"No.","Time","Source","Destination","Protocol","Length","Info"
"3","2018-05-18 09:25:58.612632","192.168.2.3","35.201.78.171","TCP","66","58607  >  443 [FIN, ACK] Seq=1 Ack=57 Win=296 Len=0 TSval=27699928 TSecr=1808581198"
"7","2018-05-18 09:25:58.680960","192.168.2.3","216.58.199.244","TCP","66","47524  >  443 [FIN, ACK] Seq=1 Ack=57 Win=262 Len=0 TSval=27699934 TSecr=2191628894"
"10","2018-05-18 09:25:59.895890","192.168.2.3","192.168.2.1","TCP","185","8009  >  59437 [PSH, ACK] Seq=1 Ack=118 Win=277 Len=119 TSval=27700056 TSecr=3033587988 [TCP segment of a reassembled PDU]"
"21","2018-05-18 09:26:04.898101","192.168.2.3","192.168.2.1","TCP","185","8009  >  59437 [PSH, ACK] Seq=120 Ack=235 Win=277 Len=119 TSval=27700556 TSecr=3033592988 [TCP segment of a reassembled PDU]"
"23","2018-05-18 09:26:06.054854","192.168.2.3","172.217.161.238","TCP","66","49570  >  443 [ACK] Seq=1 Ack=1 Win=312 Len=0 TSval=27700672 TSecr=2645808021"
"25","2018-05-18 09:26:06.771514","192.168.2.3","172.217.161.227","TCP","66","54430  >  443 [ACK] Seq=1 Ack=1 Win=583 Len=0 TSval=27700744 TSecr=3375025315"
"28","2018-05-18 09:26:09.900387","192.168.2.3","192.168.2.1","TCP","185","8009  >  59437 [PSH, ACK] Seq=239 Ack=352 Win=277 Len=119 TSval=27701056 TSecr=3033597982 [TCP segment of a reassembled PDU]"
"32","2018-05-18 09:26:12.931599","192.168.2.3","64.233.189.188","TCP","66","49614  >  5228 [ACK] Seq=1 Ack=1 Win=406 Len=0 TSval=27701360 TSecr=4032031537"
"37","2018-05-18 09:26:14.902734","192.168.2.3","192.168.2.1","TCP","185","8009  >  59437 [PSH, ACK] Seq=358 Ack=469 Win=277 Len=119 TSval=27701557 TSecr=3033602979 [TCP segment of a reassembled PDU]"
"39","2018-05-18 09:26:15.171845","192.168.2.3","172.217.161.228","TCP","66","56200  >  443 [ACK] Seq=1 Ack=1 Win=1362 Len=0 TSval=27701584 TSecr=1873726851"
"43","2018-05-18 09:26:19.964698","192.168.2.3","192.168.2.1","TCP","185","8009  >  59437 [PSH, ACK] Seq=477 Ack=586 Win=277 Len=119 TSval=27702058 TSecr=3033607949 [TCP segment of a reassembled PDU]"
"45","2018-05-18 09:26:20.612877","192.168.2.3","172.217.161.238","TCP","66","49562  >  443 [ACK] Seq=1 Ack=1 Win=430 Len=0 TSval=27702128 TSecr=1748753952"
"47","2018-05-18 09:26:21.743943","192.168.2.3","172.217.161.227","TLSv1.2","135","[TCP Previous segment not captured] , Application Data"
"48","2018-05-18 09:26:21.743948","192.168.2.3","172.217.161.227","TLSv1.2","104","Application Data"
"51","2018-05-18 09:26:21.750403","192.168.2.3","172.217.161.227","TLSv1.2","100","Application Data"
"52","2018-05-18 09:26:21.750604","192.168.2.3","172.217.161.227","TLSv1.2","104","Application Data"
"54","2018-05-18 09:26:23.015233","192.168.2.3","74.125.203.188","TCP","66","37915  >  5228 [ACK] Seq=1 Ack=1 Win=406 Len=0 TSval=27702368 TSecr=3735301327"
"56","2018-05-18 09:26:23.671987","192.168.2.3","172.217.161.238","TCP","66","49574  >  443 [ACK] Seq=1 Ack=1 Win=279 Len=0 TSval=27702434 TSecr=2953787288"
"59","2018-05-18 09:26:24.966915","192.168.2.3","192.168.2.1","TCP","185","8009  >  59437 [PSH, ACK] Seq=596 Ack=703 Win=277 Len=119 TSval=27702563 TSecr=3033612998 [TCP segment of a reassembled PDU]"
"63","2018-05-18 09:26:29.970486","192.168.2.3","192.168.2.1","AJP13","185","AJP13 Error? [TCP segment of a reassembled PDU]"
"77","2018-05-18 09:26:34.973404","192.168.2.3","192.168.2.1","TCP","185","8009  >  59437 [PSH, ACK] Seq=834 Ack=937 Win=277 Len=119 TSval=27703564 TSecr=3033622971 [TCP segment of a reassembled PDU]"
"84","2018-05-18 09:26:39.975733","192.168.2.3","192.168.2.1","TCP","185","8009  >  59437 [PSH, ACK] Seq=953 Ack=1054 Win=277 Len=119 TSval=27704064 TSecr=3033627969 [TCP segment of a reassembled PDU]"
"88","2018-05-18 09:26:44.979507","192.168.2.3","192.168.2.1","TCP","185","8009  >  59437 [PSH, ACK] Seq=1072 Ack=1171 Win=277 Len=119 TSval=27704564 TSecr=3033632967 [TCP segment of a reassembled PDU]"
"93","2018-05-18 09:26:49.985008","192.168.2.3","192.168.2.1","TCP","185","8009  >  59437 [PSH, ACK] Seq=1191 Ack=1288 Win=277 Len=119 TSval=27705065 TSecr=3033637966 [TCP segment of a reassembled PDU]"
"95","2018-05-18 09:26:51.172442","192.168.2.3","172.217.161.238","TCP","66","[TCP Dup ACK 23#1] 49570  >  443 [ACK] Seq=1 Ack=1 Win=312 Len=0 TSval=27705184 TSecr=2645853141"
"98","2018-05-18 09:26:52.818681","192.168.2.3","74.125.203.188","TCP","91","[TCP Previous segment not captured] 37915  >  5228 [PSH, ACK] Seq=2 Ack=1 Win=406 Len=25 TSval=27705348 TSecr=3735346450"
"100","2018-05-18 09:26:52.864671","192.168.2.3","74.125.203.188","TCP","66","37915  >  5228 [ACK] Seq=27 Ack=26 Win=406 Len=0 TSval=27705353 TSecr=3735376254"
"102","2018-05-18 09:26:54.988405","192.168.2.3","192.168.2.1","TCP","185","8009  >  59437 [PSH, ACK] Seq=1310 Ack=1405 Win=277 Len=119 TSval=27705565 TSecr=3033642963 [TCP segment of a reassembled PDU]"
"106","2018-05-18 09:26:56.600884","192.168.2.3","172.217.161.238","TCP","74","57231  >  80 [SYN] Seq=0 Win=14600 Len=0 MSS=1460 SACK_PERM=1 TSval=27705726 TSecr=0 WS=64"
"108","2018-05-18 09:26:56.609255","192.168.2.3","172.217.161.238","TCP","66","57231  >  80 [ACK] Seq=1 Ack=1 Win=14656 Len=0 TSval=27705727 TSecr=2645903683"
"109","2018-05-18 09:26:56.609614","192.168.2.3","172.217.161.238","HTTP","137","HEAD /generate_204 HTTP/1.1 "
"112","2018-05-18 09:26:56.618584","192.168.2.3","172.217.161.238","TCP","66","57231  >  80 [ACK] Seq=72 Ack=84 Win=14656 Len=0 TSval=27705728 TSecr=2645903693"
"113","2018-05-18 09:26:56.618875","192.168.2.3","172.217.161.238","TCP","66","57231  >  80 [FIN, ACK] Seq=72 Ack=84 Win=14656 Len=0 TSval=27705728 TSecr=2645903693"
"115","2018-05-18 09:26:56.627319","192.168.2.3","172.217.161.238","TCP","66","57231  >  80 [ACK] Seq=73 Ack=85 Win=14656 Len=0 TSval=27705729 TSecr=2645903701"
"122","2018-05-18 09:26:58.052100","192.168.2.3","64.233.189.188","TCP","66","[TCP Dup ACK 32#1] 49614  >  5228 [ACK] Seq=1 Ack=1 Win=406 Len=0 TSval=27705872 TSecr=4032076662"
"124","2018-05-18 09:26:58.611955","192.168.2.3","172.217.161.238","TLSv1.2","160","[TCP Previous segment not captured] , Application Data"
"125","2018-05-18 09:26:58.612347","192.168.2.3","172.217.161.238","TLSv1.2","104","Application Data"
"126","2018-05-18 09:26:58.612350","192.168.2.3","172.217.161.238","TLSv1.2","417","Application Data"
"131","2018-05-18 09:26:58.653667","192.168.2.3","172.217.161.238","TCP","66","49562  >  443 [ACK] Seq=485 Ack=39 Win=430 Len=0 TSval=27705932 TSecr=1748837065"
"139","2018-05-18 09:26:58.696995","192.168.2.3","172.217.161.238","TCP","66","49562  >  443 [ACK] Seq=485 Ack=107 Win=430 Len=0 TSval=27705936 TSecr=1748837141"
"140","2018-05-18 09:26:58.697433","192.168.2.3","172.217.161.238","TCP","66","49562  >  443 [ACK] Seq=485 Ack=516 Win=446 Len=0 TSval=27705936 TSecr=1748837141"
"141","2018-05-18 09:26:58.697613","192.168.2.3","172.217.161.238","TCP","66","49562  >  443 [ACK] Seq=485 Ack=554 Win=446 Len=0 TSval=27705936 TSecr=1748837141"
"142","2018-05-18 09:26:58.699264","192.168.2.3","172.217.161.238","TLSv1.2","104","Application Data"
"148","2018-05-18 09:26:59.991219","192.168.2.3","192.168.2.1","TCP","185","8009  >  59437 [PSH, ACK] Seq=1429 Ack=1522 Win=277 Len=119 TSval=27706065 TSecr=3033647962 [TCP segment of a reassembled PDU]"
"151","2018-05-18 09:27:00.292170","192.168.2.3","172.217.161.228","TCP","66","[TCP Dup ACK 39#1] 56200  >  443 [ACK] Seq=1 Ack=1 Win=1362 Len=0 TSval=27706096 TSecr=1873771883"
"155","2018-05-18 09:27:04.993142","192.168.2.3","192.168.2.1","TCP","185","8009  >  59437 [PSH, ACK] Seq=1548 Ack=1639 Win=277 Len=119 TSval=27706566 TSecr=3033652957 [TCP segment of a reassembled PDU]"
"159","2018-05-18 09:27:05.659580","192.168.2.3","172.217.161.238","TCP","66","[TCP Previous segment not captured] 49570  >  443 [FIN, ACK] Seq=2 Ack=57 Win=312 Len=0 TSval=27706632 TSecr=2645912724"
"161","2018-05-18 09:27:06.772617","192.168.2.3","172.217.161.227","TCP","66","[TCP Keep-Alive] 54430  >  443 [ACK] Seq=180 Ack=96 Win=583 Len=0 TSval=27706744 TSecr=3375085327"
"164","2018-05-18 09:27:08.782506","192.168.2.3","172.217.161.238","TCP","66","[TCP Dup ACK 56#1] 49574  >  443 [ACK] Seq=1 Ack=1 Win=279 Len=0 TSval=27706944 TSecr=2953832281"
"167","2018-05-18 09:27:10.040347","192.168.2.3","192.168.2.1","TCP","185","8009  >  59437 [PSH, ACK] Seq=1667 Ack=1756 Win=277 Len=119 TSval=27707070 TSecr=3033657934 [TCP segment of a reassembled PDU]"
"171","2018-05-18 09:27:15.044865","192.168.2.3","192.168.2.1","TCP","185","8009  >  59437 [PSH, ACK] Seq=1786 Ack=1873 Win=277 Len=119 TSval=27707571 TSecr=3033662976 [TCP segment of a reassembled PDU]"
"174","2018-05-18 09:27:20.047316","192.168.2.3","192.168.2.1","TCP","185","8009  >  59437 [PSH, ACK] Seq=1905 Ack=1990 Win=277 Len=119 TSval=27708071 TSecr=3033667963 [TCP segment of a reassembled PDU]"
"176","2018-05-18 09:27:21.753351","192.168.2.3","172.217.161.227","TLSv1.2","135","Application Data"
"177","2018-05-18 09:27:21.753558","192.168.2.3","172.217.161.227","TLSv1.2","104","Application Data"
"180","2018-05-18 09:27:21.761976","192.168.2.3","172.217.161.227","TLSv1.2","100","Application Data"
"181","2018-05-18 09:27:21.761979","192.168.2.3","172.217.161.227","TLSv1.2","104","Application Data"
"183","2018-05-18 09:27:21.792395","192.168.2.3","172.217.161.227","TCP","66","54430  >  443 [ACK] Seq=360 Ack=212 Win=583 Len=0 TSval=27708246 TSecr=3375145325"
"185","2018-05-18 09:27:25.050382","192.168.2.3","192.168.2.1","TCP","185","8009  >  59437 [PSH, ACK] Seq=2024 Ack=2107 Win=277 Len=119 TSval=27708571 TSecr=3033672961 [TCP segment of a reassembled PDU]"
"190","2018-05-18 09:27:30.052516","192.168.2.3","192.168.2.1","TCP","185","8009  >  59437 [PSH, ACK] Seq=2143 Ack=2224 Win=277 Len=119 TSval=27709072 TSecr=3033677961 [TCP segment of a reassembled PDU]"
"193","2018-05-18 09:27:35.055092","192.168.2.3","192.168.2.1","TCP","185","8009  >  59437 [PSH, ACK] Seq=2262 Ack=2341 Win=277 Len=119 TSval=27709572 TSecr=3033682959 [TCP segment of a reassembled PDU]"
"195","2018-05-18 09:27:37.893171","192.168.2.3","74.125.203.188","TCP","66","[TCP Keep-Alive] 37915  >  5228 [ACK] Seq=26 Ack=26 Win=406 Len=0 TSval=27709856 TSecr=3735376254"
"198","2018-05-18 09:27:40.062205","192.168.2.3","192.168.2.1","TCP","185","8009  >  59437 [PSH, ACK] Seq=2381 Ack=2458 Win=277 Len=119 TSval=27710072 TSecr=3033687947 [TCP segment of a reassembled PDU]"
"204","2018-05-18 09:27:43.172703","192.168.2.3","64.233.189.188","TCP","66","[TCP Dup ACK 32#2] 49614  >  5228 [ACK] Seq=1 Ack=1 Win=406 Len=0 TSval=27710384 TSecr=4032121778"
"206","2018-05-18 09:27:43.812665","192.168.2.3","172.217.161.238","TCP","66","[TCP Keep-Alive] 49562  >  443 [ACK] Seq=522 Ack=554 Win=446 Len=0 TSval=27710448 TSecr=1748837152"
"209","2018-05-18 09:27:45.065485","192.168.2.3","192.168.2.1","TCP","185","8009  >  59437 [PSH, ACK] Seq=2500 Ack=2575 Win=277 Len=119 TSval=27710573 TSecr=3033692952 [TCP segment of a reassembled PDU]"
"211","2018-05-18 09:27:45.412909","192.168.2.3","172.217.161.228","TCP","66","[TCP Dup ACK 39#2] 56200  >  443 [ACK] Seq=1 Ack=1 Win=1362 Len=0 TSval=27710608 TSecr=1873816999"
"216","2018-05-18 09:27:50.067413","192.168.2.3","192.168.2.1","TCP","185","8009  >  59437 [PSH, ACK] Seq=2619 Ack=2692 Win=277 Len=119 TSval=27711073 TSecr=3033697944 [TCP segment of a reassembled PDU]"
"218","2018-05-18 09:27:53.892830","192.168.2.3","172.217.161.238","TCP","66","[TCP Dup ACK 56#2] 49574  >  443 [ACK] Seq=1 Ack=1 Win=279 Len=0 TSval=27711456 TSecr=2953877388"
"221","2018-05-18 09:27:55.072240","192.168.2.3","192.168.2.1","TCP","185","8009  >  59437 [PSH, ACK] Seq=2738 Ack=2809 Win=277 Len=119 TSval=27711573 TSecr=3033702941 [TCP segment of a reassembled PDU]"
"225","2018-05-18 09:27:59.422421","192.168.2.3","172.217.161.238","TCP","74","57232  >  80 [SYN] Seq=0 Win=14600 Len=0 MSS=1460 SACK_PERM=1 TSval=27712008 TSecr=0 WS=64"
"227","2018-05-18 09:27:59.428572","192.168.2.3","172.217.161.238","TCP","66","57232  >  80 [ACK] Seq=1 Ack=1 Win=14656 Len=0 TSval=27712009 TSecr=2787481091"
"228","2018-05-18 09:27:59.428947","192.168.2.3","172.217.161.238","HTTP","137","HEAD /generate_204 HTTP/1.1 "
"231","2018-05-18 09:27:59.436435","192.168.2.3","172.217.161.238","TCP","66","57232  >  80 [ACK] Seq=72 Ack=84 Win=14656 Len=0 TSval=27712010 TSecr=2787481098"
"232","2018-05-18 09:27:59.436865","192.168.2.3","172.217.161.238","TCP","66","57232  >  80 [FIN, ACK] Seq=72 Ack=84 Win=14656 Len=0 TSval=27712010 TSecr=2787481098"
"234","2018-05-18 09:27:59.446254","192.168.2.3","172.217.161.238","TCP","66","57232  >  80 [ACK] Seq=73 Ack=85 Win=14656 Len=0 TSval=27712011 TSecr=2787481105"
"238","2018-05-18 09:28:00.079961","192.168.2.3","192.168.2.1","TCP","185","8009  >  59437 [PSH, ACK] Seq=2857 Ack=2926 Win=277 Len=119 TSval=27712074 TSecr=3033707939 [TCP segment of a reassembled PDU]"
"251","2018-05-18 09:28:05.082727","192.168.2.3","192.168.2.1","TCP","185","8009  >  59437 [PSH, ACK] Seq=2976 Ack=3043 Win=277 Len=119 TSval=27712574 TSecr=3033712942 [TCP segment of a reassembled PDU]"
"253","2018-05-18 09:28:06.774820","192.168.2.3","172.217.161.227","TCP","66","[TCP Keep-Alive] 54430  >  443 [ACK] Seq=359 Ack=212 Win=583 Len=0 TSval=27712744 TSecr=3375145325"
"256","2018-05-18 09:28:10.086090","192.168.2.3","192.168.2.1","TCP","185","8009  >  59437 [PSH, ACK] Seq=3095 Ack=3160 Win=277 Len=119 TSval=27713075 TSecr=3033717937 [TCP segment of a reassembled PDU]"
"260","2018-05-18 09:28:15.088333","192.168.2.3","192.168.2.1","TCP","185","8009  >  59437 [PSH, ACK] Seq=3214 Ack=3277 Win=277 Len=119 TSval=27713575 TSecr=3033722939 [TCP segment of a reassembled PDU]"
"265","2018-05-18 09:28:20.090884","192.168.2.3","192.168.2.1","TCP","185","8009  >  59437 [PSH, ACK] Seq=3333 Ack=3394 Win=277 Len=119 TSval=27714075 TSecr=3033727937 [TCP segment of a reassembled PDU]"
"268","2018-05-18 09:28:21.764032","192.168.2.3","172.217.161.227","TLSv1.2","135","Application Data"
"269","2018-05-18 09:28:21.764221","192.168.2.3","172.217.161.227","TLSv1.2","104","Application Data"
"272","2018-05-18 09:28:21.769679","192.168.2.3","172.217.161.227","TCP","66","54430  >  443 [ACK] Seq=467 Ack=290 Win=583 Len=0 TSval=27714243 TSecr=3375205330"
"273","2018-05-18 09:28:21.769682","192.168.2.3","172.217.161.227","TCP","66","54430  >  443 [ACK] Seq=467 Ack=328 Win=583 Len=0 TSval=27714243 TSecr=3375205330"
"274","2018-05-18 09:28:21.773062","192.168.2.3","172.217.161.227","TLSv1.2","100","Application Data"
"275","2018-05-18 09:28:21.773064","192.168.2.3","172.217.161.227","TLSv1.2","104","Application Data"
"277","2018-05-18 09:28:23.014902","192.168.2.3","74.125.203.188","TCP","66","[TCP Keep-Alive] 37915  >  5228 [ACK] Seq=26 Ack=26 Win=406 Len=0 TSval=27714368 TSecr=3735421328"
"281","2018-05-18 09:28:25.102039","192.168.2.3","192.168.2.1","TCP","185","8009  >  59437 [PSH, ACK] Seq=3452 Ack=3511 Win=277 Len=119 TSval=27714576 TSecr=3033732933 [TCP segment of a reassembled PDU]"
"283","2018-05-18 09:28:28.293394","192.168.2.3","64.233.189.188","TCP","66","[TCP Dup ACK 32#3] 49614  >  5228 [ACK] Seq=1 Ack=1 Win=406 Len=0 TSval=27714896 TSecr=4032166898"
"285","2018-05-18 09:28:28.937067","192.168.2.3","172.217.161.238","TCP","66","[TCP Keep-Alive] 49562  >  443 [ACK] Seq=522 Ack=554 Win=446 Len=0 TSval=27714960 TSecr=1748882261"
"288","2018-05-18 09:28:30.105046","192.168.2.3","192.168.2.1","TCP","185","8009  >  59437 [PSH, ACK] Seq=3571 Ack=3628 Win=277 Len=119 TSval=27715077 TSecr=3033737943 [TCP segment of a reassembled PDU]"
"290","2018-05-18 09:28:30.533320","192.168.2.3","172.217.161.228","TCP","66","[TCP Dup ACK 39#3] 56200  >  443 [ACK] Seq=1 Ack=1 Win=1362 Len=0 TSval=27715120 TSecr=1873862116"
"294","2018-05-18 09:28:35.109649","192.168.2.3","192.168.2.1","TCP","185","8009  >  59437 [PSH, ACK] Seq=3690 Ack=3745 Win=277 Len=119 TSval=27715577 TSecr=3033742942 [TCP segment of a reassembled PDU]"
"296","2018-05-18 09:28:39.013493","192.168.2.3","172.217.161.238","TCP","66","[TCP Dup ACK 56#3] 49574  >  443 [ACK] Seq=1 Ack=1 Win=279 Len=0 TSval=27715968 TSecr=2953922494"
"299","2018-05-18 09:28:40.118587","192.168.2.3","192.168.2.1","TCP","185","8009  >  59437 [PSH, ACK] Seq=3809 Ack=3862 Win=277 Len=119 TSval=27716078 TSecr=3033747945 [TCP segment of a reassembled PDU]"
"304","2018-05-18 09:28:45.084264","192.168.2.3","172.217.161.228","TCP","66","[TCP Previous segment not captured] 56200  >  443 [FIN, ACK] Seq=2 Ack=56 Win=1362 Len=0 TSval=27716574 TSecr=1873921771"
"305","2018-05-18 09:28:45.087756","192.168.2.3","172.217.161.228","TCP","66","56200  >  443 [ACK] Seq=3 Ack=57 Win=1362 Len=0 TSval=27716575 TSecr=1873921771"
"308","2018-05-18 09:28:45.121889","192.168.2.3","192.168.2.1","TCP","185","8009  >  59437 [PSH, ACK] Seq=3928 Ack=3979 Win=277 Len=119 TSval=27716578 TSecr=3033752924 [TCP segment of a reassembled PDU]"
"311","2018-05-18 09:28:50.144524","192.168.2.3","192.168.2.1","TCP","185","8009  >  59437 [PSH, ACK] Seq=4047 Ack=4096 Win=277 Len=119 TSval=27717079 TSecr=3033757924 [TCP segment of a reassembled PDU]"
"314","2018-05-18 09:28:52.867818","192.168.2.3","74.125.203.188","TCP","91","37915  >  5228 [PSH, ACK] Seq=27 Ack=26 Win=406 Len=25 TSval=27717353 TSecr=3735466450"
"316","2018-05-18 09:28:52.919270","192.168.2.3","74.125.203.188","TCP","66","37915  >  5228 [ACK] Seq=52 Ack=51 Win=406 Len=0 TSval=27717358 TSecr=3735496303"
"318","2018-05-18 09:28:55.147544","192.168.2.3","192.168.2.1","TCP","185","8009  >  59437 [PSH, ACK] Seq=4166 Ack=4213 Win=277 Len=119 TSval=27717581 TSecr=3033762945 [TCP segment of a reassembled PDU]"
"321","2018-05-18 09:29:00.149395","192.168.2.3","192.168.2.1","TCP","185","8009  >  59437 [PSH, ACK] Seq=4285 Ack=4330 Win=277 Len=119 TSval=27718081 TSecr=3033767942 [TCP segment of a reassembled PDU]"
"326","2018-05-18 09:29:02.222600","192.168.2.3","172.217.161.238","TCP","74","57233  >  80 [SYN] Seq=0 Win=14600 Len=0 MSS=1460 SACK_PERM=1 TSval=27718288 TSecr=0 WS=64"
"328","2018-05-18 09:29:02.229311","192.168.2.3","172.217.161.238","TCP","66","57233  >  80 [ACK] Seq=1 Ack=1 Win=14656 Len=0 TSval=27718289 TSecr=879655531"
"329","2018-05-18 09:29:02.229313","192.168.2.3","172.217.161.238","HTTP","137","HEAD /generate_204 HTTP/1.1 "
"332","2018-05-18 09:29:02.238047","192.168.2.3","172.217.161.238","TCP","66","57233  >  80 [ACK] Seq=72 Ack=84 Win=14656 Len=0 TSval=27718290 TSecr=879655539"
"333","2018-05-18 09:29:02.238355","192.168.2.3","172.217.161.238","TCP","66","57233  >  80 [FIN, ACK] Seq=72 Ack=84 Win=14656 Len=0 TSval=27718290 TSecr=879655539"
"335","2018-05-18 09:29:02.259095","192.168.2.3","172.217.161.238","TCP","66","57233  >  80 [ACK] Seq=73 Ack=85 Win=14656 Len=0 TSval=27718291 TSecr=879655546"
