"No.","Time","Source","Destination","Protocol","Length","Info"
"1","2018-05-14 14:41:09.831906","192.168.2.2","17.253.75.208","TCP","66","60378  >  80 [ACK] Seq=1 Ack=1 Win=1957 Len=0 TSval=1278889006 TSecr=1222761890"
"2","2018-05-14 14:41:09.831911","192.168.2.2","17.253.75.208","TCP","66","60378  >  80 [ACK] Seq=1 Ack=11585 Win=1776 Len=0 TSval=1278889006 TSecr=1222761894"
"3","2018-05-14 14:41:09.835327","192.168.2.2","17.253.75.208","TCP","66","60378  >  80 [ACK] Seq=1 Ack=23169 Win=2025 Len=0 TSval=1278889009 TSecr=1222761895"
"4","2018-05-14 14:41:09.835332","192.168.2.2","17.253.75.208","TCP","66","60378  >  80 [ACK] Seq=1 Ack=34753 Win=2025 Len=0 TSval=1278889009 TSecr=1222761897"
"14","2018-05-14 14:41:09.837740","192.168.2.2","17.253.75.208","TCP","66","60378  >  80 [ACK] Seq=1 Ack=46337 Win=1957 Len=0 TSval=1278889010 TSecr=1222761902"
"43","2018-05-14 14:41:09.845408","192.168.2.2","17.253.75.208","TCP","66","60378  >  80 [ACK] Seq=1 Ack=57921 Win=2002 Len=0 TSval=1278889019 TSecr=1222761903"
"44","2018-05-14 14:41:09.845410","192.168.2.2","17.253.75.208","TCP","66","60378  >  80 [ACK] Seq=1 Ack=69505 Win=2025 Len=0 TSval=1278889019 TSecr=1222761943"
"51","2018-05-14 14:41:09.846996","192.168.2.2","17.253.75.208","TCP","66","60378  >  80 [ACK] Seq=1 Ack=81089 Win=2025 Len=0 TSval=1278889020 TSecr=1222761945"
"52","2018-05-14 14:41:09.847011","192.168.2.2","17.253.75.208","TCP","66","60378  >  80 [ACK] Seq=1 Ack=86881 Win=2002 Len=0 TSval=1278889021 TSecr=1222761947"
"53","2018-05-14 14:41:09.847012","192.168.2.2","17.253.75.208","TCP","66","60378  >  80 [ACK] Seq=1 Ack=89777 Win=1957 Len=0 TSval=1278889021 TSecr=1222761948"
"54","2018-05-14 14:41:09.847013","192.168.2.2","17.253.75.208","TCP","66","60378  >  80 [ACK] Seq=1 Ack=92673 Win=1912 Len=0 TSval=1278889021 TSecr=1222761949"
"55","2018-05-14 14:41:09.847013","192.168.2.2","17.253.75.208","TCP","66","60378  >  80 [ACK] Seq=1 Ack=95569 Win=1867 Len=0 TSval=1278889021 TSecr=1222761949"
"65","2018-05-14 14:41:09.851168","192.168.2.2","17.253.75.208","TCP","66","[TCP Window Update] 60378  >  80 [ACK] Seq=1 Ack=95569 Win=2048 Len=0 TSval=1278889021 TSecr=1222761949"
"66","2018-05-14 14:41:09.851170","192.168.2.2","17.253.75.208","TCP","66","60378  >  80 [ACK] Seq=1 Ack=107153 Win=2002 Len=0 TSval=1278889022 TSecr=1222761950"
"101","2018-05-14 14:41:09.860689","192.168.2.2","17.253.75.208","TCP","66","60378  >  80 [ACK] Seq=1 Ack=118737 Win=1912 Len=0 TSval=1278889033 TSecr=1222761952"
"102","2018-05-14 14:41:09.864931","192.168.2.2","17.253.75.208","TCP","66","60378  >  80 [ACK] Seq=1 Ack=130321 Win=2025 Len=0 TSval=1278889034 TSecr=1222761956"
"103","2018-05-14 14:41:09.864934","192.168.2.2","17.253.75.208","TCP","66","60378  >  80 [ACK] Seq=1 Ack=141905 Win=1934 Len=0 TSval=1278889035 TSecr=1222761958"
"104","2018-05-14 14:41:09.866263","192.168.2.2","17.253.75.208","TCP","66","60378  >  80 [ACK] Seq=1 Ack=153489 Win=2025 Len=0 TSval=1278889035 TSecr=1222761960"
"105","2018-05-14 14:41:09.866264","192.168.2.2","17.253.75.208","TCP","66","60378  >  80 [ACK] Seq=1 Ack=165073 Win=2025 Len=0 TSval=1278889036 TSecr=1222761962"
"113","2018-05-14 14:41:09.869954","192.168.2.2","17.253.75.208","TCP","66","60378  >  80 [ACK] Seq=1 Ack=176657 Win=2025 Len=0 TSval=1278889040 TSecr=1222761964"
"138","2018-05-14 14:41:09.875002","192.168.2.2","17.253.75.208","TCP","66","60378  >  80 [ACK] Seq=1 Ack=188241 Win=2002 Len=0 TSval=1278889043 TSecr=1222761972"
"147","2018-05-14 14:41:09.877525","192.168.2.2","17.253.75.208","TCP","66","60378  >  80 [ACK] Seq=1 Ack=199825 Win=1957 Len=0 TSval=1278889047 TSecr=1222761977"
"148","2018-05-14 14:41:09.877527","192.168.2.2","17.253.75.208","TCP","66","60378  >  80 [ACK] Seq=1 Ack=211409 Win=1934 Len=0 TSval=1278889048 TSecr=1222761979"
"157","2018-05-14 14:41:09.879858","192.168.2.2","17.253.75.208","TCP","66","60378  >  80 [ACK] Seq=1 Ack=222993 Win=1957 Len=0 TSval=1278889049 TSecr=1222761981"
"162","2018-05-14 14:41:09.880683","192.168.2.2","17.253.75.208","TCP","66","60378  >  80 [ACK] Seq=1 Ack=234577 Win=1957 Len=0 TSval=1278889050 TSecr=1222761983"
"177","2018-05-14 14:41:09.882992","192.168.2.2","17.253.75.208","TCP","66","60378  >  80 [ACK] Seq=1 Ack=246161 Win=1957 Len=0 TSval=1278889051 TSecr=1222761985"
"190","2018-05-14 14:41:09.884985","192.168.2.2","17.253.75.208","TCP","66","60378  >  80 [ACK] Seq=1 Ack=257745 Win=2025 Len=0 TSval=1278889053 TSecr=1222761987"
"191","2018-05-14 14:41:09.884987","192.168.2.2","17.253.75.208","TCP","66","60378  >  80 [ACK] Seq=1 Ack=269329 Win=2002 Len=0 TSval=1278889053 TSecr=1222761988"
"204","2018-05-14 14:41:09.887675","192.168.2.2","17.253.75.208","TCP","66","60378  >  80 [ACK] Seq=1 Ack=280913 Win=2002 Len=0 TSval=1278889055 TSecr=1222761989"
"229","2018-05-14 14:41:09.891060","192.168.2.2","17.253.75.208","TCP","66","60378  >  80 [ACK] Seq=1 Ack=292497 Win=1980 Len=0 TSval=1278889056 TSecr=1222761990"
"230","2018-05-14 14:41:09.892999","192.168.2.2","17.253.75.208","TCP","66","60378  >  80 [ACK] Seq=1 Ack=304081 Win=2002 Len=0 TSval=1278889060 TSecr=1222761992"
"231","2018-05-14 14:41:09.893001","192.168.2.2","17.253.75.208","TCP","66","60378  >  80 [ACK] Seq=1 Ack=315665 Win=2025 Len=0 TSval=1278889060 TSecr=1222761994"
"240","2018-05-14 14:41:09.894257","192.168.2.2","17.253.75.208","TCP","66","60378  >  80 [ACK] Seq=1 Ack=327249 Win=2025 Len=0 TSval=1278889062 TSecr=1222761995"
"241","2018-05-14 14:41:09.895800","192.168.2.2","17.253.75.208","TCP","66","60378  >  80 [ACK] Seq=1 Ack=338833 Win=2002 Len=0 TSval=1278889063 TSecr=1222761996"
"250","2018-05-14 14:41:09.897634","192.168.2.2","17.253.75.208","TCP","66","60378  >  80 [ACK] Seq=1 Ack=350417 Win=2002 Len=0 TSval=1278889064 TSecr=1222761998"
"263","2018-05-14 14:41:09.899858","192.168.2.2","17.253.75.208","TCP","66","60378  >  80 [ACK] Seq=1 Ack=362001 Win=2002 Len=0 TSval=1278889065 TSecr=1222762002"
"281","2018-05-14 14:41:09.902367","192.168.2.2","17.253.75.208","TCP","66","60378  >  80 [ACK] Seq=1 Ack=373585 Win=2002 Len=0 TSval=1278889067 TSecr=1222762003"
"300","2018-05-14 14:41:09.906141","192.168.2.2","17.253.75.208","TCP","66","60378  >  80 [ACK] Seq=1 Ack=385169 Win=1980 Len=0 TSval=1278889068 TSecr=1222762004"
"306","2018-05-14 14:41:09.908411","192.168.2.2","17.253.75.208","TCP","66","60378  >  80 [ACK] Seq=1 Ack=396753 Win=1934 Len=0 TSval=1278889072 TSecr=1222762005"
"307","2018-05-14 14:41:09.908413","192.168.2.2","17.253.75.208","TCP","66","60378  >  80 [ACK] Seq=1 Ack=408337 Win=1980 Len=0 TSval=1278889073 TSecr=1222762006"
"319","2018-05-14 14:41:09.912038","192.168.2.2","17.253.75.208","TCP","66","60378  >  80 [ACK] Seq=1 Ack=419921 Win=2002 Len=0 TSval=1278889075 TSecr=1222762008"
"320","2018-05-14 14:41:09.912040","192.168.2.2","17.253.75.208","TCP","66","60378  >  80 [ACK] Seq=1 Ack=431505 Win=1821 Len=0 TSval=1278889075 TSecr=1222762010"
"333","2018-05-14 14:41:09.913788","192.168.2.2","17.253.75.208","TCP","66","60378  >  80 [ACK] Seq=1 Ack=443089 Win=1957 Len=0 TSval=1278889077 TSecr=1222762013"
"338","2018-05-14 14:41:09.916373","192.168.2.2","17.253.75.208","TCP","66","60378  >  80 [ACK] Seq=1 Ack=454673 Win=2025 Len=0 TSval=1278889078 TSecr=1222762017"
"339","2018-05-14 14:41:09.916586","192.168.2.2","17.253.75.208","TCP","66","60378  >  80 [ACK] Seq=1 Ack=466257 Win=2025 Len=0 TSval=1278889079 TSecr=1222762019"
"364","2018-05-14 14:41:09.919520","192.168.2.2","17.253.75.208","TCP","66","60378  >  80 [ACK] Seq=1 Ack=477841 Win=2025 Len=0 TSval=1278889081 TSecr=1222762020"
"365","2018-05-14 14:41:09.919729","192.168.2.2","17.253.75.208","TCP","66","60378  >  80 [ACK] Seq=1 Ack=489425 Win=1957 Len=0 TSval=1278889082 TSecr=1222762022"
"374","2018-05-14 14:41:09.922685","192.168.2.2","17.253.75.208","TCP","66","60378  >  80 [ACK] Seq=1 Ack=501009 Win=1980 Len=0 TSval=1278889083 TSecr=1222762023"
"375","2018-05-14 14:41:09.922688","192.168.2.2","17.253.75.208","TCP","66","60378  >  80 [ACK] Seq=1 Ack=508249 Win=1980 Len=0 TSval=1278889083 TSecr=1222762024"
"376","2018-05-14 14:41:09.922689","192.168.2.2","17.253.75.208","TCP","66","[TCP Window Update] 60378  >  80 [ACK] Seq=1 Ack=508249 Win=2048 Len=0 TSval=1278889083 TSecr=1222762024"
"395","2018-05-14 14:41:09.924947","192.168.2.2","17.253.75.208","TCP","66","60378  >  80 [ACK] Seq=1 Ack=519833 Win=2025 Len=0 TSval=1278889085 TSecr=1222762027"
"425","2018-05-14 14:41:09.938177","192.168.2.2","17.253.75.208","TCP","66","60378  >  80 [ACK] Seq=1 Ack=531417 Win=2025 Len=0 TSval=1278889086 TSecr=1222762028"
"426","2018-05-14 14:41:09.938180","192.168.2.2","17.253.75.208","TCP","66","60378  >  80 [ACK] Seq=1 Ack=543001 Win=2025 Len=0 TSval=1278889094 TSecr=1222762030"
"427","2018-05-14 14:41:09.941899","192.168.2.2","17.253.75.208","TCP","66","60378  >  80 [ACK] Seq=1 Ack=554585 Win=2025 Len=0 TSval=1278889095 TSecr=1222762030"
"428","2018-05-14 14:41:09.941903","192.168.2.2","17.253.75.208","TCP","66","60378  >  80 [ACK] Seq=1 Ack=566169 Win=2025 Len=0 TSval=1278889095 TSecr=1222762033"
"429","2018-05-14 14:41:09.941904","192.168.2.2","17.253.75.208","TCP","66","60378  >  80 [ACK] Seq=1 Ack=577753 Win=2002 Len=0 TSval=1278889096 TSecr=1222762033"
"454","2018-05-14 14:41:09.946550","192.168.2.2","17.253.75.208","TCP","66","60378  >  80 [ACK] Seq=1 Ack=589337 Win=2025 Len=0 TSval=1278889105 TSecr=1222762035"
"455","2018-05-14 14:41:09.946552","192.168.2.2","17.253.75.208","TCP","66","60378  >  80 [ACK] Seq=1 Ack=600921 Win=1980 Len=0 TSval=1278889105 TSecr=1222762049"
"488","2018-05-14 14:41:09.958521","192.168.2.2","17.253.75.208","TCP","66","60378  >  80 [ACK] Seq=1 Ack=612505 Win=2025 Len=0 TSval=1278889115 TSecr=1222762049"
"489","2018-05-14 14:41:09.958525","192.168.2.2","17.253.75.208","TCP","66","60378  >  80 [ACK] Seq=1 Ack=624089 Win=2002 Len=0 TSval=1278889115 TSecr=1222762052"
"490","2018-05-14 14:41:09.960757","192.168.2.2","17.253.75.208","TCP","66","60378  >  80 [ACK] Seq=1 Ack=635673 Win=2002 Len=0 TSval=1278889116 TSecr=1222762053"
"491","2018-05-14 14:41:09.960759","192.168.2.2","17.253.75.208","TCP","66","60378  >  80 [ACK] Seq=1 Ack=647257 Win=2025 Len=0 TSval=1278889116 TSecr=1222762054"
"492","2018-05-14 14:41:09.962028","192.168.2.2","17.253.75.208","TCP","66","60378  >  80 [ACK] Seq=1 Ack=658841 Win=2025 Len=0 TSval=1278889121 TSecr=1222762057"
"493","2018-05-14 14:41:09.962029","192.168.2.2","17.253.75.208","TCP","66","60378  >  80 [ACK] Seq=1 Ack=661737 Win=2002 Len=0 TSval=1278889121 TSecr=1222762058"
"494","2018-05-14 14:41:09.962138","192.168.2.2","17.253.75.208","TCP","66","60378  >  80 [ACK] Seq=1 Ack=663185 Win=2025 Len=0 TSval=1278889121 TSecr=1222762058"
"495","2018-05-14 14:41:09.962263","192.168.2.2","17.253.75.208","TCP","66","60378  >  80 [ACK] Seq=1 Ack=664633 Win=2048 Len=0 TSval=1278889121 TSecr=1222762058"
"496","2018-05-14 14:41:09.962360","192.168.2.2","17.253.75.208","TCP","66","60378  >  80 [ACK] Seq=1 Ack=667529 Win=2002 Len=0 TSval=1278889121 TSecr=1222762059"
"497","2018-05-14 14:41:09.962362","192.168.2.2","17.253.75.208","TCP","66","60378  >  80 [ACK] Seq=1 Ack=668977 Win=2048 Len=0 TSval=1278889121 TSecr=1222762059"
"516","2018-05-14 14:41:09.965834","192.168.2.2","17.253.75.208","TCP","66","60378  >  80 [ACK] Seq=1 Ack=680561 Win=2002 Len=0 TSval=1278889124 TSecr=1222762069"
"529","2018-05-14 14:41:09.967792","192.168.2.2","17.253.75.208","TCP","66","60378  >  80 [ACK] Seq=1 Ack=692145 Win=2025 Len=0 TSval=1278889126 TSecr=1222762069"
"536","2018-05-14 14:41:09.968766","192.168.2.2","17.253.75.208","TCP","66","60378  >  80 [ACK] Seq=1 Ack=703729 Win=2002 Len=0 TSval=1278889127 TSecr=1222762070"
"550","2018-05-14 14:41:09.971067","192.168.2.2","17.253.75.208","TCP","66","60378  >  80 [ACK] Seq=1 Ack=715313 Win=2002 Len=0 TSval=1278889128 TSecr=1222762072"
"557","2018-05-14 14:41:09.972226","192.168.2.2","17.253.75.208","TCP","66","60378  >  80 [ACK] Seq=1 Ack=726897 Win=1957 Len=0 TSval=1278889129 TSecr=1222762073"
"558","2018-05-14 14:41:09.973225","192.168.2.2","17.253.75.208","TCP","66","60378  >  80 [ACK] Seq=1 Ack=738481 Win=2025 Len=0 TSval=1278889131 TSecr=1222762074"
"601","2018-05-14 14:41:09.979916","192.168.2.2","17.253.75.208","TCP","66","60378  >  80 [ACK] Seq=1 Ack=750065 Win=2025 Len=0 TSval=1278889136 TSecr=1222762076"
"602","2018-05-14 14:41:09.979918","192.168.2.2","17.253.75.208","TCP","66","60378  >  80 [ACK] Seq=1 Ack=761649 Win=1980 Len=0 TSval=1278889137 TSecr=1222762079"
"603","2018-05-14 14:41:09.981675","192.168.2.2","17.253.75.208","TCP","66","60378  >  80 [ACK] Seq=1 Ack=773233 Win=1912 Len=0 TSval=1278889137 TSecr=1222762080"
"604","2018-05-14 14:41:09.981677","192.168.2.2","17.253.75.208","TCP","66","60378  >  80 [ACK] Seq=1 Ack=784817 Win=2002 Len=0 TSval=1278889138 TSecr=1222762080"
"605","2018-05-14 14:41:09.984454","192.168.2.2","17.253.75.208","TCP","66","60378  >  80 [ACK] Seq=1 Ack=796401 Win=2002 Len=0 TSval=1278889139 TSecr=1222762081"
"606","2018-05-14 14:41:09.984455","192.168.2.2","17.253.75.208","TCP","66","60378  >  80 [ACK] Seq=1 Ack=807985 Win=2002 Len=0 TSval=1278889140 TSecr=1222762083"
"636","2018-05-14 14:41:09.987598","192.168.2.2","17.253.75.208","TCP","66","60378  >  80 [ACK] Seq=1 Ack=819569 Win=1889 Len=0 TSval=1278889144 TSecr=1222762084"
"637","2018-05-14 14:41:09.989186","192.168.2.2","17.253.75.208","TCP","66","60378  >  80 [ACK] Seq=1 Ack=831153 Win=1934 Len=0 TSval=1278889145 TSecr=1222762090"
"638","2018-05-14 14:41:09.989187","192.168.2.2","17.253.75.208","TCP","66","60378  >  80 [ACK] Seq=1 Ack=842737 Win=1889 Len=0 TSval=1278889146 TSecr=1222762091"
"663","2018-05-14 14:41:09.993451","192.168.2.2","17.253.75.208","TCP","66","60378  >  80 [ACK] Seq=1 Ack=854321 Win=2002 Len=0 TSval=1278889147 TSecr=1222762092"
"681","2018-05-14 14:41:09.995380","192.168.2.2","17.253.75.208","TCP","66","60378  >  80 [ACK] Seq=1 Ack=865905 Win=2025 Len=0 TSval=1278889150 TSecr=1222762095"
"682","2018-05-14 14:41:09.995382","192.168.2.2","17.253.75.208","TCP","66","60378  >  80 [ACK] Seq=1 Ack=877489 Win=1980 Len=0 TSval=1278889151 TSecr=1222762096"
"683","2018-05-14 14:41:09.997487","192.168.2.2","17.253.75.208","TCP","66","60378  >  80 [ACK] Seq=1 Ack=889073 Win=2002 Len=0 TSval=1278889152 TSecr=1222762098"
"684","2018-05-14 14:41:09.997488","192.168.2.2","17.253.75.208","TCP","66","60378  >  80 [ACK] Seq=1 Ack=900657 Win=2002 Len=0 TSval=1278889153 TSecr=1222762100"
"693","2018-05-14 14:41:09.999429","192.168.2.2","17.253.75.208","TCP","66","60378  >  80 [ACK] Seq=1 Ack=912241 Win=2025 Len=0 TSval=1278889155 TSecr=1222762100"
"728","2018-05-14 14:41:10.002575","192.168.2.2","17.253.75.208","TCP","66","60378  >  80 [ACK] Seq=1 Ack=923825 Win=2025 Len=0 TSval=1278889156 TSecr=1222762104"
"729","2018-05-14 14:41:10.002576","192.168.2.2","17.253.75.208","TCP","66","60378  >  80 [ACK] Seq=1 Ack=935409 Win=2025 Len=0 TSval=1278889157 TSecr=1222762106"
"736","2018-05-14 14:41:10.007880","192.168.2.2","17.253.75.208","TCP","66","60378  >  80 [ACK] Seq=1 Ack=946993 Win=2002 Len=0 TSval=1278889159 TSecr=1222762106"
"737","2018-05-14 14:41:10.007882","192.168.2.2","17.253.75.208","TCP","66","60378  >  80 [ACK] Seq=1 Ack=958577 Win=2025 Len=0 TSval=1278889160 TSecr=1222762108"
"757","2018-05-14 14:41:10.008805","192.168.2.2","17.253.75.208","TCP","66","60378  >  80 [ACK] Seq=1 Ack=970161 Win=1980 Len=0 TSval=1278889160 TSecr=1222762108"
"758","2018-05-14 14:41:10.011308","192.168.2.2","17.253.75.208","TCP","66","60378  >  80 [ACK] Seq=1 Ack=981745 Win=2002 Len=0 TSval=1278889165 TSecr=1222762108"
"759","2018-05-14 14:41:10.011311","192.168.2.2","17.253.75.208","TCP","66","60378  >  80 [ACK] Seq=1 Ack=993329 Win=2002 Len=0 TSval=1278889165 TSecr=1222762113"
"760","2018-05-14 14:41:10.011886","192.168.2.2","17.253.75.208","TCP","66","60378  >  80 [ACK] Seq=1 Ack=1004913 Win=1980 Len=0 TSval=1278889166 TSecr=1222762113"
"801","2018-05-14 14:41:10.016782","192.168.2.2","17.253.75.208","TCP","66","60378  >  80 [ACK] Seq=1 Ack=1016497 Win=2025 Len=0 TSval=1278889169 TSecr=1222762113"
"802","2018-05-14 14:41:10.016783","192.168.2.2","17.253.75.208","TCP","66","60378  >  80 [ACK] Seq=1 Ack=1028081 Win=1957 Len=0 TSval=1278889170 TSecr=1222762119"
"813","2018-05-14 14:41:10.018592","192.168.2.2","17.253.75.208","TCP","66","60378  >  80 [ACK] Seq=1 Ack=1039665 Win=2002 Len=0 TSval=1278889170 TSecr=1222762119"
"814","2018-05-14 14:41:10.018594","192.168.2.2","17.253.75.208","TCP","66","60378  >  80 [ACK] Seq=1 Ack=1051249 Win=2025 Len=0 TSval=1278889171 TSecr=1222762120"
"815","2018-05-14 14:41:10.020043","192.168.2.2","17.253.75.208","TCP","66","60378  >  80 [ACK] Seq=1 Ack=1062833 Win=2025 Len=0 TSval=1278889172 TSecr=1222762122"
"816","2018-05-14 14:41:10.020044","192.168.2.2","17.253.75.208","TCP","66","60378  >  80 [ACK] Seq=1 Ack=1074417 Win=2002 Len=0 TSval=1278889173 TSecr=1222762122"
"832","2018-05-14 14:41:10.023402","192.168.2.2","17.253.75.208","TCP","66","60378  >  80 [ACK] Seq=1 Ack=1086001 Win=2025 Len=0 TSval=1278889175 TSecr=1222762123"
"855","2018-05-14 14:41:10.025186","192.168.2.2","17.253.75.208","TCP","66","60378  >  80 [ACK] Seq=1 Ack=1097585 Win=2002 Len=0 TSval=1278889176 TSecr=1222762127"
"880","2018-05-14 14:41:10.032497","192.168.2.2","17.253.75.208","TCP","66","60378  >  80 [ACK] Seq=1 Ack=1109169 Win=2025 Len=0 TSval=1278889177 TSecr=1222762129"
"881","2018-05-14 14:41:10.032503","192.168.2.2","17.253.75.208","TCP","66","60378  >  80 [ACK] Seq=1 Ack=1120753 Win=2025 Len=0 TSval=1278889178 TSecr=1222762130"
"882","2018-05-14 14:41:10.035466","192.168.2.2","17.253.75.208","TCP","66","60378  >  80 [ACK] Seq=1 Ack=1132337 Win=2002 Len=0 TSval=1278889183 TSecr=1222762130"
"883","2018-05-14 14:41:10.036177","192.168.2.2","17.253.75.208","TCP","66","60378  >  80 [ACK] Seq=1 Ack=1143921 Win=1889 Len=0 TSval=1278889186 TSecr=1222762131"
"884","2018-05-14 14:41:10.036178","192.168.2.2","17.253.75.208","TCP","66","60378  >  80 [ACK] Seq=1 Ack=1155505 Win=1708 Len=0 TSval=1278889186 TSecr=1222762131"
"885","2018-05-14 14:41:10.036179","192.168.2.2","17.253.75.208","TCP","66","60378  >  80 [ACK] Seq=1 Ack=1167089 Win=1527 Len=0 TSval=1278889186 TSecr=1222762135"
"886","2018-05-14 14:41:10.036704","192.168.2.2","17.253.75.208","TCP","66","60378  >  80 [ACK] Seq=1 Ack=1168537 Win=2048 Len=0 TSval=1278889186 TSecr=1222762136"
"939","2018-05-14 14:41:10.046001","192.168.2.2","17.253.75.208","TCP","66","60378  >  80 [ACK] Seq=1 Ack=1180121 Win=2025 Len=0 TSval=1278889192 TSecr=1222762143"
"940","2018-05-14 14:41:10.046004","192.168.2.2","17.253.75.208","TCP","66","60378  >  80 [ACK] Seq=1 Ack=1191705 Win=2025 Len=0 TSval=1278889195 TSecr=1222762143"
"957","2018-05-14 14:41:10.052166","192.168.2.2","17.253.75.208","TCP","66","60378  >  80 [ACK] Seq=1 Ack=1203289 Win=1980 Len=0 TSval=1278889195 TSecr=1222762146"
"958","2018-05-14 14:41:10.052168","192.168.2.2","17.253.75.208","TCP","66","60378  >  80 [ACK] Seq=1 Ack=1214873 Win=2002 Len=0 TSval=1278889196 TSecr=1222762146"
"959","2018-05-14 14:41:10.054120","192.168.2.2","17.253.75.208","TCP","66","60378  >  80 [ACK] Seq=1 Ack=1225009 Win=2002 Len=0 TSval=1278889196 TSecr=1222762147"
"960","2018-05-14 14:41:10.054123","192.168.2.2","17.253.75.208","TCP","66","60378  >  80 [ACK] Seq=1 Ack=1236593 Win=2025 Len=0 TSval=1278889197 TSecr=1222762147"
"961","2018-05-14 14:41:10.054558","192.168.2.2","17.253.75.208","TCP","66","60378  >  80 [ACK] Seq=1 Ack=1248177 Win=1980 Len=0 TSval=1278889202 TSecr=1222762148"
"962","2018-05-14 14:41:10.054559","192.168.2.2","17.253.75.208","TCP","66","60378  >  80 [ACK] Seq=1 Ack=1259761 Win=2025 Len=0 TSval=1278889202 TSecr=1222762156"
"1011","2018-05-14 14:41:10.065103","192.168.2.2","17.253.75.208","TCP","66","60378  >  80 [ACK] Seq=1 Ack=1271345 Win=2025 Len=0 TSval=1278889211 TSecr=1222762157"
"1012","2018-05-14 14:41:10.065106","192.168.2.2","17.253.75.208","TCP","66","60378  >  80 [ACK] Seq=1 Ack=1282929 Win=2025 Len=0 TSval=1278889211 TSecr=1222762163"
"1013","2018-05-14 14:41:10.066865","192.168.2.2","17.253.75.208","TCP","66","60378  >  80 [ACK] Seq=1 Ack=1294513 Win=2025 Len=0 TSval=1278889212 TSecr=1222762163"
"1014","2018-05-14 14:41:10.066868","192.168.2.2","17.253.75.208","TCP","66","60378  >  80 [ACK] Seq=1 Ack=1306097 Win=1980 Len=0 TSval=1278889212 TSecr=1222762165"
"1015","2018-05-14 14:41:10.067279","192.168.2.2","17.253.75.208","TCP","66","60378  >  80 [ACK] Seq=1 Ack=1317681 Win=2025 Len=0 TSval=1278889214 TSecr=1222762166"
"1016","2018-05-14 14:41:10.067280","192.168.2.2","17.253.75.208","TCP","66","60378  >  80 [ACK] Seq=1 Ack=1329265 Win=2025 Len=0 TSval=1278889214 TSecr=1222762167"
"1046","2018-05-14 14:41:10.072933","192.168.2.2","17.253.75.208","TCP","66","60378  >  80 [ACK] Seq=1 Ack=1340849 Win=2025 Len=0 TSval=1278889218 TSecr=1222762168"
"1047","2018-05-14 14:41:10.072937","192.168.2.2","17.253.75.208","TCP","66","60378  >  80 [ACK] Seq=1 Ack=1352433 Win=1889 Len=0 TSval=1278889219 TSecr=1222762176"
"1081","2018-05-14 14:41:10.079003","192.168.2.2","17.253.75.208","TCP","66","60378  >  80 [ACK] Seq=1 Ack=1359673 Win=2002 Len=0 TSval=1278889221 TSecr=1222762176"
"1082","2018-05-14 14:41:10.079006","192.168.2.2","17.253.75.208","TCP","66","60378  >  80 [ACK] Seq=1 Ack=1362569 Win=1957 Len=0 TSval=1278889221 TSecr=1222762178"
"1083","2018-05-14 14:41:10.080301","192.168.2.2","17.253.75.208","TCP","66","60378  >  80 [ACK] Seq=1 Ack=1364017 Win=2048 Len=0 TSval=1278889221 TSecr=1222762178"
"1084","2018-05-14 14:41:10.080303","192.168.2.2","17.253.75.208","TCP","66","60378  >  80 [ACK] Seq=1 Ack=1366913 Win=2002 Len=0 TSval=1278889221 TSecr=1222762178"
"1085","2018-05-14 14:41:10.080303","192.168.2.2","17.253.75.208","TCP","66","[TCP Window Update] 60378  >  80 [ACK] Seq=1 Ack=1366913 Win=2048 Len=0 TSval=1278889221 TSecr=1222762178"
"1086","2018-05-14 14:41:10.080304","192.168.2.2","17.253.75.208","TCP","66","60378  >  80 [ACK] Seq=1 Ack=1378497 Win=2025 Len=0 TSval=1278889222 TSecr=1222762178"
"1087","2018-05-14 14:41:10.080305","192.168.2.2","17.253.75.208","TCP","66","60378  >  80 [ACK] Seq=1 Ack=1390081 Win=2002 Len=0 TSval=1278889223 TSecr=1222762179"
"1088","2018-05-14 14:41:10.081033","192.168.2.2","17.253.75.208","TCP","66","60378  >  80 [ACK] Seq=1 Ack=1401665 Win=2002 Len=0 TSval=1278889226 TSecr=1222762180"
"1097","2018-05-14 14:41:10.085605","192.168.2.2","17.253.75.208","TCP","66","60378  >  80 [ACK] Seq=1 Ack=1413249 Win=1980 Len=0 TSval=1278889228 TSecr=1222762183"
"1136","2018-05-14 14:41:10.136312","192.168.2.2","17.253.75.208","TCP","78","60378  >  80 [ACK] Seq=1 Ack=1421937 Win=2048 Len=0 TSval=1278889276 TSecr=1222762183 SLE=1424833 SRE=1426281"
"1137","2018-05-14 14:41:10.136315","192.168.2.2","17.253.75.208","TCP","78","[TCP Dup ACK 1136#1] 60378  >  80 [ACK] Seq=1 Ack=1421937 Win=2048 Len=0 TSval=1278889276 TSecr=1222762183 SLE=1424833 SRE=1427729"
"1138","2018-05-14 14:41:10.136316","192.168.2.2","17.253.75.208","TCP","78","[TCP Dup ACK 1136#2] 60378  >  80 [ACK] Seq=1 Ack=1421937 Win=2048 Len=0 TSval=1278889276 TSecr=1222762183 SLE=1424833 SRE=1429177"
"1139","2018-05-14 14:41:10.136317","192.168.2.2","17.253.75.208","TCP","78","[TCP Dup ACK 1136#3] 60378  >  80 [ACK] Seq=1 Ack=1421937 Win=2048 Len=0 TSval=1278889276 TSecr=1222762183 SLE=1424833 SRE=1430625"
"1140","2018-05-14 14:41:10.136318","192.168.2.2","17.253.75.208","TCP","78","[TCP Dup ACK 1136#4] 60378  >  80 [ACK] Seq=1 Ack=1421937 Win=2048 Len=0 TSval=1278889276 TSecr=1222762183 SLE=1424833 SRE=1432073"
"1141","2018-05-14 14:41:10.136318","192.168.2.2","17.253.75.208","TCP","78","[TCP Dup ACK 1136#5] 60378  >  80 [ACK] Seq=1 Ack=1421937 Win=2048 Len=0 TSval=1278889276 TSecr=1222762183 SLE=1424833 SRE=1433521"
"1142","2018-05-14 14:41:10.136319","192.168.2.2","17.253.75.208","TCP","78","[TCP Dup ACK 1136#6] 60378  >  80 [ACK] Seq=1 Ack=1421937 Win=2048 Len=0 TSval=1278889276 TSecr=1222762183 SLE=1424833 SRE=1434969"
"1143","2018-05-14 14:41:10.136319","192.168.2.2","17.253.75.208","TCP","78","[TCP Dup ACK 1136#7] 60378  >  80 [ACK] Seq=1 Ack=1421937 Win=2048 Len=0 TSval=1278889276 TSecr=1222762183 SLE=1424833 SRE=1436417"
"1144","2018-05-14 14:41:10.136321","192.168.2.2","17.253.75.208","TCP","78","[TCP Dup ACK 1136#8] 60378  >  80 [ACK] Seq=1 Ack=1421937 Win=2048 Len=0 TSval=1278889276 TSecr=1222762183 SLE=1424833 SRE=1437865"
"1145","2018-05-14 14:41:10.136321","192.168.2.2","17.253.75.208","TCP","78","[TCP Dup ACK 1136#9] 60378  >  80 [ACK] Seq=1 Ack=1421937 Win=2048 Len=0 TSval=1278889276 TSecr=1222762183 SLE=1424833 SRE=1439313"
"1146","2018-05-14 14:41:10.136322","192.168.2.2","17.253.75.208","TCP","78","[TCP Dup ACK 1136#10] 60378  >  80 [ACK] Seq=1 Ack=1421937 Win=2048 Len=0 TSval=1278889276 TSecr=1222762183 SLE=1424833 SRE=1440761"
"1147","2018-05-14 14:41:10.136323","192.168.2.2","17.253.75.208","TCP","78","[TCP Dup ACK 1136#11] 60378  >  80 [ACK] Seq=1 Ack=1421937 Win=2048 Len=0 TSval=1278889276 TSecr=1222762183 SLE=1424833 SRE=1442209"
"1148","2018-05-14 14:41:10.136337","192.168.2.2","17.253.75.208","TCP","78","[TCP Dup ACK 1136#12] 60378  >  80 [ACK] Seq=1 Ack=1421937 Win=2048 Len=0 TSval=1278889276 TSecr=1222762183 SLE=1424833 SRE=1443657"
"1149","2018-05-14 14:41:10.136338","192.168.2.2","17.253.75.208","TCP","78","[TCP Dup ACK 1136#13] 60378  >  80 [ACK] Seq=1 Ack=1421937 Win=2048 Len=0 TSval=1278889276 TSecr=1222762183 SLE=1424833 SRE=1445105"
"1150","2018-05-14 14:41:10.136338","192.168.2.2","17.253.75.208","TCP","78","[TCP Dup ACK 1136#14] 60378  >  80 [ACK] Seq=1 Ack=1421937 Win=2048 Len=0 TSval=1278889276 TSecr=1222762183 SLE=1424833 SRE=1446553"
"1151","2018-05-14 14:41:10.136339","192.168.2.2","17.253.75.208","TCP","78","[TCP Dup ACK 1136#15] 60378  >  80 [ACK] Seq=1 Ack=1421937 Win=2048 Len=0 TSval=1278889276 TSecr=1222762183 SLE=1424833 SRE=1448001"
"1152","2018-05-14 14:41:10.136340","192.168.2.2","17.253.75.208","TCP","78","[TCP Dup ACK 1136#16] 60378  >  80 [ACK] Seq=1 Ack=1421937 Win=2048 Len=0 TSval=1278889276 TSecr=1222762183 SLE=1424833 SRE=1449449"
"1153","2018-05-14 14:41:10.136340","192.168.2.2","17.253.75.208","TCP","78","[TCP Dup ACK 1136#17] 60378  >  80 [ACK] Seq=1 Ack=1421937 Win=2048 Len=0 TSval=1278889276 TSecr=1222762183 SLE=1424833 SRE=1450897"
"1154","2018-05-14 14:41:10.136341","192.168.2.2","17.253.75.208","TCP","78","[TCP Dup ACK 1136#18] 60378  >  80 [ACK] Seq=1 Ack=1421937 Win=2048 Len=0 TSval=1278889276 TSecr=1222762183 SLE=1424833 SRE=1452345"
"1155","2018-05-14 14:41:10.136342","192.168.2.2","17.253.75.208","TCP","78","[TCP Dup ACK 1136#19] 60378  >  80 [ACK] Seq=1 Ack=1421937 Win=2048 Len=0 TSval=1278889276 TSecr=1222762183 SLE=1424833 SRE=1453793"
"1156","2018-05-14 14:41:10.136342","192.168.2.2","17.253.75.208","TCP","78","[TCP Dup ACK 1136#20] 60378  >  80 [ACK] Seq=1 Ack=1421937 Win=2048 Len=0 TSval=1278889276 TSecr=1222762183 SLE=1424833 SRE=1455241"
"1157","2018-05-14 14:41:10.136343","192.168.2.2","17.253.75.208","TCP","78","[TCP Dup ACK 1136#21] 60378  >  80 [ACK] Seq=1 Ack=1421937 Win=2048 Len=0 TSval=1278889276 TSecr=1222762183 SLE=1424833 SRE=1456689"
"1158","2018-05-14 14:41:10.136344","192.168.2.2","17.253.75.208","TCP","78","[TCP Dup ACK 1136#22] 60378  >  80 [ACK] Seq=1 Ack=1421937 Win=2048 Len=0 TSval=1278889276 TSecr=1222762183 SLE=1424833 SRE=1458137"
"1159","2018-05-14 14:41:10.136344","192.168.2.2","17.253.75.208","TCP","78","[TCP Dup ACK 1136#23] 60378  >  80 [ACK] Seq=1 Ack=1421937 Win=2048 Len=0 TSval=1278889276 TSecr=1222762183 SLE=1424833 SRE=1459585"
"1171","2018-05-14 14:41:10.142835","192.168.2.2","17.253.75.208","TCP","78","[TCP Dup ACK 1136#24] 60378  >  80 [ACK] Seq=1 Ack=1421937 Win=2048 Len=0 TSval=1278889276 TSecr=1222762183 SLE=1424833 SRE=1461033"
"1172","2018-05-14 14:41:10.142838","192.168.2.2","17.253.75.208","TCP","78","[TCP Dup ACK 1136#25] 60378  >  80 [ACK] Seq=1 Ack=1421937 Win=2048 Len=0 TSval=1278889276 TSecr=1222762183 SLE=1424833 SRE=1462481"
"1173","2018-05-14 14:41:10.142839","192.168.2.2","17.253.75.208","TCP","78","[TCP Dup ACK 1136#26] 60378  >  80 [ACK] Seq=1 Ack=1421937 Win=2048 Len=0 TSval=1278889276 TSecr=1222762183 SLE=1424833 SRE=1463929"
"1174","2018-05-14 14:41:10.142839","192.168.2.2","17.253.75.208","TCP","78","[TCP Dup ACK 1136#27] 60378  >  80 [ACK] Seq=1 Ack=1421937 Win=2048 Len=0 TSval=1278889276 TSecr=1222762183 SLE=1424833 SRE=1465377"
"1175","2018-05-14 14:41:10.142840","192.168.2.2","17.253.75.208","TCP","78","[TCP Dup ACK 1136#28] 60378  >  80 [ACK] Seq=1 Ack=1421937 Win=2048 Len=0 TSval=1278889276 TSecr=1222762183 SLE=1424833 SRE=1466825"
"1176","2018-05-14 14:41:10.142841","192.168.2.2","17.253.75.208","TCP","78","[TCP Dup ACK 1136#29] 60378  >  80 [ACK] Seq=1 Ack=1421937 Win=2048 Len=0 TSval=1278889276 TSecr=1222762183 SLE=1424833 SRE=1468273"
"1177","2018-05-14 14:41:10.142841","192.168.2.2","17.253.75.208","TCP","78","[TCP Dup ACK 1136#30] 60378  >  80 [ACK] Seq=1 Ack=1421937 Win=2048 Len=0 TSval=1278889276 TSecr=1222762183 SLE=1424833 SRE=1469721"
"1178","2018-05-14 14:41:10.142842","192.168.2.2","17.253.75.208","TCP","78","[TCP Dup ACK 1136#31] 60378  >  80 [ACK] Seq=1 Ack=1421937 Win=2048 Len=0 TSval=1278889276 TSecr=1222762183 SLE=1424833 SRE=1471169"
"1179","2018-05-14 14:41:10.142843","192.168.2.2","17.253.75.208","TCP","78","[TCP Dup ACK 1136#32] 60378  >  80 [ACK] Seq=1 Ack=1421937 Win=2048 Len=0 TSval=1278889276 TSecr=1222762183 SLE=1424833 SRE=1472617"
"1181","2018-05-14 14:41:10.143717","192.168.2.2","17.253.75.208","TCP","78","[TCP Dup ACK 1136#33] 60378  >  80 [ACK] Seq=1 Ack=1421937 Win=2048 Len=0 TSval=1278889285 TSecr=1222762183 SLE=1424833 SRE=1474065"
"1182","2018-05-14 14:41:10.143719","192.168.2.2","17.253.75.208","TCP","78","[TCP Dup ACK 1136#34] 60378  >  80 [ACK] Seq=1 Ack=1421937 Win=2048 Len=0 TSval=1278889285 TSecr=1222762183 SLE=1424833 SRE=1475513"
"1183","2018-05-14 14:41:10.143719","192.168.2.2","17.253.75.208","TCP","78","[TCP Dup ACK 1136#35] 60378  >  80 [ACK] Seq=1 Ack=1421937 Win=2048 Len=0 TSval=1278889285 TSecr=1222762183 SLE=1424833 SRE=1476961"
"1184","2018-05-14 14:41:10.143720","192.168.2.2","17.253.75.208","TCP","78","[TCP Dup ACK 1136#36] 60378  >  80 [ACK] Seq=1 Ack=1421937 Win=2048 Len=0 TSval=1278889285 TSecr=1222762183 SLE=1424833 SRE=1478409"
"1185","2018-05-14 14:41:10.143721","192.168.2.2","17.253.75.208","TCP","78","[TCP Dup ACK 1136#37] 60378  >  80 [ACK] Seq=1 Ack=1421937 Win=2048 Len=0 TSval=1278889285 TSecr=1222762183 SLE=1424833 SRE=1479857"
"1186","2018-05-14 14:41:10.143721","192.168.2.2","17.253.75.208","TCP","78","[TCP Dup ACK 1136#38] 60378  >  80 [ACK] Seq=1 Ack=1421937 Win=2048 Len=0 TSval=1278889285 TSecr=1222762183 SLE=1424833 SRE=1481305"
"1187","2018-05-14 14:41:10.143722","192.168.2.2","17.253.75.208","TCP","78","[TCP Dup ACK 1136#39] 60378  >  80 [ACK] Seq=1 Ack=1421937 Win=2048 Len=0 TSval=1278889285 TSecr=1222762183 SLE=1424833 SRE=1482753"
"1188","2018-05-14 14:41:10.143723","192.168.2.2","17.253.75.208","TCP","78","[TCP Dup ACK 1136#40] 60378  >  80 [ACK] Seq=1 Ack=1421937 Win=2048 Len=0 TSval=1278889285 TSecr=1222762183 SLE=1424833 SRE=1484201"
"1189","2018-05-14 14:41:10.143724","192.168.2.2","17.253.75.208","TCP","78","[TCP Dup ACK 1136#41] 60378  >  80 [ACK] Seq=1 Ack=1421937 Win=2048 Len=0 TSval=1278889285 TSecr=1222762183 SLE=1424833 SRE=1485649"
"1190","2018-05-14 14:41:10.143724","192.168.2.2","17.253.75.208","TCP","78","[TCP Dup ACK 1136#42] 60378  >  80 [ACK] Seq=1 Ack=1421937 Win=2048 Len=0 TSval=1278889285 TSecr=1222762183 SLE=1424833 SRE=1487097"
"1191","2018-05-14 14:41:10.143725","192.168.2.2","17.253.75.208","TCP","78","[TCP Dup ACK 1136#43] 60378  >  80 [ACK] Seq=1 Ack=1421937 Win=2048 Len=0 TSval=1278889285 TSecr=1222762183 SLE=1424833 SRE=1488545"
"1192","2018-05-14 14:41:10.143726","192.168.2.2","17.253.75.208","TCP","78","[TCP Dup ACK 1136#44] 60378  >  80 [ACK] Seq=1 Ack=1421937 Win=2048 Len=0 TSval=1278889285 TSecr=1222762183 SLE=1424833 SRE=1489993"
"1193","2018-05-14 14:41:10.143726","192.168.2.2","17.253.75.208","TCP","78","[TCP Dup ACK 1136#45] 60378  >  80 [ACK] Seq=1 Ack=1421937 Win=2048 Len=0 TSval=1278889285 TSecr=1222762183 SLE=1424833 SRE=1491441"
"1194","2018-05-14 14:41:10.143727","192.168.2.2","17.253.75.208","TCP","78","[TCP Dup ACK 1136#46] 60378  >  80 [ACK] Seq=1 Ack=1421937 Win=2048 Len=0 TSval=1278889285 TSecr=1222762183 SLE=1424833 SRE=1492889"
"1195","2018-05-14 14:41:10.147890","192.168.2.2","17.253.75.208","TCP","78","[TCP Dup ACK 1136#47] 60378  >  80 [ACK] Seq=1 Ack=1421937 Win=2048 Len=0 TSval=1278889288 TSecr=1222762183 SLE=1424833 SRE=1494337"
"1196","2018-05-14 14:41:10.147892","192.168.2.2","17.253.75.208","TCP","78","[TCP Dup ACK 1136#48] 60378  >  80 [ACK] Seq=1 Ack=1421937 Win=2048 Len=0 TSval=1278889288 TSecr=1222762183 SLE=1424833 SRE=1495785"
"1200","2018-05-14 14:41:10.149523","192.168.2.2","17.253.75.208","TCP","78","[TCP Dup ACK 1136#49] 60378  >  80 [ACK] Seq=1 Ack=1421937 Win=2048 Len=0 TSval=1278889289 TSecr=1222762183 SLE=1424833 SRE=1497233"
"1201","2018-05-14 14:41:10.149525","192.168.2.2","17.253.75.208","TCP","78","[TCP Dup ACK 1136#50] 60378  >  80 [ACK] Seq=1 Ack=1421937 Win=2048 Len=0 TSval=1278889289 TSecr=1222762183 SLE=1424833 SRE=1498681"
"1202","2018-05-14 14:41:10.149526","192.168.2.2","17.253.75.208","TCP","78","[TCP Dup ACK 1136#51] 60378  >  80 [ACK] Seq=1 Ack=1421937 Win=2048 Len=0 TSval=1278889289 TSecr=1222762183 SLE=1424833 SRE=1500129"
"1203","2018-05-14 14:41:10.149527","192.168.2.2","17.253.75.208","TCP","78","[TCP Dup ACK 1136#52] 60378  >  80 [ACK] Seq=1 Ack=1421937 Win=2048 Len=0 TSval=1278889289 TSecr=1222762183 SLE=1424833 SRE=1501577"
"1204","2018-05-14 14:41:10.149527","192.168.2.2","17.253.75.208","TCP","78","[TCP Dup ACK 1136#53] 60378  >  80 [ACK] Seq=1 Ack=1421937 Win=2048 Len=0 TSval=1278889289 TSecr=1222762183 SLE=1424833 SRE=1503025"
"1205","2018-05-14 14:41:10.149528","192.168.2.2","17.253.75.208","TCP","78","[TCP Dup ACK 1136#54] 60378  >  80 [ACK] Seq=1 Ack=1421937 Win=2048 Len=0 TSval=1278889289 TSecr=1222762183 SLE=1424833 SRE=1504473"
"1206","2018-05-14 14:41:10.149528","192.168.2.2","17.253.75.208","TCP","78","[TCP Dup ACK 1136#55] 60378  >  80 [ACK] Seq=1 Ack=1421937 Win=2048 Len=0 TSval=1278889289 TSecr=1222762183 SLE=1424833 SRE=1505921"
"1207","2018-05-14 14:41:10.149530","192.168.2.2","17.253.75.208","TCP","78","[TCP Dup ACK 1136#56] 60378  >  80 [ACK] Seq=1 Ack=1421937 Win=2048 Len=0 TSval=1278889289 TSecr=1222762183 SLE=1424833 SRE=1507369"
"1208","2018-05-14 14:41:10.149531","192.168.2.2","17.253.75.208","TCP","78","60378  >  80 [ACK] Seq=1 Ack=1423385 Win=2025 Len=0 TSval=1278889289 TSecr=1222762248 SLE=1424833 SRE=1507369"
"1209","2018-05-14 14:41:10.149531","192.168.2.2","17.253.75.208","TCP","66","60378  >  80 [ACK] Seq=1 Ack=1507369 Win=713 Len=0 TSval=1278889289 TSecr=1222762249"
"1210","2018-05-14 14:41:10.149532","192.168.2.2","17.253.75.208","TCP","66","[TCP Window Update] 60378  >  80 [ACK] Seq=1 Ack=1507369 Win=2048 Len=0 TSval=1278889289 TSecr=1222762249"
"1211","2018-05-14 14:41:10.150473","192.168.2.2","17.253.75.208","TCP","66","60378  >  80 [ACK] Seq=1 Ack=1510265 Win=2002 Len=0 TSval=1278889293 TSecr=1222762254"
"1212","2018-05-14 14:41:10.150474","192.168.2.2","17.253.75.208","TCP","66","[TCP Window Update] 60378  >  80 [ACK] Seq=1 Ack=1510265 Win=2048 Len=0 TSval=1278889293 TSecr=1222762254"
"1251","2018-05-14 14:41:10.167247","192.168.2.2","17.253.75.208","TCP","66","60378  >  80 [ACK] Seq=1 Ack=1513161 Win=2025 Len=0 TSval=1278889303 TSecr=1222762255"
"1252","2018-05-14 14:41:10.167251","192.168.2.2","17.253.75.208","TCP","66","60378  >  80 [ACK] Seq=1 Ack=1514609 Win=2048 Len=0 TSval=1278889303 TSecr=1222762258"
"1253","2018-05-14 14:41:10.167845","192.168.2.2","17.253.75.208","TCP","66","60378  >  80 [ACK] Seq=1 Ack=1517505 Win=2002 Len=0 TSval=1278889306 TSecr=1222762260"
"1254","2018-05-14 14:41:10.167852","192.168.2.2","17.253.75.208","TCP","66","60378  >  80 [ACK] Seq=1 Ack=1520401 Win=1957 Len=0 TSval=1278889306 TSecr=1222762260"
"1255","2018-05-14 14:41:10.167853","192.168.2.2","17.253.75.208","TCP","66","60378  >  80 [ACK] Seq=1 Ack=1521849 Win=2048 Len=0 TSval=1278889306 TSecr=1222762261"
"1256","2018-05-14 14:41:10.167853","192.168.2.2","17.253.75.208","TCP","66","60378  >  80 [ACK] Seq=1 Ack=1524745 Win=2002 Len=0 TSval=1278889306 TSecr=1222762261"
"1257","2018-05-14 14:41:10.167854","192.168.2.2","17.253.75.208","TCP","66","60378  >  80 [ACK] Seq=1 Ack=1527641 Win=1957 Len=0 TSval=1278889306 TSecr=1222762261"
"1258","2018-05-14 14:41:10.167856","192.168.2.2","17.253.75.208","TCP","66","60378  >  80 [ACK] Seq=1 Ack=1530537 Win=1912 Len=0 TSval=1278889306 TSecr=1222762262"
"1259","2018-05-14 14:41:10.167857","192.168.2.2","17.253.75.208","TCP","66","60378  >  80 [ACK] Seq=1 Ack=1533433 Win=1867 Len=0 TSval=1278889306 TSecr=1222762262"
"1260","2018-05-14 14:41:10.167858","192.168.2.2","17.253.75.208","TCP","66","[TCP Window Update] 60378  >  80 [ACK] Seq=1 Ack=1533433 Win=1980 Len=0 TSval=1278889306 TSecr=1222762262"
"1261","2018-05-14 14:41:10.167858","192.168.2.2","17.253.75.208","TCP","66","60378  >  80 [ACK] Seq=1 Ack=1534881 Win=2048 Len=0 TSval=1278889306 TSecr=1222762263"
"1262","2018-05-14 14:41:10.167859","192.168.2.2","17.253.75.208","TCP","66","60378  >  80 [ACK] Seq=1 Ack=1537777 Win=2002 Len=0 TSval=1278889307 TSecr=1222762263"
"1263","2018-05-14 14:41:10.167860","192.168.2.2","17.253.75.208","TCP","66","60378  >  80 [ACK] Seq=1 Ack=1540673 Win=1957 Len=0 TSval=1278889307 TSecr=1222762264"
"1264","2018-05-14 14:41:10.167861","192.168.2.2","17.253.75.208","TCP","66","60378  >  80 [ACK] Seq=1 Ack=1543569 Win=1934 Len=0 TSval=1278889307 TSecr=1222762264"
"1265","2018-05-14 14:41:10.167861","192.168.2.2","17.253.75.208","TCP","66","[TCP Window Update] 60378  >  80 [ACK] Seq=1 Ack=1543569 Win=2048 Len=0 TSval=1278889307 TSecr=1222762264"
"1266","2018-05-14 14:41:10.167862","192.168.2.2","17.253.75.208","TCP","66","60378  >  80 [ACK] Seq=1 Ack=1546465 Win=2002 Len=0 TSval=1278889309 TSecr=1222762265"
"1267","2018-05-14 14:41:10.167862","192.168.2.2","17.253.75.208","TCP","66","60378  >  80 [ACK] Seq=1 Ack=1549361 Win=1957 Len=0 TSval=1278889309 TSecr=1222762265"
"1268","2018-05-14 14:41:10.167863","192.168.2.2","17.253.75.208","TCP","66","60378  >  80 [ACK] Seq=1 Ack=1550809 Win=2002 Len=0 TSval=1278889309 TSecr=1222762266"
"1269","2018-05-14 14:41:10.167864","192.168.2.2","17.253.75.208","TCP","66","60378  >  80 [ACK] Seq=1 Ack=1553705 Win=1957 Len=0 TSval=1278889309 TSecr=1222762266"
"1270","2018-05-14 14:41:10.169116","192.168.2.2","17.253.75.208","TCP","66","60378  >  80 [ACK] Seq=1 Ack=1556601 Win=1912 Len=0 TSval=1278889309 TSecr=1222762266"
"1271","2018-05-14 14:41:10.169123","192.168.2.2","17.253.75.208","TCP","66","60378  >  80 [ACK] Seq=1 Ack=1559497 Win=1867 Len=0 TSval=1278889309 TSecr=1222762267"
"1272","2018-05-14 14:41:10.169124","192.168.2.2","17.253.75.208","TCP","66","60378  >  80 [ACK] Seq=1 Ack=1562393 Win=1821 Len=0 TSval=1278889309 TSecr=1222762267"
"1273","2018-05-14 14:41:10.171068","192.168.2.2","17.253.75.208","TCP","66","[TCP Window Update] 60378  >  80 [ACK] Seq=1 Ack=1562393 Win=2048 Len=0 TSval=1278889310 TSecr=1222762267"
"1314","2018-05-14 14:41:10.198302","192.168.2.2","17.253.75.208","TCP","66","60378  >  80 [ACK] Seq=1 Ack=1565289 Win=2002 Len=0 TSval=1278889319 TSecr=1222762278"
"1315","2018-05-14 14:41:10.198307","192.168.2.2","17.253.75.208","TCP","66","[TCP Window Update] 60378  >  80 [ACK] Seq=1 Ack=1565289 Win=2048 Len=0 TSval=1278889319 TSecr=1222762278"
"1316","2018-05-14 14:41:10.198889","192.168.2.2","17.253.75.208","TCP","66","60378  >  80 [ACK] Seq=1 Ack=1568185 Win=2002 Len=0 TSval=1278889319 TSecr=1222762278"
"1317","2018-05-14 14:41:10.198891","192.168.2.2","17.253.75.208","TCP","66","60378  >  80 [ACK] Seq=1 Ack=1569633 Win=2048 Len=0 TSval=1278889319 TSecr=1222762279"
