"No.","Time","Source","Destination","Protocol","Length","Info"
"1","2018-05-25 14:01:28.640182","192.168.2.3","34.208.66.202","TCP","1414","53801  >  3491 [ACK] Seq=1 Ack=1 Win=6800 Len=1348 TSval=4294964230 TSecr=970408338"
"2","2018-05-25 14:01:28.640186","192.168.2.3","34.208.66.202","TCP","1414","53801  >  3491 [ACK] Seq=1349 Ack=1 Win=6800 Len=1348 TSval=4294964230 TSecr=970408338"
"3","2018-05-25 14:01:28.640362","192.168.2.3","34.208.66.202","TCP","1414","53801  >  3491 [ACK] Seq=2697 Ack=1 Win=6800 Len=1348 TSval=4294964230 TSecr=970408338"
"4","2018-05-25 14:01:28.640363","192.168.2.3","34.208.66.202","TCP","1066","53801  >  3491 [PSH, ACK] Seq=4045 Ack=1 Win=6800 Len=1000 TSval=4294964230 TSecr=970408338"
"5","2018-05-25 14:01:28.640599","192.168.2.3","34.208.66.202","TCP","1414","53801  >  3491 [ACK] Seq=5045 Ack=1 Win=6800 Len=1348 TSval=4294964231 TSecr=970408338"
"6","2018-05-25 14:01:28.641070","192.168.2.3","34.208.66.202","TCP","1414","53801  >  3491 [ACK] Seq=6393 Ack=1 Win=6800 Len=1348 TSval=4294964245 TSecr=970408358"
"7","2018-05-25 14:01:28.641076","192.168.2.3","34.208.66.202","TCP","1414","53801  >  3491 [ACK] Seq=7741 Ack=1 Win=6800 Len=1348 TSval=4294964246 TSecr=970408358"
"8","2018-05-25 14:01:28.641471","192.168.2.3","34.208.66.202","TCP","1414","53801  >  3491 [ACK] Seq=9089 Ack=1 Win=6800 Len=1348 TSval=4294964248 TSecr=970408358"
"9","2018-05-25 14:01:28.641473","192.168.2.3","34.208.66.202","TCP","1414","53801  >  3491 [ACK] Seq=10437 Ack=1 Win=6800 Len=1348 TSval=4294964249 TSecr=970408358"
"10","2018-05-25 14:01:28.641729","192.168.2.3","34.208.66.202","TCP","1414","53801  >  3491 [ACK] Seq=11785 Ack=1 Win=6800 Len=1348 TSval=4294964253 TSecr=970408358"
"11","2018-05-25 14:01:28.641731","192.168.2.3","34.208.66.202","TCP","1414","53801  >  3491 [ACK] Seq=13133 Ack=1 Win=6800 Len=1348 TSval=4294964254 TSecr=970408358"
"12","2018-05-25 14:01:28.641980","192.168.2.3","34.208.66.202","TCP","1414","53801  >  3491 [ACK] Seq=14481 Ack=1 Win=6800 Len=1348 TSval=4294964255 TSecr=970408358"
"13","2018-05-25 14:01:28.642399","192.168.2.3","34.208.66.202","TCP","1414","53801  >  3491 [ACK] Seq=15829 Ack=1 Win=6800 Len=1348 TSval=4294964257 TSecr=970408358"
"14","2018-05-25 14:01:28.642401","192.168.2.3","34.208.66.202","TCP","1414","53801  >  3491 [ACK] Seq=17177 Ack=1 Win=6800 Len=1348 TSval=4294964258 TSecr=970408358"
"15","2018-05-25 14:01:28.642434","192.168.2.3","34.208.66.202","TCP","1414","53801  >  3491 [ACK] Seq=18525 Ack=1 Win=6800 Len=1348 TSval=4294964259 TSecr=970408358"
"16","2018-05-25 14:01:28.642810","192.168.2.3","34.208.66.202","TCP","1414","53801  >  3491 [ACK] Seq=19873 Ack=1 Win=6800 Len=1348 TSval=4294964261 TSecr=970408358"
"17","2018-05-25 14:01:28.642812","192.168.2.3","34.208.66.202","TCP","1414","53801  >  3491 [ACK] Seq=21221 Ack=1 Win=6800 Len=1348 TSval=4294964262 TSecr=970408358"
"18","2018-05-25 14:01:28.643136","192.168.2.3","34.208.66.202","TCP","1414","53801  >  3491 [ACK] Seq=22569 Ack=1 Win=6800 Len=1348 TSval=4294964264 TSecr=970408358"
"29","2018-05-25 14:01:28.791834","192.168.2.3","34.208.66.202","TCP","1414","53801  >  3491 [ACK] Seq=23917 Ack=1 Win=6800 Len=1348 TSval=4294964288 TSecr=970408501"
"30","2018-05-25 14:01:28.791840","192.168.2.3","34.208.66.202","TCP","1414","53801  >  3491 [ACK] Seq=25265 Ack=1 Win=6800 Len=1348 TSval=4294964288 TSecr=970408501"
"31","2018-05-25 14:01:28.791909","192.168.2.3","34.208.66.202","TCP","1414","53801  >  3491 [ACK] Seq=26613 Ack=1 Win=6800 Len=1348 TSval=4294964288 TSecr=970408501"
"32","2018-05-25 14:01:28.792256","192.168.2.3","34.208.66.202","TCP","1414","53801  >  3491 [ACK] Seq=27961 Ack=1 Win=6800 Len=1348 TSval=4294964288 TSecr=970408501"
"33","2018-05-25 14:01:28.792403","192.168.2.3","34.208.66.202","TCP","1414","53801  >  3491 [ACK] Seq=29309 Ack=1 Win=6800 Len=1348 TSval=4294964288 TSecr=970408501"
"34","2018-05-25 14:01:28.792562","192.168.2.3","34.208.66.202","TCP","1414","53801  >  3491 [ACK] Seq=30657 Ack=1 Win=6800 Len=1348 TSval=4294964288 TSecr=970408501"
"35","2018-05-25 14:01:28.792793","192.168.2.3","34.208.66.202","TCP","1414","53801  >  3491 [ACK] Seq=32005 Ack=1 Win=6800 Len=1348 TSval=4294964288 TSecr=970408501"
"36","2018-05-25 14:01:28.793001","192.168.2.3","34.208.66.202","TCP","1414","53801  >  3491 [ACK] Seq=33353 Ack=1 Win=6800 Len=1348 TSval=4294964288 TSecr=970408501"
"37","2018-05-25 14:01:28.793003","192.168.2.3","34.208.66.202","TCP","613","53801  >  3491 [PSH, ACK] Seq=34701 Ack=1 Win=6800 Len=547 TSval=4294964288 TSecr=970408501"
"38","2018-05-25 14:01:28.899404","192.168.2.3","34.208.66.202","TCP","1414","53801  >  3491 [ACK] Seq=35248 Ack=1 Win=6800 Len=1348 TSval=4294964298 TSecr=970408501"
"44","2018-05-25 14:01:28.940648","192.168.2.3","34.208.66.202","TCP","1414","53801  >  3491 [ACK] Seq=36596 Ack=1 Win=6800 Len=1348 TSval=4294964300 TSecr=970408501"
"45","2018-05-25 14:01:28.940841","192.168.2.3","34.208.66.202","TCP","1414","53801  >  3491 [ACK] Seq=37944 Ack=1 Win=6800 Len=1348 TSval=4294964300 TSecr=970408501"
"48","2018-05-25 14:01:29.114408","192.168.2.3","34.208.66.202","TCP","505","53801  >  3491 [PSH, ACK] Seq=39292 Ack=1 Win=6800 Len=439 TSval=4294964306 TSecr=970408541"
"49","2018-05-25 14:01:29.114645","192.168.2.3","34.208.66.202","TCP","1414","53801  >  3491 [ACK] Seq=39731 Ack=1 Win=6800 Len=1348 TSval=4294964314 TSecr=970408541"
"50","2018-05-25 14:01:29.114646","192.168.2.3","34.208.66.202","TCP","1414","53801  >  3491 [ACK] Seq=41079 Ack=1 Win=6800 Len=1348 TSval=4294964315 TSecr=970408541"
"52","2018-05-25 14:01:29.140173","192.168.2.3","34.208.66.202","TCP","1414","53801  >  3491 [ACK] Seq=42427 Ack=1 Win=6800 Len=1348 TSval=4294964322 TSecr=970408575"
"53","2018-05-25 14:01:29.175824","192.168.2.3","34.208.66.202","TCP","1414","53801  >  3491 [ACK] Seq=43775 Ack=1 Win=6800 Len=1348 TSval=4294964324 TSecr=970408586"
"55","2018-05-25 14:01:29.277244","192.168.2.3","34.208.66.202","TCP","1275","53801  >  3491 [PSH, ACK] Seq=45123 Ack=1 Win=6800 Len=1209 TSval=4294964337 TSecr=970408624"
"56","2018-05-25 14:01:29.297863","192.168.2.3","34.208.66.202","TCP","1414","53801  >  3491 [ACK] Seq=46332 Ack=1 Win=6800 Len=1348 TSval=4294964339 TSecr=970408624"
"57","2018-05-25 14:01:29.304902","192.168.2.3","34.208.66.202","TCP","1414","53801  >  3491 [ACK] Seq=47680 Ack=1 Win=6800 Len=1348 TSval=4294964340 TSecr=970408624"
"59","2018-05-25 14:01:29.354234","192.168.2.3","34.208.66.202","TCP","1414","53801  >  3491 [ACK] Seq=49028 Ack=1 Win=6800 Len=1348 TSval=4294964342 TSecr=970408624"
"60","2018-05-25 14:01:29.354485","192.168.2.3","34.208.66.202","TCP","1414","53801  >  3491 [ACK] Seq=50376 Ack=1 Win=6800 Len=1348 TSval=4294964343 TSecr=970408624"
"61","2018-05-25 14:01:29.354487","192.168.2.3","34.208.66.202","TCP","1414","53801  >  3491 [ACK] Seq=51724 Ack=1 Win=6800 Len=1348 TSval=4294964344 TSecr=970408624"
"62","2018-05-25 14:01:29.364955","192.168.2.3","34.208.66.202","TCP","1414","53801  >  3491 [ACK] Seq=53072 Ack=1 Win=6800 Len=1348 TSval=4294964346 TSecr=970408624"
"63","2018-05-25 14:01:29.374403","192.168.2.3","34.208.66.202","TCP","1414","53801  >  3491 [ACK] Seq=54420 Ack=1 Win=6800 Len=1348 TSval=4294964347 TSecr=970408624"
"64","2018-05-25 14:01:29.384773","192.168.2.3","34.208.66.202","TCP","1414","53801  >  3491 [ACK] Seq=55768 Ack=1 Win=6800 Len=1348 TSval=4294964348 TSecr=970408624"
"66","2018-05-25 14:01:29.415997","192.168.2.3","34.208.66.202","TCP","1414","53801  >  3491 [ACK] Seq=57116 Ack=1 Win=6800 Len=1348 TSval=4294964351 TSecr=970408624"
"67","2018-05-25 14:01:29.422043","192.168.2.3","34.208.66.202","TCP","934","53801  >  3491 [PSH, ACK] Seq=58464 Ack=1 Win=6800 Len=868 TSval=4294964351 TSecr=970408659"
"70","2018-05-25 14:01:29.461631","192.168.2.3","34.208.66.202","TCP","1414","53801  >  3491 [ACK] Seq=59332 Ack=1 Win=6800 Len=1348 TSval=4294964354 TSecr=970408665"
"71","2018-05-25 14:01:29.461634","192.168.2.3","34.208.66.202","TCP","1414","53801  >  3491 [ACK] Seq=60680 Ack=1 Win=6800 Len=1348 TSval=4294964355 TSecr=970408666"
"72","2018-05-25 14:01:29.487690","192.168.2.3","34.208.66.202","TCP","1414","53801  >  3491 [ACK] Seq=62028 Ack=1 Win=6800 Len=1348 TSval=4294964358 TSecr=970408666"
"74","2018-05-25 14:01:29.498591","192.168.2.3","34.208.66.202","TCP","1414","53801  >  3491 [ACK] Seq=63376 Ack=1 Win=6800 Len=1348 TSval=4294964359 TSecr=970408679"
"76","2018-05-25 14:01:29.507472","192.168.2.3","34.208.66.202","TCP","1414","53801  >  3491 [ACK] Seq=64724 Ack=1 Win=6800 Len=1348 TSval=4294964360 TSecr=970408679"
"78","2018-05-25 14:01:29.562037","192.168.2.3","34.208.66.202","TCP","1414","53801  >  3491 [ACK] Seq=66072 Ack=1 Win=6800 Len=1348 TSval=4294964362 TSecr=970408683"
"79","2018-05-25 14:01:29.562041","192.168.2.3","34.208.66.202","TCP","1414","53801  >  3491 [ACK] Seq=67420 Ack=1 Win=6800 Len=1348 TSval=4294964363 TSecr=970408683"
"80","2018-05-25 14:01:29.562247","192.168.2.3","34.208.66.202","TCP","1414","53801  >  3491 [ACK] Seq=68768 Ack=1 Win=6800 Len=1348 TSval=4294964364 TSecr=970408691"
"81","2018-05-25 14:01:29.563532","192.168.2.3","34.208.66.202","TCP","1414","53801  >  3491 [ACK] Seq=70116 Ack=1 Win=6800 Len=1348 TSval=4294964366 TSecr=970408691"
"82","2018-05-25 14:01:29.577551","192.168.2.3","34.208.66.202","TCP","1414","53801  >  3491 [ACK] Seq=71464 Ack=1 Win=6800 Len=1348 TSval=4294964367 TSecr=970408691"
"85","2018-05-25 14:01:29.609056","192.168.2.3","34.208.66.202","TCP","586","53801  >  3491 [PSH, ACK] Seq=72812 Ack=1 Win=6800 Len=520 TSval=4294964368 TSecr=970408701"
"86","2018-05-25 14:01:29.609394","192.168.2.3","34.208.66.202","TCP","1414","53801  >  3491 [ACK] Seq=73332 Ack=1 Win=6800 Len=1348 TSval=4294964370 TSecr=970408701"
"87","2018-05-25 14:01:29.618635","192.168.2.3","34.208.66.202","TCP","1414","53801  >  3491 [ACK] Seq=74680 Ack=1 Win=6800 Len=1348 TSval=4294964371 TSecr=970408706"
"89","2018-05-25 14:01:29.659066","192.168.2.3","34.208.66.202","TCP","1414","53801  >  3491 [ACK] Seq=76028 Ack=1 Win=6800 Len=1348 TSval=4294964374 TSecr=970408706"
"90","2018-05-25 14:01:29.659085","192.168.2.3","34.208.66.202","TCP","1414","53801  >  3491 [ACK] Seq=77376 Ack=1 Win=6800 Len=1348 TSval=4294964375 TSecr=970408715"
"91","2018-05-25 14:01:29.670015","192.168.2.3","34.208.66.202","TCP","1414","53801  >  3491 [ACK] Seq=78724 Ack=1 Win=6800 Len=1348 TSval=4294964376 TSecr=970408715"
"92","2018-05-25 14:01:29.684924","192.168.2.3","34.208.66.202","TCP","1414","53801  >  3491 [ACK] Seq=80072 Ack=1 Win=6800 Len=1348 TSval=4294964378 TSecr=970408715"
"94","2018-05-25 14:01:29.694852","192.168.2.3","34.208.66.202","TCP","1414","53801  >  3491 [ACK] Seq=81420 Ack=1 Win=6800 Len=1348 TSval=4294964379 TSecr=970408728"
"95","2018-05-25 14:01:29.704738","192.168.2.3","34.208.66.202","TCP","1414","53801  >  3491 [ACK] Seq=82768 Ack=1 Win=6800 Len=1348 TSval=4294964380 TSecr=970408728"
"96","2018-05-25 14:01:29.713957","192.168.2.3","34.208.66.202","TCP","1414","53801  >  3491 [ACK] Seq=84116 Ack=1 Win=6800 Len=1348 TSval=4294964381 TSecr=970408728"
"99","2018-05-25 14:01:29.767666","192.168.2.3","34.208.66.202","TCP","1414","53801  >  3491 [ACK] Seq=85464 Ack=1 Win=6800 Len=1348 TSval=4294964382 TSecr=970408735"
"100","2018-05-25 14:01:29.767688","192.168.2.3","34.208.66.202","TCP","1414","53801  >  3491 [ACK] Seq=86812 Ack=1 Win=6800 Len=1348 TSval=4294964382 TSecr=970408735"
"101","2018-05-25 14:01:29.767689","192.168.2.3","34.208.66.202","TCP","1414","53801  >  3491 [ACK] Seq=88160 Ack=1 Win=6800 Len=1348 TSval=4294964384 TSecr=970408735"
"102","2018-05-25 14:01:29.767718","192.168.2.3","34.208.66.202","TCP","1414","53801  >  3491 [ACK] Seq=89508 Ack=1 Win=6800 Len=1348 TSval=4294964385 TSecr=970408735"
"103","2018-05-25 14:01:29.767889","192.168.2.3","34.208.66.202","TCP","1414","53801  >  3491 [ACK] Seq=90856 Ack=1 Win=6800 Len=1348 TSval=4294964385 TSecr=970408735"
"104","2018-05-25 14:01:29.768200","192.168.2.3","34.208.66.202","TCP","521","53801  >  3491 [PSH, ACK] Seq=92204 Ack=1 Win=6800 Len=455 TSval=4294964385 TSecr=970408745"
"105","2018-05-25 14:01:29.773946","192.168.2.3","34.208.66.202","TCP","1414","53801  >  3491 [ACK] Seq=92659 Ack=1 Win=6800 Len=1348 TSval=4294964387 TSecr=970408745"
"107","2018-05-25 14:01:29.810548","192.168.2.3","34.208.66.202","TCP","1414","53801  >  3491 [ACK] Seq=94007 Ack=1 Win=6800 Len=1348 TSval=4294964388 TSecr=970408745"
"108","2018-05-25 14:01:29.810956","192.168.2.3","34.208.66.202","TCP","1414","53801  >  3491 [ACK] Seq=95355 Ack=1 Win=6800 Len=1348 TSval=4294964390 TSecr=970408755"
"109","2018-05-25 14:01:29.820902","192.168.2.3","34.208.66.202","TCP","1414","53801  >  3491 [ACK] Seq=96703 Ack=1 Win=6800 Len=1348 TSval=4294964391 TSecr=970408755"
"113","2018-05-25 14:01:29.921945","192.168.2.3","34.208.66.202","TCP","1003","53801  >  3491 [PSH, ACK] Seq=98051 Ack=1 Win=6800 Len=937 TSval=4294964401 TSecr=970408785"
"115","2018-05-25 14:01:29.981299","192.168.2.3","34.208.66.202","TCP","1414","53801  >  3491 [ACK] Seq=98988 Ack=1 Win=6800 Len=1348 TSval=4294964406 TSecr=970408785"
"117","2018-05-25 14:01:30.077333","192.168.2.3","34.208.66.202","TCP","951","53801  >  3491 [PSH, ACK] Seq=100336 Ack=1 Win=6800 Len=885 TSval=4294964416 TSecr=970408821"
"118","2018-05-25 14:01:30.104503","192.168.2.3","34.208.66.202","TCP","1414","53801  >  3491 [ACK] Seq=101221 Ack=1 Win=6800 Len=1348 TSval=4294964420 TSecr=970408821"
"119","2018-05-25 14:01:30.113566","192.168.2.3","34.208.66.202","TCP","1414","53801  >  3491 [ACK] Seq=102569 Ack=1 Win=6800 Len=1348 TSval=4294964421 TSecr=970408821"
"121","2018-05-25 14:01:30.128008","192.168.2.3","34.208.66.202","TCP","1414","53801  >  3491 [ACK] Seq=103917 Ack=1 Win=6800 Len=1348 TSval=4294964422 TSecr=970408835"
"122","2018-05-25 14:01:30.140423","192.168.2.3","34.208.66.202","TCP","1414","53801  >  3491 [ACK] Seq=105265 Ack=1 Win=6800 Len=1348 TSval=4294964423 TSecr=970408835"
"124","2018-05-25 14:01:30.217258","192.168.2.3","34.208.66.202","TCP","1414","53801  >  3491 [ACK] Seq=106613 Ack=1 Win=6800 Len=1348 TSval=4294964431 TSecr=970408835"
"125","2018-05-25 14:01:30.217261","192.168.2.3","34.208.66.202","TCP","375","53801  >  3491 [PSH, ACK] Seq=107961 Ack=1 Win=6800 Len=309 TSval=4294964431 TSecr=970408859"
"130","2018-05-25 14:01:30.278098","192.168.2.3","34.208.66.202","TCP","1414","53801  >  3491 [ACK] Seq=108270 Ack=1 Win=6800 Len=1348 TSval=4294964433 TSecr=970408859"
"133","2018-05-25 14:01:30.375599","192.168.2.3","34.208.66.202","TCP","1064","53801  >  3491 [PSH, ACK] Seq=109618 Ack=1 Win=6800 Len=998 TSval=4294964445 TSecr=970408894"
"134","2018-05-25 14:01:30.375603","192.168.2.3","34.208.66.202","TCP","1414","53801  >  3491 [ACK] Seq=110616 Ack=1 Win=6800 Len=1348 TSval=4294964447 TSecr=970408894"
"135","2018-05-25 14:01:30.375667","192.168.2.3","34.208.66.202","TCP","1414","53801  >  3491 [ACK] Seq=111964 Ack=1 Win=6800 Len=1348 TSval=4294964447 TSecr=970408894"
"137","2018-05-25 14:01:30.477686","192.168.2.3","34.208.66.202","TCP","1414","53801  >  3491 [ACK] Seq=113312 Ack=1 Win=6800 Len=1348 TSval=4294964454 TSecr=970408910"
"138","2018-05-25 14:01:30.477690","192.168.2.3","34.208.66.202","TCP","1414","53801  >  3491 [ACK] Seq=114660 Ack=1 Win=6800 Len=1348 TSval=4294964456 TSecr=970408910"
"142","2018-05-25 14:01:30.536290","192.168.2.3","34.208.66.202","TCP","998","53801  >  3491 [PSH, ACK] Seq=116008 Ack=1 Win=6800 Len=932 TSval=4294964461 TSecr=970408934"
"143","2018-05-25 14:01:30.610563","192.168.2.3","34.208.66.202","TCP","1414","53801  >  3491 [ACK] Seq=116940 Ack=1 Win=6800 Len=1348 TSval=4294964469 TSecr=970408934"
"146","2018-05-25 14:01:30.631091","192.168.2.3","34.208.66.202","TCP","1414","53801  >  3491 [ACK] Seq=118288 Ack=1 Win=6800 Len=1348 TSval=4294964471 TSecr=970408934"
"148","2018-05-25 14:01:30.691696","192.168.2.3","34.208.66.202","TCP","1073","53801  >  3491 [PSH, ACK] Seq=119636 Ack=1 Win=6800 Len=1007 TSval=4294964477 TSecr=970408974"
"151","2018-05-25 14:01:30.788904","192.168.2.3","34.208.66.202","TCP","1414","53801  >  3491 [ACK] Seq=120643 Ack=1 Win=6800 Len=1348 TSval=4294964485 TSecr=970408993"
"152","2018-05-25 14:01:30.788907","192.168.2.3","34.208.66.202","TCP","1414","53801  >  3491 [ACK] Seq=121991 Ack=1 Win=6800 Len=1348 TSval=4294964486 TSecr=970408993"
"153","2018-05-25 14:01:30.789209","192.168.2.3","34.208.66.202","TCP","1414","53801  >  3491 [ACK] Seq=123339 Ack=1 Win=6800 Len=1348 TSval=4294964487 TSecr=970408993"
"154","2018-05-25 14:01:30.843706","192.168.2.3","34.208.66.202","TCP","1414","53801  >  3491 [ACK] Seq=124687 Ack=1 Win=6800 Len=1348 TSval=4294964494 TSecr=970408998"
"156","2018-05-25 14:01:30.900406","192.168.2.3","34.208.66.202","TCP","1414","53801  >  3491 [ACK] Seq=126035 Ack=1 Win=6800 Len=1348 TSval=4294964495 TSecr=970408998"
"157","2018-05-25 14:01:30.900408","192.168.2.3","34.208.66.202","TCP","1283","53801  >  3491 [PSH, ACK] Seq=127383 Ack=1 Win=6800 Len=1217 TSval=4294964497 TSecr=970409024"
"167","2018-05-25 14:01:31.012168","192.168.2.3","34.208.66.202","TCP","1414","53801  >  3491 [ACK] Seq=128600 Ack=1 Win=6800 Len=1348 TSval=4294964509 TSecr=970409038"
"168","2018-05-25 14:01:31.025013","192.168.2.3","34.208.66.202","TCP","1414","53801  >  3491 [ACK] Seq=129948 Ack=1 Win=6800 Len=1348 TSval=4294964511 TSecr=970409038"
"171","2018-05-25 14:01:31.098247","192.168.2.3","34.208.66.202","TCP","1019","53801  >  3491 [PSH, ACK] Seq=131296 Ack=1 Win=6800 Len=953 TSval=4294964515 TSecr=970409068"
"184","2018-05-25 14:01:31.200406","192.168.2.3","34.208.66.202","TCP","1414","53801  >  3491 [ACK] Seq=132249 Ack=1 Win=6800 Len=1348 TSval=4294964525 TSecr=970409068"
"185","2018-05-25 14:01:31.200410","192.168.2.3","34.208.66.202","TCP","1414","53801  >  3491 [ACK] Seq=133597 Ack=1 Win=6800 Len=1348 TSval=4294964526 TSecr=970409068"
"186","2018-05-25 14:01:31.200690","192.168.2.3","34.208.66.202","TCP","1414","53801  >  3491 [ACK] Seq=134945 Ack=1 Win=6800 Len=1348 TSval=4294964526 TSecr=970409068"
"188","2018-05-25 14:01:31.239147","192.168.2.3","34.208.66.202","TCP","440","53801  >  3491 [PSH, ACK] Seq=136293 Ack=1 Win=6800 Len=374 TSval=4294964533 TSecr=970409115"
"190","2018-05-25 14:01:31.324696","192.168.2.3","34.208.66.202","TCP","1414","53801  >  3491 [ACK] Seq=136667 Ack=1 Win=6800 Len=1348 TSval=4294964542 TSecr=970409115"
"194","2018-05-25 14:01:31.338241","192.168.2.3","34.208.66.202","TCP","1414","53801  >  3491 [ACK] Seq=138015 Ack=1 Win=6800 Len=1348 TSval=4294964543 TSecr=970409115"
"196","2018-05-25 14:01:31.343639","192.168.2.3","34.208.66.202","TCP","1414","53801  >  3491 [ACK] Seq=139363 Ack=1 Win=6800 Len=1348 TSval=4294964544 TSecr=970409140"
"198","2018-05-25 14:01:31.400590","192.168.2.3","34.208.66.202","TCP","1414","53801  >  3491 [ACK] Seq=140711 Ack=1 Win=6800 Len=1348 TSval=4294964546 TSecr=970409140"
"199","2018-05-25 14:01:31.400592","192.168.2.3","34.208.66.202","TCP","1414","53801  >  3491 [ACK] Seq=142059 Ack=1 Win=6800 Len=1348 TSval=4294964547 TSecr=970409140"
"200","2018-05-25 14:01:31.400593","192.168.2.3","34.208.66.202","TCP","429","53801  >  3491 [PSH, ACK] Seq=143407 Ack=1 Win=6800 Len=363 TSval=4294964547 TSecr=970409150"
"201","2018-05-25 14:01:31.400800","192.168.2.3","34.208.66.202","TCP","1414","53801  >  3491 [ACK] Seq=143770 Ack=1 Win=6800 Len=1348 TSval=4294964549 TSecr=970409150"
"202","2018-05-25 14:01:31.427642","192.168.2.3","34.208.66.202","TCP","1414","53801  >  3491 [ACK] Seq=145118 Ack=1 Win=6800 Len=1348 TSval=4294964551 TSecr=970409150"
"203","2018-05-25 14:01:31.455600","192.168.2.3","34.208.66.202","TCP","1414","53801  >  3491 [ACK] Seq=146466 Ack=1 Win=6800 Len=1348 TSval=4294964555 TSecr=970409150"
"207","2018-05-25 14:01:31.561110","192.168.2.3","34.208.66.202","TCP","1414","53801  >  3491 [ACK] Seq=147814 Ack=1 Win=6800 Len=1348 TSval=4294964556 TSecr=970409150"
"208","2018-05-25 14:01:31.561129","192.168.2.3","34.208.66.202","TCP","1414","53801  >  3491 [ACK] Seq=149162 Ack=1 Win=6800 Len=1348 TSval=4294964558 TSecr=970409150"
"209","2018-05-25 14:01:31.561610","192.168.2.3","34.208.66.202","TCP","1414","53801  >  3491 [ACK] Seq=150510 Ack=1 Win=6800 Len=1348 TSval=4294964560 TSecr=970409175"
"210","2018-05-25 14:01:31.561766","192.168.2.3","34.208.66.202","TCP","1414","53801  >  3491 [ACK] Seq=151858 Ack=1 Win=6800 Len=1348 TSval=4294964561 TSecr=970409175"
"211","2018-05-25 14:01:31.562017","192.168.2.3","34.208.66.202","TCP","1414","53801  >  3491 [ACK] Seq=153206 Ack=1 Win=6800 Len=1348 TSval=4294964562 TSecr=970409175"
"212","2018-05-25 14:01:31.562019","192.168.2.3","34.208.66.202","TCP","1414","53801  >  3491 [ACK] Seq=154554 Ack=1 Win=6800 Len=1348 TSval=4294964564 TSecr=970409187"
"213","2018-05-25 14:01:31.562222","192.168.2.3","34.208.66.202","TCP","934","53801  >  3491 [PSH, ACK] Seq=155902 Ack=1 Win=6800 Len=868 TSval=4294964564 TSecr=970409192"
"214","2018-05-25 14:01:31.565678","192.168.2.3","34.208.66.202","TCP","1414","53801  >  3491 [ACK] Seq=156770 Ack=1 Win=6800 Len=1348 TSval=4294964566 TSecr=970409192"
"217","2018-05-25 14:01:31.604258","192.168.2.3","34.208.66.202","TCP","1414","53801  >  3491 [ACK] Seq=158118 Ack=1 Win=6800 Len=1348 TSval=4294964567 TSecr=970409192"
"218","2018-05-25 14:01:31.604260","192.168.2.3","34.208.66.202","TCP","1414","53801  >  3491 [ACK] Seq=159466 Ack=1 Win=6800 Len=1348 TSval=4294964569 TSecr=970409192"
"219","2018-05-25 14:01:31.619016","192.168.2.3","34.208.66.202","TCP","1414","53801  >  3491 [ACK] Seq=160814 Ack=1 Win=6800 Len=1348 TSval=4294964571 TSecr=970409206"
"220","2018-05-25 14:01:31.637006","192.168.2.3","34.208.66.202","TCP","1414","53801  >  3491 [ACK] Seq=162162 Ack=1 Win=6800 Len=1348 TSval=4294964573 TSecr=970409206"
"221","2018-05-25 14:01:31.654152","192.168.2.3","34.208.66.202","TCP","1414","53801  >  3491 [ACK] Seq=163510 Ack=1 Win=6800 Len=1348 TSval=4294964575 TSecr=970409206"
"222","2018-05-25 14:01:31.671331","192.168.2.3","34.208.66.202","TCP","1414","53801  >  3491 [ACK] Seq=164858 Ack=1 Win=6800 Len=1348 TSval=4294964576 TSecr=970409206"
"223","2018-05-25 14:01:31.689369","192.168.2.3","34.208.66.202","TCP","1414","53801  >  3491 [ACK] Seq=166206 Ack=1 Win=6800 Len=1348 TSval=4294964578 TSecr=970409206"
"225","2018-05-25 14:01:31.706657","192.168.2.3","34.208.66.202","TCP","1414","53801  >  3491 [ACK] Seq=167554 Ack=1 Win=6800 Len=1348 TSval=4294964580 TSecr=970409206"
"226","2018-05-25 14:01:31.713660","192.168.2.3","34.208.66.202","TCP","934","53801  >  3491 [PSH, ACK] Seq=168902 Ack=1 Win=6800 Len=868 TSval=4294964580 TSecr=970409232"
"227","2018-05-25 14:01:31.730018","192.168.2.3","34.208.66.202","TCP","1414","53801  >  3491 [ACK] Seq=169770 Ack=1 Win=6800 Len=1348 TSval=4294964582 TSecr=970409232"
"228","2018-05-25 14:01:31.738064","192.168.2.3","34.208.66.202","TCP","1414","53801  >  3491 [ACK] Seq=171118 Ack=1 Win=6800 Len=1348 TSval=4294964583 TSecr=970409232"
"230","2018-05-25 14:01:31.758049","192.168.2.3","34.208.66.202","TCP","1414","53801  >  3491 [ACK] Seq=172466 Ack=1 Win=6800 Len=1348 TSval=4294964585 TSecr=970409242"
"231","2018-05-25 14:01:31.772791","192.168.2.3","34.208.66.202","TCP","1414","53801  >  3491 [ACK] Seq=173814 Ack=1 Win=6800 Len=1348 TSval=4294964587 TSecr=970409242"
"234","2018-05-25 14:01:31.823300","192.168.2.3","34.208.66.202","TCP","1414","53801  >  3491 [ACK] Seq=175162 Ack=1 Win=6800 Len=1348 TSval=4294964588 TSecr=970409242"
"235","2018-05-25 14:01:31.823522","192.168.2.3","34.208.66.202","TCP","1414","53801  >  3491 [ACK] Seq=176510 Ack=1 Win=6800 Len=1348 TSval=4294964591 TSecr=970409251"
"236","2018-05-25 14:01:31.835673","192.168.2.3","34.208.66.202","TCP","1414","53801  >  3491 [ACK] Seq=177858 Ack=1 Win=6800 Len=1348 TSval=4294964593 TSecr=970409260"
"237","2018-05-25 14:01:31.843192","192.168.2.3","34.208.66.202","TCP","1414","53801  >  3491 [ACK] Seq=179206 Ack=1 Win=6800 Len=1348 TSval=4294964594 TSecr=970409260"
"239","2018-05-25 14:01:31.861063","192.168.2.3","34.208.66.202","TCP","1282","53801  >  3491 [PSH, ACK] Seq=180554 Ack=1 Win=6800 Len=1216 TSval=4294964595 TSecr=970409270"
"243","2018-05-25 14:01:31.916505","192.168.2.3","34.208.66.202","TCP","1414","53801  >  3491 [ACK] Seq=181770 Ack=1 Win=6800 Len=1348 TSval=4294964598 TSecr=970409270"
"244","2018-05-25 14:01:31.916509","192.168.2.3","34.208.66.202","TCP","1414","53801  >  3491 [ACK] Seq=183118 Ack=1 Win=6800 Len=1348 TSval=4294964599 TSecr=970409270"
"245","2018-05-25 14:01:31.920816","192.168.2.3","34.208.66.202","TCP","1414","53801  >  3491 [ACK] Seq=184466 Ack=1 Win=6800 Len=1348 TSval=4294964601 TSecr=970409280"
"246","2018-05-25 14:01:31.936375","192.168.2.3","34.208.66.202","TCP","1414","53801  >  3491 [ACK] Seq=185814 Ack=1 Win=6800 Len=1348 TSval=4294964602 TSecr=970409284"
"247","2018-05-25 14:01:31.936680","192.168.2.3","34.208.66.202","TCP","1414","53801  >  3491 [ACK] Seq=187162 Ack=1 Win=6800 Len=1348 TSval=4294964602 TSecr=970409284"
"250","2018-05-25 14:01:31.958182","192.168.2.3","34.208.66.202","TCP","1414","53801  >  3491 [ACK] Seq=188510 Ack=1 Win=6800 Len=1348 TSval=4294964605 TSecr=970409284"
"252","2018-05-25 14:01:31.965398","192.168.2.3","34.208.66.202","TCP","1414","53801  >  3491 [ACK] Seq=189858 Ack=1 Win=6800 Len=1348 TSval=4294964606 TSecr=970409284"
"253","2018-05-25 14:01:31.974885","192.168.2.3","34.208.66.202","TCP","1414","53801  >  3491 [ACK] Seq=191206 Ack=1 Win=6800 Len=1348 TSval=4294964607 TSecr=970409296"
"255","2018-05-25 14:01:32.015171","192.168.2.3","34.208.66.202","TCP","1414","53801  >  3491 [ACK] Seq=192554 Ack=1 Win=6800 Len=1348 TSval=4294964608 TSecr=970409296"
"256","2018-05-25 14:01:32.015174","192.168.2.3","34.208.66.202","TCP","1414","53801  >  3491 [ACK] Seq=193902 Ack=1 Win=6800 Len=1348 TSval=4294964610 TSecr=970409296"
"257","2018-05-25 14:01:32.015175","192.168.2.3","34.208.66.202","TCP","200","53801  >  3491 [PSH, ACK] Seq=195250 Ack=1 Win=6800 Len=134 TSval=4294964610 TSecr=970409306"
"258","2018-05-25 14:01:32.015517","192.168.2.3","34.208.66.202","TCP","1414","53801  >  3491 [ACK] Seq=195384 Ack=1 Win=6800 Len=1348 TSval=4294964610 TSecr=970409306"
"259","2018-05-25 14:01:32.044203","192.168.2.3","34.208.66.202","TCP","1414","53801  >  3491 [ACK] Seq=196732 Ack=1 Win=6800 Len=1348 TSval=4294964614 TSecr=970409306"
"260","2018-05-25 14:01:32.045068","192.168.2.3","34.208.66.202","TCP","1414","53801  >  3491 [ACK] Seq=198080 Ack=1 Win=6800 Len=1348 TSval=4294964614 TSecr=970409306"
"261","2018-05-25 14:01:32.071671","192.168.2.3","34.208.66.202","TCP","1414","53801  >  3491 [ACK] Seq=199428 Ack=1 Win=6800 Len=1348 TSval=4294964616 TSecr=970409306"
"270","2018-05-25 14:01:32.121130","192.168.2.3","34.208.66.202","TCP","1414","53801  >  3491 [ACK] Seq=200776 Ack=1 Win=6800 Len=1348 TSval=4294964620 TSecr=970409325"
"271","2018-05-25 14:01:32.121132","192.168.2.3","34.208.66.202","TCP","1414","53801  >  3491 [ACK] Seq=202124 Ack=1 Win=6800 Len=1348 TSval=4294964621 TSecr=970409325"
"272","2018-05-25 14:01:32.128951","192.168.2.3","34.208.66.202","TCP","1414","53801  >  3491 [ACK] Seq=203472 Ack=1 Win=6800 Len=1348 TSval=4294964622 TSecr=970409335"
"273","2018-05-25 14:01:32.142672","192.168.2.3","34.208.66.202","TCP","1414","53801  >  3491 [ACK] Seq=204820 Ack=1 Win=6800 Len=1348 TSval=4294964624 TSecr=970409335"
"274","2018-05-25 14:01:32.161314","192.168.2.3","34.208.66.202","TCP","1414","53801  >  3491 [ACK] Seq=206168 Ack=1 Win=6800 Len=1348 TSval=4294964625 TSecr=970409335"
"276","2018-05-25 14:01:32.172149","192.168.2.3","34.208.66.202","TCP","1414","53801  >  3491 [ACK] Seq=207516 Ack=1 Win=6800 Len=1348 TSval=4294964626 TSecr=970409335"
"277","2018-05-25 14:01:32.172153","192.168.2.3","34.208.66.202","TCP","425","53801  >  3491 [PSH, ACK] Seq=208864 Ack=1 Win=6800 Len=359 TSval=4294964626 TSecr=970409347"
"279","2018-05-25 14:01:32.226413","192.168.2.3","34.208.66.202","TCP","1414","53801  >  3491 [ACK] Seq=209223 Ack=1 Win=6800 Len=1348 TSval=4294964629 TSecr=970409353"
"280","2018-05-25 14:01:32.226417","192.168.2.3","34.208.66.202","TCP","1414","53801  >  3491 [ACK] Seq=210571 Ack=1 Win=6800 Len=1348 TSval=4294964629 TSecr=970409353"
"281","2018-05-25 14:01:32.240225","192.168.2.3","34.208.66.202","TCP","1414","53801  >  3491 [ACK] Seq=211919 Ack=1 Win=6800 Len=1348 TSval=4294964633 TSecr=970409353"
"282","2018-05-25 14:01:32.240229","192.168.2.3","34.208.66.202","TCP","1414","53801  >  3491 [ACK] Seq=213267 Ack=1 Win=6800 Len=1348 TSval=4294964633 TSecr=970409353"
"296","2018-05-25 14:01:32.326758","192.168.2.3","34.208.66.202","TCP","1414","53801  >  3491 [ACK] Seq=214615 Ack=1 Win=6800 Len=1348 TSval=4294964636 TSecr=970409370"
"297","2018-05-25 14:01:32.326761","192.168.2.3","34.208.66.202","TCP","1414","53801  >  3491 [ACK] Seq=215963 Ack=1 Win=6800 Len=1348 TSval=4294964636 TSecr=970409370"
"298","2018-05-25 14:01:32.326915","192.168.2.3","34.208.66.202","TCP","154","53801  >  3491 [PSH, ACK] Seq=217311 Ack=1 Win=6800 Len=88 TSval=4294964641 TSecr=970409383"
"303","2018-05-25 14:01:32.423488","192.168.2.3","34.208.66.202","TCP","1414","53801  >  3491 [ACK] Seq=217399 Ack=1 Win=6800 Len=1348 TSval=4294964651 TSecr=970409400"
"304","2018-05-25 14:01:32.437339","192.168.2.3","34.208.66.202","TCP","1414","53801  >  3491 [ACK] Seq=218747 Ack=1 Win=6800 Len=1348 TSval=4294964653 TSecr=970409400"
"305","2018-05-25 14:01:32.437343","192.168.2.3","34.208.66.202","TCP","1414","53801  >  3491 [ACK] Seq=220095 Ack=1 Win=6800 Len=1348 TSval=4294964653 TSecr=970409400"
"317","2018-05-25 14:01:32.543755","192.168.2.3","34.208.66.202","TCP","609","53801  >  3491 [PSH, ACK] Seq=221443 Ack=1 Win=6800 Len=543 TSval=4294964660 TSecr=970409433"
"321","2018-05-25 14:01:32.589158","192.168.2.3","34.208.66.202","TCP","1414","53801  >  3491 [ACK] Seq=221986 Ack=1 Win=6800 Len=1348 TSval=4294964668 TSecr=970409449"
"324","2018-05-25 14:01:32.629544","192.168.2.3","34.208.66.202","TCP","1414","53801  >  3491 [ACK] Seq=223334 Ack=1 Win=6800 Len=1348 TSval=4294964669 TSecr=970409449"
"335","2018-05-25 14:01:32.672626","192.168.2.3","34.208.66.202","TCP","1414","53801  >  3491 [ACK] Seq=224682 Ack=1 Win=6800 Len=1348 TSval=4294964676 TSecr=970409449"
"337","2018-05-25 14:01:32.686807","192.168.2.3","34.208.66.202","TCP","1414","53801  >  3491 [ACK] Seq=226030 Ack=1 Win=6800 Len=1348 TSval=4294964678 TSecr=970409449"
"339","2018-05-25 14:01:32.737655","192.168.2.3","34.208.66.202","TCP","763","53801  >  3491 [PSH, ACK] Seq=227378 Ack=1 Win=6800 Len=697 TSval=4294964678 TSecr=970409476"
"344","2018-05-25 14:01:32.941182","192.168.2.3","34.208.66.202","TCP","1414","53801  >  3491 [ACK] Seq=228075 Ack=1 Win=6800 Len=1348 TSval=4294964685 TSecr=970409487"
"345","2018-05-25 14:01:32.941450","192.168.2.3","34.208.66.202","TCP","1414","53801  >  3491 [ACK] Seq=229423 Ack=1 Win=6800 Len=1348 TSval=4294964693 TSecr=970409512"
"346","2018-05-25 14:01:32.941452","192.168.2.3","34.208.66.202","TCP","1414","53801  >  3491 [ACK] Seq=230771 Ack=1 Win=6800 Len=1348 TSval=4294964696 TSecr=970409512"
"347","2018-05-25 14:01:32.941809","192.168.2.3","34.208.66.202","TCP","1414","53801  >  3491 [ACK] Seq=232119 Ack=1 Win=6800 Len=1348 TSval=4294964696 TSecr=970409512"
"348","2018-05-25 14:01:32.941812","192.168.2.3","34.208.66.202","TCP","645","53801  >  3491 [PSH, ACK] Seq=233467 Ack=1 Win=6800 Len=579 TSval=4294964697 TSecr=970409524"
"349","2018-05-25 14:01:32.957731","192.168.2.3","34.208.66.202","TCP","1414","53801  >  3491 [ACK] Seq=234046 Ack=1 Win=6800 Len=1348 TSval=4294964705 TSecr=970409524"
"350","2018-05-25 14:01:32.957733","192.168.2.3","34.208.66.202","TCP","1414","53801  >  3491 [ACK] Seq=235394 Ack=1 Win=6800 Len=1348 TSval=4294964705 TSecr=970409524"
"354","2018-05-25 14:01:33.037030","192.168.2.3","34.208.66.202","TCP","1414","53801  >  3491 [ACK] Seq=236742 Ack=1 Win=6800 Len=1348 TSval=4294964713 TSecr=970409524"
"355","2018-05-25 14:01:33.043823","192.168.2.3","34.208.66.202","TCP","1414","53801  >  3491 [ACK] Seq=238090 Ack=1 Win=6800 Len=1348 TSval=4294964714 TSecr=970409524"
"361","2018-05-25 14:01:33.098440","192.168.2.3","34.208.66.202","TCP","888","53801  >  3491 [PSH, ACK] Seq=239438 Ack=1 Win=6800 Len=822 TSval=4294964719 TSecr=970409576"
"363","2018-05-25 14:01:33.175161","192.168.2.3","34.208.66.202","TCP","1414","53801  >  3491 [ACK] Seq=240260 Ack=1 Win=6800 Len=1348 TSval=4294964727 TSecr=970409583"
"366","2018-05-25 14:01:33.255767","192.168.2.3","34.208.66.202","TCP","1414","53801  >  3491 [ACK] Seq=241608 Ack=1 Win=6800 Len=1348 TSval=4294964728 TSecr=970409583"
"367","2018-05-25 14:01:33.255925","192.168.2.3","34.208.66.202","TCP","1414","53801  >  3491 [ACK] Seq=242956 Ack=1 Win=6800 Len=1348 TSval=4294964735 TSecr=970409606"
"368","2018-05-25 14:01:33.270048","192.168.2.3","34.208.66.202","TCP","1414","53801  >  3491 [ACK] Seq=244304 Ack=1 Win=6800 Len=1348 TSval=4294964736 TSecr=970409606"
"370","2018-05-25 14:01:33.291417","192.168.2.3","34.208.66.202","TCP","1146","53801  >  3491 [PSH, ACK] Seq=245652 Ack=1 Win=6800 Len=1080 TSval=4294964738 TSecr=970409626"
"371","2018-05-25 14:01:33.306051","192.168.2.3","34.208.66.202","TCP","1414","53801  >  3491 [ACK] Seq=246732 Ack=1 Win=6800 Len=1348 TSval=4294964740 TSecr=970409626"
"372","2018-05-25 14:01:33.317714","192.168.2.3","34.208.66.202","TCP","1414","53801  >  3491 [ACK] Seq=248080 Ack=1 Win=6800 Len=1348 TSval=4294964741 TSecr=970409626"
"373","2018-05-25 14:01:33.336282","192.168.2.3","34.208.66.202","TCP","1414","53801  >  3491 [ACK] Seq=249428 Ack=1 Win=6800 Len=1348 TSval=4294964743 TSecr=970409626"
"374","2018-05-25 14:01:33.345206","192.168.2.3","34.208.66.202","TCP","1414","53801  >  3491 [ACK] Seq=250776 Ack=1 Win=6800 Len=1348 TSval=4294964744 TSecr=970409626"
"375","2018-05-25 14:01:33.356619","192.168.2.3","34.208.66.202","TCP","1414","53801  >  3491 [ACK] Seq=252124 Ack=1 Win=6800 Len=1348 TSval=4294964745 TSecr=970409626"
"376","2018-05-25 14:01:33.375194","192.168.2.3","34.208.66.202","TCP","1414","53801  >  3491 [ACK] Seq=253472 Ack=1 Win=6800 Len=1348 TSval=4294964747 TSecr=970409626"
"377","2018-05-25 14:01:33.388999","192.168.2.3","34.208.66.202","TCP","1414","53801  >  3491 [ACK] Seq=254820 Ack=1 Win=6800 Len=1348 TSval=4294964748 TSecr=970409626"
"378","2018-05-25 14:01:33.403663","192.168.2.3","34.208.66.202","TCP","1414","53801  >  3491 [ACK] Seq=256168 Ack=1 Win=6800 Len=1348 TSval=4294964750 TSecr=970409626"
"380","2018-05-25 14:01:33.450283","192.168.2.3","34.208.66.202","TCP","1414","53801  >  3491 [ACK] Seq=257516 Ack=1 Win=6800 Len=1348 TSval=4294964752 TSecr=970409626"
"381","2018-05-25 14:01:33.450286","192.168.2.3","34.208.66.202","TCP","934","53801  >  3491 [PSH, ACK] Seq=258864 Ack=1 Win=6800 Len=868 TSval=4294964752 TSecr=970409663"
"403","2018-05-25 14:01:33.655660","192.168.2.3","34.208.66.202","TCP","1414","53801  >  3491 [ACK] Seq=259732 Ack=1 Win=6800 Len=1348 TSval=4294964755 TSecr=970409663"
"404","2018-05-25 14:01:33.655664","192.168.2.3","34.208.66.202","TCP","1414","53801  >  3491 [ACK] Seq=261080 Ack=1 Win=6800 Len=1348 TSval=4294964756 TSecr=970409663"
"405","2018-05-25 14:01:33.655940","192.168.2.3","34.208.66.202","TCP","1414","53801  >  3491 [ACK] Seq=262428 Ack=1 Win=6800 Len=1348 TSval=4294964759 TSecr=970409676"
"406","2018-05-25 14:01:33.657968","192.168.2.3","34.208.66.202","TCP","1414","53801  >  3491 [ACK] Seq=263776 Ack=1 Win=6800 Len=1348 TSval=4294964760 TSecr=970409676"
"407","2018-05-25 14:01:33.657970","192.168.2.3","34.208.66.202","TCP","1414","53801  >  3491 [ACK] Seq=265124 Ack=1 Win=6800 Len=1348 TSval=4294964761 TSecr=970409676"
"408","2018-05-25 14:01:33.657970","192.168.2.3","34.208.66.202","TCP","1414","53801  >  3491 [ACK] Seq=266472 Ack=1 Win=6800 Len=1348 TSval=4294964764 TSecr=970409692"
"409","2018-05-25 14:01:33.657971","192.168.2.3","34.208.66.202","TCP","1414","53801  >  3491 [ACK] Seq=267820 Ack=1 Win=6800 Len=1348 TSval=4294964766 TSecr=970409692"
"410","2018-05-25 14:01:33.657972","192.168.2.3","34.208.66.202","TCP","1414","53801  >  3491 [ACK] Seq=269168 Ack=1 Win=6800 Len=1348 TSval=4294964767 TSecr=970409692"
"411","2018-05-25 14:01:33.657973","192.168.2.3","34.208.66.202","TCP","1414","53801  >  3491 [ACK] Seq=270516 Ack=1 Win=6800 Len=1348 TSval=4294964769 TSecr=970409692"
"412","2018-05-25 14:01:33.657974","192.168.2.3","34.208.66.202","TCP","934","53801  >  3491 [PSH, ACK] Seq=271864 Ack=1 Win=6800 Len=868 TSval=4294964770 TSecr=970409707"
"413","2018-05-25 14:01:33.657975","192.168.2.3","34.208.66.202","TCP","1414","53801  >  3491 [ACK] Seq=272732 Ack=1 Win=6800 Len=1348 TSval=4294964773 TSecr=970409707"
"414","2018-05-25 14:01:33.657975","192.168.2.3","34.208.66.202","TCP","1414","53801  >  3491 [ACK] Seq=274080 Ack=1 Win=6800 Len=1348 TSval=4294964775 TSecr=970409707"
"415","2018-05-25 14:01:33.690418","192.168.2.3","34.208.66.202","TCP","1414","53801  >  3491 [ACK] Seq=275428 Ack=1 Win=6800 Len=1348 TSval=4294964778 TSecr=970409707"
"416","2018-05-25 14:01:33.698940","192.168.2.3","34.208.66.202","TCP","1414","53801  >  3491 [ACK] Seq=276776 Ack=1 Win=6800 Len=1348 TSval=4294964779 TSecr=970409707"
"418","2018-05-25 14:01:33.713690","192.168.2.3","34.208.66.202","TCP","1414","53801  >  3491 [ACK] Seq=278124 Ack=1 Win=6800 Len=1348 TSval=4294964781 TSecr=970409707"
"425","2018-05-25 14:01:33.759178","192.168.2.3","34.208.66.202","TCP","1414","53801  >  3491 [ACK] Seq=279472 Ack=1 Win=6800 Len=1348 TSval=4294964783 TSecr=970409707"
"426","2018-05-25 14:01:33.759457","192.168.2.3","34.208.66.202","TCP","1414","53801  >  3491 [ACK] Seq=280820 Ack=1 Win=6800 Len=1348 TSval=4294964784 TSecr=970409707"
"427","2018-05-25 14:01:33.759615","192.168.2.3","34.208.66.202","TCP","1414","53801  >  3491 [ACK] Seq=282168 Ack=1 Win=6800 Len=1348 TSval=4294964785 TSecr=970409707"
"438","2018-05-25 14:01:33.777516","192.168.2.3","34.208.66.202","TCP","1414","53801  >  3491 [ACK] Seq=283516 Ack=1 Win=6800 Len=1348 TSval=4294964787 TSecr=970409707"
"449","2018-05-25 14:01:33.790246","192.168.2.3","34.208.66.202","TCP","1414","53801  >  3491 [ACK] Seq=284864 Ack=1 Win=6800 Len=1348 TSval=4294964788 TSecr=970409707"
"453","2018-05-25 14:01:33.799695","192.168.2.3","34.208.66.202","TCP","1414","53801  >  3491 [ACK] Seq=286212 Ack=1 Win=6800 Len=1348 TSval=4294964789 TSecr=970409707"
"456","2018-05-25 14:01:33.820885","192.168.2.3","34.208.66.202","TCP","1414","53801  >  3491 [ACK] Seq=287560 Ack=1 Win=6800 Len=1348 TSval=4294964791 TSecr=970409707"
"457","2018-05-25 14:01:33.820887","192.168.2.3","34.208.66.202","TCP","1110","53801  >  3491 [PSH, ACK] Seq=288908 Ack=1 Win=6800 Len=1044 TSval=4294964791 TSecr=970409759"
"458","2018-05-25 14:01:33.858647","192.168.2.3","34.208.66.202","TCP","1414","53801  >  3491 [ACK] Seq=289952 Ack=1 Win=6800 Len=1348 TSval=4294964793 TSecr=970409759"
"459","2018-05-25 14:01:33.872000","192.168.2.3","34.208.66.202","TCP","1414","53801  >  3491 [ACK] Seq=291300 Ack=1 Win=6800 Len=1348 TSval=4294964796 TSecr=970409759"
"461","2018-05-25 14:01:33.892122","192.168.2.3","34.208.66.202","TCP","1414","53801  >  3491 [ACK] Seq=292648 Ack=1 Win=6800 Len=1348 TSval=4294964798 TSecr=970409774"
"462","2018-05-25 14:01:33.892125","192.168.2.3","34.208.66.202","TCP","1414","53801  >  3491 [ACK] Seq=293996 Ack=1 Win=6800 Len=1348 TSval=4294964798 TSecr=970409774"
"463","2018-05-25 14:01:33.903835","192.168.2.3","34.208.66.202","TCP","1414","53801  >  3491 [ACK] Seq=295344 Ack=1 Win=6800 Len=1348 TSval=4294964800 TSecr=970409774"
"464","2018-05-25 14:01:33.903837","192.168.2.3","34.208.66.202","TCP","1414","53801  >  3491 [ACK] Seq=296692 Ack=1 Win=6800 Len=1348 TSval=4294964800 TSecr=970409774"
"467","2018-05-25 14:01:33.960900","192.168.2.3","34.208.66.202","TCP","1414","53801  >  3491 [ACK] Seq=298040 Ack=1 Win=6800 Len=1348 TSval=4294964803 TSecr=970409785"
