"No.","Time","Source","Destination","Protocol","Length","Info"
"8","2018-09-24 11:04:23.091730","192.168.2.3","192.168.2.1","TCP","183","8009  >  55495 [PSH, ACK] Seq=1 Ack=118 Win=277 Len=117 TSval=2205147 TSecr=1716195956 [TCP segment of a reassembled PDU]"
"13","2018-09-24 11:04:23.872003","192.168.2.3","8.8.8.8","DNS","89","Standard query 0xabed A connectivitycheck.gstatic.com"
"15","2018-09-24 11:04:23.927843","192.168.2.3","216.58.221.163","QUIC","1392","Client Hello, PKN: 1, CID: 3344534432719008961"
"16","2018-09-24 11:04:23.927848","192.168.2.3","216.58.221.163","QUIC","407","Payload (Encrypted), PKN: 2, CID: 3344534432719008961"
"20","2018-09-24 11:04:23.971343","192.168.2.3","216.58.221.163","QUIC","83","Payload (Encrypted), PKN: 3, CID: 3344534432719008961"
"21","2018-09-24 11:04:23.971348","192.168.2.3","216.58.221.163","QUIC","72","Payload (Encrypted), PKN: 4, CID: 3344534432719008961"
"23","2018-09-24 11:04:24.016556","192.168.2.3","216.58.221.163","QUIC","72","Payload (Encrypted), PKN: 5, CID: 3344534432719008961"
"29","2018-09-24 11:04:24.727702","192.168.2.3","192.168.2.5","TCP","93","55900  >  9000 [PSH, ACK] Seq=1 Ack=1 Win=410 Len=27 TSval=2205310 TSecr=48755"
"31","2018-09-24 11:04:24.773766","192.168.2.3","216.58.221.164","TLSv1.2","156","Application Data"
"32","2018-09-24 11:04:24.773771","192.168.2.3","216.58.221.164","TLSv1.2","104","Application Data"
"33","2018-09-24 11:04:24.773772","192.168.2.3","216.58.221.164","TLSv1.2","159","Application Data"
"38","2018-09-24 11:04:24.792410","192.168.2.3","216.58.221.164","TCP","1434","55403  >  443 [ACK] Seq=222 Ack=39 Win=1022 Len=1368 TSval=2205317 TSecr=535884991 [TCP segment of a reassembled PDU]"
"39","2018-09-24 11:04:24.792413","192.168.2.3","216.58.221.164","TCP","1434","55403  >  443 [ACK] Seq=1590 Ack=39 Win=1022 Len=1368 TSval=2205317 TSecr=535884991 [TCP segment of a reassembled PDU]"
"40","2018-09-24 11:04:24.792639","192.168.2.3","216.58.221.164","TLSv1.2","212","Application Data"
"41","2018-09-24 11:04:24.792640","192.168.2.3","216.58.221.164","TCP","1434","55403  >  443 [ACK] Seq=3104 Ack=39 Win=1022 Len=1368 TSval=2205317 TSecr=535884991 [TCP segment of a reassembled PDU]"
"42","2018-09-24 11:04:24.792777","192.168.2.3","216.58.221.164","TLSv1.2","836","Application Data"
"43","2018-09-24 11:04:24.793031","192.168.2.3","216.58.221.164","TCP","1434","55403  >  443 [ACK] Seq=5242 Ack=39 Win=1022 Len=1368 TSval=2205317 TSecr=535884991 [TCP segment of a reassembled PDU]"
"44","2018-09-24 11:04:24.793034","192.168.2.3","216.58.221.164","TCP","1434","55403  >  443 [ACK] Seq=6610 Ack=39 Win=1022 Len=1368 TSval=2205317 TSecr=535884991 [TCP segment of a reassembled PDU]"
"45","2018-09-24 11:04:24.793035","192.168.2.3","216.58.221.164","TLSv1.2","212","Application Data"
"46","2018-09-24 11:04:24.793223","192.168.2.3","216.58.221.164","TCP","1434","55403  >  443 [ACK] Seq=8124 Ack=39 Win=1022 Len=1368 TSval=2205317 TSecr=535884991 [TCP segment of a reassembled PDU]"
"47","2018-09-24 11:04:24.793630","192.168.2.3","216.58.221.164","TCP","1434","55403  >  443 [ACK] Seq=9492 Ack=39 Win=1022 Len=1368 TSval=2205317 TSecr=535884991 [TCP segment of a reassembled PDU]"
"53","2018-09-24 11:04:24.803804","192.168.2.3","216.58.221.164","TLSv1.2","1434","Application Data [TCP segment of a reassembled PDU]"
"54","2018-09-24 11:04:24.804120","192.168.2.3","216.58.221.164","TCP","1434","55403  >  443 [ACK] Seq=12228 Ack=39 Win=1022 Len=1368 TSval=2205318 TSecr=535885009 [TCP segment of a reassembled PDU]"
"55","2018-09-24 11:04:24.804122","192.168.2.3","216.58.221.164","TLSv1.2","1434","Application Data [TCP segment of a reassembled PDU]"
"56","2018-09-24 11:04:24.804252","192.168.2.3","216.58.221.164","TCP","1434","55403  >  443 [ACK] Seq=14964 Ack=39 Win=1022 Len=1368 TSval=2205318 TSecr=535885009 [TCP segment of a reassembled PDU]"
"57","2018-09-24 11:04:24.804623","192.168.2.3","216.58.221.164","TLSv1.2","1434","Application Data [TCP segment of a reassembled PDU]"
"58","2018-09-24 11:04:24.804625","192.168.2.3","216.58.221.164","TCP","1434","55403  >  443 [ACK] Seq=17700 Ack=39 Win=1022 Len=1368 TSval=2205318 TSecr=535885009 [TCP segment of a reassembled PDU]"
"59","2018-09-24 11:04:24.807533","192.168.2.3","216.58.221.164","TLSv1.2","1434","Application Data [TCP segment of a reassembled PDU]"
"60","2018-09-24 11:04:24.807535","192.168.2.3","216.58.221.164","TCP","1434","55403  >  443 [ACK] Seq=20436 Ack=39 Win=1022 Len=1368 TSval=2205319 TSecr=535885010 [TCP segment of a reassembled PDU]"
"61","2018-09-24 11:04:24.807860","192.168.2.3","216.58.221.164","TLSv1.2","1434","Application Data, Application Data"
"62","2018-09-24 11:04:24.807980","192.168.2.3","216.58.221.164","TCP","1434","55403  >  443 [ACK] Seq=23172 Ack=39 Win=1022 Len=1368 TSval=2205319 TSecr=535885010 [TCP segment of a reassembled PDU]"
"63","2018-09-24 11:04:24.808047","192.168.2.3","216.58.221.164","TLSv1.2","1434","Application Data [TCP segment of a reassembled PDU]"
"64","2018-09-24 11:04:24.808280","192.168.2.3","216.58.221.164","TLSv1.2","1434","Application Data [TCP segment of a reassembled PDU]"
"65","2018-09-24 11:04:24.808428","192.168.2.3","216.58.221.164","TCP","1434","55403  >  443 [ACK] Seq=27276 Ack=39 Win=1022 Len=1368 TSval=2205319 TSecr=535885010 [TCP segment of a reassembled PDU]"
"66","2018-09-24 11:04:24.808569","192.168.2.3","216.58.221.164","TLSv1.2","1434","Application Data [TCP segment of a reassembled PDU]"
"67","2018-09-24 11:04:24.808744","192.168.2.3","216.58.221.164","TCP","1434","55403  >  443 [ACK] Seq=30012 Ack=39 Win=1022 Len=1368 TSval=2205319 TSecr=535885010 [TCP segment of a reassembled PDU]"
"75","2018-09-24 11:04:24.815308","192.168.2.3","216.58.221.164","TLSv1.2","1434","Application Data [TCP segment of a reassembled PDU]"
"76","2018-09-24 11:04:24.815608","192.168.2.3","216.58.221.164","TCP","1434","55403  >  443 [ACK] Seq=32748 Ack=39 Win=1022 Len=1368 TSval=2205319 TSecr=535885021 [TCP segment of a reassembled PDU]"
"77","2018-09-24 11:04:24.815609","192.168.2.3","216.58.221.164","TCP","1434","55403  >  443 [ACK] Seq=34116 Ack=39 Win=1022 Len=1368 TSval=2205319 TSecr=535885021 [TCP segment of a reassembled PDU]"
"78","2018-09-24 11:04:24.815750","192.168.2.3","216.58.221.164","TLSv1.2","1434","Application Data [TCP segment of a reassembled PDU]"
"79","2018-09-24 11:04:24.816093","192.168.2.3","216.58.221.164","TCP","1434","55403  >  443 [ACK] Seq=36852 Ack=39 Win=1022 Len=1368 TSval=2205319 TSecr=535885021 [TCP segment of a reassembled PDU]"
"80","2018-09-24 11:04:24.816095","192.168.2.3","216.58.221.164","TLSv1.2","1434","Application Data [TCP segment of a reassembled PDU]"
"81","2018-09-24 11:04:24.816266","192.168.2.3","216.58.221.164","TCP","1434","55403  >  443 [ACK] Seq=39588 Ack=39 Win=1022 Len=1368 TSval=2205319 TSecr=535885021 [TCP segment of a reassembled PDU]"
"82","2018-09-24 11:04:24.816288","192.168.2.3","216.58.221.164","TLSv1.2","1434","Application Data [TCP segment of a reassembled PDU]"
"83","2018-09-24 11:04:24.816758","192.168.2.3","216.58.221.164","TLSv1.2","1434","Application Data [TCP segment of a reassembled PDU]"
"90","2018-09-24 11:04:24.830792","192.168.2.3","216.58.221.164","TCP","1434","55403  >  443 [ACK] Seq=43692 Ack=39 Win=1022 Len=1368 TSval=2205320 TSecr=535885024 [TCP segment of a reassembled PDU]"
"91","2018-09-24 11:04:24.830795","192.168.2.3","216.58.221.164","TLSv1.2","1434","Application Data [TCP segment of a reassembled PDU]"
"92","2018-09-24 11:04:24.831181","192.168.2.3","216.58.221.164","TCP","1434","55403  >  443 [ACK] Seq=46428 Ack=39 Win=1022 Len=1368 TSval=2205320 TSecr=535885024 [TCP segment of a reassembled PDU]"
"93","2018-09-24 11:04:24.831184","192.168.2.3","216.58.221.164","TCP","1434","55403  >  443 [ACK] Seq=47796 Ack=39 Win=1022 Len=1368 TSval=2205320 TSecr=535885025 [TCP segment of a reassembled PDU]"
"94","2018-09-24 11:04:24.831336","192.168.2.3","216.58.221.164","TLSv1.2","1434","Application Data [TCP segment of a reassembled PDU]"
"96","2018-09-24 11:04:24.831752","192.168.2.3","216.58.221.164","TCP","1434","55403  >  443 [ACK] Seq=50532 Ack=39 Win=1022 Len=1368 TSval=2205320 TSecr=535885025 [TCP segment of a reassembled PDU]"
"97","2018-09-24 11:04:24.834813","192.168.2.3","216.58.221.164","TLSv1.2","1434","Application Data [TCP segment of a reassembled PDU]"
"98","2018-09-24 11:04:24.835053","192.168.2.3","216.58.221.164","TCP","1434","55403  >  443 [ACK] Seq=53268 Ack=39 Win=1022 Len=1368 TSval=2205321 TSecr=535885025 [TCP segment of a reassembled PDU]"
"100","2018-09-24 11:04:24.835302","192.168.2.3","216.58.221.164","TLSv1.2","1434","Application Data [TCP segment of a reassembled PDU]"
"102","2018-09-24 11:04:24.835590","192.168.2.3","216.58.221.164","TLSv1.2","1301","Application Data"
"104","2018-09-24 11:04:24.838172","192.168.2.3","216.58.221.163","QUIC","116","Payload (Encrypted), PKN: 6, CID: 3344534432719008961"
"108","2018-09-24 11:04:24.852197","192.168.2.3","216.58.221.164","TCP","1434","55403  >  443 [ACK] Seq=57239 Ack=39 Win=1022 Len=1368 TSval=2205323 TSecr=535885052 [TCP segment of a reassembled PDU]"
"109","2018-09-24 11:04:24.852202","192.168.2.3","216.58.221.164","TCP","1434","55403  >  443 [ACK] Seq=58607 Ack=39 Win=1022 Len=1368 TSval=2205323 TSecr=535885052 [TCP segment of a reassembled PDU]"
"110","2018-09-24 11:04:24.852396","192.168.2.3","216.58.221.164","TLSv1.2","212","Application Data"
"111","2018-09-24 11:04:24.852397","192.168.2.3","216.58.221.164","TCP","1434","55403  >  443 [ACK] Seq=60121 Ack=39 Win=1022 Len=1368 TSval=2205323 TSecr=535885052 [TCP segment of a reassembled PDU]"
"112","2018-09-24 11:04:24.852548","192.168.2.3","216.58.221.164","TLSv1.2","155","Application Data"
"115","2018-09-24 11:04:24.880903","192.168.2.3","216.58.221.163","QUIC","72","Payload (Encrypted), PKN: 7, CID: 3344534432719008961"
"116","2018-09-24 11:04:24.895171","192.168.2.3","216.58.221.174","TCP","66","39205  >  443 [ACK] Seq=1 Ack=1 Win=346 Len=0 TSval=2205328 TSecr=1030204444"
"119","2018-09-24 11:04:24.956080","192.168.2.3","216.58.221.164","TCP","1434","55403  >  443 [ACK] Seq=61578 Ack=39 Win=1022 Len=1368 TSval=2205334 TSecr=535885109 [TCP segment of a reassembled PDU]"
"120","2018-09-24 11:04:24.956383","192.168.2.3","216.58.221.164","TCP","1434","55403  >  443 [ACK] Seq=62946 Ack=39 Win=1022 Len=1368 TSval=2205334 TSecr=535885109 [TCP segment of a reassembled PDU]"
"121","2018-09-24 11:04:24.956385","192.168.2.3","216.58.221.164","TLSv1.2","212","Application Data"
"122","2018-09-24 11:04:24.956730","192.168.2.3","216.58.221.164","TCP","1434","55403  >  443 [ACK] Seq=64460 Ack=39 Win=1022 Len=1368 TSval=2205334 TSecr=535885109 [TCP segment of a reassembled PDU]"
"123","2018-09-24 11:04:24.956732","192.168.2.3","216.58.221.164","TLSv1.2","155","Application Data"
"129","2018-09-24 11:04:25.080629","192.168.2.3","216.58.221.164","TCP","1434","55403  >  443 [ACK] Seq=65917 Ack=39 Win=1022 Len=1368 TSval=2205346 TSecr=535885184 [TCP segment of a reassembled PDU]"
"130","2018-09-24 11:04:25.080643","192.168.2.3","216.58.221.164","TCP","1434","55403  >  443 [ACK] Seq=67285 Ack=39 Win=1022 Len=1368 TSval=2205346 TSecr=535885184 [TCP segment of a reassembled PDU]"
"131","2018-09-24 11:04:25.080685","192.168.2.3","216.58.221.164","TLSv1.2","212","Application Data"
"132","2018-09-24 11:04:25.080959","192.168.2.3","216.58.221.164","TLSv1.2","1390","Application Data"
"133","2018-09-24 11:04:25.080966","192.168.2.3","216.58.221.164","TCP","66","55403  >  443 [ACK] Seq=70123 Ack=273 Win=1022 Len=0 TSval=2205346 TSecr=535885286"
"138","2018-09-24 11:04:25.094779","192.168.2.3","216.58.221.164","TCP","66","55403  >  443 [ACK] Seq=70123 Ack=770 Win=1022 Len=0 TSval=2205347 TSecr=535885287"
"139","2018-09-24 11:04:25.181608","192.168.2.3","216.58.221.164","TCP","1434","55403  >  443 [ACK] Seq=70123 Ack=770 Win=1022 Len=1368 TSval=2205356 TSecr=535885298 [TCP segment of a reassembled PDU]"
"140","2018-09-24 11:04:25.181612","192.168.2.3","216.58.221.164","TCP","1434","55403  >  443 [ACK] Seq=71491 Ack=770 Win=1022 Len=1368 TSval=2205356 TSecr=535885298 [TCP segment of a reassembled PDU]"
"141","2018-09-24 11:04:25.181613","192.168.2.3","216.58.221.164","TLSv1.2","212","Application Data"
"142","2018-09-24 11:04:25.181768","192.168.2.3","216.58.221.164","TCP","1434","55403  >  443 [ACK] Seq=73005 Ack=770 Win=1022 Len=1368 TSval=2205356 TSecr=535885298 [TCP segment of a reassembled PDU]"
"143","2018-09-24 11:04:25.181926","192.168.2.3","216.58.221.164","TLSv1.2","155","Application Data"
"147","2018-09-24 11:04:25.267113","192.168.2.3","216.58.221.164","TCP","66","55403  >  443 [ACK] Seq=74462 Ack=1026 Win=1022 Len=0 TSval=2205365 TSecr=535885436"
"148","2018-09-24 11:04:25.300717","192.168.2.3","216.58.221.164","TCP","1434","55403  >  443 [ACK] Seq=74462 Ack=1026 Win=1022 Len=1368 TSval=2205368 TSecr=535885436 [TCP segment of a reassembled PDU]"
"149","2018-09-24 11:04:25.300720","192.168.2.3","216.58.221.164","TCP","1434","55403  >  443 [ACK] Seq=75830 Ack=1026 Win=1022 Len=1368 TSval=2205368 TSecr=535885436 [TCP segment of a reassembled PDU]"
"150","2018-09-24 11:04:25.300867","192.168.2.3","216.58.221.164","TLSv1.2","212","Application Data"
"151","2018-09-24 11:04:25.301159","192.168.2.3","216.58.221.164","TLSv1.2","1202","Application Data"
"154","2018-09-24 11:04:25.374787","192.168.2.3","216.58.197.10","TCP","66","33749  >  443 [ACK] Seq=1 Ack=1 Win=413 Len=0 TSval=2205376 TSecr=627440633"
"157","2018-09-24 11:04:25.385127","192.168.2.3","216.58.221.164","TCP","66","55403  >  443 [ACK] Seq=78480 Ack=1263 Win=1022 Len=0 TSval=2205377 TSecr=535885594"
"158","2018-09-24 11:04:25.406280","192.168.2.3","216.58.221.164","TCP","1434","55403  >  443 [ACK] Seq=78480 Ack=1263 Win=1022 Len=1368 TSval=2205378 TSecr=535885594 [TCP segment of a reassembled PDU]"
"159","2018-09-24 11:04:25.406282","192.168.2.3","216.58.221.164","TCP","1434","55403  >  443 [ACK] Seq=79848 Ack=1263 Win=1022 Len=1368 TSval=2205378 TSecr=535885594 [TCP segment of a reassembled PDU]"
"160","2018-09-24 11:04:25.406303","192.168.2.3","216.58.221.164","TLSv1.2","212","Application Data"
"161","2018-09-24 11:04:25.406580","192.168.2.3","216.58.221.164","TCP","1434","55403  >  443 [ACK] Seq=81362 Ack=1263 Win=1022 Len=1368 TSval=2205378 TSecr=535885594 [TCP segment of a reassembled PDU]"
"162","2018-09-24 11:04:25.406581","192.168.2.3","216.58.221.164","TLSv1.2","155","Application Data"
"166","2018-09-24 11:04:25.523046","192.168.2.3","216.58.221.164","TCP","1434","55403  >  443 [ACK] Seq=82819 Ack=1263 Win=1022 Len=1368 TSval=2205390 TSecr=535885663 [TCP segment of a reassembled PDU]"
"167","2018-09-24 11:04:25.523052","192.168.2.3","216.58.221.164","TCP","1434","55403  >  443 [ACK] Seq=84187 Ack=1263 Win=1022 Len=1368 TSval=2205390 TSecr=535885663 [TCP segment of a reassembled PDU]"
"168","2018-09-24 11:04:25.523303","192.168.2.3","216.58.221.164","TLSv1.2","212","Application Data"
"169","2018-09-24 11:04:25.523305","192.168.2.3","216.58.221.164","TCP","1434","55403  >  443 [ACK] Seq=85701 Ack=1263 Win=1022 Len=1368 TSval=2205390 TSecr=535885663 [TCP segment of a reassembled PDU]"
"170","2018-09-24 11:04:25.523306","192.168.2.3","216.58.221.164","TLSv1.2","155","Application Data"
"173","2018-09-24 11:04:25.629492","192.168.2.3","216.58.221.164","TCP","1434","55403  >  443 [ACK] Seq=87158 Ack=1263 Win=1022 Len=1368 TSval=2205401 TSecr=535885740 [TCP segment of a reassembled PDU]"
"174","2018-09-24 11:04:25.629681","192.168.2.3","216.58.221.164","TCP","1434","55403  >  443 [ACK] Seq=88526 Ack=1263 Win=1022 Len=1368 TSval=2205401 TSecr=535885740 [TCP segment of a reassembled PDU]"
"175","2018-09-24 11:04:25.629684","192.168.2.3","216.58.221.164","TLSv1.2","212","Application Data"
"176","2018-09-24 11:04:25.629685","192.168.2.3","216.58.221.164","TCP","1434","55403  >  443 [ACK] Seq=90040 Ack=1263 Win=1022 Len=1368 TSval=2205401 TSecr=535885740 [TCP segment of a reassembled PDU]"
"177","2018-09-24 11:04:25.629840","192.168.2.3","216.58.221.164","TLSv1.2","155","Application Data"
"181","2018-09-24 11:04:25.732666","192.168.2.3","216.58.221.164","TCP","1434","55403  >  443 [ACK] Seq=91497 Ack=1263 Win=1022 Len=1368 TSval=2205410 TSecr=535885846 [TCP segment of a reassembled PDU]"
"182","2018-09-24 11:04:25.732761","192.168.2.3","216.58.221.164","TCP","1434","55403  >  443 [ACK] Seq=92865 Ack=1263 Win=1022 Len=1368 TSval=2205410 TSecr=535885846 [TCP segment of a reassembled PDU]"
"183","2018-09-24 11:04:25.733051","192.168.2.3","216.58.221.164","TLSv1.2","212","Application Data"
"184","2018-09-24 11:04:25.733053","192.168.2.3","216.58.221.164","TCP","1434","55403  >  443 [ACK] Seq=94379 Ack=1263 Win=1022 Len=1368 TSval=2205410 TSecr=535885846 [TCP segment of a reassembled PDU]"
"185","2018-09-24 11:04:25.733054","192.168.2.3","216.58.221.164","TLSv1.2","155","Application Data"
"186","2018-09-24 11:04:25.733344","192.168.2.3","192.168.2.5","TCP","93","55900  >  9000 [PSH, ACK] Seq=28 Ack=1 Win=410 Len=27 TSval=2205410 TSecr=51528"
"191","2018-09-24 11:04:25.820562","192.168.2.3","216.58.221.164","TCP","1434","55403  >  443 [ACK] Seq=95836 Ack=1263 Win=1022 Len=1368 TSval=2205420 TSecr=535885950 [TCP segment of a reassembled PDU]"
"192","2018-09-24 11:04:25.820673","192.168.2.3","216.58.221.164","TCP","1434","55403  >  443 [ACK] Seq=97204 Ack=1263 Win=1022 Len=1368 TSval=2205420 TSecr=535885950 [TCP segment of a reassembled PDU]"
"193","2018-09-24 11:04:25.820675","192.168.2.3","216.58.221.164","TLSv1.2","212","Application Data"
"194","2018-09-24 11:04:25.820979","192.168.2.3","216.58.221.164","TCP","1434","55403  >  443 [ACK] Seq=98718 Ack=1263 Win=1022 Len=1368 TSval=2205420 TSecr=535885950 [TCP segment of a reassembled PDU]"
"195","2018-09-24 11:04:25.820982","192.168.2.3","216.58.221.164","TLSv1.2","155","Application Data"
"198","2018-09-24 11:04:25.940733","192.168.2.3","216.58.221.164","TCP","1434","55403  >  443 [ACK] Seq=100175 Ack=1263 Win=1022 Len=1368 TSval=2205432 TSecr=535886038 [TCP segment of a reassembled PDU]"
"199","2018-09-24 11:04:25.940737","192.168.2.3","216.58.221.164","TCP","1434","55403  >  443 [ACK] Seq=101543 Ack=1263 Win=1022 Len=1368 TSval=2205432 TSecr=535886038 [TCP segment of a reassembled PDU]"
"200","2018-09-24 11:04:25.940907","192.168.2.3","216.58.221.164","TLSv1.2","212","Application Data"
"201","2018-09-24 11:04:25.940909","192.168.2.3","216.58.221.164","TCP","1434","55403  >  443 [ACK] Seq=103057 Ack=1263 Win=1022 Len=1368 TSval=2205432 TSecr=535886038 [TCP segment of a reassembled PDU]"
"202","2018-09-24 11:04:25.941036","192.168.2.3","216.58.221.164","TLSv1.2","155","Application Data"
"205","2018-09-24 11:04:26.019837","192.168.2.3","216.58.221.164","TCP","1434","55403  >  443 [ACK] Seq=104514 Ack=1263 Win=1022 Len=1368 TSval=2205439 TSecr=535886157 [TCP segment of a reassembled PDU]"
"206","2018-09-24 11:04:26.019842","192.168.2.3","216.58.221.164","TCP","1434","55403  >  443 [ACK] Seq=105882 Ack=1263 Win=1022 Len=1368 TSval=2205439 TSecr=535886157 [TCP segment of a reassembled PDU]"
"207","2018-09-24 11:04:26.019964","192.168.2.3","216.58.221.164","TLSv1.2","212","Application Data"
"208","2018-09-24 11:04:26.020304","192.168.2.3","216.58.221.164","TCP","1434","55403  >  443 [ACK] Seq=107396 Ack=1263 Win=1022 Len=1368 TSval=2205439 TSecr=535886157 [TCP segment of a reassembled PDU]"
"209","2018-09-24 11:04:26.020306","192.168.2.3","216.58.221.164","TLSv1.2","155","Application Data"
"214","2018-09-24 11:04:26.093526","192.168.2.3","216.58.221.164","TCP","66","55403  >  443 [ACK] Seq=108853 Ack=1580 Win=1022 Len=0 TSval=2205447 TSecr=535886287"
"215","2018-09-24 11:04:26.133082","192.168.2.3","216.58.221.164","TCP","1434","55403  >  443 [ACK] Seq=108853 Ack=1580 Win=1022 Len=1368 TSval=2205449 TSecr=535886287 [TCP segment of a reassembled PDU]"
"216","2018-09-24 11:04:26.133086","192.168.2.3","216.58.221.164","TCP","1434","55403  >  443 [ACK] Seq=110221 Ack=1580 Win=1022 Len=1368 TSval=2205449 TSecr=535886287 [TCP segment of a reassembled PDU]"
"217","2018-09-24 11:04:26.133218","192.168.2.3","216.58.221.164","TLSv1.2","212","Application Data"
"218","2018-09-24 11:04:26.133465","192.168.2.3","216.58.221.164","TCP","1434","55403  >  443 [ACK] Seq=111735 Ack=1580 Win=1022 Len=1368 TSval=2205449 TSecr=535886287 [TCP segment of a reassembled PDU]"
"219","2018-09-24 11:04:26.133467","192.168.2.3","216.58.221.164","TLSv1.2","155","Application Data"
"224","2018-09-24 11:04:26.214363","192.168.2.3","216.58.221.164","TCP","66","55403  >  443 [ACK] Seq=113192 Ack=1998 Win=1022 Len=0 TSval=2205458 TSecr=535886405"
"225","2018-09-24 11:04:26.235467","192.168.2.3","216.58.221.164","TCP","1434","55403  >  443 [ACK] Seq=113192 Ack=1998 Win=1022 Len=1368 TSval=2205461 TSecr=535886405 [TCP segment of a reassembled PDU]"
"226","2018-09-24 11:04:26.235486","192.168.2.3","216.58.221.164","TCP","1434","55403  >  443 [ACK] Seq=114560 Ack=1998 Win=1022 Len=1368 TSval=2205461 TSecr=535886405 [TCP segment of a reassembled PDU]"
"227","2018-09-24 11:04:26.235487","192.168.2.3","216.58.221.164","TLSv1.2","212","Application Data"
"228","2018-09-24 11:04:26.235529","192.168.2.3","216.58.221.164","TCP","1434","55403  >  443 [ACK] Seq=116074 Ack=1998 Win=1022 Len=1368 TSval=2205461 TSecr=535886405 [TCP segment of a reassembled PDU]"
"229","2018-09-24 11:04:26.235544","192.168.2.3","216.58.221.164","TLSv1.2","155","Application Data"
"236","2018-09-24 11:04:26.321712","192.168.2.3","216.58.221.164","TCP","1434","55403  >  443 [ACK] Seq=117531 Ack=1998 Win=1022 Len=1368 TSval=2205470 TSecr=535886452 [TCP segment of a reassembled PDU]"
"237","2018-09-24 11:04:26.321716","192.168.2.3","216.58.221.164","TCP","1434","55403  >  443 [ACK] Seq=118899 Ack=1998 Win=1022 Len=1368 TSval=2205470 TSecr=535886452 [TCP segment of a reassembled PDU]"
"238","2018-09-24 11:04:26.321914","192.168.2.3","216.58.221.164","TLSv1.2","212","Application Data"
"239","2018-09-24 11:04:26.322290","192.168.2.3","216.58.221.164","TCP","1434","55403  >  443 [ACK] Seq=120413 Ack=1998 Win=1022 Len=1368 TSval=2205470 TSecr=535886452 [TCP segment of a reassembled PDU]"
"240","2018-09-24 11:04:26.322293","192.168.2.3","216.58.221.164","TLSv1.2","155","Application Data"
"245","2018-09-24 11:04:26.419496","192.168.2.3","216.58.221.164","TCP","1434","55403  >  443 [ACK] Seq=121870 Ack=2068 Win=1022 Len=1368 TSval=2205480 TSecr=535886611 [TCP segment of a reassembled PDU]"
"246","2018-09-24 11:04:26.419500","192.168.2.3","216.58.221.164","TCP","1434","55403  >  443 [ACK] Seq=123238 Ack=2068 Win=1022 Len=1368 TSval=2205480 TSecr=535886611 [TCP segment of a reassembled PDU]"
"247","2018-09-24 11:04:26.419739","192.168.2.3","216.58.221.164","TLSv1.2","212","Application Data"
"248","2018-09-24 11:04:26.419741","192.168.2.3","216.58.221.164","TCP","1434","55403  >  443 [ACK] Seq=124752 Ack=2068 Win=1022 Len=1368 TSval=2205480 TSecr=535886611 [TCP segment of a reassembled PDU]"
"249","2018-09-24 11:04:26.419742","192.168.2.3","216.58.221.164","TLSv1.2","155","Application Data"
"254","2018-09-24 11:04:26.482701","192.168.2.3","216.58.221.164","TCP","66","55403  >  443 [ACK] Seq=126209 Ack=2472 Win=1022 Len=0 TSval=2205486 TSecr=535886687"
"255","2018-09-24 11:04:26.516206","192.168.2.3","216.58.221.164","TCP","1434","55403  >  443 [ACK] Seq=126209 Ack=2472 Win=1022 Len=1368 TSval=2205490 TSecr=535886687 [TCP segment of a reassembled PDU]"
"256","2018-09-24 11:04:26.516211","192.168.2.3","216.58.221.164","TCP","1434","55403  >  443 [ACK] Seq=127577 Ack=2472 Win=1022 Len=1368 TSval=2205490 TSecr=535886687 [TCP segment of a reassembled PDU]"
"257","2018-09-24 11:04:26.516212","192.168.2.3","216.58.221.164","TLSv1.2","212","Application Data"
"258","2018-09-24 11:04:26.516726","192.168.2.3","216.58.221.164","TCP","1434","55403  >  443 [ACK] Seq=129091 Ack=2472 Win=1022 Len=1368 TSval=2205490 TSecr=535886687 [TCP segment of a reassembled PDU]"
"259","2018-09-24 11:04:26.516728","192.168.2.3","216.58.221.164","TLSv1.2","155","Application Data"
"263","2018-09-24 11:04:26.555499","192.168.2.3","216.58.221.163","QUIC","116","Payload (Encrypted), PKN: 8, CID: 3344534432719008961"
"266","2018-09-24 11:04:26.589230","192.168.2.3","216.58.221.163","QUIC","72","Payload (Encrypted), PKN: 9, CID: 3344534432719008961"
"267","2018-09-24 11:04:26.614588","192.168.2.3","216.58.221.164","TCP","1434","55403  >  443 [ACK] Seq=130548 Ack=2472 Win=1022 Len=1368 TSval=2205499 TSecr=535886733 [TCP segment of a reassembled PDU]"
"268","2018-09-24 11:04:26.614593","192.168.2.3","216.58.221.164","TCP","1434","55403  >  443 [ACK] Seq=131916 Ack=2472 Win=1022 Len=1368 TSval=2205499 TSecr=535886733 [TCP segment of a reassembled PDU]"
"269","2018-09-24 11:04:26.614594","192.168.2.3","216.58.221.164","TLSv1.2","212","Application Data"
"270","2018-09-24 11:04:26.614861","192.168.2.3","216.58.221.164","TCP","1434","55403  >  443 [ACK] Seq=133430 Ack=2472 Win=1022 Len=1368 TSval=2205499 TSecr=535886733 [TCP segment of a reassembled PDU]"
"271","2018-09-24 11:04:26.614863","192.168.2.3","216.58.221.164","TLSv1.2","155","Application Data"
"276","2018-09-24 11:04:26.677350","192.168.2.3","216.58.221.164","TCP","66","55403  >  443 [ACK] Seq=134887 Ack=2752 Win=1022 Len=0 TSval=2205505 TSecr=535886876"
"277","2018-09-24 11:04:26.712867","192.168.2.3","216.58.221.164","TCP","1434","55403  >  443 [ACK] Seq=134887 Ack=2752 Win=1022 Len=1368 TSval=2205509 TSecr=535886876 [TCP segment of a reassembled PDU]"
"278","2018-09-24 11:04:26.712871","192.168.2.3","216.58.221.164","TCP","1434","55403  >  443 [ACK] Seq=136255 Ack=2752 Win=1022 Len=1368 TSval=2205509 TSecr=535886876 [TCP segment of a reassembled PDU]"
"279","2018-09-24 11:04:26.713071","192.168.2.3","216.58.221.164","TLSv1.2","212","Application Data"
"280","2018-09-24 11:04:26.713073","192.168.2.3","216.58.221.164","TCP","1434","55403  >  443 [ACK] Seq=137769 Ack=2752 Win=1022 Len=1368 TSval=2205509 TSecr=535886876 [TCP segment of a reassembled PDU]"
"281","2018-09-24 11:04:26.713192","192.168.2.3","216.58.221.164","TLSv1.2","155","Application Data"
"284","2018-09-24 11:04:26.724723","192.168.2.3","192.168.2.5","TCP","93","55900  >  9000 [PSH, ACK] Seq=55 Ack=1 Win=410 Len=27 TSval=2205511 TSecr=51628"
"286","2018-09-24 11:04:26.801930","192.168.2.3","216.58.221.164","TCP","1434","55403  >  443 [ACK] Seq=139226 Ack=2752 Win=1022 Len=1368 TSval=2205518 TSecr=535886930 [TCP segment of a reassembled PDU]"
"287","2018-09-24 11:04:26.802062","192.168.2.3","216.58.221.164","TCP","1434","55403  >  443 [ACK] Seq=140594 Ack=2752 Win=1022 Len=1368 TSval=2205518 TSecr=535886930 [TCP segment of a reassembled PDU]"
"288","2018-09-24 11:04:26.802064","192.168.2.3","216.58.221.164","TLSv1.2","212","Application Data"
"289","2018-09-24 11:04:26.802379","192.168.2.3","216.58.221.164","TCP","1434","55403  >  443 [ACK] Seq=142108 Ack=2752 Win=1022 Len=1368 TSval=2205518 TSecr=535886930 [TCP segment of a reassembled PDU]"
"290","2018-09-24 11:04:26.802382","192.168.2.3","216.58.221.164","TLSv1.2","155","Application Data"
"294","2018-09-24 11:04:26.909806","192.168.2.3","216.58.221.164","TCP","1434","55403  >  443 [ACK] Seq=143565 Ack=2752 Win=1022 Len=1368 TSval=2205528 TSecr=535887020 [TCP segment of a reassembled PDU]"
"295","2018-09-24 11:04:26.909811","192.168.2.3","216.58.221.164","TCP","1434","55403  >  443 [ACK] Seq=144933 Ack=2752 Win=1022 Len=1368 TSval=2205528 TSecr=535887020 [TCP segment of a reassembled PDU]"
"296","2018-09-24 11:04:26.909986","192.168.2.3","216.58.221.164","TLSv1.2","212","Application Data"
"297","2018-09-24 11:04:26.909988","192.168.2.3","216.58.221.164","TCP","1434","55403  >  443 [ACK] Seq=146447 Ack=2752 Win=1022 Len=1368 TSval=2205528 TSecr=535887020 [TCP segment of a reassembled PDU]"
"298","2018-09-24 11:04:26.910118","192.168.2.3","216.58.221.164","TLSv1.2","155","Application Data"
"304","2018-09-24 11:04:26.989920","192.168.2.3","216.58.221.164","TCP","66","55403  >  443 [ACK] Seq=147904 Ack=3284 Win=1022 Len=0 TSval=2205536 TSecr=535887183"
"305","2018-09-24 11:04:26.996625","192.168.2.3","216.58.221.164","TCP","1434","55403  >  443 [ACK] Seq=147904 Ack=3284 Win=1022 Len=1368 TSval=2205538 TSecr=535887183 [TCP segment of a reassembled PDU]"
"306","2018-09-24 11:04:26.996628","192.168.2.3","216.58.221.164","TCP","1434","55403  >  443 [ACK] Seq=149272 Ack=3284 Win=1022 Len=1368 TSval=2205538 TSecr=535887183 [TCP segment of a reassembled PDU]"
"307","2018-09-24 11:04:26.996948","192.168.2.3","216.58.221.164","TLSv1.2","212","Application Data"
"308","2018-09-24 11:04:26.997333","192.168.2.3","216.58.221.164","TCP","1434","55403  >  443 [ACK] Seq=150786 Ack=3284 Win=1022 Len=1368 TSval=2205538 TSecr=535887183 [TCP segment of a reassembled PDU]"
"309","2018-09-24 11:04:26.997335","192.168.2.3","216.58.221.164","TLSv1.2","155","Application Data"
"315","2018-09-24 11:04:27.085823","192.168.2.3","216.58.221.164","TCP","66","55403  >  443 [ACK] Seq=152243 Ack=3743 Win=1022 Len=0 TSval=2205547 TSecr=535887287"
"316","2018-09-24 11:04:27.095137","192.168.2.3","216.58.221.164","TCP","1434","55403  >  443 [ACK] Seq=152243 Ack=3743 Win=1022 Len=1368 TSval=2205547 TSecr=535887287 [TCP segment of a reassembled PDU]"
"317","2018-09-24 11:04:27.095139","192.168.2.3","216.58.221.164","TCP","1434","55403  >  443 [ACK] Seq=153611 Ack=3743 Win=1022 Len=1368 TSval=2205547 TSecr=535887287 [TCP segment of a reassembled PDU]"
"318","2018-09-24 11:04:27.095330","192.168.2.3","216.58.221.164","TLSv1.2","212","Application Data"
"319","2018-09-24 11:04:27.095731","192.168.2.3","216.58.221.164","TCP","1434","55403  >  443 [ACK] Seq=155125 Ack=3743 Win=1022 Len=1368 TSval=2205547 TSecr=535887287 [TCP segment of a reassembled PDU]"
"320","2018-09-24 11:04:27.095732","192.168.2.3","216.58.221.164","TLSv1.2","155","Application Data"
"326","2018-09-24 11:04:27.171424","192.168.2.3","216.58.221.164","TCP","66","55403  >  443 [ACK] Seq=156582 Ack=4223 Win=1022 Len=0 TSval=2205555 TSecr=535887368"
"327","2018-09-24 11:04:27.197681","192.168.2.3","216.58.221.164","TCP","1434","55403  >  443 [ACK] Seq=156582 Ack=4223 Win=1022 Len=1368 TSval=2205558 TSecr=535887368 [TCP segment of a reassembled PDU]"
"328","2018-09-24 11:04:27.197833","192.168.2.3","216.58.221.164","TCP","1434","55403  >  443 [ACK] Seq=157950 Ack=4223 Win=1022 Len=1368 TSval=2205558 TSecr=535887368 [TCP segment of a reassembled PDU]"
"329","2018-09-24 11:04:27.197834","192.168.2.3","216.58.221.164","TLSv1.2","212","Application Data"
"330","2018-09-24 11:04:27.198004","192.168.2.3","216.58.221.164","TCP","1434","55403  >  443 [ACK] Seq=159464 Ack=4223 Win=1022 Len=1368 TSval=2205558 TSecr=535887368 [TCP segment of a reassembled PDU]"
"331","2018-09-24 11:04:27.198006","192.168.2.3","216.58.221.164","TLSv1.2","155","Application Data"
"337","2018-09-24 11:04:27.259795","192.168.2.3","216.58.221.164","TCP","66","55403  >  443 [ACK] Seq=160921 Ack=4685 Win=1022 Len=0 TSval=2205564 TSecr=535887466"
"338","2018-09-24 11:04:27.316873","192.168.2.3","216.58.221.164","TCP","1434","55403  >  443 [ACK] Seq=160921 Ack=4685 Win=1022 Len=1368 TSval=2205570 TSecr=535887466 [TCP segment of a reassembled PDU]"
"339","2018-09-24 11:04:27.317050","192.168.2.3","216.58.221.164","TCP","1434","55403  >  443 [ACK] Seq=162289 Ack=4685 Win=1022 Len=1368 TSval=2205570 TSecr=535887466 [TCP segment of a reassembled PDU]"
"340","2018-09-24 11:04:27.317052","192.168.2.3","216.58.221.164","TLSv1.2","212","Application Data"
"341","2018-09-24 11:04:27.317218","192.168.2.3","216.58.221.164","TCP","1434","55403  >  443 [ACK] Seq=163803 Ack=4685 Win=1022 Len=1368 TSval=2205570 TSecr=535887466 [TCP segment of a reassembled PDU]"
"342","2018-09-24 11:04:27.317219","192.168.2.3","216.58.221.164","TLSv1.2","155","Application Data"
"346","2018-09-24 11:04:27.418731","192.168.2.3","216.58.221.164","TCP","1434","55403  >  443 [ACK] Seq=165260 Ack=4685 Win=1022 Len=1368 TSval=2205579 TSecr=535887534 [TCP segment of a reassembled PDU]"
"347","2018-09-24 11:04:27.418835","192.168.2.3","216.58.221.164","TCP","1434","55403  >  443 [ACK] Seq=166628 Ack=4685 Win=1022 Len=1368 TSval=2205579 TSecr=535887534 [TCP segment of a reassembled PDU]"
"348","2018-09-24 11:04:27.418836","192.168.2.3","216.58.221.164","TLSv1.2","212","Application Data"
"349","2018-09-24 11:04:27.419124","192.168.2.3","216.58.221.164","TCP","1434","55403  >  443 [ACK] Seq=168142 Ack=4685 Win=1022 Len=1368 TSval=2205579 TSecr=535887534 [TCP segment of a reassembled PDU]"
"350","2018-09-24 11:04:27.419127","192.168.2.3","216.58.221.164","TLSv1.2","155","Application Data"
"354","2018-09-24 11:04:27.517225","192.168.2.3","216.58.221.164","TCP","1434","55403  >  443 [ACK] Seq=169599 Ack=4685 Win=1022 Len=1368 TSval=2205590 TSecr=535887636 [TCP segment of a reassembled PDU]"
"355","2018-09-24 11:04:27.517230","192.168.2.3","216.58.221.164","TCP","1434","55403  >  443 [ACK] Seq=170967 Ack=4685 Win=1022 Len=1368 TSval=2205590 TSecr=535887636 [TCP segment of a reassembled PDU]"
"356","2018-09-24 11:04:27.517231","192.168.2.3","216.58.221.164","TLSv1.2","212","Application Data"
"357","2018-09-24 11:04:27.517395","192.168.2.3","216.58.221.164","TLSv1.2","1391","Application Data"
"362","2018-09-24 11:04:27.579831","192.168.2.3","216.58.221.164","TCP","66","55403  >  443 [ACK] Seq=173806 Ack=5067 Win=1022 Len=0 TSval=2205596 TSecr=535887783"
"363","2018-09-24 11:04:27.638281","192.168.2.3","216.58.221.164","TCP","1434","55403  >  443 [ACK] Seq=173806 Ack=5067 Win=1022 Len=1368 TSval=2205602 TSecr=535887783 [TCP segment of a reassembled PDU]"
"364","2018-09-24 11:04:27.638285","192.168.2.3","216.58.221.164","TCP","1434","55403  >  443 [ACK] Seq=175174 Ack=5067 Win=1022 Len=1368 TSval=2205602 TSecr=535887783 [TCP segment of a reassembled PDU]"
"365","2018-09-24 11:04:27.638286","192.168.2.3","216.58.221.164","TLSv1.2","212","Application Data"
"366","2018-09-24 11:04:27.638406","192.168.2.3","216.58.221.164","TCP","1434","55403  >  443 [ACK] Seq=176688 Ack=5067 Win=1022 Len=1368 TSval=2205602 TSecr=535887783 [TCP segment of a reassembled PDU]"
"367","2018-09-24 11:04:27.638537","192.168.2.3","216.58.221.164","TLSv1.2","155","Application Data"
"369","2018-09-24 11:04:27.711004","192.168.2.3","216.58.221.164","TCP","1434","55403  >  443 [ACK] Seq=178145 Ack=5067 Win=1022 Len=1368 TSval=2205609 TSecr=535887855 [TCP segment of a reassembled PDU]"
"370","2018-09-24 11:04:27.711384","192.168.2.3","216.58.221.164","TCP","1434","55403  >  443 [ACK] Seq=179513 Ack=5067 Win=1022 Len=1368 TSval=2205609 TSecr=535887855 [TCP segment of a reassembled PDU]"
"371","2018-09-24 11:04:27.711385","192.168.2.3","216.58.221.164","TLSv1.2","212","Application Data"
"372","2018-09-24 11:04:27.711589","192.168.2.3","216.58.221.164","TCP","1434","55403  >  443 [ACK] Seq=181027 Ack=5067 Win=1022 Len=1368 TSval=2205609 TSecr=535887855 [TCP segment of a reassembled PDU]"
"373","2018-09-24 11:04:27.711590","192.168.2.3","216.58.221.164","TLSv1.2","155","Application Data"
"377","2018-09-24 11:04:27.738349","192.168.2.3","192.168.2.5","TCP","93","55900  >  9000 [PSH, ACK] Seq=82 Ack=1 Win=410 Len=27 TSval=2205611 TSecr=51728"
"379","2018-09-24 11:04:27.811632","192.168.2.3","216.58.221.164","TCP","1434","55403  >  443 [ACK] Seq=182484 Ack=5067 Win=1022 Len=1368 TSval=2205618 TSecr=535887928 [TCP segment of a reassembled PDU]"
"380","2018-09-24 11:04:27.811738","192.168.2.3","216.58.221.164","TCP","1434","55403  >  443 [ACK] Seq=183852 Ack=5067 Win=1022 Len=1368 TSval=2205618 TSecr=535887928 [TCP segment of a reassembled PDU]"
"381","2018-09-24 11:04:27.811740","192.168.2.3","216.58.221.164","TLSv1.2","212","Application Data"
"382","2018-09-24 11:04:27.812041","192.168.2.3","216.58.221.164","TCP","1434","55403  >  443 [ACK] Seq=185366 Ack=5067 Win=1022 Len=1368 TSval=2205618 TSecr=535887928 [TCP segment of a reassembled PDU]"
"383","2018-09-24 11:04:27.812044","192.168.2.3","216.58.221.164","TLSv1.2","155","Application Data"
"388","2018-09-24 11:04:27.874643","192.168.2.3","216.58.221.164","TCP","66","55403  >  443 [ACK] Seq=186823 Ack=5241 Win=1022 Len=0 TSval=2205625 TSecr=535888078"
"389","2018-09-24 11:04:27.924668","192.168.2.3","216.58.221.164","TCP","1434","55403  >  443 [ACK] Seq=186823 Ack=5241 Win=1022 Len=1368 TSval=2205628 TSecr=535888078 [TCP segment of a reassembled PDU]"
"390","2018-09-24 11:04:27.924796","192.168.2.3","216.58.221.164","TCP","1434","55403  >  443 [ACK] Seq=188191 Ack=5241 Win=1022 Len=1368 TSval=2205628 TSecr=535888078 [TCP segment of a reassembled PDU]"
"391","2018-09-24 11:04:27.924798","192.168.2.3","216.58.221.164","TLSv1.2","212","Application Data"
"392","2018-09-24 11:04:27.925075","192.168.2.3","216.58.221.164","TCP","1434","55403  >  443 [ACK] Seq=189705 Ack=5241 Win=1022 Len=1368 TSval=2205628 TSecr=535888078 [TCP segment of a reassembled PDU]"
"393","2018-09-24 11:04:27.925079","192.168.2.3","216.58.221.164","TLSv1.2","155","Application Data"
"397","2018-09-24 11:04:27.995233","192.168.2.3","216.58.221.164","TCP","1434","55403  >  443 [ACK] Seq=191162 Ack=5241 Win=1022 Len=1368 TSval=2205638 TSecr=535888142 [TCP segment of a reassembled PDU]"
"398","2018-09-24 11:04:27.995617","192.168.2.3","216.58.221.164","TCP","1434","55403  >  443 [ACK] Seq=192530 Ack=5241 Win=1022 Len=1368 TSval=2205638 TSecr=535888142 [TCP segment of a reassembled PDU]"
"399","2018-09-24 11:04:27.995619","192.168.2.3","216.58.221.164","TLSv1.2","212","Application Data"
"402","2018-09-24 11:04:28.003290","192.168.2.3","216.58.221.164","TCP","1434","55403  >  443 [ACK] Seq=194044 Ack=5241 Win=1022 Len=1368 TSval=2205638 TSecr=535888142 [TCP segment of a reassembled PDU]"
"403","2018-09-24 11:04:28.003292","192.168.2.3","216.58.221.164","TLSv1.2","155","Application Data"
"407","2018-09-24 11:04:28.025772","192.168.2.3","216.58.221.164","TCP","66","55403  >  443 [ACK] Seq=195501 Ack=5601 Win=1022 Len=0 TSval=2205641 TSecr=535888232"
"412","2018-09-24 11:04:28.090464","192.168.2.3","216.58.221.164","TCP","66","55403  >  443 [ACK] Seq=195501 Ack=6227 Win=1022 Len=0 TSval=2205647 TSecr=535888287"
"413","2018-09-24 11:04:28.119985","192.168.2.3","216.58.221.164","TCP","1434","55403  >  443 [ACK] Seq=195501 Ack=6424 Win=1022 Len=1368 TSval=2205650 TSecr=535888296 [TCP segment of a reassembled PDU]"
"414","2018-09-24 11:04:28.119990","192.168.2.3","216.58.221.164","TCP","1434","55403  >  443 [ACK] Seq=196869 Ack=6424 Win=1022 Len=1368 TSval=2205650 TSecr=535888296 [TCP segment of a reassembled PDU]"
"415","2018-09-24 11:04:28.119990","192.168.2.3","216.58.221.164","TLSv1.2","212","Application Data"
"416","2018-09-24 11:04:28.120193","192.168.2.3","216.58.221.164","TCP","1434","55403  >  443 [ACK] Seq=198383 Ack=6424 Win=1022 Len=1368 TSval=2205650 TSecr=535888296 [TCP segment of a reassembled PDU]"
"417","2018-09-24 11:04:28.120269","192.168.2.3","216.58.221.164","TLSv1.2","155","Application Data"
"420","2018-09-24 11:04:28.170174","192.168.2.3","192.168.2.1","TCP","183","8009  >  55495 [PSH, ACK] Seq=118 Ack=235 Win=277 Len=117 TSval=2205655 TSecr=1716201028 [TCP segment of a reassembled PDU]"
"424","2018-09-24 11:04:28.189957","192.168.2.3","216.58.221.164","TCP","66","55403  >  443 [ACK] Seq=199840 Ack=6885 Win=1022 Len=0 TSval=2205657 TSecr=535888396"
"425","2018-09-24 11:04:28.211761","192.168.2.3","216.58.221.164","TCP","1434","55403  >  443 [ACK] Seq=199840 Ack=6885 Win=1022 Len=1368 TSval=2205659 TSecr=535888396 [TCP segment of a reassembled PDU]"
"426","2018-09-24 11:04:28.211954","192.168.2.3","216.58.221.164","TCP","1434","55403  >  443 [ACK] Seq=201208 Ack=6885 Win=1022 Len=1368 TSval=2205659 TSecr=535888396 [TCP segment of a reassembled PDU]"
"427","2018-09-24 11:04:28.211956","192.168.2.3","216.58.221.164","TLSv1.2","212","Application Data"
