"No.","Time","Source","Destination","Protocol","Length","Info"
"3","2018-09-19 09:57:49.895474","192.168.2.3","192.168.2.1","TCP","183","8009  >  51502 [PSH, ACK] Seq=1 Ack=118 Win=277 Len=117 TSval=1837364 TSecr=1280438720 [TCP segment of a reassembled PDU]"
"27","2018-09-19 09:58:01.709740","192.168.2.3","192.168.2.1","TCP","74","8009  >  51503 [SYN, ACK, ECN] Seq=0 Ack=1 Win=14480 Len=0 MSS=1460 SACK_PERM=1 TSval=1838546 TSecr=1280450532 WS=64"
"30","2018-09-19 09:58:01.710796","192.168.2.3","192.168.2.1","TCP","97","8009  >  51502 [PSH, ACK] Seq=118 Ack=119 Win=277 Len=31 TSval=1838546 TSecr=1280450532 [TCP segment of a reassembled PDU]"
"31","2018-09-19 09:58:01.710799","192.168.2.3","192.168.2.1","TCP","66","8009  >  51502 [FIN, ACK] Seq=149 Ack=119 Win=277 Len=0 TSval=1838546 TSecr=1280450532"
"34","2018-09-19 09:58:01.711555","192.168.2.3","192.168.2.1","TCP","66","8009  >  51503 [ACK] Seq=1 Ack=158 Win=15552 Len=0 TSval=1838546 TSecr=1280450533"
"35","2018-09-19 09:58:01.733012","192.168.2.3","192.168.2.1","AJP13","1197","AJP13 Error?"
"38","2018-09-19 09:58:01.737165","192.168.2.3","192.168.2.1","TCP","292","8009  >  51503 [PSH, ACK] Seq=1132 Ack=251 Win=15552 Len=226 TSval=1838548 TSecr=1280450556 [TCP segment of a reassembled PDU]"
"41","2018-09-19 09:58:01.746892","192.168.2.3","192.168.2.1","TCP","1514","8009  >  51503 [ACK] Seq=1358 Ack=376 Win=15552 Len=1448 TSval=1838549 TSecr=1280450560 [TCP segment of a reassembled PDU]"
"42","2018-09-19 09:58:01.750869","192.168.2.3","192.168.2.1","TCP","1514","8009  >  51503 [ACK] Seq=2806 Ack=376 Win=15552 Len=1448 TSval=1838549 TSecr=1280450560 [TCP segment of a reassembled PDU]"
"44","2018-09-19 09:58:01.751330","192.168.2.3","192.168.2.1","TCP","1247","8009  >  51503 [PSH, ACK] Seq=4254 Ack=376 Win=15552 Len=1181 TSval=1838549 TSecr=1280450560 [TCP segment of a reassembled PDU]"
"58","2018-09-19 09:58:06.771651","192.168.2.3","192.168.2.1","TCP","183","8009  >  51503 [PSH, ACK] Seq=5435 Ack=493 Win=15552 Len=117 TSval=1839052 TSecr=1280455588 [TCP segment of a reassembled PDU]"
"61","2018-09-19 09:58:06.779506","192.168.2.3","192.168.2.1","TCP","66","8009  >  51503 [ACK] Seq=5552 Ack=1106 Win=17728 Len=0 TSval=1839053 TSecr=1280455589"
"62","2018-09-19 09:58:06.781404","192.168.2.3","192.168.2.1","TCP","519","8009  >  51503 [PSH, ACK] Seq=5552 Ack=1106 Win=17728 Len=453 TSval=1839053 TSecr=1280455589 [TCP segment of a reassembled PDU]"
"66","2018-09-19 09:58:15.448478","192.168.2.3","108.177.125.188","TCP","66","42262  >  5228 [ACK] Seq=1 Ack=1 Win=406 Len=0 TSval=1839920 TSecr=498564811"
"69","2018-09-19 09:58:16.793034","192.168.2.3","192.168.2.1","TCP","183","8009  >  51503 [PSH, ACK] Seq=6005 Ack=1223 Win=17728 Len=117 TSval=1840054 TSecr=1280465604 [TCP segment of a reassembled PDU]"
"71","2018-09-19 09:58:18.648035","192.168.2.3","64.233.188.188","TCP","66","36126  >  5228 [ACK] Seq=1 Ack=1 Win=406 Len=0 TSval=1840240 TSecr=1097267012"
"78","2018-09-19 09:58:26.697781","192.168.2.3","192.168.2.1","TCP","183","8009  >  51503 [PSH, ACK] Seq=6122 Ack=1340 Win=17728 Len=117 TSval=1841044 TSecr=1280475504 [TCP segment of a reassembled PDU]"
"81","2018-09-19 09:58:30.508202","192.168.2.3","172.217.27.174","TCP","66","42648  >  443 [ACK] Seq=1 Ack=1 Win=296 Len=0 TSval=1841424 TSecr=3867540323"
"99","2018-09-19 09:58:31.705488","192.168.2.3","192.168.2.1","TCP","183","8009  >  51503 [PSH, ACK] Seq=6239 Ack=1457 Win=17728 Len=117 TSval=1841545 TSecr=1280480507 [TCP segment of a reassembled PDU]"
"114","2018-09-19 09:58:38.496308","192.168.2.3","192.168.2.1","TCP","183","8009  >  51503 [PSH, ACK] Seq=6356 Ack=1574 Win=17728 Len=117 TSval=1842224 TSecr=1280487297 [TCP segment of a reassembled PDU]"
"118","2018-09-19 09:58:51.709693","192.168.2.3","192.168.2.1","TCP","74","8009  >  51504 [SYN, ACK, ECN] Seq=0 Ack=1 Win=14480 Len=0 MSS=1460 SACK_PERM=1 TSval=1843546 TSecr=1280500503 WS=64"
"121","2018-09-19 09:58:51.710001","192.168.2.3","192.168.2.1","TCP","97","8009  >  51503 [PSH, ACK] Seq=6473 Ack=1575 Win=17728 Len=31 TSval=1843546 TSecr=1280500503 [TCP segment of a reassembled PDU]"
"122","2018-09-19 09:58:51.710003","192.168.2.3","192.168.2.1","TCP","66","8009  >  51503 [FIN, ACK] Seq=6504 Ack=1575 Win=17728 Len=0 TSval=1843546 TSecr=1280500503"
"125","2018-09-19 09:58:51.711193","192.168.2.3","192.168.2.1","TCP","66","8009  >  51504 [ACK] Seq=1 Ack=158 Win=15552 Len=0 TSval=1843546 TSecr=1280500506"
"126","2018-09-19 09:58:51.735461","192.168.2.3","192.168.2.1","AJP13","1197","AJP13 Error?"
"129","2018-09-19 09:58:51.740356","192.168.2.3","192.168.2.1","TCP","292","8009  >  51504 [PSH, ACK] Seq=1132 Ack=251 Win=15552 Len=226 TSval=1843548 TSecr=1280500531 [TCP segment of a reassembled PDU]"
"132","2018-09-19 09:58:51.743704","192.168.2.3","192.168.2.1","TCP","1514","8009  >  51504 [ACK] Seq=1358 Ack=376 Win=15552 Len=1448 TSval=1843549 TSecr=1280500535 [TCP segment of a reassembled PDU]"
"133","2018-09-19 09:58:51.744096","192.168.2.3","192.168.2.1","TCP","1514","8009  >  51504 [ACK] Seq=2806 Ack=376 Win=15552 Len=1448 TSval=1843549 TSecr=1280500535 [TCP segment of a reassembled PDU]"
"135","2018-09-19 09:58:51.744371","192.168.2.3","192.168.2.1","TCP","1247","8009  >  51504 [PSH, ACK] Seq=4254 Ack=376 Win=15552 Len=1181 TSval=1843549 TSecr=1280500535 [TCP segment of a reassembled PDU]"
"139","2018-09-19 09:58:56.768438","192.168.2.3","192.168.2.1","TCP","183","8009  >  51504 [PSH, ACK] Seq=5435 Ack=493 Win=15552 Len=117 TSval=1844051 TSecr=1280505558 [TCP segment of a reassembled PDU]"
"142","2018-09-19 09:58:56.782435","192.168.2.3","192.168.2.1","TCP","66","8009  >  51504 [ACK] Seq=5552 Ack=1106 Win=17728 Len=0 TSval=1844053 TSecr=1280505559"
"143","2018-09-19 09:58:56.783388","192.168.2.3","192.168.2.1","TCP","519","8009  >  51504 [PSH, ACK] Seq=5552 Ack=1106 Win=17728 Len=453 TSval=1844053 TSecr=1280505559 [TCP segment of a reassembled PDU]"
"145","2018-09-19 09:59:00.568538","192.168.2.3","108.177.125.188","TCP","66","[TCP Dup ACK 66#1] 42262  >  5228 [ACK] Seq=1 Ack=1 Win=406 Len=0 TSval=1844432 TSecr=498609932"
"147","2018-09-19 09:59:03.798769","192.168.2.3","64.233.188.188","TCP","66","[TCP Dup ACK 71#1] 36126  >  5228 [ACK] Seq=1 Ack=1 Win=406 Len=0 TSval=1844752 TSecr=1097312123"
"150","2018-09-19 09:59:06.795810","192.168.2.3","192.168.2.1","TCP","183","8009  >  51504 [PSH, ACK] Seq=6005 Ack=1223 Win=17728 Len=117 TSval=1845054 TSecr=1280515581 [TCP segment of a reassembled PDU]"
"154","2018-09-19 09:59:15.623569","192.168.2.3","172.217.27.174","TCP","66","[TCP Dup ACK 81#1] 42648  >  443 [ACK] Seq=1 Ack=1 Win=296 Len=0 TSval=1845936 TSecr=3867585464"
"157","2018-09-19 09:59:16.700729","192.168.2.3","192.168.2.1","TCP","183","8009  >  51504 [PSH, ACK] Seq=6122 Ack=1340 Win=17728 Len=117 TSval=1846044 TSecr=1280525475 [TCP segment of a reassembled PDU]"
"171","2018-09-19 09:59:26.709138","192.168.2.3","192.168.2.1","TCP","183","8009  >  51504 [PSH, ACK] Seq=6239 Ack=1457 Win=17728 Len=117 TSval=1847045 TSecr=1280535484 [TCP segment of a reassembled PDU]"
"188","2018-09-19 09:59:33.587113","192.168.2.3","64.233.188.188","TCP","92","[TCP Previous segment not captured] 36126  >  5228 [PSH, ACK] Seq=2 Ack=1 Win=406 Len=26 TSval=1847733 TSecr=1097357273"
"190","2018-09-19 09:59:33.624786","192.168.2.3","64.233.188.188","TCP","66","36126  >  5228 [ACK] Seq=28 Ack=27 Win=406 Len=0 TSval=1847737 TSecr=1097387062"
"205","2018-09-19 09:59:41.707410","192.168.2.3","192.168.2.1","TCP","183","8009  >  51504 [PSH, ACK] Seq=6356 Ack=1574 Win=17728 Len=117 TSval=1848545 TSecr=1280550474 [TCP segment of a reassembled PDU]"
"207","2018-09-19 09:59:45.688988","192.168.2.3","108.177.125.188","TCP","66","[TCP Dup ACK 66#2] 42262  >  5228 [ACK] Seq=1 Ack=1 Win=406 Len=0 TSval=1848944 TSecr=498655057"
"212","2018-09-19 09:59:56.717946","192.168.2.3","192.168.2.1","TCP","183","8009  >  51504 [PSH, ACK] Seq=6473 Ack=1691 Win=17728 Len=117 TSval=1850046 TSecr=1280565478 [TCP segment of a reassembled PDU]"
"214","2018-09-19 10:00:00.729120","192.168.2.3","172.217.27.174","TCP","66","[TCP Dup ACK 81#2] 42648  >  443 [ACK] Seq=1 Ack=1 Win=296 Len=0 TSval=1850448 TSecr=3867630579"
"222","2018-09-19 10:00:11.721090","192.168.2.3","192.168.2.1","TCP","183","8009  >  51504 [PSH, ACK] Seq=6590 Ack=1808 Win=17728 Len=117 TSval=1851547 TSecr=1280580486 [TCP segment of a reassembled PDU]"
"227","2018-09-19 10:00:18.649327","192.168.2.3","64.233.188.188","TCP","66","[TCP Keep-Alive] 36126  >  5228 [ACK] Seq=27 Ack=27 Win=406 Len=0 TSval=1852240 TSecr=1097387062"
"230","2018-09-19 10:00:26.723501","192.168.2.3","192.168.2.1","TCP","183","8009  >  51504 [PSH, ACK] Seq=6707 Ack=1925 Win=17728 Len=117 TSval=1853047 TSecr=1280595485 [TCP segment of a reassembled PDU]"
"241","2018-09-19 10:00:30.809511","192.168.2.3","108.177.125.188","TCP","66","[TCP Dup ACK 66#3] 42262  >  5228 [ACK] Seq=1 Ack=1 Win=406 Len=0 TSval=1853456 TSecr=498700173"
"268","2018-09-19 10:00:41.726023","192.168.2.3","192.168.2.1","TCP","183","8009  >  51504 [PSH, ACK] Seq=6824 Ack=2042 Win=17728 Len=117 TSval=1854547 TSecr=1280610483 [TCP segment of a reassembled PDU]"
"272","2018-09-19 10:00:45.849678","192.168.2.3","172.217.27.174","TCP","66","[TCP Dup ACK 81#3] 42648  >  443 [ACK] Seq=1 Ack=1 Win=296 Len=0 TSval=1854960 TSecr=3867675685"
"275","2018-09-19 10:00:56.728967","192.168.2.3","192.168.2.1","TCP","183","8009  >  51504 [PSH, ACK] Seq=6941 Ack=2159 Win=17728 Len=117 TSval=1856047 TSecr=1280625480 [TCP segment of a reassembled PDU]"
"279","2018-09-19 10:01:00.319563","192.168.2.3","172.217.27.174","TCP","66","[TCP Previous segment not captured] 42648  >  443 [FIN, ACK] Seq=2 Ack=57 Win=296 Len=0 TSval=1856406 TSecr=3867735268"
"281","2018-09-19 10:01:03.804696","192.168.2.3","64.233.188.188","TCP","66","[TCP Keep-Alive] 36126  >  5228 [ACK] Seq=27 Ack=27 Win=406 Len=0 TSval=1856752 TSecr=1097432124"
"286","2018-09-19 10:01:11.731085","192.168.2.3","192.168.2.1","TCP","183","8009  >  51504 [PSH, ACK] Seq=7058 Ack=2276 Win=17728 Len=117 TSval=1857548 TSecr=1280640480 [TCP segment of a reassembled PDU]"
"288","2018-09-19 10:01:15.929983","192.168.2.3","108.177.125.188","TCP","66","[TCP Dup ACK 66#4] 42262  >  5228 [ACK] Seq=1 Ack=1 Win=406 Len=0 TSval=1857968 TSecr=498745293"
"294","2018-09-19 10:01:26.734399","192.168.2.3","192.168.2.1","TCP","183","8009  >  51504 [PSH, ACK] Seq=7175 Ack=2393 Win=17728 Len=117 TSval=1859048 TSecr=1280655475 [TCP segment of a reassembled PDU]"
"313","2018-09-19 10:01:33.652451","192.168.2.3","64.233.188.188","TCP","92","36126  >  5228 [PSH, ACK] Seq=28 Ack=27 Win=406 Len=26 TSval=1859737 TSecr=1097477279"
"315","2018-09-19 10:01:33.689461","192.168.2.3","64.233.188.188","TCP","66","36126  >  5228 [ACK] Seq=54 Ack=53 Win=406 Len=0 TSval=1859743 TSecr=1097507128"
"322","2018-09-19 10:01:41.736440","192.168.2.3","192.168.2.1","TCP","183","8009  >  51504 [PSH, ACK] Seq=7292 Ack=2510 Win=17728 Len=117 TSval=1860548 TSecr=1280670473 [TCP segment of a reassembled PDU]"
