"No.","Time","Source","Destination","Protocol","Length","Info"
"12","2018-09-19 10:10:26.707453","192.168.2.3","192.168.2.1","TCP","74","8009  >  51520 [SYN, ACK, ECN] Seq=0 Ack=1 Win=14480 Len=0 MSS=1460 SACK_PERM=1 TSval=1913045 TSecr=1281195128 WS=64"
"15","2018-09-19 10:10:26.708053","192.168.2.3","192.168.2.1","TCP","97","8009  >  51519 [PSH, ACK] Seq=1 Ack=2 Win=277 Len=31 TSval=1913045 TSecr=1281195128 [TCP segment of a reassembled PDU]"
"16","2018-09-19 10:10:26.708056","192.168.2.3","192.168.2.1","TCP","66","8009  >  51519 [FIN, ACK] Seq=32 Ack=2 Win=277 Len=0 TSval=1913045 TSecr=1281195128"
"19","2018-09-19 10:10:26.710009","192.168.2.3","192.168.2.1","TCP","66","8009  >  51520 [ACK] Seq=1 Ack=158 Win=15552 Len=0 TSval=1913045 TSecr=1281195129"
"20","2018-09-19 10:10:26.731664","192.168.2.3","192.168.2.1","AJP13","1197","AJP13 Error?"
"23","2018-09-19 10:10:26.735604","192.168.2.3","192.168.2.1","TCP","292","8009  >  51520 [PSH, ACK] Seq=1132 Ack=251 Win=15552 Len=226 TSval=1913047 TSecr=1281195152 [TCP segment of a reassembled PDU]"
"26","2018-09-19 10:10:26.739248","192.168.2.3","192.168.2.1","TCP","1514","8009  >  51520 [ACK] Seq=1358 Ack=376 Win=15552 Len=1448 TSval=1913048 TSecr=1281195155 [TCP segment of a reassembled PDU]"
"27","2018-09-19 10:10:26.739687","192.168.2.3","192.168.2.1","TCP","1514","8009  >  51520 [ACK] Seq=2806 Ack=376 Win=15552 Len=1448 TSval=1913048 TSecr=1281195155 [TCP segment of a reassembled PDU]"
"28","2018-09-19 10:10:26.739689","192.168.2.3","192.168.2.1","TCP","1247","8009  >  51520 [PSH, ACK] Seq=4254 Ack=376 Win=15552 Len=1181 TSval=1913048 TSecr=1281195155 [TCP segment of a reassembled PDU]"
"37","2018-09-19 10:10:31.766978","192.168.2.3","192.168.2.1","TCP","183","8009  >  51520 [PSH, ACK] Seq=5435 Ack=493 Win=15552 Len=117 TSval=1913551 TSecr=1281200178 [TCP segment of a reassembled PDU]"
"40","2018-09-19 10:10:31.785918","192.168.2.3","192.168.2.1","TCP","66","8009  >  51520 [ACK] Seq=5552 Ack=1106 Win=17728 Len=0 TSval=1913551 TSecr=1281200179"
"41","2018-09-19 10:10:31.785927","192.168.2.3","192.168.2.1","TCP","519","8009  >  51520 [PSH, ACK] Seq=5552 Ack=1106 Win=17728 Len=453 TSval=1913552 TSecr=1281200179 [TCP segment of a reassembled PDU]"
"56","2018-09-19 10:10:41.792631","192.168.2.3","192.168.2.1","TCP","183","8009  >  51520 [PSH, ACK] Seq=6005 Ack=1223 Win=17728 Len=117 TSval=1914553 TSecr=1281210199 [TCP segment of a reassembled PDU]"
"58","2018-09-19 10:10:46.016110","192.168.2.3","172.217.161.238","TCP","66","55607  >  443 [ACK] Seq=1 Ack=1 Win=539 Len=0 TSval=1914976 TSecr=2023616539"
"61","2018-09-19 10:10:46.799328","192.168.2.3","192.168.2.1","TCP","183","8009  >  51520 [PSH, ACK] Seq=6122 Ack=1340 Win=17728 Len=117 TSval=1915054 TSecr=1281215203 [TCP segment of a reassembled PDU]"
"63","2018-09-19 10:10:47.936164","192.168.2.3","172.217.27.174","TCP","66","42652  >  443 [ACK] Seq=1 Ack=1 Win=296 Len=0 TSval=1915168 TSecr=1713656905"
"68","2018-09-19 10:10:56.727082","192.168.2.3","192.168.2.1","TCP","183","8009  >  51520 [PSH, ACK] Seq=6239 Ack=1457 Win=17728 Len=117 TSval=1916047 TSecr=1281225123 [TCP segment of a reassembled PDU]"
"72","2018-09-19 10:11:02.487745","192.168.2.3","172.217.27.174","TCP","66","[TCP Previous segment not captured] 42652  >  443 [FIN, ACK] Seq=2 Ack=56 Win=296 Len=0 TSval=1916623 TSecr=1713716562"
"74","2018-09-19 10:11:02.515448","192.168.2.3","172.217.27.174","TCP","66","42652  >  443 [ACK] Seq=3 Ack=57 Win=296 Len=0 TSval=1916623 TSecr=1713716562"
"75","2018-09-19 10:11:02.515451","192.168.2.3","108.177.125.188","TCP","66","42262  >  5228 [ACK] Seq=1 Ack=1 Win=406 Len=0 TSval=1916624 TSecr=499331861"
"77","2018-09-19 10:11:04.096267","192.168.2.3","64.233.188.188","TCP","66","36126  >  5228 [ACK] Seq=1 Ack=1 Win=406 Len=0 TSval=1916784 TSecr=1098032464"
"82","2018-09-19 10:11:09.513984","192.168.2.3","192.168.2.1","TCP","183","8009  >  51520 [PSH, ACK] Seq=6356 Ack=1574 Win=17728 Len=117 TSval=1917325 TSecr=1281237864 [TCP segment of a reassembled PDU]"
"97","2018-09-19 10:11:20.546570","192.168.2.3","192.168.2.1","TCP","183","8009  >  51520 [PSH, ACK] Seq=6473 Ack=1691 Win=17728 Len=117 TSval=1918427 TSecr=1281248861 [TCP segment of a reassembled PDU]"
"103","2018-09-19 10:11:31.136414","192.168.2.3","172.217.161.238","TCP","66","[TCP Dup ACK 58#1] 55607  >  443 [ACK] Seq=1 Ack=1 Win=539 Len=0 TSval=1919488 TSecr=2023661655"
"106","2018-09-19 10:11:31.514757","192.168.2.3","192.168.2.1","TCP","183","8009  >  51520 [PSH, ACK] Seq=6590 Ack=1808 Win=17728 Len=117 TSval=1919525 TSecr=1281259857 [TCP segment of a reassembled PDU]"
"119","2018-09-19 10:11:33.874385","192.168.2.3","64.233.188.188","TCP","92","[TCP Previous segment not captured] 36126  >  5228 [PSH, ACK] Seq=2 Ack=1 Win=406 Len=26 TSval=1919761 TSecr=1098077571"
"121","2018-09-19 10:11:33.916160","192.168.2.3","64.233.188.188","TCP","66","36126  >  5228 [ACK] Seq=28 Ack=27 Win=406 Len=0 TSval=1919765 TSecr=1098107350"
"130","2018-09-19 10:11:45.588917","192.168.2.3","172.217.161.238","TCP","66","[TCP Previous segment not captured] 55607  >  443 [FIN, ACK] Seq=2 Ack=57 Win=539 Len=0 TSval=1920933 TSecr=2023721216"
"136","2018-09-19 10:11:46.523484","192.168.2.3","192.168.2.1","TCP","183","8009  >  51520 [PSH, ACK] Seq=6707 Ack=1925 Win=17728 Len=117 TSval=1921026 TSecr=1281274857 [TCP segment of a reassembled PDU]"
"138","2018-09-19 10:11:47.616777","192.168.2.3","108.177.125.188","TCP","66","[TCP Dup ACK 75#1] 42262  >  5228 [ACK] Seq=1 Ack=1 Win=406 Len=0 TSval=1921136 TSecr=499377000"
"141","2018-09-19 10:11:51.554134","192.168.2.3","192.168.2.1","TCP","183","8009  >  51520 [PSH, ACK] Seq=6824 Ack=2042 Win=17728 Len=117 TSval=1921529 TSecr=1281279890 [TCP segment of a reassembled PDU]"
"147","2018-09-19 10:12:00.211136","192.168.2.3","172.217.27.174","TCP","74","42654  >  443 [SYN] Seq=0 Win=14600 Len=0 MSS=1460 SACK_PERM=1 TSval=1922395 TSecr=0 WS=64"
"149","2018-09-19 10:12:00.218207","192.168.2.3","172.217.27.174","TCP","66","42654  >  443 [ACK] Seq=1 Ack=1 Win=14656 Len=0 TSval=1922396 TSecr=3758974260"
"150","2018-09-19 10:12:00.218209","192.168.2.3","172.217.27.174","TLSv1.2","583","Client Hello"
"153","2018-09-19 10:12:00.225083","192.168.2.3","172.217.27.174","TCP","66","42654  >  443 [ACK] Seq=518 Ack=149 Win=15680 Len=0 TSval=1922396 TSecr=3758974269"
"154","2018-09-19 10:12:00.225842","192.168.2.3","172.217.27.174","TLSv1.2","109","Change Cipher Spec, Encrypted Handshake Message"
"155","2018-09-19 10:12:00.226332","192.168.2.3","172.217.27.174","TLSv1.2","151","Application Data"
"156","2018-09-19 10:12:00.226908","192.168.2.3","172.217.27.174","TLSv1.2","234","Application Data"
"157","2018-09-19 10:12:00.227247","192.168.2.3","172.217.27.174","TLSv1.2","310","Application Data"
"161","2018-09-19 10:12:00.231991","192.168.2.3","172.217.27.174","TLSv1.2","96","Application Data"
"162","2018-09-19 10:12:00.267110","192.168.2.3","172.217.27.174","TCP","66","42654  >  443 [ACK] Seq=1088 Ack=240 Win=15680 Len=0 TSval=1922401 TSecr=3758974275"
"168","2018-09-19 10:12:00.321652","192.168.2.3","172.217.27.174","TCP","66","42654  >  443 [ACK] Seq=1088 Ack=466 Win=16768 Len=0 TSval=1922406 TSecr=3758974365"
"169","2018-09-19 10:12:00.321655","192.168.2.3","172.217.27.174","TCP","66","42654  >  443 [ACK] Seq=1088 Ack=677 Win=17856 Len=0 TSval=1922406 TSecr=3758974365"
"170","2018-09-19 10:12:00.322125","192.168.2.3","172.217.27.174","TCP","66","42654  >  443 [ACK] Seq=1088 Ack=709 Win=17856 Len=0 TSval=1922406 TSecr=3758974365"
"171","2018-09-19 10:12:00.322128","192.168.2.3","172.217.27.174","TCP","66","42654  >  443 [ACK] Seq=1088 Ack=747 Win=17856 Len=0 TSval=1922406 TSecr=3758974365"
"172","2018-09-19 10:12:00.323656","192.168.2.3","172.217.27.174","TLSv1.2","104","Application Data"
"177","2018-09-19 10:12:06.519609","192.168.2.3","192.168.2.1","TCP","74","8009  >  51525 [SYN, ACK, ECN] Seq=0 Ack=1 Win=14480 Len=0 MSS=1460 SACK_PERM=1 TSval=1923026 TSecr=1281294838 WS=64"
"180","2018-09-19 10:12:06.519922","192.168.2.3","192.168.2.1","TCP","97","8009  >  51520 [PSH, ACK] Seq=6941 Ack=2043 Win=17728 Len=31 TSval=1923026 TSecr=1281294838 [TCP segment of a reassembled PDU]"
"181","2018-09-19 10:12:06.519924","192.168.2.3","192.168.2.1","TCP","66","8009  >  51520 [FIN, ACK] Seq=6972 Ack=2043 Win=17728 Len=0 TSval=1923026 TSecr=1281294838"
"184","2018-09-19 10:12:06.523217","192.168.2.3","192.168.2.1","TCP","66","8009  >  51525 [ACK] Seq=1 Ack=158 Win=15552 Len=0 TSval=1923026 TSecr=1281294842"
"186","2018-09-19 10:12:06.547906","192.168.2.3","192.168.2.1","AJP13","1197","AJP13 Error?"
"189","2018-09-19 10:12:06.550905","192.168.2.3","192.168.2.1","TCP","292","8009  >  51525 [PSH, ACK] Seq=1132 Ack=251 Win=15552 Len=226 TSval=1923029 TSecr=1281294869 [TCP segment of a reassembled PDU]"
"192","2018-09-19 10:12:06.558862","192.168.2.3","192.168.2.1","TCP","1514","8009  >  51525 [ACK] Seq=1358 Ack=376 Win=15552 Len=1448 TSval=1923029 TSecr=1281294871 [TCP segment of a reassembled PDU]"
"193","2018-09-19 10:12:06.558866","192.168.2.3","192.168.2.1","TCP","1514","8009  >  51525 [ACK] Seq=2806 Ack=376 Win=15552 Len=1448 TSval=1923029 TSecr=1281294871 [TCP segment of a reassembled PDU]"
"194","2018-09-19 10:12:06.559069","192.168.2.3","192.168.2.1","TCP","1247","8009  >  51525 [PSH, ACK] Seq=4254 Ack=376 Win=15552 Len=1181 TSval=1923029 TSecr=1281294871 [TCP segment of a reassembled PDU]"
"204","2018-09-19 10:12:11.578742","192.168.2.3","192.168.2.1","TCP","183","8009  >  51525 [PSH, ACK] Seq=5435 Ack=493 Win=15552 Len=117 TSval=1923532 TSecr=1281299891 [TCP segment of a reassembled PDU]"
"206","2018-09-19 10:12:11.580137","192.168.2.3","192.168.2.1","TCP","66","8009  >  51525 [ACK] Seq=5552 Ack=1106 Win=17728 Len=0 TSval=1923532 TSecr=1281299892"
"207","2018-09-19 10:12:11.581808","192.168.2.3","192.168.2.1","TCP","519","8009  >  51525 [PSH, ACK] Seq=5552 Ack=1106 Win=17728 Len=453 TSval=1923532 TSecr=1281299893 [TCP segment of a reassembled PDU]"
"222","2018-09-19 10:12:18.977949","192.168.2.3","64.233.188.188","TCP","66","[TCP Keep-Alive] 36126  >  5228 [ACK] Seq=27 Ack=27 Win=406 Len=0 TSval=1924272 TSecr=1098107350"
"225","2018-09-19 10:12:19.892952","192.168.2.3","192.168.2.1","TCP","183","8009  >  51525 [PSH, ACK] Seq=6005 Ack=1223 Win=17728 Len=117 TSval=1924363 TSecr=1281308203 [TCP segment of a reassembled PDU]"
"230","2018-09-19 10:12:31.560887","192.168.2.3","192.168.2.1","TCP","183","8009  >  51525 [PSH, ACK] Seq=6122 Ack=1340 Win=17728 Len=117 TSval=1925530 TSecr=1281319860 [TCP segment of a reassembled PDU]"
"243","2018-09-19 10:12:32.737315","192.168.2.3","108.177.125.188","TCP","66","[TCP Dup ACK 75#2] 42262  >  5228 [ACK] Seq=1 Ack=1 Win=406 Len=0 TSval=1925648 TSecr=499422102"
"247","2018-09-19 10:12:41.566525","192.168.2.3","192.168.2.1","TCP","183","8009  >  51525 [PSH, ACK] Seq=6239 Ack=1457 Win=17728 Len=117 TSval=1926530 TSecr=1281329869 [TCP segment of a reassembled PDU]"
"249","2018-09-19 10:12:45.377397","192.168.2.3","172.217.27.174","TCP","66","[TCP Keep-Alive] 42654  >  443 [ACK] Seq=1125 Ack=747 Win=17856 Len=0 TSval=1926912 TSecr=3758974373"
"260","2018-09-19 10:12:56.572818","192.168.2.3","192.168.2.1","TCP","183","8009  >  51525 [PSH, ACK] Seq=6356 Ack=1574 Win=17728 Len=117 TSval=1928031 TSecr=1281344868 [TCP segment of a reassembled PDU]"
"284","2018-09-19 10:13:04.098320","192.168.2.3","64.233.188.188","TCP","66","[TCP Keep-Alive] 36126  >  5228 [ACK] Seq=27 Ack=27 Win=406 Len=0 TSval=1928784 TSecr=1098152453"
"290","2018-09-19 10:13:04.612544","192.168.2.3","172.217.27.174","TCP","74","42655  >  443 [SYN] Seq=0 Win=14600 Len=0 MSS=1460 SACK_PERM=1 TSval=1928835 TSecr=0 WS=64"
"292","2018-09-19 10:13:04.621175","192.168.2.3","172.217.27.174","TCP","66","42655  >  443 [ACK] Seq=1 Ack=1 Win=14656 Len=0 TSval=1928836 TSecr=1662698379"
"293","2018-09-19 10:13:04.621665","192.168.2.3","172.217.27.174","TLSv1.2","583","Client Hello"
"296","2018-09-19 10:13:04.629207","192.168.2.3","172.217.27.174","TCP","66","42655  >  443 [ACK] Seq=518 Ack=149 Win=15680 Len=0 TSval=1928837 TSecr=1662698389"
"297","2018-09-19 10:13:04.629621","192.168.2.3","172.217.27.174","TLSv1.2","109","Change Cipher Spec, Encrypted Handshake Message"
"299","2018-09-19 10:13:04.644662","192.168.2.3","172.217.27.174","TLSv1.2","151","Application Data"
"300","2018-09-19 10:13:04.645237","192.168.2.3","172.217.27.174","TLSv1.2","96","Application Data"
"302","2018-09-19 10:13:04.661803","192.168.2.3","172.217.27.174","TLSv1.2","179","Application Data"
"303","2018-09-19 10:13:04.662033","192.168.2.3","172.217.27.174","TCP","1434","42655  >  443 [ACK] Seq=789 Ack=210 Win=15680 Len=1368 TSval=1928838 TSecr=1662698396 [TCP segment of a reassembled PDU]"
"304","2018-09-19 10:13:04.662035","192.168.2.3","172.217.27.174","TCP","1434","42655  >  443 [ACK] Seq=2157 Ack=210 Win=15680 Len=1368 TSval=1928838 TSecr=1662698396 [TCP segment of a reassembled PDU]"
"305","2018-09-19 10:13:04.662036","192.168.2.3","172.217.27.174","TLSv1.2","212","Application Data"
"306","2018-09-19 10:13:04.662192","192.168.2.3","172.217.27.174","TLSv1.2","675","Application Data"
"310","2018-09-19 10:13:04.687553","192.168.2.3","172.217.27.174","TCP","66","42655  >  443 [ACK] Seq=4280 Ack=240 Win=15680 Len=0 TSval=1928843 TSecr=1662698411"
"315","2018-09-19 10:13:04.863370","192.168.2.3","172.217.27.174","TCP","66","42655  >  443 [ACK] Seq=4280 Ack=566 Win=16768 Len=0 TSval=1928860 TSecr=1662698623"
"316","2018-09-19 10:13:04.863372","192.168.2.3","172.217.27.174","TCP","66","42655  >  443 [ACK] Seq=4280 Ack=808 Win=17856 Len=0 TSval=1928860 TSecr=1662698623"
"317","2018-09-19 10:13:04.863373","192.168.2.3","172.217.27.174","TCP","66","42655  >  443 [ACK] Seq=4280 Ack=838 Win=17856 Len=0 TSval=1928860 TSecr=1662698623"
"318","2018-09-19 10:13:04.863374","192.168.2.3","172.217.27.174","TCP","66","42655  >  443 [ACK] Seq=4280 Ack=876 Win=17856 Len=0 TSval=1928860 TSecr=1662698623"
"319","2018-09-19 10:13:04.864998","192.168.2.3","172.217.27.174","TLSv1.2","104","Application Data"
"326","2018-09-19 10:13:05.199520","192.168.2.3","172.217.161.234","TCP","74","41275  >  443 [SYN] Seq=0 Win=14600 Len=0 MSS=1460 SACK_PERM=1 TSval=1928894 TSecr=0 WS=64"
"328","2018-09-19 10:13:05.205636","192.168.2.3","172.217.161.234","TCP","66","41275  >  443 [ACK] Seq=1 Ack=1 Win=14656 Len=0 TSval=1928894 TSecr=16454722"
"329","2018-09-19 10:13:05.206190","192.168.2.3","172.217.161.234","TLSv1.2","583","Client Hello"
"332","2018-09-19 10:13:05.212727","192.168.2.3","172.217.161.234","TCP","66","41275  >  443 [ACK] Seq=518 Ack=149 Win=15680 Len=0 TSval=1928895 TSecr=16454729"
"333","2018-09-19 10:13:05.213215","192.168.2.3","172.217.161.234","TLSv1.2","109","Change Cipher Spec, Encrypted Handshake Message"
"335","2018-09-19 10:13:05.226651","192.168.2.3","172.217.161.234","TLSv1.2","151","Application Data"
"336","2018-09-19 10:13:05.226653","192.168.2.3","172.217.161.234","TLSv1.2","96","Application Data"
"337","2018-09-19 10:13:05.226654","192.168.2.3","172.217.161.234","TLSv1.2","322","Application Data"
"338","2018-09-19 10:13:05.226655","192.168.2.3","172.217.161.234","TLSv1.2","330","Application Data"
"342","2018-09-19 10:13:05.283601","192.168.2.3","172.217.161.234","TCP","66","41275  >  443 [ACK] Seq=1196 Ack=240 Win=15680 Len=0 TSval=1928901 TSecr=16454748"
"347","2018-09-19 10:13:05.297349","192.168.2.3","172.217.161.234","TCP","66","41275  >  443 [ACK] Seq=1196 Ack=494 Win=16768 Len=0 TSval=1928903 TSecr=16454814"
"348","2018-09-19 10:13:05.297906","192.168.2.3","172.217.161.234","TCP","66","41275  >  443 [ACK] Seq=1196 Ack=846 Win=17856 Len=0 TSval=1928904 TSecr=16454814"
"349","2018-09-19 10:13:05.297909","192.168.2.3","172.217.161.234","TCP","66","41275  >  443 [ACK] Seq=1196 Ack=932 Win=17856 Len=0 TSval=1928904 TSecr=16454814"
"350","2018-09-19 10:13:05.298420","192.168.2.3","172.217.161.234","TCP","66","41275  >  443 [ACK] Seq=1196 Ack=970 Win=17856 Len=0 TSval=1928904 TSecr=16454814"
"351","2018-09-19 10:13:05.299749","192.168.2.3","172.217.161.234","TLSv1.2","104","Application Data"
