"No.","Time","Source","Destination","Protocol","Length","Info"
"1","2018-09-19 09:54:18.485269","192.168.2.3","64.233.188.188","TCP","66","36126  >  5228 [ACK] Seq=1 Ack=1 Win=406 Len=0 TSval=1816224 TSecr=1097026911"
"8","2018-09-19 09:54:20.207925","192.168.2.3","192.168.2.1","TCP","66","8009  >  51496 [ACK] Seq=1 Ack=580 Win=260 Len=0 TSval=1816396 TSecr=1280229151"
"9","2018-09-19 09:54:20.208962","192.168.2.3","192.168.2.1","TCP","183","8009  >  51496 [PSH, ACK] Seq=1 Ack=580 Win=260 Len=117 TSval=1816396 TSecr=1280229151 [TCP segment of a reassembled PDU]"
"11","2018-09-19 09:54:20.216178","192.168.2.3","192.168.2.1","TCP","519","8009  >  51496 [PSH, ACK] Seq=118 Ack=731 Win=277 Len=453 TSval=1816397 TSecr=1280229153 [TCP segment of a reassembled PDU]"
"32","2018-09-19 09:54:29.845437","192.168.2.3","108.177.125.188","TCP","66","42262  >  5228 [ACK] Seq=1 Ack=1 Win=406 Len=0 TSval=1817360 TSecr=498339289"
"46","2018-09-19 09:54:30.230897","192.168.2.3","192.168.2.1","TCP","183","8009  >  51496 [PSH, ACK] Seq=571 Ack=848 Win=277 Len=117 TSval=1817398 TSecr=1280239164 [TCP segment of a reassembled PDU]"
"49","2018-09-19 09:54:35.251207","192.168.2.3","192.168.2.1","AJP13","183","AJP13 Error? [TCP segment of a reassembled PDU]"
"52","2018-09-19 09:54:42.033913","192.168.2.3","192.168.2.1","TCP","183","8009  >  51496 [PSH, ACK] Seq=805 Ack=1082 Win=277 Len=117 TSval=1818578 TSecr=1280250965 [TCP segment of a reassembled PDU]"
"56","2018-09-19 09:54:55.253185","192.168.2.3","192.168.2.1","TCP","74","8009  >  51498 [SYN, ACK, ECN] Seq=0 Ack=1 Win=14480 Len=0 MSS=1460 SACK_PERM=1 TSval=1819900 TSecr=1280264176 WS=64"
"57","2018-09-19 09:54:55.253189","192.168.2.3","192.168.2.1","TCP","97","8009  >  51496 [PSH, ACK] Seq=922 Ack=1083 Win=277 Len=31 TSval=1819900 TSecr=1280264176 [TCP segment of a reassembled PDU]"
"61","2018-09-19 09:54:55.253749","192.168.2.3","192.168.2.1","TCP","66","8009  >  51496 [FIN, ACK] Seq=953 Ack=1083 Win=277 Len=0 TSval=1819900 TSecr=1280264176"
"63","2018-09-19 09:54:55.255486","192.168.2.3","192.168.2.1","TCP","66","8009  >  51498 [ACK] Seq=1 Ack=158 Win=15552 Len=0 TSval=1819900 TSecr=1280264177"
"64","2018-09-19 09:54:55.278515","192.168.2.3","192.168.2.1","AJP13","1197","AJP13 Error?"
"67","2018-09-19 09:54:55.281627","192.168.2.3","192.168.2.1","TCP","292","8009  >  51498 [PSH, ACK] Seq=1132 Ack=251 Win=15552 Len=226 TSval=1819903 TSecr=1280264202 [TCP segment of a reassembled PDU]"
"70","2018-09-19 09:54:55.293234","192.168.2.3","192.168.2.1","TCP","1514","8009  >  51498 [ACK] Seq=1358 Ack=376 Win=15552 Len=1448 TSval=1819904 TSecr=1280264205 [TCP segment of a reassembled PDU]"
"71","2018-09-19 09:54:55.293632","192.168.2.3","192.168.2.1","TCP","1514","8009  >  51498 [ACK] Seq=2806 Ack=376 Win=15552 Len=1448 TSval=1819904 TSecr=1280264205 [TCP segment of a reassembled PDU]"
"72","2018-09-19 09:54:55.293634","192.168.2.3","192.168.2.1","TCP","1247","8009  >  51498 [PSH, ACK] Seq=4254 Ack=376 Win=15552 Len=1181 TSval=1819904 TSecr=1280264205 [TCP segment of a reassembled PDU]"
"81","2018-09-19 09:55:00.311966","192.168.2.3","192.168.2.1","TCP","183","8009  >  51498 [PSH, ACK] Seq=5435 Ack=493 Win=15552 Len=117 TSval=1820406 TSecr=1280269229 [TCP segment of a reassembled PDU]"
"83","2018-09-19 09:55:00.312851","192.168.2.3","192.168.2.1","TCP","66","8009  >  51498 [ACK] Seq=5552 Ack=1106 Win=17728 Len=0 TSval=1820406 TSecr=1280269230"
"84","2018-09-19 09:55:00.316071","192.168.2.3","192.168.2.1","TCP","519","8009  >  51498 [PSH, ACK] Seq=5552 Ack=1106 Win=17728 Len=453 TSval=1820406 TSecr=1280269231 [TCP segment of a reassembled PDU]"
"86","2018-09-19 09:55:00.725833","192.168.2.3","172.217.27.174","TCP","66","42647  >  443 [ACK] Seq=1 Ack=1 Win=539 Len=0 TSval=1820448 TSecr=804064393"
"89","2018-09-19 09:55:03.618623","192.168.2.3","64.233.188.188","TCP","66","[TCP Dup ACK 1#1] 36126  >  5228 [ACK] Seq=1 Ack=1 Win=406 Len=0 TSval=1820736 TSecr=1097071960"
"92","2018-09-19 09:55:05.319442","192.168.2.3","192.168.2.1","TCP","183","8009  >  51498 [PSH, ACK] Seq=6005 Ack=1223 Win=17728 Len=117 TSval=1820907 TSecr=1280274234 [TCP segment of a reassembled PDU]"
"100","2018-09-19 09:55:12.112248","192.168.2.3","192.168.2.1","TCP","183","8009  >  51498 [PSH, ACK] Seq=6122 Ack=1340 Win=17728 Len=117 TSval=1821586 TSecr=1280281022 [TCP segment of a reassembled PDU]"
"102","2018-09-19 09:55:14.966132","192.168.2.3","108.177.125.188","TCP","66","[TCP Dup ACK 32#1] 42262  >  5228 [ACK] Seq=1 Ack=1 Win=406 Len=0 TSval=1821872 TSecr=498384329"
"106","2018-09-19 09:55:17.136016","192.168.2.3","192.168.2.1","TCP","183","8009  >  51498 [PSH, ACK] Seq=6239 Ack=1457 Win=17728 Len=117 TSval=1822087 TSecr=1280286029 [TCP segment of a reassembled PDU]"
"116","2018-09-19 09:55:23.913486","192.168.2.3","192.168.2.1","TCP","183","8009  >  51498 [PSH, ACK] Seq=6356 Ack=1574 Win=17728 Len=117 TSval=1822766 TSecr=1280292814 [TCP segment of a reassembled PDU]"
"139","2018-09-19 09:55:33.480930","192.168.2.3","64.233.188.188","TCP","92","[TCP Previous segment not captured] 36126  >  5228 [PSH, ACK] Seq=2 Ack=1 Win=406 Len=26 TSval=1823723 TSecr=1097117093"
"141","2018-09-19 09:55:33.524191","192.168.2.3","64.233.188.188","TCP","66","36126  >  5228 [ACK] Seq=28 Ack=27 Win=406 Len=0 TSval=1823727 TSecr=1097146956"
"150","2018-09-19 09:55:37.137879","192.168.2.3","192.168.2.1","TCP","74","8009  >  51499 [SYN, ACK, ECN] Seq=0 Ack=1 Win=14480 Len=0 MSS=1460 SACK_PERM=1 TSval=1824089 TSecr=1280306036 WS=64"
"151","2018-09-19 09:55:37.137882","192.168.2.3","192.168.2.1","TCP","97","8009  >  51498 [PSH, ACK] Seq=6473 Ack=1575 Win=17728 Len=31 TSval=1824089 TSecr=1280306036 [TCP segment of a reassembled PDU]"
"155","2018-09-19 09:55:37.141800","192.168.2.3","192.168.2.1","TCP","66","8009  >  51498 [FIN, ACK] Seq=6504 Ack=1575 Win=17728 Len=0 TSval=1824089 TSecr=1280306036"
"157","2018-09-19 09:55:37.152230","192.168.2.3","192.168.2.1","TCP","66","8009  >  51499 [ACK] Seq=1 Ack=158 Win=15552 Len=0 TSval=1824090 TSecr=1280306037"
"158","2018-09-19 09:55:37.173062","192.168.2.3","192.168.2.1","AJP13","1197","AJP13 Error?"
"161","2018-09-19 09:55:37.176965","192.168.2.3","192.168.2.1","TCP","292","8009  >  51499 [PSH, ACK] Seq=1132 Ack=251 Win=15552 Len=226 TSval=1824092 TSecr=1280306070 [TCP segment of a reassembled PDU]"
"164","2018-09-19 09:55:37.181382","192.168.2.3","192.168.2.1","TCP","1514","8009  >  51499 [ACK] Seq=1358 Ack=376 Win=15552 Len=1448 TSval=1824093 TSecr=1280306073 [TCP segment of a reassembled PDU]"
"165","2018-09-19 09:55:37.183109","192.168.2.3","192.168.2.1","TCP","1514","8009  >  51499 [ACK] Seq=2806 Ack=376 Win=15552 Len=1448 TSval=1824093 TSecr=1280306073 [TCP segment of a reassembled PDU]"
"167","2018-09-19 09:55:37.183735","192.168.2.3","192.168.2.1","TCP","1247","8009  >  51499 [PSH, ACK] Seq=4254 Ack=376 Win=15552 Len=1181 TSval=1824093 TSecr=1280306073 [TCP segment of a reassembled PDU]"
"176","2018-09-19 09:55:42.200275","192.168.2.3","192.168.2.1","TCP","183","8009  >  51499 [PSH, ACK] Seq=5435 Ack=493 Win=15552 Len=117 TSval=1824595 TSecr=1280311088 [TCP segment of a reassembled PDU]"
"178","2018-09-19 09:55:42.200600","192.168.2.3","192.168.2.1","TCP","66","8009  >  51499 [ACK] Seq=5552 Ack=1106 Win=17728 Len=0 TSval=1824595 TSecr=1280311089"
"179","2018-09-19 09:55:42.202103","192.168.2.3","192.168.2.1","TCP","519","8009  >  51499 [PSH, ACK] Seq=5552 Ack=1106 Win=17728 Len=453 TSval=1824595 TSecr=1280311089 [TCP segment of a reassembled PDU]"
"181","2018-09-19 09:55:45.846598","192.168.2.3","172.217.27.174","TCP","66","[TCP Dup ACK 86#1] 42647  >  443 [ACK] Seq=1 Ack=1 Win=539 Len=0 TSval=1824960 TSecr=804109513"
"185","2018-09-19 09:55:52.208536","192.168.2.3","192.168.2.1","TCP","183","8009  >  51499 [PSH, ACK] Seq=6005 Ack=1223 Win=17728 Len=117 TSval=1825596 TSecr=1280321093 [TCP segment of a reassembled PDU]"
"188","2018-09-19 09:56:00.086799","192.168.2.3","108.177.125.188","TCP","66","[TCP Dup ACK 32#2] 42262  >  5228 [ACK] Seq=1 Ack=1 Win=406 Len=0 TSval=1826384 TSecr=498429449"
"192","2018-09-19 09:56:00.324339","192.168.2.3","172.217.27.174","TCP","66","[TCP Previous segment not captured] 42647  >  443 [FIN, ACK] Seq=2 Ack=57 Win=539 Len=0 TSval=1826407 TSecr=804169105"
"195","2018-09-19 09:56:00.965926","192.168.2.3","192.168.2.1","TCP","183","8009  >  51499 [PSH, ACK] Seq=6122 Ack=1340 Win=17728 Len=117 TSval=1826471 TSecr=1280329832 [TCP segment of a reassembled PDU]"
"200","2018-09-19 09:56:07.743442","192.168.2.3","192.168.2.1","TCP","183","8009  >  51499 [PSH, ACK] Seq=6239 Ack=1457 Win=17728 Len=117 TSval=1827149 TSecr=1280336621 [TCP segment of a reassembled PDU]"
"202","2018-09-19 09:56:18.578610","192.168.2.3","64.233.188.188","TCP","66","[TCP Keep-Alive] 36126  >  5228 [ACK] Seq=27 Ack=27 Win=406 Len=0 TSval=1828232 TSecr=1097146956"
"206","2018-09-19 09:56:20.967677","192.168.2.3","192.168.2.1","TCP","74","8009  >  51500 [SYN, ACK, ECN] Seq=0 Ack=1 Win=14480 Len=0 MSS=1460 SACK_PERM=1 TSval=1828472 TSecr=1280349841 WS=64"
"208","2018-09-19 09:56:20.967963","192.168.2.3","192.168.2.1","TCP","97","8009  >  51499 [PSH, ACK] Seq=6356 Ack=1458 Win=17728 Len=31 TSval=1828472 TSecr=1280349841 [TCP segment of a reassembled PDU]"
"211","2018-09-19 09:56:20.968806","192.168.2.3","192.168.2.1","TCP","66","8009  >  51499 [FIN, ACK] Seq=6387 Ack=1458 Win=17728 Len=0 TSval=1828472 TSecr=1280349841"
"213","2018-09-19 09:56:20.969495","192.168.2.3","192.168.2.1","TCP","66","8009  >  51500 [ACK] Seq=1 Ack=158 Win=15552 Len=0 TSval=1828472 TSecr=1280349842"
"214","2018-09-19 09:56:20.993451","192.168.2.3","192.168.2.1","AJP13","1197","AJP13 Error?"
"217","2018-09-19 09:56:21.001843","192.168.2.3","192.168.2.1","TCP","292","8009  >  51500 [PSH, ACK] Seq=1132 Ack=251 Win=15552 Len=226 TSval=1828475 TSecr=1280349867 [TCP segment of a reassembled PDU]"
"220","2018-09-19 09:56:21.004553","192.168.2.3","192.168.2.1","TCP","1514","8009  >  51500 [ACK] Seq=1358 Ack=376 Win=15552 Len=1448 TSval=1828475 TSecr=1280349875 [TCP segment of a reassembled PDU]"
"221","2018-09-19 09:56:21.004902","192.168.2.3","192.168.2.1","TCP","1514","8009  >  51500 [ACK] Seq=2806 Ack=376 Win=15552 Len=1448 TSval=1828475 TSecr=1280349875 [TCP segment of a reassembled PDU]"
"222","2018-09-19 09:56:21.004904","192.168.2.3","192.168.2.1","TCP","1247","8009  >  51500 [PSH, ACK] Seq=4254 Ack=376 Win=15552 Len=1181 TSval=1828475 TSecr=1280349875 [TCP segment of a reassembled PDU]"
"228","2018-09-19 09:56:26.028394","192.168.2.3","192.168.2.1","TCP","183","8009  >  51500 [PSH, ACK] Seq=5435 Ack=493 Win=15552 Len=117 TSval=1828978 TSecr=1280354895 [TCP segment of a reassembled PDU]"
"232","2018-09-19 09:56:26.030432","192.168.2.3","192.168.2.1","TCP","66","8009  >  51500 [ACK] Seq=5552 Ack=1106 Win=17728 Len=0 TSval=1828978 TSecr=1280354896"
"233","2018-09-19 09:56:26.033133","192.168.2.3","192.168.2.1","TCP","519","8009  >  51500 [PSH, ACK] Seq=5552 Ack=1106 Win=17728 Len=453 TSval=1828978 TSecr=1280354896 [TCP segment of a reassembled PDU]"
"260","2018-09-19 09:56:36.052340","192.168.2.3","192.168.2.1","TCP","183","8009  >  51500 [PSH, ACK] Seq=6005 Ack=1223 Win=17728 Len=117 TSval=1829980 TSecr=1280364901 [TCP segment of a reassembled PDU]"
"263","2018-09-19 09:56:42.855202","192.168.2.3","192.168.2.1","TCP","183","8009  >  51500 [PSH, ACK] Seq=6122 Ack=1340 Win=17728 Len=117 TSval=1830660 TSecr=1280371697 [TCP segment of a reassembled PDU]"
"265","2018-09-19 09:56:45.207116","192.168.2.3","108.177.125.188","TCP","66","[TCP Dup ACK 32#3] 42262  >  5228 [ACK] Seq=1 Ack=1 Win=406 Len=0 TSval=1830896 TSecr=498474570"
"276","2018-09-19 09:56:49.628994","192.168.2.3","192.168.2.1","TCP","183","8009  >  51500 [PSH, ACK] Seq=6239 Ack=1457 Win=17728 Len=117 TSval=1831338 TSecr=1280378484 [TCP segment of a reassembled PDU]"
"297","2018-09-19 09:57:00.200176","192.168.2.3","172.217.27.174","TCP","74","42648  >  443 [SYN] Seq=0 Win=14600 Len=0 MSS=1460 SACK_PERM=1 TSval=1832395 TSecr=0 WS=64"
"299","2018-09-19 09:57:00.207478","192.168.2.3","172.217.27.174","TCP","66","42648  >  443 [ACK] Seq=1 Ack=1 Win=14656 Len=0 TSval=1832396 TSecr=3867495156"
"300","2018-09-19 09:57:00.208071","192.168.2.3","172.217.27.174","TLSv1.2","583","Client Hello"
"303","2018-09-19 09:57:00.221481","192.168.2.3","172.217.27.174","TCP","66","42648  >  443 [ACK] Seq=518 Ack=149 Win=15680 Len=0 TSval=1832397 TSecr=3867495165"
"304","2018-09-19 09:57:00.221869","192.168.2.3","172.217.27.174","TLSv1.2","109","Change Cipher Spec, Encrypted Handshake Message"
"305","2018-09-19 09:57:00.222870","192.168.2.3","172.217.27.174","TLSv1.2","151","Application Data"
"308","2018-09-19 09:57:00.234456","192.168.2.3","172.217.27.174","TLSv1.2","235","Application Data"
"309","2018-09-19 09:57:00.234458","192.168.2.3","172.217.27.174","TLSv1.2","310","Application Data"
"310","2018-09-19 09:57:00.234459","192.168.2.3","172.217.27.174","TCP","66","42648  >  443 [ACK] Seq=1059 Ack=240 Win=15680 Len=0 TSval=1832398 TSecr=3867495178"
"311","2018-09-19 09:57:00.234804","192.168.2.3","172.217.27.174","TLSv1.2","96","Application Data"
"318","2018-09-19 09:57:00.321299","192.168.2.3","172.217.27.174","TCP","66","42648  >  443 [ACK] Seq=1089 Ack=685 Win=17856 Len=0 TSval=1832407 TSecr=3867495267"
"319","2018-09-19 09:57:00.324356","192.168.2.3","172.217.27.174","TCP","66","42648  >  443 [ACK] Seq=1089 Ack=970 Win=18944 Len=0 TSval=1832407 TSecr=3867495268"
"320","2018-09-19 09:57:00.324949","192.168.2.3","172.217.27.174","TLSv1.2","104","Application Data"
"324","2018-09-19 09:57:02.857864","192.168.2.3","192.168.2.1","TCP","74","8009  >  51502 [SYN, ACK, ECN] Seq=0 Ack=1 Win=14480 Len=0 MSS=1460 SACK_PERM=1 TSval=1832661 TSecr=1280391706 WS=64"
"327","2018-09-19 09:57:02.858963","192.168.2.3","192.168.2.1","TCP","97","8009  >  51500 [PSH, ACK] Seq=6356 Ack=1458 Win=17728 Len=31 TSval=1832661 TSecr=1280391706 [TCP segment of a reassembled PDU]"
"328","2018-09-19 09:57:02.858966","192.168.2.3","192.168.2.1","TCP","66","8009  >  51500 [FIN, ACK] Seq=6387 Ack=1458 Win=17728 Len=0 TSval=1832661 TSecr=1280391706"
"331","2018-09-19 09:57:02.865434","192.168.2.3","192.168.2.1","TCP","66","8009  >  51502 [ACK] Seq=1 Ack=158 Win=15552 Len=0 TSval=1832661 TSecr=1280391708"
"332","2018-09-19 09:57:02.888963","192.168.2.3","192.168.2.1","AJP13","1197","AJP13 Error?"
"335","2018-09-19 09:57:02.891387","192.168.2.3","192.168.2.1","TCP","292","8009  >  51502 [PSH, ACK] Seq=1132 Ack=251 Win=15552 Len=226 TSval=1832664 TSecr=1280391738 [TCP segment of a reassembled PDU]"
"338","2018-09-19 09:57:02.894807","192.168.2.3","192.168.2.1","TCP","1514","8009  >  51502 [ACK] Seq=1358 Ack=376 Win=15552 Len=1448 TSval=1832664 TSecr=1280391740 [TCP segment of a reassembled PDU]"
"339","2018-09-19 09:57:02.894810","192.168.2.3","192.168.2.1","TCP","1514","8009  >  51502 [ACK] Seq=2806 Ack=376 Win=15552 Len=1448 TSval=1832664 TSecr=1280391740 [TCP segment of a reassembled PDU]"
"342","2018-09-19 09:57:02.895016","192.168.2.3","192.168.2.1","TCP","1247","8009  >  51502 [PSH, ACK] Seq=4254 Ack=376 Win=15552 Len=1181 TSval=1832664 TSecr=1280391740 [TCP segment of a reassembled PDU]"
"344","2018-09-19 09:57:03.617173","192.168.2.3","64.233.188.188","TCP","66","[TCP Keep-Alive] 36126  >  5228 [ACK] Seq=27 Ack=27 Win=406 Len=0 TSval=1832736 TSecr=1097192053"
"350","2018-09-19 09:57:07.917627","192.168.2.3","192.168.2.1","TCP","183","8009  >  51502 [PSH, ACK] Seq=5435 Ack=493 Win=15552 Len=117 TSval=1833167 TSecr=1280396760 [TCP segment of a reassembled PDU]"
"353","2018-09-19 09:57:07.925421","192.168.2.3","192.168.2.1","TCP","66","8009  >  51502 [ACK] Seq=5552 Ack=1106 Win=17728 Len=0 TSval=1833167 TSecr=1280396761"
"354","2018-09-19 09:57:07.925424","192.168.2.3","192.168.2.1","TCP","519","8009  >  51502 [PSH, ACK] Seq=5552 Ack=1106 Win=17728 Len=453 TSval=1833167 TSecr=1280396761 [TCP segment of a reassembled PDU]"
"359","2018-09-19 09:57:17.934770","192.168.2.3","192.168.2.1","TCP","183","8009  >  51502 [PSH, ACK] Seq=6005 Ack=1223 Win=17728 Len=117 TSval=1834168 TSecr=1280406771 [TCP segment of a reassembled PDU]"
