"No.","Time","Source","Destination","Protocol","Length","Info"
"6","2018-09-19 09:39:00.240817","192.168.2.3","192.168.2.1","TCP","183","8009  >  51474 [PSH, ACK] Seq=1 Ack=118 Win=277 Len=117 TSval=1724400 TSecr=1279309696 [TCP segment of a reassembled PDU]"
"8","2018-09-19 09:39:03.278196","192.168.2.3","64.233.188.188","TCP","66","36126  >  5228 [ACK] Seq=1 Ack=1 Win=406 Len=0 TSval=1724704 TSecr=1096111631"
"11","2018-09-19 09:39:05.251573","192.168.2.3","192.168.2.1","TCP","183","8009  >  51474 [PSH, ACK] Seq=118 Ack=235 Win=277 Len=117 TSval=1724901 TSecr=1279314698 [TCP segment of a reassembled PDU]"
"13","2018-09-19 09:39:15.595579","192.168.2.3","216.58.197.14","TCP","66","46334  >  443 [ACK] Seq=1 Ack=1 Win=279 Len=0 TSval=1725936 TSecr=4180422673"
"15","2018-09-19 09:39:16.891318","192.168.2.3","108.177.125.188","TCP","66","42262  >  5228 [ACK] Seq=1 Ack=1 Win=406 Len=0 TSval=1726064 TSecr=497426267"
"17","2018-09-19 09:39:18.155659","192.168.2.3","172.217.27.174","TCP","66","42640  >  443 [ACK] Seq=1 Ack=1 Win=494 Len=0 TSval=1726192 TSecr=3989723271"
"19","2018-09-19 09:39:18.638185","192.168.2.3","216.58.199.234","TCP","66","49477  >  443 [ACK] Seq=1 Ack=1 Win=495 Len=0 TSval=1726240 TSecr=2043789285"
"23","2018-09-19 09:39:20.242675","192.168.2.3","192.168.2.1","TCP","74","8009  >  51475 [SYN, ACK, ECN] Seq=0 Ack=1 Win=14480 Len=0 MSS=1460 SACK_PERM=1 TSval=1726400 TSecr=1279329691 WS=64"
"26","2018-09-19 09:39:20.243040","192.168.2.3","192.168.2.1","TCP","97","8009  >  51474 [PSH, ACK] Seq=235 Ack=236 Win=277 Len=31 TSval=1726400 TSecr=1279329691 [TCP segment of a reassembled PDU]"
"27","2018-09-19 09:39:20.243043","192.168.2.3","192.168.2.1","TCP","66","8009  >  51474 [FIN, ACK] Seq=266 Ack=236 Win=277 Len=0 TSval=1726400 TSecr=1279329691"
"30","2018-09-19 09:39:20.244446","192.168.2.3","192.168.2.1","TCP","66","8009  >  51475 [ACK] Seq=1 Ack=158 Win=15552 Len=0 TSval=1726400 TSecr=1279329692"
"31","2018-09-19 09:39:20.266425","192.168.2.3","192.168.2.1","AJP13","1197","AJP13 Error?"
"34","2018-09-19 09:39:20.271089","192.168.2.3","192.168.2.1","TCP","292","8009  >  51475 [PSH, ACK] Seq=1132 Ack=251 Win=15552 Len=226 TSval=1726403 TSecr=1279329714 [TCP segment of a reassembled PDU]"
"37","2018-09-19 09:39:20.276442","192.168.2.3","192.168.2.1","TCP","1514","8009  >  51475 [ACK] Seq=1358 Ack=376 Win=15552 Len=1448 TSval=1726403 TSecr=1279329718 [TCP segment of a reassembled PDU]"
"38","2018-09-19 09:39:20.276661","192.168.2.3","192.168.2.1","TCP","1514","8009  >  51475 [ACK] Seq=2806 Ack=376 Win=15552 Len=1448 TSval=1726403 TSecr=1279329718 [TCP segment of a reassembled PDU]"
"39","2018-09-19 09:39:20.276817","192.168.2.3","192.168.2.1","TCP","1247","8009  >  51475 [PSH, ACK] Seq=4254 Ack=376 Win=15552 Len=1181 TSval=1726403 TSecr=1279329718 [TCP segment of a reassembled PDU]"
"45","2018-09-19 09:39:25.305876","192.168.2.3","192.168.2.1","TCP","66","8009  >  51475 [ACK] Seq=5435 Ack=955 Win=16640 Len=0 TSval=1726906 TSecr=1279334743"
"46","2018-09-19 09:39:25.333505","192.168.2.3","192.168.2.1","TCP","183","8009  >  51475 [PSH, ACK] Seq=5435 Ack=955 Win=16640 Len=117 TSval=1726907 TSecr=1279334743 [TCP segment of a reassembled PDU]"
"47","2018-09-19 09:39:25.333507","192.168.2.3","192.168.2.1","TCP","519","8009  >  51475 [PSH, ACK] Seq=5552 Ack=1106 Win=17728 Len=453 TSval=1726908 TSecr=1279334745 [TCP segment of a reassembled PDU]"
"61","2018-09-19 09:39:33.066523","192.168.2.3","64.233.188.188","TCP","92","[TCP Previous segment not captured] 36126  >  5228 [PSH, ACK] Seq=2 Ack=1 Win=406 Len=26 TSval=1727683 TSecr=1096156752"
"63","2018-09-19 09:39:33.129259","192.168.2.3","64.233.188.188","TCP","66","36126  >  5228 [ACK] Seq=28 Ack=27 Win=406 Len=0 TSval=1727689 TSecr=1096186542"
"67","2018-09-19 09:39:35.359192","192.168.2.3","192.168.2.1","TCP","183","8009  >  51475 [PSH, ACK] Seq=6005 Ack=1223 Win=17728 Len=117 TSval=1727911 TSecr=1279344780 [TCP segment of a reassembled PDU]"
"80","2018-09-19 09:39:41.124206","192.168.2.3","192.168.2.1","TCP","183","8009  >  51475 [PSH, ACK] Seq=6122 Ack=1340 Win=17728 Len=117 TSval=1728488 TSecr=1279350553 [TCP segment of a reassembled PDU]"
"86","2018-09-19 09:39:47.910727","192.168.2.3","192.168.2.1","TCP","183","8009  >  51475 [PSH, ACK] Seq=6239 Ack=1457 Win=17728 Len=117 TSval=1729167 TSecr=1279357338 [TCP segment of a reassembled PDU]"
"96","2018-09-19 09:40:00.716052","192.168.2.3","216.58.197.14","TCP","66","[TCP Dup ACK 13#1] 46334  >  443 [ACK] Seq=1 Ack=1 Win=279 Len=0 TSval=1730448 TSecr=4180467794"
"100","2018-09-19 09:40:01.128036","192.168.2.3","192.168.2.1","TCP","74","8009  >  51476 [SYN, ACK, ECN] Seq=0 Ack=1 Win=14480 Len=0 MSS=1460 SACK_PERM=1 TSval=1730489 TSecr=1279370550 WS=64"
"101","2018-09-19 09:40:01.128041","192.168.2.3","192.168.2.1","TCP","97","8009  >  51475 [PSH, ACK] Seq=6356 Ack=1458 Win=17728 Len=31 TSval=1730489 TSecr=1279370550 [TCP segment of a reassembled PDU]"
"102","2018-09-19 09:40:01.128042","192.168.2.3","192.168.2.1","TCP","66","8009  >  51475 [FIN, ACK] Seq=6387 Ack=1458 Win=17728 Len=0 TSval=1730489 TSecr=1279370550"
"107","2018-09-19 09:40:01.129418","192.168.2.3","192.168.2.1","TCP","66","8009  >  51476 [ACK] Seq=1 Ack=158 Win=15552 Len=0 TSval=1730489 TSecr=1279370553"
"108","2018-09-19 09:40:01.175609","192.168.2.3","192.168.2.1","AJP13","1197","AJP13 Error?"
"111","2018-09-19 09:40:01.178183","192.168.2.3","192.168.2.1","TCP","292","8009  >  51476 [PSH, ACK] Seq=1132 Ack=251 Win=15552 Len=226 TSval=1730494 TSecr=1279370600 [TCP segment of a reassembled PDU]"
"114","2018-09-19 09:40:01.181370","192.168.2.3","192.168.2.1","TCP","1514","8009  >  51476 [ACK] Seq=1358 Ack=376 Win=15552 Len=1448 TSval=1730494 TSecr=1279370602 [TCP segment of a reassembled PDU]"
"115","2018-09-19 09:40:01.181738","192.168.2.3","192.168.2.1","TCP","1514","8009  >  51476 [ACK] Seq=2806 Ack=376 Win=15552 Len=1448 TSval=1730494 TSecr=1279370602 [TCP segment of a reassembled PDU]"
"116","2018-09-19 09:40:01.181740","192.168.2.3","192.168.2.1","TCP","1247","8009  >  51476 [PSH, ACK] Seq=4254 Ack=376 Win=15552 Len=1181 TSval=1730494 TSecr=1279370602 [TCP segment of a reassembled PDU]"
"119","2018-09-19 09:40:01.996037","192.168.2.3","108.177.125.188","TCP","66","[TCP Dup ACK 15#1] 42262  >  5228 [ACK] Seq=1 Ack=1 Win=406 Len=0 TSval=1730576 TSecr=497471373"
"124","2018-09-19 09:40:03.276018","192.168.2.3","172.217.27.174","TCP","66","[TCP Dup ACK 17#1] 42640  >  443 [ACK] Seq=1 Ack=1 Win=494 Len=0 TSval=1730704 TSecr=3989768392"
"126","2018-09-19 09:40:03.758664","192.168.2.3","216.58.199.234","TCP","66","[TCP Dup ACK 19#1] 49477  >  443 [ACK] Seq=1 Ack=1 Win=495 Len=0 TSval=1730752 TSecr=2043834406"
"133","2018-09-19 09:40:06.185855","192.168.2.3","192.168.2.1","TCP","66","8009  >  51476 [ACK] Seq=5435 Ack=955 Win=16640 Len=0 TSval=1730994 TSecr=1279375602"
"134","2018-09-19 09:40:06.186585","192.168.2.3","192.168.2.1","TCP","183","8009  >  51476 [PSH, ACK] Seq=5435 Ack=1106 Win=17728 Len=117 TSval=1730995 TSecr=1279375603 [TCP segment of a reassembled PDU]"
"136","2018-09-19 09:40:06.191720","192.168.2.3","192.168.2.1","TCP","519","8009  >  51476 [PSH, ACK] Seq=5552 Ack=1106 Win=17728 Len=453 TSval=1730995 TSecr=1279375605 [TCP segment of a reassembled PDU]"
"141","2018-09-19 09:40:16.217619","192.168.2.3","192.168.2.1","TCP","183","8009  >  51476 [PSH, ACK] Seq=6005 Ack=1223 Win=17728 Len=117 TSval=1731998 TSecr=1279385611 [TCP segment of a reassembled PDU]"
"145","2018-09-19 09:40:17.798193","192.168.2.3","172.217.27.174","TCP","66","[TCP Previous segment not captured] 42640  >  443 [FIN, ACK] Seq=2 Ack=57 Win=494 Len=0 TSval=1732156 TSecr=3989828028"
"147","2018-09-19 09:40:18.182339","192.168.2.3","64.233.188.188","TCP","66","[TCP Keep-Alive] 36126  >  5228 [ACK] Seq=27 Ack=27 Win=406 Len=0 TSval=1732192 TSecr=1096186542"
"150","2018-09-19 09:40:18.197757","192.168.2.3","216.58.199.234","TCP","66","[TCP Previous segment not captured] 49477  >  443 [FIN, ACK] Seq=2 Ack=57 Win=495 Len=0 TSval=1732196 TSecr=2043893958"
"155","2018-09-19 09:40:26.111388","192.168.2.3","192.168.2.1","TCP","183","8009  >  51476 [PSH, ACK] Seq=6122 Ack=1340 Win=17728 Len=117 TSval=1732987 TSecr=1279395518 [TCP segment of a reassembled PDU]"
"170","2018-09-19 09:40:31.121127","192.168.2.3","192.168.2.1","TCP","183","8009  >  51476 [PSH, ACK] Seq=6239 Ack=1457 Win=17728 Len=117 TSval=1733488 TSecr=1279400525 [TCP segment of a reassembled PDU]"
"173","2018-09-19 09:40:36.126567","192.168.2.3","192.168.2.1","TCP","183","8009  >  51476 [PSH, ACK] Seq=6356 Ack=1574 Win=17728 Len=117 TSval=1733989 TSecr=1279405527 [TCP segment of a reassembled PDU]"
"192","2018-09-19 09:40:45.836460","192.168.2.3","216.58.197.14","TCP","66","[TCP Dup ACK 13#2] 46334  >  443 [ACK] Seq=1 Ack=1 Win=279 Len=0 TSval=1734960 TSecr=4180512914"
"194","2018-09-19 09:40:47.116544","192.168.2.3","108.177.125.188","TCP","66","[TCP Dup ACK 15#2] 42262  >  5228 [ACK] Seq=1 Ack=1 Win=406 Len=0 TSval=1735088 TSecr=497516478"
"199","2018-09-19 09:40:48.204994","192.168.2.3","192.168.2.1","TCP","74","8009  >  51477 [SYN, ACK, ECN] Seq=0 Ack=1 Win=14480 Len=0 MSS=1460 SACK_PERM=1 TSval=1735196 TSecr=1279417603 WS=64"
"202","2018-09-19 09:40:48.205187","192.168.2.3","192.168.2.1","TCP","97","8009  >  51476 [PSH, ACK] Seq=6473 Ack=1575 Win=17728 Len=31 TSval=1735196 TSecr=1279417603 [TCP segment of a reassembled PDU]"
"203","2018-09-19 09:40:48.205189","192.168.2.3","192.168.2.1","TCP","66","8009  >  51476 [FIN, ACK] Seq=6504 Ack=1575 Win=17728 Len=0 TSval=1735196 TSecr=1279417603"
"206","2018-09-19 09:40:48.206802","192.168.2.3","192.168.2.1","TCP","66","8009  >  51477 [ACK] Seq=1 Ack=158 Win=15552 Len=0 TSval=1735197 TSecr=1279417604"
"207","2018-09-19 09:40:48.229348","192.168.2.3","192.168.2.1","AJP13","1197","AJP13 Error?"
"210","2018-09-19 09:40:48.233920","192.168.2.3","192.168.2.1","TCP","292","8009  >  51477 [PSH, ACK] Seq=1132 Ack=251 Win=15552 Len=226 TSval=1735199 TSecr=1279417627 [TCP segment of a reassembled PDU]"
"213","2018-09-19 09:40:48.238132","192.168.2.3","192.168.2.1","TCP","1514","8009  >  51477 [ACK] Seq=1358 Ack=376 Win=15552 Len=1448 TSval=1735199 TSecr=1279417631 [TCP segment of a reassembled PDU]"
"214","2018-09-19 09:40:48.238136","192.168.2.3","192.168.2.1","TCP","1514","8009  >  51477 [ACK] Seq=2806 Ack=376 Win=15552 Len=1448 TSval=1735199 TSecr=1279417631 [TCP segment of a reassembled PDU]"
"217","2018-09-19 09:40:48.238350","192.168.2.3","192.168.2.1","TCP","1247","8009  >  51477 [PSH, ACK] Seq=4254 Ack=376 Win=15552 Len=1181 TSval=1735199 TSecr=1279417631 [TCP segment of a reassembled PDU]"
"220","2018-09-19 09:40:53.268891","192.168.2.3","192.168.2.1","TCP","183","8009  >  51477 [PSH, ACK] Seq=5435 Ack=493 Win=15552 Len=117 TSval=1735703 TSecr=1279422661 [TCP segment of a reassembled PDU]"
"224","2018-09-19 09:40:53.304455","192.168.2.3","192.168.2.1","TCP","66","8009  >  51477 [ACK] Seq=5552 Ack=1106 Win=17728 Len=0 TSval=1735703 TSecr=1279422662"
"225","2018-09-19 09:40:53.304464","192.168.2.3","192.168.2.1","TCP","519","8009  >  51477 [PSH, ACK] Seq=5552 Ack=1106 Win=17728 Len=453 TSval=1735703 TSecr=1279422662 [TCP segment of a reassembled PDU]"
"230","2018-09-19 09:41:00.275918","192.168.2.3","216.58.197.14","TCP","66","[TCP Previous segment not captured] 46334  >  443 [FIN, ACK] Seq=2 Ack=57 Win=279 Len=0 TSval=1736403 TSecr=4180572469"
"232","2018-09-19 09:41:03.276611","192.168.2.3","64.233.188.188","TCP","66","[TCP Keep-Alive] 36126  >  5228 [ACK] Seq=27 Ack=27 Win=406 Len=0 TSval=1736704 TSecr=1096231657"
"235","2018-09-19 09:41:03.347549","192.168.2.3","192.168.2.1","TCP","183","8009  >  51477 [PSH, ACK] Seq=6005 Ack=1223 Win=17728 Len=117 TSval=1736711 TSecr=1279432702 [TCP segment of a reassembled PDU]"
"242","2018-09-19 09:41:10.080358","192.168.2.3","192.168.2.1","TCP","66","8009  >  51477 [ACK] Seq=6122 Ack=1340 Win=17728 Len=0 TSval=1737384 TSecr=1279439443"
"243","2018-09-19 09:41:10.080919","192.168.2.3","192.168.2.1","TCP","183","8009  >  51477 [PSH, ACK] Seq=6122 Ack=1340 Win=17728 Len=117 TSval=1737384 TSecr=1279439443 [TCP segment of a reassembled PDU]"
"247","2018-09-19 09:41:20.183114","192.168.2.3","192.168.2.1","TCP","74","8009  >  51478 [SYN, ACK, ECN] Seq=0 Ack=1 Win=14480 Len=0 MSS=1460 SACK_PERM=1 TSval=1738394 TSecr=1279449561 WS=64"
"249","2018-09-19 09:41:20.183261","192.168.2.3","192.168.2.1","TCP","97","8009  >  51477 [PSH, ACK] Seq=6239 Ack=1341 Win=17728 Len=31 TSval=1738394 TSecr=1279449561 [TCP segment of a reassembled PDU]"
"250","2018-09-19 09:41:20.183265","192.168.2.3","192.168.2.1","TCP","66","8009  >  51477 [FIN, ACK] Seq=6270 Ack=1341 Win=17728 Len=0 TSval=1738394 TSecr=1279449561"
"254","2018-09-19 09:41:20.188627","192.168.2.3","192.168.2.1","TCP","66","8009  >  51478 [ACK] Seq=1 Ack=158 Win=15552 Len=0 TSval=1738395 TSecr=1279449562"
"255","2018-09-19 09:41:20.216062","192.168.2.3","192.168.2.1","AJP13","1197","AJP13 Error?"
"258","2018-09-19 09:41:20.220136","192.168.2.3","192.168.2.1","TCP","292","8009  >  51478 [PSH, ACK] Seq=1132 Ack=251 Win=15552 Len=226 TSval=1738398 TSecr=1279449594 [TCP segment of a reassembled PDU]"
"261","2018-09-19 09:41:20.225934","192.168.2.3","192.168.2.1","TCP","1514","8009  >  51478 [ACK] Seq=1358 Ack=376 Win=15552 Len=1448 TSval=1738398 TSecr=1279449598 [TCP segment of a reassembled PDU]"
"262","2018-09-19 09:41:20.226235","192.168.2.3","192.168.2.1","TCP","1514","8009  >  51478 [ACK] Seq=2806 Ack=376 Win=15552 Len=1448 TSval=1738398 TSecr=1279449598 [TCP segment of a reassembled PDU]"
"263","2018-09-19 09:41:20.226238","192.168.2.3","192.168.2.1","TCP","1247","8009  >  51478 [PSH, ACK] Seq=4254 Ack=376 Win=15552 Len=1181 TSval=1738398 TSecr=1279449598 [TCP segment of a reassembled PDU]"
"268","2018-09-19 09:41:25.240769","192.168.2.3","192.168.2.1","TCP","183","8009  >  51478 [PSH, ACK] Seq=5435 Ack=493 Win=15552 Len=117 TSval=1738900 TSecr=1279454613 [TCP segment of a reassembled PDU]"
"271","2018-09-19 09:41:25.248316","192.168.2.3","192.168.2.1","TCP","66","8009  >  51478 [ACK] Seq=5552 Ack=1106 Win=17728 Len=0 TSval=1738901 TSecr=1279454614"
"272","2018-09-19 09:41:25.249542","192.168.2.3","192.168.2.1","TCP","519","8009  >  51478 [PSH, ACK] Seq=5552 Ack=1106 Win=17728 Len=453 TSval=1738901 TSecr=1279454614 [TCP segment of a reassembled PDU]"
"285","2018-09-19 09:41:32.237084","192.168.2.3","108.177.125.188","TCP","66","[TCP Dup ACK 15#3] 42262  >  5228 [ACK] Seq=1 Ack=1 Win=406 Len=0 TSval=1739600 TSecr=497561598"
"287","2018-09-19 09:41:33.134865","192.168.2.3","64.233.188.188","TCP","92","36126  >  5228 [PSH, ACK] Seq=28 Ack=27 Win=406 Len=26 TSval=1739689 TSecr=1096276751"
"289","2018-09-19 09:41:33.173230","192.168.2.3","64.233.188.188","TCP","66","36126  >  5228 [ACK] Seq=54 Ack=53 Win=406 Len=0 TSval=1739693 TSecr=1096306610"
"291","2018-09-19 09:41:35.270290","192.168.2.3","192.168.2.1","TCP","183","8009  >  51478 [PSH, ACK] Seq=6005 Ack=1223 Win=17728 Len=117 TSval=1739903 TSecr=1279464627 [TCP segment of a reassembled PDU]"
"296","2018-09-19 09:41:41.122454","192.168.2.3","192.168.2.1","TCP","183","8009  >  51478 [PSH, ACK] Seq=6122 Ack=1340 Win=17728 Len=117 TSval=1740488 TSecr=1279470485 [TCP segment of a reassembled PDU]"
"311","2018-09-19 09:41:47.911672","192.168.2.3","192.168.2.1","TCP","183","8009  >  51478 [PSH, ACK] Seq=6239 Ack=1457 Win=17728 Len=117 TSval=1741167 TSecr=1279477272 [TCP segment of a reassembled PDU]"
"317","2018-09-19 09:42:00.170983","192.168.2.3","172.217.27.174","TCP","74","42644  >  443 [SYN] Seq=0 Win=14600 Len=0 MSS=1460 SACK_PERM=1 TSval=1742393 TSecr=0 WS=64"
"319","2018-09-19 09:42:00.177124","192.168.2.3","172.217.27.174","TCP","66","42644  >  443 [ACK] Seq=1 Ack=1 Win=14656 Len=0 TSval=1742393 TSecr=1660833943"
"320","2018-09-19 09:42:00.177831","192.168.2.3","172.217.27.174","TLSv1.2","583","Client Hello"
"323","2018-09-19 09:42:00.185194","192.168.2.3","172.217.27.174","TCP","66","42644  >  443 [ACK] Seq=518 Ack=149 Win=15680 Len=0 TSval=1742394 TSecr=1660833950"
"324","2018-09-19 09:42:00.189095","192.168.2.3","172.217.27.174","TLSv1.2","109","Change Cipher Spec, Encrypted Handshake Message"
"325","2018-09-19 09:42:00.189097","192.168.2.3","172.217.27.174","TLSv1.2","151","Application Data"
"326","2018-09-19 09:42:00.189098","192.168.2.3","172.217.27.174","TLSv1.2","234","Application Data"
"327","2018-09-19 09:42:00.189099","192.168.2.3","172.217.27.174","TLSv1.2","310","Application Data"
"331","2018-09-19 09:42:00.195247","192.168.2.3","172.217.27.174","TLSv1.2","96","Application Data"
"332","2018-09-19 09:42:00.227262","192.168.2.3","172.217.27.174","TCP","66","42644  >  443 [ACK] Seq=1088 Ack=240 Win=15680 Len=0 TSval=1742399 TSecr=1660833961"
"338","2018-09-19 09:42:00.272611","192.168.2.3","172.217.27.174","TCP","66","42644  >  443 [ACK] Seq=1088 Ack=466 Win=16768 Len=0 TSval=1742403 TSecr=1660834038"
"339","2018-09-19 09:42:00.272810","192.168.2.3","172.217.27.174","TCP","66","42644  >  443 [ACK] Seq=1088 Ack=762 Win=17856 Len=0 TSval=1742403 TSecr=1660834038"
"340","2018-09-19 09:42:00.279380","192.168.2.3","172.217.27.174","TCP","66","42644  >  443 [ACK] Seq=1088 Ack=801 Win=17856 Len=0 TSval=1742403 TSecr=1660834038"
"341","2018-09-19 09:42:00.279382","192.168.2.3","172.217.27.174","TCP","66","42644  >  443 [ACK] Seq=1088 Ack=839 Win=17856 Len=0 TSval=1742403 TSecr=1660834038"
"342","2018-09-19 09:42:00.279383","192.168.2.3","172.217.27.174","TLSv1.2","104","Application Data"
"346","2018-09-19 09:42:01.124213","192.168.2.3","192.168.2.1","TCP","74","8009  >  51479 [SYN, ACK, ECN] Seq=0 Ack=1 Win=14480 Len=0 MSS=1460 SACK_PERM=1 TSval=1742488 TSecr=1279490481 WS=64"
"349","2018-09-19 09:42:01.129138","192.168.2.3","192.168.2.1","TCP","97","8009  >  51478 [PSH, ACK] Seq=6356 Ack=1458 Win=17728 Len=31 TSval=1742488 TSecr=1279490481 [TCP segment of a reassembled PDU]"
"350","2018-09-19 09:42:01.129142","192.168.2.3","192.168.2.1","TCP","66","8009  >  51478 [FIN, ACK] Seq=6387 Ack=1458 Win=17728 Len=0 TSval=1742488 TSecr=1279490481"
"353","2018-09-19 09:42:01.132991","192.168.2.3","192.168.2.1","TCP","66","8009  >  51479 [ACK] Seq=1 Ack=158 Win=15552 Len=0 TSval=1742489 TSecr=1279490482"
"354","2018-09-19 09:42:01.150558","192.168.2.3","192.168.2.1","AJP13","1197","AJP13 Error?"
"357","2018-09-19 09:42:01.159038","192.168.2.3","192.168.2.1","TCP","292","8009  >  51479 [PSH, ACK] Seq=1132 Ack=251 Win=15552 Len=226 TSval=1742492 TSecr=1279490506 [TCP segment of a reassembled PDU]"
"360","2018-09-19 09:42:01.186253","192.168.2.3","192.168.2.1","TCP","1514","8009  >  51479 [ACK] Seq=1358 Ack=376 Win=15552 Len=1448 TSval=1742494 TSecr=1279490514 [TCP segment of a reassembled PDU]"
"361","2018-09-19 09:42:01.186258","192.168.2.3","192.168.2.1","TCP","1514","8009  >  51479 [ACK] Seq=2806 Ack=376 Win=15552 Len=1448 TSval=1742494 TSecr=1279490514 [TCP segment of a reassembled PDU]"
"362","2018-09-19 09:42:01.186460","192.168.2.3","192.168.2.1","TCP","1247","8009  >  51479 [PSH, ACK] Seq=4254 Ack=376 Win=15552 Len=1181 TSval=1742494 TSecr=1279490514 [TCP segment of a reassembled PDU]"
"368","2018-09-19 09:42:06.205377","192.168.2.3","192.168.2.1","TCP","66","8009  >  51479 [ACK] Seq=5435 Ack=989 Win=17728 Len=0 TSval=1742994 TSecr=1279495532"
"369","2018-09-19 09:42:06.205381","192.168.2.3","192.168.2.1","TCP","519","8009  >  51479 [PSH, ACK] Seq=5435 Ack=989 Win=17728 Len=453 TSval=1742994 TSecr=1279495532 [TCP segment of a reassembled PDU]"
"372","2018-09-19 09:42:12.386111","192.168.2.3","192.168.2.1","TCP","183","8009  >  51479 [PSH, ACK] Seq=5888 Ack=1106 Win=17728 Len=117 TSval=1743614 TSecr=1279501731 [TCP segment of a reassembled PDU]"
"385","2018-09-19 09:42:17.357550","192.168.2.3","108.177.125.188","TCP","66","[TCP Dup ACK 15#4] 42262  >  5228 [ACK] Seq=1 Ack=1 Win=406 Len=0 TSval=1744112 TSecr=497606719"
"387","2018-09-19 09:42:18.242938","192.168.2.3","64.233.188.188","TCP","66","[TCP Keep-Alive] 36126  >  5228 [ACK] Seq=53 Ack=53 Win=406 Len=0 TSval=1744200 TSecr=1096306610"
"394","2018-09-19 09:42:24.943146","192.168.2.3","192.168.2.1","TCP","183","8009  >  51479 [PSH, ACK] Seq=6005 Ack=1223 Win=17728 Len=117 TSval=1744870 TSecr=1279514265 [TCP segment of a reassembled PDU]"
