"No.","Time","Source","Destination","Protocol","Length","Info"
"2","2018-09-19 09:28:34.898916","192.168.2.3","192.168.2.1","TCP","183","8009  >  51449 [PSH, ACK] Seq=1 Ack=118 Win=277 Len=117 TSval=1661867 TSecr=1278684728 [TCP segment of a reassembled PDU]"
"5","2018-09-19 09:28:39.901814","192.168.2.3","192.168.2.1","TCP","183","8009  >  51449 [PSH, ACK] Seq=118 Ack=235 Win=277 Len=117 TSval=1662367 TSecr=1278689727 [TCP segment of a reassembled PDU]"
"7","2018-09-19 09:28:45.188853","192.168.2.3","108.177.125.188","TCP","66","42262  >  5228 [ACK] Seq=1 Ack=1 Win=406 Len=0 TSval=1662896 TSecr=496794549"
"11","2018-09-19 09:28:54.900914","192.168.2.3","192.168.2.1","TCP","74","8009  >  51452 [SYN, ACK, ECN] Seq=0 Ack=1 Win=14480 Len=0 MSS=1460 SACK_PERM=1 TSval=1663867 TSecr=1278704716 WS=64"
"12","2018-09-19 09:28:54.900918","192.168.2.3","192.168.2.1","TCP","97","8009  >  51449 [PSH, ACK] Seq=235 Ack=236 Win=277 Len=31 TSval=1663867 TSecr=1278704716 [TCP segment of a reassembled PDU]"
"13","2018-09-19 09:28:54.900919","192.168.2.3","192.168.2.1","TCP","66","8009  >  51449 [FIN, ACK] Seq=266 Ack=236 Win=277 Len=0 TSval=1663867 TSecr=1278704716"
"18","2018-09-19 09:28:54.903372","192.168.2.3","192.168.2.1","TCP","66","8009  >  51452 [ACK] Seq=1 Ack=158 Win=15552 Len=0 TSval=1663867 TSecr=1278704717"
"19","2018-09-19 09:28:54.926043","192.168.2.3","192.168.2.1","AJP13","1197","AJP13 Error?"
"22","2018-09-19 09:28:54.936340","192.168.2.3","192.168.2.1","TCP","292","8009  >  51452 [PSH, ACK] Seq=1132 Ack=251 Win=15552 Len=226 TSval=1663870 TSecr=1278704741 [TCP segment of a reassembled PDU]"
"25","2018-09-19 09:28:54.939308","192.168.2.3","192.168.2.1","TCP","1514","8009  >  51452 [ACK] Seq=1358 Ack=376 Win=15552 Len=1448 TSval=1663871 TSecr=1278704751 [TCP segment of a reassembled PDU]"
"26","2018-09-19 09:28:54.940747","192.168.2.3","192.168.2.1","TCP","1514","8009  >  51452 [ACK] Seq=2806 Ack=376 Win=15552 Len=1448 TSval=1663871 TSecr=1278704751 [TCP segment of a reassembled PDU]"
"28","2018-09-19 09:28:54.941067","192.168.2.3","192.168.2.1","TCP","1247","8009  >  51452 [PSH, ACK] Seq=4254 Ack=376 Win=15552 Len=1181 TSval=1663871 TSecr=1278704751 [TCP segment of a reassembled PDU]"
"33","2018-09-19 09:28:59.969684","192.168.2.3","192.168.2.1","TCP","66","8009  >  51452 [ACK] Seq=5435 Ack=955 Win=16640 Len=0 TSval=1664373 TSecr=1278709770"
"34","2018-09-19 09:28:59.969688","192.168.2.3","192.168.2.1","TCP","183","8009  >  51452 [PSH, ACK] Seq=5435 Ack=955 Win=16640 Len=117 TSval=1664373 TSecr=1278709770 [TCP segment of a reassembled PDU]"
"35","2018-09-19 09:28:59.969688","192.168.2.3","192.168.2.1","TCP","519","8009  >  51452 [PSH, ACK] Seq=5552 Ack=1106 Win=17728 Len=453 TSval=1664373 TSecr=1278709772 [TCP segment of a reassembled PDU]"
"38","2018-09-19 09:29:02.993273","192.168.2.3","64.233.188.188","TCP","66","36126  >  5228 [ACK] Seq=1 Ack=1 Win=406 Len=0 TSval=1664672 TSecr=1095511302"
"57","2018-09-19 09:29:09.978157","192.168.2.3","192.168.2.1","TCP","183","8009  >  51452 [PSH, ACK] Seq=6005 Ack=1223 Win=17728 Len=117 TSval=1665374 TSecr=1278719778 [TCP segment of a reassembled PDU]"
"69","2018-09-19 09:29:15.267323","192.168.2.3","192.168.2.1","TCP","183","8009  >  51452 [PSH, ACK] Seq=6122 Ack=1340 Win=17728 Len=117 TSval=1665903 TSecr=1278725065 [TCP segment of a reassembled PDU]"
"71","2018-09-19 09:29:15.429009","192.168.2.3","172.217.27.174","TCP","66","42637  >  443 [ACK] Seq=1 Ack=1 Win=296 Len=0 TSval=1665920 TSecr=3634068286"
"74","2018-09-19 09:29:20.270219","192.168.2.3","192.168.2.1","TCP","183","8009  >  51452 [PSH, ACK] Seq=6239 Ack=1457 Win=17728 Len=117 TSval=1666404 TSecr=1278730066 [TCP segment of a reassembled PDU]"
"90","2018-09-19 09:29:30.309166","192.168.2.3","108.177.125.188","TCP","66","[TCP Dup ACK 7#1] 42262  >  5228 [ACK] Seq=1 Ack=1 Win=406 Len=0 TSval=1667408 TSecr=496839670"
"92","2018-09-19 09:29:32.831994","192.168.2.3","64.233.188.188","TCP","92","[TCP Previous segment not captured] 36126  >  5228 [PSH, ACK] Seq=2 Ack=1 Win=406 Len=26 TSval=1667660 TSecr=1095556467"
"94","2018-09-19 09:29:32.869514","192.168.2.3","64.233.188.188","TCP","66","36126  >  5228 [ACK] Seq=28 Ack=27 Win=406 Len=0 TSval=1667664 TSecr=1095586307"
"107","2018-09-19 09:29:35.270440","192.168.2.3","192.168.2.1","TCP","74","8009  >  51453 [SYN, ACK, ECN] Seq=0 Ack=1 Win=14480 Len=0 MSS=1460 SACK_PERM=1 TSval=1667904 TSecr=1278745058 WS=64"
"110","2018-09-19 09:29:35.270783","192.168.2.3","192.168.2.1","TCP","97","8009  >  51452 [PSH, ACK] Seq=6356 Ack=1458 Win=17728 Len=31 TSval=1667904 TSecr=1278745058 [TCP segment of a reassembled PDU]"
"112","2018-09-19 09:29:35.270905","192.168.2.3","192.168.2.1","TCP","66","8009  >  51452 [FIN, ACK] Seq=6387 Ack=1458 Win=17728 Len=0 TSval=1667904 TSecr=1278745058"
"114","2018-09-19 09:29:35.276660","192.168.2.3","192.168.2.1","TCP","66","8009  >  51453 [ACK] Seq=1 Ack=158 Win=15552 Len=0 TSval=1667904 TSecr=1278745060"
"115","2018-09-19 09:29:35.294847","192.168.2.3","192.168.2.1","AJP13","1197","AJP13 Error?"
"118","2018-09-19 09:29:35.300405","192.168.2.3","192.168.2.1","TCP","292","8009  >  51453 [PSH, ACK] Seq=1132 Ack=251 Win=15552 Len=226 TSval=1667907 TSecr=1278745084 [TCP segment of a reassembled PDU]"
"121","2018-09-19 09:29:35.302900","192.168.2.3","192.168.2.1","TCP","1514","8009  >  51453 [ACK] Seq=1358 Ack=376 Win=15552 Len=1448 TSval=1667907 TSecr=1278745089 [TCP segment of a reassembled PDU]"
"122","2018-09-19 09:29:35.308978","192.168.2.3","192.168.2.1","TCP","1514","8009  >  51453 [ACK] Seq=2806 Ack=376 Win=15552 Len=1448 TSval=1667907 TSecr=1278745089 [TCP segment of a reassembled PDU]"
"123","2018-09-19 09:29:35.308981","192.168.2.3","192.168.2.1","TCP","1247","8009  >  51453 [PSH, ACK] Seq=4254 Ack=376 Win=15552 Len=1181 TSval=1667907 TSecr=1278745089 [TCP segment of a reassembled PDU]"
"451","2018-09-19 09:29:40.330741","192.168.2.3","192.168.2.1","TCP","183","8009  >  51453 [PSH, ACK] Seq=5435 Ack=493 Win=15552 Len=117 TSval=1668410 TSecr=1278750113 [TCP segment of a reassembled PDU]"
"455","2018-09-19 09:29:40.341187","192.168.2.3","192.168.2.1","TCP","66","8009  >  51453 [ACK] Seq=5552 Ack=1106 Win=17728 Len=0 TSval=1668411 TSecr=1278750114"
"458","2018-09-19 09:29:40.342263","192.168.2.3","192.168.2.1","TCP","519","8009  >  51453 [PSH, ACK] Seq=5552 Ack=1106 Win=17728 Len=453 TSval=1668411 TSecr=1278750114 [TCP segment of a reassembled PDU]"
"2757","2018-09-19 09:29:50.351937","192.168.2.3","192.168.2.1","TCP","183","8009  >  51453 [PSH, ACK] Seq=6005 Ack=1223 Win=17728 Len=117 TSval=1669412 TSecr=1278760127 [TCP segment of a reassembled PDU]"
"4251","2018-09-19 09:29:55.495648","192.168.2.3","192.168.2.1","TCP","183","8009  >  51453 [PSH, ACK] Seq=6122 Ack=1340 Win=17728 Len=117 TSval=1669926 TSecr=1278765267 [TCP segment of a reassembled PDU]"
"13082","2018-09-19 09:30:00.605076","192.168.2.3","172.217.27.174","TCP","66","[TCP Dup ACK 71#1] 42637  >  443 [ACK] Seq=1 Ack=1 Win=296 Len=0 TSval=1670432 TSecr=3634113407"
"19236","2018-09-19 09:30:05.802107","192.168.2.3","192.168.2.1","TCP","97","8009  >  51453 [PSH, ACK] Seq=6239 Ack=1341 Win=17728 Len=31 TSval=1670956 TSecr=1278775559 [TCP segment of a reassembled PDU]"
"19237","2018-09-19 09:30:05.802109","192.168.2.3","192.168.2.1","TCP","66","8009  >  51453 [FIN, ACK] Seq=6270 Ack=1341 Win=17728 Len=0 TSval=1670956 TSecr=1278775559"
"19238","2018-09-19 09:30:05.802110","192.168.2.3","192.168.2.1","TCP","74","8009  >  51454 [SYN, ACK, ECN] Seq=0 Ack=1 Win=14480 Len=0 MSS=1460 SACK_PERM=1 TSval=1670956 TSecr=1278775559 WS=64"
"19243","2018-09-19 09:30:05.807614","192.168.2.3","192.168.2.1","TCP","66","8009  >  51454 [ACK] Seq=1 Ack=158 Win=15552 Len=0 TSval=1670957 TSecr=1278775573"
"19248","2018-09-19 09:30:05.827585","192.168.2.3","192.168.2.1","AJP13","1197","AJP13 Error?"
"19251","2018-09-19 09:30:05.832601","192.168.2.3","192.168.2.1","TCP","292","8009  >  51454 [PSH, ACK] Seq=1132 Ack=251 Win=15552 Len=226 TSval=1670960 TSecr=1278775598 [TCP segment of a reassembled PDU]"
"19254","2018-09-19 09:30:05.837109","192.168.2.3","192.168.2.1","TCP","1514","8009  >  51454 [ACK] Seq=1358 Ack=376 Win=15552 Len=1448 TSval=1670960 TSecr=1278775602 [TCP segment of a reassembled PDU]"
"19255","2018-09-19 09:30:05.837258","192.168.2.3","192.168.2.1","TCP","1514","8009  >  51454 [ACK] Seq=2806 Ack=376 Win=15552 Len=1448 TSval=1670960 TSecr=1278775602 [TCP segment of a reassembled PDU]"
"19257","2018-09-19 09:30:05.837431","192.168.2.3","192.168.2.1","TCP","1247","8009  >  51454 [PSH, ACK] Seq=4254 Ack=376 Win=15552 Len=1181 TSval=1670960 TSecr=1278775602 [TCP segment of a reassembled PDU]"
"26538","2018-09-19 09:30:10.855638","192.168.2.3","192.168.2.1","TCP","66","8009  >  51454 [ACK] Seq=5435 Ack=955 Win=16640 Len=0 TSval=1671462 TSecr=1278780617"
"26539","2018-09-19 09:30:10.856340","192.168.2.3","192.168.2.1","TCP","183","8009  >  51454 [PSH, ACK] Seq=5435 Ack=955 Win=16640 Len=117 TSval=1671462 TSecr=1278780617 [TCP segment of a reassembled PDU]"
"26546","2018-09-19 09:30:10.858728","192.168.2.3","192.168.2.1","TCP","519","8009  >  51454 [PSH, ACK] Seq=5552 Ack=1106 Win=17728 Len=453 TSval=1671462 TSecr=1278780619 [TCP segment of a reassembled PDU]"
"29395","2018-09-19 09:30:15.429849","192.168.2.3","108.177.125.188","TCP","66","[TCP Dup ACK 7#2] 42262  >  5228 [ACK] Seq=1 Ack=1 Win=406 Len=0 TSval=1671920 TSecr=496884790"
"30072","2018-09-19 09:30:17.909682","192.168.2.3","64.233.188.188","TCP","66","[TCP Keep-Alive] 36126  >  5228 [ACK] Seq=27 Ack=27 Win=406 Len=0 TSval=1672168 TSecr=1095586307"
"30280","2018-09-19 09:30:20.865970","192.168.2.3","192.168.2.1","TCP","183","8009  >  51454 [PSH, ACK] Seq=6005 Ack=1223 Win=17728 Len=117 TSval=1672463 TSecr=1278790622 [TCP segment of a reassembled PDU]"
"31094","2018-09-19 09:30:27.664194","192.168.2.3","192.168.2.1","TCP","183","8009  >  51454 [PSH, ACK] Seq=6122 Ack=1340 Win=17728 Len=117 TSval=1673143 TSecr=1278797416 [TCP segment of a reassembled PDU]"
"32824","2018-09-19 09:30:32.668464","192.168.2.3","192.168.2.1","TCP","183","8009  >  51454 [PSH, ACK] Seq=6239 Ack=1457 Win=17728 Len=117 TSval=1673643 TSecr=1278802409 [TCP segment of a reassembled PDU]"
"35519","2018-09-19 09:30:45.269677","192.168.2.3","192.168.2.1","TCP","97","8009  >  51454 [PSH, ACK] Seq=6356 Ack=1458 Win=17728 Len=31 TSval=1674903 TSecr=1278815006 [TCP segment of a reassembled PDU]"
"35520","2018-09-19 09:30:45.269680","192.168.2.3","192.168.2.1","TCP","66","8009  >  51454 [FIN, ACK] Seq=6387 Ack=1458 Win=17728 Len=0 TSval=1674903 TSecr=1278815006"
"35523","2018-09-19 09:30:45.270106","192.168.2.3","192.168.2.1","TCP","74","8009  >  51463 [SYN, ACK, ECN] Seq=0 Ack=1 Win=14480 Len=0 MSS=1460 SACK_PERM=1 TSval=1674904 TSecr=1278815006 WS=64"
"35526","2018-09-19 09:30:45.278092","192.168.2.3","192.168.2.1","TCP","66","8009  >  51463 [ACK] Seq=1 Ack=158 Win=15552 Len=0 TSval=1674904 TSecr=1278815007"
"35527","2018-09-19 09:30:45.293868","192.168.2.3","192.168.2.1","AJP13","1197","AJP13 Error?"
"35530","2018-09-19 09:30:45.297593","192.168.2.3","192.168.2.1","TCP","292","8009  >  51463 [PSH, ACK] Seq=1132 Ack=251 Win=15552 Len=226 TSval=1674906 TSecr=1278815030 [TCP segment of a reassembled PDU]"
"35533","2018-09-19 09:30:45.300968","192.168.2.3","192.168.2.1","TCP","1514","8009  >  51463 [ACK] Seq=1358 Ack=376 Win=15552 Len=1448 TSval=1674907 TSecr=1278815033 [TCP segment of a reassembled PDU]"
"35534","2018-09-19 09:30:45.301617","192.168.2.3","192.168.2.1","TCP","1514","8009  >  51463 [ACK] Seq=2806 Ack=376 Win=15552 Len=1448 TSval=1674907 TSecr=1278815033 [TCP segment of a reassembled PDU]"
"35536","2018-09-19 09:30:45.302334","192.168.2.3","192.168.2.1","TCP","1247","8009  >  51463 [PSH, ACK] Seq=4254 Ack=376 Win=15552 Len=1181 TSval=1674907 TSecr=1278815033 [TCP segment of a reassembled PDU]"
"35566","2018-09-19 09:30:45.670952","192.168.2.3","172.217.27.174","TCP","66","[TCP Dup ACK 71#2] 42637  >  443 [ACK] Seq=1 Ack=1 Win=296 Len=0 TSval=1674944 TSecr=3634158583"
"36099","2018-09-19 09:30:50.349715","192.168.2.3","192.168.2.1","TCP","183","8009  >  51463 [PSH, ACK] Seq=5435 Ack=493 Win=15552 Len=117 TSval=1675411 TSecr=1278820056 [TCP segment of a reassembled PDU]"
"36101","2018-09-19 09:30:50.349836","192.168.2.3","192.168.2.1","TCP","66","8009  >  51463 [ACK] Seq=5552 Ack=1106 Win=17728 Len=0 TSval=1675411 TSecr=1278820057"
"36104","2018-09-19 09:30:50.355375","192.168.2.3","192.168.2.1","TCP","519","8009  >  51463 [PSH, ACK] Seq=5552 Ack=1106 Win=17728 Len=453 TSval=1675412 TSecr=1278820078 [TCP segment of a reassembled PDU]"
"36650","2018-09-19 09:31:00.288158","192.168.2.3","172.217.27.174","TCP","66","[TCP Previous segment not captured] 42637  >  443 [FIN, ACK] Seq=2 Ack=57 Win=296 Len=0 TSval=1676405 TSecr=3634218239"
"36651","2018-09-19 09:31:00.288161","192.168.2.3","172.217.27.174","TCP","78","[TCP Dup ACK 36650#1] 42637  >  443 [ACK] Seq=3 Ack=57 Win=296 Len=0 TSval=1676405 TSecr=3634218258 SLE=56 SRE=57"
"36654","2018-09-19 09:31:00.384706","192.168.2.3","192.168.2.1","TCP","183","8009  >  51463 [PSH, ACK] Seq=6005 Ack=1223 Win=17728 Len=117 TSval=1676415 TSecr=1278830088 [TCP segment of a reassembled PDU]"
"36656","2018-09-19 09:31:00.550246","192.168.2.3","108.177.125.188","TCP","66","[TCP Dup ACK 7#3] 42262  >  5228 [ACK] Seq=1 Ack=1 Win=406 Len=0 TSval=1676432 TSecr=496929911"
"36662","2018-09-19 09:31:02.957437","192.168.2.3","64.233.188.188","TCP","66","[TCP Keep-Alive] 36126  >  5228 [ACK] Seq=27 Ack=27 Win=406 Len=0 TSval=1676672 TSecr=1095631384"
"36677","2018-09-19 09:31:07.141869","192.168.2.3","192.168.2.1","TCP","183","8009  >  51463 [PSH, ACK] Seq=6122 Ack=1340 Win=17728 Len=117 TSval=1677091 TSecr=1278836856 [TCP segment of a reassembled PDU]"
"36707","2018-09-19 09:31:13.937877","192.168.2.3","192.168.2.1","TCP","183","8009  >  51463 [PSH, ACK] Seq=6239 Ack=1457 Win=17728 Len=117 TSval=1677770 TSecr=1278843639 [TCP segment of a reassembled PDU]"
"36721","2018-09-19 09:31:27.144621","192.168.2.3","192.168.2.1","TCP","74","8009  >  51464 [SYN, ACK, ECN] Seq=0 Ack=1 Win=14480 Len=0 MSS=1460 SACK_PERM=1 TSval=1679091 TSecr=1278856852 WS=64"
"36723","2018-09-19 09:31:27.144886","192.168.2.3","192.168.2.1","TCP","97","8009  >  51463 [PSH, ACK] Seq=6356 Ack=1458 Win=17728 Len=31 TSval=1679091 TSecr=1278856852 [TCP segment of a reassembled PDU]"
"36725","2018-09-19 09:31:27.146253","192.168.2.3","192.168.2.1","TCP","66","8009  >  51463 [FIN, ACK] Seq=6387 Ack=1458 Win=17728 Len=0 TSval=1679091 TSecr=1278856852"
"36728","2018-09-19 09:31:27.147716","192.168.2.3","192.168.2.1","TCP","66","8009  >  51464 [ACK] Seq=1 Ack=158 Win=15552 Len=0 TSval=1679091 TSecr=1278856855"
"36730","2018-09-19 09:31:27.169723","192.168.2.3","192.168.2.1","AJP13","1197","AJP13 Error?"
"36734","2018-09-19 09:31:27.180606","192.168.2.3","192.168.2.1","TCP","292","8009  >  51464 [PSH, ACK] Seq=1132 Ack=251 Win=15552 Len=226 TSval=1679095 TSecr=1278856878 [TCP segment of a reassembled PDU]"
"36738","2018-09-19 09:31:27.183373","192.168.2.3","192.168.2.1","TCP","1514","8009  >  51464 [ACK] Seq=1358 Ack=376 Win=15552 Len=1448 TSval=1679095 TSecr=1278856888 [TCP segment of a reassembled PDU]"
"36739","2018-09-19 09:31:27.183832","192.168.2.3","192.168.2.1","TCP","1514","8009  >  51464 [ACK] Seq=2806 Ack=376 Win=15552 Len=1448 TSval=1679095 TSecr=1278856888 [TCP segment of a reassembled PDU]"
"36740","2018-09-19 09:31:27.183836","192.168.2.3","192.168.2.1","TCP","1247","8009  >  51464 [PSH, ACK] Seq=4254 Ack=376 Win=15552 Len=1181 TSval=1679095 TSecr=1278856888 [TCP segment of a reassembled PDU]"
"36754","2018-09-19 09:31:32.201882","192.168.2.3","192.168.2.1","TCP","183","8009  >  51464 [PSH, ACK] Seq=5435 Ack=493 Win=15552 Len=117 TSval=1679597 TSecr=1278861902 [TCP segment of a reassembled PDU]"
"36757","2018-09-19 09:31:32.271956","192.168.2.3","192.168.2.1","TCP","66","8009  >  51464 [ACK] Seq=5552 Ack=955 Win=16640 Len=0 TSval=1679604 TSecr=1278861903"
"36759","2018-09-19 09:31:32.355600","192.168.2.3","192.168.2.1","TCP","66","8009  >  51464 [ACK] Seq=5552 Ack=1106 Win=17728 Len=0 TSval=1679612 TSecr=1278862054"
"36760","2018-09-19 09:31:32.357741","192.168.2.3","192.168.2.1","TCP","519","8009  >  51464 [PSH, ACK] Seq=5552 Ack=1106 Win=17728 Len=453 TSval=1679612 TSecr=1278862054 [TCP segment of a reassembled PDU]"
"36762","2018-09-19 09:31:32.878044","192.168.2.3","64.233.188.188","TCP","92","36126  >  5228 [PSH, ACK] Seq=28 Ack=27 Win=406 Len=26 TSval=1679664 TSecr=1095676431"
"36764","2018-09-19 09:31:32.924298","192.168.2.3","64.233.188.188","TCP","66","36126  >  5228 [ACK] Seq=54 Ack=53 Win=406 Len=0 TSval=1679669 TSecr=1095706353"
"36798","2018-09-19 09:31:42.371658","192.168.2.3","192.168.2.1","TCP","183","8009  >  51464 [PSH, ACK] Seq=6005 Ack=1223 Win=17728 Len=117 TSval=1680614 TSecr=1278872065 [TCP segment of a reassembled PDU]"
"36803","2018-09-19 09:31:45.673445","192.168.2.3","108.177.125.188","TCP","66","[TCP Dup ACK 7#4] 42262  >  5228 [ACK] Seq=1 Ack=1 Win=406 Len=0 TSval=1680944 TSecr=496975031"
"36806","2018-09-19 09:31:49.936389","192.168.2.3","192.168.2.1","TCP","183","8009  >  51464 [PSH, ACK] Seq=6122 Ack=1340 Win=17728 Len=117 TSval=1681370 TSecr=1278879624 [TCP segment of a reassembled PDU]"
"36813","2018-09-19 09:31:54.941879","192.168.2.3","192.168.2.1","TCP","183","8009  >  51464 [PSH, ACK] Seq=6239 Ack=1457 Win=17728 Len=117 TSval=1681871 TSecr=1278884626 [TCP segment of a reassembled PDU]"
"36820","2018-09-19 09:32:00.138049","192.168.2.3","172.217.27.174","TCP","74","42638  >  443 [SYN] Seq=0 Win=14600 Len=0 MSS=1460 SACK_PERM=1 TSval=1682390 TSecr=0 WS=64"
"36822","2018-09-19 09:32:00.143992","192.168.2.3","172.217.27.174","TCP","66","42638  >  443 [ACK] Seq=1 Ack=1 Win=14656 Len=0 TSval=1682391 TSecr=1711374228"
"36823","2018-09-19 09:32:00.144678","192.168.2.3","172.217.27.174","TLSv1.2","583","Client Hello"
"36826","2018-09-19 09:32:00.152655","192.168.2.3","172.217.27.174","TCP","66","42638  >  443 [ACK] Seq=518 Ack=149 Win=15680 Len=0 TSval=1682392 TSecr=1711374235"
"36827","2018-09-19 09:32:00.153006","192.168.2.3","172.217.27.174","TLSv1.2","109","Change Cipher Spec, Encrypted Handshake Message"
"36828","2018-09-19 09:32:00.153903","192.168.2.3","172.217.27.174","TLSv1.2","151","Application Data"
"36829","2018-09-19 09:32:00.154511","192.168.2.3","172.217.27.174","TLSv1.2","235","Application Data"
"36830","2018-09-19 09:32:00.154513","192.168.2.3","172.217.27.174","TLSv1.2","310","Application Data"
"36835","2018-09-19 09:32:00.173974","192.168.2.3","172.217.27.174","TCP","66","42638  >  443 [ACK] Seq=1059 Ack=240 Win=15680 Len=0 TSval=1682392 TSecr=1711374243"
"36836","2018-09-19 09:32:00.173976","192.168.2.3","172.217.27.174","TLSv1.2","96","Application Data"
"36837","2018-09-19 09:32:00.175850","192.168.2.3","172.217.27.174","TCP","78","[TCP Dup ACK 36835#1] 42638  >  443 [ACK] Seq=1089 Ack=240 Win=15680 Len=0 TSval=1682394 TSecr=1711374258 SLE=210 SRE=240"
"36843","2018-09-19 09:32:00.680773","192.168.2.3","172.217.27.174","TCP","66","42638  >  443 [ACK] Seq=1089 Ack=466 Win=16768 Len=0 TSval=1682444 TSecr=1711374764"
"36844","2018-09-19 09:32:00.680777","192.168.2.3","172.217.27.174","TCP","66","42638  >  443 [ACK] Seq=1089 Ack=579 Win=16768 Len=0 TSval=1682444 TSecr=1711374764"
"36845","2018-09-19 09:32:00.681203","192.168.2.3","172.217.27.174","TCP","66","42638  >  443 [ACK] Seq=1089 Ack=806 Win=17856 Len=0 TSval=1682445 TSecr=1711374765"
"36846","2018-09-19 09:32:00.682066","192.168.2.3","172.217.27.174","TLSv1.2","104","Application Data"
