"No.","Time","Source","Destination","Protocol","Length","Info"
"1","2018-09-19 09:45:00.562854","192.168.2.3","172.217.27.174","TCP","66","42644  >  443 [ACK] Seq=1 Ack=1 Win=279 Len=0 TSval=1760432 TSecr=1660969210"
"4","2018-09-19 09:45:00.929156","192.168.2.3","192.168.2.1","TCP","183","8009  >  51483 [PSH, ACK] Seq=1 Ack=118 Win=277 Len=117 TSval=1760468 TSecr=1279670177 [TCP segment of a reassembled PDU]"
"8","2018-09-19 09:45:03.442218","192.168.2.3","64.233.188.188","TCP","66","36126  >  5228 [ACK] Seq=1 Ack=1 Win=406 Len=0 TSval=1760720 TSecr=1096471812"
"12","2018-09-19 09:45:06.804655","192.168.2.3","192.168.2.1","TCP","183","8009  >  51483 [PSH, ACK] Seq=118 Ack=235 Win=277 Len=117 TSval=1761056 TSecr=1279676051 [TCP segment of a reassembled PDU]"
"16","2018-09-19 09:45:11.817963","192.168.2.3","192.168.2.1","TCP","183","8009  >  51483 [PSH, ACK] Seq=235 Ack=352 Win=277 Len=117 TSval=1761557 TSecr=1279681056 [TCP segment of a reassembled PDU]"
"18","2018-09-19 09:45:17.839792","192.168.2.3","108.177.125.188","TCP","66","42262  >  5228 [ACK] Seq=1 Ack=1 Win=406 Len=0 TSval=1762160 TSecr=497787212"
"21","2018-09-19 09:45:18.605120","192.168.2.3","192.168.2.1","TCP","183","8009  >  51483 [PSH, ACK] Seq=352 Ack=469 Win=277 Len=117 TSval=1762236 TSecr=1279687843 [TCP segment of a reassembled PDU]"
"26","2018-09-19 09:45:28.808077","192.168.2.3","192.168.2.1","TCP","97","8009  >  51483 [PSH, ACK] Seq=469 Ack=470 Win=277 Len=31 TSval=1763256 TSecr=1279698044 [TCP segment of a reassembled PDU]"
"27","2018-09-19 09:45:28.808081","192.168.2.3","192.168.2.1","TCP","66","8009  >  51483 [FIN, ACK] Seq=500 Ack=470 Win=277 Len=0 TSval=1763256 TSecr=1279698044"
"28","2018-09-19 09:45:28.808082","192.168.2.3","192.168.2.1","TCP","74","8009  >  51484 [SYN, ACK, ECN] Seq=0 Ack=1 Win=14480 Len=0 MSS=1460 SACK_PERM=1 TSval=1763256 TSecr=1279698044 WS=64"
"33","2018-09-19 09:45:28.815156","192.168.2.3","192.168.2.1","TCP","66","8009  >  51484 [ACK] Seq=1 Ack=158 Win=15552 Len=0 TSval=1763257 TSecr=1279698045"
"34","2018-09-19 09:45:28.846136","192.168.2.3","192.168.2.1","AJP13","1197","AJP13 Error?"
"37","2018-09-19 09:45:28.852608","192.168.2.3","192.168.2.1","TCP","292","8009  >  51484 [PSH, ACK] Seq=1132 Ack=251 Win=15552 Len=226 TSval=1763260 TSecr=1279698082 [TCP segment of a reassembled PDU]"
"40","2018-09-19 09:45:28.864553","192.168.2.3","192.168.2.1","TCP","1514","8009  >  51484 [ACK] Seq=1358 Ack=376 Win=15552 Len=1448 TSval=1763262 TSecr=1279698088 [TCP segment of a reassembled PDU]"
"41","2018-09-19 09:45:28.865513","192.168.2.3","192.168.2.1","TCP","1514","8009  >  51484 [ACK] Seq=2806 Ack=376 Win=15552 Len=1448 TSval=1763262 TSecr=1279698088 [TCP segment of a reassembled PDU]"
"42","2018-09-19 09:45:28.865516","192.168.2.3","192.168.2.1","TCP","1247","8009  >  51484 [PSH, ACK] Seq=4254 Ack=376 Win=15552 Len=1181 TSval=1763262 TSecr=1279698088 [TCP segment of a reassembled PDU]"
"59","2018-09-19 09:45:33.249184","192.168.2.3","64.233.188.188","TCP","92","[TCP Previous segment not captured] 36126  >  5228 [PSH, ACK] Seq=2 Ack=1 Win=406 Len=26 TSval=1763699 TSecr=1096516917"
"61","2018-09-19 09:45:33.286253","192.168.2.3","64.233.188.188","TCP","66","36126  >  5228 [ACK] Seq=28 Ack=27 Win=406 Len=0 TSval=1763704 TSecr=1096546724"
"69","2018-09-19 09:45:33.879516","192.168.2.3","192.168.2.1","TCP","66","8009  >  51484 [ACK] Seq=5435 Ack=955 Win=16640 Len=0 TSval=1763763 TSecr=1279703097"
"70","2018-09-19 09:45:33.879522","192.168.2.3","192.168.2.1","TCP","183","8009  >  51484 [PSH, ACK] Seq=5435 Ack=955 Win=16640 Len=117 TSval=1763763 TSecr=1279703097 [TCP segment of a reassembled PDU]"
"72","2018-09-19 09:45:33.880624","192.168.2.3","192.168.2.1","TCP","519","8009  >  51484 [PSH, ACK] Seq=5552 Ack=1106 Win=17728 Len=453 TSval=1763764 TSecr=1279703098 [TCP segment of a reassembled PDU]"
"75","2018-09-19 09:45:43.894212","192.168.2.3","192.168.2.1","TCP","183","8009  >  51484 [PSH, ACK] Seq=6005 Ack=1223 Win=17728 Len=117 TSval=1764765 TSecr=1279713114 [TCP segment of a reassembled PDU]"
"77","2018-09-19 09:45:45.679736","192.168.2.3","172.217.27.174","TCP","66","[TCP Dup ACK 1#1] 42644  >  443 [ACK] Seq=1 Ack=1 Win=279 Len=0 TSval=1764944 TSecr=1661014334"
"80","2018-09-19 09:45:49.915632","192.168.2.3","192.168.2.1","TCP","183","8009  >  51484 [PSH, ACK] Seq=6122 Ack=1340 Win=17728 Len=117 TSval=1765367 TSecr=1279719126 [TCP segment of a reassembled PDU]"
"95","2018-09-19 09:45:56.698812","192.168.2.3","192.168.2.1","TCP","183","8009  >  51484 [PSH, ACK] Seq=6239 Ack=1457 Win=17728 Len=117 TSval=1766045 TSecr=1279725913 [TCP segment of a reassembled PDU]"
"99","2018-09-19 09:46:00.282651","192.168.2.3","172.217.27.174","TCP","66","[TCP Previous segment not captured] 42644  >  443 [FIN, ACK] Seq=2 Ack=57 Win=279 Len=0 TSval=1766404 TSecr=1661074038"
"101","2018-09-19 09:46:02.959944","192.168.2.3","108.177.125.188","TCP","66","[TCP Dup ACK 18#1] 42262  >  5228 [ACK] Seq=1 Ack=1 Win=406 Len=0 TSval=1766672 TSecr=497832322"
"107","2018-09-19 09:46:09.921583","192.168.2.3","192.168.2.1","TCP","74","8009  >  51485 [SYN, ACK, ECN] Seq=0 Ack=1 Win=14480 Len=0 MSS=1460 SACK_PERM=1 TSval=1767368 TSecr=1279739130 WS=64"
"110","2018-09-19 09:46:09.922445","192.168.2.3","192.168.2.1","TCP","97","8009  >  51484 [PSH, ACK] Seq=6356 Ack=1458 Win=17728 Len=31 TSval=1767368 TSecr=1279739130 [TCP segment of a reassembled PDU]"
"111","2018-09-19 09:46:09.922448","192.168.2.3","192.168.2.1","TCP","66","8009  >  51484 [FIN, ACK] Seq=6387 Ack=1458 Win=17728 Len=0 TSval=1767368 TSecr=1279739130"
"114","2018-09-19 09:46:09.922814","192.168.2.3","192.168.2.1","TCP","66","8009  >  51485 [ACK] Seq=1 Ack=158 Win=15552 Len=0 TSval=1767368 TSecr=1279739135"
"115","2018-09-19 09:46:09.947172","192.168.2.3","192.168.2.1","AJP13","1197","AJP13 Error?"
"118","2018-09-19 09:46:09.956491","192.168.2.3","192.168.2.1","TCP","292","8009  >  51485 [PSH, ACK] Seq=1132 Ack=251 Win=15552 Len=226 TSval=1767371 TSecr=1279739160 [TCP segment of a reassembled PDU]"
"121","2018-09-19 09:46:09.965981","192.168.2.3","192.168.2.1","TCP","1514","8009  >  51485 [ACK] Seq=1358 Ack=376 Win=15552 Len=1448 TSval=1767372 TSecr=1279739169 [TCP segment of a reassembled PDU]"
"122","2018-09-19 09:46:09.966379","192.168.2.3","192.168.2.1","TCP","1514","8009  >  51485 [ACK] Seq=2806 Ack=376 Win=15552 Len=1448 TSval=1767372 TSecr=1279739169 [TCP segment of a reassembled PDU]"
"123","2018-09-19 09:46:09.966382","192.168.2.3","192.168.2.1","TCP","1247","8009  >  51485 [PSH, ACK] Seq=4254 Ack=376 Win=15552 Len=1181 TSval=1767372 TSecr=1279739169 [TCP segment of a reassembled PDU]"
"127","2018-09-19 09:46:14.981384","192.168.2.3","192.168.2.1","TCP","183","8009  >  51485 [PSH, ACK] Seq=5435 Ack=493 Win=15552 Len=117 TSval=1767874 TSecr=1279744189 [TCP segment of a reassembled PDU]"
"131","2018-09-19 09:46:14.983748","192.168.2.3","192.168.2.1","TCP","66","8009  >  51485 [ACK] Seq=5552 Ack=1106 Win=17728 Len=0 TSval=1767874 TSecr=1279744190"
"132","2018-09-19 09:46:14.984662","192.168.2.3","192.168.2.1","TCP","519","8009  >  51485 [PSH, ACK] Seq=5552 Ack=1106 Win=17728 Len=453 TSval=1767874 TSecr=1279744190 [TCP segment of a reassembled PDU]"
"134","2018-09-19 09:46:18.320096","192.168.2.3","64.233.188.188","TCP","66","[TCP Keep-Alive] 36126  >  5228 [ACK] Seq=27 Ack=27 Win=406 Len=0 TSval=1768208 TSecr=1096546724"
"137","2018-09-19 09:46:24.995054","192.168.2.3","192.168.2.1","TCP","183","8009  >  51485 [PSH, ACK] Seq=6005 Ack=1223 Win=17728 Len=117 TSval=1768875 TSecr=1279754197 [TCP segment of a reassembled PDU]"
"154","2018-09-19 09:46:31.796934","192.168.2.3","192.168.2.1","TCP","183","8009  >  51485 [PSH, ACK] Seq=6122 Ack=1340 Win=17728 Len=117 TSval=1769555 TSecr=1279760994 [TCP segment of a reassembled PDU]"
"159","2018-09-19 09:46:38.582516","192.168.2.3","192.168.2.1","TCP","183","8009  >  51485 [PSH, ACK] Seq=6239 Ack=1457 Win=17728 Len=117 TSval=1770234 TSecr=1279767778 [TCP segment of a reassembled PDU]"
"166","2018-09-19 09:46:48.080462","192.168.2.3","108.177.125.188","TCP","66","[TCP Dup ACK 18#2] 42262  >  5228 [ACK] Seq=1 Ack=1 Win=406 Len=0 TSval=1771184 TSecr=497877443"
"170","2018-09-19 09:46:51.800159","192.168.2.3","192.168.2.1","TCP","97","8009  >  51485 [PSH, ACK] Seq=6356 Ack=1458 Win=17728 Len=31 TSval=1771555 TSecr=1279780990 [TCP segment of a reassembled PDU]"
"171","2018-09-19 09:46:51.800163","192.168.2.3","192.168.2.1","TCP","66","8009  >  51485 [FIN, ACK] Seq=6387 Ack=1458 Win=17728 Len=0 TSval=1771555 TSecr=1279780990"
"174","2018-09-19 09:46:51.801311","192.168.2.3","192.168.2.1","TCP","74","8009  >  51486 [SYN, ACK, ECN] Seq=0 Ack=1 Win=14480 Len=0 MSS=1460 SACK_PERM=1 TSval=1771556 TSecr=1279780990 WS=64"
"177","2018-09-19 09:46:51.802600","192.168.2.3","192.168.2.1","TCP","66","8009  >  51486 [ACK] Seq=1 Ack=158 Win=15552 Len=0 TSval=1771556 TSecr=1279780993"
"178","2018-09-19 09:46:51.830223","192.168.2.3","192.168.2.1","AJP13","1197","AJP13 Error?"
"181","2018-09-19 09:46:51.832990","192.168.2.3","192.168.2.1","TCP","292","8009  >  51486 [PSH, ACK] Seq=1132 Ack=251 Win=15552 Len=226 TSval=1771559 TSecr=1279781021 [TCP segment of a reassembled PDU]"
"184","2018-09-19 09:46:51.835402","192.168.2.3","192.168.2.1","TCP","1514","8009  >  51486 [ACK] Seq=1358 Ack=376 Win=15552 Len=1448 TSval=1771559 TSecr=1279781023 [TCP segment of a reassembled PDU]"
"185","2018-09-19 09:46:51.835805","192.168.2.3","192.168.2.1","TCP","1514","8009  >  51486 [ACK] Seq=2806 Ack=376 Win=15552 Len=1448 TSval=1771559 TSecr=1279781023 [TCP segment of a reassembled PDU]"
"187","2018-09-19 09:46:51.836079","192.168.2.3","192.168.2.1","TCP","1247","8009  >  51486 [PSH, ACK] Seq=4254 Ack=376 Win=15552 Len=1181 TSval=1771559 TSecr=1279781023 [TCP segment of a reassembled PDU]"
"201","2018-09-19 09:46:56.862698","192.168.2.3","192.168.2.1","TCP","66","8009  >  51486 [ACK] Seq=5435 Ack=955 Win=16640 Len=0 TSval=1772062 TSecr=1279786041"
"202","2018-09-19 09:46:56.863492","192.168.2.3","192.168.2.1","TCP","183","8009  >  51486 [PSH, ACK] Seq=5435 Ack=1106 Win=17728 Len=117 TSval=1772062 TSecr=1279786043 [TCP segment of a reassembled PDU]"
"204","2018-09-19 09:46:56.866454","192.168.2.3","192.168.2.1","TCP","519","8009  >  51486 [PSH, ACK] Seq=5552 Ack=1106 Win=17728 Len=453 TSval=1772062 TSecr=1279786048 [TCP segment of a reassembled PDU]"
"228","2018-09-19 09:47:00.189522","192.168.2.3","172.217.27.174","TCP","74","42645  >  443 [SYN] Seq=0 Win=14600 Len=0 MSS=1460 SACK_PERM=1 TSval=1772394 TSecr=0 WS=64"
"230","2018-09-19 09:47:00.240492","192.168.2.3","172.217.27.174","TCP","66","42645  >  443 [ACK] Seq=1 Ack=1 Win=14656 Len=0 TSval=1772397 TSecr=3990230427"
"231","2018-09-19 09:47:00.240495","192.168.2.3","172.217.27.174","TLSv1.2","583","Client Hello"
"234","2018-09-19 09:47:00.264090","192.168.2.3","172.217.27.174","TCP","66","42645  >  443 [ACK] Seq=518 Ack=149 Win=15680 Len=0 TSval=1772400 TSecr=3990230478"
"235","2018-09-19 09:47:00.264092","192.168.2.3","172.217.27.174","TLSv1.2","109","Change Cipher Spec, Encrypted Handshake Message"
"236","2018-09-19 09:47:00.264093","192.168.2.3","172.217.27.174","TLSv1.2","151","Application Data"
"237","2018-09-19 09:47:00.264094","192.168.2.3","172.217.27.174","TLSv1.2","234","Application Data"
"238","2018-09-19 09:47:00.264095","192.168.2.3","172.217.27.174","TLSv1.2","322","Application Data"
"242","2018-09-19 09:47:00.270062","192.168.2.3","172.217.27.174","TCP","66","42645  >  443 [ACK] Seq=1070 Ack=240 Win=15680 Len=0 TSval=1772402 TSecr=3990230501"
"243","2018-09-19 09:47:00.274676","192.168.2.3","172.217.27.174","TLSv1.2","96","Application Data"
"249","2018-09-19 09:47:00.346253","192.168.2.3","172.217.27.174","TCP","66","42645  >  443 [ACK] Seq=1100 Ack=773 Win=17856 Len=0 TSval=1772410 TSecr=3990230577"
"250","2018-09-19 09:47:00.346985","192.168.2.3","172.217.27.174","TCP","66","42645  >  443 [ACK] Seq=1100 Ack=876 Win=17856 Len=0 TSval=1772410 TSecr=3990230578"
"251","2018-09-19 09:47:00.347460","192.168.2.3","172.217.27.174","TLSv1.2","104","Application Data"
"257","2018-09-19 09:47:03.440497","192.168.2.3","64.233.188.188","TCP","66","[TCP Keep-Alive] 36126  >  5228 [ACK] Seq=27 Ack=27 Win=406 Len=0 TSval=1772720 TSecr=1096591794"
"260","2018-09-19 09:47:06.877654","192.168.2.3","192.168.2.1","TCP","183","8009  >  51486 [PSH, ACK] Seq=6005 Ack=1223 Win=17728 Len=117 TSval=1773063 TSecr=1279796055 [TCP segment of a reassembled PDU]"
"268","2018-09-19 09:47:11.890286","192.168.2.3","192.168.2.1","TCP","183","8009  >  51486 [PSH, ACK] Seq=6122 Ack=1340 Win=17728 Len=117 TSval=1773564 TSecr=1279801064 [TCP segment of a reassembled PDU]"
