"No.","Time","Source","Destination","Protocol","Length","Info"
"23","2018-09-19 09:43:00.011957","192.168.2.3","192.168.2.1","TCP","183","8009  >  51480 [PSH, ACK] Seq=1 Ack=118 Win=277 Len=117 TSval=1748377 TSecr=1279549322 [TCP segment of a reassembled PDU]"
"25","2018-09-19 09:43:02.480678","192.168.2.3","108.177.125.188","TCP","66","42262  >  5228 [ACK] Seq=1 Ack=1 Win=406 Len=0 TSval=1748624 TSecr=497651840"
"27","2018-09-19 09:43:03.277957","192.168.2.3","64.233.188.188","TCP","66","36126  >  5228 [ACK] Seq=1 Ack=1 Win=406 Len=0 TSval=1748704 TSecr=1096351717"
"31","2018-09-19 09:43:06.828222","192.168.2.3","192.168.2.1","TCP","183","8009  >  51480 [PSH, ACK] Seq=118 Ack=235 Win=277 Len=117 TSval=1749057 TSecr=1279556119 [TCP segment of a reassembled PDU]"
"37","2018-09-19 09:43:13.595761","192.168.2.3","192.168.2.1","TCP","183","8009  >  51480 [PSH, ACK] Seq=235 Ack=352 Win=277 Len=117 TSval=1749735 TSecr=1279562906 [TCP segment of a reassembled PDU]"
"43","2018-09-19 09:43:23.813661","192.168.2.3","192.168.2.1","TCP","74","8009  >  51481 [SYN, ACK, ECN] Seq=0 Ack=1 Win=14480 Len=0 MSS=1460 SACK_PERM=1 TSval=1750757 TSecr=1279573107 WS=64"
"44","2018-09-19 09:43:23.813666","192.168.2.3","192.168.2.1","TCP","97","8009  >  51480 [PSH, ACK] Seq=352 Ack=353 Win=277 Len=31 TSval=1750757 TSecr=1279573107 [TCP segment of a reassembled PDU]"
"45","2018-09-19 09:43:23.813666","192.168.2.3","192.168.2.1","TCP","66","8009  >  51480 [FIN, ACK] Seq=383 Ack=353 Win=277 Len=0 TSval=1750757 TSecr=1279573107"
"50","2018-09-19 09:43:23.816161","192.168.2.3","192.168.2.1","TCP","66","8009  >  51481 [ACK] Seq=1 Ack=158 Win=15552 Len=0 TSval=1750757 TSecr=1279573124"
"51","2018-09-19 09:43:23.838476","192.168.2.3","192.168.2.1","AJP13","1197","AJP13 Error?"
"54","2018-09-19 09:43:23.841618","192.168.2.3","192.168.2.1","TCP","292","8009  >  51481 [PSH, ACK] Seq=1132 Ack=251 Win=15552 Len=226 TSval=1750760 TSecr=1279573148 [TCP segment of a reassembled PDU]"
"57","2018-09-19 09:43:23.847323","192.168.2.3","192.168.2.1","TCP","1514","8009  >  51481 [ACK] Seq=1358 Ack=376 Win=15552 Len=1448 TSval=1750760 TSecr=1279573151 [TCP segment of a reassembled PDU]"
"58","2018-09-19 09:43:23.847512","192.168.2.3","192.168.2.1","TCP","1514","8009  >  51481 [ACK] Seq=2806 Ack=376 Win=15552 Len=1448 TSval=1750760 TSecr=1279573151 [TCP segment of a reassembled PDU]"
"59","2018-09-19 09:43:23.847514","192.168.2.3","192.168.2.1","TCP","1247","8009  >  51481 [PSH, ACK] Seq=4254 Ack=376 Win=15552 Len=1181 TSval=1750760 TSecr=1279573151 [TCP segment of a reassembled PDU]"
"85","2018-09-19 09:43:28.860851","192.168.2.3","192.168.2.1","TCP","183","8009  >  51481 [PSH, ACK] Seq=5435 Ack=493 Win=15552 Len=117 TSval=1751262 TSecr=1279578162 [TCP segment of a reassembled PDU]"
"87","2018-09-19 09:43:28.867944","192.168.2.3","192.168.2.1","TCP","66","8009  >  51481 [ACK] Seq=5552 Ack=1106 Win=17728 Len=0 TSval=1751262 TSecr=1279578163"
"88","2018-09-19 09:43:28.867946","192.168.2.3","192.168.2.1","TCP","519","8009  >  51481 [PSH, ACK] Seq=5552 Ack=1106 Win=17728 Len=453 TSval=1751262 TSecr=1279578163 [TCP segment of a reassembled PDU]"
"93","2018-09-19 09:43:30.319078","192.168.2.3","172.217.27.174","TCP","66","42644  >  443 [ACK] Seq=1 Ack=1 Win=279 Len=0 TSval=1751408 TSecr=1660879049"
"95","2018-09-19 09:43:33.180415","192.168.2.3","64.233.188.188","TCP","92","[TCP Previous segment not captured] 36126  >  5228 [PSH, ACK] Seq=2 Ack=1 Win=406 Len=26 TSval=1751694 TSecr=1096396752"
"97","2018-09-19 09:43:33.235009","192.168.2.3","64.233.188.188","TCP","66","36126  >  5228 [ACK] Seq=28 Ack=27 Win=406 Len=0 TSval=1751699 TSecr=1096426655"
"99","2018-09-19 09:43:38.880700","192.168.2.3","192.168.2.1","TCP","183","8009  >  51481 [PSH, ACK] Seq=6005 Ack=1223 Win=17728 Len=117 TSval=1752264 TSecr=1279588175 [TCP segment of a reassembled PDU]"
"102","2018-09-19 09:43:44.908652","192.168.2.3","192.168.2.1","TCP","183","8009  >  51481 [PSH, ACK] Seq=6122 Ack=1340 Win=17728 Len=117 TSval=1752867 TSecr=1279594200 [TCP segment of a reassembled PDU]"
"104","2018-09-19 09:43:47.598683","192.168.2.3","108.177.125.188","TCP","66","[TCP Dup ACK 25#1] 42262  >  5228 [ACK] Seq=1 Ack=1 Win=406 Len=0 TSval=1753136 TSecr=497696963"
"119","2018-09-19 09:43:50.907553","192.168.2.3","192.168.2.1","TCP","183","8009  >  51481 [PSH, ACK] Seq=6239 Ack=1457 Win=17728 Len=117 TSval=1753466 TSecr=1279600200 [TCP segment of a reassembled PDU]"
"127","2018-09-19 09:44:04.916502","192.168.2.3","192.168.2.1","TCP","74","8009  >  51482 [SYN, ACK, ECN] Seq=0 Ack=1 Win=14480 Len=0 MSS=1460 SACK_PERM=1 TSval=1754867 TSecr=1279614200 WS=64"
"128","2018-09-19 09:44:04.916506","192.168.2.3","192.168.2.1","TCP","97","8009  >  51481 [PSH, ACK] Seq=6356 Ack=1458 Win=17728 Len=31 TSval=1754867 TSecr=1279614200 [TCP segment of a reassembled PDU]"
"129","2018-09-19 09:44:04.916507","192.168.2.3","192.168.2.1","TCP","66","8009  >  51481 [FIN, ACK] Seq=6387 Ack=1458 Win=17728 Len=0 TSval=1754867 TSecr=1279614200"
"134","2018-09-19 09:44:04.918829","192.168.2.3","192.168.2.1","TCP","66","8009  >  51482 [ACK] Seq=1 Ack=158 Win=15552 Len=0 TSval=1754868 TSecr=1279614207"
"135","2018-09-19 09:44:04.940521","192.168.2.3","192.168.2.1","AJP13","1197","AJP13 Error?"
"138","2018-09-19 09:44:04.945020","192.168.2.3","192.168.2.1","TCP","292","8009  >  51482 [PSH, ACK] Seq=1132 Ack=251 Win=15552 Len=226 TSval=1754870 TSecr=1279614230 [TCP segment of a reassembled PDU]"
"141","2018-09-19 09:44:04.952911","192.168.2.3","192.168.2.1","TCP","1514","8009  >  51482 [ACK] Seq=1358 Ack=376 Win=15552 Len=1448 TSval=1754871 TSecr=1279614234 [TCP segment of a reassembled PDU]"
"142","2018-09-19 09:44:04.952916","192.168.2.3","192.168.2.1","TCP","1514","8009  >  51482 [ACK] Seq=2806 Ack=376 Win=15552 Len=1448 TSval=1754871 TSecr=1279614234 [TCP segment of a reassembled PDU]"
"144","2018-09-19 09:44:04.953252","192.168.2.3","192.168.2.1","TCP","1247","8009  >  51482 [PSH, ACK] Seq=4254 Ack=376 Win=15552 Len=1181 TSval=1754871 TSecr=1279614234 [TCP segment of a reassembled PDU]"
"149","2018-09-19 09:44:09.967528","192.168.2.3","192.168.2.1","TCP","183","8009  >  51482 [PSH, ACK] Seq=5435 Ack=493 Win=15552 Len=117 TSval=1755372 TSecr=1279619251 [TCP segment of a reassembled PDU]"
"152","2018-09-19 09:44:09.969514","192.168.2.3","192.168.2.1","TCP","66","8009  >  51482 [ACK] Seq=5552 Ack=1106 Win=17728 Len=0 TSval=1755373 TSecr=1279619252"
"153","2018-09-19 09:44:09.970466","192.168.2.3","192.168.2.1","TCP","519","8009  >  51482 [PSH, ACK] Seq=5552 Ack=1106 Win=17728 Len=453 TSval=1755373 TSecr=1279619252 [TCP segment of a reassembled PDU]"
"156","2018-09-19 09:44:14.982882","192.168.2.3","192.168.2.1","TCP","183","8009  >  51482 [PSH, ACK] Seq=6005 Ack=1223 Win=17728 Len=117 TSval=1755874 TSecr=1279624256 [TCP segment of a reassembled PDU]"
"158","2018-09-19 09:44:15.438752","192.168.2.3","172.217.27.174","TCP","66","[TCP Dup ACK 93#1] 42644  >  443 [ACK] Seq=1 Ack=1 Win=279 Len=0 TSval=1755920 TSecr=1660924090"
"160","2018-09-19 09:44:18.337621","192.168.2.3","64.233.188.188","TCP","66","[TCP Keep-Alive] 36126  >  5228 [ACK] Seq=27 Ack=27 Win=406 Len=0 TSval=1756208 TSecr=1096426655"
"163","2018-09-19 09:44:21.114348","192.168.2.3","192.168.2.1","TCP","183","8009  >  51482 [PSH, ACK] Seq=6122 Ack=1340 Win=17728 Len=117 TSval=1756487 TSecr=1279630390 [TCP segment of a reassembled PDU]"
"169","2018-09-19 09:44:26.127396","192.168.2.3","192.168.2.1","TCP","183","8009  >  51482 [PSH, ACK] Seq=6239 Ack=1457 Win=17728 Len=117 TSval=1756988 TSecr=1279635397 [TCP segment of a reassembled PDU]"
"186","2018-09-19 09:44:32.729672","192.168.2.3","108.177.125.188","TCP","66","[TCP Dup ACK 25#2] 42262  >  5228 [ACK] Seq=1 Ack=1 Win=406 Len=0 TSval=1757648 TSecr=497742081"
"189","2018-09-19 09:44:32.913347","192.168.2.3","192.168.2.1","TCP","183","8009  >  51482 [PSH, ACK] Seq=6356 Ack=1574 Win=17728 Len=117 TSval=1757667 TSecr=1279642182 [TCP segment of a reassembled PDU]"
