"No.","Time","Source","Destination","Protocol","Length","Info"
"1","2018-09-19 09:50:18.482707","192.168.2.3","64.233.188.188","TCP","66","36126  >  5228 [ACK] Seq=1 Ack=1 Win=406 Len=0 TSval=1792224 TSecr=1096786810"
"6","2018-09-19 09:50:19.968382","192.168.2.3","192.168.2.1","TCP","66","8009  >  51491 [ACK] Seq=1 Ack=580 Win=260 Len=0 TSval=1792372 TSecr=1279989028"
"7","2018-09-19 09:50:19.968385","192.168.2.3","192.168.2.1","TCP","183","8009  >  51491 [PSH, ACK] Seq=1 Ack=580 Win=260 Len=117 TSval=1792372 TSecr=1279989028 [TCP segment of a reassembled PDU]"
"9","2018-09-19 09:50:19.971051","192.168.2.3","192.168.2.1","TCP","519","8009  >  51491 [PSH, ACK] Seq=118 Ack=731 Win=277 Len=453 TSval=1792372 TSecr=1279989030 [TCP segment of a reassembled PDU]"
"12","2018-09-19 09:50:24.987391","192.168.2.3","192.168.2.1","TCP","183","8009  >  51491 [PSH, ACK] Seq=571 Ack=848 Win=277 Len=117 TSval=1792874 TSecr=1279994034 [TCP segment of a reassembled PDU]"
"30","2018-09-19 09:50:31.774875","192.168.2.3","192.168.2.1","AJP13","183","AJP13 Error? [TCP segment of a reassembled PDU]"
"32","2018-09-19 09:50:33.709037","192.168.2.3","108.177.125.188","TCP","66","42262  >  5228 [ACK] Seq=1 Ack=1 Win=406 Len=0 TSval=1793744 TSecr=498103074"
"35","2018-09-19 09:50:41.781755","192.168.2.3","192.168.2.1","TCP","183","8009  >  51491 [PSH, ACK] Seq=805 Ack=1082 Win=277 Len=117 TSval=1794553 TSecr=1280010832 [TCP segment of a reassembled PDU]"
"39","2018-09-19 09:50:45.844054","192.168.2.3","172.217.27.174","TCP","66","42645  >  443 [ACK] Seq=1 Ack=1 Win=279 Len=0 TSval=1794960 TSecr=3990410961"
"44","2018-09-19 09:50:56.786299","192.168.2.3","192.168.2.1","TCP","183","8009  >  51491 [PSH, ACK] Seq=922 Ack=1199 Win=277 Len=117 TSval=1796054 TSecr=1280025829 [TCP segment of a reassembled PDU]"
"48","2018-09-19 09:51:00.357802","192.168.2.3","172.217.27.174","TCP","66","[TCP Previous segment not captured] 42645  >  443 [FIN, ACK] Seq=2 Ack=56 Win=279 Len=0 TSval=1796411 TSecr=3990470581"
"49","2018-09-19 09:51:00.358033","192.168.2.3","172.217.27.174","TCP","66","42645  >  443 [ACK] Seq=3 Ack=57 Win=279 Len=0 TSval=1796411 TSecr=3990470581"
"52","2018-09-19 09:51:03.604278","192.168.2.3","64.233.188.188","TCP","66","[TCP Dup ACK 1#1] 36126  >  5228 [ACK] Seq=1 Ack=1 Win=406 Len=0 TSval=1796736 TSecr=1096831957"
"57","2018-09-19 09:51:09.273381","192.168.2.3","192.168.2.1","TCP","183","8009  >  51491 [PSH, ACK] Seq=1039 Ack=1316 Win=277 Len=117 TSval=1797303 TSecr=1280038314 [TCP segment of a reassembled PDU]"
"73","2018-09-19 09:51:18.805750","192.168.2.3","108.177.125.188","TCP","66","[TCP Dup ACK 32#1] 42262  >  5228 [ACK] Seq=1 Ack=1 Win=406 Len=0 TSval=1798256 TSecr=498148192"
"76","2018-09-19 09:51:24.275394","192.168.2.3","192.168.2.1","TCP","183","8009  >  51491 [PSH, ACK] Seq=1156 Ack=1433 Win=277 Len=117 TSval=1798803 TSecr=1280053313 [TCP segment of a reassembled PDU]"
"90","2018-09-19 09:51:33.391758","192.168.2.3","64.233.188.188","TCP","92","[TCP Previous segment not captured] 36126  >  5228 [PSH, ACK] Seq=2 Ack=1 Win=406 Len=26 TSval=1799713 TSecr=1096877079"
"92","2018-09-19 09:51:33.430893","192.168.2.3","64.233.188.188","TCP","66","36126  >  5228 [ACK] Seq=28 Ack=27 Win=406 Len=0 TSval=1799718 TSecr=1096906867"
"97","2018-09-19 09:51:38.523869","192.168.2.3","192.168.2.1","TCP","183","8009  >  51491 [PSH, ACK] Seq=1273 Ack=1550 Win=277 Len=117 TSval=1800225 TSecr=1280067530 [TCP segment of a reassembled PDU]"
"98","2018-09-19 09:51:38.523873","192.168.2.3","192.168.2.1","TCP","74","8009  >  51492 [SYN, ACK, ECN] Seq=0 Ack=1 Win=14480 Len=0 MSS=1460 SACK_PERM=1 TSval=1800226 TSecr=1280067530 WS=64"
"99","2018-09-19 09:51:38.523874","192.168.2.3","192.168.2.1","TCP","97","8009  >  51491 [PSH, ACK] Seq=1390 Ack=1551 Win=277 Len=31 TSval=1800226 TSecr=1280067530 [TCP segment of a reassembled PDU]"
"100","2018-09-19 09:51:38.523887","192.168.2.3","192.168.2.1","TCP","66","8009  >  51491 [FIN, ACK] Seq=1421 Ack=1551 Win=277 Len=0 TSval=1800226 TSecr=1280067530"
"106","2018-09-19 09:51:38.526265","192.168.2.3","192.168.2.1","TCP","66","8009  >  51492 [ACK] Seq=1 Ack=158 Win=15552 Len=0 TSval=1800228 TSecr=1280067559"
"107","2018-09-19 09:51:38.551140","192.168.2.3","192.168.2.1","AJP13","1197","AJP13 Error?"
"110","2018-09-19 09:51:38.554550","192.168.2.3","192.168.2.1","TCP","292","8009  >  51492 [PSH, ACK] Seq=1132 Ack=251 Win=15552 Len=226 TSval=1800231 TSecr=1280067585 [TCP segment of a reassembled PDU]"
"113","2018-09-19 09:51:38.557640","192.168.2.3","192.168.2.1","TCP","1514","8009  >  51492 [ACK] Seq=1358 Ack=376 Win=15552 Len=1448 TSval=1800231 TSecr=1280067588 [TCP segment of a reassembled PDU]"
"114","2018-09-19 09:51:38.557644","192.168.2.3","192.168.2.1","TCP","1514","8009  >  51492 [ACK] Seq=2806 Ack=376 Win=15552 Len=1448 TSval=1800231 TSecr=1280067588 [TCP segment of a reassembled PDU]"
"117","2018-09-19 09:51:38.557856","192.168.2.3","192.168.2.1","TCP","1247","8009  >  51492 [PSH, ACK] Seq=4254 Ack=376 Win=15552 Len=1181 TSval=1800231 TSecr=1280067588 [TCP segment of a reassembled PDU]"
"121","2018-09-19 09:51:43.557177","192.168.2.3","192.168.2.1","TCP","66","8009  >  51492 [ACK] Seq=5435 Ack=989 Win=17728 Len=0 TSval=1800731 TSecr=1280072585"
"122","2018-09-19 09:51:43.559359","192.168.2.3","192.168.2.1","TCP","519","8009  >  51492 [PSH, ACK] Seq=5435 Ack=989 Win=17728 Len=453 TSval=1800731 TSecr=1280072585 [TCP segment of a reassembled PDU]"
"129","2018-09-19 09:51:53.577380","192.168.2.3","192.168.2.1","TCP","97","8009  >  51492 [PSH, ACK] Seq=5888 Ack=990 Win=17728 Len=31 TSval=1801732 TSecr=1280082589 [TCP segment of a reassembled PDU]"
"130","2018-09-19 09:51:53.577384","192.168.2.3","192.168.2.1","TCP","74","8009  >  51493 [SYN, ACK, ECN] Seq=0 Ack=1 Win=14480 Len=0 MSS=1460 SACK_PERM=1 TSval=1801732 TSecr=1280082589 WS=64"
"131","2018-09-19 09:51:53.577384","192.168.2.3","192.168.2.1","TCP","66","8009  >  51492 [FIN, ACK] Seq=5919 Ack=990 Win=17728 Len=0 TSval=1801732 TSecr=1280082589"
"136","2018-09-19 09:51:53.581394","192.168.2.3","192.168.2.1","TCP","66","8009  >  51493 [ACK] Seq=1 Ack=158 Win=15552 Len=0 TSval=1801733 TSecr=1280082602"
"137","2018-09-19 09:51:53.604774","192.168.2.3","192.168.2.1","AJP13","1197","AJP13 Error?"
"140","2018-09-19 09:51:53.607741","192.168.2.3","192.168.2.1","TCP","292","8009  >  51493 [PSH, ACK] Seq=1132 Ack=251 Win=15552 Len=226 TSval=1801736 TSecr=1280082628 [TCP segment of a reassembled PDU]"
"143","2018-09-19 09:51:53.610179","192.168.2.3","192.168.2.1","TCP","1514","8009  >  51493 [ACK] Seq=1358 Ack=376 Win=15552 Len=1448 TSval=1801736 TSecr=1280082630 [TCP segment of a reassembled PDU]"
"144","2018-09-19 09:51:53.610589","192.168.2.3","192.168.2.1","TCP","1514","8009  >  51493 [ACK] Seq=2806 Ack=376 Win=15552 Len=1448 TSval=1801736 TSecr=1280082630 [TCP segment of a reassembled PDU]"
"145","2018-09-19 09:51:53.610592","192.168.2.3","192.168.2.1","TCP","1247","8009  >  51493 [PSH, ACK] Seq=4254 Ack=376 Win=15552 Len=1181 TSval=1801736 TSecr=1280082630 [TCP segment of a reassembled PDU]"
"159","2018-09-19 09:51:58.579955","192.168.2.3","192.168.2.1","TCP","66","8009  >  51493 [ACK] Seq=5435 Ack=989 Win=17728 Len=0 TSval=1802233 TSecr=1280087589"
"160","2018-09-19 09:51:58.598670","192.168.2.3","192.168.2.1","TCP","519","8009  >  51493 [PSH, ACK] Seq=5435 Ack=989 Win=17728 Len=453 TSval=1802233 TSecr=1280087589 [TCP segment of a reassembled PDU]"
"166","2018-09-19 09:52:00.168833","192.168.2.3","172.217.27.174","TCP","74","42647  >  443 [SYN] Seq=0 Win=14600 Len=0 MSS=1460 SACK_PERM=1 TSval=1802392 TSecr=0 WS=64"
"168","2018-09-19 09:52:00.174957","192.168.2.3","172.217.27.174","TCP","66","42647  >  443 [ACK] Seq=1 Ack=1 Win=14656 Len=0 TSval=1802393 TSecr=803928957"
"169","2018-09-19 09:52:00.175404","192.168.2.3","172.217.27.174","TLSv1.2","269","Client Hello"
"174","2018-09-19 09:52:00.221681","192.168.2.3","172.217.27.174","TCP","66","42647  >  443 [ACK] Seq=204 Ack=1419 Win=17472 Len=0 TSval=1802397 TSecr=803929001"
"175","2018-09-19 09:52:00.221683","192.168.2.3","172.217.27.174","TCP","66","42647  >  443 [ACK] Seq=204 Ack=2837 Win=20288 Len=0 TSval=1802397 TSecr=803929001"
"176","2018-09-19 09:52:00.221684","192.168.2.3","172.217.27.174","TCP","66","42647  >  443 [ACK] Seq=204 Ack=3570 Win=23168 Len=0 TSval=1802397 TSecr=803929001"
"177","2018-09-19 09:52:00.231952","192.168.2.3","172.217.27.174","TLSv1.2","151","Client Key Exchange, Change Cipher Spec, Encrypted Handshake Message"
"180","2018-09-19 09:52:00.244041","192.168.2.3","172.217.27.174","TLSv1.2","151","Application Data"
"181","2018-09-19 09:52:00.244653","192.168.2.3","172.217.27.174","TLSv1.2","96","Application Data"
"182","2018-09-19 09:52:00.245083","192.168.2.3","172.217.27.174","TLSv1.2","234","Application Data"
"183","2018-09-19 09:52:00.245086","192.168.2.3","172.217.27.174","TLSv1.2","310","Application Data"
"186","2018-09-19 09:52:00.283796","192.168.2.3","172.217.27.174","TCP","66","42647  >  443 [ACK] Seq=816 Ack=3937 Win=25984 Len=0 TSval=1802404 TSecr=803929031"
"191","2018-09-19 09:52:00.324938","192.168.2.3","172.217.27.174","TCP","66","42647  >  443 [ACK] Seq=816 Ack=4163 Win=28800 Len=0 TSval=1802408 TSecr=803929104"
"192","2018-09-19 09:52:00.324940","192.168.2.3","172.217.27.174","TCP","66","42647  >  443 [ACK] Seq=816 Ack=4393 Win=31616 Len=0 TSval=1802408 TSecr=803929104"
"193","2018-09-19 09:52:00.325126","192.168.2.3","172.217.27.174","TCP","66","42647  >  443 [ACK] Seq=816 Ack=4534 Win=34496 Len=0 TSval=1802408 TSecr=803929104"
"194","2018-09-19 09:52:00.327286","192.168.2.3","172.217.27.174","TCP","66","42647  >  443 [ACK] Seq=816 Ack=4572 Win=34496 Len=0 TSval=1802408 TSecr=803929104"
"195","2018-09-19 09:52:00.327824","192.168.2.3","172.217.27.174","TLSv1.2","104","Application Data"
"197","2018-09-19 09:52:03.923787","192.168.2.3","108.177.125.188","TCP","66","[TCP Dup ACK 32#2] 42262  >  5228 [ACK] Seq=1 Ack=1 Win=406 Len=0 TSval=1802768 TSecr=498193289"
"204","2018-09-19 09:52:08.613483","192.168.2.3","192.168.2.1","TCP","183","8009  >  51493 [PSH, ACK] Seq=5888 Ack=1106 Win=17728 Len=117 TSval=1803236 TSecr=1280097623 [TCP segment of a reassembled PDU]"
"213","2018-09-19 09:52:15.392928","192.168.2.3","192.168.2.1","TCP","183","8009  >  51493 [PSH, ACK] Seq=6005 Ack=1223 Win=17728 Len=117 TSval=1803914 TSecr=1280104403 [TCP segment of a reassembled PDU]"
"221","2018-09-19 09:52:18.488175","192.168.2.3","64.233.188.188","TCP","66","[TCP Keep-Alive] 36126  >  5228 [ACK] Seq=27 Ack=27 Win=406 Len=0 TSval=1804224 TSecr=1096906867"
"224","2018-09-19 09:52:20.399884","192.168.2.3","192.168.2.1","TCP","183","8009  >  51493 [PSH, ACK] Seq=6122 Ack=1340 Win=17728 Len=117 TSval=1804415 TSecr=1280109406 [TCP segment of a reassembled PDU]"
