"No.","Time","Source","Destination","Protocol","Length","Info"
"1","2018-09-19 09:33:30.792520","192.168.2.3","172.217.27.174","TCP","66","42638  >  443 [ACK] Seq=1 Ack=1 Win=279 Len=0 TSval=1691456 TSecr=1711419791"
"3","2018-09-19 09:33:32.930318","192.168.2.3","64.233.188.188","TCP","92","36126  >  5228 [PSH, ACK] Seq=1 Ack=1 Win=406 Len=26 TSval=1691669 TSecr=1095796648"
"5","2018-09-19 09:33:32.970081","192.168.2.3","64.233.188.188","TCP","66","36126  >  5228 [ACK] Seq=27 Ack=27 Win=406 Len=0 TSval=1691673 TSecr=1095826405"
"7","2018-09-19 09:33:36.823428","192.168.2.3","192.168.2.1","TCP","183","8009  >  51467 [PSH, ACK] Seq=1 Ack=118 Win=277 Len=117 TSval=1692059 TSecr=1278986447 [TCP segment of a reassembled PDU]"
"23","2018-09-19 09:33:51.826602","192.168.2.3","192.168.2.1","TCP","183","8009  >  51467 [PSH, ACK] Seq=118 Ack=235 Win=277 Len=117 TSval=1693559 TSecr=1279001445 [TCP segment of a reassembled PDU]"
"30","2018-09-19 09:33:59.583344","192.168.2.3","192.168.2.1","TCP","183","8009  >  51467 [PSH, ACK] Seq=235 Ack=352 Win=277 Len=117 TSval=1694335 TSecr=1279009188 [TCP segment of a reassembled PDU]"
"35","2018-09-19 09:34:01.032198","192.168.2.3","108.177.125.188","TCP","66","42262  >  5228 [ACK] Seq=1 Ack=1 Win=406 Len=0 TSval=1694480 TSecr=497110396"
"50","2018-09-19 09:34:14.592305","192.168.2.3","192.168.2.1","TCP","183","8009  >  51467 [PSH, ACK] Seq=352 Ack=469 Win=277 Len=117 TSval=1695836 TSecr=1279024197 [TCP segment of a reassembled PDU]"
"53","2018-09-19 09:34:15.912308","192.168.2.3","172.217.27.174","TCP","66","[TCP Dup ACK 1#1] 42638  >  443 [ACK] Seq=1 Ack=1 Win=279 Len=0 TSval=1695968 TSecr=1711464882"
"55","2018-09-19 09:34:17.992525","192.168.2.3","64.233.188.188","TCP","66","[TCP Keep-Alive] 36126  >  5228 [ACK] Seq=26 Ack=27 Win=406 Len=0 TSval=1696176 TSecr=1095826405"
"86","2018-09-19 09:34:29.602796","192.168.2.3","192.168.2.1","TCP","183","8009  >  51467 [PSH, ACK] Seq=469 Ack=586 Win=277 Len=117 TSval=1697337 TSecr=1279039202 [TCP segment of a reassembled PDU]"
"91","2018-09-19 09:34:44.607078","192.168.2.3","192.168.2.1","TCP","183","8009  >  51467 [PSH, ACK] Seq=586 Ack=703 Win=277 Len=117 TSval=1698837 TSecr=1279054210 [TCP segment of a reassembled PDU]"
"93","2018-09-19 09:34:46.152644","192.168.2.3","108.177.125.188","TCP","66","[TCP Dup ACK 35#1] 42262  >  5228 [ACK] Seq=1 Ack=1 Win=406 Len=0 TSval=1698992 TSecr=497155513"
"98","2018-09-19 09:34:59.609936","192.168.2.3","192.168.2.1","AJP13","183","AJP13 Error? [TCP segment of a reassembled PDU]"
"100","2018-09-19 09:35:01.032934","192.168.2.3","172.217.27.174","TCP","66","[TCP Dup ACK 1#2] 42638  >  443 [ACK] Seq=1 Ack=1 Win=279 Len=0 TSval=1700480 TSecr=1711510002"
"102","2018-09-19 09:35:03.142781","192.168.2.3","64.233.188.188","TCP","66","[TCP Keep-Alive] 36126  >  5228 [ACK] Seq=26 Ack=27 Win=406 Len=0 TSval=1700688 TSecr=1095871467"
"105","2018-09-19 09:35:10.096966","192.168.2.3","192.168.2.1","TCP","183","8009  >  51467 [PSH, ACK] Seq=820 Ack=937 Win=277 Len=117 TSval=1701386 TSecr=1279079694 [TCP segment of a reassembled PDU]"
"117","2018-09-19 09:35:16.751288","192.168.2.3","192.168.2.1","TCP","183","8009  >  51467 [PSH, ACK] Seq=937 Ack=1054 Win=277 Len=117 TSval=1702051 TSecr=1279086346 [TCP segment of a reassembled PDU]"
"146","2018-09-19 09:35:30.025567","192.168.2.3","192.168.2.1","TCP","74","8009  >  51468 [SYN, ACK, ECN] Seq=0 Ack=1 Win=14480 Len=0 MSS=1460 SACK_PERM=1 TSval=1703379 TSecr=1279099613 WS=64"
"149","2018-09-19 09:35:30.029670","192.168.2.3","192.168.2.1","TCP","97","8009  >  51467 [PSH, ACK] Seq=1054 Ack=1055 Win=277 Len=31 TSval=1703379 TSecr=1279099613 [TCP segment of a reassembled PDU]"
"150","2018-09-19 09:35:30.029675","192.168.2.3","192.168.2.1","TCP","66","8009  >  51467 [FIN, ACK] Seq=1085 Ack=1055 Win=277 Len=0 TSval=1703379 TSecr=1279099613"
"153","2018-09-19 09:35:30.036613","192.168.2.3","192.168.2.1","TCP","66","8009  >  51468 [ACK] Seq=1 Ack=158 Win=15552 Len=0 TSval=1703380 TSecr=1279099615"
"154","2018-09-19 09:35:30.059711","192.168.2.3","192.168.2.1","AJP13","1197","AJP13 Error?"
"157","2018-09-19 09:35:30.063351","192.168.2.3","192.168.2.1","TCP","292","8009  >  51468 [PSH, ACK] Seq=1132 Ack=251 Win=15552 Len=226 TSval=1703383 TSecr=1279099648 [TCP segment of a reassembled PDU]"
"160","2018-09-19 09:35:30.067886","192.168.2.3","192.168.2.1","TCP","1514","8009  >  51468 [ACK] Seq=1358 Ack=376 Win=15552 Len=1448 TSval=1703383 TSecr=1279099651 [TCP segment of a reassembled PDU]"
"161","2018-09-19 09:35:30.068679","192.168.2.3","192.168.2.1","TCP","1514","8009  >  51468 [ACK] Seq=2806 Ack=376 Win=15552 Len=1448 TSval=1703383 TSecr=1279099651 [TCP segment of a reassembled PDU]"
"163","2018-09-19 09:35:30.068873","192.168.2.3","192.168.2.1","TCP","1247","8009  >  51468 [PSH, ACK] Seq=4254 Ack=376 Win=15552 Len=1181 TSval=1703383 TSecr=1279099651 [TCP segment of a reassembled PDU]"
"165","2018-09-19 09:35:31.273191","192.168.2.3","108.177.125.188","TCP","66","[TCP Dup ACK 35#2] 42262  >  5228 [ACK] Seq=1 Ack=1 Win=406 Len=0 TSval=1703504 TSecr=497200634"
"167","2018-09-19 09:35:32.974940","192.168.2.3","64.233.188.188","TCP","92","36126  >  5228 [PSH, ACK] Seq=27 Ack=27 Win=406 Len=26 TSval=1703674 TSecr=1095916617"
"169","2018-09-19 09:35:33.013672","192.168.2.3","64.233.188.188","TCP","66","36126  >  5228 [ACK] Seq=53 Ack=53 Win=406 Len=0 TSval=1703678 TSecr=1095946450"
"172","2018-09-19 09:35:35.083752","192.168.2.3","192.168.2.1","TCP","183","8009  >  51468 [PSH, ACK] Seq=5435 Ack=493 Win=15552 Len=117 TSval=1703885 TSecr=1279104664 [TCP segment of a reassembled PDU]"
"175","2018-09-19 09:35:35.086173","192.168.2.3","192.168.2.1","TCP","66","8009  >  51468 [ACK] Seq=5552 Ack=1106 Win=17728 Len=0 TSval=1703885 TSecr=1279104665"
"176","2018-09-19 09:35:35.087478","192.168.2.3","192.168.2.1","TCP","519","8009  >  51468 [PSH, ACK] Seq=5552 Ack=1106 Win=17728 Len=453 TSval=1703885 TSecr=1279104665 [TCP segment of a reassembled PDU]"
"179","2018-09-19 09:35:40.091552","192.168.2.3","192.168.2.1","TCP","183","8009  >  51468 [PSH, ACK] Seq=6005 Ack=1223 Win=17728 Len=117 TSval=1704385 TSecr=1279109667 [TCP segment of a reassembled PDU]"
"188","2018-09-19 09:35:45.096859","192.168.2.3","192.168.2.1","TCP","183","8009  >  51468 [PSH, ACK] Seq=6122 Ack=1340 Win=17728 Len=117 TSval=1704886 TSecr=1279114671 [TCP segment of a reassembled PDU]"
"190","2018-09-19 09:35:46.153208","192.168.2.3","172.217.27.174","TCP","66","[TCP Dup ACK 1#3] 42638  >  443 [ACK] Seq=1 Ack=1 Win=279 Len=0 TSval=1704992 TSecr=1711555122"
"195","2018-09-19 09:35:51.895426","192.168.2.3","192.168.2.1","TCP","183","8009  >  51468 [PSH, ACK] Seq=6239 Ack=1457 Win=17728 Len=117 TSval=1705566 TSecr=1279121465 [TCP segment of a reassembled PDU]"
"199","2018-09-19 09:35:56.903489","192.168.2.3","192.168.2.1","TCP","183","8009  >  51468 [PSH, ACK] Seq=6356 Ack=1574 Win=17728 Len=117 TSval=1706067 TSecr=1279126468 [TCP segment of a reassembled PDU]"
"204","2018-09-19 09:36:00.682310","192.168.2.3","172.217.27.174","TCP","66","[TCP Previous segment not captured] 42638  >  443 [FIN, ACK] Seq=2 Ack=57 Win=279 Len=0 TSval=1706444 TSecr=1711614766"
"211","2018-09-19 09:36:09.683421","192.168.2.3","192.168.2.1","TCP","74","8009  >  51469 [SYN, ACK, ECN] Seq=0 Ack=1 Win=14480 Len=0 MSS=1460 SACK_PERM=1 TSval=1707344 TSecr=1279139246 WS=64"
"212","2018-09-19 09:36:09.683425","192.168.2.3","192.168.2.1","TCP","97","8009  >  51468 [PSH, ACK] Seq=6473 Ack=1575 Win=17728 Len=31 TSval=1707345 TSecr=1279139246 [TCP segment of a reassembled PDU]"
"213","2018-09-19 09:36:09.683425","192.168.2.3","192.168.2.1","TCP","66","8009  >  51468 [FIN, ACK] Seq=6504 Ack=1575 Win=17728 Len=0 TSval=1707345 TSecr=1279139246"
"218","2018-09-19 09:36:09.685290","192.168.2.3","192.168.2.1","TCP","66","8009  >  51469 [ACK] Seq=1 Ack=158 Win=15552 Len=0 TSval=1707345 TSecr=1279139247"
"219","2018-09-19 09:36:09.706755","192.168.2.3","192.168.2.1","AJP13","1197","AJP13 Error?"
"222","2018-09-19 09:36:09.710570","192.168.2.3","192.168.2.1","TCP","292","8009  >  51469 [PSH, ACK] Seq=1132 Ack=251 Win=15552 Len=226 TSval=1707347 TSecr=1279139269 [TCP segment of a reassembled PDU]"
"225","2018-09-19 09:36:09.713573","192.168.2.3","192.168.2.1","TCP","1514","8009  >  51469 [ACK] Seq=1358 Ack=376 Win=15552 Len=1448 TSval=1707347 TSecr=1279139272 [TCP segment of a reassembled PDU]"
"226","2018-09-19 09:36:09.713577","192.168.2.3","192.168.2.1","TCP","1514","8009  >  51469 [ACK] Seq=2806 Ack=376 Win=15552 Len=1448 TSval=1707347 TSecr=1279139272 [TCP segment of a reassembled PDU]"
"229","2018-09-19 09:36:09.714160","192.168.2.3","192.168.2.1","TCP","1247","8009  >  51469 [PSH, ACK] Seq=4254 Ack=376 Win=15552 Len=1181 TSval=1707347 TSecr=1279139272 [TCP segment of a reassembled PDU]"
"234","2018-09-19 09:36:14.744014","192.168.2.3","192.168.2.1","TCP","66","8009  >  51469 [ACK] Seq=5435 Ack=955 Win=16640 Len=0 TSval=1707850 TSecr=1279144297"
"235","2018-09-19 09:36:14.744018","192.168.2.3","192.168.2.1","TCP","183","8009  >  51469 [PSH, ACK] Seq=5435 Ack=955 Win=16640 Len=117 TSval=1707850 TSecr=1279144297 [TCP segment of a reassembled PDU]"
"237","2018-09-19 09:36:14.749431","192.168.2.3","192.168.2.1","TCP","519","8009  >  51469 [PSH, ACK] Seq=5552 Ack=1106 Win=17728 Len=453 TSval=1707851 TSecr=1279144300 [TCP segment of a reassembled PDU]"
"240","2018-09-19 09:36:16.393590","192.168.2.3","108.177.125.188","TCP","66","[TCP Dup ACK 35#3] 42262  >  5228 [ACK] Seq=1 Ack=1 Win=406 Len=0 TSval=1708016 TSecr=497245755"
"246","2018-09-19 09:36:17.521838","192.168.2.3","172.217.27.174","TCP","74","42640  >  443 [SYN] Seq=0 Win=14600 Len=0 MSS=1460 SACK_PERM=1 TSval=1708128 TSecr=0 WS=64"
"248","2018-09-19 09:36:17.529059","192.168.2.3","172.217.27.174","TCP","66","42640  >  443 [ACK] Seq=1 Ack=1 Win=14656 Len=0 TSval=1708129 TSecr=3989587758"
"249","2018-09-19 09:36:17.529691","192.168.2.3","172.217.27.174","TLSv1.2","269","Client Hello"
"254","2018-09-19 09:36:17.575117","192.168.2.3","172.217.27.174","TCP","66","42640  >  443 [ACK] Seq=204 Ack=1419 Win=17472 Len=0 TSval=1708134 TSecr=3989587804"
"255","2018-09-19 09:36:17.575937","192.168.2.3","172.217.27.174","TCP","66","42640  >  443 [ACK] Seq=204 Ack=2837 Win=20288 Len=0 TSval=1708134 TSecr=3989587804"
"256","2018-09-19 09:36:17.576165","192.168.2.3","172.217.27.174","TCP","66","42640  >  443 [ACK] Seq=204 Ack=3571 Win=23168 Len=0 TSval=1708134 TSecr=3989587804"
"257","2018-09-19 09:36:17.583737","192.168.2.3","172.217.27.174","TLSv1.2","151","Client Key Exchange, Change Cipher Spec, Encrypted Handshake Message"
"260","2018-09-19 09:36:17.597565","192.168.2.3","172.217.27.174","TLSv1.2","151","Application Data"
"261","2018-09-19 09:36:17.598236","192.168.2.3","172.217.27.174","TLSv1.2","96","Application Data"
"262","2018-09-19 09:36:17.598558","192.168.2.3","172.217.27.174","TLSv1.2","179","Application Data"
"263","2018-09-19 09:36:17.599021","192.168.2.3","172.217.27.174","TCP","1434","42640  >  443 [ACK] Seq=517 Ack=3908 Win=25984 Len=1368 TSval=1708136 TSecr=3989587820 [TCP segment of a reassembled PDU]"
"264","2018-09-19 09:36:17.599233","192.168.2.3","172.217.27.174","TCP","1434","42640  >  443 [ACK] Seq=1885 Ack=3908 Win=25984 Len=1368 TSval=1708136 TSecr=3989587820 [TCP segment of a reassembled PDU]"
"265","2018-09-19 09:36:17.599235","192.168.2.3","172.217.27.174","TLSv1.2","212","Application Data"
"266","2018-09-19 09:36:17.599236","192.168.2.3","172.217.27.174","TLSv1.2","675","Application Data"
"271","2018-09-19 09:36:17.643571","192.168.2.3","172.217.27.174","TCP","66","42640  >  443 [ACK] Seq=4008 Ack=3938 Win=25984 Len=0 TSval=1708141 TSecr=3989587834"
"276","2018-09-19 09:36:17.795726","192.168.2.3","172.217.27.174","TCP","66","42640  >  443 [ACK] Seq=4008 Ack=4264 Win=28800 Len=0 TSval=1708156 TSecr=3989588025"
"277","2018-09-19 09:36:17.796023","192.168.2.3","172.217.27.174","TCP","66","42640  >  443 [ACK] Seq=4008 Ack=4506 Win=31616 Len=0 TSval=1708156 TSecr=3989588025"
"278","2018-09-19 09:36:17.796314","192.168.2.3","172.217.27.174","TCP","66","42640  >  443 [ACK] Seq=4008 Ack=4574 Win=31616 Len=0 TSval=1708156 TSecr=3989588025"
"279","2018-09-19 09:36:17.797119","192.168.2.3","172.217.27.174","TLSv1.2","104","Application Data"
"285","2018-09-19 09:36:18.044524","192.168.2.3","216.58.199.234","TCP","74","49477  >  443 [SYN] Seq=0 Win=14600 Len=0 MSS=1460 SACK_PERM=1 TSval=1708181 TSecr=0 WS=64"
"287","2018-09-19 09:36:18.050384","192.168.2.3","216.58.199.234","TCP","66","49477  >  443 [ACK] Seq=1 Ack=1 Win=14656 Len=0 TSval=1708181 TSecr=2043653812"
"288","2018-09-19 09:36:18.050868","192.168.2.3","216.58.199.234","TLSv1.2","272","Client Hello"
"290","2018-09-19 09:36:18.075958","192.168.2.3","64.233.188.188","TCP","66","[TCP Keep-Alive] 36126  >  5228 [ACK] Seq=52 Ack=53 Win=406 Len=0 TSval=1708184 TSecr=1095946450"
"293","2018-09-19 09:36:18.097997","192.168.2.3","216.58.199.234","TCP","66","49477  >  443 [ACK] Seq=207 Ack=1419 Win=17472 Len=0 TSval=1708186 TSecr=2043653856"
"294","2018-09-19 09:36:18.097999","192.168.2.3","216.58.199.234","TCP","66","49477  >  443 [ACK] Seq=207 Ack=2656 Win=20352 Len=0 TSval=1708186 TSecr=2043653856"
"295","2018-09-19 09:36:18.107771","192.168.2.3","216.58.199.234","TLSv1.2","151","Client Key Exchange, Change Cipher Spec, Encrypted Handshake Message"
"299","2018-09-19 09:36:18.115727","192.168.2.3","216.58.199.234","TLSv1.2","151","Application Data"
"300","2018-09-19 09:36:18.115729","192.168.2.3","216.58.199.234","TCP","66","49477  >  443 [ACK] Seq=377 Ack=2993 Win=23168 Len=0 TSval=1708188 TSecr=2043653875"
"301","2018-09-19 09:36:18.115730","192.168.2.3","216.58.199.234","TLSv1.2","96","Application Data"
"302","2018-09-19 09:36:18.115731","192.168.2.3","216.58.199.234","TLSv1.2","322","Application Data"
"303","2018-09-19 09:36:18.115732","192.168.2.3","216.58.199.234","TLSv1.2","330","Application Data"
"306","2018-09-19 09:36:18.153574","192.168.2.3","216.58.199.234","TCP","66","49477  >  443 [ACK] Seq=927 Ack=3023 Win=23168 Len=0 TSval=1708192 TSecr=2043653883"
"311","2018-09-19 09:36:18.193810","192.168.2.3","216.58.199.234","TCP","66","49477  >  443 [ACK] Seq=927 Ack=3277 Win=26048 Len=0 TSval=1708196 TSecr=2043653953"
"312","2018-09-19 09:36:18.193813","192.168.2.3","216.58.199.234","TCP","66","49477  >  443 [ACK] Seq=927 Ack=3587 Win=28864 Len=0 TSval=1708196 TSecr=2043653953"
"313","2018-09-19 09:36:18.194298","192.168.2.3","216.58.199.234","TCP","66","49477  >  443 [ACK] Seq=927 Ack=3823 Win=31680 Len=0 TSval=1708196 TSecr=2043653953"
"314","2018-09-19 09:36:18.195258","192.168.2.3","216.58.199.234","TCP","66","49477  >  443 [ACK] Seq=927 Ack=3861 Win=31680 Len=0 TSval=1708196 TSecr=2043653953"
"315","2018-09-19 09:36:18.196338","192.168.2.3","216.58.199.234","TLSv1.2","104","Application Data"
"319","2018-09-19 09:36:24.756832","192.168.2.3","192.168.2.1","TCP","183","8009  >  51469 [PSH, ACK] Seq=6005 Ack=1223 Win=17728 Len=117 TSval=1708852 TSecr=1279154309 [TCP segment of a reassembled PDU]"
"354","2018-09-19 09:36:29.913294","192.168.2.3","192.168.2.1","TCP","183","8009  >  51469 [PSH, ACK] Seq=6122 Ack=1340 Win=17728 Len=117 TSval=1709367 TSecr=1279159458 [TCP segment of a reassembled PDU]"
"361","2018-09-19 09:36:40.009379","192.168.2.3","192.168.2.1","TCP","74","8009  >  51470 [SYN, ACK, ECN] Seq=0 Ack=1 Win=14480 Len=0 MSS=1460 SACK_PERM=1 TSval=1710377 TSecr=1279169555 WS=64"
"363","2018-09-19 09:36:40.009505","192.168.2.3","192.168.2.1","TCP","97","8009  >  51469 [PSH, ACK] Seq=6239 Ack=1341 Win=17728 Len=31 TSval=1710377 TSecr=1279169555 [TCP segment of a reassembled PDU]"
"364","2018-09-19 09:36:40.009506","192.168.2.3","192.168.2.1","TCP","66","8009  >  51469 [FIN, ACK] Seq=6270 Ack=1341 Win=17728 Len=0 TSval=1710377 TSecr=1279169555"
"368","2018-09-19 09:36:40.010704","192.168.2.3","192.168.2.1","TCP","66","8009  >  51470 [ACK] Seq=1 Ack=158 Win=15552 Len=0 TSval=1710377 TSecr=1279169556"
"369","2018-09-19 09:36:40.033869","192.168.2.3","192.168.2.1","AJP13","1197","AJP13 Error?"
"372","2018-09-19 09:36:40.048260","192.168.2.3","192.168.2.1","TCP","292","8009  >  51470 [PSH, ACK] Seq=1132 Ack=251 Win=15552 Len=226 TSval=1710380 TSecr=1279169580 [TCP segment of a reassembled PDU]"
"375","2018-09-19 09:36:40.054460","192.168.2.3","192.168.2.1","TCP","1514","8009  >  51470 [ACK] Seq=1358 Ack=376 Win=15552 Len=1448 TSval=1710381 TSecr=1279169594 [TCP segment of a reassembled PDU]"
"376","2018-09-19 09:36:40.054465","192.168.2.3","192.168.2.1","TCP","1514","8009  >  51470 [ACK] Seq=2806 Ack=376 Win=15552 Len=1448 TSval=1710381 TSecr=1279169594 [TCP segment of a reassembled PDU]"
"377","2018-09-19 09:36:40.054680","192.168.2.3","192.168.2.1","TCP","1247","8009  >  51470 [PSH, ACK] Seq=4254 Ack=376 Win=15552 Len=1181 TSval=1710381 TSecr=1279169594 [TCP segment of a reassembled PDU]"
"385","2018-09-19 09:36:45.085864","192.168.2.3","192.168.2.1","TCP","183","8009  >  51470 [PSH, ACK] Seq=5435 Ack=493 Win=15552 Len=117 TSval=1710883 TSecr=1279174608 [TCP segment of a reassembled PDU]"
"386","2018-09-19 09:36:45.085875","192.168.2.3","192.168.2.1","TCP","66","8009  >  51470 [ACK] Seq=5552 Ack=1106 Win=17728 Len=0 TSval=1710883 TSecr=1279174609"
"387","2018-09-19 09:36:45.085878","192.168.2.3","192.168.2.1","TCP","519","8009  >  51470 [PSH, ACK] Seq=5552 Ack=1106 Win=17728 Len=453 TSval=1710883 TSecr=1279174609 [TCP segment of a reassembled PDU]"
"398","2018-09-19 09:36:55.097644","192.168.2.3","192.168.2.1","TCP","183","8009  >  51470 [PSH, ACK] Seq=6005 Ack=1223 Win=17728 Len=117 TSval=1711886 TSecr=1279184631 [TCP segment of a reassembled PDU]"
"404","2018-09-19 09:37:00.166501","192.168.2.3","216.58.197.14","TCP","74","46334  >  443 [SYN] Seq=0 Win=14600 Len=0 MSS=1460 SACK_PERM=1 TSval=1712393 TSecr=0 WS=64"
"406","2018-09-19 09:37:00.173451","192.168.2.3","216.58.197.14","TCP","66","46334  >  443 [ACK] Seq=1 Ack=1 Win=14656 Len=0 TSval=1712393 TSecr=4180332365"
"407","2018-09-19 09:37:00.173967","192.168.2.3","216.58.197.14","TLSv1.2","583","Client Hello"
"410","2018-09-19 09:37:00.183371","192.168.2.3","216.58.197.14","TCP","66","46334  >  443 [ACK] Seq=518 Ack=149 Win=15680 Len=0 TSval=1712394 TSecr=4180332373"
"411","2018-09-19 09:37:00.183932","192.168.2.3","216.58.197.14","TLSv1.2","109","Change Cipher Spec, Encrypted Handshake Message"
"412","2018-09-19 09:37:00.185516","192.168.2.3","216.58.197.14","TLSv1.2","151","Application Data"
"413","2018-09-19 09:37:00.186016","192.168.2.3","216.58.197.14","TLSv1.2","233","Application Data"
"414","2018-09-19 09:37:00.186019","192.168.2.3","216.58.197.14","TLSv1.2","313","Application Data"
"417","2018-09-19 09:37:00.189974","192.168.2.3","216.58.197.14","TLSv1.2","96","Application Data"
"425","2018-09-19 09:37:00.312761","192.168.2.3","216.58.197.14","TCP","66","46334  >  443 [ACK] Seq=1090 Ack=240 Win=15680 Len=0 TSval=1712399 TSecr=4180332383"
"426","2018-09-19 09:37:00.318711","192.168.2.3","216.58.197.14","TCP","66","46334  >  443 [ACK] Seq=1090 Ack=466 Win=16768 Len=0 TSval=1712408 TSecr=4180332465"
"427","2018-09-19 09:37:00.318713","192.168.2.3","216.58.197.14","TCP","66","46334  >  443 [ACK] Seq=1090 Ack=553 Win=16768 Len=0 TSval=1712408 TSecr=4180332465"
"428","2018-09-19 09:37:00.319262","192.168.2.3","216.58.197.14","TCP","66","46334  >  443 [ACK] Seq=1090 Ack=810 Win=17856 Len=0 TSval=1712408 TSecr=4180332465"
"429","2018-09-19 09:37:00.319264","192.168.2.3","216.58.197.14","TCP","66","46334  >  443 [ACK] Seq=1090 Ack=848 Win=17856 Len=0 TSval=1712408 TSecr=4180332465"
"430","2018-09-19 09:37:00.319590","192.168.2.3","216.58.197.14","TCP","78","[TCP Dup ACK 429#1] 46334  >  443 [ACK] Seq=1090 Ack=848 Win=17856 Len=0 TSval=1712408 TSecr=4180332481 SLE=810 SRE=848"
"431","2018-09-19 09:37:00.324916","192.168.2.3","216.58.197.14","TLSv1.2","104","Application Data"
"433","2018-09-19 09:37:01.514078","192.168.2.3","108.177.125.188","TCP","66","[TCP Dup ACK 35#4] 42262  >  5228 [ACK] Seq=1 Ack=1 Win=406 Len=0 TSval=1712528 TSecr=497290875"
"436","2018-09-19 09:37:01.894993","192.168.2.3","192.168.2.1","TCP","183","8009  >  51470 [PSH, ACK] Seq=6122 Ack=1340 Win=17728 Len=117 TSval=1712566 TSecr=1279191408 [TCP segment of a reassembled PDU]"
"438","2018-09-19 09:37:02.964630","192.168.2.3","172.217.27.174","TCP","66","[TCP Keep-Alive] 42640  >  443 [ACK] Seq=4045 Ack=4574 Win=31616 Len=0 TSval=1712660 TSecr=3989588073"
"440","2018-09-19 09:37:03.153583","192.168.2.3","64.233.188.188","TCP","66","[TCP Keep-Alive] 36126  >  5228 [ACK] Seq=52 Ack=53 Win=406 Len=0 TSval=1712688 TSecr=1095991550"
"442","2018-09-19 09:37:03.270704","192.168.2.3","216.58.199.234","TCP","66","[TCP Keep-Alive] 49477  >  443 [ACK] Seq=964 Ack=3861 Win=31680 Len=0 TSval=1712701 TSecr=2043654003"
"445","2018-09-19 09:37:08.671459","192.168.2.3","192.168.2.1","TCP","183","8009  >  51470 [PSH, ACK] Seq=6239 Ack=1457 Win=17728 Len=117 TSval=1713243 TSecr=1279198195 [TCP segment of a reassembled PDU]"
"449","2018-09-19 09:37:18.883448","192.168.2.3","192.168.2.1","TCP","74","8009  >  51472 [SYN, ACK, ECN] Seq=0 Ack=1 Win=14480 Len=0 MSS=1460 SACK_PERM=1 TSval=1714264 TSecr=1279208396 WS=64"
"450","2018-09-19 09:37:18.883452","192.168.2.3","192.168.2.1","TCP","97","8009  >  51470 [PSH, ACK] Seq=6356 Ack=1458 Win=17728 Len=31 TSval=1714264 TSecr=1279208396 [TCP segment of a reassembled PDU]"
"451","2018-09-19 09:37:18.883453","192.168.2.3","192.168.2.1","TCP","66","8009  >  51470 [FIN, ACK] Seq=6387 Ack=1458 Win=17728 Len=0 TSval=1714264 TSecr=1279208396"
"456","2018-09-19 09:37:18.887830","192.168.2.3","192.168.2.1","TCP","66","8009  >  51472 [ACK] Seq=1 Ack=158 Win=15552 Len=0 TSval=1714265 TSecr=1279208404"
"457","2018-09-19 09:37:18.918285","192.168.2.3","192.168.2.1","AJP13","1197","AJP13 Error?"
"460","2018-09-19 09:37:18.923281","192.168.2.3","192.168.2.1","TCP","292","8009  >  51472 [PSH, ACK] Seq=1132 Ack=251 Win=15552 Len=226 TSval=1714268 TSecr=1279208438 [TCP segment of a reassembled PDU]"
"463","2018-09-19 09:37:18.933068","192.168.2.3","192.168.2.1","TCP","1514","8009  >  51472 [ACK] Seq=1358 Ack=376 Win=15552 Len=1448 TSval=1714269 TSecr=1279208443 [TCP segment of a reassembled PDU]"
"464","2018-09-19 09:37:18.933074","192.168.2.3","192.168.2.1","TCP","1514","8009  >  51472 [ACK] Seq=2806 Ack=376 Win=15552 Len=1448 TSval=1714269 TSecr=1279208443 [TCP segment of a reassembled PDU]"
"467","2018-09-19 09:37:18.933203","192.168.2.3","192.168.2.1","TCP","1247","8009  >  51472 [PSH, ACK] Seq=4254 Ack=376 Win=15552 Len=1181 TSval=1714269 TSecr=1279208443 [TCP segment of a reassembled PDU]"
"476","2018-09-19 09:37:23.938706","192.168.2.3","192.168.2.1","TCP","66","8009  >  51472 [ACK] Seq=5435 Ack=955 Win=16640 Len=0 TSval=1714770 TSecr=1279213450"
"477","2018-09-19 09:37:23.939224","192.168.2.3","192.168.2.1","TCP","183","8009  >  51472 [PSH, ACK] Seq=5435 Ack=955 Win=16640 Len=117 TSval=1714770 TSecr=1279213450 [TCP segment of a reassembled PDU]"
"479","2018-09-19 09:37:23.944652","192.168.2.3","192.168.2.1","TCP","519","8009  >  51472 [PSH, ACK] Seq=5552 Ack=1106 Win=17728 Len=453 TSval=1714771 TSecr=1279213452 [TCP segment of a reassembled PDU]"
"506","2018-09-19 09:37:32.086639","192.168.2.3","192.168.2.1","TCP","183","8009  >  51472 [PSH, ACK] Seq=6005 Ack=1223 Win=17728 Len=117 TSval=1715585 TSecr=1279221594 [TCP segment of a reassembled PDU]"
"508","2018-09-19 09:37:33.018602","192.168.2.3","64.233.188.188","TCP","92","36126  >  5228 [PSH, ACK] Seq=53 Ack=53 Win=406 Len=26 TSval=1715678 TSecr=1096036628"
"510","2018-09-19 09:37:33.060885","192.168.2.3","64.233.188.188","TCP","66","36126  >  5228 [ACK] Seq=79 Ack=79 Win=406 Len=0 TSval=1715682 TSecr=1096066495"
"521","2018-09-19 09:37:39.905523","192.168.2.3","192.168.2.1","TCP","183","8009  >  51472 [PSH, ACK] Seq=6122 Ack=1340 Win=17728 Len=117 TSval=1716367 TSecr=1279229409 [TCP segment of a reassembled PDU]"
"526","2018-09-19 09:37:44.911708","192.168.2.3","192.168.2.1","TCP","183","8009  >  51472 [PSH, ACK] Seq=6239 Ack=1457 Win=17728 Len=117 TSval=1716867 TSecr=1279234412 [TCP segment of a reassembled PDU]"
"528","2018-09-19 09:37:45.334528","192.168.2.3","216.58.197.14","TCP","66","[TCP Keep-Alive] 46334  >  443 [ACK] Seq=1127 Ack=848 Win=17856 Len=0 TSval=1716910 TSecr=4180332523"
"530","2018-09-19 09:37:46.634568","192.168.2.3","108.177.125.188","TCP","66","[TCP Dup ACK 35#5] 42262  >  5228 [ACK] Seq=1 Ack=1 Win=406 Len=0 TSval=1717040 TSecr=497335996"
"532","2018-09-19 09:37:47.974920","192.168.2.3","172.217.27.174","TCP","66","[TCP Keep-Alive] 42640  >  443 [ACK] Seq=4045 Ack=4574 Win=31616 Len=0 TSval=1717174 TSecr=3989633201"
"534","2018-09-19 09:37:48.394569","192.168.2.3","216.58.199.234","TCP","66","[TCP Keep-Alive] 49477  >  443 [ACK] Seq=964 Ack=3861 Win=31680 Len=0 TSval=1717216 TSecr=2043699038"
"560","2018-09-19 09:37:59.920935","192.168.2.3","192.168.2.1","TCP","74","8009  >  51473 [SYN, ACK, ECN] Seq=0 Ack=1 Win=14480 Len=0 MSS=1460 SACK_PERM=1 TSval=1718368 TSecr=1279249403 WS=64"
"562","2018-09-19 09:37:59.921273","192.168.2.3","192.168.2.1","TCP","97","8009  >  51472 [PSH, ACK] Seq=6356 Ack=1458 Win=17728 Len=31 TSval=1718368 TSecr=1279249403 [TCP segment of a reassembled PDU]"
"565","2018-09-19 09:37:59.921994","192.168.2.3","192.168.2.1","TCP","66","8009  >  51472 [FIN, ACK] Seq=6387 Ack=1458 Win=17728 Len=0 TSval=1718368 TSecr=1279249403"
"567","2018-09-19 09:37:59.922836","192.168.2.3","192.168.2.1","TCP","66","8009  >  51473 [ACK] Seq=1 Ack=158 Win=15552 Len=0 TSval=1718368 TSecr=1279249418"
"568","2018-09-19 09:37:59.943894","192.168.2.3","192.168.2.1","AJP13","1197","AJP13 Error?"
"571","2018-09-19 09:37:59.946816","192.168.2.3","192.168.2.1","TCP","292","8009  >  51473 [PSH, ACK] Seq=1132 Ack=251 Win=15552 Len=226 TSval=1718371 TSecr=1279249440 [TCP segment of a reassembled PDU]"
"574","2018-09-19 09:37:59.955554","192.168.2.3","192.168.2.1","TCP","1514","8009  >  51473 [ACK] Seq=1358 Ack=376 Win=15552 Len=1448 TSval=1718371 TSecr=1279249442 [TCP segment of a reassembled PDU]"
"575","2018-09-19 09:37:59.955727","192.168.2.3","192.168.2.1","TCP","1514","8009  >  51473 [ACK] Seq=2806 Ack=376 Win=15552 Len=1448 TSval=1718371 TSecr=1279249442 [TCP segment of a reassembled PDU]"
"576","2018-09-19 09:37:59.955730","192.168.2.3","192.168.2.1","TCP","1247","8009  >  51473 [PSH, ACK] Seq=4254 Ack=376 Win=15552 Len=1181 TSval=1718371 TSecr=1279249442 [TCP segment of a reassembled PDU]"
"584","2018-09-19 09:38:04.966013","192.168.2.3","192.168.2.1","TCP","66","8009  >  51473 [ACK] Seq=5435 Ack=955 Win=16640 Len=0 TSval=1718873 TSecr=1279254453"
"585","2018-09-19 09:38:04.966507","192.168.2.3","192.168.2.1","TCP","183","8009  >  51473 [PSH, ACK] Seq=5435 Ack=1106 Win=17728 Len=117 TSval=1718873 TSecr=1279254455 [TCP segment of a reassembled PDU]"
"587","2018-09-19 09:38:04.968681","192.168.2.3","192.168.2.1","TCP","519","8009  >  51473 [PSH, ACK] Seq=5552 Ack=1106 Win=17728 Len=453 TSval=1718873 TSecr=1279254455 [TCP segment of a reassembled PDU]"
"591","2018-09-19 09:38:09.973166","192.168.2.3","192.168.2.1","TCP","183","8009  >  51473 [PSH, ACK] Seq=6005 Ack=1223 Win=17728 Len=117 TSval=1719373 TSecr=1279259459 [TCP segment of a reassembled PDU]"
"599","2018-09-19 09:38:14.976379","192.168.2.3","192.168.2.1","TCP","183","8009  >  51473 [PSH, ACK] Seq=6122 Ack=1340 Win=17728 Len=117 TSval=1719874 TSecr=1279264459 [TCP segment of a reassembled PDU]"
"601","2018-09-19 09:38:18.156880","192.168.2.3","64.233.188.188","TCP","66","[TCP Keep-Alive] 36126  >  5228 [ACK] Seq=78 Ack=79 Win=406 Len=0 TSval=1720192 TSecr=1096066495"
"604","2018-09-19 09:38:20.142933","192.168.2.3","192.168.2.1","TCP","183","8009  >  51473 [PSH, ACK] Seq=6239 Ack=1457 Win=17728 Len=117 TSval=1720390 TSecr=1279269620 [TCP segment of a reassembled PDU]"
