"No.","Time","Source","Destination","Protocol","Length","Info"
"2","2018-09-19 09:47:44.771814","192.168.2.3","192.168.2.1","TCP","183","8009  >  51487 [PSH, ACK] Seq=1 Ack=118 Win=277 Len=117 TSval=1776853 TSecr=1279833923 [TCP segment of a reassembled PDU]"
"4","2018-09-19 09:47:45.361067","192.168.2.3","172.217.27.174","TCP","66","42645  >  443 [ACK] Seq=1 Ack=1 Win=279 Len=0 TSval=1776912 TSecr=3990230584"
"7","2018-09-19 09:47:49.907782","192.168.2.3","192.168.2.1","TCP","183","8009  >  51487 [PSH, ACK] Seq=118 Ack=235 Win=277 Len=117 TSval=1777366 TSecr=1279839059 [TCP segment of a reassembled PDU]"
"10","2018-09-19 09:47:56.715364","192.168.2.3","192.168.2.1","TCP","183","8009  >  51487 [PSH, ACK] Seq=235 Ack=352 Win=277 Len=117 TSval=1778047 TSecr=1279845846 [TCP segment of a reassembled PDU]"
"46","2018-09-19 09:48:09.919624","192.168.2.3","192.168.2.1","TCP","74","8009  >  51488 [SYN, ACK, ECN] Seq=0 Ack=1 Win=14480 Len=0 MSS=1460 SACK_PERM=1 TSval=1779367 TSecr=1279859055 WS=64"
"47","2018-09-19 09:48:09.919628","192.168.2.3","192.168.2.1","TCP","97","8009  >  51487 [PSH, ACK] Seq=352 Ack=353 Win=277 Len=31 TSval=1779367 TSecr=1279859055 [TCP segment of a reassembled PDU]"
"48","2018-09-19 09:48:09.919629","192.168.2.3","192.168.2.1","TCP","66","8009  >  51487 [FIN, ACK] Seq=383 Ack=353 Win=277 Len=0 TSval=1779367 TSecr=1279859055"
"53","2018-09-19 09:48:09.923858","192.168.2.3","192.168.2.1","TCP","66","8009  >  51488 [ACK] Seq=1 Ack=158 Win=15552 Len=0 TSval=1779367 TSecr=1279859066"
"54","2018-09-19 09:48:09.941286","192.168.2.3","192.168.2.1","AJP13","1197","AJP13 Error?"
"57","2018-09-19 09:48:09.944073","192.168.2.3","192.168.2.1","TCP","292","8009  >  51488 [PSH, ACK] Seq=1132 Ack=251 Win=15552 Len=226 TSval=1779370 TSecr=1279859087 [TCP segment of a reassembled PDU]"
"60","2018-09-19 09:48:09.954024","192.168.2.3","192.168.2.1","TCP","1514","8009  >  51488 [ACK] Seq=1358 Ack=376 Win=15552 Len=1448 TSval=1779371 TSecr=1279859089 [TCP segment of a reassembled PDU]"
"61","2018-09-19 09:48:09.959828","192.168.2.3","192.168.2.1","TCP","1514","8009  >  51488 [ACK] Seq=2806 Ack=376 Win=15552 Len=1448 TSval=1779371 TSecr=1279859089 [TCP segment of a reassembled PDU]"
"62","2018-09-19 09:48:09.959832","192.168.2.3","192.168.2.1","TCP","1247","8009  >  51488 [PSH, ACK] Seq=4254 Ack=376 Win=15552 Len=1181 TSval=1779371 TSecr=1279859089 [TCP segment of a reassembled PDU]"
"77","2018-09-19 09:48:14.968799","192.168.2.3","192.168.2.1","TCP","183","8009  >  51488 [PSH, ACK] Seq=5435 Ack=493 Win=15552 Len=117 TSval=1779872 TSecr=1279864107 [TCP segment of a reassembled PDU]"
"81","2018-09-19 09:48:14.971143","192.168.2.3","192.168.2.1","TCP","66","8009  >  51488 [ACK] Seq=5552 Ack=1106 Win=17728 Len=0 TSval=1779872 TSecr=1279864108"
"82","2018-09-19 09:48:14.974628","192.168.2.3","192.168.2.1","TCP","519","8009  >  51488 [PSH, ACK] Seq=5552 Ack=1106 Win=17728 Len=453 TSval=1779873 TSecr=1279864108 [TCP segment of a reassembled PDU]"
"84","2018-09-19 09:48:18.321367","192.168.2.3","108.177.125.188","TCP","66","42262  >  5228 [ACK] Seq=1 Ack=1 Win=406 Len=0 TSval=1780208 TSecr=497967684"
"86","2018-09-19 09:48:18.401355","192.168.2.3","64.233.188.188","TCP","66","36126  >  5228 [ACK] Seq=1 Ack=1 Win=406 Len=0 TSval=1780216 TSecr=1096666767"
"89","2018-09-19 09:48:24.985800","192.168.2.3","192.168.2.1","TCP","183","8009  >  51488 [PSH, ACK] Seq=6005 Ack=1223 Win=17728 Len=117 TSval=1780874 TSecr=1279874119 [TCP segment of a reassembled PDU]"
"105","2018-09-19 09:48:30.084866","192.168.2.3","192.168.2.1","TCP","183","8009  >  51488 [PSH, ACK] Seq=6122 Ack=1340 Win=17728 Len=117 TSval=1781383 TSecr=1279879208 [TCP segment of a reassembled PDU]"
"107","2018-09-19 09:48:30.481519","192.168.2.3","172.217.27.174","TCP","66","[TCP Dup ACK 4#1] 42645  >  443 [ACK] Seq=1 Ack=1 Win=279 Len=0 TSval=1781424 TSecr=3990275598"
"110","2018-09-19 09:48:35.091042","192.168.2.3","192.168.2.1","TCP","183","8009  >  51488 [PSH, ACK] Seq=6239 Ack=1457 Win=17728 Len=117 TSval=1781884 TSecr=1279884215 [TCP segment of a reassembled PDU]"
"115","2018-09-19 09:48:40.099395","192.168.2.3","192.168.2.1","TCP","183","8009  >  51488 [PSH, ACK] Seq=6356 Ack=1574 Win=17728 Len=117 TSval=1782385 TSecr=1279889214 [TCP segment of a reassembled PDU]"
"126","2018-09-19 09:48:55.092582","192.168.2.3","192.168.2.1","TCP","74","8009  >  51489 [SYN, ACK, ECN] Seq=0 Ack=1 Win=14480 Len=0 MSS=1460 SACK_PERM=1 TSval=1783885 TSecr=1279904208 WS=64"
"127","2018-09-19 09:48:55.092586","192.168.2.3","192.168.2.1","TCP","97","8009  >  51488 [PSH, ACK] Seq=6473 Ack=1575 Win=17728 Len=31 TSval=1783885 TSecr=1279904208 [TCP segment of a reassembled PDU]"
"130","2018-09-19 09:48:55.092712","192.168.2.3","192.168.2.1","TCP","66","8009  >  51488 [FIN, ACK] Seq=6504 Ack=1575 Win=17728 Len=0 TSval=1783885 TSecr=1279904208"
"133","2018-09-19 09:48:55.095710","192.168.2.3","192.168.2.1","TCP","66","8009  >  51489 [ACK] Seq=1 Ack=158 Win=15552 Len=0 TSval=1783885 TSecr=1279904209"
"134","2018-09-19 09:48:55.118547","192.168.2.3","192.168.2.1","AJP13","1197","AJP13 Error?"
"137","2018-09-19 09:48:55.142484","192.168.2.3","192.168.2.1","TCP","292","8009  >  51489 [PSH, ACK] Seq=1132 Ack=251 Win=15552 Len=226 TSval=1783890 TSecr=1279904234 [TCP segment of a reassembled PDU]"
"140","2018-09-19 09:48:55.149792","192.168.2.3","192.168.2.1","TCP","1514","8009  >  51489 [ACK] Seq=1358 Ack=376 Win=15552 Len=1448 TSval=1783890 TSecr=1279904257 [TCP segment of a reassembled PDU]"
"141","2018-09-19 09:48:55.149796","192.168.2.3","192.168.2.1","TCP","1514","8009  >  51489 [ACK] Seq=2806 Ack=376 Win=15552 Len=1448 TSval=1783890 TSecr=1279904257 [TCP segment of a reassembled PDU]"
"144","2018-09-19 09:48:55.150041","192.168.2.3","192.168.2.1","TCP","1247","8009  >  51489 [PSH, ACK] Seq=4254 Ack=376 Win=15552 Len=1181 TSval=1783890 TSecr=1279904257 [TCP segment of a reassembled PDU]"
"148","2018-09-19 09:49:00.153443","192.168.2.3","192.168.2.1","TCP","66","8009  >  51489 [ACK] Seq=5435 Ack=955 Win=16640 Len=0 TSval=1784391 TSecr=1279909261"
"150","2018-09-19 09:49:00.154135","192.168.2.3","192.168.2.1","TCP","183","8009  >  51489 [PSH, ACK] Seq=5435 Ack=955 Win=16640 Len=117 TSval=1784391 TSecr=1279909261 [TCP segment of a reassembled PDU]"
"152","2018-09-19 09:49:00.155999","192.168.2.3","192.168.2.1","TCP","519","8009  >  51489 [PSH, ACK] Seq=5552 Ack=1106 Win=17728 Len=453 TSval=1784391 TSecr=1279909262 [TCP segment of a reassembled PDU]"
"155","2018-09-19 09:49:03.451144","192.168.2.3","64.233.188.188","TCP","66","[TCP Dup ACK 86#1] 36126  >  5228 [ACK] Seq=1 Ack=1 Win=406 Len=0 TSval=1784720 TSecr=1096711876"
"156","2018-09-19 09:49:03.451149","192.168.2.3","108.177.125.188","TCP","66","[TCP Dup ACK 84#1] 42262  >  5228 [ACK] Seq=1 Ack=1 Win=406 Len=0 TSval=1784720 TSecr=498012804"
"172","2018-09-19 09:49:10.171615","192.168.2.3","192.168.2.1","TCP","183","8009  >  51489 [PSH, ACK] Seq=6005 Ack=1223 Win=17728 Len=117 TSval=1785392 TSecr=1279919266 [TCP segment of a reassembled PDU]"
"175","2018-09-19 09:49:15.601901","192.168.2.3","172.217.27.174","TCP","66","[TCP Dup ACK 4#2] 42645  >  443 [ACK] Seq=1 Ack=1 Win=279 Len=0 TSval=1785936 TSecr=3990320718"
"178","2018-09-19 09:49:17.003930","192.168.2.3","192.168.2.1","TCP","183","8009  >  51489 [PSH, ACK] Seq=6122 Ack=1340 Win=17728 Len=117 TSval=1786075 TSecr=1279926059 [TCP segment of a reassembled PDU]"
"182","2018-09-19 09:49:23.753145","192.168.2.3","192.168.2.1","TCP","183","8009  >  51489 [PSH, ACK] Seq=6239 Ack=1457 Win=17728 Len=117 TSval=1786751 TSecr=1279932849 [TCP segment of a reassembled PDU]"
"205","2018-09-19 09:49:33.335341","192.168.2.3","64.233.188.188","TCP","92","[TCP Previous segment not captured] 36126  >  5228 [PSH, ACK] Seq=2 Ack=1 Win=406 Len=26 TSval=1787709 TSecr=1096756926"
"207","2018-09-19 09:49:33.383734","192.168.2.3","64.233.188.188","TCP","66","36126  >  5228 [ACK] Seq=28 Ack=27 Win=406 Len=0 TSval=1787713 TSecr=1096786810"
"211","2018-09-19 09:49:33.889137","192.168.2.3","192.168.2.1","TCP","74","8009  >  51490 [SYN, ACK] Seq=0 Ack=1 Win=14480 Len=0 MSS=1460 SACK_PERM=1 TSval=1787764 TSecr=1279942979 WS=64"
"214","2018-09-19 09:49:33.892137","192.168.2.3","192.168.2.1","TCP","66","8009  >  51490 [ACK] Seq=1 Ack=158 Win=15552 Len=0 TSval=1787765 TSecr=1279942983"
"215","2018-09-19 09:49:33.913516","192.168.2.3","192.168.2.1","AJP13","1197","AJP13 Error?"
"218","2018-09-19 09:49:33.916441","192.168.2.3","192.168.2.1","TCP","292","8009  >  51490 [PSH, ACK] Seq=1132 Ack=251 Win=15552 Len=226 TSval=1787767 TSecr=1279943006 [TCP segment of a reassembled PDU]"
"221","2018-09-19 09:49:33.921109","192.168.2.3","192.168.2.1","TCP","1514","8009  >  51490 [ACK] Seq=1358 Ack=376 Win=15552 Len=1448 TSval=1787767 TSecr=1279943008 [TCP segment of a reassembled PDU]"
"222","2018-09-19 09:49:33.921426","192.168.2.3","192.168.2.1","TCP","1514","8009  >  51490 [ACK] Seq=2806 Ack=376 Win=15552 Len=1448 TSval=1787767 TSecr=1279943008 [TCP segment of a reassembled PDU]"
"223","2018-09-19 09:49:33.921430","192.168.2.3","192.168.2.1","TCP","1247","8009  >  51490 [PSH, ACK] Seq=4254 Ack=376 Win=15552 Len=1181 TSval=1787767 TSecr=1279943008 [TCP segment of a reassembled PDU]"
"227","2018-09-19 09:49:34.097779","192.168.2.3","192.168.2.1","TCP","97","8009  >  51489 [PSH, ACK] Seq=6356 Ack=1458 Win=17728 Len=31 TSval=1787785 TSecr=1279943179 [TCP segment of a reassembled PDU]"
"228","2018-09-19 09:49:34.097783","192.168.2.3","192.168.2.1","TCP","66","8009  >  51489 [FIN, ACK] Seq=6387 Ack=1458 Win=17728 Len=0 TSval=1787785 TSecr=1279943179"
"234","2018-09-19 09:49:38.846792","192.168.2.3","192.168.2.1","TCP","66","8009  >  51490 [ACK] Seq=5435 Ack=989 Win=17728 Len=0 TSval=1788260 TSecr=1279947931"
"235","2018-09-19 09:49:38.850706","192.168.2.3","192.168.2.1","TCP","519","8009  >  51490 [PSH, ACK] Seq=5435 Ack=989 Win=17728 Len=453 TSval=1788260 TSecr=1279947931 [TCP segment of a reassembled PDU]"
"237","2018-09-19 09:49:48.591236","192.168.2.3","108.177.125.188","TCP","66","[TCP Dup ACK 84#2] 42262  >  5228 [ACK] Seq=1 Ack=1 Win=406 Len=0 TSval=1789232 TSecr=498057934"
"240","2018-09-19 09:49:48.860798","192.168.2.3","192.168.2.1","TCP","183","8009  >  51490 [PSH, ACK] Seq=5888 Ack=1106 Win=17728 Len=117 TSval=1789261 TSecr=1279957940 [TCP segment of a reassembled PDU]"
"243","2018-09-19 09:49:54.904137","192.168.2.3","192.168.2.1","TCP","183","8009  >  51490 [PSH, ACK] Seq=6005 Ack=1223 Win=17728 Len=117 TSval=1789866 TSecr=1279963980 [TCP segment of a reassembled PDU]"
