"No.","Time","Source","Destination","Protocol","Length","Info"
"4","2018-09-19 10:02:06.801051","192.168.2.3","192.168.2.1","TCP","183","8009  >  51505 [PSH, ACK] Seq=1 Ack=118 Win=243 Len=117 TSval=1863054 TSecr=1280695520 [TCP segment of a reassembled PDU]"
"6","2018-09-19 10:02:06.802409","192.168.2.3","192.168.2.1","TCP","66","8009  >  51505 [ACK] Seq=118 Ack=731 Win=277 Len=0 TSval=1863055 TSecr=1280695521"
"7","2018-09-19 10:02:06.806551","192.168.2.3","192.168.2.1","TCP","519","8009  >  51505 [PSH, ACK] Seq=118 Ack=731 Win=277 Len=453 TSval=1863055 TSecr=1280695523 [TCP segment of a reassembled PDU]"
"12","2018-09-19 10:02:16.820576","192.168.2.3","192.168.2.1","TCP","183","8009  >  51505 [PSH, ACK] Seq=571 Ack=848 Win=277 Len=117 TSval=1864057 TSecr=1280705533 [TCP segment of a reassembled PDU]"
"14","2018-09-19 10:02:18.733374","192.168.2.3","64.233.188.188","TCP","66","36126  >  5228 [ACK] Seq=1 Ack=1 Win=406 Len=0 TSval=1864248 TSecr=1097507128"
"18","2018-09-19 10:02:26.699192","192.168.2.3","192.168.2.1","AJP13","183","AJP13 Error? [TCP segment of a reassembled PDU]"
"32","2018-09-19 10:02:31.705562","192.168.2.3","192.168.2.1","TCP","183","8009  >  51505 [PSH, ACK] Seq=805 Ack=1082 Win=277 Len=117 TSval=1865545 TSecr=1280720414 [TCP segment of a reassembled PDU]"
"35","2018-09-19 10:02:36.709498","192.168.2.3","192.168.2.1","TCP","183","8009  >  51505 [PSH, ACK] Seq=922 Ack=1199 Win=277 Len=117 TSval=1866045 TSecr=1280725414 [TCP segment of a reassembled PDU]"
"39","2018-09-19 10:02:45.371580","192.168.2.3","172.217.27.174","TCP","66","42650  >  443 [ACK] Seq=1 Ack=1 Win=279 Len=0 TSval=1866912 TSecr=1662034081"
"45","2018-09-19 10:02:46.177599","192.168.2.3","108.177.125.188","TCP","66","42262  >  5228 [ACK] Seq=1 Ack=1 Win=406 Len=0 TSval=1866992 TSecr=498835534"
"55","2018-09-19 10:02:51.708396","192.168.2.3","192.168.2.1","TCP","74","8009  >  51506 [SYN, ACK, ECN] Seq=0 Ack=1 Win=14480 Len=0 MSS=1460 SACK_PERM=1 TSval=1867545 TSecr=1280740409 WS=64"
"57","2018-09-19 10:02:51.708601","192.168.2.3","192.168.2.1","TCP","97","8009  >  51505 [PSH, ACK] Seq=1039 Ack=1200 Win=277 Len=31 TSval=1867545 TSecr=1280740409 [TCP segment of a reassembled PDU]"
"60","2018-09-19 10:02:51.708724","192.168.2.3","192.168.2.1","TCP","66","8009  >  51505 [FIN, ACK] Seq=1070 Ack=1200 Win=277 Len=0 TSval=1867545 TSecr=1280740409"
"62","2018-09-19 10:02:51.709998","192.168.2.3","192.168.2.1","TCP","66","8009  >  51506 [ACK] Seq=1 Ack=158 Win=15552 Len=0 TSval=1867545 TSecr=1280740411"
"63","2018-09-19 10:02:51.730810","192.168.2.3","192.168.2.1","AJP13","1197","AJP13 Error?"
"66","2018-09-19 10:02:51.734260","192.168.2.3","192.168.2.1","TCP","292","8009  >  51506 [PSH, ACK] Seq=1132 Ack=251 Win=15552 Len=226 TSval=1867548 TSecr=1280740432 [TCP segment of a reassembled PDU]"
"69","2018-09-19 10:02:51.755310","192.168.2.3","192.168.2.1","TCP","1514","8009  >  51506 [ACK] Seq=1358 Ack=376 Win=15552 Len=1448 TSval=1867548 TSecr=1280740435 [TCP segment of a reassembled PDU]"
"70","2018-09-19 10:02:51.755315","192.168.2.3","192.168.2.1","TCP","1514","8009  >  51506 [ACK] Seq=2806 Ack=376 Win=15552 Len=1448 TSval=1867548 TSecr=1280740435 [TCP segment of a reassembled PDU]"
"72","2018-09-19 10:02:51.755601","192.168.2.3","192.168.2.1","TCP","1247","8009  >  51506 [PSH, ACK] Seq=4254 Ack=376 Win=15552 Len=1181 TSval=1867548 TSecr=1280740435 [TCP segment of a reassembled PDU]"
"77","2018-09-19 10:02:56.768519","192.168.2.3","192.168.2.1","TCP","183","8009  >  51506 [PSH, ACK] Seq=5435 Ack=493 Win=15552 Len=117 TSval=1868051 TSecr=1280745462 [TCP segment of a reassembled PDU]"
"80","2018-09-19 10:02:56.774417","192.168.2.3","192.168.2.1","TCP","66","8009  >  51506 [ACK] Seq=5552 Ack=1106 Win=17728 Len=0 TSval=1868052 TSecr=1280745463"
"81","2018-09-19 10:02:56.810757","192.168.2.3","192.168.2.1","TCP","519","8009  >  51506 [PSH, ACK] Seq=5552 Ack=1106 Win=17728 Len=453 TSval=1868052 TSecr=1280745463 [TCP segment of a reassembled PDU]"
"103","2018-09-19 10:03:03.772623","192.168.2.3","64.233.188.188","TCP","66","[TCP Dup ACK 14#1] 36126  >  5228 [ACK] Seq=1 Ack=1 Win=406 Len=0 TSval=1868752 TSecr=1097552208"
"112","2018-09-19 10:03:06.821350","192.168.2.3","192.168.2.1","TCP","183","8009  >  51506 [PSH, ACK] Seq=6005 Ack=1223 Win=17728 Len=117 TSval=1869057 TSecr=1280755510 [TCP segment of a reassembled PDU]"
"120","2018-09-19 10:03:14.940578","192.168.2.3","192.168.2.1","TCP","183","8009  >  51506 [PSH, ACK] Seq=6122 Ack=1340 Win=17728 Len=117 TSval=1869867 TSecr=1280763606 [TCP segment of a reassembled PDU]"
"127","2018-09-19 10:03:24.934944","192.168.2.3","192.168.2.1","TCP","183","8009  >  51506 [PSH, ACK] Seq=6239 Ack=1457 Win=17728 Len=117 TSval=1870868 TSecr=1280773610 [TCP segment of a reassembled PDU]"
"130","2018-09-19 10:03:30.504135","192.168.2.3","172.217.27.174","TCP","66","[TCP Dup ACK 39#1] 42650  >  443 [ACK] Seq=1 Ack=1 Win=279 Len=0 TSval=1871424 TSecr=1662079139"
"145","2018-09-19 10:03:31.291513","192.168.2.3","108.177.125.188","TCP","66","[TCP Dup ACK 45#1] 42262  >  5228 [ACK] Seq=1 Ack=1 Win=406 Len=0 TSval=1871504 TSecr=498880662"
"149","2018-09-19 10:03:33.693955","192.168.2.3","64.233.188.188","TCP","92","[TCP Previous segment not captured] 36126  >  5228 [PSH, ACK] Seq=2 Ack=1 Win=406 Len=26 TSval=1871744 TSecr=1097597247"
"151","2018-09-19 10:03:33.740128","192.168.2.3","64.233.188.188","TCP","66","36126  >  5228 [ACK] Seq=28 Ack=27 Win=406 Len=0 TSval=1871748 TSecr=1097627169"
"157","2018-09-19 10:03:39.942060","192.168.2.3","192.168.2.1","TCP","183","8009  >  51506 [PSH, ACK] Seq=6356 Ack=1574 Win=17728 Len=117 TSval=1872369 TSecr=1280788613 [TCP segment of a reassembled PDU]"
"173","2018-09-19 10:03:54.945536","192.168.2.3","192.168.2.1","TCP","183","8009  >  51506 [PSH, ACK] Seq=6473 Ack=1691 Win=17728 Len=117 TSval=1873869 TSecr=1280803617 [TCP segment of a reassembled PDU]"
"180","2018-09-19 10:04:09.893698","192.168.2.3","192.168.2.1","TCP","74","8009  >  51507 [SYN, ACK, ECN] Seq=0 Ack=1 Win=14480 Len=0 MSS=1460 SACK_PERM=1 TSval=1875364 TSecr=1280818563 WS=64"
"183","2018-09-19 10:04:09.894519","192.168.2.3","192.168.2.1","TCP","183","8009  >  51506 [PSH, ACK] Seq=6590 Ack=1809 Win=17728 Len=117 TSval=1875364 TSecr=1280818563 [TCP segment of a reassembled PDU]"
"184","2018-09-19 10:04:09.894522","192.168.2.3","192.168.2.1","TCP","97","8009  >  51506 [PSH, ACK] Seq=6707 Ack=1809 Win=17728 Len=31 TSval=1875364 TSecr=1280818563 [TCP segment of a reassembled PDU]"
"187","2018-09-19 10:04:09.894742","192.168.2.3","192.168.2.1","TCP","66","8009  >  51506 [FIN, ACK] Seq=6738 Ack=1809 Win=17728 Len=0 TSval=1875364 TSecr=1280818563"
"189","2018-09-19 10:04:09.895263","192.168.2.3","192.168.2.1","TCP","66","8009  >  51507 [ACK] Seq=1 Ack=158 Win=15552 Len=0 TSval=1875364 TSecr=1280818564"
"190","2018-09-19 10:04:09.920586","192.168.2.3","192.168.2.1","AJP13","1197","AJP13 Error?"
"193","2018-09-19 10:04:09.927669","192.168.2.3","192.168.2.1","TCP","292","8009  >  51507 [PSH, ACK] Seq=1132 Ack=251 Win=15552 Len=226 TSval=1875367 TSecr=1280818590 [TCP segment of a reassembled PDU]"
"196","2018-09-19 10:04:09.931657","192.168.2.3","192.168.2.1","TCP","1514","8009  >  51507 [ACK] Seq=1358 Ack=376 Win=15552 Len=1448 TSval=1875367 TSecr=1280818597 [TCP segment of a reassembled PDU]"
"197","2018-09-19 10:04:09.931958","192.168.2.3","192.168.2.1","TCP","1514","8009  >  51507 [ACK] Seq=2806 Ack=376 Win=15552 Len=1448 TSval=1875367 TSecr=1280818597 [TCP segment of a reassembled PDU]"
"199","2018-09-19 10:04:09.932289","192.168.2.3","192.168.2.1","TCP","1247","8009  >  51507 [PSH, ACK] Seq=4254 Ack=376 Win=15552 Len=1181 TSval=1875367 TSecr=1280818597 [TCP segment of a reassembled PDU]"
"205","2018-09-19 10:04:14.968197","192.168.2.3","192.168.2.1","TCP","66","8009  >  51507 [ACK] Seq=5435 Ack=955 Win=16640 Len=0 TSval=1875871 TSecr=1280823619"
"206","2018-09-19 10:04:14.968200","192.168.2.3","192.168.2.1","TCP","183","8009  >  51507 [PSH, ACK] Seq=5435 Ack=955 Win=16640 Len=117 TSval=1875871 TSecr=1280823619 [TCP segment of a reassembled PDU]"
"208","2018-09-19 10:04:14.969252","192.168.2.3","192.168.2.1","TCP","519","8009  >  51507 [PSH, ACK] Seq=5552 Ack=1106 Win=17728 Len=453 TSval=1875871 TSecr=1280823622 [TCP segment of a reassembled PDU]"
"213","2018-09-19 10:04:15.611965","192.168.2.3","172.217.27.174","TCP","66","[TCP Dup ACK 39#2] 42650  >  443 [ACK] Seq=1 Ack=1 Win=279 Len=0 TSval=1875936 TSecr=1662124272"
"218","2018-09-19 10:04:16.411922","192.168.2.3","108.177.125.188","TCP","66","[TCP Dup ACK 45#2] 42262  >  5228 [ACK] Seq=1 Ack=1 Win=406 Len=0 TSval=1876016 TSecr=498925775"
"220","2018-09-19 10:04:18.819510","192.168.2.3","64.233.188.188","TCP","66","[TCP Keep-Alive] 36126  >  5228 [ACK] Seq=27 Ack=27 Win=406 Len=0 TSval=1876256 TSecr=1097627169"
"227","2018-09-19 10:04:24.980369","192.168.2.3","192.168.2.1","TCP","183","8009  >  51507 [PSH, ACK] Seq=6005 Ack=1223 Win=17728 Len=117 TSval=1876872 TSecr=1280833638 [TCP segment of a reassembled PDU]"
"230","2018-09-19 10:04:29.995350","192.168.2.3","192.168.2.1","TCP","183","8009  >  51507 [PSH, ACK] Seq=6122 Ack=1340 Win=17728 Len=117 TSval=1877374 TSecr=1280838650 [TCP segment of a reassembled PDU]"
"248","2018-09-19 10:04:35.014424","192.168.2.3","192.168.2.1","TCP","183","8009  >  51507 [PSH, ACK] Seq=6239 Ack=1457 Win=17728 Len=117 TSval=1877876 TSecr=1280843651 [TCP segment of a reassembled PDU]"
"252","2018-09-19 10:04:49.997988","192.168.2.3","192.168.2.1","TCP","74","8009  >  51508 [SYN, ACK, ECN] Seq=0 Ack=1 Win=14480 Len=0 MSS=1460 SACK_PERM=1 TSval=1879374 TSecr=1280858644 WS=64"
"253","2018-09-19 10:04:49.997993","192.168.2.3","192.168.2.1","TCP","97","8009  >  51507 [PSH, ACK] Seq=6356 Ack=1458 Win=17728 Len=31 TSval=1879374 TSecr=1280858644 [TCP segment of a reassembled PDU]"
"254","2018-09-19 10:04:49.997994","192.168.2.3","192.168.2.1","TCP","66","8009  >  51507 [FIN, ACK] Seq=6387 Ack=1458 Win=17728 Len=0 TSval=1879374 TSecr=1280858644"
"259","2018-09-19 10:04:50.000183","192.168.2.3","192.168.2.1","TCP","66","8009  >  51508 [ACK] Seq=1 Ack=158 Win=15552 Len=0 TSval=1879374 TSecr=1280858646"
"260","2018-09-19 10:04:50.022849","192.168.2.3","192.168.2.1","AJP13","1197","AJP13 Error?"
"263","2018-09-19 10:04:50.030038","192.168.2.3","192.168.2.1","TCP","292","8009  >  51508 [PSH, ACK] Seq=1132 Ack=251 Win=15552 Len=226 TSval=1879377 TSecr=1280858670 [TCP segment of a reassembled PDU]"
"266","2018-09-19 10:04:50.033298","192.168.2.3","192.168.2.1","TCP","1514","8009  >  51508 [ACK] Seq=1358 Ack=376 Win=15552 Len=1448 TSval=1879378 TSecr=1280858677 [TCP segment of a reassembled PDU]"
"267","2018-09-19 10:04:50.034081","192.168.2.3","192.168.2.1","TCP","1514","8009  >  51508 [ACK] Seq=2806 Ack=376 Win=15552 Len=1448 TSval=1879378 TSecr=1280858677 [TCP segment of a reassembled PDU]"
"269","2018-09-19 10:04:50.034340","192.168.2.3","192.168.2.1","TCP","1247","8009  >  51508 [PSH, ACK] Seq=4254 Ack=376 Win=15552 Len=1181 TSval=1879378 TSecr=1280858677 [TCP segment of a reassembled PDU]"
"285","2018-09-19 10:04:55.052866","192.168.2.3","192.168.2.1","TCP","183","8009  >  51508 [PSH, ACK] Seq=5435 Ack=493 Win=15552 Len=117 TSval=1879880 TSecr=1280863695 [TCP segment of a reassembled PDU]"
"288","2018-09-19 10:04:55.054834","192.168.2.3","192.168.2.1","TCP","66","8009  >  51508 [ACK] Seq=5552 Ack=1106 Win=17728 Len=0 TSval=1879880 TSecr=1280863696"
"289","2018-09-19 10:04:55.056614","192.168.2.3","192.168.2.1","TCP","519","8009  >  51508 [PSH, ACK] Seq=5552 Ack=1106 Win=17728 Len=453 TSval=1879880 TSecr=1280863696 [TCP segment of a reassembled PDU]"
"291","2018-09-19 10:05:00.732412","192.168.2.3","172.217.27.174","TCP","66","[TCP Dup ACK 39#3] 42650  >  443 [ACK] Seq=1 Ack=1 Win=279 Len=0 TSval=1880448 TSecr=1662169380"
"293","2018-09-19 10:05:01.532460","192.168.2.3","108.177.125.188","TCP","66","[TCP Dup ACK 45#3] 42262  >  5228 [ACK] Seq=1 Ack=1 Win=406 Len=0 TSval=1880528 TSecr=498970896"
