"No.","Time","Source","Destination","Protocol","Length","Info"
"1","2018-08-23 01:57:20.406377","192.168.2.3","216.58.197.4","TLSv1.2","156","Application Data"
"2","2018-08-23 01:57:20.406657","192.168.2.3","216.58.197.4","TLSv1.2","104","Application Data"
"3","2018-08-23 01:57:20.407701","192.168.2.3","216.58.197.4","TLSv1.2","158","Application Data"
"7","2018-08-23 01:57:20.419983","192.168.2.3","216.58.197.4","TCP","1434","34236  >  443 [ACK] Seq=221 Ack=1 Win=1828 Len=1368 TSval=7812255 TSecr=760015207 [TCP segment of a reassembled PDU]"
"8","2018-08-23 01:57:20.420217","192.168.2.3","216.58.197.4","TCP","1434","34236  >  443 [ACK] Seq=1589 Ack=1 Win=1828 Len=1368 TSval=7812255 TSecr=760015207 [TCP segment of a reassembled PDU]"
"9","2018-08-23 01:57:20.420431","192.168.2.3","216.58.197.4","TLSv1.2","212","Application Data"
"10","2018-08-23 01:57:20.420433","192.168.2.3","216.58.197.4","TCP","1434","34236  >  443 [ACK] Seq=3103 Ack=39 Win=1828 Len=1368 TSval=7812255 TSecr=760015207 [TCP segment of a reassembled PDU]"
"11","2018-08-23 01:57:20.420551","192.168.2.3","216.58.197.4","TLSv1.2","183","Application Data"
"12","2018-08-23 01:57:20.420799","192.168.2.3","216.58.197.4","TCP","1434","34236  >  443 [ACK] Seq=4588 Ack=39 Win=1828 Len=1368 TSval=7812255 TSecr=760015207 [TCP segment of a reassembled PDU]"
"13","2018-08-23 01:57:20.421160","192.168.2.3","216.58.197.4","TCP","1434","34236  >  443 [ACK] Seq=5956 Ack=39 Win=1828 Len=1368 TSval=7812255 TSecr=760015207 [TCP segment of a reassembled PDU]"
"14","2018-08-23 01:57:20.421162","192.168.2.3","216.58.197.4","TLSv1.2","212","Application Data"
"15","2018-08-23 01:57:20.421337","192.168.2.3","216.58.197.4","TCP","1434","34236  >  443 [ACK] Seq=7470 Ack=39 Win=1828 Len=1368 TSval=7812255 TSecr=760015207 [TCP segment of a reassembled PDU]"
"21","2018-08-23 01:57:20.426406","192.168.2.3","216.58.197.4","TLSv1.2","1434","Application Data [TCP segment of a reassembled PDU]"
"22","2018-08-23 01:57:20.426582","192.168.2.3","216.58.197.4","TCP","1434","34236  >  443 [ACK] Seq=10206 Ack=39 Win=1828 Len=1368 TSval=7812255 TSecr=760015220 [TCP segment of a reassembled PDU]"
"23","2018-08-23 01:57:20.426796","192.168.2.3","216.58.197.4","TLSv1.2","1434","Application Data [TCP segment of a reassembled PDU]"
"24","2018-08-23 01:57:20.427194","192.168.2.3","216.58.197.4","TLSv1.2","1434","Application Data [TCP segment of a reassembled PDU]"
"25","2018-08-23 01:57:20.427197","192.168.2.3","216.58.197.4","TCP","1434","34236  >  443 [ACK] Seq=14310 Ack=39 Win=1828 Len=1368 TSval=7812255 TSecr=760015221 [TCP segment of a reassembled PDU]"
"26","2018-08-23 01:57:20.427517","192.168.2.3","216.58.197.4","TLSv1.2","1434","Application Data [TCP segment of a reassembled PDU]"
"27","2018-08-23 01:57:20.427886","192.168.2.3","216.58.197.4","TLSv1.2","1434","Application Data [TCP segment of a reassembled PDU]"
"28","2018-08-23 01:57:20.427889","192.168.2.3","216.58.197.4","TCP","1434","34236  >  443 [ACK] Seq=18414 Ack=39 Win=1828 Len=1368 TSval=7812255 TSecr=760015221 [TCP segment of a reassembled PDU]"
"29","2018-08-23 01:57:20.428251","192.168.2.3","216.58.197.4","TLSv1.2","1434","Application Data [TCP segment of a reassembled PDU]"
"30","2018-08-23 01:57:20.429322","192.168.2.3","216.58.197.4","TLSv1.2","1434","Application Data [TCP segment of a reassembled PDU]"
"31","2018-08-23 01:57:20.429694","192.168.2.3","216.58.197.4","TCP","1434","34236  >  443 [ACK] Seq=22518 Ack=39 Win=1828 Len=1368 TSval=7812255 TSecr=760015221 [TCP segment of a reassembled PDU]"
"32","2018-08-23 01:57:20.429698","192.168.2.3","216.58.197.4","TLSv1.2","1434","Application Data [TCP segment of a reassembled PDU]"
"33","2018-08-23 01:57:20.429770","192.168.2.3","216.58.197.4","TLSv1.2","1434","Application Data [TCP segment of a reassembled PDU]"
"34","2018-08-23 01:57:20.430148","192.168.2.3","216.58.197.4","TCP","1434","34236  >  443 [ACK] Seq=26622 Ack=39 Win=1828 Len=1368 TSval=7812255 TSecr=760015222 [TCP segment of a reassembled PDU]"
"35","2018-08-23 01:57:20.430152","192.168.2.3","216.58.197.4","TLSv1.2","1434","Application Data [TCP segment of a reassembled PDU]"
"40","2018-08-23 01:57:20.432247","192.168.2.3","216.58.197.4","TLSv1.2","1434","Application Data [TCP segment of a reassembled PDU]"
"41","2018-08-23 01:57:20.433075","192.168.2.3","216.58.197.4","TCP","1434","34236  >  443 [ACK] Seq=30726 Ack=39 Win=1828 Len=1368 TSval=7812256 TSecr=760015227 [TCP segment of a reassembled PDU]"
"42","2018-08-23 01:57:20.433078","192.168.2.3","216.58.197.4","TCP","1434","34236  >  443 [ACK] Seq=32094 Ack=39 Win=1828 Len=1368 TSval=7812256 TSecr=760015227 [TCP segment of a reassembled PDU]"
"43","2018-08-23 01:57:20.433366","192.168.2.3","216.58.197.4","TLSv1.2","1434","Application Data [TCP segment of a reassembled PDU]"
"45","2018-08-23 01:57:20.433691","192.168.2.3","216.58.197.4","TLSv1.2","1434","Application Data [TCP segment of a reassembled PDU]"
"47","2018-08-23 01:57:20.433895","192.168.2.3","216.58.197.4","TCP","1434","34236  >  443 [ACK] Seq=36198 Ack=39 Win=1828 Len=1368 TSval=7812256 TSecr=760015227 [TCP segment of a reassembled PDU]"
"49","2018-08-23 01:57:20.434376","192.168.2.3","216.58.197.4","TLSv1.2","1434","Application Data [TCP segment of a reassembled PDU]"
"50","2018-08-23 01:57:20.434380","192.168.2.3","216.58.197.4","TLSv1.2","1434","Application Data [TCP segment of a reassembled PDU]"
"51","2018-08-23 01:57:20.434610","192.168.2.3","216.58.197.4","TCP","1434","34236  >  443 [ACK] Seq=40302 Ack=39 Win=1828 Len=1368 TSval=7812256 TSecr=760015228 [TCP segment of a reassembled PDU]"
"52","2018-08-23 01:57:20.434818","192.168.2.3","216.58.197.4","TLSv1.2","1434","Application Data [TCP segment of a reassembled PDU]"
"53","2018-08-23 01:57:20.435163","192.168.2.3","216.58.197.4","TLSv1.2","1434","Application Data [TCP segment of a reassembled PDU]"
"55","2018-08-23 01:57:20.437146","192.168.2.3","216.58.197.4","TCP","1434","34236  >  443 [ACK] Seq=44406 Ack=39 Win=1828 Len=1368 TSval=7812256 TSecr=760015230 [TCP segment of a reassembled PDU]"
"57","2018-08-23 01:57:20.437331","192.168.2.3","216.58.197.4","TLSv1.2","1434","Application Data [TCP segment of a reassembled PDU]"
"58","2018-08-23 01:57:20.437552","192.168.2.3","216.58.197.4","TLSv1.2","1434","Application Data [TCP segment of a reassembled PDU]"
"64","2018-08-23 01:57:20.443137","192.168.2.3","216.58.197.4","TCP","1434","34236  >  443 [PSH, ACK] Seq=48510 Ack=39 Win=1828 Len=1368 TSval=7812256 TSecr=760015230 [TCP segment of a reassembled PDU]"
"65","2018-08-23 01:57:20.443140","192.168.2.3","216.58.197.4","TLSv1.2","1434","Application Data [TCP segment of a reassembled PDU]"
"66","2018-08-23 01:57:20.443452","192.168.2.3","216.58.197.4","TLSv1.2","1434","Application Data [TCP segment of a reassembled PDU]"
"67","2018-08-23 01:57:20.443455","192.168.2.3","216.58.197.4","TCP","1434","34236  >  443 [ACK] Seq=52614 Ack=39 Win=1828 Len=1368 TSval=7812256 TSecr=760015230 [TCP segment of a reassembled PDU]"
"68","2018-08-23 01:57:20.443664","192.168.2.3","216.58.197.4","TLSv1.2","1434","Application Data [TCP segment of a reassembled PDU]"
"69","2018-08-23 01:57:20.443985","192.168.2.3","216.58.197.4","TLSv1.2","1434","Application Data [TCP segment of a reassembled PDU]"
"70","2018-08-23 01:57:20.443987","192.168.2.3","216.58.197.4","TCP","1434","34236  >  443 [ACK] Seq=56718 Ack=39 Win=1828 Len=1368 TSval=7812257 TSecr=760015232 [TCP segment of a reassembled PDU]"
"71","2018-08-23 01:57:20.444467","192.168.2.3","216.58.197.4","TCP","1434","34236  >  443 [ACK] Seq=58086 Ack=39 Win=1828 Len=1368 TSval=7812257 TSecr=760015233 [TCP segment of a reassembled PDU]"
"72","2018-08-23 01:57:20.444470","192.168.2.3","216.58.197.4","TLSv1.2","1434","Application Data [TCP segment of a reassembled PDU]"
"73","2018-08-23 01:57:20.444847","192.168.2.3","216.58.197.4","TLSv1.2","1285","Application Data"
"79","2018-08-23 01:57:20.482868","192.168.2.3","216.58.197.4","TCP","1434","34236  >  443 [ACK] Seq=62041 Ack=39 Win=1828 Len=1368 TSval=7812261 TSecr=760015245 [TCP segment of a reassembled PDU]"
"80","2018-08-23 01:57:20.482887","192.168.2.3","216.58.197.4","TCP","1434","34236  >  443 [ACK] Seq=63409 Ack=39 Win=1828 Len=1368 TSval=7812261 TSecr=760015245 [TCP segment of a reassembled PDU]"
"81","2018-08-23 01:57:20.482987","192.168.2.3","216.58.197.4","TLSv1.2","212","Application Data"
"82","2018-08-23 01:57:20.483273","192.168.2.3","216.58.197.4","TCP","1434","34236  >  443 [ACK] Seq=64923 Ack=39 Win=1828 Len=1368 TSval=7812261 TSecr=760015245 [TCP segment of a reassembled PDU]"
"83","2018-08-23 01:57:20.483276","192.168.2.3","216.58.197.4","TLSv1.2","155","Application Data"
"87","2018-08-23 01:57:20.574942","192.168.2.3","216.58.197.4","TCP","1434","34236  >  443 [ACK] Seq=66380 Ack=39 Win=1828 Len=1368 TSval=7812270 TSecr=760015284 [TCP segment of a reassembled PDU]"
"88","2018-08-23 01:57:20.574947","192.168.2.3","216.58.197.4","TCP","1434","34236  >  443 [ACK] Seq=67748 Ack=39 Win=1828 Len=1368 TSval=7812270 TSecr=760015284 [TCP segment of a reassembled PDU]"
"89","2018-08-23 01:57:20.574948","192.168.2.3","216.58.197.4","TLSv1.2","212","Application Data"
"90","2018-08-23 01:57:20.575212","192.168.2.3","216.58.197.4","TCP","1434","34236  >  443 [ACK] Seq=69262 Ack=39 Win=1828 Len=1368 TSval=7812270 TSecr=760015284 [TCP segment of a reassembled PDU]"
"91","2018-08-23 01:57:20.575215","192.168.2.3","216.58.197.4","TLSv1.2","155","Application Data"
"95","2018-08-23 01:57:20.670751","192.168.2.3","216.58.197.4","TCP","1434","34236  >  443 [ACK] Seq=70719 Ack=39 Win=1828 Len=1368 TSval=7812280 TSecr=760015416 [TCP segment of a reassembled PDU]"
"96","2018-08-23 01:57:20.671190","192.168.2.3","216.58.197.4","TCP","1434","34236  >  443 [ACK] Seq=72087 Ack=39 Win=1828 Len=1368 TSval=7812280 TSecr=760015416 [TCP segment of a reassembled PDU]"
"97","2018-08-23 01:57:20.671195","192.168.2.3","216.58.197.4","TLSv1.2","212","Application Data"
"98","2018-08-23 01:57:20.671196","192.168.2.3","216.58.197.4","TCP","1434","34236  >  443 [ACK] Seq=73601 Ack=39 Win=1828 Len=1368 TSval=7812280 TSecr=760015416 [TCP segment of a reassembled PDU]"
"99","2018-08-23 01:57:20.671197","192.168.2.3","216.58.197.4","TLSv1.2","155","Application Data"
"106","2018-08-23 01:57:20.731894","192.168.2.3","216.58.197.4","TCP","66","34236  >  443 [ACK] Seq=75058 Ack=375 Win=1828 Len=0 TSval=7812286 TSecr=760015526"
"108","2018-08-23 01:57:20.740546","192.168.2.3","216.58.197.4","TCP","66","34236  >  443 [ACK] Seq=75058 Ack=821 Win=1828 Len=0 TSval=7812287 TSecr=760015527"
"109","2018-08-23 01:57:20.785164","192.168.2.3","216.58.197.4","TCP","1434","34236  >  443 [ACK] Seq=75058 Ack=821 Win=1828 Len=1368 TSval=7812291 TSecr=760015527 [TCP segment of a reassembled PDU]"
"110","2018-08-23 01:57:20.785593","192.168.2.3","216.58.197.4","TCP","1434","34236  >  443 [ACK] Seq=76426 Ack=821 Win=1828 Len=1368 TSval=7812291 TSecr=760015527 [TCP segment of a reassembled PDU]"
"111","2018-08-23 01:57:20.785597","192.168.2.3","216.58.197.4","TLSv1.2","212","Application Data"
"112","2018-08-23 01:57:20.785974","192.168.2.3","216.58.197.4","TCP","1434","34236  >  443 [ACK] Seq=77940 Ack=821 Win=1828 Len=1368 TSval=7812291 TSecr=760015527 [TCP segment of a reassembled PDU]"
"113","2018-08-23 01:57:20.785977","192.168.2.3","216.58.197.4","TLSv1.2","155","Application Data"
"118","2018-08-23 01:57:20.868737","192.168.2.3","216.58.197.4","TCP","66","34236  >  443 [ACK] Seq=79397 Ack=1114 Win=1828 Len=0 TSval=7812300 TSecr=760015630"
"119","2018-08-23 01:57:20.883653","192.168.2.3","216.58.197.4","TCP","1434","34236  >  443 [ACK] Seq=79397 Ack=1114 Win=1828 Len=1368 TSval=7812301 TSecr=760015630 [TCP segment of a reassembled PDU]"
"120","2018-08-23 01:57:20.883659","192.168.2.3","216.58.197.4","TCP","1434","34236  >  443 [ACK] Seq=80765 Ack=1114 Win=1828 Len=1368 TSval=7812301 TSecr=760015630 [TCP segment of a reassembled PDU]"
"121","2018-08-23 01:57:20.883660","192.168.2.3","216.58.197.4","TLSv1.2","212","Application Data"
"122","2018-08-23 01:57:20.883952","192.168.2.3","216.58.197.4","TCP","1434","34236  >  443 [ACK] Seq=82279 Ack=1114 Win=1828 Len=1368 TSval=7812301 TSecr=760015630 [TCP segment of a reassembled PDU]"
"123","2018-08-23 01:57:20.883956","192.168.2.3","216.58.197.4","TLSv1.2","155","Application Data"
"127","2018-08-23 01:57:20.977122","192.168.2.3","216.58.197.4","TCP","1434","34236  >  443 [ACK] Seq=83736 Ack=1114 Win=1828 Len=1368 TSval=7812310 TSecr=760015684 [TCP segment of a reassembled PDU]"
"128","2018-08-23 01:57:20.977540","192.168.2.3","216.58.197.4","TCP","1434","34236  >  443 [ACK] Seq=85104 Ack=1114 Win=1828 Len=1368 TSval=7812310 TSecr=760015684 [TCP segment of a reassembled PDU]"
"129","2018-08-23 01:57:20.977543","192.168.2.3","216.58.197.4","TLSv1.2","212","Application Data"
"130","2018-08-23 01:57:20.977544","192.168.2.3","216.58.197.4","TCP","1434","34236  >  443 [ACK] Seq=86618 Ack=1114 Win=1828 Len=1368 TSval=7812310 TSecr=760015684 [TCP segment of a reassembled PDU]"
"131","2018-08-23 01:57:20.977918","192.168.2.3","216.58.197.4","TLSv1.2","155","Application Data"
"135","2018-08-23 01:57:20.998953","192.168.2.3","216.58.197.4","TCP","66","34236  >  443 [ACK] Seq=88075 Ack=1399 Win=1828 Len=0 TSval=7812313 TSecr=760015794"
"136","2018-08-23 01:57:21.075034","192.168.2.3","216.58.197.4","TCP","1434","34236  >  443 [ACK] Seq=88075 Ack=1399 Win=1828 Len=1368 TSval=7812320 TSecr=760015794 [TCP segment of a reassembled PDU]"
"137","2018-08-23 01:57:21.075340","192.168.2.3","216.58.197.4","TCP","1434","34236  >  443 [ACK] Seq=89443 Ack=1399 Win=1828 Len=1368 TSval=7812320 TSecr=760015794 [TCP segment of a reassembled PDU]"
"138","2018-08-23 01:57:21.075343","192.168.2.3","216.58.197.4","TLSv1.2","212","Application Data"
"139","2018-08-23 01:57:21.075806","192.168.2.3","216.58.197.4","TCP","1434","34236  >  443 [ACK] Seq=90957 Ack=1399 Win=1828 Len=1368 TSval=7812320 TSecr=760015794 [TCP segment of a reassembled PDU]"
"140","2018-08-23 01:57:21.075808","192.168.2.3","216.58.197.4","TLSv1.2","155","Application Data"
"144","2018-08-23 01:57:21.172730","192.168.2.3","216.58.197.4","TCP","1434","34236  >  443 [ACK] Seq=92414 Ack=1399 Win=1828 Len=1368 TSval=7812330 TSecr=760015917 [TCP segment of a reassembled PDU]"
"145","2018-08-23 01:57:21.172738","192.168.2.3","216.58.197.4","TCP","1434","34236  >  443 [ACK] Seq=93782 Ack=1399 Win=1828 Len=1368 TSval=7812330 TSecr=760015917 [TCP segment of a reassembled PDU]"
"146","2018-08-23 01:57:21.172739","192.168.2.3","216.58.197.4","TLSv1.2","212","Application Data"
"147","2018-08-23 01:57:21.172874","192.168.2.3","216.58.197.4","TCP","1434","34236  >  443 [ACK] Seq=95296 Ack=1399 Win=1828 Len=1368 TSval=7812330 TSecr=760015917 [TCP segment of a reassembled PDU]"
"148","2018-08-23 01:57:21.173126","192.168.2.3","216.58.197.4","TLSv1.2","155","Application Data"
"152","2018-08-23 01:57:21.247955","192.168.2.3","216.58.197.4","TCP","1434","34236  >  443 [ACK] Seq=96753 Ack=1399 Win=1828 Len=1368 TSval=7812338 TSecr=760015973 [TCP segment of a reassembled PDU]"
"153","2018-08-23 01:57:21.248357","192.168.2.3","216.58.197.4","TCP","1434","34236  >  443 [ACK] Seq=98121 Ack=1399 Win=1828 Len=1368 TSval=7812338 TSecr=760015973 [TCP segment of a reassembled PDU]"
"154","2018-08-23 01:57:21.248360","192.168.2.3","216.58.197.4","TLSv1.2","212","Application Data"
"155","2018-08-23 01:57:21.250548","192.168.2.3","216.58.197.4","TCP","1434","34236  >  443 [ACK] Seq=99635 Ack=1399 Win=1828 Len=1368 TSval=7812338 TSecr=760015973 [TCP segment of a reassembled PDU]"
"156","2018-08-23 01:57:21.250553","192.168.2.3","216.58.197.4","TLSv1.2","155","Application Data"
"160","2018-08-23 01:57:21.331881","192.168.2.3","216.58.197.4","TCP","1434","34236  >  443 [ACK] Seq=101092 Ack=1399 Win=1828 Len=1368 TSval=7812346 TSecr=760016051 [TCP segment of a reassembled PDU]"
"161","2018-08-23 01:57:21.336966","192.168.2.3","216.58.197.4","TCP","1434","34236  >  443 [ACK] Seq=102460 Ack=1399 Win=1828 Len=1368 TSval=7812346 TSecr=760016051 [TCP segment of a reassembled PDU]"
"162","2018-08-23 01:57:21.336973","192.168.2.3","216.58.197.4","TLSv1.2","212","Application Data"
"163","2018-08-23 01:57:21.336974","192.168.2.3","216.58.197.4","TCP","1434","34236  >  443 [ACK] Seq=103974 Ack=1399 Win=1828 Len=1368 TSval=7812346 TSecr=760016051 [TCP segment of a reassembled PDU]"
"164","2018-08-23 01:57:21.336975","192.168.2.3","216.58.197.4","TLSv1.2","155","Application Data"
"167","2018-08-23 01:57:21.427938","192.168.2.3","216.58.197.4","TCP","1434","34236  >  443 [ACK] Seq=105431 Ack=1399 Win=1828 Len=1368 TSval=7812355 TSecr=760016137 [TCP segment of a reassembled PDU]"
"168","2018-08-23 01:57:21.428178","192.168.2.3","216.58.197.4","TCP","1434","34236  >  443 [ACK] Seq=106799 Ack=1399 Win=1828 Len=1368 TSval=7812355 TSecr=760016137 [TCP segment of a reassembled PDU]"
"169","2018-08-23 01:57:21.428181","192.168.2.3","216.58.197.4","TLSv1.2","212","Application Data"
"170","2018-08-23 01:57:21.428680","192.168.2.3","216.58.197.4","TCP","1434","34236  >  443 [ACK] Seq=108313 Ack=1399 Win=1828 Len=1368 TSval=7812356 TSecr=760016137 [TCP segment of a reassembled PDU]"
"171","2018-08-23 01:57:21.428683","192.168.2.3","216.58.197.4","TLSv1.2","155","Application Data"
"175","2018-08-23 01:57:21.524217","192.168.2.3","216.58.197.4","TCP","1434","34236  >  443 [ACK] Seq=109770 Ack=1399 Win=1828 Len=1368 TSval=7812365 TSecr=760016229 [TCP segment of a reassembled PDU]"
"176","2018-08-23 01:57:21.524452","192.168.2.3","216.58.197.4","TCP","1434","34236  >  443 [ACK] Seq=111138 Ack=1399 Win=1828 Len=1368 TSval=7812365 TSecr=760016229 [TCP segment of a reassembled PDU]"
"177","2018-08-23 01:57:21.524455","192.168.2.3","216.58.197.4","TLSv1.2","212","Application Data"
"178","2018-08-23 01:57:21.524456","192.168.2.3","216.58.197.4","TCP","1434","34236  >  443 [ACK] Seq=112652 Ack=1399 Win=1828 Len=1368 TSval=7812365 TSecr=760016229 [TCP segment of a reassembled PDU]"
"179","2018-08-23 01:57:21.524615","192.168.2.3","216.58.197.4","TLSv1.2","155","Application Data"
"185","2018-08-23 01:57:21.590440","192.168.2.3","216.58.197.4","TCP","66","34236  >  443 [ACK] Seq=114109 Ack=1694 Win=1828 Len=0 TSval=7812372 TSecr=760016382"
"186","2018-08-23 01:57:21.590444","192.168.2.3","216.58.197.4","TCP","66","34236  >  443 [ACK] Seq=114109 Ack=1984 Win=1828 Len=0 TSval=7812372 TSecr=760016382"
"187","2018-08-23 01:57:21.620412","192.168.2.3","216.58.197.4","TCP","1434","34236  >  443 [ACK] Seq=114109 Ack=1984 Win=1828 Len=1368 TSval=7812375 TSecr=760016382 [TCP segment of a reassembled PDU]"
"188","2018-08-23 01:57:21.620686","192.168.2.3","216.58.197.4","TCP","1434","34236  >  443 [ACK] Seq=115477 Ack=1984 Win=1828 Len=1368 TSval=7812375 TSecr=760016382 [TCP segment of a reassembled PDU]"
"189","2018-08-23 01:57:21.620688","192.168.2.3","216.58.197.4","TLSv1.2","212","Application Data"
"190","2018-08-23 01:57:21.620892","192.168.2.3","216.58.197.4","TCP","1434","34236  >  443 [ACK] Seq=116991 Ack=1984 Win=1828 Len=1368 TSval=7812375 TSecr=760016382 [TCP segment of a reassembled PDU]"
"191","2018-08-23 01:57:21.620895","192.168.2.3","216.58.197.4","TLSv1.2","155","Application Data"
"195","2018-08-23 01:57:21.694494","192.168.2.3","216.58.197.4","TCP","1434","34236  >  443 [ACK] Seq=118448 Ack=1984 Win=1828 Len=1368 TSval=7812382 TSecr=760016421 [TCP segment of a reassembled PDU]"
"196","2018-08-23 01:57:21.696236","192.168.2.3","216.58.197.4","TCP","1434","34236  >  443 [ACK] Seq=119816 Ack=1984 Win=1828 Len=1368 TSval=7812382 TSecr=760016421 [TCP segment of a reassembled PDU]"
"197","2018-08-23 01:57:21.696241","192.168.2.3","216.58.197.4","TLSv1.2","212","Application Data"
"198","2018-08-23 01:57:21.696558","192.168.2.3","216.58.197.4","TCP","1434","34236  >  443 [ACK] Seq=121330 Ack=1984 Win=1828 Len=1368 TSval=7812382 TSecr=760016421 [TCP segment of a reassembled PDU]"
"199","2018-08-23 01:57:21.696562","192.168.2.3","216.58.197.4","TLSv1.2","155","Application Data"
"205","2018-08-23 01:57:21.741591","192.168.2.3","216.58.197.4","TCP","66","34236  >  443 [ACK] Seq=122787 Ack=2214 Win=1828 Len=0 TSval=7812387 TSecr=760016527"
"208","2018-08-23 01:57:21.751135","192.168.2.3","216.58.197.4","TCP","66","34236  >  443 [ACK] Seq=122787 Ack=2526 Win=1828 Len=0 TSval=7812388 TSecr=760016546"
"209","2018-08-23 01:57:21.792357","192.168.2.3","216.58.197.4","TCP","1434","34236  >  443 [ACK] Seq=122787 Ack=2526 Win=1828 Len=1368 TSval=7812392 TSecr=760016546 [TCP segment of a reassembled PDU]"
"210","2018-08-23 01:57:21.792815","192.168.2.3","216.58.197.4","TCP","1434","34236  >  443 [ACK] Seq=124155 Ack=2526 Win=1828 Len=1368 TSval=7812392 TSecr=760016546 [TCP segment of a reassembled PDU]"
"211","2018-08-23 01:57:21.792819","192.168.2.3","216.58.197.4","TLSv1.2","212","Application Data"
"212","2018-08-23 01:57:21.792820","192.168.2.3","216.58.197.4","TCP","1434","34236  >  443 [ACK] Seq=125669 Ack=2526 Win=1828 Len=1368 TSval=7812392 TSecr=760016546 [TCP segment of a reassembled PDU]"
"213","2018-08-23 01:57:21.792957","192.168.2.3","216.58.197.4","TLSv1.2","155","Application Data"
"217","2018-08-23 01:57:21.889519","192.168.2.3","216.58.197.4","TCP","1434","34236  >  443 [ACK] Seq=127126 Ack=2526 Win=1828 Len=1368 TSval=7812402 TSecr=760016633 [TCP segment of a reassembled PDU]"
"218","2018-08-23 01:57:21.889524","192.168.2.3","216.58.197.4","TCP","1434","34236  >  443 [ACK] Seq=128494 Ack=2526 Win=1828 Len=1368 TSval=7812402 TSecr=760016633 [TCP segment of a reassembled PDU]"
"219","2018-08-23 01:57:21.889708","192.168.2.3","216.58.197.4","TLSv1.2","212","Application Data"
"220","2018-08-23 01:57:21.889710","192.168.2.3","216.58.197.4","TCP","1434","34236  >  443 [ACK] Seq=130008 Ack=2526 Win=1828 Len=1368 TSval=7812402 TSecr=760016633 [TCP segment of a reassembled PDU]"
"221","2018-08-23 01:57:21.889900","192.168.2.3","216.58.197.4","TLSv1.2","155","Application Data"
"225","2018-08-23 01:57:21.972201","192.168.2.3","216.58.197.4","TCP","1434","34236  >  443 [ACK] Seq=131465 Ack=2526 Win=1828 Len=1368 TSval=7812410 TSecr=760016690 [TCP segment of a reassembled PDU]"
"226","2018-08-23 01:57:21.972457","192.168.2.3","216.58.197.4","TCP","1434","34236  >  443 [ACK] Seq=132833 Ack=2526 Win=1828 Len=1368 TSval=7812410 TSecr=760016690 [TCP segment of a reassembled PDU]"
"227","2018-08-23 01:57:21.972460","192.168.2.3","216.58.197.4","TLSv1.2","212","Application Data"
"228","2018-08-23 01:57:21.972461","192.168.2.3","216.58.197.4","TCP","1434","34236  >  443 [ACK] Seq=134347 Ack=2526 Win=1828 Len=1368 TSval=7812410 TSecr=760016690 [TCP segment of a reassembled PDU]"
"229","2018-08-23 01:57:21.972619","192.168.2.3","216.58.197.4","TLSv1.2","155","Application Data"
"235","2018-08-23 01:57:22.029776","192.168.2.3","216.58.197.4","TCP","66","34236  >  443 [ACK] Seq=135804 Ack=3051 Win=1828 Len=0 TSval=7812416 TSecr=760016821"
"238","2018-08-23 01:57:22.035476","192.168.2.3","216.58.197.4","TCP","66","34236  >  443 [ACK] Seq=135804 Ack=3439 Win=1828 Len=0 TSval=7812416 TSecr=760016830"
"239","2018-08-23 01:57:22.067862","192.168.2.3","216.58.197.4","TCP","1434","34236  >  443 [ACK] Seq=135804 Ack=3439 Win=1828 Len=1368 TSval=7812419 TSecr=760016830 [TCP segment of a reassembled PDU]"
"240","2018-08-23 01:57:22.068182","192.168.2.3","216.58.197.4","TCP","1434","34236  >  443 [ACK] Seq=137172 Ack=3439 Win=1828 Len=1368 TSval=7812419 TSecr=760016830 [TCP segment of a reassembled PDU]"
"241","2018-08-23 01:57:22.068190","192.168.2.3","216.58.197.4","TLSv1.2","212","Application Data"
"242","2018-08-23 01:57:22.068506","192.168.2.3","216.58.197.4","TCP","1434","34236  >  443 [ACK] Seq=138686 Ack=3439 Win=1828 Len=1368 TSval=7812420 TSecr=760016830 [TCP segment of a reassembled PDU]"
"243","2018-08-23 01:57:22.068509","192.168.2.3","216.58.197.4","TLSv1.2","155","Application Data"
"247","2018-08-23 01:57:22.163092","192.168.2.3","216.58.197.4","TCP","1434","34236  >  443 [ACK] Seq=140143 Ack=3439 Win=1828 Len=1368 TSval=7812429 TSecr=760016869 [TCP segment of a reassembled PDU]"
"248","2018-08-23 01:57:22.163449","192.168.2.3","216.58.197.4","TCP","1434","34236  >  443 [ACK] Seq=141511 Ack=3439 Win=1828 Len=1368 TSval=7812429 TSecr=760016869 [TCP segment of a reassembled PDU]"
"249","2018-08-23 01:57:22.163451","192.168.2.3","216.58.197.4","TLSv1.2","212","Application Data"
"250","2018-08-23 01:57:22.163452","192.168.2.3","216.58.197.4","TCP","1434","34236  >  443 [ACK] Seq=143025 Ack=3439 Win=1828 Len=1368 TSval=7812429 TSecr=760016869 [TCP segment of a reassembled PDU]"
"251","2018-08-23 01:57:22.163683","192.168.2.3","216.58.197.4","TLSv1.2","155","Application Data"
"255","2018-08-23 01:57:22.259578","192.168.2.3","216.58.197.4","TCP","1434","34236  >  443 [ACK] Seq=144482 Ack=3439 Win=1828 Len=1368 TSval=7812438 TSecr=760016964 [TCP segment of a reassembled PDU]"
"256","2018-08-23 01:57:22.259583","192.168.2.3","216.58.197.4","TCP","1434","34236  >  443 [ACK] Seq=145850 Ack=3439 Win=1828 Len=1368 TSval=7812438 TSecr=760016964 [TCP segment of a reassembled PDU]"
"257","2018-08-23 01:57:22.259584","192.168.2.3","216.58.197.4","TLSv1.2","212","Application Data"
"258","2018-08-23 01:57:22.259962","192.168.2.3","216.58.197.4","TCP","1434","34236  >  443 [ACK] Seq=147364 Ack=3439 Win=1828 Len=1368 TSval=7812438 TSecr=760016964 [TCP segment of a reassembled PDU]"
"259","2018-08-23 01:57:22.259966","192.168.2.3","216.58.197.4","TLSv1.2","155","Application Data"
"264","2018-08-23 01:57:22.317952","192.168.2.3","216.58.197.4","TCP","66","34236  >  443 [ACK] Seq=148821 Ack=3700 Win=1828 Len=0 TSval=7812444 TSecr=760017110"
"265","2018-08-23 01:57:22.336193","192.168.2.3","216.58.197.4","TCP","1434","34236  >  443 [ACK] Seq=148821 Ack=3700 Win=1828 Len=1368 TSval=7812446 TSecr=760017110 [TCP segment of a reassembled PDU]"
"266","2018-08-23 01:57:22.336478","192.168.2.3","216.58.197.4","TCP","1434","34236  >  443 [ACK] Seq=150189 Ack=3700 Win=1828 Len=1368 TSval=7812446 TSecr=760017110 [TCP segment of a reassembled PDU]"
"267","2018-08-23 01:57:22.336484","192.168.2.3","216.58.197.4","TLSv1.2","212","Application Data"
"268","2018-08-23 01:57:22.336910","192.168.2.3","216.58.197.4","TCP","1434","34236  >  443 [ACK] Seq=151703 Ack=3700 Win=1828 Len=1368 TSval=7812446 TSecr=760017110 [TCP segment of a reassembled PDU]"
"269","2018-08-23 01:57:22.336917","192.168.2.3","216.58.197.4","TLSv1.2","155","Application Data"
"272","2018-08-23 01:57:22.432329","192.168.2.3","216.58.197.4","TCP","1434","34236  >  443 [ACK] Seq=153160 Ack=3700 Win=1828 Len=1368 TSval=7812456 TSecr=760017137 [TCP segment of a reassembled PDU]"
"273","2018-08-23 01:57:22.432677","192.168.2.3","216.58.197.4","TCP","1434","34236  >  443 [ACK] Seq=154528 Ack=3700 Win=1828 Len=1368 TSval=7812456 TSecr=760017137 [TCP segment of a reassembled PDU]"
"274","2018-08-23 01:57:22.432681","192.168.2.3","216.58.197.4","TLSv1.2","212","Application Data"
"275","2018-08-23 01:57:22.433151","192.168.2.3","216.58.197.4","TCP","1434","34236  >  443 [ACK] Seq=156042 Ack=3700 Win=1828 Len=1368 TSval=7812456 TSecr=760017137 [TCP segment of a reassembled PDU]"
"276","2018-08-23 01:57:22.433154","192.168.2.3","216.58.197.4","TLSv1.2","155","Application Data"
"282","2018-08-23 01:57:22.495135","192.168.2.3","216.58.197.4","TCP","66","34236  >  443 [ACK] Seq=157499 Ack=4041 Win=1828 Len=0 TSval=7812462 TSecr=760017282"
"283","2018-08-23 01:57:22.516411","192.168.2.3","216.58.197.4","TCP","1434","34236  >  443 [ACK] Seq=157499 Ack=4041 Win=1828 Len=1368 TSval=7812464 TSecr=760017282 [TCP segment of a reassembled PDU]"
"284","2018-08-23 01:57:22.516733","192.168.2.3","216.58.197.4","TCP","1434","34236  >  443 [ACK] Seq=158867 Ack=4041 Win=1828 Len=1368 TSval=7812464 TSecr=760017282 [TCP segment of a reassembled PDU]"
"285","2018-08-23 01:57:22.516735","192.168.2.3","216.58.197.4","TLSv1.2","212","Application Data"
"286","2018-08-23 01:57:22.516736","192.168.2.3","216.58.197.4","TCP","1434","34236  >  443 [ACK] Seq=160381 Ack=4041 Win=1828 Len=1368 TSval=7812464 TSecr=760017282 [TCP segment of a reassembled PDU]"
"287","2018-08-23 01:57:22.516737","192.168.2.3","216.58.197.4","TLSv1.2","155","Application Data"
"291","2018-08-23 01:57:22.611159","192.168.2.3","216.58.197.4","TCP","1434","34236  >  443 [ACK] Seq=161838 Ack=4041 Win=1828 Len=1368 TSval=7812474 TSecr=760017317 [TCP segment of a reassembled PDU]"
"292","2018-08-23 01:57:22.611532","192.168.2.3","216.58.197.4","TCP","1434","34236  >  443 [ACK] Seq=163206 Ack=4041 Win=1828 Len=1368 TSval=7812474 TSecr=760017317 [TCP segment of a reassembled PDU]"
"293","2018-08-23 01:57:22.611535","192.168.2.3","216.58.197.4","TLSv1.2","212","Application Data"
"294","2018-08-23 01:57:22.611634","192.168.2.3","216.58.197.4","TCP","1434","34236  >  443 [ACK] Seq=164720 Ack=4041 Win=1828 Len=1368 TSval=7812474 TSecr=760017317 [TCP segment of a reassembled PDU]"
"295","2018-08-23 01:57:22.611648","192.168.2.3","216.58.197.4","TLSv1.2","155","Application Data"
"301","2018-08-23 01:57:22.682116","192.168.2.3","216.58.197.4","TCP","66","34236  >  443 [ACK] Seq=166177 Ack=4402 Win=1828 Len=0 TSval=7812481 TSecr=760017461"
"302","2018-08-23 01:57:22.708760","192.168.2.3","216.58.197.4","TCP","1434","34236  >  443 [ACK] Seq=166177 Ack=4402 Win=1828 Len=1368 TSval=7812484 TSecr=760017461 [TCP segment of a reassembled PDU]"
"303","2018-08-23 01:57:22.708766","192.168.2.3","216.58.197.4","TCP","1434","34236  >  443 [ACK] Seq=167545 Ack=4402 Win=1828 Len=1368 TSval=7812484 TSecr=760017461 [TCP segment of a reassembled PDU]"
"304","2018-08-23 01:57:22.708767","192.168.2.3","216.58.197.4","TLSv1.2","212","Application Data"
"305","2018-08-23 01:57:22.709037","192.168.2.3","216.58.197.4","TCP","1434","34236  >  443 [ACK] Seq=169059 Ack=4402 Win=1828 Len=1368 TSval=7812484 TSecr=760017461 [TCP segment of a reassembled PDU]"
"306","2018-08-23 01:57:22.709041","192.168.2.3","216.58.197.4","TLSv1.2","155","Application Data"
"312","2018-08-23 01:57:22.740744","192.168.2.3","216.58.197.4","TCP","66","34236  >  443 [ACK] Seq=170516 Ack=4787 Win=1828 Len=0 TSval=7812487 TSecr=760017527"
"313","2018-08-23 01:57:22.803927","192.168.2.3","216.58.197.4","TCP","1434","34236  >  443 [ACK] Seq=170516 Ack=4787 Win=1828 Len=1368 TSval=7812493 TSecr=760017527 [TCP segment of a reassembled PDU]"
"314","2018-08-23 01:57:22.804485","192.168.2.3","216.58.197.4","TCP","1434","34236  >  443 [ACK] Seq=171884 Ack=4787 Win=1828 Len=1368 TSval=7812493 TSecr=760017527 [TCP segment of a reassembled PDU]"
"315","2018-08-23 01:57:22.804489","192.168.2.3","216.58.197.4","TLSv1.2","212","Application Data"
"316","2018-08-23 01:57:22.804697","192.168.2.3","216.58.197.4","TCP","1434","34236  >  443 [ACK] Seq=173398 Ack=4787 Win=1828 Len=1368 TSval=7812493 TSecr=760017527 [TCP segment of a reassembled PDU]"
"317","2018-08-23 01:57:22.804700","192.168.2.3","216.58.197.4","TLSv1.2","155","Application Data"
"321","2018-08-23 01:57:22.913590","192.168.2.3","216.58.197.4","TCP","1434","34236  >  443 [ACK] Seq=174855 Ack=4787 Win=1828 Len=1368 TSval=7812504 TSecr=760017645 [TCP segment of a reassembled PDU]"
"322","2018-08-23 01:57:22.913596","192.168.2.3","216.58.197.4","TCP","1434","34236  >  443 [ACK] Seq=176223 Ack=4787 Win=1828 Len=1368 TSval=7812504 TSecr=760017645 [TCP segment of a reassembled PDU]"
"323","2018-08-23 01:57:22.913597","192.168.2.3","216.58.197.4","TLSv1.2","212","Application Data"
"324","2018-08-23 01:57:22.913923","192.168.2.3","216.58.197.4","TCP","1434","34236  >  443 [ACK] Seq=177737 Ack=4787 Win=1828 Len=1368 TSval=7812504 TSecr=760017645 [TCP segment of a reassembled PDU]"
"325","2018-08-23 01:57:22.913926","192.168.2.3","216.58.197.4","TLSv1.2","155","Application Data"
"330","2018-08-23 01:57:23.002537","192.168.2.3","216.58.197.4","TCP","66","34236  >  443 [ACK] Seq=179194 Ack=5051 Win=1828 Len=0 TSval=7812513 TSecr=760017753"
"331","2018-08-23 01:57:23.007720","192.168.2.3","216.58.197.4","TCP","1434","34236  >  443 [ACK] Seq=179194 Ack=5051 Win=1828 Len=1368 TSval=7812513 TSecr=760017753 [TCP segment of a reassembled PDU]"
"332","2018-08-23 01:57:23.007724","192.168.2.3","216.58.197.4","TCP","1434","34236  >  443 [ACK] Seq=180562 Ack=5051 Win=1828 Len=1368 TSval=7812513 TSecr=760017753 [TCP segment of a reassembled PDU]"
"333","2018-08-23 01:57:23.007792","192.168.2.3","216.58.197.4","TLSv1.2","212","Application Data"
"334","2018-08-23 01:57:23.008077","192.168.2.3","216.58.197.4","TCP","1434","34236  >  443 [ACK] Seq=182076 Ack=5051 Win=1828 Len=1368 TSval=7812513 TSecr=760017753 [TCP segment of a reassembled PDU]"
"335","2018-08-23 01:57:23.008080","192.168.2.3","216.58.197.4","TLSv1.2","155","Application Data"
"341","2018-08-23 01:57:23.072059","192.168.2.3","216.58.197.4","TCP","66","34236  >  443 [ACK] Seq=183533 Ack=5222 Win=1828 Len=0 TSval=7812520 TSecr=760017866"
"342","2018-08-23 01:57:23.072062","192.168.2.3","216.58.197.4","TCP","66","34236  >  443 [ACK] Seq=183533 Ack=5384 Win=1828 Len=0 TSval=7812520 TSecr=760017866"
"343","2018-08-23 01:57:23.105764","192.168.2.3","216.58.197.4","TCP","1434","34236  >  443 [ACK] Seq=183533 Ack=5384 Win=1828 Len=1368 TSval=7812523 TSecr=760017866 [TCP segment of a reassembled PDU]"
"344","2018-08-23 01:57:23.105960","192.168.2.3","216.58.197.4","TCP","1434","34236  >  443 [ACK] Seq=184901 Ack=5384 Win=1828 Len=1368 TSval=7812523 TSecr=760017866 [TCP segment of a reassembled PDU]"
"345","2018-08-23 01:57:23.105962","192.168.2.3","216.58.197.4","TLSv1.2","212","Application Data"
"346","2018-08-23 01:57:23.105963","192.168.2.3","216.58.197.4","TCP","1434","34236  >  443 [ACK] Seq=186415 Ack=5384 Win=1828 Len=1368 TSval=7812523 TSecr=760017866 [TCP segment of a reassembled PDU]"
"347","2018-08-23 01:57:23.106114","192.168.2.3","216.58.197.4","TLSv1.2","155","Application Data"
"351","2018-08-23 01:57:23.220697","192.168.2.3","216.58.197.4","TCP","1434","34236  >  443 [ACK] Seq=187872 Ack=5384 Win=1828 Len=1368 TSval=7812534 TSecr=760017906 [TCP segment of a reassembled PDU]"
"352","2018-08-23 01:57:23.221011","192.168.2.3","216.58.197.4","TCP","1434","34236  >  443 [ACK] Seq=189240 Ack=5384 Win=1828 Len=1368 TSval=7812534 TSecr=760017906 [TCP segment of a reassembled PDU]"
"353","2018-08-23 01:57:23.221027","192.168.2.3","216.58.197.4","TLSv1.2","212","Application Data"
"354","2018-08-23 01:57:23.221028","192.168.2.3","216.58.197.4","TCP","1434","34236  >  443 [ACK] Seq=190754 Ack=5384 Win=1828 Len=1368 TSval=7812534 TSecr=760017906 [TCP segment of a reassembled PDU]"
"355","2018-08-23 01:57:23.221165","192.168.2.3","216.58.197.4","TLSv1.2","155","Application Data"
"361","2018-08-23 01:57:23.285386","192.168.2.3","216.58.197.4","TCP","66","34236  >  443 [ACK] Seq=192211 Ack=5908 Win=1828 Len=0 TSval=7812541 TSecr=760018080"
"362","2018-08-23 01:57:23.314776","192.168.2.3","216.58.197.4","TCP","1434","34236  >  443 [ACK] Seq=192211 Ack=5908 Win=1828 Len=1368 TSval=7812544 TSecr=760018080 [TCP segment of a reassembled PDU]"
"363","2018-08-23 01:57:23.314789","192.168.2.3","216.58.197.4","TCP","1434","34236  >  443 [ACK] Seq=193579 Ack=5908 Win=1828 Len=1368 TSval=7812544 TSecr=760018080 [TCP segment of a reassembled PDU]"
"364","2018-08-23 01:57:23.314867","192.168.2.3","216.58.197.4","TLSv1.2","212","Application Data"
"365","2018-08-23 01:57:23.315059","192.168.2.3","216.58.197.4","TCP","1434","34236  >  443 [ACK] Seq=195093 Ack=5908 Win=1828 Len=1368 TSval=7812544 TSecr=760018080 [TCP segment of a reassembled PDU]"
"366","2018-08-23 01:57:23.315063","192.168.2.3","216.58.197.4","TLSv1.2","155","Application Data"
"373","2018-08-23 01:57:23.392238","192.168.2.3","216.58.197.4","TCP","1434","34236  >  443 [ACK] Seq=196550 Ack=5908 Win=1828 Len=1368 TSval=7812552 TSecr=760018115 [TCP segment of a reassembled PDU]"
"374","2018-08-23 01:57:23.392656","192.168.2.3","216.58.197.4","TCP","1434","34236  >  443 [ACK] Seq=197918 Ack=5908 Win=1828 Len=1368 TSval=7812552 TSecr=760018115 [TCP segment of a reassembled PDU]"
"375","2018-08-23 01:57:23.392660","192.168.2.3","216.58.197.4","TLSv1.2","212","Application Data"
"376","2018-08-23 01:57:23.393109","192.168.2.3","216.58.197.4","TCP","1434","34236  >  443 [ACK] Seq=199432 Ack=5908 Win=1828 Len=1368 TSval=7812552 TSecr=760018115 [TCP segment of a reassembled PDU]"
"377","2018-08-23 01:57:23.393112","192.168.2.3","216.58.197.4","TLSv1.2","155","Application Data"
"383","2018-08-23 01:57:23.442588","192.168.2.3","216.58.197.4","TCP","66","34236  >  443 [ACK] Seq=200889 Ack=6143 Win=1828 Len=0 TSval=7812557 TSecr=760018236"
"384","2018-08-23 01:57:23.476935","192.168.2.3","216.58.197.4","TCP","1434","34236  >  443 [ACK] Seq=200889 Ack=6143 Win=1828 Len=1368 TSval=7812560 TSecr=760018236 [TCP segment of a reassembled PDU]"
"385","2018-08-23 01:57:23.477342","192.168.2.3","216.58.197.4","TCP","1434","34236  >  443 [ACK] Seq=202257 Ack=6143 Win=1828 Len=1368 TSval=7812560 TSecr=760018236 [TCP segment of a reassembled PDU]"
"386","2018-08-23 01:57:23.477361","192.168.2.3","216.58.197.4","TLSv1.2","212","Application Data"
"387","2018-08-23 01:57:23.477362","192.168.2.3","216.58.197.4","TLSv1.2","379","Application Data"
"388","2018-08-23 01:57:23.477363","192.168.2.3","216.58.197.4","TLSv1.2","102","Application Data"
"393","2018-08-23 01:57:23.530756","192.168.2.3","216.58.197.4","TCP","66","34236  >  443 [ACK] Seq=204120 Ack=6952 Win=1828 Len=0 TSval=7812566 TSecr=760018318"
"396","2018-08-23 01:57:23.741443","192.168.2.3","216.58.197.4","TCP","66","34236  >  443 [ACK] Seq=204120 Ack=7395 Win=1828 Len=0 TSval=7812587 TSecr=760018527"
"399","2018-08-23 01:57:24.744200","192.168.2.3","216.58.197.4","TCP","66","34236  >  443 [ACK] Seq=204120 Ack=7784 Win=1828 Len=0 TSval=7812687 TSecr=760019527"
"401","2018-08-23 01:57:25.277740","192.168.2.3","216.58.197.4","TCP","66","34236  >  443 [ACK] Seq=204120 Ack=8069 Win=1828 Len=0 TSval=7812741 TSecr=760020033"
"403","2018-08-23 01:57:25.281552","192.168.2.3","216.58.197.4","TCP","66","34236  >  443 [ACK] Seq=204120 Ack=9369 Win=1828 Len=0 TSval=7812741 TSecr=760020075"
"413","2018-08-23 01:57:25.641811","192.168.2.3","216.58.197.4","TCP","66","34236  >  443 [ACK] Seq=204120 Ack=10787 Win=1812 Len=0 TSval=7812777 TSecr=760020433"
"414","2018-08-23 01:57:25.641815","192.168.2.3","216.58.197.4","TCP","66","34236  >  443 [ACK] Seq=204120 Ack=11248 Win=1828 Len=0 TSval=7812777 TSecr=760020433"
"415","2018-08-23 01:57:25.643466","192.168.2.3","216.58.197.4","TCP","66","34236  >  443 [ACK] Seq=204120 Ack=12666 Win=1812 Len=0 TSval=7812777 TSecr=760020433"
"416","2018-08-23 01:57:25.643469","192.168.2.3","216.58.197.4","TCP","66","34236  >  443 [ACK] Seq=204120 Ack=12945 Win=1828 Len=0 TSval=7812777 TSecr=760020433"
"417","2018-08-23 01:57:25.643768","192.168.2.3","216.58.197.4","TCP","66","34236  >  443 [ACK] Seq=204120 Ack=14363 Win=1812 Len=0 TSval=7812777 TSecr=760020437"
"419","2018-08-23 01:57:25.644186","192.168.2.3","216.58.197.4","TCP","66","34236  >  443 [ACK] Seq=204120 Ack=16511 Win=1808 Len=0 TSval=7812777 TSecr=760020437"
"423","2018-08-23 01:57:25.646406","192.168.2.3","216.58.197.4","TCP","66","34236  >  443 [ACK] Seq=204120 Ack=17929 Win=1812 Len=0 TSval=7812777 TSecr=760020440"
"424","2018-08-23 01:57:25.646409","192.168.2.3","216.58.197.4","TCP","66","34236  >  443 [ACK] Seq=204120 Ack=18381 Win=1828 Len=0 TSval=7812777 TSecr=760020440"
"425","2018-08-23 01:57:25.646935","192.168.2.3","216.58.197.4","TCP","66","34236  >  443 [ACK] Seq=204120 Ack=20297 Win=1812 Len=0 TSval=7812777 TSecr=760020440"
"428","2018-08-23 01:57:25.651239","192.168.2.3","216.58.197.4","TCP","66","34236  >  443 [ACK] Seq=204120 Ack=21715 Win=1812 Len=0 TSval=7812778 TSecr=760020443"
"429","2018-08-23 01:57:25.651581","192.168.2.3","216.58.197.4","TCP","66","34236  >  443 [ACK] Seq=204120 Ack=22026 Win=1828 Len=0 TSval=7812778 TSecr=760020443"
"446","2018-08-23 01:57:25.680649","192.168.2.3","216.58.197.4","TCP","66","34236  >  443 [ACK] Seq=204120 Ack=23895 Win=1812 Len=0 TSval=7812780 TSecr=760020468"
"447","2018-08-23 01:57:25.680655","192.168.2.3","216.58.197.4","TCP","66","34236  >  443 [ACK] Seq=204120 Ack=25713 Win=1828 Len=0 TSval=7812780 TSecr=760020468"
"448","2018-08-23 01:57:25.680656","192.168.2.3","216.58.197.4","TCP","66","34236  >  443 [ACK] Seq=204120 Ack=27401 Win=1828 Len=0 TSval=7812781 TSecr=760020469"
"449","2018-08-23 01:57:25.680656","192.168.2.3","216.58.197.4","TCP","66","34236  >  443 [ACK] Seq=204120 Ack=29133 Win=1828 Len=0 TSval=7812781 TSecr=760020471"
"450","2018-08-23 01:57:25.680657","192.168.2.3","216.58.197.4","TCP","66","34236  >  443 [ACK] Seq=204120 Ack=30946 Win=1828 Len=0 TSval=7812781 TSecr=760020471"
"459","2018-08-23 01:57:25.686314","192.168.2.3","216.58.197.4","TCP","66","34236  >  443 [ACK] Seq=204120 Ack=32849 Win=1828 Len=0 TSval=7812781 TSecr=760020473"
"470","2018-08-23 01:57:25.690695","192.168.2.3","216.58.197.4","TCP","66","34236  >  443 [ACK] Seq=204120 Ack=34553 Win=1828 Len=0 TSval=7812782 TSecr=760020475"
"475","2018-08-23 01:57:25.697328","192.168.2.3","216.58.197.4","TCP","66","34236  >  443 [ACK] Seq=204120 Ack=39836 Win=1828 Len=0 TSval=7812782 TSecr=760020475"
"476","2018-08-23 01:57:25.697333","192.168.2.3","216.58.197.4","TCP","66","34236  >  443 [ACK] Seq=204120 Ack=43327 Win=1828 Len=0 TSval=7812782 TSecr=760020479"
"477","2018-08-23 01:57:25.697334","192.168.2.3","216.58.197.4","TCP","66","34236  >  443 [ACK] Seq=204120 Ack=45046 Win=1828 Len=0 TSval=7812782 TSecr=760020482"
"478","2018-08-23 01:57:25.697334","192.168.2.3","216.58.197.4","TCP","66","34236  >  443 [ACK] Seq=204120 Ack=52236 Win=1828 Len=0 TSval=7812782 TSecr=760020482"
"479","2018-08-23 01:57:25.704465","192.168.2.3","216.58.197.4","TCP","66","34236  >  443 [ACK] Seq=204120 Ack=55919 Win=1828 Len=0 TSval=7812783 TSecr=760020487"
"493","2018-08-23 01:57:25.710697","192.168.2.3","216.58.197.4","TCP","66","34236  >  443 [ACK] Seq=204120 Ack=57636 Win=1828 Len=0 TSval=7812784 TSecr=760020502"
"517","2018-08-23 01:57:25.721897","192.168.2.3","216.58.197.4","TCP","66","34236  >  443 [ACK] Seq=204120 Ack=59397 Win=1828 Len=0 TSval=7812784 TSecr=760020503"
"518","2018-08-23 01:57:25.721902","192.168.2.3","216.58.197.4","TCP","66","34236  >  443 [ACK] Seq=204120 Ack=61261 Win=1828 Len=0 TSval=7812785 TSecr=760020503"
"519","2018-08-23 01:57:25.721903","192.168.2.3","216.58.197.4","TCP","66","34236  >  443 [ACK] Seq=204120 Ack=63058 Win=1828 Len=0 TSval=7812785 TSecr=760020504"
"520","2018-08-23 01:57:25.721903","192.168.2.3","216.58.197.4","TCP","66","34236  >  443 [ACK] Seq=204120 Ack=66456 Win=1828 Len=0 TSval=7812785 TSecr=760020504"
"521","2018-08-23 01:57:25.721904","192.168.2.3","216.58.197.4","TCP","66","34236  >  443 [ACK] Seq=204120 Ack=68331 Win=1828 Len=0 TSval=7812785 TSecr=760020506"
"522","2018-08-23 01:57:25.721906","192.168.2.3","216.58.197.4","TCP","66","34236  >  443 [ACK] Seq=204120 Ack=70227 Win=1828 Len=0 TSval=7812785 TSecr=760020507"
"523","2018-08-23 01:57:25.721907","192.168.2.3","216.58.197.4","TCP","66","34236  >  443 [ACK] Seq=204120 Ack=75550 Win=1828 Len=0 TSval=7812785 TSecr=760020507"
"524","2018-08-23 01:57:25.722932","192.168.2.3","216.58.197.4","TCP","66","34236  >  443 [ACK] Seq=204120 Ack=79293 Win=1828 Len=0 TSval=7812785 TSecr=760020510"
"525","2018-08-23 01:57:25.723176","192.168.2.3","216.58.197.4","TCP","66","34236  >  443 [ACK] Seq=204120 Ack=81131 Win=1828 Len=0 TSval=7812785 TSecr=760020514"
"526","2018-08-23 01:57:25.723518","192.168.2.3","216.58.197.4","TCP","66","34236  >  443 [ACK] Seq=204120 Ack=82123 Win=1828 Len=0 TSval=7812785 TSecr=760020514"
"527","2018-08-23 01:57:25.745228","192.168.2.3","216.58.197.4","TLSv1.2","104","Application Data"
"529","2018-08-23 01:57:26.917787","192.168.2.3","216.58.197.14","TCP","66","41148  >  443 [ACK] Seq=1 Ack=1 Win=296 Len=0 TSval=7812905 TSecr=2852192223"
"546","2018-08-23 01:57:35.471412","192.168.2.3","216.58.197.14","TCP","66","41142  >  443 [ACK] Seq=1 Ack=1 Win=564 Len=0 TSval=7813760 TSecr=932993962"
"548","2018-08-23 01:57:35.947889","192.168.2.3","74.125.204.188","TCP","66","33038  >  5228 [ACK] Seq=1 Ack=1 Win=406 Len=0 TSval=7813808 TSecr=3813734280"
"551","2018-08-23 01:57:41.626114","192.168.2.3","216.58.197.14","TLSv1.2","161","[TCP Previous segment not captured] , Application Data"
"552","2018-08-23 01:57:41.626438","192.168.2.3","216.58.197.14","TLSv1.2","104","Application Data"
"553","2018-08-23 01:57:41.626707","192.168.2.3","216.58.197.14","TLSv1.2","586","Application Data"
"558","2018-08-23 01:57:41.667922","192.168.2.3","216.58.197.14","TCP","66","41142  >  443 [ACK] Seq=655 Ack=39 Win=564 Len=0 TSval=7814380 TSecr=933045161"
"563","2018-08-23 01:57:41.781965","192.168.2.3","216.58.197.14","TCP","66","41142  >  443 [ACK] Seq=655 Ack=107 Win=564 Len=0 TSval=7814391 TSecr=933045311"
"564","2018-08-23 01:57:41.782388","192.168.2.3","216.58.197.14","TCP","66","41142  >  443 [ACK] Seq=655 Ack=351 Win=580 Len=0 TSval=7814391 TSecr=933045311"
"565","2018-08-23 01:57:41.782557","192.168.2.3","216.58.197.14","TCP","66","41142  >  443 [ACK] Seq=655 Ack=617 Win=597 Len=0 TSval=7814391 TSecr=933045311"
"566","2018-08-23 01:57:41.782573","192.168.2.3","216.58.197.14","TCP","66","41142  >  443 [ACK] Seq=655 Ack=655 Win=597 Len=0 TSval=7814391 TSecr=933045311"
"567","2018-08-23 01:57:41.783902","192.168.2.3","216.58.197.14","TLSv1.2","104","Application Data"
"568","2018-08-23 01:57:41.827942","192.168.2.3","216.58.197.3","TCP","66","43379  >  443 [ACK] Seq=1 Ack=1 Win=406 Len=0 TSval=7814396 TSecr=1765206788"
