"No.","Time","Source","Destination","Protocol","Length","Info"
"2","2018-08-23 02:00:11.640384","192.168.2.3","216.58.197.4","TLSv1.2","156","Application Data"
"3","2018-08-23 02:00:11.640635","192.168.2.3","216.58.197.4","TLSv1.2","104","Application Data"
"4","2018-08-23 02:00:11.641434","192.168.2.3","216.58.197.4","TLSv1.2","158","Application Data"
"8","2018-08-23 02:00:11.657778","192.168.2.3","216.58.197.4","TCP","1434","34236  >  443 [ACK] Seq=221 Ack=39 Win=2359 Len=1368 TSval=7829378 TSecr=760186441 [TCP segment of a reassembled PDU]"
"9","2018-08-23 02:00:11.657783","192.168.2.3","216.58.197.4","TCP","1434","34236  >  443 [ACK] Seq=1589 Ack=39 Win=2359 Len=1368 TSval=7829378 TSecr=760186441 [TCP segment of a reassembled PDU]"
"10","2018-08-23 02:00:11.657784","192.168.2.3","216.58.197.4","TLSv1.2","212","Application Data"
"11","2018-08-23 02:00:11.657940","192.168.2.3","216.58.197.4","TCP","1434","34236  >  443 [ACK] Seq=3103 Ack=39 Win=2359 Len=1368 TSval=7829378 TSecr=760186441 [TCP segment of a reassembled PDU]"
"12","2018-08-23 02:00:11.658064","192.168.2.3","216.58.197.4","TLSv1.2","223","Application Data"
"13","2018-08-23 02:00:11.658320","192.168.2.3","216.58.197.4","TCP","1434","34236  >  443 [ACK] Seq=4628 Ack=39 Win=2359 Len=1368 TSval=7829378 TSecr=760186441 [TCP segment of a reassembled PDU]"
"14","2018-08-23 02:00:11.658322","192.168.2.3","216.58.197.4","TCP","1434","34236  >  443 [ACK] Seq=5996 Ack=39 Win=2359 Len=1368 TSval=7829378 TSecr=760186441 [TCP segment of a reassembled PDU]"
"15","2018-08-23 02:00:11.658422","192.168.2.3","216.58.197.4","TLSv1.2","212","Application Data"
"16","2018-08-23 02:00:11.658753","192.168.2.3","216.58.197.4","TCP","1434","34236  >  443 [ACK] Seq=7510 Ack=39 Win=2359 Len=1368 TSval=7829378 TSecr=760186441 [TCP segment of a reassembled PDU]"
"22","2018-08-23 02:00:11.663787","192.168.2.3","216.58.197.4","TLSv1.2","1434","Application Data [TCP segment of a reassembled PDU]"
"23","2018-08-23 02:00:11.663953","192.168.2.3","216.58.197.4","TCP","1434","34236  >  443 [ACK] Seq=10246 Ack=39 Win=2359 Len=1368 TSval=7829379 TSecr=760186458 [TCP segment of a reassembled PDU]"
"24","2018-08-23 02:00:11.664222","192.168.2.3","216.58.197.4","TLSv1.2","1434","Application Data [TCP segment of a reassembled PDU]"
"25","2018-08-23 02:00:11.664565","192.168.2.3","216.58.197.4","TLSv1.2","1434","Application Data [TCP segment of a reassembled PDU]"
"26","2018-08-23 02:00:11.664567","192.168.2.3","216.58.197.4","TCP","1434","34236  >  443 [ACK] Seq=14350 Ack=39 Win=2359 Len=1368 TSval=7829379 TSecr=760186458 [TCP segment of a reassembled PDU]"
"27","2018-08-23 02:00:11.665665","192.168.2.3","216.58.197.4","TLSv1.2","1434","Application Data [TCP segment of a reassembled PDU]"
"28","2018-08-23 02:00:11.665668","192.168.2.3","216.58.197.4","TLSv1.2","1434","Application Data [TCP segment of a reassembled PDU]"
"29","2018-08-23 02:00:11.666071","192.168.2.3","216.58.197.4","TCP","1434","34236  >  443 [ACK] Seq=18454 Ack=39 Win=2359 Len=1368 TSval=7829379 TSecr=760186458 [TCP segment of a reassembled PDU]"
"30","2018-08-23 02:00:11.666270","192.168.2.3","216.58.197.4","TLSv1.2","1434","Application Data [TCP segment of a reassembled PDU]"
"31","2018-08-23 02:00:11.666430","192.168.2.3","216.58.197.4","TLSv1.2","1434","Application Data [TCP segment of a reassembled PDU]"
"32","2018-08-23 02:00:11.666587","192.168.2.3","216.58.197.4","TCP","1434","34236  >  443 [ACK] Seq=22558 Ack=39 Win=2359 Len=1368 TSval=7829379 TSecr=760186459 [TCP segment of a reassembled PDU]"
"33","2018-08-23 02:00:11.666742","192.168.2.3","216.58.197.4","TLSv1.2","1434","Application Data [TCP segment of a reassembled PDU]"
"34","2018-08-23 02:00:11.666972","192.168.2.3","216.58.197.4","TLSv1.2","1434","Application Data [TCP segment of a reassembled PDU]"
"35","2018-08-23 02:00:11.666975","192.168.2.3","216.58.197.4","TCP","1434","34236  >  443 [ACK] Seq=26662 Ack=39 Win=2359 Len=1368 TSval=7829379 TSecr=760186459 [TCP segment of a reassembled PDU]"
"36","2018-08-23 02:00:11.667311","192.168.2.3","216.58.197.4","TLSv1.2","1434","Application Data [TCP segment of a reassembled PDU]"
"43","2018-08-23 02:00:11.671067","192.168.2.3","216.58.197.4","TLSv1.2","1434","Application Data [TCP segment of a reassembled PDU]"
"44","2018-08-23 02:00:11.671071","192.168.2.3","216.58.197.4","TCP","1434","34236  >  443 [ACK] Seq=30766 Ack=39 Win=2359 Len=1368 TSval=7829380 TSecr=760186464 [TCP segment of a reassembled PDU]"
"46","2018-08-23 02:00:11.671403","192.168.2.3","216.58.197.4","TCP","1434","34236  >  443 [ACK] Seq=32134 Ack=39 Win=2359 Len=1368 TSval=7829380 TSecr=760186464 [TCP segment of a reassembled PDU]"
"47","2018-08-23 02:00:11.671811","192.168.2.3","216.58.197.4","TLSv1.2","1434","Application Data [TCP segment of a reassembled PDU]"
"48","2018-08-23 02:00:11.671815","192.168.2.3","216.58.197.4","TLSv1.2","1434","Application Data [TCP segment of a reassembled PDU]"
"49","2018-08-23 02:00:11.672130","192.168.2.3","216.58.197.4","TCP","1434","34236  >  443 [ACK] Seq=36238 Ack=39 Win=2359 Len=1368 TSval=7829380 TSecr=760186465 [TCP segment of a reassembled PDU]"
"50","2018-08-23 02:00:11.672398","192.168.2.3","216.58.197.4","TLSv1.2","1434","Application Data [TCP segment of a reassembled PDU]"
"51","2018-08-23 02:00:11.672557","192.168.2.3","216.58.197.4","TLSv1.2","1434","Application Data [TCP segment of a reassembled PDU]"
"52","2018-08-23 02:00:11.672700","192.168.2.3","216.58.197.4","TCP","1434","34236  >  443 [ACK] Seq=40342 Ack=39 Win=2359 Len=1368 TSval=7829380 TSecr=760186466 [TCP segment of a reassembled PDU]"
"53","2018-08-23 02:00:11.672896","192.168.2.3","216.58.197.4","TLSv1.2","1434","Application Data [TCP segment of a reassembled PDU]"
"54","2018-08-23 02:00:11.673058","192.168.2.3","216.58.197.4","TLSv1.2","1434","Application Data [TCP segment of a reassembled PDU]"
"55","2018-08-23 02:00:11.674486","192.168.2.3","216.58.197.4","TCP","1434","34236  >  443 [ACK] Seq=44446 Ack=39 Win=2359 Len=1368 TSval=7829380 TSecr=760186467 [TCP segment of a reassembled PDU]"
"56","2018-08-23 02:00:11.674765","192.168.2.3","216.58.197.4","TLSv1.2","1434","Application Data [TCP segment of a reassembled PDU]"
"57","2018-08-23 02:00:11.674961","192.168.2.3","216.58.197.4","TLSv1.2","1434","Application Data [TCP segment of a reassembled PDU]"
"58","2018-08-23 02:00:11.675124","192.168.2.3","216.58.197.4","TCP","1434","34236  >  443 [PSH, ACK] Seq=48550 Ack=39 Win=2359 Len=1368 TSval=7829380 TSecr=760186467 [TCP segment of a reassembled PDU]"
"60","2018-08-23 02:00:11.675504","192.168.2.3","216.58.197.4","TLSv1.2","1434","Application Data [TCP segment of a reassembled PDU]"
"61","2018-08-23 02:00:11.675508","192.168.2.3","216.58.197.4","TLSv1.2","1434","Application Data [TCP segment of a reassembled PDU]"
"63","2018-08-23 02:00:11.675749","192.168.2.3","216.58.197.4","TCP","1434","34236  >  443 [ACK] Seq=52654 Ack=39 Win=2359 Len=1368 TSval=7829380 TSecr=760186467 [TCP segment of a reassembled PDU]"
"64","2018-08-23 02:00:11.675960","192.168.2.3","216.58.197.4","TLSv1.2","1434","Application Data [TCP segment of a reassembled PDU]"
"69","2018-08-23 02:00:11.678008","192.168.2.3","216.58.197.4","TCP","1434","34236  >  443 [ACK] Seq=55390 Ack=39 Win=2359 Len=1368 TSval=7829380 TSecr=760186471 [TCP segment of a reassembled PDU]"
"70","2018-08-23 02:00:11.678012","192.168.2.3","216.58.197.4","TLSv1.2","1434","Application Data [TCP segment of a reassembled PDU]"
"71","2018-08-23 02:00:11.678274","192.168.2.3","216.58.197.4","TLSv1.2","1169","Application Data"
"77","2018-08-23 02:00:11.714487","192.168.2.3","216.58.197.4","TCP","1434","34236  >  443 [ACK] Seq=59229 Ack=39 Win=2359 Len=1368 TSval=7829384 TSecr=760186479 [TCP segment of a reassembled PDU]"
"78","2018-08-23 02:00:11.714798","192.168.2.3","216.58.197.4","TCP","1434","34236  >  443 [ACK] Seq=60597 Ack=39 Win=2359 Len=1368 TSval=7829384 TSecr=760186479 [TCP segment of a reassembled PDU]"
"79","2018-08-23 02:00:11.714800","192.168.2.3","216.58.197.4","TLSv1.2","212","Application Data"
"80","2018-08-23 02:00:11.715207","192.168.2.3","216.58.197.4","TCP","1434","34236  >  443 [ACK] Seq=62111 Ack=39 Win=2359 Len=1368 TSval=7829384 TSecr=760186479 [TCP segment of a reassembled PDU]"
"81","2018-08-23 02:00:11.715210","192.168.2.3","216.58.197.4","TLSv1.2","155","Application Data"
"85","2018-08-23 02:00:11.827105","192.168.2.3","216.58.197.4","TCP","1434","34236  >  443 [ACK] Seq=63568 Ack=39 Win=2359 Len=1368 TSval=7829395 TSecr=760186555 [TCP segment of a reassembled PDU]"
"86","2018-08-23 02:00:11.827411","192.168.2.3","216.58.197.4","TCP","1434","34236  >  443 [ACK] Seq=64936 Ack=39 Win=2359 Len=1368 TSval=7829395 TSecr=760186555 [TCP segment of a reassembled PDU]"
"87","2018-08-23 02:00:11.827413","192.168.2.3","216.58.197.4","TLSv1.2","212","Application Data"
"88","2018-08-23 02:00:11.827414","192.168.2.3","216.58.197.4","TLSv1.2","1389","Application Data"
"91","2018-08-23 02:00:11.926245","192.168.2.3","216.58.197.4","TCP","1434","34236  >  443 [ACK] Seq=67773 Ack=39 Win=2359 Len=1368 TSval=7829405 TSecr=760186628 [TCP segment of a reassembled PDU]"
"92","2018-08-23 02:00:11.926549","192.168.2.3","216.58.197.4","TCP","1434","34236  >  443 [ACK] Seq=69141 Ack=39 Win=2359 Len=1368 TSval=7829405 TSecr=760186628 [TCP segment of a reassembled PDU]"
"93","2018-08-23 02:00:11.926554","192.168.2.3","216.58.197.4","TLSv1.2","212","Application Data"
"94","2018-08-23 02:00:11.926968","192.168.2.3","216.58.197.4","TCP","1434","34236  >  443 [ACK] Seq=70655 Ack=39 Win=2359 Len=1368 TSval=7829405 TSecr=760186628 [TCP segment of a reassembled PDU]"
"95","2018-08-23 02:00:11.926972","192.168.2.3","216.58.197.4","TLSv1.2","155","Application Data"
"102","2018-08-23 02:00:12.040958","192.168.2.3","216.58.197.4","TCP","1434","34236  >  443 [ACK] Seq=72112 Ack=39 Win=2359 Len=1368 TSval=7829416 TSecr=760186727 [TCP segment of a reassembled PDU]"
"103","2018-08-23 02:00:12.041137","192.168.2.3","216.58.197.4","TCP","1434","34236  >  443 [ACK] Seq=73480 Ack=39 Win=2359 Len=1368 TSval=7829416 TSecr=760186727 [TCP segment of a reassembled PDU]"
"104","2018-08-23 02:00:12.041140","192.168.2.3","216.58.197.4","TLSv1.2","212","Application Data"
"105","2018-08-23 02:00:12.041349","192.168.2.3","216.58.197.4","TLSv1.2","1283","Application Data"
"109","2018-08-23 02:00:12.058336","192.168.2.3","216.58.197.4","TCP","66","34236  >  443 [ACK] Seq=76211 Ack=254 Win=2359 Len=0 TSval=7829417 TSecr=760186817"
"111","2018-08-23 02:00:12.068005","192.168.2.3","216.58.197.4","TCP","66","34236  >  443 [ACK] Seq=76211 Ack=664 Win=2363 Len=0 TSval=7829419 TSecr=760186832"
"112","2018-08-23 02:00:12.147030","192.168.2.3","216.58.197.4","TCP","1434","34236  >  443 [ACK] Seq=76211 Ack=664 Win=2363 Len=1368 TSval=7829427 TSecr=760186832 [TCP segment of a reassembled PDU]"
"113","2018-08-23 02:00:12.147388","192.168.2.3","216.58.197.4","TCP","1434","34236  >  443 [ACK] Seq=77579 Ack=664 Win=2363 Len=1368 TSval=7829427 TSecr=760186832 [TCP segment of a reassembled PDU]"
"114","2018-08-23 02:00:12.147392","192.168.2.3","216.58.197.4","TLSv1.2","212","Application Data"
"115","2018-08-23 02:00:12.147811","192.168.2.3","216.58.197.4","TCP","1434","34236  >  443 [ACK] Seq=79093 Ack=664 Win=2363 Len=1368 TSval=7829427 TSecr=760186832 [TCP segment of a reassembled PDU]"
"116","2018-08-23 02:00:12.147814","192.168.2.3","216.58.197.4","TLSv1.2","155","Application Data"
"121","2018-08-23 02:00:12.246535","192.168.2.3","216.58.197.4","TCP","1434","34236  >  443 [ACK] Seq=80550 Ack=859 Win=2363 Len=1368 TSval=7829437 TSecr=760187010 [TCP segment of a reassembled PDU]"
"122","2018-08-23 02:00:12.246543","192.168.2.3","216.58.197.4","TCP","1434","34236  >  443 [ACK] Seq=81918 Ack=859 Win=2363 Len=1368 TSval=7829437 TSecr=760187010 [TCP segment of a reassembled PDU]"
"123","2018-08-23 02:00:12.246544","192.168.2.3","216.58.197.4","TLSv1.2","212","Application Data"
"124","2018-08-23 02:00:12.246824","192.168.2.3","216.58.197.4","TCP","1434","34236  >  443 [ACK] Seq=83432 Ack=859 Win=2363 Len=1368 TSval=7829437 TSecr=760187010 [TCP segment of a reassembled PDU]"
"125","2018-08-23 02:00:12.246828","192.168.2.3","216.58.197.4","TLSv1.2","155","Application Data"
"130","2018-08-23 02:00:12.366923","192.168.2.3","216.58.197.4","TCP","1434","34236  >  443 [ACK] Seq=84889 Ack=859 Win=2363 Len=1368 TSval=7829448 TSecr=760187048 [TCP segment of a reassembled PDU]"
"131","2018-08-23 02:00:12.366943","192.168.2.3","216.58.197.4","TCP","1434","34236  >  443 [ACK] Seq=86257 Ack=859 Win=2363 Len=1368 TSval=7829448 TSecr=760187048 [TCP segment of a reassembled PDU]"
"132","2018-08-23 02:00:12.367055","192.168.2.3","216.58.197.4","TLSv1.2","212","Application Data"
"133","2018-08-23 02:00:12.367259","192.168.2.3","216.58.197.4","TLSv1.2","1310","Application Data"
"137","2018-08-23 02:00:12.399821","192.168.2.3","216.58.197.4","TCP","66","34236  >  443 [ACK] Seq=89015 Ack=1051 Win=2363 Len=0 TSval=7829453 TSecr=760187159"
"138","2018-08-23 02:00:12.491928","192.168.2.3","216.58.197.4","TCP","1434","34236  >  443 [ACK] Seq=89015 Ack=1051 Win=2363 Len=1368 TSval=7829459 TSecr=760187159 [TCP segment of a reassembled PDU]"
"139","2018-08-23 02:00:12.492146","192.168.2.3","216.58.197.4","TCP","1434","34236  >  443 [ACK] Seq=90383 Ack=1051 Win=2363 Len=1368 TSval=7829459 TSecr=760187159 [TCP segment of a reassembled PDU]"
"140","2018-08-23 02:00:12.492150","192.168.2.3","216.58.197.4","TLSv1.2","212","Application Data"
"141","2018-08-23 02:00:12.492151","192.168.2.3","216.58.197.4","TCP","1434","34236  >  443 [ACK] Seq=91897 Ack=1051 Win=2363 Len=1368 TSval=7829459 TSecr=760187159 [TCP segment of a reassembled PDU]"
"142","2018-08-23 02:00:12.492415","192.168.2.3","216.58.197.4","TLSv1.2","155","Application Data"
"146","2018-08-23 02:00:12.593829","192.168.2.3","216.58.197.4","TCP","1434","34236  >  443 [ACK] Seq=93354 Ack=1051 Win=2363 Len=1368 TSval=7829469 TSecr=760187293 [TCP segment of a reassembled PDU]"
"147","2018-08-23 02:00:12.594095","192.168.2.3","216.58.197.4","TCP","1434","34236  >  443 [ACK] Seq=94722 Ack=1051 Win=2363 Len=1368 TSval=7829469 TSecr=760187293 [TCP segment of a reassembled PDU]"
"148","2018-08-23 02:00:12.594097","192.168.2.3","216.58.197.4","TLSv1.2","212","Application Data"
"149","2018-08-23 02:00:12.594206","192.168.2.3","216.58.197.4","TCP","1434","34236  >  443 [ACK] Seq=96236 Ack=1051 Win=2363 Len=1368 TSval=7829469 TSecr=760187293 [TCP segment of a reassembled PDU]"
"150","2018-08-23 02:00:12.594209","192.168.2.3","216.58.197.4","TLSv1.2","155","Application Data"
"151","2018-08-23 02:00:12.594210","192.168.2.3","108.177.97.188","TCP","66","58805  >  5228 [ACK] Seq=1 Ack=1 Win=406 Len=0 TSval=7829472 TSecr=2777711497"
"156","2018-08-23 02:00:12.659218","192.168.2.3","216.58.197.4","TCP","1434","34236  >  443 [ACK] Seq=97693 Ack=1051 Win=2363 Len=1368 TSval=7829478 TSecr=760187395 [TCP segment of a reassembled PDU]"
"157","2018-08-23 02:00:12.659636","192.168.2.3","216.58.197.4","TCP","1434","34236  >  443 [ACK] Seq=99061 Ack=1051 Win=2363 Len=1368 TSval=7829478 TSecr=760187395 [TCP segment of a reassembled PDU]"
"158","2018-08-23 02:00:12.659639","192.168.2.3","216.58.197.4","TLSv1.2","212","Application Data"
"159","2018-08-23 02:00:12.659640","192.168.2.3","216.58.197.4","TCP","1434","34236  >  443 [ACK] Seq=100575 Ack=1051 Win=2363 Len=1368 TSval=7829478 TSecr=760187395 [TCP segment of a reassembled PDU]"
"160","2018-08-23 02:00:12.659835","192.168.2.3","216.58.197.4","TLSv1.2","155","Application Data"
"164","2018-08-23 02:00:12.743875","192.168.2.3","216.58.197.4","TCP","1434","34236  >  443 [ACK] Seq=102032 Ack=1051 Win=2363 Len=1368 TSval=7829486 TSecr=760187460 [TCP segment of a reassembled PDU]"
"165","2018-08-23 02:00:12.743880","192.168.2.3","216.58.197.4","TCP","1434","34236  >  443 [ACK] Seq=103400 Ack=1051 Win=2363 Len=1368 TSval=7829486 TSecr=760187460 [TCP segment of a reassembled PDU]"
"166","2018-08-23 02:00:12.743881","192.168.2.3","216.58.197.4","TLSv1.2","212","Application Data"
"167","2018-08-23 02:00:12.743957","192.168.2.3","216.58.197.4","TCP","1434","34236  >  443 [ACK] Seq=104914 Ack=1051 Win=2363 Len=1368 TSval=7829486 TSecr=760187460 [TCP segment of a reassembled PDU]"
"168","2018-08-23 02:00:12.743958","192.168.2.3","216.58.197.4","TLSv1.2","155","Application Data"
"171","2018-08-23 02:00:12.834316","192.168.2.3","216.58.197.4","TCP","1434","34236  >  443 [ACK] Seq=106371 Ack=1051 Win=2363 Len=1368 TSval=7829496 TSecr=760187544 [TCP segment of a reassembled PDU]"
"172","2018-08-23 02:00:12.834829","192.168.2.3","216.58.197.4","TCP","1434","34236  >  443 [ACK] Seq=107739 Ack=1051 Win=2363 Len=1368 TSval=7829496 TSecr=760187544 [TCP segment of a reassembled PDU]"
"173","2018-08-23 02:00:12.834832","192.168.2.3","216.58.197.4","TLSv1.2","212","Application Data"
"174","2018-08-23 02:00:12.835153","192.168.2.3","216.58.197.4","TCP","1434","34236  >  443 [ACK] Seq=109253 Ack=1051 Win=2363 Len=1368 TSval=7829496 TSecr=760187544 [TCP segment of a reassembled PDU]"
"175","2018-08-23 02:00:12.835156","192.168.2.3","216.58.197.4","TLSv1.2","155","Application Data"
"179","2018-08-23 02:00:12.949102","192.168.2.3","216.58.197.4","TCP","1434","34236  >  443 [ACK] Seq=110710 Ack=1051 Win=2363 Len=1368 TSval=7829507 TSecr=760187635 [TCP segment of a reassembled PDU]"
"180","2018-08-23 02:00:12.949474","192.168.2.3","216.58.197.4","TCP","1434","34236  >  443 [ACK] Seq=112078 Ack=1051 Win=2363 Len=1368 TSval=7829507 TSecr=760187635 [TCP segment of a reassembled PDU]"
"181","2018-08-23 02:00:12.949476","192.168.2.3","216.58.197.4","TLSv1.2","212","Application Data"
"182","2018-08-23 02:00:12.949822","192.168.2.3","216.58.197.4","TCP","1434","34236  >  443 [ACK] Seq=113592 Ack=1051 Win=2363 Len=1368 TSval=7829507 TSecr=760187635 [TCP segment of a reassembled PDU]"
"183","2018-08-23 02:00:12.949826","192.168.2.3","216.58.197.4","TLSv1.2","155","Application Data"
"189","2018-08-23 02:00:13.032049","192.168.2.3","216.58.197.4","TCP","1434","34236  >  443 [ACK] Seq=115049 Ack=1051 Win=2363 Len=1368 TSval=7829515 TSecr=760187750 [TCP segment of a reassembled PDU]"
"190","2018-08-23 02:00:13.032053","192.168.2.3","216.58.197.4","TCP","1434","34236  >  443 [ACK] Seq=116417 Ack=1051 Win=2363 Len=1368 TSval=7829515 TSecr=760187750 [TCP segment of a reassembled PDU]"
"191","2018-08-23 02:00:13.032054","192.168.2.3","216.58.197.4","TLSv1.2","212","Application Data"
"192","2018-08-23 02:00:13.032340","192.168.2.3","216.58.197.4","TCP","1434","34236  >  443 [ACK] Seq=117931 Ack=1051 Win=2363 Len=1368 TSval=7829515 TSecr=760187750 [TCP segment of a reassembled PDU]"
"193","2018-08-23 02:00:13.032343","192.168.2.3","216.58.197.4","TLSv1.2","155","Application Data"
"194","2018-08-23 02:00:13.032344","192.168.2.3","216.58.197.4","TCP","66","34236  >  443 [ACK] Seq=119388 Ack=1139 Win=2363 Len=0 TSval=7829516 TSecr=760187814"
"195","2018-08-23 02:00:13.032345","192.168.2.3","216.58.197.4","TCP","66","34236  >  443 [ACK] Seq=119388 Ack=1331 Win=2363 Len=0 TSval=7829516 TSecr=760187815"
"200","2018-08-23 02:00:13.038681","192.168.2.3","216.58.197.4","TCP","66","34236  >  443 [ACK] Seq=119388 Ack=1557 Win=2363 Len=0 TSval=7829516 TSecr=760187832"
"202","2018-08-23 02:00:13.067412","192.168.2.3","216.58.197.4","TCP","66","34236  >  443 [ACK] Seq=119388 Ack=1790 Win=2363 Len=0 TSval=7829519 TSecr=760187859"
"205","2018-08-23 02:00:13.091986","192.168.2.3","216.58.197.4","TCP","66","34236  >  443 [ACK] Seq=119388 Ack=1891 Win=2363 Len=0 TSval=7829522 TSecr=760187885"
"206","2018-08-23 02:00:13.092283","192.168.2.3","216.58.197.4","TCP","66","34236  >  443 [ACK] Seq=119388 Ack=1956 Win=2363 Len=0 TSval=7829522 TSecr=760187885"
"207","2018-08-23 02:00:13.139593","192.168.2.3","216.58.197.4","TCP","1434","34236  >  443 [ACK] Seq=119388 Ack=1956 Win=2363 Len=1368 TSval=7829526 TSecr=760187885 [TCP segment of a reassembled PDU]"
"208","2018-08-23 02:00:13.139599","192.168.2.3","216.58.197.4","TCP","1434","34236  >  443 [ACK] Seq=120756 Ack=1956 Win=2363 Len=1368 TSval=7829526 TSecr=760187885 [TCP segment of a reassembled PDU]"
"209","2018-08-23 02:00:13.139600","192.168.2.3","216.58.197.4","TLSv1.2","212","Application Data"
"210","2018-08-23 02:00:13.140268","192.168.2.3","216.58.197.4","TCP","1434","34236  >  443 [ACK] Seq=122270 Ack=1956 Win=2363 Len=1368 TSval=7829526 TSecr=760187885 [TCP segment of a reassembled PDU]"
"211","2018-08-23 02:00:13.140270","192.168.2.3","216.58.197.4","TLSv1.2","155","Application Data"
"217","2018-08-23 02:00:13.194229","192.168.2.3","216.58.197.4","TCP","66","34236  >  443 [ACK] Seq=123727 Ack=2089 Win=2363 Len=0 TSval=7829532 TSecr=760187986"
"218","2018-08-23 02:00:13.194420","192.168.2.3","216.58.197.4","TCP","66","34236  >  443 [ACK] Seq=123727 Ack=2335 Win=2363 Len=0 TSval=7829532 TSecr=760187986"
"219","2018-08-23 02:00:13.236977","192.168.2.3","216.58.197.4","TCP","1434","34236  >  443 [ACK] Seq=123727 Ack=2335 Win=2363 Len=1368 TSval=7829536 TSecr=760187986 [TCP segment of a reassembled PDU]"
"220","2018-08-23 02:00:13.236986","192.168.2.3","216.58.197.4","TCP","1434","34236  >  443 [ACK] Seq=125095 Ack=2335 Win=2363 Len=1368 TSval=7829536 TSecr=760187986 [TCP segment of a reassembled PDU]"
"221","2018-08-23 02:00:13.237080","192.168.2.3","216.58.197.4","TLSv1.2","212","Application Data"
"222","2018-08-23 02:00:13.237341","192.168.2.3","216.58.197.4","TCP","1434","34236  >  443 [ACK] Seq=126609 Ack=2335 Win=2363 Len=1368 TSval=7829536 TSecr=760187986 [TCP segment of a reassembled PDU]"
"223","2018-08-23 02:00:13.237343","192.168.2.3","216.58.197.4","TLSv1.2","155","Application Data"
"227","2018-08-23 02:00:13.314330","192.168.2.3","216.58.197.4","TCP","1434","34236  >  443 [ACK] Seq=128066 Ack=2335 Win=2363 Len=1368 TSval=7829544 TSecr=760188038 [TCP segment of a reassembled PDU]"
"228","2018-08-23 02:00:13.314652","192.168.2.3","216.58.197.4","TCP","1434","34236  >  443 [ACK] Seq=129434 Ack=2335 Win=2363 Len=1368 TSval=7829544 TSecr=760188038 [TCP segment of a reassembled PDU]"
"229","2018-08-23 02:00:13.314655","192.168.2.3","216.58.197.4","TLSv1.2","212","Application Data"
"230","2018-08-23 02:00:13.315018","192.168.2.3","216.58.197.4","TCP","1434","34236  >  443 [ACK] Seq=130948 Ack=2335 Win=2363 Len=1368 TSval=7829544 TSecr=760188038 [TCP segment of a reassembled PDU]"
"231","2018-08-23 02:00:13.315021","192.168.2.3","216.58.197.4","TLSv1.2","155","Application Data"
"237","2018-08-23 02:00:13.375435","192.168.2.3","216.58.197.4","TCP","66","34236  >  443 [ACK] Seq=132405 Ack=2696 Win=2363 Len=0 TSval=7829550 TSecr=760188170"
"238","2018-08-23 02:00:13.410567","192.168.2.3","216.58.197.4","TCP","1434","34236  >  443 [ACK] Seq=132405 Ack=2696 Win=2363 Len=1368 TSval=7829553 TSecr=760188170 [TCP segment of a reassembled PDU]"
"239","2018-08-23 02:00:13.410757","192.168.2.3","216.58.197.4","TCP","1434","34236  >  443 [ACK] Seq=133773 Ack=2696 Win=2363 Len=1368 TSval=7829553 TSecr=760188170 [TCP segment of a reassembled PDU]"
"240","2018-08-23 02:00:13.410760","192.168.2.3","216.58.197.4","TLSv1.2","212","Application Data"
"241","2018-08-23 02:00:13.410925","192.168.2.3","216.58.197.4","TCP","1434","34236  >  443 [ACK] Seq=135287 Ack=2696 Win=2363 Len=1368 TSval=7829553 TSecr=760188170 [TCP segment of a reassembled PDU]"
"242","2018-08-23 02:00:13.410927","192.168.2.3","216.58.197.4","TLSv1.2","155","Application Data"
"246","2018-08-23 02:00:13.475985","192.168.2.3","216.58.197.4","TCP","66","34236  >  443 [ACK] Seq=136744 Ack=3146 Win=2363 Len=0 TSval=7829560 TSecr=760188266"
"247","2018-08-23 02:00:13.505548","192.168.2.3","216.58.197.4","TCP","1434","34236  >  443 [ACK] Seq=136744 Ack=3146 Win=2363 Len=1368 TSval=7829563 TSecr=760188266 [TCP segment of a reassembled PDU]"
"248","2018-08-23 02:00:13.505557","192.168.2.3","216.58.197.4","TCP","1434","34236  >  443 [ACK] Seq=138112 Ack=3146 Win=2363 Len=1368 TSval=7829563 TSecr=760188266 [TCP segment of a reassembled PDU]"
"249","2018-08-23 02:00:13.505640","192.168.2.3","216.58.197.4","TLSv1.2","212","Application Data"
"250","2018-08-23 02:00:13.505811","192.168.2.3","216.58.197.4","TCP","1434","34236  >  443 [ACK] Seq=139626 Ack=3146 Win=2363 Len=1368 TSval=7829563 TSecr=760188266 [TCP segment of a reassembled PDU]"
"251","2018-08-23 02:00:13.505813","192.168.2.3","216.58.197.4","TLSv1.2","155","Application Data"
"255","2018-08-23 02:00:13.603413","192.168.2.3","216.58.197.4","TCP","1434","34236  >  443 [ACK] Seq=141083 Ack=3146 Win=2363 Len=1368 TSval=7829573 TSecr=760188306 [TCP segment of a reassembled PDU]"
"256","2018-08-23 02:00:13.603419","192.168.2.3","216.58.197.4","TCP","1434","34236  >  443 [ACK] Seq=142451 Ack=3146 Win=2363 Len=1368 TSval=7829573 TSecr=760188306 [TCP segment of a reassembled PDU]"
"257","2018-08-23 02:00:13.603420","192.168.2.3","216.58.197.4","TLSv1.2","212","Application Data"
"258","2018-08-23 02:00:13.603750","192.168.2.3","216.58.197.4","TCP","1434","34236  >  443 [ACK] Seq=143965 Ack=3146 Win=2363 Len=1368 TSval=7829573 TSecr=760188306 [TCP segment of a reassembled PDU]"
"259","2018-08-23 02:00:13.603753","192.168.2.3","216.58.197.4","TLSv1.2","155","Application Data"
"262","2018-08-23 02:00:13.685913","192.168.2.3","216.58.197.4","TCP","1434","34236  >  443 [ACK] Seq=145422 Ack=3146 Win=2363 Len=1368 TSval=7829581 TSecr=760188404 [TCP segment of a reassembled PDU]"
"263","2018-08-23 02:00:13.686375","192.168.2.3","216.58.197.4","TCP","1434","34236  >  443 [ACK] Seq=146790 Ack=3146 Win=2363 Len=1368 TSval=7829581 TSecr=760188404 [TCP segment of a reassembled PDU]"
"264","2018-08-23 02:00:13.686378","192.168.2.3","216.58.197.4","TLSv1.2","212","Application Data"
"265","2018-08-23 02:00:13.686738","192.168.2.3","216.58.197.4","TCP","1434","34236  >  443 [ACK] Seq=148304 Ack=3146 Win=2363 Len=1368 TSval=7829581 TSecr=760188404 [TCP segment of a reassembled PDU]"
"266","2018-08-23 02:00:13.686741","192.168.2.3","216.58.197.4","TLSv1.2","155","Application Data"
"272","2018-08-23 02:00:13.740299","192.168.2.3","216.58.197.4","TCP","66","34236  >  443 [ACK] Seq=149761 Ack=3469 Win=2363 Len=0 TSval=7829587 TSecr=760188535"
"273","2018-08-23 02:00:13.794268","192.168.2.3","216.58.197.4","TCP","1434","34236  >  443 [ACK] Seq=149761 Ack=3469 Win=2363 Len=1368 TSval=7829592 TSecr=760188535 [TCP segment of a reassembled PDU]"
"274","2018-08-23 02:00:13.794704","192.168.2.3","216.58.197.4","TCP","1434","34236  >  443 [ACK] Seq=151129 Ack=3469 Win=2363 Len=1368 TSval=7829592 TSecr=760188535 [TCP segment of a reassembled PDU]"
"275","2018-08-23 02:00:13.794708","192.168.2.3","216.58.197.4","TLSv1.2","212","Application Data"
"276","2018-08-23 02:00:13.795212","192.168.2.3","216.58.197.4","TCP","1434","34236  >  443 [ACK] Seq=152643 Ack=3469 Win=2363 Len=1368 TSval=7829592 TSecr=760188535 [TCP segment of a reassembled PDU]"
"277","2018-08-23 02:00:13.795215","192.168.2.3","216.58.197.4","TLSv1.2","155","Application Data"
"281","2018-08-23 02:00:13.881832","192.168.2.3","216.58.197.4","TCP","1434","34236  >  443 [ACK] Seq=154100 Ack=3469 Win=2363 Len=1368 TSval=7829600 TSecr=760188596 [TCP segment of a reassembled PDU]"
"282","2018-08-23 02:00:13.881837","192.168.2.3","216.58.197.4","TCP","1434","34236  >  443 [ACK] Seq=155468 Ack=3469 Win=2363 Len=1368 TSval=7829600 TSecr=760188596 [TCP segment of a reassembled PDU]"
"283","2018-08-23 02:00:13.881838","192.168.2.3","216.58.197.4","TLSv1.2","212","Application Data"
"284","2018-08-23 02:00:13.881989","192.168.2.3","216.58.197.4","TCP","1434","34236  >  443 [ACK] Seq=156982 Ack=3469 Win=2363 Len=1368 TSval=7829600 TSecr=760188596 [TCP segment of a reassembled PDU]"
"285","2018-08-23 02:00:13.882143","192.168.2.3","216.58.197.4","TLSv1.2","155","Application Data"
"291","2018-08-23 02:00:13.941019","192.168.2.3","216.58.197.4","TCP","66","34236  >  443 [ACK] Seq=158439 Ack=3975 Win=2363 Len=0 TSval=7829607 TSecr=760188734"
"292","2018-08-23 02:00:13.974157","192.168.2.3","216.58.197.4","TCP","1434","34236  >  443 [ACK] Seq=158439 Ack=3975 Win=2363 Len=1368 TSval=7829610 TSecr=760188734 [TCP segment of a reassembled PDU]"
"293","2018-08-23 02:00:13.974484","192.168.2.3","216.58.197.4","TCP","1434","34236  >  443 [ACK] Seq=159807 Ack=3975 Win=2363 Len=1368 TSval=7829610 TSecr=760188734 [TCP segment of a reassembled PDU]"
"294","2018-08-23 02:00:13.974487","192.168.2.3","216.58.197.4","TLSv1.2","212","Application Data"
"295","2018-08-23 02:00:13.974488","192.168.2.3","216.58.197.4","TCP","1434","34236  >  443 [ACK] Seq=161321 Ack=3975 Win=2363 Len=1368 TSval=7829610 TSecr=760188734 [TCP segment of a reassembled PDU]"
"296","2018-08-23 02:00:13.974648","192.168.2.3","216.58.197.4","TLSv1.2","155","Application Data"
"302","2018-08-23 02:00:14.063875","192.168.2.3","216.58.197.4","TCP","66","34236  >  443 [ACK] Seq=162778 Ack=4278 Win=2363 Len=0 TSval=7829619 TSecr=760188833"
"303","2018-08-23 02:00:14.088329","192.168.2.3","216.58.197.4","TCP","1434","34236  >  443 [ACK] Seq=162778 Ack=4278 Win=2363 Len=1368 TSval=7829621 TSecr=760188833 [TCP segment of a reassembled PDU]"
"304","2018-08-23 02:00:14.088513","192.168.2.3","216.58.197.4","TCP","1434","34236  >  443 [ACK] Seq=164146 Ack=4278 Win=2363 Len=1368 TSval=7829621 TSecr=760188833 [TCP segment of a reassembled PDU]"
"305","2018-08-23 02:00:14.088515","192.168.2.3","216.58.197.4","TLSv1.2","212","Application Data"
"306","2018-08-23 02:00:14.088782","192.168.2.3","216.58.197.4","TCP","1434","34236  >  443 [ACK] Seq=165660 Ack=4278 Win=2363 Len=1368 TSval=7829621 TSecr=760188833 [TCP segment of a reassembled PDU]"
"307","2018-08-23 02:00:14.088785","192.168.2.3","216.58.197.4","TLSv1.2","155","Application Data"
"313","2018-08-23 02:00:14.146683","192.168.2.3","216.58.197.4","TCP","66","34236  >  443 [ACK] Seq=167117 Ack=4637 Win=2363 Len=0 TSval=7829627 TSecr=760188942"
"314","2018-08-23 02:00:14.179201","192.168.2.3","216.58.197.4","TCP","1434","34236  >  443 [ACK] Seq=167117 Ack=4637 Win=2363 Len=1368 TSval=7829630 TSecr=760188942 [TCP segment of a reassembled PDU]"
"315","2018-08-23 02:00:14.179380","192.168.2.3","216.58.197.4","TCP","1434","34236  >  443 [ACK] Seq=168485 Ack=4637 Win=2363 Len=1368 TSval=7829630 TSecr=760188942 [TCP segment of a reassembled PDU]"
"316","2018-08-23 02:00:14.179382","192.168.2.3","216.58.197.4","TLSv1.2","212","Application Data"
"317","2018-08-23 02:00:14.179588","192.168.2.3","216.58.197.4","TCP","1434","34236  >  443 [ACK] Seq=169999 Ack=4637 Win=2363 Len=1368 TSval=7829630 TSecr=760188942 [TCP segment of a reassembled PDU]"
"318","2018-08-23 02:00:14.179590","192.168.2.3","216.58.197.4","TLSv1.2","155","Application Data"
"320","2018-08-23 02:00:14.309068","192.168.2.3","216.58.197.4","TCP","1434","34236  >  443 [ACK] Seq=171456 Ack=4637 Win=2363 Len=1368 TSval=7829642 TSecr=760188980 [TCP segment of a reassembled PDU]"
"321","2018-08-23 02:00:14.309365","192.168.2.3","216.58.197.4","TCP","1434","34236  >  443 [ACK] Seq=172824 Ack=4637 Win=2363 Len=1368 TSval=7829642 TSecr=760188980 [TCP segment of a reassembled PDU]"
"322","2018-08-23 02:00:14.309367","192.168.2.3","216.58.197.4","TLSv1.2","212","Application Data"
"323","2018-08-23 02:00:14.309368","192.168.2.3","216.58.197.4","TCP","1434","34236  >  443 [ACK] Seq=174338 Ack=4637 Win=2363 Len=1368 TSval=7829642 TSecr=760188980 [TCP segment of a reassembled PDU]"
"324","2018-08-23 02:00:14.309476","192.168.2.3","216.58.197.4","TLSv1.2","155","Application Data"
"328","2018-08-23 02:00:14.400084","192.168.2.3","216.58.197.4","TCP","1434","34236  >  443 [ACK] Seq=175795 Ack=4637 Win=2363 Len=1368 TSval=7829652 TSecr=760189110 [TCP segment of a reassembled PDU]"
"329","2018-08-23 02:00:14.400519","192.168.2.3","216.58.197.4","TCP","1434","34236  >  443 [ACK] Seq=177163 Ack=4637 Win=2363 Len=1368 TSval=7829652 TSecr=760189110 [TCP segment of a reassembled PDU]"
"330","2018-08-23 02:00:14.400522","192.168.2.3","216.58.197.4","TLSv1.2","212","Application Data"
"331","2018-08-23 02:00:14.400523","192.168.2.3","216.58.197.4","TCP","1434","34236  >  443 [ACK] Seq=178677 Ack=4637 Win=2363 Len=1368 TSval=7829653 TSecr=760189110 [TCP segment of a reassembled PDU]"
"332","2018-08-23 02:00:14.400663","192.168.2.3","216.58.197.4","TLSv1.2","155","Application Data"
"337","2018-08-23 02:00:14.489822","192.168.2.3","216.58.197.4","TCP","66","34236  >  443 [ACK] Seq=180134 Ack=4885 Win=2363 Len=0 TSval=7829662 TSecr=760189251"
"338","2018-08-23 02:00:14.517041","192.168.2.3","216.58.197.4","TCP","1434","34236  >  443 [ACK] Seq=180134 Ack=4885 Win=2363 Len=1368 TSval=7829664 TSecr=760189251 [TCP segment of a reassembled PDU]"
"339","2018-08-23 02:00:14.517394","192.168.2.3","216.58.197.4","TCP","1434","34236  >  443 [ACK] Seq=181502 Ack=4885 Win=2363 Len=1368 TSval=7829664 TSecr=760189251 [TCP segment of a reassembled PDU]"
"340","2018-08-23 02:00:14.517398","192.168.2.3","216.58.197.4","TLSv1.2","212","Application Data"
"341","2018-08-23 02:00:14.517959","192.168.2.3","216.58.197.4","TCP","1434","34236  >  443 [ACK] Seq=183016 Ack=4885 Win=2363 Len=1368 TSval=7829664 TSecr=760189251 [TCP segment of a reassembled PDU]"
"342","2018-08-23 02:00:14.517962","192.168.2.3","216.58.197.4","TLSv1.2","155","Application Data"
"348","2018-08-23 02:00:14.568268","192.168.2.3","216.58.197.4","TCP","66","34236  >  443 [ACK] Seq=184473 Ack=5008 Win=2363 Len=0 TSval=7829669 TSecr=760189363"
"349","2018-08-23 02:00:14.568463","192.168.2.3","216.58.197.4","TCP","66","34236  >  443 [ACK] Seq=184473 Ack=5240 Win=2363 Len=0 TSval=7829669 TSecr=760189364"
"350","2018-08-23 02:00:14.611792","192.168.2.3","216.58.197.4","TCP","1434","34236  >  443 [ACK] Seq=184473 Ack=5240 Win=2363 Len=1368 TSval=7829674 TSecr=760189364 [TCP segment of a reassembled PDU]"
"351","2018-08-23 02:00:14.612231","192.168.2.3","216.58.197.4","TCP","1434","34236  >  443 [ACK] Seq=185841 Ack=5240 Win=2363 Len=1368 TSval=7829674 TSecr=760189364 [TCP segment of a reassembled PDU]"
"352","2018-08-23 02:00:14.612235","192.168.2.3","216.58.197.4","TLSv1.2","212","Application Data"
"353","2018-08-23 02:00:14.612546","192.168.2.3","216.58.197.4","TCP","1434","34236  >  443 [ACK] Seq=187355 Ack=5240 Win=2363 Len=1368 TSval=7829674 TSecr=760189364 [TCP segment of a reassembled PDU]"
"354","2018-08-23 02:00:14.612550","192.168.2.3","216.58.197.4","TLSv1.2","155","Application Data"
"358","2018-08-23 02:00:14.722094","192.168.2.3","216.58.197.4","TCP","1434","34236  >  443 [ACK] Seq=188812 Ack=5240 Win=2363 Len=1368 TSval=7829685 TSecr=760189413 [TCP segment of a reassembled PDU]"
"359","2018-08-23 02:00:14.722443","192.168.2.3","216.58.197.4","TCP","1434","34236  >  443 [ACK] Seq=190180 Ack=5240 Win=2363 Len=1368 TSval=7829685 TSecr=760189413 [TCP segment of a reassembled PDU]"
"360","2018-08-23 02:00:14.722446","192.168.2.3","216.58.197.4","TLSv1.2","212","Application Data"
"361","2018-08-23 02:00:14.722447","192.168.2.3","216.58.197.4","TCP","1434","34236  >  443 [ACK] Seq=191694 Ack=5240 Win=2363 Len=1368 TSval=7829685 TSecr=760189413 [TCP segment of a reassembled PDU]"
"362","2018-08-23 02:00:14.722697","192.168.2.3","216.58.197.4","TLSv1.2","155","Application Data"
"368","2018-08-23 02:00:14.779469","192.168.2.3","216.58.197.4","TCP","66","34236  >  443 [ACK] Seq=193151 Ack=5642 Win=2363 Len=0 TSval=7829690 TSecr=760189573"
"369","2018-08-23 02:00:14.837853","192.168.2.3","216.58.197.4","TCP","1434","34236  >  443 [ACK] Seq=193151 Ack=5642 Win=2363 Len=1368 TSval=7829696 TSecr=760189573 [TCP segment of a reassembled PDU]"
"370","2018-08-23 02:00:14.837858","192.168.2.3","216.58.197.4","TCP","1434","34236  >  443 [ACK] Seq=194519 Ack=5642 Win=2363 Len=1368 TSval=7829696 TSecr=760189573 [TCP segment of a reassembled PDU]"
"371","2018-08-23 02:00:14.838224","192.168.2.3","216.58.197.4","TLSv1.2","212","Application Data"
"372","2018-08-23 02:00:14.838226","192.168.2.3","216.58.197.4","TCP","1434","34236  >  443 [ACK] Seq=196033 Ack=5642 Win=2363 Len=1368 TSval=7829696 TSecr=760189573 [TCP segment of a reassembled PDU]"
"373","2018-08-23 02:00:14.838227","192.168.2.3","216.58.197.4","TLSv1.2","155","Application Data"
"379","2018-08-23 02:00:14.886912","192.168.2.3","216.58.197.4","TCP","66","34236  >  443 [ACK] Seq=197490 Ack=5847 Win=2363 Len=0 TSval=7829701 TSecr=760189682"
"380","2018-08-23 02:00:14.887432","192.168.2.3","216.58.197.4","TCP","66","34236  >  443 [ACK] Seq=197490 Ack=6061 Win=2363 Len=0 TSval=7829701 TSecr=760189682"
"381","2018-08-23 02:00:14.912794","192.168.2.3","216.58.197.4","TCP","1434","34236  >  443 [ACK] Seq=197490 Ack=6061 Win=2363 Len=1368 TSval=7829704 TSecr=760189682 [TCP segment of a reassembled PDU]"
"382","2018-08-23 02:00:14.913094","192.168.2.3","216.58.197.4","TCP","1434","34236  >  443 [ACK] Seq=198858 Ack=6061 Win=2363 Len=1368 TSval=7829704 TSecr=760189682 [TCP segment of a reassembled PDU]"
"383","2018-08-23 02:00:14.913099","192.168.2.3","216.58.197.4","TLSv1.2","212","Application Data"
"384","2018-08-23 02:00:14.913100","192.168.2.3","216.58.197.4","TLSv1.2","634","Application Data"
"385","2018-08-23 02:00:14.913100","192.168.2.3","216.58.197.4","TLSv1.2","102","Application Data"
"390","2018-08-23 02:00:15.012083","192.168.2.3","216.58.197.4","TCP","66","34236  >  443 [ACK] Seq=200976 Ack=7078 Win=2363 Len=0 TSval=7829714 TSecr=760189788"
"393","2018-08-23 02:00:15.066928","192.168.2.3","216.58.197.4","TCP","66","34236  >  443 [ACK] Seq=200976 Ack=7347 Win=2363 Len=0 TSval=7829719 TSecr=760189836"
"396","2018-08-23 02:00:16.066708","192.168.2.3","216.58.197.4","TCP","66","34236  >  443 [ACK] Seq=200976 Ack=7492 Win=2363 Len=0 TSval=7829819 TSecr=760190837"
"398","2018-08-23 02:00:16.860373","192.168.2.3","216.58.197.4","TCP","66","34236  >  443 [ACK] Seq=200976 Ack=7663 Win=2363 Len=0 TSval=7829899 TSecr=760191620"
"401","2018-08-23 02:00:16.881078","192.168.2.3","216.58.197.4","TCP","66","34236  >  443 [ACK] Seq=200976 Ack=9081 Win=2363 Len=0 TSval=7829901 TSecr=760191673"
"402","2018-08-23 02:00:16.881320","192.168.2.3","216.58.197.4","TCP","66","34236  >  443 [ACK] Seq=200976 Ack=9179 Win=2363 Len=0 TSval=7829901 TSecr=760191673"
"404","2018-08-23 02:00:17.043123","192.168.2.3","216.58.197.4","TCP","66","34236  >  443 [ACK] Seq=200976 Ack=9235 Win=2363 Len=0 TSval=7829917 TSecr=760191838"
"406","2018-08-23 02:00:17.066577","192.168.2.3","216.58.197.4","TCP","66","34236  >  443 [ACK] Seq=200976 Ack=9423 Win=2363 Len=0 TSval=7829919 TSecr=760191861"
"419","2018-08-23 02:00:17.417666","192.168.2.3","216.58.197.4","TCP","66","34236  >  443 [ACK] Seq=200976 Ack=10841 Win=2363 Len=0 TSval=7829954 TSecr=760192211"
"420","2018-08-23 02:00:17.417669","192.168.2.3","216.58.197.4","TCP","66","34236  >  443 [ACK] Seq=200976 Ack=11224 Win=2363 Len=0 TSval=7829954 TSecr=760192211"
"421","2018-08-23 02:00:17.419064","192.168.2.3","216.58.197.4","TCP","66","34236  >  443 [ACK] Seq=200976 Ack=12642 Win=2363 Len=0 TSval=7829954 TSecr=760192211"
"422","2018-08-23 02:00:17.419995","192.168.2.3","216.58.197.4","TCP","66","34236  >  443 [ACK] Seq=200976 Ack=12987 Win=2363 Len=0 TSval=7829954 TSecr=760192211"
"423","2018-08-23 02:00:17.419998","192.168.2.3","216.58.197.4","TCP","66","34236  >  443 [ACK] Seq=200976 Ack=14405 Win=2356 Len=0 TSval=7829954 TSecr=760192211"
"424","2018-08-23 02:00:17.419999","192.168.2.3","216.58.197.4","TCP","66","34236  >  443 [ACK] Seq=200976 Ack=14908 Win=2356 Len=0 TSval=7829954 TSecr=760192211"
"425","2018-08-23 02:00:17.420000","192.168.2.3","216.58.197.4","TCP","66","34236  >  443 [ACK] Seq=200976 Ack=16666 Win=2363 Len=0 TSval=7829955 TSecr=760192212"
"426","2018-08-23 02:00:17.420637","192.168.2.3","216.58.197.4","TCP","66","34236  >  443 [ACK] Seq=200976 Ack=18477 Win=2363 Len=0 TSval=7829955 TSecr=760192212"
"427","2018-08-23 02:00:17.420828","192.168.2.3","216.58.197.4","TCP","66","34236  >  443 [ACK] Seq=200976 Ack=20204 Win=2363 Len=0 TSval=7829955 TSecr=760192213"
"430","2018-08-23 02:00:17.450414","192.168.2.3","216.58.197.4","TCP","66","34236  >  443 [ACK] Seq=200976 Ack=21622 Win=2363 Len=0 TSval=7829958 TSecr=760192245"
"431","2018-08-23 02:00:17.450574","192.168.2.3","216.58.197.4","TCP","66","34236  >  443 [ACK] Seq=200976 Ack=22111 Win=2363 Len=0 TSval=7829958 TSecr=760192245"
"436","2018-08-23 02:00:17.453218","192.168.2.3","216.58.197.4","TCP","66","34236  >  443 [ACK] Seq=200976 Ack=23529 Win=2363 Len=0 TSval=7829958 TSecr=760192248"
"439","2018-08-23 02:00:17.453490","192.168.2.3","216.58.197.4","TCP","66","34236  >  443 [ACK] Seq=200976 Ack=23855 Win=2363 Len=0 TSval=7829958 TSecr=760192248"
"440","2018-08-23 02:00:17.454114","192.168.2.3","216.58.197.4","TCP","66","34236  >  443 [ACK] Seq=200976 Ack=25738 Win=2363 Len=0 TSval=7829958 TSecr=760192248"
"441","2018-08-23 02:00:17.454551","192.168.2.3","216.58.197.4","TCP","66","34236  >  443 [ACK] Seq=200976 Ack=27499 Win=2363 Len=0 TSval=7829958 TSecr=760192249"
"446","2018-08-23 02:00:17.456363","192.168.2.3","216.58.197.4","TCP","66","34236  >  443 [ACK] Seq=200976 Ack=29376 Win=2363 Len=0 TSval=7829958 TSecr=760192251"
"452","2018-08-23 02:00:17.456869","192.168.2.3","216.58.197.4","TCP","66","34236  >  443 [ACK] Seq=200976 Ack=31205 Win=2363 Len=0 TSval=7829958 TSecr=760192251"
"455","2018-08-23 02:00:17.458314","192.168.2.3","216.58.197.4","TCP","66","34236  >  443 [ACK] Seq=200976 Ack=32979 Win=2363 Len=0 TSval=7829958 TSecr=760192252"
"456","2018-08-23 02:00:17.458965","192.168.2.3","216.58.197.4","TCP","66","34236  >  443 [ACK] Seq=200976 Ack=35815 Win=2363 Len=0 TSval=7829958 TSecr=760192252"
"457","2018-08-23 02:00:17.459366","192.168.2.3","216.58.197.4","TCP","66","34236  >  443 [ACK] Seq=200976 Ack=37775 Win=2363 Len=0 TSval=7829958 TSecr=760192252"
"462","2018-08-23 02:00:17.460458","192.168.2.3","216.58.197.4","TCP","66","34236  >  443 [ACK] Seq=200976 Ack=38112 Win=2363 Len=0 TSval=7829959 TSecr=760192254"
"475","2018-08-23 02:00:17.467619","192.168.2.3","216.58.197.4","TCP","66","34236  >  443 [ACK] Seq=200976 Ack=40037 Win=2363 Len=0 TSval=7829959 TSecr=760192256"
"476","2018-08-23 02:00:17.467621","192.168.2.3","216.58.197.4","TCP","66","34236  >  443 [ACK] Seq=200976 Ack=41941 Win=2363 Len=0 TSval=7829959 TSecr=760192256"
"477","2018-08-23 02:00:17.469359","192.168.2.3","216.58.197.4","TCP","66","34236  >  443 [ACK] Seq=200976 Ack=43825 Win=2363 Len=0 TSval=7829959 TSecr=760192257"
"478","2018-08-23 02:00:17.469361","192.168.2.3","216.58.197.4","TCP","66","34236  >  443 [ACK] Seq=200976 Ack=45671 Win=2363 Len=0 TSval=7829959 TSecr=760192259"
"479","2018-08-23 02:00:17.469936","192.168.2.3","216.58.197.4","TCP","66","34236  >  443 [ACK] Seq=200976 Ack=47448 Win=2363 Len=0 TSval=7829959 TSecr=760192259"
"480","2018-08-23 02:00:17.470549","192.168.2.3","216.58.197.4","TCP","66","34236  >  443 [ACK] Seq=200976 Ack=53121 Win=2363 Len=0 TSval=7829960 TSecr=760192260"
"487","2018-08-23 02:00:17.485333","192.168.2.3","216.58.197.4","TCP","66","34236  >  443 [ACK] Seq=200976 Ack=55051 Win=2363 Len=0 TSval=7829961 TSecr=760192279"
"492","2018-08-23 02:00:17.486328","192.168.2.3","216.58.197.4","TCP","66","34236  >  443 [ACK] Seq=200976 Ack=56866 Win=2363 Len=0 TSval=7829961 TSecr=760192279"
"493","2018-08-23 02:00:17.486582","192.168.2.3","216.58.197.4","TCP","66","34236  >  443 [ACK] Seq=200976 Ack=58674 Win=2363 Len=0 TSval=7829961 TSecr=760192280"
"496","2018-08-23 02:00:17.488057","192.168.2.3","216.58.197.4","TCP","66","34236  >  443 [ACK] Seq=200976 Ack=60375 Win=2363 Len=0 TSval=7829961 TSecr=760192282"
"501","2018-08-23 02:00:17.489094","192.168.2.3","216.58.197.4","TCP","66","34236  >  443 [ACK] Seq=200976 Ack=62145 Win=2363 Len=0 TSval=7829961 TSecr=760192282"
"502","2018-08-23 02:00:17.489097","192.168.2.3","216.58.197.4","TCP","66","34236  >  443 [ACK] Seq=200976 Ack=63983 Win=2363 Len=0 TSval=7829961 TSecr=760192283"
"525","2018-08-23 02:00:17.500218","192.168.2.3","216.58.197.4","TCP","66","34236  >  443 [ACK] Seq=200976 Ack=65693 Win=2363 Len=0 TSval=7829961 TSecr=760192284"
"526","2018-08-23 02:00:17.500221","192.168.2.3","216.58.197.4","TCP","66","34236  >  443 [ACK] Seq=200976 Ack=67610 Win=2363 Len=0 TSval=7829962 TSecr=760192284"
"527","2018-08-23 02:00:17.500222","192.168.2.3","216.58.197.4","TCP","66","34236  >  443 [ACK] Seq=200976 Ack=69371 Win=2363 Len=0 TSval=7829962 TSecr=760192286"
"528","2018-08-23 02:00:17.500223","192.168.2.3","216.58.197.4","TCP","66","34236  >  443 [ACK] Seq=200976 Ack=71156 Win=2363 Len=0 TSval=7829962 TSecr=760192286"
"529","2018-08-23 02:00:17.500224","192.168.2.3","216.58.197.4","TCP","66","34236  >  443 [ACK] Seq=200976 Ack=74649 Win=2363 Len=0 TSval=7829962 TSecr=760192287"
"530","2018-08-23 02:00:17.500225","192.168.2.3","216.58.197.4","TCP","66","34236  >  443 [ACK] Seq=200976 Ack=76534 Win=2363 Len=0 TSval=7829962 TSecr=760192288"
"531","2018-08-23 02:00:17.500226","192.168.2.3","216.58.197.4","TCP","66","34236  >  443 [ACK] Seq=200976 Ack=79528 Win=2363 Len=0 TSval=7829962 TSecr=760192289"
"532","2018-08-23 02:00:17.500227","192.168.2.3","216.58.197.4","TCP","66","34236  >  443 [ACK] Seq=200976 Ack=79756 Win=2363 Len=0 TSval=7829962 TSecr=760192291"
"533","2018-08-23 02:00:17.500228","192.168.2.3","216.58.197.4","TCP","66","34236  >  443 [ACK] Seq=200976 Ack=80072 Win=2363 Len=0 TSval=7829963 TSecr=760192291"
"534","2018-08-23 02:00:17.500606","192.168.2.3","216.58.197.4","TCP","66","34236  >  443 [ACK] Seq=200976 Ack=80305 Win=2363 Len=0 TSval=7829963 TSecr=760192292"
"535","2018-08-23 02:00:17.501712","192.168.2.3","216.58.197.4","TLSv1.2","104","Application Data"
"538","2018-08-23 02:00:21.789958","192.168.2.3","216.58.197.14","TCP","66","41142  >  443 [ACK] Seq=1 Ack=1 Win=631 Len=0 TSval=7830392 TSecr=933160272"
"541","2018-08-23 02:00:27.310032","192.168.2.3","216.58.197.14","TCP","66","41148  >  443 [ACK] Seq=1 Ack=1 Win=296 Len=0 TSval=7830944 TSecr=2852372497"
"550","2018-08-23 02:00:32.712652","192.168.2.3","216.58.197.14","TLSv1.2","156","[TCP Previous segment not captured] , Application Data"
"551","2018-08-23 02:00:32.712657","192.168.2.3","216.58.197.14","TLSv1.2","104","Application Data"
"552","2018-08-23 02:00:32.712737","192.168.2.3","216.58.197.14","TLSv1.2","581","Application Data"
"557","2018-08-23 02:00:32.752113","192.168.2.3","216.58.197.14","TCP","66","41142  >  443 [ACK] Seq=645 Ack=39 Win=631 Len=0 TSval=7831488 TSecr=933216248"
"562","2018-08-23 02:00:32.803329","192.168.2.3","216.58.197.14","TCP","66","41142  >  443 [ACK] Seq=645 Ack=107 Win=631 Len=0 TSval=7831493 TSecr=933216332"
"563","2018-08-23 02:00:32.803674","192.168.2.3","216.58.197.14","TCP","66","41142  >  443 [ACK] Seq=645 Ack=176 Win=631 Len=0 TSval=7831493 TSecr=933216332"
"564","2018-08-23 02:00:32.803760","192.168.2.3","216.58.197.14","TCP","66","41142  >  443 [ACK] Seq=645 Ack=434 Win=647 Len=0 TSval=7831493 TSecr=933216332"
"565","2018-08-23 02:00:32.804075","192.168.2.3","216.58.197.14","TCP","66","41142  >  443 [ACK] Seq=645 Ack=472 Win=647 Len=0 TSval=7831493 TSecr=933216332"
"566","2018-08-23 02:00:32.804880","192.168.2.3","216.58.197.14","TLSv1.2","104","Application Data"
