"No.","Time","Source","Destination","Protocol","Length","Info"
"1","2018-08-23 02:01:12.920366","192.168.2.3","216.58.197.4","TLSv1.2","157","Application Data"
"2","2018-08-23 02:01:12.920371","192.168.2.3","216.58.197.4","TLSv1.2","104","Application Data"
"3","2018-08-23 02:01:12.920878","192.168.2.3","216.58.197.4","TLSv1.2","159","Application Data"
"8","2018-08-23 02:01:12.931062","192.168.2.3","216.58.197.4","TCP","1434","34236  >  443 [ACK] Seq=223 Ack=39 Win=2363 Len=1368 TSval=7835505 TSecr=760247722 [TCP segment of a reassembled PDU]"
"9","2018-08-23 02:01:12.931067","192.168.2.3","216.58.197.4","TCP","1434","34236  >  443 [ACK] Seq=1591 Ack=39 Win=2363 Len=1368 TSval=7835505 TSecr=760247722 [TCP segment of a reassembled PDU]"
"10","2018-08-23 02:01:12.931068","192.168.2.3","216.58.197.4","TLSv1.2","212","Application Data"
"11","2018-08-23 02:01:12.931646","192.168.2.3","216.58.197.4","TCP","1434","34236  >  443 [ACK] Seq=3105 Ack=39 Win=2363 Len=1368 TSval=7835506 TSecr=760247722 [TCP segment of a reassembled PDU]"
"12","2018-08-23 02:01:12.931650","192.168.2.3","216.58.197.4","TLSv1.2","223","Application Data"
"13","2018-08-23 02:01:12.931651","192.168.2.3","216.58.197.4","TCP","1434","34236  >  443 [ACK] Seq=4630 Ack=39 Win=2363 Len=1368 TSval=7835506 TSecr=760247722 [TCP segment of a reassembled PDU]"
"14","2018-08-23 02:01:12.931823","192.168.2.3","216.58.197.4","TCP","1434","34236  >  443 [ACK] Seq=5998 Ack=39 Win=2363 Len=1368 TSval=7835506 TSecr=760247722 [TCP segment of a reassembled PDU]"
"15","2018-08-23 02:01:12.932094","192.168.2.3","216.58.197.4","TLSv1.2","212","Application Data"
"16","2018-08-23 02:01:12.932537","192.168.2.3","216.58.197.4","TCP","1434","34236  >  443 [ACK] Seq=7512 Ack=39 Win=2363 Len=1368 TSval=7835506 TSecr=760247722 [TCP segment of a reassembled PDU]"
"17","2018-08-23 02:01:12.932540","192.168.2.3","216.58.197.4","TCP","1434","34236  >  443 [ACK] Seq=8880 Ack=39 Win=2363 Len=1368 TSval=7835506 TSecr=760247722 [TCP segment of a reassembled PDU]"
"22","2018-08-23 02:01:12.937033","192.168.2.3","216.58.197.4","TLSv1.2","1434","Application Data [TCP segment of a reassembled PDU]"
"23","2018-08-23 02:01:12.937263","192.168.2.3","216.58.197.4","TCP","1434","34236  >  443 [ACK] Seq=11616 Ack=39 Win=2363 Len=1368 TSval=7835506 TSecr=760247731 [TCP segment of a reassembled PDU]"
"24","2018-08-23 02:01:12.937266","192.168.2.3","216.58.197.4","TLSv1.2","1434","Application Data [TCP segment of a reassembled PDU]"
"25","2018-08-23 02:01:12.937683","192.168.2.3","216.58.197.4","TCP","1434","34236  >  443 [ACK] Seq=14352 Ack=39 Win=2363 Len=1368 TSval=7835506 TSecr=760247731 [TCP segment of a reassembled PDU]"
"26","2018-08-23 02:01:12.937956","192.168.2.3","216.58.197.4","TLSv1.2","1434","Application Data [TCP segment of a reassembled PDU]"
"27","2018-08-23 02:01:12.937958","192.168.2.3","216.58.197.4","TCP","1434","34236  >  443 [ACK] Seq=17088 Ack=39 Win=2363 Len=1368 TSval=7835506 TSecr=760247732 [TCP segment of a reassembled PDU]"
"28","2018-08-23 02:01:12.938322","192.168.2.3","216.58.197.4","TLSv1.2","1434","Application Data [TCP segment of a reassembled PDU]"
"29","2018-08-23 02:01:12.938492","192.168.2.3","216.58.197.4","TCP","1434","34236  >  443 [ACK] Seq=19824 Ack=39 Win=2363 Len=1368 TSval=7835506 TSecr=760247732 [TCP segment of a reassembled PDU]"
"33","2018-08-23 02:01:12.942339","192.168.2.3","216.58.197.4","TLSv1.2","1434","Application Data, Application Data"
"35","2018-08-23 02:01:12.942497","192.168.2.3","216.58.197.4","TCP","1434","34236  >  443 [ACK] Seq=22560 Ack=39 Win=2363 Len=1368 TSval=7835506 TSecr=760247732 [TCP segment of a reassembled PDU]"
"36","2018-08-23 02:01:12.944949","192.168.2.3","216.58.197.4","TLSv1.2","1434","Application Data [TCP segment of a reassembled PDU]"
"37","2018-08-23 02:01:12.945136","192.168.2.3","216.58.197.4","TLSv1.2","1434","Application Data [TCP segment of a reassembled PDU]"
"38","2018-08-23 02:01:12.945353","192.168.2.3","216.58.197.4","TCP","1434","34236  >  443 [ACK] Seq=26664 Ack=39 Win=2363 Len=1368 TSval=7835507 TSecr=760247733 [TCP segment of a reassembled PDU]"
"39","2018-08-23 02:01:12.945500","192.168.2.3","216.58.197.4","TLSv1.2","1434","Application Data [TCP segment of a reassembled PDU]"
"40","2018-08-23 02:01:12.945762","192.168.2.3","216.58.197.4","TCP","1434","34236  >  443 [ACK] Seq=29400 Ack=39 Win=2363 Len=1368 TSval=7835507 TSecr=760247737 [TCP segment of a reassembled PDU]"
"41","2018-08-23 02:01:12.945765","192.168.2.3","216.58.197.4","TLSv1.2","1434","Application Data [TCP segment of a reassembled PDU]"
"42","2018-08-23 02:01:12.946013","192.168.2.3","216.58.197.4","TCP","1434","34236  >  443 [ACK] Seq=32136 Ack=39 Win=2363 Len=1368 TSval=7835507 TSecr=760247738 [TCP segment of a reassembled PDU]"
"43","2018-08-23 02:01:12.946239","192.168.2.3","216.58.197.4","TCP","1434","34236  >  443 [ACK] Seq=33504 Ack=39 Win=2363 Len=1368 TSval=7835507 TSecr=760247738 [TCP segment of a reassembled PDU]"
"44","2018-08-23 02:01:12.946400","192.168.2.3","216.58.197.4","TLSv1.2","1434","Application Data [TCP segment of a reassembled PDU]"
"46","2018-08-23 02:01:12.946636","192.168.2.3","216.58.197.4","TCP","1434","34236  >  443 [ACK] Seq=36240 Ack=39 Win=2363 Len=1368 TSval=7835507 TSecr=760247738 [TCP segment of a reassembled PDU]"
"47","2018-08-23 02:01:12.946639","192.168.2.3","216.58.197.4","TLSv1.2","1434","Application Data [TCP segment of a reassembled PDU]"
"48","2018-08-23 02:01:12.947095","192.168.2.3","216.58.197.4","TCP","1434","34236  >  443 [ACK] Seq=38976 Ack=39 Win=2363 Len=1368 TSval=7835507 TSecr=760247738 [TCP segment of a reassembled PDU]"
"49","2018-08-23 02:01:12.947661","192.168.2.3","216.58.197.4","TLSv1.2","1434","Application Data [TCP segment of a reassembled PDU]"
"50","2018-08-23 02:01:12.947860","192.168.2.3","216.58.197.4","TLSv1.2","1434","Application Data [TCP segment of a reassembled PDU]"
"51","2018-08-23 02:01:12.948033","192.168.2.3","216.58.197.4","TCP","1434","34236  >  443 [ACK] Seq=43080 Ack=39 Win=2363 Len=1368 TSval=7835507 TSecr=760247739 [TCP segment of a reassembled PDU]"
"52","2018-08-23 02:01:12.948471","192.168.2.3","216.58.197.4","TLSv1.2","1434","Application Data [TCP segment of a reassembled PDU]"
"53","2018-08-23 02:01:12.948816","192.168.2.3","216.58.197.4","TCP","1434","34236  >  443 [ACK] Seq=45816 Ack=39 Win=2363 Len=1368 TSval=7835507 TSecr=760247743 [TCP segment of a reassembled PDU]"
"54","2018-08-23 02:01:12.949059","192.168.2.3","216.58.197.4","TCP","1434","34236  >  443 [ACK] Seq=47184 Ack=39 Win=2363 Len=1368 TSval=7835507 TSecr=760247743 [TCP segment of a reassembled PDU]"
"60","2018-08-23 02:01:12.950649","192.168.2.3","216.58.197.4","TLSv1.2","1434","Application Data [TCP segment of a reassembled PDU]"
"61","2018-08-23 02:01:12.950652","192.168.2.3","216.58.197.4","TCP","1434","34236  >  443 [PSH, ACK] Seq=49920 Ack=39 Win=2363 Len=1368 TSval=7835507 TSecr=760247745 [TCP segment of a reassembled PDU]"
"64","2018-08-23 02:01:12.952152","192.168.2.3","216.58.197.4","TLSv1.2","1434","Application Data [TCP segment of a reassembled PDU]"
"65","2018-08-23 02:01:12.952155","192.168.2.3","216.58.197.4","TCP","1434","34236  >  443 [ACK] Seq=52656 Ack=39 Win=2363 Len=1368 TSval=7835508 TSecr=760247746 [TCP segment of a reassembled PDU]"
"66","2018-08-23 02:01:12.952157","192.168.2.3","216.58.197.4","TLSv1.2","1434","Application Data [TCP segment of a reassembled PDU]"
"68","2018-08-23 02:01:12.952475","192.168.2.3","216.58.197.4","TCP","1434","34236  >  443 [ACK] Seq=55392 Ack=39 Win=2363 Len=1368 TSval=7835508 TSecr=760247746 [TCP segment of a reassembled PDU]"
"69","2018-08-23 02:01:12.952479","192.168.2.3","216.58.197.4","TLSv1.2","1434","Application Data [TCP segment of a reassembled PDU]"
"70","2018-08-23 02:01:12.952664","192.168.2.3","216.58.197.4","TLSv1.2","1112","Application Data"
"76","2018-08-23 02:01:12.993873","192.168.2.3","216.58.197.4","TCP","1434","34236  >  443 [ACK] Seq=59174 Ack=39 Win=2363 Len=1368 TSval=7835512 TSecr=760247753 [TCP segment of a reassembled PDU]"
"77","2018-08-23 02:01:12.994068","192.168.2.3","216.58.197.4","TCP","1434","34236  >  443 [ACK] Seq=60542 Ack=39 Win=2363 Len=1368 TSval=7835512 TSecr=760247753 [TCP segment of a reassembled PDU]"
"78","2018-08-23 02:01:12.994070","192.168.2.3","216.58.197.4","TLSv1.2","212","Application Data"
"79","2018-08-23 02:01:12.994071","192.168.2.3","216.58.197.4","TCP","1434","34236  >  443 [ACK] Seq=62056 Ack=39 Win=2363 Len=1368 TSval=7835512 TSecr=760247753 [TCP segment of a reassembled PDU]"
"80","2018-08-23 02:01:12.994215","192.168.2.3","216.58.197.4","TLSv1.2","155","Application Data"
"85","2018-08-23 02:01:13.108311","192.168.2.3","216.58.197.4","TCP","1434","34236  >  443 [ACK] Seq=63513 Ack=39 Win=2363 Len=1368 TSval=7835523 TSecr=760247794 [TCP segment of a reassembled PDU]"
"86","2018-08-23 02:01:13.108316","192.168.2.3","216.58.197.4","TCP","1434","34236  >  443 [ACK] Seq=64881 Ack=39 Win=2363 Len=1368 TSval=7835523 TSecr=760247794 [TCP segment of a reassembled PDU]"
"87","2018-08-23 02:01:13.108518","192.168.2.3","216.58.197.4","TLSv1.2","212","Application Data"
"88","2018-08-23 02:01:13.108519","192.168.2.3","216.58.197.4","TLSv1.2","1299","Application Data"
"91","2018-08-23 02:01:13.206641","192.168.2.3","216.58.197.4","TCP","1434","34236  >  443 [ACK] Seq=67628 Ack=39 Win=2363 Len=1368 TSval=7835533 TSecr=760247909 [TCP segment of a reassembled PDU]"
"92","2018-08-23 02:01:13.207043","192.168.2.3","216.58.197.4","TCP","1434","34236  >  443 [ACK] Seq=68996 Ack=39 Win=2363 Len=1368 TSval=7835533 TSecr=760247909 [TCP segment of a reassembled PDU]"
"93","2018-08-23 02:01:13.207046","192.168.2.3","216.58.197.4","TLSv1.2","212","Application Data"
"94","2018-08-23 02:01:13.207047","192.168.2.3","216.58.197.4","TCP","1434","34236  >  443 [ACK] Seq=70510 Ack=39 Win=2363 Len=1368 TSval=7835533 TSecr=760247909 [TCP segment of a reassembled PDU]"
"95","2018-08-23 02:01:13.207333","192.168.2.3","216.58.197.4","TLSv1.2","155","Application Data"
"102","2018-08-23 02:01:13.277604","192.168.2.3","216.58.197.4","TCP","66","34236  >  443 [ACK] Seq=71967 Ack=336 Win=2363 Len=0 TSval=7835540 TSecr=760248067"
"103","2018-08-23 02:01:13.310705","192.168.2.3","216.58.197.4","TCP","66","34236  >  443 [ACK] Seq=71967 Ack=568 Win=2363 Len=0 TSval=7835544 TSecr=760248072"
"104","2018-08-23 02:01:13.315379","192.168.2.3","216.58.197.4","TCP","1434","34236  >  443 [ACK] Seq=71967 Ack=568 Win=2363 Len=1368 TSval=7835544 TSecr=760248072 [TCP segment of a reassembled PDU]"
"105","2018-08-23 02:01:13.315697","192.168.2.3","216.58.197.4","TCP","1434","34236  >  443 [ACK] Seq=73335 Ack=568 Win=2363 Len=1368 TSval=7835544 TSecr=760248072 [TCP segment of a reassembled PDU]"
"106","2018-08-23 02:01:13.315702","192.168.2.3","216.58.197.4","TLSv1.2","212","Application Data"
"107","2018-08-23 02:01:13.316011","192.168.2.3","216.58.197.4","TLSv1.2","1338","Application Data"
"112","2018-08-23 02:01:13.392796","192.168.2.3","216.58.197.4","TCP","66","34236  >  443 [ACK] Seq=76121 Ack=811 Win=2363 Len=0 TSval=7835552 TSecr=760248188"
"113","2018-08-23 02:01:13.429700","192.168.2.3","216.58.197.4","TCP","1434","34236  >  443 [ACK] Seq=76121 Ack=811 Win=2363 Len=1368 TSval=7835555 TSecr=760248188 [TCP segment of a reassembled PDU]"
"114","2018-08-23 02:01:13.430097","192.168.2.3","216.58.197.4","TCP","1434","34236  >  443 [ACK] Seq=77489 Ack=811 Win=2363 Len=1368 TSval=7835555 TSecr=760248188 [TCP segment of a reassembled PDU]"
"115","2018-08-23 02:01:13.430102","192.168.2.3","216.58.197.4","TLSv1.2","212","Application Data"
"116","2018-08-23 02:01:13.430527","192.168.2.3","216.58.197.4","TCP","1434","34236  >  443 [ACK] Seq=79003 Ack=811 Win=2363 Len=1368 TSval=7835555 TSecr=760248188 [TCP segment of a reassembled PDU]"
"117","2018-08-23 02:01:13.430531","192.168.2.3","216.58.197.4","TLSv1.2","155","Application Data"
"121","2018-08-23 02:01:13.528007","192.168.2.3","216.58.197.4","TCP","1434","34236  >  443 [ACK] Seq=80460 Ack=811 Win=2363 Len=1368 TSval=7835565 TSecr=760248231 [TCP segment of a reassembled PDU]"
"122","2018-08-23 02:01:13.528012","192.168.2.3","216.58.197.4","TCP","1434","34236  >  443 [ACK] Seq=81828 Ack=811 Win=2363 Len=1368 TSval=7835565 TSecr=760248231 [TCP segment of a reassembled PDU]"
"123","2018-08-23 02:01:13.528100","192.168.2.3","216.58.197.4","TLSv1.2","212","Application Data"
"124","2018-08-23 02:01:13.528370","192.168.2.3","216.58.197.4","TCP","1434","34236  >  443 [ACK] Seq=83342 Ack=811 Win=2363 Len=1368 TSval=7835565 TSecr=760248231 [TCP segment of a reassembled PDU]"
"125","2018-08-23 02:01:13.528372","192.168.2.3","216.58.197.4","TLSv1.2","155","Application Data"
"130","2018-08-23 02:01:13.590636","192.168.2.3","216.58.197.4","TCP","66","34236  >  443 [ACK] Seq=84799 Ack=939 Win=2363 Len=0 TSval=7835572 TSecr=760248348"
"131","2018-08-23 02:01:13.635022","192.168.2.3","216.58.197.4","TCP","1434","34236  >  443 [ACK] Seq=84799 Ack=939 Win=2363 Len=1368 TSval=7835576 TSecr=760248348 [TCP segment of a reassembled PDU]"
"132","2018-08-23 02:01:13.635479","192.168.2.3","216.58.197.4","TCP","1434","34236  >  443 [ACK] Seq=86167 Ack=939 Win=2363 Len=1368 TSval=7835576 TSecr=760248348 [TCP segment of a reassembled PDU]"
"133","2018-08-23 02:01:13.635484","192.168.2.3","216.58.197.4","TLSv1.2","212","Application Data"
"134","2018-08-23 02:01:13.637815","192.168.2.3","216.58.197.4","TCP","1434","34236  >  443 [ACK] Seq=87681 Ack=939 Win=2363 Len=1368 TSval=7835576 TSecr=760248348 [TCP segment of a reassembled PDU]"
"135","2018-08-23 02:01:13.637818","192.168.2.3","216.58.197.4","TLSv1.2","70","Application Data"
"139","2018-08-23 02:01:13.747975","192.168.2.3","216.58.197.4","TCP","1434","34236  >  443 [ACK] Seq=89053 Ack=939 Win=2363 Len=1368 TSval=7835587 TSecr=760248478 [TCP segment of a reassembled PDU]"
"140","2018-08-23 02:01:13.748423","192.168.2.3","216.58.197.4","TCP","1434","34236  >  443 [ACK] Seq=90421 Ack=939 Win=2363 Len=1368 TSval=7835587 TSecr=760248478 [TCP segment of a reassembled PDU]"
"141","2018-08-23 02:01:13.748425","192.168.2.3","216.58.197.4","TLSv1.2","212","Application Data"
"142","2018-08-23 02:01:13.748425","192.168.2.3","216.58.197.4","TCP","1434","34236  >  443 [ACK] Seq=91935 Ack=939 Win=2363 Len=1368 TSval=7835587 TSecr=760248478 [TCP segment of a reassembled PDU]"
"143","2018-08-23 02:01:13.748642","192.168.2.3","216.58.197.4","TLSv1.2","155","Application Data"
"146","2018-08-23 02:01:13.846870","192.168.2.3","216.58.197.4","TCP","1434","34236  >  443 [ACK] Seq=93392 Ack=939 Win=2363 Len=1368 TSval=7835597 TSecr=760248549 [TCP segment of a reassembled PDU]"
"147","2018-08-23 02:01:13.847239","192.168.2.3","216.58.197.4","TCP","1434","34236  >  443 [ACK] Seq=94760 Ack=939 Win=2363 Len=1368 TSval=7835597 TSecr=760248549 [TCP segment of a reassembled PDU]"
"148","2018-08-23 02:01:13.847242","192.168.2.3","216.58.197.4","TLSv1.2","212","Application Data"
"149","2018-08-23 02:01:13.847243","192.168.2.3","216.58.197.4","TCP","1434","34236  >  443 [ACK] Seq=96274 Ack=939 Win=2363 Len=1368 TSval=7835597 TSecr=760248549 [TCP segment of a reassembled PDU]"
"150","2018-08-23 02:01:13.847503","192.168.2.3","216.58.197.4","TLSv1.2","155","Application Data"
"154","2018-08-23 02:01:13.952937","192.168.2.3","216.58.197.4","TCP","1434","34236  >  443 [ACK] Seq=97731 Ack=939 Win=2363 Len=1368 TSval=7835608 TSecr=760248648 [TCP segment of a reassembled PDU]"
"155","2018-08-23 02:01:13.953144","192.168.2.3","216.58.197.4","TCP","1434","34236  >  443 [ACK] Seq=99099 Ack=939 Win=2363 Len=1368 TSval=7835608 TSecr=760248648 [TCP segment of a reassembled PDU]"
"156","2018-08-23 02:01:13.953146","192.168.2.3","216.58.197.4","TLSv1.2","212","Application Data"
"157","2018-08-23 02:01:13.953625","192.168.2.3","216.58.197.4","TLSv1.2","1416","Application Data"
"161","2018-08-23 02:01:14.077895","192.168.2.3","216.58.197.4","TCP","1434","34236  >  443 [ACK] Seq=101963 Ack=939 Win=2363 Len=1368 TSval=7835619 TSecr=760248754 [TCP segment of a reassembled PDU]"
"162","2018-08-23 02:01:14.078063","192.168.2.3","216.58.197.4","TCP","1434","34236  >  443 [ACK] Seq=103331 Ack=939 Win=2363 Len=1368 TSval=7835619 TSecr=760248754 [TCP segment of a reassembled PDU]"
"163","2018-08-23 02:01:14.078070","192.168.2.3","216.58.197.4","TLSv1.2","212","Application Data"
"164","2018-08-23 02:01:14.078218","192.168.2.3","216.58.197.4","TCP","1434","34236  >  443 [ACK] Seq=104845 Ack=939 Win=2363 Len=1368 TSval=7835619 TSecr=760248754 [TCP segment of a reassembled PDU]"
"165","2018-08-23 02:01:14.078223","192.168.2.3","216.58.197.4","TLSv1.2","155","Application Data"
"168","2018-08-23 02:01:14.153230","192.168.2.3","216.58.197.4","TCP","1434","34236  >  443 [ACK] Seq=106302 Ack=939 Win=2363 Len=1368 TSval=7835627 TSecr=760248879 [TCP segment of a reassembled PDU]"
"169","2018-08-23 02:01:14.153498","192.168.2.3","216.58.197.4","TCP","1434","34236  >  443 [ACK] Seq=107670 Ack=939 Win=2363 Len=1368 TSval=7835627 TSecr=760248879 [TCP segment of a reassembled PDU]"
"170","2018-08-23 02:01:14.153500","192.168.2.3","216.58.197.4","TLSv1.2","212","Application Data"
"171","2018-08-23 02:01:14.153501","192.168.2.3","216.58.197.4","TCP","1434","34236  >  443 [ACK] Seq=109184 Ack=939 Win=2363 Len=1368 TSval=7835627 TSecr=760248879 [TCP segment of a reassembled PDU]"
"172","2018-08-23 02:01:14.153837","192.168.2.3","216.58.197.4","TLSv1.2","155","Application Data"
"176","2018-08-23 02:01:14.261758","192.168.2.3","216.58.197.4","TCP","1434","34236  >  443 [ACK] Seq=110641 Ack=939 Win=2363 Len=1368 TSval=7835637 TSecr=760248954 [TCP segment of a reassembled PDU]"
"177","2018-08-23 02:01:14.261762","192.168.2.3","216.58.197.4","TCP","1434","34236  >  443 [ACK] Seq=112009 Ack=939 Win=2363 Len=1368 TSval=7835637 TSecr=760248954 [TCP segment of a reassembled PDU]"
"178","2018-08-23 02:01:14.261906","192.168.2.3","216.58.197.4","TLSv1.2","212","Application Data"
"179","2018-08-23 02:01:14.262267","192.168.2.3","216.58.197.4","TCP","1434","34236  >  443 [ACK] Seq=113523 Ack=939 Win=2363 Len=1368 TSval=7835637 TSecr=760248954 [TCP segment of a reassembled PDU]"
"180","2018-08-23 02:01:14.262269","192.168.2.3","216.58.197.4","TLSv1.2","155","Application Data"
"184","2018-08-23 02:01:14.276089","192.168.2.3","216.58.197.4","TCP","66","34236  >  443 [ACK] Seq=114980 Ack=1064 Win=2363 Len=0 TSval=7835639 TSecr=760249060"
"186","2018-08-23 02:01:14.277418","192.168.2.3","216.58.197.4","TCP","66","34236  >  443 [ACK] Seq=114980 Ack=1332 Win=2363 Len=0 TSval=7835640 TSecr=760249072"
"187","2018-08-23 02:01:14.339230","192.168.2.3","216.58.197.4","TCP","1434","34236  >  443 [ACK] Seq=114980 Ack=1332 Win=2363 Len=1368 TSval=7835646 TSecr=760249072 [TCP segment of a reassembled PDU]"
"188","2018-08-23 02:01:14.339422","192.168.2.3","216.58.197.4","TCP","1434","34236  >  443 [ACK] Seq=116348 Ack=1332 Win=2363 Len=1368 TSval=7835646 TSecr=760249072 [TCP segment of a reassembled PDU]"
"189","2018-08-23 02:01:14.339424","192.168.2.3","216.58.197.4","TLSv1.2","212","Application Data"
"190","2018-08-23 02:01:14.339669","192.168.2.3","216.58.197.4","TCP","1434","34236  >  443 [ACK] Seq=117862 Ack=1332 Win=2363 Len=1368 TSval=7835646 TSecr=760249072 [TCP segment of a reassembled PDU]"
"191","2018-08-23 02:01:14.339671","192.168.2.3","216.58.197.4","TLSv1.2","155","Application Data"
"195","2018-08-23 02:01:14.434828","192.168.2.3","216.58.197.4","TCP","1434","34236  >  443 [ACK] Seq=119319 Ack=1332 Win=2363 Len=1368 TSval=7835656 TSecr=760249180 [TCP segment of a reassembled PDU]"
"196","2018-08-23 02:01:14.434834","192.168.2.3","216.58.197.4","TCP","1434","34236  >  443 [ACK] Seq=120687 Ack=1332 Win=2363 Len=1368 TSval=7835656 TSecr=760249180 [TCP segment of a reassembled PDU]"
"197","2018-08-23 02:01:14.434835","192.168.2.3","216.58.197.4","TLSv1.2","212","Application Data"
"198","2018-08-23 02:01:14.435160","192.168.2.3","216.58.197.4","TCP","1434","34236  >  443 [ACK] Seq=122201 Ack=1332 Win=2363 Len=1368 TSval=7835656 TSecr=760249180 [TCP segment of a reassembled PDU]"
"199","2018-08-23 02:01:14.435164","192.168.2.3","216.58.197.4","TLSv1.2","155","Application Data"
"205","2018-08-23 02:01:14.489035","192.168.2.3","216.58.197.4","TCP","66","34236  >  443 [ACK] Seq=123658 Ack=1663 Win=2363 Len=0 TSval=7835661 TSecr=760249284"
"206","2018-08-23 02:01:14.489205","192.168.2.3","216.58.197.4","TCP","66","34236  >  443 [ACK] Seq=123658 Ack=1772 Win=2363 Len=0 TSval=7835661 TSecr=760249284"
"207","2018-08-23 02:01:14.548031","192.168.2.3","216.58.197.4","TCP","1434","34236  >  443 [ACK] Seq=123658 Ack=1772 Win=2363 Len=1368 TSval=7835667 TSecr=760249284 [TCP segment of a reassembled PDU]"
"208","2018-08-23 02:01:14.548344","192.168.2.3","216.58.197.4","TCP","1434","34236  >  443 [ACK] Seq=125026 Ack=1772 Win=2363 Len=1368 TSval=7835667 TSecr=760249284 [TCP segment of a reassembled PDU]"
"209","2018-08-23 02:01:14.548346","192.168.2.3","216.58.197.4","TLSv1.2","212","Application Data"
"210","2018-08-23 02:01:14.548553","192.168.2.3","216.58.197.4","TCP","1434","34236  >  443 [ACK] Seq=126540 Ack=1772 Win=2363 Len=1368 TSval=7835667 TSecr=760249284 [TCP segment of a reassembled PDU]"
"211","2018-08-23 02:01:14.548555","192.168.2.3","216.58.197.4","TLSv1.2","155","Application Data"
"217","2018-08-23 02:01:14.614225","192.168.2.3","216.58.197.4","TCP","66","34236  >  443 [ACK] Seq=127997 Ack=1961 Win=2363 Len=0 TSval=7835674 TSecr=760249409"
"218","2018-08-23 02:01:14.614228","192.168.2.3","216.58.197.4","TCP","66","34236  >  443 [ACK] Seq=127997 Ack=2149 Win=2363 Len=0 TSval=7835674 TSecr=760249409"
"219","2018-08-23 02:01:14.646427","192.168.2.3","216.58.197.4","TCP","1434","34236  >  443 [ACK] Seq=127997 Ack=2149 Win=2363 Len=1368 TSval=7835677 TSecr=760249409 [TCP segment of a reassembled PDU]"
"220","2018-08-23 02:01:14.646576","192.168.2.3","216.58.197.4","TCP","1434","34236  >  443 [ACK] Seq=129365 Ack=2149 Win=2363 Len=1368 TSval=7835677 TSecr=760249409 [TCP segment of a reassembled PDU]"
"221","2018-08-23 02:01:14.646578","192.168.2.3","216.58.197.4","TLSv1.2","212","Application Data"
"222","2018-08-23 02:01:14.646934","192.168.2.3","216.58.197.4","TCP","1434","34236  >  443 [ACK] Seq=130879 Ack=2149 Win=2363 Len=1368 TSval=7835677 TSecr=760249409 [TCP segment of a reassembled PDU]"
"223","2018-08-23 02:01:14.646935","192.168.2.3","216.58.197.4","TLSv1.2","155","Application Data"
"227","2018-08-23 02:01:14.742746","192.168.2.3","216.58.197.4","TCP","1434","34236  >  443 [ACK] Seq=132336 Ack=2149 Win=2363 Len=1368 TSval=7835687 TSecr=760249447 [TCP segment of a reassembled PDU]"
"228","2018-08-23 02:01:14.743157","192.168.2.3","216.58.197.4","TCP","1434","34236  >  443 [ACK] Seq=133704 Ack=2149 Win=2363 Len=1368 TSval=7835687 TSecr=760249447 [TCP segment of a reassembled PDU]"
"229","2018-08-23 02:01:14.743160","192.168.2.3","216.58.197.4","TLSv1.2","212","Application Data"
"230","2018-08-23 02:01:14.743161","192.168.2.3","216.58.197.4","TCP","1434","34236  >  443 [ACK] Seq=135218 Ack=2149 Win=2363 Len=1368 TSval=7835687 TSecr=760249447 [TCP segment of a reassembled PDU]"
"231","2018-08-23 02:01:14.743246","192.168.2.3","216.58.197.4","TLSv1.2","155","Application Data"
"235","2018-08-23 02:01:14.839271","192.168.2.3","216.58.197.4","TCP","1434","34236  >  443 [ACK] Seq=136675 Ack=2149 Win=2363 Len=1368 TSval=7835696 TSecr=760249544 [TCP segment of a reassembled PDU]"
"236","2018-08-23 02:01:14.839279","192.168.2.3","216.58.197.4","TCP","1434","34236  >  443 [ACK] Seq=138043 Ack=2149 Win=2363 Len=1368 TSval=7835696 TSecr=760249544 [TCP segment of a reassembled PDU]"
"237","2018-08-23 02:01:14.839377","192.168.2.3","216.58.197.4","TLSv1.2","212","Application Data"
"238","2018-08-23 02:01:14.839565","192.168.2.3","216.58.197.4","TCP","1434","34236  >  443 [ACK] Seq=139557 Ack=2149 Win=2363 Len=1368 TSval=7835696 TSecr=760249544 [TCP segment of a reassembled PDU]"
"239","2018-08-23 02:01:14.839568","192.168.2.3","216.58.197.4","TLSv1.2","155","Application Data"
"245","2018-08-23 02:01:14.895921","192.168.2.3","216.58.197.4","TCP","66","34236  >  443 [ACK] Seq=141014 Ack=2601 Win=2363 Len=0 TSval=7835702 TSecr=760249691"
"246","2018-08-23 02:01:14.915393","192.168.2.3","216.58.197.4","TCP","1434","34236  >  443 [ACK] Seq=141014 Ack=2601 Win=2363 Len=1368 TSval=7835704 TSecr=760249691 [TCP segment of a reassembled PDU]"
"247","2018-08-23 02:01:14.915398","192.168.2.3","216.58.197.4","TCP","1434","34236  >  443 [ACK] Seq=142382 Ack=2601 Win=2363 Len=1368 TSval=7835704 TSecr=760249691 [TCP segment of a reassembled PDU]"
"248","2018-08-23 02:01:14.915399","192.168.2.3","216.58.197.4","TLSv1.2","212","Application Data"
"249","2018-08-23 02:01:14.915491","192.168.2.3","216.58.197.4","TCP","1434","34236  >  443 [ACK] Seq=143896 Ack=2601 Win=2363 Len=1368 TSval=7835704 TSecr=760249691 [TCP segment of a reassembled PDU]"
"250","2018-08-23 02:01:14.915493","192.168.2.3","216.58.197.4","TLSv1.2","155","Application Data"
"255","2018-08-23 02:01:14.973379","192.168.2.3","216.58.197.4","TCP","66","34236  >  443 [ACK] Seq=145353 Ack=3066 Win=2363 Len=0 TSval=7835710 TSecr=760249768"
"256","2018-08-23 02:01:15.018067","192.168.2.3","216.58.197.4","TCP","1434","34236  >  443 [ACK] Seq=145353 Ack=3066 Win=2363 Len=1368 TSval=7835713 TSecr=760249768 [TCP segment of a reassembled PDU]"
"257","2018-08-23 02:01:15.018379","192.168.2.3","216.58.197.4","TCP","1434","34236  >  443 [ACK] Seq=146721 Ack=3066 Win=2363 Len=1368 TSval=7835713 TSecr=760249768 [TCP segment of a reassembled PDU]"
"258","2018-08-23 02:01:15.018381","192.168.2.3","216.58.197.4","TLSv1.2","212","Application Data"
"259","2018-08-23 02:01:15.018382","192.168.2.3","216.58.197.4","TCP","1434","34236  >  443 [ACK] Seq=148235 Ack=3066 Win=2363 Len=1368 TSval=7835714 TSecr=760249768 [TCP segment of a reassembled PDU]"
"260","2018-08-23 02:01:15.018468","192.168.2.3","216.58.197.4","TLSv1.2","155","Application Data"
"264","2018-08-23 02:01:15.106788","192.168.2.3","216.58.197.4","TCP","1434","34236  >  443 [ACK] Seq=149692 Ack=3066 Win=2363 Len=1368 TSval=7835723 TSecr=760249819 [TCP segment of a reassembled PDU]"
"265","2018-08-23 02:01:15.107141","192.168.2.3","216.58.197.4","TCP","1434","34236  >  443 [ACK] Seq=151060 Ack=3066 Win=2363 Len=1368 TSval=7835723 TSecr=760249819 [TCP segment of a reassembled PDU]"
"266","2018-08-23 02:01:15.107144","192.168.2.3","216.58.197.4","TLSv1.2","212","Application Data"
"267","2018-08-23 02:01:15.107308","192.168.2.3","216.58.197.4","TCP","1434","34236  >  443 [ACK] Seq=152574 Ack=3066 Win=2363 Len=1368 TSval=7835723 TSecr=760249819 [TCP segment of a reassembled PDU]"
"268","2018-08-23 02:01:15.107311","192.168.2.3","216.58.197.4","TLSv1.2","155","Application Data"
"274","2018-08-23 02:01:15.162490","192.168.2.3","216.58.197.4","TCP","66","34236  >  443 [ACK] Seq=154031 Ack=3584 Win=2363 Len=0 TSval=7835729 TSecr=760249956"
"275","2018-08-23 02:01:15.223245","192.168.2.3","216.58.197.4","TCP","1434","34236  >  443 [ACK] Seq=154031 Ack=3584 Win=2363 Len=1368 TSval=7835734 TSecr=760249956 [TCP segment of a reassembled PDU]"
"276","2018-08-23 02:01:15.223250","192.168.2.3","216.58.197.4","TCP","1434","34236  >  443 [ACK] Seq=155399 Ack=3584 Win=2363 Len=1368 TSval=7835734 TSecr=760249956 [TCP segment of a reassembled PDU]"
"277","2018-08-23 02:01:15.223371","192.168.2.3","216.58.197.4","TLSv1.2","212","Application Data"
"278","2018-08-23 02:01:15.223592","192.168.2.3","216.58.197.4","TCP","1434","34236  >  443 [ACK] Seq=156913 Ack=3584 Win=2363 Len=1368 TSval=7835734 TSecr=760249956 [TCP segment of a reassembled PDU]"
"279","2018-08-23 02:01:15.223594","192.168.2.3","216.58.197.4","TLSv1.2","155","Application Data"
"284","2018-08-23 02:01:15.277079","192.168.2.3","216.58.197.4","TCP","66","34236  >  443 [ACK] Seq=158370 Ack=3965 Win=2363 Len=0 TSval=7835740 TSecr=760250060"
"287","2018-08-23 02:01:15.285499","192.168.2.3","216.58.197.4","TCP","66","34236  >  443 [ACK] Seq=158370 Ack=4424 Win=2363 Len=0 TSval=7835741 TSecr=760250080"
"288","2018-08-23 02:01:15.296906","192.168.2.3","216.58.197.4","TCP","1434","34236  >  443 [ACK] Seq=158370 Ack=4424 Win=2363 Len=1368 TSval=7835742 TSecr=760250080 [TCP segment of a reassembled PDU]"
"289","2018-08-23 02:01:15.296911","192.168.2.3","216.58.197.4","TCP","1434","34236  >  443 [ACK] Seq=159738 Ack=4424 Win=2363 Len=1368 TSval=7835742 TSecr=760250080 [TCP segment of a reassembled PDU]"
"290","2018-08-23 02:01:15.297011","192.168.2.3","216.58.197.4","TLSv1.2","212","Application Data"
"291","2018-08-23 02:01:15.297483","192.168.2.3","216.58.197.4","TCP","1434","34236  >  443 [ACK] Seq=161252 Ack=4424 Win=2363 Len=1368 TSval=7835742 TSecr=760250080 [TCP segment of a reassembled PDU]"
"292","2018-08-23 02:01:15.297487","192.168.2.3","216.58.197.4","TLSv1.2","155","Application Data"
"295","2018-08-23 02:01:15.394512","192.168.2.3","216.58.197.4","TCP","1434","34236  >  443 [ACK] Seq=162709 Ack=4424 Win=2363 Len=1368 TSval=7835752 TSecr=760250098 [TCP segment of a reassembled PDU]"
"296","2018-08-23 02:01:15.394519","192.168.2.3","216.58.197.4","TCP","1434","34236  >  443 [ACK] Seq=164077 Ack=4424 Win=2363 Len=1368 TSval=7835752 TSecr=760250098 [TCP segment of a reassembled PDU]"
"297","2018-08-23 02:01:15.394520","192.168.2.3","216.58.197.4","TLSv1.2","212","Application Data"
"298","2018-08-23 02:01:15.394810","192.168.2.3","216.58.197.4","TCP","1434","34236  >  443 [ACK] Seq=165591 Ack=4424 Win=2363 Len=1368 TSval=7835752 TSecr=760250098 [TCP segment of a reassembled PDU]"
"299","2018-08-23 02:01:15.394813","192.168.2.3","216.58.197.4","TLSv1.2","155","Application Data"
"305","2018-08-23 02:01:15.459102","192.168.2.3","216.58.197.4","TCP","66","34236  >  443 [ACK] Seq=167048 Ack=4686 Win=2363 Len=0 TSval=7835758 TSecr=760250251"
"306","2018-08-23 02:01:15.507937","192.168.2.3","216.58.197.4","TCP","1434","34236  >  443 [ACK] Seq=167048 Ack=4686 Win=2363 Len=1368 TSval=7835763 TSecr=760250251 [TCP segment of a reassembled PDU]"
"307","2018-08-23 02:01:15.508288","192.168.2.3","216.58.197.4","TCP","1434","34236  >  443 [ACK] Seq=168416 Ack=4686 Win=2363 Len=1368 TSval=7835763 TSecr=760250251 [TCP segment of a reassembled PDU]"
"308","2018-08-23 02:01:15.508296","192.168.2.3","216.58.197.4","TLSv1.2","212","Application Data"
"309","2018-08-23 02:01:15.508446","192.168.2.3","216.58.197.4","TLSv1.2","1411","Application Data"
"313","2018-08-23 02:01:15.606631","192.168.2.3","216.58.197.4","TCP","1434","34236  >  443 [ACK] Seq=171275 Ack=4686 Win=2363 Len=1368 TSval=7835773 TSecr=760250309 [TCP segment of a reassembled PDU]"
"314","2018-08-23 02:01:15.607030","192.168.2.3","216.58.197.4","TCP","1434","34236  >  443 [ACK] Seq=172643 Ack=4686 Win=2363 Len=1368 TSval=7835773 TSecr=760250309 [TCP segment of a reassembled PDU]"
"315","2018-08-23 02:01:15.607032","192.168.2.3","216.58.197.4","TLSv1.2","212","Application Data"
"316","2018-08-23 02:01:15.607237","192.168.2.3","216.58.197.4","TCP","1434","34236  >  443 [ACK] Seq=174157 Ack=4686 Win=2363 Len=1368 TSval=7835773 TSecr=760250309 [TCP segment of a reassembled PDU]"
"317","2018-08-23 02:01:15.607239","192.168.2.3","216.58.197.4","TLSv1.2","155","Application Data"
"321","2018-08-23 02:01:15.715069","192.168.2.3","216.58.197.4","TCP","1434","34236  >  443 [ACK] Seq=175614 Ack=4686 Win=2363 Len=1368 TSval=7835784 TSecr=760250408 [TCP segment of a reassembled PDU]"
"322","2018-08-23 02:01:15.715480","192.168.2.3","216.58.197.4","TCP","1434","34236  >  443 [ACK] Seq=176982 Ack=4686 Win=2363 Len=1368 TSval=7835784 TSecr=760250408 [TCP segment of a reassembled PDU]"
"323","2018-08-23 02:01:15.715483","192.168.2.3","216.58.197.4","TLSv1.2","212","Application Data"
"324","2018-08-23 02:01:15.715924","192.168.2.3","216.58.197.4","TLSv1.2","1378","Application Data"
"331","2018-08-23 02:01:15.768145","192.168.2.3","216.58.197.4","TCP","66","34236  >  443 [ACK] Seq=179808 Ack=5161 Win=2363 Len=0 TSval=7835789 TSecr=760250543"
"332","2018-08-23 02:01:15.829982","192.168.2.3","216.58.197.4","TCP","1434","34236  >  443 [ACK] Seq=179808 Ack=5161 Win=2363 Len=1368 TSval=7835795 TSecr=760250543 [TCP segment of a reassembled PDU]"
"333","2018-08-23 02:01:15.835549","192.168.2.3","216.58.197.4","TCP","1434","34236  >  443 [ACK] Seq=181176 Ack=5161 Win=2363 Len=1368 TSval=7835795 TSecr=760250543 [TCP segment of a reassembled PDU]"
"334","2018-08-23 02:01:15.835552","192.168.2.3","216.58.197.4","TLSv1.2","212","Application Data"
"335","2018-08-23 02:01:15.835793","192.168.2.3","216.58.197.4","TCP","1434","34236  >  443 [ACK] Seq=182690 Ack=5161 Win=2363 Len=1368 TSval=7835795 TSecr=760250543 [TCP segment of a reassembled PDU]"
"336","2018-08-23 02:01:15.835796","192.168.2.3","216.58.197.4","TLSv1.2","155","Application Data"
"340","2018-08-23 02:01:15.929738","192.168.2.3","216.58.197.4","TCP","1434","34236  >  443 [ACK] Seq=184147 Ack=5161 Win=2363 Len=1368 TSval=7835805 TSecr=760250676 [TCP segment of a reassembled PDU]"
"341","2018-08-23 02:01:15.930182","192.168.2.3","216.58.197.4","TCP","1434","34236  >  443 [ACK] Seq=185515 Ack=5161 Win=2363 Len=1368 TSval=7835805 TSecr=760250676 [TCP segment of a reassembled PDU]"
"342","2018-08-23 02:01:15.930184","192.168.2.3","216.58.197.4","TLSv1.2","212","Application Data"
"343","2018-08-23 02:01:15.930185","192.168.2.3","216.58.197.4","TCP","1434","34236  >  443 [ACK] Seq=187029 Ack=5161 Win=2363 Len=1368 TSval=7835805 TSecr=760250676 [TCP segment of a reassembled PDU]"
"344","2018-08-23 02:01:15.930186","192.168.2.3","216.58.197.4","TLSv1.2","155","Application Data"
"348","2018-08-23 02:01:16.041920","192.168.2.3","216.58.197.4","TCP","1434","34236  >  443 [ACK] Seq=188486 Ack=5161 Win=2363 Len=1368 TSval=7835816 TSecr=760250731 [TCP segment of a reassembled PDU]"
"349","2018-08-23 02:01:16.042027","192.168.2.3","216.58.197.4","TCP","1434","34236  >  443 [ACK] Seq=189854 Ack=5161 Win=2363 Len=1368 TSval=7835816 TSecr=760250731 [TCP segment of a reassembled PDU]"
"350","2018-08-23 02:01:16.042030","192.168.2.3","216.58.197.4","TLSv1.2","212","Application Data"
"351","2018-08-23 02:01:16.042362","192.168.2.3","216.58.197.4","TCP","1434","34236  >  443 [ACK] Seq=191368 Ack=5161 Win=2363 Len=1368 TSval=7835816 TSecr=760250731 [TCP segment of a reassembled PDU]"
"352","2018-08-23 02:01:16.042364","192.168.2.3","216.58.197.4","TLSv1.2","106","Application Data"
"358","2018-08-23 02:01:16.098458","192.168.2.3","216.58.197.4","TCP","66","34236  >  443 [ACK] Seq=192776 Ack=5340 Win=2363 Len=0 TSval=7835822 TSecr=760250893"
"359","2018-08-23 02:01:16.158407","192.168.2.3","216.58.197.4","TCP","1434","34236  >  443 [ACK] Seq=192776 Ack=5340 Win=2363 Len=1368 TSval=7835827 TSecr=760250893 [TCP segment of a reassembled PDU]"
"360","2018-08-23 02:01:16.158410","192.168.2.3","216.58.197.4","TCP","1434","34236  >  443 [ACK] Seq=194144 Ack=5340 Win=2363 Len=1368 TSval=7835827 TSecr=760250893 [TCP segment of a reassembled PDU]"
"361","2018-08-23 02:01:16.158411","192.168.2.3","216.58.197.4","TLSv1.2","212","Application Data"
"362","2018-08-23 02:01:16.158736","192.168.2.3","216.58.197.4","TCP","1434","34236  >  443 [ACK] Seq=195658 Ack=5340 Win=2363 Len=1368 TSval=7835827 TSecr=760250893 [TCP segment of a reassembled PDU]"
"363","2018-08-23 02:01:16.158738","192.168.2.3","216.58.197.4","TLSv1.2","155","Application Data"
"369","2018-08-23 02:01:16.248650","192.168.2.3","216.58.197.4","TCP","66","34236  >  443 [ACK] Seq=197115 Ack=5664 Win=2363 Len=0 TSval=7835836 TSecr=760251005"
"370","2018-08-23 02:01:16.249009","192.168.2.3","216.58.197.4","TCP","1434","34236  >  443 [ACK] Seq=197115 Ack=5664 Win=2363 Len=1368 TSval=7835837 TSecr=760251005 [TCP segment of a reassembled PDU]"
"371","2018-08-23 02:01:16.249011","192.168.2.3","216.58.197.4","TCP","1434","34236  >  443 [ACK] Seq=198483 Ack=5664 Win=2363 Len=1368 TSval=7835837 TSecr=760251005 [TCP segment of a reassembled PDU]"
"372","2018-08-23 02:01:16.249012","192.168.2.3","216.58.197.4","TLSv1.2","212","Application Data"
"373","2018-08-23 02:01:16.249226","192.168.2.3","216.58.197.4","TCP","1434","34236  >  443 [ACK] Seq=199997 Ack=5664 Win=2363 Len=1368 TSval=7835837 TSecr=760251005 [TCP segment of a reassembled PDU]"
"374","2018-08-23 02:01:16.249229","192.168.2.3","216.58.197.4","TLSv1.2","155","Application Data"
"375","2018-08-23 02:01:16.249518","192.168.2.3","216.58.197.4","TCP","78","[TCP Dup ACK 369#1] 34236  >  443 [ACK] Seq=201454 Ack=5664 Win=2363 Len=0 TSval=7835837 TSecr=760251029 SLE=5427 SRE=5664"
"380","2018-08-23 02:01:16.265260","192.168.2.3","216.58.197.4","TCP","66","34236  >  443 [ACK] Seq=201454 Ack=5817 Win=2363 Len=0 TSval=7835839 TSecr=760251060"
"382","2018-08-23 02:01:16.277660","192.168.2.3","216.58.197.4","TCP","66","34236  >  443 [ACK] Seq=201454 Ack=6000 Win=2363 Len=0 TSval=7835840 TSecr=760251072"
"385","2018-08-23 02:01:16.306563","192.168.2.3","216.58.197.4","TCP","66","34236  >  443 [ACK] Seq=201454 Ack=6752 Win=2363 Len=0 TSval=7835842 TSecr=760251092"
"386","2018-08-23 02:01:16.306569","192.168.2.3","216.58.197.4","TCP","66","34236  >  443 [ACK] Seq=201454 Ack=7015 Win=2363 Len=0 TSval=7835843 TSecr=760251094"
"387","2018-08-23 02:01:16.306570","192.168.2.3","216.58.197.4","TCP","1434","34236  >  443 [ACK] Seq=201454 Ack=7015 Win=2363 Len=1368 TSval=7835843 TSecr=760251094 [TCP segment of a reassembled PDU]"
"388","2018-08-23 02:01:16.306629","192.168.2.3","216.58.197.4","TLSv1.2","971","Application Data"
"389","2018-08-23 02:01:16.306630","192.168.2.3","216.58.197.4","TLSv1.2","102","Application Data"
"394","2018-08-23 02:01:17.277511","192.168.2.3","216.58.197.4","TCP","66","34236  >  443 [ACK] Seq=203763 Ack=7431 Win=2363 Len=0 TSval=7835940 TSecr=760252060"
"396","2018-08-23 02:01:18.115840","192.168.2.3","216.58.197.4","TCP","66","34236  >  443 [ACK] Seq=203763 Ack=7520 Win=2363 Len=0 TSval=7836024 TSecr=760252875"
"398","2018-08-23 02:01:18.121187","192.168.2.3","216.58.197.4","TCP","66","34236  >  443 [ACK] Seq=203763 Ack=8822 Win=2363 Len=0 TSval=7836025 TSecr=760252913"
"400","2018-08-23 02:01:18.267357","192.168.2.3","216.58.197.4","TCP","66","34236  >  443 [ACK] Seq=203763 Ack=8968 Win=2363 Len=0 TSval=7836039 TSecr=760253061"
"402","2018-08-23 02:01:18.277734","192.168.2.3","216.58.197.4","TCP","66","34236  >  443 [ACK] Seq=203763 Ack=9098 Win=2363 Len=0 TSval=7836040 TSecr=760253073"
"407","2018-08-23 02:01:18.672992","192.168.2.3","216.58.197.4","TCP","66","34236  >  443 [ACK] Seq=203763 Ack=10516 Win=2363 Len=0 TSval=7836080 TSecr=760253466"
"412","2018-08-23 02:01:18.676348","192.168.2.3","216.58.197.4","TCP","66","34236  >  443 [ACK] Seq=203763 Ack=10934 Win=2363 Len=0 TSval=7836080 TSecr=760253466"
"413","2018-08-23 02:01:18.676354","192.168.2.3","216.58.197.4","TCP","66","34236  >  443 [ACK] Seq=203763 Ack=12808 Win=2363 Len=0 TSval=7836080 TSecr=760253466"
"418","2018-08-23 02:01:18.678901","192.168.2.3","216.58.197.4","TCP","66","34236  >  443 [ACK] Seq=203763 Ack=14226 Win=2363 Len=0 TSval=7836080 TSecr=760253469"
"419","2018-08-23 02:01:18.678904","192.168.2.3","216.58.197.4","TCP","66","34236  >  443 [ACK] Seq=203763 Ack=15917 Win=2363 Len=0 TSval=7836080 TSecr=760253469"
"420","2018-08-23 02:01:18.678905","192.168.2.3","216.58.197.4","TCP","66","34236  >  443 [ACK] Seq=203763 Ack=16282 Win=2363 Len=0 TSval=7836080 TSecr=760253469"
"421","2018-08-23 02:01:18.678906","192.168.2.3","216.58.197.4","TCP","66","34236  >  443 [ACK] Seq=203763 Ack=17700 Win=2363 Len=0 TSval=7836080 TSecr=760253473"
"422","2018-08-23 02:01:18.678907","192.168.2.3","216.58.197.4","TCP","66","34236  >  443 [ACK] Seq=203763 Ack=18104 Win=2363 Len=0 TSval=7836080 TSecr=760253473"
"423","2018-08-23 02:01:18.679271","192.168.2.3","216.58.197.4","TCP","66","34236  >  443 [ACK] Seq=203763 Ack=19522 Win=2363 Len=0 TSval=7836080 TSecr=760253473"
"424","2018-08-23 02:01:18.679474","192.168.2.3","216.58.197.4","TCP","66","34236  >  443 [ACK] Seq=203763 Ack=19884 Win=2363 Len=0 TSval=7836080 TSecr=760253473"
"427","2018-08-23 02:01:18.681632","192.168.2.3","216.58.197.4","TCP","66","34236  >  443 [ACK] Seq=203763 Ack=21302 Win=2363 Len=0 TSval=7836081 TSecr=760253476"
"428","2018-08-23 02:01:18.681933","192.168.2.3","216.58.197.4","TCP","66","34236  >  443 [ACK] Seq=203763 Ack=21787 Win=2363 Len=0 TSval=7836081 TSecr=760253476"
"433","2018-08-23 02:01:18.708786","192.168.2.3","216.58.197.4","TCP","66","34236  >  443 [ACK] Seq=203763 Ack=23205 Win=2363 Len=0 TSval=7836083 TSecr=760253503"
"436","2018-08-23 02:01:18.709702","192.168.2.3","216.58.197.4","TCP","66","34236  >  443 [ACK] Seq=203763 Ack=23542 Win=2363 Len=0 TSval=7836083 TSecr=760253503"
"437","2018-08-23 02:01:18.710178","192.168.2.3","216.58.197.4","TCP","66","34236  >  443 [ACK] Seq=203763 Ack=25427 Win=2363 Len=0 TSval=7836083 TSecr=760253503"
"438","2018-08-23 02:01:18.710180","192.168.2.3","216.58.197.4","TCP","66","34236  >  443 [ACK] Seq=203763 Ack=27276 Win=2363 Len=0 TSval=7836083 TSecr=760253505"
"443","2018-08-23 02:01:18.712949","192.168.2.3","216.58.197.4","TCP","66","34236  >  443 [ACK] Seq=203763 Ack=28990 Win=2363 Len=0 TSval=7836084 TSecr=760253507"
"446","2018-08-23 02:01:18.713461","192.168.2.3","216.58.197.4","TCP","66","34236  >  443 [ACK] Seq=203763 Ack=30820 Win=2363 Len=0 TSval=7836084 TSecr=760253508"
"447","2018-08-23 02:01:18.714686","192.168.2.3","216.58.197.4","TCP","66","34236  >  443 [ACK] Seq=203763 Ack=32668 Win=2363 Len=0 TSval=7836084 TSecr=760253509"
"452","2018-08-23 02:01:18.717253","192.168.2.3","216.58.197.4","TCP","66","34236  >  443 [ACK] Seq=203763 Ack=34506 Win=2363 Len=0 TSval=7836084 TSecr=760253511"
"453","2018-08-23 02:01:18.717652","192.168.2.3","216.58.197.4","TCP","66","34236  >  443 [ACK] Seq=203763 Ack=36434 Win=2363 Len=0 TSval=7836084 TSecr=760253511"
"456","2018-08-23 02:01:18.718940","192.168.2.3","216.58.197.4","TCP","66","34236  >  443 [ACK] Seq=203763 Ack=38186 Win=2363 Len=0 TSval=7836084 TSecr=760253513"
"461","2018-08-23 02:01:18.721323","192.168.2.3","216.58.197.4","TCP","66","34236  >  443 [ACK] Seq=203763 Ack=39869 Win=2363 Len=0 TSval=7836085 TSecr=760253516"
"466","2018-08-23 02:01:18.721690","192.168.2.3","216.58.197.4","TCP","66","34236  >  443 [ACK] Seq=203763 Ack=41654 Win=2363 Len=0 TSval=7836085 TSecr=760253516"
"467","2018-08-23 02:01:18.722991","192.168.2.3","216.58.197.4","TCP","66","34236  >  443 [ACK] Seq=203763 Ack=43400 Win=2363 Len=0 TSval=7836085 TSecr=760253517"
"470","2018-08-23 02:01:18.723629","192.168.2.3","216.58.197.4","TCP","66","34236  >  443 [ACK] Seq=203763 Ack=45106 Win=2363 Len=0 TSval=7836085 TSecr=760253517"
"471","2018-08-23 02:01:18.725077","192.168.2.3","216.58.197.4","TCP","66","34236  >  443 [ACK] Seq=203763 Ack=47005 Win=2363 Len=0 TSval=7836085 TSecr=760253519"
"482","2018-08-23 02:01:18.735470","192.168.2.3","216.58.197.4","TCP","66","34236  >  443 [ACK] Seq=203763 Ack=48851 Win=2363 Len=0 TSval=7836086 TSecr=760253521"
"483","2018-08-23 02:01:18.735473","192.168.2.3","216.58.197.4","TCP","66","34236  >  443 [ACK] Seq=203763 Ack=50580 Win=2363 Len=0 TSval=7836086 TSecr=760253521"
"484","2018-08-23 02:01:18.735474","192.168.2.3","216.58.197.4","TCP","66","34236  >  443 [ACK] Seq=203763 Ack=52507 Win=2363 Len=0 TSval=7836086 TSecr=760253523"
"485","2018-08-23 02:01:18.735474","192.168.2.3","216.58.197.4","TCP","66","34236  >  443 [ACK] Seq=203763 Ack=54434 Win=2363 Len=0 TSval=7836086 TSecr=760253525"
"486","2018-08-23 02:01:18.735475","192.168.2.3","216.58.197.4","TCP","66","34236  >  443 [ACK] Seq=203763 Ack=56224 Win=2363 Len=0 TSval=7836086 TSecr=760253525"
"493","2018-08-23 02:01:18.746795","192.168.2.3","216.58.197.4","TCP","66","34236  >  443 [ACK] Seq=203763 Ack=58138 Win=2363 Len=0 TSval=7836087 TSecr=760253540"
"494","2018-08-23 02:01:18.747197","192.168.2.3","216.58.197.4","TCP","66","34236  >  443 [ACK] Seq=203763 Ack=59915 Win=2363 Len=0 TSval=7836087 TSecr=760253541"
"500","2018-08-23 02:01:18.748708","192.168.2.3","216.58.197.4","TCP","66","34236  >  443 [ACK] Seq=203763 Ack=61735 Win=2363 Len=0 TSval=7836087 TSecr=760253541"
"507","2018-08-23 02:01:18.751234","192.168.2.3","216.58.197.4","TCP","66","34236  >  443 [ACK] Seq=203763 Ack=63536 Win=2363 Len=0 TSval=7836087 TSecr=760253543"
"514","2018-08-23 02:01:18.753389","192.168.2.3","216.58.197.4","TCP","66","34236  >  443 [ACK] Seq=203763 Ack=66372 Win=2363 Len=0 TSval=7836088 TSecr=760253543"
"515","2018-08-23 02:01:18.753392","192.168.2.3","216.58.197.4","TCP","66","34236  >  443 [ACK] Seq=203763 Ack=66874 Win=2363 Len=0 TSval=7836088 TSecr=760253543"
"516","2018-08-23 02:01:18.754491","192.168.2.3","216.58.197.4","TCP","66","34236  >  443 [ACK] Seq=203763 Ack=70345 Win=2363 Len=0 TSval=7836088 TSecr=760253546"
"517","2018-08-23 02:01:18.754493","192.168.2.3","216.58.197.4","TCP","66","34236  >  443 [ACK] Seq=203763 Ack=73916 Win=2363 Len=0 TSval=7836088 TSecr=760253548"
"518","2018-08-23 02:01:18.755404","192.168.2.3","216.58.197.4","TCP","66","34236  >  443 [ACK] Seq=203763 Ack=75644 Win=2363 Len=0 TSval=7836088 TSecr=760253549"
"519","2018-08-23 02:01:18.756019","192.168.2.3","216.58.197.4","TCP","66","34236  >  443 [ACK] Seq=203763 Ack=77393 Win=2363 Len=0 TSval=7836088 TSecr=760253549"
"531","2018-08-23 02:01:18.758314","192.168.2.3","216.58.197.4","TCP","66","34236  >  443 [ACK] Seq=203763 Ack=77668 Win=2363 Len=0 TSval=7836088 TSecr=760253553"
"532","2018-08-23 02:01:18.759018","192.168.2.3","216.58.197.4","TCP","66","34236  >  443 [ACK] Seq=203763 Ack=79407 Win=2363 Len=0 TSval=7836088 TSecr=760253553"
"533","2018-08-23 02:01:18.759020","192.168.2.3","216.58.197.4","TCP","66","34236  >  443 [ACK] Seq=203763 Ack=80522 Win=2363 Len=0 TSval=7836088 TSecr=760253554"
"534","2018-08-23 02:01:18.759021","192.168.2.3","216.58.197.4","TCP","66","34236  >  443 [ACK] Seq=203763 Ack=80676 Win=2363 Len=0 TSval=7836088 TSecr=760253554"
"535","2018-08-23 02:01:18.759620","192.168.2.3","216.58.197.4","TCP","66","34236  >  443 [ACK] Seq=203763 Ack=81223 Win=2363 Len=0 TSval=7836088 TSecr=760253554"
"536","2018-08-23 02:01:18.766364","192.168.2.3","216.58.197.4","TLSv1.2","104","Application Data"
"539","2018-08-23 02:01:31.550705","192.168.2.3","216.58.197.14","TCP","66","41142  >  443 [ACK] Seq=1 Ack=1 Win=661 Len=0 TSval=7837368 TSecr=933230032"
"541","2018-08-23 02:01:34.602576","192.168.2.3","216.58.197.14","TLSv1.2","156","[TCP Previous segment not captured] , Application Data"
"542","2018-08-23 02:01:34.602581","192.168.2.3","216.58.197.14","TLSv1.2","104","Application Data"
"543","2018-08-23 02:01:34.602582","192.168.2.3","216.58.197.14","TLSv1.2","586","Application Data"
"548","2018-08-23 02:01:34.640744","192.168.2.3","216.58.197.14","TCP","66","41142  >  443 [ACK] Seq=650 Ack=39 Win=661 Len=0 TSval=7837677 TSecr=933278137"
"553","2018-08-23 02:01:34.704860","192.168.2.3","216.58.197.14","TCP","66","41142  >  443 [ACK] Seq=650 Ack=107 Win=661 Len=0 TSval=7837682 TSecr=933278213"
"554","2018-08-23 02:01:34.705007","192.168.2.3","216.58.197.14","TCP","66","41142  >  443 [ACK] Seq=650 Ack=238 Win=661 Len=0 TSval=7837682 TSecr=933278213"
"555","2018-08-23 02:01:34.705009","192.168.2.3","216.58.197.14","TCP","66","41142  >  443 [ACK] Seq=650 Ack=395 Win=661 Len=0 TSval=7837682 TSecr=933278213"
"556","2018-08-23 02:01:34.705010","192.168.2.3","216.58.197.14","TLSv1.2","104","Application Data"
"558","2018-08-23 02:01:36.111769","192.168.2.3","74.125.204.188","TCP","66","33038  >  5228 [ACK] Seq=1 Ack=1 Win=406 Len=0 TSval=7837824 TSecr=3813974445"
