"No.","Time","Source","Destination","Protocol","Length","Info"
"1","2018-08-23 02:07:07.228970","192.168.2.3","216.58.197.4","TLSv1.2","156","Application Data"
"2","2018-08-23 02:07:07.228975","192.168.2.3","216.58.197.4","TLSv1.2","104","Application Data"
"3","2018-08-23 02:07:07.230144","192.168.2.3","216.58.197.4","TLSv1.2","158","Application Data"
"7","2018-08-23 02:07:07.240623","192.168.2.3","216.58.197.4","TCP","1434","34236  >  443 [ACK] Seq=221 Ack=39 Win=2363 Len=1368 TSval=7870936 TSecr=760602030 [TCP segment of a reassembled PDU]"
"8","2018-08-23 02:07:07.240871","192.168.2.3","216.58.197.4","TCP","1434","34236  >  443 [ACK] Seq=1589 Ack=39 Win=2363 Len=1368 TSval=7870936 TSecr=760602030 [TCP segment of a reassembled PDU]"
"9","2018-08-23 02:07:07.240874","192.168.2.3","216.58.197.4","TLSv1.2","212","Application Data"
"10","2018-08-23 02:07:07.240875","192.168.2.3","216.58.197.4","TCP","1434","34236  >  443 [ACK] Seq=3103 Ack=39 Win=2363 Len=1368 TSval=7870936 TSecr=760602030 [TCP segment of a reassembled PDU]"
"11","2018-08-23 02:07:07.241022","192.168.2.3","216.58.197.4","TLSv1.2","262","Application Data"
"12","2018-08-23 02:07:07.241418","192.168.2.3","216.58.197.4","TCP","1434","34236  >  443 [ACK] Seq=4667 Ack=39 Win=2363 Len=1368 TSval=7870936 TSecr=760602030 [TCP segment of a reassembled PDU]"
"13","2018-08-23 02:07:07.241420","192.168.2.3","216.58.197.4","TCP","1434","34236  >  443 [ACK] Seq=6035 Ack=39 Win=2363 Len=1368 TSval=7870936 TSecr=760602030 [TCP segment of a reassembled PDU]"
"14","2018-08-23 02:07:07.241422","192.168.2.3","216.58.197.4","TLSv1.2","212","Application Data"
"15","2018-08-23 02:07:07.241615","192.168.2.3","216.58.197.4","TCP","1434","34236  >  443 [ACK] Seq=7549 Ack=39 Win=2363 Len=1368 TSval=7870936 TSecr=760602030 [TCP segment of a reassembled PDU]"
"20","2018-08-23 02:07:07.249419","192.168.2.3","216.58.197.4","TLSv1.2","1434","Application Data [TCP segment of a reassembled PDU]"
"21","2018-08-23 02:07:07.249679","192.168.2.3","216.58.197.4","TCP","1434","34236  >  443 [ACK] Seq=10285 Ack=39 Win=2363 Len=1368 TSval=7870937 TSecr=760602042 [TCP segment of a reassembled PDU]"
"22","2018-08-23 02:07:07.249878","192.168.2.3","216.58.197.4","TLSv1.2","1434","Application Data [TCP segment of a reassembled PDU]"
"23","2018-08-23 02:07:07.250360","192.168.2.3","216.58.197.4","TLSv1.2","1434","Application Data [TCP segment of a reassembled PDU]"
"24","2018-08-23 02:07:07.250362","192.168.2.3","216.58.197.4","TCP","1434","34236  >  443 [ACK] Seq=14389 Ack=39 Win=2363 Len=1368 TSval=7870937 TSecr=760602042 [TCP segment of a reassembled PDU]"
"25","2018-08-23 02:07:07.250456","192.168.2.3","216.58.197.4","TLSv1.2","1434","Application Data [TCP segment of a reassembled PDU]"
"26","2018-08-23 02:07:07.250831","192.168.2.3","216.58.197.4","TLSv1.2","1434","Application Data [TCP segment of a reassembled PDU]"
"27","2018-08-23 02:07:07.251221","192.168.2.3","216.58.197.4","TCP","1434","34236  >  443 [ACK] Seq=18493 Ack=39 Win=2363 Len=1368 TSval=7870937 TSecr=760602042 [TCP segment of a reassembled PDU]"
"28","2018-08-23 02:07:07.251223","192.168.2.3","216.58.197.4","TLSv1.2","1434","Application Data [TCP segment of a reassembled PDU]"
"29","2018-08-23 02:07:07.251535","192.168.2.3","216.58.197.4","TLSv1.2","1434","Application Data [TCP segment of a reassembled PDU]"
"30","2018-08-23 02:07:07.251775","192.168.2.3","216.58.197.4","TCP","1434","34236  >  443 [ACK] Seq=22597 Ack=39 Win=2363 Len=1368 TSval=7870937 TSecr=760602042 [TCP segment of a reassembled PDU]"
"31","2018-08-23 02:07:07.251778","192.168.2.3","216.58.197.4","TLSv1.2","1434","Application Data [TCP segment of a reassembled PDU]"
"32","2018-08-23 02:07:07.251882","192.168.2.3","216.58.197.4","TLSv1.2","1434","Application Data [TCP segment of a reassembled PDU]"
"37","2018-08-23 02:07:07.255278","192.168.2.3","216.58.197.4","TCP","1434","34236  >  443 [ACK] Seq=26701 Ack=39 Win=2363 Len=1368 TSval=7870938 TSecr=760602050 [TCP segment of a reassembled PDU]"
"38","2018-08-23 02:07:07.255280","192.168.2.3","216.58.197.4","TLSv1.2","1434","Application Data [TCP segment of a reassembled PDU]"
"40","2018-08-23 02:07:07.255663","192.168.2.3","216.58.197.4","TLSv1.2","1434","Application Data [TCP segment of a reassembled PDU]"
"43","2018-08-23 02:07:07.256308","192.168.2.3","216.58.197.4","TCP","1434","34236  >  443 [ACK] Seq=30805 Ack=39 Win=2363 Len=1368 TSval=7870938 TSecr=760602051 [TCP segment of a reassembled PDU]"
"44","2018-08-23 02:07:07.256310","192.168.2.3","216.58.197.4","TCP","1434","34236  >  443 [ACK] Seq=32173 Ack=39 Win=2363 Len=1368 TSval=7870938 TSecr=760602051 [TCP segment of a reassembled PDU]"
"45","2018-08-23 02:07:07.256619","192.168.2.3","216.58.197.4","TLSv1.2","1434","Application Data [TCP segment of a reassembled PDU]"
"46","2018-08-23 02:07:07.257019","192.168.2.3","216.58.197.4","TLSv1.2","1434","Application Data [TCP segment of a reassembled PDU]"
"47","2018-08-23 02:07:07.257022","192.168.2.3","216.58.197.4","TCP","1434","34236  >  443 [ACK] Seq=36277 Ack=39 Win=2363 Len=1368 TSval=7870938 TSecr=760602051 [TCP segment of a reassembled PDU]"
"48","2018-08-23 02:07:07.257130","192.168.2.3","216.58.197.4","TLSv1.2","1434","Application Data [TCP segment of a reassembled PDU]"
"49","2018-08-23 02:07:07.258306","192.168.2.3","216.58.197.4","TLSv1.2","1434","Application Data [TCP segment of a reassembled PDU]"
"50","2018-08-23 02:07:07.258309","192.168.2.3","216.58.197.4","TCP","1434","34236  >  443 [ACK] Seq=40381 Ack=39 Win=2363 Len=1368 TSval=7870938 TSecr=760602052 [TCP segment of a reassembled PDU]"
"51","2018-08-23 02:07:07.258465","192.168.2.3","216.58.197.4","TLSv1.2","1434","Application Data [TCP segment of a reassembled PDU]"
"52","2018-08-23 02:07:07.258695","192.168.2.3","216.58.197.4","TLSv1.2","1434","Application Data [TCP segment of a reassembled PDU]"
"53","2018-08-23 02:07:07.258817","192.168.2.3","216.58.197.4","TCP","1434","34236  >  443 [ACK] Seq=44485 Ack=39 Win=2363 Len=1368 TSval=7870938 TSecr=760602052 [TCP segment of a reassembled PDU]"
"54","2018-08-23 02:07:07.259345","192.168.2.3","216.58.197.4","TLSv1.2","1434","Application Data [TCP segment of a reassembled PDU]"
"56","2018-08-23 02:07:07.259550","192.168.2.3","216.58.197.4","TLSv1.2","1434","Application Data [TCP segment of a reassembled PDU]"
"57","2018-08-23 02:07:07.259551","192.168.2.3","216.58.197.4","TCP","1434","34236  >  443 [PSH, ACK] Seq=48589 Ack=39 Win=2363 Len=1368 TSval=7870938 TSecr=760602053 [TCP segment of a reassembled PDU]"
"58","2018-08-23 02:07:07.260081","192.168.2.3","216.58.197.4","TLSv1.2","1434","Application Data [TCP segment of a reassembled PDU]"
"59","2018-08-23 02:07:07.260084","192.168.2.3","216.58.197.4","TLSv1.2","1434","Application Data [TCP segment of a reassembled PDU]"
"63","2018-08-23 02:07:07.261549","192.168.2.3","216.58.197.4","TCP","1434","34236  >  443 [ACK] Seq=52693 Ack=39 Win=2363 Len=1368 TSval=7870938 TSecr=760602056 [TCP segment of a reassembled PDU]"
"64","2018-08-23 02:07:07.262170","192.168.2.3","216.58.197.4","TLSv1.2","1434","Application Data [TCP segment of a reassembled PDU]"
"65","2018-08-23 02:07:07.262172","192.168.2.3","216.58.197.4","TLSv1.2","1434","Application Data [TCP segment of a reassembled PDU]"
"66","2018-08-23 02:07:07.262319","192.168.2.3","216.58.197.4","TCP","1434","34236  >  443 [ACK] Seq=56797 Ack=39 Win=2363 Len=1368 TSval=7870938 TSecr=760602057 [TCP segment of a reassembled PDU]"
"69","2018-08-23 02:07:07.262593","192.168.2.3","216.58.197.4","TLSv1.2","1434","Application Data [TCP segment of a reassembled PDU]"
"70","2018-08-23 02:07:07.262595","192.168.2.3","216.58.197.4","TLSv1.2","455","Application Data"
"78","2018-08-23 02:07:07.335421","192.168.2.3","216.58.197.4","TCP","1434","34236  >  443 [ACK] Seq=59922 Ack=39 Win=2363 Len=1368 TSval=7870944 TSecr=760602063 [TCP segment of a reassembled PDU]"
"79","2018-08-23 02:07:07.335426","192.168.2.3","216.58.197.4","TCP","1434","34236  >  443 [ACK] Seq=61290 Ack=39 Win=2363 Len=1368 TSval=7870944 TSecr=760602063 [TCP segment of a reassembled PDU]"
"80","2018-08-23 02:07:07.335427","192.168.2.3","216.58.197.4","TLSv1.2","212","Application Data"
"81","2018-08-23 02:07:07.335742","192.168.2.3","216.58.197.4","TCP","1434","34236  >  443 [ACK] Seq=62804 Ack=39 Win=2363 Len=1368 TSval=7870944 TSecr=760602063 [TCP segment of a reassembled PDU]"
"82","2018-08-23 02:07:07.335744","192.168.2.3","216.58.197.4","TLSv1.2","155","Application Data"
"85","2018-08-23 02:07:07.430459","192.168.2.3","216.58.197.4","TCP","1434","34236  >  443 [ACK] Seq=64261 Ack=39 Win=2363 Len=1368 TSval=7870955 TSecr=760602137 [TCP segment of a reassembled PDU]"
"86","2018-08-23 02:07:07.430925","192.168.2.3","216.58.197.4","TCP","1434","34236  >  443 [ACK] Seq=65629 Ack=39 Win=2363 Len=1368 TSval=7870955 TSecr=760602137 [TCP segment of a reassembled PDU]"
"87","2018-08-23 02:07:07.430928","192.168.2.3","216.58.197.4","TLSv1.2","212","Application Data"
"88","2018-08-23 02:07:07.431240","192.168.2.3","216.58.197.4","TCP","1434","34236  >  443 [ACK] Seq=67143 Ack=39 Win=2363 Len=1368 TSval=7870955 TSecr=760602137 [TCP segment of a reassembled PDU]"
"89","2018-08-23 02:07:07.431244","192.168.2.3","216.58.197.4","TLSv1.2","155","Application Data"
"95","2018-08-23 02:07:07.526753","192.168.2.3","216.58.197.4","TCP","66","34236  >  443 [ACK] Seq=68600 Ack=306 Win=2363 Len=0 TSval=7870965 TSecr=760602321"
"96","2018-08-23 02:07:07.543617","192.168.2.3","216.58.197.4","TCP","1434","34236  >  443 [ACK] Seq=68600 Ack=306 Win=2363 Len=1368 TSval=7870966 TSecr=760602321 [TCP segment of a reassembled PDU]"
"97","2018-08-23 02:07:07.543964","192.168.2.3","216.58.197.4","TCP","1434","34236  >  443 [ACK] Seq=69968 Ack=306 Win=2363 Len=1368 TSval=7870966 TSecr=760602321 [TCP segment of a reassembled PDU]"
"98","2018-08-23 02:07:07.543967","192.168.2.3","216.58.197.4","TLSv1.2","212","Application Data"
"99","2018-08-23 02:07:07.544314","192.168.2.3","216.58.197.4","TLSv1.2","1230","Application Data"
"104","2018-08-23 02:07:07.619828","192.168.2.3","216.58.197.4","TCP","66","34236  >  443 [ACK] Seq=72646 Ack=340 Win=2363 Len=0 TSval=7870971 TSecr=760602345"
"105","2018-08-23 02:07:07.652974","192.168.2.3","216.58.197.4","TCP","1434","34236  >  443 [ACK] Seq=72646 Ack=340 Win=2363 Len=1368 TSval=7870977 TSecr=760602345 [TCP segment of a reassembled PDU]"
"106","2018-08-23 02:07:07.657935","192.168.2.3","216.58.197.4","TCP","1434","34236  >  443 [ACK] Seq=74014 Ack=340 Win=2363 Len=1368 TSval=7870977 TSecr=760602345 [TCP segment of a reassembled PDU]"
"107","2018-08-23 02:07:07.657940","192.168.2.3","216.58.197.4","TLSv1.2","212","Application Data"
"108","2018-08-23 02:07:07.657941","192.168.2.3","216.58.197.4","TCP","1434","34236  >  443 [ACK] Seq=75528 Ack=340 Win=2363 Len=1368 TSval=7870977 TSecr=760602345 [TCP segment of a reassembled PDU]"
"109","2018-08-23 02:07:07.658060","192.168.2.3","216.58.197.4","TLSv1.2","155","Application Data"
"111","2018-08-23 02:07:07.661270","192.168.2.3","216.58.197.4","TCP","66","34236  >  443 [ACK] Seq=76985 Ack=597 Win=2363 Len=0 TSval=7870978 TSecr=760602456"
"114","2018-08-23 02:07:07.769850","192.168.2.3","216.58.197.4","TCP","1434","34236  >  443 [ACK] Seq=76985 Ack=597 Win=2363 Len=1368 TSval=7870989 TSecr=760602499 [TCP segment of a reassembled PDU]"
"115","2018-08-23 02:07:07.770262","192.168.2.3","216.58.197.4","TCP","1434","34236  >  443 [ACK] Seq=78353 Ack=597 Win=2363 Len=1368 TSval=7870989 TSecr=760602499 [TCP segment of a reassembled PDU]"
"116","2018-08-23 02:07:07.770266","192.168.2.3","216.58.197.4","TLSv1.2","212","Application Data"
"117","2018-08-23 02:07:07.770557","192.168.2.3","216.58.197.4","TCP","1434","34236  >  443 [ACK] Seq=79867 Ack=597 Win=2363 Len=1368 TSval=7870989 TSecr=760602499 [TCP segment of a reassembled PDU]"
"118","2018-08-23 02:07:07.770558","192.168.2.3","216.58.197.4","TLSv1.2","155","Application Data"
"123","2018-08-23 02:07:07.824017","192.168.2.3","216.58.197.4","TCP","66","34236  >  443 [ACK] Seq=81324 Ack=783 Win=2363 Len=0 TSval=7870994 TSecr=760602619"
"124","2018-08-23 02:07:07.878991","192.168.2.3","216.58.197.4","TCP","1434","34236  >  443 [ACK] Seq=81324 Ack=783 Win=2363 Len=1368 TSval=7871000 TSecr=760602619 [TCP segment of a reassembled PDU]"
"125","2018-08-23 02:07:07.879412","192.168.2.3","216.58.197.4","TCP","1434","34236  >  443 [ACK] Seq=82692 Ack=783 Win=2363 Len=1368 TSval=7871000 TSecr=760602619 [TCP segment of a reassembled PDU]"
"126","2018-08-23 02:07:07.879414","192.168.2.3","216.58.197.4","TLSv1.2","212","Application Data"
"127","2018-08-23 02:07:07.882640","192.168.2.3","216.58.197.4","TCP","1434","34236  >  443 [ACK] Seq=84206 Ack=783 Win=2363 Len=1368 TSval=7871000 TSecr=760602619 [TCP segment of a reassembled PDU]"
"128","2018-08-23 02:07:07.882643","192.168.2.3","216.58.197.4","TLSv1.2","155","Application Data"
"132","2018-08-23 02:07:07.992295","192.168.2.3","216.58.197.4","TCP","1434","34236  >  443 [ACK] Seq=85663 Ack=783 Win=2363 Len=1368 TSval=7871011 TSecr=760602684 [TCP segment of a reassembled PDU]"
"133","2018-08-23 02:07:07.992300","192.168.2.3","216.58.197.4","TCP","1434","34236  >  443 [ACK] Seq=87031 Ack=783 Win=2363 Len=1368 TSval=7871011 TSecr=760602684 [TCP segment of a reassembled PDU]"
"134","2018-08-23 02:07:07.992301","192.168.2.3","216.58.197.4","TLSv1.2","212","Application Data"
"135","2018-08-23 02:07:07.992455","192.168.2.3","216.58.197.4","TCP","1434","34236  >  443 [ACK] Seq=88545 Ack=783 Win=2363 Len=1368 TSval=7871011 TSecr=760602684 [TCP segment of a reassembled PDU]"
"136","2018-08-23 02:07:07.992597","192.168.2.3","216.58.197.4","TLSv1.2","155","Application Data"
"140","2018-08-23 02:07:08.093608","192.168.2.3","216.58.197.4","TCP","1434","34236  >  443 [ACK] Seq=90002 Ack=783 Win=2363 Len=1368 TSval=7871021 TSecr=760602793 [TCP segment of a reassembled PDU]"
"141","2018-08-23 02:07:08.093613","192.168.2.3","216.58.197.4","TCP","1434","34236  >  443 [ACK] Seq=91370 Ack=783 Win=2363 Len=1368 TSval=7871021 TSecr=760602793 [TCP segment of a reassembled PDU]"
"142","2018-08-23 02:07:08.093614","192.168.2.3","216.58.197.4","TLSv1.2","212","Application Data"
"143","2018-08-23 02:07:08.093829","192.168.2.3","216.58.197.4","TCP","1434","34236  >  443 [ACK] Seq=92884 Ack=783 Win=2363 Len=1368 TSval=7871021 TSecr=760602793 [TCP segment of a reassembled PDU]"
"144","2018-08-23 02:07:08.093834","192.168.2.3","216.58.197.4","TLSv1.2","155","Application Data"
"148","2018-08-23 02:07:08.196854","192.168.2.3","216.58.197.4","TCP","1434","34236  >  443 [ACK] Seq=94341 Ack=783 Win=2363 Len=1368 TSval=7871032 TSecr=760602895 [TCP segment of a reassembled PDU]"
"149","2018-08-23 02:07:08.197118","192.168.2.3","216.58.197.4","TCP","1434","34236  >  443 [ACK] Seq=95709 Ack=783 Win=2363 Len=1368 TSval=7871032 TSecr=760602895 [TCP segment of a reassembled PDU]"
"150","2018-08-23 02:07:08.197121","192.168.2.3","216.58.197.4","TLSv1.2","212","Application Data"
"151","2018-08-23 02:07:08.197329","192.168.2.3","216.58.197.4","TCP","1434","34236  >  443 [ACK] Seq=97223 Ack=783 Win=2363 Len=1368 TSval=7871032 TSecr=760602895 [TCP segment of a reassembled PDU]"
"152","2018-08-23 02:07:08.197331","192.168.2.3","216.58.197.4","TLSv1.2","113","Application Data"
"156","2018-08-23 02:07:08.314069","192.168.2.3","216.58.197.4","TCP","1434","34236  >  443 [ACK] Seq=98638 Ack=783 Win=2363 Len=1368 TSval=7871043 TSecr=760602998 [TCP segment of a reassembled PDU]"
"157","2018-08-23 02:07:08.314086","192.168.2.3","216.58.197.4","TCP","1434","34236  >  443 [ACK] Seq=100006 Ack=783 Win=2363 Len=1368 TSval=7871043 TSecr=760602998 [TCP segment of a reassembled PDU]"
"158","2018-08-23 02:07:08.314129","192.168.2.3","216.58.197.4","TLSv1.2","212","Application Data"
"159","2018-08-23 02:07:08.314349","192.168.2.3","216.58.197.4","TCP","1434","34236  >  443 [ACK] Seq=101520 Ack=783 Win=2363 Len=1368 TSval=7871043 TSecr=760602998 [TCP segment of a reassembled PDU]"
"160","2018-08-23 02:07:08.314354","192.168.2.3","216.58.197.4","TLSv1.2","138","Application Data"
"164","2018-08-23 02:07:08.422483","192.168.2.3","216.58.197.4","TCP","1434","34236  >  443 [ACK] Seq=102960 Ack=783 Win=2363 Len=1368 TSval=7871054 TSecr=760603115 [TCP segment of a reassembled PDU]"
"165","2018-08-23 02:07:08.422799","192.168.2.3","216.58.197.4","TCP","1434","34236  >  443 [ACK] Seq=104328 Ack=783 Win=2363 Len=1368 TSval=7871054 TSecr=760603115 [TCP segment of a reassembled PDU]"
"166","2018-08-23 02:07:08.422801","192.168.2.3","216.58.197.4","TLSv1.2","212","Application Data"
"167","2018-08-23 02:07:08.423185","192.168.2.3","216.58.197.4","TCP","1434","34236  >  443 [ACK] Seq=105842 Ack=783 Win=2363 Len=1368 TSval=7871054 TSecr=760603115 [TCP segment of a reassembled PDU]"
"168","2018-08-23 02:07:08.423188","192.168.2.3","216.58.197.4","TLSv1.2","155","Application Data"
"173","2018-08-23 02:07:08.507899","192.168.2.3","216.58.197.4","TCP","66","34236  >  443 [ACK] Seq=107299 Ack=861 Win=2363 Len=0 TSval=7871063 TSecr=760603302"
"175","2018-08-23 02:07:08.523847","192.168.2.3","216.58.197.4","TCP","66","34236  >  443 [ACK] Seq=107299 Ack=978 Win=2363 Len=0 TSval=7871064 TSecr=760603319"
"176","2018-08-23 02:07:08.537727","192.168.2.3","216.58.197.4","TCP","1434","34236  >  443 [ACK] Seq=107299 Ack=978 Win=2363 Len=1368 TSval=7871066 TSecr=760603319 [TCP segment of a reassembled PDU]"
"177","2018-08-23 02:07:08.538145","192.168.2.3","216.58.197.4","TCP","1434","34236  >  443 [ACK] Seq=108667 Ack=978 Win=2363 Len=1368 TSval=7871066 TSecr=760603319 [TCP segment of a reassembled PDU]"
"178","2018-08-23 02:07:08.538147","192.168.2.3","216.58.197.4","TLSv1.2","212","Application Data"
"179","2018-08-23 02:07:08.538553","192.168.2.3","216.58.197.4","TCP","1434","34236  >  443 [ACK] Seq=110181 Ack=978 Win=2363 Len=1368 TSval=7871066 TSecr=760603319 [TCP segment of a reassembled PDU]"
"180","2018-08-23 02:07:08.538555","192.168.2.3","216.58.197.4","TLSv1.2","155","Application Data"
"184","2018-08-23 02:07:08.644694","192.168.2.3","216.58.197.4","TCP","1434","34236  >  443 [ACK] Seq=111638 Ack=978 Win=2363 Len=1368 TSval=7871076 TSecr=760603339 [TCP segment of a reassembled PDU]"
"185","2018-08-23 02:07:08.645085","192.168.2.3","216.58.197.4","TCP","1434","34236  >  443 [ACK] Seq=113006 Ack=978 Win=2363 Len=1368 TSval=7871077 TSecr=760603339 [TCP segment of a reassembled PDU]"
"186","2018-08-23 02:07:08.645087","192.168.2.3","216.58.197.4","TLSv1.2","212","Application Data"
"187","2018-08-23 02:07:08.647907","192.168.2.3","216.58.197.4","TCP","1434","34236  >  443 [ACK] Seq=114520 Ack=978 Win=2363 Len=1368 TSval=7871077 TSecr=760603339 [TCP segment of a reassembled PDU]"
"188","2018-08-23 02:07:08.647909","192.168.2.3","216.58.197.4","TLSv1.2","155","Application Data"
"192","2018-08-23 02:07:08.761758","192.168.2.3","216.58.197.4","TCP","1434","34236  >  443 [ACK] Seq=115977 Ack=978 Win=2363 Len=1368 TSval=7871088 TSecr=760603449 [TCP segment of a reassembled PDU]"
"193","2018-08-23 02:07:08.761998","192.168.2.3","216.58.197.4","TCP","1434","34236  >  443 [ACK] Seq=117345 Ack=978 Win=2363 Len=1368 TSval=7871088 TSecr=760603449 [TCP segment of a reassembled PDU]"
"194","2018-08-23 02:07:08.762000","192.168.2.3","216.58.197.4","TLSv1.2","212","Application Data"
"195","2018-08-23 02:07:08.762402","192.168.2.3","216.58.197.4","TCP","1434","34236  >  443 [ACK] Seq=118859 Ack=978 Win=2363 Len=1368 TSval=7871088 TSecr=760603449 [TCP segment of a reassembled PDU]"
"196","2018-08-23 02:07:08.762405","192.168.2.3","216.58.197.4","TLSv1.2","155","Application Data"
"200","2018-08-23 02:07:08.856027","192.168.2.3","216.58.197.4","TCP","1434","34236  >  443 [ACK] Seq=120316 Ack=978 Win=2363 Len=1368 TSval=7871098 TSecr=760603563 [TCP segment of a reassembled PDU]"
"201","2018-08-23 02:07:08.856418","192.168.2.3","216.58.197.4","TCP","1434","34236  >  443 [ACK] Seq=121684 Ack=978 Win=2363 Len=1368 TSval=7871098 TSecr=760603563 [TCP segment of a reassembled PDU]"
"202","2018-08-23 02:07:08.856422","192.168.2.3","216.58.197.4","TLSv1.2","212","Application Data"
"203","2018-08-23 02:07:08.856542","192.168.2.3","216.58.197.4","TCP","1434","34236  >  443 [ACK] Seq=123198 Ack=978 Win=2363 Len=1368 TSval=7871098 TSecr=760603563 [TCP segment of a reassembled PDU]"
"204","2018-08-23 02:07:08.856547","192.168.2.3","216.58.197.4","TLSv1.2","155","Application Data"
"208","2018-08-23 02:07:08.934710","192.168.2.3","216.58.197.4","TCP","1434","34236  >  443 [ACK] Seq=124655 Ack=978 Win=2363 Len=1368 TSval=7871105 TSecr=760603657 [TCP segment of a reassembled PDU]"
"209","2018-08-23 02:07:08.934989","192.168.2.3","216.58.197.4","TCP","1434","34236  >  443 [ACK] Seq=126023 Ack=978 Win=2363 Len=1368 TSval=7871105 TSecr=760603657 [TCP segment of a reassembled PDU]"
"210","2018-08-23 02:07:08.934993","192.168.2.3","216.58.197.4","TLSv1.2","212","Application Data"
"211","2018-08-23 02:07:08.934994","192.168.2.3","216.58.197.4","TCP","1434","34236  >  443 [ACK] Seq=127537 Ack=978 Win=2363 Len=1368 TSval=7871106 TSecr=760603657 [TCP segment of a reassembled PDU]"
"212","2018-08-23 02:07:08.935139","192.168.2.3","216.58.197.4","TLSv1.2","155","Application Data"
"216","2018-08-23 02:07:09.028546","192.168.2.3","216.58.197.4","TCP","1434","34236  >  443 [ACK] Seq=128994 Ack=978 Win=2363 Len=1368 TSval=7871115 TSecr=760603736 [TCP segment of a reassembled PDU]"
"217","2018-08-23 02:07:09.028995","192.168.2.3","216.58.197.4","TCP","1434","34236  >  443 [ACK] Seq=130362 Ack=978 Win=2363 Len=1368 TSval=7871115 TSecr=760603736 [TCP segment of a reassembled PDU]"
"218","2018-08-23 02:07:09.028997","192.168.2.3","216.58.197.4","TLSv1.2","212","Application Data"
"219","2018-08-23 02:07:09.029478","192.168.2.3","216.58.197.4","TCP","1434","34236  >  443 [ACK] Seq=131876 Ack=978 Win=2363 Len=1368 TSval=7871115 TSecr=760603736 [TCP segment of a reassembled PDU]"
"220","2018-08-23 02:07:09.029481","192.168.2.3","216.58.197.4","TLSv1.2","155","Application Data"
"224","2018-08-23 02:07:09.124724","192.168.2.3","216.58.197.4","TCP","1434","34236  >  443 [ACK] Seq=133333 Ack=978 Win=2363 Len=1368 TSval=7871124 TSecr=760603830 [TCP segment of a reassembled PDU]"
"225","2018-08-23 02:07:09.124882","192.168.2.3","216.58.197.4","TCP","1434","34236  >  443 [ACK] Seq=134701 Ack=978 Win=2363 Len=1368 TSval=7871124 TSecr=760603830 [TCP segment of a reassembled PDU]"
"226","2018-08-23 02:07:09.124886","192.168.2.3","216.58.197.4","TLSv1.2","212","Application Data"
"227","2018-08-23 02:07:09.125405","192.168.2.3","216.58.197.4","TCP","1434","34236  >  443 [ACK] Seq=136215 Ack=978 Win=2363 Len=1368 TSval=7871124 TSecr=760603830 [TCP segment of a reassembled PDU]"
"228","2018-08-23 02:07:09.125409","192.168.2.3","216.58.197.4","TLSv1.2","155","Application Data"
"232","2018-08-23 02:07:09.213593","192.168.2.3","216.58.197.4","TCP","1434","34236  >  443 [ACK] Seq=137672 Ack=978 Win=2363 Len=1368 TSval=7871133 TSecr=760603926 [TCP segment of a reassembled PDU]"
"233","2018-08-23 02:07:09.213598","192.168.2.3","216.58.197.4","TCP","1434","34236  >  443 [ACK] Seq=139040 Ack=978 Win=2363 Len=1368 TSval=7871133 TSecr=760603926 [TCP segment of a reassembled PDU]"
"234","2018-08-23 02:07:09.213599","192.168.2.3","216.58.197.4","TLSv1.2","212","Application Data"
"235","2018-08-23 02:07:09.213976","192.168.2.3","216.58.197.4","TCP","1434","34236  >  443 [ACK] Seq=140554 Ack=978 Win=2363 Len=1368 TSval=7871133 TSecr=760603926 [TCP segment of a reassembled PDU]"
"236","2018-08-23 02:07:09.213979","192.168.2.3","216.58.197.4","TLSv1.2","155","Application Data"
"242","2018-08-23 02:07:09.276563","192.168.2.3","216.58.197.4","TCP","66","34236  >  443 [ACK] Seq=142011 Ack=1249 Win=2363 Len=0 TSval=7871140 TSecr=760604072"
"243","2018-08-23 02:07:09.306901","192.168.2.3","216.58.197.4","TCP","1434","34236  >  443 [ACK] Seq=142011 Ack=1249 Win=2363 Len=1368 TSval=7871143 TSecr=760604072 [TCP segment of a reassembled PDU]"
"244","2018-08-23 02:07:09.307272","192.168.2.3","216.58.197.4","TCP","1434","34236  >  443 [ACK] Seq=143379 Ack=1249 Win=2363 Len=1368 TSval=7871143 TSecr=760604072 [TCP segment of a reassembled PDU]"
"245","2018-08-23 02:07:09.307278","192.168.2.3","216.58.197.4","TLSv1.2","212","Application Data"
"246","2018-08-23 02:07:09.307439","192.168.2.3","216.58.197.4","TCP","1434","34236  >  443 [ACK] Seq=144893 Ack=1249 Win=2363 Len=1368 TSval=7871143 TSecr=760604072 [TCP segment of a reassembled PDU]"
"247","2018-08-23 02:07:09.307442","192.168.2.3","216.58.197.4","TLSv1.2","155","Application Data"
"250","2018-08-23 02:07:09.382632","192.168.2.3","216.58.197.4","TCP","1434","34236  >  443 [ACK] Seq=146350 Ack=1249 Win=2363 Len=1368 TSval=7871150 TSecr=760604109 [TCP segment of a reassembled PDU]"
"251","2018-08-23 02:07:09.383105","192.168.2.3","216.58.197.4","TCP","1434","34236  >  443 [ACK] Seq=147718 Ack=1249 Win=2363 Len=1368 TSval=7871150 TSecr=760604109 [TCP segment of a reassembled PDU]"
"252","2018-08-23 02:07:09.383108","192.168.2.3","216.58.197.4","TLSv1.2","212","Application Data"
"253","2018-08-23 02:07:09.383109","192.168.2.3","216.58.197.4","TCP","1434","34236  >  443 [ACK] Seq=149232 Ack=1249 Win=2363 Len=1368 TSval=7871150 TSecr=760604109 [TCP segment of a reassembled PDU]"
"254","2018-08-23 02:07:09.383110","192.168.2.3","216.58.197.4","TLSv1.2","155","Application Data"
"258","2018-08-23 02:07:09.479119","192.168.2.3","216.58.197.4","TCP","1434","34236  >  443 [ACK] Seq=150689 Ack=1249 Win=2363 Len=1368 TSval=7871160 TSecr=760604184 [TCP segment of a reassembled PDU]"
"259","2018-08-23 02:07:09.479497","192.168.2.3","216.58.197.4","TCP","1434","34236  >  443 [ACK] Seq=152057 Ack=1249 Win=2363 Len=1368 TSval=7871160 TSecr=760604184 [TCP segment of a reassembled PDU]"
"260","2018-08-23 02:07:09.479501","192.168.2.3","216.58.197.4","TLSv1.2","212","Application Data"
"261","2018-08-23 02:07:09.479739","192.168.2.3","216.58.197.4","TCP","1434","34236  >  443 [ACK] Seq=153571 Ack=1249 Win=2363 Len=1368 TSval=7871160 TSecr=760604184 [TCP segment of a reassembled PDU]"
"262","2018-08-23 02:07:09.479741","192.168.2.3","216.58.197.4","TLSv1.2","155","Application Data"
"270","2018-08-23 02:07:09.528369","192.168.2.3","216.58.197.4","TCP","66","34236  >  443 [ACK] Seq=155028 Ack=1563 Win=2363 Len=0 TSval=7871165 TSecr=760604302"
"271","2018-08-23 02:07:09.529463","192.168.2.3","216.58.197.4","TCP","66","34236  >  443 [ACK] Seq=155028 Ack=1990 Win=2363 Len=0 TSval=7871165 TSecr=760604324"
"272","2018-08-23 02:07:09.572576","192.168.2.3","216.58.197.4","TCP","1434","34236  >  443 [ACK] Seq=155028 Ack=1990 Win=2363 Len=1368 TSval=7871169 TSecr=760604324 [TCP segment of a reassembled PDU]"
"273","2018-08-23 02:07:09.572854","192.168.2.3","216.58.197.4","TCP","1434","34236  >  443 [ACK] Seq=156396 Ack=1990 Win=2363 Len=1368 TSval=7871169 TSecr=760604324 [TCP segment of a reassembled PDU]"
"274","2018-08-23 02:07:09.572858","192.168.2.3","216.58.197.4","TLSv1.2","212","Application Data"
"275","2018-08-23 02:07:09.573211","192.168.2.3","216.58.197.4","TCP","1434","34236  >  443 [ACK] Seq=157910 Ack=1990 Win=2363 Len=1368 TSval=7871169 TSecr=760604324 [TCP segment of a reassembled PDU]"
"276","2018-08-23 02:07:09.573214","192.168.2.3","216.58.197.4","TLSv1.2","155","Application Data"
"280","2018-08-23 02:07:09.661994","192.168.2.3","216.58.197.4","TCP","1434","34236  >  443 [ACK] Seq=159367 Ack=1990 Win=2363 Len=1368 TSval=7871178 TSecr=760604414 [TCP segment of a reassembled PDU]"
"281","2018-08-23 02:07:09.662000","192.168.2.3","216.58.197.4","TCP","1434","34236  >  443 [ACK] Seq=160735 Ack=1990 Win=2363 Len=1368 TSval=7871178 TSecr=760604414 [TCP segment of a reassembled PDU]"
"282","2018-08-23 02:07:09.662001","192.168.2.3","216.58.197.4","TLSv1.2","212","Application Data"
"283","2018-08-23 02:07:09.662443","192.168.2.3","216.58.197.4","TCP","1434","34236  >  443 [ACK] Seq=162249 Ack=1990 Win=2363 Len=1368 TSval=7871178 TSecr=760604414 [TCP segment of a reassembled PDU]"
"284","2018-08-23 02:07:09.662447","192.168.2.3","216.58.197.4","TLSv1.2","155","Application Data"
"289","2018-08-23 02:07:09.715314","192.168.2.3","216.58.197.4","TCP","66","34236  >  443 [ACK] Seq=163706 Ack=2283 Win=2363 Len=0 TSval=7871184 TSecr=760604510"
"290","2018-08-23 02:07:09.754710","192.168.2.3","216.58.197.4","TCP","1434","34236  >  443 [ACK] Seq=163706 Ack=2283 Win=2363 Len=1368 TSval=7871187 TSecr=760604510 [TCP segment of a reassembled PDU]"
"291","2018-08-23 02:07:09.755193","192.168.2.3","216.58.197.4","TCP","1434","34236  >  443 [ACK] Seq=165074 Ack=2283 Win=2363 Len=1368 TSval=7871188 TSecr=760604510 [TCP segment of a reassembled PDU]"
"292","2018-08-23 02:07:09.755195","192.168.2.3","216.58.197.4","TLSv1.2","212","Application Data"
"293","2018-08-23 02:07:09.755196","192.168.2.3","216.58.197.4","TCP","1434","34236  >  443 [ACK] Seq=166588 Ack=2283 Win=2363 Len=1368 TSval=7871188 TSecr=760604510 [TCP segment of a reassembled PDU]"
"294","2018-08-23 02:07:09.755197","192.168.2.3","216.58.197.4","TLSv1.2","155","Application Data"
"299","2018-08-23 02:07:09.794443","192.168.2.3","216.58.197.4","TCP","66","34236  >  443 [ACK] Seq=168045 Ack=2409 Win=2363 Len=0 TSval=7871192 TSecr=760604553"
"302","2018-08-23 02:07:09.801664","192.168.2.3","216.58.197.4","TCP","66","34236  >  443 [ACK] Seq=168045 Ack=2755 Win=2363 Len=0 TSval=7871192 TSecr=760604597"
"303","2018-08-23 02:07:09.847840","192.168.2.3","216.58.197.4","TCP","1434","34236  >  443 [ACK] Seq=168045 Ack=2755 Win=2363 Len=1368 TSval=7871197 TSecr=760604597 [TCP segment of a reassembled PDU]"
"304","2018-08-23 02:07:09.848144","192.168.2.3","216.58.197.4","TCP","1434","34236  >  443 [ACK] Seq=169413 Ack=2755 Win=2363 Len=1368 TSval=7871197 TSecr=760604597 [TCP segment of a reassembled PDU]"
"305","2018-08-23 02:07:09.848165","192.168.2.3","216.58.197.4","TLSv1.2","212","Application Data"
"306","2018-08-23 02:07:09.848636","192.168.2.3","216.58.197.4","TCP","1434","34236  >  443 [ACK] Seq=170927 Ack=2755 Win=2363 Len=1368 TSval=7871197 TSecr=760604597 [TCP segment of a reassembled PDU]"
"307","2018-08-23 02:07:09.848642","192.168.2.3","216.58.197.4","TLSv1.2","155","Application Data"
"313","2018-08-23 02:07:09.898704","192.168.2.3","216.58.197.4","TCP","66","34236  >  443 [ACK] Seq=172384 Ack=2945 Win=2363 Len=0 TSval=7871202 TSecr=760604694"
"314","2018-08-23 02:07:09.946580","192.168.2.3","216.58.197.4","TCP","1434","34236  >  443 [ACK] Seq=172384 Ack=2945 Win=2363 Len=1368 TSval=7871207 TSecr=760604694 [TCP segment of a reassembled PDU]"
"315","2018-08-23 02:07:09.946920","192.168.2.3","216.58.197.4","TCP","1434","34236  >  443 [ACK] Seq=173752 Ack=2945 Win=2363 Len=1368 TSval=7871207 TSecr=760604694 [TCP segment of a reassembled PDU]"
"316","2018-08-23 02:07:09.946922","192.168.2.3","216.58.197.4","TLSv1.2","212","Application Data"
"317","2018-08-23 02:07:09.947084","192.168.2.3","216.58.197.4","TCP","1434","34236  >  443 [ACK] Seq=175266 Ack=2945 Win=2363 Len=1368 TSval=7871207 TSecr=760604694 [TCP segment of a reassembled PDU]"
"318","2018-08-23 02:07:09.947087","192.168.2.3","216.58.197.4","TLSv1.2","155","Application Data"
"322","2018-08-23 02:07:10.042206","192.168.2.3","216.58.197.4","TCP","1434","34236  >  443 [ACK] Seq=176723 Ack=2945 Win=2363 Len=1368 TSval=7871216 TSecr=760604748 [TCP segment of a reassembled PDU]"
"323","2018-08-23 02:07:10.042518","192.168.2.3","216.58.197.4","TCP","1434","34236  >  443 [ACK] Seq=178091 Ack=2945 Win=2363 Len=1368 TSval=7871216 TSecr=760604748 [TCP segment of a reassembled PDU]"
"324","2018-08-23 02:07:10.042522","192.168.2.3","216.58.197.4","TLSv1.2","212","Application Data"
"325","2018-08-23 02:07:10.042523","192.168.2.3","216.58.197.4","TCP","1434","34236  >  443 [ACK] Seq=179605 Ack=2945 Win=2363 Len=1368 TSval=7871216 TSecr=760604748 [TCP segment of a reassembled PDU]"
"326","2018-08-23 02:07:10.042693","192.168.2.3","216.58.197.4","TLSv1.2","155","Application Data"
"332","2018-08-23 02:07:10.104140","192.168.2.3","216.58.197.4","TCP","66","34236  >  443 [ACK] Seq=181062 Ack=3271 Win=2363 Len=0 TSval=7871222 TSecr=760604899"
"333","2018-08-23 02:07:10.117405","192.168.2.3","216.58.197.4","TCP","1434","34236  >  443 [ACK] Seq=181062 Ack=3271 Win=2363 Len=1368 TSval=7871224 TSecr=760604899 [TCP segment of a reassembled PDU]"
"334","2018-08-23 02:07:10.117801","192.168.2.3","216.58.197.4","TCP","1434","34236  >  443 [ACK] Seq=182430 Ack=3271 Win=2363 Len=1368 TSval=7871224 TSecr=760604899 [TCP segment of a reassembled PDU]"
"335","2018-08-23 02:07:10.117804","192.168.2.3","216.58.197.4","TLSv1.2","212","Application Data"
"336","2018-08-23 02:07:10.118149","192.168.2.3","216.58.197.4","TCP","1434","34236  >  443 [ACK] Seq=183944 Ack=3271 Win=2363 Len=1368 TSval=7871224 TSecr=760604899 [TCP segment of a reassembled PDU]"
"337","2018-08-23 02:07:10.118151","192.168.2.3","216.58.197.4","TLSv1.2","155","Application Data"
"341","2018-08-23 02:07:10.231892","192.168.2.3","216.58.197.4","TCP","1434","34236  >  443 [ACK] Seq=185401 Ack=3271 Win=2363 Len=1368 TSval=7871235 TSecr=760604919 [TCP segment of a reassembled PDU]"
"342","2018-08-23 02:07:10.232175","192.168.2.3","216.58.197.4","TCP","1434","34236  >  443 [ACK] Seq=186769 Ack=3271 Win=2363 Len=1368 TSval=7871235 TSecr=760604919 [TCP segment of a reassembled PDU]"
"343","2018-08-23 02:07:10.232177","192.168.2.3","216.58.197.4","TLSv1.2","212","Application Data"
"344","2018-08-23 02:07:10.232597","192.168.2.3","216.58.197.4","TCP","1434","34236  >  443 [ACK] Seq=188283 Ack=3271 Win=2363 Len=1368 TSval=7871235 TSecr=760604919 [TCP segment of a reassembled PDU]"
"345","2018-08-23 02:07:10.232601","192.168.2.3","216.58.197.4","TLSv1.2","155","Application Data"
"351","2018-08-23 02:07:10.292456","192.168.2.3","216.58.197.4","TCP","66","34236  >  443 [ACK] Seq=189740 Ack=3650 Win=2363 Len=0 TSval=7871241 TSecr=760605087"
"352","2018-08-23 02:07:10.330462","192.168.2.3","216.58.197.4","TCP","1434","34236  >  443 [ACK] Seq=189740 Ack=3650 Win=2363 Len=1368 TSval=7871245 TSecr=760605087 [TCP segment of a reassembled PDU]"
"353","2018-08-23 02:07:10.330477","192.168.2.3","216.58.197.4","TCP","1434","34236  >  443 [ACK] Seq=191108 Ack=3650 Win=2363 Len=1368 TSval=7871245 TSecr=760605087 [TCP segment of a reassembled PDU]"
"354","2018-08-23 02:07:10.330479","192.168.2.3","216.58.197.4","TLSv1.2","212","Application Data"
"355","2018-08-23 02:07:10.330724","192.168.2.3","216.58.197.4","TCP","1434","34236  >  443 [ACK] Seq=192622 Ack=3650 Win=2363 Len=1368 TSval=7871245 TSecr=760605087 [TCP segment of a reassembled PDU]"
"356","2018-08-23 02:07:10.330731","192.168.2.3","216.58.197.4","TLSv1.2","155","Application Data"
"360","2018-08-23 02:07:10.438892","192.168.2.3","216.58.197.4","TCP","1434","34236  >  443 [ACK] Seq=194079 Ack=3650 Win=2363 Len=1368 TSval=7871256 TSecr=760605132 [TCP segment of a reassembled PDU]"
"361","2018-08-23 02:07:10.439336","192.168.2.3","216.58.197.4","TCP","1434","34236  >  443 [ACK] Seq=195447 Ack=3650 Win=2363 Len=1368 TSval=7871256 TSecr=760605132 [TCP segment of a reassembled PDU]"
"362","2018-08-23 02:07:10.439341","192.168.2.3","216.58.197.4","TLSv1.2","212","Application Data"
"363","2018-08-23 02:07:10.442568","192.168.2.3","216.58.197.4","TCP","1434","34236  >  443 [ACK] Seq=196961 Ack=3650 Win=2363 Len=1368 TSval=7871256 TSecr=760605132 [TCP segment of a reassembled PDU]"
"364","2018-08-23 02:07:10.442572","192.168.2.3","216.58.197.4","TLSv1.2","155","Application Data"
"370","2018-08-23 02:07:10.506118","192.168.2.3","216.58.197.4","TCP","66","34236  >  443 [ACK] Seq=198418 Ack=3854 Win=2363 Len=0 TSval=7871263 TSecr=760605301"
"373","2018-08-23 02:07:10.525788","192.168.2.3","216.58.197.4","TCP","66","34236  >  443 [ACK] Seq=198418 Ack=4275 Win=2363 Len=0 TSval=7871265 TSecr=760605304"
"374","2018-08-23 02:07:10.554510","192.168.2.3","216.58.197.4","TCP","1434","34236  >  443 [ACK] Seq=198418 Ack=4275 Win=2363 Len=1368 TSval=7871267 TSecr=760605304 [TCP segment of a reassembled PDU]"
"375","2018-08-23 02:07:10.554902","192.168.2.3","216.58.197.4","TCP","1434","34236  >  443 [ACK] Seq=199786 Ack=4275 Win=2363 Len=1368 TSval=7871267 TSecr=760605304 [TCP segment of a reassembled PDU]"
"376","2018-08-23 02:07:10.554904","192.168.2.3","216.58.197.4","TLSv1.2","212","Application Data"
"377","2018-08-23 02:07:10.554905","192.168.2.3","216.58.197.4","TCP","1434","34236  >  443 [ACK] Seq=201300 Ack=4275 Win=2363 Len=1368 TSval=7871267 TSecr=760605304 [TCP segment of a reassembled PDU]"
"378","2018-08-23 02:07:10.555152","192.168.2.3","216.58.197.4","TLSv1.2","155","Application Data"
"382","2018-08-23 02:07:10.653496","192.168.2.3","216.58.197.4","TCP","1434","34236  >  443 [ACK] Seq=202757 Ack=4549 Win=2363 Len=1368 TSval=7871277 TSecr=760605444 [TCP segment of a reassembled PDU]"
"383","2018-08-23 02:07:10.654585","192.168.2.3","216.58.197.4","TCP","1434","34236  >  443 [ACK] Seq=204125 Ack=4549 Win=2363 Len=1368 TSval=7871277 TSecr=760605444 [TCP segment of a reassembled PDU]"
"384","2018-08-23 02:07:10.654587","192.168.2.3","216.58.197.4","TLSv1.2","212","Application Data"
"385","2018-08-23 02:07:10.654588","192.168.2.3","216.58.197.4","TCP","1434","34236  >  443 [ACK] Seq=205639 Ack=4549 Win=2363 Len=1368 TSval=7871277 TSecr=760605444 [TCP segment of a reassembled PDU]"
"386","2018-08-23 02:07:10.654589","192.168.2.3","216.58.197.4","TLSv1.2","155","Application Data"
"390","2018-08-23 02:07:10.674434","192.168.2.3","216.58.197.14","TCP","66","41152  >  443 [ACK] Seq=1 Ack=1 Win=494 Len=0 TSval=7871280 TSecr=933569090"
"394","2018-08-23 02:07:10.705145","192.168.2.3","216.58.197.4","TCP","66","34236  >  443 [ACK] Seq=207096 Ack=4758 Win=2363 Len=0 TSval=7871283 TSecr=760605500"
"395","2018-08-23 02:07:10.759032","192.168.2.3","216.58.197.4","TCP","1434","34236  >  443 [ACK] Seq=207096 Ack=4758 Win=2363 Len=1368 TSval=7871288 TSecr=760605500 [TCP segment of a reassembled PDU]"
"396","2018-08-23 02:07:10.759406","192.168.2.3","216.58.197.4","TCP","1434","34236  >  443 [ACK] Seq=208464 Ack=4758 Win=2363 Len=1368 TSval=7871288 TSecr=760605500 [TCP segment of a reassembled PDU]"
"397","2018-08-23 02:07:10.759409","192.168.2.3","216.58.197.4","TLSv1.2","212","Application Data"
"398","2018-08-23 02:07:10.759878","192.168.2.3","216.58.197.4","TCP","1434","34236  >  443 [ACK] Seq=209978 Ack=4758 Win=2363 Len=1368 TSval=7871288 TSecr=760605500 [TCP segment of a reassembled PDU]"
"399","2018-08-23 02:07:10.759882","192.168.2.3","216.58.197.4","TLSv1.2","124","Application Data"
"403","2018-08-23 02:07:10.872080","192.168.2.3","216.58.197.4","TCP","1434","34236  >  443 [ACK] Seq=211404 Ack=4758 Win=2363 Len=1368 TSval=7871299 TSecr=760605561 [TCP segment of a reassembled PDU]"
"404","2018-08-23 02:07:10.872500","192.168.2.3","216.58.197.4","TCP","1434","34236  >  443 [ACK] Seq=212772 Ack=4758 Win=2363 Len=1368 TSval=7871299 TSecr=760605561 [TCP segment of a reassembled PDU]"
"405","2018-08-23 02:07:10.872503","192.168.2.3","216.58.197.4","TLSv1.2","212","Application Data"
"406","2018-08-23 02:07:10.872504","192.168.2.3","216.58.197.4","TCP","1434","34236  >  443 [ACK] Seq=214286 Ack=4758 Win=2363 Len=1368 TSval=7871299 TSecr=760605561 [TCP segment of a reassembled PDU]"
"407","2018-08-23 02:07:10.872505","192.168.2.3","216.58.197.4","TLSv1.2","130","Application Data"
"410","2018-08-23 02:07:10.980835","192.168.2.3","216.58.197.4","TCP","1434","34236  >  443 [ACK] Seq=215718 Ack=4758 Win=2363 Len=1368 TSval=7871310 TSecr=760605674 [TCP segment of a reassembled PDU]"
"411","2018-08-23 02:07:10.981280","192.168.2.3","216.58.197.4","TCP","1434","34236  >  443 [ACK] Seq=217086 Ack=4758 Win=2363 Len=1368 TSval=7871310 TSecr=760605674 [TCP segment of a reassembled PDU]"
"412","2018-08-23 02:07:10.981282","192.168.2.3","216.58.197.4","TLSv1.2","212","Application Data"
"413","2018-08-23 02:07:10.981283","192.168.2.3","216.58.197.4","TCP","1434","34236  >  443 [ACK] Seq=218600 Ack=4758 Win=2363 Len=1368 TSval=7871310 TSecr=760605674 [TCP segment of a reassembled PDU]"
"414","2018-08-23 02:07:10.981515","192.168.2.3","216.58.197.4","TLSv1.2","155","Application Data"
"418","2018-08-23 02:07:11.098133","192.168.2.3","216.58.197.4","TCP","1434","34236  >  443 [ACK] Seq=220057 Ack=4758 Win=2363 Len=1368 TSval=7871322 TSecr=760605782 [TCP segment of a reassembled PDU]"
"419","2018-08-23 02:07:11.098415","192.168.2.3","216.58.197.4","TCP","1434","34236  >  443 [ACK] Seq=221425 Ack=4758 Win=2363 Len=1368 TSval=7871322 TSecr=760605782 [TCP segment of a reassembled PDU]"
"420","2018-08-23 02:07:11.098416","192.168.2.3","216.58.197.4","TLSv1.2","212","Application Data"
"421","2018-08-23 02:07:11.098852","192.168.2.3","216.58.197.4","TCP","1434","34236  >  443 [ACK] Seq=222939 Ack=4758 Win=2363 Len=1368 TSval=7871322 TSecr=760605782 [TCP segment of a reassembled PDU]"
"422","2018-08-23 02:07:11.098854","192.168.2.3","216.58.197.4","TLSv1.2","155","Application Data"
"428","2018-08-23 02:07:11.145354","192.168.2.3","216.58.197.4","TCP","66","34236  >  443 [ACK] Seq=224396 Ack=5145 Win=2363 Len=0 TSval=7871327 TSecr=760605941"
"429","2018-08-23 02:07:11.210780","192.168.2.3","216.58.197.4","TCP","1434","34236  >  443 [ACK] Seq=224396 Ack=5145 Win=2363 Len=1368 TSval=7871333 TSecr=760605941 [TCP segment of a reassembled PDU]"
"430","2018-08-23 02:07:11.210787","192.168.2.3","216.58.197.4","TCP","1434","34236  >  443 [ACK] Seq=225764 Ack=5145 Win=2363 Len=1368 TSval=7871333 TSecr=760605941 [TCP segment of a reassembled PDU]"
"431","2018-08-23 02:07:11.210788","192.168.2.3","216.58.197.4","TLSv1.2","212","Application Data"
"432","2018-08-23 02:07:11.211066","192.168.2.3","216.58.197.4","TCP","1434","34236  >  443 [ACK] Seq=227278 Ack=5145 Win=2363 Len=1368 TSval=7871333 TSecr=760605941 [TCP segment of a reassembled PDU]"
"433","2018-08-23 02:07:11.211069","192.168.2.3","216.58.197.4","TLSv1.2","155","Application Data"
"439","2018-08-23 02:07:11.258073","192.168.2.3","216.58.197.4","TCP","66","34236  >  443 [ACK] Seq=228735 Ack=5521 Win=2363 Len=0 TSval=7871338 TSecr=760606052"
"442","2018-08-23 02:07:11.291632","192.168.2.3","216.58.197.4","TCP","66","34236  >  443 [ACK] Seq=228735 Ack=6107 Win=2363 Len=0 TSval=7871341 TSecr=760606086"
"443","2018-08-23 02:07:11.307055","192.168.2.3","216.58.197.4","TCP","1434","34236  >  443 [ACK] Seq=228735 Ack=6107 Win=2363 Len=1368 TSval=7871343 TSecr=760606086 [TCP segment of a reassembled PDU]"
"444","2018-08-23 02:07:11.307423","192.168.2.3","216.58.197.4","TCP","1434","34236  >  443 [ACK] Seq=230103 Ack=6107 Win=2363 Len=1368 TSval=7871343 TSecr=760606086 [TCP segment of a reassembled PDU]"
"445","2018-08-23 02:07:11.307426","192.168.2.3","216.58.197.4","TLSv1.2","212","Application Data"
"446","2018-08-23 02:07:11.307427","192.168.2.3","216.58.197.4","TCP","1434","34236  >  443 [ACK] Seq=231617 Ack=6107 Win=2363 Len=1368 TSval=7871343 TSecr=760606086 [TCP segment of a reassembled PDU]"
"447","2018-08-23 02:07:11.307548","192.168.2.3","216.58.197.4","TLSv1.2","155","Application Data"
"448","2018-08-23 02:07:11.310713","192.168.2.3","216.58.197.4","TLSv1.2","448","Application Data"
"455","2018-08-23 02:07:11.510464","192.168.2.3","216.58.197.4","TCP","66","34236  >  443 [ACK] Seq=233456 Ack=6481 Win=2363 Len=0 TSval=7871363 TSecr=760606303"
"458","2018-08-23 02:07:11.550423","192.168.2.3","216.58.197.4","TCP","66","34236  >  443 [ACK] Seq=233456 Ack=7709 Win=2363 Len=0 TSval=7871367 TSecr=760606320"
"471","2018-08-23 02:07:11.711588","192.168.2.3","216.58.197.4","TCP","66","34236  >  443 [ACK] Seq=233456 Ack=9508 Win=2363 Len=0 TSval=7871383 TSecr=760606499"
"472","2018-08-23 02:07:11.711832","192.168.2.3","216.58.197.4","TCP","66","34236  >  443 [ACK] Seq=233456 Ack=11233 Win=2363 Len=0 TSval=7871383 TSecr=760606499"
"473","2018-08-23 02:07:11.711953","192.168.2.3","216.58.197.4","TCP","66","34236  >  443 [ACK] Seq=233456 Ack=14851 Win=2363 Len=0 TSval=7871383 TSecr=760606499"
"474","2018-08-23 02:07:11.712399","192.168.2.3","216.58.197.4","TCP","66","34236  >  443 [ACK] Seq=233456 Ack=16702 Win=2363 Len=0 TSval=7871383 TSecr=760606500"
"475","2018-08-23 02:07:11.712646","192.168.2.3","216.58.197.4","TCP","66","34236  >  443 [ACK] Seq=233456 Ack=18570 Win=2363 Len=0 TSval=7871383 TSecr=760606500"
"486","2018-08-23 02:07:11.735423","192.168.2.3","216.58.197.4","TCP","66","34236  >  443 [ACK] Seq=233456 Ack=20423 Win=2363 Len=0 TSval=7871386 TSecr=760606530"
"492","2018-08-23 02:07:11.736346","192.168.2.3","216.58.197.4","TCP","66","34236  >  443 [ACK] Seq=233456 Ack=25332 Win=2363 Len=0 TSval=7871386 TSecr=760606530"
"493","2018-08-23 02:07:11.737151","192.168.2.3","216.58.197.4","TCP","66","34236  >  443 [ACK] Seq=233456 Ack=27262 Win=2363 Len=0 TSval=7871386 TSecr=760606530"
"494","2018-08-23 02:07:11.737154","192.168.2.3","216.58.197.4","TCP","66","34236  >  443 [ACK] Seq=233456 Ack=29184 Win=2363 Len=0 TSval=7871386 TSecr=760606530"
"495","2018-08-23 02:07:11.737847","192.168.2.3","216.58.197.4","TCP","66","34236  >  443 [ACK] Seq=233456 Ack=29828 Win=2363 Len=0 TSval=7871386 TSecr=760606532"
"496","2018-08-23 02:07:11.748599","192.168.2.3","216.58.197.4","TLSv1.2","104","Application Data"
"498","2018-08-23 02:07:16.567783","192.168.2.3","216.58.197.14","TLSv1.2","156","Application Data"
"499","2018-08-23 02:07:16.567788","192.168.2.3","216.58.197.14","TLSv1.2","104","Application Data"
"500","2018-08-23 02:07:16.570138","192.168.2.3","216.58.197.14","TLSv1.2","582","Application Data"
"504","2018-08-23 02:07:16.604515","192.168.2.3","216.58.197.14","TCP","66","41142  >  443 [ACK] Seq=645 Ack=39 Win=661 Len=0 TSval=7871873 TSecr=933620104"
"510","2018-08-23 02:07:16.653164","192.168.2.3","216.58.197.14","TCP","66","41142  >  443 [ACK] Seq=645 Ack=107 Win=661 Len=0 TSval=7871877 TSecr=933620181"
"511","2018-08-23 02:07:16.653168","192.168.2.3","216.58.197.14","TCP","66","41142  >  443 [ACK] Seq=645 Ack=324 Win=661 Len=0 TSval=7871877 TSecr=933620181"
"512","2018-08-23 02:07:16.653169","192.168.2.3","216.58.197.14","TCP","66","41142  >  443 [ACK] Seq=645 Ack=471 Win=661 Len=0 TSval=7871877 TSecr=933620181"
"513","2018-08-23 02:07:16.653170","192.168.2.3","216.58.197.14","TCP","66","41142  >  443 [ACK] Seq=645 Ack=509 Win=661 Len=0 TSval=7871877 TSecr=933620181"
"514","2018-08-23 02:07:16.655078","192.168.2.3","216.58.197.14","TLSv1.2","104","Application Data"
