"No.","Time","Source","Destination","Protocol","Length","Info"
"3","2018-08-23 02:08:24.766901","192.168.2.3","216.58.197.14","TCP","66","41153  >  443 [FIN, ACK] Seq=1 Ack=57 Win=279 Len=0 TSval=7878689 TSecr=3237409720"
"7","2018-08-23 02:08:25.139903","192.168.2.3","172.217.161.234","TCP","66","39194  >  443 [FIN, ACK] Seq=1 Ack=57 Win=296 Len=0 TSval=7878726 TSecr=1496083046"
"11","2018-08-23 02:08:27.389324","192.168.2.3","216.58.197.4","TLSv1.2","156","Application Data"
"12","2018-08-23 02:08:27.389329","192.168.2.3","216.58.197.4","TLSv1.2","104","Application Data"
"13","2018-08-23 02:08:27.389425","192.168.2.3","216.58.197.4","TLSv1.2","159","Application Data"
"18","2018-08-23 02:08:27.399425","192.168.2.3","216.58.197.4","TCP","1434","34236  >  443 [ACK] Seq=222 Ack=39 Win=2363 Len=1368 TSval=7878952 TSecr=760682191 [TCP segment of a reassembled PDU]"
"19","2018-08-23 02:08:27.399429","192.168.2.3","216.58.197.4","TCP","1434","34236  >  443 [ACK] Seq=1590 Ack=39 Win=2363 Len=1368 TSval=7878952 TSecr=760682191 [TCP segment of a reassembled PDU]"
"20","2018-08-23 02:08:27.399431","192.168.2.3","216.58.197.4","TLSv1.2","212","Application Data"
"21","2018-08-23 02:08:27.399683","192.168.2.3","216.58.197.4","TCP","1434","34236  >  443 [ACK] Seq=3104 Ack=39 Win=2363 Len=1368 TSval=7878952 TSecr=760682191 [TCP segment of a reassembled PDU]"
"22","2018-08-23 02:08:27.399686","192.168.2.3","216.58.197.4","TLSv1.2","223","Application Data"
"23","2018-08-23 02:08:27.400061","192.168.2.3","216.58.197.4","TCP","1434","34236  >  443 [ACK] Seq=4629 Ack=39 Win=2363 Len=1368 TSval=7878952 TSecr=760682191 [TCP segment of a reassembled PDU]"
"24","2018-08-23 02:08:27.400064","192.168.2.3","216.58.197.4","TCP","1434","34236  >  443 [ACK] Seq=5997 Ack=39 Win=2363 Len=1368 TSval=7878952 TSecr=760682191 [TCP segment of a reassembled PDU]"
"25","2018-08-23 02:08:27.400257","192.168.2.3","216.58.197.4","TLSv1.2","212","Application Data"
"26","2018-08-23 02:08:27.400489","192.168.2.3","216.58.197.4","TCP","1434","34236  >  443 [ACK] Seq=7511 Ack=39 Win=2363 Len=1368 TSval=7878952 TSecr=760682191 [TCP segment of a reassembled PDU]"
"27","2018-08-23 02:08:27.400493","192.168.2.3","216.58.197.4","TCP","1434","34236  >  443 [ACK] Seq=8879 Ack=39 Win=2363 Len=1368 TSval=7878952 TSecr=760682191 [TCP segment of a reassembled PDU]"
"33","2018-08-23 02:08:27.405205","192.168.2.3","216.58.197.4","TLSv1.2","1434","Application Data [TCP segment of a reassembled PDU]"
"34","2018-08-23 02:08:27.405905","192.168.2.3","216.58.197.4","TCP","1434","34236  >  443 [ACK] Seq=11615 Ack=39 Win=2363 Len=1368 TSval=7878952 TSecr=760682200 [TCP segment of a reassembled PDU]"
"35","2018-08-23 02:08:27.405907","192.168.2.3","216.58.197.4","TLSv1.2","1434","Application Data [TCP segment of a reassembled PDU]"
"36","2018-08-23 02:08:27.406072","192.168.2.3","216.58.197.4","TCP","1434","34236  >  443 [ACK] Seq=14351 Ack=39 Win=2363 Len=1368 TSval=7878952 TSecr=760682201 [TCP segment of a reassembled PDU]"
"37","2018-08-23 02:08:27.406434","192.168.2.3","216.58.197.4","TLSv1.2","1434","Application Data [TCP segment of a reassembled PDU]"
"38","2018-08-23 02:08:27.406436","192.168.2.3","216.58.197.4","TCP","1434","34236  >  443 [ACK] Seq=17087 Ack=39 Win=2363 Len=1368 TSval=7878952 TSecr=760682201 [TCP segment of a reassembled PDU]"
"39","2018-08-23 02:08:27.407023","192.168.2.3","216.58.197.4","TLSv1.2","1434","Application Data [TCP segment of a reassembled PDU]"
"40","2018-08-23 02:08:27.407025","192.168.2.3","216.58.197.4","TCP","1434","34236  >  443 [ACK] Seq=19823 Ack=39 Win=2363 Len=1368 TSval=7878953 TSecr=760682201 [TCP segment of a reassembled PDU]"
"41","2018-08-23 02:08:27.407327","192.168.2.3","216.58.197.4","TLSv1.2","1434","Application Data, Application Data"
"42","2018-08-23 02:08:27.407663","192.168.2.3","216.58.197.4","TCP","1434","34236  >  443 [ACK] Seq=22559 Ack=39 Win=2363 Len=1368 TSval=7878953 TSecr=760682201 [TCP segment of a reassembled PDU]"
"43","2018-08-23 02:08:27.407665","192.168.2.3","216.58.197.4","TLSv1.2","1434","Application Data [TCP segment of a reassembled PDU]"
"44","2018-08-23 02:08:27.408182","192.168.2.3","216.58.197.4","TLSv1.2","1434","Application Data [TCP segment of a reassembled PDU]"
"45","2018-08-23 02:08:27.408186","192.168.2.3","216.58.197.4","TCP","1434","34236  >  443 [ACK] Seq=26663 Ack=39 Win=2363 Len=1368 TSval=7878953 TSecr=760682202 [TCP segment of a reassembled PDU]"
"46","2018-08-23 02:08:27.408333","192.168.2.3","216.58.197.4","TLSv1.2","1434","Application Data [TCP segment of a reassembled PDU]"
"47","2018-08-23 02:08:27.408682","192.168.2.3","216.58.197.4","TCP","1434","34236  >  443 [ACK] Seq=29399 Ack=39 Win=2363 Len=1368 TSval=7878953 TSecr=760682202 [TCP segment of a reassembled PDU]"
"52","2018-08-23 02:08:27.411934","192.168.2.3","216.58.197.4","TLSv1.2","1434","Application Data [TCP segment of a reassembled PDU]"
"53","2018-08-23 02:08:27.411936","192.168.2.3","216.58.197.4","TCP","1434","34236  >  443 [ACK] Seq=32135 Ack=39 Win=2363 Len=1368 TSval=7878953 TSecr=760682207 [TCP segment of a reassembled PDU]"
"55","2018-08-23 02:08:27.412123","192.168.2.3","216.58.197.4","TCP","1434","34236  >  443 [ACK] Seq=33503 Ack=39 Win=2363 Len=1368 TSval=7878953 TSecr=760682207 [TCP segment of a reassembled PDU]"
"56","2018-08-23 02:08:27.412452","192.168.2.3","216.58.197.4","TLSv1.2","1434","Application Data [TCP segment of a reassembled PDU]"
"59","2018-08-23 02:08:27.412766","192.168.2.3","216.58.197.4","TCP","1434","34236  >  443 [ACK] Seq=36239 Ack=39 Win=2363 Len=1368 TSval=7878953 TSecr=760682207 [TCP segment of a reassembled PDU]"
"60","2018-08-23 02:08:27.413098","192.168.2.3","216.58.197.4","TLSv1.2","1434","Application Data [TCP segment of a reassembled PDU]"
"61","2018-08-23 02:08:27.413640","192.168.2.3","216.58.197.4","TCP","1434","34236  >  443 [ACK] Seq=38975 Ack=39 Win=2363 Len=1368 TSval=7878953 TSecr=760682208 [TCP segment of a reassembled PDU]"
"62","2018-08-23 02:08:27.413913","192.168.2.3","216.58.197.4","TLSv1.2","1434","Application Data [TCP segment of a reassembled PDU]"
"63","2018-08-23 02:08:27.414148","192.168.2.3","216.58.197.4","TLSv1.2","1434","Application Data [TCP segment of a reassembled PDU]"
"64","2018-08-23 02:08:27.414150","192.168.2.3","216.58.197.4","TCP","1434","34236  >  443 [ACK] Seq=43079 Ack=39 Win=2363 Len=1368 TSval=7878953 TSecr=760682208 [TCP segment of a reassembled PDU]"
"65","2018-08-23 02:08:27.414482","192.168.2.3","216.58.197.4","TLSv1.2","1434","Application Data [TCP segment of a reassembled PDU]"
"66","2018-08-23 02:08:27.414484","192.168.2.3","216.58.197.4","TCP","1434","34236  >  443 [ACK] Seq=45815 Ack=39 Win=2363 Len=1368 TSval=7878953 TSecr=760682208 [TCP segment of a reassembled PDU]"
"67","2018-08-23 02:08:27.414990","192.168.2.3","216.58.197.4","TCP","1434","34236  >  443 [ACK] Seq=47183 Ack=39 Win=2363 Len=1368 TSval=7878953 TSecr=760682209 [TCP segment of a reassembled PDU]"
"68","2018-08-23 02:08:27.414992","192.168.2.3","216.58.197.4","TLSv1.2","1434","Application Data [TCP segment of a reassembled PDU]"
"69","2018-08-23 02:08:27.415299","192.168.2.3","216.58.197.4","TCP","1434","34236  >  443 [PSH, ACK] Seq=49919 Ack=39 Win=2363 Len=1368 TSval=7878953 TSecr=760682209 [TCP segment of a reassembled PDU]"
"70","2018-08-23 02:08:27.415301","192.168.2.3","216.58.197.4","TLSv1.2","1434","Application Data [TCP segment of a reassembled PDU]"
"71","2018-08-23 02:08:27.415656","192.168.2.3","216.58.197.4","TCP","1434","34236  >  443 [ACK] Seq=52655 Ack=39 Win=2363 Len=1368 TSval=7878953 TSecr=760682209 [TCP segment of a reassembled PDU]"
"75","2018-08-23 02:08:27.417077","192.168.2.3","216.58.197.4","TLSv1.2","1434","Application Data [TCP segment of a reassembled PDU]"
"76","2018-08-23 02:08:27.417319","192.168.2.3","216.58.197.4","TCP","1434","34236  >  443 [ACK] Seq=55391 Ack=39 Win=2363 Len=1368 TSval=7878954 TSecr=760682209 [TCP segment of a reassembled PDU]"
"79","2018-08-23 02:08:27.418632","192.168.2.3","216.58.197.4","TLSv1.2","1434","Application Data [TCP segment of a reassembled PDU]"
"80","2018-08-23 02:08:27.418647","192.168.2.3","216.58.197.4","TLSv1.2","1289","Application Data"
"87","2018-08-23 02:08:27.486755","192.168.2.3","216.58.197.4","TCP","1434","34236  >  443 [ACK] Seq=59350 Ack=39 Win=2363 Len=1368 TSval=7878960 TSecr=760682220 [TCP segment of a reassembled PDU]"
"88","2018-08-23 02:08:27.486760","192.168.2.3","216.58.197.4","TCP","1434","34236  >  443 [ACK] Seq=60718 Ack=39 Win=2363 Len=1368 TSval=7878960 TSecr=760682220 [TCP segment of a reassembled PDU]"
"89","2018-08-23 02:08:27.486761","192.168.2.3","216.58.197.4","TLSv1.2","212","Application Data"
"90","2018-08-23 02:08:27.486889","192.168.2.3","216.58.197.4","TCP","1434","34236  >  443 [ACK] Seq=62232 Ack=39 Win=2363 Len=1368 TSval=7878960 TSecr=760682220 [TCP segment of a reassembled PDU]"
"91","2018-08-23 02:08:27.487090","192.168.2.3","216.58.197.4","TLSv1.2","155","Application Data"
"95","2018-08-23 02:08:27.576546","192.168.2.3","216.58.197.4","TCP","1434","34236  >  443 [ACK] Seq=63689 Ack=39 Win=2363 Len=1368 TSval=7878970 TSecr=760682328 [TCP segment of a reassembled PDU]"
"96","2018-08-23 02:08:27.576941","192.168.2.3","216.58.197.4","TCP","1434","34236  >  443 [ACK] Seq=65057 Ack=39 Win=2363 Len=1368 TSval=7878970 TSecr=760682328 [TCP segment of a reassembled PDU]"
"97","2018-08-23 02:08:27.576944","192.168.2.3","216.58.197.4","TLSv1.2","212","Application Data"
"98","2018-08-23 02:08:27.577405","192.168.2.3","216.58.197.4","TCP","1434","34236  >  443 [ACK] Seq=66571 Ack=39 Win=2363 Len=1368 TSval=7878970 TSecr=760682328 [TCP segment of a reassembled PDU]"
"99","2018-08-23 02:08:27.577408","192.168.2.3","216.58.197.4","TLSv1.2","155","Application Data"
"103","2018-08-23 02:08:27.692014","192.168.2.3","216.58.197.4","TCP","1434","34236  >  443 [ACK] Seq=68028 Ack=39 Win=2363 Len=1368 TSval=7878981 TSecr=760682378 [TCP segment of a reassembled PDU]"
"104","2018-08-23 02:08:27.692019","192.168.2.3","216.58.197.4","TCP","1434","34236  >  443 [ACK] Seq=69396 Ack=39 Win=2363 Len=1368 TSval=7878981 TSecr=760682378 [TCP segment of a reassembled PDU]"
"105","2018-08-23 02:08:27.692021","192.168.2.3","216.58.197.4","TLSv1.2","212","Application Data"
"106","2018-08-23 02:08:27.692305","192.168.2.3","216.58.197.4","TCP","1434","34236  >  443 [ACK] Seq=70910 Ack=39 Win=2363 Len=1368 TSval=7878981 TSecr=760682378 [TCP segment of a reassembled PDU]"
"107","2018-08-23 02:08:27.692308","192.168.2.3","216.58.197.4","TLSv1.2","155","Application Data"
"113","2018-08-23 02:08:27.714459","192.168.2.3","216.58.197.4","TCP","66","34236  >  443 [ACK] Seq=72367 Ack=359 Win=2363 Len=0 TSval=7878983 TSecr=760682510"
"115","2018-08-23 02:08:27.755276","192.168.2.3","216.58.197.4","TCP","66","34236  >  443 [ACK] Seq=72367 Ack=412 Win=2363 Len=0 TSval=7878988 TSecr=760682520"
"116","2018-08-23 02:08:27.781568","192.168.2.3","216.58.197.4","TCP","1434","34236  >  443 [ACK] Seq=72367 Ack=412 Win=2363 Len=1368 TSval=7878990 TSecr=760682520 [TCP segment of a reassembled PDU]"
"117","2018-08-23 02:08:27.781979","192.168.2.3","216.58.197.4","TCP","1434","34236  >  443 [ACK] Seq=73735 Ack=412 Win=2363 Len=1368 TSval=7878990 TSecr=760682520 [TCP segment of a reassembled PDU]"
"118","2018-08-23 02:08:27.781982","192.168.2.3","216.58.197.4","TLSv1.2","212","Application Data"
"119","2018-08-23 02:08:27.782226","192.168.2.3","216.58.197.4","TCP","1434","34236  >  443 [ACK] Seq=75249 Ack=412 Win=2363 Len=1368 TSval=7878990 TSecr=760682520 [TCP segment of a reassembled PDU]"
"120","2018-08-23 02:08:27.782228","192.168.2.3","216.58.197.4","TLSv1.2","155","Application Data"
"125","2018-08-23 02:08:27.827826","192.168.2.3","216.58.197.4","TCP","66","34236  >  443 [ACK] Seq=76706 Ack=606 Win=2363 Len=0 TSval=7878995 TSecr=760682624"
"126","2018-08-23 02:08:27.898699","192.168.2.3","216.58.197.4","TCP","1434","34236  >  443 [ACK] Seq=76706 Ack=606 Win=2363 Len=1368 TSval=7879002 TSecr=760682624 [TCP segment of a reassembled PDU]"
"127","2018-08-23 02:08:27.899000","192.168.2.3","216.58.197.4","TCP","1434","34236  >  443 [ACK] Seq=78074 Ack=606 Win=2363 Len=1368 TSval=7879002 TSecr=760682624 [TCP segment of a reassembled PDU]"
"128","2018-08-23 02:08:27.899004","192.168.2.3","216.58.197.4","TLSv1.2","212","Application Data"
"129","2018-08-23 02:08:27.899005","192.168.2.3","216.58.197.4","TCP","1434","34236  >  443 [ACK] Seq=79588 Ack=606 Win=2363 Len=1368 TSval=7879002 TSecr=760682624 [TCP segment of a reassembled PDU]"
"130","2018-08-23 02:08:27.899135","192.168.2.3","216.58.197.4","TLSv1.2","155","Application Data"
"134","2018-08-23 02:08:27.980534","192.168.2.3","216.58.197.4","TCP","66","34236  >  443 [ACK] Seq=81045 Ack=664 Win=2363 Len=0 TSval=7879010 TSecr=760682776"
"135","2018-08-23 02:08:27.998779","192.168.2.3","216.58.197.4","TCP","1434","34236  >  443 [ACK] Seq=81045 Ack=664 Win=2363 Len=1368 TSval=7879011 TSecr=760682776 [TCP segment of a reassembled PDU]"
"136","2018-08-23 02:08:27.998784","192.168.2.3","216.58.197.4","TCP","1434","34236  >  443 [ACK] Seq=82413 Ack=664 Win=2363 Len=1368 TSval=7879012 TSecr=760682776 [TCP segment of a reassembled PDU]"
"137","2018-08-23 02:08:27.998785","192.168.2.3","216.58.197.4","TLSv1.2","212","Application Data"
"138","2018-08-23 02:08:27.998961","192.168.2.3","216.58.197.4","TCP","1434","34236  >  443 [ACK] Seq=83927 Ack=664 Win=2363 Len=1368 TSval=7879012 TSecr=760682776 [TCP segment of a reassembled PDU]"
"139","2018-08-23 02:08:27.998964","192.168.2.3","216.58.197.4","TLSv1.2","155","Application Data"
"143","2018-08-23 02:08:28.091475","192.168.2.3","216.58.197.4","TCP","1434","34236  >  443 [ACK] Seq=85384 Ack=664 Win=2363 Len=1368 TSval=7879021 TSecr=760682800 [TCP segment of a reassembled PDU]"
"144","2018-08-23 02:08:28.103591","192.168.2.3","216.58.197.4","TCP","1434","34236  >  443 [ACK] Seq=86752 Ack=664 Win=2363 Len=1368 TSval=7879021 TSecr=760682800 [TCP segment of a reassembled PDU]"
"145","2018-08-23 02:08:28.103609","192.168.2.3","216.58.197.4","TLSv1.2","212","Application Data"
"146","2018-08-23 02:08:28.103610","192.168.2.3","216.58.197.4","TCP","1434","34236  >  443 [ACK] Seq=88266 Ack=664 Win=2363 Len=1368 TSval=7879021 TSecr=760682800 [TCP segment of a reassembled PDU]"
"147","2018-08-23 02:08:28.103611","192.168.2.3","216.58.197.4","TLSv1.2","155","Application Data"
"150","2018-08-23 02:08:28.213748","192.168.2.3","216.58.197.4","TCP","1434","34236  >  443 [ACK] Seq=89723 Ack=664 Win=2363 Len=1368 TSval=7879032 TSecr=760682905 [TCP segment of a reassembled PDU]"
"151","2018-08-23 02:08:28.213753","192.168.2.3","216.58.197.4","TCP","1434","34236  >  443 [ACK] Seq=91091 Ack=664 Win=2363 Len=1368 TSval=7879032 TSecr=760682905 [TCP segment of a reassembled PDU]"
"152","2018-08-23 02:08:28.213754","192.168.2.3","216.58.197.4","TLSv1.2","212","Application Data"
"153","2018-08-23 02:08:28.214117","192.168.2.3","216.58.197.4","TCP","1434","34236  >  443 [ACK] Seq=92605 Ack=664 Win=2363 Len=1368 TSval=7879032 TSecr=760682905 [TCP segment of a reassembled PDU]"
"154","2018-08-23 02:08:28.214120","192.168.2.3","216.58.197.4","TLSv1.2","139","Application Data"
"157","2018-08-23 02:08:28.284485","192.168.2.3","216.58.197.4","TCP","1434","34236  >  443 [ACK] Seq=94046 Ack=664 Win=2363 Len=1368 TSval=7879040 TSecr=760683015 [TCP segment of a reassembled PDU]"
"158","2018-08-23 02:08:28.284491","192.168.2.3","216.58.197.4","TCP","1434","34236  >  443 [ACK] Seq=95414 Ack=664 Win=2363 Len=1368 TSval=7879040 TSecr=760683015 [TCP segment of a reassembled PDU]"
"159","2018-08-23 02:08:28.284492","192.168.2.3","216.58.197.4","TLSv1.2","212","Application Data"
"160","2018-08-23 02:08:28.284582","192.168.2.3","216.58.197.4","TCP","1434","34236  >  443 [ACK] Seq=96928 Ack=664 Win=2363 Len=1368 TSval=7879040 TSecr=760683015 [TCP segment of a reassembled PDU]"
"161","2018-08-23 02:08:28.284583","192.168.2.3","216.58.197.4","TLSv1.2","155","Application Data"
"165","2018-08-23 02:08:28.379438","192.168.2.3","216.58.197.4","TCP","1434","34236  >  443 [ACK] Seq=98385 Ack=664 Win=2363 Len=1368 TSval=7879050 TSecr=760683086 [TCP segment of a reassembled PDU]"
"166","2018-08-23 02:08:28.379709","192.168.2.3","216.58.197.4","TCP","1434","34236  >  443 [ACK] Seq=99753 Ack=664 Win=2363 Len=1368 TSval=7879050 TSecr=760683086 [TCP segment of a reassembled PDU]"
"167","2018-08-23 02:08:28.379712","192.168.2.3","216.58.197.4","TLSv1.2","212","Application Data"
"168","2018-08-23 02:08:28.380099","192.168.2.3","216.58.197.4","TCP","1434","34236  >  443 [ACK] Seq=101267 Ack=664 Win=2363 Len=1368 TSval=7879050 TSecr=760683086 [TCP segment of a reassembled PDU]"
"169","2018-08-23 02:08:28.380102","192.168.2.3","216.58.197.4","TLSv1.2","155","Application Data"
"173","2018-08-23 02:08:28.476005","192.168.2.3","216.58.197.4","TCP","1434","34236  >  443 [ACK] Seq=102724 Ack=664 Win=2363 Len=1368 TSval=7879059 TSecr=760683181 [TCP segment of a reassembled PDU]"
"174","2018-08-23 02:08:28.476010","192.168.2.3","216.58.197.4","TCP","1434","34236  >  443 [ACK] Seq=104092 Ack=664 Win=2363 Len=1368 TSval=7879060 TSecr=760683181 [TCP segment of a reassembled PDU]"
"175","2018-08-23 02:08:28.476183","192.168.2.3","216.58.197.4","TLSv1.2","212","Application Data"
"176","2018-08-23 02:08:28.478579","192.168.2.3","216.58.197.4","TCP","1434","34236  >  443 [ACK] Seq=105606 Ack=664 Win=2363 Len=1368 TSval=7879060 TSecr=760683181 [TCP segment of a reassembled PDU]"
"177","2018-08-23 02:08:28.478582","192.168.2.3","216.58.197.4","TLSv1.2","155","Application Data"
"181","2018-08-23 02:08:28.574526","192.168.2.3","216.58.197.4","TCP","1434","34236  >  443 [ACK] Seq=107063 Ack=664 Win=2363 Len=1368 TSval=7879069 TSecr=760683280 [TCP segment of a reassembled PDU]"
"182","2018-08-23 02:08:28.574531","192.168.2.3","216.58.197.4","TCP","1434","34236  >  443 [ACK] Seq=108431 Ack=664 Win=2363 Len=1368 TSval=7879069 TSecr=760683280 [TCP segment of a reassembled PDU]"
"183","2018-08-23 02:08:28.574532","192.168.2.3","216.58.197.4","TLSv1.2","212","Application Data"
"184","2018-08-23 02:08:28.574623","192.168.2.3","216.58.197.4","TCP","1434","34236  >  443 [ACK] Seq=109945 Ack=664 Win=2363 Len=1368 TSval=7879069 TSecr=760683280 [TCP segment of a reassembled PDU]"
"185","2018-08-23 02:08:28.574624","192.168.2.3","216.58.197.4","TLSv1.2","155","Application Data"
"190","2018-08-23 02:08:28.636533","192.168.2.3","216.58.197.4","TCP","66","34236  >  443 [ACK] Seq=111402 Ack=951 Win=2363 Len=0 TSval=7879076 TSecr=760683432"
"193","2018-08-23 02:08:28.649204","192.168.2.3","216.58.197.4","TCP","66","34236  >  443 [ACK] Seq=111402 Ack=1406 Win=2363 Len=0 TSval=7879077 TSecr=760683445"
"194","2018-08-23 02:08:28.682853","192.168.2.3","216.58.197.4","TCP","1434","34236  >  443 [ACK] Seq=111402 Ack=1406 Win=2363 Len=1368 TSval=7879080 TSecr=760683445 [TCP segment of a reassembled PDU]"
"195","2018-08-23 02:08:28.683024","192.168.2.3","216.58.197.4","TCP","1434","34236  >  443 [ACK] Seq=112770 Ack=1406 Win=2363 Len=1368 TSval=7879080 TSecr=760683445 [TCP segment of a reassembled PDU]"
"196","2018-08-23 02:08:28.683028","192.168.2.3","216.58.197.4","TLSv1.2","212","Application Data"
"197","2018-08-23 02:08:28.683219","192.168.2.3","216.58.197.4","TCP","1434","34236  >  443 [ACK] Seq=114284 Ack=1406 Win=2363 Len=1368 TSval=7879080 TSecr=760683445 [TCP segment of a reassembled PDU]"
"198","2018-08-23 02:08:28.683222","192.168.2.3","216.58.197.4","TLSv1.2","155","Application Data"
"204","2018-08-23 02:08:28.726704","192.168.2.3","216.58.197.4","TCP","66","34236  >  443 [ACK] Seq=115741 Ack=1645 Win=2363 Len=0 TSval=7879085 TSecr=760683509"
"205","2018-08-23 02:08:28.763733","192.168.2.3","216.58.197.4","TCP","1434","34236  >  443 [ACK] Seq=115741 Ack=1645 Win=2363 Len=1368 TSval=7879088 TSecr=760683509 [TCP segment of a reassembled PDU]"
"206","2018-08-23 02:08:28.764032","192.168.2.3","216.58.197.4","TCP","1434","34236  >  443 [ACK] Seq=117109 Ack=1645 Win=2363 Len=1368 TSval=7879088 TSecr=760683509 [TCP segment of a reassembled PDU]"
"207","2018-08-23 02:08:28.764050","192.168.2.3","216.58.197.4","TLSv1.2","212","Application Data"
"208","2018-08-23 02:08:28.764560","192.168.2.3","216.58.197.4","TCP","1434","34236  >  443 [ACK] Seq=118623 Ack=1645 Win=2363 Len=1368 TSval=7879088 TSecr=760683509 [TCP segment of a reassembled PDU]"
"209","2018-08-23 02:08:28.764565","192.168.2.3","216.58.197.4","TLSv1.2","155","Application Data"
"213","2018-08-23 02:08:28.865296","192.168.2.3","216.58.197.4","TCP","1434","34236  >  443 [ACK] Seq=120080 Ack=1645 Win=2363 Len=1368 TSval=7879098 TSecr=760683606 [TCP segment of a reassembled PDU]"
"214","2018-08-23 02:08:28.865301","192.168.2.3","216.58.197.4","TCP","1434","34236  >  443 [ACK] Seq=121448 Ack=1645 Win=2363 Len=1368 TSval=7879098 TSecr=760683606 [TCP segment of a reassembled PDU]"
"215","2018-08-23 02:08:28.865302","192.168.2.3","216.58.197.4","TLSv1.2","212","Application Data"
"216","2018-08-23 02:08:28.865539","192.168.2.3","216.58.197.4","TCP","1434","34236  >  443 [ACK] Seq=122962 Ack=1645 Win=2363 Len=1368 TSval=7879098 TSecr=760683606 [TCP segment of a reassembled PDU]"
"217","2018-08-23 02:08:28.865541","192.168.2.3","216.58.197.4","TLSv1.2","155","Application Data"
"220","2018-08-23 02:08:28.920076","192.168.2.3","108.177.97.188","TCP","66","58805  >  5228 [ACK] Seq=1 Ack=1 Win=406 Len=0 TSval=7879104 TSecr=2778207823"
"224","2018-08-23 02:08:28.951316","192.168.2.3","216.58.197.4","TCP","66","34236  >  443 [ACK] Seq=124419 Ack=1956 Win=2363 Len=0 TSval=7879107 TSecr=760683723"
"225","2018-08-23 02:08:28.951319","192.168.2.3","216.58.197.4","TCP","78","[TCP Dup ACK 224#1] 34236  >  443 [ACK] Seq=124419 Ack=1956 Win=2363 Len=0 TSval=7879107 TSecr=760683747 SLE=1826 SRE=1956"
"226","2018-08-23 02:08:28.968024","192.168.2.3","216.58.197.4","TCP","1434","34236  >  443 [ACK] Seq=124419 Ack=1956 Win=2363 Len=1368 TSval=7879109 TSecr=760683747 [TCP segment of a reassembled PDU]"
"227","2018-08-23 02:08:28.968422","192.168.2.3","216.58.197.4","TCP","1434","34236  >  443 [ACK] Seq=125787 Ack=1956 Win=2363 Len=1368 TSval=7879109 TSecr=760683747 [TCP segment of a reassembled PDU]"
"228","2018-08-23 02:08:28.968424","192.168.2.3","216.58.197.4","TLSv1.2","212","Application Data"
"229","2018-08-23 02:08:28.968425","192.168.2.3","216.58.197.4","TCP","1434","34236  >  443 [ACK] Seq=127301 Ack=1956 Win=2363 Len=1368 TSval=7879109 TSecr=760683747 [TCP segment of a reassembled PDU]"
"230","2018-08-23 02:08:28.968426","192.168.2.3","216.58.197.4","TLSv1.2","155","Application Data"
"235","2018-08-23 02:08:29.063441","192.168.2.3","216.58.197.4","TCP","1434","34236  >  443 [ACK] Seq=128758 Ack=1956 Win=2363 Len=1368 TSval=7879118 TSecr=760683769 [TCP segment of a reassembled PDU]"
"236","2018-08-23 02:08:29.066518","192.168.2.3","216.58.197.4","TCP","1434","34236  >  443 [ACK] Seq=130126 Ack=1956 Win=2363 Len=1368 TSval=7879118 TSecr=760683769 [TCP segment of a reassembled PDU]"
"237","2018-08-23 02:08:29.066522","192.168.2.3","216.58.197.4","TLSv1.2","212","Application Data"
"238","2018-08-23 02:08:29.066523","192.168.2.3","216.58.197.4","TCP","1434","34236  >  443 [ACK] Seq=131640 Ack=1956 Win=2363 Len=1368 TSval=7879118 TSecr=760683769 [TCP segment of a reassembled PDU]"
"239","2018-08-23 02:08:29.066768","192.168.2.3","216.58.197.4","TLSv1.2","155","Application Data"
"245","2018-08-23 02:08:29.130157","192.168.2.3","216.58.197.4","TCP","66","34236  >  443 [ACK] Seq=133097 Ack=2357 Win=2363 Len=0 TSval=7879125 TSecr=760683925"
"246","2018-08-23 02:08:29.160312","192.168.2.3","216.58.197.4","TCP","1434","34236  >  443 [ACK] Seq=133097 Ack=2357 Win=2363 Len=1368 TSval=7879128 TSecr=760683925 [TCP segment of a reassembled PDU]"
"247","2018-08-23 02:08:29.160626","192.168.2.3","216.58.197.4","TCP","1434","34236  >  443 [ACK] Seq=134465 Ack=2357 Win=2363 Len=1368 TSval=7879128 TSecr=760683925 [TCP segment of a reassembled PDU]"
"248","2018-08-23 02:08:29.160629","192.168.2.3","216.58.197.4","TLSv1.2","212","Application Data"
"249","2018-08-23 02:08:29.161092","192.168.2.3","216.58.197.4","TCP","1434","34236  >  443 [ACK] Seq=135979 Ack=2357 Win=2363 Len=1368 TSval=7879128 TSecr=760683925 [TCP segment of a reassembled PDU]"
"250","2018-08-23 02:08:29.161096","192.168.2.3","216.58.197.4","TLSv1.2","155","Application Data"
"254","2018-08-23 02:08:29.253843","192.168.2.3","216.58.197.4","TCP","1434","34236  >  443 [ACK] Seq=137436 Ack=2357 Win=2363 Len=1368 TSval=7879137 TSecr=760683962 [TCP segment of a reassembled PDU]"
"255","2018-08-23 02:08:29.253848","192.168.2.3","216.58.197.4","TCP","1434","34236  >  443 [ACK] Seq=138804 Ack=2357 Win=2363 Len=1368 TSval=7879137 TSecr=760683962 [TCP segment of a reassembled PDU]"
"256","2018-08-23 02:08:29.253931","192.168.2.3","216.58.197.4","TLSv1.2","212","Application Data"
"257","2018-08-23 02:08:29.254182","192.168.2.3","216.58.197.4","TCP","1434","34236  >  443 [ACK] Seq=140318 Ack=2357 Win=2363 Len=1368 TSval=7879137 TSecr=760683962 [TCP segment of a reassembled PDU]"
"258","2018-08-23 02:08:29.254185","192.168.2.3","216.58.197.4","TLSv1.2","155","Application Data"
"264","2018-08-23 02:08:29.320247","192.168.2.3","216.58.197.4","TCP","66","34236  >  443 [ACK] Seq=141775 Ack=2518 Win=2363 Len=0 TSval=7879144 TSecr=760684116"
"265","2018-08-23 02:08:29.349598","192.168.2.3","216.58.197.4","TCP","1434","34236  >  443 [ACK] Seq=141775 Ack=2518 Win=2363 Len=1368 TSval=7879147 TSecr=760684116 [TCP segment of a reassembled PDU]"
"266","2018-08-23 02:08:29.365697","192.168.2.3","216.58.197.4","TCP","1434","34236  >  443 [ACK] Seq=143143 Ack=2518 Win=2363 Len=1368 TSval=7879147 TSecr=760684116 [TCP segment of a reassembled PDU]"
"267","2018-08-23 02:08:29.365702","192.168.2.3","216.58.197.4","TLSv1.2","212","Application Data"
"268","2018-08-23 02:08:29.365703","192.168.2.3","216.58.197.4","TCP","1434","34236  >  443 [ACK] Seq=144657 Ack=2518 Win=2363 Len=1368 TSval=7879147 TSecr=760684116 [TCP segment of a reassembled PDU]"
"269","2018-08-23 02:08:29.365879","192.168.2.3","216.58.197.4","TLSv1.2","155","Application Data"
"273","2018-08-23 02:08:29.464666","192.168.2.3","216.58.197.4","TCP","1434","34236  >  443 [ACK] Seq=146114 Ack=2518 Win=2363 Len=1368 TSval=7879158 TSecr=760684167 [TCP segment of a reassembled PDU]"
"274","2018-08-23 02:08:29.465055","192.168.2.3","216.58.197.4","TCP","1434","34236  >  443 [ACK] Seq=147482 Ack=2518 Win=2363 Len=1368 TSval=7879158 TSecr=760684167 [TCP segment of a reassembled PDU]"
"275","2018-08-23 02:08:29.465056","192.168.2.3","216.58.197.4","TLSv1.2","212","Application Data"
"276","2018-08-23 02:08:29.465497","192.168.2.3","216.58.197.4","TCP","1434","34236  >  443 [ACK] Seq=148996 Ack=2518 Win=2363 Len=1368 TSval=7879158 TSecr=760684167 [TCP segment of a reassembled PDU]"
"277","2018-08-23 02:08:29.465500","192.168.2.3","216.58.197.4","TLSv1.2","153","Application Data"
"283","2018-08-23 02:08:29.524359","192.168.2.3","216.58.197.4","TCP","66","34236  >  443 [ACK] Seq=150451 Ack=2875 Win=2363 Len=0 TSval=7879164 TSecr=760684320"
"284","2018-08-23 02:08:29.563777","192.168.2.3","216.58.197.4","TCP","1434","34236  >  443 [ACK] Seq=150451 Ack=2875 Win=2363 Len=1368 TSval=7879168 TSecr=760684320 [TCP segment of a reassembled PDU]"
"285","2018-08-23 02:08:29.564072","192.168.2.3","216.58.197.4","TCP","1434","34236  >  443 [ACK] Seq=151819 Ack=2875 Win=2363 Len=1368 TSval=7879168 TSecr=760684320 [TCP segment of a reassembled PDU]"
"286","2018-08-23 02:08:29.564075","192.168.2.3","216.58.197.4","TLSv1.2","212","Application Data"
"287","2018-08-23 02:08:29.564316","192.168.2.3","216.58.197.4","TCP","1434","34236  >  443 [ACK] Seq=153333 Ack=2875 Win=2363 Len=1368 TSval=7879168 TSecr=760684320 [TCP segment of a reassembled PDU]"
"288","2018-08-23 02:08:29.564318","192.168.2.3","216.58.197.4","TLSv1.2","155","Application Data"
"293","2018-08-23 02:08:29.669504","192.168.2.3","216.58.197.4","TCP","1434","34236  >  443 [ACK] Seq=154790 Ack=3049 Win=2363 Len=1368 TSval=7879179 TSecr=760684452 [TCP segment of a reassembled PDU]"
"294","2018-08-23 02:08:29.669865","192.168.2.3","216.58.197.4","TCP","1434","34236  >  443 [ACK] Seq=156158 Ack=3049 Win=2363 Len=1368 TSval=7879179 TSecr=760684452 [TCP segment of a reassembled PDU]"
"295","2018-08-23 02:08:29.669868","192.168.2.3","216.58.197.4","TLSv1.2","212","Application Data"
"296","2018-08-23 02:08:29.670334","192.168.2.3","216.58.197.4","TCP","1434","34236  >  443 [ACK] Seq=157672 Ack=3049 Win=2363 Len=1368 TSval=7879179 TSecr=760684452 [TCP segment of a reassembled PDU]"
"297","2018-08-23 02:08:29.670337","192.168.2.3","216.58.197.4","TLSv1.2","155","Application Data"
"303","2018-08-23 02:08:29.724856","192.168.2.3","216.58.197.4","TCP","66","34236  >  443 [ACK] Seq=159129 Ack=3397 Win=2363 Len=0 TSval=7879184 TSecr=760684510"
"306","2018-08-23 02:08:29.728005","192.168.2.3","216.58.197.4","TCP","66","34236  >  443 [ACK] Seq=159129 Ack=3627 Win=2363 Len=0 TSval=7879185 TSecr=760684523"
"307","2018-08-23 02:08:29.787026","192.168.2.3","216.58.197.4","TCP","1434","34236  >  443 [ACK] Seq=159129 Ack=3627 Win=2363 Len=1368 TSval=7879191 TSecr=760684523 [TCP segment of a reassembled PDU]"
"308","2018-08-23 02:08:29.787390","192.168.2.3","216.58.197.4","TCP","1434","34236  >  443 [ACK] Seq=160497 Ack=3627 Win=2363 Len=1368 TSval=7879191 TSecr=760684523 [TCP segment of a reassembled PDU]"
"309","2018-08-23 02:08:29.787392","192.168.2.3","216.58.197.4","TLSv1.2","212","Application Data"
"310","2018-08-23 02:08:29.787393","192.168.2.3","216.58.197.4","TLSv1.2","1351","Application Data"
"313","2018-08-23 02:08:29.893386","192.168.2.3","216.58.197.4","TCP","1434","34236  >  443 [ACK] Seq=163296 Ack=3627 Win=2363 Len=1368 TSval=7879200 TSecr=760684588 [TCP segment of a reassembled PDU]"
"314","2018-08-23 02:08:29.893391","192.168.2.3","216.58.197.4","TCP","1434","34236  >  443 [ACK] Seq=164664 Ack=3627 Win=2363 Len=1368 TSval=7879200 TSecr=760684588 [TCP segment of a reassembled PDU]"
"315","2018-08-23 02:08:29.893392","192.168.2.3","216.58.197.4","TLSv1.2","212","Application Data"
"316","2018-08-23 02:08:29.893856","192.168.2.3","216.58.197.4","TCP","1434","34236  >  443 [ACK] Seq=166178 Ack=3627 Win=2363 Len=1368 TSval=7879200 TSecr=760684588 [TCP segment of a reassembled PDU]"
"317","2018-08-23 02:08:29.893858","192.168.2.3","216.58.197.4","TLSv1.2","155","Application Data"
"324","2018-08-23 02:08:29.993127","192.168.2.3","216.58.197.4","TCP","1434","34236  >  443 [ACK] Seq=167635 Ack=3627 Win=2363 Len=1368 TSval=7879211 TSecr=760684735 [TCP segment of a reassembled PDU]"
"325","2018-08-23 02:08:29.993146","192.168.2.3","216.58.197.4","TCP","1434","34236  >  443 [ACK] Seq=169003 Ack=3627 Win=2363 Len=1368 TSval=7879211 TSecr=760684735 [TCP segment of a reassembled PDU]"
"326","2018-08-23 02:08:29.993147","192.168.2.3","216.58.197.4","TLSv1.2","212","Application Data"
"327","2018-08-23 02:08:29.993406","192.168.2.3","216.58.197.4","TCP","1434","34236  >  443 [ACK] Seq=170517 Ack=3627 Win=2363 Len=1368 TSval=7879211 TSecr=760684735 [TCP segment of a reassembled PDU]"
"328","2018-08-23 02:08:29.993409","192.168.2.3","216.58.197.4","TLSv1.2","155","Application Data"
"332","2018-08-23 02:08:30.028604","192.168.2.3","216.58.197.4","TCP","66","34236  >  443 [ACK] Seq=171974 Ack=3947 Win=2363 Len=0 TSval=7879213 TSecr=760684743"
"333","2018-08-23 02:08:30.028611","192.168.2.3","216.58.197.4","TCP","78","[TCP Dup ACK 332#1] 34236  >  443 [ACK] Seq=171974 Ack=3947 Win=2363 Len=0 TSval=7879214 TSecr=760684768 SLE=3838 SRE=3947"
"334","2018-08-23 02:08:30.104647","192.168.2.3","216.58.197.4","TCP","1434","34236  >  443 [ACK] Seq=171974 Ack=3947 Win=2363 Len=1368 TSval=7879222 TSecr=760684794 [TCP segment of a reassembled PDU]"
"335","2018-08-23 02:08:30.104971","192.168.2.3","216.58.197.4","TCP","1434","34236  >  443 [ACK] Seq=173342 Ack=3947 Win=2363 Len=1368 TSval=7879222 TSecr=760684794 [TCP segment of a reassembled PDU]"
"336","2018-08-23 02:08:30.104976","192.168.2.3","216.58.197.4","TLSv1.2","212","Application Data"
"337","2018-08-23 02:08:30.105358","192.168.2.3","216.58.197.4","TCP","1434","34236  >  443 [ACK] Seq=174856 Ack=3947 Win=2363 Len=1368 TSval=7879222 TSecr=760684794 [TCP segment of a reassembled PDU]"
"338","2018-08-23 02:08:30.105360","192.168.2.3","216.58.197.4","TLSv1.2","127","Application Data"
"342","2018-08-23 02:08:30.203906","192.168.2.3","216.58.197.4","TCP","1434","34236  >  443 [ACK] Seq=176285 Ack=3947 Win=2363 Len=1368 TSval=7879232 TSecr=760684906 [TCP segment of a reassembled PDU]"
"343","2018-08-23 02:08:30.205072","192.168.2.3","216.58.197.4","TCP","1434","34236  >  443 [ACK] Seq=177653 Ack=3947 Win=2363 Len=1368 TSval=7879232 TSecr=760684906 [TCP segment of a reassembled PDU]"
"344","2018-08-23 02:08:30.205075","192.168.2.3","216.58.197.4","TLSv1.2","212","Application Data"
"345","2018-08-23 02:08:30.205284","192.168.2.3","216.58.197.4","TCP","1434","34236  >  443 [ACK] Seq=179167 Ack=3947 Win=2363 Len=1368 TSval=7879232 TSecr=760684906 [TCP segment of a reassembled PDU]"
"346","2018-08-23 02:08:30.205286","192.168.2.3","216.58.197.4","TLSv1.2","155","Application Data"
"352","2018-08-23 02:08:30.254276","192.168.2.3","216.58.197.4","TCP","66","34236  >  443 [ACK] Seq=180624 Ack=4151 Win=2363 Len=0 TSval=7879237 TSecr=760685050"
"353","2018-08-23 02:08:30.254280","192.168.2.3","216.58.197.4","TCP","66","34236  >  443 [ACK] Seq=180624 Ack=4253 Win=2363 Len=0 TSval=7879237 TSecr=760685050"
"354","2018-08-23 02:08:30.278626","192.168.2.3","216.58.197.4","TCP","1434","34236  >  443 [ACK] Seq=180624 Ack=4253 Win=2363 Len=1368 TSval=7879240 TSecr=760685050 [TCP segment of a reassembled PDU]"
"355","2018-08-23 02:08:30.278983","192.168.2.3","216.58.197.4","TCP","1434","34236  >  443 [ACK] Seq=181992 Ack=4253 Win=2363 Len=1368 TSval=7879240 TSecr=760685050 [TCP segment of a reassembled PDU]"
"356","2018-08-23 02:08:30.278986","192.168.2.3","216.58.197.4","TLSv1.2","212","Application Data"
"357","2018-08-23 02:08:30.278987","192.168.2.3","216.58.197.4","TLSv1.2","598","Application Data"
"358","2018-08-23 02:08:30.278988","192.168.2.3","216.58.197.4","TLSv1.2","102","Application Data"
"364","2018-08-23 02:08:30.289752","192.168.2.3","216.58.197.4","TCP","66","34236  >  443 [ACK] Seq=184074 Ack=5019 Win=2363 Len=0 TSval=7879241 TSecr=760685084"
"367","2018-08-23 02:08:30.724998","192.168.2.3","216.58.197.4","TCP","66","34236  >  443 [ACK] Seq=184074 Ack=5250 Win=2363 Len=0 TSval=7879284 TSecr=760685510"
"369","2018-08-23 02:08:30.855478","192.168.2.3","216.58.197.4","TCP","66","34236  >  443 [ACK] Seq=184074 Ack=5384 Win=2363 Len=0 TSval=7879298 TSecr=760685614"
"372","2018-08-23 02:08:30.870913","192.168.2.3","216.58.197.4","TCP","66","34236  >  443 [ACK] Seq=184074 Ack=6802 Win=2363 Len=0 TSval=7879299 TSecr=760685664"
"373","2018-08-23 02:08:30.870917","192.168.2.3","216.58.197.4","TCP","66","34236  >  443 [ACK] Seq=184074 Ack=6913 Win=2363 Len=0 TSval=7879299 TSecr=760685664"
"385","2018-08-23 02:08:30.973294","192.168.2.3","216.58.197.4","TCP","66","34236  >  443 [ACK] Seq=184074 Ack=8837 Win=2363 Len=0 TSval=7879309 TSecr=760685767"
"386","2018-08-23 02:08:30.983889","192.168.2.3","216.58.197.4","TCP","66","34236  >  443 [ACK] Seq=184074 Ack=15613 Win=2332 Len=0 TSval=7879310 TSecr=760685768"
"387","2018-08-23 02:08:30.983892","192.168.2.3","216.58.197.4","TCP","66","34236  >  443 [ACK] Seq=184074 Ack=17031 Win=2363 Len=0 TSval=7879310 TSecr=760685768"
"388","2018-08-23 02:08:30.983893","192.168.2.3","216.58.197.4","TCP","66","34236  >  443 [ACK] Seq=184074 Ack=17721 Win=2363 Len=0 TSval=7879310 TSecr=760685768"
"391","2018-08-23 02:08:31.006571","192.168.2.3","216.58.197.4","TCP","66","34236  >  443 [ACK] Seq=184074 Ack=19139 Win=2363 Len=0 TSval=7879313 TSecr=760685802"
"392","2018-08-23 02:08:31.006887","192.168.2.3","216.58.197.4","TCP","66","34236  >  443 [ACK] Seq=184074 Ack=19432 Win=2363 Len=0 TSval=7879313 TSecr=760685802"
"403","2018-08-23 02:08:31.012538","192.168.2.3","216.58.197.4","TCP","66","34236  >  443 [ACK] Seq=184074 Ack=21188 Win=2363 Len=0 TSval=7879313 TSecr=760685804"
"406","2018-08-23 02:08:31.014079","192.168.2.3","216.58.197.4","TCP","66","34236  >  443 [ACK] Seq=184074 Ack=23048 Win=2363 Len=0 TSval=7879313 TSecr=760685804"
"410","2018-08-23 02:08:31.014309","192.168.2.3","216.58.197.4","TCP","66","34236  >  443 [ACK] Seq=184074 Ack=24727 Win=2363 Len=0 TSval=7879313 TSecr=760685806"
"414","2018-08-23 02:08:31.017232","192.168.2.3","216.58.197.4","TCP","66","34236  >  443 [ACK] Seq=184074 Ack=26538 Win=2363 Len=0 TSval=7879313 TSecr=760685808"
"415","2018-08-23 02:08:31.017247","192.168.2.3","216.58.197.4","TCP","66","34236  >  443 [ACK] Seq=184074 Ack=28376 Win=2363 Len=0 TSval=7879313 TSecr=760685808"
"416","2018-08-23 02:08:31.017250","192.168.2.3","216.58.197.4","TCP","66","34236  >  443 [ACK] Seq=184074 Ack=30292 Win=2363 Len=0 TSval=7879314 TSecr=760685809"
"422","2018-08-23 02:08:31.018122","192.168.2.3","216.58.197.4","TCP","66","34236  >  443 [ACK] Seq=184074 Ack=32064 Win=2363 Len=0 TSval=7879314 TSecr=760685811"
"423","2018-08-23 02:08:31.018125","192.168.2.3","216.58.197.4","TCP","66","34236  >  443 [ACK] Seq=184074 Ack=33925 Win=2363 Len=0 TSval=7879314 TSecr=760685811"
"428","2018-08-23 02:08:31.020003","192.168.2.3","216.58.197.4","TCP","66","34236  >  443 [ACK] Seq=184074 Ack=35747 Win=2363 Len=0 TSval=7879314 TSecr=760685812"
"429","2018-08-23 02:08:31.020006","192.168.2.3","216.58.197.4","TCP","66","34236  >  443 [ACK] Seq=184074 Ack=37470 Win=2363 Len=0 TSval=7879314 TSecr=760685814"
"432","2018-08-23 02:08:31.022041","192.168.2.3","216.58.197.4","TCP","66","34236  >  443 [ACK] Seq=184074 Ack=40306 Win=2363 Len=0 TSval=7879314 TSecr=760685814"
"433","2018-08-23 02:08:31.022044","192.168.2.3","216.58.197.4","TCP","66","34236  >  443 [ACK] Seq=184074 Ack=41015 Win=2363 Len=0 TSval=7879314 TSecr=760685814"
"438","2018-08-23 02:08:31.022716","192.168.2.3","216.58.197.4","TCP","66","34236  >  443 [ACK] Seq=184074 Ack=42728 Win=2363 Len=0 TSval=7879314 TSecr=760685816"
"439","2018-08-23 02:08:31.022719","192.168.2.3","216.58.197.4","TCP","66","34236  >  443 [ACK] Seq=184074 Ack=44424 Win=2363 Len=0 TSval=7879314 TSecr=760685816"
"440","2018-08-23 02:08:31.025346","192.168.2.3","216.58.197.4","TCP","66","34236  >  443 [ACK] Seq=184074 Ack=46141 Win=2363 Len=0 TSval=7879314 TSecr=760685817"
"441","2018-08-23 02:08:31.025348","192.168.2.3","216.58.197.4","TCP","66","34236  >  443 [ACK] Seq=184074 Ack=48050 Win=2363 Len=0 TSval=7879314 TSecr=760685819"
"442","2018-08-23 02:08:31.025721","192.168.2.3","216.58.197.4","TCP","66","34236  >  443 [ACK] Seq=184074 Ack=49903 Win=2363 Len=0 TSval=7879315 TSecr=760685819"
"448","2018-08-23 02:08:31.041916","192.168.2.3","216.58.197.4","TCP","66","34236  >  443 [ACK] Seq=184074 Ack=51644 Win=2363 Len=0 TSval=7879316 TSecr=760685836"
"451","2018-08-23 02:08:31.042220","192.168.2.3","216.58.197.4","TCP","66","34236  >  443 [ACK] Seq=184074 Ack=54480 Win=2363 Len=0 TSval=7879316 TSecr=760685836"
"464","2018-08-23 02:08:31.046220","192.168.2.3","216.58.197.4","TCP","66","34236  >  443 [ACK] Seq=184074 Ack=55004 Win=2363 Len=0 TSval=7879316 TSecr=760685836"
"465","2018-08-23 02:08:31.046223","192.168.2.3","216.58.197.4","TCP","66","34236  >  443 [ACK] Seq=184074 Ack=56708 Win=2363 Len=0 TSval=7879316 TSecr=760685839"
"466","2018-08-23 02:08:31.046448","192.168.2.3","216.58.197.4","TCP","66","34236  >  443 [ACK] Seq=184074 Ack=58545 Win=2363 Len=0 TSval=7879317 TSecr=760685839"
"467","2018-08-23 02:08:31.046787","192.168.2.3","216.58.197.4","TCP","66","34236  >  443 [ACK] Seq=184074 Ack=60294 Win=2363 Len=0 TSval=7879317 TSecr=760685839"
"468","2018-08-23 02:08:31.047055","192.168.2.3","216.58.197.4","TCP","66","34236  >  443 [ACK] Seq=184074 Ack=62220 Win=2363 Len=0 TSval=7879317 TSecr=760685841"
"469","2018-08-23 02:08:31.047518","192.168.2.3","216.58.197.4","TCP","66","34236  >  443 [ACK] Seq=184074 Ack=63437 Win=2363 Len=0 TSval=7879317 TSecr=760685841"
"470","2018-08-23 02:08:31.070656","192.168.2.3","216.58.197.4","TLSv1.2","104","Application Data"
"476","2018-08-23 02:08:41.995866","192.168.2.3","216.58.197.3","TCP","66","43379  >  443 [ACK] Seq=1 Ack=1 Win=406 Len=0 TSval=7880412 TSecr=1765866962"
"478","2018-08-23 02:08:43.287461","192.168.2.3","216.58.197.14","TLSv1.2","156","Application Data"
"479","2018-08-23 02:08:43.287666","192.168.2.3","216.58.197.14","TLSv1.2","104","Application Data"
"480","2018-08-23 02:08:43.287669","192.168.2.3","216.58.197.14","TLSv1.2","582","Application Data"
"485","2018-08-23 02:08:43.326004","192.168.2.3","216.58.197.14","TCP","66","41142  >  443 [ACK] Seq=645 Ack=39 Win=661 Len=0 TSval=7880545 TSecr=933706823"
"490","2018-08-23 02:08:43.432499","192.168.2.3","216.58.197.14","TCP","66","41142  >  443 [ACK] Seq=645 Ack=107 Win=661 Len=0 TSval=7880555 TSecr=933706963"
"491","2018-08-23 02:08:43.432741","192.168.2.3","216.58.197.14","TCP","66","41142  >  443 [ACK] Seq=645 Ack=218 Win=661 Len=0 TSval=7880555 TSecr=933706963"
"492","2018-08-23 02:08:43.432962","192.168.2.3","216.58.197.14","TCP","66","41142  >  443 [ACK] Seq=645 Ack=310 Win=661 Len=0 TSval=7880555 TSecr=933706963"
"493","2018-08-23 02:08:43.432964","192.168.2.3","216.58.197.14","TCP","66","41142  >  443 [ACK] Seq=645 Ack=348 Win=661 Len=0 TSval=7880555 TSecr=933706963"
"494","2018-08-23 02:08:43.433851","192.168.2.3","216.58.197.14","TLSv1.2","104","Application Data"
