"No.","Time","Source","Destination","Protocol","Length","Info"
"13","2018-08-23 01:52:20.553274","192.168.2.3","216.58.197.4","TLSv1.2","156","Application Data"
"14","2018-08-23 01:52:20.553513","192.168.2.3","216.58.197.4","TLSv1.2","104","Application Data"
"15","2018-08-23 01:52:20.554636","192.168.2.3","216.58.197.4","TLSv1.2","158","Application Data"
"19","2018-08-23 01:52:20.567043","192.168.2.3","216.58.197.4","TCP","1434","34236  >  443 [ACK] Seq=221 Ack=39 Win=848 Len=1368 TSval=7782270 TSecr=759715354 [TCP segment of a reassembled PDU]"
"20","2018-08-23 01:52:20.567320","192.168.2.3","216.58.197.4","TCP","1434","34236  >  443 [ACK] Seq=1589 Ack=39 Win=848 Len=1368 TSval=7782270 TSecr=759715354 [TCP segment of a reassembled PDU]"
"21","2018-08-23 01:52:20.567322","192.168.2.3","216.58.197.4","TLSv1.2","212","Application Data"
"22","2018-08-23 01:52:20.567712","192.168.2.3","216.58.197.4","TCP","1434","34236  >  443 [ACK] Seq=3103 Ack=39 Win=848 Len=1368 TSval=7782270 TSecr=759715354 [TCP segment of a reassembled PDU]"
"23","2018-08-23 01:52:20.567714","192.168.2.3","216.58.197.4","TLSv1.2","183","Application Data"
"24","2018-08-23 01:52:20.567984","192.168.2.3","216.58.197.4","TCP","1434","34236  >  443 [ACK] Seq=4588 Ack=39 Win=848 Len=1368 TSval=7782270 TSecr=759715354 [TCP segment of a reassembled PDU]"
"25","2018-08-23 01:52:20.567987","192.168.2.3","216.58.197.4","TCP","1434","34236  >  443 [ACK] Seq=5956 Ack=39 Win=848 Len=1368 TSval=7782270 TSecr=759715354 [TCP segment of a reassembled PDU]"
"26","2018-08-23 01:52:20.567988","192.168.2.3","216.58.197.4","TLSv1.2","212","Application Data"
"27","2018-08-23 01:52:20.568091","192.168.2.3","216.58.197.4","TCP","1434","34236  >  443 [ACK] Seq=7470 Ack=39 Win=848 Len=1368 TSval=7782270 TSecr=759715354 [TCP segment of a reassembled PDU]"
"32","2018-08-23 01:52:20.574335","192.168.2.3","216.58.197.4","TLSv1.2","1434","Application Data [TCP segment of a reassembled PDU]"
"33","2018-08-23 01:52:20.574457","192.168.2.3","216.58.197.4","TCP","1434","34236  >  443 [ACK] Seq=10206 Ack=39 Win=848 Len=1368 TSval=7782270 TSecr=759715367 [TCP segment of a reassembled PDU]"
"34","2018-08-23 01:52:20.574722","192.168.2.3","216.58.197.4","TLSv1.2","1434","Application Data [TCP segment of a reassembled PDU]"
"35","2018-08-23 01:52:20.574725","192.168.2.3","216.58.197.4","TLSv1.2","1434","Application Data [TCP segment of a reassembled PDU]"
"36","2018-08-23 01:52:20.574878","192.168.2.3","216.58.197.4","TCP","1434","34236  >  443 [ACK] Seq=14310 Ack=39 Win=848 Len=1368 TSval=7782270 TSecr=759715367 [TCP segment of a reassembled PDU]"
"37","2018-08-23 01:52:20.575036","192.168.2.3","216.58.197.4","TLSv1.2","1434","Application Data [TCP segment of a reassembled PDU]"
"38","2018-08-23 01:52:20.575274","192.168.2.3","216.58.197.4","TLSv1.2","1434","Application Data [TCP segment of a reassembled PDU]"
"39","2018-08-23 01:52:20.575899","192.168.2.3","216.58.197.4","TCP","1434","34236  >  443 [ACK] Seq=18414 Ack=39 Win=848 Len=1368 TSval=7782270 TSecr=759715368 [TCP segment of a reassembled PDU]"
"40","2018-08-23 01:52:20.575902","192.168.2.3","216.58.197.4","TLSv1.2","1434","Application Data [TCP segment of a reassembled PDU]"
"41","2018-08-23 01:52:20.576049","192.168.2.3","216.58.197.4","TLSv1.2","1434","Application Data [TCP segment of a reassembled PDU]"
"42","2018-08-23 01:52:20.576188","192.168.2.3","216.58.197.4","TCP","1434","34236  >  443 [ACK] Seq=22518 Ack=39 Win=848 Len=1368 TSval=7782270 TSecr=759715368 [TCP segment of a reassembled PDU]"
"43","2018-08-23 01:52:20.576487","192.168.2.3","216.58.197.4","TLSv1.2","1434","Application Data [TCP segment of a reassembled PDU]"
"44","2018-08-23 01:52:20.576626","192.168.2.3","216.58.197.4","TLSv1.2","1434","Application Data [TCP segment of a reassembled PDU]"
"45","2018-08-23 01:52:20.576690","192.168.2.3","216.58.197.4","TCP","1434","34236  >  443 [ACK] Seq=26622 Ack=39 Win=848 Len=1368 TSval=7782270 TSecr=759715368 [TCP segment of a reassembled PDU]"
"53","2018-08-23 01:52:20.588606","192.168.2.3","216.58.197.4","TLSv1.2","1434","Application Data [TCP segment of a reassembled PDU]"
"54","2018-08-23 01:52:20.588611","192.168.2.3","216.58.197.4","TLSv1.2","1434","Application Data [TCP segment of a reassembled PDU]"
"55","2018-08-23 01:52:20.588779","192.168.2.3","216.58.197.4","TCP","1434","34236  >  443 [ACK] Seq=30726 Ack=39 Win=848 Len=1368 TSval=7782271 TSecr=759715374 [TCP segment of a reassembled PDU]"
"56","2018-08-23 01:52:20.589037","192.168.2.3","216.58.197.4","TCP","1434","34236  >  443 [ACK] Seq=32094 Ack=39 Win=848 Len=1368 TSval=7782271 TSecr=759715375 [TCP segment of a reassembled PDU]"
"57","2018-08-23 01:52:20.589273","192.168.2.3","216.58.197.4","TLSv1.2","1434","Application Data [TCP segment of a reassembled PDU]"
"58","2018-08-23 01:52:20.589584","192.168.2.3","216.58.197.4","TLSv1.2","1434","Application Data [TCP segment of a reassembled PDU]"
"59","2018-08-23 01:52:20.589585","192.168.2.3","216.58.197.4","TCP","1434","34236  >  443 [ACK] Seq=36198 Ack=39 Win=848 Len=1368 TSval=7782271 TSecr=759715375 [TCP segment of a reassembled PDU]"
"60","2018-08-23 01:52:20.589812","192.168.2.3","216.58.197.4","TLSv1.2","1434","Application Data [TCP segment of a reassembled PDU]"
"61","2018-08-23 01:52:20.590020","192.168.2.3","216.58.197.4","TLSv1.2","1434","Application Data [TCP segment of a reassembled PDU]"
"62","2018-08-23 01:52:20.590211","192.168.2.3","216.58.197.4","TCP","1434","34236  >  443 [ACK] Seq=40302 Ack=39 Win=848 Len=1368 TSval=7782271 TSecr=759715376 [TCP segment of a reassembled PDU]"
"63","2018-08-23 01:52:20.590213","192.168.2.3","216.58.197.4","TLSv1.2","1434","Application Data [TCP segment of a reassembled PDU]"
"64","2018-08-23 01:52:20.590586","192.168.2.3","216.58.197.4","TLSv1.2","1434","Application Data [TCP segment of a reassembled PDU]"
"65","2018-08-23 01:52:20.590588","192.168.2.3","216.58.197.4","TCP","1434","34236  >  443 [ACK] Seq=44406 Ack=39 Win=848 Len=1368 TSval=7782271 TSecr=759715376 [TCP segment of a reassembled PDU]"
"66","2018-08-23 01:52:20.590944","192.168.2.3","216.58.197.4","TLSv1.2","1434","Application Data [TCP segment of a reassembled PDU]"
"67","2018-08-23 01:52:20.590946","192.168.2.3","216.58.197.4","TLSv1.2","1434","Application Data [TCP segment of a reassembled PDU]"
"68","2018-08-23 01:52:20.591125","192.168.2.3","216.58.197.4","TCP","1434","34236  >  443 [PSH, ACK] Seq=48510 Ack=39 Win=848 Len=1368 TSval=7782272 TSecr=759715376 [TCP segment of a reassembled PDU]"
"69","2018-08-23 01:52:20.591337","192.168.2.3","216.58.197.4","TLSv1.2","1434","Application Data [TCP segment of a reassembled PDU]"
"70","2018-08-23 01:52:20.591689","192.168.2.3","216.58.197.4","TLSv1.2","1434","Application Data [TCP segment of a reassembled PDU]"
"71","2018-08-23 01:52:20.591892","192.168.2.3","216.58.197.4","TCP","1434","34236  >  443 [ACK] Seq=52614 Ack=39 Win=848 Len=1368 TSval=7782272 TSecr=759715377 [TCP segment of a reassembled PDU]"
"77","2018-08-23 01:52:20.594538","192.168.2.3","216.58.197.4","TLSv1.2","1434","Application Data [TCP segment of a reassembled PDU]"
"81","2018-08-23 01:52:20.595709","192.168.2.3","216.58.197.4","TLSv1.2","1434","Application Data [TCP segment of a reassembled PDU]"
"82","2018-08-23 01:52:20.595711","192.168.2.3","216.58.197.4","TCP","1434","34236  >  443 [ACK] Seq=56718 Ack=39 Win=848 Len=1368 TSval=7782272 TSecr=759715389 [TCP segment of a reassembled PDU]"
"84","2018-08-23 01:52:20.596151","192.168.2.3","216.58.197.4","TLSv1.2","1434","Application Data [TCP segment of a reassembled PDU]"
"85","2018-08-23 01:52:20.596153","192.168.2.3","216.58.197.4","TLSv1.2","438","Application Data"
"89","2018-08-23 01:52:20.613563","192.168.2.3","216.58.197.4","TCP","1434","34236  >  443 [ACK] Seq=59826 Ack=39 Win=848 Len=1368 TSval=7782274 TSecr=759715396 [TCP segment of a reassembled PDU]"
"90","2018-08-23 01:52:20.613833","192.168.2.3","216.58.197.4","TCP","1434","34236  >  443 [ACK] Seq=61194 Ack=39 Win=848 Len=1368 TSval=7782274 TSecr=759715396 [TCP segment of a reassembled PDU]"
"91","2018-08-23 01:52:20.613835","192.168.2.3","216.58.197.4","TLSv1.2","212","Application Data"
"92","2018-08-23 01:52:20.614288","192.168.2.3","216.58.197.4","TCP","1434","34236  >  443 [ACK] Seq=62708 Ack=39 Win=848 Len=1368 TSval=7782274 TSecr=759715396 [TCP segment of a reassembled PDU]"
"93","2018-08-23 01:52:20.614291","192.168.2.3","216.58.197.4","TLSv1.2","155","Application Data"
"97","2018-08-23 01:52:20.673184","192.168.2.3","216.58.197.4","TCP","1434","34236  >  443 [ACK] Seq=64165 Ack=39 Win=848 Len=1368 TSval=7782280 TSecr=759715454 [TCP segment of a reassembled PDU]"
"98","2018-08-23 01:52:20.673707","192.168.2.3","216.58.197.4","TCP","1434","34236  >  443 [ACK] Seq=65533 Ack=39 Win=848 Len=1368 TSval=7782280 TSecr=759715454 [TCP segment of a reassembled PDU]"
"99","2018-08-23 01:52:20.673712","192.168.2.3","216.58.197.4","TLSv1.2","212","Application Data"
"100","2018-08-23 01:52:20.674049","192.168.2.3","216.58.197.4","TCP","1434","34236  >  443 [ACK] Seq=67047 Ack=39 Win=848 Len=1368 TSval=7782280 TSecr=759715454 [TCP segment of a reassembled PDU]"
"101","2018-08-23 01:52:20.674052","192.168.2.3","216.58.197.4","TLSv1.2","155","Application Data"
"105","2018-08-23 01:52:20.764832","192.168.2.3","216.58.197.4","TCP","1434","34236  >  443 [ACK] Seq=68504 Ack=39 Win=848 Len=1368 TSval=7782289 TSecr=759715474 [TCP segment of a reassembled PDU]"
"106","2018-08-23 01:52:20.764837","192.168.2.3","216.58.197.4","TCP","1434","34236  >  443 [ACK] Seq=69872 Ack=39 Win=848 Len=1368 TSval=7782289 TSecr=759715474 [TCP segment of a reassembled PDU]"
"107","2018-08-23 01:52:20.764838","192.168.2.3","216.58.197.4","TLSv1.2","212","Application Data"
"108","2018-08-23 01:52:20.765227","192.168.2.3","216.58.197.4","TCP","1434","34236  >  443 [ACK] Seq=71386 Ack=39 Win=848 Len=1368 TSval=7782289 TSecr=759715474 [TCP segment of a reassembled PDU]"
"109","2018-08-23 01:52:20.765229","192.168.2.3","216.58.197.4","TLSv1.2","155","Application Data"
"112","2018-08-23 01:52:20.854138","192.168.2.3","216.58.197.4","TCP","1434","34236  >  443 [ACK] Seq=72843 Ack=39 Win=848 Len=1368 TSval=7782298 TSecr=759715565 [TCP segment of a reassembled PDU]"
"113","2018-08-23 01:52:20.854511","192.168.2.3","216.58.197.4","TCP","1434","34236  >  443 [ACK] Seq=74211 Ack=39 Win=848 Len=1368 TSval=7782298 TSecr=759715565 [TCP segment of a reassembled PDU]"
"114","2018-08-23 01:52:20.854514","192.168.2.3","216.58.197.4","TLSv1.2","212","Application Data"
"115","2018-08-23 01:52:20.857204","192.168.2.3","216.58.197.4","TCP","1434","34236  >  443 [ACK] Seq=75725 Ack=39 Win=848 Len=1368 TSval=7782298 TSecr=759715565 [TCP segment of a reassembled PDU]"
"116","2018-08-23 01:52:20.857208","192.168.2.3","216.58.197.4","TLSv1.2","155","Application Data"
"123","2018-08-23 01:52:20.884815","192.168.2.3","216.58.197.4","TCP","66","34236  >  443 [ACK] Seq=77182 Ack=391 Win=848 Len=0 TSval=7782302 TSecr=759715679"
"125","2018-08-23 01:52:20.898877","192.168.2.3","216.58.197.4","TCP","66","34236  >  443 [ACK] Seq=77182 Ack=589 Win=848 Len=0 TSval=7782303 TSecr=759715679"
"126","2018-08-23 01:52:20.950562","192.168.2.3","216.58.197.4","TCP","1434","34236  >  443 [ACK] Seq=77182 Ack=589 Win=848 Len=1368 TSval=7782308 TSecr=759715679 [TCP segment of a reassembled PDU]"
"127","2018-08-23 01:52:20.950857","192.168.2.3","216.58.197.4","TCP","1434","34236  >  443 [ACK] Seq=78550 Ack=589 Win=848 Len=1368 TSval=7782308 TSecr=759715679 [TCP segment of a reassembled PDU]"
"128","2018-08-23 01:52:20.950860","192.168.2.3","216.58.197.4","TLSv1.2","212","Application Data"
"129","2018-08-23 01:52:20.951635","192.168.2.3","216.58.197.4","TCP","1434","34236  >  443 [ACK] Seq=80064 Ack=589 Win=848 Len=1368 TSval=7782308 TSecr=759715679 [TCP segment of a reassembled PDU]"
"130","2018-08-23 01:52:20.951639","192.168.2.3","216.58.197.4","TLSv1.2","155","Application Data"
"134","2018-08-23 01:52:21.048226","192.168.2.3","216.58.197.4","TCP","1434","34236  >  443 [ACK] Seq=81521 Ack=589 Win=848 Len=1368 TSval=7782318 TSecr=759715791 [TCP segment of a reassembled PDU]"
"135","2018-08-23 01:52:21.049341","192.168.2.3","216.58.197.4","TCP","1434","34236  >  443 [ACK] Seq=82889 Ack=589 Win=848 Len=1368 TSval=7782318 TSecr=759715791 [TCP segment of a reassembled PDU]"
"136","2018-08-23 01:52:21.049347","192.168.2.3","216.58.197.4","TLSv1.2","212","Application Data"
"137","2018-08-23 01:52:21.050088","192.168.2.3","216.58.197.4","TCP","1434","34236  >  443 [ACK] Seq=84403 Ack=589 Win=848 Len=1368 TSval=7782318 TSecr=759715791 [TCP segment of a reassembled PDU]"
"138","2018-08-23 01:52:21.050094","192.168.2.3","216.58.197.4","TLSv1.2","155","Application Data"
"143","2018-08-23 01:52:21.097299","192.168.2.3","216.58.197.4","TCP","66","34236  >  443 [ACK] Seq=85860 Ack=661 Win=848 Len=0 TSval=7782323 TSecr=759715852"
"144","2018-08-23 01:52:21.147122","192.168.2.3","216.58.197.4","TCP","1434","34236  >  443 [ACK] Seq=85860 Ack=661 Win=848 Len=1368 TSval=7782328 TSecr=759715852 [TCP segment of a reassembled PDU]"
"145","2018-08-23 01:52:21.147128","192.168.2.3","216.58.197.4","TCP","1434","34236  >  443 [ACK] Seq=87228 Ack=661 Win=848 Len=1368 TSval=7782328 TSecr=759715852 [TCP segment of a reassembled PDU]"
"146","2018-08-23 01:52:21.147233","192.168.2.3","216.58.197.4","TLSv1.2","212","Application Data"
"147","2018-08-23 01:52:21.147572","192.168.2.3","216.58.197.4","TCP","1434","34236  >  443 [ACK] Seq=88742 Ack=661 Win=848 Len=1368 TSval=7782328 TSecr=759715852 [TCP segment of a reassembled PDU]"
"148","2018-08-23 01:52:21.147575","192.168.2.3","216.58.197.4","TLSv1.2","155","Application Data"
"153","2018-08-23 01:52:21.205280","192.168.2.3","216.58.197.4","TCP","66","34236  >  443 [ACK] Seq=90199 Ack=948 Win=848 Len=0 TSval=7782333 TSecr=759715997"
"154","2018-08-23 01:52:21.244607","192.168.2.3","216.58.197.4","TCP","1434","34236  >  443 [ACK] Seq=90199 Ack=948 Win=848 Len=1368 TSval=7782337 TSecr=759715997 [TCP segment of a reassembled PDU]"
"155","2018-08-23 01:52:21.244924","192.168.2.3","216.58.197.4","TCP","1434","34236  >  443 [ACK] Seq=91567 Ack=948 Win=848 Len=1368 TSval=7782337 TSecr=759715997 [TCP segment of a reassembled PDU]"
"156","2018-08-23 01:52:21.244927","192.168.2.3","216.58.197.4","TLSv1.2","212","Application Data"
"157","2018-08-23 01:52:21.244928","192.168.2.3","216.58.197.4","TCP","1434","34236  >  443 [ACK] Seq=93081 Ack=948 Win=848 Len=1368 TSval=7782337 TSecr=759715997 [TCP segment of a reassembled PDU]"
"158","2018-08-23 01:52:21.245014","192.168.2.3","216.58.197.4","TLSv1.2","155","Application Data"
"162","2018-08-23 01:52:21.334738","192.168.2.3","216.58.197.4","TCP","1434","34236  >  443 [ACK] Seq=94538 Ack=948 Win=848 Len=1368 TSval=7782346 TSecr=759716045 [TCP segment of a reassembled PDU]"
"163","2018-08-23 01:52:21.335186","192.168.2.3","216.58.197.4","TCP","1434","34236  >  443 [ACK] Seq=95906 Ack=948 Win=848 Len=1368 TSval=7782346 TSecr=759716045 [TCP segment of a reassembled PDU]"
"164","2018-08-23 01:52:21.335189","192.168.2.3","216.58.197.4","TLSv1.2","212","Application Data"
"165","2018-08-23 01:52:21.335202","192.168.2.3","216.58.197.4","TCP","1434","34236  >  443 [ACK] Seq=97420 Ack=948 Win=848 Len=1368 TSval=7782347 TSecr=759716045 [TCP segment of a reassembled PDU]"
"166","2018-08-23 01:52:21.335311","192.168.2.3","216.58.197.4","TLSv1.2","155","Application Data"
"169","2018-08-23 01:52:21.431302","192.168.2.3","216.58.197.4","TCP","1434","34236  >  443 [ACK] Seq=98877 Ack=948 Win=848 Len=1368 TSval=7782356 TSecr=759716135 [TCP segment of a reassembled PDU]"
"170","2018-08-23 01:52:21.431308","192.168.2.3","216.58.197.4","TCP","1434","34236  >  443 [ACK] Seq=100245 Ack=948 Win=848 Len=1368 TSval=7782356 TSecr=759716135 [TCP segment of a reassembled PDU]"
"171","2018-08-23 01:52:21.431309","192.168.2.3","216.58.197.4","TLSv1.2","212","Application Data"
"172","2018-08-23 01:52:21.432885","192.168.2.3","216.58.197.4","TCP","1434","34236  >  443 [ACK] Seq=101759 Ack=948 Win=848 Len=1368 TSval=7782356 TSecr=759716135 [TCP segment of a reassembled PDU]"
"173","2018-08-23 01:52:21.432888","192.168.2.3","216.58.197.4","TLSv1.2","155","Application Data"
"177","2018-08-23 01:52:21.528457","192.168.2.3","216.58.197.4","TCP","1434","34236  >  443 [ACK] Seq=103216 Ack=948 Win=848 Len=1368 TSval=7782366 TSecr=759716233 [TCP segment of a reassembled PDU]"
"178","2018-08-23 01:52:21.533844","192.168.2.3","216.58.197.4","TCP","1434","34236  >  443 [ACK] Seq=104584 Ack=948 Win=848 Len=1368 TSval=7782366 TSecr=759716233 [TCP segment of a reassembled PDU]"
"179","2018-08-23 01:52:21.533850","192.168.2.3","216.58.197.4","TLSv1.2","212","Application Data"
"180","2018-08-23 01:52:21.534113","192.168.2.3","216.58.197.4","TCP","1434","34236  >  443 [ACK] Seq=106098 Ack=948 Win=848 Len=1368 TSval=7782366 TSecr=759716233 [TCP segment of a reassembled PDU]"
"181","2018-08-23 01:52:21.534118","192.168.2.3","216.58.197.4","TLSv1.2","155","Application Data"
"185","2018-08-23 01:52:21.624366","192.168.2.3","216.58.197.4","TCP","1434","34236  >  443 [ACK] Seq=107555 Ack=948 Win=848 Len=1368 TSval=7782375 TSecr=759716334 [TCP segment of a reassembled PDU]"
"186","2018-08-23 01:52:21.625404","192.168.2.3","216.58.197.4","TCP","1434","34236  >  443 [ACK] Seq=108923 Ack=948 Win=848 Len=1368 TSval=7782375 TSecr=759716334 [TCP segment of a reassembled PDU]"
"187","2018-08-23 01:52:21.625408","192.168.2.3","216.58.197.4","TLSv1.2","212","Application Data"
"188","2018-08-23 01:52:21.625744","192.168.2.3","216.58.197.4","TCP","1434","34236  >  443 [ACK] Seq=110437 Ack=948 Win=848 Len=1368 TSval=7782375 TSecr=759716334 [TCP segment of a reassembled PDU]"
"189","2018-08-23 01:52:21.625748","192.168.2.3","216.58.197.4","TLSv1.2","155","Application Data"
"195","2018-08-23 01:52:21.697472","192.168.2.3","216.58.197.4","TCP","1434","34236  >  443 [ACK] Seq=111894 Ack=948 Win=848 Len=1368 TSval=7782382 TSecr=759716426 [TCP segment of a reassembled PDU]"
"196","2018-08-23 01:52:21.697477","192.168.2.3","216.58.197.4","TCP","1434","34236  >  443 [ACK] Seq=113262 Ack=948 Win=848 Len=1368 TSval=7782382 TSecr=759716426 [TCP segment of a reassembled PDU]"
"197","2018-08-23 01:52:21.697478","192.168.2.3","216.58.197.4","TLSv1.2","212","Application Data"
"198","2018-08-23 01:52:21.697539","192.168.2.3","216.58.197.4","TCP","1434","34236  >  443 [ACK] Seq=114776 Ack=948 Win=848 Len=1368 TSval=7782382 TSecr=759716426 [TCP segment of a reassembled PDU]"
"199","2018-08-23 01:52:21.697540","192.168.2.3","216.58.197.4","TLSv1.2","155","Application Data"
"203","2018-08-23 01:52:21.721558","192.168.2.3","216.58.197.4","TCP","66","34236  >  443 [ACK] Seq=116233 Ack=1132 Win=846 Len=0 TSval=7782383 TSecr=759716479"
"204","2018-08-23 01:52:21.721562","192.168.2.3","216.58.197.4","TCP","66","34236  >  443 [ACK] Seq=116233 Ack=1317 Win=844 Len=0 TSval=7782383 TSecr=759716479"
"205","2018-08-23 01:52:21.722389","192.168.2.3","216.58.197.4","TCP","78","[TCP Window Update] 34236  >  443 [ACK] Seq=116233 Ack=1317 Win=848 Len=0 TSval=7782385 TSecr=759716509 SLE=1132 SRE=1317"
"206","2018-08-23 01:52:21.789749","192.168.2.3","216.58.197.4","TCP","1434","34236  >  443 [ACK] Seq=116233 Ack=1317 Win=848 Len=1368 TSval=7782392 TSecr=759716509 [TCP segment of a reassembled PDU]"
"207","2018-08-23 01:52:21.790101","192.168.2.3","216.58.197.4","TCP","1434","34236  >  443 [ACK] Seq=117601 Ack=1317 Win=848 Len=1368 TSval=7782392 TSecr=759716509 [TCP segment of a reassembled PDU]"
"208","2018-08-23 01:52:21.790103","192.168.2.3","216.58.197.4","TLSv1.2","212","Application Data"
"209","2018-08-23 01:52:21.790514","192.168.2.3","216.58.197.4","TCP","1434","34236  >  443 [ACK] Seq=119115 Ack=1317 Win=848 Len=1368 TSval=7782392 TSecr=759716509 [TCP segment of a reassembled PDU]"
"210","2018-08-23 01:52:21.790516","192.168.2.3","216.58.197.4","TLSv1.2","155","Application Data"
"216","2018-08-23 01:52:21.850541","192.168.2.3","216.58.197.4","TCP","66","34236  >  443 [ACK] Seq=120572 Ack=1574 Win=844 Len=0 TSval=7782398 TSecr=759716644"
"217","2018-08-23 01:52:21.850544","192.168.2.3","216.58.197.4","TCP","66","34236  >  443 [ACK] Seq=120572 Ack=1815 Win=844 Len=0 TSval=7782398 TSecr=759716644"
"218","2018-08-23 01:52:21.881551","192.168.2.3","216.58.197.4","TCP","1434","34236  >  443 [ACK] Seq=120572 Ack=1815 Win=848 Len=1368 TSval=7782401 TSecr=759716644 [TCP segment of a reassembled PDU]"
"219","2018-08-23 01:52:21.881556","192.168.2.3","216.58.197.4","TCP","1434","34236  >  443 [ACK] Seq=121940 Ack=1815 Win=848 Len=1368 TSval=7782401 TSecr=759716644 [TCP segment of a reassembled PDU]"
"220","2018-08-23 01:52:21.881706","192.168.2.3","216.58.197.4","TLSv1.2","212","Application Data"
"221","2018-08-23 01:52:21.881709","192.168.2.3","216.58.197.4","TCP","1434","34236  >  443 [ACK] Seq=123454 Ack=1815 Win=848 Len=1368 TSval=7782401 TSecr=759716644 [TCP segment of a reassembled PDU]"
"222","2018-08-23 01:52:21.882002","192.168.2.3","216.58.197.4","TLSv1.2","155","Application Data"
"228","2018-08-23 01:52:21.899215","192.168.2.3","216.58.197.4","TCP","66","34236  >  443 [ACK] Seq=124911 Ack=2172 Win=848 Len=0 TSval=7782403 TSecr=759716679"
"229","2018-08-23 01:52:21.975961","192.168.2.3","216.58.197.4","TCP","1434","34236  >  443 [ACK] Seq=124911 Ack=2172 Win=848 Len=1368 TSval=7782411 TSecr=759716679 [TCP segment of a reassembled PDU]"
"230","2018-08-23 01:52:21.976458","192.168.2.3","216.58.197.4","TCP","1434","34236  >  443 [ACK] Seq=126279 Ack=2172 Win=848 Len=1368 TSval=7782411 TSecr=759716679 [TCP segment of a reassembled PDU]"
"231","2018-08-23 01:52:21.976463","192.168.2.3","216.58.197.4","TLSv1.2","212","Application Data"
"232","2018-08-23 01:52:21.976826","192.168.2.3","216.58.197.4","TCP","1434","34236  >  443 [ACK] Seq=127793 Ack=2172 Win=848 Len=1368 TSval=7782411 TSecr=759716679 [TCP segment of a reassembled PDU]"
"233","2018-08-23 01:52:21.976829","192.168.2.3","216.58.197.4","TLSv1.2","155","Application Data"
"237","2018-08-23 01:52:22.074698","192.168.2.3","216.58.197.4","TCP","1434","34236  >  443 [ACK] Seq=129250 Ack=2172 Win=848 Len=1368 TSval=7782421 TSecr=759716817 [TCP segment of a reassembled PDU]"
"238","2018-08-23 01:52:22.075096","192.168.2.3","216.58.197.4","TCP","1434","34236  >  443 [ACK] Seq=130618 Ack=2172 Win=848 Len=1368 TSval=7782421 TSecr=759716817 [TCP segment of a reassembled PDU]"
"239","2018-08-23 01:52:22.075100","192.168.2.3","216.58.197.4","TLSv1.2","212","Application Data"
"240","2018-08-23 01:52:22.075561","192.168.2.3","216.58.197.4","TCP","1434","34236  >  443 [ACK] Seq=132132 Ack=2172 Win=848 Len=1368 TSval=7782421 TSecr=759716817 [TCP segment of a reassembled PDU]"
"241","2018-08-23 01:52:22.075565","192.168.2.3","216.58.197.4","TLSv1.2","155","Application Data"
"246","2018-08-23 01:52:22.114534","192.168.2.3","216.58.197.4","TCP","66","34236  >  443 [ACK] Seq=133589 Ack=2206 Win=848 Len=0 TSval=7782425 TSecr=759716875"
"249","2018-08-23 01:52:22.133043","192.168.2.3","216.58.197.4","TCP","66","34236  >  443 [ACK] Seq=133589 Ack=2446 Win=848 Len=0 TSval=7782426 TSecr=759716927"
"250","2018-08-23 01:52:22.136059","192.168.2.3","216.58.197.4","TCP","1434","34236  >  443 [ACK] Seq=133589 Ack=2446 Win=848 Len=1368 TSval=7782427 TSecr=759716927 [TCP segment of a reassembled PDU]"
"251","2018-08-23 01:52:22.136447","192.168.2.3","216.58.197.4","TCP","1434","34236  >  443 [ACK] Seq=134957 Ack=2446 Win=848 Len=1368 TSval=7782427 TSecr=759716927 [TCP segment of a reassembled PDU]"
"252","2018-08-23 01:52:22.136450","192.168.2.3","216.58.197.4","TLSv1.2","212","Application Data"
"253","2018-08-23 01:52:22.136866","192.168.2.3","216.58.197.4","TCP","1434","34236  >  443 [ACK] Seq=136471 Ack=2446 Win=848 Len=1368 TSval=7782427 TSecr=759716927 [TCP segment of a reassembled PDU]"
"254","2018-08-23 01:52:22.136869","192.168.2.3","216.58.197.4","TLSv1.2","155","Application Data"
"257","2018-08-23 01:52:22.138121","192.168.2.3","216.58.197.4","TCP","66","34236  >  443 [ACK] Seq=137928 Ack=2788 Win=848 Len=0 TSval=7782427 TSecr=759716932"
"261","2018-08-23 01:52:22.230214","192.168.2.3","216.58.197.4","TCP","1434","34236  >  443 [ACK] Seq=137928 Ack=2788 Win=848 Len=1368 TSval=7782436 TSecr=759716977 [TCP segment of a reassembled PDU]"
"262","2018-08-23 01:52:22.230820","192.168.2.3","216.58.197.4","TCP","1434","34236  >  443 [ACK] Seq=139296 Ack=2788 Win=848 Len=1368 TSval=7782436 TSecr=759716977 [TCP segment of a reassembled PDU]"
"263","2018-08-23 01:52:22.230823","192.168.2.3","216.58.197.4","TLSv1.2","212","Application Data"
"264","2018-08-23 01:52:22.230823","192.168.2.3","216.58.197.4","TCP","1434","34236  >  443 [ACK] Seq=140810 Ack=2788 Win=848 Len=1368 TSval=7782436 TSecr=759716977 [TCP segment of a reassembled PDU]"
"265","2018-08-23 01:52:22.230942","192.168.2.3","216.58.197.4","TLSv1.2","155","Application Data"
"270","2018-08-23 01:52:22.290469","192.168.2.3","216.58.197.4","TCP","66","34236  >  443 [ACK] Seq=142267 Ack=3180 Win=848 Len=0 TSval=7782442 TSecr=759717085"
"271","2018-08-23 01:52:22.330876","192.168.2.3","216.58.197.4","TCP","1434","34236  >  443 [ACK] Seq=142267 Ack=3180 Win=848 Len=1368 TSval=7782446 TSecr=759717085 [TCP segment of a reassembled PDU]"
"272","2018-08-23 01:52:22.331071","192.168.2.3","216.58.197.4","TCP","1434","34236  >  443 [ACK] Seq=143635 Ack=3180 Win=848 Len=1368 TSval=7782446 TSecr=759717085 [TCP segment of a reassembled PDU]"
"273","2018-08-23 01:52:22.331073","192.168.2.3","216.58.197.4","TLSv1.2","212","Application Data"
"274","2018-08-23 01:52:22.331074","192.168.2.3","216.58.197.4","TCP","1434","34236  >  443 [ACK] Seq=145149 Ack=3180 Win=848 Len=1368 TSval=7782446 TSecr=759717085 [TCP segment of a reassembled PDU]"
"275","2018-08-23 01:52:22.331390","192.168.2.3","216.58.197.4","TLSv1.2","155","Application Data"
"279","2018-08-23 01:52:22.425211","192.168.2.3","216.58.197.4","TCP","1434","34236  >  443 [ACK] Seq=146606 Ack=3180 Win=848 Len=1368 TSval=7782455 TSecr=759717131 [TCP segment of a reassembled PDU]"
"280","2018-08-23 01:52:22.425216","192.168.2.3","216.58.197.4","TCP","1434","34236  >  443 [ACK] Seq=147974 Ack=3180 Win=848 Len=1368 TSval=7782455 TSecr=759717131 [TCP segment of a reassembled PDU]"
"281","2018-08-23 01:52:22.425217","192.168.2.3","216.58.197.4","TLSv1.2","212","Application Data"
"282","2018-08-23 01:52:22.425565","192.168.2.3","216.58.197.4","TCP","1434","34236  >  443 [ACK] Seq=149488 Ack=3180 Win=848 Len=1368 TSval=7782455 TSecr=759717131 [TCP segment of a reassembled PDU]"
"283","2018-08-23 01:52:22.425569","192.168.2.3","216.58.197.4","TLSv1.2","155","Application Data"
"289","2018-08-23 01:52:22.489887","192.168.2.3","216.58.197.4","TCP","66","34236  >  443 [ACK] Seq=150945 Ack=3440 Win=848 Len=0 TSval=7782462 TSecr=759717284"
"290","2018-08-23 01:52:22.491574","192.168.2.3","216.58.197.4","TCP","1434","34236  >  443 [ACK] Seq=150945 Ack=3440 Win=848 Len=1368 TSval=7782462 TSecr=759717284 [TCP segment of a reassembled PDU]"
"291","2018-08-23 01:52:22.491961","192.168.2.3","216.58.197.4","TCP","1434","34236  >  443 [ACK] Seq=152313 Ack=3440 Win=848 Len=1368 TSval=7782462 TSecr=759717284 [TCP segment of a reassembled PDU]"
"292","2018-08-23 01:52:22.491965","192.168.2.3","216.58.197.4","TLSv1.2","212","Application Data"
"293","2018-08-23 01:52:22.492372","192.168.2.3","216.58.197.4","TCP","1434","34236  >  443 [ACK] Seq=153827 Ack=3440 Win=848 Len=1368 TSval=7782462 TSecr=759717284 [TCP segment of a reassembled PDU]"
"294","2018-08-23 01:52:22.492376","192.168.2.3","216.58.197.4","TLSv1.2","155","Application Data"
"298","2018-08-23 01:52:22.587992","192.168.2.3","216.58.197.4","TCP","1434","34236  >  443 [ACK] Seq=155284 Ack=3440 Win=848 Len=1368 TSval=7782472 TSecr=759717292 [TCP segment of a reassembled PDU]"
"299","2018-08-23 01:52:22.588384","192.168.2.3","216.58.197.4","TCP","1434","34236  >  443 [ACK] Seq=156652 Ack=3440 Win=848 Len=1368 TSval=7782472 TSecr=759717292 [TCP segment of a reassembled PDU]"
"300","2018-08-23 01:52:22.588387","192.168.2.3","216.58.197.4","TLSv1.2","212","Application Data"
"301","2018-08-23 01:52:22.588671","192.168.2.3","216.58.197.4","TCP","1434","34236  >  443 [ACK] Seq=158166 Ack=3440 Win=848 Len=1368 TSval=7782472 TSecr=759717292 [TCP segment of a reassembled PDU]"
"302","2018-08-23 01:52:22.588674","192.168.2.3","216.58.197.4","TLSv1.2","155","Application Data"
"308","2018-08-23 01:52:22.646789","192.168.2.3","216.58.197.4","TCP","66","34236  >  443 [ACK] Seq=159623 Ack=3823 Win=848 Len=0 TSval=7782478 TSecr=759717441"
"309","2018-08-23 01:52:22.680926","192.168.2.3","216.58.197.4","TCP","1434","34236  >  443 [ACK] Seq=159623 Ack=3823 Win=848 Len=1368 TSval=7782481 TSecr=759717441 [TCP segment of a reassembled PDU]"
"310","2018-08-23 01:52:22.681167","192.168.2.3","216.58.197.4","TCP","1434","34236  >  443 [ACK] Seq=160991 Ack=3823 Win=848 Len=1368 TSval=7782481 TSecr=759717441 [TCP segment of a reassembled PDU]"
"311","2018-08-23 01:52:22.681183","192.168.2.3","216.58.197.4","TLSv1.2","212","Application Data"
"312","2018-08-23 01:52:22.681639","192.168.2.3","216.58.197.4","TCP","1434","34236  >  443 [ACK] Seq=162505 Ack=3823 Win=848 Len=1368 TSval=7782481 TSecr=759717441 [TCP segment of a reassembled PDU]"
"313","2018-08-23 01:52:22.681643","192.168.2.3","216.58.197.4","TLSv1.2","155","Application Data"
"319","2018-08-23 01:52:22.739482","192.168.2.3","216.58.197.4","TCP","66","34236  >  443 [ACK] Seq=163962 Ack=4297 Win=848 Len=0 TSval=7782487 TSecr=759717531"
"320","2018-08-23 01:52:22.775664","192.168.2.3","216.58.197.4","TCP","1434","34236  >  443 [ACK] Seq=163962 Ack=4297 Win=848 Len=1368 TSval=7782491 TSecr=759717531 [TCP segment of a reassembled PDU]"
"321","2018-08-23 01:52:22.775966","192.168.2.3","216.58.197.4","TCP","1434","34236  >  443 [ACK] Seq=165330 Ack=4297 Win=848 Len=1368 TSval=7782491 TSecr=759717531 [TCP segment of a reassembled PDU]"
"322","2018-08-23 01:52:22.775968","192.168.2.3","216.58.197.4","TLSv1.2","212","Application Data"
"323","2018-08-23 01:52:22.775969","192.168.2.3","216.58.197.4","TCP","1434","34236  >  443 [ACK] Seq=166844 Ack=4297 Win=848 Len=1368 TSval=7782491 TSecr=759717531 [TCP segment of a reassembled PDU]"
"324","2018-08-23 01:52:22.776188","192.168.2.3","216.58.197.4","TLSv1.2","155","Application Data"
"328","2018-08-23 01:52:22.845326","192.168.2.3","216.58.197.4","TCP","1434","34236  >  443 [ACK] Seq=168301 Ack=4297 Win=848 Len=1368 TSval=7782498 TSecr=759717576 [TCP segment of a reassembled PDU]"
"329","2018-08-23 01:52:22.845668","192.168.2.3","216.58.197.4","TCP","1434","34236  >  443 [ACK] Seq=169669 Ack=4297 Win=848 Len=1368 TSval=7782498 TSecr=759717576 [TCP segment of a reassembled PDU]"
"330","2018-08-23 01:52:22.845671","192.168.2.3","216.58.197.4","TLSv1.2","212","Application Data"
"331","2018-08-23 01:52:22.846072","192.168.2.3","216.58.197.4","TCP","1434","34236  >  443 [ACK] Seq=171183 Ack=4297 Win=848 Len=1368 TSval=7782498 TSecr=759717576 [TCP segment of a reassembled PDU]"
"332","2018-08-23 01:52:22.846074","192.168.2.3","216.58.197.4","TLSv1.2","155","Application Data"
"338","2018-08-23 01:52:22.899344","192.168.2.3","216.58.197.4","TCP","66","34236  >  443 [ACK] Seq=172640 Ack=4619 Win=848 Len=0 TSval=7782503 TSecr=759717680"
"341","2018-08-23 01:52:22.903343","192.168.2.3","216.58.197.4","TCP","66","34236  >  443 [ACK] Seq=172640 Ack=4790 Win=848 Len=0 TSval=7782503 TSecr=759717697"
"342","2018-08-23 01:52:22.940482","192.168.2.3","216.58.197.4","TCP","1434","34236  >  443 [ACK] Seq=172640 Ack=4790 Win=848 Len=1368 TSval=7782507 TSecr=759717697 [TCP segment of a reassembled PDU]"
"343","2018-08-23 01:52:22.940631","192.168.2.3","216.58.197.4","TCP","1434","34236  >  443 [ACK] Seq=174008 Ack=4790 Win=848 Len=1368 TSval=7782507 TSecr=759717697 [TCP segment of a reassembled PDU]"
"344","2018-08-23 01:52:22.940634","192.168.2.3","216.58.197.4","TLSv1.2","212","Application Data"
"345","2018-08-23 01:52:22.940842","192.168.2.3","216.58.197.4","TCP","1434","34236  >  443 [ACK] Seq=175522 Ack=4790 Win=848 Len=1368 TSval=7782507 TSecr=759717697 [TCP segment of a reassembled PDU]"
"346","2018-08-23 01:52:22.940845","192.168.2.3","216.58.197.4","TLSv1.2","155","Application Data"
"350","2018-08-23 01:52:23.035792","192.168.2.3","216.58.197.4","TCP","1434","34236  >  443 [ACK] Seq=176979 Ack=4790 Win=848 Len=1368 TSval=7782517 TSecr=759717781 [TCP segment of a reassembled PDU]"
"351","2018-08-23 01:52:23.036033","192.168.2.3","216.58.197.4","TCP","1434","34236  >  443 [ACK] Seq=178347 Ack=4790 Win=848 Len=1368 TSval=7782517 TSecr=759717781 [TCP segment of a reassembled PDU]"
"352","2018-08-23 01:52:23.036040","192.168.2.3","216.58.197.4","TLSv1.2","212","Application Data"
"353","2018-08-23 01:52:23.036200","192.168.2.3","216.58.197.4","TCP","1434","34236  >  443 [ACK] Seq=179861 Ack=4790 Win=848 Len=1368 TSval=7782517 TSecr=759717781 [TCP segment of a reassembled PDU]"
"354","2018-08-23 01:52:23.036205","192.168.2.3","216.58.197.4","TLSv1.2","155","Application Data"
"358","2018-08-23 01:52:23.099055","192.168.2.3","216.58.197.4","TCP","66","34236  >  443 [ACK] Seq=181318 Ack=5268 Win=848 Len=0 TSval=7782523 TSecr=759717893"
"359","2018-08-23 01:52:23.130746","192.168.2.3","216.58.197.4","TCP","1434","34236  >  443 [ACK] Seq=181318 Ack=5268 Win=848 Len=1368 TSval=7782526 TSecr=759717893 [TCP segment of a reassembled PDU]"
"360","2018-08-23 01:52:23.131179","192.168.2.3","216.58.197.4","TCP","1434","34236  >  443 [ACK] Seq=182686 Ack=5268 Win=848 Len=1368 TSval=7782526 TSecr=759717893 [TCP segment of a reassembled PDU]"
"361","2018-08-23 01:52:23.131183","192.168.2.3","216.58.197.4","TLSv1.2","212","Application Data"
"362","2018-08-23 01:52:23.131653","192.168.2.3","216.58.197.4","TCP","1434","34236  >  443 [ACK] Seq=184200 Ack=5268 Win=848 Len=1368 TSval=7782526 TSecr=759717893 [TCP segment of a reassembled PDU]"
"363","2018-08-23 01:52:23.131656","192.168.2.3","216.58.197.4","TLSv1.2","155","Application Data"
"367","2018-08-23 01:52:23.228944","192.168.2.3","216.58.197.4","TCP","1434","34236  >  443 [ACK] Seq=185657 Ack=5268 Win=848 Len=1368 TSval=7782536 TSecr=759717931 [TCP segment of a reassembled PDU]"
"368","2018-08-23 01:52:23.229184","192.168.2.3","216.58.197.4","TCP","1434","34236  >  443 [ACK] Seq=187025 Ack=5268 Win=848 Len=1368 TSval=7782536 TSecr=759717931 [TCP segment of a reassembled PDU]"
"369","2018-08-23 01:52:23.229188","192.168.2.3","216.58.197.4","TLSv1.2","212","Application Data"
"370","2018-08-23 01:52:23.229577","192.168.2.3","216.58.197.4","TCP","1434","34236  >  443 [ACK] Seq=188539 Ack=5268 Win=848 Len=1368 TSval=7782536 TSecr=759717931 [TCP segment of a reassembled PDU]"
"371","2018-08-23 01:52:23.229579","192.168.2.3","216.58.197.4","TLSv1.2","155","Application Data"
"377","2018-08-23 01:52:23.289829","192.168.2.3","216.58.197.4","TCP","66","34236  >  443 [ACK] Seq=189996 Ack=5636 Win=848 Len=0 TSval=7782542 TSecr=759718084"
"378","2018-08-23 01:52:23.324804","192.168.2.3","216.58.197.4","TCP","1434","34236  >  443 [ACK] Seq=189996 Ack=5636 Win=848 Len=1368 TSval=7782545 TSecr=759718084 [TCP segment of a reassembled PDU]"
"379","2018-08-23 01:52:23.325529","192.168.2.3","216.58.197.4","TCP","1434","34236  >  443 [ACK] Seq=191364 Ack=5636 Win=848 Len=1368 TSval=7782546 TSecr=759718084 [TCP segment of a reassembled PDU]"
"380","2018-08-23 01:52:23.325532","192.168.2.3","216.58.197.4","TLSv1.2","212","Application Data"
"381","2018-08-23 01:52:23.325533","192.168.2.3","216.58.197.4","TCP","1434","34236  >  443 [ACK] Seq=192878 Ack=5636 Win=848 Len=1368 TSval=7782546 TSecr=759718084 [TCP segment of a reassembled PDU]"
"382","2018-08-23 01:52:23.325655","192.168.2.3","216.58.197.4","TLSv1.2","155","Application Data"
"386","2018-08-23 01:52:23.419243","192.168.2.3","216.58.197.4","TCP","1434","34236  >  443 [ACK] Seq=194335 Ack=5636 Win=848 Len=1368 TSval=7782555 TSecr=759718125 [TCP segment of a reassembled PDU]"
"387","2018-08-23 01:52:23.419597","192.168.2.3","216.58.197.4","TCP","1434","34236  >  443 [ACK] Seq=195703 Ack=5636 Win=848 Len=1368 TSval=7782555 TSecr=759718125 [TCP segment of a reassembled PDU]"
"388","2018-08-23 01:52:23.419602","192.168.2.3","216.58.197.4","TLSv1.2","212","Application Data"
"389","2018-08-23 01:52:23.419603","192.168.2.3","216.58.197.4","TCP","1434","34236  >  443 [ACK] Seq=197217 Ack=5636 Win=848 Len=1368 TSval=7782555 TSecr=759718125 [TCP segment of a reassembled PDU]"
"390","2018-08-23 01:52:23.419733","192.168.2.3","216.58.197.4","TLSv1.2","155","Application Data"
"394","2018-08-23 01:52:23.543313","192.168.2.3","216.58.197.4","TCP","1434","34236  >  443 [ACK] Seq=198674 Ack=5636 Win=848 Len=1368 TSval=7782567 TSecr=759718219 [TCP segment of a reassembled PDU]"
"395","2018-08-23 01:52:23.543703","192.168.2.3","216.58.197.4","TCP","1434","34236  >  443 [ACK] Seq=200042 Ack=5636 Win=848 Len=1368 TSval=7782567 TSecr=759718219 [TCP segment of a reassembled PDU]"
"396","2018-08-23 01:52:23.543720","192.168.2.3","216.58.197.4","TLSv1.2","212","Application Data"
"397","2018-08-23 01:52:23.544139","192.168.2.3","216.58.197.4","TCP","1434","34236  >  443 [ACK] Seq=201556 Ack=5636 Win=848 Len=1368 TSval=7782567 TSecr=759718219 [TCP segment of a reassembled PDU]"
"398","2018-08-23 01:52:23.544143","192.168.2.3","216.58.197.4","TLSv1.2","155","Application Data"
"405","2018-08-23 01:52:23.633751","192.168.2.3","216.58.197.4","TCP","66","34236  >  443 [ACK] Seq=203013 Ack=6122 Win=848 Len=0 TSval=7782576 TSecr=759718427"
"406","2018-08-23 01:52:23.640350","192.168.2.3","216.58.197.4","TCP","1434","34236  >  443 [ACK] Seq=203013 Ack=6274 Win=848 Len=1368 TSval=7782577 TSecr=759718428 [TCP segment of a reassembled PDU]"
"407","2018-08-23 01:52:23.640712","192.168.2.3","216.58.197.4","TCP","1434","34236  >  443 [ACK] Seq=204381 Ack=6274 Win=848 Len=1368 TSval=7782577 TSecr=759718428 [TCP segment of a reassembled PDU]"
"408","2018-08-23 01:52:23.640715","192.168.2.3","216.58.197.4","TLSv1.2","212","Application Data"
"409","2018-08-23 01:52:23.640716","192.168.2.3","216.58.197.4","TCP","1434","34236  >  443 [ACK] Seq=205895 Ack=6274 Win=848 Len=1368 TSval=7782577 TSecr=759718428 [TCP segment of a reassembled PDU]"
"410","2018-08-23 01:52:23.640717","192.168.2.3","216.58.197.4","TLSv1.2","155","Application Data"
"413","2018-08-23 01:52:23.734189","192.168.2.3","216.58.197.4","TCP","1434","34236  >  443 [ACK] Seq=207352 Ack=6274 Win=848 Len=1368 TSval=7782586 TSecr=759718441 [TCP segment of a reassembled PDU]"
"414","2018-08-23 01:52:23.734373","192.168.2.3","216.58.197.4","TCP","1434","34236  >  443 [ACK] Seq=208720 Ack=6274 Win=848 Len=1368 TSval=7782586 TSecr=759718441 [TCP segment of a reassembled PDU]"
"415","2018-08-23 01:52:23.734375","192.168.2.3","216.58.197.4","TLSv1.2","212","Application Data"
"416","2018-08-23 01:52:23.734942","192.168.2.3","216.58.197.4","TCP","1434","34236  >  443 [ACK] Seq=210234 Ack=6274 Win=848 Len=1368 TSval=7782586 TSecr=759718441 [TCP segment of a reassembled PDU]"
"417","2018-08-23 01:52:23.734945","192.168.2.3","216.58.197.4","TLSv1.2","155","Application Data"
"421","2018-08-23 01:52:23.836898","192.168.2.3","216.58.197.4","TCP","1434","34236  >  443 [ACK] Seq=211691 Ack=6274 Win=848 Len=1368 TSval=7782597 TSecr=759718535 [TCP segment of a reassembled PDU]"
"422","2018-08-23 01:52:23.837260","192.168.2.3","216.58.197.4","TCP","1434","34236  >  443 [ACK] Seq=213059 Ack=6274 Win=848 Len=1368 TSval=7782597 TSecr=759718535 [TCP segment of a reassembled PDU]"
"423","2018-08-23 01:52:23.837262","192.168.2.3","216.58.197.4","TLSv1.2","212","Application Data"
"424","2018-08-23 01:52:23.837263","192.168.2.3","216.58.197.4","TCP","1434","34236  >  443 [ACK] Seq=214573 Ack=6274 Win=848 Len=1368 TSval=7782597 TSecr=759718535 [TCP segment of a reassembled PDU]"
"425","2018-08-23 01:52:23.837264","192.168.2.3","216.58.197.4","TLSv1.2","155","Application Data"
"433","2018-08-23 01:52:23.902903","192.168.2.3","216.58.197.4","TCP","66","34236  >  443 [ACK] Seq=216030 Ack=6700 Win=848 Len=0 TSval=7782603 TSecr=759718680"
"434","2018-08-23 01:52:23.934482","192.168.2.3","216.58.197.4","TCP","66","34236  >  443 [ACK] Seq=216030 Ack=6822 Win=848 Len=0 TSval=7782607 TSecr=759718695"
"435","2018-08-23 01:52:23.961268","192.168.2.3","216.58.197.4","TCP","1434","34236  >  443 [ACK] Seq=216030 Ack=6822 Win=848 Len=1368 TSval=7782609 TSecr=759718695 [TCP segment of a reassembled PDU]"
"436","2018-08-23 01:52:23.964713","192.168.2.3","216.58.197.4","TCP","1434","34236  >  443 [ACK] Seq=217398 Ack=6822 Win=848 Len=1368 TSval=7782609 TSecr=759718695 [TCP segment of a reassembled PDU]"
"437","2018-08-23 01:52:23.964716","192.168.2.3","216.58.197.4","TLSv1.2","212","Application Data"
"438","2018-08-23 01:52:23.964717","192.168.2.3","216.58.197.4","TCP","1434","34236  >  443 [ACK] Seq=218912 Ack=6822 Win=848 Len=1368 TSval=7782609 TSecr=759718695 [TCP segment of a reassembled PDU]"
"439","2018-08-23 01:52:23.964718","192.168.2.3","216.58.197.4","TLSv1.2","155","Application Data"
"443","2018-08-23 01:52:24.058887","192.168.2.3","216.58.197.4","TCP","1434","34236  >  443 [ACK] Seq=220369 Ack=6822 Win=848 Len=1368 TSval=7782619 TSecr=759718765 [TCP segment of a reassembled PDU]"
"444","2018-08-23 01:52:24.058893","192.168.2.3","216.58.197.4","TCP","1434","34236  >  443 [ACK] Seq=221737 Ack=6822 Win=848 Len=1368 TSval=7782619 TSecr=759718765 [TCP segment of a reassembled PDU]"
"445","2018-08-23 01:52:24.058894","192.168.2.3","216.58.197.4","TLSv1.2","212","Application Data"
"446","2018-08-23 01:52:24.059230","192.168.2.3","216.58.197.4","TCP","1434","34236  >  443 [ACK] Seq=223251 Ack=6822 Win=848 Len=1368 TSval=7782619 TSecr=759718765 [TCP segment of a reassembled PDU]"
"447","2018-08-23 01:52:24.059234","192.168.2.3","216.58.197.4","TLSv1.2","155","Application Data"
"453","2018-08-23 01:52:24.109711","192.168.2.3","216.58.197.4","TCP","66","34236  >  443 [ACK] Seq=224708 Ack=7052 Win=845 Len=0 TSval=7782624 TSecr=759718903"
"454","2018-08-23 01:52:24.109916","192.168.2.3","216.58.197.4","TCP","66","34236  >  443 [ACK] Seq=224708 Ack=7221 Win=844 Len=0 TSval=7782624 TSecr=759718903"
"455","2018-08-23 01:52:24.136147","192.168.2.3","216.58.197.4","TCP","1434","34236  >  443 [ACK] Seq=224708 Ack=7221 Win=848 Len=1368 TSval=7782627 TSecr=759718903 [TCP segment of a reassembled PDU]"
"456","2018-08-23 01:52:24.137414","192.168.2.3","216.58.197.4","TCP","1434","34236  >  443 [ACK] Seq=226076 Ack=7221 Win=848 Len=1368 TSval=7782627 TSecr=759718903 [TCP segment of a reassembled PDU]"
"457","2018-08-23 01:52:24.137419","192.168.2.3","216.58.197.4","TLSv1.2","212","Application Data"
"458","2018-08-23 01:52:24.137796","192.168.2.3","216.58.197.4","TLSv1.2","1256","Application Data"
"459","2018-08-23 01:52:24.137800","192.168.2.3","216.58.197.4","TLSv1.2","102","Application Data"
"466","2018-08-23 01:52:24.254995","192.168.2.3","216.58.197.4","TCP","66","34236  >  443 [ACK] Seq=228816 Ack=7918 Win=848 Len=0 TSval=7782639 TSecr=759719045"
"468","2018-08-23 01:52:24.504415","192.168.2.3","216.58.197.4","TCP","66","34236  >  443 [ACK] Seq=228816 Ack=8074 Win=848 Len=0 TSval=7782664 TSecr=759719265"
"470","2018-08-23 01:52:24.510441","192.168.2.3","216.58.197.4","TCP","66","34236  >  443 [ACK] Seq=228816 Ack=9398 Win=848 Len=0 TSval=7782664 TSecr=759719303"
"483","2018-08-23 01:52:24.647351","192.168.2.3","216.58.197.4","TCP","66","34236  >  443 [ACK] Seq=228816 Ack=11345 Win=848 Len=0 TSval=7782678 TSecr=759719440"
"484","2018-08-23 01:52:24.647355","192.168.2.3","216.58.197.4","TCP","66","34236  >  443 [ACK] Seq=228816 Ack=13082 Win=848 Len=0 TSval=7782678 TSecr=759719441"
"485","2018-08-23 01:52:24.648064","192.168.2.3","216.58.197.4","TCP","66","34236  >  443 [ACK] Seq=228816 Ack=16709 Win=848 Len=0 TSval=7782678 TSecr=759719441"
"486","2018-08-23 01:52:24.648067","192.168.2.3","216.58.197.4","TCP","66","34236  >  443 [ACK] Seq=228816 Ack=18572 Win=848 Len=0 TSval=7782678 TSecr=759719441"
"487","2018-08-23 01:52:24.648512","192.168.2.3","216.58.197.4","TCP","66","34236  >  443 [ACK] Seq=228816 Ack=20260 Win=848 Len=0 TSval=7782678 TSecr=759719442"
"501","2018-08-23 01:52:24.684397","192.168.2.3","216.58.197.4","TCP","66","34236  >  443 [ACK] Seq=228816 Ack=22138 Win=848 Len=0 TSval=7782681 TSecr=759719474"
"508","2018-08-23 01:52:24.687237","192.168.2.3","216.58.197.4","TCP","66","34236  >  443 [ACK] Seq=228816 Ack=25431 Win=848 Len=0 TSval=7782682 TSecr=759719476"
"509","2018-08-23 01:52:24.687240","192.168.2.3","216.58.197.4","TCP","66","34236  >  443 [ACK] Seq=228816 Ack=27431 Win=848 Len=0 TSval=7782682 TSecr=759719476"
"512","2018-08-23 01:52:24.688597","192.168.2.3","216.58.197.4","TCP","66","34236  >  443 [ACK] Seq=228816 Ack=30919 Win=848 Len=0 TSval=7782682 TSecr=759719477"
"515","2018-08-23 01:52:24.689425","192.168.2.3","216.58.197.4","TCP","66","34236  >  443 [ACK] Seq=228816 Ack=36465 Win=848 Len=0 TSval=7782682 TSecr=759719479"
"516","2018-08-23 01:52:24.689428","192.168.2.3","216.58.197.4","TCP","66","34236  >  443 [ACK] Seq=228816 Ack=38351 Win=848 Len=0 TSval=7782682 TSecr=759719482"
"517","2018-08-23 01:52:24.690149","192.168.2.3","216.58.197.4","TCP","66","34236  >  443 [ACK] Seq=228816 Ack=40195 Win=848 Len=0 TSval=7782682 TSecr=759719484"
"525","2018-08-23 01:52:24.690685","192.168.2.3","216.58.197.4","TCP","66","34236  >  443 [ACK] Seq=228816 Ack=42024 Win=848 Len=0 TSval=7782682 TSecr=759719484"
"526","2018-08-23 01:52:24.692194","192.168.2.3","216.58.197.4","TCP","66","34236  >  443 [ACK] Seq=228816 Ack=43738 Win=848 Len=0 TSval=7782682 TSecr=759719485"
"527","2018-08-23 01:52:24.692445","192.168.2.3","216.58.197.4","TCP","66","34236  >  443 [ACK] Seq=228816 Ack=43947 Win=892 Len=0 TSval=7782682 TSecr=759719486"
"528","2018-08-23 01:52:24.692664","192.168.2.3","216.58.197.4","TCP","66","34236  >  443 [ACK] Seq=228816 Ack=44015 Win=892 Len=0 TSval=7782682 TSecr=759719486"
"529","2018-08-23 01:52:24.710977","192.168.2.3","216.58.197.4","TLSv1.2","104","Application Data"
"532","2018-08-23 01:52:26.858596","192.168.2.3","216.58.197.14","TCP","66","41146  >  443 [ACK] Seq=1 Ack=1 Win=279 Len=0 TSval=7782899 TSecr=1819610690"
"534","2018-08-23 01:52:32.164195","192.168.2.3","216.58.197.14","TLSv1.2","155","Application Data"
"535","2018-08-23 01:52:32.164200","192.168.2.3","216.58.197.14","TLSv1.2","104","Application Data"
"536","2018-08-23 01:52:32.164200","192.168.2.3","216.58.197.14","TLSv1.2","580","Application Data"
"541","2018-08-23 01:52:32.204560","192.168.2.3","216.58.197.14","TCP","66","41142  >  443 [ACK] Seq=642 Ack=39 Win=430 Len=0 TSval=7783434 TSecr=932735698"
"546","2018-08-23 01:52:32.246894","192.168.2.3","216.58.197.14","TCP","66","41142  >  443 [ACK] Seq=642 Ack=107 Win=430 Len=0 TSval=7783438 TSecr=932735775"
"547","2018-08-23 01:52:32.246897","192.168.2.3","216.58.197.14","TCP","66","41142  >  443 [ACK] Seq=642 Ack=259 Win=446 Len=0 TSval=7783438 TSecr=932735775"
"548","2018-08-23 01:52:32.247849","192.168.2.3","216.58.197.14","TCP","66","41142  >  443 [ACK] Seq=642 Ack=417 Win=446 Len=0 TSval=7783438 TSecr=932735775"
"549","2018-08-23 01:52:32.248396","192.168.2.3","216.58.197.14","TLSv1.2","104","Application Data"
