"No.","Time","Source","Destination","Protocol","Length","Info"
"1","2018-08-23 01:50:05.577680","192.168.2.3","74.125.204.188","TCP","92","33038  >  5228 [PSH, ACK] Seq=1 Ack=1 Win=406 Len=26 TSval=7768770 TSecr=3813299235"
"3","2018-08-23 01:50:05.621905","192.168.2.3","74.125.204.188","TCP","66","33038  >  5228 [ACK] Seq=27 Ack=27 Win=406 Len=0 TSval=7768775 TSecr=3813329030"
"4","2018-08-23 01:50:07.665180","192.168.2.3","216.58.197.4","TLSv1.2","156","Application Data"
"5","2018-08-23 01:50:07.665186","192.168.2.3","216.58.197.4","TLSv1.2","104","Application Data"
"6","2018-08-23 01:50:07.665187","192.168.2.3","216.58.197.4","TLSv1.2","158","Application Data"
"11","2018-08-23 01:50:07.675725","192.168.2.3","216.58.197.4","TCP","1434","34236  >  443 [ACK] Seq=221 Ack=39 Win=661 Len=1368 TSval=7768981 TSecr=759582467 [TCP segment of a reassembled PDU]"
"12","2018-08-23 01:50:07.676042","192.168.2.3","216.58.197.4","TCP","1434","34236  >  443 [ACK] Seq=1589 Ack=39 Win=661 Len=1368 TSval=7768981 TSecr=759582467 [TCP segment of a reassembled PDU]"
"13","2018-08-23 01:50:07.676048","192.168.2.3","216.58.197.4","TLSv1.2","212","Application Data"
"14","2018-08-23 01:50:07.676493","192.168.2.3","216.58.197.4","TCP","1434","34236  >  443 [ACK] Seq=3103 Ack=39 Win=661 Len=1368 TSval=7768981 TSecr=759582467 [TCP segment of a reassembled PDU]"
"15","2018-08-23 01:50:07.676496","192.168.2.3","216.58.197.4","TLSv1.2","183","Application Data"
"16","2018-08-23 01:50:07.676991","192.168.2.3","216.58.197.4","TCP","1434","34236  >  443 [ACK] Seq=4588 Ack=39 Win=661 Len=1368 TSval=7768981 TSecr=759582467 [TCP segment of a reassembled PDU]"
"17","2018-08-23 01:50:07.676995","192.168.2.3","216.58.197.4","TCP","1434","34236  >  443 [ACK] Seq=5956 Ack=39 Win=661 Len=1368 TSval=7768981 TSecr=759582467 [TCP segment of a reassembled PDU]"
"18","2018-08-23 01:50:07.676996","192.168.2.3","216.58.197.4","TLSv1.2","212","Application Data"
"19","2018-08-23 01:50:07.677387","192.168.2.3","216.58.197.4","TCP","1434","34236  >  443 [ACK] Seq=7470 Ack=39 Win=661 Len=1368 TSval=7768981 TSecr=759582467 [TCP segment of a reassembled PDU]"
"20","2018-08-23 01:50:07.677390","192.168.2.3","216.58.197.4","TCP","1434","34236  >  443 [ACK] Seq=8838 Ack=39 Win=661 Len=1368 TSval=7768981 TSecr=759582467 [TCP segment of a reassembled PDU]"
"26","2018-08-23 01:50:07.681809","192.168.2.3","216.58.197.4","TLSv1.2","1434","Application Data [TCP segment of a reassembled PDU]"
"27","2018-08-23 01:50:07.682023","192.168.2.3","216.58.197.4","TCP","1434","34236  >  443 [ACK] Seq=11574 Ack=39 Win=661 Len=1368 TSval=7768981 TSecr=759582476 [TCP segment of a reassembled PDU]"
"28","2018-08-23 01:50:07.682221","192.168.2.3","216.58.197.4","TLSv1.2","1434","Application Data [TCP segment of a reassembled PDU]"
"29","2018-08-23 01:50:07.683011","192.168.2.3","216.58.197.4","TCP","1434","34236  >  443 [ACK] Seq=14310 Ack=39 Win=661 Len=1368 TSval=7768981 TSecr=759582476 [TCP segment of a reassembled PDU]"
"30","2018-08-23 01:50:07.683014","192.168.2.3","216.58.197.4","TLSv1.2","1434","Application Data [TCP segment of a reassembled PDU]"
"31","2018-08-23 01:50:07.683356","192.168.2.3","216.58.197.4","TLSv1.2","1434","Application Data [TCP segment of a reassembled PDU]"
"32","2018-08-23 01:50:07.685692","192.168.2.3","216.58.197.4","TCP","1434","34236  >  443 [ACK] Seq=18414 Ack=39 Win=661 Len=1368 TSval=7768982 TSecr=759582477 [TCP segment of a reassembled PDU]"
"33","2018-08-23 01:50:07.685956","192.168.2.3","216.58.197.4","TLSv1.2","1434","Application Data [TCP segment of a reassembled PDU]"
"34","2018-08-23 01:50:07.685959","192.168.2.3","216.58.197.4","TLSv1.2","1434","Application Data [TCP segment of a reassembled PDU]"
"36","2018-08-23 01:50:07.686227","192.168.2.3","216.58.197.4","TCP","1434","34236  >  443 [ACK] Seq=22518 Ack=39 Win=661 Len=1368 TSval=7768982 TSecr=759582477 [TCP segment of a reassembled PDU]"
"37","2018-08-23 01:50:07.686229","192.168.2.3","216.58.197.4","TLSv1.2","1434","Application Data [TCP segment of a reassembled PDU]"
"38","2018-08-23 01:50:07.686492","192.168.2.3","216.58.197.4","TCP","1434","34236  >  443 [ACK] Seq=25254 Ack=39 Win=661 Len=1368 TSval=7768982 TSecr=759582477 [TCP segment of a reassembled PDU]"
"39","2018-08-23 01:50:07.687146","192.168.2.3","216.58.197.4","TLSv1.2","1434","Application Data [TCP segment of a reassembled PDU]"
"40","2018-08-23 01:50:07.687149","192.168.2.3","216.58.197.4","TCP","1434","34236  >  443 [ACK] Seq=27990 Ack=39 Win=661 Len=1368 TSval=7768982 TSecr=759582477 [TCP segment of a reassembled PDU]"
"42","2018-08-23 01:50:07.687547","192.168.2.3","216.58.197.4","TLSv1.2","1434","Application Data [TCP segment of a reassembled PDU]"
"44","2018-08-23 01:50:07.688543","192.168.2.3","216.58.197.4","TCP","1434","34236  >  443 [ACK] Seq=30726 Ack=39 Win=661 Len=1368 TSval=7768982 TSecr=759582482 [TCP segment of a reassembled PDU]"
"45","2018-08-23 01:50:07.688546","192.168.2.3","216.58.197.4","TLSv1.2","1434","Application Data [TCP segment of a reassembled PDU]"
"46","2018-08-23 01:50:07.688908","192.168.2.3","216.58.197.4","TCP","1434","34236  >  443 [ACK] Seq=33462 Ack=39 Win=661 Len=1368 TSval=7768982 TSecr=759582482 [TCP segment of a reassembled PDU]"
"53","2018-08-23 01:50:07.695712","192.168.2.3","216.58.197.4","TCP","1434","34236  >  443 [ACK] Seq=34830 Ack=39 Win=661 Len=1368 TSval=7768982 TSecr=759582483 [TCP segment of a reassembled PDU]"
"54","2018-08-23 01:50:07.695904","192.168.2.3","216.58.197.4","TLSv1.2","1434","Application Data [TCP segment of a reassembled PDU]"
"55","2018-08-23 01:50:07.696136","192.168.2.3","216.58.197.4","TLSv1.2","1434","Application Data [TCP segment of a reassembled PDU]"
"56","2018-08-23 01:50:07.696139","192.168.2.3","216.58.197.4","TCP","1434","34236  >  443 [PSH, ACK] Seq=38934 Ack=39 Win=661 Len=1368 TSval=7768982 TSecr=759582483 [TCP segment of a reassembled PDU]"
"57","2018-08-23 01:50:07.696247","192.168.2.3","216.58.197.4","TLSv1.2","1434","Application Data [TCP segment of a reassembled PDU]"
"58","2018-08-23 01:50:07.696424","192.168.2.3","216.58.197.4","TCP","1434","34236  >  443 [ACK] Seq=41670 Ack=39 Win=661 Len=1368 TSval=7768982 TSecr=759582483 [TCP segment of a reassembled PDU]"
"59","2018-08-23 01:50:07.697551","192.168.2.3","216.58.197.4","TLSv1.2","1434","Application Data [TCP segment of a reassembled PDU]"
"60","2018-08-23 01:50:07.697913","192.168.2.3","216.58.197.4","TCP","1434","34236  >  443 [ACK] Seq=44406 Ack=39 Win=661 Len=1368 TSval=7768983 TSecr=759582486 [TCP segment of a reassembled PDU]"
"61","2018-08-23 01:50:07.697915","192.168.2.3","216.58.197.4","TLSv1.2","1434","Application Data [TCP segment of a reassembled PDU]"
"62","2018-08-23 01:50:07.698052","192.168.2.3","216.58.197.4","TCP","1434","34236  >  443 [ACK] Seq=47142 Ack=39 Win=661 Len=1368 TSval=7768983 TSecr=759582486 [TCP segment of a reassembled PDU]"
"63","2018-08-23 01:50:07.698324","192.168.2.3","216.58.197.4","TCP","1434","34236  >  443 [ACK] Seq=48510 Ack=39 Win=661 Len=1368 TSval=7768983 TSecr=759582486 [TCP segment of a reassembled PDU]"
"64","2018-08-23 01:50:07.698623","192.168.2.3","216.58.197.4","TLSv1.2","1434","Application Data [TCP segment of a reassembled PDU]"
"65","2018-08-23 01:50:07.698626","192.168.2.3","216.58.197.4","TCP","1434","34236  >  443 [ACK] Seq=51246 Ack=39 Win=661 Len=1368 TSval=7768983 TSecr=759582486 [TCP segment of a reassembled PDU]"
"66","2018-08-23 01:50:07.698904","192.168.2.3","216.58.197.4","TLSv1.2","1434","Application Data [TCP segment of a reassembled PDU]"
"67","2018-08-23 01:50:07.698906","192.168.2.3","216.58.197.4","TLSv1.2","1434","Application Data [TCP segment of a reassembled PDU]"
"68","2018-08-23 01:50:07.699136","192.168.2.3","216.58.197.4","TCP","1434","34236  >  443 [PSH, ACK] Seq=55350 Ack=39 Win=661 Len=1368 TSval=7768983 TSecr=759582487 [TCP segment of a reassembled PDU]"
"74","2018-08-23 01:50:07.702566","192.168.2.3","216.58.197.4","TCP","1058","34236  >  443 [PSH, ACK] Seq=56718 Ack=39 Win=661 Len=992 TSval=7768983 TSecr=759582488 [TCP segment of a reassembled PDU]"
"75","2018-08-23 01:50:07.702568","192.168.2.3","216.58.197.4","TLSv1.2","1434","Application Data [TCP segment of a reassembled PDU]"
"76","2018-08-23 01:50:07.702822","192.168.2.3","216.58.197.4","TCP","1434","34236  >  443 [ACK] Seq=59078 Ack=39 Win=661 Len=1368 TSval=7768983 TSecr=759582488 [TCP segment of a reassembled PDU]"
"77","2018-08-23 01:50:07.702825","192.168.2.3","216.58.197.4","TLSv1.2","396","Application Data"
"83","2018-08-23 01:50:07.727162","192.168.2.3","216.58.197.4","TCP","1434","34236  >  443 [ACK] Seq=60776 Ack=39 Win=661 Len=1368 TSval=7768986 TSecr=759582503 [TCP segment of a reassembled PDU]"
"84","2018-08-23 01:50:07.727955","192.168.2.3","216.58.197.4","TCP","1434","34236  >  443 [ACK] Seq=62144 Ack=39 Win=661 Len=1368 TSval=7768986 TSecr=759582503 [TCP segment of a reassembled PDU]"
"85","2018-08-23 01:50:07.727959","192.168.2.3","216.58.197.4","TLSv1.2","212","Application Data"
"86","2018-08-23 01:50:07.727960","192.168.2.3","216.58.197.4","TCP","1434","34236  >  443 [ACK] Seq=63658 Ack=39 Win=661 Len=1368 TSval=7768986 TSecr=759582503 [TCP segment of a reassembled PDU]"
"87","2018-08-23 01:50:07.728194","192.168.2.3","216.58.197.4","TLSv1.2","155","Application Data"
"91","2018-08-23 01:50:07.823116","192.168.2.3","216.58.197.4","TCP","1434","34236  >  443 [ACK] Seq=65115 Ack=39 Win=661 Len=1368 TSval=7768995 TSecr=759582568 [TCP segment of a reassembled PDU]"
"92","2018-08-23 01:50:07.823417","192.168.2.3","216.58.197.4","TCP","1434","34236  >  443 [ACK] Seq=66483 Ack=39 Win=661 Len=1368 TSval=7768995 TSecr=759582568 [TCP segment of a reassembled PDU]"
"93","2018-08-23 01:50:07.823433","192.168.2.3","216.58.197.4","TLSv1.2","212","Application Data"
"94","2018-08-23 01:50:07.823619","192.168.2.3","216.58.197.4","TCP","1434","34236  >  443 [ACK] Seq=67997 Ack=39 Win=661 Len=1368 TSval=7768996 TSecr=759582568 [TCP segment of a reassembled PDU]"
"95","2018-08-23 01:50:07.823622","192.168.2.3","216.58.197.4","TLSv1.2","155","Application Data"
"99","2018-08-23 01:50:07.921695","192.168.2.3","216.58.197.4","TCP","1434","34236  >  443 [ACK] Seq=69454 Ack=39 Win=661 Len=1368 TSval=7769005 TSecr=759582623 [TCP segment of a reassembled PDU]"
"100","2018-08-23 01:50:07.921700","192.168.2.3","216.58.197.4","TCP","1434","34236  >  443 [ACK] Seq=70822 Ack=39 Win=661 Len=1368 TSval=7769005 TSecr=759582623 [TCP segment of a reassembled PDU]"
"101","2018-08-23 01:50:07.921701","192.168.2.3","216.58.197.4","TLSv1.2","212","Application Data"
"102","2018-08-23 01:50:07.922042","192.168.2.3","216.58.197.4","TCP","1434","34236  >  443 [ACK] Seq=72336 Ack=39 Win=661 Len=1368 TSval=7769005 TSecr=759582623 [TCP segment of a reassembled PDU]"
"103","2018-08-23 01:50:07.922048","192.168.2.3","216.58.197.4","TLSv1.2","155","Application Data"
"110","2018-08-23 01:50:07.981637","192.168.2.3","216.58.197.4","TCP","66","34236  >  443 [ACK] Seq=73793 Ack=477 Win=705 Len=0 TSval=7769011 TSecr=759582772"
"112","2018-08-23 01:50:08.022996","192.168.2.3","216.58.197.4","TCP","66","34236  >  443 [ACK] Seq=73793 Ack=742 Win=715 Len=0 TSval=7769016 TSecr=759582786"
"113","2018-08-23 01:50:08.028075","192.168.2.3","216.58.197.4","TCP","1434","34236  >  443 [ACK] Seq=73793 Ack=742 Win=715 Len=1368 TSval=7769016 TSecr=759582786 [TCP segment of a reassembled PDU]"
"114","2018-08-23 01:50:08.028427","192.168.2.3","216.58.197.4","TCP","1434","34236  >  443 [ACK] Seq=75161 Ack=742 Win=715 Len=1368 TSval=7769016 TSecr=759582786 [TCP segment of a reassembled PDU]"
"115","2018-08-23 01:50:08.028431","192.168.2.3","216.58.197.4","TLSv1.2","212","Application Data"
"116","2018-08-23 01:50:08.028794","192.168.2.3","216.58.197.4","TCP","1434","34236  >  443 [ACK] Seq=76675 Ack=742 Win=715 Len=1368 TSval=7769016 TSecr=759582786 [TCP segment of a reassembled PDU]"
"117","2018-08-23 01:50:08.028798","192.168.2.3","216.58.197.4","TLSv1.2","139","Application Data"
"122","2018-08-23 01:50:08.088980","192.168.2.3","216.58.197.4","TCP","66","34236  >  443 [ACK] Seq=78116 Ack=900 Win=713 Len=0 TSval=7769022 TSecr=759582883"
"123","2018-08-23 01:50:08.144717","192.168.2.3","216.58.197.4","TCP","1434","34236  >  443 [ACK] Seq=78116 Ack=900 Win=715 Len=1368 TSval=7769027 TSecr=759582883 [TCP segment of a reassembled PDU]"
"124","2018-08-23 01:50:08.144890","192.168.2.3","216.58.197.4","TCP","1434","34236  >  443 [ACK] Seq=79484 Ack=900 Win=715 Len=1368 TSval=7769027 TSecr=759582883 [TCP segment of a reassembled PDU]"
"125","2018-08-23 01:50:08.144892","192.168.2.3","216.58.197.4","TLSv1.2","212","Application Data"
"126","2018-08-23 01:50:08.145179","192.168.2.3","216.58.197.4","TCP","1434","34236  >  443 [ACK] Seq=80998 Ack=900 Win=715 Len=1368 TSval=7769027 TSecr=759582883 [TCP segment of a reassembled PDU]"
"127","2018-08-23 01:50:08.145181","192.168.2.3","216.58.197.4","TLSv1.2","155","Application Data"
"132","2018-08-23 01:50:08.235825","192.168.2.3","216.58.197.4","TCP","66","34236  >  443 [ACK] Seq=82455 Ack=1195 Win=711 Len=0 TSval=7769037 TSecr=759583030"
"133","2018-08-23 01:50:08.240246","192.168.2.3","216.58.197.4","TCP","1434","34236  >  443 [ACK] Seq=82455 Ack=1195 Win=715 Len=1368 TSval=7769037 TSecr=759583030 [TCP segment of a reassembled PDU]"
"134","2018-08-23 01:50:08.240664","192.168.2.3","216.58.197.4","TCP","1434","34236  >  443 [ACK] Seq=83823 Ack=1195 Win=715 Len=1368 TSval=7769037 TSecr=759583030 [TCP segment of a reassembled PDU]"
"135","2018-08-23 01:50:08.240666","192.168.2.3","216.58.197.4","TLSv1.2","212","Application Data"
"136","2018-08-23 01:50:08.240667","192.168.2.3","216.58.197.4","TCP","1434","34236  >  443 [ACK] Seq=85337 Ack=1195 Win=715 Len=1368 TSval=7769037 TSecr=759583030 [TCP segment of a reassembled PDU]"
"137","2018-08-23 01:50:08.240899","192.168.2.3","216.58.197.4","TLSv1.2","155","Application Data"
"141","2018-08-23 01:50:08.335231","192.168.2.3","216.58.197.4","TCP","1434","34236  >  443 [ACK] Seq=86794 Ack=1195 Win=715 Len=1368 TSval=7769047 TSecr=759583040 [TCP segment of a reassembled PDU]"
"142","2018-08-23 01:50:08.335619","192.168.2.3","216.58.197.4","TCP","1434","34236  >  443 [ACK] Seq=88162 Ack=1195 Win=715 Len=1368 TSval=7769047 TSecr=759583040 [TCP segment of a reassembled PDU]"
"143","2018-08-23 01:50:08.335622","192.168.2.3","216.58.197.4","TLSv1.2","212","Application Data"
"144","2018-08-23 01:50:08.336628","192.168.2.3","216.58.197.4","TCP","1434","34236  >  443 [ACK] Seq=89676 Ack=1195 Win=715 Len=1368 TSval=7769047 TSecr=759583040 [TCP segment of a reassembled PDU]"
"145","2018-08-23 01:50:08.336631","192.168.2.3","216.58.197.4","TLSv1.2","155","Application Data"
"149","2018-08-23 01:50:08.431158","192.168.2.3","216.58.197.4","TCP","1434","34236  >  443 [ACK] Seq=91133 Ack=1195 Win=715 Len=1368 TSval=7769056 TSecr=759583136 [TCP segment of a reassembled PDU]"
"150","2018-08-23 01:50:08.431423","192.168.2.3","216.58.197.4","TCP","1434","34236  >  443 [ACK] Seq=92501 Ack=1195 Win=715 Len=1368 TSval=7769056 TSecr=759583136 [TCP segment of a reassembled PDU]"
"151","2018-08-23 01:50:08.431426","192.168.2.3","216.58.197.4","TLSv1.2","212","Application Data"
"152","2018-08-23 01:50:08.431881","192.168.2.3","216.58.197.4","TCP","1434","34236  >  443 [ACK] Seq=94015 Ack=1195 Win=715 Len=1368 TSval=7769056 TSecr=759583136 [TCP segment of a reassembled PDU]"
"153","2018-08-23 01:50:08.431884","192.168.2.3","216.58.197.4","TLSv1.2","155","Application Data"
"157","2018-08-23 01:50:08.530244","192.168.2.3","216.58.197.4","TCP","1434","34236  >  443 [ACK] Seq=95472 Ack=1195 Win=715 Len=1368 TSval=7769066 TSecr=759583232 [TCP segment of a reassembled PDU]"
"158","2018-08-23 01:50:08.530368","192.168.2.3","216.58.197.4","TCP","1434","34236  >  443 [ACK] Seq=96840 Ack=1195 Win=715 Len=1368 TSval=7769066 TSecr=759583232 [TCP segment of a reassembled PDU]"
"159","2018-08-23 01:50:08.530370","192.168.2.3","216.58.197.4","TLSv1.2","212","Application Data"
"160","2018-08-23 01:50:08.530624","192.168.2.3","216.58.197.4","TCP","1434","34236  >  443 [ACK] Seq=98354 Ack=1195 Win=715 Len=1368 TSval=7769066 TSecr=759583232 [TCP segment of a reassembled PDU]"
"161","2018-08-23 01:50:08.530627","192.168.2.3","216.58.197.4","TLSv1.2","155","Application Data"
"164","2018-08-23 01:50:08.623892","192.168.2.3","216.58.197.4","TCP","1434","34236  >  443 [ACK] Seq=99811 Ack=1195 Win=715 Len=1368 TSval=7769075 TSecr=759583330 [TCP segment of a reassembled PDU]"
"165","2018-08-23 01:50:08.623897","192.168.2.3","216.58.197.4","TCP","1434","34236  >  443 [ACK] Seq=101179 Ack=1195 Win=715 Len=1368 TSval=7769075 TSecr=759583330 [TCP segment of a reassembled PDU]"
"166","2018-08-23 01:50:08.623898","192.168.2.3","216.58.197.4","TLSv1.2","212","Application Data"
"167","2018-08-23 01:50:08.624160","192.168.2.3","216.58.197.4","TCP","1434","34236  >  443 [ACK] Seq=102693 Ack=1195 Win=715 Len=1368 TSval=7769075 TSecr=759583330 [TCP segment of a reassembled PDU]"
"168","2018-08-23 01:50:08.624179","192.168.2.3","216.58.197.4","TLSv1.2","155","Application Data"
"172","2018-08-23 01:50:08.700165","192.168.2.3","216.58.197.4","TCP","1434","34236  >  443 [ACK] Seq=104150 Ack=1195 Win=715 Len=1368 TSval=7769083 TSecr=759583424 [TCP segment of a reassembled PDU]"
"173","2018-08-23 01:50:08.700358","192.168.2.3","216.58.197.4","TCP","1434","34236  >  443 [ACK] Seq=105518 Ack=1195 Win=715 Len=1368 TSval=7769083 TSecr=759583424 [TCP segment of a reassembled PDU]"
"174","2018-08-23 01:50:08.700360","192.168.2.3","216.58.197.4","TLSv1.2","212","Application Data"
"175","2018-08-23 01:50:08.700600","192.168.2.3","216.58.197.4","TCP","1434","34236  >  443 [ACK] Seq=107032 Ack=1195 Win=715 Len=1368 TSval=7769083 TSecr=759583424 [TCP segment of a reassembled PDU]"
"176","2018-08-23 01:50:08.700603","192.168.2.3","216.58.197.4","TLSv1.2","155","Application Data"
"181","2018-08-23 01:50:08.743223","192.168.2.3","216.58.197.4","TCP","66","34236  >  443 [ACK] Seq=108489 Ack=1229 Win=715 Len=0 TSval=7769088 TSecr=759583500"
"182","2018-08-23 01:50:08.812510","192.168.2.3","216.58.197.4","TCP","1434","34236  >  443 [ACK] Seq=108489 Ack=1229 Win=715 Len=1368 TSval=7769094 TSecr=759583500 [TCP segment of a reassembled PDU]"
"183","2018-08-23 01:50:08.813376","192.168.2.3","216.58.197.4","TCP","1434","34236  >  443 [ACK] Seq=109857 Ack=1229 Win=715 Len=1368 TSval=7769094 TSecr=759583500 [TCP segment of a reassembled PDU]"
"184","2018-08-23 01:50:08.813380","192.168.2.3","216.58.197.4","TLSv1.2","212","Application Data"
"185","2018-08-23 01:50:08.813585","192.168.2.3","216.58.197.4","TCP","1434","34236  >  443 [ACK] Seq=111371 Ack=1229 Win=715 Len=1368 TSval=7769094 TSecr=759583500 [TCP segment of a reassembled PDU]"
"186","2018-08-23 01:50:08.813587","192.168.2.3","216.58.197.4","TLSv1.2","155","Application Data"
"190","2018-08-23 01:50:08.891256","192.168.2.3","216.58.197.4","TCP","1434","34236  >  443 [ACK] Seq=112828 Ack=1229 Win=715 Len=1368 TSval=7769102 TSecr=759583653 [TCP segment of a reassembled PDU]"
"191","2018-08-23 01:50:08.891535","192.168.2.3","216.58.197.4","TCP","1434","34236  >  443 [ACK] Seq=114196 Ack=1229 Win=715 Len=1368 TSval=7769102 TSecr=759583653 [TCP segment of a reassembled PDU]"
"192","2018-08-23 01:50:08.891552","192.168.2.3","216.58.197.4","TLSv1.2","212","Application Data"
"193","2018-08-23 01:50:08.891880","192.168.2.3","216.58.197.4","TCP","1434","34236  >  443 [ACK] Seq=115710 Ack=1229 Win=715 Len=1368 TSval=7769102 TSecr=759583653 [TCP segment of a reassembled PDU]"
"194","2018-08-23 01:50:08.891882","192.168.2.3","216.58.197.4","TLSv1.2","155","Application Data"
"200","2018-08-23 01:50:08.941181","192.168.2.3","216.58.197.4","TCP","66","34236  >  443 [ACK] Seq=117167 Ack=1341 Win=714 Len=0 TSval=7769107 TSecr=759583735"
"201","2018-08-23 01:50:08.941199","192.168.2.3","216.58.197.4","TCP","66","34236  >  443 [ACK] Seq=117167 Ack=1405 Win=713 Len=0 TSval=7769107 TSecr=759583735"
"203","2018-08-23 01:50:08.978285","192.168.2.3","216.58.197.4","TCP","66","34236  >  443 [ACK] Seq=117167 Ack=1526 Win=712 Len=0 TSval=7769111 TSecr=759583772"
"205","2018-08-23 01:50:08.994440","192.168.2.3","216.58.197.4","TCP","1434","34236  >  443 [ACK] Seq=117167 Ack=1526 Win=715 Len=1368 TSval=7769112 TSecr=759583772 [TCP segment of a reassembled PDU]"
"206","2018-08-23 01:50:08.994446","192.168.2.3","216.58.197.4","TCP","1434","34236  >  443 [ACK] Seq=118535 Ack=1526 Win=715 Len=1368 TSval=7769112 TSecr=759583772 [TCP segment of a reassembled PDU]"
"207","2018-08-23 01:50:08.994447","192.168.2.3","216.58.197.4","TLSv1.2","212","Application Data"
"208","2018-08-23 01:50:08.994747","192.168.2.3","216.58.197.4","TCP","1434","34236  >  443 [ACK] Seq=120049 Ack=1526 Win=715 Len=1368 TSval=7769112 TSecr=759583772 [TCP segment of a reassembled PDU]"
"209","2018-08-23 01:50:08.994751","192.168.2.3","216.58.197.4","TLSv1.2","155","Application Data"
"213","2018-08-23 01:50:09.033140","192.168.2.3","216.58.197.4","TCP","66","34236  >  443 [ACK] Seq=121506 Ack=1724 Win=715 Len=0 TSval=7769117 TSecr=759583786"
"216","2018-08-23 01:50:09.045431","192.168.2.3","216.58.197.4","TCP","66","34236  >  443 [ACK] Seq=121506 Ack=1956 Win=712 Len=0 TSval=7769118 TSecr=759583840"
"217","2018-08-23 01:50:09.045664","192.168.2.3","216.58.197.4","TCP","66","34236  >  443 [ACK] Seq=121506 Ack=2029 Win=711 Len=0 TSval=7769118 TSecr=759583840"
"218","2018-08-23 01:50:09.071143","192.168.2.3","216.58.197.4","TCP","1434","34236  >  443 [ACK] Seq=121506 Ack=2029 Win=715 Len=1368 TSval=7769120 TSecr=759583840 [TCP segment of a reassembled PDU]"
"219","2018-08-23 01:50:09.071628","192.168.2.3","216.58.197.4","TCP","1434","34236  >  443 [ACK] Seq=122874 Ack=2029 Win=715 Len=1368 TSval=7769120 TSecr=759583840 [TCP segment of a reassembled PDU]"
"220","2018-08-23 01:50:09.071631","192.168.2.3","216.58.197.4","TLSv1.2","212","Application Data"
"221","2018-08-23 01:50:09.071904","192.168.2.3","216.58.197.4","TCP","1434","34236  >  443 [ACK] Seq=124388 Ack=2029 Win=715 Len=1368 TSval=7769120 TSecr=759583840 [TCP segment of a reassembled PDU]"
"222","2018-08-23 01:50:09.071906","192.168.2.3","216.58.197.4","TLSv1.2","155","Application Data"
"226","2018-08-23 01:50:09.169351","192.168.2.3","216.58.197.4","TCP","1434","34236  >  443 [ACK] Seq=125845 Ack=2029 Win=715 Len=1368 TSval=7769130 TSecr=759583872 [TCP segment of a reassembled PDU]"
"227","2018-08-23 01:50:09.169357","192.168.2.3","216.58.197.4","TCP","1434","34236  >  443 [ACK] Seq=127213 Ack=2029 Win=715 Len=1368 TSval=7769130 TSecr=759583872 [TCP segment of a reassembled PDU]"
"228","2018-08-23 01:50:09.169358","192.168.2.3","216.58.197.4","TLSv1.2","212","Application Data"
"229","2018-08-23 01:50:09.169635","192.168.2.3","216.58.197.4","TCP","1434","34236  >  443 [ACK] Seq=128727 Ack=2029 Win=715 Len=1368 TSval=7769130 TSecr=759583872 [TCP segment of a reassembled PDU]"
"230","2018-08-23 01:50:09.169638","192.168.2.3","216.58.197.4","TLSv1.2","155","Application Data"
"233","2018-08-23 01:50:09.263383","192.168.2.3","216.58.197.4","TCP","1434","34236  >  443 [ACK] Seq=130184 Ack=2029 Win=715 Len=1368 TSval=7769139 TSecr=759583969 [TCP segment of a reassembled PDU]"
"234","2018-08-23 01:50:09.263738","192.168.2.3","216.58.197.4","TCP","1434","34236  >  443 [ACK] Seq=131552 Ack=2029 Win=715 Len=1368 TSval=7769140 TSecr=759583969 [TCP segment of a reassembled PDU]"
"235","2018-08-23 01:50:09.263743","192.168.2.3","216.58.197.4","TLSv1.2","212","Application Data"
"236","2018-08-23 01:50:09.263917","192.168.2.3","216.58.197.4","TCP","1434","34236  >  443 [ACK] Seq=133066 Ack=2029 Win=715 Len=1368 TSval=7769140 TSecr=759583969 [TCP segment of a reassembled PDU]"
"237","2018-08-23 01:50:09.263921","192.168.2.3","216.58.197.4","TLSv1.2","155","Application Data"
"243","2018-08-23 01:50:09.318661","192.168.2.3","216.58.197.4","TCP","66","34236  >  443 [ACK] Seq=134523 Ack=2284 Win=715 Len=0 TSval=7769145 TSecr=759584113"
"246","2018-08-23 01:50:09.327225","192.168.2.3","216.58.197.4","TCP","66","34236  >  443 [ACK] Seq=134523 Ack=2788 Win=715 Len=0 TSval=7769146 TSecr=759584121"
"247","2018-08-23 01:50:09.357841","192.168.2.3","216.58.197.4","TCP","1434","34236  >  443 [ACK] Seq=134523 Ack=2788 Win=715 Len=1368 TSval=7769149 TSecr=759584121 [TCP segment of a reassembled PDU]"
"248","2018-08-23 01:50:09.357846","192.168.2.3","216.58.197.4","TCP","1434","34236  >  443 [ACK] Seq=135891 Ack=2788 Win=715 Len=1368 TSval=7769149 TSecr=759584121 [TCP segment of a reassembled PDU]"
"249","2018-08-23 01:50:09.357963","192.168.2.3","216.58.197.4","TLSv1.2","212","Application Data"
"250","2018-08-23 01:50:09.358491","192.168.2.3","216.58.197.4","TCP","1434","34236  >  443 [ACK] Seq=137405 Ack=2788 Win=715 Len=1368 TSval=7769149 TSecr=759584121 [TCP segment of a reassembled PDU]"
"251","2018-08-23 01:50:09.358494","192.168.2.3","216.58.197.4","TLSv1.2","155","Application Data"
"255","2018-08-23 01:50:09.436158","192.168.2.3","216.58.197.4","TCP","1434","34236  >  443 [ACK] Seq=138862 Ack=2788 Win=715 Len=1368 TSval=7769157 TSecr=759584158 [TCP segment of a reassembled PDU]"
"256","2018-08-23 01:50:09.436176","192.168.2.3","216.58.197.4","TCP","1434","34236  >  443 [ACK] Seq=140230 Ack=2788 Win=715 Len=1368 TSval=7769157 TSecr=759584158 [TCP segment of a reassembled PDU]"
"257","2018-08-23 01:50:09.436274","192.168.2.3","216.58.197.4","TLSv1.2","212","Application Data"
"258","2018-08-23 01:50:09.436482","192.168.2.3","216.58.197.4","TCP","1434","34236  >  443 [ACK] Seq=141744 Ack=2788 Win=715 Len=1368 TSval=7769157 TSecr=759584158 [TCP segment of a reassembled PDU]"
"259","2018-08-23 01:50:09.436484","192.168.2.3","216.58.197.4","TLSv1.2","155","Application Data"
"265","2018-08-23 01:50:09.494600","192.168.2.3","216.58.197.4","TCP","66","34236  >  443 [ACK] Seq=143201 Ack=3151 Win=715 Len=0 TSval=7769163 TSecr=759584289"
"266","2018-08-23 01:50:09.519375","192.168.2.3","216.58.197.4","TCP","1434","34236  >  443 [ACK] Seq=143201 Ack=3151 Win=715 Len=1368 TSval=7769165 TSecr=759584289 [TCP segment of a reassembled PDU]"
"267","2018-08-23 01:50:09.519653","192.168.2.3","216.58.197.4","TCP","1434","34236  >  443 [ACK] Seq=144569 Ack=3151 Win=715 Len=1368 TSval=7769165 TSecr=759584289 [TCP segment of a reassembled PDU]"
"268","2018-08-23 01:50:09.519655","192.168.2.3","216.58.197.4","TLSv1.2","212","Application Data"
"269","2018-08-23 01:50:09.519912","192.168.2.3","216.58.197.4","TCP","1434","34236  >  443 [ACK] Seq=146083 Ack=3151 Win=715 Len=1368 TSval=7769165 TSecr=759584289 [TCP segment of a reassembled PDU]"
"270","2018-08-23 01:50:09.519915","192.168.2.3","216.58.197.4","TLSv1.2","155","Application Data"
"273","2018-08-23 01:50:09.615399","192.168.2.3","216.58.197.4","TCP","1434","34236  >  443 [ACK] Seq=147540 Ack=3151 Win=715 Len=1368 TSval=7769175 TSecr=759584320 [TCP segment of a reassembled PDU]"
"274","2018-08-23 01:50:09.615831","192.168.2.3","216.58.197.4","TCP","1434","34236  >  443 [ACK] Seq=148908 Ack=3151 Win=715 Len=1368 TSval=7769175 TSecr=759584320 [TCP segment of a reassembled PDU]"
"275","2018-08-23 01:50:09.615832","192.168.2.3","216.58.197.4","TLSv1.2","212","Application Data"
"276","2018-08-23 01:50:09.619453","192.168.2.3","216.58.197.4","TCP","1434","34236  >  443 [ACK] Seq=150422 Ack=3151 Win=715 Len=1368 TSval=7769175 TSecr=759584320 [TCP segment of a reassembled PDU]"
"277","2018-08-23 01:50:09.619456","192.168.2.3","216.58.197.4","TLSv1.2","155","Application Data"
"283","2018-08-23 01:50:09.673925","192.168.2.3","216.58.197.4","TCP","66","34236  >  443 [ACK] Seq=151879 Ack=3500 Win=715 Len=0 TSval=7769181 TSecr=759584468"
"284","2018-08-23 01:50:09.713360","192.168.2.3","216.58.197.4","TCP","1434","34236  >  443 [ACK] Seq=151879 Ack=3500 Win=715 Len=1368 TSval=7769184 TSecr=759584468 [TCP segment of a reassembled PDU]"
"285","2018-08-23 01:50:09.713565","192.168.2.3","216.58.197.4","TCP","1434","34236  >  443 [ACK] Seq=153247 Ack=3500 Win=715 Len=1368 TSval=7769184 TSecr=759584468 [TCP segment of a reassembled PDU]"
"286","2018-08-23 01:50:09.713567","192.168.2.3","216.58.197.4","TLSv1.2","212","Application Data"
"287","2018-08-23 01:50:09.713568","192.168.2.3","216.58.197.4","TCP","1434","34236  >  443 [ACK] Seq=154761 Ack=3500 Win=715 Len=1368 TSval=7769184 TSecr=759584468 [TCP segment of a reassembled PDU]"
"288","2018-08-23 01:50:09.713728","192.168.2.3","216.58.197.4","TLSv1.2","155","Application Data"
"291","2018-08-23 01:50:09.804716","192.168.2.3","216.58.197.4","TCP","1434","34236  >  443 [ACK] Seq=156218 Ack=3500 Win=715 Len=1368 TSval=7769194 TSecr=759584513 [TCP segment of a reassembled PDU]"
"292","2018-08-23 01:50:09.805002","192.168.2.3","216.58.197.4","TCP","1434","34236  >  443 [ACK] Seq=157586 Ack=3500 Win=715 Len=1368 TSval=7769194 TSecr=759584513 [TCP segment of a reassembled PDU]"
"293","2018-08-23 01:50:09.805005","192.168.2.3","216.58.197.4","TLSv1.2","212","Application Data"
"294","2018-08-23 01:50:09.805156","192.168.2.3","216.58.197.4","TCP","1434","34236  >  443 [ACK] Seq=159100 Ack=3500 Win=715 Len=1368 TSval=7769194 TSecr=759584513 [TCP segment of a reassembled PDU]"
"295","2018-08-23 01:50:09.805158","192.168.2.3","216.58.197.4","TLSv1.2","155","Application Data"
"301","2018-08-23 01:50:09.860577","192.168.2.3","216.58.197.4","TCP","66","34236  >  443 [ACK] Seq=160557 Ack=3932 Win=715 Len=0 TSval=7769199 TSecr=759584654"
"302","2018-08-23 01:50:09.900345","192.168.2.3","216.58.197.4","TCP","1434","34236  >  443 [ACK] Seq=160557 Ack=3932 Win=715 Len=1368 TSval=7769203 TSecr=759584654 [TCP segment of a reassembled PDU]"
"303","2018-08-23 01:50:09.900721","192.168.2.3","216.58.197.4","TCP","1434","34236  >  443 [ACK] Seq=161925 Ack=3932 Win=715 Len=1368 TSval=7769203 TSecr=759584654 [TCP segment of a reassembled PDU]"
"304","2018-08-23 01:50:09.900733","192.168.2.3","216.58.197.4","TLSv1.2","212","Application Data"
"305","2018-08-23 01:50:09.901153","192.168.2.3","216.58.197.4","TCP","1434","34236  >  443 [ACK] Seq=163439 Ack=3932 Win=715 Len=1368 TSval=7769203 TSecr=759584654 [TCP segment of a reassembled PDU]"
"306","2018-08-23 01:50:09.901158","192.168.2.3","216.58.197.4","TLSv1.2","155","Application Data"
"311","2018-08-23 01:50:09.977484","192.168.2.3","216.58.197.4","TCP","1434","34236  >  443 [ACK] Seq=164896 Ack=3932 Win=715 Len=1368 TSval=7769211 TSecr=759584701 [TCP segment of a reassembled PDU]"
"312","2018-08-23 01:50:09.977675","192.168.2.3","216.58.197.4","TCP","1434","34236  >  443 [ACK] Seq=166264 Ack=3932 Win=715 Len=1368 TSval=7769211 TSecr=759584701 [TCP segment of a reassembled PDU]"
"313","2018-08-23 01:50:09.977678","192.168.2.3","216.58.197.4","TLSv1.2","212","Application Data"
"314","2018-08-23 01:50:09.978188","192.168.2.3","216.58.197.4","TCP","1434","34236  >  443 [ACK] Seq=167778 Ack=3932 Win=715 Len=1368 TSval=7769211 TSecr=759584701 [TCP segment of a reassembled PDU]"
"315","2018-08-23 01:50:09.978191","192.168.2.3","216.58.197.4","TLSv1.2","155","Application Data"
"320","2018-08-23 01:50:09.991952","192.168.2.3","216.58.197.4","TCP","66","34236  >  443 [ACK] Seq=169235 Ack=4469 Win=715 Len=0 TSval=7769212 TSecr=759584772"
"321","2018-08-23 01:50:10.094269","192.168.2.3","216.58.197.4","TCP","1434","34236  >  443 [ACK] Seq=169235 Ack=4469 Win=715 Len=1368 TSval=7769223 TSecr=759584772 [TCP segment of a reassembled PDU]"
"322","2018-08-23 01:50:10.094684","192.168.2.3","216.58.197.4","TCP","1434","34236  >  443 [ACK] Seq=170603 Ack=4469 Win=715 Len=1368 TSval=7769223 TSecr=759584772 [TCP segment of a reassembled PDU]"
"323","2018-08-23 01:50:10.094688","192.168.2.3","216.58.197.4","TLSv1.2","212","Application Data"
"324","2018-08-23 01:50:10.095059","192.168.2.3","216.58.197.4","TCP","1434","34236  >  443 [ACK] Seq=172117 Ack=4469 Win=715 Len=1368 TSval=7769223 TSecr=759584772 [TCP segment of a reassembled PDU]"
"325","2018-08-23 01:50:10.095062","192.168.2.3","216.58.197.4","TLSv1.2","155","Application Data"
"329","2018-08-23 01:50:10.170006","192.168.2.3","216.58.197.4","TCP","1434","34236  >  443 [ACK] Seq=173574 Ack=4469 Win=715 Len=1368 TSval=7769230 TSecr=759584935 [TCP segment of a reassembled PDU]"
"330","2018-08-23 01:50:10.170220","192.168.2.3","216.58.197.4","TCP","1434","34236  >  443 [ACK] Seq=174942 Ack=4469 Win=715 Len=1368 TSval=7769230 TSecr=759584935 [TCP segment of a reassembled PDU]"
"331","2018-08-23 01:50:10.170222","192.168.2.3","216.58.197.4","TLSv1.2","212","Application Data"
"332","2018-08-23 01:50:10.170492","192.168.2.3","216.58.197.4","TCP","1434","34236  >  443 [ACK] Seq=176456 Ack=4469 Win=715 Len=1368 TSval=7769230 TSecr=759584935 [TCP segment of a reassembled PDU]"
"333","2018-08-23 01:50:10.170496","192.168.2.3","216.58.197.4","TLSv1.2","155","Application Data"
"337","2018-08-23 01:50:10.243059","192.168.2.3","216.58.197.4","TCP","66","34236  >  443 [ACK] Seq=177913 Ack=4567 Win=715 Len=0 TSval=7769238 TSecr=759585003"
"338","2018-08-23 01:50:10.268698","192.168.2.3","216.58.197.4","TCP","1434","34236  >  443 [ACK] Seq=177913 Ack=4567 Win=715 Len=1368 TSval=7769240 TSecr=759585003 [TCP segment of a reassembled PDU]"
"339","2018-08-23 01:50:10.268706","192.168.2.3","216.58.197.4","TCP","1434","34236  >  443 [ACK] Seq=179281 Ack=4567 Win=715 Len=1368 TSval=7769240 TSecr=759585003 [TCP segment of a reassembled PDU]"
"340","2018-08-23 01:50:10.268707","192.168.2.3","216.58.197.4","TLSv1.2","212","Application Data"
"341","2018-08-23 01:50:10.268980","192.168.2.3","216.58.197.4","TCP","1434","34236  >  443 [ACK] Seq=180795 Ack=4567 Win=715 Len=1368 TSval=7769240 TSecr=759585003 [TCP segment of a reassembled PDU]"
"342","2018-08-23 01:50:10.268985","192.168.2.3","216.58.197.4","TLSv1.2","155","Application Data"
"348","2018-08-23 01:50:10.315478","192.168.2.3","216.58.197.4","TCP","66","34236  >  443 [ACK] Seq=182252 Ack=4952 Win=715 Len=0 TSval=7769245 TSecr=759585110"
"349","2018-08-23 01:50:10.364319","192.168.2.3","216.58.197.4","TCP","1434","34236  >  443 [ACK] Seq=182252 Ack=4952 Win=715 Len=1368 TSval=7769250 TSecr=759585110 [TCP segment of a reassembled PDU]"
"350","2018-08-23 01:50:10.364716","192.168.2.3","216.58.197.4","TCP","1434","34236  >  443 [ACK] Seq=183620 Ack=4952 Win=715 Len=1368 TSval=7769250 TSecr=759585110 [TCP segment of a reassembled PDU]"
"351","2018-08-23 01:50:10.364719","192.168.2.3","216.58.197.4","TLSv1.2","212","Application Data"
"352","2018-08-23 01:50:10.364925","192.168.2.3","216.58.197.4","TCP","1434","34236  >  443 [ACK] Seq=185134 Ack=4952 Win=715 Len=1368 TSval=7769250 TSecr=759585110 [TCP segment of a reassembled PDU]"
"353","2018-08-23 01:50:10.364927","192.168.2.3","216.58.197.4","TLSv1.2","155","Application Data"
"357","2018-08-23 01:50:10.460249","192.168.2.3","216.58.197.4","TCP","1434","34236  >  443 [ACK] Seq=186591 Ack=4952 Win=715 Len=1368 TSval=7769259 TSecr=759585165 [TCP segment of a reassembled PDU]"
"358","2018-08-23 01:50:10.460254","192.168.2.3","216.58.197.4","TCP","1434","34236  >  443 [ACK] Seq=187959 Ack=4952 Win=715 Len=1368 TSval=7769259 TSecr=759585165 [TCP segment of a reassembled PDU]"
"359","2018-08-23 01:50:10.460255","192.168.2.3","216.58.197.4","TLSv1.2","212","Application Data"
"360","2018-08-23 01:50:10.460522","192.168.2.3","216.58.197.4","TCP","1434","34236  >  443 [ACK] Seq=189473 Ack=4952 Win=715 Len=1368 TSval=7769259 TSecr=759585165 [TCP segment of a reassembled PDU]"
"361","2018-08-23 01:50:10.460525","192.168.2.3","216.58.197.4","TLSv1.2","155","Application Data"
"367","2018-08-23 01:50:10.514729","192.168.2.3","216.58.197.4","TCP","66","34236  >  443 [ACK] Seq=190930 Ack=5215 Win=715 Len=0 TSval=7769265 TSecr=759585303"
"368","2018-08-23 01:50:10.553984","192.168.2.3","216.58.197.4","TCP","1434","34236  >  443 [ACK] Seq=190930 Ack=5215 Win=715 Len=1368 TSval=7769269 TSecr=759585303 [TCP segment of a reassembled PDU]"
"369","2018-08-23 01:50:10.554254","192.168.2.3","216.58.197.4","TCP","1434","34236  >  443 [ACK] Seq=192298 Ack=5215 Win=715 Len=1368 TSval=7769269 TSecr=759585303 [TCP segment of a reassembled PDU]"
"370","2018-08-23 01:50:10.554258","192.168.2.3","216.58.197.4","TLSv1.2","212","Application Data"
"371","2018-08-23 01:50:10.554646","192.168.2.3","216.58.197.4","TCP","1434","34236  >  443 [ACK] Seq=193812 Ack=5215 Win=715 Len=1368 TSval=7769269 TSecr=759585303 [TCP segment of a reassembled PDU]"
"372","2018-08-23 01:50:10.554655","192.168.2.3","216.58.197.4","TLSv1.2","155","Application Data"
"376","2018-08-23 01:50:10.649459","192.168.2.3","216.58.197.4","TCP","1434","34236  >  443 [ACK] Seq=195269 Ack=5215 Win=715 Len=1368 TSval=7769278 TSecr=759585354 [TCP segment of a reassembled PDU]"
"377","2018-08-23 01:50:10.649776","192.168.2.3","216.58.197.4","TCP","1434","34236  >  443 [ACK] Seq=196637 Ack=5215 Win=715 Len=1368 TSval=7769278 TSecr=759585354 [TCP segment of a reassembled PDU]"
"378","2018-08-23 01:50:10.649778","192.168.2.3","216.58.197.4","TLSv1.2","212","Application Data"
"379","2018-08-23 01:50:10.650268","192.168.2.3","216.58.197.4","TCP","1434","34236  >  443 [ACK] Seq=198151 Ack=5215 Win=715 Len=1368 TSval=7769278 TSecr=759585354 [TCP segment of a reassembled PDU]"
"380","2018-08-23 01:50:10.650271","192.168.2.3","216.58.197.4","TLSv1.2","155","Application Data"
"386","2018-08-23 01:50:10.696205","192.168.2.3","216.58.197.4","TCP","66","34236  >  443 [ACK] Seq=199608 Ack=5299 Win=715 Len=0 TSval=7769283 TSecr=759585490"
"387","2018-08-23 01:50:10.696208","192.168.2.3","216.58.197.4","TCP","66","34236  >  443 [ACK] Seq=199608 Ack=5572 Win=715 Len=0 TSval=7769283 TSecr=759585490"
"388","2018-08-23 01:50:10.725195","192.168.2.3","216.58.197.4","TCP","1434","34236  >  443 [ACK] Seq=199608 Ack=5572 Win=715 Len=1368 TSval=7769286 TSecr=759585490 [TCP segment of a reassembled PDU]"
"389","2018-08-23 01:50:10.725538","192.168.2.3","216.58.197.4","TCP","1434","34236  >  443 [ACK] Seq=200976 Ack=5572 Win=715 Len=1368 TSval=7769286 TSecr=759585490 [TCP segment of a reassembled PDU]"
"390","2018-08-23 01:50:10.725540","192.168.2.3","216.58.197.4","TLSv1.2","212","Application Data"
"391","2018-08-23 01:50:10.725540","192.168.2.3","216.58.197.4","TLSv1.2","864","Application Data"
"392","2018-08-23 01:50:10.725541","192.168.2.3","216.58.197.4","TLSv1.2","102","Application Data"
"397","2018-08-23 01:50:10.755629","192.168.2.3","216.58.197.4","TCP","66","34236  >  443 [ACK] Seq=203324 Ack=6205 Win=715 Len=0 TSval=7769289 TSecr=759585548"
"402","2018-08-23 01:50:10.979089","192.168.2.3","216.58.197.4","TCP","66","34236  >  443 [ACK] Seq=203324 Ack=6635 Win=715 Len=0 TSval=7769311 TSecr=759585767"
"405","2018-08-23 01:50:11.007281","192.168.2.3","216.58.197.4","TCP","66","34236  >  443 [ACK] Seq=203324 Ack=8233 Win=715 Len=0 TSval=7769314 TSecr=759585786"
"418","2018-08-23 01:50:11.109323","192.168.2.3","216.58.197.4","TCP","66","34236  >  443 [ACK] Seq=203324 Ack=9957 Win=715 Len=0 TSval=7769324 TSecr=759585902"
"419","2018-08-23 01:50:11.109606","192.168.2.3","216.58.197.4","TCP","66","34236  >  443 [ACK] Seq=203324 Ack=13687 Win=715 Len=0 TSval=7769324 TSecr=759585903"
"420","2018-08-23 01:50:11.114074","192.168.2.3","216.58.197.4","TCP","66","34236  >  443 [ACK] Seq=203324 Ack=19139 Win=715 Len=0 TSval=7769324 TSecr=759585903"
"425","2018-08-23 01:50:11.140016","192.168.2.3","216.58.197.4","TCP","66","34236  >  443 [ACK] Seq=203324 Ack=20926 Win=715 Len=0 TSval=7769327 TSecr=759585934"
"428","2018-08-23 01:50:11.141290","192.168.2.3","216.58.197.4","TCP","66","34236  >  443 [ACK] Seq=203324 Ack=22668 Win=715 Len=0 TSval=7769327 TSecr=759585935"
"434","2018-08-23 01:50:11.142154","192.168.2.3","216.58.197.4","TCP","66","34236  >  443 [ACK] Seq=203324 Ack=24536 Win=715 Len=0 TSval=7769327 TSecr=759585935"
"437","2018-08-23 01:50:11.143101","192.168.2.3","216.58.197.4","TCP","66","34236  >  443 [ACK] Seq=203324 Ack=26340 Win=715 Len=0 TSval=7769327 TSecr=759585936"
"438","2018-08-23 01:50:11.143842","192.168.2.3","216.58.197.4","TCP","66","34236  >  443 [ACK] Seq=203324 Ack=29885 Win=715 Len=0 TSval=7769328 TSecr=759585936"
"443","2018-08-23 01:50:11.144469","192.168.2.3","216.58.197.4","TCP","66","34236  >  443 [ACK] Seq=203324 Ack=31599 Win=715 Len=0 TSval=7769328 TSecr=759585938"
"446","2018-08-23 01:50:11.147691","192.168.2.3","216.58.197.4","TCP","66","34236  >  443 [ACK] Seq=203324 Ack=33320 Win=715 Len=0 TSval=7769328 TSecr=759585939"
"453","2018-08-23 01:50:11.151721","192.168.2.3","216.58.197.4","TCP","66","34236  >  443 [ACK] Seq=203324 Ack=35250 Win=715 Len=0 TSval=7769328 TSecr=759585939"
"454","2018-08-23 01:50:11.151723","192.168.2.3","216.58.197.4","TCP","66","34236  >  443 [ACK] Seq=203324 Ack=37077 Win=723 Len=0 TSval=7769328 TSecr=759585941"
"455","2018-08-23 01:50:11.151724","192.168.2.3","216.58.197.4","TCP","66","34236  >  443 [ACK] Seq=203324 Ack=38931 Win=811 Len=0 TSval=7769328 TSecr=759585943"
"456","2018-08-23 01:50:11.151725","192.168.2.3","216.58.197.4","TCP","66","34236  >  443 [ACK] Seq=203324 Ack=40610 Win=811 Len=0 TSval=7769328 TSecr=759585943"
"457","2018-08-23 01:50:11.152322","192.168.2.3","216.58.197.4","TCP","66","34236  >  443 [ACK] Seq=203324 Ack=42127 Win=827 Len=0 TSval=7769328 TSecr=759585944"
"464","2018-08-23 01:50:11.186372","192.168.2.3","216.58.197.4","TCP","66","34236  >  443 [ACK] Seq=203324 Ack=42764 Win=848 Len=0 TSval=7769332 TSecr=759585979"
"465","2018-08-23 01:50:11.187962","192.168.2.3","216.58.197.4","TLSv1.2","104","Application Data"
"483","2018-08-23 01:50:18.570409","192.168.2.3","216.58.197.14","TLSv1.2","161","Application Data"
"484","2018-08-23 01:50:18.570722","192.168.2.3","216.58.197.14","TLSv1.2","104","Application Data"
"485","2018-08-23 01:50:18.571080","192.168.2.3","216.58.197.14","TLSv1.2","579","Application Data"
"489","2018-08-23 01:50:18.613012","192.168.2.3","216.58.197.14","TCP","66","41142  >  443 [ACK] Seq=647 Ack=39 Win=329 Len=0 TSval=7770075 TSecr=932602104"
"495","2018-08-23 01:50:18.658539","192.168.2.3","216.58.197.14","TCP","66","41142  >  443 [ACK] Seq=647 Ack=107 Win=329 Len=0 TSval=7770079 TSecr=932602184"
"496","2018-08-23 01:50:18.658542","192.168.2.3","216.58.197.14","TCP","66","41142  >  443 [ACK] Seq=647 Ack=399 Win=346 Len=0 TSval=7770079 TSecr=932602184"
"497","2018-08-23 01:50:18.659595","192.168.2.3","216.58.197.14","TCP","66","41142  >  443 [ACK] Seq=647 Ack=577 Win=363 Len=0 TSval=7770079 TSecr=932602184"
"498","2018-08-23 01:50:18.659974","192.168.2.3","216.58.197.14","TCP","66","41142  >  443 [ACK] Seq=647 Ack=615 Win=363 Len=0 TSval=7770079 TSecr=932602184"
"499","2018-08-23 01:50:18.660387","192.168.2.3","216.58.197.14","TLSv1.2","104","Application Data"
