"No.","Time","Source","Destination","Protocol","Length","Info"
"1","2018-08-23 01:54:18.867246","192.168.2.3","216.58.197.4","TLSv1.2","156","Application Data"
"2","2018-08-23 01:54:18.867432","192.168.2.3","216.58.197.4","TLSv1.2","104","Application Data"
"3","2018-08-23 01:54:18.868200","192.168.2.3","216.58.197.4","TLSv1.2","158","Application Data"
"7","2018-08-23 01:54:18.885513","192.168.2.3","216.58.197.4","TCP","1434","34236  >  443 [ACK] Seq=221 Ack=39 Win=1828 Len=1368 TSval=7794101 TSecr=759833668 [TCP segment of a reassembled PDU]"
"8","2018-08-23 01:54:18.885517","192.168.2.3","216.58.197.4","TCP","1434","34236  >  443 [ACK] Seq=1589 Ack=39 Win=1828 Len=1368 TSval=7794101 TSecr=759833668 [TCP segment of a reassembled PDU]"
"9","2018-08-23 01:54:18.885518","192.168.2.3","216.58.197.4","TLSv1.2","212","Application Data"
"10","2018-08-23 01:54:18.885665","192.168.2.3","216.58.197.4","TCP","1434","34236  >  443 [ACK] Seq=3103 Ack=39 Win=1828 Len=1368 TSval=7794101 TSecr=759833668 [TCP segment of a reassembled PDU]"
"11","2018-08-23 01:54:18.885667","192.168.2.3","216.58.197.4","TLSv1.2","183","Application Data"
"12","2018-08-23 01:54:18.885919","192.168.2.3","216.58.197.4","TCP","1434","34236  >  443 [ACK] Seq=4588 Ack=39 Win=1828 Len=1368 TSval=7794101 TSecr=759833668 [TCP segment of a reassembled PDU]"
"13","2018-08-23 01:54:18.886080","192.168.2.3","216.58.197.4","TCP","1434","34236  >  443 [ACK] Seq=5956 Ack=39 Win=1828 Len=1368 TSval=7794101 TSecr=759833668 [TCP segment of a reassembled PDU]"
"14","2018-08-23 01:54:18.886082","192.168.2.3","216.58.197.4","TLSv1.2","212","Application Data"
"15","2018-08-23 01:54:18.886460","192.168.2.3","216.58.197.4","TCP","1434","34236  >  443 [ACK] Seq=7470 Ack=39 Win=1828 Len=1368 TSval=7794101 TSecr=759833668 [TCP segment of a reassembled PDU]"
"21","2018-08-23 01:54:18.894315","192.168.2.3","216.58.197.4","TCP","1434","34236  >  443 [ACK] Seq=8838 Ack=39 Win=1828 Len=1368 TSval=7794102 TSecr=759833686 [TCP segment of a reassembled PDU]"
"22","2018-08-23 01:54:18.894521","192.168.2.3","216.58.197.4","TLSv1.2","1434","Application Data [TCP segment of a reassembled PDU]"
"23","2018-08-23 01:54:18.894671","192.168.2.3","216.58.197.4","TCP","1434","34236  >  443 [ACK] Seq=11574 Ack=39 Win=1828 Len=1368 TSval=7794102 TSecr=759833686 [TCP segment of a reassembled PDU]"
"24","2018-08-23 01:54:18.894893","192.168.2.3","216.58.197.4","TLSv1.2","1434","Application Data [TCP segment of a reassembled PDU]"
"25","2018-08-23 01:54:18.895241","192.168.2.3","216.58.197.4","TCP","1434","34236  >  443 [ACK] Seq=14310 Ack=39 Win=1828 Len=1368 TSval=7794102 TSecr=759833686 [TCP segment of a reassembled PDU]"
"26","2018-08-23 01:54:18.895242","192.168.2.3","216.58.197.4","TLSv1.2","1434","Application Data [TCP segment of a reassembled PDU]"
"27","2018-08-23 01:54:18.895346","192.168.2.3","216.58.197.4","TCP","1434","34236  >  443 [ACK] Seq=17046 Ack=39 Win=1828 Len=1368 TSval=7794102 TSecr=759833686 [TCP segment of a reassembled PDU]"
"28","2018-08-23 01:54:18.895636","192.168.2.3","216.58.197.4","TLSv1.2","1434","Application Data [TCP segment of a reassembled PDU]"
"29","2018-08-23 01:54:18.895639","192.168.2.3","216.58.197.4","TCP","1434","34236  >  443 [ACK] Seq=19782 Ack=39 Win=1828 Len=1368 TSval=7794102 TSecr=759833686 [TCP segment of a reassembled PDU]"
"30","2018-08-23 01:54:18.895900","192.168.2.3","216.58.197.4","TLSv1.2","1434","Application Data, Application Data"
"31","2018-08-23 01:54:18.896198","192.168.2.3","216.58.197.4","TCP","1434","34236  >  443 [ACK] Seq=22518 Ack=39 Win=1828 Len=1368 TSval=7794102 TSecr=759833686 [TCP segment of a reassembled PDU]"
"32","2018-08-23 01:54:18.896201","192.168.2.3","216.58.197.4","TLSv1.2","1434","Application Data [TCP segment of a reassembled PDU]"
"33","2018-08-23 01:54:18.896369","192.168.2.3","216.58.197.4","TLSv1.2","1434","Application Data [TCP segment of a reassembled PDU]"
"34","2018-08-23 01:54:18.896540","192.168.2.3","216.58.197.4","TCP","1434","34236  >  443 [ACK] Seq=26622 Ack=39 Win=1828 Len=1368 TSval=7794102 TSecr=759833686 [TCP segment of a reassembled PDU]"
"35","2018-08-23 01:54:18.896757","192.168.2.3","216.58.197.4","TLSv1.2","1434","Application Data [TCP segment of a reassembled PDU]"
"43","2018-08-23 01:54:18.904183","192.168.2.3","216.58.197.4","TCP","1434","34236  >  443 [ACK] Seq=29358 Ack=39 Win=1828 Len=1368 TSval=7794103 TSecr=759833695 [TCP segment of a reassembled PDU]"
"44","2018-08-23 01:54:18.904333","192.168.2.3","216.58.197.4","TLSv1.2","1434","Application Data [TCP segment of a reassembled PDU]"
"45","2018-08-23 01:54:18.904695","192.168.2.3","216.58.197.4","TCP","1434","34236  >  443 [ACK] Seq=32094 Ack=39 Win=1828 Len=1368 TSval=7794103 TSecr=759833695 [TCP segment of a reassembled PDU]"
"46","2018-08-23 01:54:18.904698","192.168.2.3","216.58.197.4","TCP","1434","34236  >  443 [ACK] Seq=33462 Ack=39 Win=1828 Len=1368 TSval=7794103 TSecr=759833695 [TCP segment of a reassembled PDU]"
"47","2018-08-23 01:54:18.904768","192.168.2.3","216.58.197.4","TLSv1.2","1434","Application Data [TCP segment of a reassembled PDU]"
"48","2018-08-23 01:54:18.905048","192.168.2.3","216.58.197.4","TCP","1434","34236  >  443 [ACK] Seq=36198 Ack=39 Win=1828 Len=1368 TSval=7794103 TSecr=759833695 [TCP segment of a reassembled PDU]"
"49","2018-08-23 01:54:18.905051","192.168.2.3","216.58.197.4","TLSv1.2","1434","Application Data [TCP segment of a reassembled PDU]"
"50","2018-08-23 01:54:18.905377","192.168.2.3","216.58.197.4","TCP","1434","34236  >  443 [ACK] Seq=38934 Ack=39 Win=1828 Len=1368 TSval=7794103 TSecr=759833695 [TCP segment of a reassembled PDU]"
"51","2018-08-23 01:54:18.905536","192.168.2.3","216.58.197.4","TLSv1.2","1434","Application Data [TCP segment of a reassembled PDU]"
"52","2018-08-23 01:54:18.907635","192.168.2.3","216.58.197.4","TLSv1.2","1434","Application Data [TCP segment of a reassembled PDU]"
"53","2018-08-23 01:54:18.907843","192.168.2.3","216.58.197.4","TCP","1434","34236  >  443 [ACK] Seq=43038 Ack=39 Win=1828 Len=1368 TSval=7794103 TSecr=759833696 [TCP segment of a reassembled PDU]"
"54","2018-08-23 01:54:18.907845","192.168.2.3","216.58.197.4","TLSv1.2","1434","Application Data [TCP segment of a reassembled PDU]"
"55","2018-08-23 01:54:18.907988","192.168.2.3","216.58.197.4","TCP","1434","34236  >  443 [ACK] Seq=45774 Ack=39 Win=1828 Len=1368 TSval=7794103 TSecr=759833696 [TCP segment of a reassembled PDU]"
"56","2018-08-23 01:54:18.908282","192.168.2.3","216.58.197.4","TCP","1434","34236  >  443 [ACK] Seq=47142 Ack=39 Win=1828 Len=1368 TSval=7794103 TSecr=759833696 [TCP segment of a reassembled PDU]"
"57","2018-08-23 01:54:18.908535","192.168.2.3","216.58.197.4","TLSv1.2","1434","Application Data [TCP segment of a reassembled PDU]"
"58","2018-08-23 01:54:18.908538","192.168.2.3","216.58.197.4","TCP","1434","34236  >  443 [ACK] Seq=49878 Ack=39 Win=1828 Len=1368 TSval=7794103 TSecr=759833696 [TCP segment of a reassembled PDU]"
"60","2018-08-23 01:54:18.908900","192.168.2.3","216.58.197.4","TLSv1.2","1434","Application Data [TCP segment of a reassembled PDU]"
"61","2018-08-23 01:54:18.908902","192.168.2.3","216.58.197.4","TCP","1434","34236  >  443 [ACK] Seq=52614 Ack=39 Win=1828 Len=1368 TSval=7794103 TSecr=759833696 [TCP segment of a reassembled PDU]"
"62","2018-08-23 01:54:18.909169","192.168.2.3","216.58.197.4","TLSv1.2","1434","Application Data [TCP segment of a reassembled PDU]"
"63","2018-08-23 01:54:18.909405","192.168.2.3","216.58.197.4","TCP","1434","34236  >  443 [ACK] Seq=55350 Ack=39 Win=1828 Len=1368 TSval=7794103 TSecr=759833697 [TCP segment of a reassembled PDU]"
"67","2018-08-23 01:54:18.910863","192.168.2.3","216.58.197.4","TLSv1.2","1434","Application Data [TCP segment of a reassembled PDU]"
"68","2018-08-23 01:54:18.911328","192.168.2.3","216.58.197.4","TLSv1.2","1434","Application Data [TCP segment of a reassembled PDU]"
"69","2018-08-23 01:54:18.911331","192.168.2.3","216.58.197.4","TLSv1.2","1015","Application Data"
"77","2018-08-23 01:54:18.927924","192.168.2.3","216.58.197.4","TCP","1434","34236  >  443 [ACK] Seq=60403 Ack=39 Win=1828 Len=1368 TSval=7794106 TSecr=759833711 [TCP segment of a reassembled PDU]"
"78","2018-08-23 01:54:18.928081","192.168.2.3","216.58.197.4","TCP","1434","34236  >  443 [ACK] Seq=61771 Ack=39 Win=1828 Len=1368 TSval=7794106 TSecr=759833711 [TCP segment of a reassembled PDU]"
"79","2018-08-23 01:54:18.928084","192.168.2.3","216.58.197.4","TLSv1.2","212","Application Data"
"80","2018-08-23 01:54:18.928320","192.168.2.3","216.58.197.4","TCP","1434","34236  >  443 [ACK] Seq=63285 Ack=39 Win=1828 Len=1368 TSval=7794106 TSecr=759833711 [TCP segment of a reassembled PDU]"
"81","2018-08-23 01:54:18.928323","192.168.2.3","216.58.197.4","TLSv1.2","155","Application Data"
"85","2018-08-23 01:54:19.025799","192.168.2.3","216.58.197.4","TCP","1434","34236  >  443 [ACK] Seq=64742 Ack=39 Win=1828 Len=1368 TSval=7794115 TSecr=759833728 [TCP segment of a reassembled PDU]"
"86","2018-08-23 01:54:19.028718","192.168.2.3","216.58.197.4","TCP","1434","34236  >  443 [ACK] Seq=66110 Ack=39 Win=1828 Len=1368 TSval=7794115 TSecr=759833728 [TCP segment of a reassembled PDU]"
"87","2018-08-23 01:54:19.028720","192.168.2.3","216.58.197.4","TLSv1.2","212","Application Data"
"88","2018-08-23 01:54:19.029049","192.168.2.3","216.58.197.4","TCP","1434","34236  >  443 [ACK] Seq=67624 Ack=39 Win=1828 Len=1368 TSval=7794116 TSecr=759833728 [TCP segment of a reassembled PDU]"
"89","2018-08-23 01:54:19.029052","192.168.2.3","216.58.197.4","TLSv1.2","155","Application Data"
"93","2018-08-23 01:54:19.122158","192.168.2.3","216.58.197.4","TCP","1434","34236  >  443 [ACK] Seq=69081 Ack=39 Win=1828 Len=1368 TSval=7794125 TSecr=759833869 [TCP segment of a reassembled PDU]"
"94","2018-08-23 01:54:19.122447","192.168.2.3","216.58.197.4","TCP","1434","34236  >  443 [ACK] Seq=70449 Ack=39 Win=1828 Len=1368 TSval=7794125 TSecr=759833869 [TCP segment of a reassembled PDU]"
"95","2018-08-23 01:54:19.122450","192.168.2.3","216.58.197.4","TLSv1.2","212","Application Data"
"96","2018-08-23 01:54:19.122820","192.168.2.3","216.58.197.4","TCP","1434","34236  >  443 [ACK] Seq=71963 Ack=39 Win=1828 Len=1368 TSval=7794125 TSecr=759833869 [TCP segment of a reassembled PDU]"
"97","2018-08-23 01:54:19.122823","192.168.2.3","216.58.197.4","TLSv1.2","155","Application Data"
"104","2018-08-23 01:54:19.211546","192.168.2.3","216.58.197.4","TCP","66","34236  >  443 [ACK] Seq=73420 Ack=203 Win=1828 Len=0 TSval=7794134 TSecr=759834006"
"105","2018-08-23 01:54:19.228022","192.168.2.3","216.58.197.4","TCP","1434","34236  >  443 [ACK] Seq=73420 Ack=421 Win=1828 Len=1368 TSval=7794136 TSecr=759834006 [TCP segment of a reassembled PDU]"
"106","2018-08-23 01:54:19.228482","192.168.2.3","216.58.197.4","TCP","1434","34236  >  443 [ACK] Seq=74788 Ack=421 Win=1828 Len=1368 TSval=7794136 TSecr=759834006 [TCP segment of a reassembled PDU]"
"107","2018-08-23 01:54:19.228486","192.168.2.3","216.58.197.4","TLSv1.2","212","Application Data"
"108","2018-08-23 01:54:19.228487","192.168.2.3","216.58.197.4","TCP","1434","34236  >  443 [ACK] Seq=76302 Ack=421 Win=1828 Len=1368 TSval=7794136 TSecr=759834006 [TCP segment of a reassembled PDU]"
"109","2018-08-23 01:54:19.228625","192.168.2.3","216.58.197.4","TLSv1.2","155","Application Data"
"114","2018-08-23 01:54:19.270277","192.168.2.3","216.58.197.4","TCP","66","34236  >  443 [ACK] Seq=77759 Ack=592 Win=1828 Len=0 TSval=7794140 TSecr=759834028"
"115","2018-08-23 01:54:19.344831","192.168.2.3","216.58.197.4","TCP","1434","34236  >  443 [ACK] Seq=77759 Ack=592 Win=1828 Len=1368 TSval=7794147 TSecr=759834028 [TCP segment of a reassembled PDU]"
"116","2018-08-23 01:54:19.344836","192.168.2.3","216.58.197.4","TCP","1434","34236  >  443 [ACK] Seq=79127 Ack=592 Win=1828 Len=1368 TSval=7794147 TSecr=759834028 [TCP segment of a reassembled PDU]"
"117","2018-08-23 01:54:19.344939","192.168.2.3","216.58.197.4","TLSv1.2","212","Application Data"
"118","2018-08-23 01:54:19.345202","192.168.2.3","216.58.197.4","TCP","1434","34236  >  443 [ACK] Seq=80641 Ack=592 Win=1828 Len=1368 TSval=7794147 TSecr=759834028 [TCP segment of a reassembled PDU]"
"119","2018-08-23 01:54:19.345205","192.168.2.3","216.58.197.4","TLSv1.2","155","Application Data"
"123","2018-08-23 01:54:19.378552","192.168.2.3","216.58.197.4","TCP","66","34236  >  443 [ACK] Seq=82098 Ack=883 Win=1828 Len=0 TSval=7794151 TSecr=759834162"
"124","2018-08-23 01:54:19.466742","192.168.2.3","216.58.197.4","TCP","1434","34236  >  443 [ACK] Seq=82098 Ack=883 Win=1828 Len=1368 TSval=7794157 TSecr=759834162 [TCP segment of a reassembled PDU]"
"125","2018-08-23 01:54:19.466748","192.168.2.3","216.58.197.4","TCP","1434","34236  >  443 [ACK] Seq=83466 Ack=883 Win=1828 Len=1368 TSval=7794157 TSecr=759834162 [TCP segment of a reassembled PDU]"
"126","2018-08-23 01:54:19.466818","192.168.2.3","216.58.197.4","TLSv1.2","212","Application Data"
"127","2018-08-23 01:54:19.467103","192.168.2.3","216.58.197.4","TCP","1434","34236  >  443 [ACK] Seq=84980 Ack=883 Win=1828 Len=1368 TSval=7794157 TSecr=759834162 [TCP segment of a reassembled PDU]"
"128","2018-08-23 01:54:19.467107","192.168.2.3","216.58.197.4","TLSv1.2","155","Application Data"
"132","2018-08-23 01:54:19.515494","192.168.2.3","216.58.197.4","TCP","66","34236  >  443 [ACK] Seq=86437 Ack=1133 Win=1828 Len=0 TSval=7794164 TSecr=759834308"
"133","2018-08-23 01:54:19.538069","192.168.2.3","216.58.197.4","TCP","1434","34236  >  443 [ACK] Seq=86437 Ack=1133 Win=1828 Len=1368 TSval=7794167 TSecr=759834308 [TCP segment of a reassembled PDU]"
"134","2018-08-23 01:54:19.540763","192.168.2.3","216.58.197.4","TCP","1434","34236  >  443 [ACK] Seq=87805 Ack=1133 Win=1828 Len=1368 TSval=7794167 TSecr=759834308 [TCP segment of a reassembled PDU]"
"135","2018-08-23 01:54:19.540767","192.168.2.3","216.58.197.4","TLSv1.2","212","Application Data"
"136","2018-08-23 01:54:19.540768","192.168.2.3","216.58.197.4","TCP","1434","34236  >  443 [ACK] Seq=89319 Ack=1133 Win=1828 Len=1368 TSval=7794167 TSecr=759834308 [TCP segment of a reassembled PDU]"
"137","2018-08-23 01:54:19.541186","192.168.2.3","216.58.197.4","TLSv1.2","155","Application Data"
"141","2018-08-23 01:54:19.634652","192.168.2.3","216.58.197.4","TCP","1434","34236  >  443 [ACK] Seq=90776 Ack=1133 Win=1828 Len=1368 TSval=7794176 TSecr=759834381 [TCP segment of a reassembled PDU]"
"142","2018-08-23 01:54:19.635063","192.168.2.3","216.58.197.4","TCP","1434","34236  >  443 [ACK] Seq=92144 Ack=1133 Win=1828 Len=1368 TSval=7794176 TSecr=759834381 [TCP segment of a reassembled PDU]"
"143","2018-08-23 01:54:19.635065","192.168.2.3","216.58.197.4","TLSv1.2","212","Application Data"
"144","2018-08-23 01:54:19.635066","192.168.2.3","216.58.197.4","TCP","1434","34236  >  443 [ACK] Seq=93658 Ack=1133 Win=1828 Len=1368 TSval=7794176 TSecr=759834381 [TCP segment of a reassembled PDU]"
"145","2018-08-23 01:54:19.635067","192.168.2.3","216.58.197.4","TLSv1.2","155","Application Data"
"149","2018-08-23 01:54:19.730194","192.168.2.3","216.58.197.4","TCP","1434","34236  >  443 [ACK] Seq=95115 Ack=1133 Win=1828 Len=1368 TSval=7794186 TSecr=759834435 [TCP segment of a reassembled PDU]"
"150","2018-08-23 01:54:19.730628","192.168.2.3","216.58.197.4","TCP","1434","34236  >  443 [ACK] Seq=96483 Ack=1133 Win=1828 Len=1368 TSval=7794186 TSecr=759834435 [TCP segment of a reassembled PDU]"
"151","2018-08-23 01:54:19.730632","192.168.2.3","216.58.197.4","TLSv1.2","212","Application Data"
"152","2018-08-23 01:54:19.730633","192.168.2.3","216.58.197.4","TCP","1434","34236  >  443 [ACK] Seq=97997 Ack=1133 Win=1828 Len=1368 TSval=7794186 TSecr=759834435 [TCP segment of a reassembled PDU]"
"153","2018-08-23 01:54:19.730783","192.168.2.3","216.58.197.4","TLSv1.2","155","Application Data"
"157","2018-08-23 01:54:19.838211","192.168.2.3","216.58.197.4","TCP","1434","34236  >  443 [ACK] Seq=99454 Ack=1133 Win=1828 Len=1368 TSval=7794197 TSecr=759834531 [TCP segment of a reassembled PDU]"
"158","2018-08-23 01:54:19.838691","192.168.2.3","216.58.197.4","TCP","1434","34236  >  443 [ACK] Seq=100822 Ack=1133 Win=1828 Len=1368 TSval=7794197 TSecr=759834531 [TCP segment of a reassembled PDU]"
"159","2018-08-23 01:54:19.838694","192.168.2.3","216.58.197.4","TLSv1.2","212","Application Data"
"160","2018-08-23 01:54:19.838709","192.168.2.3","216.58.197.4","TCP","1434","34236  >  443 [ACK] Seq=102336 Ack=1133 Win=1828 Len=1368 TSval=7794197 TSecr=759834531 [TCP segment of a reassembled PDU]"
"161","2018-08-23 01:54:19.838849","192.168.2.3","216.58.197.4","TLSv1.2","155","Application Data"
"165","2018-08-23 01:54:19.934023","192.168.2.3","216.58.197.4","TCP","1434","34236  >  443 [ACK] Seq=103793 Ack=1133 Win=1828 Len=1368 TSval=7794206 TSecr=759834639 [TCP segment of a reassembled PDU]"
"166","2018-08-23 01:54:19.934388","192.168.2.3","216.58.197.4","TCP","1434","34236  >  443 [ACK] Seq=105161 Ack=1133 Win=1828 Len=1368 TSval=7794206 TSecr=759834639 [TCP segment of a reassembled PDU]"
"167","2018-08-23 01:54:19.934392","192.168.2.3","216.58.197.4","TLSv1.2","212","Application Data"
"168","2018-08-23 01:54:19.934558","192.168.2.3","216.58.197.4","TCP","1434","34236  >  443 [ACK] Seq=106675 Ack=1133 Win=1828 Len=1368 TSval=7794206 TSecr=759834639 [TCP segment of a reassembled PDU]"
"169","2018-08-23 01:54:19.934562","192.168.2.3","216.58.197.4","TLSv1.2","155","Application Data"
"173","2018-08-23 01:54:20.030465","192.168.2.3","216.58.197.4","TCP","1434","34236  >  443 [ACK] Seq=108132 Ack=1133 Win=1828 Len=1368 TSval=7794216 TSecr=759834735 [TCP segment of a reassembled PDU]"
"174","2018-08-23 01:54:20.030924","192.168.2.3","216.58.197.4","TCP","1434","34236  >  443 [ACK] Seq=109500 Ack=1133 Win=1828 Len=1368 TSval=7794216 TSecr=759834735 [TCP segment of a reassembled PDU]"
"175","2018-08-23 01:54:20.030927","192.168.2.3","216.58.197.4","TLSv1.2","212","Application Data"
"176","2018-08-23 01:54:20.030928","192.168.2.3","216.58.197.4","TCP","1434","34236  >  443 [ACK] Seq=111014 Ack=1133 Win=1828 Len=1368 TSval=7794216 TSecr=759834735 [TCP segment of a reassembled PDU]"
"177","2018-08-23 01:54:20.030929","192.168.2.3","216.58.197.4","TLSv1.2","155","Application Data"
"181","2018-08-23 01:54:20.124197","192.168.2.3","216.58.197.4","TCP","1434","34236  >  443 [ACK] Seq=112471 Ack=1133 Win=1828 Len=1368 TSval=7794225 TSecr=759834831 [TCP segment of a reassembled PDU]"
"182","2018-08-23 01:54:20.124638","192.168.2.3","216.58.197.4","TCP","1434","34236  >  443 [ACK] Seq=113839 Ack=1133 Win=1828 Len=1368 TSval=7794225 TSecr=759834831 [TCP segment of a reassembled PDU]"
"183","2018-08-23 01:54:20.124641","192.168.2.3","216.58.197.4","TLSv1.2","212","Application Data"
"184","2018-08-23 01:54:20.124642","192.168.2.3","216.58.197.4","TCP","1434","34236  >  443 [ACK] Seq=115353 Ack=1133 Win=1828 Len=1368 TSval=7794225 TSecr=759834831 [TCP segment of a reassembled PDU]"
"185","2018-08-23 01:54:20.124929","192.168.2.3","216.58.197.4","TLSv1.2","155","Application Data"
"190","2018-08-23 01:54:20.222585","192.168.2.3","216.58.197.4","TCP","1434","34236  >  443 [ACK] Seq=116810 Ack=1355 Win=1828 Len=1368 TSval=7794235 TSecr=759835006 [TCP segment of a reassembled PDU]"
"191","2018-08-23 01:54:20.222591","192.168.2.3","216.58.197.4","TCP","1434","34236  >  443 [ACK] Seq=118178 Ack=1355 Win=1828 Len=1368 TSval=7794235 TSecr=759835006 [TCP segment of a reassembled PDU]"
"192","2018-08-23 01:54:20.222701","192.168.2.3","216.58.197.4","TLSv1.2","212","Application Data"
"193","2018-08-23 01:54:20.222858","192.168.2.3","216.58.197.4","TCP","1434","34236  >  443 [ACK] Seq=119692 Ack=1355 Win=1828 Len=1368 TSval=7794235 TSecr=759835006 [TCP segment of a reassembled PDU]"
"194","2018-08-23 01:54:20.222860","192.168.2.3","216.58.197.4","TLSv1.2","155","Application Data"
"199","2018-08-23 01:54:20.267347","192.168.2.3","216.58.197.4","TCP","66","34236  >  443 [ACK] Seq=121149 Ack=1492 Win=1828 Len=0 TSval=7794240 TSecr=759835028"
"200","2018-08-23 01:54:20.335280","192.168.2.3","216.58.197.4","TCP","1434","34236  >  443 [ACK] Seq=121149 Ack=1492 Win=1828 Len=1368 TSval=7794246 TSecr=759835028 [TCP segment of a reassembled PDU]"
"201","2018-08-23 01:54:20.336075","192.168.2.3","216.58.197.4","TCP","1434","34236  >  443 [ACK] Seq=122517 Ack=1492 Win=1828 Len=1368 TSval=7794246 TSecr=759835028 [TCP segment of a reassembled PDU]"
"202","2018-08-23 01:54:20.336077","192.168.2.3","216.58.197.4","TLSv1.2","212","Application Data"
"203","2018-08-23 01:54:20.336255","192.168.2.3","216.58.197.4","TCP","1434","34236  >  443 [ACK] Seq=124031 Ack=1492 Win=1828 Len=1368 TSval=7794246 TSecr=759835028 [TCP segment of a reassembled PDU]"
"204","2018-08-23 01:54:20.336258","192.168.2.3","216.58.197.4","TLSv1.2","155","Application Data"
"208","2018-08-23 01:54:20.431632","192.168.2.3","216.58.197.4","TCP","1434","34236  >  443 [ACK] Seq=125488 Ack=1492 Win=1828 Len=1368 TSval=7794256 TSecr=759835176 [TCP segment of a reassembled PDU]"
"209","2018-08-23 01:54:20.431639","192.168.2.3","216.58.197.4","TCP","1434","34236  >  443 [ACK] Seq=126856 Ack=1492 Win=1828 Len=1368 TSval=7794256 TSecr=759835176 [TCP segment of a reassembled PDU]"
"210","2018-08-23 01:54:20.431640","192.168.2.3","216.58.197.4","TLSv1.2","212","Application Data"
"211","2018-08-23 01:54:20.431977","192.168.2.3","216.58.197.4","TCP","1434","34236  >  443 [ACK] Seq=128370 Ack=1492 Win=1828 Len=1368 TSval=7794256 TSecr=759835176 [TCP segment of a reassembled PDU]"
"212","2018-08-23 01:54:20.431980","192.168.2.3","216.58.197.4","TLSv1.2","155","Application Data"
"215","2018-08-23 01:54:20.529152","192.168.2.3","216.58.197.4","TCP","1434","34236  >  443 [ACK] Seq=129827 Ack=1492 Win=1828 Len=1368 TSval=7794266 TSecr=759835232 [TCP segment of a reassembled PDU]"
"216","2018-08-23 01:54:20.529595","192.168.2.3","216.58.197.4","TCP","1434","34236  >  443 [ACK] Seq=131195 Ack=1492 Win=1828 Len=1368 TSval=7794266 TSecr=759835232 [TCP segment of a reassembled PDU]"
"217","2018-08-23 01:54:20.529597","192.168.2.3","216.58.197.4","TLSv1.2","212","Application Data"
"218","2018-08-23 01:54:20.530069","192.168.2.3","216.58.197.4","TCP","1434","34236  >  443 [ACK] Seq=132709 Ack=1492 Win=1828 Len=1368 TSval=7794266 TSecr=759835232 [TCP segment of a reassembled PDU]"
"219","2018-08-23 01:54:20.530072","192.168.2.3","216.58.197.4","TLSv1.2","155","Application Data"
"223","2018-08-23 01:54:20.626290","192.168.2.3","216.58.197.4","TCP","1434","34236  >  443 [ACK] Seq=134166 Ack=1492 Win=1828 Len=1368 TSval=7794275 TSecr=759835330 [TCP segment of a reassembled PDU]"
"224","2018-08-23 01:54:20.626308","192.168.2.3","216.58.197.4","TCP","1434","34236  >  443 [ACK] Seq=135534 Ack=1492 Win=1828 Len=1368 TSval=7794275 TSecr=759835330 [TCP segment of a reassembled PDU]"
"225","2018-08-23 01:54:20.626309","192.168.2.3","216.58.197.4","TLSv1.2","212","Application Data"
"226","2018-08-23 01:54:20.626453","192.168.2.3","216.58.197.4","TCP","1434","34236  >  443 [ACK] Seq=137048 Ack=1492 Win=1828 Len=1368 TSval=7794275 TSecr=759835330 [TCP segment of a reassembled PDU]"
"227","2018-08-23 01:54:20.626695","192.168.2.3","216.58.197.4","TLSv1.2","155","Application Data"
"231","2018-08-23 01:54:20.704565","192.168.2.3","216.58.197.4","TCP","1434","34236  >  443 [ACK] Seq=138505 Ack=1492 Win=1828 Len=1368 TSval=7794283 TSecr=759835427 [TCP segment of a reassembled PDU]"
"232","2018-08-23 01:54:20.704570","192.168.2.3","216.58.197.4","TCP","1434","34236  >  443 [ACK] Seq=139873 Ack=1492 Win=1828 Len=1368 TSval=7794283 TSecr=759835427 [TCP segment of a reassembled PDU]"
"233","2018-08-23 01:54:20.704571","192.168.2.3","216.58.197.4","TLSv1.2","212","Application Data"
"234","2018-08-23 01:54:20.704879","192.168.2.3","216.58.197.4","TCP","1434","34236  >  443 [ACK] Seq=141387 Ack=1492 Win=1828 Len=1368 TSval=7794283 TSecr=759835427 [TCP segment of a reassembled PDU]"
"235","2018-08-23 01:54:20.704882","192.168.2.3","216.58.197.4","TLSv1.2","155","Application Data"
"239","2018-08-23 01:54:20.710148","192.168.2.3","216.58.197.4","TCP","66","34236  >  443 [ACK] Seq=142844 Ack=1526 Win=1828 Len=0 TSval=7794284 TSecr=759835505"
"240","2018-08-23 01:54:20.815082","192.168.2.3","216.58.197.4","TCP","1434","34236  >  443 [ACK] Seq=142844 Ack=1526 Win=1828 Len=1368 TSval=7794294 TSecr=759835505 [TCP segment of a reassembled PDU]"
"241","2018-08-23 01:54:20.815332","192.168.2.3","216.58.197.4","TCP","1434","34236  >  443 [ACK] Seq=144212 Ack=1526 Win=1828 Len=1368 TSval=7794294 TSecr=759835505 [TCP segment of a reassembled PDU]"
"242","2018-08-23 01:54:20.815335","192.168.2.3","216.58.197.4","TLSv1.2","212","Application Data"
"243","2018-08-23 01:54:20.815819","192.168.2.3","216.58.197.4","TCP","1434","34236  >  443 [ACK] Seq=145726 Ack=1526 Win=1828 Len=1368 TSval=7794294 TSecr=759835505 [TCP segment of a reassembled PDU]"
"244","2018-08-23 01:54:20.815822","192.168.2.3","216.58.197.4","TLSv1.2","155","Application Data"
"250","2018-08-23 01:54:20.876208","192.168.2.3","216.58.197.4","TCP","66","34236  >  443 [ACK] Seq=147183 Ack=1706 Win=1828 Len=0 TSval=7794301 TSecr=759835671"
"251","2018-08-23 01:54:20.876397","192.168.2.3","216.58.197.4","TCP","66","34236  >  443 [ACK] Seq=147183 Ack=1870 Win=1828 Len=0 TSval=7794301 TSecr=759835671"
"252","2018-08-23 01:54:20.894244","192.168.2.3","216.58.197.4","TCP","1434","34236  >  443 [ACK] Seq=147183 Ack=1870 Win=1828 Len=1368 TSval=7794302 TSecr=759835671 [TCP segment of a reassembled PDU]"
"253","2018-08-23 01:54:20.894524","192.168.2.3","216.58.197.4","TCP","1434","34236  >  443 [ACK] Seq=148551 Ack=1870 Win=1828 Len=1368 TSval=7794302 TSecr=759835671 [TCP segment of a reassembled PDU]"
"254","2018-08-23 01:54:20.894527","192.168.2.3","216.58.197.4","TLSv1.2","212","Application Data"
"255","2018-08-23 01:54:20.894741","192.168.2.3","216.58.197.4","TCP","1434","34236  >  443 [ACK] Seq=150065 Ack=1870 Win=1828 Len=1368 TSval=7794302 TSecr=759835671 [TCP segment of a reassembled PDU]"
"256","2018-08-23 01:54:20.894744","192.168.2.3","216.58.197.4","TLSv1.2","155","Application Data"
"259","2018-08-23 01:54:20.990245","192.168.2.3","216.58.197.4","TCP","1434","34236  >  443 [ACK] Seq=151522 Ack=1870 Win=1828 Len=1368 TSval=7794312 TSecr=759835695 [TCP segment of a reassembled PDU]"
"260","2018-08-23 01:54:20.990640","192.168.2.3","216.58.197.4","TCP","1434","34236  >  443 [ACK] Seq=152890 Ack=1870 Win=1828 Len=1368 TSval=7794312 TSecr=759835695 [TCP segment of a reassembled PDU]"
"261","2018-08-23 01:54:20.990642","192.168.2.3","216.58.197.4","TLSv1.2","212","Application Data"
"262","2018-08-23 01:54:20.991096","192.168.2.3","216.58.197.4","TCP","1434","34236  >  443 [ACK] Seq=154404 Ack=1870 Win=1828 Len=1368 TSval=7794312 TSecr=759835695 [TCP segment of a reassembled PDU]"
"263","2018-08-23 01:54:20.991099","192.168.2.3","216.58.197.4","TLSv1.2","155","Application Data"
"269","2018-08-23 01:54:21.041764","192.168.2.3","216.58.197.4","TCP","66","34236  >  443 [ACK] Seq=155861 Ack=2284 Win=1828 Len=0 TSval=7794317 TSecr=759835835"
"270","2018-08-23 01:54:21.085645","192.168.2.3","216.58.197.4","TCP","1434","34236  >  443 [ACK] Seq=155861 Ack=2284 Win=1828 Len=1368 TSval=7794321 TSecr=759835835 [TCP segment of a reassembled PDU]"
"271","2018-08-23 01:54:21.085650","192.168.2.3","216.58.197.4","TCP","1434","34236  >  443 [ACK] Seq=157229 Ack=2284 Win=1828 Len=1368 TSval=7794321 TSecr=759835835 [TCP segment of a reassembled PDU]"
"272","2018-08-23 01:54:21.085651","192.168.2.3","216.58.197.4","TLSv1.2","212","Application Data"
"273","2018-08-23 01:54:21.086047","192.168.2.3","216.58.197.4","TCP","1434","34236  >  443 [ACK] Seq=158743 Ack=2284 Win=1828 Len=1368 TSval=7794321 TSecr=759835835 [TCP segment of a reassembled PDU]"
"274","2018-08-23 01:54:21.086062","192.168.2.3","216.58.197.4","TLSv1.2","155","Application Data"
"277","2018-08-23 01:54:21.180241","192.168.2.3","216.58.197.4","TCP","1434","34236  >  443 [ACK] Seq=160200 Ack=2284 Win=1828 Len=1368 TSval=7794331 TSecr=759835886 [TCP segment of a reassembled PDU]"
"278","2018-08-23 01:54:21.180539","192.168.2.3","216.58.197.4","TCP","1434","34236  >  443 [ACK] Seq=161568 Ack=2284 Win=1828 Len=1368 TSval=7794331 TSecr=759835886 [TCP segment of a reassembled PDU]"
"279","2018-08-23 01:54:21.180541","192.168.2.3","216.58.197.4","TLSv1.2","212","Application Data"
"280","2018-08-23 01:54:21.180788","192.168.2.3","216.58.197.4","TCP","1434","34236  >  443 [ACK] Seq=163082 Ack=2284 Win=1828 Len=1368 TSval=7794331 TSecr=759835886 [TCP segment of a reassembled PDU]"
"281","2018-08-23 01:54:21.180790","192.168.2.3","216.58.197.4","TLSv1.2","155","Application Data"
"287","2018-08-23 01:54:21.233435","192.168.2.3","216.58.197.4","TCP","66","34236  >  443 [ACK] Seq=164539 Ack=2638 Win=1828 Len=0 TSval=7794336 TSecr=759836006"
"290","2018-08-23 01:54:21.245862","192.168.2.3","216.58.197.4","TCP","66","34236  >  443 [ACK] Seq=164539 Ack=3113 Win=1828 Len=0 TSval=7794337 TSecr=759836038"
"291","2018-08-23 01:54:21.278258","192.168.2.3","216.58.197.4","TCP","1434","34236  >  443 [ACK] Seq=164539 Ack=3113 Win=1828 Len=1368 TSval=7794341 TSecr=759836038 [TCP segment of a reassembled PDU]"
"292","2018-08-23 01:54:21.278448","192.168.2.3","216.58.197.4","TCP","1434","34236  >  443 [ACK] Seq=165907 Ack=3113 Win=1828 Len=1368 TSval=7794341 TSecr=759836038 [TCP segment of a reassembled PDU]"
"293","2018-08-23 01:54:21.278451","192.168.2.3","216.58.197.4","TLSv1.2","212","Application Data"
"294","2018-08-23 01:54:21.281498","192.168.2.3","216.58.197.4","TCP","1434","34236  >  443 [ACK] Seq=167421 Ack=3113 Win=1828 Len=1368 TSval=7794341 TSecr=759836038 [TCP segment of a reassembled PDU]"
"295","2018-08-23 01:54:21.281501","192.168.2.3","216.58.197.4","TLSv1.2","155","Application Data"
"300","2018-08-23 01:54:21.344100","192.168.2.3","216.58.197.4","TCP","66","34236  >  443 [ACK] Seq=168878 Ack=3344 Win=1828 Len=0 TSval=7794347 TSecr=759836135"
"301","2018-08-23 01:54:21.374690","192.168.2.3","216.58.197.4","TCP","1434","34236  >  443 [ACK] Seq=168878 Ack=3344 Win=1828 Len=1368 TSval=7794350 TSecr=759836135 [TCP segment of a reassembled PDU]"
"302","2018-08-23 01:54:21.374697","192.168.2.3","216.58.197.4","TCP","1434","34236  >  443 [ACK] Seq=170246 Ack=3344 Win=1828 Len=1368 TSval=7794350 TSecr=759836135 [TCP segment of a reassembled PDU]"
"303","2018-08-23 01:54:21.374698","192.168.2.3","216.58.197.4","TLSv1.2","212","Application Data"
"304","2018-08-23 01:54:21.374727","192.168.2.3","216.58.197.4","TCP","1434","34236  >  443 [ACK] Seq=171760 Ack=3344 Win=1828 Len=1368 TSval=7794350 TSecr=759836135 [TCP segment of a reassembled PDU]"
"305","2018-08-23 01:54:21.374972","192.168.2.3","216.58.197.4","TLSv1.2","155","Application Data"
"308","2018-08-23 01:54:21.470302","192.168.2.3","216.58.197.4","TCP","1434","34236  >  443 [ACK] Seq=173217 Ack=3344 Win=1828 Len=1368 TSval=7794360 TSecr=759836214 [TCP segment of a reassembled PDU]"
"309","2018-08-23 01:54:21.470677","192.168.2.3","216.58.197.4","TCP","1434","34236  >  443 [ACK] Seq=174585 Ack=3344 Win=1828 Len=1368 TSval=7794360 TSecr=759836214 [TCP segment of a reassembled PDU]"
"310","2018-08-23 01:54:21.470679","192.168.2.3","216.58.197.4","TLSv1.2","212","Application Data"
"311","2018-08-23 01:54:21.471076","192.168.2.3","216.58.197.4","TCP","1434","34236  >  443 [ACK] Seq=176099 Ack=3344 Win=1828 Len=1368 TSval=7794360 TSecr=759836214 [TCP segment of a reassembled PDU]"
"312","2018-08-23 01:54:21.471079","192.168.2.3","216.58.197.4","TLSv1.2","155","Application Data"
"318","2018-08-23 01:54:21.528337","192.168.2.3","216.58.197.4","TCP","66","34236  >  443 [ACK] Seq=177556 Ack=3633 Win=1828 Len=0 TSval=7794366 TSecr=759836323"
"321","2018-08-23 01:54:21.535092","192.168.2.3","216.58.197.4","TCP","66","34236  >  443 [ACK] Seq=177556 Ack=3916 Win=1828 Len=0 TSval=7794366 TSecr=759836329"
"322","2018-08-23 01:54:21.563892","192.168.2.3","216.58.197.4","TCP","1434","34236  >  443 [ACK] Seq=177556 Ack=3916 Win=1828 Len=1368 TSval=7794369 TSecr=759836329 [TCP segment of a reassembled PDU]"
"323","2018-08-23 01:54:21.564395","192.168.2.3","216.58.197.4","TCP","1434","34236  >  443 [ACK] Seq=178924 Ack=3916 Win=1828 Len=1368 TSval=7794369 TSecr=759836329 [TCP segment of a reassembled PDU]"
"324","2018-08-23 01:54:21.564398","192.168.2.3","216.58.197.4","TLSv1.2","212","Application Data"
"325","2018-08-23 01:54:21.564799","192.168.2.3","216.58.197.4","TCP","1434","34236  >  443 [ACK] Seq=180438 Ack=3916 Win=1828 Len=1368 TSval=7794369 TSecr=759836329 [TCP segment of a reassembled PDU]"
"326","2018-08-23 01:54:21.564802","192.168.2.3","216.58.197.4","TLSv1.2","155","Application Data"
"330","2018-08-23 01:54:21.660542","192.168.2.3","216.58.197.4","TCP","1434","34236  >  443 [ACK] Seq=181895 Ack=3916 Win=1828 Len=1368 TSval=7794379 TSecr=759836365 [TCP segment of a reassembled PDU]"
"331","2018-08-23 01:54:21.662412","192.168.2.3","216.58.197.4","TCP","1434","34236  >  443 [ACK] Seq=183263 Ack=3916 Win=1828 Len=1368 TSval=7794379 TSecr=759836365 [TCP segment of a reassembled PDU]"
"332","2018-08-23 01:54:21.662421","192.168.2.3","216.58.197.4","TLSv1.2","212","Application Data"
"333","2018-08-23 01:54:21.662422","192.168.2.3","216.58.197.4","TCP","1434","34236  >  443 [ACK] Seq=184777 Ack=3916 Win=1828 Len=1368 TSval=7794379 TSecr=759836365 [TCP segment of a reassembled PDU]"
"334","2018-08-23 01:54:21.662519","192.168.2.3","216.58.197.4","TLSv1.2","155","Application Data"
"340","2018-08-23 01:54:21.711664","192.168.2.3","216.58.197.4","TCP","66","34236  >  443 [ACK] Seq=186234 Ack=4177 Win=1828 Len=0 TSval=7794384 TSecr=759836506"
"341","2018-08-23 01:54:21.777161","192.168.2.3","216.58.197.4","TCP","1434","34236  >  443 [ACK] Seq=186234 Ack=4177 Win=1828 Len=1368 TSval=7794390 TSecr=759836506 [TCP segment of a reassembled PDU]"
"342","2018-08-23 01:54:21.777167","192.168.2.3","216.58.197.4","TCP","1434","34236  >  443 [ACK] Seq=187602 Ack=4177 Win=1828 Len=1368 TSval=7794390 TSecr=759836506 [TCP segment of a reassembled PDU]"
"343","2018-08-23 01:54:21.777168","192.168.2.3","216.58.197.4","TLSv1.2","212","Application Data"
"344","2018-08-23 01:54:21.777391","192.168.2.3","216.58.197.4","TCP","1434","34236  >  443 [ACK] Seq=189116 Ack=4177 Win=1828 Len=1368 TSval=7794390 TSecr=759836506 [TCP segment of a reassembled PDU]"
"345","2018-08-23 01:54:21.777394","192.168.2.3","216.58.197.4","TLSv1.2","155","Application Data"
"350","2018-08-23 01:54:21.831736","192.168.2.3","216.58.197.4","TCP","66","34236  >  443 [ACK] Seq=190573 Ack=4564 Win=1828 Len=0 TSval=7794396 TSecr=759836625"
"351","2018-08-23 01:54:21.871353","192.168.2.3","216.58.197.4","TCP","1434","34236  >  443 [ACK] Seq=190573 Ack=4564 Win=1828 Len=1368 TSval=7794400 TSecr=759836625 [TCP segment of a reassembled PDU]"
"352","2018-08-23 01:54:21.871685","192.168.2.3","216.58.197.4","TCP","1434","34236  >  443 [ACK] Seq=191941 Ack=4564 Win=1828 Len=1368 TSval=7794400 TSecr=759836625 [TCP segment of a reassembled PDU]"
"353","2018-08-23 01:54:21.871688","192.168.2.3","216.58.197.4","TLSv1.2","212","Application Data"
"354","2018-08-23 01:54:21.872106","192.168.2.3","216.58.197.4","TCP","1434","34236  >  443 [ACK] Seq=193455 Ack=4564 Win=1828 Len=1368 TSval=7794400 TSecr=759836625 [TCP segment of a reassembled PDU]"
"355","2018-08-23 01:54:21.872109","192.168.2.3","216.58.197.4","TLSv1.2","155","Application Data"
"359","2018-08-23 01:54:21.969701","192.168.2.3","216.58.197.4","TCP","1434","34236  >  443 [ACK] Seq=194912 Ack=4564 Win=1828 Len=1368 TSval=7794410 TSecr=759836672 [TCP segment of a reassembled PDU]"
"360","2018-08-23 01:54:21.969707","192.168.2.3","216.58.197.4","TCP","1434","34236  >  443 [ACK] Seq=196280 Ack=4564 Win=1828 Len=1368 TSval=7794410 TSecr=759836672 [TCP segment of a reassembled PDU]"
"361","2018-08-23 01:54:21.969708","192.168.2.3","216.58.197.4","TLSv1.2","212","Application Data"
"362","2018-08-23 01:54:21.970025","192.168.2.3","216.58.197.4","TCP","1434","34236  >  443 [ACK] Seq=197794 Ack=4564 Win=1828 Len=1368 TSval=7794410 TSecr=759836672 [TCP segment of a reassembled PDU]"
"363","2018-08-23 01:54:21.970026","192.168.2.3","216.58.197.4","TLSv1.2","155","Application Data"
"367","2018-08-23 01:54:22.066102","192.168.2.3","216.58.197.4","TCP","1434","34236  >  443 [ACK] Seq=199251 Ack=4564 Win=1828 Len=1368 TSval=7794420 TSecr=759836770 [TCP segment of a reassembled PDU]"
"368","2018-08-23 01:54:22.067536","192.168.2.3","216.58.197.4","TCP","1434","34236  >  443 [ACK] Seq=200619 Ack=4564 Win=1828 Len=1368 TSval=7794420 TSecr=759836770 [TCP segment of a reassembled PDU]"
"369","2018-08-23 01:54:22.067540","192.168.2.3","216.58.197.4","TLSv1.2","212","Application Data"
"370","2018-08-23 01:54:22.067541","192.168.2.3","216.58.197.4","TCP","1434","34236  >  443 [ACK] Seq=202133 Ack=4564 Win=1828 Len=1368 TSval=7794420 TSecr=759836770 [TCP segment of a reassembled PDU]"
"371","2018-08-23 01:54:22.067542","192.168.2.3","216.58.197.4","TLSv1.2","155","Application Data"
"376","2018-08-23 01:54:22.125757","192.168.2.3","216.58.197.4","TCP","66","34236  >  443 [ACK] Seq=203590 Ack=4711 Win=1828 Len=0 TSval=7794426 TSecr=759836888"
"377","2018-08-23 01:54:22.162464","192.168.2.3","216.58.197.4","TCP","1434","34236  >  443 [ACK] Seq=203590 Ack=4711 Win=1828 Len=1368 TSval=7794429 TSecr=759836888 [TCP segment of a reassembled PDU]"
"378","2018-08-23 01:54:22.162654","192.168.2.3","216.58.197.4","TCP","1434","34236  >  443 [ACK] Seq=204958 Ack=4711 Win=1828 Len=1368 TSval=7794429 TSecr=759836888 [TCP segment of a reassembled PDU]"
"379","2018-08-23 01:54:22.162658","192.168.2.3","216.58.197.4","TLSv1.2","212","Application Data"
"380","2018-08-23 01:54:22.162832","192.168.2.3","216.58.197.4","TCP","1434","34236  >  443 [ACK] Seq=206472 Ack=4711 Win=1828 Len=1368 TSval=7794429 TSecr=759836888 [TCP segment of a reassembled PDU]"
"381","2018-08-23 01:54:22.162834","192.168.2.3","216.58.197.4","TLSv1.2","155","Application Data"
"384","2018-08-23 01:54:22.212497","192.168.2.3","216.58.197.4","TCP","66","34236  >  443 [ACK] Seq=207929 Ack=4844 Win=1828 Len=0 TSval=7794434 TSecr=759837007"
"386","2018-08-23 01:54:22.241285","192.168.2.3","216.58.197.4","TCP","66","34236  >  443 [ACK] Seq=207929 Ack=5012 Win=1828 Len=0 TSval=7794437 TSecr=759837028"
"387","2018-08-23 01:54:22.270291","192.168.2.3","216.58.197.4","TCP","1434","34236  >  443 [ACK] Seq=207929 Ack=5012 Win=1828 Len=1368 TSval=7794440 TSecr=759837028 [TCP segment of a reassembled PDU]"
"388","2018-08-23 01:54:22.270563","192.168.2.3","216.58.197.4","TCP","1434","34236  >  443 [ACK] Seq=209297 Ack=5012 Win=1828 Len=1368 TSval=7794440 TSecr=759837028 [TCP segment of a reassembled PDU]"
"389","2018-08-23 01:54:22.270566","192.168.2.3","216.58.197.4","TLSv1.2","212","Application Data"
"390","2018-08-23 01:54:22.273660","192.168.2.3","216.58.197.4","TCP","1434","34236  >  443 [ACK] Seq=210811 Ack=5012 Win=1828 Len=1368 TSval=7794440 TSecr=759837028 [TCP segment of a reassembled PDU]"
"391","2018-08-23 01:54:22.273662","192.168.2.3","216.58.197.4","TLSv1.2","155","Application Data"
"396","2018-08-23 01:54:22.321831","192.168.2.3","216.58.197.4","TCP","66","34236  >  443 [ACK] Seq=212268 Ack=5235 Win=1828 Len=0 TSval=7794445 TSecr=759837116"
"397","2018-08-23 01:54:22.367121","192.168.2.3","216.58.197.4","TCP","1434","34236  >  443 [ACK] Seq=212268 Ack=5235 Win=1828 Len=1368 TSval=7794449 TSecr=759837116 [TCP segment of a reassembled PDU]"
"398","2018-08-23 01:54:22.367128","192.168.2.3","216.58.197.4","TCP","1434","34236  >  443 [ACK] Seq=213636 Ack=5235 Win=1828 Len=1368 TSval=7794449 TSecr=759837116 [TCP segment of a reassembled PDU]"
"399","2018-08-23 01:54:22.367129","192.168.2.3","216.58.197.4","TLSv1.2","212","Application Data"
"400","2018-08-23 01:54:22.367481","192.168.2.3","216.58.197.4","TCP","1434","34236  >  443 [ACK] Seq=215150 Ack=5235 Win=1828 Len=1368 TSval=7794450 TSecr=759837116 [TCP segment of a reassembled PDU]"
"401","2018-08-23 01:54:22.367484","192.168.2.3","216.58.197.4","TLSv1.2","155","Application Data"
"407","2018-08-23 01:54:22.420081","192.168.2.3","216.58.197.4","TCP","66","34236  >  443 [ACK] Seq=216607 Ack=5796 Win=1828 Len=0 TSval=7794455 TSecr=759837215"
"408","2018-08-23 01:54:22.482884","192.168.2.3","216.58.197.4","TCP","1434","34236  >  443 [ACK] Seq=216607 Ack=5796 Win=1828 Len=1368 TSval=7794461 TSecr=759837215 [TCP segment of a reassembled PDU]"
"409","2018-08-23 01:54:22.482889","192.168.2.3","216.58.197.4","TCP","1434","34236  >  443 [ACK] Seq=217975 Ack=5796 Win=1828 Len=1368 TSval=7794461 TSecr=759837215 [TCP segment of a reassembled PDU]"
"410","2018-08-23 01:54:22.482890","192.168.2.3","216.58.197.4","TLSv1.2","212","Application Data"
"411","2018-08-23 01:54:22.483380","192.168.2.3","216.58.197.4","TCP","1434","34236  >  443 [ACK] Seq=219489 Ack=5796 Win=1828 Len=1368 TSval=7794461 TSecr=759837215 [TCP segment of a reassembled PDU]"
"412","2018-08-23 01:54:22.483383","192.168.2.3","216.58.197.4","TLSv1.2","155","Application Data"
"416","2018-08-23 01:54:22.580911","192.168.2.3","216.58.197.4","TCP","1434","34236  >  443 [ACK] Seq=220946 Ack=5796 Win=1828 Len=1368 TSval=7794471 TSecr=759837283 [TCP segment of a reassembled PDU]"
"417","2018-08-23 01:54:22.580916","192.168.2.3","216.58.197.4","TCP","1434","34236  >  443 [ACK] Seq=222314 Ack=5796 Win=1828 Len=1368 TSval=7794471 TSecr=759837283 [TCP segment of a reassembled PDU]"
"418","2018-08-23 01:54:22.580917","192.168.2.3","216.58.197.4","TLSv1.2","212","Application Data"
"419","2018-08-23 01:54:22.581202","192.168.2.3","216.58.197.4","TCP","1434","34236  >  443 [ACK] Seq=223828 Ack=5796 Win=1828 Len=1368 TSval=7794471 TSecr=759837283 [TCP segment of a reassembled PDU]"
"420","2018-08-23 01:54:22.581206","192.168.2.3","216.58.197.4","TLSv1.2","155","Application Data"
"425","2018-08-23 01:54:22.629806","192.168.2.3","216.58.197.4","TCP","66","34236  >  443 [ACK] Seq=225285 Ack=6086 Win=1828 Len=0 TSval=7794476 TSecr=759837424"
"426","2018-08-23 01:54:22.674502","192.168.2.3","216.58.197.4","TCP","1434","34236  >  443 [ACK] Seq=225285 Ack=6086 Win=1828 Len=1368 TSval=7794480 TSecr=759837424 [TCP segment of a reassembled PDU]"
"427","2018-08-23 01:54:22.674508","192.168.2.3","216.58.197.4","TCP","1434","34236  >  443 [ACK] Seq=226653 Ack=6086 Win=1828 Len=1368 TSval=7794480 TSecr=759837424 [TCP segment of a reassembled PDU]"
"428","2018-08-23 01:54:22.674509","192.168.2.3","216.58.197.4","TLSv1.2","212","Application Data"
"429","2018-08-23 01:54:22.674950","192.168.2.3","216.58.197.4","TCP","1434","34236  >  443 [ACK] Seq=228167 Ack=6086 Win=1828 Len=1368 TSval=7794480 TSecr=759837424 [TCP segment of a reassembled PDU]"
"430","2018-08-23 01:54:22.674953","192.168.2.3","216.58.197.4","TLSv1.2","155","Application Data"
"431","2018-08-23 01:54:22.675454","192.168.2.3","216.58.197.4","TLSv1.2","809","Application Data"
"432","2018-08-23 01:54:22.675599","192.168.2.3","216.58.197.4","TLSv1.2","102","Application Data"
"439","2018-08-23 01:54:22.707020","192.168.2.3","216.58.197.4","TCP","66","34236  >  443 [ACK] Seq=230403 Ack=7088 Win=1828 Len=0 TSval=7794484 TSecr=759837500"
"441","2018-08-23 01:54:22.957234","192.168.2.3","216.58.197.4","TCP","66","34236  >  443 [ACK] Seq=230403 Ack=7188 Win=1828 Len=0 TSval=7794509 TSecr=759837719"
"444","2018-08-23 01:54:22.972053","192.168.2.3","216.58.197.4","TCP","66","34236  >  443 [ACK] Seq=230403 Ack=8646 Win=1828 Len=0 TSval=7794510 TSecr=759837766"
"449","2018-08-23 01:54:23.142295","192.168.2.3","216.58.197.4","TCP","66","34236  >  443 [ACK] Seq=230403 Ack=10589 Win=1828 Len=0 TSval=7794527 TSecr=759837936"
"450","2018-08-23 01:54:23.142298","192.168.2.3","216.58.197.4","TCP","66","34236  >  443 [ACK] Seq=230403 Ack=12376 Win=1828 Len=0 TSval=7794527 TSecr=759837936"
"455","2018-08-23 01:54:23.144939","192.168.2.3","216.58.197.4","TCP","66","34236  >  443 [ACK] Seq=230403 Ack=14118 Win=1828 Len=0 TSval=7794527 TSecr=759837939"
"456","2018-08-23 01:54:23.145330","192.168.2.3","216.58.197.4","TCP","66","34236  >  443 [ACK] Seq=230403 Ack=15976 Win=1828 Len=0 TSval=7794527 TSecr=759837939"
"461","2018-08-23 01:54:23.148549","192.168.2.3","216.58.197.4","TCP","66","34236  >  443 [ACK] Seq=230403 Ack=17798 Win=1828 Len=0 TSval=7794528 TSecr=759837942"
"462","2018-08-23 01:54:23.148926","192.168.2.3","216.58.197.4","TCP","66","34236  >  443 [ACK] Seq=230403 Ack=19562 Win=1828 Len=0 TSval=7794528 TSecr=759837942"
"465","2018-08-23 01:54:23.151643","192.168.2.3","216.58.197.4","TCP","66","34236  >  443 [ACK] Seq=230403 Ack=21433 Win=1828 Len=0 TSval=7794528 TSecr=759837946"
"474","2018-08-23 01:54:23.176569","192.168.2.3","216.58.197.4","TCP","66","34236  >  443 [ACK] Seq=230403 Ack=23265 Win=1828 Len=0 TSval=7794531 TSecr=759837970"
"475","2018-08-23 01:54:23.177396","192.168.2.3","216.58.197.4","TCP","66","34236  >  443 [ACK] Seq=230403 Ack=26101 Win=1828 Len=0 TSval=7794531 TSecr=759837970"
"481","2018-08-23 01:54:23.178640","192.168.2.3","216.58.197.4","TCP","66","34236  >  443 [ACK] Seq=230403 Ack=28937 Win=1828 Len=0 TSval=7794531 TSecr=759837970"
"482","2018-08-23 01:54:23.178987","192.168.2.3","216.58.197.4","TCP","66","34236  >  443 [ACK] Seq=230403 Ack=31769 Win=1828 Len=0 TSval=7794531 TSecr=759837970"
"487","2018-08-23 01:54:23.179937","192.168.2.3","216.58.197.4","TCP","66","34236  >  443 [ACK] Seq=230403 Ack=33458 Win=1828 Len=0 TSval=7794531 TSecr=759837973"
"488","2018-08-23 01:54:23.180901","192.168.2.3","216.58.197.4","TCP","66","34236  >  443 [ACK] Seq=230403 Ack=36967 Win=1828 Len=0 TSval=7794531 TSecr=759837973"
"499","2018-08-23 01:54:23.186002","192.168.2.3","216.58.197.4","TCP","66","34236  >  443 [ACK] Seq=230403 Ack=38848 Win=1828 Len=0 TSval=7794531 TSecr=759837975"
"500","2018-08-23 01:54:23.186008","192.168.2.3","216.58.197.4","TCP","66","34236  >  443 [ACK] Seq=230403 Ack=40625 Win=1828 Len=0 TSval=7794531 TSecr=759837975"
"503","2018-08-23 01:54:23.188258","192.168.2.3","216.58.197.4","TCP","66","34236  >  443 [ACK] Seq=230403 Ack=42495 Win=1828 Len=0 TSval=7794532 TSecr=759837977"
"508","2018-08-23 01:54:23.191127","192.168.2.3","216.58.197.4","TCP","66","34236  >  443 [ACK] Seq=230403 Ack=44354 Win=1828 Len=0 TSval=7794532 TSecr=759837979"
"509","2018-08-23 01:54:23.191131","192.168.2.3","216.58.197.4","TCP","66","34236  >  443 [ACK] Seq=230403 Ack=46278 Win=1828 Len=0 TSval=7794532 TSecr=759837979"
"510","2018-08-23 01:54:23.191280","192.168.2.3","216.58.197.4","TCP","66","34236  >  443 [ACK] Seq=230403 Ack=49836 Win=1828 Len=0 TSval=7794532 TSecr=759837980"
"511","2018-08-23 01:54:23.195219","192.168.2.3","216.58.197.4","TCP","66","34236  >  443 [ACK] Seq=230403 Ack=51711 Win=1828 Len=0 TSval=7794532 TSecr=759837982"
"512","2018-08-23 01:54:23.195223","192.168.2.3","216.58.197.4","TCP","66","34236  >  443 [ACK] Seq=230403 Ack=53540 Win=1828 Len=0 TSval=7794532 TSecr=759837984"
"513","2018-08-23 01:54:23.195224","192.168.2.3","216.58.197.4","TCP","66","34236  >  443 [ACK] Seq=230403 Ack=54729 Win=1828 Len=0 TSval=7794532 TSecr=759837984"
"518","2018-08-23 01:54:23.228609","192.168.2.3","216.58.197.4","TCP","66","34236  >  443 [ACK] Seq=230403 Ack=55155 Win=1828 Len=0 TSval=7794536 TSecr=759838004"
"520","2018-08-23 01:54:23.236389","192.168.2.3","216.58.197.4","TLSv1.2","104","Application Data"
"521","2018-08-23 01:54:23.236571","192.168.2.3","216.58.197.4","TCP","78","[TCP Dup ACK 518#1] 34236  >  443 [ACK] Seq=230441 Ack=55155 Win=1828 Len=0 TSval=7794537 TSecr=759838027 SLE=55125 SRE=55155"
"536","2018-08-23 01:54:33.335778","192.168.2.3","216.58.197.14","TLSv1.2","161","Application Data"
"537","2018-08-23 01:54:33.335783","192.168.2.3","216.58.197.14","TLSv1.2","104","Application Data"
"538","2018-08-23 01:54:33.335784","192.168.2.3","216.58.197.14","TLSv1.2","583","Application Data"
"543","2018-08-23 01:54:33.375874","192.168.2.3","216.58.197.14","TCP","66","41142  >  443 [ACK] Seq=651 Ack=39 Win=497 Len=0 TSval=7795551 TSecr=932856870"
"548","2018-08-23 01:54:33.418801","192.168.2.3","216.58.197.14","TCP","66","41142  >  443 [ACK] Seq=651 Ack=107 Win=497 Len=0 TSval=7795555 TSecr=932856947"
"549","2018-08-23 01:54:33.419122","192.168.2.3","216.58.197.14","TCP","66","41142  >  443 [ACK] Seq=651 Ack=237 Win=513 Len=0 TSval=7795555 TSecr=932856947"
"550","2018-08-23 01:54:33.419124","192.168.2.3","216.58.197.14","TCP","66","41142  >  443 [ACK] Seq=651 Ack=428 Win=530 Len=0 TSval=7795555 TSecr=932856947"
"551","2018-08-23 01:54:33.420313","192.168.2.3","216.58.197.14","TLSv1.2","104","Application Data"
"553","2018-08-23 01:54:33.708913","192.168.2.3","216.58.197.10","TCP","66","47764  >  443 [ACK] Seq=1 Ack=1 Win=495 Len=0 TSval=7795584 TSecr=519229061"
