"No.","Time","Source","Destination","Protocol","Length","Info"
"3","2018-08-23 01:51:06.212998","192.168.2.3","216.58.197.4","TLSv1.2","157","Application Data"
"4","2018-08-23 01:51:06.213180","192.168.2.3","216.58.197.4","TLSv1.2","104","Application Data"
"5","2018-08-23 01:51:06.216788","192.168.2.3","216.58.197.4","TLSv1.2","159","Application Data"
"9","2018-08-23 01:51:06.226133","192.168.2.3","216.58.197.4","TCP","1434","34236  >  443 [ACK] Seq=223 Ack=39 Win=848 Len=1368 TSval=7774836 TSecr=759641013 [TCP segment of a reassembled PDU]"
"10","2018-08-23 01:51:06.226412","192.168.2.3","216.58.197.4","TCP","1434","34236  >  443 [ACK] Seq=1591 Ack=39 Win=848 Len=1368 TSval=7774836 TSecr=759641013 [TCP segment of a reassembled PDU]"
"11","2018-08-23 01:51:06.226415","192.168.2.3","216.58.197.4","TLSv1.2","212","Application Data"
"12","2018-08-23 01:51:06.226416","192.168.2.3","216.58.197.4","TCP","1434","34236  >  443 [ACK] Seq=3105 Ack=39 Win=848 Len=1368 TSval=7774836 TSecr=759641013 [TCP segment of a reassembled PDU]"
"13","2018-08-23 01:51:06.226534","192.168.2.3","216.58.197.4","TLSv1.2","182","Application Data"
"14","2018-08-23 01:51:06.226952","192.168.2.3","216.58.197.4","TCP","1434","34236  >  443 [ACK] Seq=4589 Ack=39 Win=848 Len=1368 TSval=7774836 TSecr=759641013 [TCP segment of a reassembled PDU]"
"15","2018-08-23 01:51:06.226968","192.168.2.3","216.58.197.4","TCP","1434","34236  >  443 [ACK] Seq=5957 Ack=39 Win=848 Len=1368 TSval=7774836 TSecr=759641013 [TCP segment of a reassembled PDU]"
"16","2018-08-23 01:51:06.226970","192.168.2.3","216.58.197.4","TLSv1.2","212","Application Data"
"17","2018-08-23 01:51:06.227325","192.168.2.3","216.58.197.4","TCP","1434","34236  >  443 [ACK] Seq=7471 Ack=39 Win=848 Len=1368 TSval=7774836 TSecr=759641013 [TCP segment of a reassembled PDU]"
"23","2018-08-23 01:51:06.232148","192.168.2.3","216.58.197.4","TLSv1.2","1434","Application Data [TCP segment of a reassembled PDU]"
"24","2018-08-23 01:51:06.232151","192.168.2.3","216.58.197.4","TCP","1434","34236  >  443 [ACK] Seq=10207 Ack=39 Win=848 Len=1368 TSval=7774836 TSecr=759641026 [TCP segment of a reassembled PDU]"
"25","2018-08-23 01:51:06.232508","192.168.2.3","216.58.197.4","TLSv1.2","1434","Application Data [TCP segment of a reassembled PDU]"
"26","2018-08-23 01:51:06.232904","192.168.2.3","216.58.197.4","TLSv1.2","1434","Application Data [TCP segment of a reassembled PDU]"
"27","2018-08-23 01:51:06.232907","192.168.2.3","216.58.197.4","TCP","1434","34236  >  443 [ACK] Seq=14311 Ack=39 Win=848 Len=1368 TSval=7774836 TSecr=759641026 [TCP segment of a reassembled PDU]"
"28","2018-08-23 01:51:06.233291","192.168.2.3","216.58.197.4","TLSv1.2","1434","Application Data [TCP segment of a reassembled PDU]"
"29","2018-08-23 01:51:06.233668","192.168.2.3","216.58.197.4","TLSv1.2","1434","Application Data [TCP segment of a reassembled PDU]"
"30","2018-08-23 01:51:06.233670","192.168.2.3","216.58.197.4","TCP","1434","34236  >  443 [ACK] Seq=18415 Ack=39 Win=848 Len=1368 TSval=7774836 TSecr=759641026 [TCP segment of a reassembled PDU]"
"31","2018-08-23 01:51:06.234059","192.168.2.3","216.58.197.4","TLSv1.2","1434","Application Data [TCP segment of a reassembled PDU]"
"32","2018-08-23 01:51:06.234299","192.168.2.3","216.58.197.4","TLSv1.2","1434","Application Data [TCP segment of a reassembled PDU]"
"33","2018-08-23 01:51:06.234301","192.168.2.3","216.58.197.4","TCP","1434","34236  >  443 [ACK] Seq=22519 Ack=39 Win=848 Len=1368 TSval=7774836 TSecr=759641027 [TCP segment of a reassembled PDU]"
"34","2018-08-23 01:51:06.234655","192.168.2.3","216.58.197.4","TLSv1.2","1434","Application Data [TCP segment of a reassembled PDU]"
"35","2018-08-23 01:51:06.234994","192.168.2.3","216.58.197.4","TLSv1.2","1434","Application Data [TCP segment of a reassembled PDU]"
"36","2018-08-23 01:51:06.234998","192.168.2.3","216.58.197.4","TCP","1434","34236  >  443 [ACK] Seq=26623 Ack=39 Win=848 Len=1368 TSval=7774837 TSecr=759641027 [TCP segment of a reassembled PDU]"
"37","2018-08-23 01:51:06.235307","192.168.2.3","216.58.197.4","TLSv1.2","1434","Application Data [TCP segment of a reassembled PDU]"
"46","2018-08-23 01:51:06.283882","192.168.2.3","216.58.197.4","TLSv1.2","1434","Application Data [TCP segment of a reassembled PDU]"
"47","2018-08-23 01:51:06.284114","192.168.2.3","216.58.197.4","TCP","1434","34236  >  443 [ACK] Seq=30727 Ack=39 Win=848 Len=1368 TSval=7774841 TSecr=759641032 [TCP segment of a reassembled PDU]"
"48","2018-08-23 01:51:06.284257","192.168.2.3","216.58.197.4","TCP","1434","34236  >  443 [ACK] Seq=32095 Ack=39 Win=848 Len=1368 TSval=7774841 TSecr=759641032 [TCP segment of a reassembled PDU]"
"49","2018-08-23 01:51:06.284675","192.168.2.3","216.58.197.4","TLSv1.2","1434","Application Data [TCP segment of a reassembled PDU]"
"50","2018-08-23 01:51:06.285050","192.168.2.3","216.58.197.4","TLSv1.2","1434","Application Data [TCP segment of a reassembled PDU]"
"51","2018-08-23 01:51:06.285222","192.168.2.3","216.58.197.4","TCP","1434","34236  >  443 [ACK] Seq=36199 Ack=39 Win=848 Len=1368 TSval=7774842 TSecr=759641033 [TCP segment of a reassembled PDU]"
"52","2018-08-23 01:51:06.285695","192.168.2.3","216.58.197.4","TLSv1.2","1434","Application Data [TCP segment of a reassembled PDU]"
"53","2018-08-23 01:51:06.285960","192.168.2.3","216.58.197.4","TLSv1.2","1434","Application Data [TCP segment of a reassembled PDU]"
"54","2018-08-23 01:51:06.285962","192.168.2.3","216.58.197.4","TCP","1434","34236  >  443 [ACK] Seq=40303 Ack=39 Win=848 Len=1368 TSval=7774842 TSecr=759641033 [TCP segment of a reassembled PDU]"
"55","2018-08-23 01:51:06.286287","192.168.2.3","216.58.197.4","TLSv1.2","1434","Application Data [TCP segment of a reassembled PDU]"
"56","2018-08-23 01:51:06.286290","192.168.2.3","216.58.197.4","TLSv1.2","1434","Application Data [TCP segment of a reassembled PDU]"
"57","2018-08-23 01:51:06.286618","192.168.2.3","216.58.197.4","TCP","1434","34236  >  443 [ACK] Seq=44407 Ack=39 Win=848 Len=1368 TSval=7774842 TSecr=759641034 [TCP segment of a reassembled PDU]"
"58","2018-08-23 01:51:06.286809","192.168.2.3","216.58.197.4","TLSv1.2","1434","Application Data [TCP segment of a reassembled PDU]"
"60","2018-08-23 01:51:06.288585","192.168.2.3","216.58.197.4","TLSv1.2","1434","Application Data [TCP segment of a reassembled PDU]"
"61","2018-08-23 01:51:06.288588","192.168.2.3","216.58.197.4","TCP","1434","34236  >  443 [ACK] Seq=48511 Ack=39 Win=848 Len=1368 TSval=7774842 TSecr=759641034 [TCP segment of a reassembled PDU]"
"62","2018-08-23 01:51:06.288590","192.168.2.3","216.58.197.4","TLSv1.2","1434","Application Data [TCP segment of a reassembled PDU]"
"63","2018-08-23 01:51:06.288591","192.168.2.3","216.58.197.4","TLSv1.2","1434","Application Data [TCP segment of a reassembled PDU]"
"64","2018-08-23 01:51:06.288592","192.168.2.3","216.58.197.4","TCP","1434","34236  >  443 [ACK] Seq=52615 Ack=39 Win=848 Len=1368 TSval=7774842 TSecr=759641035 [TCP segment of a reassembled PDU]"
"65","2018-08-23 01:51:06.288594","192.168.2.3","216.58.197.4","TLSv1.2","1434","Application Data [TCP segment of a reassembled PDU]"
"66","2018-08-23 01:51:06.288595","192.168.2.3","216.58.197.4","TLSv1.2","1434","Application Data [TCP segment of a reassembled PDU]"
"69","2018-08-23 01:51:06.290081","192.168.2.3","216.58.197.4","TCP","1434","34236  >  443 [ACK] Seq=56719 Ack=39 Win=848 Len=1368 TSval=7774842 TSecr=759641084 [TCP segment of a reassembled PDU]"
"70","2018-08-23 01:51:06.290084","192.168.2.3","216.58.197.4","TCP","1434","34236  >  443 [ACK] Seq=58087 Ack=39 Win=848 Len=1368 TSval=7774842 TSecr=759641084 [TCP segment of a reassembled PDU]"
"72","2018-08-23 01:51:06.290465","192.168.2.3","216.58.197.4","TLSv1.2","1434","Application Data [TCP segment of a reassembled PDU]"
"75","2018-08-23 01:51:06.292321","192.168.2.3","216.58.197.4","TCP","1434","34236  >  443 [ACK] Seq=60823 Ack=39 Win=848 Len=1368 TSval=7774842 TSecr=759641084 [TCP segment of a reassembled PDU]"
"76","2018-08-23 01:51:06.292451","192.168.2.3","216.58.197.4","TLSv1.2","1434","Application Data [TCP segment of a reassembled PDU]"
"77","2018-08-23 01:51:06.292609","192.168.2.3","216.58.197.4","TCP","1434","34236  >  443 [ACK] Seq=63559 Ack=39 Win=848 Len=1368 TSval=7774842 TSecr=759641085 [TCP segment of a reassembled PDU]"
"79","2018-08-23 01:51:06.292756","192.168.2.3","216.58.197.4","TLSv1.2","975","Application Data, Application Data"
"87","2018-08-23 01:51:06.377826","192.168.2.3","216.58.197.4","TCP","1434","34236  >  443 [ACK] Seq=65836 Ack=39 Win=848 Len=1368 TSval=7774849 TSecr=759641092 [TCP segment of a reassembled PDU]"
"88","2018-08-23 01:51:06.378015","192.168.2.3","216.58.197.4","TCP","1434","34236  >  443 [ACK] Seq=67204 Ack=39 Win=848 Len=1368 TSval=7774850 TSecr=759641092 [TCP segment of a reassembled PDU]"
"89","2018-08-23 01:51:06.378019","192.168.2.3","216.58.197.4","TLSv1.2","212","Application Data"
"90","2018-08-23 01:51:06.378711","192.168.2.3","216.58.197.4","TCP","1434","34236  >  443 [ACK] Seq=68718 Ack=39 Win=848 Len=1368 TSval=7774850 TSecr=759641092 [TCP segment of a reassembled PDU]"
"91","2018-08-23 01:51:06.378715","192.168.2.3","216.58.197.4","TLSv1.2","155","Application Data"
"95","2018-08-23 01:51:06.474604","192.168.2.3","216.58.197.4","TCP","1434","34236  >  443 [ACK] Seq=70175 Ack=39 Win=848 Len=1368 TSval=7774859 TSecr=759641179 [TCP segment of a reassembled PDU]"
"96","2018-08-23 01:51:06.474801","192.168.2.3","216.58.197.4","TCP","1434","34236  >  443 [ACK] Seq=71543 Ack=39 Win=848 Len=1368 TSval=7774859 TSecr=759641179 [TCP segment of a reassembled PDU]"
"97","2018-08-23 01:51:06.474805","192.168.2.3","216.58.197.4","TLSv1.2","212","Application Data"
"98","2018-08-23 01:51:06.475086","192.168.2.3","216.58.197.4","TCP","1434","34236  >  443 [ACK] Seq=73057 Ack=39 Win=848 Len=1368 TSval=7774859 TSecr=759641179 [TCP segment of a reassembled PDU]"
"99","2018-08-23 01:51:06.475088","192.168.2.3","216.58.197.4","TLSv1.2","155","Application Data"
"105","2018-08-23 01:51:06.513468","192.168.2.3","216.58.197.4","TCP","66","34236  >  443 [ACK] Seq=74514 Ack=226 Win=848 Len=0 TSval=7774864 TSecr=759641304"
"106","2018-08-23 01:51:06.582232","192.168.2.3","216.58.197.4","TCP","1434","34236  >  443 [ACK] Seq=74514 Ack=226 Win=848 Len=1368 TSval=7774871 TSecr=759641304 [TCP segment of a reassembled PDU]"
"107","2018-08-23 01:51:06.583410","192.168.2.3","216.58.197.4","TCP","1434","34236  >  443 [ACK] Seq=75882 Ack=226 Win=848 Len=1368 TSval=7774871 TSecr=759641304 [TCP segment of a reassembled PDU]"
"108","2018-08-23 01:51:06.583412","192.168.2.3","216.58.197.4","TLSv1.2","212","Application Data"
"109","2018-08-23 01:51:06.583413","192.168.2.3","216.58.197.4","TCP","1434","34236  >  443 [ACK] Seq=77396 Ack=226 Win=848 Len=1368 TSval=7774871 TSecr=759641304 [TCP segment of a reassembled PDU]"
"110","2018-08-23 01:51:06.583487","192.168.2.3","216.58.197.4","TLSv1.2","155","Application Data"
"114","2018-08-23 01:51:06.664610","192.168.2.3","216.58.197.4","TCP","66","34236  >  443 [ACK] Seq=78853 Ack=401 Win=848 Len=0 TSval=7774879 TSecr=759641412"
"115","2018-08-23 01:51:06.684522","192.168.2.3","216.58.197.4","TCP","1434","34236  >  443 [ACK] Seq=78853 Ack=401 Win=848 Len=1368 TSval=7774881 TSecr=759641412 [TCP segment of a reassembled PDU]"
"116","2018-08-23 01:51:06.684528","192.168.2.3","216.58.197.4","TCP","1434","34236  >  443 [ACK] Seq=80221 Ack=401 Win=848 Len=1368 TSval=7774881 TSecr=759641412 [TCP segment of a reassembled PDU]"
"117","2018-08-23 01:51:06.684529","192.168.2.3","216.58.197.4","TLSv1.2","212","Application Data"
"118","2018-08-23 01:51:06.684530","192.168.2.3","216.58.197.4","TCP","1434","34236  >  443 [ACK] Seq=81735 Ack=401 Win=848 Len=1368 TSval=7774881 TSecr=759641412 [TCP segment of a reassembled PDU]"
"119","2018-08-23 01:51:06.684531","192.168.2.3","216.58.197.4","TLSv1.2","155","Application Data"
"124","2018-08-23 01:51:06.771830","192.168.2.3","216.58.197.4","TCP","66","34236  >  443 [ACK] Seq=83192 Ack=548 Win=846 Len=0 TSval=7774890 TSecr=759641566"
"125","2018-08-23 01:51:06.780830","192.168.2.3","216.58.197.4","TCP","1434","34236  >  443 [ACK] Seq=83192 Ack=548 Win=848 Len=1368 TSval=7774891 TSecr=759641566 [TCP segment of a reassembled PDU]"
"126","2018-08-23 01:51:06.780971","192.168.2.3","216.58.197.4","TCP","1434","34236  >  443 [ACK] Seq=84560 Ack=548 Win=848 Len=1368 TSval=7774891 TSecr=759641566 [TCP segment of a reassembled PDU]"
"127","2018-08-23 01:51:06.780978","192.168.2.3","216.58.197.4","TLSv1.2","212","Application Data"
"128","2018-08-23 01:51:06.781148","192.168.2.3","216.58.197.4","TCP","1434","34236  >  443 [ACK] Seq=86074 Ack=548 Win=848 Len=1368 TSval=7774891 TSecr=759641566 [TCP segment of a reassembled PDU]"
"129","2018-08-23 01:51:06.781151","192.168.2.3","216.58.197.4","TLSv1.2","155","Application Data"
"133","2018-08-23 01:51:06.870016","192.168.2.3","216.58.197.4","TCP","1434","34236  >  443 [ACK] Seq=87531 Ack=548 Win=848 Len=1368 TSval=7774900 TSecr=759641581 [TCP segment of a reassembled PDU]"
"134","2018-08-23 01:51:06.870024","192.168.2.3","216.58.197.4","TCP","1434","34236  >  443 [ACK] Seq=88899 Ack=548 Win=848 Len=1368 TSval=7774900 TSecr=759641581 [TCP segment of a reassembled PDU]"
"135","2018-08-23 01:51:06.870025","192.168.2.3","216.58.197.4","TLSv1.2","212","Application Data"
"136","2018-08-23 01:51:06.870090","192.168.2.3","216.58.197.4","TCP","1434","34236  >  443 [ACK] Seq=90413 Ack=548 Win=848 Len=1368 TSval=7774900 TSecr=759641581 [TCP segment of a reassembled PDU]"
"137","2018-08-23 01:51:06.870091","192.168.2.3","216.58.197.4","TLSv1.2","155","Application Data"
"141","2018-08-23 01:51:06.974136","192.168.2.3","216.58.197.4","TCP","1434","34236  >  443 [ACK] Seq=91870 Ack=548 Win=848 Len=1368 TSval=7774910 TSecr=759641671 [TCP segment of a reassembled PDU]"
"142","2018-08-23 01:51:06.974140","192.168.2.3","216.58.197.4","TCP","1434","34236  >  443 [ACK] Seq=93238 Ack=548 Win=848 Len=1368 TSval=7774910 TSecr=759641671 [TCP segment of a reassembled PDU]"
"143","2018-08-23 01:51:06.974141","192.168.2.3","216.58.197.4","TLSv1.2","212","Application Data"
"144","2018-08-23 01:51:06.974313","192.168.2.3","216.58.197.4","TCP","1434","34236  >  443 [ACK] Seq=94752 Ack=548 Win=848 Len=1368 TSval=7774910 TSecr=759641671 [TCP segment of a reassembled PDU]"
"145","2018-08-23 01:51:06.974549","192.168.2.3","216.58.197.4","TLSv1.2","155","Application Data"
"148","2018-08-23 01:51:07.068164","192.168.2.3","216.58.197.4","TCP","1434","34236  >  443 [ACK] Seq=96209 Ack=548 Win=848 Len=1368 TSval=7774920 TSecr=759641774 [TCP segment of a reassembled PDU]"
"149","2018-08-23 01:51:07.068561","192.168.2.3","216.58.197.4","TCP","1434","34236  >  443 [ACK] Seq=97577 Ack=548 Win=848 Len=1368 TSval=7774920 TSecr=759641774 [TCP segment of a reassembled PDU]"
"150","2018-08-23 01:51:07.068565","192.168.2.3","216.58.197.4","TLSv1.2","212","Application Data"
"151","2018-08-23 01:51:07.069112","192.168.2.3","216.58.197.4","TCP","1434","34236  >  443 [ACK] Seq=99091 Ack=548 Win=848 Len=1368 TSval=7774920 TSecr=759641774 [TCP segment of a reassembled PDU]"
"152","2018-08-23 01:51:07.069114","192.168.2.3","216.58.197.4","TLSv1.2","155","Application Data"
"156","2018-08-23 01:51:07.164279","192.168.2.3","216.58.197.4","TCP","1434","34236  >  443 [ACK] Seq=100548 Ack=548 Win=848 Len=1368 TSval=7774930 TSecr=759641869 [TCP segment of a reassembled PDU]"
"157","2018-08-23 01:51:07.164729","192.168.2.3","216.58.197.4","TCP","1434","34236  >  443 [ACK] Seq=101916 Ack=548 Win=848 Len=1368 TSval=7774930 TSecr=759641869 [TCP segment of a reassembled PDU]"
"158","2018-08-23 01:51:07.164731","192.168.2.3","216.58.197.4","TLSv1.2","212","Application Data"
"159","2018-08-23 01:51:07.164732","192.168.2.3","216.58.197.4","TCP","1434","34236  >  443 [ACK] Seq=103430 Ack=548 Win=848 Len=1368 TSval=7774930 TSecr=759641869 [TCP segment of a reassembled PDU]"
"160","2018-08-23 01:51:07.164880","192.168.2.3","216.58.197.4","TLSv1.2","155","Application Data"
"164","2018-08-23 01:51:07.258380","192.168.2.3","216.58.197.4","TCP","1434","34236  >  443 [ACK] Seq=104887 Ack=548 Win=848 Len=1368 TSval=7774939 TSecr=759641965 [TCP segment of a reassembled PDU]"
"165","2018-08-23 01:51:07.258609","192.168.2.3","216.58.197.4","TCP","1434","34236  >  443 [ACK] Seq=106255 Ack=548 Win=848 Len=1368 TSval=7774939 TSecr=759641965 [TCP segment of a reassembled PDU]"
"166","2018-08-23 01:51:07.258611","192.168.2.3","216.58.197.4","TLSv1.2","212","Application Data"
"167","2018-08-23 01:51:07.258806","192.168.2.3","216.58.197.4","TCP","1434","34236  >  443 [ACK] Seq=107769 Ack=548 Win=848 Len=1368 TSval=7774939 TSecr=759641965 [TCP segment of a reassembled PDU]"
"168","2018-08-23 01:51:07.258808","192.168.2.3","216.58.197.4","TLSv1.2","155","Application Data"
"173","2018-08-23 01:51:07.380972","192.168.2.3","216.58.197.4","TCP","1434","34236  >  443 [ACK] Seq=109226 Ack=548 Win=848 Len=1368 TSval=7774951 TSecr=759642059 [TCP segment of a reassembled PDU]"
"174","2018-08-23 01:51:07.381202","192.168.2.3","216.58.197.4","TCP","1434","34236  >  443 [ACK] Seq=110594 Ack=548 Win=848 Len=1368 TSval=7774951 TSecr=759642059 [TCP segment of a reassembled PDU]"
"175","2018-08-23 01:51:07.381207","192.168.2.3","216.58.197.4","TLSv1.2","212","Application Data"
"176","2018-08-23 01:51:07.381401","192.168.2.3","216.58.197.4","TCP","1434","34236  >  443 [ACK] Seq=112108 Ack=548 Win=848 Len=1368 TSval=7774951 TSecr=759642059 [TCP segment of a reassembled PDU]"
"177","2018-08-23 01:51:07.381416","192.168.2.3","216.58.197.4","TLSv1.2","155","Application Data"
"181","2018-08-23 01:51:07.451634","192.168.2.3","216.58.197.4","TCP","1434","34236  >  443 [ACK] Seq=113565 Ack=548 Win=848 Len=1368 TSval=7774958 TSecr=759642181 [TCP segment of a reassembled PDU]"
"182","2018-08-23 01:51:07.451912","192.168.2.3","216.58.197.4","TCP","1434","34236  >  443 [ACK] Seq=114933 Ack=548 Win=848 Len=1368 TSval=7774958 TSecr=759642181 [TCP segment of a reassembled PDU]"
"183","2018-08-23 01:51:07.451915","192.168.2.3","216.58.197.4","TLSv1.2","212","Application Data"
"184","2018-08-23 01:51:07.452371","192.168.2.3","216.58.197.4","TCP","1434","34236  >  443 [ACK] Seq=116447 Ack=548 Win=848 Len=1368 TSval=7774958 TSecr=759642181 [TCP segment of a reassembled PDU]"
"185","2018-08-23 01:51:07.452374","192.168.2.3","216.58.197.4","TLSv1.2","155","Application Data"
"191","2018-08-23 01:51:07.484026","192.168.2.3","216.58.197.4","TCP","66","34236  >  443 [ACK] Seq=117904 Ack=958 Win=848 Len=0 TSval=7774962 TSecr=759642268"
"192","2018-08-23 01:51:07.548248","192.168.2.3","216.58.197.4","TCP","1434","34236  >  443 [ACK] Seq=117904 Ack=958 Win=848 Len=1368 TSval=7774968 TSecr=759642268 [TCP segment of a reassembled PDU]"
"193","2018-08-23 01:51:07.548253","192.168.2.3","216.58.197.4","TCP","1434","34236  >  443 [ACK] Seq=119272 Ack=958 Win=848 Len=1368 TSval=7774968 TSecr=759642268 [TCP segment of a reassembled PDU]"
"194","2018-08-23 01:51:07.548450","192.168.2.3","216.58.197.4","TLSv1.2","212","Application Data"
"195","2018-08-23 01:51:07.548784","192.168.2.3","216.58.197.4","TCP","1434","34236  >  443 [ACK] Seq=120786 Ack=958 Win=848 Len=1368 TSval=7774968 TSecr=759642268 [TCP segment of a reassembled PDU]"
"196","2018-08-23 01:51:07.548787","192.168.2.3","216.58.197.4","TLSv1.2","155","Application Data"
"199","2018-08-23 01:51:07.639948","192.168.2.3","216.58.197.4","TCP","1434","34236  >  443 [ACK] Seq=122243 Ack=958 Win=848 Len=1368 TSval=7774977 TSecr=759642348 [TCP segment of a reassembled PDU]"
"200","2018-08-23 01:51:07.639955","192.168.2.3","216.58.197.4","TCP","1434","34236  >  443 [ACK] Seq=123611 Ack=958 Win=848 Len=1368 TSval=7774977 TSecr=759642348 [TCP segment of a reassembled PDU]"
"201","2018-08-23 01:51:07.639956","192.168.2.3","216.58.197.4","TLSv1.2","212","Application Data"
"202","2018-08-23 01:51:07.640112","192.168.2.3","216.58.197.4","TCP","1434","34236  >  443 [ACK] Seq=125125 Ack=958 Win=848 Len=1368 TSval=7774977 TSecr=759642348 [TCP segment of a reassembled PDU]"
"203","2018-08-23 01:51:07.640230","192.168.2.3","216.58.197.4","TLSv1.2","155","Application Data"
"207","2018-08-23 01:51:07.742375","192.168.2.3","216.58.197.4","TCP","1434","34236  >  443 [ACK] Seq=126582 Ack=958 Win=848 Len=1368 TSval=7774987 TSecr=759642480 [TCP segment of a reassembled PDU]"
"208","2018-08-23 01:51:07.742381","192.168.2.3","216.58.197.4","TCP","1434","34236  >  443 [ACK] Seq=127950 Ack=958 Win=848 Len=1368 TSval=7774987 TSecr=759642480 [TCP segment of a reassembled PDU]"
"209","2018-08-23 01:51:07.742382","192.168.2.3","216.58.197.4","TLSv1.2","212","Application Data"
"210","2018-08-23 01:51:07.742717","192.168.2.3","216.58.197.4","TCP","1434","34236  >  443 [ACK] Seq=129464 Ack=958 Win=848 Len=1368 TSval=7774987 TSecr=759642480 [TCP segment of a reassembled PDU]"
"211","2018-08-23 01:51:07.742720","192.168.2.3","216.58.197.4","TLSv1.2","112","Application Data"
"217","2018-08-23 01:51:07.793127","192.168.2.3","216.58.197.4","TCP","66","34236  >  443 [ACK] Seq=130878 Ack=1361 Win=848 Len=0 TSval=7774992 TSecr=759642587"
"218","2018-08-23 01:51:07.830118","192.168.2.3","216.58.197.4","TCP","1434","34236  >  443 [ACK] Seq=130878 Ack=1361 Win=848 Len=1368 TSval=7774996 TSecr=759642587 [TCP segment of a reassembled PDU]"
"219","2018-08-23 01:51:07.830539","192.168.2.3","216.58.197.4","TCP","1434","34236  >  443 [ACK] Seq=132246 Ack=1361 Win=848 Len=1368 TSval=7774996 TSecr=759642587 [TCP segment of a reassembled PDU]"
"220","2018-08-23 01:51:07.830542","192.168.2.3","216.58.197.4","TLSv1.2","212","Application Data"
"221","2018-08-23 01:51:07.830792","192.168.2.3","216.58.197.4","TCP","1434","34236  >  443 [ACK] Seq=133760 Ack=1361 Win=848 Len=1368 TSval=7774996 TSecr=759642587 [TCP segment of a reassembled PDU]"
"222","2018-08-23 01:51:07.830794","192.168.2.3","216.58.197.4","TLSv1.2","155","Application Data"
"228","2018-08-23 01:51:07.885289","192.168.2.3","216.58.197.4","TCP","66","34236  >  443 [ACK] Seq=135217 Ack=1748 Win=848 Len=0 TSval=7775002 TSecr=759642678"
"229","2018-08-23 01:51:07.899597","192.168.2.3","216.58.197.4","TCP","1434","34236  >  443 [ACK] Seq=135217 Ack=1748 Win=848 Len=1368 TSval=7775003 TSecr=759642678 [TCP segment of a reassembled PDU]"
"230","2018-08-23 01:51:07.899967","192.168.2.3","216.58.197.4","TCP","1434","34236  >  443 [ACK] Seq=136585 Ack=1748 Win=848 Len=1368 TSval=7775003 TSecr=759642678 [TCP segment of a reassembled PDU]"
"231","2018-08-23 01:51:07.899971","192.168.2.3","216.58.197.4","TLSv1.2","212","Application Data"
"232","2018-08-23 01:51:07.900404","192.168.2.3","216.58.197.4","TCP","1434","34236  >  443 [ACK] Seq=138099 Ack=1748 Win=848 Len=1368 TSval=7775003 TSecr=759642678 [TCP segment of a reassembled PDU]"
"233","2018-08-23 01:51:07.900408","192.168.2.3","216.58.197.4","TLSv1.2","155","Application Data"
"237","2018-08-23 01:51:07.995873","192.168.2.3","216.58.197.4","TCP","1434","34236  >  443 [ACK] Seq=139556 Ack=1748 Win=848 Len=1368 TSval=7775013 TSecr=759642700 [TCP segment of a reassembled PDU]"
"238","2018-08-23 01:51:07.995877","192.168.2.3","216.58.197.4","TCP","1434","34236  >  443 [ACK] Seq=140924 Ack=1748 Win=848 Len=1368 TSval=7775013 TSecr=759642700 [TCP segment of a reassembled PDU]"
"239","2018-08-23 01:51:07.996024","192.168.2.3","216.58.197.4","TLSv1.2","212","Application Data"
"240","2018-08-23 01:51:07.996394","192.168.2.3","216.58.197.4","TCP","1434","34236  >  443 [ACK] Seq=142438 Ack=1748 Win=848 Len=1368 TSval=7775013 TSecr=759642700 [TCP segment of a reassembled PDU]"
"241","2018-08-23 01:51:07.996397","192.168.2.3","216.58.197.4","TLSv1.2","155","Application Data"
"245","2018-08-23 01:51:08.089450","192.168.2.3","216.58.197.4","TCP","1434","34236  >  443 [ACK] Seq=143895 Ack=1748 Win=848 Len=1368 TSval=7775022 TSecr=759642796 [TCP segment of a reassembled PDU]"
"246","2018-08-23 01:51:08.089456","192.168.2.3","216.58.197.4","TCP","1434","34236  >  443 [ACK] Seq=145263 Ack=1748 Win=848 Len=1368 TSval=7775022 TSecr=759642796 [TCP segment of a reassembled PDU]"
"247","2018-08-23 01:51:08.089457","192.168.2.3","216.58.197.4","TLSv1.2","212","Application Data"
"248","2018-08-23 01:51:08.089786","192.168.2.3","216.58.197.4","TCP","1434","34236  >  443 [ACK] Seq=146777 Ack=1748 Win=848 Len=1368 TSval=7775022 TSecr=759642796 [TCP segment of a reassembled PDU]"
"249","2018-08-23 01:51:08.089788","192.168.2.3","216.58.197.4","TLSv1.2","155","Application Data"
"254","2018-08-23 01:51:08.145286","192.168.2.3","216.58.197.4","TCP","66","34236  >  443 [ACK] Seq=148234 Ack=2123 Win=848 Len=0 TSval=7775028 TSecr=759642939"
"255","2018-08-23 01:51:08.184930","192.168.2.3","216.58.197.4","TCP","1434","34236  >  443 [ACK] Seq=148234 Ack=2123 Win=848 Len=1368 TSval=7775031 TSecr=759642939 [TCP segment of a reassembled PDU]"
"256","2018-08-23 01:51:08.185263","192.168.2.3","216.58.197.4","TCP","1434","34236  >  443 [ACK] Seq=149602 Ack=2123 Win=848 Len=1368 TSval=7775031 TSecr=759642939 [TCP segment of a reassembled PDU]"
"257","2018-08-23 01:51:08.185266","192.168.2.3","216.58.197.4","TLSv1.2","212","Application Data"
"258","2018-08-23 01:51:08.185495","192.168.2.3","216.58.197.4","TCP","1434","34236  >  443 [ACK] Seq=151116 Ack=2123 Win=848 Len=1368 TSval=7775031 TSecr=759642939 [TCP segment of a reassembled PDU]"
"259","2018-08-23 01:51:08.185498","192.168.2.3","216.58.197.4","TLSv1.2","155","Application Data"
"263","2018-08-23 01:51:08.280231","192.168.2.3","216.58.197.4","TCP","1434","34236  >  443 [ACK] Seq=152573 Ack=2123 Win=848 Len=1368 TSval=7775041 TSecr=759642985 [TCP segment of a reassembled PDU]"
"264","2018-08-23 01:51:08.280239","192.168.2.3","216.58.197.4","TCP","1434","34236  >  443 [ACK] Seq=153941 Ack=2123 Win=848 Len=1368 TSval=7775041 TSecr=759642985 [TCP segment of a reassembled PDU]"
"265","2018-08-23 01:51:08.280241","192.168.2.3","216.58.197.4","TLSv1.2","212","Application Data"
"266","2018-08-23 01:51:08.281025","192.168.2.3","216.58.197.4","TCP","1434","34236  >  443 [ACK] Seq=155455 Ack=2123 Win=848 Len=1368 TSval=7775041 TSecr=759642985 [TCP segment of a reassembled PDU]"
"267","2018-08-23 01:51:08.281031","192.168.2.3","216.58.197.4","TLSv1.2","155","Application Data"
"273","2018-08-23 01:51:08.331545","192.168.2.3","216.58.197.4","TCP","66","34236  >  443 [ACK] Seq=156912 Ack=2393 Win=848 Len=0 TSval=7775046 TSecr=759643122"
"274","2018-08-23 01:51:08.374591","192.168.2.3","216.58.197.4","TCP","1434","34236  >  443 [ACK] Seq=156912 Ack=2393 Win=848 Len=1368 TSval=7775051 TSecr=759643122 [TCP segment of a reassembled PDU]"
"275","2018-08-23 01:51:08.375040","192.168.2.3","216.58.197.4","TCP","1434","34236  >  443 [ACK] Seq=158280 Ack=2393 Win=848 Len=1368 TSval=7775051 TSecr=759643122 [TCP segment of a reassembled PDU]"
"276","2018-08-23 01:51:08.375042","192.168.2.3","216.58.197.4","TLSv1.2","212","Application Data"
"277","2018-08-23 01:51:08.375469","192.168.2.3","216.58.197.4","TCP","1434","34236  >  443 [ACK] Seq=159794 Ack=2393 Win=848 Len=1368 TSval=7775051 TSecr=759643122 [TCP segment of a reassembled PDU]"
"278","2018-08-23 01:51:08.375473","192.168.2.3","216.58.197.4","TLSv1.2","155","Application Data"
"284","2018-08-23 01:51:08.427062","192.168.2.3","216.58.197.4","TCP","66","34236  >  443 [ACK] Seq=161251 Ack=2790 Win=848 Len=0 TSval=7775056 TSecr=759643221"
"285","2018-08-23 01:51:08.469597","192.168.2.3","216.58.197.4","TCP","1434","34236  >  443 [ACK] Seq=161251 Ack=2790 Win=848 Len=1368 TSval=7775060 TSecr=759643221 [TCP segment of a reassembled PDU]"
"286","2018-08-23 01:51:08.469973","192.168.2.3","216.58.197.4","TCP","1434","34236  >  443 [ACK] Seq=162619 Ack=2790 Win=848 Len=1368 TSval=7775060 TSecr=759643221 [TCP segment of a reassembled PDU]"
"287","2018-08-23 01:51:08.469975","192.168.2.3","216.58.197.4","TLSv1.2","212","Application Data"
"288","2018-08-23 01:51:08.469976","192.168.2.3","216.58.197.4","TCP","1434","34236  >  443 [ACK] Seq=164133 Ack=2790 Win=848 Len=1368 TSval=7775060 TSecr=759643221 [TCP segment of a reassembled PDU]"
"289","2018-08-23 01:51:08.470234","192.168.2.3","216.58.197.4","TLSv1.2","155","Application Data"
"295","2018-08-23 01:51:08.483919","192.168.2.3","216.58.197.4","TCP","66","34236  >  443 [ACK] Seq=165590 Ack=3148 Win=848 Len=0 TSval=7775062 TSecr=759643268"
"296","2018-08-23 01:51:08.566675","192.168.2.3","216.58.197.4","TCP","1434","34236  >  443 [ACK] Seq=165590 Ack=3148 Win=848 Len=1368 TSval=7775070 TSecr=759643268 [TCP segment of a reassembled PDU]"
"297","2018-08-23 01:51:08.568036","192.168.2.3","216.58.197.4","TCP","1434","34236  >  443 [ACK] Seq=166958 Ack=3148 Win=848 Len=1368 TSval=7775070 TSecr=759643268 [TCP segment of a reassembled PDU]"
"298","2018-08-23 01:51:08.568039","192.168.2.3","216.58.197.4","TLSv1.2","212","Application Data"
"299","2018-08-23 01:51:08.568040","192.168.2.3","216.58.197.4","TCP","1434","34236  >  443 [ACK] Seq=168472 Ack=3148 Win=848 Len=1368 TSval=7775070 TSecr=759643268 [TCP segment of a reassembled PDU]"
"300","2018-08-23 01:51:08.568130","192.168.2.3","216.58.197.4","TLSv1.2","155","Application Data"
"305","2018-08-23 01:51:08.623862","192.168.2.3","216.58.197.4","TCP","66","34236  >  443 [ACK] Seq=169929 Ack=3525 Win=848 Len=0 TSval=7775075 TSecr=759643413"
"306","2018-08-23 01:51:08.664297","192.168.2.3","216.58.197.4","TCP","1434","34236  >  443 [ACK] Seq=169929 Ack=3525 Win=848 Len=1368 TSval=7775079 TSecr=759643413 [TCP segment of a reassembled PDU]"
"307","2018-08-23 01:51:08.664303","192.168.2.3","216.58.197.4","TCP","1434","34236  >  443 [ACK] Seq=171297 Ack=3525 Win=848 Len=1368 TSval=7775079 TSecr=759643413 [TCP segment of a reassembled PDU]"
"308","2018-08-23 01:51:08.664304","192.168.2.3","216.58.197.4","TLSv1.2","212","Application Data"
"309","2018-08-23 01:51:08.664580","192.168.2.3","216.58.197.4","TCP","1434","34236  >  443 [ACK] Seq=172811 Ack=3525 Win=848 Len=1368 TSval=7775079 TSecr=759643413 [TCP segment of a reassembled PDU]"
"310","2018-08-23 01:51:08.664582","192.168.2.3","216.58.197.4","TLSv1.2","155","Application Data"
"316","2018-08-23 01:51:08.714859","192.168.2.3","216.58.197.4","TCP","66","34236  >  443 [ACK] Seq=174268 Ack=3868 Win=848 Len=0 TSval=7775085 TSecr=759643509"
"317","2018-08-23 01:51:08.758643","192.168.2.3","216.58.197.4","TCP","1434","34236  >  443 [ACK] Seq=174268 Ack=3868 Win=848 Len=1368 TSval=7775089 TSecr=759643509 [TCP segment of a reassembled PDU]"
"318","2018-08-23 01:51:08.758924","192.168.2.3","216.58.197.4","TCP","1434","34236  >  443 [ACK] Seq=175636 Ack=3868 Win=848 Len=1368 TSval=7775089 TSecr=759643509 [TCP segment of a reassembled PDU]"
"319","2018-08-23 01:51:08.758929","192.168.2.3","216.58.197.4","TLSv1.2","212","Application Data"
"320","2018-08-23 01:51:08.759431","192.168.2.3","216.58.197.4","TCP","1434","34236  >  443 [ACK] Seq=177150 Ack=3868 Win=848 Len=1368 TSval=7775089 TSecr=759643509 [TCP segment of a reassembled PDU]"
"321","2018-08-23 01:51:08.759435","192.168.2.3","216.58.197.4","TLSv1.2","155","Application Data"
"325","2018-08-23 01:51:08.829188","192.168.2.3","216.58.197.4","TCP","1434","34236  >  443 [ACK] Seq=178607 Ack=3868 Win=848 Len=1368 TSval=7775096 TSecr=759643559 [TCP segment of a reassembled PDU]"
"326","2018-08-23 01:51:08.829572","192.168.2.3","216.58.197.4","TCP","1434","34236  >  443 [ACK] Seq=179975 Ack=3868 Win=848 Len=1368 TSval=7775096 TSecr=759643559 [TCP segment of a reassembled PDU]"
"327","2018-08-23 01:51:08.829576","192.168.2.3","216.58.197.4","TLSv1.2","212","Application Data"
"328","2018-08-23 01:51:08.829920","192.168.2.3","216.58.197.4","TCP","1434","34236  >  443 [ACK] Seq=181489 Ack=3868 Win=848 Len=1368 TSval=7775096 TSecr=759643559 [TCP segment of a reassembled PDU]"
"329","2018-08-23 01:51:08.829924","192.168.2.3","216.58.197.4","TLSv1.2","155","Application Data"
"335","2018-08-23 01:51:08.882023","192.168.2.3","216.58.197.4","TCP","66","34236  >  443 [ACK] Seq=182946 Ack=4178 Win=848 Len=0 TSval=7775101 TSecr=759643676"
"336","2018-08-23 01:51:08.923716","192.168.2.3","216.58.197.4","TCP","1434","34236  >  443 [ACK] Seq=182946 Ack=4178 Win=848 Len=1368 TSval=7775105 TSecr=759643676 [TCP segment of a reassembled PDU]"
"337","2018-08-23 01:51:08.924182","192.168.2.3","216.58.197.4","TCP","1434","34236  >  443 [ACK] Seq=184314 Ack=4178 Win=848 Len=1368 TSval=7775106 TSecr=759643676 [TCP segment of a reassembled PDU]"
"338","2018-08-23 01:51:08.924184","192.168.2.3","216.58.197.4","TLSv1.2","212","Application Data"
"339","2018-08-23 01:51:08.924634","192.168.2.3","216.58.197.4","TCP","1434","34236  >  443 [ACK] Seq=185828 Ack=4178 Win=848 Len=1368 TSval=7775106 TSecr=759643676 [TCP segment of a reassembled PDU]"
"340","2018-08-23 01:51:08.924636","192.168.2.3","216.58.197.4","TLSv1.2","155","Application Data"
"346","2018-08-23 01:51:08.982447","192.168.2.3","216.58.197.4","TCP","66","34236  >  443 [ACK] Seq=187285 Ack=4503 Win=848 Len=0 TSval=7775111 TSecr=759643775"
"347","2018-08-23 01:51:09.018028","192.168.2.3","216.58.197.4","TCP","1434","34236  >  443 [ACK] Seq=187285 Ack=4503 Win=848 Len=1368 TSval=7775115 TSecr=759643775 [TCP segment of a reassembled PDU]"
"348","2018-08-23 01:51:09.018391","192.168.2.3","216.58.197.4","TCP","1434","34236  >  443 [ACK] Seq=188653 Ack=4503 Win=848 Len=1368 TSval=7775115 TSecr=759643775 [TCP segment of a reassembled PDU]"
"349","2018-08-23 01:51:09.018407","192.168.2.3","216.58.197.4","TLSv1.2","212","Application Data"
"350","2018-08-23 01:51:09.018728","192.168.2.3","216.58.197.4","TCP","1434","34236  >  443 [ACK] Seq=190167 Ack=4503 Win=848 Len=1368 TSval=7775115 TSecr=759643775 [TCP segment of a reassembled PDU]"
"351","2018-08-23 01:51:09.018730","192.168.2.3","216.58.197.4","TLSv1.2","155","Application Data"
"355","2018-08-23 01:51:09.114151","192.168.2.3","216.58.197.4","TCP","1434","34236  >  443 [ACK] Seq=191624 Ack=4503 Win=848 Len=1368 TSval=7775125 TSecr=759643818 [TCP segment of a reassembled PDU]"
"356","2018-08-23 01:51:09.115080","192.168.2.3","216.58.197.4","TCP","1434","34236  >  443 [ACK] Seq=192992 Ack=4503 Win=848 Len=1368 TSval=7775125 TSecr=759643818 [TCP segment of a reassembled PDU]"
"357","2018-08-23 01:51:09.115083","192.168.2.3","216.58.197.4","TLSv1.2","212","Application Data"
"358","2018-08-23 01:51:09.115230","192.168.2.3","216.58.197.4","TCP","1434","34236  >  443 [ACK] Seq=194506 Ack=4503 Win=848 Len=1368 TSval=7775125 TSecr=759643818 [TCP segment of a reassembled PDU]"
"359","2018-08-23 01:51:09.115232","192.168.2.3","216.58.197.4","TLSv1.2","155","Application Data"
"365","2018-08-23 01:51:09.172123","192.168.2.3","216.58.197.4","TCP","66","34236  >  443 [ACK] Seq=195963 Ack=5017 Win=848 Len=0 TSval=7775130 TSecr=759643966"
"366","2018-08-23 01:51:09.212562","192.168.2.3","216.58.197.4","TCP","1434","34236  >  443 [ACK] Seq=195963 Ack=5017 Win=848 Len=1368 TSval=7775134 TSecr=759643966 [TCP segment of a reassembled PDU]"
"367","2018-08-23 01:51:09.212567","192.168.2.3","216.58.197.4","TCP","1434","34236  >  443 [ACK] Seq=197331 Ack=5017 Win=848 Len=1368 TSval=7775134 TSecr=759643966 [TCP segment of a reassembled PDU]"
"368","2018-08-23 01:51:09.212568","192.168.2.3","216.58.197.4","TLSv1.2","212","Application Data"
"369","2018-08-23 01:51:09.212680","192.168.2.3","216.58.197.4","TCP","1434","34236  >  443 [ACK] Seq=198845 Ack=5017 Win=848 Len=1368 TSval=7775134 TSecr=759643966 [TCP segment of a reassembled PDU]"
"370","2018-08-23 01:51:09.212857","192.168.2.3","216.58.197.4","TLSv1.2","155","Application Data"
"374","2018-08-23 01:51:09.308539","192.168.2.3","216.58.197.4","TCP","1434","34236  >  443 [ACK] Seq=200302 Ack=5017 Win=848 Len=1368 TSval=7775144 TSecr=759644012 [TCP segment of a reassembled PDU]"
"375","2018-08-23 01:51:09.314440","192.168.2.3","216.58.197.4","TCP","1434","34236  >  443 [ACK] Seq=201670 Ack=5017 Win=848 Len=1368 TSval=7775144 TSecr=759644012 [TCP segment of a reassembled PDU]"
"376","2018-08-23 01:51:09.314445","192.168.2.3","216.58.197.4","TLSv1.2","212","Application Data"
"377","2018-08-23 01:51:09.314647","192.168.2.3","216.58.197.4","TCP","1434","34236  >  443 [ACK] Seq=203184 Ack=5017 Win=848 Len=1368 TSval=7775144 TSecr=759644012 [TCP segment of a reassembled PDU]"
"378","2018-08-23 01:51:09.314650","192.168.2.3","216.58.197.4","TLSv1.2","155","Application Data"
"382","2018-08-23 01:51:09.429227","192.168.2.3","216.58.197.4","TCP","1434","34236  >  443 [ACK] Seq=204641 Ack=5017 Win=848 Len=1368 TSval=7775156 TSecr=759644114 [TCP segment of a reassembled PDU]"
"383","2018-08-23 01:51:09.429614","192.168.2.3","216.58.197.4","TCP","1434","34236  >  443 [ACK] Seq=206009 Ack=5017 Win=848 Len=1368 TSval=7775156 TSecr=759644114 [TCP segment of a reassembled PDU]"
"384","2018-08-23 01:51:09.429617","192.168.2.3","216.58.197.4","TLSv1.2","212","Application Data"
"385","2018-08-23 01:51:09.429618","192.168.2.3","216.58.197.4","TCP","1434","34236  >  443 [ACK] Seq=207523 Ack=5017 Win=848 Len=1368 TSval=7775156 TSecr=759644114 [TCP segment of a reassembled PDU]"
"386","2018-08-23 01:51:09.429949","192.168.2.3","216.58.197.4","TLSv1.2","155","Application Data"
"392","2018-08-23 01:51:09.484006","192.168.2.3","216.58.197.4","TCP","66","34236  >  443 [ACK] Seq=208980 Ack=5265 Win=848 Len=0 TSval=7775162 TSecr=759644268"
"393","2018-08-23 01:51:09.527982","192.168.2.3","216.58.197.4","TCP","1434","34236  >  443 [ACK] Seq=208980 Ack=5265 Win=848 Len=1368 TSval=7775166 TSecr=759644268 [TCP segment of a reassembled PDU]"
"394","2018-08-23 01:51:09.528164","192.168.2.3","216.58.197.4","TCP","1434","34236  >  443 [ACK] Seq=210348 Ack=5265 Win=848 Len=1368 TSval=7775166 TSecr=759644268 [TCP segment of a reassembled PDU]"
"395","2018-08-23 01:51:09.528168","192.168.2.3","216.58.197.4","TLSv1.2","212","Application Data"
"396","2018-08-23 01:51:09.528712","192.168.2.3","216.58.197.4","TCP","1434","34236  >  443 [ACK] Seq=211862 Ack=5265 Win=848 Len=1368 TSval=7775166 TSecr=759644268 [TCP segment of a reassembled PDU]"
"397","2018-08-23 01:51:09.528714","192.168.2.3","216.58.197.4","TLSv1.2","155","Application Data"
"401","2018-08-23 01:51:09.626390","192.168.2.3","216.58.197.4","TCP","1434","34236  >  443 [ACK] Seq=213319 Ack=5265 Win=848 Len=1368 TSval=7775175 TSecr=759644368 [TCP segment of a reassembled PDU]"
"402","2018-08-23 01:51:09.626395","192.168.2.3","216.58.197.4","TCP","1434","34236  >  443 [ACK] Seq=214687 Ack=5265 Win=848 Len=1368 TSval=7775175 TSecr=759644368 [TCP segment of a reassembled PDU]"
"403","2018-08-23 01:51:09.626520","192.168.2.3","216.58.197.4","TLSv1.2","212","Application Data"
"404","2018-08-23 01:51:09.626752","192.168.2.3","216.58.197.4","TCP","1434","34236  >  443 [ACK] Seq=216201 Ack=5265 Win=848 Len=1368 TSval=7775175 TSecr=759644368 [TCP segment of a reassembled PDU]"
"405","2018-08-23 01:51:09.626755","192.168.2.3","216.58.197.4","TLSv1.2","155","Application Data"
"412","2018-08-23 01:51:09.681313","192.168.2.3","216.58.197.4","TCP","66","34236  >  443 [ACK] Seq=217658 Ack=5755 Win=844 Len=0 TSval=7775181 TSecr=759644440"
"413","2018-08-23 01:51:09.713656","192.168.2.3","216.58.197.4","TCP","66","34236  >  443 [ACK] Seq=217658 Ack=5969 Win=848 Len=0 TSval=7775185 TSecr=759644476"
"414","2018-08-23 01:51:09.724277","192.168.2.3","216.58.197.4","TCP","1434","34236  >  443 [ACK] Seq=217658 Ack=5969 Win=848 Len=1368 TSval=7775185 TSecr=759644476 [TCP segment of a reassembled PDU]"
"415","2018-08-23 01:51:09.724283","192.168.2.3","216.58.197.4","TCP","1434","34236  >  443 [ACK] Seq=219026 Ack=5969 Win=848 Len=1368 TSval=7775185 TSecr=759644476 [TCP segment of a reassembled PDU]"
"416","2018-08-23 01:51:09.724284","192.168.2.3","216.58.197.4","TLSv1.2","212","Application Data"
"417","2018-08-23 01:51:09.724547","192.168.2.3","216.58.197.4","TCP","1434","34236  >  443 [ACK] Seq=220540 Ack=5969 Win=848 Len=1368 TSval=7775185 TSecr=759644476 [TCP segment of a reassembled PDU]"
"418","2018-08-23 01:51:09.724550","192.168.2.3","216.58.197.4","TLSv1.2","155","Application Data"
"424","2018-08-23 01:51:09.780289","192.168.2.3","216.58.197.4","TCP","66","34236  >  443 [ACK] Seq=221997 Ack=6362 Win=848 Len=0 TSval=7775191 TSecr=759644574"
"425","2018-08-23 01:51:09.814049","192.168.2.3","216.58.197.4","TCP","1434","34236  >  443 [ACK] Seq=221997 Ack=6362 Win=848 Len=1368 TSval=7775195 TSecr=759644574 [TCP segment of a reassembled PDU]"
"426","2018-08-23 01:51:09.814410","192.168.2.3","216.58.197.4","TCP","1434","34236  >  443 [ACK] Seq=223365 Ack=6362 Win=848 Len=1368 TSval=7775195 TSecr=759644574 [TCP segment of a reassembled PDU]"
"427","2018-08-23 01:51:09.814414","192.168.2.3","216.58.197.4","TLSv1.2","212","Application Data"
"428","2018-08-23 01:51:09.814591","192.168.2.3","216.58.197.4","TCP","1434","34236  >  443 [ACK] Seq=224879 Ack=6362 Win=848 Len=1368 TSval=7775195 TSecr=759644574 [TCP segment of a reassembled PDU]"
"429","2018-08-23 01:51:09.814594","192.168.2.3","216.58.197.4","TLSv1.2","155","Application Data"
"433","2018-08-23 01:51:09.918271","192.168.2.3","216.58.197.4","TCP","1434","34236  >  443 [ACK] Seq=226336 Ack=6362 Win=848 Len=1368 TSval=7775204 TSecr=759644614 [TCP segment of a reassembled PDU]"
"434","2018-08-23 01:51:09.918276","192.168.2.3","216.58.197.4","TCP","1434","34236  >  443 [ACK] Seq=227704 Ack=6362 Win=848 Len=1368 TSval=7775204 TSecr=759644614 [TCP segment of a reassembled PDU]"
"435","2018-08-23 01:51:09.918507","192.168.2.3","216.58.197.4","TLSv1.2","212","Application Data"
"436","2018-08-23 01:51:09.918510","192.168.2.3","216.58.197.4","TCP","1434","34236  >  443 [ACK] Seq=229218 Ack=6362 Win=848 Len=1368 TSval=7775204 TSecr=759644614 [TCP segment of a reassembled PDU]"
"437","2018-08-23 01:51:09.918512","192.168.2.3","216.58.197.4","TLSv1.2","155","Application Data"
"441","2018-08-23 01:51:10.016695","192.168.2.3","216.58.197.4","TCP","1434","34236  >  443 [ACK] Seq=230675 Ack=6362 Win=848 Len=1368 TSval=7775214 TSecr=759644718 [TCP segment of a reassembled PDU]"
"442","2018-08-23 01:51:10.016700","192.168.2.3","216.58.197.4","TCP","1434","34236  >  443 [ACK] Seq=232043 Ack=6362 Win=848 Len=1368 TSval=7775214 TSecr=759644718 [TCP segment of a reassembled PDU]"
"443","2018-08-23 01:51:10.016824","192.168.2.3","216.58.197.4","TLSv1.2","212","Application Data"
"444","2018-08-23 01:51:10.017089","192.168.2.3","216.58.197.4","TCP","1434","34236  >  443 [ACK] Seq=233557 Ack=6362 Win=848 Len=1368 TSval=7775214 TSecr=759644718 [TCP segment of a reassembled PDU]"
"445","2018-08-23 01:51:10.017090","192.168.2.3","216.58.197.4","TLSv1.2","155","Application Data"
"449","2018-08-23 01:51:10.108385","192.168.2.3","216.58.197.4","TCP","1434","34236  >  443 [ACK] Seq=235014 Ack=6362 Win=848 Len=1368 TSval=7775224 TSecr=759644817 [TCP segment of a reassembled PDU]"
"450","2018-08-23 01:51:10.108402","192.168.2.3","216.58.197.4","TCP","1434","34236  >  443 [ACK] Seq=236382 Ack=6362 Win=848 Len=1368 TSval=7775224 TSecr=759644817 [TCP segment of a reassembled PDU]"
"451","2018-08-23 01:51:10.108403","192.168.2.3","216.58.197.4","TLSv1.2","212","Application Data"
"452","2018-08-23 01:51:10.108613","192.168.2.3","216.58.197.4","TCP","1434","34236  >  443 [ACK] Seq=237896 Ack=6362 Win=848 Len=1368 TSval=7775224 TSecr=759644817 [TCP segment of a reassembled PDU]"
"453","2018-08-23 01:51:10.108616","192.168.2.3","216.58.197.4","TLSv1.2","155","Application Data"
"459","2018-08-23 01:51:10.154120","192.168.2.3","216.58.197.4","TCP","66","34236  >  443 [ACK] Seq=239353 Ack=6573 Win=845 Len=0 TSval=7775229 TSecr=759644948"
"460","2018-08-23 01:51:10.159972","192.168.2.3","216.58.197.4","TCP","66","34236  >  443 [ACK] Seq=239353 Ack=6790 Win=844 Len=0 TSval=7775229 TSecr=759644949"
"461","2018-08-23 01:51:10.176174","192.168.2.3","216.58.197.4","TCP","1434","34236  >  443 [ACK] Seq=239353 Ack=6790 Win=848 Len=1368 TSval=7775231 TSecr=759644949 [TCP segment of a reassembled PDU]"
"462","2018-08-23 01:51:10.176449","192.168.2.3","216.58.197.4","TCP","1434","34236  >  443 [ACK] Seq=240721 Ack=6790 Win=848 Len=1368 TSval=7775231 TSecr=759644949 [TCP segment of a reassembled PDU]"
"463","2018-08-23 01:51:10.176450","192.168.2.3","216.58.197.4","TLSv1.2","212","Application Data"
"464","2018-08-23 01:51:10.176451","192.168.2.3","216.58.197.4","TLSv1.2","1005","Application Data"
"465","2018-08-23 01:51:10.176452","192.168.2.3","216.58.197.4","TLSv1.2","102","Application Data"
"470","2018-08-23 01:51:10.313908","192.168.2.3","216.58.197.4","TCP","66","34236  >  443 [ACK] Seq=243210 Ack=7538 Win=848 Len=0 TSval=7775245 TSecr=759645101"
"473","2018-08-23 01:51:10.484188","192.168.2.3","216.58.197.4","TCP","66","34236  >  443 [ACK] Seq=243210 Ack=7918 Win=848 Len=0 TSval=7775262 TSecr=759645268"
"476","2018-08-23 01:51:10.549782","192.168.2.3","216.58.197.4","TCP","66","34236  >  443 [ACK] Seq=243210 Ack=9470 Win=848 Len=0 TSval=7775268 TSecr=759645320"
"483","2018-08-23 01:51:10.691220","192.168.2.3","216.58.197.4","TCP","66","34236  >  443 [ACK] Seq=243210 Ack=11394 Win=848 Len=0 TSval=7775282 TSecr=759645485"
"484","2018-08-23 01:51:10.692067","192.168.2.3","216.58.197.4","TCP","66","34236  >  443 [ACK] Seq=243210 Ack=14823 Win=848 Len=0 TSval=7775282 TSecr=759645485"
"487","2018-08-23 01:51:10.695342","192.168.2.3","216.58.197.4","TCP","66","34236  >  443 [ACK] Seq=243210 Ack=16503 Win=848 Len=0 TSval=7775283 TSecr=759645488"
"490","2018-08-23 01:51:10.697091","192.168.2.3","216.58.197.4","TCP","66","34236  >  443 [ACK] Seq=243210 Ack=18397 Win=848 Len=0 TSval=7775283 TSecr=759645491"
"495","2018-08-23 01:51:10.700177","192.168.2.3","216.58.197.4","TCP","66","34236  >  443 [ACK] Seq=243210 Ack=20169 Win=848 Len=0 TSval=7775283 TSecr=759645494"
"496","2018-08-23 01:51:10.700590","192.168.2.3","216.58.197.4","TCP","66","34236  >  443 [ACK] Seq=243210 Ack=21945 Win=848 Len=0 TSval=7775283 TSecr=759645494"
"508","2018-08-23 01:51:10.725216","192.168.2.3","216.58.197.4","TCP","66","34236  >  443 [ACK] Seq=243210 Ack=27105 Win=848 Len=0 TSval=7775286 TSecr=759645516"
"509","2018-08-23 01:51:10.725567","192.168.2.3","216.58.197.4","TCP","66","34236  >  443 [ACK] Seq=243210 Ack=28809 Win=848 Len=0 TSval=7775286 TSecr=759645517"
"512","2018-08-23 01:51:10.726041","192.168.2.3","216.58.197.4","TCP","66","34236  >  443 [ACK] Seq=243210 Ack=32336 Win=848 Len=0 TSval=7775286 TSecr=759645519"
"513","2018-08-23 01:51:10.727378","192.168.2.3","216.58.197.4","TCP","66","34236  >  443 [ACK] Seq=243210 Ack=34243 Win=848 Len=0 TSval=7775286 TSecr=759645521"
"518","2018-08-23 01:51:10.729139","192.168.2.3","216.58.197.4","TCP","66","34236  >  443 [ACK] Seq=243210 Ack=36106 Win=848 Len=0 TSval=7775286 TSecr=759645523"
"521","2018-08-23 01:51:10.730063","192.168.2.3","216.58.197.4","TCP","66","34236  >  443 [ACK] Seq=243210 Ack=38006 Win=848 Len=0 TSval=7775286 TSecr=759645523"
"522","2018-08-23 01:51:10.730618","192.168.2.3","216.58.197.4","TCP","66","34236  >  443 [ACK] Seq=243210 Ack=39779 Win=848 Len=0 TSval=7775286 TSecr=759645524"
"527","2018-08-23 01:51:10.733616","192.168.2.3","216.58.197.4","TCP","66","34236  >  443 [ACK] Seq=243210 Ack=41683 Win=848 Len=0 TSval=7775286 TSecr=759645526"
"528","2018-08-23 01:51:10.736114","192.168.2.3","216.58.197.4","TCP","66","34236  >  443 [ACK] Seq=243210 Ack=43506 Win=848 Len=0 TSval=7775287 TSecr=759645526"
"534","2018-08-23 01:51:10.738028","192.168.2.3","216.58.197.4","TCP","66","34236  >  443 [ACK] Seq=243210 Ack=43712 Win=848 Len=0 TSval=7775287 TSecr=759645532"
"535","2018-08-23 01:51:10.739006","192.168.2.3","216.58.197.4","TCP","66","34236  >  443 [ACK] Seq=243210 Ack=44013 Win=848 Len=0 TSval=7775287 TSecr=759645532"
"536","2018-08-23 01:51:10.757128","192.168.2.3","216.58.197.4","TLSv1.2","104","Application Data"
"538","2018-08-23 01:51:11.143579","192.168.2.3","108.177.97.188","TCP","66","58805  >  5228 [ACK] Seq=1 Ack=1 Win=406 Len=0 TSval=7775328 TSecr=2777170052"
"553","2018-08-23 01:51:18.315734","192.168.2.3","216.58.197.14","TLSv1.2","162","Application Data"
"554","2018-08-23 01:51:18.316054","192.168.2.3","216.58.197.14","TLSv1.2","104","Application Data"
"555","2018-08-23 01:51:18.316058","192.168.2.3","216.58.197.14","TLSv1.2","584","Application Data"
"560","2018-08-23 01:51:18.354375","192.168.2.3","216.58.197.14","TCP","66","41142  >  443 [ACK] Seq=653 Ack=39 Win=379 Len=0 TSval=7776049 TSecr=932661849"
"565","2018-08-23 01:51:18.406289","192.168.2.3","216.58.197.14","TCP","66","41142  >  443 [ACK] Seq=653 Ack=107 Win=379 Len=0 TSval=7776054 TSecr=932661934"
"566","2018-08-23 01:51:18.406292","192.168.2.3","216.58.197.14","TCP","66","41142  >  443 [ACK] Seq=653 Ack=246 Win=396 Len=0 TSval=7776054 TSecr=932661934"
"567","2018-08-23 01:51:18.406800","192.168.2.3","216.58.197.14","TCP","66","41142  >  443 [ACK] Seq=653 Ack=441 Win=413 Len=0 TSval=7776054 TSecr=932661934"
"568","2018-08-23 01:51:18.407398","192.168.2.3","216.58.197.14","TCP","66","41142  >  443 [ACK] Seq=653 Ack=479 Win=413 Len=0 TSval=7776054 TSecr=932661934"
"569","2018-08-23 01:51:18.408782","192.168.2.3","216.58.197.14","TLSv1.2","104","Application Data"
