"No.","Time","Source","Destination","Protocol","Length","Info"
"1","2018-08-23 01:59:07.508924","192.168.2.3","216.58.197.4","TCP","66","34236  >  443 [ACK] Seq=1 Ack=1 Win=1828 Len=0 TSval=7822964 TSecr=760077281"
"3","2018-08-23 01:59:09.631126","192.168.2.3","216.58.197.4","TLSv1.2","156","[TCP Previous segment not captured] , Application Data"
"4","2018-08-23 01:59:09.631131","192.168.2.3","216.58.197.4","TLSv1.2","104","Application Data"
"5","2018-08-23 01:59:09.631490","192.168.2.3","216.58.197.4","TLSv1.2","158","Application Data"
"10","2018-08-23 01:59:09.643231","192.168.2.3","216.58.197.4","TCP","1434","34236  >  443 [ACK] Seq=222 Ack=39 Win=1828 Len=1368 TSval=7823177 TSecr=760124432 [TCP segment of a reassembled PDU]"
"11","2018-08-23 01:59:09.643616","192.168.2.3","216.58.197.4","TCP","1434","34236  >  443 [ACK] Seq=1590 Ack=39 Win=1828 Len=1368 TSval=7823177 TSecr=760124432 [TCP segment of a reassembled PDU]"
"12","2018-08-23 01:59:09.643620","192.168.2.3","216.58.197.4","TLSv1.2","212","Application Data"
"13","2018-08-23 01:59:09.644038","192.168.2.3","216.58.197.4","TCP","1434","34236  >  443 [ACK] Seq=3104 Ack=39 Win=1828 Len=1368 TSval=7823177 TSecr=760124432 [TCP segment of a reassembled PDU]"
"14","2018-08-23 01:59:09.644347","192.168.2.3","216.58.197.4","TLSv1.2","223","Application Data"
"15","2018-08-23 01:59:09.644349","192.168.2.3","216.58.197.4","TCP","1434","34236  >  443 [ACK] Seq=4629 Ack=39 Win=1828 Len=1368 TSval=7823177 TSecr=760124432 [TCP segment of a reassembled PDU]"
"16","2018-08-23 01:59:09.644732","192.168.2.3","216.58.197.4","TCP","1434","34236  >  443 [ACK] Seq=5997 Ack=39 Win=1828 Len=1368 TSval=7823177 TSecr=760124432 [TCP segment of a reassembled PDU]"
"17","2018-08-23 01:59:09.644735","192.168.2.3","216.58.197.4","TLSv1.2","212","Application Data"
"18","2018-08-23 01:59:09.644736","192.168.2.3","216.58.197.4","TCP","1434","34236  >  443 [ACK] Seq=7511 Ack=39 Win=1828 Len=1368 TSval=7823177 TSecr=760124432 [TCP segment of a reassembled PDU]"
"19","2018-08-23 01:59:09.645138","192.168.2.3","216.58.197.4","TCP","1434","34236  >  443 [ACK] Seq=8879 Ack=39 Win=1828 Len=1368 TSval=7823177 TSecr=760124432 [TCP segment of a reassembled PDU]"
"25","2018-08-23 01:59:09.649788","192.168.2.3","216.58.197.4","TLSv1.2","1434","Application Data [TCP segment of a reassembled PDU]"
"26","2018-08-23 01:59:09.649791","192.168.2.3","216.58.197.4","TCP","1434","34236  >  443 [ACK] Seq=11615 Ack=39 Win=1828 Len=1368 TSval=7823178 TSecr=760124444 [TCP segment of a reassembled PDU]"
"27","2018-08-23 01:59:09.650196","192.168.2.3","216.58.197.4","TLSv1.2","1434","Application Data [TCP segment of a reassembled PDU]"
"28","2018-08-23 01:59:09.650820","192.168.2.3","216.58.197.4","TCP","1434","34236  >  443 [ACK] Seq=14351 Ack=39 Win=1828 Len=1368 TSval=7823178 TSecr=760124444 [TCP segment of a reassembled PDU]"
"29","2018-08-23 01:59:09.650822","192.168.2.3","216.58.197.4","TLSv1.2","1434","Application Data [TCP segment of a reassembled PDU]"
"30","2018-08-23 01:59:09.651022","192.168.2.3","216.58.197.4","TCP","1434","34236  >  443 [ACK] Seq=17087 Ack=39 Win=1828 Len=1368 TSval=7823178 TSecr=760124444 [TCP segment of a reassembled PDU]"
"31","2018-08-23 01:59:09.651373","192.168.2.3","216.58.197.4","TLSv1.2","1434","Application Data [TCP segment of a reassembled PDU]"
"32","2018-08-23 01:59:09.651658","192.168.2.3","216.58.197.4","TCP","1434","34236  >  443 [ACK] Seq=19823 Ack=39 Win=1828 Len=1368 TSval=7823178 TSecr=760124445 [TCP segment of a reassembled PDU]"
"33","2018-08-23 01:59:09.651902","192.168.2.3","216.58.197.4","TLSv1.2","1434","Application Data, Application Data"
"34","2018-08-23 01:59:09.651904","192.168.2.3","216.58.197.4","TCP","1434","34236  >  443 [ACK] Seq=22559 Ack=39 Win=1828 Len=1368 TSval=7823178 TSecr=760124445 [TCP segment of a reassembled PDU]"
"35","2018-08-23 01:59:09.652035","192.168.2.3","216.58.197.4","TLSv1.2","1434","Application Data [TCP segment of a reassembled PDU]"
"36","2018-08-23 01:59:09.652254","192.168.2.3","216.58.197.4","TLSv1.2","1434","Application Data [TCP segment of a reassembled PDU]"
"37","2018-08-23 01:59:09.652893","192.168.2.3","216.58.197.4","TCP","1434","34236  >  443 [ACK] Seq=26663 Ack=39 Win=1828 Len=1368 TSval=7823178 TSecr=760124446 [TCP segment of a reassembled PDU]"
"38","2018-08-23 01:59:09.653197","192.168.2.3","216.58.197.4","TLSv1.2","1434","Application Data [TCP segment of a reassembled PDU]"
"39","2018-08-23 01:59:09.653457","192.168.2.3","216.58.197.4","TCP","1434","34236  >  443 [ACK] Seq=29399 Ack=39 Win=1828 Len=1368 TSval=7823178 TSecr=760124446 [TCP segment of a reassembled PDU]"
"43","2018-08-23 01:59:09.655782","192.168.2.3","216.58.197.4","TLSv1.2","1434","Application Data [TCP segment of a reassembled PDU]"
"44","2018-08-23 01:59:09.655785","192.168.2.3","216.58.197.4","TCP","1434","34236  >  443 [ACK] Seq=32135 Ack=39 Win=1828 Len=1368 TSval=7823178 TSecr=760124450 [TCP segment of a reassembled PDU]"
"46","2018-08-23 01:59:09.656044","192.168.2.3","216.58.197.4","TCP","1434","34236  >  443 [ACK] Seq=33503 Ack=39 Win=1828 Len=1368 TSval=7823178 TSecr=760124450 [TCP segment of a reassembled PDU]"
"48","2018-08-23 01:59:09.656564","192.168.2.3","216.58.197.4","TLSv1.2","1434","Application Data [TCP segment of a reassembled PDU]"
"49","2018-08-23 01:59:09.656566","192.168.2.3","216.58.197.4","TCP","1434","34236  >  443 [ACK] Seq=36239 Ack=39 Win=1828 Len=1368 TSval=7823178 TSecr=760124451 [TCP segment of a reassembled PDU]"
"51","2018-08-23 01:59:09.656918","192.168.2.3","216.58.197.4","TLSv1.2","1434","Application Data [TCP segment of a reassembled PDU]"
"53","2018-08-23 01:59:09.660146","192.168.2.3","216.58.197.4","TCP","1434","34236  >  443 [ACK] Seq=38975 Ack=39 Win=1828 Len=1368 TSval=7823178 TSecr=760124451 [TCP segment of a reassembled PDU]"
"54","2018-08-23 01:59:09.660149","192.168.2.3","216.58.197.4","TLSv1.2","1434","Application Data [TCP segment of a reassembled PDU]"
"55","2018-08-23 01:59:09.660171","192.168.2.3","216.58.197.4","TLSv1.2","1434","Application Data [TCP segment of a reassembled PDU]"
"58","2018-08-23 01:59:09.660487","192.168.2.3","216.58.197.4","TCP","1434","34236  >  443 [ACK] Seq=43079 Ack=39 Win=1828 Len=1368 TSval=7823178 TSecr=760124452 [TCP segment of a reassembled PDU]"
"59","2018-08-23 01:59:09.660490","192.168.2.3","216.58.197.4","TLSv1.2","1434","Application Data [TCP segment of a reassembled PDU]"
"61","2018-08-23 01:59:09.660814","192.168.2.3","216.58.197.4","TCP","1434","34236  >  443 [ACK] Seq=45815 Ack=39 Win=1828 Len=1368 TSval=7823178 TSecr=760124452 [TCP segment of a reassembled PDU]"
"62","2018-08-23 01:59:09.660816","192.168.2.3","216.58.197.4","TCP","1434","34236  >  443 [ACK] Seq=47183 Ack=39 Win=1828 Len=1368 TSval=7823178 TSecr=760124452 [TCP segment of a reassembled PDU]"
"63","2018-08-23 01:59:09.661155","192.168.2.3","216.58.197.4","TLSv1.2","1434","Application Data [TCP segment of a reassembled PDU]"
"64","2018-08-23 01:59:09.661157","192.168.2.3","216.58.197.4","TCP","1434","34236  >  443 [PSH, ACK] Seq=49919 Ack=39 Win=1828 Len=1368 TSval=7823178 TSecr=760124453 [TCP segment of a reassembled PDU]"
"65","2018-08-23 01:59:09.661515","192.168.2.3","216.58.197.4","TLSv1.2","1434","Application Data [TCP segment of a reassembled PDU]"
"66","2018-08-23 01:59:09.661519","192.168.2.3","216.58.197.4","TCP","1434","34236  >  443 [ACK] Seq=52655 Ack=39 Win=1828 Len=1368 TSval=7823179 TSecr=760124454 [TCP segment of a reassembled PDU]"
"73","2018-08-23 01:59:09.667071","192.168.2.3","216.58.197.4","TLSv1.2","1434","Application Data [TCP segment of a reassembled PDU]"
"74","2018-08-23 01:59:09.667074","192.168.2.3","216.58.197.4","TCP","1434","34236  >  443 [ACK] Seq=55391 Ack=39 Win=1828 Len=1368 TSval=7823179 TSecr=760124454 [TCP segment of a reassembled PDU]"
"75","2018-08-23 01:59:09.667665","192.168.2.3","216.58.197.4","TLSv1.2","1330","Application Data, Application Data"
"78","2018-08-23 01:59:09.729110","192.168.2.3","216.58.197.4","TCP","1434","34236  >  443 [ACK] Seq=58023 Ack=39 Win=1828 Len=1368 TSval=7823185 TSecr=760124508 [TCP segment of a reassembled PDU]"
"79","2018-08-23 01:59:09.729431","192.168.2.3","216.58.197.4","TCP","1434","34236  >  443 [ACK] Seq=59391 Ack=39 Win=1828 Len=1368 TSval=7823186 TSecr=760124508 [TCP segment of a reassembled PDU]"
"80","2018-08-23 01:59:09.729435","192.168.2.3","216.58.197.4","TLSv1.2","212","Application Data"
"81","2018-08-23 01:59:09.729920","192.168.2.3","216.58.197.4","TCP","1434","34236  >  443 [ACK] Seq=60905 Ack=39 Win=1828 Len=1368 TSval=7823186 TSecr=760124508 [TCP segment of a reassembled PDU]"
"82","2018-08-23 01:59:09.729924","192.168.2.3","216.58.197.4","TLSv1.2","155","Application Data"
"86","2018-08-23 01:59:09.842421","192.168.2.3","216.58.197.4","TCP","1434","34236  >  443 [ACK] Seq=62362 Ack=39 Win=1828 Len=1368 TSval=7823197 TSecr=760124530 [TCP segment of a reassembled PDU]"
"87","2018-08-23 01:59:09.842888","192.168.2.3","216.58.197.4","TCP","1434","34236  >  443 [ACK] Seq=63730 Ack=39 Win=1828 Len=1368 TSval=7823197 TSecr=760124530 [TCP segment of a reassembled PDU]"
"88","2018-08-23 01:59:09.842896","192.168.2.3","216.58.197.4","TLSv1.2","212","Application Data"
"89","2018-08-23 01:59:09.842898","192.168.2.3","216.58.197.4","TCP","1434","34236  >  443 [ACK] Seq=65244 Ack=39 Win=1828 Len=1368 TSval=7823197 TSecr=760124530 [TCP segment of a reassembled PDU]"
"90","2018-08-23 01:59:09.842969","192.168.2.3","216.58.197.4","TLSv1.2","155","Application Data"
"94","2018-08-23 01:59:09.954118","192.168.2.3","216.58.197.4","TCP","1434","34236  >  443 [ACK] Seq=66701 Ack=39 Win=1828 Len=1368 TSval=7823208 TSecr=760124643 [TCP segment of a reassembled PDU]"
"95","2018-08-23 01:59:09.954358","192.168.2.3","216.58.197.4","TCP","1434","34236  >  443 [ACK] Seq=68069 Ack=39 Win=1828 Len=1368 TSval=7823208 TSecr=760124643 [TCP segment of a reassembled PDU]"
"96","2018-08-23 01:59:09.954361","192.168.2.3","216.58.197.4","TLSv1.2","212","Application Data"
"97","2018-08-23 01:59:09.954512","192.168.2.3","216.58.197.4","TCP","1434","34236  >  443 [ACK] Seq=69583 Ack=39 Win=1828 Len=1368 TSval=7823208 TSecr=760124643 [TCP segment of a reassembled PDU]"
"98","2018-08-23 01:59:09.954514","192.168.2.3","216.58.197.4","TLSv1.2","115","Application Data"
"104","2018-08-23 01:59:09.988701","192.168.2.3","216.58.197.4","TCP","66","34236  >  443 [ACK] Seq=71000 Ack=239 Win=1828 Len=0 TSval=7823211 TSecr=760124779"
"106","2018-08-23 01:59:10.029430","192.168.2.3","216.58.197.4","TCP","66","34236  >  443 [ACK] Seq=71000 Ack=377 Win=1828 Len=0 TSval=7823216 TSecr=760124788"
"107","2018-08-23 01:59:10.068111","192.168.2.3","216.58.197.4","TCP","1434","34236  >  443 [ACK] Seq=71000 Ack=377 Win=1828 Len=1368 TSval=7823219 TSecr=760124788 [TCP segment of a reassembled PDU]"
"108","2018-08-23 01:59:10.068530","192.168.2.3","216.58.197.4","TCP","1434","34236  >  443 [ACK] Seq=72368 Ack=377 Win=1828 Len=1368 TSval=7823219 TSecr=760124788 [TCP segment of a reassembled PDU]"
"109","2018-08-23 01:59:10.068533","192.168.2.3","216.58.197.4","TLSv1.2","212","Application Data"
"110","2018-08-23 01:59:10.068924","192.168.2.3","216.58.197.4","TCP","1434","34236  >  443 [ACK] Seq=73882 Ack=377 Win=1828 Len=1368 TSval=7823219 TSecr=760124788 [TCP segment of a reassembled PDU]"
"111","2018-08-23 01:59:10.068926","192.168.2.3","216.58.197.4","TLSv1.2","67","Application Data"
"116","2018-08-23 01:59:10.120740","192.168.2.3","216.58.197.4","TCP","66","34236  >  443 [ACK] Seq=75251 Ack=639 Win=1828 Len=0 TSval=7823225 TSecr=760124913"
"117","2018-08-23 01:59:10.176360","192.168.2.3","216.58.197.4","TCP","1434","34236  >  443 [ACK] Seq=75251 Ack=639 Win=1828 Len=1368 TSval=7823230 TSecr=760124913 [TCP segment of a reassembled PDU]"
"118","2018-08-23 01:59:10.176369","192.168.2.3","216.58.197.4","TCP","1434","34236  >  443 [ACK] Seq=76619 Ack=639 Win=1828 Len=1368 TSval=7823230 TSecr=760124913 [TCP segment of a reassembled PDU]"
"119","2018-08-23 01:59:10.176370","192.168.2.3","216.58.197.4","TLSv1.2","212","Application Data"
"120","2018-08-23 01:59:10.176576","192.168.2.3","216.58.197.4","TCP","1434","34236  >  443 [ACK] Seq=78133 Ack=639 Win=1828 Len=1368 TSval=7823230 TSecr=760124913 [TCP segment of a reassembled PDU]"
"121","2018-08-23 01:59:10.176578","192.168.2.3","216.58.197.4","TLSv1.2","155","Application Data"
"124","2018-08-23 01:59:10.283757","192.168.2.3","216.58.197.4","TCP","66","34236  >  443 [ACK] Seq=79590 Ack=924 Win=1828 Len=0 TSval=7823241 TSecr=760125079"
"125","2018-08-23 01:59:10.294440","192.168.2.3","216.58.197.4","TCP","1434","34236  >  443 [ACK] Seq=79590 Ack=924 Win=1828 Len=1368 TSval=7823242 TSecr=760125079 [TCP segment of a reassembled PDU]"
"126","2018-08-23 01:59:10.294445","192.168.2.3","216.58.197.4","TCP","1434","34236  >  443 [ACK] Seq=80958 Ack=924 Win=1828 Len=1368 TSval=7823242 TSecr=760125079 [TCP segment of a reassembled PDU]"
"127","2018-08-23 01:59:10.294609","192.168.2.3","216.58.197.4","TLSv1.2","212","Application Data"
"128","2018-08-23 01:59:10.294612","192.168.2.3","216.58.197.4","TCP","1434","34236  >  443 [ACK] Seq=82472 Ack=924 Win=1828 Len=1368 TSval=7823242 TSecr=760125079 [TCP segment of a reassembled PDU]"
"129","2018-08-23 01:59:10.294888","192.168.2.3","216.58.197.4","TLSv1.2","155","Application Data"
"133","2018-08-23 01:59:10.401100","192.168.2.3","216.58.197.4","TCP","1434","34236  >  443 [ACK] Seq=83929 Ack=924 Win=1828 Len=1368 TSval=7823253 TSecr=760125095 [TCP segment of a reassembled PDU]"
"134","2018-08-23 01:59:10.401426","192.168.2.3","216.58.197.4","TCP","1434","34236  >  443 [ACK] Seq=85297 Ack=924 Win=1828 Len=1368 TSval=7823253 TSecr=760125095 [TCP segment of a reassembled PDU]"
"135","2018-08-23 01:59:10.401429","192.168.2.3","216.58.197.4","TLSv1.2","212","Application Data"
"136","2018-08-23 01:59:10.401930","192.168.2.3","216.58.197.4","TCP","1434","34236  >  443 [ACK] Seq=86811 Ack=924 Win=1828 Len=1368 TSval=7823253 TSecr=760125095 [TCP segment of a reassembled PDU]"
"137","2018-08-23 01:59:10.401933","192.168.2.3","216.58.197.4","TLSv1.2","155","Application Data"
"141","2018-08-23 01:59:10.517226","192.168.2.3","216.58.197.4","TCP","1434","34236  >  443 [ACK] Seq=88268 Ack=924 Win=1828 Len=1368 TSval=7823264 TSecr=760125202 [TCP segment of a reassembled PDU]"
"142","2018-08-23 01:59:10.517503","192.168.2.3","216.58.197.4","TCP","1434","34236  >  443 [ACK] Seq=89636 Ack=924 Win=1828 Len=1368 TSval=7823264 TSecr=760125202 [TCP segment of a reassembled PDU]"
"143","2018-08-23 01:59:10.517505","192.168.2.3","216.58.197.4","TLSv1.2","212","Application Data"
"144","2018-08-23 01:59:10.517945","192.168.2.3","216.58.197.4","TCP","1434","34236  >  443 [ACK] Seq=91150 Ack=924 Win=1828 Len=1368 TSval=7823264 TSecr=760125202 [TCP segment of a reassembled PDU]"
"145","2018-08-23 01:59:10.517948","192.168.2.3","216.58.197.4","TLSv1.2","155","Application Data"
"149","2018-08-23 01:59:10.612203","192.168.2.3","216.58.197.4","TCP","1434","34236  >  443 [ACK] Seq=92607 Ack=924 Win=1828 Len=1368 TSval=7823274 TSecr=760125318 [TCP segment of a reassembled PDU]"
"150","2018-08-23 01:59:10.612611","192.168.2.3","216.58.197.4","TCP","1434","34236  >  443 [ACK] Seq=93975 Ack=924 Win=1828 Len=1368 TSval=7823274 TSecr=760125318 [TCP segment of a reassembled PDU]"
"151","2018-08-23 01:59:10.612614","192.168.2.3","216.58.197.4","TLSv1.2","212","Application Data"
"152","2018-08-23 01:59:10.612988","192.168.2.3","216.58.197.4","TCP","1434","34236  >  443 [ACK] Seq=95489 Ack=924 Win=1828 Len=1368 TSval=7823274 TSecr=760125318 [TCP segment of a reassembled PDU]"
"153","2018-08-23 01:59:10.612990","192.168.2.3","216.58.197.4","TLSv1.2","155","Application Data"
"157","2018-08-23 01:59:10.689208","192.168.2.3","216.58.197.4","TCP","1434","34236  >  443 [ACK] Seq=96946 Ack=924 Win=1828 Len=1368 TSval=7823281 TSecr=760125413 [TCP segment of a reassembled PDU]"
"158","2018-08-23 01:59:10.689509","192.168.2.3","216.58.197.4","TCP","1434","34236  >  443 [ACK] Seq=98314 Ack=924 Win=1828 Len=1368 TSval=7823281 TSecr=760125413 [TCP segment of a reassembled PDU]"
"159","2018-08-23 01:59:10.689511","192.168.2.3","216.58.197.4","TLSv1.2","212","Application Data"
"160","2018-08-23 01:59:10.689663","192.168.2.3","216.58.197.4","TCP","1434","34236  >  443 [ACK] Seq=99828 Ack=924 Win=1828 Len=1368 TSval=7823282 TSecr=760125413 [TCP segment of a reassembled PDU]"
"161","2018-08-23 01:59:10.689664","192.168.2.3","216.58.197.4","TLSv1.2","155","Application Data"
"164","2018-08-23 01:59:10.785116","192.168.2.3","216.58.197.4","TCP","1434","34236  >  443 [ACK] Seq=101285 Ack=924 Win=1828 Len=1368 TSval=7823291 TSecr=760125490 [TCP segment of a reassembled PDU]"
"165","2018-08-23 01:59:10.785571","192.168.2.3","216.58.197.4","TCP","1434","34236  >  443 [ACK] Seq=102653 Ack=924 Win=1828 Len=1368 TSval=7823291 TSecr=760125490 [TCP segment of a reassembled PDU]"
"166","2018-08-23 01:59:10.785575","192.168.2.3","216.58.197.4","TLSv1.2","212","Application Data"
"167","2018-08-23 01:59:10.785576","192.168.2.3","216.58.197.4","TCP","1434","34236  >  443 [ACK] Seq=104167 Ack=924 Win=1828 Len=1368 TSval=7823291 TSecr=760125490 [TCP segment of a reassembled PDU]"
"168","2018-08-23 01:59:10.785672","192.168.2.3","216.58.197.4","TLSv1.2","155","Application Data"
"171","2018-08-23 01:59:10.869711","192.168.2.3","216.58.197.4","TCP","1434","34236  >  443 [ACK] Seq=105624 Ack=924 Win=1828 Len=1368 TSval=7823299 TSecr=760125586 [TCP segment of a reassembled PDU]"
"172","2018-08-23 01:59:10.869882","192.168.2.3","216.58.197.4","TCP","1434","34236  >  443 [ACK] Seq=106992 Ack=924 Win=1828 Len=1368 TSval=7823299 TSecr=760125586 [TCP segment of a reassembled PDU]"
"173","2018-08-23 01:59:10.869884","192.168.2.3","216.58.197.4","TLSv1.2","212","Application Data"
"174","2018-08-23 01:59:10.870059","192.168.2.3","216.58.197.4","TCP","1434","34236  >  443 [ACK] Seq=108506 Ack=924 Win=1828 Len=1368 TSval=7823300 TSecr=760125586 [TCP segment of a reassembled PDU]"
"175","2018-08-23 01:59:10.870063","192.168.2.3","216.58.197.4","TLSv1.2","155","Application Data"
"179","2018-08-23 01:59:10.965431","192.168.2.3","216.58.197.4","TCP","1434","34236  >  443 [ACK] Seq=109963 Ack=924 Win=1828 Len=1368 TSval=7823309 TSecr=760125671 [TCP segment of a reassembled PDU]"
"180","2018-08-23 01:59:10.965770","192.168.2.3","216.58.197.4","TCP","1434","34236  >  443 [ACK] Seq=111331 Ack=924 Win=1828 Len=1368 TSval=7823309 TSecr=760125671 [TCP segment of a reassembled PDU]"
"181","2018-08-23 01:59:10.965774","192.168.2.3","216.58.197.4","TLSv1.2","212","Application Data"
"182","2018-08-23 01:59:10.965775","192.168.2.3","216.58.197.4","TCP","1434","34236  >  443 [ACK] Seq=112845 Ack=924 Win=1828 Len=1368 TSval=7823309 TSecr=760125671 [TCP segment of a reassembled PDU]"
"183","2018-08-23 01:59:10.965935","192.168.2.3","216.58.197.4","TLSv1.2","155","Application Data"
"189","2018-08-23 01:59:10.993086","192.168.2.3","216.58.197.4","TCP","66","34236  >  443 [ACK] Seq=114302 Ack=1394 Win=1828 Len=0 TSval=7823312 TSecr=760125775"
"192","2018-08-23 01:59:11.022334","192.168.2.3","216.58.197.4","TCP","66","34236  >  443 [ACK] Seq=114302 Ack=1862 Win=1828 Len=0 TSval=7823315 TSecr=760125817"
"193","2018-08-23 01:59:11.072113","192.168.2.3","216.58.197.4","TCP","1434","34236  >  443 [ACK] Seq=114302 Ack=1862 Win=1828 Len=1368 TSval=7823320 TSecr=760125817 [TCP segment of a reassembled PDU]"
"194","2018-08-23 01:59:11.072118","192.168.2.3","216.58.197.4","TCP","1434","34236  >  443 [ACK] Seq=115670 Ack=1862 Win=1828 Len=1368 TSval=7823320 TSecr=760125817 [TCP segment of a reassembled PDU]"
"195","2018-08-23 01:59:11.072119","192.168.2.3","216.58.197.4","TLSv1.2","212","Application Data"
"196","2018-08-23 01:59:11.072365","192.168.2.3","216.58.197.4","TCP","1434","34236  >  443 [ACK] Seq=117184 Ack=1862 Win=1828 Len=1368 TSval=7823320 TSecr=760125817 [TCP segment of a reassembled PDU]"
"197","2018-08-23 01:59:11.072367","192.168.2.3","216.58.197.4","TLSv1.2","155","Application Data"
"202","2018-08-23 01:59:11.130172","192.168.2.3","216.58.197.4","TCP","66","34236  >  443 [ACK] Seq=118641 Ack=2336 Win=1828 Len=0 TSval=7823326 TSecr=760125925"
"203","2018-08-23 01:59:11.157448","192.168.2.3","216.58.197.4","TCP","1434","34236  >  443 [ACK] Seq=118641 Ack=2336 Win=1828 Len=1368 TSval=7823328 TSecr=760125925 [TCP segment of a reassembled PDU]"
"204","2018-08-23 01:59:11.157836","192.168.2.3","216.58.197.4","TCP","1434","34236  >  443 [ACK] Seq=120009 Ack=2336 Win=1828 Len=1368 TSval=7823328 TSecr=760125925 [TCP segment of a reassembled PDU]"
"205","2018-08-23 01:59:11.157839","192.168.2.3","216.58.197.4","TLSv1.2","212","Application Data"
"206","2018-08-23 01:59:11.158272","192.168.2.3","216.58.197.4","TCP","1434","34236  >  443 [ACK] Seq=121523 Ack=2336 Win=1828 Len=1368 TSval=7823328 TSecr=760125925 [TCP segment of a reassembled PDU]"
"207","2018-08-23 01:59:11.158275","192.168.2.3","216.58.197.4","TLSv1.2","155","Application Data"
"211","2018-08-23 01:59:11.252972","192.168.2.3","216.58.197.4","TCP","1434","34236  >  443 [ACK] Seq=122980 Ack=2336 Win=1828 Len=1368 TSval=7823338 TSecr=760125999 [TCP segment of a reassembled PDU]"
"212","2018-08-23 01:59:11.253362","192.168.2.3","216.58.197.4","TCP","1434","34236  >  443 [ACK] Seq=124348 Ack=2336 Win=1828 Len=1368 TSval=7823338 TSecr=760125999 [TCP segment of a reassembled PDU]"
"213","2018-08-23 01:59:11.253365","192.168.2.3","216.58.197.4","TLSv1.2","212","Application Data"
"214","2018-08-23 01:59:11.253732","192.168.2.3","216.58.197.4","TCP","1434","34236  >  443 [ACK] Seq=125862 Ack=2336 Win=1828 Len=1368 TSval=7823338 TSecr=760125999 [TCP segment of a reassembled PDU]"
"215","2018-08-23 01:59:11.253734","192.168.2.3","216.58.197.4","TLSv1.2","155","Application Data"
"221","2018-08-23 01:59:11.318606","192.168.2.3","216.58.197.4","TCP","66","34236  >  443 [ACK] Seq=127319 Ack=2564 Win=1828 Len=0 TSval=7823344 TSecr=760126106"
"222","2018-08-23 01:59:11.361739","192.168.2.3","216.58.197.4","TCP","1434","34236  >  443 [ACK] Seq=127319 Ack=2564 Win=1828 Len=1368 TSval=7823349 TSecr=760126106 [TCP segment of a reassembled PDU]"
"223","2018-08-23 01:59:11.361745","192.168.2.3","216.58.197.4","TCP","1434","34236  >  443 [ACK] Seq=128687 Ack=2564 Win=1828 Len=1368 TSval=7823349 TSecr=760126106 [TCP segment of a reassembled PDU]"
"224","2018-08-23 01:59:11.361746","192.168.2.3","216.58.197.4","TLSv1.2","212","Application Data"
"225","2018-08-23 01:59:11.361993","192.168.2.3","216.58.197.4","TLSv1.2","1369","Application Data"
"228","2018-08-23 01:59:11.457441","192.168.2.3","216.58.197.4","TCP","1434","34236  >  443 [ACK] Seq=131504 Ack=2564 Win=1828 Len=1368 TSval=7823358 TSecr=760126163 [TCP segment of a reassembled PDU]"
"229","2018-08-23 01:59:11.457446","192.168.2.3","216.58.197.4","TCP","1434","34236  >  443 [ACK] Seq=132872 Ack=2564 Win=1828 Len=1368 TSval=7823358 TSecr=760126163 [TCP segment of a reassembled PDU]"
"230","2018-08-23 01:59:11.457560","192.168.2.3","216.58.197.4","TLSv1.2","212","Application Data"
"231","2018-08-23 01:59:11.457769","192.168.2.3","216.58.197.4","TCP","1434","34236  >  443 [ACK] Seq=134386 Ack=2564 Win=1828 Len=1368 TSval=7823358 TSecr=760126163 [TCP segment of a reassembled PDU]"
"232","2018-08-23 01:59:11.457771","192.168.2.3","216.58.197.4","TLSv1.2","155","Application Data"
"237","2018-08-23 01:59:11.525350","192.168.2.3","216.58.197.4","TCP","66","34236  >  443 [ACK] Seq=135843 Ack=2883 Win=1828 Len=0 TSval=7823365 TSecr=760126319"
"238","2018-08-23 01:59:11.554323","192.168.2.3","216.58.197.4","TCP","1434","34236  >  443 [ACK] Seq=135843 Ack=2883 Win=1828 Len=1368 TSval=7823368 TSecr=760126319 [TCP segment of a reassembled PDU]"
"239","2018-08-23 01:59:11.554341","192.168.2.3","216.58.197.4","TCP","1434","34236  >  443 [ACK] Seq=137211 Ack=2883 Win=1828 Len=1368 TSval=7823368 TSecr=760126319 [TCP segment of a reassembled PDU]"
"240","2018-08-23 01:59:11.554342","192.168.2.3","216.58.197.4","TLSv1.2","212","Application Data"
"241","2018-08-23 01:59:11.554400","192.168.2.3","216.58.197.4","TCP","1434","34236  >  443 [ACK] Seq=138725 Ack=2883 Win=1828 Len=1368 TSval=7823368 TSecr=760126319 [TCP segment of a reassembled PDU]"
"242","2018-08-23 01:59:11.554677","192.168.2.3","216.58.197.4","TLSv1.2","155","Application Data"
"247","2018-08-23 01:59:11.610086","192.168.2.3","216.58.197.4","TCP","66","34236  >  443 [ACK] Seq=140182 Ack=3034 Win=1828 Len=0 TSval=7823374 TSecr=760126405"
"248","2018-08-23 01:59:11.667601","192.168.2.3","216.58.197.4","TCP","1434","34236  >  443 [ACK] Seq=140182 Ack=3034 Win=1828 Len=1368 TSval=7823379 TSecr=760126405 [TCP segment of a reassembled PDU]"
"249","2018-08-23 01:59:11.667607","192.168.2.3","216.58.197.4","TCP","1434","34236  >  443 [ACK] Seq=141550 Ack=3034 Win=1828 Len=1368 TSval=7823379 TSecr=760126405 [TCP segment of a reassembled PDU]"
"250","2018-08-23 01:59:11.667729","192.168.2.3","216.58.197.4","TLSv1.2","212","Application Data"
"251","2018-08-23 01:59:11.668049","192.168.2.3","216.58.197.4","TCP","1434","34236  >  443 [ACK] Seq=143064 Ack=3034 Win=1828 Len=1368 TSval=7823379 TSecr=760126405 [TCP segment of a reassembled PDU]"
"252","2018-08-23 01:59:11.668051","192.168.2.3","216.58.197.4","TLSv1.2","155","Application Data"
"256","2018-08-23 01:59:11.746253","192.168.2.3","216.58.197.4","TCP","1434","34236  >  443 [ACK] Seq=144521 Ack=3034 Win=1828 Len=1368 TSval=7823387 TSecr=760126469 [TCP segment of a reassembled PDU]"
"257","2018-08-23 01:59:11.746259","192.168.2.3","216.58.197.4","TCP","1434","34236  >  443 [ACK] Seq=145889 Ack=3034 Win=1828 Len=1368 TSval=7823387 TSecr=760126469 [TCP segment of a reassembled PDU]"
"258","2018-08-23 01:59:11.746343","192.168.2.3","216.58.197.4","TLSv1.2","212","Application Data"
"259","2018-08-23 01:59:11.746662","192.168.2.3","216.58.197.4","TCP","1434","34236  >  443 [ACK] Seq=147403 Ack=3034 Win=1828 Len=1368 TSval=7823387 TSecr=760126469 [TCP segment of a reassembled PDU]"
"260","2018-08-23 01:59:11.746665","192.168.2.3","216.58.197.4","TLSv1.2","155","Application Data"
"266","2018-08-23 01:59:11.817193","192.168.2.3","216.58.197.4","TCP","66","34236  >  443 [ACK] Seq=148860 Ack=3391 Win=1828 Len=0 TSval=7823394 TSecr=760126612"
"267","2018-08-23 01:59:11.861510","192.168.2.3","216.58.197.4","TCP","1434","34236  >  443 [ACK] Seq=148860 Ack=3391 Win=1828 Len=1368 TSval=7823398 TSecr=760126612 [TCP segment of a reassembled PDU]"
"268","2018-08-23 01:59:11.861637","192.168.2.3","216.58.197.4","TCP","1434","34236  >  443 [ACK] Seq=150228 Ack=3391 Win=1828 Len=1368 TSval=7823398 TSecr=760126612 [TCP segment of a reassembled PDU]"
"269","2018-08-23 01:59:11.861640","192.168.2.3","216.58.197.4","TLSv1.2","212","Application Data"
"270","2018-08-23 01:59:11.861914","192.168.2.3","216.58.197.4","TCP","1434","34236  >  443 [ACK] Seq=151742 Ack=3391 Win=1828 Len=1368 TSval=7823398 TSecr=760126612 [TCP segment of a reassembled PDU]"
"271","2018-08-23 01:59:11.861918","192.168.2.3","216.58.197.4","TLSv1.2","155","Application Data"
"275","2018-08-23 01:59:11.957848","192.168.2.3","216.58.197.4","TCP","1434","34236  >  443 [ACK] Seq=153199 Ack=3391 Win=1828 Len=1368 TSval=7823408 TSecr=760126662 [TCP segment of a reassembled PDU]"
"276","2018-08-23 01:59:11.958125","192.168.2.3","216.58.197.4","TCP","1434","34236  >  443 [ACK] Seq=154567 Ack=3391 Win=1828 Len=1368 TSval=7823408 TSecr=760126662 [TCP segment of a reassembled PDU]"
"277","2018-08-23 01:59:11.958127","192.168.2.3","216.58.197.4","TLSv1.2","212","Application Data"
"278","2018-08-23 01:59:11.958128","192.168.2.3","216.58.197.4","TCP","1434","34236  >  443 [ACK] Seq=156081 Ack=3391 Win=1828 Len=1368 TSval=7823408 TSecr=760126662 [TCP segment of a reassembled PDU]"
"279","2018-08-23 01:59:11.958244","192.168.2.3","216.58.197.4","TLSv1.2","155","Application Data"
"283","2018-08-23 01:59:11.993465","192.168.2.3","216.58.197.4","TCP","66","34236  >  443 [ACK] Seq=157538 Ack=3640 Win=1828 Len=0 TSval=7823412 TSecr=760126775"
"286","2018-08-23 01:59:12.020724","192.168.2.3","216.58.197.4","TCP","66","34236  >  443 [ACK] Seq=157538 Ack=4161 Win=1828 Len=0 TSval=7823415 TSecr=760126816"
"287","2018-08-23 01:59:12.053401","192.168.2.3","216.58.197.4","TCP","1434","34236  >  443 [ACK] Seq=157538 Ack=4161 Win=1828 Len=1368 TSval=7823418 TSecr=760126816 [TCP segment of a reassembled PDU]"
"288","2018-08-23 01:59:12.053685","192.168.2.3","216.58.197.4","TCP","1434","34236  >  443 [ACK] Seq=158906 Ack=4161 Win=1828 Len=1368 TSval=7823418 TSecr=760126816 [TCP segment of a reassembled PDU]"
"289","2018-08-23 01:59:12.053687","192.168.2.3","216.58.197.4","TLSv1.2","212","Application Data"
"290","2018-08-23 01:59:12.054067","192.168.2.3","216.58.197.4","TCP","1434","34236  >  443 [ACK] Seq=160420 Ack=4161 Win=1828 Len=1368 TSval=7823418 TSecr=760126816 [TCP segment of a reassembled PDU]"
"291","2018-08-23 01:59:12.054070","192.168.2.3","216.58.197.4","TLSv1.2","155","Application Data"
"295","2018-08-23 01:59:12.162275","192.168.2.3","216.58.197.4","TCP","1434","34236  >  443 [ACK] Seq=161877 Ack=4161 Win=1828 Len=1368 TSval=7823429 TSecr=760126895 [TCP segment of a reassembled PDU]"
"296","2018-08-23 01:59:12.162427","192.168.2.3","216.58.197.4","TCP","1434","34236  >  443 [ACK] Seq=163245 Ack=4161 Win=1828 Len=1368 TSval=7823429 TSecr=760126895 [TCP segment of a reassembled PDU]"
"297","2018-08-23 01:59:12.162429","192.168.2.3","216.58.197.4","TLSv1.2","212","Application Data"
"298","2018-08-23 01:59:12.162667","192.168.2.3","216.58.197.4","TCP","1434","34236  >  443 [ACK] Seq=164759 Ack=4161 Win=1828 Len=1368 TSval=7823429 TSecr=760126895 [TCP segment of a reassembled PDU]"
"299","2018-08-23 01:59:12.162670","192.168.2.3","216.58.197.4","TLSv1.2","155","Application Data"
"305","2018-08-23 01:59:12.226768","192.168.2.3","216.58.197.4","TCP","66","34236  >  443 [ACK] Seq=166216 Ack=4578 Win=1828 Len=0 TSval=7823435 TSecr=760127014"
"306","2018-08-23 01:59:12.278537","192.168.2.3","216.58.197.4","TCP","1434","34236  >  443 [ACK] Seq=166216 Ack=4578 Win=1828 Len=1368 TSval=7823440 TSecr=760127014 [TCP segment of a reassembled PDU]"
"307","2018-08-23 01:59:12.278542","192.168.2.3","216.58.197.4","TCP","1434","34236  >  443 [ACK] Seq=167584 Ack=4578 Win=1828 Len=1368 TSval=7823440 TSecr=760127014 [TCP segment of a reassembled PDU]"
"308","2018-08-23 01:59:12.278543","192.168.2.3","216.58.197.4","TLSv1.2","212","Application Data"
"309","2018-08-23 01:59:12.278798","192.168.2.3","216.58.197.4","TCP","1434","34236  >  443 [ACK] Seq=169098 Ack=4578 Win=1828 Len=1368 TSval=7823440 TSecr=760127014 [TCP segment of a reassembled PDU]"
"310","2018-08-23 01:59:12.278801","192.168.2.3","216.58.197.4","TLSv1.2","155","Application Data"
"313","2018-08-23 01:59:12.373538","192.168.2.3","216.58.197.4","TCP","1434","34236  >  443 [ACK] Seq=170555 Ack=4578 Win=1828 Len=1368 TSval=7823450 TSecr=760127079 [TCP segment of a reassembled PDU]"
"314","2018-08-23 01:59:12.373543","192.168.2.3","216.58.197.4","TCP","1434","34236  >  443 [ACK] Seq=171923 Ack=4578 Win=1828 Len=1368 TSval=7823450 TSecr=760127079 [TCP segment of a reassembled PDU]"
"315","2018-08-23 01:59:12.373722","192.168.2.3","216.58.197.4","TLSv1.2","212","Application Data"
"316","2018-08-23 01:59:12.373724","192.168.2.3","216.58.197.4","TCP","1434","34236  >  443 [ACK] Seq=173437 Ack=4578 Win=1828 Len=1368 TSval=7823450 TSecr=760127079 [TCP segment of a reassembled PDU]"
"317","2018-08-23 01:59:12.373910","192.168.2.3","216.58.197.4","TLSv1.2","155","Application Data"
"320","2018-08-23 01:59:12.481580","192.168.2.3","216.58.197.4","TCP","1434","34236  >  443 [ACK] Seq=174894 Ack=4578 Win=1828 Len=1368 TSval=7823460 TSecr=760127174 [TCP segment of a reassembled PDU]"
"321","2018-08-23 01:59:12.481586","192.168.2.3","216.58.197.4","TCP","1434","34236  >  443 [ACK] Seq=176262 Ack=4578 Win=1828 Len=1368 TSval=7823460 TSecr=760127174 [TCP segment of a reassembled PDU]"
"322","2018-08-23 01:59:12.481587","192.168.2.3","216.58.197.4","TLSv1.2","212","Application Data"
"323","2018-08-23 01:59:12.481847","192.168.2.3","216.58.197.4","TLSv1.2","1178","Application Data"
"330","2018-08-23 01:59:12.487609","192.168.2.3","216.58.197.4","TCP","66","34236  >  443 [ACK] Seq=178888 Ack=4758 Win=1828 Len=0 TSval=7823461 TSecr=760127282"
"331","2018-08-23 01:59:12.518922","192.168.2.3","216.58.197.4","TCP","66","34236  >  443 [ACK] Seq=178888 Ack=4973 Win=1828 Len=0 TSval=7823465 TSecr=760127283"
"332","2018-08-23 01:59:12.596765","192.168.2.3","216.58.197.4","TCP","1434","34236  >  443 [ACK] Seq=178888 Ack=4973 Win=1828 Len=1368 TSval=7823472 TSecr=760127283 [TCP segment of a reassembled PDU]"
"333","2018-08-23 01:59:12.597147","192.168.2.3","216.58.197.4","TCP","1434","34236  >  443 [ACK] Seq=180256 Ack=4973 Win=1828 Len=1368 TSval=7823472 TSecr=760127283 [TCP segment of a reassembled PDU]"
"334","2018-08-23 01:59:12.597150","192.168.2.3","216.58.197.4","TLSv1.2","212","Application Data"
"335","2018-08-23 01:59:12.597344","192.168.2.3","216.58.197.4","TCP","1434","34236  >  443 [ACK] Seq=181770 Ack=4973 Win=1828 Len=1368 TSval=7823472 TSecr=760127283 [TCP segment of a reassembled PDU]"
"336","2018-08-23 01:59:12.597347","192.168.2.3","216.58.197.4","TLSv1.2","155","Application Data"
"340","2018-08-23 01:59:12.706749","192.168.2.3","216.58.197.4","TCP","1434","34236  >  443 [ACK] Seq=183227 Ack=4973 Win=1828 Len=1368 TSval=7823483 TSecr=760127437 [TCP segment of a reassembled PDU]"
"341","2018-08-23 01:59:12.706755","192.168.2.3","216.58.197.4","TCP","1434","34236  >  443 [ACK] Seq=184595 Ack=4973 Win=1828 Len=1368 TSval=7823483 TSecr=760127437 [TCP segment of a reassembled PDU]"
"342","2018-08-23 01:59:12.706756","192.168.2.3","216.58.197.4","TLSv1.2","212","Application Data"
"343","2018-08-23 01:59:12.707209","192.168.2.3","216.58.197.4","TCP","1434","34236  >  443 [ACK] Seq=186109 Ack=4973 Win=1828 Len=1368 TSval=7823483 TSecr=760127437 [TCP segment of a reassembled PDU]"
"344","2018-08-23 01:59:12.707211","192.168.2.3","216.58.197.4","TLSv1.2","155","Application Data"
"350","2018-08-23 01:59:12.776706","192.168.2.3","216.58.197.4","TCP","66","34236  >  443 [ACK] Seq=187566 Ack=5143 Win=1828 Len=0 TSval=7823490 TSecr=760127567"
"351","2018-08-23 01:59:12.776714","192.168.2.3","216.58.197.4","TCP","66","34236  >  443 [ACK] Seq=187566 Ack=5202 Win=1828 Len=0 TSval=7823490 TSecr=760127567"
"352","2018-08-23 01:59:12.819140","192.168.2.3","216.58.197.4","TCP","1434","34236  >  443 [ACK] Seq=187566 Ack=5202 Win=1828 Len=1368 TSval=7823494 TSecr=760127567 [TCP segment of a reassembled PDU]"
"353","2018-08-23 01:59:12.819146","192.168.2.3","216.58.197.4","TCP","1434","34236  >  443 [ACK] Seq=188934 Ack=5202 Win=1828 Len=1368 TSval=7823494 TSecr=760127567 [TCP segment of a reassembled PDU]"
"354","2018-08-23 01:59:12.819148","192.168.2.3","216.58.197.4","TLSv1.2","212","Application Data"
"355","2018-08-23 01:59:12.819397","192.168.2.3","216.58.197.4","TCP","1434","34236  >  443 [ACK] Seq=190448 Ack=5202 Win=1828 Len=1368 TSval=7823494 TSecr=760127567 [TCP segment of a reassembled PDU]"
"356","2018-08-23 01:59:12.819400","192.168.2.3","216.58.197.4","TLSv1.2","155","Application Data"
"360","2018-08-23 01:59:12.917421","192.168.2.3","216.58.197.4","TCP","1434","34236  >  443 [ACK] Seq=191905 Ack=5202 Win=1828 Len=1368 TSval=7823504 TSecr=760127620 [TCP segment of a reassembled PDU]"
"361","2018-08-23 01:59:12.917772","192.168.2.3","216.58.197.4","TCP","1434","34236  >  443 [ACK] Seq=193273 Ack=5202 Win=1828 Len=1368 TSval=7823504 TSecr=760127620 [TCP segment of a reassembled PDU]"
"362","2018-08-23 01:59:12.917777","192.168.2.3","216.58.197.4","TLSv1.2","212","Application Data"
"363","2018-08-23 01:59:12.917778","192.168.2.3","216.58.197.4","TCP","1434","34236  >  443 [ACK] Seq=194787 Ack=5202 Win=1828 Len=1368 TSval=7823504 TSecr=760127620 [TCP segment of a reassembled PDU]"
"364","2018-08-23 01:59:12.917957","192.168.2.3","216.58.197.4","TLSv1.2","155","Application Data"
"370","2018-08-23 01:59:12.969433","192.168.2.3","216.58.197.4","TCP","66","34236  >  443 [ACK] Seq=196244 Ack=5431 Win=1828 Len=0 TSval=7823510 TSecr=760127764"
"371","2018-08-23 01:59:12.969745","192.168.2.3","216.58.197.4","TCP","66","34236  >  443 [ACK] Seq=196244 Ack=5486 Win=1828 Len=0 TSval=7823510 TSecr=760127765"
"373","2018-08-23 01:59:12.982153","192.168.2.3","216.58.197.4","TCP","66","34236  >  443 [ACK] Seq=196244 Ack=5546 Win=1828 Len=0 TSval=7823511 TSecr=760127775"
"375","2018-08-23 01:59:12.996144","192.168.2.3","216.58.197.4","TCP","66","34236  >  443 [ACK] Seq=196244 Ack=5725 Win=1828 Len=0 TSval=7823512 TSecr=760127788"
"376","2018-08-23 01:59:13.023965","192.168.2.3","216.58.197.4","TCP","1434","34236  >  443 [ACK] Seq=196244 Ack=5725 Win=1828 Len=1368 TSval=7823515 TSecr=760127788 [TCP segment of a reassembled PDU]"
"377","2018-08-23 01:59:13.023971","192.168.2.3","216.58.197.4","TCP","1434","34236  >  443 [ACK] Seq=197612 Ack=5725 Win=1828 Len=1368 TSval=7823515 TSecr=760127788 [TCP segment of a reassembled PDU]"
"378","2018-08-23 01:59:13.023972","192.168.2.3","216.58.197.4","TLSv1.2","212","Application Data"
"379","2018-08-23 01:59:13.024276","192.168.2.3","216.58.197.4","TCP","1434","34236  >  443 [ACK] Seq=199126 Ack=5725 Win=1828 Len=1368 TSval=7823515 TSecr=760127788 [TCP segment of a reassembled PDU]"
"380","2018-08-23 01:59:13.024277","192.168.2.3","216.58.197.4","TLSv1.2","155","Application Data"
"381","2018-08-23 01:59:13.024278","192.168.2.3","216.58.197.4","TLSv1.2","147","Application Data"
"382","2018-08-23 01:59:13.024279","192.168.2.3","216.58.197.4","TLSv1.2","102","Application Data"
"388","2018-08-23 01:59:13.033184","192.168.2.3","216.58.197.4","TCP","66","34236  >  443 [ACK] Seq=200700 Ack=6713 Win=1828 Len=0 TSval=7823516 TSecr=760127826"
"391","2018-08-23 01:59:13.993796","192.168.2.3","216.58.197.4","TCP","66","34236  >  443 [ACK] Seq=200700 Ack=6887 Win=1828 Len=0 TSval=7823612 TSecr=760128775"
"394","2018-08-23 01:59:14.993743","192.168.2.3","216.58.197.4","TCP","66","34236  >  443 [ACK] Seq=200700 Ack=7127 Win=1828 Len=0 TSval=7823712 TSecr=760129775"
"396","2018-08-23 01:59:15.149401","192.168.2.3","216.58.197.4","TCP","66","34236  >  443 [ACK] Seq=200700 Ack=7279 Win=1828 Len=0 TSval=7823728 TSecr=760129909"
"399","2018-08-23 01:59:15.150788","192.168.2.3","216.58.197.4","TCP","66","34236  >  443 [ACK] Seq=200700 Ack=8697 Win=1812 Len=0 TSval=7823728 TSecr=760129945"
"400","2018-08-23 01:59:15.151059","192.168.2.3","216.58.197.4","TCP","66","34236  >  443 [ACK] Seq=200700 Ack=8757 Win=1812 Len=0 TSval=7823728 TSecr=760129945"
"450","2018-08-23 01:59:15.862854","192.168.2.3","216.58.197.4","TCP","66","34236  >  443 [ACK] Seq=200700 Ack=10175 Win=1812 Len=0 TSval=7823794 TSecr=760130593"
"451","2018-08-23 01:59:15.862858","192.168.2.3","216.58.197.4","TCP","66","34236  >  443 [ACK] Seq=200700 Ack=10593 Win=1812 Len=0 TSval=7823794 TSecr=760130593"
"452","2018-08-23 01:59:15.862859","192.168.2.3","216.58.197.4","TCP","66","34236  >  443 [ACK] Seq=200700 Ack=12011 Win=1812 Len=0 TSval=7823796 TSecr=760130593"
"453","2018-08-23 01:59:15.862860","192.168.2.3","216.58.197.4","TCP","66","34236  >  443 [ACK] Seq=200700 Ack=14263 Win=1800 Len=0 TSval=7823796 TSecr=760130596"
"454","2018-08-23 01:59:15.862861","192.168.2.3","216.58.197.4","TCP","66","34236  >  443 [ACK] Seq=200700 Ack=15681 Win=1812 Len=0 TSval=7823796 TSecr=760130596"
"455","2018-08-23 01:59:15.863002","192.168.2.3","216.58.197.4","TCP","66","34236  >  443 [ACK] Seq=200700 Ack=17855 Win=1807 Len=0 TSval=7823796 TSecr=760130600"
"456","2018-08-23 01:59:15.863004","192.168.2.3","216.58.197.4","TCP","66","34236  >  443 [ACK] Seq=200700 Ack=19273 Win=1812 Len=0 TSval=7823796 TSecr=760130600"
"457","2018-08-23 01:59:15.863005","192.168.2.3","216.58.197.4","TCP","66","34236  >  443 [ACK] Seq=200700 Ack=21299 Win=1812 Len=0 TSval=7823796 TSecr=760130603"
"464","2018-08-23 01:59:15.872355","192.168.2.3","216.58.197.4","TCP","66","34236  >  443 [ACK] Seq=200700 Ack=22717 Win=1812 Len=0 TSval=7823800 TSecr=760130630"
"465","2018-08-23 01:59:15.872357","192.168.2.3","216.58.197.4","TCP","66","34236  >  443 [ACK] Seq=200700 Ack=23056 Win=1812 Len=0 TSval=7823800 TSecr=760130630"
"466","2018-08-23 01:59:15.872358","192.168.2.3","216.58.197.4","TCP","66","34236  >  443 [ACK] Seq=200700 Ack=24787 Win=1812 Len=0 TSval=7823800 TSecr=760130630"
"467","2018-08-23 01:59:15.872359","192.168.2.3","216.58.197.4","TCP","66","34236  >  443 [ACK] Seq=200700 Ack=28438 Win=1828 Len=0 TSval=7823800 TSecr=760130631"
"484","2018-08-23 01:59:15.880349","192.168.2.3","216.58.197.4","TCP","66","34236  >  443 [ACK] Seq=200700 Ack=35329 Win=1828 Len=0 TSval=7823800 TSecr=760130638"
"485","2018-08-23 01:59:15.880352","192.168.2.3","216.58.197.4","TCP","66","34236  >  443 [ACK] Seq=200700 Ack=37485 Win=1828 Len=0 TSval=7823800 TSecr=760130638"
"486","2018-08-23 01:59:15.880353","192.168.2.3","216.58.197.4","TCP","66","34236  >  443 [ACK] Seq=200700 Ack=39348 Win=1828 Len=0 TSval=7823800 TSecr=760130642"
"487","2018-08-23 01:59:15.880354","192.168.2.3","216.58.197.4","TCP","66","34236  >  443 [ACK] Seq=200700 Ack=41025 Win=1828 Len=0 TSval=7823800 TSecr=760130642"
"488","2018-08-23 01:59:15.880355","192.168.2.3","216.58.197.4","TCP","66","34236  >  443 [ACK] Seq=200700 Ack=46358 Win=1828 Len=0 TSval=7823801 TSecr=760130644"
"489","2018-08-23 01:59:15.882071","192.168.2.3","216.58.197.4","TCP","66","34236  >  443 [ACK] Seq=200700 Ack=53126 Win=1828 Len=0 TSval=7823801 TSecr=760130648"
"490","2018-08-23 01:59:15.882074","192.168.2.3","216.58.197.4","TCP","66","34236  >  443 [ACK] Seq=200700 Ack=60484 Win=1828 Len=0 TSval=7823801 TSecr=760130663"
"491","2018-08-23 01:59:15.883423","192.168.2.3","216.58.197.4","TCP","66","34236  >  443 [ACK] Seq=200700 Ack=65869 Win=1828 Len=0 TSval=7823801 TSecr=760130670"
"503","2018-08-23 01:59:15.886870","192.168.2.3","216.58.197.4","TCP","66","34236  >  443 [ACK] Seq=200700 Ack=77439 Win=1828 Len=0 TSval=7823801 TSecr=760130671"
"504","2018-08-23 01:59:15.887586","192.168.2.3","216.58.197.4","TCP","66","34236  >  443 [ACK] Seq=200700 Ack=80099 Win=1828 Len=0 TSval=7823801 TSecr=760130681"
"505","2018-08-23 01:59:15.887589","192.168.2.3","216.58.197.4","TCP","66","34236  >  443 [ACK] Seq=200700 Ack=82448 Win=1828 Len=0 TSval=7823801 TSecr=760130682"
"510","2018-08-23 01:59:15.888942","192.168.2.3","216.58.197.4","TCP","66","34236  >  443 [ACK] Seq=200700 Ack=84297 Win=1828 Len=0 TSval=7823801 TSecr=760130683"
"513","2018-08-23 01:59:15.889734","192.168.2.3","216.58.197.4","TCP","66","34236  >  443 [ACK] Seq=200700 Ack=86196 Win=1828 Len=0 TSval=7823802 TSecr=760130683"
"514","2018-08-23 01:59:15.889737","192.168.2.3","216.58.197.4","TCP","66","34236  >  443 [ACK] Seq=200700 Ack=87614 Win=1872 Len=0 TSval=7823802 TSecr=760130684"
"515","2018-08-23 01:59:15.889738","192.168.2.3","216.58.197.4","TCP","66","34236  >  443 [ACK] Seq=200700 Ack=88053 Win=1916 Len=0 TSval=7823802 TSecr=760130684"
"518","2018-08-23 01:59:15.890917","192.168.2.3","216.58.197.4","TCP","66","34236  >  443 [ACK] Seq=200700 Ack=89471 Win=1961 Len=0 TSval=7823802 TSecr=760130685"
"519","2018-08-23 01:59:15.890920","192.168.2.3","216.58.197.4","TCP","66","34236  >  443 [ACK] Seq=200700 Ack=89868 Win=2005 Len=0 TSval=7823802 TSecr=760130685"
"524","2018-08-23 01:59:15.891789","192.168.2.3","216.58.197.4","TCP","66","34236  >  443 [ACK] Seq=200700 Ack=91286 Win=2049 Len=0 TSval=7823802 TSecr=760130685"
"527","2018-08-23 01:59:15.892196","192.168.2.3","216.58.197.4","TCP","66","34236  >  443 [ACK] Seq=200700 Ack=91717 Win=2093 Len=0 TSval=7823802 TSecr=760130685"
"538","2018-08-23 01:59:15.898229","192.168.2.3","216.58.197.4","TCP","66","34236  >  443 [ACK] Seq=200700 Ack=93135 Win=2138 Len=0 TSval=7823802 TSecr=760130686"
"539","2018-08-23 01:59:15.898233","192.168.2.3","216.58.197.4","TCP","66","34236  >  443 [ACK] Seq=200700 Ack=93444 Win=2182 Len=0 TSval=7823802 TSecr=760130686"
"540","2018-08-23 01:59:15.898234","192.168.2.3","216.58.197.4","TCP","66","34236  >  443 [ACK] Seq=200700 Ack=94862 Win=2226 Len=0 TSval=7823802 TSecr=760130687"
"541","2018-08-23 01:59:15.898235","192.168.2.3","216.58.197.4","TCP","66","34236  >  443 [ACK] Seq=200700 Ack=97042 Win=2348 Len=0 TSval=7823802 TSecr=760130687"
"542","2018-08-23 01:59:15.900121","192.168.2.3","216.58.197.4","TCP","66","34236  >  443 [ACK] Seq=200700 Ack=103666 Win=2359 Len=0 TSval=7823803 TSecr=760130688"
"543","2018-08-23 01:59:15.913066","192.168.2.3","216.58.197.4","TLSv1.2","104","Application Data"
"545","2018-08-23 01:59:23.309050","192.168.2.3","216.58.197.14","TCP","66","41142  >  443 [ACK] Seq=1 Ack=1 Win=597 Len=0 TSval=7824544 TSecr=933101809"
"548","2018-08-23 01:59:27.469083","192.168.2.3","108.177.97.188","TCP","66","58805  >  5228 [ACK] Seq=1 Ack=1 Win=406 Len=0 TSval=7824960 TSecr=2777666376"
"550","2018-08-23 01:59:35.949193","192.168.2.3","74.125.204.188","TCP","66","33038  >  5228 [ACK] Seq=1 Ack=1 Win=406 Len=0 TSval=7825808 TSecr=3813854364"
"552","2018-08-23 01:59:36.613430","192.168.2.3","216.58.197.14","TLSv1.2","162","[TCP Previous segment not captured] , Application Data"
"553","2018-08-23 01:59:36.613773","192.168.2.3","216.58.197.14","TLSv1.2","104","Application Data"
"554","2018-08-23 01:59:36.613776","192.168.2.3","216.58.197.14","TLSv1.2","581","Application Data"
"559","2018-08-23 01:59:36.659235","192.168.2.3","216.58.197.14","TCP","66","41142  >  443 [ACK] Seq=651 Ack=39 Win=597 Len=0 TSval=7825879 TSecr=933160148"
"564","2018-08-23 01:59:36.696615","192.168.2.3","216.58.197.14","TCP","66","41142  >  443 [ACK] Seq=651 Ack=390 Win=614 Len=0 TSval=7825882 TSecr=933160225"
"565","2018-08-23 01:59:36.696844","192.168.2.3","216.58.197.14","TCP","66","41142  >  443 [ACK] Seq=651 Ack=630 Win=631 Len=0 TSval=7825882 TSecr=933160225"
"566","2018-08-23 01:59:36.697135","192.168.2.3","216.58.197.14","TCP","66","41142  >  443 [ACK] Seq=651 Ack=668 Win=631 Len=0 TSval=7825882 TSecr=933160226"
"567","2018-08-23 01:59:36.697919","192.168.2.3","216.58.197.14","TLSv1.2","104","Application Data"
