"No.","Time","Source","Destination","Protocol","Length","Info"
"1","2018-08-23 01:58:17.016727","192.168.2.3","216.58.197.4","TLSv1.2","156","Application Data"
"2","2018-08-23 01:58:17.016732","192.168.2.3","216.58.197.4","TLSv1.2","104","Application Data"
"3","2018-08-23 01:58:17.016732","192.168.2.3","216.58.197.4","TLSv1.2","158","Application Data"
"8","2018-08-23 01:58:17.026924","192.168.2.3","216.58.197.4","TCP","1434","34236  >  443 [ACK] Seq=221 Ack=39 Win=1828 Len=1368 TSval=7817915 TSecr=760071818 [TCP segment of a reassembled PDU]"
"9","2018-08-23 01:58:17.027231","192.168.2.3","216.58.197.4","TCP","1434","34236  >  443 [ACK] Seq=1589 Ack=39 Win=1828 Len=1368 TSval=7817915 TSecr=760071818 [TCP segment of a reassembled PDU]"
"10","2018-08-23 01:58:17.027234","192.168.2.3","216.58.197.4","TLSv1.2","212","Application Data"
"11","2018-08-23 01:58:17.027624","192.168.2.3","216.58.197.4","TCP","1434","34236  >  443 [ACK] Seq=3103 Ack=39 Win=1828 Len=1368 TSval=7817915 TSecr=760071818 [TCP segment of a reassembled PDU]"
"12","2018-08-23 01:58:17.027628","192.168.2.3","216.58.197.4","TLSv1.2","222","Application Data"
"13","2018-08-23 01:58:17.028103","192.168.2.3","216.58.197.4","TCP","1434","34236  >  443 [ACK] Seq=4627 Ack=39 Win=1828 Len=1368 TSval=7817915 TSecr=760071818 [TCP segment of a reassembled PDU]"
"14","2018-08-23 01:58:17.028106","192.168.2.3","216.58.197.4","TCP","1434","34236  >  443 [ACK] Seq=5995 Ack=39 Win=1828 Len=1368 TSval=7817915 TSecr=760071818 [TCP segment of a reassembled PDU]"
"15","2018-08-23 01:58:17.028107","192.168.2.3","216.58.197.4","TLSv1.2","212","Application Data"
"16","2018-08-23 01:58:17.028426","192.168.2.3","216.58.197.4","TCP","1434","34236  >  443 [ACK] Seq=7509 Ack=39 Win=1828 Len=1368 TSval=7817915 TSecr=760071818 [TCP segment of a reassembled PDU]"
"17","2018-08-23 01:58:17.028836","192.168.2.3","216.58.197.4","TCP","1434","34236  >  443 [ACK] Seq=8877 Ack=39 Win=1828 Len=1368 TSval=7817915 TSecr=760071818 [TCP segment of a reassembled PDU]"
"22","2018-08-23 01:58:17.033007","192.168.2.3","216.58.197.4","TLSv1.2","1434","Application Data [TCP segment of a reassembled PDU]"
"24","2018-08-23 01:58:17.033303","192.168.2.3","216.58.197.4","TCP","1434","34236  >  443 [ACK] Seq=11613 Ack=39 Win=1828 Len=1368 TSval=7817916 TSecr=760071828 [TCP segment of a reassembled PDU]"
"25","2018-08-23 01:58:17.033494","192.168.2.3","216.58.197.4","TLSv1.2","1434","Application Data [TCP segment of a reassembled PDU]"
"26","2018-08-23 01:58:17.034766","192.168.2.3","216.58.197.4","TCP","1434","34236  >  443 [ACK] Seq=14349 Ack=39 Win=1828 Len=1368 TSval=7817916 TSecr=760071828 [TCP segment of a reassembled PDU]"
"27","2018-08-23 01:58:17.034768","192.168.2.3","216.58.197.4","TLSv1.2","1434","Application Data [TCP segment of a reassembled PDU]"
"28","2018-08-23 01:58:17.034976","192.168.2.3","216.58.197.4","TCP","1434","34236  >  443 [ACK] Seq=17085 Ack=39 Win=1828 Len=1368 TSval=7817916 TSecr=760071828 [TCP segment of a reassembled PDU]"
"29","2018-08-23 01:58:17.035778","192.168.2.3","216.58.197.4","TLSv1.2","1434","Application Data [TCP segment of a reassembled PDU]"
"30","2018-08-23 01:58:17.036069","192.168.2.3","216.58.197.4","TCP","1434","34236  >  443 [ACK] Seq=19821 Ack=39 Win=1828 Len=1368 TSval=7817916 TSecr=760071828 [TCP segment of a reassembled PDU]"
"31","2018-08-23 01:58:17.036493","192.168.2.3","216.58.197.4","TLSv1.2","1434","Application Data, Application Data"
"32","2018-08-23 01:58:17.036496","192.168.2.3","216.58.197.4","TCP","1434","34236  >  443 [ACK] Seq=22557 Ack=39 Win=1828 Len=1368 TSval=7817916 TSecr=760071828 [TCP segment of a reassembled PDU]"
"33","2018-08-23 01:58:17.036745","192.168.2.3","216.58.197.4","TLSv1.2","1434","Application Data [TCP segment of a reassembled PDU]"
"34","2018-08-23 01:58:17.036863","192.168.2.3","216.58.197.4","TLSv1.2","1434","Application Data [TCP segment of a reassembled PDU]"
"35","2018-08-23 01:58:17.037146","192.168.2.3","216.58.197.4","TCP","1434","34236  >  443 [ACK] Seq=26661 Ack=39 Win=1828 Len=1368 TSval=7817916 TSecr=760071829 [TCP segment of a reassembled PDU]"
"37","2018-08-23 01:58:17.037454","192.168.2.3","216.58.197.4","TLSv1.2","1434","Application Data [TCP segment of a reassembled PDU]"
"38","2018-08-23 01:58:17.037806","192.168.2.3","216.58.197.4","TCP","1434","34236  >  443 [ACK] Seq=29397 Ack=39 Win=1828 Len=1368 TSval=7817916 TSecr=760071829 [TCP segment of a reassembled PDU]"
"45","2018-08-23 01:58:17.045973","192.168.2.3","216.58.197.4","TLSv1.2","1434","Application Data [TCP segment of a reassembled PDU]"
"46","2018-08-23 01:58:17.046122","192.168.2.3","216.58.197.4","TCP","1434","34236  >  443 [ACK] Seq=32133 Ack=39 Win=1828 Len=1368 TSval=7817917 TSecr=760071834 [TCP segment of a reassembled PDU]"
"47","2018-08-23 01:58:17.046470","192.168.2.3","216.58.197.4","TCP","1434","34236  >  443 [ACK] Seq=33501 Ack=39 Win=1828 Len=1368 TSval=7817917 TSecr=760071834 [TCP segment of a reassembled PDU]"
"48","2018-08-23 01:58:17.047171","192.168.2.3","216.58.197.4","TLSv1.2","1434","Application Data [TCP segment of a reassembled PDU]"
"49","2018-08-23 01:58:17.047174","192.168.2.3","216.58.197.4","TCP","1434","34236  >  443 [ACK] Seq=36237 Ack=39 Win=1828 Len=1368 TSval=7817917 TSecr=760071835 [TCP segment of a reassembled PDU]"
"50","2018-08-23 01:58:17.047548","192.168.2.3","216.58.197.4","TLSv1.2","1434","Application Data [TCP segment of a reassembled PDU]"
"51","2018-08-23 01:58:17.048685","192.168.2.3","216.58.197.4","TCP","1434","34236  >  443 [ACK] Seq=38973 Ack=39 Win=1828 Len=1368 TSval=7817917 TSecr=760071835 [TCP segment of a reassembled PDU]"
"52","2018-08-23 01:58:17.048688","192.168.2.3","216.58.197.4","TLSv1.2","1434","Application Data [TCP segment of a reassembled PDU]"
"53","2018-08-23 01:58:17.049022","192.168.2.3","216.58.197.4","TLSv1.2","1434","Application Data [TCP segment of a reassembled PDU]"
"54","2018-08-23 01:58:17.049025","192.168.2.3","216.58.197.4","TCP","1434","34236  >  443 [ACK] Seq=43077 Ack=39 Win=1828 Len=1368 TSval=7817917 TSecr=760071836 [TCP segment of a reassembled PDU]"
"55","2018-08-23 01:58:17.049191","192.168.2.3","216.58.197.4","TLSv1.2","1434","Application Data [TCP segment of a reassembled PDU]"
"56","2018-08-23 01:58:17.049660","192.168.2.3","216.58.197.4","TCP","1434","34236  >  443 [ACK] Seq=45813 Ack=39 Win=1828 Len=1368 TSval=7817917 TSecr=760071837 [TCP segment of a reassembled PDU]"
"57","2018-08-23 01:58:17.049886","192.168.2.3","216.58.197.4","TCP","1434","34236  >  443 [ACK] Seq=47181 Ack=39 Win=1828 Len=1368 TSval=7817917 TSecr=760071837 [TCP segment of a reassembled PDU]"
"58","2018-08-23 01:58:17.049889","192.168.2.3","216.58.197.4","TLSv1.2","1434","Application Data [TCP segment of a reassembled PDU]"
"59","2018-08-23 01:58:17.050037","192.168.2.3","216.58.197.4","TCP","1434","34236  >  443 [PSH, ACK] Seq=49917 Ack=39 Win=1828 Len=1368 TSval=7817917 TSecr=760071837 [TCP segment of a reassembled PDU]"
"60","2018-08-23 01:58:17.050204","192.168.2.3","216.58.197.4","TLSv1.2","1434","Application Data [TCP segment of a reassembled PDU]"
"62","2018-08-23 01:58:17.050447","192.168.2.3","216.58.197.4","TCP","1434","34236  >  443 [ACK] Seq=52653 Ack=39 Win=1828 Len=1368 TSval=7817917 TSecr=760071838 [TCP segment of a reassembled PDU]"
"64","2018-08-23 01:58:17.050765","192.168.2.3","216.58.197.4","TLSv1.2","1434","Application Data [TCP segment of a reassembled PDU]"
"65","2018-08-23 01:58:17.050767","192.168.2.3","216.58.197.4","TCP","1434","34236  >  443 [ACK] Seq=55389 Ack=39 Win=1828 Len=1368 TSval=7817917 TSecr=760071838 [TCP segment of a reassembled PDU]"
"67","2018-08-23 01:58:17.052151","192.168.2.3","216.58.197.4","TLSv1.2","1434","Application Data [TCP segment of a reassembled PDU]"
"68","2018-08-23 01:58:17.052554","192.168.2.3","216.58.197.4","TLSv1.2","1434","Application Data [TCP segment of a reassembled PDU]"
"69","2018-08-23 01:58:17.052556","192.168.2.3","216.58.197.4","TCP","1434","34236  >  443 [ACK] Seq=59493 Ack=39 Win=1828 Len=1368 TSval=7817918 TSecr=760071847 [TCP segment of a reassembled PDU]"
"70","2018-08-23 01:58:17.052716","192.168.2.3","216.58.197.4","TLSv1.2","169","Application Data"
"80","2018-08-23 01:58:17.077367","192.168.2.3","216.58.197.4","TCP","1434","34236  >  443 [ACK] Seq=60964 Ack=39 Win=1828 Len=1368 TSval=7817920 TSecr=760071853 [TCP segment of a reassembled PDU]"
"81","2018-08-23 01:58:17.077372","192.168.2.3","216.58.197.4","TCP","1434","34236  >  443 [ACK] Seq=62332 Ack=39 Win=1828 Len=1368 TSval=7817920 TSecr=760071853 [TCP segment of a reassembled PDU]"
"82","2018-08-23 01:58:17.077374","192.168.2.3","216.58.197.4","TLSv1.2","212","Application Data"
"83","2018-08-23 01:58:17.077488","192.168.2.3","216.58.197.4","TCP","1434","34236  >  443 [ACK] Seq=63846 Ack=39 Win=1828 Len=1368 TSval=7817920 TSecr=760071853 [TCP segment of a reassembled PDU]"
"84","2018-08-23 01:58:17.077620","192.168.2.3","216.58.197.4","TLSv1.2","155","Application Data"
"88","2018-08-23 01:58:17.173167","192.168.2.3","216.58.197.4","TCP","1434","34236  >  443 [ACK] Seq=65303 Ack=39 Win=1828 Len=1368 TSval=7817930 TSecr=760071918 [TCP segment of a reassembled PDU]"
"89","2018-08-23 01:58:17.173177","192.168.2.3","216.58.197.4","TCP","1434","34236  >  443 [ACK] Seq=66671 Ack=39 Win=1828 Len=1368 TSval=7817930 TSecr=760071918 [TCP segment of a reassembled PDU]"
"90","2018-08-23 01:58:17.173303","192.168.2.3","216.58.197.4","TLSv1.2","212","Application Data"
"91","2018-08-23 01:58:17.173483","192.168.2.3","216.58.197.4","TCP","1434","34236  >  443 [ACK] Seq=68185 Ack=39 Win=1828 Len=1368 TSval=7817930 TSecr=760071918 [TCP segment of a reassembled PDU]"
"92","2018-08-23 01:58:17.173487","192.168.2.3","216.58.197.4","TLSv1.2","155","Application Data"
"95","2018-08-23 01:58:17.279958","192.168.2.3","216.58.197.4","TCP","1434","34236  >  443 [ACK] Seq=69642 Ack=39 Win=1828 Len=1368 TSval=7817941 TSecr=760071974 [TCP segment of a reassembled PDU]"
"96","2018-08-23 01:58:17.279963","192.168.2.3","216.58.197.4","TCP","1434","34236  >  443 [ACK] Seq=71010 Ack=39 Win=1828 Len=1368 TSval=7817941 TSecr=760071974 [TCP segment of a reassembled PDU]"
"97","2018-08-23 01:58:17.279964","192.168.2.3","216.58.197.4","TLSv1.2","212","Application Data"
"98","2018-08-23 01:58:17.280391","192.168.2.3","216.58.197.4","TCP","1434","34236  >  443 [ACK] Seq=72524 Ack=39 Win=1828 Len=1368 TSval=7817941 TSecr=760071974 [TCP segment of a reassembled PDU]"
"99","2018-08-23 01:58:17.280394","192.168.2.3","216.58.197.4","TLSv1.2","155","Application Data"
"105","2018-08-23 01:58:17.371798","192.168.2.3","216.58.197.4","TCP","66","34236  >  443 [ACK] Seq=73981 Ack=313 Win=1828 Len=0 TSval=7817950 TSecr=760072167"
"106","2018-08-23 01:58:17.377893","192.168.2.3","216.58.197.4","TCP","1434","34236  >  443 [ACK] Seq=73981 Ack=521 Win=1828 Len=1368 TSval=7817950 TSecr=760072167 [TCP segment of a reassembled PDU]"
"107","2018-08-23 01:58:17.377898","192.168.2.3","216.58.197.4","TCP","1434","34236  >  443 [ACK] Seq=75349 Ack=521 Win=1828 Len=1368 TSval=7817950 TSecr=760072167 [TCP segment of a reassembled PDU]"
"108","2018-08-23 01:58:17.377900","192.168.2.3","216.58.197.4","TLSv1.2","212","Application Data"
"109","2018-08-23 01:58:17.378158","192.168.2.3","216.58.197.4","TCP","1434","34236  >  443 [ACK] Seq=76863 Ack=521 Win=1828 Len=1368 TSval=7817950 TSecr=760072167 [TCP segment of a reassembled PDU]"
"110","2018-08-23 01:58:17.378160","192.168.2.3","216.58.197.4","TLSv1.2","155","Application Data"
"115","2018-08-23 01:58:17.418251","192.168.2.3","216.58.197.4","TCP","66","34236  >  443 [ACK] Seq=78320 Ack=751 Win=1828 Len=0 TSval=7817955 TSecr=760072180"
"116","2018-08-23 01:58:17.472967","192.168.2.3","216.58.197.4","TCP","1434","34236  >  443 [ACK] Seq=78320 Ack=751 Win=1828 Len=1368 TSval=7817960 TSecr=760072180 [TCP segment of a reassembled PDU]"
"117","2018-08-23 01:58:17.473288","192.168.2.3","216.58.197.4","TCP","1434","34236  >  443 [ACK] Seq=79688 Ack=751 Win=1828 Len=1368 TSval=7817960 TSecr=760072180 [TCP segment of a reassembled PDU]"
"118","2018-08-23 01:58:17.473292","192.168.2.3","216.58.197.4","TLSv1.2","212","Application Data"
"119","2018-08-23 01:58:17.473472","192.168.2.3","216.58.197.4","TCP","1434","34236  >  443 [ACK] Seq=81202 Ack=751 Win=1828 Len=1368 TSval=7817960 TSecr=760072180 [TCP segment of a reassembled PDU]"
"120","2018-08-23 01:58:17.473475","192.168.2.3","216.58.197.4","TLSv1.2","155","Application Data"
"124","2018-08-23 01:58:17.493191","192.168.2.3","216.58.197.4","TCP","66","34236  >  443 [ACK] Seq=82659 Ack=854 Win=1828 Len=0 TSval=7817962 TSecr=760072287"
"125","2018-08-23 01:58:17.586918","192.168.2.3","216.58.197.4","TCP","1434","34236  >  443 [ACK] Seq=82659 Ack=854 Win=1828 Len=1368 TSval=7817971 TSecr=760072287 [TCP segment of a reassembled PDU]"
"126","2018-08-23 01:58:17.586924","192.168.2.3","216.58.197.4","TCP","1434","34236  >  443 [ACK] Seq=84027 Ack=854 Win=1828 Len=1368 TSval=7817971 TSecr=760072287 [TCP segment of a reassembled PDU]"
"127","2018-08-23 01:58:17.586925","192.168.2.3","216.58.197.4","TLSv1.2","212","Application Data"
"128","2018-08-23 01:58:17.587211","192.168.2.3","216.58.197.4","TCP","1434","34236  >  443 [ACK] Seq=85541 Ack=854 Win=1828 Len=1368 TSval=7817971 TSecr=760072287 [TCP segment of a reassembled PDU]"
"129","2018-08-23 01:58:17.587214","192.168.2.3","216.58.197.4","TLSv1.2","155","Application Data"
"134","2018-08-23 01:58:17.661729","192.168.2.3","216.58.197.4","TCP","66","34236  >  443 [ACK] Seq=86998 Ack=913 Win=1828 Len=0 TSval=7817979 TSecr=760072449"
"135","2018-08-23 01:58:17.685034","192.168.2.3","216.58.197.4","TCP","1434","34236  >  443 [ACK] Seq=86998 Ack=913 Win=1828 Len=1368 TSval=7817981 TSecr=760072449 [TCP segment of a reassembled PDU]"
"136","2018-08-23 01:58:17.685040","192.168.2.3","216.58.197.4","TCP","1434","34236  >  443 [ACK] Seq=88366 Ack=913 Win=1828 Len=1368 TSval=7817981 TSecr=760072449 [TCP segment of a reassembled PDU]"
"137","2018-08-23 01:58:17.685041","192.168.2.3","216.58.197.4","TLSv1.2","212","Application Data"
"138","2018-08-23 01:58:17.685380","192.168.2.3","216.58.197.4","TCP","1434","34236  >  443 [ACK] Seq=89880 Ack=913 Win=1828 Len=1368 TSval=7817981 TSecr=760072449 [TCP segment of a reassembled PDU]"
"139","2018-08-23 01:58:17.685384","192.168.2.3","216.58.197.4","TLSv1.2","155","Application Data"
"142","2018-08-23 01:58:17.780896","192.168.2.3","216.58.197.4","TCP","1434","34236  >  443 [ACK] Seq=91337 Ack=913 Win=1828 Len=1368 TSval=7817991 TSecr=760072486 [TCP segment of a reassembled PDU]"
"143","2018-08-23 01:58:17.781187","192.168.2.3","216.58.197.4","TCP","1434","34236  >  443 [ACK] Seq=92705 Ack=913 Win=1828 Len=1368 TSval=7817991 TSecr=760072486 [TCP segment of a reassembled PDU]"
"144","2018-08-23 01:58:17.781190","192.168.2.3","216.58.197.4","TLSv1.2","212","Application Data"
"145","2018-08-23 01:58:17.781191","192.168.2.3","216.58.197.4","TCP","1434","34236  >  443 [ACK] Seq=94219 Ack=913 Win=1828 Len=1368 TSval=7817991 TSecr=760072486 [TCP segment of a reassembled PDU]"
"146","2018-08-23 01:58:17.781291","192.168.2.3","216.58.197.4","TLSv1.2","155","Application Data"
"150","2018-08-23 01:58:17.876810","192.168.2.3","216.58.197.4","TCP","1434","34236  >  443 [ACK] Seq=95676 Ack=913 Win=1828 Len=1368 TSval=7818000 TSecr=760072582 [TCP segment of a reassembled PDU]"
"151","2018-08-23 01:58:17.877102","192.168.2.3","216.58.197.4","TCP","1434","34236  >  443 [ACK] Seq=97044 Ack=913 Win=1828 Len=1368 TSval=7818000 TSecr=760072582 [TCP segment of a reassembled PDU]"
"152","2018-08-23 01:58:17.877106","192.168.2.3","216.58.197.4","TLSv1.2","212","Application Data"
"153","2018-08-23 01:58:17.877279","192.168.2.3","216.58.197.4","TCP","1434","34236  >  443 [ACK] Seq=98558 Ack=913 Win=1828 Len=1368 TSval=7818000 TSecr=760072582 [TCP segment of a reassembled PDU]"
"154","2018-08-23 01:58:17.877281","192.168.2.3","216.58.197.4","TLSv1.2","155","Application Data"
"156","2018-08-23 01:58:17.969776","192.168.2.3","216.58.197.4","TCP","1434","34236  >  443 [ACK] Seq=100015 Ack=913 Win=1828 Len=1368 TSval=7818010 TSecr=760072678 [TCP segment of a reassembled PDU]"
"157","2018-08-23 01:58:17.970267","192.168.2.3","216.58.197.4","TCP","1434","34236  >  443 [ACK] Seq=101383 Ack=913 Win=1828 Len=1368 TSval=7818010 TSecr=760072678 [TCP segment of a reassembled PDU]"
"158","2018-08-23 01:58:17.970269","192.168.2.3","216.58.197.4","TLSv1.2","212","Application Data"
"159","2018-08-23 01:58:17.970641","192.168.2.3","216.58.197.4","TCP","1434","34236  >  443 [ACK] Seq=102897 Ack=913 Win=1828 Len=1368 TSval=7818010 TSecr=760072678 [TCP segment of a reassembled PDU]"
"160","2018-08-23 01:58:17.970644","192.168.2.3","216.58.197.4","TLSv1.2","155","Application Data"
"164","2018-08-23 01:58:18.071322","192.168.2.3","216.58.197.4","TCP","1434","34236  >  443 [ACK] Seq=104354 Ack=913 Win=1828 Len=1368 TSval=7818019 TSecr=760072771 [TCP segment of a reassembled PDU]"
"165","2018-08-23 01:58:18.071518","192.168.2.3","216.58.197.4","TCP","1434","34236  >  443 [ACK] Seq=105722 Ack=913 Win=1828 Len=1368 TSval=7818019 TSecr=760072771 [TCP segment of a reassembled PDU]"
"166","2018-08-23 01:58:18.071520","192.168.2.3","216.58.197.4","TLSv1.2","212","Application Data"
"167","2018-08-23 01:58:18.071724","192.168.2.3","216.58.197.4","TCP","1434","34236  >  443 [ACK] Seq=107236 Ack=913 Win=1828 Len=1368 TSval=7818019 TSecr=760072771 [TCP segment of a reassembled PDU]"
"168","2018-08-23 01:58:18.071727","192.168.2.3","216.58.197.4","TLSv1.2","155","Application Data"
"172","2018-08-23 01:58:18.132598","192.168.2.3","216.58.197.4","TCP","1434","34236  >  443 [ACK] Seq=108693 Ack=913 Win=1828 Len=1368 TSval=7818026 TSecr=760072872 [TCP segment of a reassembled PDU]"
"173","2018-08-23 01:58:18.132966","192.168.2.3","216.58.197.4","TCP","1434","34236  >  443 [ACK] Seq=110061 Ack=913 Win=1828 Len=1368 TSval=7818026 TSecr=760072872 [TCP segment of a reassembled PDU]"
"174","2018-08-23 01:58:18.132970","192.168.2.3","216.58.197.4","TLSv1.2","212","Application Data"
"175","2018-08-23 01:58:18.133416","192.168.2.3","216.58.197.4","TCP","1434","34236  >  443 [ACK] Seq=111575 Ack=913 Win=1828 Len=1368 TSval=7818026 TSecr=760072872 [TCP segment of a reassembled PDU]"
"176","2018-08-23 01:58:18.133420","192.168.2.3","216.58.197.4","TLSv1.2","155","Application Data"
"180","2018-08-23 01:58:18.228536","192.168.2.3","216.58.197.4","TCP","1434","34236  >  443 [ACK] Seq=113032 Ack=913 Win=1828 Len=1368 TSval=7818035 TSecr=760072934 [TCP segment of a reassembled PDU]"
"181","2018-08-23 01:58:18.228794","192.168.2.3","216.58.197.4","TCP","1434","34236  >  443 [ACK] Seq=114400 Ack=913 Win=1828 Len=1368 TSval=7818035 TSecr=760072934 [TCP segment of a reassembled PDU]"
"182","2018-08-23 01:58:18.228797","192.168.2.3","216.58.197.4","TLSv1.2","212","Application Data"
"183","2018-08-23 01:58:18.230008","192.168.2.3","216.58.197.4","TCP","1434","34236  >  443 [ACK] Seq=115914 Ack=913 Win=1828 Len=1368 TSval=7818036 TSecr=760072934 [TCP segment of a reassembled PDU]"
"184","2018-08-23 01:58:18.230011","192.168.2.3","216.58.197.4","TLSv1.2","155","Application Data"
"187","2018-08-23 01:58:18.304423","192.168.2.3","216.58.197.4","TCP","1434","34236  >  443 [ACK] Seq=117371 Ack=913 Win=1828 Len=1368 TSval=7818043 TSecr=760073030 [TCP segment of a reassembled PDU]"
"188","2018-08-23 01:58:18.304428","192.168.2.3","216.58.197.4","TCP","1434","34236  >  443 [ACK] Seq=118739 Ack=913 Win=1828 Len=1368 TSval=7818043 TSecr=760073030 [TCP segment of a reassembled PDU]"
"189","2018-08-23 01:58:18.304429","192.168.2.3","216.58.197.4","TLSv1.2","212","Application Data"
"190","2018-08-23 01:58:18.304630","192.168.2.3","216.58.197.4","TCP","1434","34236  >  443 [ACK] Seq=120253 Ack=913 Win=1828 Len=1368 TSval=7818043 TSecr=760073030 [TCP segment of a reassembled PDU]"
"191","2018-08-23 01:58:18.304634","192.168.2.3","216.58.197.4","TLSv1.2","155","Application Data"
"197","2018-08-23 01:58:18.385462","192.168.2.3","216.58.197.4","TCP","66","34236  >  443 [ACK] Seq=121710 Ack=1455 Win=1828 Len=0 TSval=7818051 TSecr=760073167"
"198","2018-08-23 01:58:18.401776","192.168.2.3","216.58.197.4","TCP","1434","34236  >  443 [ACK] Seq=121710 Ack=1455 Win=1828 Len=1368 TSval=7818053 TSecr=760073167 [TCP segment of a reassembled PDU]"
"199","2018-08-23 01:58:18.401781","192.168.2.3","216.58.197.4","TCP","1434","34236  >  443 [ACK] Seq=123078 Ack=1455 Win=1828 Len=1368 TSval=7818053 TSecr=760073167 [TCP segment of a reassembled PDU]"
"200","2018-08-23 01:58:18.401883","192.168.2.3","216.58.197.4","TLSv1.2","212","Application Data"
"201","2018-08-23 01:58:18.402129","192.168.2.3","216.58.197.4","TCP","1434","34236  >  443 [ACK] Seq=124592 Ack=1455 Win=1828 Len=1368 TSval=7818053 TSecr=760073167 [TCP segment of a reassembled PDU]"
"202","2018-08-23 01:58:18.402131","192.168.2.3","216.58.197.4","TLSv1.2","155","Application Data"
"207","2018-08-23 01:58:18.465088","192.168.2.3","216.58.197.4","TCP","66","34236  >  443 [ACK] Seq=126049 Ack=2008 Win=1828 Len=0 TSval=7818059 TSecr=760073260"
"208","2018-08-23 01:58:18.484531","192.168.2.3","216.58.197.4","TCP","1434","34236  >  443 [ACK] Seq=126049 Ack=2008 Win=1828 Len=1368 TSval=7818061 TSecr=760073260 [TCP segment of a reassembled PDU]"
"209","2018-08-23 01:58:18.484816","192.168.2.3","216.58.197.4","TCP","1434","34236  >  443 [ACK] Seq=127417 Ack=2008 Win=1828 Len=1368 TSval=7818061 TSecr=760073260 [TCP segment of a reassembled PDU]"
"210","2018-08-23 01:58:18.484819","192.168.2.3","216.58.197.4","TLSv1.2","212","Application Data"
"211","2018-08-23 01:58:18.485235","192.168.2.3","216.58.197.4","TCP","1434","34236  >  443 [ACK] Seq=128931 Ack=2008 Win=1828 Len=1368 TSval=7818061 TSecr=760073260 [TCP segment of a reassembled PDU]"
"212","2018-08-23 01:58:18.485239","192.168.2.3","216.58.197.4","TLSv1.2","155","Application Data"
"216","2018-08-23 01:58:18.581954","192.168.2.3","216.58.197.4","TCP","1434","34236  >  443 [ACK] Seq=130388 Ack=2008 Win=1828 Len=1368 TSval=7818071 TSecr=760073286 [TCP segment of a reassembled PDU]"
"217","2018-08-23 01:58:18.581960","192.168.2.3","216.58.197.4","TCP","1434","34236  >  443 [ACK] Seq=131756 Ack=2008 Win=1828 Len=1368 TSval=7818071 TSecr=760073286 [TCP segment of a reassembled PDU]"
"218","2018-08-23 01:58:18.581961","192.168.2.3","216.58.197.4","TLSv1.2","212","Application Data"
"219","2018-08-23 01:58:18.582265","192.168.2.3","216.58.197.4","TCP","1434","34236  >  443 [ACK] Seq=133270 Ack=2008 Win=1828 Len=1368 TSval=7818071 TSecr=760073286 [TCP segment of a reassembled PDU]"
"220","2018-08-23 01:58:18.582269","192.168.2.3","216.58.197.4","TLSv1.2","155","Application Data"
"226","2018-08-23 01:58:18.640753","192.168.2.3","216.58.197.4","TCP","66","34236  >  443 [ACK] Seq=134727 Ack=2496 Win=1828 Len=0 TSval=7818077 TSecr=760073436"
"227","2018-08-23 01:58:18.676542","192.168.2.3","216.58.197.4","TCP","1434","34236  >  443 [ACK] Seq=134727 Ack=2496 Win=1828 Len=1368 TSval=7818080 TSecr=760073436 [TCP segment of a reassembled PDU]"
"228","2018-08-23 01:58:18.681647","192.168.2.3","216.58.197.4","TCP","1434","34236  >  443 [ACK] Seq=136095 Ack=2496 Win=1828 Len=1368 TSval=7818080 TSecr=760073436 [TCP segment of a reassembled PDU]"
"229","2018-08-23 01:58:18.681653","192.168.2.3","216.58.197.4","TLSv1.2","212","Application Data"
"230","2018-08-23 01:58:18.681653","192.168.2.3","216.58.197.4","TCP","1434","34236  >  443 [ACK] Seq=137609 Ack=2496 Win=1828 Len=1368 TSval=7818080 TSecr=760073436 [TCP segment of a reassembled PDU]"
"231","2018-08-23 01:58:18.681733","192.168.2.3","216.58.197.4","TLSv1.2","155","Application Data"
"234","2018-08-23 01:58:18.771561","192.168.2.3","216.58.197.4","TCP","1434","34236  >  443 [ACK] Seq=139066 Ack=2496 Win=1828 Len=1368 TSval=7818090 TSecr=760073482 [TCP segment of a reassembled PDU]"
"235","2018-08-23 01:58:18.772033","192.168.2.3","216.58.197.4","TCP","1434","34236  >  443 [ACK] Seq=140434 Ack=2496 Win=1828 Len=1368 TSval=7818090 TSecr=760073482 [TCP segment of a reassembled PDU]"
"236","2018-08-23 01:58:18.772036","192.168.2.3","216.58.197.4","TLSv1.2","212","Application Data"
"237","2018-08-23 01:58:18.772429","192.168.2.3","216.58.197.4","TCP","1434","34236  >  443 [ACK] Seq=141948 Ack=2496 Win=1828 Len=1368 TSval=7818090 TSecr=760073482 [TCP segment of a reassembled PDU]"
"238","2018-08-23 01:58:18.772433","192.168.2.3","216.58.197.4","TLSv1.2","155","Application Data"
"242","2018-08-23 01:58:18.866106","192.168.2.3","216.58.197.4","TCP","1434","34236  >  443 [ACK] Seq=143405 Ack=2496 Win=1828 Len=1368 TSval=7818099 TSecr=760073573 [TCP segment of a reassembled PDU]"
"243","2018-08-23 01:58:18.866457","192.168.2.3","216.58.197.4","TCP","1434","34236  >  443 [ACK] Seq=144773 Ack=2496 Win=1828 Len=1368 TSval=7818099 TSecr=760073573 [TCP segment of a reassembled PDU]"
"244","2018-08-23 01:58:18.866460","192.168.2.3","216.58.197.4","TLSv1.2","212","Application Data"
"245","2018-08-23 01:58:18.866684","192.168.2.3","216.58.197.4","TCP","1434","34236  >  443 [ACK] Seq=146287 Ack=2496 Win=1828 Len=1368 TSval=7818099 TSecr=760073573 [TCP segment of a reassembled PDU]"
"246","2018-08-23 01:58:18.866686","192.168.2.3","216.58.197.4","TLSv1.2","155","Application Data"
"252","2018-08-23 01:58:18.929640","192.168.2.3","216.58.197.4","TCP","66","34236  >  443 [ACK] Seq=147744 Ack=3002 Win=1828 Len=0 TSval=7818106 TSecr=760073724"
"253","2018-08-23 01:58:18.944594","192.168.2.3","216.58.197.4","TCP","1434","34236  >  443 [ACK] Seq=147744 Ack=3002 Win=1828 Len=1368 TSval=7818107 TSecr=760073724 [TCP segment of a reassembled PDU]"
"254","2018-08-23 01:58:18.944957","192.168.2.3","216.58.197.4","TCP","1434","34236  >  443 [ACK] Seq=149112 Ack=3002 Win=1828 Len=1368 TSval=7818107 TSecr=760073724 [TCP segment of a reassembled PDU]"
"255","2018-08-23 01:58:18.944961","192.168.2.3","216.58.197.4","TLSv1.2","212","Application Data"
"256","2018-08-23 01:58:18.945300","192.168.2.3","216.58.197.4","TCP","1434","34236  >  443 [ACK] Seq=150626 Ack=3002 Win=1828 Len=1368 TSval=7818107 TSecr=760073724 [TCP segment of a reassembled PDU]"
"257","2018-08-23 01:58:18.945303","192.168.2.3","216.58.197.4","TLSv1.2","155","Application Data"
"261","2018-08-23 01:58:19.040550","192.168.2.3","216.58.197.4","TCP","1434","34236  >  443 [ACK] Seq=152083 Ack=3002 Win=1828 Len=1368 TSval=7818117 TSecr=760073746 [TCP segment of a reassembled PDU]"
"262","2018-08-23 01:58:19.040844","192.168.2.3","216.58.197.4","TCP","1434","34236  >  443 [ACK] Seq=153451 Ack=3002 Win=1828 Len=1368 TSval=7818117 TSecr=760073746 [TCP segment of a reassembled PDU]"
"263","2018-08-23 01:58:19.040848","192.168.2.3","216.58.197.4","TLSv1.2","212","Application Data"
"264","2018-08-23 01:58:19.041305","192.168.2.3","216.58.197.4","TCP","1434","34236  >  443 [ACK] Seq=154965 Ack=3002 Win=1828 Len=1368 TSval=7818117 TSecr=760073746 [TCP segment of a reassembled PDU]"
"265","2018-08-23 01:58:19.041307","192.168.2.3","216.58.197.4","TLSv1.2","155","Application Data"
"271","2018-08-23 01:58:19.098502","192.168.2.3","216.58.197.4","TCP","66","34236  >  443 [ACK] Seq=156422 Ack=3233 Win=1828 Len=0 TSval=7818123 TSecr=760073893"
"272","2018-08-23 01:58:19.125118","192.168.2.3","216.58.197.4","TCP","1434","34236  >  443 [ACK] Seq=156422 Ack=3233 Win=1828 Len=1368 TSval=7818125 TSecr=760073893 [TCP segment of a reassembled PDU]"
"273","2018-08-23 01:58:19.125124","192.168.2.3","216.58.197.4","TCP","1434","34236  >  443 [ACK] Seq=157790 Ack=3233 Win=1828 Len=1368 TSval=7818125 TSecr=760073893 [TCP segment of a reassembled PDU]"
"274","2018-08-23 01:58:19.125125","192.168.2.3","216.58.197.4","TLSv1.2","212","Application Data"
"275","2018-08-23 01:58:19.126172","192.168.2.3","216.58.197.4","TCP","1434","34236  >  443 [ACK] Seq=159304 Ack=3233 Win=1828 Len=1368 TSval=7818125 TSecr=760073893 [TCP segment of a reassembled PDU]"
"276","2018-08-23 01:58:19.126176","192.168.2.3","216.58.197.4","TLSv1.2","155","Application Data"
"280","2018-08-23 01:58:19.232828","192.168.2.3","216.58.197.4","TCP","1434","34236  >  443 [ACK] Seq=160761 Ack=3233 Win=1828 Len=1368 TSval=7818136 TSecr=760073927 [TCP segment of a reassembled PDU]"
"281","2018-08-23 01:58:19.232834","192.168.2.3","216.58.197.4","TCP","1434","34236  >  443 [ACK] Seq=162129 Ack=3233 Win=1828 Len=1368 TSval=7818136 TSecr=760073927 [TCP segment of a reassembled PDU]"
"282","2018-08-23 01:58:19.232835","192.168.2.3","216.58.197.4","TLSv1.2","212","Application Data"
"283","2018-08-23 01:58:19.233188","192.168.2.3","216.58.197.4","TCP","1434","34236  >  443 [ACK] Seq=163643 Ack=3233 Win=1828 Len=1368 TSval=7818136 TSecr=760073927 [TCP segment of a reassembled PDU]"
"284","2018-08-23 01:58:19.233191","192.168.2.3","216.58.197.4","TLSv1.2","155","Application Data"
"290","2018-08-23 01:58:19.299564","192.168.2.3","216.58.197.4","TCP","66","34236  >  443 [ACK] Seq=165100 Ack=3728 Win=1828 Len=0 TSval=7818143 TSecr=760074087"
"291","2018-08-23 01:58:19.317378","192.168.2.3","216.58.197.4","TCP","1434","34236  >  443 [ACK] Seq=165100 Ack=3728 Win=1828 Len=1368 TSval=7818144 TSecr=760074087 [TCP segment of a reassembled PDU]"
"292","2018-08-23 01:58:19.317806","192.168.2.3","216.58.197.4","TCP","1434","34236  >  443 [ACK] Seq=166468 Ack=3728 Win=1828 Len=1368 TSval=7818144 TSecr=760074087 [TCP segment of a reassembled PDU]"
"293","2018-08-23 01:58:19.317810","192.168.2.3","216.58.197.4","TLSv1.2","212","Application Data"
"294","2018-08-23 01:58:19.317811","192.168.2.3","216.58.197.4","TCP","1434","34236  >  443 [ACK] Seq=167982 Ack=3728 Win=1828 Len=1368 TSval=7818144 TSecr=760074087 [TCP segment of a reassembled PDU]"
"295","2018-08-23 01:58:19.317811","192.168.2.3","216.58.197.4","TLSv1.2","155","Application Data"
"301","2018-08-23 01:58:19.385577","192.168.2.3","216.58.197.4","TCP","66","34236  >  443 [ACK] Seq=169439 Ack=4086 Win=1828 Len=0 TSval=7818151 TSecr=760074167"
"302","2018-08-23 01:58:19.409717","192.168.2.3","216.58.197.4","TCP","1434","34236  >  443 [ACK] Seq=169439 Ack=4086 Win=1828 Len=1368 TSval=7818154 TSecr=760074167 [TCP segment of a reassembled PDU]"
"303","2018-08-23 01:58:19.409991","192.168.2.3","216.58.197.4","TCP","1434","34236  >  443 [ACK] Seq=170807 Ack=4086 Win=1828 Len=1368 TSval=7818154 TSecr=760074167 [TCP segment of a reassembled PDU]"
"304","2018-08-23 01:58:19.409993","192.168.2.3","216.58.197.4","TLSv1.2","212","Application Data"
"305","2018-08-23 01:58:19.410504","192.168.2.3","216.58.197.4","TCP","1434","34236  >  443 [ACK] Seq=172321 Ack=4086 Win=1828 Len=1368 TSval=7818154 TSecr=760074167 [TCP segment of a reassembled PDU]"
"306","2018-08-23 01:58:19.410507","192.168.2.3","216.58.197.4","TLSv1.2","155","Application Data"
"312","2018-08-23 01:58:19.478477","192.168.2.3","216.58.197.4","TCP","66","34236  >  443 [ACK] Seq=173778 Ack=4511 Win=1828 Len=0 TSval=7818160 TSecr=760074267"
"313","2018-08-23 01:58:19.508421","192.168.2.3","216.58.197.4","TCP","1434","34236  >  443 [ACK] Seq=173778 Ack=4511 Win=1828 Len=1368 TSval=7818163 TSecr=760074267 [TCP segment of a reassembled PDU]"
"314","2018-08-23 01:58:19.508849","192.168.2.3","216.58.197.4","TCP","1434","34236  >  443 [ACK] Seq=175146 Ack=4511 Win=1828 Len=1368 TSval=7818163 TSecr=760074267 [TCP segment of a reassembled PDU]"
"315","2018-08-23 01:58:19.508855","192.168.2.3","216.58.197.4","TLSv1.2","212","Application Data"
"316","2018-08-23 01:58:19.508856","192.168.2.3","216.58.197.4","TCP","1434","34236  >  443 [ACK] Seq=176660 Ack=4511 Win=1828 Len=1368 TSval=7818164 TSecr=760074267 [TCP segment of a reassembled PDU]"
"317","2018-08-23 01:58:19.508857","192.168.2.3","216.58.197.4","TLSv1.2","155","Application Data"
"321","2018-08-23 01:58:19.614512","192.168.2.3","216.58.197.4","TCP","1434","34236  >  443 [ACK] Seq=178117 Ack=4511 Win=1828 Len=1368 TSval=7818174 TSecr=760074309 [TCP segment of a reassembled PDU]"
"322","2018-08-23 01:58:19.614806","192.168.2.3","216.58.197.4","TCP","1434","34236  >  443 [ACK] Seq=179485 Ack=4511 Win=1828 Len=1368 TSval=7818174 TSecr=760074309 [TCP segment of a reassembled PDU]"
"323","2018-08-23 01:58:19.614809","192.168.2.3","216.58.197.4","TLSv1.2","212","Application Data"
"324","2018-08-23 01:58:19.615253","192.168.2.3","216.58.197.4","TCP","1434","34236  >  443 [ACK] Seq=180999 Ack=4511 Win=1828 Len=1368 TSval=7818174 TSecr=760074309 [TCP segment of a reassembled PDU]"
"325","2018-08-23 01:58:19.615256","192.168.2.3","216.58.197.4","TLSv1.2","155","Application Data"
"330","2018-08-23 01:58:19.711188","192.168.2.3","216.58.197.4","TCP","1434","34236  >  443 [ACK] Seq=182456 Ack=4511 Win=1828 Len=1368 TSval=7818184 TSecr=760074416 [TCP segment of a reassembled PDU]"
"331","2018-08-23 01:58:19.711686","192.168.2.3","216.58.197.4","TCP","1434","34236  >  443 [ACK] Seq=183824 Ack=4511 Win=1828 Len=1368 TSval=7818184 TSecr=760074416 [TCP segment of a reassembled PDU]"
"332","2018-08-23 01:58:19.711689","192.168.2.3","216.58.197.4","TLSv1.2","212","Application Data"
"333","2018-08-23 01:58:19.711689","192.168.2.3","216.58.197.4","TCP","1434","34236  >  443 [ACK] Seq=185338 Ack=4511 Win=1828 Len=1368 TSval=7818184 TSecr=760074416 [TCP segment of a reassembled PDU]"
"334","2018-08-23 01:58:19.711690","192.168.2.3","216.58.197.4","TLSv1.2","155","Application Data"
"340","2018-08-23 01:58:19.740625","192.168.2.3","216.58.197.4","TCP","66","34236  >  443 [ACK] Seq=186795 Ack=4707 Win=1828 Len=0 TSval=7818187 TSecr=760074512"
"341","2018-08-23 01:58:19.810805","192.168.2.3","216.58.197.4","TCP","1434","34236  >  443 [ACK] Seq=186795 Ack=4707 Win=1828 Len=1368 TSval=7818193 TSecr=760074512 [TCP segment of a reassembled PDU]"
"342","2018-08-23 01:58:19.810809","192.168.2.3","216.58.197.4","TCP","1434","34236  >  443 [ACK] Seq=188163 Ack=4707 Win=1828 Len=1368 TSval=7818193 TSecr=760074512 [TCP segment of a reassembled PDU]"
"343","2018-08-23 01:58:19.810810","192.168.2.3","216.58.197.4","TLSv1.2","212","Application Data"
"344","2018-08-23 01:58:19.811247","192.168.2.3","216.58.197.4","TCP","1434","34236  >  443 [ACK] Seq=189677 Ack=4707 Win=1828 Len=1368 TSval=7818194 TSecr=760074512 [TCP segment of a reassembled PDU]"
"345","2018-08-23 01:58:19.811250","192.168.2.3","216.58.197.4","TLSv1.2","155","Application Data"
"350","2018-08-23 01:58:19.873893","192.168.2.3","216.58.197.4","TCP","66","34236  >  443 [ACK] Seq=191134 Ack=5133 Win=1828 Len=0 TSval=7818200 TSecr=760074668"
"351","2018-08-23 01:58:19.904532","192.168.2.3","216.58.197.4","TCP","1434","34236  >  443 [ACK] Seq=191134 Ack=5133 Win=1828 Len=1368 TSval=7818203 TSecr=760074668 [TCP segment of a reassembled PDU]"
"352","2018-08-23 01:58:19.904894","192.168.2.3","216.58.197.4","TCP","1434","34236  >  443 [ACK] Seq=192502 Ack=5133 Win=1828 Len=1368 TSval=7818203 TSecr=760074668 [TCP segment of a reassembled PDU]"
"353","2018-08-23 01:58:19.904897","192.168.2.3","216.58.197.4","TLSv1.2","212","Application Data"
"354","2018-08-23 01:58:19.905218","192.168.2.3","216.58.197.4","TCP","1434","34236  >  443 [ACK] Seq=194016 Ack=5133 Win=1828 Len=1368 TSval=7818203 TSecr=760074668 [TCP segment of a reassembled PDU]"
"355","2018-08-23 01:58:19.905222","192.168.2.3","216.58.197.4","TLSv1.2","155","Application Data"
"359","2018-08-23 01:58:20.017604","192.168.2.3","216.58.197.4","TCP","1434","34236  >  443 [ACK] Seq=195473 Ack=5133 Win=1828 Len=1368 TSval=7818214 TSecr=760074746 [TCP segment of a reassembled PDU]"
"360","2018-08-23 01:58:20.017883","192.168.2.3","216.58.197.4","TCP","1434","34236  >  443 [ACK] Seq=196841 Ack=5133 Win=1828 Len=1368 TSval=7818214 TSecr=760074746 [TCP segment of a reassembled PDU]"
"361","2018-08-23 01:58:20.017887","192.168.2.3","216.58.197.4","TLSv1.2","212","Application Data"
"362","2018-08-23 01:58:20.018286","192.168.2.3","216.58.197.4","TCP","1434","34236  >  443 [ACK] Seq=198355 Ack=5133 Win=1828 Len=1368 TSval=7818214 TSecr=760074746 [TCP segment of a reassembled PDU]"
"363","2018-08-23 01:58:20.018289","192.168.2.3","216.58.197.4","TLSv1.2","155","Application Data"
"369","2018-08-23 01:58:20.103900","192.168.2.3","216.58.197.4","TCP","66","34236  >  443 [ACK] Seq=199812 Ack=5567 Win=1828 Len=0 TSval=7818221 TSecr=760074878"
"370","2018-08-23 01:58:20.118321","192.168.2.3","216.58.197.4","TCP","1434","34236  >  443 [ACK] Seq=199812 Ack=5567 Win=1828 Len=1368 TSval=7818224 TSecr=760074878 [TCP segment of a reassembled PDU]"
"371","2018-08-23 01:58:20.118515","192.168.2.3","216.58.197.4","TCP","1434","34236  >  443 [ACK] Seq=201180 Ack=5567 Win=1828 Len=1368 TSval=7818224 TSecr=760074878 [TCP segment of a reassembled PDU]"
"372","2018-08-23 01:58:20.118517","192.168.2.3","216.58.197.4","TLSv1.2","212","Application Data"
"373","2018-08-23 01:58:20.119135","192.168.2.3","216.58.197.4","TCP","1434","34236  >  443 [ACK] Seq=202694 Ack=5567 Win=1828 Len=1368 TSval=7818225 TSecr=760074878 [TCP segment of a reassembled PDU]"
"374","2018-08-23 01:58:20.119138","192.168.2.3","216.58.197.4","TLSv1.2","155","Application Data"
"378","2018-08-23 01:58:20.211992","192.168.2.3","216.58.197.4","TCP","1434","34236  >  443 [ACK] Seq=204151 Ack=5567 Win=1828 Len=1368 TSval=7818234 TSecr=760074920 [TCP segment of a reassembled PDU]"
"379","2018-08-23 01:58:20.212239","192.168.2.3","216.58.197.4","TCP","1434","34236  >  443 [ACK] Seq=205519 Ack=5567 Win=1828 Len=1368 TSval=7818234 TSecr=760074920 [TCP segment of a reassembled PDU]"
"380","2018-08-23 01:58:20.212242","192.168.2.3","216.58.197.4","TLSv1.2","212","Application Data"
"381","2018-08-23 01:58:20.212665","192.168.2.3","216.58.197.4","TCP","1434","34236  >  443 [ACK] Seq=207033 Ack=5567 Win=1828 Len=1368 TSval=7818234 TSecr=760074920 [TCP segment of a reassembled PDU]"
"382","2018-08-23 01:58:20.212667","192.168.2.3","216.58.197.4","TLSv1.2","155","Application Data"
"387","2018-08-23 01:58:20.272530","192.168.2.3","216.58.197.4","TCP","66","34236  >  443 [ACK] Seq=208490 Ack=5970 Win=1828 Len=0 TSval=7818240 TSecr=760075067"
"388","2018-08-23 01:58:20.308664","192.168.2.3","216.58.197.4","TCP","1434","34236  >  443 [ACK] Seq=208490 Ack=5970 Win=1828 Len=1368 TSval=7818243 TSecr=760075067 [TCP segment of a reassembled PDU]"
"389","2018-08-23 01:58:20.309013","192.168.2.3","216.58.197.4","TCP","1434","34236  >  443 [ACK] Seq=209858 Ack=5970 Win=1828 Len=1368 TSval=7818244 TSecr=760075067 [TCP segment of a reassembled PDU]"
"390","2018-08-23 01:58:20.309016","192.168.2.3","216.58.197.4","TLSv1.2","212","Application Data"
"391","2018-08-23 01:58:20.309412","192.168.2.3","216.58.197.4","TCP","1434","34236  >  443 [ACK] Seq=211372 Ack=5970 Win=1828 Len=1368 TSval=7818244 TSecr=760075067 [TCP segment of a reassembled PDU]"
"392","2018-08-23 01:58:20.309416","192.168.2.3","216.58.197.4","TLSv1.2","155","Application Data"
"393","2018-08-23 01:58:20.310379","192.168.2.3","216.58.197.4","TLSv1.2","866","Application Data"
"394","2018-08-23 01:58:20.310575","192.168.2.3","216.58.197.4","TLSv1.2","102","Application Data"
"402","2018-08-23 01:58:20.329825","192.168.2.3","216.58.197.4","TCP","66","34236  >  443 [ACK] Seq=213665 Ack=6896 Win=1828 Len=0 TSval=7818246 TSecr=760075120"
"405","2018-08-23 01:58:20.385697","192.168.2.3","216.58.197.4","TCP","66","34236  >  443 [ACK] Seq=213665 Ack=7390 Win=1828 Len=0 TSval=7818251 TSecr=760075167"
"408","2018-08-23 01:58:21.385807","192.168.2.3","216.58.197.4","TCP","66","34236  >  443 [ACK] Seq=213665 Ack=7673 Win=1828 Len=0 TSval=7818351 TSecr=760076168"
"412","2018-08-23 01:58:21.975932","192.168.2.3","216.58.197.4","TCP","66","34236  >  443 [ACK] Seq=213665 Ack=9406 Win=1828 Len=0 TSval=7818410 TSecr=760076744"
"425","2018-08-23 01:58:22.347109","192.168.2.3","216.58.197.4","TCP","66","34236  >  443 [ACK] Seq=213665 Ack=11234 Win=1828 Len=0 TSval=7818447 TSecr=760077140"
"426","2018-08-23 01:58:22.347112","192.168.2.3","216.58.197.4","TCP","66","34236  >  443 [ACK] Seq=213665 Ack=12981 Win=1828 Len=0 TSval=7818447 TSecr=760077140"
"427","2018-08-23 01:58:22.347883","192.168.2.3","216.58.197.4","TCP","66","34236  >  443 [ACK] Seq=213665 Ack=20448 Win=1828 Len=0 TSval=7818447 TSecr=760077140"
"430","2018-08-23 01:58:22.382762","192.168.2.3","216.58.197.4","TCP","66","34236  >  443 [ACK] Seq=213665 Ack=22171 Win=1828 Len=0 TSval=7818451 TSecr=760077177"
"437","2018-08-23 01:58:22.387627","192.168.2.3","216.58.197.4","TCP","66","34236  >  443 [ACK] Seq=213665 Ack=25625 Win=1828 Len=0 TSval=7818451 TSecr=760077180"
"464","2018-08-23 01:58:22.407379","192.168.2.3","216.58.197.4","TCP","66","34236  >  443 [ACK] Seq=213665 Ack=27505 Win=1828 Len=0 TSval=7818451 TSecr=760077182"
"465","2018-08-23 01:58:22.407387","192.168.2.3","216.58.197.4","TCP","66","34236  >  443 [ACK] Seq=213665 Ack=29281 Win=1828 Len=0 TSval=7818452 TSecr=760077184"
"466","2018-08-23 01:58:22.407388","192.168.2.3","216.58.197.4","TCP","66","34236  >  443 [ACK] Seq=213665 Ack=30998 Win=1828 Len=0 TSval=7818452 TSecr=760077184"
"467","2018-08-23 01:58:22.407389","192.168.2.3","216.58.197.4","TCP","66","34236  >  443 [ACK] Seq=213665 Ack=32778 Win=1828 Len=0 TSval=7818452 TSecr=760077185"
"468","2018-08-23 01:58:22.407389","192.168.2.3","216.58.197.4","TCP","66","34236  >  443 [ACK] Seq=213665 Ack=42046 Win=1828 Len=0 TSval=7818453 TSecr=760077187"
"469","2018-08-23 01:58:22.407392","192.168.2.3","216.58.197.4","TCP","66","34236  >  443 [ACK] Seq=213665 Ack=50623 Win=1828 Len=0 TSval=7818453 TSecr=760077192"
"470","2018-08-23 01:58:22.407393","192.168.2.3","216.58.197.4","TCP","66","34236  >  443 [ACK] Seq=213665 Ack=52499 Win=1828 Len=0 TSval=7818453 TSecr=760077196"
"477","2018-08-23 01:58:22.421165","192.168.2.3","216.58.197.4","TCP","66","34236  >  443 [ACK] Seq=213665 Ack=54334 Win=1828 Len=0 TSval=7818455 TSecr=760077214"
"482","2018-08-23 01:58:22.421402","192.168.2.3","216.58.197.4","TCP","66","34236  >  443 [ACK] Seq=213665 Ack=56067 Win=1828 Len=0 TSval=7818455 TSecr=760077214"
"483","2018-08-23 01:58:22.423254","192.168.2.3","216.58.197.4","TCP","66","34236  >  443 [ACK] Seq=213665 Ack=57874 Win=1828 Len=0 TSval=7818455 TSecr=760077215"
"484","2018-08-23 01:58:22.423576","192.168.2.3","216.58.197.4","TCP","66","34236  >  443 [ACK] Seq=213665 Ack=59699 Win=1828 Len=0 TSval=7818455 TSecr=760077217"
"489","2018-08-23 01:58:22.423912","192.168.2.3","216.58.197.4","TCP","66","34236  >  443 [ACK] Seq=213665 Ack=61364 Win=1828 Len=0 TSval=7818455 TSecr=760077217"
"496","2018-08-23 01:58:22.427179","192.168.2.3","216.58.197.4","TCP","66","34236  >  443 [ACK] Seq=213665 Ack=63125 Win=1828 Len=0 TSval=7818455 TSecr=760077220"
"497","2018-08-23 01:58:22.427182","192.168.2.3","216.58.197.4","TCP","66","34236  >  443 [ACK] Seq=213665 Ack=66335 Win=1828 Len=0 TSval=7818455 TSecr=760077220"
"500","2018-08-23 01:58:22.427866","192.168.2.3","216.58.197.4","TCP","66","34236  >  443 [ACK] Seq=213665 Ack=68479 Win=1828 Len=0 TSval=7818455 TSecr=760077221"
"506","2018-08-23 01:58:22.430763","192.168.2.3","216.58.197.4","TCP","66","34236  >  443 [ACK] Seq=213665 Ack=70236 Win=1828 Len=0 TSval=7818456 TSecr=760077222"
"520","2018-08-23 01:58:22.433792","192.168.2.3","216.58.197.4","TCP","66","34236  >  443 [ACK] Seq=213665 Ack=77573 Win=1828 Len=0 TSval=7818456 TSecr=760077224"
"521","2018-08-23 01:58:22.437776","192.168.2.3","216.58.197.4","TCP","66","34236  >  443 [ACK] Seq=213665 Ack=81239 Win=1828 Len=0 TSval=7818456 TSecr=760077228"
"522","2018-08-23 01:58:22.440488","192.168.2.3","216.58.197.4","TLSv1.2","104","Application Data"
"525","2018-08-23 01:58:26.849169","192.168.2.3","216.58.197.14","TCP","66","41142  >  443 [ACK] Seq=1 Ack=1 Win=597 Len=0 TSval=7818898 TSecr=933045358"
"536","2018-08-23 01:58:38.180794","192.168.2.3","216.58.197.14","TLSv1.2","156","[TCP Previous segment not captured] , Application Data"
"537","2018-08-23 01:58:38.181832","192.168.2.3","216.58.197.14","TLSv1.2","104","Application Data"
"538","2018-08-23 01:58:38.182119","192.168.2.3","216.58.197.14","TLSv1.2","582","Application Data"
"542","2018-08-23 01:58:38.219102","192.168.2.3","216.58.197.14","TCP","66","41142  >  443 [ACK] Seq=646 Ack=39 Win=597 Len=0 TSval=7820035 TSecr=933101716"
"548","2018-08-23 01:58:38.268418","192.168.2.3","216.58.197.14","TCP","66","41142  >  443 [ACK] Seq=646 Ack=107 Win=597 Len=0 TSval=7820039 TSecr=933101793"
"549","2018-08-23 01:58:38.268678","192.168.2.3","216.58.197.14","TCP","66","41142  >  443 [ACK] Seq=646 Ack=169 Win=597 Len=0 TSval=7820040 TSecr=933101793"
"550","2018-08-23 01:58:38.268920","192.168.2.3","216.58.197.14","TCP","66","41142  >  443 [ACK] Seq=646 Ack=280 Win=597 Len=0 TSval=7820040 TSecr=933101793"
"551","2018-08-23 01:58:38.268923","192.168.2.3","216.58.197.14","TCP","66","41142  >  443 [ACK] Seq=646 Ack=318 Win=597 Len=0 TSval=7820040 TSecr=933101793"
"552","2018-08-23 01:58:38.274835","192.168.2.3","216.58.197.14","TLSv1.2","104","Application Data"
