"No.","Time","Source","Destination","Protocol","Length","Info"
"1","2018-08-23 02:05:54.479097","192.168.2.3","216.58.197.4","TLSv1.2","155","Application Data"
"2","2018-08-23 02:05:54.479322","192.168.2.3","216.58.197.4","TLSv1.2","104","Application Data"
"3","2018-08-23 02:05:54.480564","192.168.2.3","216.58.197.4","TLSv1.2","158","Application Data"
"7","2018-08-23 02:05:54.499716","192.168.2.3","216.58.197.4","TCP","1434","34236  >  443 [ACK] Seq=220 Ack=39 Win=2363 Len=1368 TSval=7863662 TSecr=760529280 [TCP segment of a reassembled PDU]"
"8","2018-08-23 02:05:54.499721","192.168.2.3","216.58.197.4","TCP","1434","34236  >  443 [ACK] Seq=1588 Ack=39 Win=2363 Len=1368 TSval=7863662 TSecr=760529280 [TCP segment of a reassembled PDU]"
"9","2018-08-23 02:05:54.499722","192.168.2.3","216.58.197.4","TLSv1.2","212","Application Data"
"10","2018-08-23 02:05:54.499896","192.168.2.3","216.58.197.4","TCP","1434","34236  >  443 [ACK] Seq=3102 Ack=39 Win=2363 Len=1368 TSval=7863662 TSecr=760529280 [TCP segment of a reassembled PDU]"
"11","2018-08-23 02:05:54.499900","192.168.2.3","216.58.197.4","TLSv1.2","223","Application Data"
"12","2018-08-23 02:05:54.500054","192.168.2.3","216.58.197.4","TCP","1434","34236  >  443 [ACK] Seq=4627 Ack=39 Win=2363 Len=1368 TSval=7863662 TSecr=760529280 [TCP segment of a reassembled PDU]"
"13","2018-08-23 02:05:54.500238","192.168.2.3","216.58.197.4","TCP","1434","34236  >  443 [ACK] Seq=5995 Ack=39 Win=2363 Len=1368 TSval=7863662 TSecr=760529280 [TCP segment of a reassembled PDU]"
"14","2018-08-23 02:05:54.500240","192.168.2.3","216.58.197.4","TLSv1.2","212","Application Data"
"15","2018-08-23 02:05:54.500692","192.168.2.3","216.58.197.4","TCP","1434","34236  >  443 [ACK] Seq=7509 Ack=39 Win=2363 Len=1368 TSval=7863662 TSecr=760529280 [TCP segment of a reassembled PDU]"
"21","2018-08-23 02:05:54.506540","192.168.2.3","216.58.197.4","TLSv1.2","1434","Application Data [TCP segment of a reassembled PDU]"
"22","2018-08-23 02:05:54.506901","192.168.2.3","216.58.197.4","TCP","1434","34236  >  443 [ACK] Seq=10245 Ack=39 Win=2363 Len=1368 TSval=7863663 TSecr=760529301 [TCP segment of a reassembled PDU]"
"23","2018-08-23 02:05:54.506903","192.168.2.3","216.58.197.4","TLSv1.2","1434","Application Data [TCP segment of a reassembled PDU]"
"24","2018-08-23 02:05:54.508936","192.168.2.3","216.58.197.4","TLSv1.2","1434","Application Data [TCP segment of a reassembled PDU]"
"25","2018-08-23 02:05:54.508939","192.168.2.3","216.58.197.4","TCP","1434","34236  >  443 [ACK] Seq=14349 Ack=39 Win=2363 Len=1368 TSval=7863663 TSecr=760529301 [TCP segment of a reassembled PDU]"
"26","2018-08-23 02:05:54.508940","192.168.2.3","216.58.197.4","TLSv1.2","1434","Application Data [TCP segment of a reassembled PDU]"
"27","2018-08-23 02:05:54.508941","192.168.2.3","216.58.197.4","TLSv1.2","1434","Application Data [TCP segment of a reassembled PDU]"
"28","2018-08-23 02:05:54.508942","192.168.2.3","216.58.197.4","TCP","1434","34236  >  443 [ACK] Seq=18453 Ack=39 Win=2363 Len=1368 TSval=7863663 TSecr=760529301 [TCP segment of a reassembled PDU]"
"29","2018-08-23 02:05:54.509152","192.168.2.3","216.58.197.4","TLSv1.2","1434","Application Data [TCP segment of a reassembled PDU]"
"30","2018-08-23 02:05:54.509155","192.168.2.3","216.58.197.4","TLSv1.2","1434","Application Data [TCP segment of a reassembled PDU]"
"31","2018-08-23 02:05:54.509297","192.168.2.3","216.58.197.4","TCP","1434","34236  >  443 [ACK] Seq=22557 Ack=39 Win=2363 Len=1368 TSval=7863663 TSecr=760529301 [TCP segment of a reassembled PDU]"
"32","2018-08-23 02:05:54.509638","192.168.2.3","216.58.197.4","TLSv1.2","1434","Application Data [TCP segment of a reassembled PDU]"
"33","2018-08-23 02:05:54.509639","192.168.2.3","216.58.197.4","TLSv1.2","1434","Application Data [TCP segment of a reassembled PDU]"
"34","2018-08-23 02:05:54.509772","192.168.2.3","216.58.197.4","TCP","1434","34236  >  443 [ACK] Seq=26661 Ack=39 Win=2363 Len=1368 TSval=7863663 TSecr=760529301 [TCP segment of a reassembled PDU]"
"35","2018-08-23 02:05:54.510174","192.168.2.3","216.58.197.4","TLSv1.2","1434","Application Data [TCP segment of a reassembled PDU]"
"37","2018-08-23 02:05:54.512757","192.168.2.3","216.58.197.4","TLSv1.2","1434","Application Data [TCP segment of a reassembled PDU]"
"38","2018-08-23 02:05:54.513037","192.168.2.3","216.58.197.4","TCP","1434","34236  >  443 [ACK] Seq=30765 Ack=39 Win=2363 Len=1368 TSval=7863663 TSecr=760529308 [TCP segment of a reassembled PDU]"
"42","2018-08-23 02:05:54.513268","192.168.2.3","216.58.197.4","TCP","1434","34236  >  443 [ACK] Seq=32133 Ack=39 Win=2363 Len=1368 TSval=7863663 TSecr=760529308 [TCP segment of a reassembled PDU]"
"46","2018-08-23 02:05:54.516256","192.168.2.3","216.58.197.4","TLSv1.2","1434","Application Data [TCP segment of a reassembled PDU]"
"47","2018-08-23 02:05:54.516260","192.168.2.3","216.58.197.4","TLSv1.2","1434","Application Data [TCP segment of a reassembled PDU]"
"48","2018-08-23 02:05:54.516541","192.168.2.3","216.58.197.4","TCP","1434","34236  >  443 [ACK] Seq=36237 Ack=39 Win=2363 Len=1368 TSval=7863664 TSecr=760529310 [TCP segment of a reassembled PDU]"
"49","2018-08-23 02:05:54.516558","192.168.2.3","216.58.197.4","TLSv1.2","1434","Application Data [TCP segment of a reassembled PDU]"
"50","2018-08-23 02:05:54.516916","192.168.2.3","216.58.197.4","TLSv1.2","1434","Application Data [TCP segment of a reassembled PDU]"
"51","2018-08-23 02:05:54.516918","192.168.2.3","216.58.197.4","TCP","1434","34236  >  443 [ACK] Seq=40341 Ack=39 Win=2363 Len=1368 TSval=7863664 TSecr=760529310 [TCP segment of a reassembled PDU]"
"53","2018-08-23 02:05:54.517518","192.168.2.3","216.58.197.4","TLSv1.2","1434","Application Data [TCP segment of a reassembled PDU]"
"54","2018-08-23 02:05:54.517521","192.168.2.3","216.58.197.4","TLSv1.2","1434","Application Data [TCP segment of a reassembled PDU]"
"56","2018-08-23 02:05:54.517802","192.168.2.3","216.58.197.4","TCP","1434","34236  >  443 [ACK] Seq=44445 Ack=39 Win=2363 Len=1368 TSval=7863664 TSecr=760529310 [TCP segment of a reassembled PDU]"
"57","2018-08-23 02:05:54.517805","192.168.2.3","216.58.197.4","TLSv1.2","1434","Application Data [TCP segment of a reassembled PDU]"
"58","2018-08-23 02:05:54.518177","192.168.2.3","216.58.197.4","TLSv1.2","1434","Application Data [TCP segment of a reassembled PDU]"
"64","2018-08-23 02:05:54.522089","192.168.2.3","216.58.197.4","TCP","1434","34236  >  443 [PSH, ACK] Seq=48549 Ack=39 Win=2363 Len=1368 TSval=7863664 TSecr=760529310 [TCP segment of a reassembled PDU]"
"65","2018-08-23 02:05:54.522092","192.168.2.3","216.58.197.4","TLSv1.2","1434","Application Data [TCP segment of a reassembled PDU]"
"66","2018-08-23 02:05:54.522476","192.168.2.3","216.58.197.4","TLSv1.2","1434","Application Data [TCP segment of a reassembled PDU]"
"67","2018-08-23 02:05:54.522479","192.168.2.3","216.58.197.4","TCP","1434","34236  >  443 [ACK] Seq=52653 Ack=39 Win=2363 Len=1368 TSval=7863664 TSecr=760529311 [TCP segment of a reassembled PDU]"
"68","2018-08-23 02:05:54.522807","192.168.2.3","216.58.197.4","TLSv1.2","1434","Application Data [TCP segment of a reassembled PDU]"
"69","2018-08-23 02:05:54.522809","192.168.2.3","216.58.197.4","TLSv1.2","1434","Application Data [TCP segment of a reassembled PDU]"
"70","2018-08-23 02:05:54.523013","192.168.2.3","216.58.197.4","TLSv1.2","1434","Application Data [TCP segment of a reassembled PDU]"
"71","2018-08-23 02:05:54.523424","192.168.2.3","216.58.197.4","TCP","1434","34236  >  443 [ACK] Seq=58125 Ack=39 Win=2363 Len=1368 TSval=7863664 TSecr=760529314 [TCP segment of a reassembled PDU]"
"72","2018-08-23 02:05:54.523427","192.168.2.3","216.58.197.4","TLSv1.2","1434","Application Data [TCP segment of a reassembled PDU]"
"73","2018-08-23 02:05:54.523503","192.168.2.3","216.58.197.4","TLSv1.2","788","Application Data"
"79","2018-08-23 02:05:54.532628","192.168.2.3","216.58.197.4","TCP","1434","34236  >  443 [ACK] Seq=61583 Ack=39 Win=2363 Len=1368 TSval=7863665 TSecr=760529324 [TCP segment of a reassembled PDU]"
"80","2018-08-23 02:05:54.533039","192.168.2.3","216.58.197.4","TCP","1434","34236  >  443 [ACK] Seq=62951 Ack=39 Win=2363 Len=1368 TSval=7863665 TSecr=760529324 [TCP segment of a reassembled PDU]"
"81","2018-08-23 02:05:54.533041","192.168.2.3","216.58.197.4","TLSv1.2","212","Application Data"
"82","2018-08-23 02:05:54.534185","192.168.2.3","216.58.197.4","TCP","1434","34236  >  443 [ACK] Seq=64465 Ack=39 Win=2363 Len=1368 TSval=7863665 TSecr=760529324 [TCP segment of a reassembled PDU]"
"83","2018-08-23 02:05:54.534188","192.168.2.3","216.58.197.4","TLSv1.2","155","Application Data"
"87","2018-08-23 02:05:54.603404","192.168.2.3","216.58.197.4","TCP","1434","34236  >  443 [ACK] Seq=65922 Ack=39 Win=2363 Len=1368 TSval=7863672 TSecr=760529335 [TCP segment of a reassembled PDU]"
"88","2018-08-23 02:05:54.603409","192.168.2.3","216.58.197.4","TCP","1434","34236  >  443 [ACK] Seq=67290 Ack=39 Win=2363 Len=1368 TSval=7863672 TSecr=760529335 [TCP segment of a reassembled PDU]"
"89","2018-08-23 02:05:54.603547","192.168.2.3","216.58.197.4","TLSv1.2","212","Application Data"
"90","2018-08-23 02:05:54.603705","192.168.2.3","216.58.197.4","TCP","1434","34236  >  443 [ACK] Seq=68804 Ack=39 Win=2363 Len=1368 TSval=7863672 TSecr=760529335 [TCP segment of a reassembled PDU]"
"91","2018-08-23 02:05:54.603707","192.168.2.3","216.58.197.4","TLSv1.2","155","Application Data"
"95","2018-08-23 02:05:54.691624","192.168.2.3","216.58.197.4","TCP","1434","34236  >  443 [ACK] Seq=70261 Ack=39 Win=2363 Len=1368 TSval=7863681 TSecr=760529445 [TCP segment of a reassembled PDU]"
"96","2018-08-23 02:05:54.691958","192.168.2.3","216.58.197.4","TCP","1434","34236  >  443 [ACK] Seq=71629 Ack=39 Win=2363 Len=1368 TSval=7863681 TSecr=760529445 [TCP segment of a reassembled PDU]"
"97","2018-08-23 02:05:54.691960","192.168.2.3","216.58.197.4","TLSv1.2","212","Application Data"
"98","2018-08-23 02:05:54.692396","192.168.2.3","216.58.197.4","TCP","1434","34236  >  443 [ACK] Seq=73143 Ack=39 Win=2363 Len=1368 TSval=7863681 TSecr=760529445 [TCP segment of a reassembled PDU]"
"99","2018-08-23 02:05:54.692400","192.168.2.3","216.58.197.4","TLSv1.2","155","Application Data"
"106","2018-08-23 02:05:54.778284","192.168.2.3","216.58.197.4","TCP","66","34236  >  443 [ACK] Seq=74600 Ack=230 Win=2363 Len=0 TSval=7863690 TSecr=760529573"
"108","2018-08-23 02:05:54.787785","192.168.2.3","216.58.197.4","TCP","1434","34236  >  443 [ACK] Seq=74600 Ack=532 Win=2363 Len=1368 TSval=7863691 TSecr=760529574 [TCP segment of a reassembled PDU]"
"109","2018-08-23 02:05:54.788250","192.168.2.3","216.58.197.4","TCP","1434","34236  >  443 [ACK] Seq=75968 Ack=532 Win=2363 Len=1368 TSval=7863691 TSecr=760529574 [TCP segment of a reassembled PDU]"
"110","2018-08-23 02:05:54.788253","192.168.2.3","216.58.197.4","TLSv1.2","212","Application Data"
"111","2018-08-23 02:05:54.788714","192.168.2.3","216.58.197.4","TCP","1434","34236  >  443 [ACK] Seq=77482 Ack=532 Win=2363 Len=1368 TSval=7863691 TSecr=760529574 [TCP segment of a reassembled PDU]"
"112","2018-08-23 02:05:54.788717","192.168.2.3","216.58.197.4","TLSv1.2","155","Application Data"
"116","2018-08-23 02:05:54.823677","192.168.2.3","216.58.197.4","TCP","66","34236  >  443 [ACK] Seq=78939 Ack=627 Win=2363 Len=0 TSval=7863695 TSecr=760529584"
"117","2018-08-23 02:05:54.833574","192.168.2.3","216.58.197.14","TCP","66","41153  >  443 [ACK] Seq=1 Ack=1 Win=279 Len=0 TSval=7863696 TSecr=3237214775"
"120","2018-08-23 02:05:54.880818","192.168.2.3","216.58.197.4","TCP","66","34236  >  443 [ACK] Seq=78939 Ack=833 Win=2363 Len=0 TSval=7863700 TSecr=760529676"
"121","2018-08-23 02:05:54.885756","192.168.2.3","216.58.197.4","TCP","1434","34236  >  443 [ACK] Seq=78939 Ack=833 Win=2363 Len=1368 TSval=7863701 TSecr=760529676 [TCP segment of a reassembled PDU]"
"122","2018-08-23 02:05:54.886079","192.168.2.3","216.58.197.4","TCP","1434","34236  >  443 [ACK] Seq=80307 Ack=833 Win=2363 Len=1368 TSval=7863701 TSecr=760529676 [TCP segment of a reassembled PDU]"
"123","2018-08-23 02:05:54.886082","192.168.2.3","216.58.197.4","TLSv1.2","212","Application Data"
"124","2018-08-23 02:05:54.886654","192.168.2.3","216.58.197.4","TCP","1434","34236  >  443 [ACK] Seq=81821 Ack=833 Win=2363 Len=1368 TSval=7863701 TSecr=760529676 [TCP segment of a reassembled PDU]"
"125","2018-08-23 02:05:54.886657","192.168.2.3","216.58.197.4","TLSv1.2","155","Application Data"
"129","2018-08-23 02:05:54.981592","192.168.2.3","216.58.197.4","TCP","1434","34236  >  443 [ACK] Seq=83278 Ack=833 Win=2363 Len=1368 TSval=7863710 TSecr=760529687 [TCP segment of a reassembled PDU]"
"130","2018-08-23 02:05:54.981877","192.168.2.3","216.58.197.4","TCP","1434","34236  >  443 [ACK] Seq=84646 Ack=833 Win=2363 Len=1368 TSval=7863710 TSecr=760529687 [TCP segment of a reassembled PDU]"
"131","2018-08-23 02:05:54.981880","192.168.2.3","216.58.197.4","TLSv1.2","212","Application Data"
"132","2018-08-23 02:05:54.982150","192.168.2.3","216.58.197.4","TCP","1434","34236  >  443 [ACK] Seq=86160 Ack=833 Win=2363 Len=1368 TSval=7863710 TSecr=760529687 [TCP segment of a reassembled PDU]"
"133","2018-08-23 02:05:54.982153","192.168.2.3","216.58.197.4","TLSv1.2","155","Application Data"
"138","2018-08-23 02:05:55.083046","192.168.2.3","216.58.197.4","TCP","1434","34236  >  443 [ACK] Seq=87617 Ack=1061 Win=2363 Len=1368 TSval=7863720 TSecr=760529869 [TCP segment of a reassembled PDU]"
"139","2018-08-23 02:05:55.083051","192.168.2.3","216.58.197.4","TCP","1434","34236  >  443 [ACK] Seq=88985 Ack=1061 Win=2363 Len=1368 TSval=7863720 TSecr=760529869 [TCP segment of a reassembled PDU]"
"140","2018-08-23 02:05:55.083052","192.168.2.3","216.58.197.4","TLSv1.2","212","Application Data"
"141","2018-08-23 02:05:55.083352","192.168.2.3","216.58.197.4","TCP","1434","34236  >  443 [ACK] Seq=90499 Ack=1061 Win=2363 Len=1368 TSval=7863720 TSecr=760529869 [TCP segment of a reassembled PDU]"
"142","2018-08-23 02:05:55.083355","192.168.2.3","216.58.197.4","TLSv1.2","155","Application Data"
"146","2018-08-23 02:05:55.171933","192.168.2.3","216.58.197.4","TCP","1434","34236  >  443 [ACK] Seq=91956 Ack=1061 Win=2363 Len=1368 TSval=7863729 TSecr=760529884 [TCP segment of a reassembled PDU]"
"147","2018-08-23 02:05:55.172265","192.168.2.3","216.58.197.4","TCP","1434","34236  >  443 [ACK] Seq=93324 Ack=1061 Win=2363 Len=1368 TSval=7863729 TSecr=760529884 [TCP segment of a reassembled PDU]"
"148","2018-08-23 02:05:55.172268","192.168.2.3","216.58.197.4","TLSv1.2","212","Application Data"
"149","2018-08-23 02:05:55.172268","192.168.2.3","216.58.197.4","TCP","1434","34236  >  443 [ACK] Seq=94838 Ack=1061 Win=2363 Len=1368 TSval=7863729 TSecr=760529884 [TCP segment of a reassembled PDU]"
"150","2018-08-23 02:05:55.172397","192.168.2.3","216.58.197.4","TLSv1.2","155","Application Data"
"154","2018-08-23 02:05:55.265600","192.168.2.3","216.58.197.4","TCP","1434","34236  >  443 [ACK] Seq=96295 Ack=1061 Win=2363 Len=1368 TSval=7863739 TSecr=760529973 [TCP segment of a reassembled PDU]"
"155","2018-08-23 02:05:55.265991","192.168.2.3","216.58.197.4","TCP","1434","34236  >  443 [ACK] Seq=97663 Ack=1061 Win=2363 Len=1368 TSval=7863739 TSecr=760529973 [TCP segment of a reassembled PDU]"
"156","2018-08-23 02:05:55.265995","192.168.2.3","216.58.197.4","TLSv1.2","212","Application Data"
"157","2018-08-23 02:05:55.266484","192.168.2.3","216.58.197.4","TCP","1434","34236  >  443 [ACK] Seq=99177 Ack=1061 Win=2363 Len=1368 TSval=7863739 TSecr=760529973 [TCP segment of a reassembled PDU]"
"158","2018-08-23 02:05:55.266489","192.168.2.3","216.58.197.4","TLSv1.2","155","Application Data"
"162","2018-08-23 02:05:55.318826","192.168.2.3","172.217.161.234","TCP","66","39194  >  443 [ACK] Seq=1 Ack=1 Win=296 Len=0 TSval=7863744 TSecr=1495888122"
"164","2018-08-23 02:05:55.365699","192.168.2.3","216.58.197.4","TCP","1434","34236  >  443 [ACK] Seq=100634 Ack=1061 Win=2363 Len=1368 TSval=7863749 TSecr=760530067 [TCP segment of a reassembled PDU]"
"165","2018-08-23 02:05:55.366250","192.168.2.3","216.58.197.4","TCP","1434","34236  >  443 [ACK] Seq=102002 Ack=1061 Win=2363 Len=1368 TSval=7863749 TSecr=760530067 [TCP segment of a reassembled PDU]"
"166","2018-08-23 02:05:55.366254","192.168.2.3","216.58.197.4","TLSv1.2","212","Application Data"
"167","2018-08-23 02:05:55.366446","192.168.2.3","216.58.197.4","TCP","1434","34236  >  443 [ACK] Seq=103516 Ack=1061 Win=2363 Len=1368 TSval=7863749 TSecr=760530067 [TCP segment of a reassembled PDU]"
"168","2018-08-23 02:05:55.366449","192.168.2.3","216.58.197.4","TLSv1.2","155","Application Data"
"172","2018-08-23 02:05:55.455401","192.168.2.3","216.58.197.4","TCP","1434","34236  >  443 [ACK] Seq=104973 Ack=1061 Win=2363 Len=1368 TSval=7863758 TSecr=760530167 [TCP segment of a reassembled PDU]"
"173","2018-08-23 02:05:55.455772","192.168.2.3","216.58.197.4","TCP","1434","34236  >  443 [ACK] Seq=106341 Ack=1061 Win=2363 Len=1368 TSval=7863758 TSecr=760530167 [TCP segment of a reassembled PDU]"
"174","2018-08-23 02:05:55.455775","192.168.2.3","216.58.197.4","TLSv1.2","212","Application Data"
"175","2018-08-23 02:05:55.455934","192.168.2.3","216.58.197.4","TCP","1434","34236  >  443 [ACK] Seq=107855 Ack=1061 Win=2363 Len=1368 TSval=7863758 TSecr=760530167 [TCP segment of a reassembled PDU]"
"176","2018-08-23 02:05:55.455936","192.168.2.3","216.58.197.4","TLSv1.2","155","Application Data"
"180","2018-08-23 02:05:55.557597","192.168.2.3","216.58.197.4","TCP","1434","34236  >  443 [ACK] Seq=109312 Ack=1061 Win=2363 Len=1368 TSval=7863768 TSecr=760530257 [TCP segment of a reassembled PDU]"
"181","2018-08-23 02:05:55.558014","192.168.2.3","216.58.197.4","TCP","1434","34236  >  443 [ACK] Seq=110680 Ack=1061 Win=2363 Len=1368 TSval=7863768 TSecr=760530257 [TCP segment of a reassembled PDU]"
"182","2018-08-23 02:05:55.558018","192.168.2.3","216.58.197.4","TLSv1.2","212","Application Data"
"183","2018-08-23 02:05:55.558642","192.168.2.3","216.58.197.4","TCP","1434","34236  >  443 [ACK] Seq=112194 Ack=1061 Win=2363 Len=1368 TSval=7863768 TSecr=760530257 [TCP segment of a reassembled PDU]"
"184","2018-08-23 02:05:55.558646","192.168.2.3","216.58.197.4","TLSv1.2","155","Application Data"
"188","2018-08-23 02:05:55.650257","192.168.2.3","216.58.197.4","TCP","1434","34236  >  443 [ACK] Seq=113651 Ack=1061 Win=2363 Len=1368 TSval=7863777 TSecr=760530359 [TCP segment of a reassembled PDU]"
"189","2018-08-23 02:05:55.650262","192.168.2.3","216.58.197.4","TCP","1434","34236  >  443 [ACK] Seq=115019 Ack=1061 Win=2363 Len=1368 TSval=7863777 TSecr=760530359 [TCP segment of a reassembled PDU]"
"190","2018-08-23 02:05:55.650263","192.168.2.3","216.58.197.4","TLSv1.2","212","Application Data"
"191","2018-08-23 02:05:55.650457","192.168.2.3","216.58.197.4","TCP","1434","34236  >  443 [ACK] Seq=116533 Ack=1061 Win=2363 Len=1368 TSval=7863777 TSecr=760530359 [TCP segment of a reassembled PDU]"
"192","2018-08-23 02:05:55.650461","192.168.2.3","216.58.197.4","TLSv1.2","155","Application Data"
"196","2018-08-23 02:05:55.715702","192.168.2.3","216.58.197.4","TCP","1434","34236  >  443 [ACK] Seq=117990 Ack=1061 Win=2363 Len=1368 TSval=7863784 TSecr=760530451 [TCP segment of a reassembled PDU]"
"197","2018-08-23 02:05:55.716046","192.168.2.3","216.58.197.4","TCP","1434","34236  >  443 [ACK] Seq=119358 Ack=1061 Win=2363 Len=1368 TSval=7863784 TSecr=760530451 [TCP segment of a reassembled PDU]"
"198","2018-08-23 02:05:55.716049","192.168.2.3","216.58.197.4","TLSv1.2","212","Application Data"
"199","2018-08-23 02:05:55.716530","192.168.2.3","216.58.197.4","TCP","1434","34236  >  443 [ACK] Seq=120872 Ack=1061 Win=2363 Len=1368 TSval=7863784 TSecr=760530451 [TCP segment of a reassembled PDU]"
"200","2018-08-23 02:05:55.716532","192.168.2.3","216.58.197.4","TLSv1.2","155","Application Data"
"206","2018-08-23 02:05:55.788718","192.168.2.3","216.58.197.4","TCP","66","34236  >  443 [ACK] Seq=122329 Ack=1541 Win=2363 Len=0 TSval=7863791 TSecr=760530574"
"207","2018-08-23 02:05:55.808864","192.168.2.3","216.58.197.4","TCP","1434","34236  >  443 [ACK] Seq=122329 Ack=1541 Win=2363 Len=1368 TSval=7863793 TSecr=760530574 [TCP segment of a reassembled PDU]"
"208","2018-08-23 02:05:55.809298","192.168.2.3","216.58.197.4","TCP","1434","34236  >  443 [ACK] Seq=123697 Ack=1541 Win=2363 Len=1368 TSval=7863793 TSecr=760530574 [TCP segment of a reassembled PDU]"
"209","2018-08-23 02:05:55.809300","192.168.2.3","216.58.197.4","TLSv1.2","212","Application Data"
"210","2018-08-23 02:05:55.809660","192.168.2.3","216.58.197.4","TCP","1434","34236  >  443 [ACK] Seq=125211 Ack=1541 Win=2363 Len=1368 TSval=7863793 TSecr=760530574 [TCP segment of a reassembled PDU]"
"211","2018-08-23 02:05:55.809663","192.168.2.3","216.58.197.4","TLSv1.2","155","Application Data"
"215","2018-08-23 02:05:55.903303","192.168.2.3","216.58.197.4","TCP","1434","34236  >  443 [ACK] Seq=126668 Ack=1541 Win=2363 Len=1368 TSval=7863802 TSecr=760530610 [TCP segment of a reassembled PDU]"
"216","2018-08-23 02:05:55.903644","192.168.2.3","216.58.197.4","TCP","1434","34236  >  443 [ACK] Seq=128036 Ack=1541 Win=2363 Len=1368 TSval=7863802 TSecr=760530610 [TCP segment of a reassembled PDU]"
"217","2018-08-23 02:05:55.903799","192.168.2.3","216.58.197.4","TLSv1.2","212","Application Data"
"218","2018-08-23 02:05:55.903979","192.168.2.3","216.58.197.4","TCP","1434","34236  >  443 [ACK] Seq=129550 Ack=1541 Win=2363 Len=1368 TSval=7863802 TSecr=760530610 [TCP segment of a reassembled PDU]"
"219","2018-08-23 02:05:55.903985","192.168.2.3","216.58.197.4","TLSv1.2","155","Application Data"
"223","2018-08-23 02:05:56.003559","192.168.2.3","216.58.197.4","TCP","1434","34236  >  443 [ACK] Seq=131007 Ack=1541 Win=2363 Len=1368 TSval=7863812 TSecr=760530705 [TCP segment of a reassembled PDU]"
"224","2018-08-23 02:05:56.003566","192.168.2.3","216.58.197.4","TCP","1434","34236  >  443 [ACK] Seq=132375 Ack=1541 Win=2363 Len=1368 TSval=7863812 TSecr=760530705 [TCP segment of a reassembled PDU]"
"225","2018-08-23 02:05:56.003568","192.168.2.3","216.58.197.4","TLSv1.2","212","Application Data"
"226","2018-08-23 02:05:56.003873","192.168.2.3","216.58.197.4","TCP","1434","34236  >  443 [ACK] Seq=133889 Ack=1541 Win=2363 Len=1368 TSval=7863812 TSecr=760530705 [TCP segment of a reassembled PDU]"
"227","2018-08-23 02:05:56.003876","192.168.2.3","216.58.197.4","TLSv1.2","155","Application Data"
"233","2018-08-23 02:05:56.056536","192.168.2.3","216.58.197.4","TCP","66","34236  >  443 [ACK] Seq=135346 Ack=1944 Win=2363 Len=0 TSval=7863818 TSecr=760530851"
"236","2018-08-23 02:05:56.069644","192.168.2.3","216.58.197.4","TCP","1434","34236  >  443 [ACK] Seq=135346 Ack=1944 Win=2363 Len=1368 TSval=7863819 TSecr=760530851 [TCP segment of a reassembled PDU]"
"237","2018-08-23 02:05:56.070051","192.168.2.3","216.58.197.4","TCP","1434","34236  >  443 [ACK] Seq=136714 Ack=1944 Win=2363 Len=1368 TSval=7863819 TSecr=760530851 [TCP segment of a reassembled PDU]"
"238","2018-08-23 02:05:56.070052","192.168.2.3","216.58.197.4","TLSv1.2","212","Application Data"
"239","2018-08-23 02:05:56.070053","192.168.2.3","216.58.197.4","TCP","1434","34236  >  443 [ACK] Seq=138228 Ack=1944 Win=2363 Len=1368 TSval=7863819 TSecr=760530851 [TCP segment of a reassembled PDU]"
"240","2018-08-23 02:05:56.070054","192.168.2.3","216.58.197.4","TLSv1.2","155","Application Data"
"245","2018-08-23 02:05:56.169421","192.168.2.3","216.58.197.4","TCP","1434","34236  >  443 [ACK] Seq=139685 Ack=1944 Win=2363 Len=1368 TSval=7863829 TSecr=760530851 [TCP segment of a reassembled PDU]"
"246","2018-08-23 02:05:56.169427","192.168.2.3","216.58.197.4","TCP","1434","34236  >  443 [ACK] Seq=141053 Ack=1944 Win=2363 Len=1368 TSval=7863829 TSecr=760530851 [TCP segment of a reassembled PDU]"
"247","2018-08-23 02:05:56.169544","192.168.2.3","216.58.197.4","TLSv1.2","212","Application Data"
"248","2018-08-23 02:05:56.169798","192.168.2.3","216.58.197.4","TCP","1434","34236  >  443 [ACK] Seq=142567 Ack=1944 Win=2363 Len=1368 TSval=7863829 TSecr=760530851 [TCP segment of a reassembled PDU]"
"249","2018-08-23 02:05:56.169801","192.168.2.3","216.58.197.4","TLSv1.2","155","Application Data"
"252","2018-08-23 02:05:56.185554","192.168.2.3","216.58.197.4","TCP","66","34236  >  443 [ACK] Seq=144024 Ack=2361 Win=2363 Len=0 TSval=7863830 TSecr=760530858"
"253","2018-08-23 02:05:56.195187","192.168.2.3","216.58.197.4","TCP","78","[TCP Dup ACK 252#1] 34236  >  443 [ACK] Seq=144024 Ack=2361 Win=2363 Len=0 TSval=7863831 TSecr=760530887 SLE=2207 SRE=2361"
"257","2018-08-23 02:05:56.223292","192.168.2.3","216.58.197.4","TCP","66","34236  >  443 [ACK] Seq=144024 Ack=2506 Win=2363 Len=0 TSval=7863834 TSecr=760531019"
"258","2018-08-23 02:05:56.223517","192.168.2.3","216.58.197.4","TCP","66","34236  >  443 [ACK] Seq=144024 Ack=2803 Win=2363 Len=0 TSval=7863834 TSecr=760531019"
"259","2018-08-23 02:05:56.258388","192.168.2.3","216.58.197.4","TCP","1434","34236  >  443 [ACK] Seq=144024 Ack=2803 Win=2363 Len=1368 TSval=7863838 TSecr=760531019 [TCP segment of a reassembled PDU]"
"260","2018-08-23 02:05:56.258751","192.168.2.3","216.58.197.4","TCP","1434","34236  >  443 [ACK] Seq=145392 Ack=2803 Win=2363 Len=1368 TSval=7863838 TSecr=760531019 [TCP segment of a reassembled PDU]"
"261","2018-08-23 02:05:56.258969","192.168.2.3","216.58.197.4","TLSv1.2","212","Application Data"
"262","2018-08-23 02:05:56.258973","192.168.2.3","216.58.197.4","TCP","1434","34236  >  443 [ACK] Seq=146906 Ack=2803 Win=2363 Len=1368 TSval=7863838 TSecr=760531019 [TCP segment of a reassembled PDU]"
"263","2018-08-23 02:05:56.259119","192.168.2.3","216.58.197.4","TLSv1.2","155","Application Data"
"266","2018-08-23 02:05:56.351414","192.168.2.3","216.58.197.4","TCP","1434","34236  >  443 [ACK] Seq=148363 Ack=2803 Win=2363 Len=1368 TSval=7863847 TSecr=760531060 [TCP segment of a reassembled PDU]"
"267","2018-08-23 02:05:56.351421","192.168.2.3","216.58.197.4","TCP","1434","34236  >  443 [ACK] Seq=149731 Ack=2803 Win=2363 Len=1368 TSval=7863847 TSecr=760531060 [TCP segment of a reassembled PDU]"
"268","2018-08-23 02:05:56.351537","192.168.2.3","216.58.197.4","TLSv1.2","212","Application Data"
"269","2018-08-23 02:05:56.352576","192.168.2.3","216.58.197.4","TCP","1434","34236  >  443 [ACK] Seq=151245 Ack=2803 Win=2363 Len=1368 TSval=7863847 TSecr=760531060 [TCP segment of a reassembled PDU]"
"270","2018-08-23 02:05:56.352580","192.168.2.3","216.58.197.4","TLSv1.2","155","Application Data"
"276","2018-08-23 02:05:56.407130","192.168.2.3","216.58.197.4","TCP","66","34236  >  443 [ACK] Seq=152702 Ack=3123 Win=2363 Len=0 TSval=7863853 TSecr=760531200"
"277","2018-08-23 02:05:56.407146","192.168.2.3","216.58.197.4","TCP","66","34236  >  443 [ACK] Seq=152702 Ack=3380 Win=2363 Len=0 TSval=7863853 TSecr=760531200"
"278","2018-08-23 02:05:56.446967","192.168.2.3","216.58.197.4","TCP","1434","34236  >  443 [ACK] Seq=152702 Ack=3380 Win=2363 Len=1368 TSval=7863857 TSecr=760531200 [TCP segment of a reassembled PDU]"
"279","2018-08-23 02:05:56.447253","192.168.2.3","216.58.197.4","TCP","1434","34236  >  443 [ACK] Seq=154070 Ack=3380 Win=2363 Len=1368 TSval=7863857 TSecr=760531200 [TCP segment of a reassembled PDU]"
"280","2018-08-23 02:05:56.447256","192.168.2.3","216.58.197.4","TLSv1.2","212","Application Data"
"281","2018-08-23 02:05:56.447708","192.168.2.3","216.58.197.4","TCP","1434","34236  >  443 [ACK] Seq=155584 Ack=3380 Win=2363 Len=1368 TSval=7863857 TSecr=760531200 [TCP segment of a reassembled PDU]"
"282","2018-08-23 02:05:56.447712","192.168.2.3","216.58.197.4","TLSv1.2","155","Application Data"
"286","2018-08-23 02:05:56.518132","192.168.2.3","216.58.197.4","TCP","1434","34236  >  443 [ACK] Seq=157041 Ack=3380 Win=2363 Len=1368 TSval=7863864 TSecr=760531249 [TCP segment of a reassembled PDU]"
"287","2018-08-23 02:05:56.518362","192.168.2.3","216.58.197.4","TCP","1434","34236  >  443 [ACK] Seq=158409 Ack=3380 Win=2363 Len=1368 TSval=7863864 TSecr=760531249 [TCP segment of a reassembled PDU]"
"288","2018-08-23 02:05:56.518365","192.168.2.3","216.58.197.4","TLSv1.2","212","Application Data"
"289","2018-08-23 02:05:56.518846","192.168.2.3","216.58.197.4","TCP","1434","34236  >  443 [ACK] Seq=159923 Ack=3380 Win=2363 Len=1368 TSval=7863864 TSecr=760531249 [TCP segment of a reassembled PDU]"
"290","2018-08-23 02:05:56.518849","192.168.2.3","216.58.197.4","TLSv1.2","155","Application Data"
"296","2018-08-23 02:05:56.564081","192.168.2.3","216.58.197.4","TCP","66","34236  >  443 [ACK] Seq=161380 Ack=3668 Win=2363 Len=0 TSval=7863869 TSecr=760531359"
"297","2018-08-23 02:05:56.612066","192.168.2.3","216.58.197.4","TCP","1434","34236  >  443 [ACK] Seq=161380 Ack=3668 Win=2363 Len=1368 TSval=7863873 TSecr=760531359 [TCP segment of a reassembled PDU]"
"298","2018-08-23 02:05:56.612071","192.168.2.3","216.58.197.4","TCP","1434","34236  >  443 [ACK] Seq=162748 Ack=3668 Win=2363 Len=1368 TSval=7863873 TSecr=760531359 [TCP segment of a reassembled PDU]"
"299","2018-08-23 02:05:56.612321","192.168.2.3","216.58.197.4","TLSv1.2","212","Application Data"
"300","2018-08-23 02:05:56.612612","192.168.2.3","216.58.197.4","TCP","1434","34236  >  443 [ACK] Seq=164262 Ack=3668 Win=2363 Len=1368 TSval=7863873 TSecr=760531359 [TCP segment of a reassembled PDU]"
"301","2018-08-23 02:05:56.612615","192.168.2.3","216.58.197.4","TLSv1.2","155","Application Data"
"304","2018-08-23 02:05:56.707657","192.168.2.3","216.58.197.4","TCP","1434","34236  >  443 [ACK] Seq=165719 Ack=3668 Win=2363 Len=1368 TSval=7863883 TSecr=760531413 [TCP segment of a reassembled PDU]"
"305","2018-08-23 02:05:56.708098","192.168.2.3","216.58.197.4","TCP","1434","34236  >  443 [ACK] Seq=167087 Ack=3668 Win=2363 Len=1368 TSval=7863883 TSecr=760531413 [TCP segment of a reassembled PDU]"
"306","2018-08-23 02:05:56.708101","192.168.2.3","216.58.197.4","TLSv1.2","212","Application Data"
"307","2018-08-23 02:05:56.708368","192.168.2.3","216.58.197.4","TCP","1434","34236  >  443 [ACK] Seq=168601 Ack=3668 Win=2363 Len=1368 TSval=7863883 TSecr=760531413 [TCP segment of a reassembled PDU]"
"308","2018-08-23 02:05:56.708370","192.168.2.3","216.58.197.4","TLSv1.2","155","Application Data"
"314","2018-08-23 02:05:56.767998","192.168.2.3","216.58.197.4","TCP","66","34236  >  443 [ACK] Seq=170058 Ack=3928 Win=2363 Len=0 TSval=7863889 TSecr=760531559"
"315","2018-08-23 02:05:56.768004","192.168.2.3","216.58.197.4","TCP","66","34236  >  443 [ACK] Seq=170058 Ack=4120 Win=2363 Len=0 TSval=7863889 TSecr=760531559"
"317","2018-08-23 02:05:56.778403","192.168.2.3","216.58.197.4","TCP","66","34236  >  443 [ACK] Seq=170058 Ack=4203 Win=2363 Len=0 TSval=7863890 TSecr=760531574"
"319","2018-08-23 02:05:56.788377","192.168.2.3","216.58.197.4","TCP","66","34236  >  443 [ACK] Seq=170058 Ack=4358 Win=2363 Len=0 TSval=7863891 TSecr=760531584"
"320","2018-08-23 02:05:56.805835","192.168.2.3","216.58.197.4","TCP","1434","34236  >  443 [ACK] Seq=170058 Ack=4358 Win=2363 Len=1368 TSval=7863893 TSecr=760531584 [TCP segment of a reassembled PDU]"
"321","2018-08-23 02:05:56.806074","192.168.2.3","216.58.197.4","TCP","1434","34236  >  443 [ACK] Seq=171426 Ack=4358 Win=2363 Len=1368 TSval=7863893 TSecr=760531584 [TCP segment of a reassembled PDU]"
"322","2018-08-23 02:05:56.806076","192.168.2.3","216.58.197.4","TLSv1.2","212","Application Data"
"323","2018-08-23 02:05:56.806450","192.168.2.3","216.58.197.4","TCP","1434","34236  >  443 [ACK] Seq=172940 Ack=4358 Win=2363 Len=1368 TSval=7863893 TSecr=760531584 [TCP segment of a reassembled PDU]"
"324","2018-08-23 02:05:56.806453","192.168.2.3","216.58.197.4","TLSv1.2","155","Application Data"
"330","2018-08-23 02:05:56.870786","192.168.2.3","216.58.197.4","TCP","66","34236  >  443 [ACK] Seq=174397 Ack=4794 Win=2363 Len=0 TSval=7863899 TSecr=760531660"
"331","2018-08-23 02:05:56.901698","192.168.2.3","216.58.197.4","TCP","1434","34236  >  443 [ACK] Seq=174397 Ack=4794 Win=2363 Len=1368 TSval=7863902 TSecr=760531660 [TCP segment of a reassembled PDU]"
"332","2018-08-23 02:05:56.901877","192.168.2.3","216.58.197.4","TCP","1434","34236  >  443 [ACK] Seq=175765 Ack=4794 Win=2363 Len=1368 TSval=7863902 TSecr=760531660 [TCP segment of a reassembled PDU]"
"333","2018-08-23 02:05:56.901880","192.168.2.3","216.58.197.4","TLSv1.2","212","Application Data"
"334","2018-08-23 02:05:56.902290","192.168.2.3","216.58.197.4","TCP","1434","34236  >  443 [ACK] Seq=177279 Ack=4794 Win=2363 Len=1368 TSval=7863902 TSecr=760531660 [TCP segment of a reassembled PDU]"
"335","2018-08-23 02:05:56.902294","192.168.2.3","216.58.197.4","TLSv1.2","155","Application Data"
"339","2018-08-23 02:05:56.925937","192.168.2.3","216.58.197.3","TLSv1.2","135","Application Data"
"340","2018-08-23 02:05:56.925946","192.168.2.3","216.58.197.3","TLSv1.2","104","Application Data"
"343","2018-08-23 02:05:56.932282","192.168.2.3","216.58.197.3","TCP","66","43379  >  443 [ACK] Seq=108 Ack=117 Win=406 Len=0 TSval=7863905 TSecr=1765746929"
"344","2018-08-23 02:05:56.933171","192.168.2.3","216.58.197.3","TLSv1.2","100","Application Data"
"345","2018-08-23 02:05:56.933374","192.168.2.3","216.58.197.3","TLSv1.2","104","Application Data"
"347","2018-08-23 02:05:57.002317","192.168.2.3","216.58.197.4","TCP","1434","34236  >  443 [ACK] Seq=178736 Ack=4794 Win=2363 Len=1368 TSval=7863912 TSecr=760531703 [TCP segment of a reassembled PDU]"
"348","2018-08-23 02:05:57.002593","192.168.2.3","216.58.197.4","TCP","1434","34236  >  443 [ACK] Seq=180104 Ack=4794 Win=2363 Len=1368 TSval=7863912 TSecr=760531703 [TCP segment of a reassembled PDU]"
"349","2018-08-23 02:05:57.002596","192.168.2.3","216.58.197.4","TLSv1.2","212","Application Data"
"350","2018-08-23 02:05:57.002597","192.168.2.3","216.58.197.4","TCP","1434","34236  >  443 [ACK] Seq=181618 Ack=4794 Win=2363 Len=1368 TSval=7863912 TSecr=760531703 [TCP segment of a reassembled PDU]"
"351","2018-08-23 02:05:57.002598","192.168.2.3","216.58.197.4","TLSv1.2","155","Application Data"
"354","2018-08-23 02:05:57.089058","192.168.2.3","216.58.197.4","TCP","1434","34236  >  443 [ACK] Seq=183075 Ack=4794 Win=2363 Len=1368 TSval=7863921 TSecr=760531804 [TCP segment of a reassembled PDU]"
"355","2018-08-23 02:05:57.089532","192.168.2.3","216.58.197.4","TCP","1434","34236  >  443 [ACK] Seq=184443 Ack=4794 Win=2363 Len=1368 TSval=7863921 TSecr=760531804 [TCP segment of a reassembled PDU]"
"356","2018-08-23 02:05:57.089536","192.168.2.3","216.58.197.4","TLSv1.2","212","Application Data"
"357","2018-08-23 02:05:57.089537","192.168.2.3","216.58.197.4","TCP","1434","34236  >  443 [ACK] Seq=185957 Ack=4794 Win=2363 Len=1368 TSval=7863921 TSecr=760531804 [TCP segment of a reassembled PDU]"
"358","2018-08-23 02:05:57.089691","192.168.2.3","216.58.197.4","TLSv1.2","155","Application Data"
"362","2018-08-23 02:05:57.186507","192.168.2.3","216.58.197.4","TCP","1434","34236  >  443 [ACK] Seq=187414 Ack=4794 Win=2363 Len=1368 TSval=7863931 TSecr=760531890 [TCP segment of a reassembled PDU]"
"363","2018-08-23 02:05:57.189981","192.168.2.3","216.58.197.4","TCP","1434","34236  >  443 [ACK] Seq=188782 Ack=4794 Win=2363 Len=1368 TSval=7863931 TSecr=760531890 [TCP segment of a reassembled PDU]"
"364","2018-08-23 02:05:57.189986","192.168.2.3","216.58.197.4","TLSv1.2","212","Application Data"
"365","2018-08-23 02:05:57.189987","192.168.2.3","216.58.197.4","TCP","1434","34236  >  443 [ACK] Seq=190296 Ack=4794 Win=2363 Len=1368 TSval=7863931 TSecr=760531890 [TCP segment of a reassembled PDU]"
"366","2018-08-23 02:05:57.190159","192.168.2.3","216.58.197.4","TLSv1.2","155","Application Data"
"373","2018-08-23 02:05:57.198378","192.168.2.3","216.58.197.4","TCP","66","34236  >  443 [ACK] Seq=191753 Ack=5338 Win=2363 Len=0 TSval=7863932 TSecr=760531993"
"374","2018-08-23 02:05:57.233877","192.168.2.3","216.58.197.4","TCP","66","34236  >  443 [ACK] Seq=191753 Ack=5547 Win=2363 Len=0 TSval=7863936 TSecr=760531994"
"377","2018-08-23 02:05:57.248470","192.168.2.3","216.58.197.4","TCP","66","34236  >  443 [ACK] Seq=191753 Ack=5701 Win=2363 Len=0 TSval=7863937 TSecr=760532044"
"378","2018-08-23 02:05:57.248646","192.168.2.3","216.58.197.4","TCP","66","34236  >  443 [ACK] Seq=191753 Ack=5815 Win=2363 Len=0 TSval=7863937 TSecr=760532044"
"379","2018-08-23 02:05:57.285965","192.168.2.3","216.58.197.4","TCP","1434","34236  >  443 [ACK] Seq=191753 Ack=5815 Win=2363 Len=1368 TSval=7863941 TSecr=760532044 [TCP segment of a reassembled PDU]"
"380","2018-08-23 02:05:57.286431","192.168.2.3","216.58.197.4","TCP","1434","34236  >  443 [ACK] Seq=193121 Ack=5815 Win=2363 Len=1368 TSval=7863941 TSecr=760532044 [TCP segment of a reassembled PDU]"
"381","2018-08-23 02:05:57.286434","192.168.2.3","216.58.197.4","TLSv1.2","212","Application Data"
"382","2018-08-23 02:05:57.286788","192.168.2.3","216.58.197.4","TCP","1434","34236  >  443 [ACK] Seq=194635 Ack=5815 Win=2363 Len=1368 TSval=7863941 TSecr=760532044 [TCP segment of a reassembled PDU]"
"383","2018-08-23 02:05:57.286790","192.168.2.3","216.58.197.4","TLSv1.2","155","Application Data"
"387","2018-08-23 02:05:57.376804","192.168.2.3","216.58.197.4","TCP","1434","34236  >  443 [ACK] Seq=196092 Ack=5815 Win=2363 Len=1368 TSval=7863950 TSecr=760532128 [TCP segment of a reassembled PDU]"
"388","2018-08-23 02:05:57.376809","192.168.2.3","216.58.197.4","TCP","1434","34236  >  443 [ACK] Seq=197460 Ack=5815 Win=2363 Len=1368 TSval=7863950 TSecr=760532128 [TCP segment of a reassembled PDU]"
"389","2018-08-23 02:05:57.376956","192.168.2.3","216.58.197.4","TLSv1.2","212","Application Data"
"390","2018-08-23 02:05:57.377281","192.168.2.3","216.58.197.4","TCP","1434","34236  >  443 [ACK] Seq=198974 Ack=5815 Win=2363 Len=1368 TSval=7863950 TSecr=760532128 [TCP segment of a reassembled PDU]"
"391","2018-08-23 02:05:57.377283","192.168.2.3","216.58.197.4","TLSv1.2","155","Application Data"
"397","2018-08-23 02:05:57.437725","192.168.2.3","216.58.197.4","TCP","66","34236  >  443 [ACK] Seq=200431 Ack=5934 Win=2363 Len=0 TSval=7863956 TSecr=760532230"
"398","2018-08-23 02:05:57.437728","192.168.2.3","216.58.197.4","TCP","66","34236  >  443 [ACK] Seq=200431 Ack=6011 Win=2363 Len=0 TSval=7863956 TSecr=760532230"
"399","2018-08-23 02:05:57.479021","192.168.2.3","216.58.197.4","TCP","1434","34236  >  443 [ACK] Seq=200431 Ack=6011 Win=2363 Len=1368 TSval=7863960 TSecr=760532230 [TCP segment of a reassembled PDU]"
"400","2018-08-23 02:05:57.479027","192.168.2.3","216.58.197.4","TCP","1434","34236  >  443 [ACK] Seq=201799 Ack=6011 Win=2363 Len=1368 TSval=7863960 TSecr=760532230 [TCP segment of a reassembled PDU]"
"401","2018-08-23 02:05:57.479028","192.168.2.3","216.58.197.4","TLSv1.2","212","Application Data"
"402","2018-08-23 02:05:57.479373","192.168.2.3","216.58.197.4","TCP","1434","34236  >  443 [ACK] Seq=203313 Ack=6011 Win=2363 Len=1368 TSval=7863960 TSecr=760532230 [TCP segment of a reassembled PDU]"
"403","2018-08-23 02:05:57.479376","192.168.2.3","216.58.197.4","TLSv1.2","155","Application Data"
"407","2018-08-23 02:05:57.571878","192.168.2.3","216.58.197.4","TCP","1434","34236  >  443 [ACK] Seq=204770 Ack=6011 Win=2363 Len=1368 TSval=7863969 TSecr=760532280 [TCP segment of a reassembled PDU]"
"408","2018-08-23 02:05:57.572056","192.168.2.3","216.58.197.4","TCP","1434","34236  >  443 [ACK] Seq=206138 Ack=6011 Win=2363 Len=1368 TSval=7863969 TSecr=760532280 [TCP segment of a reassembled PDU]"
"409","2018-08-23 02:05:57.572059","192.168.2.3","216.58.197.4","TLSv1.2","212","Application Data"
"410","2018-08-23 02:05:57.572386","192.168.2.3","216.58.197.4","TCP","1434","34236  >  443 [ACK] Seq=207652 Ack=6011 Win=2363 Len=1368 TSval=7863969 TSecr=760532280 [TCP segment of a reassembled PDU]"
"411","2018-08-23 02:05:57.572389","192.168.2.3","216.58.197.4","TLSv1.2","155","Application Data"
"415","2018-08-23 02:05:57.674337","192.168.2.3","216.58.197.4","TCP","1434","34236  >  443 [ACK] Seq=209109 Ack=6011 Win=2363 Len=1368 TSval=7863979 TSecr=760532373 [TCP segment of a reassembled PDU]"
"416","2018-08-23 02:05:57.674345","192.168.2.3","216.58.197.4","TCP","1434","34236  >  443 [ACK] Seq=210477 Ack=6011 Win=2363 Len=1368 TSval=7863979 TSecr=760532373 [TCP segment of a reassembled PDU]"
"417","2018-08-23 02:05:57.674346","192.168.2.3","216.58.197.4","TLSv1.2","212","Application Data"
"418","2018-08-23 02:05:57.674709","192.168.2.3","216.58.197.4","TCP","1434","34236  >  443 [ACK] Seq=211991 Ack=6011 Win=2363 Len=1368 TSval=7863979 TSecr=760532373 [TCP segment of a reassembled PDU]"
"419","2018-08-23 02:05:57.674712","192.168.2.3","216.58.197.4","TLSv1.2","155","Application Data"
"424","2018-08-23 02:05:57.765125","192.168.2.3","216.58.197.4","TCP","66","34236  >  443 [ACK] Seq=213448 Ack=6226 Win=2363 Len=0 TSval=7863989 TSecr=760532560"
"426","2018-08-23 02:05:57.778491","192.168.2.3","216.58.197.4","TCP","66","34236  >  443 [ACK] Seq=213448 Ack=6354 Win=2363 Len=0 TSval=7863990 TSecr=760532574"
"428","2018-08-23 02:05:57.788895","192.168.2.3","216.58.197.4","TCP","66","34236  >  443 [ACK] Seq=213448 Ack=6482 Win=2363 Len=0 TSval=7863991 TSecr=760532584"
"429","2018-08-23 02:05:57.792096","192.168.2.3","216.58.197.4","TCP","1434","34236  >  443 [ACK] Seq=213448 Ack=6482 Win=2363 Len=1368 TSval=7863991 TSecr=760532584 [TCP segment of a reassembled PDU]"
"430","2018-08-23 02:05:57.792101","192.168.2.3","216.58.197.4","TCP","1434","34236  >  443 [ACK] Seq=214816 Ack=6482 Win=2363 Len=1368 TSval=7863991 TSecr=760532584 [TCP segment of a reassembled PDU]"
"431","2018-08-23 02:05:57.792102","192.168.2.3","216.58.197.4","TLSv1.2","212","Application Data"
"432","2018-08-23 02:05:57.792345","192.168.2.3","216.58.197.4","TCP","1434","34236  >  443 [ACK] Seq=216330 Ack=6482 Win=2363 Len=1368 TSval=7863991 TSecr=760532584 [TCP segment of a reassembled PDU]"
"433","2018-08-23 02:05:57.792348","192.168.2.3","216.58.197.4","TLSv1.2","155","Application Data"
"437","2018-08-23 02:05:57.889004","192.168.2.3","216.58.197.4","TCP","1434","34236  >  443 [ACK] Seq=217787 Ack=6482 Win=2363 Len=1368 TSval=7864001 TSecr=760532593 [TCP segment of a reassembled PDU]"
"438","2018-08-23 02:05:57.889011","192.168.2.3","216.58.197.4","TCP","1434","34236  >  443 [ACK] Seq=219155 Ack=6482 Win=2363 Len=1368 TSval=7864001 TSecr=760532593 [TCP segment of a reassembled PDU]"
"439","2018-08-23 02:05:57.889012","192.168.2.3","216.58.197.4","TLSv1.2","212","Application Data"
"440","2018-08-23 02:05:57.889280","192.168.2.3","216.58.197.4","TCP","1434","34236  >  443 [ACK] Seq=220669 Ack=6482 Win=2363 Len=1368 TSval=7864001 TSecr=760532593 [TCP segment of a reassembled PDU]"
"441","2018-08-23 02:05:57.889283","192.168.2.3","216.58.197.4","TLSv1.2","155","Application Data"
"445","2018-08-23 02:05:57.958336","192.168.2.3","216.58.197.4","TCP","1434","34236  >  443 [ACK] Seq=222126 Ack=6482 Win=2363 Len=1368 TSval=7864008 TSecr=760532690 [TCP segment of a reassembled PDU]"
"446","2018-08-23 02:05:57.958682","192.168.2.3","216.58.197.4","TCP","1434","34236  >  443 [ACK] Seq=223494 Ack=6482 Win=2363 Len=1368 TSval=7864008 TSecr=760532690 [TCP segment of a reassembled PDU]"
"447","2018-08-23 02:05:57.958684","192.168.2.3","216.58.197.4","TLSv1.2","212","Application Data"
"448","2018-08-23 02:05:57.958912","192.168.2.3","216.58.197.4","TCP","1434","34236  >  443 [ACK] Seq=225008 Ack=6482 Win=2363 Len=1368 TSval=7864008 TSecr=760532690 [TCP segment of a reassembled PDU]"
"449","2018-08-23 02:05:57.958915","192.168.2.3","216.58.197.4","TLSv1.2","155","Application Data"
"455","2018-08-23 02:05:58.025047","192.168.2.3","216.58.197.4","TCP","66","34236  >  443 [ACK] Seq=226465 Ack=6629 Win=2363 Len=0 TSval=7864014 TSecr=760532816"
"456","2018-08-23 02:05:58.085360","192.168.2.3","216.58.197.4","TCP","1434","34236  >  443 [ACK] Seq=226465 Ack=6629 Win=2363 Len=1368 TSval=7864020 TSecr=760532816 [TCP segment of a reassembled PDU]"
"457","2018-08-23 02:05:58.085366","192.168.2.3","216.58.197.4","TCP","1434","34236  >  443 [ACK] Seq=227833 Ack=6629 Win=2363 Len=1368 TSval=7864020 TSecr=760532816 [TCP segment of a reassembled PDU]"
"458","2018-08-23 02:05:58.085368","192.168.2.3","216.58.197.4","TLSv1.2","212","Application Data"
"459","2018-08-23 02:05:58.085759","192.168.2.3","216.58.197.4","TCP","1434","34236  >  443 [ACK] Seq=229347 Ack=6629 Win=2363 Len=1368 TSval=7864020 TSecr=760532816 [TCP segment of a reassembled PDU]"
"460","2018-08-23 02:05:58.085762","192.168.2.3","216.58.197.4","TLSv1.2","155","Application Data"
"464","2018-08-23 02:05:58.176875","192.168.2.3","216.58.197.4","TCP","1434","34236  >  443 [ACK] Seq=230804 Ack=6629 Win=2363 Len=1368 TSval=7864030 TSecr=760532887 [TCP segment of a reassembled PDU]"
"465","2018-08-23 02:05:58.177156","192.168.2.3","216.58.197.4","TCP","1434","34236  >  443 [ACK] Seq=232172 Ack=6629 Win=2363 Len=1368 TSval=7864030 TSecr=760532887 [TCP segment of a reassembled PDU]"
"466","2018-08-23 02:05:58.177158","192.168.2.3","216.58.197.4","TLSv1.2","212","Application Data"
"467","2018-08-23 02:05:58.177623","192.168.2.3","216.58.197.4","TCP","1434","34236  >  443 [ACK] Seq=233686 Ack=6629 Win=2363 Len=1368 TSval=7864030 TSecr=760532887 [TCP segment of a reassembled PDU]"
"468","2018-08-23 02:05:58.177626","192.168.2.3","216.58.197.4","TLSv1.2","155","Application Data"
"472","2018-08-23 02:05:58.271226","192.168.2.3","216.58.197.4","TCP","1434","34236  >  443 [ACK] Seq=235143 Ack=6629 Win=2363 Len=1368 TSval=7864039 TSecr=760532979 [TCP segment of a reassembled PDU]"
"473","2018-08-23 02:05:58.271600","192.168.2.3","216.58.197.4","TCP","1434","34236  >  443 [ACK] Seq=236511 Ack=6629 Win=2363 Len=1368 TSval=7864039 TSecr=760532979 [TCP segment of a reassembled PDU]"
"474","2018-08-23 02:05:58.271602","192.168.2.3","216.58.197.4","TLSv1.2","212","Application Data"
"475","2018-08-23 02:05:58.271924","192.168.2.3","216.58.197.4","TCP","1434","34236  >  443 [ACK] Seq=238025 Ack=6629 Win=2363 Len=1368 TSval=7864039 TSecr=760532979 [TCP segment of a reassembled PDU]"
"476","2018-08-23 02:05:58.271927","192.168.2.3","216.58.197.4","TLSv1.2","155","Application Data"
"482","2018-08-23 02:05:58.326249","192.168.2.3","216.58.197.4","TCP","66","34236  >  443 [ACK] Seq=239482 Ack=6924 Win=2363 Len=0 TSval=7864045 TSecr=760533121"
"483","2018-08-23 02:05:58.346095","192.168.2.3","216.58.197.4","TCP","1434","34236  >  443 [ACK] Seq=239482 Ack=6924 Win=2363 Len=1368 TSval=7864047 TSecr=760533121 [TCP segment of a reassembled PDU]"
"484","2018-08-23 02:05:58.346406","192.168.2.3","216.58.197.4","TCP","1434","34236  >  443 [ACK] Seq=240850 Ack=6924 Win=2363 Len=1368 TSval=7864047 TSecr=760533121 [TCP segment of a reassembled PDU]"
"485","2018-08-23 02:05:58.346410","192.168.2.3","216.58.197.4","TLSv1.2","212","Application Data"
"486","2018-08-23 02:05:58.346721","192.168.2.3","216.58.197.4","TCP","1434","34236  >  443 [ACK] Seq=242364 Ack=6924 Win=2363 Len=1368 TSval=7864047 TSecr=760533121 [TCP segment of a reassembled PDU]"
"487","2018-08-23 02:05:58.346724","192.168.2.3","216.58.197.4","TLSv1.2","155","Application Data"
"488","2018-08-23 02:05:58.346725","192.168.2.3","216.58.197.4","TLSv1.2","212","Application Data"
"495","2018-08-23 02:05:58.469022","192.168.2.3","216.58.197.4","TCP","66","34236  >  443 [ACK] Seq=243967 Ack=7555 Win=2363 Len=0 TSval=7864059 TSecr=760533262"
"497","2018-08-23 02:05:58.723681","192.168.2.3","216.58.197.4","TCP","66","34236  >  443 [ACK] Seq=243967 Ack=7758 Win=2363 Len=0 TSval=7864085 TSecr=760533482"
"499","2018-08-23 02:05:58.727535","192.168.2.3","216.58.197.4","TCP","66","34236  >  443 [ACK] Seq=243967 Ack=9081 Win=2363 Len=0 TSval=7864085 TSecr=760533523"
"501","2018-08-23 02:05:58.778636","192.168.2.3","216.58.197.4","TCP","66","34236  >  443 [ACK] Seq=243967 Ack=9153 Win=2363 Len=0 TSval=7864090 TSecr=760533574"
"503","2018-08-23 02:05:58.788811","192.168.2.3","216.58.197.4","TCP","66","34236  >  443 [ACK] Seq=243967 Ack=9437 Win=2363 Len=0 TSval=7864091 TSecr=760533584"
"510","2018-08-23 02:05:58.952482","192.168.2.3","216.58.197.4","TCP","66","34236  >  443 [ACK] Seq=243967 Ack=10855 Win=2363 Len=0 TSval=7864107 TSecr=760533747"
"511","2018-08-23 02:05:58.952486","192.168.2.3","216.58.197.4","TCP","66","34236  >  443 [ACK] Seq=243967 Ack=11382 Win=2363 Len=0 TSval=7864107 TSecr=760533747"
"512","2018-08-23 02:05:58.952826","192.168.2.3","216.58.197.4","TCP","66","34236  >  443 [ACK] Seq=243967 Ack=12800 Win=2363 Len=0 TSval=7864107 TSecr=760533747"
"513","2018-08-23 02:05:58.953106","192.168.2.3","216.58.197.4","TCP","66","34236  >  443 [ACK] Seq=243967 Ack=13274 Win=2363 Len=0 TSval=7864107 TSecr=760533747"
"518","2018-08-23 02:05:58.955325","192.168.2.3","216.58.197.4","TCP","66","34236  >  443 [ACK] Seq=243967 Ack=15194 Win=2363 Len=0 TSval=7864108 TSecr=760533750"
"519","2018-08-23 02:05:58.955810","192.168.2.3","216.58.197.4","TCP","66","34236  >  443 [ACK] Seq=243967 Ack=17026 Win=2363 Len=0 TSval=7864108 TSecr=760533750"
"524","2018-08-23 02:05:58.958391","192.168.2.3","216.58.197.4","TCP","66","34236  >  443 [ACK] Seq=243967 Ack=18767 Win=2363 Len=0 TSval=7864108 TSecr=760533753"
"525","2018-08-23 02:05:58.958783","192.168.2.3","216.58.197.4","TCP","66","34236  >  443 [ACK] Seq=243967 Ack=20498 Win=2363 Len=0 TSval=7864108 TSecr=760533753"
"528","2018-08-23 02:05:58.961086","192.168.2.3","216.58.197.4","TCP","66","34236  >  443 [ACK] Seq=243967 Ack=22366 Win=2363 Len=0 TSval=7864108 TSecr=760533756"
"539","2018-08-23 02:05:58.984079","192.168.2.3","216.58.197.4","TCP","66","34236  >  443 [ACK] Seq=243967 Ack=24238 Win=2363 Len=0 TSval=7864111 TSecr=760533778"
"540","2018-08-23 02:05:58.985073","192.168.2.3","216.58.197.4","TCP","66","34236  >  443 [ACK] Seq=243967 Ack=27074 Win=2363 Len=0 TSval=7864111 TSecr=760533779"
"541","2018-08-23 02:05:58.985075","192.168.2.3","216.58.197.4","TCP","66","34236  >  443 [ACK] Seq=243967 Ack=27619 Win=2363 Len=0 TSval=7864111 TSecr=760533779"
"542","2018-08-23 02:05:58.985076","192.168.2.3","216.58.197.4","TCP","66","34236  >  443 [ACK] Seq=243967 Ack=29380 Win=2363 Len=0 TSval=7864111 TSecr=760533779"
"548","2018-08-23 02:05:58.985640","192.168.2.3","216.58.197.4","TCP","66","34236  >  443 [ACK] Seq=243967 Ack=32216 Win=2363 Len=0 TSval=7864111 TSecr=760533779"
"549","2018-08-23 02:05:58.986228","192.168.2.3","216.58.197.4","TCP","66","34236  >  443 [ACK] Seq=243967 Ack=32937 Win=2363 Len=0 TSval=7864111 TSecr=760533779"
"550","2018-08-23 02:05:58.987284","192.168.2.3","216.58.197.4","TCP","66","34236  >  443 [ACK] Seq=243967 Ack=34741 Win=2363 Len=0 TSval=7864111 TSecr=760533782"
"555","2018-08-23 02:05:58.988117","192.168.2.3","216.58.197.4","TCP","66","34236  >  443 [ACK] Seq=243967 Ack=37577 Win=2363 Len=0 TSval=7864111 TSecr=760533782"
"556","2018-08-23 02:05:58.988132","192.168.2.3","216.58.197.4","TCP","66","34236  >  443 [ACK] Seq=243967 Ack=38207 Win=2363 Len=0 TSval=7864111 TSecr=760533782"
"557","2018-08-23 02:05:58.988952","192.168.2.3","216.58.197.4","TCP","66","34236  >  443 [ACK] Seq=243967 Ack=40116 Win=2363 Len=0 TSval=7864111 TSecr=760533784"
"560","2018-08-23 02:05:58.989787","192.168.2.3","216.58.197.4","TCP","66","34236  >  443 [ACK] Seq=243967 Ack=41968 Win=2363 Len=0 TSval=7864111 TSecr=760533784"
"565","2018-08-23 02:05:58.991994","192.168.2.3","216.58.197.4","TCP","66","34236  >  443 [ACK] Seq=243967 Ack=43804 Win=2363 Len=0 TSval=7864111 TSecr=760533785"
"570","2018-08-23 02:05:58.992704","192.168.2.3","216.58.197.4","TCP","66","34236  >  443 [ACK] Seq=243967 Ack=45511 Win=2363 Len=0 TSval=7864111 TSecr=760533787"
"571","2018-08-23 02:05:58.993681","192.168.2.3","216.58.197.4","TCP","66","34236  >  443 [ACK] Seq=243967 Ack=47347 Win=2363 Len=0 TSval=7864111 TSecr=760533787"
"574","2018-08-23 02:05:58.994698","192.168.2.3","216.58.197.4","TCP","66","34236  >  443 [ACK] Seq=243967 Ack=49201 Win=2363 Len=0 TSval=7864112 TSecr=760533789"
"575","2018-08-23 02:05:58.994701","192.168.2.3","216.58.197.4","TCP","66","34236  >  443 [ACK] Seq=243967 Ack=50978 Win=2363 Len=0 TSval=7864112 TSecr=760533789"
"576","2018-08-23 02:05:58.995192","192.168.2.3","216.58.197.4","TCP","66","34236  >  443 [ACK] Seq=243967 Ack=52714 Win=2363 Len=0 TSval=7864112 TSecr=760533790"
"581","2018-08-23 02:05:58.996869","192.168.2.3","216.58.197.4","TCP","66","34236  >  443 [ACK] Seq=243967 Ack=54532 Win=2363 Len=0 TSval=7864112 TSecr=760533792"
"582","2018-08-23 02:05:59.005085","192.168.2.3","216.58.197.4","TCP","66","34236  >  443 [ACK] Seq=243967 Ack=56261 Win=2363 Len=0 TSval=7864112 TSecr=760533792"
"599","2018-08-23 02:05:59.018937","192.168.2.3","216.58.197.4","TCP","66","34236  >  443 [ACK] Seq=243967 Ack=58026 Win=2363 Len=0 TSval=7864114 TSecr=760533810"
"600","2018-08-23 02:05:59.021164","192.168.2.3","216.58.197.4","TCP","66","34236  >  443 [ACK] Seq=243967 Ack=59813 Win=2363 Len=0 TSval=7864114 TSecr=760533810"
"601","2018-08-23 02:05:59.022742","192.168.2.3","216.58.197.4","TCP","66","34236  >  443 [ACK] Seq=243967 Ack=65994 Win=2363 Len=0 TSval=7864114 TSecr=760533810"
"602","2018-08-23 02:05:59.050082","192.168.2.3","216.58.197.4","TLSv1.2","104","Application Data"
"617","2018-08-23 02:06:05.073803","192.168.2.3","172.217.161.202","TCP","66","38190  >  443 [ACK] Seq=1 Ack=1 Win=279 Len=0 TSval=7864720 TSecr=1056920650"
"619","2018-08-23 02:06:06.012291","192.168.2.3","74.125.204.188","TCP","92","33038  >  5228 [PSH, ACK] Seq=1 Ack=1 Win=406 Len=26 TSval=7864813 TSecr=3814259565"
"621","2018-08-23 02:06:06.055887","192.168.2.3","74.125.204.188","TCP","66","33038  >  5228 [ACK] Seq=27 Ack=27 Win=406 Len=0 TSval=7864818 TSecr=3814289465"
"623","2018-08-23 02:06:11.339744","192.168.2.3","216.58.197.14","TLSv1.2","156","Application Data"
"624","2018-08-23 02:06:11.341035","192.168.2.3","216.58.197.14","TLSv1.2","104","Application Data"
"625","2018-08-23 02:06:11.341050","192.168.2.3","216.58.197.14","TLSv1.2","581","Application Data"
"630","2018-08-23 02:06:11.402208","192.168.2.3","216.58.197.14","TCP","66","41142  >  443 [ACK] Seq=644 Ack=39 Win=661 Len=0 TSval=7865351 TSecr=933554876"
"635","2018-08-23 02:06:11.425168","192.168.2.3","216.58.197.14","TCP","66","41142  >  443 [ACK] Seq=644 Ack=107 Win=661 Len=0 TSval=7865355 TSecr=933554955"
"636","2018-08-23 02:06:11.425404","192.168.2.3","216.58.197.14","TCP","66","41142  >  443 [ACK] Seq=644 Ack=182 Win=661 Len=0 TSval=7865355 TSecr=933554955"
"637","2018-08-23 02:06:11.425769","192.168.2.3","216.58.197.14","TCP","66","41142  >  443 [ACK] Seq=644 Ack=380 Win=661 Len=0 TSval=7865355 TSecr=933554955"
"638","2018-08-23 02:06:11.427885","192.168.2.3","216.58.197.14","TLSv1.2","104","Application Data"
