"No.","Time","Source","Destination","Protocol","Length","Info"
"1","2018-08-23 02:04:05.964944","192.168.2.3","74.125.204.188","TCP","92","33038  >  5228 [PSH, ACK] Seq=1 Ack=1 Win=406 Len=26 TSval=7852809 TSecr=3814139564"
"3","2018-08-23 02:04:06.008315","192.168.2.3","74.125.204.188","TCP","66","33038  >  5228 [ACK] Seq=27 Ack=27 Win=406 Len=0 TSval=7852813 TSecr=3814169417"
"4","2018-08-23 02:04:06.723495","192.168.2.3","216.58.197.4","TLSv1.2","155","Application Data"
"5","2018-08-23 02:04:06.723691","192.168.2.3","216.58.197.4","TLSv1.2","104","Application Data"
"6","2018-08-23 02:04:06.724251","192.168.2.3","216.58.197.4","TLSv1.2","158","Application Data"
"10","2018-08-23 02:04:06.737143","192.168.2.3","216.58.197.4","TCP","1434","34236  >  443 [ACK] Seq=220 Ack=39 Win=2363 Len=1368 TSval=7852886 TSecr=760421525 [TCP segment of a reassembled PDU]"
"11","2018-08-23 02:04:06.737146","192.168.2.3","216.58.197.4","TCP","1434","34236  >  443 [ACK] Seq=1588 Ack=39 Win=2363 Len=1368 TSval=7852886 TSecr=760421525 [TCP segment of a reassembled PDU]"
"12","2018-08-23 02:04:06.737147","192.168.2.3","216.58.197.4","TLSv1.2","212","Application Data"
"13","2018-08-23 02:04:06.737485","192.168.2.3","216.58.197.4","TCP","1434","34236  >  443 [ACK] Seq=3102 Ack=39 Win=2363 Len=1368 TSval=7852886 TSecr=760421525 [TCP segment of a reassembled PDU]"
"14","2018-08-23 02:04:06.737488","192.168.2.3","216.58.197.4","TLSv1.2","223","Application Data"
"15","2018-08-23 02:04:06.737754","192.168.2.3","216.58.197.4","TCP","1434","34236  >  443 [ACK] Seq=4627 Ack=39 Win=2363 Len=1368 TSval=7852886 TSecr=760421525 [TCP segment of a reassembled PDU]"
"16","2018-08-23 02:04:06.737756","192.168.2.3","216.58.197.4","TCP","1434","34236  >  443 [ACK] Seq=5995 Ack=39 Win=2363 Len=1368 TSval=7852886 TSecr=760421525 [TCP segment of a reassembled PDU]"
"17","2018-08-23 02:04:06.737758","192.168.2.3","216.58.197.4","TLSv1.2","212","Application Data"
"18","2018-08-23 02:04:06.738403","192.168.2.3","216.58.197.4","TCP","1434","34236  >  443 [ACK] Seq=7509 Ack=39 Win=2363 Len=1368 TSval=7852886 TSecr=760421525 [TCP segment of a reassembled PDU]"
"24","2018-08-23 02:04:06.743934","192.168.2.3","216.58.197.4","TLSv1.2","1434","Application Data [TCP segment of a reassembled PDU]"
"25","2018-08-23 02:04:06.744380","192.168.2.3","216.58.197.4","TCP","1434","34236  >  443 [ACK] Seq=10245 Ack=39 Win=2363 Len=1368 TSval=7852887 TSecr=760421538 [TCP segment of a reassembled PDU]"
"26","2018-08-23 02:04:06.744383","192.168.2.3","216.58.197.4","TLSv1.2","1434","Application Data [TCP segment of a reassembled PDU]"
"27","2018-08-23 02:04:06.744797","192.168.2.3","216.58.197.4","TLSv1.2","1434","Application Data [TCP segment of a reassembled PDU]"
"28","2018-08-23 02:04:06.744800","192.168.2.3","216.58.197.4","TCP","1434","34236  >  443 [ACK] Seq=14349 Ack=39 Win=2363 Len=1368 TSval=7852887 TSecr=760421538 [TCP segment of a reassembled PDU]"
"29","2018-08-23 02:04:06.745046","192.168.2.3","216.58.197.4","TLSv1.2","1434","Application Data [TCP segment of a reassembled PDU]"
"30","2018-08-23 02:04:06.745458","192.168.2.3","216.58.197.4","TLSv1.2","1434","Application Data [TCP segment of a reassembled PDU]"
"31","2018-08-23 02:04:06.745669","192.168.2.3","216.58.197.4","TCP","1434","34236  >  443 [ACK] Seq=18453 Ack=39 Win=2363 Len=1368 TSval=7852887 TSecr=760421538 [TCP segment of a reassembled PDU]"
"32","2018-08-23 02:04:06.745672","192.168.2.3","216.58.197.4","TLSv1.2","1434","Application Data [TCP segment of a reassembled PDU]"
"33","2018-08-23 02:04:06.745835","192.168.2.3","216.58.197.4","TLSv1.2","1434","Application Data [TCP segment of a reassembled PDU]"
"34","2018-08-23 02:04:06.746217","192.168.2.3","216.58.197.4","TCP","1434","34236  >  443 [ACK] Seq=22557 Ack=39 Win=2363 Len=1368 TSval=7852887 TSecr=760421538 [TCP segment of a reassembled PDU]"
"35","2018-08-23 02:04:06.746601","192.168.2.3","216.58.197.4","TLSv1.2","1434","Application Data [TCP segment of a reassembled PDU]"
"36","2018-08-23 02:04:06.746604","192.168.2.3","216.58.197.4","TLSv1.2","1434","Application Data [TCP segment of a reassembled PDU]"
"37","2018-08-23 02:04:06.746885","192.168.2.3","216.58.197.4","TCP","1434","34236  >  443 [ACK] Seq=26661 Ack=39 Win=2363 Len=1368 TSval=7852887 TSecr=760421539 [TCP segment of a reassembled PDU]"
"38","2018-08-23 02:04:06.747123","192.168.2.3","216.58.197.4","TLSv1.2","1434","Application Data [TCP segment of a reassembled PDU]"
"44","2018-08-23 02:04:06.749988","192.168.2.3","216.58.197.4","TLSv1.2","1434","Application Data [TCP segment of a reassembled PDU]"
"45","2018-08-23 02:04:06.750379","192.168.2.3","216.58.197.4","TCP","1434","34236  >  443 [ACK] Seq=30765 Ack=39 Win=2363 Len=1368 TSval=7852887 TSecr=760421545 [TCP segment of a reassembled PDU]"
"46","2018-08-23 02:04:06.750523","192.168.2.3","216.58.197.4","TCP","1434","34236  >  443 [ACK] Seq=32133 Ack=39 Win=2363 Len=1368 TSval=7852887 TSecr=760421545 [TCP segment of a reassembled PDU]"
"49","2018-08-23 02:04:06.751507","192.168.2.3","216.58.197.4","TLSv1.2","1434","Application Data [TCP segment of a reassembled PDU]"
"50","2018-08-23 02:04:06.751510","192.168.2.3","216.58.197.4","TLSv1.2","1434","Application Data [TCP segment of a reassembled PDU]"
"51","2018-08-23 02:04:06.751766","192.168.2.3","216.58.197.4","TCP","1434","34236  >  443 [ACK] Seq=36237 Ack=39 Win=2363 Len=1368 TSval=7852887 TSecr=760421545 [TCP segment of a reassembled PDU]"
"52","2018-08-23 02:04:06.751769","192.168.2.3","216.58.197.4","TLSv1.2","1434","Application Data [TCP segment of a reassembled PDU]"
"53","2018-08-23 02:04:06.752047","192.168.2.3","216.58.197.4","TLSv1.2","1434","Application Data [TCP segment of a reassembled PDU]"
"54","2018-08-23 02:04:06.752263","192.168.2.3","216.58.197.4","TCP","1434","34236  >  443 [ACK] Seq=40341 Ack=39 Win=2363 Len=1368 TSval=7852887 TSecr=760421546 [TCP segment of a reassembled PDU]"
"55","2018-08-23 02:04:06.752909","192.168.2.3","216.58.197.4","TLSv1.2","1434","Application Data [TCP segment of a reassembled PDU]"
"56","2018-08-23 02:04:06.752912","192.168.2.3","216.58.197.4","TLSv1.2","1434","Application Data [TCP segment of a reassembled PDU]"
"57","2018-08-23 02:04:06.753238","192.168.2.3","216.58.197.4","TCP","1434","34236  >  443 [ACK] Seq=44445 Ack=39 Win=2363 Len=1368 TSval=7852887 TSecr=760421546 [TCP segment of a reassembled PDU]"
"58","2018-08-23 02:04:06.753242","192.168.2.3","216.58.197.4","TLSv1.2","1434","Application Data [TCP segment of a reassembled PDU]"
"59","2018-08-23 02:04:06.753576","192.168.2.3","216.58.197.4","TLSv1.2","1434","Application Data [TCP segment of a reassembled PDU]"
"60","2018-08-23 02:04:06.753578","192.168.2.3","216.58.197.4","TCP","1434","34236  >  443 [ACK] Seq=48549 Ack=39 Win=2363 Len=1368 TSval=7852887 TSecr=760421547 [TCP segment of a reassembled PDU]"
"61","2018-08-23 02:04:06.753911","192.168.2.3","216.58.197.4","TLSv1.2","1434","Application Data [TCP segment of a reassembled PDU]"
"63","2018-08-23 02:04:06.754283","192.168.2.3","216.58.197.4","TLSv1.2","1434","Application Data [TCP segment of a reassembled PDU]"
"64","2018-08-23 02:04:06.754428","192.168.2.3","216.58.197.4","TCP","1434","34236  >  443 [ACK] Seq=52653 Ack=39 Win=2363 Len=1368 TSval=7852888 TSecr=760421547 [TCP segment of a reassembled PDU]"
"66","2018-08-23 02:04:06.754642","192.168.2.3","216.58.197.4","TLSv1.2","1434","Application Data [TCP segment of a reassembled PDU]"
"68","2018-08-23 02:04:06.755981","192.168.2.3","216.58.197.4","TLSv1.2","1434","Application Data [TCP segment of a reassembled PDU]"
"71","2018-08-23 02:04:06.756718","192.168.2.3","216.58.197.4","TCP","1434","34236  >  443 [ACK] Seq=56757 Ack=39 Win=2363 Len=1368 TSval=7852888 TSecr=760421551 [TCP segment of a reassembled PDU]"
"72","2018-08-23 02:04:06.756721","192.168.2.3","216.58.197.4","TLSv1.2","1434","Application Data [TCP segment of a reassembled PDU]"
"73","2018-08-23 02:04:06.756722","192.168.2.3","216.58.197.4","TLSv1.2","418","Application Data"
"81","2018-08-23 02:04:06.777193","192.168.2.3","216.58.197.4","TCP","1434","34236  >  443 [ACK] Seq=59845 Ack=39 Win=2363 Len=1368 TSval=7852890 TSecr=760421557 [TCP segment of a reassembled PDU]"
"82","2018-08-23 02:04:06.777510","192.168.2.3","216.58.197.4","TCP","1434","34236  >  443 [ACK] Seq=61213 Ack=39 Win=2363 Len=1368 TSval=7852890 TSecr=760421557 [TCP segment of a reassembled PDU]"
"83","2018-08-23 02:04:06.777515","192.168.2.3","216.58.197.4","TLSv1.2","212","Application Data"
"84","2018-08-23 02:04:06.777623","192.168.2.3","216.58.197.4","TCP","1434","34236  >  443 [ACK] Seq=62727 Ack=39 Win=2363 Len=1368 TSval=7852890 TSecr=760421557 [TCP segment of a reassembled PDU]"
"85","2018-08-23 02:04:06.777626","192.168.2.3","216.58.197.4","TLSv1.2","155","Application Data"
"89","2018-08-23 02:04:06.885510","192.168.2.3","216.58.197.4","TCP","1434","34236  >  443 [ACK] Seq=64184 Ack=39 Win=2363 Len=1368 TSval=7852901 TSecr=760421619 [TCP segment of a reassembled PDU]"
"90","2018-08-23 02:04:06.885515","192.168.2.3","216.58.197.4","TCP","1434","34236  >  443 [ACK] Seq=65552 Ack=39 Win=2363 Len=1368 TSval=7852901 TSecr=760421619 [TCP segment of a reassembled PDU]"
"91","2018-08-23 02:04:06.885516","192.168.2.3","216.58.197.4","TLSv1.2","212","Application Data"
"92","2018-08-23 02:04:06.885777","192.168.2.3","216.58.197.4","TCP","1434","34236  >  443 [ACK] Seq=67066 Ack=39 Win=2363 Len=1368 TSval=7852901 TSecr=760421619 [TCP segment of a reassembled PDU]"
"93","2018-08-23 02:04:06.885780","192.168.2.3","216.58.197.4","TLSv1.2","155","Application Data"
"97","2018-08-23 02:04:06.980554","192.168.2.3","216.58.197.4","TCP","1434","34236  >  443 [ACK] Seq=68523 Ack=39 Win=2363 Len=1368 TSval=7852910 TSecr=760421686 [TCP segment of a reassembled PDU]"
"98","2018-08-23 02:04:06.980917","192.168.2.3","216.58.197.4","TCP","1434","34236  >  443 [ACK] Seq=69891 Ack=39 Win=2363 Len=1368 TSval=7852910 TSecr=760421686 [TCP segment of a reassembled PDU]"
"99","2018-08-23 02:04:06.980921","192.168.2.3","216.58.197.4","TLSv1.2","212","Application Data"
"100","2018-08-23 02:04:06.980922","192.168.2.3","216.58.197.4","TCP","1434","34236  >  443 [ACK] Seq=71405 Ack=39 Win=2363 Len=1368 TSval=7852910 TSecr=760421686 [TCP segment of a reassembled PDU]"
"101","2018-08-23 02:04:06.980923","192.168.2.3","216.58.197.4","TLSv1.2","155","Application Data"
"107","2018-08-23 02:04:07.050680","192.168.2.3","216.58.197.4","TCP","66","34236  >  443 [ACK] Seq=72862 Ack=277 Win=2363 Len=0 TSval=7852917 TSecr=760421845"
"109","2018-08-23 02:04:07.059152","192.168.2.3","216.58.197.4","TCP","66","34236  >  443 [ACK] Seq=72862 Ack=698 Win=2363 Len=0 TSval=7852918 TSecr=760421845"
"110","2018-08-23 02:04:07.078039","192.168.2.3","216.58.197.4","TCP","1434","34236  >  443 [ACK] Seq=72862 Ack=698 Win=2363 Len=1368 TSval=7852920 TSecr=760421845 [TCP segment of a reassembled PDU]"
"111","2018-08-23 02:04:07.078260","192.168.2.3","216.58.197.4","TCP","1434","34236  >  443 [ACK] Seq=74230 Ack=698 Win=2363 Len=1368 TSval=7852920 TSecr=760421845 [TCP segment of a reassembled PDU]"
"112","2018-08-23 02:04:07.078263","192.168.2.3","216.58.197.4","TLSv1.2","212","Application Data"
"113","2018-08-23 02:04:07.078398","192.168.2.3","216.58.197.4","TCP","1434","34236  >  443 [ACK] Seq=75744 Ack=698 Win=2363 Len=1368 TSval=7852920 TSecr=760421845 [TCP segment of a reassembled PDU]"
"114","2018-08-23 02:04:07.078401","192.168.2.3","216.58.197.4","TLSv1.2","155","Application Data"
"119","2018-08-23 02:04:07.192920","192.168.2.3","216.58.197.4","TCP","1434","34236  >  443 [ACK] Seq=77201 Ack=927 Win=2363 Len=1368 TSval=7852931 TSecr=760421966 [TCP segment of a reassembled PDU]"
"120","2018-08-23 02:04:07.192925","192.168.2.3","216.58.197.4","TCP","1434","34236  >  443 [ACK] Seq=78569 Ack=927 Win=2363 Len=1368 TSval=7852931 TSecr=760421966 [TCP segment of a reassembled PDU]"
"121","2018-08-23 02:04:07.192926","192.168.2.3","216.58.197.4","TLSv1.2","212","Application Data"
"122","2018-08-23 02:04:07.193367","192.168.2.3","216.58.197.4","TLSv1.2","1432","Application Data"
"125","2018-08-23 02:04:07.288507","192.168.2.3","216.58.197.4","TCP","1434","34236  >  443 [ACK] Seq=81449 Ack=927 Win=2363 Len=1368 TSval=7852941 TSecr=760421994 [TCP segment of a reassembled PDU]"
"126","2018-08-23 02:04:07.288815","192.168.2.3","216.58.197.4","TCP","1434","34236  >  443 [ACK] Seq=82817 Ack=927 Win=2363 Len=1368 TSval=7852941 TSecr=760421994 [TCP segment of a reassembled PDU]"
"127","2018-08-23 02:04:07.288818","192.168.2.3","216.58.197.4","TLSv1.2","212","Application Data"
"128","2018-08-23 02:04:07.288992","192.168.2.3","216.58.197.4","TCP","1434","34236  >  443 [ACK] Seq=84331 Ack=927 Win=2363 Len=1368 TSval=7852941 TSecr=760421994 [TCP segment of a reassembled PDU]"
"129","2018-08-23 02:04:07.288995","192.168.2.3","216.58.197.4","TLSv1.2","155","Application Data"
"134","2018-08-23 02:04:07.385048","192.168.2.3","216.58.197.4","TCP","66","34236  >  443 [ACK] Seq=85788 Ack=1082 Win=2363 Len=0 TSval=7852951 TSecr=760422144"
"135","2018-08-23 02:04:07.397142","192.168.2.3","216.58.197.4","TCP","1434","34236  >  443 [ACK] Seq=85788 Ack=1082 Win=2363 Len=1368 TSval=7852952 TSecr=760422144 [TCP segment of a reassembled PDU]"
"136","2018-08-23 02:04:07.397549","192.168.2.3","216.58.197.4","TCP","1434","34236  >  443 [ACK] Seq=87156 Ack=1082 Win=2363 Len=1368 TSval=7852952 TSecr=760422144 [TCP segment of a reassembled PDU]"
"137","2018-08-23 02:04:07.397552","192.168.2.3","216.58.197.4","TLSv1.2","212","Application Data"
"138","2018-08-23 02:04:07.397553","192.168.2.3","216.58.197.4","TCP","1434","34236  >  443 [ACK] Seq=88670 Ack=1082 Win=2363 Len=1368 TSval=7852952 TSecr=760422144 [TCP segment of a reassembled PDU]"
"139","2018-08-23 02:04:07.397707","192.168.2.3","216.58.197.4","TLSv1.2","155","Application Data"
"143","2018-08-23 02:04:07.492587","192.168.2.3","216.58.197.4","TCP","1434","34236  >  443 [ACK] Seq=90127 Ack=1082 Win=2363 Len=1368 TSval=7852961 TSecr=760422198 [TCP segment of a reassembled PDU]"
"144","2018-08-23 02:04:07.492993","192.168.2.3","216.58.197.4","TCP","1434","34236  >  443 [ACK] Seq=91495 Ack=1082 Win=2363 Len=1368 TSval=7852961 TSecr=760422198 [TCP segment of a reassembled PDU]"
"145","2018-08-23 02:04:07.492996","192.168.2.3","216.58.197.4","TLSv1.2","212","Application Data"
"146","2018-08-23 02:04:07.492997","192.168.2.3","216.58.197.4","TCP","1434","34236  >  443 [ACK] Seq=93009 Ack=1082 Win=2363 Len=1368 TSval=7852962 TSecr=760422198 [TCP segment of a reassembled PDU]"
"147","2018-08-23 02:04:07.493100","192.168.2.3","216.58.197.4","TLSv1.2","155","Application Data"
"151","2018-08-23 02:04:07.610325","192.168.2.3","216.58.197.4","TCP","1434","34236  >  443 [ACK] Seq=94466 Ack=1082 Win=2363 Len=1368 TSval=7852973 TSecr=760422294 [TCP segment of a reassembled PDU]"
"152","2018-08-23 02:04:07.610641","192.168.2.3","216.58.197.4","TCP","1434","34236  >  443 [ACK] Seq=95834 Ack=1082 Win=2363 Len=1368 TSval=7852973 TSecr=760422294 [TCP segment of a reassembled PDU]"
"153","2018-08-23 02:04:07.610643","192.168.2.3","216.58.197.4","TLSv1.2","212","Application Data"
"154","2018-08-23 02:04:07.610644","192.168.2.3","216.58.197.4","TCP","1434","34236  >  443 [ACK] Seq=97348 Ack=1082 Win=2363 Len=1368 TSval=7852973 TSecr=760422294 [TCP segment of a reassembled PDU]"
"155","2018-08-23 02:04:07.610830","192.168.2.3","216.58.197.4","TLSv1.2","155","Application Data"
"159","2018-08-23 02:04:07.705054","192.168.2.3","216.58.197.4","TCP","1434","34236  >  443 [ACK] Seq=98805 Ack=1082 Win=2363 Len=1368 TSval=7852983 TSecr=760422411 [TCP segment of a reassembled PDU]"
"160","2018-08-23 02:04:07.705376","192.168.2.3","216.58.197.4","TCP","1434","34236  >  443 [ACK] Seq=100173 Ack=1082 Win=2363 Len=1368 TSval=7852983 TSecr=760422411 [TCP segment of a reassembled PDU]"
"161","2018-08-23 02:04:07.705378","192.168.2.3","216.58.197.4","TLSv1.2","212","Application Data"
"162","2018-08-23 02:04:07.705379","192.168.2.3","216.58.197.4","TCP","1434","34236  >  443 [ACK] Seq=101687 Ack=1082 Win=2363 Len=1368 TSval=7852983 TSecr=760422411 [TCP segment of a reassembled PDU]"
"163","2018-08-23 02:04:07.705545","192.168.2.3","216.58.197.4","TLSv1.2","155","Application Data"
"166","2018-08-23 02:04:07.800681","192.168.2.3","216.58.197.4","TCP","1434","34236  >  443 [ACK] Seq=103144 Ack=1082 Win=2363 Len=1368 TSval=7852992 TSecr=760422506 [TCP segment of a reassembled PDU]"
"167","2018-08-23 02:04:07.801067","192.168.2.3","216.58.197.4","TCP","1434","34236  >  443 [ACK] Seq=104512 Ack=1082 Win=2363 Len=1368 TSval=7852992 TSecr=760422506 [TCP segment of a reassembled PDU]"
"168","2018-08-23 02:04:07.801070","192.168.2.3","216.58.197.4","TLSv1.2","212","Application Data"
"169","2018-08-23 02:04:07.801505","192.168.2.3","216.58.197.4","TCP","1434","34236  >  443 [ACK] Seq=106026 Ack=1082 Win=2363 Len=1368 TSval=7852992 TSecr=760422506 [TCP segment of a reassembled PDU]"
"170","2018-08-23 02:04:07.801507","192.168.2.3","216.58.197.4","TLSv1.2","155","Application Data"
"174","2018-08-23 02:04:07.897407","192.168.2.3","216.58.197.4","TCP","1434","34236  >  443 [ACK] Seq=107483 Ack=1082 Win=2363 Len=1368 TSval=7853002 TSecr=760422602 [TCP segment of a reassembled PDU]"
"175","2018-08-23 02:04:07.897412","192.168.2.3","216.58.197.4","TCP","1434","34236  >  443 [ACK] Seq=108851 Ack=1082 Win=2363 Len=1368 TSval=7853002 TSecr=760422602 [TCP segment of a reassembled PDU]"
"176","2018-08-23 02:04:07.897536","192.168.2.3","216.58.197.4","TLSv1.2","212","Application Data"
"177","2018-08-23 02:04:07.897807","192.168.2.3","216.58.197.4","TCP","1434","34236  >  443 [ACK] Seq=110365 Ack=1082 Win=2363 Len=1368 TSval=7853002 TSecr=760422602 [TCP segment of a reassembled PDU]"
"178","2018-08-23 02:04:07.897808","192.168.2.3","216.58.197.4","TLSv1.2","155","Application Data"
"181","2018-08-23 02:04:07.992655","192.168.2.3","216.58.197.4","TCP","1434","34236  >  443 [ACK] Seq=111822 Ack=1082 Win=2363 Len=1368 TSval=7853011 TSecr=760422698 [TCP segment of a reassembled PDU]"
"182","2018-08-23 02:04:07.992976","192.168.2.3","216.58.197.4","TCP","1434","34236  >  443 [ACK] Seq=113190 Ack=1082 Win=2363 Len=1368 TSval=7853011 TSecr=760422698 [TCP segment of a reassembled PDU]"
"183","2018-08-23 02:04:07.992978","192.168.2.3","216.58.197.4","TLSv1.2","212","Application Data"
"184","2018-08-23 02:04:07.993340","192.168.2.3","216.58.197.4","TCP","1434","34236  >  443 [ACK] Seq=114704 Ack=1082 Win=2363 Len=1368 TSval=7853011 TSecr=760422698 [TCP segment of a reassembled PDU]"
"185","2018-08-23 02:04:07.993343","192.168.2.3","216.58.197.4","TLSv1.2","155","Application Data"
"190","2018-08-23 02:04:08.049547","192.168.2.3","216.58.197.4","TCP","66","34236  >  443 [ACK] Seq=116161 Ack=1206 Win=2363 Len=0 TSval=7853017 TSecr=760422845"
"192","2018-08-23 02:04:08.059195","192.168.2.3","216.58.197.4","TCP","66","34236  >  443 [ACK] Seq=116161 Ack=1434 Win=2363 Len=0 TSval=7853018 TSecr=760422854"
"193","2018-08-23 02:04:08.088256","192.168.2.3","216.58.197.4","TCP","1434","34236  >  443 [ACK] Seq=116161 Ack=1434 Win=2363 Len=1368 TSval=7853021 TSecr=760422854 [TCP segment of a reassembled PDU]"
"194","2018-08-23 02:04:08.088634","192.168.2.3","216.58.197.4","TCP","1434","34236  >  443 [ACK] Seq=117529 Ack=1434 Win=2363 Len=1368 TSval=7853021 TSecr=760422854 [TCP segment of a reassembled PDU]"
"195","2018-08-23 02:04:08.088636","192.168.2.3","216.58.197.4","TLSv1.2","212","Application Data"
"196","2018-08-23 02:04:08.089077","192.168.2.3","216.58.197.4","TCP","1434","34236  >  443 [ACK] Seq=119043 Ack=1434 Win=2363 Len=1368 TSval=7853021 TSecr=760422854 [TCP segment of a reassembled PDU]"
"197","2018-08-23 02:04:08.089080","192.168.2.3","216.58.197.4","TLSv1.2","155","Application Data"
"201","2018-08-23 02:04:08.183697","192.168.2.3","216.58.197.4","TCP","1434","34236  >  443 [ACK] Seq=120500 Ack=1434 Win=2363 Len=1368 TSval=7853031 TSecr=760422890 [TCP segment of a reassembled PDU]"
"202","2018-08-23 02:04:08.184048","192.168.2.3","216.58.197.4","TCP","1434","34236  >  443 [ACK] Seq=121868 Ack=1434 Win=2363 Len=1368 TSval=7853031 TSecr=760422890 [TCP segment of a reassembled PDU]"
"203","2018-08-23 02:04:08.184051","192.168.2.3","216.58.197.4","TLSv1.2","212","Application Data"
"204","2018-08-23 02:04:08.184554","192.168.2.3","216.58.197.4","TCP","1434","34236  >  443 [ACK] Seq=123382 Ack=1434 Win=2363 Len=1368 TSval=7853031 TSecr=760422890 [TCP segment of a reassembled PDU]"
"205","2018-08-23 02:04:08.184557","192.168.2.3","216.58.197.4","TLSv1.2","155","Application Data"
"211","2018-08-23 02:04:08.258919","192.168.2.3","216.58.197.4","TCP","1434","34236  >  443 [ACK] Seq=124839 Ack=1434 Win=2363 Len=1368 TSval=7853038 TSecr=760422985 [TCP segment of a reassembled PDU]"
"212","2018-08-23 02:04:08.269465","192.168.2.3","216.58.197.4","TCP","1434","34236  >  443 [ACK] Seq=126207 Ack=1434 Win=2363 Len=1368 TSval=7853038 TSecr=760422985 [TCP segment of a reassembled PDU]"
"213","2018-08-23 02:04:08.269471","192.168.2.3","216.58.197.4","TLSv1.2","212","Application Data"
"214","2018-08-23 02:04:08.269858","192.168.2.3","216.58.197.4","TCP","1434","34236  >  443 [ACK] Seq=127721 Ack=1434 Win=2363 Len=1368 TSval=7853038 TSecr=760422985 [TCP segment of a reassembled PDU]"
"215","2018-08-23 02:04:08.269862","192.168.2.3","216.58.197.4","TLSv1.2","155","Application Data"
"216","2018-08-23 02:04:08.269863","192.168.2.3","216.58.197.4","TCP","66","34236  >  443 [ACK] Seq=129178 Ack=1918 Win=2363 Len=0 TSval=7853039 TSecr=760423044"
"220","2018-08-23 02:04:08.357051","192.168.2.3","216.58.197.4","TCP","1434","34236  >  443 [ACK] Seq=129178 Ack=1918 Win=2363 Len=1368 TSval=7853048 TSecr=760423070 [TCP segment of a reassembled PDU]"
"221","2018-08-23 02:04:08.357464","192.168.2.3","216.58.197.4","TCP","1434","34236  >  443 [ACK] Seq=130546 Ack=1918 Win=2363 Len=1368 TSval=7853048 TSecr=760423070 [TCP segment of a reassembled PDU]"
"222","2018-08-23 02:04:08.357467","192.168.2.3","216.58.197.4","TLSv1.2","212","Application Data"
"223","2018-08-23 02:04:08.357851","192.168.2.3","216.58.197.4","TCP","1434","34236  >  443 [ACK] Seq=132060 Ack=1918 Win=2363 Len=1368 TSval=7853048 TSecr=760423070 [TCP segment of a reassembled PDU]"
"224","2018-08-23 02:04:08.357854","192.168.2.3","216.58.197.4","TLSv1.2","155","Application Data"
"230","2018-08-23 02:04:08.412725","192.168.2.3","216.58.197.4","TCP","66","34236  >  443 [ACK] Seq=133517 Ack=2277 Win=2363 Len=0 TSval=7853053 TSecr=760423202"
"231","2018-08-23 02:04:08.440770","192.168.2.3","216.58.197.4","TCP","1434","34236  >  443 [ACK] Seq=133517 Ack=2277 Win=2363 Len=1368 TSval=7853056 TSecr=760423202 [TCP segment of a reassembled PDU]"
"232","2018-08-23 02:04:08.440876","192.168.2.3","216.58.197.4","TCP","1434","34236  >  443 [ACK] Seq=134885 Ack=2277 Win=2363 Len=1368 TSval=7853056 TSecr=760423202 [TCP segment of a reassembled PDU]"
"233","2018-08-23 02:04:08.440878","192.168.2.3","216.58.197.4","TLSv1.2","212","Application Data"
"234","2018-08-23 02:04:08.441159","192.168.2.3","216.58.197.4","TCP","1434","34236  >  443 [ACK] Seq=136399 Ack=2277 Win=2363 Len=1368 TSval=7853056 TSecr=760423202 [TCP segment of a reassembled PDU]"
"235","2018-08-23 02:04:08.441161","192.168.2.3","216.58.197.4","TLSv1.2","155","Application Data"
"239","2018-08-23 02:04:08.537111","192.168.2.3","216.58.197.4","TCP","1434","34236  >  443 [ACK] Seq=137856 Ack=2277 Win=2363 Len=1368 TSval=7853066 TSecr=760423242 [TCP segment of a reassembled PDU]"
"240","2018-08-23 02:04:08.537555","192.168.2.3","216.58.197.4","TCP","1434","34236  >  443 [ACK] Seq=139224 Ack=2277 Win=2363 Len=1368 TSval=7853066 TSecr=760423242 [TCP segment of a reassembled PDU]"
"241","2018-08-23 02:04:08.537557","192.168.2.3","216.58.197.4","TLSv1.2","212","Application Data"
"242","2018-08-23 02:04:08.537926","192.168.2.3","216.58.197.4","TCP","1434","34236  >  443 [ACK] Seq=140738 Ack=2277 Win=2363 Len=1368 TSval=7853066 TSecr=760423242 [TCP segment of a reassembled PDU]"
"243","2018-08-23 02:04:08.537929","192.168.2.3","216.58.197.4","TLSv1.2","155","Application Data"
"248","2018-08-23 02:04:08.605707","192.168.2.3","216.58.197.4","TCP","66","34236  >  443 [ACK] Seq=142195 Ack=2810 Win=2363 Len=0 TSval=7853073 TSecr=760423401"
"249","2018-08-23 02:04:08.643172","192.168.2.3","216.58.197.4","TCP","1434","34236  >  443 [ACK] Seq=142195 Ack=2810 Win=2363 Len=1368 TSval=7853077 TSecr=760423401 [TCP segment of a reassembled PDU]"
"250","2018-08-23 02:04:08.643622","192.168.2.3","216.58.197.4","TCP","1434","34236  >  443 [ACK] Seq=143563 Ack=2810 Win=2363 Len=1368 TSval=7853077 TSecr=760423401 [TCP segment of a reassembled PDU]"
"251","2018-08-23 02:04:08.643626","192.168.2.3","216.58.197.4","TLSv1.2","212","Application Data"
"252","2018-08-23 02:04:08.644098","192.168.2.3","216.58.197.4","TCP","1434","34236  >  443 [ACK] Seq=145077 Ack=2810 Win=2363 Len=1368 TSval=7853077 TSecr=760423401 [TCP segment of a reassembled PDU]"
"253","2018-08-23 02:04:08.644101","192.168.2.3","216.58.197.4","TLSv1.2","155","Application Data"
"257","2018-08-23 02:04:08.733062","192.168.2.3","216.58.197.4","TCP","1434","34236  >  443 [ACK] Seq=146534 Ack=2810 Win=2363 Len=1368 TSval=7853085 TSecr=760423445 [TCP segment of a reassembled PDU]"
"258","2018-08-23 02:04:08.733067","192.168.2.3","216.58.197.4","TCP","1434","34236  >  443 [ACK] Seq=147902 Ack=2810 Win=2363 Len=1368 TSval=7853085 TSecr=760423445 [TCP segment of a reassembled PDU]"
"259","2018-08-23 02:04:08.733190","192.168.2.3","216.58.197.4","TLSv1.2","212","Application Data"
"260","2018-08-23 02:04:08.733441","192.168.2.3","216.58.197.4","TCP","1434","34236  >  443 [ACK] Seq=149416 Ack=2810 Win=2363 Len=1368 TSval=7853085 TSecr=760423445 [TCP segment of a reassembled PDU]"
"261","2018-08-23 02:04:08.733444","192.168.2.3","216.58.197.4","TLSv1.2","155","Application Data"
"265","2018-08-23 02:04:08.837783","192.168.2.3","216.58.197.4","TCP","1434","34236  >  443 [ACK] Seq=150873 Ack=2810 Win=2363 Len=1368 TSval=7853096 TSecr=760423534 [TCP segment of a reassembled PDU]"
"266","2018-08-23 02:04:08.837787","192.168.2.3","216.58.197.4","TCP","1434","34236  >  443 [ACK] Seq=152241 Ack=2810 Win=2363 Len=1368 TSval=7853096 TSecr=760423534 [TCP segment of a reassembled PDU]"
"267","2018-08-23 02:04:08.837789","192.168.2.3","216.58.197.4","TLSv1.2","212","Application Data"
"268","2018-08-23 02:04:08.838033","192.168.2.3","216.58.197.4","TCP","1434","34236  >  443 [ACK] Seq=153755 Ack=2810 Win=2363 Len=1368 TSval=7853096 TSecr=760423534 [TCP segment of a reassembled PDU]"
"269","2018-08-23 02:04:08.838037","192.168.2.3","216.58.197.4","TLSv1.2","155","Application Data"
"273","2018-08-23 02:04:08.894444","192.168.2.3","216.58.197.4","TCP","66","34236  >  443 [ACK] Seq=155212 Ack=3139 Win=2363 Len=0 TSval=7853102 TSecr=760423689"
"274","2018-08-23 02:04:08.921409","192.168.2.3","216.58.197.4","TCP","1434","34236  >  443 [ACK] Seq=155212 Ack=3139 Win=2363 Len=1368 TSval=7853104 TSecr=760423689 [TCP segment of a reassembled PDU]"
"275","2018-08-23 02:04:08.921416","192.168.2.3","216.58.197.4","TCP","1434","34236  >  443 [ACK] Seq=156580 Ack=3139 Win=2363 Len=1368 TSval=7853104 TSecr=760423689 [TCP segment of a reassembled PDU]"
"276","2018-08-23 02:04:08.921417","192.168.2.3","216.58.197.4","TLSv1.2","212","Application Data"
"277","2018-08-23 02:04:08.921701","192.168.2.3","216.58.197.4","TCP","1434","34236  >  443 [ACK] Seq=158094 Ack=3139 Win=2363 Len=1368 TSval=7853104 TSecr=760423689 [TCP segment of a reassembled PDU]"
"278","2018-08-23 02:04:08.921706","192.168.2.3","216.58.197.4","TLSv1.2","155","Application Data"
"284","2018-08-23 02:04:08.983042","192.168.2.3","216.58.197.4","TCP","66","34236  >  443 [ACK] Seq=159551 Ack=3668 Win=2363 Len=0 TSval=7853111 TSecr=760423778"
"285","2018-08-23 02:04:09.015872","192.168.2.3","216.58.197.4","TCP","1434","34236  >  443 [ACK] Seq=159551 Ack=3668 Win=2363 Len=1368 TSval=7853114 TSecr=760423778 [TCP segment of a reassembled PDU]"
"286","2018-08-23 02:04:09.016179","192.168.2.3","216.58.197.4","TCP","1434","34236  >  443 [ACK] Seq=160919 Ack=3668 Win=2363 Len=1368 TSval=7853114 TSecr=760423778 [TCP segment of a reassembled PDU]"
"287","2018-08-23 02:04:09.016182","192.168.2.3","216.58.197.4","TLSv1.2","212","Application Data"
"288","2018-08-23 02:04:09.016653","192.168.2.3","216.58.197.4","TCP","1434","34236  >  443 [ACK] Seq=162433 Ack=3668 Win=2363 Len=1368 TSval=7853114 TSecr=760423778 [TCP segment of a reassembled PDU]"
"289","2018-08-23 02:04:09.016657","192.168.2.3","216.58.197.4","TLSv1.2","155","Application Data"
"295","2018-08-23 02:04:09.059468","192.168.2.3","216.58.197.4","TCP","66","34236  >  443 [ACK] Seq=163890 Ack=3947 Win=2363 Len=0 TSval=7853118 TSecr=760423845"
"296","2018-08-23 02:04:09.111648","192.168.2.3","216.58.197.4","TCP","1434","34236  >  443 [ACK] Seq=163890 Ack=3947 Win=2363 Len=1368 TSval=7853123 TSecr=760423845 [TCP segment of a reassembled PDU]"
"297","2018-08-23 02:04:09.112089","192.168.2.3","216.58.197.4","TCP","1434","34236  >  443 [ACK] Seq=165258 Ack=3947 Win=2363 Len=1368 TSval=7853123 TSecr=760423845 [TCP segment of a reassembled PDU]"
"298","2018-08-23 02:04:09.112092","192.168.2.3","216.58.197.4","TLSv1.2","212","Application Data"
"299","2018-08-23 02:04:09.112531","192.168.2.3","216.58.197.4","TCP","1434","34236  >  443 [ACK] Seq=166772 Ack=3947 Win=2363 Len=1368 TSval=7853123 TSecr=760423845 [TCP segment of a reassembled PDU]"
"300","2018-08-23 02:04:09.112533","192.168.2.3","216.58.197.4","TLSv1.2","155","Application Data"
"304","2018-08-23 02:04:09.207955","192.168.2.3","216.58.197.4","TCP","1434","34236  >  443 [ACK] Seq=168229 Ack=3947 Win=2363 Len=1368 TSval=7853133 TSecr=760423954 [TCP segment of a reassembled PDU]"
"305","2018-08-23 02:04:09.208467","192.168.2.3","216.58.197.4","TCP","1434","34236  >  443 [ACK] Seq=169597 Ack=3947 Win=2363 Len=1368 TSval=7853133 TSecr=760423954 [TCP segment of a reassembled PDU]"
"306","2018-08-23 02:04:09.208471","192.168.2.3","216.58.197.4","TLSv1.2","212","Application Data"
"307","2018-08-23 02:04:09.208472","192.168.2.3","216.58.197.4","TCP","1434","34236  >  443 [ACK] Seq=171111 Ack=3947 Win=2363 Len=1368 TSval=7853133 TSecr=760423954 [TCP segment of a reassembled PDU]"
"308","2018-08-23 02:04:09.208473","192.168.2.3","216.58.197.4","TLSv1.2","155","Application Data"
"314","2018-08-23 02:04:09.265466","192.168.2.3","216.58.197.4","TCP","66","34236  >  443 [ACK] Seq=172568 Ack=4327 Win=2363 Len=0 TSval=7853139 TSecr=760424060"
"315","2018-08-23 02:04:09.302147","192.168.2.3","216.58.197.4","TCP","1434","34236  >  443 [ACK] Seq=172568 Ack=4327 Win=2363 Len=1368 TSval=7853142 TSecr=760424060 [TCP segment of a reassembled PDU]"
"316","2018-08-23 02:04:09.302152","192.168.2.3","216.58.197.4","TCP","1434","34236  >  443 [ACK] Seq=173936 Ack=4327 Win=2363 Len=1368 TSval=7853142 TSecr=760424060 [TCP segment of a reassembled PDU]"
"317","2018-08-23 02:04:09.302428","192.168.2.3","216.58.197.4","TLSv1.2","212","Application Data"
"318","2018-08-23 02:04:09.302818","192.168.2.3","216.58.197.4","TCP","1434","34236  >  443 [ACK] Seq=175450 Ack=4327 Win=2363 Len=1368 TSval=7853142 TSecr=760424060 [TCP segment of a reassembled PDU]"
"319","2018-08-23 02:04:09.302821","192.168.2.3","216.58.197.4","TLSv1.2","155","Application Data"
"323","2018-08-23 02:04:09.380740","192.168.2.3","216.58.197.4","TCP","1434","34236  >  443 [ACK] Seq=176907 Ack=4327 Win=2363 Len=1368 TSval=7853150 TSecr=760424103 [TCP segment of a reassembled PDU]"
"324","2018-08-23 02:04:09.381012","192.168.2.3","216.58.197.4","TCP","1434","34236  >  443 [ACK] Seq=178275 Ack=4327 Win=2363 Len=1368 TSval=7853150 TSecr=760424103 [TCP segment of a reassembled PDU]"
"325","2018-08-23 02:04:09.381015","192.168.2.3","216.58.197.4","TLSv1.2","212","Application Data"
"326","2018-08-23 02:04:09.381226","192.168.2.3","216.58.197.4","TCP","1434","34236  >  443 [ACK] Seq=179789 Ack=4327 Win=2363 Len=1368 TSval=7853150 TSecr=760424103 [TCP segment of a reassembled PDU]"
"327","2018-08-23 02:04:09.381229","192.168.2.3","216.58.197.4","TLSv1.2","155","Application Data"
"333","2018-08-23 02:04:09.441112","192.168.2.3","216.58.197.4","TCP","66","34236  >  443 [ACK] Seq=181246 Ack=4739 Win=2363 Len=0 TSval=7853156 TSecr=760424236"
"334","2018-08-23 02:04:09.477362","192.168.2.3","216.58.197.4","TCP","1434","34236  >  443 [ACK] Seq=181246 Ack=4739 Win=2363 Len=1368 TSval=7853160 TSecr=760424236 [TCP segment of a reassembled PDU]"
"335","2018-08-23 02:04:09.480534","192.168.2.3","216.58.197.4","TCP","1434","34236  >  443 [ACK] Seq=182614 Ack=4739 Win=2363 Len=1368 TSval=7853160 TSecr=760424236 [TCP segment of a reassembled PDU]"
"336","2018-08-23 02:04:09.480538","192.168.2.3","216.58.197.4","TLSv1.2","212","Application Data"
"337","2018-08-23 02:04:09.480539","192.168.2.3","216.58.197.4","TCP","1434","34236  >  443 [ACK] Seq=184128 Ack=4739 Win=2363 Len=1368 TSval=7853160 TSecr=760424236 [TCP segment of a reassembled PDU]"
"338","2018-08-23 02:04:09.480669","192.168.2.3","216.58.197.4","TLSv1.2","155","Application Data"
"341","2018-08-23 02:04:09.570844","192.168.2.3","216.58.197.4","TCP","1434","34236  >  443 [ACK] Seq=185585 Ack=4739 Win=2363 Len=1368 TSval=7853169 TSecr=760424281 [TCP segment of a reassembled PDU]"
"342","2018-08-23 02:04:09.571148","192.168.2.3","216.58.197.4","TCP","1434","34236  >  443 [ACK] Seq=186953 Ack=4739 Win=2363 Len=1368 TSval=7853169 TSecr=760424281 [TCP segment of a reassembled PDU]"
"343","2018-08-23 02:04:09.571152","192.168.2.3","216.58.197.4","TLSv1.2","212","Application Data"
"344","2018-08-23 02:04:09.571398","192.168.2.3","216.58.197.4","TCP","1434","34236  >  443 [ACK] Seq=188467 Ack=4739 Win=2363 Len=1368 TSval=7853169 TSecr=760424281 [TCP segment of a reassembled PDU]"
"345","2018-08-23 02:04:09.571401","192.168.2.3","216.58.197.4","TLSv1.2","155","Application Data"
"349","2018-08-23 02:04:09.667361","192.168.2.3","216.58.197.4","TCP","1434","34236  >  443 [ACK] Seq=189924 Ack=4739 Win=2363 Len=1368 TSval=7853179 TSecr=760424372 [TCP segment of a reassembled PDU]"
"350","2018-08-23 02:04:09.667367","192.168.2.3","216.58.197.4","TCP","1434","34236  >  443 [ACK] Seq=191292 Ack=4739 Win=2363 Len=1368 TSval=7853179 TSecr=760424372 [TCP segment of a reassembled PDU]"
"351","2018-08-23 02:04:09.667477","192.168.2.3","216.58.197.4","TLSv1.2","212","Application Data"
"352","2018-08-23 02:04:09.667789","192.168.2.3","216.58.197.4","TCP","1434","34236  >  443 [ACK] Seq=192806 Ack=4739 Win=2363 Len=1368 TSval=7853179 TSecr=760424372 [TCP segment of a reassembled PDU]"
"353","2018-08-23 02:04:09.667792","192.168.2.3","216.58.197.4","TLSv1.2","155","Application Data"
"357","2018-08-23 02:04:09.764457","192.168.2.3","216.58.197.4","TCP","1434","34236  >  443 [ACK] Seq=194263 Ack=4739 Win=2363 Len=1368 TSval=7853189 TSecr=760424468 [TCP segment of a reassembled PDU]"
"358","2018-08-23 02:04:09.764849","192.168.2.3","216.58.197.4","TCP","1434","34236  >  443 [ACK] Seq=195631 Ack=4739 Win=2363 Len=1368 TSval=7853189 TSecr=760424468 [TCP segment of a reassembled PDU]"
"359","2018-08-23 02:04:09.764852","192.168.2.3","216.58.197.4","TLSv1.2","212","Application Data"
"360","2018-08-23 02:04:09.765263","192.168.2.3","216.58.197.4","TCP","1434","34236  >  443 [ACK] Seq=197145 Ack=4739 Win=2363 Len=1368 TSval=7853189 TSecr=760424468 [TCP segment of a reassembled PDU]"
"361","2018-08-23 02:04:09.765266","192.168.2.3","216.58.197.4","TLSv1.2","155","Application Data"
"367","2018-08-23 02:04:09.848676","192.168.2.3","216.58.197.4","TCP","1434","34236  >  443 [ACK] Seq=198602 Ack=4739 Win=2363 Len=1368 TSval=7853197 TSecr=760424566 [TCP segment of a reassembled PDU]"
"368","2018-08-23 02:04:09.848957","192.168.2.3","216.58.197.4","TCP","1434","34236  >  443 [ACK] Seq=199970 Ack=4739 Win=2363 Len=1368 TSval=7853197 TSecr=760424566 [TCP segment of a reassembled PDU]"
"369","2018-08-23 02:04:09.848961","192.168.2.3","216.58.197.4","TLSv1.2","212","Application Data"
"370","2018-08-23 02:04:09.849408","192.168.2.3","216.58.197.4","TCP","1434","34236  >  443 [ACK] Seq=201484 Ack=4739 Win=2363 Len=1368 TSval=7853197 TSecr=760424566 [TCP segment of a reassembled PDU]"
"371","2018-08-23 02:04:09.849412","192.168.2.3","216.58.197.4","TLSv1.2","155","Application Data"
"376","2018-08-23 02:04:09.863155","192.168.2.3","216.58.197.14","TCP","74","41152  >  443 [SYN] Seq=0 Win=14600 Len=0 MSS=1460 SACK_PERM=1 TSval=7853199 TSecr=0 WS=64"
"378","2018-08-23 02:04:09.868995","192.168.2.3","216.58.197.14","TCP","66","41152  >  443 [ACK] Seq=1 Ack=1 Win=14656 Len=0 TSval=7853199 TSecr=933433398"
"379","2018-08-23 02:04:09.869774","192.168.2.3","216.58.197.14","TLSv1.2","265","Client Hello"
"383","2018-08-23 02:04:09.900716","192.168.2.3","216.58.197.4","TCP","66","34236  >  443 [ACK] Seq=202941 Ack=4978 Win=2363 Len=0 TSval=7853202 TSecr=760424695"
"387","2018-08-23 02:04:09.920075","192.168.2.3","216.58.197.14","TCP","66","41152  >  443 [ACK] Seq=200 Ack=1419 Win=17472 Len=0 TSval=7853204 TSecr=933433440"
"388","2018-08-23 02:04:09.920487","192.168.2.3","216.58.197.14","TCP","66","41152  >  443 [ACK] Seq=200 Ack=2837 Win=20288 Len=0 TSval=7853204 TSecr=933433440"
"389","2018-08-23 02:04:09.920776","192.168.2.3","216.58.197.14","TCP","66","41152  >  443 [ACK] Seq=200 Ack=3551 Win=23168 Len=0 TSval=7853204 TSecr=933433440"
"391","2018-08-23 02:04:09.923112","192.168.2.3","216.58.197.14","TCP","78","[TCP Dup ACK 389#1] 41152  >  443 [ACK] Seq=200 Ack=3551 Win=23168 Len=0 TSval=7853205 TSecr=933433452 SLE=2837 SRE=3551"
"392","2018-08-23 02:04:09.930558","192.168.2.3","216.58.197.14","TLSv1.2","151","Client Key Exchange, Change Cipher Spec, Encrypted Handshake Message"
"395","2018-08-23 02:04:09.948757","192.168.2.3","216.58.197.14","TLSv1.2","151","Application Data"
"396","2018-08-23 02:04:09.948761","192.168.2.3","216.58.197.14","TLSv1.2","96","Application Data"
"397","2018-08-23 02:04:09.949634","192.168.2.3","216.58.197.14","TCP","1434","41152  >  443 [ACK] Seq=400 Ack=3888 Win=25984 Len=1368 TSval=7853207 TSecr=933433466 [TCP segment of a reassembled PDU]"
"398","2018-08-23 02:04:09.950070","192.168.2.3","216.58.197.14","TCP","1434","41152  >  443 [ACK] Seq=1768 Ack=3888 Win=25984 Len=1368 TSval=7853207 TSecr=933433466 [TCP segment of a reassembled PDU]"
"399","2018-08-23 02:04:09.950289","192.168.2.3","216.58.197.14","TLSv1.2","249","Application Data"
"400","2018-08-23 02:04:09.950292","192.168.2.3","216.58.197.14","TCP","1434","41152  >  443 [ACK] Seq=3319 Ack=3888 Win=25984 Len=1368 TSval=7853207 TSecr=933433466 [TCP segment of a reassembled PDU]"
"401","2018-08-23 02:04:09.950514","192.168.2.3","216.58.197.14","TLSv1.2","94","Application Data"
"406","2018-08-23 02:04:09.957654","192.168.2.3","216.58.197.4","TCP","1434","34236  >  443 [ACK] Seq=202941 Ack=4978 Win=2363 Len=1368 TSval=7853208 TSecr=760424695 [TCP segment of a reassembled PDU]"
"407","2018-08-23 02:04:09.958117","192.168.2.3","216.58.197.4","TCP","1434","34236  >  443 [ACK] Seq=204309 Ack=4978 Win=2363 Len=1368 TSval=7853208 TSecr=760424695 [TCP segment of a reassembled PDU]"
"408","2018-08-23 02:04:09.958119","192.168.2.3","216.58.197.4","TLSv1.2","212","Application Data"
"409","2018-08-23 02:04:09.958423","192.168.2.3","216.58.197.4","TCP","1434","34236  >  443 [ACK] Seq=205823 Ack=4978 Win=2363 Len=1368 TSval=7853208 TSecr=760424695 [TCP segment of a reassembled PDU]"
"410","2018-08-23 02:04:09.958439","192.168.2.3","216.58.197.4","TLSv1.2","155","Application Data"
"414","2018-08-23 02:04:09.993323","192.168.2.3","216.58.197.14","TCP","66","41152  >  443 [ACK] Seq=4715 Ack=3918 Win=25984 Len=0 TSval=7853212 TSecr=933433483"
"415","2018-08-23 02:04:10.040728","192.168.2.3","216.58.197.4","TCP","1434","34236  >  443 [ACK] Seq=207280 Ack=4978 Win=2363 Len=1368 TSval=7853216 TSecr=760424759 [TCP segment of a reassembled PDU]"
"416","2018-08-23 02:04:10.041176","192.168.2.3","216.58.197.4","TCP","1434","34236  >  443 [ACK] Seq=208648 Ack=4978 Win=2363 Len=1368 TSval=7853216 TSecr=760424759 [TCP segment of a reassembled PDU]"
"417","2018-08-23 02:04:10.041180","192.168.2.3","216.58.197.4","TLSv1.2","212","Application Data"
"418","2018-08-23 02:04:10.041181","192.168.2.3","216.58.197.4","TCP","1434","34236  >  443 [ACK] Seq=210162 Ack=4978 Win=2363 Len=1368 TSval=7853216 TSecr=760424759 [TCP segment of a reassembled PDU]"
"419","2018-08-23 02:04:10.041338","192.168.2.3","216.58.197.4","TLSv1.2","155","Application Data"
"425","2018-08-23 02:04:10.062548","192.168.2.3","216.58.197.4","TCP","66","34236  >  443 [ACK] Seq=211619 Ack=5249 Win=2363 Len=0 TSval=7853218 TSecr=760424845"
"428","2018-08-23 02:04:10.095543","192.168.2.3","216.58.197.4","TCP","66","34236  >  443 [ACK] Seq=211619 Ack=5385 Win=2363 Len=0 TSval=7853222 TSecr=760424891"
"429","2018-08-23 02:04:10.136703","192.168.2.3","216.58.197.4","TCP","1434","34236  >  443 [ACK] Seq=211619 Ack=5385 Win=2363 Len=1368 TSval=7853226 TSecr=760424891 [TCP segment of a reassembled PDU]"
"430","2018-08-23 02:04:10.137143","192.168.2.3","216.58.197.4","TCP","1434","34236  >  443 [ACK] Seq=212987 Ack=5385 Win=2363 Len=1368 TSval=7853226 TSecr=760424891 [TCP segment of a reassembled PDU]"
"431","2018-08-23 02:04:10.137145","192.168.2.3","216.58.197.4","TLSv1.2","212","Application Data"
"432","2018-08-23 02:04:10.137146","192.168.2.3","216.58.197.4","TCP","1434","34236  >  443 [ACK] Seq=214501 Ack=5385 Win=2363 Len=1368 TSval=7853226 TSecr=760424891 [TCP segment of a reassembled PDU]"
"433","2018-08-23 02:04:10.137147","192.168.2.3","216.58.197.4","TLSv1.2","155","Application Data"
"437","2018-08-23 02:04:10.244773","192.168.2.3","216.58.197.4","TCP","1434","34236  >  443 [ACK] Seq=215958 Ack=5385 Win=2363 Len=1368 TSval=7853237 TSecr=760424978 [TCP segment of a reassembled PDU]"
"438","2018-08-23 02:04:10.245176","192.168.2.3","216.58.197.4","TCP","1434","34236  >  443 [ACK] Seq=217326 Ack=5385 Win=2363 Len=1368 TSval=7853237 TSecr=760424978 [TCP segment of a reassembled PDU]"
"439","2018-08-23 02:04:10.245178","192.168.2.3","216.58.197.4","TLSv1.2","212","Application Data"
"440","2018-08-23 02:04:10.245525","192.168.2.3","216.58.197.4","TCP","1434","34236  >  443 [ACK] Seq=218840 Ack=5385 Win=2363 Len=1368 TSval=7853237 TSecr=760424978 [TCP segment of a reassembled PDU]"
"441","2018-08-23 02:04:10.245528","192.168.2.3","216.58.197.4","TLSv1.2","155","Application Data"
"447","2018-08-23 02:04:10.257290","192.168.2.3","216.58.197.14","TCP","66","41152  >  443 [ACK] Seq=4715 Ack=4187 Win=28800 Len=0 TSval=7853238 TSecr=933433786"
"448","2018-08-23 02:04:10.257294","192.168.2.3","216.58.197.14","TCP","66","41152  >  443 [ACK] Seq=4715 Ack=4713 Win=31616 Len=0 TSval=7853238 TSecr=933433786"
"451","2018-08-23 02:04:10.258725","192.168.2.3","216.58.197.14","TCP","66","41152  >  443 [ACK] Seq=4715 Ack=4781 Win=31616 Len=0 TSval=7853238 TSecr=933433788"
"452","2018-08-23 02:04:10.261801","192.168.2.3","216.58.197.14","TLSv1.2","104","Application Data"
"454","2018-08-23 02:04:10.328932","192.168.2.3","216.58.197.4","TCP","1434","34236  >  443 [ACK] Seq=220297 Ack=5385 Win=2363 Len=1368 TSval=7853245 TSecr=760425046 [TCP segment of a reassembled PDU]"
"455","2018-08-23 02:04:10.329386","192.168.2.3","216.58.197.4","TCP","1434","34236  >  443 [ACK] Seq=221665 Ack=5385 Win=2363 Len=1368 TSval=7853245 TSecr=760425046 [TCP segment of a reassembled PDU]"
"456","2018-08-23 02:04:10.329389","192.168.2.3","216.58.197.4","TLSv1.2","212","Application Data"
"457","2018-08-23 02:04:10.329390","192.168.2.3","216.58.197.4","TCP","1434","34236  >  443 [ACK] Seq=223179 Ack=5385 Win=2363 Len=1368 TSval=7853245 TSecr=760425046 [TCP segment of a reassembled PDU]"
"458","2018-08-23 02:04:10.329391","192.168.2.3","216.58.197.4","TLSv1.2","155","Application Data"
"463","2018-08-23 02:04:10.433090","192.168.2.3","216.58.197.4","TCP","66","34236  >  443 [ACK] Seq=224636 Ack=5432 Win=2363 Len=0 TSval=7853256 TSecr=760425189"
"464","2018-08-23 02:04:10.437397","192.168.2.3","216.58.197.4","TCP","1434","34236  >  443 [ACK] Seq=224636 Ack=5432 Win=2363 Len=1368 TSval=7853256 TSecr=760425189 [TCP segment of a reassembled PDU]"
"465","2018-08-23 02:04:10.437805","192.168.2.3","216.58.197.4","TCP","1434","34236  >  443 [ACK] Seq=226004 Ack=5432 Win=2363 Len=1368 TSval=7853256 TSecr=760425189 [TCP segment of a reassembled PDU]"
"466","2018-08-23 02:04:10.437807","192.168.2.3","216.58.197.4","TLSv1.2","212","Application Data"
"467","2018-08-23 02:04:10.438084","192.168.2.3","216.58.197.4","TCP","1434","34236  >  443 [ACK] Seq=227518 Ack=5432 Win=2363 Len=1368 TSval=7853256 TSecr=760425189 [TCP segment of a reassembled PDU]"
"468","2018-08-23 02:04:10.438086","192.168.2.3","216.58.197.4","TLSv1.2","155","Application Data"
"474","2018-08-23 02:04:10.500878","192.168.2.3","216.58.197.4","TCP","66","34236  >  443 [ACK] Seq=228975 Ack=5653 Win=2363 Len=0 TSval=7853262 TSecr=760425294"
"475","2018-08-23 02:04:10.500881","192.168.2.3","216.58.197.4","TCP","66","34236  >  443 [ACK] Seq=228975 Ack=5733 Win=2363 Len=0 TSval=7853262 TSecr=760425294"
"476","2018-08-23 02:04:10.520711","192.168.2.3","216.58.197.4","TCP","1434","34236  >  443 [ACK] Seq=228975 Ack=5733 Win=2363 Len=1368 TSval=7853264 TSecr=760425294 [TCP segment of a reassembled PDU]"
"477","2018-08-23 02:04:10.521051","192.168.2.3","216.58.197.4","TCP","1434","34236  >  443 [ACK] Seq=230343 Ack=5733 Win=2363 Len=1368 TSval=7853264 TSecr=760425294 [TCP segment of a reassembled PDU]"
"478","2018-08-23 02:04:10.521054","192.168.2.3","216.58.197.4","TLSv1.2","212","Application Data"
"479","2018-08-23 02:04:10.521055","192.168.2.3","216.58.197.4","TCP","1434","34236  >  443 [ACK] Seq=231857 Ack=5733 Win=2363 Len=1368 TSval=7853264 TSecr=760425294 [TCP segment of a reassembled PDU]"
"480","2018-08-23 02:04:10.521187","192.168.2.3","216.58.197.4","TLSv1.2","155","Application Data"
"484","2018-08-23 02:04:10.616454","192.168.2.3","216.58.197.4","TCP","1434","34236  >  443 [ACK] Seq=233314 Ack=5733 Win=2363 Len=1368 TSval=7853274 TSecr=760425322 [TCP segment of a reassembled PDU]"
"485","2018-08-23 02:04:10.616719","192.168.2.3","216.58.197.4","TCP","1434","34236  >  443 [ACK] Seq=234682 Ack=5733 Win=2363 Len=1368 TSval=7853274 TSecr=760425322 [TCP segment of a reassembled PDU]"
"486","2018-08-23 02:04:10.616723","192.168.2.3","216.58.197.4","TLSv1.2","212","Application Data"
"487","2018-08-23 02:04:10.617213","192.168.2.3","216.58.197.4","TCP","1434","34236  >  443 [ACK] Seq=236196 Ack=5733 Win=2363 Len=1368 TSval=7853274 TSecr=760425322 [TCP segment of a reassembled PDU]"
"488","2018-08-23 02:04:10.617215","192.168.2.3","216.58.197.4","TLSv1.2","155","Application Data"
"494","2018-08-23 02:04:10.675729","192.168.2.3","216.58.197.4","TCP","66","34236  >  443 [ACK] Seq=237653 Ack=6017 Win=2363 Len=0 TSval=7853280 TSecr=760425470"
"495","2018-08-23 02:04:10.726198","192.168.2.3","216.58.197.4","TCP","1434","34236  >  443 [ACK] Seq=237653 Ack=6017 Win=2363 Len=1368 TSval=7853285 TSecr=760425470 [TCP segment of a reassembled PDU]"
"496","2018-08-23 02:04:10.726202","192.168.2.3","216.58.197.4","TCP","1434","34236  >  443 [ACK] Seq=239021 Ack=6017 Win=2363 Len=1368 TSval=7853285 TSecr=760425470 [TCP segment of a reassembled PDU]"
"497","2018-08-23 02:04:10.726323","192.168.2.3","216.58.197.4","TLSv1.2","212","Application Data"
"498","2018-08-23 02:04:10.726555","192.168.2.3","216.58.197.4","TCP","1434","34236  >  443 [ACK] Seq=240535 Ack=6017 Win=2363 Len=1368 TSval=7853285 TSecr=760425470 [TCP segment of a reassembled PDU]"
"499","2018-08-23 02:04:10.726558","192.168.2.3","216.58.197.4","TLSv1.2","155","Application Data"
"503","2018-08-23 02:04:10.808627","192.168.2.3","216.58.197.4","TCP","1434","34236  >  443 [ACK] Seq=241992 Ack=6017 Win=2363 Len=1368 TSval=7853293 TSecr=760425527 [TCP segment of a reassembled PDU]"
"504","2018-08-23 02:04:10.811836","192.168.2.3","216.58.197.4","TCP","1434","34236  >  443 [ACK] Seq=243360 Ack=6017 Win=2363 Len=1368 TSval=7853293 TSecr=760425527 [TCP segment of a reassembled PDU]"
"505","2018-08-23 02:04:10.811841","192.168.2.3","216.58.197.4","TLSv1.2","212","Application Data"
"506","2018-08-23 02:04:10.811842","192.168.2.3","216.58.197.4","TCP","1434","34236  >  443 [ACK] Seq=244874 Ack=6017 Win=2363 Len=1368 TSval=7853293 TSecr=760425527 [TCP segment of a reassembled PDU]"
"507","2018-08-23 02:04:10.811843","192.168.2.3","216.58.197.4","TLSv1.2","155","Application Data"
"513","2018-08-23 02:04:10.870190","192.168.2.3","216.58.197.4","TCP","66","34236  >  443 [ACK] Seq=246331 Ack=6502 Win=2363 Len=0 TSval=7853299 TSecr=760425661"
"514","2018-08-23 02:04:10.918047","192.168.2.3","216.58.197.4","TCP","1434","34236  >  443 [ACK] Seq=246331 Ack=6502 Win=2363 Len=1368 TSval=7853304 TSecr=760425661 [TCP segment of a reassembled PDU]"
"515","2018-08-23 02:04:10.918290","192.168.2.3","216.58.197.4","TCP","1434","34236  >  443 [ACK] Seq=247699 Ack=6502 Win=2363 Len=1368 TSval=7853304 TSecr=760425661 [TCP segment of a reassembled PDU]"
"516","2018-08-23 02:04:10.918295","192.168.2.3","216.58.197.4","TLSv1.2","212","Application Data"
"517","2018-08-23 02:04:10.918446","192.168.2.3","216.58.197.4","TCP","1434","34236  >  443 [ACK] Seq=249213 Ack=6502 Win=2363 Len=1368 TSval=7853304 TSecr=760425661 [TCP segment of a reassembled PDU]"
"518","2018-08-23 02:04:10.918451","192.168.2.3","216.58.197.4","TLSv1.2","155","Application Data"
"519","2018-08-23 02:04:10.918811","192.168.2.3","216.58.197.4","TLSv1.2","272","Application Data"
"526","2018-08-23 02:04:10.948168","192.168.2.3","216.58.197.4","TCP","66","34236  >  443 [ACK] Seq=250876 Ack=7444 Win=2363 Len=0 TSval=7853307 TSecr=760425740"
"529","2018-08-23 02:04:11.059440","192.168.2.3","216.58.197.4","TCP","66","34236  >  443 [ACK] Seq=250876 Ack=7601 Win=2363 Len=0 TSval=7853318 TSecr=760425845"
"532","2018-08-23 02:04:11.202557","192.168.2.3","216.58.197.4","TCP","66","34236  >  443 [ACK] Seq=250876 Ack=7883 Win=2363 Len=0 TSval=7853333 TSecr=760425959"
"533","2018-08-23 02:04:11.203168","192.168.2.3","216.58.197.4","TCP","66","34236  >  443 [ACK] Seq=250876 Ack=9135 Win=2363 Len=0 TSval=7853333 TSecr=760425998"
"536","2018-08-23 02:04:11.206775","192.168.2.3","216.58.197.4","TCP","66","34236  >  443 [ACK] Seq=250876 Ack=10860 Win=2363 Len=0 TSval=7853333 TSecr=760426001"
"541","2018-08-23 02:04:11.209926","192.168.2.3","216.58.197.4","TCP","66","34236  >  443 [ACK] Seq=250876 Ack=12713 Win=2363 Len=0 TSval=7853333 TSecr=760426005"
"542","2018-08-23 02:04:11.210505","192.168.2.3","216.58.197.4","TCP","66","34236  >  443 [ACK] Seq=250876 Ack=14493 Win=2363 Len=0 TSval=7853333 TSecr=760426005"
"547","2018-08-23 02:04:11.213046","192.168.2.3","216.58.197.4","TCP","66","34236  >  443 [ACK] Seq=250876 Ack=16367 Win=2363 Len=0 TSval=7853334 TSecr=760426008"
"548","2018-08-23 02:04:11.213622","192.168.2.3","216.58.197.4","TCP","66","34236  >  443 [ACK] Seq=250876 Ack=18095 Win=2363 Len=0 TSval=7853334 TSecr=760426008"
"551","2018-08-23 02:04:11.217795","192.168.2.3","216.58.197.4","TCP","66","34236  >  443 [ACK] Seq=250876 Ack=19856 Win=2363 Len=0 TSval=7853334 TSecr=760426011"
"554","2018-08-23 02:04:11.222471","192.168.2.3","216.58.197.4","TCP","66","34236  >  443 [ACK] Seq=250876 Ack=21570 Win=2363 Len=0 TSval=7853335 TSecr=760426014"
"557","2018-08-23 02:04:11.237243","192.168.2.3","216.58.197.4","TCP","66","34236  >  443 [ACK] Seq=250876 Ack=22996 Win=2363 Len=0 TSval=7853336 TSecr=760426032"
"564","2018-08-23 02:04:11.383689","192.168.2.3","216.58.197.4","TCP","66","34236  >  443 [ACK] Seq=250876 Ack=23697 Win=2363 Len=0 TSval=7853350 TSecr=760426172"
"565","2018-08-23 02:04:11.383693","192.168.2.3","216.58.197.4","TLSv1.2","104","Application Data"
"567","2018-08-23 02:04:14.377448","192.168.2.3","216.58.197.14","TLSv1.2","161","Application Data"
"568","2018-08-23 02:04:14.377452","192.168.2.3","216.58.197.14","TLSv1.2","104","Application Data"
"569","2018-08-23 02:04:14.378496","192.168.2.3","216.58.197.14","TLSv1.2","576","Application Data"
"574","2018-08-23 02:04:14.422762","192.168.2.3","216.58.197.14","TCP","66","41142  >  443 [ACK] Seq=644 Ack=39 Win=661 Len=0 TSval=7853655 TSecr=933437913"
"579","2018-08-23 02:04:14.462159","192.168.2.3","216.58.197.14","TCP","66","41142  >  443 [ACK] Seq=644 Ack=107 Win=661 Len=0 TSval=7853658 TSecr=933437990"
"580","2018-08-23 02:04:14.462162","192.168.2.3","216.58.197.14","TCP","66","41142  >  443 [ACK] Seq=644 Ack=244 Win=661 Len=0 TSval=7853658 TSecr=933437990"
"581","2018-08-23 02:04:14.462163","192.168.2.3","216.58.197.14","TCP","66","41142  >  443 [ACK] Seq=644 Ack=498 Win=661 Len=0 TSval=7853658 TSecr=933437990"
"582","2018-08-23 02:04:14.462164","192.168.2.3","216.58.197.14","TLSv1.2","104","Application Data"
