"No.","Time","Source","Destination","Protocol","Length","Info"
"1","2018-08-23 02:09:28.595985","192.168.2.3","216.58.197.14","TCP","66","41142  >  443 [ACK] Seq=1 Ack=1 Win=661 Len=0 TSval=7885072 TSecr=933707009"
"3","2018-08-23 02:09:30.065313","192.168.2.3","216.58.197.4","TLSv1.2","156","Application Data"
"4","2018-08-23 02:09:30.065318","192.168.2.3","216.58.197.4","TLSv1.2","104","Application Data"
"5","2018-08-23 02:09:30.065319","192.168.2.3","216.58.197.4","TLSv1.2","159","Application Data"
"10","2018-08-23 02:09:30.081232","192.168.2.3","216.58.197.4","TCP","1434","34236  >  443 [ACK] Seq=222 Ack=1 Win=2363 Len=1368 TSval=7885220 TSecr=760730998 [TCP segment of a reassembled PDU]"
"11","2018-08-23 02:09:30.081467","192.168.2.3","216.58.197.4","TCP","1434","34236  >  443 [ACK] Seq=1590 Ack=1 Win=2363 Len=1368 TSval=7885220 TSecr=760730998 [TCP segment of a reassembled PDU]"
"12","2018-08-23 02:09:30.081470","192.168.2.3","216.58.197.4","TLSv1.2","212","Application Data"
"13","2018-08-23 02:09:30.081470","192.168.2.3","216.58.197.4","TCP","1434","34236  >  443 [ACK] Seq=3104 Ack=1 Win=2363 Len=1368 TSval=7885220 TSecr=760730998 [TCP segment of a reassembled PDU]"
"14","2018-08-23 02:09:30.081577","192.168.2.3","216.58.197.4","TLSv1.2","222","Application Data"
"15","2018-08-23 02:09:30.081869","192.168.2.3","216.58.197.4","TCP","1434","34236  >  443 [ACK] Seq=4628 Ack=1 Win=2363 Len=1368 TSval=7885220 TSecr=760730998 [TCP segment of a reassembled PDU]"
"16","2018-08-23 02:09:30.081871","192.168.2.3","216.58.197.4","TCP","1434","34236  >  443 [ACK] Seq=5996 Ack=1 Win=2363 Len=1368 TSval=7885220 TSecr=760730998 [TCP segment of a reassembled PDU]"
"19","2018-08-23 02:09:30.086401","192.168.2.3","216.58.197.4","TLSv1.2","1434","Application Data [TCP segment of a reassembled PDU]"
"20","2018-08-23 02:09:30.086417","192.168.2.3","216.58.197.4","TCP","1434","34236  >  443 [ACK] Seq=8732 Ack=1 Win=2363 Len=1368 TSval=7885220 TSecr=760744867 [TCP segment of a reassembled PDU]"
"22","2018-08-23 02:09:30.086690","192.168.2.3","216.58.197.4","TLSv1.2","1434","Application Data [TCP segment of a reassembled PDU]"
"23","2018-08-23 02:09:30.087043","192.168.2.3","216.58.197.4","TCP","1434","34236  >  443 [ACK] Seq=11468 Ack=1 Win=2363 Len=1368 TSval=7885220 TSecr=760744867 [TCP segment of a reassembled PDU]"
"24","2018-08-23 02:09:30.087763","192.168.2.3","216.58.197.4","TLSv1.2","1434","Application Data [TCP segment of a reassembled PDU]"
"25","2018-08-23 02:09:30.087765","192.168.2.3","216.58.197.4","TCP","1434","34236  >  443 [ACK] Seq=14204 Ack=1 Win=2363 Len=1368 TSval=7885221 TSecr=760744867 [TCP segment of a reassembled PDU]"
"26","2018-08-23 02:09:30.088533","192.168.2.3","216.58.197.4","TLSv1.2","1434","Application Data [TCP segment of a reassembled PDU]"
"27","2018-08-23 02:09:30.088536","192.168.2.3","216.58.197.4","TCP","1434","34236  >  443 [ACK] Seq=16940 Ack=39 Win=2363 Len=1368 TSval=7885221 TSecr=760744867 [TCP segment of a reassembled PDU]"
"28","2018-08-23 02:09:30.088791","192.168.2.3","216.58.197.4","TLSv1.2","1434","Application Data [TCP segment of a reassembled PDU]"
"29","2018-08-23 02:09:30.089235","192.168.2.3","216.58.197.4","TCP","1434","34236  >  443 [ACK] Seq=19676 Ack=39 Win=2363 Len=1368 TSval=7885221 TSecr=760744883 [TCP segment of a reassembled PDU]"
"30","2018-08-23 02:09:30.089237","192.168.2.3","216.58.197.4","TLSv1.2","1434","Application Data [TCP segment of a reassembled PDU]"
"31","2018-08-23 02:09:30.089473","192.168.2.3","216.58.197.4","TCP","1434","34236  >  443 [ACK] Seq=22412 Ack=39 Win=2363 Len=1368 TSval=7885221 TSecr=760744883 [TCP segment of a reassembled PDU]"
"32","2018-08-23 02:09:30.090018","192.168.2.3","216.58.197.4","TLSv1.2","1434","Application Data [TCP segment of a reassembled PDU]"
"33","2018-08-23 02:09:30.090021","192.168.2.3","216.58.197.4","TCP","1434","34236  >  443 [ACK] Seq=25148 Ack=39 Win=2363 Len=1368 TSval=7885221 TSecr=760744883 [TCP segment of a reassembled PDU]"
"34","2018-08-23 02:09:30.090232","192.168.2.3","216.58.197.4","TLSv1.2","1434","Application Data [TCP segment of a reassembled PDU]"
"37","2018-08-23 02:09:30.092223","192.168.2.3","216.58.197.4","TCP","1434","34236  >  443 [ACK] Seq=27884 Ack=39 Win=2363 Len=1368 TSval=7885221 TSecr=760744887 [TCP segment of a reassembled PDU]"
"39","2018-08-23 02:09:30.092493","192.168.2.3","216.58.197.4","TLSv1.2","1434","Application Data, Application Data"
"40","2018-08-23 02:09:30.092496","192.168.2.3","216.58.197.4","TCP","1434","34236  >  443 [ACK] Seq=30620 Ack=39 Win=2363 Len=1368 TSval=7885221 TSecr=760744887 [TCP segment of a reassembled PDU]"
"42","2018-08-23 02:09:30.093344","192.168.2.3","216.58.197.4","TCP","1434","34236  >  443 [ACK] Seq=31988 Ack=39 Win=2363 Len=1368 TSval=7885221 TSecr=760744888 [TCP segment of a reassembled PDU]"
"43","2018-08-23 02:09:30.093347","192.168.2.3","216.58.197.4","TLSv1.2","1434","Application Data [TCP segment of a reassembled PDU]"
"46","2018-08-23 02:09:30.093695","192.168.2.3","216.58.197.4","TLSv1.2","1434","Application Data [TCP segment of a reassembled PDU]"
"47","2018-08-23 02:09:30.094039","192.168.2.3","216.58.197.4","TCP","1434","34236  >  443 [ACK] Seq=36092 Ack=39 Win=2363 Len=1368 TSval=7885221 TSecr=760744889 [TCP segment of a reassembled PDU]"
"48","2018-08-23 02:09:30.094147","192.168.2.3","216.58.197.4","TLSv1.2","1434","Application Data [TCP segment of a reassembled PDU]"
"55","2018-08-23 02:09:30.098732","192.168.2.3","216.58.197.4","TCP","1434","34236  >  443 [ACK] Seq=38828 Ack=39 Win=2363 Len=1368 TSval=7885222 TSecr=760744890 [TCP segment of a reassembled PDU]"
"56","2018-08-23 02:09:30.099158","192.168.2.3","216.58.197.4","TLSv1.2","1434","Application Data [TCP segment of a reassembled PDU]"
"57","2018-08-23 02:09:30.099161","192.168.2.3","216.58.197.4","TCP","1434","34236  >  443 [ACK] Seq=41564 Ack=39 Win=2363 Len=1368 TSval=7885222 TSecr=760744890 [TCP segment of a reassembled PDU]"
"58","2018-08-23 02:09:30.099216","192.168.2.3","216.58.197.4","TLSv1.2","1434","Application Data [TCP segment of a reassembled PDU]"
"59","2018-08-23 02:09:30.099595","192.168.2.3","216.58.197.4","TCP","1434","34236  >  443 [ACK] Seq=44300 Ack=39 Win=2363 Len=1368 TSval=7885222 TSecr=760744890 [TCP segment of a reassembled PDU]"
"60","2018-08-23 02:09:30.099937","192.168.2.3","216.58.197.4","TLSv1.2","1434","Application Data [TCP segment of a reassembled PDU]"
"61","2018-08-23 02:09:30.099940","192.168.2.3","216.58.197.4","TCP","1434","34236  >  443 [PSH, ACK] Seq=47036 Ack=39 Win=2363 Len=1368 TSval=7885222 TSecr=760744890 [TCP segment of a reassembled PDU]"
"62","2018-08-23 02:09:30.100075","192.168.2.3","216.58.197.4","TLSv1.2","1434","Application Data [TCP segment of a reassembled PDU]"
"63","2018-08-23 02:09:30.101693","192.168.2.3","216.58.197.4","TCP","1434","34236  >  443 [ACK] Seq=49772 Ack=39 Win=2363 Len=1368 TSval=7885222 TSecr=760744891 [TCP segment of a reassembled PDU]"
"64","2018-08-23 02:09:30.102069","192.168.2.3","216.58.197.4","TLSv1.2","1434","Application Data [TCP segment of a reassembled PDU]"
"65","2018-08-23 02:09:30.102072","192.168.2.3","216.58.197.4","TCP","1434","34236  >  443 [ACK] Seq=52508 Ack=39 Win=2363 Len=1368 TSval=7885222 TSecr=760744891 [TCP segment of a reassembled PDU]"
"66","2018-08-23 02:09:30.102339","192.168.2.3","216.58.197.4","TLSv1.2","1434","Application Data [TCP segment of a reassembled PDU]"
"67","2018-08-23 02:09:30.102418","192.168.2.3","216.58.197.4","TCP","1434","34236  >  443 [ACK] Seq=55244 Ack=39 Win=2363 Len=1368 TSval=7885222 TSecr=760744891 [TCP segment of a reassembled PDU]"
"68","2018-08-23 02:09:30.102732","192.168.2.3","216.58.197.4","TLSv1.2","1434","Application Data [TCP segment of a reassembled PDU]"
"69","2018-08-23 02:09:30.102734","192.168.2.3","216.58.197.4","TCP","1434","34236  >  443 [ACK] Seq=57980 Ack=39 Win=2363 Len=1368 TSval=7885222 TSecr=760744894 [TCP segment of a reassembled PDU]"
"70","2018-08-23 02:09:30.102940","192.168.2.3","216.58.197.4","TLSv1.2","158","Application Data"
"79","2018-08-23 02:09:30.139361","192.168.2.3","216.58.197.4","TCP","1434","34236  >  443 [ACK] Seq=59440 Ack=39 Win=2363 Len=1368 TSval=7885226 TSecr=760744904 [TCP segment of a reassembled PDU]"
"80","2018-08-23 02:09:30.139650","192.168.2.3","216.58.197.4","TCP","1434","34236  >  443 [ACK] Seq=60808 Ack=39 Win=2363 Len=1368 TSval=7885226 TSecr=760744904 [TCP segment of a reassembled PDU]"
"81","2018-08-23 02:09:30.139652","192.168.2.3","216.58.197.4","TLSv1.2","212","Application Data"
"82","2018-08-23 02:09:30.139915","192.168.2.3","216.58.197.4","TCP","1434","34236  >  443 [ACK] Seq=62322 Ack=39 Win=2363 Len=1368 TSval=7885226 TSecr=760744904 [TCP segment of a reassembled PDU]"
"83","2018-08-23 02:09:30.139918","192.168.2.3","216.58.197.4","TLSv1.2","155","Application Data"
"87","2018-08-23 02:09:30.246519","192.168.2.3","216.58.197.4","TCP","1434","34236  >  443 [ACK] Seq=63779 Ack=39 Win=2363 Len=1368 TSval=7885237 TSecr=760744981 [TCP segment of a reassembled PDU]"
"88","2018-08-23 02:09:30.246944","192.168.2.3","216.58.197.4","TCP","1434","34236  >  443 [ACK] Seq=65147 Ack=39 Win=2363 Len=1368 TSval=7885237 TSecr=760744981 [TCP segment of a reassembled PDU]"
"89","2018-08-23 02:09:30.247139","192.168.2.3","216.58.197.4","TLSv1.2","212","Application Data"
"90","2018-08-23 02:09:30.247142","192.168.2.3","216.58.197.4","TCP","1434","34236  >  443 [ACK] Seq=66661 Ack=39 Win=2363 Len=1368 TSval=7885237 TSecr=760744981 [TCP segment of a reassembled PDU]"
"91","2018-08-23 02:09:30.247454","192.168.2.3","216.58.197.4","TLSv1.2","155","Application Data"
"94","2018-08-23 02:09:30.342354","192.168.2.3","216.58.197.4","TCP","1434","34236  >  443 [ACK] Seq=68118 Ack=39 Win=2363 Len=1368 TSval=7885246 TSecr=760745048 [TCP segment of a reassembled PDU]"
"95","2018-08-23 02:09:30.342776","192.168.2.3","216.58.197.4","TCP","1434","34236  >  443 [ACK] Seq=69486 Ack=39 Win=2363 Len=1368 TSval=7885246 TSecr=760745048 [TCP segment of a reassembled PDU]"
"96","2018-08-23 02:09:30.342780","192.168.2.3","216.58.197.4","TLSv1.2","212","Application Data"
"97","2018-08-23 02:09:30.342781","192.168.2.3","216.58.197.4","TCP","1434","34236  >  443 [ACK] Seq=71000 Ack=39 Win=2363 Len=1368 TSval=7885246 TSecr=760745048 [TCP segment of a reassembled PDU]"
"98","2018-08-23 02:09:30.342782","192.168.2.3","216.58.197.4","TLSv1.2","155","Application Data"
"104","2018-08-23 02:09:30.418114","192.168.2.3","216.58.197.4","TCP","66","34236  >  443 [ACK] Seq=72457 Ack=398 Win=2363 Len=0 TSval=7885254 TSecr=760745214"
"106","2018-08-23 02:09:30.463311","192.168.2.3","216.58.197.4","TCP","1434","34236  >  443 [ACK] Seq=72457 Ack=514 Win=2363 Len=1368 TSval=7885258 TSecr=760745222 [TCP segment of a reassembled PDU]"
"107","2018-08-23 02:09:30.463547","192.168.2.3","216.58.197.4","TCP","1434","34236  >  443 [ACK] Seq=73825 Ack=514 Win=2363 Len=1368 TSval=7885258 TSecr=760745222 [TCP segment of a reassembled PDU]"
"108","2018-08-23 02:09:30.463550","192.168.2.3","216.58.197.4","TLSv1.2","212","Application Data"
"109","2018-08-23 02:09:30.463723","192.168.2.3","216.58.197.4","TCP","1434","34236  >  443 [ACK] Seq=75339 Ack=514 Win=2363 Len=1368 TSval=7885258 TSecr=760745222 [TCP segment of a reassembled PDU]"
"110","2018-08-23 02:09:30.463726","192.168.2.3","216.58.197.4","TLSv1.2","155","Application Data"
"115","2018-08-23 02:09:30.556053","192.168.2.3","216.58.197.4","TCP","1434","34236  >  443 [ACK] Seq=76796 Ack=782 Win=2363 Len=1368 TSval=7885267 TSecr=760745314 [TCP segment of a reassembled PDU]"
"116","2018-08-23 02:09:30.556348","192.168.2.3","216.58.197.4","TCP","1434","34236  >  443 [ACK] Seq=78164 Ack=782 Win=2363 Len=1368 TSval=7885267 TSecr=760745314 [TCP segment of a reassembled PDU]"
"117","2018-08-23 02:09:30.556507","192.168.2.3","216.58.197.4","TLSv1.2","212","Application Data"
"118","2018-08-23 02:09:30.556681","192.168.2.3","216.58.197.4","TCP","1434","34236  >  443 [ACK] Seq=79678 Ack=782 Win=2363 Len=1368 TSval=7885268 TSecr=760745314 [TCP segment of a reassembled PDU]"
"119","2018-08-23 02:09:30.556683","192.168.2.3","216.58.197.4","TLSv1.2","155","Application Data"
"123","2018-08-23 02:09:30.652470","192.168.2.3","216.58.197.4","TCP","1434","34236  >  443 [ACK] Seq=81135 Ack=782 Win=2363 Len=1368 TSval=7885277 TSecr=760745358 [TCP segment of a reassembled PDU]"
"124","2018-08-23 02:09:30.653874","192.168.2.3","216.58.197.4","TCP","1434","34236  >  443 [ACK] Seq=82503 Ack=782 Win=2363 Len=1368 TSval=7885277 TSecr=760745358 [TCP segment of a reassembled PDU]"
"125","2018-08-23 02:09:30.653877","192.168.2.3","216.58.197.4","TLSv1.2","212","Application Data"
"126","2018-08-23 02:09:30.654164","192.168.2.3","216.58.197.4","TCP","1434","34236  >  443 [ACK] Seq=84017 Ack=782 Win=2363 Len=1368 TSval=7885277 TSecr=760745358 [TCP segment of a reassembled PDU]"
"127","2018-08-23 02:09:30.654227","192.168.2.3","216.58.197.4","TLSv1.2","155","Application Data"
"132","2018-08-23 02:09:30.706042","192.168.2.3","216.58.197.4","TCP","66","34236  >  443 [ACK] Seq=85474 Ack=1043 Win=2363 Len=0 TSval=7885283 TSecr=760745469"
"133","2018-08-23 02:09:30.760743","192.168.2.3","216.58.197.4","TCP","1434","34236  >  443 [ACK] Seq=85474 Ack=1043 Win=2363 Len=1368 TSval=7885288 TSecr=760745469 [TCP segment of a reassembled PDU]"
"134","2018-08-23 02:09:30.770888","192.168.2.3","216.58.197.4","TCP","1434","34236  >  443 [ACK] Seq=86842 Ack=1043 Win=2363 Len=1368 TSval=7885288 TSecr=760745469 [TCP segment of a reassembled PDU]"
"135","2018-08-23 02:09:30.770893","192.168.2.3","216.58.197.4","TLSv1.2","212","Application Data"
"136","2018-08-23 02:09:30.771025","192.168.2.3","216.58.197.4","TCP","1434","34236  >  443 [ACK] Seq=88356 Ack=1043 Win=2363 Len=1368 TSval=7885288 TSecr=760745469 [TCP segment of a reassembled PDU]"
"137","2018-08-23 02:09:30.771027","192.168.2.3","216.58.197.4","TLSv1.2","112","Application Data"
"141","2018-08-23 02:09:30.873504","192.168.2.3","216.58.197.4","TCP","1434","34236  >  443 [ACK] Seq=89770 Ack=1043 Win=2363 Len=1368 TSval=7885299 TSecr=760745612 [TCP segment of a reassembled PDU]"
"142","2018-08-23 02:09:30.873868","192.168.2.3","216.58.197.4","TCP","1434","34236  >  443 [ACK] Seq=91138 Ack=1043 Win=2363 Len=1368 TSval=7885299 TSecr=760745612 [TCP segment of a reassembled PDU]"
"143","2018-08-23 02:09:30.873871","192.168.2.3","216.58.197.4","TLSv1.2","212","Application Data"
"144","2018-08-23 02:09:30.874187","192.168.2.3","216.58.197.4","TCP","1434","34236  >  443 [ACK] Seq=92652 Ack=1043 Win=2363 Len=1368 TSval=7885299 TSecr=760745612 [TCP segment of a reassembled PDU]"
"145","2018-08-23 02:09:30.874190","192.168.2.3","216.58.197.4","TLSv1.2","155","Application Data"
"149","2018-08-23 02:09:30.975478","192.168.2.3","216.58.197.4","TCP","1434","34236  >  443 [ACK] Seq=94109 Ack=1043 Win=2363 Len=1368 TSval=7885309 TSecr=760745675 [TCP segment of a reassembled PDU]"
"150","2018-08-23 02:09:30.975484","192.168.2.3","216.58.197.4","TCP","1434","34236  >  443 [ACK] Seq=95477 Ack=1043 Win=2363 Len=1368 TSval=7885309 TSecr=760745675 [TCP segment of a reassembled PDU]"
"151","2018-08-23 02:09:30.975485","192.168.2.3","216.58.197.4","TLSv1.2","212","Application Data"
"152","2018-08-23 02:09:30.975825","192.168.2.3","216.58.197.4","TCP","1434","34236  >  443 [ACK] Seq=96991 Ack=1043 Win=2363 Len=1368 TSval=7885309 TSecr=760745675 [TCP segment of a reassembled PDU]"
"153","2018-08-23 02:09:30.975828","192.168.2.3","216.58.197.4","TLSv1.2","155","Application Data"
"157","2018-08-23 02:09:31.065382","192.168.2.3","216.58.197.4","TCP","1434","34236  >  443 [ACK] Seq=98448 Ack=1043 Win=2363 Len=1368 TSval=7885318 TSecr=760745777 [TCP segment of a reassembled PDU]"
"158","2018-08-23 02:09:31.065625","192.168.2.3","216.58.197.4","TCP","1434","34236  >  443 [ACK] Seq=99816 Ack=1043 Win=2363 Len=1368 TSval=7885318 TSecr=760745777 [TCP segment of a reassembled PDU]"
"159","2018-08-23 02:09:31.065630","192.168.2.3","216.58.197.4","TLSv1.2","212","Application Data"
"160","2018-08-23 02:09:31.066027","192.168.2.3","216.58.197.4","TCP","1434","34236  >  443 [ACK] Seq=101330 Ack=1043 Win=2363 Len=1368 TSval=7885318 TSecr=760745777 [TCP segment of a reassembled PDU]"
"161","2018-08-23 02:09:31.066035","192.168.2.3","216.58.197.4","TLSv1.2","155","Application Data"
"165","2018-08-23 02:09:31.142147","192.168.2.3","216.58.197.4","TCP","1434","34236  >  443 [ACK] Seq=102787 Ack=1043 Win=2363 Len=1368 TSval=7885326 TSecr=760745867 [TCP segment of a reassembled PDU]"
"166","2018-08-23 02:09:31.147398","192.168.2.3","216.58.197.4","TCP","1434","34236  >  443 [ACK] Seq=104155 Ack=1043 Win=2363 Len=1368 TSval=7885326 TSecr=760745867 [TCP segment of a reassembled PDU]"
"167","2018-08-23 02:09:31.147402","192.168.2.3","216.58.197.4","TLSv1.2","212","Application Data"
"168","2018-08-23 02:09:31.147709","192.168.2.3","216.58.197.4","TCP","1434","34236  >  443 [ACK] Seq=105669 Ack=1043 Win=2363 Len=1368 TSval=7885326 TSecr=760745867 [TCP segment of a reassembled PDU]"
"169","2018-08-23 02:09:31.147711","192.168.2.3","216.58.197.4","TLSv1.2","155","Application Data"
"173","2018-08-23 02:09:31.238793","192.168.2.3","216.58.197.4","TCP","1434","34236  >  443 [ACK] Seq=107126 Ack=1043 Win=2363 Len=1368 TSval=7885336 TSecr=760745949 [TCP segment of a reassembled PDU]"
"174","2018-08-23 02:09:31.239011","192.168.2.3","216.58.197.4","TCP","1434","34236  >  443 [ACK] Seq=108494 Ack=1043 Win=2363 Len=1368 TSval=7885336 TSecr=760745949 [TCP segment of a reassembled PDU]"
"175","2018-08-23 02:09:31.239015","192.168.2.3","216.58.197.4","TLSv1.2","212","Application Data"
"176","2018-08-23 02:09:31.242216","192.168.2.3","216.58.197.4","TCP","1434","34236  >  443 [ACK] Seq=110008 Ack=1043 Win=2363 Len=1368 TSval=7885336 TSecr=760745949 [TCP segment of a reassembled PDU]"
"177","2018-08-23 02:09:31.242219","192.168.2.3","216.58.197.4","TLSv1.2","155","Application Data"
"183","2018-08-23 02:09:31.310231","192.168.2.3","216.58.197.4","TCP","66","34236  >  443 [ACK] Seq=111465 Ack=1258 Win=2363 Len=0 TSval=7885343 TSecr=760746106"
"184","2018-08-23 02:09:31.310429","192.168.2.3","216.58.197.4","TCP","66","34236  >  443 [ACK] Seq=111465 Ack=1318 Win=2363 Len=0 TSval=7885343 TSecr=760746106"
"185","2018-08-23 02:09:31.326108","192.168.2.3","216.58.197.4","TCP","1434","34236  >  443 [ACK] Seq=111465 Ack=1318 Win=2363 Len=1368 TSval=7885344 TSecr=760746106 [TCP segment of a reassembled PDU]"
"186","2018-08-23 02:09:31.326113","192.168.2.3","216.58.197.4","TCP","1434","34236  >  443 [ACK] Seq=112833 Ack=1318 Win=2363 Len=1368 TSval=7885344 TSecr=760746106 [TCP segment of a reassembled PDU]"
"187","2018-08-23 02:09:31.326281","192.168.2.3","216.58.197.4","TLSv1.2","212","Application Data"
"188","2018-08-23 02:09:31.326284","192.168.2.3","216.58.197.4","TCP","1434","34236  >  443 [ACK] Seq=114347 Ack=1318 Win=2363 Len=1368 TSval=7885344 TSecr=760746106 [TCP segment of a reassembled PDU]"
"189","2018-08-23 02:09:31.326395","192.168.2.3","216.58.197.4","TLSv1.2","155","Application Data"
"194","2018-08-23 02:09:31.395004","192.168.2.3","216.58.197.4","TCP","66","34236  >  443 [ACK] Seq=115804 Ack=1704 Win=2363 Len=0 TSval=7885351 TSecr=760746188"
"196","2018-08-23 02:09:31.420115","192.168.2.3","216.58.197.4","TCP","1434","34236  >  443 [ACK] Seq=115804 Ack=1912 Win=2363 Len=1368 TSval=7885354 TSecr=760746212 [TCP segment of a reassembled PDU]"
"197","2018-08-23 02:09:31.420516","192.168.2.3","216.58.197.4","TCP","1434","34236  >  443 [ACK] Seq=117172 Ack=1912 Win=2363 Len=1368 TSval=7885354 TSecr=760746212 [TCP segment of a reassembled PDU]"
"198","2018-08-23 02:09:31.420518","192.168.2.3","216.58.197.4","TLSv1.2","212","Application Data"
"199","2018-08-23 02:09:31.420968","192.168.2.3","216.58.197.4","TCP","1434","34236  >  443 [ACK] Seq=118686 Ack=1912 Win=2363 Len=1368 TSval=7885354 TSecr=760746212 [TCP segment of a reassembled PDU]"
"200","2018-08-23 02:09:31.420971","192.168.2.3","216.58.197.4","TLSv1.2","155","Application Data"
"204","2018-08-23 02:09:31.456115","192.168.2.3","216.58.197.4","TCP","66","34236  >  443 [ACK] Seq=120143 Ack=1964 Win=2363 Len=0 TSval=7885358 TSecr=760746222"
"205","2018-08-23 02:09:31.530811","192.168.2.3","216.58.197.4","TCP","1434","34236  >  443 [ACK] Seq=120143 Ack=1964 Win=2363 Len=1368 TSval=7885365 TSecr=760746222 [TCP segment of a reassembled PDU]"
"206","2018-08-23 02:09:31.530817","192.168.2.3","216.58.197.4","TCP","1434","34236  >  443 [ACK] Seq=121511 Ack=1964 Win=2363 Len=1368 TSval=7885365 TSecr=760746222 [TCP segment of a reassembled PDU]"
"207","2018-08-23 02:09:31.530818","192.168.2.3","216.58.197.4","TLSv1.2","212","Application Data"
"208","2018-08-23 02:09:31.531160","192.168.2.3","216.58.197.4","TCP","1434","34236  >  443 [ACK] Seq=123025 Ack=1964 Win=2363 Len=1368 TSval=7885365 TSecr=760746222 [TCP segment of a reassembled PDU]"
"209","2018-08-23 02:09:31.531164","192.168.2.3","216.58.197.4","TLSv1.2","155","Application Data"
"215","2018-08-23 02:09:31.590932","192.168.2.3","216.58.197.4","TCP","66","34236  >  443 [ACK] Seq=124482 Ack=2221 Win=2363 Len=0 TSval=7885371 TSecr=760746379"
"216","2018-08-23 02:09:31.591167","192.168.2.3","216.58.197.4","TCP","66","34236  >  443 [ACK] Seq=124482 Ack=2437 Win=2363 Len=0 TSval=7885371 TSecr=760746379"
"217","2018-08-23 02:09:31.642124","192.168.2.3","216.58.197.4","TCP","1434","34236  >  443 [ACK] Seq=124482 Ack=2437 Win=2363 Len=1368 TSval=7885373 TSecr=760746379 [TCP segment of a reassembled PDU]"
"218","2018-08-23 02:09:31.642130","192.168.2.3","216.58.197.4","TCP","1434","34236  >  443 [ACK] Seq=125850 Ack=2437 Win=2363 Len=1368 TSval=7885373 TSecr=760746379 [TCP segment of a reassembled PDU]"
"219","2018-08-23 02:09:31.642131","192.168.2.3","216.58.197.4","TLSv1.2","212","Application Data"
"220","2018-08-23 02:09:31.642443","192.168.2.3","216.58.197.4","TCP","1434","34236  >  443 [ACK] Seq=127364 Ack=2437 Win=2363 Len=1368 TSval=7885373 TSecr=760746379 [TCP segment of a reassembled PDU]"
"221","2018-08-23 02:09:31.642446","192.168.2.3","216.58.197.4","TLSv1.2","155","Application Data"
"227","2018-08-23 02:09:31.694249","192.168.2.3","216.58.197.4","TCP","66","34236  >  443 [ACK] Seq=128821 Ack=2777 Win=2363 Len=0 TSval=7885381 TSecr=760746490"
"228","2018-08-23 02:09:31.743698","192.168.2.3","216.58.197.4","TCP","1434","34236  >  443 [ACK] Seq=128821 Ack=2777 Win=2363 Len=1368 TSval=7885383 TSecr=760746490 [TCP segment of a reassembled PDU]"
"229","2018-08-23 02:09:31.743704","192.168.2.3","216.58.197.4","TCP","1434","34236  >  443 [ACK] Seq=130189 Ack=2777 Win=2363 Len=1368 TSval=7885383 TSecr=760746490 [TCP segment of a reassembled PDU]"
"230","2018-08-23 02:09:31.743786","192.168.2.3","216.58.197.4","TLSv1.2","212","Application Data"
"231","2018-08-23 02:09:31.744055","192.168.2.3","216.58.197.4","TCP","1434","34236  >  443 [ACK] Seq=131703 Ack=2777 Win=2363 Len=1368 TSval=7885383 TSecr=760746490 [TCP segment of a reassembled PDU]"
"232","2018-08-23 02:09:31.744059","192.168.2.3","216.58.197.4","TLSv1.2","155","Application Data"
"237","2018-08-23 02:09:31.801872","192.168.2.3","216.58.197.4","TCP","66","34236  >  443 [ACK] Seq=133160 Ack=3199 Win=2363 Len=0 TSval=7885392 TSecr=760746597"
"238","2018-08-23 02:09:31.804963","192.168.2.3","216.58.197.4","TCP","1434","34236  >  443 [ACK] Seq=133160 Ack=3199 Win=2363 Len=1368 TSval=7885392 TSecr=760746597 [TCP segment of a reassembled PDU]"
"239","2018-08-23 02:09:31.804969","192.168.2.3","216.58.197.4","TCP","1434","34236  >  443 [ACK] Seq=134528 Ack=3199 Win=2363 Len=1368 TSval=7885392 TSecr=760746597 [TCP segment of a reassembled PDU]"
"240","2018-08-23 02:09:31.804970","192.168.2.3","216.58.197.4","TLSv1.2","212","Application Data"
"241","2018-08-23 02:09:31.805305","192.168.2.3","216.58.197.4","TCP","1434","34236  >  443 [ACK] Seq=136042 Ack=3199 Win=2363 Len=1368 TSval=7885392 TSecr=760746597 [TCP segment of a reassembled PDU]"
"242","2018-08-23 02:09:31.805308","192.168.2.3","216.58.197.4","TLSv1.2","155","Application Data"
"248","2018-08-23 02:09:31.867276","192.168.2.3","216.58.197.4","TCP","66","34236  >  443 [ACK] Seq=137499 Ack=3519 Win=2363 Len=0 TSval=7885399 TSecr=760746663"
"249","2018-08-23 02:09:31.898442","192.168.2.3","216.58.197.4","TCP","1434","34236  >  443 [ACK] Seq=137499 Ack=3519 Win=2363 Len=1368 TSval=7885402 TSecr=760746663 [TCP segment of a reassembled PDU]"
"250","2018-08-23 02:09:31.899857","192.168.2.3","216.58.197.4","TCP","1434","34236  >  443 [ACK] Seq=138867 Ack=3519 Win=2363 Len=1368 TSval=7885402 TSecr=760746663 [TCP segment of a reassembled PDU]"
"251","2018-08-23 02:09:31.899861","192.168.2.3","216.58.197.4","TLSv1.2","212","Application Data"
"252","2018-08-23 02:09:31.899862","192.168.2.3","216.58.197.4","TCP","1434","34236  >  443 [ACK] Seq=140381 Ack=3519 Win=2363 Len=1368 TSval=7885402 TSecr=760746663 [TCP segment of a reassembled PDU]"
"253","2018-08-23 02:09:31.899863","192.168.2.3","216.58.197.4","TLSv1.2","155","Application Data"
"257","2018-08-23 02:09:31.999582","192.168.2.3","216.58.197.4","TCP","1434","34236  >  443 [ACK] Seq=141838 Ack=3519 Win=2363 Len=1368 TSval=7885411 TSecr=760746701 [TCP segment of a reassembled PDU]"
"258","2018-08-23 02:09:31.999588","192.168.2.3","216.58.197.4","TCP","1434","34236  >  443 [ACK] Seq=143206 Ack=3519 Win=2363 Len=1368 TSval=7885411 TSecr=760746701 [TCP segment of a reassembled PDU]"
"259","2018-08-23 02:09:31.999589","192.168.2.3","216.58.197.4","TLSv1.2","212","Application Data"
"260","2018-08-23 02:09:31.999940","192.168.2.3","216.58.197.4","TCP","1434","34236  >  443 [ACK] Seq=144720 Ack=3519 Win=2363 Len=1368 TSval=7885411 TSecr=760746701 [TCP segment of a reassembled PDU]"
"261","2018-08-23 02:09:31.999957","192.168.2.3","216.58.197.4","TLSv1.2","155","Application Data"
"267","2018-08-23 02:09:32.053977","192.168.2.3","216.58.197.4","TCP","66","34236  >  443 [ACK] Seq=146177 Ack=3917 Win=2363 Len=0 TSval=7885417 TSecr=760746849"
"268","2018-08-23 02:09:32.091812","192.168.2.3","216.58.197.4","TCP","1434","34236  >  443 [ACK] Seq=146177 Ack=3917 Win=2363 Len=1368 TSval=7885421 TSecr=760746849 [TCP segment of a reassembled PDU]"
"269","2018-08-23 02:09:32.092353","192.168.2.3","216.58.197.4","TCP","1434","34236  >  443 [ACK] Seq=147545 Ack=3917 Win=2363 Len=1368 TSval=7885421 TSecr=760746849 [TCP segment of a reassembled PDU]"
"270","2018-08-23 02:09:32.092356","192.168.2.3","216.58.197.4","TLSv1.2","212","Application Data"
"271","2018-08-23 02:09:32.092357","192.168.2.3","216.58.197.4","TCP","1434","34236  >  443 [ACK] Seq=149059 Ack=3917 Win=2363 Len=1368 TSval=7885421 TSecr=760746849 [TCP segment of a reassembled PDU]"
"272","2018-08-23 02:09:32.092358","192.168.2.3","216.58.197.4","TLSv1.2","155","Application Data"
"276","2018-08-23 02:09:32.187280","192.168.2.3","216.58.197.4","TCP","1434","34236  >  443 [ACK] Seq=150516 Ack=3917 Win=2363 Len=1368 TSval=7885431 TSecr=760746893 [TCP segment of a reassembled PDU]"
"277","2018-08-23 02:09:32.187718","192.168.2.3","216.58.197.4","TCP","1434","34236  >  443 [ACK] Seq=151884 Ack=3917 Win=2363 Len=1368 TSval=7885431 TSecr=760746893 [TCP segment of a reassembled PDU]"
"278","2018-08-23 02:09:32.187723","192.168.2.3","216.58.197.4","TLSv1.2","212","Application Data"
"279","2018-08-23 02:09:32.187750","192.168.2.3","216.58.197.4","TCP","1434","34236  >  443 [ACK] Seq=153398 Ack=3917 Win=2363 Len=1368 TSval=7885431 TSecr=760746893 [TCP segment of a reassembled PDU]"
"280","2018-08-23 02:09:32.187959","192.168.2.3","216.58.197.4","TLSv1.2","155","Application Data"
"286","2018-08-23 02:09:32.243627","192.168.2.3","216.58.197.4","TCP","66","34236  >  443 [ACK] Seq=154855 Ack=4275 Win=2363 Len=0 TSval=7885436 TSecr=760747039"
"287","2018-08-23 02:09:32.262114","192.168.2.3","216.58.197.4","TCP","1434","34236  >  443 [ACK] Seq=154855 Ack=4275 Win=2363 Len=1368 TSval=7885438 TSecr=760747039 [TCP segment of a reassembled PDU]"
"288","2018-08-23 02:09:32.262518","192.168.2.3","216.58.197.4","TCP","1434","34236  >  443 [ACK] Seq=156223 Ack=4275 Win=2363 Len=1368 TSval=7885438 TSecr=760747039 [TCP segment of a reassembled PDU]"
"289","2018-08-23 02:09:32.262520","192.168.2.3","216.58.197.4","TLSv1.2","212","Application Data"
"290","2018-08-23 02:09:32.262868","192.168.2.3","216.58.197.4","TCP","1434","34236  >  443 [ACK] Seq=157737 Ack=4275 Win=2363 Len=1368 TSval=7885438 TSecr=760747039 [TCP segment of a reassembled PDU]"
"291","2018-08-23 02:09:32.262870","192.168.2.3","216.58.197.4","TLSv1.2","155","Application Data"
"295","2018-08-23 02:09:32.360500","192.168.2.3","216.58.197.4","TCP","1434","34236  >  443 [ACK] Seq=159194 Ack=4275 Win=2363 Len=1368 TSval=7885448 TSecr=760747064 [TCP segment of a reassembled PDU]"
"296","2018-08-23 02:09:32.360873","192.168.2.3","216.58.197.4","TCP","1434","34236  >  443 [ACK] Seq=160562 Ack=4275 Win=2363 Len=1368 TSval=7885448 TSecr=760747064 [TCP segment of a reassembled PDU]"
"297","2018-08-23 02:09:32.360875","192.168.2.3","216.58.197.4","TLSv1.2","212","Application Data"
"298","2018-08-23 02:09:32.361047","192.168.2.3","216.58.197.4","TCP","1434","34236  >  443 [ACK] Seq=162076 Ack=4275 Win=2363 Len=1368 TSval=7885448 TSecr=760747064 [TCP segment of a reassembled PDU]"
"299","2018-08-23 02:09:32.361065","192.168.2.3","216.58.197.4","TLSv1.2","155","Application Data"
"305","2018-08-23 02:09:32.415096","192.168.2.3","216.58.197.4","TCP","66","34236  >  443 [ACK] Seq=163533 Ack=4733 Win=2363 Len=0 TSval=7885453 TSecr=760747209"
"308","2018-08-23 02:09:32.425832","192.168.2.3","216.58.197.4","TCP","66","34236  >  443 [ACK] Seq=163533 Ack=5191 Win=2363 Len=0 TSval=7885454 TSecr=760747212"
"309","2018-08-23 02:09:32.473323","192.168.2.3","216.58.197.4","TCP","1434","34236  >  443 [ACK] Seq=163533 Ack=5191 Win=2363 Len=1368 TSval=7885459 TSecr=760747212 [TCP segment of a reassembled PDU]"
"310","2018-08-23 02:09:32.473620","192.168.2.3","216.58.197.4","TCP","1434","34236  >  443 [ACK] Seq=164901 Ack=5191 Win=2363 Len=1368 TSval=7885459 TSecr=760747212 [TCP segment of a reassembled PDU]"
"311","2018-08-23 02:09:32.473623","192.168.2.3","216.58.197.4","TLSv1.2","212","Application Data"
"314","2018-08-23 02:09:32.478781","192.168.2.3","216.58.197.4","TCP","1434","34236  >  443 [ACK] Seq=166415 Ack=5191 Win=2363 Len=1368 TSval=7885459 TSecr=760747212 [TCP segment of a reassembled PDU]"
"315","2018-08-23 02:09:32.478786","192.168.2.3","216.58.197.4","TLSv1.2","155","Application Data"
"319","2018-08-23 02:09:32.540515","192.168.2.3","216.58.197.4","TCP","66","34236  >  443 [ACK] Seq=167872 Ack=5398 Win=2363 Len=0 TSval=7885466 TSecr=760747336"
"320","2018-08-23 02:09:32.550260","192.168.2.3","216.58.197.4","TCP","1434","34236  >  443 [ACK] Seq=167872 Ack=5398 Win=2363 Len=1368 TSval=7885467 TSecr=760747336 [TCP segment of a reassembled PDU]"
"321","2018-08-23 02:09:32.550682","192.168.2.3","216.58.197.4","TCP","1434","34236  >  443 [ACK] Seq=169240 Ack=5398 Win=2363 Len=1368 TSval=7885467 TSecr=760747336 [TCP segment of a reassembled PDU]"
"322","2018-08-23 02:09:32.550687","192.168.2.3","216.58.197.4","TLSv1.2","212","Application Data"
"323","2018-08-23 02:09:32.551017","192.168.2.3","216.58.197.4","TCP","1434","34236  >  443 [ACK] Seq=170754 Ack=5398 Win=2363 Len=1368 TSval=7885467 TSecr=760747336 [TCP segment of a reassembled PDU]"
"324","2018-08-23 02:09:32.551019","192.168.2.3","216.58.197.4","TLSv1.2","155","Application Data"
"328","2018-08-23 02:09:32.667598","192.168.2.3","216.58.197.4","TCP","1434","34236  >  443 [ACK] Seq=172211 Ack=5398 Win=2363 Len=1368 TSval=7885479 TSecr=760747352 [TCP segment of a reassembled PDU]"
"329","2018-08-23 02:09:32.667912","192.168.2.3","216.58.197.4","TCP","1434","34236  >  443 [ACK] Seq=173579 Ack=5398 Win=2363 Len=1368 TSval=7885479 TSecr=760747352 [TCP segment of a reassembled PDU]"
"330","2018-08-23 02:09:32.667916","192.168.2.3","216.58.197.4","TLSv1.2","212","Application Data"
"331","2018-08-23 02:09:32.668279","192.168.2.3","216.58.197.4","TCP","1434","34236  >  443 [ACK] Seq=175093 Ack=5398 Win=2363 Len=1368 TSval=7885479 TSecr=760747352 [TCP segment of a reassembled PDU]"
"332","2018-08-23 02:09:32.668283","192.168.2.3","216.58.197.4","TLSv1.2","155","Application Data"
"336","2018-08-23 02:09:32.763688","192.168.2.3","216.58.197.4","TCP","1434","34236  >  443 [ACK] Seq=176550 Ack=5398 Win=2363 Len=1368 TSval=7885488 TSecr=760747469 [TCP segment of a reassembled PDU]"
"337","2018-08-23 02:09:32.764048","192.168.2.3","216.58.197.4","TCP","1434","34236  >  443 [ACK] Seq=177918 Ack=5398 Win=2363 Len=1368 TSval=7885488 TSecr=760747469 [TCP segment of a reassembled PDU]"
"338","2018-08-23 02:09:32.764050","192.168.2.3","216.58.197.4","TLSv1.2","212","Application Data"
"339","2018-08-23 02:09:32.764315","192.168.2.3","216.58.197.4","TCP","1434","34236  >  443 [ACK] Seq=179432 Ack=5398 Win=2363 Len=1368 TSval=7885488 TSecr=760747469 [TCP segment of a reassembled PDU]"
"340","2018-08-23 02:09:32.764317","192.168.2.3","216.58.197.4","TLSv1.2","155","Application Data"
"344","2018-08-23 02:09:32.857517","192.168.2.3","216.58.197.4","TCP","1434","34236  >  443 [ACK] Seq=180889 Ack=5398 Win=2363 Len=1368 TSval=7885498 TSecr=760747565 [TCP segment of a reassembled PDU]"
"345","2018-08-23 02:09:32.857773","192.168.2.3","216.58.197.4","TCP","1434","34236  >  443 [ACK] Seq=182257 Ack=5398 Win=2363 Len=1368 TSval=7885498 TSecr=760747565 [TCP segment of a reassembled PDU]"
"346","2018-08-23 02:09:32.857776","192.168.2.3","216.58.197.4","TLSv1.2","212","Application Data"
"347","2018-08-23 02:09:32.857952","192.168.2.3","216.58.197.4","TCP","1434","34236  >  443 [ACK] Seq=183771 Ack=5398 Win=2363 Len=1368 TSval=7885498 TSecr=760747565 [TCP segment of a reassembled PDU]"
"348","2018-08-23 02:09:32.857955","192.168.2.3","216.58.197.4","TLSv1.2","155","Application Data"
"355","2018-08-23 02:09:32.862938","192.168.2.3","216.58.197.4","TCP","66","34236  >  443 [ACK] Seq=185228 Ack=5844 Win=2363 Len=0 TSval=7885498 TSecr=760747658"
"356","2018-08-23 02:09:32.896098","192.168.2.3","216.58.197.4","TCP","66","34236  >  443 [ACK] Seq=185228 Ack=5953 Win=2363 Len=0 TSval=7885502 TSecr=760747659"
"357","2018-08-23 02:09:32.953292","192.168.2.3","216.58.197.4","TCP","1434","34236  >  443 [ACK] Seq=185228 Ack=5953 Win=2363 Len=1368 TSval=7885507 TSecr=760747659 [TCP segment of a reassembled PDU]"
"358","2018-08-23 02:09:32.953616","192.168.2.3","216.58.197.4","TCP","1434","34236  >  443 [ACK] Seq=186596 Ack=5953 Win=2363 Len=1368 TSval=7885507 TSecr=760747659 [TCP segment of a reassembled PDU]"
"359","2018-08-23 02:09:32.953620","192.168.2.3","216.58.197.4","TLSv1.2","212","Application Data"
"360","2018-08-23 02:09:32.953853","192.168.2.3","216.58.197.4","TCP","1434","34236  >  443 [ACK] Seq=188110 Ack=5953 Win=2363 Len=1368 TSval=7885507 TSecr=760747659 [TCP segment of a reassembled PDU]"
"361","2018-08-23 02:09:32.953856","192.168.2.3","216.58.197.4","TLSv1.2","155","Application Data"
"365","2018-08-23 02:09:33.051931","192.168.2.3","216.58.197.4","TCP","1434","34236  >  443 [ACK] Seq=189567 Ack=5953 Win=2363 Len=1368 TSval=7885517 TSecr=760747755 [TCP segment of a reassembled PDU]"
"366","2018-08-23 02:09:33.051937","192.168.2.3","216.58.197.4","TCP","1434","34236  >  443 [ACK] Seq=190935 Ack=5953 Win=2363 Len=1368 TSval=7885517 TSecr=760747755 [TCP segment of a reassembled PDU]"
"367","2018-08-23 02:09:33.051937","192.168.2.3","216.58.197.4","TLSv1.2","212","Application Data"
"368","2018-08-23 02:09:33.052267","192.168.2.3","216.58.197.4","TCP","1434","34236  >  443 [ACK] Seq=192449 Ack=5953 Win=2363 Len=1368 TSval=7885517 TSecr=760747755 [TCP segment of a reassembled PDU]"
"369","2018-08-23 02:09:33.052268","192.168.2.3","216.58.197.4","TLSv1.2","155","Application Data"
"373","2018-08-23 02:09:33.148465","192.168.2.3","216.58.197.4","TCP","1434","34236  >  443 [ACK] Seq=193906 Ack=5953 Win=2363 Len=1368 TSval=7885527 TSecr=760747853 [TCP segment of a reassembled PDU]"
"374","2018-08-23 02:09:33.148788","192.168.2.3","216.58.197.4","TCP","1434","34236  >  443 [ACK] Seq=195274 Ack=5953 Win=2363 Len=1368 TSval=7885527 TSecr=760747853 [TCP segment of a reassembled PDU]"
"375","2018-08-23 02:09:33.148790","192.168.2.3","216.58.197.4","TLSv1.2","212","Application Data"
"376","2018-08-23 02:09:33.149163","192.168.2.3","216.58.197.4","TCP","1434","34236  >  443 [ACK] Seq=196788 Ack=5953 Win=2363 Len=1368 TSval=7885527 TSecr=760747853 [TCP segment of a reassembled PDU]"
"377","2018-08-23 02:09:33.149164","192.168.2.3","216.58.197.4","TLSv1.2","155","Application Data"
"383","2018-08-23 02:09:33.200580","192.168.2.3","216.58.197.4","TCP","66","34236  >  443 [ACK] Seq=198245 Ack=6020 Win=2363 Len=0 TSval=7885532 TSecr=760747996"
"384","2018-08-23 02:09:33.200584","192.168.2.3","216.58.197.4","TCP","66","34236  >  443 [ACK] Seq=198245 Ack=6135 Win=2363 Len=0 TSval=7885532 TSecr=760747996"
"385","2018-08-23 02:09:33.244285","192.168.2.3","216.58.197.4","TCP","1434","34236  >  443 [ACK] Seq=198245 Ack=6135 Win=2363 Len=1368 TSval=7885536 TSecr=760747996 [TCP segment of a reassembled PDU]"
"386","2018-08-23 02:09:33.244625","192.168.2.3","216.58.197.4","TCP","1434","34236  >  443 [ACK] Seq=199613 Ack=6135 Win=2363 Len=1368 TSval=7885536 TSecr=760747996 [TCP segment of a reassembled PDU]"
"387","2018-08-23 02:09:33.244628","192.168.2.3","216.58.197.4","TLSv1.2","212","Application Data"
"388","2018-08-23 02:09:33.244642","192.168.2.3","216.58.197.4","TCP","1434","34236  >  443 [ACK] Seq=201127 Ack=6135 Win=2363 Len=1368 TSval=7885536 TSecr=760747996 [TCP segment of a reassembled PDU]"
"389","2018-08-23 02:09:33.244828","192.168.2.3","216.58.197.4","TLSv1.2","155","Application Data"
"395","2018-08-23 02:09:33.298016","192.168.2.3","216.58.197.4","TCP","66","34236  >  443 [ACK] Seq=202584 Ack=6302 Win=2363 Len=0 TSval=7885542 TSecr=760748092"
"396","2018-08-23 02:09:33.298351","192.168.2.3","216.58.197.4","TCP","66","34236  >  443 [ACK] Seq=202584 Ack=6591 Win=2363 Len=0 TSval=7885542 TSecr=760748093"
"397","2018-08-23 02:09:33.322675","192.168.2.3","216.58.197.4","TCP","1434","34236  >  443 [ACK] Seq=202584 Ack=6591 Win=2363 Len=1368 TSval=7885544 TSecr=760748093 [TCP segment of a reassembled PDU]"
"398","2018-08-23 02:09:33.323140","192.168.2.3","216.58.197.4","TCP","1434","34236  >  443 [ACK] Seq=203952 Ack=6591 Win=2363 Len=1368 TSval=7885544 TSecr=760748093 [TCP segment of a reassembled PDU]"
"399","2018-08-23 02:09:33.323143","192.168.2.3","216.58.197.4","TLSv1.2","212","Application Data"
"400","2018-08-23 02:09:33.323143","192.168.2.3","216.58.197.4","TLSv1.2","398","Application Data"
"401","2018-08-23 02:09:33.323144","192.168.2.3","216.58.197.4","TLSv1.2","102","Application Data"
"410","2018-08-23 02:09:33.433492","192.168.2.3","216.58.197.4","TCP","66","34236  >  443 [ACK] Seq=205834 Ack=6733 Win=2363 Len=0 TSval=7885554 TSecr=760748212"
"411","2018-08-23 02:09:33.434002","192.168.2.3","216.58.197.4","TCP","66","34236  >  443 [ACK] Seq=205834 Ack=7744 Win=2363 Len=0 TSval=7885555 TSecr=760748223"
"413","2018-08-23 02:09:33.676129","192.168.2.3","216.58.197.4","TCP","66","34236  >  443 [ACK] Seq=205834 Ack=8012 Win=2363 Len=0 TSval=7885580 TSecr=760748441"
"415","2018-08-23 02:09:33.682143","192.168.2.3","216.58.197.4","TCP","66","34236  >  443 [ACK] Seq=205834 Ack=9266 Win=2363 Len=0 TSval=7885580 TSecr=760748475"
"428","2018-08-23 02:09:33.891328","192.168.2.3","216.58.197.4","TCP","66","34236  >  443 [ACK] Seq=205834 Ack=10991 Win=2363 Len=0 TSval=7885601 TSecr=760748685"
"429","2018-08-23 02:09:33.891331","192.168.2.3","216.58.197.4","TCP","66","34236  >  443 [ACK] Seq=205834 Ack=12738 Win=2363 Len=0 TSval=7885601 TSecr=760748686"
"430","2018-08-23 02:09:33.893452","192.168.2.3","216.58.197.4","TCP","66","34236  >  443 [ACK] Seq=205834 Ack=14435 Win=2363 Len=0 TSval=7885601 TSecr=760748686"
"431","2018-08-23 02:09:33.893762","192.168.2.3","216.58.197.4","TCP","66","34236  >  443 [ACK] Seq=205834 Ack=19914 Win=2363 Len=0 TSval=7885601 TSecr=760748686"
"442","2018-08-23 02:09:33.928261","192.168.2.3","216.58.197.4","TCP","66","34236  >  443 [ACK] Seq=205834 Ack=21682 Win=2363 Len=0 TSval=7885605 TSecr=760748723"
"445","2018-08-23 02:09:33.929028","192.168.2.3","216.58.197.4","TCP","66","34236  >  443 [ACK] Seq=205834 Ack=25059 Win=2363 Len=0 TSval=7885605 TSecr=760748723"
"446","2018-08-23 02:09:33.929678","192.168.2.3","216.58.197.4","TCP","66","34236  >  443 [ACK] Seq=205834 Ack=26823 Win=2363 Len=0 TSval=7885605 TSecr=760748723"
"447","2018-08-23 02:09:33.929681","192.168.2.3","216.58.197.4","TCP","66","34236  >  443 [ACK] Seq=205834 Ack=29659 Win=2363 Len=0 TSval=7885605 TSecr=760748723"
"448","2018-08-23 02:09:33.929887","192.168.2.3","216.58.197.4","TCP","66","34236  >  443 [ACK] Seq=205834 Ack=30327 Win=2363 Len=0 TSval=7885605 TSecr=760748723"
"449","2018-08-23 02:09:33.930302","192.168.2.3","216.58.197.4","TCP","66","34236  >  443 [ACK] Seq=205834 Ack=32127 Win=2363 Len=0 TSval=7885605 TSecr=760748725"
"454","2018-08-23 02:09:33.932339","192.168.2.3","216.58.197.4","TCP","66","34236  >  443 [ACK] Seq=205834 Ack=33994 Win=2363 Len=0 TSval=7885605 TSecr=760748727"
"457","2018-08-23 02:09:33.932573","192.168.2.3","216.58.197.4","TCP","66","34236  >  443 [ACK] Seq=205834 Ack=35774 Win=2363 Len=0 TSval=7885605 TSecr=760748727"
"458","2018-08-23 02:09:33.933816","192.168.2.3","216.58.197.4","TCP","66","34236  >  443 [ACK] Seq=205834 Ack=37490 Win=2363 Len=0 TSval=7885605 TSecr=760748729"
"463","2018-08-23 02:09:33.935487","192.168.2.3","216.58.197.4","TCP","66","34236  >  443 [ACK] Seq=205834 Ack=39355 Win=2363 Len=0 TSval=7885605 TSecr=760748731"
"466","2018-08-23 02:09:33.935969","192.168.2.3","216.58.197.4","TCP","66","34236  >  443 [ACK] Seq=205834 Ack=41181 Win=2363 Len=0 TSval=7885606 TSecr=760748731"
"477","2018-08-23 02:09:33.945629","192.168.2.3","216.58.197.4","TCP","66","34236  >  443 [ACK] Seq=205834 Ack=43038 Win=2363 Len=0 TSval=7885606 TSecr=760748732"
"478","2018-08-23 02:09:33.947111","192.168.2.3","216.58.197.4","TCP","66","34236  >  443 [ACK] Seq=205834 Ack=44719 Win=2363 Len=0 TSval=7885607 TSecr=760748734"
"479","2018-08-23 02:09:33.947227","192.168.2.3","216.58.197.4","TCP","66","34236  >  443 [ACK] Seq=205834 Ack=46538 Win=2363 Len=0 TSval=7885607 TSecr=760748734"
"480","2018-08-23 02:09:33.949761","192.168.2.3","216.58.197.4","TCP","66","34236  >  443 [ACK] Seq=205834 Ack=51791 Win=2363 Len=0 TSval=7885607 TSecr=760748736"
"489","2018-08-23 02:09:33.964980","192.168.2.3","216.58.197.4","TCP","66","34236  >  443 [ACK] Seq=205834 Ack=53653 Win=2363 Len=0 TSval=7885608 TSecr=760748760"
"490","2018-08-23 02:09:33.965579","192.168.2.3","216.58.197.4","TCP","66","34236  >  443 [ACK] Seq=205834 Ack=54869 Win=2363 Len=0 TSval=7885608 TSecr=760748760"
"491","2018-08-23 02:09:33.965582","192.168.2.3","216.58.197.4","TCP","66","34236  >  443 [ACK] Seq=205834 Ack=55176 Win=2363 Len=0 TSval=7885608 TSecr=760748761"
"492","2018-08-23 02:09:33.966706","192.168.2.3","216.58.197.4","TCP","66","34236  >  443 [ACK] Seq=205834 Ack=55244 Win=2363 Len=0 TSval=7885609 TSecr=760748761"
"493","2018-08-23 02:09:33.985277","192.168.2.3","216.58.197.4","TLSv1.2","104","Application Data"
"495","2018-08-23 02:09:36.279590","192.168.2.3","74.125.204.188","TCP","66","33038  >  5228 [ACK] Seq=1 Ack=1 Win=406 Len=0 TSval=7885840 TSecr=3814454609"