"No.","Time","Source","Destination","Protocol","Length","Info"
"7","2018-08-23 01:48:46.503309","192.168.2.3","216.58.197.14","TCP","66","41142  >  443 [ACK] Seq=1 Ack=1 Win=312 Len=0 TSval=7760864 TSecr=932464916"
"11","2018-08-23 01:48:47.144655","192.168.2.3","216.58.197.4","TLSv1.2","156","[TCP Previous segment not captured] , Application Data"
"12","2018-08-23 01:48:47.144660","192.168.2.3","216.58.197.4","TLSv1.2","104","Application Data"
"16","2018-08-23 01:48:47.150289","192.168.2.3","216.58.197.4","TLSv1.2","158","Application Data"
"17","2018-08-23 01:48:47.158155","192.168.2.3","216.58.197.4","TCP","1434","34236  >  443 [ACK] Seq=222 Ack=39 Win=504 Len=1368 TSval=7760929 TSecr=759501945 [TCP segment of a reassembled PDU]"
"18","2018-08-23 01:48:47.158445","192.168.2.3","216.58.197.4","TCP","1434","34236  >  443 [ACK] Seq=1590 Ack=39 Win=504 Len=1368 TSval=7760929 TSecr=759501945 [TCP segment of a reassembled PDU]"
"19","2018-08-23 01:48:47.158447","192.168.2.3","216.58.197.4","TLSv1.2","212","Application Data"
"20","2018-08-23 01:48:47.158783","192.168.2.3","216.58.197.4","TLSv1.2","1243","Application Data"
"21","2018-08-23 01:48:47.158995","192.168.2.3","216.58.197.4","TCP","1434","34236  >  443 [ACK] Seq=4281 Ack=39 Win=504 Len=1368 TSval=7760929 TSecr=759501945 [TCP segment of a reassembled PDU]"
"22","2018-08-23 01:48:47.158998","192.168.2.3","216.58.197.4","TCP","1434","34236  >  443 [ACK] Seq=5649 Ack=39 Win=504 Len=1368 TSval=7760929 TSecr=759501945 [TCP segment of a reassembled PDU]"
"23","2018-08-23 01:48:47.159114","192.168.2.3","216.58.197.4","TLSv1.2","212","Application Data"
"24","2018-08-23 01:48:47.159580","192.168.2.3","216.58.197.4","TCP","1434","34236  >  443 [ACK] Seq=7163 Ack=39 Win=504 Len=1368 TSval=7760929 TSecr=759501945 [TCP segment of a reassembled PDU]"
"25","2018-08-23 01:48:47.159833","192.168.2.3","216.58.197.4","TCP","1434","34236  >  443 [ACK] Seq=8531 Ack=39 Win=504 Len=1368 TSval=7760929 TSecr=759501945 [TCP segment of a reassembled PDU]"
"31","2018-08-23 01:48:47.164072","192.168.2.3","216.58.197.4","TLSv1.2","1434","Application Data [TCP segment of a reassembled PDU]"
"32","2018-08-23 01:48:47.164074","192.168.2.3","216.58.197.4","TCP","1434","34236  >  443 [ACK] Seq=11267 Ack=39 Win=504 Len=1368 TSval=7760930 TSecr=759501958 [TCP segment of a reassembled PDU]"
"33","2018-08-23 01:48:47.164469","192.168.2.3","216.58.197.4","TLSv1.2","1434","Application Data [TCP segment of a reassembled PDU]"
"34","2018-08-23 01:48:47.164841","192.168.2.3","216.58.197.4","TCP","1434","34236  >  443 [ACK] Seq=14003 Ack=39 Win=504 Len=1368 TSval=7760930 TSecr=759501958 [TCP segment of a reassembled PDU]"
"35","2018-08-23 01:48:47.164857","192.168.2.3","216.58.197.4","TLSv1.2","1434","Application Data [TCP segment of a reassembled PDU]"
"36","2018-08-23 01:48:47.165021","192.168.2.3","216.58.197.4","TCP","1434","34236  >  443 [ACK] Seq=16739 Ack=39 Win=504 Len=1368 TSval=7760930 TSecr=759501958 [TCP segment of a reassembled PDU]"
"37","2018-08-23 01:48:47.165824","192.168.2.3","216.58.197.4","TLSv1.2","1434","Application Data [TCP segment of a reassembled PDU]"
"38","2018-08-23 01:48:47.165827","192.168.2.3","216.58.197.4","TCP","1434","34236  >  443 [ACK] Seq=19475 Ack=39 Win=504 Len=1368 TSval=7760930 TSecr=759501959 [TCP segment of a reassembled PDU]"
"39","2018-08-23 01:48:47.166091","192.168.2.3","216.58.197.4","TLSv1.2","1434","Application Data, Application Data"
"40","2018-08-23 01:48:47.166095","192.168.2.3","216.58.197.4","TCP","1434","34236  >  443 [ACK] Seq=22211 Ack=39 Win=504 Len=1368 TSval=7760930 TSecr=759501959 [TCP segment of a reassembled PDU]"
"41","2018-08-23 01:48:47.166248","192.168.2.3","216.58.197.4","TLSv1.2","1434","Application Data [TCP segment of a reassembled PDU]"
"42","2018-08-23 01:48:47.166421","192.168.2.3","216.58.197.4","TLSv1.2","1434","Application Data [TCP segment of a reassembled PDU]"
"43","2018-08-23 01:48:47.166999","192.168.2.3","216.58.197.4","TCP","1434","34236  >  443 [ACK] Seq=26315 Ack=39 Win=504 Len=1368 TSval=7760930 TSecr=759501959 [TCP segment of a reassembled PDU]"
"44","2018-08-23 01:48:47.167001","192.168.2.3","216.58.197.4","TLSv1.2","1434","Application Data [TCP segment of a reassembled PDU]"
"45","2018-08-23 01:48:47.167117","192.168.2.3","216.58.197.4","TCP","1434","34236  >  443 [ACK] Seq=29051 Ack=39 Win=504 Len=1368 TSval=7760930 TSecr=759501959 [TCP segment of a reassembled PDU]"
"49","2018-08-23 01:48:47.169910","192.168.2.3","216.58.197.4","TLSv1.2","1434","Application Data [TCP segment of a reassembled PDU]"
"50","2018-08-23 01:48:47.169913","192.168.2.3","216.58.197.4","TCP","1434","34236  >  443 [ACK] Seq=31787 Ack=39 Win=504 Len=1368 TSval=7760930 TSecr=759501964 [TCP segment of a reassembled PDU]"
"52","2018-08-23 01:48:47.170270","192.168.2.3","216.58.197.4","TCP","1434","34236  >  443 [ACK] Seq=33155 Ack=39 Win=504 Len=1368 TSval=7760930 TSecr=759501964 [TCP segment of a reassembled PDU]"
"56","2018-08-23 01:48:47.171296","192.168.2.3","216.58.197.4","TLSv1.2","1434","Application Data [TCP segment of a reassembled PDU]"
"57","2018-08-23 01:48:47.171313","192.168.2.3","216.58.197.4","TCP","1434","34236  >  443 [ACK] Seq=35891 Ack=39 Win=504 Len=1368 TSval=7760930 TSecr=759501964 [TCP segment of a reassembled PDU]"
"58","2018-08-23 01:48:47.171603","192.168.2.3","216.58.197.4","TLSv1.2","1434","Application Data [TCP segment of a reassembled PDU]"
"59","2018-08-23 01:48:47.171943","192.168.2.3","216.58.197.4","TCP","1434","34236  >  443 [PSH, ACK] Seq=38627 Ack=39 Win=504 Len=1368 TSval=7760930 TSecr=759501965 [TCP segment of a reassembled PDU]"
"60","2018-08-23 01:48:47.172772","192.168.2.3","216.58.197.4","TLSv1.2","1434","Application Data [TCP segment of a reassembled PDU]"
"61","2018-08-23 01:48:47.172780","192.168.2.3","216.58.197.4","TLSv1.2","1434","Application Data [TCP segment of a reassembled PDU]"
"62","2018-08-23 01:48:47.173026","192.168.2.3","216.58.197.4","TCP","1434","34236  >  443 [ACK] Seq=42731 Ack=39 Win=504 Len=1368 TSval=7760930 TSecr=759501965 [TCP segment of a reassembled PDU]"
"63","2018-08-23 01:48:47.173225","192.168.2.3","216.58.197.4","TLSv1.2","1434","Application Data [TCP segment of a reassembled PDU]"
"64","2018-08-23 01:48:47.173228","192.168.2.3","216.58.197.4","TCP","1434","34236  >  443 [ACK] Seq=45467 Ack=39 Win=504 Len=1368 TSval=7760930 TSecr=759501966 [TCP segment of a reassembled PDU]"
"65","2018-08-23 01:48:47.173571","192.168.2.3","216.58.197.4","TCP","1434","34236  >  443 [ACK] Seq=46835 Ack=39 Win=504 Len=1368 TSval=7760930 TSecr=759501966 [TCP segment of a reassembled PDU]"
"66","2018-08-23 01:48:47.173710","192.168.2.3","216.58.197.4","TLSv1.2","1434","Application Data [TCP segment of a reassembled PDU]"
"67","2018-08-23 01:48:47.174061","192.168.2.3","216.58.197.4","TCP","1434","34236  >  443 [ACK] Seq=49571 Ack=39 Win=504 Len=1368 TSval=7760930 TSecr=759501966 [TCP segment of a reassembled PDU]"
"68","2018-08-23 01:48:47.174063","192.168.2.3","216.58.197.4","TLSv1.2","1434","Application Data [TCP segment of a reassembled PDU]"
"70","2018-08-23 01:48:47.174236","192.168.2.3","216.58.197.4","TCP","1434","34236  >  443 [ACK] Seq=52307 Ack=39 Win=504 Len=1368 TSval=7760931 TSecr=759501967 [TCP segment of a reassembled PDU]"
"72","2018-08-23 01:48:47.174535","192.168.2.3","216.58.197.4","TLSv1.2","1434","Application Data [TCP segment of a reassembled PDU]"
"73","2018-08-23 01:48:47.174740","192.168.2.3","216.58.197.4","TCP","1434","34236  >  443 [PSH, ACK] Seq=55043 Ack=39 Win=504 Len=1368 TSval=7760931 TSecr=759501967 [TCP segment of a reassembled PDU]"
"81","2018-08-23 01:48:47.178588","192.168.2.3","216.58.197.4","TLSv1.2","1434","Application Data [TCP segment of a reassembled PDU]"
"82","2018-08-23 01:48:47.178770","192.168.2.3","216.58.197.4","TLSv1.2","1434","Application Data [TCP segment of a reassembled PDU]"
"84","2018-08-23 01:48:47.178946","192.168.2.3","216.58.197.4","TCP","1434","34236  >  443 [ACK] Seq=59147 Ack=39 Win=504 Len=1368 TSval=7760931 TSecr=759501970 [TCP segment of a reassembled PDU]"
"85","2018-08-23 01:48:47.178948","192.168.2.3","216.58.197.4","TCP","1434","34236  >  443 [ACK] Seq=60515 Ack=39 Win=504 Len=1368 TSval=7760931 TSecr=759501970 [TCP segment of a reassembled PDU]"
"86","2018-08-23 01:48:47.179127","192.168.2.3","216.58.197.4","TLSv1.2","659","Application Data, Application Data"
"89","2018-08-23 01:48:47.183196","192.168.2.3","216.58.197.4","TCP","1434","34236  >  443 [ACK] Seq=62476 Ack=39 Win=504 Len=1368 TSval=7760931 TSecr=759501973 [TCP segment of a reassembled PDU]"
"90","2018-08-23 01:48:47.183199","192.168.2.3","216.58.197.4","TCP","1434","34236  >  443 [ACK] Seq=63844 Ack=39 Win=504 Len=1368 TSval=7760931 TSecr=759501973 [TCP segment of a reassembled PDU]"
"91","2018-08-23 01:48:47.183369","192.168.2.3","216.58.197.4","TLSv1.2","212","Application Data"
"92","2018-08-23 01:48:47.183550","192.168.2.3","216.58.197.4","TCP","1434","34236  >  443 [ACK] Seq=65358 Ack=39 Win=504 Len=1368 TSval=7760931 TSecr=759501973 [TCP segment of a reassembled PDU]"
"93","2018-08-23 01:48:47.183554","192.168.2.3","216.58.197.4","TLSv1.2","155","Application Data"
"100","2018-08-23 01:48:47.231938","192.168.2.3","216.58.197.4","TCP","66","34236  >  443 [ACK] Seq=66815 Ack=206 Win=504 Len=0 TSval=7760936 TSecr=759502025"
"102","2018-08-23 01:48:47.241187","192.168.2.3","216.58.197.4","TCP","66","34236  >  443 [ACK] Seq=66815 Ack=655 Win=552 Len=0 TSval=7760937 TSecr=759502025"
"103","2018-08-23 01:48:47.259283","192.168.2.3","216.58.197.4","TCP","1434","34236  >  443 [ACK] Seq=66815 Ack=655 Win=552 Len=1368 TSval=7760939 TSecr=759502025 [TCP segment of a reassembled PDU]"
"104","2018-08-23 01:48:47.259288","192.168.2.3","216.58.197.4","TCP","1434","34236  >  443 [ACK] Seq=68183 Ack=655 Win=552 Len=1368 TSval=7760939 TSecr=759502025 [TCP segment of a reassembled PDU]"
"105","2018-08-23 01:48:47.259289","192.168.2.3","216.58.197.4","TLSv1.2","212","Application Data"
"106","2018-08-23 01:48:47.259407","192.168.2.3","216.58.197.4","TCP","1434","34236  >  443 [ACK] Seq=69697 Ack=655 Win=552 Len=1368 TSval=7760939 TSecr=759502025 [TCP segment of a reassembled PDU]"
"107","2018-08-23 01:48:47.259708","192.168.2.3","216.58.197.4","TLSv1.2","155","Application Data"
"112","2018-08-23 01:48:47.371705","192.168.2.3","216.58.197.4","TCP","1434","34236  >  443 [ACK] Seq=71154 Ack=918 Win=576 Len=1368 TSval=7760950 TSecr=759502138 [TCP segment of a reassembled PDU]"
"113","2018-08-23 01:48:47.371993","192.168.2.3","216.58.197.4","TCP","1434","34236  >  443 [ACK] Seq=72522 Ack=918 Win=576 Len=1368 TSval=7760950 TSecr=759502138 [TCP segment of a reassembled PDU]"
"114","2018-08-23 01:48:47.371997","192.168.2.3","216.58.197.4","TLSv1.2","212","Application Data"
"115","2018-08-23 01:48:47.372209","192.168.2.3","216.58.197.4","TCP","1434","34236  >  443 [ACK] Seq=74036 Ack=918 Win=576 Len=1368 TSval=7760950 TSecr=759502138 [TCP segment of a reassembled PDU]"
"116","2018-08-23 01:48:47.372212","192.168.2.3","216.58.197.4","TLSv1.2","155","Application Data"
"120","2018-08-23 01:48:47.448566","192.168.2.3","216.58.197.4","TCP","1434","34236  >  443 [ACK] Seq=75493 Ack=918 Win=576 Len=1368 TSval=7760958 TSecr=759502172 [TCP segment of a reassembled PDU]"
"121","2018-08-23 01:48:47.448918","192.168.2.3","216.58.197.4","TCP","1434","34236  >  443 [ACK] Seq=76861 Ack=918 Win=576 Len=1368 TSval=7760958 TSecr=759502172 [TCP segment of a reassembled PDU]"
"122","2018-08-23 01:48:47.448919","192.168.2.3","216.58.197.4","TLSv1.2","212","Application Data"
"123","2018-08-23 01:48:47.449389","192.168.2.3","216.58.197.4","TCP","1434","34236  >  443 [ACK] Seq=78375 Ack=918 Win=576 Len=1368 TSval=7760958 TSecr=759502172 [TCP segment of a reassembled PDU]"
"124","2018-08-23 01:48:47.449392","192.168.2.3","216.58.197.4","TLSv1.2","155","Application Data"
"129","2018-08-23 01:48:47.522186","192.168.2.3","216.58.197.4","TCP","66","34236  >  443 [ACK] Seq=79832 Ack=970 Win=576 Len=0 TSval=7760966 TSecr=759502283"
"130","2018-08-23 01:48:47.545102","192.168.2.3","216.58.197.4","TCP","1434","34236  >  443 [ACK] Seq=79832 Ack=970 Win=576 Len=1368 TSval=7760968 TSecr=759502283 [TCP segment of a reassembled PDU]"
"131","2018-08-23 01:48:47.545534","192.168.2.3","216.58.197.4","TCP","1434","34236  >  443 [ACK] Seq=81200 Ack=970 Win=576 Len=1368 TSval=7760968 TSecr=759502283 [TCP segment of a reassembled PDU]"
"132","2018-08-23 01:48:47.545537","192.168.2.3","216.58.197.4","TLSv1.2","212","Application Data"
"133","2018-08-23 01:48:47.546598","192.168.2.3","216.58.197.4","TCP","1434","34236  >  443 [ACK] Seq=82714 Ack=970 Win=576 Len=1368 TSval=7760968 TSecr=759502283 [TCP segment of a reassembled PDU]"
"134","2018-08-23 01:48:47.546602","192.168.2.3","216.58.197.4","TLSv1.2","155","Application Data"
"138","2018-08-23 01:48:47.659492","192.168.2.3","216.58.197.4","TCP","1434","34236  >  443 [ACK] Seq=84171 Ack=970 Win=576 Len=1368 TSval=7760979 TSecr=759502386 [TCP segment of a reassembled PDU]"
"139","2018-08-23 01:48:47.659967","192.168.2.3","216.58.197.4","TCP","1434","34236  >  443 [ACK] Seq=85539 Ack=970 Win=576 Len=1368 TSval=7760979 TSecr=759502386 [TCP segment of a reassembled PDU]"
"140","2018-08-23 01:48:47.659971","192.168.2.3","216.58.197.4","TLSv1.2","212","Application Data"
"141","2018-08-23 01:48:47.659972","192.168.2.3","216.58.197.4","TCP","1434","34236  >  443 [ACK] Seq=87053 Ack=970 Win=576 Len=1368 TSval=7760979 TSecr=759502386 [TCP segment of a reassembled PDU]"
"142","2018-08-23 01:48:47.660077","192.168.2.3","216.58.197.4","TLSv1.2","155","Application Data"
"146","2018-08-23 01:48:47.755614","192.168.2.3","216.58.197.4","TCP","1434","34236  >  443 [ACK] Seq=88510 Ack=970 Win=576 Len=1368 TSval=7760989 TSecr=759502459 [TCP segment of a reassembled PDU]"
"147","2018-08-23 01:48:47.756029","192.168.2.3","216.58.197.4","TCP","1434","34236  >  443 [ACK] Seq=89878 Ack=970 Win=576 Len=1368 TSval=7760989 TSecr=759502459 [TCP segment of a reassembled PDU]"
"148","2018-08-23 01:48:47.756035","192.168.2.3","216.58.197.4","TLSv1.2","212","Application Data"
"149","2018-08-23 01:48:47.756177","192.168.2.3","216.58.197.4","TCP","1434","34236  >  443 [ACK] Seq=91392 Ack=970 Win=576 Len=1368 TSval=7760989 TSecr=759502459 [TCP segment of a reassembled PDU]"
"150","2018-08-23 01:48:47.756180","192.168.2.3","216.58.197.4","TLSv1.2","155","Application Data"
"154","2018-08-23 01:48:47.851661","192.168.2.3","216.58.197.4","TCP","1434","34236  >  443 [ACK] Seq=92849 Ack=970 Win=576 Len=1368 TSval=7760998 TSecr=759502556 [TCP segment of a reassembled PDU]"
"155","2018-08-23 01:48:47.851964","192.168.2.3","216.58.197.4","TCP","1434","34236  >  443 [ACK] Seq=94217 Ack=970 Win=576 Len=1368 TSval=7760998 TSecr=759502556 [TCP segment of a reassembled PDU]"
"156","2018-08-23 01:48:47.851966","192.168.2.3","216.58.197.4","TLSv1.2","212","Application Data"
"157","2018-08-23 01:48:47.851967","192.168.2.3","216.58.197.4","TCP","1434","34236  >  443 [ACK] Seq=95731 Ack=970 Win=576 Len=1368 TSval=7760998 TSecr=759502556 [TCP segment of a reassembled PDU]"
"158","2018-08-23 01:48:47.852122","192.168.2.3","216.58.197.4","TLSv1.2","155","Application Data"
"161","2018-08-23 01:48:47.949551","192.168.2.3","216.58.197.4","TCP","1434","34236  >  443 [ACK] Seq=97188 Ack=970 Win=576 Len=1368 TSval=7761008 TSecr=759502652 [TCP segment of a reassembled PDU]"
"162","2018-08-23 01:48:47.950013","192.168.2.3","216.58.197.4","TCP","1434","34236  >  443 [ACK] Seq=98556 Ack=970 Win=576 Len=1368 TSval=7761008 TSecr=759502652 [TCP segment of a reassembled PDU]"
"163","2018-08-23 01:48:47.950016","192.168.2.3","216.58.197.4","TLSv1.2","212","Application Data"
"164","2018-08-23 01:48:47.950017","192.168.2.3","216.58.197.4","TCP","1434","34236  >  443 [ACK] Seq=100070 Ack=970 Win=576 Len=1368 TSval=7761008 TSecr=759502652 [TCP segment of a reassembled PDU]"
"165","2018-08-23 01:48:47.950384","192.168.2.3","216.58.197.4","TLSv1.2","155","Application Data"
"169","2018-08-23 01:48:48.045764","192.168.2.3","216.58.197.4","TCP","1434","34236  >  443 [ACK] Seq=101527 Ack=970 Win=576 Len=1368 TSval=7761018 TSecr=759502750 [TCP segment of a reassembled PDU]"
"170","2018-08-23 01:48:48.046152","192.168.2.3","216.58.197.4","TCP","1434","34236  >  443 [ACK] Seq=102895 Ack=970 Win=576 Len=1368 TSval=7761018 TSecr=759502750 [TCP segment of a reassembled PDU]"
"171","2018-08-23 01:48:48.046154","192.168.2.3","216.58.197.4","TLSv1.2","212","Application Data"
"172","2018-08-23 01:48:48.046155","192.168.2.3","216.58.197.4","TCP","1434","34236  >  443 [ACK] Seq=104409 Ack=970 Win=576 Len=1368 TSval=7761018 TSecr=759502750 [TCP segment of a reassembled PDU]"
"173","2018-08-23 01:48:48.046156","192.168.2.3","216.58.197.4","TLSv1.2","155","Application Data"
"177","2018-08-23 01:48:48.122312","192.168.2.3","216.58.197.4","TCP","1434","34236  >  443 [ACK] Seq=105866 Ack=970 Win=576 Len=1368 TSval=7761025 TSecr=759502846 [TCP segment of a reassembled PDU]"
"178","2018-08-23 01:48:48.122683","192.168.2.3","216.58.197.4","TCP","1434","34236  >  443 [ACK] Seq=107234 Ack=970 Win=576 Len=1368 TSval=7761026 TSecr=759502846 [TCP segment of a reassembled PDU]"
"179","2018-08-23 01:48:48.122688","192.168.2.3","216.58.197.4","TLSv1.2","212","Application Data"
"180","2018-08-23 01:48:48.123091","192.168.2.3","216.58.197.4","TCP","1434","34236  >  443 [ACK] Seq=108748 Ack=970 Win=576 Len=1368 TSval=7761026 TSecr=759502846 [TCP segment of a reassembled PDU]"
"181","2018-08-23 01:48:48.123097","192.168.2.3","216.58.197.4","TLSv1.2","155","Application Data"
"185","2018-08-23 01:48:48.218351","192.168.2.3","216.58.197.4","TCP","1434","34236  >  443 [ACK] Seq=110205 Ack=970 Win=576 Len=1368 TSval=7761035 TSecr=759502923 [TCP segment of a reassembled PDU]"
"186","2018-08-23 01:48:48.218727","192.168.2.3","216.58.197.4","TCP","1434","34236  >  443 [ACK] Seq=111573 Ack=970 Win=576 Len=1368 TSval=7761035 TSecr=759502923 [TCP segment of a reassembled PDU]"
"187","2018-08-23 01:48:48.218730","192.168.2.3","216.58.197.4","TLSv1.2","212","Application Data"
"188","2018-08-23 01:48:48.218730","192.168.2.3","216.58.197.4","TCP","1434","34236  >  443 [ACK] Seq=113087 Ack=970 Win=576 Len=1368 TSval=7761035 TSecr=759502923 [TCP segment of a reassembled PDU]"
"189","2018-08-23 01:48:48.218855","192.168.2.3","216.58.197.4","TLSv1.2","155","Application Data"
"194","2018-08-23 01:48:48.232675","192.168.2.3","216.58.197.4","TCP","66","34236  >  443 [ACK] Seq=114544 Ack=1113 Win=600 Len=0 TSval=7761037 TSecr=759503025"
"196","2018-08-23 01:48:48.244202","192.168.2.3","216.58.197.4","TCP","66","34236  >  443 [ACK] Seq=114544 Ack=1313 Win=624 Len=0 TSval=7761037 TSecr=759503035"
"197","2018-08-23 01:48:48.314318","192.168.2.3","216.58.197.4","TCP","1434","34236  >  443 [ACK] Seq=114544 Ack=1313 Win=624 Len=1368 TSval=7761045 TSecr=759503035 [TCP segment of a reassembled PDU]"
"198","2018-08-23 01:48:48.314696","192.168.2.3","216.58.197.4","TCP","1434","34236  >  443 [ACK] Seq=115912 Ack=1313 Win=624 Len=1368 TSval=7761045 TSecr=759503035 [TCP segment of a reassembled PDU]"
"199","2018-08-23 01:48:48.314698","192.168.2.3","216.58.197.4","TLSv1.2","212","Application Data"
"200","2018-08-23 01:48:48.315105","192.168.2.3","216.58.197.4","TCP","1434","34236  >  443 [ACK] Seq=117426 Ack=1313 Win=624 Len=1368 TSval=7761045 TSecr=759503035 [TCP segment of a reassembled PDU]"
"201","2018-08-23 01:48:48.315108","192.168.2.3","216.58.197.4","TLSv1.2","155","Application Data"
"205","2018-08-23 01:48:48.399059","192.168.2.3","216.58.197.4","TCP","1434","34236  >  443 [ACK] Seq=118883 Ack=1313 Win=624 Len=1368 TSval=7761053 TSecr=759503155 [TCP segment of a reassembled PDU]"
"206","2018-08-23 01:48:48.399358","192.168.2.3","216.58.197.4","TCP","1434","34236  >  443 [ACK] Seq=120251 Ack=1313 Win=624 Len=1368 TSval=7761053 TSecr=759503155 [TCP segment of a reassembled PDU]"
"207","2018-08-23 01:48:48.399362","192.168.2.3","216.58.197.4","TLSv1.2","212","Application Data"
"208","2018-08-23 01:48:48.399700","192.168.2.3","216.58.197.4","TCP","1434","34236  >  443 [ACK] Seq=121765 Ack=1313 Win=624 Len=1368 TSval=7761053 TSecr=759503155 [TCP segment of a reassembled PDU]"
"209","2018-08-23 01:48:48.399703","192.168.2.3","216.58.197.4","TLSv1.2","155","Application Data"
"215","2018-08-23 01:48:48.452318","192.168.2.3","216.58.197.4","TCP","66","34236  >  443 [ACK] Seq=123222 Ack=1468 Win=648 Len=0 TSval=7761058 TSecr=759503245"
"216","2018-08-23 01:48:48.452321","192.168.2.3","216.58.197.4","TCP","66","34236  >  443 [ACK] Seq=123222 Ack=1623 Win=661 Len=0 TSval=7761058 TSecr=759503246"
"217","2018-08-23 01:48:48.504835","192.168.2.3","216.58.197.4","TCP","1434","34236  >  443 [ACK] Seq=123222 Ack=1623 Win=661 Len=1368 TSval=7761064 TSecr=759503246 [TCP segment of a reassembled PDU]"
"218","2018-08-23 01:48:48.505241","192.168.2.3","216.58.197.4","TCP","1434","34236  >  443 [ACK] Seq=124590 Ack=1623 Win=661 Len=1368 TSval=7761064 TSecr=759503246 [TCP segment of a reassembled PDU]"
"219","2018-08-23 01:48:48.505245","192.168.2.3","216.58.197.4","TLSv1.2","212","Application Data"
"220","2018-08-23 01:48:48.505687","192.168.2.3","216.58.197.4","TCP","1434","34236  >  443 [ACK] Seq=126104 Ack=1623 Win=661 Len=1368 TSval=7761064 TSecr=759503246 [TCP segment of a reassembled PDU]"
"221","2018-08-23 01:48:48.505689","192.168.2.3","216.58.197.4","TLSv1.2","155","Application Data"
"226","2018-08-23 01:48:48.579483","192.168.2.3","216.58.197.4","TCP","66","34236  >  443 [ACK] Seq=127561 Ack=1665 Win=661 Len=0 TSval=7761071 TSecr=759503372"
"227","2018-08-23 01:48:48.590422","192.168.2.3","216.58.197.4","TCP","1434","34236  >  443 [ACK] Seq=127561 Ack=1665 Win=661 Len=1368 TSval=7761072 TSecr=759503372 [TCP segment of a reassembled PDU]"
"228","2018-08-23 01:48:48.590427","192.168.2.3","216.58.197.4","TCP","1434","34236  >  443 [ACK] Seq=128929 Ack=1665 Win=661 Len=1368 TSval=7761072 TSecr=759503372 [TCP segment of a reassembled PDU]"
"229","2018-08-23 01:48:48.590428","192.168.2.3","216.58.197.4","TLSv1.2","212","Application Data"
"230","2018-08-23 01:48:48.590728","192.168.2.3","216.58.197.4","TCP","1434","34236  >  443 [ACK] Seq=130443 Ack=1665 Win=661 Len=1368 TSval=7761072 TSecr=759503372 [TCP segment of a reassembled PDU]"
"231","2018-08-23 01:48:48.590733","192.168.2.3","216.58.197.4","TLSv1.2","155","Application Data"
"237","2018-08-23 01:48:48.642990","192.168.2.3","216.58.197.4","TCP","66","34236  >  443 [ACK] Seq=131900 Ack=2112 Win=661 Len=0 TSval=7761078 TSecr=759503431"
"238","2018-08-23 01:48:48.683733","192.168.2.3","216.58.197.4","TCP","1434","34236  >  443 [ACK] Seq=131900 Ack=2112 Win=661 Len=1368 TSval=7761082 TSecr=759503431 [TCP segment of a reassembled PDU]"
"239","2018-08-23 01:48:48.684038","192.168.2.3","216.58.197.4","TCP","1434","34236  >  443 [ACK] Seq=133268 Ack=2112 Win=661 Len=1368 TSval=7761082 TSecr=759503431 [TCP segment of a reassembled PDU]"
"240","2018-08-23 01:48:48.684041","192.168.2.3","216.58.197.4","TLSv1.2","212","Application Data"
"241","2018-08-23 01:48:48.684479","192.168.2.3","216.58.197.4","TCP","1434","34236  >  443 [ACK] Seq=134782 Ack=2112 Win=661 Len=1368 TSval=7761082 TSecr=759503431 [TCP segment of a reassembled PDU]"
"242","2018-08-23 01:48:48.684766","192.168.2.3","216.58.197.4","TLSv1.2","155","Application Data"
"246","2018-08-23 01:48:48.779541","192.168.2.3","216.58.197.4","TCP","1434","34236  >  443 [ACK] Seq=136239 Ack=2112 Win=661 Len=1368 TSval=7761091 TSecr=759503484 [TCP segment of a reassembled PDU]"
"247","2018-08-23 01:48:48.779813","192.168.2.3","216.58.197.4","TCP","1434","34236  >  443 [ACK] Seq=137607 Ack=2112 Win=661 Len=1368 TSval=7761091 TSecr=759503484 [TCP segment of a reassembled PDU]"
"248","2018-08-23 01:48:48.779815","192.168.2.3","216.58.197.4","TLSv1.2","212","Application Data"
"249","2018-08-23 01:48:48.780229","192.168.2.3","216.58.197.4","TCP","1434","34236  >  443 [ACK] Seq=139121 Ack=2112 Win=661 Len=1368 TSval=7761091 TSecr=759503484 [TCP segment of a reassembled PDU]"
"250","2018-08-23 01:48:48.780232","192.168.2.3","216.58.197.4","TLSv1.2","155","Application Data"
"256","2018-08-23 01:48:48.826720","192.168.2.3","216.58.197.4","TCP","66","34236  >  443 [ACK] Seq=140578 Ack=2668 Win=661 Len=0 TSval=7761096 TSecr=759503620"
"259","2018-08-23 01:48:48.834816","192.168.2.3","216.58.197.4","TCP","66","34236  >  443 [ACK] Seq=140578 Ack=3016 Win=661 Len=0 TSval=7761097 TSecr=759503629"
"260","2018-08-23 01:48:48.858403","192.168.2.3","216.58.197.4","TCP","1434","34236  >  443 [ACK] Seq=140578 Ack=3016 Win=661 Len=1368 TSval=7761099 TSecr=759503629 [TCP segment of a reassembled PDU]"
"261","2018-08-23 01:48:48.858408","192.168.2.3","216.58.197.4","TCP","1434","34236  >  443 [ACK] Seq=141946 Ack=3016 Win=661 Len=1368 TSval=7761099 TSecr=759503629 [TCP segment of a reassembled PDU]"
"262","2018-08-23 01:48:48.858557","192.168.2.3","216.58.197.4","TLSv1.2","212","Application Data"
"263","2018-08-23 01:48:48.858815","192.168.2.3","216.58.197.4","TCP","1434","34236  >  443 [ACK] Seq=143460 Ack=3016 Win=661 Len=1368 TSval=7761099 TSecr=759503629 [TCP segment of a reassembled PDU]"
"264","2018-08-23 01:48:48.858816","192.168.2.3","216.58.197.4","TLSv1.2","155","Application Data"
"267","2018-08-23 01:48:48.955199","192.168.2.3","216.58.197.4","TCP","1434","34236  >  443 [ACK] Seq=144917 Ack=3016 Win=661 Len=1368 TSval=7761109 TSecr=759503658 [TCP segment of a reassembled PDU]"
"268","2018-08-23 01:48:48.955204","192.168.2.3","216.58.197.4","TCP","1434","34236  >  443 [ACK] Seq=146285 Ack=3016 Win=661 Len=1368 TSval=7761109 TSecr=759503658 [TCP segment of a reassembled PDU]"
"269","2018-08-23 01:48:48.955205","192.168.2.3","216.58.197.4","TLSv1.2","212","Application Data"
"270","2018-08-23 01:48:48.955556","192.168.2.3","216.58.197.4","TCP","1434","34236  >  443 [ACK] Seq=147799 Ack=3016 Win=661 Len=1368 TSval=7761109 TSecr=759503658 [TCP segment of a reassembled PDU]"
"271","2018-08-23 01:48:48.955559","192.168.2.3","216.58.197.4","TLSv1.2","155","Application Data"
"275","2018-08-23 01:48:49.038429","192.168.2.3","216.58.197.4","TCP","1434","34236  >  443 [ACK] Seq=149256 Ack=3016 Win=661 Len=1368 TSval=7761117 TSecr=759503755 [TCP segment of a reassembled PDU]"
"276","2018-08-23 01:48:49.038745","192.168.2.3","216.58.197.4","TCP","1434","34236  >  443 [ACK] Seq=150624 Ack=3016 Win=661 Len=1368 TSval=7761117 TSecr=759503755 [TCP segment of a reassembled PDU]"
"277","2018-08-23 01:48:49.038749","192.168.2.3","216.58.197.4","TLSv1.2","212","Application Data"
"278","2018-08-23 01:48:49.038922","192.168.2.3","216.58.197.4","TCP","1434","34236  >  443 [ACK] Seq=152138 Ack=3016 Win=661 Len=1368 TSval=7761117 TSecr=759503755 [TCP segment of a reassembled PDU]"
"279","2018-08-23 01:48:49.038924","192.168.2.3","216.58.197.4","TLSv1.2","155","Application Data"
"285","2018-08-23 01:48:49.090429","192.168.2.3","216.58.197.4","TCP","66","34236  >  443 [ACK] Seq=153595 Ack=3339 Win=661 Len=0 TSval=7761122 TSecr=759503884"
"286","2018-08-23 01:48:49.146830","192.168.2.3","216.58.197.4","TCP","1434","34236  >  443 [ACK] Seq=153595 Ack=3339 Win=661 Len=1368 TSval=7761128 TSecr=759503884 [TCP segment of a reassembled PDU]"
"287","2018-08-23 01:48:49.147189","192.168.2.3","216.58.197.4","TCP","1434","34236  >  443 [ACK] Seq=154963 Ack=3339 Win=661 Len=1368 TSval=7761128 TSecr=759503884 [TCP segment of a reassembled PDU]"
"288","2018-08-23 01:48:49.147191","192.168.2.3","216.58.197.4","TLSv1.2","212","Application Data"
"289","2018-08-23 01:48:49.147383","192.168.2.3","216.58.197.4","TCP","1434","34236  >  443 [ACK] Seq=156477 Ack=3339 Win=661 Len=1368 TSval=7761128 TSecr=759503884 [TCP segment of a reassembled PDU]"
"290","2018-08-23 01:48:49.147386","192.168.2.3","216.58.197.4","TLSv1.2","155","Application Data"
"296","2018-08-23 01:48:49.204600","192.168.2.3","216.58.197.4","TCP","66","34236  >  443 [ACK] Seq=157934 Ack=3764 Win=661 Len=0 TSval=7761134 TSecr=759503996"
"299","2018-08-23 01:48:49.241399","192.168.2.3","216.58.197.4","TCP","66","34236  >  443 [ACK] Seq=157934 Ack=4008 Win=661 Len=0 TSval=7761137 TSecr=759504025"
"300","2018-08-23 01:48:49.242679","192.168.2.3","216.58.197.4","TCP","1434","34236  >  443 [ACK] Seq=157934 Ack=4008 Win=661 Len=1368 TSval=7761138 TSecr=759504025 [TCP segment of a reassembled PDU]"
"301","2018-08-23 01:48:49.242958","192.168.2.3","216.58.197.4","TCP","1434","34236  >  443 [ACK] Seq=159302 Ack=4008 Win=661 Len=1368 TSval=7761138 TSecr=759504025 [TCP segment of a reassembled PDU]"
"302","2018-08-23 01:48:49.242966","192.168.2.3","216.58.197.4","TLSv1.2","212","Application Data"
"303","2018-08-23 01:48:49.243313","192.168.2.3","216.58.197.4","TCP","1434","34236  >  443 [ACK] Seq=160816 Ack=4008 Win=661 Len=1368 TSval=7761138 TSecr=759504025 [TCP segment of a reassembled PDU]"
"304","2018-08-23 01:48:49.243319","192.168.2.3","216.58.197.4","TLSv1.2","155","Application Data"
"308","2018-08-23 01:48:49.326431","192.168.2.3","216.58.197.4","TCP","1434","34236  >  443 [ACK] Seq=162273 Ack=4008 Win=661 Len=1368 TSval=7761146 TSecr=759504043 [TCP segment of a reassembled PDU]"
"309","2018-08-23 01:48:49.328711","192.168.2.3","216.58.197.4","TCP","1434","34236  >  443 [ACK] Seq=163641 Ack=4008 Win=661 Len=1368 TSval=7761146 TSecr=759504043 [TCP segment of a reassembled PDU]"
"310","2018-08-23 01:48:49.328715","192.168.2.3","216.58.197.4","TLSv1.2","212","Application Data"
"311","2018-08-23 01:48:49.329010","192.168.2.3","216.58.197.4","TCP","1434","34236  >  443 [ACK] Seq=165155 Ack=4008 Win=661 Len=1368 TSval=7761146 TSecr=759504043 [TCP segment of a reassembled PDU]"
"312","2018-08-23 01:48:49.329012","192.168.2.3","216.58.197.4","TLSv1.2","155","Application Data"
"316","2018-08-23 01:48:49.436271","192.168.2.3","216.58.197.4","TCP","1434","34236  >  443 [ACK] Seq=166612 Ack=4008 Win=661 Len=1368 TSval=7761157 TSecr=759504129 [TCP segment of a reassembled PDU]"
"317","2018-08-23 01:48:49.436276","192.168.2.3","216.58.197.4","TCP","1434","34236  >  443 [ACK] Seq=167980 Ack=4008 Win=661 Len=1368 TSval=7761157 TSecr=759504129 [TCP segment of a reassembled PDU]"
"318","2018-08-23 01:48:49.436277","192.168.2.3","216.58.197.4","TLSv1.2","212","Application Data"
"319","2018-08-23 01:48:49.436623","192.168.2.3","216.58.197.4","TCP","1434","34236  >  443 [ACK] Seq=169494 Ack=4008 Win=661 Len=1368 TSval=7761157 TSecr=759504129 [TCP segment of a reassembled PDU]"
"320","2018-08-23 01:48:49.436625","192.168.2.3","216.58.197.4","TLSv1.2","155","Application Data"
"325","2018-08-23 01:48:49.484856","192.168.2.3","216.58.197.4","TCP","66","34236  >  443 [ACK] Seq=170951 Ack=4256 Win=661 Len=0 TSval=7761162 TSecr=759504277"
"326","2018-08-23 01:48:49.518204","192.168.2.3","216.58.197.4","TCP","1434","34236  >  443 [ACK] Seq=170951 Ack=4256 Win=661 Len=1368 TSval=7761165 TSecr=759504277 [TCP segment of a reassembled PDU]"
"327","2018-08-23 01:48:49.518650","192.168.2.3","216.58.197.4","TCP","1434","34236  >  443 [ACK] Seq=172319 Ack=4256 Win=661 Len=1368 TSval=7761165 TSecr=759504277 [TCP segment of a reassembled PDU]"
"328","2018-08-23 01:48:49.518652","192.168.2.3","216.58.197.4","TLSv1.2","212","Application Data"
"329","2018-08-23 01:48:49.519034","192.168.2.3","216.58.197.4","TCP","1434","34236  >  443 [ACK] Seq=173833 Ack=4256 Win=661 Len=1368 TSval=7761165 TSecr=759504277 [TCP segment of a reassembled PDU]"
"330","2018-08-23 01:48:49.519037","192.168.2.3","216.58.197.4","TLSv1.2","155","Application Data"
"335","2018-08-23 01:48:49.626893","192.168.2.3","216.58.197.4","TCP","1434","34236  >  443 [ACK] Seq=175290 Ack=4505 Win=661 Len=1368 TSval=7761176 TSecr=759504416 [TCP segment of a reassembled PDU]"
"336","2018-08-23 01:48:49.627352","192.168.2.3","216.58.197.4","TCP","1434","34236  >  443 [ACK] Seq=176658 Ack=4505 Win=661 Len=1368 TSval=7761176 TSecr=759504416 [TCP segment of a reassembled PDU]"
"337","2018-08-23 01:48:49.627357","192.168.2.3","216.58.197.4","TLSv1.2","212","Application Data"
"338","2018-08-23 01:48:49.627789","192.168.2.3","216.58.197.4","TCP","1434","34236  >  443 [ACK] Seq=178172 Ack=4505 Win=661 Len=1368 TSval=7761176 TSecr=759504416 [TCP segment of a reassembled PDU]"
"339","2018-08-23 01:48:49.627793","192.168.2.3","216.58.197.4","TLSv1.2","155","Application Data"
"345","2018-08-23 01:48:49.682729","192.168.2.3","216.58.197.4","TCP","66","34236  >  443 [ACK] Seq=179629 Ack=4884 Win=661 Len=0 TSval=7761182 TSecr=759504476"
"346","2018-08-23 01:48:49.723274","192.168.2.3","216.58.197.4","TCP","1434","34236  >  443 [ACK] Seq=179629 Ack=4884 Win=661 Len=1368 TSval=7761186 TSecr=759504476 [TCP segment of a reassembled PDU]"
"347","2018-08-23 01:48:49.723279","192.168.2.3","216.58.197.4","TCP","1434","34236  >  443 [ACK] Seq=180997 Ack=4884 Win=661 Len=1368 TSval=7761186 TSecr=759504476 [TCP segment of a reassembled PDU]"
"348","2018-08-23 01:48:49.723281","192.168.2.3","216.58.197.4","TLSv1.2","212","Application Data"
"349","2018-08-23 01:48:49.723871","192.168.2.3","216.58.197.4","TCP","1434","34236  >  443 [ACK] Seq=182511 Ack=4884 Win=661 Len=1368 TSval=7761186 TSecr=759504476 [TCP segment of a reassembled PDU]"
"350","2018-08-23 01:48:49.723876","192.168.2.3","216.58.197.4","TLSv1.2","155","Application Data"
"354","2018-08-23 01:48:49.808836","192.168.2.3","216.58.197.4","TCP","1434","34236  >  443 [ACK] Seq=183968 Ack=4884 Win=661 Len=1368 TSval=7761194 TSecr=759504523 [TCP segment of a reassembled PDU]"
"355","2018-08-23 01:48:49.808841","192.168.2.3","216.58.197.4","TCP","1434","34236  >  443 [ACK] Seq=185336 Ack=4884 Win=661 Len=1368 TSval=7761194 TSecr=759504523 [TCP segment of a reassembled PDU]"
"356","2018-08-23 01:48:49.808854","192.168.2.3","216.58.197.4","TLSv1.2","212","Application Data"
"357","2018-08-23 01:48:49.809004","192.168.2.3","216.58.197.4","TCP","1434","34236  >  443 [ACK] Seq=186850 Ack=4884 Win=661 Len=1368 TSval=7761194 TSecr=759504523 [TCP segment of a reassembled PDU]"
"358","2018-08-23 01:48:49.809190","192.168.2.3","216.58.197.4","TLSv1.2","155","Application Data"
"362","2018-08-23 01:48:49.912263","192.168.2.3","216.58.197.4","TCP","1434","34236  >  443 [ACK] Seq=188307 Ack=4884 Win=661 Len=1368 TSval=7761204 TSecr=759504609 [TCP segment of a reassembled PDU]"
"363","2018-08-23 01:48:49.912748","192.168.2.3","216.58.197.4","TCP","1434","34236  >  443 [ACK] Seq=189675 Ack=4884 Win=661 Len=1368 TSval=7761205 TSecr=759504609 [TCP segment of a reassembled PDU]"
"364","2018-08-23 01:48:49.912750","192.168.2.3","216.58.197.4","TLSv1.2","212","Application Data"
"365","2018-08-23 01:48:49.913136","192.168.2.3","216.58.197.4","TCP","1434","34236  >  443 [ACK] Seq=191189 Ack=4884 Win=661 Len=1368 TSval=7761205 TSecr=759504609 [TCP segment of a reassembled PDU]"
"366","2018-08-23 01:48:49.913137","192.168.2.3","216.58.197.4","TLSv1.2","155","Application Data"
"370","2018-08-23 01:48:49.998478","192.168.2.3","216.58.197.4","TCP","1434","34236  >  443 [ACK] Seq=192646 Ack=4884 Win=661 Len=1368 TSval=7761213 TSecr=759504713 [TCP segment of a reassembled PDU]"
"371","2018-08-23 01:48:49.998673","192.168.2.3","216.58.197.4","TCP","1434","34236  >  443 [ACK] Seq=194014 Ack=4884 Win=661 Len=1368 TSval=7761213 TSecr=759504713 [TCP segment of a reassembled PDU]"
"372","2018-08-23 01:48:49.998675","192.168.2.3","216.58.197.4","TLSv1.2","212","Application Data"
"373","2018-08-23 01:48:49.998902","192.168.2.3","216.58.197.4","TCP","1434","34236  >  443 [ACK] Seq=195528 Ack=4884 Win=661 Len=1368 TSval=7761213 TSecr=759504713 [TCP segment of a reassembled PDU]"
"374","2018-08-23 01:48:49.998905","192.168.2.3","216.58.197.4","TLSv1.2","155","Application Data"
"380","2018-08-23 01:48:50.050606","192.168.2.3","216.58.197.4","TCP","66","34236  >  443 [ACK] Seq=196985 Ack=5292 Win=661 Len=0 TSval=7761218 TSecr=759504843"
"381","2018-08-23 01:48:50.106692","192.168.2.3","216.58.197.4","TCP","1434","34236  >  443 [ACK] Seq=196985 Ack=5292 Win=661 Len=1368 TSval=7761224 TSecr=759504843 [TCP segment of a reassembled PDU]"
"382","2018-08-23 01:48:50.106947","192.168.2.3","216.58.197.4","TCP","1434","34236  >  443 [ACK] Seq=198353 Ack=5292 Win=661 Len=1368 TSval=7761224 TSecr=759504843 [TCP segment of a reassembled PDU]"
"383","2018-08-23 01:48:50.106950","192.168.2.3","216.58.197.4","TLSv1.2","212","Application Data"
"384","2018-08-23 01:48:50.107365","192.168.2.3","216.58.197.4","TCP","1434","34236  >  443 [ACK] Seq=199867 Ack=5292 Win=661 Len=1368 TSval=7761224 TSecr=759504843 [TCP segment of a reassembled PDU]"
"385","2018-08-23 01:48:50.107368","192.168.2.3","216.58.197.4","TLSv1.2","155","Application Data"
"389","2018-08-23 01:48:50.202878","192.168.2.3","216.58.197.4","TCP","1434","34236  >  443 [ACK] Seq=201324 Ack=5292 Win=661 Len=1368 TSval=7761234 TSecr=759504907 [TCP segment of a reassembled PDU]"
"390","2018-08-23 01:48:50.203372","192.168.2.3","216.58.197.4","TCP","1434","34236  >  443 [ACK] Seq=202692 Ack=5292 Win=661 Len=1368 TSval=7761234 TSecr=759504907 [TCP segment of a reassembled PDU]"
"391","2018-08-23 01:48:50.203376","192.168.2.3","216.58.197.4","TLSv1.2","212","Application Data"
"392","2018-08-23 01:48:50.203377","192.168.2.3","216.58.197.4","TCP","1434","34236  >  443 [ACK] Seq=204206 Ack=5292 Win=661 Len=1368 TSval=7761234 TSecr=759504907 [TCP segment of a reassembled PDU]"
"393","2018-08-23 01:48:50.203461","192.168.2.3","216.58.197.4","TLSv1.2","155","Application Data"
"399","2018-08-23 01:48:50.241138","192.168.2.3","216.58.197.4","TCP","66","34236  >  443 [ACK] Seq=205663 Ack=5570 Win=661 Len=0 TSval=7761237 TSecr=759505026"
"402","2018-08-23 01:48:50.250813","192.168.2.3","216.58.197.4","TCP","66","34236  >  443 [ACK] Seq=205663 Ack=5961 Win=661 Len=0 TSval=7761238 TSecr=759505043"
"403","2018-08-23 01:48:50.269899","192.168.2.3","216.58.197.4","TCP","1434","34236  >  443 [ACK] Seq=205663 Ack=5961 Win=661 Len=1368 TSval=7761240 TSecr=759505043 [TCP segment of a reassembled PDU]"
"404","2018-08-23 01:48:50.270163","192.168.2.3","216.58.197.4","TCP","1434","34236  >  443 [ACK] Seq=207031 Ack=5961 Win=661 Len=1368 TSval=7761240 TSecr=759505043 [TCP segment of a reassembled PDU]"
"405","2018-08-23 01:48:50.270167","192.168.2.3","216.58.197.4","TLSv1.2","212","Application Data"
"406","2018-08-23 01:48:50.270168","192.168.2.3","216.58.197.4","TLSv1.2","222","Application Data"
"407","2018-08-23 01:48:50.270169","192.168.2.3","216.58.197.4","TLSv1.2","102","Application Data"
"412","2018-08-23 01:48:50.307883","192.168.2.3","216.58.197.4","TCP","66","34236  >  443 [ACK] Seq=208737 Ack=6675 Win=661 Len=0 TSval=7761244 TSecr=759505100"
"414","2018-08-23 01:48:50.552124","192.168.2.3","216.58.197.4","TCP","66","34236  >  443 [ACK] Seq=208737 Ack=6791 Win=661 Len=0 TSval=7761269 TSecr=759505316"
"416","2018-08-23 01:48:50.602475","192.168.2.3","216.58.197.4","TCP","66","34236  >  443 [ACK] Seq=208737 Ack=7983 Win=661 Len=0 TSval=7761274 TSecr=759505356"
"417","2018-08-23 01:48:50.664719","192.168.2.3","74.125.204.188","TCP","66","33038  >  5228 [ACK] Seq=1 Ack=1 Win=406 Len=0 TSval=7761280 TSecr=3813208973"
"426","2018-08-23 01:48:50.683139","192.168.2.3","216.58.197.4","TCP","66","34236  >  443 [ACK] Seq=208737 Ack=9795 Win=661 Len=0 TSval=7761282 TSecr=759505477"
"433","2018-08-23 01:48:50.690937","192.168.2.3","216.58.197.4","TCP","66","34236  >  443 [ACK] Seq=208737 Ack=11525 Win=661 Len=0 TSval=7761282 TSecr=759505477"
"434","2018-08-23 01:48:50.690943","192.168.2.3","216.58.197.4","TCP","66","34236  >  443 [ACK] Seq=208737 Ack=13454 Win=661 Len=0 TSval=7761282 TSecr=759505477"
"435","2018-08-23 01:48:50.690944","192.168.2.3","216.58.197.4","TCP","66","34236  >  443 [ACK] Seq=208737 Ack=15165 Win=661 Len=0 TSval=7761282 TSecr=759505478"
"436","2018-08-23 01:48:50.690945","192.168.2.3","216.58.197.4","TCP","66","34236  >  443 [ACK] Seq=208737 Ack=17014 Win=661 Len=0 TSval=7761282 TSecr=759505478"
"437","2018-08-23 01:48:50.691604","192.168.2.3","216.58.197.4","TCP","66","34236  >  443 [ACK] Seq=208737 Ack=18728 Win=661 Len=0 TSval=7761282 TSecr=759505478"
"438","2018-08-23 01:48:50.691609","192.168.2.3","216.58.197.4","TCP","66","34236  >  443 [ACK] Seq=208737 Ack=20463 Win=661 Len=0 TSval=7761282 TSecr=759505478"
"447","2018-08-23 01:48:50.715015","192.168.2.3","216.58.197.4","TCP","66","34236  >  443 [ACK] Seq=208737 Ack=22196 Win=661 Len=0 TSval=7761285 TSecr=759505508"
"450","2018-08-23 01:48:50.715735","192.168.2.3","216.58.197.4","TCP","66","34236  >  443 [ACK] Seq=208737 Ack=25695 Win=661 Len=0 TSval=7761285 TSecr=759505508"
"453","2018-08-23 01:48:50.716409","192.168.2.3","216.58.197.4","TCP","66","34236  >  443 [ACK] Seq=208737 Ack=27488 Win=661 Len=0 TSval=7761285 TSecr=759505509"
"456","2018-08-23 01:48:50.717137","192.168.2.3","216.58.197.4","TCP","66","34236  >  443 [ACK] Seq=208737 Ack=29288 Win=661 Len=0 TSval=7761285 TSecr=759505511"
"457","2018-08-23 01:48:50.717859","192.168.2.3","216.58.197.4","TCP","66","34236  >  443 [ACK] Seq=208737 Ack=31170 Win=661 Len=0 TSval=7761285 TSecr=759505511"
"460","2018-08-23 01:48:50.718445","192.168.2.3","216.58.197.4","TCP","66","34236  >  443 [ACK] Seq=208737 Ack=32863 Win=661 Len=0 TSval=7761285 TSecr=759505512"
"465","2018-08-23 01:48:50.719549","192.168.2.3","216.58.197.4","TCP","66","34236  >  443 [ACK] Seq=208737 Ack=34791 Win=661 Len=0 TSval=7761285 TSecr=759505513"
"466","2018-08-23 01:48:50.720292","192.168.2.3","216.58.197.4","TCP","66","34236  >  443 [ACK] Seq=208737 Ack=36674 Win=661 Len=0 TSval=7761285 TSecr=759505513"
"468","2018-08-23 01:48:50.720751","192.168.2.3","216.58.197.4","TCP","66","34236  >  443 [ACK] Seq=208737 Ack=38363 Win=661 Len=0 TSval=7761285 TSecr=759505514"
"471","2018-08-23 01:48:50.722414","192.168.2.3","216.58.197.4","TCP","66","34236  >  443 [ACK] Seq=208737 Ack=41414 Win=661 Len=0 TSval=7761286 TSecr=759505516"
"478","2018-08-23 01:48:50.749043","192.168.2.3","216.58.197.4","TCP","66","34236  >  443 [ACK] Seq=208737 Ack=42158 Win=661 Len=0 TSval=7761288 TSecr=759505528"
"480","2018-08-23 01:48:50.754600","192.168.2.3","216.58.197.4","TCP","78","[TCP Dup ACK 478#1] 34236  >  443 [ACK] Seq=208737 Ack=42158 Win=661 Len=0 TSval=7761289 TSecr=759505548 SLE=41905 SRE=42158"
"481","2018-08-23 01:48:50.754809","192.168.2.3","216.58.197.4","TLSv1.2","104","Application Data"
"483","2018-08-23 01:48:56.593647","192.168.2.3","216.58.197.3","TLSv1.2","135","[TCP Previous segment not captured] , Application Data"
"484","2018-08-23 01:48:56.593916","192.168.2.3","216.58.197.3","TLSv1.2","104","Application Data"
"487","2018-08-23 01:48:56.604301","192.168.2.3","216.58.197.3","TLSv1.2","100","Application Data"
"488","2018-08-23 01:48:56.604471","192.168.2.3","216.58.197.3","TLSv1.2","104","Application Data"
"491","2018-08-23 01:48:57.063039","192.168.2.3","216.58.197.14","TCP","66","41144  >  443 [ACK] Seq=1 Ack=1 Win=296 Len=0 TSval=7761920 TSecr=932475475"
"494","2018-08-23 01:48:58.206203","192.168.2.3","216.58.197.14","TLSv1.2","162","[TCP Previous segment not captured] , Application Data"
"495","2018-08-23 01:48:58.206208","192.168.2.3","216.58.197.14","TLSv1.2","104","Application Data"
"496","2018-08-23 01:48:58.206337","192.168.2.3","216.58.197.14","TLSv1.2","580","Application Data"
"501","2018-08-23 01:48:58.242281","192.168.2.3","216.58.197.14","TCP","66","41142  >  443 [ACK] Seq=650 Ack=39 Win=312 Len=0 TSval=7762038 TSecr=932521740"
"506","2018-08-23 01:48:58.294082","192.168.2.3","216.58.197.14","TCP","66","41142  >  443 [ACK] Seq=650 Ack=107 Win=312 Len=0 TSval=7762043 TSecr=932521821"
"507","2018-08-23 01:48:58.295094","192.168.2.3","216.58.197.14","TCP","66","41142  >  443 [ACK] Seq=650 Ack=170 Win=312 Len=0 TSval=7762043 TSecr=932521821"
"508","2018-08-23 01:48:58.299002","192.168.2.3","216.58.197.14","TCP","66","41142  >  443 [ACK] Seq=650 Ack=402 Win=329 Len=0 TSval=7762043 TSecr=932521821"
"509","2018-08-23 01:48:58.299233","192.168.2.3","216.58.197.14","TCP","66","41142  >  443 [ACK] Seq=650 Ack=440 Win=329 Len=0 TSval=7762043 TSecr=932521822"
"510","2018-08-23 01:48:58.299737","192.168.2.3","216.58.197.14","TLSv1.2","104","Application Data"
