"No.","Time","Source","Destination","Protocol","Length","Info"
"1","2018-08-23 01:55:53.386716","192.168.2.3","216.58.197.4","TCP","66","34236  >  443 [ACK] Seq=1 Ack=1 Win=1828 Len=0 TSval=7803552 TSecr=759883146"
"3","2018-08-23 01:55:53.620412","192.168.2.3","216.58.197.4","TLSv1.2","156","[TCP Previous segment not captured] , Application Data"
"4","2018-08-23 01:55:53.620417","192.168.2.3","216.58.197.4","TLSv1.2","104","Application Data"
"5","2018-08-23 01:55:53.620933","192.168.2.3","216.58.197.4","TLSv1.2","159","Application Data"
"9","2018-08-23 01:55:53.625726","192.168.2.3","216.58.197.4","TCP","66","34236  >  443 [ACK] Seq=223 Ack=39 Win=1828 Len=0 TSval=7803575 TSecr=759928421"
"10","2018-08-23 01:55:53.632222","192.168.2.3","216.58.197.4","TCP","1434","34236  >  443 [ACK] Seq=223 Ack=39 Win=1828 Len=1368 TSval=7803576 TSecr=759928421 [TCP segment of a reassembled PDU]"
"11","2018-08-23 01:55:53.632627","192.168.2.3","216.58.197.4","TCP","1434","34236  >  443 [ACK] Seq=1591 Ack=39 Win=1828 Len=1368 TSval=7803576 TSecr=759928421 [TCP segment of a reassembled PDU]"
"12","2018-08-23 01:55:53.632630","192.168.2.3","216.58.197.4","TLSv1.2","212","Application Data"
"13","2018-08-23 01:55:53.632631","192.168.2.3","216.58.197.4","TCP","1434","34236  >  443 [ACK] Seq=3105 Ack=39 Win=1828 Len=1368 TSval=7803576 TSecr=759928421 [TCP segment of a reassembled PDU]"
"14","2018-08-23 01:55:53.632836","192.168.2.3","216.58.197.4","TLSv1.2","183","Application Data"
"15","2018-08-23 01:55:53.633406","192.168.2.3","216.58.197.4","TCP","1434","34236  >  443 [ACK] Seq=4590 Ack=39 Win=1828 Len=1368 TSval=7803576 TSecr=759928421 [TCP segment of a reassembled PDU]"
"16","2018-08-23 01:55:53.633410","192.168.2.3","216.58.197.4","TCP","1434","34236  >  443 [ACK] Seq=5958 Ack=39 Win=1828 Len=1368 TSval=7803576 TSecr=759928421 [TCP segment of a reassembled PDU]"
"17","2018-08-23 01:55:53.633411","192.168.2.3","216.58.197.4","TLSv1.2","212","Application Data"
"18","2018-08-23 01:55:53.633826","192.168.2.3","216.58.197.4","TCP","1434","34236  >  443 [ACK] Seq=7472 Ack=39 Win=1828 Len=1368 TSval=7803576 TSecr=759928421 [TCP segment of a reassembled PDU]"
"23","2018-08-23 01:55:53.637978","192.168.2.3","216.58.197.4","TLSv1.2","1434","Application Data [TCP segment of a reassembled PDU]"
"25","2018-08-23 01:55:53.638343","192.168.2.3","216.58.197.4","TCP","1434","34236  >  443 [ACK] Seq=10208 Ack=39 Win=1828 Len=1368 TSval=7803577 TSecr=759928432 [TCP segment of a reassembled PDU]"
"26","2018-08-23 01:55:53.638712","192.168.2.3","216.58.197.4","TLSv1.2","1434","Application Data [TCP segment of a reassembled PDU]"
"27","2018-08-23 01:55:53.639139","192.168.2.3","216.58.197.4","TLSv1.2","1434","Application Data [TCP segment of a reassembled PDU]"
"28","2018-08-23 01:55:53.639143","192.168.2.3","216.58.197.4","TCP","1434","34236  >  443 [ACK] Seq=14312 Ack=39 Win=1828 Len=1368 TSval=7803577 TSecr=759928433 [TCP segment of a reassembled PDU]"
"29","2018-08-23 01:55:53.639538","192.168.2.3","216.58.197.4","TLSv1.2","1434","Application Data [TCP segment of a reassembled PDU]"
"30","2018-08-23 01:55:53.639774","192.168.2.3","216.58.197.4","TLSv1.2","1434","Application Data [TCP segment of a reassembled PDU]"
"31","2018-08-23 01:55:53.640003","192.168.2.3","216.58.197.4","TCP","1434","34236  >  443 [ACK] Seq=18416 Ack=39 Win=1828 Len=1368 TSval=7803577 TSecr=759928433 [TCP segment of a reassembled PDU]"
"32","2018-08-23 01:55:53.640139","192.168.2.3","216.58.197.4","TLSv1.2","1434","Application Data [TCP segment of a reassembled PDU]"
"33","2018-08-23 01:55:53.640505","192.168.2.3","216.58.197.4","TLSv1.2","1434","Application Data [TCP segment of a reassembled PDU]"
"34","2018-08-23 01:55:53.640508","192.168.2.3","216.58.197.4","TCP","1434","34236  >  443 [ACK] Seq=22520 Ack=39 Win=1828 Len=1368 TSval=7803577 TSecr=759928434 [TCP segment of a reassembled PDU]"
"35","2018-08-23 01:55:53.641061","192.168.2.3","216.58.197.4","TLSv1.2","1434","Application Data [TCP segment of a reassembled PDU]"
"36","2018-08-23 01:55:53.641064","192.168.2.3","216.58.197.4","TLSv1.2","1434","Application Data [TCP segment of a reassembled PDU]"
"37","2018-08-23 01:55:53.641457","192.168.2.3","216.58.197.4","TCP","1434","34236  >  443 [ACK] Seq=26624 Ack=39 Win=1828 Len=1368 TSval=7803577 TSecr=759928434 [TCP segment of a reassembled PDU]"
"38","2018-08-23 01:55:53.641460","192.168.2.3","216.58.197.4","TLSv1.2","1434","Application Data [TCP segment of a reassembled PDU]"
"42","2018-08-23 01:55:53.644245","192.168.2.3","216.58.197.4","TLSv1.2","1434","Application Data [TCP segment of a reassembled PDU]"
"43","2018-08-23 01:55:53.644247","192.168.2.3","216.58.197.4","TCP","1434","34236  >  443 [ACK] Seq=30728 Ack=39 Win=1828 Len=1368 TSval=7803577 TSecr=759928438 [TCP segment of a reassembled PDU]"
"45","2018-08-23 01:55:53.644653","192.168.2.3","216.58.197.4","TCP","1434","34236  >  443 [ACK] Seq=32096 Ack=39 Win=1828 Len=1368 TSval=7803577 TSecr=759928438 [TCP segment of a reassembled PDU]"
"47","2018-08-23 01:55:53.645145","192.168.2.3","216.58.197.4","TLSv1.2","1434","Application Data [TCP segment of a reassembled PDU]"
"48","2018-08-23 01:55:53.645148","192.168.2.3","216.58.197.4","TLSv1.2","1434","Application Data [TCP segment of a reassembled PDU]"
"50","2018-08-23 01:55:53.645283","192.168.2.3","216.58.197.4","TCP","1434","34236  >  443 [ACK] Seq=36200 Ack=39 Win=1828 Len=1368 TSval=7803577 TSecr=759928439 [TCP segment of a reassembled PDU]"
"52","2018-08-23 01:55:53.647927","192.168.2.3","216.58.197.4","TLSv1.2","1434","Application Data [TCP segment of a reassembled PDU]"
"53","2018-08-23 01:55:53.647930","192.168.2.3","216.58.197.4","TLSv1.2","1434","Application Data [TCP segment of a reassembled PDU]"
"54","2018-08-23 01:55:53.648094","192.168.2.3","216.58.197.4","TCP","1434","34236  >  443 [ACK] Seq=40304 Ack=39 Win=1828 Len=1368 TSval=7803577 TSecr=759928440 [TCP segment of a reassembled PDU]"
"55","2018-08-23 01:55:53.648220","192.168.2.3","216.58.197.4","TLSv1.2","1434","Application Data [TCP segment of a reassembled PDU]"
"56","2018-08-23 01:55:53.648533","192.168.2.3","216.58.197.4","TLSv1.2","1434","Application Data [TCP segment of a reassembled PDU]"
"57","2018-08-23 01:55:53.648556","192.168.2.3","216.58.197.4","TCP","1434","34236  >  443 [ACK] Seq=44408 Ack=39 Win=1828 Len=1368 TSval=7803577 TSecr=759928441 [TCP segment of a reassembled PDU]"
"59","2018-08-23 01:55:53.648769","192.168.2.3","216.58.197.4","TLSv1.2","1434","Application Data [TCP segment of a reassembled PDU]"
"61","2018-08-23 01:55:53.649152","192.168.2.3","216.58.197.4","TLSv1.2","1434","Application Data [TCP segment of a reassembled PDU]"
"63","2018-08-23 01:55:53.649691","192.168.2.3","216.58.197.4","TCP","1434","34236  >  443 [PSH, ACK] Seq=48512 Ack=39 Win=1828 Len=1368 TSval=7803578 TSecr=759928441 [TCP segment of a reassembled PDU]"
"64","2018-08-23 01:55:53.649694","192.168.2.3","216.58.197.4","TLSv1.2","1434","Application Data [TCP segment of a reassembled PDU]"
"65","2018-08-23 01:55:53.649894","192.168.2.3","216.58.197.4","TLSv1.2","1434","Application Data [TCP segment of a reassembled PDU]"
"66","2018-08-23 01:55:53.650132","192.168.2.3","216.58.197.4","TCP","1434","34236  >  443 [ACK] Seq=52616 Ack=39 Win=1828 Len=1368 TSval=7803578 TSecr=759928442 [TCP segment of a reassembled PDU]"
"67","2018-08-23 01:55:53.650388","192.168.2.3","216.58.197.4","TLSv1.2","1434","Application Data [TCP segment of a reassembled PDU]"
"68","2018-08-23 01:55:53.651025","192.168.2.3","216.58.197.4","TLSv1.2","1434","Application Data [TCP segment of a reassembled PDU]"
"69","2018-08-23 01:55:53.651029","192.168.2.3","216.58.197.4","TLSv1.2","1434","Application Data [TCP segment of a reassembled PDU]"
"70","2018-08-23 01:55:53.651147","192.168.2.3","216.58.197.4","TCP","1434","34236  >  443 [ACK] Seq=58088 Ack=39 Win=1828 Len=1368 TSval=7803578 TSecr=759928445 [TCP segment of a reassembled PDU]"
"71","2018-08-23 01:55:53.651308","192.168.2.3","216.58.197.4","TLSv1.2","1434","Application Data [TCP segment of a reassembled PDU]"
"72","2018-08-23 01:55:53.651540","192.168.2.3","216.58.197.4","TLSv1.2","564","Application Data"
"82","2018-08-23 01:55:53.683085","192.168.2.3","216.58.197.4","TCP","1434","34236  >  443 [ACK] Seq=61322 Ack=39 Win=1828 Len=1368 TSval=7803581 TSecr=759928451 [TCP segment of a reassembled PDU]"
"83","2018-08-23 01:55:53.683397","192.168.2.3","216.58.197.4","TCP","1434","34236  >  443 [ACK] Seq=62690 Ack=39 Win=1828 Len=1368 TSval=7803581 TSecr=759928451 [TCP segment of a reassembled PDU]"
"84","2018-08-23 01:55:53.683400","192.168.2.3","216.58.197.4","TLSv1.2","212","Application Data"
"85","2018-08-23 01:55:53.683967","192.168.2.3","216.58.197.4","TCP","1434","34236  >  443 [ACK] Seq=64204 Ack=39 Win=1828 Len=1368 TSval=7803581 TSecr=759928451 [TCP segment of a reassembled PDU]"
"86","2018-08-23 01:55:53.683970","192.168.2.3","216.58.197.4","TLSv1.2","155","Application Data"
"90","2018-08-23 01:55:53.789942","192.168.2.3","216.58.197.4","TCP","1434","34236  >  443 [ACK] Seq=65661 Ack=39 Win=1828 Len=1368 TSval=7803592 TSecr=759928484 [TCP segment of a reassembled PDU]"
"91","2018-08-23 01:55:53.790299","192.168.2.3","216.58.197.4","TCP","1434","34236  >  443 [ACK] Seq=67029 Ack=39 Win=1828 Len=1368 TSval=7803592 TSecr=759928484 [TCP segment of a reassembled PDU]"
"92","2018-08-23 01:55:53.790302","192.168.2.3","216.58.197.4","TLSv1.2","212","Application Data"
"93","2018-08-23 01:55:53.790558","192.168.2.3","216.58.197.4","TCP","1434","34236  >  443 [ACK] Seq=68543 Ack=39 Win=1828 Len=1368 TSval=7803592 TSecr=759928484 [TCP segment of a reassembled PDU]"
"94","2018-08-23 01:55:53.790562","192.168.2.3","216.58.197.4","TLSv1.2","155","Application Data"
"98","2018-08-23 01:55:53.874989","192.168.2.3","216.58.197.4","TCP","1434","34236  >  443 [ACK] Seq=70000 Ack=39 Win=1828 Len=1368 TSval=7803600 TSecr=759928630 [TCP segment of a reassembled PDU]"
"99","2018-08-23 01:55:53.875312","192.168.2.3","216.58.197.4","TCP","1434","34236  >  443 [ACK] Seq=71368 Ack=39 Win=1828 Len=1368 TSval=7803600 TSecr=759928630 [TCP segment of a reassembled PDU]"
"100","2018-08-23 01:55:53.875316","192.168.2.3","216.58.197.4","TLSv1.2","212","Application Data"
"101","2018-08-23 01:55:53.875691","192.168.2.3","216.58.197.4","TCP","1434","34236  >  443 [ACK] Seq=72882 Ack=39 Win=1828 Len=1368 TSval=7803600 TSecr=759928630 [TCP segment of a reassembled PDU]"
"102","2018-08-23 01:55:53.875695","192.168.2.3","216.58.197.4","TLSv1.2","155","Application Data"
"106","2018-08-23 01:55:53.970865","192.168.2.3","216.58.197.4","TCP","1434","34236  >  443 [ACK] Seq=74339 Ack=39 Win=1828 Len=1368 TSval=7803610 TSecr=759928676 [TCP segment of a reassembled PDU]"
"109","2018-08-23 01:55:53.971140","192.168.2.3","216.58.197.4","TCP","1434","34236  >  443 [ACK] Seq=75707 Ack=39 Win=1828 Len=1368 TSval=7803610 TSecr=759928676 [TCP segment of a reassembled PDU]"
"110","2018-08-23 01:55:53.971142","192.168.2.3","216.58.197.4","TLSv1.2","212","Application Data"
"111","2018-08-23 01:55:53.971924","192.168.2.3","216.58.197.4","TCP","1434","34236  >  443 [ACK] Seq=77221 Ack=39 Win=1828 Len=1368 TSval=7803610 TSecr=759928676 [TCP segment of a reassembled PDU]"
"112","2018-08-23 01:55:53.971927","192.168.2.3","216.58.197.4","TLSv1.2","155","Application Data"
"113","2018-08-23 01:55:53.972652","192.168.2.3","216.58.197.4","TCP","66","34236  >  443 [ACK] Seq=78678 Ack=334 Win=1828 Len=0 TSval=7803610 TSecr=759928767"
"118","2018-08-23 01:55:54.006681","192.168.2.3","216.58.197.4","TCP","66","34236  >  443 [ACK] Seq=78678 Ack=452 Win=1828 Len=0 TSval=7803614 TSecr=759928770"
"119","2018-08-23 01:55:54.079226","192.168.2.3","216.58.197.4","TCP","1434","34236  >  443 [ACK] Seq=78678 Ack=452 Win=1828 Len=1368 TSval=7803621 TSecr=759928770 [TCP segment of a reassembled PDU]"
"120","2018-08-23 01:55:54.079232","192.168.2.3","216.58.197.4","TCP","1434","34236  >  443 [ACK] Seq=80046 Ack=452 Win=1828 Len=1368 TSval=7803621 TSecr=759928770 [TCP segment of a reassembled PDU]"
"121","2018-08-23 01:55:54.079346","192.168.2.3","216.58.197.4","TLSv1.2","212","Application Data"
"122","2018-08-23 01:55:54.083161","192.168.2.3","216.58.197.4","TCP","1434","34236  >  443 [ACK] Seq=81560 Ack=452 Win=1828 Len=1368 TSval=7803621 TSecr=759928770 [TCP segment of a reassembled PDU]"
"123","2018-08-23 01:55:54.083164","192.168.2.3","216.58.197.4","TLSv1.2","155","Application Data"
"127","2018-08-23 01:55:54.105203","192.168.2.3","216.58.197.4","TCP","66","34236  >  443 [ACK] Seq=83017 Ack=700 Win=1828 Len=0 TSval=7803623 TSecr=759928880"
"128","2018-08-23 01:55:54.184107","192.168.2.3","216.58.197.4","TCP","1434","34236  >  443 [ACK] Seq=83017 Ack=700 Win=1828 Len=1368 TSval=7803630 TSecr=759928883 [TCP segment of a reassembled PDU]"
"129","2018-08-23 01:55:54.184114","192.168.2.3","216.58.197.4","TCP","1434","34236  >  443 [ACK] Seq=84385 Ack=700 Win=1828 Len=1368 TSval=7803630 TSecr=759928883 [TCP segment of a reassembled PDU]"
"130","2018-08-23 01:55:54.184115","192.168.2.3","216.58.197.4","TLSv1.2","212","Application Data"
"131","2018-08-23 01:55:54.184455","192.168.2.3","216.58.197.4","TCP","1434","34236  >  443 [ACK] Seq=85899 Ack=700 Win=1828 Len=1368 TSval=7803630 TSecr=759928883 [TCP segment of a reassembled PDU]"
"132","2018-08-23 01:55:54.184459","192.168.2.3","216.58.197.4","TLSv1.2","155","Application Data"
"137","2018-08-23 01:55:54.236692","192.168.2.3","216.58.197.4","TCP","66","34236  >  443 [ACK] Seq=87356 Ack=949 Win=1828 Len=0 TSval=7803636 TSecr=759929026"
"138","2018-08-23 01:55:54.270714","192.168.2.3","216.58.197.4","TCP","1434","34236  >  443 [ACK] Seq=87356 Ack=949 Win=1828 Len=1368 TSval=7803640 TSecr=759929026 [TCP segment of a reassembled PDU]"
"139","2018-08-23 01:55:54.270720","192.168.2.3","216.58.197.4","TCP","1434","34236  >  443 [ACK] Seq=88724 Ack=949 Win=1828 Len=1368 TSval=7803640 TSecr=759929026 [TCP segment of a reassembled PDU]"
"140","2018-08-23 01:55:54.270722","192.168.2.3","216.58.197.4","TLSv1.2","212","Application Data"
"141","2018-08-23 01:55:54.270971","192.168.2.3","216.58.197.4","TCP","1434","34236  >  443 [ACK] Seq=90238 Ack=949 Win=1828 Len=1368 TSval=7803640 TSecr=759929026 [TCP segment of a reassembled PDU]"
"142","2018-08-23 01:55:54.270973","192.168.2.3","216.58.197.4","TLSv1.2","155","Application Data"
"146","2018-08-23 01:55:54.367201","192.168.2.3","216.58.197.4","TCP","1434","34236  >  443 [ACK] Seq=91695 Ack=949 Win=1828 Len=1368 TSval=7803650 TSecr=759929071 [TCP segment of a reassembled PDU]"
"147","2018-08-23 01:55:54.367552","192.168.2.3","216.58.197.4","TCP","1434","34236  >  443 [ACK] Seq=93063 Ack=949 Win=1828 Len=1368 TSval=7803650 TSecr=759929071 [TCP segment of a reassembled PDU]"
"148","2018-08-23 01:55:54.367556","192.168.2.3","216.58.197.4","TLSv1.2","212","Application Data"
"149","2018-08-23 01:55:54.367920","192.168.2.3","216.58.197.4","TCP","1434","34236  >  443 [ACK] Seq=94577 Ack=949 Win=1828 Len=1368 TSval=7803650 TSecr=759929071 [TCP segment of a reassembled PDU]"
"150","2018-08-23 01:55:54.367923","192.168.2.3","216.58.197.4","TLSv1.2","155","Application Data"
"154","2018-08-23 01:55:54.463074","192.168.2.3","216.58.197.4","TCP","1434","34236  >  443 [ACK] Seq=96034 Ack=949 Win=1828 Len=1368 TSval=7803659 TSecr=759929168 [TCP segment of a reassembled PDU]"
"155","2018-08-23 01:55:54.463377","192.168.2.3","216.58.197.4","TCP","1434","34236  >  443 [ACK] Seq=97402 Ack=949 Win=1828 Len=1368 TSval=7803659 TSecr=759929168 [TCP segment of a reassembled PDU]"
"156","2018-08-23 01:55:54.463380","192.168.2.3","216.58.197.4","TLSv1.2","212","Application Data"
"157","2018-08-23 01:55:54.463605","192.168.2.3","216.58.197.4","TCP","1434","34236  >  443 [ACK] Seq=98916 Ack=949 Win=1828 Len=1368 TSval=7803659 TSecr=759929168 [TCP segment of a reassembled PDU]"
"158","2018-08-23 01:55:54.463606","192.168.2.3","216.58.197.4","TLSv1.2","155","Application Data"
"162","2018-08-23 01:55:54.577451","192.168.2.3","216.58.197.4","TCP","1434","34236  >  443 [ACK] Seq=100373 Ack=949 Win=1828 Len=1368 TSval=7803670 TSecr=759929264 [TCP segment of a reassembled PDU]"
"163","2018-08-23 01:55:54.577457","192.168.2.3","216.58.197.4","TCP","1434","34236  >  443 [ACK] Seq=101741 Ack=949 Win=1828 Len=1368 TSval=7803670 TSecr=759929264 [TCP segment of a reassembled PDU]"
"164","2018-08-23 01:55:54.577458","192.168.2.3","216.58.197.4","TLSv1.2","212","Application Data"
"165","2018-08-23 01:55:54.577584","192.168.2.3","216.58.197.4","TCP","1434","34236  >  443 [ACK] Seq=103255 Ack=949 Win=1828 Len=1368 TSval=7803670 TSecr=759929264 [TCP segment of a reassembled PDU]"
"166","2018-08-23 01:55:54.577790","192.168.2.3","216.58.197.4","TLSv1.2","155","Application Data"
"171","2018-08-23 01:55:54.653088","192.168.2.3","216.58.197.4","TCP","1434","34236  >  443 [ACK] Seq=104712 Ack=949 Win=1828 Len=1368 TSval=7803678 TSecr=759929378 [TCP segment of a reassembled PDU]"
"172","2018-08-23 01:55:54.653511","192.168.2.3","216.58.197.4","TCP","1434","34236  >  443 [ACK] Seq=106080 Ack=949 Win=1828 Len=1368 TSval=7803678 TSecr=759929378 [TCP segment of a reassembled PDU]"
"173","2018-08-23 01:55:54.653514","192.168.2.3","216.58.197.4","TLSv1.2","212","Application Data"
"174","2018-08-23 01:55:54.654223","192.168.2.3","216.58.197.4","TCP","1434","34236  >  443 [ACK] Seq=107594 Ack=949 Win=1828 Len=1368 TSval=7803678 TSecr=759929378 [TCP segment of a reassembled PDU]"
"175","2018-08-23 01:55:54.654225","192.168.2.3","216.58.197.4","TLSv1.2","155","Application Data"
"179","2018-08-23 01:55:54.749630","192.168.2.3","216.58.197.4","TCP","1434","34236  >  443 [ACK] Seq=109051 Ack=949 Win=1828 Len=1368 TSval=7803688 TSecr=759929454 [TCP segment of a reassembled PDU]"
"180","2018-08-23 01:55:54.749998","192.168.2.3","216.58.197.4","TCP","1434","34236  >  443 [ACK] Seq=110419 Ack=949 Win=1828 Len=1368 TSval=7803688 TSecr=759929454 [TCP segment of a reassembled PDU]"
"181","2018-08-23 01:55:54.750002","192.168.2.3","216.58.197.4","TLSv1.2","212","Application Data"
"182","2018-08-23 01:55:54.750469","192.168.2.3","216.58.197.4","TCP","1434","34236  >  443 [ACK] Seq=111933 Ack=949 Win=1828 Len=1368 TSval=7803688 TSecr=759929454 [TCP segment of a reassembled PDU]"
"183","2018-08-23 01:55:54.750472","192.168.2.3","216.58.197.4","TLSv1.2","155","Application Data"
"187","2018-08-23 01:55:54.835288","192.168.2.3","216.58.197.4","TCP","1434","34236  >  443 [ACK] Seq=113390 Ack=949 Win=1828 Len=1368 TSval=7803696 TSecr=759929551 [TCP segment of a reassembled PDU]"
"188","2018-08-23 01:55:54.835293","192.168.2.3","216.58.197.4","TCP","1434","34236  >  443 [ACK] Seq=114758 Ack=949 Win=1828 Len=1368 TSval=7803696 TSecr=759929551 [TCP segment of a reassembled PDU]"
"189","2018-08-23 01:55:54.835416","192.168.2.3","216.58.197.4","TLSv1.2","212","Application Data"
"190","2018-08-23 01:55:54.835878","192.168.2.3","216.58.197.4","TCP","1434","34236  >  443 [ACK] Seq=116272 Ack=949 Win=1828 Len=1368 TSval=7803696 TSecr=759929551 [TCP segment of a reassembled PDU]"
"191","2018-08-23 01:55:54.835882","192.168.2.3","216.58.197.4","TLSv1.2","155","Application Data"
"195","2018-08-23 01:55:54.928965","192.168.2.3","216.58.197.4","TCP","1434","34236  >  443 [ACK] Seq=117729 Ack=949 Win=1828 Len=1368 TSval=7803706 TSecr=759929636 [TCP segment of a reassembled PDU]"
"196","2018-08-23 01:55:54.929315","192.168.2.3","216.58.197.4","TCP","1434","34236  >  443 [ACK] Seq=119097 Ack=949 Win=1828 Len=1368 TSval=7803706 TSecr=759929636 [TCP segment of a reassembled PDU]"
"197","2018-08-23 01:55:54.929318","192.168.2.3","216.58.197.4","TLSv1.2","212","Application Data"
"198","2018-08-23 01:55:54.929319","192.168.2.3","216.58.197.4","TCP","1434","34236  >  443 [ACK] Seq=120611 Ack=949 Win=1828 Len=1368 TSval=7803706 TSecr=759929636 [TCP segment of a reassembled PDU]"
"199","2018-08-23 01:55:54.929320","192.168.2.3","216.58.197.4","TLSv1.2","155","Application Data"
"204","2018-08-23 01:55:54.967967","192.168.2.3","216.58.197.4","TCP","66","34236  >  443 [ACK] Seq=122068 Ack=1093 Win=1828 Len=0 TSval=7803710 TSecr=759929763"
"206","2018-08-23 01:55:54.975797","192.168.2.3","216.58.197.4","TCP","66","34236  >  443 [ACK] Seq=122068 Ack=1171 Win=1828 Len=0 TSval=7803710 TSecr=759929771"
"207","2018-08-23 01:55:55.024574","192.168.2.3","216.58.197.4","TCP","1434","34236  >  443 [ACK] Seq=122068 Ack=1171 Win=1828 Len=1368 TSval=7803715 TSecr=759929771 [TCP segment of a reassembled PDU]"
"208","2018-08-23 01:55:55.024913","192.168.2.3","216.58.197.4","TCP","1434","34236  >  443 [ACK] Seq=123436 Ack=1171 Win=1828 Len=1368 TSval=7803715 TSecr=759929771 [TCP segment of a reassembled PDU]"
"209","2018-08-23 01:55:55.024915","192.168.2.3","216.58.197.4","TLSv1.2","212","Application Data"
"210","2018-08-23 01:55:55.024916","192.168.2.3","216.58.197.4","TCP","1434","34236  >  443 [ACK] Seq=124950 Ack=1171 Win=1828 Len=1368 TSval=7803715 TSecr=759929771 [TCP segment of a reassembled PDU]"
"211","2018-08-23 01:55:55.025130","192.168.2.3","216.58.197.4","TLSv1.2","155","Application Data"
"215","2018-08-23 01:55:55.101528","192.168.2.3","216.58.197.4","TCP","1434","34236  >  443 [ACK] Seq=126407 Ack=1171 Win=1828 Len=1368 TSval=7803723 TSecr=759929865 [TCP segment of a reassembled PDU]"
"216","2018-08-23 01:55:55.101888","192.168.2.3","216.58.197.4","TCP","1434","34236  >  443 [ACK] Seq=127775 Ack=1171 Win=1828 Len=1368 TSval=7803723 TSecr=759929865 [TCP segment of a reassembled PDU]"
"217","2018-08-23 01:55:55.101892","192.168.2.3","216.58.197.4","TLSv1.2","212","Application Data"
"218","2018-08-23 01:55:55.102099","192.168.2.3","216.58.197.4","TCP","1434","34236  >  443 [ACK] Seq=129289 Ack=1171 Win=1828 Len=1368 TSval=7803723 TSecr=759929865 [TCP segment of a reassembled PDU]"
"219","2018-08-23 01:55:55.102102","192.168.2.3","216.58.197.4","TLSv1.2","155","Application Data"
"225","2018-08-23 01:55:55.164223","192.168.2.3","216.58.197.4","TCP","66","34236  >  443 [ACK] Seq=130746 Ack=1382 Win=1828 Len=0 TSval=7803729 TSecr=759929956"
"226","2018-08-23 01:55:55.164227","192.168.2.3","216.58.197.4","TCP","66","34236  >  443 [ACK] Seq=130746 Ack=1482 Win=1828 Len=0 TSval=7803729 TSecr=759929956"
"227","2018-08-23 01:55:55.218147","192.168.2.3","216.58.197.4","TCP","1434","34236  >  443 [ACK] Seq=130746 Ack=1482 Win=1828 Len=1368 TSval=7803735 TSecr=759929956 [TCP segment of a reassembled PDU]"
"228","2018-08-23 01:55:55.218595","192.168.2.3","216.58.197.4","TCP","1434","34236  >  443 [ACK] Seq=132114 Ack=1482 Win=1828 Len=1368 TSval=7803735 TSecr=759929956 [TCP segment of a reassembled PDU]"
"229","2018-08-23 01:55:55.218599","192.168.2.3","216.58.197.4","TLSv1.2","212","Application Data"
"230","2018-08-23 01:55:55.218600","192.168.2.3","216.58.197.4","TCP","1434","34236  >  443 [ACK] Seq=133628 Ack=1482 Win=1828 Len=1368 TSval=7803735 TSecr=759929956 [TCP segment of a reassembled PDU]"
"231","2018-08-23 01:55:55.218747","192.168.2.3","216.58.197.4","TLSv1.2","155","Application Data"
"235","2018-08-23 01:55:55.289881","192.168.2.3","216.58.197.4","TCP","1434","34236  >  443 [ACK] Seq=135085 Ack=1482 Win=1828 Len=1368 TSval=7803741 TSecr=759930019 [TCP segment of a reassembled PDU]"
"236","2018-08-23 01:55:55.289887","192.168.2.3","216.58.197.4","TCP","1434","34236  >  443 [ACK] Seq=136453 Ack=1482 Win=1828 Len=1368 TSval=7803741 TSecr=759930019 [TCP segment of a reassembled PDU]"
"237","2018-08-23 01:55:55.290016","192.168.2.3","216.58.197.4","TLSv1.2","212","Application Data"
"238","2018-08-23 01:55:55.290020","192.168.2.3","216.58.197.4","TCP","1434","34236  >  443 [ACK] Seq=137967 Ack=1482 Win=1828 Len=1368 TSval=7803741 TSecr=759930019 [TCP segment of a reassembled PDU]"
"239","2018-08-23 01:55:55.290269","192.168.2.3","216.58.197.4","TLSv1.2","155","Application Data"
"245","2018-08-23 01:55:55.348169","192.168.2.3","216.58.197.4","TCP","66","34236  >  443 [ACK] Seq=139424 Ack=1874 Win=1828 Len=0 TSval=7803748 TSecr=759930139"
"246","2018-08-23 01:55:55.379174","192.168.2.3","216.58.197.4","TCP","1434","34236  >  443 [ACK] Seq=139424 Ack=1874 Win=1828 Len=1368 TSval=7803751 TSecr=759930139 [TCP segment of a reassembled PDU]"
"247","2018-08-23 01:55:55.379677","192.168.2.3","216.58.197.4","TCP","1434","34236  >  443 [ACK] Seq=140792 Ack=1874 Win=1828 Len=1368 TSval=7803751 TSecr=759930139 [TCP segment of a reassembled PDU]"
"248","2018-08-23 01:55:55.379681","192.168.2.3","216.58.197.4","TLSv1.2","212","Application Data"
"249","2018-08-23 01:55:55.380480","192.168.2.3","216.58.197.4","TCP","1434","34236  >  443 [ACK] Seq=142306 Ack=1874 Win=1828 Len=1368 TSval=7803751 TSecr=759930139 [TCP segment of a reassembled PDU]"
"250","2018-08-23 01:55:55.380483","192.168.2.3","216.58.197.4","TLSv1.2","155","Application Data"
"254","2018-08-23 01:55:55.472395","192.168.2.3","216.58.197.4","TCP","1434","34236  >  443 [ACK] Seq=143763 Ack=1874 Win=1828 Len=1368 TSval=7803760 TSecr=759930181 [TCP segment of a reassembled PDU]"
"255","2018-08-23 01:55:55.472796","192.168.2.3","216.58.197.4","TCP","1434","34236  >  443 [ACK] Seq=145131 Ack=1874 Win=1828 Len=1368 TSval=7803760 TSecr=759930181 [TCP segment of a reassembled PDU]"
"256","2018-08-23 01:55:55.472801","192.168.2.3","216.58.197.4","TLSv1.2","212","Application Data"
"257","2018-08-23 01:55:55.472802","192.168.2.3","216.58.197.4","TCP","1434","34236  >  443 [ACK] Seq=146645 Ack=1874 Win=1828 Len=1368 TSval=7803760 TSecr=759930181 [TCP segment of a reassembled PDU]"
"258","2018-08-23 01:55:55.472931","192.168.2.3","216.58.197.4","TLSv1.2","155","Application Data"
"262","2018-08-23 01:55:55.552172","192.168.2.3","216.58.197.4","TCP","1434","34236  >  443 [ACK] Seq=148102 Ack=1874 Win=1828 Len=1368 TSval=7803768 TSecr=759930273 [TCP segment of a reassembled PDU]"
"263","2018-08-23 01:55:55.552178","192.168.2.3","216.58.197.4","TCP","1434","34236  >  443 [ACK] Seq=149470 Ack=1874 Win=1828 Len=1368 TSval=7803768 TSecr=759930273 [TCP segment of a reassembled PDU]"
"264","2018-08-23 01:55:55.552179","192.168.2.3","216.58.197.4","TLSv1.2","212","Application Data"
"265","2018-08-23 01:55:55.552489","192.168.2.3","216.58.197.4","TCP","1434","34236  >  443 [ACK] Seq=150984 Ack=1874 Win=1828 Len=1368 TSval=7803768 TSecr=759930273 [TCP segment of a reassembled PDU]"
"266","2018-08-23 01:55:55.552492","192.168.2.3","216.58.197.4","TLSv1.2","155","Application Data"
"272","2018-08-23 01:55:55.606139","192.168.2.3","216.58.197.4","TCP","66","34236  >  443 [ACK] Seq=152441 Ack=2173 Win=1828 Len=0 TSval=7803773 TSecr=759930400"
"273","2018-08-23 01:55:55.668501","192.168.2.3","216.58.197.4","TCP","1434","34236  >  443 [ACK] Seq=152441 Ack=2173 Win=1828 Len=1368 TSval=7803779 TSecr=759930400 [TCP segment of a reassembled PDU]"
"274","2018-08-23 01:55:55.668509","192.168.2.3","216.58.197.4","TCP","1434","34236  >  443 [ACK] Seq=153809 Ack=2173 Win=1828 Len=1368 TSval=7803779 TSecr=759930400 [TCP segment of a reassembled PDU]"
"275","2018-08-23 01:55:55.668609","192.168.2.3","216.58.197.4","TLSv1.2","212","Application Data"
"276","2018-08-23 01:55:55.668829","192.168.2.3","216.58.197.4","TCP","1434","34236  >  443 [ACK] Seq=155323 Ack=2173 Win=1828 Len=1368 TSval=7803779 TSecr=759930400 [TCP segment of a reassembled PDU]"
"277","2018-08-23 01:55:55.668832","192.168.2.3","216.58.197.4","TLSv1.2","155","Application Data"
"283","2018-08-23 01:55:55.735161","192.168.2.3","216.58.197.4","TCP","66","34236  >  443 [ACK] Seq=156780 Ack=2588 Win=1828 Len=0 TSval=7803786 TSecr=759930520"
"284","2018-08-23 01:55:55.764236","192.168.2.3","216.58.197.4","TCP","1434","34236  >  443 [ACK] Seq=156780 Ack=2588 Win=1828 Len=1368 TSval=7803789 TSecr=759930520 [TCP segment of a reassembled PDU]"
"285","2018-08-23 01:55:55.764241","192.168.2.3","216.58.197.4","TCP","1434","34236  >  443 [ACK] Seq=158148 Ack=2588 Win=1828 Len=1368 TSval=7803789 TSecr=759930520 [TCP segment of a reassembled PDU]"
"286","2018-08-23 01:55:55.764242","192.168.2.3","216.58.197.4","TLSv1.2","212","Application Data"
"287","2018-08-23 01:55:55.764340","192.168.2.3","216.58.197.4","TCP","1434","34236  >  443 [ACK] Seq=159662 Ack=2588 Win=1828 Len=1368 TSval=7803789 TSecr=759930520 [TCP segment of a reassembled PDU]"
"288","2018-08-23 01:55:55.764341","192.168.2.3","216.58.197.4","TLSv1.2","155","Application Data"
"293","2018-08-23 01:55:55.824010","192.168.2.3","216.58.197.4","TCP","66","34236  >  443 [ACK] Seq=161119 Ack=2954 Win=1828 Len=0 TSval=7803795 TSecr=759930619"
"294","2018-08-23 01:55:55.859785","192.168.2.3","216.58.197.4","TCP","1434","34236  >  443 [ACK] Seq=161119 Ack=2954 Win=1828 Len=1368 TSval=7803798 TSecr=759930619 [TCP segment of a reassembled PDU]"
"295","2018-08-23 01:55:55.859792","192.168.2.3","216.58.197.4","TCP","1434","34236  >  443 [ACK] Seq=162487 Ack=2954 Win=1828 Len=1368 TSval=7803798 TSecr=759930619 [TCP segment of a reassembled PDU]"
"296","2018-08-23 01:55:55.859921","192.168.2.3","216.58.197.4","TLSv1.2","212","Application Data"
"297","2018-08-23 01:55:55.860108","192.168.2.3","216.58.197.4","TCP","1434","34236  >  443 [ACK] Seq=164001 Ack=2954 Win=1828 Len=1368 TSval=7803798 TSecr=759930619 [TCP segment of a reassembled PDU]"
"298","2018-08-23 01:55:55.860110","192.168.2.3","216.58.197.4","TLSv1.2","155","Application Data"
"302","2018-08-23 01:55:55.952381","192.168.2.3","216.58.197.4","TCP","1434","34236  >  443 [ACK] Seq=165458 Ack=2954 Win=1828 Len=1368 TSval=7803808 TSecr=759930661 [TCP segment of a reassembled PDU]"
"303","2018-08-23 01:55:55.952681","192.168.2.3","216.58.197.4","TCP","1434","34236  >  443 [ACK] Seq=166826 Ack=2954 Win=1828 Len=1368 TSval=7803808 TSecr=759930661 [TCP segment of a reassembled PDU]"
"304","2018-08-23 01:55:55.952685","192.168.2.3","216.58.197.4","TLSv1.2","212","Application Data"
"305","2018-08-23 01:55:55.952890","192.168.2.3","216.58.197.4","TCP","1434","34236  >  443 [ACK] Seq=168340 Ack=2954 Win=1828 Len=1368 TSval=7803808 TSecr=759930661 [TCP segment of a reassembled PDU]"
"306","2018-08-23 01:55:55.952892","192.168.2.3","216.58.197.4","TLSv1.2","155","Application Data"
"312","2018-08-23 01:55:55.975776","192.168.2.3","216.58.197.4","TCP","66","34236  >  443 [ACK] Seq=169797 Ack=3355 Win=1828 Len=0 TSval=7803810 TSecr=759930763"
"315","2018-08-23 01:55:56.012800","192.168.2.3","216.58.197.4","TCP","66","34236  >  443 [ACK] Seq=169797 Ack=3643 Win=1828 Len=0 TSval=7803814 TSecr=759930804"
"316","2018-08-23 01:55:56.050574","192.168.2.3","216.58.197.4","TCP","1434","34236  >  443 [ACK] Seq=169797 Ack=3643 Win=1828 Len=1368 TSval=7803818 TSecr=759930804 [TCP segment of a reassembled PDU]"
"317","2018-08-23 01:55:56.050938","192.168.2.3","216.58.197.4","TCP","1434","34236  >  443 [ACK] Seq=171165 Ack=3643 Win=1828 Len=1368 TSval=7803818 TSecr=759930804 [TCP segment of a reassembled PDU]"
"318","2018-08-23 01:55:56.050941","192.168.2.3","216.58.197.4","TLSv1.2","212","Application Data"
"319","2018-08-23 01:55:56.050942","192.168.2.3","216.58.197.4","TCP","1434","34236  >  443 [ACK] Seq=172679 Ack=3643 Win=1828 Len=1368 TSval=7803818 TSecr=759930804 [TCP segment of a reassembled PDU]"
"320","2018-08-23 01:55:56.051028","192.168.2.3","216.58.197.4","TLSv1.2","155","Application Data"
"325","2018-08-23 01:55:56.104199","192.168.2.3","216.58.197.4","TCP","66","34236  >  443 [ACK] Seq=174136 Ack=4087 Win=1828 Len=0 TSval=7803823 TSecr=759930898"
"326","2018-08-23 01:55:56.147409","192.168.2.3","216.58.197.4","TCP","1434","34236  >  443 [ACK] Seq=174136 Ack=4087 Win=1828 Len=1368 TSval=7803828 TSecr=759930898 [TCP segment of a reassembled PDU]"
"327","2018-08-23 01:55:56.147691","192.168.2.3","216.58.197.4","TCP","1434","34236  >  443 [ACK] Seq=175504 Ack=4087 Win=1828 Len=1368 TSval=7803828 TSecr=759930898 [TCP segment of a reassembled PDU]"
"328","2018-08-23 01:55:56.147693","192.168.2.3","216.58.197.4","TLSv1.2","212","Application Data"
"329","2018-08-23 01:55:56.148157","192.168.2.3","216.58.197.4","TCP","1434","34236  >  443 [ACK] Seq=177018 Ack=4087 Win=1828 Len=1368 TSval=7803828 TSecr=759930898 [TCP segment of a reassembled PDU]"
"330","2018-08-23 01:55:56.148160","192.168.2.3","216.58.197.4","TLSv1.2","155","Application Data"
"334","2018-08-23 01:55:56.244456","192.168.2.3","216.58.197.4","TCP","1434","34236  >  443 [ACK] Seq=178475 Ack=4087 Win=1828 Len=1368 TSval=7803837 TSecr=759930988 [TCP segment of a reassembled PDU]"
"335","2018-08-23 01:55:56.244461","192.168.2.3","216.58.197.4","TCP","1434","34236  >  443 [ACK] Seq=179843 Ack=4087 Win=1828 Len=1368 TSval=7803837 TSecr=759930988 [TCP segment of a reassembled PDU]"
"336","2018-08-23 01:55:56.244463","192.168.2.3","216.58.197.4","TLSv1.2","212","Application Data"
"337","2018-08-23 01:55:56.244802","192.168.2.3","216.58.197.4","TCP","1434","34236  >  443 [ACK] Seq=181357 Ack=4087 Win=1828 Len=1368 TSval=7803837 TSecr=759930988 [TCP segment of a reassembled PDU]"
"338","2018-08-23 01:55:56.244806","192.168.2.3","216.58.197.4","TLSv1.2","155","Application Data"
"344","2018-08-23 01:55:56.305682","192.168.2.3","216.58.197.4","TCP","66","34236  >  443 [ACK] Seq=182814 Ack=4348 Win=1828 Len=0 TSval=7803843 TSecr=759931100"
"345","2018-08-23 01:55:56.339047","192.168.2.3","216.58.197.4","TCP","1434","34236  >  443 [ACK] Seq=182814 Ack=4348 Win=1828 Len=1368 TSval=7803847 TSecr=759931100 [TCP segment of a reassembled PDU]"
"346","2018-08-23 01:55:56.339053","192.168.2.3","216.58.197.4","TCP","1434","34236  >  443 [ACK] Seq=184182 Ack=4348 Win=1828 Len=1368 TSval=7803847 TSecr=759931100 [TCP segment of a reassembled PDU]"
"347","2018-08-23 01:55:56.339054","192.168.2.3","216.58.197.4","TLSv1.2","212","Application Data"
"349","2018-08-23 01:55:56.344612","192.168.2.3","216.58.197.4","TCP","1434","34236  >  443 [ACK] Seq=185696 Ack=4348 Win=1828 Len=1368 TSval=7803847 TSecr=759931100 [TCP segment of a reassembled PDU]"
"350","2018-08-23 01:55:56.344617","192.168.2.3","216.58.197.4","TLSv1.2","155","Application Data"
"354","2018-08-23 01:55:56.406419","192.168.2.3","216.58.197.4","TCP","66","34236  >  443 [ACK] Seq=187153 Ack=4722 Win=1828 Len=0 TSval=7803853 TSecr=759931201"
"355","2018-08-23 01:55:56.449293","192.168.2.3","216.58.197.4","TCP","1434","34236  >  443 [ACK] Seq=187153 Ack=4722 Win=1828 Len=1368 TSval=7803857 TSecr=759931201 [TCP segment of a reassembled PDU]"
"356","2018-08-23 01:55:56.449299","192.168.2.3","216.58.197.4","TCP","1434","34236  >  443 [ACK] Seq=188521 Ack=4722 Win=1828 Len=1368 TSval=7803857 TSecr=759931201 [TCP segment of a reassembled PDU]"
"357","2018-08-23 01:55:56.449300","192.168.2.3","216.58.197.4","TLSv1.2","212","Application Data"
"358","2018-08-23 01:55:56.449536","192.168.2.3","216.58.197.4","TCP","1434","34236  >  443 [ACK] Seq=190035 Ack=4722 Win=1828 Len=1368 TSval=7803858 TSecr=759931201 [TCP segment of a reassembled PDU]"
"359","2018-08-23 01:55:56.449551","192.168.2.3","216.58.197.4","TLSv1.2","155","Application Data"
"363","2018-08-23 01:55:56.531101","192.168.2.3","216.58.197.4","TCP","1434","34236  >  443 [ACK] Seq=191492 Ack=4722 Win=1828 Len=1368 TSval=7803866 TSecr=759931250 [TCP segment of a reassembled PDU]"
"364","2018-08-23 01:55:56.531624","192.168.2.3","216.58.197.4","TCP","1434","34236  >  443 [ACK] Seq=192860 Ack=4722 Win=1828 Len=1368 TSval=7803866 TSecr=759931250 [TCP segment of a reassembled PDU]"
"365","2018-08-23 01:55:56.531625","192.168.2.3","216.58.197.4","TLSv1.2","212","Application Data"
"366","2018-08-23 01:55:56.531626","192.168.2.3","216.58.197.4","TCP","1434","34236  >  443 [ACK] Seq=194374 Ack=4722 Win=1828 Len=1368 TSval=7803866 TSecr=759931250 [TCP segment of a reassembled PDU]"
"367","2018-08-23 01:55:56.531627","192.168.2.3","216.58.197.4","TLSv1.2","155","Application Data"
"370","2018-08-23 01:55:56.636933","192.168.2.3","216.58.197.4","TCP","1434","34236  >  443 [ACK] Seq=195831 Ack=4722 Win=1828 Len=1368 TSval=7803876 TSecr=759931332 [TCP segment of a reassembled PDU]"
"371","2018-08-23 01:55:56.637190","192.168.2.3","216.58.197.4","TCP","1434","34236  >  443 [ACK] Seq=197199 Ack=4722 Win=1828 Len=1368 TSval=7803876 TSecr=759931332 [TCP segment of a reassembled PDU]"
"372","2018-08-23 01:55:56.637193","192.168.2.3","216.58.197.4","TLSv1.2","212","Application Data"
"373","2018-08-23 01:55:56.637767","192.168.2.3","216.58.197.4","TLSv1.2","1311","Application Data"
"380","2018-08-23 01:55:56.684706","192.168.2.3","216.58.197.4","TCP","66","34236  >  443 [ACK] Seq=199958 Ack=5085 Win=1828 Len=0 TSval=7803881 TSecr=759931478"
"381","2018-08-23 01:55:56.721379","192.168.2.3","216.58.197.4","TCP","66","34236  >  443 [ACK] Seq=199958 Ack=5313 Win=1828 Len=0 TSval=7803885 TSecr=759931479"
"382","2018-08-23 01:55:56.756377","192.168.2.3","216.58.197.4","TCP","1434","34236  >  443 [ACK] Seq=199958 Ack=5313 Win=1828 Len=1368 TSval=7803888 TSecr=759931479 [TCP segment of a reassembled PDU]"
"383","2018-08-23 01:55:56.756383","192.168.2.3","216.58.197.4","TCP","1434","34236  >  443 [ACK] Seq=201326 Ack=5313 Win=1828 Len=1368 TSval=7803888 TSecr=759931479 [TCP segment of a reassembled PDU]"
"384","2018-08-23 01:55:56.756384","192.168.2.3","216.58.197.4","TLSv1.2","212","Application Data"
"385","2018-08-23 01:55:56.756644","192.168.2.3","216.58.197.4","TCP","1434","34236  >  443 [ACK] Seq=202840 Ack=5313 Win=1828 Len=1368 TSval=7803888 TSecr=759931479 [TCP segment of a reassembled PDU]"
"386","2018-08-23 01:55:56.756646","192.168.2.3","216.58.197.4","TLSv1.2","155","Application Data"
"389","2018-08-23 01:55:56.767034","192.168.2.3","216.58.197.3","TLSv1.2","135","Application Data"
"390","2018-08-23 01:55:56.767038","192.168.2.3","216.58.197.3","TLSv1.2","104","Application Data"
"393","2018-08-23 01:55:56.773498","192.168.2.3","216.58.197.3","TCP","66","43379  >  443 [ACK] Seq=108 Ack=117 Win=406 Len=0 TSval=7803890 TSecr=1765146769"
"394","2018-08-23 01:55:56.773502","192.168.2.3","216.58.197.3","TLSv1.2","100","Application Data"
"395","2018-08-23 01:55:56.773816","192.168.2.3","216.58.197.3","TLSv1.2","104","Application Data"
"398","2018-08-23 01:55:56.851202","192.168.2.3","216.58.197.4","TCP","1434","34236  >  443 [ACK] Seq=204297 Ack=5313 Win=1828 Len=1368 TSval=7803898 TSecr=759931597 [TCP segment of a reassembled PDU]"
"399","2018-08-23 01:55:56.856672","192.168.2.3","216.58.197.4","TCP","1434","34236  >  443 [ACK] Seq=205665 Ack=5313 Win=1828 Len=1368 TSval=7803898 TSecr=759931597 [TCP segment of a reassembled PDU]"
"400","2018-08-23 01:55:56.856678","192.168.2.3","216.58.197.4","TLSv1.2","212","Application Data"
"401","2018-08-23 01:55:56.856678","192.168.2.3","216.58.197.4","TCP","1434","34236  >  443 [ACK] Seq=207179 Ack=5313 Win=1828 Len=1368 TSval=7803898 TSecr=759931597 [TCP segment of a reassembled PDU]"
"402","2018-08-23 01:55:56.856759","192.168.2.3","216.58.197.4","TLSv1.2","155","Application Data"
"409","2018-08-23 01:55:56.959789","192.168.2.3","216.58.197.4","TCP","1434","34236  >  443 [ACK] Seq=208636 Ack=5313 Win=1828 Len=1368 TSval=7803909 TSecr=759931657 [TCP segment of a reassembled PDU]"
"410","2018-08-23 01:55:56.959794","192.168.2.3","216.58.197.4","TCP","1434","34236  >  443 [ACK] Seq=210004 Ack=5313 Win=1828 Len=1368 TSval=7803909 TSecr=759931657 [TCP segment of a reassembled PDU]"
"411","2018-08-23 01:55:56.959795","192.168.2.3","216.58.197.4","TLSv1.2","212","Application Data"
"412","2018-08-23 01:55:56.960079","192.168.2.3","216.58.197.4","TCP","1434","34236  >  443 [ACK] Seq=211518 Ack=5313 Win=1828 Len=1368 TSval=7803909 TSecr=759931657 [TCP segment of a reassembled PDU]"
"413","2018-08-23 01:55:56.960082","192.168.2.3","216.58.197.4","TLSv1.2","155","Application Data"
"414","2018-08-23 01:55:56.960083","192.168.2.3","216.58.197.4","TCP","66","34236  >  443 [ACK] Seq=212975 Ack=5453 Win=1828 Len=0 TSval=7803909 TSecr=759931753"
"415","2018-08-23 01:55:56.960083","192.168.2.3","216.58.197.4","TCP","66","34236  >  443 [ACK] Seq=212975 Ack=5668 Win=1828 Len=0 TSval=7803909 TSecr=759931754"
"416","2018-08-23 01:55:56.960378","192.168.2.3","216.58.197.4","TCP","66","34236  >  443 [ACK] Seq=212975 Ack=5794 Win=1828 Len=0 TSval=7803909 TSecr=759931754"
"421","2018-08-23 01:55:56.967862","192.168.2.3","216.58.197.4","TCP","66","34236  >  443 [ACK] Seq=212975 Ack=5960 Win=1828 Len=0 TSval=7803910 TSecr=759931763"
"423","2018-08-23 01:55:56.975809","192.168.2.3","216.58.197.4","TCP","66","34236  >  443 [ACK] Seq=212975 Ack=6108 Win=1828 Len=0 TSval=7803910 TSecr=759931771"
"424","2018-08-23 01:55:57.074137","192.168.2.3","216.58.197.4","TCP","1434","34236  >  443 [ACK] Seq=212975 Ack=6108 Win=1828 Len=1368 TSval=7803920 TSecr=759931771 [TCP segment of a reassembled PDU]"
"425","2018-08-23 01:55:57.074520","192.168.2.3","216.58.197.4","TCP","1434","34236  >  443 [ACK] Seq=214343 Ack=6108 Win=1828 Len=1368 TSval=7803920 TSecr=759931771 [TCP segment of a reassembled PDU]"
"426","2018-08-23 01:55:57.074522","192.168.2.3","216.58.197.4","TLSv1.2","212","Application Data"
"427","2018-08-23 01:55:57.074523","192.168.2.3","216.58.197.4","TCP","1434","34236  >  443 [ACK] Seq=215857 Ack=6108 Win=1828 Len=1368 TSval=7803920 TSecr=759931771 [TCP segment of a reassembled PDU]"
"428","2018-08-23 01:55:57.074705","192.168.2.3","216.58.197.4","TLSv1.2","155","Application Data"
"431","2018-08-23 01:55:57.171501","192.168.2.3","216.58.197.4","TCP","1434","34236  >  443 [ACK] Seq=217314 Ack=6108 Win=1828 Len=1368 TSval=7803930 TSecr=759931875 [TCP segment of a reassembled PDU]"
"432","2018-08-23 01:55:57.171924","192.168.2.3","216.58.197.4","TCP","1434","34236  >  443 [ACK] Seq=218682 Ack=6108 Win=1828 Len=1368 TSval=7803930 TSecr=759931875 [TCP segment of a reassembled PDU]"
"433","2018-08-23 01:55:57.171929","192.168.2.3","216.58.197.4","TLSv1.2","212","Application Data"
"434","2018-08-23 01:55:57.171930","192.168.2.3","216.58.197.4","TCP","1434","34236  >  443 [ACK] Seq=220196 Ack=6108 Win=1828 Len=1368 TSval=7803930 TSecr=759931875 [TCP segment of a reassembled PDU]"
"435","2018-08-23 01:55:57.171931","192.168.2.3","216.58.197.4","TLSv1.2","155","Application Data"
"441","2018-08-23 01:55:57.224955","192.168.2.3","216.58.197.4","TCP","66","34236  >  443 [ACK] Seq=221653 Ack=6393 Win=1828 Len=0 TSval=7803935 TSecr=759932020"
"442","2018-08-23 01:55:57.224959","192.168.2.3","216.58.197.4","TCP","66","34236  >  443 [ACK] Seq=221653 Ack=6541 Win=1828 Len=0 TSval=7803935 TSecr=759932020"
"443","2018-08-23 01:55:57.286186","192.168.2.3","216.58.197.4","TCP","1434","34236  >  443 [ACK] Seq=221653 Ack=6541 Win=1828 Len=1368 TSval=7803941 TSecr=759932020 [TCP segment of a reassembled PDU]"
"444","2018-08-23 01:55:57.286191","192.168.2.3","216.58.197.4","TCP","1434","34236  >  443 [ACK] Seq=223021 Ack=6541 Win=1828 Len=1368 TSval=7803941 TSecr=759932020 [TCP segment of a reassembled PDU]"
"445","2018-08-23 01:55:57.286284","192.168.2.3","216.58.197.4","TLSv1.2","212","Application Data"
"446","2018-08-23 01:55:57.286524","192.168.2.3","216.58.197.4","TCP","1434","34236  >  443 [ACK] Seq=224535 Ack=6541 Win=1828 Len=1368 TSval=7803941 TSecr=759932020 [TCP segment of a reassembled PDU]"
"447","2018-08-23 01:55:57.286526","192.168.2.3","216.58.197.4","TLSv1.2","155","Application Data"
"451","2018-08-23 01:55:57.375066","192.168.2.3","216.58.197.4","TCP","1434","34236  >  443 [ACK] Seq=225992 Ack=6541 Win=1828 Len=1368 TSval=7803950 TSecr=759932087 [TCP segment of a reassembled PDU]"
"452","2018-08-23 01:55:57.375480","192.168.2.3","216.58.197.4","TCP","1434","34236  >  443 [ACK] Seq=227360 Ack=6541 Win=1828 Len=1368 TSval=7803950 TSecr=759932087 [TCP segment of a reassembled PDU]"
"453","2018-08-23 01:55:57.375484","192.168.2.3","216.58.197.4","TLSv1.2","212","Application Data"
"454","2018-08-23 01:55:57.375485","192.168.2.3","216.58.197.4","TCP","1434","34236  >  443 [ACK] Seq=228874 Ack=6541 Win=1828 Len=1368 TSval=7803950 TSecr=759932087 [TCP segment of a reassembled PDU]"
"455","2018-08-23 01:55:57.375486","192.168.2.3","216.58.197.4","TLSv1.2","155","Application Data"
"459","2018-08-23 01:55:57.429037","192.168.2.3","216.58.197.4","TCP","66","34236  >  443 [ACK] Seq=230331 Ack=6744 Win=1828 Len=0 TSval=7803956 TSecr=759932224"
"461","2018-08-23 01:55:57.429992","192.168.2.3","216.58.197.4","TCP","66","34236  >  443 [ACK] Seq=230331 Ack=6963 Win=1828 Len=0 TSval=7803956 TSecr=759932225"
"462","2018-08-23 01:55:57.479135","192.168.2.3","216.58.197.4","TCP","1434","34236  >  443 [ACK] Seq=230331 Ack=6963 Win=1828 Len=1368 TSval=7803961 TSecr=759932225 [TCP segment of a reassembled PDU]"
"463","2018-08-23 01:55:57.479651","192.168.2.3","216.58.197.4","TCP","1434","34236  >  443 [ACK] Seq=231699 Ack=6963 Win=1828 Len=1368 TSval=7803961 TSecr=759932225 [TCP segment of a reassembled PDU]"
"464","2018-08-23 01:55:57.479656","192.168.2.3","216.58.197.4","TLSv1.2","212","Application Data"
"465","2018-08-23 01:55:57.479984","192.168.2.3","216.58.197.4","TCP","1434","34236  >  443 [ACK] Seq=233213 Ack=6963 Win=1828 Len=1368 TSval=7803961 TSecr=759932225 [TCP segment of a reassembled PDU]"
"466","2018-08-23 01:55:57.479987","192.168.2.3","216.58.197.4","TLSv1.2","155","Application Data"
"467","2018-08-23 01:55:57.479988","192.168.2.3","216.58.197.4","TLSv1.2","396","Application Data"
"468","2018-08-23 01:55:57.479989","192.168.2.3","216.58.197.4","TLSv1.2","102","Application Data"
"473","2018-08-23 01:55:57.564390","192.168.2.3","216.58.197.4","TCP","66","34236  >  443 [ACK] Seq=235036 Ack=7797 Win=1828 Len=0 TSval=7803969 TSecr=759932358"
"475","2018-08-23 01:55:57.566192","192.168.2.3","216.58.197.4","TCP","66","34236  >  443 [ACK] Seq=235036 Ack=7946 Win=1828 Len=0 TSval=7803969 TSecr=759932361"
"477","2018-08-23 01:55:57.781865","192.168.2.3","216.58.197.4","TCP","66","34236  >  443 [ACK] Seq=235036 Ack=8236 Win=1828 Len=0 TSval=7803991 TSecr=759932577"
"479","2018-08-23 01:55:57.826837","192.168.2.3","216.58.197.4","TCP","66","34236  >  443 [ACK] Seq=235036 Ack=9419 Win=1828 Len=0 TSval=7803995 TSecr=759932620"
"492","2018-08-23 01:55:57.945643","192.168.2.3","216.58.197.4","TCP","66","34236  >  443 [ACK] Seq=235036 Ack=10837 Win=1812 Len=0 TSval=7804007 TSecr=759932739"
"493","2018-08-23 01:55:57.945647","192.168.2.3","216.58.197.4","TCP","66","34236  >  443 [ACK] Seq=235036 Ack=11303 Win=1812 Len=0 TSval=7804007 TSecr=759932739"
"494","2018-08-23 01:55:57.945648","192.168.2.3","216.58.197.4","TCP","66","34236  >  443 [ACK] Seq=235036 Ack=12721 Win=1812 Len=0 TSval=7804007 TSecr=759932740"
"495","2018-08-23 01:55:57.948559","192.168.2.3","216.58.197.4","TCP","66","34236  >  443 [ACK] Seq=235036 Ack=13060 Win=1828 Len=0 TSval=7804007 TSecr=759932740"
"496","2018-08-23 01:55:57.948562","192.168.2.3","216.58.197.4","TCP","66","34236  >  443 [ACK] Seq=235036 Ack=14478 Win=1806 Len=0 TSval=7804007 TSecr=759932740"
"497","2018-08-23 01:55:57.948563","192.168.2.3","216.58.197.4","TCP","66","34236  >  443 [ACK] Seq=235036 Ack=14963 Win=1802 Len=0 TSval=7804007 TSecr=759932740"
"498","2018-08-23 01:55:57.948564","192.168.2.3","216.58.197.4","TCP","66","34236  >  443 [ACK] Seq=235036 Ack=16716 Win=1812 Len=0 TSval=7804007 TSecr=759932740"
"499","2018-08-23 01:55:57.948564","192.168.2.3","216.58.197.4","TCP","66","34236  >  443 [ACK] Seq=235036 Ack=18511 Win=1807 Len=0 TSval=7804008 TSecr=759932740"
"500","2018-08-23 01:55:57.948566","192.168.2.3","216.58.197.4","TCP","66","34236  >  443 [ACK] Seq=235036 Ack=19929 Win=1785 Len=0 TSval=7804008 TSecr=759932740"
"501","2018-08-23 01:55:57.948567","192.168.2.3","216.58.197.4","TCP","66","34236  >  443 [ACK] Seq=235036 Ack=20243 Win=1781 Len=0 TSval=7804008 TSecr=759932740"
"519","2018-08-23 01:55:57.988353","192.168.2.3","216.58.197.4","TCP","66","34236  >  443 [ACK] Seq=235036 Ack=21661 Win=1812 Len=0 TSval=7804012 TSecr=759932777"
"520","2018-08-23 01:55:57.988356","192.168.2.3","216.58.197.4","TCP","66","34236  >  443 [ACK] Seq=235036 Ack=22014 Win=1812 Len=0 TSval=7804012 TSecr=759932777"
"521","2018-08-23 01:55:57.988357","192.168.2.3","216.58.197.4","TCP","66","34236  >  443 [ACK] Seq=235036 Ack=24850 Win=1812 Len=0 TSval=7804012 TSecr=759932777"
"524","2018-08-23 01:55:57.990471","192.168.2.3","216.58.197.4","TCP","66","34236  >  443 [ACK] Seq=235036 Ack=25449 Win=1828 Len=0 TSval=7804012 TSecr=759932777"
"525","2018-08-23 01:55:57.990474","192.168.2.3","216.58.197.4","TCP","66","34236  >  443 [ACK] Seq=235036 Ack=28723 Win=1828 Len=0 TSval=7804012 TSecr=759932777"
"526","2018-08-23 01:55:57.990475","192.168.2.3","216.58.197.4","TCP","66","34236  >  443 [ACK] Seq=235036 Ack=32652 Win=1828 Len=0 TSval=7804012 TSecr=759932780"
"527","2018-08-23 01:55:57.990475","192.168.2.3","216.58.197.4","TCP","66","34236  >  443 [ACK] Seq=235036 Ack=34543 Win=1828 Len=0 TSval=7804012 TSecr=759932783"
"532","2018-08-23 01:55:57.991407","192.168.2.3","216.58.197.4","TCP","66","34236  >  443 [ACK] Seq=235036 Ack=36465 Win=1828 Len=0 TSval=7804012 TSecr=759932783"
"533","2018-08-23 01:55:57.992067","192.168.2.3","216.58.197.4","TCP","66","34236  >  443 [ACK] Seq=235036 Ack=38394 Win=1828 Len=0 TSval=7804012 TSecr=759932785"
"534","2018-08-23 01:55:57.992070","192.168.2.3","216.58.197.4","TCP","66","34236  >  443 [ACK] Seq=235036 Ack=40091 Win=1828 Len=0 TSval=7804012 TSecr=759932786"
"537","2018-08-23 01:55:57.992645","192.168.2.3","216.58.197.4","TCP","66","34236  >  443 [ACK] Seq=235036 Ack=42246 Win=1828 Len=0 TSval=7804012 TSecr=759932786"
"538","2018-08-23 01:55:57.993559","192.168.2.3","216.58.197.4","TCP","66","34236  >  443 [ACK] Seq=235036 Ack=42449 Win=1828 Len=0 TSval=7804012 TSecr=759932788"
"539","2018-08-23 01:55:57.993771","192.168.2.3","216.58.197.4","TCP","66","34236  >  443 [ACK] Seq=235036 Ack=42521 Win=1828 Len=0 TSval=7804012 TSecr=759932788"
"546","2018-08-23 01:55:57.996894","192.168.2.3","216.58.197.4","TCP","66","34236  >  443 [ACK] Seq=235036 Ack=42861 Win=1828 Len=0 TSval=7804012 TSecr=759932791"
"547","2018-08-23 01:55:57.997751","192.168.2.3","216.58.197.4","TCP","66","34236  >  443 [ACK] Seq=235036 Ack=43351 Win=1828 Len=0 TSval=7804013 TSecr=759932792"
"548","2018-08-23 01:55:58.018555","192.168.2.3","216.58.197.4","TLSv1.2","104","Application Data"
"551","2018-08-23 01:56:03.949016","192.168.2.3","216.58.197.10","TCP","66","47764  >  443 [ACK] Seq=1 Ack=1 Win=495 Len=0 TSval=7804608 TSecr=519319352"
"553","2018-08-23 01:56:05.262108","192.168.2.3","216.58.197.14","TLSv1.2","156","Application Data"
"554","2018-08-23 01:56:05.263182","192.168.2.3","216.58.197.14","TLSv1.2","104","Application Data"
"555","2018-08-23 01:56:05.263560","192.168.2.3","216.58.197.14","TLSv1.2","584","Application Data"
"559","2018-08-23 01:56:05.306856","192.168.2.3","216.58.197.14","TCP","66","41142  >  443 [ACK] Seq=647 Ack=39 Win=547 Len=0 TSval=7804744 TSecr=932948797"
"565","2018-08-23 01:56:05.344723","192.168.2.3","216.58.197.14","TCP","66","41142  >  443 [ACK] Seq=647 Ack=406 Win=564 Len=0 TSval=7804747 TSecr=932948873"
"566","2018-08-23 01:56:05.344862","192.168.2.3","216.58.197.14","TCP","66","41142  >  443 [ACK] Seq=647 Ack=497 Win=564 Len=0 TSval=7804747 TSecr=932948873"
"567","2018-08-23 01:56:05.345075","192.168.2.3","216.58.197.14","TCP","66","41142  >  443 [ACK] Seq=647 Ack=535 Win=564 Len=0 TSval=7804747 TSecr=932948873"
"568","2018-08-23 01:56:05.346025","192.168.2.3","216.58.197.14","TLSv1.2","104","Application Data"
"570","2018-08-23 01:56:05.735451","192.168.2.3","74.125.204.188","TCP","92","33038  >  5228 [PSH, ACK] Seq=1 Ack=1 Win=406 Len=26 TSval=7804786 TSecr=3813659399"
"572","2018-08-23 01:56:05.800873","192.168.2.3","74.125.204.188","TCP","66","33038  >  5228 [ACK] Seq=27 Ack=27 Win=406 Len=0 TSval=7804793 TSecr=3813689189"
