"No.","Time","Source","Destination","Protocol","Length","Info"
"1","2018-08-23 01:53:41.705227","192.168.2.3","216.58.197.3","TCP","66","43379  >  443 [ACK] Seq=1 Ack=1 Win=406 Len=0 TSval=7790384 TSecr=1764966676"
"9","2018-08-23 01:53:44.054482","192.168.2.3","216.58.197.4","TLSv1.2","156","Application Data"
"10","2018-08-23 01:53:44.054487","192.168.2.3","216.58.197.4","TLSv1.2","104","Application Data"
"14","2018-08-23 01:53:44.060749","192.168.2.3","216.58.197.4","TLSv1.2","158","Application Data"
"15","2018-08-23 01:53:44.083427","192.168.2.3","216.58.197.4","TCP","1434","34236  >  443 [ACK] Seq=221 Ack=39 Win=1828 Len=1368 TSval=7790620 TSecr=759798855 [TCP segment of a reassembled PDU]"
"16","2018-08-23 01:53:44.083614","192.168.2.3","216.58.197.4","TCP","1434","34236  >  443 [ACK] Seq=1589 Ack=39 Win=1828 Len=1368 TSval=7790620 TSecr=759798855 [TCP segment of a reassembled PDU]"
"17","2018-08-23 01:53:44.083617","192.168.2.3","216.58.197.4","TLSv1.2","212","Application Data"
"18","2018-08-23 01:53:44.083899","192.168.2.3","216.58.197.4","TCP","1434","34236  >  443 [ACK] Seq=3103 Ack=39 Win=1828 Len=1368 TSval=7790620 TSecr=759798855 [TCP segment of a reassembled PDU]"
"19","2018-08-23 01:53:44.083903","192.168.2.3","216.58.197.4","TLSv1.2","182","Application Data"
"20","2018-08-23 01:53:44.084058","192.168.2.3","216.58.197.4","TCP","1434","34236  >  443 [ACK] Seq=4587 Ack=39 Win=1828 Len=1368 TSval=7790620 TSecr=759798855 [TCP segment of a reassembled PDU]"
"21","2018-08-23 01:53:44.084062","192.168.2.3","216.58.197.4","TCP","1434","34236  >  443 [ACK] Seq=5955 Ack=39 Win=1828 Len=1368 TSval=7790620 TSecr=759798855 [TCP segment of a reassembled PDU]"
"22","2018-08-23 01:53:44.084219","192.168.2.3","216.58.197.4","TLSv1.2","212","Application Data"
"23","2018-08-23 01:53:44.084452","192.168.2.3","216.58.197.4","TCP","1434","34236  >  443 [ACK] Seq=7469 Ack=39 Win=1828 Len=1368 TSval=7790620 TSecr=759798855 [TCP segment of a reassembled PDU]"
"29","2018-08-23 01:53:44.091504","192.168.2.3","216.58.197.4","TLSv1.2","1434","Application Data [TCP segment of a reassembled PDU]"
"30","2018-08-23 01:53:44.091508","192.168.2.3","216.58.197.4","TCP","1434","34236  >  443 [ACK] Seq=10205 Ack=39 Win=1828 Len=1368 TSval=7790622 TSecr=759798883 [TCP segment of a reassembled PDU]"
"31","2018-08-23 01:53:44.091732","192.168.2.3","216.58.197.4","TLSv1.2","1434","Application Data [TCP segment of a reassembled PDU]"
"32","2018-08-23 01:53:44.092244","192.168.2.3","216.58.197.4","TLSv1.2","1434","Application Data [TCP segment of a reassembled PDU]"
"33","2018-08-23 01:53:44.092247","192.168.2.3","216.58.197.4","TCP","1434","34236  >  443 [ACK] Seq=14309 Ack=39 Win=1828 Len=1368 TSval=7790622 TSecr=759798884 [TCP segment of a reassembled PDU]"
"34","2018-08-23 01:53:44.092583","192.168.2.3","216.58.197.4","TLSv1.2","1434","Application Data [TCP segment of a reassembled PDU]"
"35","2018-08-23 01:53:44.093218","192.168.2.3","216.58.197.4","TLSv1.2","1434","Application Data [TCP segment of a reassembled PDU]"
"36","2018-08-23 01:53:44.093639","192.168.2.3","216.58.197.4","TCP","1434","34236  >  443 [ACK] Seq=18413 Ack=39 Win=1828 Len=1368 TSval=7790622 TSecr=759798884 [TCP segment of a reassembled PDU]"
"37","2018-08-23 01:53:44.093642","192.168.2.3","216.58.197.4","TLSv1.2","1434","Application Data [TCP segment of a reassembled PDU]"
"38","2018-08-23 01:53:44.093890","192.168.2.3","216.58.197.4","TLSv1.2","1434","Application Data [TCP segment of a reassembled PDU]"
"39","2018-08-23 01:53:44.093892","192.168.2.3","216.58.197.4","TCP","1434","34236  >  443 [ACK] Seq=22517 Ack=39 Win=1828 Len=1368 TSval=7790622 TSecr=759798884 [TCP segment of a reassembled PDU]"
"40","2018-08-23 01:53:44.094226","192.168.2.3","216.58.197.4","TLSv1.2","1434","Application Data [TCP segment of a reassembled PDU]"
"41","2018-08-23 01:53:44.094241","192.168.2.3","216.58.197.4","TLSv1.2","1434","Application Data [TCP segment of a reassembled PDU]"
"42","2018-08-23 01:53:44.094405","192.168.2.3","216.58.197.4","TCP","1434","34236  >  443 [ACK] Seq=26621 Ack=39 Win=1828 Len=1368 TSval=7790622 TSecr=759798884 [TCP segment of a reassembled PDU]"
"43","2018-08-23 01:53:44.094787","192.168.2.3","216.58.197.4","TLSv1.2","1434","Application Data [TCP segment of a reassembled PDU]"
"47","2018-08-23 01:53:44.097089","192.168.2.3","216.58.197.4","TLSv1.2","1434","Application Data [TCP segment of a reassembled PDU]"
"48","2018-08-23 01:53:44.097344","192.168.2.3","216.58.197.4","TCP","1434","34236  >  443 [ACK] Seq=30725 Ack=39 Win=1828 Len=1368 TSval=7790623 TSecr=759798891 [TCP segment of a reassembled PDU]"
"49","2018-08-23 01:53:44.097625","192.168.2.3","216.58.197.4","TCP","1434","34236  >  443 [ACK] Seq=32093 Ack=39 Win=1828 Len=1368 TSval=7790623 TSecr=759798891 [TCP segment of a reassembled PDU]"
"51","2018-08-23 01:53:44.098054","192.168.2.3","216.58.197.4","TLSv1.2","1434","Application Data [TCP segment of a reassembled PDU]"
"52","2018-08-23 01:53:44.098056","192.168.2.3","216.58.197.4","TLSv1.2","1434","Application Data [TCP segment of a reassembled PDU]"
"54","2018-08-23 01:53:44.098413","192.168.2.3","216.58.197.4","TCP","1434","34236  >  443 [ACK] Seq=36197 Ack=39 Win=1828 Len=1368 TSval=7790623 TSecr=759798892 [TCP segment of a reassembled PDU]"
"57","2018-08-23 01:53:44.099700","192.168.2.3","216.58.197.4","TLSv1.2","1434","Application Data [TCP segment of a reassembled PDU]"
"58","2018-08-23 01:53:44.099989","192.168.2.3","216.58.197.4","TLSv1.2","1434","Application Data [TCP segment of a reassembled PDU]"
"59","2018-08-23 01:53:44.100212","192.168.2.3","216.58.197.4","TCP","1434","34236  >  443 [ACK] Seq=40301 Ack=39 Win=1828 Len=1368 TSval=7790623 TSecr=759798893 [TCP segment of a reassembled PDU]"
"60","2018-08-23 01:53:44.100568","192.168.2.3","216.58.197.4","TLSv1.2","1434","Application Data [TCP segment of a reassembled PDU]"
"61","2018-08-23 01:53:44.100571","192.168.2.3","216.58.197.4","TLSv1.2","1434","Application Data [TCP segment of a reassembled PDU]"
"62","2018-08-23 01:53:44.100976","192.168.2.3","216.58.197.4","TCP","1434","34236  >  443 [ACK] Seq=44405 Ack=39 Win=1828 Len=1368 TSval=7790623 TSecr=759798894 [TCP segment of a reassembled PDU]"
"64","2018-08-23 01:53:44.101303","192.168.2.3","216.58.197.4","TLSv1.2","1434","Application Data [TCP segment of a reassembled PDU]"
"65","2018-08-23 01:53:44.101305","192.168.2.3","216.58.197.4","TLSv1.2","1434","Application Data [TCP segment of a reassembled PDU]"
"68","2018-08-23 01:53:44.103355","192.168.2.3","216.58.197.4","TCP","1434","34236  >  443 [PSH, ACK] Seq=48509 Ack=39 Win=1828 Len=1368 TSval=7790623 TSecr=759798894 [TCP segment of a reassembled PDU]"
"69","2018-08-23 01:53:44.103359","192.168.2.3","216.58.197.4","TLSv1.2","1434","Application Data [TCP segment of a reassembled PDU]"
"70","2018-08-23 01:53:44.103689","192.168.2.3","216.58.197.4","TLSv1.2","1434","Application Data [TCP segment of a reassembled PDU]"
"71","2018-08-23 01:53:44.103853","192.168.2.3","216.58.197.4","TCP","1434","34236  >  443 [ACK] Seq=52613 Ack=39 Win=1828 Len=1368 TSval=7790623 TSecr=759798894 [TCP segment of a reassembled PDU]"
"73","2018-08-23 01:53:44.104147","192.168.2.3","216.58.197.4","TLSv1.2","1434","Application Data [TCP segment of a reassembled PDU]"
"77","2018-08-23 01:53:44.106037","192.168.2.3","216.58.197.4","TLSv1.2","1434","Application Data [TCP segment of a reassembled PDU]"
"78","2018-08-23 01:53:44.106039","192.168.2.3","216.58.197.4","TLSv1.2","1434","Application Data [TCP segment of a reassembled PDU]"
"79","2018-08-23 01:53:44.106314","192.168.2.3","216.58.197.4","TCP","1434","34236  >  443 [ACK] Seq=58085 Ack=39 Win=1828 Len=1368 TSval=7790623 TSecr=759798897 [TCP segment of a reassembled PDU]"
"80","2018-08-23 01:53:44.106505","192.168.2.3","216.58.197.4","TLSv1.2","1434","Application Data [TCP segment of a reassembled PDU]"
"81","2018-08-23 01:53:44.106508","192.168.2.3","216.58.197.4","TLSv1.2","935","Application Data"
"87","2018-08-23 01:53:44.124178","192.168.2.3","216.58.197.4","TCP","1434","34236  >  443 [ACK] Seq=61690 Ack=39 Win=1828 Len=1368 TSval=7790625 TSecr=759798906 [TCP segment of a reassembled PDU]"
"88","2018-08-23 01:53:44.124451","192.168.2.3","216.58.197.4","TCP","1434","34236  >  443 [ACK] Seq=63058 Ack=39 Win=1828 Len=1368 TSval=7790625 TSecr=759798906 [TCP segment of a reassembled PDU]"
"89","2018-08-23 01:53:44.124454","192.168.2.3","216.58.197.4","TLSv1.2","212","Application Data"
"90","2018-08-23 01:53:44.124647","192.168.2.3","216.58.197.4","TCP","1434","34236  >  443 [ACK] Seq=64572 Ack=39 Win=1828 Len=1368 TSval=7790625 TSecr=759798906 [TCP segment of a reassembled PDU]"
"91","2018-08-23 01:53:44.124649","192.168.2.3","216.58.197.4","TLSv1.2","155","Application Data"
"97","2018-08-23 01:53:44.154876","192.168.2.3","216.58.197.4","TCP","66","34236  >  443 [ACK] Seq=66029 Ack=230 Win=1828 Len=0 TSval=7790628 TSecr=759798949"
"100","2018-08-23 01:53:44.172207","192.168.2.3","216.58.197.4","TCP","66","34236  >  443 [ACK] Seq=66029 Ack=576 Win=1828 Len=0 TSval=7790630 TSecr=759798949"
"101","2018-08-23 01:53:44.221393","192.168.2.3","216.58.197.4","TCP","1434","34236  >  443 [ACK] Seq=66029 Ack=576 Win=1828 Len=1368 TSval=7790635 TSecr=759798949 [TCP segment of a reassembled PDU]"
"102","2018-08-23 01:53:44.221398","192.168.2.3","216.58.197.4","TCP","1434","34236  >  443 [ACK] Seq=67397 Ack=576 Win=1828 Len=1368 TSval=7790635 TSecr=759798949 [TCP segment of a reassembled PDU]"
"103","2018-08-23 01:53:44.221492","192.168.2.3","216.58.197.4","TLSv1.2","212","Application Data"
"104","2018-08-23 01:53:44.221790","192.168.2.3","216.58.197.4","TCP","1434","34236  >  443 [ACK] Seq=68911 Ack=576 Win=1828 Len=1368 TSval=7790635 TSecr=759798949 [TCP segment of a reassembled PDU]"
"105","2018-08-23 01:53:44.221793","192.168.2.3","216.58.197.4","TLSv1.2","155","Application Data"
"110","2018-08-23 01:53:44.305281","192.168.2.3","216.58.197.4","TCP","66","34236  >  443 [ACK] Seq=70368 Ack=749 Win=1828 Len=0 TSval=7790644 TSecr=759799067"
"111","2018-08-23 01:53:44.335046","192.168.2.3","216.58.197.4","TCP","1434","34236  >  443 [ACK] Seq=70368 Ack=749 Win=1828 Len=1368 TSval=7790646 TSecr=759799067 [TCP segment of a reassembled PDU]"
"112","2018-08-23 01:53:44.335293","192.168.2.3","216.58.197.4","TCP","1434","34236  >  443 [ACK] Seq=71736 Ack=749 Win=1828 Len=1368 TSval=7790646 TSecr=759799067 [TCP segment of a reassembled PDU]"
"113","2018-08-23 01:53:44.335296","192.168.2.3","216.58.197.4","TLSv1.2","212","Application Data"
"114","2018-08-23 01:53:44.335654","192.168.2.3","216.58.197.4","TLSv1.2","1423","Application Data"
"119","2018-08-23 01:53:44.416864","192.168.2.3","216.58.197.4","TCP","66","34236  >  443 [ACK] Seq=74607 Ack=1002 Win=1828 Len=0 TSval=7790655 TSecr=759799211"
"121","2018-08-23 01:53:44.433581","192.168.2.3","216.58.197.4","TCP","1434","34236  >  443 [ACK] Seq=74607 Ack=1002 Win=1828 Len=1368 TSval=7790656 TSecr=759799211 [TCP segment of a reassembled PDU]"
"122","2018-08-23 01:53:44.433892","192.168.2.3","216.58.197.4","TCP","1434","34236  >  443 [ACK] Seq=75975 Ack=1002 Win=1828 Len=1368 TSval=7790656 TSecr=759799211 [TCP segment of a reassembled PDU]"
"123","2018-08-23 01:53:44.433894","192.168.2.3","216.58.197.4","TLSv1.2","212","Application Data"
"124","2018-08-23 01:53:44.434163","192.168.2.3","216.58.197.4","TCP","1434","34236  >  443 [ACK] Seq=77489 Ack=1002 Win=1828 Len=1368 TSval=7790656 TSecr=759799211 [TCP segment of a reassembled PDU]"
"125","2018-08-23 01:53:44.434166","192.168.2.3","216.58.197.4","TLSv1.2","155","Application Data"
"129","2018-08-23 01:53:44.465330","192.168.2.3","216.58.197.4","TCP","66","34236  >  443 [ACK] Seq=78946 Ack=1082 Win=1828 Len=0 TSval=7790660 TSecr=759799228"
"130","2018-08-23 01:53:44.539462","192.168.2.3","216.58.197.4","TCP","1434","34236  >  443 [ACK] Seq=78946 Ack=1082 Win=1828 Len=1368 TSval=7790667 TSecr=759799228 [TCP segment of a reassembled PDU]"
"131","2018-08-23 01:53:44.539979","192.168.2.3","216.58.197.4","TCP","1434","34236  >  443 [ACK] Seq=80314 Ack=1082 Win=1828 Len=1368 TSval=7790667 TSecr=759799228 [TCP segment of a reassembled PDU]"
"132","2018-08-23 01:53:44.539981","192.168.2.3","216.58.197.4","TLSv1.2","212","Application Data"
"133","2018-08-23 01:53:44.540200","192.168.2.3","216.58.197.4","TCP","1434","34236  >  443 [ACK] Seq=81828 Ack=1082 Win=1828 Len=1368 TSval=7790667 TSecr=759799228 [TCP segment of a reassembled PDU]"
"134","2018-08-23 01:53:44.540203","192.168.2.3","216.58.197.4","TLSv1.2","155","Application Data"
"138","2018-08-23 01:53:44.659103","192.168.2.3","216.58.197.4","TCP","1434","34236  >  443 [ACK] Seq=83285 Ack=1082 Win=1828 Len=1368 TSval=7790679 TSecr=759799340 [TCP segment of a reassembled PDU]"
"139","2018-08-23 01:53:44.659234","192.168.2.3","216.58.197.4","TCP","1434","34236  >  443 [ACK] Seq=84653 Ack=1082 Win=1828 Len=1368 TSval=7790679 TSecr=759799340 [TCP segment of a reassembled PDU]"
"140","2018-08-23 01:53:44.659236","192.168.2.3","216.58.197.4","TLSv1.2","212","Application Data"
"141","2018-08-23 01:53:44.659507","192.168.2.3","216.58.197.4","TLSv1.2","1410","Application Data"
"145","2018-08-23 01:53:44.755696","192.168.2.3","216.58.197.4","TCP","1434","34236  >  443 [ACK] Seq=87511 Ack=1082 Win=1828 Len=1368 TSval=7790688 TSecr=759799459 [TCP segment of a reassembled PDU]"
"146","2018-08-23 01:53:44.755873","192.168.2.3","216.58.197.4","TCP","1434","34236  >  443 [ACK] Seq=88879 Ack=1082 Win=1828 Len=1368 TSval=7790688 TSecr=759799459 [TCP segment of a reassembled PDU]"
"147","2018-08-23 01:53:44.755881","192.168.2.3","216.58.197.4","TLSv1.2","212","Application Data"
"148","2018-08-23 01:53:44.755882","192.168.2.3","216.58.197.4","TCP","1434","34236  >  443 [ACK] Seq=90393 Ack=1082 Win=1828 Len=1368 TSval=7790688 TSecr=759799459 [TCP segment of a reassembled PDU]"
"149","2018-08-23 01:53:44.756024","192.168.2.3","216.58.197.4","TLSv1.2","155","Application Data"
"153","2018-08-23 01:53:44.863925","192.168.2.3","216.58.197.4","TCP","1434","34236  >  443 [ACK] Seq=91850 Ack=1082 Win=1828 Len=1368 TSval=7790699 TSecr=759799556 [TCP segment of a reassembled PDU]"
"154","2018-08-23 01:53:44.863930","192.168.2.3","216.58.197.4","TCP","1434","34236  >  443 [ACK] Seq=93218 Ack=1082 Win=1828 Len=1368 TSval=7790699 TSecr=759799556 [TCP segment of a reassembled PDU]"
"155","2018-08-23 01:53:44.863931","192.168.2.3","216.58.197.4","TLSv1.2","212","Application Data"
"156","2018-08-23 01:53:44.864194","192.168.2.3","216.58.197.4","TCP","1434","34236  >  443 [ACK] Seq=94732 Ack=1082 Win=1828 Len=1368 TSval=7790699 TSecr=759799556 [TCP segment of a reassembled PDU]"
"157","2018-08-23 01:53:44.864210","192.168.2.3","216.58.197.4","TLSv1.2","155","Application Data"
"159","2018-08-23 01:53:44.975149","192.168.2.3","216.58.197.4","TCP","1434","34236  >  443 [ACK] Seq=96189 Ack=1082 Win=1828 Len=1368 TSval=7790710 TSecr=759799665 [TCP segment of a reassembled PDU]"
"160","2018-08-23 01:53:44.975584","192.168.2.3","216.58.197.4","TCP","1434","34236  >  443 [ACK] Seq=97557 Ack=1082 Win=1828 Len=1368 TSval=7790710 TSecr=759799665 [TCP segment of a reassembled PDU]"
"161","2018-08-23 01:53:44.975588","192.168.2.3","216.58.197.4","TLSv1.2","212","Application Data"
"162","2018-08-23 01:53:44.975588","192.168.2.3","216.58.197.4","TCP","1434","34236  >  443 [ACK] Seq=99071 Ack=1082 Win=1828 Len=1368 TSval=7790710 TSecr=759799665 [TCP segment of a reassembled PDU]"
"163","2018-08-23 01:53:44.975705","192.168.2.3","216.58.197.4","TLSv1.2","155","Application Data"
"167","2018-08-23 01:53:45.073787","192.168.2.3","216.58.197.4","TCP","1434","34236  >  443 [ACK] Seq=100528 Ack=1082 Win=1828 Len=1368 TSval=7790720 TSecr=759799776 [TCP segment of a reassembled PDU]"
"168","2018-08-23 01:53:45.074086","192.168.2.3","216.58.197.4","TCP","1434","34236  >  443 [ACK] Seq=101896 Ack=1082 Win=1828 Len=1368 TSval=7790720 TSecr=759799776 [TCP segment of a reassembled PDU]"
"169","2018-08-23 01:53:45.074102","192.168.2.3","216.58.197.4","TLSv1.2","212","Application Data"
"170","2018-08-23 01:53:45.074295","192.168.2.3","216.58.197.4","TCP","1434","34236  >  443 [ACK] Seq=103410 Ack=1082 Win=1828 Len=1368 TSval=7790720 TSecr=759799776 [TCP segment of a reassembled PDU]"
"171","2018-08-23 01:53:45.074298","192.168.2.3","216.58.197.4","TLSv1.2","155","Application Data"
"176","2018-08-23 01:53:45.155114","192.168.2.3","216.58.197.4","TCP","66","34236  >  443 [ACK] Seq=104867 Ack=1355 Win=1828 Len=0 TSval=7790728 TSecr=759799950"
"178","2018-08-23 01:53:45.171068","192.168.2.3","216.58.197.4","TCP","1434","34236  >  443 [ACK] Seq=104867 Ack=1355 Win=1828 Len=1368 TSval=7790730 TSecr=759799950 [TCP segment of a reassembled PDU]"
"179","2018-08-23 01:53:45.171072","192.168.2.3","216.58.197.4","TCP","1434","34236  >  443 [ACK] Seq=106235 Ack=1355 Win=1828 Len=1368 TSval=7790730 TSecr=759799950 [TCP segment of a reassembled PDU]"
"180","2018-08-23 01:53:45.171073","192.168.2.3","216.58.197.4","TLSv1.2","212","Application Data"
"181","2018-08-23 01:53:45.171374","192.168.2.3","216.58.197.4","TCP","1434","34236  >  443 [ACK] Seq=107749 Ack=1355 Win=1828 Len=1368 TSval=7790730 TSecr=759799950 [TCP segment of a reassembled PDU]"
"182","2018-08-23 01:53:45.171377","192.168.2.3","216.58.197.4","TLSv1.2","155","Application Data"
"186","2018-08-23 01:53:45.205378","192.168.2.3","216.58.197.4","TCP","66","34236  >  443 [ACK] Seq=109206 Ack=1457 Win=1828 Len=0 TSval=7790734 TSecr=759799965"
"187","2018-08-23 01:53:45.277508","192.168.2.3","216.58.197.4","TCP","1434","34236  >  443 [ACK] Seq=109206 Ack=1457 Win=1828 Len=1368 TSval=7790741 TSecr=759799965 [TCP segment of a reassembled PDU]"
"188","2018-08-23 01:53:45.277814","192.168.2.3","216.58.197.4","TCP","1434","34236  >  443 [ACK] Seq=110574 Ack=1457 Win=1828 Len=1368 TSval=7790741 TSecr=759799965 [TCP segment of a reassembled PDU]"
"189","2018-08-23 01:53:45.277818","192.168.2.3","216.58.197.4","TLSv1.2","212","Application Data"
"190","2018-08-23 01:53:45.278197","192.168.2.3","216.58.197.4","TCP","1434","34236  >  443 [ACK] Seq=112088 Ack=1457 Win=1828 Len=1368 TSval=7790741 TSecr=759799965 [TCP segment of a reassembled PDU]"
"191","2018-08-23 01:53:45.278200","192.168.2.3","216.58.197.4","TLSv1.2","155","Application Data"
"195","2018-08-23 01:53:45.375778","192.168.2.3","216.58.197.4","TCP","1434","34236  >  443 [ACK] Seq=113545 Ack=1457 Win=1828 Len=1368 TSval=7790750 TSecr=759800078 [TCP segment of a reassembled PDU]"
"196","2018-08-23 01:53:45.375783","192.168.2.3","216.58.197.4","TCP","1434","34236  >  443 [ACK] Seq=114913 Ack=1457 Win=1828 Len=1368 TSval=7790750 TSecr=759800078 [TCP segment of a reassembled PDU]"
"197","2018-08-23 01:53:45.375898","192.168.2.3","216.58.197.4","TLSv1.2","212","Application Data"
"198","2018-08-23 01:53:45.376141","192.168.2.3","216.58.197.4","TCP","1434","34236  >  443 [ACK] Seq=116427 Ack=1457 Win=1828 Len=1368 TSval=7790750 TSecr=759800078 [TCP segment of a reassembled PDU]"
"199","2018-08-23 01:53:45.376143","192.168.2.3","216.58.197.4","TLSv1.2","155","Application Data"
"203","2018-08-23 01:53:45.472492","192.168.2.3","216.58.197.4","TCP","1434","34236  >  443 [ACK] Seq=117884 Ack=1457 Win=1828 Len=1368 TSval=7790760 TSecr=759800176 [TCP segment of a reassembled PDU]"
"204","2018-08-23 01:53:45.472657","192.168.2.3","216.58.197.4","TCP","1434","34236  >  443 [ACK] Seq=119252 Ack=1457 Win=1828 Len=1368 TSval=7790760 TSecr=759800176 [TCP segment of a reassembled PDU]"
"205","2018-08-23 01:53:45.472659","192.168.2.3","216.58.197.4","TLSv1.2","212","Application Data"
"206","2018-08-23 01:53:45.472869","192.168.2.3","216.58.197.4","TCP","1434","34236  >  443 [ACK] Seq=120766 Ack=1457 Win=1828 Len=1368 TSval=7790760 TSecr=759800176 [TCP segment of a reassembled PDU]"
"207","2018-08-23 01:53:45.472872","192.168.2.3","216.58.197.4","TLSv1.2","155","Application Data"
"211","2018-08-23 01:53:45.553674","192.168.2.3","216.58.197.4","TCP","1434","34236  >  443 [ACK] Seq=122223 Ack=1457 Win=1828 Len=1368 TSval=7790768 TSecr=759800273 [TCP segment of a reassembled PDU]"
"212","2018-08-23 01:53:45.553998","192.168.2.3","216.58.197.4","TCP","1434","34236  >  443 [ACK] Seq=123591 Ack=1457 Win=1828 Len=1368 TSval=7790768 TSecr=759800273 [TCP segment of a reassembled PDU]"
"213","2018-08-23 01:53:45.554000","192.168.2.3","216.58.197.4","TLSv1.2","212","Application Data"
"214","2018-08-23 01:53:45.554001","192.168.2.3","216.58.197.4","TCP","1434","34236  >  443 [ACK] Seq=125105 Ack=1457 Win=1828 Len=1368 TSval=7790768 TSecr=759800273 [TCP segment of a reassembled PDU]"
"215","2018-08-23 01:53:45.554318","192.168.2.3","216.58.197.4","TLSv1.2","155","Application Data"
"219","2018-08-23 01:53:45.649000","192.168.2.3","216.58.197.4","TCP","1434","34236  >  443 [ACK] Seq=126562 Ack=1457 Win=1828 Len=1368 TSval=7790778 TSecr=759800354 [TCP segment of a reassembled PDU]"
"220","2018-08-23 01:53:45.649240","192.168.2.3","216.58.197.4","TCP","1434","34236  >  443 [ACK] Seq=127930 Ack=1457 Win=1828 Len=1368 TSval=7790778 TSecr=759800354 [TCP segment of a reassembled PDU]"
"221","2018-08-23 01:53:45.649242","192.168.2.3","216.58.197.4","TLSv1.2","212","Application Data"
"222","2018-08-23 01:53:45.649466","192.168.2.3","216.58.197.4","TCP","1434","34236  >  443 [ACK] Seq=129444 Ack=1457 Win=1828 Len=1368 TSval=7790778 TSecr=759800354 [TCP segment of a reassembled PDU]"
"223","2018-08-23 01:53:45.649467","192.168.2.3","216.58.197.4","TLSv1.2","155","Application Data"
"227","2018-08-23 01:53:45.745695","192.168.2.3","216.58.197.4","TCP","1434","34236  >  443 [ACK] Seq=130901 Ack=1457 Win=1828 Len=1368 TSval=7790788 TSecr=759800449 [TCP segment of a reassembled PDU]"
"228","2018-08-23 01:53:45.748233","192.168.2.3","216.58.197.4","TCP","1434","34236  >  443 [ACK] Seq=132269 Ack=1457 Win=1828 Len=1368 TSval=7790788 TSecr=759800449 [TCP segment of a reassembled PDU]"
"229","2018-08-23 01:53:45.748237","192.168.2.3","216.58.197.4","TLSv1.2","212","Application Data"
"230","2018-08-23 01:53:45.748238","192.168.2.3","216.58.197.4","TCP","1434","34236  >  443 [ACK] Seq=133783 Ack=1457 Win=1828 Len=1368 TSval=7790788 TSecr=759800449 [TCP segment of a reassembled PDU]"
"231","2018-08-23 01:53:45.748325","192.168.2.3","216.58.197.4","TLSv1.2","155","Application Data"
"235","2018-08-23 01:53:45.874038","192.168.2.3","216.58.197.4","TCP","1434","34236  >  443 [ACK] Seq=135240 Ack=1457 Win=1828 Len=1368 TSval=7790797 TSecr=759800548 [TCP segment of a reassembled PDU]"
"236","2018-08-23 01:53:45.874043","192.168.2.3","216.58.197.4","TCP","1434","34236  >  443 [ACK] Seq=136608 Ack=1457 Win=1828 Len=1368 TSval=7790797 TSecr=759800548 [TCP segment of a reassembled PDU]"
"237","2018-08-23 01:53:45.874044","192.168.2.3","216.58.197.4","TLSv1.2","212","Application Data"
"238","2018-08-23 01:53:45.874317","192.168.2.3","216.58.197.4","TCP","1434","34236  >  443 [ACK] Seq=138122 Ack=1457 Win=1828 Len=1368 TSval=7790797 TSecr=759800548 [TCP segment of a reassembled PDU]"
"239","2018-08-23 01:53:45.874320","192.168.2.3","216.58.197.4","TLSv1.2","155","Application Data"
"244","2018-08-23 01:53:45.936358","192.168.2.3","216.58.197.4","TCP","66","34236  >  443 [ACK] Seq=139579 Ack=1553 Win=1828 Len=0 TSval=7790806 TSecr=759800718"
"245","2018-08-23 01:53:45.936365","192.168.2.3","216.58.197.4","TCP","66","34236  >  443 [ACK] Seq=139579 Ack=1738 Win=1828 Len=0 TSval=7790806 TSecr=759800718"
"246","2018-08-23 01:53:45.936366","192.168.2.3","216.58.197.4","TCP","1434","34236  >  443 [ACK] Seq=139579 Ack=1738 Win=1828 Len=1368 TSval=7790806 TSecr=759800718 [TCP segment of a reassembled PDU]"
"247","2018-08-23 01:53:45.936367","192.168.2.3","216.58.197.4","TCP","1434","34236  >  443 [ACK] Seq=140947 Ack=1738 Win=1828 Len=1368 TSval=7790806 TSecr=759800718 [TCP segment of a reassembled PDU]"
"248","2018-08-23 01:53:45.936368","192.168.2.3","216.58.197.4","TLSv1.2","212","Application Data"
"249","2018-08-23 01:53:45.936670","192.168.2.3","216.58.197.4","TCP","1434","34236  >  443 [ACK] Seq=142461 Ack=1738 Win=1828 Len=1368 TSval=7790806 TSecr=759800718 [TCP segment of a reassembled PDU]"
"250","2018-08-23 01:53:45.936673","192.168.2.3","216.58.197.4","TLSv1.2","155","Application Data"
"254","2018-08-23 01:53:46.025429","192.168.2.3","216.58.197.4","TCP","1434","34236  >  443 [ACK] Seq=143918 Ack=1738 Win=1828 Len=1368 TSval=7790814 TSecr=759800737 [TCP segment of a reassembled PDU]"
"255","2018-08-23 01:53:46.025435","192.168.2.3","216.58.197.4","TCP","1434","34236  >  443 [ACK] Seq=145286 Ack=1738 Win=1828 Len=1368 TSval=7790814 TSecr=759800737 [TCP segment of a reassembled PDU]"
"256","2018-08-23 01:53:46.025436","192.168.2.3","216.58.197.4","TLSv1.2","212","Application Data"
"257","2018-08-23 01:53:46.025749","192.168.2.3","216.58.197.4","TCP","1434","34236  >  443 [ACK] Seq=146800 Ack=1738 Win=1828 Len=1368 TSval=7790814 TSecr=759800737 [TCP segment of a reassembled PDU]"
"258","2018-08-23 01:53:46.025751","192.168.2.3","216.58.197.4","TLSv1.2","155","Application Data"
"264","2018-08-23 01:53:46.077949","192.168.2.3","216.58.197.4","TCP","66","34236  >  443 [ACK] Seq=148257 Ack=2234 Win=1828 Len=0 TSval=7790821 TSecr=759800872"
"265","2018-08-23 01:53:46.109199","192.168.2.3","216.58.197.4","TCP","1434","34236  >  443 [ACK] Seq=148257 Ack=2234 Win=1828 Len=1368 TSval=7790824 TSecr=759800872 [TCP segment of a reassembled PDU]"
"266","2018-08-23 01:53:46.109548","192.168.2.3","216.58.197.4","TCP","1434","34236  >  443 [ACK] Seq=149625 Ack=2234 Win=1828 Len=1368 TSval=7790824 TSecr=759800872 [TCP segment of a reassembled PDU]"
"267","2018-08-23 01:53:46.109551","192.168.2.3","216.58.197.4","TLSv1.2","212","Application Data"
"268","2018-08-23 01:53:46.109551","192.168.2.3","216.58.197.4","TCP","1434","34236  >  443 [ACK] Seq=151139 Ack=2234 Win=1828 Len=1368 TSval=7790824 TSecr=759800872 [TCP segment of a reassembled PDU]"
"269","2018-08-23 01:53:46.109732","192.168.2.3","216.58.197.4","TLSv1.2","155","Application Data"
"275","2018-08-23 01:53:46.171064","192.168.2.3","216.58.197.4","TCP","66","34236  >  443 [ACK] Seq=152596 Ack=2558 Win=1828 Len=0 TSval=7790830 TSecr=759800950"
"276","2018-08-23 01:53:46.195022","192.168.2.3","216.58.197.4","TCP","1434","34236  >  443 [ACK] Seq=152596 Ack=2558 Win=1828 Len=1368 TSval=7790832 TSecr=759800950 [TCP segment of a reassembled PDU]"
"277","2018-08-23 01:53:46.195027","192.168.2.3","216.58.197.4","TCP","1434","34236  >  443 [ACK] Seq=153964 Ack=2558 Win=1828 Len=1368 TSval=7790832 TSecr=759800950 [TCP segment of a reassembled PDU]"
"278","2018-08-23 01:53:46.195028","192.168.2.3","216.58.197.4","TLSv1.2","212","Application Data"
"279","2018-08-23 01:53:46.195391","192.168.2.3","216.58.197.4","TCP","1434","34236  >  443 [ACK] Seq=155478 Ack=2558 Win=1828 Len=1368 TSval=7790832 TSecr=759800950 [TCP segment of a reassembled PDU]"
"280","2018-08-23 01:53:46.195393","192.168.2.3","216.58.197.4","TLSv1.2","155","Application Data"
"285","2018-08-23 01:53:46.249308","192.168.2.3","216.58.197.4","TCP","66","34236  >  443 [ACK] Seq=156935 Ack=2986 Win=1828 Len=0 TSval=7790838 TSecr=759801044"
"288","2018-08-23 01:53:46.256321","192.168.2.3","216.58.197.4","TCP","66","34236  >  443 [ACK] Seq=156935 Ack=3521 Win=1828 Len=0 TSval=7790839 TSecr=759801051"
"289","2018-08-23 01:53:46.286961","192.168.2.3","216.58.197.4","TCP","1434","34236  >  443 [ACK] Seq=156935 Ack=3521 Win=1828 Len=1368 TSval=7790842 TSecr=759801051 [TCP segment of a reassembled PDU]"
"290","2018-08-23 01:53:46.287321","192.168.2.3","216.58.197.4","TCP","1434","34236  >  443 [ACK] Seq=158303 Ack=3521 Win=1828 Len=1368 TSval=7790842 TSecr=759801051 [TCP segment of a reassembled PDU]"
"291","2018-08-23 01:53:46.287325","192.168.2.3","216.58.197.4","TLSv1.2","212","Application Data"
"292","2018-08-23 01:53:46.287788","192.168.2.3","216.58.197.4","TCP","1434","34236  >  443 [ACK] Seq=159817 Ack=3521 Win=1828 Len=1368 TSval=7790842 TSecr=759801051 [TCP segment of a reassembled PDU]"
"293","2018-08-23 01:53:46.287792","192.168.2.3","216.58.197.4","TLSv1.2","155","Application Data"
"297","2018-08-23 01:53:46.382863","192.168.2.3","216.58.197.4","TCP","1434","34236  >  443 [ACK] Seq=161274 Ack=3521 Win=1828 Len=1368 TSval=7790851 TSecr=759801088 [TCP segment of a reassembled PDU]"
"298","2018-08-23 01:53:46.383168","192.168.2.3","216.58.197.4","TCP","1434","34236  >  443 [ACK] Seq=162642 Ack=3521 Win=1828 Len=1368 TSval=7790851 TSecr=759801088 [TCP segment of a reassembled PDU]"
"299","2018-08-23 01:53:46.383171","192.168.2.3","216.58.197.4","TLSv1.2","212","Application Data"
"300","2018-08-23 01:53:46.384721","192.168.2.3","216.58.197.4","TCP","1434","34236  >  443 [ACK] Seq=164156 Ack=3521 Win=1828 Len=1368 TSval=7790851 TSecr=759801088 [TCP segment of a reassembled PDU]"
"301","2018-08-23 01:53:46.384725","192.168.2.3","216.58.197.4","TLSv1.2","155","Application Data"
"307","2018-08-23 01:53:46.435755","192.168.2.3","216.58.197.4","TCP","66","34236  >  443 [ACK] Seq=165613 Ack=3778 Win=1828 Len=0 TSval=7790856 TSecr=759801226"
"308","2018-08-23 01:53:46.459830","192.168.2.3","216.58.197.4","TCP","1434","34236  >  443 [ACK] Seq=165613 Ack=3778 Win=1828 Len=1368 TSval=7790859 TSecr=759801226 [TCP segment of a reassembled PDU]"
"309","2018-08-23 01:53:46.459988","192.168.2.3","216.58.197.4","TCP","1434","34236  >  443 [ACK] Seq=166981 Ack=3778 Win=1828 Len=1368 TSval=7790859 TSecr=759801226 [TCP segment of a reassembled PDU]"
"310","2018-08-23 01:53:46.459991","192.168.2.3","216.58.197.4","TLSv1.2","212","Application Data"
"311","2018-08-23 01:53:46.460364","192.168.2.3","216.58.197.4","TCP","1434","34236  >  443 [ACK] Seq=168495 Ack=3778 Win=1828 Len=1368 TSval=7790859 TSecr=759801226 [TCP segment of a reassembled PDU]"
"312","2018-08-23 01:53:46.460367","192.168.2.3","216.58.197.4","TLSv1.2","155","Application Data"
"318","2018-08-23 01:53:46.512529","192.168.2.3","216.58.197.4","TCP","66","34236  >  443 [ACK] Seq=169952 Ack=4347 Win=1828 Len=0 TSval=7790864 TSecr=759801307"
"319","2018-08-23 01:53:46.577917","192.168.2.3","216.58.197.4","TCP","1434","34236  >  443 [ACK] Seq=169952 Ack=4347 Win=1828 Len=1368 TSval=7790871 TSecr=759801307 [TCP segment of a reassembled PDU]"
"320","2018-08-23 01:53:46.578391","192.168.2.3","216.58.197.4","TCP","1434","34236  >  443 [ACK] Seq=171320 Ack=4347 Win=1828 Len=1368 TSval=7790871 TSecr=759801307 [TCP segment of a reassembled PDU]"
"321","2018-08-23 01:53:46.578393","192.168.2.3","216.58.197.4","TLSv1.2","212","Application Data"
"322","2018-08-23 01:53:46.578729","192.168.2.3","216.58.197.4","TCP","1434","34236  >  443 [ACK] Seq=172834 Ack=4347 Win=1828 Len=1368 TSval=7790871 TSecr=759801307 [TCP segment of a reassembled PDU]"
"323","2018-08-23 01:53:46.578744","192.168.2.3","216.58.197.4","TLSv1.2","155","Application Data"
"327","2018-08-23 01:53:46.651575","192.168.2.3","216.58.197.4","TCP","1434","34236  >  443 [ACK] Seq=174291 Ack=4347 Win=1828 Len=1368 TSval=7790878 TSecr=759801379 [TCP segment of a reassembled PDU]"
"328","2018-08-23 01:53:46.651906","192.168.2.3","216.58.197.4","TCP","1434","34236  >  443 [ACK] Seq=175659 Ack=4347 Win=1828 Len=1368 TSval=7790878 TSecr=759801379 [TCP segment of a reassembled PDU]"
"329","2018-08-23 01:53:46.651908","192.168.2.3","216.58.197.4","TLSv1.2","212","Application Data"
"330","2018-08-23 01:53:46.652342","192.168.2.3","216.58.197.4","TCP","1434","34236  >  443 [ACK] Seq=177173 Ack=4347 Win=1828 Len=1368 TSval=7790878 TSecr=759801379 [TCP segment of a reassembled PDU]"
"331","2018-08-23 01:53:46.652345","192.168.2.3","216.58.197.4","TLSv1.2","155","Application Data"
"337","2018-08-23 01:53:46.708842","192.168.2.3","216.58.197.4","TCP","66","34236  >  443 [ACK] Seq=178630 Ack=4624 Win=1828 Len=0 TSval=7790884 TSecr=759801503"
"338","2018-08-23 01:53:46.750775","192.168.2.3","216.58.197.4","TCP","1434","34236  >  443 [ACK] Seq=178630 Ack=4624 Win=1828 Len=1368 TSval=7790888 TSecr=759801503 [TCP segment of a reassembled PDU]"
"339","2018-08-23 01:53:46.750782","192.168.2.3","216.58.197.4","TCP","1434","34236  >  443 [ACK] Seq=179998 Ack=4624 Win=1828 Len=1368 TSval=7790888 TSecr=759801503 [TCP segment of a reassembled PDU]"
"340","2018-08-23 01:53:46.750783","192.168.2.3","216.58.197.4","TLSv1.2","212","Application Data"
"341","2018-08-23 01:53:46.751046","192.168.2.3","216.58.197.4","TCP","1434","34236  >  443 [ACK] Seq=181512 Ack=4624 Win=1828 Len=1368 TSval=7790888 TSecr=759801503 [TCP segment of a reassembled PDU]"
"342","2018-08-23 01:53:46.751049","192.168.2.3","216.58.197.4","TLSv1.2","155","Application Data"
"348","2018-08-23 01:53:46.810814","192.168.2.3","216.58.197.4","TCP","66","34236  >  443 [ACK] Seq=182969 Ack=4915 Win=1828 Len=0 TSval=7790894 TSecr=759801601"
"349","2018-08-23 01:53:46.849791","192.168.2.3","216.58.197.4","TCP","1434","34236  >  443 [ACK] Seq=182969 Ack=4915 Win=1828 Len=1368 TSval=7790898 TSecr=759801601 [TCP segment of a reassembled PDU]"
"350","2018-08-23 01:53:46.849796","192.168.2.3","216.58.197.4","TCP","1434","34236  >  443 [ACK] Seq=184337 Ack=4915 Win=1828 Len=1368 TSval=7790898 TSecr=759801601 [TCP segment of a reassembled PDU]"
"351","2018-08-23 01:53:46.849797","192.168.2.3","216.58.197.4","TLSv1.2","212","Application Data"
"352","2018-08-23 01:53:46.850040","192.168.2.3","216.58.197.4","TCP","1434","34236  >  443 [ACK] Seq=185851 Ack=4915 Win=1828 Len=1368 TSval=7790898 TSecr=759801601 [TCP segment of a reassembled PDU]"
"353","2018-08-23 01:53:46.850042","192.168.2.3","216.58.197.4","TLSv1.2","155","Application Data"
"357","2018-08-23 01:53:46.941568","192.168.2.3","216.58.197.4","TCP","1434","34236  >  443 [ACK] Seq=187308 Ack=4915 Win=1828 Len=1368 TSval=7790907 TSecr=759801650 [TCP segment of a reassembled PDU]"
"358","2018-08-23 01:53:46.941573","192.168.2.3","216.58.197.4","TCP","1434","34236  >  443 [ACK] Seq=188676 Ack=4915 Win=1828 Len=1368 TSval=7790907 TSecr=759801650 [TCP segment of a reassembled PDU]"
"359","2018-08-23 01:53:46.941574","192.168.2.3","216.58.197.4","TLSv1.2","212","Application Data"
"360","2018-08-23 01:53:46.941950","192.168.2.3","216.58.197.4","TCP","1434","34236  >  443 [ACK] Seq=190190 Ack=4915 Win=1828 Len=1368 TSval=7790907 TSecr=759801650 [TCP segment of a reassembled PDU]"
"361","2018-08-23 01:53:46.941954","192.168.2.3","216.58.197.4","TLSv1.2","155","Application Data"
"367","2018-08-23 01:53:46.992936","192.168.2.3","216.58.197.4","TCP","66","34236  >  443 [ACK] Seq=191647 Ack=5306 Win=1828 Len=0 TSval=7790912 TSecr=759801787"
"368","2018-08-23 01:53:47.038720","192.168.2.3","216.58.197.4","TCP","1434","34236  >  443 [ACK] Seq=191647 Ack=5306 Win=1828 Len=1368 TSval=7790917 TSecr=759801787 [TCP segment of a reassembled PDU]"
"369","2018-08-23 01:53:47.038724","192.168.2.3","216.58.197.4","TCP","1434","34236  >  443 [ACK] Seq=193015 Ack=5306 Win=1828 Len=1368 TSval=7790917 TSecr=759801787 [TCP segment of a reassembled PDU]"
"370","2018-08-23 01:53:47.038725","192.168.2.3","216.58.197.4","TLSv1.2","212","Application Data"
"371","2018-08-23 01:53:47.039052","192.168.2.3","216.58.197.4","TCP","1434","34236  >  443 [ACK] Seq=194529 Ack=5306 Win=1828 Len=1368 TSval=7790917 TSecr=759801787 [TCP segment of a reassembled PDU]"
"372","2018-08-23 01:53:47.039054","192.168.2.3","216.58.197.4","TLSv1.2","155","Application Data"
"377","2018-08-23 01:53:47.154840","192.168.2.3","216.58.197.4","TCP","1434","34236  >  443 [ACK] Seq=195986 Ack=5306 Win=1828 Len=1368 TSval=7790928 TSecr=759801839 [TCP segment of a reassembled PDU]"
"378","2018-08-23 01:53:47.154844","192.168.2.3","216.58.197.4","TCP","1434","34236  >  443 [ACK] Seq=197354 Ack=5306 Win=1828 Len=1368 TSval=7790928 TSecr=759801839 [TCP segment of a reassembled PDU]"
"379","2018-08-23 01:53:47.154976","192.168.2.3","216.58.197.4","TLSv1.2","212","Application Data"
"380","2018-08-23 01:53:47.155187","192.168.2.3","216.58.197.4","TCP","1434","34236  >  443 [ACK] Seq=198868 Ack=5306 Win=1828 Len=1368 TSval=7790928 TSecr=759801839 [TCP segment of a reassembled PDU]"
"381","2018-08-23 01:53:47.155189","192.168.2.3","216.58.197.4","TLSv1.2","155","Application Data"
"385","2018-08-23 01:53:47.171460","192.168.2.3","216.58.197.4","TCP","66","34236  >  443 [ACK] Seq=200325 Ack=5809 Win=1828 Len=0 TSval=7790930 TSecr=759801950"
"388","2018-08-23 01:53:47.206012","192.168.2.3","216.58.197.4","TCP","66","34236  >  443 [ACK] Seq=200325 Ack=5956 Win=1828 Len=0 TSval=7790934 TSecr=759802000"
"389","2018-08-23 01:53:47.230246","192.168.2.3","216.58.197.4","TCP","1434","34236  >  443 [ACK] Seq=200325 Ack=5956 Win=1828 Len=1368 TSval=7790936 TSecr=759802000 [TCP segment of a reassembled PDU]"
"390","2018-08-23 01:53:47.230701","192.168.2.3","216.58.197.4","TCP","1434","34236  >  443 [ACK] Seq=201693 Ack=5956 Win=1828 Len=1368 TSval=7790936 TSecr=759802000 [TCP segment of a reassembled PDU]"
"391","2018-08-23 01:53:47.230703","192.168.2.3","216.58.197.4","TLSv1.2","212","Application Data"
"392","2018-08-23 01:53:47.230704","192.168.2.3","216.58.197.4","TCP","1434","34236  >  443 [ACK] Seq=203207 Ack=5956 Win=1828 Len=1368 TSval=7790936 TSecr=759802000 [TCP segment of a reassembled PDU]"
"393","2018-08-23 01:53:47.230704","192.168.2.3","216.58.197.4","TLSv1.2","155","Application Data"
"397","2018-08-23 01:53:47.345861","192.168.2.3","216.58.197.4","TCP","1434","34236  >  443 [ACK] Seq=204664 Ack=5956 Win=1828 Len=1368 TSval=7790947 TSecr=759802070 [TCP segment of a reassembled PDU]"
"398","2018-08-23 01:53:47.346013","192.168.2.3","216.58.197.4","TCP","1434","34236  >  443 [ACK] Seq=206032 Ack=5956 Win=1828 Len=1368 TSval=7790947 TSecr=759802070 [TCP segment of a reassembled PDU]"
"399","2018-08-23 01:53:47.346015","192.168.2.3","216.58.197.4","TLSv1.2","212","Application Data"
"400","2018-08-23 01:53:47.346210","192.168.2.3","216.58.197.4","TCP","1434","34236  >  443 [ACK] Seq=207546 Ack=5956 Win=1828 Len=1368 TSval=7790947 TSecr=759802070 [TCP segment of a reassembled PDU]"
"401","2018-08-23 01:53:47.346212","192.168.2.3","216.58.197.4","TLSv1.2","69","Application Data"
"407","2018-08-23 01:53:47.404207","192.168.2.3","216.58.197.4","TCP","66","34236  >  443 [ACK] Seq=208917 Ack=6262 Win=1828 Len=0 TSval=7790953 TSecr=759802197"
"408","2018-08-23 01:53:47.442025","192.168.2.3","216.58.197.4","TCP","1434","34236  >  443 [ACK] Seq=208917 Ack=6262 Win=1828 Len=1368 TSval=7790957 TSecr=759802197 [TCP segment of a reassembled PDU]"
"409","2018-08-23 01:53:47.442423","192.168.2.3","216.58.197.4","TCP","1434","34236  >  443 [ACK] Seq=210285 Ack=6262 Win=1828 Len=1368 TSval=7790957 TSecr=759802197 [TCP segment of a reassembled PDU]"
"410","2018-08-23 01:53:47.442426","192.168.2.3","216.58.197.4","TLSv1.2","212","Application Data"
"411","2018-08-23 01:53:47.442427","192.168.2.3","216.58.197.4","TCP","1434","34236  >  443 [ACK] Seq=211799 Ack=6262 Win=1828 Len=1368 TSval=7790957 TSecr=759802197 [TCP segment of a reassembled PDU]"
"412","2018-08-23 01:53:47.442577","192.168.2.3","216.58.197.4","TLSv1.2","155","Application Data"
"416","2018-08-23 01:53:47.550796","192.168.2.3","216.58.197.4","TCP","1434","34236  >  443 [ACK] Seq=213256 Ack=6262 Win=1828 Len=1368 TSval=7790968 TSecr=759802242 [TCP segment of a reassembled PDU]"
"417","2018-08-23 01:53:47.550802","192.168.2.3","216.58.197.4","TCP","1434","34236  >  443 [ACK] Seq=214624 Ack=6262 Win=1828 Len=1368 TSval=7790968 TSecr=759802242 [TCP segment of a reassembled PDU]"
"418","2018-08-23 01:53:47.550803","192.168.2.3","216.58.197.4","TLSv1.2","212","Application Data"
"419","2018-08-23 01:53:47.551176","192.168.2.3","216.58.197.4","TCP","1434","34236  >  443 [ACK] Seq=216138 Ack=6262 Win=1828 Len=1368 TSval=7790968 TSecr=759802242 [TCP segment of a reassembled PDU]"
"420","2018-08-23 01:53:47.551193","192.168.2.3","216.58.197.4","TLSv1.2","155","Application Data"
"427","2018-08-23 01:53:47.602174","192.168.2.3","216.58.197.4","TCP","66","34236  >  443 [ACK] Seq=217595 Ack=7014 Win=1828 Len=0 TSval=7790973 TSecr=759802379"
"428","2018-08-23 01:53:47.665318","192.168.2.3","216.58.197.4","TCP","1434","34236  >  443 [ACK] Seq=217595 Ack=7014 Win=1828 Len=1368 TSval=7790979 TSecr=759802379 [TCP segment of a reassembled PDU]"
"429","2018-08-23 01:53:47.665545","192.168.2.3","216.58.197.4","TCP","1434","34236  >  443 [ACK] Seq=218963 Ack=7014 Win=1828 Len=1368 TSval=7790979 TSecr=759802379 [TCP segment of a reassembled PDU]"
"430","2018-08-23 01:53:47.665547","192.168.2.3","216.58.197.4","TLSv1.2","212","Application Data"
"431","2018-08-23 01:53:47.665548","192.168.2.3","216.58.197.4","TCP","1434","34236  >  443 [ACK] Seq=220477 Ack=7014 Win=1828 Len=1368 TSval=7790979 TSecr=759802379 [TCP segment of a reassembled PDU]"
"432","2018-08-23 01:53:47.665742","192.168.2.3","216.58.197.4","TLSv1.2","155","Application Data"
"436","2018-08-23 01:53:47.760765","192.168.2.3","216.58.197.4","TCP","1434","34236  >  443 [ACK] Seq=221934 Ack=7014 Win=1828 Len=1368 TSval=7790989 TSecr=759802505 [TCP segment of a reassembled PDU]"
"437","2018-08-23 01:53:47.760780","192.168.2.3","216.58.197.4","TCP","1434","34236  >  443 [ACK] Seq=223302 Ack=7014 Win=1828 Len=1368 TSval=7790989 TSecr=759802505 [TCP segment of a reassembled PDU]"
"438","2018-08-23 01:53:47.760782","192.168.2.3","216.58.197.4","TLSv1.2","212","Application Data"
"439","2018-08-23 01:53:47.761040","192.168.2.3","216.58.197.4","TCP","1434","34236  >  443 [ACK] Seq=224816 Ack=7014 Win=1828 Len=1368 TSval=7790989 TSecr=759802505 [TCP segment of a reassembled PDU]"
"440","2018-08-23 01:53:47.761047","192.168.2.3","216.58.197.4","TLSv1.2","155","Application Data"
"444","2018-08-23 01:53:47.857977","192.168.2.3","216.58.197.4","TCP","1434","34236  >  443 [ACK] Seq=226273 Ack=7014 Win=1828 Len=1368 TSval=7790999 TSecr=759802561 [TCP segment of a reassembled PDU]"
"445","2018-08-23 01:53:47.857985","192.168.2.3","216.58.197.4","TCP","1434","34236  >  443 [ACK] Seq=227641 Ack=7014 Win=1828 Len=1368 TSval=7790999 TSecr=759802561 [TCP segment of a reassembled PDU]"
"446","2018-08-23 01:53:47.857987","192.168.2.3","216.58.197.4","TLSv1.2","212","Application Data"
"447","2018-08-23 01:53:47.858310","192.168.2.3","216.58.197.4","TCP","1434","34236  >  443 [ACK] Seq=229155 Ack=7014 Win=1828 Len=1368 TSval=7790999 TSecr=759802561 [TCP segment of a reassembled PDU]"
"448","2018-08-23 01:53:47.858313","192.168.2.3","216.58.197.4","TLSv1.2","155","Application Data"
"452","2018-08-23 01:53:47.953814","192.168.2.3","216.58.197.4","TCP","1434","34236  >  443 [ACK] Seq=230612 Ack=7014 Win=1828 Len=1368 TSval=7791008 TSecr=759802659 [TCP segment of a reassembled PDU]"
"453","2018-08-23 01:53:47.954223","192.168.2.3","216.58.197.4","TCP","1434","34236  >  443 [ACK] Seq=231980 Ack=7014 Win=1828 Len=1368 TSval=7791008 TSecr=759802659 [TCP segment of a reassembled PDU]"
"454","2018-08-23 01:53:47.954226","192.168.2.3","216.58.197.4","TLSv1.2","212","Application Data"
"455","2018-08-23 01:53:47.954227","192.168.2.3","216.58.197.4","TCP","1434","34236  >  443 [ACK] Seq=233494 Ack=7014 Win=1828 Len=1368 TSval=7791008 TSecr=759802659 [TCP segment of a reassembled PDU]"
"456","2018-08-23 01:53:47.954354","192.168.2.3","216.58.197.4","TLSv1.2","155","Application Data"
"461","2018-08-23 01:53:48.011870","192.168.2.3","216.58.197.4","TCP","66","34236  >  443 [ACK] Seq=234951 Ack=7413 Win=1828 Len=0 TSval=7791014 TSecr=759802804"
"462","2018-08-23 01:53:48.049949","192.168.2.3","216.58.197.4","TCP","1434","34236  >  443 [ACK] Seq=234951 Ack=7413 Win=1828 Len=1368 TSval=7791018 TSecr=759802804 [TCP segment of a reassembled PDU]"
"463","2018-08-23 01:53:48.050361","192.168.2.3","216.58.197.4","TCP","1434","34236  >  443 [ACK] Seq=236319 Ack=7413 Win=1828 Len=1368 TSval=7791018 TSecr=759802804 [TCP segment of a reassembled PDU]"
"464","2018-08-23 01:53:48.050363","192.168.2.3","216.58.197.4","TLSv1.2","212","Application Data"
"465","2018-08-23 01:53:48.050364","192.168.2.3","216.58.197.4","TCP","1434","34236  >  443 [ACK] Seq=237833 Ack=7413 Win=1828 Len=1368 TSval=7791018 TSecr=759802804 [TCP segment of a reassembled PDU]"
"466","2018-08-23 01:53:48.050365","192.168.2.3","216.58.197.4","TLSv1.2","155","Application Data"
"471","2018-08-23 01:53:48.096821","192.168.2.3","216.58.197.4","TCP","66","34236  >  443 [ACK] Seq=239290 Ack=7801 Win=1828 Len=0 TSval=7791023 TSecr=759802891"
"472","2018-08-23 01:53:48.127609","192.168.2.3","216.58.197.4","TCP","1434","34236  >  443 [ACK] Seq=239290 Ack=7801 Win=1828 Len=1368 TSval=7791026 TSecr=759802891 [TCP segment of a reassembled PDU]"
"473","2018-08-23 01:53:48.127906","192.168.2.3","216.58.197.4","TCP","1434","34236  >  443 [ACK] Seq=240658 Ack=7801 Win=1828 Len=1368 TSval=7791026 TSecr=759802891 [TCP segment of a reassembled PDU]"
"474","2018-08-23 01:53:48.127911","192.168.2.3","216.58.197.4","TLSv1.2","212","Application Data"
"475","2018-08-23 01:53:48.127912","192.168.2.3","216.58.197.4","TLSv1.2","805","Application Data"
"476","2018-08-23 01:53:48.127913","192.168.2.3","216.58.197.4","TLSv1.2","102","Application Data"
"483","2018-08-23 01:53:48.174706","192.168.2.3","216.58.197.4","TCP","66","34236  >  443 [ACK] Seq=242947 Ack=8188 Win=1828 Len=0 TSval=7791030 TSecr=759802950"
"486","2018-08-23 01:53:48.181501","192.168.2.3","216.58.197.4","TCP","66","34236  >  443 [ACK] Seq=242947 Ack=8862 Win=1828 Len=0 TSval=7791031 TSecr=759802974"
"488","2018-08-23 01:53:48.435391","192.168.2.3","216.58.197.4","TCP","66","34236  >  443 [ACK] Seq=242947 Ack=8956 Win=1828 Len=0 TSval=7791057 TSecr=759803194"
"490","2018-08-23 01:53:48.449927","192.168.2.3","216.58.197.4","TCP","66","34236  >  443 [ACK] Seq=242947 Ack=10210 Win=1828 Len=0 TSval=7791058 TSecr=759803237"
"491","2018-08-23 01:53:48.535379","192.168.2.3","216.58.197.10","TCP","66","47764  >  443 [ACK] Seq=1 Ack=1 Win=495 Len=0 TSval=7791067 TSecr=519184062"
"525","2018-08-23 01:53:48.575543","192.168.2.3","216.58.197.4","TCP","66","34236  >  443 [ACK] Seq=242947 Ack=11628 Win=1812 Len=0 TSval=7791070 TSecr=759803363"
"526","2018-08-23 01:53:48.575547","192.168.2.3","216.58.197.4","TCP","66","34236  >  443 [ACK] Seq=242947 Ack=11933 Win=1812 Len=0 TSval=7791070 TSecr=759803363"
"531","2018-08-23 01:53:48.575719","192.168.2.3","216.58.197.4","TCP","66","34236  >  443 [ACK] Seq=242947 Ack=13351 Win=1812 Len=0 TSval=7791070 TSecr=759803364"
"532","2018-08-23 01:53:48.575721","192.168.2.3","216.58.197.4","TCP","66","34236  >  443 [ACK] Seq=242947 Ack=13648 Win=1828 Len=0 TSval=7791070 TSecr=759803364"
"533","2018-08-23 01:53:48.575722","192.168.2.3","216.58.197.4","TCP","66","34236  >  443 [ACK] Seq=242947 Ack=15538 Win=1802 Len=0 TSval=7791070 TSecr=759803364"
"534","2018-08-23 01:53:48.575723","192.168.2.3","216.58.197.4","TCP","66","34236  >  443 [ACK] Seq=242947 Ack=16956 Win=1812 Len=0 TSval=7791070 TSecr=759803364"
"535","2018-08-23 01:53:48.575724","192.168.2.3","216.58.197.4","TCP","66","34236  >  443 [ACK] Seq=242947 Ack=17258 Win=1812 Len=0 TSval=7791070 TSecr=759803364"
"539","2018-08-23 01:53:48.583940","192.168.2.3","216.58.197.4","TCP","66","34236  >  443 [ACK] Seq=242947 Ack=18676 Win=1812 Len=0 TSval=7791071 TSecr=759803365"
"540","2018-08-23 01:53:48.583944","192.168.2.3","216.58.197.4","TCP","66","34236  >  443 [ACK] Seq=242947 Ack=20803 Win=1802 Len=0 TSval=7791071 TSecr=759803365"
"541","2018-08-23 01:53:48.583945","192.168.2.3","216.58.197.4","TCP","66","34236  >  443 [ACK] Seq=242947 Ack=22483 Win=1812 Len=0 TSval=7791071 TSecr=759803365"
"542","2018-08-23 01:53:48.583946","192.168.2.3","216.58.197.4","TCP","66","34236  >  443 [ACK] Seq=242947 Ack=29444 Win=1828 Len=0 TSval=7791071 TSecr=759803366"
"543","2018-08-23 01:53:48.583947","192.168.2.3","216.58.197.4","TCP","66","34236  >  443 [ACK] Seq=242947 Ack=35396 Win=1828 Len=0 TSval=7791071 TSecr=759803368"
"544","2018-08-23 01:53:48.583949","192.168.2.3","216.58.197.4","TCP","66","34236  >  443 [ACK] Seq=242947 Ack=37285 Win=1828 Len=0 TSval=7791071 TSecr=759803369"
"545","2018-08-23 01:53:48.583949","192.168.2.3","216.58.197.4","TCP","66","34236  >  443 [ACK] Seq=242947 Ack=39077 Win=1828 Len=0 TSval=7791071 TSecr=759803370"
"546","2018-08-23 01:53:48.583951","192.168.2.3","216.58.197.4","TCP","66","34236  >  443 [ACK] Seq=242947 Ack=40913 Win=1828 Len=0 TSval=7791071 TSecr=759803371"
"547","2018-08-23 01:53:48.583951","192.168.2.3","216.58.197.4","TCP","66","34236  >  443 [ACK] Seq=242947 Ack=44104 Win=1828 Len=0 TSval=7791071 TSecr=759803371"
"548","2018-08-23 01:53:48.584125","192.168.2.3","216.58.197.4","TCP","66","34236  >  443 [ACK] Seq=242947 Ack=44689 Win=1828 Len=0 TSval=7791071 TSecr=759803372"
"555","2018-08-23 01:53:48.615342","192.168.2.3","216.58.197.4","TCP","66","34236  >  443 [ACK] Seq=242947 Ack=45176 Win=1828 Len=0 TSval=7791075 TSecr=759803409"
"556","2018-08-23 01:53:48.616611","192.168.2.3","216.58.197.4","TCP","66","34236  >  443 [ACK] Seq=242947 Ack=45443 Win=1828 Len=0 TSval=7791075 TSecr=759803409"
"557","2018-08-23 01:53:48.618440","192.168.2.3","216.58.197.4","TLSv1.2","104","Application Data"
"560","2018-08-23 01:53:56.161976","192.168.2.3","216.58.197.14","TLSv1.2","160","Application Data"
"561","2018-08-23 01:53:56.161981","192.168.2.3","216.58.197.14","TLSv1.2","104","Application Data"
"562","2018-08-23 01:53:56.161982","192.168.2.3","216.58.197.14","TLSv1.2","582","Application Data"
"567","2018-08-23 01:53:56.205479","192.168.2.3","216.58.197.14","TCP","66","41142  >  443 [ACK] Seq=649 Ack=39 Win=463 Len=0 TSval=7791834 TSecr=932819696"
"572","2018-08-23 01:53:56.247386","192.168.2.3","216.58.197.14","TCP","66","41142  >  443 [ACK] Seq=649 Ack=107 Win=463 Len=0 TSval=7791838 TSecr=932819776"
"573","2018-08-23 01:53:56.247564","192.168.2.3","216.58.197.14","TCP","66","41142  >  443 [ACK] Seq=649 Ack=367 Win=480 Len=0 TSval=7791838 TSecr=932819776"
"574","2018-08-23 01:53:56.247840","192.168.2.3","216.58.197.14","TCP","66","41142  >  443 [ACK] Seq=649 Ack=525 Win=497 Len=0 TSval=7791838 TSecr=932819776"
"575","2018-08-23 01:53:56.248139","192.168.2.3","216.58.197.14","TCP","66","41142  >  443 [ACK] Seq=649 Ack=563 Win=497 Len=0 TSval=7791838 TSecr=932819776"
"576","2018-08-23 01:53:56.248782","192.168.2.3","216.58.197.14","TLSv1.2","104","Application Data"
"578","2018-08-23 01:53:56.679340","192.168.2.3","216.58.197.3","TLSv1.2","135","[TCP Previous segment not captured] , Application Data"
"579","2018-08-23 01:53:56.679529","192.168.2.3","216.58.197.3","TLSv1.2","104","Application Data"
"582","2018-08-23 01:53:56.747994","192.168.2.3","216.58.197.3","TLSv1.2","100","Application Data"
"583","2018-08-23 01:53:56.747999","192.168.2.3","216.58.197.3","TLSv1.2","104","Application Data"
"585","2018-08-23 01:53:57.065433","192.168.2.3","216.58.197.14","TCP","66","41146  >  443 [ACK] Seq=1 Ack=1 Win=279 Len=0 TSval=7791920 TSecr=1819700781"
