"No.","Time","Source","Destination","Protocol","Length","Info"
"33","2018-05-18 09:13:14.668425","192.168.2.2","111.119.29.53","TCP","66","62185  >  80 [ACK] Seq=1 Ack=4294920961 Win=9683 Len=0 TSval=464880513 TSecr=990006258"
"34","2018-05-18 09:13:14.668429","192.168.2.2","111.119.29.53","TCP","66","62185  >  80 [ACK] Seq=1 Ack=4294923857 Win=9638 Len=0 TSval=464880548 TSecr=990006279"
"35","2018-05-18 09:13:14.668429","192.168.2.2","111.119.29.53","TCP","66","[TCP Window Update] 62185  >  80 [ACK] Seq=1 Ack=4294923857 Win=9683 Len=0 TSval=464880553 TSecr=990006279"
"36","2018-05-18 09:13:14.668446","192.168.2.2","111.119.29.53","TCP","66","62185  >  80 [ACK] Seq=1 Ack=4294926753 Win=9660 Len=0 TSval=464880592 TSecr=990006300"
"37","2018-05-18 09:13:14.668446","192.168.2.2","111.119.29.53","TCP","66","62185  >  80 [ACK] Seq=1 Ack=4294928201 Win=9683 Len=0 TSval=464880647 TSecr=990006321"
"38","2018-05-18 09:13:14.668448","192.168.2.2","111.119.29.53","TCP","66","62185  >  80 [ACK] Seq=1 Ack=4294931097 Win=9638 Len=0 TSval=464880664 TSecr=990006332"
"39","2018-05-18 09:13:14.668449","192.168.2.2","111.119.29.53","TCP","66","[TCP Window Update] 62185  >  80 [ACK] Seq=1 Ack=4294931097 Win=9683 Len=0 TSval=464880664 TSecr=990006332"
"40","2018-05-18 09:13:14.668450","192.168.2.2","111.119.29.53","TCP","66","62185  >  80 [ACK] Seq=1 Ack=4294933993 Win=9660 Len=0 TSval=464880731 TSecr=990006353"
"41","2018-05-18 09:13:14.668450","192.168.2.2","111.119.29.53","TCP","66","62185  >  80 [ACK] Seq=1 Ack=4294935441 Win=9683 Len=0 TSval=464880743 TSecr=990006374"
"46","2018-05-18 09:13:14.668729","192.168.2.2","111.119.29.53","TCP","66","62185  >  80 [ACK] Seq=1 Ack=4294938337 Win=9660 Len=0 TSval=464880805 TSecr=990006384"
"47","2018-05-18 09:13:14.668730","192.168.2.2","111.119.29.53","TCP","66","62185  >  80 [ACK] Seq=1 Ack=4294939785 Win=9683 Len=0 TSval=464880861 TSecr=990006406"
"48","2018-05-18 09:13:14.668730","192.168.2.2","111.119.29.53","TCP","66","62185  >  80 [ACK] Seq=1 Ack=4294942681 Win=9660 Len=0 TSval=464880921 TSecr=990006416"
"49","2018-05-18 09:13:14.668731","192.168.2.2","111.119.29.53","TCP","66","62185  >  80 [ACK] Seq=1 Ack=4294944129 Win=9683 Len=0 TSval=464880981 TSecr=990006437"
"50","2018-05-18 09:13:14.668732","192.168.2.2","111.119.29.53","TCP","66","62185  >  80 [ACK] Seq=1 Ack=4294947025 Win=9660 Len=0 TSval=464881056 TSecr=990006448"
"51","2018-05-18 09:13:14.668732","192.168.2.2","111.119.29.53","TCP","66","62185  >  80 [ACK] Seq=1 Ack=4294948473 Win=9683 Len=0 TSval=464881058 TSecr=990006469"
"52","2018-05-18 09:13:14.668733","192.168.2.2","111.119.29.53","TCP","66","62185  >  80 [ACK] Seq=1 Ack=4294951369 Win=9660 Len=0 TSval=464881115 TSecr=990006480"
"54","2018-05-18 09:13:14.668734","192.168.2.2","111.119.29.53","TCP","66","62185  >  80 [ACK] Seq=1 Ack=4294952817 Win=9683 Len=0 TSval=464881173 TSecr=990006501"
"56","2018-05-18 09:13:14.668952","192.168.2.2","111.119.29.53","TCP","66","62185  >  80 [ACK] Seq=1 Ack=4294955713 Win=9660 Len=0 TSval=464881250 TSecr=990006512"
"57","2018-05-18 09:13:14.668954","192.168.2.2","111.119.29.53","TCP","66","62185  >  80 [ACK] Seq=1 Ack=4294957161 Win=9683 Len=0 TSval=464881252 TSecr=990006533"
"58","2018-05-18 09:13:14.668955","192.168.2.2","111.119.29.53","TCP","66","62185  >  80 [ACK] Seq=1 Ack=4294960057 Win=9660 Len=0 TSval=464881287 TSecr=990006543"
"59","2018-05-18 09:13:14.668968","192.168.2.2","111.119.29.53","TCP","66","62185  >  80 [ACK] Seq=1 Ack=4294961505 Win=9683 Len=0 TSval=464881293 TSecr=990006564"
"60","2018-05-18 09:13:14.668969","192.168.2.2","111.119.29.53","TCP","66","62185  >  80 [ACK] Seq=1 Ack=4294964401 Win=9660 Len=0 TSval=464881413 TSecr=990006575"
"61","2018-05-18 09:13:14.668970","192.168.2.2","111.119.29.53","TCP","66","62185  >  80 [ACK] Seq=1 Ack=4294965849 Win=9683 Len=0 TSval=464881475 TSecr=990006596"
"69","2018-05-18 09:13:14.676394","192.168.2.2","111.119.29.53","TCP","66","62185  >  80 [ACK] Seq=1 Ack=1449 Win=9660 Len=0 TSval=464881608 TSecr=990006606"
"70","2018-05-18 09:13:14.679400","192.168.2.2","111.119.29.53","TCP","78","[TCP Window Update] 62185  >  80 [ACK] Seq=1 Ack=1449 Win=9683 Len=0 TSval=464881612 TSecr=990006606 SLE=4294920961 SRE=4294922409"
"72","2018-05-18 09:13:14.682667","192.168.2.2","111.119.29.53","TCP","78","[TCP Dup ACK 69#1] 62185  >  80 [ACK] Seq=1 Ack=1449 Win=9683 Len=0 TSval=464881615 TSecr=990006606 SLE=4294922409 SRE=4294923857"
"75","2018-05-18 09:13:14.696482","192.168.2.2","111.119.29.53","TCP","78","[TCP Dup ACK 69#2] 62185  >  80 [ACK] Seq=1 Ack=1449 Win=9683 Len=0 TSval=464881618 TSecr=990006606 SLE=4294923857 SRE=4294925305"
"76","2018-05-18 09:13:14.696484","192.168.2.2","111.119.29.53","TCP","78","[TCP Dup ACK 69#3] 62185  >  80 [ACK] Seq=1 Ack=1449 Win=9683 Len=0 TSval=464881621 TSecr=990006606 SLE=4294925305 SRE=4294926753"
"78","2018-05-18 09:13:14.699409","192.168.2.2","111.119.29.53","TCP","78","[TCP Dup ACK 69#4] 62185  >  80 [ACK] Seq=1 Ack=1449 Win=9683 Len=0 TSval=464881623 TSecr=990006606 SLE=4294926753 SRE=4294928201"
"79","2018-05-18 09:13:14.699411","192.168.2.2","111.119.29.53","TCP","78","[TCP Dup ACK 69#5] 62185  >  80 [ACK] Seq=1 Ack=1449 Win=9683 Len=0 TSval=464881628 TSecr=990006606 SLE=4294928201 SRE=4294929649"
"81","2018-05-18 09:13:14.710803","192.168.2.2","111.119.29.53","TCP","78","[TCP Dup ACK 69#6] 62185  >  80 [ACK] Seq=1 Ack=1449 Win=9683 Len=0 TSval=464881633 TSecr=990006606 SLE=4294929649 SRE=4294931097"
"82","2018-05-18 09:13:14.710805","192.168.2.2","111.119.29.53","TCP","78","[TCP Dup ACK 69#7] 62185  >  80 [ACK] Seq=1 Ack=1449 Win=9683 Len=0 TSval=464881636 TSecr=990006606 SLE=4294931097 SRE=4294932545"
"83","2018-05-18 09:13:14.713932","192.168.2.2","111.119.29.53","TCP","78","[TCP Dup ACK 69#8] 62185  >  80 [ACK] Seq=1 Ack=1449 Win=9683 Len=0 TSval=464881638 TSecr=990006606 SLE=4294932545 SRE=4294933993"
"84","2018-05-18 09:13:14.713934","192.168.2.2","111.119.29.53","TCP","78","[TCP Dup ACK 69#9] 62185  >  80 [ACK] Seq=1 Ack=1449 Win=9683 Len=0 TSval=464881640 TSecr=990006606 SLE=4294933993 SRE=4294935441"
"85","2018-05-18 09:13:14.717416","192.168.2.2","111.119.29.53","TCP","78","[TCP Dup ACK 69#10] 62185  >  80 [ACK] Seq=1 Ack=1449 Win=9683 Len=0 TSval=464881642 TSecr=990006606 SLE=4294935441 SRE=4294936889"
"86","2018-05-18 09:13:14.717419","192.168.2.2","111.119.29.53","TCP","78","[TCP Dup ACK 69#11] 62185  >  80 [ACK] Seq=1 Ack=1449 Win=9683 Len=0 TSval=464881645 TSecr=990006606 SLE=4294936889 SRE=4294938337"
"87","2018-05-18 09:13:14.781673","192.168.2.2","111.119.29.53","TCP","78","[TCP Dup ACK 69#12] 62185  >  80 [ACK] Seq=1 Ack=1449 Win=9683 Len=0 TSval=464881648 TSecr=990006606 SLE=4294938337 SRE=4294939785"
"88","2018-05-18 09:13:14.781677","192.168.2.2","111.119.29.53","TCP","78","[TCP Dup ACK 69#13] 62185  >  80 [ACK] Seq=1 Ack=1449 Win=9683 Len=0 TSval=464881651 TSecr=990006606 SLE=4294939785 SRE=4294941233"
"89","2018-05-18 09:13:14.782241","192.168.2.2","111.119.29.53","TCP","78","[TCP Dup ACK 69#14] 62185  >  80 [ACK] Seq=1 Ack=1449 Win=9683 Len=0 TSval=464881653 TSecr=990006606 SLE=4294941233 SRE=4294942681"
"90","2018-05-18 09:13:14.782243","192.168.2.2","111.119.29.53","TCP","78","[TCP Dup ACK 69#15] 62185  >  80 [ACK] Seq=1 Ack=1449 Win=9683 Len=0 TSval=464881655 TSecr=990006606 SLE=4294942681 SRE=4294944129"
"91","2018-05-18 09:13:14.782244","192.168.2.2","111.119.29.53","TCP","78","[TCP Dup ACK 69#16] 62185  >  80 [ACK] Seq=1 Ack=1449 Win=9683 Len=0 TSval=464881659 TSecr=990006606 SLE=4294944129 SRE=4294945577"
"92","2018-05-18 09:13:14.782244","192.168.2.2","111.119.29.53","TCP","78","[TCP Dup ACK 69#17] 62185  >  80 [ACK] Seq=1 Ack=1449 Win=9683 Len=0 TSval=464881661 TSecr=990006606 SLE=4294945577 SRE=4294947025"
"93","2018-05-18 09:13:14.782245","192.168.2.2","111.119.29.53","TCP","78","[TCP Dup ACK 69#18] 62185  >  80 [ACK] Seq=1 Ack=1449 Win=9683 Len=0 TSval=464881663 TSecr=990006606 SLE=4294947025 SRE=4294948473"
"94","2018-05-18 09:13:14.782247","192.168.2.2","111.119.29.53","TCP","78","[TCP Dup ACK 69#19] 62185  >  80 [ACK] Seq=1 Ack=1449 Win=9683 Len=0 TSval=464881668 TSecr=990006606 SLE=4294948473 SRE=4294949921"
"95","2018-05-18 09:13:14.782248","192.168.2.2","111.119.29.53","TCP","78","[TCP Dup ACK 69#20] 62185  >  80 [ACK] Seq=1 Ack=1449 Win=9683 Len=0 TSval=464881670 TSecr=990006606 SLE=4294949921 SRE=4294951369"
"96","2018-05-18 09:13:14.782248","192.168.2.2","111.119.29.53","TCP","78","[TCP Dup ACK 69#21] 62185  >  80 [ACK] Seq=1 Ack=1449 Win=9683 Len=0 TSval=464881673 TSecr=990006606 SLE=4294951369 SRE=4294952817"
"97","2018-05-18 09:13:14.782249","192.168.2.2","111.119.29.53","TCP","78","[TCP Dup ACK 69#22] 62185  >  80 [ACK] Seq=1 Ack=1449 Win=9683 Len=0 TSval=464881675 TSecr=990006606 SLE=4294952817 SRE=4294954265"
"98","2018-05-18 09:13:14.782249","192.168.2.2","111.119.29.53","TCP","78","[TCP Dup ACK 69#23] 62185  >  80 [ACK] Seq=1 Ack=1449 Win=9683 Len=0 TSval=464881684 TSecr=990006606 SLE=4294954265 SRE=4294955713"
"100","2018-05-18 09:13:14.782251","192.168.2.2","111.119.29.53","TCP","78","[TCP Dup ACK 69#24] 62185  >  80 [ACK] Seq=1 Ack=1449 Win=9683 Len=0 TSval=464881689 TSecr=990006606 SLE=4294955713 SRE=4294957161"
"103","2018-05-18 09:13:14.782252","192.168.2.2","111.119.29.53","TCP","66","62185  >  80 [ACK] Seq=1 Ack=4345 Win=9660 Len=0 TSval=464881696 TSecr=990007681"
"104","2018-05-18 09:13:14.782253","192.168.2.2","111.119.29.53","TCP","66","62185  >  80 [ACK] Seq=1 Ack=5793 Win=9683 Len=0 TSval=464881698 TSecr=990007697"
"119","2018-05-18 09:13:14.820586","192.168.2.2","111.119.29.53","TCP","66","62185  >  80 [ACK] Seq=1 Ack=8689 Win=9660 Len=0 TSval=464881710 TSecr=990007705"
"124","2018-05-18 09:13:14.821046","192.168.2.2","111.119.29.53","TCP","66","62185  >  80 [ACK] Seq=1 Ack=10137 Win=9683 Len=0 TSval=464881730 TSecr=990007797"
"128","2018-05-18 09:13:14.832172","192.168.2.2","111.119.29.53","TCP","66","62185  >  80 [ACK] Seq=1 Ack=13033 Win=9660 Len=0 TSval=464881744 TSecr=990007805"
"132","2018-05-18 09:13:14.846474","192.168.2.2","111.119.29.53","TCP","66","62185  >  80 [ACK] Seq=1 Ack=14481 Win=9683 Len=0 TSval=464881755 TSecr=990007836"
"138","2018-05-18 09:13:14.857503","192.168.2.2","111.119.29.53","TCP","66","62185  >  80 [ACK] Seq=1 Ack=17377 Win=9660 Len=0 TSval=464881766 TSecr=990007843"
"144","2018-05-18 09:13:14.863969","192.168.2.2","111.119.29.53","TCP","66","62185  >  80 [ACK] Seq=1 Ack=18825 Win=9683 Len=0 TSval=464881772 TSecr=990007859"
"147","2018-05-18 09:13:14.880030","192.168.2.2","111.119.29.53","TCP","66","62185  >  80 [ACK] Seq=1 Ack=21721 Win=9660 Len=0 TSval=464881785 TSecr=990007867"
"149","2018-05-18 09:13:14.890467","192.168.2.2","111.119.29.53","TCP","66","62185  >  80 [ACK] Seq=1 Ack=23169 Win=9683 Len=0 TSval=464881795 TSecr=990007883"
"152","2018-05-18 09:13:14.909395","192.168.2.2","111.119.29.53","TCP","66","62185  >  80 [ACK] Seq=1 Ack=26065 Win=9660 Len=0 TSval=464881811 TSecr=990007893"
"154","2018-05-18 09:13:14.914816","192.168.2.2","111.119.29.53","TCP","66","62185  >  80 [ACK] Seq=1 Ack=27513 Win=9683 Len=0 TSval=464881820 TSecr=990007910"
"172","2018-05-18 09:13:14.998516","192.168.2.2","111.119.29.53","TCP","66","62185  >  80 [ACK] Seq=1 Ack=30409 Win=9660 Len=0 TSval=464881892 TSecr=990007919"
"173","2018-05-18 09:13:14.998519","192.168.2.2","111.119.29.53","TCP","66","62185  >  80 [ACK] Seq=1 Ack=31857 Win=9683 Len=0 TSval=464881895 TSecr=990007937"
"176","2018-05-18 09:13:15.015976","192.168.2.2","111.119.29.53","TCP","66","62185  >  80 [ACK] Seq=1 Ack=34753 Win=9638 Len=0 TSval=464881903 TSecr=990007946"
"177","2018-05-18 09:13:15.015978","192.168.2.2","111.119.29.53","TCP","66","[TCP Window Update] 62185  >  80 [ACK] Seq=1 Ack=34753 Win=9683 Len=0 TSval=464881904 TSecr=990007946"
"178","2018-05-18 09:13:15.021785","192.168.2.2","111.119.29.53","TCP","66","62185  >  80 [ACK] Seq=1 Ack=37649 Win=9660 Len=0 TSval=464881909 TSecr=990007963"
"179","2018-05-18 09:13:15.021787","192.168.2.2","111.119.29.53","TCP","66","62185  >  80 [ACK] Seq=1 Ack=40545 Win=9615 Len=0 TSval=464881914 TSecr=990007980"
"182","2018-05-18 09:13:15.022209","192.168.2.2","111.119.29.53","TCP","66","62185  >  80 [ACK] Seq=1 Ack=43441 Win=9570 Len=0 TSval=464881919 TSecr=990007999"
"183","2018-05-18 09:13:15.025443","192.168.2.2","111.119.29.53","TCP","66","[TCP Window Update] 62185  >  80 [ACK] Seq=1 Ack=43441 Win=9683 Len=0 TSval=464881920 TSecr=990007999"
"185","2018-05-18 09:13:15.039687","192.168.2.2","111.119.29.53","TCP","66","62185  >  80 [ACK] Seq=1 Ack=46337 Win=9660 Len=0 TSval=464881933 TSecr=990008022"
"193","2018-05-18 09:13:15.050973","192.168.2.2","111.119.29.53","TCP","66","62185  >  80 [ACK] Seq=1 Ack=47785 Win=9683 Len=0 TSval=464881943 TSecr=990008043"
"201","2018-05-18 09:13:15.067066","192.168.2.2","111.119.29.53","TCP","66","62185  >  80 [ACK] Seq=1 Ack=50681 Win=9660 Len=0 TSval=464881955 TSecr=990008052"
"204","2018-05-18 09:13:15.074400","192.168.2.2","111.119.29.53","TCP","66","62185  >  80 [ACK] Seq=1 Ack=52129 Win=9683 Len=0 TSval=464881961 TSecr=990008069"
"212","2018-05-18 09:13:15.092325","192.168.2.2","111.119.29.53","TCP","66","62185  >  80 [ACK] Seq=1 Ack=55025 Win=9660 Len=0 TSval=464881978 TSecr=990008078"
"215","2018-05-18 09:13:15.110290","192.168.2.2","111.119.29.53","TCP","66","62185  >  80 [ACK] Seq=1 Ack=56473 Win=9683 Len=0 TSval=464881986 TSecr=990008096"
"217","2018-05-18 09:13:15.118810","192.168.2.2","111.119.29.53","TCP","66","62185  >  80 [ACK] Seq=1 Ack=59369 Win=9660 Len=0 TSval=464882002 TSecr=990008104"
"220","2018-05-18 09:13:15.123910","192.168.2.2","111.119.29.53","TCP","66","62185  >  80 [ACK] Seq=1 Ack=60817 Win=9683 Len=0 TSval=464882008 TSecr=990008120"
"223","2018-05-18 09:13:15.137755","192.168.2.2","111.119.29.53","TCP","66","62185  >  80 [ACK] Seq=1 Ack=63713 Win=9660 Len=0 TSval=464882021 TSecr=990008127"
"227","2018-05-18 09:13:15.149621","192.168.2.2","111.119.29.53","TCP","66","62185  >  80 [ACK] Seq=1 Ack=65161 Win=9683 Len=0 TSval=464882028 TSecr=990008141"
"229","2018-05-18 09:13:15.162103","192.168.2.2","111.119.29.53","TCP","66","62185  >  80 [ACK] Seq=1 Ack=68057 Win=9660 Len=0 TSval=464882040 TSecr=990008148"
"232","2018-05-18 09:13:15.172182","192.168.2.2","111.119.29.53","TCP","66","62185  >  80 [ACK] Seq=1 Ack=69505 Win=9683 Len=0 TSval=464882051 TSecr=990008162"
"234","2018-05-18 09:13:15.181149","192.168.2.2","111.119.29.53","TCP","66","62185  >  80 [ACK] Seq=1 Ack=72401 Win=9660 Len=0 TSval=464882058 TSecr=990008169"
"236","2018-05-18 09:13:15.187443","192.168.2.2","111.119.29.53","TCP","66","62185  >  80 [ACK] Seq=1 Ack=73849 Win=9683 Len=0 TSval=464882064 TSecr=990008182"
"240","2018-05-18 09:13:15.198907","192.168.2.2","111.119.29.53","TCP","66","62185  >  80 [ACK] Seq=1 Ack=76745 Win=9660 Len=0 TSval=464882074 TSecr=990008188"
"243","2018-05-18 09:13:15.204730","192.168.2.2","111.119.29.53","TCP","66","62185  >  80 [ACK] Seq=1 Ack=78193 Win=9683 Len=0 TSval=464882079 TSecr=990008198"
"249","2018-05-18 09:13:15.219495","192.168.2.2","111.119.29.53","TCP","66","62185  >  80 [ACK] Seq=1 Ack=81089 Win=9660 Len=0 TSval=464882089 TSecr=990008202"
"250","2018-05-18 09:13:15.222451","192.168.2.2","111.119.29.53","TCP","66","62185  >  80 [ACK] Seq=1 Ack=82537 Win=9683 Len=0 TSval=464882091 TSecr=990008211"
"251","2018-05-18 09:13:15.223163","192.168.2.2","111.119.29.53","TCP","66","62185  >  80 [ACK] Seq=1 Ack=85433 Win=9660 Len=0 TSval=464882096 TSecr=990008215"
"268","2018-05-18 09:13:15.280961","192.168.2.2","111.119.29.53","TCP","66","62185  >  80 [ACK] Seq=1 Ack=86881 Win=9683 Len=0 TSval=464882102 TSecr=990008223"
"292","2018-05-18 09:13:15.336803","192.168.2.2","111.119.29.53","TCP","66","62185  >  80 [ACK] Seq=1 Ack=89777 Win=9660 Len=0 TSval=464882163 TSecr=990008230"
"294","2018-05-18 09:13:15.342497","192.168.2.2","111.119.29.53","TCP","66","62185  >  80 [ACK] Seq=1 Ack=91225 Win=9683 Len=0 TSval=464882166 TSecr=990008239"
"295","2018-05-18 09:13:15.342499","192.168.2.2","111.119.29.53","TCP","66","62185  >  80 [ACK] Seq=1 Ack=94121 Win=9660 Len=0 TSval=464882175 TSecr=990008244"
"296","2018-05-18 09:13:15.342500","192.168.2.2","111.119.29.53","TCP","66","62185  >  80 [ACK] Seq=1 Ack=95569 Win=9683 Len=0 TSval=464882181 TSecr=990008253"
"298","2018-05-18 09:13:15.348463","192.168.2.2","111.119.29.53","TCP","66","62185  >  80 [ACK] Seq=1 Ack=98465 Win=9660 Len=0 TSval=464882212 TSecr=990008258"
"302","2018-05-18 09:13:15.368124","192.168.2.2","111.119.29.53","TCP","66","62185  >  80 [ACK] Seq=1 Ack=99913 Win=9683 Len=0 TSval=464882214 TSecr=990008267"
"303","2018-05-18 09:13:15.368127","192.168.2.2","111.119.29.53","TCP","66","62185  >  80 [ACK] Seq=1 Ack=102809 Win=9660 Len=0 TSval=464882222 TSecr=990008272"
"305","2018-05-18 09:13:15.370581","192.168.2.2","111.119.29.53","TCP","66","62185  >  80 [ACK] Seq=1 Ack=104257 Win=9683 Len=0 TSval=464882224 TSecr=990008281"
"306","2018-05-18 09:13:15.370585","192.168.2.2","111.119.29.53","TCP","66","62185  >  80 [ACK] Seq=1 Ack=107153 Win=9660 Len=0 TSval=464882229 TSecr=990008286"
"307","2018-05-18 09:13:15.371325","192.168.2.2","111.119.29.53","TCP","66","62185  >  80 [ACK] Seq=1 Ack=108601 Win=9683 Len=0 TSval=464882233 TSecr=990008295"
"309","2018-05-18 09:13:15.380826","192.168.2.2","111.119.29.53","TCP","66","62185  >  80 [ACK] Seq=1 Ack=111497 Win=9660 Len=0 TSval=464882238 TSecr=990008300"
"310","2018-05-18 09:13:15.380831","192.168.2.2","111.119.29.53","TCP","66","62185  >  80 [ACK] Seq=1 Ack=112945 Win=9683 Len=0 TSval=464882240 TSecr=990008309"
"317","2018-05-18 09:13:15.393303","192.168.2.2","111.119.29.53","TCP","66","62185  >  80 [ACK] Seq=1 Ack=115841 Win=9660 Len=0 TSval=464882247 TSecr=990008313"
"318","2018-05-18 09:13:15.393634","192.168.2.2","111.119.29.53","TCP","66","62185  >  80 [ACK] Seq=1 Ack=117289 Win=9683 Len=0 TSval=464882249 TSecr=990008321"
"320","2018-05-18 09:13:15.398500","192.168.2.2","111.119.29.53","TCP","66","62185  >  80 [ACK] Seq=1 Ack=120185 Win=9660 Len=0 TSval=464882255 TSecr=990008327"
"331","2018-05-18 09:13:15.456558","192.168.2.2","111.119.29.53","TCP","66","62185  >  80 [ACK] Seq=1 Ack=121633 Win=9683 Len=0 TSval=464882257 TSecr=990008339"
"332","2018-05-18 09:13:15.456561","192.168.2.2","111.119.29.53","TCP","66","62185  >  80 [ACK] Seq=1 Ack=124529 Win=9660 Len=0 TSval=464882277 TSecr=990008345"
"339","2018-05-18 09:13:15.485143","192.168.2.2","111.119.29.53","TCP","66","62185  >  80 [ACK] Seq=1 Ack=125977 Win=9683 Len=0 TSval=464882279 TSecr=990008358"
"340","2018-05-18 09:13:15.485146","192.168.2.2","111.119.29.53","TCP","66","62185  >  80 [ACK] Seq=1 Ack=128873 Win=9660 Len=0 TSval=464882287 TSecr=990008364"
"341","2018-05-18 09:13:15.485146","192.168.2.2","111.119.29.53","TCP","66","62185  >  80 [ACK] Seq=1 Ack=130321 Win=9683 Len=0 TSval=464882289 TSecr=990008376"
"342","2018-05-18 09:13:15.485147","192.168.2.2","111.119.29.53","TCP","66","62185  >  80 [ACK] Seq=1 Ack=133217 Win=9660 Len=0 TSval=464882292 TSecr=990008382"
"344","2018-05-18 09:13:15.485150","192.168.2.2","111.119.29.53","TCP","66","62185  >  80 [ACK] Seq=1 Ack=134665 Win=9683 Len=0 TSval=464882295 TSecr=990008395"
"346","2018-05-18 09:13:15.485151","192.168.2.2","111.119.29.53","TCP","66","62185  >  80 [ACK] Seq=1 Ack=137561 Win=9660 Len=0 TSval=464882302 TSecr=990008401"
"348","2018-05-18 09:13:15.485152","192.168.2.2","111.119.29.53","TCP","66","62185  >  80 [ACK] Seq=1 Ack=139009 Win=9683 Len=0 TSval=464882304 TSecr=990008413"
"349","2018-05-18 09:13:15.485840","192.168.2.2","111.119.29.53","TCP","66","62185  >  80 [ACK] Seq=1 Ack=141905 Win=9660 Len=0 TSval=464882315 TSecr=990008420"
"350","2018-05-18 09:13:15.485842","192.168.2.2","111.119.29.53","TCP","66","62185  >  80 [ACK] Seq=1 Ack=143353 Win=9683 Len=0 TSval=464882317 TSecr=990008432"
"351","2018-05-18 09:13:15.485843","192.168.2.2","111.119.29.53","TCP","66","62185  >  80 [ACK] Seq=1 Ack=146249 Win=9660 Len=0 TSval=464882325 TSecr=990008438"
"352","2018-05-18 09:13:15.485844","192.168.2.2","111.119.29.53","TCP","66","62185  >  80 [ACK] Seq=1 Ack=147697 Win=9683 Len=0 TSval=464882327 TSecr=990008451"
"353","2018-05-18 09:13:15.485844","192.168.2.2","111.119.29.53","TCP","66","62185  >  80 [ACK] Seq=1 Ack=150593 Win=9660 Len=0 TSval=464882331 TSecr=990008457"
"357","2018-05-18 09:13:15.495046","192.168.2.2","111.119.29.53","TCP","66","62185  >  80 [ACK] Seq=1 Ack=153489 Win=9638 Len=0 TSval=464882341 TSecr=990008469"
"358","2018-05-18 09:13:15.495049","192.168.2.2","111.119.29.53","TCP","66","[TCP Window Update] 62185  >  80 [ACK] Seq=1 Ack=153489 Win=9683 Len=0 TSval=464882341 TSecr=990008469"
"365","2018-05-18 09:13:15.498737","192.168.2.2","111.119.29.53","TCP","66","62185  >  80 [ACK] Seq=1 Ack=156385 Win=9660 Len=0 TSval=464882344 TSecr=990008482"
"367","2018-05-18 09:13:15.503275","192.168.2.2","111.119.29.53","TCP","66","62185  >  80 [ACK] Seq=1 Ack=157833 Win=9683 Len=0 TSval=464882346 TSecr=990008494"
"374","2018-05-18 09:13:15.512643","192.168.2.2","111.119.29.53","TCP","66","62185  >  80 [ACK] Seq=1 Ack=160729 Win=9660 Len=0 TSval=464882356 TSecr=990008499"
"375","2018-05-18 09:13:15.515640","192.168.2.2","111.119.29.53","TCP","66","62185  >  80 [ACK] Seq=1 Ack=162177 Win=9683 Len=0 TSval=464882356 TSecr=990008508"
"392","2018-05-18 09:13:15.561805","192.168.2.2","111.119.29.53","TCP","66","62185  >  80 [ACK] Seq=1 Ack=165073 Win=9660 Len=0 TSval=464882367 TSecr=990008512"
"403","2018-05-18 09:13:15.579429","192.168.2.2","111.119.29.53","TCP","66","62185  >  80 [ACK] Seq=1 Ack=167969 Win=9638 Len=0 TSval=464882407 TSecr=990008522"
"404","2018-05-18 09:13:15.579432","192.168.2.2","111.119.29.53","TCP","66","[TCP Window Update] 62185  >  80 [ACK] Seq=1 Ack=167969 Win=9683 Len=0 TSval=464882413 TSecr=990008522"
"406","2018-05-18 09:13:15.582388","192.168.2.2","111.119.29.53","TCP","66","62185  >  80 [ACK] Seq=1 Ack=170865 Win=9638 Len=0 TSval=464882419 TSecr=990008529"
"407","2018-05-18 09:13:15.582391","192.168.2.2","111.119.29.53","TCP","66","[TCP Window Update] 62185  >  80 [ACK] Seq=1 Ack=170865 Win=9683 Len=0 TSval=464882419 TSecr=990008529"
"411","2018-05-18 09:13:15.598849","192.168.2.2","111.119.29.53","TCP","66","62185  >  80 [ACK] Seq=1 Ack=173761 Win=9660 Len=0 TSval=464882421 TSecr=990008536"
"412","2018-05-18 09:13:15.598854","192.168.2.2","111.119.29.53","TCP","66","62185  >  80 [ACK] Seq=1 Ack=176657 Win=9638 Len=0 TSval=464882429 TSecr=990008543"
"413","2018-05-18 09:13:15.599283","192.168.2.2","111.119.29.53","TCP","66","62185  >  80 [ACK] Seq=1 Ack=179553 Win=9593 Len=0 TSval=464882431 TSecr=990008550"
"414","2018-05-18 09:13:15.599287","192.168.2.2","111.119.29.53","TCP","66","[TCP Window Update] 62185  >  80 [ACK] Seq=1 Ack=179553 Win=9683 Len=0 TSval=464882431 TSecr=990008550"
"415","2018-05-18 09:13:15.599287","192.168.2.2","111.119.29.53","TCP","66","62185  >  80 [ACK] Seq=1 Ack=182449 Win=9660 Len=0 TSval=464882433 TSecr=990008557"
"416","2018-05-18 09:13:15.599288","192.168.2.2","111.119.29.53","TCP","66","62185  >  80 [ACK] Seq=1 Ack=183897 Win=9683 Len=0 TSval=464882435 TSecr=990008564"
"420","2018-05-18 09:13:15.607057","192.168.2.2","111.119.29.53","TCP","66","62185  >  80 [ACK] Seq=1 Ack=186793 Win=9660 Len=0 TSval=464882439 TSecr=990008566"
"421","2018-05-18 09:13:15.607061","192.168.2.2","111.119.29.53","TCP","66","62185  >  80 [ACK] Seq=1 Ack=188241 Win=9683 Len=0 TSval=464882440 TSecr=990008572"
"423","2018-05-18 09:13:15.612777","192.168.2.2","111.119.29.53","TCP","66","62185  >  80 [ACK] Seq=1 Ack=191137 Win=9638 Len=0 TSval=464882444 TSecr=990008577"
"424","2018-05-18 09:13:15.612780","192.168.2.2","111.119.29.53","TCP","66","62185  >  80 [ACK] Seq=1 Ack=192585 Win=9683 Len=0 TSval=464882445 TSecr=990008586"
"429","2018-05-18 09:13:15.623080","192.168.2.2","111.119.29.53","TCP","66","62185  >  80 [ACK] Seq=1 Ack=195481 Win=9660 Len=0 TSval=464882455 TSecr=990008591"
"432","2018-05-18 09:13:15.632778","192.168.2.2","111.119.29.53","TCP","66","62185  >  80 [ACK] Seq=1 Ack=196929 Win=9683 Len=0 TSval=464882456 TSecr=990008600"
"433","2018-05-18 09:13:15.632780","192.168.2.2","111.119.29.53","TCP","66","62185  >  80 [ACK] Seq=1 Ack=199825 Win=9660 Len=0 TSval=464882458 TSecr=990008605"
"434","2018-05-18 09:13:15.633242","192.168.2.2","111.119.29.53","TCP","66","62185  >  80 [ACK] Seq=1 Ack=201273 Win=9683 Len=0 TSval=464882459 TSecr=990008615"
"435","2018-05-18 09:13:15.633244","192.168.2.2","111.119.29.53","TCP","66","62185  >  80 [ACK] Seq=1 Ack=204169 Win=9660 Len=0 TSval=464882460 TSecr=990008615"
"436","2018-05-18 09:13:15.633244","192.168.2.2","111.119.29.53","TCP","66","62185  >  80 [ACK] Seq=1 Ack=205617 Win=9683 Len=0 TSval=464882461 TSecr=990008622"
"439","2018-05-18 09:13:15.641263","192.168.2.2","111.119.29.53","TCP","66","62185  >  80 [ACK] Seq=1 Ack=208513 Win=9660 Len=0 TSval=464882462 TSecr=990008630"
"440","2018-05-18 09:13:15.641265","192.168.2.2","111.119.29.53","TCP","66","62185  >  80 [ACK] Seq=1 Ack=209961 Win=9683 Len=0 TSval=464882469 TSecr=990008637"
"446","2018-05-18 09:13:15.655959","192.168.2.2","111.119.29.53","TCP","66","62185  >  80 [ACK] Seq=1 Ack=212857 Win=9660 Len=0 TSval=464882476 TSecr=990008637"
"449","2018-05-18 09:13:15.658525","192.168.2.2","111.119.29.53","TCP","66","62185  >  80 [ACK] Seq=1 Ack=214305 Win=9683 Len=0 TSval=464882476 TSecr=990008645"
"450","2018-05-18 09:13:15.658532","192.168.2.2","111.119.29.53","TCP","66","62185  >  80 [ACK] Seq=1 Ack=217201 Win=9660 Len=0 TSval=464882481 TSecr=990008651"
"451","2018-05-18 09:13:15.661455","192.168.2.2","111.119.29.53","TCP","66","62185  >  80 [ACK] Seq=1 Ack=218649 Win=9683 Len=0 TSval=464882488 TSecr=990008656"
"454","2018-05-18 09:13:15.663948","192.168.2.2","111.119.29.53","TCP","66","62185  >  80 [ACK] Seq=1 Ack=221545 Win=9660 Len=0 TSval=464882491 TSecr=990008656"
"455","2018-05-18 09:13:15.664981","192.168.2.2","111.119.29.53","TCP","66","62185  >  80 [ACK] Seq=1 Ack=222993 Win=9683 Len=0 TSval=464882491 TSecr=990008662"
"466","2018-05-18 09:13:15.676524","192.168.2.2","111.119.29.53","TCP","66","62185  >  80 [ACK] Seq=1 Ack=225889 Win=9660 Len=0 TSval=464882502 TSecr=990008668"
"469","2018-05-18 09:13:15.680192","192.168.2.2","111.119.29.53","TCP","66","62185  >  80 [ACK] Seq=1 Ack=227337 Win=9683 Len=0 TSval=464882504 TSecr=990008673"
"471","2018-05-18 09:13:15.681376","192.168.2.2","111.119.29.53","TCP","66","62185  >  80 [ACK] Seq=1 Ack=230233 Win=9660 Len=0 TSval=464882505 TSecr=990008673"
"472","2018-05-18 09:13:15.682108","192.168.2.2","111.119.29.53","TCP","66","62185  >  80 [ACK] Seq=1 Ack=231681 Win=9683 Len=0 TSval=464882506 TSecr=990008679"
"483","2018-05-18 09:13:15.691349","192.168.2.2","111.119.29.53","TCP","66","62185  >  80 [ACK] Seq=1 Ack=234577 Win=9660 Len=0 TSval=464882513 TSecr=990008685"
"486","2018-05-18 09:13:15.692742","192.168.2.2","111.119.29.53","TCP","66","62185  >  80 [ACK] Seq=1 Ack=236025 Win=9683 Len=0 TSval=464882514 TSecr=990008690"
"490","2018-05-18 09:13:15.699239","192.168.2.2","111.119.29.53","TCP","66","62185  >  80 [ACK] Seq=1 Ack=238921 Win=9660 Len=0 TSval=464882519 TSecr=990008690"
"493","2018-05-18 09:13:15.704148","192.168.2.2","111.119.29.53","TCP","66","62185  >  80 [ACK] Seq=1 Ack=240369 Win=9683 Len=0 TSval=464882522 TSecr=990008696"
"496","2018-05-18 09:13:15.710374","192.168.2.2","111.119.29.53","TCP","66","62185  >  80 [ACK] Seq=1 Ack=243265 Win=9660 Len=0 TSval=464882526 TSecr=990008702"
"497","2018-05-18 09:13:15.710376","192.168.2.2","111.119.29.53","TCP","66","62185  >  80 [ACK] Seq=1 Ack=244713 Win=9683 Len=0 TSval=464882528 TSecr=990008707"
"508","2018-05-18 09:13:15.729929","192.168.2.2","111.119.29.53","TCP","66","62185  >  80 [ACK] Seq=1 Ack=247609 Win=9660 Len=0 TSval=464882535 TSecr=990008707"
"509","2018-05-18 09:13:15.729938","192.168.2.2","111.119.29.53","TCP","66","62185  >  80 [ACK] Seq=1 Ack=249057 Win=9683 Len=0 TSval=464882536 TSecr=990008711"
"510","2018-05-18 09:13:15.731446","192.168.2.2","111.119.29.53","TCP","66","62185  >  80 [ACK] Seq=1 Ack=251953 Win=9660 Len=0 TSval=464882540 TSecr=990008715"
"511","2018-05-18 09:13:15.731449","192.168.2.2","111.119.29.53","TCP","66","62185  >  80 [ACK] Seq=1 Ack=254849 Win=9615 Len=0 TSval=464882541 TSecr=990008719"
"512","2018-05-18 09:13:15.731449","192.168.2.2","111.119.29.53","TCP","66","[TCP Window Update] 62185  >  80 [ACK] Seq=1 Ack=254849 Win=9683 Len=0 TSval=464882541 TSecr=990008719"
"513","2018-05-18 09:13:15.731450","192.168.2.2","111.119.29.53","TCP","66","62185  >  80 [ACK] Seq=1 Ack=257745 Win=9660 Len=0 TSval=464882542 TSecr=990008723"
"514","2018-05-18 09:13:15.732163","192.168.2.2","111.119.29.53","TCP","66","62185  >  80 [ACK] Seq=1 Ack=259193 Win=9683 Len=0 TSval=464882548 TSecr=990008730"
"517","2018-05-18 09:13:15.738262","192.168.2.2","111.119.29.53","TCP","66","62185  >  80 [ACK] Seq=1 Ack=262089 Win=9660 Len=0 TSval=464882554 TSecr=990008730"
"518","2018-05-18 09:13:15.739445","192.168.2.2","111.119.29.53","TCP","66","62185  >  80 [ACK] Seq=1 Ack=263537 Win=9683 Len=0 TSval=464882554 TSecr=990008736"
"522","2018-05-18 09:13:15.746469","192.168.2.2","111.119.29.53","TCP","66","62185  >  80 [ACK] Seq=1 Ack=266433 Win=9638 Len=0 TSval=464882560 TSecr=990008743"
"529","2018-05-18 09:13:15.756209","192.168.2.2","111.119.29.53","TCP","66","62185  >  80 [ACK] Seq=1 Ack=269329 Win=9593 Len=0 TSval=464882564 TSecr=990008748"
"530","2018-05-18 09:13:15.756211","192.168.2.2","111.119.29.53","TCP","66","[TCP Window Update] 62185  >  80 [ACK] Seq=1 Ack=269329 Win=9683 Len=0 TSval=464882566 TSecr=990008748"
"531","2018-05-18 09:13:15.756595","192.168.2.2","111.119.29.53","TCP","66","62185  >  80 [ACK] Seq=1 Ack=272225 Win=9660 Len=0 TSval=464882568 TSecr=990008752"
"534","2018-05-18 09:13:15.760973","192.168.2.2","111.119.29.53","TCP","66","62185  >  80 [ACK] Seq=1 Ack=273673 Win=9683 Len=0 TSval=464882571 TSecr=990008757"
"537","2018-05-18 09:13:15.764984","192.168.2.2","111.119.29.53","TCP","66","62185  >  80 [ACK] Seq=1 Ack=276569 Win=9660 Len=0 TSval=464882575 TSecr=990008757"
"538","2018-05-18 09:13:15.764986","192.168.2.2","111.119.29.53","TCP","66","62185  >  80 [ACK] Seq=1 Ack=278017 Win=9683 Len=0 TSval=464882575 TSecr=990008762"
"546","2018-05-18 09:13:15.779251","192.168.2.2","111.119.29.53","TCP","66","62185  >  80 [ACK] Seq=1 Ack=280913 Win=9638 Len=0 TSval=464882579 TSecr=990008767"
"547","2018-05-18 09:13:15.779254","192.168.2.2","111.119.29.53","TCP","66","[TCP Window Update] 62185  >  80 [ACK] Seq=1 Ack=280913 Win=9683 Len=0 TSval=464882579 TSecr=990008767"
"548","2018-05-18 09:13:15.779638","192.168.2.2","111.119.29.53","TCP","66","62185  >  80 [ACK] Seq=1 Ack=283809 Win=9660 Len=0 TSval=464882585 TSecr=990008771"
"549","2018-05-18 09:13:15.779640","192.168.2.2","111.119.29.53","TCP","66","62185  >  80 [ACK] Seq=1 Ack=285257 Win=9683 Len=0 TSval=464882587 TSecr=990008776"
"553","2018-05-18 09:13:15.783911","192.168.2.2","111.119.29.53","TCP","66","62185  >  80 [ACK] Seq=1 Ack=288153 Win=9660 Len=0 TSval=464882591 TSecr=990008776"
"556","2018-05-18 09:13:15.787204","192.168.2.2","111.119.29.53","TCP","66","62185  >  80 [ACK] Seq=1 Ack=291049 Win=9615 Len=0 TSval=464882595 TSecr=990008781"
"559","2018-05-18 09:13:15.793781","192.168.2.2","111.119.29.53","TCP","66","62185  >  80 [ACK] Seq=1 Ack=293945 Win=9570 Len=0 TSval=464882599 TSecr=990008785"
"562","2018-05-18 09:13:15.796449","192.168.2.2","111.119.29.53","TCP","66","62185  >  80 [ACK] Seq=1 Ack=295393 Win=9683 Len=0 TSval=464882601 TSecr=990008790"
"563","2018-05-18 09:13:15.796859","192.168.2.2","111.119.29.53","TCP","66","62185  >  80 [ACK] Seq=1 Ack=298289 Win=9660 Len=0 TSval=464882602 TSecr=990008795"
"566","2018-05-18 09:13:15.801588","192.168.2.2","111.119.29.53","TCP","66","62185  >  80 [ACK] Seq=1 Ack=299737 Win=9683 Len=0 TSval=464882605 TSecr=990008799"
"572","2018-05-18 09:13:15.808184","192.168.2.2","111.119.29.53","TCP","66","62185  >  80 [ACK] Seq=1 Ack=302633 Win=9660 Len=0 TSval=464882608 TSecr=990008799"
"573","2018-05-18 09:13:15.808187","192.168.2.2","111.119.29.53","TCP","66","62185  >  80 [ACK] Seq=1 Ack=304081 Win=9683 Len=0 TSval=464882608 TSecr=990008802"
"574","2018-05-18 09:13:15.809328","192.168.2.2","111.119.29.53","TCP","66","62185  >  80 [ACK] Seq=1 Ack=306977 Win=9638 Len=0 TSval=464882612 TSecr=990008806"
"579","2018-05-18 09:13:15.816797","192.168.2.2","111.119.29.53","TCP","66","62185  >  80 [ACK] Seq=1 Ack=308425 Win=9683 Len=0 TSval=464882617 TSecr=990008806"
"592","2018-05-18 09:13:15.819381","192.168.2.2","111.119.29.53","TCP","66","62185  >  80 [ACK] Seq=1 Ack=311321 Win=9660 Len=0 TSval=464882620 TSecr=990008811"
"593","2018-05-18 09:13:15.821862","192.168.2.2","111.119.29.53","TCP","66","62185  >  80 [ACK] Seq=1 Ack=312769 Win=9683 Len=0 TSval=464882621 TSecr=990008811"
"609","2018-05-18 09:13:15.859384","192.168.2.2","111.119.29.53","TCP","66","62185  >  80 [ACK] Seq=1 Ack=315665 Win=9660 Len=0 TSval=464882625 TSecr=990008811"
"610","2018-05-18 09:13:15.859394","192.168.2.2","111.119.29.53","TCP","66","62185  >  80 [ACK] Seq=1 Ack=317113 Win=9683 Len=0 TSval=464882625 TSecr=990008819"
"611","2018-05-18 09:13:15.860767","192.168.2.2","111.119.29.53","TCP","66","62185  >  80 [ACK] Seq=1 Ack=320009 Win=9660 Len=0 TSval=464882626 TSecr=990008819"
"612","2018-05-18 09:13:15.860770","192.168.2.2","111.119.29.53","TCP","66","62185  >  80 [ACK] Seq=1 Ack=321457 Win=9683 Len=0 TSval=464882633 TSecr=990008824"
"613","2018-05-18 09:13:15.860770","192.168.2.2","111.119.29.53","TCP","66","62185  >  80 [ACK] Seq=1 Ack=324353 Win=9660 Len=0 TSval=464882644 TSecr=990008824"
"614","2018-05-18 09:13:15.860771","192.168.2.2","111.119.29.53","TCP","66","62185  >  80 [ACK] Seq=1 Ack=325801 Win=9683 Len=0 TSval=464882653 TSecr=990008830"
"616","2018-05-18 09:13:15.866963","192.168.2.2","111.119.29.53","TCP","66","62185  >  80 [ACK] Seq=1 Ack=328697 Win=9660 Len=0 TSval=464882662 TSecr=990008830"
"617","2018-05-18 09:13:15.866965","192.168.2.2","111.119.29.53","TCP","66","62185  >  80 [ACK] Seq=1 Ack=330145 Win=9683 Len=0 TSval=464882663 TSecr=990008836"
"622","2018-05-18 09:13:15.869290","192.168.2.2","111.119.29.53","TCP","66","62185  >  80 [ACK] Seq=1 Ack=333041 Win=9660 Len=0 TSval=464882665 TSecr=990008836"
"623","2018-05-18 09:13:15.869291","192.168.2.2","111.119.29.53","TCP","66","62185  >  80 [ACK] Seq=1 Ack=333665 Win=9673 Len=0 TSval=464882666 TSecr=990008842"
"624","2018-05-18 09:13:15.870849","192.168.2.2","111.119.29.53","TCP","78","[TCP Window Update] 62185  >  80 [ACK] Seq=1 Ack=333665 Win=9683 Len=0 TSval=464882666 TSecr=990008861 SLE=332217 SRE=333665"
"625","2018-05-18 09:13:15.873069","192.168.2.2","111.119.29.53","HTTP","397","GET /a355/1dab/cd23/45a3-bb47-4195a0873e80/06bc56e0-6f4d-43e1-b042-ccfa1e7b449d_a3.aac/range/482003-522108 HTTP/1.1 "
"631","2018-05-18 09:13:15.883397","192.168.2.2","111.119.29.53","TCP","66","62185  >  80 [ACK] Seq=332 Ack=334276 Win=9673 Len=0 TSval=464882677 TSecr=990008881"
"632","2018-05-18 09:13:15.883713","192.168.2.2","111.119.29.53","TCP","66","62185  >  80 [ACK] Seq=332 Ack=337172 Win=9628 Len=0 TSval=464882678 TSecr=990008882"
"633","2018-05-18 09:13:15.886173","192.168.2.2","111.119.29.53","TCP","66","62185  >  80 [ACK] Seq=332 Ack=338620 Win=9670 Len=0 TSval=464882680 TSecr=990008882"
"643","2018-05-18 09:13:15.899100","192.168.2.2","111.119.29.53","TCP","66","62185  >  80 [ACK] Seq=332 Ack=341516 Win=9638 Len=0 TSval=464882682 TSecr=990008887"
"644","2018-05-18 09:13:15.899102","192.168.2.2","111.119.29.53","TCP","66","62185  >  80 [ACK] Seq=332 Ack=342964 Win=9683 Len=0 TSval=464882684 TSecr=990008887"
"645","2018-05-18 09:13:15.900336","192.168.2.2","111.119.29.53","TCP","66","62185  >  80 [ACK] Seq=332 Ack=345860 Win=9638 Len=0 TSval=464882687 TSecr=990008893"
"646","2018-05-18 09:13:15.901072","192.168.2.2","111.119.29.53","TCP","66","62185  >  80 [ACK] Seq=332 Ack=348756 Win=9593 Len=0 TSval=464882691 TSecr=990008893"
"647","2018-05-18 09:13:15.903765","192.168.2.2","111.119.29.53","TCP","66","62185  >  80 [ACK] Seq=332 Ack=351652 Win=9547 Len=0 TSval=464882692 TSecr=990008899"
"654","2018-05-18 09:13:15.911781","192.168.2.2","111.119.29.53","TCP","66","62185  >  80 [ACK] Seq=332 Ack=354548 Win=9502 Len=0 TSval=464882696 TSecr=990008904"
"655","2018-05-18 09:13:15.911786","192.168.2.2","111.119.29.53","TCP","66","62185  >  80 [ACK] Seq=332 Ack=357444 Win=9457 Len=0 TSval=464882700 TSecr=990008904"
"656","2018-05-18 09:13:15.914388","192.168.2.2","111.119.29.53","TCP","66","62185  >  80 [ACK] Seq=332 Ack=360340 Win=9412 Len=0 TSval=464882701 TSecr=990008909"
"660","2018-05-18 09:13:15.920221","192.168.2.2","111.119.29.53","TCP","66","62185  >  80 [ACK] Seq=332 Ack=363236 Win=9366 Len=0 TSval=464882705 TSecr=990008913"
"661","2018-05-18 09:13:15.921159","192.168.2.2","111.119.29.53","TCP","66","62185  >  80 [ACK] Seq=332 Ack=364684 Win=9683 Len=0 TSval=464882708 TSecr=990008913"
"668","2018-05-18 09:13:15.928604","192.168.2.2","111.119.29.53","TCP","66","62185  >  80 [ACK] Seq=332 Ack=367580 Win=9638 Len=0 TSval=464882710 TSecr=990008921"
"669","2018-05-18 09:13:15.928607","192.168.2.2","111.119.29.53","TCP","66","62185  >  80 [ACK] Seq=332 Ack=370476 Win=9593 Len=0 TSval=464882714 TSecr=990008921"
"670","2018-05-18 09:13:15.929146","192.168.2.2","111.119.29.53","TCP","66","62185  >  80 [ACK] Seq=332 Ack=373372 Win=9547 Len=0 TSval=464882714 TSecr=990008926"
"672","2018-05-18 09:13:15.933934","192.168.2.2","111.119.29.53","TCP","66","62185  >  80 [ACK] Seq=332 Ack=374382 Win=9531 Len=0 TSval=464882719 TSecr=990008932"
"673","2018-05-18 09:13:15.941632","192.168.2.2","111.119.29.53","TCP","66","[TCP Window Update] 62185  >  80 [ACK] Seq=332 Ack=374382 Win=9683 Len=0 TSval=464882726 TSecr=990008932"
"674","2018-05-18 09:13:15.943943","192.168.2.2","111.119.29.53","HTTP","398","GET /a355/1dab/cd23/45a3-bb47-4195a0873e80/06bc56e0-6f4d-43e1-b042-ccfa1e7b449d_v9.ts/range/7952024-9299983 HTTP/1.1 "
"683","2018-05-18 09:13:15.963015","192.168.2.2","111.119.29.53","TCP","66","62185  >  80 [ACK] Seq=664 Ack=374996 Win=9673 Len=0 TSval=464882735 TSecr=990008951"
"684","2018-05-18 09:13:15.963017","192.168.2.2","111.119.29.53","TCP","66","62185  >  80 [ACK] Seq=664 Ack=377892 Win=9660 Len=0 TSval=464882741 TSecr=990008952"
"688","2018-05-18 09:13:15.963231","192.168.2.2","111.119.29.53","TCP","66","62185  >  80 [ACK] Seq=664 Ack=380788 Win=9615 Len=0 TSval=464882741 TSecr=990008952"
"689","2018-05-18 09:13:15.963233","192.168.2.2","111.119.29.53","TCP","66","62185  >  80 [ACK] Seq=664 Ack=382236 Win=9683 Len=0 TSval=464882742 TSecr=990008957"
"690","2018-05-18 09:13:15.966940","192.168.2.2","111.119.29.53","TCP","66","62185  >  80 [ACK] Seq=664 Ack=385132 Win=9660 Len=0 TSval=464882745 TSecr=990008957"
"691","2018-05-18 09:13:15.966942","192.168.2.2","111.119.29.53","TCP","66","62185  >  80 [ACK] Seq=664 Ack=386580 Win=9683 Len=0 TSval=464882747 TSecr=990008963"
"695","2018-05-18 09:13:15.969927","192.168.2.2","111.119.29.53","TCP","66","62185  >  80 [ACK] Seq=664 Ack=389476 Win=9638 Len=0 TSval=464882749 TSecr=990008963"
"696","2018-05-18 09:13:15.970780","192.168.2.2","111.119.29.53","TCP","66","[TCP Window Update] 62185  >  80 [ACK] Seq=664 Ack=389476 Win=9683 Len=0 TSval=464882749 TSecr=990008963"
"697","2018-05-18 09:13:15.972360","192.168.2.2","111.119.29.53","TCP","66","62185  >  80 [ACK] Seq=664 Ack=392372 Win=9660 Len=0 TSval=464882750 TSecr=990008968"
"701","2018-05-18 09:13:15.976535","192.168.2.2","111.119.29.53","TCP","66","62185  >  80 [ACK] Seq=664 Ack=393820 Win=9683 Len=0 TSval=464882752 TSecr=990008974"
"702","2018-05-18 09:13:15.978261","192.168.2.2","111.119.29.53","TCP","66","62185  >  80 [ACK] Seq=664 Ack=396716 Win=9660 Len=0 TSval=464882753 TSecr=990008974"
"708","2018-05-18 09:13:15.982149","192.168.2.2","111.119.29.53","TCP","66","62185  >  80 [ACK] Seq=664 Ack=398164 Win=9683 Len=0 TSval=464882758 TSecr=990008979"
