"No.","Time","Source","Destination","Protocol","Length","Info"
"3","2018-05-18 08:57:16.506797","192.168.2.2","17.253.91.201","TCP","78","61992  >  80 [SYN, ECN, CWR] Seq=0 Win=65535 Len=0 MSS=1460 WS=64 TSval=463929867 TSecr=0 SACK_PERM=1"
"5","2018-05-18 08:57:16.517102","192.168.2.2","17.253.91.201","TCP","66","61992  >  80 [ACK] Seq=1 Ack=1 Win=131712 Len=0 TSval=463929877 TSecr=478250859"
"6","2018-05-18 08:57:16.517104","192.168.2.2","17.253.91.201","HTTP","753","GET /apple-assets-us-std-000001/Music111/v4/20/b5/f5/20b5f51d-d315-67a8-0106-e51e5e47d04f/mzaf_7562186616014469036.lwhq.aac.a.m4p?accessKey=1526626626_1832794717281533127_69nHiwHdSqQlJ01PzDfVC7HQcIw9Ka6SrNSrU34kCWy3RW9YQXnH2i2dnRnC%2ByDNlssWPVphDOfcVa511HVJc86sTTFNczhQebnQhccwKqUPMN8tz408ZvBrxH8LSXmtzBznrCml5eL9PbP%2FlWZ5gkGF9vPvCuYMQC87MAYOlknQho7UWuLcbZoWw3NS%2FoLD9iHJisiQBEnM7k4fWjaCbQ%3D%3D HTTP/1.1 "
"7","2018-05-18 08:57:16.519255","192.168.2.2","23.67.184.110","TCP","1514","61958  >  443 [ACK] Seq=1 Ack=1 Win=2048 Len=1448 TSval=463929880 TSecr=1538904071 [TCP segment of a reassembled PDU]"
"8","2018-05-18 08:57:16.519257","192.168.2.2","23.67.184.110","TLSv1.2","1458","Application Data"
"9","2018-05-18 08:57:16.519809","192.168.2.2","23.67.184.110","TLSv1.2","839","Application Data"
"24","2018-05-18 08:57:16.529141","192.168.2.2","17.253.91.201","TCP","78","[TCP Dup ACK 5#1] 61992  >  80 [ACK] Seq=688 Ack=1 Win=131712 Len=0 TSval=463929889 TSecr=478250870 SLE=5793 SRE=7241"
"25","2018-05-18 08:57:16.529144","192.168.2.2","17.253.91.201","TCP","78","[TCP Dup ACK 5#2] 61992  >  80 [ACK] Seq=688 Ack=1 Win=131712 Len=0 TSval=463929889 TSecr=478250870 SLE=5793 SRE=8689"
"26","2018-05-18 08:57:16.529145","192.168.2.2","17.253.91.201","TCP","78","[TCP Dup ACK 5#3] 61992  >  80 [ACK] Seq=688 Ack=1 Win=131712 Len=0 TSval=463929889 TSecr=478250870 SLE=5793 SRE=10137"
"27","2018-05-18 08:57:16.529146","192.168.2.2","17.253.91.201","TCP","78","[TCP Dup ACK 5#4] 61992  >  80 [ACK] Seq=688 Ack=1 Win=131712 Len=0 TSval=463929889 TSecr=478250870 SLE=5793 SRE=11585"
"28","2018-05-18 08:57:16.529653","192.168.2.2","17.253.91.201","TCP","78","[TCP Dup ACK 5#5] 61992  >  80 [ACK] Seq=688 Ack=1 Win=131712 Len=0 TSval=463929889 TSecr=478250870 SLE=5793 SRE=13033"
"29","2018-05-18 08:57:16.529656","192.168.2.2","17.253.91.201","TCP","78","[TCP Dup ACK 5#6] 61992  >  80 [ACK] Seq=688 Ack=1 Win=131712 Len=0 TSval=463929889 TSecr=478250870 SLE=5793 SRE=14481"
"30","2018-05-18 08:57:16.530384","192.168.2.2","17.253.91.201","TCP","78","61992  >  80 [ACK] Seq=688 Ack=1449 Win=130304 Len=0 TSval=463929890 TSecr=478250870 SLE=5793 SRE=14481"
"31","2018-05-18 08:57:16.530386","192.168.2.2","17.253.91.201","TCP","78","61992  >  80 [ACK] Seq=688 Ack=2897 Win=128832 Len=0 TSval=463929890 TSecr=478250870 SLE=5793 SRE=14481"
"32","2018-05-18 08:57:16.530387","192.168.2.2","17.253.91.201","TCP","78","61992  >  80 [ACK] Seq=688 Ack=4345 Win=127424 Len=0 TSval=463929890 TSecr=478250870 SLE=5793 SRE=14481"
"33","2018-05-18 08:57:16.530388","192.168.2.2","17.253.91.201","TCP","78","[TCP Window Update] 61992  >  80 [ACK] Seq=688 Ack=4345 Win=130816 Len=0 TSval=463929890 TSecr=478250870 SLE=5793 SRE=14481"
"34","2018-05-18 08:57:16.530826","192.168.2.2","17.253.91.201","TCP","66","61992  >  80 [ACK] Seq=688 Ack=14481 Win=120896 Len=0 TSval=463929890 TSecr=478250870"
"35","2018-05-18 08:57:16.530828","192.168.2.2","17.253.91.201","TCP","66","[TCP Window Update] 61992  >  80 [ACK] Seq=688 Ack=14481 Win=131072 Len=0 TSval=463929890 TSecr=478250870"
"46","2018-05-18 08:57:16.537757","192.168.2.2","17.253.91.201","TCP","78","[TCP Dup ACK 34#1] 61992  >  80 [ACK] Seq=688 Ack=14481 Win=131072 Len=0 TSval=463929897 TSecr=478250870 SLE=1 SRE=1449"
"47","2018-05-18 08:57:16.537759","192.168.2.2","17.253.91.201","TCP","78","[TCP Dup ACK 34#2] 61992  >  80 [ACK] Seq=688 Ack=14481 Win=131072 Len=0 TSval=463929897 TSecr=478250870 SLE=1449 SRE=2897"
"53","2018-05-18 08:57:16.538319","192.168.2.2","17.253.91.201","TCP","78","[TCP Dup ACK 34#3] 61992  >  80 [ACK] Seq=688 Ack=14481 Win=131072 Len=0 TSval=463929897 TSecr=478250870 SLE=2897 SRE=4345"
"54","2018-05-18 08:57:16.538321","192.168.2.2","17.253.91.201","TCP","78","[TCP Dup ACK 34#4] 61992  >  80 [ACK] Seq=688 Ack=14481 Win=131072 Len=0 TSval=463929897 TSecr=478250870 SLE=4345 SRE=5793"
"55","2018-05-18 08:57:16.538939","192.168.2.2","17.253.91.201","TCP","66","61992  >  80 [ACK] Seq=688 Ack=17377 Win=128128 Len=0 TSval=463929897 TSecr=478250882"
"56","2018-05-18 08:57:16.538941","192.168.2.2","17.253.91.201","TCP","66","[TCP Window Update] 61992  >  80 [ACK] Seq=688 Ack=17377 Win=131072 Len=0 TSval=463929897 TSecr=478250882"
"57","2018-05-18 08:57:16.540237","192.168.2.2","17.253.91.201","TCP","66","61992  >  80 [ACK] Seq=688 Ack=20273 Win=128128 Len=0 TSval=463929898 TSecr=478250882"
"58","2018-05-18 08:57:16.540239","192.168.2.2","17.253.91.201","TCP","66","[TCP Window Update] 61992  >  80 [ACK] Seq=688 Ack=20273 Win=131072 Len=0 TSval=463929898 TSecr=478250882"
"59","2018-05-18 08:57:16.540656","192.168.2.2","17.253.91.201","TCP","66","61992  >  80 [ACK] Seq=688 Ack=23169 Win=128128 Len=0 TSval=463929899 TSecr=478250882"
"60","2018-05-18 08:57:16.540657","192.168.2.2","17.253.91.201","TCP","66","[TCP Window Update] 61992  >  80 [ACK] Seq=688 Ack=23169 Win=131072 Len=0 TSval=463929899 TSecr=478250882"
"61","2018-05-18 08:57:16.540658","192.168.2.2","17.253.91.201","TCP","66","61992  >  80 [ACK] Seq=688 Ack=26065 Win=128128 Len=0 TSval=463929899 TSecr=478250883"
"62","2018-05-18 08:57:16.540659","192.168.2.2","17.253.91.201","TCP","66","61992  >  80 [ACK] Seq=688 Ack=27513 Win=131072 Len=0 TSval=463929899 TSecr=478250883"
"63","2018-05-18 08:57:16.541042","192.168.2.2","17.253.91.201","TCP","66","61992  >  80 [ACK] Seq=688 Ack=30409 Win=128128 Len=0 TSval=463929899 TSecr=478250883"
"64","2018-05-18 08:57:16.541045","192.168.2.2","17.253.91.201","TCP","66","[TCP Window Update] 61992  >  80 [ACK] Seq=688 Ack=30409 Win=131072 Len=0 TSval=463929899 TSecr=478250883"
"87","2018-05-18 08:57:16.551628","192.168.2.2","17.253.91.201","TCP","66","61992  >  80 [ACK] Seq=688 Ack=33305 Win=128128 Len=0 TSval=463929908 TSecr=478250891"
"88","2018-05-18 08:57:16.551631","192.168.2.2","17.253.91.201","TCP","66","[TCP Window Update] 61992  >  80 [ACK] Seq=688 Ack=33305 Win=131072 Len=0 TSval=463929908 TSecr=478250891"
"89","2018-05-18 08:57:16.552165","192.168.2.2","17.253.91.201","TCP","66","61992  >  80 [ACK] Seq=688 Ack=36201 Win=128128 Len=0 TSval=463929908 TSecr=478250891"
"90","2018-05-18 08:57:16.552167","192.168.2.2","17.253.91.201","TCP","66","61992  >  80 [ACK] Seq=688 Ack=37649 Win=131072 Len=0 TSval=463929908 TSecr=478250892"
"91","2018-05-18 08:57:16.552168","192.168.2.2","17.253.91.201","TCP","66","61992  >  80 [ACK] Seq=688 Ack=40545 Win=129600 Len=0 TSval=463929909 TSecr=478250892"
"92","2018-05-18 08:57:16.552169","192.168.2.2","17.253.91.201","TCP","66","61992  >  80 [ACK] Seq=688 Ack=43441 Win=126720 Len=0 TSval=463929909 TSecr=478250892"
"93","2018-05-18 08:57:16.552169","192.168.2.2","17.253.91.201","TCP","66","[TCP Window Update] 61992  >  80 [ACK] Seq=688 Ack=43441 Win=131072 Len=0 TSval=463929909 TSecr=478250892"
"94","2018-05-18 08:57:16.552171","192.168.2.2","17.253.91.201","TCP","66","61992  >  80 [ACK] Seq=688 Ack=46337 Win=129600 Len=0 TSval=463929909 TSecr=478250893"
"95","2018-05-18 08:57:16.552171","192.168.2.2","17.253.91.201","TCP","66","61992  >  80 [ACK] Seq=688 Ack=47785 Win=131072 Len=0 TSval=463929909 TSecr=478250893"
"96","2018-05-18 08:57:16.552172","192.168.2.2","17.253.91.201","TCP","66","61992  >  80 [ACK] Seq=688 Ack=50681 Win=129600 Len=0 TSval=463929909 TSecr=478250893"
"97","2018-05-18 08:57:16.552173","192.168.2.2","17.253.91.201","TCP","66","61992  >  80 [ACK] Seq=688 Ack=53577 Win=126720 Len=0 TSval=463929909 TSecr=478250893"
"98","2018-05-18 08:57:16.552173","192.168.2.2","17.253.91.201","TCP","66","[TCP Window Update] 61992  >  80 [ACK] Seq=688 Ack=53577 Win=131072 Len=0 TSval=463929909 TSecr=478250893"
"99","2018-05-18 08:57:16.552174","192.168.2.2","17.253.91.201","TCP","66","61992  >  80 [ACK] Seq=688 Ack=56473 Win=128128 Len=0 TSval=463929909 TSecr=478250893"
"100","2018-05-18 08:57:16.552175","192.168.2.2","17.253.91.201","TCP","66","[TCP Window Update] 61992  >  80 [ACK] Seq=688 Ack=56473 Win=131072 Len=0 TSval=463929909 TSecr=478250893"
"101","2018-05-18 08:57:16.552175","192.168.2.2","17.253.91.201","TCP","66","61992  >  80 [ACK] Seq=688 Ack=59369 Win=128128 Len=0 TSval=463929910 TSecr=478250893"
"102","2018-05-18 08:57:16.552571","192.168.2.2","17.253.91.201","TCP","66","61992  >  80 [ACK] Seq=688 Ack=60817 Win=131072 Len=0 TSval=463929910 TSecr=478250893"
"128","2018-05-18 08:57:16.567936","192.168.2.2","17.253.91.201","TCP","66","61992  >  80 [ACK] Seq=688 Ack=63713 Win=129600 Len=0 TSval=463929920 TSecr=478250893"
"129","2018-05-18 08:57:16.567939","192.168.2.2","17.253.91.201","TCP","66","61992  >  80 [ACK] Seq=688 Ack=65161 Win=131072 Len=0 TSval=463929920 TSecr=478250904"
"130","2018-05-18 08:57:16.568465","192.168.2.2","17.253.91.201","TCP","66","61992  >  80 [ACK] Seq=688 Ack=68057 Win=128128 Len=0 TSval=463929921 TSecr=478250904"
"131","2018-05-18 08:57:16.568467","192.168.2.2","17.253.91.201","TCP","66","61992  >  80 [ACK] Seq=688 Ack=70953 Win=125248 Len=0 TSval=463929921 TSecr=478250904"
"132","2018-05-18 08:57:16.568468","192.168.2.2","17.253.91.201","TCP","66","[TCP Window Update] 61992  >  80 [ACK] Seq=688 Ack=70953 Win=131072 Len=0 TSval=463929921 TSecr=478250904"
"133","2018-05-18 08:57:16.568469","192.168.2.2","17.253.91.201","TCP","66","61992  >  80 [ACK] Seq=688 Ack=73849 Win=129600 Len=0 TSval=463929921 TSecr=478250904"
"134","2018-05-18 08:57:16.568469","192.168.2.2","17.253.91.201","TCP","66","61992  >  80 [ACK] Seq=688 Ack=75297 Win=131072 Len=0 TSval=463929921 TSecr=478250904"
"135","2018-05-18 08:57:16.568471","192.168.2.2","17.253.91.201","TCP","66","61992  >  80 [ACK] Seq=688 Ack=76745 Win=129600 Len=0 TSval=463929921 TSecr=478250904"
"136","2018-05-18 08:57:16.568472","192.168.2.2","17.253.91.201","TCP","66","61992  >  80 [ACK] Seq=688 Ack=78193 Win=131072 Len=0 TSval=463929921 TSecr=478250904"
"137","2018-05-18 08:57:16.568472","192.168.2.2","17.253.91.201","TCP","66","61992  >  80 [ACK] Seq=688 Ack=81089 Win=128128 Len=0 TSval=463929921 TSecr=478250904"
"138","2018-05-18 08:57:16.568473","192.168.2.2","17.253.91.201","TCP","66","[TCP Window Update] 61992  >  80 [ACK] Seq=688 Ack=81089 Win=131072 Len=0 TSval=463929921 TSecr=478250904"
"139","2018-05-18 08:57:16.568474","192.168.2.2","17.253.91.201","TCP","66","61992  >  80 [ACK] Seq=688 Ack=83985 Win=129600 Len=0 TSval=463929922 TSecr=478250904"
"140","2018-05-18 08:57:16.568474","192.168.2.2","17.253.91.201","TCP","66","61992  >  80 [ACK] Seq=688 Ack=86881 Win=126720 Len=0 TSval=463929922 TSecr=478250904"
"141","2018-05-18 08:57:16.568475","192.168.2.2","17.253.91.201","TCP","66","61992  >  80 [ACK] Seq=688 Ack=88329 Win=131072 Len=0 TSval=463929922 TSecr=478250904"
"142","2018-05-18 08:57:16.568476","192.168.2.2","17.253.91.201","TCP","66","61992  >  80 [ACK] Seq=688 Ack=91225 Win=128128 Len=0 TSval=463929922 TSecr=478250904"
"143","2018-05-18 08:57:16.568476","192.168.2.2","17.253.91.201","TCP","66","61992  >  80 [ACK] Seq=688 Ack=92673 Win=131072 Len=0 TSval=463929922 TSecr=478250904"
"144","2018-05-18 08:57:16.568477","192.168.2.2","17.253.91.201","TCP","66","61992  >  80 [ACK] Seq=688 Ack=95569 Win=128128 Len=0 TSval=463929922 TSecr=478250904"
"145","2018-05-18 08:57:16.568478","192.168.2.2","17.253.91.201","TCP","66","61992  >  80 [ACK] Seq=688 Ack=97017 Win=131072 Len=0 TSval=463929922 TSecr=478250904"
"170","2018-05-18 08:57:16.576225","192.168.2.2","17.253.91.201","TCP","66","61992  >  80 [ACK] Seq=688 Ack=99913 Win=129600 Len=0 TSval=463929933 TSecr=478250905"
"171","2018-05-18 08:57:16.576227","192.168.2.2","17.253.91.201","TCP","66","61992  >  80 [ACK] Seq=688 Ack=101361 Win=131072 Len=0 TSval=463929933 TSecr=478250920"
"172","2018-05-18 08:57:16.579408","192.168.2.2","17.253.91.201","TCP","66","61992  >  80 [ACK] Seq=688 Ack=104257 Win=128128 Len=0 TSval=463929934 TSecr=478250921"
"173","2018-05-18 08:57:16.579410","192.168.2.2","17.253.91.201","TCP","66","[TCP Window Update] 61992  >  80 [ACK] Seq=688 Ack=104257 Win=131072 Len=0 TSval=463929934 TSecr=478250921"
"174","2018-05-18 08:57:16.580147","192.168.2.2","17.253.91.201","TCP","66","61992  >  80 [ACK] Seq=688 Ack=107153 Win=128128 Len=0 TSval=463929934 TSecr=478250921"
"175","2018-05-18 08:57:16.580150","192.168.2.2","17.253.91.201","TCP","66","61992  >  80 [ACK] Seq=688 Ack=108601 Win=131072 Len=0 TSval=463929934 TSecr=478250921"
"176","2018-05-18 08:57:16.580150","192.168.2.2","17.253.91.201","TCP","66","61992  >  80 [ACK] Seq=688 Ack=111497 Win=129600 Len=0 TSval=463929935 TSecr=478250921"
"177","2018-05-18 08:57:16.580151","192.168.2.2","17.253.91.201","TCP","66","61992  >  80 [ACK] Seq=688 Ack=114393 Win=126720 Len=0 TSval=463929935 TSecr=478250921"
"178","2018-05-18 08:57:16.580152","192.168.2.2","17.253.91.201","TCP","66","61992  >  80 [ACK] Seq=688 Ack=115841 Win=131072 Len=0 TSval=463929935 TSecr=478250921"
"179","2018-05-18 08:57:16.580153","192.168.2.2","17.253.91.201","TCP","66","61992  >  80 [ACK] Seq=688 Ack=118737 Win=129600 Len=0 TSval=463929935 TSecr=478250921"
"180","2018-05-18 08:57:16.580153","192.168.2.2","17.253.91.201","TCP","66","61992  >  80 [ACK] Seq=688 Ack=120185 Win=131072 Len=0 TSval=463929935 TSecr=478250921"
"181","2018-05-18 08:57:16.580154","192.168.2.2","17.253.91.201","TCP","66","61992  >  80 [ACK] Seq=688 Ack=123081 Win=129600 Len=0 TSval=463929935 TSecr=478250921"
"182","2018-05-18 08:57:16.580155","192.168.2.2","17.253.91.201","TCP","66","61992  >  80 [ACK] Seq=688 Ack=125977 Win=126720 Len=0 TSval=463929935 TSecr=478250921"
"183","2018-05-18 08:57:16.580155","192.168.2.2","17.253.91.201","TCP","66","[TCP Window Update] 61992  >  80 [ACK] Seq=688 Ack=125977 Win=131072 Len=0 TSval=463929935 TSecr=478250921"
"184","2018-05-18 08:57:16.580156","192.168.2.2","17.253.91.201","TCP","66","61992  >  80 [ACK] Seq=688 Ack=128873 Win=129600 Len=0 TSval=463929935 TSecr=478250921"
"185","2018-05-18 08:57:16.580156","192.168.2.2","17.253.91.201","TCP","66","61992  >  80 [ACK] Seq=688 Ack=131769 Win=128128 Len=0 TSval=463929935 TSecr=478250921"
"186","2018-05-18 08:57:16.580157","192.168.2.2","17.253.91.201","TCP","66","[TCP Window Update] 61992  >  80 [ACK] Seq=688 Ack=131769 Win=131072 Len=0 TSval=463929936 TSecr=478250921"
"194","2018-05-18 08:57:16.587406","192.168.2.2","17.253.91.201","TCP","66","61992  >  80 [ACK] Seq=688 Ack=134665 Win=129600 Len=0 TSval=463929940 TSecr=478250921"
"212","2018-05-18 08:57:16.592029","192.168.2.2","17.253.91.201","TCP","66","61992  >  80 [ACK] Seq=688 Ack=136113 Win=131072 Len=0 TSval=463929944 TSecr=478250928"
"213","2018-05-18 08:57:16.592031","192.168.2.2","17.253.91.201","TCP","66","61992  >  80 [ACK] Seq=688 Ack=139009 Win=128128 Len=0 TSval=463929944 TSecr=478250928"
"214","2018-05-18 08:57:16.592031","192.168.2.2","17.253.91.201","TCP","66","61992  >  80 [ACK] Seq=688 Ack=140457 Win=131072 Len=0 TSval=463929945 TSecr=478250931"
"215","2018-05-18 08:57:16.592698","192.168.2.2","17.253.91.201","TCP","66","61992  >  80 [ACK] Seq=688 Ack=141905 Win=129600 Len=0 TSval=463929945 TSecr=478250931"
"216","2018-05-18 08:57:16.592700","192.168.2.2","17.253.91.201","TCP","66","61992  >  80 [ACK] Seq=688 Ack=144801 Win=128128 Len=0 TSval=463929945 TSecr=478250932"
"217","2018-05-18 08:57:16.592700","192.168.2.2","17.253.91.201","TCP","66","61992  >  80 [ACK] Seq=688 Ack=147697 Win=125248 Len=0 TSval=463929945 TSecr=478250932"
"218","2018-05-18 08:57:16.592701","192.168.2.2","17.253.91.201","TCP","66","61992  >  80 [ACK] Seq=688 Ack=150593 Win=122368 Len=0 TSval=463929945 TSecr=478250932"
"219","2018-05-18 08:57:16.592702","192.168.2.2","17.253.91.201","TCP","66","61992  >  80 [ACK] Seq=688 Ack=153489 Win=119488 Len=0 TSval=463929945 TSecr=478250932"
"220","2018-05-18 08:57:16.592703","192.168.2.2","17.253.91.201","TCP","66","[TCP Window Update] 61992  >  80 [ACK] Seq=688 Ack=153489 Win=126720 Len=0 TSval=463929945 TSecr=478250932"
"221","2018-05-18 08:57:16.592704","192.168.2.2","17.253.91.201","TCP","66","61992  >  80 [ACK] Seq=688 Ack=156385 Win=123776 Len=0 TSval=463929945 TSecr=478250932"
"222","2018-05-18 08:57:16.592704","192.168.2.2","17.253.91.201","TCP","66","[TCP Window Update] 61992  >  80 [ACK] Seq=688 Ack=156385 Win=131072 Len=0 TSval=463929946 TSecr=478250932"
"223","2018-05-18 08:57:16.592705","192.168.2.2","17.253.91.201","TCP","66","61992  >  80 [ACK] Seq=688 Ack=159281 Win=129600 Len=0 TSval=463929946 TSecr=478250932"
"224","2018-05-18 08:57:16.592705","192.168.2.2","17.253.91.201","TCP","66","61992  >  80 [ACK] Seq=688 Ack=160729 Win=131072 Len=0 TSval=463929946 TSecr=478250932"
"225","2018-05-18 08:57:16.592706","192.168.2.2","17.253.91.201","TCP","66","61992  >  80 [ACK] Seq=688 Ack=163625 Win=129600 Len=0 TSval=463929946 TSecr=478250932"
"226","2018-05-18 08:57:16.592706","192.168.2.2","17.253.91.201","TCP","66","61992  >  80 [ACK] Seq=688 Ack=166521 Win=128128 Len=0 TSval=463929946 TSecr=478250932"
"227","2018-05-18 08:57:16.592707","192.168.2.2","17.253.91.201","TCP","66","61992  >  80 [ACK] Seq=688 Ack=167969 Win=131072 Len=0 TSval=463929946 TSecr=478250932"
"232","2018-05-18 08:57:16.598551","192.168.2.2","17.253.91.201","TCP","66","61992  >  80 [ACK] Seq=688 Ack=170865 Win=128128 Len=0 TSval=463929953 TSecr=478250940"
"233","2018-05-18 08:57:16.598553","192.168.2.2","17.253.91.201","TCP","66","[TCP Window Update] 61992  >  80 [ACK] Seq=688 Ack=170865 Win=131072 Len=0 TSval=463929953 TSecr=478250940"
"237","2018-05-18 08:57:16.599027","192.168.2.2","17.253.91.201","TCP","66","61992  >  80 [ACK] Seq=688 Ack=173761 Win=128128 Len=0 TSval=463929953 TSecr=478250940"
"238","2018-05-18 08:57:16.599029","192.168.2.2","17.253.91.201","TCP","66","[TCP Window Update] 61992  >  80 [ACK] Seq=688 Ack=173761 Win=131072 Len=0 TSval=463929953 TSecr=478250940"
"239","2018-05-18 08:57:16.600459","192.168.2.2","17.253.91.201","TCP","66","61992  >  80 [ACK] Seq=688 Ack=176657 Win=128128 Len=0 TSval=463929955 TSecr=478250944"
"240","2018-05-18 08:57:16.600461","192.168.2.2","17.253.91.201","TCP","66","[TCP Window Update] 61992  >  80 [ACK] Seq=688 Ack=176657 Win=131072 Len=0 TSval=463929955 TSecr=478250944"
"261","2018-05-18 08:57:16.603890","192.168.2.2","17.253.91.201","TCP","66","61992  >  80 [ACK] Seq=688 Ack=179553 Win=129600 Len=0 TSval=463929956 TSecr=478250944"
"262","2018-05-18 08:57:16.603892","192.168.2.2","17.253.91.201","TCP","66","61992  >  80 [ACK] Seq=688 Ack=181001 Win=131072 Len=0 TSval=463929956 TSecr=478250945"
"267","2018-05-18 08:57:16.606453","192.168.2.2","17.253.91.201","TCP","66","61992  >  80 [ACK] Seq=688 Ack=183897 Win=128128 Len=0 TSval=463929957 TSecr=478250945"
"268","2018-05-18 08:57:16.606455","192.168.2.2","17.253.91.201","TCP","66","61992  >  80 [ACK] Seq=688 Ack=185345 Win=131072 Len=0 TSval=463929957 TSecr=478250945"
"269","2018-05-18 08:57:16.606456","192.168.2.2","17.253.91.201","TCP","66","61992  >  80 [ACK] Seq=688 Ack=188241 Win=129600 Len=0 TSval=463929957 TSecr=478250945"
"270","2018-05-18 08:57:16.606456","192.168.2.2","17.253.91.201","TCP","66","61992  >  80 [ACK] Seq=688 Ack=191137 Win=126720 Len=0 TSval=463929957 TSecr=478250945"
"271","2018-05-18 08:57:16.606457","192.168.2.2","17.253.91.201","TCP","66","61992  >  80 [ACK] Seq=688 Ack=194033 Win=123776 Len=0 TSval=463929957 TSecr=478250945"
"272","2018-05-18 08:57:16.606458","192.168.2.2","17.253.91.201","TCP","66","[TCP Window Update] 61992  >  80 [ACK] Seq=688 Ack=194033 Win=131072 Len=0 TSval=463929957 TSecr=478250945"
"273","2018-05-18 08:57:16.606459","192.168.2.2","17.253.91.201","TCP","66","61992  >  80 [ACK] Seq=688 Ack=196929 Win=128128 Len=0 TSval=463929957 TSecr=478250945"
"274","2018-05-18 08:57:16.606460","192.168.2.2","17.253.91.201","TCP","66","[TCP Window Update] 61992  >  80 [ACK] Seq=688 Ack=196929 Win=131072 Len=0 TSval=463929957 TSecr=478250945"
"275","2018-05-18 08:57:16.606460","192.168.2.2","17.253.91.201","TCP","66","61992  >  80 [ACK] Seq=688 Ack=199825 Win=129600 Len=0 TSval=463929957 TSecr=478250945"
"276","2018-05-18 08:57:16.606461","192.168.2.2","17.253.91.201","TCP","66","61992  >  80 [ACK] Seq=688 Ack=202721 Win=128128 Len=0 TSval=463929958 TSecr=478250945"
"277","2018-05-18 08:57:16.606462","192.168.2.2","17.253.91.201","TCP","66","[TCP Window Update] 61992  >  80 [ACK] Seq=688 Ack=202721 Win=131072 Len=0 TSval=463929958 TSecr=478250945"
"278","2018-05-18 08:57:16.606817","192.168.2.2","17.253.91.201","TCP","66","61992  >  80 [ACK] Seq=688 Ack=205617 Win=128128 Len=0 TSval=463929958 TSecr=478250945"
"279","2018-05-18 08:57:16.606819","192.168.2.2","17.253.91.201","TCP","66","[TCP Window Update] 61992  >  80 [ACK] Seq=688 Ack=205617 Win=131072 Len=0 TSval=463929958 TSecr=478250945"
"284","2018-05-18 08:57:16.612378","192.168.2.2","17.253.91.201","TCP","66","61992  >  80 [ACK] Seq=688 Ack=208513 Win=129600 Len=0 TSval=463929963 TSecr=478250945"
"285","2018-05-18 08:57:16.612381","192.168.2.2","17.253.91.201","TCP","66","61992  >  80 [ACK] Seq=688 Ack=211409 Win=128128 Len=0 TSval=463929963 TSecr=478250951"
"286","2018-05-18 08:57:16.612382","192.168.2.2","17.253.91.201","TCP","66","[TCP Window Update] 61992  >  80 [ACK] Seq=688 Ack=211409 Win=131072 Len=0 TSval=463929963 TSecr=478250951"
"287","2018-05-18 08:57:16.613318","192.168.2.2","17.253.91.201","TCP","66","61992  >  80 [ACK] Seq=688 Ack=214305 Win=128128 Len=0 TSval=463929964 TSecr=478250951"
"288","2018-05-18 08:57:16.613320","192.168.2.2","17.253.91.201","TCP","66","61992  >  80 [ACK] Seq=688 Ack=215753 Win=131072 Len=0 TSval=463929964 TSecr=478250953"
"307","2018-05-18 08:57:16.614389","192.168.2.2","17.253.91.201","TCP","66","61992  >  80 [ACK] Seq=688 Ack=218649 Win=128128 Len=0 TSval=463929966 TSecr=478250956"
"308","2018-05-18 08:57:16.614390","192.168.2.2","17.253.91.201","TCP","66","[TCP Window Update] 61992  >  80 [ACK] Seq=688 Ack=218649 Win=131072 Len=0 TSval=463929966 TSecr=478250956"
"309","2018-05-18 08:57:16.615182","192.168.2.2","17.253.91.201","TCP","66","61992  >  80 [ACK] Seq=688 Ack=221545 Win=128128 Len=0 TSval=463929967 TSecr=478250959"
"310","2018-05-18 08:57:16.615184","192.168.2.2","17.253.91.201","TCP","66","[TCP Window Update] 61992  >  80 [ACK] Seq=688 Ack=221545 Win=131072 Len=0 TSval=463929967 TSecr=478250959"
"311","2018-05-18 08:57:16.617053","192.168.2.2","17.253.91.201","TCP","66","61992  >  80 [ACK] Seq=688 Ack=224441 Win=128128 Len=0 TSval=463929967 TSecr=478250959"
"312","2018-05-18 08:57:16.617055","192.168.2.2","17.253.91.201","TCP","66","[TCP Window Update] 61992  >  80 [ACK] Seq=688 Ack=224441 Win=131072 Len=0 TSval=463929968 TSecr=478250959"
"313","2018-05-18 08:57:16.617516","192.168.2.2","17.253.91.201","TCP","66","61992  >  80 [ACK] Seq=688 Ack=227337 Win=128128 Len=0 TSval=463929968 TSecr=478250959"
"314","2018-05-18 08:57:16.617518","192.168.2.2","17.253.91.201","TCP","66","61992  >  80 [ACK] Seq=688 Ack=230233 Win=125248 Len=0 TSval=463929969 TSecr=478250959"
"315","2018-05-18 08:57:16.617518","192.168.2.2","17.253.91.201","TCP","66","61992  >  80 [ACK] Seq=688 Ack=233129 Win=122368 Len=0 TSval=463929969 TSecr=478250959"
"316","2018-05-18 08:57:16.617519","192.168.2.2","17.253.91.201","TCP","66","61992  >  80 [ACK] Seq=688 Ack=236025 Win=119488 Len=0 TSval=463929969 TSecr=478250959"
"317","2018-05-18 08:57:16.617520","192.168.2.2","17.253.91.201","TCP","66","[TCP Window Update] 61992  >  80 [ACK] Seq=688 Ack=236025 Win=129600 Len=0 TSval=463929969 TSecr=478250959"
"318","2018-05-18 08:57:16.617521","192.168.2.2","17.253.91.201","TCP","66","61992  >  80 [ACK] Seq=688 Ack=238921 Win=128128 Len=0 TSval=463929969 TSecr=478250959"
"319","2018-05-18 08:57:16.617522","192.168.2.2","17.253.91.201","TCP","66","61992  >  80 [ACK] Seq=688 Ack=241817 Win=125248 Len=0 TSval=463929969 TSecr=478250959"
"320","2018-05-18 08:57:16.618370","192.168.2.2","17.253.91.201","TCP","66","[TCP Window Update] 61992  >  80 [ACK] Seq=688 Ack=241817 Win=131072 Len=0 TSval=463929969 TSecr=478250959"
"321","2018-05-18 08:57:16.618372","192.168.2.2","17.253.91.201","TCP","66","61992  >  80 [ACK] Seq=688 Ack=244713 Win=128128 Len=0 TSval=463929969 TSecr=478250959"
"322","2018-05-18 08:57:16.618373","192.168.2.2","17.253.91.201","TCP","66","[TCP Window Update] 61992  >  80 [ACK] Seq=688 Ack=244713 Win=131072 Len=0 TSval=463929969 TSecr=478250959"
"331","2018-05-18 08:57:16.621874","192.168.2.2","17.253.91.201","TCP","66","61992  >  80 [ACK] Seq=688 Ack=247609 Win=128128 Len=0 TSval=463929973 TSecr=478250965"
"332","2018-05-18 08:57:16.621876","192.168.2.2","17.253.91.201","TCP","66","[TCP Window Update] 61992  >  80 [ACK] Seq=688 Ack=247609 Win=131072 Len=0 TSval=463929973 TSecr=478250965"
"333","2018-05-18 08:57:16.621877","192.168.2.2","17.253.91.201","TCP","66","61992  >  80 [ACK] Seq=688 Ack=250505 Win=128128 Len=0 TSval=463929973 TSecr=478250965"
"336","2018-05-18 08:57:16.622555","192.168.2.2","17.253.91.201","TCP","66","[TCP Window Update] 61992  >  80 [ACK] Seq=688 Ack=250505 Win=131072 Len=0 TSval=463929973 TSecr=478250965"
"337","2018-05-18 08:57:16.622558","192.168.2.2","17.253.91.201","TCP","66","61992  >  80 [ACK] Seq=688 Ack=253401 Win=128128 Len=0 TSval=463929973 TSecr=478250965"
"338","2018-05-18 08:57:16.622558","192.168.2.2","17.253.91.201","TCP","66","[TCP Window Update] 61992  >  80 [ACK] Seq=688 Ack=253401 Win=131072 Len=0 TSval=463929973 TSecr=478250965"
"339","2018-05-18 08:57:16.623278","192.168.2.2","17.253.91.201","TCP","66","61992  >  80 [ACK] Seq=688 Ack=256297 Win=128128 Len=0 TSval=463929974 TSecr=478250966"
"340","2018-05-18 08:57:16.623280","192.168.2.2","17.253.91.201","TCP","66","[TCP Window Update] 61992  >  80 [ACK] Seq=688 Ack=256297 Win=131072 Len=0 TSval=463929974 TSecr=478250966"
"346","2018-05-18 08:57:16.625089","192.168.2.2","17.253.91.201","TCP","66","61992  >  80 [ACK] Seq=688 Ack=259193 Win=128128 Len=0 TSval=463929974 TSecr=478250967"
"347","2018-05-18 08:57:16.625108","192.168.2.2","17.253.91.201","TCP","66","[TCP Window Update] 61992  >  80 [ACK] Seq=688 Ack=259193 Win=131072 Len=0 TSval=463929974 TSecr=478250967"
"368","2018-05-18 08:57:16.630544","192.168.2.2","17.253.91.201","TCP","66","61992  >  80 [ACK] Seq=688 Ack=262089 Win=128128 Len=0 TSval=463929980 TSecr=478250969"
"369","2018-05-18 08:57:16.630546","192.168.2.2","17.253.91.201","TCP","66","[TCP Window Update] 61992  >  80 [ACK] Seq=688 Ack=262089 Win=131072 Len=0 TSval=463929980 TSecr=478250969"
"373","2018-05-18 08:57:16.632520","192.168.2.2","17.253.91.201","TCP","66","61992  >  80 [ACK] Seq=688 Ack=264985 Win=128128 Len=0 TSval=463929980 TSecr=478250970"
"374","2018-05-18 08:57:16.632523","192.168.2.2","17.253.91.201","TCP","66","61992  >  80 [ACK] Seq=688 Ack=266433 Win=131072 Len=0 TSval=463929980 TSecr=478250970"
"375","2018-05-18 08:57:16.632523","192.168.2.2","17.253.91.201","TCP","66","61992  >  80 [ACK] Seq=688 Ack=269329 Win=128128 Len=0 TSval=463929981 TSecr=478250970"
"376","2018-05-18 08:57:16.632524","192.168.2.2","17.253.91.201","TCP","66","61992  >  80 [ACK] Seq=688 Ack=270777 Win=131072 Len=0 TSval=463929981 TSecr=478250970"
"377","2018-05-18 08:57:16.632524","192.168.2.2","17.253.91.201","TCP","66","61992  >  80 [ACK] Seq=688 Ack=272225 Win=129600 Len=0 TSval=463929981 TSecr=478250970"
"378","2018-05-18 08:57:16.632526","192.168.2.2","17.253.91.201","TCP","66","61992  >  80 [ACK] Seq=688 Ack=273673 Win=131072 Len=0 TSval=463929981 TSecr=478250970"
"379","2018-05-18 08:57:16.632526","192.168.2.2","17.253.91.201","TCP","66","61992  >  80 [ACK] Seq=688 Ack=276569 Win=128128 Len=0 TSval=463929981 TSecr=478250970"
"380","2018-05-18 08:57:16.632527","192.168.2.2","17.253.91.201","TCP","66","[TCP Window Update] 61992  >  80 [ACK] Seq=688 Ack=276569 Win=131072 Len=0 TSval=463929981 TSecr=478250970"
"381","2018-05-18 08:57:16.632527","192.168.2.2","17.253.91.201","TCP","66","61992  >  80 [ACK] Seq=688 Ack=279465 Win=128128 Len=0 TSval=463929981 TSecr=478250970"
"382","2018-05-18 08:57:16.632528","192.168.2.2","17.253.91.201","TCP","66","[TCP Window Update] 61992  >  80 [ACK] Seq=688 Ack=279465 Win=131072 Len=0 TSval=463929981 TSecr=478250970"
"383","2018-05-18 08:57:16.632529","192.168.2.2","17.253.91.201","TCP","66","61992  >  80 [ACK] Seq=688 Ack=282361 Win=128128 Len=0 TSval=463929981 TSecr=478250970"
"384","2018-05-18 08:57:16.632529","192.168.2.2","17.253.91.201","TCP","66","[TCP Window Update] 61992  >  80 [ACK] Seq=688 Ack=282361 Win=131072 Len=0 TSval=463929981 TSecr=478250970"
"385","2018-05-18 08:57:16.635162","192.168.2.2","17.253.91.201","TCP","66","61992  >  80 [ACK] Seq=688 Ack=285257 Win=129600 Len=0 TSval=463929982 TSecr=478250970"
"386","2018-05-18 08:57:16.635164","192.168.2.2","17.253.91.201","TCP","66","61992  >  80 [ACK] Seq=688 Ack=288153 Win=126720 Len=0 TSval=463929982 TSecr=478250974"
"387","2018-05-18 08:57:16.635165","192.168.2.2","17.253.91.201","TCP","66","[TCP Window Update] 61992  >  80 [ACK] Seq=688 Ack=288153 Win=131072 Len=0 TSval=463929982 TSecr=478250974"
"388","2018-05-18 08:57:16.635166","192.168.2.2","17.253.91.201","TCP","66","61992  >  80 [ACK] Seq=688 Ack=291049 Win=129600 Len=0 TSval=463929982 TSecr=478250974"
"389","2018-05-18 08:57:16.635166","192.168.2.2","17.253.91.201","TCP","66","61992  >  80 [ACK] Seq=688 Ack=292497 Win=131072 Len=0 TSval=463929982 TSecr=478250975"
"390","2018-05-18 08:57:16.636443","192.168.2.2","17.253.91.201","TCP","66","61992  >  80 [ACK] Seq=688 Ack=295393 Win=128128 Len=0 TSval=463929982 TSecr=478250975"
"391","2018-05-18 08:57:16.636445","192.168.2.2","17.253.91.201","TCP","66","[TCP Window Update] 61992  >  80 [ACK] Seq=688 Ack=295393 Win=131072 Len=0 TSval=463929982 TSecr=478250975"
"392","2018-05-18 08:57:16.636904","192.168.2.2","17.253.91.201","TCP","66","61992  >  80 [ACK] Seq=688 Ack=298289 Win=128128 Len=0 TSval=463929986 TSecr=478250977"
"393","2018-05-18 08:57:16.636906","192.168.2.2","17.253.91.201","TCP","66","61992  >  80 [ACK] Seq=688 Ack=299737 Win=131072 Len=0 TSval=463929986 TSecr=478250977"
"396","2018-05-18 08:57:16.639760","192.168.2.2","17.253.91.201","TCP","66","61992  >  80 [ACK] Seq=688 Ack=302633 Win=128128 Len=0 TSval=463929988 TSecr=478250983"
"397","2018-05-18 08:57:16.639762","192.168.2.2","17.253.91.201","TCP","66","[TCP Window Update] 61992  >  80 [ACK] Seq=688 Ack=302633 Win=131072 Len=0 TSval=463929988 TSecr=478250983"
"427","2018-05-18 08:57:16.664767","192.168.2.2","17.253.91.201","TCP","66","61992  >  80 [ACK] Seq=688 Ack=305529 Win=128128 Len=0 TSval=463929990 TSecr=478250985"
"428","2018-05-18 08:57:16.664769","192.168.2.2","17.253.91.201","TCP","66","[TCP Window Update] 61992  >  80 [ACK] Seq=688 Ack=305529 Win=131072 Len=0 TSval=463929990 TSecr=478250985"
"429","2018-05-18 08:57:16.668361","192.168.2.2","17.253.91.201","TCP","66","61992  >  80 [ACK] Seq=688 Ack=308425 Win=128128 Len=0 TSval=463929990 TSecr=478250985"
"430","2018-05-18 08:57:16.668363","192.168.2.2","17.253.91.201","TCP","66","[TCP Window Update] 61992  >  80 [ACK] Seq=688 Ack=308425 Win=131072 Len=0 TSval=463929990 TSecr=478250985"
"431","2018-05-18 08:57:16.668364","192.168.2.2","17.253.91.201","TCP","66","61992  >  80 [ACK] Seq=688 Ack=311321 Win=129600 Len=0 TSval=463929990 TSecr=478250985"
"432","2018-05-18 08:57:16.668365","192.168.2.2","17.253.91.201","TCP","66","61992  >  80 [ACK] Seq=688 Ack=314217 Win=128128 Len=0 TSval=463929991 TSecr=478250985"
"433","2018-05-18 08:57:16.668365","192.168.2.2","17.253.91.201","TCP","66","[TCP Window Update] 61992  >  80 [ACK] Seq=688 Ack=314217 Win=131072 Len=0 TSval=463929991 TSecr=478250985"
"434","2018-05-18 08:57:16.668367","192.168.2.2","17.253.91.201","TCP","66","61992  >  80 [ACK] Seq=688 Ack=317113 Win=128128 Len=0 TSval=463929991 TSecr=478250985"
"435","2018-05-18 08:57:16.668368","192.168.2.2","17.253.91.201","TCP","66","[TCP Window Update] 61992  >  80 [ACK] Seq=688 Ack=317113 Win=131072 Len=0 TSval=463929991 TSecr=478250985"
"436","2018-05-18 08:57:16.668621","192.168.2.2","17.253.91.201","TCP","66","61992  >  80 [ACK] Seq=688 Ack=320009 Win=128128 Len=0 TSval=463929991 TSecr=478250985"
"437","2018-05-18 08:57:16.668624","192.168.2.2","17.253.91.201","TCP","66","[TCP Window Update] 61992  >  80 [ACK] Seq=688 Ack=320009 Win=131072 Len=0 TSval=463929991 TSecr=478250985"
"438","2018-05-18 08:57:16.668625","192.168.2.2","17.253.91.201","TCP","66","61992  >  80 [ACK] Seq=688 Ack=322905 Win=128128 Len=0 TSval=463929991 TSecr=478250985"
"439","2018-05-18 08:57:16.668625","192.168.2.2","17.253.91.201","TCP","66","[TCP Window Update] 61992  >  80 [ACK] Seq=688 Ack=322905 Win=131072 Len=0 TSval=463929991 TSecr=478250985"
"440","2018-05-18 08:57:16.669969","192.168.2.2","17.253.91.201","TCP","66","61992  >  80 [ACK] Seq=688 Ack=325801 Win=128128 Len=0 TSval=463930014 TSecr=478250987"
"441","2018-05-18 08:57:16.669971","192.168.2.2","17.253.91.201","TCP","66","61992  >  80 [ACK] Seq=688 Ack=328697 Win=125248 Len=0 TSval=463930014 TSecr=478250987"
"442","2018-05-18 08:57:16.669972","192.168.2.2","17.253.91.201","TCP","66","[TCP Window Update] 61992  >  80 [ACK] Seq=688 Ack=328697 Win=131072 Len=0 TSval=463930014 TSecr=478250987"
"443","2018-05-18 08:57:16.670367","192.168.2.2","23.67.184.110","TCP","66","61958  >  443 [ACK] Seq=3614 Ack=350 Win=2042 Len=0 TSval=463930014 TSecr=1538913006"
"444","2018-05-18 08:57:16.670369","192.168.2.2","17.253.91.201","TCP","66","61992  >  80 [ACK] Seq=688 Ack=331593 Win=128128 Len=0 TSval=463930017 TSecr=478250987"
"445","2018-05-18 08:57:16.670370","192.168.2.2","17.253.91.201","TCP","66","61992  >  80 [ACK] Seq=688 Ack=334489 Win=125248 Len=0 TSval=463930017 TSecr=478250989"
"446","2018-05-18 08:57:16.670370","192.168.2.2","17.253.91.201","TCP","66","[TCP Window Update] 61992  >  80 [ACK] Seq=688 Ack=334489 Win=131072 Len=0 TSval=463930017 TSecr=478250989"
"447","2018-05-18 08:57:16.670371","192.168.2.2","17.253.91.201","TCP","66","61992  >  80 [ACK] Seq=688 Ack=337385 Win=128128 Len=0 TSval=463930017 TSecr=478250989"
"448","2018-05-18 08:57:16.670372","192.168.2.2","17.253.91.201","TCP","66","61992  >  80 [ACK] Seq=688 Ack=340281 Win=125248 Len=0 TSval=463930017 TSecr=478250989"
"449","2018-05-18 08:57:16.670373","192.168.2.2","17.253.91.201","TCP","66","[TCP Window Update] 61992  >  80 [ACK] Seq=688 Ack=340281 Win=131072 Len=0 TSval=463930017 TSecr=478250989"
"450","2018-05-18 08:57:16.671104","192.168.2.2","17.253.91.201","TCP","66","61992  >  80 [ACK] Seq=688 Ack=343177 Win=129600 Len=0 TSval=463930017 TSecr=478250992"
"453","2018-05-18 08:57:16.673248","192.168.2.2","17.253.91.201","TCP","66","61992  >  80 [ACK] Seq=688 Ack=346073 Win=128128 Len=0 TSval=463930020 TSecr=478251017"
"454","2018-05-18 08:57:16.673250","192.168.2.2","17.253.91.201","TCP","66","[TCP Window Update] 61992  >  80 [ACK] Seq=688 Ack=346073 Win=131072 Len=0 TSval=463930020 TSecr=478251017"
"482","2018-05-18 08:57:16.678902","192.168.2.2","17.253.91.201","TCP","66","61992  >  80 [ACK] Seq=688 Ack=348969 Win=128128 Len=0 TSval=463930024 TSecr=478251020"
"483","2018-05-18 08:57:16.678904","192.168.2.2","17.253.91.201","TCP","66","[TCP Window Update] 61992  >  80 [ACK] Seq=688 Ack=348969 Win=131072 Len=0 TSval=463930024 TSecr=478251020"
"486","2018-05-18 08:57:16.680873","192.168.2.2","17.253.91.201","TCP","66","61992  >  80 [ACK] Seq=688 Ack=351865 Win=128128 Len=0 TSval=463930025 TSecr=478251020"
"487","2018-05-18 08:57:16.680875","192.168.2.2","17.253.91.201","TCP","66","61992  >  80 [ACK] Seq=688 Ack=353313 Win=131072 Len=0 TSval=463930025 TSecr=478251020"
"488","2018-05-18 08:57:16.680876","192.168.2.2","17.253.91.201","TCP","66","61992  >  80 [ACK] Seq=688 Ack=356209 Win=129600 Len=0 TSval=463930025 TSecr=478251020"
"489","2018-05-18 08:57:16.680877","192.168.2.2","17.253.91.201","TCP","66","61992  >  80 [ACK] Seq=688 Ack=359105 Win=128128 Len=0 TSval=463930025 TSecr=478251020"
"490","2018-05-18 08:57:16.680877","192.168.2.2","17.253.91.201","TCP","66","61992  >  80 [ACK] Seq=688 Ack=360553 Win=131072 Len=0 TSval=463930025 TSecr=478251021"
"491","2018-05-18 08:57:16.681594","192.168.2.2","17.253.91.201","TCP","66","61992  >  80 [ACK] Seq=688 Ack=363449 Win=128128 Len=0 TSval=463930025 TSecr=478251021"
"492","2018-05-18 08:57:16.681597","192.168.2.2","17.253.91.201","TCP","66","[TCP Window Update] 61992  >  80 [ACK] Seq=688 Ack=363449 Win=131072 Len=0 TSval=463930025 TSecr=478251021"
"493","2018-05-18 08:57:16.681597","192.168.2.2","17.253.91.201","TCP","66","61992  >  80 [ACK] Seq=688 Ack=366345 Win=128128 Len=0 TSval=463930026 TSecr=478251022"
"494","2018-05-18 08:57:16.681598","192.168.2.2","17.253.91.201","TCP","66","[TCP Window Update] 61992  >  80 [ACK] Seq=688 Ack=366345 Win=131072 Len=0 TSval=463930026 TSecr=478251022"
"495","2018-05-18 08:57:16.681598","192.168.2.2","17.253.91.201","TCP","66","61992  >  80 [ACK] Seq=688 Ack=369241 Win=129600 Len=0 TSval=463930026 TSecr=478251022"
"496","2018-05-18 08:57:16.681600","192.168.2.2","17.253.91.201","TCP","66","61992  >  80 [ACK] Seq=688 Ack=372137 Win=126720 Len=0 TSval=463930026 TSecr=478251023"
"497","2018-05-18 08:57:16.681601","192.168.2.2","17.253.91.201","TCP","66","[TCP Window Update] 61992  >  80 [ACK] Seq=688 Ack=372137 Win=131072 Len=0 TSval=463930026 TSecr=478251023"
"498","2018-05-18 08:57:16.681601","192.168.2.2","17.253.91.201","TCP","66","61992  >  80 [ACK] Seq=688 Ack=375033 Win=129600 Len=0 TSval=463930026 TSecr=478251023"
"499","2018-05-18 08:57:16.681602","192.168.2.2","17.253.91.201","TCP","66","61992  >  80 [ACK] Seq=688 Ack=376481 Win=131072 Len=0 TSval=463930026 TSecr=478251023"
"500","2018-05-18 08:57:16.681602","192.168.2.2","17.253.91.201","TCP","66","61992  >  80 [ACK] Seq=688 Ack=379377 Win=129600 Len=0 TSval=463930026 TSecr=478251023"
"501","2018-05-18 08:57:16.681603","192.168.2.2","17.253.91.201","TCP","66","61992  >  80 [ACK] Seq=688 Ack=382273 Win=128128 Len=0 TSval=463930026 TSecr=478251023"
"502","2018-05-18 08:57:16.681603","192.168.2.2","17.253.91.201","TCP","66","[TCP Window Update] 61992  >  80 [ACK] Seq=688 Ack=382273 Win=131072 Len=0 TSval=463930026 TSecr=478251023"
"503","2018-05-18 08:57:16.682176","192.168.2.2","17.253.91.201","TCP","66","61992  >  80 [ACK] Seq=688 Ack=385169 Win=128128 Len=0 TSval=463930027 TSecr=478251023"
"504","2018-05-18 08:57:16.682178","192.168.2.2","17.253.91.201","TCP","66","[TCP Window Update] 61992  >  80 [ACK] Seq=688 Ack=385169 Win=131072 Len=0 TSval=463930027 TSecr=478251023"
"505","2018-05-18 08:57:16.682595","192.168.2.2","17.253.91.201","TCP","66","61992  >  80 [ACK] Seq=688 Ack=388065 Win=128128 Len=0 TSval=463930027 TSecr=478251025"
"506","2018-05-18 08:57:16.682597","192.168.2.2","17.253.91.201","TCP","66","[TCP Window Update] 61992  >  80 [ACK] Seq=688 Ack=388065 Win=131072 Len=0 TSval=463930027 TSecr=478251025"
"536","2018-05-18 08:57:16.690224","192.168.2.2","17.253.91.201","TCP","66","61992  >  80 [ACK] Seq=688 Ack=390961 Win=128128 Len=0 TSval=463930033 TSecr=478251031"
"537","2018-05-18 08:57:16.690226","192.168.2.2","17.253.91.201","TCP","66","[TCP Window Update] 61992  >  80 [ACK] Seq=688 Ack=390961 Win=131072 Len=0 TSval=463930033 TSecr=478251031"
"538","2018-05-18 08:57:16.692254","192.168.2.2","17.253.91.201","TCP","66","61992  >  80 [ACK] Seq=688 Ack=393857 Win=128128 Len=0 TSval=463930037 TSecr=478251033"
"539","2018-05-18 08:57:16.692256","192.168.2.2","17.253.91.201","TCP","66","[TCP Window Update] 61992  >  80 [ACK] Seq=688 Ack=393857 Win=131072 Len=0 TSval=463930037 TSecr=478251033"
"540","2018-05-18 08:57:16.695375","192.168.2.2","17.253.91.201","TCP","66","61992  >  80 [ACK] Seq=688 Ack=396753 Win=128128 Len=0 TSval=463930039 TSecr=478251033"
