"No.","Time","Source","Destination","Protocol","Length","Info"
"8","2018-08-07 17:43:37.193920","192.168.2.3","216.58.197.4","TLSv1.2","156","Application Data"
"9","2018-08-07 17:43:37.193925","192.168.2.3","216.58.197.4","TLSv1.2","104","Application Data"
"10","2018-08-07 17:43:37.196166","192.168.2.3","216.58.197.4","TLSv1.2","158","Application Data"
"14","2018-08-07 17:43:37.208435","192.168.2.3","216.58.197.4","TCP","1434","49253  >  443 [ACK] Seq=221 Ack=1 Win=998 Len=1368 TSval=465564 TSecr=372491158 [TCP segment of a reassembled PDU]"
"15","2018-08-07 17:43:37.208670","192.168.2.3","216.58.197.4","TCP","1434","49253  >  443 [ACK] Seq=1589 Ack=1 Win=998 Len=1368 TSval=465564 TSecr=372491158 [TCP segment of a reassembled PDU]"
"16","2018-08-07 17:43:37.208673","192.168.2.3","216.58.197.4","TLSv1.2","212","Application Data"
"17","2018-08-07 17:43:37.208674","192.168.2.3","216.58.197.4","TCP","1434","49253  >  443 [ACK] Seq=3103 Ack=1 Win=998 Len=1368 TSval=465564 TSecr=372491158 [TCP segment of a reassembled PDU]"
"18","2018-08-07 17:43:37.208822","192.168.2.3","216.58.197.4","TLSv1.2","186","Application Data"
"19","2018-08-07 17:43:37.208824","192.168.2.3","216.58.197.4","TCP","1434","49253  >  443 [ACK] Seq=4591 Ack=1 Win=998 Len=1368 TSval=465564 TSecr=372491158 [TCP segment of a reassembled PDU]"
"20","2018-08-07 17:43:37.209064","192.168.2.3","216.58.197.4","TCP","1434","49253  >  443 [ACK] Seq=5959 Ack=1 Win=998 Len=1368 TSval=465564 TSecr=372491158 [TCP segment of a reassembled PDU]"
"21","2018-08-07 17:43:37.209067","192.168.2.3","216.58.197.4","TLSv1.2","212","Application Data"
"22","2018-08-07 17:43:37.209565","192.168.2.3","216.58.197.4","TCP","1434","49253  >  443 [ACK] Seq=7473 Ack=1 Win=998 Len=1368 TSval=465564 TSecr=372491158 [TCP segment of a reassembled PDU]"
"28","2018-08-07 17:43:37.219508","192.168.2.3","216.58.197.4","TLSv1.2","1434","Application Data [TCP segment of a reassembled PDU]"
"29","2018-08-07 17:43:37.219912","192.168.2.3","216.58.197.4","TCP","1434","49253  >  443 [ACK] Seq=10209 Ack=39 Win=998 Len=1368 TSval=465565 TSecr=372491158 [TCP segment of a reassembled PDU]"
"30","2018-08-07 17:43:37.219915","192.168.2.3","216.58.197.4","TLSv1.2","1434","Application Data [TCP segment of a reassembled PDU]"
"31","2018-08-07 17:43:37.220217","192.168.2.3","216.58.197.4","TLSv1.2","1434","Application Data [TCP segment of a reassembled PDU]"
"32","2018-08-07 17:43:37.220276","192.168.2.3","216.58.197.4","TCP","1434","49253  >  443 [ACK] Seq=14313 Ack=39 Win=998 Len=1368 TSval=465565 TSecr=372491173 [TCP segment of a reassembled PDU]"
"33","2018-08-07 17:43:37.220627","192.168.2.3","216.58.197.4","TLSv1.2","1434","Application Data [TCP segment of a reassembled PDU]"
"34","2018-08-07 17:43:37.221121","192.168.2.3","216.58.197.4","TLSv1.2","1434","Application Data [TCP segment of a reassembled PDU]"
"35","2018-08-07 17:43:37.221406","192.168.2.3","216.58.197.4","TCP","1434","49253  >  443 [ACK] Seq=18417 Ack=39 Win=998 Len=1368 TSval=465565 TSecr=372491173 [TCP segment of a reassembled PDU]"
"36","2018-08-07 17:43:37.221410","192.168.2.3","216.58.197.4","TLSv1.2","1434","Application Data [TCP segment of a reassembled PDU]"
"37","2018-08-07 17:43:37.221825","192.168.2.3","216.58.197.4","TLSv1.2","1434","Application Data [TCP segment of a reassembled PDU]"
"38","2018-08-07 17:43:37.221827","192.168.2.3","216.58.197.4","TCP","1434","49253  >  443 [ACK] Seq=22521 Ack=39 Win=998 Len=1368 TSval=465565 TSecr=372491173 [TCP segment of a reassembled PDU]"
"39","2018-08-07 17:43:37.221976","192.168.2.3","216.58.197.4","TLSv1.2","1434","Application Data [TCP segment of a reassembled PDU]"
"40","2018-08-07 17:43:37.222088","192.168.2.3","216.58.197.4","TLSv1.2","1434","Application Data [TCP segment of a reassembled PDU]"
"41","2018-08-07 17:43:37.222366","192.168.2.3","216.58.197.4","TCP","1434","49253  >  443 [ACK] Seq=26625 Ack=39 Win=998 Len=1368 TSval=465565 TSecr=372491174 [TCP segment of a reassembled PDU]"
"42","2018-08-07 17:43:37.222555","192.168.2.3","216.58.197.4","TLSv1.2","1434","Application Data [TCP segment of a reassembled PDU]"
"47","2018-08-07 17:43:37.225904","192.168.2.3","216.58.197.4","TLSv1.2","1434","Application Data [TCP segment of a reassembled PDU]"
"51","2018-08-07 17:43:37.227265","192.168.2.3","216.58.197.4","TCP","1434","49253  >  443 [ACK] Seq=30729 Ack=39 Win=998 Len=1368 TSval=465566 TSecr=372491184 [TCP segment of a reassembled PDU]"
"52","2018-08-07 17:43:37.227268","192.168.2.3","216.58.197.4","TCP","1434","49253  >  443 [ACK] Seq=32097 Ack=39 Win=998 Len=1368 TSval=465566 TSecr=372491184 [TCP segment of a reassembled PDU]"
"53","2018-08-07 17:43:37.227518","192.168.2.3","216.58.197.4","TLSv1.2","1434","Application Data [TCP segment of a reassembled PDU]"
"54","2018-08-07 17:43:37.227520","192.168.2.3","216.58.197.4","TLSv1.2","1434","Application Data [TCP segment of a reassembled PDU]"
"55","2018-08-07 17:43:37.227849","192.168.2.3","216.58.197.4","TCP","1434","49253  >  443 [ACK] Seq=36201 Ack=39 Win=998 Len=1368 TSval=465566 TSecr=372491184 [TCP segment of a reassembled PDU]"
"56","2018-08-07 17:43:37.227852","192.168.2.3","216.58.197.4","TLSv1.2","1434","Application Data [TCP segment of a reassembled PDU]"
"57","2018-08-07 17:43:37.228235","192.168.2.3","216.58.197.4","TLSv1.2","1434","Application Data [TCP segment of a reassembled PDU]"
"58","2018-08-07 17:43:37.228237","192.168.2.3","216.58.197.4","TCP","1434","49253  >  443 [ACK] Seq=40305 Ack=39 Win=998 Len=1368 TSval=465566 TSecr=372491185 [TCP segment of a reassembled PDU]"
"62","2018-08-07 17:43:37.232016","192.168.2.3","216.58.197.4","TLSv1.2","1434","Application Data [TCP segment of a reassembled PDU]"
"63","2018-08-07 17:43:37.232306","192.168.2.3","216.58.197.4","TCP","1434","49253  >  443 [ACK] Seq=43041 Ack=39 Win=998 Len=1368 TSval=465566 TSecr=372491185 [TCP segment of a reassembled PDU]"
"64","2018-08-07 17:43:37.232307","192.168.2.3","216.58.197.4","TLSv1.2","1434","Application Data [TCP segment of a reassembled PDU]"
"66","2018-08-07 17:43:37.232716","192.168.2.3","216.58.197.4","TCP","1434","49253  >  443 [ACK] Seq=45777 Ack=39 Win=998 Len=1368 TSval=465566 TSecr=372491186 [TCP segment of a reassembled PDU]"
"67","2018-08-07 17:43:37.232718","192.168.2.3","216.58.197.4","TLSv1.2","1434","Application Data [TCP segment of a reassembled PDU]"
"69","2018-08-07 17:43:37.232943","192.168.2.3","216.58.197.4","TCP","1434","49253  >  443 [ACK] Seq=48513 Ack=39 Win=998 Len=1368 TSval=465566 TSecr=372491186 [TCP segment of a reassembled PDU]"
"70","2018-08-07 17:43:37.232946","192.168.2.3","216.58.197.4","TLSv1.2","1434","Application Data [TCP segment of a reassembled PDU]"
"71","2018-08-07 17:43:37.233324","192.168.2.3","216.58.197.4","TCP","1434","49253  >  443 [ACK] Seq=51249 Ack=39 Win=998 Len=1368 TSval=465566 TSecr=372491186 [TCP segment of a reassembled PDU]"
"72","2018-08-07 17:43:37.233327","192.168.2.3","216.58.197.4","TLSv1.2","1434","Application Data [TCP segment of a reassembled PDU]"
"73","2018-08-07 17:43:37.233501","192.168.2.3","216.58.197.4","TCP","1434","49253  >  443 [ACK] Seq=53985 Ack=39 Win=998 Len=1368 TSval=465566 TSecr=372491186 [TCP segment of a reassembled PDU]"
"74","2018-08-07 17:43:37.233874","192.168.2.3","216.58.197.4","TLSv1.2","1434","Application Data [TCP segment of a reassembled PDU]"
"80","2018-08-07 17:43:37.240728","192.168.2.3","216.58.197.4","TCP","1434","49253  >  443 [ACK] Seq=56721 Ack=39 Win=998 Len=1368 TSval=465567 TSecr=372491190 [TCP segment of a reassembled PDU]"
"81","2018-08-07 17:43:37.241097","192.168.2.3","216.58.197.4","TLSv1.2","1113","Application Data, Application Data"
"83","2018-08-07 17:43:37.251024","192.168.2.3","216.58.197.4","TCP","1434","49253  >  443 [ACK] Seq=59136 Ack=39 Win=998 Len=1368 TSval=465568 TSecr=372491205 [TCP segment of a reassembled PDU]"
"84","2018-08-07 17:43:37.251390","192.168.2.3","216.58.197.4","TCP","1434","49253  >  443 [ACK] Seq=60504 Ack=39 Win=998 Len=1368 TSval=465568 TSecr=372491205 [TCP segment of a reassembled PDU]"
"85","2018-08-07 17:43:37.251393","192.168.2.3","216.58.197.4","TLSv1.2","212","Application Data"
"86","2018-08-07 17:43:37.251728","192.168.2.3","216.58.197.4","TCP","1434","49253  >  443 [ACK] Seq=62018 Ack=39 Win=998 Len=1368 TSval=465568 TSecr=372491205 [TCP segment of a reassembled PDU]"
"87","2018-08-07 17:43:37.251730","192.168.2.3","216.58.197.4","TLSv1.2","155","Application Data"
"91","2018-08-07 17:43:37.376191","192.168.2.3","216.58.197.4","TCP","1434","49253  >  443 [ACK] Seq=63475 Ack=39 Win=998 Len=1368 TSval=465581 TSecr=372491256 [TCP segment of a reassembled PDU]"
"92","2018-08-07 17:43:37.376212","192.168.2.3","216.58.197.4","TCP","1434","49253  >  443 [ACK] Seq=64843 Ack=39 Win=998 Len=1368 TSval=465581 TSecr=372491256 [TCP segment of a reassembled PDU]"
"93","2018-08-07 17:43:37.376250","192.168.2.3","216.58.197.4","TLSv1.2","212","Application Data"
"94","2018-08-07 17:43:37.376678","192.168.2.3","216.58.197.4","TLSv1.2","1316","Application Data"
"97","2018-08-07 17:43:37.401967","192.168.2.3","108.177.125.188","TCP","66","50384  >  5228 [ACK] Seq=1 Ack=1 Win=262 Len=0 TSval=465584 TSecr=2743983095"
"102","2018-08-07 17:43:37.460044","192.168.2.3","216.58.197.4","TCP","66","49253  >  443 [ACK] Seq=67607 Ack=407 Win=998 Len=0 TSval=465589 TSecr=372491410"
"104","2018-08-07 17:43:37.476696","192.168.2.3","216.58.197.4","TCP","66","49253  >  443 [ACK] Seq=67607 Ack=535 Win=998 Len=0 TSval=465591 TSecr=372491410"
"105","2018-08-07 17:43:37.501316","192.168.2.3","216.58.197.4","TCP","1434","49253  >  443 [ACK] Seq=67607 Ack=535 Win=998 Len=1368 TSval=465593 TSecr=372491410 [TCP segment of a reassembled PDU]"
"106","2018-08-07 17:43:37.501319","192.168.2.3","216.58.197.4","TCP","1434","49253  >  443 [ACK] Seq=68975 Ack=535 Win=998 Len=1368 TSval=465593 TSecr=372491410 [TCP segment of a reassembled PDU]"
"107","2018-08-07 17:43:37.501320","192.168.2.3","216.58.197.4","TLSv1.2","212","Application Data"
"108","2018-08-07 17:43:37.501623","192.168.2.3","216.58.197.4","TLSv1.2","1361","Application Data"
"113","2018-08-07 17:43:37.603958","192.168.2.3","216.58.197.4","TCP","1434","49253  >  443 [ACK] Seq=71784 Ack=535 Win=998 Len=1368 TSval=465603 TSecr=372491466 [TCP segment of a reassembled PDU]"
"114","2018-08-07 17:43:37.604128","192.168.2.3","216.58.197.4","TCP","1434","49253  >  443 [ACK] Seq=73152 Ack=535 Win=998 Len=1368 TSval=465604 TSecr=372491466 [TCP segment of a reassembled PDU]"
"115","2018-08-07 17:43:37.604131","192.168.2.3","216.58.197.4","TLSv1.2","212","Application Data"
"116","2018-08-07 17:43:37.604388","192.168.2.3","216.58.197.4","TLSv1.2","1237","Application Data"
"120","2018-08-07 17:43:37.642680","192.168.2.3","216.58.197.4","TCP","66","49253  >  443 [ACK] Seq=75837 Ack=651 Win=998 Len=0 TSval=465608 TSecr=372491561"
"121","2018-08-07 17:43:37.729049","192.168.2.3","216.58.197.4","TCP","1434","49253  >  443 [ACK] Seq=75837 Ack=651 Win=998 Len=1368 TSval=465616 TSecr=372491561 [TCP segment of a reassembled PDU]"
"122","2018-08-07 17:43:37.729056","192.168.2.3","216.58.197.4","TCP","1434","49253  >  443 [ACK] Seq=77205 Ack=651 Win=998 Len=1368 TSval=465616 TSecr=372491561 [TCP segment of a reassembled PDU]"
"123","2018-08-07 17:43:37.729331","192.168.2.3","216.58.197.4","TLSv1.2","212","Application Data"
"124","2018-08-07 17:43:37.729335","192.168.2.3","216.58.197.4","TLSv1.2","981","Application Data"
"129","2018-08-07 17:43:37.770892","192.168.2.3","216.58.197.4","TCP","66","49253  >  443 [ACK] Seq=79634 Ack=837 Win=998 Len=0 TSval=465620 TSecr=372491730"
"130","2018-08-07 17:43:37.826353","192.168.2.3","216.58.197.4","TCP","1434","49253  >  443 [ACK] Seq=79634 Ack=837 Win=998 Len=1368 TSval=465626 TSecr=372491730 [TCP segment of a reassembled PDU]"
"131","2018-08-07 17:43:37.830741","192.168.2.3","216.58.197.4","TCP","1434","49253  >  443 [ACK] Seq=81002 Ack=837 Win=998 Len=1368 TSval=465626 TSecr=372491730 [TCP segment of a reassembled PDU]"
"132","2018-08-07 17:43:37.830744","192.168.2.3","216.58.197.4","TLSv1.2","212","Application Data"
"133","2018-08-07 17:43:37.830745","192.168.2.3","216.58.197.4","TLSv1.2","1415","Application Data"
"136","2018-08-07 17:43:37.948123","192.168.2.3","216.58.197.4","TCP","1434","49253  >  443 [ACK] Seq=83865 Ack=837 Win=998 Len=1368 TSval=465638 TSecr=372491795 [TCP segment of a reassembled PDU]"
"137","2018-08-07 17:43:37.948602","192.168.2.3","216.58.197.4","TCP","1434","49253  >  443 [ACK] Seq=85233 Ack=837 Win=998 Len=1368 TSval=465638 TSecr=372491795 [TCP segment of a reassembled PDU]"
"138","2018-08-07 17:43:37.948604","192.168.2.3","216.58.197.4","TLSv1.2","212","Application Data"
"139","2018-08-07 17:43:37.948939","192.168.2.3","216.58.197.4","TCP","1434","49253  >  443 [ACK] Seq=86747 Ack=837 Win=998 Len=1368 TSval=465638 TSecr=372491795 [TCP segment of a reassembled PDU]"
"140","2018-08-07 17:43:37.948941","192.168.2.3","216.58.197.4","TLSv1.2","100","Application Data"
"144","2018-08-07 17:43:38.051919","192.168.2.3","216.58.197.4","TCP","1434","49253  >  443 [ACK] Seq=88149 Ack=837 Win=998 Len=1368 TSval=465648 TSecr=372491953 [TCP segment of a reassembled PDU]"
"145","2018-08-07 17:43:38.051923","192.168.2.3","216.58.197.4","TCP","1434","49253  >  443 [ACK] Seq=89517 Ack=837 Win=998 Len=1368 TSval=465648 TSecr=372491953 [TCP segment of a reassembled PDU]"
"146","2018-08-07 17:43:38.051989","192.168.2.3","216.58.197.4","TLSv1.2","212","Application Data"
"147","2018-08-07 17:43:38.052380","192.168.2.3","216.58.197.4","TLSv1.2","1356","Application Data"
"151","2018-08-07 17:43:38.151022","192.168.2.3","216.58.197.4","TCP","1434","49253  >  443 [ACK] Seq=92321 Ack=837 Win=998 Len=1368 TSval=465658 TSecr=372492016 [TCP segment of a reassembled PDU]"
"152","2018-08-07 17:43:38.151224","192.168.2.3","216.58.197.4","TCP","1434","49253  >  443 [ACK] Seq=93689 Ack=837 Win=998 Len=1368 TSval=465658 TSecr=372492016 [TCP segment of a reassembled PDU]"
"153","2018-08-07 17:43:38.151226","192.168.2.3","216.58.197.4","TLSv1.2","212","Application Data"
"154","2018-08-07 17:43:38.151518","192.168.2.3","216.58.197.4","TLSv1.2","1176","Application Data"
"158","2018-08-07 17:43:38.242369","192.168.2.3","216.58.197.4","TCP","1434","49253  >  443 [ACK] Seq=96313 Ack=837 Win=998 Len=1368 TSval=465668 TSecr=372492115 [TCP segment of a reassembled PDU]"
"159","2018-08-07 17:43:38.242666","192.168.2.3","216.58.197.4","TCP","1434","49253  >  443 [ACK] Seq=97681 Ack=837 Win=998 Len=1368 TSval=465668 TSecr=372492115 [TCP segment of a reassembled PDU]"
"160","2018-08-07 17:43:38.242668","192.168.2.3","216.58.197.4","TLSv1.2","212","Application Data"
"161","2018-08-07 17:43:38.242914","192.168.2.3","216.58.197.4","TCP","1434","49253  >  443 [ACK] Seq=99195 Ack=837 Win=998 Len=1368 TSval=465668 TSecr=372492115 [TCP segment of a reassembled PDU]"
"162","2018-08-07 17:43:38.242915","192.168.2.3","216.58.197.4","TLSv1.2","155","Application Data"
"166","2018-08-07 17:43:38.333140","192.168.2.3","216.58.197.4","TCP","1434","49253  >  443 [ACK] Seq=100652 Ack=837 Win=998 Len=1368 TSval=465677 TSecr=372492207 [TCP segment of a reassembled PDU]"
"167","2018-08-07 17:43:38.333292","192.168.2.3","216.58.197.4","TCP","1434","49253  >  443 [ACK] Seq=102020 Ack=837 Win=998 Len=1368 TSval=465677 TSecr=372492207 [TCP segment of a reassembled PDU]"
"168","2018-08-07 17:43:38.333294","192.168.2.3","216.58.197.4","TLSv1.2","212","Application Data"
"169","2018-08-07 17:43:38.333626","192.168.2.3","216.58.197.4","TCP","1434","49253  >  443 [ACK] Seq=103534 Ack=837 Win=998 Len=1368 TSval=465677 TSecr=372492207 [TCP segment of a reassembled PDU]"
"170","2018-08-07 17:43:38.333628","192.168.2.3","216.58.197.4","TLSv1.2","155","Application Data"
"173","2018-08-07 17:43:38.427133","192.168.2.3","216.58.197.4","TCP","1434","49253  >  443 [ACK] Seq=104991 Ack=837 Win=998 Len=1368 TSval=465686 TSecr=372492298 [TCP segment of a reassembled PDU]"
"174","2018-08-07 17:43:38.427712","192.168.2.3","216.58.197.4","TCP","1434","49253  >  443 [ACK] Seq=106359 Ack=837 Win=998 Len=1368 TSval=465686 TSecr=372492298 [TCP segment of a reassembled PDU]"
"175","2018-08-07 17:43:38.427714","192.168.2.3","216.58.197.4","TLSv1.2","212","Application Data"
"176","2018-08-07 17:43:38.427715","192.168.2.3","216.58.197.4","TCP","1434","49253  >  443 [ACK] Seq=107873 Ack=837 Win=998 Len=1368 TSval=465686 TSecr=372492298 [TCP segment of a reassembled PDU]"
"177","2018-08-07 17:43:38.427716","192.168.2.3","216.58.197.4","TLSv1.2","155","Application Data"
"181","2018-08-07 17:43:38.451529","192.168.2.3","216.58.197.4","TCP","66","49253  >  443 [ACK] Seq=109330 Ack=896 Win=998 Len=0 TSval=465688 TSecr=372492410"
"183","2018-08-07 17:43:38.472548","192.168.2.3","216.58.197.4","TCP","66","49253  >  443 [ACK] Seq=109330 Ack=1064 Win=998 Len=0 TSval=465691 TSecr=372492431"
"184","2018-08-07 17:43:38.525321","192.168.2.3","216.58.197.4","TCP","1434","49253  >  443 [ACK] Seq=109330 Ack=1064 Win=998 Len=1368 TSval=465696 TSecr=372492431 [TCP segment of a reassembled PDU]"
"185","2018-08-07 17:43:38.525324","192.168.2.3","216.58.197.4","TCP","1434","49253  >  443 [ACK] Seq=110698 Ack=1064 Win=998 Len=1368 TSval=465696 TSecr=372492431 [TCP segment of a reassembled PDU]"
"186","2018-08-07 17:43:38.525325","192.168.2.3","216.58.197.4","TLSv1.2","212","Application Data"
"187","2018-08-07 17:43:38.525630","192.168.2.3","216.58.197.4","TCP","1434","49253  >  443 [ACK] Seq=112212 Ack=1064 Win=998 Len=1368 TSval=465696 TSecr=372492431 [TCP segment of a reassembled PDU]"
"188","2018-08-07 17:43:38.525631","192.168.2.3","216.58.197.4","TLSv1.2","155","Application Data"
"194","2018-08-07 17:43:38.595175","192.168.2.3","216.58.197.4","TCP","66","49253  >  443 [ACK] Seq=113669 Ack=1238 Win=998 Len=0 TSval=465703 TSecr=372492551"
"195","2018-08-07 17:43:38.595417","192.168.2.3","216.58.197.4","TCP","66","49253  >  443 [ACK] Seq=113669 Ack=1523 Win=998 Len=0 TSval=465703 TSecr=372492551"
"196","2018-08-07 17:43:38.623233","192.168.2.3","216.58.197.4","TCP","1434","49253  >  443 [ACK] Seq=113669 Ack=1523 Win=998 Len=1368 TSval=465706 TSecr=372492551 [TCP segment of a reassembled PDU]"
"197","2018-08-07 17:43:38.623469","192.168.2.3","216.58.197.4","TCP","1434","49253  >  443 [ACK] Seq=115037 Ack=1523 Win=998 Len=1368 TSval=465706 TSecr=372492551 [TCP segment of a reassembled PDU]"
"198","2018-08-07 17:43:38.623471","192.168.2.3","216.58.197.4","TLSv1.2","212","Application Data"
"199","2018-08-07 17:43:38.623947","192.168.2.3","216.58.197.4","TCP","1434","49253  >  443 [ACK] Seq=116551 Ack=1523 Win=998 Len=1368 TSval=465706 TSecr=372492551 [TCP segment of a reassembled PDU]"
"200","2018-08-07 17:43:38.623950","192.168.2.3","216.58.197.4","TLSv1.2","155","Application Data"
"204","2018-08-07 17:43:38.688182","192.168.2.3","216.58.197.4","TCP","66","49253  >  443 [ACK] Seq=118008 Ack=1983 Win=998 Len=0 TSval=465712 TSecr=372492640"
"205","2018-08-07 17:43:38.690326","192.168.2.3","216.58.197.4","TCP","1434","49253  >  443 [ACK] Seq=118008 Ack=1983 Win=998 Len=1368 TSval=465712 TSecr=372492640 [TCP segment of a reassembled PDU]"
"206","2018-08-07 17:43:38.690774","192.168.2.3","216.58.197.4","TCP","1434","49253  >  443 [ACK] Seq=119376 Ack=1983 Win=998 Len=1368 TSval=465712 TSecr=372492640 [TCP segment of a reassembled PDU]"
"207","2018-08-07 17:43:38.690776","192.168.2.3","216.58.197.4","TLSv1.2","212","Application Data"
"208","2018-08-07 17:43:38.691126","192.168.2.3","216.58.197.4","TCP","1434","49253  >  443 [ACK] Seq=120890 Ack=1983 Win=998 Len=1368 TSval=465712 TSecr=372492640 [TCP segment of a reassembled PDU]"
"209","2018-08-07 17:43:38.691128","192.168.2.3","216.58.197.4","TLSv1.2","155","Application Data"
"213","2018-08-07 17:43:38.792643","192.168.2.3","216.58.197.4","TCP","1434","49253  >  443 [ACK] Seq=122347 Ack=1983 Win=998 Len=1368 TSval=465722 TSecr=372492655 [TCP segment of a reassembled PDU]"
"214","2018-08-07 17:43:38.792647","192.168.2.3","216.58.197.4","TCP","1434","49253  >  443 [ACK] Seq=123715 Ack=1983 Win=998 Len=1368 TSval=465722 TSecr=372492655 [TCP segment of a reassembled PDU]"
"215","2018-08-07 17:43:38.792648","192.168.2.3","216.58.197.4","TLSv1.2","212","Application Data"
"216","2018-08-07 17:43:38.792807","192.168.2.3","216.58.197.4","TCP","1434","49253  >  443 [ACK] Seq=125229 Ack=1983 Win=998 Len=1368 TSval=465722 TSecr=372492655 [TCP segment of a reassembled PDU]"
"217","2018-08-07 17:43:38.793054","192.168.2.3","216.58.197.4","TLSv1.2","155","Application Data"
"223","2018-08-07 17:43:38.855515","192.168.2.3","216.58.197.4","TCP","66","49253  >  443 [ACK] Seq=126686 Ack=2453 Win=998 Len=0 TSval=465729 TSecr=372492799"
"224","2018-08-07 17:43:38.910587","192.168.2.3","216.58.197.4","TCP","1434","49253  >  443 [ACK] Seq=126686 Ack=2453 Win=998 Len=1368 TSval=465734 TSecr=372492799 [TCP segment of a reassembled PDU]"
"225","2018-08-07 17:43:38.910597","192.168.2.3","216.58.197.4","TCP","1434","49253  >  443 [ACK] Seq=128054 Ack=2453 Win=998 Len=1368 TSval=465734 TSecr=372492799 [TCP segment of a reassembled PDU]"
"226","2018-08-07 17:43:38.910709","192.168.2.3","216.58.197.4","TLSv1.2","212","Application Data"
"227","2018-08-07 17:43:38.910939","192.168.2.3","216.58.197.4","TLSv1.2","1282","Application Data"
"231","2018-08-07 17:43:39.011598","192.168.2.3","216.58.197.4","TCP","1434","49253  >  443 [ACK] Seq=130784 Ack=2453 Win=998 Len=1368 TSval=465744 TSecr=372492875 [TCP segment of a reassembled PDU]"
"232","2018-08-07 17:43:39.011738","192.168.2.3","216.58.197.4","TCP","1434","49253  >  443 [ACK] Seq=132152 Ack=2453 Win=998 Len=1368 TSval=465744 TSecr=372492875 [TCP segment of a reassembled PDU]"
"233","2018-08-07 17:43:39.011740","192.168.2.3","216.58.197.4","TLSv1.2","212","Application Data"
"234","2018-08-07 17:43:39.012002","192.168.2.3","216.58.197.4","TCP","1434","49253  >  443 [ACK] Seq=133666 Ack=2453 Win=998 Len=1368 TSval=465744 TSecr=372492875 [TCP segment of a reassembled PDU]"
"235","2018-08-07 17:43:39.012004","192.168.2.3","216.58.197.4","TLSv1.2","155","Application Data"
"241","2018-08-07 17:43:39.074724","192.168.2.3","216.58.197.4","TCP","66","49253  >  443 [ACK] Seq=135123 Ack=2767 Win=998 Len=0 TSval=465751 TSecr=372493031"
"242","2018-08-07 17:43:39.110895","192.168.2.3","216.58.197.4","TCP","1434","49253  >  443 [ACK] Seq=135123 Ack=2767 Win=998 Len=1368 TSval=465754 TSecr=372493031 [TCP segment of a reassembled PDU]"
"243","2018-08-07 17:43:39.114642","192.168.2.3","216.58.197.4","TCP","1434","49253  >  443 [ACK] Seq=136491 Ack=2767 Win=998 Len=1368 TSval=465754 TSecr=372493031 [TCP segment of a reassembled PDU]"
"244","2018-08-07 17:43:39.114644","192.168.2.3","216.58.197.4","TLSv1.2","212","Application Data"
"245","2018-08-07 17:43:39.115080","192.168.2.3","216.58.197.4","TCP","1434","49253  >  443 [ACK] Seq=138005 Ack=2767 Win=998 Len=1368 TSval=465754 TSecr=372493031 [TCP segment of a reassembled PDU]"
"246","2018-08-07 17:43:39.115083","192.168.2.3","216.58.197.4","TLSv1.2","155","Application Data"
"250","2018-08-07 17:43:39.229239","192.168.2.3","216.58.197.4","TCP","1434","49253  >  443 [ACK] Seq=139462 Ack=2767 Win=998 Len=1368 TSval=465766 TSecr=372493079 [TCP segment of a reassembled PDU]"
"251","2018-08-07 17:43:39.229679","192.168.2.3","216.58.197.4","TCP","1434","49253  >  443 [ACK] Seq=140830 Ack=2767 Win=998 Len=1368 TSval=465766 TSecr=372493079 [TCP segment of a reassembled PDU]"
"252","2018-08-07 17:43:39.229682","192.168.2.3","216.58.197.4","TLSv1.2","212","Application Data"
"253","2018-08-07 17:43:39.229683","192.168.2.3","216.58.197.4","TCP","1434","49253  >  443 [ACK] Seq=142344 Ack=2767 Win=998 Len=1368 TSval=465766 TSecr=372493079 [TCP segment of a reassembled PDU]"
"254","2018-08-07 17:43:39.229861","192.168.2.3","216.58.197.4","TLSv1.2","155","Application Data"
"260","2018-08-07 17:43:39.279207","192.168.2.3","216.58.197.4","TCP","66","49253  >  443 [ACK] Seq=143801 Ack=3314 Win=998 Len=0 TSval=465771 TSecr=372493234"
"261","2018-08-07 17:43:39.298607","192.168.2.3","216.58.197.4","TCP","1434","49253  >  443 [ACK] Seq=143801 Ack=3314 Win=998 Len=1368 TSval=465773 TSecr=372493234 [TCP segment of a reassembled PDU]"
"262","2018-08-07 17:43:39.298612","192.168.2.3","216.58.197.4","TCP","1434","49253  >  443 [ACK] Seq=145169 Ack=3314 Win=998 Len=1368 TSval=465773 TSecr=372493234 [TCP segment of a reassembled PDU]"
"263","2018-08-07 17:43:39.298613","192.168.2.3","216.58.197.4","TLSv1.2","212","Application Data"
"264","2018-08-07 17:43:39.298801","192.168.2.3","216.58.197.4","TCP","1434","49253  >  443 [ACK] Seq=146683 Ack=3314 Win=998 Len=1368 TSval=465773 TSecr=372493234 [TCP segment of a reassembled PDU]"
"265","2018-08-07 17:43:39.298804","192.168.2.3","216.58.197.4","TLSv1.2","155","Application Data"
"271","2018-08-07 17:43:39.356914","192.168.2.3","216.58.197.4","TCP","66","49253  >  443 [ACK] Seq=148140 Ack=3720 Win=998 Len=0 TSval=465779 TSecr=372493315"
"272","2018-08-07 17:43:39.394240","192.168.2.3","216.58.197.4","TCP","1434","49253  >  443 [ACK] Seq=148140 Ack=3720 Win=998 Len=1368 TSval=465783 TSecr=372493315 [TCP segment of a reassembled PDU]"
"273","2018-08-07 17:43:39.394639","192.168.2.3","216.58.197.4","TCP","1434","49253  >  443 [ACK] Seq=149508 Ack=3720 Win=998 Len=1368 TSval=465783 TSecr=372493315 [TCP segment of a reassembled PDU]"
"274","2018-08-07 17:43:39.394641","192.168.2.3","216.58.197.4","TLSv1.2","212","Application Data"
"275","2018-08-07 17:43:39.395044","192.168.2.3","216.58.197.4","TCP","1434","49253  >  443 [ACK] Seq=151022 Ack=3720 Win=998 Len=1368 TSval=465783 TSecr=372493315 [TCP segment of a reassembled PDU]"
"276","2018-08-07 17:43:39.395046","192.168.2.3","216.58.197.4","TLSv1.2","155","Application Data"
"282","2018-08-07 17:43:39.472953","192.168.2.3","216.58.197.4","TCP","66","49253  >  443 [ACK] Seq=152479 Ack=4047 Win=998 Len=0 TSval=465791 TSecr=372493411"
"283","2018-08-07 17:43:39.483117","192.168.2.3","216.58.197.4","TCP","1434","49253  >  443 [ACK] Seq=152479 Ack=4047 Win=998 Len=1368 TSval=465792 TSecr=372493411 [TCP segment of a reassembled PDU]"
"284","2018-08-07 17:43:39.483484","192.168.2.3","216.58.197.4","TCP","1434","49253  >  443 [ACK] Seq=153847 Ack=4047 Win=998 Len=1368 TSval=465792 TSecr=372493411 [TCP segment of a reassembled PDU]"
"285","2018-08-07 17:43:39.483487","192.168.2.3","216.58.197.4","TLSv1.2","212","Application Data"
"286","2018-08-07 17:43:39.483488","192.168.2.3","216.58.197.4","TCP","1434","49253  >  443 [ACK] Seq=155361 Ack=4047 Win=998 Len=1368 TSval=465792 TSecr=372493411 [TCP segment of a reassembled PDU]"
"287","2018-08-07 17:43:39.483489","192.168.2.3","216.58.197.4","TLSv1.2","155","Application Data"
"293","2018-08-07 17:43:39.549342","192.168.2.3","216.58.197.4","TCP","66","49253  >  443 [ACK] Seq=156818 Ack=4444 Win=998 Len=0 TSval=465798 TSecr=372493505"
"294","2018-08-07 17:43:39.586624","192.168.2.3","216.58.197.4","TCP","1434","49253  >  443 [ACK] Seq=156818 Ack=4444 Win=998 Len=1368 TSval=465802 TSecr=372493505 [TCP segment of a reassembled PDU]"
"295","2018-08-07 17:43:39.587082","192.168.2.3","216.58.197.4","TCP","1434","49253  >  443 [ACK] Seq=158186 Ack=4444 Win=998 Len=1368 TSval=465802 TSecr=372493505 [TCP segment of a reassembled PDU]"
"296","2018-08-07 17:43:39.587084","192.168.2.3","216.58.197.4","TLSv1.2","212","Application Data"
"297","2018-08-07 17:43:39.587086","192.168.2.3","216.58.197.4","TLSv1.2","932","Application Data"
"299","2018-08-07 17:43:39.682188","192.168.2.3","216.58.197.4","TCP","1434","49253  >  443 [ACK] Seq=160566 Ack=4444 Win=998 Len=1368 TSval=465811 TSecr=372493551 [TCP segment of a reassembled PDU]"
"300","2018-08-07 17:43:39.682487","192.168.2.3","216.58.197.4","TCP","1434","49253  >  443 [ACK] Seq=161934 Ack=4444 Win=998 Len=1368 TSval=465812 TSecr=372493551 [TCP segment of a reassembled PDU]"
"301","2018-08-07 17:43:39.682489","192.168.2.3","216.58.197.4","TLSv1.2","212","Application Data"
"302","2018-08-07 17:43:39.682929","192.168.2.3","216.58.197.4","TCP","1434","49253  >  443 [ACK] Seq=163448 Ack=4444 Win=998 Len=1368 TSval=465812 TSecr=372493551 [TCP segment of a reassembled PDU]"
"303","2018-08-07 17:43:39.682932","192.168.2.3","216.58.197.4","TLSv1.2","155","Application Data"
"309","2018-08-07 17:43:39.739652","192.168.2.3","216.58.197.4","TCP","66","49253  >  443 [ACK] Seq=164905 Ack=4771 Win=998 Len=0 TSval=465817 TSecr=372493697"
"310","2018-08-07 17:43:39.806168","192.168.2.3","216.58.197.4","TCP","1434","49253  >  443 [ACK] Seq=164905 Ack=4771 Win=998 Len=1368 TSval=465824 TSecr=372493697 [TCP segment of a reassembled PDU]"
"311","2018-08-07 17:43:39.806598","192.168.2.3","216.58.197.4","TCP","1434","49253  >  443 [ACK] Seq=166273 Ack=4771 Win=998 Len=1368 TSval=465824 TSecr=372493697 [TCP segment of a reassembled PDU]"
"312","2018-08-07 17:43:39.806601","192.168.2.3","216.58.197.4","TLSv1.2","212","Application Data"
"313","2018-08-07 17:43:39.806602","192.168.2.3","216.58.197.4","TCP","1434","49253  >  443 [ACK] Seq=167787 Ack=4771 Win=998 Len=1368 TSval=465824 TSecr=372493697 [TCP segment of a reassembled PDU]"
"314","2018-08-07 17:43:39.806603","192.168.2.3","216.58.197.4","TLSv1.2","155","Application Data"
"317","2018-08-07 17:43:39.906343","192.168.2.3","216.58.197.4","TCP","1434","49253  >  443 [ACK] Seq=169244 Ack=4771 Win=998 Len=1368 TSval=465834 TSecr=372493771 [TCP segment of a reassembled PDU]"
"318","2018-08-07 17:43:39.906840","192.168.2.3","216.58.197.4","TCP","1434","49253  >  443 [ACK] Seq=170612 Ack=4771 Win=998 Len=1368 TSval=465834 TSecr=372493771 [TCP segment of a reassembled PDU]"
"319","2018-08-07 17:43:39.906843","192.168.2.3","216.58.197.4","TLSv1.2","212","Application Data"
"320","2018-08-07 17:43:39.906844","192.168.2.3","216.58.197.4","TLSv1.2","1248","Application Data"
"324","2018-08-07 17:43:39.961945","192.168.2.3","172.217.27.174","TCP","66","52264  >  443 [ACK] Seq=1 Ack=1 Win=661 Len=0 TSval=465840 TSecr=2421990157"
"326","2018-08-07 17:43:39.996954","192.168.2.3","203.211.199.120","TLSv1.2","787","Application Data"
"332","2018-08-07 17:43:40.022006","192.168.2.3","203.211.199.120","TCP","66","42858  >  443 [ACK] Seq=1443 Ack=10307 Win=1004 Len=0 TSval=465846 TSecr=4163819134"
"333","2018-08-07 17:43:40.028761","192.168.2.3","216.58.197.4","TCP","1434","49253  >  443 [ACK] Seq=173308 Ack=4908 Win=998 Len=1368 TSval=465846 TSecr=372493965 [TCP segment of a reassembled PDU]"
"334","2018-08-07 17:43:40.028764","192.168.2.3","216.58.197.4","TCP","1434","49253  >  443 [ACK] Seq=174676 Ack=4908 Win=998 Len=1368 TSval=465846 TSecr=372493965 [TCP segment of a reassembled PDU]"
"335","2018-08-07 17:43:40.028950","192.168.2.3","216.58.197.4","TLSv1.2","212","Application Data"
"336","2018-08-07 17:43:40.028952","192.168.2.3","216.58.197.4","TLSv1.2","831","Application Data"
"340","2018-08-07 17:43:40.130822","192.168.2.3","216.58.197.4","TCP","1434","49253  >  443 [ACK] Seq=176955 Ack=4908 Win=998 Len=1368 TSval=465856 TSecr=372493993 [TCP segment of a reassembled PDU]"
"341","2018-08-07 17:43:40.130825","192.168.2.3","216.58.197.4","TCP","1434","49253  >  443 [ACK] Seq=178323 Ack=4908 Win=998 Len=1368 TSval=465856 TSecr=372493993 [TCP segment of a reassembled PDU]"
"342","2018-08-07 17:43:40.130826","192.168.2.3","216.58.197.4","TLSv1.2","212","Application Data"
"343","2018-08-07 17:43:40.131093","192.168.2.3","216.58.197.4","TLSv1.2","1131","Application Data"
"349","2018-08-07 17:43:40.188974","192.168.2.3","216.58.197.4","TCP","66","49253  >  443 [ACK] Seq=180902 Ack=5226 Win=998 Len=0 TSval=465862 TSecr=372494147"
"350","2018-08-07 17:43:40.233045","192.168.2.3","216.58.197.4","TCP","1434","49253  >  443 [ACK] Seq=180902 Ack=5226 Win=998 Len=1368 TSval=465866 TSecr=372494147 [TCP segment of a reassembled PDU]"
"351","2018-08-07 17:43:40.233304","192.168.2.3","216.58.197.4","TCP","1434","49253  >  443 [ACK] Seq=182270 Ack=5226 Win=998 Len=1368 TSval=465866 TSecr=372494147 [TCP segment of a reassembled PDU]"
"352","2018-08-07 17:43:40.233306","192.168.2.3","216.58.197.4","TLSv1.2","212","Application Data"
"353","2018-08-07 17:43:40.233307","192.168.2.3","216.58.197.4","TLSv1.2","744","Application Data"
"357","2018-08-07 17:43:40.346222","192.168.2.3","216.58.197.4","TCP","1434","49253  >  443 [ACK] Seq=184462 Ack=5226 Win=998 Len=1368 TSval=465878 TSecr=372494198 [TCP segment of a reassembled PDU]"
"358","2018-08-07 17:43:40.346649","192.168.2.3","216.58.197.4","TCP","1434","49253  >  443 [ACK] Seq=185830 Ack=5226 Win=998 Len=1368 TSval=465878 TSecr=372494198 [TCP segment of a reassembled PDU]"
"359","2018-08-07 17:43:40.346651","192.168.2.3","216.58.197.4","TLSv1.2","212","Application Data"
"360","2018-08-07 17:43:40.346652","192.168.2.3","216.58.197.4","TLSv1.2","524","Application Data"
"365","2018-08-07 17:43:40.401116","192.168.2.3","216.58.197.4","TCP","66","49253  >  443 [ACK] Seq=187802 Ack=5573 Win=998 Len=0 TSval=465883 TSecr=372494359"
"366","2018-08-07 17:43:40.450682","192.168.2.3","216.58.197.4","TCP","1434","49253  >  443 [ACK] Seq=187802 Ack=5573 Win=998 Len=1368 TSval=465888 TSecr=372494359 [TCP segment of a reassembled PDU]"
"367","2018-08-07 17:43:40.450831","192.168.2.3","216.58.197.4","TCP","1434","49253  >  443 [ACK] Seq=189170 Ack=5573 Win=998 Len=1368 TSval=465888 TSecr=372494359 [TCP segment of a reassembled PDU]"
"368","2018-08-07 17:43:40.450832","192.168.2.3","216.58.197.4","TLSv1.2","212","Application Data"
"369","2018-08-07 17:43:40.450833","192.168.2.3","216.58.197.4","TLSv1.2","809","Application Data"
"374","2018-08-07 17:43:40.475525","192.168.2.3","216.58.197.4","TCP","66","49253  >  443 [ACK] Seq=191427 Ack=6022 Win=998 Len=0 TSval=465891 TSecr=372494410"
"375","2018-08-07 17:43:40.550716","192.168.2.3","216.58.197.4","TCP","1434","49253  >  443 [ACK] Seq=191427 Ack=6022 Win=998 Len=1368 TSval=465898 TSecr=372494410 [TCP segment of a reassembled PDU]"
"376","2018-08-07 17:43:40.551063","192.168.2.3","216.58.197.4","TCP","1434","49253  >  443 [ACK] Seq=192795 Ack=6022 Win=998 Len=1368 TSval=465898 TSecr=372494410 [TCP segment of a reassembled PDU]"
"377","2018-08-07 17:43:40.551065","192.168.2.3","216.58.197.4","TLSv1.2","212","Application Data"
"378","2018-08-07 17:43:40.551066","192.168.2.3","216.58.197.4","TLSv1.2","528","Application Data"
"383","2018-08-07 17:43:40.600049","192.168.2.3","216.58.197.4","TCP","66","49253  >  443 [ACK] Seq=194771 Ack=6391 Win=998 Len=0 TSval=465903 TSecr=372494557"
"386","2018-08-07 17:43:40.659426","192.168.2.3","216.58.197.4","TCP","1434","49253  >  443 [ACK] Seq=194771 Ack=6391 Win=998 Len=1368 TSval=465909 TSecr=372494557 [TCP segment of a reassembled PDU]"
"387","2018-08-07 17:43:40.659429","192.168.2.3","216.58.197.4","TCP","1434","49253  >  443 [ACK] Seq=196139 Ack=6391 Win=998 Len=1368 TSval=465909 TSecr=372494557 [TCP segment of a reassembled PDU]"
"388","2018-08-07 17:43:40.659618","192.168.2.3","216.58.197.4","TLSv1.2","212","Application Data"
"389","2018-08-07 17:43:40.659620","192.168.2.3","216.58.197.4","TLSv1.2","905","Application Data"
"390","2018-08-07 17:43:40.659756","192.168.2.3","216.58.197.4","TLSv1.2","102","Application Data"
"391","2018-08-07 17:43:40.660184","192.168.2.3","216.58.197.4","TCP","66","49253  >  443 [ACK] Seq=198528 Ack=7081 Win=998 Len=0 TSval=465909 TSecr=372494593"
"393","2018-08-07 17:43:40.663399","192.168.2.3","216.58.197.4","TCP","78","[TCP Dup ACK 391#1] 49253  >  443 [ACK] Seq=198528 Ack=7081 Win=998 Len=0 TSval=465910 TSecr=372494622 SLE=6793 SRE=7081"
"397","2018-08-07 17:43:40.855012","192.168.2.3","216.58.197.4","TCP","66","49253  >  443 [ACK] Seq=198528 Ack=7187 Win=998 Len=0 TSval=465929 TSecr=372494810"
"399","2018-08-07 17:43:40.887209","192.168.2.3","216.58.197.4","TCP","66","49253  >  443 [ACK] Seq=198528 Ack=8597 Win=982 Len=0 TSval=465932 TSecr=372494843"
"406","2018-08-07 17:43:41.202375","192.168.2.3","216.58.197.4","TCP","66","49253  >  443 [ACK] Seq=198528 Ack=10015 Win=982 Len=0 TSval=465963 TSecr=372495160"
"407","2018-08-07 17:43:41.202379","192.168.2.3","216.58.197.4","TCP","66","49253  >  443 [ACK] Seq=198528 Ack=10479 Win=998 Len=0 TSval=465964 TSecr=372495160"
"410","2018-08-07 17:43:41.202549","192.168.2.3","216.58.197.4","TCP","66","49253  >  443 [ACK] Seq=198528 Ack=11897 Win=982 Len=0 TSval=465964 TSecr=372495160"
"411","2018-08-07 17:43:41.203319","192.168.2.3","216.58.197.4","TCP","66","49253  >  443 [ACK] Seq=198528 Ack=12223 Win=982 Len=0 TSval=465964 TSecr=372495160"
"412","2018-08-07 17:43:41.203321","192.168.2.3","216.58.197.4","TCP","66","49253  >  443 [ACK] Seq=198528 Ack=13641 Win=982 Len=0 TSval=465964 TSecr=372495160"
"413","2018-08-07 17:43:41.203321","192.168.2.3","216.58.197.4","TCP","66","49253  >  443 [ACK] Seq=198528 Ack=14134 Win=975 Len=0 TSval=465964 TSecr=372495160"
"431","2018-08-07 17:43:41.210707","192.168.2.3","216.58.197.4","TCP","66","49253  >  443 [ACK] Seq=198528 Ack=15552 Win=953 Len=0 TSval=465964 TSecr=372495162"
"432","2018-08-07 17:43:41.210709","192.168.2.3","216.58.197.4","TCP","66","49253  >  443 [ACK] Seq=198528 Ack=16052 Win=946 Len=0 TSval=465964 TSecr=372495162"
"433","2018-08-07 17:43:41.210710","192.168.2.3","216.58.197.4","TCP","66","49253  >  443 [ACK] Seq=198528 Ack=17470 Win=931 Len=0 TSval=465964 TSecr=372495163"
"434","2018-08-07 17:43:41.210711","192.168.2.3","216.58.197.4","TCP","66","49253  >  443 [ACK] Seq=198528 Ack=17734 Win=927 Len=0 TSval=465964 TSecr=372495163"
"441","2018-08-07 17:43:41.216554","192.168.2.3","216.58.197.4","TCP","66","49253  >  443 [ACK] Seq=198528 Ack=19152 Win=982 Len=0 TSval=465965 TSecr=372495165"
"442","2018-08-07 17:43:41.216572","192.168.2.3","216.58.197.4","TCP","66","49253  >  443 [ACK] Seq=198528 Ack=19414 Win=998 Len=0 TSval=465965 TSecr=372495165"
"443","2018-08-07 17:43:41.216573","192.168.2.3","216.58.197.4","TCP","66","49253  >  443 [ACK] Seq=198528 Ack=20832 Win=982 Len=0 TSval=465965 TSecr=372495165"
"444","2018-08-07 17:43:41.216574","192.168.2.3","216.58.197.4","TCP","66","49253  >  443 [ACK] Seq=198528 Ack=21312 Win=982 Len=0 TSval=465965 TSecr=372495165"
"445","2018-08-07 17:43:41.216574","192.168.2.3","216.58.197.4","TCP","66","49253  >  443 [ACK] Seq=198528 Ack=23136 Win=976 Len=0 TSval=465965 TSecr=372495166"
"446","2018-08-07 17:43:41.217660","192.168.2.3","216.58.197.4","TCP","66","49253  >  443 [ACK] Seq=198528 Ack=37425 Win=982 Len=0 TSval=465965 TSecr=372495168"
"463","2018-08-07 17:43:41.234724","192.168.2.3","216.58.197.4","TCP","66","49253  >  443 [ACK] Seq=198528 Ack=39143 Win=998 Len=0 TSval=465967 TSecr=372495191"
"475","2018-08-07 17:43:41.239111","192.168.2.3","216.58.197.4","TCP","66","49253  >  443 [ACK] Seq=198528 Ack=42694 Win=998 Len=0 TSval=465967 TSecr=372495191"
"476","2018-08-07 17:43:41.239400","192.168.2.3","216.58.197.4","TCP","66","49253  >  443 [ACK] Seq=198528 Ack=58551 Win=998 Len=0 TSval=465967 TSecr=372495192"
"477","2018-08-07 17:43:41.239872","192.168.2.3","216.58.197.4","TCP","66","49253  >  443 [ACK] Seq=198528 Ack=60706 Win=1097 Len=0 TSval=465967 TSecr=372495196"
"478","2018-08-07 17:43:41.240039","192.168.2.3","216.58.197.4","TCP","66","49253  >  443 [ACK] Seq=198528 Ack=61054 Win=1124 Len=0 TSval=465967 TSecr=372495196"
"479","2018-08-07 17:43:41.267770","192.168.2.3","216.58.197.4","TLSv1.2","104","Application Data"
"481","2018-08-07 17:43:41.722002","192.168.2.3","172.217.27.163","TCP","66","38971  >  443 [ACK] Seq=1 Ack=1 Win=406 Len=0 TSval=466016 TSecr=466725736"