"No.","Time","Source","Destination","Protocol","Length","Info"
"1","2018-08-07 18:06:18.597142","192.168.2.3","172.217.27.174","TCP","66","52258  >  443 [ACK] Seq=1 Ack=1 Win=661 Len=0 TSval=601702 TSecr=2576252150"
"5","2018-08-07 18:06:20.040915","192.168.2.3","172.217.27.174","TCP","66","52317  >  443 [FIN, ACK] Seq=1 Ack=57 Win=279 Len=0 TSval=601846 TSecr=3868877076"
"7","2018-08-07 18:06:23.336844","192.168.2.3","108.177.125.188","TCP","66","50384  >  5228 [ACK] Seq=1 Ack=1 Win=262 Len=0 TSval=602176 TSecr=2745349028"
"9","2018-08-07 18:06:24.772180","192.168.2.3","216.58.197.4","TLSv1.2","156","Application Data"
"10","2018-08-07 18:06:24.772184","192.168.2.3","216.58.197.4","TLSv1.2","104","Application Data"
"11","2018-08-07 18:06:24.772185","192.168.2.3","216.58.197.4","TLSv1.2","159","Application Data"
"16","2018-08-07 18:06:24.790494","192.168.2.3","216.58.197.4","TCP","1434","49253  >  443 [ACK] Seq=222 Ack=39 Win=1522 Len=1368 TSval=602321 TSecr=373858741 [TCP segment of a reassembled PDU]"
"17","2018-08-07 18:06:24.790727","192.168.2.3","216.58.197.4","TCP","1434","49253  >  443 [ACK] Seq=1590 Ack=39 Win=1522 Len=1368 TSval=602321 TSecr=373858741 [TCP segment of a reassembled PDU]"
"18","2018-08-07 18:06:24.790729","192.168.2.3","216.58.197.4","TLSv1.2","212","Application Data"
"19","2018-08-07 18:06:24.790729","192.168.2.3","216.58.197.4","TCP","1434","49253  >  443 [ACK] Seq=3104 Ack=39 Win=1522 Len=1368 TSval=602321 TSecr=373858741 [TCP segment of a reassembled PDU]"
"20","2018-08-07 18:06:24.790883","192.168.2.3","216.58.197.4","TLSv1.2","287","Application Data"
"21","2018-08-07 18:06:24.791104","192.168.2.3","216.58.197.4","TCP","1434","49253  >  443 [ACK] Seq=4693 Ack=39 Win=1522 Len=1368 TSval=602321 TSecr=373858741 [TCP segment of a reassembled PDU]"
"22","2018-08-07 18:06:24.791107","192.168.2.3","216.58.197.4","TCP","1434","49253  >  443 [ACK] Seq=6061 Ack=39 Win=1522 Len=1368 TSval=602321 TSecr=373858741 [TCP segment of a reassembled PDU]"
"23","2018-08-07 18:06:24.791108","192.168.2.3","216.58.197.4","TLSv1.2","212","Application Data"
"24","2018-08-07 18:06:24.791592","192.168.2.3","216.58.197.4","TCP","1434","49253  >  443 [ACK] Seq=7575 Ack=39 Win=1522 Len=1368 TSval=602321 TSecr=373858741 [TCP segment of a reassembled PDU]"
"25","2018-08-07 18:06:24.791921","192.168.2.3","216.58.197.4","TCP","1434","49253  >  443 [ACK] Seq=8943 Ack=39 Win=1522 Len=1368 TSval=602321 TSecr=373858741 [TCP segment of a reassembled PDU]"
"31","2018-08-07 18:06:24.796586","192.168.2.3","216.58.197.4","TLSv1.2","1434","Application Data [TCP segment of a reassembled PDU]"
"32","2018-08-07 18:06:24.799889","192.168.2.3","216.58.197.4","TCP","1434","49253  >  443 [ACK] Seq=11679 Ack=39 Win=1522 Len=1368 TSval=602321 TSecr=373858759 [TCP segment of a reassembled PDU]"
"33","2018-08-07 18:06:24.799892","192.168.2.3","216.58.197.4","TLSv1.2","1434","Application Data [TCP segment of a reassembled PDU]"
"34","2018-08-07 18:06:24.800214","192.168.2.3","216.58.197.4","TCP","1434","49253  >  443 [ACK] Seq=14415 Ack=39 Win=1522 Len=1368 TSval=602321 TSecr=373858759 [TCP segment of a reassembled PDU]"
"35","2018-08-07 18:06:24.800216","192.168.2.3","216.58.197.4","TLSv1.2","1434","Application Data [TCP segment of a reassembled PDU]"
"36","2018-08-07 18:06:24.800380","192.168.2.3","216.58.197.4","TCP","1434","49253  >  443 [ACK] Seq=17151 Ack=39 Win=1522 Len=1368 TSval=602321 TSecr=373858759 [TCP segment of a reassembled PDU]"
"37","2018-08-07 18:06:24.800642","192.168.2.3","216.58.197.4","TLSv1.2","1434","Application Data [TCP segment of a reassembled PDU]"
"38","2018-08-07 18:06:24.800937","192.168.2.3","216.58.197.4","TCP","1434","49253  >  443 [ACK] Seq=19887 Ack=39 Win=1522 Len=1368 TSval=602322 TSecr=373858759 [TCP segment of a reassembled PDU]"
"39","2018-08-07 18:06:24.800940","192.168.2.3","216.58.197.4","TLSv1.2","1434","Application Data, Application Data"
"40","2018-08-07 18:06:24.801077","192.168.2.3","216.58.197.4","TCP","1434","49253  >  443 [ACK] Seq=22623 Ack=39 Win=1522 Len=1368 TSval=602322 TSecr=373858759 [TCP segment of a reassembled PDU]"
"41","2018-08-07 18:06:24.801203","192.168.2.3","216.58.197.4","TLSv1.2","1434","Application Data [TCP segment of a reassembled PDU]"
"42","2018-08-07 18:06:24.801476","192.168.2.3","216.58.197.4","TLSv1.2","1434","Application Data [TCP segment of a reassembled PDU]"
"43","2018-08-07 18:06:24.801956","192.168.2.3","216.58.197.4","TCP","1434","49253  >  443 [ACK] Seq=26727 Ack=39 Win=1522 Len=1368 TSval=602322 TSecr=373858760 [TCP segment of a reassembled PDU]"
"44","2018-08-07 18:06:24.801958","192.168.2.3","216.58.197.4","TLSv1.2","1434","Application Data [TCP segment of a reassembled PDU]"
"45","2018-08-07 18:06:24.802326","192.168.2.3","216.58.197.4","TCP","1434","49253  >  443 [ACK] Seq=29463 Ack=39 Win=1522 Len=1368 TSval=602322 TSecr=373858760 [TCP segment of a reassembled PDU]"
"51","2018-08-07 18:06:24.805630","192.168.2.3","216.58.197.4","TLSv1.2","1434","Application Data [TCP segment of a reassembled PDU]"
"53","2018-08-07 18:06:24.806036","192.168.2.3","216.58.197.4","TCP","1434","49253  >  443 [ACK] Seq=32199 Ack=39 Win=1522 Len=1368 TSval=602322 TSecr=373858768 [TCP segment of a reassembled PDU]"
"54","2018-08-07 18:06:24.806039","192.168.2.3","216.58.197.4","TCP","1434","49253  >  443 [ACK] Seq=33567 Ack=39 Win=1522 Len=1368 TSval=602322 TSecr=373858768 [TCP segment of a reassembled PDU]"
"56","2018-08-07 18:06:24.806807","192.168.2.3","216.58.197.4","TLSv1.2","1434","Application Data [TCP segment of a reassembled PDU]"
"57","2018-08-07 18:06:24.807013","192.168.2.3","216.58.197.4","TCP","1434","49253  >  443 [ACK] Seq=36303 Ack=39 Win=1522 Len=1368 TSval=602322 TSecr=373858768 [TCP segment of a reassembled PDU]"
"58","2018-08-07 18:06:24.807158","192.168.2.3","216.58.197.4","TLSv1.2","1434","Application Data [TCP segment of a reassembled PDU]"
"59","2018-08-07 18:06:24.807830","192.168.2.3","216.58.197.4","TCP","1434","49253  >  443 [ACK] Seq=39039 Ack=39 Win=1522 Len=1368 TSval=602322 TSecr=373858768 [TCP segment of a reassembled PDU]"
"60","2018-08-07 18:06:24.808032","192.168.2.3","216.58.197.4","TLSv1.2","1434","Application Data [TCP segment of a reassembled PDU]"
"61","2018-08-07 18:06:24.808264","192.168.2.3","216.58.197.4","TLSv1.2","1434","Application Data [TCP segment of a reassembled PDU]"
"62","2018-08-07 18:06:24.808266","192.168.2.3","216.58.197.4","TCP","1434","49253  >  443 [ACK] Seq=43143 Ack=39 Win=1522 Len=1368 TSval=602323 TSecr=373858769 [TCP segment of a reassembled PDU]"
"63","2018-08-07 18:06:24.808716","192.168.2.3","216.58.197.4","TLSv1.2","1434","Application Data [TCP segment of a reassembled PDU]"
"64","2018-08-07 18:06:24.808881","192.168.2.3","216.58.197.4","TCP","1434","49253  >  443 [ACK] Seq=45879 Ack=39 Win=1522 Len=1368 TSval=602323 TSecr=373858769 [TCP segment of a reassembled PDU]"
"65","2018-08-07 18:06:24.809066","192.168.2.3","216.58.197.4","TCP","1434","49253  >  443 [ACK] Seq=47247 Ack=39 Win=1522 Len=1368 TSval=602323 TSecr=373858769 [TCP segment of a reassembled PDU]"
"66","2018-08-07 18:06:24.809346","192.168.2.3","216.58.197.4","TLSv1.2","1434","Application Data [TCP segment of a reassembled PDU]"
"70","2018-08-07 18:06:24.812310","192.168.2.3","216.58.197.4","TCP","1434","49253  >  443 [ACK] Seq=49983 Ack=39 Win=1522 Len=1368 TSval=602323 TSecr=373858770 [TCP segment of a reassembled PDU]"
"71","2018-08-07 18:06:24.812529","192.168.2.3","216.58.197.4","TLSv1.2","1434","Application Data [TCP segment of a reassembled PDU]"
"72","2018-08-07 18:06:24.812595","192.168.2.3","216.58.197.4","TCP","1434","49253  >  443 [ACK] Seq=52719 Ack=39 Win=1522 Len=1368 TSval=602323 TSecr=373858770 [TCP segment of a reassembled PDU]"
"76","2018-08-07 18:06:24.812954","192.168.2.3","216.58.197.4","TLSv1.2","1434","Application Data [TCP segment of a reassembled PDU]"
"78","2018-08-07 18:06:24.816777","192.168.2.3","216.58.197.4","TLSv1.2","68","Application Data"
"82","2018-08-07 18:06:24.843856","192.168.2.3","216.58.197.4","TCP","1434","49253  >  443 [ACK] Seq=55457 Ack=39 Win=1522 Len=1368 TSval=602326 TSecr=373858785 [TCP segment of a reassembled PDU]"
"83","2018-08-07 18:06:24.844161","192.168.2.3","216.58.197.4","TCP","1434","49253  >  443 [ACK] Seq=56825 Ack=39 Win=1522 Len=1368 TSval=602326 TSecr=373858785 [TCP segment of a reassembled PDU]"
"84","2018-08-07 18:06:24.844163","192.168.2.3","216.58.197.4","TLSv1.2","212","Application Data"
"85","2018-08-07 18:06:24.844947","192.168.2.3","216.58.197.4","TCP","1434","49253  >  443 [ACK] Seq=58339 Ack=39 Win=1522 Len=1368 TSval=602326 TSecr=373858785 [TCP segment of a reassembled PDU]"
"86","2018-08-07 18:06:24.844950","192.168.2.3","216.58.197.4","TLSv1.2","155","Application Data"
"89","2018-08-07 18:06:24.946979","192.168.2.3","216.58.197.4","TCP","1434","49253  >  443 [ACK] Seq=59796 Ack=39 Win=1522 Len=1368 TSval=602336 TSecr=373858813 [TCP segment of a reassembled PDU]"
"90","2018-08-07 18:06:24.949599","192.168.2.3","216.58.197.4","TCP","1434","49253  >  443 [ACK] Seq=61164 Ack=39 Win=1522 Len=1368 TSval=602337 TSecr=373858813 [TCP segment of a reassembled PDU]"
"91","2018-08-07 18:06:24.949602","192.168.2.3","216.58.197.4","TLSv1.2","212","Application Data"
"92","2018-08-07 18:06:24.949602","192.168.2.3","216.58.197.4","TLSv1.2","1058","Application Data"
"95","2018-08-07 18:06:25.048589","192.168.2.3","216.58.197.4","TCP","1434","49253  >  443 [ACK] Seq=63670 Ack=39 Win=1522 Len=1368 TSval=602347 TSecr=373858918 [TCP segment of a reassembled PDU]"
"96","2018-08-07 18:06:25.048958","192.168.2.3","216.58.197.4","TCP","1434","49253  >  443 [ACK] Seq=65038 Ack=39 Win=1522 Len=1368 TSval=602347 TSecr=373858918 [TCP segment of a reassembled PDU]"
"97","2018-08-07 18:06:25.048961","192.168.2.3","216.58.197.4","TLSv1.2","212","Application Data"
"98","2018-08-07 18:06:25.048962","192.168.2.3","216.58.197.4","TLSv1.2","1052","Application Data"
"101","2018-08-07 18:06:25.162909","192.168.2.3","216.58.197.4","TCP","1434","49253  >  443 [ACK] Seq=67538 Ack=39 Win=1522 Len=1368 TSval=602358 TSecr=373859017 [TCP segment of a reassembled PDU]"
"102","2018-08-07 18:06:25.163075","192.168.2.3","216.58.197.4","TCP","1434","49253  >  443 [ACK] Seq=68906 Ack=39 Win=1522 Len=1368 TSval=602358 TSecr=373859017 [TCP segment of a reassembled PDU]"
"103","2018-08-07 18:06:25.163076","192.168.2.3","216.58.197.4","TLSv1.2","212","Application Data"
"104","2018-08-07 18:06:25.163234","192.168.2.3","216.58.197.4","TLSv1.2","1055","Application Data"
"110","2018-08-07 18:06:25.234049","192.168.2.3","216.58.197.4","TCP","66","49253  >  443 [ACK] Seq=71409 Ack=260 Win=1522 Len=0 TSval=602365 TSecr=373859196"
"112","2018-08-07 18:06:25.243927","192.168.2.3","216.58.197.4","TCP","66","49253  >  443 [ACK] Seq=71409 Ack=602 Win=1522 Len=0 TSval=602366 TSecr=373859196"
"113","2018-08-07 18:06:25.265601","192.168.2.3","216.58.197.4","TCP","1434","49253  >  443 [ACK] Seq=71409 Ack=602 Win=1522 Len=1368 TSval=602368 TSecr=373859196 [TCP segment of a reassembled PDU]"
"114","2018-08-07 18:06:25.265821","192.168.2.3","216.58.197.4","TCP","1434","49253  >  443 [ACK] Seq=72777 Ack=602 Win=1522 Len=1368 TSval=602368 TSecr=373859196 [TCP segment of a reassembled PDU]"
"115","2018-08-07 18:06:25.265823","192.168.2.3","216.58.197.4","TLSv1.2","212","Application Data"
"116","2018-08-07 18:06:25.265824","192.168.2.3","216.58.197.4","TLSv1.2","1037","Application Data"
"119","2018-08-07 18:06:25.365562","192.168.2.3","216.58.197.4","TCP","1434","49253  >  443 [ACK] Seq=75262 Ack=602 Win=1522 Len=1368 TSval=602378 TSecr=373859234 [TCP segment of a reassembled PDU]"
"120","2018-08-07 18:06:25.365786","192.168.2.3","216.58.197.4","TCP","1434","49253  >  443 [ACK] Seq=76630 Ack=602 Win=1522 Len=1368 TSval=602378 TSecr=373859234 [TCP segment of a reassembled PDU]"
"121","2018-08-07 18:06:25.365788","192.168.2.3","216.58.197.4","TLSv1.2","212","Application Data"
"122","2018-08-07 18:06:25.365789","192.168.2.3","216.58.197.4","TLSv1.2","1029","Application Data"
"126","2018-08-07 18:06:25.406857","192.168.2.3","216.58.197.4","TCP","66","49253  >  443 [ACK] Seq=79107 Ack=831 Win=1522 Len=0 TSval=602383 TSecr=373859335"
"127","2018-08-07 18:06:25.484241","192.168.2.3","216.58.197.4","TCP","1434","49253  >  443 [ACK] Seq=79107 Ack=831 Win=1522 Len=1368 TSval=602390 TSecr=373859335 [TCP segment of a reassembled PDU]"
"128","2018-08-07 18:06:25.484510","192.168.2.3","216.58.197.4","TCP","1434","49253  >  443 [ACK] Seq=80475 Ack=831 Win=1522 Len=1368 TSval=602390 TSecr=373859335 [TCP segment of a reassembled PDU]"
"129","2018-08-07 18:06:25.484512","192.168.2.3","216.58.197.4","TLSv1.2","212","Application Data"
"130","2018-08-07 18:06:25.484512","192.168.2.3","216.58.197.4","TLSv1.2","705","Application Data"
"134","2018-08-07 18:06:25.540478","192.168.2.3","216.58.197.4","TCP","66","49253  >  443 [ACK] Seq=82628 Ack=1050 Win=1522 Len=0 TSval=602396 TSecr=373859503"
"135","2018-08-07 18:06:25.587161","192.168.2.3","216.58.197.4","TCP","1434","49253  >  443 [ACK] Seq=82628 Ack=1050 Win=1522 Len=1368 TSval=602400 TSecr=373859503 [TCP segment of a reassembled PDU]"
"136","2018-08-07 18:06:25.587166","192.168.2.3","216.58.197.4","TCP","1434","49253  >  443 [ACK] Seq=83996 Ack=1050 Win=1522 Len=1368 TSval=602400 TSecr=373859503 [TCP segment of a reassembled PDU]"
"137","2018-08-07 18:06:25.587167","192.168.2.3","216.58.197.4","TLSv1.2","212","Application Data"
"138","2018-08-07 18:06:25.587416","192.168.2.3","216.58.197.4","TLSv1.2","1075","Application Data"
"141","2018-08-07 18:06:25.686497","192.168.2.3","216.58.197.4","TCP","1434","49253  >  443 [ACK] Seq=86519 Ack=1050 Win=1522 Len=1368 TSval=602410 TSecr=373859555 [TCP segment of a reassembled PDU]"
"142","2018-08-07 18:06:25.686757","192.168.2.3","216.58.197.4","TCP","1434","49253  >  443 [ACK] Seq=87887 Ack=1050 Win=1522 Len=1368 TSval=602410 TSecr=373859555 [TCP segment of a reassembled PDU]"
"143","2018-08-07 18:06:25.686758","192.168.2.3","216.58.197.4","TLSv1.2","212","Application Data"
"144","2018-08-07 18:06:25.686759","192.168.2.3","216.58.197.4","TLSv1.2","1016","Application Data"
"147","2018-08-07 18:06:25.806037","192.168.2.3","216.58.197.4","TCP","1434","49253  >  443 [ACK] Seq=90351 Ack=1050 Win=1522 Len=1368 TSval=602422 TSecr=373859655 [TCP segment of a reassembled PDU]"
"148","2018-08-07 18:06:25.806425","192.168.2.3","216.58.197.4","TCP","1434","49253  >  443 [ACK] Seq=91719 Ack=1050 Win=1522 Len=1368 TSval=602422 TSecr=373859655 [TCP segment of a reassembled PDU]"
"149","2018-08-07 18:06:25.806428","192.168.2.3","216.58.197.4","TLSv1.2","212","Application Data"
"150","2018-08-07 18:06:25.806429","192.168.2.3","216.58.197.4","TLSv1.2","704","Application Data"
"153","2018-08-07 18:06:25.906113","192.168.2.3","216.58.197.4","TCP","1434","49253  >  443 [ACK] Seq=93871 Ack=1050 Win=1522 Len=1368 TSval=602432 TSecr=373859775 [TCP segment of a reassembled PDU]"
"154","2018-08-07 18:06:25.906116","192.168.2.3","216.58.197.4","TCP","1434","49253  >  443 [ACK] Seq=95239 Ack=1050 Win=1522 Len=1368 TSval=602432 TSecr=373859775 [TCP segment of a reassembled PDU]"
"155","2018-08-07 18:06:25.906117","192.168.2.3","216.58.197.4","TLSv1.2","212","Application Data"
"156","2018-08-07 18:06:25.906350","192.168.2.3","216.58.197.4","TLSv1.2","1077","Application Data"
"159","2018-08-07 18:06:26.008613","192.168.2.3","216.58.197.4","TCP","1434","49253  >  443 [ACK] Seq=97764 Ack=1050 Win=1522 Len=1368 TSval=602443 TSecr=373859875 [TCP segment of a reassembled PDU]"
"160","2018-08-07 18:06:26.009007","192.168.2.3","216.58.197.4","TCP","1434","49253  >  443 [ACK] Seq=99132 Ack=1050 Win=1522 Len=1368 TSval=602443 TSecr=373859875 [TCP segment of a reassembled PDU]"
"161","2018-08-07 18:06:26.009008","192.168.2.3","216.58.197.4","TLSv1.2","212","Application Data"
"162","2018-08-07 18:06:26.009009","192.168.2.3","216.58.197.4","TCP","1434","49253  >  443 [ACK] Seq=100646 Ack=1050 Win=1522 Len=1368 TSval=602443 TSecr=373859875 [TCP segment of a reassembled PDU]"
"163","2018-08-07 18:06:26.009010","192.168.2.3","216.58.197.4","TLSv1.2","155","Application Data"
"167","2018-08-07 18:06:26.092694","192.168.2.3","216.58.197.4","TCP","1434","49253  >  443 [ACK] Seq=102103 Ack=1050 Win=1522 Len=1368 TSval=602451 TSecr=373860017 [TCP segment of a reassembled PDU]"
"168","2018-08-07 18:06:26.092701","192.168.2.3","216.58.197.4","TCP","1434","49253  >  443 [ACK] Seq=103471 Ack=1050 Win=1522 Len=1368 TSval=602451 TSecr=373860017 [TCP segment of a reassembled PDU]"
"169","2018-08-07 18:06:26.092702","192.168.2.3","216.58.197.4","TLSv1.2","212","Application Data"
"170","2018-08-07 18:06:26.092961","192.168.2.3","216.58.197.4","TCP","1434","49253  >  443 [ACK] Seq=104985 Ack=1050 Win=1522 Len=1368 TSval=602451 TSecr=373860017 [TCP segment of a reassembled PDU]"
"171","2018-08-07 18:06:26.092964","192.168.2.3","216.58.197.4","TLSv1.2","155","Application Data"
"174","2018-08-07 18:06:26.190270","192.168.2.3","216.58.197.4","TCP","1434","49253  >  443 [ACK] Seq=106442 Ack=1050 Win=1522 Len=1368 TSval=602461 TSecr=373860061 [TCP segment of a reassembled PDU]"
"175","2018-08-07 18:06:26.190513","192.168.2.3","216.58.197.4","TCP","1434","49253  >  443 [ACK] Seq=107810 Ack=1050 Win=1522 Len=1368 TSval=602461 TSecr=373860061 [TCP segment of a reassembled PDU]"
"176","2018-08-07 18:06:26.190516","192.168.2.3","216.58.197.4","TLSv1.2","212","Application Data"
"177","2018-08-07 18:06:26.190517","192.168.2.3","216.58.197.4","TCP","1434","49253  >  443 [ACK] Seq=109324 Ack=1050 Win=1522 Len=1368 TSval=602461 TSecr=373860061 [TCP segment of a reassembled PDU]"
"178","2018-08-07 18:06:26.190643","192.168.2.3","216.58.197.4","TLSv1.2","155","Application Data"
"183","2018-08-07 18:06:26.234936","192.168.2.3","216.58.197.4","TCP","66","49253  >  443 [ACK] Seq=110781 Ack=1238 Win=1522 Len=0 TSval=602465 TSecr=373860196"
"185","2018-08-07 18:06:26.245705","192.168.2.3","216.58.197.4","TCP","66","49253  >  443 [ACK] Seq=110781 Ack=1483 Win=1522 Len=0 TSval=602466 TSecr=373860206"
"186","2018-08-07 18:06:26.288695","192.168.2.3","216.58.197.4","TCP","1434","49253  >  443 [ACK] Seq=110781 Ack=1483 Win=1522 Len=1368 TSval=602471 TSecr=373860206 [TCP segment of a reassembled PDU]"
"187","2018-08-07 18:06:26.288975","192.168.2.3","216.58.197.4","TCP","1434","49253  >  443 [ACK] Seq=112149 Ack=1483 Win=1522 Len=1368 TSval=602471 TSecr=373860206 [TCP segment of a reassembled PDU]"
"188","2018-08-07 18:06:26.288977","192.168.2.3","216.58.197.4","TLSv1.2","212","Application Data"
"189","2018-08-07 18:06:26.289507","192.168.2.3","216.58.197.4","TCP","1434","49253  >  443 [ACK] Seq=113663 Ack=1483 Win=1522 Len=1368 TSval=602471 TSecr=373860206 [TCP segment of a reassembled PDU]"
"190","2018-08-07 18:06:26.289509","192.168.2.3","216.58.197.4","TLSv1.2","155","Application Data"
"194","2018-08-07 18:06:26.383306","192.168.2.3","216.58.197.4","TCP","1434","49253  >  443 [ACK] Seq=115120 Ack=1483 Win=1522 Len=1368 TSval=602480 TSecr=373860297 [TCP segment of a reassembled PDU]"
"195","2018-08-07 18:06:26.383309","192.168.2.3","216.58.197.4","TCP","1434","49253  >  443 [ACK] Seq=116488 Ack=1483 Win=1522 Len=1368 TSval=602480 TSecr=373860297 [TCP segment of a reassembled PDU]"
"196","2018-08-07 18:06:26.383310","192.168.2.3","216.58.197.4","TLSv1.2","212","Application Data"
"197","2018-08-07 18:06:26.383607","192.168.2.3","216.58.197.4","TCP","1434","49253  >  443 [ACK] Seq=118002 Ack=1483 Win=1522 Len=1368 TSval=602480 TSecr=373860297 [TCP segment of a reassembled PDU]"
"198","2018-08-07 18:06:26.383608","192.168.2.3","216.58.197.4","TLSv1.2","155","Application Data"
"204","2018-08-07 18:06:26.456072","192.168.2.3","216.58.197.4","TCP","66","49253  >  443 [ACK] Seq=119459 Ack=1678 Win=1522 Len=0 TSval=602487 TSecr=373860412"
"205","2018-08-07 18:06:26.456083","192.168.2.3","216.58.197.4","TCP","66","49253  >  443 [ACK] Seq=119459 Ack=1939 Win=1522 Len=0 TSval=602487 TSecr=373860412"
"206","2018-08-07 18:06:26.474674","192.168.2.3","216.58.197.4","TCP","1434","49253  >  443 [ACK] Seq=119459 Ack=1939 Win=1522 Len=1368 TSval=602489 TSecr=373860412 [TCP segment of a reassembled PDU]"
"207","2018-08-07 18:06:26.475194","192.168.2.3","216.58.197.4","TCP","1434","49253  >  443 [ACK] Seq=120827 Ack=1939 Win=1522 Len=1368 TSval=602489 TSecr=373860412 [TCP segment of a reassembled PDU]"
"208","2018-08-07 18:06:26.475196","192.168.2.3","216.58.197.4","TLSv1.2","212","Application Data"
"209","2018-08-07 18:06:26.475432","192.168.2.3","216.58.197.4","TCP","1434","49253  >  443 [ACK] Seq=122341 Ack=1939 Win=1522 Len=1368 TSval=602489 TSecr=373860412 [TCP segment of a reassembled PDU]"
"210","2018-08-07 18:06:26.475435","192.168.2.3","216.58.197.4","TLSv1.2","155","Application Data"
"213","2018-08-07 18:06:26.571356","192.168.2.3","216.58.197.4","TCP","1434","49253  >  443 [ACK] Seq=123798 Ack=1939 Win=1522 Len=1368 TSval=602499 TSecr=373860444 [TCP segment of a reassembled PDU]"
"214","2018-08-07 18:06:26.571732","192.168.2.3","216.58.197.4","TCP","1434","49253  >  443 [ACK] Seq=125166 Ack=1939 Win=1522 Len=1368 TSval=602499 TSecr=373860444 [TCP segment of a reassembled PDU]"
"215","2018-08-07 18:06:26.571734","192.168.2.3","216.58.197.4","TLSv1.2","212","Application Data"
"216","2018-08-07 18:06:26.571735","192.168.2.3","216.58.197.4","TCP","1434","49253  >  443 [ACK] Seq=126680 Ack=1939 Win=1522 Len=1368 TSval=602499 TSecr=373860444 [TCP segment of a reassembled PDU]"
"217","2018-08-07 18:06:26.572002","192.168.2.3","216.58.197.4","TLSv1.2","155","Application Data"
"222","2018-08-07 18:06:26.626286","192.168.2.3","216.58.197.4","TCP","66","49253  >  443 [ACK] Seq=128137 Ack=2301 Win=1522 Len=0 TSval=602504 TSecr=373860589"
"223","2018-08-07 18:06:26.652364","192.168.2.3","216.58.197.4","TCP","1434","49253  >  443 [ACK] Seq=128137 Ack=2301 Win=1522 Len=1368 TSval=602507 TSecr=373860589 [TCP segment of a reassembled PDU]"
"224","2018-08-07 18:06:26.655987","192.168.2.3","216.58.197.4","TCP","1434","49253  >  443 [ACK] Seq=129505 Ack=2301 Win=1522 Len=1368 TSval=602507 TSecr=373860589 [TCP segment of a reassembled PDU]"
"225","2018-08-07 18:06:26.655990","192.168.2.3","216.58.197.4","TLSv1.2","212","Application Data"
"226","2018-08-07 18:06:26.656257","192.168.2.3","216.58.197.4","TCP","1434","49253  >  443 [ACK] Seq=131019 Ack=2301 Win=1522 Len=1368 TSval=602507 TSecr=373860589 [TCP segment of a reassembled PDU]"
"227","2018-08-07 18:06:26.656259","192.168.2.3","216.58.197.4","TLSv1.2","155","Application Data"
"232","2018-08-07 18:06:26.717650","192.168.2.3","216.58.197.4","TCP","66","49253  >  443 [ACK] Seq=132476 Ack=2740 Win=1522 Len=0 TSval=602514 TSecr=373860678"
"233","2018-08-07 18:06:26.768614","192.168.2.3","216.58.197.4","TCP","1434","49253  >  443 [ACK] Seq=132476 Ack=2740 Win=1522 Len=1368 TSval=602518 TSecr=373860678 [TCP segment of a reassembled PDU]"
"234","2018-08-07 18:06:26.768894","192.168.2.3","216.58.197.4","TCP","1434","49253  >  443 [ACK] Seq=133844 Ack=2740 Win=1522 Len=1368 TSval=602518 TSecr=373860678 [TCP segment of a reassembled PDU]"
"235","2018-08-07 18:06:26.768896","192.168.2.3","216.58.197.4","TLSv1.2","212","Application Data"
"236","2018-08-07 18:06:26.771409","192.168.2.3","216.58.197.4","TCP","1434","49253  >  443 [ACK] Seq=135358 Ack=2740 Win=1522 Len=1368 TSval=602518 TSecr=373860678 [TCP segment of a reassembled PDU]"
"237","2018-08-07 18:06:26.771598","192.168.2.3","216.58.197.4","TLSv1.2","155","Application Data"
"243","2018-08-07 18:06:26.832573","192.168.2.3","216.58.197.4","TCP","66","49253  >  443 [ACK] Seq=136815 Ack=3147 Win=1522 Len=0 TSval=602525 TSecr=373860795"
"244","2018-08-07 18:06:26.862902","192.168.2.3","216.58.197.4","TCP","1434","49253  >  443 [ACK] Seq=136815 Ack=3147 Win=1522 Len=1368 TSval=602528 TSecr=373860795 [TCP segment of a reassembled PDU]"
"245","2018-08-07 18:06:26.863347","192.168.2.3","216.58.197.4","TCP","1434","49253  >  443 [ACK] Seq=138183 Ack=3147 Win=1522 Len=1368 TSval=602528 TSecr=373860795 [TCP segment of a reassembled PDU]"
"246","2018-08-07 18:06:26.863350","192.168.2.3","216.58.197.4","TLSv1.2","212","Application Data"
"247","2018-08-07 18:06:26.863350","192.168.2.3","216.58.197.4","TCP","1434","49253  >  443 [ACK] Seq=139697 Ack=3147 Win=1522 Len=1368 TSval=602528 TSecr=373860795 [TCP segment of a reassembled PDU]"
"248","2018-08-07 18:06:26.863484","192.168.2.3","216.58.197.4","TLSv1.2","155","Application Data"
"254","2018-08-07 18:06:26.931458","192.168.2.3","216.58.197.4","TCP","66","49253  >  443 [ACK] Seq=141154 Ack=3521 Win=1522 Len=0 TSval=602535 TSecr=373860891"
"255","2018-08-07 18:06:26.973414","192.168.2.3","216.58.197.4","TCP","1434","49253  >  443 [ACK] Seq=141154 Ack=3521 Win=1522 Len=1368 TSval=602539 TSecr=373860891 [TCP segment of a reassembled PDU]"
"256","2018-08-07 18:06:26.973419","192.168.2.3","216.58.197.4","TCP","1434","49253  >  443 [ACK] Seq=142522 Ack=3521 Win=1522 Len=1368 TSval=602539 TSecr=373860891 [TCP segment of a reassembled PDU]"
"257","2018-08-07 18:06:26.973504","192.168.2.3","216.58.197.4","TLSv1.2","212","Application Data"
"258","2018-08-07 18:06:26.973984","192.168.2.3","216.58.197.4","TCP","1434","49253  >  443 [ACK] Seq=144036 Ack=3521 Win=1522 Len=1368 TSval=602539 TSecr=373860891 [TCP segment of a reassembled PDU]"
"259","2018-08-07 18:06:26.973987","192.168.2.3","216.58.197.4","TLSv1.2","81","Application Data"
"262","2018-08-07 18:06:27.082840","192.168.2.3","216.58.197.4","TCP","1434","49253  >  443 [ACK] Seq=145419 Ack=3521 Win=1522 Len=1368 TSval=602550 TSecr=373860942 [TCP segment of a reassembled PDU]"
"263","2018-08-07 18:06:27.083245","192.168.2.3","216.58.197.4","TCP","1434","49253  >  443 [ACK] Seq=146787 Ack=3521 Win=1522 Len=1368 TSval=602550 TSecr=373860942 [TCP segment of a reassembled PDU]"
"264","2018-08-07 18:06:27.083247","192.168.2.3","216.58.197.4","TLSv1.2","212","Application Data"
"265","2018-08-07 18:06:27.083248","192.168.2.3","216.58.197.4","TLSv1.2","712","Application Data"
"271","2018-08-07 18:06:27.174258","192.168.2.3","216.58.197.4","TCP","66","49253  >  443 [ACK] Seq=148947 Ack=3875 Win=1522 Len=0 TSval=602559 TSecr=373861136"
"272","2018-08-07 18:06:27.185508","192.168.2.3","216.58.197.4","TCP","1434","49253  >  443 [ACK] Seq=148947 Ack=3989 Win=1522 Len=1368 TSval=602560 TSecr=373861137 [TCP segment of a reassembled PDU]"
"273","2018-08-07 18:06:27.185858","192.168.2.3","216.58.197.4","TCP","1434","49253  >  443 [ACK] Seq=150315 Ack=3989 Win=1522 Len=1368 TSval=602560 TSecr=373861137 [TCP segment of a reassembled PDU]"
"274","2018-08-07 18:06:27.185861","192.168.2.3","216.58.197.4","TLSv1.2","212","Application Data"
"275","2018-08-07 18:06:27.186188","192.168.2.3","216.58.197.4","TLSv1.2","1405","Application Data"
"281","2018-08-07 18:06:27.249806","192.168.2.3","216.58.197.4","TCP","66","49253  >  443 [ACK] Seq=153168 Ack=4137 Win=1522 Len=0 TSval=602567 TSecr=373861196"
"282","2018-08-07 18:06:27.292102","192.168.2.3","216.58.197.4","TCP","1434","49253  >  443 [ACK] Seq=153168 Ack=4137 Win=1522 Len=1368 TSval=602571 TSecr=373861196 [TCP segment of a reassembled PDU]"
"283","2018-08-07 18:06:27.292619","192.168.2.3","216.58.197.4","TCP","1434","49253  >  443 [ACK] Seq=154536 Ack=4137 Win=1522 Len=1368 TSval=602571 TSecr=373861196 [TCP segment of a reassembled PDU]"
"284","2018-08-07 18:06:27.292622","192.168.2.3","216.58.197.4","TLSv1.2","212","Application Data"
"285","2018-08-07 18:06:27.292623","192.168.2.3","216.58.197.4","TLSv1.2","711","Application Data"
"288","2018-08-07 18:06:27.402938","192.168.2.3","216.58.197.4","TCP","1434","49253  >  443 [ACK] Seq=156695 Ack=4137 Win=1522 Len=1368 TSval=602582 TSecr=373861261 [TCP segment of a reassembled PDU]"
"289","2018-08-07 18:06:27.403207","192.168.2.3","216.58.197.4","TCP","1434","49253  >  443 [ACK] Seq=158063 Ack=4137 Win=1522 Len=1368 TSval=602582 TSecr=373861261 [TCP segment of a reassembled PDU]"
"290","2018-08-07 18:06:27.403209","192.168.2.3","216.58.197.4","TLSv1.2","212","Application Data"
"291","2018-08-07 18:06:27.403210","192.168.2.3","216.58.197.4","TLSv1.2","698","Application Data"
"293","2018-08-07 18:06:27.505403","192.168.2.3","216.58.197.4","TCP","1434","49253  >  443 [ACK] Seq=160209 Ack=4137 Win=1522 Len=1368 TSval=602592 TSecr=373861371 [TCP segment of a reassembled PDU]"
"294","2018-08-07 18:06:27.505732","192.168.2.3","216.58.197.4","TCP","1434","49253  >  443 [ACK] Seq=161577 Ack=4137 Win=1522 Len=1368 TSval=602592 TSecr=373861371 [TCP segment of a reassembled PDU]"
"295","2018-08-07 18:06:27.505734","192.168.2.3","216.58.197.4","TLSv1.2","212","Application Data"
"296","2018-08-07 18:06:27.506107","192.168.2.3","216.58.197.4","TLSv1.2","1388","Application Data"
"302","2018-08-07 18:06:27.565277","192.168.2.3","216.58.197.4","TCP","66","49253  >  443 [ACK] Seq=164413 Ack=4497 Win=1522 Len=0 TSval=602598 TSecr=373861527"
"304","2018-08-07 18:06:27.605653","192.168.2.3","216.58.197.4","TCP","1434","49253  >  443 [ACK] Seq=164413 Ack=4497 Win=1522 Len=1368 TSval=602602 TSecr=373861527 [TCP segment of a reassembled PDU]"
"305","2018-08-07 18:06:27.606017","192.168.2.3","216.58.197.4","TCP","1434","49253  >  443 [ACK] Seq=165781 Ack=4497 Win=1522 Len=1368 TSval=602602 TSecr=373861527 [TCP segment of a reassembled PDU]"
"306","2018-08-07 18:06:27.606019","192.168.2.3","216.58.197.4","TLSv1.2","212","Application Data"
"307","2018-08-07 18:06:27.606020","192.168.2.3","216.58.197.4","TLSv1.2","680","Application Data"
"311","2018-08-07 18:06:27.725982","192.168.2.3","216.58.197.4","TCP","1434","49253  >  443 [ACK] Seq=167909 Ack=4497 Win=1522 Len=1368 TSval=602614 TSecr=373861574 [TCP segment of a reassembled PDU]"
"312","2018-08-07 18:06:27.726380","192.168.2.3","216.58.197.4","TCP","1434","49253  >  443 [ACK] Seq=169277 Ack=4497 Win=1522 Len=1368 TSval=602614 TSecr=373861574 [TCP segment of a reassembled PDU]"
"313","2018-08-07 18:06:27.726933","192.168.2.3","216.58.197.4","TLSv1.2","212","Application Data"
"314","2018-08-07 18:06:27.727371","192.168.2.3","216.58.197.4","TLSv1.2","718","Application Data"
"320","2018-08-07 18:06:27.782644","192.168.2.3","216.58.197.4","TCP","66","49253  >  443 [ACK] Seq=171443 Ack=4626 Win=1522 Len=0 TSval=602620 TSecr=373861745"
"323","2018-08-07 18:06:27.817770","192.168.2.3","216.58.197.4","TCP","66","49253  >  443 [ACK] Seq=171443 Ack=5239 Win=1522 Len=0 TSval=602624 TSecr=373861779"
"324","2018-08-07 18:06:27.826093","192.168.2.3","216.58.197.4","TCP","1434","49253  >  443 [ACK] Seq=171443 Ack=5239 Win=1522 Len=1368 TSval=602624 TSecr=373861779 [TCP segment of a reassembled PDU]"
"325","2018-08-07 18:06:27.826370","192.168.2.3","216.58.197.4","TCP","1434","49253  >  443 [ACK] Seq=172811 Ack=5239 Win=1522 Len=1368 TSval=602624 TSecr=373861779 [TCP segment of a reassembled PDU]"
"326","2018-08-07 18:06:27.826372","192.168.2.3","216.58.197.4","TLSv1.2","212","Application Data"
"327","2018-08-07 18:06:27.826574","192.168.2.3","216.58.197.4","TLSv1.2","1017","Application Data"
"328","2018-08-07 18:06:27.827501","192.168.2.3","216.58.197.4","TLSv1.2","455","Application Data"
"329","2018-08-07 18:06:27.827687","192.168.2.3","216.58.197.4","TLSv1.2","102","Application Data"
"335","2018-08-07 18:06:28.077683","192.168.2.3","216.58.197.4","TCP","66","49253  >  443 [ACK] Seq=175701 Ack=5334 Win=1522 Len=0 TSval=602650 TSecr=373862002"
"337","2018-08-07 18:06:28.092889","192.168.2.3","216.58.197.4","TCP","66","49253  >  443 [ACK] Seq=175701 Ack=6648 Win=1522 Len=0 TSval=602651 TSecr=373862054"
"346","2018-08-07 18:06:28.209792","192.168.2.3","216.58.197.4","TCP","66","49253  >  443 [ACK] Seq=175701 Ack=6764 Win=1522 Len=0 TSval=602663 TSecr=373862170"
"347","2018-08-07 18:06:28.209803","192.168.2.3","216.58.197.4","TCP","66","49253  >  443 [ACK] Seq=175701 Ack=9600 Win=1522 Len=0 TSval=602663 TSecr=373862170"
"348","2018-08-07 18:06:28.212533","192.168.2.3","216.58.197.4","TCP","66","49253  >  443 [ACK] Seq=175701 Ack=12436 Win=1522 Len=0 TSval=602663 TSecr=373862170"
"349","2018-08-07 18:06:28.212537","192.168.2.3","216.58.197.4","TCP","66","49253  >  443 [ACK] Seq=175701 Ack=15779 Win=1522 Len=0 TSval=602663 TSecr=373862170"
"358","2018-08-07 18:06:28.238882","192.168.2.3","216.58.197.4","TCP","66","49253  >  443 [ACK] Seq=175701 Ack=20033 Win=1522 Len=0 TSval=602666 TSecr=373862199"
"366","2018-08-07 18:06:28.244580","192.168.2.3","216.58.197.4","TCP","66","49253  >  443 [ACK] Seq=175701 Ack=20352 Win=1522 Len=0 TSval=602666 TSecr=373862199"
"380","2018-08-07 18:06:28.255047","192.168.2.3","216.58.197.4","TCP","66","49253  >  443 [ACK] Seq=175701 Ack=23188 Win=1522 Len=0 TSval=602667 TSecr=373862202"
"381","2018-08-07 18:06:28.255049","192.168.2.3","216.58.197.4","TCP","66","49253  >  443 [ACK] Seq=175701 Ack=24736 Win=1522 Len=0 TSval=602667 TSecr=373862202"
"382","2018-08-07 18:06:28.255050","192.168.2.3","216.58.197.4","TCP","66","49253  >  443 [ACK] Seq=175701 Ack=27572 Win=1522 Len=0 TSval=602667 TSecr=373862204"
"383","2018-08-07 18:06:28.255051","192.168.2.3","216.58.197.4","TCP","66","49253  >  443 [ACK] Seq=175701 Ack=28950 Win=1522 Len=0 TSval=602667 TSecr=373862204"
"384","2018-08-07 18:06:28.255493","192.168.2.3","216.58.197.4","TCP","66","49253  >  443 [ACK] Seq=175701 Ack=31786 Win=1522 Len=0 TSval=602667 TSecr=373862206"
"385","2018-08-07 18:06:28.255938","192.168.2.3","216.58.197.4","TCP","66","49253  >  443 [ACK] Seq=175701 Ack=39452 Win=1522 Len=0 TSval=602667 TSecr=373862206"
"386","2018-08-07 18:06:28.256275","192.168.2.3","216.58.197.4","TCP","66","49253  >  443 [ACK] Seq=175701 Ack=41105 Win=1522 Len=0 TSval=602667 TSecr=373862210"
"387","2018-08-07 18:06:28.256693","192.168.2.3","216.58.197.4","TCP","66","49253  >  443 [ACK] Seq=175701 Ack=41518 Win=1522 Len=0 TSval=602667 TSecr=373862217"
"388","2018-08-07 18:06:28.283105","192.168.2.3","216.58.197.4","TLSv1.2","104","Application Data"
"392","2018-08-07 18:06:36.585012","192.168.2.3","172.217.27.174","TLSv1.2","156","[TCP Previous segment not captured] , Application Data"
"393","2018-08-07 18:06:36.585453","192.168.2.3","172.217.27.174","TLSv1.2","104","Application Data"
"394","2018-08-07 18:06:36.588388","192.168.2.3","172.217.27.174","TLSv1.2","503","Application Data"
"398","2018-08-07 18:06:36.628130","192.168.2.3","172.217.27.174","TCP","66","52258  >  443 [ACK] Seq=567 Ack=39 Win=661 Len=0 TSval=603505 TSecr=2576315160"
"404","2018-08-07 18:06:36.672866","192.168.2.3","172.217.27.174","TCP","66","52258  >  443 [ACK] Seq=567 Ack=107 Win=661 Len=0 TSval=603509 TSecr=2576315241"
"405","2018-08-07 18:06:36.672869","192.168.2.3","172.217.27.174","TCP","66","52258  >  443 [ACK] Seq=567 Ack=359 Win=661 Len=0 TSval=603509 TSecr=2576315241"
"406","2018-08-07 18:06:36.674239","192.168.2.3","172.217.27.174","TCP","66","52258  >  443 [ACK] Seq=567 Ack=598 Win=661 Len=0 TSval=603509 TSecr=2576315241"
"407","2018-08-07 18:06:36.674242","192.168.2.3","172.217.27.174","TCP","66","52258  >  443 [ACK] Seq=567 Ack=636 Win=661 Len=0 TSval=603509 TSecr=2576315242"
"408","2018-08-07 18:06:36.674243","192.168.2.3","172.217.27.174","TLSv1.2","104","Application Data"
