"No.","Time","Source","Destination","Protocol","Length","Info"
"1","2018-08-08 09:12:35.765953","192.168.2.3","108.177.125.188","TCP","66","51028  >  5228 [ACK] Seq=1 Ack=1 Win=406 Len=0 TSval=6039360 TSecr=2960370999"
"3","2018-08-08 09:12:36.086888","192.168.2.3","224.0.0.251","MDNS","403","Standard query response 0x0000 PTR Google-Home-d8ff63fb78680c8a1c8ccacd5fd7f560._googlecast._tcp.local TXT, cache flush SRV, cache flush 0 0 8009 d8ff63fb-7868-0c8a-1c8c-cacd5fd7f560.local A, cache flush 192.168.2.3"
"4","2018-08-08 09:12:36.086892","192.168.2.3","224.0.0.251","MDNS","272","Standard query response 0x0000 PTR d8ff63fb-7868-0c8a-1c8c-cacd5fd7f560._googlezone._tcp.local TXT, cache flush SRV, cache flush 210 72 10001 d8ff63fb-7868-0c8a-1c8c-cacd5fd7f560.local A, cache flush 192.168.2.3"
"5","2018-08-08 09:12:37.106354","192.168.2.3","224.0.0.251","MDNS","403","Standard query response 0x0000 PTR Google-Home-d8ff63fb78680c8a1c8ccacd5fd7f560._googlecast._tcp.local TXT, cache flush SRV, cache flush 0 0 8009 d8ff63fb-7868-0c8a-1c8c-cacd5fd7f560.local A, cache flush 192.168.2.3"
"6","2018-08-08 09:12:37.110520","192.168.2.3","224.0.0.251","MDNS","272","Standard query response 0x0000 PTR d8ff63fb-7868-0c8a-1c8c-cacd5fd7f560._googlezone._tcp.local TXT, cache flush SRV, cache flush 210 72 10001 d8ff63fb-7868-0c8a-1c8c-cacd5fd7f560.local A, cache flush 192.168.2.3"
"8","2018-08-08 09:12:38.146743","192.168.2.3","192.168.2.1","TCP","183","8009  >  61428 [PSH, ACK] Seq=1 Ack=118 Win=277 Len=117 TSval=6039598 TSecr=1047984153 [TCP segment of a reassembled PDU]"
"10","2018-08-08 09:12:38.726140","192.168.2.3","216.58.221.164","TCP","66","35291  >  443 [ACK] Seq=1 Ack=1 Win=661 Len=0 TSval=6039656 TSecr=1000304266"
"12","2018-08-08 09:12:40.165978","192.168.2.3","172.217.27.174","TCP","66","52862  >  443 [ACK] Seq=1 Ack=1 Win=1365 Len=0 TSval=6039800 TSecr=929858153"
"14","2018-08-08 09:12:41.153569","192.168.2.3","192.168.2.1","ICMP","98","Echo (ping) request  id=0x095e, seq=1/256, ttl=64 (reply in 15)"
"16","2018-08-08 09:12:41.522815","192.168.2.3","172.217.27.163","TLSv1.2","135","Application Data"
"17","2018-08-08 09:12:41.523083","192.168.2.3","172.217.27.163","TLSv1.2","104","Application Data"
"21","2018-08-08 09:12:41.532178","192.168.2.3","172.217.27.163","TCP","66","39575  >  443 [ACK] Seq=108 Ack=96 Win=262 Len=0 TSval=6039936 TSecr=234450377"
"22","2018-08-08 09:12:41.541524","192.168.2.3","172.217.27.163","TLSv1.2","100","Application Data"
"23","2018-08-08 09:12:41.541526","192.168.2.3","172.217.27.163","TLSv1.2","104","Application Data"
"25","2018-08-08 09:12:41.576240","192.168.2.3","224.0.0.251","MDNS","82","Standard query 0x0000 PTR _googlecast._tcp.local, ""QM"" question"
"26","2018-08-08 09:12:41.577796","192.168.2.3","224.0.0.251","MDNS","403","Standard query response 0x0000 PTR Google-Home-d8ff63fb78680c8a1c8ccacd5fd7f560._googlecast._tcp.local TXT, cache flush SRV, cache flush 0 0 8009 d8ff63fb-7868-0c8a-1c8c-cacd5fd7f560.local A, cache flush 192.168.2.3"
"27","2018-08-08 09:12:41.593085","192.168.2.3","224.0.0.251","MDNS","82","Standard query 0x0000 PTR _googlezone._tcp.local, ""QM"" question"
"28","2018-08-08 09:12:41.593087","192.168.2.3","224.0.0.251","MDNS","272","Standard query response 0x0000 PTR d8ff63fb-7868-0c8a-1c8c-cacd5fd7f560._googlezone._tcp.local TXT, cache flush SRV, cache flush 210 72 10001 d8ff63fb-7868-0c8a-1c8c-cacd5fd7f560.local A, cache flush 192.168.2.3"
"29","2018-08-08 09:12:42.176055","192.168.2.3","192.168.2.1","ICMP","98","Echo (ping) request  id=0x095e, seq=2/512, ttl=64 (reply in 30)"
"31","2018-08-08 09:12:42.199885","192.168.2.3","8.8.8.8","ICMP","98","Echo (ping) request  id=0x0964, seq=1/256, ttl=64 (reply in 32)"
"34","2018-08-08 09:12:43.152494","192.168.2.3","192.168.2.1","TCP","183","8009  >  61428 [PSH, ACK] Seq=118 Ack=235 Win=277 Len=117 TSval=6040098 TSecr=1047989145 [TCP segment of a reassembled PDU]"
"36","2018-08-08 09:12:43.226940","192.168.2.3","172.217.27.174","TCP","66","52867  >  443 [ACK] Seq=1 Ack=1 Win=494 Len=0 TSval=6040106 TSecr=929861250"
"37","2018-08-08 09:12:43.226948","192.168.2.3","8.8.8.8","ICMP","98","Echo (ping) request  id=0x0964, seq=2/512, ttl=64 (reply in 39)"
"40","2018-08-08 09:12:43.234723","192.168.2.3","8.8.8.8","DNS","74","Standard query 0x6d54 A www.google.com"
"41","2018-08-08 09:12:43.234730","192.168.2.3","8.8.8.8","DNS","74","Standard query 0x73f8 AAAA www.google.com"
"44","2018-08-08 09:12:43.348186","192.168.2.3","8.8.8.8","DNS","79","Standard query 0x8e6e A clients4.google.com"
"45","2018-08-08 09:12:43.348191","192.168.2.3","8.8.8.8","DNS","79","Standard query 0x0551 AAAA clients4.google.com"
"48","2018-08-08 09:12:43.396860","192.168.2.3","172.217.27.174","TCP","74","52870  >  443 [SYN] Seq=0 Win=14600 Len=0 MSS=1460 SACK_PERM=1 TSval=6040123 TSecr=0 WS=64"
"50","2018-08-08 09:12:43.405667","192.168.2.3","172.217.27.174","TCP","66","52870  >  443 [ACK] Seq=1 Ack=1 Win=14656 Len=0 TSval=6040123 TSecr=929906421"
"51","2018-08-08 09:12:43.406302","192.168.2.3","172.217.27.174","TLSv1.2","583","Client Hello"
"54","2018-08-08 09:12:43.412406","192.168.2.3","172.217.27.174","TCP","66","52870  >  443 [ACK] Seq=518 Ack=149 Win=15680 Len=0 TSval=6040124 TSecr=929906431"
"55","2018-08-08 09:12:43.412932","192.168.2.3","172.217.27.174","TLSv1.2","109","Change Cipher Spec, Encrypted Handshake Message"
"57","2018-08-08 09:12:43.449613","192.168.2.3","172.217.27.174","TLSv1.2","151","Application Data"
"58","2018-08-08 09:12:43.449619","192.168.2.3","172.217.27.174","TLSv1.2","96","Application Data"
"59","2018-08-08 09:12:43.449620","192.168.2.3","172.217.27.174","TLSv1.2","234","Application Data"
"60","2018-08-08 09:12:43.449850","192.168.2.3","172.217.27.174","TLSv1.2","350","Application Data"
"63","2018-08-08 09:12:43.497444","192.168.2.3","172.217.27.174","TCP","66","52870  >  443 [ACK] Seq=1128 Ack=240 Win=15680 Len=0 TSval=6040133 TSecr=929906474"
"68","2018-08-08 09:12:43.534056","192.168.2.3","172.217.27.174","TCP","66","52870  >  443 [ACK] Seq=1128 Ack=466 Win=16768 Len=0 TSval=6040136 TSecr=929906551"
"69","2018-08-08 09:12:43.539345","192.168.2.3","172.217.27.174","TCP","66","52870  >  443 [ACK] Seq=1128 Ack=724 Win=17856 Len=0 TSval=6040136 TSecr=929906551"
"70","2018-08-08 09:12:43.539348","192.168.2.3","172.217.27.174","TCP","66","52870  >  443 [ACK] Seq=1128 Ack=855 Win=18944 Len=0 TSval=6040136 TSecr=929906551"
"71","2018-08-08 09:12:43.539349","192.168.2.3","172.217.27.174","TCP","66","52870  >  443 [ACK] Seq=1128 Ack=893 Win=18944 Len=0 TSval=6040136 TSecr=929906551"
"72","2018-08-08 09:12:43.539350","192.168.2.3","172.217.27.174","TLSv1.2","104","Application Data"
"73","2018-08-08 09:12:43.566106","192.168.2.3","172.217.161.234","TCP","66","58936  >  443 [ACK] Seq=1 Ack=1 Win=495 Len=0 TSval=6040140 TSecr=3679101304"
"76","2018-08-08 09:12:46.822014","192.168.2.3","172.217.27.163","TLSv1.2","135","Application Data"
"78","2018-08-08 09:12:46.832331","192.168.2.3","172.217.27.163","TLSv1.2","100","Application Data"
"79","2018-08-08 09:12:46.832334","192.168.2.3","172.217.27.163","TLSv1.2","104","Application Data"
"82","2018-08-08 09:12:48.161327","192.168.2.3","192.168.2.1","TCP","183","8009  >  61428 [PSH, ACK] Seq=235 Ack=352 Win=277 Len=117 TSval=6040599 TSecr=1047994144 [TCP segment of a reassembled PDU]"
"85","2018-08-08 09:12:53.165405","192.168.2.3","192.168.2.1","TCP","183","8009  >  61428 [PSH, ACK] Seq=352 Ack=469 Win=277 Len=117 TSval=6041099 TSecr=1047999145 [TCP segment of a reassembled PDU]"
"87","2018-08-08 09:12:53.467073","192.168.2.3","224.0.0.251","MDNS","403","Standard query response 0x0000 PTR Google-Home-d8ff63fb78680c8a1c8ccacd5fd7f560._googlecast._tcp.local TXT, cache flush SRV, cache flush 0 0 8009 d8ff63fb-7868-0c8a-1c8c-cacd5fd7f560.local A, cache flush 192.168.2.3"
"88","2018-08-08 09:12:53.467256","192.168.2.3","224.0.0.251","MDNS","272","Standard query response 0x0000 PTR d8ff63fb-7868-0c8a-1c8c-cacd5fd7f560._googlezone._tcp.local TXT, cache flush SRV, cache flush 210 77 10001 d8ff63fb-7868-0c8a-1c8c-cacd5fd7f560.local A, cache flush 192.168.2.3"
"89","2018-08-08 09:12:54.166176","192.168.2.3","192.168.2.2","TCP","66","8008  >  50525 [ACK] Seq=1 Ack=1 Win=294 Len=0 TSval=6041200 TSecr=555397671"
"90","2018-08-08 09:12:54.487656","192.168.2.3","224.0.0.251","MDNS","403","Standard query response 0x0000 PTR Google-Home-d8ff63fb78680c8a1c8ccacd5fd7f560._googlecast._tcp.local TXT, cache flush SRV, cache flush 0 0 8009 d8ff63fb-7868-0c8a-1c8c-cacd5fd7f560.local A, cache flush 192.168.2.3"
"91","2018-08-08 09:12:54.487661","192.168.2.3","224.0.0.251","MDNS","272","Standard query response 0x0000 PTR d8ff63fb-7868-0c8a-1c8c-cacd5fd7f560._googlezone._tcp.local TXT, cache flush SRV, cache flush 210 77 10001 d8ff63fb-7868-0c8a-1c8c-cacd5fd7f560.local A, cache flush 192.168.2.3"
"95","2018-08-08 09:12:58.169906","192.168.2.3","192.168.2.1","TCP","183","8009  >  61428 [PSH, ACK] Seq=469 Ack=586 Win=277 Len=117 TSval=6041600 TSecr=1048004143 [TCP segment of a reassembled PDU]"
"98","2018-08-08 09:13:00.168869","192.168.2.3","108.177.125.188","TCP","66","51024  >  5228 [ACK] Seq=1 Ack=1 Win=406 Len=0 TSval=6041800 TSecr=675762661"
"102","2018-08-08 09:13:03.172235","192.168.2.3","192.168.2.1","TCP","183","8009  >  61428 [PSH, ACK] Seq=586 Ack=703 Win=277 Len=117 TSval=6042100 TSecr=1048009138 [TCP segment of a reassembled PDU]"
"108","2018-08-08 09:13:08.178278","192.168.2.3","192.168.2.1","AJP13","183","AJP13 Error? [TCP segment of a reassembled PDU]"
"110","2018-08-08 09:13:09.908169","192.168.2.3","172.217.27.174","TCP","66","52869  >  443 [ACK] Seq=1 Ack=1 Win=312 Len=0 TSval=6042772 TSecr=2630663451"
"113","2018-08-08 09:13:11.606318","192.168.2.3","172.217.161.67","TCP","66","57081  >  80 [ACK] Seq=1 Ack=1 Win=229 Len=0 TSval=6042944 TSecr=2369932479"
"116","2018-08-08 09:13:13.183596","192.168.2.3","192.168.2.1","TCP","183","8009  >  61428 [PSH, ACK] Seq=820 Ack=937 Win=277 Len=117 TSval=6043101 TSecr=1048019129 [TCP segment of a reassembled PDU]"
"119","2018-08-08 09:13:18.186238","192.168.2.3","192.168.2.1","TCP","183","8009  >  61428 [PSH, ACK] Seq=937 Ack=1054 Win=277 Len=117 TSval=6043601 TSecr=1048024126 [TCP segment of a reassembled PDU]"
"122","2018-08-08 09:13:20.329379","192.168.2.3","239.255.255.250","SSDP","136","M-SEARCH * HTTP/1.1 "
"123","2018-08-08 09:13:20.886654","192.168.2.3","108.177.125.188","TCP","66","[TCP Dup ACK 1#1] 51028  >  5228 [ACK] Seq=1 Ack=1 Win=406 Len=0 TSval=6043872 TSecr=2960416032"
"126","2018-08-08 09:13:23.189081","192.168.2.3","192.168.2.1","TCP","183","8009  >  61428 [PSH, ACK] Seq=1054 Ack=1171 Win=277 Len=117 TSval=6044102 TSecr=1048029122 [TCP segment of a reassembled PDU]"
"128","2018-08-08 09:13:23.766491","192.168.2.3","216.58.221.164","TCP","66","[TCP Dup ACK 10#1] 35291  >  443 [ACK] Seq=1 Ack=1 Win=661 Len=0 TSval=6044160 TSecr=1000349269"
"130","2018-08-08 09:13:25.206433","192.168.2.3","172.217.27.174","TCP","66","[TCP Dup ACK 12#1] 52862  >  443 [ACK] Seq=1 Ack=1 Win=1365 Len=0 TSval=6044304 TSecr=929903191"
"134","2018-08-08 09:13:28.193242","192.168.2.3","192.168.2.1","TCP","183","8009  >  61428 [PSH, ACK] Seq=1171 Ack=1288 Win=277 Len=117 TSval=6044602 TSecr=1048034120 [TCP segment of a reassembled PDU]"
"136","2018-08-08 09:13:28.246979","192.168.2.3","172.217.27.174","TCP","66","[TCP Dup ACK 36#1] 52867  >  443 [ACK] Seq=1 Ack=1 Win=494 Len=0 TSval=6044608 TSecr=929906252"
"138","2018-08-08 09:13:28.586507","192.168.2.3","172.217.27.174","TCP","66","[TCP Keep-Alive] 52870  >  443 [ACK] Seq=1165 Ack=893 Win=18944 Len=0 TSval=6044642 TSecr=929906604"
"140","2018-08-08 09:13:28.726546","192.168.2.3","172.217.161.234","TCP","66","[TCP Dup ACK 73#1] 58936  >  443 [ACK] Seq=1 Ack=1 Win=495 Len=0 TSval=6044656 TSecr=3679146302"
"142","2018-08-08 09:13:31.856337","192.168.2.3","172.217.27.163","TCP","66","[TCP Keep-Alive] 39575  >  443 [ACK] Seq=320 Ack=174 Win=262 Len=0 TSval=6044968 TSecr=234455686"
"145","2018-08-08 09:13:33.195526","192.168.2.3","192.168.2.1","TCP","183","8009  >  61428 [PSH, ACK] Seq=1288 Ack=1405 Win=277 Len=117 TSval=6045102 TSecr=1048039112 [TCP segment of a reassembled PDU]"
"149","2018-08-08 09:13:38.272338","192.168.2.3","192.168.2.1","TCP","183","8009  >  61428 [PSH, ACK] Seq=1405 Ack=1522 Win=277 Len=117 TSval=6045610 TSecr=1048044181 [TCP segment of a reassembled PDU]"
"151","2018-08-08 09:13:39.286654","192.168.2.3","192.168.2.2","TCP","66","[TCP Dup ACK 89#1] 8008  >  50525 [ACK] Seq=1 Ack=1 Win=294 Len=0 TSval=6045712 TSecr=555397671"
"152","2018-08-08 09:13:41.547871","192.168.2.3","172.217.27.163","TLSv1.2","135","Application Data"
"153","2018-08-08 09:13:41.547876","192.168.2.3","172.217.27.163","TLSv1.2","104","Application Data"
"156","2018-08-08 09:13:41.554502","192.168.2.3","172.217.27.163","TCP","66","39575  >  443 [ACK] Seq=428 Ack=290 Win=262 Len=0 TSval=6045938 TSecr=234510402"
"157","2018-08-08 09:13:41.555315","192.168.2.3","172.217.27.163","TLSv1.2","100","Application Data"
"158","2018-08-08 09:13:41.555556","192.168.2.3","172.217.27.163","TLSv1.2","104","Application Data"
"161","2018-08-08 09:13:44.150407","192.168.2.3","192.168.2.1","TCP","183","8009  >  61428 [PSH, ACK] Seq=1522 Ack=1639 Win=277 Len=117 TSval=6046198 TSecr=1048050050 [TCP segment of a reassembled PDU]"
"164","2018-08-08 09:13:44.316540","192.168.2.3","192.168.2.1","ICMP","98","Echo (ping) request  id=0x0a6e, seq=1/256, ttl=64 (reply in 165)"
"170","2018-08-08 09:13:45.206702","192.168.2.3","108.177.125.188","TCP","66","[TCP Dup ACK 98#1] 51024  >  5228 [ACK] Seq=1 Ack=1 Win=406 Len=0 TSval=6046304 TSecr=675807772"
"173","2018-08-08 09:13:45.336873","192.168.2.3","192.168.2.1","ICMP","98","Echo (ping) request  id=0x0a6e, seq=2/512, ttl=64 (reply in 174)"
"175","2018-08-08 09:13:45.357007","192.168.2.3","8.8.8.8","ICMP","98","Echo (ping) request  id=0x0a74, seq=1/256, ttl=64 (reply in 176)"
"180","2018-08-08 09:13:45.606959","192.168.2.3","224.0.0.251","MDNS","82","Standard query 0x0000 PTR _googlecast._tcp.local, ""QM"" question"
"181","2018-08-08 09:13:45.608530","192.168.2.3","224.0.0.251","MDNS","403","Standard query response 0x0000 PTR Google-Home-d8ff63fb78680c8a1c8ccacd5fd7f560._googlecast._tcp.local TXT, cache flush SRV, cache flush 0 0 8009 d8ff63fb-7868-0c8a-1c8c-cacd5fd7f560.local A, cache flush 192.168.2.3"
"182","2018-08-08 09:13:45.608748","192.168.2.3","224.0.0.251","MDNS","82","Standard query 0x0000 PTR _googlezone._tcp.local, ""QM"" question"
"183","2018-08-08 09:13:45.614114","192.168.2.3","224.0.0.251","MDNS","272","Standard query response 0x0000 PTR d8ff63fb-7868-0c8a-1c8c-cacd5fd7f560._googlezone._tcp.local TXT, cache flush SRV, cache flush 210 77 10001 d8ff63fb-7868-0c8a-1c8c-cacd5fd7f560.local A, cache flush 192.168.2.3"
"185","2018-08-08 09:13:46.386902","192.168.2.3","8.8.8.8","ICMP","98","Echo (ping) request  id=0x0a74, seq=2/512, ttl=64 (reply in 186)"
"187","2018-08-08 09:13:46.395801","192.168.2.3","8.8.8.8","DNS","74","Standard query 0x6eed A www.google.com"
"188","2018-08-08 09:13:46.395805","192.168.2.3","8.8.8.8","DNS","74","Standard query 0x6ee4 AAAA www.google.com"
"191","2018-08-08 09:13:46.835218","192.168.2.3","172.217.27.163","TLSv1.2","135","Application Data"
"193","2018-08-08 09:13:46.842016","192.168.2.3","172.217.27.163","TLSv1.2","100","Application Data"
"194","2018-08-08 09:13:46.842257","192.168.2.3","172.217.27.163","TLSv1.2","104","Application Data"
"197","2018-08-08 09:13:50.155976","192.168.2.3","192.168.2.1","TCP","183","8009  >  61428 [PSH, ACK] Seq=1639 Ack=1756 Win=277 Len=117 TSval=6046798 TSecr=1048056042 [TCP segment of a reassembled PDU]"
"206","2018-08-08 09:13:54.966865","192.168.2.3","172.217.27.174","TCP","66","[TCP Dup ACK 110#1] 52869  >  443 [ACK] Seq=1 Ack=1 Win=312 Len=0 TSval=6047280 TSecr=2630708509"
"209","2018-08-08 09:13:56.147172","192.168.2.3","192.168.2.1","TCP","183","8009  >  61428 [PSH, ACK] Seq=1756 Ack=1873 Win=277 Len=117 TSval=6047398 TSecr=1048062034 [TCP segment of a reassembled PDU]"
"211","2018-08-08 09:13:56.726929","192.168.2.3","172.217.161.67","TCP","66","[TCP Dup ACK 113#1] 57081  >  80 [ACK] Seq=1 Ack=1 Win=229 Len=0 TSval=6047456 TSecr=2369977593"
"217","2018-08-08 09:14:01.472518","192.168.2.3","192.168.2.1","TCP","183","8009  >  61428 [PSH, ACK] Seq=1873 Ack=1990 Win=277 Len=117 TSval=6047930 TSecr=1048067350 [TCP segment of a reassembled PDU]"
"219","2018-08-08 09:14:06.016744","192.168.2.3","108.177.125.188","TCP","66","[TCP Dup ACK 1#2] 51028  >  5228 [ACK] Seq=1 Ack=1 Win=406 Len=0 TSval=6048384 TSecr=2960461153"
"222","2018-08-08 09:14:07.152129","192.168.2.3","192.168.2.1","TCP","183","8009  >  61428 [PSH, ACK] Seq=1990 Ack=2107 Win=277 Len=117 TSval=6048498 TSecr=1048073015 [TCP segment of a reassembled PDU]"
"224","2018-08-08 09:14:08.889369","192.168.2.3","216.58.221.164","TCP","66","[TCP Dup ACK 10#2] 35291  >  443 [ACK] Seq=1 Ack=1 Win=661 Len=0 TSval=6048672 TSecr=1000394340"
"226","2018-08-08 09:14:10.328116","192.168.2.3","172.217.27.174","TCP","66","[TCP Dup ACK 12#2] 52862  >  443 [ACK] Seq=1 Ack=1 Win=1365 Len=0 TSval=6048816 TSecr=929948231"
"229","2018-08-08 09:14:12.161397","192.168.2.3","192.168.2.1","TCP","183","8009  >  61428 [PSH, ACK] Seq=2107 Ack=2224 Win=277 Len=117 TSval=6048999 TSecr=1048078013 [TCP segment of a reassembled PDU]"
"231","2018-08-08 09:14:13.367039","192.168.2.3","172.217.27.174","TCP","66","[TCP Dup ACK 36#2] 52867  >  443 [ACK] Seq=1 Ack=1 Win=494 Len=0 TSval=6049120 TSecr=929951271"
"233","2018-08-08 09:14:13.688059","192.168.2.3","172.217.27.174","TCP","66","[TCP Keep-Alive] 52870  >  443 [ACK] Seq=1165 Ack=893 Win=18944 Len=0 TSval=6049152 TSecr=929951611"
"235","2018-08-08 09:14:13.847015","192.168.2.3","172.217.161.234","TCP","66","[TCP Dup ACK 73#2] 58936  >  443 [ACK] Seq=1 Ack=1 Win=495 Len=0 TSval=6049168 TSecr=3679191458"
"237","2018-08-08 09:14:15.015033","192.168.2.3","108.177.125.188","TCP","91","[TCP Previous segment not captured] 51024  >  5228 [PSH, ACK] Seq=2 Ack=1 Win=406 Len=25 TSval=6049284 TSecr=675852810"
"240","2018-08-08 09:14:15.087054","192.168.2.3","108.177.125.188","TCP","66","51024  >  5228 [ACK] Seq=27 Ack=26 Win=406 Len=0 TSval=6049292 TSecr=675882619"
"242","2018-08-08 09:14:17.552465","192.168.2.3","192.168.2.1","TCP","183","8009  >  61428 [PSH, ACK] Seq=2224 Ack=2341 Win=277 Len=117 TSval=6049538 TSecr=1048083393 [TCP segment of a reassembled PDU]"
"244","2018-08-08 09:14:20.357961","192.168.2.3","239.255.255.250","SSDP","136","M-SEARCH * HTTP/1.1 "
