"No.","Time","Source","Destination","Protocol","Length","Info"
"39","2018-08-07 18:07:31.132045","192.168.2.3","216.58.197.4","TLSv1.2","156","Application Data"
"40","2018-08-07 18:07:31.132229","192.168.2.3","216.58.197.4","TLSv1.2","104","Application Data"
"41","2018-08-07 18:07:31.133190","192.168.2.3","216.58.197.4","TLSv1.2","159","Application Data"
"45","2018-08-07 18:07:31.147409","192.168.2.3","216.58.197.4","TCP","1434","49253  >  443 [ACK] Seq=222 Ack=39 Win=1522 Len=1368 TSval=608956 TSecr=373925100 [TCP segment of a reassembled PDU]"
"46","2018-08-07 18:07:31.147744","192.168.2.3","216.58.197.4","TCP","1434","49253  >  443 [ACK] Seq=1590 Ack=39 Win=1522 Len=1368 TSval=608956 TSecr=373925100 [TCP segment of a reassembled PDU]"
"47","2018-08-07 18:07:31.147746","192.168.2.3","216.58.197.4","TLSv1.2","212","Application Data"
"48","2018-08-07 18:07:31.147747","192.168.2.3","216.58.197.4","TCP","1434","49253  >  443 [ACK] Seq=3104 Ack=39 Win=1522 Len=1368 TSval=608956 TSecr=373925100 [TCP segment of a reassembled PDU]"
"49","2018-08-07 18:07:31.147923","192.168.2.3","216.58.197.4","TLSv1.2","287","Application Data"
"50","2018-08-07 18:07:31.148491","192.168.2.3","216.58.197.4","TCP","1434","49253  >  443 [ACK] Seq=4693 Ack=39 Win=1522 Len=1368 TSval=608957 TSecr=373925100 [TCP segment of a reassembled PDU]"
"51","2018-08-07 18:07:31.148908","192.168.2.3","216.58.197.4","TCP","1434","49253  >  443 [ACK] Seq=6061 Ack=39 Win=1522 Len=1368 TSval=608957 TSecr=373925100 [TCP segment of a reassembled PDU]"
"52","2018-08-07 18:07:31.148911","192.168.2.3","216.58.197.4","TLSv1.2","212","Application Data"
"53","2018-08-07 18:07:31.149428","192.168.2.3","216.58.197.4","TCP","1434","49253  >  443 [ACK] Seq=7575 Ack=39 Win=1522 Len=1368 TSval=608957 TSecr=373925100 [TCP segment of a reassembled PDU]"
"57","2018-08-07 18:07:31.153137","192.168.2.3","216.58.197.4","TLSv1.2","156","Application Data"
"60","2018-08-07 18:07:31.156168","192.168.2.3","216.58.197.4","TCP","1434","49253  >  443 [ACK] Seq=9033 Ack=39 Win=1522 Len=1368 TSval=608957 TSecr=373925116 [TCP segment of a reassembled PDU]"
"61","2018-08-07 18:07:31.156171","192.168.2.3","216.58.197.4","TCP","1434","49253  >  443 [ACK] Seq=10401 Ack=39 Win=1522 Len=1368 TSval=608957 TSecr=373925116 [TCP segment of a reassembled PDU]"
"62","2018-08-07 18:07:31.156403","192.168.2.3","216.58.197.4","TLSv1.2","212","Application Data"
"63","2018-08-07 18:07:31.156405","192.168.2.3","216.58.197.4","TCP","1434","49253  >  443 [ACK] Seq=11915 Ack=39 Win=1522 Len=1368 TSval=608957 TSecr=373925116 [TCP segment of a reassembled PDU]"
"64","2018-08-07 18:07:31.156407","192.168.2.3","216.58.197.4","TLSv1.2","156","Application Data"
"65","2018-08-07 18:07:31.156608","192.168.2.3","216.58.197.4","TCP","1434","49253  >  443 [ACK] Seq=13373 Ack=39 Win=1522 Len=1368 TSval=608957 TSecr=373925116 [TCP segment of a reassembled PDU]"
"66","2018-08-07 18:07:31.156778","192.168.2.3","216.58.197.4","TCP","1434","49253  >  443 [ACK] Seq=14741 Ack=39 Win=1522 Len=1368 TSval=608957 TSecr=373925116 [TCP segment of a reassembled PDU]"
"67","2018-08-07 18:07:31.157248","192.168.2.3","216.58.197.4","TLSv1.2","1434","Application Data [TCP segment of a reassembled PDU]"
"68","2018-08-07 18:07:31.157529","192.168.2.3","216.58.197.4","TCP","1434","49253  >  443 [ACK] Seq=17477 Ack=39 Win=1522 Len=1368 TSval=608957 TSecr=373925117 [TCP segment of a reassembled PDU]"
"69","2018-08-07 18:07:31.157531","192.168.2.3","216.58.197.4","TLSv1.2","1434","Application Data [TCP segment of a reassembled PDU]"
"70","2018-08-07 18:07:31.158093","192.168.2.3","216.58.197.4","TCP","1434","49253  >  443 [ACK] Seq=20213 Ack=39 Win=1522 Len=1368 TSval=608957 TSecr=373925117 [TCP segment of a reassembled PDU]"
"71","2018-08-07 18:07:31.158095","192.168.2.3","216.58.197.4","TLSv1.2","1434","Application Data [TCP segment of a reassembled PDU]"
"72","2018-08-07 18:07:31.158393","192.168.2.3","216.58.197.4","TCP","1434","49253  >  443 [ACK] Seq=22949 Ack=39 Win=1522 Len=1368 TSval=608957 TSecr=373925117 [TCP segment of a reassembled PDU]"
"80","2018-08-07 18:07:31.163223","192.168.2.3","216.58.197.4","TLSv1.2","1434","Application Data [TCP segment of a reassembled PDU]"
"81","2018-08-07 18:07:31.163225","192.168.2.3","216.58.197.4","TCP","1434","49253  >  443 [ACK] Seq=25685 Ack=39 Win=1522 Len=1368 TSval=608958 TSecr=373925124 [TCP segment of a reassembled PDU]"
"82","2018-08-07 18:07:31.163544","192.168.2.3","216.58.197.4","TLSv1.2","1434","Application Data [TCP segment of a reassembled PDU]"
"83","2018-08-07 18:07:31.163708","192.168.2.3","216.58.197.4","TCP","1434","49253  >  443 [ACK] Seq=28421 Ack=39 Win=1522 Len=1368 TSval=608958 TSecr=373925124 [TCP segment of a reassembled PDU]"
"84","2018-08-07 18:07:31.163802","192.168.2.3","216.58.197.4","TLSv1.2","1434","Application Data [TCP segment of a reassembled PDU]"
"85","2018-08-07 18:07:31.163990","192.168.2.3","216.58.197.4","TCP","1434","49253  >  443 [ACK] Seq=31157 Ack=39 Win=1522 Len=1368 TSval=608958 TSecr=373925124 [TCP segment of a reassembled PDU]"
"86","2018-08-07 18:07:31.164269","192.168.2.3","216.58.197.4","TLSv1.2","1434","Application Data [TCP segment of a reassembled PDU]"
"87","2018-08-07 18:07:31.164271","192.168.2.3","216.58.197.4","TCP","1434","49253  >  443 [ACK] Seq=33893 Ack=39 Win=1522 Len=1368 TSval=608958 TSecr=373925124 [TCP segment of a reassembled PDU]"
"88","2018-08-07 18:07:31.165239","192.168.2.3","216.58.197.4","TLSv1.2","1434","Application Data [TCP segment of a reassembled PDU]"
"89","2018-08-07 18:07:31.165241","192.168.2.3","216.58.197.4","TCP","1434","49253  >  443 [ACK] Seq=36629 Ack=39 Win=1522 Len=1368 TSval=608958 TSecr=373925124 [TCP segment of a reassembled PDU]"
"90","2018-08-07 18:07:31.165546","192.168.2.3","216.58.197.4","TLSv1.2","1434","Application Data [TCP segment of a reassembled PDU]"
"91","2018-08-07 18:07:31.165644","192.168.2.3","216.58.197.4","TCP","1434","49253  >  443 [ACK] Seq=39365 Ack=39 Win=1522 Len=1368 TSval=608958 TSecr=373925125 [TCP segment of a reassembled PDU]"
"92","2018-08-07 18:07:31.165829","192.168.2.3","216.58.197.4","TLSv1.2","1434","Application Data [TCP segment of a reassembled PDU]"
"99","2018-08-07 18:07:31.170833","192.168.2.3","216.58.197.4","TCP","1434","49253  >  443 [ACK] Seq=42101 Ack=39 Win=1522 Len=1368 TSval=608959 TSecr=373925126 [TCP segment of a reassembled PDU]"
"100","2018-08-07 18:07:31.170836","192.168.2.3","216.58.197.4","TLSv1.2","1434","Application Data [TCP segment of a reassembled PDU]"
"101","2018-08-07 18:07:31.171305","192.168.2.3","216.58.197.4","TCP","1434","49253  >  443 [ACK] Seq=44837 Ack=39 Win=1522 Len=1368 TSval=608959 TSecr=373925126 [TCP segment of a reassembled PDU]"
"102","2018-08-07 18:07:31.172361","192.168.2.3","216.58.197.4","TLSv1.2","1434","Application Data [TCP segment of a reassembled PDU]"
"103","2018-08-07 18:07:31.172600","192.168.2.3","216.58.197.4","TCP","1434","49253  >  443 [ACK] Seq=47573 Ack=39 Win=1522 Len=1368 TSval=608959 TSecr=373925126 [TCP segment of a reassembled PDU]"
"104","2018-08-07 18:07:31.172602","192.168.2.3","216.58.197.4","TLSv1.2","1434","Application Data [TCP segment of a reassembled PDU]"
"106","2018-08-07 18:07:31.172891","192.168.2.3","216.58.197.4","TCP","1434","49253  >  443 [ACK] Seq=50309 Ack=39 Win=1522 Len=1368 TSval=608959 TSecr=373925131 [TCP segment of a reassembled PDU]"
"107","2018-08-07 18:07:31.173059","192.168.2.3","216.58.197.4","TLSv1.2","1434","Application Data [TCP segment of a reassembled PDU]"
"108","2018-08-07 18:07:31.173223","192.168.2.3","216.58.197.4","TCP","1434","49253  >  443 [ACK] Seq=53045 Ack=39 Win=1522 Len=1368 TSval=608959 TSecr=373925131 [TCP segment of a reassembled PDU]"
"109","2018-08-07 18:07:31.173280","192.168.2.3","216.58.197.4","TLSv1.2","1058","Application Data, Application Data"
"115","2018-08-07 18:07:31.208564","192.168.2.3","216.58.197.4","TCP","66","49253  >  443 [ACK] Seq=55405 Ack=73 Win=1522 Len=0 TSval=608963 TSecr=373925136"
"116","2018-08-07 18:07:31.250956","192.168.2.3","216.58.197.4","TCP","1434","49253  >  443 [ACK] Seq=55405 Ack=73 Win=1522 Len=1368 TSval=608967 TSecr=373925136 [TCP segment of a reassembled PDU]"
"117","2018-08-07 18:07:31.251273","192.168.2.3","216.58.197.4","TCP","1434","49253  >  443 [ACK] Seq=56773 Ack=73 Win=1522 Len=1368 TSval=608967 TSecr=373925136 [TCP segment of a reassembled PDU]"
"118","2018-08-07 18:07:31.251275","192.168.2.3","216.58.197.4","TLSv1.2","212","Application Data"
"119","2018-08-07 18:07:31.251809","192.168.2.3","216.58.197.4","TCP","1434","49253  >  443 [ACK] Seq=58287 Ack=73 Win=1522 Len=1368 TSval=608967 TSecr=373925136 [TCP segment of a reassembled PDU]"
"120","2018-08-07 18:07:31.251812","192.168.2.3","216.58.197.4","TLSv1.2","155","Application Data"
"124","2018-08-07 18:07:31.373450","192.168.2.3","216.58.197.4","TCP","1434","49253  >  443 [ACK] Seq=59744 Ack=73 Win=1522 Len=1368 TSval=608979 TSecr=373925259 [TCP segment of a reassembled PDU]"
"125","2018-08-07 18:07:31.373453","192.168.2.3","216.58.197.4","TCP","1434","49253  >  443 [ACK] Seq=61112 Ack=73 Win=1522 Len=1368 TSval=608979 TSecr=373925259 [TCP segment of a reassembled PDU]"
"126","2018-08-07 18:07:31.373454","192.168.2.3","216.58.197.4","TLSv1.2","212","Application Data"
"127","2018-08-07 18:07:31.373744","192.168.2.3","216.58.197.4","TLSv1.2","1133","Application Data"
"132","2018-08-07 18:07:31.435798","192.168.2.3","216.58.197.4","TCP","66","49253  >  443 [ACK] Seq=63693 Ack=142 Win=1522 Len=0 TSval=608985 TSecr=373925398"
"133","2018-08-07 18:07:31.435966","192.168.2.3","216.58.197.4","TCP","66","49253  >  443 [ACK] Seq=63693 Ack=322 Win=1522 Len=0 TSval=608985 TSecr=373925398"
"135","2018-08-07 18:07:31.440470","192.168.2.3","216.58.197.4","TCP","66","49253  >  443 [ACK] Seq=63693 Ack=504 Win=1522 Len=0 TSval=608986 TSecr=373925400"
"137","2018-08-07 18:07:31.451109","192.168.2.3","216.58.197.4","TCP","66","49253  >  443 [ACK] Seq=63693 Ack=666 Win=1522 Len=0 TSval=608987 TSecr=373925413"
"138","2018-08-07 18:07:31.475589","192.168.2.3","216.58.197.4","TCP","1434","49253  >  443 [ACK] Seq=63693 Ack=666 Win=1522 Len=1368 TSval=608989 TSecr=373925413 [TCP segment of a reassembled PDU]"
"139","2018-08-07 18:07:31.476071","192.168.2.3","216.58.197.4","TCP","1434","49253  >  443 [ACK] Seq=65061 Ack=666 Win=1522 Len=1368 TSval=608989 TSecr=373925413 [TCP segment of a reassembled PDU]"
"140","2018-08-07 18:07:31.476074","192.168.2.3","216.58.197.4","TLSv1.2","212","Application Data"
"141","2018-08-07 18:07:31.476075","192.168.2.3","216.58.197.4","TLSv1.2","1139","Application Data"
"145","2018-08-07 18:07:31.599021","192.168.2.3","216.58.197.4","TCP","1434","49253  >  443 [ACK] Seq=67648 Ack=828 Win=1522 Len=1368 TSval=609001 TSecr=373925540 [TCP segment of a reassembled PDU]"
"146","2018-08-07 18:07:31.599188","192.168.2.3","216.58.197.4","TCP","1434","49253  >  443 [ACK] Seq=69016 Ack=828 Win=1522 Len=1368 TSval=609001 TSecr=373925540 [TCP segment of a reassembled PDU]"
"147","2018-08-07 18:07:31.599189","192.168.2.3","216.58.197.4","TLSv1.2","212","Application Data"
"148","2018-08-07 18:07:31.599444","192.168.2.3","216.58.197.4","TLSv1.2","489","Application Data"
"151","2018-08-07 18:07:31.705996","192.168.2.3","216.58.197.4","TCP","1434","49253  >  443 [ACK] Seq=70953 Ack=828 Win=1522 Len=1368 TSval=609012 TSecr=373925567 [TCP segment of a reassembled PDU]"
"152","2018-08-07 18:07:31.706001","192.168.2.3","216.58.197.4","TCP","1434","49253  >  443 [ACK] Seq=72321 Ack=828 Win=1522 Len=1368 TSval=609012 TSecr=373925567 [TCP segment of a reassembled PDU]"
"153","2018-08-07 18:07:31.706001","192.168.2.3","216.58.197.4","TLSv1.2","212","Application Data"
"154","2018-08-07 18:07:31.706092","192.168.2.3","216.58.197.4","TLSv1.2","1078","Application Data"
"159","2018-08-07 18:07:31.798512","192.168.2.3","216.58.197.4","TCP","66","49253  >  443 [ACK] Seq=74847 Ack=981 Win=1522 Len=0 TSval=609021 TSecr=373925713"
"160","2018-08-07 18:07:31.820491","192.168.2.3","216.58.197.4","TCP","1434","49253  >  443 [ACK] Seq=74847 Ack=981 Win=1522 Len=1368 TSval=609024 TSecr=373925713 [TCP segment of a reassembled PDU]"
"161","2018-08-07 18:07:31.820926","192.168.2.3","216.58.197.4","TCP","1434","49253  >  443 [ACK] Seq=76215 Ack=981 Win=1522 Len=1368 TSval=609024 TSecr=373925713 [TCP segment of a reassembled PDU]"
"162","2018-08-07 18:07:31.820927","192.168.2.3","216.58.197.4","TLSv1.2","212","Application Data"
"163","2018-08-07 18:07:31.820928","192.168.2.3","216.58.197.4","TLSv1.2","742","Application Data"
"166","2018-08-07 18:07:31.922676","192.168.2.3","216.58.197.4","TCP","1434","49253  >  443 [ACK] Seq=78405 Ack=981 Win=1522 Len=1368 TSval=609034 TSecr=373925789 [TCP segment of a reassembled PDU]"
"167","2018-08-07 18:07:31.923114","192.168.2.3","216.58.197.4","TCP","1434","49253  >  443 [ACK] Seq=79773 Ack=981 Win=1522 Len=1368 TSval=609034 TSecr=373925789 [TCP segment of a reassembled PDU]"
"168","2018-08-07 18:07:31.923117","192.168.2.3","216.58.197.4","TLSv1.2","212","Application Data"
"169","2018-08-07 18:07:31.923118","192.168.2.3","216.58.197.4","TLSv1.2","760","Application Data"
"172","2018-08-07 18:07:32.047969","192.168.2.3","216.58.197.4","TCP","1434","49253  >  443 [ACK] Seq=81981 Ack=981 Win=1522 Len=1368 TSval=609046 TSecr=373925931 [TCP segment of a reassembled PDU]"
"173","2018-08-07 18:07:32.047974","192.168.2.3","216.58.197.4","TCP","1434","49253  >  443 [ACK] Seq=83349 Ack=981 Win=1522 Len=1368 TSval=609046 TSecr=373925931 [TCP segment of a reassembled PDU]"
"174","2018-08-07 18:07:32.048124","192.168.2.3","216.58.197.4","TLSv1.2","212","Application Data"
"175","2018-08-07 18:07:32.048126","192.168.2.3","216.58.197.4","TLSv1.2","752","Application Data"
"179","2018-08-07 18:07:32.151785","192.168.2.3","216.58.197.4","TCP","1434","49253  >  443 [ACK] Seq=85549 Ack=981 Win=1522 Len=1368 TSval=609056 TSecr=373926016 [TCP segment of a reassembled PDU]"
"180","2018-08-07 18:07:32.151789","192.168.2.3","216.58.197.4","TCP","1434","49253  >  443 [ACK] Seq=86917 Ack=981 Win=1522 Len=1368 TSval=609056 TSecr=373926016 [TCP segment of a reassembled PDU]"
"181","2018-08-07 18:07:32.151790","192.168.2.3","216.58.197.4","TLSv1.2","212","Application Data"
"182","2018-08-07 18:07:32.151966","192.168.2.3","216.58.197.4","TLSv1.2","735","Application Data"
"185","2018-08-07 18:07:32.250198","192.168.2.3","216.58.197.4","TCP","1434","49253  >  443 [ACK] Seq=89100 Ack=981 Win=1522 Len=1368 TSval=609067 TSecr=373926120 [TCP segment of a reassembled PDU]"
"186","2018-08-07 18:07:32.250203","192.168.2.3","216.58.197.4","TCP","1434","49253  >  443 [ACK] Seq=90468 Ack=981 Win=1522 Len=1368 TSval=609067 TSecr=373926120 [TCP segment of a reassembled PDU]"
"187","2018-08-07 18:07:32.250313","192.168.2.3","216.58.197.4","TLSv1.2","212","Application Data"
"188","2018-08-07 18:07:32.250315","192.168.2.3","216.58.197.4","TLSv1.2","441","Application Data"
"192","2018-08-07 18:07:32.365833","192.168.2.3","216.58.197.4","TCP","1434","49253  >  443 [ACK] Seq=92357 Ack=981 Win=1522 Len=1368 TSval=609078 TSecr=373926218 [TCP segment of a reassembled PDU]"
"193","2018-08-07 18:07:32.365837","192.168.2.3","216.58.197.4","TCP","1434","49253  >  443 [ACK] Seq=93725 Ack=981 Win=1522 Len=1368 TSval=609078 TSecr=373926218 [TCP segment of a reassembled PDU]"
"194","2018-08-07 18:07:32.366102","192.168.2.3","216.58.197.4","TLSv1.2","212","Application Data"
"195","2018-08-07 18:07:32.366105","192.168.2.3","216.58.197.4","TLSv1.2","756","Application Data"
"198","2018-08-07 18:07:32.437460","192.168.2.3","216.58.197.4","TCP","66","49253  >  443 [ACK] Seq=95929 Ack=1196 Win=1522 Len=0 TSval=609085 TSecr=373926400"
"200","2018-08-07 18:07:32.457912","192.168.2.3","216.58.197.4","TCP","66","49253  >  443 [ACK] Seq=95929 Ack=1473 Win=1522 Len=0 TSval=609087 TSecr=373926414"
"201","2018-08-07 18:07:32.467205","192.168.2.3","216.58.197.4","TCP","1434","49253  >  443 [ACK] Seq=95929 Ack=1473 Win=1522 Len=1368 TSval=609088 TSecr=373926414 [TCP segment of a reassembled PDU]"
"202","2018-08-07 18:07:32.467428","192.168.2.3","216.58.197.4","TCP","1434","49253  >  443 [ACK] Seq=97297 Ack=1473 Win=1522 Len=1368 TSval=609088 TSecr=373926414 [TCP segment of a reassembled PDU]"
"203","2018-08-07 18:07:32.467430","192.168.2.3","216.58.197.4","TLSv1.2","212","Application Data"
"204","2018-08-07 18:07:32.467431","192.168.2.3","216.58.197.4","TLSv1.2","1088","Application Data"
"208","2018-08-07 18:07:32.590396","192.168.2.3","216.58.197.4","TCP","1434","49253  >  443 [ACK] Seq=99833 Ack=1473 Win=1522 Len=1368 TSval=609101 TSecr=373926435 [TCP segment of a reassembled PDU]"
"209","2018-08-07 18:07:32.590615","192.168.2.3","216.58.197.4","TCP","1434","49253  >  443 [ACK] Seq=101201 Ack=1473 Win=1522 Len=1368 TSval=609101 TSecr=373926435 [TCP segment of a reassembled PDU]"
"210","2018-08-07 18:07:32.590619","192.168.2.3","216.58.197.4","TLSv1.2","212","Application Data"
"211","2018-08-07 18:07:32.590947","192.168.2.3","216.58.197.4","TLSv1.2","755","Application Data"
"215","2018-08-07 18:07:32.692050","192.168.2.3","216.58.197.4","TCP","1434","49253  >  443 [ACK] Seq=103404 Ack=1473 Win=1522 Len=1368 TSval=609111 TSecr=373926559 [TCP segment of a reassembled PDU]"
"216","2018-08-07 18:07:32.692054","192.168.2.3","216.58.197.4","TCP","1434","49253  >  443 [ACK] Seq=104772 Ack=1473 Win=1522 Len=1368 TSval=609111 TSecr=373926559 [TCP segment of a reassembled PDU]"
"217","2018-08-07 18:07:32.692055","192.168.2.3","216.58.197.4","TLSv1.2","212","Application Data"
"218","2018-08-07 18:07:32.692325","192.168.2.3","216.58.197.4","TLSv1.2","756","Application Data"
"222","2018-08-07 18:07:32.810358","192.168.2.3","216.58.197.4","TCP","1434","49253  >  443 [ACK] Seq=106976 Ack=1473 Win=1522 Len=1368 TSval=609123 TSecr=373926660 [TCP segment of a reassembled PDU]"
"223","2018-08-07 18:07:32.810867","192.168.2.3","216.58.197.4","TCP","1434","49253  >  443 [ACK] Seq=108344 Ack=1473 Win=1522 Len=1368 TSval=609123 TSecr=373926660 [TCP segment of a reassembled PDU]"
"224","2018-08-07 18:07:32.810870","192.168.2.3","216.58.197.4","TLSv1.2","212","Application Data"
"225","2018-08-07 18:07:32.810871","192.168.2.3","216.58.197.4","TLSv1.2","768","Application Data"
"228","2018-08-07 18:07:32.914445","192.168.2.3","216.58.197.4","TCP","1434","49253  >  443 [ACK] Seq=110560 Ack=1473 Win=1522 Len=1368 TSval=609133 TSecr=373926779 [TCP segment of a reassembled PDU]"
"229","2018-08-07 18:07:32.914928","192.168.2.3","216.58.197.4","TCP","1434","49253  >  443 [ACK] Seq=111928 Ack=1473 Win=1522 Len=1368 TSval=609133 TSecr=373926779 [TCP segment of a reassembled PDU]"
"230","2018-08-07 18:07:32.914931","192.168.2.3","216.58.197.4","TLSv1.2","212","Application Data"
"231","2018-08-07 18:07:32.914932","192.168.2.3","216.58.197.4","TCP","1434","49253  >  443 [ACK] Seq=113442 Ack=1473 Win=1522 Len=1368 TSval=609133 TSecr=373926779 [TCP segment of a reassembled PDU]"
"232","2018-08-07 18:07:32.915059","192.168.2.3","216.58.197.4","TLSv1.2","155","Application Data"
"236","2018-08-07 18:07:33.011554","192.168.2.3","216.58.197.4","TCP","1434","49253  >  443 [ACK] Seq=114899 Ack=1473 Win=1522 Len=1368 TSval=609143 TSecr=373926883 [TCP segment of a reassembled PDU]"
"237","2018-08-07 18:07:33.011769","192.168.2.3","216.58.197.4","TCP","1434","49253  >  443 [ACK] Seq=116267 Ack=1473 Win=1522 Len=1368 TSval=609143 TSecr=373926883 [TCP segment of a reassembled PDU]"
"238","2018-08-07 18:07:33.011771","192.168.2.3","216.58.197.4","TLSv1.2","212","Application Data"
"239","2018-08-07 18:07:33.011772","192.168.2.3","216.58.197.4","TCP","1434","49253  >  443 [ACK] Seq=117781 Ack=1473 Win=1522 Len=1368 TSval=609143 TSecr=373926883 [TCP segment of a reassembled PDU]"
"240","2018-08-07 18:07:33.012136","192.168.2.3","216.58.197.4","TLSv1.2","155","Application Data"
"243","2018-08-07 18:07:33.101697","192.168.2.3","216.58.197.4","TCP","1434","49253  >  443 [ACK] Seq=119238 Ack=1473 Win=1522 Len=1368 TSval=609152 TSecr=373926980 [TCP segment of a reassembled PDU]"
"244","2018-08-07 18:07:33.101702","192.168.2.3","216.58.197.4","TCP","1434","49253  >  443 [ACK] Seq=120606 Ack=1473 Win=1522 Len=1368 TSval=609152 TSecr=373926980 [TCP segment of a reassembled PDU]"
"245","2018-08-07 18:07:33.101703","192.168.2.3","216.58.197.4","TLSv1.2","212","Application Data"
"246","2018-08-07 18:07:33.101911","192.168.2.3","216.58.197.4","TCP","1434","49253  >  443 [ACK] Seq=122120 Ack=1473 Win=1522 Len=1368 TSval=609152 TSecr=373926980 [TCP segment of a reassembled PDU]"
"247","2018-08-07 18:07:33.102050","192.168.2.3","216.58.197.4","TLSv1.2","155","Application Data"
"251","2018-08-07 18:07:33.204081","192.168.2.3","216.58.197.4","TCP","1434","49253  >  443 [ACK] Seq=123577 Ack=1473 Win=1522 Len=1368 TSval=609162 TSecr=373927070 [TCP segment of a reassembled PDU]"
"252","2018-08-07 18:07:33.204086","192.168.2.3","216.58.197.4","TCP","1434","49253  >  443 [ACK] Seq=124945 Ack=1473 Win=1522 Len=1368 TSval=609162 TSecr=373927070 [TCP segment of a reassembled PDU]"
"253","2018-08-07 18:07:33.204087","192.168.2.3","216.58.197.4","TLSv1.2","212","Application Data"
"254","2018-08-07 18:07:33.204539","192.168.2.3","216.58.197.4","TCP","1434","49253  >  443 [ACK] Seq=126459 Ack=1473 Win=1522 Len=1368 TSval=609162 TSecr=373927070 [TCP segment of a reassembled PDU]"
"255","2018-08-07 18:07:33.204541","192.168.2.3","216.58.197.4","TLSv1.2","155","Application Data"
"258","2018-08-07 18:07:33.292506","192.168.2.3","216.58.197.4","TCP","1434","49253  >  443 [ACK] Seq=127916 Ack=1473 Win=1522 Len=1368 TSval=609171 TSecr=373927172 [TCP segment of a reassembled PDU]"
"259","2018-08-07 18:07:33.292723","192.168.2.3","216.58.197.4","TCP","1434","49253  >  443 [ACK] Seq=129284 Ack=1473 Win=1522 Len=1368 TSval=609171 TSecr=373927172 [TCP segment of a reassembled PDU]"
"260","2018-08-07 18:07:33.292726","192.168.2.3","216.58.197.4","TLSv1.2","212","Application Data"
"261","2018-08-07 18:07:33.292726","192.168.2.3","216.58.197.4","TCP","1434","49253  >  443 [ACK] Seq=130798 Ack=1473 Win=1522 Len=1368 TSval=609171 TSecr=373927172 [TCP segment of a reassembled PDU]"
"262","2018-08-07 18:07:33.293027","192.168.2.3","216.58.197.4","TLSv1.2","155","Application Data"
"268","2018-08-07 18:07:33.381534","192.168.2.3","216.58.197.4","TCP","66","49253  >  443 [ACK] Seq=132255 Ack=1699 Win=1522 Len=0 TSval=609180 TSecr=373927342"
"269","2018-08-07 18:07:33.391047","192.168.2.3","216.58.197.4","TCP","1434","49253  >  443 [ACK] Seq=132255 Ack=1699 Win=1522 Len=1368 TSval=609181 TSecr=373927342 [TCP segment of a reassembled PDU]"
"270","2018-08-07 18:07:33.391571","192.168.2.3","216.58.197.4","TCP","1434","49253  >  443 [ACK] Seq=133623 Ack=1699 Win=1522 Len=1368 TSval=609181 TSecr=373927342 [TCP segment of a reassembled PDU]"
"271","2018-08-07 18:07:33.391574","192.168.2.3","216.58.197.4","TLSv1.2","212","Application Data"
"272","2018-08-07 18:07:33.391575","192.168.2.3","216.58.197.4","TCP","1434","49253  >  443 [ACK] Seq=135137 Ack=1699 Win=1522 Len=1368 TSval=609181 TSecr=373927342 [TCP segment of a reassembled PDU]"
"273","2018-08-07 18:07:33.391576","192.168.2.3","216.58.197.4","TLSv1.2","155","Application Data"
"278","2018-08-07 18:07:33.451467","192.168.2.3","216.58.197.4","TCP","66","49253  >  443 [ACK] Seq=136594 Ack=2021 Win=1522 Len=0 TSval=609187 TSecr=373927400"
"279","2018-08-07 18:07:33.491277","192.168.2.3","216.58.197.4","TCP","1434","49253  >  443 [ACK] Seq=136594 Ack=2021 Win=1522 Len=1368 TSval=609191 TSecr=373927400 [TCP segment of a reassembled PDU]"
"280","2018-08-07 18:07:33.491281","192.168.2.3","216.58.197.4","TCP","1434","49253  >  443 [ACK] Seq=137962 Ack=2021 Win=1522 Len=1368 TSval=609191 TSecr=373927400 [TCP segment of a reassembled PDU]"
"281","2018-08-07 18:07:33.491282","192.168.2.3","216.58.197.4","TLSv1.2","212","Application Data"
"282","2018-08-07 18:07:33.491684","192.168.2.3","216.58.197.4","TLSv1.2","1415","Application Data"
"288","2018-08-07 18:07:33.553570","192.168.2.3","216.58.197.4","TCP","66","49253  >  443 [ACK] Seq=140825 Ack=2250 Win=1522 Len=0 TSval=609197 TSecr=373927515"
"289","2018-08-07 18:07:33.587944","192.168.2.3","216.58.197.4","TCP","1434","49253  >  443 [ACK] Seq=140825 Ack=2250 Win=1522 Len=1368 TSval=609200 TSecr=373927515 [TCP segment of a reassembled PDU]"
"290","2018-08-07 18:07:33.587947","192.168.2.3","216.58.197.4","TCP","1434","49253  >  443 [ACK] Seq=142193 Ack=2250 Win=1522 Len=1368 TSval=609200 TSecr=373927515 [TCP segment of a reassembled PDU]"
"291","2018-08-07 18:07:33.588133","192.168.2.3","216.58.197.4","TLSv1.2","212","Application Data"
"292","2018-08-07 18:07:33.588317","192.168.2.3","216.58.197.4","TCP","1434","49253  >  443 [ACK] Seq=143707 Ack=2250 Win=1522 Len=1368 TSval=609200 TSecr=373927515 [TCP segment of a reassembled PDU]"
"293","2018-08-07 18:07:33.588320","192.168.2.3","216.58.197.4","TLSv1.2","155","Application Data"
"298","2018-08-07 18:07:33.630927","192.168.2.3","216.58.197.4","TCP","66","49253  >  443 [ACK] Seq=145164 Ack=2331 Win=1522 Len=0 TSval=609205 TSecr=373927556"
"304","2018-08-07 18:07:33.696279","192.168.2.3","216.58.197.4","TCP","66","49253  >  443 [ACK] Seq=145164 Ack=2734 Win=1522 Len=0 TSval=609207 TSecr=373927611"
"305","2018-08-07 18:07:33.696503","192.168.2.3","216.58.197.4","TCP","1434","49253  >  443 [ACK] Seq=145164 Ack=2734 Win=1522 Len=1368 TSval=609211 TSecr=373927611 [TCP segment of a reassembled PDU]"
"306","2018-08-07 18:07:33.696505","192.168.2.3","216.58.197.4","TCP","1434","49253  >  443 [ACK] Seq=146532 Ack=2734 Win=1522 Len=1368 TSval=609211 TSecr=373927611 [TCP segment of a reassembled PDU]"
"307","2018-08-07 18:07:33.696729","192.168.2.3","216.58.197.4","TLSv1.2","212","Application Data"
"308","2018-08-07 18:07:33.696730","192.168.2.3","216.58.197.4","TCP","1434","49253  >  443 [ACK] Seq=148046 Ack=3021 Win=1522 Len=1368 TSval=609211 TSecr=373927620 [TCP segment of a reassembled PDU]"
"309","2018-08-07 18:07:33.696940","192.168.2.3","216.58.197.4","TLSv1.2","155","Application Data"
"312","2018-08-07 18:07:33.701514","192.168.2.3","216.58.197.4","TCP","78","[TCP Dup ACK 308#1] 49253  >  443 [ACK] Seq=149503 Ack=3021 Win=1522 Len=0 TSval=609212 TSecr=373927659 SLE=2939 SRE=3021"
"314","2018-08-07 18:07:33.802632","192.168.2.3","216.58.197.4","TCP","1434","49253  >  443 [ACK] Seq=149503 Ack=3021 Win=1522 Len=1368 TSval=609222 TSecr=373927704 [TCP segment of a reassembled PDU]"
"315","2018-08-07 18:07:33.803165","192.168.2.3","216.58.197.4","TCP","1434","49253  >  443 [ACK] Seq=150871 Ack=3021 Win=1522 Len=1368 TSval=609222 TSecr=373927704 [TCP segment of a reassembled PDU]"
"316","2018-08-07 18:07:33.803168","192.168.2.3","216.58.197.4","TLSv1.2","212","Application Data"
"317","2018-08-07 18:07:33.803169","192.168.2.3","216.58.197.4","TCP","1434","49253  >  443 [ACK] Seq=152385 Ack=3021 Win=1522 Len=1368 TSval=609222 TSecr=373927704 [TCP segment of a reassembled PDU]"
"318","2018-08-07 18:07:33.803170","192.168.2.3","216.58.197.4","TLSv1.2","155","Application Data"
"324","2018-08-07 18:07:33.868374","192.168.2.3","216.58.197.4","TCP","66","49253  >  443 [ACK] Seq=153842 Ack=3209 Win=1522 Len=0 TSval=609229 TSecr=373927830"
"325","2018-08-07 18:07:33.868761","192.168.2.3","216.58.197.4","TCP","66","49253  >  443 [ACK] Seq=153842 Ack=3469 Win=1522 Len=0 TSval=609229 TSecr=373927830"
"326","2018-08-07 18:07:33.901066","192.168.2.3","216.58.197.4","TCP","1434","49253  >  443 [ACK] Seq=153842 Ack=3469 Win=1522 Len=1368 TSval=609232 TSecr=373927830 [TCP segment of a reassembled PDU]"
"327","2018-08-07 18:07:33.901431","192.168.2.3","216.58.197.4","TCP","1434","49253  >  443 [ACK] Seq=155210 Ack=3469 Win=1522 Len=1368 TSval=609232 TSecr=373927830 [TCP segment of a reassembled PDU]"
"328","2018-08-07 18:07:33.901434","192.168.2.3","216.58.197.4","TLSv1.2","212","Application Data"
"329","2018-08-07 18:07:33.901975","192.168.2.3","216.58.197.4","TCP","1434","49253  >  443 [ACK] Seq=156724 Ack=3469 Win=1522 Len=1368 TSval=609232 TSecr=373927830 [TCP segment of a reassembled PDU]"
"330","2018-08-07 18:07:33.901978","192.168.2.3","216.58.197.4","TLSv1.2","155","Application Data"
"335","2018-08-07 18:07:33.974251","192.168.2.3","216.58.197.4","TCP","66","49253  >  443 [ACK] Seq=158181 Ack=3915 Win=1522 Len=0 TSval=609239 TSecr=373927936"
"336","2018-08-07 18:07:34.003262","192.168.2.3","216.58.197.4","TCP","1434","49253  >  443 [ACK] Seq=158181 Ack=3915 Win=1522 Len=1368 TSval=609242 TSecr=373927936 [TCP segment of a reassembled PDU]"
"337","2018-08-07 18:07:34.003267","192.168.2.3","216.58.197.4","TCP","1434","49253  >  443 [ACK] Seq=159549 Ack=3915 Win=1522 Len=1368 TSval=609242 TSecr=373927936 [TCP segment of a reassembled PDU]"
"338","2018-08-07 18:07:34.003268","192.168.2.3","216.58.197.4","TLSv1.2","212","Application Data"
"339","2018-08-07 18:07:34.003489","192.168.2.3","216.58.197.4","TLSv1.2","1309","Application Data"
"342","2018-08-07 18:07:34.122350","192.168.2.3","216.58.197.4","TCP","1434","49253  >  443 [ACK] Seq=162306 Ack=3915 Win=1522 Len=1368 TSval=609254 TSecr=373927971 [TCP segment of a reassembled PDU]"
"343","2018-08-07 18:07:34.122818","192.168.2.3","216.58.197.4","TCP","1434","49253  >  443 [ACK] Seq=163674 Ack=3915 Win=1522 Len=1368 TSval=609254 TSecr=373927971 [TCP segment of a reassembled PDU]"
"344","2018-08-07 18:07:34.122820","192.168.2.3","216.58.197.4","TLSv1.2","212","Application Data"
"345","2018-08-07 18:07:34.125653","192.168.2.3","216.58.197.4","TCP","1434","49253  >  443 [ACK] Seq=165188 Ack=3915 Win=1522 Len=1368 TSval=609254 TSecr=373927971 [TCP segment of a reassembled PDU]"
"346","2018-08-07 18:07:34.125656","192.168.2.3","216.58.197.4","TLSv1.2","155","Application Data"
"350","2018-08-07 18:07:34.227830","192.168.2.3","216.58.197.4","TCP","1434","49253  >  443 [ACK] Seq=166645 Ack=3915 Win=1522 Len=1368 TSval=609264 TSecr=373928093 [TCP segment of a reassembled PDU]"
"351","2018-08-07 18:07:34.228231","192.168.2.3","216.58.197.4","TCP","1434","49253  >  443 [ACK] Seq=168013 Ack=3915 Win=1522 Len=1368 TSval=609264 TSecr=373928093 [TCP segment of a reassembled PDU]"
"352","2018-08-07 18:07:34.228233","192.168.2.3","216.58.197.4","TLSv1.2","212","Application Data"
"353","2018-08-07 18:07:34.228234","192.168.2.3","216.58.197.4","TLSv1.2","1421","Application Data"
"358","2018-08-07 18:07:34.284319","192.168.2.3","216.58.197.4","TCP","66","49253  >  443 [ACK] Seq=170882 Ack=4404 Win=1522 Len=0 TSval=609270 TSecr=373928246"
"359","2018-08-07 18:07:34.326751","192.168.2.3","216.58.197.4","TCP","1434","49253  >  443 [ACK] Seq=170882 Ack=4404 Win=1522 Len=1368 TSval=609274 TSecr=373928246 [TCP segment of a reassembled PDU]"
"360","2018-08-07 18:07:34.327179","192.168.2.3","216.58.197.4","TCP","1434","49253  >  443 [ACK] Seq=172250 Ack=4404 Win=1522 Len=1368 TSval=609274 TSecr=373928246 [TCP segment of a reassembled PDU]"
"361","2018-08-07 18:07:34.327182","192.168.2.3","216.58.197.4","TLSv1.2","212","Application Data"
"362","2018-08-07 18:07:34.327183","192.168.2.3","216.58.197.4","TLSv1.2","494","Application Data"
"368","2018-08-07 18:07:34.438634","192.168.2.3","216.58.197.4","TCP","66","49253  >  443 [ACK] Seq=174192 Ack=4536 Win=1522 Len=0 TSval=609286 TSecr=373928398"
"369","2018-08-07 18:07:34.446174","192.168.2.3","216.58.197.4","TCP","1434","49253  >  443 [ACK] Seq=174192 Ack=4536 Win=1522 Len=1368 TSval=609286 TSecr=373928398 [TCP segment of a reassembled PDU]"
"370","2018-08-07 18:07:34.446403","192.168.2.3","216.58.197.4","TCP","1434","49253  >  443 [ACK] Seq=175560 Ack=4536 Win=1522 Len=1368 TSval=609286 TSecr=373928398 [TCP segment of a reassembled PDU]"
"373","2018-08-07 18:07:34.452615","192.168.2.3","216.58.197.4","TLSv1.2","212","Application Data"
"374","2018-08-07 18:07:34.452617","192.168.2.3","216.58.197.4","TLSv1.2","590","Application Data"
"376","2018-08-07 18:07:34.488163","192.168.2.3","216.58.197.4","TCP","66","49253  >  443 [ACK] Seq=177598 Ack=4759 Win=1522 Len=0 TSval=609291 TSecr=373928414"
"379","2018-08-07 18:07:34.507963","192.168.2.3","216.58.197.4","TCP","66","49253  >  443 [ACK] Seq=177598 Ack=4881 Win=1522 Len=0 TSval=609292 TSecr=373928470"
"380","2018-08-07 18:07:34.508302","192.168.2.3","216.58.197.4","TCP","66","49253  >  443 [ACK] Seq=177598 Ack=5102 Win=1522 Len=0 TSval=609293 TSecr=373928470"
"381","2018-08-07 18:07:34.547644","192.168.2.3","216.58.197.4","TCP","1434","49253  >  443 [ACK] Seq=177598 Ack=5102 Win=1522 Len=1368 TSval=609296 TSecr=373928470 [TCP segment of a reassembled PDU]"
"382","2018-08-07 18:07:34.547649","192.168.2.3","216.58.197.4","TCP","1434","49253  >  443 [ACK] Seq=178966 Ack=5102 Win=1522 Len=1368 TSval=609296 TSecr=373928470 [TCP segment of a reassembled PDU]"
"383","2018-08-07 18:07:34.547650","192.168.2.3","216.58.197.4","TLSv1.2","212","Application Data"
"384","2018-08-07 18:07:34.547951","192.168.2.3","216.58.197.4","TLSv1.2","1188","Application Data"
"387","2018-08-07 18:07:34.649837","192.168.2.3","216.58.197.4","TCP","1434","49253  >  443 [ACK] Seq=181602 Ack=5102 Win=1522 Len=1368 TSval=609307 TSecr=373928516 [TCP segment of a reassembled PDU]"
"388","2018-08-07 18:07:34.649910","192.168.2.3","216.58.197.4","TCP","1434","49253  >  443 [ACK] Seq=182970 Ack=5102 Win=1522 Len=1368 TSval=609307 TSecr=373928516 [TCP segment of a reassembled PDU]"
"389","2018-08-07 18:07:34.650291","192.168.2.3","216.58.197.4","TLSv1.2","212","Application Data"
"390","2018-08-07 18:07:34.650294","192.168.2.3","216.58.197.4","TLSv1.2","517","Application Data"
"394","2018-08-07 18:07:34.660478","192.168.2.3","172.217.27.174","TCP","66","52318  >  443 [ACK] Seq=1 Ack=1 Win=279 Len=0 TSval=609308 TSecr=260510511"
"396","2018-08-07 18:07:34.764501","192.168.2.3","216.58.197.4","TCP","1434","49253  >  443 [ACK] Seq=184935 Ack=5102 Win=1522 Len=1368 TSval=609318 TSecr=373928618 [TCP segment of a reassembled PDU]"
"397","2018-08-07 18:07:34.764789","192.168.2.3","216.58.197.4","TCP","1434","49253  >  443 [ACK] Seq=186303 Ack=5102 Win=1522 Len=1368 TSval=609318 TSecr=373928618 [TCP segment of a reassembled PDU]"
"398","2018-08-07 18:07:34.764791","192.168.2.3","216.58.197.4","TLSv1.2","212","Application Data"
"399","2018-08-07 18:07:34.764792","192.168.2.3","216.58.197.4","TLSv1.2","477","Application Data"
"404","2018-08-07 18:07:34.833385","192.168.2.3","216.58.197.4","TCP","66","49253  >  443 [ACK] Seq=188228 Ack=5337 Win=1522 Len=0 TSval=609325 TSecr=373928794"
"405","2018-08-07 18:07:34.867921","192.168.2.3","216.58.197.4","TCP","1434","49253  >  443 [ACK] Seq=188228 Ack=5337 Win=1522 Len=1368 TSval=609328 TSecr=373928794 [TCP segment of a reassembled PDU]"
"406","2018-08-07 18:07:34.868457","192.168.2.3","216.58.197.4","TCP","1434","49253  >  443 [ACK] Seq=189596 Ack=5337 Win=1522 Len=1368 TSval=609328 TSecr=373928794 [TCP segment of a reassembled PDU]"
"407","2018-08-07 18:07:34.868460","192.168.2.3","216.58.197.4","TLSv1.2","212","Application Data"
"408","2018-08-07 18:07:34.868460","192.168.2.3","216.58.197.4","TLSv1.2","466","Application Data"
"414","2018-08-07 18:07:34.930354","192.168.2.3","216.58.197.4","TCP","66","49253  >  443 [ACK] Seq=191510 Ack=5789 Win=1522 Len=0 TSval=609335 TSecr=373928891"
"415","2018-08-07 18:07:34.957221","192.168.2.3","216.58.197.4","TCP","1434","49253  >  443 [ACK] Seq=191510 Ack=5789 Win=1522 Len=1368 TSval=609337 TSecr=373928891 [TCP segment of a reassembled PDU]"
"416","2018-08-07 18:07:34.957244","192.168.2.3","216.58.197.4","TCP","1434","49253  >  443 [ACK] Seq=192878 Ack=5789 Win=1522 Len=1368 TSval=609337 TSecr=373928891 [TCP segment of a reassembled PDU]"
"417","2018-08-07 18:07:34.957488","192.168.2.3","216.58.197.4","TLSv1.2","212","Application Data"
"418","2018-08-07 18:07:34.957490","192.168.2.3","216.58.197.4","TLSv1.2","129","Application Data"
"419","2018-08-07 18:07:34.957491","192.168.2.3","216.58.197.4","TLSv1.2","102","Application Data"
"420","2018-08-07 18:07:34.960426","192.168.2.3","8.8.8.8","DNS","79","Standard query 0xc4e5 A play.googleapis.com"
"421","2018-08-07 18:07:34.961052","192.168.2.3","8.8.8.8","DNS","79","Standard query 0x8dd7 AAAA play.googleapis.com"
"426","2018-08-07 18:07:34.993145","192.168.2.3","216.58.197.4","TCP","66","49253  >  443 [ACK] Seq=194491 Ack=6663 Win=1522 Len=0 TSval=609341 TSecr=373928948"
"429","2018-08-07 18:07:35.017778","192.168.2.3","172.217.161.234","TCP","74","58389  >  443 [SYN] Seq=0 Win=14600 Len=0 MSS=1460 SACK_PERM=1 TSval=609343 TSecr=0 WS=64"
"431","2018-08-07 18:07:35.023809","192.168.2.3","172.217.161.234","TCP","66","58389  >  443 [ACK] Seq=1 Ack=1 Win=14656 Len=0 TSval=609344 TSecr=3658444031"
"432","2018-08-07 18:07:35.028647","192.168.2.3","172.217.161.234","TLSv1.2","583","Client Hello"
"435","2018-08-07 18:07:35.034725","192.168.2.3","172.217.161.234","TCP","66","58389  >  443 [ACK] Seq=518 Ack=153 Win=15680 Len=0 TSval=609345 TSecr=3658444042"
"436","2018-08-07 18:07:35.038002","192.168.2.3","172.217.161.234","TLSv1.2","266","Change Cipher Spec, Encrypted Handshake Message, Encrypted Handshake Message"
"438","2018-08-07 18:07:35.070027","192.168.2.3","172.217.161.234","TLSv1.2","151","Application Data"
"439","2018-08-07 18:07:35.070030","192.168.2.3","172.217.161.234","TLSv1.2","96","Application Data"
"440","2018-08-07 18:07:35.070030","192.168.2.3","172.217.161.234","TLSv1.2","301","Application Data"
"441","2018-08-07 18:07:35.070391","192.168.2.3","172.217.161.234","TCP","1434","58389  >  443 [ACK] Seq=1068 Ack=214 Win=15680 Len=1368 TSval=609349 TSecr=3658444051 [TCP segment of a reassembled PDU]"
"442","2018-08-07 18:07:35.070393","192.168.2.3","172.217.161.234","TCP","1434","58389  >  443 [ACK] Seq=2436 Ack=214 Win=15680 Len=1368 TSval=609349 TSecr=3658444051 [TCP segment of a reassembled PDU]"
"443","2018-08-07 18:07:35.070394","192.168.2.3","172.217.161.234","TLSv1.2","212","Application Data"
"444","2018-08-07 18:07:35.070538","192.168.2.3","172.217.161.234","TLSv1.2","862","Application Data"
"449","2018-08-07 18:07:35.108135","192.168.2.3","172.217.161.234","TCP","66","58389  >  443 [ACK] Seq=4746 Ack=244 Win=15680 Len=0 TSval=609353 TSecr=3658444083"
"450","2018-08-07 18:07:35.108540","192.168.2.3","172.217.161.234","TCP","66","58387  >  443 [ACK] Seq=1 Ack=1 Win=296 Len=0 TSval=609353 TSecr=3015438500"
"456","2018-08-07 18:07:35.183361","192.168.2.3","172.217.161.234","TCP","66","58389  >  443 [ACK] Seq=4746 Ack=440 Win=16768 Len=0 TSval=609360 TSecr=3658444187"
"457","2018-08-07 18:07:35.183364","192.168.2.3","172.217.161.234","TCP","66","58389  >  443 [ACK] Seq=4746 Ack=719 Win=17856 Len=0 TSval=609360 TSecr=3658444187"
"458","2018-08-07 18:07:35.183365","192.168.2.3","172.217.161.234","TCP","66","58389  >  443 [ACK] Seq=4746 Ack=921 Win=18944 Len=0 TSval=609360 TSecr=3658444187"
"459","2018-08-07 18:07:35.186581","192.168.2.3","172.217.161.234","TLSv1.2","104","Application Data"
"462","2018-08-07 18:07:35.238153","192.168.2.3","216.58.197.4","TCP","66","49253  >  443 [ACK] Seq=194491 Ack=6785 Win=1522 Len=0 TSval=609366 TSecr=373929168"
"465","2018-08-07 18:07:35.248678","192.168.2.3","216.58.197.4","TCP","66","49253  >  443 [ACK] Seq=194491 Ack=8592 Win=1512 Len=0 TSval=609367 TSecr=373929210"
"469","2018-08-07 18:07:35.433796","192.168.2.3","216.58.197.4","TCP","66","49253  >  443 [ACK] Seq=194491 Ack=8727 Win=1522 Len=0 TSval=609385 TSecr=373929396"
"470","2018-08-07 18:07:35.434039","192.168.2.3","216.58.197.4","TCP","66","49253  >  443 [ACK] Seq=194491 Ack=9360 Win=1522 Len=0 TSval=609385 TSecr=373929396"
"481","2018-08-07 18:07:35.442287","192.168.2.3","216.58.197.4","TCP","66","49253  >  443 [ACK] Seq=194491 Ack=13754 Win=1522 Len=0 TSval=609386 TSecr=373929399"
"484","2018-08-07 18:07:35.443330","192.168.2.3","216.58.197.4","TCP","66","49253  >  443 [ACK] Seq=194491 Ack=16590 Win=1522 Len=0 TSval=609386 TSecr=373929401"
"485","2018-08-07 18:07:35.443332","192.168.2.3","216.58.197.4","TCP","66","49253  >  443 [ACK] Seq=194491 Ack=18268 Win=1522 Len=0 TSval=609386 TSecr=373929401"
"486","2018-08-07 18:07:35.444062","192.168.2.3","216.58.197.4","TCP","66","49253  >  443 [ACK] Seq=194491 Ack=21104 Win=1522 Len=0 TSval=609386 TSecr=373929405"
"491","2018-08-07 18:07:35.447334","192.168.2.3","216.58.197.4","TCP","66","49253  >  443 [ACK] Seq=194491 Ack=22684 Win=1522 Len=0 TSval=609386 TSecr=373929405"
"492","2018-08-07 18:07:35.447612","192.168.2.3","216.58.197.4","TCP","66","49253  >  443 [ACK] Seq=194491 Ack=27230 Win=1522 Len=0 TSval=609386 TSecr=373929408"
"510","2018-08-07 18:07:35.474394","192.168.2.3","216.58.197.4","TCP","66","49253  >  443 [ACK] Seq=194491 Ack=41916 Win=1522 Len=0 TSval=609389 TSecr=373929430"
"515","2018-08-07 18:07:35.475669","192.168.2.3","216.58.197.4","TCP","66","49253  >  443 [ACK] Seq=194491 Ack=44956 Win=1522 Len=0 TSval=609389 TSecr=373929435"
"531","2018-08-07 18:07:35.480669","192.168.2.3","216.58.197.4","TCP","66","49253  >  443 [ACK] Seq=194491 Ack=47792 Win=1522 Len=0 TSval=609389 TSecr=373929438"
"532","2018-08-07 18:07:35.486665","192.168.2.3","216.58.197.4","TCP","66","49253  >  443 [ACK] Seq=194491 Ack=49300 Win=1522 Len=0 TSval=609390 TSecr=373929438"
"533","2018-08-07 18:07:35.487061","192.168.2.3","216.58.197.4","TCP","66","49253  >  443 [ACK] Seq=194491 Ack=55245 Win=1522 Len=0 TSval=609390 TSecr=373929440"
"534","2018-08-07 18:07:35.487470","192.168.2.3","216.58.197.4","TCP","66","49253  >  443 [ACK] Seq=194491 Ack=60429 Win=1522 Len=0 TSval=609390 TSecr=373929442"
"535","2018-08-07 18:07:35.526975","192.168.2.3","216.58.197.4","TLSv1.2","104","Application Data"