"No.","Time","Source","Destination","Protocol","Length","Info"
"1","2018-08-07 17:36:05.077142","192.168.2.3","172.217.27.174","TCP","66","52263  >  443 [ACK] Seq=1 Ack=1 Win=296 Len=0 TSval=420352 TSecr=4029480667"
"3","2018-08-07 17:36:08.339335","192.168.2.3","216.58.197.4","TLSv1.2","156","Application Data"
"4","2018-08-07 17:36:08.339339","192.168.2.3","216.58.197.4","TLSv1.2","104","Application Data"
"5","2018-08-07 17:36:08.341222","192.168.2.3","216.58.197.4","TLSv1.2","159","Application Data"
"9","2018-08-07 17:36:08.350198","192.168.2.3","216.58.197.4","TCP","1434","49253  >  443 [ACK] Seq=222 Ack=39 Win=998 Len=1368 TSval=420679 TSecr=372042303 [TCP segment of a reassembled PDU]"
"10","2018-08-07 17:36:08.350453","192.168.2.3","216.58.197.4","TCP","1434","49253  >  443 [ACK] Seq=1590 Ack=39 Win=998 Len=1368 TSval=420679 TSecr=372042303 [TCP segment of a reassembled PDU]"
"11","2018-08-07 17:36:08.350454","192.168.2.3","216.58.197.4","TLSv1.2","212","Application Data"
"12","2018-08-07 17:36:08.350676","192.168.2.3","216.58.197.4","TCP","1434","49253  >  443 [ACK] Seq=3104 Ack=39 Win=998 Len=1368 TSval=420679 TSecr=372042303 [TCP segment of a reassembled PDU]"
"13","2018-08-07 17:36:08.350678","192.168.2.3","216.58.197.4","TLSv1.2","222","Application Data"
"14","2018-08-07 17:36:08.351080","192.168.2.3","216.58.197.4","TCP","1434","49253  >  443 [ACK] Seq=4628 Ack=39 Win=998 Len=1368 TSval=420679 TSecr=372042303 [TCP segment of a reassembled PDU]"
"15","2018-08-07 17:36:08.351252","192.168.2.3","216.58.197.4","TCP","1434","49253  >  443 [ACK] Seq=5996 Ack=39 Win=998 Len=1368 TSval=420679 TSecr=372042303 [TCP segment of a reassembled PDU]"
"16","2018-08-07 17:36:08.351254","192.168.2.3","216.58.197.4","TLSv1.2","212","Application Data"
"17","2018-08-07 17:36:08.351570","192.168.2.3","216.58.197.4","TCP","1434","49253  >  443 [ACK] Seq=7510 Ack=39 Win=998 Len=1368 TSval=420679 TSecr=372042303 [TCP segment of a reassembled PDU]"
"23","2018-08-07 17:36:08.358306","192.168.2.3","216.58.197.4","TLSv1.2","1434","Application Data [TCP segment of a reassembled PDU]"
"24","2018-08-07 17:36:08.358779","192.168.2.3","216.58.197.4","TCP","1434","49253  >  443 [ACK] Seq=10246 Ack=39 Win=998 Len=1368 TSval=420679 TSecr=372042313 [TCP segment of a reassembled PDU]"
"25","2018-08-07 17:36:08.358781","192.168.2.3","216.58.197.4","TLSv1.2","1434","Application Data [TCP segment of a reassembled PDU]"
"26","2018-08-07 17:36:08.359070","192.168.2.3","216.58.197.4","TLSv1.2","1434","Application Data [TCP segment of a reassembled PDU]"
"27","2018-08-07 17:36:08.359073","192.168.2.3","216.58.197.4","TCP","1434","49253  >  443 [ACK] Seq=14350 Ack=39 Win=998 Len=1368 TSval=420679 TSecr=372042313 [TCP segment of a reassembled PDU]"
"28","2018-08-07 17:36:08.359238","192.168.2.3","216.58.197.4","TLSv1.2","1434","Application Data [TCP segment of a reassembled PDU]"
"29","2018-08-07 17:36:08.359572","192.168.2.3","216.58.197.4","TLSv1.2","1434","Application Data [TCP segment of a reassembled PDU]"
"30","2018-08-07 17:36:08.359574","192.168.2.3","216.58.197.4","TCP","1434","49253  >  443 [ACK] Seq=18454 Ack=39 Win=998 Len=1368 TSval=420680 TSecr=372042313 [TCP segment of a reassembled PDU]"
"31","2018-08-07 17:36:08.360068","192.168.2.3","216.58.197.4","TLSv1.2","1434","Application Data [TCP segment of a reassembled PDU]"
"32","2018-08-07 17:36:08.360391","192.168.2.3","216.58.197.4","TLSv1.2","1434","Application Data [TCP segment of a reassembled PDU]"
"33","2018-08-07 17:36:08.360393","192.168.2.3","216.58.197.4","TCP","1434","49253  >  443 [ACK] Seq=22558 Ack=39 Win=998 Len=1368 TSval=420680 TSecr=372042314 [TCP segment of a reassembled PDU]"
"34","2018-08-07 17:36:08.360492","192.168.2.3","216.58.197.4","TLSv1.2","1434","Application Data [TCP segment of a reassembled PDU]"
"35","2018-08-07 17:36:08.360655","192.168.2.3","216.58.197.4","TLSv1.2","1434","Application Data [TCP segment of a reassembled PDU]"
"36","2018-08-07 17:36:08.360960","192.168.2.3","216.58.197.4","TCP","1434","49253  >  443 [ACK] Seq=26662 Ack=39 Win=998 Len=1368 TSval=420680 TSecr=372042314 [TCP segment of a reassembled PDU]"
"37","2018-08-07 17:36:08.361067","192.168.2.3","216.58.197.4","TLSv1.2","1434","Application Data [TCP segment of a reassembled PDU]"
"42","2018-08-07 17:36:08.364774","192.168.2.3","216.58.197.4","TLSv1.2","1434","Application Data [TCP segment of a reassembled PDU]"
"45","2018-08-07 17:36:08.365131","192.168.2.3","216.58.197.4","TCP","1434","49253  >  443 [ACK] Seq=30766 Ack=39 Win=998 Len=1368 TSval=420680 TSecr=372042321 [TCP segment of a reassembled PDU]"
"47","2018-08-07 17:36:08.365269","192.168.2.3","216.58.197.4","TCP","1434","49253  >  443 [ACK] Seq=32134 Ack=39 Win=998 Len=1368 TSval=420680 TSecr=372042321 [TCP segment of a reassembled PDU]"
"48","2018-08-07 17:36:08.365562","192.168.2.3","216.58.197.4","TLSv1.2","1434","Application Data [TCP segment of a reassembled PDU]"
"49","2018-08-07 17:36:08.365564","192.168.2.3","216.58.197.4","TLSv1.2","1434","Application Data [TCP segment of a reassembled PDU]"
"50","2018-08-07 17:36:08.365785","192.168.2.3","216.58.197.4","TCP","1434","49253  >  443 [ACK] Seq=36238 Ack=39 Win=998 Len=1368 TSval=420680 TSecr=372042322 [TCP segment of a reassembled PDU]"
"51","2018-08-07 17:36:08.366205","192.168.2.3","216.58.197.4","TLSv1.2","1434","Application Data [TCP segment of a reassembled PDU]"
"52","2018-08-07 17:36:08.366207","192.168.2.3","216.58.197.4","TLSv1.2","1434","Application Data [TCP segment of a reassembled PDU]"
"53","2018-08-07 17:36:08.366404","192.168.2.3","216.58.197.4","TCP","1434","49253  >  443 [ACK] Seq=40342 Ack=39 Win=998 Len=1368 TSval=420680 TSecr=372042322 [TCP segment of a reassembled PDU]"
"59","2018-08-07 17:36:08.371131","192.168.2.3","216.58.197.4","TLSv1.2","1434","Application Data [TCP segment of a reassembled PDU]"
"60","2018-08-07 17:36:08.371864","192.168.2.3","216.58.197.4","TLSv1.2","1434","Application Data [TCP segment of a reassembled PDU]"
"61","2018-08-07 17:36:08.371866","192.168.2.3","216.58.197.4","TCP","1434","49253  >  443 [ACK] Seq=44446 Ack=39 Win=998 Len=1368 TSval=420681 TSecr=372042322 [TCP segment of a reassembled PDU]"
"62","2018-08-07 17:36:08.372307","192.168.2.3","216.58.197.4","TLSv1.2","1434","Application Data [TCP segment of a reassembled PDU]"
"63","2018-08-07 17:36:08.372309","192.168.2.3","216.58.197.4","TLSv1.2","1434","Application Data [TCP segment of a reassembled PDU]"
"64","2018-08-07 17:36:08.372310","192.168.2.3","216.58.197.4","TCP","1434","49253  >  443 [ACK] Seq=48550 Ack=39 Win=998 Len=1368 TSval=420681 TSecr=372042323 [TCP segment of a reassembled PDU]"
"65","2018-08-07 17:36:08.372859","192.168.2.3","216.58.197.4","TLSv1.2","1434","Application Data [TCP segment of a reassembled PDU]"
"66","2018-08-07 17:36:08.372861","192.168.2.3","216.58.197.4","TLSv1.2","1434","Application Data [TCP segment of a reassembled PDU]"
"67","2018-08-07 17:36:08.373161","192.168.2.3","216.58.197.4","TCP","1434","49253  >  443 [PSH, ACK] Seq=52654 Ack=39 Win=998 Len=1368 TSval=420681 TSecr=372042324 [TCP segment of a reassembled PDU]"
"68","2018-08-07 17:36:08.373436","192.168.2.3","216.58.197.4","TLSv1.2","1434","Application Data [TCP segment of a reassembled PDU]"
"69","2018-08-07 17:36:08.373888","192.168.2.3","216.58.197.4","TLSv1.2","1434","Application Data [TCP segment of a reassembled PDU]"
"70","2018-08-07 17:36:08.373890","192.168.2.3","216.58.197.4","TCP","1434","49253  >  443 [ACK] Seq=56758 Ack=39 Win=998 Len=1368 TSval=420681 TSecr=372042328 [TCP segment of a reassembled PDU]"
"71","2018-08-07 17:36:08.374125","192.168.2.3","216.58.197.4","TLSv1.2","1434","Application Data [TCP segment of a reassembled PDU]"
"72","2018-08-07 17:36:08.374127","192.168.2.3","216.58.197.4","TLSv1.2","653","Application Data"
"80","2018-08-07 17:36:08.479558","192.168.2.3","216.58.197.4","TCP","1434","49253  >  443 [ACK] Seq=60081 Ack=39 Win=998 Len=1368 TSval=420692 TSecr=372042337 [TCP segment of a reassembled PDU]"
"81","2018-08-07 17:36:08.480005","192.168.2.3","216.58.197.4","TCP","1434","49253  >  443 [ACK] Seq=61449 Ack=39 Win=998 Len=1368 TSval=420692 TSecr=372042337 [TCP segment of a reassembled PDU]"
"82","2018-08-07 17:36:08.480008","192.168.2.3","216.58.197.4","TLSv1.2","212","Application Data"
"83","2018-08-07 17:36:08.480009","192.168.2.3","216.58.197.4","TCP","1434","49253  >  443 [ACK] Seq=62963 Ack=39 Win=998 Len=1368 TSval=420692 TSecr=372042337 [TCP segment of a reassembled PDU]"
"84","2018-08-07 17:36:08.480010","192.168.2.3","216.58.197.4","TLSv1.2","155","Application Data"
"91","2018-08-07 17:36:08.595529","192.168.2.3","216.58.197.4","TCP","66","49253  >  443 [ACK] Seq=64420 Ack=637 Win=998 Len=0 TSval=420703 TSecr=372042549"
"92","2018-08-07 17:36:08.604013","192.168.2.3","216.58.197.4","TCP","1434","49253  >  443 [ACK] Seq=64420 Ack=637 Win=998 Len=1368 TSval=420704 TSecr=372042549 [TCP segment of a reassembled PDU]"
"93","2018-08-07 17:36:08.604016","192.168.2.3","216.58.197.4","TCP","1434","49253  >  443 [ACK] Seq=65788 Ack=637 Win=998 Len=1368 TSval=420704 TSecr=372042549 [TCP segment of a reassembled PDU]"
"94","2018-08-07 17:36:08.604202","192.168.2.3","216.58.197.4","TLSv1.2","212","Application Data"
"95","2018-08-07 17:36:08.604368","192.168.2.3","216.58.197.4","TCP","1434","49253  >  443 [ACK] Seq=67302 Ack=637 Win=998 Len=1368 TSval=420704 TSecr=372042549 [TCP segment of a reassembled PDU]"
"96","2018-08-07 17:36:08.604370","192.168.2.3","216.58.197.4","TLSv1.2","155","Application Data"
"99","2018-08-07 17:36:08.647304","192.168.2.3","216.58.197.4","TCP","66","49253  >  443 [ACK] Seq=68759 Ack=795 Win=998 Len=0 TSval=420709 TSecr=372042565"
"100","2018-08-07 17:36:08.702220","192.168.2.3","216.58.197.4","TCP","1434","49253  >  443 [ACK] Seq=68759 Ack=795 Win=998 Len=1368 TSval=420714 TSecr=372042565 [TCP segment of a reassembled PDU]"
"101","2018-08-07 17:36:08.702488","192.168.2.3","216.58.197.4","TCP","1434","49253  >  443 [ACK] Seq=70127 Ack=795 Win=998 Len=1368 TSval=420714 TSecr=372042565 [TCP segment of a reassembled PDU]"
"102","2018-08-07 17:36:08.702490","192.168.2.3","216.58.197.4","TLSv1.2","212","Application Data"
"103","2018-08-07 17:36:08.702491","192.168.2.3","216.58.197.4","TLSv1.2","729","Application Data"
"107","2018-08-07 17:36:08.743741","192.168.2.3","216.58.197.4","TCP","66","49253  >  443 [ACK] Seq=72304 Ack=962 Win=998 Len=0 TSval=420718 TSecr=372042701"
"108","2018-08-07 17:36:08.823858","192.168.2.3","216.58.197.4","TCP","1434","49253  >  443 [ACK] Seq=72304 Ack=962 Win=998 Len=1368 TSval=420726 TSecr=372042701 [TCP segment of a reassembled PDU]"
"109","2018-08-07 17:36:08.824307","192.168.2.3","216.58.197.4","TCP","1434","49253  >  443 [ACK] Seq=73672 Ack=962 Win=998 Len=1368 TSval=420726 TSecr=372042701 [TCP segment of a reassembled PDU]"
"110","2018-08-07 17:36:08.824309","192.168.2.3","216.58.197.4","TLSv1.2","212","Application Data"
"111","2018-08-07 17:36:08.824310","192.168.2.3","216.58.197.4","TLSv1.2","657","Application Data"
"114","2018-08-07 17:36:08.926154","192.168.2.3","216.58.197.4","TCP","1434","49253  >  443 [ACK] Seq=75777 Ack=962 Win=998 Len=1368 TSval=420736 TSecr=372042787 [TCP segment of a reassembled PDU]"
"116","2018-08-07 17:36:08.926515","192.168.2.3","216.58.197.4","TCP","1434","49253  >  443 [ACK] Seq=77145 Ack=962 Win=998 Len=1368 TSval=420736 TSecr=372042787 [TCP segment of a reassembled PDU]"
"117","2018-08-07 17:36:08.926517","192.168.2.3","216.58.197.4","TLSv1.2","212","Application Data"
"118","2018-08-07 17:36:08.926518","192.168.2.3","216.58.197.4","TLSv1.2","1032","Application Data"
"119","2018-08-07 17:36:08.927495","192.168.2.3","216.58.197.4","TCP","66","49253  >  443 [ACK] Seq=79625 Ack=1163 Win=998 Len=0 TSval=420737 TSecr=372042884"
"122","2018-08-07 17:36:09.026295","192.168.2.3","216.58.197.4","TCP","1434","49253  >  443 [ACK] Seq=79625 Ack=1163 Win=998 Len=1368 TSval=420746 TSecr=372042889 [TCP segment of a reassembled PDU]"
"123","2018-08-07 17:36:09.026648","192.168.2.3","216.58.197.4","TCP","1434","49253  >  443 [ACK] Seq=80993 Ack=1163 Win=998 Len=1368 TSval=420746 TSecr=372042889 [TCP segment of a reassembled PDU]"
"124","2018-08-07 17:36:09.026655","192.168.2.3","216.58.197.4","TLSv1.2","212","Application Data"
"125","2018-08-07 17:36:09.026656","192.168.2.3","216.58.197.4","TLSv1.2","350","Application Data"
"128","2018-08-07 17:36:09.145000","192.168.2.3","216.58.197.4","TCP","1434","49253  >  443 [ACK] Seq=82791 Ack=1163 Win=998 Len=1368 TSval=420758 TSecr=372042989 [TCP segment of a reassembled PDU]"
"129","2018-08-07 17:36:09.145297","192.168.2.3","216.58.197.4","TCP","1434","49253  >  443 [ACK] Seq=84159 Ack=1163 Win=998 Len=1368 TSval=420758 TSecr=372042989 [TCP segment of a reassembled PDU]"
"130","2018-08-07 17:36:09.145300","192.168.2.3","216.58.197.4","TLSv1.2","212","Application Data"
"131","2018-08-07 17:36:09.145301","192.168.2.3","216.58.197.4","TCP","1434","49253  >  443 [ACK] Seq=85673 Ack=1163 Win=998 Len=1368 TSval=420758 TSecr=372042989 [TCP segment of a reassembled PDU]"
"132","2018-08-07 17:36:09.145302","192.168.2.3","216.58.197.4","TLSv1.2","155","Application Data"
"135","2018-08-07 17:36:09.214208","192.168.2.3","216.58.197.4","TCP","1434","49253  >  443 [ACK] Seq=87130 Ack=1163 Win=998 Len=1368 TSval=420765 TSecr=372043108 [TCP segment of a reassembled PDU]"
"136","2018-08-07 17:36:09.214375","192.168.2.3","216.58.197.4","TCP","1434","49253  >  443 [ACK] Seq=88498 Ack=1163 Win=998 Len=1368 TSval=420765 TSecr=372043108 [TCP segment of a reassembled PDU]"
"137","2018-08-07 17:36:09.214379","192.168.2.3","216.58.197.4","TLSv1.2","212","Application Data"
"138","2018-08-07 17:36:09.214689","192.168.2.3","216.58.197.4","TCP","1434","49253  >  443 [ACK] Seq=90012 Ack=1163 Win=998 Len=1368 TSval=420765 TSecr=372043108 [TCP segment of a reassembled PDU]"
"139","2018-08-07 17:36:09.214691","192.168.2.3","216.58.197.4","TLSv1.2","155","Application Data"
"143","2018-08-07 17:36:09.319818","192.168.2.3","216.58.197.4","TCP","1434","49253  >  443 [ACK] Seq=91469 Ack=1163 Win=998 Len=1368 TSval=420775 TSecr=372043217 [TCP segment of a reassembled PDU]"
"144","2018-08-07 17:36:09.319854","192.168.2.3","216.58.197.4","TCP","1434","49253  >  443 [ACK] Seq=92837 Ack=1163 Win=998 Len=1368 TSval=420775 TSecr=372043217 [TCP segment of a reassembled PDU]"
"145","2018-08-07 17:36:09.320056","192.168.2.3","216.58.197.4","TLSv1.2","212","Application Data"
"146","2018-08-07 17:36:09.320058","192.168.2.3","216.58.197.4","TCP","1434","49253  >  443 [ACK] Seq=94351 Ack=1163 Win=998 Len=1368 TSval=420775 TSecr=372043217 [TCP segment of a reassembled PDU]"
"147","2018-08-07 17:36:09.320206","192.168.2.3","216.58.197.4","TLSv1.2","155","Application Data"
"151","2018-08-07 17:36:09.434945","192.168.2.3","216.58.197.4","TCP","1434","49253  >  443 [ACK] Seq=95808 Ack=1163 Win=998 Len=1368 TSval=420787 TSecr=372043283 [TCP segment of a reassembled PDU]"
"152","2018-08-07 17:36:09.436127","192.168.2.3","216.58.197.4","TCP","1434","49253  >  443 [ACK] Seq=97176 Ack=1163 Win=998 Len=1368 TSval=420787 TSecr=372043283 [TCP segment of a reassembled PDU]"
"153","2018-08-07 17:36:09.436129","192.168.2.3","216.58.197.4","TLSv1.2","212","Application Data"
"154","2018-08-07 17:36:09.436270","192.168.2.3","216.58.197.4","TCP","1434","49253  >  443 [ACK] Seq=98690 Ack=1163 Win=998 Len=1368 TSval=420787 TSecr=372043283 [TCP segment of a reassembled PDU]"
"155","2018-08-07 17:36:09.436274","192.168.2.3","216.58.197.4","TLSv1.2","155","Application Data"
"161","2018-08-07 17:36:09.498568","192.168.2.3","216.58.197.4","TCP","66","49253  >  443 [ACK] Seq=100147 Ack=1271 Win=998 Len=0 TSval=420794 TSecr=372043452"
"162","2018-08-07 17:36:09.498894","192.168.2.3","216.58.197.4","TCP","66","49253  >  443 [ACK] Seq=100147 Ack=1409 Win=998 Len=0 TSval=420794 TSecr=372043453"
"163","2018-08-07 17:36:09.505960","192.168.2.3","216.58.197.4","TCP","1434","49253  >  443 [ACK] Seq=100147 Ack=1409 Win=998 Len=1368 TSval=420794 TSecr=372043453 [TCP segment of a reassembled PDU]"
"166","2018-08-07 17:36:09.506338","192.168.2.3","216.58.197.4","TCP","1434","49253  >  443 [ACK] Seq=101515 Ack=1409 Win=998 Len=1368 TSval=420794 TSecr=372043453 [TCP segment of a reassembled PDU]"
"167","2018-08-07 17:36:09.506340","192.168.2.3","216.58.197.4","TLSv1.2","212","Application Data"
"168","2018-08-07 17:36:09.506647","192.168.2.3","216.58.197.4","TCP","1434","49253  >  443 [ACK] Seq=103029 Ack=1409 Win=998 Len=1368 TSval=420794 TSecr=372043453 [TCP segment of a reassembled PDU]"
"169","2018-08-07 17:36:09.506650","192.168.2.3","216.58.197.4","TLSv1.2","155","Application Data"
"170","2018-08-07 17:36:09.508213","192.168.2.3","216.58.197.4","TCP","66","49253  >  443 [ACK] Seq=104486 Ack=1835 Win=998 Len=0 TSval=420795 TSecr=372043464"
"176","2018-08-07 17:36:09.574799","192.168.2.3","216.58.197.4","TCP","66","49253  >  443 [ACK] Seq=104486 Ack=2342 Win=998 Len=0 TSval=420801 TSecr=372043530"
"179","2018-08-07 17:36:09.620550","192.168.2.3","216.58.197.4","TCP","66","49253  >  443 [ACK] Seq=104486 Ack=2628 Win=998 Len=0 TSval=420806 TSecr=372043550"
"180","2018-08-07 17:36:09.627114","192.168.2.3","216.58.197.4","TCP","1434","49253  >  443 [ACK] Seq=104486 Ack=2628 Win=998 Len=1368 TSval=420806 TSecr=372043550 [TCP segment of a reassembled PDU]"
"181","2018-08-07 17:36:09.627361","192.168.2.3","216.58.197.4","TCP","1434","49253  >  443 [ACK] Seq=105854 Ack=2628 Win=998 Len=1368 TSval=420806 TSecr=372043550 [TCP segment of a reassembled PDU]"
"182","2018-08-07 17:36:09.627362","192.168.2.3","216.58.197.4","TLSv1.2","212","Application Data"
"183","2018-08-07 17:36:09.627363","192.168.2.3","216.58.197.4","TCP","1434","49253  >  443 [ACK] Seq=107368 Ack=2628 Win=998 Len=1368 TSval=420806 TSecr=372043550 [TCP segment of a reassembled PDU]"
"184","2018-08-07 17:36:09.627546","192.168.2.3","216.58.197.4","TLSv1.2","155","Application Data"
"188","2018-08-07 17:36:09.694112","192.168.2.3","216.58.197.4","TCP","1434","49253  >  443 [ACK] Seq=108825 Ack=2628 Win=998 Len=1368 TSval=420813 TSecr=372043590 [TCP segment of a reassembled PDU]"
"189","2018-08-07 17:36:09.694392","192.168.2.3","216.58.197.4","TCP","1434","49253  >  443 [ACK] Seq=110193 Ack=2628 Win=998 Len=1368 TSval=420813 TSecr=372043590 [TCP segment of a reassembled PDU]"
"190","2018-08-07 17:36:09.694395","192.168.2.3","216.58.197.4","TLSv1.2","212","Application Data"
"191","2018-08-07 17:36:09.695107","192.168.2.3","216.58.197.4","TCP","1434","49253  >  443 [ACK] Seq=111707 Ack=2628 Win=998 Len=1368 TSval=420813 TSecr=372043590 [TCP segment of a reassembled PDU]"
"192","2018-08-07 17:36:09.695110","192.168.2.3","216.58.197.4","TLSv1.2","155","Application Data"
"198","2018-08-07 17:36:09.754340","192.168.2.3","216.58.197.4","TCP","66","49253  >  443 [ACK] Seq=113164 Ack=3140 Win=998 Len=0 TSval=420819 TSecr=372043711"
"199","2018-08-07 17:36:09.797804","192.168.2.3","216.58.197.4","TCP","1434","49253  >  443 [ACK] Seq=113164 Ack=3140 Win=998 Len=1368 TSval=420823 TSecr=372043711 [TCP segment of a reassembled PDU]"
"200","2018-08-07 17:36:09.798278","192.168.2.3","216.58.197.4","TCP","1434","49253  >  443 [ACK] Seq=114532 Ack=3140 Win=998 Len=1368 TSval=420823 TSecr=372043711 [TCP segment of a reassembled PDU]"
"201","2018-08-07 17:36:09.798281","192.168.2.3","216.58.197.4","TLSv1.2","212","Application Data"
"202","2018-08-07 17:36:09.798630","192.168.2.3","216.58.197.4","TCP","1434","49253  >  443 [ACK] Seq=116046 Ack=3140 Win=998 Len=1368 TSval=420823 TSecr=372043711 [TCP segment of a reassembled PDU]"
"203","2018-08-07 17:36:09.798633","192.168.2.3","216.58.197.4","TLSv1.2","155","Application Data"
"209","2018-08-07 17:36:09.856511","192.168.2.3","216.58.197.4","TCP","66","49253  >  443 [ACK] Seq=117503 Ack=3433 Win=998 Len=0 TSval=420829 TSecr=372043813"
"210","2018-08-07 17:36:09.886223","192.168.2.3","216.58.197.4","TCP","1434","49253  >  443 [ACK] Seq=117503 Ack=3433 Win=998 Len=1368 TSval=420832 TSecr=372043813 [TCP segment of a reassembled PDU]"
"211","2018-08-07 17:36:09.886581","192.168.2.3","216.58.197.4","TCP","1434","49253  >  443 [ACK] Seq=118871 Ack=3433 Win=998 Len=1368 TSval=420832 TSecr=372043813 [TCP segment of a reassembled PDU]"
"212","2018-08-07 17:36:09.886583","192.168.2.3","216.58.197.4","TLSv1.2","212","Application Data"
"213","2018-08-07 17:36:09.886584","192.168.2.3","216.58.197.4","TCP","1434","49253  >  443 [ACK] Seq=120385 Ack=3433 Win=998 Len=1368 TSval=420832 TSecr=372043813 [TCP segment of a reassembled PDU]"
"214","2018-08-07 17:36:09.886585","192.168.2.3","216.58.197.4","TLSv1.2","155","Application Data"
"220","2018-08-07 17:36:09.952916","192.168.2.3","216.58.197.4","TCP","66","49253  >  443 [ACK] Seq=121842 Ack=3982 Win=998 Len=0 TSval=420839 TSecr=372043910"
"221","2018-08-07 17:36:09.986983","192.168.2.3","216.58.197.4","TCP","1434","49253  >  443 [ACK] Seq=121842 Ack=3982 Win=998 Len=1368 TSval=420842 TSecr=372043910 [TCP segment of a reassembled PDU]"
"222","2018-08-07 17:36:09.986988","192.168.2.3","216.58.197.4","TCP","1434","49253  >  443 [ACK] Seq=123210 Ack=3982 Win=998 Len=1368 TSval=420842 TSecr=372043910 [TCP segment of a reassembled PDU]"
"223","2018-08-07 17:36:09.986989","192.168.2.3","216.58.197.4","TLSv1.2","212","Application Data"
"224","2018-08-07 17:36:09.987250","192.168.2.3","216.58.197.4","TCP","1434","49253  >  443 [ACK] Seq=124724 Ack=3982 Win=998 Len=1368 TSval=420842 TSecr=372043910 [TCP segment of a reassembled PDU]"
"225","2018-08-07 17:36:09.987253","192.168.2.3","216.58.197.4","TLSv1.2","125","Application Data"
"229","2018-08-07 17:36:10.103443","192.168.2.3","216.58.197.4","TCP","1434","49253  >  443 [ACK] Seq=126151 Ack=3982 Win=998 Len=1368 TSval=420854 TSecr=372043950 [TCP segment of a reassembled PDU]"
"230","2018-08-07 17:36:10.103722","192.168.2.3","216.58.197.4","TCP","1434","49253  >  443 [ACK] Seq=127519 Ack=3982 Win=998 Len=1368 TSval=420854 TSecr=372043950 [TCP segment of a reassembled PDU]"
"231","2018-08-07 17:36:10.103723","192.168.2.3","216.58.197.4","TLSv1.2","212","Application Data"
"232","2018-08-07 17:36:10.103737","192.168.2.3","216.58.197.4","TCP","1434","49253  >  443 [ACK] Seq=129033 Ack=3982 Win=998 Len=1368 TSval=420854 TSecr=372043950 [TCP segment of a reassembled PDU]"
"233","2018-08-07 17:36:10.104062","192.168.2.3","216.58.197.4","TLSv1.2","144","Application Data"
"239","2018-08-07 17:36:10.172648","192.168.2.3","216.58.197.4","TCP","66","49253  >  443 [ACK] Seq=130479 Ack=4446 Win=998 Len=0 TSval=420861 TSecr=372044130"
"240","2018-08-07 17:36:10.206322","192.168.2.3","216.58.197.4","TCP","1434","49253  >  443 [ACK] Seq=130479 Ack=4446 Win=998 Len=1368 TSval=420864 TSecr=372044130 [TCP segment of a reassembled PDU]"
"241","2018-08-07 17:36:10.206729","192.168.2.3","216.58.197.4","TCP","1434","49253  >  443 [ACK] Seq=131847 Ack=4446 Win=998 Len=1368 TSval=420864 TSecr=372044130 [TCP segment of a reassembled PDU]"
"242","2018-08-07 17:36:10.206732","192.168.2.3","216.58.197.4","TLSv1.2","212","Application Data"
"243","2018-08-07 17:36:10.206732","192.168.2.3","216.58.197.4","TLSv1.2","1045","Application Data"
"250","2018-08-07 17:36:10.297888","192.168.2.3","216.58.197.4","TCP","66","49253  >  443 [ACK] Seq=134340 Ack=5030 Win=998 Len=0 TSval=420874 TSecr=372044254"
"251","2018-08-07 17:36:10.315470","192.168.2.3","216.58.197.4","TCP","1434","49253  >  443 [ACK] Seq=134340 Ack=5030 Win=998 Len=1368 TSval=420875 TSecr=372044254 [TCP segment of a reassembled PDU]"
"252","2018-08-07 17:36:10.315472","192.168.2.3","216.58.197.4","TCP","1434","49253  >  443 [ACK] Seq=135708 Ack=5030 Win=998 Len=1368 TSval=420875 TSecr=372044254 [TCP segment of a reassembled PDU]"
"253","2018-08-07 17:36:10.315615","192.168.2.3","216.58.197.4","TLSv1.2","212","Application Data"
"254","2018-08-07 17:36:10.315617","192.168.2.3","216.58.197.4","TLSv1.2","335","Application Data"
"257","2018-08-07 17:36:10.425223","192.168.2.3","216.58.197.4","TCP","1434","49253  >  443 [ACK] Seq=137491 Ack=5030 Win=998 Len=1368 TSval=420886 TSecr=372044278 [TCP segment of a reassembled PDU]"
"258","2018-08-07 17:36:10.426325","192.168.2.3","216.58.197.4","TCP","1434","49253  >  443 [ACK] Seq=138859 Ack=5030 Win=998 Len=1368 TSval=420886 TSecr=372044278 [TCP segment of a reassembled PDU]"
"259","2018-08-07 17:36:10.426328","192.168.2.3","216.58.197.4","TLSv1.2","212","Application Data"
"260","2018-08-07 17:36:10.426328","192.168.2.3","216.58.197.4","TLSv1.2","366","Application Data"
"264","2018-08-07 17:36:10.527670","192.168.2.3","216.58.197.4","TCP","1434","49253  >  443 [ACK] Seq=140673 Ack=5030 Win=998 Len=1368 TSval=420896 TSecr=372044389 [TCP segment of a reassembled PDU]"
"265","2018-08-07 17:36:10.527676","192.168.2.3","216.58.197.4","TCP","1434","49253  >  443 [ACK] Seq=142041 Ack=5030 Win=998 Len=1368 TSval=420896 TSecr=372044389 [TCP segment of a reassembled PDU]"
"266","2018-08-07 17:36:10.527677","192.168.2.3","216.58.197.4","TLSv1.2","212","Application Data"
"267","2018-08-07 17:36:10.527909","192.168.2.3","216.58.197.4","TLSv1.2","962","Application Data"
"273","2018-08-07 17:36:10.608851","192.168.2.3","216.58.197.4","TCP","66","49253  >  443 [ACK] Seq=144451 Ack=5263 Win=998 Len=0 TSval=420905 TSecr=372044550"
"274","2018-08-07 17:36:10.630015","192.168.2.3","216.58.197.4","TCP","1434","49253  >  443 [ACK] Seq=144451 Ack=5263 Win=998 Len=1368 TSval=420907 TSecr=372044550 [TCP segment of a reassembled PDU]"
"275","2018-08-07 17:36:10.630018","192.168.2.3","216.58.197.4","TCP","1434","49253  >  443 [ACK] Seq=145819 Ack=5263 Win=998 Len=1368 TSval=420907 TSecr=372044550 [TCP segment of a reassembled PDU]"
"276","2018-08-07 17:36:10.630215","192.168.2.3","216.58.197.4","TLSv1.2","212","Application Data"
"277","2018-08-07 17:36:10.630589","192.168.2.3","216.58.197.4","TLSv1.2","358","Application Data"
"281","2018-08-07 17:36:10.746327","192.168.2.3","216.58.197.4","TCP","1434","49253  >  443 [ACK] Seq=147625 Ack=5263 Win=998 Len=1368 TSval=420918 TSecr=372044593 [TCP segment of a reassembled PDU]"
"282","2018-08-07 17:36:10.746330","192.168.2.3","216.58.197.4","TCP","1434","49253  >  443 [ACK] Seq=148993 Ack=5263 Win=998 Len=1368 TSval=420918 TSecr=372044593 [TCP segment of a reassembled PDU]"
"283","2018-08-07 17:36:10.746331","192.168.2.3","216.58.197.4","TLSv1.2","212","Application Data"
"284","2018-08-07 17:36:10.746357","192.168.2.3","216.58.197.4","TLSv1.2","368","Application Data"
"289","2018-08-07 17:36:10.802458","192.168.2.3","216.58.197.4","TCP","66","49253  >  443 [ACK] Seq=150809 Ack=5741 Win=998 Len=0 TSval=420924 TSecr=372044757"
"290","2018-08-07 17:36:10.850134","192.168.2.3","216.58.197.4","TCP","1434","49253  >  443 [ACK] Seq=150809 Ack=5741 Win=998 Len=1368 TSval=420928 TSecr=372044757 [TCP segment of a reassembled PDU]"
"291","2018-08-07 17:36:10.850140","192.168.2.3","216.58.197.4","TCP","1434","49253  >  443 [ACK] Seq=152177 Ack=5741 Win=998 Len=1368 TSval=420928 TSecr=372044757 [TCP segment of a reassembled PDU]"
"292","2018-08-07 17:36:10.850141","192.168.2.3","216.58.197.4","TLSv1.2","212","Application Data"
"293","2018-08-07 17:36:10.850397","192.168.2.3","216.58.197.4","TLSv1.2","979","Application Data"
"298","2018-08-07 17:36:10.900513","192.168.2.3","216.58.197.4","TCP","66","49253  >  443 [ACK] Seq=154604 Ack=5962 Win=998 Len=0 TSval=420934 TSecr=372044856"
"301","2018-08-07 17:36:10.933073","192.168.2.3","216.58.197.4","TCP","66","49253  >  443 [ACK] Seq=154604 Ack=6582 Win=998 Len=0 TSval=420937 TSecr=372044889"
"302","2018-08-07 17:36:10.966777","192.168.2.3","216.58.197.4","TCP","1434","49253  >  443 [ACK] Seq=154604 Ack=6582 Win=998 Len=1368 TSval=420940 TSecr=372044889 [TCP segment of a reassembled PDU]"
"303","2018-08-07 17:36:10.967035","192.168.2.3","216.58.197.4","TCP","1434","49253  >  443 [ACK] Seq=155972 Ack=6582 Win=998 Len=1368 TSval=420940 TSecr=372044889 [TCP segment of a reassembled PDU]"
"304","2018-08-07 17:36:10.967038","192.168.2.3","216.58.197.4","TLSv1.2","212","Application Data"
"305","2018-08-07 17:36:10.967038","192.168.2.3","216.58.197.4","TLSv1.2","674","Application Data"
"306","2018-08-07 17:36:10.967039","192.168.2.3","216.58.197.4","TLSv1.2","102","Application Data"
"312","2018-08-07 17:36:11.609313","192.168.2.3","216.58.197.4","TCP","66","49253  >  443 [ACK] Seq=158130 Ack=6992 Win=998 Len=0 TSval=421005 TSecr=372045550"
"317","2018-08-07 17:36:11.644553","192.168.2.3","216.58.197.4","TCP","66","49253  >  443 [ACK] Seq=158130 Ack=10273 Win=998 Len=0 TSval=421008 TSecr=372045576"
"332","2018-08-07 17:36:11.682931","192.168.2.3","216.58.197.4","TCP","66","49253  >  443 [ACK] Seq=158130 Ack=19378 Win=998 Len=0 TSval=421012 TSecr=372045633"
"333","2018-08-07 17:36:11.682945","192.168.2.3","216.58.197.4","TCP","66","49253  >  443 [ACK] Seq=158130 Ack=21124 Win=998 Len=0 TSval=421012 TSecr=372045634"
"334","2018-08-07 17:36:11.682946","192.168.2.3","216.58.197.4","TCP","66","49253  >  443 [ACK] Seq=158130 Ack=21593 Win=998 Len=0 TSval=421012 TSecr=372045635"
"335","2018-08-07 17:36:11.777419","192.168.2.3","172.217.27.174","TLSv1.2","150","Application Data"
"336","2018-08-07 17:36:11.777424","192.168.2.3","172.217.27.174","TLSv1.2","104","Application Data"
"340","2018-08-07 17:36:11.785153","192.168.2.3","172.217.27.174","TCP","1434","52264  >  443 [ACK] Seq=123 Ack=1 Win=661 Len=1368 TSval=421022 TSecr=2421545222 [TCP segment of a reassembled PDU]"
"341","2018-08-07 17:36:11.785156","192.168.2.3","172.217.27.174","TCP","1434","52264  >  443 [ACK] Seq=1491 Ack=1 Win=661 Len=1368 TSval=421022 TSecr=2421545222 [TCP segment of a reassembled PDU]"
"342","2018-08-07 17:36:11.785280","192.168.2.3","172.217.27.174","TLSv1.2","212","Application Data"
"343","2018-08-07 17:36:11.785512","192.168.2.3","172.217.27.174","TCP","1434","52264  >  443 [ACK] Seq=3005 Ack=1 Win=661 Len=1368 TSval=421022 TSecr=2421545222 [TCP segment of a reassembled PDU]"
"344","2018-08-07 17:36:11.785514","192.168.2.3","172.217.27.174","TCP","1434","52264  >  443 [ACK] Seq=4373 Ack=1 Win=661 Len=1368 TSval=421022 TSecr=2421545222 [TCP segment of a reassembled PDU]"
"345","2018-08-07 17:36:11.785515","192.168.2.3","172.217.27.174","TLSv1.2","212","Application Data"
"346","2018-08-07 17:36:11.785926","192.168.2.3","172.217.27.174","TCP","1434","52264  >  443 [ACK] Seq=5887 Ack=1 Win=661 Len=1368 TSval=421022 TSecr=2421545222 [TCP segment of a reassembled PDU]"
"347","2018-08-07 17:36:11.785929","192.168.2.3","172.217.27.174","TCP","1434","52264  >  443 [ACK] Seq=7255 Ack=1 Win=661 Len=1368 TSval=421022 TSecr=2421545222 [TCP segment of a reassembled PDU]"
"348","2018-08-07 17:36:11.787419","192.168.2.3","172.217.27.174","TLSv1.2","1434","Application Data [TCP segment of a reassembled PDU]"
"349","2018-08-07 17:36:11.787576","192.168.2.3","172.217.27.174","TCP","1434","52264  >  443 [ACK] Seq=9991 Ack=1 Win=661 Len=1368 TSval=421022 TSecr=2421587093 [TCP segment of a reassembled PDU]"
"350","2018-08-07 17:36:11.787778","192.168.2.3","172.217.27.174","TLSv1.2","1434","Application Data [TCP segment of a reassembled PDU]"
"351","2018-08-07 17:36:11.788000","192.168.2.3","172.217.27.174","TCP","1434","52264  >  443 [ACK] Seq=12727 Ack=1 Win=661 Len=1368 TSval=421022 TSecr=2421587093 [TCP segment of a reassembled PDU]"
"358","2018-08-07 17:36:11.793274","192.168.2.3","172.217.27.174","TLSv1.2","1434","Application Data [TCP segment of a reassembled PDU]"
"359","2018-08-07 17:36:11.793277","192.168.2.3","172.217.27.174","TLSv1.2","551","Application Data"
"361","2018-08-07 17:36:11.810662","192.168.2.3","172.217.27.174","TLSv1.2","1307","Application Data"
"362","2018-08-07 17:36:11.820872","192.168.2.3","172.217.26.106","TLSv1.2","251","Application Data"
"363","2018-08-07 17:36:11.820875","192.168.2.3","172.217.26.106","TLSv1.2","104","Application Data"
"373","2018-08-07 17:36:11.832290","192.168.2.3","216.58.197.4","TCP","66","49253  >  443 [ACK] Seq=158130 Ack=22030 Win=998 Len=0 TSval=421027 TSecr=372045788"
"374","2018-08-07 17:36:11.834081","192.168.2.3","216.58.197.4","TCP","66","49253  >  443 [ACK] Seq=158130 Ack=22375 Win=998 Len=0 TSval=421027 TSecr=372045789"
"375","2018-08-07 17:36:11.834677","192.168.2.3","216.58.197.4","TLSv1.2","104","Application Data"
"381","2018-08-07 17:36:11.862980","192.168.2.3","172.217.26.106","TCP","66","35265  >  443 [ACK] Seq=224 Ack=115 Win=585 Len=0 TSval=421030 TSecr=4143489946"
"382","2018-08-07 17:36:11.863937","192.168.2.3","172.217.26.106","TCP","66","35265  >  443 [ACK] Seq=224 Ack=183 Win=585 Len=0 TSval=421030 TSecr=4143489981"
"383","2018-08-07 17:36:11.883318","192.168.2.3","172.217.26.106","TLSv1.2","104","Application Data"
"384","2018-08-07 17:36:11.891838","192.168.2.3","172.217.26.106","TLSv1.2","1323","Application Data"
"391","2018-08-07 17:36:11.901615","192.168.2.3","172.217.27.174","TCP","66","52264  >  443 [ACK] Seq=17189 Ack=918 Win=661 Len=0 TSval=421034 TSecr=2421587207"
"392","2018-08-07 17:36:11.906878","192.168.2.3","172.217.27.174","TLSv1.2","104","Application Data"
"398","2018-08-07 17:36:12.170424","192.168.2.3","172.217.26.106","TCP","66","35265  >  443 [ACK] Seq=1519 Ack=1220 Win=661 Len=0 TSval=421061 TSecr=4143490287"
"399","2018-08-07 17:36:12.176460","192.168.2.3","172.217.26.106","TLSv1.2","104","Application Data"
"405","2018-08-07 17:36:12.241969","192.168.2.3","172.217.27.174","TCP","66","52264  >  443 [ACK] Seq=17227 Ack=3972 Win=661 Len=0 TSval=421068 TSecr=2421587548"
"408","2018-08-07 17:36:12.270142","192.168.2.3","172.217.27.174","TCP","66","52264  >  443 [ACK] Seq=17227 Ack=4233 Win=661 Len=0 TSval=421071 TSecr=2421587579"
"409","2018-08-07 17:36:12.293198","192.168.2.3","172.217.27.174","TLSv1.2","104","Application Data"
"411","2018-08-07 17:36:12.300953","192.168.2.3","172.217.27.174","TCP","1434","52274  >  443 [ACK] Seq=1 Ack=1 Win=450 Len=1368 TSval=421073 TSecr=4029505618 [TCP segment of a reassembled PDU]"
"412","2018-08-07 17:36:12.300955","192.168.2.3","172.217.27.174","TCP","1434","52274  >  443 [ACK] Seq=1369 Ack=1 Win=450 Len=1368 TSval=421073 TSecr=4029505618 [TCP segment of a reassembled PDU]"
"413","2018-08-07 17:36:12.301150","192.168.2.3","172.217.27.174","TLSv1.2","933","Application Data"
"414","2018-08-07 17:36:12.301152","192.168.2.3","172.217.27.174","TLSv1.2","104","Application Data"
"415","2018-08-07 17:36:12.301153","192.168.2.3","172.217.27.174","TLSv1.2","367","Application Data"
"422","2018-08-07 17:36:12.347281","192.168.2.3","172.217.27.174","TCP","66","52274  >  443 [ACK] Seq=3943 Ack=39 Win=450 Len=0 TSval=421079 TSecr=4029533004"
"423","2018-08-07 17:36:12.477210","192.168.2.3","172.217.27.163","TCP","66","38980  >  443 [ACK] Seq=1 Ack=1 Win=1300 Len=0 TSval=421092 TSecr=2009279603"
"429","2018-08-07 17:36:12.539576","192.168.2.3","172.217.27.174","TCP","66","52274  >  443 [ACK] Seq=3943 Ack=108 Win=450 Len=0 TSval=421098 TSecr=4029533234"
"430","2018-08-07 17:36:12.539921","192.168.2.3","172.217.27.174","TCP","66","52274  >  443 [ACK] Seq=3943 Ack=218 Win=450 Len=0 TSval=421098 TSecr=4029533234"
"431","2018-08-07 17:36:12.539923","192.168.2.3","172.217.27.174","TCP","66","52274  >  443 [ACK] Seq=3943 Ack=286 Win=450 Len=0 TSval=421098 TSecr=4029533234"
"432","2018-08-07 17:36:12.544465","192.168.2.3","172.217.27.174","TLSv1.2","104","Application Data"
"434","2018-08-07 17:36:12.765275","192.168.2.3","8.8.8.8","DNS","122","Standard query 0x3dcc A r6---sn-xgmnpoxuopp-puhe.c.doc-0-0-sj.sj.googleusercontent.com"
"436","2018-08-07 17:36:12.809853","192.168.2.3","150.100.16.81","TCP","74","52586  >  443 [SYN] Seq=0 Win=14600 Len=0 MSS=1460 SACK_PERM=1 TSval=421125 TSecr=0 WS=64"
"438","2018-08-07 17:36:12.815302","192.168.2.3","150.100.16.81","TCP","66","52586  >  443 [ACK] Seq=1 Ack=1 Win=14656 Len=0 TSval=421125 TSecr=2612797457"
"439","2018-08-07 17:36:12.817377","192.168.2.3","150.100.16.81","TLSv1.2","312","Client Hello"
"444","2018-08-07 17:36:12.824949","192.168.2.3","150.100.16.81","TCP","66","52586  >  443 [ACK] Seq=247 Ack=1449 Win=17536 Len=0 TSval=421126 TSecr=2612797465"
"445","2018-08-07 17:36:12.825328","192.168.2.3","150.100.16.81","TCP","66","52586  >  443 [ACK] Seq=247 Ack=2897 Win=20416 Len=0 TSval=421126 TSecr=2612797465"
"446","2018-08-07 17:36:12.825639","192.168.2.3","150.100.16.81","TCP","66","52586  >  443 [ACK] Seq=247 Ack=3117 Win=23296 Len=0 TSval=421126 TSecr=2612797465"
"447","2018-08-07 17:36:12.834261","192.168.2.3","150.100.16.81","TLSv1.2","159","Client Key Exchange, Change Cipher Spec, Encrypted Handshake Message"
"449","2018-08-07 17:36:12.860296","192.168.2.3","150.100.16.81","TLSv1.2","1395","Application Data"
"451","2018-08-07 17:36:12.912064","192.168.2.3","172.217.27.174","TCP","1434","52274  >  443 [ACK] Seq=3981 Ack=286 Win=450 Len=1368 TSval=421134 TSecr=4029533286 [TCP segment of a reassembled PDU]"
"452","2018-08-07 17:36:12.912067","192.168.2.3","172.217.27.174","TCP","1434","52274  >  443 [ACK] Seq=5349 Ack=286 Win=450 Len=1368 TSval=421134 TSecr=4029533286 [TCP segment of a reassembled PDU]"
"453","2018-08-07 17:36:12.912227","192.168.2.3","172.217.27.174","TLSv1.2","934","Application Data"
"454","2018-08-07 17:36:12.912229","192.168.2.3","172.217.27.174","TLSv1.2","447","Application Data"
"473","2018-08-07 17:36:13.042293","192.168.2.3","150.100.16.81","TCP","66","52586  >  443 [ACK] Seq=1669 Ack=6243 Win=32000 Len=0 TSval=421148 TSecr=2612797679"
"474","2018-08-07 17:36:13.042296","192.168.2.3","150.100.16.81","TCP","66","52586  >  443 [ACK] Seq=1669 Ack=9139 Win=37824 Len=0 TSval=421148 TSecr=2612797679"
"475","2018-08-07 17:36:13.043177","192.168.2.3","150.100.16.81","TCP","66","52586  >  443 [ACK] Seq=1669 Ack=17827 Win=37824 Len=0 TSval=421148 TSecr=2612797679"
"476","2018-08-07 17:36:13.043443","192.168.2.3","150.100.16.81","TCP","66","52586  >  443 [ACK] Seq=1669 Ack=20723 Win=41600 Len=0 TSval=421148 TSecr=2612797679"
"477","2018-08-07 17:36:13.045668","192.168.2.3","150.100.16.81","TCP","66","52586  >  443 [ACK] Seq=1669 Ack=23619 Win=42304 Len=0 TSval=421148 TSecr=2612797679"
"488","2018-08-07 17:36:13.056398","192.168.2.3","150.100.16.81","TCP","66","52586  >  443 [ACK] Seq=1669 Ack=37083 Win=42304 Len=0 TSval=421149 TSecr=2612797689"
"489","2018-08-07 17:36:13.057030","192.168.2.3","150.100.16.81","TCP","66","52586  >  443 [FIN, ACK] Seq=1669 Ack=37083 Win=42304 Len=0 TSval=421149 TSecr=2612797689"
"491","2018-08-07 17:36:13.101015","192.168.2.3","172.217.27.174","TLSv1.2","150","Application Data"
"492","2018-08-07 17:36:13.101018","192.168.2.3","172.217.27.174","TCP","1434","52264  >  443 [ACK] Seq=17349 Ack=4233 Win=661 Len=1368 TSval=421154 TSecr=2421587608 [TCP segment of a reassembled PDU]"
"493","2018-08-07 17:36:13.101141","192.168.2.3","172.217.27.174","TCP","1434","52264  >  443 [ACK] Seq=18717 Ack=4233 Win=661 Len=1368 TSval=421154 TSecr=2421587608 [TCP segment of a reassembled PDU]"
"494","2018-08-07 17:36:13.101280","192.168.2.3","172.217.27.174","TLSv1.2","212","Application Data"
"495","2018-08-07 17:36:13.101603","192.168.2.3","172.217.27.174","TCP","1434","52264  >  443 [ACK] Seq=20231 Ack=4233 Win=661 Len=1368 TSval=421154 TSecr=2421587608 [TCP segment of a reassembled PDU]"
"496","2018-08-07 17:36:13.101966","192.168.2.3","172.217.27.174","TCP","1434","52264  >  443 [ACK] Seq=21599 Ack=4233 Win=661 Len=1368 TSval=421154 TSecr=2421587608 [TCP segment of a reassembled PDU]"
"497","2018-08-07 17:36:13.101968","192.168.2.3","172.217.27.174","TLSv1.2","212","Application Data"
"498","2018-08-07 17:36:13.101969","192.168.2.3","172.217.27.174","TCP","1434","52264  >  443 [ACK] Seq=23113 Ack=4233 Win=661 Len=1368 TSval=421154 TSecr=2421587608 [TCP segment of a reassembled PDU]"
"499","2018-08-07 17:36:13.102287","192.168.2.3","172.217.27.174","TCP","1434","52264  >  443 [ACK] Seq=24481 Ack=4233 Win=661 Len=1368 TSval=421154 TSecr=2421587608 [TCP segment of a reassembled PDU]"
