"No.","Time","Source","Destination","Protocol","Length","Info"
"1","2018-08-07 17:46:58.044117","192.168.2.3","172.217.27.163","TCP","66","39023  >  443 [ACK] Seq=1 Ack=1 Win=1534 Len=0 TSval=485648 TSecr=3337707889"
"2","2018-08-07 17:46:58.044476","192.168.2.3","172.217.27.170","TCP","66","38519  >  443 [ACK] Seq=1 Ack=1 Win=1059 Len=0 TSval=485648 TSecr=1979857369"
"5","2018-08-07 17:46:59.324097","192.168.2.3","172.217.27.161","TCP","66","38386  >  80 [ACK] Seq=1 Ack=1 Win=406 Len=0 TSval=485776 TSecr=1895976297"
"7","2018-08-07 17:47:02.906540","192.168.2.3","192.168.2.1","ICMP","98","Echo (ping) request  id=0x06f2, seq=1/256, ttl=64 (reply in 8)"
"9","2018-08-07 17:47:03.124548","192.168.2.3","172.217.27.174","TCP","66","52293  >  443 [ACK] Seq=1 Ack=1 Win=661 Len=0 TSval=486156 TSecr=874321153"
"11","2018-08-07 17:47:03.165702","192.168.2.3","172.217.27.174","TCP","66","52274  >  443 [ACK] Seq=1 Ack=1 Win=494 Len=0 TSval=486160 TSecr=4030138830"
"13","2018-08-07 17:47:03.564195","192.168.2.3","172.217.27.174","TCP","66","52258  >  443 [ACK] Seq=1 Ack=1 Win=661 Len=0 TSval=486200 TSecr=2575097052"
"15","2018-08-07 17:47:03.924464","192.168.2.3","192.168.2.1","ICMP","98","Echo (ping) request  id=0x06f2, seq=2/512, ttl=64 (reply in 16)"
"17","2018-08-07 17:47:03.978586","192.168.2.3","8.8.8.8","ICMP","98","Echo (ping) request  id=0x06f8, seq=1/256, ttl=64 (reply in 18)"
"19","2018-08-07 17:47:04.764169","192.168.2.3","216.58.197.4","TCP","66","49253  >  443 [ACK] Seq=1 Ack=1 Win=1522 Len=0 TSval=486320 TSecr=372653673"
"21","2018-08-07 17:47:05.006305","192.168.2.3","8.8.8.8","ICMP","98","Echo (ping) request  id=0x06f8, seq=2/512, ttl=64 (reply in 22)"
"23","2018-08-07 17:47:05.014049","192.168.2.3","8.8.8.8","DNS","74","Standard query 0x06cc A www.google.com"
"24","2018-08-07 17:47:05.016703","192.168.2.3","8.8.8.8","DNS","74","Standard query 0x5bf3 AAAA www.google.com"
"28","2018-08-07 17:47:11.558128","192.168.2.3","216.58.197.4","TLSv1.2","156","[TCP Previous segment not captured] , Application Data"
"29","2018-08-07 17:47:11.558132","192.168.2.3","216.58.197.4","TLSv1.2","104","Application Data"
"30","2018-08-07 17:47:11.558133","192.168.2.3","216.58.197.4","TLSv1.2","159","Application Data"
"35","2018-08-07 17:47:11.571297","192.168.2.3","216.58.197.4","TCP","1434","49253  >  443 [ACK] Seq=223 Ack=39 Win=1522 Len=1368 TSval=487000 TSecr=372705523 [TCP segment of a reassembled PDU]"
"36","2018-08-07 17:47:11.571643","192.168.2.3","216.58.197.4","TCP","1434","49253  >  443 [ACK] Seq=1591 Ack=39 Win=1522 Len=1368 TSval=487000 TSecr=372705523 [TCP segment of a reassembled PDU]"
"37","2018-08-07 17:47:11.571646","192.168.2.3","216.58.197.4","TLSv1.2","212","Application Data"
"38","2018-08-07 17:47:11.572051","192.168.2.3","216.58.197.4","TCP","1434","49253  >  443 [ACK] Seq=3105 Ack=39 Win=1522 Len=1368 TSval=487000 TSecr=372705523 [TCP segment of a reassembled PDU]"
"39","2018-08-07 17:47:11.572054","192.168.2.3","216.58.197.4","TLSv1.2","284","Application Data"
"40","2018-08-07 17:47:11.575329","192.168.2.3","216.58.197.4","TCP","1434","49253  >  443 [ACK] Seq=4691 Ack=39 Win=1522 Len=1368 TSval=487000 TSecr=372705523 [TCP segment of a reassembled PDU]"
"41","2018-08-07 17:47:11.575334","192.168.2.3","216.58.197.4","TCP","1434","49253  >  443 [ACK] Seq=6059 Ack=39 Win=1522 Len=1368 TSval=487000 TSecr=372705523 [TCP segment of a reassembled PDU]"
"42","2018-08-07 17:47:11.575335","192.168.2.3","216.58.197.4","TLSv1.2","212","Application Data"
"43","2018-08-07 17:47:11.575721","192.168.2.3","216.58.197.4","TCP","1434","49253  >  443 [ACK] Seq=7573 Ack=39 Win=1522 Len=1368 TSval=487000 TSecr=372705523 [TCP segment of a reassembled PDU]"
"44","2018-08-07 17:47:11.575724","192.168.2.3","216.58.197.4","TLSv1.2","156","Application Data"
"50","2018-08-07 17:47:11.582609","192.168.2.3","216.58.197.4","TCP","1434","49253  >  443 [ACK] Seq=9031 Ack=39 Win=1522 Len=1368 TSval=487001 TSecr=372705536 [TCP segment of a reassembled PDU]"
"51","2018-08-07 17:47:11.582616","192.168.2.3","216.58.197.4","TCP","1434","49253  >  443 [ACK] Seq=10399 Ack=39 Win=1522 Len=1368 TSval=487001 TSecr=372705536 [TCP segment of a reassembled PDU]"
"52","2018-08-07 17:47:11.582715","192.168.2.3","216.58.197.4","TLSv1.2","1434","Application Data [TCP segment of a reassembled PDU]"
"53","2018-08-07 17:47:11.582717","192.168.2.3","216.58.197.4","TLSv1.2","302","Application Data"
"54","2018-08-07 17:47:11.582773","192.168.2.3","216.58.197.4","TCP","1434","49253  >  443 [ACK] Seq=13371 Ack=39 Win=1522 Len=1368 TSval=487001 TSecr=372705537 [TCP segment of a reassembled PDU]"
"55","2018-08-07 17:47:11.583146","192.168.2.3","216.58.197.4","TCP","1434","49253  >  443 [ACK] Seq=14739 Ack=39 Win=1522 Len=1368 TSval=487001 TSecr=372705537 [TCP segment of a reassembled PDU]"
"58","2018-08-07 17:47:11.599807","192.168.2.3","216.58.197.4","TLSv1.2","1434","Application Data [TCP segment of a reassembled PDU]"
"59","2018-08-07 17:47:11.600006","192.168.2.3","216.58.197.4","TLSv1.2","1434","Application Data [TCP segment of a reassembled PDU]"
"60","2018-08-07 17:47:11.600024","192.168.2.3","216.58.197.4","TCP","1434","49253  >  443 [ACK] Seq=18843 Ack=39 Win=1522 Len=1368 TSval=487002 TSecr=372705540 [TCP segment of a reassembled PDU]"
"61","2018-08-07 17:47:11.600206","192.168.2.3","216.58.197.4","TLSv1.2","1434","Application Data [TCP segment of a reassembled PDU]"
"62","2018-08-07 17:47:11.600446","192.168.2.3","216.58.197.4","TLSv1.2","1434","Application Data [TCP segment of a reassembled PDU]"
"63","2018-08-07 17:47:11.600810","192.168.2.3","216.58.197.4","TCP","1434","49253  >  443 [ACK] Seq=22947 Ack=39 Win=1522 Len=1368 TSval=487002 TSecr=372705540 [TCP segment of a reassembled PDU]"
"64","2018-08-07 17:47:11.601320","192.168.2.3","216.58.197.4","TLSv1.2","1434","Application Data [TCP segment of a reassembled PDU]"
"65","2018-08-07 17:47:11.601323","192.168.2.3","216.58.197.4","TLSv1.2","1434","Application Data [TCP segment of a reassembled PDU]"
"66","2018-08-07 17:47:11.601682","192.168.2.3","216.58.197.4","TCP","1434","49253  >  443 [ACK] Seq=27051 Ack=39 Win=1522 Len=1368 TSval=487003 TSecr=372705540 [TCP segment of a reassembled PDU]"
"67","2018-08-07 17:47:11.601684","192.168.2.3","216.58.197.4","TLSv1.2","1434","Application Data [TCP segment of a reassembled PDU]"
"68","2018-08-07 17:47:11.602227","192.168.2.3","216.58.197.4","TLSv1.2","1434","Application Data [TCP segment of a reassembled PDU]"
"69","2018-08-07 17:47:11.602230","192.168.2.3","216.58.197.4","TCP","1434","49253  >  443 [ACK] Seq=31155 Ack=39 Win=1522 Len=1368 TSval=487003 TSecr=372705548 [TCP segment of a reassembled PDU]"
"70","2018-08-07 17:47:11.602498","192.168.2.3","216.58.197.4","TLSv1.2","1434","Application Data [TCP segment of a reassembled PDU]"
"71","2018-08-07 17:47:11.602760","192.168.2.3","216.58.197.4","TLSv1.2","1434","Application Data [TCP segment of a reassembled PDU]"
"72","2018-08-07 17:47:11.602762","192.168.2.3","216.58.197.4","TCP","1434","49253  >  443 [ACK] Seq=35259 Ack=39 Win=1522 Len=1368 TSval=487003 TSecr=372705548 [TCP segment of a reassembled PDU]"
"73","2018-08-07 17:47:11.602876","192.168.2.3","216.58.197.4","TLSv1.2","1434","Application Data [TCP segment of a reassembled PDU]"
"74","2018-08-07 17:47:11.603060","192.168.2.3","216.58.197.4","TCP","1434","49253  >  443 [ACK] Seq=37995 Ack=39 Win=1522 Len=1368 TSval=487003 TSecr=372705548 [TCP segment of a reassembled PDU]"
"82","2018-08-07 17:47:11.607440","192.168.2.3","216.58.197.4","TLSv1.2","1434","Application Data [TCP segment of a reassembled PDU]"
"84","2018-08-07 17:47:11.608300","192.168.2.3","216.58.197.4","TCP","1434","49253  >  443 [ACK] Seq=40731 Ack=39 Win=1522 Len=1368 TSval=487004 TSecr=372705565 [TCP segment of a reassembled PDU]"
"85","2018-08-07 17:47:11.608548","192.168.2.3","216.58.197.4","TLSv1.2","1434","Application Data [TCP segment of a reassembled PDU]"
"86","2018-08-07 17:47:11.608549","192.168.2.3","216.58.197.4","TLSv1.2","1434","Application Data [TCP segment of a reassembled PDU]"
"87","2018-08-07 17:47:11.608819","192.168.2.3","216.58.197.4","TCP","1434","49253  >  443 [ACK] Seq=44835 Ack=39 Win=1522 Len=1368 TSval=487004 TSecr=372705565 [TCP segment of a reassembled PDU]"
"88","2018-08-07 17:47:11.608820","192.168.2.3","216.58.197.4","TLSv1.2","1434","Application Data [TCP segment of a reassembled PDU]"
"89","2018-08-07 17:47:11.609054","192.168.2.3","216.58.197.4","TLSv1.2","1434","Application Data [TCP segment of a reassembled PDU]"
"90","2018-08-07 17:47:11.609146","192.168.2.3","216.58.197.4","TCP","1434","49253  >  443 [ACK] Seq=48939 Ack=39 Win=1522 Len=1368 TSval=487004 TSecr=372705565 [TCP segment of a reassembled PDU]"
"91","2018-08-07 17:47:11.609384","192.168.2.3","216.58.197.4","TLSv1.2","1434","Application Data [TCP segment of a reassembled PDU]"
"92","2018-08-07 17:47:11.611134","192.168.2.3","216.58.197.4","TLSv1.2","1434","Application Data [TCP segment of a reassembled PDU]"
"93","2018-08-07 17:47:11.611423","192.168.2.3","216.58.197.4","TCP","1434","49253  >  443 [ACK] Seq=53043 Ack=39 Win=1522 Len=1368 TSval=487004 TSecr=372705566 [TCP segment of a reassembled PDU]"
"94","2018-08-07 17:47:11.611425","192.168.2.3","216.58.197.4","TLSv1.2","1434","Application Data [TCP segment of a reassembled PDU]"
"95","2018-08-07 17:47:11.611774","192.168.2.3","216.58.197.4","TCP","1434","49253  >  443 [ACK] Seq=55779 Ack=39 Win=1522 Len=1368 TSval=487004 TSecr=372705566 [TCP segment of a reassembled PDU]"
"96","2018-08-07 17:47:11.611777","192.168.2.3","216.58.197.4","TLSv1.2","1434","Application Data [TCP segment of a reassembled PDU]"
"98","2018-08-07 17:47:11.611896","192.168.2.3","216.58.197.4","TCP","1434","49253  >  443 [ACK] Seq=58515 Ack=39 Win=1522 Len=1368 TSval=487004 TSecr=372705567 [TCP segment of a reassembled PDU]"
"99","2018-08-07 17:47:11.612068","192.168.2.3","216.58.197.4","TLSv1.2","1434","Application Data [TCP segment of a reassembled PDU]"
"100","2018-08-07 17:47:11.612197","192.168.2.3","216.58.197.4","TLSv1.2","540","Application Data"
"108","2018-08-07 17:47:11.655298","192.168.2.3","216.58.197.4","TCP","1434","49253  >  443 [ACK] Seq=61725 Ack=39 Win=1522 Len=1368 TSval=487009 TSecr=372705577 [TCP segment of a reassembled PDU]"
"109","2018-08-07 17:47:11.655712","192.168.2.3","216.58.197.4","TCP","1434","49253  >  443 [ACK] Seq=63093 Ack=39 Win=1522 Len=1368 TSval=487009 TSecr=372705577 [TCP segment of a reassembled PDU]"
"110","2018-08-07 17:47:11.655714","192.168.2.3","216.58.197.4","TLSv1.2","212","Application Data"
"112","2018-08-07 17:47:11.658380","192.168.2.3","216.58.197.4","TCP","1434","49253  >  443 [ACK] Seq=64607 Ack=39 Win=1522 Len=1368 TSval=487009 TSecr=372705577 [TCP segment of a reassembled PDU]"
"113","2018-08-07 17:47:11.658383","192.168.2.3","216.58.197.4","TLSv1.2","155","Application Data"
"118","2018-08-07 17:47:11.760925","192.168.2.3","216.58.197.4","TCP","1434","49253  >  443 [ACK] Seq=66064 Ack=39 Win=1522 Len=1368 TSval=487019 TSecr=372705623 [TCP segment of a reassembled PDU]"
"119","2018-08-07 17:47:11.760928","192.168.2.3","216.58.197.4","TCP","1434","49253  >  443 [ACK] Seq=67432 Ack=39 Win=1522 Len=1368 TSval=487019 TSecr=372705623 [TCP segment of a reassembled PDU]"
"120","2018-08-07 17:47:11.760929","192.168.2.3","216.58.197.4","TLSv1.2","212","Application Data"
"121","2018-08-07 17:47:11.761182","192.168.2.3","216.58.197.4","TLSv1.2","932","Application Data"
"126","2018-08-07 17:47:11.838850","192.168.2.3","216.58.197.4","TCP","66","49253  >  443 [ACK] Seq=69812 Ack=292 Win=1522 Len=0 TSval=487027 TSecr=372705795"
"128","2018-08-07 17:47:11.851952","192.168.2.3","216.58.197.4","TCP","66","49253  >  443 [ACK] Seq=69812 Ack=527 Win=1522 Len=0 TSval=487028 TSecr=372705795"
"129","2018-08-07 17:47:11.886637","192.168.2.3","216.58.197.4","TCP","1434","49253  >  443 [ACK] Seq=69812 Ack=527 Win=1522 Len=1368 TSval=487031 TSecr=372705795 [TCP segment of a reassembled PDU]"
"130","2018-08-07 17:47:11.886981","192.168.2.3","216.58.197.4","TCP","1434","49253  >  443 [ACK] Seq=71180 Ack=527 Win=1522 Len=1368 TSval=487031 TSecr=372705795 [TCP segment of a reassembled PDU]"
"131","2018-08-07 17:47:11.886985","192.168.2.3","216.58.197.4","TLSv1.2","212","Application Data"
"132","2018-08-07 17:47:11.886986","192.168.2.3","216.58.197.4","TLSv1.2","495","Application Data"
"136","2018-08-07 17:47:12.014338","192.168.2.3","216.58.197.4","TCP","66","49253  >  443 [ACK] Seq=73123 Ack=688 Win=1522 Len=0 TSval=487045 TSecr=372705934"
"137","2018-08-07 17:47:12.016131","192.168.2.3","216.58.197.4","TCP","1434","49253  >  443 [ACK] Seq=73123 Ack=688 Win=1522 Len=1368 TSval=487045 TSecr=372705934 [TCP segment of a reassembled PDU]"
"138","2018-08-07 17:47:12.016533","192.168.2.3","216.58.197.4","TCP","1434","49253  >  443 [ACK] Seq=74491 Ack=688 Win=1522 Len=1368 TSval=487045 TSecr=372705934 [TCP segment of a reassembled PDU]"
"139","2018-08-07 17:47:12.016535","192.168.2.3","216.58.197.4","TLSv1.2","212","Application Data"
"140","2018-08-07 17:47:12.016536","192.168.2.3","216.58.197.4","TCP","1434","49253  >  443 [ACK] Seq=76005 Ack=688 Win=1522 Len=1368 TSval=487045 TSecr=372705934 [TCP segment of a reassembled PDU]"
"141","2018-08-07 17:47:12.016537","192.168.2.3","216.58.197.4","TLSv1.2","77","Application Data"
"145","2018-08-07 17:47:12.134056","192.168.2.3","216.58.197.4","TCP","1434","49253  >  443 [ACK] Seq=77384 Ack=688 Win=1522 Len=1368 TSval=487056 TSecr=372705981 [TCP segment of a reassembled PDU]"
"146","2018-08-07 17:47:12.134061","192.168.2.3","216.58.197.4","TCP","1434","49253  >  443 [ACK] Seq=78752 Ack=688 Win=1522 Len=1368 TSval=487056 TSecr=372705981 [TCP segment of a reassembled PDU]"
"147","2018-08-07 17:47:12.134062","192.168.2.3","216.58.197.4","TLSv1.2","212","Application Data"
"148","2018-08-07 17:47:12.134235","192.168.2.3","216.58.197.4","TCP","1434","49253  >  443 [ACK] Seq=80266 Ack=688 Win=1522 Len=1368 TSval=487056 TSecr=372705981 [TCP segment of a reassembled PDU]"
"149","2018-08-07 17:47:12.134515","192.168.2.3","216.58.197.4","TLSv1.2","93","Application Data"
"154","2018-08-07 17:47:12.140998","192.168.2.3","216.58.197.4","TCP","66","49253  >  443 [ACK] Seq=81661 Ack=961 Win=1522 Len=0 TSval=487057 TSecr=372706098"
"155","2018-08-07 17:47:12.236445","192.168.2.3","216.58.197.4","TCP","1434","49253  >  443 [ACK] Seq=81661 Ack=961 Win=1522 Len=1368 TSval=487066 TSecr=372706099 [TCP segment of a reassembled PDU]"
"156","2018-08-07 17:47:12.236557","192.168.2.3","216.58.197.4","TCP","1434","49253  >  443 [ACK] Seq=83029 Ack=961 Win=1522 Len=1368 TSval=487066 TSecr=372706099 [TCP segment of a reassembled PDU]"
"157","2018-08-07 17:47:12.236561","192.168.2.3","216.58.197.4","TLSv1.2","212","Application Data"
"158","2018-08-07 17:47:12.237992","192.168.2.3","216.58.197.4","TLSv1.2","218","Application Data"
"162","2018-08-07 17:47:12.371321","192.168.2.3","216.58.197.4","TCP","1434","49253  >  443 [ACK] Seq=84695 Ack=961 Win=1522 Len=1368 TSval=487080 TSecr=372706203 [TCP segment of a reassembled PDU]"
"163","2018-08-07 17:47:12.372726","192.168.2.3","216.58.197.4","TCP","1434","49253  >  443 [ACK] Seq=86063 Ack=961 Win=1522 Len=1368 TSval=487080 TSecr=372706203 [TCP segment of a reassembled PDU]"
"164","2018-08-07 17:47:12.372729","192.168.2.3","216.58.197.4","TLSv1.2","212","Application Data"
"165","2018-08-07 17:47:12.372956","192.168.2.3","216.58.197.4","TLSv1.2","1422","Application Data"
"169","2018-08-07 17:47:12.461657","192.168.2.3","216.58.197.4","TCP","1434","49253  >  443 [ACK] Seq=88933 Ack=961 Win=1522 Len=1368 TSval=487089 TSecr=372706338 [TCP segment of a reassembled PDU]"
"170","2018-08-07 17:47:12.461663","192.168.2.3","216.58.197.4","TCP","1434","49253  >  443 [ACK] Seq=90301 Ack=961 Win=1522 Len=1368 TSval=487089 TSecr=372706338 [TCP segment of a reassembled PDU]"
"171","2018-08-07 17:47:12.461664","192.168.2.3","216.58.197.4","TLSv1.2","212","Application Data"
"172","2018-08-07 17:47:12.461789","192.168.2.3","216.58.197.4","TCP","1434","49253  >  443 [ACK] Seq=91815 Ack=961 Win=1522 Len=1368 TSval=487089 TSecr=372706338 [TCP segment of a reassembled PDU]"
"173","2018-08-07 17:47:12.461790","192.168.2.3","216.58.197.4","TLSv1.2","155","Application Data"
"177","2018-08-07 17:47:12.556317","192.168.2.3","216.58.197.4","TCP","1434","49253  >  443 [ACK] Seq=93272 Ack=961 Win=1522 Len=1368 TSval=487099 TSecr=372706427 [TCP segment of a reassembled PDU]"
"178","2018-08-07 17:47:12.556699","192.168.2.3","216.58.197.4","TCP","1434","49253  >  443 [ACK] Seq=94640 Ack=961 Win=1522 Len=1368 TSval=487099 TSecr=372706427 [TCP segment of a reassembled PDU]"
"179","2018-08-07 17:47:12.556701","192.168.2.3","216.58.197.4","TLSv1.2","212","Application Data"
"180","2018-08-07 17:47:12.556702","192.168.2.3","216.58.197.4","TCP","1434","49253  >  443 [ACK] Seq=96154 Ack=961 Win=1522 Len=1368 TSval=487099 TSecr=372706427 [TCP segment of a reassembled PDU]"
"181","2018-08-07 17:47:12.556897","192.168.2.3","216.58.197.4","TLSv1.2","155","Application Data"
"184","2018-08-07 17:47:12.646710","192.168.2.3","216.58.197.4","TCP","1434","49253  >  443 [ACK] Seq=97611 Ack=961 Win=1522 Len=1368 TSval=487108 TSecr=372706522 [TCP segment of a reassembled PDU]"
"185","2018-08-07 17:47:12.646981","192.168.2.3","216.58.197.4","TCP","1434","49253  >  443 [ACK] Seq=98979 Ack=961 Win=1522 Len=1368 TSval=487108 TSecr=372706522 [TCP segment of a reassembled PDU]"
"186","2018-08-07 17:47:12.647492","192.168.2.3","216.58.197.4","TLSv1.2","212","Application Data"
"187","2018-08-07 17:47:12.647854","192.168.2.3","216.58.197.4","TCP","1434","49253  >  443 [ACK] Seq=100493 Ack=961 Win=1522 Len=1368 TSval=487108 TSecr=372706522 [TCP segment of a reassembled PDU]"
"188","2018-08-07 17:47:12.647857","192.168.2.3","216.58.197.4","TLSv1.2","155","Application Data"
"192","2018-08-07 17:47:12.721358","192.168.2.3","216.58.197.4","TCP","1434","49253  >  443 [ACK] Seq=101950 Ack=961 Win=1522 Len=1368 TSval=487115 TSecr=372706613 [TCP segment of a reassembled PDU]"
"193","2018-08-07 17:47:12.721715","192.168.2.3","216.58.197.4","TCP","1434","49253  >  443 [ACK] Seq=103318 Ack=961 Win=1522 Len=1368 TSval=487115 TSecr=372706613 [TCP segment of a reassembled PDU]"
"194","2018-08-07 17:47:12.721717","192.168.2.3","216.58.197.4","TLSv1.2","212","Application Data"
"195","2018-08-07 17:47:12.721718","192.168.2.3","216.58.197.4","TCP","1434","49253  >  443 [ACK] Seq=104832 Ack=961 Win=1522 Len=1368 TSval=487115 TSecr=372706613 [TCP segment of a reassembled PDU]"
"196","2018-08-07 17:47:12.723064","192.168.2.3","216.58.197.4","TLSv1.2","155","Application Data"
"200","2018-08-07 17:47:12.809775","192.168.2.3","216.58.197.4","TCP","1434","49253  >  443 [ACK] Seq=106289 Ack=961 Win=1522 Len=1368 TSval=487124 TSecr=372706688 [TCP segment of a reassembled PDU]"
"201","2018-08-07 17:47:12.810208","192.168.2.3","216.58.197.4","TCP","1434","49253  >  443 [ACK] Seq=107657 Ack=961 Win=1522 Len=1368 TSval=487124 TSecr=372706688 [TCP segment of a reassembled PDU]"
"202","2018-08-07 17:47:12.810210","192.168.2.3","216.58.197.4","TLSv1.2","212","Application Data"
"203","2018-08-07 17:47:12.810571","192.168.2.3","216.58.197.4","TCP","1434","49253  >  443 [ACK] Seq=109171 Ack=961 Win=1522 Len=1368 TSval=487124 TSecr=372706688 [TCP segment of a reassembled PDU]"
"204","2018-08-07 17:47:12.810573","192.168.2.3","216.58.197.4","TLSv1.2","155","Application Data"
"208","2018-08-07 17:47:12.836000","192.168.2.3","216.58.197.4","TCP","66","49253  >  443 [ACK] Seq=110628 Ack=1029 Win=1522 Len=0 TSval=487127 TSecr=372706795"
"210","2018-08-07 17:47:12.851330","192.168.2.3","216.58.197.4","TCP","66","49253  >  443 [ACK] Seq=110628 Ack=1172 Win=1522 Len=0 TSval=487128 TSecr=372706810"
"213","2018-08-07 17:47:12.872145","192.168.2.3","216.58.197.4","TCP","66","49253  >  443 [ACK] Seq=110628 Ack=1420 Win=1522 Len=0 TSval=487130 TSecr=372706827"
"214","2018-08-07 17:47:12.872148","192.168.2.3","216.58.197.4","TCP","66","49253  >  443 [ACK] Seq=110628 Ack=1702 Win=1522 Len=0 TSval=487130 TSecr=372706827"
"215","2018-08-07 17:47:12.906657","192.168.2.3","216.58.197.4","TCP","1434","49253  >  443 [ACK] Seq=110628 Ack=1702 Win=1522 Len=1368 TSval=487134 TSecr=372706827 [TCP segment of a reassembled PDU]"
"216","2018-08-07 17:47:12.910375","192.168.2.3","216.58.197.4","TCP","1434","49253  >  443 [ACK] Seq=111996 Ack=1702 Win=1522 Len=1368 TSval=487134 TSecr=372706827 [TCP segment of a reassembled PDU]"
"217","2018-08-07 17:47:12.910377","192.168.2.3","216.58.197.4","TLSv1.2","212","Application Data"
"218","2018-08-07 17:47:12.910883","192.168.2.3","216.58.197.4","TCP","1434","49253  >  443 [ACK] Seq=113510 Ack=1702 Win=1522 Len=1368 TSval=487134 TSecr=372706827 [TCP segment of a reassembled PDU]"
"219","2018-08-07 17:47:12.910886","192.168.2.3","216.58.197.4","TLSv1.2","155","Application Data"
"223","2018-08-07 17:47:13.002365","192.168.2.3","216.58.197.4","TCP","1434","49253  >  443 [ACK] Seq=114967 Ack=1702 Win=1522 Len=1368 TSval=487143 TSecr=372706915 [TCP segment of a reassembled PDU]"
"224","2018-08-07 17:47:13.002794","192.168.2.3","216.58.197.4","TCP","1434","49253  >  443 [ACK] Seq=116335 Ack=1702 Win=1522 Len=1368 TSval=487143 TSecr=372706915 [TCP segment of a reassembled PDU]"
"225","2018-08-07 17:47:13.002797","192.168.2.3","216.58.197.4","TLSv1.2","212","Application Data"
"226","2018-08-07 17:47:13.003140","192.168.2.3","216.58.197.4","TCP","1434","49253  >  443 [ACK] Seq=117849 Ack=1702 Win=1522 Len=1368 TSval=487143 TSecr=372706915 [TCP segment of a reassembled PDU]"
"227","2018-08-07 17:47:13.003143","192.168.2.3","216.58.197.4","TLSv1.2","155","Application Data"
"231","2018-08-07 17:47:13.063248","192.168.2.3","216.58.197.4","TCP","1434","49253  >  443 [ACK] Seq=119306 Ack=1702 Win=1522 Len=1368 TSval=487149 TSecr=372706968 [TCP segment of a reassembled PDU]"
"232","2018-08-07 17:47:13.065453","192.168.2.3","216.58.197.4","TCP","1434","49253  >  443 [ACK] Seq=120674 Ack=1702 Win=1522 Len=1368 TSval=487149 TSecr=372706968 [TCP segment of a reassembled PDU]"
"233","2018-08-07 17:47:13.065455","192.168.2.3","216.58.197.4","TLSv1.2","212","Application Data"
"234","2018-08-07 17:47:13.065456","192.168.2.3","216.58.197.4","TCP","1434","49253  >  443 [ACK] Seq=122188 Ack=1702 Win=1522 Len=1368 TSval=487149 TSecr=372706968 [TCP segment of a reassembled PDU]"
"235","2018-08-07 17:47:13.065798","192.168.2.3","216.58.197.4","TLSv1.2","155","Application Data"
"238","2018-08-07 17:47:13.069271","192.168.2.3","216.58.197.4","TCP","66","49253  >  443 [ACK] Seq=123645 Ack=1978 Win=1522 Len=0 TSval=487150 TSecr=372707028"
"241","2018-08-07 17:47:13.173658","192.168.2.3","203.211.199.120","TCP","66","42858  >  443 [ACK] Seq=1 Ack=1 Win=1004 Len=0 TSval=487160 TSecr=4163987257"
"242","2018-08-07 17:47:13.207295","192.168.2.3","216.58.197.4","TCP","1434","49253  >  443 [ACK] Seq=123645 Ack=1978 Win=1522 Len=1368 TSval=487162 TSecr=372707070 [TCP segment of a reassembled PDU]"
"243","2018-08-07 17:47:13.207301","192.168.2.3","216.58.197.4","TCP","1434","49253  >  443 [ACK] Seq=125013 Ack=1978 Win=1522 Len=1368 TSval=487162 TSecr=372707070 [TCP segment of a reassembled PDU]"
"244","2018-08-07 17:47:13.207302","192.168.2.3","216.58.197.4","TLSv1.2","212","Application Data"
"245","2018-08-07 17:47:13.207482","192.168.2.3","216.58.197.4","TLSv1.2","1230","Application Data"
"250","2018-08-07 17:47:13.267790","192.168.2.3","216.58.197.4","TCP","66","49253  >  443 [ACK] Seq=127691 Ack=2055 Win=1522 Len=0 TSval=487170 TSecr=372707225"
"251","2018-08-07 17:47:13.268031","192.168.2.3","216.58.197.4","TCP","66","49253  >  443 [ACK] Seq=127691 Ack=2329 Win=1522 Len=0 TSval=487170 TSecr=372707225"
"252","2018-08-07 17:47:13.289561","192.168.2.3","216.58.197.4","TCP","1434","49253  >  443 [ACK] Seq=127691 Ack=2329 Win=1522 Len=1368 TSval=487172 TSecr=372707225 [TCP segment of a reassembled PDU]"
"253","2018-08-07 17:47:13.290046","192.168.2.3","216.58.197.4","TCP","1434","49253  >  443 [ACK] Seq=129059 Ack=2329 Win=1522 Len=1368 TSval=487172 TSecr=372707225 [TCP segment of a reassembled PDU]"
"254","2018-08-07 17:47:13.290048","192.168.2.3","216.58.197.4","TLSv1.2","212","Application Data"
"255","2018-08-07 17:47:13.290505","192.168.2.3","216.58.197.4","TCP","1434","49253  >  443 [ACK] Seq=130573 Ack=2329 Win=1522 Len=1368 TSval=487172 TSecr=372707225 [TCP segment of a reassembled PDU]"
"256","2018-08-07 17:47:13.290507","192.168.2.3","216.58.197.4","TLSv1.2","155","Application Data"
"260","2018-08-07 17:47:13.385856","192.168.2.3","216.58.197.4","TCP","1434","49253  >  443 [ACK] Seq=132030 Ack=2329 Win=1522 Len=1368 TSval=487182 TSecr=372707255 [TCP segment of a reassembled PDU]"
"261","2018-08-07 17:47:13.386141","192.168.2.3","216.58.197.4","TCP","1434","49253  >  443 [ACK] Seq=133398 Ack=2329 Win=1522 Len=1368 TSval=487182 TSecr=372707255 [TCP segment of a reassembled PDU]"
"262","2018-08-07 17:47:13.386144","192.168.2.3","216.58.197.4","TLSv1.2","212","Application Data"
"263","2018-08-07 17:47:13.386145","192.168.2.3","216.58.197.4","TCP","1434","49253  >  443 [ACK] Seq=134912 Ack=2329 Win=1522 Len=1368 TSval=487182 TSecr=372707255 [TCP segment of a reassembled PDU]"
"264","2018-08-07 17:47:13.386293","192.168.2.3","216.58.197.4","TLSv1.2","155","Application Data"
"270","2018-08-07 17:47:13.443752","192.168.2.3","216.58.197.4","TCP","66","49253  >  443 [ACK] Seq=136369 Ack=2744 Win=1522 Len=0 TSval=487187 TSecr=372707400"
"271","2018-08-07 17:47:13.489053","192.168.2.3","216.58.197.4","TCP","1434","49253  >  443 [ACK] Seq=136369 Ack=2744 Win=1522 Len=1368 TSval=487192 TSecr=372707400 [TCP segment of a reassembled PDU]"
"272","2018-08-07 17:47:13.489272","192.168.2.3","216.58.197.4","TCP","1434","49253  >  443 [ACK] Seq=137737 Ack=2744 Win=1522 Len=1368 TSval=487192 TSecr=372707400 [TCP segment of a reassembled PDU]"
"273","2018-08-07 17:47:13.489274","192.168.2.3","216.58.197.4","TLSv1.2","212","Application Data"
"274","2018-08-07 17:47:13.489743","192.168.2.3","216.58.197.4","TLSv1.2","1367","Application Data"
"278","2018-08-07 17:47:13.614504","192.168.2.3","216.58.197.4","TCP","1434","49253  >  443 [ACK] Seq=140552 Ack=2744 Win=1522 Len=1368 TSval=487204 TSecr=372707454 [TCP segment of a reassembled PDU]"
"279","2018-08-07 17:47:13.614799","192.168.2.3","216.58.197.4","TCP","1434","49253  >  443 [ACK] Seq=141920 Ack=2744 Win=1522 Len=1368 TSval=487204 TSecr=372707454 [TCP segment of a reassembled PDU]"
"280","2018-08-07 17:47:13.614801","192.168.2.3","216.58.197.4","TLSv1.2","212","Application Data"
"281","2018-08-07 17:47:13.614802","192.168.2.3","216.58.197.4","TLSv1.2","846","Application Data"
"284","2018-08-07 17:47:13.738265","192.168.2.3","216.58.197.4","TCP","1434","49253  >  443 [ACK] Seq=144214 Ack=2744 Win=1522 Len=1368 TSval=487217 TSecr=372707580 [TCP segment of a reassembled PDU]"
"285","2018-08-07 17:47:13.738269","192.168.2.3","216.58.197.4","TCP","1434","49253  >  443 [ACK] Seq=145582 Ack=2744 Win=1522 Len=1368 TSval=487217 TSecr=372707580 [TCP segment of a reassembled PDU]"
"286","2018-08-07 17:47:13.738295","192.168.2.3","216.58.197.4","TLSv1.2","212","Application Data"
"287","2018-08-07 17:47:13.738560","192.168.2.3","216.58.197.4","TCP","1434","49253  >  443 [ACK] Seq=147096 Ack=2744 Win=1522 Len=1368 TSval=487217 TSecr=372707580 [TCP segment of a reassembled PDU]"
"288","2018-08-07 17:47:13.738561","192.168.2.3","216.58.197.4","TLSv1.2","104","Application Data"
"295","2018-08-07 17:47:13.748219","192.168.2.3","216.58.197.4","TCP","66","49253  >  443 [ACK] Seq=148502 Ack=3205 Win=1522 Len=0 TSval=487218 TSecr=372707707"
"296","2018-08-07 17:47:13.785038","192.168.2.3","216.58.197.4","TCP","66","49253  >  443 [ACK] Seq=148502 Ack=3446 Win=1522 Len=0 TSval=487222 TSecr=372707708"
"298","2018-08-07 17:47:13.836195","192.168.2.3","216.58.197.4","TCP","66","49253  >  443 [ACK] Seq=148502 Ack=3502 Win=1522 Len=0 TSval=487227 TSecr=372707796"
"299","2018-08-07 17:47:13.842248","192.168.2.3","216.58.197.4","TCP","1434","49253  >  443 [ACK] Seq=148502 Ack=3502 Win=1522 Len=1368 TSval=487227 TSecr=372707796 [TCP segment of a reassembled PDU]"
"300","2018-08-07 17:47:13.842538","192.168.2.3","216.58.197.4","TCP","1434","49253  >  443 [ACK] Seq=149870 Ack=3502 Win=1522 Len=1368 TSval=487227 TSecr=372707796 [TCP segment of a reassembled PDU]"
"301","2018-08-07 17:47:13.842540","192.168.2.3","216.58.197.4","TLSv1.2","212","Application Data"
"302","2018-08-07 17:47:13.842541","192.168.2.3","216.58.197.4","TLSv1.2","153","Application Data"
"306","2018-08-07 17:47:13.885208","192.168.2.3","216.58.197.4","TCP","66","49253  >  443 [ACK] Seq=151471 Ack=3780 Win=1522 Len=0 TSval=487232 TSecr=372707810"
"307","2018-08-07 17:47:13.967349","192.168.2.3","216.58.197.4","TCP","1434","49253  >  443 [ACK] Seq=151471 Ack=3780 Win=1522 Len=1368 TSval=487240 TSecr=372707810 [TCP segment of a reassembled PDU]"
"308","2018-08-07 17:47:13.967355","192.168.2.3","216.58.197.4","TCP","1434","49253  >  443 [ACK] Seq=152839 Ack=3780 Win=1522 Len=1368 TSval=487240 TSecr=372707810 [TCP segment of a reassembled PDU]"
"309","2018-08-07 17:47:13.967604","192.168.2.3","216.58.197.4","TLSv1.2","212","Application Data"
"310","2018-08-07 17:47:13.967605","192.168.2.3","216.58.197.4","TCP","1434","49253  >  443 [ACK] Seq=154353 Ack=3780 Win=1522 Len=1368 TSval=487240 TSecr=372707810 [TCP segment of a reassembled PDU]"
"311","2018-08-07 17:47:13.967606","192.168.2.3","216.58.197.4","TLSv1.2","104","Application Data"
"317","2018-08-07 17:47:14.033099","192.168.2.3","216.58.197.4","TCP","66","49253  >  443 [ACK] Seq=155759 Ack=3914 Win=1522 Len=0 TSval=487246 TSecr=372707990"
"318","2018-08-07 17:47:14.033484","192.168.2.3","216.58.197.4","TCP","66","49253  >  443 [ACK] Seq=155759 Ack=4071 Win=1522 Len=0 TSval=487246 TSecr=372707990"
"319","2018-08-07 17:47:14.086403","192.168.2.3","216.58.197.4","TCP","1434","49253  >  443 [ACK] Seq=155759 Ack=4071 Win=1522 Len=1368 TSval=487252 TSecr=372707990 [TCP segment of a reassembled PDU]"
"320","2018-08-07 17:47:14.086832","192.168.2.3","216.58.197.4","TCP","1434","49253  >  443 [ACK] Seq=157127 Ack=4071 Win=1522 Len=1368 TSval=487252 TSecr=372707990 [TCP segment of a reassembled PDU]"
"321","2018-08-07 17:47:14.086835","192.168.2.3","216.58.197.4","TLSv1.2","212","Application Data"
"322","2018-08-07 17:47:14.087253","192.168.2.3","216.58.197.4","TCP","1434","49253  >  443 [ACK] Seq=158641 Ack=4071 Win=1522 Len=1368 TSval=487252 TSecr=372707990 [TCP segment of a reassembled PDU]"
"323","2018-08-07 17:47:14.087256","192.168.2.3","216.58.197.4","TLSv1.2","107","Application Data"
"327","2018-08-07 17:47:14.197982","192.168.2.3","216.58.197.4","TCP","1434","49253  >  443 [ACK] Seq=160050 Ack=4071 Win=1522 Len=1368 TSval=487263 TSecr=372708052 [TCP segment of a reassembled PDU]"
"328","2018-08-07 17:47:14.197989","192.168.2.3","216.58.197.4","TCP","1434","49253  >  443 [ACK] Seq=161418 Ack=4071 Win=1522 Len=1368 TSval=487263 TSecr=372708052 [TCP segment of a reassembled PDU]"
"329","2018-08-07 17:47:14.197990","192.168.2.3","216.58.197.4","TLSv1.2","212","Application Data"
"330","2018-08-07 17:47:14.198161","192.168.2.3","216.58.197.4","TLSv1.2","490","Application Data"
"334","2018-08-07 17:47:14.251557","192.168.2.3","216.58.197.4","TCP","66","49253  >  443 [ACK] Seq=163356 Ack=4594 Win=1522 Len=0 TSval=487268 TSecr=372708210"
"335","2018-08-07 17:47:14.312166","192.168.2.3","216.58.197.4","TCP","1434","49253  >  443 [ACK] Seq=163356 Ack=4594 Win=1522 Len=1368 TSval=487274 TSecr=372708210 [TCP segment of a reassembled PDU]"
"336","2018-08-07 17:47:14.312533","192.168.2.3","8.8.8.8","DNS","79","Standard query 0x0545 A play.googleapis.com"
"337","2018-08-07 17:47:14.312535","192.168.2.3","8.8.8.8","DNS","79","Standard query 0xc7ad AAAA play.googleapis.com"
"338","2018-08-07 17:47:14.313012","192.168.2.3","216.58.197.4","TCP","1434","49253  >  443 [ACK] Seq=164724 Ack=4594 Win=1522 Len=1368 TSval=487274 TSecr=372708210 [TCP segment of a reassembled PDU]"
"339","2018-08-07 17:47:14.313014","192.168.2.3","216.58.197.4","TLSv1.2","212","Application Data"
"340","2018-08-07 17:47:14.313360","192.168.2.3","216.58.197.4","TLSv1.2","1157","Application Data"
"341","2018-08-07 17:47:14.313362","192.168.2.3","216.58.197.4","TLSv1.2","102","Application Data"
"346","2018-08-07 17:47:14.329548","192.168.2.3","216.58.197.4","TCP","66","49253  >  443 [ACK] Seq=167365 Ack=5087 Win=1522 Len=0 TSval=487276 TSecr=372708288"
"348","2018-08-07 17:47:14.331761","192.168.2.3","216.58.197.4","TCP","66","49253  >  443 [ACK] Seq=167365 Ack=5231 Win=1522 Len=0 TSval=487276 TSecr=372708290"
"351","2018-08-07 17:47:14.364896","192.168.2.3","172.217.161.202","TCP","74","40750  >  443 [SYN] Seq=0 Win=14600 Len=0 MSS=1460 SACK_PERM=1 TSval=487279 TSecr=0 WS=64"
"353","2018-08-07 17:47:14.371541","192.168.2.3","172.217.161.202","TCP","66","40750  >  443 [ACK] Seq=1 Ack=1 Win=14656 Len=0 TSval=487280 TSecr=3727514283"
"354","2018-08-07 17:47:14.372147","192.168.2.3","172.217.161.202","TLSv1.2","583","Client Hello"
"358","2018-08-07 17:47:14.413845","192.168.2.3","172.217.161.202","TCP","66","40750  >  443 [ACK] Seq=518 Ack=153 Win=15680 Len=0 TSval=487284 TSecr=3727514317"
"359","2018-08-07 17:47:14.414104","192.168.2.3","172.217.161.202","TLSv1.2","266","Change Cipher Spec, Encrypted Handshake Message, Encrypted Handshake Message"
"361","2018-08-07 17:47:14.442585","192.168.2.3","172.217.161.202","TLSv1.2","151","Application Data"
"362","2018-08-07 17:47:14.442589","192.168.2.3","172.217.161.202","TLSv1.2","96","Application Data"
"363","2018-08-07 17:47:14.442590","192.168.2.3","172.217.161.202","TLSv1.2","302","Application Data"
"364","2018-08-07 17:47:14.442735","192.168.2.3","172.217.161.202","TCP","1434","40750  >  443 [ACK] Seq=1069 Ack=214 Win=15680 Len=1368 TSval=487287 TSecr=3727514332 [TCP segment of a reassembled PDU]"
"365","2018-08-07 17:47:14.442949","192.168.2.3","172.217.161.202","TCP","1434","40750  >  443 [ACK] Seq=2437 Ack=214 Win=15680 Len=1368 TSval=487287 TSecr=3727514332 [TCP segment of a reassembled PDU]"
"366","2018-08-07 17:47:14.442951","192.168.2.3","172.217.161.202","TLSv1.2","212","Application Data"
"367","2018-08-07 17:47:14.443087","192.168.2.3","172.217.161.202","TLSv1.2","840","Application Data"
"371","2018-08-07 17:47:14.484265","192.168.2.3","172.217.161.202","TCP","66","40750  >  443 [ACK] Seq=4725 Ack=244 Win=15680 Len=0 TSval=487292 TSecr=3727514360"
"376","2018-08-07 17:47:14.558147","192.168.2.3","172.217.161.202","TCP","66","40750  >  443 [ACK] Seq=4725 Ack=656 Win=17856 Len=0 TSval=487299 TSecr=3727514467"
"377","2018-08-07 17:47:14.558303","192.168.2.3","172.217.161.202","TCP","66","40750  >  443 [ACK] Seq=4725 Ack=787 Win=18944 Len=0 TSval=487299 TSecr=3727514467"
"378","2018-08-07 17:47:14.558305","192.168.2.3","172.217.161.202","TCP","66","40750  >  443 [ACK] Seq=4725 Ack=825 Win=18944 Len=0 TSval=487299 TSecr=3727514468"
"379","2018-08-07 17:47:14.560668","192.168.2.3","172.217.161.202","TLSv1.2","104","Application Data"
"382","2018-08-07 17:47:14.717018","192.168.2.3","216.58.197.4","TCP","66","49253  >  443 [ACK] Seq=167365 Ack=5331 Win=1522 Len=0 TSval=487315 TSecr=372708676"
"387","2018-08-07 17:47:14.749841","192.168.2.3","216.58.197.4","TCP","66","49253  >  443 [ACK] Seq=167365 Ack=6749 Win=1512 Len=0 TSval=487318 TSecr=372708705"
"388","2018-08-07 17:47:14.749843","192.168.2.3","216.58.197.4","TCP","66","49253  >  443 [ACK] Seq=167365 Ack=8167 Win=1512 Len=0 TSval=487318 TSecr=372708705"
"389","2018-08-07 17:47:14.751171","192.168.2.3","216.58.197.4","TCP","66","49253  >  443 [ACK] Seq=167365 Ack=9585 Win=1512 Len=0 TSval=487318 TSecr=372708705"
"390","2018-08-07 17:47:14.754482","192.168.2.3","216.58.197.4","TCP","66","49253  >  443 [ACK] Seq=167365 Ack=9818 Win=1512 Len=0 TSval=487318 TSecr=372708705"
"399","2018-08-07 17:47:14.764805","192.168.2.3","216.58.197.4","TCP","66","49253  >  443 [ACK] Seq=167365 Ack=11236 Win=1512 Len=0 TSval=487320 TSecr=372708723"
"400","2018-08-07 17:47:14.764807","192.168.2.3","216.58.197.4","TCP","66","49253  >  443 [ACK] Seq=167365 Ack=11747 Win=1512 Len=0 TSval=487320 TSecr=372708723"
"401","2018-08-07 17:47:14.766053","192.168.2.3","216.58.197.4","TCP","66","49253  >  443 [ACK] Seq=167365 Ack=13490 Win=1512 Len=0 TSval=487320 TSecr=372708723"
"402","2018-08-07 17:47:14.766356","192.168.2.3","216.58.197.4","TCP","66","49253  >  443 [ACK] Seq=167365 Ack=14908 Win=1512 Len=0 TSval=487320 TSecr=372708724"
"403","2018-08-07 17:47:14.766357","192.168.2.3","216.58.197.4","TCP","66","49253  >  443 [ACK] Seq=167365 Ack=15226 Win=1522 Len=0 TSval=487320 TSecr=372708724"
"404","2018-08-07 17:47:14.766689","192.168.2.3","216.58.197.4","TCP","66","49253  >  443 [ACK] Seq=167365 Ack=16644 Win=1503 Len=0 TSval=487320 TSecr=372708724"
"405","2018-08-07 17:47:14.766947","192.168.2.3","216.58.197.4","TCP","66","49253  >  443 [ACK] Seq=167365 Ack=17348 Win=1522 Len=0 TSval=487320 TSecr=372708724"
"407","2018-08-07 17:47:14.841559","192.168.2.3","216.58.197.4","TCP","66","49253  >  443 [ACK] Seq=167365 Ack=17435 Win=1522 Len=0 TSval=487327 TSecr=372708796"
"414","2018-08-07 17:47:14.928986","192.168.2.3","216.58.197.4","TCP","66","49253  >  443 [ACK] Seq=167365 Ack=17591 Win=1522 Len=0 TSval=487336 TSecr=372708888"
"415","2018-08-07 17:47:14.928989","192.168.2.3","216.58.197.4","TCP","66","49253  >  443 [ACK] Seq=167365 Ack=17656 Win=1522 Len=0 TSval=487336 TSecr=372708888"
"416","2018-08-07 17:47:14.929234","192.168.2.3","216.58.197.4","TCP","66","49253  >  443 [ACK] Seq=167365 Ack=17791 Win=1522 Len=0 TSval=487336 TSecr=372708888"
"417","2018-08-07 17:47:14.930148","192.168.2.3","216.58.197.4","TCP","66","49253  >  443 [ACK] Seq=167365 Ack=18060 Win=1522 Len=0 TSval=487336 TSecr=372708888"
"418","2018-08-07 17:47:14.930743","192.168.2.3","216.58.197.4","TLSv1.2","104","Application Data"
"420","2018-08-07 17:47:14.977439","192.168.2.3","172.217.27.174","TCP","1434","[TCP Previous segment not captured] 52293  >  443 [ACK] Seq=2 Ack=1 Win=661 Len=1368 TSval=487341 TSecr=874366199 [TCP segment of a reassembled PDU]"
"421","2018-08-07 17:47:14.977442","192.168.2.3","172.217.27.174","TCP","1434","52293  >  443 [ACK] Seq=1370 Ack=1 Win=661 Len=1368 TSval=487341 TSecr=874366199 [TCP segment of a reassembled PDU]"
"422","2018-08-07 17:47:14.977630","192.168.2.3","172.217.27.174","TLSv1.2","576","Application Data"
"423","2018-08-07 17:47:14.977632","192.168.2.3","172.217.27.174","TLSv1.2","104","Application Data"
"429","2018-08-07 17:47:15.022819","192.168.2.3","216.58.197.4","TLSv1.2","156","Application Data"
"430","2018-08-07 17:47:15.022823","192.168.2.3","216.58.197.4","TLSv1.2","159","Application Data"
"431","2018-08-07 17:47:15.022824","192.168.2.3","216.58.197.4","TCP","1434","49253  >  443 [ACK] Seq=167586 Ack=18060 Win=1522 Len=1368 TSval=487345 TSecr=372708935 [TCP segment of a reassembled PDU]"
"432","2018-08-07 17:47:15.023069","192.168.2.3","216.58.197.4","TCP","1434","49253  >  443 [ACK] Seq=168954 Ack=18060 Win=1522 Len=1368 TSval=487345 TSecr=372708935 [TCP segment of a reassembled PDU]"
"433","2018-08-07 17:47:15.023072","192.168.2.3","216.58.197.4","TLSv1.2","212","Application Data"
"434","2018-08-07 17:47:15.023402","192.168.2.3","216.58.197.4","TCP","1434","49253  >  443 [ACK] Seq=170468 Ack=18060 Win=1522 Len=1368 TSval=487345 TSecr=372708935 [TCP segment of a reassembled PDU]"
"435","2018-08-07 17:47:15.023404","192.168.2.3","216.58.197.4","TCP","1434","49253  >  443 [ACK] Seq=171836 Ack=18060 Win=1522 Len=1368 TSval=487345 TSecr=372708935 [TCP segment of a reassembled PDU]"
"436","2018-08-07 17:47:15.023405","192.168.2.3","216.58.197.4","TLSv1.2","212","Application Data"
