"No.","Time","Source","Destination","Protocol","Length","Info"
"1","2018-08-07 17:40:35.640011","192.168.2.3","172.217.161.234","TCP","66","58364  >  443 [ACK] Seq=1 Ack=1 Win=495 Len=0 TSval=447408 TSecr=3656779693"
"3","2018-08-07 17:40:39.036704","192.168.2.3","216.58.197.4","TLSv1.2","156","Application Data"
"4","2018-08-07 17:40:39.037094","192.168.2.3","216.58.197.4","TLSv1.2","104","Application Data"
"5","2018-08-07 17:40:39.040574","192.168.2.3","216.58.197.4","TLSv1.2","159","Application Data"
"9","2018-08-07 17:40:39.048820","192.168.2.3","216.58.197.4","TCP","1434","49253  >  443 [ACK] Seq=222 Ack=39 Win=998 Len=1368 TSval=447748 TSecr=372313001 [TCP segment of a reassembled PDU]"
"10","2018-08-07 17:40:39.049107","192.168.2.3","216.58.197.4","TCP","1434","49253  >  443 [ACK] Seq=1590 Ack=39 Win=998 Len=1368 TSval=447748 TSecr=372313001 [TCP segment of a reassembled PDU]"
"11","2018-08-07 17:40:39.049109","192.168.2.3","216.58.197.4","TLSv1.2","212","Application Data"
"12","2018-08-07 17:40:39.051743","192.168.2.3","216.58.197.4","TCP","1434","49253  >  443 [ACK] Seq=3104 Ack=39 Win=998 Len=1368 TSval=447748 TSecr=372313001 [TCP segment of a reassembled PDU]"
"13","2018-08-07 17:40:39.051746","192.168.2.3","216.58.197.4","TLSv1.2","143","Application Data"
"14","2018-08-07 17:40:39.051909","192.168.2.3","216.58.197.4","TCP","1434","49253  >  443 [ACK] Seq=4549 Ack=39 Win=998 Len=1368 TSval=447748 TSecr=372313001 [TCP segment of a reassembled PDU]"
"15","2018-08-07 17:40:39.052071","192.168.2.3","216.58.197.4","TCP","1434","49253  >  443 [ACK] Seq=5917 Ack=39 Win=998 Len=1368 TSval=447748 TSecr=372313001 [TCP segment of a reassembled PDU]"
"16","2018-08-07 17:40:39.052074","192.168.2.3","216.58.197.4","TLSv1.2","212","Application Data"
"17","2018-08-07 17:40:39.052539","192.168.2.3","216.58.197.4","TCP","1434","49253  >  443 [ACK] Seq=7431 Ack=39 Win=998 Len=1368 TSval=447748 TSecr=372313001 [TCP segment of a reassembled PDU]"
"20","2018-08-07 17:40:39.054864","192.168.2.3","216.58.197.4","TCP","1434","49253  >  443 [ACK] Seq=8799 Ack=39 Win=998 Len=1368 TSval=447749 TSecr=372313012 [TCP segment of a reassembled PDU]"
"21","2018-08-07 17:40:39.055276","192.168.2.3","216.58.197.4","TLSv1.2","1434","Application Data [TCP segment of a reassembled PDU]"
"22","2018-08-07 17:40:39.055568","192.168.2.3","216.58.197.4","TCP","1434","49253  >  443 [ACK] Seq=11535 Ack=39 Win=998 Len=1368 TSval=447749 TSecr=372313012 [TCP segment of a reassembled PDU]"
"23","2018-08-07 17:40:39.056028","192.168.2.3","216.58.197.4","TLSv1.2","1434","Application Data [TCP segment of a reassembled PDU]"
"24","2018-08-07 17:40:39.056030","192.168.2.3","216.58.197.4","TCP","1434","49253  >  443 [ACK] Seq=14271 Ack=39 Win=998 Len=1368 TSval=447749 TSecr=372313013 [TCP segment of a reassembled PDU]"
"26","2018-08-07 17:40:39.056307","192.168.2.3","216.58.197.4","TLSv1.2","1434","Application Data [TCP segment of a reassembled PDU]"
"29","2018-08-07 17:40:39.058154","192.168.2.3","216.58.197.4","TCP","1434","49253  >  443 [ACK] Seq=17007 Ack=39 Win=998 Len=1368 TSval=447749 TSecr=372313015 [TCP segment of a reassembled PDU]"
"30","2018-08-07 17:40:39.058157","192.168.2.3","216.58.197.4","TLSv1.2","1434","Application Data [TCP segment of a reassembled PDU]"
"31","2018-08-07 17:40:39.058500","192.168.2.3","216.58.197.4","TCP","1434","49253  >  443 [ACK] Seq=19743 Ack=39 Win=998 Len=1368 TSval=447749 TSecr=372313015 [TCP segment of a reassembled PDU]"
"35","2018-08-07 17:40:39.061706","192.168.2.3","216.58.197.4","TLSv1.2","1434","Application Data, Application Data"
"36","2018-08-07 17:40:39.061948","192.168.2.3","216.58.197.4","TCP","1434","49253  >  443 [ACK] Seq=22479 Ack=39 Win=998 Len=1368 TSval=447749 TSecr=372313016 [TCP segment of a reassembled PDU]"
"37","2018-08-07 17:40:39.062097","192.168.2.3","216.58.197.4","TLSv1.2","1434","Application Data [TCP segment of a reassembled PDU]"
"38","2018-08-07 17:40:39.062098","192.168.2.3","216.58.197.4","TLSv1.2","1434","Application Data [TCP segment of a reassembled PDU]"
"39","2018-08-07 17:40:39.062302","192.168.2.3","216.58.197.4","TCP","1434","49253  >  443 [ACK] Seq=26583 Ack=39 Win=998 Len=1368 TSval=447749 TSecr=372313016 [TCP segment of a reassembled PDU]"
"40","2018-08-07 17:40:39.062899","192.168.2.3","216.58.197.4","TLSv1.2","1434","Application Data [TCP segment of a reassembled PDU]"
"42","2018-08-07 17:40:39.064133","192.168.2.3","216.58.197.4","TCP","1434","49253  >  443 [ACK] Seq=29319 Ack=39 Win=998 Len=1368 TSval=447750 TSecr=372313019 [TCP segment of a reassembled PDU]"
"43","2018-08-07 17:40:39.065266","192.168.2.3","216.58.197.4","TLSv1.2","1434","Application Data [TCP segment of a reassembled PDU]"
"44","2018-08-07 17:40:39.065269","192.168.2.3","216.58.197.4","TCP","1434","49253  >  443 [ACK] Seq=32055 Ack=39 Win=998 Len=1368 TSval=447750 TSecr=372313019 [TCP segment of a reassembled PDU]"
"45","2018-08-07 17:40:39.065465","192.168.2.3","216.58.197.4","TCP","1434","49253  >  443 [ACK] Seq=33423 Ack=39 Win=998 Len=1368 TSval=447750 TSecr=372313020 [TCP segment of a reassembled PDU]"
"46","2018-08-07 17:40:39.066483","192.168.2.3","216.58.197.4","TLSv1.2","1434","Application Data [TCP segment of a reassembled PDU]"
"47","2018-08-07 17:40:39.066485","192.168.2.3","216.58.197.4","TCP","1434","49253  >  443 [ACK] Seq=36159 Ack=39 Win=998 Len=1368 TSval=447750 TSecr=372313020 [TCP segment of a reassembled PDU]"
"50","2018-08-07 17:40:39.066614","192.168.2.3","216.58.197.4","TLSv1.2","1434","Application Data [TCP segment of a reassembled PDU]"
"51","2018-08-07 17:40:39.066987","192.168.2.3","216.58.197.4","TCP","1434","49253  >  443 [ACK] Seq=38895 Ack=39 Win=998 Len=1368 TSval=447750 TSecr=372313020 [TCP segment of a reassembled PDU]"
"52","2018-08-07 17:40:39.066989","192.168.2.3","216.58.197.4","TLSv1.2","1434","Application Data [TCP segment of a reassembled PDU]"
"53","2018-08-07 17:40:39.067208","192.168.2.3","216.58.197.4","TLSv1.2","1434","Application Data [TCP segment of a reassembled PDU]"
"54","2018-08-07 17:40:39.067210","192.168.2.3","216.58.197.4","TCP","1434","49253  >  443 [ACK] Seq=42999 Ack=39 Win=998 Len=1368 TSval=447750 TSecr=372313022 [TCP segment of a reassembled PDU]"
"55","2018-08-07 17:40:39.067399","192.168.2.3","216.58.197.4","TLSv1.2","1434","Application Data [TCP segment of a reassembled PDU]"
"57","2018-08-07 17:40:39.067869","192.168.2.3","216.58.197.4","TCP","1434","49253  >  443 [ACK] Seq=45735 Ack=39 Win=998 Len=1368 TSval=447750 TSecr=372313022 [TCP segment of a reassembled PDU]"
"58","2018-08-07 17:40:39.069257","192.168.2.3","216.58.197.4","TCP","1434","49253  >  443 [ACK] Seq=47103 Ack=39 Win=998 Len=1368 TSval=447750 TSecr=372313025 [TCP segment of a reassembled PDU]"
"60","2018-08-07 17:40:39.069637","192.168.2.3","216.58.197.4","TLSv1.2","1434","Application Data [TCP segment of a reassembled PDU]"
"61","2018-08-07 17:40:39.069640","192.168.2.3","216.58.197.4","TCP","1434","49253  >  443 [ACK] Seq=49839 Ack=39 Win=998 Len=1368 TSval=447750 TSecr=372313025 [TCP segment of a reassembled PDU]"
"62","2018-08-07 17:40:39.069903","192.168.2.3","216.58.197.4","TLSv1.2","1434","Application Data [TCP segment of a reassembled PDU]"
"64","2018-08-07 17:40:39.070091","192.168.2.3","216.58.197.4","TCP","1434","49253  >  443 [PSH, ACK] Seq=52575 Ack=39 Win=998 Len=1368 TSval=447750 TSecr=372313026 [TCP segment of a reassembled PDU]"
"65","2018-08-07 17:40:39.070440","192.168.2.3","216.58.197.4","TLSv1.2","1434","Application Data [TCP segment of a reassembled PDU]"
"66","2018-08-07 17:40:39.070442","192.168.2.3","216.58.197.4","TCP","1434","49253  >  443 [ACK] Seq=55311 Ack=39 Win=998 Len=1368 TSval=447750 TSecr=372313027 [TCP segment of a reassembled PDU]"
"68","2018-08-07 17:40:39.070755","192.168.2.3","216.58.197.4","TLSv1.2","1434","Application Data [TCP segment of a reassembled PDU]"
"75","2018-08-07 17:40:39.075026","192.168.2.3","216.58.197.4","TLSv1.2","1434","Application Data [TCP segment of a reassembled PDU]"
"76","2018-08-07 17:40:39.075030","192.168.2.3","216.58.197.4","TLSv1.2","378","Application Data"
"80","2018-08-07 17:40:39.143576","192.168.2.3","216.58.197.4","TCP","1434","49253  >  443 [ACK] Seq=59727 Ack=39 Win=998 Len=1368 TSval=447758 TSecr=372313078 [TCP segment of a reassembled PDU]"
"81","2018-08-07 17:40:39.143725","192.168.2.3","216.58.197.4","TCP","1434","49253  >  443 [ACK] Seq=61095 Ack=39 Win=998 Len=1368 TSval=447758 TSecr=372313078 [TCP segment of a reassembled PDU]"
"82","2018-08-07 17:40:39.143727","192.168.2.3","216.58.197.4","TLSv1.2","212","Application Data"
"83","2018-08-07 17:40:39.143916","192.168.2.3","216.58.197.4","TCP","1434","49253  >  443 [ACK] Seq=62609 Ack=39 Win=998 Len=1368 TSval=447758 TSecr=372313078 [TCP segment of a reassembled PDU]"
"84","2018-08-07 17:40:39.143918","192.168.2.3","216.58.197.4","TLSv1.2","155","Application Data"
"88","2018-08-07 17:40:39.258779","192.168.2.3","216.58.197.4","TCP","1434","49253  >  443 [ACK] Seq=64066 Ack=39 Win=998 Len=1368 TSval=447769 TSecr=372313108 [TCP segment of a reassembled PDU]"
"89","2018-08-07 17:40:39.259105","192.168.2.3","216.58.197.4","TCP","1434","49253  >  443 [ACK] Seq=65434 Ack=39 Win=998 Len=1368 TSval=447769 TSecr=372313108 [TCP segment of a reassembled PDU]"
"90","2018-08-07 17:40:39.259107","192.168.2.3","216.58.197.4","TLSv1.2","212","Application Data"
"91","2018-08-07 17:40:39.259108","192.168.2.3","216.58.197.4","TLSv1.2","166","Application Data"
"94","2018-08-07 17:40:39.375230","192.168.2.3","216.58.197.4","TCP","1434","49253  >  443 [ACK] Seq=67048 Ack=39 Win=998 Len=1368 TSval=447780 TSecr=372313223 [TCP segment of a reassembled PDU]"
"95","2018-08-07 17:40:39.375452","192.168.2.3","216.58.197.4","TCP","1434","49253  >  443 [ACK] Seq=68416 Ack=39 Win=998 Len=1368 TSval=447780 TSecr=372313223 [TCP segment of a reassembled PDU]"
"96","2018-08-07 17:40:39.375453","192.168.2.3","216.58.197.4","TLSv1.2","212","Application Data"
"97","2018-08-07 17:40:39.375454","192.168.2.3","216.58.197.4","TLSv1.2","547","Application Data"
"100","2018-08-07 17:40:39.480655","192.168.2.3","216.58.197.4","TCP","1434","49253  >  443 [ACK] Seq=70411 Ack=39 Win=998 Len=1368 TSval=447791 TSecr=372313339 [TCP segment of a reassembled PDU]"
"101","2018-08-07 17:40:39.480665","192.168.2.3","216.58.197.4","TCP","1434","49253  >  443 [ACK] Seq=71779 Ack=39 Win=998 Len=1368 TSval=447791 TSecr=372313339 [TCP segment of a reassembled PDU]"
"102","2018-08-07 17:40:39.480778","192.168.2.3","216.58.197.4","TLSv1.2","212","Application Data"
"103","2018-08-07 17:40:39.480780","192.168.2.3","216.58.197.4","TLSv1.2","394","Application Data"
"108","2018-08-07 17:40:39.548334","192.168.2.3","216.58.197.4","TCP","66","49253  >  443 [ACK] Seq=73621 Ack=357 Win=998 Len=0 TSval=447798 TSecr=372313503"
"110","2018-08-07 17:40:39.573492","192.168.2.3","216.58.197.4","TCP","66","49253  >  443 [ACK] Seq=73621 Ack=792 Win=998 Len=0 TSval=447801 TSecr=372313503"
"111","2018-08-07 17:40:39.581402","192.168.2.3","216.58.197.4","TCP","1434","49253  >  443 [ACK] Seq=73621 Ack=792 Win=998 Len=1368 TSval=447802 TSecr=372313503 [TCP segment of a reassembled PDU]"
"112","2018-08-07 17:40:39.581796","192.168.2.3","216.58.197.4","TCP","1434","49253  >  443 [ACK] Seq=74989 Ack=792 Win=998 Len=1368 TSval=447802 TSecr=372313503 [TCP segment of a reassembled PDU]"
"113","2018-08-07 17:40:39.581799","192.168.2.3","216.58.197.4","TLSv1.2","212","Application Data"
"114","2018-08-07 17:40:39.581799","192.168.2.3","216.58.197.4","TLSv1.2","304","Application Data"
"118","2018-08-07 17:40:39.684982","192.168.2.3","216.58.197.4","TCP","1434","49253  >  443 [ACK] Seq=76741 Ack=792 Win=998 Len=1368 TSval=447812 TSecr=372313545 [TCP segment of a reassembled PDU]"
"119","2018-08-07 17:40:39.688147","192.168.2.3","216.58.197.4","TCP","1434","49253  >  443 [ACK] Seq=78109 Ack=792 Win=998 Len=1368 TSval=447812 TSecr=372313545 [TCP segment of a reassembled PDU]"
"120","2018-08-07 17:40:39.688149","192.168.2.3","216.58.197.4","TLSv1.2","212","Application Data"
"121","2018-08-07 17:40:39.688150","192.168.2.3","216.58.197.4","TLSv1.2","563","Application Data"
"125","2018-08-07 17:40:39.743097","192.168.2.3","216.58.197.4","TCP","66","49253  >  443 [ACK] Seq=80120 Ack=921 Win=998 Len=0 TSval=447818 TSecr=372313659"
"126","2018-08-07 17:40:39.803329","192.168.2.3","216.58.197.4","TCP","1434","49253  >  443 [ACK] Seq=80120 Ack=921 Win=998 Len=1368 TSval=447824 TSecr=372313659 [TCP segment of a reassembled PDU]"
"127","2018-08-07 17:40:39.803333","192.168.2.3","216.58.197.4","TCP","1434","49253  >  443 [ACK] Seq=81488 Ack=921 Win=998 Len=1368 TSval=447824 TSecr=372313659 [TCP segment of a reassembled PDU]"
"128","2018-08-07 17:40:39.803524","192.168.2.3","216.58.197.4","TLSv1.2","212","Application Data"
"129","2018-08-07 17:40:39.803527","192.168.2.3","216.58.197.4","TLSv1.2","394","Application Data"
"133","2018-08-07 17:40:39.896126","192.168.2.3","216.58.197.4","TCP","66","49253  >  443 [ACK] Seq=83330 Ack=984 Win=998 Len=0 TSval=447833 TSecr=372313853"
"134","2018-08-07 17:40:39.911965","192.168.2.3","216.58.197.4","TCP","1434","49253  >  443 [ACK] Seq=83330 Ack=984 Win=998 Len=1368 TSval=447835 TSecr=372313853 [TCP segment of a reassembled PDU]"
"135","2018-08-07 17:40:39.913065","192.168.2.3","216.58.197.4","TCP","1434","49253  >  443 [ACK] Seq=84698 Ack=984 Win=998 Len=1368 TSval=447835 TSecr=372313853 [TCP segment of a reassembled PDU]"
"136","2018-08-07 17:40:39.913068","192.168.2.3","216.58.197.4","TLSv1.2","212","Application Data"
"137","2018-08-07 17:40:39.913068","192.168.2.3","216.58.197.4","TLSv1.2","333","Application Data"
"141","2018-08-07 17:40:40.024266","192.168.2.3","216.58.197.4","TCP","1434","49253  >  443 [ACK] Seq=86479 Ack=984 Win=998 Len=1368 TSval=447846 TSecr=372313877 [TCP segment of a reassembled PDU]"
"142","2018-08-07 17:40:40.024554","192.168.2.3","216.58.197.4","TCP","1434","49253  >  443 [ACK] Seq=87847 Ack=984 Win=998 Len=1368 TSval=447846 TSecr=372313877 [TCP segment of a reassembled PDU]"
"143","2018-08-07 17:40:40.024556","192.168.2.3","216.58.197.4","TLSv1.2","212","Application Data"
"144","2018-08-07 17:40:40.024557","192.168.2.3","216.58.197.4","TLSv1.2","858","Application Data"
"147","2018-08-07 17:40:40.101039","192.168.2.3","216.58.197.4","TCP","1434","49253  >  443 [ACK] Seq=90153 Ack=984 Win=998 Len=1368 TSval=447854 TSecr=372313988 [TCP segment of a reassembled PDU]"
"148","2018-08-07 17:40:40.101296","192.168.2.3","216.58.197.4","TCP","1434","49253  >  443 [ACK] Seq=91521 Ack=984 Win=998 Len=1368 TSval=447854 TSecr=372313988 [TCP segment of a reassembled PDU]"
"149","2018-08-07 17:40:40.101298","192.168.2.3","216.58.197.4","TLSv1.2","212","Application Data"
"150","2018-08-07 17:40:40.101299","192.168.2.3","216.58.197.4","TCP","1434","49253  >  443 [ACK] Seq=93035 Ack=984 Win=998 Len=1368 TSval=447854 TSecr=372313988 [TCP segment of a reassembled PDU]"
"151","2018-08-07 17:40:40.101626","192.168.2.3","216.58.197.4","TLSv1.2","155","Application Data"
"155","2018-08-07 17:40:40.223083","192.168.2.3","216.58.197.4","TCP","1434","49253  >  443 [ACK] Seq=94492 Ack=984 Win=998 Len=1368 TSval=447865 TSecr=372314065 [TCP segment of a reassembled PDU]"
"156","2018-08-07 17:40:40.223089","192.168.2.3","216.58.197.4","TCP","1434","49253  >  443 [ACK] Seq=95860 Ack=984 Win=998 Len=1368 TSval=447865 TSecr=372314065 [TCP segment of a reassembled PDU]"
"157","2018-08-07 17:40:40.223090","192.168.2.3","216.58.197.4","TLSv1.2","212","Application Data"
"158","2018-08-07 17:40:40.223268","192.168.2.3","216.58.197.4","TLSv1.2","725","Application Data"
"161","2018-08-07 17:40:40.317091","192.168.2.3","216.58.197.4","TCP","1434","49253  >  443 [ACK] Seq=98033 Ack=984 Win=998 Len=1368 TSval=447875 TSecr=372314187 [TCP segment of a reassembled PDU]"
"162","2018-08-07 17:40:40.317512","192.168.2.3","216.58.197.4","TCP","1434","49253  >  443 [ACK] Seq=99401 Ack=984 Win=998 Len=1368 TSval=447875 TSecr=372314187 [TCP segment of a reassembled PDU]"
"163","2018-08-07 17:40:40.317514","192.168.2.3","216.58.197.4","TLSv1.2","212","Application Data"
"164","2018-08-07 17:40:40.317909","192.168.2.3","216.58.197.4","TCP","1434","49253  >  443 [ACK] Seq=100915 Ack=984 Win=998 Len=1368 TSval=447875 TSecr=372314187 [TCP segment of a reassembled PDU]"
"165","2018-08-07 17:40:40.317911","192.168.2.3","216.58.197.4","TLSv1.2","155","Application Data"
"169","2018-08-07 17:40:40.408273","192.168.2.3","216.58.197.4","TCP","1434","49253  >  443 [ACK] Seq=102372 Ack=984 Win=998 Len=1368 TSval=447884 TSecr=372314281 [TCP segment of a reassembled PDU]"
"170","2018-08-07 17:40:40.408621","192.168.2.3","216.58.197.4","TCP","1434","49253  >  443 [ACK] Seq=103740 Ack=984 Win=998 Len=1368 TSval=447884 TSecr=372314281 [TCP segment of a reassembled PDU]"
"171","2018-08-07 17:40:40.408623","192.168.2.3","216.58.197.4","TLSv1.2","212","Application Data"
"172","2018-08-07 17:40:40.408905","192.168.2.3","216.58.197.4","TCP","1434","49253  >  443 [ACK] Seq=105254 Ack=984 Win=998 Len=1368 TSval=447884 TSecr=372314281 [TCP segment of a reassembled PDU]"
"173","2018-08-07 17:40:40.408908","192.168.2.3","216.58.197.4","TLSv1.2","155","Application Data"
"177","2018-08-07 17:40:40.487574","192.168.2.3","216.58.197.4","TCP","1434","49253  >  443 [ACK] Seq=106711 Ack=984 Win=998 Len=1368 TSval=447892 TSecr=372314372 [TCP segment of a reassembled PDU]"
"178","2018-08-07 17:40:40.487969","192.168.2.3","216.58.197.4","TCP","1434","49253  >  443 [ACK] Seq=108079 Ack=984 Win=998 Len=1368 TSval=447892 TSecr=372314372 [TCP segment of a reassembled PDU]"
"179","2018-08-07 17:40:40.487971","192.168.2.3","216.58.197.4","TLSv1.2","212","Application Data"
"180","2018-08-07 17:40:40.488241","192.168.2.3","216.58.197.4","TCP","1434","49253  >  443 [ACK] Seq=109593 Ack=984 Win=998 Len=1368 TSval=447892 TSecr=372314372 [TCP segment of a reassembled PDU]"
"181","2018-08-07 17:40:40.488243","192.168.2.3","216.58.197.4","TLSv1.2","155","Application Data"
"189","2018-08-07 17:40:40.559930","192.168.2.3","216.58.197.4","TCP","66","49253  >  443 [ACK] Seq=111050 Ack=1678 Win=998 Len=0 TSval=447899 TSecr=372314504"
"190","2018-08-07 17:40:40.572913","192.168.2.3","216.58.197.4","TCP","1434","49253  >  443 [ACK] Seq=111050 Ack=1739 Win=998 Len=1368 TSval=447901 TSecr=372314518 [TCP segment of a reassembled PDU]"
"191","2018-08-07 17:40:40.572918","192.168.2.3","216.58.197.4","TCP","1434","49253  >  443 [ACK] Seq=112418 Ack=1739 Win=998 Len=1368 TSval=447901 TSecr=372314518 [TCP segment of a reassembled PDU]"
"192","2018-08-07 17:40:40.572920","192.168.2.3","216.58.197.4","TLSv1.2","212","Application Data"
"193","2018-08-07 17:40:40.573120","192.168.2.3","216.58.197.4","TCP","1434","49253  >  443 [ACK] Seq=113932 Ack=1739 Win=998 Len=1368 TSval=447901 TSecr=372314518 [TCP segment of a reassembled PDU]"
"194","2018-08-07 17:40:40.573121","192.168.2.3","216.58.197.4","TLSv1.2","155","Application Data"
"198","2018-08-07 17:40:40.669845","192.168.2.3","216.58.197.4","TCP","1434","49253  >  443 [ACK] Seq=115389 Ack=1739 Win=998 Len=1368 TSval=447910 TSecr=372314537 [TCP segment of a reassembled PDU]"
"199","2018-08-07 17:40:40.670118","192.168.2.3","216.58.197.4","TCP","1434","49253  >  443 [ACK] Seq=116757 Ack=1739 Win=998 Len=1368 TSval=447910 TSecr=372314537 [TCP segment of a reassembled PDU]"
"200","2018-08-07 17:40:40.670121","192.168.2.3","216.58.197.4","TLSv1.2","212","Application Data"
"201","2018-08-07 17:40:40.670121","192.168.2.3","216.58.197.4","TCP","1434","49253  >  443 [ACK] Seq=118271 Ack=1739 Win=998 Len=1368 TSval=447910 TSecr=372314537 [TCP segment of a reassembled PDU]"
"202","2018-08-07 17:40:40.670312","192.168.2.3","216.58.197.4","TLSv1.2","155","Application Data"
"206","2018-08-07 17:40:40.766971","192.168.2.3","216.58.197.4","TCP","1434","49253  >  443 [ACK] Seq=119728 Ack=1739 Win=998 Len=1368 TSval=447920 TSecr=372314635 [TCP segment of a reassembled PDU]"
"207","2018-08-07 17:40:40.766976","192.168.2.3","216.58.197.4","TCP","1434","49253  >  443 [ACK] Seq=121096 Ack=1739 Win=998 Len=1368 TSval=447920 TSecr=372314635 [TCP segment of a reassembled PDU]"
"208","2018-08-07 17:40:40.767135","192.168.2.3","216.58.197.4","TLSv1.2","212","Application Data"
"209","2018-08-07 17:40:40.767138","192.168.2.3","216.58.197.4","TCP","1434","49253  >  443 [ACK] Seq=122610 Ack=1739 Win=998 Len=1368 TSval=447920 TSecr=372314635 [TCP segment of a reassembled PDU]"
"210","2018-08-07 17:40:40.767353","192.168.2.3","216.58.197.4","TLSv1.2","155","Application Data"
"216","2018-08-07 17:40:40.828237","192.168.2.3","216.58.197.4","TCP","66","49253  >  443 [ACK] Seq=124067 Ack=2158 Win=998 Len=0 TSval=447926 TSecr=372314786"
"217","2018-08-07 17:40:40.861401","192.168.2.3","216.58.197.4","TCP","1434","49253  >  443 [ACK] Seq=124067 Ack=2158 Win=998 Len=1368 TSval=447930 TSecr=372314786 [TCP segment of a reassembled PDU]"
"218","2018-08-07 17:40:40.861923","192.168.2.3","216.58.197.4","TCP","1434","49253  >  443 [ACK] Seq=125435 Ack=2158 Win=998 Len=1368 TSval=447930 TSecr=372314786 [TCP segment of a reassembled PDU]"
"219","2018-08-07 17:40:40.861926","192.168.2.3","216.58.197.4","TLSv1.2","212","Application Data"
"220","2018-08-07 17:40:40.861927","192.168.2.3","216.58.197.4","TCP","1434","49253  >  443 [ACK] Seq=126949 Ack=2158 Win=998 Len=1368 TSval=447930 TSecr=372314786 [TCP segment of a reassembled PDU]"
"221","2018-08-07 17:40:40.861928","192.168.2.3","216.58.197.4","TLSv1.2","155","Application Data"
"225","2018-08-07 17:40:40.936917","192.168.2.3","216.58.197.4","TCP","1434","49253  >  443 [ACK] Seq=128406 Ack=2158 Win=998 Len=1368 TSval=447937 TSecr=372314826 [TCP segment of a reassembled PDU]"
"226","2018-08-07 17:40:40.936921","192.168.2.3","216.58.197.4","TCP","1434","49253  >  443 [ACK] Seq=129774 Ack=2158 Win=998 Len=1368 TSval=447937 TSecr=372314826 [TCP segment of a reassembled PDU]"
"227","2018-08-07 17:40:40.936922","192.168.2.3","216.58.197.4","TLSv1.2","212","Application Data"
"228","2018-08-07 17:40:40.937150","192.168.2.3","216.58.197.4","TCP","1434","49253  >  443 [ACK] Seq=131288 Ack=2158 Win=998 Len=1368 TSval=447937 TSecr=372314826 [TCP segment of a reassembled PDU]"
"229","2018-08-07 17:40:40.937153","192.168.2.3","216.58.197.4","TLSv1.2","155","Application Data"
"235","2018-08-07 17:40:40.992242","192.168.2.3","216.58.197.4","TCP","66","49253  >  443 [ACK] Seq=132745 Ack=2491 Win=998 Len=0 TSval=447943 TSecr=372314950"
"236","2018-08-07 17:40:41.021377","192.168.2.3","216.58.197.4","TCP","1434","49253  >  443 [ACK] Seq=132745 Ack=2491 Win=998 Len=1368 TSval=447946 TSecr=372314950 [TCP segment of a reassembled PDU]"
"237","2018-08-07 17:40:41.021702","192.168.2.3","216.58.197.4","TCP","1434","49253  >  443 [ACK] Seq=134113 Ack=2491 Win=998 Len=1368 TSval=447946 TSecr=372314950 [TCP segment of a reassembled PDU]"
"238","2018-08-07 17:40:41.021705","192.168.2.3","216.58.197.4","TLSv1.2","212","Application Data"
"239","2018-08-07 17:40:41.021706","192.168.2.3","216.58.197.4","TCP","1434","49253  >  443 [ACK] Seq=135627 Ack=2491 Win=998 Len=1368 TSval=447946 TSecr=372314950 [TCP segment of a reassembled PDU]"
"240","2018-08-07 17:40:41.021853","192.168.2.3","216.58.197.4","TLSv1.2","155","Application Data"
"243","2018-08-07 17:40:41.117398","192.168.2.3","216.58.197.4","TCP","1434","49253  >  443 [ACK] Seq=137084 Ack=2491 Win=998 Len=1368 TSval=447955 TSecr=372314986 [TCP segment of a reassembled PDU]"
"244","2018-08-07 17:40:41.117816","192.168.2.3","216.58.197.4","TCP","1434","49253  >  443 [ACK] Seq=138452 Ack=2491 Win=998 Len=1368 TSval=447955 TSecr=372314986 [TCP segment of a reassembled PDU]"
"245","2018-08-07 17:40:41.117818","192.168.2.3","216.58.197.4","TLSv1.2","212","Application Data"
"246","2018-08-07 17:40:41.117818","192.168.2.3","216.58.197.4","TCP","1434","49253  >  443 [ACK] Seq=139966 Ack=2491 Win=998 Len=1368 TSval=447955 TSecr=372314986 [TCP segment of a reassembled PDU]"
"247","2018-08-07 17:40:41.117819","192.168.2.3","216.58.197.4","TLSv1.2","155","Application Data"
"249","2018-08-07 17:40:41.211415","192.168.2.3","216.58.197.4","TCP","1434","49253  >  443 [ACK] Seq=141423 Ack=2491 Win=998 Len=1368 TSval=447965 TSecr=372315082 [TCP segment of a reassembled PDU]"
"250","2018-08-07 17:40:41.211420","192.168.2.3","216.58.197.4","TCP","1434","49253  >  443 [ACK] Seq=142791 Ack=2491 Win=998 Len=1368 TSval=447965 TSecr=372315082 [TCP segment of a reassembled PDU]"
"251","2018-08-07 17:40:41.211542","192.168.2.3","216.58.197.4","TLSv1.2","212","Application Data"
"252","2018-08-07 17:40:41.211881","192.168.2.3","216.58.197.4","TCP","1434","49253  >  443 [ACK] Seq=144305 Ack=2491 Win=998 Len=1368 TSval=447965 TSecr=372315082 [TCP segment of a reassembled PDU]"
"253","2018-08-07 17:40:41.211883","192.168.2.3","216.58.197.4","TLSv1.2","155","Application Data"
"257","2018-08-07 17:40:41.305766","192.168.2.3","216.58.197.4","TCP","1434","49253  >  443 [ACK] Seq=145762 Ack=2491 Win=998 Len=1368 TSval=447974 TSecr=372315175 [TCP segment of a reassembled PDU]"
"258","2018-08-07 17:40:41.305908","192.168.2.3","216.58.197.4","TCP","1434","49253  >  443 [ACK] Seq=147130 Ack=2491 Win=998 Len=1368 TSval=447974 TSecr=372315175 [TCP segment of a reassembled PDU]"
"259","2018-08-07 17:40:41.305909","192.168.2.3","216.58.197.4","TLSv1.2","212","Application Data"
"260","2018-08-07 17:40:41.306077","192.168.2.3","216.58.197.4","TCP","1434","49253  >  443 [ACK] Seq=148644 Ack=2491 Win=998 Len=1368 TSval=447974 TSecr=372315175 [TCP segment of a reassembled PDU]"
"261","2018-08-07 17:40:41.306078","192.168.2.3","216.58.197.4","TLSv1.2","155","Application Data"
"266","2018-08-07 17:40:41.366698","192.168.2.3","216.58.197.4","TCP","66","49253  >  443 [ACK] Seq=150101 Ack=2826 Win=998 Len=0 TSval=447980 TSecr=372315324"
"267","2018-08-07 17:40:41.400312","192.168.2.3","216.58.197.4","TCP","1434","49253  >  443 [ACK] Seq=150101 Ack=2826 Win=998 Len=1368 TSval=447983 TSecr=372315324 [TCP segment of a reassembled PDU]"
"268","2018-08-07 17:40:41.400760","192.168.2.3","216.58.197.4","TCP","1434","49253  >  443 [ACK] Seq=151469 Ack=2826 Win=998 Len=1368 TSval=447984 TSecr=372315324 [TCP segment of a reassembled PDU]"
"269","2018-08-07 17:40:41.400762","192.168.2.3","216.58.197.4","TLSv1.2","212","Application Data"
"270","2018-08-07 17:40:41.401265","192.168.2.3","216.58.197.4","TCP","1434","49253  >  443 [ACK] Seq=152983 Ack=2826 Win=998 Len=1368 TSval=447984 TSecr=372315324 [TCP segment of a reassembled PDU]"
"271","2018-08-07 17:40:41.401268","192.168.2.3","216.58.197.4","TLSv1.2","155","Application Data"
"275","2018-08-07 17:40:41.498547","192.168.2.3","216.58.197.4","TCP","1434","49253  >  443 [ACK] Seq=154440 Ack=2826 Win=998 Len=1368 TSval=447993 TSecr=372315365 [TCP segment of a reassembled PDU]"
"276","2018-08-07 17:40:41.498806","192.168.2.3","216.58.197.4","TCP","1434","49253  >  443 [ACK] Seq=155808 Ack=2826 Win=998 Len=1368 TSval=447993 TSecr=372315365 [TCP segment of a reassembled PDU]"
"277","2018-08-07 17:40:41.498808","192.168.2.3","216.58.197.4","TLSv1.2","212","Application Data"
"278","2018-08-07 17:40:41.499346","192.168.2.3","216.58.197.4","TCP","1434","49253  >  443 [ACK] Seq=157322 Ack=2826 Win=998 Len=1368 TSval=447993 TSecr=372315365 [TCP segment of a reassembled PDU]"
"279","2018-08-07 17:40:41.499349","192.168.2.3","216.58.197.4","TLSv1.2","155","Application Data"
"286","2018-08-07 17:40:41.556647","192.168.2.3","216.58.197.4","TCP","66","49253  >  443 [ACK] Seq=158779 Ack=3397 Win=998 Len=0 TSval=447999 TSecr=372315504"
"288","2018-08-07 17:40:41.596604","192.168.2.3","216.58.197.4","TCP","1434","49253  >  443 [ACK] Seq=158779 Ack=3622 Win=998 Len=1368 TSval=448003 TSecr=372315519 [TCP segment of a reassembled PDU]"
"289","2018-08-07 17:40:41.596970","192.168.2.3","216.58.197.4","TCP","1434","49253  >  443 [ACK] Seq=160147 Ack=3622 Win=998 Len=1368 TSval=448003 TSecr=372315519 [TCP segment of a reassembled PDU]"
"290","2018-08-07 17:40:41.596971","192.168.2.3","216.58.197.4","TLSv1.2","212","Application Data"
"291","2018-08-07 17:40:41.596972","192.168.2.3","216.58.197.4","TCP","1434","49253  >  443 [ACK] Seq=161661 Ack=3622 Win=998 Len=1368 TSval=448003 TSecr=372315519 [TCP segment of a reassembled PDU]"
"292","2018-08-07 17:40:41.596973","192.168.2.3","216.58.197.4","TLSv1.2","155","Application Data"
"296","2018-08-07 17:40:41.640021","192.168.2.3","172.217.27.163","TCP","66","38971  >  443 [ACK] Seq=1 Ack=1 Win=406 Len=0 TSval=448008 TSecr=466545649"
"298","2018-08-07 17:40:41.699395","192.168.2.3","216.58.197.4","TCP","1434","49253  >  443 [ACK] Seq=163118 Ack=3622 Win=998 Len=1368 TSval=448013 TSecr=372315561 [TCP segment of a reassembled PDU]"
"299","2018-08-07 17:40:41.699400","192.168.2.3","216.58.197.4","TCP","1434","49253  >  443 [ACK] Seq=164486 Ack=3622 Win=998 Len=1368 TSval=448013 TSecr=372315561 [TCP segment of a reassembled PDU]"
"300","2018-08-07 17:40:41.699401","192.168.2.3","216.58.197.4","TLSv1.2","212","Application Data"
"301","2018-08-07 17:40:41.699698","192.168.2.3","216.58.197.4","TCP","1434","49253  >  443 [ACK] Seq=166000 Ack=3622 Win=998 Len=1368 TSval=448013 TSecr=372315561 [TCP segment of a reassembled PDU]"
"302","2018-08-07 17:40:41.699700","192.168.2.3","216.58.197.4","TLSv1.2","155","Application Data"
"307","2018-08-07 17:40:41.767662","192.168.2.3","216.58.197.4","TCP","66","49253  >  443 [ACK] Seq=167457 Ack=3979 Win=998 Len=0 TSval=448020 TSecr=372315725"
"310","2018-08-07 17:40:41.775279","192.168.2.3","216.58.197.4","TCP","66","49253  >  443 [ACK] Seq=167457 Ack=4172 Win=998 Len=0 TSval=448021 TSecr=372315733"
"311","2018-08-07 17:40:41.789318","192.168.2.3","216.58.197.4","TCP","1434","49253  >  443 [ACK] Seq=167457 Ack=4172 Win=998 Len=1368 TSval=448022 TSecr=372315733 [TCP segment of a reassembled PDU]"
"312","2018-08-07 17:40:41.789638","192.168.2.3","216.58.197.4","TCP","1434","49253  >  443 [ACK] Seq=168825 Ack=4172 Win=998 Len=1368 TSval=448022 TSecr=372315733 [TCP segment of a reassembled PDU]"
"313","2018-08-07 17:40:41.789640","192.168.2.3","216.58.197.4","TLSv1.2","212","Application Data"
"314","2018-08-07 17:40:41.789989","192.168.2.3","216.58.197.4","TCP","1434","49253  >  443 [ACK] Seq=170339 Ack=4172 Win=998 Len=1368 TSval=448022 TSecr=372315733 [TCP segment of a reassembled PDU]"
"315","2018-08-07 17:40:41.789991","192.168.2.3","216.58.197.4","TLSv1.2","155","Application Data"
"321","2018-08-07 17:40:41.852490","192.168.2.3","216.58.197.4","TCP","66","49253  >  443 [ACK] Seq=171796 Ack=4633 Win=998 Len=0 TSval=448029 TSecr=372315809"
"322","2018-08-07 17:40:41.898829","192.168.2.3","216.58.197.4","TCP","1434","49253  >  443 [ACK] Seq=171796 Ack=4633 Win=998 Len=1368 TSval=448033 TSecr=372315809 [TCP segment of a reassembled PDU]"
"323","2018-08-07 17:40:41.898930","192.168.2.3","216.58.197.4","TCP","1434","49253  >  443 [ACK] Seq=173164 Ack=4633 Win=998 Len=1368 TSval=448033 TSecr=372315809 [TCP segment of a reassembled PDU]"
"324","2018-08-07 17:40:41.898932","192.168.2.3","216.58.197.4","TLSv1.2","212","Application Data"
"325","2018-08-07 17:40:41.899261","192.168.2.3","216.58.197.4","TCP","1434","49253  >  443 [ACK] Seq=174678 Ack=4633 Win=998 Len=1368 TSval=448033 TSecr=372315809 [TCP segment of a reassembled PDU]"
"326","2018-08-07 17:40:41.899263","192.168.2.3","216.58.197.4","TLSv1.2","155","Application Data"
"330","2018-08-07 17:40:41.964679","192.168.2.3","216.58.197.4","TCP","66","49253  >  443 [ACK] Seq=176135 Ack=5015 Win=998 Len=0 TSval=448040 TSecr=372315922"
"331","2018-08-07 17:40:41.988977","192.168.2.3","216.58.197.4","TCP","1434","49253  >  443 [ACK] Seq=176135 Ack=5015 Win=998 Len=1368 TSval=448042 TSecr=372315922 [TCP segment of a reassembled PDU]"
"332","2018-08-07 17:40:41.989263","192.168.2.3","216.58.197.4","TCP","1434","49253  >  443 [ACK] Seq=177503 Ack=5015 Win=998 Len=1368 TSval=448042 TSecr=372315922 [TCP segment of a reassembled PDU]"
"333","2018-08-07 17:40:41.989265","192.168.2.3","216.58.197.4","TLSv1.2","212","Application Data"
"334","2018-08-07 17:40:41.989480","192.168.2.3","216.58.197.4","TCP","1434","49253  >  443 [ACK] Seq=179017 Ack=5015 Win=998 Len=1368 TSval=448042 TSecr=372315922 [TCP segment of a reassembled PDU]"
"335","2018-08-07 17:40:41.989482","192.168.2.3","216.58.197.4","TLSv1.2","155","Application Data"
"339","2018-08-07 17:40:42.050823","192.168.2.3","216.58.197.4","TCP","66","49253  >  443 [ACK] Seq=180474 Ack=5386 Win=998 Len=0 TSval=448049 TSecr=372316009"
"340","2018-08-07 17:40:42.108613","192.168.2.3","216.58.197.4","TCP","1434","49253  >  443 [ACK] Seq=180474 Ack=5386 Win=998 Len=1368 TSval=448054 TSecr=372316009 [TCP segment of a reassembled PDU]"
"341","2018-08-07 17:40:42.108617","192.168.2.3","216.58.197.4","TCP","1434","49253  >  443 [ACK] Seq=181842 Ack=5386 Win=998 Len=1368 TSval=448054 TSecr=372316009 [TCP segment of a reassembled PDU]"
"342","2018-08-07 17:40:42.108618","192.168.2.3","216.58.197.4","TLSv1.2","212","Application Data"
"343","2018-08-07 17:40:42.108896","192.168.2.3","216.58.197.4","TLSv1.2","1298","Application Data"
"349","2018-08-07 17:40:42.168470","192.168.2.3","216.58.197.4","TCP","66","49253  >  443 [ACK] Seq=184588 Ack=6002 Win=998 Len=0 TSval=448060 TSecr=372316126"
"352","2018-08-07 17:40:42.178202","192.168.2.3","216.58.197.4","TCP","66","49253  >  443 [ACK] Seq=184588 Ack=6443 Win=998 Len=0 TSval=448061 TSecr=372316136"
"353","2018-08-07 17:40:42.216158","192.168.2.3","216.58.197.4","TCP","1434","49253  >  443 [ACK] Seq=184588 Ack=6443 Win=998 Len=1368 TSval=448065 TSecr=372316136 [TCP segment of a reassembled PDU]"
"354","2018-08-07 17:40:42.216162","192.168.2.3","216.58.197.4","TCP","1434","49253  >  443 [ACK] Seq=185956 Ack=6443 Win=998 Len=1368 TSval=448065 TSecr=372316136 [TCP segment of a reassembled PDU]"
"355","2018-08-07 17:40:42.216163","192.168.2.3","216.58.197.4","TLSv1.2","212","Application Data"
"356","2018-08-07 17:40:42.216332","192.168.2.3","216.58.197.4","TLSv1.2","794","Application Data"
"361","2018-08-07 17:40:42.332586","192.168.2.3","216.58.197.4","TCP","1434","49253  >  443 [ACK] Seq=188198 Ack=6443 Win=998 Len=1368 TSval=448076 TSecr=372316180 [TCP segment of a reassembled PDU]"
"362","2018-08-07 17:40:42.332806","192.168.2.3","216.58.197.4","TCP","1434","49253  >  443 [ACK] Seq=189566 Ack=6443 Win=998 Len=1368 TSval=448076 TSecr=372316180 [TCP segment of a reassembled PDU]"
"363","2018-08-07 17:40:42.332808","192.168.2.3","216.58.197.4","TLSv1.2","212","Application Data"
"364","2018-08-07 17:40:42.332809","192.168.2.3","216.58.197.4","TLSv1.2","280","Application Data"
"366","2018-08-07 17:40:42.370081","192.168.2.3","216.58.197.4","TCP","66","49253  >  443 [ACK] Seq=191294 Ack=6727 Win=998 Len=0 TSval=448081 TSecr=372316290"
"367","2018-08-07 17:40:42.431303","192.168.2.3","216.58.197.4","TCP","1434","49253  >  443 [ACK] Seq=191294 Ack=6727 Win=998 Len=1368 TSval=448086 TSecr=372316290 [TCP segment of a reassembled PDU]"
"368","2018-08-07 17:40:42.431305","192.168.2.3","216.58.197.4","TCP","1434","49253  >  443 [ACK] Seq=192662 Ack=6727 Win=998 Len=1368 TSval=448086 TSecr=372316290 [TCP segment of a reassembled PDU]"
"369","2018-08-07 17:40:42.431331","192.168.2.3","216.58.197.4","TLSv1.2","76","Application Data"
"372","2018-08-07 17:40:42.533723","192.168.2.3","216.58.197.4","TCP","1434","49253  >  443 [ACK] Seq=194040 Ack=6727 Win=998 Len=1368 TSval=448097 TSecr=372316395 [TCP segment of a reassembled PDU]"
"373","2018-08-07 17:40:42.533727","192.168.2.3","216.58.197.4","TCP","1434","49253  >  443 [ACK] Seq=195408 Ack=6727 Win=998 Len=1368 TSval=448097 TSecr=372316395 [TCP segment of a reassembled PDU]"
"374","2018-08-07 17:40:42.533728","192.168.2.3","216.58.197.4","TLSv1.2","212","Application Data"
"375","2018-08-07 17:40:42.533925","192.168.2.3","216.58.197.4","TLSv1.2","406","Application Data"
"379","2018-08-07 17:40:42.546693","192.168.2.3","216.58.197.4","TCP","66","49253  >  443 [ACK] Seq=197262 Ack=6980 Win=998 Len=0 TSval=448098 TSecr=372316504"
"381","2018-08-07 17:40:42.560808","192.168.2.3","216.58.197.4","TCP","66","49253  >  443 [ACK] Seq=197262 Ack=7147 Win=998 Len=0 TSval=448100 TSecr=372316519"
"384","2018-08-07 17:40:42.600962","192.168.2.3","216.58.197.4","TCP","66","49253  >  443 [ACK] Seq=197262 Ack=7446 Win=998 Len=0 TSval=448104 TSecr=372316557"
"385","2018-08-07 17:40:42.663904","192.168.2.3","216.58.197.4","TCP","1434","49253  >  443 [ACK] Seq=197262 Ack=7446 Win=998 Len=1368 TSval=448109 TSecr=372316557 [TCP segment of a reassembled PDU]"
"386","2018-08-07 17:40:42.663908","192.168.2.3","216.58.197.4","TCP","1434","49253  >  443 [ACK] Seq=198630 Ack=7446 Win=998 Len=1368 TSval=448109 TSecr=372316557 [TCP segment of a reassembled PDU]"
"387","2018-08-07 17:40:42.664087","192.168.2.3","216.58.197.4","TLSv1.2","212","Application Data"
"388","2018-08-07 17:40:42.664090","192.168.2.3","216.58.197.4","TLSv1.2","271","Application Data"
"391","2018-08-07 17:40:42.761095","192.168.2.3","216.58.197.4","TCP","1434","49253  >  443 [ACK] Seq=200349 Ack=7446 Win=998 Len=1368 TSval=448119 TSecr=372316627 [TCP segment of a reassembled PDU]"
"392","2018-08-07 17:40:42.761100","192.168.2.3","216.58.197.4","TCP","1434","49253  >  443 [ACK] Seq=201717 Ack=7446 Win=998 Len=1368 TSval=448119 TSecr=372316627 [TCP segment of a reassembled PDU]"
"393","2018-08-07 17:40:42.761101","192.168.2.3","216.58.197.4","TLSv1.2","212","Application Data"
"394","2018-08-07 17:40:42.761219","192.168.2.3","216.58.197.4","TLSv1.2","258","Application Data"
"398","2018-08-07 17:40:42.820110","192.168.2.3","216.58.197.4","TCP","66","49253  >  443 [ACK] Seq=203423 Ack=7544 Win=998 Len=0 TSval=448125 TSecr=372316774"
"399","2018-08-07 17:40:42.820119","192.168.2.3","216.58.197.4","TCP","66","49253  >  443 [ACK] Seq=203423 Ack=7667 Win=998 Len=0 TSval=448125 TSecr=372316774"
"400","2018-08-07 17:40:42.876280","192.168.2.3","216.58.197.4","TCP","1434","49253  >  443 [ACK] Seq=203423 Ack=7667 Win=998 Len=1368 TSval=448131 TSecr=372316774 [TCP segment of a reassembled PDU]"
"401","2018-08-07 17:40:42.876283","192.168.2.3","216.58.197.4","TCP","1434","49253  >  443 [ACK] Seq=204791 Ack=7667 Win=998 Len=1368 TSval=448131 TSecr=372316774 [TCP segment of a reassembled PDU]"
"402","2018-08-07 17:40:42.876284","192.168.2.3","216.58.197.4","TLSv1.2","212","Application Data"
"403","2018-08-07 17:40:42.876312","192.168.2.3","216.58.197.4","TLSv1.2","278","Application Data"
"408","2018-08-07 17:40:42.932764","192.168.2.3","216.58.197.4","TCP","66","49253  >  443 [ACK] Seq=206517 Ack=8042 Win=998 Len=0 TSval=448137 TSecr=372316890"
"411","2018-08-07 17:40:42.978444","192.168.2.3","216.58.197.4","TCP","66","49253  >  443 [ACK] Seq=206517 Ack=8649 Win=998 Len=0 TSval=448140 TSecr=372316926"
"412","2018-08-07 17:40:42.978447","192.168.2.3","216.58.197.4","TCP","66","49253  >  443 [ACK] Seq=206517 Ack=8796 Win=998 Len=0 TSval=448141 TSecr=372316929"
"413","2018-08-07 17:40:42.978679","192.168.2.3","216.58.197.4","TCP","1434","49253  >  443 [ACK] Seq=206517 Ack=8796 Win=998 Len=1368 TSval=448141 TSecr=372316929 [TCP segment of a reassembled PDU]"
"414","2018-08-07 17:40:42.978680","192.168.2.3","216.58.197.4","TCP","1434","49253  >  443 [ACK] Seq=207885 Ack=8796 Win=998 Len=1368 TSval=448141 TSecr=372316929 [TCP segment of a reassembled PDU]"
"415","2018-08-07 17:40:42.978832","192.168.2.3","216.58.197.4","TLSv1.2","212","Application Data"
"416","2018-08-07 17:40:42.978834","192.168.2.3","216.58.197.4","TLSv1.2","258","Application Data"
"417","2018-08-07 17:40:42.978834","192.168.2.3","216.58.197.4","TLSv1.2","381","Application Data"
"418","2018-08-07 17:40:42.978835","192.168.2.3","216.58.197.4","TLSv1.2","102","Application Data"
"420","2018-08-07 17:40:42.995190","192.168.2.3","192.168.2.1","ICMP","98","Echo (ping) request  id=0x0eca, seq=1/256, ttl=64 (reply in 421)"
