"No.","Time","Source","Destination","Protocol","Length","Info"
"1","2018-08-07 17:52:14.050787","192.168.2.3","172.217.27.174","TCP","66","52293  >  443 [ACK] Seq=1 Ack=1 Win=661 Len=0 TSval=517248 TSecr=874632005"
"3","2018-08-07 17:52:14.207444","192.168.2.3","172.217.27.174","TCP","66","52274  >  443 [ACK] Seq=1 Ack=1 Win=494 Len=0 TSval=517264 TSecr=4030449790"
"6","2018-08-07 17:52:19.485091","192.168.2.3","192.168.2.1","ICMP","98","Echo (ping) request  id=0x0c26, seq=1/256, ttl=64 (reply in 7)"
"8","2018-08-07 17:52:19.823315","192.168.2.3","172.217.27.174","TLSv1.2","363","[TCP Previous segment not captured] , Application Data"
"9","2018-08-07 17:52:19.823320","192.168.2.3","172.217.27.174","TLSv1.2","104","Application Data"
"10","2018-08-07 17:52:19.823476","192.168.2.3","172.217.27.174","TCP","1434","52293  >  443 [ACK] Seq=337 Ack=1 Win=661 Len=1368 TSval=517825 TSecr=874677125 [TCP segment of a reassembled PDU]"
"11","2018-08-07 17:52:19.823679","192.168.2.3","172.217.27.174","TCP","1434","52293  >  443 [ACK] Seq=1705 Ack=1 Win=661 Len=1368 TSval=517825 TSecr=874677125 [TCP segment of a reassembled PDU]"
"12","2018-08-07 17:52:19.824019","192.168.2.3","172.217.27.174","TLSv1.2","212","Application Data"
"13","2018-08-07 17:52:19.824359","192.168.2.3","172.217.27.174","TCP","1434","52293  >  443 [ACK] Seq=3219 Ack=1 Win=661 Len=1368 TSval=517825 TSecr=874677125 [TCP segment of a reassembled PDU]"
"14","2018-08-07 17:52:19.824361","192.168.2.3","172.217.27.174","TCP","1434","52293  >  443 [ACK] Seq=4587 Ack=1 Win=661 Len=1368 TSval=517825 TSecr=874677125 [TCP segment of a reassembled PDU]"
"15","2018-08-07 17:52:19.824362","192.168.2.3","172.217.27.174","TLSv1.2","212","Application Data"
"16","2018-08-07 17:52:19.824418","192.168.2.3","172.217.27.174","TCP","1434","52293  >  443 [ACK] Seq=6101 Ack=1 Win=661 Len=1368 TSval=517825 TSecr=874677125 [TCP segment of a reassembled PDU]"
"17","2018-08-07 17:52:19.824846","192.168.2.3","172.217.27.174","TCP","1434","52293  >  443 [ACK] Seq=7469 Ack=1 Win=661 Len=1368 TSval=517825 TSecr=874677125 [TCP segment of a reassembled PDU]"
"23","2018-08-07 17:52:19.829272","192.168.2.3","172.217.27.174","TLSv1.2","1434","Application Data [TCP segment of a reassembled PDU]"
"24","2018-08-07 17:52:19.829274","192.168.2.3","172.217.27.174","TLSv1.2","707","Application Data"
"29","2018-08-07 17:52:19.869292","192.168.2.3","172.217.27.174","TCP","66","52293  >  443 [ACK] Seq=10846 Ack=39 Win=661 Len=0 TSval=517830 TSecr=874682898"
"34","2018-08-07 17:52:19.928257","192.168.2.3","172.217.27.174","TCP","66","52293  >  443 [ACK] Seq=10846 Ack=107 Win=661 Len=0 TSval=517835 TSecr=874682986"
"35","2018-08-07 17:52:19.928270","192.168.2.3","172.217.27.174","TCP","66","52293  >  443 [ACK] Seq=10846 Ack=613 Win=661 Len=0 TSval=517835 TSecr=874682987"
"36","2018-08-07 17:52:19.928271","192.168.2.3","172.217.27.174","TLSv1.2","104","Application Data"
"38","2018-08-07 17:52:20.497620","192.168.2.3","192.168.2.1","ICMP","98","Echo (ping) request  id=0x0c26, seq=2/512, ttl=64 (reply in 39)"
"40","2018-08-07 17:52:20.531529","192.168.2.3","8.8.8.8","ICMP","98","Echo (ping) request  id=0x0c2c, seq=1/256, ttl=64 (reply in 41)"
"42","2018-08-07 17:52:21.557521","192.168.2.3","8.8.8.8","ICMP","98","Echo (ping) request  id=0x0c2c, seq=2/512, ttl=64 (reply in 43)"
"44","2018-08-07 17:52:21.570050","192.168.2.3","8.8.8.8","DNS","74","Standard query 0x1a37 A www.google.com"
"45","2018-08-07 17:52:21.570052","192.168.2.3","8.8.8.8","DNS","74","Standard query 0xea44 AAAA www.google.com"
"48","2018-08-07 17:52:22.692761","192.168.2.3","108.177.125.188","TCP","66","50384  >  5228 [ACK] Seq=1 Ack=1 Win=262 Len=0 TSval=518112 TSecr=2744508379"
"50","2018-08-07 17:52:24.871156","192.168.2.3","216.58.197.4","TLSv1.2","156","Application Data"
"51","2018-08-07 17:52:24.871160","192.168.2.3","216.58.197.4","TLSv1.2","104","Application Data"
"52","2018-08-07 17:52:24.871191","192.168.2.3","216.58.197.4","TLSv1.2","158","Application Data"
"57","2018-08-07 17:52:24.887334","192.168.2.3","216.58.197.4","TCP","1434","49253  >  443 [ACK] Seq=221 Ack=1 Win=1522 Len=1368 TSval=518331 TSecr=373018837 [TCP segment of a reassembled PDU]"
"58","2018-08-07 17:52:24.887544","192.168.2.3","216.58.197.4","TCP","1434","49253  >  443 [ACK] Seq=1589 Ack=1 Win=1522 Len=1368 TSval=518331 TSecr=373018837 [TCP segment of a reassembled PDU]"
"59","2018-08-07 17:52:24.887546","192.168.2.3","216.58.197.4","TLSv1.2","212","Application Data"
"60","2018-08-07 17:52:24.887685","192.168.2.3","216.58.197.4","TCP","1434","49253  >  443 [ACK] Seq=3103 Ack=1 Win=1522 Len=1368 TSval=518331 TSecr=373018837 [TCP segment of a reassembled PDU]"
"61","2018-08-07 17:52:24.887687","192.168.2.3","216.58.197.4","TLSv1.2","244","Application Data"
"62","2018-08-07 17:52:24.887953","192.168.2.3","216.58.197.4","TCP","1434","49253  >  443 [ACK] Seq=4649 Ack=1 Win=1522 Len=1368 TSval=518331 TSecr=373018837 [TCP segment of a reassembled PDU]"
"63","2018-08-07 17:52:24.887955","192.168.2.3","216.58.197.4","TCP","1434","49253  >  443 [ACK] Seq=6017 Ack=1 Win=1522 Len=1368 TSval=518331 TSecr=373018837 [TCP segment of a reassembled PDU]"
"64","2018-08-07 17:52:24.888154","192.168.2.3","216.58.197.4","TLSv1.2","212","Application Data"
"65","2018-08-07 17:52:24.888370","192.168.2.3","216.58.197.4","TCP","1434","49253  >  443 [ACK] Seq=7531 Ack=1 Win=1522 Len=1368 TSval=518331 TSecr=373018837 [TCP segment of a reassembled PDU]"
"66","2018-08-07 17:52:24.888372","192.168.2.3","216.58.197.4","TLSv1.2","1434","Application Data [TCP segment of a reassembled PDU]"
"67","2018-08-07 17:52:24.888539","192.168.2.3","216.58.197.4","TCP","1434","49253  >  443 [ACK] Seq=10267 Ack=1 Win=1522 Len=1368 TSval=518331 TSecr=373018837 [TCP segment of a reassembled PDU]"
"68","2018-08-07 17:52:24.888785","192.168.2.3","216.58.197.4","TLSv1.2","1434","Application Data [TCP segment of a reassembled PDU]"
"75","2018-08-07 17:52:24.893788","192.168.2.3","216.58.197.4","TLSv1.2","1434","Application Data [TCP segment of a reassembled PDU]"
"76","2018-08-07 17:52:24.893790","192.168.2.3","216.58.197.4","TCP","1434","49253  >  443 [ACK] Seq=14371 Ack=39 Win=1522 Len=1368 TSval=518332 TSecr=373018838 [TCP segment of a reassembled PDU]"
"77","2018-08-07 17:52:24.894081","192.168.2.3","216.58.197.4","TLSv1.2","1434","Application Data [TCP segment of a reassembled PDU]"
"78","2018-08-07 17:52:24.894577","192.168.2.3","216.58.197.4","TLSv1.2","1434","Application Data [TCP segment of a reassembled PDU]"
"79","2018-08-07 17:52:24.894579","192.168.2.3","216.58.197.4","TCP","1434","49253  >  443 [ACK] Seq=18475 Ack=39 Win=1522 Len=1368 TSval=518332 TSecr=373018853 [TCP segment of a reassembled PDU]"
"80","2018-08-07 17:52:24.894720","192.168.2.3","216.58.197.4","TLSv1.2","1434","Application Data [TCP segment of a reassembled PDU]"
"81","2018-08-07 17:52:24.895586","192.168.2.3","216.58.197.4","TLSv1.2","1434","Application Data [TCP segment of a reassembled PDU]"
"82","2018-08-07 17:52:24.895967","192.168.2.3","216.58.197.4","TCP","1434","49253  >  443 [ACK] Seq=22579 Ack=39 Win=1522 Len=1368 TSval=518332 TSecr=373018854 [TCP segment of a reassembled PDU]"
"83","2018-08-07 17:52:24.895968","192.168.2.3","216.58.197.4","TLSv1.2","1434","Application Data [TCP segment of a reassembled PDU]"
"84","2018-08-07 17:52:24.896123","192.168.2.3","216.58.197.4","TLSv1.2","1434","Application Data [TCP segment of a reassembled PDU]"
"85","2018-08-07 17:52:24.896290","192.168.2.3","216.58.197.4","TCP","1434","49253  >  443 [ACK] Seq=26683 Ack=39 Win=1522 Len=1368 TSval=518332 TSecr=373018854 [TCP segment of a reassembled PDU]"
"86","2018-08-07 17:52:24.896516","192.168.2.3","216.58.197.4","TLSv1.2","1434","Application Data [TCP segment of a reassembled PDU]"
"87","2018-08-07 17:52:24.896844","192.168.2.3","216.58.197.4","TLSv1.2","1434","Application Data [TCP segment of a reassembled PDU]"
"88","2018-08-07 17:52:24.896845","192.168.2.3","216.58.197.4","TCP","1434","49253  >  443 [ACK] Seq=30787 Ack=39 Win=1522 Len=1368 TSval=518332 TSecr=373018854 [TCP segment of a reassembled PDU]"
"89","2018-08-07 17:52:24.896972","192.168.2.3","216.58.197.4","TCP","1434","49253  >  443 [ACK] Seq=32155 Ack=39 Win=1522 Len=1368 TSval=518332 TSecr=373018854 [TCP segment of a reassembled PDU]"
"90","2018-08-07 17:52:24.897547","192.168.2.3","216.58.197.4","TLSv1.2","1434","Application Data [TCP segment of a reassembled PDU]"
"91","2018-08-07 17:52:24.897766","192.168.2.3","216.58.197.4","TLSv1.2","1434","Application Data [TCP segment of a reassembled PDU]"
"92","2018-08-07 17:52:24.897768","192.168.2.3","216.58.197.4","TCP","1434","49253  >  443 [ACK] Seq=36259 Ack=39 Win=1522 Len=1368 TSval=518332 TSecr=373018854 [TCP segment of a reassembled PDU]"
"96","2018-08-07 17:52:24.899993","192.168.2.3","216.58.197.4","TLSv1.2","1434","Application Data [TCP segment of a reassembled PDU]"
"97","2018-08-07 17:52:24.899995","192.168.2.3","216.58.197.4","TLSv1.2","1434","Application Data [TCP segment of a reassembled PDU]"
"99","2018-08-07 17:52:24.900349","192.168.2.3","216.58.197.4","TCP","1434","49253  >  443 [ACK] Seq=40363 Ack=39 Win=1522 Len=1368 TSval=518333 TSecr=373018860 [TCP segment of a reassembled PDU]"
"101","2018-08-07 17:52:24.900698","192.168.2.3","216.58.197.4","TLSv1.2","1434","Application Data [TCP segment of a reassembled PDU]"
"102","2018-08-07 17:52:24.900701","192.168.2.3","216.58.197.4","TLSv1.2","1434","Application Data [TCP segment of a reassembled PDU]"
"108","2018-08-07 17:52:24.905167","192.168.2.3","216.58.197.4","TCP","1434","49253  >  443 [ACK] Seq=44467 Ack=39 Win=1522 Len=1368 TSval=518333 TSecr=373018860 [TCP segment of a reassembled PDU]"
"109","2018-08-07 17:52:24.905168","192.168.2.3","216.58.197.4","TLSv1.2","1434","Application Data [TCP segment of a reassembled PDU]"
"111","2018-08-07 17:52:24.905504","192.168.2.3","216.58.197.4","TLSv1.2","1434","Application Data [TCP segment of a reassembled PDU]"
"112","2018-08-07 17:52:24.905507","192.168.2.3","216.58.197.4","TCP","1434","49253  >  443 [ACK] Seq=48571 Ack=39 Win=1522 Len=1368 TSval=518333 TSecr=373018862 [TCP segment of a reassembled PDU]"
"113","2018-08-07 17:52:24.905770","192.168.2.3","216.58.197.4","TLSv1.2","1434","Application Data [TCP segment of a reassembled PDU]"
"114","2018-08-07 17:52:24.905772","192.168.2.3","216.58.197.4","TLSv1.2","1434","Application Data [TCP segment of a reassembled PDU]"
"115","2018-08-07 17:52:24.905939","192.168.2.3","216.58.197.4","TCP","1434","49253  >  443 [ACK] Seq=52675 Ack=39 Win=1522 Len=1368 TSval=518333 TSecr=373018862 [TCP segment of a reassembled PDU]"
"116","2018-08-07 17:52:24.906261","192.168.2.3","216.58.197.4","TLSv1.2","1434","Application Data [TCP segment of a reassembled PDU]"
"117","2018-08-07 17:52:24.906530","192.168.2.3","216.58.197.4","TLSv1.2","1434","Application Data [TCP segment of a reassembled PDU]"
"118","2018-08-07 17:52:24.906660","192.168.2.3","216.58.197.4","TCP","1434","49253  >  443 [ACK] Seq=56779 Ack=39 Win=1522 Len=1368 TSval=518333 TSecr=373018862 [TCP segment of a reassembled PDU]"
"119","2018-08-07 17:52:24.906904","192.168.2.3","216.58.197.4","TLSv1.2","1434","Application Data [TCP segment of a reassembled PDU]"
"120","2018-08-07 17:52:24.907012","192.168.2.3","216.58.197.4","TLSv1.2","525","Application Data"
"128","2018-08-07 17:52:24.960283","192.168.2.3","216.58.197.4","TCP","1434","49253  >  443 [ACK] Seq=59974 Ack=39 Win=1522 Len=1368 TSval=518339 TSecr=373018913 [TCP segment of a reassembled PDU]"
"129","2018-08-07 17:52:24.960740","192.168.2.3","216.58.197.4","TCP","1434","49253  >  443 [ACK] Seq=61342 Ack=39 Win=1522 Len=1368 TSval=518339 TSecr=373018913 [TCP segment of a reassembled PDU]"
"130","2018-08-07 17:52:24.960742","192.168.2.3","216.58.197.4","TLSv1.2","212","Application Data"
"131","2018-08-07 17:52:24.960743","192.168.2.3","216.58.197.4","TCP","1434","49253  >  443 [ACK] Seq=62856 Ack=39 Win=1522 Len=1368 TSval=518339 TSecr=373018913 [TCP segment of a reassembled PDU]"
"132","2018-08-07 17:52:24.960745","192.168.2.3","216.58.197.4","TLSv1.2","155","Application Data"
"136","2018-08-07 17:52:25.064534","192.168.2.3","216.58.197.4","TCP","1434","49253  >  443 [ACK] Seq=64313 Ack=39 Win=1522 Len=1368 TSval=518349 TSecr=373018927 [TCP segment of a reassembled PDU]"
"137","2018-08-07 17:52:25.064893","192.168.2.3","216.58.197.4","TCP","1434","49253  >  443 [ACK] Seq=65681 Ack=39 Win=1522 Len=1368 TSval=518349 TSecr=373018927 [TCP segment of a reassembled PDU]"
"138","2018-08-07 17:52:25.064895","192.168.2.3","216.58.197.4","TLSv1.2","212","Application Data"
"139","2018-08-07 17:52:25.065113","192.168.2.3","216.58.197.4","TCP","1434","49253  >  443 [ACK] Seq=67195 Ack=39 Win=1522 Len=1368 TSval=518349 TSecr=373018927 [TCP segment of a reassembled PDU]"
"140","2018-08-07 17:52:25.065117","192.168.2.3","216.58.197.4","TLSv1.2","155","Application Data"
"144","2018-08-07 17:52:25.167122","192.168.2.3","216.58.197.4","TCP","1434","49253  >  443 [ACK] Seq=68652 Ack=39 Win=1522 Len=1368 TSval=518359 TSecr=373019031 [TCP segment of a reassembled PDU]"
"145","2018-08-07 17:52:25.167381","192.168.2.3","216.58.197.4","TCP","1434","49253  >  443 [ACK] Seq=70020 Ack=39 Win=1522 Len=1368 TSval=518359 TSecr=373019031 [TCP segment of a reassembled PDU]"
"146","2018-08-07 17:52:25.167383","192.168.2.3","216.58.197.4","TLSv1.2","212","Application Data"
"147","2018-08-07 17:52:25.167384","192.168.2.3","216.58.197.4","TLSv1.2","993","Application Data"
"150","2018-08-07 17:52:25.288546","192.168.2.3","216.58.197.4","TCP","1434","49253  >  443 [ACK] Seq=72461 Ack=39 Win=1522 Len=1368 TSval=518371 TSecr=373019133 [TCP segment of a reassembled PDU]"
"151","2018-08-07 17:52:25.288759","192.168.2.3","216.58.197.4","TCP","1434","49253  >  443 [ACK] Seq=73829 Ack=39 Win=1522 Len=1368 TSval=518371 TSecr=373019133 [TCP segment of a reassembled PDU]"
"152","2018-08-07 17:52:25.288761","192.168.2.3","216.58.197.4","TLSv1.2","212","Application Data"
"153","2018-08-07 17:52:25.288762","192.168.2.3","216.58.197.4","TCP","1434","49253  >  443 [ACK] Seq=75343 Ack=39 Win=1522 Len=1368 TSval=518371 TSecr=373019133 [TCP segment of a reassembled PDU]"
"154","2018-08-07 17:52:25.288964","192.168.2.3","216.58.197.4","TLSv1.2","112","Application Data"
"161","2018-08-07 17:52:25.352763","192.168.2.3","216.58.197.4","TCP","66","49253  >  443 [ACK] Seq=76757 Ack=356 Win=1522 Len=0 TSval=518378 TSecr=373019311"
"163","2018-08-07 17:52:25.367209","192.168.2.3","216.58.197.4","TCP","66","49253  >  443 [ACK] Seq=76757 Ack=781 Win=1522 Len=0 TSval=518379 TSecr=373019311"
"164","2018-08-07 17:52:25.385549","192.168.2.3","216.58.197.4","TCP","1434","49253  >  443 [ACK] Seq=76757 Ack=781 Win=1522 Len=1368 TSval=518381 TSecr=373019311 [TCP segment of a reassembled PDU]"
"165","2018-08-07 17:52:25.385553","192.168.2.3","216.58.197.4","TCP","1434","49253  >  443 [ACK] Seq=78125 Ack=781 Win=1522 Len=1368 TSval=518381 TSecr=373019311 [TCP segment of a reassembled PDU]"
"166","2018-08-07 17:52:25.385554","192.168.2.3","216.58.197.4","TLSv1.2","212","Application Data"
"167","2018-08-07 17:52:25.385709","192.168.2.3","216.58.197.4","TCP","1434","49253  >  443 [ACK] Seq=79639 Ack=781 Win=1522 Len=1368 TSval=518381 TSecr=373019311 [TCP segment of a reassembled PDU]"
"168","2018-08-07 17:52:25.386142","192.168.2.3","216.58.197.4","TLSv1.2","155","Application Data"
"173","2018-08-07 17:52:25.488476","192.168.2.3","216.58.197.4","TCP","1434","49253  >  443 [ACK] Seq=81096 Ack=1075 Win=1522 Len=1368 TSval=518391 TSecr=373019438 [TCP segment of a reassembled PDU]"
"174","2018-08-07 17:52:25.489006","192.168.2.3","216.58.197.4","TCP","1434","49253  >  443 [ACK] Seq=82464 Ack=1075 Win=1522 Len=1368 TSval=518391 TSecr=373019438 [TCP segment of a reassembled PDU]"
"175","2018-08-07 17:52:25.489454","192.168.2.3","216.58.197.4","TLSv1.2","212","Application Data"
"176","2018-08-07 17:52:25.489457","192.168.2.3","216.58.197.4","TLSv1.2","1014","Application Data"
"180","2018-08-07 17:52:25.603374","192.168.2.3","216.58.197.4","TCP","1434","49253  >  443 [ACK] Seq=84926 Ack=1075 Win=1522 Len=1368 TSval=518403 TSecr=373019455 [TCP segment of a reassembled PDU]"
"181","2018-08-07 17:52:25.603378","192.168.2.3","216.58.197.4","TCP","1434","49253  >  443 [ACK] Seq=86294 Ack=1075 Win=1522 Len=1368 TSval=518403 TSecr=373019455 [TCP segment of a reassembled PDU]"
"182","2018-08-07 17:52:25.603562","192.168.2.3","216.58.197.4","TLSv1.2","212","Application Data"
"183","2018-08-07 17:52:25.603565","192.168.2.3","216.58.197.4","TCP","1434","49253  >  443 [ACK] Seq=87808 Ack=1075 Win=1522 Len=1368 TSval=518403 TSecr=373019455 [TCP segment of a reassembled PDU]"
"184","2018-08-07 17:52:25.603759","192.168.2.3","216.58.197.4","TLSv1.2","81","Application Data"
"188","2018-08-07 17:52:25.697809","192.168.2.3","216.58.197.4","TCP","66","49253  >  443 [ACK] Seq=89191 Ack=1265 Win=1522 Len=0 TSval=518413 TSecr=373019626"
"189","2018-08-07 17:52:25.705645","192.168.2.3","216.58.197.4","TCP","1434","49253  >  443 [ACK] Seq=89191 Ack=1265 Win=1522 Len=1368 TSval=518413 TSecr=373019626 [TCP segment of a reassembled PDU]"
"190","2018-08-07 17:52:25.705647","192.168.2.3","216.58.197.4","TCP","1434","49253  >  443 [ACK] Seq=90559 Ack=1265 Win=1522 Len=1368 TSval=518413 TSecr=373019626 [TCP segment of a reassembled PDU]"
"191","2018-08-07 17:52:25.705648","192.168.2.3","216.58.197.4","TLSv1.2","212","Application Data"
"192","2018-08-07 17:52:25.705839","192.168.2.3","216.58.197.4","TCP","1434","49253  >  443 [ACK] Seq=92073 Ack=1265 Win=1522 Len=1368 TSval=518413 TSecr=373019626 [TCP segment of a reassembled PDU]"
"193","2018-08-07 17:52:25.706027","192.168.2.3","216.58.197.4","TLSv1.2","119","Application Data"
"197","2018-08-07 17:52:25.829400","192.168.2.3","216.58.197.4","TCP","1434","49253  >  443 [ACK] Seq=93494 Ack=1265 Win=1522 Len=1368 TSval=518426 TSecr=373019672 [TCP segment of a reassembled PDU]"
"198","2018-08-07 17:52:25.829418","192.168.2.3","216.58.197.4","TCP","1434","49253  >  443 [ACK] Seq=94862 Ack=1265 Win=1522 Len=1368 TSval=518426 TSecr=373019672 [TCP segment of a reassembled PDU]"
"199","2018-08-07 17:52:25.829419","192.168.2.3","216.58.197.4","TLSv1.2","212","Application Data"
"200","2018-08-07 17:52:25.829584","192.168.2.3","216.58.197.4","TCP","1434","49253  >  443 [ACK] Seq=96376 Ack=1265 Win=1522 Len=1368 TSval=518426 TSecr=373019672 [TCP segment of a reassembled PDU]"
"201","2018-08-07 17:52:25.829586","192.168.2.3","216.58.197.4","TLSv1.2","155","Application Data"
"205","2018-08-07 17:52:25.929890","192.168.2.3","216.58.197.4","TCP","1434","49253  >  443 [ACK] Seq=97833 Ack=1265 Win=1522 Len=1368 TSval=518436 TSecr=373019795 [TCP segment of a reassembled PDU]"
"206","2018-08-07 17:52:25.929894","192.168.2.3","216.58.197.4","TCP","1434","49253  >  443 [ACK] Seq=99201 Ack=1265 Win=1522 Len=1368 TSval=518436 TSecr=373019795 [TCP segment of a reassembled PDU]"
"207","2018-08-07 17:52:25.930125","192.168.2.3","216.58.197.4","TLSv1.2","212","Application Data"
"208","2018-08-07 17:52:25.930126","192.168.2.3","216.58.197.4","TCP","1434","49253  >  443 [ACK] Seq=100715 Ack=1265 Win=1522 Len=1368 TSval=518436 TSecr=373019795 [TCP segment of a reassembled PDU]"
"209","2018-08-07 17:52:25.930391","192.168.2.3","216.58.197.4","TLSv1.2","155","Application Data"
"213","2018-08-07 17:52:26.033839","192.168.2.3","216.58.197.4","TCP","1434","49253  >  443 [ACK] Seq=102172 Ack=1265 Win=1522 Len=1368 TSval=518446 TSecr=373019896 [TCP segment of a reassembled PDU]"
"214","2018-08-07 17:52:26.033845","192.168.2.3","216.58.197.4","TCP","1434","49253  >  443 [ACK] Seq=103540 Ack=1265 Win=1522 Len=1368 TSval=518446 TSecr=373019896 [TCP segment of a reassembled PDU]"
"215","2018-08-07 17:52:26.033846","192.168.2.3","216.58.197.4","TLSv1.2","212","Application Data"
"216","2018-08-07 17:52:26.034032","192.168.2.3","216.58.197.4","TLSv1.2","1406","Application Data"
"219","2018-08-07 17:52:26.150406","192.168.2.3","216.58.197.4","TCP","1434","49253  >  443 [ACK] Seq=106394 Ack=1265 Win=1522 Len=1368 TSval=518458 TSecr=373020000 [TCP segment of a reassembled PDU]"
"220","2018-08-07 17:52:26.150766","192.168.2.3","216.58.197.4","TCP","1434","49253  >  443 [ACK] Seq=107762 Ack=1265 Win=1522 Len=1368 TSval=518458 TSecr=373020000 [TCP segment of a reassembled PDU]"
"221","2018-08-07 17:52:26.150769","192.168.2.3","216.58.197.4","TLSv1.2","212","Application Data"
"222","2018-08-07 17:52:26.150770","192.168.2.3","216.58.197.4","TLSv1.2","1042","Application Data"
"225","2018-08-07 17:52:26.249558","192.168.2.3","216.58.197.4","TCP","1434","49253  >  443 [ACK] Seq=110252 Ack=1265 Win=1522 Len=1368 TSval=518468 TSecr=373020116 [TCP segment of a reassembled PDU]"
"226","2018-08-07 17:52:26.249563","192.168.2.3","216.58.197.4","TCP","1434","49253  >  443 [ACK] Seq=111620 Ack=1265 Win=1522 Len=1368 TSval=518468 TSecr=373020116 [TCP segment of a reassembled PDU]"
"227","2018-08-07 17:52:26.249564","192.168.2.3","216.58.197.4","TLSv1.2","212","Application Data"
"228","2018-08-07 17:52:26.249771","192.168.2.3","216.58.197.4","TCP","1434","49253  >  443 [ACK] Seq=113134 Ack=1265 Win=1522 Len=1368 TSval=518468 TSecr=373020116 [TCP segment of a reassembled PDU]"
"229","2018-08-07 17:52:26.249775","192.168.2.3","216.58.197.4","TLSv1.2","155","Application Data"
"234","2018-08-07 17:52:26.350658","192.168.2.3","216.58.197.4","TCP","1434","49253  >  443 [ACK] Seq=114591 Ack=1265 Win=1522 Len=1368 TSval=518478 TSecr=373020216 [TCP segment of a reassembled PDU]"
"235","2018-08-07 17:52:26.350662","192.168.2.3","216.58.197.4","TCP","1434","49253  >  443 [ACK] Seq=115959 Ack=1265 Win=1522 Len=1368 TSval=518478 TSecr=373020216 [TCP segment of a reassembled PDU]"
"236","2018-08-07 17:52:26.350663","192.168.2.3","216.58.197.4","TLSv1.2","212","Application Data"
"237","2018-08-07 17:52:26.351101","192.168.2.3","216.58.197.4","TLSv1.2","1382","Application Data"
"238","2018-08-07 17:52:26.354935","192.168.2.3","216.58.197.4","TCP","66","49253  >  443 [ACK] Seq=118789 Ack=1405 Win=1522 Len=0 TSval=518478 TSecr=373020311"
"241","2018-08-07 17:52:26.367857","192.168.2.3","216.58.197.4","TCP","66","49253  >  443 [ACK] Seq=118789 Ack=1622 Win=1522 Len=0 TSval=518480 TSecr=373020327"
"242","2018-08-07 17:52:26.465634","192.168.2.3","216.58.197.4","TCP","1434","49253  >  443 [ACK] Seq=118789 Ack=1622 Win=1522 Len=1368 TSval=518489 TSecr=373020327 [TCP segment of a reassembled PDU]"
"243","2018-08-07 17:52:26.466163","192.168.2.3","216.58.197.4","TCP","1434","49253  >  443 [ACK] Seq=120157 Ack=1622 Win=1522 Len=1368 TSval=518489 TSecr=373020327 [TCP segment of a reassembled PDU]"
"244","2018-08-07 17:52:26.466165","192.168.2.3","216.58.197.4","TLSv1.2","212","Application Data"
"245","2018-08-07 17:52:26.466493","192.168.2.3","216.58.197.4","TLSv1.2","1369","Application Data"
"248","2018-08-07 17:52:26.543463","192.168.2.3","216.58.197.4","TCP","1434","49253  >  443 [ACK] Seq=122974 Ack=1622 Win=1522 Len=1368 TSval=518497 TSecr=373020432 [TCP segment of a reassembled PDU]"
"249","2018-08-07 17:52:26.543960","192.168.2.3","216.58.197.4","TCP","1434","49253  >  443 [ACK] Seq=124342 Ack=1622 Win=1522 Len=1368 TSval=518497 TSecr=373020432 [TCP segment of a reassembled PDU]"
"250","2018-08-07 17:52:26.545547","192.168.2.3","216.58.197.4","TLSv1.2","212","Application Data"
"251","2018-08-07 17:52:26.546634","192.168.2.3","216.58.197.4","TCP","1434","49253  >  443 [ACK] Seq=125856 Ack=1622 Win=1522 Len=1368 TSval=518497 TSecr=373020432 [TCP segment of a reassembled PDU]"
"252","2018-08-07 17:52:26.546898","192.168.2.3","216.58.197.4","TLSv1.2","155","Application Data"
"256","2018-08-07 17:52:26.636119","192.168.2.3","216.58.197.4","TCP","1434","49253  >  443 [ACK] Seq=127313 Ack=1622 Win=1522 Len=1368 TSval=518506 TSecr=373020552 [TCP segment of a reassembled PDU]"
"257","2018-08-07 17:52:26.636564","192.168.2.3","216.58.197.4","TCP","1434","49253  >  443 [ACK] Seq=128681 Ack=1622 Win=1522 Len=1368 TSval=518506 TSecr=373020552 [TCP segment of a reassembled PDU]"
"258","2018-08-07 17:52:26.636566","192.168.2.3","216.58.197.4","TLSv1.2","212","Application Data"
"259","2018-08-07 17:52:26.637015","192.168.2.3","216.58.197.4","TCP","1434","49253  >  443 [ACK] Seq=130195 Ack=1622 Win=1522 Len=1368 TSval=518506 TSecr=373020552 [TCP segment of a reassembled PDU]"
"260","2018-08-07 17:52:26.637017","192.168.2.3","216.58.197.4","TLSv1.2","155","Application Data"
"264","2018-08-07 17:52:26.726630","192.168.2.3","216.58.197.4","TCP","1434","49253  >  443 [ACK] Seq=131652 Ack=1622 Win=1522 Len=1368 TSval=518515 TSecr=373020603 [TCP segment of a reassembled PDU]"
"265","2018-08-07 17:52:26.726643","192.168.2.3","216.58.197.4","TCP","1434","49253  >  443 [ACK] Seq=133020 Ack=1622 Win=1522 Len=1368 TSval=518515 TSecr=373020603 [TCP segment of a reassembled PDU]"
"266","2018-08-07 17:52:26.726644","192.168.2.3","216.58.197.4","TLSv1.2","212","Application Data"
"267","2018-08-07 17:52:26.726687","192.168.2.3","216.58.197.4","TCP","1434","49253  >  443 [ACK] Seq=134534 Ack=1622 Win=1522 Len=1368 TSval=518515 TSecr=373020603 [TCP segment of a reassembled PDU]"
"268","2018-08-07 17:52:26.726887","192.168.2.3","216.58.197.4","TLSv1.2","155","Application Data"
"271","2018-08-07 17:52:26.828934","192.168.2.3","216.58.197.4","TCP","1434","49253  >  443 [ACK] Seq=135991 Ack=1622 Win=1522 Len=1368 TSval=518525 TSecr=373020692 [TCP segment of a reassembled PDU]"
"272","2018-08-07 17:52:26.828939","192.168.2.3","216.58.197.4","TCP","1434","49253  >  443 [ACK] Seq=137359 Ack=1622 Win=1522 Len=1368 TSval=518525 TSecr=373020692 [TCP segment of a reassembled PDU]"
"273","2018-08-07 17:52:26.828940","192.168.2.3","216.58.197.4","TLSv1.2","212","Application Data"
"274","2018-08-07 17:52:26.829141","192.168.2.3","216.58.197.4","TCP","1434","49253  >  443 [ACK] Seq=138873 Ack=1622 Win=1522 Len=1368 TSval=518525 TSecr=373020692 [TCP segment of a reassembled PDU]"
"275","2018-08-07 17:52:26.829144","192.168.2.3","216.58.197.4","TLSv1.2","155","Application Data"
"280","2018-08-07 17:52:26.896409","192.168.2.3","216.58.197.4","TCP","66","49253  >  443 [ACK] Seq=140330 Ack=1867 Win=1522 Len=0 TSval=518532 TSecr=373020857"
"281","2018-08-07 17:52:26.896831","192.168.2.3","216.58.197.4","TCP","66","49253  >  443 [ACK] Seq=140330 Ack=1938 Win=1522 Len=0 TSval=518532 TSecr=373020857"
"282","2018-08-07 17:52:26.915075","192.168.2.3","216.58.197.4","TCP","1434","49253  >  443 [ACK] Seq=140330 Ack=1938 Win=1522 Len=1368 TSval=518534 TSecr=373020857 [TCP segment of a reassembled PDU]"
"283","2018-08-07 17:52:26.915078","192.168.2.3","216.58.197.4","TCP","1434","49253  >  443 [ACK] Seq=141698 Ack=1938 Win=1522 Len=1368 TSval=518534 TSecr=373020857 [TCP segment of a reassembled PDU]"
"284","2018-08-07 17:52:26.915079","192.168.2.3","216.58.197.4","TLSv1.2","212","Application Data"
"285","2018-08-07 17:52:26.915533","192.168.2.3","216.58.197.4","TCP","1434","49253  >  443 [ACK] Seq=143212 Ack=1938 Win=1522 Len=1368 TSval=518534 TSecr=373020857 [TCP segment of a reassembled PDU]"
"286","2018-08-07 17:52:26.915535","192.168.2.3","216.58.197.4","TLSv1.2","155","Application Data"
"291","2018-08-07 17:52:26.971960","192.168.2.3","216.58.197.4","TCP","66","49253  >  443 [ACK] Seq=144669 Ack=2113 Win=1522 Len=0 TSval=518540 TSecr=373020929"
"292","2018-08-07 17:52:27.009994","192.168.2.3","216.58.197.4","TCP","1434","49253  >  443 [ACK] Seq=144669 Ack=2113 Win=1522 Len=1368 TSval=518544 TSecr=373020929 [TCP segment of a reassembled PDU]"
"293","2018-08-07 17:52:27.010468","192.168.2.3","216.58.197.4","TCP","1434","49253  >  443 [ACK] Seq=146037 Ack=2113 Win=1522 Len=1368 TSval=518544 TSecr=373020929 [TCP segment of a reassembled PDU]"
"294","2018-08-07 17:52:27.010471","192.168.2.3","216.58.197.4","TLSv1.2","212","Application Data"
"295","2018-08-07 17:52:27.010472","192.168.2.3","216.58.197.4","TCP","1434","49253  >  443 [ACK] Seq=147551 Ack=2113 Win=1522 Len=1368 TSval=518544 TSecr=373020929 [TCP segment of a reassembled PDU]"
"296","2018-08-07 17:52:27.010636","192.168.2.3","216.58.197.4","TLSv1.2","155","Application Data"
"300","2018-08-07 17:52:27.108717","192.168.2.3","216.58.197.4","TCP","1434","49253  >  443 [ACK] Seq=149008 Ack=2113 Win=1522 Len=1368 TSval=518554 TSecr=373020976 [TCP segment of a reassembled PDU]"
"301","2018-08-07 17:52:27.109172","192.168.2.3","216.58.197.4","TCP","1434","49253  >  443 [ACK] Seq=150376 Ack=2113 Win=1522 Len=1368 TSval=518554 TSecr=373020976 [TCP segment of a reassembled PDU]"
"302","2018-08-07 17:52:27.109174","192.168.2.3","216.58.197.4","TLSv1.2","212","Application Data"
"303","2018-08-07 17:52:27.109539","192.168.2.3","216.58.197.4","TCP","1434","49253  >  443 [ACK] Seq=151890 Ack=2113 Win=1522 Len=1368 TSval=518554 TSecr=373020976 [TCP segment of a reassembled PDU]"
"304","2018-08-07 17:52:27.109541","192.168.2.3","216.58.197.4","TLSv1.2","155","Application Data"
"310","2018-08-07 17:52:27.165921","192.168.2.3","216.58.197.4","TCP","66","49253  >  443 [ACK] Seq=153347 Ack=2346 Win=1522 Len=0 TSval=518559 TSecr=373021125"
"311","2018-08-07 17:52:27.239334","192.168.2.3","216.58.197.4","TCP","1434","49253  >  443 [ACK] Seq=153347 Ack=2346 Win=1522 Len=1368 TSval=518563 TSecr=373021125 [TCP segment of a reassembled PDU]"
"312","2018-08-07 17:52:27.239340","192.168.2.3","216.58.197.4","TCP","1434","49253  >  443 [ACK] Seq=154715 Ack=2346 Win=1522 Len=1368 TSval=518563 TSecr=373021125 [TCP segment of a reassembled PDU]"
"313","2018-08-07 17:52:27.239430","192.168.2.3","216.58.197.4","TLSv1.2","212","Application Data"
"314","2018-08-07 17:52:27.239810","192.168.2.3","216.58.197.4","TCP","1434","49253  >  443 [ACK] Seq=156229 Ack=2346 Win=1522 Len=1368 TSval=518563 TSecr=373021125 [TCP segment of a reassembled PDU]"
"315","2018-08-07 17:52:27.239813","192.168.2.3","216.58.197.4","TLSv1.2","155","Application Data"
"318","2018-08-07 17:52:27.283009","192.168.2.3","216.58.197.4","TCP","1434","49253  >  443 [ACK] Seq=157686 Ack=2346 Win=1522 Len=1368 TSval=518571 TSecr=373021206 [TCP segment of a reassembled PDU]"
"319","2018-08-07 17:52:27.283445","192.168.2.3","216.58.197.4","TCP","1434","49253  >  443 [ACK] Seq=159054 Ack=2346 Win=1522 Len=1368 TSval=518571 TSecr=373021206 [TCP segment of a reassembled PDU]"
"320","2018-08-07 17:52:27.283447","192.168.2.3","216.58.197.4","TLSv1.2","212","Application Data"
"321","2018-08-07 17:52:27.283448","192.168.2.3","216.58.197.4","TCP","1434","49253  >  443 [ACK] Seq=160568 Ack=2346 Win=1522 Len=1368 TSval=518571 TSecr=373021206 [TCP segment of a reassembled PDU]"
"322","2018-08-07 17:52:27.283605","192.168.2.3","216.58.197.4","TLSv1.2","155","Application Data"
"327","2018-08-07 17:52:27.362645","192.168.2.3","216.58.197.4","TCP","1434","49253  >  443 [ACK] Seq=162025 Ack=2595 Win=1522 Len=1368 TSval=518579 TSecr=373021311 [TCP segment of a reassembled PDU]"
"328","2018-08-07 17:52:27.363110","192.168.2.3","216.58.197.4","TCP","1434","49253  >  443 [ACK] Seq=163393 Ack=2595 Win=1522 Len=1368 TSval=518579 TSecr=373021311 [TCP segment of a reassembled PDU]"
"329","2018-08-07 17:52:27.363111","192.168.2.3","216.58.197.4","TLSv1.2","212","Application Data"
"330","2018-08-07 17:52:27.363112","192.168.2.3","216.58.197.4","TCP","1434","49253  >  443 [ACK] Seq=164907 Ack=2595 Win=1522 Len=1368 TSval=518579 TSecr=373021311 [TCP segment of a reassembled PDU]"
"331","2018-08-07 17:52:27.363540","192.168.2.3","216.58.197.4","TLSv1.2","155","Application Data"
"336","2018-08-07 17:52:27.401054","192.168.2.3","216.58.197.4","TCP","66","49253  >  443 [ACK] Seq=166364 Ack=2849 Win=1522 Len=0 TSval=518583 TSecr=373021327"
"339","2018-08-07 17:52:27.433371","192.168.2.3","216.58.197.4","TCP","66","49253  >  443 [ACK] Seq=166364 Ack=3182 Win=1522 Len=0 TSval=518586 TSecr=373021379"
"340","2018-08-07 17:52:27.464872","192.168.2.3","216.58.197.4","TCP","1434","49253  >  443 [ACK] Seq=166364 Ack=3182 Win=1522 Len=1368 TSval=518589 TSecr=373021379 [TCP segment of a reassembled PDU]"
"341","2018-08-07 17:52:27.465165","192.168.2.3","216.58.197.4","TCP","1434","49253  >  443 [ACK] Seq=167732 Ack=3182 Win=1522 Len=1368 TSval=518589 TSecr=373021379 [TCP segment of a reassembled PDU]"
"342","2018-08-07 17:52:27.465169","192.168.2.3","216.58.197.4","TLSv1.2","212","Application Data"
"343","2018-08-07 17:52:27.465169","192.168.2.3","216.58.197.4","TCP","1434","49253  >  443 [ACK] Seq=169246 Ack=3182 Win=1522 Len=1368 TSval=518589 TSecr=373021379 [TCP segment of a reassembled PDU]"
"344","2018-08-07 17:52:27.465231","192.168.2.3","216.58.197.4","TLSv1.2","155","Application Data"
"348","2018-08-07 17:52:27.561206","192.168.2.3","216.58.197.4","TCP","1434","49253  >  443 [ACK] Seq=170703 Ack=3182 Win=1522 Len=1368 TSval=518599 TSecr=373021431 [TCP segment of a reassembled PDU]"
"349","2018-08-07 17:52:27.561211","192.168.2.3","216.58.197.4","TCP","1434","49253  >  443 [ACK] Seq=172071 Ack=3182 Win=1522 Len=1368 TSval=518599 TSecr=373021431 [TCP segment of a reassembled PDU]"
"350","2018-08-07 17:52:27.561212","192.168.2.3","216.58.197.4","TLSv1.2","212","Application Data"
"351","2018-08-07 17:52:27.561607","192.168.2.3","216.58.197.4","TCP","1434","49253  >  443 [ACK] Seq=173585 Ack=3182 Win=1522 Len=1368 TSval=518599 TSecr=373021431 [TCP segment of a reassembled PDU]"
"352","2018-08-07 17:52:27.561610","192.168.2.3","216.58.197.4","TLSv1.2","155","Application Data"
"356","2018-08-07 17:52:27.652526","192.168.2.3","216.58.197.4","TCP","66","49253  >  443 [ACK] Seq=175042 Ack=3540 Win=1522 Len=0 TSval=518606 TSecr=373021582"
"357","2018-08-07 17:52:27.653269","192.168.2.3","216.58.197.4","TCP","1434","49253  >  443 [ACK] Seq=175042 Ack=3540 Win=1522 Len=1368 TSval=518608 TSecr=373021582 [TCP segment of a reassembled PDU]"
"358","2018-08-07 17:52:27.653679","192.168.2.3","216.58.197.4","TCP","1434","49253  >  443 [ACK] Seq=176410 Ack=3540 Win=1522 Len=1368 TSval=518608 TSecr=373021582 [TCP segment of a reassembled PDU]"
"359","2018-08-07 17:52:27.653681","192.168.2.3","216.58.197.4","TLSv1.2","212","Application Data"
"360","2018-08-07 17:52:27.653682","192.168.2.3","216.58.197.4","TCP","1434","49253  >  443 [ACK] Seq=177924 Ack=3540 Win=1522 Len=1368 TSval=518608 TSecr=373021582 [TCP segment of a reassembled PDU]"
"361","2018-08-07 17:52:27.653870","192.168.2.3","216.58.197.4","TLSv1.2","155","Application Data"
"364","2018-08-07 17:52:27.785045","192.168.2.3","216.58.197.4","TCP","1434","49253  >  443 [ACK] Seq=179381 Ack=3540 Win=1522 Len=1368 TSval=518618 TSecr=373021620 [TCP segment of a reassembled PDU]"
"365","2018-08-07 17:52:27.785291","192.168.2.3","216.58.197.4","TCP","1434","49253  >  443 [ACK] Seq=180749 Ack=3540 Win=1522 Len=1368 TSval=518618 TSecr=373021620 [TCP segment of a reassembled PDU]"
"366","2018-08-07 17:52:27.785292","192.168.2.3","216.58.197.4","TLSv1.2","212","Application Data"
"367","2018-08-07 17:52:27.785307","192.168.2.3","216.58.197.4","TCP","1434","49253  >  443 [ACK] Seq=182263 Ack=3540 Win=1522 Len=1368 TSval=518618 TSecr=373021620 [TCP segment of a reassembled PDU]"
"368","2018-08-07 17:52:27.785517","192.168.2.3","216.58.197.4","TLSv1.2","155","Application Data"
"372","2018-08-07 17:52:27.848436","192.168.2.3","216.58.197.4","TCP","1434","49253  >  443 [ACK] Seq=183720 Ack=3540 Win=1522 Len=1368 TSval=518628 TSecr=373021751 [TCP segment of a reassembled PDU]"
"373","2018-08-07 17:52:27.852677","192.168.2.3","216.58.197.4","TCP","1434","49253  >  443 [ACK] Seq=185088 Ack=3540 Win=1522 Len=1368 TSval=518628 TSecr=373021751 [TCP segment of a reassembled PDU]"
"374","2018-08-07 17:52:27.852947","192.168.2.3","216.58.197.4","TLSv1.2","212","Application Data"
"375","2018-08-07 17:52:27.852948","192.168.2.3","216.58.197.4","TCP","1434","49253  >  443 [ACK] Seq=186602 Ack=3540 Win=1522 Len=1368 TSval=518628 TSecr=373021751 [TCP segment of a reassembled PDU]"
"376","2018-08-07 17:52:27.852950","192.168.2.3","216.58.197.4","TLSv1.2","155","Application Data"
"382","2018-08-07 17:52:27.913148","192.168.2.3","216.58.197.4","TCP","66","49253  >  443 [ACK] Seq=188059 Ack=4053 Win=1522 Len=0 TSval=518634 TSecr=373021872"
"383","2018-08-07 17:52:27.939410","192.168.2.3","216.58.197.4","TCP","1434","49253  >  443 [ACK] Seq=188059 Ack=4053 Win=1522 Len=1368 TSval=518636 TSecr=373021872 [TCP segment of a reassembled PDU]"
"384","2018-08-07 17:52:27.939413","192.168.2.3","216.58.197.4","TCP","1434","49253  >  443 [ACK] Seq=189427 Ack=4053 Win=1522 Len=1368 TSval=518636 TSecr=373021872 [TCP segment of a reassembled PDU]"
"385","2018-08-07 17:52:27.939675","192.168.2.3","216.58.197.4","TLSv1.2","212","Application Data"
"386","2018-08-07 17:52:27.939678","192.168.2.3","216.58.197.4","TCP","1434","49253  >  443 [ACK] Seq=190941 Ack=4053 Win=1522 Len=1368 TSval=518636 TSecr=373021872 [TCP segment of a reassembled PDU]"
"387","2018-08-07 17:52:27.939783","192.168.2.3","216.58.197.4","TLSv1.2","155","Application Data"
"391","2018-08-07 17:52:28.041511","192.168.2.3","216.58.197.4","TCP","1434","49253  >  443 [ACK] Seq=192398 Ack=4053 Win=1522 Len=1368 TSval=518647 TSecr=373021906 [TCP segment of a reassembled PDU]"
"392","2018-08-07 17:52:28.041516","192.168.2.3","216.58.197.4","TCP","1434","49253  >  443 [ACK] Seq=193766 Ack=4053 Win=1522 Len=1368 TSval=518647 TSecr=373021906 [TCP segment of a reassembled PDU]"
"393","2018-08-07 17:52:28.041517","192.168.2.3","216.58.197.4","TLSv1.2","212","Application Data"
"394","2018-08-07 17:52:28.041926","192.168.2.3","216.58.197.4","TCP","1434","49253  >  443 [ACK] Seq=195280 Ack=4053 Win=1522 Len=1368 TSval=518647 TSecr=373021906 [TCP segment of a reassembled PDU]"
"395","2018-08-07 17:52:28.041927","192.168.2.3","216.58.197.4","TLSv1.2","155","Application Data"
"400","2018-08-07 17:52:28.103907","192.168.2.3","216.58.197.4","TCP","66","49253  >  443 [ACK] Seq=196737 Ack=4457 Win=1522 Len=0 TSval=518653 TSecr=373022064"
"401","2018-08-07 17:52:28.140441","192.168.2.3","216.58.197.4","TCP","1434","49253  >  443 [ACK] Seq=196737 Ack=4457 Win=1522 Len=1368 TSval=518657 TSecr=373022064 [TCP segment of a reassembled PDU]"
"402","2018-08-07 17:52:28.140869","192.168.2.3","216.58.197.4","TCP","1434","49253  >  443 [ACK] Seq=198105 Ack=4457 Win=1522 Len=1368 TSval=518657 TSecr=373022064 [TCP segment of a reassembled PDU]"
"403","2018-08-07 17:52:28.140872","192.168.2.3","216.58.197.4","TLSv1.2","212","Application Data"
"404","2018-08-07 17:52:28.144068","192.168.2.3","216.58.197.4","TCP","1434","49253  >  443 [ACK] Seq=199619 Ack=4457 Win=1522 Len=1368 TSval=518657 TSecr=373022064 [TCP segment of a reassembled PDU]"
"405","2018-08-07 17:52:28.144355","192.168.2.3","216.58.197.4","TLSv1.2","155","Application Data"
"409","2018-08-07 17:52:28.242879","192.168.2.3","216.58.197.4","TCP","1434","49253  >  443 [ACK] Seq=201076 Ack=4457 Win=1522 Len=1368 TSval=518667 TSecr=373022110 [TCP segment of a reassembled PDU]"
"410","2018-08-07 17:52:28.243086","192.168.2.3","216.58.197.4","TCP","1434","49253  >  443 [ACK] Seq=202444 Ack=4457 Win=1522 Len=1368 TSval=518667 TSecr=373022110 [TCP segment of a reassembled PDU]"
"411","2018-08-07 17:52:28.243090","192.168.2.3","216.58.197.4","TLSv1.2","212","Application Data"
"412","2018-08-07 17:52:28.243327","192.168.2.3","216.58.197.4","TLSv1.2","1355","Application Data"
"417","2018-08-07 17:52:28.287577","192.168.2.3","216.58.197.4","TCP","66","49253  >  443 [ACK] Seq=205247 Ack=4703 Win=1522 Len=0 TSval=518672 TSecr=373022211"
"419","2018-08-07 17:52:28.351750","192.168.2.3","216.58.197.4","TCP","66","49253  >  443 [ACK] Seq=205247 Ack=4961 Win=1522 Len=0 TSval=518678 TSecr=373022312"
"420","2018-08-07 17:52:28.355117","192.168.2.3","216.58.197.4","TCP","1434","49253  >  443 [ACK] Seq=205247 Ack=4961 Win=1522 Len=1368 TSval=518678 TSecr=373022312 [TCP segment of a reassembled PDU]"
"421","2018-08-07 17:52:28.355120","192.168.2.3","216.58.197.4","TCP","1434","49253  >  443 [ACK] Seq=206615 Ack=4961 Win=1522 Len=1368 TSval=518678 TSecr=373022312 [TCP segment of a reassembled PDU]"
"422","2018-08-07 17:52:28.355121","192.168.2.3","216.58.197.4","TLSv1.2","212","Application Data"
"423","2018-08-07 17:52:28.355290","192.168.2.3","216.58.197.4","TLSv1.2","1040","Application Data"
"427","2018-08-07 17:52:28.403479","192.168.2.3","216.58.197.4","TCP","66","49253  >  443 [ACK] Seq=209103 Ack=5149 Win=1522 Len=0 TSval=518683 TSecr=373022327"
"428","2018-08-07 17:52:28.457641","192.168.2.3","216.58.197.4","TCP","1434","49253  >  443 [ACK] Seq=209103 Ack=5149 Win=1522 Len=1368 TSval=518688 TSecr=373022327 [TCP segment of a reassembled PDU]"
"429","2018-08-07 17:52:28.457645","192.168.2.3","216.58.197.4","TCP","1434","49253  >  443 [ACK] Seq=210471 Ack=5149 Win=1522 Len=1368 TSval=518688 TSecr=373022327 [TCP segment of a reassembled PDU]"
"430","2018-08-07 17:52:28.457646","192.168.2.3","216.58.197.4","TLSv1.2","212","Application Data"
"431","2018-08-07 17:52:28.457796","192.168.2.3","216.58.197.4","TCP","1434","49253  >  443 [ACK] Seq=211985 Ack=5149 Win=1522 Len=1368 TSval=518688 TSecr=373022327 [TCP segment of a reassembled PDU]"
"432","2018-08-07 17:52:28.458065","192.168.2.3","216.58.197.4","TLSv1.2","155","Application Data"
"438","2018-08-07 17:52:28.509529","192.168.2.3","216.58.197.4","TCP","66","49253  >  443 [ACK] Seq=213442 Ack=5358 Win=1522 Len=0 TSval=518694 TSecr=373022467"
"439","2018-08-07 17:52:28.509870","192.168.2.3","216.58.197.4","TCP","66","49253  >  443 [ACK] Seq=213442 Ack=5408 Win=1522 Len=0 TSval=518694 TSecr=373022467"
"440","2018-08-07 17:52:28.571194","192.168.2.3","216.58.197.4","TCP","1434","49253  >  443 [ACK] Seq=213442 Ack=5408 Win=1522 Len=1368 TSval=518699 TSecr=373022467 [TCP segment of a reassembled PDU]"
"441","2018-08-07 17:52:28.571201","192.168.2.3","216.58.197.4","TCP","1434","49253  >  443 [ACK] Seq=214810 Ack=5408 Win=1522 Len=1368 TSval=518699 TSecr=373022467 [TCP segment of a reassembled PDU]"
"442","2018-08-07 17:52:28.571202","192.168.2.3","216.58.197.4","TLSv1.2","212","Application Data"
"443","2018-08-07 17:52:28.571476","192.168.2.3","216.58.197.4","TCP","1434","49253  >  443 [ACK] Seq=216324 Ack=5408 Win=1522 Len=1368 TSval=518699 TSecr=373022467 [TCP segment of a reassembled PDU]"
"444","2018-08-07 17:52:28.571480","192.168.2.3","216.58.197.4","TLSv1.2","123","Application Data"
"447","2018-08-07 17:52:28.676709","192.168.2.3","216.58.197.4","TCP","1434","49253  >  443 [ACK] Seq=217749 Ack=5408 Win=1522 Len=1368 TSval=518710 TSecr=373022537 [TCP segment of a reassembled PDU]"
"448","2018-08-07 17:52:28.676999","192.168.2.3","216.58.197.4","TCP","1434","49253  >  443 [ACK] Seq=219117 Ack=5408 Win=1522 Len=1368 TSval=518710 TSecr=373022537 [TCP segment of a reassembled PDU]"
"449","2018-08-07 17:52:28.677001","192.168.2.3","216.58.197.4","TLSv1.2","212","Application Data"
"450","2018-08-07 17:52:28.677382","192.168.2.3","216.58.197.4","TLSv1.2","1171","Application Data"
"456","2018-08-07 17:52:28.706042","192.168.2.3","172.217.27.174","TCP","66","[TCP Previous segment not captured] 52274  >  443 [FIN, ACK] Seq=2 Ack=57 Win=494 Len=0 TSval=518713 TSecr=4030509403"
"460","2018-08-07 17:52:28.738981","192.168.2.3","216.58.197.4","TCP","66","49253  >  443 [ACK] Seq=221736 Ack=5623 Win=1522 Len=0 TSval=518717 TSecr=373022699"
"461","2018-08-07 17:52:28.743031","192.168.2.3","216.58.197.4","TCP","66","49253  >  443 [ACK] Seq=221736 Ack=5751 Win=1522 Len=0 TSval=518717 TSecr=373022699"
"462","2018-08-07 17:52:28.777831","192.168.2.3","216.58.197.4","TCP","1434","49253  >  443 [ACK] Seq=221736 Ack=5751 Win=1522 Len=1368 TSval=518720 TSecr=373022699 [TCP segment of a reassembled PDU]"
"463","2018-08-07 17:52:28.777836","192.168.2.3","216.58.197.4","TCP","1434","49253  >  443 [ACK] Seq=223104 Ack=5751 Win=1522 Len=1368 TSval=518720 TSecr=373022699 [TCP segment of a reassembled PDU]"
"464","2018-08-07 17:52:28.777837","192.168.2.3","216.58.197.4","TLSv1.2","212","Application Data"
"465","2018-08-07 17:52:28.777973","192.168.2.3","216.58.197.4","TCP","1434","49253  >  443 [ACK] Seq=224618 Ack=5751 Win=1522 Len=1368 TSval=518720 TSecr=373022699 [TCP segment of a reassembled PDU]"
"466","2018-08-07 17:52:28.778179","192.168.2.3","216.58.197.4","TLSv1.2","155","Application Data"
"471","2018-08-07 17:52:28.827664","192.168.2.3","216.58.197.4","TCP","66","49253  >  443 [ACK] Seq=226075 Ack=6038 Win=1522 Len=0 TSval=518726 TSecr=373022787"
"474","2018-08-07 17:52:28.872260","192.168.2.3","216.58.197.4","TCP","66","49253  >  443 [ACK] Seq=226075 Ack=6602 Win=1522 Len=0 TSval=518730 TSecr=373022826"
"475","2018-08-07 17:52:28.882177","192.168.2.3","216.58.197.4","TCP","1434","49253  >  443 [ACK] Seq=226075 Ack=6602 Win=1522 Len=1368 TSval=518731 TSecr=373022826 [TCP segment of a reassembled PDU]"
"476","2018-08-07 17:52:28.882575","192.168.2.3","216.58.197.4","TCP","1434","49253  >  443 [ACK] Seq=227443 Ack=6602 Win=1522 Len=1368 TSval=518731 TSecr=373022826 [TCP segment of a reassembled PDU]"
"477","2018-08-07 17:52:28.882577","192.168.2.3","216.58.197.4","TLSv1.2","212","Application Data"
"478","2018-08-07 17:52:28.882578","192.168.2.3","216.58.197.4","TCP","1434","49253  >  443 [ACK] Seq=228957 Ack=6602 Win=1522 Len=1368 TSval=518731 TSecr=373022826 [TCP segment of a reassembled PDU]"
"479","2018-08-07 17:52:28.882579","192.168.2.3","216.58.197.4","TLSv1.2","71","Application Data"
"480","2018-08-07 17:52:28.882810","192.168.2.3","216.58.197.4","TLSv1.2","488","Application Data"
"481","2018-08-07 17:52:28.882812","192.168.2.3","216.58.197.4","TLSv1.2","102","Application Data"
"487","2018-08-07 17:52:29.367966","192.168.2.3","216.58.197.4","TCP","66","49253  >  443 [ACK] Seq=230788 Ack=7069 Win=1522 Len=0 TSval=518780 TSecr=373023311"
"489","2018-08-07 17:52:29.788637","192.168.2.3","216.58.197.4","TCP","66","49253  >  443 [ACK] Seq=230788 Ack=7120 Win=1522 Len=0 TSval=518822 TSecr=373023713"
"492","2018-08-07 17:52:29.804859","192.168.2.3","216.58.197.4","TCP","66","49253  >  443 [ACK] Seq=230788 Ack=8538 Win=1512 Len=0 TSval=518823 TSecr=373023764"
"493","2018-08-07 17:52:29.804861","192.168.2.3","216.58.197.4","TCP","66","49253  >  443 [ACK] Seq=230788 Ack=8661 Win=1512 Len=0 TSval=518823 TSecr=373023764"
"495","2018-08-07 17:52:30.353845","192.168.2.3","216.58.197.4","TCP","66","49253  >  443 [ACK] Seq=230788 Ack=8928 Win=1522 Len=0 TSval=518878 TSecr=373024312"
"497","2018-08-07 17:52:30.373124","192.168.2.3","216.58.197.4","TCP","66","49253  >  443 [ACK] Seq=230788 Ack=9136 Win=1522 Len=0 TSval=518880 TSecr=373024328"
"510","2018-08-07 17:52:30.443749","192.168.2.3","216.58.197.4","TCP","66","49253  >  443 [ACK] Seq=230788 Ack=10554 Win=1512 Len=0 TSval=518887 TSecr=373024402"
"511","2018-08-07 17:52:30.443751","192.168.2.3","216.58.197.4","TCP","66","49253  >  443 [ACK] Seq=230788 Ack=10923 Win=1512 Len=0 TSval=518887 TSecr=373024402"
"512","2018-08-07 17:52:30.443752","192.168.2.3","216.58.197.4","TCP","66","49253  >  443 [ACK] Seq=230788 Ack=12341 Win=1512 Len=0 TSval=518887 TSecr=373024402"
"513","2018-08-07 17:52:30.443753","192.168.2.3","216.58.197.4","TCP","66","49253  >  443 [ACK] Seq=230788 Ack=14057 Win=1503 Len=0 TSval=518887 TSecr=373024402"
"514","2018-08-07 17:52:30.450904","192.168.2.3","216.58.197.4","TCP","66","49253  >  443 [ACK] Seq=230788 Ack=16168 Win=1503 Len=0 TSval=518888 TSecr=373024402"
"515","2018-08-07 17:52:30.450907","192.168.2.3","216.58.197.4","TCP","66","49253  >  443 [ACK] Seq=230788 Ack=19771 Win=1507 Len=0 TSval=518888 TSecr=373024403"
"522","2018-08-07 17:52:30.476456","192.168.2.3","216.58.197.4","TCP","66","49253  >  443 [ACK] Seq=230788 Ack=21189 Win=1512 Len=0 TSval=518890 TSecr=373024436"
"523","2018-08-07 17:52:30.477297","192.168.2.3","216.58.197.4","TCP","66","49253  >  443 [ACK] Seq=230788 Ack=21577 Win=1522 Len=0 TSval=518890 TSecr=373024436"
"526","2018-08-07 17:52:30.478140","192.168.2.3","216.58.197.4","TCP","66","49253  >  443 [ACK] Seq=230788 Ack=23440 Win=1522 Len=0 TSval=518891 TSecr=373024437"
"527","2018-08-07 17:52:30.479028","192.168.2.3","216.58.197.4","TCP","66","49253  >  443 [ACK] Seq=230788 Ack=25201 Win=1522 Len=0 TSval=518891 TSecr=373024437"
"532","2018-08-07 17:52:30.480223","192.168.2.3","216.58.197.4","TCP","66","49253  >  443 [ACK] Seq=230788 Ack=27123 Win=1522 Len=0 TSval=518891 TSecr=373024439"
"533","2018-08-07 17:52:30.481110","192.168.2.3","216.58.197.4","TCP","66","49253  >  443 [ACK] Seq=230788 Ack=28998 Win=1522 Len=0 TSval=518891 TSecr=373024441"
"536","2018-08-07 17:52:30.481514","192.168.2.3","216.58.197.4","TCP","66","49253  >  443 [ACK] Seq=230788 Ack=30709 Win=1522 Len=0 TSval=518891 TSecr=373024441"
"541","2018-08-07 17:52:30.483950","192.168.2.3","216.58.197.4","TCP","66","49253  >  443 [ACK] Seq=230788 Ack=32638 Win=1522 Len=0 TSval=518891 TSecr=373024442"
"544","2018-08-07 17:52:30.484663","192.168.2.3","216.58.197.4","TCP","66","49253  >  443 [ACK] Seq=230788 Ack=34367 Win=1522 Len=0 TSval=518891 TSecr=373024444"
"551","2018-08-07 17:52:30.488408","192.168.2.3","216.58.197.4","TCP","66","49253  >  443 [ACK] Seq=230788 Ack=36070 Win=1522 Len=0 TSval=518891 TSecr=373024444"
"552","2018-08-07 17:52:30.488410","192.168.2.3","216.58.197.4","TCP","66","49253  >  443 [ACK] Seq=230788 Ack=37799 Win=1522 Len=0 TSval=518892 TSecr=373024445"
"563","2018-08-07 17:52:30.493233","192.168.2.3","216.58.197.4","TCP","66","49253  >  443 [ACK] Seq=230788 Ack=48722 Win=1522 Len=0 TSval=518892 TSecr=373024447"
"564","2018-08-07 17:52:30.503365","192.168.2.3","224.0.0.251","MDNS","82","Standard query 0x0000 PTR _googlecast._tcp.local, ""QM"" question"
"565","2018-08-07 17:52:30.503368","192.168.2.3","224.0.0.251","MDNS","437","Standard query response 0x0000 PTR Google-Home-d8ff63fb78680c8a1c8ccacd5fd7f560._googlecast._tcp.local TXT, cache flush SRV, cache flush 0 0 8009 d8ff63fb-7868-0c8a-1c8c-cacd5fd7f560.local A, cache flush 192.168.2.3"
"566","2018-08-07 17:52:30.503369","192.168.2.3","224.0.0.251","MDNS","82","Standard query 0x0000 PTR _googlezone._tcp.local, ""QM"" question"
"567","2018-08-07 17:52:30.503369","192.168.2.3","224.0.0.251","MDNS","119","Standard query 0x0000 SRV d8ff63fb-7868-0c8a-1c8c-cacd5fd7f560._googlezone._tcp.local, ""QM"" question"
"568","2018-08-07 17:52:30.503370","192.168.2.3","224.0.0.251","MDNS","321","Standard query response 0x0000 PTR d8ff63fb-7868-0c8a-1c8c-cacd5fd7f560._googlezone._tcp.local TXT, cache flush SRV, cache flush 210 70 10001 d8ff63fb-7868-0c8a-1c8c-cacd5fd7f560.local A, cache flush 192.168.2.3"
"569","2018-08-07 17:52:30.503372","192.168.2.3","224.0.0.251","MDNS","186","Standard query response 0x0000 SRV, cache flush 210 70 10001 d8ff63fb-7868-0c8a-1c8c-cacd5fd7f560.local A, cache flush 192.168.2.3"
"570","2018-08-07 17:52:30.505684","192.168.2.3","216.58.197.4","TCP","66","49253  >  443 [ACK] Seq=230788 Ack=52339 Win=1522 Len=0 TSval=518893 TSecr=373024453"
"614","2018-08-07 17:52:30.526549","192.168.2.3","216.58.197.4","TCP","66","49253  >  443 [ACK] Seq=230788 Ack=54246 Win=1522 Len=0 TSval=518895 TSecr=373024470"
"615","2018-08-07 17:52:30.526551","192.168.2.3","216.58.197.4","TCP","66","49253  >  443 [ACK] Seq=230788 Ack=56028 Win=1522 Len=0 TSval=518895 TSecr=373024470"
"616","2018-08-07 17:52:30.526552","192.168.2.3","216.58.197.4","TCP","66","49253  >  443 [ACK] Seq=230788 Ack=57740 Win=1522 Len=0 TSval=518895 TSecr=373024471"
"624","2018-08-07 17:52:30.532040","192.168.2.3","216.58.197.4","TCP","66","49253  >  443 [ACK] Seq=230788 Ack=61022 Win=1522 Len=0 TSval=518895 TSecr=373024473"
"625","2018-08-07 17:52:30.532042","192.168.2.3","216.58.197.4","TCP","66","49253  >  443 [ACK] Seq=230788 Ack=63338 Win=1522 Len=0 TSval=518895 TSecr=373024473"
"626","2018-08-07 17:52:30.532043","192.168.2.3","216.58.197.4","TCP","66","49253  >  443 [ACK] Seq=230788 Ack=78333 Win=1522 Len=0 TSval=518896 TSecr=373024475"
"627","2018-08-07 17:52:30.538967","192.168.2.3","216.58.197.4","TCP","66","49253  >  443 [ACK] Seq=230788 Ack=94010 Win=1522 Len=0 TSval=518897 TSecr=373024483"
"628","2018-08-07 17:52:30.546245","192.168.2.3","216.58.197.4","TLSv1.2","104","Application Data"
"630","2018-08-07 17:52:33.889959","192.168.2.3","64.233.188.188","TCP","66","40306  >  5228 [ACK] Seq=1 Ack=1 Win=539 Len=0 TSval=519232 TSecr=3578441883"
"632","2018-08-07 17:52:39.960309","192.168.2.3","172.217.27.174","TLSv1.2","161","Application Data"
"633","2018-08-07 17:52:39.960313","192.168.2.3","172.217.27.174","TLSv1.2","104","Application Data"
"634","2018-08-07 17:52:39.960314","192.168.2.3","172.217.27.174","TLSv1.2","475","Application Data"
"639","2018-08-07 17:52:39.997629","192.168.2.3","172.217.27.174","TCP","66","52258  >  443 [ACK] Seq=543 Ack=39 Win=661 Len=0 TSval=519843 TSecr=2575478535"
"644","2018-08-07 17:52:40.046886","192.168.2.3","172.217.27.174","TCP","66","52258  >  443 [ACK] Seq=543 Ack=107 Win=661 Len=0 TSval=519847 TSecr=2575478613"
"645","2018-08-07 17:52:40.046888","192.168.2.3","172.217.27.174","TCP","66","52258  >  443 [ACK] Seq=543 Ack=338 Win=661 Len=0 TSval=519847 TSecr=2575478613"
"646","2018-08-07 17:52:40.046889","192.168.2.3","172.217.27.174","TCP","66","52258  >  443 [ACK] Seq=543 Ack=570 Win=661 Len=0 TSval=519847 TSecr=2575478613"
"647","2018-08-07 17:52:40.046890","192.168.2.3","172.217.27.174","TCP","66","52258  >  443 [ACK] Seq=543 Ack=608 Win=661 Len=0 TSval=519847 TSecr=2575478613"
"648","2018-08-07 17:52:40.046890","192.168.2.3","172.217.27.174","TLSv1.2","104","Application Data"
"650","2018-08-07 17:52:41.889898","192.168.2.3","172.217.27.163","TCP","66","38971  >  443 [ACK] Seq=1 Ack=1 Win=406 Len=0 TSval=520032 TSecr=467265893"
"652","2018-08-07 17:52:48.971896","192.168.2.3","172.217.27.174","TLSv1.2","156","Application Data"
"653","2018-08-07 17:52:48.972367","192.168.2.3","172.217.27.174","TLSv1.2","505","Application Data"
"660","2018-08-07 17:52:49.112390","192.168.2.3","172.217.27.174","TCP","66","52258  >  443 [ACK] Seq=1110 Ack=1034 Win=661 Len=0 TSval=520753 TSecr=2575487670"
"661","2018-08-07 17:52:49.112393","192.168.2.3","172.217.27.174","TLSv1.2","104","Application Data"
"663","2018-08-07 17:52:52.555846","192.168.2.3","108.177.125.188","TCP","91","[TCP Previous segment not captured] 50384  >  5228 [PSH, ACK] Seq=2 Ack=1 Win=262 Len=25 TSval=521098 TSecr=2744553503"
"665","2018-08-07 17:52:52.599840","192.168.2.3","108.177.125.188","TCP","66","50384  >  5228 [ACK] Seq=27 Ack=26 Win=262 Len=0 TSval=521103 TSecr=2744583367"
