"No.","Time","Source","Destination","Protocol","Length","Info"
"1","2018-08-07 18:00:45.744054","192.168.2.3","192.168.2.1","ICMP","98","Echo (ping) request  id=0x0659, seq=1/256, ttl=64 (reply in 2)"
"3","2018-08-07 18:00:46.773078","192.168.2.3","192.168.2.1","ICMP","98","Echo (ping) request  id=0x0659, seq=2/512, ttl=64 (reply in 4)"
"5","2018-08-07 18:00:46.809405","192.168.2.3","8.8.8.8","ICMP","98","Echo (ping) request  id=0x065f, seq=1/256, ttl=64 (reply in 6)"
"7","2018-08-07 18:00:47.822897","192.168.2.3","8.8.8.8","ICMP","98","Echo (ping) request  id=0x065f, seq=2/512, ttl=64 (reply in 8)"
"9","2018-08-07 18:00:47.833304","192.168.2.3","8.8.8.8","DNS","74","Standard query 0x0133 A www.google.com"
"10","2018-08-07 18:00:47.833306","192.168.2.3","8.8.8.8","DNS","74","Standard query 0xa634 AAAA www.google.com"
"13","2018-08-07 18:00:47.937215","192.168.2.3","216.58.197.4","TCP","66","49253  >  443 [ACK] Seq=1 Ack=1 Win=1522 Len=0 TSval=568636 TSecr=373476861"
"15","2018-08-07 18:00:50.212914","192.168.2.3","64.233.188.188","TCP","66","40306  >  5228 [ACK] Seq=1 Ack=1 Win=539 Len=0 TSval=568864 TSecr=3578938206"
"18","2018-08-07 18:00:52.787588","192.168.2.3","108.177.125.188","TCP","91","50384  >  5228 [PSH, ACK] Seq=1 Ack=1 Win=262 Len=25 TSval=569121 TSecr=2745033829"
"21","2018-08-07 18:00:53.068616","192.168.2.3","108.177.125.188","TCP","66","50384  >  5228 [ACK] Seq=26 Ack=26 Win=262 Len=0 TSval=569149 TSecr=2745063835"
"22","2018-08-07 18:00:56.953104","192.168.2.3","239.255.255.250","SSDP","136","M-SEARCH * HTTP/1.1 "
"23","2018-08-07 18:00:57.068266","192.168.2.3","172.217.27.163","TLSv1.2","135","Application Data"
"24","2018-08-07 18:00:57.068490","192.168.2.3","172.217.27.163","TLSv1.2","104","Application Data"
"27","2018-08-07 18:00:57.081491","192.168.2.3","172.217.27.163","TLSv1.2","100","Application Data"
"28","2018-08-07 18:00:57.081495","192.168.2.3","172.217.27.163","TLSv1.2","104","Application Data"
"30","2018-08-07 18:01:00.653287","192.168.2.3","224.0.0.251","MDNS","82","Standard query 0x0000 PTR _googlecast._tcp.local, ""QM"" question"
"31","2018-08-07 18:01:00.654907","192.168.2.3","224.0.0.251","MDNS","437","Standard query response 0x0000 PTR Google-Home-d8ff63fb78680c8a1c8ccacd5fd7f560._googlecast._tcp.local TXT, cache flush SRV, cache flush 0 0 8009 d8ff63fb-7868-0c8a-1c8c-cacd5fd7f560.local A, cache flush 192.168.2.3"
"32","2018-08-07 18:01:00.659430","192.168.2.3","224.0.0.251","MDNS","82","Standard query 0x0000 PTR _googlezone._tcp.local, ""QM"" question"
"33","2018-08-07 18:01:00.659432","192.168.2.3","224.0.0.251","MDNS","119","Standard query 0x0000 SRV d8ff63fb-7868-0c8a-1c8c-cacd5fd7f560._googlezone._tcp.local, ""QM"" question"
"34","2018-08-07 18:01:00.659433","192.168.2.3","224.0.0.251","MDNS","321","Standard query response 0x0000 PTR d8ff63fb-7868-0c8a-1c8c-cacd5fd7f560._googlezone._tcp.local TXT, cache flush SRV, cache flush 210 70 10001 d8ff63fb-7868-0c8a-1c8c-cacd5fd7f560.local A, cache flush 192.168.2.3"
"35","2018-08-07 18:01:00.659434","192.168.2.3","224.0.0.251","MDNS","186","Standard query response 0x0000 SRV, cache flush 210 70 10001 d8ff63fb-7868-0c8a-1c8c-cacd5fd7f560.local A, cache flush 192.168.2.3"
"37","2018-08-07 18:01:01.123086","192.168.2.3","216.58.197.4","TLSv1.2","155","[TCP Previous segment not captured] , Application Data"
"38","2018-08-07 18:01:01.123097","192.168.2.3","216.58.197.4","TLSv1.2","104","Application Data"
"39","2018-08-07 18:01:01.123162","192.168.2.3","216.58.197.4","TLSv1.2","158","Application Data"
"44","2018-08-07 18:01:01.130778","192.168.2.3","216.58.197.4","TCP","66","49253  >  443 [ACK] Seq=221 Ack=39 Win=1522 Len=0 TSval=569955 TSecr=373535091"
"45","2018-08-07 18:01:01.135640","192.168.2.3","216.58.197.4","TCP","1434","49253  >  443 [ACK] Seq=221 Ack=39 Win=1522 Len=1368 TSval=569956 TSecr=373535091 [TCP segment of a reassembled PDU]"
"46","2018-08-07 18:01:01.137310","192.168.2.3","216.58.197.4","TCP","1434","49253  >  443 [ACK] Seq=1589 Ack=39 Win=1522 Len=1368 TSval=569956 TSecr=373535091 [TCP segment of a reassembled PDU]"
"47","2018-08-07 18:01:01.137313","192.168.2.3","216.58.197.4","TLSv1.2","212","Application Data"
"48","2018-08-07 18:01:01.137731","192.168.2.3","216.58.197.4","TCP","1434","49253  >  443 [ACK] Seq=3103 Ack=39 Win=1522 Len=1368 TSval=569956 TSecr=373535091 [TCP segment of a reassembled PDU]"
"49","2018-08-07 18:01:01.138233","192.168.2.3","216.58.197.4","TLSv1.2","287","Application Data"
"50","2018-08-07 18:01:01.139008","192.168.2.3","216.58.197.4","TCP","1434","49253  >  443 [ACK] Seq=4692 Ack=39 Win=1522 Len=1368 TSval=569956 TSecr=373535091 [TCP segment of a reassembled PDU]"
"51","2018-08-07 18:01:01.139289","192.168.2.3","216.58.197.4","TCP","1434","49253  >  443 [ACK] Seq=6060 Ack=39 Win=1522 Len=1368 TSval=569956 TSecr=373535091 [TCP segment of a reassembled PDU]"
"55","2018-08-07 18:01:01.145486","192.168.2.3","216.58.197.4","TLSv1.2","212","Application Data"
"56","2018-08-07 18:01:01.145493","192.168.2.3","216.58.197.4","TCP","1434","49253  >  443 [ACK] Seq=7574 Ack=39 Win=1522 Len=1368 TSval=569957 TSecr=373535091 [TCP segment of a reassembled PDU]"
"57","2018-08-07 18:01:01.145494","192.168.2.3","216.58.197.4","TLSv1.2","156","Application Data"
"58","2018-08-07 18:01:01.145621","192.168.2.3","216.58.197.4","TCP","1434","49253  >  443 [ACK] Seq=9032 Ack=39 Win=1522 Len=1368 TSval=569957 TSecr=373535105 [TCP segment of a reassembled PDU]"
"59","2018-08-07 18:01:01.146781","192.168.2.3","216.58.197.4","TCP","1434","49253  >  443 [ACK] Seq=10400 Ack=39 Win=1522 Len=1368 TSval=569957 TSecr=373535105 [TCP segment of a reassembled PDU]"
"60","2018-08-07 18:01:01.147055","192.168.2.3","216.58.197.4","TLSv1.2","1434","Application Data [TCP segment of a reassembled PDU]"
"61","2018-08-07 18:01:01.147058","192.168.2.3","216.58.197.4","TCP","1434","49253  >  443 [ACK] Seq=13136 Ack=39 Win=1522 Len=1368 TSval=569957 TSecr=373535105 [TCP segment of a reassembled PDU]"
"62","2018-08-07 18:01:01.147115","192.168.2.3","216.58.197.4","TLSv1.2","1434","Application Data [TCP segment of a reassembled PDU]"
"63","2018-08-07 18:01:01.147358","192.168.2.3","216.58.197.4","TCP","1434","49253  >  443 [ACK] Seq=15872 Ack=39 Win=1522 Len=1368 TSval=569957 TSecr=373535105 [TCP segment of a reassembled PDU]"
"64","2018-08-07 18:01:01.147460","192.168.2.3","216.58.197.4","TLSv1.2","1434","Application Data [TCP segment of a reassembled PDU]"
"65","2018-08-07 18:01:01.147891","192.168.2.3","216.58.197.4","TCP","1434","49253  >  443 [ACK] Seq=18608 Ack=39 Win=1522 Len=1368 TSval=569957 TSecr=373535106 [TCP segment of a reassembled PDU]"
"66","2018-08-07 18:01:01.147893","192.168.2.3","216.58.197.4","TLSv1.2","1434","Application Data [TCP segment of a reassembled PDU]"
"67","2018-08-07 18:01:01.148202","192.168.2.3","216.58.197.4","TCP","1434","49253  >  443 [ACK] Seq=21344 Ack=39 Win=1522 Len=1368 TSval=569957 TSecr=373535106 [TCP segment of a reassembled PDU]"
"70","2018-08-07 18:01:01.151395","192.168.2.3","216.58.197.4","TLSv1.2","1434","Application Data [TCP segment of a reassembled PDU]"
"73","2018-08-07 18:01:01.151727","192.168.2.3","216.58.197.4","TCP","1434","49253  >  443 [ACK] Seq=24080 Ack=39 Win=1522 Len=1368 TSval=569957 TSecr=373535113 [TCP segment of a reassembled PDU]"
"74","2018-08-07 18:01:01.151730","192.168.2.3","216.58.197.4","TLSv1.2","1434","Application Data [TCP segment of a reassembled PDU]"
"77","2018-08-07 18:01:01.153551","192.168.2.3","216.58.197.4","TCP","1434","49253  >  443 [ACK] Seq=26816 Ack=39 Win=1522 Len=1368 TSval=569957 TSecr=373535113 [TCP segment of a reassembled PDU]"
"78","2018-08-07 18:01:01.153553","192.168.2.3","216.58.197.4","TLSv1.2","1434","Application Data [TCP segment of a reassembled PDU]"
"79","2018-08-07 18:01:01.153725","192.168.2.3","216.58.197.4","TCP","1434","49253  >  443 [ACK] Seq=29552 Ack=39 Win=1522 Len=1368 TSval=569957 TSecr=373535113 [TCP segment of a reassembled PDU]"
"80","2018-08-07 18:01:01.154628","192.168.2.3","216.58.197.4","TLSv1.2","1434","Application Data [TCP segment of a reassembled PDU]"
"81","2018-08-07 18:01:01.155027","192.168.2.3","216.58.197.4","TCP","1434","49253  >  443 [ACK] Seq=32288 Ack=39 Win=1522 Len=1368 TSval=569958 TSecr=373535114 [TCP segment of a reassembled PDU]"
"82","2018-08-07 18:01:01.155295","192.168.2.3","216.58.197.4","TLSv1.2","1434","Application Data [TCP segment of a reassembled PDU]"
"83","2018-08-07 18:01:01.155297","192.168.2.3","216.58.197.4","TCP","1434","49253  >  443 [ACK] Seq=35024 Ack=39 Win=1522 Len=1368 TSval=569958 TSecr=373535114 [TCP segment of a reassembled PDU]"
"84","2018-08-07 18:01:01.155442","192.168.2.3","216.58.197.4","TLSv1.2","1434","Application Data [TCP segment of a reassembled PDU]"
"85","2018-08-07 18:01:01.155626","192.168.2.3","216.58.197.4","TCP","1434","49253  >  443 [ACK] Seq=37760 Ack=39 Win=1522 Len=1368 TSval=569958 TSecr=373535114 [TCP segment of a reassembled PDU]"
"87","2018-08-07 18:01:01.156049","192.168.2.3","216.58.197.4","TLSv1.2","1434","Application Data [TCP segment of a reassembled PDU]"
"88","2018-08-07 18:01:01.156277","192.168.2.3","216.58.197.4","TCP","1434","49253  >  443 [ACK] Seq=40496 Ack=39 Win=1522 Len=1368 TSval=569958 TSecr=373535115 [TCP segment of a reassembled PDU]"
"89","2018-08-07 18:01:01.156279","192.168.2.3","216.58.197.4","TLSv1.2","1434","Application Data [TCP segment of a reassembled PDU]"
"90","2018-08-07 18:01:01.156533","192.168.2.3","216.58.197.4","TCP","1434","49253  >  443 [ACK] Seq=43232 Ack=39 Win=1522 Len=1368 TSval=569958 TSecr=373535115 [TCP segment of a reassembled PDU]"
"92","2018-08-07 18:01:01.156939","192.168.2.3","216.58.197.4","TLSv1.2","1434","Application Data [TCP segment of a reassembled PDU]"
"96","2018-08-07 18:01:01.159995","192.168.2.3","216.58.197.4","TCP","1434","49253  >  443 [ACK] Seq=45968 Ack=39 Win=1522 Len=1368 TSval=569958 TSecr=373535119 [TCP segment of a reassembled PDU]"
"97","2018-08-07 18:01:01.159996","192.168.2.3","216.58.197.4","TLSv1.2","1434","Application Data [TCP segment of a reassembled PDU]"
"102","2018-08-07 18:01:01.163789","192.168.2.3","216.58.197.4","TCP","1434","49253  >  443 [ACK] Seq=48704 Ack=39 Win=1522 Len=1368 TSval=569958 TSecr=373535119 [TCP segment of a reassembled PDU]"
"103","2018-08-07 18:01:01.163792","192.168.2.3","216.58.197.4","TLSv1.2","1434","Application Data [TCP segment of a reassembled PDU]"
"104","2018-08-07 18:01:01.164026","192.168.2.3","216.58.197.4","TCP","1434","49253  >  443 [ACK] Seq=51440 Ack=39 Win=1522 Len=1368 TSval=569958 TSecr=373535119 [TCP segment of a reassembled PDU]"
"106","2018-08-07 18:01:01.164356","192.168.2.3","216.58.197.4","TLSv1.2","1434","Application Data [TCP segment of a reassembled PDU]"
"107","2018-08-07 18:01:01.164712","192.168.2.3","216.58.197.4","TLSv1.2","1414","Application Data"
"111","2018-08-07 18:01:01.225649","192.168.2.3","216.58.197.4","TCP","1434","49253  >  443 [ACK] Seq=55524 Ack=39 Win=1522 Len=1368 TSval=569965 TSecr=373535172 [TCP segment of a reassembled PDU]"
"112","2018-08-07 18:01:01.228838","192.168.2.3","216.58.197.4","TCP","1434","49253  >  443 [ACK] Seq=56892 Ack=39 Win=1522 Len=1368 TSval=569965 TSecr=373535172 [TCP segment of a reassembled PDU]"
"113","2018-08-07 18:01:01.228843","192.168.2.3","216.58.197.4","TLSv1.2","212","Application Data"
"114","2018-08-07 18:01:01.229265","192.168.2.3","216.58.197.4","TCP","1434","49253  >  443 [ACK] Seq=58406 Ack=39 Win=1522 Len=1368 TSval=569965 TSecr=373535172 [TCP segment of a reassembled PDU]"
"115","2018-08-07 18:01:01.229266","192.168.2.3","216.58.197.4","TLSv1.2","155","Application Data"
"119","2018-08-07 18:01:01.328212","192.168.2.3","216.58.197.4","TCP","1434","49253  >  443 [ACK] Seq=59863 Ack=39 Win=1522 Len=1368 TSval=569975 TSecr=373535197 [TCP segment of a reassembled PDU]"
"120","2018-08-07 18:01:01.328216","192.168.2.3","216.58.197.4","TCP","1434","49253  >  443 [ACK] Seq=61231 Ack=39 Win=1522 Len=1368 TSval=569975 TSecr=373535197 [TCP segment of a reassembled PDU]"
"121","2018-08-07 18:01:01.328218","192.168.2.3","216.58.197.4","TLSv1.2","212","Application Data"
"122","2018-08-07 18:01:01.328507","192.168.2.3","216.58.197.4","TCP","1434","49253  >  443 [ACK] Seq=62745 Ack=39 Win=1522 Len=1368 TSval=569975 TSecr=373535197 [TCP segment of a reassembled PDU]"
"123","2018-08-07 18:01:01.328510","192.168.2.3","216.58.197.4","TLSv1.2","153","Application Data"
"125","2018-08-07 18:01:01.447558","192.168.2.3","216.58.197.4","TCP","1434","49253  >  443 [ACK] Seq=64200 Ack=39 Win=1522 Len=1368 TSval=569987 TSecr=373535296 [TCP segment of a reassembled PDU]"
"126","2018-08-07 18:01:01.447816","192.168.2.3","216.58.197.4","TCP","1434","49253  >  443 [ACK] Seq=65568 Ack=39 Win=1522 Len=1368 TSval=569987 TSecr=373535296 [TCP segment of a reassembled PDU]"
"127","2018-08-07 18:01:01.447820","192.168.2.3","216.58.197.4","TLSv1.2","212","Application Data"
"128","2018-08-07 18:01:01.447821","192.168.2.3","216.58.197.4","TLSv1.2","1167","Application Data"
"131","2018-08-07 18:01:01.549447","192.168.2.3","216.58.197.4","TCP","1434","49253  >  443 [ACK] Seq=68183 Ack=39 Win=1522 Len=1368 TSval=569997 TSecr=373535415 [TCP segment of a reassembled PDU]"
"132","2018-08-07 18:01:01.549745","192.168.2.3","216.58.197.4","TCP","1434","49253  >  443 [ACK] Seq=69551 Ack=39 Win=1522 Len=1368 TSval=569997 TSecr=373535415 [TCP segment of a reassembled PDU]"
"133","2018-08-07 18:01:01.549746","192.168.2.3","216.58.197.4","TLSv1.2","212","Application Data"
"134","2018-08-07 18:01:01.549912","192.168.2.3","216.58.197.4","TCP","1434","49253  >  443 [ACK] Seq=71065 Ack=39 Win=1522 Len=1368 TSval=569997 TSecr=373535415 [TCP segment of a reassembled PDU]"
"135","2018-08-07 18:01:01.549913","192.168.2.3","216.58.197.4","TLSv1.2","155","Application Data"
"142","2018-08-07 18:01:01.627039","192.168.2.3","216.58.197.4","TCP","66","49253  >  443 [ACK] Seq=72522 Ack=368 Win=1522 Len=0 TSval=570005 TSecr=373535589"
"144","2018-08-07 18:01:01.642979","192.168.2.3","216.58.197.4","TCP","66","49253  >  443 [ACK] Seq=72522 Ack=789 Win=1522 Len=0 TSval=570007 TSecr=373535589"
"145","2018-08-07 18:01:01.686422","192.168.2.3","216.58.197.4","TCP","1434","49253  >  443 [ACK] Seq=72522 Ack=789 Win=1522 Len=1368 TSval=570011 TSecr=373535589 [TCP segment of a reassembled PDU]"
"146","2018-08-07 18:01:01.686723","192.168.2.3","216.58.197.4","TCP","1434","49253  >  443 [ACK] Seq=73890 Ack=789 Win=1522 Len=1368 TSval=570011 TSecr=373535589 [TCP segment of a reassembled PDU]"
"147","2018-08-07 18:01:01.686726","192.168.2.3","216.58.197.4","TLSv1.2","212","Application Data"
"148","2018-08-07 18:01:01.686727","192.168.2.3","216.58.197.4","TLSv1.2","855","Application Data"
"153","2018-08-07 18:01:01.798833","192.168.2.3","216.58.197.4","TCP","66","49253  >  443 [ACK] Seq=76193 Ack=895 Win=1522 Len=0 TSval=570022 TSecr=373535723"
"154","2018-08-07 18:01:01.803002","192.168.2.3","216.58.197.4","TCP","1434","49253  >  443 [ACK] Seq=76193 Ack=895 Win=1522 Len=1368 TSval=570022 TSecr=373535723 [TCP segment of a reassembled PDU]"
"155","2018-08-07 18:01:01.803230","192.168.2.3","216.58.197.4","TCP","1434","49253  >  443 [ACK] Seq=77561 Ack=895 Win=1522 Len=1368 TSval=570022 TSecr=373535723 [TCP segment of a reassembled PDU]"
"156","2018-08-07 18:01:01.803235","192.168.2.3","216.58.197.4","TLSv1.2","212","Application Data"
"157","2018-08-07 18:01:01.803410","192.168.2.3","216.58.197.4","TCP","1434","49253  >  443 [ACK] Seq=79075 Ack=895 Win=1522 Len=1368 TSval=570022 TSecr=373535723 [TCP segment of a reassembled PDU]"
"158","2018-08-07 18:01:01.803414","192.168.2.3","216.58.197.4","TLSv1.2","155","Application Data"
"162","2018-08-07 18:01:01.901143","192.168.2.3","216.58.197.4","TCP","1434","49253  >  443 [ACK] Seq=80532 Ack=895 Win=1522 Len=1368 TSval=570032 TSecr=373535771 [TCP segment of a reassembled PDU]"
"163","2018-08-07 18:01:01.901434","192.168.2.3","216.58.197.4","TCP","1434","49253  >  443 [ACK] Seq=81900 Ack=895 Win=1522 Len=1368 TSval=570032 TSecr=373535771 [TCP segment of a reassembled PDU]"
"164","2018-08-07 18:01:01.901436","192.168.2.3","216.58.197.4","TLSv1.2","212","Application Data"
"165","2018-08-07 18:01:01.901437","192.168.2.3","216.58.197.4","TCP","1434","49253  >  443 [ACK] Seq=83414 Ack=895 Win=1522 Len=1368 TSval=570032 TSecr=373535771 [TCP segment of a reassembled PDU]"
"166","2018-08-07 18:01:01.901593","192.168.2.3","216.58.197.4","TLSv1.2","155","Application Data"
"171","2018-08-07 18:01:01.929129","192.168.2.3","216.58.197.4","TCP","66","49253  >  443 [ACK] Seq=84871 Ack=1077 Win=1522 Len=0 TSval=570035 TSecr=373535890"
"172","2018-08-07 18:01:02.005909","192.168.2.3","216.58.197.4","TCP","1434","49253  >  443 [ACK] Seq=84871 Ack=1077 Win=1522 Len=1368 TSval=570043 TSecr=373535890 [TCP segment of a reassembled PDU]"
"173","2018-08-07 18:01:02.006338","192.168.2.3","216.58.197.4","TCP","1434","49253  >  443 [ACK] Seq=86239 Ack=1077 Win=1522 Len=1368 TSval=570043 TSecr=373535890 [TCP segment of a reassembled PDU]"
"174","2018-08-07 18:01:02.006340","192.168.2.3","216.58.197.4","TLSv1.2","212","Application Data"
"175","2018-08-07 18:01:02.006966","192.168.2.3","216.58.197.4","TLSv1.2","849","Application Data"
"178","2018-08-07 18:01:02.118559","192.168.2.3","216.58.197.4","TCP","1434","49253  >  443 [ACK] Seq=88536 Ack=1077 Win=1522 Len=1368 TSval=570054 TSecr=373535974 [TCP segment of a reassembled PDU]"
"179","2018-08-07 18:01:02.118944","192.168.2.3","216.58.197.4","TCP","1434","49253  >  443 [ACK] Seq=89904 Ack=1077 Win=1522 Len=1368 TSval=570054 TSecr=373535974 [TCP segment of a reassembled PDU]"
"180","2018-08-07 18:01:02.118948","192.168.2.3","216.58.197.4","TLSv1.2","212","Application Data"
"181","2018-08-07 18:01:02.118949","192.168.2.3","216.58.197.4","TLSv1.2","1177","Application Data"
"184","2018-08-07 18:01:02.224202","192.168.2.3","216.58.197.4","TCP","1434","49253  >  443 [ACK] Seq=92529 Ack=1077 Win=1522 Len=1368 TSval=570064 TSecr=373536086 [TCP segment of a reassembled PDU]"
"185","2018-08-07 18:01:02.224206","192.168.2.3","216.58.197.4","TCP","1434","49253  >  443 [ACK] Seq=93897 Ack=1077 Win=1522 Len=1368 TSval=570064 TSecr=373536086 [TCP segment of a reassembled PDU]"
"186","2018-08-07 18:01:02.224384","192.168.2.3","216.58.197.4","TLSv1.2","212","Application Data"
"187","2018-08-07 18:01:02.224387","192.168.2.3","216.58.197.4","TCP","1434","49253  >  443 [ACK] Seq=95411 Ack=1077 Win=1522 Len=1368 TSval=570064 TSecr=373536086 [TCP segment of a reassembled PDU]"
"188","2018-08-07 18:01:02.224580","192.168.2.3","216.58.197.4","TLSv1.2","155","Application Data"
"192","2018-08-07 18:01:02.347868","192.168.2.3","216.58.197.4","TCP","1434","49253  >  443 [ACK] Seq=96868 Ack=1077 Win=1522 Len=1368 TSval=570077 TSecr=373536232 [TCP segment of a reassembled PDU]"
"193","2018-08-07 18:01:02.348196","192.168.2.3","216.58.197.4","TCP","1434","49253  >  443 [ACK] Seq=98236 Ack=1077 Win=1522 Len=1368 TSval=570077 TSecr=373536232 [TCP segment of a reassembled PDU]"
"194","2018-08-07 18:01:02.348198","192.168.2.3","216.58.197.4","TLSv1.2","212","Application Data"
"195","2018-08-07 18:01:02.348417","192.168.2.3","216.58.197.4","TLSv1.2","1208","Application Data"
"199","2018-08-07 18:01:02.454817","192.168.2.3","216.58.197.4","TCP","1434","49253  >  443 [ACK] Seq=100892 Ack=1077 Win=1522 Len=1368 TSval=570087 TSecr=373536316 [TCP segment of a reassembled PDU]"
"200","2018-08-07 18:01:02.454820","192.168.2.3","216.58.197.4","TCP","1434","49253  >  443 [ACK] Seq=102260 Ack=1077 Win=1522 Len=1368 TSval=570087 TSecr=373536316 [TCP segment of a reassembled PDU]"
"201","2018-08-07 18:01:02.454971","192.168.2.3","216.58.197.4","TLSv1.2","212","Application Data"
"202","2018-08-07 18:01:02.455382","192.168.2.3","216.58.197.4","TLSv1.2","1206","Application Data"
"205","2018-08-07 18:01:02.552384","192.168.2.3","216.58.197.4","TCP","1434","49253  >  443 [ACK] Seq=104914 Ack=1077 Win=1522 Len=1368 TSval=570097 TSecr=373536423 [TCP segment of a reassembled PDU]"
"206","2018-08-07 18:01:02.552719","192.168.2.3","216.58.197.4","TCP","1434","49253  >  443 [ACK] Seq=106282 Ack=1077 Win=1522 Len=1368 TSval=570097 TSecr=373536423 [TCP segment of a reassembled PDU]"
"207","2018-08-07 18:01:02.552722","192.168.2.3","216.58.197.4","TLSv1.2","212","Application Data"
"208","2018-08-07 18:01:02.552723","192.168.2.3","216.58.197.4","TLSv1.2","973","Application Data"
"213","2018-08-07 18:01:02.628902","192.168.2.3","216.58.197.4","TCP","66","49253  >  443 [ACK] Seq=108703 Ack=1329 Win=1522 Len=0 TSval=570105 TSecr=373536589"
"214","2018-08-07 18:01:02.641550","192.168.2.3","216.58.197.4","TCP","1434","49253  >  443 [ACK] Seq=108703 Ack=1329 Win=1522 Len=1368 TSval=570106 TSecr=373536589 [TCP segment of a reassembled PDU]"
"216","2018-08-07 18:01:02.641979","192.168.2.3","216.58.197.4","TCP","1434","49253  >  443 [ACK] Seq=110071 Ack=1329 Win=1522 Len=1368 TSval=570106 TSecr=373536589 [TCP segment of a reassembled PDU]"
"217","2018-08-07 18:01:02.641982","192.168.2.3","216.58.197.4","TLSv1.2","212","Application Data"
"218","2018-08-07 18:01:02.645166","192.168.2.3","216.58.197.4","TCP","1434","49253  >  443 [ACK] Seq=111585 Ack=1329 Win=1522 Len=1368 TSval=570106 TSecr=373536589 [TCP segment of a reassembled PDU]"
"219","2018-08-07 18:01:02.645169","192.168.2.3","216.58.197.4","TLSv1.2","155","Application Data"
"222","2018-08-07 18:01:02.683018","192.168.2.3","216.58.197.4","TCP","66","49253  >  443 [ACK] Seq=113042 Ack=1517 Win=1522 Len=0 TSval=570111 TSecr=373536605"
"223","2018-08-07 18:01:02.728919","192.168.2.3","216.58.197.4","TCP","1434","49253  >  443 [ACK] Seq=113042 Ack=1517 Win=1522 Len=1368 TSval=570115 TSecr=373536605 [TCP segment of a reassembled PDU]"
"224","2018-08-07 18:01:02.729338","192.168.2.3","216.58.197.4","TCP","1434","49253  >  443 [ACK] Seq=114410 Ack=1517 Win=1522 Len=1368 TSval=570115 TSecr=373536605 [TCP segment of a reassembled PDU]"
"225","2018-08-07 18:01:02.729339","192.168.2.3","216.58.197.4","TLSv1.2","212","Application Data"
"226","2018-08-07 18:01:02.729716","192.168.2.3","216.58.197.4","TCP","1434","49253  >  443 [ACK] Seq=115924 Ack=1517 Win=1522 Len=1368 TSval=570115 TSecr=373536605 [TCP segment of a reassembled PDU]"
"227","2018-08-07 18:01:02.729718","192.168.2.3","216.58.197.4","TLSv1.2","155","Application Data"
"230","2018-08-07 18:01:02.831363","192.168.2.3","216.58.197.4","TCP","1434","49253  >  443 [ACK] Seq=117381 Ack=1517 Win=1522 Len=1368 TSval=570125 TSecr=373536697 [TCP segment of a reassembled PDU]"
"231","2018-08-07 18:01:02.831578","192.168.2.3","216.58.197.4","TCP","1434","49253  >  443 [ACK] Seq=118749 Ack=1517 Win=1522 Len=1368 TSval=570125 TSecr=373536697 [TCP segment of a reassembled PDU]"
"232","2018-08-07 18:01:02.831580","192.168.2.3","216.58.197.4","TLSv1.2","212","Application Data"
"233","2018-08-07 18:01:02.831581","192.168.2.3","216.58.197.4","TCP","1434","49253  >  443 [ACK] Seq=120263 Ack=1517 Win=1522 Len=1368 TSval=570125 TSecr=373536697 [TCP segment of a reassembled PDU]"
"234","2018-08-07 18:01:02.831744","192.168.2.3","216.58.197.4","TLSv1.2","155","Application Data"
"238","2018-08-07 18:01:02.936686","192.168.2.3","216.58.197.4","TCP","1434","49253  >  443 [ACK] Seq=121720 Ack=1517 Win=1522 Len=1368 TSval=570136 TSecr=373536799 [TCP segment of a reassembled PDU]"
"239","2018-08-07 18:01:02.937006","192.168.2.3","216.58.197.4","TCP","1434","49253  >  443 [ACK] Seq=123088 Ack=1517 Win=1522 Len=1368 TSval=570136 TSecr=373536799 [TCP segment of a reassembled PDU]"
"240","2018-08-07 18:01:02.937007","192.168.2.3","216.58.197.4","TLSv1.2","212","Application Data"
"241","2018-08-07 18:01:02.937281","192.168.2.3","216.58.197.4","TCP","1434","49253  >  443 [ACK] Seq=124602 Ack=1517 Win=1522 Len=1368 TSval=570136 TSecr=373536799 [TCP segment of a reassembled PDU]"
"242","2018-08-07 18:01:02.937283","192.168.2.3","216.58.197.4","TLSv1.2","155","Application Data"
"246","2018-08-07 18:01:03.025747","192.168.2.3","216.58.197.4","TCP","1434","49253  >  443 [ACK] Seq=126059 Ack=1517 Win=1522 Len=1368 TSval=570144 TSecr=373536905 [TCP segment of a reassembled PDU]"
"247","2018-08-07 18:01:03.025750","192.168.2.3","216.58.197.4","TCP","1434","49253  >  443 [ACK] Seq=127427 Ack=1517 Win=1522 Len=1368 TSval=570144 TSecr=373536905 [TCP segment of a reassembled PDU]"
"248","2018-08-07 18:01:03.025751","192.168.2.3","216.58.197.4","TLSv1.2","212","Application Data"
"249","2018-08-07 18:01:03.026136","192.168.2.3","216.58.197.4","TCP","1434","49253  >  443 [ACK] Seq=128941 Ack=1517 Win=1522 Len=1368 TSval=570144 TSecr=373536905 [TCP segment of a reassembled PDU]"
"250","2018-08-07 18:01:03.026139","192.168.2.3","216.58.197.4","TLSv1.2","155","Application Data"
"256","2018-08-07 18:01:03.091197","192.168.2.3","216.58.197.4","TCP","66","49253  >  443 [ACK] Seq=130398 Ack=1646 Win=1522 Len=0 TSval=570151 TSecr=373537049"
"257","2018-08-07 18:01:03.091200","192.168.2.3","216.58.197.4","TCP","66","49253  >  443 [ACK] Seq=130398 Ack=1705 Win=1522 Len=0 TSval=570151 TSecr=373537049"
"258","2018-08-07 18:01:03.121577","192.168.2.3","216.58.197.4","TCP","1434","49253  >  443 [ACK] Seq=130398 Ack=1705 Win=1522 Len=1368 TSval=570154 TSecr=373537049 [TCP segment of a reassembled PDU]"
"259","2018-08-07 18:01:03.122051","192.168.2.3","216.58.197.4","TCP","1434","49253  >  443 [ACK] Seq=131766 Ack=1705 Win=1522 Len=1368 TSval=570154 TSecr=373537049 [TCP segment of a reassembled PDU]"
"260","2018-08-07 18:01:03.122054","192.168.2.3","216.58.197.4","TLSv1.2","212","Application Data"
"261","2018-08-07 18:01:03.122054","192.168.2.3","216.58.197.4","TLSv1.2","1155","Application Data"
"264","2018-08-07 18:01:03.244222","192.168.2.3","216.58.197.4","TCP","1434","49253  >  443 [ACK] Seq=134369 Ack=1705 Win=1522 Len=1368 TSval=570166 TSecr=373537090 [TCP segment of a reassembled PDU]"
"265","2018-08-07 18:01:03.244546","192.168.2.3","216.58.197.4","TCP","1434","49253  >  443 [ACK] Seq=135737 Ack=1705 Win=1522 Len=1368 TSval=570166 TSecr=373537090 [TCP segment of a reassembled PDU]"
"266","2018-08-07 18:01:03.244547","192.168.2.3","216.58.197.4","TLSv1.2","212","Application Data"
"267","2018-08-07 18:01:03.244548","192.168.2.3","216.58.197.4","TCP","1434","49253  >  443 [ACK] Seq=137251 Ack=1705 Win=1522 Len=1368 TSval=570166 TSecr=373537090 [TCP segment of a reassembled PDU]"
"268","2018-08-07 18:01:03.244703","192.168.2.3","216.58.197.4","TLSv1.2","155","Application Data"
"273","2018-08-07 18:01:03.317212","192.168.2.3","216.58.197.4","TCP","66","49253  >  443 [ACK] Seq=138708 Ack=2056 Win=1522 Len=0 TSval=570174 TSecr=373537279"
"274","2018-08-07 18:01:03.342604","192.168.2.3","216.58.197.4","TCP","1434","49253  >  443 [ACK] Seq=138708 Ack=2056 Win=1522 Len=1368 TSval=570176 TSecr=373537279 [TCP segment of a reassembled PDU]"
"275","2018-08-07 18:01:03.342608","192.168.2.3","216.58.197.4","TCP","1434","49253  >  443 [ACK] Seq=140076 Ack=2056 Win=1522 Len=1368 TSval=570176 TSecr=373537279 [TCP segment of a reassembled PDU]"
"276","2018-08-07 18:01:03.342764","192.168.2.3","216.58.197.4","TLSv1.2","212","Application Data"
"277","2018-08-07 18:01:03.343004","192.168.2.3","216.58.197.4","TCP","1434","49253  >  443 [ACK] Seq=141590 Ack=2056 Win=1522 Len=1368 TSval=570176 TSecr=373537279 [TCP segment of a reassembled PDU]"
"278","2018-08-07 18:01:03.343007","192.168.2.3","216.58.197.4","TLSv1.2","155","Application Data"
"281","2018-08-07 18:01:03.438048","192.168.2.3","216.58.197.4","TCP","1434","49253  >  443 [ACK] Seq=143047 Ack=2056 Win=1522 Len=1368 TSval=570186 TSecr=373537310 [TCP segment of a reassembled PDU]"
"282","2018-08-07 18:01:03.438050","192.168.2.3","216.58.197.4","TCP","1434","49253  >  443 [ACK] Seq=144415 Ack=2056 Win=1522 Len=1368 TSval=570186 TSecr=373537310 [TCP segment of a reassembled PDU]"
"283","2018-08-07 18:01:03.438237","192.168.2.3","216.58.197.4","TLSv1.2","212","Application Data"
"284","2018-08-07 18:01:03.438401","192.168.2.3","216.58.197.4","TCP","1434","49253  >  443 [ACK] Seq=145929 Ack=2056 Win=1522 Len=1368 TSval=570186 TSecr=373537310 [TCP segment of a reassembled PDU]"
"285","2018-08-07 18:01:03.438402","192.168.2.3","216.58.197.4","TLSv1.2","155","Application Data"
"290","2018-08-07 18:01:03.495224","192.168.2.3","216.58.197.4","TCP","66","49253  >  443 [ACK] Seq=147386 Ack=2409 Win=1522 Len=0 TSval=570192 TSecr=373537457"
"291","2018-08-07 18:01:03.543396","192.168.2.3","216.58.197.4","TCP","1434","49253  >  443 [ACK] Seq=147386 Ack=2409 Win=1522 Len=1368 TSval=570197 TSecr=373537457 [TCP segment of a reassembled PDU]"
"292","2018-08-07 18:01:03.543737","192.168.2.3","216.58.197.4","TCP","1434","49253  >  443 [ACK] Seq=148754 Ack=2409 Win=1522 Len=1368 TSval=570197 TSecr=373537457 [TCP segment of a reassembled PDU]"
"293","2018-08-07 18:01:03.543739","192.168.2.3","216.58.197.4","TLSv1.2","212","Application Data"
"294","2018-08-07 18:01:03.544188","192.168.2.3","216.58.197.4","TLSv1.2","1360","Application Data"
"300","2018-08-07 18:01:03.596308","192.168.2.3","216.58.197.4","TCP","66","49253  >  443 [ACK] Seq=151562 Ack=2760 Win=1522 Len=0 TSval=570202 TSecr=373537556"
"303","2018-08-07 18:01:03.642919","192.168.2.3","216.58.197.4","TCP","66","49253  >  443 [ACK] Seq=151562 Ack=3205 Win=1522 Len=0 TSval=570206 TSecr=373537589"
"304","2018-08-07 18:01:03.659338","192.168.2.3","216.58.197.4","TCP","1434","49253  >  443 [ACK] Seq=151562 Ack=3205 Win=1522 Len=1368 TSval=570208 TSecr=373537589 [TCP segment of a reassembled PDU]"
"305","2018-08-07 18:01:03.659343","192.168.2.3","216.58.197.4","TCP","1434","49253  >  443 [ACK] Seq=152930 Ack=3205 Win=1522 Len=1368 TSval=570208 TSecr=373537589 [TCP segment of a reassembled PDU]"
"306","2018-08-07 18:01:03.659344","192.168.2.3","216.58.197.4","TLSv1.2","212","Application Data"
"307","2018-08-07 18:01:03.659881","192.168.2.3","216.58.197.4","TLSv1.2","1300","Application Data"
"310","2018-08-07 18:01:03.759251","192.168.2.3","216.58.197.4","TCP","1434","49253  >  443 [ACK] Seq=155678 Ack=3205 Win=1522 Len=1368 TSval=570218 TSecr=373537627 [TCP segment of a reassembled PDU]"
"311","2018-08-07 18:01:03.759701","192.168.2.3","216.58.197.4","TCP","1434","49253  >  443 [ACK] Seq=157046 Ack=3205 Win=1522 Len=1368 TSval=570218 TSecr=373537627 [TCP segment of a reassembled PDU]"
"312","2018-08-07 18:01:03.759703","192.168.2.3","216.58.197.4","TLSv1.2","212","Application Data"
"313","2018-08-07 18:01:03.759705","192.168.2.3","216.58.197.4","TLSv1.2","881","Application Data"
"317","2018-08-07 18:01:03.873707","192.168.2.3","216.58.197.4","TCP","66","49253  >  443 [ACK] Seq=159375 Ack=3363 Win=1522 Len=0 TSval=570230 TSecr=373537800"
"318","2018-08-07 18:01:03.879054","192.168.2.3","216.58.197.4","TCP","1434","49253  >  443 [ACK] Seq=159375 Ack=3363 Win=1522 Len=1368 TSval=570230 TSecr=373537800 [TCP segment of a reassembled PDU]"
"319","2018-08-07 18:01:03.881061","192.168.2.3","216.58.197.4","TCP","1434","49253  >  443 [ACK] Seq=160743 Ack=3363 Win=1522 Len=1368 TSval=570230 TSecr=373537800 [TCP segment of a reassembled PDU]"
"320","2018-08-07 18:01:03.881064","192.168.2.3","216.58.197.4","TLSv1.2","212","Application Data"
"321","2018-08-07 18:01:03.881065","192.168.2.3","216.58.197.4","TCP","1434","49253  >  443 [ACK] Seq=162257 Ack=3363 Win=1522 Len=1368 TSval=570230 TSecr=373537800 [TCP segment of a reassembled PDU]"
"322","2018-08-07 18:01:03.881066","192.168.2.3","216.58.197.4","TLSv1.2","155","Application Data"
"328","2018-08-07 18:01:03.939459","192.168.2.3","216.58.197.4","TCP","66","49253  >  443 [ACK] Seq=163714 Ack=3698 Win=1522 Len=0 TSval=570236 TSecr=373537898"
"329","2018-08-07 18:01:03.982066","192.168.2.3","216.58.197.4","TCP","1434","49253  >  443 [ACK] Seq=163714 Ack=3698 Win=1522 Len=1368 TSval=570240 TSecr=373537898 [TCP segment of a reassembled PDU]"
"330","2018-08-07 18:01:03.982393","192.168.2.3","216.58.197.4","TCP","1434","49253  >  443 [ACK] Seq=165082 Ack=3698 Win=1522 Len=1368 TSval=570240 TSecr=373537898 [TCP segment of a reassembled PDU]"
"331","2018-08-07 18:01:03.982395","192.168.2.3","216.58.197.4","TLSv1.2","212","Application Data"
"332","2018-08-07 18:01:03.982582","192.168.2.3","216.58.197.4","TCP","1434","49253  >  443 [ACK] Seq=166596 Ack=3698 Win=1522 Len=1368 TSval=570240 TSecr=373537898 [TCP segment of a reassembled PDU]"
"333","2018-08-07 18:01:03.982583","192.168.2.3","216.58.197.4","TLSv1.2","155","Application Data"
"337","2018-08-07 18:01:04.106581","192.168.2.3","216.58.197.4","TCP","1434","49253  >  443 [ACK] Seq=168053 Ack=3698 Win=1522 Len=1368 TSval=570253 TSecr=373537950 [TCP segment of a reassembled PDU]"
"338","2018-08-07 18:01:04.106868","192.168.2.3","216.58.197.4","TCP","1434","49253  >  443 [ACK] Seq=169421 Ack=3698 Win=1522 Len=1368 TSval=570253 TSecr=373537950 [TCP segment of a reassembled PDU]"
"339","2018-08-07 18:01:04.106870","192.168.2.3","216.58.197.4","TLSv1.2","212","Application Data"
"340","2018-08-07 18:01:04.107091","192.168.2.3","216.58.197.4","TLSv1.2","1397","Application Data"
"346","2018-08-07 18:01:04.166833","192.168.2.3","216.58.197.4","TCP","66","49253  >  443 [ACK] Seq=172266 Ack=3812 Win=1522 Len=0 TSval=570259 TSecr=373538129"
"347","2018-08-07 18:01:04.167194","192.168.2.3","216.58.197.4","TCP","66","49253  >  443 [ACK] Seq=172266 Ack=4006 Win=1522 Len=0 TSval=570259 TSecr=373538129"
"348","2018-08-07 18:01:04.206659","192.168.2.3","216.58.197.4","TCP","1434","49253  >  443 [ACK] Seq=172266 Ack=4006 Win=1522 Len=1368 TSval=570263 TSecr=373538129 [TCP segment of a reassembled PDU]"
"349","2018-08-07 18:01:04.206663","192.168.2.3","216.58.197.4","TCP","1434","49253  >  443 [ACK] Seq=173634 Ack=4006 Win=1522 Len=1368 TSval=570263 TSecr=373538129 [TCP segment of a reassembled PDU]"
"350","2018-08-07 18:01:04.206664","192.168.2.3","216.58.197.4","TLSv1.2","212","Application Data"
"351","2018-08-07 18:01:04.206754","192.168.2.3","216.58.197.4","TLSv1.2","1205","Application Data"
"354","2018-08-07 18:01:04.327528","192.168.2.3","216.58.197.4","TCP","1434","49253  >  443 [ACK] Seq=176287 Ack=4006 Win=1522 Len=1368 TSval=570275 TSecr=373538175 [TCP segment of a reassembled PDU]"
"355","2018-08-07 18:01:04.328020","192.168.2.3","216.58.197.4","TCP","1434","49253  >  443 [ACK] Seq=177655 Ack=4006 Win=1522 Len=1368 TSval=570275 TSecr=373538175 [TCP segment of a reassembled PDU]"
"356","2018-08-07 18:01:04.328022","192.168.2.3","216.58.197.4","TLSv1.2","212","Application Data"
"357","2018-08-07 18:01:04.328023","192.168.2.3","216.58.197.4","TLSv1.2","1189","Application Data"
"363","2018-08-07 18:01:04.386366","192.168.2.3","216.58.197.4","TCP","66","49253  >  443 [ACK] Seq=180292 Ack=4402 Win=1522 Len=0 TSval=570281 TSecr=373538346"
"366","2018-08-07 18:01:04.404200","192.168.2.3","216.58.197.4","TCP","66","49253  >  443 [ACK] Seq=180292 Ack=4852 Win=1522 Len=0 TSval=570283 TSecr=373538366"
"367","2018-08-07 18:01:04.405120","192.168.2.3","216.58.197.4","TCP","66","49253  >  443 [ACK] Seq=180292 Ack=4951 Win=1522 Len=0 TSval=570283 TSecr=373538367"
"368","2018-08-07 18:01:04.429380","192.168.2.3","216.58.197.4","TCP","1434","49253  >  443 [ACK] Seq=180292 Ack=4951 Win=1522 Len=1368 TSval=570285 TSecr=373538367 [TCP segment of a reassembled PDU]"
"369","2018-08-07 18:01:04.429832","192.168.2.3","216.58.197.4","TCP","1434","49253  >  443 [ACK] Seq=181660 Ack=4951 Win=1522 Len=1368 TSval=570285 TSecr=373538367 [TCP segment of a reassembled PDU]"
"370","2018-08-07 18:01:04.429835","192.168.2.3","216.58.197.4","TLSv1.2","212","Application Data"
"371","2018-08-07 18:01:04.430124","192.168.2.3","216.58.197.4","TCP","1434","49253  >  443 [ACK] Seq=183174 Ack=4951 Win=1522 Len=1368 TSval=570285 TSecr=373538367 [TCP segment of a reassembled PDU]"
"372","2018-08-07 18:01:04.430126","192.168.2.3","216.58.197.4","TLSv1.2","155","Application Data"
"376","2018-08-07 18:01:04.459377","192.168.2.3","216.58.197.4","TLSv1.2","1217","Application Data"
"377","2018-08-07 18:01:04.459386","192.168.2.3","216.58.197.4","TLSv1.2","102","Application Data"
"381","2018-08-07 18:01:04.628160","192.168.2.3","216.58.197.4","TCP","66","49253  >  443 [ACK] Seq=185818 Ack=5147 Win=1522 Len=0 TSval=570305 TSecr=373538588"
"384","2018-08-07 18:01:04.666766","192.168.2.3","216.58.197.4","TCP","66","49253  >  443 [ACK] Seq=185818 Ack=6731 Win=1522 Len=0 TSval=570309 TSecr=373538606"
"397","2018-08-07 18:01:04.772938","192.168.2.3","216.58.197.4","TCP","66","49253  >  443 [ACK] Seq=185818 Ack=8676 Win=1522 Len=0 TSval=570319 TSecr=373538733"
"398","2018-08-07 18:01:04.773314","192.168.2.3","216.58.197.4","TCP","66","49253  >  443 [ACK] Seq=185818 Ack=10571 Win=1522 Len=0 TSval=570320 TSecr=373538733"
"399","2018-08-07 18:01:04.776978","192.168.2.3","216.58.197.4","TCP","66","49253  >  443 [ACK] Seq=185818 Ack=12254 Win=1522 Len=0 TSval=570320 TSecr=373538733"
"400","2018-08-07 18:01:04.776981","192.168.2.3","216.58.197.4","TCP","66","49253  >  443 [ACK] Seq=185818 Ack=14006 Win=1522 Len=0 TSval=570320 TSecr=373538734"
"401","2018-08-07 18:01:04.776981","192.168.2.3","216.58.197.4","TCP","66","49253  >  443 [ACK] Seq=185818 Ack=15831 Win=1522 Len=0 TSval=570320 TSecr=373538734"
"402","2018-08-07 18:01:04.776982","192.168.2.3","216.58.197.4","TCP","66","49253  >  443 [ACK] Seq=185818 Ack=17554 Win=1522 Len=0 TSval=570320 TSecr=373538734"
"405","2018-08-07 18:01:04.806177","192.168.2.3","216.58.197.4","TCP","66","49253  >  443 [ACK] Seq=185818 Ack=19290 Win=1522 Len=0 TSval=570323 TSecr=373538767"
"413","2018-08-07 18:01:04.812937","192.168.2.3","216.58.197.4","TCP","66","49253  >  443 [ACK] Seq=185818 Ack=21163 Win=1522 Len=0 TSval=570323 TSecr=373538771"
"414","2018-08-07 18:01:04.815063","192.168.2.3","216.58.197.4","TCP","66","49253  >  443 [ACK] Seq=185818 Ack=25096 Win=1522 Len=0 TSval=570324 TSecr=373538771"
"421","2018-08-07 18:01:04.845859","192.168.2.3","216.58.197.4","TCP","66","49253  >  443 [ACK] Seq=185818 Ack=25282 Win=1522 Len=0 TSval=570327 TSecr=373538805"
"422","2018-08-07 18:01:04.846924","192.168.2.3","216.58.197.4","TCP","66","49253  >  443 [ACK] Seq=185818 Ack=25691 Win=1522 Len=0 TSval=570327 TSecr=373538806"
"423","2018-08-07 18:01:04.856369","192.168.2.3","216.58.197.4","TLSv1.2","104","Application Data"
"425","2018-08-07 18:01:05.573071","192.168.2.3","172.217.27.174","TCP","66","52315  >  443 [ACK] Seq=1 Ack=1 Win=296 Len=0 TSval=570400 TSecr=260121304"
"427","2018-08-07 18:01:08.982737","192.168.2.3","172.217.27.174","TLSv1.2","161","Application Data"
"428","2018-08-07 18:01:08.982953","192.168.2.3","172.217.27.174","TLSv1.2","104","Application Data"
"429","2018-08-07 18:01:08.982955","192.168.2.3","172.217.27.174","TLSv1.2","504","Application Data"
"434","2018-08-07 18:01:09.023138","192.168.2.3","172.217.27.174","TCP","66","52258  >  443 [ACK] Seq=572 Ack=39 Win=661 Len=0 TSval=570745 TSecr=2575987558"
"439","2018-08-07 18:01:09.604105","192.168.2.3","172.217.27.174","TCP","66","52258  >  443 [ACK] Seq=572 Ack=107 Win=661 Len=0 TSval=570803 TSecr=2575988171"
"440","2018-08-07 18:01:09.604108","192.168.2.3","172.217.27.174","TCP","66","52258  >  443 [ACK] Seq=572 Ack=208 Win=661 Len=0 TSval=570803 TSecr=2575988171"
"441","2018-08-07 18:01:09.604343","192.168.2.3","172.217.27.174","TCP","66","52258  >  443 [ACK] Seq=572 Ack=354 Win=661 Len=0 TSval=570803 TSecr=2575988171"
"442","2018-08-07 18:01:09.604596","192.168.2.3","172.217.27.174","TCP","66","52258  >  443 [ACK] Seq=572 Ack=392 Win=661 Len=0 TSval=570803 TSecr=2575988172"
"443","2018-08-07 18:01:09.605130","192.168.2.3","172.217.27.174","TLSv1.2","104","Application Data"
