"No.","Time","Source","Destination","Protocol","Length","Info"
"7","2018-08-07 18:05:24.856217","192.168.2.3","216.58.197.4","TLSv1.2","156","[TCP Previous segment not captured] , Application Data"
"8","2018-08-07 18:05:24.856221","192.168.2.3","216.58.197.4","TLSv1.2","104","Application Data"
"12","2018-08-07 18:05:24.863715","192.168.2.3","216.58.197.4","TLSv1.2","158","Application Data"
"13","2018-08-07 18:05:24.865460","192.168.2.3","216.58.197.4","TCP","1434","49253  >  443 [ACK] Seq=222 Ack=39 Win=1522 Len=1368 TSval=596328 TSecr=373798825 [TCP segment of a reassembled PDU]"
"14","2018-08-07 18:05:24.865463","192.168.2.3","216.58.197.4","TCP","1434","49253  >  443 [ACK] Seq=1590 Ack=39 Win=1522 Len=1368 TSval=596328 TSecr=373798825 [TCP segment of a reassembled PDU]"
"15","2018-08-07 18:05:24.865648","192.168.2.3","216.58.197.4","TLSv1.2","212","Application Data"
"16","2018-08-07 18:05:24.866111","192.168.2.3","216.58.197.4","TCP","1434","49253  >  443 [ACK] Seq=3104 Ack=39 Win=1522 Len=1368 TSval=596328 TSecr=373798825 [TCP segment of a reassembled PDU]"
"17","2018-08-07 18:05:24.866113","192.168.2.3","216.58.197.4","TLSv1.2","287","Application Data"
"18","2018-08-07 18:05:24.866370","192.168.2.3","216.58.197.4","TCP","1434","49253  >  443 [ACK] Seq=4693 Ack=39 Win=1522 Len=1368 TSval=596328 TSecr=373798825 [TCP segment of a reassembled PDU]"
"19","2018-08-07 18:05:24.866371","192.168.2.3","216.58.197.4","TCP","1434","49253  >  443 [ACK] Seq=6061 Ack=39 Win=1522 Len=1368 TSval=596328 TSecr=373798825 [TCP segment of a reassembled PDU]"
"20","2018-08-07 18:05:24.866497","192.168.2.3","216.58.197.4","TLSv1.2","212","Application Data"
"21","2018-08-07 18:05:24.866849","192.168.2.3","216.58.197.4","TCP","1434","49253  >  443 [ACK] Seq=7575 Ack=39 Win=1522 Len=1368 TSval=596328 TSecr=373798825 [TCP segment of a reassembled PDU]"
"26","2018-08-07 18:05:24.871626","192.168.2.3","216.58.197.4","TLSv1.2","1434","Application Data [TCP segment of a reassembled PDU]"
"27","2018-08-07 18:05:24.872131","192.168.2.3","216.58.197.4","TCP","1434","49253  >  443 [ACK] Seq=10311 Ack=39 Win=1522 Len=1368 TSval=596329 TSecr=373798834 [TCP segment of a reassembled PDU]"
"28","2018-08-07 18:05:24.872134","192.168.2.3","216.58.197.4","TLSv1.2","1434","Application Data [TCP segment of a reassembled PDU]"
"29","2018-08-07 18:05:24.872378","192.168.2.3","216.58.197.4","TLSv1.2","1434","Application Data [TCP segment of a reassembled PDU]"
"30","2018-08-07 18:05:24.872416","192.168.2.3","216.58.197.4","TCP","1434","49253  >  443 [ACK] Seq=14415 Ack=39 Win=1522 Len=1368 TSval=596329 TSecr=373798834 [TCP segment of a reassembled PDU]"
"31","2018-08-07 18:05:24.872779","192.168.2.3","216.58.197.4","TLSv1.2","1434","Application Data [TCP segment of a reassembled PDU]"
"32","2018-08-07 18:05:24.874800","192.168.2.3","216.58.197.4","TLSv1.2","1434","Application Data [TCP segment of a reassembled PDU]"
"33","2018-08-07 18:05:24.874802","192.168.2.3","216.58.197.4","TCP","1434","49253  >  443 [ACK] Seq=18519 Ack=39 Win=1522 Len=1368 TSval=596329 TSecr=373798835 [TCP segment of a reassembled PDU]"
"34","2018-08-07 18:05:24.875128","192.168.2.3","216.58.197.4","TLSv1.2","1434","Application Data [TCP segment of a reassembled PDU]"
"35","2018-08-07 18:05:24.875186","192.168.2.3","216.58.197.4","TLSv1.2","1434","Application Data [TCP segment of a reassembled PDU]"
"36","2018-08-07 18:05:24.875310","192.168.2.3","216.58.197.4","TCP","1434","49253  >  443 [ACK] Seq=22623 Ack=39 Win=1522 Len=1368 TSval=596329 TSecr=373798835 [TCP segment of a reassembled PDU]"
"37","2018-08-07 18:05:24.875622","192.168.2.3","216.58.197.4","TLSv1.2","1434","Application Data [TCP segment of a reassembled PDU]"
"38","2018-08-07 18:05:24.875624","192.168.2.3","216.58.197.4","TLSv1.2","1434","Application Data [TCP segment of a reassembled PDU]"
"39","2018-08-07 18:05:24.875945","192.168.2.3","216.58.197.4","TCP","1434","49253  >  443 [ACK] Seq=26727 Ack=39 Win=1522 Len=1368 TSval=596329 TSecr=373798835 [TCP segment of a reassembled PDU]"
"43","2018-08-07 18:05:24.878052","192.168.2.3","216.58.197.4","TLSv1.2","1434","Application Data [TCP segment of a reassembled PDU]"
"44","2018-08-07 18:05:24.878054","192.168.2.3","216.58.197.4","TLSv1.2","1434","Application Data [TCP segment of a reassembled PDU]"
"45","2018-08-07 18:05:24.878297","192.168.2.3","216.58.197.4","TCP","1434","49253  >  443 [ACK] Seq=30831 Ack=39 Win=1522 Len=1368 TSval=596330 TSecr=373798840 [TCP segment of a reassembled PDU]"
"49","2018-08-07 18:05:24.879919","192.168.2.3","216.58.197.4","TCP","1434","49253  >  443 [ACK] Seq=32199 Ack=39 Win=1522 Len=1368 TSval=596330 TSecr=373798841 [TCP segment of a reassembled PDU]"
"50","2018-08-07 18:05:24.880083","192.168.2.3","216.58.197.4","TLSv1.2","1434","Application Data [TCP segment of a reassembled PDU]"
"52","2018-08-07 18:05:24.880458","192.168.2.3","216.58.197.4","TLSv1.2","1434","Application Data [TCP segment of a reassembled PDU]"
"53","2018-08-07 18:05:24.880460","192.168.2.3","216.58.197.4","TCP","1434","49253  >  443 [ACK] Seq=36303 Ack=39 Win=1522 Len=1368 TSval=596330 TSecr=373798841 [TCP segment of a reassembled PDU]"
"54","2018-08-07 18:05:24.880623","192.168.2.3","216.58.197.4","TLSv1.2","1434","Application Data [TCP segment of a reassembled PDU]"
"55","2018-08-07 18:05:24.882429","192.168.2.3","216.58.197.4","TLSv1.2","1434","Application Data [TCP segment of a reassembled PDU]"
"57","2018-08-07 18:05:24.882677","192.168.2.3","216.58.197.4","TCP","1434","49253  >  443 [ACK] Seq=40407 Ack=39 Win=1522 Len=1368 TSval=596330 TSecr=373798843 [TCP segment of a reassembled PDU]"
"58","2018-08-07 18:05:24.882843","192.168.2.3","216.58.197.4","TLSv1.2","1434","Application Data [TCP segment of a reassembled PDU]"
"59","2018-08-07 18:05:24.882845","192.168.2.3","216.58.197.4","TLSv1.2","1434","Application Data [TCP segment of a reassembled PDU]"
"60","2018-08-07 18:05:24.883312","192.168.2.3","216.58.197.4","TCP","1434","49253  >  443 [ACK] Seq=44511 Ack=39 Win=1522 Len=1368 TSval=596330 TSecr=373798843 [TCP segment of a reassembled PDU]"
"61","2018-08-07 18:05:24.883828","192.168.2.3","216.58.197.4","TLSv1.2","1434","Application Data [TCP segment of a reassembled PDU]"
"62","2018-08-07 18:05:24.884045","192.168.2.3","216.58.197.4","TLSv1.2","1434","Application Data [TCP segment of a reassembled PDU]"
"63","2018-08-07 18:05:24.884048","192.168.2.3","216.58.197.4","TCP","1434","49253  >  443 [ACK] Seq=48615 Ack=39 Win=1522 Len=1368 TSval=596330 TSecr=373798844 [TCP segment of a reassembled PDU]"
"64","2018-08-07 18:05:24.884204","192.168.2.3","216.58.197.4","TLSv1.2","1434","Application Data [TCP segment of a reassembled PDU]"
"66","2018-08-07 18:05:24.884628","192.168.2.3","216.58.197.4","TLSv1.2","1434","Application Data [TCP segment of a reassembled PDU]"
"69","2018-08-07 18:05:24.887188","192.168.2.3","216.58.197.4","TCP","1434","49253  >  443 [ACK] Seq=52719 Ack=39 Win=1522 Len=1368 TSval=596330 TSecr=373798846 [TCP segment of a reassembled PDU]"
"70","2018-08-07 18:05:24.887190","192.168.2.3","216.58.197.4","TLSv1.2","1434","Application Data [TCP segment of a reassembled PDU]"
"71","2018-08-07 18:05:24.887190","192.168.2.3","216.58.197.4","TLSv1.2","876","Application Data"
"78","2018-08-07 18:05:25.002047","192.168.2.3","216.58.197.4","TCP","1434","49253  >  443 [ACK] Seq=56265 Ack=39 Win=1522 Len=1368 TSval=596342 TSecr=373798896 [TCP segment of a reassembled PDU]"
"79","2018-08-07 18:05:25.002493","192.168.2.3","216.58.197.4","TCP","1434","49253  >  443 [ACK] Seq=57633 Ack=39 Win=1522 Len=1368 TSval=596342 TSecr=373798896 [TCP segment of a reassembled PDU]"
"80","2018-08-07 18:05:25.002495","192.168.2.3","216.58.197.4","TLSv1.2","212","Application Data"
"81","2018-08-07 18:05:25.002637","192.168.2.3","216.58.197.4","TCP","1434","49253  >  443 [ACK] Seq=59147 Ack=39 Win=1522 Len=1368 TSval=596342 TSecr=373798896 [TCP segment of a reassembled PDU]"
"82","2018-08-07 18:05:25.002651","192.168.2.3","216.58.197.4","TLSv1.2","155","Application Data"
"86","2018-08-07 18:05:25.105465","192.168.2.3","216.58.197.4","TCP","1434","49253  >  443 [ACK] Seq=60604 Ack=39 Win=1522 Len=1368 TSval=596352 TSecr=373798971 [TCP segment of a reassembled PDU]"
"87","2018-08-07 18:05:25.105470","192.168.2.3","216.58.197.4","TCP","1434","49253  >  443 [ACK] Seq=61972 Ack=39 Win=1522 Len=1368 TSval=596352 TSecr=373798971 [TCP segment of a reassembled PDU]"
"88","2018-08-07 18:05:25.105584","192.168.2.3","216.58.197.4","TLSv1.2","212","Application Data"
"89","2018-08-07 18:05:25.105833","192.168.2.3","216.58.197.4","TCP","1434","49253  >  443 [ACK] Seq=63486 Ack=39 Win=1522 Len=1368 TSval=596352 TSecr=373798971 [TCP segment of a reassembled PDU]"
"90","2018-08-07 18:05:25.105835","192.168.2.3","216.58.197.4","TLSv1.2","71","Application Data"
"94","2018-08-07 18:05:25.210748","192.168.2.3","216.58.197.4","TCP","1434","49253  >  443 [ACK] Seq=64859 Ack=39 Win=1522 Len=1368 TSval=596363 TSecr=373799074 [TCP segment of a reassembled PDU]"
"95","2018-08-07 18:05:25.211126","192.168.2.3","216.58.197.4","TCP","1434","49253  >  443 [ACK] Seq=66227 Ack=39 Win=1522 Len=1368 TSval=596363 TSecr=373799074 [TCP segment of a reassembled PDU]"
"96","2018-08-07 18:05:25.211129","192.168.2.3","216.58.197.4","TLSv1.2","212","Application Data"
"97","2018-08-07 18:05:25.211129","192.168.2.3","216.58.197.4","TLSv1.2","716","Application Data"
"100","2018-08-07 18:05:25.324815","192.168.2.3","216.58.197.4","TCP","1434","49253  >  443 [ACK] Seq=68391 Ack=39 Win=1522 Len=1368 TSval=596374 TSecr=373799179 [TCP segment of a reassembled PDU]"
"101","2018-08-07 18:05:25.328648","192.168.2.3","216.58.197.4","TCP","1434","49253  >  443 [ACK] Seq=69759 Ack=39 Win=1522 Len=1368 TSval=596374 TSecr=373799179 [TCP segment of a reassembled PDU]"
"102","2018-08-07 18:05:25.328651","192.168.2.3","216.58.197.4","TLSv1.2","212","Application Data"
"103","2018-08-07 18:05:25.328957","192.168.2.3","216.58.197.4","TLSv1.2","705","Application Data"
"110","2018-08-07 18:05:25.355128","192.168.2.3","216.58.197.4","TCP","66","49253  >  443 [ACK] Seq=71912 Ack=210 Win=1522 Len=0 TSval=596377 TSecr=373799316"
"112","2018-08-07 18:05:25.377537","192.168.2.3","216.58.197.4","TCP","66","49253  >  443 [ACK] Seq=71912 Ack=643 Win=1522 Len=0 TSval=596379 TSecr=373799317"
"113","2018-08-07 18:05:25.424477","192.168.2.3","216.58.197.4","TCP","1434","49253  >  443 [ACK] Seq=71912 Ack=643 Win=1522 Len=1368 TSval=596384 TSecr=373799317 [TCP segment of a reassembled PDU]"
"114","2018-08-07 18:05:25.425037","192.168.2.3","216.58.197.4","TCP","1434","49253  >  443 [ACK] Seq=73280 Ack=643 Win=1522 Len=1368 TSval=596384 TSecr=373799317 [TCP segment of a reassembled PDU]"
"115","2018-08-07 18:05:25.425040","192.168.2.3","216.58.197.4","TLSv1.2","212","Application Data"
"116","2018-08-07 18:05:25.425041","192.168.2.3","216.58.197.4","TLSv1.2","1080","Application Data"
"119","2018-08-07 18:05:25.527445","192.168.2.3","216.58.197.4","TCP","1434","49253  >  443 [ACK] Seq=75808 Ack=643 Win=1522 Len=1368 TSval=596395 TSecr=373799393 [TCP segment of a reassembled PDU]"
"120","2018-08-07 18:05:25.527716","192.168.2.3","216.58.197.4","TCP","1434","49253  >  443 [ACK] Seq=77176 Ack=643 Win=1522 Len=1368 TSval=596395 TSecr=373799393 [TCP segment of a reassembled PDU]"
"121","2018-08-07 18:05:25.527717","192.168.2.3","216.58.197.4","TLSv1.2","212","Application Data"
"122","2018-08-07 18:05:25.527863","192.168.2.3","216.58.197.4","TLSv1.2","1201","Application Data"
"126","2018-08-07 18:05:25.579657","192.168.2.3","216.58.197.4","TCP","66","49253  >  443 [ACK] Seq=79825 Ack=921 Win=1522 Len=0 TSval=596400 TSecr=373799500"
"127","2018-08-07 18:05:25.641500","192.168.2.3","216.58.197.4","TCP","1434","49253  >  443 [ACK] Seq=79825 Ack=921 Win=1522 Len=1368 TSval=596406 TSecr=373799500 [TCP segment of a reassembled PDU]"
"128","2018-08-07 18:05:25.641946","192.168.2.3","216.58.197.4","TCP","1434","49253  >  443 [ACK] Seq=81193 Ack=921 Win=1522 Len=1368 TSval=596406 TSecr=373799500 [TCP segment of a reassembled PDU]"
"129","2018-08-07 18:05:25.641948","192.168.2.3","216.58.197.4","TLSv1.2","212","Application Data"
"130","2018-08-07 18:05:25.641949","192.168.2.3","216.58.197.4","TLSv1.2","744","Application Data"
"134","2018-08-07 18:05:25.682331","192.168.2.3","216.58.197.4","TCP","66","49253  >  443 [ACK] Seq=83385 Ack=1123 Win=1522 Len=0 TSval=596410 TSecr=373799642"
"135","2018-08-07 18:05:25.745064","192.168.2.3","216.58.197.4","TCP","1434","49253  >  443 [ACK] Seq=83385 Ack=1123 Win=1522 Len=1368 TSval=596416 TSecr=373799642 [TCP segment of a reassembled PDU]"
"136","2018-08-07 18:05:25.745068","192.168.2.3","216.58.197.4","TCP","1434","49253  >  443 [ACK] Seq=84753 Ack=1123 Win=1522 Len=1368 TSval=596416 TSecr=373799642 [TCP segment of a reassembled PDU]"
"137","2018-08-07 18:05:25.745069","192.168.2.3","216.58.197.4","TLSv1.2","212","Application Data"
"138","2018-08-07 18:05:25.745347","192.168.2.3","216.58.197.4","TCP","1434","49253  >  443 [ACK] Seq=86267 Ack=1123 Win=1522 Len=1368 TSval=596416 TSecr=373799642 [TCP segment of a reassembled PDU]"
"139","2018-08-07 18:05:25.745349","192.168.2.3","216.58.197.4","TLSv1.2","155","Application Data"
"143","2018-08-07 18:05:25.848004","192.168.2.3","216.58.197.4","TCP","1434","49253  >  443 [ACK] Seq=87724 Ack=1123 Win=1522 Len=1368 TSval=596426 TSecr=373799754 [TCP segment of a reassembled PDU]"
"144","2018-08-07 18:05:25.848018","192.168.2.3","216.58.197.4","TCP","1434","49253  >  443 [ACK] Seq=89092 Ack=1123 Win=1522 Len=1368 TSval=596426 TSecr=373799754 [TCP segment of a reassembled PDU]"
"145","2018-08-07 18:05:25.848020","192.168.2.3","216.58.197.4","TLSv1.2","212","Application Data"
"146","2018-08-07 18:05:25.848278","192.168.2.3","216.58.197.4","TCP","1434","49253  >  443 [ACK] Seq=90606 Ack=1123 Win=1522 Len=1368 TSval=596426 TSecr=373799754 [TCP segment of a reassembled PDU]"
"147","2018-08-07 18:05:25.848283","192.168.2.3","216.58.197.4","TLSv1.2","155","Application Data"
"151","2018-08-07 18:05:25.962273","192.168.2.3","216.58.197.4","TCP","1434","49253  >  443 [ACK] Seq=92063 Ack=1123 Win=1522 Len=1368 TSval=596438 TSecr=373799817 [TCP segment of a reassembled PDU]"
"152","2018-08-07 18:05:25.962674","192.168.2.3","216.58.197.4","TCP","1434","49253  >  443 [ACK] Seq=93431 Ack=1123 Win=1522 Len=1368 TSval=596438 TSecr=373799817 [TCP segment of a reassembled PDU]"
"153","2018-08-07 18:05:25.962675","192.168.2.3","216.58.197.4","TLSv1.2","212","Application Data"
"154","2018-08-07 18:05:25.962676","192.168.2.3","216.58.197.4","TCP","1434","49253  >  443 [ACK] Seq=94945 Ack=1123 Win=1522 Len=1368 TSval=596438 TSecr=373799817 [TCP segment of a reassembled PDU]"
"155","2018-08-07 18:05:25.962803","192.168.2.3","216.58.197.4","TLSv1.2","155","Application Data"
"159","2018-08-07 18:05:26.138369","192.168.2.3","216.58.197.4","TCP","1434","49253  >  443 [ACK] Seq=96402 Ack=1123 Win=1522 Len=1368 TSval=596448 TSecr=373799931 [TCP segment of a reassembled PDU]"
"160","2018-08-07 18:05:26.138666","192.168.2.3","216.58.197.4","TCP","1434","49253  >  443 [ACK] Seq=97770 Ack=1123 Win=1522 Len=1368 TSval=596448 TSecr=373799931 [TCP segment of a reassembled PDU]"
"161","2018-08-07 18:05:26.138668","192.168.2.3","216.58.197.4","TLSv1.2","212","Application Data"
"162","2018-08-07 18:05:26.138912","192.168.2.3","216.58.197.4","TCP","1434","49253  >  443 [ACK] Seq=99284 Ack=1123 Win=1522 Len=1368 TSval=596448 TSecr=373799931 [TCP segment of a reassembled PDU]"
"163","2018-08-07 18:05:26.138914","192.168.2.3","216.58.197.4","TLSv1.2","155","Application Data"
"167","2018-08-07 18:05:26.164711","192.168.2.3","216.58.197.4","TCP","1434","49253  >  443 [ACK] Seq=100741 Ack=1123 Win=1522 Len=1368 TSval=596457 TSecr=373800107 [TCP segment of a reassembled PDU]"
"168","2018-08-07 18:05:26.164925","192.168.2.3","216.58.197.4","TCP","1434","49253  >  443 [ACK] Seq=102109 Ack=1123 Win=1522 Len=1368 TSval=596457 TSecr=373800107 [TCP segment of a reassembled PDU]"
"169","2018-08-07 18:05:26.164929","192.168.2.3","216.58.197.4","TLSv1.2","212","Application Data"
"170","2018-08-07 18:05:26.164930","192.168.2.3","216.58.197.4","TCP","1434","49253  >  443 [ACK] Seq=103623 Ack=1123 Win=1522 Len=1368 TSval=596457 TSecr=373800107 [TCP segment of a reassembled PDU]"
"171","2018-08-07 18:05:26.165076","192.168.2.3","216.58.197.4","TLSv1.2","155","Application Data"
"177","2018-08-07 18:05:26.240645","192.168.2.3","216.58.197.4","TCP","66","49253  >  443 [ACK] Seq=105080 Ack=1402 Win=1522 Len=0 TSval=596466 TSecr=373800201"
"178","2018-08-07 18:05:26.240650","192.168.2.3","216.58.197.4","TCP","66","49253  >  443 [ACK] Seq=105080 Ack=1495 Win=1522 Len=0 TSval=596466 TSecr=373800201"
"179","2018-08-07 18:05:26.250589","192.168.2.3","216.58.197.4","TCP","1434","49253  >  443 [ACK] Seq=105080 Ack=1495 Win=1522 Len=1368 TSval=596467 TSecr=373800201 [TCP segment of a reassembled PDU]"
"180","2018-08-07 18:05:26.251621","192.168.2.3","216.58.197.4","TCP","1434","49253  >  443 [ACK] Seq=106448 Ack=1495 Win=1522 Len=1368 TSval=596467 TSecr=373800201 [TCP segment of a reassembled PDU]"
"181","2018-08-07 18:05:26.251624","192.168.2.3","216.58.197.4","TLSv1.2","212","Application Data"
"182","2018-08-07 18:05:26.251876","192.168.2.3","216.58.197.4","TCP","1434","49253  >  443 [ACK] Seq=107962 Ack=1495 Win=1522 Len=1368 TSval=596467 TSecr=373800201 [TCP segment of a reassembled PDU]"
"183","2018-08-07 18:05:26.254738","192.168.2.3","216.58.197.4","TLSv1.2","155","Application Data"
"189","2018-08-07 18:05:26.327875","192.168.2.3","216.58.197.4","TCP","66","49253  >  443 [ACK] Seq=109419 Ack=1771 Win=1522 Len=0 TSval=596475 TSecr=373800287"
"190","2018-08-07 18:05:26.351891","192.168.2.3","216.58.197.4","TCP","1434","49253  >  443 [ACK] Seq=109419 Ack=1771 Win=1522 Len=1368 TSval=596477 TSecr=373800287 [TCP segment of a reassembled PDU]"
"191","2018-08-07 18:05:26.351904","192.168.2.3","216.58.197.4","TCP","1434","49253  >  443 [ACK] Seq=110787 Ack=1771 Win=1522 Len=1368 TSval=596477 TSecr=373800287 [TCP segment of a reassembled PDU]"
"192","2018-08-07 18:05:26.351906","192.168.2.3","216.58.197.4","TLSv1.2","212","Application Data"
"193","2018-08-07 18:05:26.352156","192.168.2.3","216.58.197.4","TCP","1434","49253  >  443 [ACK] Seq=112301 Ack=1771 Win=1522 Len=1368 TSval=596477 TSecr=373800287 [TCP segment of a reassembled PDU]"
"194","2018-08-07 18:05:26.352162","192.168.2.3","216.58.197.4","TLSv1.2","155","Application Data"
"196","2018-08-07 18:05:26.356265","192.168.2.3","172.217.27.174","TCP","66","52258  >  443 [ACK] Seq=1 Ack=1 Win=661 Len=0 TSval=596478 TSecr=2576199906"
"200","2018-08-07 18:05:26.371074","192.168.2.3","216.58.197.4","TCP","66","49253  >  443 [ACK] Seq=113758 Ack=2291 Win=1522 Len=0 TSval=596479 TSecr=373800317"
"203","2018-08-07 18:05:26.415591","192.168.2.3","216.58.197.4","TCP","66","49253  >  443 [ACK] Seq=113758 Ack=2767 Win=1522 Len=0 TSval=596483 TSecr=373800377"
"204","2018-08-07 18:05:26.448670","192.168.2.3","216.58.197.4","TCP","1434","49253  >  443 [ACK] Seq=113758 Ack=2767 Win=1522 Len=1368 TSval=596487 TSecr=373800377 [TCP segment of a reassembled PDU]"
"205","2018-08-07 18:05:26.449105","192.168.2.3","216.58.197.4","TCP","1434","49253  >  443 [ACK] Seq=115126 Ack=2767 Win=1522 Len=1368 TSval=596487 TSecr=373800377 [TCP segment of a reassembled PDU]"
"206","2018-08-07 18:05:26.449108","192.168.2.3","216.58.197.4","TLSv1.2","212","Application Data"
"207","2018-08-07 18:05:26.449109","192.168.2.3","216.58.197.4","TLSv1.2","1310","Application Data"
"210","2018-08-07 18:05:26.556714","192.168.2.3","216.58.197.4","TCP","1434","49253  >  443 [ACK] Seq=117884 Ack=2767 Win=1522 Len=1368 TSval=596497 TSecr=373800417 [TCP segment of a reassembled PDU]"
"211","2018-08-07 18:05:26.556719","192.168.2.3","216.58.197.4","TCP","1434","49253  >  443 [ACK] Seq=119252 Ack=2767 Win=1522 Len=1368 TSval=596497 TSecr=373800417 [TCP segment of a reassembled PDU]"
"212","2018-08-07 18:05:26.556721","192.168.2.3","216.58.197.4","TLSv1.2","212","Application Data"
"213","2018-08-07 18:05:26.557001","192.168.2.3","216.58.197.4","TCP","1434","49253  >  443 [ACK] Seq=120766 Ack=2767 Win=1522 Len=1368 TSval=596497 TSecr=373800417 [TCP segment of a reassembled PDU]"
"214","2018-08-07 18:05:26.557002","192.168.2.3","216.58.197.4","TLSv1.2","155","Application Data"
"220","2018-08-07 18:05:26.607731","192.168.2.3","216.58.197.4","TCP","66","49253  >  443 [ACK] Seq=122223 Ack=3139 Win=1522 Len=0 TSval=596503 TSecr=373800570"
"221","2018-08-07 18:05:26.644377","192.168.2.3","216.58.197.4","TCP","1434","49253  >  443 [ACK] Seq=122223 Ack=3139 Win=1522 Len=1368 TSval=596506 TSecr=373800570 [TCP segment of a reassembled PDU]"
"222","2018-08-07 18:05:26.644803","192.168.2.3","216.58.197.4","TCP","1434","49253  >  443 [ACK] Seq=123591 Ack=3139 Win=1522 Len=1368 TSval=596506 TSecr=373800570 [TCP segment of a reassembled PDU]"
"223","2018-08-07 18:05:26.644805","192.168.2.3","216.58.197.4","TLSv1.2","212","Application Data"
"224","2018-08-07 18:05:26.645253","192.168.2.3","216.58.197.4","TCP","1434","49253  >  443 [ACK] Seq=125105 Ack=3139 Win=1522 Len=1368 TSval=596506 TSecr=373800570 [TCP segment of a reassembled PDU]"
"225","2018-08-07 18:05:26.645256","192.168.2.3","216.58.197.4","TLSv1.2","155","Application Data"
"229","2018-08-07 18:05:26.764974","192.168.2.3","216.58.197.4","TCP","1434","49253  >  443 [ACK] Seq=126562 Ack=3139 Win=1522 Len=1368 TSval=596518 TSecr=373800614 [TCP segment of a reassembled PDU]"
"230","2018-08-07 18:05:26.765359","192.168.2.3","216.58.197.4","TCP","1434","49253  >  443 [ACK] Seq=127930 Ack=3139 Win=1522 Len=1368 TSval=596518 TSecr=373800614 [TCP segment of a reassembled PDU]"
"231","2018-08-07 18:05:26.765362","192.168.2.3","216.58.197.4","TLSv1.2","212","Application Data"
"232","2018-08-07 18:05:26.765816","192.168.2.3","216.58.197.4","TLSv1.2","1410","Application Data"
"238","2018-08-07 18:05:26.821853","192.168.2.3","216.58.197.4","TCP","66","49253  >  443 [ACK] Seq=130788 Ack=3438 Win=1522 Len=0 TSval=596524 TSecr=373800784"
"239","2018-08-07 18:05:26.864495","192.168.2.3","216.58.197.4","TCP","1434","49253  >  443 [ACK] Seq=130788 Ack=3438 Win=1522 Len=1368 TSval=596528 TSecr=373800784 [TCP segment of a reassembled PDU]"
"240","2018-08-07 18:05:26.864880","192.168.2.3","216.58.197.4","TCP","1434","49253  >  443 [ACK] Seq=132156 Ack=3438 Win=1522 Len=1368 TSval=596528 TSecr=373800784 [TCP segment of a reassembled PDU]"
"241","2018-08-07 18:05:26.864883","192.168.2.3","216.58.197.4","TLSv1.2","212","Application Data"
"242","2018-08-07 18:05:26.865214","192.168.2.3","216.58.197.4","TLSv1.2","1416","Application Data"
"247","2018-08-07 18:05:26.929152","192.168.2.3","216.58.197.4","TCP","66","49253  >  443 [ACK] Seq=135020 Ack=3934 Win=1522 Len=0 TSval=596535 TSecr=373800892"
"248","2018-08-07 18:05:26.968147","192.168.2.3","216.58.197.4","TCP","1434","49253  >  443 [ACK] Seq=135020 Ack=3934 Win=1522 Len=1368 TSval=596539 TSecr=373800892 [TCP segment of a reassembled PDU]"
"249","2018-08-07 18:05:26.968607","192.168.2.3","216.58.197.4","TCP","1434","49253  >  443 [ACK] Seq=136388 Ack=3934 Win=1522 Len=1368 TSval=596539 TSecr=373800892 [TCP segment of a reassembled PDU]"
"250","2018-08-07 18:05:26.968610","192.168.2.3","216.58.197.4","TLSv1.2","212","Application Data"
"251","2018-08-07 18:05:26.968611","192.168.2.3","216.58.197.4","TLSv1.2","1109","Application Data"
"255","2018-08-07 18:05:27.082056","192.168.2.3","216.58.197.4","TCP","1434","49253  >  443 [ACK] Seq=138945 Ack=3934 Win=1522 Len=1368 TSval=596550 TSecr=373800937 [TCP segment of a reassembled PDU]"
"256","2018-08-07 18:05:27.082297","192.168.2.3","216.58.197.4","TCP","1434","49253  >  443 [ACK] Seq=140313 Ack=3934 Win=1522 Len=1368 TSval=596550 TSecr=373800937 [TCP segment of a reassembled PDU]"
"257","2018-08-07 18:05:27.082299","192.168.2.3","216.58.197.4","TLSv1.2","212","Application Data"
"258","2018-08-07 18:05:27.082300","192.168.2.3","216.58.197.4","TLSv1.2","767","Application Data"
"261","2018-08-07 18:05:27.127368","192.168.2.3","216.58.197.4","TCP","66","49253  >  443 [ACK] Seq=142528 Ack=4144 Win=1522 Len=0 TSval=596555 TSecr=373801054"
"264","2018-08-07 18:05:27.148429","192.168.2.3","216.58.197.4","TCP","66","49253  >  443 [ACK] Seq=142528 Ack=4381 Win=1522 Len=0 TSval=596557 TSecr=373801110"
"265","2018-08-07 18:05:27.204592","192.168.2.3","216.58.197.4","TCP","1434","49253  >  443 [ACK] Seq=142528 Ack=4381 Win=1522 Len=1368 TSval=596560 TSecr=373801110 [TCP segment of a reassembled PDU]"
"266","2018-08-07 18:05:27.204599","192.168.2.3","216.58.197.4","TCP","1434","49253  >  443 [ACK] Seq=143896 Ack=4381 Win=1522 Len=1368 TSval=596560 TSecr=373801110 [TCP segment of a reassembled PDU]"
"267","2018-08-07 18:05:27.204791","192.168.2.3","216.58.197.4","TLSv1.2","212","Application Data"
"268","2018-08-07 18:05:27.204793","192.168.2.3","216.58.197.4","TLSv1.2","1096","Application Data"
"270","2018-08-07 18:05:27.304652","192.168.2.3","216.58.197.4","TCP","1434","49253  >  443 [ACK] Seq=146440 Ack=4381 Win=1522 Len=1368 TSval=596570 TSecr=373801173 [TCP segment of a reassembled PDU]"
"271","2018-08-07 18:05:27.304656","192.168.2.3","216.58.197.4","TCP","1434","49253  >  443 [ACK] Seq=147808 Ack=4381 Win=1522 Len=1368 TSval=596570 TSecr=373801173 [TCP segment of a reassembled PDU]"
"272","2018-08-07 18:05:27.304657","192.168.2.3","216.58.197.4","TLSv1.2","212","Application Data"
"273","2018-08-07 18:05:27.304865","192.168.2.3","216.58.197.4","TLSv1.2","750","Application Data"
"278","2018-08-07 18:05:27.371611","192.168.2.3","216.58.197.4","TCP","66","49253  >  443 [ACK] Seq=150006 Ack=4764 Win=1522 Len=0 TSval=596579 TSecr=373801317"
"279","2018-08-07 18:05:27.402337","192.168.2.3","216.58.197.4","TCP","1434","49253  >  443 [ACK] Seq=150006 Ack=4764 Win=1522 Len=1368 TSval=596582 TSecr=373801317 [TCP segment of a reassembled PDU]"
"280","2018-08-07 18:05:27.402824","192.168.2.3","216.58.197.4","TCP","1434","49253  >  443 [ACK] Seq=151374 Ack=4764 Win=1522 Len=1368 TSval=596582 TSecr=373801317 [TCP segment of a reassembled PDU]"
"281","2018-08-07 18:05:27.402827","192.168.2.3","216.58.197.4","TLSv1.2","212","Application Data"
"282","2018-08-07 18:05:27.402828","192.168.2.3","216.58.197.4","TLSv1.2","1105","Application Data"
"285","2018-08-07 18:05:27.534255","192.168.2.3","216.58.197.4","TCP","1434","49253  >  443 [ACK] Seq=153927 Ack=4764 Win=1522 Len=1368 TSval=596592 TSecr=373801371 [TCP segment of a reassembled PDU]"
"286","2018-08-07 18:05:27.534557","192.168.2.3","216.58.197.4","TCP","1434","49253  >  443 [ACK] Seq=155295 Ack=4764 Win=1522 Len=1368 TSval=596592 TSecr=373801371 [TCP segment of a reassembled PDU]"
"287","2018-08-07 18:05:27.534560","192.168.2.3","216.58.197.4","TLSv1.2","212","Application Data"
"288","2018-08-07 18:05:27.534561","192.168.2.3","216.58.197.4","TCP","1434","49253  >  443 [ACK] Seq=156809 Ack=4764 Win=1522 Len=1368 TSval=596592 TSecr=373801371 [TCP segment of a reassembled PDU]"
"289","2018-08-07 18:05:27.534728","192.168.2.3","216.58.197.4","TLSv1.2","155","Application Data"
"293","2018-08-07 18:05:27.594547","192.168.2.3","216.58.197.4","TCP","66","49253  >  443 [ACK] Seq=158266 Ack=5004 Win=1522 Len=0 TSval=596601 TSecr=373801548"
"294","2018-08-07 18:05:27.632868","192.168.2.3","216.58.197.4","TCP","1434","49253  >  443 [ACK] Seq=158266 Ack=5004 Win=1522 Len=1368 TSval=596605 TSecr=373801548 [TCP segment of a reassembled PDU]"
"295","2018-08-07 18:05:27.633140","192.168.2.3","216.58.197.4","TCP","1434","49253  >  443 [ACK] Seq=159634 Ack=5004 Win=1522 Len=1368 TSval=596605 TSecr=373801548 [TCP segment of a reassembled PDU]"
"296","2018-08-07 18:05:27.633142","192.168.2.3","216.58.197.4","TLSv1.2","212","Application Data"
"297","2018-08-07 18:05:27.633665","192.168.2.3","216.58.197.4","TCP","1434","49253  >  443 [ACK] Seq=161148 Ack=5004 Win=1522 Len=1368 TSval=596605 TSecr=373801548 [TCP segment of a reassembled PDU]"
"298","2018-08-07 18:05:27.633668","192.168.2.3","216.58.197.4","TLSv1.2","155","Application Data"
"304","2018-08-07 18:05:27.689416","192.168.2.3","216.58.197.4","TCP","66","49253  >  443 [ACK] Seq=162605 Ack=5159 Win=1522 Len=0 TSval=596611 TSecr=373801652"
"305","2018-08-07 18:05:27.732748","192.168.2.3","216.58.197.4","TCP","1434","49253  >  443 [ACK] Seq=162605 Ack=5159 Win=1522 Len=1368 TSval=596615 TSecr=373801652 [TCP segment of a reassembled PDU]"
"306","2018-08-07 18:05:27.732753","192.168.2.3","216.58.197.4","TCP","1434","49253  >  443 [ACK] Seq=163973 Ack=5159 Win=1522 Len=1368 TSval=596615 TSecr=373801652 [TCP segment of a reassembled PDU]"
"307","2018-08-07 18:05:27.732754","192.168.2.3","216.58.197.4","TLSv1.2","212","Application Data"
"308","2018-08-07 18:05:27.732991","192.168.2.3","216.58.197.4","TLSv1.2","985","Application Data"
"309","2018-08-07 18:05:27.732993","192.168.2.3","216.58.197.4","TLSv1.2","102","Application Data"
"314","2018-08-07 18:05:27.748431","192.168.2.3","216.58.197.4","TCP","66","49253  >  443 [ACK] Seq=166442 Ack=5989 Win=1522 Len=0 TSval=596617 TSecr=373801709"