"No.","Time","Source","Destination","Protocol","Length","Info"
"1","2018-08-07 17:58:50.212209","192.168.2.3","172.217.27.174","TCP","66","52315  >  443 [ACK] Seq=1 Ack=1 Win=296 Len=0 TSval=556864 TSecr=259985907"
"4","2018-08-07 17:58:52.736618","192.168.2.3","108.177.125.188","TCP","91","50384  >  5228 [PSH, ACK] Seq=1 Ack=1 Win=262 Len=25 TSval=557116 TSecr=2744913662"
"6","2018-08-07 17:58:52.782598","192.168.2.3","108.177.125.188","TCP","66","50384  >  5228 [ACK] Seq=26 Ack=26 Win=262 Len=0 TSval=557121 TSecr=2744943549"
"7","2018-08-07 17:58:56.891818","192.168.2.3","239.255.255.250","SSDP","136","M-SEARCH * HTTP/1.1 "
"8","2018-08-07 17:58:57.013925","192.168.2.3","172.217.27.163","TLSv1.2","135","Application Data"
"9","2018-08-07 17:58:57.013928","192.168.2.3","172.217.27.163","TLSv1.2","104","Application Data"
"12","2018-08-07 17:58:57.024860","192.168.2.3","172.217.27.163","TCP","66","38971  >  443 [ACK] Seq=108 Ack=117 Win=406 Len=0 TSval=557545 TSecr=467686066"
"13","2018-08-07 17:58:57.025321","192.168.2.3","172.217.27.163","TLSv1.2","100","Application Data"
"14","2018-08-07 17:58:57.025720","192.168.2.3","172.217.27.163","TLSv1.2","104","Application Data"
"16","2018-08-07 17:58:57.283068","192.168.2.3","216.58.197.4","TLSv1.2","156","Application Data"
"17","2018-08-07 17:58:57.283072","192.168.2.3","216.58.197.4","TLSv1.2","104","Application Data"
"18","2018-08-07 17:58:57.283073","192.168.2.3","216.58.197.4","TLSv1.2","158","Application Data"
"19","2018-08-07 17:58:57.283251","192.168.2.3","216.58.197.4","TCP","1434","49253  >  443 [ACK] Seq=221 Ack=1 Win=1522 Len=1368 TSval=557568 TSecr=373367698 [TCP segment of a reassembled PDU]"
"20","2018-08-07 17:58:57.283470","192.168.2.3","216.58.197.4","TCP","1434","49253  >  443 [ACK] Seq=1589 Ack=1 Win=1522 Len=1368 TSval=557568 TSecr=373367698 [TCP segment of a reassembled PDU]"
"21","2018-08-07 17:58:57.283471","192.168.2.3","216.58.197.4","TLSv1.2","212","Application Data"
"22","2018-08-07 17:58:57.283472","192.168.2.3","216.58.197.4","TCP","1434","49253  >  443 [ACK] Seq=3103 Ack=1 Win=1522 Len=1368 TSval=557568 TSecr=373367698 [TCP segment of a reassembled PDU]"
"23","2018-08-07 17:58:57.283714","192.168.2.3","216.58.197.4","TLSv1.2","286","Application Data"
"24","2018-08-07 17:58:57.283991","192.168.2.3","216.58.197.4","TCP","1434","49253  >  443 [ACK] Seq=4691 Ack=1 Win=1522 Len=1368 TSval=557568 TSecr=373367698 [TCP segment of a reassembled PDU]"
"34","2018-08-07 17:58:57.289999","192.168.2.3","216.58.197.4","TCP","1434","49253  >  443 [ACK] Seq=6059 Ack=1 Win=1522 Len=1368 TSval=557571 TSecr=373411250 [TCP segment of a reassembled PDU]"
"35","2018-08-07 17:58:57.290001","192.168.2.3","216.58.197.4","TLSv1.2","1434","Application Data [TCP segment of a reassembled PDU]"
"36","2018-08-07 17:58:57.290413","192.168.2.3","216.58.197.4","TLSv1.2","1434","Application Data [TCP segment of a reassembled PDU]"
"37","2018-08-07 17:58:57.290797","192.168.2.3","216.58.197.4","TCP","1434","49253  >  443 [ACK] Seq=10163 Ack=1 Win=1522 Len=1368 TSval=557571 TSecr=373411250 [TCP segment of a reassembled PDU]"
"38","2018-08-07 17:58:57.290800","192.168.2.3","216.58.197.4","TLSv1.2","1434","Application Data [TCP segment of a reassembled PDU]"
"39","2018-08-07 17:58:57.291059","192.168.2.3","216.58.197.4","TLSv1.2","1434","Application Data [TCP segment of a reassembled PDU]"
"40","2018-08-07 17:58:57.291062","192.168.2.3","216.58.197.4","TCP","1434","49253  >  443 [ACK] Seq=14267 Ack=1 Win=1522 Len=1368 TSval=557571 TSecr=373411251 [TCP segment of a reassembled PDU]"
"41","2018-08-07 17:58:57.291230","192.168.2.3","216.58.197.4","TLSv1.2","1434","Application Data [TCP segment of a reassembled PDU]"
"42","2018-08-07 17:58:57.292536","192.168.2.3","216.58.197.4","TLSv1.2","1434","Application Data [TCP segment of a reassembled PDU]"
"43","2018-08-07 17:58:57.292538","192.168.2.3","216.58.197.4","TCP","1434","49253  >  443 [ACK] Seq=18371 Ack=1 Win=1522 Len=1368 TSval=557571 TSecr=373411251 [TCP segment of a reassembled PDU]"
"44","2018-08-07 17:58:57.292815","192.168.2.3","216.58.197.4","TLSv1.2","1434","Application Data [TCP segment of a reassembled PDU]"
"45","2018-08-07 17:58:57.292939","192.168.2.3","216.58.197.4","TLSv1.2","1434","Application Data [TCP segment of a reassembled PDU]"
"50","2018-08-07 17:58:57.295807","192.168.2.3","216.58.197.4","TCP","1434","49253  >  443 [ACK] Seq=22475 Ack=39 Win=1522 Len=1368 TSval=557572 TSecr=373411251 [TCP segment of a reassembled PDU]"
"51","2018-08-07 17:58:57.295809","192.168.2.3","216.58.197.4","TLSv1.2","1434","Application Data [TCP segment of a reassembled PDU]"
"52","2018-08-07 17:58:57.296791","192.168.2.3","216.58.197.4","TLSv1.2","1434","Application Data [TCP segment of a reassembled PDU]"
"53","2018-08-07 17:58:57.296805","192.168.2.3","216.58.197.4","TCP","1434","49253  >  443 [ACK] Seq=26579 Ack=39 Win=1522 Len=1368 TSval=557572 TSecr=373411257 [TCP segment of a reassembled PDU]"
"54","2018-08-07 17:58:57.297017","192.168.2.3","216.58.197.4","TLSv1.2","1434","Application Data [TCP segment of a reassembled PDU]"
"57","2018-08-07 17:58:57.297485","192.168.2.3","216.58.197.4","TCP","1434","49253  >  443 [ACK] Seq=29315 Ack=39 Win=1522 Len=1368 TSval=557572 TSecr=373411258 [TCP segment of a reassembled PDU]"
"58","2018-08-07 17:58:57.297682","192.168.2.3","216.58.197.4","TLSv1.2","1434","Application Data [TCP segment of a reassembled PDU]"
"59","2018-08-07 17:58:57.297685","192.168.2.3","216.58.197.4","TCP","1434","49253  >  443 [ACK] Seq=32051 Ack=39 Win=1522 Len=1368 TSval=557572 TSecr=373411258 [TCP segment of a reassembled PDU]"
"61","2018-08-07 17:58:57.300410","192.168.2.3","216.58.197.4","TLSv1.2","1434","Application Data [TCP segment of a reassembled PDU]"
"62","2018-08-07 17:58:57.300412","192.168.2.3","216.58.197.4","TLSv1.2","1434","Application Data [TCP segment of a reassembled PDU]"
"67","2018-08-07 17:58:57.306082","192.168.2.3","216.58.197.4","TCP","1434","49253  >  443 [ACK] Seq=36155 Ack=39 Win=1522 Len=1368 TSval=557572 TSecr=373411259 [TCP segment of a reassembled PDU]"
"68","2018-08-07 17:58:57.306094","192.168.2.3","216.58.197.4","TLSv1.2","1434","Application Data [TCP segment of a reassembled PDU]"
"69","2018-08-07 17:58:57.306330","192.168.2.3","216.58.197.4","TLSv1.2","1434","Application Data [TCP segment of a reassembled PDU]"
"70","2018-08-07 17:58:57.306555","192.168.2.3","216.58.197.4","TCP","1434","49253  >  443 [ACK] Seq=40259 Ack=39 Win=1522 Len=1368 TSval=557572 TSecr=373411260 [TCP segment of a reassembled PDU]"
"71","2018-08-07 17:58:57.306560","192.168.2.3","216.58.197.4","TLSv1.2","1434","Application Data [TCP segment of a reassembled PDU]"
"72","2018-08-07 17:58:57.309732","192.168.2.3","216.58.197.4","TLSv1.2","1434","Application Data [TCP segment of a reassembled PDU]"
"73","2018-08-07 17:58:57.309743","192.168.2.3","216.58.197.4","TCP","1434","49253  >  443 [ACK] Seq=44363 Ack=39 Win=1522 Len=1368 TSval=557572 TSecr=373411263 [TCP segment of a reassembled PDU]"
"74","2018-08-07 17:58:57.309744","192.168.2.3","216.58.197.4","TLSv1.2","1434","Application Data [TCP segment of a reassembled PDU]"
"75","2018-08-07 17:58:57.309745","192.168.2.3","216.58.197.4","TLSv1.2","1434","Application Data [TCP segment of a reassembled PDU]"
"76","2018-08-07 17:58:57.309748","192.168.2.3","216.58.197.4","TCP","1434","49253  >  443 [ACK] Seq=48467 Ack=39 Win=1522 Len=1368 TSval=557573 TSecr=373411264 [TCP segment of a reassembled PDU]"
"77","2018-08-07 17:58:57.309752","192.168.2.3","216.58.197.4","TLSv1.2","1434","Application Data [TCP segment of a reassembled PDU]"
"78","2018-08-07 17:58:57.309753","192.168.2.3","216.58.197.4","TLSv1.2","1434","Application Data [TCP segment of a reassembled PDU]"
"79","2018-08-07 17:58:57.309755","192.168.2.3","216.58.197.4","TCP","1434","49253  >  443 [ACK] Seq=52571 Ack=39 Win=1522 Len=1368 TSval=557573 TSecr=373411264 [TCP segment of a reassembled PDU]"
"80","2018-08-07 17:58:57.309757","192.168.2.3","216.58.197.4","TLSv1.2","1434","Application Data [TCP segment of a reassembled PDU]"
"81","2018-08-07 17:58:57.309758","192.168.2.3","216.58.197.4","TCP","1434","49253  >  443 [ACK] Seq=55307 Ack=39 Win=1522 Len=1368 TSval=557573 TSecr=373411265 [TCP segment of a reassembled PDU]"
"82","2018-08-07 17:58:57.309760","192.168.2.3","216.58.197.4","TLSv1.2","1434","Application Data [TCP segment of a reassembled PDU]"
"90","2018-08-07 17:58:57.316843","192.168.2.3","216.58.197.4","TLSv1.2","451","Application Data"
"92","2018-08-07 17:58:57.332242","192.168.2.3","216.58.197.4","TCP","1434","49253  >  443 [ACK] Seq=58428 Ack=39 Win=1522 Len=1368 TSval=557575 TSecr=373411284 [TCP segment of a reassembled PDU]"
"93","2018-08-07 17:58:57.332247","192.168.2.3","216.58.197.4","TCP","1434","49253  >  443 [ACK] Seq=59796 Ack=39 Win=1522 Len=1368 TSval=557575 TSecr=373411284 [TCP segment of a reassembled PDU]"
"94","2018-08-07 17:58:57.332440","192.168.2.3","216.58.197.4","TLSv1.2","212","Application Data"
"95","2018-08-07 17:58:57.332441","192.168.2.3","216.58.197.4","TCP","1434","49253  >  443 [ACK] Seq=61310 Ack=39 Win=1522 Len=1368 TSval=557575 TSecr=373411284 [TCP segment of a reassembled PDU]"
"96","2018-08-07 17:58:57.332702","192.168.2.3","216.58.197.4","TLSv1.2","155","Application Data"
"99","2018-08-07 17:58:57.449822","192.168.2.3","216.58.197.4","TCP","1434","49253  >  443 [ACK] Seq=62767 Ack=39 Win=1522 Len=1368 TSval=557587 TSecr=373411340 [TCP segment of a reassembled PDU]"
"100","2018-08-07 17:58:57.449825","192.168.2.3","216.58.197.4","TCP","1434","49253  >  443 [ACK] Seq=64135 Ack=39 Win=1522 Len=1368 TSval=557587 TSecr=373411340 [TCP segment of a reassembled PDU]"
"101","2018-08-07 17:58:57.449826","192.168.2.3","216.58.197.4","TLSv1.2","212","Application Data"
"102","2018-08-07 17:58:57.450067","192.168.2.3","216.58.197.4","TCP","1434","49253  >  443 [ACK] Seq=65649 Ack=39 Win=1522 Len=1368 TSval=557587 TSecr=373411340 [TCP segment of a reassembled PDU]"
"103","2018-08-07 17:58:57.450069","192.168.2.3","216.58.197.4","TLSv1.2","155","Application Data"
"107","2018-08-07 17:58:57.552064","192.168.2.3","216.58.197.4","TCP","1434","49253  >  443 [ACK] Seq=67106 Ack=39 Win=1522 Len=1368 TSval=557597 TSecr=373411417 [TCP segment of a reassembled PDU]"
"108","2018-08-07 17:58:57.552067","192.168.2.3","216.58.197.4","TCP","1434","49253  >  443 [ACK] Seq=68474 Ack=39 Win=1522 Len=1368 TSval=557597 TSecr=373411417 [TCP segment of a reassembled PDU]"
"109","2018-08-07 17:58:57.552249","192.168.2.3","216.58.197.4","TLSv1.2","212","Application Data"
"110","2018-08-07 17:58:57.552481","192.168.2.3","216.58.197.4","TLSv1.2","1101","Application Data"
"113","2018-08-07 17:58:57.655359","192.168.2.3","216.58.197.4","TCP","1434","49253  >  443 [ACK] Seq=71023 Ack=39 Win=1522 Len=1368 TSval=557608 TSecr=373411519 [TCP segment of a reassembled PDU]"
"114","2018-08-07 17:58:57.655734","192.168.2.3","216.58.197.4","TCP","1434","49253  >  443 [ACK] Seq=72391 Ack=39 Win=1522 Len=1368 TSval=557608 TSecr=373411519 [TCP segment of a reassembled PDU]"
"115","2018-08-07 17:58:57.655737","192.168.2.3","216.58.197.4","TLSv1.2","212","Application Data"
"116","2018-08-07 17:58:57.655738","192.168.2.3","216.58.197.4","TCP","1434","49253  >  443 [ACK] Seq=73905 Ack=39 Win=1522 Len=1368 TSval=557608 TSecr=373411519 [TCP segment of a reassembled PDU]"
"117","2018-08-07 17:58:57.655914","192.168.2.3","216.58.197.4","TLSv1.2","84","Application Data"
"124","2018-08-07 17:58:57.731259","192.168.2.3","216.58.197.4","TCP","66","49253  >  443 [ACK] Seq=75291 Ack=256 Win=1522 Len=0 TSval=557615 TSecr=373411692"
"126","2018-08-07 17:58:57.742379","192.168.2.3","216.58.197.4","TCP","66","49253  >  443 [ACK] Seq=75291 Ack=429 Win=1522 Len=0 TSval=557617 TSecr=373411692"
"127","2018-08-07 17:58:57.769084","192.168.2.3","216.58.197.4","TCP","1434","49253  >  443 [ACK] Seq=75291 Ack=429 Win=1522 Len=1368 TSval=557619 TSecr=373411692 [TCP segment of a reassembled PDU]"
"128","2018-08-07 17:58:57.769088","192.168.2.3","216.58.197.4","TCP","1434","49253  >  443 [ACK] Seq=76659 Ack=429 Win=1522 Len=1368 TSval=557619 TSecr=373411692 [TCP segment of a reassembled PDU]"
"129","2018-08-07 17:58:57.769089","192.168.2.3","216.58.197.4","TLSv1.2","212","Application Data"
"130","2018-08-07 17:58:57.769557","192.168.2.3","216.58.197.4","TCP","1434","49253  >  443 [ACK] Seq=78173 Ack=429 Win=1522 Len=1368 TSval=557619 TSecr=373411692 [TCP segment of a reassembled PDU]"
"131","2018-08-07 17:58:57.769559","192.168.2.3","216.58.197.4","TLSv1.2","88","Application Data"
"135","2018-08-07 17:58:57.868214","192.168.2.3","216.58.197.4","TCP","1434","49253  >  443 [ACK] Seq=79563 Ack=610 Win=1522 Len=1368 TSval=557629 TSecr=373411811 [TCP segment of a reassembled PDU]"
"136","2018-08-07 17:58:57.868603","192.168.2.3","216.58.197.4","TCP","1434","49253  >  443 [ACK] Seq=80931 Ack=610 Win=1522 Len=1368 TSval=557629 TSecr=373411811 [TCP segment of a reassembled PDU]"
"137","2018-08-07 17:58:57.868607","192.168.2.3","216.58.197.4","TLSv1.2","212","Application Data"
"138","2018-08-07 17:58:57.868607","192.168.2.3","216.58.197.4","TCP","1434","49253  >  443 [ACK] Seq=82445 Ack=610 Win=1522 Len=1368 TSval=557629 TSecr=373411811 [TCP segment of a reassembled PDU]"
"139","2018-08-07 17:58:57.868608","192.168.2.3","216.58.197.4","TLSv1.2","155","Application Data"
"143","2018-08-07 17:58:57.994476","192.168.2.3","216.58.197.4","TCP","1434","49253  >  443 [ACK] Seq=83902 Ack=610 Win=1522 Len=1368 TSval=557641 TSecr=373411836 [TCP segment of a reassembled PDU]"
"144","2018-08-07 17:58:57.994481","192.168.2.3","216.58.197.4","TCP","1434","49253  >  443 [ACK] Seq=85270 Ack=610 Win=1522 Len=1368 TSval=557641 TSecr=373411836 [TCP segment of a reassembled PDU]"
"145","2018-08-07 17:58:57.994482","192.168.2.3","216.58.197.4","TLSv1.2","212","Application Data"
"146","2018-08-07 17:58:57.994626","192.168.2.3","216.58.197.4","TLSv1.2","1351","Application Data"
"149","2018-08-07 17:58:58.061692","192.168.2.3","216.58.197.4","TCP","66","49253  >  443 [ACK] Seq=88069 Ack=707 Win=1522 Len=0 TSval=557649 TSecr=373411990"
"150","2018-08-07 17:58:58.099724","192.168.2.3","216.58.197.4","TCP","1434","49253  >  443 [ACK] Seq=88069 Ack=707 Win=1522 Len=1368 TSval=557652 TSecr=373411990 [TCP segment of a reassembled PDU]"
"151","2018-08-07 17:58:58.099878","192.168.2.3","216.58.197.4","TCP","1434","49253  >  443 [ACK] Seq=89437 Ack=707 Win=1522 Len=1368 TSval=557652 TSecr=373411990 [TCP segment of a reassembled PDU]"
"152","2018-08-07 17:58:58.099880","192.168.2.3","216.58.197.4","TLSv1.2","212","Application Data"
"153","2018-08-07 17:58:58.100150","192.168.2.3","216.58.197.4","TCP","1434","49253  >  443 [ACK] Seq=90951 Ack=707 Win=1522 Len=1368 TSval=557652 TSecr=373411990 [TCP segment of a reassembled PDU]"
"154","2018-08-07 17:58:58.100152","192.168.2.3","216.58.197.4","TLSv1.2","155","Application Data"
"158","2018-08-07 17:58:58.211767","192.168.2.3","216.58.197.4","TCP","1434","49253  >  443 [ACK] Seq=92408 Ack=707 Win=1522 Len=1368 TSval=557663 TSecr=373412107 [TCP segment of a reassembled PDU]"
"159","2018-08-07 17:58:58.212225","192.168.2.3","216.58.197.4","TCP","1434","49253  >  443 [ACK] Seq=93776 Ack=707 Win=1522 Len=1368 TSval=557663 TSecr=373412107 [TCP segment of a reassembled PDU]"
"160","2018-08-07 17:58:58.212227","192.168.2.3","216.58.197.4","TLSv1.2","212","Application Data"
"161","2018-08-07 17:58:58.212228","192.168.2.3","216.58.197.4","TCP","1434","49253  >  443 [ACK] Seq=95290 Ack=707 Win=1522 Len=1368 TSval=557664 TSecr=373412107 [TCP segment of a reassembled PDU]"
"162","2018-08-07 17:58:58.212229","192.168.2.3","216.58.197.4","TLSv1.2","155","Application Data"
"166","2018-08-07 17:58:58.311126","192.168.2.3","216.58.197.4","TCP","1434","49253  >  443 [ACK] Seq=96747 Ack=707 Win=1522 Len=1368 TSval=557673 TSecr=373412179 [TCP segment of a reassembled PDU]"
"167","2018-08-07 17:58:58.311130","192.168.2.3","216.58.197.4","TCP","1434","49253  >  443 [ACK] Seq=98115 Ack=707 Win=1522 Len=1368 TSval=557673 TSecr=373412179 [TCP segment of a reassembled PDU]"
"168","2018-08-07 17:58:58.311131","192.168.2.3","216.58.197.4","TLSv1.2","212","Application Data"
"169","2018-08-07 17:58:58.311331","192.168.2.3","216.58.197.4","TCP","1434","49253  >  443 [ACK] Seq=99629 Ack=707 Win=1522 Len=1368 TSval=557673 TSecr=373412179 [TCP segment of a reassembled PDU]"
"170","2018-08-07 17:58:58.311334","192.168.2.3","216.58.197.4","TLSv1.2","155","Application Data"
"173","2018-08-07 17:58:58.406523","192.168.2.3","216.58.197.4","TCP","1434","49253  >  443 [ACK] Seq=101086 Ack=707 Win=1522 Len=1368 TSval=557683 TSecr=373412278 [TCP segment of a reassembled PDU]"
"174","2018-08-07 17:58:58.406720","192.168.2.3","216.58.197.4","TCP","1434","49253  >  443 [ACK] Seq=102454 Ack=707 Win=1522 Len=1368 TSval=557683 TSecr=373412278 [TCP segment of a reassembled PDU]"
"175","2018-08-07 17:58:58.406721","192.168.2.3","216.58.197.4","TLSv1.2","212","Application Data"
"176","2018-08-07 17:58:58.406889","192.168.2.3","216.58.197.4","TCP","1434","49253  >  443 [ACK] Seq=103968 Ack=707 Win=1522 Len=1368 TSval=557683 TSecr=373412278 [TCP segment of a reassembled PDU]"
"177","2018-08-07 17:58:58.406891","192.168.2.3","216.58.197.4","TLSv1.2","155","Application Data"
"181","2018-08-07 17:58:58.506330","192.168.2.3","216.58.197.4","TCP","1434","49253  >  443 [ACK] Seq=105425 Ack=707 Win=1522 Len=1368 TSval=557693 TSecr=373412374 [TCP segment of a reassembled PDU]"
"182","2018-08-07 17:58:58.506336","192.168.2.3","216.58.197.4","TCP","1434","49253  >  443 [ACK] Seq=106793 Ack=707 Win=1522 Len=1368 TSval=557693 TSecr=373412374 [TCP segment of a reassembled PDU]"
"183","2018-08-07 17:58:58.506457","192.168.2.3","216.58.197.4","TLSv1.2","212","Application Data"
"184","2018-08-07 17:58:58.506951","192.168.2.3","216.58.197.4","TCP","1434","49253  >  443 [ACK] Seq=108307 Ack=707 Win=1522 Len=1368 TSval=557693 TSecr=373412374 [TCP segment of a reassembled PDU]"
"185","2018-08-07 17:58:58.506954","192.168.2.3","216.58.197.4","TLSv1.2","155","Application Data"
"188","2018-08-07 17:58:58.620690","192.168.2.3","216.58.197.4","TCP","1434","49253  >  443 [ACK] Seq=109764 Ack=707 Win=1522 Len=1368 TSval=557703 TSecr=373412474 [TCP segment of a reassembled PDU]"
"189","2018-08-07 17:58:58.620867","192.168.2.3","216.58.197.4","TCP","1434","49253  >  443 [ACK] Seq=111132 Ack=707 Win=1522 Len=1368 TSval=557703 TSecr=373412474 [TCP segment of a reassembled PDU]"
"190","2018-08-07 17:58:58.620870","192.168.2.3","216.58.197.4","TLSv1.2","212","Application Data"
"191","2018-08-07 17:58:58.620871","192.168.2.3","216.58.197.4","TCP","1434","49253  >  443 [ACK] Seq=112646 Ack=707 Win=1522 Len=1368 TSval=557703 TSecr=373412474 [TCP segment of a reassembled PDU]"
"192","2018-08-07 17:58:58.621006","192.168.2.3","216.58.197.4","TLSv1.2","155","Application Data"
"196","2018-08-07 17:58:58.715302","192.168.2.3","216.58.197.4","TCP","1434","49253  >  443 [ACK] Seq=114103 Ack=707 Win=1522 Len=1368 TSval=557712 TSecr=373412588 [TCP segment of a reassembled PDU]"
"197","2018-08-07 17:58:58.715311","192.168.2.3","216.58.197.4","TCP","1434","49253  >  443 [ACK] Seq=115471 Ack=707 Win=1522 Len=1368 TSval=557712 TSecr=373412588 [TCP segment of a reassembled PDU]"
"198","2018-08-07 17:58:58.715465","192.168.2.3","216.58.197.4","TLSv1.2","212","Application Data"
"199","2018-08-07 17:58:58.715467","192.168.2.3","216.58.197.4","TCP","1434","49253  >  443 [ACK] Seq=116985 Ack=707 Win=1522 Len=1368 TSval=557712 TSecr=373412588 [TCP segment of a reassembled PDU]"
"200","2018-08-07 17:58:58.715811","192.168.2.3","216.58.197.4","TLSv1.2","155","Application Data"
"206","2018-08-07 17:58:58.756484","192.168.2.3","216.58.197.4","TCP","66","49253  >  443 [ACK] Seq=118442 Ack=864 Win=1522 Len=0 TSval=557718 TSecr=373412693"
"207","2018-08-07 17:58:58.756488","192.168.2.3","216.58.197.4","TCP","66","49253  >  443 [ACK] Seq=118442 Ack=936 Win=1522 Len=0 TSval=557718 TSecr=373412703"
"210","2018-08-07 17:58:58.768731","192.168.2.3","216.58.197.4","TCP","66","49253  >  443 [ACK] Seq=118442 Ack=1100 Win=1522 Len=0 TSval=557719 TSecr=373412730"
"211","2018-08-07 17:58:58.769137","192.168.2.3","216.58.197.4","TCP","66","49253  >  443 [ACK] Seq=118442 Ack=1224 Win=1522 Len=0 TSval=557719 TSecr=373412730"
"212","2018-08-07 17:58:58.792984","192.168.2.3","216.58.197.4","TCP","1434","49253  >  443 [ACK] Seq=118442 Ack=1224 Win=1522 Len=1368 TSval=557722 TSecr=373412730 [TCP segment of a reassembled PDU]"
"213","2018-08-07 17:58:58.793915","192.168.2.3","216.58.197.4","TCP","1434","49253  >  443 [ACK] Seq=119810 Ack=1224 Win=1522 Len=1368 TSval=557722 TSecr=373412730 [TCP segment of a reassembled PDU]"
"214","2018-08-07 17:58:58.793918","192.168.2.3","216.58.197.4","TLSv1.2","212","Application Data"
"215","2018-08-07 17:58:58.794270","192.168.2.3","216.58.197.4","TCP","1434","49253  >  443 [ACK] Seq=121324 Ack=1224 Win=1522 Len=1368 TSval=557722 TSecr=373412730 [TCP segment of a reassembled PDU]"
"216","2018-08-07 17:58:58.794272","192.168.2.3","216.58.197.4","TLSv1.2","155","Application Data"
"222","2018-08-07 17:58:58.852695","192.168.2.3","216.58.197.4","TCP","66","49253  >  443 [ACK] Seq=122781 Ack=1598 Win=1522 Len=0 TSval=557727 TSecr=373412813"
"223","2018-08-07 17:58:58.888132","192.168.2.3","216.58.197.4","TCP","1434","49253  >  443 [ACK] Seq=122781 Ack=1598 Win=1522 Len=1368 TSval=557731 TSecr=373412813 [TCP segment of a reassembled PDU]"
"224","2018-08-07 17:58:58.888137","192.168.2.3","216.58.197.4","TCP","1434","49253  >  443 [ACK] Seq=124149 Ack=1598 Win=1522 Len=1368 TSval=557731 TSecr=373412813 [TCP segment of a reassembled PDU]"
"225","2018-08-07 17:58:58.888273","192.168.2.3","216.58.197.4","TLSv1.2","212","Application Data"
"226","2018-08-07 17:58:58.892612","192.168.2.3","216.58.197.4","TCP","1434","49253  >  443 [ACK] Seq=125663 Ack=1598 Win=1522 Len=1368 TSval=557731 TSecr=373412813 [TCP segment of a reassembled PDU]"
"227","2018-08-07 17:58:58.892617","192.168.2.3","216.58.197.4","TLSv1.2","155","Application Data"
"231","2018-08-07 17:58:58.984254","192.168.2.3","216.58.197.4","TCP","1434","49253  >  443 [ACK] Seq=127120 Ack=1598 Win=1522 Len=1368 TSval=557741 TSecr=373412860 [TCP segment of a reassembled PDU]"
"232","2018-08-07 17:58:58.984258","192.168.2.3","216.58.197.4","TCP","1434","49253  >  443 [ACK] Seq=128488 Ack=1598 Win=1522 Len=1368 TSval=557741 TSecr=373412860 [TCP segment of a reassembled PDU]"
"233","2018-08-07 17:58:58.984259","192.168.2.3","216.58.197.4","TLSv1.2","212","Application Data"
"234","2018-08-07 17:58:58.984542","192.168.2.3","216.58.197.4","TCP","1434","49253  >  443 [ACK] Seq=130002 Ack=1598 Win=1522 Len=1368 TSval=557741 TSecr=373412860 [TCP segment of a reassembled PDU]"
"235","2018-08-07 17:58:58.984544","192.168.2.3","216.58.197.4","TLSv1.2","155","Application Data"
"239","2018-08-07 17:58:59.050492","192.168.2.3","216.58.197.4","TCP","66","49253  >  443 [ACK] Seq=131459 Ack=1943 Win=1522 Len=0 TSval=557747 TSecr=373413011"
"240","2018-08-07 17:58:59.078032","192.168.2.3","216.58.197.4","TCP","1434","49253  >  443 [ACK] Seq=131459 Ack=1943 Win=1522 Len=1368 TSval=557750 TSecr=373413011 [TCP segment of a reassembled PDU]"
"241","2018-08-07 17:58:59.078035","192.168.2.3","216.58.197.4","TCP","1434","49253  >  443 [ACK] Seq=132827 Ack=1943 Win=1522 Len=1368 TSval=557750 TSecr=373413011 [TCP segment of a reassembled PDU]"
"242","2018-08-07 17:58:59.078237","192.168.2.3","216.58.197.4","TLSv1.2","212","Application Data"
"243","2018-08-07 17:58:59.078393","192.168.2.3","216.58.197.4","TCP","1434","49253  >  443 [ACK] Seq=134341 Ack=1943 Win=1522 Len=1368 TSval=557750 TSecr=373413011 [TCP segment of a reassembled PDU]"
"244","2018-08-07 17:58:59.078395","192.168.2.3","216.58.197.4","TLSv1.2","155","Application Data"
"248","2018-08-07 17:58:59.175429","192.168.2.3","216.58.197.4","TCP","1434","49253  >  443 [ACK] Seq=135798 Ack=1943 Win=1522 Len=1368 TSval=557760 TSecr=373413045 [TCP segment of a reassembled PDU]"
"249","2018-08-07 17:58:59.175432","192.168.2.3","216.58.197.4","TCP","1434","49253  >  443 [ACK] Seq=137166 Ack=1943 Win=1522 Len=1368 TSval=557760 TSecr=373413045 [TCP segment of a reassembled PDU]"
"250","2018-08-07 17:58:59.175567","192.168.2.3","216.58.197.4","TLSv1.2","212","Application Data"
"251","2018-08-07 17:58:59.175762","192.168.2.3","216.58.197.4","TCP","1434","49253  >  443 [ACK] Seq=138680 Ack=1943 Win=1522 Len=1368 TSval=557760 TSecr=373413045 [TCP segment of a reassembled PDU]"
"252","2018-08-07 17:58:59.175763","192.168.2.3","216.58.197.4","TLSv1.2","155","Application Data"
"255","2018-08-07 17:58:59.270583","192.168.2.3","216.58.197.4","TCP","1434","49253  >  443 [ACK] Seq=140137 Ack=1943 Win=1522 Len=1368 TSval=557769 TSecr=373413143 [TCP segment of a reassembled PDU]"
"256","2018-08-07 17:58:59.271122","192.168.2.3","216.58.197.4","TCP","1434","49253  >  443 [ACK] Seq=141505 Ack=1943 Win=1522 Len=1368 TSval=557769 TSecr=373413143 [TCP segment of a reassembled PDU]"
"257","2018-08-07 17:58:59.271124","192.168.2.3","216.58.197.4","TLSv1.2","212","Application Data"
"258","2018-08-07 17:58:59.271476","192.168.2.3","216.58.197.4","TCP","1434","49253  >  443 [ACK] Seq=143019 Ack=1943 Win=1522 Len=1368 TSval=557769 TSecr=373413143 [TCP segment of a reassembled PDU]"
"259","2018-08-07 17:58:59.271479","192.168.2.3","216.58.197.4","TLSv1.2","155","Application Data"
"263","2018-08-07 17:58:59.371416","192.168.2.3","216.58.197.4","TCP","1434","49253  >  443 [ACK] Seq=144476 Ack=1943 Win=1522 Len=1368 TSval=557779 TSecr=373413238 [TCP segment of a reassembled PDU]"
"264","2018-08-07 17:58:59.372770","192.168.2.3","216.58.197.4","TCP","1434","49253  >  443 [ACK] Seq=145844 Ack=1943 Win=1522 Len=1368 TSval=557779 TSecr=373413238 [TCP segment of a reassembled PDU]"
"265","2018-08-07 17:58:59.372776","192.168.2.3","216.58.197.4","TLSv1.2","212","Application Data"
"266","2018-08-07 17:58:59.372777","192.168.2.3","216.58.197.4","TCP","1434","49253  >  443 [ACK] Seq=147358 Ack=1943 Win=1522 Len=1368 TSval=557779 TSecr=373413238 [TCP segment of a reassembled PDU]"
"267","2018-08-07 17:58:59.372960","192.168.2.3","216.58.197.4","TLSv1.2","155","Application Data"
"273","2018-08-07 17:58:59.430730","192.168.2.3","216.58.197.4","TCP","66","49253  >  443 [ACK] Seq=148815 Ack=2313 Win=1522 Len=0 TSval=557785 TSecr=373413391"
"274","2018-08-07 17:58:59.465722","192.168.2.3","216.58.197.4","TCP","1434","49253  >  443 [ACK] Seq=148815 Ack=2313 Win=1522 Len=1368 TSval=557789 TSecr=373413391 [TCP segment of a reassembled PDU]"
"275","2018-08-07 17:58:59.466513","192.168.2.3","216.58.197.4","TCP","1434","49253  >  443 [ACK] Seq=150183 Ack=2313 Win=1522 Len=1368 TSval=557789 TSecr=373413391 [TCP segment of a reassembled PDU]"
"276","2018-08-07 17:58:59.466516","192.168.2.3","216.58.197.4","TLSv1.2","212","Application Data"
"277","2018-08-07 17:58:59.466516","192.168.2.3","216.58.197.4","TCP","1434","49253  >  443 [ACK] Seq=151697 Ack=2313 Win=1522 Len=1368 TSval=557789 TSecr=373413391 [TCP segment of a reassembled PDU]"
"278","2018-08-07 17:58:59.466668","192.168.2.3","216.58.197.4","TLSv1.2","155","Application Data"
"284","2018-08-07 17:58:59.542934","192.168.2.3","216.58.197.4","TCP","66","49253  >  443 [ACK] Seq=153154 Ack=2598 Win=1522 Len=0 TSval=557797 TSecr=373413499"
"285","2018-08-07 17:58:59.564522","192.168.2.3","216.58.197.4","TCP","1434","49253  >  443 [ACK] Seq=153154 Ack=2598 Win=1522 Len=1368 TSval=557799 TSecr=373413499 [TCP segment of a reassembled PDU]"
"286","2018-08-07 17:58:59.564931","192.168.2.3","216.58.197.4","TCP","1434","49253  >  443 [ACK] Seq=154522 Ack=2598 Win=1522 Len=1368 TSval=557799 TSecr=373413499 [TCP segment of a reassembled PDU]"
"287","2018-08-07 17:58:59.564934","192.168.2.3","216.58.197.4","TLSv1.2","212","Application Data"
"288","2018-08-07 17:58:59.566953","192.168.2.3","216.58.197.4","TCP","1434","49253  >  443 [ACK] Seq=156036 Ack=2598 Win=1522 Len=1368 TSval=557799 TSecr=373413499 [TCP segment of a reassembled PDU]"
"289","2018-08-07 17:58:59.566956","192.168.2.3","216.58.197.4","TLSv1.2","155","Application Data"
"295","2018-08-07 17:58:59.625996","192.168.2.3","216.58.197.4","TCP","66","49253  >  443 [ACK] Seq=157493 Ack=3004 Win=1522 Len=0 TSval=557805 TSecr=373413587"
"296","2018-08-07 17:58:59.660646","192.168.2.3","216.58.197.4","TCP","1434","49253  >  443 [ACK] Seq=157493 Ack=3004 Win=1522 Len=1368 TSval=557808 TSecr=373413587 [TCP segment of a reassembled PDU]"
"297","2018-08-07 17:58:59.660918","192.168.2.3","216.58.197.4","TCP","1434","49253  >  443 [ACK] Seq=158861 Ack=3004 Win=1522 Len=1368 TSval=557808 TSecr=373413587 [TCP segment of a reassembled PDU]"
"298","2018-08-07 17:58:59.660921","192.168.2.3","216.58.197.4","TLSv1.2","212","Application Data"
"299","2018-08-07 17:58:59.660922","192.168.2.3","216.58.197.4","TCP","1434","49253  >  443 [ACK] Seq=160375 Ack=3004 Win=1522 Len=1368 TSval=557808 TSecr=373413587 [TCP segment of a reassembled PDU]"
"300","2018-08-07 17:58:59.661059","192.168.2.3","216.58.197.4","TLSv1.2","155","Application Data"
"306","2018-08-07 17:58:59.741180","192.168.2.3","216.58.197.4","TCP","66","49253  >  443 [ACK] Seq=161832 Ack=3281 Win=1522 Len=0 TSval=557816 TSecr=373413693"
"307","2018-08-07 17:58:59.756403","192.168.2.3","216.58.197.4","TCP","1434","49253  >  443 [ACK] Seq=161832 Ack=3281 Win=1522 Len=1368 TSval=557818 TSecr=373413693 [TCP segment of a reassembled PDU]"
"308","2018-08-07 17:58:59.756959","192.168.2.3","216.58.197.4","TCP","1434","49253  >  443 [ACK] Seq=163200 Ack=3281 Win=1522 Len=1368 TSval=557818 TSecr=373413693 [TCP segment of a reassembled PDU]"
"309","2018-08-07 17:58:59.756962","192.168.2.3","216.58.197.4","TLSv1.2","212","Application Data"
"310","2018-08-07 17:58:59.756963","192.168.2.3","216.58.197.4","TCP","1434","49253  >  443 [ACK] Seq=164714 Ack=3281 Win=1522 Len=1368 TSval=557818 TSecr=373413693 [TCP segment of a reassembled PDU]"
"311","2018-08-07 17:58:59.756964","192.168.2.3","216.58.197.4","TLSv1.2","155","Application Data"
"317","2018-08-07 17:58:59.818030","192.168.2.3","216.58.197.4","TCP","66","49253  >  443 [ACK] Seq=166171 Ack=3638 Win=1522 Len=0 TSval=557824 TSecr=373413779"
"318","2018-08-07 17:58:59.853340","192.168.2.3","216.58.197.4","TCP","1434","49253  >  443 [ACK] Seq=166171 Ack=3638 Win=1522 Len=1368 TSval=557828 TSecr=373413779 [TCP segment of a reassembled PDU]"
"319","2018-08-07 17:58:59.853773","192.168.2.3","216.58.197.4","TCP","1434","49253  >  443 [ACK] Seq=167539 Ack=3638 Win=1522 Len=1368 TSval=557828 TSecr=373413779 [TCP segment of a reassembled PDU]"
"320","2018-08-07 17:58:59.853776","192.168.2.3","216.58.197.4","TLSv1.2","212","Application Data"
"321","2018-08-07 17:58:59.854259","192.168.2.3","216.58.197.4","TCP","1434","49253  >  443 [ACK] Seq=169053 Ack=3638 Win=1522 Len=1368 TSval=557828 TSecr=373413779 [TCP segment of a reassembled PDU]"
"322","2018-08-07 17:58:59.854261","192.168.2.3","216.58.197.4","TLSv1.2","155","Application Data"
"328","2018-08-07 17:58:59.913910","192.168.2.3","216.58.197.4","TCP","66","49253  >  443 [ACK] Seq=170510 Ack=4018 Win=1522 Len=0 TSval=557834 TSecr=373413873"
"329","2018-08-07 17:58:59.977252","192.168.2.3","216.58.197.4","TCP","1434","49253  >  443 [ACK] Seq=170510 Ack=4018 Win=1522 Len=1368 TSval=557840 TSecr=373413873 [TCP segment of a reassembled PDU]"
"330","2018-08-07 17:58:59.977625","192.168.2.3","216.58.197.4","TCP","1434","49253  >  443 [ACK] Seq=171878 Ack=4018 Win=1522 Len=1368 TSval=557840 TSecr=373413873 [TCP segment of a reassembled PDU]"
"331","2018-08-07 17:58:59.977627","192.168.2.3","216.58.197.4","TLSv1.2","212","Application Data"
"332","2018-08-07 17:58:59.977628","192.168.2.3","216.58.197.4","TCP","1434","49253  >  443 [ACK] Seq=173392 Ack=4018 Win=1522 Len=1368 TSval=557840 TSecr=373413873 [TCP segment of a reassembled PDU]"
"333","2018-08-07 17:58:59.977981","192.168.2.3","216.58.197.4","TLSv1.2","155","Application Data"
"337","2018-08-07 17:59:00.076271","192.168.2.3","216.58.197.4","TCP","1434","49253  >  443 [ACK] Seq=174849 Ack=4018 Win=1522 Len=1368 TSval=557850 TSecr=373413945 [TCP segment of a reassembled PDU]"
"338","2018-08-07 17:59:00.078253","192.168.2.3","216.58.197.4","TCP","1434","49253  >  443 [ACK] Seq=176217 Ack=4018 Win=1522 Len=1368 TSval=557850 TSecr=373413945 [TCP segment of a reassembled PDU]"
"339","2018-08-07 17:59:00.078255","192.168.2.3","216.58.197.4","TLSv1.2","212","Application Data"
"340","2018-08-07 17:59:00.078644","192.168.2.3","216.58.197.4","TCP","1434","49253  >  443 [ACK] Seq=177731 Ack=4018 Win=1522 Len=1368 TSval=557850 TSecr=373413945 [TCP segment of a reassembled PDU]"
"341","2018-08-07 17:59:00.078646","192.168.2.3","216.58.197.4","TLSv1.2","155","Application Data"
"347","2018-08-07 17:59:00.136434","192.168.2.3","216.58.197.4","TCP","66","49253  >  443 [ACK] Seq=179188 Ack=4383 Win=1522 Len=0 TSval=557856 TSecr=373414094"
"348","2018-08-07 17:59:00.172762","192.168.2.3","216.58.197.4","TCP","1434","49253  >  443 [ACK] Seq=179188 Ack=4383 Win=1522 Len=1368 TSval=557860 TSecr=373414094 [TCP segment of a reassembled PDU]"
"349","2018-08-07 17:59:00.172764","192.168.2.3","216.58.197.4","TCP","1434","49253  >  443 [ACK] Seq=180556 Ack=4383 Win=1522 Len=1368 TSval=557860 TSecr=373414094 [TCP segment of a reassembled PDU]"
"350","2018-08-07 17:59:00.172809","192.168.2.3","216.58.197.4","TLSv1.2","212","Application Data"
"351","2018-08-07 17:59:00.173129","192.168.2.3","216.58.197.4","TCP","1434","49253  >  443 [ACK] Seq=182070 Ack=4383 Win=1522 Len=1368 TSval=557860 TSecr=373414094 [TCP segment of a reassembled PDU]"
"352","2018-08-07 17:59:00.173131","192.168.2.3","216.58.197.4","TLSv1.2","155","Application Data"
"356","2018-08-07 17:59:00.272345","192.168.2.3","216.58.197.4","TCP","1434","49253  >  443 [ACK] Seq=183527 Ack=4383 Win=1522 Len=1368 TSval=557870 TSecr=373414140 [TCP segment of a reassembled PDU]"
"357","2018-08-07 17:59:00.275207","192.168.2.3","216.58.197.4","TCP","1434","49253  >  443 [ACK] Seq=184895 Ack=4383 Win=1522 Len=1368 TSval=557870 TSecr=373414140 [TCP segment of a reassembled PDU]"
"358","2018-08-07 17:59:00.275210","192.168.2.3","216.58.197.4","TLSv1.2","212","Application Data"
"359","2018-08-07 17:59:00.275211","192.168.2.3","216.58.197.4","TLSv1.2","1108","Application Data"
"363","2018-08-07 17:59:00.353045","192.168.2.3","216.58.197.4","TCP","66","49253  >  443 [ACK] Seq=187451 Ack=4513 Win=1522 Len=0 TSval=557878 TSecr=373414272"
"364","2018-08-07 17:59:00.393382","192.168.2.3","216.58.197.4","TCP","1434","49253  >  443 [ACK] Seq=187451 Ack=4513 Win=1522 Len=1368 TSval=557882 TSecr=373414272 [TCP segment of a reassembled PDU]"
"365","2018-08-07 17:59:00.393399","192.168.2.3","216.58.197.4","TCP","1434","49253  >  443 [ACK] Seq=188819 Ack=4513 Win=1522 Len=1368 TSval=557882 TSecr=373414272 [TCP segment of a reassembled PDU]"
"366","2018-08-07 17:59:00.393400","192.168.2.3","216.58.197.4","TLSv1.2","212","Application Data"
"367","2018-08-07 17:59:00.393609","192.168.2.3","216.58.197.4","TLSv1.2","1049","Application Data"
"372","2018-08-07 17:59:00.453689","192.168.2.3","216.58.197.4","TCP","66","49253  >  443 [ACK] Seq=191316 Ack=4791 Win=1522 Len=0 TSval=557888 TSecr=373414410"
"373","2018-08-07 17:59:00.493401","192.168.2.3","216.58.197.4","TCP","1434","49253  >  443 [ACK] Seq=191316 Ack=4791 Win=1522 Len=1368 TSval=557892 TSecr=373414410 [TCP segment of a reassembled PDU]"
"374","2018-08-07 17:59:00.493405","192.168.2.3","216.58.197.4","TCP","1434","49253  >  443 [ACK] Seq=192684 Ack=4791 Win=1522 Len=1368 TSval=557892 TSecr=373414410 [TCP segment of a reassembled PDU]"
"375","2018-08-07 17:59:00.493406","192.168.2.3","216.58.197.4","TLSv1.2","212","Application Data"
"376","2018-08-07 17:59:00.493881","192.168.2.3","216.58.197.4","TCP","1434","49253  >  443 [ACK] Seq=194198 Ack=4791 Win=1522 Len=1368 TSval=557892 TSecr=373414410 [TCP segment of a reassembled PDU]"
"377","2018-08-07 17:59:00.493883","192.168.2.3","216.58.197.4","TLSv1.2","155","Application Data"
"380","2018-08-07 17:59:00.614790","192.168.2.3","216.58.197.4","TCP","1434","49253  >  443 [ACK] Seq=195655 Ack=4791 Win=1522 Len=1368 TSval=557904 TSecr=373414461 [TCP segment of a reassembled PDU]"
"381","2018-08-07 17:59:00.614794","192.168.2.3","216.58.197.4","TCP","1434","49253  >  443 [ACK] Seq=197023 Ack=4791 Win=1522 Len=1368 TSval=557904 TSecr=373414461 [TCP segment of a reassembled PDU]"
"382","2018-08-07 17:59:00.614795","192.168.2.3","216.58.197.4","TLSv1.2","212","Application Data"
"383","2018-08-07 17:59:00.615018","192.168.2.3","216.58.197.4","TCP","1434","49253  >  443 [ACK] Seq=198537 Ack=4791 Win=1522 Len=1368 TSval=557904 TSecr=373414461 [TCP segment of a reassembled PDU]"
"384","2018-08-07 17:59:00.615021","192.168.2.3","216.58.197.4","TLSv1.2","155","Application Data"
"389","2018-08-07 17:59:00.684589","192.168.2.3","216.58.197.4","TCP","66","49253  >  443 [ACK] Seq=199994 Ack=4937 Win=1522 Len=0 TSval=557911 TSecr=373414643"
"390","2018-08-07 17:59:00.716648","192.168.2.3","216.58.197.4","TCP","1434","49253  >  443 [ACK] Seq=199994 Ack=4937 Win=1522 Len=1368 TSval=557914 TSecr=373414643 [TCP segment of a reassembled PDU]"
"391","2018-08-07 17:59:00.717061","192.168.2.3","216.58.197.4","TCP","1434","49253  >  443 [ACK] Seq=201362 Ack=4937 Win=1522 Len=1368 TSval=557914 TSecr=373414643 [TCP segment of a reassembled PDU]"
"392","2018-08-07 17:59:00.717064","192.168.2.3","216.58.197.4","TLSv1.2","212","Application Data"
"393","2018-08-07 17:59:00.717064","192.168.2.3","216.58.197.4","TLSv1.2","1253","Application Data"
"397","2018-08-07 17:59:00.742031","192.168.2.3","216.58.197.4","TCP","66","49253  >  443 [ACK] Seq=204063 Ack=5193 Win=1522 Len=0 TSval=557917 TSecr=373414693"
"398","2018-08-07 17:59:00.816630","192.168.2.3","216.58.197.4","TCP","1434","49253  >  443 [ACK] Seq=204063 Ack=5193 Win=1522 Len=1368 TSval=557924 TSecr=373414693 [TCP segment of a reassembled PDU]"
"399","2018-08-07 17:59:00.817030","192.168.2.3","216.58.197.4","TCP","1434","49253  >  443 [ACK] Seq=205431 Ack=5193 Win=1522 Len=1368 TSval=557924 TSecr=373414693 [TCP segment of a reassembled PDU]"
"400","2018-08-07 17:59:00.817032","192.168.2.3","216.58.197.4","TLSv1.2","212","Application Data"
"401","2018-08-07 17:59:00.817479","192.168.2.3","216.58.197.4","TLSv1.2","1408","Application Data"
"406","2018-08-07 17:59:00.872514","192.168.2.3","216.58.197.4","TCP","66","49253  >  443 [ACK] Seq=208287 Ack=5551 Win=1522 Len=0 TSval=557930 TSecr=373414833"
"407","2018-08-07 17:59:00.929145","192.168.2.3","216.58.197.4","TCP","1434","49253  >  443 [ACK] Seq=208287 Ack=5551 Win=1522 Len=1368 TSval=557935 TSecr=373414833 [TCP segment of a reassembled PDU]"
"408","2018-08-07 17:59:00.929150","192.168.2.3","216.58.197.4","TCP","1434","49253  >  443 [ACK] Seq=209655 Ack=5551 Win=1522 Len=1368 TSval=557935 TSecr=373414833 [TCP segment of a reassembled PDU]"
"409","2018-08-07 17:59:00.929151","192.168.2.3","216.58.197.4","TLSv1.2","212","Application Data"
"410","2018-08-07 17:59:00.929193","192.168.2.3","216.58.197.4","TCP","1434","49253  >  443 [ACK] Seq=211169 Ack=5551 Win=1522 Len=1368 TSval=557935 TSecr=373414833 [TCP segment of a reassembled PDU]"
"411","2018-08-07 17:59:00.929194","192.168.2.3","216.58.197.4","TLSv1.2","67","Application Data"
"412","2018-08-07 17:59:00.929391","192.168.2.3","216.58.197.4","TLSv1.2","102","Application Data"
"416","2018-08-07 17:59:00.963806","192.168.2.3","216.58.197.4","TCP","66","49253  >  443 [ACK] Seq=212574 Ack=6224 Win=1522 Len=0 TSval=557938 TSecr=373414916"
"419","2018-08-07 17:59:01.746519","192.168.2.3","216.58.197.4","TCP","66","49253  >  443 [ACK] Seq=212574 Ack=6800 Win=1522 Len=0 TSval=558017 TSecr=373415693"
"427","2018-08-07 17:59:02.634086","192.168.2.3","216.58.197.4","TCP","66","49253  >  443 [ACK] Seq=212574 Ack=8304 Win=1512 Len=0 TSval=558106 TSecr=373416567"
"428","2018-08-07 17:59:02.634478","192.168.2.3","216.58.197.4","TCP","66","49253  >  443 [ACK] Seq=212574 Ack=10199 Win=1512 Len=0 TSval=558106 TSecr=373416591"
"429","2018-08-07 17:59:02.634736","192.168.2.3","216.58.197.4","TCP","66","49253  >  443 [ACK] Seq=212574 Ack=11762 Win=1512 Len=0 TSval=558106 TSecr=373416591"
"432","2018-08-07 17:59:02.667889","192.168.2.3","216.58.197.4","TCP","66","49253  >  443 [ACK] Seq=212574 Ack=13198 Win=1522 Len=0 TSval=558109 TSecr=373416625"
"434","2018-08-07 17:59:02.772139","192.168.2.3","216.58.197.4","TCP","66","49253  >  443 [ACK] Seq=212574 Ack=13413 Win=1522 Len=0 TSval=558120 TSecr=373416693"
"441","2018-08-07 17:59:02.828227","192.168.2.3","216.58.197.4","TCP","66","49253  >  443 [ACK] Seq=212574 Ack=13650 Win=1522 Len=0 TSval=558125 TSecr=373416789"
"442","2018-08-07 17:59:02.828230","192.168.2.3","216.58.197.4","TCP","66","49253  >  443 [ACK] Seq=212574 Ack=13715 Win=1522 Len=0 TSval=558125 TSecr=373416790"
"443","2018-08-07 17:59:02.832115","192.168.2.3","216.58.197.4","TCP","66","49253  >  443 [ACK] Seq=212574 Ack=13819 Win=1522 Len=0 TSval=558125 TSecr=373416790"
"444","2018-08-07 17:59:02.832119","192.168.2.3","216.58.197.4","TCP","66","49253  >  443 [ACK] Seq=212574 Ack=14102 Win=1522 Len=0 TSval=558125 TSecr=373416790"
"445","2018-08-07 17:59:02.832119","192.168.2.3","216.58.197.4","TCP","66","49253  >  443 [ACK] Seq=212574 Ack=14140 Win=1522 Len=0 TSval=558125 TSecr=373416790"
"446","2018-08-07 17:59:02.832120","192.168.2.3","216.58.197.4","TCP","66","49253  >  443 [ACK] Seq=212574 Ack=14170 Win=1522 Len=0 TSval=558125 TSecr=373416790"
"447","2018-08-07 17:59:02.838158","192.168.2.3","216.58.197.4","TLSv1.2","104","Application Data"
"449","2018-08-07 17:59:03.654329","192.168.2.3","172.217.27.174","TLSv1.2","161","Application Data"
"450","2018-08-07 17:59:03.654333","192.168.2.3","172.217.27.174","TLSv1.2","104","Application Data"
"451","2018-08-07 17:59:03.654334","192.168.2.3","172.217.27.174","TLSv1.2","482","Application Data"
"452","2018-08-07 17:59:03.654639","192.168.2.3","8.8.8.8","DNS","79","Standard query 0xf1ef A play.googleapis.com"
"453","2018-08-07 17:59:03.654641","192.168.2.3","8.8.8.8","DNS","79","Standard query 0x2032 AAAA play.googleapis.com"
"458","2018-08-07 17:59:03.691700","192.168.2.3","172.217.27.174","TCP","66","52258  >  443 [ACK] Seq=550 Ack=39 Win=661 Len=0 TSval=558212 TSecr=2575862230"
"461","2018-08-07 17:59:03.704675","192.168.2.3","172.217.161.234","TCP","74","58384  >  443 [SYN] Seq=0 Win=14600 Len=0 MSS=1460 SACK_PERM=1 TSval=558213 TSecr=0 WS=64"
"463","2018-08-07 17:59:03.713272","192.168.2.3","172.217.161.234","TCP","66","58384  >  443 [ACK] Seq=1 Ack=1 Win=14656 Len=0 TSval=558214 TSecr=355561380"
"464","2018-08-07 17:59:03.714997","192.168.2.3","172.217.161.234","TLSv1.2","583","Client Hello"
"467","2018-08-07 17:59:03.732498","192.168.2.3","172.217.161.234","TCP","66","58384  >  443 [ACK] Seq=518 Ack=153 Win=15680 Len=0 TSval=558215 TSecr=355561391"
"468","2018-08-07 17:59:03.732503","192.168.2.3","172.217.161.234","TLSv1.2","266","Change Cipher Spec, Encrypted Handshake Message, Encrypted Handshake Message"
"474","2018-08-07 17:59:03.738983","192.168.2.3","172.217.27.174","TCP","66","52258  >  443 [ACK] Seq=550 Ack=107 Win=661 Len=0 TSval=558216 TSecr=2575862308"
"475","2018-08-07 17:59:03.739308","192.168.2.3","172.217.27.174","TCP","66","52258  >  443 [ACK] Seq=550 Ack=306 Win=661 Len=0 TSval=558216 TSecr=2575862308"
"476","2018-08-07 17:59:03.739430","192.168.2.3","172.217.27.174","TCP","66","52258  >  443 [ACK] Seq=550 Ack=426 Win=661 Len=0 TSval=558216 TSecr=2575862308"
"477","2018-08-07 17:59:03.739433","192.168.2.3","172.217.27.174","TCP","66","52258  >  443 [ACK] Seq=550 Ack=464 Win=661 Len=0 TSval=558216 TSecr=2575862308"
"478","2018-08-07 17:59:03.772913","192.168.2.3","172.217.161.234","TLSv1.2","151","Application Data"
"479","2018-08-07 17:59:03.772917","192.168.2.3","172.217.27.174","TLSv1.2","104","Application Data"
"480","2018-08-07 17:59:03.772918","192.168.2.3","172.217.161.234","TLSv1.2","96","Application Data"
"481","2018-08-07 17:59:03.772918","192.168.2.3","172.217.161.234","TLSv1.2","302","Application Data"
"482","2018-08-07 17:59:03.773193","192.168.2.3","172.217.161.234","TCP","1434","58384  >  443 [ACK] Seq=1069 Ack=214 Win=15680 Len=1368 TSval=558220 TSecr=355561409 [TCP segment of a reassembled PDU]"
"483","2018-08-07 17:59:03.777239","192.168.2.3","172.217.161.234","TCP","1434","58384  >  443 [ACK] Seq=2437 Ack=214 Win=15680 Len=1368 TSval=558220 TSecr=355561409 [TCP segment of a reassembled PDU]"
"486","2018-08-07 17:59:03.777639","192.168.2.3","172.217.161.234","TLSv1.2","212","Application Data"
"487","2018-08-07 17:59:03.777641","192.168.2.3","172.217.161.234","TLSv1.2","900","Application Data"
"490","2018-08-07 17:59:03.811746","192.168.2.3","172.217.161.234","TCP","66","58384  >  443 [ACK] Seq=4785 Ack=244 Win=15680 Len=0 TSval=558224 TSecr=355561448"
"497","2018-08-07 17:59:03.888472","192.168.2.3","172.217.161.234","TCP","66","58384  >  443 [ACK] Seq=4785 Ack=440 Win=16768 Len=0 TSval=558231 TSecr=355561557"
"498","2018-08-07 17:59:03.888478","192.168.2.3","172.217.161.234","TCP","66","58384  >  443 [ACK] Seq=4785 Ack=716 Win=17856 Len=0 TSval=558231 TSecr=355561557"
"499","2018-08-07 17:59:03.888739","192.168.2.3","172.217.161.234","TCP","66","58384  >  443 [ACK] Seq=4785 Ack=895 Win=18944 Len=0 TSval=558231 TSecr=355561557"
"500","2018-08-07 17:59:03.888740","192.168.2.3","172.217.161.234","TCP","66","58384  >  443 [ACK] Seq=4785 Ack=933 Win=18944 Len=0 TSval=558231 TSecr=355561557"
"501","2018-08-07 17:59:03.896856","192.168.2.3","172.217.161.234","TLSv1.2","104","Application Data"
