"No.","Time","Source","Destination","Protocol","Length","Info"
"1","2018-08-07 17:57:19.868095","192.168.2.3","8.8.8.8","DNS","79","Standard query 0xad59 A clients4.google.com"
"3","2018-08-07 17:57:19.881303","192.168.2.3","172.217.27.174","TCP","74","52315  >  443 [SYN] Seq=0 Win=14600 Len=0 MSS=1460 SACK_PERM=1 TSval=547830 TSecr=0 WS=64"
"5","2018-08-07 17:57:19.891473","192.168.2.3","172.217.27.174","TCP","66","52315  >  443 [ACK] Seq=1 Ack=1 Win=14656 Len=0 TSval=547832 TSecr=259940733"
"6","2018-08-07 17:57:19.892217","192.168.2.3","172.217.27.174","TLSv1.2","583","Client Hello"
"9","2018-08-07 17:57:19.898573","192.168.2.3","172.217.27.174","TCP","66","52315  >  443 [ACK] Seq=518 Ack=149 Win=15680 Len=0 TSval=547832 TSecr=259940745"
"10","2018-08-07 17:57:19.903581","192.168.2.3","172.217.27.174","TLSv1.2","109","Change Cipher Spec, Encrypted Handshake Message"
"12","2018-08-07 17:57:19.914134","192.168.2.3","172.217.27.174","TLSv1.2","151","Application Data"
"13","2018-08-07 17:57:19.914746","192.168.2.3","172.217.27.174","TLSv1.2","96","Application Data"
"14","2018-08-07 17:57:19.915301","192.168.2.3","172.217.27.174","TLSv1.2","514","Application Data"
"15","2018-08-07 17:57:19.915721","192.168.2.3","172.217.27.174","TCP","1434","52315  >  443 [ACK] Seq=1124 Ack=210 Win=15680 Len=1368 TSval=547834 TSecr=259940756 [TCP segment of a reassembled PDU]"
"16","2018-08-07 17:57:19.916118","192.168.2.3","172.217.27.174","TCP","1434","52315  >  443 [ACK] Seq=2492 Ack=210 Win=15680 Len=1368 TSval=547834 TSecr=259940756 [TCP segment of a reassembled PDU]"
"17","2018-08-07 17:57:19.916121","192.168.2.3","172.217.27.174","TLSv1.2","212","Application Data"
"18","2018-08-07 17:57:19.916122","192.168.2.3","172.217.27.174","TLSv1.2","464","Application Data"
"23","2018-08-07 17:57:19.950694","192.168.2.3","172.217.27.174","TCP","66","52315  >  443 [ACK] Seq=4404 Ack=240 Win=15680 Len=0 TSval=547838 TSecr=259940766"
"28","2018-08-07 17:57:20.007305","192.168.2.3","172.217.27.174","TCP","66","52315  >  443 [ACK] Seq=4404 Ack=463 Win=16768 Len=0 TSval=547843 TSecr=259940850"
"29","2018-08-07 17:57:20.007307","192.168.2.3","172.217.27.174","TCP","66","52315  >  443 [ACK] Seq=4404 Ack=595 Win=17856 Len=0 TSval=547843 TSecr=259940850"
"30","2018-08-07 17:57:20.007308","192.168.2.3","172.217.27.174","TCP","66","52315  >  443 [ACK] Seq=4404 Ack=766 Win=18944 Len=0 TSval=547843 TSecr=259940850"
"31","2018-08-07 17:57:20.008081","192.168.2.3","172.217.27.174","TLSv1.2","104","Application Data"
"36","2018-08-07 17:57:23.854873","192.168.2.3","216.58.197.4","TLSv1.2","156","Application Data"
"37","2018-08-07 17:57:23.854877","192.168.2.3","216.58.197.4","TLSv1.2","104","Application Data"
"38","2018-08-07 17:57:23.854878","192.168.2.3","216.58.197.4","TLSv1.2","158","Application Data"
"39","2018-08-07 17:57:23.866065","192.168.2.3","216.58.197.4","TCP","1434","49253  >  443 [ACK] Seq=221 Ack=1 Win=1522 Len=1368 TSval=548229 TSecr=373277937 [TCP segment of a reassembled PDU]"
"40","2018-08-07 17:57:23.866188","192.168.2.3","216.58.197.4","TCP","1434","49253  >  443 [ACK] Seq=1589 Ack=1 Win=1522 Len=1368 TSval=548229 TSecr=373277937 [TCP segment of a reassembled PDU]"
"41","2018-08-07 17:57:23.866190","192.168.2.3","216.58.197.4","TLSv1.2","212","Application Data"
"42","2018-08-07 17:57:23.866406","192.168.2.3","216.58.197.4","TCP","1434","49253  >  443 [ACK] Seq=3103 Ack=1 Win=1522 Len=1368 TSval=548229 TSecr=373277937 [TCP segment of a reassembled PDU]"
"43","2018-08-07 17:57:23.866544","192.168.2.3","216.58.197.4","TLSv1.2","287","Application Data"
"44","2018-08-07 17:57:23.867387","192.168.2.3","216.58.197.4","TCP","1434","49253  >  443 [ACK] Seq=4692 Ack=1 Win=1522 Len=1368 TSval=548229 TSecr=373277937 [TCP segment of a reassembled PDU]"
"45","2018-08-07 17:57:23.880738","192.168.2.3","216.58.197.4","TCP","1434","49253  >  443 [ACK] Seq=6060 Ack=1 Win=1522 Len=1368 TSval=548229 TSecr=373277937 [TCP segment of a reassembled PDU]"
"50","2018-08-07 17:57:23.901227","192.168.2.3","216.58.197.4","TLSv1.2","1434","Application Data [TCP segment of a reassembled PDU]"
"51","2018-08-07 17:57:23.901230","192.168.2.3","216.58.197.4","TLSv1.2","1434","Application Data [TCP segment of a reassembled PDU]"
"52","2018-08-07 17:57:23.901524","192.168.2.3","216.58.197.4","TCP","1434","49253  >  443 [ACK] Seq=10164 Ack=1 Win=1522 Len=1368 TSval=548232 TSecr=373317843 [TCP segment of a reassembled PDU]"
"53","2018-08-07 17:57:23.901765","192.168.2.3","216.58.197.4","TLSv1.2","1434","Application Data [TCP segment of a reassembled PDU]"
"54","2018-08-07 17:57:23.901999","192.168.2.3","216.58.197.4","TLSv1.2","1434","Application Data [TCP segment of a reassembled PDU]"
"55","2018-08-07 17:57:23.902002","192.168.2.3","216.58.197.4","TCP","1434","49253  >  443 [ACK] Seq=14268 Ack=1 Win=1522 Len=1368 TSval=548232 TSecr=373317843 [TCP segment of a reassembled PDU]"
"58","2018-08-07 17:57:23.916053","192.168.2.3","216.58.197.4","TLSv1.2","1434","Application Data [TCP segment of a reassembled PDU]"
"59","2018-08-07 17:57:23.916318","192.168.2.3","216.58.197.4","TLSv1.2","1434","Application Data [TCP segment of a reassembled PDU]"
"60","2018-08-07 17:57:23.916320","192.168.2.3","216.58.197.4","TCP","1434","49253  >  443 [ACK] Seq=18372 Ack=39 Win=1522 Len=1368 TSval=548234 TSecr=373317843 [TCP segment of a reassembled PDU]"
"61","2018-08-07 17:57:23.916488","192.168.2.3","216.58.197.4","TLSv1.2","1434","Application Data [TCP segment of a reassembled PDU]"
"62","2018-08-07 17:57:23.916794","192.168.2.3","216.58.197.4","TLSv1.2","1434","Application Data [TCP segment of a reassembled PDU]"
"63","2018-08-07 17:57:23.916796","192.168.2.3","216.58.197.4","TCP","1434","49253  >  443 [ACK] Seq=22476 Ack=39 Win=1522 Len=1368 TSval=548234 TSecr=373317850 [TCP segment of a reassembled PDU]"
"64","2018-08-07 17:57:23.917051","192.168.2.3","216.58.197.4","TLSv1.2","1434","Application Data [TCP segment of a reassembled PDU]"
"66","2018-08-07 17:57:23.934739","192.168.2.3","216.58.197.4","TLSv1.2","1434","Application Data [TCP segment of a reassembled PDU]"
"67","2018-08-07 17:57:23.934743","192.168.2.3","216.58.197.4","TCP","1434","49253  >  443 [ACK] Seq=26580 Ack=39 Win=1522 Len=1368 TSval=548236 TSecr=373317865 [TCP segment of a reassembled PDU]"
"68","2018-08-07 17:57:23.935120","192.168.2.3","216.58.197.4","TLSv1.2","1434","Application Data [TCP segment of a reassembled PDU]"
"72","2018-08-07 17:57:23.960146","192.168.2.3","216.58.197.4","TCP","1434","49253  >  443 [ACK] Seq=29316 Ack=39 Win=1522 Len=1368 TSval=548238 TSecr=373317896 [TCP segment of a reassembled PDU]"
"73","2018-08-07 17:57:23.960149","192.168.2.3","216.58.197.4","TLSv1.2","1434","Application Data [TCP segment of a reassembled PDU]"
"74","2018-08-07 17:57:23.960450","192.168.2.3","216.58.197.4","TCP","1434","49253  >  443 [ACK] Seq=32052 Ack=39 Win=1522 Len=1368 TSval=548238 TSecr=373317896 [TCP segment of a reassembled PDU]"
"75","2018-08-07 17:57:23.960452","192.168.2.3","216.58.197.4","TLSv1.2","1434","Application Data [TCP segment of a reassembled PDU]"
"76","2018-08-07 17:57:23.960671","192.168.2.3","216.58.197.4","TLSv1.2","1434","Application Data [TCP segment of a reassembled PDU]"
"81","2018-08-07 17:57:23.961041","192.168.2.3","216.58.197.4","TCP","1434","49253  >  443 [ACK] Seq=36156 Ack=39 Win=1522 Len=1368 TSval=548238 TSecr=373317898 [TCP segment of a reassembled PDU]"
"82","2018-08-07 17:57:23.962207","192.168.2.3","216.58.197.4","TLSv1.2","1434","Application Data [TCP segment of a reassembled PDU]"
"83","2018-08-07 17:57:23.962555","192.168.2.3","216.58.197.4","TLSv1.2","1434","Application Data [TCP segment of a reassembled PDU]"
"84","2018-08-07 17:57:23.962557","192.168.2.3","216.58.197.4","TCP","1434","49253  >  443 [ACK] Seq=40260 Ack=39 Win=1522 Len=1368 TSval=548238 TSecr=373317898 [TCP segment of a reassembled PDU]"
"85","2018-08-07 17:57:23.962594","192.168.2.3","216.58.197.4","TCP","1434","[TCP Fast Retransmission] 49253  >  443 [ACK] Seq=15636 Ack=39 Win=1522 Len=1368 TSval=548239 TSecr=373317909[Reassembly error, protocol TCP: New fragment overlaps old data (retransmission?)]"
"86","2018-08-07 17:57:23.963139","192.168.2.3","216.58.197.4","TCP","1434","[TCP Out-Of-Order] 49253  >  443 [ACK] Seq=17004 Ack=39 Win=1522 Len=1368 TSval=548239 TSecr=373317909[Reassembly error, protocol TCP: New fragment overlaps old data (retransmission?)]"
"87","2018-08-07 17:57:23.963498","192.168.2.3","216.58.197.4","TCP","1434","[TCP Out-Of-Order] 49253  >  443 [ACK] Seq=18372 Ack=39 Win=1522 Len=1368 TSval=548239 TSecr=373317909[Reassembly error, protocol TCP: New fragment overlaps old data (retransmission?)]"
"91","2018-08-07 17:57:23.975028","192.168.2.3","216.58.197.4","TLSv1.2","1434","Application Data [TCP segment of a reassembled PDU]"
"92","2018-08-07 17:57:23.975031","192.168.2.3","216.58.197.4","TLSv1.2","1434","Application Data [TCP segment of a reassembled PDU]"
"98","2018-08-07 17:57:23.997157","192.168.2.3","216.58.197.4","TCP","1434","49253  >  443 [ACK] Seq=44364 Ack=39 Win=1522 Len=1368 TSval=548242 TSecr=373317938 [TCP segment of a reassembled PDU]"
"99","2018-08-07 17:57:23.997160","192.168.2.3","216.58.197.4","TLSv1.2","1434","Application Data [TCP segment of a reassembled PDU]"
"107","2018-08-07 17:57:24.002773","192.168.2.3","216.58.197.4","TLSv1.2","1434","Application Data [TCP segment of a reassembled PDU]"
"108","2018-08-07 17:57:24.002776","192.168.2.3","216.58.197.4","TCP","1434","49253  >  443 [ACK] Seq=48468 Ack=39 Win=1522 Len=1368 TSval=548242 TSecr=373317938 [TCP segment of a reassembled PDU]"
"109","2018-08-07 17:57:24.003114","192.168.2.3","216.58.197.4","TLSv1.2","1434","Application Data [TCP segment of a reassembled PDU]"
"110","2018-08-07 17:57:24.003335","192.168.2.3","216.58.197.4","TLSv1.2","1434","Application Data [TCP segment of a reassembled PDU]"
"111","2018-08-07 17:57:24.005054","192.168.2.3","216.58.197.4","TCP","1434","49253  >  443 [ACK] Seq=52572 Ack=39 Win=1522 Len=1368 TSval=548243 TSecr=373317941 [TCP segment of a reassembled PDU]"
"112","2018-08-07 17:57:24.005057","192.168.2.3","216.58.197.4","TCP","1434","49253  >  443 [ACK] Seq=53940 Ack=39 Win=1522 Len=1368 TSval=548243 TSecr=373317941 [TCP segment of a reassembled PDU]"
"113","2018-08-07 17:57:24.005538","192.168.2.3","216.58.197.4","TLSv1.2","1434","Application Data, Application Data"
"114","2018-08-07 17:57:24.005923","192.168.2.3","216.58.197.4","TCP","1434","49253  >  443 [ACK] Seq=56676 Ack=39 Win=1522 Len=1368 TSval=548243 TSecr=373317941 [TCP segment of a reassembled PDU]"
"115","2018-08-07 17:57:24.008930","192.168.2.3","216.58.197.4","TLSv1.2","1434","Application Data [TCP segment of a reassembled PDU]"
"117","2018-08-07 17:57:24.037210","192.168.2.3","216.58.197.4","TLSv1.2","1434","Application Data [TCP segment of a reassembled PDU]"
"118","2018-08-07 17:57:24.037656","192.168.2.3","216.58.197.4","TCP","1434","49253  >  443 [ACK] Seq=60780 Ack=39 Win=1522 Len=1368 TSval=548246 TSecr=373317961 [TCP segment of a reassembled PDU]"
"121","2018-08-07 17:57:24.060344","192.168.2.3","216.58.197.4","TLSv1.2","1434","Application Data [TCP segment of a reassembled PDU]"
"122","2018-08-07 17:57:24.060347","192.168.2.3","216.58.197.4","TLSv1.2","1434","Application Data [TCP segment of a reassembled PDU]"
"123","2018-08-07 17:57:24.060532","192.168.2.3","216.58.197.4","TCP","1434","49253  >  443 [ACK] Seq=64884 Ack=39 Win=1522 Len=1368 TSval=548248 TSecr=373317999 [TCP segment of a reassembled PDU]"
"126","2018-08-07 17:57:24.071616","192.168.2.3","216.58.197.4","TCP","1434","[TCP Retransmission] 49253  >  443 [ACK] Seq=47100 Ack=39 Win=1522 Len=1368 TSval=548250 TSecr=373318006"
"127","2018-08-07 17:57:24.072058","192.168.2.3","216.58.197.4","TCP","1434","[TCP Retransmission] 49253  >  443 [ACK] Seq=48468 Ack=39 Win=1522 Len=1368 TSval=548250 TSecr=373318006"
"130","2018-08-07 17:57:24.104671","192.168.2.3","216.58.197.4","TCP","1434","[TCP Retransmission] 49253  >  443 [ACK] Seq=49836 Ack=39 Win=1522 Len=1368 TSval=548253 TSecr=373318024"
"131","2018-08-07 17:57:24.106660","192.168.2.3","216.58.197.4","TCP","1434","[TCP Retransmission] 49253  >  443 [PSH, ACK] Seq=51204 Ack=39 Win=1522 Len=1368 TSval=548253 TSecr=373318024"
"132","2018-08-07 17:57:24.107082","192.168.2.3","216.58.197.4","TCP","1434","[TCP Retransmission] 49253  >  443 [ACK] Seq=55308 Ack=39 Win=1522 Len=1368 TSval=548253 TSecr=373318024"
"136","2018-08-07 17:57:24.137515","192.168.2.3","216.58.197.4","TCP","1434","[TCP Retransmission] 49253  >  443 [ACK] Seq=56676 Ack=39 Win=1522 Len=1368 TSval=548256 TSecr=373318068"
"137","2018-08-07 17:57:24.137518","192.168.2.3","216.58.197.4","TCP","1434","[TCP Retransmission] 49253  >  443 [ACK] Seq=58044 Ack=39 Win=1522 Len=1368 TSval=548256 TSecr=373318068"
"138","2018-08-07 17:57:24.137782","192.168.2.3","216.58.197.4","TCP","1434","49253  >  443 [ACK] Seq=66252 Ack=39 Win=1522 Len=1368 TSval=548256 TSecr=373318068 [TCP segment of a reassembled PDU]"
"139","2018-08-07 17:57:24.137982","192.168.2.3","216.58.197.4","TLSv1.2","1434","Application Data [TCP segment of a reassembled PDU]"
"141","2018-08-07 17:57:24.165544","192.168.2.3","216.58.197.4","TLSv1.2","1434","Application Data [TCP segment of a reassembled PDU]"
"144","2018-08-07 17:57:24.172944","192.168.2.3","216.58.197.4","TCP","1434","49253  >  443 [ACK] Seq=70356 Ack=39 Win=1522 Len=1368 TSval=548260 TSecr=373318100 [TCP segment of a reassembled PDU]"
"145","2018-08-07 17:57:24.173352","192.168.2.3","216.58.197.4","TLSv1.2","1434","Application Data [TCP segment of a reassembled PDU]"
"150","2018-08-07 17:57:24.205821","192.168.2.3","216.58.197.4","TLSv1.2","333","Application Data"
"151","2018-08-07 17:57:24.206424","192.168.2.3","216.58.197.4","TCP","1434","[TCP Fast Retransmission] 49253  >  443 [ACK] Seq=47100 Ack=39 Win=1522 Len=1368 TSval=548263 TSecr=373318141[Reassembly error, protocol TCP: New fragment overlaps old data (retransmission?)]"
"152","2018-08-07 17:57:24.206986","192.168.2.3","216.58.197.4","TCP","1434","[TCP Out-Of-Order] 49253  >  443 [ACK] Seq=48468 Ack=39 Win=1522 Len=1368 TSval=548263 TSecr=373318141[Reassembly error, protocol TCP: New fragment overlaps old data (retransmission?)]"
"153","2018-08-07 17:57:24.232278","192.168.2.3","216.58.197.4","TCP","1434","49253  >  443 [ACK] Seq=73359 Ack=39 Win=1522 Len=1368 TSval=548266 TSecr=373318141 [TCP segment of a reassembled PDU]"
"154","2018-08-07 17:57:24.232755","192.168.2.3","216.58.197.4","TCP","1434","49253  >  443 [ACK] Seq=74727 Ack=39 Win=1522 Len=1368 TSval=548266 TSecr=373318141 [TCP segment of a reassembled PDU]"
"156","2018-08-07 17:57:24.244834","192.168.2.3","216.58.197.4","TLSv1.2","1434","Application Data [TCP segment of a reassembled PDU]"
"157","2018-08-07 17:57:24.244837","192.168.2.3","216.58.197.4","TLSv1.2","89","Application Data"
"167","2018-08-07 17:57:24.316929","192.168.2.3","216.58.197.4","TCP","66","49253  >  443 [ACK] Seq=77486 Ack=262 Win=1522 Len=0 TSval=548274 TSecr=373318278"
"168","2018-08-07 17:57:24.331767","192.168.2.3","216.58.197.4","TCP","1434","49253  >  443 [ACK] Seq=77486 Ack=479 Win=1522 Len=1368 TSval=548276 TSecr=373318278 [TCP segment of a reassembled PDU]"
"170","2018-08-07 17:57:24.332045","192.168.2.3","216.58.197.4","TCP","1434","49253  >  443 [ACK] Seq=78854 Ack=479 Win=1522 Len=1368 TSval=548276 TSecr=373318278 [TCP segment of a reassembled PDU]"
"171","2018-08-07 17:57:24.332047","192.168.2.3","216.58.197.4","TLSv1.2","212","Application Data"
"175","2018-08-07 17:57:24.337054","192.168.2.3","216.58.197.4","TCP","333","[TCP Fast Retransmission] 49253  >  443 [PSH, ACK] Seq=73092 Ack=735 Win=1522 Len=267 TSval=548276 TSecr=373318294[Reassembly error, protocol TCP: New fragment overlaps old data (retransmission?)]"
"176","2018-08-07 17:57:24.340966","192.168.2.3","216.58.197.4","TCP","1434","[TCP Retransmission] 49253  >  443 [ACK] Seq=76095 Ack=735 Win=1522 Len=1368 TSval=548277 TSecr=373318299"
"178","2018-08-07 17:57:24.341140","192.168.2.3","216.58.197.4","TCP","89","[TCP Retransmission] 49253  >  443 [PSH, ACK] Seq=77463 Ack=735 Win=1522 Len=23 TSval=548277 TSecr=373318299"
"179","2018-08-07 17:57:24.341510","192.168.2.3","216.58.197.4","TCP","1434","49253  >  443 [ACK] Seq=80368 Ack=735 Win=1522 Len=1368 TSval=548277 TSecr=373318299 [TCP segment of a reassembled PDU]"
"180","2018-08-07 17:57:24.342141","192.168.2.3","216.58.197.4","TLSv1.2","155","Application Data"
"185","2018-08-07 17:57:24.428658","192.168.2.3","216.58.197.4","TCP","1434","49253  >  443 [ACK] Seq=81825 Ack=735 Win=1522 Len=1368 TSval=548285 TSecr=373318309 [TCP segment of a reassembled PDU]"
"187","2018-08-07 17:57:24.429035","192.168.2.3","216.58.197.4","TCP","1434","49253  >  443 [ACK] Seq=83193 Ack=735 Win=1522 Len=1368 TSval=548285 TSecr=373318309 [TCP segment of a reassembled PDU]"
"188","2018-08-07 17:57:24.429037","192.168.2.3","216.58.197.4","TLSv1.2","212","Application Data"
"189","2018-08-07 17:57:24.429447","192.168.2.3","216.58.197.4","TCP","1434","49253  >  443 [ACK] Seq=84707 Ack=735 Win=1522 Len=1368 TSval=548285 TSecr=373318309 [TCP segment of a reassembled PDU]"
"190","2018-08-07 17:57:24.429449","192.168.2.3","216.58.197.4","TLSv1.2","155","Application Data"
"196","2018-08-07 17:57:24.470839","192.168.2.3","216.58.197.4","TCP","66","49253  >  443 [ACK] Seq=86164 Ack=922 Win=1522 Len=0 TSval=548290 TSecr=373318391"
"197","2018-08-07 17:57:24.530439","192.168.2.3","216.58.197.4","TCP","1434","49253  >  443 [ACK] Seq=86164 Ack=922 Win=1522 Len=1368 TSval=548295 TSecr=373318391 [TCP segment of a reassembled PDU]"
"198","2018-08-07 17:57:24.530882","192.168.2.3","216.58.197.4","TCP","1434","49253  >  443 [ACK] Seq=87532 Ack=922 Win=1522 Len=1368 TSval=548295 TSecr=373318391 [TCP segment of a reassembled PDU]"
"199","2018-08-07 17:57:24.530883","192.168.2.3","216.58.197.4","TLSv1.2","212","Application Data"
"200","2018-08-07 17:57:24.530884","192.168.2.3","216.58.197.4","TLSv1.2","1237","Application Data"
"206","2018-08-07 17:57:24.596173","192.168.2.3","216.58.197.4","TCP","66","49253  >  443 [ACK] Seq=90217 Ack=1210 Win=1522 Len=0 TSval=548302 TSecr=373318553"
"207","2018-08-07 17:57:24.644659","192.168.2.3","216.58.197.4","TCP","1434","49253  >  443 [ACK] Seq=90217 Ack=1210 Win=1522 Len=1368 TSval=548307 TSecr=373318553 [TCP segment of a reassembled PDU]"
"208","2018-08-07 17:57:24.645104","192.168.2.3","216.58.197.4","TCP","1434","49253  >  443 [ACK] Seq=91585 Ack=1210 Win=1522 Len=1368 TSval=548307 TSecr=373318553 [TCP segment of a reassembled PDU]"
"209","2018-08-07 17:57:24.645105","192.168.2.3","216.58.197.4","TLSv1.2","212","Application Data"
"210","2018-08-07 17:57:24.648028","192.168.2.3","216.58.197.4","TCP","1434","49253  >  443 [ACK] Seq=93099 Ack=1210 Win=1522 Len=1368 TSval=548307 TSecr=373318553 [TCP segment of a reassembled PDU]"
"211","2018-08-07 17:57:24.648404","192.168.2.3","216.58.197.4","TLSv1.2","155","Application Data"
"215","2018-08-07 17:57:24.744091","192.168.2.3","216.58.197.4","TCP","1434","49253  >  443 [ACK] Seq=94556 Ack=1210 Win=1522 Len=1368 TSval=548317 TSecr=373318615 [TCP segment of a reassembled PDU]"
"216","2018-08-07 17:57:24.744493","192.168.2.3","216.58.197.4","TCP","1434","49253  >  443 [ACK] Seq=95924 Ack=1210 Win=1522 Len=1368 TSval=548317 TSecr=373318615 [TCP segment of a reassembled PDU]"
"217","2018-08-07 17:57:24.744495","192.168.2.3","216.58.197.4","TLSv1.2","212","Application Data"
"218","2018-08-07 17:57:24.744610","192.168.2.3","216.58.197.4","TCP","1434","49253  >  443 [ACK] Seq=97438 Ack=1210 Win=1522 Len=1368 TSval=548317 TSecr=373318615 [TCP segment of a reassembled PDU]"
"219","2018-08-07 17:57:24.744612","192.168.2.3","216.58.197.4","TLSv1.2","155","Application Data"
"223","2018-08-07 17:57:24.843379","192.168.2.3","216.58.197.4","TCP","1434","49253  >  443 [ACK] Seq=98895 Ack=1210 Win=1522 Len=1368 TSval=548327 TSecr=373318711 [TCP segment of a reassembled PDU]"
"224","2018-08-07 17:57:24.844910","192.168.2.3","216.58.197.4","TCP","1434","49253  >  443 [ACK] Seq=100263 Ack=1210 Win=1522 Len=1368 TSval=548327 TSecr=373318711 [TCP segment of a reassembled PDU]"
"225","2018-08-07 17:57:24.845153","192.168.2.3","216.58.197.4","TLSv1.2","212","Application Data"
"226","2018-08-07 17:57:24.845154","192.168.2.3","216.58.197.4","TCP","1434","49253  >  443 [ACK] Seq=101777 Ack=1210 Win=1522 Len=1368 TSval=548327 TSecr=373318711 [TCP segment of a reassembled PDU]"
"227","2018-08-07 17:57:24.845323","192.168.2.3","216.58.197.4","TLSv1.2","155","Application Data"
"231","2018-08-07 17:57:24.940156","192.168.2.3","216.58.197.4","TCP","1434","49253  >  443 [ACK] Seq=103234 Ack=1210 Win=1522 Len=1368 TSval=548336 TSecr=373318812 [TCP segment of a reassembled PDU]"
"232","2018-08-07 17:57:24.940161","192.168.2.3","216.58.197.4","TCP","1434","49253  >  443 [ACK] Seq=104602 Ack=1210 Win=1522 Len=1368 TSval=548336 TSecr=373318812 [TCP segment of a reassembled PDU]"
"233","2018-08-07 17:57:24.940391","192.168.2.3","216.58.197.4","TLSv1.2","212","Application Data"
"234","2018-08-07 17:57:24.940394","192.168.2.3","216.58.197.4","TCP","1434","49253  >  443 [ACK] Seq=106116 Ack=1210 Win=1522 Len=1368 TSval=548336 TSecr=373318812 [TCP segment of a reassembled PDU]"
"235","2018-08-07 17:57:24.940453","192.168.2.3","216.58.197.4","TLSv1.2","155","Application Data"
"238","2018-08-07 17:57:25.029288","192.168.2.3","216.58.197.4","TCP","1434","49253  >  443 [ACK] Seq=107573 Ack=1210 Win=1522 Len=1368 TSval=548345 TSecr=373318907 [TCP segment of a reassembled PDU]"
"239","2018-08-07 17:57:25.029692","192.168.2.3","216.58.197.4","TCP","1434","49253  >  443 [ACK] Seq=108941 Ack=1210 Win=1522 Len=1368 TSval=548345 TSecr=373318907 [TCP segment of a reassembled PDU]"
"240","2018-08-07 17:57:25.029694","192.168.2.3","216.58.197.4","TLSv1.2","212","Application Data"
"241","2018-08-07 17:57:25.030099","192.168.2.3","216.58.197.4","TCP","1434","49253  >  443 [ACK] Seq=110455 Ack=1210 Win=1522 Len=1368 TSval=548345 TSecr=373318907 [TCP segment of a reassembled PDU]"
"242","2018-08-07 17:57:25.030102","192.168.2.3","216.58.197.4","TLSv1.2","155","Application Data"
"246","2018-08-07 17:57:25.126193","192.168.2.3","216.58.197.4","TCP","1434","49253  >  443 [ACK] Seq=111912 Ack=1210 Win=1522 Len=1368 TSval=548355 TSecr=373318997 [TCP segment of a reassembled PDU]"
"247","2018-08-07 17:57:25.126197","192.168.2.3","216.58.197.4","TCP","1434","49253  >  443 [ACK] Seq=113280 Ack=1210 Win=1522 Len=1368 TSval=548355 TSecr=373318997 [TCP segment of a reassembled PDU]"
"248","2018-08-07 17:57:25.126198","192.168.2.3","216.58.197.4","TLSv1.2","212","Application Data"
"249","2018-08-07 17:57:25.126375","192.168.2.3","216.58.197.4","TCP","1434","49253  >  443 [ACK] Seq=114794 Ack=1210 Win=1522 Len=1368 TSval=548355 TSecr=373318997 [TCP segment of a reassembled PDU]"
"250","2018-08-07 17:57:25.129864","192.168.2.3","216.58.197.4","TLSv1.2","155","Application Data"
"256","2018-08-07 17:57:25.196636","192.168.2.3","216.58.197.4","TCP","66","49253  >  443 [ACK] Seq=116251 Ack=1476 Win=1522 Len=0 TSval=548362 TSecr=373319158"
"257","2018-08-07 17:57:25.196639","192.168.2.3","216.58.197.4","TCP","66","49253  >  443 [ACK] Seq=116251 Ack=1712 Win=1522 Len=0 TSval=548362 TSecr=373319158"
"258","2018-08-07 17:57:25.199297","192.168.2.3","216.58.197.4","TCP","1434","49253  >  443 [ACK] Seq=116251 Ack=1712 Win=1522 Len=1368 TSval=548362 TSecr=373319158 [TCP segment of a reassembled PDU]"
"259","2018-08-07 17:57:25.199713","192.168.2.3","216.58.197.4","TCP","1434","49253  >  443 [ACK] Seq=117619 Ack=1712 Win=1522 Len=1368 TSval=548362 TSecr=373319158 [TCP segment of a reassembled PDU]"
"260","2018-08-07 17:57:25.199715","192.168.2.3","216.58.197.4","TLSv1.2","212","Application Data"
"261","2018-08-07 17:57:25.200116","192.168.2.3","216.58.197.4","TCP","1434","49253  >  443 [ACK] Seq=119133 Ack=1712 Win=1522 Len=1368 TSval=548362 TSecr=373319158 [TCP segment of a reassembled PDU]"
"262","2018-08-07 17:57:25.200118","192.168.2.3","216.58.197.4","TLSv1.2","155","Application Data"
"266","2018-08-07 17:57:25.291865","192.168.2.3","216.58.197.4","TCP","1434","49253  >  443 [ACK] Seq=120590 Ack=1712 Win=1522 Len=1368 TSval=548372 TSecr=373319167 [TCP segment of a reassembled PDU]"
"267","2018-08-07 17:57:25.292264","192.168.2.3","216.58.197.4","TCP","1434","49253  >  443 [ACK] Seq=121958 Ack=1712 Win=1522 Len=1368 TSval=548372 TSecr=373319167 [TCP segment of a reassembled PDU]"
"268","2018-08-07 17:57:25.292267","192.168.2.3","216.58.197.4","TLSv1.2","212","Application Data"
"269","2018-08-07 17:57:25.292643","192.168.2.3","216.58.197.4","TCP","1434","49253  >  443 [ACK] Seq=123472 Ack=1712 Win=1522 Len=1368 TSval=548372 TSecr=373319167 [TCP segment of a reassembled PDU]"
"270","2018-08-07 17:57:25.292646","192.168.2.3","216.58.197.4","TLSv1.2","155","Application Data"
"276","2018-08-07 17:57:25.332954","192.168.2.3","216.58.197.4","TCP","66","49253  >  443 [ACK] Seq=124929 Ack=2136 Win=1522 Len=0 TSval=548376 TSecr=373319278"
"279","2018-08-07 17:57:25.348958","192.168.2.3","216.58.197.4","TCP","66","49253  >  443 [ACK] Seq=124929 Ack=2579 Win=1522 Len=0 TSval=548377 TSecr=373319307"
"280","2018-08-07 17:57:25.387993","192.168.2.3","216.58.197.4","TCP","1434","49253  >  443 [ACK] Seq=124929 Ack=2579 Win=1522 Len=1368 TSval=548381 TSecr=373319307 [TCP segment of a reassembled PDU]"
"281","2018-08-07 17:57:25.388353","192.168.2.3","216.58.197.4","TCP","1434","49253  >  443 [ACK] Seq=126297 Ack=2579 Win=1522 Len=1368 TSval=548381 TSecr=373319307 [TCP segment of a reassembled PDU]"
"282","2018-08-07 17:57:25.388356","192.168.2.3","216.58.197.4","TLSv1.2","212","Application Data"
"283","2018-08-07 17:57:25.388838","192.168.2.3","216.58.197.4","TCP","1434","49253  >  443 [ACK] Seq=127811 Ack=2579 Win=1522 Len=1368 TSval=548381 TSecr=373319307 [TCP segment of a reassembled PDU]"
"284","2018-08-07 17:57:25.388841","192.168.2.3","216.58.197.4","TLSv1.2","155","Application Data"
"288","2018-08-07 17:57:25.478920","192.168.2.3","216.58.197.4","TCP","1434","49253  >  443 [ACK] Seq=129268 Ack=2579 Win=1522 Len=1368 TSval=548390 TSecr=373319396 [TCP segment of a reassembled PDU]"
"289","2018-08-07 17:57:25.478924","192.168.2.3","216.58.197.4","TCP","1434","49253  >  443 [ACK] Seq=130636 Ack=2579 Win=1522 Len=1368 TSval=548390 TSecr=373319396 [TCP segment of a reassembled PDU]"
"290","2018-08-07 17:57:25.479125","192.168.2.3","216.58.197.4","TLSv1.2","212","Application Data"
"291","2018-08-07 17:57:25.479128","192.168.2.3","216.58.197.4","TCP","1434","49253  >  443 [ACK] Seq=132150 Ack=2579 Win=1522 Len=1368 TSval=548390 TSecr=373319396 [TCP segment of a reassembled PDU]"
"292","2018-08-07 17:57:25.479262","192.168.2.3","216.58.197.4","TLSv1.2","155","Application Data"
"297","2018-08-07 17:57:25.536505","192.168.2.3","216.58.197.4","TCP","66","49253  >  443 [ACK] Seq=133607 Ack=2944 Win=1522 Len=0 TSval=548396 TSecr=373319496"
"298","2018-08-07 17:57:25.584538","192.168.2.3","216.58.197.4","TCP","1434","49253  >  443 [ACK] Seq=133607 Ack=2944 Win=1522 Len=1368 TSval=548400 TSecr=373319496 [TCP segment of a reassembled PDU]"
"299","2018-08-07 17:57:25.584543","192.168.2.3","216.58.197.4","TCP","1434","49253  >  443 [ACK] Seq=134975 Ack=2944 Win=1522 Len=1368 TSval=548400 TSecr=373319496 [TCP segment of a reassembled PDU]"
"300","2018-08-07 17:57:25.584544","192.168.2.3","216.58.197.4","TLSv1.2","212","Application Data"
"301","2018-08-07 17:57:25.584617","192.168.2.3","216.58.197.4","TCP","1434","49253  >  443 [ACK] Seq=136489 Ack=2944 Win=1522 Len=1368 TSval=548400 TSecr=373319496 [TCP segment of a reassembled PDU]"
"302","2018-08-07 17:57:25.584788","192.168.2.3","216.58.197.4","TLSv1.2","155","Application Data"
"305","2018-08-07 17:57:25.695319","192.168.2.3","216.58.197.4","TCP","1434","49253  >  443 [ACK] Seq=137946 Ack=2944 Win=1522 Len=1368 TSval=548410 TSecr=373319551 [TCP segment of a reassembled PDU]"
"306","2018-08-07 17:57:25.695325","192.168.2.3","216.58.197.4","TCP","1434","49253  >  443 [ACK] Seq=139314 Ack=2944 Win=1522 Len=1368 TSval=548410 TSecr=373319551 [TCP segment of a reassembled PDU]"
"307","2018-08-07 17:57:25.695326","192.168.2.3","216.58.197.4","TLSv1.2","212","Application Data"
"308","2018-08-07 17:57:25.695618","192.168.2.3","216.58.197.4","TCP","1434","49253  >  443 [ACK] Seq=140828 Ack=2944 Win=1522 Len=1368 TSval=548410 TSecr=373319551 [TCP segment of a reassembled PDU]"
"309","2018-08-07 17:57:25.695622","192.168.2.3","216.58.197.4","TLSv1.2","155","Application Data"
"313","2018-08-07 17:57:25.774770","192.168.2.3","216.58.197.4","TCP","1434","49253  >  443 [ACK] Seq=142285 Ack=2944 Win=1522 Len=1368 TSval=548420 TSecr=373319663 [TCP segment of a reassembled PDU]"
"314","2018-08-07 17:57:25.774774","192.168.2.3","216.58.197.4","TCP","1434","49253  >  443 [ACK] Seq=143653 Ack=2944 Win=1522 Len=1368 TSval=548420 TSecr=373319663 [TCP segment of a reassembled PDU]"
"315","2018-08-07 17:57:25.774960","192.168.2.3","216.58.197.4","TLSv1.2","212","Application Data"
"316","2018-08-07 17:57:25.775201","192.168.2.3","216.58.197.4","TCP","1434","49253  >  443 [ACK] Seq=145167 Ack=2944 Win=1522 Len=1368 TSval=548420 TSecr=373319663 [TCP segment of a reassembled PDU]"
"317","2018-08-07 17:57:25.775203","192.168.2.3","216.58.197.4","TLSv1.2","155","Application Data"
"323","2018-08-07 17:57:25.861631","192.168.2.3","216.58.197.4","TCP","66","49253  >  443 [ACK] Seq=146624 Ack=3276 Win=1522 Len=0 TSval=548428 TSecr=373319791"
"325","2018-08-07 17:57:25.868325","192.168.2.3","216.58.197.4","TCP","1434","49253  >  443 [ACK] Seq=146624 Ack=3276 Win=1522 Len=1368 TSval=548429 TSecr=373319791 [TCP segment of a reassembled PDU]"
"326","2018-08-07 17:57:25.868441","192.168.2.3","216.58.197.4","TCP","1434","49253  >  443 [ACK] Seq=147992 Ack=3276 Win=1522 Len=1368 TSval=548429 TSecr=373319791 [TCP segment of a reassembled PDU]"
"327","2018-08-07 17:57:25.868442","192.168.2.3","216.58.197.4","TLSv1.2","212","Application Data"
"328","2018-08-07 17:57:25.868668","192.168.2.3","216.58.197.4","TCP","1434","49253  >  443 [ACK] Seq=149506 Ack=3276 Win=1522 Len=1368 TSval=548429 TSecr=373319791 [TCP segment of a reassembled PDU]"
"329","2018-08-07 17:57:25.868784","192.168.2.3","216.58.197.4","TLSv1.2","155","Application Data"
"331","2018-08-07 17:57:25.899386","192.168.2.3","216.58.197.4","TCP","78","[TCP Dup ACK 323#1] 49253  >  443 [ACK] Seq=150963 Ack=3276 Win=1522 Len=0 TSval=548432 TSecr=373319826 SLE=3158 SRE=3276"
"334","2018-08-07 17:57:25.927480","192.168.2.3","216.58.197.4","TCP","66","49253  >  443 [ACK] Seq=150963 Ack=3781 Win=1522 Len=0 TSval=548435 TSecr=373319888"
"335","2018-08-07 17:57:25.990973","192.168.2.3","216.58.197.4","TCP","1434","49253  >  443 [ACK] Seq=150963 Ack=3781 Win=1522 Len=1368 TSval=548441 TSecr=373319888 [TCP segment of a reassembled PDU]"
"336","2018-08-07 17:57:25.991281","192.168.2.3","216.58.197.4","TCP","1434","49253  >  443 [ACK] Seq=152331 Ack=3781 Win=1522 Len=1368 TSval=548441 TSecr=373319888 [TCP segment of a reassembled PDU]"
"337","2018-08-07 17:57:25.991283","192.168.2.3","216.58.197.4","TLSv1.2","212","Application Data"
"338","2018-08-07 17:57:25.991283","192.168.2.3","216.58.197.4","TCP","1434","49253  >  443 [ACK] Seq=153845 Ack=3781 Win=1522 Len=1368 TSval=548441 TSecr=373319888 [TCP segment of a reassembled PDU]"
"339","2018-08-07 17:57:25.991436","192.168.2.3","216.58.197.4","TLSv1.2","155","Application Data"
"343","2018-08-07 17:57:26.085061","192.168.2.3","216.58.197.4","TCP","1434","49253  >  443 [ACK] Seq=155302 Ack=3781 Win=1522 Len=1368 TSval=548451 TSecr=373319958 [TCP segment of a reassembled PDU]"
"344","2018-08-07 17:57:26.085323","192.168.2.3","216.58.197.4","TCP","1434","49253  >  443 [ACK] Seq=156670 Ack=3781 Win=1522 Len=1368 TSval=548451 TSecr=373319958 [TCP segment of a reassembled PDU]"
"345","2018-08-07 17:57:26.085494","192.168.2.3","216.58.197.4","TLSv1.2","212","Application Data"
"346","2018-08-07 17:57:26.085671","192.168.2.3","216.58.197.4","TCP","1434","49253  >  443 [ACK] Seq=158184 Ack=3781 Win=1522 Len=1368 TSval=548451 TSecr=373319958 [TCP segment of a reassembled PDU]"
"347","2018-08-07 17:57:26.085673","192.168.2.3","216.58.197.4","TLSv1.2","155","Application Data"
"352","2018-08-07 17:57:26.143914","192.168.2.3","216.58.197.4","TCP","66","49253  >  443 [ACK] Seq=159641 Ack=4107 Win=1522 Len=0 TSval=548457 TSecr=373320101"
"353","2018-08-07 17:57:26.186233","192.168.2.3","216.58.197.4","TCP","1434","49253  >  443 [ACK] Seq=159641 Ack=4107 Win=1522 Len=1368 TSval=548461 TSecr=373320101 [TCP segment of a reassembled PDU]"
"354","2018-08-07 17:57:26.186237","192.168.2.3","216.58.197.4","TCP","1434","49253  >  443 [ACK] Seq=161009 Ack=4107 Win=1522 Len=1368 TSval=548461 TSecr=373320101 [TCP segment of a reassembled PDU]"
"355","2018-08-07 17:57:26.186238","192.168.2.3","216.58.197.4","TLSv1.2","212","Application Data"
"356","2018-08-07 17:57:26.186667","192.168.2.3","216.58.197.4","TCP","1434","49253  >  443 [ACK] Seq=162523 Ack=4107 Win=1522 Len=1368 TSval=548461 TSecr=373320101 [TCP segment of a reassembled PDU]"
"357","2018-08-07 17:57:26.186669","192.168.2.3","216.58.197.4","TLSv1.2","155","Application Data"
"362","2018-08-07 17:57:26.271481","192.168.2.3","216.58.197.4","TCP","66","49253  >  443 [ACK] Seq=163980 Ack=4357 Win=1522 Len=0 TSval=548470 TSecr=373320232"
"363","2018-08-07 17:57:26.283702","192.168.2.3","216.58.197.4","TCP","1434","49253  >  443 [ACK] Seq=163980 Ack=4357 Win=1522 Len=1368 TSval=548471 TSecr=373320232 [TCP segment of a reassembled PDU]"
"364","2018-08-07 17:57:26.286898","192.168.2.3","216.58.197.4","TCP","1434","49253  >  443 [ACK] Seq=165348 Ack=4357 Win=1522 Len=1368 TSval=548471 TSecr=373320232 [TCP segment of a reassembled PDU]"
"365","2018-08-07 17:57:26.286901","192.168.2.3","216.58.197.4","TLSv1.2","212","Application Data"
"366","2018-08-07 17:57:26.286902","192.168.2.3","216.58.197.4","TLSv1.2","1179","Application Data"
"371","2018-08-07 17:57:26.335697","192.168.2.3","216.58.197.4","TCP","66","49253  >  443 [ACK] Seq=167975 Ack=4628 Win=1522 Len=0 TSval=548476 TSecr=373320278"
"372","2018-08-07 17:57:26.382641","192.168.2.3","216.58.197.4","TCP","1434","49253  >  443 [ACK] Seq=167975 Ack=4628 Win=1522 Len=1368 TSval=548480 TSecr=373320278 [TCP segment of a reassembled PDU]"
"373","2018-08-07 17:57:26.382643","192.168.2.3","216.58.197.4","TCP","1434","49253  >  443 [ACK] Seq=169343 Ack=4628 Win=1522 Len=1368 TSval=548480 TSecr=373320278 [TCP segment of a reassembled PDU]"
"374","2018-08-07 17:57:26.382644","192.168.2.3","216.58.197.4","TLSv1.2","212","Application Data"
"375","2018-08-07 17:57:26.382951","192.168.2.3","216.58.197.4","TCP","1434","49253  >  443 [ACK] Seq=170857 Ack=4628 Win=1522 Len=1368 TSval=548481 TSecr=373320278 [TCP segment of a reassembled PDU]"
"376","2018-08-07 17:57:26.382952","192.168.2.3","216.58.197.4","TLSv1.2","155","Application Data"
"381","2018-08-07 17:57:26.433693","192.168.2.3","216.58.197.4","TCP","66","49253  >  443 [ACK] Seq=172314 Ack=4950 Win=1522 Len=0 TSval=548486 TSecr=373320394"
"382","2018-08-07 17:57:26.497121","192.168.2.3","216.58.197.4","TCP","1434","49253  >  443 [ACK] Seq=172314 Ack=4950 Win=1522 Len=1368 TSval=548491 TSecr=373320394 [TCP segment of a reassembled PDU]"
"383","2018-08-07 17:57:26.497126","192.168.2.3","216.58.197.4","TCP","1434","49253  >  443 [ACK] Seq=173682 Ack=4950 Win=1522 Len=1368 TSval=548491 TSecr=373320394 [TCP segment of a reassembled PDU]"
"384","2018-08-07 17:57:26.497127","192.168.2.3","216.58.197.4","TLSv1.2","212","Application Data"
"385","2018-08-07 17:57:26.497247","192.168.2.3","216.58.197.4","TCP","1434","49253  >  443 [ACK] Seq=175196 Ack=4950 Win=1522 Len=1368 TSval=548491 TSecr=373320394 [TCP segment of a reassembled PDU]"
"386","2018-08-07 17:57:26.497481","192.168.2.3","216.58.197.4","TLSv1.2","125","Application Data"
"390","2018-08-07 17:57:26.552816","192.168.2.3","216.58.197.4","TCP","66","49253  >  443 [ACK] Seq=176623 Ack=5286 Win=1522 Len=0 TSval=548497 TSecr=373320509"
"391","2018-08-07 17:57:26.597168","192.168.2.3","216.58.197.4","TCP","1434","49253  >  443 [ACK] Seq=176623 Ack=5286 Win=1522 Len=1368 TSval=548502 TSecr=373320509 [TCP segment of a reassembled PDU]"
"392","2018-08-07 17:57:26.597627","192.168.2.3","216.58.197.4","TCP","1434","49253  >  443 [ACK] Seq=177991 Ack=5286 Win=1522 Len=1368 TSval=548502 TSecr=373320509 [TCP segment of a reassembled PDU]"
"393","2018-08-07 17:57:26.597629","192.168.2.3","216.58.197.4","TLSv1.2","212","Application Data"
"394","2018-08-07 17:57:26.597951","192.168.2.3","216.58.197.4","TLSv1.2","1305","Application Data"
"397","2018-08-07 17:57:26.696222","192.168.2.3","216.58.197.4","TCP","1434","49253  >  443 [ACK] Seq=180744 Ack=5286 Win=1522 Len=1368 TSval=548512 TSecr=373320565 [TCP segment of a reassembled PDU]"
"398","2018-08-07 17:57:26.696226","192.168.2.3","216.58.197.4","TCP","1434","49253  >  443 [ACK] Seq=182112 Ack=5286 Win=1522 Len=1368 TSval=548512 TSecr=373320565 [TCP segment of a reassembled PDU]"
"399","2018-08-07 17:57:26.696383","192.168.2.3","216.58.197.4","TLSv1.2","212","Application Data"
"400","2018-08-07 17:57:26.696654","192.168.2.3","216.58.197.4","TCP","1434","49253  >  443 [ACK] Seq=183626 Ack=5286 Win=1522 Len=1368 TSval=548512 TSecr=373320565 [TCP segment of a reassembled PDU]"
"401","2018-08-07 17:57:26.696656","192.168.2.3","216.58.197.4","TLSv1.2","155","Application Data"
"405","2018-08-07 17:57:26.795362","192.168.2.3","216.58.197.4","TCP","1434","49253  >  443 [ACK] Seq=185083 Ack=5286 Win=1522 Len=1368 TSval=548522 TSecr=373320704 [TCP segment of a reassembled PDU]"
"406","2018-08-07 17:57:26.795682","192.168.2.3","216.58.197.4","TCP","1434","49253  >  443 [ACK] Seq=186451 Ack=5286 Win=1522 Len=1368 TSval=548522 TSecr=373320704 [TCP segment of a reassembled PDU]"
"407","2018-08-07 17:57:26.795684","192.168.2.3","216.58.197.4","TLSv1.2","212","Application Data"
"408","2018-08-07 17:57:26.795848","192.168.2.3","216.58.197.4","TCP","1434","49253  >  443 [ACK] Seq=187965 Ack=5286 Win=1522 Len=1368 TSval=548522 TSecr=373320704 [TCP segment of a reassembled PDU]"
"409","2018-08-07 17:57:26.795849","192.168.2.3","216.58.197.4","TLSv1.2","155","Application Data"
"415","2018-08-07 17:57:26.854192","192.168.2.3","216.58.197.4","TCP","66","49253  >  443 [ACK] Seq=189422 Ack=5863 Win=1522 Len=0 TSval=548527 TSecr=373320811"
"418","2018-08-07 17:57:26.876770","192.168.2.3","216.58.197.4","TCP","66","49253  >  443 [ACK] Seq=189422 Ack=6463 Win=1522 Len=0 TSval=548530 TSecr=373320837"
"419","2018-08-07 17:57:26.903640","192.168.2.3","216.58.197.4","TCP","1434","49253  >  443 [ACK] Seq=189422 Ack=6463 Win=1522 Len=1368 TSval=548533 TSecr=373320837 [TCP segment of a reassembled PDU]"
"420","2018-08-07 17:57:26.903972","192.168.2.3","216.58.197.4","TCP","1434","49253  >  443 [ACK] Seq=190790 Ack=6463 Win=1522 Len=1368 TSval=548533 TSecr=373320837 [TCP segment of a reassembled PDU]"
"421","2018-08-07 17:57:26.903974","192.168.2.3","216.58.197.4","TLSv1.2","212","Application Data"
"422","2018-08-07 17:57:26.904452","192.168.2.3","216.58.197.4","TCP","1434","49253  >  443 [ACK] Seq=192304 Ack=6463 Win=1522 Len=1368 TSval=548533 TSecr=373320837 [TCP segment of a reassembled PDU]"
"423","2018-08-07 17:57:26.904454","192.168.2.3","216.58.197.4","TLSv1.2","155","Application Data"
"424","2018-08-07 17:57:26.904455","192.168.2.3","216.58.197.4","TLSv1.2","332","Application Data"
"425","2018-08-07 17:57:26.904456","192.168.2.3","216.58.197.4","TLSv1.2","102","Application Data"
"431","2018-08-07 17:57:27.335054","192.168.2.3","216.58.197.4","TCP","66","49253  >  443 [ACK] Seq=194063 Ack=6829 Win=1522 Len=0 TSval=548576 TSecr=373321278"
"434","2018-08-07 17:57:28.335282","192.168.2.3","216.58.197.4","TCP","66","49253  >  443 [ACK] Seq=194063 Ack=7143 Win=1522 Len=0 TSval=548676 TSecr=373322279"
"438","2018-08-07 17:57:28.372913","192.168.2.3","216.58.197.4","TCP","66","49253  >  443 [ACK] Seq=194063 Ack=8684 Win=1512 Len=0 TSval=548680 TSecr=373322302"
"439","2018-08-07 17:57:28.410718","192.168.2.3","216.58.197.4","TCP","66","49253  >  443 [ACK] Seq=194063 Ack=8839 Win=1522 Len=0 TSval=548684 TSecr=373322332"
"444","2018-08-07 17:57:28.542516","192.168.2.3","216.58.197.4","TCP","66","49253  >  443 [ACK] Seq=194063 Ack=10774 Win=1512 Len=0 TSval=548697 TSecr=373322502"
"445","2018-08-07 17:57:28.542965","192.168.2.3","216.58.197.4","TCP","66","49253  >  443 [ACK] Seq=194063 Ack=12192 Win=1512 Len=0 TSval=548697 TSecr=373322502"
"446","2018-08-07 17:57:28.543358","192.168.2.3","216.58.197.4","TCP","66","49253  >  443 [ACK] Seq=194063 Ack=12506 Win=1512 Len=0 TSval=548697 TSecr=373322502"
"451","2018-08-07 17:57:28.545328","192.168.2.3","216.58.197.4","TCP","66","49253  >  443 [ACK] Seq=194063 Ack=13924 Win=1512 Len=0 TSval=548697 TSecr=373322506"
"452","2018-08-07 17:57:28.545331","192.168.2.3","216.58.197.4","TCP","66","49253  >  443 [ACK] Seq=194063 Ack=14405 Win=1512 Len=0 TSval=548697 TSecr=373322506"
"453","2018-08-07 17:57:28.545689","192.168.2.3","216.58.197.4","TCP","66","49253  >  443 [ACK] Seq=194063 Ack=15823 Win=1512 Len=0 TSval=548697 TSecr=373322506"
"454","2018-08-07 17:57:28.545692","192.168.2.3","216.58.197.4","TCP","66","49253  >  443 [ACK] Seq=194063 Ack=16228 Win=1512 Len=0 TSval=548697 TSecr=373322506"
"459","2018-08-07 17:57:28.548300","192.168.2.3","216.58.197.4","TCP","66","49253  >  443 [ACK] Seq=194063 Ack=17646 Win=1512 Len=0 TSval=548697 TSecr=373322509"
"462","2018-08-07 17:57:28.551340","192.168.2.3","216.58.197.4","TCP","66","49253  >  443 [ACK] Seq=194063 Ack=17925 Win=1512 Len=0 TSval=548697 TSecr=373322509"
"463","2018-08-07 17:57:28.551342","192.168.2.3","216.58.197.4","TCP","66","49253  >  443 [ACK] Seq=194063 Ack=19343 Win=1512 Len=0 TSval=548697 TSecr=373322509"
"464","2018-08-07 17:57:28.551343","192.168.2.3","216.58.197.4","TCP","66","49253  >  443 [ACK] Seq=194063 Ack=19823 Win=1512 Len=0 TSval=548697 TSecr=373322509"
"465","2018-08-07 17:57:28.552801","192.168.2.3","216.58.197.4","TCP","66","49253  >  443 [ACK] Seq=194063 Ack=21241 Win=1512 Len=0 TSval=548698 TSecr=373322512"
"466","2018-08-07 17:57:28.553065","192.168.2.3","216.58.197.4","TCP","66","49253  >  443 [ACK] Seq=194063 Ack=21616 Win=1522 Len=0 TSval=548698 TSecr=373322512"
"473","2018-08-07 17:57:28.578351","192.168.2.3","216.58.197.4","TCP","66","49253  >  443 [ACK] Seq=194063 Ack=23486 Win=1522 Len=0 TSval=548700 TSecr=373322537"
"474","2018-08-07 17:57:28.578996","192.168.2.3","216.58.197.4","TCP","66","49253  >  443 [ACK] Seq=194063 Ack=27094 Win=1522 Len=0 TSval=548700 TSecr=373322537"
"486","2018-08-07 17:57:28.584596","192.168.2.3","216.58.197.4","TCP","66","49253  >  443 [ACK] Seq=194063 Ack=28789 Win=1522 Len=0 TSval=548701 TSecr=373322544"
"487","2018-08-07 17:57:28.585216","192.168.2.3","216.58.197.4","TCP","66","49253  >  443 [ACK] Seq=194063 Ack=35684 Win=1522 Len=0 TSval=548701 TSecr=373322544"
"494","2018-08-07 17:57:28.589015","192.168.2.3","216.58.197.4","TCP","66","49253  >  443 [ACK] Seq=194063 Ack=37609 Win=1522 Len=0 TSval=548701 TSecr=373322546"
"503","2018-08-07 17:57:28.592720","192.168.2.3","216.58.197.4","TCP","66","49253  >  443 [ACK] Seq=194063 Ack=39386 Win=1522 Len=0 TSval=548702 TSecr=373322548"
"510","2018-08-07 17:57:28.602830","192.168.2.3","216.58.197.4","TCP","66","49253  >  443 [ACK] Seq=194063 Ack=41084 Win=1522 Len=0 TSval=548702 TSecr=373322548"
"511","2018-08-07 17:57:28.602835","192.168.2.3","216.58.197.4","TCP","66","49253  >  443 [ACK] Seq=194063 Ack=44692 Win=1522 Len=0 TSval=548702 TSecr=373322550"
"512","2018-08-07 17:57:28.602835","192.168.2.3","216.58.197.4","TCP","66","49253  >  443 [ACK] Seq=194063 Ack=50266 Win=1522 Len=0 TSval=548702 TSecr=373322551"
"513","2018-08-07 17:57:28.602836","192.168.2.3","216.58.197.4","TCP","66","49253  >  443 [ACK] Seq=194063 Ack=52040 Win=1522 Len=0 TSval=548703 TSecr=373322555"
"529","2018-08-07 17:57:28.615016","192.168.2.3","216.58.197.4","TCP","66","49253  >  443 [ACK] Seq=194063 Ack=65407 Win=1522 Len=0 TSval=548704 TSecr=373322557"
"530","2018-08-07 17:57:28.627424","192.168.2.3","216.58.197.4","TLSv1.2","104","Application Data"
"532","2018-08-07 17:57:29.251142","192.168.2.3","172.217.27.174","TCP","66","52258  >  443 [ACK] Seq=1 Ack=1 Win=661 Len=0 TSval=548768 TSecr=2575722705"
"534","2018-08-07 17:57:35.875367","192.168.2.3","192.168.2.1","ICMP","98","Echo (ping) request  id=0x029a, seq=1/256, ttl=64 (reply in 535)"
"536","2018-08-07 17:57:36.601014","192.168.2.3","224.0.0.251","MDNS","82","Standard query 0x0000 PTR _googlecast._tcp.local, ""QM"" question"
"537","2018-08-07 17:57:36.602810","192.168.2.3","224.0.0.251","MDNS","437","Standard query response 0x0000 PTR Google-Home-d8ff63fb78680c8a1c8ccacd5fd7f560._googlecast._tcp.local TXT, cache flush SRV, cache flush 0 0 8009 d8ff63fb-7868-0c8a-1c8c-cacd5fd7f560.local A, cache flush 192.168.2.3"
"538","2018-08-07 17:57:36.603092","192.168.2.3","224.0.0.251","MDNS","82","Standard query 0x0000 PTR _googlezone._tcp.local, ""QM"" question"
"539","2018-08-07 17:57:36.613168","192.168.2.3","224.0.0.251","MDNS","119","Standard query 0x0000 SRV d8ff63fb-7868-0c8a-1c8c-cacd5fd7f560._googlezone._tcp.local, ""QM"" question"
"540","2018-08-07 17:57:36.613171","192.168.2.3","224.0.0.251","MDNS","321","Standard query response 0x0000 PTR d8ff63fb-7868-0c8a-1c8c-cacd5fd7f560._googlezone._tcp.local TXT, cache flush SRV, cache flush 210 70 10001 d8ff63fb-7868-0c8a-1c8c-cacd5fd7f560.local A, cache flush 192.168.2.3"
"541","2018-08-07 17:57:36.613171","192.168.2.3","224.0.0.251","MDNS","186","Standard query response 0x0000 SRV, cache flush 210 70 10001 d8ff63fb-7868-0c8a-1c8c-cacd5fd7f560.local A, cache flush 192.168.2.3"
"542","2018-08-07 17:57:36.883795","192.168.2.3","192.168.2.1","ICMP","98","Echo (ping) request  id=0x029a, seq=2/512, ttl=64 (reply in 543)"
"544","2018-08-07 17:57:36.920371","192.168.2.3","8.8.8.8","ICMP","98","Echo (ping) request  id=0x02a0, seq=1/256, ttl=64 (reply in 545)"
"546","2018-08-07 17:57:37.730952","192.168.2.3","108.177.125.188","TCP","66","50384  >  5228 [ACK] Seq=1 Ack=1 Win=262 Len=0 TSval=549616 TSecr=2744823497"
"548","2018-08-07 17:57:37.930960","192.168.2.3","8.8.8.8","ICMP","98","Echo (ping) request  id=0x02a0, seq=2/512, ttl=64 (reply in 549)"
"550","2018-08-07 17:57:37.944430","192.168.2.3","8.8.8.8","DNS","74","Standard query 0x118b A www.google.com"
"551","2018-08-07 17:57:37.944432","192.168.2.3","8.8.8.8","DNS","74","Standard query 0x3805 AAAA www.google.com"
"554","2018-08-07 17:57:39.993194","192.168.2.3","172.217.27.174","TLSv1.2","157","[TCP Previous segment not captured] , Application Data"
"555","2018-08-07 17:57:39.993199","192.168.2.3","172.217.27.174","TLSv1.2","104","Application Data"
"556","2018-08-07 17:57:39.993199","192.168.2.3","172.217.27.174","TLSv1.2","472","Application Data"
"561","2018-08-07 17:57:40.031283","192.168.2.3","172.217.27.174","TCP","66","52258  >  443 [ACK] Seq=537 Ack=39 Win=661 Len=0 TSval=549846 TSecr=2575778569"
"566","2018-08-07 17:57:40.077445","192.168.2.3","172.217.27.174","TCP","66","52258  >  443 [ACK] Seq=537 Ack=107 Win=661 Len=0 TSval=549850 TSecr=2575778646"
"567","2018-08-07 17:57:40.077449","192.168.2.3","172.217.27.174","TCP","66","52258  >  443 [ACK] Seq=537 Ack=340 Win=661 Len=0 TSval=549850 TSecr=2575778646"
"568","2018-08-07 17:57:40.077985","192.168.2.3","172.217.27.174","TCP","66","52258  >  443 [ACK] Seq=537 Ack=442 Win=661 Len=0 TSval=549850 TSecr=2575778646"
"569","2018-08-07 17:57:40.078295","192.168.2.3","172.217.27.174","TCP","66","52258  >  443 [ACK] Seq=537 Ack=480 Win=661 Len=0 TSval=549850 TSecr=2575778646"
"570","2018-08-07 17:57:40.079223","192.168.2.3","172.217.27.174","TLSv1.2","104","Application Data"
"572","2018-08-07 17:57:40.924125","192.168.2.3","172.217.27.174","TLSv1.2","160","Application Data"
"573","2018-08-07 17:57:40.924135","192.168.2.3","172.217.27.174","TLSv1.2","507","Application Data"
"580","2018-08-07 17:57:41.007478","192.168.2.3","172.217.27.174","TCP","66","52258  >  443 [ACK] Seq=1110 Ack=628 Win=661 Len=0 TSval=549943 TSecr=2575779576"
"581","2018-08-07 17:57:41.008313","192.168.2.3","172.217.27.174","TCP","66","52258  >  443 [ACK] Seq=1110 Ack=887 Win=661 Len=0 TSval=549943 TSecr=2575779576"
"582","2018-08-07 17:57:41.009043","192.168.2.3","172.217.27.174","TLSv1.2","104","Application Data"
"584","2018-08-07 17:57:42.014942","192.168.2.3","172.217.27.163","TCP","66","38971  >  443 [ACK] Seq=1 Ack=1 Win=406 Len=0 TSval=550044 TSecr=467566038"
"586","2018-08-07 17:57:49.731002","192.168.2.3","64.233.188.188","TCP","66","40306  >  5228 [ACK] Seq=1 Ack=1 Win=539 Len=0 TSval=550816 TSecr=3578757724"
