"No.","Time","Source","Destination","Protocol","Length","Info"
"3","2018-08-07 18:04:32.057183","192.168.2.3","172.217.27.174","TCP","66","52258  >  443 [ACK] Seq=1 Ack=1 Win=661 Len=0 TSval=591048 TSecr=2576145613"
"5","2018-08-07 18:04:32.553645","192.168.2.3","216.58.197.4","TLSv1.2","156","[TCP Previous segment not captured] , Application Data"
"6","2018-08-07 18:04:32.553857","192.168.2.3","216.58.197.4","TLSv1.2","104","Application Data"
"10","2018-08-07 18:04:32.560226","192.168.2.3","216.58.197.4","TLSv1.2","158","Application Data"
"11","2018-08-07 18:04:32.570466","192.168.2.3","216.58.197.4","TCP","1434","49253  >  443 [ACK] Seq=222 Ack=39 Win=1522 Len=1368 TSval=591098 TSecr=373746522 [TCP segment of a reassembled PDU]"
"12","2018-08-07 18:04:32.570865","192.168.2.3","216.58.197.4","TCP","1434","49253  >  443 [ACK] Seq=1590 Ack=39 Win=1522 Len=1368 TSval=591099 TSecr=373746522 [TCP segment of a reassembled PDU]"
"13","2018-08-07 18:04:32.570880","192.168.2.3","216.58.197.4","TLSv1.2","212","Application Data"
"14","2018-08-07 18:04:32.570881","192.168.2.3","216.58.197.4","TCP","1434","49253  >  443 [ACK] Seq=3104 Ack=39 Win=1522 Len=1368 TSval=591099 TSecr=373746522 [TCP segment of a reassembled PDU]"
"15","2018-08-07 18:04:32.570882","192.168.2.3","216.58.197.4","TLSv1.2","287","Application Data"
"16","2018-08-07 18:04:32.570958","192.168.2.3","216.58.197.4","TCP","1434","49253  >  443 [ACK] Seq=4693 Ack=39 Win=1522 Len=1368 TSval=591099 TSecr=373746522 [TCP segment of a reassembled PDU]"
"17","2018-08-07 18:04:32.571329","192.168.2.3","216.58.197.4","TCP","1434","49253  >  443 [ACK] Seq=6061 Ack=39 Win=1522 Len=1368 TSval=591099 TSecr=373746522 [TCP segment of a reassembled PDU]"
"18","2018-08-07 18:04:32.571332","192.168.2.3","216.58.197.4","TLSv1.2","212","Application Data"
"19","2018-08-07 18:04:32.571333","192.168.2.3","216.58.197.4","TCP","1434","49253  >  443 [ACK] Seq=7575 Ack=39 Win=1522 Len=1368 TSval=591099 TSecr=373746522 [TCP segment of a reassembled PDU]"
"25","2018-08-07 18:04:32.576857","192.168.2.3","216.58.197.4","TLSv1.2","1434","Application Data [TCP segment of a reassembled PDU]"
"26","2018-08-07 18:04:32.580886","192.168.2.3","216.58.197.4","TCP","1434","49253  >  443 [ACK] Seq=10311 Ack=39 Win=1522 Len=1368 TSval=591100 TSecr=373746539 [TCP segment of a reassembled PDU]"
"27","2018-08-07 18:04:32.581397","192.168.2.3","216.58.197.4","TLSv1.2","1434","Application Data [TCP segment of a reassembled PDU]"
"28","2018-08-07 18:04:32.581766","192.168.2.3","216.58.197.4","TLSv1.2","1434","Application Data [TCP segment of a reassembled PDU]"
"29","2018-08-07 18:04:32.581769","192.168.2.3","216.58.197.4","TCP","1434","49253  >  443 [ACK] Seq=14415 Ack=39 Win=1522 Len=1368 TSval=591100 TSecr=373746539 [TCP segment of a reassembled PDU]"
"30","2018-08-07 18:04:32.582030","192.168.2.3","216.58.197.4","TLSv1.2","1434","Application Data [TCP segment of a reassembled PDU]"
"31","2018-08-07 18:04:32.582522","192.168.2.3","216.58.197.4","TLSv1.2","1434","Application Data [TCP segment of a reassembled PDU]"
"32","2018-08-07 18:04:32.583005","192.168.2.3","216.58.197.4","TCP","1434","49253  >  443 [ACK] Seq=18519 Ack=39 Win=1522 Len=1368 TSval=591100 TSecr=373746539 [TCP segment of a reassembled PDU]"
"33","2018-08-07 18:04:32.583385","192.168.2.3","216.58.197.4","TLSv1.2","1434","Application Data [TCP segment of a reassembled PDU]"
"34","2018-08-07 18:04:32.583388","192.168.2.3","216.58.197.4","TLSv1.2","1434","Application Data [TCP segment of a reassembled PDU]"
"35","2018-08-07 18:04:32.583662","192.168.2.3","216.58.197.4","TCP","1434","49253  >  443 [ACK] Seq=22623 Ack=39 Win=1522 Len=1368 TSval=591100 TSecr=373746539 [TCP segment of a reassembled PDU]"
"36","2018-08-07 18:04:32.583775","192.168.2.3","216.58.197.4","TLSv1.2","1434","Application Data [TCP segment of a reassembled PDU]"
"37","2018-08-07 18:04:32.584063","192.168.2.3","216.58.197.4","TLSv1.2","1434","Application Data [TCP segment of a reassembled PDU]"
"38","2018-08-07 18:04:32.584066","192.168.2.3","216.58.197.4","TCP","1434","49253  >  443 [ACK] Seq=26727 Ack=39 Win=1522 Len=1368 TSval=591100 TSecr=373746539 [TCP segment of a reassembled PDU]"
"39","2018-08-07 18:04:32.584345","192.168.2.3","216.58.197.4","TLSv1.2","1434","Application Data [TCP segment of a reassembled PDU]"
"43","2018-08-07 18:04:32.587382","192.168.2.3","216.58.197.4","TLSv1.2","1434","Application Data [TCP segment of a reassembled PDU]"
"45","2018-08-07 18:04:32.587617","192.168.2.3","216.58.197.4","TCP","1434","49253  >  443 [ACK] Seq=30831 Ack=39 Win=1522 Len=1368 TSval=591101 TSecr=373746549 [TCP segment of a reassembled PDU]"
"50","2018-08-07 18:04:32.594110","192.168.2.3","216.58.197.4","TCP","1434","49253  >  443 [ACK] Seq=32199 Ack=39 Win=1522 Len=1368 TSval=591101 TSecr=373746549 [TCP segment of a reassembled PDU]"
"51","2018-08-07 18:04:32.594290","192.168.2.3","216.58.197.4","TLSv1.2","1434","Application Data [TCP segment of a reassembled PDU]"
"52","2018-08-07 18:04:32.594697","192.168.2.3","216.58.197.4","TLSv1.2","1434","Application Data [TCP segment of a reassembled PDU]"
"53","2018-08-07 18:04:32.594699","192.168.2.3","216.58.197.4","TCP","1434","49253  >  443 [ACK] Seq=36303 Ack=39 Win=1522 Len=1368 TSval=591101 TSecr=373746550 [TCP segment of a reassembled PDU]"
"54","2018-08-07 18:04:32.594867","192.168.2.3","216.58.197.4","TLSv1.2","1434","Application Data [TCP segment of a reassembled PDU]"
"55","2018-08-07 18:04:32.595012","192.168.2.3","216.58.197.4","TLSv1.2","1434","Application Data [TCP segment of a reassembled PDU]"
"56","2018-08-07 18:04:32.595322","192.168.2.3","216.58.197.4","TCP","1434","49253  >  443 [ACK] Seq=40407 Ack=39 Win=1522 Len=1368 TSval=591101 TSecr=373746551 [TCP segment of a reassembled PDU]"
"57","2018-08-07 18:04:32.595429","192.168.2.3","216.58.197.4","TLSv1.2","1434","Application Data [TCP segment of a reassembled PDU]"
"58","2018-08-07 18:04:32.595569","192.168.2.3","216.58.197.4","TLSv1.2","1434","Application Data [TCP segment of a reassembled PDU]"
"59","2018-08-07 18:04:32.595758","192.168.2.3","216.58.197.4","TCP","1434","49253  >  443 [ACK] Seq=44511 Ack=39 Win=1522 Len=1368 TSval=591101 TSecr=373746551 [TCP segment of a reassembled PDU]"
"60","2018-08-07 18:04:32.596145","192.168.2.3","216.58.197.4","TLSv1.2","1434","Application Data [TCP segment of a reassembled PDU]"
"61","2018-08-07 18:04:32.596885","192.168.2.3","216.58.197.4","TLSv1.2","1434","Application Data [TCP segment of a reassembled PDU]"
"62","2018-08-07 18:04:32.596887","192.168.2.3","216.58.197.4","TLSv1.2","1434","Application Data [TCP segment of a reassembled PDU]"
"63","2018-08-07 18:04:32.597176","192.168.2.3","216.58.197.4","TCP","1434","49253  >  443 [ACK] Seq=49983 Ack=39 Win=1522 Len=1368 TSval=591101 TSecr=373746552 [TCP segment of a reassembled PDU]"
"64","2018-08-07 18:04:32.597178","192.168.2.3","216.58.197.4","TLSv1.2","1434","Application Data [TCP segment of a reassembled PDU]"
"65","2018-08-07 18:04:32.597488","192.168.2.3","216.58.197.4","TCP","1434","49253  >  443 [PSH, ACK] Seq=52719 Ack=39 Win=1522 Len=1368 TSval=591101 TSecr=373746552 [TCP segment of a reassembled PDU]"
"66","2018-08-07 18:04:32.597490","192.168.2.3","216.58.197.4","TLSv1.2","97","Application Data"
"76","2018-08-07 18:04:32.656448","192.168.2.3","216.58.197.4","TCP","1434","49253  >  443 [ACK] Seq=54118 Ack=39 Win=1522 Len=1368 TSval=591108 TSecr=373746566 [TCP segment of a reassembled PDU]"
"77","2018-08-07 18:04:32.656975","192.168.2.3","216.58.197.4","TCP","1434","49253  >  443 [ACK] Seq=55486 Ack=39 Win=1522 Len=1368 TSval=591108 TSecr=373746566 [TCP segment of a reassembled PDU]"
"78","2018-08-07 18:04:32.656977","192.168.2.3","216.58.197.4","TLSv1.2","212","Application Data"
"79","2018-08-07 18:04:32.657079","192.168.2.3","216.58.197.4","TCP","1434","49253  >  443 [ACK] Seq=57000 Ack=39 Win=1522 Len=1368 TSval=591108 TSecr=373746566 [TCP segment of a reassembled PDU]"
"80","2018-08-07 18:04:32.657080","192.168.2.3","216.58.197.4","TLSv1.2","155","Application Data"
"87","2018-08-07 18:04:32.804205","192.168.2.3","216.58.197.4","TCP","1434","49253  >  443 [ACK] Seq=58457 Ack=39 Win=1522 Len=1368 TSval=591120 TSecr=373746665 [TCP segment of a reassembled PDU]"
"88","2018-08-07 18:04:32.804373","192.168.2.3","216.58.197.4","TCP","1434","49253  >  443 [ACK] Seq=59825 Ack=39 Win=1522 Len=1368 TSval=591120 TSecr=373746665 [TCP segment of a reassembled PDU]"
"89","2018-08-07 18:04:32.804374","192.168.2.3","216.58.197.4","TLSv1.2","212","Application Data"
"90","2018-08-07 18:04:32.804531","192.168.2.3","216.58.197.4","TCP","1434","49253  >  443 [ACK] Seq=61339 Ack=39 Win=1522 Len=1368 TSval=591120 TSecr=373746665 [TCP segment of a reassembled PDU]"
"91","2018-08-07 18:04:32.804716","192.168.2.3","216.58.197.4","TLSv1.2","155","Application Data"
"96","2018-08-07 18:04:32.811489","192.168.2.3","216.58.197.4","TCP","66","49253  >  443 [ACK] Seq=62796 Ack=204 Win=1522 Len=0 TSval=591123 TSecr=373746765"
"97","2018-08-07 18:04:32.815576","192.168.2.3","216.58.197.4","TCP","66","49253  >  443 [ACK] Seq=62796 Ack=439 Win=1522 Len=0 TSval=591123 TSecr=373746766"
"98","2018-08-07 18:04:32.879888","192.168.2.3","216.58.197.4","TCP","1434","49253  >  443 [ACK] Seq=62796 Ack=439 Win=1522 Len=1368 TSval=591130 TSecr=373746766 [TCP segment of a reassembled PDU]"
"99","2018-08-07 18:04:32.880179","192.168.2.3","216.58.197.4","TCP","1434","49253  >  443 [ACK] Seq=64164 Ack=439 Win=1522 Len=1368 TSval=591130 TSecr=373746766 [TCP segment of a reassembled PDU]"
"100","2018-08-07 18:04:32.880181","192.168.2.3","216.58.197.4","TLSv1.2","212","Application Data"
"101","2018-08-07 18:04:32.880182","192.168.2.3","216.58.197.4","TLSv1.2","723","Application Data"
"105","2018-08-07 18:04:32.985196","192.168.2.3","216.58.197.4","TCP","66","49253  >  443 [ACK] Seq=66335 Ack=629 Win=1522 Len=0 TSval=591141 TSecr=373746907"
"106","2018-08-07 18:04:33.004929","192.168.2.3","216.58.197.4","TCP","1434","49253  >  443 [ACK] Seq=66335 Ack=629 Win=1522 Len=1368 TSval=591142 TSecr=373746907 [TCP segment of a reassembled PDU]"
"107","2018-08-07 18:04:33.005170","192.168.2.3","216.58.197.4","TCP","1434","49253  >  443 [ACK] Seq=67703 Ack=629 Win=1522 Len=1368 TSval=591142 TSecr=373746907 [TCP segment of a reassembled PDU]"
"108","2018-08-07 18:04:33.005172","192.168.2.3","216.58.197.4","TLSv1.2","212","Application Data"
"109","2018-08-07 18:04:33.005339","192.168.2.3","216.58.197.4","TLSv1.2","1382","Application Data"
"112","2018-08-07 18:04:33.104180","192.168.2.3","216.58.197.4","TCP","1434","49253  >  443 [ACK] Seq=70533 Ack=629 Win=1522 Len=1368 TSval=591152 TSecr=373746973 [TCP segment of a reassembled PDU]"
"113","2018-08-07 18:04:33.104671","192.168.2.3","216.58.197.4","TCP","1434","49253  >  443 [ACK] Seq=71901 Ack=629 Win=1522 Len=1368 TSval=591152 TSecr=373746973 [TCP segment of a reassembled PDU]"
"114","2018-08-07 18:04:33.104673","192.168.2.3","216.58.197.4","TLSv1.2","212","Application Data"
"115","2018-08-07 18:04:33.104674","192.168.2.3","216.58.197.4","TLSv1.2","1020","Application Data"
"119","2018-08-07 18:04:33.114795","192.168.2.3","216.58.197.4","TCP","66","49253  >  443 [ACK] Seq=74369 Ack=918 Win=1522 Len=0 TSval=591153 TSecr=373747075"
"120","2018-08-07 18:04:33.286054","192.168.2.3","216.58.197.4","TCP","1434","49253  >  443 [ACK] Seq=74369 Ack=918 Win=1522 Len=1368 TSval=591163 TSecr=373747075 [TCP segment of a reassembled PDU]"
"121","2018-08-07 18:04:33.286217","192.168.2.3","216.58.197.4","TCP","1434","49253  >  443 [ACK] Seq=75737 Ack=918 Win=1522 Len=1368 TSval=591163 TSecr=373747075 [TCP segment of a reassembled PDU]"
"122","2018-08-07 18:04:33.286225","192.168.2.3","216.58.197.4","TLSv1.2","212","Application Data"
"123","2018-08-07 18:04:33.286335","192.168.2.3","216.58.197.4","TLSv1.2","1069","Application Data"
"126","2018-08-07 18:04:33.321022","192.168.2.3","216.58.197.4","TCP","1434","49253  >  443 [ACK] Seq=78254 Ack=918 Win=1522 Len=1368 TSval=591174 TSecr=373747254 [TCP segment of a reassembled PDU]"
"127","2018-08-07 18:04:33.321313","192.168.2.3","216.58.197.4","TCP","1434","49253  >  443 [ACK] Seq=79622 Ack=918 Win=1522 Len=1368 TSval=591174 TSecr=373747254 [TCP segment of a reassembled PDU]"
"128","2018-08-07 18:04:33.321314","192.168.2.3","216.58.197.4","TLSv1.2","212","Application Data"
"129","2018-08-07 18:04:33.321315","192.168.2.3","216.58.197.4","TLSv1.2","699","Application Data"
"132","2018-08-07 18:04:33.423712","192.168.2.3","216.58.197.4","TCP","1434","49253  >  443 [ACK] Seq=81769 Ack=918 Win=1522 Len=1368 TSval=591184 TSecr=373747289 [TCP segment of a reassembled PDU]"
"133","2018-08-07 18:04:33.424031","192.168.2.3","216.58.197.4","TCP","1434","49253  >  443 [ACK] Seq=83137 Ack=918 Win=1522 Len=1368 TSval=591184 TSecr=373747289 [TCP segment of a reassembled PDU]"
"134","2018-08-07 18:04:33.424033","192.168.2.3","216.58.197.4","TLSv1.2","212","Application Data"
"135","2018-08-07 18:04:33.424512","192.168.2.3","216.58.197.4","TLSv1.2","1381","Application Data"
"138","2018-08-07 18:04:33.525871","192.168.2.3","216.58.197.4","TCP","1434","49253  >  443 [ACK] Seq=85966 Ack=918 Win=1522 Len=1368 TSval=591194 TSecr=373747393 [TCP segment of a reassembled PDU]"
"139","2018-08-07 18:04:33.526114","192.168.2.3","216.58.197.4","TCP","1434","49253  >  443 [ACK] Seq=87334 Ack=918 Win=1522 Len=1368 TSval=591194 TSecr=373747393 [TCP segment of a reassembled PDU]"
"140","2018-08-07 18:04:33.526116","192.168.2.3","216.58.197.4","TLSv1.2","212","Application Data"
"141","2018-08-07 18:04:33.526117","192.168.2.3","216.58.197.4","TLSv1.2","668","Application Data"
"145","2018-08-07 18:04:33.644864","192.168.2.3","216.58.197.4","TCP","1434","49253  >  443 [ACK] Seq=89450 Ack=918 Win=1522 Len=1368 TSval=591206 TSecr=373747494 [TCP segment of a reassembled PDU]"
"146","2018-08-07 18:04:33.644869","192.168.2.3","216.58.197.4","TCP","1434","49253  >  443 [ACK] Seq=90818 Ack=918 Win=1522 Len=1368 TSval=591206 TSecr=373747494 [TCP segment of a reassembled PDU]"
"147","2018-08-07 18:04:33.644870","192.168.2.3","216.58.197.4","TLSv1.2","212","Application Data"
"148","2018-08-07 18:04:33.645382","192.168.2.3","216.58.197.4","TLSv1.2","672","Application Data"
"151","2018-08-07 18:04:33.745726","192.168.2.3","216.58.197.4","TCP","1434","49253  >  443 [ACK] Seq=92938 Ack=918 Win=1522 Len=1368 TSval=591216 TSecr=373747613 [TCP segment of a reassembled PDU]"
"152","2018-08-07 18:04:33.745730","192.168.2.3","216.58.197.4","TCP","1434","49253  >  443 [ACK] Seq=94306 Ack=918 Win=1522 Len=1368 TSval=591216 TSecr=373747613 [TCP segment of a reassembled PDU]"
"153","2018-08-07 18:04:33.745731","192.168.2.3","216.58.197.4","TLSv1.2","212","Application Data"
"154","2018-08-07 18:04:33.745862","192.168.2.3","216.58.197.4","TCP","1434","49253  >  443 [ACK] Seq=95820 Ack=918 Win=1522 Len=1368 TSval=591216 TSecr=373747613 [TCP segment of a reassembled PDU]"
"155","2018-08-07 18:04:33.746142","192.168.2.3","216.58.197.4","TLSv1.2","155","Application Data"
"159","2018-08-07 18:04:33.803367","192.168.2.3","216.58.197.4","TCP","66","49253  >  443 [ACK] Seq=97277 Ack=1028 Win=1522 Len=0 TSval=591222 TSecr=373747766"
"161","2018-08-07 18:04:33.812130","192.168.2.3","216.58.197.4","TCP","66","49253  >  443 [ACK] Seq=97277 Ack=1327 Win=1522 Len=0 TSval=591223 TSecr=373747774"
"162","2018-08-07 18:04:33.839855","192.168.2.3","216.58.197.4","TCP","1434","49253  >  443 [ACK] Seq=97277 Ack=1327 Win=1522 Len=1368 TSval=591226 TSecr=373747774 [TCP segment of a reassembled PDU]"
"163","2018-08-07 18:04:33.840398","192.168.2.3","216.58.197.4","TCP","1434","49253  >  443 [ACK] Seq=98645 Ack=1327 Win=1522 Len=1368 TSval=591226 TSecr=373747774 [TCP segment of a reassembled PDU]"
"164","2018-08-07 18:04:33.840401","192.168.2.3","216.58.197.4","TLSv1.2","212","Application Data"
"165","2018-08-07 18:04:33.840402","192.168.2.3","216.58.197.4","TCP","1434","49253  >  443 [ACK] Seq=100159 Ack=1327 Win=1522 Len=1368 TSval=591226 TSecr=373747774 [TCP segment of a reassembled PDU]"
"166","2018-08-07 18:04:33.840403","192.168.2.3","216.58.197.4","TLSv1.2","155","Application Data"
"170","2018-08-07 18:04:33.904133","192.168.2.3","216.58.197.4","TCP","1434","49253  >  443 [ACK] Seq=101616 Ack=1327 Win=1522 Len=1368 TSval=591232 TSecr=373747849 [TCP segment of a reassembled PDU]"
"171","2018-08-07 18:04:33.904556","192.168.2.3","216.58.197.4","TCP","1434","49253  >  443 [ACK] Seq=102984 Ack=1327 Win=1522 Len=1368 TSval=591232 TSecr=373747849 [TCP segment of a reassembled PDU]"
"172","2018-08-07 18:04:33.904562","192.168.2.3","216.58.197.4","TLSv1.2","212","Application Data"
"173","2018-08-07 18:04:33.904981","192.168.2.3","216.58.197.4","TCP","1434","49253  >  443 [ACK] Seq=104498 Ack=1327 Win=1522 Len=1368 TSval=591232 TSecr=373747849 [TCP segment of a reassembled PDU]"
"174","2018-08-07 18:04:33.904986","192.168.2.3","216.58.197.4","TLSv1.2","155","Application Data"
"177","2018-08-07 18:04:34.000929","192.168.2.3","216.58.197.4","TCP","1434","49253  >  443 [ACK] Seq=105955 Ack=1327 Win=1522 Len=1368 TSval=591242 TSecr=373747873 [TCP segment of a reassembled PDU]"
"178","2018-08-07 18:04:34.001090","192.168.2.3","216.58.197.4","TCP","1434","49253  >  443 [ACK] Seq=107323 Ack=1327 Win=1522 Len=1368 TSval=591242 TSecr=373747873 [TCP segment of a reassembled PDU]"
"179","2018-08-07 18:04:34.001093","192.168.2.3","216.58.197.4","TLSv1.2","212","Application Data"
"180","2018-08-07 18:04:34.001094","192.168.2.3","216.58.197.4","TCP","1434","49253  >  443 [ACK] Seq=108837 Ack=1327 Win=1522 Len=1368 TSval=591242 TSecr=373747873 [TCP segment of a reassembled PDU]"
"181","2018-08-07 18:04:34.001273","192.168.2.3","216.58.197.4","TLSv1.2","155","Application Data"
"184","2018-08-07 18:04:34.103271","192.168.2.3","216.58.197.4","TCP","1434","49253  >  443 [ACK] Seq=110294 Ack=1327 Win=1522 Len=1368 TSval=591252 TSecr=373747969 [TCP segment of a reassembled PDU]"
"185","2018-08-07 18:04:34.103680","192.168.2.3","216.58.197.4","TCP","1434","49253  >  443 [ACK] Seq=111662 Ack=1327 Win=1522 Len=1368 TSval=591252 TSecr=373747969 [TCP segment of a reassembled PDU]"
"186","2018-08-07 18:04:34.103683","192.168.2.3","216.58.197.4","TLSv1.2","212","Application Data"
"187","2018-08-07 18:04:34.103683","192.168.2.3","216.58.197.4","TLSv1.2","1378","Application Data"
"190","2018-08-07 18:04:34.219263","192.168.2.3","216.58.197.4","TCP","1434","49253  >  443 [ACK] Seq=114488 Ack=1327 Win=1522 Len=1368 TSval=591264 TSecr=373748072 [TCP segment of a reassembled PDU]"
"191","2018-08-07 18:04:34.219280","192.168.2.3","216.58.197.4","TCP","1434","49253  >  443 [ACK] Seq=115856 Ack=1327 Win=1522 Len=1368 TSval=591264 TSecr=373748072 [TCP segment of a reassembled PDU]"
"192","2018-08-07 18:04:34.219281","192.168.2.3","216.58.197.4","TLSv1.2","212","Application Data"
"193","2018-08-07 18:04:34.219357","192.168.2.3","216.58.197.4","TCP","1434","49253  >  443 [ACK] Seq=117370 Ack=1327 Win=1522 Len=1368 TSval=591264 TSecr=373748072 [TCP segment of a reassembled PDU]"
"194","2018-08-07 18:04:34.219358","192.168.2.3","216.58.197.4","TLSv1.2","155","Application Data"
"197","2018-08-07 18:04:34.316607","192.168.2.3","216.58.197.4","TCP","1434","49253  >  443 [ACK] Seq=118827 Ack=1327 Win=1522 Len=1368 TSval=591274 TSecr=373748188 [TCP segment of a reassembled PDU]"
"198","2018-08-07 18:04:34.317045","192.168.2.3","216.58.197.4","TCP","1434","49253  >  443 [ACK] Seq=120195 Ack=1327 Win=1522 Len=1368 TSval=591274 TSecr=373748188 [TCP segment of a reassembled PDU]"
"199","2018-08-07 18:04:34.317046","192.168.2.3","216.58.197.4","TLSv1.2","212","Application Data"
"200","2018-08-07 18:04:34.317047","192.168.2.3","216.58.197.4","TCP","1434","49253  >  443 [ACK] Seq=121709 Ack=1327 Win=1522 Len=1368 TSval=591274 TSecr=373748188 [TCP segment of a reassembled PDU]"
"201","2018-08-07 18:04:34.317048","192.168.2.3","216.58.197.4","TLSv1.2","155","Application Data"
"207","2018-08-07 18:04:34.396484","192.168.2.3","216.58.197.4","TCP","66","49253  >  443 [ACK] Seq=123166 Ack=1780 Win=1522 Len=0 TSval=591281 TSecr=373748352"
"208","2018-08-07 18:04:34.416702","192.168.2.3","216.58.197.4","TCP","1434","49253  >  443 [ACK] Seq=123166 Ack=1780 Win=1522 Len=1368 TSval=591284 TSecr=373748352 [TCP segment of a reassembled PDU]"
"209","2018-08-07 18:04:34.417150","192.168.2.3","216.58.197.4","TCP","1434","49253  >  443 [ACK] Seq=124534 Ack=1780 Win=1522 Len=1368 TSval=591284 TSecr=373748352 [TCP segment of a reassembled PDU]"
"210","2018-08-07 18:04:34.417152","192.168.2.3","216.58.197.4","TLSv1.2","212","Application Data"
"211","2018-08-07 18:04:34.417153","192.168.2.3","216.58.197.4","TLSv1.2","1246","Application Data"
"213","2018-08-07 18:04:34.513210","192.168.2.3","216.58.197.4","TCP","1434","49253  >  443 [ACK] Seq=127228 Ack=1780 Win=1522 Len=1368 TSval=591293 TSecr=373748386 [TCP segment of a reassembled PDU]"
"214","2018-08-07 18:04:34.513213","192.168.2.3","216.58.197.4","TCP","1434","49253  >  443 [ACK] Seq=128596 Ack=1780 Win=1522 Len=1368 TSval=591293 TSecr=373748386 [TCP segment of a reassembled PDU]"
"215","2018-08-07 18:04:34.513403","192.168.2.3","216.58.197.4","TLSv1.2","212","Application Data"
"216","2018-08-07 18:04:34.513405","192.168.2.3","216.58.197.4","TCP","1434","49253  >  443 [ACK] Seq=130110 Ack=1780 Win=1522 Len=1368 TSval=591293 TSecr=373748386 [TCP segment of a reassembled PDU]"
"217","2018-08-07 18:04:34.513643","192.168.2.3","216.58.197.4","TLSv1.2","155","Application Data"
"221","2018-08-07 18:04:34.615828","192.168.2.3","216.58.197.4","TCP","1434","49253  >  443 [ACK] Seq=131567 Ack=1780 Win=1522 Len=1368 TSval=591303 TSecr=373748482 [TCP segment of a reassembled PDU]"
"222","2018-08-07 18:04:34.615832","192.168.2.3","216.58.197.4","TCP","1434","49253  >  443 [ACK] Seq=132935 Ack=1780 Win=1522 Len=1368 TSval=591303 TSecr=373748482 [TCP segment of a reassembled PDU]"
"223","2018-08-07 18:04:34.615833","192.168.2.3","216.58.197.4","TLSv1.2","212","Application Data"
"224","2018-08-07 18:04:34.616069","192.168.2.3","216.58.197.4","TLSv1.2","1114","Application Data"
"227","2018-08-07 18:04:34.730851","192.168.2.3","216.58.197.4","TCP","1434","49253  >  443 [ACK] Seq=135497 Ack=1780 Win=1522 Len=1368 TSval=591315 TSecr=373748584 [TCP segment of a reassembled PDU]"
"228","2018-08-07 18:04:34.731076","192.168.2.3","216.58.197.4","TCP","1434","49253  >  443 [ACK] Seq=136865 Ack=1780 Win=1522 Len=1368 TSval=591315 TSecr=373748584 [TCP segment of a reassembled PDU]"
"229","2018-08-07 18:04:34.731078","192.168.2.3","216.58.197.4","TLSv1.2","212","Application Data"
"230","2018-08-07 18:04:34.731215","192.168.2.3","216.58.197.4","TCP","1434","49253  >  443 [ACK] Seq=138379 Ack=1780 Win=1522 Len=1368 TSval=591315 TSecr=373748584 [TCP segment of a reassembled PDU]"
"231","2018-08-07 18:04:34.731359","192.168.2.3","216.58.197.4","TLSv1.2","155","Application Data"
"238","2018-08-07 18:04:34.802892","192.168.2.3","216.58.197.4","TCP","66","49253  >  443 [ACK] Seq=139836 Ack=2189 Win=1522 Len=0 TSval=591322 TSecr=373748761"
"240","2018-08-07 18:04:34.812598","192.168.2.3","216.58.197.4","TCP","66","49253  >  443 [ACK] Seq=139836 Ack=2600 Win=1522 Len=0 TSval=591323 TSecr=373748766"
"241","2018-08-07 18:04:34.829802","192.168.2.3","216.58.197.4","TCP","1434","49253  >  443 [ACK] Seq=139836 Ack=2600 Win=1522 Len=1368 TSval=591325 TSecr=373748766 [TCP segment of a reassembled PDU]"
"242","2018-08-07 18:04:34.833234","192.168.2.3","216.58.197.4","TCP","1434","49253  >  443 [ACK] Seq=141204 Ack=2600 Win=1522 Len=1368 TSval=591325 TSecr=373748766 [TCP segment of a reassembled PDU]"
"243","2018-08-07 18:04:34.833446","192.168.2.3","216.58.197.4","TLSv1.2","212","Application Data"
"244","2018-08-07 18:04:34.833448","192.168.2.3","216.58.197.4","TCP","1434","49253  >  443 [ACK] Seq=142718 Ack=2600 Win=1522 Len=1368 TSval=591325 TSecr=373748766 [TCP segment of a reassembled PDU]"
"245","2018-08-07 18:04:34.833641","192.168.2.3","216.58.197.4","TLSv1.2","155","Application Data"
"251","2018-08-07 18:04:34.893739","192.168.2.3","216.58.197.4","TCP","66","49253  >  443 [ACK] Seq=144175 Ack=2948 Win=1522 Len=0 TSval=591331 TSecr=373748850"
"254","2018-08-07 18:04:34.897921","192.168.2.3","216.58.197.4","TCP","66","49253  >  443 [ACK] Seq=144175 Ack=3389 Win=1522 Len=0 TSval=591332 TSecr=373748860"
"255","2018-08-07 18:04:34.939293","192.168.2.3","216.58.197.4","TCP","1434","49253  >  443 [ACK] Seq=144175 Ack=3389 Win=1522 Len=1368 TSval=591335 TSecr=373748860 [TCP segment of a reassembled PDU]"
"256","2018-08-07 18:04:34.939444","192.168.2.3","216.58.197.4","TCP","1434","49253  >  443 [ACK] Seq=145543 Ack=3389 Win=1522 Len=1368 TSval=591335 TSecr=373748860 [TCP segment of a reassembled PDU]"
"257","2018-08-07 18:04:34.939445","192.168.2.3","216.58.197.4","TLSv1.2","212","Application Data"
"258","2018-08-07 18:04:34.939796","192.168.2.3","216.58.197.4","TLSv1.2","1413","Application Data"
"262","2018-08-07 18:04:35.023862","192.168.2.3","216.58.197.4","TCP","1434","49253  >  443 [ACK] Seq=148404 Ack=3389 Win=1522 Len=1368 TSval=591344 TSecr=373748908 [TCP segment of a reassembled PDU]"
"263","2018-08-07 18:04:35.024081","192.168.2.3","216.58.197.4","TCP","1434","49253  >  443 [ACK] Seq=149772 Ack=3389 Win=1522 Len=1368 TSval=591344 TSecr=373748908 [TCP segment of a reassembled PDU]"
"264","2018-08-07 18:04:35.024083","192.168.2.3","216.58.197.4","TLSv1.2","212","Application Data"
"265","2018-08-07 18:04:35.024298","192.168.2.3","216.58.197.4","TCP","1434","49253  >  443 [ACK] Seq=151286 Ack=3389 Win=1522 Len=1368 TSval=591344 TSecr=373748908 [TCP segment of a reassembled PDU]"
"266","2018-08-07 18:04:35.024300","192.168.2.3","216.58.197.4","TLSv1.2","155","Application Data"
"270","2018-08-07 18:04:35.128565","192.168.2.3","216.58.197.4","TCP","1434","49253  >  443 [ACK] Seq=152743 Ack=3389 Win=1522 Len=1368 TSval=591355 TSecr=373748992 [TCP segment of a reassembled PDU]"
"271","2018-08-07 18:04:35.128570","192.168.2.3","216.58.197.4","TCP","1434","49253  >  443 [ACK] Seq=154111 Ack=3389 Win=1522 Len=1368 TSval=591355 TSecr=373748992 [TCP segment of a reassembled PDU]"
"272","2018-08-07 18:04:35.128571","192.168.2.3","216.58.197.4","TLSv1.2","212","Application Data"
"273","2018-08-07 18:04:35.128740","192.168.2.3","216.58.197.4","TCP","1434","49253  >  443 [ACK] Seq=155625 Ack=3389 Win=1522 Len=1368 TSval=591355 TSecr=373748992 [TCP segment of a reassembled PDU]"
"274","2018-08-07 18:04:35.128742","192.168.2.3","216.58.197.4","TLSv1.2","155","Application Data"
"277","2018-08-07 18:04:35.243530","192.168.2.3","216.58.197.4","TCP","1434","49253  >  443 [ACK] Seq=157082 Ack=3389 Win=1522 Len=1368 TSval=591366 TSecr=373749097 [TCP segment of a reassembled PDU]"
"278","2018-08-07 18:04:35.243534","192.168.2.3","216.58.197.4","TCP","1434","49253  >  443 [ACK] Seq=158450 Ack=3389 Win=1522 Len=1368 TSval=591366 TSecr=373749097 [TCP segment of a reassembled PDU]"
"279","2018-08-07 18:04:35.243535","192.168.2.3","216.58.197.4","TLSv1.2","212","Application Data"
"280","2018-08-07 18:04:35.243744","192.168.2.3","216.58.197.4","TCP","1434","49253  >  443 [ACK] Seq=159964 Ack=3389 Win=1522 Len=1368 TSval=591366 TSecr=373749097 [TCP segment of a reassembled PDU]"
"281","2018-08-07 18:04:35.243748","192.168.2.3","216.58.197.4","TLSv1.2","155","Application Data"
"286","2018-08-07 18:04:35.312333","192.168.2.3","216.58.197.4","TCP","66","49253  >  443 [ACK] Seq=161421 Ack=3754 Win=1522 Len=0 TSval=591373 TSecr=373749270"
"287","2018-08-07 18:04:35.335322","192.168.2.3","172.217.27.174","TCP","66","52317  >  443 [ACK] Seq=1 Ack=1 Win=279 Len=0 TSval=591376 TSecr=3868727256"
"289","2018-08-07 18:04:35.346694","192.168.2.3","216.58.197.4","TCP","1434","49253  >  443 [ACK] Seq=161421 Ack=3754 Win=1522 Len=1368 TSval=591376 TSecr=373749270 [TCP segment of a reassembled PDU]"
"290","2018-08-07 18:04:35.347037","192.168.2.3","216.58.197.4","TCP","1434","49253  >  443 [ACK] Seq=162789 Ack=3754 Win=1522 Len=1368 TSval=591377 TSecr=373749270 [TCP segment of a reassembled PDU]"
"291","2018-08-07 18:04:35.347039","192.168.2.3","216.58.197.4","TLSv1.2","212","Application Data"
"292","2018-08-07 18:04:35.347466","192.168.2.3","216.58.197.4","TCP","1434","49253  >  443 [ACK] Seq=164303 Ack=3754 Win=1522 Len=1368 TSval=591377 TSecr=373749270 [TCP segment of a reassembled PDU]"
"293","2018-08-07 18:04:35.347468","192.168.2.3","216.58.197.4","TLSv1.2","155","Application Data"
"297","2018-08-07 18:04:35.438564","192.168.2.3","216.58.197.4","TCP","1434","49253  >  443 [ACK] Seq=165760 Ack=3754 Win=1522 Len=1368 TSval=591386 TSecr=373749316 [TCP segment of a reassembled PDU]"
"298","2018-08-07 18:04:35.439017","192.168.2.3","216.58.197.4","TCP","1434","49253  >  443 [ACK] Seq=167128 Ack=3754 Win=1522 Len=1368 TSval=591386 TSecr=373749316 [TCP segment of a reassembled PDU]"
"299","2018-08-07 18:04:35.439019","192.168.2.3","216.58.197.4","TLSv1.2","212","Application Data"
"300","2018-08-07 18:04:35.439020","192.168.2.3","216.58.197.4","TCP","1434","49253  >  443 [ACK] Seq=168642 Ack=3754 Win=1522 Len=1368 TSval=591386 TSecr=373749316 [TCP segment of a reassembled PDU]"
"301","2018-08-07 18:04:35.439021","192.168.2.3","216.58.197.4","TLSv1.2","155","Application Data"
"305","2018-08-07 18:04:35.530686","192.168.2.3","216.58.197.4","TCP","1434","49253  >  443 [ACK] Seq=170099 Ack=3754 Win=1522 Len=1368 TSval=591395 TSecr=373749407 [TCP segment of a reassembled PDU]"
"306","2018-08-07 18:04:35.530689","192.168.2.3","216.58.197.4","TCP","1434","49253  >  443 [ACK] Seq=171467 Ack=3754 Win=1522 Len=1368 TSval=591395 TSecr=373749407 [TCP segment of a reassembled PDU]"
"307","2018-08-07 18:04:35.530691","192.168.2.3","216.58.197.4","TLSv1.2","212","Application Data"
"308","2018-08-07 18:04:35.530724","192.168.2.3","216.58.197.4","TCP","1434","49253  >  443 [ACK] Seq=172981 Ack=3754 Win=1522 Len=1368 TSval=591395 TSecr=373749407 [TCP segment of a reassembled PDU]"
"309","2018-08-07 18:04:35.531857","192.168.2.3","216.58.197.4","TLSv1.2","155","Application Data"
"314","2018-08-07 18:04:35.592314","192.168.2.3","216.58.197.4","TCP","66","49253  >  443 [ACK] Seq=174438 Ack=4333 Win=1522 Len=0 TSval=591401 TSecr=373749555"
"315","2018-08-07 18:04:35.632606","192.168.2.3","216.58.197.4","TCP","1434","49253  >  443 [ACK] Seq=174438 Ack=4333 Win=1522 Len=1368 TSval=591405 TSecr=373749555 [TCP segment of a reassembled PDU]"
"316","2018-08-07 18:04:35.632611","192.168.2.3","216.58.197.4","TCP","1434","49253  >  443 [ACK] Seq=175806 Ack=4333 Win=1522 Len=1368 TSval=591405 TSecr=373749555 [TCP segment of a reassembled PDU]"
"317","2018-08-07 18:04:35.632808","192.168.2.3","216.58.197.4","TLSv1.2","212","Application Data"
"318","2018-08-07 18:04:35.632811","192.168.2.3","216.58.197.4","TCP","1434","49253  >  443 [ACK] Seq=177320 Ack=4333 Win=1522 Len=1368 TSval=591405 TSecr=373749555 [TCP segment of a reassembled PDU]"
"319","2018-08-07 18:04:35.633032","192.168.2.3","216.58.197.4","TLSv1.2","155","Application Data"
"325","2018-08-07 18:04:35.710414","192.168.2.3","216.58.197.4","TCP","66","49253  >  443 [ACK] Seq=178777 Ack=4619 Win=1522 Len=0 TSval=591412 TSecr=373749665"
"326","2018-08-07 18:04:35.736764","192.168.2.3","216.58.197.4","TCP","1434","49253  >  443 [ACK] Seq=178777 Ack=4619 Win=1522 Len=1368 TSval=591415 TSecr=373749665 [TCP segment of a reassembled PDU]"
"327","2018-08-07 18:04:35.736768","192.168.2.3","216.58.197.4","TCP","1434","49253  >  443 [ACK] Seq=180145 Ack=4619 Win=1522 Len=1368 TSval=591415 TSecr=373749665 [TCP segment of a reassembled PDU]"
"328","2018-08-07 18:04:35.736894","192.168.2.3","216.58.197.4","TLSv1.2","212","Application Data"
"329","2018-08-07 18:04:35.737305","192.168.2.3","216.58.197.4","TLSv1.2","1085","Application Data"
"335","2018-08-07 18:04:35.813631","192.168.2.3","216.58.197.4","TCP","66","49253  >  443 [ACK] Seq=182678 Ack=4814 Win=1522 Len=0 TSval=591423 TSecr=373749767"
"336","2018-08-07 18:04:35.815639","192.168.2.3","64.233.188.188","TCP","66","40306  >  5228 [ACK] Seq=1 Ack=1 Win=539 Len=0 TSval=591424 TSecr=3579163809"
"337","2018-08-07 18:04:35.852736","192.168.2.3","216.58.197.4","TCP","1434","49253  >  443 [ACK] Seq=182678 Ack=4814 Win=1522 Len=1368 TSval=591427 TSecr=373749767 [TCP segment of a reassembled PDU]"
"338","2018-08-07 18:04:35.853071","192.168.2.3","216.58.197.4","TCP","1434","49253  >  443 [ACK] Seq=184046 Ack=4814 Win=1522 Len=1368 TSval=591427 TSecr=373749767 [TCP segment of a reassembled PDU]"
"339","2018-08-07 18:04:35.853072","192.168.2.3","216.58.197.4","TLSv1.2","212","Application Data"
"340","2018-08-07 18:04:35.853073","192.168.2.3","216.58.197.4","TLSv1.2","1409","Application Data"
"347","2018-08-07 18:04:35.920684","192.168.2.3","216.58.197.4","TCP","66","49253  >  443 [ACK] Seq=186903 Ack=5326 Win=1522 Len=0 TSval=591434 TSecr=373749883"
"348","2018-08-07 18:04:35.952584","192.168.2.3","216.58.197.4","TCP","1434","49253  >  443 [ACK] Seq=186903 Ack=5326 Win=1522 Len=1368 TSval=591437 TSecr=373749883 [TCP segment of a reassembled PDU]"
"349","2018-08-07 18:04:35.952825","192.168.2.3","216.58.197.4","TCP","1434","49253  >  443 [ACK] Seq=188271 Ack=5326 Win=1522 Len=1368 TSval=591437 TSecr=373749883 [TCP segment of a reassembled PDU]"
"350","2018-08-07 18:04:35.952827","192.168.2.3","216.58.197.4","TLSv1.2","212","Application Data"
"351","2018-08-07 18:04:35.953048","192.168.2.3","216.58.197.4","TLSv1.2","1370","Application Data"
"355","2018-08-07 18:04:36.055158","192.168.2.3","216.58.197.4","TCP","1434","49253  >  443 [ACK] Seq=191089 Ack=5326 Win=1522 Len=1368 TSval=591447 TSecr=373749921 [TCP segment of a reassembled PDU]"
"356","2018-08-07 18:04:36.055512","192.168.2.3","216.58.197.4","TCP","1434","49253  >  443 [ACK] Seq=192457 Ack=5326 Win=1522 Len=1368 TSval=591447 TSecr=373749921 [TCP segment of a reassembled PDU]"
"357","2018-08-07 18:04:36.055514","192.168.2.3","216.58.197.4","TLSv1.2","212","Application Data"
"358","2018-08-07 18:04:36.055515","192.168.2.3","216.58.197.4","TLSv1.2","334","Application Data"
"361","2018-08-07 18:04:36.169323","192.168.2.3","216.58.197.4","TCP","1434","49253  >  443 [ACK] Seq=194239 Ack=5326 Win=1522 Len=1368 TSval=591459 TSecr=373750024 [TCP segment of a reassembled PDU]"
"362","2018-08-07 18:04:36.169750","192.168.2.3","216.58.197.4","TCP","1434","49253  >  443 [ACK] Seq=195607 Ack=5326 Win=1522 Len=1368 TSval=591459 TSecr=373750024 [TCP segment of a reassembled PDU]"
"363","2018-08-07 18:04:36.169752","192.168.2.3","216.58.197.4","TLSv1.2","212","Application Data"
"364","2018-08-07 18:04:36.169753","192.168.2.3","216.58.197.4","TLSv1.2","1010","Application Data"
"370","2018-08-07 18:04:36.188356","192.168.2.3","216.58.197.4","TCP","66","49253  >  443 [ACK] Seq=198065 Ack=5726 Win=1522 Len=0 TSval=591461 TSecr=373750151"
"371","2018-08-07 18:04:36.225283","192.168.2.3","216.58.197.4","TCP","66","49253  >  443 [ACK] Seq=198065 Ack=5970 Win=1522 Len=0 TSval=591465 TSecr=373750151"
"372","2018-08-07 18:04:36.271813","192.168.2.3","216.58.197.4","TCP","1434","49253  >  443 [ACK] Seq=198065 Ack=5970 Win=1522 Len=1368 TSval=591469 TSecr=373750151 [TCP segment of a reassembled PDU]"
"373","2018-08-07 18:04:36.272196","192.168.2.3","216.58.197.4","TCP","1434","49253  >  443 [ACK] Seq=199433 Ack=5970 Win=1522 Len=1368 TSval=591469 TSecr=373750151 [TCP segment of a reassembled PDU]"
"374","2018-08-07 18:04:36.272198","192.168.2.3","216.58.197.4","TLSv1.2","212","Application Data"
"375","2018-08-07 18:04:36.272199","192.168.2.3","216.58.197.4","TLSv1.2","1009","Application Data"
"378","2018-08-07 18:04:36.372004","192.168.2.3","216.58.197.4","TCP","1434","49253  >  443 [ACK] Seq=201890 Ack=5970 Win=1522 Len=1368 TSval=591479 TSecr=373750241 [TCP segment of a reassembled PDU]"
"379","2018-08-07 18:04:36.372393","192.168.2.3","216.58.197.4","TCP","1434","49253  >  443 [ACK] Seq=203258 Ack=5970 Win=1522 Len=1368 TSval=591479 TSecr=373750241 [TCP segment of a reassembled PDU]"
"380","2018-08-07 18:04:36.372396","192.168.2.3","216.58.197.4","TLSv1.2","212","Application Data"
"381","2018-08-07 18:04:36.372397","192.168.2.3","216.58.197.4","TLSv1.2","666","Application Data"
"383","2018-08-07 18:04:36.495178","192.168.2.3","216.58.197.4","TCP","1434","49253  >  443 [ACK] Seq=205372 Ack=5970 Win=1522 Len=1368 TSval=591491 TSecr=373750341 [TCP segment of a reassembled PDU]"
"384","2018-08-07 18:04:36.495369","192.168.2.3","216.58.197.4","TCP","1434","49253  >  443 [ACK] Seq=206740 Ack=5970 Win=1522 Len=1368 TSval=591491 TSecr=373750341 [TCP segment of a reassembled PDU]"
"385","2018-08-07 18:04:36.495371","192.168.2.3","216.58.197.4","TLSv1.2","212","Application Data"
"386","2018-08-07 18:04:36.495371","192.168.2.3","216.58.197.4","TLSv1.2","1028","Application Data"
"391","2018-08-07 18:04:36.554979","192.168.2.3","216.58.197.4","TCP","66","49253  >  443 [ACK] Seq=209216 Ack=6092 Win=1522 Len=0 TSval=591497 TSecr=373750518"
"392","2018-08-07 18:04:36.555169","192.168.2.3","216.58.197.4","TCP","66","49253  >  443 [ACK] Seq=209216 Ack=6387 Win=1522 Len=0 TSval=591497 TSecr=373750518"
"393","2018-08-07 18:04:36.592266","192.168.2.3","216.58.197.4","TCP","1434","49253  >  443 [ACK] Seq=209216 Ack=6387 Win=1522 Len=1368 TSval=591501 TSecr=373750518 [TCP segment of a reassembled PDU]"
"394","2018-08-07 18:04:36.592550","192.168.2.3","216.58.197.4","TCP","1434","49253  >  443 [ACK] Seq=210584 Ack=6387 Win=1522 Len=1368 TSval=591501 TSecr=373750518 [TCP segment of a reassembled PDU]"
"395","2018-08-07 18:04:36.592552","192.168.2.3","216.58.197.4","TLSv1.2","212","Application Data"
"396","2018-08-07 18:04:36.592830","192.168.2.3","216.58.197.4","TLSv1.2","1362","Application Data"
"401","2018-08-07 18:04:36.652812","192.168.2.3","216.58.197.4","TCP","66","49253  >  443 [ACK] Seq=213394 Ack=6625 Win=1522 Len=0 TSval=591507 TSecr=373750615"
"402","2018-08-07 18:04:36.656446","192.168.2.3","216.58.197.4","TCP","66","49253  >  443 [ACK] Seq=213394 Ack=6859 Win=1522 Len=0 TSval=591507 TSecr=373750616"
"403","2018-08-07 18:04:36.677852","192.168.2.3","216.58.197.4","TCP","1434","49253  >  443 [ACK] Seq=213394 Ack=6859 Win=1522 Len=1368 TSval=591510 TSecr=373750616 [TCP segment of a reassembled PDU]"
"404","2018-08-07 18:04:36.678120","192.168.2.3","216.58.197.4","TLSv1.2","1146","Application Data"
"405","2018-08-07 18:04:36.678121","192.168.2.3","216.58.197.4","TLSv1.2","102","Application Data"
"410","2018-08-07 18:04:36.740442","192.168.2.3","216.58.197.4","TCP","66","49253  >  443 [ACK] Seq=215878 Ack=7827 Win=1522 Len=0 TSval=591516 TSecr=373750701"
"413","2018-08-07 18:04:36.812443","192.168.2.3","216.58.197.4","TCP","66","49253  >  443 [ACK] Seq=215878 Ack=8209 Win=1522 Len=0 TSval=591523 TSecr=373750767"
"415","2018-08-07 18:04:36.996234","192.168.2.3","216.58.197.4","TCP","66","49253  >  443 [ACK] Seq=215878 Ack=8282 Win=1522 Len=0 TSval=591542 TSecr=373750927"