"No.","Time","Source","Destination","Protocol","Length","Info"
"7","2018-08-07 18:03:40.415028","192.168.2.3","216.58.197.4","TLSv1.2","156","[TCP Previous segment not captured] , Application Data"
"8","2018-08-07 18:03:40.415032","192.168.2.3","216.58.197.4","TLSv1.2","104","Application Data"
"9","2018-08-07 18:03:40.419212","192.168.2.3","216.58.197.4","TLSv1.2","158","Application Data"
"13","2018-08-07 18:03:40.431829","192.168.2.3","216.58.197.4","TCP","1434","49253  >  443 [ACK] Seq=222 Ack=39 Win=1522 Len=1368 TSval=585885 TSecr=373694383 [TCP segment of a reassembled PDU]"
"14","2018-08-07 18:03:40.432228","192.168.2.3","216.58.197.4","TCP","1434","49253  >  443 [ACK] Seq=1590 Ack=39 Win=1522 Len=1368 TSval=585885 TSecr=373694383 [TCP segment of a reassembled PDU]"
"15","2018-08-07 18:03:40.432231","192.168.2.3","216.58.197.4","TLSv1.2","212","Application Data"
"16","2018-08-07 18:03:40.432232","192.168.2.3","216.58.197.4","TCP","1434","49253  >  443 [ACK] Seq=3104 Ack=39 Win=1522 Len=1368 TSval=585885 TSecr=373694383 [TCP segment of a reassembled PDU]"
"17","2018-08-07 18:03:40.432464","192.168.2.3","216.58.197.4","TLSv1.2","286","Application Data"
"18","2018-08-07 18:03:40.432740","192.168.2.3","216.58.197.4","TCP","1434","49253  >  443 [ACK] Seq=4692 Ack=39 Win=1522 Len=1368 TSval=585885 TSecr=373694383 [TCP segment of a reassembled PDU]"
"19","2018-08-07 18:03:40.432742","192.168.2.3","216.58.197.4","TCP","1434","49253  >  443 [ACK] Seq=6060 Ack=39 Win=1522 Len=1368 TSval=585885 TSecr=373694383 [TCP segment of a reassembled PDU]"
"20","2018-08-07 18:03:40.432899","192.168.2.3","216.58.197.4","TLSv1.2","212","Application Data"
"21","2018-08-07 18:03:40.433186","192.168.2.3","216.58.197.4","TCP","1434","49253  >  443 [ACK] Seq=7574 Ack=39 Win=1522 Len=1368 TSval=585885 TSecr=373694383 [TCP segment of a reassembled PDU]"
"27","2018-08-07 18:03:40.439010","192.168.2.3","216.58.197.4","TLSv1.2","1434","Application Data [TCP segment of a reassembled PDU]"
"28","2018-08-07 18:03:40.439012","192.168.2.3","216.58.197.4","TCP","1434","49253  >  443 [ACK] Seq=10310 Ack=39 Win=1522 Len=1368 TSval=585886 TSecr=373694400 [TCP segment of a reassembled PDU]"
"29","2018-08-07 18:03:40.439212","192.168.2.3","216.58.197.4","TLSv1.2","1434","Application Data [TCP segment of a reassembled PDU]"
"30","2018-08-07 18:03:40.439740","192.168.2.3","216.58.197.4","TLSv1.2","1434","Application Data [TCP segment of a reassembled PDU]"
"31","2018-08-07 18:03:40.441802","192.168.2.3","216.58.197.4","TCP","1434","49253  >  443 [ACK] Seq=14414 Ack=39 Win=1522 Len=1368 TSval=585886 TSecr=373694400 [TCP segment of a reassembled PDU]"
"32","2018-08-07 18:03:40.441960","192.168.2.3","216.58.197.4","TLSv1.2","1434","Application Data [TCP segment of a reassembled PDU]"
"33","2018-08-07 18:03:40.442129","192.168.2.3","216.58.197.4","TLSv1.2","1434","Application Data [TCP segment of a reassembled PDU]"
"34","2018-08-07 18:03:40.442420","192.168.2.3","216.58.197.4","TCP","1434","49253  >  443 [ACK] Seq=18518 Ack=39 Win=1522 Len=1368 TSval=585886 TSecr=373694400 [TCP segment of a reassembled PDU]"
"35","2018-08-07 18:03:40.442427","192.168.2.3","216.58.197.4","TLSv1.2","1434","Application Data [TCP segment of a reassembled PDU]"
"36","2018-08-07 18:03:40.442548","192.168.2.3","216.58.197.4","TLSv1.2","1434","Application Data [TCP segment of a reassembled PDU]"
"37","2018-08-07 18:03:40.442944","192.168.2.3","216.58.197.4","TCP","1434","49253  >  443 [ACK] Seq=22622 Ack=39 Win=1522 Len=1368 TSval=585886 TSecr=373694401 [TCP segment of a reassembled PDU]"
"38","2018-08-07 18:03:40.442946","192.168.2.3","216.58.197.4","TLSv1.2","1434","Application Data [TCP segment of a reassembled PDU]"
"39","2018-08-07 18:03:40.443449","192.168.2.3","216.58.197.4","TLSv1.2","1434","Application Data [TCP segment of a reassembled PDU]"
"40","2018-08-07 18:03:40.443451","192.168.2.3","216.58.197.4","TCP","1434","49253  >  443 [ACK] Seq=26726 Ack=39 Win=1522 Len=1368 TSval=585886 TSecr=373694401 [TCP segment of a reassembled PDU]"
"41","2018-08-07 18:03:40.443684","192.168.2.3","216.58.197.4","TLSv1.2","1434","Application Data [TCP segment of a reassembled PDU]"
"44","2018-08-07 18:03:40.445396","192.168.2.3","216.58.197.4","TLSv1.2","1434","Application Data [TCP segment of a reassembled PDU]"
"45","2018-08-07 18:03:40.445871","192.168.2.3","216.58.197.4","TCP","1434","49253  >  443 [ACK] Seq=30830 Ack=39 Win=1522 Len=1368 TSval=585887 TSecr=373694407 [TCP segment of a reassembled PDU]"
"46","2018-08-07 18:03:40.445874","192.168.2.3","216.58.197.4","TCP","1434","49253  >  443 [ACK] Seq=32198 Ack=39 Win=1522 Len=1368 TSval=585887 TSecr=373694407 [TCP segment of a reassembled PDU]"
"47","2018-08-07 18:03:40.446132","192.168.2.3","216.58.197.4","TLSv1.2","1434","Application Data [TCP segment of a reassembled PDU]"
"49","2018-08-07 18:03:40.446730","192.168.2.3","216.58.197.4","TLSv1.2","1434","Application Data [TCP segment of a reassembled PDU]"
"55","2018-08-07 18:03:40.450019","192.168.2.3","216.58.197.4","TCP","1434","49253  >  443 [ACK] Seq=36302 Ack=39 Win=1522 Len=1368 TSval=585887 TSecr=373694410 [TCP segment of a reassembled PDU]"
"56","2018-08-07 18:03:40.450280","192.168.2.3","216.58.197.4","TLSv1.2","1434","Application Data [TCP segment of a reassembled PDU]"
"57","2018-08-07 18:03:40.450281","192.168.2.3","216.58.197.4","TLSv1.2","1434","Application Data [TCP segment of a reassembled PDU]"
"59","2018-08-07 18:03:40.450587","192.168.2.3","216.58.197.4","TCP","1434","49253  >  443 [ACK] Seq=40406 Ack=39 Win=1522 Len=1368 TSval=585887 TSecr=373694410 [TCP segment of a reassembled PDU]"
"60","2018-08-07 18:03:40.450589","192.168.2.3","216.58.197.4","TLSv1.2","1434","Application Data [TCP segment of a reassembled PDU]"
"61","2018-08-07 18:03:40.450879","192.168.2.3","216.58.197.4","TLSv1.2","1434","Application Data [TCP segment of a reassembled PDU]"
"62","2018-08-07 18:03:40.450881","192.168.2.3","216.58.197.4","TCP","1434","49253  >  443 [ACK] Seq=44510 Ack=39 Win=1522 Len=1368 TSval=585887 TSecr=373694410 [TCP segment of a reassembled PDU]"
"63","2018-08-07 18:03:40.451118","192.168.2.3","216.58.197.4","TLSv1.2","1434","Application Data [TCP segment of a reassembled PDU]"
"65","2018-08-07 18:03:40.451368","192.168.2.3","216.58.197.4","TLSv1.2","1434","Application Data [TCP segment of a reassembled PDU]"
"66","2018-08-07 18:03:40.451715","192.168.2.3","216.58.197.4","TCP","1434","49253  >  443 [ACK] Seq=48614 Ack=39 Win=1522 Len=1368 TSval=585887 TSecr=373694411 [TCP segment of a reassembled PDU]"
"67","2018-08-07 18:03:40.451716","192.168.2.3","216.58.197.4","TLSv1.2","1434","Application Data [TCP segment of a reassembled PDU]"
"68","2018-08-07 18:03:40.451855","192.168.2.3","216.58.197.4","TCP","1434","49253  >  443 [ACK] Seq=51350 Ack=39 Win=1522 Len=1368 TSval=585887 TSecr=373694411 [TCP segment of a reassembled PDU]"
"69","2018-08-07 18:03:40.452131","192.168.2.3","216.58.197.4","TLSv1.2","1434","Application Data [TCP segment of a reassembled PDU]"
"70","2018-08-07 18:03:40.453245","192.168.2.3","216.58.197.4","TLSv1.2","657","Application Data"
"78","2018-08-07 18:03:40.519621","192.168.2.3","216.58.197.4","TCP","1434","49253  >  443 [ACK] Seq=54677 Ack=39 Win=1522 Len=1368 TSval=585894 TSecr=373694461 [TCP segment of a reassembled PDU]"
"79","2018-08-07 18:03:40.520127","192.168.2.3","216.58.197.4","TCP","1434","49253  >  443 [ACK] Seq=56045 Ack=39 Win=1522 Len=1368 TSval=585894 TSecr=373694461 [TCP segment of a reassembled PDU]"
"80","2018-08-07 18:03:40.520129","192.168.2.3","216.58.197.4","TLSv1.2","212","Application Data"
"81","2018-08-07 18:03:40.520498","192.168.2.3","216.58.197.4","TCP","1434","49253  >  443 [ACK] Seq=57559 Ack=39 Win=1522 Len=1368 TSval=585894 TSecr=373694461 [TCP segment of a reassembled PDU]"
"82","2018-08-07 18:03:40.520500","192.168.2.3","216.58.197.4","TLSv1.2","155","Application Data"
"86","2018-08-07 18:03:40.621855","192.168.2.3","216.58.197.4","TCP","1434","49253  >  443 [ACK] Seq=59016 Ack=39 Win=1522 Len=1368 TSval=585904 TSecr=373694489 [TCP segment of a reassembled PDU]"
"87","2018-08-07 18:03:40.621866","192.168.2.3","216.58.197.4","TCP","1434","49253  >  443 [ACK] Seq=60384 Ack=39 Win=1522 Len=1368 TSval=585904 TSecr=373694489 [TCP segment of a reassembled PDU]"
"88","2018-08-07 18:03:40.621941","192.168.2.3","216.58.197.4","TLSv1.2","212","Application Data"
"89","2018-08-07 18:03:40.621945","192.168.2.3","216.58.197.4","TLSv1.2","470","Application Data"
"92","2018-08-07 18:03:40.685547","192.168.2.3","216.58.197.4","TCP","66","49253  >  443 [ACK] Seq=62302 Ack=73 Win=1522 Len=0 TSval=585911 TSecr=373694609"
"93","2018-08-07 18:03:40.724164","192.168.2.3","216.58.197.4","TCP","1434","49253  >  443 [ACK] Seq=62302 Ack=73 Win=1522 Len=1368 TSval=585914 TSecr=373694609 [TCP segment of a reassembled PDU]"
"94","2018-08-07 18:03:40.724168","192.168.2.3","216.58.197.4","TCP","1434","49253  >  443 [ACK] Seq=63670 Ack=73 Win=1522 Len=1368 TSval=585914 TSecr=373694609 [TCP segment of a reassembled PDU]"
"95","2018-08-07 18:03:40.724168","192.168.2.3","216.58.197.4","TLSv1.2","212","Application Data"
"96","2018-08-07 18:03:40.724427","192.168.2.3","216.58.197.4","TLSv1.2","1062","Application Data"
"99","2018-08-07 18:03:40.840766","192.168.2.3","216.58.197.4","TCP","1434","49253  >  443 [ACK] Seq=66180 Ack=73 Win=1522 Len=1368 TSval=585926 TSecr=373694733 [TCP segment of a reassembled PDU]"
"100","2018-08-07 18:03:40.841033","192.168.2.3","216.58.197.4","TCP","1434","49253  >  443 [ACK] Seq=67548 Ack=73 Win=1522 Len=1368 TSval=585926 TSecr=373694733 [TCP segment of a reassembled PDU]"
"101","2018-08-07 18:03:40.841036","192.168.2.3","216.58.197.4","TLSv1.2","212","Application Data"
"102","2018-08-07 18:03:40.841558","192.168.2.3","216.58.197.4","TLSv1.2","1040","Application Data"
"109","2018-08-07 18:03:40.927502","192.168.2.3","216.58.197.4","TCP","66","49253  >  443 [ACK] Seq=70036 Ack=142 Win=1522 Len=0 TSval=585935 TSecr=373694890"
"110","2018-08-07 18:03:40.929068","192.168.2.3","216.58.197.4","TCP","66","49253  >  443 [ACK] Seq=70036 Ack=273 Win=1522 Len=0 TSval=585935 TSecr=373694890"
"111","2018-08-07 18:03:40.929070","192.168.2.3","216.58.197.4","TCP","66","49253  >  443 [ACK] Seq=70036 Ack=402 Win=1522 Len=0 TSval=585935 TSecr=373694890"
"113","2018-08-07 18:03:40.938316","192.168.2.3","216.58.197.4","TCP","66","49253  >  443 [ACK] Seq=70036 Ack=661 Win=1522 Len=0 TSval=585936 TSecr=373694900"
"114","2018-08-07 18:03:40.944282","192.168.2.3","216.58.197.4","TCP","1434","49253  >  443 [ACK] Seq=70036 Ack=661 Win=1522 Len=1368 TSval=585936 TSecr=373694900 [TCP segment of a reassembled PDU]"
"115","2018-08-07 18:03:40.944284","192.168.2.3","216.58.197.4","TCP","1434","49253  >  443 [ACK] Seq=71404 Ack=661 Win=1522 Len=1368 TSval=585936 TSecr=373694900 [TCP segment of a reassembled PDU]"
"116","2018-08-07 18:03:40.944286","192.168.2.3","216.58.197.4","TLSv1.2","212","Application Data"
"117","2018-08-07 18:03:40.944550","192.168.2.3","216.58.197.4","TLSv1.2","1378","Application Data"
"120","2018-08-07 18:03:41.043354","192.168.2.3","216.58.197.4","TCP","1434","49253  >  443 [ACK] Seq=74230 Ack=661 Win=1522 Len=1368 TSval=585946 TSecr=373694912 [TCP segment of a reassembled PDU]"
"121","2018-08-07 18:03:41.043779","192.168.2.3","216.58.197.4","TCP","1434","49253  >  443 [ACK] Seq=75598 Ack=661 Win=1522 Len=1368 TSval=585946 TSecr=373694912 [TCP segment of a reassembled PDU]"
"122","2018-08-07 18:03:41.043782","192.168.2.3","216.58.197.4","TLSv1.2","212","Application Data"
"123","2018-08-07 18:03:41.043783","192.168.2.3","216.58.197.4","TLSv1.2","709","Application Data"
"127","2018-08-07 18:03:41.124651","192.168.2.3","216.58.197.4","TCP","66","49253  >  443 [ACK] Seq=77755 Ack=960 Win=1522 Len=0 TSval=585955 TSecr=373695050"
"128","2018-08-07 18:03:41.163991","192.168.2.3","216.58.197.4","TCP","1434","49253  >  443 [ACK] Seq=77755 Ack=960 Win=1522 Len=1368 TSval=585958 TSecr=373695050 [TCP segment of a reassembled PDU]"
"129","2018-08-07 18:03:41.164455","192.168.2.3","216.58.197.4","TCP","1434","49253  >  443 [ACK] Seq=79123 Ack=960 Win=1522 Len=1368 TSval=585958 TSecr=373695050 [TCP segment of a reassembled PDU]"
"130","2018-08-07 18:03:41.164678","192.168.2.3","216.58.197.4","TLSv1.2","212","Application Data"
"131","2018-08-07 18:03:41.165050","192.168.2.3","216.58.197.4","TLSv1.2","708","Application Data"
"135","2018-08-07 18:03:41.264064","192.168.2.3","216.58.197.4","TCP","66","49253  >  443 [ACK] Seq=81279 Ack=1231 Win=1522 Len=0 TSval=585968 TSecr=373695223"
"136","2018-08-07 18:03:41.264067","192.168.2.3","216.58.197.4","TCP","1434","49253  >  443 [ACK] Seq=81279 Ack=1231 Win=1522 Len=1368 TSval=585968 TSecr=373695223 [TCP segment of a reassembled PDU]"
"137","2018-08-07 18:03:41.264255","192.168.2.3","216.58.197.4","TCP","1434","49253  >  443 [ACK] Seq=82647 Ack=1231 Win=1522 Len=1368 TSval=585968 TSecr=373695223 [TCP segment of a reassembled PDU]"
"138","2018-08-07 18:03:41.264371","192.168.2.3","216.58.197.4","TLSv1.2","212","Application Data"
"139","2018-08-07 18:03:41.264654","192.168.2.3","216.58.197.4","TLSv1.2","1414","Application Data"
"142","2018-08-07 18:03:41.366547","192.168.2.3","216.58.197.4","TCP","1434","49253  >  443 [ACK] Seq=85509 Ack=1231 Win=1522 Len=1368 TSval=585979 TSecr=373695233 [TCP segment of a reassembled PDU]"
"143","2018-08-07 18:03:41.367002","192.168.2.3","216.58.197.4","TCP","1434","49253  >  443 [ACK] Seq=86877 Ack=1231 Win=1522 Len=1368 TSval=585979 TSecr=373695233 [TCP segment of a reassembled PDU]"
"144","2018-08-07 18:03:41.367005","192.168.2.3","216.58.197.4","TLSv1.2","212","Application Data"
"145","2018-08-07 18:03:41.367006","192.168.2.3","216.58.197.4","TLSv1.2","362","Application Data"
"147","2018-08-07 18:03:41.482593","192.168.2.3","216.58.197.4","TCP","1434","49253  >  443 [ACK] Seq=88687 Ack=1231 Win=1522 Len=1368 TSval=585990 TSecr=373695337 [TCP segment of a reassembled PDU]"
"148","2018-08-07 18:03:41.482620","192.168.2.3","216.58.197.4","TCP","1434","49253  >  443 [ACK] Seq=90055 Ack=1231 Win=1522 Len=1368 TSval=585990 TSecr=373695337 [TCP segment of a reassembled PDU]"
"149","2018-08-07 18:03:41.482819","192.168.2.3","216.58.197.4","TLSv1.2","212","Application Data"
"150","2018-08-07 18:03:41.482822","192.168.2.3","216.58.197.4","TCP","1434","49253  >  443 [ACK] Seq=91569 Ack=1231 Win=1522 Len=1368 TSval=585990 TSecr=373695337 [TCP segment of a reassembled PDU]"
"151","2018-08-07 18:03:41.482962","192.168.2.3","216.58.197.4","TLSv1.2","81","Application Data"
"155","2018-08-07 18:03:41.580109","192.168.2.3","216.58.197.4","TCP","1434","49253  >  443 [ACK] Seq=92952 Ack=1231 Win=1522 Len=1368 TSval=586000 TSecr=373695491 [TCP segment of a reassembled PDU]"
"156","2018-08-07 18:03:41.580526","192.168.2.3","216.58.197.4","TCP","1434","49253  >  443 [ACK] Seq=94320 Ack=1231 Win=1522 Len=1368 TSval=586000 TSecr=373695491 [TCP segment of a reassembled PDU]"
"157","2018-08-07 18:03:41.580527","192.168.2.3","216.58.197.4","TLSv1.2","212","Application Data"
"158","2018-08-07 18:03:41.580528","192.168.2.3","216.58.197.4","TCP","1434","49253  >  443 [ACK] Seq=95834 Ack=1231 Win=1522 Len=1368 TSval=586000 TSecr=373695491 [TCP segment of a reassembled PDU]"
"159","2018-08-07 18:03:41.580529","192.168.2.3","216.58.197.4","TLSv1.2","155","Application Data"
"163","2018-08-07 18:03:41.674353","192.168.2.3","216.58.197.4","TCP","1434","49253  >  443 [ACK] Seq=97291 Ack=1231 Win=1522 Len=1368 TSval=586009 TSecr=373695548 [TCP segment of a reassembled PDU]"
"164","2018-08-07 18:03:41.675079","192.168.2.3","216.58.197.4","TCP","1434","49253  >  443 [ACK] Seq=98659 Ack=1231 Win=1522 Len=1368 TSval=586009 TSecr=373695548 [TCP segment of a reassembled PDU]"
"165","2018-08-07 18:03:41.675082","192.168.2.3","216.58.197.4","TLSv1.2","212","Application Data"
"166","2018-08-07 18:03:41.675438","192.168.2.3","216.58.197.4","TCP","1434","49253  >  443 [ACK] Seq=100173 Ack=1231 Win=1522 Len=1368 TSval=586009 TSecr=373695548 [TCP segment of a reassembled PDU]"
"167","2018-08-07 18:03:41.675452","192.168.2.3","216.58.197.4","TLSv1.2","155","Application Data"
"171","2018-08-07 18:03:41.767420","192.168.2.3","216.58.197.4","TCP","1434","49253  >  443 [ACK] Seq=101630 Ack=1231 Win=1522 Len=1368 TSval=586019 TSecr=373695643 [TCP segment of a reassembled PDU]"
"172","2018-08-07 18:03:41.767770","192.168.2.3","216.58.197.4","TCP","1434","49253  >  443 [ACK] Seq=102998 Ack=1231 Win=1522 Len=1368 TSval=586019 TSecr=373695643 [TCP segment of a reassembled PDU]"
"173","2018-08-07 18:03:41.767773","192.168.2.3","216.58.197.4","TLSv1.2","212","Application Data"
"176","2018-08-07 18:03:41.772560","192.168.2.3","216.58.197.4","TCP","1434","49253  >  443 [ACK] Seq=104512 Ack=1231 Win=1522 Len=1368 TSval=586019 TSecr=373695643 [TCP segment of a reassembled PDU]"
"177","2018-08-07 18:03:41.772562","192.168.2.3","216.58.197.4","TLSv1.2","155","Application Data"
"181","2018-08-07 18:03:41.850434","192.168.2.3","216.58.197.4","TCP","66","49253  >  443 [ACK] Seq=105969 Ack=1848 Win=1522 Len=0 TSval=586027 TSecr=373695806"
"182","2018-08-07 18:03:41.864968","192.168.2.3","216.58.197.4","TCP","1434","49253  >  443 [ACK] Seq=105969 Ack=1848 Win=1522 Len=1368 TSval=586029 TSecr=373695806 [TCP segment of a reassembled PDU]"
"183","2018-08-07 18:03:41.865453","192.168.2.3","216.58.197.4","TCP","1434","49253  >  443 [ACK] Seq=107337 Ack=1848 Win=1522 Len=1368 TSval=586029 TSecr=373695806 [TCP segment of a reassembled PDU]"
"184","2018-08-07 18:03:41.865456","192.168.2.3","216.58.197.4","TLSv1.2","212","Application Data"
"185","2018-08-07 18:03:41.865457","192.168.2.3","216.58.197.4","TCP","1434","49253  >  443 [ACK] Seq=108851 Ack=1848 Win=1522 Len=1368 TSval=586029 TSecr=373695806 [TCP segment of a reassembled PDU]"
"186","2018-08-07 18:03:41.865458","192.168.2.3","216.58.197.4","TLSv1.2","155","Application Data"
"192","2018-08-07 18:03:41.937075","192.168.2.3","216.58.197.4","TCP","66","49253  >  443 [ACK] Seq=110308 Ack=2321 Win=1522 Len=0 TSval=586036 TSecr=373695890"
"195","2018-08-07 18:03:41.939934","192.168.2.3","216.58.197.4","TCP","66","49253  >  443 [ACK] Seq=110308 Ack=2831 Win=1522 Len=0 TSval=586036 TSecr=373695901"
"196","2018-08-07 18:03:41.961866","192.168.2.3","216.58.197.4","TCP","1434","49253  >  443 [ACK] Seq=110308 Ack=2831 Win=1522 Len=1368 TSval=586038 TSecr=373695901 [TCP segment of a reassembled PDU]"
"197","2018-08-07 18:03:41.961966","192.168.2.3","216.58.197.4","TCP","1434","49253  >  443 [ACK] Seq=111676 Ack=2831 Win=1522 Len=1368 TSval=586038 TSecr=373695901 [TCP segment of a reassembled PDU]"
"198","2018-08-07 18:03:41.961968","192.168.2.3","216.58.197.4","TLSv1.2","212","Application Data"
"199","2018-08-07 18:03:41.962283","192.168.2.3","216.58.197.4","TCP","1434","49253  >  443 [ACK] Seq=113190 Ack=2831 Win=1522 Len=1368 TSval=586038 TSecr=373695901 [TCP segment of a reassembled PDU]"
"200","2018-08-07 18:03:41.962286","192.168.2.3","216.58.197.4","TLSv1.2","155","Application Data"
"205","2018-08-07 18:03:42.031004","192.168.2.3","216.58.197.4","TCP","66","49253  >  443 [ACK] Seq=114647 Ack=3038 Win=1522 Len=0 TSval=586045 TSecr=373695993"
"206","2018-08-07 18:03:42.060826","192.168.2.3","216.58.197.4","TCP","1434","49253  >  443 [ACK] Seq=114647 Ack=3038 Win=1522 Len=1368 TSval=586048 TSecr=373695993 [TCP segment of a reassembled PDU]"
"207","2018-08-07 18:03:42.061195","192.168.2.3","216.58.197.4","TCP","1434","49253  >  443 [ACK] Seq=116015 Ack=3038 Win=1522 Len=1368 TSval=586048 TSecr=373695993 [TCP segment of a reassembled PDU]"
"208","2018-08-07 18:03:42.061198","192.168.2.3","216.58.197.4","TLSv1.2","212","Application Data"
"209","2018-08-07 18:03:42.061198","192.168.2.3","216.58.197.4","TCP","1434","49253  >  443 [ACK] Seq=117529 Ack=3038 Win=1522 Len=1368 TSval=586048 TSecr=373695993 [TCP segment of a reassembled PDU]"
"210","2018-08-07 18:03:42.061328","192.168.2.3","216.58.197.4","TLSv1.2","155","Application Data"
"216","2018-08-07 18:03:42.120403","192.168.2.3","216.58.197.4","TCP","66","49253  >  443 [ACK] Seq=118986 Ack=3392 Win=1522 Len=0 TSval=586054 TSecr=373696081"
"217","2018-08-07 18:03:42.135452","192.168.2.3","172.217.27.163","TCP","66","38971  >  443 [ACK] Seq=1 Ack=1 Win=406 Len=0 TSval=586056 TSecr=467926169"
"219","2018-08-07 18:03:42.155746","192.168.2.3","216.58.197.4","TCP","1434","49253  >  443 [ACK] Seq=118986 Ack=3392 Win=1522 Len=1368 TSval=586057 TSecr=373696081 [TCP segment of a reassembled PDU]"
"220","2018-08-07 18:03:42.158155","192.168.2.3","216.58.197.4","TCP","1434","49253  >  443 [ACK] Seq=120354 Ack=3392 Win=1522 Len=1368 TSval=586057 TSecr=373696081 [TCP segment of a reassembled PDU]"
"221","2018-08-07 18:03:42.158159","192.168.2.3","216.58.197.4","TLSv1.2","212","Application Data"
"222","2018-08-07 18:03:42.158566","192.168.2.3","216.58.197.4","TCP","1434","49253  >  443 [ACK] Seq=121868 Ack=3392 Win=1522 Len=1368 TSval=586057 TSecr=373696081 [TCP segment of a reassembled PDU]"
"223","2018-08-07 18:03:42.158568","192.168.2.3","216.58.197.4","TLSv1.2","155","Application Data"
"229","2018-08-07 18:03:42.224007","192.168.2.3","216.58.197.4","TCP","66","49253  >  443 [ACK] Seq=123325 Ack=3692 Win=1522 Len=0 TSval=586064 TSecr=373696182"
"230","2018-08-07 18:03:42.263211","192.168.2.3","216.58.197.4","TCP","1434","49253  >  443 [ACK] Seq=123325 Ack=3692 Win=1522 Len=1368 TSval=586068 TSecr=373696182 [TCP segment of a reassembled PDU]"
"231","2018-08-07 18:03:42.263216","192.168.2.3","216.58.197.4","TCP","1434","49253  >  443 [ACK] Seq=124693 Ack=3692 Win=1522 Len=1368 TSval=586068 TSecr=373696182 [TCP segment of a reassembled PDU]"
"232","2018-08-07 18:03:42.263217","192.168.2.3","216.58.197.4","TLSv1.2","212","Application Data"
"233","2018-08-07 18:03:42.263345","192.168.2.3","216.58.197.4","TCP","1434","49253  >  443 [ACK] Seq=126207 Ack=3692 Win=1522 Len=1368 TSval=586068 TSecr=373696182 [TCP segment of a reassembled PDU]"
"234","2018-08-07 18:03:42.263654","192.168.2.3","216.58.197.4","TLSv1.2","155","Application Data"
"238","2018-08-07 18:03:42.377070","192.168.2.3","216.58.197.4","TCP","1434","49253  >  443 [ACK] Seq=127664 Ack=3692 Win=1522 Len=1368 TSval=586080 TSecr=373696231 [TCP segment of a reassembled PDU]"
"239","2018-08-07 18:03:42.377395","192.168.2.3","216.58.197.4","TCP","1434","49253  >  443 [ACK] Seq=129032 Ack=3692 Win=1522 Len=1368 TSval=586080 TSecr=373696231 [TCP segment of a reassembled PDU]"
"240","2018-08-07 18:03:42.377397","192.168.2.3","216.58.197.4","TLSv1.2","212","Application Data"
"241","2018-08-07 18:03:42.377857","192.168.2.3","216.58.197.4","TCP","1434","49253  >  443 [ACK] Seq=130546 Ack=3692 Win=1522 Len=1368 TSval=586080 TSecr=373696231 [TCP segment of a reassembled PDU]"
"242","2018-08-07 18:03:42.377860","192.168.2.3","216.58.197.4","TLSv1.2","155","Application Data"
"246","2018-08-07 18:03:42.444494","192.168.2.3","216.58.197.4","TCP","66","49253  >  443 [ACK] Seq=132003 Ack=4136 Win=1522 Len=0 TSval=586086 TSecr=373696404"
"247","2018-08-07 18:03:42.479117","192.168.2.3","216.58.197.4","TCP","1434","49253  >  443 [ACK] Seq=132003 Ack=4136 Win=1522 Len=1368 TSval=586090 TSecr=373696404 [TCP segment of a reassembled PDU]"
"248","2018-08-07 18:03:42.479426","192.168.2.3","216.58.197.4","TCP","1434","49253  >  443 [ACK] Seq=133371 Ack=4136 Win=1522 Len=1368 TSval=586090 TSecr=373696404 [TCP segment of a reassembled PDU]"
"249","2018-08-07 18:03:42.479428","192.168.2.3","216.58.197.4","TLSv1.2","212","Application Data"
"250","2018-08-07 18:03:42.479428","192.168.2.3","216.58.197.4","TLSv1.2","1075","Application Data"
"254","2018-08-07 18:03:42.542494","192.168.2.3","216.58.197.4","TCP","66","49253  >  443 [ACK] Seq=135894 Ack=4613 Win=1522 Len=0 TSval=586096 TSecr=373696505"
"255","2018-08-07 18:03:42.604677","192.168.2.3","216.58.197.4","TCP","1434","49253  >  443 [ACK] Seq=135894 Ack=4613 Win=1522 Len=1368 TSval=586102 TSecr=373696505 [TCP segment of a reassembled PDU]"
"256","2018-08-07 18:03:42.604943","192.168.2.3","216.58.197.4","TCP","1434","49253  >  443 [ACK] Seq=137262 Ack=4613 Win=1522 Len=1368 TSval=586102 TSecr=373696505 [TCP segment of a reassembled PDU]"
"257","2018-08-07 18:03:42.604945","192.168.2.3","216.58.197.4","TLSv1.2","212","Application Data"
"258","2018-08-07 18:03:42.605122","192.168.2.3","216.58.197.4","TCP","1434","49253  >  443 [ACK] Seq=138776 Ack=4613 Win=1522 Len=1368 TSval=586102 TSecr=373696505 [TCP segment of a reassembled PDU]"
"259","2018-08-07 18:03:42.605124","192.168.2.3","216.58.197.4","TLSv1.2","155","Application Data"
"263","2018-08-07 18:03:42.703490","192.168.2.3","216.58.197.4","TCP","1434","49253  >  443 [ACK] Seq=140233 Ack=4613 Win=1522 Len=1368 TSval=586112 TSecr=373696573 [TCP segment of a reassembled PDU]"
"264","2018-08-07 18:03:42.703940","192.168.2.3","216.58.197.4","TCP","1434","49253  >  443 [ACK] Seq=141601 Ack=4613 Win=1522 Len=1368 TSval=586112 TSecr=373696573 [TCP segment of a reassembled PDU]"
"265","2018-08-07 18:03:42.703943","192.168.2.3","216.58.197.4","TLSv1.2","212","Application Data"
"266","2018-08-07 18:03:42.704322","192.168.2.3","216.58.197.4","TCP","1434","49253  >  443 [ACK] Seq=143115 Ack=4613 Win=1522 Len=1368 TSval=586112 TSecr=373696573 [TCP segment of a reassembled PDU]"
"267","2018-08-07 18:03:42.704325","192.168.2.3","216.58.197.4","TLSv1.2","155","Application Data"
"271","2018-08-07 18:03:42.806059","192.168.2.3","216.58.197.4","TCP","1434","49253  >  443 [ACK] Seq=144572 Ack=4613 Win=1522 Len=1368 TSval=586123 TSecr=373696672 [TCP segment of a reassembled PDU]"
"272","2018-08-07 18:03:42.806480","192.168.2.3","216.58.197.4","TCP","1434","49253  >  443 [ACK] Seq=145940 Ack=4613 Win=1522 Len=1368 TSval=586123 TSecr=373696672 [TCP segment of a reassembled PDU]"
"273","2018-08-07 18:03:42.806483","192.168.2.3","216.58.197.4","TLSv1.2","212","Application Data"
"274","2018-08-07 18:03:42.806484","192.168.2.3","216.58.197.4","TLSv1.2","936","Application Data"
"279","2018-08-07 18:03:42.875203","192.168.2.3","216.58.197.4","TCP","66","49253  >  443 [ACK] Seq=148324 Ack=4678 Win=1522 Len=0 TSval=586130 TSecr=373696807"
"280","2018-08-07 18:03:42.920924","192.168.2.3","216.58.197.4","TCP","1434","49253  >  443 [ACK] Seq=148324 Ack=4678 Win=1522 Len=1368 TSval=586134 TSecr=373696807 [TCP segment of a reassembled PDU]"
"281","2018-08-07 18:03:42.921150","192.168.2.3","216.58.197.4","TCP","1434","49253  >  443 [ACK] Seq=149692 Ack=4678 Win=1522 Len=1368 TSval=586134 TSecr=373696807 [TCP segment of a reassembled PDU]"
"282","2018-08-07 18:03:42.921152","192.168.2.3","216.58.197.4","TLSv1.2","212","Application Data"
"283","2018-08-07 18:03:42.921153","192.168.2.3","216.58.197.4","TLSv1.2","721","Application Data"
"286","2018-08-07 18:03:42.928455","192.168.2.3","216.58.197.4","TCP","66","49253  >  443 [ACK] Seq=151861 Ack=4968 Win=1522 Len=0 TSval=586135 TSecr=373696890"
"288","2018-08-07 18:03:42.938472","192.168.2.3","216.58.197.4","TCP","66","49253  >  443 [ACK] Seq=151861 Ack=5052 Win=1522 Len=0 TSval=586136 TSecr=373696900"
"289","2018-08-07 18:03:43.023170","192.168.2.3","216.58.197.4","TCP","1434","49253  >  443 [ACK] Seq=151861 Ack=5052 Win=1522 Len=1368 TSval=586144 TSecr=373696900 [TCP segment of a reassembled PDU]"
"290","2018-08-07 18:03:43.023515","192.168.2.3","216.58.197.4","TCP","1434","49253  >  443 [ACK] Seq=153229 Ack=5052 Win=1522 Len=1368 TSval=586144 TSecr=373696900 [TCP segment of a reassembled PDU]"
"291","2018-08-07 18:03:43.023518","192.168.2.3","216.58.197.4","TLSv1.2","212","Application Data"
"292","2018-08-07 18:03:43.023870","192.168.2.3","216.58.197.4","TLSv1.2","1062","Application Data"
"295","2018-08-07 18:03:43.132185","192.168.2.3","216.58.197.4","TCP","1434","49253  >  443 [ACK] Seq=155739 Ack=5052 Win=1522 Len=1368 TSval=586155 TSecr=373696992 [TCP segment of a reassembled PDU]"
"296","2018-08-07 18:03:43.132190","192.168.2.3","216.58.197.4","TCP","1434","49253  >  443 [ACK] Seq=157107 Ack=5052 Win=1522 Len=1368 TSval=586155 TSecr=373696992 [TCP segment of a reassembled PDU]"
"297","2018-08-07 18:03:43.132191","192.168.2.3","216.58.197.4","TLSv1.2","212","Application Data"
"298","2018-08-07 18:03:43.132347","192.168.2.3","216.58.197.4","TLSv1.2","1047","Application Data"
"303","2018-08-07 18:03:43.184423","192.168.2.3","216.58.197.4","TCP","66","49253  >  443 [ACK] Seq=159602 Ack=5292 Win=1522 Len=0 TSval=586160 TSecr=373697147"
"304","2018-08-07 18:03:43.184765","192.168.2.3","216.58.197.4","TCP","66","49253  >  443 [ACK] Seq=159602 Ack=5405 Win=1522 Len=0 TSval=586160 TSecr=373697147"
"305","2018-08-07 18:03:43.241963","192.168.2.3","216.58.197.4","TCP","1434","49253  >  443 [ACK] Seq=159602 Ack=5405 Win=1522 Len=1368 TSval=586166 TSecr=373697147 [TCP segment of a reassembled PDU]"
"306","2018-08-07 18:03:43.245832","192.168.2.3","216.58.197.4","TCP","1434","49253  >  443 [ACK] Seq=160970 Ack=5405 Win=1522 Len=1368 TSval=586166 TSecr=373697147 [TCP segment of a reassembled PDU]"
"307","2018-08-07 18:03:43.245834","192.168.2.3","216.58.197.4","TLSv1.2","212","Application Data"
"308","2018-08-07 18:03:43.245835","192.168.2.3","216.58.197.4","TLSv1.2","700","Application Data"
"311","2018-08-07 18:03:43.349169","192.168.2.3","216.58.197.4","TCP","1434","49253  >  443 [ACK] Seq=163118 Ack=5405 Win=1522 Len=1368 TSval=586176 TSecr=373697214 [TCP segment of a reassembled PDU]"
"312","2018-08-07 18:03:43.349174","192.168.2.3","216.58.197.4","TCP","1434","49253  >  443 [ACK] Seq=164486 Ack=5405 Win=1522 Len=1368 TSval=586176 TSecr=373697214 [TCP segment of a reassembled PDU]"
"313","2018-08-07 18:03:43.349368","192.168.2.3","216.58.197.4","TLSv1.2","212","Application Data"
"314","2018-08-07 18:03:43.349532","192.168.2.3","216.58.197.4","TLSv1.2","1392","Application Data"
"320","2018-08-07 18:03:43.404251","192.168.2.3","216.58.197.4","TCP","66","49253  >  443 [ACK] Seq=167326 Ack=5721 Win=1522 Len=0 TSval=586182 TSecr=373697366"
"321","2018-08-07 18:03:43.408661","192.168.2.3","216.58.197.4","TCP","66","49253  >  443 [ACK] Seq=167326 Ack=5979 Win=1522 Len=0 TSval=586183 TSecr=373697367"
"322","2018-08-07 18:03:43.440370","192.168.2.3","216.58.197.4","TCP","1434","49253  >  443 [ACK] Seq=167326 Ack=5979 Win=1522 Len=1368 TSval=586186 TSecr=373697367 [TCP segment of a reassembled PDU]"
"323","2018-08-07 18:03:43.440373","192.168.2.3","216.58.197.4","TCP","1434","49253  >  443 [ACK] Seq=168694 Ack=5979 Win=1522 Len=1368 TSval=586186 TSecr=373697367 [TCP segment of a reassembled PDU]"
"324","2018-08-07 18:03:43.440374","192.168.2.3","216.58.197.4","TLSv1.2","146","Application Data"
"325","2018-08-07 18:03:43.440441","192.168.2.3","216.58.197.4","TLSv1.2","102","Application Data"
"330","2018-08-07 18:03:43.463187","192.168.2.3","216.58.197.4","TCP","66","49253  >  443 [ACK] Seq=170178 Ack=6700 Win=1522 Len=0 TSval=586188 TSecr=373697425"
"332","2018-08-07 18:03:43.715928","192.168.2.3","216.58.197.4","TCP","66","49253  >  443 [ACK] Seq=170178 Ack=6758 Win=1522 Len=0 TSval=586214 TSecr=373697641"
"334","2018-08-07 18:03:43.729777","192.168.2.3","216.58.197.4","TCP","66","49253  >  443 [ACK] Seq=170178 Ack=8041 Win=1522 Len=0 TSval=586215 TSecr=373697691"
"345","2018-08-07 18:03:43.786806","192.168.2.3","216.58.197.4","TCP","66","49253  >  443 [ACK] Seq=170178 Ack=10017 Win=1522 Len=0 TSval=586220 TSecr=373697744"
"346","2018-08-07 18:03:43.786809","192.168.2.3","216.58.197.4","TCP","66","49253  >  443 [ACK] Seq=170178 Ack=12853 Win=1522 Len=0 TSval=586220 TSecr=373697744"
"347","2018-08-07 18:03:43.786810","192.168.2.3","216.58.197.4","TCP","66","49253  >  443 [ACK] Seq=170178 Ack=15080 Win=1522 Len=0 TSval=586220 TSecr=373697744"
"348","2018-08-07 18:03:43.786868","192.168.2.3","216.58.197.4","TCP","66","49253  >  443 [ACK] Seq=170178 Ack=16860 Win=1522 Len=0 TSval=586221 TSecr=373697745"
"349","2018-08-07 18:03:43.793854","192.168.2.3","216.58.197.4","TCP","66","49253  >  443 [ACK] Seq=170178 Ack=18750 Win=1522 Len=0 TSval=586221 TSecr=373697748"
"352","2018-08-07 18:03:43.819162","192.168.2.3","216.58.197.4","TCP","66","49253  >  443 [ACK] Seq=170178 Ack=20617 Win=1522 Len=0 TSval=586224 TSecr=373697780"
"355","2018-08-07 18:03:43.820724","192.168.2.3","216.58.197.4","TCP","66","49253  >  443 [ACK] Seq=170178 Ack=21793 Win=1522 Len=0 TSval=586224 TSecr=373697783"
"361","2018-08-07 18:03:43.898849","192.168.2.3","216.58.197.4","TCP","66","49253  >  443 [ACK] Seq=170178 Ack=22659 Win=1522 Len=0 TSval=586232 TSecr=373697857"
"362","2018-08-07 18:03:43.899115","192.168.2.3","216.58.197.4","TLSv1.2","104","Application Data"
