"No.","Time","Source","Destination","Protocol","Length","Info"
"6","2018-08-07 17:49:25.686871","192.168.2.3","172.217.161.212","TCP","66","60980  >  443 [FIN, ACK] Seq=1 Ack=57 Win=1148 Len=0 TSval=500412 TSecr=536319240"
"11","2018-08-07 17:49:27.796070","192.168.2.3","172.217.27.163","TCP","66","39023  >  443 [FIN, ACK] Seq=1 Ack=57 Win=1534 Len=0 TSval=500623 TSecr=3337902794"
"15","2018-08-07 17:49:27.809070","192.168.2.3","172.217.27.170","TCP","66","38519  >  443 [FIN, ACK] Seq=1 Ack=57 Win=1059 Len=0 TSval=500624 TSecr=1980052268"
"18","2018-08-07 17:49:29.205898","192.168.2.3","172.217.27.161","TCP","66","38386  >  80 [ACK] Seq=1 Ack=2 Win=406 Len=0 TSval=500764 TSecr=1896171237"
"19","2018-08-07 17:49:29.885656","192.168.2.3","172.217.161.202","TCP","66","40750  >  443 [ACK] Seq=1 Ack=1 Win=296 Len=0 TSval=500832 TSecr=3727604675"
"21","2018-08-07 17:49:30.344652","192.168.2.3","216.58.197.4","TLSv1.2","156","Application Data"
"23","2018-08-07 17:49:30.351810","192.168.2.3","216.58.197.4","TLSv1.2","104","Application Data"
"24","2018-08-07 17:49:30.351813","192.168.2.3","216.58.197.4","TLSv1.2","159","Application Data"
"28","2018-08-07 17:49:30.367319","192.168.2.3","216.58.197.4","TCP","1434","49253  >  443 [ACK] Seq=222 Ack=39 Win=1522 Len=1368 TSval=500880 TSecr=372844318 [TCP segment of a reassembled PDU]"
"29","2018-08-07 17:49:30.367855","192.168.2.3","216.58.197.4","TCP","1434","49253  >  443 [ACK] Seq=1590 Ack=39 Win=1522 Len=1368 TSval=500880 TSecr=372844318 [TCP segment of a reassembled PDU]"
"30","2018-08-07 17:49:30.367858","192.168.2.3","216.58.197.4","TLSv1.2","212","Application Data"
"31","2018-08-07 17:49:30.368160","192.168.2.3","216.58.197.4","TCP","1434","49253  >  443 [ACK] Seq=3104 Ack=39 Win=1522 Len=1368 TSval=500880 TSecr=372844318 [TCP segment of a reassembled PDU]"
"32","2018-08-07 17:49:30.368162","192.168.2.3","216.58.197.4","TLSv1.2","243","Application Data"
"33","2018-08-07 17:49:30.368394","192.168.2.3","216.58.197.4","TCP","1434","49253  >  443 [ACK] Seq=4649 Ack=39 Win=1522 Len=1368 TSval=500880 TSecr=372844318 [TCP segment of a reassembled PDU]"
"34","2018-08-07 17:49:30.368395","192.168.2.3","216.58.197.4","TCP","1434","49253  >  443 [ACK] Seq=6017 Ack=39 Win=1522 Len=1368 TSval=500880 TSecr=372844318 [TCP segment of a reassembled PDU]"
"35","2018-08-07 17:49:30.368649","192.168.2.3","216.58.197.4","TLSv1.2","212","Application Data"
"36","2018-08-07 17:49:30.368882","192.168.2.3","216.58.197.4","TCP","1434","49253  >  443 [ACK] Seq=7531 Ack=39 Win=1522 Len=1368 TSval=500880 TSecr=372844318 [TCP segment of a reassembled PDU]"
"37","2018-08-07 17:49:30.369241","192.168.2.3","216.58.197.4","TCP","1434","49253  >  443 [ACK] Seq=8899 Ack=39 Win=1522 Len=1368 TSval=500880 TSecr=372844318 [TCP segment of a reassembled PDU]"
"43","2018-08-07 17:49:30.376853","192.168.2.3","216.58.197.4","TLSv1.2","1434","Application Data [TCP segment of a reassembled PDU]"
"44","2018-08-07 17:49:30.377364","192.168.2.3","216.58.197.4","TCP","1434","49253  >  443 [ACK] Seq=11635 Ack=39 Win=1522 Len=1368 TSval=500881 TSecr=372844333 [TCP segment of a reassembled PDU]"
"45","2018-08-07 17:49:30.377366","192.168.2.3","216.58.197.4","TLSv1.2","1434","Application Data [TCP segment of a reassembled PDU]"
"46","2018-08-07 17:49:30.377801","192.168.2.3","216.58.197.4","TCP","1434","49253  >  443 [ACK] Seq=14371 Ack=39 Win=1522 Len=1368 TSval=500881 TSecr=372844333 [TCP segment of a reassembled PDU]"
"47","2018-08-07 17:49:30.377803","192.168.2.3","216.58.197.4","TLSv1.2","1434","Application Data [TCP segment of a reassembled PDU]"
"48","2018-08-07 17:49:30.378636","192.168.2.3","216.58.197.4","TCP","1434","49253  >  443 [ACK] Seq=17107 Ack=39 Win=1522 Len=1368 TSval=500881 TSecr=372844333 [TCP segment of a reassembled PDU]"
"49","2018-08-07 17:49:30.378814","192.168.2.3","216.58.197.4","TLSv1.2","1434","Application Data [TCP segment of a reassembled PDU]"
"50","2018-08-07 17:49:30.379155","192.168.2.3","216.58.197.4","TCP","1434","49253  >  443 [ACK] Seq=19843 Ack=39 Win=1522 Len=1368 TSval=500881 TSecr=372844334 [TCP segment of a reassembled PDU]"
"51","2018-08-07 17:49:30.379157","192.168.2.3","216.58.197.4","TLSv1.2","1434","Application Data, Application Data"
"52","2018-08-07 17:49:30.379244","192.168.2.3","216.58.197.4","TCP","1434","49253  >  443 [ACK] Seq=22579 Ack=39 Win=1522 Len=1368 TSval=500881 TSecr=372844334 [TCP segment of a reassembled PDU]"
"53","2018-08-07 17:49:30.379396","192.168.2.3","216.58.197.4","TLSv1.2","1434","Application Data [TCP segment of a reassembled PDU]"
"54","2018-08-07 17:49:30.379692","192.168.2.3","216.58.197.4","TLSv1.2","1434","Application Data [TCP segment of a reassembled PDU]"
"56","2018-08-07 17:49:30.382065","192.168.2.3","216.58.197.4","TCP","1434","49253  >  443 [ACK] Seq=26683 Ack=39 Win=1522 Len=1368 TSval=500881 TSecr=372844334 [TCP segment of a reassembled PDU]"
"57","2018-08-07 17:49:30.382382","192.168.2.3","216.58.197.4","TLSv1.2","1434","Application Data [TCP segment of a reassembled PDU]"
"58","2018-08-07 17:49:30.382384","192.168.2.3","216.58.197.4","TCP","1434","49253  >  443 [ACK] Seq=29419 Ack=39 Win=1522 Len=1368 TSval=500881 TSecr=372844334 [TCP segment of a reassembled PDU]"
"63","2018-08-07 17:49:30.384164","192.168.2.3","216.58.197.4","TLSv1.2","1434","Application Data [TCP segment of a reassembled PDU]"
"64","2018-08-07 17:49:30.384444","192.168.2.3","216.58.197.4","TCP","1434","49253  >  443 [ACK] Seq=32155 Ack=39 Win=1522 Len=1368 TSval=500881 TSecr=372844342 [TCP segment of a reassembled PDU]"
"65","2018-08-07 17:49:30.384621","192.168.2.3","216.58.197.4","TCP","1434","49253  >  443 [ACK] Seq=33523 Ack=39 Win=1522 Len=1368 TSval=500881 TSecr=372844342 [TCP segment of a reassembled PDU]"
"66","2018-08-07 17:49:30.385032","192.168.2.3","216.58.197.4","TLSv1.2","1434","Application Data [TCP segment of a reassembled PDU]"
"67","2018-08-07 17:49:30.385034","192.168.2.3","216.58.197.4","TCP","1434","49253  >  443 [ACK] Seq=36259 Ack=39 Win=1522 Len=1368 TSval=500881 TSecr=372844343 [TCP segment of a reassembled PDU]"
"68","2018-08-07 17:49:30.385393","192.168.2.3","216.58.197.4","TLSv1.2","1434","Application Data [TCP segment of a reassembled PDU]"
"71","2018-08-07 17:49:30.387408","192.168.2.3","216.58.197.4","TCP","1434","49253  >  443 [ACK] Seq=38995 Ack=39 Win=1522 Len=1368 TSval=500882 TSecr=372844344 [TCP segment of a reassembled PDU]"
"72","2018-08-07 17:49:30.387410","192.168.2.3","216.58.197.4","TLSv1.2","1434","Application Data [TCP segment of a reassembled PDU]"
"73","2018-08-07 17:49:30.387593","192.168.2.3","216.58.197.4","TLSv1.2","1434","Application Data [TCP segment of a reassembled PDU]"
"74","2018-08-07 17:49:30.388818","192.168.2.3","216.58.197.4","TCP","1434","49253  >  443 [ACK] Seq=43099 Ack=39 Win=1522 Len=1368 TSval=500882 TSecr=372844344 [TCP segment of a reassembled PDU]"
"75","2018-08-07 17:49:30.388821","192.168.2.3","216.58.197.4","TLSv1.2","1434","Application Data [TCP segment of a reassembled PDU]"
"77","2018-08-07 17:49:30.388976","192.168.2.3","216.58.197.4","TCP","1434","49253  >  443 [ACK] Seq=45835 Ack=39 Win=1522 Len=1368 TSval=500882 TSecr=372844344 [TCP segment of a reassembled PDU]"
"78","2018-08-07 17:49:30.389122","192.168.2.3","216.58.197.4","TCP","1434","49253  >  443 [ACK] Seq=47203 Ack=39 Win=1522 Len=1368 TSval=500882 TSecr=372844345 [TCP segment of a reassembled PDU]"
"79","2018-08-07 17:49:30.389441","192.168.2.3","216.58.197.4","TLSv1.2","1434","Application Data [TCP segment of a reassembled PDU]"
"80","2018-08-07 17:49:30.389443","192.168.2.3","216.58.197.4","TCP","1434","49253  >  443 [ACK] Seq=49939 Ack=39 Win=1522 Len=1368 TSval=500882 TSecr=372844345 [TCP segment of a reassembled PDU]"
"81","2018-08-07 17:49:30.389539","192.168.2.3","216.58.197.4","TLSv1.2","1434","Application Data [TCP segment of a reassembled PDU]"
"89","2018-08-07 17:49:30.398468","192.168.2.3","216.58.197.4","TCP","1434","49253  >  443 [ACK] Seq=52675 Ack=39 Win=1522 Len=1368 TSval=500882 TSecr=372844347 [TCP segment of a reassembled PDU]"
"90","2018-08-07 17:49:30.398470","192.168.2.3","216.58.197.4","TLSv1.2","1434","Application Data [TCP segment of a reassembled PDU]"
"91","2018-08-07 17:49:30.398834","192.168.2.3","216.58.197.4","TCP","1434","49253  >  443 [ACK] Seq=55411 Ack=39 Win=1522 Len=1368 TSval=500882 TSecr=372844347 [TCP segment of a reassembled PDU]"
"92","2018-08-07 17:49:30.398836","192.168.2.3","216.58.197.4","TLSv1.2","1434","Application Data [TCP segment of a reassembled PDU]"
"93","2018-08-07 17:49:30.399016","192.168.2.3","216.58.197.4","TLSv1.2","258","Application Data"
"96","2018-08-07 17:49:30.431932","192.168.2.3","216.58.197.4","TCP","1434","49253  >  443 [ACK] Seq=58339 Ack=39 Win=1522 Len=1368 TSval=500886 TSecr=372844364 [TCP segment of a reassembled PDU]"
"97","2018-08-07 17:49:30.432430","192.168.2.3","216.58.197.4","TCP","1434","49253  >  443 [ACK] Seq=59707 Ack=39 Win=1522 Len=1368 TSval=500886 TSecr=372844364 [TCP segment of a reassembled PDU]"
"98","2018-08-07 17:49:30.432433","192.168.2.3","216.58.197.4","TLSv1.2","212","Application Data"
"99","2018-08-07 17:49:30.432670","192.168.2.3","216.58.197.4","TCP","1434","49253  >  443 [ACK] Seq=61221 Ack=39 Win=1522 Len=1368 TSval=500886 TSecr=372844364 [TCP segment of a reassembled PDU]"
"100","2018-08-07 17:49:30.432672","192.168.2.3","216.58.197.4","TLSv1.2","155","Application Data"
"104","2018-08-07 17:49:30.533076","192.168.2.3","216.58.197.4","TCP","1434","49253  >  443 [ACK] Seq=62678 Ack=39 Win=1522 Len=1368 TSval=500896 TSecr=372844398 [TCP segment of a reassembled PDU]"
"105","2018-08-07 17:49:30.533079","192.168.2.3","216.58.197.4","TCP","1434","49253  >  443 [ACK] Seq=64046 Ack=39 Win=1522 Len=1368 TSval=500896 TSecr=372844398 [TCP segment of a reassembled PDU]"
"106","2018-08-07 17:49:30.533080","192.168.2.3","216.58.197.4","TLSv1.2","212","Application Data"
"107","2018-08-07 17:49:30.533386","192.168.2.3","216.58.197.4","TCP","1434","49253  >  443 [ACK] Seq=65560 Ack=39 Win=1522 Len=1368 TSval=500896 TSecr=372844398 [TCP segment of a reassembled PDU]"
"108","2018-08-07 17:49:30.533388","192.168.2.3","216.58.197.4","TLSv1.2","155","Application Data"
"111","2018-08-07 17:49:30.627124","192.168.2.3","216.58.197.4","TCP","1434","49253  >  443 [ACK] Seq=67017 Ack=39 Win=1522 Len=1368 TSval=500906 TSecr=372844499 [TCP segment of a reassembled PDU]"
"112","2018-08-07 17:49:30.627406","192.168.2.3","216.58.197.4","TCP","1434","49253  >  443 [ACK] Seq=68385 Ack=39 Win=1522 Len=1368 TSval=500906 TSecr=372844499 [TCP segment of a reassembled PDU]"
"113","2018-08-07 17:49:30.627408","192.168.2.3","216.58.197.4","TLSv1.2","212","Application Data"
"114","2018-08-07 17:49:30.627744","192.168.2.3","216.58.197.4","TCP","1434","49253  >  443 [ACK] Seq=69899 Ack=39 Win=1522 Len=1368 TSval=500906 TSecr=372844499 [TCP segment of a reassembled PDU]"
"115","2018-08-07 17:49:30.627747","192.168.2.3","216.58.197.4","TLSv1.2","155","Application Data"
"118","2018-08-07 17:49:30.722909","192.168.2.3","216.58.197.4","TCP","1434","49253  >  443 [ACK] Seq=71356 Ack=39 Win=1522 Len=1368 TSval=500915 TSecr=372844593 [TCP segment of a reassembled PDU]"
"119","2018-08-07 17:49:30.722914","192.168.2.3","216.58.197.4","TCP","1434","49253  >  443 [ACK] Seq=72724 Ack=39 Win=1522 Len=1368 TSval=500915 TSecr=372844593 [TCP segment of a reassembled PDU]"
"120","2018-08-07 17:49:30.723137","192.168.2.3","216.58.197.4","TLSv1.2","212","Application Data"
"121","2018-08-07 17:49:30.723139","192.168.2.3","216.58.197.4","TCP","1434","49253  >  443 [ACK] Seq=74238 Ack=39 Win=1522 Len=1368 TSval=500915 TSecr=372844593 [TCP segment of a reassembled PDU]"
"122","2018-08-07 17:49:30.723277","192.168.2.3","216.58.197.4","TLSv1.2","155","Application Data"
"126","2018-08-07 17:49:30.825123","192.168.2.3","216.58.197.4","TCP","1434","49253  >  443 [ACK] Seq=75695 Ack=39 Win=1522 Len=1368 TSval=500925 TSecr=372844729 [TCP segment of a reassembled PDU]"
"127","2018-08-07 17:49:30.825346","192.168.2.3","216.58.197.4","TCP","1434","49253  >  443 [ACK] Seq=77063 Ack=39 Win=1522 Len=1368 TSval=500925 TSecr=372844729 [TCP segment of a reassembled PDU]"
"128","2018-08-07 17:49:30.825348","192.168.2.3","216.58.197.4","TLSv1.2","212","Application Data"
"129","2018-08-07 17:49:30.825511","192.168.2.3","216.58.197.4","TLSv1.2","1355","Application Data"
"133","2018-08-07 17:49:30.828673","192.168.2.3","216.58.197.4","TCP","66","49253  >  443 [ACK] Seq=79866 Ack=293 Win=1522 Len=0 TSval=500926 TSecr=372844788"
"138","2018-08-07 17:49:30.876047","192.168.2.3","216.58.197.4","TCP","66","49253  >  443 [ACK] Seq=79866 Ack=552 Win=1522 Len=0 TSval=500931 TSecr=372844799"
"139","2018-08-07 17:49:30.927333","192.168.2.3","216.58.197.4","TCP","1434","49253  >  443 [ACK] Seq=79866 Ack=552 Win=1522 Len=1368 TSval=500935 TSecr=372844799 [TCP segment of a reassembled PDU]"
"140","2018-08-07 17:49:30.927579","192.168.2.3","216.58.197.4","TCP","1434","49253  >  443 [ACK] Seq=81234 Ack=552 Win=1522 Len=1368 TSval=500935 TSecr=372844799 [TCP segment of a reassembled PDU]"
"141","2018-08-07 17:49:30.927580","192.168.2.3","216.58.197.4","TLSv1.2","212","Application Data"
"142","2018-08-07 17:49:30.927581","192.168.2.3","216.58.197.4","TLSv1.2","392","Application Data"
"146","2018-08-07 17:49:30.993559","192.168.2.3","216.58.197.4","TCP","66","49253  >  443 [ACK] Seq=83074 Ack=690 Win=1522 Len=0 TSval=500942 TSecr=372844950"
"147","2018-08-07 17:49:31.045056","192.168.2.3","216.58.197.4","TCP","1434","49253  >  443 [ACK] Seq=83074 Ack=690 Win=1522 Len=1368 TSval=500947 TSecr=372844950 [TCP segment of a reassembled PDU]"
"148","2018-08-07 17:49:31.045232","192.168.2.3","216.58.197.4","TCP","1434","49253  >  443 [ACK] Seq=84442 Ack=690 Win=1522 Len=1368 TSval=500947 TSecr=372844950 [TCP segment of a reassembled PDU]"
"149","2018-08-07 17:49:31.045234","192.168.2.3","216.58.197.4","TLSv1.2","212","Application Data"
"150","2018-08-07 17:49:31.045396","192.168.2.3","216.58.197.4","TLSv1.2","1061","Application Data"
"153","2018-08-07 17:49:31.143086","192.168.2.3","216.58.197.4","TCP","1434","49253  >  443 [ACK] Seq=86951 Ack=690 Win=1522 Len=1368 TSval=500957 TSecr=372845010 [TCP segment of a reassembled PDU]"
"154","2018-08-07 17:49:31.143530","192.168.2.3","216.58.197.4","TCP","1434","49253  >  443 [ACK] Seq=88319 Ack=690 Win=1522 Len=1368 TSval=500957 TSecr=372845010 [TCP segment of a reassembled PDU]"
"155","2018-08-07 17:49:31.143532","192.168.2.3","216.58.197.4","TLSv1.2","212","Application Data"
"156","2018-08-07 17:49:31.143533","192.168.2.3","216.58.197.4","TLSv1.2","1174","Application Data"
"160","2018-08-07 17:49:31.154256","192.168.2.3","216.58.197.4","TCP","66","49253  >  443 [ACK] Seq=90941 Ack=742 Win=1522 Len=0 TSval=500958 TSecr=372845114"
"161","2018-08-07 17:49:31.246249","192.168.2.3","216.58.197.4","TCP","1434","49253  >  443 [ACK] Seq=90941 Ack=742 Win=1522 Len=1368 TSval=500967 TSecr=372845114 [TCP segment of a reassembled PDU]"
"162","2018-08-07 17:49:31.246692","192.168.2.3","216.58.197.4","TCP","1434","49253  >  443 [ACK] Seq=92309 Ack=742 Win=1522 Len=1368 TSval=500967 TSecr=372845114 [TCP segment of a reassembled PDU]"
"163","2018-08-07 17:49:31.246695","192.168.2.3","216.58.197.4","TLSv1.2","212","Application Data"
"164","2018-08-07 17:49:31.246695","192.168.2.3","216.58.197.4","TLSv1.2","748","Application Data"
"166","2018-08-07 17:49:31.341928","192.168.2.3","216.58.197.4","TCP","1434","49253  >  443 [ACK] Seq=94505 Ack=742 Win=1522 Len=1368 TSval=500977 TSecr=372845212 [TCP segment of a reassembled PDU]"
"167","2018-08-07 17:49:31.342234","192.168.2.3","216.58.197.4","TCP","1434","49253  >  443 [ACK] Seq=95873 Ack=742 Win=1522 Len=1368 TSval=500977 TSecr=372845212 [TCP segment of a reassembled PDU]"
"168","2018-08-07 17:49:31.342236","192.168.2.3","216.58.197.4","TLSv1.2","212","Application Data"
"169","2018-08-07 17:49:31.342237","192.168.2.3","216.58.197.4","TCP","1434","49253  >  443 [ACK] Seq=97387 Ack=742 Win=1522 Len=1368 TSval=500977 TSecr=372845212 [TCP segment of a reassembled PDU]"
"170","2018-08-07 17:49:31.342407","192.168.2.3","216.58.197.4","TLSv1.2","155","Application Data"
"173","2018-08-07 17:49:31.431293","192.168.2.3","216.58.197.4","TCP","1434","49253  >  443 [ACK] Seq=98844 Ack=742 Win=1522 Len=1368 TSval=500986 TSecr=372845307 [TCP segment of a reassembled PDU]"
"174","2018-08-07 17:49:31.431468","192.168.2.3","216.58.197.4","TCP","1434","49253  >  443 [ACK] Seq=100212 Ack=742 Win=1522 Len=1368 TSval=500986 TSecr=372845307 [TCP segment of a reassembled PDU]"
"175","2018-08-07 17:49:31.431470","192.168.2.3","216.58.197.4","TLSv1.2","212","Application Data"
"176","2018-08-07 17:49:31.431734","192.168.2.3","216.58.197.4","TCP","1434","49253  >  443 [ACK] Seq=101726 Ack=742 Win=1522 Len=1368 TSval=500986 TSecr=372845307 [TCP segment of a reassembled PDU]"
"177","2018-08-07 17:49:31.431737","192.168.2.3","216.58.197.4","TLSv1.2","155","Application Data"
"180","2018-08-07 17:49:31.528678","192.168.2.3","216.58.197.4","TCP","1434","49253  >  443 [ACK] Seq=103183 Ack=742 Win=1522 Len=1368 TSval=500996 TSecr=372845397 [TCP segment of a reassembled PDU]"
"181","2018-08-07 17:49:31.529011","192.168.2.3","216.58.197.4","TCP","1434","49253  >  443 [ACK] Seq=104551 Ack=742 Win=1522 Len=1368 TSval=500996 TSecr=372845397 [TCP segment of a reassembled PDU]"
"182","2018-08-07 17:49:31.529013","192.168.2.3","216.58.197.4","TLSv1.2","212","Application Data"
"183","2018-08-07 17:49:31.529014","192.168.2.3","216.58.197.4","TCP","1434","49253  >  443 [ACK] Seq=106065 Ack=742 Win=1522 Len=1368 TSval=500996 TSecr=372845397 [TCP segment of a reassembled PDU]"
"184","2018-08-07 17:49:31.529165","192.168.2.3","216.58.197.4","TLSv1.2","155","Application Data"
"188","2018-08-07 17:49:31.601286","192.168.2.3","216.58.197.4","TCP","1434","49253  >  443 [ACK] Seq=107522 Ack=742 Win=1522 Len=1368 TSval=501003 TSecr=372845535 [TCP segment of a reassembled PDU]"
"189","2018-08-07 17:49:31.605339","192.168.2.3","216.58.197.4","TCP","1434","49253  >  443 [ACK] Seq=108890 Ack=742 Win=1522 Len=1368 TSval=501003 TSecr=372845535 [TCP segment of a reassembled PDU]"
"190","2018-08-07 17:49:31.605344","192.168.2.3","216.58.197.4","TLSv1.2","212","Application Data"
"191","2018-08-07 17:49:31.605739","192.168.2.3","216.58.197.4","TCP","1434","49253  >  443 [ACK] Seq=110404 Ack=742 Win=1522 Len=1368 TSval=501003 TSecr=372845535 [TCP segment of a reassembled PDU]"
"192","2018-08-07 17:49:31.605741","192.168.2.3","216.58.197.4","TLSv1.2","155","Application Data"
"196","2018-08-07 17:49:31.686259","192.168.2.3","216.58.197.4","TCP","1434","49253  >  443 [ACK] Seq=111861 Ack=742 Win=1522 Len=1368 TSval=501012 TSecr=372845571 [TCP segment of a reassembled PDU]"
"197","2018-08-07 17:49:31.686626","192.168.2.3","216.58.197.4","TCP","1434","49253  >  443 [ACK] Seq=113229 Ack=742 Win=1522 Len=1368 TSval=501012 TSecr=372845571 [TCP segment of a reassembled PDU]"
"198","2018-08-07 17:49:31.686628","192.168.2.3","216.58.197.4","TLSv1.2","212","Application Data"
"199","2018-08-07 17:49:31.687094","192.168.2.3","216.58.197.4","TCP","1434","49253  >  443 [ACK] Seq=114743 Ack=742 Win=1522 Len=1368 TSval=501012 TSecr=372845571 [TCP segment of a reassembled PDU]"
"200","2018-08-07 17:49:31.687096","192.168.2.3","216.58.197.4","TLSv1.2","155","Application Data"
"206","2018-08-07 17:49:31.764339","192.168.2.3","216.58.197.4","TCP","66","49253  >  443 [ACK] Seq=116200 Ack=1079 Win=1522 Len=0 TSval=501019 TSecr=372845718"
"207","2018-08-07 17:49:31.764553","192.168.2.3","216.58.197.4","TCP","66","49253  >  443 [ACK] Seq=116200 Ack=1375 Win=1522 Len=0 TSval=501019 TSecr=372845718"
"208","2018-08-07 17:49:31.785681","192.168.2.3","216.58.197.4","TCP","1434","49253  >  443 [ACK] Seq=116200 Ack=1375 Win=1522 Len=1368 TSval=501021 TSecr=372845718 [TCP segment of a reassembled PDU]"
"209","2018-08-07 17:49:31.785688","192.168.2.3","216.58.197.4","TCP","1434","49253  >  443 [ACK] Seq=117568 Ack=1375 Win=1522 Len=1368 TSval=501021 TSecr=372845718 [TCP segment of a reassembled PDU]"
"210","2018-08-07 17:49:31.785879","192.168.2.3","216.58.197.4","TLSv1.2","212","Application Data"
"211","2018-08-07 17:49:31.785881","192.168.2.3","216.58.197.4","TCP","1434","49253  >  443 [ACK] Seq=119082 Ack=1375 Win=1522 Len=1368 TSval=501021 TSecr=372845718 [TCP segment of a reassembled PDU]"
"212","2018-08-07 17:49:31.785986","192.168.2.3","216.58.197.4","TLSv1.2","155","Application Data"
"218","2018-08-07 17:49:31.841469","192.168.2.3","216.58.197.4","TCP","66","49253  >  443 [ACK] Seq=120539 Ack=1923 Win=1522 Len=0 TSval=501027 TSecr=372845788"
"219","2018-08-07 17:49:31.888660","192.168.2.3","216.58.197.4","TCP","1434","49253  >  443 [ACK] Seq=120539 Ack=1923 Win=1522 Len=1368 TSval=501031 TSecr=372845788 [TCP segment of a reassembled PDU]"
"220","2018-08-07 17:49:31.888664","192.168.2.3","216.58.197.4","TCP","1434","49253  >  443 [ACK] Seq=121907 Ack=1923 Win=1522 Len=1368 TSval=501031 TSecr=372845788 [TCP segment of a reassembled PDU]"
"221","2018-08-07 17:49:31.888665","192.168.2.3","216.58.197.4","TLSv1.2","212","Application Data"
"222","2018-08-07 17:49:31.888834","192.168.2.3","216.58.197.4","TCP","1434","49253  >  443 [ACK] Seq=123421 Ack=1923 Win=1522 Len=1368 TSval=501031 TSecr=372845788 [TCP segment of a reassembled PDU]"
"223","2018-08-07 17:49:31.889041","192.168.2.3","216.58.197.4","TLSv1.2","155","Application Data"
"226","2018-08-07 17:49:31.971245","192.168.2.3","216.58.197.4","TCP","1434","49253  >  443 [ACK] Seq=124878 Ack=1923 Win=1522 Len=1368 TSval=501040 TSecr=372845895 [TCP segment of a reassembled PDU]"
"227","2018-08-07 17:49:31.971554","192.168.2.3","216.58.197.4","TCP","1434","49253  >  443 [ACK] Seq=126246 Ack=1923 Win=1522 Len=1368 TSval=501040 TSecr=372845895 [TCP segment of a reassembled PDU]"
"228","2018-08-07 17:49:31.971559","192.168.2.3","216.58.197.4","TLSv1.2","212","Application Data"
"229","2018-08-07 17:49:31.971790","192.168.2.3","216.58.197.4","TCP","1434","49253  >  443 [ACK] Seq=127760 Ack=1923 Win=1522 Len=1368 TSval=501040 TSecr=372845895 [TCP segment of a reassembled PDU]"
"230","2018-08-07 17:49:31.971796","192.168.2.3","216.58.197.4","TLSv1.2","155","Application Data"
"236","2018-08-07 17:49:32.034422","192.168.2.3","216.58.197.4","TCP","66","49253  >  443 [ACK] Seq=129217 Ack=2289 Win=1522 Len=0 TSval=501046 TSecr=372845989"
"237","2018-08-07 17:49:32.070473","192.168.2.3","216.58.197.4","TCP","1434","49253  >  443 [ACK] Seq=129217 Ack=2289 Win=1522 Len=1368 TSval=501050 TSecr=372845989 [TCP segment of a reassembled PDU]"
"238","2018-08-07 17:49:32.070477","192.168.2.3","216.58.197.4","TCP","1434","49253  >  443 [ACK] Seq=130585 Ack=2289 Win=1522 Len=1368 TSval=501050 TSecr=372845989 [TCP segment of a reassembled PDU]"
"239","2018-08-07 17:49:32.070670","192.168.2.3","216.58.197.4","TLSv1.2","212","Application Data"
"240","2018-08-07 17:49:32.070671","192.168.2.3","216.58.197.4","TCP","1434","49253  >  443 [ACK] Seq=132099 Ack=2289 Win=1522 Len=1368 TSval=501050 TSecr=372845989 [TCP segment of a reassembled PDU]"
"241","2018-08-07 17:49:32.071056","192.168.2.3","216.58.197.4","TLSv1.2","155","Application Data"
"245","2018-08-07 17:49:32.125703","192.168.2.3","172.217.27.164","TCP","66","52359  >  443 [ACK] Seq=1 Ack=1 Win=661 Len=0 TSval=501056 TSecr=2605692830"
"247","2018-08-07 17:49:32.160093","192.168.2.3","216.58.197.4","TCP","1434","49253  >  443 [ACK] Seq=133556 Ack=2289 Win=1522 Len=1368 TSval=501059 TSecr=372846036 [TCP segment of a reassembled PDU]"
"248","2018-08-07 17:49:32.160374","192.168.2.3","216.58.197.4","TCP","1434","49253  >  443 [ACK] Seq=134924 Ack=2289 Win=1522 Len=1368 TSval=501059 TSecr=372846036 [TCP segment of a reassembled PDU]"
"249","2018-08-07 17:49:32.160376","192.168.2.3","216.58.197.4","TLSv1.2","212","Application Data"
"250","2018-08-07 17:49:32.160889","192.168.2.3","216.58.197.4","TCP","1434","49253  >  443 [ACK] Seq=136438 Ack=2289 Win=1522 Len=1368 TSval=501059 TSecr=372846036 [TCP segment of a reassembled PDU]"
"251","2018-08-07 17:49:32.160892","192.168.2.3","216.58.197.4","TLSv1.2","155","Application Data"
"257","2018-08-07 17:49:32.220920","192.168.2.3","216.58.197.4","TCP","66","49253  >  443 [ACK] Seq=137895 Ack=2496 Win=1522 Len=0 TSval=501065 TSecr=372846180"
"258","2018-08-07 17:49:32.258113","192.168.2.3","216.58.197.4","TCP","1434","49253  >  443 [ACK] Seq=137895 Ack=2496 Win=1522 Len=1368 TSval=501069 TSecr=372846180 [TCP segment of a reassembled PDU]"
"259","2018-08-07 17:49:32.258129","192.168.2.3","216.58.197.4","TCP","1434","49253  >  443 [ACK] Seq=139263 Ack=2496 Win=1522 Len=1368 TSval=501069 TSecr=372846180 [TCP segment of a reassembled PDU]"
"260","2018-08-07 17:49:32.258130","192.168.2.3","216.58.197.4","TLSv1.2","212","Application Data"
"261","2018-08-07 17:49:32.258298","192.168.2.3","216.58.197.4","TCP","1434","49253  >  443 [ACK] Seq=140777 Ack=2496 Win=1522 Len=1368 TSval=501069 TSecr=372846180 [TCP segment of a reassembled PDU]"
"262","2018-08-07 17:49:32.258482","192.168.2.3","216.58.197.4","TLSv1.2","155","Application Data"
"266","2018-08-07 17:49:32.361064","192.168.2.3","216.58.197.4","TCP","1434","49253  >  443 [ACK] Seq=142234 Ack=2496 Win=1522 Len=1368 TSval=501079 TSecr=372846223 [TCP segment of a reassembled PDU]"
"267","2018-08-07 17:49:32.361221","192.168.2.3","216.58.197.4","TCP","1434","49253  >  443 [ACK] Seq=143602 Ack=2496 Win=1522 Len=1368 TSval=501079 TSecr=372846223 [TCP segment of a reassembled PDU]"
"268","2018-08-07 17:49:32.361223","192.168.2.3","216.58.197.4","TLSv1.2","212","Application Data"
"269","2018-08-07 17:49:32.361469","192.168.2.3","216.58.197.4","TCP","1434","49253  >  443 [ACK] Seq=145116 Ack=2496 Win=1522 Len=1368 TSval=501079 TSecr=372846223 [TCP segment of a reassembled PDU]"
"270","2018-08-07 17:49:32.361471","192.168.2.3","216.58.197.4","TLSv1.2","117","Application Data"
"275","2018-08-07 17:49:32.462942","192.168.2.3","216.58.197.4","TCP","1434","49253  >  443 [ACK] Seq=146535 Ack=2709 Win=1522 Len=1368 TSval=501089 TSecr=372846402 [TCP segment of a reassembled PDU]"
"276","2018-08-07 17:49:32.462945","192.168.2.3","216.58.197.4","TCP","1434","49253  >  443 [ACK] Seq=147903 Ack=2709 Win=1522 Len=1368 TSval=501089 TSecr=372846402 [TCP segment of a reassembled PDU]"
"277","2018-08-07 17:49:32.463146","192.168.2.3","216.58.197.4","TLSv1.2","212","Application Data"
"278","2018-08-07 17:49:32.463147","192.168.2.3","216.58.197.4","TCP","1434","49253  >  443 [ACK] Seq=149417 Ack=2709 Win=1522 Len=1368 TSval=501089 TSecr=372846402 [TCP segment of a reassembled PDU]"
"279","2018-08-07 17:49:32.463268","192.168.2.3","216.58.197.4","TLSv1.2","155","Application Data"
"285","2018-08-07 17:49:32.526727","192.168.2.3","216.58.197.4","TCP","66","49253  >  443 [ACK] Seq=150874 Ack=2999 Win=1522 Len=0 TSval=501096 TSecr=372846483"
"286","2018-08-07 17:49:32.550596","192.168.2.3","216.58.197.4","TCP","1434","49253  >  443 [ACK] Seq=150874 Ack=2999 Win=1522 Len=1368 TSval=501098 TSecr=372846483 [TCP segment of a reassembled PDU]"
"287","2018-08-07 17:49:32.550901","192.168.2.3","216.58.197.4","TCP","1434","49253  >  443 [ACK] Seq=152242 Ack=2999 Win=1522 Len=1368 TSval=501098 TSecr=372846483 [TCP segment of a reassembled PDU]"
"288","2018-08-07 17:49:32.550904","192.168.2.3","216.58.197.4","TLSv1.2","212","Application Data"
"289","2018-08-07 17:49:32.550905","192.168.2.3","216.58.197.4","TCP","1434","49253  >  443 [ACK] Seq=153756 Ack=2999 Win=1522 Len=1368 TSval=501098 TSecr=372846483 [TCP segment of a reassembled PDU]"
"290","2018-08-07 17:49:32.551057","192.168.2.3","216.58.197.4","TLSv1.2","155","Application Data"
"294","2018-08-07 17:49:32.648700","192.168.2.3","216.58.197.4","TCP","1434","49253  >  443 [ACK] Seq=155213 Ack=2999 Win=1522 Len=1368 TSval=501108 TSecr=372846516 [TCP segment of a reassembled PDU]"
"295","2018-08-07 17:49:32.648704","192.168.2.3","216.58.197.4","TCP","1434","49253  >  443 [ACK] Seq=156581 Ack=2999 Win=1522 Len=1368 TSval=501108 TSecr=372846516 [TCP segment of a reassembled PDU]"
"296","2018-08-07 17:49:32.648705","192.168.2.3","216.58.197.4","TLSv1.2","212","Application Data"
"297","2018-08-07 17:49:32.648848","192.168.2.3","216.58.197.4","TCP","1434","49253  >  443 [ACK] Seq=158095 Ack=2999 Win=1522 Len=1368 TSval=501108 TSecr=372846516 [TCP segment of a reassembled PDU]"
"298","2018-08-07 17:49:32.649153","192.168.2.3","216.58.197.4","TLSv1.2","155","Application Data"
"304","2018-08-07 17:49:32.708225","192.168.2.3","216.58.197.4","TCP","66","49253  >  443 [ACK] Seq=159552 Ack=3540 Win=1522 Len=0 TSval=501114 TSecr=372846668"
"305","2018-08-07 17:49:32.757401","192.168.2.3","216.58.197.4","TCP","1434","49253  >  443 [ACK] Seq=159552 Ack=3540 Win=1522 Len=1368 TSval=501117 TSecr=372846668 [TCP segment of a reassembled PDU]"
"306","2018-08-07 17:49:32.757405","192.168.2.3","216.58.197.4","TCP","1434","49253  >  443 [ACK] Seq=160920 Ack=3540 Win=1522 Len=1368 TSval=501117 TSecr=372846668 [TCP segment of a reassembled PDU]"
"307","2018-08-07 17:49:32.757406","192.168.2.3","216.58.197.4","TLSv1.2","212","Application Data"
"308","2018-08-07 17:49:32.757624","192.168.2.3","216.58.197.4","TCP","1434","49253  >  443 [ACK] Seq=162434 Ack=3540 Win=1522 Len=1368 TSval=501117 TSecr=372846668 [TCP segment of a reassembled PDU]"
"309","2018-08-07 17:49:32.757626","192.168.2.3","216.58.197.4","TLSv1.2","155","Application Data"
"315","2018-08-07 17:49:32.812599","192.168.2.3","216.58.197.4","TCP","66","49253  >  443 [ACK] Seq=163891 Ack=3990 Win=1522 Len=0 TSval=501124 TSecr=372846771"
"318","2018-08-07 17:49:32.850390","192.168.2.3","216.58.197.4","TCP","66","49253  >  443 [ACK] Seq=163891 Ack=4127 Win=1522 Len=0 TSval=501127 TSecr=372846788"
"319","2018-08-07 17:49:32.850649","192.168.2.3","216.58.197.4","TCP","1434","49253  >  443 [ACK] Seq=163891 Ack=4127 Win=1522 Len=1368 TSval=501128 TSecr=372846788 [TCP segment of a reassembled PDU]"
"320","2018-08-07 17:49:32.850651","192.168.2.3","216.58.197.4","TCP","1434","49253  >  443 [ACK] Seq=165259 Ack=4127 Win=1522 Len=1368 TSval=501128 TSecr=372846788 [TCP segment of a reassembled PDU]"
"321","2018-08-07 17:49:32.850652","192.168.2.3","216.58.197.4","TLSv1.2","212","Application Data"
"322","2018-08-07 17:49:32.850996","192.168.2.3","216.58.197.4","TCP","1434","49253  >  443 [ACK] Seq=166773 Ack=4127 Win=1522 Len=1368 TSval=501128 TSecr=372846788 [TCP segment of a reassembled PDU]"
"323","2018-08-07 17:49:32.850999","192.168.2.3","216.58.197.4","TLSv1.2","155","Application Data"
"329","2018-08-07 17:49:32.918975","192.168.2.3","216.58.197.4","TCP","66","49253  >  443 [ACK] Seq=168230 Ack=4652 Win=1522 Len=0 TSval=501135 TSecr=372846878"
"330","2018-08-07 17:49:32.935544","192.168.2.3","216.58.197.4","TCP","1434","49253  >  443 [ACK] Seq=168230 Ack=4652 Win=1522 Len=1368 TSval=501136 TSecr=372846878 [TCP segment of a reassembled PDU]"
"331","2018-08-07 17:49:32.935546","192.168.2.3","216.58.197.4","TCP","1434","49253  >  443 [ACK] Seq=169598 Ack=4652 Win=1522 Len=1368 TSval=501136 TSecr=372846878 [TCP segment of a reassembled PDU]"
"332","2018-08-07 17:49:32.935769","192.168.2.3","216.58.197.4","TLSv1.2","212","Application Data"
"333","2018-08-07 17:49:32.935771","192.168.2.3","216.58.197.4","TCP","1434","49253  >  443 [ACK] Seq=171112 Ack=4652 Win=1522 Len=1368 TSval=501136 TSecr=372846878 [TCP segment of a reassembled PDU]"
"334","2018-08-07 17:49:32.935772","192.168.2.3","216.58.197.4","TLSv1.2","155","Application Data"
"337","2018-08-07 17:49:33.034555","192.168.2.3","216.58.197.4","TCP","1434","49253  >  443 [ACK] Seq=172569 Ack=4652 Win=1522 Len=1368 TSval=501146 TSecr=372846901 [TCP segment of a reassembled PDU]"
"338","2018-08-07 17:49:33.034924","192.168.2.3","216.58.197.4","TCP","1434","49253  >  443 [ACK] Seq=173937 Ack=4652 Win=1522 Len=1368 TSval=501146 TSecr=372846901 [TCP segment of a reassembled PDU]"
"339","2018-08-07 17:49:33.034926","192.168.2.3","216.58.197.4","TLSv1.2","212","Application Data"
"340","2018-08-07 17:49:33.034927","192.168.2.3","216.58.197.4","TCP","1434","49253  >  443 [ACK] Seq=175451 Ack=4652 Win=1522 Len=1368 TSval=501146 TSecr=372846901 [TCP segment of a reassembled PDU]"
"341","2018-08-07 17:49:33.035093","192.168.2.3","216.58.197.4","TLSv1.2","155","Application Data"
"345","2018-08-07 17:49:33.152205","192.168.2.3","216.58.197.4","TCP","1434","49253  >  443 [ACK] Seq=176908 Ack=4652 Win=1522 Len=1368 TSval=501158 TSecr=372847000 [TCP segment of a reassembled PDU]"
"346","2018-08-07 17:49:33.152560","192.168.2.3","216.58.197.4","TCP","1434","49253  >  443 [ACK] Seq=178276 Ack=4652 Win=1522 Len=1368 TSval=501158 TSecr=372847000 [TCP segment of a reassembled PDU]"
"347","2018-08-07 17:49:33.152562","192.168.2.3","216.58.197.4","TLSv1.2","212","Application Data"
"348","2018-08-07 17:49:33.153030","192.168.2.3","216.58.197.4","TLSv1.2","1391","Application Data"
"355","2018-08-07 17:49:33.243490","192.168.2.3","216.58.197.4","TCP","66","49253  >  443 [ACK] Seq=181115 Ack=5221 Win=1522 Len=0 TSval=501167 TSecr=372847170"
"356","2018-08-07 17:49:33.243494","192.168.2.3","216.58.197.4","TCP","78","[TCP Dup ACK 355#1] 49253  >  443 [ACK] Seq=181115 Ack=5221 Win=1522 Len=0 TSval=501167 TSecr=372847198 SLE=4944 SRE=5221"
"357","2018-08-07 17:49:33.254315","192.168.2.3","216.58.197.4","TCP","1434","49253  >  443 [ACK] Seq=181115 Ack=5221 Win=1522 Len=1368 TSval=501168 TSecr=372847198 [TCP segment of a reassembled PDU]"
"358","2018-08-07 17:49:33.254763","192.168.2.3","216.58.197.4","TCP","1434","49253  >  443 [ACK] Seq=182483 Ack=5221 Win=1522 Len=1368 TSval=501168 TSecr=372847198 [TCP segment of a reassembled PDU]"
"359","2018-08-07 17:49:33.254765","192.168.2.3","216.58.197.4","TLSv1.2","212","Application Data"
"360","2018-08-07 17:49:33.254766","192.168.2.3","216.58.197.4","TCP","1434","49253  >  443 [ACK] Seq=183997 Ack=5221 Win=1522 Len=1368 TSval=501168 TSecr=372847198 [TCP segment of a reassembled PDU]"
"361","2018-08-07 17:49:33.254767","192.168.2.3","216.58.197.4","TLSv1.2","155","Application Data"
"365","2018-08-07 17:49:33.356102","192.168.2.3","216.58.197.4","TCP","1434","49253  >  443 [ACK] Seq=185454 Ack=5221 Win=1522 Len=1368 TSval=501178 TSecr=372847220 [TCP segment of a reassembled PDU]"
"366","2018-08-07 17:49:33.356262","192.168.2.3","216.58.197.4","TCP","1434","49253  >  443 [ACK] Seq=186822 Ack=5221 Win=1522 Len=1368 TSval=501178 TSecr=372847220 [TCP segment of a reassembled PDU]"
"367","2018-08-07 17:49:33.356264","192.168.2.3","216.58.197.4","TLSv1.2","212","Application Data"
"368","2018-08-07 17:49:33.356479","192.168.2.3","216.58.197.4","TLSv1.2","876","Application Data"
"372","2018-08-07 17:49:33.412596","192.168.2.3","216.58.197.4","TCP","66","49253  >  443 [ACK] Seq=189146 Ack=5343 Win=1522 Len=0 TSval=501184 TSecr=372847330"
"373","2018-08-07 17:49:33.412598","192.168.2.3","64.233.188.188","TCP","66","40306  >  5228 [ACK] Seq=1 Ack=1 Win=539 Len=0 TSval=501184 TSecr=3578261399"
"375","2018-08-07 17:49:33.477425","192.168.2.3","216.58.197.4","TCP","1434","49253  >  443 [ACK] Seq=189146 Ack=5343 Win=1522 Len=1368 TSval=501191 TSecr=372847330 [TCP segment of a reassembled PDU]"
"376","2018-08-07 17:49:33.477936","192.168.2.3","216.58.197.4","TCP","1434","49253  >  443 [ACK] Seq=190514 Ack=5343 Win=1522 Len=1368 TSval=501191 TSecr=372847330 [TCP segment of a reassembled PDU]"
"377","2018-08-07 17:49:33.477939","192.168.2.3","216.58.197.4","TLSv1.2","212","Application Data"
"378","2018-08-07 17:49:33.477940","192.168.2.3","216.58.197.4","TLSv1.2","643","Application Data"
"383","2018-08-07 17:49:33.540950","192.168.2.3","216.58.197.4","TCP","66","49253  >  443 [ACK] Seq=192605 Ack=5474 Win=1522 Len=0 TSval=501197 TSecr=372847500"
"384","2018-08-07 17:49:33.540952","192.168.2.3","216.58.197.4","TCP","66","49253  >  443 [ACK] Seq=192605 Ack=5599 Win=1522 Len=0 TSval=501197 TSecr=372847500"
"385","2018-08-07 17:49:33.599686","192.168.2.3","216.58.197.4","TCP","1434","49253  >  443 [ACK] Seq=192605 Ack=5599 Win=1522 Len=1368 TSval=501200 TSecr=372847500 [TCP segment of a reassembled PDU]"
"386","2018-08-07 17:49:33.599691","192.168.2.3","216.58.197.4","TCP","1434","49253  >  443 [ACK] Seq=193973 Ack=5599 Win=1522 Len=1368 TSval=501200 TSecr=372847500 [TCP segment of a reassembled PDU]"
"387","2018-08-07 17:49:33.599825","192.168.2.3","216.58.197.4","TLSv1.2","212","Application Data"
"388","2018-08-07 17:49:33.600194","192.168.2.3","216.58.197.4","TLSv1.2","1390","Application Data"
"391","2018-08-07 17:49:33.679070","192.168.2.3","216.58.197.4","TCP","1434","49253  >  443 [ACK] Seq=196811 Ack=5599 Win=1522 Len=1368 TSval=501211 TSecr=372847606 [TCP segment of a reassembled PDU]"
"392","2018-08-07 17:49:33.679074","192.168.2.3","216.58.197.4","TCP","1434","49253  >  443 [ACK] Seq=198179 Ack=5599 Win=1522 Len=1368 TSval=501211 TSecr=372847606 [TCP segment of a reassembled PDU]"
"393","2018-08-07 17:49:33.679075","192.168.2.3","216.58.197.4","TLSv1.2","212","Application Data"
"394","2018-08-07 17:49:33.679278","192.168.2.3","216.58.197.4","TLSv1.2","883","Application Data"
"399","2018-08-07 17:49:33.738621","192.168.2.3","216.58.197.4","TCP","66","49253  >  443 [ACK] Seq=200510 Ack=5961 Win=1522 Len=0 TSval=501217 TSecr=372847698"
"400","2018-08-07 17:49:33.794615","192.168.2.3","216.58.197.4","TCP","1434","49253  >  443 [ACK] Seq=200510 Ack=5961 Win=1522 Len=1368 TSval=501222 TSecr=372847698 [TCP segment of a reassembled PDU]"
"401","2018-08-07 17:49:33.794623","192.168.2.3","216.58.197.4","TCP","1434","49253  >  443 [ACK] Seq=201878 Ack=5961 Win=1522 Len=1368 TSval=501222 TSecr=372847698 [TCP segment of a reassembled PDU]"
"402","2018-08-07 17:49:33.794624","192.168.2.3","216.58.197.4","TLSv1.2","212","Application Data"
"403","2018-08-07 17:49:33.794785","192.168.2.3","216.58.197.4","TLSv1.2","828","Application Data"
"409","2018-08-07 17:49:33.839997","192.168.2.3","216.58.197.4","TCP","66","49253  >  443 [ACK] Seq=204154 Ack=6316 Win=1522 Len=0 TSval=501227 TSecr=372847788"
"410","2018-08-07 17:49:33.896789","192.168.2.3","216.58.197.4","TCP","1434","49253  >  443 [ACK] Seq=204154 Ack=6316 Win=1522 Len=1368 TSval=501232 TSecr=372847788 [TCP segment of a reassembled PDU]"
"411","2018-08-07 17:49:33.896792","192.168.2.3","216.58.197.4","TCP","1434","49253  >  443 [ACK] Seq=205522 Ack=6316 Win=1522 Len=1368 TSval=501232 TSecr=372847788 [TCP segment of a reassembled PDU]"
"412","2018-08-07 17:49:33.896955","192.168.2.3","216.58.197.4","TLSv1.2","212","Application Data"
"413","2018-08-07 17:49:33.897095","192.168.2.3","216.58.197.4","TCP","1434","49253  >  443 [ACK] Seq=207036 Ack=6316 Win=1522 Len=1368 TSval=501232 TSecr=372847788 [TCP segment of a reassembled PDU]"
"414","2018-08-07 17:49:33.897097","192.168.2.3","216.58.197.4","TLSv1.2","96","Application Data"
"420","2018-08-07 17:49:33.949687","192.168.2.3","216.58.197.4","TCP","66","49253  >  443 [ACK] Seq=208434 Ack=6555 Win=1522 Len=0 TSval=501238 TSecr=372847907"
"423","2018-08-07 17:49:33.998998","192.168.2.3","216.58.197.4","TCP","1434","49253  >  443 [ACK] Seq=208434 Ack=6555 Win=1522 Len=1368 TSval=501242 TSecr=372847907 [TCP segment of a reassembled PDU]"
"424","2018-08-07 17:49:33.999000","192.168.2.3","216.58.197.4","TCP","1434","49253  >  443 [ACK] Seq=209802 Ack=6555 Win=1522 Len=1368 TSval=501242 TSecr=372847907 [TCP segment of a reassembled PDU]"
"425","2018-08-07 17:49:33.999001","192.168.2.3","216.58.197.4","TLSv1.2","212","Application Data"
"426","2018-08-07 17:49:33.999116","192.168.2.3","216.58.197.4","TLSv1.2","609","Application Data"
"427","2018-08-07 17:49:33.999119","192.168.2.3","216.58.197.4","TLSv1.2","448","Application Data"
"428","2018-08-07 17:49:33.999441","192.168.2.3","216.58.197.4","TLSv1.2","102","Application Data"
"429","2018-08-07 17:49:33.999442","192.168.2.3","216.58.197.4","TCP","66","49253  >  443 [ACK] Seq=212277 Ack=7313 Win=1522 Len=0 TSval=501243 TSecr=372847953"
"433","2018-08-07 17:49:34.255755","192.168.2.3","216.58.197.4","TCP","66","49253  >  443 [ACK] Seq=212277 Ack=7391 Win=1522 Len=0 TSval=501269 TSecr=372848182"
"436","2018-08-07 17:49:34.275719","192.168.2.3","216.58.197.4","TCP","66","49253  >  443 [ACK] Seq=212277 Ack=9166 Win=1522 Len=0 TSval=501270 TSecr=372848231"
"442","2018-08-07 17:49:34.565050","192.168.2.3","216.58.197.4","TCP","66","49253  >  443 [ACK] Seq=212277 Ack=11048 Win=1512 Len=0 TSval=501299 TSecr=372848522"
"446","2018-08-07 17:49:34.566372","192.168.2.3","216.58.197.4","TCP","66","49253  >  443 [ACK] Seq=212277 Ack=12898 Win=1512 Len=0 TSval=501299 TSecr=372848522"
"447","2018-08-07 17:49:34.566377","192.168.2.3","216.58.197.4","TCP","66","49253  >  443 [ACK] Seq=212277 Ack=14316 Win=1512 Len=0 TSval=501300 TSecr=372848525"
"448","2018-08-07 17:49:34.566378","192.168.2.3","216.58.197.4","TCP","66","49253  >  443 [ACK] Seq=212277 Ack=14810 Win=1522 Len=0 TSval=501300 TSecr=372848525"
"449","2018-08-07 17:49:34.566928","192.168.2.3","216.58.197.4","TCP","66","49253  >  443 [ACK] Seq=212277 Ack=16228 Win=1512 Len=0 TSval=501300 TSecr=372848525"
"450","2018-08-07 17:49:34.566931","192.168.2.3","216.58.197.4","TCP","66","49253  >  443 [ACK] Seq=212277 Ack=16593 Win=1512 Len=0 TSval=501300 TSecr=372848525"
"455","2018-08-07 17:49:34.569407","192.168.2.3","216.58.197.4","TCP","66","49253  >  443 [ACK] Seq=212277 Ack=18011 Win=1512 Len=0 TSval=501300 TSecr=372848528"
"456","2018-08-07 17:49:34.569413","192.168.2.3","216.58.197.4","TCP","66","49253  >  443 [ACK] Seq=212277 Ack=18480 Win=1512 Len=0 TSval=501300 TSecr=372848528"
"457","2018-08-07 17:49:34.569925","192.168.2.3","216.58.197.4","TCP","66","49253  >  443 [ACK] Seq=212277 Ack=19898 Win=1512 Len=0 TSval=501300 TSecr=372848528"
"458","2018-08-07 17:49:34.569928","192.168.2.3","216.58.197.4","TCP","66","49253  >  443 [ACK] Seq=212277 Ack=20219 Win=1512 Len=0 TSval=501300 TSecr=372848528"
"461","2018-08-07 17:49:34.575903","192.168.2.3","216.58.197.4","TCP","66","49253  >  443 [ACK] Seq=212277 Ack=21637 Win=1512 Len=0 TSval=501301 TSecr=372848532"
"462","2018-08-07 17:49:34.575907","192.168.2.3","216.58.197.4","TCP","66","49253  >  443 [ACK] Seq=212277 Ack=22106 Win=1512 Len=0 TSval=501301 TSecr=372848532"
"469","2018-08-07 17:49:34.597948","192.168.2.3","216.58.197.4","TCP","66","49253  >  443 [ACK] Seq=212277 Ack=23906 Win=1512 Len=0 TSval=501303 TSecr=372848556"
"470","2018-08-07 17:49:34.597951","192.168.2.3","216.58.197.4","TCP","66","49253  >  443 [ACK] Seq=212277 Ack=25722 Win=1522 Len=0 TSval=501303 TSecr=372848556"
"471","2018-08-07 17:49:34.598478","192.168.2.3","216.58.197.4","TCP","66","49253  >  443 [ACK] Seq=212277 Ack=27607 Win=1522 Len=0 TSval=501303 TSecr=372848558"
"476","2018-08-07 17:49:34.600862","192.168.2.3","216.58.197.4","TCP","66","49253  >  443 [ACK] Seq=212277 Ack=29358 Win=1522 Len=0 TSval=501303 TSecr=372848560"
"479","2018-08-07 17:49:34.601661","192.168.2.3","216.58.197.4","TCP","66","49253  >  443 [ACK] Seq=212277 Ack=31129 Win=1522 Len=0 TSval=501303 TSecr=372848560"
"480","2018-08-07 17:49:34.602885","192.168.2.3","216.58.197.4","TCP","66","49253  >  443 [ACK] Seq=212277 Ack=32936 Win=1522 Len=0 TSval=501303 TSecr=372848562"
"485","2018-08-07 17:49:34.604627","192.168.2.3","216.58.197.4","TCP","66","49253  >  443 [ACK] Seq=212277 Ack=34672 Win=1522 Len=0 TSval=501303 TSecr=372848564"
"504","2018-08-07 17:49:34.615460","192.168.2.3","216.58.197.4","TCP","66","49253  >  443 [ACK] Seq=212277 Ack=36412 Win=1522 Len=0 TSval=501303 TSecr=372848564"
"505","2018-08-07 17:49:34.615478","192.168.2.3","216.58.197.4","TCP","66","49253  >  443 [ACK] Seq=212277 Ack=38258 Win=1522 Len=0 TSval=501304 TSecr=372848566"
"506","2018-08-07 17:49:34.615479","192.168.2.3","216.58.197.4","TCP","66","49253  >  443 [ACK] Seq=212277 Ack=40173 Win=1522 Len=0 TSval=501304 TSecr=372848567"
"507","2018-08-07 17:49:34.615479","192.168.2.3","216.58.197.4","TCP","66","49253  >  443 [ACK] Seq=212277 Ack=41933 Win=1522 Len=0 TSval=501304 TSecr=372848567"
"508","2018-08-07 17:49:34.615480","192.168.2.3","216.58.197.4","TCP","66","49253  >  443 [ACK] Seq=212277 Ack=43696 Win=1522 Len=0 TSval=501304 TSecr=372848569"
"509","2018-08-07 17:49:34.615483","192.168.2.3","216.58.197.4","TCP","66","49253  >  443 [ACK] Seq=212277 Ack=45399 Win=1522 Len=0 TSval=501304 TSecr=372848571"
"510","2018-08-07 17:49:34.615483","192.168.2.3","216.58.197.4","TCP","66","49253  >  443 [ACK] Seq=212277 Ack=47205 Win=1522 Len=0 TSval=501304 TSecr=372848571"
"511","2018-08-07 17:49:34.615484","192.168.2.3","216.58.197.4","TCP","66","49253  >  443 [ACK] Seq=212277 Ack=48890 Win=1522 Len=0 TSval=501304 TSecr=372848573"
"516","2018-08-07 17:49:34.621021","192.168.2.3","216.58.197.4","TCP","66","49253  >  443 [ACK] Seq=212277 Ack=56289 Win=1522 Len=0 TSval=501305 TSecr=372848573"
"523","2018-08-07 17:49:34.632336","192.168.2.3","216.58.197.4","TCP","66","49253  >  443 [ACK] Seq=212277 Ack=57984 Win=1522 Len=0 TSval=501306 TSecr=372848590"
"524","2018-08-07 17:49:34.633105","192.168.2.3","216.58.197.4","TCP","66","49253  >  443 [ACK] Seq=212277 Ack=59608 Win=1522 Len=0 TSval=501306 TSecr=372848591"
"525","2018-08-07 17:49:34.633106","192.168.2.3","216.58.197.4","TCP","66","49253  >  443 [ACK] Seq=212277 Ack=61525 Win=1522 Len=0 TSval=501306 TSecr=372848591"
"533","2018-08-07 17:49:34.634892","192.168.2.3","216.58.197.4","TCP","66","49253  >  443 [ACK] Seq=212277 Ack=63292 Win=1522 Len=0 TSval=501306 TSecr=372848594"
"545","2018-08-07 17:49:34.641305","192.168.2.3","216.58.197.4","TCP","66","49253  >  443 [ACK] Seq=212277 Ack=68424 Win=1522 Len=0 TSval=501307 TSecr=372848594"
"546","2018-08-07 17:49:34.641307","192.168.2.3","216.58.197.4","TCP","66","49253  >  443 [ACK] Seq=212277 Ack=70111 Win=1522 Len=0 TSval=501307 TSecr=372848596"
"547","2018-08-07 17:49:34.641308","192.168.2.3","216.58.197.4","TCP","66","49253  >  443 [ACK] Seq=212277 Ack=71801 Win=1522 Len=0 TSval=501307 TSecr=372848596"
"548","2018-08-07 17:49:34.641308","192.168.2.3","216.58.197.4","TCP","66","49253  >  443 [ACK] Seq=212277 Ack=73548 Win=1522 Len=0 TSval=501307 TSecr=372848597"
"559","2018-08-07 17:49:34.645209","192.168.2.3","216.58.197.4","TCP","66","49253  >  443 [ACK] Seq=212277 Ack=75402 Win=1522 Len=0 TSval=501307 TSecr=372848598"
"560","2018-08-07 17:49:34.645211","192.168.2.3","216.58.197.4","TCP","66","49253  >  443 [ACK] Seq=212277 Ack=77405 Win=1522 Len=0 TSval=501307 TSecr=372848598"
"561","2018-08-07 17:49:34.645212","192.168.2.3","216.58.197.4","TCP","66","49253  >  443 [ACK] Seq=212277 Ack=81128 Win=1522 Len=0 TSval=501307 TSecr=372848602"
"562","2018-08-07 17:49:34.645212","192.168.2.3","216.58.197.4","TCP","66","49253  >  443 [ACK] Seq=212277 Ack=82873 Win=1522 Len=0 TSval=501307 TSecr=372848603"
"568","2018-08-07 17:49:34.646252","192.168.2.3","216.58.197.4","TCP","66","49253  >  443 [ACK] Seq=212277 Ack=84726 Win=1522 Len=0 TSval=501308 TSecr=372848603"
"583","2018-08-07 17:49:34.656625","192.168.2.3","216.58.197.4","TCP","66","49253  >  443 [ACK] Seq=212277 Ack=101199 Win=1522 Len=0 TSval=501309 TSecr=372848605"
"584","2018-08-07 17:49:34.687553","192.168.2.3","216.58.197.4","TLSv1.2","104","Application Data"
"587","2018-08-07 17:49:37.565769","192.168.2.3","108.177.125.188","TCP","66","50384  >  5228 [ACK] Seq=1 Ack=1 Win=262 Len=0 TSval=501600 TSecr=2744343267"
"589","2018-08-07 17:49:39.646544","192.168.2.3","23.67.174.208","TCP","66","[TCP ZeroWindow] 57505  >  443 [ACK] Seq=1 Ack=1 Win=0 Len=0 TSval=501808 TSecr=1054438637"
"591","2018-08-07 17:49:41.806081","192.168.2.3","172.217.27.163","TCP","66","38971  >  443 [ACK] Seq=1 Ack=1 Win=406 Len=0 TSval=502024 TSecr=467085837"
"596","2018-08-07 17:49:42.425682","192.168.2.3","23.67.174.208","TCP","66","[TCP ZeroWindow] [TCP Previous segment not captured] 57505  >  443 [ACK] Seq=2 Ack=1 Win=0 Len=0 TSval=502085 TSecr=1054483758"
"599","2018-08-07 17:49:54.678313","192.168.2.3","172.217.27.174","TLSv1.2","157","Application Data"
"600","2018-08-07 17:49:54.678319","192.168.2.3","172.217.27.174","TLSv1.2","104","Application Data"
"601","2018-08-07 17:49:54.678320","192.168.2.3","172.217.27.174","TLSv1.2","506","Application Data"
"606","2018-08-07 17:49:54.716075","192.168.2.3","172.217.27.174","TCP","66","52258  >  443 [ACK] Seq=570 Ack=39 Win=661 Len=0 TSval=503315 TSecr=2575313253"
"611","2018-08-07 17:49:55.206579","192.168.2.3","172.217.27.174","TCP","66","52258  >  443 [ACK] Seq=570 Ack=326 Win=661 Len=0 TSval=503364 TSecr=2575313774"
"612","2018-08-07 17:49:55.206987","192.168.2.3","172.217.27.174","TCP","66","52258  >  443 [ACK] Seq=570 Ack=583 Win=661 Len=0 TSval=503364 TSecr=2575313774"
"613","2018-08-07 17:49:55.211506","192.168.2.3","172.217.27.174","TLSv1.2","104","Application Data"
"615","2018-08-07 17:49:56.646267","192.168.2.3","239.255.255.250","SSDP","136","M-SEARCH * HTTP/1.1 "
"616","2018-08-07 17:49:56.801359","192.168.2.3","172.217.27.163","TLSv1.2","135","[TCP Previous segment not captured] , Application Data"
"617","2018-08-07 17:49:56.801362","192.168.2.3","172.217.27.163","TLSv1.2","104","Application Data"
"620","2018-08-07 17:49:56.812191","192.168.2.3","172.217.27.163","TCP","66","38971  >  443 [ACK] Seq=109 Ack=117 Win=406 Len=0 TSval=503524 TSecr=467145854"
"621","2018-08-07 17:49:56.812194","192.168.2.3","172.217.27.163","TLSv1.2","100","Application Data"
"622","2018-08-07 17:49:56.812195","192.168.2.3","172.217.27.163","TLSv1.2","104","Application Data"
"624","2018-08-07 17:49:58.686051","192.168.2.3","172.217.27.174","TCP","66","52293  >  443 [ACK] Seq=1 Ack=1 Win=661 Len=0 TSval=503712 TSecr=874496720"
"626","2018-08-07 17:49:58.846020","192.168.2.3","172.217.27.174","TCP","66","52274  >  443 [ACK] Seq=1 Ack=1 Win=494 Len=0 TSval=503728 TSecr=4030314429"
