"No.","Time","Source","Destination","Protocol","Length","Info"
"24","2018-08-07 17:51:04.277195","192.168.2.3","216.58.197.4","TLSv1.2","155","Application Data"
"25","2018-08-07 17:51:04.277199","192.168.2.3","216.58.197.4","TLSv1.2","104","Application Data"
"26","2018-08-07 17:51:04.277200","192.168.2.3","216.58.197.4","TLSv1.2","158","Application Data"
"31","2018-08-07 17:51:04.284872","192.168.2.3","216.58.197.4","TCP","66","49253  >  443 [ACK] Seq=220 Ack=39 Win=1522 Len=0 TSval=510271 TSecr=372938244"
"32","2018-08-07 17:51:04.297045","192.168.2.3","216.58.197.4","TCP","1434","49253  >  443 [ACK] Seq=220 Ack=39 Win=1522 Len=1368 TSval=510272 TSecr=372938244 [TCP segment of a reassembled PDU]"
"33","2018-08-07 17:51:04.297047","192.168.2.3","216.58.197.4","TCP","1434","49253  >  443 [ACK] Seq=1588 Ack=39 Win=1522 Len=1368 TSval=510272 TSecr=372938244 [TCP segment of a reassembled PDU]"
"34","2018-08-07 17:51:04.297048","192.168.2.3","216.58.197.4","TLSv1.2","212","Application Data"
"35","2018-08-07 17:51:04.297240","192.168.2.3","216.58.197.4","TCP","1434","49253  >  443 [ACK] Seq=3102 Ack=39 Win=1522 Len=1368 TSval=510272 TSecr=372938244 [TCP segment of a reassembled PDU]"
"36","2018-08-07 17:51:04.297242","192.168.2.3","216.58.197.4","TLSv1.2","243","Application Data"
"37","2018-08-07 17:51:04.297429","192.168.2.3","216.58.197.4","TCP","1434","49253  >  443 [ACK] Seq=4647 Ack=39 Win=1522 Len=1368 TSval=510272 TSecr=372938244 [TCP segment of a reassembled PDU]"
"38","2018-08-07 17:51:04.297689","192.168.2.3","216.58.197.4","TCP","1434","49253  >  443 [ACK] Seq=6015 Ack=39 Win=1522 Len=1368 TSval=510272 TSecr=372938244 [TCP segment of a reassembled PDU]"
"39","2018-08-07 17:51:04.297691","192.168.2.3","216.58.197.4","TLSv1.2","212","Application Data"
"40","2018-08-07 17:51:04.297691","192.168.2.3","216.58.197.4","TCP","1434","49253  >  443 [ACK] Seq=7529 Ack=39 Win=1522 Len=1368 TSval=510272 TSecr=372938244 [TCP segment of a reassembled PDU]"
"41","2018-08-07 17:51:04.297834","192.168.2.3","216.58.197.4","TLSv1.2","156","Application Data"
"46","2018-08-07 17:51:04.303154","192.168.2.3","216.58.197.4","TCP","1434","49253  >  443 [ACK] Seq=8987 Ack=39 Win=1522 Len=1368 TSval=510273 TSecr=372938263 [TCP segment of a reassembled PDU]"
"47","2018-08-07 17:51:04.303521","192.168.2.3","216.58.197.4","TCP","1434","49253  >  443 [ACK] Seq=10355 Ack=39 Win=1522 Len=1368 TSval=510273 TSecr=372938263 [TCP segment of a reassembled PDU]"
"48","2018-08-07 17:51:04.303523","192.168.2.3","216.58.197.4","TLSv1.2","1434","Application Data [TCP segment of a reassembled PDU]"
"49","2018-08-07 17:51:04.303681","192.168.2.3","216.58.197.4","TLSv1.2","1434","Application Data [TCP segment of a reassembled PDU]"
"50","2018-08-07 17:51:04.304215","192.168.2.3","216.58.197.4","TCP","1434","49253  >  443 [ACK] Seq=14459 Ack=39 Win=1522 Len=1368 TSval=510273 TSecr=372938263 [TCP segment of a reassembled PDU]"
"51","2018-08-07 17:51:04.304218","192.168.2.3","216.58.197.4","TLSv1.2","1434","Application Data [TCP segment of a reassembled PDU]"
"52","2018-08-07 17:51:04.304601","192.168.2.3","216.58.197.4","TLSv1.2","1434","Application Data [TCP segment of a reassembled PDU]"
"53","2018-08-07 17:51:04.304603","192.168.2.3","216.58.197.4","TCP","1434","49253  >  443 [ACK] Seq=18563 Ack=39 Win=1522 Len=1368 TSval=510273 TSecr=372938263 [TCP segment of a reassembled PDU]"
"54","2018-08-07 17:51:04.304774","192.168.2.3","216.58.197.4","TLSv1.2","1434","Application Data [TCP segment of a reassembled PDU]"
"55","2018-08-07 17:51:04.305593","192.168.2.3","216.58.197.4","TLSv1.2","1434","Application Data [TCP segment of a reassembled PDU]"
"56","2018-08-07 17:51:04.306057","192.168.2.3","216.58.197.4","TCP","1434","49253  >  443 [ACK] Seq=22667 Ack=39 Win=1522 Len=1368 TSval=510273 TSecr=372938263 [TCP segment of a reassembled PDU]"
"57","2018-08-07 17:51:04.306488","192.168.2.3","216.58.197.4","TLSv1.2","1434","Application Data [TCP segment of a reassembled PDU]"
"58","2018-08-07 17:51:04.306490","192.168.2.3","216.58.197.4","TLSv1.2","1434","Application Data [TCP segment of a reassembled PDU]"
"62","2018-08-07 17:51:04.309179","192.168.2.3","216.58.197.4","TCP","1434","49253  >  443 [ACK] Seq=26771 Ack=39 Win=1522 Len=1368 TSval=510274 TSecr=372938269 [TCP segment of a reassembled PDU]"
"63","2018-08-07 17:51:04.309182","192.168.2.3","216.58.197.4","TLSv1.2","1434","Application Data [TCP segment of a reassembled PDU]"
"65","2018-08-07 17:51:04.309325","192.168.2.3","216.58.197.4","TLSv1.2","1434","Application Data [TCP segment of a reassembled PDU]"
"67","2018-08-07 17:51:04.310200","192.168.2.3","216.58.197.4","TCP","1434","49253  >  443 [ACK] Seq=30875 Ack=39 Win=1522 Len=1368 TSval=510274 TSecr=372938269 [TCP segment of a reassembled PDU]"
"68","2018-08-07 17:51:04.310202","192.168.2.3","216.58.197.4","TLSv1.2","1434","Application Data [TCP segment of a reassembled PDU]"
"69","2018-08-07 17:51:04.310502","192.168.2.3","216.58.197.4","TCP","1434","49253  >  443 [ACK] Seq=33611 Ack=39 Win=1522 Len=1368 TSval=510274 TSecr=372938269 [TCP segment of a reassembled PDU]"
"70","2018-08-07 17:51:04.310504","192.168.2.3","216.58.197.4","TLSv1.2","1434","Application Data [TCP segment of a reassembled PDU]"
"72","2018-08-07 17:51:04.311079","192.168.2.3","216.58.197.4","TCP","1434","49253  >  443 [ACK] Seq=36347 Ack=39 Win=1522 Len=1368 TSval=510274 TSecr=372938270 [TCP segment of a reassembled PDU]"
"73","2018-08-07 17:51:04.311081","192.168.2.3","216.58.197.4","TLSv1.2","1434","Application Data [TCP segment of a reassembled PDU]"
"74","2018-08-07 17:51:04.311328","192.168.2.3","216.58.197.4","TLSv1.2","1434","Application Data [TCP segment of a reassembled PDU]"
"79","2018-08-07 17:51:04.315100","192.168.2.3","216.58.197.4","TCP","1434","49253  >  443 [ACK] Seq=40451 Ack=39 Win=1522 Len=1368 TSval=510274 TSecr=372938270 [TCP segment of a reassembled PDU]"
"80","2018-08-07 17:51:04.315548","192.168.2.3","216.58.197.4","TLSv1.2","1434","Application Data [TCP segment of a reassembled PDU]"
"82","2018-08-07 17:51:04.316949","192.168.2.3","216.58.197.4","TLSv1.2","1434","Application Data [TCP segment of a reassembled PDU]"
"83","2018-08-07 17:51:04.316952","192.168.2.3","216.58.197.4","TCP","1434","49253  >  443 [ACK] Seq=44555 Ack=39 Win=1522 Len=1368 TSval=510274 TSecr=372938271 [TCP segment of a reassembled PDU]"
"84","2018-08-07 17:51:04.317142","192.168.2.3","216.58.197.4","TLSv1.2","1434","Application Data [TCP segment of a reassembled PDU]"
"85","2018-08-07 17:51:04.317547","192.168.2.3","216.58.197.4","TLSv1.2","1434","Application Data [TCP segment of a reassembled PDU]"
"86","2018-08-07 17:51:04.317775","192.168.2.3","216.58.197.4","TCP","1434","49253  >  443 [ACK] Seq=48659 Ack=39 Win=1522 Len=1368 TSval=510275 TSecr=372938272 [TCP segment of a reassembled PDU]"
"87","2018-08-07 17:51:04.317777","192.168.2.3","216.58.197.4","TLSv1.2","1434","Application Data [TCP segment of a reassembled PDU]"
"88","2018-08-07 17:51:04.318245","192.168.2.3","216.58.197.4","TLSv1.2","1434","Application Data [TCP segment of a reassembled PDU]"
"89","2018-08-07 17:51:04.318554","192.168.2.3","216.58.197.4","TCP","1434","49253  >  443 [PSH, ACK] Seq=52763 Ack=39 Win=1522 Len=1368 TSval=510275 TSecr=372938275 [TCP segment of a reassembled PDU]"
"90","2018-08-07 17:51:04.318555","192.168.2.3","216.58.197.4","TLSv1.2","1434","Application Data [TCP segment of a reassembled PDU]"
"91","2018-08-07 17:51:04.318861","192.168.2.3","216.58.197.4","TCP","1434","49253  >  443 [ACK] Seq=55499 Ack=39 Win=1522 Len=1368 TSval=510275 TSecr=372938275 [TCP segment of a reassembled PDU]"
"92","2018-08-07 17:51:04.319155","192.168.2.3","216.58.197.4","TLSv1.2","1434","Application Data [TCP segment of a reassembled PDU]"
"93","2018-08-07 17:51:04.319156","192.168.2.3","216.58.197.4","TLSv1.2","712","Application Data"
"95","2018-08-07 17:51:04.320282","192.168.2.3","216.58.197.4","TCP","1434","49253  >  443 [ACK] Seq=58881 Ack=39 Win=1522 Len=1368 TSval=510275 TSecr=372938277 [TCP segment of a reassembled PDU]"
"96","2018-08-07 17:51:04.320797","192.168.2.3","216.58.197.4","TCP","1434","49253  >  443 [ACK] Seq=60249 Ack=39 Win=1522 Len=1368 TSval=510275 TSecr=372938277 [TCP segment of a reassembled PDU]"
"97","2018-08-07 17:51:04.320799","192.168.2.3","216.58.197.4","TLSv1.2","212","Application Data"
"98","2018-08-07 17:51:04.320800","192.168.2.3","216.58.197.4","TCP","1434","49253  >  443 [ACK] Seq=61763 Ack=39 Win=1522 Len=1368 TSval=510275 TSecr=372938277 [TCP segment of a reassembled PDU]"
"99","2018-08-07 17:51:04.320801","192.168.2.3","216.58.197.4","TLSv1.2","155","Application Data"
"108","2018-08-07 17:51:04.423605","192.168.2.3","216.58.197.4","TCP","1434","49253  >  443 [ACK] Seq=63220 Ack=39 Win=1522 Len=1368 TSval=510285 TSecr=372938286 [TCP segment of a reassembled PDU]"
"109","2018-08-07 17:51:04.423949","192.168.2.3","216.58.197.4","TCP","1434","49253  >  443 [ACK] Seq=64588 Ack=39 Win=1522 Len=1368 TSval=510285 TSecr=372938286 [TCP segment of a reassembled PDU]"
"110","2018-08-07 17:51:04.423952","192.168.2.3","216.58.197.4","TLSv1.2","212","Application Data"
"111","2018-08-07 17:51:04.424441","192.168.2.3","216.58.197.4","TCP","1434","49253  >  443 [ACK] Seq=66102 Ack=39 Win=1522 Len=1368 TSval=510285 TSecr=372938286 [TCP segment of a reassembled PDU]"
"112","2018-08-07 17:51:04.424444","192.168.2.3","216.58.197.4","TLSv1.2","155","Application Data"
"116","2018-08-07 17:51:04.549025","192.168.2.3","216.58.197.4","TCP","1434","49253  >  443 [ACK] Seq=67559 Ack=39 Win=1522 Len=1368 TSval=510298 TSecr=372938430 [TCP segment of a reassembled PDU]"
"117","2018-08-07 17:51:04.549188","192.168.2.3","216.58.197.4","TCP","1434","49253  >  443 [ACK] Seq=68927 Ack=39 Win=1522 Len=1368 TSval=510298 TSecr=372938430 [TCP segment of a reassembled PDU]"
"118","2018-08-07 17:51:04.549190","192.168.2.3","216.58.197.4","TLSv1.2","212","Application Data"
"119","2018-08-07 17:51:04.549417","192.168.2.3","216.58.197.4","TLSv1.2","1339","Application Data"
"123","2018-08-07 17:51:04.553583","192.168.2.3","216.58.197.4","TCP","66","49253  >  443 [ACK] Seq=71714 Ack=180 Win=1522 Len=0 TSval=510298 TSecr=372938513"
"126","2018-08-07 17:51:04.564593","192.168.2.3","216.58.197.4","TCP","66","49253  >  443 [ACK] Seq=71714 Ack=397 Win=1522 Len=0 TSval=510299 TSecr=372938514"
"127","2018-08-07 17:51:04.651819","192.168.2.3","216.58.197.4","TCP","1434","49253  >  443 [ACK] Seq=71714 Ack=397 Win=1522 Len=1368 TSval=510308 TSecr=372938514 [TCP segment of a reassembled PDU]"
"128","2018-08-07 17:51:04.655440","192.168.2.3","216.58.197.4","TCP","1434","49253  >  443 [ACK] Seq=73082 Ack=397 Win=1522 Len=1368 TSval=510308 TSecr=372938514 [TCP segment of a reassembled PDU]"
"129","2018-08-07 17:51:04.655443","192.168.2.3","216.58.197.4","TLSv1.2","212","Application Data"
"130","2018-08-07 17:51:04.655677","192.168.2.3","216.58.197.4","TCP","1434","49253  >  443 [ACK] Seq=74596 Ack=397 Win=1522 Len=1368 TSval=510308 TSecr=372938514 [TCP segment of a reassembled PDU]"
"131","2018-08-07 17:51:04.655679","192.168.2.3","216.58.197.4","TLSv1.2","155","Application Data"
"135","2018-08-07 17:51:04.736691","192.168.2.3","216.58.197.4","TCP","66","49253  >  443 [ACK] Seq=76053 Ack=475 Win=1522 Len=0 TSval=510317 TSecr=372938657"
"136","2018-08-07 17:51:04.774114","192.168.2.3","216.58.197.4","TCP","1434","49253  >  443 [ACK] Seq=76053 Ack=475 Win=1522 Len=1368 TSval=510320 TSecr=372938657 [TCP segment of a reassembled PDU]"
"137","2018-08-07 17:51:04.774129","192.168.2.3","216.58.197.4","TCP","1434","49253  >  443 [ACK] Seq=77421 Ack=475 Win=1522 Len=1368 TSval=510320 TSecr=372938657 [TCP segment of a reassembled PDU]"
"138","2018-08-07 17:51:04.774131","192.168.2.3","216.58.197.4","TLSv1.2","212","Application Data"
"139","2018-08-07 17:51:04.774244","192.168.2.3","216.58.197.4","TCP","1434","49253  >  443 [ACK] Seq=78935 Ack=475 Win=1522 Len=1368 TSval=510320 TSecr=372938657 [TCP segment of a reassembled PDU]"
"140","2018-08-07 17:51:04.774247","192.168.2.3","216.58.197.4","TLSv1.2","155","Application Data"
"142","2018-08-07 17:51:04.871279","192.168.2.3","216.58.197.4","TCP","1434","49253  >  443 [ACK] Seq=80392 Ack=475 Win=1522 Len=1368 TSval=510330 TSecr=372938740 [TCP segment of a reassembled PDU]"
"144","2018-08-07 17:51:04.871699","192.168.2.3","216.58.197.4","TCP","1434","49253  >  443 [ACK] Seq=81760 Ack=475 Win=1522 Len=1368 TSval=510330 TSecr=372938740 [TCP segment of a reassembled PDU]"
"145","2018-08-07 17:51:04.871701","192.168.2.3","216.58.197.4","TLSv1.2","212","Application Data"
"146","2018-08-07 17:51:04.871804","192.168.2.3","216.58.197.4","TLSv1.2","1204","Application Data"
"147","2018-08-07 17:51:04.872863","192.168.2.3","216.58.197.4","TCP","66","49253  >  443 [ACK] Seq=84412 Ack=645 Win=1522 Len=0 TSval=510330 TSecr=372938832"
"150","2018-08-07 17:51:04.967196","192.168.2.3","216.58.197.4","TCP","1434","49253  >  443 [ACK] Seq=84412 Ack=645 Win=1522 Len=1368 TSval=510340 TSecr=372938837 [TCP segment of a reassembled PDU]"
"151","2018-08-07 17:51:04.967615","192.168.2.3","216.58.197.4","TCP","1434","49253  >  443 [ACK] Seq=85780 Ack=645 Win=1522 Len=1368 TSval=510340 TSecr=372938837 [TCP segment of a reassembled PDU]"
"152","2018-08-07 17:51:04.967617","192.168.2.3","216.58.197.4","TLSv1.2","212","Application Data"
"153","2018-08-07 17:51:04.967618","192.168.2.3","216.58.197.4","TCP","1434","49253  >  443 [ACK] Seq=87294 Ack=645 Win=1522 Len=1368 TSval=510340 TSecr=372938837 [TCP segment of a reassembled PDU]"
"154","2018-08-07 17:51:04.967619","192.168.2.3","216.58.197.4","TLSv1.2","155","Application Data"
"158","2018-08-07 17:51:05.091749","192.168.2.3","216.58.197.4","TCP","1434","49253  >  443 [ACK] Seq=88751 Ack=645 Win=1522 Len=1368 TSval=510352 TSecr=372938973 [TCP segment of a reassembled PDU]"
"159","2018-08-07 17:51:05.092217","192.168.2.3","216.58.197.4","TCP","1434","49253  >  443 [ACK] Seq=90119 Ack=645 Win=1522 Len=1368 TSval=510352 TSecr=372938973 [TCP segment of a reassembled PDU]"
"160","2018-08-07 17:51:05.092220","192.168.2.3","216.58.197.4","TLSv1.2","212","Application Data"
"161","2018-08-07 17:51:05.092221","192.168.2.3","216.58.197.4","TLSv1.2","1425","Application Data"
"163","2018-08-07 17:51:05.191635","192.168.2.3","216.58.197.4","TCP","1434","49253  >  443 [ACK] Seq=92992 Ack=645 Win=1522 Len=1368 TSval=510362 TSecr=372939058 [TCP segment of a reassembled PDU]"
"164","2018-08-07 17:51:05.192023","192.168.2.3","216.58.197.4","TCP","1434","49253  >  443 [ACK] Seq=94360 Ack=645 Win=1522 Len=1368 TSval=510362 TSecr=372939058 [TCP segment of a reassembled PDU]"
"165","2018-08-07 17:51:05.192026","192.168.2.3","216.58.197.4","TLSv1.2","212","Application Data"
"166","2018-08-07 17:51:05.192027","192.168.2.3","216.58.197.4","TCP","1434","49253  >  443 [ACK] Seq=95874 Ack=645 Win=1522 Len=1368 TSval=510362 TSecr=372939058 [TCP segment of a reassembled PDU]"
"167","2018-08-07 17:51:05.192229","192.168.2.3","216.58.197.4","TLSv1.2","155","Application Data"
"170","2018-08-07 17:51:05.287311","192.168.2.3","216.58.197.4","TCP","1434","49253  >  443 [ACK] Seq=97331 Ack=645 Win=1522 Len=1368 TSval=510372 TSecr=372939157 [TCP segment of a reassembled PDU]"
"171","2018-08-07 17:51:05.287684","192.168.2.3","216.58.197.4","TCP","1434","49253  >  443 [ACK] Seq=98699 Ack=645 Win=1522 Len=1368 TSval=510372 TSecr=372939157 [TCP segment of a reassembled PDU]"
"172","2018-08-07 17:51:05.287686","192.168.2.3","216.58.197.4","TLSv1.2","212","Application Data"
"173","2018-08-07 17:51:05.287687","192.168.2.3","216.58.197.4","TCP","1434","49253  >  443 [ACK] Seq=100213 Ack=645 Win=1522 Len=1368 TSval=510372 TSecr=372939157 [TCP segment of a reassembled PDU]"
"174","2018-08-07 17:51:05.287920","192.168.2.3","216.58.197.4","TLSv1.2","155","Application Data"
"178","2018-08-07 17:51:05.377489","192.168.2.3","216.58.197.4","TCP","1434","49253  >  443 [ACK] Seq=101670 Ack=645 Win=1522 Len=1368 TSval=510381 TSecr=372939254 [TCP segment of a reassembled PDU]"
"179","2018-08-07 17:51:05.377922","192.168.2.3","216.58.197.4","TCP","1434","49253  >  443 [ACK] Seq=103038 Ack=645 Win=1522 Len=1368 TSval=510381 TSecr=372939254 [TCP segment of a reassembled PDU]"
"180","2018-08-07 17:51:05.377924","192.168.2.3","216.58.197.4","TLSv1.2","212","Application Data"
"181","2018-08-07 17:51:05.378319","192.168.2.3","216.58.197.4","TCP","1434","49253  >  443 [ACK] Seq=104552 Ack=645 Win=1522 Len=1368 TSval=510381 TSecr=372939254 [TCP segment of a reassembled PDU]"
"182","2018-08-07 17:51:05.378320","192.168.2.3","216.58.197.4","TLSv1.2","155","Application Data"
"186","2018-08-07 17:51:05.480284","192.168.2.3","216.58.197.4","TCP","1434","49253  >  443 [ACK] Seq=106009 Ack=645 Win=1522 Len=1368 TSval=510391 TSecr=372939344 [TCP segment of a reassembled PDU]"
"187","2018-08-07 17:51:05.480300","192.168.2.3","216.58.197.4","TCP","1434","49253  >  443 [ACK] Seq=107377 Ack=645 Win=1522 Len=1368 TSval=510391 TSecr=372939344 [TCP segment of a reassembled PDU]"
"188","2018-08-07 17:51:05.480303","192.168.2.3","216.58.197.4","TLSv1.2","212","Application Data"
"189","2018-08-07 17:51:05.480421","192.168.2.3","216.58.197.4","TCP","1434","49253  >  443 [ACK] Seq=108891 Ack=645 Win=1522 Len=1368 TSval=510391 TSecr=372939344 [TCP segment of a reassembled PDU]"
"190","2018-08-07 17:51:05.480425","192.168.2.3","216.58.197.4","TLSv1.2","155","Application Data"
"195","2018-08-07 17:51:05.554179","192.168.2.3","216.58.197.4","TCP","66","49253  >  443 [ACK] Seq=110348 Ack=795 Win=1522 Len=0 TSval=510398 TSecr=372939514"
"197","2018-08-07 17:51:05.564583","192.168.2.3","216.58.197.4","TCP","66","49253  >  443 [ACK] Seq=110348 Ack=869 Win=1522 Len=0 TSval=510399 TSecr=372939524"
"198","2018-08-07 17:51:05.573172","192.168.2.3","216.58.197.4","TCP","1434","49253  >  443 [ACK] Seq=110348 Ack=869 Win=1522 Len=1368 TSval=510400 TSecr=372939524 [TCP segment of a reassembled PDU]"
"199","2018-08-07 17:51:05.573175","192.168.2.3","216.58.197.4","TCP","1434","49253  >  443 [ACK] Seq=111716 Ack=869 Win=1522 Len=1368 TSval=510400 TSecr=372939524 [TCP segment of a reassembled PDU]"
"200","2018-08-07 17:51:05.573176","192.168.2.3","216.58.197.4","TLSv1.2","212","Application Data"
"201","2018-08-07 17:51:05.573532","192.168.2.3","216.58.197.4","TCP","1434","49253  >  443 [ACK] Seq=113230 Ack=869 Win=1522 Len=1368 TSval=510400 TSecr=372939524 [TCP segment of a reassembled PDU]"
"202","2018-08-07 17:51:05.573534","192.168.2.3","216.58.197.4","TLSv1.2","155","Application Data"
"208","2018-08-07 17:51:05.645092","192.168.2.3","216.58.197.4","TCP","66","49253  >  443 [ACK] Seq=114687 Ack=1179 Win=1522 Len=0 TSval=510407 TSecr=372939602"
"209","2018-08-07 17:51:05.670607","192.168.2.3","216.58.197.4","TCP","1434","49253  >  443 [ACK] Seq=114687 Ack=1179 Win=1522 Len=1368 TSval=510410 TSecr=372939602 [TCP segment of a reassembled PDU]"
"210","2018-08-07 17:51:05.670902","192.168.2.3","216.58.197.4","TCP","1434","49253  >  443 [ACK] Seq=116055 Ack=1179 Win=1522 Len=1368 TSval=510410 TSecr=372939602 [TCP segment of a reassembled PDU]"
"211","2018-08-07 17:51:05.670917","192.168.2.3","216.58.197.4","TLSv1.2","212","Application Data"
"212","2018-08-07 17:51:05.671072","192.168.2.3","216.58.197.4","TCP","1434","49253  >  443 [ACK] Seq=117569 Ack=1179 Win=1522 Len=1368 TSval=510410 TSecr=372939602 [TCP segment of a reassembled PDU]"
"213","2018-08-07 17:51:05.671073","192.168.2.3","216.58.197.4","TLSv1.2","155","Application Data"
"217","2018-08-07 17:51:05.735516","192.168.2.3","216.58.197.4","TCP","1434","49253  >  443 [ACK] Seq=119026 Ack=1179 Win=1522 Len=1368 TSval=510416 TSecr=372939637 [TCP segment of a reassembled PDU]"
"218","2018-08-07 17:51:05.735522","192.168.2.3","216.58.197.4","TCP","1434","49253  >  443 [ACK] Seq=120394 Ack=1179 Win=1522 Len=1368 TSval=510416 TSecr=372939637 [TCP segment of a reassembled PDU]"
"219","2018-08-07 17:51:05.735915","192.168.2.3","216.58.197.4","TLSv1.2","212","Application Data"
"220","2018-08-07 17:51:05.736248","192.168.2.3","216.58.197.4","TCP","1434","49253  >  443 [ACK] Seq=121908 Ack=1179 Win=1522 Len=1368 TSval=510416 TSecr=372939637 [TCP segment of a reassembled PDU]"
"221","2018-08-07 17:51:05.736250","192.168.2.3","216.58.197.4","TLSv1.2","155","Application Data"
"224","2018-08-07 17:51:05.833084","192.168.2.3","216.58.197.4","TCP","1434","49253  >  443 [ACK] Seq=123365 Ack=1179 Win=1522 Len=1368 TSval=510426 TSecr=372939702 [TCP segment of a reassembled PDU]"
"225","2018-08-07 17:51:05.833089","192.168.2.3","216.58.197.4","TCP","1434","49253  >  443 [ACK] Seq=124733 Ack=1179 Win=1522 Len=1368 TSval=510426 TSecr=372939702 [TCP segment of a reassembled PDU]"
"226","2018-08-07 17:51:05.833244","192.168.2.3","216.58.197.4","TLSv1.2","212","Application Data"
"227","2018-08-07 17:51:05.833246","192.168.2.3","216.58.197.4","TCP","1434","49253  >  443 [ACK] Seq=126247 Ack=1179 Win=1522 Len=1368 TSval=510426 TSecr=372939702 [TCP segment of a reassembled PDU]"
"228","2018-08-07 17:51:05.833627","192.168.2.3","216.58.197.4","TLSv1.2","155","Application Data"
"231","2018-08-07 17:51:05.922312","192.168.2.3","216.58.197.4","TCP","1434","49253  >  443 [ACK] Seq=127704 Ack=1179 Win=1522 Len=1368 TSval=510435 TSecr=372939799 [TCP segment of a reassembled PDU]"
"232","2018-08-07 17:51:05.922317","192.168.2.3","216.58.197.4","TCP","1434","49253  >  443 [ACK] Seq=129072 Ack=1179 Win=1522 Len=1368 TSval=510435 TSecr=372939799 [TCP segment of a reassembled PDU]"
"233","2018-08-07 17:51:05.922317","192.168.2.3","216.58.197.4","TLSv1.2","212","Application Data"
"234","2018-08-07 17:51:05.922508","192.168.2.3","216.58.197.4","TCP","1434","49253  >  443 [ACK] Seq=130586 Ack=1179 Win=1522 Len=1368 TSval=510435 TSecr=372939799 [TCP segment of a reassembled PDU]"
"235","2018-08-07 17:51:05.922711","192.168.2.3","216.58.197.4","TLSv1.2","155","Application Data"
"239","2018-08-07 17:51:05.982578","192.168.2.3","216.58.197.4","TCP","66","49253  >  443 [ACK] Seq=132043 Ack=1319 Win=1522 Len=0 TSval=510441 TSecr=372939939"
"240","2018-08-07 17:51:06.024678","192.168.2.3","216.58.197.4","TCP","1434","49253  >  443 [ACK] Seq=132043 Ack=1319 Win=1522 Len=1368 TSval=510445 TSecr=372939939 [TCP segment of a reassembled PDU]"
"241","2018-08-07 17:51:06.024682","192.168.2.3","216.58.197.4","TCP","1434","49253  >  443 [ACK] Seq=133411 Ack=1319 Win=1522 Len=1368 TSval=510445 TSecr=372939939 [TCP segment of a reassembled PDU]"
"242","2018-08-07 17:51:06.024683","192.168.2.3","216.58.197.4","TLSv1.2","212","Application Data"
"243","2018-08-07 17:51:06.024806","192.168.2.3","216.58.197.4","TLSv1.2","1315","Application Data"
"246","2018-08-07 17:51:06.124101","192.168.2.3","216.58.197.4","TCP","1434","49253  >  443 [ACK] Seq=136174 Ack=1319 Win=1522 Len=1368 TSval=510455 TSecr=372939990 [TCP segment of a reassembled PDU]"
"247","2018-08-07 17:51:06.124527","192.168.2.3","216.58.197.4","TCP","1434","49253  >  443 [ACK] Seq=137542 Ack=1319 Win=1522 Len=1368 TSval=510455 TSecr=372939990 [TCP segment of a reassembled PDU]"
"248","2018-08-07 17:51:06.124529","192.168.2.3","216.58.197.4","TLSv1.2","212","Application Data"
"249","2018-08-07 17:51:06.124973","192.168.2.3","216.58.197.4","TLSv1.2","1159","Application Data"
"254","2018-08-07 17:51:06.223111","192.168.2.3","216.58.197.4","TCP","1434","49253  >  443 [ACK] Seq=140149 Ack=1399 Win=1522 Len=1368 TSval=510465 TSecr=372940160 [TCP segment of a reassembled PDU]"
"255","2018-08-07 17:51:06.223616","192.168.2.3","216.58.197.4","TCP","1434","49253  >  443 [ACK] Seq=141517 Ack=1399 Win=1522 Len=1368 TSval=510465 TSecr=372940160 [TCP segment of a reassembled PDU]"
"256","2018-08-07 17:51:06.224687","192.168.2.3","216.58.197.4","TLSv1.2","212","Application Data"
"257","2018-08-07 17:51:06.225098","192.168.2.3","216.58.197.4","TCP","1434","49253  >  443 [ACK] Seq=143031 Ack=1399 Win=1522 Len=1368 TSval=510465 TSecr=372940160 [TCP segment of a reassembled PDU]"
"258","2018-08-07 17:51:06.225101","192.168.2.3","216.58.197.4","TLSv1.2","155","Application Data"
"263","2018-08-07 17:51:06.280483","192.168.2.3","216.58.197.4","TCP","66","49253  >  443 [ACK] Seq=144488 Ack=1761 Win=1522 Len=0 TSval=510471 TSecr=372940240"
"264","2018-08-07 17:51:06.311381","192.168.2.3","216.58.197.4","TCP","1434","49253  >  443 [ACK] Seq=144488 Ack=1761 Win=1522 Len=1368 TSval=510474 TSecr=372940240 [TCP segment of a reassembled PDU]"
"265","2018-08-07 17:51:06.311758","192.168.2.3","216.58.197.4","TCP","1434","49253  >  443 [ACK] Seq=145856 Ack=1761 Win=1522 Len=1368 TSval=510474 TSecr=372940240 [TCP segment of a reassembled PDU]"
"266","2018-08-07 17:51:06.311760","192.168.2.3","216.58.197.4","TLSv1.2","212","Application Data"
"267","2018-08-07 17:51:06.311977","192.168.2.3","216.58.197.4","TCP","1434","49253  >  443 [ACK] Seq=147370 Ack=1761 Win=1522 Len=1368 TSval=510474 TSecr=372940240 [TCP segment of a reassembled PDU]"
"268","2018-08-07 17:51:06.311993","192.168.2.3","216.58.197.4","TLSv1.2","155","Application Data"
"272","2018-08-07 17:51:06.434267","192.168.2.3","216.58.197.4","TCP","1434","49253  >  443 [ACK] Seq=148827 Ack=1761 Win=1522 Len=1368 TSval=510486 TSecr=372940277 [TCP segment of a reassembled PDU]"
"273","2018-08-07 17:51:06.434378","192.168.2.3","216.58.197.4","TCP","1434","49253  >  443 [ACK] Seq=150195 Ack=1761 Win=1522 Len=1368 TSval=510486 TSecr=372940277 [TCP segment of a reassembled PDU]"
"274","2018-08-07 17:51:06.434383","192.168.2.3","216.58.197.4","TLSv1.2","212","Application Data"
"275","2018-08-07 17:51:06.434552","192.168.2.3","216.58.197.4","TCP","1434","49253  >  443 [ACK] Seq=151709 Ack=1761 Win=1522 Len=1368 TSval=510486 TSecr=372940277 [TCP segment of a reassembled PDU]"
"276","2018-08-07 17:51:06.434555","192.168.2.3","216.58.197.4","TLSv1.2","155","Application Data"
"279","2018-08-07 17:51:06.507618","192.168.2.3","216.58.197.4","TCP","1434","49253  >  443 [ACK] Seq=153166 Ack=1761 Win=1522 Len=1368 TSval=510494 TSecr=372940400 [TCP segment of a reassembled PDU]"
"280","2018-08-07 17:51:06.508107","192.168.2.3","216.58.197.4","TCP","1434","49253  >  443 [ACK] Seq=154534 Ack=1761 Win=1522 Len=1368 TSval=510494 TSecr=372940400 [TCP segment of a reassembled PDU]"
"281","2018-08-07 17:51:06.508108","192.168.2.3","216.58.197.4","TLSv1.2","212","Application Data"
"282","2018-08-07 17:51:06.508471","192.168.2.3","216.58.197.4","TCP","1434","49253  >  443 [ACK] Seq=156048 Ack=1761 Win=1522 Len=1368 TSval=510494 TSecr=372940400 [TCP segment of a reassembled PDU]"
"283","2018-08-07 17:51:06.508472","192.168.2.3","216.58.197.4","TLSv1.2","155","Application Data"
"290","2018-08-07 17:51:06.561739","192.168.2.3","216.58.197.4","TCP","66","49253  >  443 [ACK] Seq=157505 Ack=2605 Win=1522 Len=0 TSval=510499 TSecr=372940514"
"292","2018-08-07 17:51:06.596891","192.168.2.3","216.58.197.4","TCP","66","49253  >  443 [ACK] Seq=157505 Ack=2817 Win=1522 Len=0 TSval=510503 TSecr=372940524"
"293","2018-08-07 17:51:06.625981","192.168.2.3","216.58.197.4","TCP","1434","49253  >  443 [ACK] Seq=157505 Ack=2817 Win=1522 Len=1368 TSval=510505 TSecr=372940524 [TCP segment of a reassembled PDU]"
"294","2018-08-07 17:51:06.627102","192.168.2.3","216.58.197.4","TCP","1434","49253  >  443 [ACK] Seq=158873 Ack=2817 Win=1522 Len=1368 TSval=510505 TSecr=372940524 [TCP segment of a reassembled PDU]"
"295","2018-08-07 17:51:06.627104","192.168.2.3","216.58.197.4","TLSv1.2","212","Application Data"
"296","2018-08-07 17:51:06.627469","192.168.2.3","216.58.197.4","TCP","1434","49253  >  443 [ACK] Seq=160387 Ack=2817 Win=1522 Len=1368 TSval=510505 TSecr=372940524 [TCP segment of a reassembled PDU]"
"297","2018-08-07 17:51:06.627471","192.168.2.3","216.58.197.4","TLSv1.2","155","Application Data"
"301","2018-08-07 17:51:06.727409","192.168.2.3","216.58.197.4","TCP","1434","49253  >  443 [ACK] Seq=161844 Ack=2817 Win=1522 Len=1368 TSval=510516 TSecr=372940593 [TCP segment of a reassembled PDU]"
"302","2018-08-07 17:51:06.727759","192.168.2.3","216.58.197.4","TCP","1434","49253  >  443 [ACK] Seq=163212 Ack=2817 Win=1522 Len=1368 TSval=510516 TSecr=372940593 [TCP segment of a reassembled PDU]"
"303","2018-08-07 17:51:06.727761","192.168.2.3","216.58.197.4","TLSv1.2","212","Application Data"
"304","2018-08-07 17:51:06.727762","192.168.2.3","216.58.197.4","TCP","1434","49253  >  443 [ACK] Seq=164726 Ack=2817 Win=1522 Len=1368 TSval=510516 TSecr=372940593 [TCP segment of a reassembled PDU]"
"305","2018-08-07 17:51:06.727963","192.168.2.3","216.58.197.4","TLSv1.2","155","Application Data"
"309","2018-08-07 17:51:06.803143","192.168.2.3","216.58.197.4","TCP","1434","49253  >  443 [ACK] Seq=166183 Ack=2817 Win=1522 Len=1368 TSval=510523 TSecr=372940693 [TCP segment of a reassembled PDU]"
"310","2018-08-07 17:51:06.803472","192.168.2.3","216.58.197.4","TCP","1434","49253  >  443 [ACK] Seq=167551 Ack=2817 Win=1522 Len=1368 TSval=510523 TSecr=372940693 [TCP segment of a reassembled PDU]"
"311","2018-08-07 17:51:06.803474","192.168.2.3","216.58.197.4","TLSv1.2","212","Application Data"
"312","2018-08-07 17:51:06.803940","192.168.2.3","216.58.197.4","TCP","1434","49253  >  443 [ACK] Seq=169065 Ack=2817 Win=1522 Len=1368 TSval=510523 TSecr=372940693 [TCP segment of a reassembled PDU]"
"313","2018-08-07 17:51:06.803943","192.168.2.3","216.58.197.4","TLSv1.2","155","Application Data"
"319","2018-08-07 17:51:06.859487","192.168.2.3","216.58.197.4","TCP","66","49253  >  443 [ACK] Seq=170522 Ack=3072 Win=1522 Len=0 TSval=510529 TSecr=372940819"
"320","2018-08-07 17:51:06.859801","192.168.2.3","216.58.197.4","TCP","66","49253  >  443 [ACK] Seq=170522 Ack=3147 Win=1522 Len=0 TSval=510529 TSecr=372940820"
"321","2018-08-07 17:51:06.913266","192.168.2.3","216.58.197.4","TCP","1434","49253  >  443 [ACK] Seq=170522 Ack=3147 Win=1522 Len=1368 TSval=510534 TSecr=372940820 [TCP segment of a reassembled PDU]"
"322","2018-08-07 17:51:06.913578","192.168.2.3","216.58.197.4","TCP","1434","49253  >  443 [ACK] Seq=171890 Ack=3147 Win=1522 Len=1368 TSval=510534 TSecr=372940820 [TCP segment of a reassembled PDU]"
"323","2018-08-07 17:51:06.913579","192.168.2.3","216.58.197.4","TLSv1.2","212","Application Data"
"324","2018-08-07 17:51:06.913580","192.168.2.3","216.58.197.4","TCP","1434","49253  >  443 [ACK] Seq=173404 Ack=3147 Win=1522 Len=1368 TSval=510534 TSecr=372940820 [TCP segment of a reassembled PDU]"
"325","2018-08-07 17:51:06.913719","192.168.2.3","216.58.197.4","TLSv1.2","155","Application Data"
"331","2018-08-07 17:51:06.969305","192.168.2.3","216.58.197.4","TCP","66","49253  >  443 [ACK] Seq=174861 Ack=3412 Win=1522 Len=0 TSval=510540 TSecr=372940929"
"332","2018-08-07 17:51:06.969308","192.168.2.3","216.58.197.4","TCP","66","49253  >  443 [ACK] Seq=174861 Ack=3600 Win=1522 Len=0 TSval=510540 TSecr=372940929"
"333","2018-08-07 17:51:06.983254","192.168.2.3","216.58.197.4","TCP","1434","49253  >  443 [ACK] Seq=174861 Ack=3600 Win=1522 Len=1368 TSval=510541 TSecr=372940929 [TCP segment of a reassembled PDU]"
"334","2018-08-07 17:51:06.983549","192.168.2.3","216.58.197.4","TCP","1434","49253  >  443 [ACK] Seq=176229 Ack=3600 Win=1522 Len=1368 TSval=510541 TSecr=372940929 [TCP segment of a reassembled PDU]"
"335","2018-08-07 17:51:06.983550","192.168.2.3","216.58.197.4","TLSv1.2","212","Application Data"
"336","2018-08-07 17:51:06.984027","192.168.2.3","216.58.197.4","TCP","1434","49253  >  443 [ACK] Seq=177743 Ack=3600 Win=1522 Len=1368 TSval=510541 TSecr=372940929 [TCP segment of a reassembled PDU]"
"337","2018-08-07 17:51:06.984030","192.168.2.3","216.58.197.4","TLSv1.2","155","Application Data"
"341","2018-08-07 17:51:07.083326","192.168.2.3","216.58.197.4","TCP","1434","49253  >  443 [ACK] Seq=179200 Ack=3600 Win=1522 Len=1368 TSval=510551 TSecr=372940949 [TCP segment of a reassembled PDU]"
"342","2018-08-07 17:51:07.083863","192.168.2.3","216.58.197.4","TCP","1434","49253  >  443 [ACK] Seq=180568 Ack=3600 Win=1522 Len=1368 TSval=510551 TSecr=372940949 [TCP segment of a reassembled PDU]"
"343","2018-08-07 17:51:07.083866","192.168.2.3","216.58.197.4","TLSv1.2","212","Application Data"
"344","2018-08-07 17:51:07.084304","192.168.2.3","216.58.197.4","TCP","1434","49253  >  443 [ACK] Seq=182082 Ack=3600 Win=1522 Len=1368 TSval=510551 TSecr=372940949 [TCP segment of a reassembled PDU]"
"345","2018-08-07 17:51:07.084306","192.168.2.3","216.58.197.4","TLSv1.2","155","Application Data"
"351","2018-08-07 17:51:07.144395","192.168.2.3","216.58.197.4","TCP","66","49253  >  443 [ACK] Seq=183539 Ack=3832 Win=1522 Len=0 TSval=510557 TSecr=372941098"
"352","2018-08-07 17:51:07.201714","192.168.2.3","216.58.197.4","TCP","1434","49253  >  443 [ACK] Seq=183539 Ack=3832 Win=1522 Len=1368 TSval=510563 TSecr=372941098 [TCP segment of a reassembled PDU]"
"353","2018-08-07 17:51:07.202053","192.168.2.3","216.58.197.4","TCP","1434","49253  >  443 [ACK] Seq=184907 Ack=3832 Win=1522 Len=1368 TSval=510563 TSecr=372941098 [TCP segment of a reassembled PDU]"
"354","2018-08-07 17:51:07.202055","192.168.2.3","216.58.197.4","TLSv1.2","212","Application Data"
"355","2018-08-07 17:51:07.205936","192.168.2.3","216.58.197.4","TCP","1434","49253  >  443 [ACK] Seq=186421 Ack=3832 Win=1522 Len=1368 TSval=510563 TSecr=372941098 [TCP segment of a reassembled PDU]"
"356","2018-08-07 17:51:07.205939","192.168.2.3","216.58.197.4","TLSv1.2","155","Application Data"
"362","2018-08-07 17:51:07.266526","192.168.2.3","216.58.197.4","TCP","66","49253  >  443 [ACK] Seq=187878 Ack=3986 Win=1522 Len=0 TSval=510569 TSecr=372941225"
"363","2018-08-07 17:51:07.279215","192.168.2.3","216.58.197.4","TCP","1434","49253  >  443 [ACK] Seq=187878 Ack=3986 Win=1522 Len=1368 TSval=510571 TSecr=372941225 [TCP segment of a reassembled PDU]"
"364","2018-08-07 17:51:07.279476","192.168.2.3","216.58.197.4","TCP","1434","49253  >  443 [ACK] Seq=189246 Ack=3986 Win=1522 Len=1368 TSval=510571 TSecr=372941225 [TCP segment of a reassembled PDU]"
"365","2018-08-07 17:51:07.279480","192.168.2.3","216.58.197.4","TLSv1.2","212","Application Data"
"366","2018-08-07 17:51:07.279849","192.168.2.3","216.58.197.4","TCP","1434","49253  >  443 [ACK] Seq=190760 Ack=3986 Win=1522 Len=1368 TSval=510571 TSecr=372941225 [TCP segment of a reassembled PDU]"
"367","2018-08-07 17:51:07.279851","192.168.2.3","216.58.197.4","TLSv1.2","155","Application Data"
"371","2018-08-07 17:51:07.392991","192.168.2.3","216.58.197.4","TCP","1434","49253  >  443 [ACK] Seq=192217 Ack=3986 Win=1522 Len=1368 TSval=510582 TSecr=372941245 [TCP segment of a reassembled PDU]"
"372","2018-08-07 17:51:07.393401","192.168.2.3","216.58.197.4","TCP","1434","49253  >  443 [ACK] Seq=193585 Ack=3986 Win=1522 Len=1368 TSval=510582 TSecr=372941245 [TCP segment of a reassembled PDU]"
"373","2018-08-07 17:51:07.393403","192.168.2.3","216.58.197.4","TLSv1.2","212","Application Data"
"374","2018-08-07 17:51:07.393403","192.168.2.3","216.58.197.4","TLSv1.2","1392","Application Data"
"379","2018-08-07 17:51:07.452553","192.168.2.3","216.58.197.4","TCP","66","49253  >  443 [ACK] Seq=196425 Ack=4192 Win=1522 Len=0 TSval=510588 TSecr=372941412"
"380","2018-08-07 17:51:07.495734","192.168.2.3","216.58.197.4","TCP","1434","49253  >  443 [ACK] Seq=196425 Ack=4192 Win=1522 Len=1368 TSval=510592 TSecr=372941412 [TCP segment of a reassembled PDU]"
"381","2018-08-07 17:51:07.495738","192.168.2.3","216.58.197.4","TCP","1434","49253  >  443 [ACK] Seq=197793 Ack=4192 Win=1522 Len=1368 TSval=510592 TSecr=372941412 [TCP segment of a reassembled PDU]"
"382","2018-08-07 17:51:07.495739","192.168.2.3","216.58.197.4","TLSv1.2","212","Application Data"
"383","2018-08-07 17:51:07.496313","192.168.2.3","216.58.197.4","TLSv1.2","1358","Application Data"
"391","2018-08-07 17:51:07.564803","192.168.2.3","216.58.197.4","TCP","66","49253  >  443 [ACK] Seq=200599 Ack=4735 Win=1522 Len=0 TSval=510599 TSecr=372941514"
"392","2018-08-07 17:51:07.595449","192.168.2.3","216.58.197.4","TCP","1434","49253  >  443 [ACK] Seq=200599 Ack=4939 Win=1522 Len=1368 TSval=510602 TSecr=372941525 [TCP segment of a reassembled PDU]"
"393","2018-08-07 17:51:07.595885","192.168.2.3","216.58.197.4","TCP","1434","49253  >  443 [ACK] Seq=201967 Ack=4939 Win=1522 Len=1368 TSval=510602 TSecr=372941525 [TCP segment of a reassembled PDU]"
"394","2018-08-07 17:51:07.595887","192.168.2.3","216.58.197.4","TLSv1.2","212","Application Data"
"395","2018-08-07 17:51:07.596378","192.168.2.3","216.58.197.4","TLSv1.2","1355","Application Data"
"399","2018-08-07 17:51:07.712804","192.168.2.3","216.58.197.4","TCP","1434","49253  >  443 [ACK] Seq=204770 Ack=4939 Win=1522 Len=1368 TSval=510614 TSecr=372941562 [TCP segment of a reassembled PDU]"
"400","2018-08-07 17:51:07.713212","192.168.2.3","216.58.197.4","TCP","1434","49253  >  443 [ACK] Seq=206138 Ack=4939 Win=1522 Len=1368 TSval=510614 TSecr=372941562 [TCP segment of a reassembled PDU]"
"401","2018-08-07 17:51:07.713214","192.168.2.3","216.58.197.4","TLSv1.2","212","Application Data"
"402","2018-08-07 17:51:07.713215","192.168.2.3","216.58.197.4","TLSv1.2","980","Application Data"
"407","2018-08-07 17:51:07.806732","192.168.2.3","216.58.197.4","TCP","66","49253  >  443 [ACK] Seq=208566 Ack=5094 Win=1522 Len=0 TSval=510624 TSecr=372941727"
"408","2018-08-07 17:51:07.815626","192.168.2.3","216.58.197.4","TCP","1434","49253  >  443 [ACK] Seq=208566 Ack=5094 Win=1522 Len=1368 TSval=510624 TSecr=372941727 [TCP segment of a reassembled PDU]"
"409","2018-08-07 17:51:07.815875","192.168.2.3","216.58.197.4","TCP","1434","49253  >  443 [ACK] Seq=209934 Ack=5094 Win=1522 Len=1368 TSval=510624 TSecr=372941727 [TCP segment of a reassembled PDU]"
"410","2018-08-07 17:51:07.815877","192.168.2.3","216.58.197.4","TLSv1.2","212","Application Data"
"411","2018-08-07 17:51:07.816251","192.168.2.3","216.58.197.4","TCP","1434","49253  >  443 [ACK] Seq=211448 Ack=5094 Win=1522 Len=1368 TSval=510624 TSecr=372941727 [TCP segment of a reassembled PDU]"
"412","2018-08-07 17:51:07.816252","192.168.2.3","216.58.197.4","TLSv1.2","155","Application Data"
"418","2018-08-07 17:51:07.885684","192.168.2.3","216.58.197.4","TCP","66","49253  >  443 [ACK] Seq=212905 Ack=5536 Win=1522 Len=0 TSval=510631 TSecr=372941839"
"419","2018-08-07 17:51:07.921959","192.168.2.3","216.58.197.4","TCP","1434","49253  >  443 [ACK] Seq=212905 Ack=5536 Win=1522 Len=1368 TSval=510635 TSecr=372941839 [TCP segment of a reassembled PDU]"
"420","2018-08-07 17:51:07.922497","192.168.2.3","216.58.197.4","TCP","1434","49253  >  443 [ACK] Seq=214273 Ack=5536 Win=1522 Len=1368 TSval=510635 TSecr=372941839 [TCP segment of a reassembled PDU]"
"421","2018-08-07 17:51:07.922499","192.168.2.3","216.58.197.4","TLSv1.2","212","Application Data"
"422","2018-08-07 17:51:07.922500","192.168.2.3","216.58.197.4","TLSv1.2","1156","Application Data"
"426","2018-08-07 17:51:08.035868","192.168.2.3","216.58.197.4","TCP","1434","49253  >  443 [ACK] Seq=216877 Ack=5536 Win=1522 Len=1368 TSval=510646 TSecr=372941888 [TCP segment of a reassembled PDU]"
"427","2018-08-07 17:51:08.038659","192.168.2.3","216.58.197.4","TCP","1434","49253  >  443 [ACK] Seq=218245 Ack=5536 Win=1522 Len=1368 TSval=510646 TSecr=372941888 [TCP segment of a reassembled PDU]"
"428","2018-08-07 17:51:08.038662","192.168.2.3","216.58.197.4","TLSv1.2","212","Application Data"
"429","2018-08-07 17:51:08.038663","192.168.2.3","216.58.197.4","TLSv1.2","995","Application Data"
"434","2018-08-07 17:51:08.088023","192.168.2.3","216.58.197.4","TCP","66","49253  >  443 [ACK] Seq=220688 Ack=5846 Win=1522 Len=0 TSval=510652 TSecr=372942048"
"435","2018-08-07 17:51:08.135613","192.168.2.3","216.58.197.4","TCP","1434","49253  >  443 [ACK] Seq=220688 Ack=5846 Win=1522 Len=1368 TSval=510656 TSecr=372942048 [TCP segment of a reassembled PDU]"
"436","2018-08-07 17:51:08.135883","192.168.2.3","216.58.197.4","TCP","1434","49253  >  443 [ACK] Seq=222056 Ack=5846 Win=1522 Len=1368 TSval=510656 TSecr=372942048 [TCP segment of a reassembled PDU]"
"437","2018-08-07 17:51:08.135885","192.168.2.3","216.58.197.4","TLSv1.2","212","Application Data"
"438","2018-08-07 17:51:08.136054","192.168.2.3","216.58.197.4","TCP","1434","49253  >  443 [ACK] Seq=223570 Ack=5846 Win=1522 Len=1368 TSval=510656 TSecr=372942048 [TCP segment of a reassembled PDU]"
"439","2018-08-07 17:51:08.136056","192.168.2.3","216.58.197.4","TLSv1.2","155","Application Data"
"444","2018-08-07 17:51:08.190283","192.168.2.3","216.58.197.4","TCP","66","49253  >  443 [ACK] Seq=225027 Ack=6323 Win=1522 Len=0 TSval=510662 TSecr=372942146"
"445","2018-08-07 17:51:08.243355","192.168.2.3","216.58.197.4","TCP","1434","49253  >  443 [ACK] Seq=225027 Ack=6323 Win=1522 Len=1368 TSval=510667 TSecr=372942146 [TCP segment of a reassembled PDU]"
"446","2018-08-07 17:51:08.243530","192.168.2.3","216.58.197.4","TCP","1434","49253  >  443 [ACK] Seq=226395 Ack=6323 Win=1522 Len=1368 TSval=510667 TSecr=372942146 [TCP segment of a reassembled PDU]"
"447","2018-08-07 17:51:08.243532","192.168.2.3","216.58.197.4","TLSv1.2","212","Application Data"
"448","2018-08-07 17:51:08.243533","192.168.2.3","216.58.197.4","TLSv1.2","1169","Application Data"
"449","2018-08-07 17:51:08.243669","192.168.2.3","216.58.197.4","TLSv1.2","481","Application Data"
"450","2018-08-07 17:51:08.243672","192.168.2.3","216.58.197.4","TLSv1.2","102","Application Data"
"453","2018-08-07 17:51:08.274442","192.168.2.3","216.58.197.4","TCP","66","49253  >  443 [ACK] Seq=229463 Ack=6862 Win=1522 Len=0 TSval=510670 TSecr=372942234"
"455","2018-08-07 17:51:08.277273","192.168.2.3","216.58.197.4","TCP","66","49253  >  443 [ACK] Seq=229463 Ack=6939 Win=1522 Len=0 TSval=510670 TSecr=372942235"
"457","2018-08-07 17:51:08.501951","192.168.2.3","216.58.197.4","TCP","66","49253  >  443 [ACK] Seq=229463 Ack=7123 Win=1522 Len=0 TSval=510693 TSecr=372942462"
"460","2018-08-07 17:51:08.544844","192.168.2.3","216.58.197.4","TCP","66","49253  >  443 [ACK] Seq=229463 Ack=8654 Win=1522 Len=0 TSval=510697 TSecr=372942504"
"462","2018-08-07 17:51:08.554424","192.168.2.3","216.58.197.4","TCP","66","49253  >  443 [ACK] Seq=229463 Ack=8750 Win=1522 Len=0 TSval=510698 TSecr=372942514"
"464","2018-08-07 17:51:08.566025","192.168.2.3","216.58.197.4","TCP","66","49253  >  443 [ACK] Seq=229463 Ack=8972 Win=1522 Len=0 TSval=510699 TSecr=372942525"
"519","2018-08-07 17:51:08.748683","192.168.2.3","216.58.197.4","TCP","66","49253  >  443 [ACK] Seq=229463 Ack=10924 Win=1522 Len=0 TSval=510716 TSecr=372942690"
"520","2018-08-07 17:51:08.748702","192.168.2.3","216.58.197.4","TCP","66","49253  >  443 [ACK] Seq=229463 Ack=13760 Win=1522 Len=0 TSval=510716 TSecr=372942690"
"521","2018-08-07 17:51:08.748702","192.168.2.3","216.58.197.4","TCP","66","49253  >  443 [ACK] Seq=229463 Ack=17659 Win=1522 Len=0 TSval=510716 TSecr=372942690"
"522","2018-08-07 17:51:08.748703","192.168.2.3","216.58.197.4","TCP","66","49253  >  443 [ACK] Seq=229463 Ack=20862 Win=1522 Len=0 TSval=510716 TSecr=372942690"
"523","2018-08-07 17:51:08.748704","192.168.2.3","216.58.197.4","TCP","66","49253  >  443 [ACK] Seq=229463 Ack=21251 Win=1522 Len=0 TSval=510716 TSecr=372942691"
"524","2018-08-07 17:51:08.748705","192.168.2.3","216.58.197.4","TCP","66","49253  >  443 [ACK] Seq=229463 Ack=28327 Win=1522 Len=0 TSval=510717 TSecr=372942691"
"525","2018-08-07 17:51:08.748706","192.168.2.3","216.58.197.4","TCP","66","49253  >  443 [ACK] Seq=229463 Ack=39203 Win=1522 Len=0 TSval=510717 TSecr=372942692"
"526","2018-08-07 17:51:08.751870","192.168.2.3","216.58.197.4","TCP","66","49253  >  443 [ACK] Seq=229463 Ack=47448 Win=1522 Len=0 TSval=510718 TSecr=372942695"
"527","2018-08-07 17:51:08.755148","192.168.2.3","216.58.197.4","TCP","66","49253  >  443 [ACK] Seq=229463 Ack=57936 Win=1522 Len=0 TSval=510718 TSecr=372942696"
"528","2018-08-07 17:51:08.767881","192.168.2.3","216.58.197.4","TLSv1.2","104","Application Data"