"No.","Time","Source","Destination","Protocol","Length","Info"
"1","2018-08-07 17:31:56.144747","192.168.2.3","239.255.255.250","SSDP","136","M-SEARCH * HTTP/1.1 "
"2","2018-08-07 17:31:56.462753","192.168.2.3","172.217.27.163","TLSv1.2","135","Application Data"
"3","2018-08-07 17:31:56.462758","192.168.2.3","172.217.27.163","TLSv1.2","104","Application Data"
"6","2018-08-07 17:31:56.470888","192.168.2.3","172.217.27.163","TCP","66","38971  >  443 [ACK] Seq=108 Ack=117 Win=406 Len=0 TSval=395491 TSecr=466065515"
"7","2018-08-07 17:31:56.470895","192.168.2.3","172.217.27.163","TLSv1.2","100","Application Data"
"8","2018-08-07 17:31:56.470896","192.168.2.3","172.217.27.163","TLSv1.2","104","Application Data"
"10","2018-08-07 17:31:59.294871","192.168.2.3","8.8.8.8","DNS","75","Standard query 0x39af A time.google.com"
"11","2018-08-07 17:31:59.295183","192.168.2.3","8.8.8.8","DNS","75","Standard query 0x15d4 AAAA time.google.com"
"14","2018-08-07 17:31:59.341417","192.168.2.3","216.239.35.12","NTP","90","NTP Version 3, client"
"16","2018-08-07 17:32:05.074610","192.168.2.3","64.233.188.188","TCP","66","40306  >  5228 [ACK] Seq=1 Ack=1 Win=539 Len=0 TSval=396352 TSecr=3577213101"
"18","2018-08-07 17:32:08.465281","192.168.2.3","216.58.197.4","TLSv1.2","156","Application Data"
"19","2018-08-07 17:32:08.465286","192.168.2.3","216.58.197.4","TLSv1.2","104","Application Data"
"20","2018-08-07 17:32:08.465286","192.168.2.3","216.58.197.4","TLSv1.2","158","Application Data"
"21","2018-08-07 17:32:08.467769","192.168.2.3","216.58.197.4","TCP","1434","49253  >  443 [ACK] Seq=221 Ack=1 Win=998 Len=1368 TSval=396691 TSecr=371761024 [TCP segment of a reassembled PDU]"
"22","2018-08-07 17:32:08.468088","192.168.2.3","216.58.197.4","TCP","1434","49253  >  443 [ACK] Seq=1589 Ack=1 Win=998 Len=1368 TSval=396691 TSecr=371761024 [TCP segment of a reassembled PDU]"
"23","2018-08-07 17:32:08.468090","192.168.2.3","216.58.197.4","TLSv1.2","212","Application Data"
"24","2018-08-07 17:32:08.468487","192.168.2.3","216.58.197.4","TLSv1.2","1110","Application Data"
"25","2018-08-07 17:32:08.468494","192.168.2.3","216.58.197.4","TCP","1434","49253  >  443 [ACK] Seq=4147 Ack=1 Win=998 Len=1368 TSval=396691 TSecr=371761024 [TCP segment of a reassembled PDU]"
"26","2018-08-07 17:32:08.469044","192.168.2.3","216.58.197.4","TCP","1434","49253  >  443 [ACK] Seq=5515 Ack=1 Win=998 Len=1368 TSval=396691 TSecr=371761024 [TCP segment of a reassembled PDU]"
"27","2018-08-07 17:32:08.469047","192.168.2.3","216.58.197.4","TLSv1.2","212","Application Data"
"30","2018-08-07 17:32:08.471916","192.168.2.3","216.58.197.4","TCP","1434","49253  >  443 [ACK] Seq=7029 Ack=1 Win=998 Len=1368 TSval=396691 TSecr=371802428 [TCP segment of a reassembled PDU]"
"31","2018-08-07 17:32:08.472217","192.168.2.3","216.58.197.4","TLSv1.2","1434","Application Data [TCP segment of a reassembled PDU]"
"33","2018-08-07 17:32:08.472517","192.168.2.3","216.58.197.4","TCP","1434","49253  >  443 [ACK] Seq=9765 Ack=1 Win=998 Len=1368 TSval=396691 TSecr=371802428 [TCP segment of a reassembled PDU]"
"38","2018-08-07 17:32:08.479550","192.168.2.3","216.58.197.4","TLSv1.2","1434","Application Data [TCP segment of a reassembled PDU]"
"39","2018-08-07 17:32:08.479557","192.168.2.3","216.58.197.4","TLSv1.2","1434","Application Data [TCP segment of a reassembled PDU]"
"40","2018-08-07 17:32:08.479890","192.168.2.3","216.58.197.4","TCP","1434","49253  >  443 [ACK] Seq=13869 Ack=39 Win=998 Len=1368 TSval=396691 TSecr=371802428 [TCP segment of a reassembled PDU]"
"41","2018-08-07 17:32:08.480569","192.168.2.3","216.58.197.4","TLSv1.2","1434","Application Data [TCP segment of a reassembled PDU]"
"42","2018-08-07 17:32:08.480572","192.168.2.3","216.58.197.4","TLSv1.2","1434","Application Data [TCP segment of a reassembled PDU]"
"43","2018-08-07 17:32:08.480693","192.168.2.3","216.58.197.4","TCP","1434","49253  >  443 [ACK] Seq=17973 Ack=39 Win=998 Len=1368 TSval=396692 TSecr=371802430 [TCP segment of a reassembled PDU]"
"44","2018-08-07 17:32:08.481291","192.168.2.3","216.58.197.4","TLSv1.2","1434","Application Data [TCP segment of a reassembled PDU]"
"45","2018-08-07 17:32:08.481294","192.168.2.3","216.58.197.4","TLSv1.2","1434","Application Data [TCP segment of a reassembled PDU]"
"46","2018-08-07 17:32:08.481505","192.168.2.3","216.58.197.4","TCP","1434","49253  >  443 [ACK] Seq=22077 Ack=39 Win=998 Len=1368 TSval=396692 TSecr=371802431 [TCP segment of a reassembled PDU]"
"47","2018-08-07 17:32:08.482088","192.168.2.3","216.58.197.4","TLSv1.2","1434","Application Data [TCP segment of a reassembled PDU]"
"48","2018-08-07 17:32:08.482091","192.168.2.3","216.58.197.4","TLSv1.2","1434","Application Data [TCP segment of a reassembled PDU]"
"49","2018-08-07 17:32:08.482210","192.168.2.3","216.58.197.4","TCP","1434","49253  >  443 [ACK] Seq=26181 Ack=39 Win=998 Len=1368 TSval=396692 TSecr=371802431 [TCP segment of a reassembled PDU]"
"52","2018-08-07 17:32:08.484888","192.168.2.3","216.58.197.4","TLSv1.2","1434","Application Data [TCP segment of a reassembled PDU]"
"53","2018-08-07 17:32:08.485385","192.168.2.3","216.58.197.4","TCP","1434","49253  >  443 [ACK] Seq=28917 Ack=39 Win=998 Len=1368 TSval=396692 TSecr=371802434 [TCP segment of a reassembled PDU]"
"54","2018-08-07 17:32:08.485387","192.168.2.3","216.58.197.4","TLSv1.2","1434","Application Data [TCP segment of a reassembled PDU]"
"57","2018-08-07 17:32:08.486185","192.168.2.3","216.58.197.4","TCP","1434","49253  >  443 [ACK] Seq=31653 Ack=39 Win=998 Len=1368 TSval=396693 TSecr=371802442 [TCP segment of a reassembled PDU]"
"58","2018-08-07 17:32:08.486187","192.168.2.3","216.58.197.4","TCP","1434","49253  >  443 [ACK] Seq=33021 Ack=39 Win=998 Len=1368 TSval=396693 TSecr=371802442 [TCP segment of a reassembled PDU]"
"59","2018-08-07 17:32:08.486571","192.168.2.3","216.58.197.4","TLSv1.2","1434","Application Data [TCP segment of a reassembled PDU]"
"60","2018-08-07 17:32:08.486871","192.168.2.3","216.58.197.4","TCP","1434","49253  >  443 [ACK] Seq=35757 Ack=39 Win=998 Len=1368 TSval=396693 TSecr=371802442 [TCP segment of a reassembled PDU]"
"61","2018-08-07 17:32:08.486872","192.168.2.3","216.58.197.4","TLSv1.2","1434","Application Data [TCP segment of a reassembled PDU]"
"64","2018-08-07 17:32:08.486949","192.168.2.3","216.58.197.4","TCP","1434","49253  >  443 [ACK] Seq=38493 Ack=39 Win=998 Len=1368 TSval=396693 TSecr=371802442 [TCP segment of a reassembled PDU]"
"65","2018-08-07 17:32:08.487204","192.168.2.3","216.58.197.4","TLSv1.2","1434","Application Data [TCP segment of a reassembled PDU]"
"66","2018-08-07 17:32:08.487962","192.168.2.3","216.58.197.4","TLSv1.2","1434","Application Data [TCP segment of a reassembled PDU]"
"67","2018-08-07 17:32:08.487965","192.168.2.3","216.58.197.4","TCP","1434","49253  >  443 [ACK] Seq=42597 Ack=39 Win=998 Len=1368 TSval=396693 TSecr=371802443 [TCP segment of a reassembled PDU]"
"68","2018-08-07 17:32:08.488158","192.168.2.3","216.58.197.4","TLSv1.2","1434","Application Data [TCP segment of a reassembled PDU]"
"69","2018-08-07 17:32:08.489898","192.168.2.3","216.58.197.4","TCP","1434","49253  >  443 [ACK] Seq=45333 Ack=39 Win=998 Len=1368 TSval=396693 TSecr=371802443 [TCP segment of a reassembled PDU]"
"70","2018-08-07 17:32:08.489900","192.168.2.3","216.58.197.4","TCP","1434","49253  >  443 [ACK] Seq=46701 Ack=39 Win=998 Len=1368 TSval=396693 TSecr=371802443 [TCP segment of a reassembled PDU]"
"71","2018-08-07 17:32:08.489901","192.168.2.3","216.58.197.4","TLSv1.2","1434","Application Data [TCP segment of a reassembled PDU]"
"73","2018-08-07 17:32:08.490253","192.168.2.3","216.58.197.4","TCP","1434","49253  >  443 [ACK] Seq=49437 Ack=39 Win=998 Len=1368 TSval=396693 TSecr=371802444 [TCP segment of a reassembled PDU]"
"74","2018-08-07 17:32:08.490568","192.168.2.3","216.58.197.4","TLSv1.2","1434","Application Data [TCP segment of a reassembled PDU]"
"77","2018-08-07 17:32:08.491350","192.168.2.3","216.58.197.4","TCP","1434","49253  >  443 [ACK] Seq=52173 Ack=39 Win=998 Len=1368 TSval=396693 TSecr=371802444 [TCP segment of a reassembled PDU]"
"78","2018-08-07 17:32:08.491352","192.168.2.3","216.58.197.4","TLSv1.2","1434","Application Data [TCP segment of a reassembled PDU]"
"79","2018-08-07 17:32:08.491823","192.168.2.3","216.58.197.4","TCP","1434","49253  >  443 [ACK] Seq=54909 Ack=39 Win=998 Len=1368 TSval=396693 TSecr=371802447 [TCP segment of a reassembled PDU]"
"81","2018-08-07 17:32:08.492263","192.168.2.3","216.58.197.4","TLSv1.2","1434","Application Data [TCP segment of a reassembled PDU]"
"87","2018-08-07 17:32:08.497126","192.168.2.3","216.58.197.4","TLSv1.2","1434","Application Data [TCP segment of a reassembled PDU]"
"88","2018-08-07 17:32:08.497129","192.168.2.3","216.58.197.4","TLSv1.2","312","Application Data"
"92","2018-08-07 17:32:08.546346","192.168.2.3","216.58.197.4","TCP","1434","49253  >  443 [ACK] Seq=59259 Ack=39 Win=998 Len=1368 TSval=396698 TSecr=371802459 [TCP segment of a reassembled PDU]"
"93","2018-08-07 17:32:08.546351","192.168.2.3","216.58.197.4","TCP","1434","49253  >  443 [ACK] Seq=60627 Ack=39 Win=998 Len=1368 TSval=396698 TSecr=371802459 [TCP segment of a reassembled PDU]"
"94","2018-08-07 17:32:08.546352","192.168.2.3","216.58.197.4","TLSv1.2","212","Application Data"
"95","2018-08-07 17:32:08.546719","192.168.2.3","216.58.197.4","TCP","1434","49253  >  443 [ACK] Seq=62141 Ack=39 Win=998 Len=1368 TSval=396698 TSecr=371802459 [TCP segment of a reassembled PDU]"
"96","2018-08-07 17:32:08.546721","192.168.2.3","216.58.197.4","TLSv1.2","155","Application Data"
"99","2018-08-07 17:32:08.660577","192.168.2.3","216.58.197.4","TCP","1434","49253  >  443 [ACK] Seq=63598 Ack=39 Win=998 Len=1368 TSval=396710 TSecr=371802509 [TCP segment of a reassembled PDU]"
"100","2018-08-07 17:32:08.660937","192.168.2.3","216.58.197.4","TCP","1434","49253  >  443 [ACK] Seq=64966 Ack=39 Win=998 Len=1368 TSval=396710 TSecr=371802509 [TCP segment of a reassembled PDU]"
"101","2018-08-07 17:32:08.660940","192.168.2.3","216.58.197.4","TLSv1.2","212","Application Data"
"102","2018-08-07 17:32:08.661368","192.168.2.3","216.58.197.4","TLSv1.2","1276","Application Data"
"105","2018-08-07 17:32:08.763362","192.168.2.3","216.58.197.4","TCP","1434","49253  >  443 [ACK] Seq=67690 Ack=39 Win=998 Len=1368 TSval=396720 TSecr=371802623 [TCP segment of a reassembled PDU]"
"106","2018-08-07 17:32:08.763631","192.168.2.3","216.58.197.4","TCP","1434","49253  >  443 [ACK] Seq=69058 Ack=39 Win=998 Len=1368 TSval=396720 TSecr=371802623 [TCP segment of a reassembled PDU]"
"107","2018-08-07 17:32:08.763633","192.168.2.3","216.58.197.4","TLSv1.2","212","Application Data"
"108","2018-08-07 17:32:08.763851","192.168.2.3","216.58.197.4","TCP","1434","49253  >  443 [ACK] Seq=70572 Ack=39 Win=998 Len=1368 TSval=396720 TSecr=371802623 [TCP segment of a reassembled PDU]"
"109","2018-08-07 17:32:08.763853","192.168.2.3","216.58.197.4","TLSv1.2","155","Application Data"
"113","2018-08-07 17:32:08.863623","192.168.2.3","216.58.197.4","TCP","1434","49253  >  443 [ACK] Seq=72029 Ack=39 Win=998 Len=1368 TSval=396730 TSecr=371802766 [TCP segment of a reassembled PDU]"
"114","2018-08-07 17:32:08.863918","192.168.2.3","216.58.197.4","TCP","1434","49253  >  443 [ACK] Seq=73397 Ack=39 Win=998 Len=1368 TSval=396730 TSecr=371802766 [TCP segment of a reassembled PDU]"
"115","2018-08-07 17:32:08.863920","192.168.2.3","216.58.197.4","TLSv1.2","212","Application Data"
"116","2018-08-07 17:32:08.864320","192.168.2.3","216.58.197.4","TLSv1.2","1063","Application Data"
"123","2018-08-07 17:32:08.977120","192.168.2.3","216.58.197.4","TCP","66","49253  >  443 [ACK] Seq=75908 Ack=496 Win=998 Len=0 TSval=396742 TSecr=371802931"
"124","2018-08-07 17:32:08.982918","192.168.2.3","216.58.197.4","TCP","1434","49253  >  443 [ACK] Seq=75908 Ack=496 Win=998 Len=1368 TSval=396742 TSecr=371802931 [TCP segment of a reassembled PDU]"
"125","2018-08-07 17:32:08.987861","192.168.2.3","216.58.197.4","TCP","1434","49253  >  443 [ACK] Seq=77276 Ack=496 Win=998 Len=1368 TSval=396742 TSecr=371802931 [TCP segment of a reassembled PDU]"
"126","2018-08-07 17:32:08.987867","192.168.2.3","216.58.197.4","TLSv1.2","212","Application Data"
"127","2018-08-07 17:32:08.987868","192.168.2.3","216.58.197.4","TLSv1.2","665","Application Data"
"130","2018-08-07 17:32:09.029170","192.168.2.3","216.58.197.4","TCP","66","49253  >  443 [ACK] Seq=79389 Ack=773 Win=998 Len=0 TSval=396747 TSecr=371802948"
"132","2018-08-07 17:32:09.083378","192.168.2.3","216.58.197.4","TCP","1434","49253  >  443 [ACK] Seq=79389 Ack=773 Win=998 Len=1368 TSval=396752 TSecr=371802990 [TCP segment of a reassembled PDU]"
"133","2018-08-07 17:32:09.083829","192.168.2.3","216.58.197.4","TCP","1434","49253  >  443 [ACK] Seq=80757 Ack=773 Win=998 Len=1368 TSval=396752 TSecr=371802990 [TCP segment of a reassembled PDU]"
"134","2018-08-07 17:32:09.083832","192.168.2.3","216.58.197.4","TLSv1.2","212","Application Data"
"135","2018-08-07 17:32:09.083833","192.168.2.3","216.58.197.4","TLSv1.2","873","Application Data"
"139","2018-08-07 17:32:09.155062","192.168.2.3","216.58.197.4","TCP","66","49253  >  443 [ACK] Seq=83078 Ack=1058 Win=998 Len=0 TSval=396760 TSecr=371803069"
"140","2018-08-07 17:32:09.187812","192.168.2.3","216.58.197.4","TCP","1434","49253  >  443 [ACK] Seq=83078 Ack=1058 Win=998 Len=1368 TSval=396763 TSecr=371803069 [TCP segment of a reassembled PDU]"
"141","2018-08-07 17:32:09.188103","192.168.2.3","216.58.197.4","TCP","1434","49253  >  443 [ACK] Seq=84446 Ack=1058 Win=998 Len=1368 TSval=396763 TSecr=371803069 [TCP segment of a reassembled PDU]"
"142","2018-08-07 17:32:09.188107","192.168.2.3","216.58.197.4","TLSv1.2","212","Application Data"
"143","2018-08-07 17:32:09.188255","192.168.2.3","216.58.197.4","TLSv1.2","885","Application Data"
"147","2018-08-07 17:32:09.285252","192.168.2.3","216.58.197.4","TCP","66","49253  >  443 [ACK] Seq=86779 Ack=1635 Win=998 Len=0 TSval=396773 TSecr=371803221"
"148","2018-08-07 17:32:09.300891","192.168.2.3","216.58.197.4","TCP","1434","49253  >  443 [ACK] Seq=86779 Ack=1635 Win=998 Len=1368 TSval=396774 TSecr=371803221 [TCP segment of a reassembled PDU]"
"149","2018-08-07 17:32:09.301227","192.168.2.3","216.58.197.4","TCP","1434","49253  >  443 [ACK] Seq=88147 Ack=1635 Win=998 Len=1368 TSval=396774 TSecr=371803221 [TCP segment of a reassembled PDU]"
"150","2018-08-07 17:32:09.301229","192.168.2.3","216.58.197.4","TLSv1.2","212","Application Data"
"151","2018-08-07 17:32:09.301229","192.168.2.3","216.58.197.4","TLSv1.2","547","Application Data"
"154","2018-08-07 17:32:09.403298","192.168.2.3","216.58.197.4","TCP","1434","49253  >  443 [ACK] Seq=90142 Ack=1635 Win=998 Len=1368 TSval=396784 TSecr=371803263 [TCP segment of a reassembled PDU]"
"155","2018-08-07 17:32:09.403668","192.168.2.3","216.58.197.4","TCP","1434","49253  >  443 [ACK] Seq=91510 Ack=1635 Win=998 Len=1368 TSval=396784 TSecr=371803263 [TCP segment of a reassembled PDU]"
"156","2018-08-07 17:32:09.403671","192.168.2.3","216.58.197.4","TLSv1.2","212","Application Data"
"157","2018-08-07 17:32:09.403975","192.168.2.3","216.58.197.4","TLSv1.2","1234","Application Data"
"160","2018-08-07 17:32:09.504238","192.168.2.3","216.58.197.4","TCP","1434","49253  >  443 [ACK] Seq=94192 Ack=1635 Win=998 Len=1368 TSval=396794 TSecr=371803366 [TCP segment of a reassembled PDU]"
"161","2018-08-07 17:32:09.504259","192.168.2.3","216.58.197.4","TCP","1434","49253  >  443 [ACK] Seq=95560 Ack=1635 Win=998 Len=1368 TSval=396794 TSecr=371803366 [TCP segment of a reassembled PDU]"
"162","2018-08-07 17:32:09.504260","192.168.2.3","216.58.197.4","TLSv1.2","212","Application Data"
"163","2018-08-07 17:32:09.504326","192.168.2.3","216.58.197.4","TLSv1.2","517","Application Data"
"165","2018-08-07 17:32:09.621109","192.168.2.3","216.58.197.4","TCP","1434","49253  >  443 [ACK] Seq=97525 Ack=1635 Win=998 Len=1368 TSval=396806 TSecr=371803467 [TCP segment of a reassembled PDU]"
"166","2018-08-07 17:32:09.621513","192.168.2.3","216.58.197.4","TCP","1434","49253  >  443 [ACK] Seq=98893 Ack=1635 Win=998 Len=1368 TSval=396806 TSecr=371803467 [TCP segment of a reassembled PDU]"
"167","2018-08-07 17:32:09.621515","192.168.2.3","216.58.197.4","TLSv1.2","212","Application Data"
"168","2018-08-07 17:32:09.621516","192.168.2.3","216.58.197.4","TLSv1.2","1124","Application Data"
"171","2018-08-07 17:32:09.723567","192.168.2.3","216.58.197.4","TCP","1434","49253  >  443 [ACK] Seq=101465 Ack=1635 Win=998 Len=1368 TSval=396816 TSecr=371803584 [TCP segment of a reassembled PDU]"
"172","2018-08-07 17:32:09.723975","192.168.2.3","216.58.197.4","TCP","1434","49253  >  443 [ACK] Seq=102833 Ack=1635 Win=998 Len=1368 TSval=396816 TSecr=371803584 [TCP segment of a reassembled PDU]"
"173","2018-08-07 17:32:09.723977","192.168.2.3","216.58.197.4","TLSv1.2","212","Application Data"
"174","2018-08-07 17:32:09.724118","192.168.2.3","216.58.197.4","TLSv1.2","992","Application Data"
"177","2018-08-07 17:32:09.824093","192.168.2.3","216.58.197.4","TCP","1434","49253  >  443 [ACK] Seq=105273 Ack=1635 Win=998 Len=1368 TSval=396826 TSecr=371803686 [TCP segment of a reassembled PDU]"
"178","2018-08-07 17:32:09.824346","192.168.2.3","216.58.197.4","TCP","1434","49253  >  443 [ACK] Seq=106641 Ack=1635 Win=998 Len=1368 TSval=396826 TSecr=371803686 [TCP segment of a reassembled PDU]"
"179","2018-08-07 17:32:09.824348","192.168.2.3","216.58.197.4","TLSv1.2","212","Application Data"
"180","2018-08-07 17:32:09.824527","192.168.2.3","216.58.197.4","TCP","1434","49253  >  443 [ACK] Seq=108155 Ack=1635 Win=998 Len=1368 TSval=396826 TSecr=371803686 [TCP segment of a reassembled PDU]"
"181","2018-08-07 17:32:09.824528","192.168.2.3","216.58.197.4","TLSv1.2","155","Application Data"
"185","2018-08-07 17:32:09.916254","192.168.2.3","216.58.197.4","TCP","1434","49253  >  443 [ACK] Seq=109612 Ack=1635 Win=998 Len=1368 TSval=396836 TSecr=371803827 [TCP segment of a reassembled PDU]"
"186","2018-08-07 17:32:09.916357","192.168.2.3","216.58.197.4","TCP","1434","49253  >  443 [ACK] Seq=110980 Ack=1635 Win=998 Len=1368 TSval=396836 TSecr=371803827 [TCP segment of a reassembled PDU]"
"187","2018-08-07 17:32:09.916358","192.168.2.3","216.58.197.4","TLSv1.2","212","Application Data"
"188","2018-08-07 17:32:09.916674","192.168.2.3","216.58.197.4","TCP","1434","49253  >  443 [ACK] Seq=112494 Ack=1635 Win=998 Len=1368 TSval=396836 TSecr=371803827 [TCP segment of a reassembled PDU]"
"189","2018-08-07 17:32:09.916677","192.168.2.3","216.58.197.4","TLSv1.2","155","Application Data"
"194","2018-08-07 17:32:09.991502","192.168.2.3","216.58.197.4","TCP","66","49253  >  443 [ACK] Seq=113951 Ack=1976 Win=998 Len=0 TSval=396843 TSecr=371803931"
"195","2018-08-07 17:32:10.011662","192.168.2.3","216.58.197.4","TCP","1434","49253  >  443 [ACK] Seq=113951 Ack=1976 Win=998 Len=1368 TSval=396845 TSecr=371803931 [TCP segment of a reassembled PDU]"
"196","2018-08-07 17:32:10.011886","192.168.2.3","216.58.197.4","TCP","1434","49253  >  443 [ACK] Seq=115319 Ack=1976 Win=998 Len=1368 TSval=396845 TSecr=371803931 [TCP segment of a reassembled PDU]"
"197","2018-08-07 17:32:10.011889","192.168.2.3","216.58.197.4","TLSv1.2","212","Application Data"
"198","2018-08-07 17:32:10.012286","192.168.2.3","216.58.197.4","TCP","1434","49253  >  443 [ACK] Seq=116833 Ack=1976 Win=998 Len=1368 TSval=396845 TSecr=371803931 [TCP segment of a reassembled PDU]"
"199","2018-08-07 17:32:10.012289","192.168.2.3","216.58.197.4","TLSv1.2","155","Application Data"
"203","2018-08-07 17:32:10.115011","192.168.2.3","216.58.197.4","TCP","1434","49253  >  443 [ACK] Seq=118290 Ack=1976 Win=998 Len=1368 TSval=396855 TSecr=371803974 [TCP segment of a reassembled PDU]"
"204","2018-08-07 17:32:10.118312","192.168.2.3","216.58.197.4","TCP","1434","49253  >  443 [ACK] Seq=119658 Ack=1976 Win=998 Len=1368 TSval=396855 TSecr=371803974 [TCP segment of a reassembled PDU]"
"205","2018-08-07 17:32:10.118317","192.168.2.3","216.58.197.4","TLSv1.2","212","Application Data"
"206","2018-08-07 17:32:10.118317","192.168.2.3","216.58.197.4","TCP","1434","49253  >  443 [ACK] Seq=121172 Ack=1976 Win=998 Len=1368 TSval=396855 TSecr=371803974 [TCP segment of a reassembled PDU]"
"207","2018-08-07 17:32:10.118534","192.168.2.3","216.58.197.4","TLSv1.2","155","Application Data"
"210","2018-08-07 17:32:10.211136","192.168.2.3","216.58.197.4","TCP","1434","49253  >  443 [ACK] Seq=122629 Ack=1976 Win=998 Len=1368 TSval=396865 TSecr=371804080 [TCP segment of a reassembled PDU]"
"211","2018-08-07 17:32:10.211449","192.168.2.3","216.58.197.4","TCP","1434","49253  >  443 [ACK] Seq=123997 Ack=1976 Win=998 Len=1368 TSval=396865 TSecr=371804080 [TCP segment of a reassembled PDU]"
"212","2018-08-07 17:32:10.211451","192.168.2.3","216.58.197.4","TLSv1.2","212","Application Data"
"213","2018-08-07 17:32:10.211452","192.168.2.3","216.58.197.4","TCP","1434","49253  >  443 [ACK] Seq=125511 Ack=1976 Win=998 Len=1368 TSval=396865 TSecr=371804080 [TCP segment of a reassembled PDU]"
"214","2018-08-07 17:32:10.211643","192.168.2.3","216.58.197.4","TLSv1.2","155","Application Data"
"220","2018-08-07 17:32:10.282857","192.168.2.3","216.58.197.4","TCP","66","49253  >  443 [ACK] Seq=126968 Ack=2313 Win=998 Len=0 TSval=396872 TSecr=371804239"
"221","2018-08-07 17:32:10.306029","192.168.2.3","216.58.197.4","TCP","1434","49253  >  443 [ACK] Seq=126968 Ack=2313 Win=998 Len=1368 TSval=396874 TSecr=371804239 [TCP segment of a reassembled PDU]"
"222","2018-08-07 17:32:10.306031","192.168.2.3","216.58.197.4","TCP","1434","49253  >  443 [ACK] Seq=128336 Ack=2313 Win=998 Len=1368 TSval=396874 TSecr=371804239 [TCP segment of a reassembled PDU]"
"223","2018-08-07 17:32:10.306195","192.168.2.3","216.58.197.4","TLSv1.2","212","Application Data"
"224","2018-08-07 17:32:10.306356","192.168.2.3","216.58.197.4","TCP","1434","49253  >  443 [ACK] Seq=129850 Ack=2313 Win=998 Len=1368 TSval=396874 TSecr=371804239 [TCP segment of a reassembled PDU]"
"225","2018-08-07 17:32:10.306357","192.168.2.3","216.58.197.4","TLSv1.2","155","Application Data"
"228","2018-08-07 17:32:10.424794","192.168.2.3","216.58.197.4","TCP","1434","49253  >  443 [ACK] Seq=131307 Ack=2313 Win=998 Len=1368 TSval=396886 TSecr=371804268 [TCP segment of a reassembled PDU]"
"229","2018-08-07 17:32:10.424922","192.168.2.3","216.58.197.4","TCP","1434","49253  >  443 [ACK] Seq=132675 Ack=2313 Win=998 Len=1368 TSval=396886 TSecr=371804268 [TCP segment of a reassembled PDU]"
"230","2018-08-07 17:32:10.424923","192.168.2.3","216.58.197.4","TLSv1.2","212","Application Data"
"231","2018-08-07 17:32:10.425091","192.168.2.3","216.58.197.4","TCP","1434","49253  >  443 [ACK] Seq=134189 Ack=2313 Win=998 Len=1368 TSval=396886 TSecr=371804268 [TCP segment of a reassembled PDU]"
"232","2018-08-07 17:32:10.425092","192.168.2.3","216.58.197.4","TLSv1.2","155","Application Data"
"238","2018-08-07 17:32:10.485585","192.168.2.3","216.58.197.4","TCP","66","49253  >  443 [ACK] Seq=135646 Ack=2595 Win=998 Len=0 TSval=396893 TSecr=371804441"
"239","2018-08-07 17:32:10.520774","192.168.2.3","216.58.197.4","TCP","1434","49253  >  443 [ACK] Seq=135646 Ack=2595 Win=998 Len=1368 TSval=396896 TSecr=371804441 [TCP segment of a reassembled PDU]"
"240","2018-08-07 17:32:10.523879","192.168.2.3","216.58.197.4","TCP","1434","49253  >  443 [ACK] Seq=137014 Ack=2595 Win=998 Len=1368 TSval=396896 TSecr=371804441 [TCP segment of a reassembled PDU]"
"241","2018-08-07 17:32:10.523883","192.168.2.3","216.58.197.4","TLSv1.2","212","Application Data"
"242","2018-08-07 17:32:10.523884","192.168.2.3","216.58.197.4","TCP","1434","49253  >  443 [ACK] Seq=138528 Ack=2595 Win=998 Len=1368 TSval=396896 TSecr=371804441 [TCP segment of a reassembled PDU]"
"243","2018-08-07 17:32:10.524052","192.168.2.3","216.58.197.4","TLSv1.2","155","Application Data"
"247","2018-08-07 17:32:10.631888","192.168.2.3","216.58.197.4","TCP","1434","49253  >  443 [ACK] Seq=139985 Ack=2595 Win=998 Len=1368 TSval=396907 TSecr=371804486 [TCP segment of a reassembled PDU]"
"248","2018-08-07 17:32:10.632070","192.168.2.3","216.58.197.4","TCP","1434","49253  >  443 [ACK] Seq=141353 Ack=2595 Win=998 Len=1368 TSval=396907 TSecr=371804486 [TCP segment of a reassembled PDU]"
"249","2018-08-07 17:32:10.632072","192.168.2.3","216.58.197.4","TLSv1.2","212","Application Data"
"250","2018-08-07 17:32:10.632307","192.168.2.3","216.58.197.4","TCP","1434","49253  >  443 [ACK] Seq=142867 Ack=2595 Win=998 Len=1368 TSval=396907 TSecr=371804486 [TCP segment of a reassembled PDU]"
"251","2018-08-07 17:32:10.632309","192.168.2.3","216.58.197.4","TLSv1.2","155","Application Data"
"256","2018-08-07 17:32:10.701087","192.168.2.3","216.58.197.4","TCP","66","49253  >  443 [ACK] Seq=144324 Ack=2976 Win=998 Len=0 TSval=396914 TSecr=371804657"
"257","2018-08-07 17:32:10.718377","192.168.2.3","216.58.197.4","TCP","1434","49253  >  443 [ACK] Seq=144324 Ack=2976 Win=998 Len=1368 TSval=396916 TSecr=371804657 [TCP segment of a reassembled PDU]"
"258","2018-08-07 17:32:10.718385","192.168.2.3","216.58.197.4","TCP","1434","49253  >  443 [ACK] Seq=145692 Ack=2976 Win=998 Len=1368 TSval=396916 TSecr=371804657 [TCP segment of a reassembled PDU]"
"259","2018-08-07 17:32:10.718387","192.168.2.3","216.58.197.4","TLSv1.2","212","Application Data"
"260","2018-08-07 17:32:10.718483","192.168.2.3","216.58.197.4","TCP","1434","49253  >  443 [ACK] Seq=147206 Ack=2976 Win=998 Len=1368 TSval=396916 TSecr=371804657 [TCP segment of a reassembled PDU]"
"261","2018-08-07 17:32:10.718844","192.168.2.3","216.58.197.4","TLSv1.2","155","Application Data"
"267","2018-08-07 17:32:10.779333","192.168.2.3","216.58.197.4","TCP","66","49253  >  443 [ACK] Seq=148663 Ack=3343 Win=998 Len=0 TSval=396922 TSecr=371804735"
"268","2018-08-07 17:32:10.821227","192.168.2.3","216.58.197.4","TCP","1434","49253  >  443 [ACK] Seq=148663 Ack=3343 Win=998 Len=1368 TSval=396926 TSecr=371804735 [TCP segment of a reassembled PDU]"
"269","2018-08-07 17:32:10.821436","192.168.2.3","216.58.197.4","TCP","1434","49253  >  443 [ACK] Seq=150031 Ack=3343 Win=998 Len=1368 TSval=396926 TSecr=371804735 [TCP segment of a reassembled PDU]"
"270","2018-08-07 17:32:10.821439","192.168.2.3","216.58.197.4","TLSv1.2","212","Application Data"
"271","2018-08-07 17:32:10.821652","192.168.2.3","216.58.197.4","TCP","1434","49253  >  443 [ACK] Seq=151545 Ack=3343 Win=998 Len=1368 TSval=396926 TSecr=371804735 [TCP segment of a reassembled PDU]"
"272","2018-08-07 17:32:10.821655","192.168.2.3","216.58.197.4","TLSv1.2","155","Application Data"
"276","2018-08-07 17:32:10.936684","192.168.2.3","216.58.197.4","TCP","1434","49253  >  443 [ACK] Seq=153002 Ack=3343 Win=998 Len=1368 TSval=396938 TSecr=371804784 [TCP segment of a reassembled PDU]"
"277","2018-08-07 17:32:10.936869","192.168.2.3","216.58.197.4","TCP","1434","49253  >  443 [ACK] Seq=154370 Ack=3343 Win=998 Len=1368 TSval=396938 TSecr=371804784 [TCP segment of a reassembled PDU]"
"278","2018-08-07 17:32:10.936874","192.168.2.3","216.58.197.4","TLSv1.2","212","Application Data"
"279","2018-08-07 17:32:10.937172","192.168.2.3","216.58.197.4","TCP","1434","49253  >  443 [ACK] Seq=155884 Ack=3343 Win=998 Len=1368 TSval=396938 TSecr=371804784 [TCP segment of a reassembled PDU]"
"280","2018-08-07 17:32:10.937174","192.168.2.3","216.58.197.4","TLSv1.2","155","Application Data"
"286","2018-08-07 17:32:10.992392","192.168.2.3","216.58.197.4","TCP","66","49253  >  443 [ACK] Seq=157341 Ack=3629 Win=998 Len=0 TSval=396943 TSecr=371804932"
"287","2018-08-07 17:32:11.003862","192.168.2.3","216.58.197.4","TCP","1434","49253  >  443 [ACK] Seq=157341 Ack=3629 Win=998 Len=1368 TSval=396944 TSecr=371804932 [TCP segment of a reassembled PDU]"
"288","2018-08-07 17:32:11.003978","192.168.2.3","216.58.197.4","TCP","1434","49253  >  443 [ACK] Seq=158709 Ack=3629 Win=998 Len=1368 TSval=396944 TSecr=371804932 [TCP segment of a reassembled PDU]"
"289","2018-08-07 17:32:11.003980","192.168.2.3","216.58.197.4","TLSv1.2","212","Application Data"
"290","2018-08-07 17:32:11.004280","192.168.2.3","216.58.197.4","TCP","1434","49253  >  443 [ACK] Seq=160223 Ack=3629 Win=998 Len=1368 TSval=396944 TSecr=371804932 [TCP segment of a reassembled PDU]"
"291","2018-08-07 17:32:11.004283","192.168.2.3","216.58.197.4","TLSv1.2","155","Application Data"
"297","2018-08-07 17:32:11.064197","192.168.2.3","216.58.197.4","TCP","66","49253  >  443 [ACK] Seq=161680 Ack=4086 Win=998 Len=0 TSval=396950 TSecr=371805020"
"300","2018-08-07 17:32:11.074016","192.168.2.3","216.58.197.4","TCP","66","49253  >  443 [ACK] Seq=161680 Ack=4420 Win=998 Len=0 TSval=396951 TSecr=371805029"
"301","2018-08-07 17:32:11.107840","192.168.2.3","216.58.197.4","TCP","1434","49253  >  443 [ACK] Seq=161680 Ack=4420 Win=998 Len=1368 TSval=396955 TSecr=371805029 [TCP segment of a reassembled PDU]"
"302","2018-08-07 17:32:11.107847","192.168.2.3","216.58.197.4","TCP","1434","49253  >  443 [ACK] Seq=163048 Ack=4420 Win=998 Len=1368 TSval=396955 TSecr=371805029 [TCP segment of a reassembled PDU]"
"303","2018-08-07 17:32:11.107848","192.168.2.3","216.58.197.4","TLSv1.2","212","Application Data"
"304","2018-08-07 17:32:11.108289","192.168.2.3","216.58.197.4","TCP","1434","49253  >  443 [ACK] Seq=164562 Ack=4420 Win=998 Len=1368 TSval=396955 TSecr=371805029 [TCP segment of a reassembled PDU]"
"305","2018-08-07 17:32:11.108290","192.168.2.3","216.58.197.4","TLSv1.2","155","Application Data"
"311","2018-08-07 17:32:11.187442","192.168.2.3","216.58.197.4","TCP","66","49253  >  443 [ACK] Seq=166019 Ack=4659 Win=998 Len=0 TSval=396963 TSecr=371805140"
"312","2018-08-07 17:32:11.220736","192.168.2.3","216.58.197.4","TCP","1434","49253  >  443 [ACK] Seq=166019 Ack=4659 Win=998 Len=1368 TSval=396966 TSecr=371805140 [TCP segment of a reassembled PDU]"
"313","2018-08-07 17:32:11.221173","192.168.2.3","216.58.197.4","TCP","1434","49253  >  443 [ACK] Seq=167387 Ack=4659 Win=998 Len=1368 TSval=396966 TSecr=371805140 [TCP segment of a reassembled PDU]"
"314","2018-08-07 17:32:11.221175","192.168.2.3","216.58.197.4","TLSv1.2","212","Application Data"
"315","2018-08-07 17:32:11.221176","192.168.2.3","216.58.197.4","TLSv1.2","1132","Application Data"
"319","2018-08-07 17:32:11.320312","192.168.2.3","216.58.197.4","TCP","1434","49253  >  443 [ACK] Seq=169967 Ack=4659 Win=998 Len=1368 TSval=396976 TSecr=371805183 [TCP segment of a reassembled PDU]"
"320","2018-08-07 17:32:11.320834","192.168.2.3","216.58.197.4","TCP","1434","49253  >  443 [ACK] Seq=171335 Ack=4659 Win=998 Len=1368 TSval=396976 TSecr=371805183 [TCP segment of a reassembled PDU]"
"321","2018-08-07 17:32:11.321835","192.168.2.3","216.58.197.4","TLSv1.2","212","Application Data"
"322","2018-08-07 17:32:11.322180","192.168.2.3","216.58.197.4","TCP","1434","49253  >  443 [ACK] Seq=172849 Ack=4659 Win=998 Len=1368 TSval=396976 TSecr=371805183 [TCP segment of a reassembled PDU]"
"323","2018-08-07 17:32:11.322182","192.168.2.3","216.58.197.4","TLSv1.2","155","Application Data"
"327","2018-08-07 17:32:11.421664","192.168.2.3","216.58.197.4","TCP","1434","49253  >  443 [ACK] Seq=174306 Ack=4659 Win=998 Len=1368 TSval=396986 TSecr=371805284 [TCP segment of a reassembled PDU]"
"328","2018-08-07 17:32:11.422056","192.168.2.3","216.58.197.4","TCP","1434","49253  >  443 [ACK] Seq=175674 Ack=4659 Win=998 Len=1368 TSval=396986 TSecr=371805284 [TCP segment of a reassembled PDU]"
"329","2018-08-07 17:32:11.422057","192.168.2.3","216.58.197.4","TLSv1.2","212","Application Data"
"330","2018-08-07 17:32:11.422058","192.168.2.3","216.58.197.4","TLSv1.2","641","Application Data"
"336","2018-08-07 17:32:11.560748","192.168.2.3","172.217.27.174","TCP","66","52259  >  443 [ACK] Seq=1 Ack=1 Win=494 Len=0 TSval=396992 TSecr=86879642"
"337","2018-08-07 17:32:11.560752","192.168.2.3","216.58.197.4","TCP","1434","49253  >  443 [ACK] Seq=177763 Ack=4659 Win=998 Len=1368 TSval=396998 TSecr=371805384 [TCP segment of a reassembled PDU]"
"338","2018-08-07 17:32:11.560949","192.168.2.3","216.58.197.4","TCP","1434","49253  >  443 [ACK] Seq=179131 Ack=4659 Win=998 Len=1368 TSval=396998 TSecr=371805384 [TCP segment of a reassembled PDU]"
"339","2018-08-07 17:32:11.560952","192.168.2.3","216.58.197.4","TLSv1.2","212","Application Data"
"340","2018-08-07 17:32:11.561354","192.168.2.3","216.58.197.4","TLSv1.2","877","Application Data"
"341","2018-08-07 17:32:11.564413","192.168.2.3","216.58.197.4","TCP","66","49253  >  443 [ACK] Seq=181456 Ack=5016 Win=998 Len=0 TSval=397000 TSecr=371805438"
"346","2018-08-07 17:32:11.567075","192.168.2.3","216.58.197.4","TCP","78","[TCP Dup ACK 341#1] 49253  >  443 [ACK] Seq=181456 Ack=5016 Win=998 Len=0 TSval=397001 TSecr=371805467 SLE=4806 SRE=5016"
"347","2018-08-07 17:32:11.643281","192.168.2.3","216.58.197.4","TCP","1434","49253  >  443 [ACK] Seq=181456 Ack=5016 Win=998 Len=1368 TSval=397008 TSecr=371805523 [TCP segment of a reassembled PDU]"
"348","2018-08-07 17:32:11.643561","192.168.2.3","216.58.197.4","TCP","1434","49253  >  443 [ACK] Seq=182824 Ack=5016 Win=998 Len=1368 TSval=397008 TSecr=371805523 [TCP segment of a reassembled PDU]"
"349","2018-08-07 17:32:11.643563","192.168.2.3","216.58.197.4","TLSv1.2","212","Application Data"
"350","2018-08-07 17:32:11.643950","192.168.2.3","216.58.197.4","TLSv1.2","1336","Application Data"
"357","2018-08-07 17:32:11.707296","192.168.2.3","216.58.197.4","TCP","66","49253  >  443 [ACK] Seq=185608 Ack=5209 Win=998 Len=0 TSval=397015 TSecr=371805664"
"358","2018-08-07 17:32:11.708240","192.168.2.3","216.58.197.4","TCP","66","49253  >  443 [ACK] Seq=185608 Ack=5382 Win=998 Len=0 TSval=397015 TSecr=371805664"
"359","2018-08-07 17:32:11.708651","192.168.2.3","216.58.197.4","TCP","66","49253  >  443 [ACK] Seq=185608 Ack=5452 Win=998 Len=0 TSval=397015 TSecr=371805665"
"360","2018-08-07 17:32:11.743579","192.168.2.3","216.58.197.4","TCP","1434","49253  >  443 [ACK] Seq=185608 Ack=5452 Win=998 Len=1368 TSval=397018 TSecr=371805665 [TCP segment of a reassembled PDU]"
"361","2018-08-07 17:32:11.743921","192.168.2.3","216.58.197.4","TCP","1434","49253  >  443 [ACK] Seq=186976 Ack=5452 Win=998 Len=1368 TSval=397018 TSecr=371805665 [TCP segment of a reassembled PDU]"
"362","2018-08-07 17:32:11.743926","192.168.2.3","216.58.197.4","TLSv1.2","212","Application Data"
"363","2018-08-07 17:32:11.743927","192.168.2.3","216.58.197.4","TLSv1.2","285","Application Data"
"367","2018-08-07 17:32:11.862927","192.168.2.3","216.58.197.4","TCP","1434","49253  >  443 [ACK] Seq=188709 Ack=5452 Win=998 Len=1368 TSval=397030 TSecr=371805706 [TCP segment of a reassembled PDU]"
"368","2018-08-07 17:32:11.863217","192.168.2.3","216.58.197.4","TCP","1434","49253  >  443 [ACK] Seq=190077 Ack=5452 Win=998 Len=1368 TSval=397030 TSecr=371805706 [TCP segment of a reassembled PDU]"
"369","2018-08-07 17:32:11.863218","192.168.2.3","216.58.197.4","TLSv1.2","212","Application Data"
"370","2018-08-07 17:32:11.863219","192.168.2.3","216.58.197.4","TLSv1.2","1027","Application Data"
"373","2018-08-07 17:32:11.957017","192.168.2.3","216.58.196.234","TCP","66","45131  >  443 [ACK] Seq=1 Ack=1 Win=495 Len=0 TSval=397040 TSecr=2348991246"
"375","2018-08-07 17:32:11.963401","192.168.2.3","216.58.197.4","TCP","1434","49253  >  443 [ACK] Seq=192552 Ack=5452 Win=998 Len=1368 TSval=397040 TSecr=371805825 [TCP segment of a reassembled PDU]"
"376","2018-08-07 17:32:11.963804","192.168.2.3","216.58.197.4","TCP","1434","49253  >  443 [ACK] Seq=193920 Ack=5452 Win=998 Len=1368 TSval=397040 TSecr=371805825 [TCP segment of a reassembled PDU]"
"377","2018-08-07 17:32:11.963807","192.168.2.3","216.58.197.4","TLSv1.2","212","Application Data"
"378","2018-08-07 17:32:11.964087","192.168.2.3","216.58.197.4","TLSv1.2","1199","Application Data"
"384","2018-08-07 17:32:11.992061","192.168.2.3","216.58.197.4","TCP","66","49253  >  443 [ACK] Seq=196567 Ack=5600 Win=998 Len=0 TSval=397043 TSecr=371805932"
"387","2018-08-07 17:32:12.049164","192.168.2.3","216.58.197.4","TCP","66","49253  >  443 [ACK] Seq=196567 Ack=5851 Win=998 Len=0 TSval=397048 TSecr=371805989"
"388","2018-08-07 17:32:12.068696","192.168.2.3","216.58.197.4","TCP","1434","49253  >  443 [ACK] Seq=196567 Ack=5851 Win=998 Len=1368 TSval=397051 TSecr=371805989 [TCP segment of a reassembled PDU]"
"389","2018-08-07 17:32:12.069024","192.168.2.3","216.58.197.4","TCP","1434","49253  >  443 [ACK] Seq=197935 Ack=5851 Win=998 Len=1368 TSval=397051 TSecr=371805989 [TCP segment of a reassembled PDU]"
"390","2018-08-07 17:32:12.069027","192.168.2.3","216.58.197.4","TLSv1.2","212","Application Data"
"391","2018-08-07 17:32:12.069028","192.168.2.3","216.58.197.4","TLSv1.2","596","Application Data"
"396","2018-08-07 17:32:12.131192","192.168.2.3","216.58.197.4","TCP","66","49253  >  443 [ACK] Seq=199979 Ack=6211 Win=998 Len=0 TSval=397057 TSecr=371806084"
"397","2018-08-07 17:32:12.165542","192.168.2.3","172.217.27.174","TCP","66","52258  >  443 [ACK] Seq=1 Ack=1 Win=363 Len=0 TSval=397061 TSecr=2574205741"
"399","2018-08-07 17:32:12.180929","192.168.2.3","216.58.197.4","TCP","1434","49253  >  443 [ACK] Seq=199979 Ack=6211 Win=998 Len=1368 TSval=397062 TSecr=371806084 [TCP segment of a reassembled PDU]"
"400","2018-08-07 17:32:12.181434","192.168.2.3","216.58.197.4","TCP","1434","49253  >  443 [ACK] Seq=201347 Ack=6211 Win=998 Len=1368 TSval=397062 TSecr=371806084 [TCP segment of a reassembled PDU]"
"401","2018-08-07 17:32:12.181437","192.168.2.3","216.58.197.4","TLSv1.2","212","Application Data"
"402","2018-08-07 17:32:12.181438","192.168.2.3","216.58.197.4","TLSv1.2","702","Application Data"
"403","2018-08-07 17:32:12.182903","192.168.2.3","216.58.197.4","TLSv1.2","442","Application Data"
"404","2018-08-07 17:32:12.183208","192.168.2.3","216.58.197.4","TLSv1.2","102","Application Data"
"409","2018-08-07 17:32:12.223221","192.168.2.3","216.58.197.4","TCP","66","49253  >  443 [ACK] Seq=203909 Ack=7076 Win=998 Len=0 TSval=397066 TSecr=371806175"
"413","2018-08-07 17:32:12.485536","192.168.2.3","216.58.197.4","TCP","66","49253  >  443 [ACK] Seq=203909 Ack=7253 Win=998 Len=0 TSval=397092 TSecr=371806398"
"414","2018-08-07 17:32:12.486412","192.168.2.3","216.58.197.4","TCP","66","49253  >  443 [ACK] Seq=203909 Ack=8521 Win=998 Len=0 TSval=397093 TSecr=371806427"
"424","2018-08-07 17:32:12.647622","192.168.2.3","216.58.197.4","TCP","66","49253  >  443 [ACK] Seq=203909 Ack=9939 Win=982 Len=0 TSval=397109 TSecr=371806603"
"428","2018-08-07 17:32:12.651964","192.168.2.3","216.58.197.4","TCP","66","49253  >  443 [ACK] Seq=203909 Ack=10388 Win=982 Len=0 TSval=397109 TSecr=371806603"
"429","2018-08-07 17:32:12.651967","192.168.2.3","216.58.197.4","TCP","66","49253  >  443 [ACK] Seq=203909 Ack=11806 Win=982 Len=0 TSval=397109 TSecr=371806604"
"430","2018-08-07 17:32:12.651967","192.168.2.3","216.58.197.4","TCP","66","49253  >  443 [ACK] Seq=203909 Ack=12109 Win=982 Len=0 TSval=397109 TSecr=371806604"
"431","2018-08-07 17:32:12.651968","192.168.2.3","216.58.197.4","TCP","66","49253  >  443 [ACK] Seq=203909 Ack=13527 Win=982 Len=0 TSval=397109 TSecr=371806604"
"432","2018-08-07 17:32:12.651969","192.168.2.3","216.58.197.4","TCP","66","49253  >  443 [ACK] Seq=203909 Ack=15301 Win=976 Len=0 TSval=397109 TSecr=371806604"
"433","2018-08-07 17:32:12.651970","192.168.2.3","216.58.197.4","TCP","66","49253  >  443 [ACK] Seq=203909 Ack=15687 Win=998 Len=0 TSval=397109 TSecr=371806604"
"434","2018-08-07 17:32:12.651971","192.168.2.3","216.58.197.4","TCP","66","49253  >  443 [ACK] Seq=203909 Ack=17105 Win=976 Len=0 TSval=397109 TSecr=371806605"
"435","2018-08-07 17:32:12.651972","192.168.2.3","216.58.197.4","TCP","66","49253  >  443 [ACK] Seq=203909 Ack=17489 Win=998 Len=0 TSval=397109 TSecr=371806605"
"436","2018-08-07 17:32:12.655466","192.168.2.3","216.58.197.4","TCP","66","49253  >  443 [ACK] Seq=203909 Ack=18907 Win=982 Len=0 TSval=397110 TSecr=371806605"
"437","2018-08-07 17:32:12.655796","192.168.2.3","216.58.197.4","TCP","66","49253  >  443 [ACK] Seq=203909 Ack=19391 Win=998 Len=0 TSval=397110 TSecr=371806605"
"449","2018-08-07 17:32:12.685580","192.168.2.3","216.58.197.4","TCP","66","49253  >  443 [ACK] Seq=203909 Ack=20809 Win=982 Len=0 TSval=397113 TSecr=371806641"
"452","2018-08-07 17:32:12.686883","192.168.2.3","216.58.197.4","TCP","66","49253  >  443 [ACK] Seq=203909 Ack=21156 Win=982 Len=0 TSval=397113 TSecr=371806641"
"455","2018-08-07 17:32:12.687564","192.168.2.3","216.58.197.4","TCP","66","49253  >  443 [ACK] Seq=203909 Ack=26532 Win=998 Len=0 TSval=397113 TSecr=371806641"
"458","2018-08-07 17:32:12.687894","192.168.2.3","216.58.197.4","TCP","66","49253  >  443 [ACK] Seq=203909 Ack=31724 Win=998 Len=0 TSval=397113 TSecr=371806642"
"463","2018-08-07 17:32:12.689996","192.168.2.3","216.58.197.4","TCP","66","49253  >  443 [ACK] Seq=203909 Ack=33593 Win=998 Len=0 TSval=397113 TSecr=371806644"
"464","2018-08-07 17:32:12.689998","192.168.2.3","216.58.197.4","TCP","66","49253  >  443 [ACK] Seq=203909 Ack=35490 Win=998 Len=0 TSval=397113 TSecr=371806644"
"465","2018-08-07 17:32:12.689999","192.168.2.3","216.58.197.4","TCP","66","49253  >  443 [ACK] Seq=203909 Ack=37325 Win=998 Len=0 TSval=397113 TSecr=371806645"
"473","2018-08-07 17:32:12.692660","192.168.2.3","216.58.197.4","TCP","66","49253  >  443 [ACK] Seq=203909 Ack=39072 Win=998 Len=0 TSval=397113 TSecr=371806647"
"474","2018-08-07 17:32:12.692663","192.168.2.3","216.58.197.4","TCP","66","49253  >  443 [ACK] Seq=203909 Ack=40878 Win=998 Len=0 TSval=397113 TSecr=371806647"
"475","2018-08-07 17:32:12.693153","192.168.2.3","216.58.197.4","TCP","66","49253  >  443 [ACK] Seq=203909 Ack=42598 Win=998 Len=0 TSval=397113 TSecr=371806649"
"476","2018-08-07 17:32:12.693584","192.168.2.3","216.58.197.4","TCP","66","49253  >  443 [ACK] Seq=203909 Ack=42838 Win=998 Len=0 TSval=397113 TSecr=371806649"
"477","2018-08-07 17:32:12.710019","192.168.2.3","216.58.197.4","TLSv1.2","104","Application Data"
"480","2018-08-07 17:32:14.779862","192.168.2.3","192.168.2.1","ICMP","98","Echo (ping) request  id=0x0623, seq=1/256, ttl=64 (reply in 481)"
"482","2018-08-07 17:32:15.796031","192.168.2.3","192.168.2.1","ICMP","98","Echo (ping) request  id=0x0623, seq=2/512, ttl=64 (reply in 483)"
"484","2018-08-07 17:32:15.819131","192.168.2.3","8.8.8.8","ICMP","98","Echo (ping) request  id=0x0629, seq=1/256, ttl=64 (reply in 485)"
"487","2018-08-07 17:32:16.845220","192.168.2.3","8.8.8.8","ICMP","98","Echo (ping) request  id=0x0629, seq=2/512, ttl=64 (reply in 488)"
"489","2018-08-07 17:32:16.853302","192.168.2.3","8.8.8.8","DNS","74","Standard query 0x48d7 A www.google.com"
"490","2018-08-07 17:32:16.853304","192.168.2.3","8.8.8.8","DNS","74","Standard query 0xae24 AAAA www.google.com"
"493","2018-08-07 17:32:19.537158","192.168.2.3","8.8.8.8","DNS","79","Standard query 0x479b A clients4.google.com"
"495","2018-08-07 17:32:19.583214","192.168.2.3","172.217.27.174","TCP","74","52263  >  443 [SYN] Seq=0 Win=14600 Len=0 MSS=1460 SACK_PERM=1 TSval=397802 TSecr=0 WS=64"
"497","2018-08-07 17:32:19.589553","192.168.2.3","172.217.27.174","TCP","66","52263  >  443 [ACK] Seq=1 Ack=1 Win=14656 Len=0 TSval=397803 TSecr=4029300286"
"498","2018-08-07 17:32:19.590384","192.168.2.3","172.217.27.174","TLSv1.2","583","Client Hello"
"501","2018-08-07 17:32:19.599049","192.168.2.3","172.217.27.174","TCP","66","52263  >  443 [ACK] Seq=518 Ack=149 Win=15680 Len=0 TSval=397804 TSecr=4029300295"
"502","2018-08-07 17:32:19.599945","192.168.2.3","172.217.27.174","TLSv1.2","109","Change Cipher Spec, Encrypted Handshake Message"
"503","2018-08-07 17:32:19.600867","192.168.2.3","172.217.27.174","TLSv1.2","151","Application Data"
"504","2018-08-07 17:32:19.601819","192.168.2.3","172.217.27.174","TLSv1.2","515","Application Data"
"505","2018-08-07 17:32:19.602157","192.168.2.3","172.217.27.174","TCP","1434","52263  >  443 [ACK] Seq=1095 Ack=149 Win=15680 Len=1368 TSval=397804 TSecr=4029300295 [TCP segment of a reassembled PDU]"
"506","2018-08-07 17:32:19.602438","192.168.2.3","172.217.27.174","TCP","1434","52263  >  443 [ACK] Seq=2463 Ack=149 Win=15680 Len=1368 TSval=397804 TSecr=4029300295 [TCP segment of a reassembled PDU]"
"507","2018-08-07 17:32:19.602441","192.168.2.3","172.217.27.174","TLSv1.2","212","Application Data"
"510","2018-08-07 17:32:19.606054","192.168.2.3","172.217.27.174","TCP","1434","52263  >  443 [ACK] Seq=3977 Ack=149 Win=15680 Len=1368 TSval=397804 TSecr=4029300295 [TCP segment of a reassembled PDU]"
"511","2018-08-07 17:32:19.606056","192.168.2.3","172.217.27.174","TLSv1.2","536","Application Data"
"515","2018-08-07 17:32:19.610795","192.168.2.3","172.217.27.174","TCP","66","52263  >  443 [ACK] Seq=5815 Ack=240 Win=15680 Len=0 TSval=397805 TSecr=4029300303"
"516","2018-08-07 17:32:19.611064","192.168.2.3","172.217.27.174","TLSv1.2","96","Application Data"
"522","2018-08-07 17:32:19.686648","192.168.2.3","172.217.27.174","TCP","66","52263  >  443 [ACK] Seq=5845 Ack=612 Win=17856 Len=0 TSval=397813 TSecr=4029300382"
"523","2018-08-07 17:32:19.687012","192.168.2.3","172.217.27.174","TCP","66","52263  >  443 [ACK] Seq=5845 Ack=870 Win=18944 Len=0 TSval=397813 TSecr=4029300382"
"524","2018-08-07 17:32:19.687562","192.168.2.3","172.217.27.174","TLSv1.2","104","Application Data"
"526","2018-08-07 17:32:20.273241","192.168.2.3","172.217.27.174","TLSv1.2","160","[TCP Previous segment not captured] , Application Data"
"527","2018-08-07 17:32:20.275223","192.168.2.3","172.217.27.174","TLSv1.2","104","Application Data"
"528","2018-08-07 17:32:20.275740","192.168.2.3","172.217.27.174","TLSv1.2","506","Application Data"
"532","2018-08-07 17:32:20.315789","192.168.2.3","172.217.27.174","TCP","66","52258  >  443 [ACK] Seq=574 Ack=39 Win=363 Len=0 TSval=397876 TSecr=2574258848"
"538","2018-08-07 17:32:20.360006","192.168.2.3","172.217.27.174","TCP","66","52258  >  443 [ACK] Seq=574 Ack=107 Win=363 Len=0 TSval=397880 TSecr=2574258927"
"539","2018-08-07 17:32:20.360286","192.168.2.3","172.217.27.174","TCP","66","52258  >  443 [ACK] Seq=574 Ack=347 Win=379 Len=0 TSval=397880 TSecr=2574258927"
"540","2018-08-07 17:32:20.360620","192.168.2.3","172.217.27.174","TCP","66","52258  >  443 [ACK] Seq=574 Ack=438 Win=379 Len=0 TSval=397880 TSecr=2574258928"
"541","2018-08-07 17:32:20.360622","192.168.2.3","172.217.27.174","TCP","66","52258  >  443 [ACK] Seq=574 Ack=476 Win=379 Len=0 TSval=397880 TSecr=2574258928"
"542","2018-08-07 17:32:20.361611","192.168.2.3","172.217.27.174","TLSv1.2","104","Application Data"
