"No.","Time","Source","Destination","Protocol","Length","Info"
"14","2018-08-07 17:54:00.489272","192.168.2.3","216.58.197.4","TLSv1.2","156","Application Data"
"15","2018-08-07 17:54:00.489993","192.168.2.3","216.58.197.4","TLSv1.2","104","Application Data"
"16","2018-08-07 17:54:00.492833","192.168.2.3","216.58.197.4","TLSv1.2","158","Application Data"
"20","2018-08-07 17:54:00.525893","192.168.2.3","216.58.197.4","TCP","1434","49253  >  443 [ACK] Seq=221 Ack=39 Win=1522 Len=1368 TSval=527895 TSecr=373114456 [TCP segment of a reassembled PDU]"
"21","2018-08-07 17:54:00.526125","192.168.2.3","216.58.197.4","TCP","1434","49253  >  443 [ACK] Seq=1589 Ack=39 Win=1522 Len=1368 TSval=527895 TSecr=373114456 [TCP segment of a reassembled PDU]"
"22","2018-08-07 17:54:00.526127","192.168.2.3","216.58.197.4","TLSv1.2","212","Application Data"
"23","2018-08-07 17:54:00.526668","192.168.2.3","216.58.197.4","TCP","1434","49253  >  443 [ACK] Seq=3103 Ack=39 Win=1522 Len=1368 TSval=527895 TSecr=373114456 [TCP segment of a reassembled PDU]"
"24","2018-08-07 17:54:00.526671","192.168.2.3","216.58.197.4","TLSv1.2","287","Application Data"
"28","2018-08-07 17:54:00.532439","192.168.2.3","216.58.197.4","TCP","1434","49253  >  443 [ACK] Seq=4692 Ack=39 Win=1522 Len=1368 TSval=527896 TSecr=373114492 [TCP segment of a reassembled PDU]"
"29","2018-08-07 17:54:00.532838","192.168.2.3","216.58.197.4","TCP","1434","49253  >  443 [ACK] Seq=6060 Ack=39 Win=1522 Len=1368 TSval=527896 TSecr=373114492 [TCP segment of a reassembled PDU]"
"30","2018-08-07 17:54:00.532840","192.168.2.3","216.58.197.4","TLSv1.2","212","Application Data"
"31","2018-08-07 17:54:00.532841","192.168.2.3","216.58.197.4","TCP","1434","49253  >  443 [ACK] Seq=7574 Ack=39 Win=1522 Len=1368 TSval=527896 TSecr=373114493 [TCP segment of a reassembled PDU]"
"32","2018-08-07 17:54:00.533028","192.168.2.3","216.58.197.4","TLSv1.2","156","Application Data"
"33","2018-08-07 17:54:00.533381","192.168.2.3","216.58.197.4","TCP","1434","49253  >  443 [ACK] Seq=9032 Ack=39 Win=1522 Len=1368 TSval=527896 TSecr=373114493 [TCP segment of a reassembled PDU]"
"34","2018-08-07 17:54:00.533383","192.168.2.3","216.58.197.4","TCP","1434","49253  >  443 [ACK] Seq=10400 Ack=39 Win=1522 Len=1368 TSval=527896 TSecr=373114493 [TCP segment of a reassembled PDU]"
"35","2018-08-07 17:54:00.533549","192.168.2.3","216.58.197.4","TLSv1.2","212","Application Data"
"36","2018-08-07 17:54:00.533919","192.168.2.3","216.58.197.4","TCP","1434","49253  >  443 [ACK] Seq=11914 Ack=39 Win=1522 Len=1368 TSval=527896 TSecr=373114493 [TCP segment of a reassembled PDU]"
"37","2018-08-07 17:54:00.533920","192.168.2.3","216.58.197.4","TLSv1.2","156","Application Data"
"38","2018-08-07 17:54:00.534233","192.168.2.3","216.58.197.4","TCP","1434","49253  >  443 [ACK] Seq=13372 Ack=39 Win=1522 Len=1368 TSval=527896 TSecr=373114493 [TCP segment of a reassembled PDU]"
"44","2018-08-07 17:54:00.543592","192.168.2.3","216.58.197.4","TCP","1434","49253  >  443 [ACK] Seq=14740 Ack=39 Win=1522 Len=1368 TSval=527897 TSecr=373114499 [TCP segment of a reassembled PDU]"
"45","2018-08-07 17:54:00.543594","192.168.2.3","216.58.197.4","TLSv1.2","1434","Application Data [TCP segment of a reassembled PDU]"
"46","2018-08-07 17:54:00.543865","192.168.2.3","216.58.197.4","TLSv1.2","1434","Application Data [TCP segment of a reassembled PDU]"
"47","2018-08-07 17:54:00.543919","192.168.2.3","216.58.197.4","TCP","1434","49253  >  443 [ACK] Seq=18844 Ack=39 Win=1522 Len=1368 TSval=527897 TSecr=373114499 [TCP segment of a reassembled PDU]"
"48","2018-08-07 17:54:00.544098","192.168.2.3","216.58.197.4","TLSv1.2","1434","Application Data [TCP segment of a reassembled PDU]"
"49","2018-08-07 17:54:00.544325","192.168.2.3","216.58.197.4","TLSv1.2","1434","Application Data [TCP segment of a reassembled PDU]"
"50","2018-08-07 17:54:00.544462","192.168.2.3","216.58.197.4","TCP","1434","49253  >  443 [ACK] Seq=22948 Ack=39 Win=1522 Len=1368 TSval=527897 TSecr=373114499 [TCP segment of a reassembled PDU]"
"51","2018-08-07 17:54:00.544733","192.168.2.3","216.58.197.4","TLSv1.2","1434","Application Data [TCP segment of a reassembled PDU]"
"52","2018-08-07 17:54:00.544840","192.168.2.3","216.58.197.4","TLSv1.2","1434","Application Data [TCP segment of a reassembled PDU]"
"53","2018-08-07 17:54:00.544954","192.168.2.3","216.58.197.4","TCP","1434","49253  >  443 [ACK] Seq=27052 Ack=39 Win=1522 Len=1368 TSval=527897 TSecr=373114499 [TCP segment of a reassembled PDU]"
"57","2018-08-07 17:54:00.548756","192.168.2.3","216.58.197.4","TLSv1.2","1434","Application Data [TCP segment of a reassembled PDU]"
"58","2018-08-07 17:54:00.548918","192.168.2.3","216.58.197.4","TLSv1.2","1434","Application Data [TCP segment of a reassembled PDU]"
"59","2018-08-07 17:54:00.549219","192.168.2.3","216.58.197.4","TCP","1434","49253  >  443 [ACK] Seq=31156 Ack=39 Win=1522 Len=1368 TSval=527897 TSecr=373114500 [TCP segment of a reassembled PDU]"
"60","2018-08-07 17:54:00.549448","192.168.2.3","216.58.197.4","TLSv1.2","1434","Application Data [TCP segment of a reassembled PDU]"
"61","2018-08-07 17:54:00.549450","192.168.2.3","216.58.197.4","TLSv1.2","1434","Application Data [TCP segment of a reassembled PDU]"
"64","2018-08-07 17:54:00.549678","192.168.2.3","216.58.197.4","TCP","1434","49253  >  443 [ACK] Seq=35260 Ack=39 Win=1522 Len=1368 TSval=527897 TSecr=373114500 [TCP segment of a reassembled PDU]"
"68","2018-08-07 17:54:00.555125","192.168.2.3","216.58.197.4","TLSv1.2","1434","Application Data [TCP segment of a reassembled PDU]"
"69","2018-08-07 17:54:00.555394","192.168.2.3","216.58.197.4","TCP","1434","49253  >  443 [ACK] Seq=37996 Ack=39 Win=1522 Len=1368 TSval=527898 TSecr=373114510 [TCP segment of a reassembled PDU]"
"70","2018-08-07 17:54:00.555665","192.168.2.3","216.58.197.4","TLSv1.2","1434","Application Data [TCP segment of a reassembled PDU]"
"71","2018-08-07 17:54:00.555668","192.168.2.3","216.58.197.4","TCP","1434","49253  >  443 [ACK] Seq=40732 Ack=39 Win=1522 Len=1368 TSval=527898 TSecr=373114510 [TCP segment of a reassembled PDU]"
"72","2018-08-07 17:54:00.555768","192.168.2.3","216.58.197.4","TLSv1.2","1434","Application Data [TCP segment of a reassembled PDU]"
"73","2018-08-07 17:54:00.555958","192.168.2.3","216.58.197.4","TLSv1.2","1434","Application Data [TCP segment of a reassembled PDU]"
"74","2018-08-07 17:54:00.556110","192.168.2.3","216.58.197.4","TCP","1434","49253  >  443 [ACK] Seq=44836 Ack=39 Win=1522 Len=1368 TSval=527898 TSecr=373114510 [TCP segment of a reassembled PDU]"
"75","2018-08-07 17:54:00.556423","192.168.2.3","216.58.197.4","TLSv1.2","1434","Application Data [TCP segment of a reassembled PDU]"
"76","2018-08-07 17:54:00.556757","192.168.2.3","216.58.197.4","TLSv1.2","1434","Application Data [TCP segment of a reassembled PDU]"
"77","2018-08-07 17:54:00.556758","192.168.2.3","216.58.197.4","TCP","1434","49253  >  443 [ACK] Seq=48940 Ack=39 Win=1522 Len=1368 TSval=527898 TSecr=373114511 [TCP segment of a reassembled PDU]"
"78","2018-08-07 17:54:00.556779","192.168.2.3","216.58.197.4","TLSv1.2","1434","Application Data [TCP segment of a reassembled PDU]"
"79","2018-08-07 17:54:00.556969","192.168.2.3","216.58.197.4","TLSv1.2","1434","Application Data [TCP segment of a reassembled PDU]"
"80","2018-08-07 17:54:00.557120","192.168.2.3","216.58.197.4","TCP","1434","49253  >  443 [ACK] Seq=53044 Ack=39 Win=1522 Len=1368 TSval=527898 TSecr=373114511 [TCP segment of a reassembled PDU]"
"81","2018-08-07 17:54:00.557309","192.168.2.3","216.58.197.4","TLSv1.2","1434","Application Data, Application Data"
"88","2018-08-07 17:54:00.566908","192.168.2.3","216.58.197.4","TCP","1434","49253  >  443 [ACK] Seq=55780 Ack=39 Win=1522 Len=1368 TSval=527899 TSecr=373114515 [TCP segment of a reassembled PDU]"
"89","2018-08-07 17:54:00.566910","192.168.2.3","216.58.197.4","TLSv1.2","1434","Application Data [TCP segment of a reassembled PDU]"
"90","2018-08-07 17:54:00.567118","192.168.2.3","216.58.197.4","TCP","1434","49253  >  443 [ACK] Seq=58516 Ack=39 Win=1522 Len=1368 TSval=527899 TSecr=373114515 [TCP segment of a reassembled PDU]"
"91","2018-08-07 17:54:00.567270","192.168.2.3","216.58.197.4","TLSv1.2","1434","Application Data [TCP segment of a reassembled PDU]"
"92","2018-08-07 17:54:00.567425","192.168.2.3","216.58.197.4","TCP","1434","49253  >  443 [ACK] Seq=61252 Ack=39 Win=1522 Len=1368 TSval=527899 TSecr=373114515 [TCP segment of a reassembled PDU]"
"93","2018-08-07 17:54:00.567661","192.168.2.3","216.58.197.4","TLSv1.2","1434","Application Data [TCP segment of a reassembled PDU]"
"94","2018-08-07 17:54:00.567664","192.168.2.3","216.58.197.4","TLSv1.2","336","Application Data"
"99","2018-08-07 17:54:00.576463","192.168.2.3","216.58.197.4","TCP","1434","49253  >  443 [ACK] Seq=64258 Ack=39 Win=1522 Len=1368 TSval=527900 TSecr=373114533 [TCP segment of a reassembled PDU]"
"100","2018-08-07 17:54:00.576792","192.168.2.3","216.58.197.4","TCP","1434","49253  >  443 [ACK] Seq=65626 Ack=39 Win=1522 Len=1368 TSval=527900 TSecr=373114533 [TCP segment of a reassembled PDU]"
"101","2018-08-07 17:54:00.576793","192.168.2.3","216.58.197.4","TLSv1.2","212","Application Data"
"102","2018-08-07 17:54:00.577209","192.168.2.3","216.58.197.4","TCP","1434","49253  >  443 [ACK] Seq=67140 Ack=39 Win=1522 Len=1368 TSval=527900 TSecr=373114534 [TCP segment of a reassembled PDU]"
"103","2018-08-07 17:54:00.577211","192.168.2.3","216.58.197.4","TLSv1.2","155","Application Data"
"107","2018-08-07 17:54:00.649199","192.168.2.3","216.58.197.4","TCP","1434","49253  >  443 [ACK] Seq=68597 Ack=39 Win=1522 Len=1368 TSval=527908 TSecr=373114583 [TCP segment of a reassembled PDU]"
"108","2018-08-07 17:54:00.649202","192.168.2.3","216.58.197.4","TCP","1434","49253  >  443 [ACK] Seq=69965 Ack=39 Win=1522 Len=1368 TSval=527908 TSecr=373114583 [TCP segment of a reassembled PDU]"
"109","2018-08-07 17:54:00.649332","192.168.2.3","216.58.197.4","TLSv1.2","212","Application Data"
"110","2018-08-07 17:54:00.649764","192.168.2.3","216.58.197.4","TCP","1434","49253  >  443 [ACK] Seq=71479 Ack=39 Win=1522 Len=1368 TSval=527908 TSecr=373114583 [TCP segment of a reassembled PDU]"
"111","2018-08-07 17:54:00.649767","192.168.2.3","216.58.197.4","TLSv1.2","155","Application Data"
"115","2018-08-07 17:54:00.738508","192.168.2.3","216.58.197.4","TCP","66","49253  >  443 [ACK] Seq=72936 Ack=73 Win=1522 Len=0 TSval=527917 TSecr=373114663"
"116","2018-08-07 17:54:00.747497","192.168.2.3","216.58.197.4","TCP","1434","49253  >  443 [ACK] Seq=72936 Ack=73 Win=1522 Len=1368 TSval=527917 TSecr=373114663 [TCP segment of a reassembled PDU]"
"117","2018-08-07 17:54:00.747910","192.168.2.3","216.58.197.4","TCP","1434","49253  >  443 [ACK] Seq=74304 Ack=73 Win=1522 Len=1368 TSval=527917 TSecr=373114663 [TCP segment of a reassembled PDU]"
"118","2018-08-07 17:54:00.747912","192.168.2.3","216.58.197.4","TLSv1.2","212","Application Data"
"119","2018-08-07 17:54:00.748306","192.168.2.3","216.58.197.4","TCP","1434","49253  >  443 [ACK] Seq=75818 Ack=73 Win=1522 Len=1368 TSval=527917 TSecr=373114663 [TCP segment of a reassembled PDU]"
"120","2018-08-07 17:54:00.748309","192.168.2.3","216.58.197.4","TLSv1.2","155","Application Data"
"124","2018-08-07 17:54:00.853879","192.168.2.3","216.58.197.4","TCP","1434","49253  >  443 [ACK] Seq=77275 Ack=73 Win=1522 Len=1368 TSval=527928 TSecr=373114714 [TCP segment of a reassembled PDU]"
"125","2018-08-07 17:54:00.853883","192.168.2.3","216.58.197.4","TCP","1434","49253  >  443 [ACK] Seq=78643 Ack=73 Win=1522 Len=1368 TSval=527928 TSecr=373114714 [TCP segment of a reassembled PDU]"
"126","2018-08-07 17:54:00.853884","192.168.2.3","216.58.197.4","TLSv1.2","212","Application Data"
"127","2018-08-07 17:54:00.854110","192.168.2.3","216.58.197.4","TLSv1.2","465","Application Data"
"129","2018-08-07 17:54:00.941545","192.168.2.3","216.58.197.4","TCP","1434","49253  >  443 [ACK] Seq=80556 Ack=73 Win=1522 Len=1368 TSval=527937 TSecr=373114820 [TCP segment of a reassembled PDU]"
"130","2018-08-07 17:54:00.941859","192.168.2.3","216.58.197.4","TCP","1434","49253  >  443 [ACK] Seq=81924 Ack=73 Win=1522 Len=1368 TSval=527937 TSecr=373114820 [TCP segment of a reassembled PDU]"
"131","2018-08-07 17:54:00.941865","192.168.2.3","216.58.197.4","TLSv1.2","212","Application Data"
"132","2018-08-07 17:54:00.942294","192.168.2.3","216.58.197.4","TCP","1434","49253  >  443 [ACK] Seq=83438 Ack=73 Win=1522 Len=1368 TSval=527937 TSecr=373114820 [TCP segment of a reassembled PDU]"
"133","2018-08-07 17:54:00.942299","192.168.2.3","216.58.197.4","TLSv1.2","155","Application Data"
"140","2018-08-07 17:54:00.975138","192.168.2.3","216.58.197.4","TCP","66","49253  >  443 [ACK] Seq=84895 Ack=340 Win=1522 Len=0 TSval=527940 TSecr=373114936"
"141","2018-08-07 17:54:00.977527","192.168.2.3","216.58.197.4","TCP","66","49253  >  443 [ACK] Seq=84895 Ack=489 Win=1522 Len=0 TSval=527940 TSecr=373114936"
"143","2018-08-07 17:54:00.989060","192.168.2.3","216.58.197.4","TCP","66","49253  >  443 [ACK] Seq=84895 Ack=787 Win=1522 Len=0 TSval=527942 TSecr=373114950"
"144","2018-08-07 17:54:01.044900","192.168.2.3","216.58.197.4","TCP","1434","49253  >  443 [ACK] Seq=84895 Ack=787 Win=1522 Len=1368 TSval=527947 TSecr=373114950 [TCP segment of a reassembled PDU]"
"145","2018-08-07 17:54:01.045336","192.168.2.3","216.58.197.4","TCP","1434","49253  >  443 [ACK] Seq=86263 Ack=787 Win=1522 Len=1368 TSval=527947 TSecr=373114950 [TCP segment of a reassembled PDU]"
"146","2018-08-07 17:54:01.045339","192.168.2.3","216.58.197.4","TLSv1.2","212","Application Data"
"147","2018-08-07 17:54:01.045746","192.168.2.3","216.58.197.4","TCP","1434","49253  >  443 [ACK] Seq=87777 Ack=787 Win=1522 Len=1368 TSval=527947 TSecr=373114950 [TCP segment of a reassembled PDU]"
"148","2018-08-07 17:54:01.045749","192.168.2.3","216.58.197.4","TLSv1.2","155","Application Data"
"152","2018-08-07 17:54:01.130979","192.168.2.3","216.58.197.4","TCP","66","49253  >  443 [ACK] Seq=89234 Ack=918 Win=1522 Len=0 TSval=527956 TSecr=373115090"
"153","2018-08-07 17:54:01.167396","192.168.2.3","216.58.197.4","TCP","1434","49253  >  443 [ACK] Seq=89234 Ack=918 Win=1522 Len=1368 TSval=527959 TSecr=373115090 [TCP segment of a reassembled PDU]"
"154","2018-08-07 17:54:01.167569","192.168.2.3","216.58.197.4","TCP","1434","49253  >  443 [ACK] Seq=90602 Ack=918 Win=1522 Len=1368 TSval=527959 TSecr=373115090 [TCP segment of a reassembled PDU]"
"155","2018-08-07 17:54:01.167571","192.168.2.3","216.58.197.4","TLSv1.2","212","Application Data"
"156","2018-08-07 17:54:01.168088","192.168.2.3","216.58.197.4","TLSv1.2","1290","Application Data"
"159","2018-08-07 17:54:01.263822","192.168.2.3","216.58.197.4","TCP","1434","49253  >  443 [ACK] Seq=93340 Ack=918 Win=1522 Len=1368 TSval=527969 TSecr=373115134 [TCP segment of a reassembled PDU]"
"160","2018-08-07 17:54:01.264080","192.168.2.3","216.58.197.4","TCP","1434","49253  >  443 [ACK] Seq=94708 Ack=918 Win=1522 Len=1368 TSval=527969 TSecr=373115134 [TCP segment of a reassembled PDU]"
"161","2018-08-07 17:54:01.264082","192.168.2.3","216.58.197.4","TLSv1.2","212","Application Data"
"162","2018-08-07 17:54:01.264188","192.168.2.3","216.58.197.4","TCP","1434","49253  >  443 [ACK] Seq=96222 Ack=918 Win=1522 Len=1368 TSval=527969 TSecr=373115134 [TCP segment of a reassembled PDU]"
"163","2018-08-07 17:54:01.264191","192.168.2.3","216.58.197.4","TLSv1.2","155","Application Data"
"167","2018-08-07 17:54:01.343804","192.168.2.3","216.58.197.4","TCP","66","49253  >  443 [ACK] Seq=97679 Ack=973 Win=1522 Len=0 TSval=527977 TSecr=373115262"
"168","2018-08-07 17:54:01.357379","192.168.2.3","216.58.197.4","TCP","1434","49253  >  443 [ACK] Seq=97679 Ack=973 Win=1522 Len=1368 TSval=527978 TSecr=373115262 [TCP segment of a reassembled PDU]"
"169","2018-08-07 17:54:01.357773","192.168.2.3","216.58.197.4","TCP","1434","49253  >  443 [ACK] Seq=99047 Ack=973 Win=1522 Len=1368 TSval=527978 TSecr=373115262 [TCP segment of a reassembled PDU]"
"170","2018-08-07 17:54:01.357774","192.168.2.3","216.58.197.4","TLSv1.2","212","Application Data"
"171","2018-08-07 17:54:01.357775","192.168.2.3","216.58.197.4","TCP","1434","49253  >  443 [ACK] Seq=100561 Ack=973 Win=1522 Len=1368 TSval=527978 TSecr=373115262 [TCP segment of a reassembled PDU]"
"172","2018-08-07 17:54:01.357776","192.168.2.3","216.58.197.4","TLSv1.2","155","Application Data"
"176","2018-08-07 17:54:01.485410","192.168.2.3","216.58.197.4","TCP","1434","49253  >  443 [ACK] Seq=102018 Ack=973 Win=1522 Len=1368 TSval=527991 TSecr=373115364 [TCP segment of a reassembled PDU]"
"177","2018-08-07 17:54:01.485785","192.168.2.3","216.58.197.4","TCP","1434","49253  >  443 [ACK] Seq=103386 Ack=973 Win=1522 Len=1368 TSval=527991 TSecr=373115364 [TCP segment of a reassembled PDU]"
"178","2018-08-07 17:54:01.485787","192.168.2.3","216.58.197.4","TLSv1.2","212","Application Data"
"179","2018-08-07 17:54:01.485789","192.168.2.3","216.58.197.4","TCP","1434","49253  >  443 [ACK] Seq=104900 Ack=973 Win=1522 Len=1368 TSval=527991 TSecr=373115364 [TCP segment of a reassembled PDU]"
"180","2018-08-07 17:54:01.486029","192.168.2.3","216.58.197.4","TLSv1.2","155","Application Data"
"184","2018-08-07 17:54:01.578375","192.168.2.3","216.58.197.4","TCP","1434","49253  >  443 [ACK] Seq=106357 Ack=973 Win=1522 Len=1368 TSval=528000 TSecr=373115452 [TCP segment of a reassembled PDU]"
"185","2018-08-07 17:54:01.578811","192.168.2.3","216.58.197.4","TCP","1434","49253  >  443 [ACK] Seq=107725 Ack=973 Win=1522 Len=1368 TSval=528000 TSecr=373115452 [TCP segment of a reassembled PDU]"
"186","2018-08-07 17:54:01.578813","192.168.2.3","216.58.197.4","TLSv1.2","212","Application Data"
"187","2018-08-07 17:54:01.580002","192.168.2.3","216.58.197.4","TCP","1434","49253  >  443 [ACK] Seq=109239 Ack=973 Win=1522 Len=1368 TSval=528001 TSecr=373115452 [TCP segment of a reassembled PDU]"
"188","2018-08-07 17:54:01.580005","192.168.2.3","216.58.197.4","TLSv1.2","155","Application Data"
"192","2018-08-07 17:54:01.690051","192.168.2.3","216.58.197.4","TCP","1434","49253  >  443 [ACK] Seq=110696 Ack=973 Win=1522 Len=1368 TSval=528011 TSecr=373115546 [TCP segment of a reassembled PDU]"
"193","2018-08-07 17:54:01.690055","192.168.2.3","216.58.197.4","TCP","1434","49253  >  443 [ACK] Seq=112064 Ack=973 Win=1522 Len=1368 TSval=528011 TSecr=373115546 [TCP segment of a reassembled PDU]"
"194","2018-08-07 17:54:01.690056","192.168.2.3","216.58.197.4","TLSv1.2","212","Application Data"
"195","2018-08-07 17:54:01.690325","192.168.2.3","216.58.197.4","TLSv1.2","997","Application Data"
"199","2018-08-07 17:54:01.753384","192.168.2.3","216.58.197.4","TCP","1434","49253  >  443 [ACK] Seq=114509 Ack=973 Win=1522 Len=1368 TSval=528018 TSecr=373115656 [TCP segment of a reassembled PDU]"
"200","2018-08-07 17:54:01.753606","192.168.2.3","216.58.197.4","TCP","1434","49253  >  443 [ACK] Seq=115877 Ack=973 Win=1522 Len=1368 TSval=528018 TSecr=373115656 [TCP segment of a reassembled PDU]"
"201","2018-08-07 17:54:01.753609","192.168.2.3","216.58.197.4","TLSv1.2","212","Application Data"
"202","2018-08-07 17:54:01.753610","192.168.2.3","216.58.197.4","TCP","1434","49253  >  443 [ACK] Seq=117391 Ack=973 Win=1522 Len=1368 TSval=528018 TSecr=373115656 [TCP segment of a reassembled PDU]"
"203","2018-08-07 17:54:01.753785","192.168.2.3","216.58.197.4","TLSv1.2","155","Application Data"
"206","2018-08-07 17:54:01.835537","192.168.2.3","216.58.197.4","TCP","1434","49253  >  443 [ACK] Seq=118848 Ack=973 Win=1522 Len=1368 TSval=528026 TSecr=373115720 [TCP segment of a reassembled PDU]"
"207","2018-08-07 17:54:01.836754","192.168.2.3","216.58.197.4","TCP","1434","49253  >  443 [ACK] Seq=120216 Ack=973 Win=1522 Len=1368 TSval=528026 TSecr=373115720 [TCP segment of a reassembled PDU]"
"208","2018-08-07 17:54:01.836961","192.168.2.3","216.58.197.4","TLSv1.2","212","Application Data"
"209","2018-08-07 17:54:01.836963","192.168.2.3","216.58.197.4","TCP","1434","49253  >  443 [ACK] Seq=121730 Ack=973 Win=1522 Len=1368 TSval=528026 TSecr=373115720 [TCP segment of a reassembled PDU]"
"210","2018-08-07 17:54:01.837378","192.168.2.3","216.58.197.4","TLSv1.2","155","Application Data"
"214","2018-08-07 17:54:01.930323","192.168.2.3","216.58.197.4","TCP","1434","49253  >  443 [ACK] Seq=123187 Ack=973 Win=1522 Len=1368 TSval=528036 TSecr=373115803 [TCP segment of a reassembled PDU]"
"215","2018-08-07 17:54:01.930327","192.168.2.3","216.58.197.4","TCP","1434","49253  >  443 [ACK] Seq=124555 Ack=973 Win=1522 Len=1368 TSval=528036 TSecr=373115803 [TCP segment of a reassembled PDU]"
"216","2018-08-07 17:54:01.930539","192.168.2.3","216.58.197.4","TLSv1.2","212","Application Data"
"217","2018-08-07 17:54:01.930541","192.168.2.3","216.58.197.4","TCP","1434","49253  >  443 [ACK] Seq=126069 Ack=973 Win=1522 Len=1368 TSval=528036 TSecr=373115803 [TCP segment of a reassembled PDU]"
"218","2018-08-07 17:54:01.930542","192.168.2.3","216.58.197.4","TLSv1.2","155","Application Data"
"223","2018-08-07 17:54:01.975104","192.168.2.3","216.58.197.4","TCP","66","49253  >  443 [ACK] Seq=127526 Ack=1224 Win=1522 Len=0 TSval=528040 TSecr=373115936"
"226","2018-08-07 17:54:01.984305","192.168.2.3","216.58.197.4","TCP","66","49253  >  443 [ACK] Seq=127526 Ack=1487 Win=1522 Len=0 TSval=528041 TSecr=373115945"
"228","2018-08-07 17:54:01.988631","192.168.2.3","216.58.197.4","TCP","66","49253  >  443 [ACK] Seq=127526 Ack=1654 Win=1522 Len=0 TSval=528042 TSecr=373115949"
"229","2018-08-07 17:54:02.025914","192.168.2.3","216.58.197.4","TCP","1434","49253  >  443 [ACK] Seq=127526 Ack=1654 Win=1522 Len=1368 TSval=528045 TSecr=373115949 [TCP segment of a reassembled PDU]"
"230","2018-08-07 17:54:02.026292","192.168.2.3","216.58.197.4","TCP","1434","49253  >  443 [ACK] Seq=128894 Ack=1654 Win=1522 Len=1368 TSval=528045 TSecr=373115949 [TCP segment of a reassembled PDU]"
"231","2018-08-07 17:54:02.026295","192.168.2.3","216.58.197.4","TLSv1.2","212","Application Data"
"232","2018-08-07 17:54:02.026296","192.168.2.3","216.58.197.4","TCP","1434","49253  >  443 [ACK] Seq=130408 Ack=1654 Win=1522 Len=1368 TSval=528045 TSecr=373115949 [TCP segment of a reassembled PDU]"
"233","2018-08-07 17:54:02.026404","192.168.2.3","216.58.197.4","TLSv1.2","155","Application Data"
"237","2018-08-07 17:54:02.124545","192.168.2.3","216.58.197.4","TCP","1434","49253  >  443 [ACK] Seq=131865 Ack=1654 Win=1522 Len=1368 TSval=528055 TSecr=373115992 [TCP segment of a reassembled PDU]"
"238","2018-08-07 17:54:02.124548","192.168.2.3","216.58.197.4","TCP","1434","49253  >  443 [ACK] Seq=133233 Ack=1654 Win=1522 Len=1368 TSval=528055 TSecr=373115992 [TCP segment of a reassembled PDU]"
"239","2018-08-07 17:54:02.124549","192.168.2.3","216.58.197.4","TLSv1.2","212","Application Data"
"240","2018-08-07 17:54:02.124961","192.168.2.3","216.58.197.4","TCP","1434","49253  >  443 [ACK] Seq=134747 Ack=1654 Win=1522 Len=1368 TSval=528055 TSecr=373115992 [TCP segment of a reassembled PDU]"
"241","2018-08-07 17:54:02.124963","192.168.2.3","216.58.197.4","TLSv1.2","155","Application Data"
"247","2018-08-07 17:54:02.191514","192.168.2.3","216.58.197.4","TCP","66","49253  >  443 [ACK] Seq=136204 Ack=2053 Win=1522 Len=0 TSval=528062 TSecr=373116152"
"248","2018-08-07 17:54:02.224698","192.168.2.3","216.58.197.4","TCP","1434","49253  >  443 [ACK] Seq=136204 Ack=2053 Win=1522 Len=1368 TSval=528065 TSecr=373116152 [TCP segment of a reassembled PDU]"
"249","2018-08-07 17:54:02.224708","192.168.2.3","216.58.197.4","TCP","1434","49253  >  443 [ACK] Seq=137572 Ack=2053 Win=1522 Len=1368 TSval=528065 TSecr=373116152 [TCP segment of a reassembled PDU]"
"250","2018-08-07 17:54:02.224778","192.168.2.3","216.58.197.4","TLSv1.2","212","Application Data"
"251","2018-08-07 17:54:02.225015","192.168.2.3","216.58.197.4","TCP","1434","49253  >  443 [ACK] Seq=139086 Ack=2053 Win=1522 Len=1368 TSval=528065 TSecr=373116152 [TCP segment of a reassembled PDU]"
"252","2018-08-07 17:54:02.225018","192.168.2.3","216.58.197.4","TLSv1.2","155","Application Data"
"258","2018-08-07 17:54:02.294228","192.168.2.3","216.58.197.4","TCP","66","49253  >  443 [ACK] Seq=140543 Ack=2238 Win=1522 Len=0 TSval=528072 TSecr=373116255"
"259","2018-08-07 17:54:02.317819","192.168.2.3","216.58.197.4","TCP","1434","49253  >  443 [ACK] Seq=140543 Ack=2238 Win=1522 Len=1368 TSval=528074 TSecr=373116255 [TCP segment of a reassembled PDU]"
"260","2018-08-07 17:54:02.318094","192.168.2.3","216.58.197.4","TCP","1434","49253  >  443 [ACK] Seq=141911 Ack=2238 Win=1522 Len=1368 TSval=528074 TSecr=373116255 [TCP segment of a reassembled PDU]"
"261","2018-08-07 17:54:02.318096","192.168.2.3","216.58.197.4","TLSv1.2","212","Application Data"
"262","2018-08-07 17:54:02.318462","192.168.2.3","216.58.197.4","TCP","1434","49253  >  443 [ACK] Seq=143425 Ack=2238 Win=1522 Len=1368 TSval=528074 TSecr=373116255 [TCP segment of a reassembled PDU]"
"263","2018-08-07 17:54:02.318465","192.168.2.3","216.58.197.4","TLSv1.2","155","Application Data"
"267","2018-08-07 17:54:02.409727","192.168.2.3","216.58.197.4","TCP","1434","49253  >  443 [ACK] Seq=144882 Ack=2238 Win=1522 Len=1368 TSval=528084 TSecr=373116284 [TCP segment of a reassembled PDU]"
"268","2018-08-07 17:54:02.410115","192.168.2.3","216.58.197.4","TCP","1434","49253  >  443 [ACK] Seq=146250 Ack=2238 Win=1522 Len=1368 TSval=528084 TSecr=373116284 [TCP segment of a reassembled PDU]"
"269","2018-08-07 17:54:02.410117","192.168.2.3","216.58.197.4","TLSv1.2","212","Application Data"
"270","2018-08-07 17:54:02.410357","192.168.2.3","216.58.197.4","TCP","1434","49253  >  443 [ACK] Seq=147764 Ack=2238 Win=1522 Len=1368 TSval=528084 TSecr=373116284 [TCP segment of a reassembled PDU]"
"271","2018-08-07 17:54:02.410359","192.168.2.3","216.58.197.4","TLSv1.2","155","Application Data"
"274","2018-08-07 17:54:02.510584","192.168.2.3","216.58.197.4","TCP","1434","49253  >  443 [ACK] Seq=149221 Ack=2238 Win=1522 Len=1368 TSval=528094 TSecr=373116376 [TCP segment of a reassembled PDU]"
"275","2018-08-07 17:54:02.510983","192.168.2.3","216.58.197.4","TCP","1434","49253  >  443 [ACK] Seq=150589 Ack=2238 Win=1522 Len=1368 TSval=528094 TSecr=373116376 [TCP segment of a reassembled PDU]"
"276","2018-08-07 17:54:02.510986","192.168.2.3","216.58.197.4","TLSv1.2","212","Application Data"
"277","2018-08-07 17:54:02.510986","192.168.2.3","216.58.197.4","TLSv1.2","698","Application Data"
"282","2018-08-07 17:54:02.573587","192.168.2.3","216.58.197.4","TCP","66","49253  >  443 [ACK] Seq=152735 Ack=2724 Win=1522 Len=0 TSval=528100 TSecr=373116534"
"284","2018-08-07 17:54:02.602702","192.168.2.3","216.58.197.4","TCP","1434","49253  >  443 [ACK] Seq=152735 Ack=2724 Win=1522 Len=1368 TSval=528103 TSecr=373116534 [TCP segment of a reassembled PDU]"
"285","2018-08-07 17:54:02.603194","192.168.2.3","216.58.197.4","TCP","1434","49253  >  443 [ACK] Seq=154103 Ack=2724 Win=1522 Len=1368 TSval=528103 TSecr=373116534 [TCP segment of a reassembled PDU]"
"286","2018-08-07 17:54:02.603197","192.168.2.3","216.58.197.4","TLSv1.2","212","Application Data"
"287","2018-08-07 17:54:02.603478","192.168.2.3","216.58.197.4","TCP","1434","49253  >  443 [ACK] Seq=155617 Ack=2724 Win=1522 Len=1368 TSval=528103 TSecr=373116534 [TCP segment of a reassembled PDU]"
"288","2018-08-07 17:54:02.603479","192.168.2.3","216.58.197.4","TLSv1.2","155","Application Data"
"292","2018-08-07 17:54:02.759396","192.168.2.3","216.58.197.4","TCP","1434","49253  >  443 [ACK] Seq=157074 Ack=2724 Win=1522 Len=1368 TSval=528116 TSecr=373116570 [TCP segment of a reassembled PDU]"
"293","2018-08-07 17:54:02.759402","192.168.2.3","216.58.197.4","TCP","1434","49253  >  443 [ACK] Seq=158442 Ack=2724 Win=1522 Len=1368 TSval=528116 TSecr=373116570 [TCP segment of a reassembled PDU]"
"294","2018-08-07 17:54:02.759672","192.168.2.3","216.58.197.4","TLSv1.2","212","Application Data"
"295","2018-08-07 17:54:02.759676","192.168.2.3","216.58.197.4","TCP","1434","49253  >  443 [ACK] Seq=159956 Ack=2724 Win=1522 Len=1368 TSval=528116 TSecr=373116570 [TCP segment of a reassembled PDU]"
"296","2018-08-07 17:54:02.759677","192.168.2.3","216.58.197.4","TLSv1.2","155","Application Data"
"301","2018-08-07 17:54:02.808515","192.168.2.3","216.58.197.4","TCP","66","49253  >  443 [ACK] Seq=161413 Ack=2767 Win=1522 Len=0 TSval=528124 TSecr=373116731"
"302","2018-08-07 17:54:02.829525","192.168.2.3","216.58.197.4","TCP","1434","49253  >  443 [ACK] Seq=161413 Ack=2767 Win=1522 Len=1368 TSval=528126 TSecr=373116731 [TCP segment of a reassembled PDU]"
"303","2018-08-07 17:54:02.829921","192.168.2.3","216.58.197.4","TCP","1434","49253  >  443 [ACK] Seq=162781 Ack=2767 Win=1522 Len=1368 TSval=528126 TSecr=373116731 [TCP segment of a reassembled PDU]"
"304","2018-08-07 17:54:02.829923","192.168.2.3","216.58.197.4","TLSv1.2","212","Application Data"
"305","2018-08-07 17:54:02.830333","192.168.2.3","216.58.197.4","TCP","1434","49253  >  443 [ACK] Seq=164295 Ack=2767 Win=1522 Len=1368 TSval=528126 TSecr=373116731 [TCP segment of a reassembled PDU]"
"306","2018-08-07 17:54:02.830336","192.168.2.3","216.58.197.4","TLSv1.2","155","Application Data"
"312","2018-08-07 17:54:02.898619","192.168.2.3","216.58.197.4","TCP","66","49253  >  443 [ACK] Seq=165752 Ack=3018 Win=1522 Len=0 TSval=528133 TSecr=373116858"
"313","2018-08-07 17:54:02.954451","192.168.2.3","216.58.197.4","TCP","1434","49253  >  443 [ACK] Seq=165752 Ack=3018 Win=1522 Len=1368 TSval=528138 TSecr=373116858 [TCP segment of a reassembled PDU]"
"314","2018-08-07 17:54:02.954692","192.168.2.3","216.58.197.4","TCP","1434","49253  >  443 [ACK] Seq=167120 Ack=3018 Win=1522 Len=1368 TSval=528138 TSecr=373116858 [TCP segment of a reassembled PDU]"
"315","2018-08-07 17:54:02.954696","192.168.2.3","216.58.197.4","TLSv1.2","212","Application Data"
"316","2018-08-07 17:54:02.955086","192.168.2.3","216.58.197.4","TCP","1434","49253  >  443 [ACK] Seq=168634 Ack=3018 Win=1522 Len=1368 TSval=528138 TSecr=373116858 [TCP segment of a reassembled PDU]"
"317","2018-08-07 17:54:02.955089","192.168.2.3","216.58.197.4","TLSv1.2","155","Application Data"
"322","2018-08-07 17:54:02.975946","192.168.2.3","216.58.197.4","TCP","66","49253  >  443 [ACK] Seq=170091 Ack=3108 Win=1522 Len=0 TSval=528140 TSecr=373116936"
"324","2018-08-07 17:54:02.988899","192.168.2.3","216.58.197.4","TCP","66","49253  >  443 [ACK] Seq=170091 Ack=3266 Win=1522 Len=0 TSval=528142 TSecr=373116949"
"325","2018-08-07 17:54:03.049787","192.168.2.3","216.58.197.4","TCP","1434","49253  >  443 [ACK] Seq=170091 Ack=3266 Win=1522 Len=1368 TSval=528148 TSecr=373116949 [TCP segment of a reassembled PDU]"
"326","2018-08-07 17:54:03.050123","192.168.2.3","216.58.197.4","TCP","1434","49253  >  443 [ACK] Seq=171459 Ack=3266 Win=1522 Len=1368 TSval=528148 TSecr=373116949 [TCP segment of a reassembled PDU]"
"327","2018-08-07 17:54:03.050125","192.168.2.3","216.58.197.4","TLSv1.2","212","Application Data"
"328","2018-08-07 17:54:03.050833","192.168.2.3","216.58.197.4","TCP","1434","49253  >  443 [ACK] Seq=172973 Ack=3266 Win=1522 Len=1368 TSval=528148 TSecr=373116949 [TCP segment of a reassembled PDU]"
"329","2018-08-07 17:54:03.050836","192.168.2.3","216.58.197.4","TLSv1.2","155","Application Data"
"331","2018-08-07 17:54:03.150647","192.168.2.3","216.58.197.4","TCP","1434","49253  >  443 [ACK] Seq=174430 Ack=3266 Win=1522 Len=1368 TSval=528158 TSecr=373117018 [TCP segment of a reassembled PDU]"
"332","2018-08-07 17:54:03.150650","192.168.2.3","216.58.197.4","TCP","1434","49253  >  443 [ACK] Seq=175798 Ack=3266 Win=1522 Len=1368 TSval=528158 TSecr=373117018 [TCP segment of a reassembled PDU]"
"333","2018-08-07 17:54:03.150861","192.168.2.3","216.58.197.4","TLSv1.2","212","Application Data"
"334","2018-08-07 17:54:03.150863","192.168.2.3","216.58.197.4","TCP","1434","49253  >  443 [ACK] Seq=177312 Ack=3266 Win=1522 Len=1368 TSval=528158 TSecr=373117018 [TCP segment of a reassembled PDU]"
"335","2018-08-07 17:54:03.151012","192.168.2.3","216.58.197.4","TLSv1.2","155","Application Data"
"341","2018-08-07 17:54:03.209019","192.168.2.3","216.58.197.4","TCP","66","49253  >  443 [ACK] Seq=178769 Ack=3488 Win=1522 Len=0 TSval=528163 TSecr=373117167"
"342","2018-08-07 17:54:03.276385","192.168.2.3","216.58.197.4","TCP","1434","49253  >  443 [ACK] Seq=178769 Ack=3488 Win=1522 Len=1368 TSval=528170 TSecr=373117167 [TCP segment of a reassembled PDU]"
"343","2018-08-07 17:54:03.276828","192.168.2.3","216.58.197.4","TCP","1434","49253  >  443 [ACK] Seq=180137 Ack=3488 Win=1522 Len=1368 TSval=528170 TSecr=373117167 [TCP segment of a reassembled PDU]"
"344","2018-08-07 17:54:03.276831","192.168.2.3","216.58.197.4","TLSv1.2","212","Application Data"
"345","2018-08-07 17:54:03.276832","192.168.2.3","216.58.197.4","TCP","1434","49253  >  443 [ACK] Seq=181651 Ack=3488 Win=1522 Len=1368 TSval=528170 TSecr=373117167 [TCP segment of a reassembled PDU]"
"346","2018-08-07 17:54:03.276833","192.168.2.3","216.58.197.4","TLSv1.2","108","Application Data"
"352","2018-08-07 17:54:03.335989","192.168.2.3","216.58.197.4","TCP","66","49253  >  443 [ACK] Seq=183061 Ack=3827 Win=1522 Len=0 TSval=528176 TSecr=373117294"
"353","2018-08-07 17:54:03.369451","192.168.2.3","216.58.197.4","TCP","1434","49253  >  443 [ACK] Seq=183061 Ack=3827 Win=1522 Len=1368 TSval=528180 TSecr=373117294 [TCP segment of a reassembled PDU]"
"354","2018-08-07 17:54:03.369847","192.168.2.3","216.58.197.4","TCP","1434","49253  >  443 [ACK] Seq=184429 Ack=3827 Win=1522 Len=1368 TSval=528180 TSecr=373117294 [TCP segment of a reassembled PDU]"
"355","2018-08-07 17:54:03.369849","192.168.2.3","216.58.197.4","TLSv1.2","212","Application Data"
"356","2018-08-07 17:54:03.369849","192.168.2.3","216.58.197.4","TCP","1434","49253  >  443 [ACK] Seq=185943 Ack=3827 Win=1522 Len=1368 TSval=528180 TSecr=373117294 [TCP segment of a reassembled PDU]"
"357","2018-08-07 17:54:03.370001","192.168.2.3","216.58.197.4","TLSv1.2","155","Application Data"
"358","2018-08-07 17:54:03.370797","192.168.2.3","216.58.197.4","TLSv1.2","1016","Application Data"
"359","2018-08-07 17:54:03.370799","192.168.2.3","216.58.197.4","TLSv1.2","102","Application Data"
"365","2018-08-07 17:54:03.421230","192.168.2.3","216.58.197.4","TCP","66","49253  >  443 [ACK] Seq=188386 Ack=4685 Win=1522 Len=0 TSval=528185 TSecr=373117377"
"367","2018-08-07 17:54:03.636700","192.168.2.3","216.58.197.4","TCP","66","49253  >  443 [ACK] Seq=188386 Ack=4883 Win=1522 Len=0 TSval=528206 TSecr=373117595"
"369","2018-08-07 17:54:03.680917","192.168.2.3","216.58.197.4","TCP","66","49253  >  443 [ACK] Seq=188386 Ack=6156 Win=1522 Len=0 TSval=528211 TSecr=373117640"
"380","2018-08-07 17:54:03.699126","192.168.2.3","216.58.197.4","TCP","66","49253  >  443 [ACK] Seq=188386 Ack=11448 Win=1522 Len=0 TSval=528213 TSecr=373117655"
"381","2018-08-07 17:54:03.699567","192.168.2.3","216.58.197.4","TCP","66","49253  >  443 [ACK] Seq=188386 Ack=14950 Win=1522 Len=0 TSval=528213 TSecr=373117655"
"384","2018-08-07 17:54:03.703208","192.168.2.3","216.58.197.4","TCP","66","49253  >  443 [ACK] Seq=188386 Ack=15402 Win=1522 Len=0 TSval=528213 TSecr=373117662"
"385","2018-08-07 17:54:03.703210","192.168.2.3","216.58.197.4","TCP","66","49253  >  443 [ACK] Seq=188386 Ack=15546 Win=1522 Len=0 TSval=528213 TSecr=373117662"
"392","2018-08-07 17:54:03.864469","192.168.2.3","216.58.197.4","TCP","66","49253  >  443 [ACK] Seq=188386 Ack=15729 Win=1522 Len=0 TSval=528229 TSecr=373117825"
"393","2018-08-07 17:54:03.865170","192.168.2.3","216.58.197.4","TCP","66","49253  >  443 [ACK] Seq=188386 Ack=15794 Win=1522 Len=0 TSval=528229 TSecr=373117825"
"394","2018-08-07 17:54:03.869508","192.168.2.3","216.58.197.4","TCP","66","49253  >  443 [ACK] Seq=188386 Ack=16003 Win=1522 Len=0 TSval=528229 TSecr=373117825"
"395","2018-08-07 17:54:03.870787","192.168.2.3","216.58.197.4","TCP","66","49253  >  443 [ACK] Seq=188386 Ack=16173 Win=1522 Len=0 TSval=528230 TSecr=373117826"
"396","2018-08-07 17:54:03.876277","192.168.2.3","216.58.197.4","TLSv1.2","104","Application Data"