"No.","Time","Source","Destination","Protocol","Length","Info"
"2","2018-08-07 17:53:50.050480","192.168.2.3","172.217.27.174","TCP","66","52293  >  443 [ACK] Seq=1 Ack=1 Win=661 Len=0 TSval=526848 TSecr=874728063"
"5","2018-08-07 17:53:56.750726","192.168.2.3","239.255.255.250","SSDP","136","M-SEARCH * HTTP/1.1 "
"6","2018-08-07 17:53:56.916839","192.168.2.3","172.217.27.163","TLSv1.2","135","Application Data"
"7","2018-08-07 17:53:56.916842","192.168.2.3","172.217.27.163","TLSv1.2","104","Application Data"
"10","2018-08-07 17:53:56.925515","192.168.2.3","172.217.27.163","TCP","66","38971  >  443 [ACK] Seq=108 Ack=117 Win=406 Len=0 TSval=527535 TSecr=467385969"
"11","2018-08-07 17:53:56.925518","192.168.2.3","172.217.27.163","TLSv1.2","100","Application Data"
"12","2018-08-07 17:53:56.925518","192.168.2.3","172.217.27.163","TLSv1.2","104","Application Data"
"14","2018-08-07 17:54:00.489272","192.168.2.3","216.58.197.4","TLSv1.2","156","Application Data"
"15","2018-08-07 17:54:00.489993","192.168.2.3","216.58.197.4","TLSv1.2","104","Application Data"
"16","2018-08-07 17:54:00.492833","192.168.2.3","216.58.197.4","TLSv1.2","158","Application Data"
"20","2018-08-07 17:54:00.525893","192.168.2.3","216.58.197.4","TCP","1434","49253  >  443 [ACK] Seq=221 Ack=39 Win=1522 Len=1368 TSval=527895 TSecr=373114456 [TCP segment of a reassembled PDU]"
"21","2018-08-07 17:54:00.526125","192.168.2.3","216.58.197.4","TCP","1434","49253  >  443 [ACK] Seq=1589 Ack=39 Win=1522 Len=1368 TSval=527895 TSecr=373114456 [TCP segment of a reassembled PDU]"
"22","2018-08-07 17:54:00.526127","192.168.2.3","216.58.197.4","TLSv1.2","212","Application Data"
"23","2018-08-07 17:54:00.526668","192.168.2.3","216.58.197.4","TCP","1434","49253  >  443 [ACK] Seq=3103 Ack=39 Win=1522 Len=1368 TSval=527895 TSecr=373114456 [TCP segment of a reassembled PDU]"
"24","2018-08-07 17:54:00.526671","192.168.2.3","216.58.197.4","TLSv1.2","287","Application Data"
"28","2018-08-07 17:54:00.532439","192.168.2.3","216.58.197.4","TCP","1434","49253  >  443 [ACK] Seq=4692 Ack=39 Win=1522 Len=1368 TSval=527896 TSecr=373114492 [TCP segment of a reassembled PDU]"
"29","2018-08-07 17:54:00.532838","192.168.2.3","216.58.197.4","TCP","1434","49253  >  443 [ACK] Seq=6060 Ack=39 Win=1522 Len=1368 TSval=527896 TSecr=373114492 [TCP segment of a reassembled PDU]"
"30","2018-08-07 17:54:00.532840","192.168.2.3","216.58.197.4","TLSv1.2","212","Application Data"
"31","2018-08-07 17:54:00.532841","192.168.2.3","216.58.197.4","TCP","1434","49253  >  443 [ACK] Seq=7574 Ack=39 Win=1522 Len=1368 TSval=527896 TSecr=373114493 [TCP segment of a reassembled PDU]"
"32","2018-08-07 17:54:00.533028","192.168.2.3","216.58.197.4","TLSv1.2","156","Application Data"
"33","2018-08-07 17:54:00.533381","192.168.2.3","216.58.197.4","TCP","1434","49253  >  443 [ACK] Seq=9032 Ack=39 Win=1522 Len=1368 TSval=527896 TSecr=373114493 [TCP segment of a reassembled PDU]"
"34","2018-08-07 17:54:00.533383","192.168.2.3","216.58.197.4","TCP","1434","49253  >  443 [ACK] Seq=10400 Ack=39 Win=1522 Len=1368 TSval=527896 TSecr=373114493 [TCP segment of a reassembled PDU]"
"35","2018-08-07 17:54:00.533549","192.168.2.3","216.58.197.4","TLSv1.2","212","Application Data"
"36","2018-08-07 17:54:00.533919","192.168.2.3","216.58.197.4","TCP","1434","49253  >  443 [ACK] Seq=11914 Ack=39 Win=1522 Len=1368 TSval=527896 TSecr=373114493 [TCP segment of a reassembled PDU]"
"37","2018-08-07 17:54:00.533920","192.168.2.3","216.58.197.4","TLSv1.2","156","Application Data"
"38","2018-08-07 17:54:00.534233","192.168.2.3","216.58.197.4","TCP","1434","49253  >  443 [ACK] Seq=13372 Ack=39 Win=1522 Len=1368 TSval=527896 TSecr=373114493 [TCP segment of a reassembled PDU]"
"44","2018-08-07 17:54:00.543592","192.168.2.3","216.58.197.4","TCP","1434","49253  >  443 [ACK] Seq=14740 Ack=39 Win=1522 Len=1368 TSval=527897 TSecr=373114499 [TCP segment of a reassembled PDU]"
"45","2018-08-07 17:54:00.543594","192.168.2.3","216.58.197.4","TLSv1.2","1434","Application Data [TCP segment of a reassembled PDU]"
"46","2018-08-07 17:54:00.543865","192.168.2.3","216.58.197.4","TLSv1.2","1434","Application Data [TCP segment of a reassembled PDU]"
"47","2018-08-07 17:54:00.543919","192.168.2.3","216.58.197.4","TCP","1434","49253  >  443 [ACK] Seq=18844 Ack=39 Win=1522 Len=1368 TSval=527897 TSecr=373114499 [TCP segment of a reassembled PDU]"
"48","2018-08-07 17:54:00.544098","192.168.2.3","216.58.197.4","TLSv1.2","1434","Application Data [TCP segment of a reassembled PDU]"
"49","2018-08-07 17:54:00.544325","192.168.2.3","216.58.197.4","TLSv1.2","1434","Application Data [TCP segment of a reassembled PDU]"
"50","2018-08-07 17:54:00.544462","192.168.2.3","216.58.197.4","TCP","1434","49253  >  443 [ACK] Seq=22948 Ack=39 Win=1522 Len=1368 TSval=527897 TSecr=373114499 [TCP segment of a reassembled PDU]"
"51","2018-08-07 17:54:00.544733","192.168.2.3","216.58.197.4","TLSv1.2","1434","Application Data [TCP segment of a reassembled PDU]"
"52","2018-08-07 17:54:00.544840","192.168.2.3","216.58.197.4","TLSv1.2","1434","Application Data [TCP segment of a reassembled PDU]"
"53","2018-08-07 17:54:00.544954","192.168.2.3","216.58.197.4","TCP","1434","49253  >  443 [ACK] Seq=27052 Ack=39 Win=1522 Len=1368 TSval=527897 TSecr=373114499 [TCP segment of a reassembled PDU]"
"57","2018-08-07 17:54:00.548756","192.168.2.3","216.58.197.4","TLSv1.2","1434","Application Data [TCP segment of a reassembled PDU]"
"58","2018-08-07 17:54:00.548918","192.168.2.3","216.58.197.4","TLSv1.2","1434","Application Data [TCP segment of a reassembled PDU]"
"59","2018-08-07 17:54:00.549219","192.168.2.3","216.58.197.4","TCP","1434","49253  >  443 [ACK] Seq=31156 Ack=39 Win=1522 Len=1368 TSval=527897 TSecr=373114500 [TCP segment of a reassembled PDU]"
"60","2018-08-07 17:54:00.549448","192.168.2.3","216.58.197.4","TLSv1.2","1434","Application Data [TCP segment of a reassembled PDU]"
"61","2018-08-07 17:54:00.549450","192.168.2.3","216.58.197.4","TLSv1.2","1434","Application Data [TCP segment of a reassembled PDU]"
"64","2018-08-07 17:54:00.549678","192.168.2.3","216.58.197.4","TCP","1434","49253  >  443 [ACK] Seq=35260 Ack=39 Win=1522 Len=1368 TSval=527897 TSecr=373114500 [TCP segment of a reassembled PDU]"
"68","2018-08-07 17:54:00.555125","192.168.2.3","216.58.197.4","TLSv1.2","1434","Application Data [TCP segment of a reassembled PDU]"
"69","2018-08-07 17:54:00.555394","192.168.2.3","216.58.197.4","TCP","1434","49253  >  443 [ACK] Seq=37996 Ack=39 Win=1522 Len=1368 TSval=527898 TSecr=373114510 [TCP segment of a reassembled PDU]"
"70","2018-08-07 17:54:00.555665","192.168.2.3","216.58.197.4","TLSv1.2","1434","Application Data [TCP segment of a reassembled PDU]"
"71","2018-08-07 17:54:00.555668","192.168.2.3","216.58.197.4","TCP","1434","49253  >  443 [ACK] Seq=40732 Ack=39 Win=1522 Len=1368 TSval=527898 TSecr=373114510 [TCP segment of a reassembled PDU]"
"72","2018-08-07 17:54:00.555768","192.168.2.3","216.58.197.4","TLSv1.2","1434","Application Data [TCP segment of a reassembled PDU]"
"73","2018-08-07 17:54:00.555958","192.168.2.3","216.58.197.4","TLSv1.2","1434","Application Data [TCP segment of a reassembled PDU]"
"74","2018-08-07 17:54:00.556110","192.168.2.3","216.58.197.4","TCP","1434","49253  >  443 [ACK] Seq=44836 Ack=39 Win=1522 Len=1368 TSval=527898 TSecr=373114510 [TCP segment of a reassembled PDU]"
"75","2018-08-07 17:54:00.556423","192.168.2.3","216.58.197.4","TLSv1.2","1434","Application Data [TCP segment of a reassembled PDU]"
"76","2018-08-07 17:54:00.556757","192.168.2.3","216.58.197.4","TLSv1.2","1434","Application Data [TCP segment of a reassembled PDU]"
"77","2018-08-07 17:54:00.556758","192.168.2.3","216.58.197.4","TCP","1434","49253  >  443 [ACK] Seq=48940 Ack=39 Win=1522 Len=1368 TSval=527898 TSecr=373114511 [TCP segment of a reassembled PDU]"
"78","2018-08-07 17:54:00.556779","192.168.2.3","216.58.197.4","TLSv1.2","1434","Application Data [TCP segment of a reassembled PDU]"
"79","2018-08-07 17:54:00.556969","192.168.2.3","216.58.197.4","TLSv1.2","1434","Application Data [TCP segment of a reassembled PDU]"
"80","2018-08-07 17:54:00.557120","192.168.2.3","216.58.197.4","TCP","1434","49253  >  443 [ACK] Seq=53044 Ack=39 Win=1522 Len=1368 TSval=527898 TSecr=373114511 [TCP segment of a reassembled PDU]"
"81","2018-08-07 17:54:00.557309","192.168.2.3","216.58.197.4","TLSv1.2","1434","Application Data, Application Data"
"88","2018-08-07 17:54:00.566908","192.168.2.3","216.58.197.4","TCP","1434","49253  >  443 [ACK] Seq=55780 Ack=39 Win=1522 Len=1368 TSval=527899 TSecr=373114515 [TCP segment of a reassembled PDU]"
"89","2018-08-07 17:54:00.566910","192.168.2.3","216.58.197.4","TLSv1.2","1434","Application Data [TCP segment of a reassembled PDU]"
"90","2018-08-07 17:54:00.567118","192.168.2.3","216.58.197.4","TCP","1434","49253  >  443 [ACK] Seq=58516 Ack=39 Win=1522 Len=1368 TSval=527899 TSecr=373114515 [TCP segment of a reassembled PDU]"
"91","2018-08-07 17:54:00.567270","192.168.2.3","216.58.197.4","TLSv1.2","1434","Application Data [TCP segment of a reassembled PDU]"
"92","2018-08-07 17:54:00.567425","192.168.2.3","216.58.197.4","TCP","1434","49253  >  443 [ACK] Seq=61252 Ack=39 Win=1522 Len=1368 TSval=527899 TSecr=373114515 [TCP segment of a reassembled PDU]"
"93","2018-08-07 17:54:00.567661","192.168.2.3","216.58.197.4","TLSv1.2","1434","Application Data [TCP segment of a reassembled PDU]"
"94","2018-08-07 17:54:00.567664","192.168.2.3","216.58.197.4","TLSv1.2","336","Application Data"
"99","2018-08-07 17:54:00.576463","192.168.2.3","216.58.197.4","TCP","1434","49253  >  443 [ACK] Seq=64258 Ack=39 Win=1522 Len=1368 TSval=527900 TSecr=373114533 [TCP segment of a reassembled PDU]"
"100","2018-08-07 17:54:00.576792","192.168.2.3","216.58.197.4","TCP","1434","49253  >  443 [ACK] Seq=65626 Ack=39 Win=1522 Len=1368 TSval=527900 TSecr=373114533 [TCP segment of a reassembled PDU]"
"101","2018-08-07 17:54:00.576793","192.168.2.3","216.58.197.4","TLSv1.2","212","Application Data"
"102","2018-08-07 17:54:00.577209","192.168.2.3","216.58.197.4","TCP","1434","49253  >  443 [ACK] Seq=67140 Ack=39 Win=1522 Len=1368 TSval=527900 TSecr=373114534 [TCP segment of a reassembled PDU]"
"103","2018-08-07 17:54:00.577211","192.168.2.3","216.58.197.4","TLSv1.2","155","Application Data"
"107","2018-08-07 17:54:00.649199","192.168.2.3","216.58.197.4","TCP","1434","49253  >  443 [ACK] Seq=68597 Ack=39 Win=1522 Len=1368 TSval=527908 TSecr=373114583 [TCP segment of a reassembled PDU]"
"108","2018-08-07 17:54:00.649202","192.168.2.3","216.58.197.4","TCP","1434","49253  >  443 [ACK] Seq=69965 Ack=39 Win=1522 Len=1368 TSval=527908 TSecr=373114583 [TCP segment of a reassembled PDU]"
"109","2018-08-07 17:54:00.649332","192.168.2.3","216.58.197.4","TLSv1.2","212","Application Data"
"110","2018-08-07 17:54:00.649764","192.168.2.3","216.58.197.4","TCP","1434","49253  >  443 [ACK] Seq=71479 Ack=39 Win=1522 Len=1368 TSval=527908 TSecr=373114583 [TCP segment of a reassembled PDU]"
"111","2018-08-07 17:54:00.649767","192.168.2.3","216.58.197.4","TLSv1.2","155","Application Data"
"115","2018-08-07 17:54:00.738508","192.168.2.3","216.58.197.4","TCP","66","49253  >  443 [ACK] Seq=72936 Ack=73 Win=1522 Len=0 TSval=527917 TSecr=373114663"
"116","2018-08-07 17:54:00.747497","192.168.2.3","216.58.197.4","TCP","1434","49253  >  443 [ACK] Seq=72936 Ack=73 Win=1522 Len=1368 TSval=527917 TSecr=373114663 [TCP segment of a reassembled PDU]"
"117","2018-08-07 17:54:00.747910","192.168.2.3","216.58.197.4","TCP","1434","49253  >  443 [ACK] Seq=74304 Ack=73 Win=1522 Len=1368 TSval=527917 TSecr=373114663 [TCP segment of a reassembled PDU]"
"118","2018-08-07 17:54:00.747912","192.168.2.3","216.58.197.4","TLSv1.2","212","Application Data"
"119","2018-08-07 17:54:00.748306","192.168.2.3","216.58.197.4","TCP","1434","49253  >  443 [ACK] Seq=75818 Ack=73 Win=1522 Len=1368 TSval=527917 TSecr=373114663 [TCP segment of a reassembled PDU]"
"120","2018-08-07 17:54:00.748309","192.168.2.3","216.58.197.4","TLSv1.2","155","Application Data"
"124","2018-08-07 17:54:00.853879","192.168.2.3","216.58.197.4","TCP","1434","49253  >  443 [ACK] Seq=77275 Ack=73 Win=1522 Len=1368 TSval=527928 TSecr=373114714 [TCP segment of a reassembled PDU]"
"125","2018-08-07 17:54:00.853883","192.168.2.3","216.58.197.4","TCP","1434","49253  >  443 [ACK] Seq=78643 Ack=73 Win=1522 Len=1368 TSval=527928 TSecr=373114714 [TCP segment of a reassembled PDU]"
"126","2018-08-07 17:54:00.853884","192.168.2.3","216.58.197.4","TLSv1.2","212","Application Data"
"127","2018-08-07 17:54:00.854110","192.168.2.3","216.58.197.4","TLSv1.2","465","Application Data"
"129","2018-08-07 17:54:00.941545","192.168.2.3","216.58.197.4","TCP","1434","49253  >  443 [ACK] Seq=80556 Ack=73 Win=1522 Len=1368 TSval=527937 TSecr=373114820 [TCP segment of a reassembled PDU]"
"130","2018-08-07 17:54:00.941859","192.168.2.3","216.58.197.4","TCP","1434","49253  >  443 [ACK] Seq=81924 Ack=73 Win=1522 Len=1368 TSval=527937 TSecr=373114820 [TCP segment of a reassembled PDU]"
"131","2018-08-07 17:54:00.941865","192.168.2.3","216.58.197.4","TLSv1.2","212","Application Data"
"132","2018-08-07 17:54:00.942294","192.168.2.3","216.58.197.4","TCP","1434","49253  >  443 [ACK] Seq=83438 Ack=73 Win=1522 Len=1368 TSval=527937 TSecr=373114820 [TCP segment of a reassembled PDU]"
"133","2018-08-07 17:54:00.942299","192.168.2.3","216.58.197.4","TLSv1.2","155","Application Data"
"140","2018-08-07 17:54:00.975138","192.168.2.3","216.58.197.4","TCP","66","49253  >  443 [ACK] Seq=84895 Ack=340 Win=1522 Len=0 TSval=527940 TSecr=373114936"
"141","2018-08-07 17:54:00.977527","192.168.2.3","216.58.197.4","TCP","66","49253  >  443 [ACK] Seq=84895 Ack=489 Win=1522 Len=0 TSval=527940 TSecr=373114936"
"143","2018-08-07 17:54:00.989060","192.168.2.3","216.58.197.4","TCP","66","49253  >  443 [ACK] Seq=84895 Ack=787 Win=1522 Len=0 TSval=527942 TSecr=373114950"
"144","2018-08-07 17:54:01.044900","192.168.2.3","216.58.197.4","TCP","1434","49253  >  443 [ACK] Seq=84895 Ack=787 Win=1522 Len=1368 TSval=527947 TSecr=373114950 [TCP segment of a reassembled PDU]"
"145","2018-08-07 17:54:01.045336","192.168.2.3","216.58.197.4","TCP","1434","49253  >  443 [ACK] Seq=86263 Ack=787 Win=1522 Len=1368 TSval=527947 TSecr=373114950 [TCP segment of a reassembled PDU]"
"146","2018-08-07 17:54:01.045339","192.168.2.3","216.58.197.4","TLSv1.2","212","Application Data"
"147","2018-08-07 17:54:01.045746","192.168.2.3","216.58.197.4","TCP","1434","49253  >  443 [ACK] Seq=87777 Ack=787 Win=1522 Len=1368 TSval=527947 TSecr=373114950 [TCP segment of a reassembled PDU]"
"148","2018-08-07 17:54:01.045749","192.168.2.3","216.58.197.4","TLSv1.2","155","Application Data"
"152","2018-08-07 17:54:01.130979","192.168.2.3","216.58.197.4","TCP","66","49253  >  443 [ACK] Seq=89234 Ack=918 Win=1522 Len=0 TSval=527956 TSecr=373115090"
"153","2018-08-07 17:54:01.167396","192.168.2.3","216.58.197.4","TCP","1434","49253  >  443 [ACK] Seq=89234 Ack=918 Win=1522 Len=1368 TSval=527959 TSecr=373115090 [TCP segment of a reassembled PDU]"
"154","2018-08-07 17:54:01.167569","192.168.2.3","216.58.197.4","TCP","1434","49253  >  443 [ACK] Seq=90602 Ack=918 Win=1522 Len=1368 TSval=527959 TSecr=373115090 [TCP segment of a reassembled PDU]"
"155","2018-08-07 17:54:01.167571","192.168.2.3","216.58.197.4","TLSv1.2","212","Application Data"
"156","2018-08-07 17:54:01.168088","192.168.2.3","216.58.197.4","TLSv1.2","1290","Application Data"
"159","2018-08-07 17:54:01.263822","192.168.2.3","216.58.197.4","TCP","1434","49253  >  443 [ACK] Seq=93340 Ack=918 Win=1522 Len=1368 TSval=527969 TSecr=373115134 [TCP segment of a reassembled PDU]"
"160","2018-08-07 17:54:01.264080","192.168.2.3","216.58.197.4","TCP","1434","49253  >  443 [ACK] Seq=94708 Ack=918 Win=1522 Len=1368 TSval=527969 TSecr=373115134 [TCP segment of a reassembled PDU]"
"161","2018-08-07 17:54:01.264082","192.168.2.3","216.58.197.4","TLSv1.2","212","Application Data"
"162","2018-08-07 17:54:01.264188","192.168.2.3","216.58.197.4","TCP","1434","49253  >  443 [ACK] Seq=96222 Ack=918 Win=1522 Len=1368 TSval=527969 TSecr=373115134 [TCP segment of a reassembled PDU]"
"163","2018-08-07 17:54:01.264191","192.168.2.3","216.58.197.4","TLSv1.2","155","Application Data"
"167","2018-08-07 17:54:01.343804","192.168.2.3","216.58.197.4","TCP","66","49253  >  443 [ACK] Seq=97679 Ack=973 Win=1522 Len=0 TSval=527977 TSecr=373115262"
"168","2018-08-07 17:54:01.357379","192.168.2.3","216.58.197.4","TCP","1434","49253  >  443 [ACK] Seq=97679 Ack=973 Win=1522 Len=1368 TSval=527978 TSecr=373115262 [TCP segment of a reassembled PDU]"
"169","2018-08-07 17:54:01.357773","192.168.2.3","216.58.197.4","TCP","1434","49253  >  443 [ACK] Seq=99047 Ack=973 Win=1522 Len=1368 TSval=527978 TSecr=373115262 [TCP segment of a reassembled PDU]"
"170","2018-08-07 17:54:01.357774","192.168.2.3","216.58.197.4","TLSv1.2","212","Application Data"
"171","2018-08-07 17:54:01.357775","192.168.2.3","216.58.197.4","TCP","1434","49253  >  443 [ACK] Seq=100561 Ack=973 Win=1522 Len=1368 TSval=527978 TSecr=373115262 [TCP segment of a reassembled PDU]"
"172","2018-08-07 17:54:01.357776","192.168.2.3","216.58.197.4","TLSv1.2","155","Application Data"
"176","2018-08-07 17:54:01.485410","192.168.2.3","216.58.197.4","TCP","1434","49253  >  443 [ACK] Seq=102018 Ack=973 Win=1522 Len=1368 TSval=527991 TSecr=373115364 [TCP segment of a reassembled PDU]"
"177","2018-08-07 17:54:01.485785","192.168.2.3","216.58.197.4","TCP","1434","49253  >  443 [ACK] Seq=103386 Ack=973 Win=1522 Len=1368 TSval=527991 TSecr=373115364 [TCP segment of a reassembled PDU]"
"178","2018-08-07 17:54:01.485787","192.168.2.3","216.58.197.4","TLSv1.2","212","Application Data"
"179","2018-08-07 17:54:01.485789","192.168.2.3","216.58.197.4","TCP","1434","49253  >  443 [ACK] Seq=104900 Ack=973 Win=1522 Len=1368 TSval=527991 TSecr=373115364 [TCP segment of a reassembled PDU]"
"180","2018-08-07 17:54:01.486029","192.168.2.3","216.58.197.4","TLSv1.2","155","Application Data"
"184","2018-08-07 17:54:01.578375","192.168.2.3","216.58.197.4","TCP","1434","49253  >  443 [ACK] Seq=106357 Ack=973 Win=1522 Len=1368 TSval=528000 TSecr=373115452 [TCP segment of a reassembled PDU]"
"185","2018-08-07 17:54:01.578811","192.168.2.3","216.58.197.4","TCP","1434","49253  >  443 [ACK] Seq=107725 Ack=973 Win=1522 Len=1368 TSval=528000 TSecr=373115452 [TCP segment of a reassembled PDU]"
"186","2018-08-07 17:54:01.578813","192.168.2.3","216.58.197.4","TLSv1.2","212","Application Data"
"187","2018-08-07 17:54:01.580002","192.168.2.3","216.58.197.4","TCP","1434","49253  >  443 [ACK] Seq=109239 Ack=973 Win=1522 Len=1368 TSval=528001 TSecr=373115452 [TCP segment of a reassembled PDU]"
"188","2018-08-07 17:54:01.580005","192.168.2.3","216.58.197.4","TLSv1.2","155","Application Data"
"192","2018-08-07 17:54:01.690051","192.168.2.3","216.58.197.4","TCP","1434","49253  >  443 [ACK] Seq=110696 Ack=973 Win=1522 Len=1368 TSval=528011 TSecr=373115546 [TCP segment of a reassembled PDU]"
"193","2018-08-07 17:54:01.690055","192.168.2.3","216.58.197.4","TCP","1434","49253  >  443 [ACK] Seq=112064 Ack=973 Win=1522 Len=1368 TSval=528011 TSecr=373115546 [TCP segment of a reassembled PDU]"
"194","2018-08-07 17:54:01.690056","192.168.2.3","216.58.197.4","TLSv1.2","212","Application Data"
"195","2018-08-07 17:54:01.690325","192.168.2.3","216.58.197.4","TLSv1.2","997","Application Data"
"199","2018-08-07 17:54:01.753384","192.168.2.3","216.58.197.4","TCP","1434","49253  >  443 [ACK] Seq=114509 Ack=973 Win=1522 Len=1368 TSval=528018 TSecr=373115656 [TCP segment of a reassembled PDU]"
"200","2018-08-07 17:54:01.753606","192.168.2.3","216.58.197.4","TCP","1434","49253  >  443 [ACK] Seq=115877 Ack=973 Win=1522 Len=1368 TSval=528018 TSecr=373115656 [TCP segment of a reassembled PDU]"
"201","2018-08-07 17:54:01.753609","192.168.2.3","216.58.197.4","TLSv1.2","212","Application Data"
"202","2018-08-07 17:54:01.753610","192.168.2.3","216.58.197.4","TCP","1434","49253  >  443 [ACK] Seq=117391 Ack=973 Win=1522 Len=1368 TSval=528018 TSecr=373115656 [TCP segment of a reassembled PDU]"
"203","2018-08-07 17:54:01.753785","192.168.2.3","216.58.197.4","TLSv1.2","155","Application Data"
"206","2018-08-07 17:54:01.835537","192.168.2.3","216.58.197.4","TCP","1434","49253  >  443 [ACK] Seq=118848 Ack=973 Win=1522 Len=1368 TSval=528026 TSecr=373115720 [TCP segment of a reassembled PDU]"
"207","2018-08-07 17:54:01.836754","192.168.2.3","216.58.197.4","TCP","1434","49253  >  443 [ACK] Seq=120216 Ack=973 Win=1522 Len=1368 TSval=528026 TSecr=373115720 [TCP segment of a reassembled PDU]"
"208","2018-08-07 17:54:01.836961","192.168.2.3","216.58.197.4","TLSv1.2","212","Application Data"
"209","2018-08-07 17:54:01.836963","192.168.2.3","216.58.197.4","TCP","1434","49253  >  443 [ACK] Seq=121730 Ack=973 Win=1522 Len=1368 TSval=528026 TSecr=373115720 [TCP segment of a reassembled PDU]"
"210","2018-08-07 17:54:01.837378","192.168.2.3","216.58.197.4","TLSv1.2","155","Application Data"
"214","2018-08-07 17:54:01.930323","192.168.2.3","216.58.197.4","TCP","1434","49253  >  443 [ACK] Seq=123187 Ack=973 Win=1522 Len=1368 TSval=528036 TSecr=373115803 [TCP segment of a reassembled PDU]"
"215","2018-08-07 17:54:01.930327","192.168.2.3","216.58.197.4","TCP","1434","49253  >  443 [ACK] Seq=124555 Ack=973 Win=1522 Len=1368 TSval=528036 TSecr=373115803 [TCP segment of a reassembled PDU]"
"216","2018-08-07 17:54:01.930539","192.168.2.3","216.58.197.4","TLSv1.2","212","Application Data"
"217","2018-08-07 17:54:01.930541","192.168.2.3","216.58.197.4","TCP","1434","49253  >  443 [ACK] Seq=126069 Ack=973 Win=1522 Len=1368 TSval=528036 TSecr=373115803 [TCP segment of a reassembled PDU]"
"218","2018-08-07 17:54:01.930542","192.168.2.3","216.58.197.4","TLSv1.2","155","Application Data"
"223","2018-08-07 17:54:01.975104","192.168.2.3","216.58.197.4","TCP","66","49253  >  443 [ACK] Seq=127526 Ack=1224 Win=1522 Len=0 TSval=528040 TSecr=373115936"
"226","2018-08-07 17:54:01.984305","192.168.2.3","216.58.197.4","TCP","66","49253  >  443 [ACK] Seq=127526 Ack=1487 Win=1522 Len=0 TSval=528041 TSecr=373115945"
"228","2018-08-07 17:54:01.988631","192.168.2.3","216.58.197.4","TCP","66","49253  >  443 [ACK] Seq=127526 Ack=1654 Win=1522 Len=0 TSval=528042 TSecr=373115949"
"229","2018-08-07 17:54:02.025914","192.168.2.3","216.58.197.4","TCP","1434","49253  >  443 [ACK] Seq=127526 Ack=1654 Win=1522 Len=1368 TSval=528045 TSecr=373115949 [TCP segment of a reassembled PDU]"
"230","2018-08-07 17:54:02.026292","192.168.2.3","216.58.197.4","TCP","1434","49253  >  443 [ACK] Seq=128894 Ack=1654 Win=1522 Len=1368 TSval=528045 TSecr=373115949 [TCP segment of a reassembled PDU]"
"231","2018-08-07 17:54:02.026295","192.168.2.3","216.58.197.4","TLSv1.2","212","Application Data"
"232","2018-08-07 17:54:02.026296","192.168.2.3","216.58.197.4","TCP","1434","49253  >  443 [ACK] Seq=130408 Ack=1654 Win=1522 Len=1368 TSval=528045 TSecr=373115949 [TCP segment of a reassembled PDU]"
"233","2018-08-07 17:54:02.026404","192.168.2.3","216.58.197.4","TLSv1.2","155","Application Data"
"237","2018-08-07 17:54:02.124545","192.168.2.3","216.58.197.4","TCP","1434","49253  >  443 [ACK] Seq=131865 Ack=1654 Win=1522 Len=1368 TSval=528055 TSecr=373115992 [TCP segment of a reassembled PDU]"
"238","2018-08-07 17:54:02.124548","192.168.2.3","216.58.197.4","TCP","1434","49253  >  443 [ACK] Seq=133233 Ack=1654 Win=1522 Len=1368 TSval=528055 TSecr=373115992 [TCP segment of a reassembled PDU]"
"239","2018-08-07 17:54:02.124549","192.168.2.3","216.58.197.4","TLSv1.2","212","Application Data"
"240","2018-08-07 17:54:02.124961","192.168.2.3","216.58.197.4","TCP","1434","49253  >  443 [ACK] Seq=134747 Ack=1654 Win=1522 Len=1368 TSval=528055 TSecr=373115992 [TCP segment of a reassembled PDU]"
"241","2018-08-07 17:54:02.124963","192.168.2.3","216.58.197.4","TLSv1.2","155","Application Data"
"247","2018-08-07 17:54:02.191514","192.168.2.3","216.58.197.4","TCP","66","49253  >  443 [ACK] Seq=136204 Ack=2053 Win=1522 Len=0 TSval=528062 TSecr=373116152"
"248","2018-08-07 17:54:02.224698","192.168.2.3","216.58.197.4","TCP","1434","49253  >  443 [ACK] Seq=136204 Ack=2053 Win=1522 Len=1368 TSval=528065 TSecr=373116152 [TCP segment of a reassembled PDU]"
"249","2018-08-07 17:54:02.224708","192.168.2.3","216.58.197.4","TCP","1434","49253  >  443 [ACK] Seq=137572 Ack=2053 Win=1522 Len=1368 TSval=528065 TSecr=373116152 [TCP segment of a reassembled PDU]"
"250","2018-08-07 17:54:02.224778","192.168.2.3","216.58.197.4","TLSv1.2","212","Application Data"
"251","2018-08-07 17:54:02.225015","192.168.2.3","216.58.197.4","TCP","1434","49253  >  443 [ACK] Seq=139086 Ack=2053 Win=1522 Len=1368 TSval=528065 TSecr=373116152 [TCP segment of a reassembled PDU]"
"252","2018-08-07 17:54:02.225018","192.168.2.3","216.58.197.4","TLSv1.2","155","Application Data"
"258","2018-08-07 17:54:02.294228","192.168.2.3","216.58.197.4","TCP","66","49253  >  443 [ACK] Seq=140543 Ack=2238 Win=1522 Len=0 TSval=528072 TSecr=373116255"
"259","2018-08-07 17:54:02.317819","192.168.2.3","216.58.197.4","TCP","1434","49253  >  443 [ACK] Seq=140543 Ack=2238 Win=1522 Len=1368 TSval=528074 TSecr=373116255 [TCP segment of a reassembled PDU]"
"260","2018-08-07 17:54:02.318094","192.168.2.3","216.58.197.4","TCP","1434","49253  >  443 [ACK] Seq=141911 Ack=2238 Win=1522 Len=1368 TSval=528074 TSecr=373116255 [TCP segment of a reassembled PDU]"
"261","2018-08-07 17:54:02.318096","192.168.2.3","216.58.197.4","TLSv1.2","212","Application Data"
"262","2018-08-07 17:54:02.318462","192.168.2.3","216.58.197.4","TCP","1434","49253  >  443 [ACK] Seq=143425 Ack=2238 Win=1522 Len=1368 TSval=528074 TSecr=373116255 [TCP segment of a reassembled PDU]"
"263","2018-08-07 17:54:02.318465","192.168.2.3","216.58.197.4","TLSv1.2","155","Application Data"
"267","2018-08-07 17:54:02.409727","192.168.2.3","216.58.197.4","TCP","1434","49253  >  443 [ACK] Seq=144882 Ack=2238 Win=1522 Len=1368 TSval=528084 TSecr=373116284 [TCP segment of a reassembled PDU]"
"268","2018-08-07 17:54:02.410115","192.168.2.3","216.58.197.4","TCP","1434","49253  >  443 [ACK] Seq=146250 Ack=2238 Win=1522 Len=1368 TSval=528084 TSecr=373116284 [TCP segment of a reassembled PDU]"
"269","2018-08-07 17:54:02.410117","192.168.2.3","216.58.197.4","TLSv1.2","212","Application Data"
"270","2018-08-07 17:54:02.410357","192.168.2.3","216.58.197.4","TCP","1434","49253  >  443 [ACK] Seq=147764 Ack=2238 Win=1522 Len=1368 TSval=528084 TSecr=373116284 [TCP segment of a reassembled PDU]"
"271","2018-08-07 17:54:02.410359","192.168.2.3","216.58.197.4","TLSv1.2","155","Application Data"
"274","2018-08-07 17:54:02.510584","192.168.2.3","216.58.197.4","TCP","1434","49253  >  443 [ACK] Seq=149221 Ack=2238 Win=1522 Len=1368 TSval=528094 TSecr=373116376 [TCP segment of a reassembled PDU]"
"275","2018-08-07 17:54:02.510983","192.168.2.3","216.58.197.4","TCP","1434","49253  >  443 [ACK] Seq=150589 Ack=2238 Win=1522 Len=1368 TSval=528094 TSecr=373116376 [TCP segment of a reassembled PDU]"
"276","2018-08-07 17:54:02.510986","192.168.2.3","216.58.197.4","TLSv1.2","212","Application Data"
"277","2018-08-07 17:54:02.510986","192.168.2.3","216.58.197.4","TLSv1.2","698","Application Data"
"282","2018-08-07 17:54:02.573587","192.168.2.3","216.58.197.4","TCP","66","49253  >  443 [ACK] Seq=152735 Ack=2724 Win=1522 Len=0 TSval=528100 TSecr=373116534"
"284","2018-08-07 17:54:02.602702","192.168.2.3","216.58.197.4","TCP","1434","49253  >  443 [ACK] Seq=152735 Ack=2724 Win=1522 Len=1368 TSval=528103 TSecr=373116534 [TCP segment of a reassembled PDU]"
"285","2018-08-07 17:54:02.603194","192.168.2.3","216.58.197.4","TCP","1434","49253  >  443 [ACK] Seq=154103 Ack=2724 Win=1522 Len=1368 TSval=528103 TSecr=373116534 [TCP segment of a reassembled PDU]"
"286","2018-08-07 17:54:02.603197","192.168.2.3","216.58.197.4","TLSv1.2","212","Application Data"
"287","2018-08-07 17:54:02.603478","192.168.2.3","216.58.197.4","TCP","1434","49253  >  443 [ACK] Seq=155617 Ack=2724 Win=1522 Len=1368 TSval=528103 TSecr=373116534 [TCP segment of a reassembled PDU]"
"288","2018-08-07 17:54:02.603479","192.168.2.3","216.58.197.4","TLSv1.2","155","Application Data"
"292","2018-08-07 17:54:02.759396","192.168.2.3","216.58.197.4","TCP","1434","49253  >  443 [ACK] Seq=157074 Ack=2724 Win=1522 Len=1368 TSval=528116 TSecr=373116570 [TCP segment of a reassembled PDU]"
"293","2018-08-07 17:54:02.759402","192.168.2.3","216.58.197.4","TCP","1434","49253  >  443 [ACK] Seq=158442 Ack=2724 Win=1522 Len=1368 TSval=528116 TSecr=373116570 [TCP segment of a reassembled PDU]"
"294","2018-08-07 17:54:02.759672","192.168.2.3","216.58.197.4","TLSv1.2","212","Application Data"
"295","2018-08-07 17:54:02.759676","192.168.2.3","216.58.197.4","TCP","1434","49253  >  443 [ACK] Seq=159956 Ack=2724 Win=1522 Len=1368 TSval=528116 TSecr=373116570 [TCP segment of a reassembled PDU]"
"296","2018-08-07 17:54:02.759677","192.168.2.3","216.58.197.4","TLSv1.2","155","Application Data"
"301","2018-08-07 17:54:02.808515","192.168.2.3","216.58.197.4","TCP","66","49253  >  443 [ACK] Seq=161413 Ack=2767 Win=1522 Len=0 TSval=528124 TSecr=373116731"
"302","2018-08-07 17:54:02.829525","192.168.2.3","216.58.197.4","TCP","1434","49253  >  443 [ACK] Seq=161413 Ack=2767 Win=1522 Len=1368 TSval=528126 TSecr=373116731 [TCP segment of a reassembled PDU]"
"303","2018-08-07 17:54:02.829921","192.168.2.3","216.58.197.4","TCP","1434","49253  >  443 [ACK] Seq=162781 Ack=2767 Win=1522 Len=1368 TSval=528126 TSecr=373116731 [TCP segment of a reassembled PDU]"
"304","2018-08-07 17:54:02.829923","192.168.2.3","216.58.197.4","TLSv1.2","212","Application Data"
"305","2018-08-07 17:54:02.830333","192.168.2.3","216.58.197.4","TCP","1434","49253  >  443 [ACK] Seq=164295 Ack=2767 Win=1522 Len=1368 TSval=528126 TSecr=373116731 [TCP segment of a reassembled PDU]"
"306","2018-08-07 17:54:02.830336","192.168.2.3","216.58.197.4","TLSv1.2","155","Application Data"
"312","2018-08-07 17:54:02.898619","192.168.2.3","216.58.197.4","TCP","66","49253  >  443 [ACK] Seq=165752 Ack=3018 Win=1522 Len=0 TSval=528133 TSecr=373116858"
"313","2018-08-07 17:54:02.954451","192.168.2.3","216.58.197.4","TCP","1434","49253  >  443 [ACK] Seq=165752 Ack=3018 Win=1522 Len=1368 TSval=528138 TSecr=373116858 [TCP segment of a reassembled PDU]"
"314","2018-08-07 17:54:02.954692","192.168.2.3","216.58.197.4","TCP","1434","49253  >  443 [ACK] Seq=167120 Ack=3018 Win=1522 Len=1368 TSval=528138 TSecr=373116858 [TCP segment of a reassembled PDU]"
"315","2018-08-07 17:54:02.954696","192.168.2.3","216.58.197.4","TLSv1.2","212","Application Data"
"316","2018-08-07 17:54:02.955086","192.168.2.3","216.58.197.4","TCP","1434","49253  >  443 [ACK] Seq=168634 Ack=3018 Win=1522 Len=1368 TSval=528138 TSecr=373116858 [TCP segment of a reassembled PDU]"
"317","2018-08-07 17:54:02.955089","192.168.2.3","216.58.197.4","TLSv1.2","155","Application Data"
"322","2018-08-07 17:54:02.975946","192.168.2.3","216.58.197.4","TCP","66","49253  >  443 [ACK] Seq=170091 Ack=3108 Win=1522 Len=0 TSval=528140 TSecr=373116936"
"324","2018-08-07 17:54:02.988899","192.168.2.3","216.58.197.4","TCP","66","49253  >  443 [ACK] Seq=170091 Ack=3266 Win=1522 Len=0 TSval=528142 TSecr=373116949"
"325","2018-08-07 17:54:03.049787","192.168.2.3","216.58.197.4","TCP","1434","49253  >  443 [ACK] Seq=170091 Ack=3266 Win=1522 Len=1368 TSval=528148 TSecr=373116949 [TCP segment of a reassembled PDU]"
"326","2018-08-07 17:54:03.050123","192.168.2.3","216.58.197.4","TCP","1434","49253  >  443 [ACK] Seq=171459 Ack=3266 Win=1522 Len=1368 TSval=528148 TSecr=373116949 [TCP segment of a reassembled PDU]"
"327","2018-08-07 17:54:03.050125","192.168.2.3","216.58.197.4","TLSv1.2","212","Application Data"
"328","2018-08-07 17:54:03.050833","192.168.2.3","216.58.197.4","TCP","1434","49253  >  443 [ACK] Seq=172973 Ack=3266 Win=1522 Len=1368 TSval=528148 TSecr=373116949 [TCP segment of a reassembled PDU]"
"329","2018-08-07 17:54:03.050836","192.168.2.3","216.58.197.4","TLSv1.2","155","Application Data"
"331","2018-08-07 17:54:03.150647","192.168.2.3","216.58.197.4","TCP","1434","49253  >  443 [ACK] Seq=174430 Ack=3266 Win=1522 Len=1368 TSval=528158 TSecr=373117018 [TCP segment of a reassembled PDU]"
"332","2018-08-07 17:54:03.150650","192.168.2.3","216.58.197.4","TCP","1434","49253  >  443 [ACK] Seq=175798 Ack=3266 Win=1522 Len=1368 TSval=528158 TSecr=373117018 [TCP segment of a reassembled PDU]"
"333","2018-08-07 17:54:03.150861","192.168.2.3","216.58.197.4","TLSv1.2","212","Application Data"
"334","2018-08-07 17:54:03.150863","192.168.2.3","216.58.197.4","TCP","1434","49253  >  443 [ACK] Seq=177312 Ack=3266 Win=1522 Len=1368 TSval=528158 TSecr=373117018 [TCP segment of a reassembled PDU]"
"335","2018-08-07 17:54:03.151012","192.168.2.3","216.58.197.4","TLSv1.2","155","Application Data"
"341","2018-08-07 17:54:03.209019","192.168.2.3","216.58.197.4","TCP","66","49253  >  443 [ACK] Seq=178769 Ack=3488 Win=1522 Len=0 TSval=528163 TSecr=373117167"
"342","2018-08-07 17:54:03.276385","192.168.2.3","216.58.197.4","TCP","1434","49253  >  443 [ACK] Seq=178769 Ack=3488 Win=1522 Len=1368 TSval=528170 TSecr=373117167 [TCP segment of a reassembled PDU]"
"343","2018-08-07 17:54:03.276828","192.168.2.3","216.58.197.4","TCP","1434","49253  >  443 [ACK] Seq=180137 Ack=3488 Win=1522 Len=1368 TSval=528170 TSecr=373117167 [TCP segment of a reassembled PDU]"
"344","2018-08-07 17:54:03.276831","192.168.2.3","216.58.197.4","TLSv1.2","212","Application Data"
"345","2018-08-07 17:54:03.276832","192.168.2.3","216.58.197.4","TCP","1434","49253  >  443 [ACK] Seq=181651 Ack=3488 Win=1522 Len=1368 TSval=528170 TSecr=373117167 [TCP segment of a reassembled PDU]"
"346","2018-08-07 17:54:03.276833","192.168.2.3","216.58.197.4","TLSv1.2","108","Application Data"
"352","2018-08-07 17:54:03.335989","192.168.2.3","216.58.197.4","TCP","66","49253  >  443 [ACK] Seq=183061 Ack=3827 Win=1522 Len=0 TSval=528176 TSecr=373117294"
"353","2018-08-07 17:54:03.369451","192.168.2.3","216.58.197.4","TCP","1434","49253  >  443 [ACK] Seq=183061 Ack=3827 Win=1522 Len=1368 TSval=528180 TSecr=373117294 [TCP segment of a reassembled PDU]"
"354","2018-08-07 17:54:03.369847","192.168.2.3","216.58.197.4","TCP","1434","49253  >  443 [ACK] Seq=184429 Ack=3827 Win=1522 Len=1368 TSval=528180 TSecr=373117294 [TCP segment of a reassembled PDU]"
"355","2018-08-07 17:54:03.369849","192.168.2.3","216.58.197.4","TLSv1.2","212","Application Data"
"356","2018-08-07 17:54:03.369849","192.168.2.3","216.58.197.4","TCP","1434","49253  >  443 [ACK] Seq=185943 Ack=3827 Win=1522 Len=1368 TSval=528180 TSecr=373117294 [TCP segment of a reassembled PDU]"
"357","2018-08-07 17:54:03.370001","192.168.2.3","216.58.197.4","TLSv1.2","155","Application Data"
"358","2018-08-07 17:54:03.370797","192.168.2.3","216.58.197.4","TLSv1.2","1016","Application Data"
"359","2018-08-07 17:54:03.370799","192.168.2.3","216.58.197.4","TLSv1.2","102","Application Data"
"365","2018-08-07 17:54:03.421230","192.168.2.3","216.58.197.4","TCP","66","49253  >  443 [ACK] Seq=188386 Ack=4685 Win=1522 Len=0 TSval=528185 TSecr=373117377"
"367","2018-08-07 17:54:03.636700","192.168.2.3","216.58.197.4","TCP","66","49253  >  443 [ACK] Seq=188386 Ack=4883 Win=1522 Len=0 TSval=528206 TSecr=373117595"
"369","2018-08-07 17:54:03.680917","192.168.2.3","216.58.197.4","TCP","66","49253  >  443 [ACK] Seq=188386 Ack=6156 Win=1522 Len=0 TSval=528211 TSecr=373117640"
"380","2018-08-07 17:54:03.699126","192.168.2.3","216.58.197.4","TCP","66","49253  >  443 [ACK] Seq=188386 Ack=11448 Win=1522 Len=0 TSval=528213 TSecr=373117655"
"381","2018-08-07 17:54:03.699567","192.168.2.3","216.58.197.4","TCP","66","49253  >  443 [ACK] Seq=188386 Ack=14950 Win=1522 Len=0 TSval=528213 TSecr=373117655"
"384","2018-08-07 17:54:03.703208","192.168.2.3","216.58.197.4","TCP","66","49253  >  443 [ACK] Seq=188386 Ack=15402 Win=1522 Len=0 TSval=528213 TSecr=373117662"
"385","2018-08-07 17:54:03.703210","192.168.2.3","216.58.197.4","TCP","66","49253  >  443 [ACK] Seq=188386 Ack=15546 Win=1522 Len=0 TSval=528213 TSecr=373117662"
"392","2018-08-07 17:54:03.864469","192.168.2.3","216.58.197.4","TCP","66","49253  >  443 [ACK] Seq=188386 Ack=15729 Win=1522 Len=0 TSval=528229 TSecr=373117825"
"393","2018-08-07 17:54:03.865170","192.168.2.3","216.58.197.4","TCP","66","49253  >  443 [ACK] Seq=188386 Ack=15794 Win=1522 Len=0 TSval=528229 TSecr=373117825"
"394","2018-08-07 17:54:03.869508","192.168.2.3","216.58.197.4","TCP","66","49253  >  443 [ACK] Seq=188386 Ack=16003 Win=1522 Len=0 TSval=528229 TSecr=373117825"
"395","2018-08-07 17:54:03.870787","192.168.2.3","216.58.197.4","TCP","66","49253  >  443 [ACK] Seq=188386 Ack=16173 Win=1522 Len=0 TSval=528230 TSecr=373117826"
"396","2018-08-07 17:54:03.876277","192.168.2.3","216.58.197.4","TLSv1.2","104","Application Data"
"398","2018-08-07 17:54:04.130866","192.168.2.3","64.233.188.188","TCP","66","40306  >  5228 [ACK] Seq=1 Ack=1 Win=539 Len=0 TSval=528256 TSecr=3578532127"
"400","2018-08-07 17:54:05.773747","192.168.2.3","172.217.27.174","TLSv1.2","156","Application Data"
"401","2018-08-07 17:54:05.773751","192.168.2.3","172.217.27.174","TLSv1.2","104","Application Data"
"402","2018-08-07 17:54:05.773752","192.168.2.3","172.217.27.174","TLSv1.2","501","Application Data"
"407","2018-08-07 17:54:05.818646","192.168.2.3","172.217.27.174","TCP","66","52258  >  443 [ACK] Seq=564 Ack=39 Win=661 Len=0 TSval=528425 TSecr=2575564349"
"412","2018-08-07 17:54:05.854709","192.168.2.3","172.217.27.174","TCP","66","52258  >  443 [ACK] Seq=564 Ack=107 Win=661 Len=0 TSval=528428 TSecr=2575564421"
"413","2018-08-07 17:54:05.855121","192.168.2.3","172.217.27.174","TCP","66","52258  >  443 [ACK] Seq=564 Ack=310 Win=661 Len=0 TSval=528428 TSecr=2575564421"
"414","2018-08-07 17:54:05.855123","192.168.2.3","172.217.27.174","TCP","66","52258  >  443 [ACK] Seq=564 Ack=448 Win=661 Len=0 TSval=528428 TSecr=2575564422"
"415","2018-08-07 17:54:05.855124","192.168.2.3","172.217.27.174","TCP","66","52258  >  443 [ACK] Seq=564 Ack=486 Win=661 Len=0 TSval=528428 TSecr=2575564422"
"416","2018-08-07 17:54:05.856123","192.168.2.3","172.217.27.174","TLSv1.2","104","Application Data"
"419","2018-08-07 17:54:12.551756","192.168.2.3","224.0.0.251","MDNS","82","Standard query 0x0000 PTR _googlecast._tcp.local, ""QM"" question"
"420","2018-08-07 17:54:12.552035","192.168.2.3","224.0.0.251","MDNS","437","Standard query response 0x0000 PTR Google-Home-d8ff63fb78680c8a1c8ccacd5fd7f560._googlecast._tcp.local TXT, cache flush SRV, cache flush 0 0 8009 d8ff63fb-7868-0c8a-1c8c-cacd5fd7f560.local A, cache flush 192.168.2.3"
"421","2018-08-07 17:54:12.557507","192.168.2.3","224.0.0.251","MDNS","82","Standard query 0x0000 PTR _googlezone._tcp.local, ""QM"" question"
"422","2018-08-07 17:54:12.557509","192.168.2.3","224.0.0.251","MDNS","119","Standard query 0x0000 SRV d8ff63fb-7868-0c8a-1c8c-cacd5fd7f560._googlezone._tcp.local, ""QM"" question"
"423","2018-08-07 17:54:12.557509","192.168.2.3","224.0.0.251","MDNS","321","Standard query response 0x0000 PTR d8ff63fb-7868-0c8a-1c8c-cacd5fd7f560._googlezone._tcp.local TXT, cache flush SRV, cache flush 210 70 10001 d8ff63fb-7868-0c8a-1c8c-cacd5fd7f560.local A, cache flush 192.168.2.3"
"424","2018-08-07 17:54:12.557510","192.168.2.3","224.0.0.251","MDNS","186","Standard query response 0x0000 SRV, cache flush 210 70 10001 d8ff63fb-7868-0c8a-1c8c-cacd5fd7f560.local A, cache flush 192.168.2.3"
"426","2018-08-07 17:54:22.688841","192.168.2.3","108.177.125.188","TCP","66","50384  >  5228 [ACK] Seq=1 Ack=1 Win=262 Len=0 TSval=530112 TSecr=2744628463"
"428","2018-08-07 17:54:25.966432","192.168.2.3","192.168.2.1","ICMP","98","Echo (ping) request  id=0x0e36, seq=1/256, ttl=64 (reply in 429)"
"430","2018-08-07 17:54:26.979235","192.168.2.3","192.168.2.1","ICMP","98","Echo (ping) request  id=0x0e36, seq=2/512, ttl=64 (reply in 431)"
"432","2018-08-07 17:54:27.005563","192.168.2.3","8.8.8.8","ICMP","98","Echo (ping) request  id=0x0e3c, seq=1/256, ttl=64 (reply in 433)"
"434","2018-08-07 17:54:28.029544","192.168.2.3","8.8.8.8","ICMP","98","Echo (ping) request  id=0x0e3c, seq=2/512, ttl=64 (reply in 435)"
"436","2018-08-07 17:54:28.041329","192.168.2.3","8.8.8.8","DNS","74","Standard query 0xecb9 A www.google.com"
"437","2018-08-07 17:54:28.041331","192.168.2.3","8.8.8.8","DNS","74","Standard query 0x4d70 AAAA www.google.com"
"441","2018-08-07 17:54:35.168953","192.168.2.3","172.217.27.174","TCP","66","[TCP Dup ACK 2#1] 52293  >  443 [ACK] Seq=1 Ack=1 Win=661 Len=0 TSval=531360 TSecr=874773125"
"444","2018-08-07 17:54:41.970595","192.168.2.3","172.217.27.163","TCP","66","[TCP Keep-Alive] 38971  >  443 [ACK] Seq=179 Ack=117 Win=406 Len=0 TSval=532040 TSecr=467385977"
"446","2018-08-07 17:54:48.892776","192.168.2.3","216.58.197.4","TCP","66","[TCP Keep-Alive] 49253  >  443 [ACK] Seq=188423 Ack=16173 Win=1522 Len=0 TSval=532732 TSecr=373117842"
"448","2018-08-07 17:54:49.249074","192.168.2.3","64.233.188.188","TCP","66","[TCP Dup ACK 398#1] 40306  >  5228 [ACK] Seq=1 Ack=1 Win=539 Len=0 TSval=532768 TSecr=3578577244"
"450","2018-08-07 17:54:51.025133","192.168.2.3","172.217.27.174","TCP","66","[TCP Keep-Alive] 52258  >  443 [ACK] Seq=601 Ack=486 Win=661 Len=0 TSval=532944 TSecr=2575564470"
"452","2018-08-07 17:54:52.618684","192.168.2.3","108.177.125.188","TCP","91","[TCP Previous segment not captured] 50384  >  5228 [PSH, ACK] Seq=2 Ack=1 Win=262 Len=25 TSval=533104 TSecr=2744673499"
"454","2018-08-07 17:54:52.661890","192.168.2.3","108.177.125.188","TCP","66","50384  >  5228 [ACK] Seq=27 Ack=26 Win=262 Len=0 TSval=533109 TSecr=2744703430"
"455","2018-08-07 17:54:56.769349","192.168.2.3","239.255.255.250","SSDP","136","M-SEARCH * HTTP/1.1 "
"456","2018-08-07 17:54:56.939147","192.168.2.3","172.217.27.163","TLSv1.2","135","Application Data"
"457","2018-08-07 17:54:56.939152","192.168.2.3","172.217.27.163","TLSv1.2","104","Application Data"
"460","2018-08-07 17:54:56.948044","192.168.2.3","172.217.27.163","TCP","66","38971  >  443 [ACK] Seq=287 Ack=233 Win=406 Len=0 TSval=533537 TSecr=467445992"
"461","2018-08-07 17:54:56.948615","192.168.2.3","172.217.27.163","TLSv1.2","100","Application Data"
"462","2018-08-07 17:54:56.948876","192.168.2.3","172.217.27.163","TLSv1.2","104","Application Data"
"464","2018-08-07 17:55:11.790525","192.168.2.3","216.58.197.4","TLSv1.2","156","Application Data"
"465","2018-08-07 17:55:11.790529","192.168.2.3","216.58.197.4","TLSv1.2","104","Application Data"
"469","2018-08-07 17:55:11.799982","192.168.2.3","216.58.197.4","TLSv1.2","158","Application Data"
"470","2018-08-07 17:55:11.828893","192.168.2.3","216.58.197.4","TCP","1434","49253  >  443 [ACK] Seq=188644 Ack=16211 Win=1522 Len=1368 TSval=535025 TSecr=373185757 [TCP segment of a reassembled PDU]"
"471","2018-08-07 17:55:11.829305","192.168.2.3","216.58.197.4","TCP","1434","49253  >  443 [ACK] Seq=190012 Ack=16211 Win=1522 Len=1368 TSval=535025 TSecr=373185757 [TCP segment of a reassembled PDU]"
"472","2018-08-07 17:55:11.829308","192.168.2.3","216.58.197.4","TLSv1.2","212","Application Data"
"473","2018-08-07 17:55:11.829309","192.168.2.3","216.58.197.4","TCP","1434","49253  >  443 [ACK] Seq=191526 Ack=16211 Win=1522 Len=1368 TSval=535025 TSecr=373185757 [TCP segment of a reassembled PDU]"
"474","2018-08-07 17:55:11.829436","192.168.2.3","216.58.197.4","TLSv1.2","450","Application Data"
"475","2018-08-07 17:55:11.829879","192.168.2.3","216.58.197.4","TCP","1434","49253  >  443 [ACK] Seq=193278 Ack=16211 Win=1522 Len=1368 TSval=535026 TSecr=373185757 [TCP segment of a reassembled PDU]"
"476","2018-08-07 17:55:11.830402","192.168.2.3","216.58.197.4","TCP","1434","49253  >  443 [ACK] Seq=194646 Ack=16211 Win=1522 Len=1368 TSval=535026 TSecr=373185757 [TCP segment of a reassembled PDU]"
"477","2018-08-07 17:55:11.830404","192.168.2.3","216.58.197.4","TLSv1.2","212","Application Data"
"478","2018-08-07 17:55:11.830405","192.168.2.3","216.58.197.4","TCP","1434","49253  >  443 [ACK] Seq=196160 Ack=16211 Win=1522 Len=1368 TSval=535026 TSecr=373185757 [TCP segment of a reassembled PDU]"
"483","2018-08-07 17:55:11.836202","192.168.2.3","216.58.197.4","TLSv1.2","1434","Application Data [TCP segment of a reassembled PDU]"
"484","2018-08-07 17:55:11.836680","192.168.2.3","216.58.197.4","TCP","1434","49253  >  443 [ACK] Seq=198896 Ack=16211 Win=1522 Len=1368 TSval=535026 TSecr=373185795 [TCP segment of a reassembled PDU]"
"485","2018-08-07 17:55:11.836683","192.168.2.3","216.58.197.4","TLSv1.2","1434","Application Data [TCP segment of a reassembled PDU]"
"486","2018-08-07 17:55:11.838122","192.168.2.3","216.58.197.4","TLSv1.2","1434","Application Data [TCP segment of a reassembled PDU]"
"487","2018-08-07 17:55:11.838489","192.168.2.3","216.58.197.4","TCP","1434","49253  >  443 [ACK] Seq=203000 Ack=16211 Win=1522 Len=1368 TSval=535026 TSecr=373185796 [TCP segment of a reassembled PDU]"
"488","2018-08-07 17:55:11.838491","192.168.2.3","216.58.197.4","TLSv1.2","1434","Application Data [TCP segment of a reassembled PDU]"
"489","2018-08-07 17:55:11.838721","192.168.2.3","216.58.197.4","TLSv1.2","1434","Application Data [TCP segment of a reassembled PDU]"
"490","2018-08-07 17:55:11.838905","192.168.2.3","216.58.197.4","TCP","1434","49253  >  443 [ACK] Seq=207104 Ack=16211 Win=1522 Len=1368 TSval=535026 TSecr=373185796 [TCP segment of a reassembled PDU]"
"491","2018-08-07 17:55:11.839233","192.168.2.3","216.58.197.4","TLSv1.2","1434","Application Data [TCP segment of a reassembled PDU]"
"492","2018-08-07 17:55:11.839248","192.168.2.3","216.58.197.4","TLSv1.2","1434","Application Data [TCP segment of a reassembled PDU]"
"493","2018-08-07 17:55:11.839426","192.168.2.3","216.58.197.4","TCP","1434","49253  >  443 [ACK] Seq=211208 Ack=16211 Win=1522 Len=1368 TSval=535026 TSecr=373185797 [TCP segment of a reassembled PDU]"
"494","2018-08-07 17:55:11.839806","192.168.2.3","216.58.197.4","TLSv1.2","1434","Application Data [TCP segment of a reassembled PDU]"
"495","2018-08-07 17:55:11.839808","192.168.2.3","216.58.197.4","TLSv1.2","1434","Application Data [TCP segment of a reassembled PDU]"
"496","2018-08-07 17:55:11.840182","192.168.2.3","216.58.197.4","TCP","1434","49253  >  443 [ACK] Seq=215312 Ack=16211 Win=1522 Len=1368 TSval=535026 TSecr=373185797 [TCP segment of a reassembled PDU]"
"499","2018-08-07 17:55:11.848935","192.168.2.3","216.58.197.4","TLSv1.2","1434","Application Data [TCP segment of a reassembled PDU]"
"500","2018-08-07 17:55:11.849414","192.168.2.3","216.58.197.4","TLSv1.2","1434","Application Data [TCP segment of a reassembled PDU]"
"501","2018-08-07 17:55:11.849418","192.168.2.3","216.58.197.4","TCP","1434","49253  >  443 [ACK] Seq=219416 Ack=16211 Win=1522 Len=1368 TSval=535027 TSecr=373185806 [TCP segment of a reassembled PDU]"
"502","2018-08-07 17:55:11.849681","192.168.2.3","216.58.197.4","TCP","1434","49253  >  443 [ACK] Seq=220784 Ack=16211 Win=1522 Len=1368 TSval=535027 TSecr=373185806 [TCP segment of a reassembled PDU]"
"503","2018-08-07 17:55:11.849683","192.168.2.3","216.58.197.4","TLSv1.2","1434","Application Data [TCP segment of a reassembled PDU]"
"504","2018-08-07 17:55:11.850002","192.168.2.3","216.58.197.4","TLSv1.2","1434","Application Data [TCP segment of a reassembled PDU]"
"505","2018-08-07 17:55:11.850018","192.168.2.3","216.58.197.4","TCP","1434","49253  >  443 [ACK] Seq=224888 Ack=16211 Win=1522 Len=1368 TSval=535027 TSecr=373185806 [TCP segment of a reassembled PDU]"
"506","2018-08-07 17:55:11.850386","192.168.2.3","216.58.197.4","TLSv1.2","1434","Application Data [TCP segment of a reassembled PDU]"
"507","2018-08-07 17:55:11.851125","192.168.2.3","216.58.197.4","TLSv1.2","1434","Application Data [TCP segment of a reassembled PDU]"
"508","2018-08-07 17:55:11.851129","192.168.2.3","216.58.197.4","TCP","1434","49253  >  443 [ACK] Seq=228992 Ack=16211 Win=1522 Len=1368 TSval=535027 TSecr=373185806 [TCP segment of a reassembled PDU]"
"509","2018-08-07 17:55:11.851287","192.168.2.3","216.58.197.4","TLSv1.2","1434","Application Data [TCP segment of a reassembled PDU]"
"510","2018-08-07 17:55:11.851457","192.168.2.3","216.58.197.4","TLSv1.2","1434","Application Data [TCP segment of a reassembled PDU]"
"511","2018-08-07 17:55:11.851597","192.168.2.3","216.58.197.4","TCP","1434","49253  >  443 [ACK] Seq=233096 Ack=16211 Win=1522 Len=1368 TSval=535027 TSecr=373185806 [TCP segment of a reassembled PDU]"
"512","2018-08-07 17:55:11.851954","192.168.2.3","216.58.197.4","TLSv1.2","1434","Application Data [TCP segment of a reassembled PDU]"
"513","2018-08-07 17:55:11.851957","192.168.2.3","216.58.197.4","TLSv1.2","1434","Application Data [TCP segment of a reassembled PDU]"
"522","2018-08-07 17:55:11.857155","192.168.2.3","216.58.197.4","TCP","1434","49253  >  443 [ACK] Seq=237200 Ack=16211 Win=1522 Len=1368 TSval=535028 TSecr=373185816 [TCP segment of a reassembled PDU]"
"523","2018-08-07 17:55:11.857160","192.168.2.3","216.58.197.4","TLSv1.2","1434","Application Data [TCP segment of a reassembled PDU]"
"524","2018-08-07 17:55:11.857318","192.168.2.3","216.58.197.4","TLSv1.2","1434","Application Data [TCP segment of a reassembled PDU]"
"525","2018-08-07 17:55:11.857473","192.168.2.3","216.58.197.4","TCP","1434","49253  >  443 [PSH, ACK] Seq=241304 Ack=16211 Win=1522 Len=1368 TSval=535028 TSecr=373185816 [TCP segment of a reassembled PDU]"
"526","2018-08-07 17:55:11.857604","192.168.2.3","216.58.197.4","TLSv1.2","1434","Application Data [TCP segment of a reassembled PDU]"
"527","2018-08-07 17:55:11.857841","192.168.2.3","216.58.197.4","TLSv1.2","1434","Application Data [TCP segment of a reassembled PDU]"
"528","2018-08-07 17:55:11.858335","192.168.2.3","216.58.197.4","TLSv1.2","1434","Application Data [TCP segment of a reassembled PDU]"
"529","2018-08-07 17:55:11.858579","192.168.2.3","216.58.197.4","TCP","1434","49253  >  443 [ACK] Seq=246776 Ack=16211 Win=1522 Len=1368 TSval=535028 TSecr=373185816 [TCP segment of a reassembled PDU]"
"530","2018-08-07 17:55:11.858582","192.168.2.3","216.58.197.4","TLSv1.2","1434","Application Data [TCP segment of a reassembled PDU]"
"534","2018-08-07 17:55:11.862468","192.168.2.3","216.58.197.4","TLSv1.2","1434","Application Data [TCP segment of a reassembled PDU]"
"535","2018-08-07 17:55:11.862470","192.168.2.3","216.58.197.4","TCP","1434","49253  >  443 [ACK] Seq=250880 Ack=16211 Win=1522 Len=1368 TSval=535028 TSecr=373185816 [TCP segment of a reassembled PDU]"
"536","2018-08-07 17:55:11.862621","192.168.2.3","216.58.197.4","TLSv1.2","1434","Application Data [TCP segment of a reassembled PDU]"
"537","2018-08-07 17:55:11.862905","192.168.2.3","216.58.197.4","TCP","1434","49253  >  443 [ACK] Seq=253616 Ack=16211 Win=1522 Len=1368 TSval=535029 TSecr=373185817 [TCP segment of a reassembled PDU]"
"538","2018-08-07 17:55:11.862907","192.168.2.3","216.58.197.4","TLSv1.2","130","Application Data"
"543","2018-08-07 17:55:11.889584","192.168.2.3","216.58.197.4","TCP","1434","49253  >  443 [ACK] Seq=255048 Ack=16211 Win=1522 Len=1368 TSval=535031 TSecr=373185829 [TCP segment of a reassembled PDU]"
"544","2018-08-07 17:55:11.890113","192.168.2.3","216.58.197.4","TCP","1434","49253  >  443 [ACK] Seq=256416 Ack=16211 Win=1522 Len=1368 TSval=535031 TSecr=373185829 [TCP segment of a reassembled PDU]"
"545","2018-08-07 17:55:11.890115","192.168.2.3","216.58.197.4","TLSv1.2","212","Application Data"
"546","2018-08-07 17:55:11.890511","192.168.2.3","216.58.197.4","TCP","1434","49253  >  443 [ACK] Seq=257930 Ack=16211 Win=1522 Len=1368 TSval=535031 TSecr=373185829 [TCP segment of a reassembled PDU]"
"547","2018-08-07 17:55:11.890513","192.168.2.3","216.58.197.4","TLSv1.2","155","Application Data"
"551","2018-08-07 17:55:11.978418","192.168.2.3","216.58.197.4","TCP","1434","49253  >  443 [ACK] Seq=259387 Ack=16211 Win=1522 Len=1368 TSval=535040 TSecr=373185896 [TCP segment of a reassembled PDU]"
"552","2018-08-07 17:55:11.978850","192.168.2.3","216.58.197.4","TCP","1434","49253  >  443 [ACK] Seq=260755 Ack=16211 Win=1522 Len=1368 TSval=535040 TSecr=373185896 [TCP segment of a reassembled PDU]"
"553","2018-08-07 17:55:11.978852","192.168.2.3","216.58.197.4","TLSv1.2","212","Application Data"
"554","2018-08-07 17:55:11.978853","192.168.2.3","216.58.197.4","TCP","1434","49253  >  443 [ACK] Seq=262269 Ack=16211 Win=1522 Len=1368 TSval=535040 TSecr=373185896 [TCP segment of a reassembled PDU]"
"555","2018-08-07 17:55:11.978994","192.168.2.3","216.58.197.4","TLSv1.2","155","Application Data"
"562","2018-08-07 17:55:12.065442","192.168.2.3","216.58.197.4","TCP","66","49253  >  443 [ACK] Seq=263726 Ack=16650 Win=1522 Len=0 TSval=535049 TSecr=373186022"
"564","2018-08-07 17:55:12.083636","192.168.2.3","216.58.197.4","TCP","1434","49253  >  443 [ACK] Seq=263726 Ack=16747 Win=1522 Len=1368 TSval=535051 TSecr=373186035 [TCP segment of a reassembled PDU]"
"565","2018-08-07 17:55:12.084174","192.168.2.3","216.58.197.4","TCP","1434","49253  >  443 [ACK] Seq=265094 Ack=16747 Win=1522 Len=1368 TSval=535051 TSecr=373186035 [TCP segment of a reassembled PDU]"
"566","2018-08-07 17:55:12.084177","192.168.2.3","216.58.197.4","TLSv1.2","212","Application Data"
"567","2018-08-07 17:55:12.084178","192.168.2.3","216.58.197.4","TLSv1.2","785","Application Data"
"570","2018-08-07 17:55:12.204538","192.168.2.3","216.58.197.4","TCP","1434","49253  >  443 [ACK] Seq=267327 Ack=17003 Win=1522 Len=1368 TSval=535063 TSecr=373186141 [TCP segment of a reassembled PDU]"
"571","2018-08-07 17:55:12.204543","192.168.2.3","216.58.197.4","TCP","1434","49253  >  443 [ACK] Seq=268695 Ack=17003 Win=1522 Len=1368 TSval=535063 TSecr=373186141 [TCP segment of a reassembled PDU]"
"572","2018-08-07 17:55:12.204545","192.168.2.3","216.58.197.4","TLSv1.2","212","Application Data"
"573","2018-08-07 17:55:12.204644","192.168.2.3","216.58.197.4","TCP","1434","49253  >  443 [ACK] Seq=270209 Ack=17003 Win=1522 Len=1368 TSval=535063 TSecr=373186141 [TCP segment of a reassembled PDU]"
"574","2018-08-07 17:55:12.204798","192.168.2.3","216.58.197.4","TLSv1.2","147","Application Data"
"578","2018-08-07 17:55:12.295995","192.168.2.3","216.58.197.4","TCP","1434","49253  >  443 [ACK] Seq=271658 Ack=17003 Win=1522 Len=1368 TSval=535072 TSecr=373186171 [TCP segment of a reassembled PDU]"
"579","2018-08-07 17:55:12.296270","192.168.2.3","216.58.197.4","TCP","1434","49253  >  443 [ACK] Seq=273026 Ack=17003 Win=1522 Len=1368 TSval=535072 TSecr=373186171 [TCP segment of a reassembled PDU]"
"580","2018-08-07 17:55:12.296273","192.168.2.3","216.58.197.4","TLSv1.2","212","Application Data"
"581","2018-08-07 17:55:12.296274","192.168.2.3","216.58.197.4","TCP","1434","49253  >  443 [ACK] Seq=274540 Ack=17003 Win=1522 Len=1368 TSval=535072 TSecr=373186171 [TCP segment of a reassembled PDU]"
"582","2018-08-07 17:55:12.296637","192.168.2.3","216.58.197.4","TLSv1.2","155","Application Data"
"586","2018-08-07 17:55:12.369318","192.168.2.3","216.58.197.4","TCP","66","49253  >  443 [ACK] Seq=275997 Ack=17172 Win=1522 Len=0 TSval=535080 TSecr=373186289"
"587","2018-08-07 17:55:12.392176","192.168.2.3","216.58.197.4","TCP","1434","49253  >  443 [ACK] Seq=275997 Ack=17172 Win=1522 Len=1368 TSval=535082 TSecr=373186289 [TCP segment of a reassembled PDU]"
"588","2018-08-07 17:55:12.395529","192.168.2.3","216.58.197.4","TCP","1434","49253  >  443 [ACK] Seq=277365 Ack=17172 Win=1522 Len=1368 TSval=535082 TSecr=373186289 [TCP segment of a reassembled PDU]"
"589","2018-08-07 17:55:12.395536","192.168.2.3","216.58.197.4","TLSv1.2","212","Application Data"
"590","2018-08-07 17:55:12.395537","192.168.2.3","216.58.197.4","TCP","1434","49253  >  443 [ACK] Seq=278879 Ack=17172 Win=1522 Len=1368 TSval=535082 TSecr=373186289 [TCP segment of a reassembled PDU]"
"591","2018-08-07 17:55:12.395733","192.168.2.3","216.58.197.4","TLSv1.2","155","Application Data"
"595","2018-08-07 17:55:12.485982","192.168.2.3","216.58.197.4","TCP","1434","49253  >  443 [ACK] Seq=280336 Ack=17172 Win=1522 Len=1368 TSval=535091 TSecr=373186402 [TCP segment of a reassembled PDU]"
"596","2018-08-07 17:55:12.486295","192.168.2.3","216.58.197.4","TCP","1434","49253  >  443 [ACK] Seq=281704 Ack=17172 Win=1522 Len=1368 TSval=535091 TSecr=373186402 [TCP segment of a reassembled PDU]"
"597","2018-08-07 17:55:12.488537","192.168.2.3","216.58.197.4","TLSv1.2","212","Application Data"
"598","2018-08-07 17:55:12.488955","192.168.2.3","216.58.197.4","TCP","1434","49253  >  443 [ACK] Seq=283218 Ack=17172 Win=1522 Len=1368 TSval=535091 TSecr=373186402 [TCP segment of a reassembled PDU]"
"599","2018-08-07 17:55:12.488957","192.168.2.3","216.58.197.4","TLSv1.2","155","Application Data"
"603","2018-08-07 17:55:12.586683","192.168.2.3","216.58.197.4","TCP","1434","49253  >  443 [ACK] Seq=284675 Ack=17172 Win=1522 Len=1368 TSval=535101 TSecr=373186456 [TCP segment of a reassembled PDU]"
"604","2018-08-07 17:55:12.586688","192.168.2.3","216.58.197.4","TCP","1434","49253  >  443 [ACK] Seq=286043 Ack=17172 Win=1522 Len=1368 TSval=535101 TSecr=373186456 [TCP segment of a reassembled PDU]"
"605","2018-08-07 17:55:12.586689","192.168.2.3","216.58.197.4","TLSv1.2","212","Application Data"
"606","2018-08-07 17:55:12.586985","192.168.2.3","216.58.197.4","TCP","1434","49253  >  443 [ACK] Seq=287557 Ack=17172 Win=1522 Len=1368 TSval=535101 TSecr=373186456 [TCP segment of a reassembled PDU]"
"607","2018-08-07 17:55:12.586988","192.168.2.3","216.58.197.4","TLSv1.2","155","Application Data"
"611","2018-08-07 17:55:12.676382","192.168.2.3","216.58.197.4","TCP","1434","49253  >  443 [ACK] Seq=289014 Ack=17172 Win=1522 Len=1368 TSval=535110 TSecr=373186553 [TCP segment of a reassembled PDU]"
"612","2018-08-07 17:55:12.676389","192.168.2.3","216.58.197.4","TCP","1434","49253  >  443 [ACK] Seq=290382 Ack=17172 Win=1522 Len=1368 TSval=535110 TSecr=373186553 [TCP segment of a reassembled PDU]"
"613","2018-08-07 17:55:12.676390","192.168.2.3","216.58.197.4","TLSv1.2","212","Application Data"
"614","2018-08-07 17:55:12.676571","192.168.2.3","216.58.197.4","TCP","1434","49253  >  443 [ACK] Seq=291896 Ack=17172 Win=1522 Len=1368 TSval=535110 TSecr=373186553 [TCP segment of a reassembled PDU]"
"615","2018-08-07 17:55:12.676575","192.168.2.3","216.58.197.4","TLSv1.2","155","Application Data"
"621","2018-08-07 17:55:12.753533","192.168.2.3","216.58.197.4","TCP","66","49253  >  443 [ACK] Seq=293353 Ack=17455 Win=1522 Len=0 TSval=535117 TSecr=373186700"
"622","2018-08-07 17:55:12.753536","192.168.2.3","216.58.197.4","TCP","66","49253  >  443 [ACK] Seq=293353 Ack=17669 Win=1522 Len=0 TSval=535117 TSecr=373186700"
"623","2018-08-07 17:55:12.778695","192.168.2.3","216.58.197.4","TCP","1434","49253  >  443 [ACK] Seq=293353 Ack=17669 Win=1522 Len=1368 TSval=535120 TSecr=373186700 [TCP segment of a reassembled PDU]"
"624","2018-08-07 17:55:12.778935","192.168.2.3","216.58.197.4","TCP","1434","49253  >  443 [ACK] Seq=294721 Ack=17669 Win=1522 Len=1368 TSval=535120 TSecr=373186700 [TCP segment of a reassembled PDU]"
"625","2018-08-07 17:55:12.778938","192.168.2.3","216.58.197.4","TLSv1.2","212","Application Data"
"626","2018-08-07 17:55:12.778939","192.168.2.3","216.58.197.4","TCP","1434","49253  >  443 [ACK] Seq=296235 Ack=17669 Win=1522 Len=1368 TSval=535120 TSecr=373186700 [TCP segment of a reassembled PDU]"
"627","2018-08-07 17:55:12.779210","192.168.2.3","216.58.197.4","TLSv1.2","155","Application Data"
"633","2018-08-07 17:55:12.834105","192.168.2.3","216.58.197.4","TCP","66","49253  >  443 [ACK] Seq=297692 Ack=18019 Win=1522 Len=0 TSval=535126 TSecr=373186795"
"634","2018-08-07 17:55:12.874526","192.168.2.3","216.58.197.4","TCP","1434","49253  >  443 [ACK] Seq=297692 Ack=18019 Win=1522 Len=1368 TSval=535130 TSecr=373186795 [TCP segment of a reassembled PDU]"
"635","2018-08-07 17:55:12.874899","192.168.2.3","216.58.197.4","TCP","1434","49253  >  443 [ACK] Seq=299060 Ack=18019 Win=1522 Len=1368 TSval=535130 TSecr=373186795 [TCP segment of a reassembled PDU]"
"636","2018-08-07 17:55:12.874902","192.168.2.3","216.58.197.4","TLSv1.2","212","Application Data"
"637","2018-08-07 17:55:12.875206","192.168.2.3","216.58.197.4","TLSv1.2","1237","Application Data"
"640","2018-08-07 17:55:12.996320","192.168.2.3","216.58.197.4","TCP","1434","49253  >  443 [ACK] Seq=301745 Ack=18289 Win=1522 Len=1368 TSval=535142 TSecr=373186923 [TCP segment of a reassembled PDU]"
"641","2018-08-07 17:55:12.996324","192.168.2.3","216.58.197.4","TCP","1434","49253  >  443 [ACK] Seq=303113 Ack=18289 Win=1522 Len=1368 TSval=535142 TSecr=373186923 [TCP segment of a reassembled PDU]"
"642","2018-08-07 17:55:12.996469","192.168.2.3","216.58.197.4","TLSv1.2","212","Application Data"
"643","2018-08-07 17:55:12.996471","192.168.2.3","216.58.197.4","TCP","1434","49253  >  443 [ACK] Seq=304627 Ack=18289 Win=1522 Len=1368 TSval=535142 TSecr=373186923 [TCP segment of a reassembled PDU]"
"644","2018-08-07 17:55:12.996720","192.168.2.3","216.58.197.4","TLSv1.2","155","Application Data"
"649","2018-08-07 17:55:13.075816","192.168.2.3","216.58.197.4","TCP","66","49253  >  443 [ACK] Seq=306084 Ack=18485 Win=1522 Len=0 TSval=535150 TSecr=373187022"
"650","2018-08-07 17:55:13.091965","192.168.2.3","216.58.197.4","TCP","1434","49253  >  443 [ACK] Seq=306084 Ack=18485 Win=1522 Len=1368 TSval=535152 TSecr=373187022 [TCP segment of a reassembled PDU]"
"651","2018-08-07 17:55:13.092474","192.168.2.3","216.58.197.4","TCP","1434","49253  >  443 [ACK] Seq=307452 Ack=18485 Win=1522 Len=1368 TSval=535152 TSecr=373187022 [TCP segment of a reassembled PDU]"
"652","2018-08-07 17:55:13.092476","192.168.2.3","216.58.197.4","TLSv1.2","212","Application Data"
"653","2018-08-07 17:55:13.092928","192.168.2.3","216.58.197.4","TCP","1434","49253  >  443 [ACK] Seq=308966 Ack=18485 Win=1522 Len=1368 TSval=535152 TSecr=373187022 [TCP segment of a reassembled PDU]"
"654","2018-08-07 17:55:13.092931","192.168.2.3","216.58.197.4","TLSv1.2","155","Application Data"
"658","2018-08-07 17:55:13.203258","192.168.2.3","216.58.197.4","TCP","1434","49253  >  443 [ACK] Seq=310423 Ack=18485 Win=1522 Len=1368 TSval=535162 TSecr=373187060 [TCP segment of a reassembled PDU]"
"659","2018-08-07 17:55:13.203263","192.168.2.3","216.58.197.4","TCP","1434","49253  >  443 [ACK] Seq=311791 Ack=18485 Win=1522 Len=1368 TSval=535162 TSecr=373187060 [TCP segment of a reassembled PDU]"
"660","2018-08-07 17:55:13.203264","192.168.2.3","216.58.197.4","TLSv1.2","212","Application Data"
"661","2018-08-07 17:55:13.203503","192.168.2.3","216.58.197.4","TCP","1434","49253  >  443 [ACK] Seq=313305 Ack=18485 Win=1522 Len=1368 TSval=535162 TSecr=373187060 [TCP segment of a reassembled PDU]"
"662","2018-08-07 17:55:13.203507","192.168.2.3","216.58.197.4","TLSv1.2","155","Application Data"
"665","2018-08-07 17:55:13.319237","192.168.2.3","216.58.197.4","TCP","1434","49253  >  443 [ACK] Seq=314762 Ack=18485 Win=1522 Len=1368 TSval=535174 TSecr=373187170 [TCP segment of a reassembled PDU]"
"666","2018-08-07 17:55:13.319553","192.168.2.3","216.58.197.4","TCP","1434","49253  >  443 [ACK] Seq=316130 Ack=18485 Win=1522 Len=1368 TSval=535174 TSecr=373187170 [TCP segment of a reassembled PDU]"
"667","2018-08-07 17:55:13.319555","192.168.2.3","216.58.197.4","TLSv1.2","212","Application Data"
"668","2018-08-07 17:55:13.319810","192.168.2.3","216.58.197.4","TCP","1434","49253  >  443 [ACK] Seq=317644 Ack=18485 Win=1522 Len=1368 TSval=535174 TSecr=373187170 [TCP segment of a reassembled PDU]"
"669","2018-08-07 17:55:13.319812","192.168.2.3","216.58.197.4","TLSv1.2","155","Application Data"
"675","2018-08-07 17:55:13.378594","192.168.2.3","216.58.197.4","TCP","66","49253  >  443 [ACK] Seq=319101 Ack=18784 Win=1522 Len=0 TSval=535180 TSecr=373187339"
"676","2018-08-07 17:55:13.415173","192.168.2.3","216.58.197.4","TCP","1434","49253  >  443 [ACK] Seq=319101 Ack=18784 Win=1522 Len=1368 TSval=535184 TSecr=373187339 [TCP segment of a reassembled PDU]"
"677","2018-08-07 17:55:13.415589","192.168.2.3","216.58.197.4","TCP","1434","49253  >  443 [ACK] Seq=320469 Ack=18784 Win=1522 Len=1368 TSval=535184 TSecr=373187339 [TCP segment of a reassembled PDU]"
"678","2018-08-07 17:55:13.415593","192.168.2.3","216.58.197.4","TLSv1.2","212","Application Data"
"679","2018-08-07 17:55:13.415995","192.168.2.3","216.58.197.4","TCP","1434","49253  >  443 [ACK] Seq=321983 Ack=18784 Win=1522 Len=1368 TSval=535184 TSecr=373187339 [TCP segment of a reassembled PDU]"
"680","2018-08-07 17:55:13.415997","192.168.2.3","216.58.197.4","TLSv1.2","155","Application Data"
"684","2018-08-07 17:55:13.521987","192.168.2.3","216.58.197.4","TCP","1434","49253  >  443 [ACK] Seq=323440 Ack=18784 Win=1522 Len=1368 TSval=535195 TSecr=373187382 [TCP segment of a reassembled PDU]"
"685","2018-08-07 17:55:13.521994","192.168.2.3","216.58.197.4","TCP","1434","49253  >  443 [ACK] Seq=324808 Ack=18784 Win=1522 Len=1368 TSval=535195 TSecr=373187382 [TCP segment of a reassembled PDU]"
"686","2018-08-07 17:55:13.521995","192.168.2.3","216.58.197.4","TLSv1.2","212","Application Data"
"687","2018-08-07 17:55:13.522151","192.168.2.3","216.58.197.4","TLSv1.2","1265","Application Data"
"691","2018-08-07 17:55:13.586961","192.168.2.3","216.58.197.4","TCP","66","49253  >  443 [ACK] Seq=327521 Ack=19024 Win=1522 Len=0 TSval=535201 TSecr=373187531"
"694","2018-08-07 17:55:13.590179","192.168.2.3","216.58.197.4","TCP","66","49253  >  443 [ACK] Seq=327521 Ack=19562 Win=1522 Len=0 TSval=535202 TSecr=373187550"
"695","2018-08-07 17:55:13.637930","192.168.2.3","216.58.197.4","TCP","1434","49253  >  443 [ACK] Seq=327521 Ack=19562 Win=1522 Len=1368 TSval=535206 TSecr=373187550 [TCP segment of a reassembled PDU]"
"696","2018-08-07 17:55:13.637935","192.168.2.3","216.58.197.4","TCP","1434","49253  >  443 [ACK] Seq=328889 Ack=19562 Win=1522 Len=1368 TSval=535206 TSecr=373187550 [TCP segment of a reassembled PDU]"
"697","2018-08-07 17:55:13.637936","192.168.2.3","216.58.197.4","TLSv1.2","212","Application Data"
"698","2018-08-07 17:55:13.638116","192.168.2.3","216.58.197.4","TCP","1434","49253  >  443 [ACK] Seq=330403 Ack=19562 Win=1522 Len=1368 TSval=535206 TSecr=373187550 [TCP segment of a reassembled PDU]"
"699","2018-08-07 17:55:13.638287","192.168.2.3","216.58.197.4","TLSv1.2","113","Application Data"
"700","2018-08-07 17:55:13.640484","192.168.2.3","216.58.197.4","TLSv1.2","501","Application Data"
"701","2018-08-07 17:55:13.640814","192.168.2.3","216.58.197.4","TLSv1.2","102","Application Data"
"710","2018-08-07 17:55:13.859722","192.168.2.3","216.58.197.4","TCP","66","49253  >  443 [ACK] Seq=332289 Ack=20668 Win=1522 Len=0 TSval=535229 TSecr=373187820"
"711","2018-08-07 17:55:13.905353","192.168.2.3","216.58.197.4","TLSv1.2","100","Application Data"
"712","2018-08-07 17:55:13.905357","192.168.2.3","172.217.27.174","TLSv1.2","157","Application Data"
"713","2018-08-07 17:55:13.905358","192.168.2.3","172.217.27.174","TLSv1.2","104","Application Data"
"714","2018-08-07 17:55:13.905358","192.168.2.3","172.217.27.174","TLSv1.2","442","Application Data"
"715","2018-08-07 17:55:13.905359","192.168.2.3","216.58.197.4","TLSv1.2","100","Application Data"
"722","2018-08-07 17:55:13.951283","192.168.2.3","172.217.27.174","TCP","66","52258  >  443 [ACK] Seq=1107 Ack=524 Win=661 Len=0 TSval=535238 TSecr=2575632480"
"727","2018-08-07 17:55:13.988029","192.168.2.3","172.217.27.174","TCP","66","52258  >  443 [ACK] Seq=1107 Ack=592 Win=661 Len=0 TSval=535241 TSecr=2575632557"
"728","2018-08-07 17:55:13.988346","192.168.2.3","172.217.27.174","TCP","66","52258  >  443 [ACK] Seq=1107 Ack=669 Win=661 Len=0 TSval=535241 TSecr=2575632557"
"729","2018-08-07 17:55:13.988348","192.168.2.3","172.217.27.174","TCP","66","52258  >  443 [ACK] Seq=1107 Ack=738 Win=661 Len=0 TSval=535241 TSecr=2575632557"
"730","2018-08-07 17:55:13.988814","192.168.2.3","172.217.27.174","TCP","66","52258  >  443 [ACK] Seq=1107 Ack=776 Win=661 Len=0 TSval=535241 TSecr=2575632557"
"731","2018-08-07 17:55:13.989942","192.168.2.3","172.217.27.174","TLSv1.2","104","Application Data"
