"No.","Time","Source","Destination","Protocol","Length","Info"
"2","2018-08-07 17:45:10.202973","192.168.2.3","172.217.27.174","TCP","66","52264  >  443 [ACK] Seq=1 Ack=1 Win=661 Len=0 TSval=474864 TSecr=2422080400"
"4","2018-08-07 17:45:11.014712","192.168.2.3","203.211.199.120","TLSv1.2","787","Application Data"
"9","2018-08-07 17:45:11.031791","192.168.2.3","203.211.199.120","TCP","66","42858  >  443 [ACK] Seq=722 Ack=1449 Win=982 Len=0 TSval=474946 TSecr=4163910149"
"10","2018-08-07 17:45:11.031793","192.168.2.3","203.211.199.120","TCP","66","42858  >  443 [ACK] Seq=722 Ack=2897 Win=982 Len=0 TSval=474946 TSecr=4163910149"
"11","2018-08-07 17:45:11.032067","192.168.2.3","203.211.199.120","TCP","66","42858  >  443 [ACK] Seq=722 Ack=4345 Win=982 Len=0 TSval=474946 TSecr=4163910149"
"12","2018-08-07 17:45:11.035205","192.168.2.3","203.211.199.120","TCP","66","42858  >  443 [ACK] Seq=722 Ack=5153 Win=982 Len=0 TSval=474946 TSecr=4163910149"
"13","2018-08-07 17:45:17.071732","192.168.2.3","203.211.199.120","TLSv1.2","787","Application Data"
"18","2018-08-07 17:45:17.087164","192.168.2.3","203.211.199.120","TCP","66","42858  >  443 [ACK] Seq=1443 Ack=6601 Win=982 Len=0 TSval=475552 TSecr=4163916205"
"19","2018-08-07 17:45:17.087167","192.168.2.3","203.211.199.120","TCP","66","42858  >  443 [ACK] Seq=1443 Ack=8049 Win=982 Len=0 TSval=475552 TSecr=4163916205"
"20","2018-08-07 17:45:17.091084","192.168.2.3","203.211.199.120","TCP","66","42858  >  443 [ACK] Seq=1443 Ack=9497 Win=960 Len=0 TSval=475552 TSecr=4163916205"
"21","2018-08-07 17:45:17.091088","192.168.2.3","203.211.199.120","TCP","66","42858  >  443 [ACK] Seq=1443 Ack=10311 Win=948 Len=0 TSval=475552 TSecr=4163916205"
"23","2018-08-07 17:45:20.285417","192.168.2.3","172.217.27.174","TCP","66","52293  >  443 [ACK] Seq=1 Ack=1 Win=363 Len=0 TSval=475872 TSecr=874218239"
"25","2018-08-07 17:45:20.947325","192.168.2.3","216.58.197.4","TLSv1.2","156","Application Data"
"26","2018-08-07 17:45:20.947329","192.168.2.3","216.58.197.4","TLSv1.2","104","Application Data"
"27","2018-08-07 17:45:20.947330","192.168.2.3","216.58.197.4","TLSv1.2","158","Application Data"
"32","2018-08-07 17:45:20.969004","192.168.2.3","216.58.197.4","TCP","1434","49253  >  443 [ACK] Seq=221 Ack=39 Win=1124 Len=1368 TSval=475940 TSecr=372594913 [TCP segment of a reassembled PDU]"
"33","2018-08-07 17:45:20.969007","192.168.2.3","216.58.197.4","TCP","1434","49253  >  443 [ACK] Seq=1589 Ack=39 Win=1124 Len=1368 TSval=475940 TSecr=372594913 [TCP segment of a reassembled PDU]"
"34","2018-08-07 17:45:20.969203","192.168.2.3","216.58.197.4","TLSv1.2","212","Application Data"
"35","2018-08-07 17:45:20.969204","192.168.2.3","216.58.197.4","TCP","1434","49253  >  443 [ACK] Seq=3103 Ack=39 Win=1124 Len=1368 TSval=475940 TSecr=372594913 [TCP segment of a reassembled PDU]"
"36","2018-08-07 17:45:20.969205","192.168.2.3","216.58.197.4","TLSv1.2","188","Application Data"
"37","2018-08-07 17:45:20.969373","192.168.2.3","216.58.197.4","TCP","1434","49253  >  443 [ACK] Seq=4593 Ack=39 Win=1124 Len=1368 TSval=475940 TSecr=372594913 [TCP segment of a reassembled PDU]"
"38","2018-08-07 17:45:20.969665","192.168.2.3","216.58.197.4","TCP","1434","49253  >  443 [ACK] Seq=5961 Ack=39 Win=1124 Len=1368 TSval=475940 TSecr=372594913 [TCP segment of a reassembled PDU]"
"39","2018-08-07 17:45:20.969668","192.168.2.3","216.58.197.4","TLSv1.2","212","Application Data"
"40","2018-08-07 17:45:20.970050","192.168.2.3","216.58.197.4","TCP","1434","49253  >  443 [ACK] Seq=7475 Ack=39 Win=1124 Len=1368 TSval=475940 TSecr=372594913 [TCP segment of a reassembled PDU]"
"41","2018-08-07 17:45:20.970052","192.168.2.3","216.58.197.4","TLSv1.2","156","Application Data"
"46","2018-08-07 17:45:20.979327","192.168.2.3","216.58.197.4","TCP","1434","49253  >  443 [ACK] Seq=8933 Ack=39 Win=1124 Len=1368 TSval=475941 TSecr=372594934 [TCP segment of a reassembled PDU]"
"47","2018-08-07 17:45:20.979329","192.168.2.3","216.58.197.4","TCP","1434","49253  >  443 [ACK] Seq=10301 Ack=39 Win=1124 Len=1368 TSval=475941 TSecr=372594934 [TCP segment of a reassembled PDU]"
"48","2018-08-07 17:45:20.979568","192.168.2.3","216.58.197.4","TLSv1.2","1434","Application Data [TCP segment of a reassembled PDU]"
"49","2018-08-07 17:45:20.979889","192.168.2.3","216.58.197.4","TLSv1.2","1434","Application Data [TCP segment of a reassembled PDU]"
"50","2018-08-07 17:45:20.979891","192.168.2.3","216.58.197.4","TCP","1434","49253  >  443 [ACK] Seq=14405 Ack=39 Win=1124 Len=1368 TSval=475941 TSecr=372594934 [TCP segment of a reassembled PDU]"
"51","2018-08-07 17:45:20.980157","192.168.2.3","216.58.197.4","TLSv1.2","1434","Application Data [TCP segment of a reassembled PDU]"
"52","2018-08-07 17:45:20.980160","192.168.2.3","216.58.197.4","TLSv1.2","1434","Application Data [TCP segment of a reassembled PDU]"
"53","2018-08-07 17:45:20.980339","192.168.2.3","216.58.197.4","TCP","1434","49253  >  443 [ACK] Seq=18509 Ack=39 Win=1124 Len=1368 TSval=475941 TSecr=372594934 [TCP segment of a reassembled PDU]"
"54","2018-08-07 17:45:20.980503","192.168.2.3","216.58.197.4","TLSv1.2","1434","Application Data [TCP segment of a reassembled PDU]"
"55","2018-08-07 17:45:20.980631","192.168.2.3","216.58.197.4","TLSv1.2","1434","Application Data [TCP segment of a reassembled PDU]"
"56","2018-08-07 17:45:20.980832","192.168.2.3","216.58.197.4","TCP","1434","49253  >  443 [ACK] Seq=22613 Ack=39 Win=1124 Len=1368 TSval=475941 TSecr=372594934 [TCP segment of a reassembled PDU]"
"57","2018-08-07 17:45:20.981019","192.168.2.3","216.58.197.4","TLSv1.2","1434","Application Data [TCP segment of a reassembled PDU]"
"58","2018-08-07 17:45:20.981380","192.168.2.3","216.58.197.4","TLSv1.2","1434","Application Data [TCP segment of a reassembled PDU]"
"63","2018-08-07 17:45:20.985506","192.168.2.3","216.58.197.4","TCP","1434","49253  >  443 [ACK] Seq=26717 Ack=39 Win=1124 Len=1368 TSval=475942 TSecr=372594944 [TCP segment of a reassembled PDU]"
"66","2018-08-07 17:45:20.985868","192.168.2.3","216.58.197.4","TLSv1.2","1434","Application Data [TCP segment of a reassembled PDU]"
"67","2018-08-07 17:45:20.985869","192.168.2.3","216.58.197.4","TLSv1.2","1434","Application Data [TCP segment of a reassembled PDU]"
"68","2018-08-07 17:45:20.987633","192.168.2.3","216.58.197.4","TCP","1434","49253  >  443 [ACK] Seq=30821 Ack=39 Win=1124 Len=1368 TSval=475942 TSecr=372594944 [TCP segment of a reassembled PDU]"
"69","2018-08-07 17:45:20.987897","192.168.2.3","216.58.197.4","TLSv1.2","1434","Application Data [TCP segment of a reassembled PDU]"
"70","2018-08-07 17:45:20.987899","192.168.2.3","216.58.197.4","TCP","1434","49253  >  443 [ACK] Seq=33557 Ack=39 Win=1124 Len=1368 TSval=475942 TSecr=372594944 [TCP segment of a reassembled PDU]"
"71","2018-08-07 17:45:20.988063","192.168.2.3","216.58.197.4","TLSv1.2","1434","Application Data [TCP segment of a reassembled PDU]"
"72","2018-08-07 17:45:20.988203","192.168.2.3","216.58.197.4","TCP","1434","49253  >  443 [ACK] Seq=36293 Ack=39 Win=1124 Len=1368 TSval=475942 TSecr=372594944 [TCP segment of a reassembled PDU]"
"73","2018-08-07 17:45:20.988643","192.168.2.3","216.58.197.4","TLSv1.2","1434","Application Data [TCP segment of a reassembled PDU]"
"74","2018-08-07 17:45:20.988646","192.168.2.3","216.58.197.4","TLSv1.2","1434","Application Data [TCP segment of a reassembled PDU]"
"75","2018-08-07 17:45:20.988791","192.168.2.3","216.58.197.4","TCP","1434","49253  >  443 [ACK] Seq=40397 Ack=39 Win=1124 Len=1368 TSval=475942 TSecr=372594945 [TCP segment of a reassembled PDU]"
"76","2018-08-07 17:45:20.989252","192.168.2.3","216.58.197.4","TLSv1.2","1434","Application Data [TCP segment of a reassembled PDU]"
"77","2018-08-07 17:45:20.989548","192.168.2.3","216.58.197.4","TLSv1.2","1434","Application Data [TCP segment of a reassembled PDU]"
"78","2018-08-07 17:45:20.989549","192.168.2.3","216.58.197.4","TCP","1434","49253  >  443 [ACK] Seq=44501 Ack=39 Win=1124 Len=1368 TSval=475942 TSecr=372594945 [TCP segment of a reassembled PDU]"
"79","2018-08-07 17:45:20.989670","192.168.2.3","216.58.197.4","TLSv1.2","1434","Application Data [TCP segment of a reassembled PDU]"
"81","2018-08-07 17:45:20.990111","192.168.2.3","216.58.197.4","TLSv1.2","1434","Application Data [TCP segment of a reassembled PDU]"
"82","2018-08-07 17:45:20.990114","192.168.2.3","216.58.197.4","TCP","1434","49253  >  443 [ACK] Seq=48605 Ack=39 Win=1124 Len=1368 TSval=475942 TSecr=372594945 [TCP segment of a reassembled PDU]"
"84","2018-08-07 17:45:20.990393","192.168.2.3","216.58.197.4","TLSv1.2","1434","Application Data [TCP segment of a reassembled PDU]"
"85","2018-08-07 17:45:20.990396","192.168.2.3","216.58.197.4","TCP","1434","49253  >  443 [ACK] Seq=51341 Ack=39 Win=1124 Len=1368 TSval=475942 TSecr=372594945 [TCP segment of a reassembled PDU]"
"86","2018-08-07 17:45:20.991976","192.168.2.3","216.58.197.4","TLSv1.2","1434","Application Data [TCP segment of a reassembled PDU]"
"88","2018-08-07 17:45:20.992380","192.168.2.3","216.58.197.4","TLSv1.2","1155","Application Data"
"97","2018-08-07 17:45:21.110238","192.168.2.3","216.58.197.4","TCP","1434","49253  >  443 [ACK] Seq=55166 Ack=39 Win=1124 Len=1368 TSval=475949 TSecr=372594997 [TCP segment of a reassembled PDU]"
"98","2018-08-07 17:45:21.110510","192.168.2.3","216.58.197.4","TCP","1434","49253  >  443 [ACK] Seq=56534 Ack=39 Win=1124 Len=1368 TSval=475949 TSecr=372594997 [TCP segment of a reassembled PDU]"
"99","2018-08-07 17:45:21.110513","192.168.2.3","216.58.197.4","TLSv1.2","212","Application Data"
"100","2018-08-07 17:45:21.110514","192.168.2.3","216.58.197.4","TCP","1434","49253  >  443 [ACK] Seq=58048 Ack=39 Win=1124 Len=1368 TSval=475949 TSecr=372594997 [TCP segment of a reassembled PDU]"
"101","2018-08-07 17:45:21.110656","192.168.2.3","216.58.197.4","TLSv1.2","155","Application Data"
"105","2018-08-07 17:45:21.168138","192.168.2.3","216.58.197.4","TCP","1434","49253  >  443 [ACK] Seq=59505 Ack=39 Win=1124 Len=1368 TSval=475960 TSecr=372595075 [TCP segment of a reassembled PDU]"
"106","2018-08-07 17:45:21.168628","192.168.2.3","216.58.197.4","TCP","1434","49253  >  443 [ACK] Seq=60873 Ack=39 Win=1124 Len=1368 TSval=475960 TSecr=372595075 [TCP segment of a reassembled PDU]"
"107","2018-08-07 17:45:21.168631","192.168.2.3","216.58.197.4","TLSv1.2","212","Application Data"
"108","2018-08-07 17:45:21.168851","192.168.2.3","216.58.197.4","TLSv1.2","508","Application Data"
"115","2018-08-07 17:45:21.227067","192.168.2.3","216.58.197.4","TCP","66","49253  >  443 [ACK] Seq=62829 Ack=369 Win=1124 Len=0 TSval=475966 TSecr=372595186"
"117","2018-08-07 17:45:21.240124","192.168.2.3","216.58.197.4","TCP","66","49253  >  443 [ACK] Seq=62829 Ack=619 Win=1124 Len=0 TSval=475967 TSecr=372595186"
"118","2018-08-07 17:45:21.277275","192.168.2.3","216.58.197.4","TCP","1434","49253  >  443 [ACK] Seq=62829 Ack=619 Win=1124 Len=1368 TSval=475971 TSecr=372595186 [TCP segment of a reassembled PDU]"
"119","2018-08-07 17:45:21.277566","192.168.2.3","216.58.197.4","TCP","1434","49253  >  443 [ACK] Seq=64197 Ack=619 Win=1124 Len=1368 TSval=475971 TSecr=372595186 [TCP segment of a reassembled PDU]"
"120","2018-08-07 17:45:21.277568","192.168.2.3","216.58.197.4","TLSv1.2","212","Application Data"
"121","2018-08-07 17:45:21.277980","192.168.2.3","216.58.197.4","TLSv1.2","911","Application Data"
"125","2018-08-07 17:45:21.379375","192.168.2.3","216.58.197.4","TCP","1434","49253  >  443 [ACK] Seq=66556 Ack=619 Win=1124 Len=1368 TSval=475981 TSecr=372595242 [TCP segment of a reassembled PDU]"
"126","2018-08-07 17:45:21.379841","192.168.2.3","216.58.197.4","TCP","1434","49253  >  443 [ACK] Seq=67924 Ack=619 Win=1124 Len=1368 TSval=475981 TSecr=372595242 [TCP segment of a reassembled PDU]"
"127","2018-08-07 17:45:21.379843","192.168.2.3","216.58.197.4","TLSv1.2","212","Application Data"
"128","2018-08-07 17:45:21.379844","192.168.2.3","216.58.197.4","TLSv1.2","622","Application Data"
"132","2018-08-07 17:45:21.463107","192.168.2.3","216.58.197.4","TCP","66","49253  >  443 [ACK] Seq=69994 Ack=927 Win=1124 Len=0 TSval=475990 TSecr=372595390"
"133","2018-08-07 17:45:21.480327","192.168.2.3","216.58.197.4","TCP","1434","49253  >  443 [ACK] Seq=69994 Ack=927 Win=1124 Len=1368 TSval=475991 TSecr=372595390 [TCP segment of a reassembled PDU]"
"134","2018-08-07 17:45:21.480331","192.168.2.3","216.58.197.4","TCP","1434","49253  >  443 [ACK] Seq=71362 Ack=927 Win=1124 Len=1368 TSval=475991 TSecr=372595390 [TCP segment of a reassembled PDU]"
"135","2018-08-07 17:45:21.480562","192.168.2.3","216.58.197.4","TLSv1.2","212","Application Data"
"136","2018-08-07 17:45:21.480564","192.168.2.3","216.58.197.4","TLSv1.2","307","Application Data"
"139","2018-08-07 17:45:21.597426","192.168.2.3","216.58.197.4","TCP","1434","49253  >  443 [ACK] Seq=73117 Ack=927 Win=1124 Len=1368 TSval=476003 TSecr=372595445 [TCP segment of a reassembled PDU]"
"141","2018-08-07 17:45:21.597824","192.168.2.3","216.58.197.4","TCP","1434","49253  >  443 [ACK] Seq=74485 Ack=927 Win=1124 Len=1368 TSval=476003 TSecr=372595445 [TCP segment of a reassembled PDU]"
"142","2018-08-07 17:45:21.597826","192.168.2.3","216.58.197.4","TLSv1.2","212","Application Data"
"143","2018-08-07 17:45:21.598418","192.168.2.3","216.58.197.4","TLSv1.2","608","Application Data"
"144","2018-08-07 17:45:21.602061","192.168.2.3","216.58.197.4","TCP","66","49253  >  443 [ACK] Seq=76541 Ack=1142 Win=1124 Len=0 TSval=476003 TSecr=372595558"
"148","2018-08-07 17:45:21.699388","192.168.2.3","216.58.197.4","TCP","1434","49253  >  443 [ACK] Seq=76541 Ack=1142 Win=1124 Len=1368 TSval=476013 TSecr=372595563 [TCP segment of a reassembled PDU]"
"149","2018-08-07 17:45:21.699901","192.168.2.3","216.58.197.4","TCP","1434","49253  >  443 [ACK] Seq=77909 Ack=1142 Win=1124 Len=1368 TSval=476013 TSecr=372595563 [TCP segment of a reassembled PDU]"
"150","2018-08-07 17:45:21.699904","192.168.2.3","216.58.197.4","TLSv1.2","212","Application Data"
"151","2018-08-07 17:45:21.699905","192.168.2.3","216.58.197.4","TLSv1.2","612","Application Data"
"155","2018-08-07 17:45:21.824163","192.168.2.3","216.58.197.4","TCP","1434","49253  >  443 [ACK] Seq=79969 Ack=1142 Win=1124 Len=1368 TSval=476025 TSecr=372595664 [TCP segment of a reassembled PDU]"
"156","2018-08-07 17:45:21.824167","192.168.2.3","216.58.197.4","TCP","1434","49253  >  443 [ACK] Seq=81337 Ack=1142 Win=1124 Len=1368 TSval=476025 TSecr=372595664 [TCP segment of a reassembled PDU]"
"157","2018-08-07 17:45:21.824168","192.168.2.3","216.58.197.4","TLSv1.2","212","Application Data"
"158","2018-08-07 17:45:21.824332","192.168.2.3","216.58.197.4","TLSv1.2","640","Application Data"
"160","2018-08-07 17:45:21.924979","192.168.2.3","216.58.197.4","TCP","1434","49253  >  443 [ACK] Seq=83425 Ack=1142 Win=1124 Len=1368 TSval=476036 TSecr=372595789 [TCP segment of a reassembled PDU]"
"161","2018-08-07 17:45:21.924983","192.168.2.3","216.58.197.4","TCP","1434","49253  >  443 [ACK] Seq=84793 Ack=1142 Win=1124 Len=1368 TSval=476036 TSecr=372595789 [TCP segment of a reassembled PDU]"
"162","2018-08-07 17:45:21.924984","192.168.2.3","216.58.197.4","TLSv1.2","212","Application Data"
"163","2018-08-07 17:45:21.925145","192.168.2.3","216.58.197.4","TLSv1.2","964","Application Data"
"166","2018-08-07 17:45:22.047078","192.168.2.3","216.58.197.4","TCP","1434","49253  >  443 [ACK] Seq=87205 Ack=1142 Win=1124 Len=1368 TSval=476048 TSecr=372595889 [TCP segment of a reassembled PDU]"
"167","2018-08-07 17:45:22.047322","192.168.2.3","216.58.197.4","TCP","1434","49253  >  443 [ACK] Seq=88573 Ack=1142 Win=1124 Len=1368 TSval=476048 TSecr=372595889 [TCP segment of a reassembled PDU]"
"168","2018-08-07 17:45:22.047324","192.168.2.3","216.58.197.4","TLSv1.2","212","Application Data"
"169","2018-08-07 17:45:22.047850","192.168.2.3","216.58.197.4","TLSv1.2","648","Application Data"
"172","2018-08-07 17:45:22.147318","192.168.2.3","216.58.197.4","TCP","1434","49253  >  443 [ACK] Seq=90669 Ack=1142 Win=1124 Len=1368 TSval=476058 TSecr=372596013 [TCP segment of a reassembled PDU]"
"173","2018-08-07 17:45:22.147749","192.168.2.3","216.58.197.4","TCP","1434","49253  >  443 [ACK] Seq=92037 Ack=1142 Win=1124 Len=1368 TSval=476058 TSecr=372596013 [TCP segment of a reassembled PDU]"
"174","2018-08-07 17:45:22.147751","192.168.2.3","216.58.197.4","TLSv1.2","212","Application Data"
"175","2018-08-07 17:45:22.147752","192.168.2.3","216.58.197.4","TLSv1.2","617","Application Data"
"179","2018-08-07 17:45:22.227233","192.168.2.3","216.58.197.4","TCP","66","49253  >  443 [ACK] Seq=94102 Ack=1402 Win=1121 Len=0 TSval=476066 TSecr=372596186"
"181","2018-08-07 17:45:22.237737","192.168.2.3","216.58.197.4","TCP","66","49253  >  443 [ACK] Seq=94102 Ack=1474 Win=1121 Len=0 TSval=476067 TSecr=372596197"
"182","2018-08-07 17:45:22.269936","192.168.2.3","216.58.197.4","TCP","1434","49253  >  443 [ACK] Seq=94102 Ack=1474 Win=1124 Len=1368 TSval=476070 TSecr=372596197 [TCP segment of a reassembled PDU]"
"183","2018-08-07 17:45:22.269940","192.168.2.3","216.58.197.4","TCP","1434","49253  >  443 [ACK] Seq=95470 Ack=1474 Win=1124 Len=1368 TSval=476070 TSecr=372596197 [TCP segment of a reassembled PDU]"
"184","2018-08-07 17:45:22.270180","192.168.2.3","216.58.197.4","TLSv1.2","212","Application Data"
"185","2018-08-07 17:45:22.270537","192.168.2.3","216.58.197.4","TLSv1.2","656","Application Data"
"189","2018-08-07 17:45:22.369617","192.168.2.3","216.58.197.4","TCP","1434","49253  >  443 [ACK] Seq=97574 Ack=1474 Win=1124 Len=1368 TSval=476080 TSecr=372596235 [TCP segment of a reassembled PDU]"
"190","2018-08-07 17:45:22.369830","192.168.2.3","216.58.197.4","TCP","1434","49253  >  443 [ACK] Seq=98942 Ack=1474 Win=1124 Len=1368 TSval=476080 TSecr=372596235 [TCP segment of a reassembled PDU]"
"191","2018-08-07 17:45:22.369850","192.168.2.3","216.58.197.4","TLSv1.2","212","Application Data"
"192","2018-08-07 17:45:22.369851","192.168.2.3","216.58.197.4","TCP","1434","49253  >  443 [ACK] Seq=100456 Ack=1474 Win=1124 Len=1368 TSval=476080 TSecr=372596235 [TCP segment of a reassembled PDU]"
"193","2018-08-07 17:45:22.370057","192.168.2.3","216.58.197.4","TLSv1.2","155","Application Data"
"197","2018-08-07 17:45:22.465047","192.168.2.3","216.58.197.4","TCP","1434","49253  >  443 [ACK] Seq=101913 Ack=1474 Win=1124 Len=1368 TSval=476090 TSecr=372596334 [TCP segment of a reassembled PDU]"
"198","2018-08-07 17:45:22.465372","192.168.2.3","216.58.197.4","TCP","1434","49253  >  443 [ACK] Seq=103281 Ack=1474 Win=1124 Len=1368 TSval=476090 TSecr=372596334 [TCP segment of a reassembled PDU]"
"199","2018-08-07 17:45:22.465374","192.168.2.3","216.58.197.4","TLSv1.2","212","Application Data"
"200","2018-08-07 17:45:22.465577","192.168.2.3","216.58.197.4","TCP","1434","49253  >  443 [ACK] Seq=104795 Ack=1474 Win=1124 Len=1368 TSval=476090 TSecr=372596334 [TCP segment of a reassembled PDU]"
"201","2018-08-07 17:45:22.465580","192.168.2.3","216.58.197.4","TLSv1.2","155","Application Data"
"205","2018-08-07 17:45:22.557414","192.168.2.3","216.58.197.4","TCP","1434","49253  >  443 [ACK] Seq=106252 Ack=1474 Win=1124 Len=1368 TSval=476099 TSecr=372596430 [TCP segment of a reassembled PDU]"
"206","2018-08-07 17:45:22.557856","192.168.2.3","216.58.197.4","TCP","1434","49253  >  443 [ACK] Seq=107620 Ack=1474 Win=1124 Len=1368 TSval=476099 TSecr=372596430 [TCP segment of a reassembled PDU]"
"207","2018-08-07 17:45:22.557858","192.168.2.3","216.58.197.4","TLSv1.2","212","Application Data"
"208","2018-08-07 17:45:22.558211","192.168.2.3","216.58.197.4","TCP","1434","49253  >  443 [ACK] Seq=109134 Ack=1474 Win=1124 Len=1368 TSval=476099 TSecr=372596430 [TCP segment of a reassembled PDU]"
"209","2018-08-07 17:45:22.558213","192.168.2.3","216.58.197.4","TLSv1.2","155","Application Data"
"213","2018-08-07 17:45:22.638217","192.168.2.3","216.58.197.4","TCP","1434","49253  >  443 [ACK] Seq=110591 Ack=1474 Win=1124 Len=1368 TSval=476107 TSecr=372596523 [TCP segment of a reassembled PDU]"
"214","2018-08-07 17:45:22.643141","192.168.2.3","216.58.197.4","TCP","1434","49253  >  443 [ACK] Seq=111959 Ack=1474 Win=1124 Len=1368 TSval=476107 TSecr=372596523 [TCP segment of a reassembled PDU]"
"215","2018-08-07 17:45:22.643152","192.168.2.3","216.58.197.4","TLSv1.2","212","Application Data"
"216","2018-08-07 17:45:22.643153","192.168.2.3","216.58.197.4","TCP","1434","49253  >  443 [ACK] Seq=113473 Ack=1474 Win=1124 Len=1368 TSval=476107 TSecr=372596523 [TCP segment of a reassembled PDU]"
"217","2018-08-07 17:45:22.643256","192.168.2.3","216.58.197.4","TLSv1.2","155","Application Data"
"223","2018-08-07 17:45:22.705809","192.168.2.3","216.58.197.4","TCP","66","49253  >  443 [ACK] Seq=114930 Ack=1862 Win=1124 Len=0 TSval=476114 TSecr=372596663"
"224","2018-08-07 17:45:22.748342","192.168.2.3","216.58.197.4","TCP","1434","49253  >  443 [ACK] Seq=114930 Ack=1862 Win=1124 Len=1368 TSval=476118 TSecr=372596663 [TCP segment of a reassembled PDU]"
"225","2018-08-07 17:45:22.748639","192.168.2.3","216.58.197.4","TCP","1434","49253  >  443 [ACK] Seq=116298 Ack=1862 Win=1124 Len=1368 TSval=476118 TSecr=372596663 [TCP segment of a reassembled PDU]"
"226","2018-08-07 17:45:22.748640","192.168.2.3","216.58.197.4","TLSv1.2","212","Application Data"
"227","2018-08-07 17:45:22.749125","192.168.2.3","216.58.197.4","TCP","1434","49253  >  443 [ACK] Seq=117812 Ack=1862 Win=1124 Len=1368 TSval=476118 TSecr=372596663 [TCP segment of a reassembled PDU]"
"228","2018-08-07 17:45:22.749140","192.168.2.3","216.58.197.4","TLSv1.2","155","Application Data"
"231","2018-08-07 17:45:22.849330","192.168.2.3","216.58.197.4","TCP","1434","49253  >  443 [ACK] Seq=119269 Ack=1862 Win=1124 Len=1368 TSval=476128 TSecr=372596714 [TCP segment of a reassembled PDU]"
"232","2018-08-07 17:45:22.849334","192.168.2.3","216.58.197.4","TCP","1434","49253  >  443 [ACK] Seq=120637 Ack=1862 Win=1124 Len=1368 TSval=476128 TSecr=372596714 [TCP segment of a reassembled PDU]"
"233","2018-08-07 17:45:22.849335","192.168.2.3","216.58.197.4","TLSv1.2","212","Application Data"
"234","2018-08-07 17:45:22.849448","192.168.2.3","216.58.197.4","TCP","1434","49253  >  443 [ACK] Seq=122151 Ack=1862 Win=1124 Len=1368 TSval=476128 TSecr=372596714 [TCP segment of a reassembled PDU]"
"235","2018-08-07 17:45:22.849762","192.168.2.3","216.58.197.4","TLSv1.2","155","Application Data"
"240","2018-08-07 17:45:22.909030","192.168.2.3","216.58.197.4","TCP","66","49253  >  443 [ACK] Seq=123608 Ack=2244 Win=1124 Len=0 TSval=476134 TSecr=372596867"
"241","2018-08-07 17:45:22.943209","192.168.2.3","216.58.197.4","TCP","1434","49253  >  443 [ACK] Seq=123608 Ack=2244 Win=1124 Len=1368 TSval=476137 TSecr=372596867 [TCP segment of a reassembled PDU]"
"242","2018-08-07 17:45:22.943643","192.168.2.3","216.58.197.4","TCP","1434","49253  >  443 [ACK] Seq=124976 Ack=2244 Win=1124 Len=1368 TSval=476138 TSecr=372596867 [TCP segment of a reassembled PDU]"
"243","2018-08-07 17:45:22.943647","192.168.2.3","216.58.197.4","TLSv1.2","212","Application Data"
"244","2018-08-07 17:45:22.943954","192.168.2.3","216.58.197.4","TCP","1434","49253  >  443 [ACK] Seq=126490 Ack=2244 Win=1124 Len=1368 TSval=476138 TSecr=372596867 [TCP segment of a reassembled PDU]"
"245","2018-08-07 17:45:22.943958","192.168.2.3","216.58.197.4","TLSv1.2","155","Application Data"
"250","2018-08-07 17:45:22.996934","192.168.2.3","216.58.197.4","TCP","66","49253  >  443 [ACK] Seq=127947 Ack=2609 Win=1124 Len=0 TSval=476143 TSecr=372596955"
"251","2018-08-07 17:45:23.037460","192.168.2.3","216.58.197.4","TCP","1434","49253  >  443 [ACK] Seq=127947 Ack=2609 Win=1124 Len=1368 TSval=476147 TSecr=372596955 [TCP segment of a reassembled PDU]"
"252","2018-08-07 17:45:23.037895","192.168.2.3","216.58.197.4","TCP","1434","49253  >  443 [ACK] Seq=129315 Ack=2609 Win=1124 Len=1368 TSval=476147 TSecr=372596955 [TCP segment of a reassembled PDU]"
"253","2018-08-07 17:45:23.037898","192.168.2.3","216.58.197.4","TLSv1.2","212","Application Data"
"254","2018-08-07 17:45:23.038803","192.168.2.3","216.58.197.4","TCP","1434","49253  >  443 [ACK] Seq=130829 Ack=2609 Win=1124 Len=1368 TSval=476147 TSecr=372596955 [TCP segment of a reassembled PDU]"
"255","2018-08-07 17:45:23.038805","192.168.2.3","216.58.197.4","TLSv1.2","155","Application Data"
"261","2018-08-07 17:45:23.101308","192.168.2.3","216.58.197.4","TCP","66","49253  >  443 [ACK] Seq=132286 Ack=2896 Win=1124 Len=0 TSval=476153 TSecr=372597060"
"262","2018-08-07 17:45:23.129238","192.168.2.3","203.211.199.120","TLSv1.2","787","Application Data"
"263","2018-08-07 17:45:23.134383","192.168.2.3","216.58.197.4","TCP","1434","49253  >  443 [ACK] Seq=132286 Ack=2896 Win=1124 Len=1368 TSval=476157 TSecr=372597060 [TCP segment of a reassembled PDU]"
"264","2018-08-07 17:45:23.134865","192.168.2.3","216.58.197.4","TCP","1434","49253  >  443 [ACK] Seq=133654 Ack=2896 Win=1124 Len=1368 TSval=476157 TSecr=372597060 [TCP segment of a reassembled PDU]"
"265","2018-08-07 17:45:23.136202","192.168.2.3","216.58.197.4","TLSv1.2","212","Application Data"
"266","2018-08-07 17:45:23.136574","192.168.2.3","216.58.197.4","TCP","1434","49253  >  443 [ACK] Seq=135168 Ack=2896 Win=1124 Len=1368 TSval=476157 TSecr=372597060 [TCP segment of a reassembled PDU]"
"267","2018-08-07 17:45:23.136577","192.168.2.3","216.58.197.4","TLSv1.2","155","Application Data"
"273","2018-08-07 17:45:23.140193","192.168.2.3","203.211.199.120","TCP","66","42858  >  443 [ACK] Seq=2164 Ack=11759 Win=982 Len=0 TSval=476157 TSecr=4163922257"
"274","2018-08-07 17:45:23.140195","192.168.2.3","203.211.199.120","TCP","66","42858  >  443 [ACK] Seq=2164 Ack=13207 Win=982 Len=0 TSval=476157 TSecr=4163922257"
"277","2018-08-07 17:45:23.141466","192.168.2.3","203.211.199.120","TCP","66","42858  >  443 [ACK] Seq=2164 Ack=14655 Win=982 Len=0 TSval=476157 TSecr=4163922257"
"278","2018-08-07 17:45:23.141469","192.168.2.3","203.211.199.120","TCP","66","42858  >  443 [ACK] Seq=2164 Ack=15469 Win=998 Len=0 TSval=476157 TSecr=4163922257"
"279","2018-08-07 17:45:23.163683","192.168.2.3","172.217.27.174","TCP","66","52274  >  443 [ACK] Seq=1 Ack=1 Win=450 Len=0 TSval=476160 TSecr=4030038746"
"282","2018-08-07 17:45:23.235642","192.168.2.3","216.58.197.4","TCP","1434","49253  >  443 [ACK] Seq=136625 Ack=3054 Win=1124 Len=1368 TSval=476167 TSecr=372597186 [TCP segment of a reassembled PDU]"
"283","2018-08-07 17:45:23.235909","192.168.2.3","216.58.197.4","TCP","1434","49253  >  443 [ACK] Seq=137993 Ack=3054 Win=1124 Len=1368 TSval=476167 TSecr=372597186 [TCP segment of a reassembled PDU]"
"284","2018-08-07 17:45:23.235926","192.168.2.3","216.58.197.4","TLSv1.2","212","Application Data"
"285","2018-08-07 17:45:23.236353","192.168.2.3","216.58.197.4","TLSv1.2","1276","Application Data"
"290","2018-08-07 17:45:23.283219","192.168.2.3","216.58.197.4","TCP","66","49253  >  443 [ACK] Seq=140717 Ack=3323 Win=1124 Len=0 TSval=476172 TSecr=372597197"
"293","2018-08-07 17:45:23.302128","192.168.2.3","216.58.197.4","TCP","66","49253  >  443 [ACK] Seq=140717 Ack=3488 Win=1124 Len=0 TSval=476173 TSecr=372597256"
"294","2018-08-07 17:45:23.366987","192.168.2.3","216.58.197.4","TCP","1434","49253  >  443 [ACK] Seq=140717 Ack=3488 Win=1124 Len=1368 TSval=476180 TSecr=372597256 [TCP segment of a reassembled PDU]"
"295","2018-08-07 17:45:23.366991","192.168.2.3","216.58.197.4","TCP","1434","49253  >  443 [ACK] Seq=142085 Ack=3488 Win=1124 Len=1368 TSval=476180 TSecr=372597256 [TCP segment of a reassembled PDU]"
"296","2018-08-07 17:45:23.366992","192.168.2.3","216.58.197.4","TLSv1.2","212","Application Data"
"297","2018-08-07 17:45:23.367266","192.168.2.3","216.58.197.4","TLSv1.2","981","Application Data"
"300","2018-08-07 17:45:23.488114","192.168.2.3","216.58.197.4","TCP","1434","49253  >  443 [ACK] Seq=144514 Ack=3488 Win=1124 Len=1368 TSval=476192 TSecr=372597332 [TCP segment of a reassembled PDU]"
"301","2018-08-07 17:45:23.488574","192.168.2.3","216.58.197.4","TCP","1434","49253  >  443 [ACK] Seq=145882 Ack=3488 Win=1124 Len=1368 TSval=476192 TSecr=372597332 [TCP segment of a reassembled PDU]"
"302","2018-08-07 17:45:23.488575","192.168.2.3","216.58.197.4","TLSv1.2","212","Application Data"
"303","2018-08-07 17:45:23.488576","192.168.2.3","216.58.197.4","TLSv1.2","1374","Application Data"
"305","2018-08-07 17:45:23.490526","192.168.2.3","216.58.197.4","TCP","66","49253  >  443 [ACK] Seq=148704 Ack=3726 Win=1124 Len=0 TSval=476192 TSecr=372597449"
"309","2018-08-07 17:45:23.588996","192.168.2.3","216.58.197.4","TCP","1434","49253  >  443 [ACK] Seq=148704 Ack=3726 Win=1124 Len=1368 TSval=476202 TSecr=372597453 [TCP segment of a reassembled PDU]"
"310","2018-08-07 17:45:23.589001","192.168.2.3","216.58.197.4","TCP","1434","49253  >  443 [ACK] Seq=150072 Ack=3726 Win=1124 Len=1368 TSval=476202 TSecr=372597453 [TCP segment of a reassembled PDU]"
"311","2018-08-07 17:45:23.589002","192.168.2.3","216.58.197.4","TLSv1.2","212","Application Data"
"312","2018-08-07 17:45:23.589148","192.168.2.3","216.58.197.4","TLSv1.2","341","Application Data"
"315","2018-08-07 17:45:23.714800","192.168.2.3","216.58.197.4","TCP","1434","49253  >  443 [ACK] Seq=151861 Ack=3726 Win=1124 Len=1368 TSval=476214 TSecr=372597553 [TCP segment of a reassembled PDU]"
"316","2018-08-07 17:45:23.714804","192.168.2.3","216.58.197.4","TCP","1434","49253  >  443 [ACK] Seq=153229 Ack=3726 Win=1124 Len=1368 TSval=476214 TSecr=372597553 [TCP segment of a reassembled PDU]"
"317","2018-08-07 17:45:23.715002","192.168.2.3","216.58.197.4","TLSv1.2","212","Application Data"
"318","2018-08-07 17:45:23.715003","192.168.2.3","216.58.197.4","TLSv1.2","931","Application Data"
"320","2018-08-07 17:45:23.816510","192.168.2.3","216.58.197.4","TCP","1434","49253  >  443 [ACK] Seq=155608 Ack=3726 Win=1124 Len=1368 TSval=476224 TSecr=372597679 [TCP segment of a reassembled PDU]"
"321","2018-08-07 17:45:23.816514","192.168.2.3","216.58.197.4","TCP","1434","49253  >  443 [ACK] Seq=156976 Ack=3726 Win=1124 Len=1368 TSval=476224 TSecr=372597679 [TCP segment of a reassembled PDU]"
"322","2018-08-07 17:45:23.816515","192.168.2.3","216.58.197.4","TLSv1.2","212","Application Data"
"323","2018-08-07 17:45:23.816646","192.168.2.3","216.58.197.4","TLSv1.2","931","Application Data"
"329","2018-08-07 17:45:23.879167","192.168.2.3","216.58.197.4","TCP","66","49253  >  443 [ACK] Seq=159355 Ack=3927 Win=1121 Len=0 TSval=476231 TSecr=372597838"
"330","2018-08-07 17:45:23.879615","192.168.2.3","216.58.197.4","TCP","66","49253  >  443 [ACK] Seq=159355 Ack=4222 Win=1121 Len=0 TSval=476231 TSecr=372597838"
"331","2018-08-07 17:45:23.912233","192.168.2.3","216.58.197.4","TCP","1434","49253  >  443 [ACK] Seq=159355 Ack=4222 Win=1124 Len=1368 TSval=476234 TSecr=372597838 [TCP segment of a reassembled PDU]"
"332","2018-08-07 17:45:23.912620","192.168.2.3","216.58.197.4","TCP","1434","49253  >  443 [ACK] Seq=160723 Ack=4222 Win=1124 Len=1368 TSval=476234 TSecr=372597838 [TCP segment of a reassembled PDU]"
"333","2018-08-07 17:45:23.912622","192.168.2.3","216.58.197.4","TLSv1.2","212","Application Data"
"334","2018-08-07 17:45:23.912623","192.168.2.3","216.58.197.4","TLSv1.2","307","Application Data"
"337","2018-08-07 17:45:24.029033","192.168.2.3","216.58.197.4","TCP","1434","49253  >  443 [ACK] Seq=162478 Ack=4222 Win=1124 Len=1368 TSval=476246 TSecr=372597877 [TCP segment of a reassembled PDU]"
"338","2018-08-07 17:45:24.029373","192.168.2.3","216.58.197.4","TCP","1434","49253  >  443 [ACK] Seq=163846 Ack=4222 Win=1124 Len=1368 TSval=476246 TSecr=372597877 [TCP segment of a reassembled PDU]"
"339","2018-08-07 17:45:24.029376","192.168.2.3","216.58.197.4","TLSv1.2","212","Application Data"
"340","2018-08-07 17:45:24.029377","192.168.2.3","216.58.197.4","TLSv1.2","305","Application Data"
"346","2018-08-07 17:45:24.084663","192.168.2.3","216.58.197.4","TCP","66","49253  >  443 [ACK] Seq=165599 Ack=4579 Win=1124 Len=0 TSval=476252 TSecr=372598042"
"347","2018-08-07 17:45:24.115486","192.168.2.3","216.58.197.4","TCP","1434","49253  >  443 [ACK] Seq=165599 Ack=4579 Win=1124 Len=1368 TSval=476255 TSecr=372598042 [TCP segment of a reassembled PDU]"
"348","2018-08-07 17:45:24.118810","192.168.2.3","216.58.197.4","TCP","1434","49253  >  443 [ACK] Seq=166967 Ack=4579 Win=1124 Len=1368 TSval=476255 TSecr=372598042 [TCP segment of a reassembled PDU]"
"349","2018-08-07 17:45:24.118813","192.168.2.3","216.58.197.4","TLSv1.2","212","Application Data"
"350","2018-08-07 17:45:24.118814","192.168.2.3","216.58.197.4","TLSv1.2","324","Application Data"
"351","2018-08-07 17:45:24.118815","192.168.2.3","216.58.197.4","TLSv1.2","102","Application Data"
"356","2018-08-07 17:45:24.132867","192.168.2.3","216.58.197.4","TCP","66","49253  >  443 [ACK] Seq=168775 Ack=5295 Win=1124 Len=0 TSval=476256 TSecr=372598089"
"359","2018-08-07 17:45:24.240241","192.168.2.3","216.58.197.4","TCP","66","49253  >  443 [ACK] Seq=168775 Ack=5754 Win=1124 Len=0 TSval=476267 TSecr=372598187"
"362","2018-08-07 17:45:24.710990","192.168.2.3","172.217.27.174","TCP","66","[TCP Previous segment not captured] 52264  >  443 [FIN, ACK] Seq=2 Ack=57 Win=661 Len=0 TSval=476314 TSecr=2422140019"
"365","2018-08-07 17:45:24.794759","192.168.2.3","216.58.197.4","TCP","66","49253  >  443 [ACK] Seq=168775 Ack=6046 Win=1124 Len=0 TSval=476323 TSecr=372598718"
"370","2018-08-07 17:45:24.796555","192.168.2.3","216.58.197.4","TCP","66","49253  >  443 [ACK] Seq=168775 Ack=7464 Win=1102 Len=0 TSval=476323 TSecr=372598755"
"371","2018-08-07 17:45:24.796850","192.168.2.3","216.58.197.4","TCP","66","49253  >  443 [ACK] Seq=168775 Ack=8882 Win=1097 Len=0 TSval=476323 TSecr=372598755"
"372","2018-08-07 17:45:24.797141","192.168.2.3","216.58.197.4","TCP","66","49253  >  443 [ACK] Seq=168775 Ack=10300 Win=1097 Len=0 TSval=476323 TSecr=372598755"
"373","2018-08-07 17:45:24.797470","192.168.2.3","216.58.197.4","TCP","66","49253  >  443 [ACK] Seq=168775 Ack=11263 Win=1113 Len=0 TSval=476323 TSecr=372598755"
"384","2018-08-07 17:45:24.847502","192.168.2.3","216.58.197.4","TCP","66","49253  >  443 [ACK] Seq=168775 Ack=12681 Win=1097 Len=0 TSval=476328 TSecr=372598805"
"385","2018-08-07 17:45:24.847504","192.168.2.3","216.58.197.4","TCP","66","49253  >  443 [ACK] Seq=168775 Ack=13163 Win=1097 Len=0 TSval=476328 TSecr=372598805"
"391","2018-08-07 17:45:24.848487","192.168.2.3","216.58.197.4","TCP","66","49253  >  443 [ACK] Seq=168775 Ack=14581 Win=1097 Len=0 TSval=476328 TSecr=372598806"
"392","2018-08-07 17:45:24.848489","192.168.2.3","216.58.197.4","TCP","66","49253  >  443 [ACK] Seq=168775 Ack=16786 Win=1092 Len=0 TSval=476328 TSecr=372598806"
"393","2018-08-07 17:45:24.848489","192.168.2.3","216.58.197.4","TCP","66","49253  >  443 [ACK] Seq=168775 Ack=18204 Win=1097 Len=0 TSval=476328 TSecr=372598806"
"395","2018-08-07 17:45:24.849816","192.168.2.3","216.58.197.4","TCP","66","49253  >  443 [ACK] Seq=168775 Ack=18471 Win=1121 Len=0 TSval=476328 TSecr=372598806"
"396","2018-08-07 17:45:24.849817","192.168.2.3","216.58.197.4","TCP","66","49253  >  443 [ACK] Seq=168775 Ack=20263 Win=1097 Len=0 TSval=476328 TSecr=372598807"
"397","2018-08-07 17:45:24.849818","192.168.2.3","216.58.197.4","TCP","66","49253  >  443 [ACK] Seq=168775 Ack=21681 Win=1097 Len=0 TSval=476328 TSecr=372598807"
"398","2018-08-07 17:45:24.850278","192.168.2.3","216.58.197.4","TCP","66","49253  >  443 [ACK] Seq=168775 Ack=21982 Win=1124 Len=0 TSval=476328 TSecr=372598807"
"399","2018-08-07 17:45:24.850595","192.168.2.3","216.58.197.4","TCP","66","49253  >  443 [ACK] Seq=168775 Ack=24737 Win=1124 Len=0 TSval=476328 TSecr=372598807"
"400","2018-08-07 17:45:24.850848","192.168.2.3","216.58.197.4","TCP","66","49253  >  443 [ACK] Seq=168775 Ack=24943 Win=1124 Len=0 TSval=476328 TSecr=372598809"
"401","2018-08-07 17:45:24.920577","192.168.2.3","172.217.27.174","TLSv1.2","304","[TCP Previous segment not captured] , Application Data"
"402","2018-08-07 17:45:24.920781","192.168.2.3","172.217.27.174","TLSv1.2","104","Application Data"
"424","2018-08-07 17:45:24.935858","192.168.2.3","216.58.197.4","TCP","66","49253  >  443 [ACK] Seq=168775 Ack=26666 Win=1124 Len=0 TSval=476336 TSecr=372598889"
"425","2018-08-07 17:45:24.935860","192.168.2.3","216.58.197.4","TCP","66","49253  >  443 [ACK] Seq=168775 Ack=28343 Win=1124 Len=0 TSval=476337 TSecr=372598890"
"426","2018-08-07 17:45:24.935861","192.168.2.3","216.58.197.4","TCP","66","49253  >  443 [ACK] Seq=168775 Ack=31966 Win=1124 Len=0 TSval=476337 TSecr=372598890"
"427","2018-08-07 17:45:24.935861","192.168.2.3","216.58.197.4","TCP","66","49253  >  443 [ACK] Seq=168775 Ack=35266 Win=1124 Len=0 TSval=476337 TSecr=372598890"
"428","2018-08-07 17:45:24.935862","192.168.2.3","216.58.197.4","TCP","66","49253  >  443 [ACK] Seq=168775 Ack=37324 Win=1124 Len=0 TSval=476337 TSecr=372598891"
"429","2018-08-07 17:45:24.935864","192.168.2.3","216.58.197.4","TCP","66","49253  >  443 [ACK] Seq=168775 Ack=39395 Win=1124 Len=0 TSval=476337 TSecr=372598892"
"430","2018-08-07 17:45:24.965146","192.168.2.3","172.217.27.174","TCP","66","52274  >  443 [ACK] Seq=278 Ack=39 Win=450 Len=0 TSval=476340 TSecr=4030085624"
"435","2018-08-07 17:45:25.092181","192.168.2.3","172.217.27.174","TCP","66","52274  >  443 [ACK] Seq=278 Ack=106 Win=450 Len=0 TSval=476352 TSecr=4030085786"
"436","2018-08-07 17:45:25.092184","192.168.2.3","172.217.27.174","TCP","66","52274  >  443 [ACK] Seq=278 Ack=575 Win=494 Len=0 TSval=476352 TSecr=4030085786"
"437","2018-08-07 17:45:25.092769","192.168.2.3","172.217.27.174","TCP","66","52274  >  443 [ACK] Seq=278 Ack=605 Win=494 Len=0 TSval=476352 TSecr=4030085787"
"438","2018-08-07 17:45:25.092773","192.168.2.3","172.217.27.174","TCP","66","52274  >  443 [ACK] Seq=278 Ack=643 Win=494 Len=0 TSval=476352 TSecr=4030085787"
"439","2018-08-07 17:45:25.095008","192.168.2.3","172.217.27.174","TLSv1.2","104","Application Data"
"440","2018-08-07 17:45:25.098257","192.168.2.3","224.0.0.251","MDNS","411","Standard query response 0x0000 PTR Google-Home-d8ff63fb78680c8a1c8ccacd5fd7f560._googlecast._tcp.local PTR Google-Home-d8ff63fb78680c8a1c8ccacd5fd7f560._googlecast._tcp.local PTR Google-Home-d8ff63fb78680c8a1c8ccacd5fd7f560._googlecast._tcp.local PTR Google-Home-d8ff63fb78680c8a1c8ccacd5fd7f560._googlecast._tcp.local PTR Google-Home-d8ff63fb78680c8a1c8ccacd5fd7f560._googlecast._tcp.local"
"468","2018-08-07 17:45:25.189689","192.168.2.3","216.58.197.4","TCP","66","49253  >  443 [ACK] Seq=168775 Ack=40813 Win=1102 Len=0 TSval=476362 TSecr=372599143"
"477","2018-08-07 17:45:25.193512","192.168.2.3","216.58.197.4","TCP","66","49253  >  443 [ACK] Seq=168775 Ack=53750 Win=974 Len=0 TSval=476362 TSecr=372599146"
"478","2018-08-07 17:45:25.193514","192.168.2.3","216.58.197.4","TCP","66","49253  >  443 [ACK] Seq=168775 Ack=62439 Win=1021 Len=0 TSval=476362 TSecr=372599147"
"485","2018-08-07 17:45:25.195788","192.168.2.3","216.58.197.4","TCP","66","49253  >  443 [ACK] Seq=168775 Ack=64232 Win=1097 Len=0 TSval=476363 TSecr=372599150"
"486","2018-08-07 17:45:25.197151","192.168.2.3","216.58.197.4","TCP","66","49253  >  443 [ACK] Seq=168775 Ack=71392 Win=1124 Len=0 TSval=476363 TSecr=372599151"
"487","2018-08-07 17:45:25.203687","192.168.2.3","216.58.197.4","TCP","66","49253  >  443 [ACK] Seq=168775 Ack=75527 Win=1124 Len=0 TSval=476363 TSecr=372599154"
"488","2018-08-07 17:45:25.210005","192.168.2.3","8.8.8.8","DNS","100","Standard query 0xb84d A narrative-news-cast-receiver.appspot.com"
"509","2018-08-07 17:45:25.235075","192.168.2.3","216.58.197.4","TCP","66","49253  >  443 [ACK] Seq=168775 Ack=77325 Win=1124 Len=0 TSval=476365 TSecr=372599177"
"510","2018-08-07 17:45:25.235077","192.168.2.3","216.58.197.4","TCP","66","49253  >  443 [ACK] Seq=168775 Ack=82251 Win=1124 Len=0 TSval=476365 TSecr=372599178"
"511","2018-08-07 17:45:25.235078","192.168.2.3","216.58.197.4","TCP","66","49253  >  443 [ACK] Seq=168775 Ack=91301 Win=1124 Len=0 TSval=476366 TSecr=372599179"
