"No.","Time","Source","Destination","Protocol","Length","Info"
"13","2016-09-26 23:00:04.305836","192.168.1.196","54.210.202.2","TCP","60","[TCP segment of a reassembled PDU]"
"56","2016-09-26 23:00:14.520278","192.168.1.196","54.210.202.2","TCP","60","[TCP Keep-Alive] 2173  >  443 [ACK] Seq=1 Ack=1 Win=3072 Len=1"
"118","2016-09-26 23:00:24.744790","192.168.1.196","54.210.202.2","TCP","60","[TCP Keep-Alive] 2173  >  443 [ACK] Seq=1 Ack=1 Win=3072 Len=1"
"143","2016-09-26 23:00:29.989239","Physical_00:67:5e","Tp-LinkT_51:33:ea","ARP","60","192.168.1.196 is at d0:52:a8:00:67:5e"
"154","2016-09-26 23:00:34.969826","192.168.1.196","54.210.202.2","TCP","60","[TCP Keep-Alive] 2173  >  443 [ACK] Seq=1 Ack=1 Win=3072 Len=1"
"159","2016-09-26 23:00:35.613903","192.168.1.196","54.210.202.2","TLSv1.2","123","Application Data"
"163","2016-09-26 23:00:35.844581","192.168.1.196","54.210.202.2","TCP","60","2173  >  443 [ACK] Seq=71 Ack=70 Win=3072 Len=0"
"237","2016-09-26 23:00:45.829262","192.168.1.196","54.210.202.2","TCP","60","[TCP Keep-Alive] 2173  >  443 [ACK] Seq=70 Ack=70 Win=3072 Len=1"
"274","2016-09-26 23:00:56.050885","192.168.1.196","54.210.202.2","TCP","60","[TCP Keep-Alive] 2173  >  443 [ACK] Seq=70 Ack=70 Win=3072 Len=1"
"321","2016-09-26 23:01:06.280692","192.168.1.196","54.210.202.2","TCP","60","[TCP Keep-Alive] 2173  >  443 [ACK] Seq=70 Ack=70 Win=3072 Len=1"
"347","2016-09-26 23:01:11.509241","Physical_00:67:5e","Tp-LinkT_51:33:ea","ARP","60","192.168.1.196 is at d0:52:a8:00:67:5e"
"367","2016-09-26 23:01:16.489417","192.168.1.196","54.210.202.2","TCP","60","[TCP Keep-Alive] 2173  >  443 [ACK] Seq=70 Ack=70 Win=3072 Len=1"
"409","2016-09-26 23:01:26.690317","192.168.1.196","54.210.202.2","TCP","60","[TCP Keep-Alive] 2173  >  443 [ACK] Seq=70 Ack=70 Win=3072 Len=1"
"442","2016-09-26 23:01:34.525231","192.168.1.196","54.210.202.2","TLSv1.2","123","Application Data"
"445","2016-09-26 23:01:34.760912","192.168.1.196","54.210.202.2","TCP","60","2173  >  443 [ACK] Seq=140 Ack=139 Win=3072 Len=0"
"459","2016-09-26 23:01:38.413838","192.168.1.196","54.210.202.2","TLSv1.2","123","Application Data"
"463","2016-09-26 23:01:38.653075","192.168.1.196","54.210.202.2","TCP","60","2173  >  443 [ACK] Seq=209 Ack=208 Win=3072 Len=0"
"520","2016-09-26 23:01:48.637821","192.168.1.196","54.210.202.2","TCP","60","[TCP Keep-Alive] 2173  >  443 [ACK] Seq=208 Ack=208 Win=3072 Len=1"
"547","2016-09-26 23:01:53.869222","Physical_00:67:5e","Tp-LinkT_51:33:ea","ARP","60","192.168.1.196 is at d0:52:a8:00:67:5e"
"563","2016-09-26 23:01:58.848416","192.168.1.196","54.210.202.2","TCP","60","[TCP Keep-Alive] 2173  >  443 [ACK] Seq=208 Ack=208 Win=3072 Len=1"
"593","2016-09-26 23:02:09.062723","192.168.1.196","54.210.202.2","TCP","60","[TCP Keep-Alive] 2173  >  443 [ACK] Seq=208 Ack=208 Win=3072 Len=1"
"642","2016-09-26 23:02:19.276133","192.168.1.196","54.210.202.2","TCP","60","[TCP Keep-Alive] 2173  >  443 [ACK] Seq=208 Ack=208 Win=3072 Len=1"
"684","2016-09-26 23:02:29.477391","192.168.1.196","54.210.202.2","TCP","60","[TCP Keep-Alive] 2173  >  443 [ACK] Seq=208 Ack=208 Win=3072 Len=1"
"711","2016-09-26 23:02:34.699256","Physical_00:67:5e","Tp-LinkT_51:33:ea","ARP","60","192.168.1.196 is at d0:52:a8:00:67:5e"
"719","2016-09-26 23:02:37.325481","192.168.1.196","54.210.202.2","TLSv1.2","123","Application Data"
"723","2016-09-26 23:02:37.545645","192.168.1.196","54.210.202.2","TCP","60","2173  >  443 [ACK] Seq=278 Ack=277 Win=3072 Len=0"
"775","2016-09-26 23:02:47.530420","192.168.1.196","54.210.202.2","TCP","60","[TCP Keep-Alive] 2173  >  443 [ACK] Seq=277 Ack=277 Win=3072 Len=1"
"820","2016-09-26 23:02:57.745040","192.168.1.196","54.210.202.2","TCP","60","[TCP Keep-Alive] 2173  >  443 [ACK] Seq=277 Ack=277 Win=3072 Len=1"
"844","2016-09-26 23:03:04.916141","192.168.1.196","54.210.202.2","TLSv1.2","123","Application Data"
"848","2016-09-26 23:03:05.144215","192.168.1.196","54.210.202.2","TCP","60","2173  >  443 [ACK] Seq=347 Ack=346 Win=3072 Len=0"
"899","2016-09-26 23:03:15.128641","192.168.1.196","54.210.202.2","TCP","60","[TCP Keep-Alive] 2173  >  443 [ACK] Seq=346 Ack=346 Win=3072 Len=1"
"918","2016-09-26 23:03:20.359265","Physical_00:67:5e","Tp-LinkT_51:33:ea","ARP","60","192.168.1.196 is at d0:52:a8:00:67:5e"
"939","2016-09-26 23:03:25.336058","192.168.1.196","54.210.202.2","TCP","60","[TCP Keep-Alive] 2173  >  443 [ACK] Seq=346 Ack=346 Win=3072 Len=1"
"1025","2016-09-26 23:03:35.544043","192.168.1.196","54.210.202.2","TCP","60","[TCP Keep-Alive] 2173  >  443 [ACK] Seq=346 Ack=346 Win=3072 Len=1"
"1069","2016-09-26 23:03:44.510675","192.168.1.196","54.210.202.2","TLSv1.2","139","Application Data"
"1072","2016-09-26 23:03:44.728742","192.168.1.196","54.210.202.2","TCP","60","2173  >  443 [ACK] Seq=432 Ack=415 Win=3072 Len=0"
"1159","2016-09-26 23:03:54.713310","192.168.1.196","54.210.202.2","TCP","60","[TCP Keep-Alive] 2173  >  443 [ACK] Seq=431 Ack=415 Win=3072 Len=1"
"1180","2016-09-26 23:03:59.939288","Physical_00:67:5e","Tp-LinkT_51:33:ea","ARP","60","192.168.1.196 is at d0:52:a8:00:67:5e"
"1198","2016-09-26 23:04:04.917234","192.168.1.196","54.210.202.2","TCP","60","[TCP Keep-Alive] 2173  >  443 [ACK] Seq=431 Ack=415 Win=3072 Len=1"
"1242","2016-09-26 23:04:15.119959","192.168.1.196","54.210.202.2","TCP","60","[TCP Keep-Alive] 2173  >  443 [ACK] Seq=431 Ack=415 Win=3072 Len=1"
"1293","2016-09-26 23:04:25.324805","192.168.1.196","54.210.202.2","TCP","60","[TCP Keep-Alive] 2173  >  443 [ACK] Seq=431 Ack=415 Win=3072 Len=1"
"1332","2016-09-26 23:04:35.531479","192.168.1.196","54.210.202.2","TCP","60","[TCP Keep-Alive] 2173  >  443 [ACK] Seq=431 Ack=415 Win=3072 Len=1"
"1366","2016-09-26 23:04:40.769257","Physical_00:67:5e","Tp-LinkT_51:33:ea","ARP","60","192.168.1.196 is at d0:52:a8:00:67:5e"
"1385","2016-09-26 23:04:43.422063","192.168.1.196","54.210.202.2","TLSv1.2","123","Application Data"
"1388","2016-09-26 23:04:43.656076","192.168.1.196","54.210.202.2","TCP","60","2173  >  443 [ACK] Seq=501 Ack=484 Win=3072 Len=0"
"1512","2016-09-26 23:04:53.640669","192.168.1.196","54.210.202.2","TCP","60","[TCP Keep-Alive] 2173  >  443 [ACK] Seq=500 Ack=484 Win=3072 Len=1"
"1567","2016-09-26 23:05:03.843323","192.168.1.196","54.210.202.2","TCP","60","[TCP Keep-Alive] 2173  >  443 [ACK] Seq=500 Ack=484 Win=3072 Len=1"
"1611","2016-09-26 23:05:14.049146","192.168.1.196","54.210.202.2","TCP","60","[TCP Keep-Alive] 2173  >  443 [ACK] Seq=500 Ack=484 Win=3072 Len=1"
"1648","2016-09-26 23:05:19.289245","Physical_00:67:5e","Tp-LinkT_51:33:ea","ARP","60","192.168.1.196 is at d0:52:a8:00:67:5e"
"1669","2016-09-26 23:05:24.268999","192.168.1.196","54.210.202.2","TCP","60","[TCP Keep-Alive] 2173  >  443 [ACK] Seq=500 Ack=484 Win=3072 Len=1"
"1737","2016-09-26 23:05:34.219024","192.168.1.196","54.210.202.2","TLSv1.2","123","Application Data"
"1741","2016-09-26 23:05:34.443827","192.168.1.196","54.210.202.2","TCP","60","2173  >  443 [ACK] Seq=570 Ack=553 Win=3072 Len=0"
"1811","2016-09-26 23:05:44.428884","192.168.1.196","54.210.202.2","TCP","60","[TCP Keep-Alive] 2173  >  443 [ACK] Seq=569 Ack=553 Win=3072 Len=1"
"1912","2016-09-26 23:05:54.629959","192.168.1.196","54.210.202.2","TCP","60","[TCP Keep-Alive] 2173  >  443 [ACK] Seq=569 Ack=553 Win=3072 Len=1"
"1942","2016-09-26 23:05:59.859250","Physical_00:67:5e","Tp-LinkT_51:33:ea","ARP","60","192.168.1.196 is at d0:52:a8:00:67:5e"
"1971","2016-09-26 23:06:04.843234","192.168.1.196","54.210.202.2","TCP","60","[TCP Keep-Alive] 2173  >  443 [ACK] Seq=569 Ack=553 Win=3072 Len=1"
"2012","2016-09-26 23:06:15.067091","192.168.1.196","54.210.202.2","TCP","60","[TCP Keep-Alive] 2173  >  443 [ACK] Seq=569 Ack=553 Win=3072 Len=1"
"2050","2016-09-26 23:06:25.293834","192.168.1.196","54.210.202.2","TCP","60","[TCP Keep-Alive] 2173  >  443 [ACK] Seq=569 Ack=553 Win=3072 Len=1"
"2076","2016-09-26 23:06:33.131047","192.168.1.196","54.210.202.2","TLSv1.2","123","Application Data"
"2080","2016-09-26 23:06:33.354667","192.168.1.196","54.210.202.2","TCP","60","2173  >  443 [ACK] Seq=639 Ack=622 Win=3072 Len=0"
"2109","2016-09-26 23:06:38.359279","Physical_00:67:5e","Tp-LinkT_51:33:ea","ARP","60","192.168.1.196 is at d0:52:a8:00:67:5e"
"2117","2016-09-26 23:06:39.121924","192.168.1.196","54.210.202.2","TLSv1.2","123","Application Data"
"2120","2016-09-26 23:06:39.356041","192.168.1.196","54.210.202.2","TCP","60","2173  >  443 [ACK] Seq=708 Ack=691 Win=3072 Len=0"
"2185","2016-09-26 23:06:49.340657","192.168.1.196","54.210.202.2","TCP","60","[TCP Keep-Alive] 2173  >  443 [ACK] Seq=707 Ack=691 Win=3072 Len=1"
"2218","2016-09-26 23:06:59.543048","192.168.1.196","54.210.202.2","TCP","60","[TCP Keep-Alive] 2173  >  443 [ACK] Seq=707 Ack=691 Win=3072 Len=1"
"2252","2016-09-26 23:07:09.753910","192.168.1.196","54.210.202.2","TCP","60","[TCP Keep-Alive] 2173  >  443 [ACK] Seq=707 Ack=691 Win=3072 Len=1"
"2319","2016-09-26 23:07:19.962831","192.168.1.196","54.210.202.2","TCP","60","[TCP Keep-Alive] 2173  >  443 [ACK] Seq=707 Ack=691 Win=3072 Len=1"
"2369","2016-09-26 23:07:25.199256","Physical_00:67:5e","Tp-LinkT_51:33:ea","ARP","60","192.168.1.196 is at d0:52:a8:00:67:5e"
"2394","2016-09-26 23:07:30.175360","192.168.1.196","54.210.202.2","TCP","60","[TCP Keep-Alive] 2173  >  443 [ACK] Seq=707 Ack=691 Win=3072 Len=1"
"2420","2016-09-26 23:07:38.033488","192.168.1.196","54.210.202.2","TLSv1.2","123","Application Data"
"2423","2016-09-26 23:07:38.267852","192.168.1.196","54.210.202.2","TCP","60","2173  >  443 [ACK] Seq=777 Ack=760 Win=3072 Len=0"
"2457","2016-09-26 23:07:45.146493","192.168.1.196","54.210.202.2","TLSv1.2","139","Application Data"
"2459","2016-09-26 23:07:45.379677","192.168.1.196","54.210.202.2","TCP","60","2173  >  443 [ACK] Seq=862 Ack=829 Win=3072 Len=0"
"2502","2016-09-26 23:07:55.364172","192.168.1.196","54.210.202.2","TCP","60","[TCP Keep-Alive] 2173  >  443 [ACK] Seq=861 Ack=829 Win=3072 Len=1"
"2534","2016-09-26 23:08:03.517735","192.168.1.196","54.210.202.2","TLSv1.2","123","Application Data"
"2537","2016-09-26 23:08:03.749203","192.168.1.196","54.210.202.2","TCP","60","2173  >  443 [ACK] Seq=931 Ack=898 Win=3072 Len=0"
"2604","2016-09-26 23:08:08.749232","Physical_00:67:5e","Tp-LinkT_51:33:ea","ARP","60","192.168.1.196 is at d0:52:a8:00:67:5e"
"2625","2016-09-26 23:08:13.733800","192.168.1.196","54.210.202.2","TCP","60","[TCP Keep-Alive] 2173  >  443 [ACK] Seq=930 Ack=898 Win=3072 Len=1"
"2666","2016-09-26 23:08:23.943556","192.168.1.196","54.210.202.2","TCP","60","[TCP Keep-Alive] 2173  >  443 [ACK] Seq=930 Ack=898 Win=3072 Len=1"
"2728","2016-09-26 23:08:34.145412","192.168.1.196","54.210.202.2","TCP","60","[TCP Keep-Alive] 2173  >  443 [ACK] Seq=930 Ack=898 Win=3072 Len=1"
"2770","2016-09-26 23:08:44.350191","192.168.1.196","54.210.202.2","TCP","60","[TCP Keep-Alive] 2173  >  443 [ACK] Seq=930 Ack=898 Win=3072 Len=1"
"2820","2016-09-26 23:08:49.569271","Physical_00:67:5e","Tp-LinkT_51:33:ea","ARP","60","192.168.1.196 is at d0:52:a8:00:67:5e"
"2847","2016-09-26 23:08:54.551718","192.168.1.196","54.210.202.2","TCP","60","[TCP Keep-Alive] 2173  >  443 [ACK] Seq=930 Ack=898 Win=3072 Len=1"
"2872","2016-09-26 23:09:02.429006","192.168.1.196","54.210.202.2","TLSv1.2","123","Application Data"
"2875","2016-09-26 23:09:02.650575","192.168.1.196","54.210.202.2","TCP","60","2173  >  443 [ACK] Seq=1000 Ack=967 Win=3072 Len=0"
"2932","2016-09-26 23:09:12.635100","192.168.1.196","54.210.202.2","TCP","60","[TCP Keep-Alive] 2173  >  443 [ACK] Seq=999 Ack=967 Win=3072 Len=1"
"2979","2016-09-26 23:09:22.838960","192.168.1.196","54.210.202.2","TCP","60","[TCP Keep-Alive] 2173  >  443 [ACK] Seq=999 Ack=967 Win=3072 Len=1"
"3015","2016-09-26 23:09:28.079246","Physical_00:67:5e","Tp-LinkT_51:33:ea","ARP","60","192.168.1.196 is at d0:52:a8:00:67:5e"
"3035","2016-09-26 23:09:33.061861","192.168.1.196","54.210.202.2","TCP","60","[TCP Keep-Alive] 2173  >  443 [ACK] Seq=999 Ack=967 Win=3072 Len=1"
"3073","2016-09-26 23:09:43.272991","192.168.1.196","54.210.202.2","TCP","60","[TCP Keep-Alive] 2173  >  443 [ACK] Seq=999 Ack=967 Win=3072 Len=1"
"3200","2016-09-26 23:09:53.491407","192.168.1.196","54.210.202.2","TCP","60","[TCP Keep-Alive] 2173  >  443 [ACK] Seq=999 Ack=967 Win=3072 Len=1"
"3222","2016-09-26 23:10:01.340002","192.168.1.196","54.210.202.2","TLSv1.2","123","Application Data"
"3225","2016-09-26 23:10:01.573749","192.168.1.196","54.210.202.2","TCP","60","2173  >  443 [ACK] Seq=1069 Ack=1036 Win=3072 Len=0"
"3226","2016-09-26 23:10:01.669807","Physical_00:67:5e","Broadcast","ARP","60","Who has 192.168.1.1? Tell 192.168.1.196"
"3228","2016-09-26 23:10:01.669879","192.168.1.196","192.168.1.1","DNS","72","Standard query 0x01d3 A pool.ntp.org"
"3230","2016-09-26 23:10:01.681660","Physical_00:67:5e","Broadcast","ARP","60","Who has 192.168.1.1? Tell 192.168.1.196"
"3232","2016-09-26 23:10:01.681816","192.168.1.196","192.189.54.33","NTP","90","NTP Version 3, client"
"3245","2016-09-26 23:10:06.689254","Physical_00:67:5e","Tp-LinkT_51:33:ea","ARP","60","192.168.1.196 is at d0:52:a8:00:67:5e"
"3271","2016-09-26 23:10:11.558376","192.168.1.196","54.210.202.2","TCP","60","[TCP Keep-Alive] 2173  >  443 [ACK] Seq=1068 Ack=1036 Win=3072 Len=1"
"3321","2016-09-26 23:10:21.777823","192.168.1.196","54.210.202.2","TCP","60","[TCP Keep-Alive] 2173  >  443 [ACK] Seq=1068 Ack=1036 Win=3072 Len=1"
"3361","2016-09-26 23:10:31.996799","192.168.1.196","54.210.202.2","TCP","60","[TCP Keep-Alive] 2173  >  443 [ACK] Seq=1068 Ack=1036 Win=3072 Len=1"
"3363","2016-09-26 23:10:32.816503","192.168.1.196","54.210.202.2","TLSv1.2","123","Application Data"
"3368","2016-09-26 23:10:33.052856","192.168.1.196","54.210.202.2","TCP","60","2173  >  443 [ACK] Seq=1138 Ack=1105 Win=3072 Len=0"
"3394","2016-09-26 23:10:43.037323","192.168.1.196","54.210.202.2","TCP","60","[TCP Keep-Alive] 2173  >  443 [ACK] Seq=1137 Ack=1105 Win=3072 Len=1"
"3420","2016-09-26 23:10:48.259279","Physical_00:67:5e","Tp-LinkT_51:33:ea","ARP","60","192.168.1.196 is at d0:52:a8:00:67:5e"
"3438","2016-09-26 23:10:53.239533","192.168.1.196","54.210.202.2","TCP","60","[TCP Keep-Alive] 2173  >  443 [ACK] Seq=1137 Ack=1105 Win=3072 Len=1"
"3485","2016-09-26 23:11:03.440615","192.168.1.196","54.210.202.2","TCP","60","[TCP Keep-Alive] 2173  >  443 [ACK] Seq=1137 Ack=1105 Win=3072 Len=1"
"3527","2016-09-26 23:11:13.641922","192.168.1.196","54.210.202.2","TCP","60","[TCP Keep-Alive] 2173  >  443 [ACK] Seq=1137 Ack=1105 Win=3072 Len=1"
"3621","2016-09-26 23:11:23.842809","192.168.1.196","54.210.202.2","TCP","60","[TCP Keep-Alive] 2173  >  443 [ACK] Seq=1137 Ack=1105 Win=3072 Len=1"
"3643","2016-09-26 23:11:29.069284","Physical_00:67:5e","Tp-LinkT_51:33:ea","ARP","60","192.168.1.196 is at d0:52:a8:00:67:5e"
"3657","2016-09-26 23:11:31.727081","192.168.1.196","54.210.202.2","TLSv1.2","123","Application Data"
"3660","2016-09-26 23:11:31.944744","192.168.1.196","54.210.202.2","TCP","60","2173  >  443 [ACK] Seq=1207 Ack=1174 Win=3072 Len=0"
"3688","2016-09-26 23:11:39.873351","192.168.1.196","54.210.202.2","TLSv1.2","123","Application Data"
"3691","2016-09-26 23:11:40.092001","192.168.1.196","54.210.202.2","TCP","60","2173  >  443 [ACK] Seq=1276 Ack=1243 Win=3072 Len=0"
"3719","2016-09-26 23:11:45.779080","192.168.1.196","54.210.202.2","TLSv1.2","139","Application Data"
"3723","2016-09-26 23:11:45.997473","192.168.1.196","54.210.202.2","TCP","60","2173  >  443 [ACK] Seq=1361 Ack=1312 Win=3072 Len=0"
"3774","2016-09-26 23:11:55.981941","192.168.1.196","54.210.202.2","TCP","60","[TCP Keep-Alive] 2173  >  443 [ACK] Seq=1360 Ack=1312 Win=3072 Len=1"
"3822","2016-09-26 23:12:06.183028","192.168.1.196","54.210.202.2","TCP","60","[TCP Keep-Alive] 2173  >  443 [ACK] Seq=1360 Ack=1312 Win=3072 Len=1"
"3842","2016-09-26 23:12:11.399224","Physical_00:67:5e","Tp-LinkT_51:33:ea","ARP","60","192.168.1.196 is at d0:52:a8:00:67:5e"
"3877","2016-09-26 23:12:16.384173","192.168.1.196","54.210.202.2","TCP","60","[TCP Keep-Alive] 2173  >  443 [ACK] Seq=1360 Ack=1312 Win=3072 Len=1"
"3919","2016-09-26 23:12:26.585578","192.168.1.196","54.210.202.2","TCP","60","[TCP Keep-Alive] 2173  >  443 [ACK] Seq=1360 Ack=1312 Win=3072 Len=1"
"3962","2016-09-26 23:12:36.786815","192.168.1.196","54.210.202.2","TCP","60","[TCP Keep-Alive] 2173  >  443 [ACK] Seq=1360 Ack=1312 Win=3072 Len=1"
"3993","2016-09-26 23:12:42.009277","Physical_00:67:5e","Tp-LinkT_51:33:ea","ARP","60","192.168.1.196 is at d0:52:a8:00:67:5e"
"3999","2016-09-26 23:12:44.691197","192.168.1.196","54.210.202.2","TLSv1.2","123","Application Data"
"4010","2016-09-26 23:12:44.952907","192.168.1.196","54.210.202.2","TCP","60","2173  >  443 [ACK] Seq=1430 Ack=1381 Win=3072 Len=0"
"4045","2016-09-26 23:12:54.937527","192.168.1.196","54.210.202.2","TCP","60","[TCP Keep-Alive] 2173  >  443 [ACK] Seq=1429 Ack=1381 Win=3072 Len=1"
"4087","2016-09-26 23:13:05.138843","192.168.1.196","54.210.202.2","TCP","60","[TCP Keep-Alive] 2173  >  443 [ACK] Seq=1429 Ack=1381 Win=3072 Len=1"
"4115","2016-09-26 23:13:10.359253","Physical_00:67:5e","Tp-LinkT_51:33:ea","ARP","60","192.168.1.196 is at d0:52:a8:00:67:5e"
"4138","2016-09-26 23:13:15.340005","192.168.1.196","54.210.202.2","TCP","60","[TCP Keep-Alive] 2173  >  443 [ACK] Seq=1429 Ack=1381 Win=3072 Len=1"
"4181","2016-09-26 23:13:25.541139","192.168.1.196","54.210.202.2","TCP","60","[TCP Keep-Alive] 2173  >  443 [ACK] Seq=1429 Ack=1381 Win=3072 Len=1"
"4230","2016-09-26 23:13:35.742184","192.168.1.196","54.210.202.2","TCP","60","[TCP Keep-Alive] 2173  >  443 [ACK] Seq=1429 Ack=1381 Win=3072 Len=1"
"4263","2016-09-26 23:13:40.959275","Physical_00:67:5e","Tp-LinkT_51:33:ea","ARP","60","192.168.1.196 is at d0:52:a8:00:67:5e"
"4274","2016-09-26 23:13:43.602052","192.168.1.196","54.210.202.2","TLSv1.2","123","Application Data"
"4279","2016-09-26 23:13:43.819956","192.168.1.196","54.210.202.2","TCP","60","2173  >  443 [ACK] Seq=1499 Ack=1450 Win=3072 Len=0"
"4335","2016-09-26 23:13:53.804753","192.168.1.196","54.210.202.2","TCP","60","[TCP Keep-Alive] 2173  >  443 [ACK] Seq=1498 Ack=1450 Win=3072 Len=1"
"4398","2016-09-26 23:14:04.011352","192.168.1.196","54.210.202.2","TCP","60","[TCP Keep-Alive] 2173  >  443 [ACK] Seq=1498 Ack=1450 Win=3072 Len=1"
"4413","2016-09-26 23:14:08.302269","192.168.1.196","54.210.202.2","TLSv1.2","123","Application Data"
"4417","2016-09-26 23:14:08.520759","192.168.1.196","54.210.202.2","TCP","60","2173  >  443 [ACK] Seq=1568 Ack=1519 Win=3072 Len=0"
"4420","2016-09-26 23:14:09.229218","Physical_00:67:5e","Tp-LinkT_51:33:ea","ARP","60","192.168.1.196 is at d0:52:a8:00:67:5e"
"4472","2016-09-26 23:14:18.505403","192.168.1.196","54.210.202.2","TCP","60","[TCP Keep-Alive] 2173  >  443 [ACK] Seq=1567 Ack=1519 Win=3072 Len=1"
"4527","2016-09-26 23:14:28.708150","192.168.1.196","54.210.202.2","TCP","60","[TCP Keep-Alive] 2173  >  443 [ACK] Seq=1567 Ack=1519 Win=3072 Len=1"
"4578","2016-09-26 23:14:38.909148","192.168.1.196","54.210.202.2","TCP","60","[TCP Keep-Alive] 2173  >  443 [ACK] Seq=1567 Ack=1519 Win=3072 Len=1"
"4603","2016-09-26 23:14:44.130306","Physical_00:67:5e","Tp-LinkT_51:33:ea","ARP","60","192.168.1.196 is at d0:52:a8:00:67:5e"
"4699","2016-09-26 23:14:49.112760","192.168.1.196","54.210.202.2","TCP","60","[TCP Keep-Alive] 2173  >  443 [ACK] Seq=1567 Ack=1519 Win=3072 Len=1"
"4737","2016-09-26 23:14:59.313814","192.168.1.196","54.210.202.2","TCP","60","[TCP Keep-Alive] 2173  >  443 [ACK] Seq=1567 Ack=1519 Win=3072 Len=1"
"4788","2016-09-26 23:15:07.212729","192.168.1.196","54.210.202.2","TLSv1.2","123","Application Data"
"4796","2016-09-26 23:15:07.432456","192.168.1.196","54.210.202.2","TCP","60","2173  >  443 [ACK] Seq=1637 Ack=1588 Win=3072 Len=0"
"4836","2016-09-26 23:15:12.439294","Physical_00:67:5e","Tp-LinkT_51:33:ea","ARP","60","192.168.1.196 is at d0:52:a8:00:67:5e"
"4861","2016-09-26 23:15:17.416897","192.168.1.196","54.210.202.2","TCP","60","[TCP Keep-Alive] 2173  >  443 [ACK] Seq=1636 Ack=1588 Win=3072 Len=1"
"4903","2016-09-26 23:15:27.618993","192.168.1.196","54.210.202.2","TCP","60","[TCP Keep-Alive] 2173  >  443 [ACK] Seq=1636 Ack=1588 Win=3072 Len=1"
"4940","2016-09-26 23:15:37.820618","192.168.1.196","54.210.202.2","TCP","60","[TCP Keep-Alive] 2173  >  443 [ACK] Seq=1636 Ack=1588 Win=3072 Len=1"
"4978","2016-09-26 23:15:43.039311","Physical_00:67:5e","Tp-LinkT_51:33:ea","ARP","60","192.168.1.196 is at d0:52:a8:00:67:5e"
"5005","2016-09-26 23:15:46.419151","192.168.1.196","54.210.202.2","TLSv1.2","139","Application Data"
"5008","2016-09-26 23:15:46.638028","192.168.1.196","54.210.202.2","TCP","60","2173  >  443 [ACK] Seq=1722 Ack=1657 Win=3072 Len=0"
"5050","2016-09-26 23:15:56.622663","192.168.1.196","54.210.202.2","TCP","60","[TCP Keep-Alive] 2173  >  443 [ACK] Seq=1721 Ack=1657 Win=3072 Len=1"
"5112","2016-09-26 23:16:06.823676","192.168.1.196","54.210.202.2","TCP","60","[TCP Keep-Alive] 2173  >  443 [ACK] Seq=1721 Ack=1657 Win=3072 Len=1"
"5134","2016-09-26 23:16:12.049213","Physical_00:67:5e","Tp-LinkT_51:33:ea","ARP","60","192.168.1.196 is at d0:52:a8:00:67:5e"
"5161","2016-09-26 23:16:17.024487","192.168.1.196","54.210.202.2","TCP","60","[TCP Keep-Alive] 2173  >  443 [ACK] Seq=1721 Ack=1657 Win=3072 Len=1"
"5197","2016-09-26 23:16:27.225800","192.168.1.196","54.210.202.2","TCP","60","[TCP Keep-Alive] 2173  >  443 [ACK] Seq=1721 Ack=1657 Win=3072 Len=1"
"5244","2016-09-26 23:16:37.426688","192.168.1.196","54.210.202.2","TCP","60","[TCP Keep-Alive] 2173  >  443 [ACK] Seq=1721 Ack=1657 Win=3072 Len=1"
"5245","2016-09-26 23:16:37.603168","192.168.1.196","54.210.202.2","TLSv1.2","123","Application Data"
"5250","2016-09-26 23:16:37.822612","192.168.1.196","54.210.202.2","TCP","60","2173  >  443 [ACK] Seq=1791 Ack=1726 Win=3072 Len=0"
"5261","2016-09-26 23:16:40.627136","192.168.1.196","54.210.202.2","TLSv1.2","123","Application Data"
"5265","2016-09-26 23:16:40.846398","192.168.1.196","54.210.202.2","TCP","60","2173  >  443 [ACK] Seq=1860 Ack=1795 Win=3072 Len=0"
"5272","2016-09-26 23:16:42.649260","Physical_00:67:5e","Tp-LinkT_51:33:ea","ARP","60","192.168.1.196 is at d0:52:a8:00:67:5e"
"5339","2016-09-26 23:16:50.831181","192.168.1.196","54.210.202.2","TCP","60","[TCP Keep-Alive] 2173  >  443 [ACK] Seq=1859 Ack=1795 Win=3072 Len=1"
"5372","2016-09-26 23:17:01.032056","192.168.1.196","54.210.202.2","TCP","60","[TCP Keep-Alive] 2173  >  443 [ACK] Seq=1859 Ack=1795 Win=3072 Len=1"
"5425","2016-09-26 23:17:11.232944","192.168.1.196","54.210.202.2","TCP","60","[TCP Keep-Alive] 2173  >  443 [ACK] Seq=1859 Ack=1795 Win=3072 Len=1"
"5466","2016-09-26 23:17:16.459267","Physical_00:67:5e","Tp-LinkT_51:33:ea","ARP","60","192.168.1.196 is at d0:52:a8:00:67:5e"
"5482","2016-09-26 23:17:21.434436","192.168.1.196","54.210.202.2","TCP","60","[TCP Keep-Alive] 2173  >  443 [ACK] Seq=1859 Ack=1795 Win=3072 Len=1"
"5525","2016-09-26 23:17:31.635548","192.168.1.196","54.210.202.2","TCP","60","[TCP Keep-Alive] 2173  >  443 [ACK] Seq=1859 Ack=1795 Win=3072 Len=1"
"5597","2016-09-26 23:17:39.538278","192.168.1.196","54.210.202.2","TLSv1.2","123","Application Data"
"5602","2016-09-26 23:17:39.756013","192.168.1.196","54.210.202.2","TCP","60","2173  >  443 [ACK] Seq=1929 Ack=1864 Win=3072 Len=0"
"5661","2016-09-26 23:17:49.740782","192.168.1.196","54.210.202.2","TCP","60","[TCP Keep-Alive] 2173  >  443 [ACK] Seq=1928 Ack=1864 Win=3072 Len=1"
"5696","2016-09-26 23:17:54.959264","Physical_00:67:5e","Tp-LinkT_51:33:ea","ARP","60","192.168.1.196 is at d0:52:a8:00:67:5e"
"5711","2016-09-26 23:17:59.942021","192.168.1.196","54.210.202.2","TCP","60","[TCP Keep-Alive] 2173  >  443 [ACK] Seq=1928 Ack=1864 Win=3072 Len=1"
"5748","2016-09-26 23:18:10.143225","192.168.1.196","54.210.202.2","TCP","60","[TCP Keep-Alive] 2173  >  443 [ACK] Seq=1928 Ack=1864 Win=3072 Len=1"
"5799","2016-09-26 23:18:20.344490","192.168.1.196","54.210.202.2","TCP","60","[TCP Keep-Alive] 2173  >  443 [ACK] Seq=1928 Ack=1864 Win=3072 Len=1"
"5821","2016-09-26 23:18:25.569229","Physical_00:67:5e","Tp-LinkT_51:33:ea","ARP","60","192.168.1.196 is at d0:52:a8:00:67:5e"
"5838","2016-09-26 23:18:30.545593","192.168.1.196","54.210.202.2","TCP","60","[TCP Keep-Alive] 2173  >  443 [ACK] Seq=1928 Ack=1864 Win=3072 Len=1"
"5887","2016-09-26 23:18:38.450460","192.168.1.196","54.210.202.2","TLSv1.2","123","Application Data"
"5891","2016-09-26 23:18:38.668607","192.168.1.196","54.210.202.2","TCP","60","2173  >  443 [ACK] Seq=1998 Ack=1933 Win=3072 Len=0"
"5953","2016-09-26 23:18:48.653387","192.168.1.196","54.210.202.2","TCP","60","[TCP Keep-Alive] 2173  >  443 [ACK] Seq=1997 Ack=1933 Win=3072 Len=1"
"6036","2016-09-26 23:18:58.854530","192.168.1.196","54.210.202.2","TCP","60","[TCP Keep-Alive] 2173  >  443 [ACK] Seq=1997 Ack=1933 Win=3072 Len=1"
"6050","2016-09-26 23:19:04.079236","Physical_00:67:5e","Tp-LinkT_51:33:ea","ARP","60","192.168.1.196 is at d0:52:a8:00:67:5e"
"6070","2016-09-26 23:19:06.900296","192.168.1.196","54.210.202.2","TLSv1.2","123","Application Data"
"6073","2016-09-26 23:19:07.120093","192.168.1.196","54.210.202.2","TCP","60","2173  >  443 [ACK] Seq=2067 Ack=2002 Win=3072 Len=0"
"6123","2016-09-26 23:19:17.104823","192.168.1.196","54.210.202.2","TCP","60","[TCP Keep-Alive] 2173  >  443 [ACK] Seq=2066 Ack=2002 Win=3072 Len=1"
"6160","2016-09-26 23:19:27.305901","192.168.1.196","54.210.202.2","TCP","60","[TCP Keep-Alive] 2173  >  443 [ACK] Seq=2066 Ack=2002 Win=3072 Len=1"
"6204","2016-09-26 23:19:37.510018","192.168.1.196","54.210.202.2","TCP","60","[TCP Keep-Alive] 2173  >  443 [ACK] Seq=2066 Ack=2002 Win=3072 Len=1"
"6232","2016-09-26 23:19:42.729231","Physical_00:67:5e","Tp-LinkT_51:33:ea","ARP","60","192.168.1.196 is at d0:52:a8:00:67:5e"
"6299","2016-09-26 23:19:47.050068","192.168.1.196","54.210.202.2","TLSv1.2","139","Application Data"
"6321","2016-09-26 23:19:47.268840","192.168.1.196","54.210.202.2","TCP","60","2173  >  443 [ACK] Seq=2152 Ack=2071 Win=3072 Len=0"
"6373","2016-09-26 23:19:57.253121","192.168.1.196","54.210.202.2","TCP","60","[TCP Keep-Alive] 2173  >  443 [ACK] Seq=2151 Ack=2071 Win=3072 Len=1"
"6387","2016-09-26 23:20:00.966624","Physical_00:67:5e","Broadcast","ARP","60","Who has 192.168.1.1? Tell 192.168.1.196"
"6389","2016-09-26 23:20:00.966680","192.168.1.196","192.168.1.1","DNS","72","Standard query 0x01d4 A pool.ntp.org"
"6391","2016-09-26 23:20:00.971447","Physical_00:67:5e","Broadcast","ARP","60","Who has 192.168.1.1? Tell 192.168.1.196"
"6393","2016-09-26 23:20:00.971597","192.168.1.196","27.124.125.252","NTP","90","NTP Version 3, client"
"6418","2016-09-26 23:20:07.453914","192.168.1.196","54.210.202.2","TCP","60","[TCP Keep-Alive] 2173  >  443 [ACK] Seq=2151 Ack=2071 Win=3072 Len=1"
"6445","2016-09-26 23:20:12.679249","Physical_00:67:5e","Tp-LinkT_51:33:ea","ARP","60","192.168.1.196 is at d0:52:a8:00:67:5e"
"6465","2016-09-26 23:20:17.654710","192.168.1.196","54.210.202.2","TCP","60","[TCP Keep-Alive] 2173  >  443 [ACK] Seq=2151 Ack=2071 Win=3072 Len=1"
"6516","2016-09-26 23:20:27.855673","192.168.1.196","54.210.202.2","TCP","60","[TCP Keep-Alive] 2173  >  443 [ACK] Seq=2151 Ack=2071 Win=3072 Len=1"
"6548","2016-09-26 23:20:38.056300","192.168.1.196","54.210.202.2","TCP","60","[TCP Keep-Alive] 2173  >  443 [ACK] Seq=2151 Ack=2071 Win=3072 Len=1"
"6583","2016-09-26 23:20:43.279283","Physical_00:67:5e","Tp-LinkT_51:33:ea","ARP","60","192.168.1.196 is at d0:52:a8:00:67:5e"
"6600","2016-09-26 23:20:45.959320","192.168.1.196","54.210.202.2","TLSv1.2","123","Application Data"
"6603","2016-09-26 23:20:46.176914","192.168.1.196","54.210.202.2","TCP","60","2173  >  443 [ACK] Seq=2221 Ack=2140 Win=3072 Len=0"
"6704","2016-09-26 23:20:56.161313","192.168.1.196","54.210.202.2","TCP","60","[TCP Keep-Alive] 2173  >  443 [ACK] Seq=2220 Ack=2140 Win=3072 Len=1"
"6738","2016-09-26 23:21:06.362032","192.168.1.196","54.210.202.2","TCP","60","[TCP Keep-Alive] 2173  >  443 [ACK] Seq=2220 Ack=2140 Win=3072 Len=1"
"6785","2016-09-26 23:21:16.562829","192.168.1.196","54.210.202.2","TCP","60","[TCP Keep-Alive] 2173  >  443 [ACK] Seq=2220 Ack=2140 Win=3072 Len=1"
"6800","2016-09-26 23:21:21.789220","Physical_00:67:5e","Tp-LinkT_51:33:ea","ARP","60","192.168.1.196 is at d0:52:a8:00:67:5e"
"6839","2016-09-26 23:21:26.763928","192.168.1.196","54.210.202.2","TCP","60","[TCP Keep-Alive] 2173  >  443 [ACK] Seq=2220 Ack=2140 Win=3072 Len=1"
"6879","2016-09-26 23:21:36.195586","192.168.1.196","54.210.202.2","TLSv1.2","123","Application Data"
"6883","2016-09-26 23:21:36.414432","192.168.1.196","54.210.202.2","TCP","60","2173  >  443 [ACK] Seq=2290 Ack=2209 Win=3072 Len=0"
"6903","2016-09-26 23:21:41.378755","192.168.1.196","54.210.202.2","TLSv1.2","123","Application Data"
"6907","2016-09-26 23:21:41.598079","192.168.1.196","54.210.202.2","TCP","60","2173  >  443 [ACK] Seq=2359 Ack=2278 Win=3072 Len=0"
"6955","2016-09-26 23:21:51.582299","192.168.1.196","54.210.202.2","TCP","60","[TCP Keep-Alive] 2173  >  443 [ACK] Seq=2358 Ack=2278 Win=3072 Len=1"
"7010","2016-09-26 23:22:01.783004","192.168.1.196","54.210.202.2","TCP","60","[TCP Keep-Alive] 2173  >  443 [ACK] Seq=2358 Ack=2278 Win=3072 Len=1"
"7047","2016-09-26 23:22:11.983870","192.168.1.196","54.210.202.2","TCP","60","[TCP Keep-Alive] 2173  >  443 [ACK] Seq=2358 Ack=2278 Win=3072 Len=1"
"7077","2016-09-26 23:22:17.209239","Physical_00:67:5e","Tp-LinkT_51:33:ea","ARP","60","192.168.1.196 is at d0:52:a8:00:67:5e"
"7090","2016-09-26 23:22:22.184508","192.168.1.196","54.210.202.2","TCP","60","[TCP Keep-Alive] 2173  >  443 [ACK] Seq=2358 Ack=2278 Win=3072 Len=1"
"7135","2016-09-26 23:22:32.385354","192.168.1.196","54.210.202.2","TCP","60","[TCP Keep-Alive] 2173  >  443 [ACK] Seq=2358 Ack=2278 Win=3072 Len=1"
"7158","2016-09-26 23:22:40.287659","192.168.1.196","54.210.202.2","TLSv1.2","123","Application Data"
"7162","2016-09-26 23:22:40.505852","192.168.1.196","54.210.202.2","TCP","60","2173  >  443 [ACK] Seq=2428 Ack=2347 Win=3072 Len=0"
"7228","2016-09-26 23:22:50.490024","192.168.1.196","54.210.202.2","TCP","60","[TCP Keep-Alive] 2173  >  443 [ACK] Seq=2427 Ack=2347 Win=3072 Len=1"
"7276","2016-09-26 23:23:00.690807","192.168.1.196","54.210.202.2","TCP","60","[TCP Keep-Alive] 2173  >  443 [ACK] Seq=2427 Ack=2347 Win=3072 Len=1"
"7300","2016-09-26 23:23:05.909272","Physical_00:67:5e","Tp-LinkT_51:33:ea","ARP","60","192.168.1.196 is at d0:52:a8:00:67:5e"
"7320","2016-09-26 23:23:10.891568","192.168.1.196","54.210.202.2","TCP","60","[TCP Keep-Alive] 2173  >  443 [ACK] Seq=2427 Ack=2347 Win=3072 Len=1"
"7388","2016-09-26 23:23:21.096957","192.168.1.196","54.210.202.2","TCP","60","[TCP Keep-Alive] 2173  >  443 [ACK] Seq=2427 Ack=2347 Win=3072 Len=1"
"7435","2016-09-26 23:23:31.297595","192.168.1.196","54.210.202.2","TCP","60","[TCP Keep-Alive] 2173  >  443 [ACK] Seq=2427 Ack=2347 Win=3072 Len=1"
"7468","2016-09-26 23:23:39.196366","192.168.1.196","54.210.202.2","TLSv1.2","123","Application Data"
"7471","2016-09-26 23:23:39.414094","192.168.1.196","54.210.202.2","TCP","60","2173  >  443 [ACK] Seq=2497 Ack=2416 Win=3072 Len=0"
"7504","2016-09-26 23:23:47.680789","192.168.1.196","54.210.202.2","TLSv1.2","139","Application Data"
"7510","2016-09-26 23:23:47.899182","192.168.1.196","54.210.202.2","TCP","60","2173  >  443 [ACK] Seq=2582 Ack=2485 Win=3072 Len=0"
"7538","2016-09-26 23:23:52.899269","Physical_00:67:5e","Tp-LinkT_51:33:ea","ARP","60","192.168.1.196 is at d0:52:a8:00:67:5e"
"7552","2016-09-26 23:23:57.883561","192.168.1.196","54.210.202.2","TCP","60","[TCP Keep-Alive] 2173  >  443 [ACK] Seq=2581 Ack=2485 Win=3072 Len=1"
"7593","2016-09-26 23:24:05.491305","192.168.1.196","54.210.202.2","TLSv1.2","123","Application Data"
"7597","2016-09-26 23:24:05.710638","192.168.1.196","54.210.202.2","TCP","60","2173  >  443 [ACK] Seq=2651 Ack=2554 Win=3072 Len=0"
"7645","2016-09-26 23:24:15.695035","192.168.1.196","54.210.202.2","TCP","60","[TCP Keep-Alive] 2173  >  443 [ACK] Seq=2650 Ack=2554 Win=3072 Len=1"
"7678","2016-09-26 23:24:25.895723","192.168.1.196","54.210.202.2","TCP","60","[TCP Keep-Alive] 2173  >  443 [ACK] Seq=2650 Ack=2554 Win=3072 Len=1"
"7737","2016-09-26 23:24:36.096480","192.168.1.196","54.210.202.2","TCP","60","[TCP Keep-Alive] 2173  >  443 [ACK] Seq=2650 Ack=2554 Win=3072 Len=1"
"7765","2016-09-26 23:24:41.319233","Physical_00:67:5e","Tp-LinkT_51:33:ea","ARP","60","192.168.1.196 is at d0:52:a8:00:67:5e"
"7796","2016-09-26 23:24:46.297151","192.168.1.196","54.210.202.2","TCP","60","[TCP Keep-Alive] 2173  >  443 [ACK] Seq=2650 Ack=2554 Win=3072 Len=1"
"7918","2016-09-26 23:24:56.497904","192.168.1.196","54.210.202.2","TCP","60","[TCP Keep-Alive] 2173  >  443 [ACK] Seq=2650 Ack=2554 Win=3072 Len=1"
"7946","2016-09-26 23:25:04.400454","192.168.1.196","54.210.202.2","TLSv1.2","123","Application Data"
"7950","2016-09-26 23:25:04.630390","192.168.1.196","54.210.202.2","TCP","60","2173  >  443 [ACK] Seq=2720 Ack=2623 Win=3072 Len=0"
"7991","2016-09-26 23:25:14.614529","192.168.1.196","54.210.202.2","TCP","60","[TCP Keep-Alive] 2173  >  443 [ACK] Seq=2719 Ack=2623 Win=3072 Len=1"
"8045","2016-09-26 23:25:24.815166","192.168.1.196","54.210.202.2","TCP","60","[TCP Keep-Alive] 2173  >  443 [ACK] Seq=2719 Ack=2623 Win=3072 Len=1"
"8071","2016-09-26 23:25:30.039264","Physical_00:67:5e","Tp-LinkT_51:33:ea","ARP","60","192.168.1.196 is at d0:52:a8:00:67:5e"
"8090","2016-09-26 23:25:35.016159","192.168.1.196","54.210.202.2","TCP","60","[TCP Keep-Alive] 2173  >  443 [ACK] Seq=2719 Ack=2623 Win=3072 Len=1"
"8123","2016-09-26 23:25:42.652819","192.168.1.196","54.210.202.2","TLSv1.2","123","Application Data"
"8128","2016-09-26 23:25:42.871110","192.168.1.196","54.210.202.2","TCP","60","2173  >  443 [ACK] Seq=2789 Ack=2692 Win=3072 Len=0"
"8198","2016-09-26 23:25:52.855592","192.168.1.196","54.210.202.2","TCP","60","[TCP Keep-Alive] 2173  >  443 [ACK] Seq=2788 Ack=2692 Win=3072 Len=1"
"8248","2016-09-26 23:26:03.057064","192.168.1.196","54.210.202.2","TCP","60","[TCP Keep-Alive] 2173  >  443 [ACK] Seq=2788 Ack=2692 Win=3072 Len=1"
"8327","2016-09-26 23:26:13.259017","192.168.1.196","54.210.202.2","TCP","60","[TCP Keep-Alive] 2173  >  443 [ACK] Seq=2788 Ack=2692 Win=3072 Len=1"
"8354","2016-09-26 23:26:18.479274","Physical_00:67:5e","Tp-LinkT_51:33:ea","ARP","60","192.168.1.196 is at d0:52:a8:00:67:5e"
"8377","2016-09-26 23:26:23.460101","192.168.1.196","54.210.202.2","TCP","60","[TCP Keep-Alive] 2173  >  443 [ACK] Seq=2788 Ack=2692 Win=3072 Len=1"
"8419","2016-09-26 23:26:33.661979","192.168.1.196","54.210.202.2","TCP","60","[TCP Keep-Alive] 2173  >  443 [ACK] Seq=2788 Ack=2692 Win=3072 Len=1"
"8423","2016-09-26 23:26:34.788977","192.168.1.196","54.210.202.2","TLSv1.2","123","Application Data"
"8426","2016-09-26 23:26:35.007460","192.168.1.196","54.210.202.2","TCP","60","2173  >  443 [ACK] Seq=2858 Ack=2761 Win=3072 Len=0"
"8458","2016-09-26 23:26:42.127476","192.168.1.196","54.210.202.2","TLSv1.2","123","Application Data"
"8461","2016-09-26 23:26:42.345801","192.168.1.196","54.210.202.2","TCP","60","2173  >  443 [ACK] Seq=2927 Ack=2830 Win=3072 Len=0"
"8503","2016-09-26 23:26:52.330258","192.168.1.196","54.210.202.2","TCP","60","[TCP Keep-Alive] 2173  >  443 [ACK] Seq=2926 Ack=2830 Win=3072 Len=1"
"8565","2016-09-26 23:27:02.532395","192.168.1.196","54.210.202.2","TCP","60","[TCP Keep-Alive] 2173  >  443 [ACK] Seq=2926 Ack=2830 Win=3072 Len=1"
"8591","2016-09-26 23:27:07.749232","Physical_00:67:5e","Tp-LinkT_51:33:ea","ARP","60","192.168.1.196 is at d0:52:a8:00:67:5e"
"8605","2016-09-26 23:27:12.733723","192.168.1.196","54.210.202.2","TCP","60","[TCP Keep-Alive] 2173  >  443 [ACK] Seq=2926 Ack=2830 Win=3072 Len=1"
"8649","2016-09-26 23:27:22.934860","192.168.1.196","54.210.202.2","TCP","60","[TCP Keep-Alive] 2173  >  443 [ACK] Seq=2926 Ack=2830 Win=3072 Len=1"
"8733","2016-09-26 23:27:33.137814","192.168.1.196","54.210.202.2","TCP","60","[TCP Keep-Alive] 2173  >  443 [ACK] Seq=2926 Ack=2830 Win=3072 Len=1"
"8781","2016-09-26 23:27:41.039515","192.168.1.196","54.210.202.2","TLSv1.2","123","Application Data"
"8787","2016-09-26 23:27:41.269764","192.168.1.196","54.210.202.2","TCP","60","2173  >  443 [ACK] Seq=2996 Ack=2899 Win=3072 Len=0"
"8822","2016-09-26 23:27:46.259220","Physical_00:67:5e","Tp-LinkT_51:33:ea","ARP","60","192.168.1.196 is at d0:52:a8:00:67:5e"
"8827","2016-09-26 23:27:48.313667","192.168.1.196","54.210.202.2","TLSv1.2","139","Application Data"
"8829","2016-09-26 23:27:48.531951","192.168.1.196","54.210.202.2","TCP","60","2173  >  443 [ACK] Seq=3081 Ack=2968 Win=3072 Len=0"
"8860","2016-09-26 23:27:58.516659","192.168.1.196","54.210.202.2","TCP","60","[TCP Keep-Alive] 2173  >  443 [ACK] Seq=3080 Ack=2968 Win=3072 Len=1"
"8902","2016-09-26 23:28:08.717757","192.168.1.196","54.210.202.2","TCP","60","[TCP Keep-Alive] 2173  >  443 [ACK] Seq=3080 Ack=2968 Win=3072 Len=1"
"8960","2016-09-26 23:28:18.918916","192.168.1.196","54.210.202.2","TCP","60","[TCP Keep-Alive] 2173  >  443 [ACK] Seq=3080 Ack=2968 Win=3072 Len=1"
"8980","2016-09-26 23:28:24.139213","Physical_00:67:5e","Tp-LinkT_51:33:ea","ARP","60","192.168.1.196 is at d0:52:a8:00:67:5e"
"9001","2016-09-26 23:28:29.120069","192.168.1.196","54.210.202.2","TCP","60","[TCP Keep-Alive] 2173  >  443 [ACK] Seq=3080 Ack=2968 Win=3072 Len=1"
"9032","2016-09-26 23:28:39.321097","192.168.1.196","54.210.202.2","TCP","60","[TCP Keep-Alive] 2173  >  443 [ACK] Seq=3080 Ack=2968 Win=3072 Len=1"
"9080","2016-09-26 23:28:47.224946","192.168.1.196","54.210.202.2","TLSv1.2","123","Application Data"
"9083","2016-09-26 23:28:47.448108","192.168.1.196","54.210.202.2","TCP","60","2173  >  443 [ACK] Seq=3150 Ack=3037 Win=3072 Len=0"
"9143","2016-09-26 23:28:57.432777","192.168.1.196","54.210.202.2","TCP","60","[TCP Keep-Alive] 2173  >  443 [ACK] Seq=3149 Ack=3037 Win=3072 Len=1"
"9165","2016-09-26 23:29:02.649269","Physical_00:67:5e","Tp-LinkT_51:33:ea","ARP","60","192.168.1.196 is at d0:52:a8:00:67:5e"
"9175","2016-09-26 23:29:04.084711","192.168.1.196","54.210.202.2","TLSv1.2","123","Application Data"
"9179","2016-09-26 23:29:04.303892","192.168.1.196","54.210.202.2","TCP","60","2173  >  443 [ACK] Seq=3219 Ack=3106 Win=3072 Len=0"
"9258","2016-09-26 23:29:14.288343","192.168.1.196","54.210.202.2","TCP","60","[TCP Keep-Alive] 2173  >  443 [ACK] Seq=3218 Ack=3106 Win=3072 Len=1"
"9301","2016-09-26 23:29:24.489957","192.168.1.196","54.210.202.2","TCP","60","[TCP Keep-Alive] 2173  >  443 [ACK] Seq=3218 Ack=3106 Win=3072 Len=1"
"9376","2016-09-26 23:29:34.692278","192.168.1.196","54.210.202.2","TCP","60","[TCP Keep-Alive] 2173  >  443 [ACK] Seq=3218 Ack=3106 Win=3072 Len=1"
"9393","2016-09-26 23:29:39.909212","Physical_00:67:5e","Tp-LinkT_51:33:ea","ARP","60","192.168.1.196 is at d0:52:a8:00:67:5e"
"9412","2016-09-26 23:29:44.892903","192.168.1.196","54.210.202.2","TCP","60","[TCP Keep-Alive] 2173  >  443 [ACK] Seq=3218 Ack=3106 Win=3072 Len=1"
"9545","2016-09-26 23:29:55.093593","192.168.1.196","54.210.202.2","TCP","60","[TCP Keep-Alive] 2173  >  443 [ACK] Seq=3218 Ack=3106 Win=3072 Len=1"
"9560","2016-09-26 23:30:00.248726","Physical_00:67:5e","Broadcast","ARP","60","Who has 192.168.1.1? Tell 192.168.1.196"
"9562","2016-09-26 23:30:00.248781","192.168.1.196","192.168.1.1","DNS","72","Standard query 0x01d5 A pool.ntp.org"
"9564","2016-09-26 23:30:00.253833","Physical_00:67:5e","Broadcast","ARP","60","Who has 192.168.1.1? Tell 192.168.1.196"
"9566","2016-09-26 23:30:00.253977","192.168.1.196","202.127.210.37","NTP","90","NTP Version 3, client"
"9577","2016-09-26 23:30:02.993452","192.168.1.196","54.210.202.2","TLSv1.2","123","Application Data"
"9581","2016-09-26 23:30:03.211365","192.168.1.196","54.210.202.2","TCP","60","2173  >  443 [ACK] Seq=3288 Ack=3175 Win=3072 Len=0"
"9593","2016-09-26 23:30:06.244866","Physical_00:67:5e","Broadcast","ARP","60","Who has 192.168.1.1? Tell 192.168.1.196"
"9595","2016-09-26 23:30:06.244921","192.168.1.196","192.168.1.1","DNS","72","Standard query 0x01d6 A pool.ntp.org"
"9597","2016-09-26 23:30:06.245589","Physical_00:67:5e","Broadcast","ARP","60","Who has 192.168.1.1? Tell 192.168.1.196"
