"No.","Time","Source","Destination","Protocol","Length","Info"
"1","2018-08-23 02:43:35.663648","192.168.2.3","203.211.199.120","TLSv1.2","786","Application Data"
"6","2018-08-23 02:43:35.688286","192.168.2.3","203.211.199.120","TCP","66","52076  >  443 [ACK] Seq=721 Ack=1449 Win=982 Len=0 TSval=8089779 TSecr=1194371902"
"7","2018-08-23 02:43:35.688289","192.168.2.3","203.211.199.120","TCP","66","52076  >  443 [ACK] Seq=721 Ack=2897 Win=982 Len=0 TSval=8089779 TSecr=1194371902"
"8","2018-08-23 02:43:35.689187","192.168.2.3","203.211.199.120","TCP","66","52076  >  443 [ACK] Seq=721 Ack=5121 Win=982 Len=0 TSval=8089779 TSecr=1194371902"
"9","2018-08-23 02:43:37.097039","192.168.2.3","74.125.204.188","TCP","66","33038  >  5228 [ACK] Seq=1 Ack=1 Win=406 Len=0 TSval=8089920 TSecr=3816495510"
"12","2018-08-23 02:43:39.230535","192.168.2.3","192.168.2.1","TCP","183","8009  >  53029 [PSH, ACK] Seq=1 Ack=118 Win=277 Len=117 TSval=8090133 TSecr=2318153760 [TCP segment of a reassembled PDU]"
"14","2018-08-23 02:43:39.549949","192.168.2.3","216.58.197.4","TLSv1.2","156","Application Data"
"15","2018-08-23 02:43:39.549954","192.168.2.3","216.58.197.4","TLSv1.2","104","Application Data"
"16","2018-08-23 02:43:39.550684","192.168.2.3","216.58.197.4","TLSv1.2","159","Application Data"
"19","2018-08-23 02:43:39.567371","192.168.2.3","216.58.197.4","TCP","1434","34236  >  443 [ACK] Seq=222 Ack=39 Win=2363 Len=1368 TSval=8090166 TSecr=762794357 [TCP segment of a reassembled PDU]"
"20","2018-08-23 02:43:39.567712","192.168.2.3","216.58.197.4","TCP","1434","34236  >  443 [ACK] Seq=1590 Ack=39 Win=2363 Len=1368 TSval=8090167 TSecr=762794357 [TCP segment of a reassembled PDU]"
"21","2018-08-23 02:43:39.567715","192.168.2.3","216.58.197.4","TLSv1.2","212","Application Data"
"22","2018-08-23 02:43:39.568088","192.168.2.3","216.58.197.4","TLSv1.2","1389","Application Data"
"23","2018-08-23 02:43:39.568410","192.168.2.3","216.58.197.4","TCP","1434","34236  >  443 [ACK] Seq=4427 Ack=39 Win=2363 Len=1368 TSval=8090167 TSecr=762794357 [TCP segment of a reassembled PDU]"
"24","2018-08-23 02:43:39.568412","192.168.2.3","216.58.197.4","TCP","1434","34236  >  443 [ACK] Seq=5795 Ack=39 Win=2363 Len=1368 TSval=8090167 TSecr=762794357 [TCP segment of a reassembled PDU]"
"25","2018-08-23 02:43:39.568617","192.168.2.3","216.58.197.4","TLSv1.2","212","Application Data"
"26","2018-08-23 02:43:39.569020","192.168.2.3","216.58.197.4","TCP","1434","34236  >  443 [ACK] Seq=7309 Ack=39 Win=2363 Len=1368 TSval=8090167 TSecr=762794357 [TCP segment of a reassembled PDU]"
"27","2018-08-23 02:43:39.569022","192.168.2.3","216.58.197.4","TLSv1.2","156","Application Data"
"28","2018-08-23 02:43:39.569023","192.168.2.3","216.58.197.4","TCP","1434","34236  >  443 [ACK] Seq=8767 Ack=39 Win=2363 Len=1368 TSval=8090167 TSecr=762794357 [TCP segment of a reassembled PDU]"
"34","2018-08-23 02:43:39.573600","192.168.2.3","216.58.197.4","TCP","1434","34236  >  443 [ACK] Seq=10135 Ack=39 Win=2363 Len=1368 TSval=8090167 TSecr=762794374 [TCP segment of a reassembled PDU]"
"35","2018-08-23 02:43:39.573961","192.168.2.3","216.58.197.4","TLSv1.2","1434","Application Data [TCP segment of a reassembled PDU]"
"36","2018-08-23 02:43:39.573964","192.168.2.3","216.58.197.4","TLSv1.2","1434","Application Data [TCP segment of a reassembled PDU]"
"37","2018-08-23 02:43:39.574402","192.168.2.3","216.58.197.4","TCP","1434","34236  >  443 [ACK] Seq=14239 Ack=39 Win=2363 Len=1368 TSval=8090167 TSecr=762794374 [TCP segment of a reassembled PDU]"
"38","2018-08-23 02:43:39.574405","192.168.2.3","216.58.197.4","TLSv1.2","1434","Application Data [TCP segment of a reassembled PDU]"
"39","2018-08-23 02:43:39.574617","192.168.2.3","216.58.197.4","TLSv1.2","1434","Application Data [TCP segment of a reassembled PDU]"
"40","2018-08-23 02:43:39.575379","192.168.2.3","216.58.197.4","TCP","1434","34236  >  443 [ACK] Seq=18343 Ack=39 Win=2363 Len=1368 TSval=8090167 TSecr=762794374 [TCP segment of a reassembled PDU]"
"41","2018-08-23 02:43:39.575640","192.168.2.3","216.58.197.4","TLSv1.2","1434","Application Data [TCP segment of a reassembled PDU]"
"42","2018-08-23 02:43:39.575642","192.168.2.3","216.58.197.4","TLSv1.2","1434","Application Data [TCP segment of a reassembled PDU]"
"43","2018-08-23 02:43:39.578111","192.168.2.3","216.58.197.4","TCP","1434","34236  >  443 [ACK] Seq=22447 Ack=39 Win=2363 Len=1368 TSval=8090167 TSecr=762794375 [TCP segment of a reassembled PDU]"
"45","2018-08-23 02:43:39.578327","192.168.2.3","216.58.197.4","TLSv1.2","1434","Application Data [TCP segment of a reassembled PDU]"
"46","2018-08-23 02:43:39.578330","192.168.2.3","216.58.197.4","TLSv1.2","1434","Application Data [TCP segment of a reassembled PDU]"
"48","2018-08-23 02:43:39.578626","192.168.2.3","216.58.197.4","TCP","1434","34236  >  443 [ACK] Seq=26551 Ack=39 Win=2363 Len=1368 TSval=8090167 TSecr=762794375 [TCP segment of a reassembled PDU]"
"53","2018-08-23 02:43:39.582826","192.168.2.3","216.58.197.4","TLSv1.2","1434","Application Data [TCP segment of a reassembled PDU]"
"54","2018-08-23 02:43:39.583329","192.168.2.3","216.58.197.4","TLSv1.2","1434","Application Data [TCP segment of a reassembled PDU]"
"55","2018-08-23 02:43:39.583868","192.168.2.3","216.58.197.4","TCP","1434","34236  >  443 [ACK] Seq=30655 Ack=39 Win=2363 Len=1368 TSval=8090168 TSecr=762794380 [TCP segment of a reassembled PDU]"
"56","2018-08-23 02:43:39.583870","192.168.2.3","216.58.197.4","TLSv1.2","1434","Application Data [TCP segment of a reassembled PDU]"
"57","2018-08-23 02:43:39.584050","192.168.2.3","216.58.197.4","TCP","1434","34236  >  443 [ACK] Seq=33391 Ack=39 Win=2363 Len=1368 TSval=8090168 TSecr=762794380 [TCP segment of a reassembled PDU]"
"58","2018-08-23 02:43:39.585067","192.168.2.3","216.58.197.4","TLSv1.2","1434","Application Data [TCP segment of a reassembled PDU]"
"59","2018-08-23 02:43:39.585294","192.168.2.3","216.58.197.4","TCP","1434","34236  >  443 [ACK] Seq=36127 Ack=39 Win=2363 Len=1368 TSval=8090168 TSecr=762794380 [TCP segment of a reassembled PDU]"
"60","2018-08-23 02:43:39.585467","192.168.2.3","216.58.197.4","TLSv1.2","1434","Application Data [TCP segment of a reassembled PDU]"
"61","2018-08-23 02:43:39.585742","192.168.2.3","216.58.197.4","TLSv1.2","1434","Application Data [TCP segment of a reassembled PDU]"
"62","2018-08-23 02:43:39.585744","192.168.2.3","216.58.197.4","TCP","1434","34236  >  443 [ACK] Seq=40231 Ack=39 Win=2363 Len=1368 TSval=8090168 TSecr=762794381 [TCP segment of a reassembled PDU]"
"63","2018-08-23 02:43:39.585980","192.168.2.3","216.58.197.4","TLSv1.2","1434","Application Data [TCP segment of a reassembled PDU]"
"64","2018-08-23 02:43:39.585983","192.168.2.3","216.58.197.4","TLSv1.2","1434","Application Data [TCP segment of a reassembled PDU]"
"65","2018-08-23 02:43:39.586330","192.168.2.3","216.58.197.4","TCP","1434","34236  >  443 [ACK] Seq=44335 Ack=39 Win=2363 Len=1368 TSval=8090168 TSecr=762794382 [TCP segment of a reassembled PDU]"
"66","2018-08-23 02:43:39.586333","192.168.2.3","216.58.197.4","TLSv1.2","1434","Application Data [TCP segment of a reassembled PDU]"
"67","2018-08-23 02:43:39.586953","192.168.2.3","216.58.197.4","TLSv1.2","1434","Application Data [TCP segment of a reassembled PDU]"
"68","2018-08-23 02:43:39.586958","192.168.2.3","216.58.197.4","TCP","1434","34236  >  443 [ACK] Seq=48439 Ack=39 Win=2363 Len=1368 TSval=8090168 TSecr=762794384 [TCP segment of a reassembled PDU]"
"70","2018-08-23 02:43:39.587365","192.168.2.3","216.58.197.4","TLSv1.2","1434","Application Data [TCP segment of a reassembled PDU]"
"71","2018-08-23 02:43:39.587367","192.168.2.3","216.58.197.4","TLSv1.2","1434","Application Data [TCP segment of a reassembled PDU]"
"72","2018-08-23 02:43:39.587673","192.168.2.3","216.58.197.4","TCP","1434","34236  >  443 [ACK] Seq=52543 Ack=39 Win=2363 Len=1368 TSval=8090168 TSecr=762794384 [TCP segment of a reassembled PDU]"
"79","2018-08-23 02:43:39.590593","192.168.2.3","216.58.197.4","TLSv1.2","1434","Application Data [TCP segment of a reassembled PDU]"
"80","2018-08-23 02:43:39.590862","192.168.2.3","216.58.197.4","TLSv1.2","1434","Application Data [TCP segment of a reassembled PDU]"
"81","2018-08-23 02:43:39.590863","192.168.2.3","216.58.197.4","TCP","1434","34236  >  443 [ACK] Seq=56647 Ack=39 Win=2363 Len=1368 TSval=8090169 TSecr=762794389 [TCP segment of a reassembled PDU]"
"84","2018-08-23 02:43:39.591823","192.168.2.3","216.58.197.4","TCP","1434","34236  >  443 [ACK] Seq=58015 Ack=39 Win=2363 Len=1368 TSval=8090169 TSecr=762794390 [TCP segment of a reassembled PDU]"
"85","2018-08-23 02:43:39.591826","192.168.2.3","216.58.197.4","TLSv1.2","1434","Application Data [TCP segment of a reassembled PDU]"
"86","2018-08-23 02:43:39.592226","192.168.2.3","216.58.197.4","TLSv1.2","1434","Application Data [TCP segment of a reassembled PDU]"
"87","2018-08-23 02:43:39.592505","192.168.2.3","216.58.197.4","TLSv1.2","1434","Application Data [TCP segment of a reassembled PDU]"
"88","2018-08-23 02:43:39.592508","192.168.2.3","216.58.197.4","TCP","1434","34236  >  443 [ACK] Seq=63487 Ack=39 Win=2363 Len=1368 TSval=8090169 TSecr=762794390 [TCP segment of a reassembled PDU]"
"89","2018-08-23 02:43:39.592655","192.168.2.3","216.58.197.4","TLSv1.2","1434","Application Data [TCP segment of a reassembled PDU]"
"90","2018-08-23 02:43:39.592805","192.168.2.3","216.58.197.4","TLSv1.2","1434","Application Data [TCP segment of a reassembled PDU]"
"91","2018-08-23 02:43:39.592978","192.168.2.3","216.58.197.4","TCP","1434","34236  >  443 [ACK] Seq=67591 Ack=39 Win=2363 Len=1368 TSval=8090169 TSecr=762794392 [TCP segment of a reassembled PDU]"
"92","2018-08-23 02:43:39.593350","192.168.2.3","216.58.197.4","TLSv1.2","1434","Application Data [TCP segment of a reassembled PDU]"
"93","2018-08-23 02:43:39.593567","192.168.2.3","216.58.197.4","TLSv1.2","698","Application Data"
"101","2018-08-23 02:43:39.678561","192.168.2.3","216.58.197.4","TCP","1434","34236  >  443 [ACK] Seq=70959 Ack=39 Win=2363 Len=1368 TSval=8090178 TSecr=762794400 [TCP segment of a reassembled PDU]"
"102","2018-08-23 02:43:39.680832","192.168.2.3","216.58.197.4","TCP","1434","34236  >  443 [ACK] Seq=72327 Ack=39 Win=2363 Len=1368 TSval=8090178 TSecr=762794400 [TCP segment of a reassembled PDU]"
"103","2018-08-23 02:43:39.680845","192.168.2.3","216.58.197.4","TLSv1.2","212","Application Data"
"104","2018-08-23 02:43:39.680846","192.168.2.3","216.58.197.4","TCP","1434","34236  >  443 [ACK] Seq=73841 Ack=39 Win=2363 Len=1368 TSval=8090178 TSecr=762794400 [TCP segment of a reassembled PDU]"
"105","2018-08-23 02:43:39.680896","192.168.2.3","216.58.197.4","TLSv1.2","155","Application Data"
"109","2018-08-23 02:43:39.753589","192.168.2.3","216.58.197.4","TCP","1434","34236  >  443 [ACK] Seq=75298 Ack=39 Win=2363 Len=1368 TSval=8090185 TSecr=762794527 [TCP segment of a reassembled PDU]"
"110","2018-08-23 02:43:39.756380","192.168.2.3","216.58.197.4","TCP","1434","34236  >  443 [ACK] Seq=76666 Ack=39 Win=2363 Len=1368 TSval=8090185 TSecr=762794527 [TCP segment of a reassembled PDU]"
"111","2018-08-23 02:43:39.756383","192.168.2.3","216.58.197.4","TLSv1.2","212","Application Data"
"112","2018-08-23 02:43:39.756384","192.168.2.3","216.58.197.4","TCP","1434","34236  >  443 [ACK] Seq=78180 Ack=39 Win=2363 Len=1368 TSval=8090185 TSecr=762794527 [TCP segment of a reassembled PDU]"
"113","2018-08-23 02:43:39.756505","192.168.2.3","216.58.197.4","TLSv1.2","155","Application Data"
"117","2018-08-23 02:43:39.872072","192.168.2.3","216.58.197.4","TCP","1434","34236  >  443 [ACK] Seq=79637 Ack=39 Win=2363 Len=1368 TSval=8090197 TSecr=762794562 [TCP segment of a reassembled PDU]"
"118","2018-08-23 02:43:39.872076","192.168.2.3","216.58.197.4","TCP","1434","34236  >  443 [ACK] Seq=81005 Ack=39 Win=2363 Len=1368 TSval=8090197 TSecr=762794562 [TCP segment of a reassembled PDU]"
"119","2018-08-23 02:43:39.872077","192.168.2.3","216.58.197.4","TLSv1.2","212","Application Data"
"120","2018-08-23 02:43:39.872341","192.168.2.3","216.58.197.4","TCP","1434","34236  >  443 [ACK] Seq=82519 Ack=39 Win=2363 Len=1368 TSval=8090197 TSecr=762794562 [TCP segment of a reassembled PDU]"
"121","2018-08-23 02:43:39.872344","192.168.2.3","216.58.197.4","TLSv1.2","155","Application Data"
"128","2018-08-23 02:43:39.877490","192.168.2.3","216.58.197.4","TCP","66","34236  >  443 [ACK] Seq=83976 Ack=202 Win=2363 Len=0 TSval=8090198 TSecr=762794678"
"130","2018-08-23 02:43:39.893648","192.168.2.3","216.58.197.4","TCP","66","34236  >  443 [ACK] Seq=83976 Ack=711 Win=2363 Len=0 TSval=8090199 TSecr=762794678"
"131","2018-08-23 02:43:39.945230","192.168.2.3","216.58.197.4","TCP","1434","34236  >  443 [ACK] Seq=83976 Ack=711 Win=2363 Len=1368 TSval=8090204 TSecr=762794678 [TCP segment of a reassembled PDU]"
"132","2018-08-23 02:43:39.945621","192.168.2.3","216.58.197.4","TCP","1434","34236  >  443 [ACK] Seq=85344 Ack=711 Win=2363 Len=1368 TSval=8090204 TSecr=762794678 [TCP segment of a reassembled PDU]"
"133","2018-08-23 02:43:39.945623","192.168.2.3","216.58.197.4","TLSv1.2","212","Application Data"
"134","2018-08-23 02:43:39.946001","192.168.2.3","216.58.197.4","TCP","1434","34236  >  443 [ACK] Seq=86858 Ack=711 Win=2363 Len=1368 TSval=8090204 TSecr=762794678 [TCP segment of a reassembled PDU]"
"135","2018-08-23 02:43:39.946003","192.168.2.3","216.58.197.4","TLSv1.2","155","Application Data"
"140","2018-08-23 02:43:40.041883","192.168.2.3","216.58.197.4","TCP","1434","34236  >  443 [ACK] Seq=88315 Ack=877 Win=2363 Len=1368 TSval=8090214 TSecr=762794836 [TCP segment of a reassembled PDU]"
"141","2018-08-23 02:43:40.042245","192.168.2.3","216.58.197.4","TCP","1434","34236  >  443 [ACK] Seq=89683 Ack=877 Win=2363 Len=1368 TSval=8090214 TSecr=762794836 [TCP segment of a reassembled PDU]"
"142","2018-08-23 02:43:40.042248","192.168.2.3","216.58.197.4","TLSv1.2","212","Application Data"
"143","2018-08-23 02:43:40.042651","192.168.2.3","216.58.197.4","TCP","1434","34236  >  443 [ACK] Seq=91197 Ack=877 Win=2363 Len=1368 TSval=8090214 TSecr=762794836 [TCP segment of a reassembled PDU]"
"144","2018-08-23 02:43:40.042654","192.168.2.3","216.58.197.4","TLSv1.2","155","Application Data"
"151","2018-08-23 02:43:40.128473","192.168.2.3","216.58.197.4","TCP","1434","34236  >  443 [ACK] Seq=92654 Ack=877 Win=2363 Len=1368 TSval=8090223 TSecr=762794849 [TCP segment of a reassembled PDU]"
"152","2018-08-23 02:43:40.128775","192.168.2.3","216.58.197.4","TCP","1434","34236  >  443 [ACK] Seq=94022 Ack=877 Win=2363 Len=1368 TSval=8090223 TSecr=762794849 [TCP segment of a reassembled PDU]"
"153","2018-08-23 02:43:40.128777","192.168.2.3","216.58.197.4","TLSv1.2","212","Application Data"
"154","2018-08-23 02:43:40.129274","192.168.2.3","216.58.197.4","TCP","1434","34236  >  443 [ACK] Seq=95536 Ack=877 Win=2363 Len=1368 TSval=8090223 TSecr=762794849 [TCP segment of a reassembled PDU]"
"155","2018-08-23 02:43:40.129277","192.168.2.3","216.58.197.4","TLSv1.2","155","Application Data"
"160","2018-08-23 02:43:40.138162","192.168.2.3","172.217.161.202","TCP","74","38265  >  443 [SYN] Seq=0 Win=14600 Len=0 MSS=1460 SACK_PERM=1 TSval=8090224 TSecr=0 WS=64"
"162","2018-08-23 02:43:40.143955","192.168.2.3","172.217.161.202","TCP","66","38265  >  443 [ACK] Seq=1 Ack=1 Win=14656 Len=0 TSval=8090224 TSecr=3222616549"
"163","2018-08-23 02:43:40.144638","192.168.2.3","172.217.161.202","TLSv1.2","583","Client Hello"
"166","2018-08-23 02:43:40.150685","192.168.2.3","172.217.161.202","TCP","66","38265  >  443 [ACK] Seq=518 Ack=153 Win=15680 Len=0 TSval=8090225 TSecr=3222616556"
"167","2018-08-23 02:43:40.158967","192.168.2.3","172.217.161.202","TLSv1.2","266","Change Cipher Spec, Encrypted Handshake Message, Encrypted Handshake Message"
"169","2018-08-23 02:43:40.173538","192.168.2.3","172.217.161.202","TLSv1.2","151","Application Data"
"171","2018-08-23 02:43:40.179100","192.168.2.3","172.217.161.202","TLSv1.2","96","Application Data"
"172","2018-08-23 02:43:40.179621","192.168.2.3","172.217.161.202","TLSv1.2","301","Application Data"
"173","2018-08-23 02:43:40.180027","192.168.2.3","172.217.161.202","TCP","1434","38265  >  443 [ACK] Seq=1068 Ack=214 Win=15680 Len=1368 TSval=8090228 TSecr=3222616569 [TCP segment of a reassembled PDU]"
"174","2018-08-23 02:43:40.180301","192.168.2.3","172.217.161.202","TCP","1434","38265  >  443 [ACK] Seq=2436 Ack=214 Win=15680 Len=1368 TSval=8090228 TSecr=3222616569 [TCP segment of a reassembled PDU]"
"175","2018-08-23 02:43:40.180303","192.168.2.3","172.217.161.202","TLSv1.2","212","Application Data"
"176","2018-08-23 02:43:40.180305","192.168.2.3","172.217.161.202","TLSv1.2","756","Application Data"
"181","2018-08-23 02:43:40.205043","192.168.2.3","216.58.197.4","TCP","1434","34236  >  443 [ACK] Seq=96993 Ack=1058 Win=2363 Len=1368 TSval=8090230 TSecr=762794989 [TCP segment of a reassembled PDU]"
"182","2018-08-23 02:43:40.205047","192.168.2.3","216.58.197.4","TCP","1434","34236  >  443 [ACK] Seq=98361 Ack=1058 Win=2363 Len=1368 TSval=8090230 TSecr=762794989 [TCP segment of a reassembled PDU]"
"183","2018-08-23 02:43:40.205202","192.168.2.3","216.58.197.4","TLSv1.2","212","Application Data"
"184","2018-08-23 02:43:40.205738","192.168.2.3","216.58.197.4","TCP","1434","34236  >  443 [ACK] Seq=99875 Ack=1058 Win=2363 Len=1368 TSval=8090230 TSecr=762794989 [TCP segment of a reassembled PDU]"
"185","2018-08-23 02:43:40.205742","192.168.2.3","216.58.197.4","TLSv1.2","155","Application Data"
"193","2018-08-23 02:43:40.230125","192.168.2.3","172.217.161.202","TCP","66","38265  >  443 [ACK] Seq=4640 Ack=894 Win=18944 Len=0 TSval=8090233 TSecr=3222616635"
"194","2018-08-23 02:43:40.233612","192.168.2.3","172.217.161.202","TLSv1.2","104","Application Data"
"196","2018-08-23 02:43:40.286887","192.168.2.3","216.58.197.4","TCP","1434","34236  >  443 [ACK] Seq=101332 Ack=1058 Win=2363 Len=1368 TSval=8090238 TSecr=762795012 [TCP segment of a reassembled PDU]"
"197","2018-08-23 02:43:40.287075","192.168.2.3","216.58.197.4","TCP","1434","34236  >  443 [ACK] Seq=102700 Ack=1058 Win=2363 Len=1368 TSval=8090238 TSecr=762795012 [TCP segment of a reassembled PDU]"
"198","2018-08-23 02:43:40.287091","192.168.2.3","216.58.197.4","TLSv1.2","212","Application Data"
"199","2018-08-23 02:43:40.287533","192.168.2.3","216.58.197.4","TCP","1434","34236  >  443 [ACK] Seq=104214 Ack=1058 Win=2363 Len=1368 TSval=8090238 TSecr=762795012 [TCP segment of a reassembled PDU]"
"200","2018-08-23 02:43:40.287535","192.168.2.3","216.58.197.4","TLSv1.2","155","Application Data"
"204","2018-08-23 02:43:40.364701","192.168.2.3","216.58.197.4","TCP","1434","34236  >  443 [ACK] Seq=105671 Ack=1058 Win=2363 Len=1368 TSval=8090246 TSecr=762795094 [TCP segment of a reassembled PDU]"
"205","2018-08-23 02:43:40.369405","192.168.2.3","216.58.197.4","TCP","1434","34236  >  443 [ACK] Seq=107039 Ack=1058 Win=2363 Len=1368 TSval=8090246 TSecr=762795094 [TCP segment of a reassembled PDU]"
"206","2018-08-23 02:43:40.369408","192.168.2.3","216.58.197.4","TLSv1.2","212","Application Data"
"207","2018-08-23 02:43:40.369590","192.168.2.3","216.58.197.4","TCP","1434","34236  >  443 [ACK] Seq=108553 Ack=1058 Win=2363 Len=1368 TSval=8090246 TSecr=762795094 [TCP segment of a reassembled PDU]"
"208","2018-08-23 02:43:40.369594","192.168.2.3","216.58.197.4","TLSv1.2","155","Application Data"
"212","2018-08-23 02:43:40.448588","192.168.2.3","216.58.197.4","TCP","1434","34236  >  443 [ACK] Seq=110010 Ack=1058 Win=2363 Len=1368 TSval=8090255 TSecr=762795176 [TCP segment of a reassembled PDU]"
"213","2018-08-23 02:43:40.448983","192.168.2.3","216.58.197.4","TCP","1434","34236  >  443 [ACK] Seq=111378 Ack=1058 Win=2363 Len=1368 TSval=8090255 TSecr=762795176 [TCP segment of a reassembled PDU]"
"214","2018-08-23 02:43:40.448984","192.168.2.3","216.58.197.4","TLSv1.2","212","Application Data"
"215","2018-08-23 02:43:40.449369","192.168.2.3","216.58.197.4","TCP","1434","34236  >  443 [ACK] Seq=112892 Ack=1058 Win=2363 Len=1368 TSval=8090255 TSecr=762795176 [TCP segment of a reassembled PDU]"
"216","2018-08-23 02:43:40.449372","192.168.2.3","216.58.197.4","TLSv1.2","155","Application Data"
"220","2018-08-23 02:43:40.545994","192.168.2.3","216.58.197.4","TCP","1434","34236  >  443 [ACK] Seq=114349 Ack=1058 Win=2363 Len=1368 TSval=8090264 TSecr=762795255 [TCP segment of a reassembled PDU]"
"221","2018-08-23 02:43:40.545997","192.168.2.3","216.58.197.4","TCP","1434","34236  >  443 [ACK] Seq=115717 Ack=1058 Win=2363 Len=1368 TSval=8090264 TSecr=762795255 [TCP segment of a reassembled PDU]"
"222","2018-08-23 02:43:40.545998","192.168.2.3","216.58.197.4","TLSv1.2","212","Application Data"
"223","2018-08-23 02:43:40.546174","192.168.2.3","216.58.197.4","TCP","1434","34236  >  443 [ACK] Seq=117231 Ack=1058 Win=2363 Len=1368 TSval=8090264 TSecr=762795255 [TCP segment of a reassembled PDU]"
"224","2018-08-23 02:43:40.546305","192.168.2.3","216.58.197.4","TLSv1.2","155","Application Data"
"229","2018-08-23 02:43:40.588874","192.168.2.3","216.58.197.4","TCP","66","34236  >  443 [ACK] Seq=118688 Ack=1092 Win=2363 Len=0 TSval=8090269 TSecr=762795352"
"230","2018-08-23 02:43:40.617252","192.168.2.3","216.58.197.4","TCP","1434","34236  >  443 [ACK] Seq=118688 Ack=1092 Win=2363 Len=1368 TSval=8090271 TSecr=762795352 [TCP segment of a reassembled PDU]"
"231","2018-08-23 02:43:40.617665","192.168.2.3","216.58.197.4","TCP","1434","34236  >  443 [ACK] Seq=120056 Ack=1092 Win=2363 Len=1368 TSval=8090272 TSecr=762795352 [TCP segment of a reassembled PDU]"
"232","2018-08-23 02:43:40.617668","192.168.2.3","216.58.197.4","TLSv1.2","212","Application Data"
"233","2018-08-23 02:43:40.618125","192.168.2.3","216.58.197.4","TCP","1434","34236  >  443 [ACK] Seq=121570 Ack=1092 Win=2363 Len=1368 TSval=8090272 TSecr=762795352 [TCP segment of a reassembled PDU]"
"234","2018-08-23 02:43:40.618128","192.168.2.3","216.58.197.4","TLSv1.2","155","Application Data"
"238","2018-08-23 02:43:40.684894","192.168.2.3","216.58.197.4","TCP","1434","34236  >  443 [ACK] Seq=123027 Ack=1092 Win=2363 Len=1368 TSval=8090278 TSecr=762795464 [TCP segment of a reassembled PDU]"
"239","2018-08-23 02:43:40.685430","192.168.2.3","216.58.197.4","TCP","1434","34236  >  443 [ACK] Seq=124395 Ack=1092 Win=2363 Len=1368 TSval=8090278 TSecr=762795464 [TCP segment of a reassembled PDU]"
"240","2018-08-23 02:43:40.685434","192.168.2.3","216.58.197.4","TLSv1.2","212","Application Data"
"241","2018-08-23 02:43:40.685711","192.168.2.3","216.58.197.4","TCP","1434","34236  >  443 [ACK] Seq=125909 Ack=1092 Win=2363 Len=1368 TSval=8090278 TSecr=762795464 [TCP segment of a reassembled PDU]"
"242","2018-08-23 02:43:40.685714","192.168.2.3","216.58.197.4","TLSv1.2","155","Application Data"
"248","2018-08-23 02:43:40.756125","192.168.2.3","216.58.197.4","TCP","66","34236  >  443 [ACK] Seq=127366 Ack=1247 Win=2363 Len=0 TSval=8090285 TSecr=762795556"
"249","2018-08-23 02:43:40.756437","192.168.2.3","216.58.197.4","TCP","66","34236  >  443 [ACK] Seq=127366 Ack=1435 Win=2363 Len=0 TSval=8090285 TSecr=762795556"
"250","2018-08-23 02:43:40.767366","192.168.2.3","216.58.197.4","TCP","1434","34236  >  443 [ACK] Seq=127366 Ack=1435 Win=2363 Len=1368 TSval=8090287 TSecr=762795556 [TCP segment of a reassembled PDU]"
"251","2018-08-23 02:43:40.767648","192.168.2.3","216.58.197.4","TCP","1434","34236  >  443 [ACK] Seq=128734 Ack=1435 Win=2363 Len=1368 TSval=8090287 TSecr=762795556 [TCP segment of a reassembled PDU]"
"252","2018-08-23 02:43:40.767650","192.168.2.3","216.58.197.4","TLSv1.2","212","Application Data"
"255","2018-08-23 02:43:40.774033","192.168.2.3","216.58.197.4","TCP","1434","34236  >  443 [ACK] Seq=130248 Ack=1435 Win=2363 Len=1368 TSval=8090287 TSecr=762795556 [TCP segment of a reassembled PDU]"
"256","2018-08-23 02:43:40.774036","192.168.2.3","216.58.197.4","TLSv1.2","155","Application Data"
"260","2018-08-23 02:43:40.845161","192.168.2.3","216.58.197.4","TCP","66","34236  >  443 [ACK] Seq=131705 Ack=1766 Win=2363 Len=0 TSval=8090294 TSecr=762795644"
"261","2018-08-23 02:43:40.864489","192.168.2.3","216.58.197.4","TCP","1434","34236  >  443 [ACK] Seq=131705 Ack=1766 Win=2363 Len=1368 TSval=8090296 TSecr=762795644 [TCP segment of a reassembled PDU]"
"262","2018-08-23 02:43:40.864943","192.168.2.3","216.58.197.4","TCP","1434","34236  >  443 [ACK] Seq=133073 Ack=1766 Win=2363 Len=1368 TSval=8090296 TSecr=762795644 [TCP segment of a reassembled PDU]"
"263","2018-08-23 02:43:40.864946","192.168.2.3","216.58.197.4","TLSv1.2","212","Application Data"
"264","2018-08-23 02:43:40.865388","192.168.2.3","216.58.197.4","TCP","1434","34236  >  443 [ACK] Seq=134587 Ack=1766 Win=2363 Len=1368 TSval=8090296 TSecr=762795644 [TCP segment of a reassembled PDU]"
"265","2018-08-23 02:43:40.865391","192.168.2.3","216.58.197.4","TLSv1.2","155","Application Data"
"271","2018-08-23 02:43:40.896637","192.168.2.3","216.58.197.4","TCP","66","34236  >  443 [ACK] Seq=136044 Ack=2243 Win=2363 Len=0 TSval=8090299 TSecr=762795678"
"272","2018-08-23 02:43:40.940588","192.168.2.3","216.58.197.4","TCP","1434","34236  >  443 [ACK] Seq=136044 Ack=2243 Win=2363 Len=1368 TSval=8090303 TSecr=762795678 [TCP segment of a reassembled PDU]"
"273","2018-08-23 02:43:40.940591","192.168.2.3","216.58.197.4","TCP","1434","34236  >  443 [ACK] Seq=137412 Ack=2243 Win=2363 Len=1368 TSval=8090304 TSecr=762795678 [TCP segment of a reassembled PDU]"
"274","2018-08-23 02:43:40.940592","192.168.2.3","216.58.197.4","TLSv1.2","212","Application Data"
"275","2018-08-23 02:43:40.940746","192.168.2.3","216.58.197.4","TCP","1434","34236  >  443 [ACK] Seq=138926 Ack=2243 Win=2363 Len=1368 TSval=8090304 TSecr=762795678 [TCP segment of a reassembled PDU]"
"276","2018-08-23 02:43:40.941156","192.168.2.3","216.58.197.4","TLSv1.2","155","Application Data"
"281","2018-08-23 02:43:40.948020","192.168.2.3","216.58.197.4","TCP","66","34236  >  443 [ACK] Seq=140383 Ack=2698 Win=2363 Len=0 TSval=8090305 TSecr=762795748"
"284","2018-08-23 02:43:41.006529","192.168.2.3","216.58.197.4","TCP","66","34236  >  443 [ACK] Seq=140383 Ack=3067 Win=2363 Len=0 TSval=8090310 TSecr=762795807"
"285","2018-08-23 02:43:41.024715","192.168.2.3","216.58.197.4","TCP","1434","34236  >  443 [ACK] Seq=140383 Ack=3067 Win=2363 Len=1368 TSval=8090312 TSecr=762795807 [TCP segment of a reassembled PDU]"
"286","2018-08-23 02:43:41.025040","192.168.2.3","216.58.197.4","TCP","1434","34236  >  443 [ACK] Seq=141751 Ack=3067 Win=2363 Len=1368 TSval=8090312 TSecr=762795807 [TCP segment of a reassembled PDU]"
"287","2018-08-23 02:43:41.025042","192.168.2.3","216.58.197.4","TLSv1.2","212","Application Data"
"288","2018-08-23 02:43:41.025567","192.168.2.3","216.58.197.4","TCP","1434","34236  >  443 [ACK] Seq=143265 Ack=3067 Win=2363 Len=1368 TSval=8090312 TSecr=762795807 [TCP segment of a reassembled PDU]"
"289","2018-08-23 02:43:41.025570","192.168.2.3","216.58.197.4","TLSv1.2","155","Application Data"
"293","2018-08-23 02:43:41.097295","192.168.2.3","216.58.197.4","TCP","1434","34236  >  443 [ACK] Seq=144722 Ack=3067 Win=2363 Len=1368 TSval=8090319 TSecr=762795871 [TCP segment of a reassembled PDU]"
"294","2018-08-23 02:43:41.097643","192.168.2.3","216.58.197.4","TCP","1434","34236  >  443 [ACK] Seq=146090 Ack=3067 Win=2363 Len=1368 TSval=8090320 TSecr=762795871 [TCP segment of a reassembled PDU]"
"295","2018-08-23 02:43:41.097645","192.168.2.3","216.58.197.4","TLSv1.2","212","Application Data"
"296","2018-08-23 02:43:41.098072","192.168.2.3","216.58.197.4","TCP","1434","34236  >  443 [ACK] Seq=147604 Ack=3067 Win=2363 Len=1368 TSval=8090320 TSecr=762795871 [TCP segment of a reassembled PDU]"
"297","2018-08-23 02:43:41.098074","192.168.2.3","216.58.197.4","TLSv1.2","155","Application Data"
"301","2018-08-23 02:43:41.182980","192.168.2.3","216.58.197.4","TCP","1434","34236  >  443 [ACK] Seq=149061 Ack=3067 Win=2363 Len=1368 TSval=8090328 TSecr=762795904 [TCP segment of a reassembled PDU]"
"302","2018-08-23 02:43:41.183368","192.168.2.3","216.58.197.4","TCP","1434","34236  >  443 [ACK] Seq=150429 Ack=3067 Win=2363 Len=1368 TSval=8090328 TSecr=762795904 [TCP segment of a reassembled PDU]"
"303","2018-08-23 02:43:41.183370","192.168.2.3","216.58.197.4","TLSv1.2","212","Application Data"
"304","2018-08-23 02:43:41.183371","192.168.2.3","216.58.197.4","TCP","1434","34236  >  443 [ACK] Seq=151943 Ack=3067 Win=2363 Len=1368 TSval=8090328 TSecr=762795904 [TCP segment of a reassembled PDU]"
"305","2018-08-23 02:43:41.183433","192.168.2.3","216.58.197.4","TLSv1.2","155","Application Data"
"309","2018-08-23 02:43:41.258696","192.168.2.3","216.58.197.4","TCP","1434","34236  >  443 [ACK] Seq=153400 Ack=3067 Win=2363 Len=1368 TSval=8090336 TSecr=762795989 [TCP segment of a reassembled PDU]"
"310","2018-08-23 02:43:41.258972","192.168.2.3","216.58.197.4","TCP","1434","34236  >  443 [ACK] Seq=154768 Ack=3067 Win=2363 Len=1368 TSval=8090336 TSecr=762795989 [TCP segment of a reassembled PDU]"
"311","2018-08-23 02:43:41.258974","192.168.2.3","216.58.197.4","TLSv1.2","212","Application Data"
"312","2018-08-23 02:43:41.258975","192.168.2.3","216.58.197.4","TCP","1434","34236  >  443 [ACK] Seq=156282 Ack=3067 Win=2363 Len=1368 TSval=8090336 TSecr=762795989 [TCP segment of a reassembled PDU]"
"313","2018-08-23 02:43:41.259273","192.168.2.3","216.58.197.4","TLSv1.2","155","Application Data"
"317","2018-08-23 02:43:41.347181","192.168.2.3","216.58.197.4","TCP","1434","34236  >  443 [ACK] Seq=157739 Ack=3067 Win=2363 Len=1368 TSval=8090344 TSecr=762796065 [TCP segment of a reassembled PDU]"
"318","2018-08-23 02:43:41.347186","192.168.2.3","216.58.197.4","TCP","1434","34236  >  443 [ACK] Seq=159107 Ack=3067 Win=2363 Len=1368 TSval=8090344 TSecr=762796065 [TCP segment of a reassembled PDU]"
"319","2018-08-23 02:43:41.347309","192.168.2.3","216.58.197.4","TLSv1.2","212","Application Data"
"320","2018-08-23 02:43:41.347529","192.168.2.3","216.58.197.4","TCP","1434","34236  >  443 [ACK] Seq=160621 Ack=3067 Win=2363 Len=1368 TSval=8090344 TSecr=762796065 [TCP segment of a reassembled PDU]"
"321","2018-08-23 02:43:41.347531","192.168.2.3","216.58.197.4","TLSv1.2","155","Application Data"
"327","2018-08-23 02:43:41.408975","192.168.2.3","216.58.197.4","TCP","66","34236  >  443 [ACK] Seq=162078 Ack=3518 Win=2363 Len=0 TSval=8090350 TSecr=762796202"
"330","2018-08-23 02:43:41.411027","192.168.2.3","216.58.197.4","TCP","66","34236  >  443 [ACK] Seq=162078 Ack=3882 Win=2363 Len=0 TSval=8090351 TSecr=762796212"
"331","2018-08-23 02:43:41.440508","192.168.2.3","216.58.197.4","TCP","1434","34236  >  443 [ACK] Seq=162078 Ack=3882 Win=2363 Len=1368 TSval=8090354 TSecr=762796212 [TCP segment of a reassembled PDU]"
"332","2018-08-23 02:43:41.440964","192.168.2.3","216.58.197.4","TCP","1434","34236  >  443 [ACK] Seq=163446 Ack=3882 Win=2363 Len=1368 TSval=8090354 TSecr=762796212 [TCP segment of a reassembled PDU]"
"333","2018-08-23 02:43:41.440967","192.168.2.3","216.58.197.4","TLSv1.2","212","Application Data"
"334","2018-08-23 02:43:41.440968","192.168.2.3","216.58.197.4","TCP","1434","34236  >  443 [ACK] Seq=164960 Ack=3882 Win=2363 Len=1368 TSval=8090354 TSecr=762796212 [TCP segment of a reassembled PDU]"
"335","2018-08-23 02:43:41.440969","192.168.2.3","216.58.197.4","TLSv1.2","155","Application Data"
"338","2018-08-23 02:43:41.513238","192.168.2.3","216.58.197.4","TCP","1434","34236  >  443 [ACK] Seq=166417 Ack=3882 Win=2363 Len=1368 TSval=8090361 TSecr=762796247 [TCP segment of a reassembled PDU]"
"339","2018-08-23 02:43:41.513628","192.168.2.3","216.58.197.4","TCP","1434","34236  >  443 [ACK] Seq=167785 Ack=3882 Win=2363 Len=1368 TSval=8090361 TSecr=762796247 [TCP segment of a reassembled PDU]"
"340","2018-08-23 02:43:41.513630","192.168.2.3","216.58.197.4","TLSv1.2","212","Application Data"
"341","2018-08-23 02:43:41.514063","192.168.2.3","216.58.197.4","TCP","1434","34236  >  443 [ACK] Seq=169299 Ack=3882 Win=2363 Len=1368 TSval=8090361 TSecr=762796247 [TCP segment of a reassembled PDU]"
"342","2018-08-23 02:43:41.514066","192.168.2.3","216.58.197.4","TLSv1.2","155","Application Data"
"346","2018-08-23 02:43:41.599515","192.168.2.3","216.58.197.4","TCP","1434","34236  >  443 [ACK] Seq=170756 Ack=3882 Win=2363 Len=1368 TSval=8090370 TSecr=762796320 [TCP segment of a reassembled PDU]"
"347","2018-08-23 02:43:41.599810","192.168.2.3","216.58.197.4","TCP","1434","34236  >  443 [ACK] Seq=172124 Ack=3882 Win=2363 Len=1368 TSval=8090370 TSecr=762796320 [TCP segment of a reassembled PDU]"
"348","2018-08-23 02:43:41.599812","192.168.2.3","216.58.197.4","TLSv1.2","212","Application Data"
"349","2018-08-23 02:43:41.600289","192.168.2.3","216.58.197.4","TCP","1434","34236  >  443 [ACK] Seq=173638 Ack=3882 Win=2363 Len=1368 TSval=8090370 TSecr=762796320 [TCP segment of a reassembled PDU]"
"350","2018-08-23 02:43:41.600293","192.168.2.3","216.58.197.4","TLSv1.2","155","Application Data"
"354","2018-08-23 02:43:41.678729","192.168.2.3","216.58.197.4","TCP","1434","34236  >  443 [ACK] Seq=175095 Ack=3882 Win=2363 Len=1368 TSval=8090377 TSecr=762796406 [TCP segment of a reassembled PDU]"
"355","2018-08-23 02:43:41.678734","192.168.2.3","216.58.197.4","TCP","1434","34236  >  443 [ACK] Seq=176463 Ack=3882 Win=2363 Len=1368 TSval=8090377 TSecr=762796406 [TCP segment of a reassembled PDU]"
"356","2018-08-23 02:43:41.678860","192.168.2.3","216.58.197.4","TLSv1.2","212","Application Data"
"357","2018-08-23 02:43:41.679096","192.168.2.3","216.58.197.4","TCP","1434","34236  >  443 [ACK] Seq=177977 Ack=3882 Win=2363 Len=1368 TSval=8090377 TSecr=762796406 [TCP segment of a reassembled PDU]"
"358","2018-08-23 02:43:41.679098","192.168.2.3","216.58.197.4","TLSv1.2","155","Application Data"
"362","2018-08-23 02:43:41.722400","192.168.2.3","203.211.199.120","TLSv1.2","786","Application Data"
"368","2018-08-23 02:43:41.769293","192.168.2.3","203.211.199.120","TCP","66","52076  >  443 [ACK] Seq=1441 Ack=6569 Win=982 Len=0 TSval=8090387 TSecr=1194377985"
"369","2018-08-23 02:43:41.769296","192.168.2.3","203.211.199.120","TCP","66","52076  >  443 [ACK] Seq=1441 Ack=8017 Win=982 Len=0 TSval=8090387 TSecr=1194377985"
"370","2018-08-23 02:43:41.769655","192.168.2.3","203.211.199.120","TCP","66","52076  >  443 [ACK] Seq=1441 Ack=9465 Win=960 Len=0 TSval=8090387 TSecr=1194377985"
"371","2018-08-23 02:43:41.770872","192.168.2.3","203.211.199.120","TCP","66","52076  >  443 [ACK] Seq=1441 Ack=10235 Win=998 Len=0 TSval=8090387 TSecr=1194377985"
"372","2018-08-23 02:43:41.771139","192.168.2.3","216.58.197.4","TCP","1434","34236  >  443 [ACK] Seq=179434 Ack=3882 Win=2363 Len=1368 TSval=8090387 TSecr=762796485 [TCP segment of a reassembled PDU]"
"373","2018-08-23 02:43:41.771141","192.168.2.3","216.58.197.4","TCP","1434","34236  >  443 [ACK] Seq=180802 Ack=3882 Win=2363 Len=1368 TSval=8090387 TSecr=762796485 [TCP segment of a reassembled PDU]"
"374","2018-08-23 02:43:41.771142","192.168.2.3","216.58.197.4","TLSv1.2","212","Application Data"
"375","2018-08-23 02:43:41.771572","192.168.2.3","216.58.197.4","TCP","1434","34236  >  443 [ACK] Seq=182316 Ack=3882 Win=2363 Len=1368 TSval=8090387 TSecr=762796485 [TCP segment of a reassembled PDU]"
"376","2018-08-23 02:43:41.771574","192.168.2.3","216.58.197.4","TLSv1.2","155","Application Data"
"382","2018-08-23 02:43:41.824435","192.168.2.3","216.58.197.4","TCP","66","34236  >  443 [ACK] Seq=183773 Ack=4122 Win=2363 Len=0 TSval=8090392 TSecr=762796625"
"383","2018-08-23 02:43:41.862213","192.168.2.3","216.58.197.4","TCP","1434","34236  >  443 [ACK] Seq=183773 Ack=4122 Win=2363 Len=1368 TSval=8090395 TSecr=762796625 [TCP segment of a reassembled PDU]"
"384","2018-08-23 02:43:41.862218","192.168.2.3","216.58.197.4","TCP","1434","34236  >  443 [ACK] Seq=185141 Ack=4122 Win=2363 Len=1368 TSval=8090395 TSecr=762796625 [TCP segment of a reassembled PDU]"
"385","2018-08-23 02:43:41.862219","192.168.2.3","216.58.197.4","TLSv1.2","212","Application Data"
"386","2018-08-23 02:43:41.862588","192.168.2.3","216.58.197.4","TCP","1434","34236  >  443 [ACK] Seq=186655 Ack=4122 Win=2363 Len=1368 TSval=8090395 TSecr=762796625 [TCP segment of a reassembled PDU]"
"387","2018-08-23 02:43:41.862591","192.168.2.3","216.58.197.4","TLSv1.2","155","Application Data"
"392","2018-08-23 02:43:41.899689","192.168.2.3","216.58.197.4","TCP","66","34236  >  443 [ACK] Seq=188112 Ack=4284 Win=2363 Len=0 TSval=8090399 TSecr=762796678"
"395","2018-08-23 02:43:41.920878","192.168.2.3","216.58.197.4","TCP","66","34236  >  443 [ACK] Seq=188112 Ack=4592 Win=2363 Len=0 TSval=8090402 TSecr=762796721"
"396","2018-08-23 02:43:41.952322","192.168.2.3","216.58.197.4","TCP","1434","34236  >  443 [ACK] Seq=188112 Ack=4592 Win=2363 Len=1368 TSval=8090405 TSecr=762796721 [TCP segment of a reassembled PDU]"
"397","2018-08-23 02:43:41.952712","192.168.2.3","216.58.197.4","TCP","1434","34236  >  443 [ACK] Seq=189480 Ack=4592 Win=2363 Len=1368 TSval=8090405 TSecr=762796721 [TCP segment of a reassembled PDU]"
"398","2018-08-23 02:43:41.952714","192.168.2.3","216.58.197.4","TLSv1.2","212","Application Data"
"399","2018-08-23 02:43:41.953183","192.168.2.3","216.58.197.4","TCP","1434","34236  >  443 [ACK] Seq=190994 Ack=4592 Win=2363 Len=1368 TSval=8090405 TSecr=762796721 [TCP segment of a reassembled PDU]"
"400","2018-08-23 02:43:41.953186","192.168.2.3","216.58.197.4","TLSv1.2","155","Application Data"
"406","2018-08-23 02:43:42.013813","192.168.2.3","216.58.197.4","TCP","66","34236  >  443 [ACK] Seq=192451 Ack=5088 Win=2363 Len=0 TSval=8090411 TSecr=762796812"
"407","2018-08-23 02:43:42.048376","192.168.2.3","216.58.197.4","TCP","1434","34236  >  443 [ACK] Seq=192451 Ack=5088 Win=2363 Len=1368 TSval=8090415 TSecr=762796812 [TCP segment of a reassembled PDU]"
"408","2018-08-23 02:43:42.048773","192.168.2.3","216.58.197.4","TCP","1434","34236  >  443 [ACK] Seq=193819 Ack=5088 Win=2363 Len=1368 TSval=8090415 TSecr=762796812 [TCP segment of a reassembled PDU]"
"409","2018-08-23 02:43:42.048775","192.168.2.3","216.58.197.4","TLSv1.2","212","Application Data"
"410","2018-08-23 02:43:42.048776","192.168.2.3","216.58.197.4","TCP","1434","34236  >  443 [ACK] Seq=195333 Ack=5088 Win=2363 Len=1368 TSval=8090415 TSecr=762796812 [TCP segment of a reassembled PDU]"
"411","2018-08-23 02:43:42.048777","192.168.2.3","216.58.197.4","TLSv1.2","155","Application Data"
"417","2018-08-23 02:43:42.109811","192.168.2.3","216.58.197.4","TCP","66","34236  >  443 [ACK] Seq=196790 Ack=5542 Win=2363 Len=0 TSval=8090421 TSecr=762796905"
"418","2018-08-23 02:43:42.142733","192.168.2.3","216.58.197.4","TCP","1434","34236  >  443 [ACK] Seq=196790 Ack=5542 Win=2363 Len=1368 TSval=8090424 TSecr=762796905 [TCP segment of a reassembled PDU]"
"419","2018-08-23 02:43:42.143063","192.168.2.3","216.58.197.4","TCP","1434","34236  >  443 [ACK] Seq=198158 Ack=5542 Win=2363 Len=1368 TSval=8090424 TSecr=762796905 [TCP segment of a reassembled PDU]"
"420","2018-08-23 02:43:42.143066","192.168.2.3","216.58.197.4","TLSv1.2","212","Application Data"
"421","2018-08-23 02:43:42.143067","192.168.2.3","216.58.197.4","TCP","1434","34236  >  443 [ACK] Seq=199672 Ack=5542 Win=2363 Len=1368 TSval=8090424 TSecr=762796905 [TCP segment of a reassembled PDU]"
"422","2018-08-23 02:43:42.143188","192.168.2.3","216.58.197.4","TLSv1.2","155","Application Data"
"425","2018-08-23 02:43:42.238459","192.168.2.3","216.58.197.4","TCP","1434","34236  >  443 [ACK] Seq=201129 Ack=5542 Win=2363 Len=1368 TSval=8090434 TSecr=762796949 [TCP segment of a reassembled PDU]"
"426","2018-08-23 02:43:42.240760","192.168.2.3","216.58.197.4","TCP","1434","34236  >  443 [ACK] Seq=202497 Ack=5542 Win=2363 Len=1368 TSval=8090434 TSecr=762796949 [TCP segment of a reassembled PDU]"
"427","2018-08-23 02:43:42.240766","192.168.2.3","216.58.197.4","TLSv1.2","212","Application Data"
"428","2018-08-23 02:43:42.240767","192.168.2.3","216.58.197.4","TCP","1434","34236  >  443 [ACK] Seq=204011 Ack=5542 Win=2363 Len=1368 TSval=8090434 TSecr=762796949 [TCP segment of a reassembled PDU]"
