"No.","Time","Source","Destination","Protocol","Length","Info"
"1","2018-08-23 02:41:16.636559","192.168.2.3","203.211.199.120","TLSv1.2","786","Application Data"
"6","2018-08-23 02:41:16.659637","192.168.2.3","203.211.199.120","TCP","66","52076  >  443 [ACK] Seq=721 Ack=2897 Win=999 Len=0 TSval=8075876 TSecr=1194232883"
"7","2018-08-23 02:41:16.660109","192.168.2.3","203.211.199.120","TCP","66","52076  >  443 [ACK] Seq=721 Ack=5116 Win=999 Len=0 TSval=8075876 TSecr=1194232883"
"8","2018-08-23 02:41:17.665517","192.168.2.3","203.211.199.120","TCP","66","52072  >  443 [ACK] Seq=1 Ack=1 Win=661 Len=0 TSval=8075977 TSecr=1194188902"
"10","2018-08-23 02:41:17.735555","192.168.2.3","203.211.199.120","TCP","66","52073  >  443 [ACK] Seq=1 Ack=1 Win=381 Len=0 TSval=8075984 TSecr=1194188937"
"11","2018-08-23 02:41:17.735560","192.168.2.3","203.211.199.120","TCP","66","52074  >  443 [ACK] Seq=1 Ack=1 Win=381 Len=0 TSval=8075984 TSecr=1194188938"
"14","2018-08-23 02:41:17.835499","192.168.2.3","216.58.197.3","TCP","66","43465  >  443 [ACK] Seq=1 Ack=1 Win=971 Len=0 TSval=8075994 TSecr=4242013156"
"16","2018-08-23 02:41:17.842375","192.168.2.3","216.58.197.4","TLSv1.2","156","Application Data"
"17","2018-08-23 02:41:17.842378","192.168.2.3","216.58.197.4","TLSv1.2","159","Application Data"
"20","2018-08-23 02:41:17.857885","192.168.2.3","216.58.197.4","TCP","1434","34236  >  443 [ACK] Seq=184 Ack=1 Win=2363 Len=1368 TSval=8075996 TSecr=762652648 [TCP segment of a reassembled PDU]"
"21","2018-08-23 02:41:17.858156","192.168.2.3","216.58.197.4","TCP","1434","34236  >  443 [ACK] Seq=1552 Ack=1 Win=2363 Len=1368 TSval=8075996 TSecr=762652648 [TCP segment of a reassembled PDU]"
"22","2018-08-23 02:41:17.858158","192.168.2.3","216.58.197.4","TLSv1.2","212","Application Data"
"23","2018-08-23 02:41:17.858553","192.168.2.3","216.58.197.4","TCP","1434","34236  >  443 [ACK] Seq=3066 Ack=1 Win=2363 Len=1368 TSval=8075996 TSecr=762652648 [TCP segment of a reassembled PDU]"
"24","2018-08-23 02:41:17.858556","192.168.2.3","216.58.197.4","TLSv1.2","411","Application Data"
"25","2018-08-23 02:41:17.858798","192.168.2.3","216.58.197.4","TCP","1434","34236  >  443 [ACK] Seq=4779 Ack=1 Win=2363 Len=1368 TSval=8075996 TSecr=762652648 [TCP segment of a reassembled PDU]"
"26","2018-08-23 02:41:17.859123","192.168.2.3","216.58.197.4","TCP","1434","34236  >  443 [ACK] Seq=6147 Ack=1 Win=2363 Len=1368 TSval=8075996 TSecr=762652648 [TCP segment of a reassembled PDU]"
"27","2018-08-23 02:41:17.859126","192.168.2.3","216.58.197.4","TLSv1.2","212","Application Data"
"28","2018-08-23 02:41:17.859351","192.168.2.3","216.58.197.4","TCP","1434","34236  >  443 [ACK] Seq=7661 Ack=1 Win=2363 Len=1368 TSval=8075996 TSecr=762652648 [TCP segment of a reassembled PDU]"
"29","2018-08-23 02:41:17.859353","192.168.2.3","216.58.197.4","TLSv1.2","156","Application Data"
"40","2018-08-23 02:41:17.864698","192.168.2.3","216.58.197.4","TCP","1434","34236  >  443 [ACK] Seq=9119 Ack=1 Win=2363 Len=1368 TSval=8075996 TSecr=762652664 [TCP segment of a reassembled PDU]"
"41","2018-08-23 02:41:17.864704","192.168.2.3","216.58.197.4","TCP","1434","34236  >  443 [ACK] Seq=10487 Ack=1 Win=2363 Len=1368 TSval=8075996 TSecr=762652664 [TCP segment of a reassembled PDU]"
"42","2018-08-23 02:41:17.865012","192.168.2.3","216.58.197.4","TLSv1.2","1434","Application Data [TCP segment of a reassembled PDU]"
"43","2018-08-23 02:41:17.865017","192.168.2.3","216.58.197.4","TLSv1.2","1434","Application Data [TCP segment of a reassembled PDU]"
"44","2018-08-23 02:41:17.865363","192.168.2.3","216.58.197.4","TCP","1434","34236  >  443 [ACK] Seq=14591 Ack=1 Win=2363 Len=1368 TSval=8075996 TSecr=762652664 [TCP segment of a reassembled PDU]"
"45","2018-08-23 02:41:17.867008","192.168.2.3","216.58.197.4","TLSv1.2","1434","Application Data [TCP segment of a reassembled PDU]"
"46","2018-08-23 02:41:17.867013","192.168.2.3","216.58.197.4","TLSv1.2","1434","Application Data [TCP segment of a reassembled PDU]"
"47","2018-08-23 02:41:17.867287","192.168.2.3","216.58.197.4","TCP","1434","34236  >  443 [ACK] Seq=18695 Ack=1 Win=2363 Len=1368 TSval=8075996 TSecr=762652664 [TCP segment of a reassembled PDU]"
"48","2018-08-23 02:41:17.867292","192.168.2.3","216.58.197.4","TLSv1.2","1434","Application Data [TCP segment of a reassembled PDU]"
"49","2018-08-23 02:41:17.867625","192.168.2.3","216.58.197.4","TLSv1.2","1434","Application Data [TCP segment of a reassembled PDU]"
"50","2018-08-23 02:41:17.867737","192.168.2.3","216.58.197.4","TCP","1434","34236  >  443 [ACK] Seq=22799 Ack=1 Win=2363 Len=1368 TSval=8075996 TSecr=762652665 [TCP segment of a reassembled PDU]"
"51","2018-08-23 02:41:17.867881","192.168.2.3","216.58.197.4","TLSv1.2","1434","Application Data [TCP segment of a reassembled PDU]"
"52","2018-08-23 02:41:17.868205","192.168.2.3","216.58.197.4","TLSv1.2","1434","Application Data [TCP segment of a reassembled PDU]"
"55","2018-08-23 02:41:17.869195","192.168.2.3","216.58.197.4","TCP","1434","34236  >  443 [ACK] Seq=26903 Ack=1 Win=2363 Len=1368 TSval=8075997 TSecr=762652665 [TCP segment of a reassembled PDU]"
"56","2018-08-23 02:41:17.869198","192.168.2.3","216.58.197.4","TLSv1.2","1434","Application Data [TCP segment of a reassembled PDU]"
"59","2018-08-23 02:41:17.869355","192.168.2.3","216.58.197.4","TLSv1.2","1434","Application Data [TCP segment of a reassembled PDU]"
"60","2018-08-23 02:41:17.869673","192.168.2.3","216.58.197.4","TCP","1434","34236  >  443 [ACK] Seq=31007 Ack=1 Win=2363 Len=1368 TSval=8075997 TSecr=762652665 [TCP segment of a reassembled PDU]"
"61","2018-08-23 02:41:17.869810","192.168.2.3","216.58.197.4","TLSv1.2","1434","Application Data [TCP segment of a reassembled PDU]"
"62","2018-08-23 02:41:17.869993","192.168.2.3","216.58.197.4","TCP","1434","34236  >  443 [ACK] Seq=33743 Ack=1 Win=2363 Len=1368 TSval=8075997 TSecr=762652665 [TCP segment of a reassembled PDU]"
"63","2018-08-23 02:41:17.870189","192.168.2.3","216.58.197.4","TLSv1.2","1434","Application Data [TCP segment of a reassembled PDU]"
"65","2018-08-23 02:41:17.871289","192.168.2.3","216.58.197.4","TCP","1434","34236  >  443 [ACK] Seq=36479 Ack=1 Win=2363 Len=1368 TSval=8075997 TSecr=762652670 [TCP segment of a reassembled PDU]"
"69","2018-08-23 02:41:17.872122","192.168.2.3","216.58.197.4","TLSv1.2","1434","Application Data [TCP segment of a reassembled PDU]"
"70","2018-08-23 02:41:17.872125","192.168.2.3","216.58.197.4","TLSv1.2","1434","Application Data [TCP segment of a reassembled PDU]"
"71","2018-08-23 02:41:17.872502","192.168.2.3","216.58.197.4","TCP","1434","34236  >  443 [ACK] Seq=40583 Ack=1 Win=2363 Len=1368 TSval=8075997 TSecr=762652671 [TCP segment of a reassembled PDU]"
"72","2018-08-23 02:41:17.872789","192.168.2.3","216.58.197.4","TLSv1.2","1434","Application Data [TCP segment of a reassembled PDU]"
"74","2018-08-23 02:41:17.873337","192.168.2.3","216.58.197.4","TLSv1.2","1434","Application Data [TCP segment of a reassembled PDU]"
"75","2018-08-23 02:41:17.873545","192.168.2.3","216.58.197.4","TCP","1434","34236  >  443 [ACK] Seq=44687 Ack=1 Win=2363 Len=1368 TSval=8075997 TSecr=762652673 [TCP segment of a reassembled PDU]"
"76","2018-08-23 02:41:17.873549","192.168.2.3","216.58.197.4","TLSv1.2","1434","Application Data [TCP segment of a reassembled PDU]"
"78","2018-08-23 02:41:17.873921","192.168.2.3","216.58.197.4","TLSv1.2","1434","Application Data [TCP segment of a reassembled PDU]"
"80","2018-08-23 02:41:17.874192","192.168.2.3","216.58.197.4","TCP","1434","34236  >  443 [ACK] Seq=48791 Ack=1 Win=2363 Len=1368 TSval=8075997 TSecr=762652673 [TCP segment of a reassembled PDU]"
"82","2018-08-23 02:41:17.874354","192.168.2.3","216.58.197.4","TLSv1.2","1434","Application Data [TCP segment of a reassembled PDU]"
"83","2018-08-23 02:41:17.874536","192.168.2.3","216.58.197.4","TLSv1.2","1434","Application Data [TCP segment of a reassembled PDU]"
"84","2018-08-23 02:41:17.874538","192.168.2.3","216.58.197.4","TCP","1434","34236  >  443 [ACK] Seq=52895 Ack=1 Win=2363 Len=1368 TSval=8075997 TSecr=762652673 [TCP segment of a reassembled PDU]"
"85","2018-08-23 02:41:17.874913","192.168.2.3","216.58.197.4","TLSv1.2","1434","Application Data [TCP segment of a reassembled PDU]"
"86","2018-08-23 02:41:17.875161","192.168.2.3","216.58.197.4","TLSv1.2","1434","Application Data [TCP segment of a reassembled PDU]"
"87","2018-08-23 02:41:17.875359","192.168.2.3","216.58.197.4","TCP","1434","34236  >  443 [ACK] Seq=56999 Ack=1 Win=2363 Len=1368 TSval=8075997 TSecr=762652674 [TCP segment of a reassembled PDU]"
"90","2018-08-23 02:41:17.877041","192.168.2.3","216.58.197.4","TLSv1.2","1434","Application Data [TCP segment of a reassembled PDU]"
"91","2018-08-23 02:41:17.877043","192.168.2.3","216.58.197.4","TCP","1434","34236  >  443 [ACK] Seq=59735 Ack=1 Win=2363 Len=1368 TSval=8075998 TSecr=762652675 [TCP segment of a reassembled PDU]"
"92","2018-08-23 02:41:17.877230","192.168.2.3","216.58.197.4","TLSv1.2","1434","Application Data [TCP segment of a reassembled PDU]"
"94","2018-08-23 02:41:17.877541","192.168.2.3","216.58.197.4","TLSv1.2","1341","Application Data"
"102","2018-08-23 02:41:17.887785","192.168.2.3","216.58.197.4","TCP","1434","34236  >  443 [ACK] Seq=63746 Ack=1 Win=2363 Len=1368 TSval=8075999 TSecr=762652683 [TCP segment of a reassembled PDU]"
"103","2018-08-23 02:41:17.888224","192.168.2.3","216.58.197.4","TCP","1434","34236  >  443 [ACK] Seq=65114 Ack=1 Win=2363 Len=1368 TSval=8075999 TSecr=762652683 [TCP segment of a reassembled PDU]"
"104","2018-08-23 02:41:17.888230","192.168.2.3","216.58.197.4","TLSv1.2","212","Application Data"
"105","2018-08-23 02:41:17.888650","192.168.2.3","216.58.197.4","TCP","1434","34236  >  443 [ACK] Seq=66628 Ack=1 Win=2363 Len=1368 TSval=8075999 TSecr=762652683 [TCP segment of a reassembled PDU]"
"106","2018-08-23 02:41:17.888653","192.168.2.3","216.58.197.4","TLSv1.2","155","Application Data"
"110","2018-08-23 02:41:17.988157","192.168.2.3","216.58.197.4","TCP","1434","34236  >  443 [ACK] Seq=68085 Ack=1 Win=2363 Len=1368 TSval=8076008 TSecr=762652694 [TCP segment of a reassembled PDU]"
"111","2018-08-23 02:41:17.988166","192.168.2.3","216.58.197.4","TCP","1434","34236  >  443 [ACK] Seq=69453 Ack=1 Win=2363 Len=1368 TSval=8076008 TSecr=762652694 [TCP segment of a reassembled PDU]"
"112","2018-08-23 02:41:17.988167","192.168.2.3","216.58.197.4","TLSv1.2","212","Application Data"
"113","2018-08-23 02:41:17.988497","192.168.2.3","216.58.197.4","TCP","1434","34236  >  443 [ACK] Seq=70967 Ack=1 Win=2363 Len=1368 TSval=8076008 TSecr=762652694 [TCP segment of a reassembled PDU]"
"114","2018-08-23 02:41:17.988501","192.168.2.3","216.58.197.4","TLSv1.2","155","Application Data"
"118","2018-08-23 02:41:18.089734","192.168.2.3","216.58.197.4","TCP","1434","34236  >  443 [ACK] Seq=72424 Ack=1 Win=2363 Len=1368 TSval=8076019 TSecr=762652794 [TCP segment of a reassembled PDU]"
"119","2018-08-23 02:41:18.089739","192.168.2.3","216.58.197.4","TCP","1434","34236  >  443 [ACK] Seq=73792 Ack=1 Win=2363 Len=1368 TSval=8076019 TSecr=762652794 [TCP segment of a reassembled PDU]"
"120","2018-08-23 02:41:18.089740","192.168.2.3","216.58.197.4","TLSv1.2","212","Application Data"
"121","2018-08-23 02:41:18.090099","192.168.2.3","216.58.197.4","TCP","1434","34236  >  443 [ACK] Seq=75306 Ack=1 Win=2363 Len=1368 TSval=8076019 TSecr=762652794 [TCP segment of a reassembled PDU]"
"122","2018-08-23 02:41:18.090101","192.168.2.3","216.58.197.4","TLSv1.2","155","Application Data"
"129","2018-08-23 02:41:18.172191","192.168.2.3","216.58.197.4","TCP","66","34236  >  443 [ACK] Seq=76763 Ack=327 Win=2363 Len=0 TSval=8076027 TSecr=762652971"
"131","2018-08-23 02:41:18.185301","192.168.2.3","216.58.197.4","TCP","1434","34236  >  443 [ACK] Seq=76763 Ack=577 Win=2363 Len=1368 TSval=8076028 TSecr=762652982 [TCP segment of a reassembled PDU]"
"132","2018-08-23 02:41:18.185554","192.168.2.3","216.58.197.4","TCP","1434","34236  >  443 [ACK] Seq=78131 Ack=577 Win=2363 Len=1368 TSval=8076028 TSecr=762652982 [TCP segment of a reassembled PDU]"
"133","2018-08-23 02:41:18.185557","192.168.2.3","216.58.197.4","TLSv1.2","212","Application Data"
"134","2018-08-23 02:41:18.185990","192.168.2.3","216.58.197.4","TCP","1434","34236  >  443 [ACK] Seq=79645 Ack=577 Win=2363 Len=1368 TSval=8076028 TSecr=762652982 [TCP segment of a reassembled PDU]"
"135","2018-08-23 02:41:18.185994","192.168.2.3","216.58.197.4","TLSv1.2","155","Application Data"
"140","2018-08-23 02:41:18.284025","192.168.2.3","216.58.197.4","TCP","1434","34236  >  443 [ACK] Seq=81102 Ack=751 Win=2363 Len=1368 TSval=8076038 TSecr=762653079 [TCP segment of a reassembled PDU]"
"141","2018-08-23 02:41:18.284383","192.168.2.3","216.58.197.4","TCP","1434","34236  >  443 [ACK] Seq=82470 Ack=751 Win=2363 Len=1368 TSval=8076038 TSecr=762653079 [TCP segment of a reassembled PDU]"
"142","2018-08-23 02:41:18.284387","192.168.2.3","216.58.197.4","TLSv1.2","212","Application Data"
"143","2018-08-23 02:41:18.285673","192.168.2.3","216.58.197.4","TCP","1434","34236  >  443 [ACK] Seq=83984 Ack=751 Win=2363 Len=1368 TSval=8076038 TSecr=762653079 [TCP segment of a reassembled PDU]"
"144","2018-08-23 02:41:18.285676","192.168.2.3","216.58.197.4","TLSv1.2","155","Application Data"
"148","2018-08-23 02:41:18.398953","192.168.2.3","216.58.197.4","TCP","1434","34236  >  443 [ACK] Seq=85441 Ack=751 Win=2363 Len=1368 TSval=8076050 TSecr=762653091 [TCP segment of a reassembled PDU]"
"149","2018-08-23 02:41:18.399330","192.168.2.3","216.58.197.4","TCP","1434","34236  >  443 [ACK] Seq=86809 Ack=751 Win=2363 Len=1368 TSval=8076050 TSecr=762653091 [TCP segment of a reassembled PDU]"
"150","2018-08-23 02:41:18.399333","192.168.2.3","216.58.197.4","TLSv1.2","212","Application Data"
"151","2018-08-23 02:41:18.399802","192.168.2.3","216.58.197.4","TCP","1434","34236  >  443 [ACK] Seq=88323 Ack=751 Win=2363 Len=1368 TSval=8076050 TSecr=762653091 [TCP segment of a reassembled PDU]"
"152","2018-08-23 02:41:18.399804","192.168.2.3","216.58.197.4","TLSv1.2","155","Application Data"
"157","2018-08-23 02:41:18.472278","192.168.2.3","216.58.197.4","TCP","1434","34236  >  443 [ACK] Seq=89780 Ack=927 Win=2363 Len=1368 TSval=8076057 TSecr=762653263 [TCP segment of a reassembled PDU]"
"158","2018-08-23 02:41:18.472602","192.168.2.3","216.58.197.4","TCP","1434","34236  >  443 [ACK] Seq=91148 Ack=927 Win=2363 Len=1368 TSval=8076057 TSecr=762653263 [TCP segment of a reassembled PDU]"
"159","2018-08-23 02:41:18.472606","192.168.2.3","216.58.197.4","TLSv1.2","212","Application Data"
"160","2018-08-23 02:41:18.472778","192.168.2.3","216.58.197.4","TCP","1434","34236  >  443 [ACK] Seq=92662 Ack=927 Win=2363 Len=1368 TSval=8076057 TSecr=762653263 [TCP segment of a reassembled PDU]"
"161","2018-08-23 02:41:18.472780","192.168.2.3","216.58.197.4","TLSv1.2","155","Application Data"
"165","2018-08-23 02:41:18.567873","192.168.2.3","216.58.197.4","TCP","1434","34236  >  443 [ACK] Seq=94119 Ack=927 Win=2363 Len=1368 TSval=8076067 TSecr=762653279 [TCP segment of a reassembled PDU]"
"166","2018-08-23 02:41:18.568151","192.168.2.3","216.58.197.4","TCP","1434","34236  >  443 [ACK] Seq=95487 Ack=927 Win=2363 Len=1368 TSval=8076067 TSecr=762653279 [TCP segment of a reassembled PDU]"
"167","2018-08-23 02:41:18.568155","192.168.2.3","216.58.197.4","TLSv1.2","212","Application Data"
"168","2018-08-23 02:41:18.568544","192.168.2.3","216.58.197.4","TCP","1434","34236  >  443 [ACK] Seq=97001 Ack=927 Win=2363 Len=1368 TSval=8076067 TSecr=762653279 [TCP segment of a reassembled PDU]"
"169","2018-08-23 02:41:18.568547","192.168.2.3","216.58.197.4","TLSv1.2","155","Application Data"
"173","2018-08-23 02:41:18.653730","192.168.2.3","216.58.197.4","TCP","1434","34236  >  443 [ACK] Seq=98458 Ack=927 Win=2363 Len=1368 TSval=8076075 TSecr=762653374 [TCP segment of a reassembled PDU]"
"174","2018-08-23 02:41:18.654078","192.168.2.3","216.58.197.4","TCP","1434","34236  >  443 [ACK] Seq=99826 Ack=927 Win=2363 Len=1368 TSval=8076075 TSecr=762653374 [TCP segment of a reassembled PDU]"
"175","2018-08-23 02:41:18.654081","192.168.2.3","216.58.197.4","TLSv1.2","212","Application Data"
"176","2018-08-23 02:41:18.654082","192.168.2.3","216.58.197.4","TCP","1434","34236  >  443 [ACK] Seq=101340 Ack=927 Win=2363 Len=1368 TSval=8076075 TSecr=762653374 [TCP segment of a reassembled PDU]"
"177","2018-08-23 02:41:18.654181","192.168.2.3","216.58.197.4","TLSv1.2","155","Application Data"
"181","2018-08-23 02:41:18.749146","192.168.2.3","216.58.197.4","TCP","1434","34236  >  443 [ACK] Seq=102797 Ack=927 Win=2363 Len=1368 TSval=8076085 TSecr=762653460 [TCP segment of a reassembled PDU]"
"182","2018-08-23 02:41:18.749476","192.168.2.3","216.58.197.4","TCP","1434","34236  >  443 [ACK] Seq=104165 Ack=927 Win=2363 Len=1368 TSval=8076085 TSecr=762653460 [TCP segment of a reassembled PDU]"
"183","2018-08-23 02:41:18.749479","192.168.2.3","216.58.197.4","TLSv1.2","212","Application Data"
"184","2018-08-23 02:41:18.749874","192.168.2.3","216.58.197.4","TCP","1434","34236  >  443 [ACK] Seq=105679 Ack=927 Win=2363 Len=1368 TSval=8076085 TSecr=762653460 [TCP segment of a reassembled PDU]"
"185","2018-08-23 02:41:18.749877","192.168.2.3","216.58.197.4","TLSv1.2","155","Application Data"
"189","2018-08-23 02:41:18.785500","192.168.2.3","203.211.199.120","TCP","66","52078  >  443 [ACK] Seq=1 Ack=1 Win=661 Len=0 TSval=8076089 TSecr=1194190016"
"191","2018-08-23 02:41:18.824457","192.168.2.3","216.58.197.4","TCP","1434","34236  >  443 [ACK] Seq=107136 Ack=927 Win=2363 Len=1368 TSval=8076092 TSecr=762653556 [TCP segment of a reassembled PDU]"
"192","2018-08-23 02:41:18.824462","192.168.2.3","216.58.197.4","TCP","1434","34236  >  443 [ACK] Seq=108504 Ack=927 Win=2363 Len=1368 TSval=8076092 TSecr=762653556 [TCP segment of a reassembled PDU]"
"193","2018-08-23 02:41:18.824463","192.168.2.3","216.58.197.4","TLSv1.2","212","Application Data"
"194","2018-08-23 02:41:18.824901","192.168.2.3","216.58.197.4","TCP","1434","34236  >  443 [ACK] Seq=110018 Ack=927 Win=2363 Len=1368 TSval=8076092 TSecr=762653556 [TCP segment of a reassembled PDU]"
"195","2018-08-23 02:41:18.824904","192.168.2.3","216.58.197.4","TLSv1.2","155","Application Data"
"199","2018-08-23 02:41:18.837468","192.168.2.3","192.168.2.1","TCP","183","8009  >  53029 [PSH, ACK] Seq=1 Ack=118 Win=277 Len=117 TSval=8076094 TSecr=2318013754 [TCP segment of a reassembled PDU]"
"201","2018-08-23 02:41:18.922192","192.168.2.3","216.58.197.4","TCP","1434","34236  >  443 [ACK] Seq=111475 Ack=927 Win=2363 Len=1368 TSval=8076102 TSecr=762653631 [TCP segment of a reassembled PDU]"
"202","2018-08-23 02:41:18.922501","192.168.2.3","216.58.197.4","TCP","1434","34236  >  443 [ACK] Seq=112843 Ack=927 Win=2363 Len=1368 TSval=8076102 TSecr=762653631 [TCP segment of a reassembled PDU]"
"203","2018-08-23 02:41:18.922504","192.168.2.3","216.58.197.4","TLSv1.2","212","Application Data"
"204","2018-08-23 02:41:18.922723","192.168.2.3","216.58.197.4","TCP","1434","34236  >  443 [ACK] Seq=114357 Ack=927 Win=2363 Len=1368 TSval=8076102 TSecr=762653631 [TCP segment of a reassembled PDU]"
"205","2018-08-23 02:41:18.922725","192.168.2.3","216.58.197.4","TLSv1.2","155","Application Data"
"209","2018-08-23 02:41:19.012978","192.168.2.3","216.58.197.4","TCP","1434","34236  >  443 [ACK] Seq=115814 Ack=927 Win=2363 Len=1368 TSval=8076111 TSecr=762653728 [TCP segment of a reassembled PDU]"
"210","2018-08-23 02:41:19.012992","192.168.2.3","216.58.197.4","TCP","1434","34236  >  443 [ACK] Seq=117182 Ack=927 Win=2363 Len=1368 TSval=8076111 TSecr=762653728 [TCP segment of a reassembled PDU]"
"211","2018-08-23 02:41:19.012993","192.168.2.3","216.58.197.4","TLSv1.2","212","Application Data"
"212","2018-08-23 02:41:19.013303","192.168.2.3","216.58.197.4","TCP","1434","34236  >  443 [ACK] Seq=118696 Ack=927 Win=2363 Len=1368 TSval=8076111 TSecr=762653728 [TCP segment of a reassembled PDU]"
"213","2018-08-23 02:41:19.013312","192.168.2.3","216.58.197.4","TLSv1.2","155","Application Data"
"217","2018-08-23 02:41:19.085029","192.168.2.3","216.58.197.4","TCP","1434","34236  >  443 [ACK] Seq=120153 Ack=927 Win=2363 Len=1368 TSval=8076118 TSecr=762653819 [TCP segment of a reassembled PDU]"
"218","2018-08-23 02:41:19.085035","192.168.2.3","216.58.197.4","TCP","1434","34236  >  443 [ACK] Seq=121521 Ack=927 Win=2363 Len=1368 TSval=8076118 TSecr=762653819 [TCP segment of a reassembled PDU]"
"219","2018-08-23 02:41:19.085036","192.168.2.3","216.58.197.4","TLSv1.2","212","Application Data"
"220","2018-08-23 02:41:19.085089","192.168.2.3","216.58.197.4","TCP","1434","34236  >  443 [ACK] Seq=123035 Ack=927 Win=2363 Len=1368 TSval=8076118 TSecr=762653819 [TCP segment of a reassembled PDU]"
"221","2018-08-23 02:41:19.085381","192.168.2.3","216.58.197.4","TLSv1.2","155","Application Data"
"226","2018-08-23 02:41:19.176781","192.168.2.3","216.58.197.4","TCP","1434","34236  >  443 [ACK] Seq=124492 Ack=1017 Win=2363 Len=1368 TSval=8076128 TSecr=762653971 [TCP segment of a reassembled PDU]"
"227","2018-08-23 02:41:19.177243","192.168.2.3","216.58.197.4","TCP","1434","34236  >  443 [ACK] Seq=125860 Ack=1017 Win=2363 Len=1368 TSval=8076128 TSecr=762653971 [TCP segment of a reassembled PDU]"
"228","2018-08-23 02:41:19.177245","192.168.2.3","216.58.197.4","TLSv1.2","212","Application Data"
"229","2018-08-23 02:41:19.177620","192.168.2.3","216.58.197.4","TCP","1434","34236  >  443 [ACK] Seq=127374 Ack=1017 Win=2363 Len=1368 TSval=8076128 TSecr=762653971 [TCP segment of a reassembled PDU]"
"230","2018-08-23 02:41:19.177635","192.168.2.3","216.58.197.4","TLSv1.2","155","Application Data"
"235","2018-08-23 02:41:19.217527","192.168.2.3","216.58.197.4","TCP","66","34236  >  443 [ACK] Seq=128831 Ack=1266 Win=2363 Len=0 TSval=8076132 TSecr=762653982"
"236","2018-08-23 02:41:19.263794","192.168.2.3","216.58.197.4","TCP","1434","34236  >  443 [ACK] Seq=128831 Ack=1266 Win=2363 Len=1368 TSval=8076136 TSecr=762653982 [TCP segment of a reassembled PDU]"
"237","2018-08-23 02:41:19.263800","192.168.2.3","216.58.197.4","TCP","1434","34236  >  443 [ACK] Seq=130199 Ack=1266 Win=2363 Len=1368 TSval=8076136 TSecr=762653982 [TCP segment of a reassembled PDU]"
"238","2018-08-23 02:41:19.263801","192.168.2.3","216.58.197.4","TLSv1.2","212","Application Data"
"239","2018-08-23 02:41:19.264116","192.168.2.3","216.58.197.4","TCP","1434","34236  >  443 [ACK] Seq=131713 Ack=1266 Win=2363 Len=1368 TSval=8076136 TSecr=762653982 [TCP segment of a reassembled PDU]"
"240","2018-08-23 02:41:19.264118","192.168.2.3","216.58.197.4","TLSv1.2","155","Application Data"
"245","2018-08-23 02:41:19.349896","192.168.2.3","216.58.197.4","TCP","66","34236  >  443 [ACK] Seq=133170 Ack=1560 Win=2363 Len=0 TSval=8076145 TSecr=762654149"
"246","2018-08-23 02:41:19.349903","192.168.2.3","216.58.197.4","TCP","66","34236  >  443 [ACK] Seq=133170 Ack=1707 Win=2363 Len=0 TSval=8076145 TSecr=762654149"
"248","2018-08-23 02:41:19.367198","192.168.2.3","216.58.197.4","TCP","1434","34236  >  443 [ACK] Seq=133170 Ack=1707 Win=2363 Len=1368 TSval=8076146 TSecr=762654149 [TCP segment of a reassembled PDU]"
"249","2018-08-23 02:41:19.367203","192.168.2.3","216.58.197.4","TCP","1434","34236  >  443 [ACK] Seq=134538 Ack=1707 Win=2363 Len=1368 TSval=8076146 TSecr=762654149 [TCP segment of a reassembled PDU]"
"250","2018-08-23 02:41:19.367312","192.168.2.3","216.58.197.4","TLSv1.2","212","Application Data"
"251","2018-08-23 02:41:19.367572","192.168.2.3","216.58.197.4","TCP","1434","34236  >  443 [ACK] Seq=136052 Ack=1707 Win=2363 Len=1368 TSval=8076146 TSecr=762654149 [TCP segment of a reassembled PDU]"
"252","2018-08-23 02:41:19.367576","192.168.2.3","216.58.197.4","TLSv1.2","155","Application Data"
"256","2018-08-23 02:41:19.396633","192.168.2.3","216.58.197.4","TCP","66","34236  >  443 [ACK] Seq=137509 Ack=2108 Win=2363 Len=0 TSval=8076148 TSecr=762654164"
"258","2018-08-23 02:41:19.400855","192.168.2.3","216.58.197.4","TCP","78","34236  >  443 [ACK] Seq=137509 Ack=2410 Win=2363 Len=0 TSval=8076150 TSecr=762654201 SLE=2108 SRE=2410"
"259","2018-08-23 02:41:19.455103","192.168.2.3","216.58.197.4","TCP","1434","34236  >  443 [ACK] Seq=137509 Ack=2410 Win=2363 Len=1368 TSval=8076155 TSecr=762654201 [TCP segment of a reassembled PDU]"
"260","2018-08-23 02:41:19.455442","192.168.2.3","216.58.197.4","TCP","1434","34236  >  443 [ACK] Seq=138877 Ack=2410 Win=2363 Len=1368 TSval=8076155 TSecr=762654201 [TCP segment of a reassembled PDU]"
"261","2018-08-23 02:41:19.455445","192.168.2.3","216.58.197.4","TLSv1.2","212","Application Data"
"262","2018-08-23 02:41:19.455672","192.168.2.3","216.58.197.4","TCP","1434","34236  >  443 [ACK] Seq=140391 Ack=2410 Win=2363 Len=1368 TSval=8076155 TSecr=762654201 [TCP segment of a reassembled PDU]"
"263","2018-08-23 02:41:19.455674","192.168.2.3","216.58.197.4","TLSv1.2","155","Application Data"
"267","2018-08-23 02:41:19.568678","192.168.2.3","216.58.197.4","TCP","1434","34236  >  443 [ACK] Seq=141848 Ack=2410 Win=2363 Len=1368 TSval=8076165 TSecr=762654301 [TCP segment of a reassembled PDU]"
"268","2018-08-23 02:41:19.568683","192.168.2.3","216.58.197.4","TCP","1434","34236  >  443 [ACK] Seq=143216 Ack=2410 Win=2363 Len=1368 TSval=8076165 TSecr=762654301 [TCP segment of a reassembled PDU]"
"269","2018-08-23 02:41:19.568814","192.168.2.3","216.58.197.4","TLSv1.2","212","Application Data"
"270","2018-08-23 02:41:19.569069","192.168.2.3","216.58.197.4","TCP","1434","34236  >  443 [ACK] Seq=144730 Ack=2410 Win=2363 Len=1368 TSval=8076165 TSecr=762654301 [TCP segment of a reassembled PDU]"
"271","2018-08-23 02:41:19.569071","192.168.2.3","216.58.197.4","TLSv1.2","155","Application Data"
"275","2018-08-23 02:41:19.645055","192.168.2.3","216.58.197.4","TCP","1434","34236  >  443 [ACK] Seq=146187 Ack=2410 Win=2363 Len=1368 TSval=8076171 TSecr=762654375 [TCP segment of a reassembled PDU]"
"276","2018-08-23 02:41:19.645060","192.168.2.3","216.58.197.4","TCP","1434","34236  >  443 [ACK] Seq=147555 Ack=2410 Win=2363 Len=1368 TSval=8076171 TSecr=762654375 [TCP segment of a reassembled PDU]"
"277","2018-08-23 02:41:19.645229","192.168.2.3","216.58.197.4","TLSv1.2","212","Application Data"
"278","2018-08-23 02:41:19.645231","192.168.2.3","216.58.197.4","TCP","1434","34236  >  443 [ACK] Seq=149069 Ack=2410 Win=2363 Len=1368 TSval=8076171 TSecr=762654375 [TCP segment of a reassembled PDU]"
"279","2018-08-23 02:41:19.645515","192.168.2.3","216.58.197.4","TLSv1.2","155","Application Data"
"285","2018-08-23 02:41:19.699059","192.168.2.3","216.58.197.4","TCP","66","34236  >  443 [ACK] Seq=150526 Ack=2626 Win=2363 Len=0 TSval=8076180 TSecr=762654499"
"286","2018-08-23 02:41:19.699380","192.168.2.3","216.58.197.4","TCP","66","34236  >  443 [ACK] Seq=150526 Ack=2794 Win=2363 Len=0 TSval=8076180 TSecr=762654500"
"287","2018-08-23 02:41:19.710036","192.168.2.3","216.58.197.4","TCP","1434","34236  >  443 [ACK] Seq=150526 Ack=2794 Win=2363 Len=1368 TSval=8076181 TSecr=762654500 [TCP segment of a reassembled PDU]"
"288","2018-08-23 02:41:19.712054","192.168.2.3","216.58.197.4","TCP","1434","34236  >  443 [ACK] Seq=151894 Ack=2794 Win=2363 Len=1368 TSval=8076181 TSecr=762654500 [TCP segment of a reassembled PDU]"
"289","2018-08-23 02:41:19.712057","192.168.2.3","216.58.197.4","TLSv1.2","212","Application Data"
"290","2018-08-23 02:41:19.712058","192.168.2.3","216.58.197.4","TCP","1434","34236  >  443 [ACK] Seq=153408 Ack=2794 Win=2363 Len=1368 TSval=8076181 TSecr=762654500 [TCP segment of a reassembled PDU]"
"291","2018-08-23 02:41:19.712246","192.168.2.3","216.58.197.4","TLSv1.2","155","Application Data"
"296","2018-08-23 02:41:19.772488","192.168.2.3","216.58.197.4","TCP","66","34236  >  443 [ACK] Seq=154865 Ack=3289 Win=2363 Len=0 TSval=8076187 TSecr=762654566"
"297","2018-08-23 02:41:19.806937","192.168.2.3","216.58.197.4","TCP","1434","34236  >  443 [ACK] Seq=154865 Ack=3289 Win=2363 Len=1368 TSval=8076191 TSecr=762654566 [TCP segment of a reassembled PDU]"
"298","2018-08-23 02:41:19.807297","192.168.2.3","216.58.197.4","TCP","1434","34236  >  443 [ACK] Seq=156233 Ack=3289 Win=2363 Len=1368 TSval=8076191 TSecr=762654566 [TCP segment of a reassembled PDU]"
"299","2018-08-23 02:41:19.807312","192.168.2.3","216.58.197.4","TLSv1.2","212","Application Data"
"300","2018-08-23 02:41:19.807313","192.168.2.3","216.58.197.4","TCP","1434","34236  >  443 [ACK] Seq=157747 Ack=3289 Win=2363 Len=1368 TSval=8076191 TSecr=762654566 [TCP segment of a reassembled PDU]"
"301","2018-08-23 02:41:19.807314","192.168.2.3","216.58.197.4","TLSv1.2","155","Application Data"
"304","2018-08-23 02:41:19.903104","192.168.2.3","216.58.197.4","TCP","1434","34236  >  443 [ACK] Seq=159204 Ack=3289 Win=2363 Len=1368 TSval=8076200 TSecr=762654613 [TCP segment of a reassembled PDU]"
"305","2018-08-23 02:41:19.903553","192.168.2.3","216.58.197.4","TCP","1434","34236  >  443 [ACK] Seq=160572 Ack=3289 Win=2363 Len=1368 TSval=8076200 TSecr=762654613 [TCP segment of a reassembled PDU]"
"306","2018-08-23 02:41:19.903556","192.168.2.3","216.58.197.4","TLSv1.2","212","Application Data"
"307","2018-08-23 02:41:19.903557","192.168.2.3","216.58.197.4","TCP","1434","34236  >  443 [ACK] Seq=162086 Ack=3289 Win=2363 Len=1368 TSval=8076200 TSecr=762654613 [TCP segment of a reassembled PDU]"
"308","2018-08-23 02:41:19.903558","192.168.2.3","216.58.197.4","TLSv1.2","155","Application Data"
"314","2018-08-23 02:41:19.966495","192.168.2.3","216.58.197.4","TCP","66","34236  >  443 [ACK] Seq=163543 Ack=3570 Win=2363 Len=0 TSval=8076207 TSecr=762654767"
"315","2018-08-23 02:41:19.996740","192.168.2.3","216.58.197.4","TCP","1434","34236  >  443 [ACK] Seq=163543 Ack=3570 Win=2363 Len=1368 TSval=8076210 TSecr=762654767 [TCP segment of a reassembled PDU]"
"316","2018-08-23 02:41:19.997052","192.168.2.3","216.58.197.4","TCP","1434","34236  >  443 [ACK] Seq=164911 Ack=3570 Win=2363 Len=1368 TSval=8076210 TSecr=762654767 [TCP segment of a reassembled PDU]"
"317","2018-08-23 02:41:19.997055","192.168.2.3","216.58.197.4","TLSv1.2","212","Application Data"
"318","2018-08-23 02:41:19.997479","192.168.2.3","216.58.197.4","TCP","1434","34236  >  443 [ACK] Seq=166425 Ack=3570 Win=2363 Len=1368 TSval=8076210 TSecr=762654767 [TCP segment of a reassembled PDU]"
"319","2018-08-23 02:41:19.997482","192.168.2.3","216.58.197.4","TLSv1.2","155","Application Data"
"325","2018-08-23 02:41:20.069036","192.168.2.3","216.58.197.4","TCP","66","34236  >  443 [ACK] Seq=167882 Ack=3954 Win=2363 Len=0 TSval=8076217 TSecr=762654869"
"326","2018-08-23 02:41:20.076410","192.168.2.3","216.58.197.4","TCP","1434","34236  >  443 [ACK] Seq=167882 Ack=3954 Win=2363 Len=1368 TSval=8076217 TSecr=762654869 [TCP segment of a reassembled PDU]"
"327","2018-08-23 02:41:20.076415","192.168.2.3","216.58.197.4","TCP","1434","34236  >  443 [ACK] Seq=169250 Ack=3954 Win=2363 Len=1368 TSval=8076217 TSecr=762654869 [TCP segment of a reassembled PDU]"
"328","2018-08-23 02:41:20.076518","192.168.2.3","216.58.197.4","TLSv1.2","212","Application Data"
"329","2018-08-23 02:41:20.076677","192.168.2.3","216.58.197.4","TCP","1434","34236  >  443 [ACK] Seq=170764 Ack=3954 Win=2363 Len=1368 TSval=8076217 TSecr=762654869 [TCP segment of a reassembled PDU]"
"330","2018-08-23 02:41:20.076680","192.168.2.3","216.58.197.4","TLSv1.2","155","Application Data"
"335","2018-08-23 02:41:20.181694","192.168.2.3","216.58.197.4","TCP","66","34236  >  443 [ACK] Seq=172221 Ack=4363 Win=2363 Len=0 TSval=8076228 TSecr=762654971"
"336","2018-08-23 02:41:20.189301","192.168.2.3","216.58.197.4","TCP","1434","34236  >  443 [ACK] Seq=172221 Ack=4363 Win=2363 Len=1368 TSval=8076229 TSecr=762654971 [TCP segment of a reassembled PDU]"
"337","2018-08-23 02:41:20.189685","192.168.2.3","216.58.197.4","TCP","1434","34236  >  443 [ACK] Seq=173589 Ack=4363 Win=2363 Len=1368 TSval=8076229 TSecr=762654971 [TCP segment of a reassembled PDU]"
"338","2018-08-23 02:41:20.189689","192.168.2.3","216.58.197.4","TLSv1.2","212","Application Data"
"339","2018-08-23 02:41:20.190071","192.168.2.3","216.58.197.4","TCP","1434","34236  >  443 [ACK] Seq=175103 Ack=4363 Win=2363 Len=1368 TSval=8076229 TSecr=762654971 [TCP segment of a reassembled PDU]"
"340","2018-08-23 02:41:20.190074","192.168.2.3","216.58.197.4","TLSv1.2","155","Application Data"
"346","2018-08-23 02:41:20.253472","192.168.2.3","216.58.197.4","TCP","66","34236  >  443 [ACK] Seq=176560 Ack=4664 Win=2363 Len=0 TSval=8076235 TSecr=762655054"
"347","2018-08-23 02:41:20.287040","192.168.2.3","216.58.197.4","TCP","1434","34236  >  443 [ACK] Seq=176560 Ack=4664 Win=2363 Len=1368 TSval=8076239 TSecr=762655054 [TCP segment of a reassembled PDU]"
"348","2018-08-23 02:41:20.287435","192.168.2.3","216.58.197.4","TCP","1434","34236  >  443 [ACK] Seq=177928 Ack=4664 Win=2363 Len=1368 TSval=8076239 TSecr=762655054 [TCP segment of a reassembled PDU]"
"349","2018-08-23 02:41:20.287437","192.168.2.3","216.58.197.4","TLSv1.2","212","Application Data"
"350","2018-08-23 02:41:20.287438","192.168.2.3","216.58.197.4","TCP","1434","34236  >  443 [ACK] Seq=179442 Ack=4664 Win=2363 Len=1368 TSval=8076239 TSecr=762655054 [TCP segment of a reassembled PDU]"
"351","2018-08-23 02:41:20.287729","192.168.2.3","216.58.197.4","TLSv1.2","155","Application Data"
"357","2018-08-23 02:41:20.360036","192.168.2.3","216.58.197.4","TCP","66","34236  >  443 [ACK] Seq=180899 Ack=5026 Win=2363 Len=0 TSval=8076246 TSecr=762655158"
"358","2018-08-23 02:41:20.383735","192.168.2.3","216.58.197.4","TCP","1434","34236  >  443 [ACK] Seq=180899 Ack=5026 Win=2363 Len=1368 TSval=8076248 TSecr=762655158 [TCP segment of a reassembled PDU]"
"359","2018-08-23 02:41:20.383741","192.168.2.3","216.58.197.4","TCP","1434","34236  >  443 [ACK] Seq=182267 Ack=5026 Win=2363 Len=1368 TSval=8076248 TSecr=762655158 [TCP segment of a reassembled PDU]"
"360","2018-08-23 02:41:20.383824","192.168.2.3","216.58.197.4","TLSv1.2","212","Application Data"
"361","2018-08-23 02:41:20.384044","192.168.2.3","216.58.197.4","TCP","1434","34236  >  443 [ACK] Seq=183781 Ack=5026 Win=2363 Len=1368 TSval=8076248 TSecr=762655158 [TCP segment of a reassembled PDU]"
"362","2018-08-23 02:41:20.384046","192.168.2.3","216.58.197.4","TLSv1.2","155","Application Data"
"365","2018-08-23 02:41:20.477645","192.168.2.3","216.58.197.4","TCP","1434","34236  >  443 [ACK] Seq=185238 Ack=5026 Win=2363 Len=1368 TSval=8076258 TSecr=762655190 [TCP segment of a reassembled PDU]"
"366","2018-08-23 02:41:20.478024","192.168.2.3","216.58.197.4","TCP","1434","34236  >  443 [ACK] Seq=186606 Ack=5026 Win=2363 Len=1368 TSval=8076258 TSecr=762655190 [TCP segment of a reassembled PDU]"
"367","2018-08-23 02:41:20.478029","192.168.2.3","216.58.197.4","TLSv1.2","212","Application Data"
"368","2018-08-23 02:41:20.478516","192.168.2.3","216.58.197.4","TCP","1434","34236  >  443 [ACK] Seq=188120 Ack=5026 Win=2363 Len=1368 TSval=8076258 TSecr=762655190 [TCP segment of a reassembled PDU]"
"369","2018-08-23 02:41:20.478520","192.168.2.3","216.58.197.4","TLSv1.2","155","Application Data"
"374","2018-08-23 02:41:20.588582","192.168.2.3","216.58.197.4","TCP","1434","34236  >  443 [ACK] Seq=189577 Ack=5149 Win=2363 Len=1368 TSval=8076269 TSecr=762655377 [TCP segment of a reassembled PDU]"
"375","2018-08-23 02:41:20.588588","192.168.2.3","216.58.197.4","TCP","1434","34236  >  443 [ACK] Seq=190945 Ack=5149 Win=2363 Len=1368 TSval=8076269 TSecr=762655377 [TCP segment of a reassembled PDU]"
"376","2018-08-23 02:41:20.588704","192.168.2.3","216.58.197.4","TLSv1.2","212","Application Data"
"377","2018-08-23 02:41:20.588972","192.168.2.3","216.58.197.4","TCP","1434","34236  >  443 [ACK] Seq=192459 Ack=5149 Win=2363 Len=1368 TSval=8076269 TSecr=762655377 [TCP segment of a reassembled PDU]"
"378","2018-08-23 02:41:20.588975","192.168.2.3","216.58.197.4","TLSv1.2","155","Application Data"
"382","2018-08-23 02:41:20.683633","192.168.2.3","216.58.197.4","TCP","1434","34236  >  443 [ACK] Seq=193916 Ack=5149 Win=2363 Len=1368 TSval=8076278 TSecr=762655395 [TCP segment of a reassembled PDU]"
"383","2018-08-23 02:41:20.684090","192.168.2.3","216.58.197.4","TCP","1434","34236  >  443 [ACK] Seq=195284 Ack=5149 Win=2363 Len=1368 TSval=8076278 TSecr=762655395 [TCP segment of a reassembled PDU]"
"384","2018-08-23 02:41:20.684094","192.168.2.3","216.58.197.4","TLSv1.2","212","Application Data"
"385","2018-08-23 02:41:20.684095","192.168.2.3","216.58.197.4","TCP","1434","34236  >  443 [ACK] Seq=196798 Ack=5149 Win=2363 Len=1368 TSval=8076278 TSecr=762655395 [TCP segment of a reassembled PDU]"
"386","2018-08-23 02:41:20.684096","192.168.2.3","216.58.197.4","TLSv1.2","155","Application Data"
"390","2018-08-23 02:41:20.799153","192.168.2.3","216.58.197.4","TCP","1434","34236  >  443 [ACK] Seq=198255 Ack=5149 Win=2363 Len=1368 TSval=8076290 TSecr=762655490 [TCP segment of a reassembled PDU]"
"391","2018-08-23 02:41:20.799601","192.168.2.3","216.58.197.4","TCP","1434","34236  >  443 [ACK] Seq=199623 Ack=5149 Win=2363 Len=1368 TSval=8076290 TSecr=762655490 [TCP segment of a reassembled PDU]"
"392","2018-08-23 02:41:20.799605","192.168.2.3","216.58.197.4","TLSv1.2","212","Application Data"
"393","2018-08-23 02:41:20.799779","192.168.2.3","216.58.197.4","TCP","1434","34236  >  443 [ACK] Seq=201137 Ack=5149 Win=2363 Len=1368 TSval=8076290 TSecr=762655490 [TCP segment of a reassembled PDU]"
"394","2018-08-23 02:41:20.799782","192.168.2.3","216.58.197.4","TLSv1.2","155","Application Data"
"400","2018-08-23 02:41:20.862883","192.168.2.3","216.58.197.4","TCP","66","34236  >  443 [ACK] Seq=202594 Ack=5413 Win=2363 Len=0 TSval=8076296 TSecr=762655663"
"401","2018-08-23 02:41:20.895702","192.168.2.3","216.58.197.4","TCP","1434","34236  >  443 [ACK] Seq=202594 Ack=5413 Win=2363 Len=1368 TSval=8076299 TSecr=762655663 [TCP segment of a reassembled PDU]"
"402","2018-08-23 02:41:20.895708","192.168.2.3","216.58.197.4","TCP","1434","34236  >  443 [ACK] Seq=203962 Ack=5413 Win=2363 Len=1368 TSval=8076299 TSecr=762655663 [TCP segment of a reassembled PDU]"
"403","2018-08-23 02:41:20.895820","192.168.2.3","216.58.197.4","TLSv1.2","212","Application Data"
"404","2018-08-23 02:41:20.896085","192.168.2.3","216.58.197.4","TCP","1434","34236  >  443 [ACK] Seq=205476 Ack=5413 Win=2363 Len=1368 TSval=8076299 TSecr=762655663 [TCP segment of a reassembled PDU]"
"405","2018-08-23 02:41:20.896089","192.168.2.3","216.58.197.4","TLSv1.2","155","Application Data"
"411","2018-08-23 02:41:20.958313","192.168.2.3","216.58.197.4","TCP","66","34236  >  443 [ACK] Seq=206933 Ack=5935 Win=2363 Len=0 TSval=8076306 TSecr=762655759"
"412","2018-08-23 02:41:20.998088","192.168.2.3","216.58.197.4","TCP","1434","34236  >  443 [ACK] Seq=206933 Ack=5935 Win=2363 Len=1368 TSval=8076309 TSecr=762655759 [TCP segment of a reassembled PDU]"
"413","2018-08-23 02:41:20.998096","192.168.2.3","216.58.197.4","TCP","1434","34236  >  443 [ACK] Seq=208301 Ack=5935 Win=2363 Len=1368 TSval=8076309 TSecr=762655759 [TCP segment of a reassembled PDU]"
"414","2018-08-23 02:41:20.998097","192.168.2.3","216.58.197.4","TLSv1.2","212","Application Data"
"415","2018-08-23 02:41:20.998374","192.168.2.3","216.58.197.4","TCP","1434","34236  >  443 [ACK] Seq=209815 Ack=5935 Win=2363 Len=1368 TSval=8076309 TSecr=762655759 [TCP segment of a reassembled PDU]"
"416","2018-08-23 02:41:20.998377","192.168.2.3","216.58.197.4","TLSv1.2","155","Application Data"
"419","2018-08-23 02:41:21.085675","192.168.2.3","216.58.197.4","TCP","1434","34236  >  443 [ACK] Seq=211272 Ack=5935 Win=2363 Len=1368 TSval=8076318 TSecr=762655804 [TCP segment of a reassembled PDU]"
"420","2018-08-23 02:41:21.086109","192.168.2.3","216.58.197.4","TCP","1434","34236  >  443 [ACK] Seq=212640 Ack=5935 Win=2363 Len=1368 TSval=8076318 TSecr=762655804 [TCP segment of a reassembled PDU]"
"421","2018-08-23 02:41:21.086113","192.168.2.3","216.58.197.4","TLSv1.2","212","Application Data"
