"No.","Time","Source","Destination","Protocol","Length","Info"
"2","2018-08-23 02:56:16.821464","192.168.2.3","192.168.2.1","TCP","183","8009  >  53029 [PSH, ACK] Seq=1 Ack=118 Win=277 Len=117 TSval=8165891 TSecr=2318909523 [TCP segment of a reassembled PDU]"
"4","2018-08-23 02:56:20.148689","192.168.2.3","216.58.197.4","TLSv1.2","156","Application Data"
"5","2018-08-23 02:56:20.148881","192.168.2.3","216.58.197.4","TLSv1.2","104","Application Data"
"6","2018-08-23 02:56:20.150098","192.168.2.3","216.58.197.4","TLSv1.2","158","Application Data"
"11","2018-08-23 02:56:20.190947","192.168.2.3","216.58.197.4","TCP","1434","34325  >  443 [ACK] Seq=221 Ack=39 Win=661 Len=1368 TSval=8166228 TSecr=601010169 [TCP segment of a reassembled PDU]"
"12","2018-08-23 02:56:20.191445","192.168.2.3","216.58.197.4","TCP","1434","34325  >  443 [ACK] Seq=1589 Ack=39 Win=661 Len=1368 TSval=8166228 TSecr=601010169 [TCP segment of a reassembled PDU]"
"13","2018-08-23 02:56:20.191448","192.168.2.3","216.58.197.4","TLSv1.2","212","Application Data"
"14","2018-08-23 02:56:20.191882","192.168.2.3","216.58.197.4","TCP","1434","34325  >  443 [ACK] Seq=3103 Ack=39 Win=661 Len=1368 TSval=8166228 TSecr=601010169 [TCP segment of a reassembled PDU]"
"15","2018-08-23 02:56:20.191884","192.168.2.3","216.58.197.4","TLSv1.2","376","Application Data"
"16","2018-08-23 02:56:20.192210","192.168.2.3","216.58.197.4","TCP","1434","34325  >  443 [ACK] Seq=4781 Ack=39 Win=661 Len=1368 TSval=8166228 TSecr=601010169 [TCP segment of a reassembled PDU]"
"17","2018-08-23 02:56:20.192601","192.168.2.3","216.58.197.4","TCP","1434","34325  >  443 [ACK] Seq=6149 Ack=39 Win=661 Len=1368 TSval=8166228 TSecr=601010169 [TCP segment of a reassembled PDU]"
"18","2018-08-23 02:56:20.192603","192.168.2.3","216.58.197.4","TLSv1.2","212","Application Data"
"19","2018-08-23 02:56:20.192964","192.168.2.3","216.58.197.4","TCP","1434","34325  >  443 [ACK] Seq=7663 Ack=39 Win=661 Len=1368 TSval=8166228 TSecr=601010169 [TCP segment of a reassembled PDU]"
"20","2018-08-23 02:56:20.192966","192.168.2.3","216.58.197.4","TCP","1434","34325  >  443 [ACK] Seq=9031 Ack=39 Win=661 Len=1368 TSval=8166228 TSecr=601010169 [TCP segment of a reassembled PDU]"
"26","2018-08-23 02:56:20.198363","192.168.2.3","216.58.197.4","TLSv1.2","1434","Application Data [TCP segment of a reassembled PDU]"
"27","2018-08-23 02:56:20.198708","192.168.2.3","216.58.197.4","TCP","1434","34325  >  443 [ACK] Seq=11767 Ack=39 Win=661 Len=1368 TSval=8166229 TSecr=601010209 [TCP segment of a reassembled PDU]"
"28","2018-08-23 02:56:20.198710","192.168.2.3","216.58.197.4","TLSv1.2","1434","Application Data [TCP segment of a reassembled PDU]"
"29","2018-08-23 02:56:20.198949","192.168.2.3","216.58.197.4","TCP","1434","34325  >  443 [ACK] Seq=14503 Ack=39 Win=661 Len=1368 TSval=8166229 TSecr=601010210 [TCP segment of a reassembled PDU]"
"30","2018-08-23 02:56:20.199436","192.168.2.3","216.58.197.4","TLSv1.2","1434","Application Data [TCP segment of a reassembled PDU]"
"31","2018-08-23 02:56:20.199438","192.168.2.3","216.58.197.4","TCP","1434","34325  >  443 [ACK] Seq=17239 Ack=39 Win=661 Len=1368 TSval=8166229 TSecr=601010210 [TCP segment of a reassembled PDU]"
"32","2018-08-23 02:56:20.199902","192.168.2.3","216.58.197.4","TLSv1.2","1434","Application Data [TCP segment of a reassembled PDU]"
"33","2018-08-23 02:56:20.199904","192.168.2.3","216.58.197.4","TCP","1434","34325  >  443 [ACK] Seq=19975 Ack=39 Win=661 Len=1368 TSval=8166229 TSecr=601010210 [TCP segment of a reassembled PDU]"
"34","2018-08-23 02:56:20.199905","192.168.2.3","216.58.197.4","TLSv1.2","1434","Application Data, Application Data"
"35","2018-08-23 02:56:20.200005","192.168.2.3","216.58.197.4","TCP","1434","34325  >  443 [ACK] Seq=22711 Ack=39 Win=661 Len=1368 TSval=8166229 TSecr=601010210 [TCP segment of a reassembled PDU]"
"36","2018-08-23 02:56:20.200389","192.168.2.3","216.58.197.4","TLSv1.2","1434","Application Data [TCP segment of a reassembled PDU]"
"37","2018-08-23 02:56:20.200391","192.168.2.3","216.58.197.4","TLSv1.2","1070","Application Data"
"38","2018-08-23 02:56:20.200949","192.168.2.3","216.58.197.4","TCP","1434","34325  >  443 [ACK] Seq=26451 Ack=39 Win=661 Len=1368 TSval=8166229 TSecr=601010211 [TCP segment of a reassembled PDU]"
"39","2018-08-23 02:56:20.200952","192.168.2.3","216.58.197.4","TCP","1434","34325  >  443 [ACK] Seq=27819 Ack=39 Win=661 Len=1368 TSval=8166229 TSecr=601010211 [TCP segment of a reassembled PDU]"
"40","2018-08-23 02:56:20.201058","192.168.2.3","216.58.197.4","TLSv1.2","212","Application Data"
"47","2018-08-23 02:56:20.204945","192.168.2.3","216.58.197.4","TCP","1434","34325  >  443 [ACK] Seq=29333 Ack=39 Win=661 Len=1368 TSval=8166229 TSecr=601010216 [TCP segment of a reassembled PDU]"
"49","2018-08-23 02:56:20.205577","192.168.2.3","216.58.197.4","TCP","1434","34325  >  443 [ACK] Seq=30701 Ack=39 Win=661 Len=1368 TSval=8166229 TSecr=601010216 [TCP segment of a reassembled PDU]"
"50","2018-08-23 02:56:20.205580","192.168.2.3","216.58.197.4","TLSv1.2","1434","Application Data [TCP segment of a reassembled PDU]"
"51","2018-08-23 02:56:20.205876","192.168.2.3","216.58.197.4","TCP","1434","34325  >  443 [ACK] Seq=33437 Ack=39 Win=661 Len=1368 TSval=8166229 TSecr=601010217 [TCP segment of a reassembled PDU]"
"52","2018-08-23 02:56:20.206106","192.168.2.3","216.58.197.4","TLSv1.2","1434","Application Data [TCP segment of a reassembled PDU]"
"53","2018-08-23 02:56:20.207959","192.168.2.3","216.58.197.4","TCP","1434","34325  >  443 [ACK] Seq=36173 Ack=39 Win=661 Len=1368 TSval=8166229 TSecr=601010217 [TCP segment of a reassembled PDU]"
"54","2018-08-23 02:56:20.207962","192.168.2.3","216.58.197.4","TLSv1.2","1434","Application Data [TCP segment of a reassembled PDU]"
"55","2018-08-23 02:56:20.208236","192.168.2.3","216.58.197.4","TCP","1434","34325  >  443 [ACK] Seq=38909 Ack=39 Win=661 Len=1368 TSval=8166230 TSecr=601010217 [TCP segment of a reassembled PDU]"
"56","2018-08-23 02:56:20.208472","192.168.2.3","216.58.197.4","TLSv1.2","1434","Application Data [TCP segment of a reassembled PDU]"
"57","2018-08-23 02:56:20.208637","192.168.2.3","216.58.197.4","TCP","1434","34325  >  443 [ACK] Seq=41645 Ack=39 Win=661 Len=1368 TSval=8166230 TSecr=601010218 [TCP segment of a reassembled PDU]"
"58","2018-08-23 02:56:20.208878","192.168.2.3","216.58.197.4","TLSv1.2","1434","Application Data [TCP segment of a reassembled PDU]"
"59","2018-08-23 02:56:20.208881","192.168.2.3","216.58.197.4","TCP","1434","34325  >  443 [ACK] Seq=44381 Ack=39 Win=661 Len=1368 TSval=8166230 TSecr=601010218 [TCP segment of a reassembled PDU]"
"61","2018-08-23 02:56:20.209227","192.168.2.3","216.58.197.4","TLSv1.2","1434","Application Data [TCP segment of a reassembled PDU]"
"62","2018-08-23 02:56:20.209466","192.168.2.3","216.58.197.4","TCP","1434","34325  >  443 [ACK] Seq=47117 Ack=39 Win=661 Len=1368 TSval=8166230 TSecr=601010218 [TCP segment of a reassembled PDU]"
"63","2018-08-23 02:56:20.209469","192.168.2.3","216.58.197.4","TLSv1.2","1434","Application Data [TCP segment of a reassembled PDU]"
"64","2018-08-23 02:56:20.209890","192.168.2.3","216.58.197.4","TCP","1434","34325  >  443 [ACK] Seq=49853 Ack=39 Win=661 Len=1368 TSval=8166230 TSecr=601010218 [TCP segment of a reassembled PDU]"
"71","2018-08-23 02:56:20.213537","192.168.2.3","216.58.197.4","TLSv1.2","1434","Application Data [TCP segment of a reassembled PDU]"
"72","2018-08-23 02:56:20.213540","192.168.2.3","216.58.197.4","TCP","1434","34325  >  443 [ACK] Seq=52589 Ack=39 Win=661 Len=1368 TSval=8166230 TSecr=601010219 [TCP segment of a reassembled PDU]"
"74","2018-08-23 02:56:20.213909","192.168.2.3","216.58.197.4","TLSv1.2","1434","Application Data [TCP segment of a reassembled PDU]"
"75","2018-08-23 02:56:20.216116","192.168.2.3","216.58.197.4","TCP","1434","34325  >  443 [ACK] Seq=55325 Ack=39 Win=661 Len=1368 TSval=8166231 TSecr=601010223 [TCP segment of a reassembled PDU]"
"76","2018-08-23 02:56:20.216499","192.168.2.3","216.58.197.4","TLSv1.2","1434","Application Data [TCP segment of a reassembled PDU]"
"77","2018-08-23 02:56:20.216847","192.168.2.3","216.58.197.4","TCP","1434","34325  >  443 [ACK] Seq=58061 Ack=39 Win=661 Len=1368 TSval=8166231 TSecr=601010223 [TCP segment of a reassembled PDU]"
"78","2018-08-23 02:56:20.216850","192.168.2.3","216.58.197.4","TLSv1.2","1434","Application Data [TCP segment of a reassembled PDU]"
"79","2018-08-23 02:56:20.217222","192.168.2.3","216.58.197.4","TCP","1434","34325  >  443 [ACK] Seq=60797 Ack=39 Win=661 Len=1368 TSval=8166231 TSecr=601010223 [TCP segment of a reassembled PDU]"
"80","2018-08-23 02:56:20.217534","192.168.2.3","216.58.197.4","TLSv1.2","1434","Application Data [TCP segment of a reassembled PDU]"
"81","2018-08-23 02:56:20.217740","192.168.2.3","216.58.197.4","TCP","1434","34325  >  443 [ACK] Seq=63533 Ack=39 Win=661 Len=1368 TSval=8166231 TSecr=601010224 [TCP segment of a reassembled PDU]"
"83","2018-08-23 02:56:20.217991","192.168.2.3","216.58.197.4","TLSv1.2","1434","Application Data [TCP segment of a reassembled PDU]"
"85","2018-08-23 02:56:20.218244","192.168.2.3","216.58.197.4","TCP","1434","34325  >  443 [ACK] Seq=66269 Ack=39 Win=661 Len=1368 TSval=8166231 TSecr=601010226 [TCP segment of a reassembled PDU]"
"86","2018-08-23 02:56:20.218246","192.168.2.3","216.58.197.4","TLSv1.2","1434","Application Data [TCP segment of a reassembled PDU]"
"87","2018-08-23 02:56:20.218502","192.168.2.3","216.58.197.4","TLSv1.2","647","Application Data"
"93","2018-08-23 02:56:20.243017","192.168.2.3","216.58.197.4","TCP","1434","34325  >  443 [ACK] Seq=69586 Ack=39 Win=661 Len=1368 TSval=8166233 TSecr=601010236 [TCP segment of a reassembled PDU]"
"94","2018-08-23 02:56:20.243020","192.168.2.3","216.58.197.4","TCP","1434","34325  >  443 [ACK] Seq=70954 Ack=39 Win=661 Len=1368 TSval=8166233 TSecr=601010236 [TCP segment of a reassembled PDU]"
"95","2018-08-23 02:56:20.243021","192.168.2.3","216.58.197.4","TLSv1.2","212","Application Data"
"96","2018-08-23 02:56:20.243195","192.168.2.3","216.58.197.4","TCP","1434","34325  >  443 [ACK] Seq=72468 Ack=39 Win=661 Len=1368 TSval=8166233 TSecr=601010236 [TCP segment of a reassembled PDU]"
"97","2018-08-23 02:56:20.243504","192.168.2.3","216.58.197.4","TLSv1.2","155","Application Data"
"101","2018-08-23 02:56:20.337131","192.168.2.3","216.58.197.4","TCP","1434","34325  >  443 [ACK] Seq=73925 Ack=39 Win=661 Len=1368 TSval=8166243 TSecr=601010261 [TCP segment of a reassembled PDU]"
"102","2018-08-23 02:56:20.345249","192.168.2.3","216.58.197.4","TCP","1434","34325  >  443 [ACK] Seq=75293 Ack=39 Win=661 Len=1368 TSval=8166243 TSecr=601010261 [TCP segment of a reassembled PDU]"
"103","2018-08-23 02:56:20.345251","192.168.2.3","216.58.197.4","TLSv1.2","212","Application Data"
"104","2018-08-23 02:56:20.345252","192.168.2.3","216.58.197.4","TCP","1434","34325  >  443 [ACK] Seq=76807 Ack=39 Win=661 Len=1368 TSval=8166243 TSecr=601010261 [TCP segment of a reassembled PDU]"
"105","2018-08-23 02:56:20.345254","192.168.2.3","216.58.197.4","TLSv1.2","155","Application Data"
"108","2018-08-23 02:56:20.432833","192.168.2.3","216.58.197.4","TCP","1434","34325  >  443 [ACK] Seq=78264 Ack=39 Win=661 Len=1368 TSval=8166252 TSecr=601010363 [TCP segment of a reassembled PDU]"
"109","2018-08-23 02:56:20.433148","192.168.2.3","216.58.197.4","TCP","1434","34325  >  443 [ACK] Seq=79632 Ack=39 Win=661 Len=1368 TSval=8166252 TSecr=601010363 [TCP segment of a reassembled PDU]"
"110","2018-08-23 02:56:20.433150","192.168.2.3","216.58.197.4","TLSv1.2","212","Application Data"
"111","2018-08-23 02:56:20.433669","192.168.2.3","216.58.197.4","TCP","1434","34325  >  443 [ACK] Seq=81146 Ack=39 Win=661 Len=1368 TSval=8166252 TSecr=601010363 [TCP segment of a reassembled PDU]"
"112","2018-08-23 02:56:20.433672","192.168.2.3","216.58.197.4","TLSv1.2","155","Application Data"
"119","2018-08-23 02:56:20.491070","192.168.2.3","216.58.197.4","TCP","66","34325  >  443 [ACK] Seq=82603 Ack=409 Win=661 Len=0 TSval=8166258 TSecr=601010502"
"121","2018-08-23 02:56:20.506954","192.168.2.3","216.58.197.4","TCP","66","34325  >  443 [ACK] Seq=82603 Ack=912 Win=661 Len=0 TSval=8166260 TSecr=601010502"
"122","2018-08-23 02:56:20.532788","192.168.2.3","216.58.197.4","TCP","1434","34325  >  443 [ACK] Seq=82603 Ack=912 Win=661 Len=1368 TSval=8166262 TSecr=601010502 [TCP segment of a reassembled PDU]"
"123","2018-08-23 02:56:20.533151","192.168.2.3","216.58.197.4","TCP","1434","34325  >  443 [ACK] Seq=83971 Ack=912 Win=661 Len=1368 TSval=8166262 TSecr=601010502 [TCP segment of a reassembled PDU]"
"124","2018-08-23 02:56:20.533153","192.168.2.3","216.58.197.4","TLSv1.2","212","Application Data"
"125","2018-08-23 02:56:20.533566","192.168.2.3","216.58.197.4","TCP","1434","34325  >  443 [ACK] Seq=85485 Ack=912 Win=661 Len=1368 TSval=8166262 TSecr=601010502 [TCP segment of a reassembled PDU]"
"126","2018-08-23 02:56:20.533568","192.168.2.3","216.58.197.4","TLSv1.2","155","Application Data"
"131","2018-08-23 02:56:20.625993","192.168.2.3","216.58.197.4","TCP","1434","34325  >  443 [ACK] Seq=86942 Ack=1108 Win=661 Len=1368 TSval=8166272 TSecr=601010615 [TCP segment of a reassembled PDU]"
"132","2018-08-23 02:56:20.626320","192.168.2.3","216.58.197.4","TCP","1434","34325  >  443 [ACK] Seq=88310 Ack=1108 Win=661 Len=1368 TSval=8166272 TSecr=601010615 [TCP segment of a reassembled PDU]"
"133","2018-08-23 02:56:20.626323","192.168.2.3","216.58.197.4","TLSv1.2","212","Application Data"
"134","2018-08-23 02:56:20.626627","192.168.2.3","216.58.197.4","TCP","1434","34325  >  443 [ACK] Seq=89824 Ack=1108 Win=661 Len=1368 TSval=8166272 TSecr=601010615 [TCP segment of a reassembled PDU]"
"135","2018-08-23 02:56:20.626630","192.168.2.3","216.58.197.4","TLSv1.2","155","Application Data"
"139","2018-08-23 02:56:20.721999","192.168.2.3","216.58.197.4","TCP","1434","34325  >  443 [ACK] Seq=91281 Ack=1108 Win=661 Len=1368 TSval=8166281 TSecr=601010644 [TCP segment of a reassembled PDU]"
"140","2018-08-23 02:56:20.722418","192.168.2.3","216.58.197.4","TCP","1434","34325  >  443 [ACK] Seq=92649 Ack=1108 Win=661 Len=1368 TSval=8166281 TSecr=601010644 [TCP segment of a reassembled PDU]"
"141","2018-08-23 02:56:20.722420","192.168.2.3","216.58.197.4","TLSv1.2","212","Application Data"
"142","2018-08-23 02:56:20.722777","192.168.2.3","216.58.197.4","TCP","1434","34325  >  443 [ACK] Seq=94163 Ack=1108 Win=661 Len=1368 TSval=8166281 TSecr=601010644 [TCP segment of a reassembled PDU]"
"143","2018-08-23 02:56:20.722779","192.168.2.3","216.58.197.4","TLSv1.2","155","Application Data"
"148","2018-08-23 02:56:20.794956","192.168.2.3","216.58.197.4","TCP","66","34325  >  443 [ACK] Seq=95620 Ack=1362 Win=661 Len=0 TSval=8166289 TSecr=601010773"
"149","2018-08-23 02:56:20.858650","192.168.2.3","216.58.197.4","TCP","1434","34325  >  443 [ACK] Seq=95620 Ack=1362 Win=661 Len=1368 TSval=8166294 TSecr=601010773 [TCP segment of a reassembled PDU]"
"150","2018-08-23 02:56:20.858655","192.168.2.3","216.58.197.4","TCP","1434","34325  >  443 [ACK] Seq=96988 Ack=1362 Win=661 Len=1368 TSval=8166294 TSecr=601010773 [TCP segment of a reassembled PDU]"
"151","2018-08-23 02:56:20.858657","192.168.2.3","216.58.197.4","TLSv1.2","212","Application Data"
"152","2018-08-23 02:56:20.859035","192.168.2.3","216.58.197.4","TCP","1434","34325  >  443 [ACK] Seq=98502 Ack=1362 Win=661 Len=1368 TSval=8166294 TSecr=601010773 [TCP segment of a reassembled PDU]"
"153","2018-08-23 02:56:20.859036","192.168.2.3","216.58.197.4","TLSv1.2","155","Application Data"
"156","2018-08-23 02:56:20.946103","192.168.2.3","216.58.197.4","TCP","1434","34325  >  443 [ACK] Seq=99959 Ack=1362 Win=661 Len=1368 TSval=8166303 TSecr=601010877 [TCP segment of a reassembled PDU]"
"157","2018-08-23 02:56:20.946108","192.168.2.3","216.58.197.4","TCP","1434","34325  >  443 [ACK] Seq=101327 Ack=1362 Win=661 Len=1368 TSval=8166303 TSecr=601010877 [TCP segment of a reassembled PDU]"
"158","2018-08-23 02:56:20.946109","192.168.2.3","216.58.197.4","TLSv1.2","212","Application Data"
"159","2018-08-23 02:56:20.946150","192.168.2.3","216.58.197.4","TCP","1434","34325  >  443 [ACK] Seq=102841 Ack=1362 Win=661 Len=1368 TSval=8166303 TSecr=601010877 [TCP segment of a reassembled PDU]"
"160","2018-08-23 02:56:20.946500","192.168.2.3","216.58.197.4","TLSv1.2","155","Application Data"
"164","2018-08-23 02:56:21.017726","192.168.2.3","216.58.197.4","TCP","1434","34325  >  443 [ACK] Seq=104298 Ack=1362 Win=661 Len=1368 TSval=8166310 TSecr=601011004 [TCP segment of a reassembled PDU]"
"165","2018-08-23 02:56:21.017730","192.168.2.3","216.58.197.4","TCP","1434","34325  >  443 [ACK] Seq=105666 Ack=1362 Win=661 Len=1368 TSval=8166310 TSecr=601011004 [TCP segment of a reassembled PDU]"
"166","2018-08-23 02:56:21.017731","192.168.2.3","216.58.197.4","TLSv1.2","212","Application Data"
"167","2018-08-23 02:56:21.017819","192.168.2.3","216.58.197.4","TCP","1434","34325  >  443 [ACK] Seq=107180 Ack=1362 Win=661 Len=1368 TSval=8166310 TSecr=601011004 [TCP segment of a reassembled PDU]"
"168","2018-08-23 02:56:21.018173","192.168.2.3","216.58.197.4","TLSv1.2","155","Application Data"
"171","2018-08-23 02:56:21.102948","192.168.2.3","216.58.197.4","TCP","1434","34325  >  443 [ACK] Seq=108637 Ack=1362 Win=661 Len=1368 TSval=8166319 TSecr=601011036 [TCP segment of a reassembled PDU]"
"172","2018-08-23 02:56:21.103217","192.168.2.3","216.58.197.4","TCP","1434","34325  >  443 [ACK] Seq=110005 Ack=1362 Win=661 Len=1368 TSval=8166319 TSecr=601011036 [TCP segment of a reassembled PDU]"
"173","2018-08-23 02:56:21.103219","192.168.2.3","216.58.197.4","TLSv1.2","212","Application Data"
"174","2018-08-23 02:56:21.103586","192.168.2.3","216.58.197.4","TCP","1434","34325  >  443 [ACK] Seq=111519 Ack=1362 Win=661 Len=1368 TSval=8166319 TSecr=601011036 [TCP segment of a reassembled PDU]"
"175","2018-08-23 02:56:21.103587","192.168.2.3","216.58.197.4","TLSv1.2","155","Application Data"
"179","2018-08-23 02:56:21.200821","192.168.2.3","216.58.197.4","TCP","1434","34325  >  443 [ACK] Seq=112976 Ack=1362 Win=661 Len=1368 TSval=8166329 TSecr=601011121 [TCP segment of a reassembled PDU]"
"180","2018-08-23 02:56:21.200826","192.168.2.3","216.58.197.4","TCP","1434","34325  >  443 [ACK] Seq=114344 Ack=1362 Win=661 Len=1368 TSval=8166329 TSecr=601011121 [TCP segment of a reassembled PDU]"
"181","2018-08-23 02:56:21.200924","192.168.2.3","216.58.197.4","TLSv1.2","212","Application Data"
"182","2018-08-23 02:56:21.201493","192.168.2.3","216.58.197.4","TCP","1434","34325  >  443 [ACK] Seq=115858 Ack=1362 Win=661 Len=1368 TSval=8166329 TSecr=601011121 [TCP segment of a reassembled PDU]"
"183","2018-08-23 02:56:21.201496","192.168.2.3","216.58.197.4","TLSv1.2","155","Application Data"
"187","2018-08-23 02:56:21.297287","192.168.2.3","216.58.197.4","TCP","1434","34325  >  443 [ACK] Seq=117315 Ack=1362 Win=661 Len=1368 TSval=8166339 TSecr=601011219 [TCP segment of a reassembled PDU]"
"188","2018-08-23 02:56:21.297550","192.168.2.3","216.58.197.4","TCP","1434","34325  >  443 [ACK] Seq=118683 Ack=1362 Win=661 Len=1368 TSval=8166339 TSecr=601011219 [TCP segment of a reassembled PDU]"
"189","2018-08-23 02:56:21.297567","192.168.2.3","216.58.197.4","TLSv1.2","212","Application Data"
"190","2018-08-23 02:56:21.297809","192.168.2.3","216.58.197.4","TCP","1434","34325  >  443 [ACK] Seq=120197 Ack=1362 Win=661 Len=1368 TSval=8166339 TSecr=601011219 [TCP segment of a reassembled PDU]"
"191","2018-08-23 02:56:21.297812","192.168.2.3","216.58.197.4","TLSv1.2","155","Application Data"
"197","2018-08-23 02:56:21.360919","192.168.2.3","216.58.197.4","TCP","66","34325  >  443 [ACK] Seq=121654 Ack=1516 Win=661 Len=0 TSval=8166345 TSecr=601011371"
"198","2018-08-23 02:56:21.360922","192.168.2.3","216.58.197.4","TCP","66","34325  >  443 [ACK] Seq=121654 Ack=1641 Win=661 Len=0 TSval=8166345 TSecr=601011371"
"199","2018-08-23 02:56:21.375008","192.168.2.3","216.58.197.4","TCP","1434","34325  >  443 [ACK] Seq=121654 Ack=1641 Win=661 Len=1368 TSval=8166346 TSecr=601011371 [TCP segment of a reassembled PDU]"
"200","2018-08-23 02:56:21.375295","192.168.2.3","216.58.197.4","TCP","1434","34325  >  443 [ACK] Seq=123022 Ack=1641 Win=661 Len=1368 TSval=8166346 TSecr=601011371 [TCP segment of a reassembled PDU]"
"201","2018-08-23 02:56:21.375298","192.168.2.3","216.58.197.4","TLSv1.2","212","Application Data"
"202","2018-08-23 02:56:21.375678","192.168.2.3","216.58.197.4","TCP","1434","34325  >  443 [ACK] Seq=124536 Ack=1641 Win=661 Len=1368 TSval=8166346 TSecr=601011371 [TCP segment of a reassembled PDU]"
"203","2018-08-23 02:56:21.375681","192.168.2.3","216.58.197.4","TLSv1.2","155","Application Data"
"207","2018-08-23 02:56:21.460335","192.168.2.3","216.58.197.4","TCP","1434","34325  >  443 [ACK] Seq=125993 Ack=1641 Win=661 Len=1368 TSval=8166355 TSecr=601011393 [TCP segment of a reassembled PDU]"
"208","2018-08-23 02:56:21.460814","192.168.2.3","216.58.197.4","TCP","1434","34325  >  443 [ACK] Seq=127361 Ack=1641 Win=661 Len=1368 TSval=8166355 TSecr=601011393 [TCP segment of a reassembled PDU]"
"209","2018-08-23 02:56:21.460817","192.168.2.3","216.58.197.4","TLSv1.2","212","Application Data"
"210","2018-08-23 02:56:21.461223","192.168.2.3","216.58.197.4","TCP","1434","34325  >  443 [ACK] Seq=128875 Ack=1641 Win=661 Len=1368 TSval=8166355 TSecr=601011393 [TCP segment of a reassembled PDU]"
"211","2018-08-23 02:56:21.461226","192.168.2.3","216.58.197.4","TLSv1.2","155","Application Data"
"217","2018-08-23 02:56:21.501584","192.168.2.3","216.58.197.4","TCP","66","34325  >  443 [ACK] Seq=130332 Ack=2132 Win=661 Len=0 TSval=8166359 TSecr=601011502"
"220","2018-08-23 02:56:21.519753","192.168.2.3","216.58.197.4","TCP","66","34325  >  443 [ACK] Seq=130332 Ack=2509 Win=661 Len=0 TSval=8166361 TSecr=601011531"
"221","2018-08-23 02:56:21.552592","192.168.2.3","216.58.197.4","TCP","1434","34325  >  443 [ACK] Seq=130332 Ack=2509 Win=661 Len=1368 TSval=8166364 TSecr=601011531 [TCP segment of a reassembled PDU]"
"222","2018-08-23 02:56:21.552988","192.168.2.3","216.58.197.4","TCP","1434","34325  >  443 [ACK] Seq=131700 Ack=2509 Win=661 Len=1368 TSval=8166364 TSecr=601011531 [TCP segment of a reassembled PDU]"
"223","2018-08-23 02:56:21.552990","192.168.2.3","216.58.197.4","TLSv1.2","212","Application Data"
"224","2018-08-23 02:56:21.554995","192.168.2.3","216.58.197.4","TCP","1434","34325  >  443 [ACK] Seq=133214 Ack=2509 Win=661 Len=1368 TSval=8166364 TSecr=601011531 [TCP segment of a reassembled PDU]"
"225","2018-08-23 02:56:21.554998","192.168.2.3","216.58.197.4","TLSv1.2","155","Application Data"
"228","2018-08-23 02:56:21.647489","192.168.2.3","216.58.197.4","TCP","1434","34325  >  443 [ACK] Seq=134671 Ack=2509 Win=661 Len=1368 TSval=8166374 TSecr=601011573 [TCP segment of a reassembled PDU]"
"229","2018-08-23 02:56:21.647782","192.168.2.3","216.58.197.4","TCP","1434","34325  >  443 [ACK] Seq=136039 Ack=2509 Win=661 Len=1368 TSval=8166374 TSecr=601011573 [TCP segment of a reassembled PDU]"
"230","2018-08-23 02:56:21.647784","192.168.2.3","216.58.197.4","TLSv1.2","212","Application Data"
"231","2018-08-23 02:56:21.648006","192.168.2.3","216.58.197.4","TCP","1434","34325  >  443 [ACK] Seq=137553 Ack=2509 Win=661 Len=1368 TSval=8166374 TSecr=601011573 [TCP segment of a reassembled PDU]"
"232","2018-08-23 02:56:21.648009","192.168.2.3","216.58.197.4","TLSv1.2","155","Application Data"
"238","2018-08-23 02:56:21.706741","192.168.2.3","216.58.197.4","TCP","66","34325  >  443 [ACK] Seq=139010 Ack=2732 Win=661 Len=0 TSval=8166380 TSecr=601011719"
"239","2018-08-23 02:56:21.744798","192.168.2.3","216.58.197.4","TCP","1434","34325  >  443 [ACK] Seq=139010 Ack=2732 Win=661 Len=1368 TSval=8166383 TSecr=601011719 [TCP segment of a reassembled PDU]"
"240","2018-08-23 02:56:21.745210","192.168.2.3","216.58.197.4","TCP","1434","34325  >  443 [ACK] Seq=140378 Ack=2732 Win=661 Len=1368 TSval=8166383 TSecr=601011719 [TCP segment of a reassembled PDU]"
"241","2018-08-23 02:56:21.745213","192.168.2.3","216.58.197.4","TLSv1.2","212","Application Data"
"242","2018-08-23 02:56:21.745213","192.168.2.3","216.58.197.4","TCP","1434","34325  >  443 [ACK] Seq=141892 Ack=2732 Win=661 Len=1368 TSval=8166383 TSecr=601011719 [TCP segment of a reassembled PDU]"
"243","2018-08-23 02:56:21.745336","192.168.2.3","216.58.197.4","TLSv1.2","155","Application Data"
"248","2018-08-23 02:56:21.804945","192.168.2.3","216.58.197.4","TCP","66","34325  >  443 [ACK] Seq=143349 Ack=2948 Win=661 Len=0 TSval=8166389 TSecr=601011815"
"249","2018-08-23 02:56:21.810927","192.168.2.3","216.58.197.4","TCP","1434","34325  >  443 [ACK] Seq=143349 Ack=2948 Win=661 Len=1368 TSval=8166390 TSecr=601011815 [TCP segment of a reassembled PDU]"
"250","2018-08-23 02:56:21.811202","192.168.2.3","216.58.197.4","TCP","1434","34325  >  443 [ACK] Seq=144717 Ack=2948 Win=661 Len=1368 TSval=8166390 TSecr=601011815 [TCP segment of a reassembled PDU]"
"251","2018-08-23 02:56:21.811204","192.168.2.3","216.58.197.4","TLSv1.2","212","Application Data"
"252","2018-08-23 02:56:21.814372","192.168.2.3","216.58.197.4","TCP","1434","34325  >  443 [ACK] Seq=146231 Ack=2948 Win=661 Len=1368 TSval=8166390 TSecr=601011815 [TCP segment of a reassembled PDU]"
"253","2018-08-23 02:56:21.814375","192.168.2.3","216.58.197.4","TLSv1.2","155","Application Data"
"258","2018-08-23 02:56:21.823473","192.168.2.3","192.168.2.1","TCP","183","8009  >  53029 [PSH, ACK] Seq=118 Ack=235 Win=277 Len=117 TSval=8166391 TSecr=2318914512 [TCP segment of a reassembled PDU]"
"262","2018-08-23 02:56:21.867354","192.168.2.3","216.58.197.4","TCP","66","34325  >  443 [ACK] Seq=147688 Ack=3137 Win=661 Len=0 TSval=8166396 TSecr=601011879"
"265","2018-08-23 02:56:21.883971","192.168.2.3","216.58.197.4","TCP","66","34325  >  443 [ACK] Seq=147688 Ack=3683 Win=661 Len=0 TSval=8166397 TSecr=601011888"
"266","2018-08-23 02:56:21.907532","192.168.2.3","216.58.197.4","TCP","1434","34325  >  443 [ACK] Seq=147688 Ack=3683 Win=661 Len=1368 TSval=8166400 TSecr=601011888 [TCP segment of a reassembled PDU]"
"267","2018-08-23 02:56:21.907537","192.168.2.3","216.58.197.4","TCP","1434","34325  >  443 [ACK] Seq=149056 Ack=3683 Win=661 Len=1368 TSval=8166400 TSecr=601011888 [TCP segment of a reassembled PDU]"
"268","2018-08-23 02:56:21.907668","192.168.2.3","216.58.197.4","TLSv1.2","212","Application Data"
"269","2018-08-23 02:56:21.907670","192.168.2.3","216.58.197.4","TCP","1434","34325  >  443 [ACK] Seq=150570 Ack=3683 Win=661 Len=1368 TSval=8166400 TSecr=601011888 [TCP segment of a reassembled PDU]"
"270","2018-08-23 02:56:21.907971","192.168.2.3","216.58.197.4","TLSv1.2","155","Application Data"
"274","2018-08-23 02:56:21.999128","192.168.2.3","216.58.197.4","TCP","1434","34325  >  443 [ACK] Seq=152027 Ack=3683 Win=661 Len=1368 TSval=8166409 TSecr=601011925 [TCP segment of a reassembled PDU]"
"275","2018-08-23 02:56:22.002582","192.168.2.3","216.58.197.4","TCP","1434","34325  >  443 [ACK] Seq=153395 Ack=3683 Win=661 Len=1368 TSval=8166409 TSecr=601011925 [TCP segment of a reassembled PDU]"
"276","2018-08-23 02:56:22.002585","192.168.2.3","216.58.197.4","TLSv1.2","212","Application Data"
"277","2018-08-23 02:56:22.002754","192.168.2.3","216.58.197.4","TCP","1434","34325  >  443 [ACK] Seq=154909 Ack=3683 Win=661 Len=1368 TSval=8166409 TSecr=601011925 [TCP segment of a reassembled PDU]"
"278","2018-08-23 02:56:22.002880","192.168.2.3","216.58.197.4","TLSv1.2","155","Application Data"
"284","2018-08-23 02:56:22.053827","192.168.2.3","216.58.197.4","TCP","66","34325  >  443 [ACK] Seq=156366 Ack=3992 Win=661 Len=0 TSval=8166414 TSecr=601012065"
"285","2018-08-23 02:56:22.096785","192.168.2.3","216.58.197.4","TCP","1434","34325  >  443 [ACK] Seq=156366 Ack=3992 Win=661 Len=1368 TSval=8166418 TSecr=601012065 [TCP segment of a reassembled PDU]"
"286","2018-08-23 02:56:22.097037","192.168.2.3","216.58.197.4","TCP","1434","34325  >  443 [ACK] Seq=157734 Ack=3992 Win=661 Len=1368 TSval=8166418 TSecr=601012065 [TCP segment of a reassembled PDU]"
"287","2018-08-23 02:56:22.097039","192.168.2.3","216.58.197.4","TLSv1.2","212","Application Data"
"288","2018-08-23 02:56:22.097352","192.168.2.3","216.58.197.4","TCP","1434","34325  >  443 [ACK] Seq=159248 Ack=3992 Win=661 Len=1368 TSval=8166418 TSecr=601012065 [TCP segment of a reassembled PDU]"
"289","2018-08-23 02:56:22.097368","192.168.2.3","216.58.197.4","TLSv1.2","155","Application Data"
"294","2018-08-23 02:56:22.160860","192.168.2.3","216.58.197.4","TCP","66","34325  >  443 [ACK] Seq=160705 Ack=4567 Win=661 Len=0 TSval=8166425 TSecr=601012170"
"295","2018-08-23 02:56:22.163048","192.168.2.3","216.58.197.4","TCP","1434","34325  >  443 [ACK] Seq=160705 Ack=4567 Win=661 Len=1368 TSval=8166425 TSecr=601012170 [TCP segment of a reassembled PDU]"
"296","2018-08-23 02:56:22.163316","192.168.2.3","216.58.197.4","TCP","1434","34325  >  443 [ACK] Seq=162073 Ack=4567 Win=661 Len=1368 TSval=8166425 TSecr=601012170 [TCP segment of a reassembled PDU]"
"297","2018-08-23 02:56:22.163320","192.168.2.3","216.58.197.4","TLSv1.2","212","Application Data"
"298","2018-08-23 02:56:22.163474","192.168.2.3","216.58.197.4","TCP","1434","34325  >  443 [ACK] Seq=163587 Ack=4567 Win=661 Len=1368 TSval=8166425 TSecr=601012170 [TCP segment of a reassembled PDU]"
"299","2018-08-23 02:56:22.163477","192.168.2.3","216.58.197.4","TLSv1.2","155","Application Data"
"305","2018-08-23 02:56:22.215547","192.168.2.3","216.58.197.4","TCP","66","34325  >  443 [ACK] Seq=165044 Ack=5160 Win=661 Len=0 TSval=8166431 TSecr=601012224"
"306","2018-08-23 02:56:22.256589","192.168.2.3","216.58.197.4","TCP","1434","34325  >  443 [ACK] Seq=165044 Ack=5160 Win=661 Len=1368 TSval=8166435 TSecr=601012224 [TCP segment of a reassembled PDU]"
"307","2018-08-23 02:56:22.256975","192.168.2.3","216.58.197.4","TCP","1434","34325  >  443 [ACK] Seq=166412 Ack=5160 Win=661 Len=1368 TSval=8166435 TSecr=601012224 [TCP segment of a reassembled PDU]"
"308","2018-08-23 02:56:22.256978","192.168.2.3","216.58.197.4","TLSv1.2","212","Application Data"
"309","2018-08-23 02:56:22.257417","192.168.2.3","216.58.197.4","TCP","1434","34325  >  443 [ACK] Seq=167926 Ack=5160 Win=661 Len=1368 TSval=8166435 TSecr=601012224 [TCP segment of a reassembled PDU]"
"310","2018-08-23 02:56:22.257420","192.168.2.3","216.58.197.4","TLSv1.2","155","Application Data"
"314","2018-08-23 02:56:22.352593","192.168.2.3","216.58.197.4","TCP","1434","34325  >  443 [ACK] Seq=169383 Ack=5160 Win=661 Len=1368 TSval=8166444 TSecr=601012275 [TCP segment of a reassembled PDU]"
"315","2018-08-23 02:56:22.353015","192.168.2.3","216.58.197.4","TCP","1434","34325  >  443 [ACK] Seq=170751 Ack=5160 Win=661 Len=1368 TSval=8166444 TSecr=601012275 [TCP segment of a reassembled PDU]"
"316","2018-08-23 02:56:22.353019","192.168.2.3","216.58.197.4","TLSv1.2","212","Application Data"
"317","2018-08-23 02:56:22.353404","192.168.2.3","216.58.197.4","TCP","1434","34325  >  443 [ACK] Seq=172265 Ack=5160 Win=661 Len=1368 TSval=8166444 TSecr=601012275 [TCP segment of a reassembled PDU]"
"318","2018-08-23 02:56:22.353421","192.168.2.3","216.58.197.4","TLSv1.2","155","Application Data"
"324","2018-08-23 02:56:22.415710","192.168.2.3","216.58.197.4","TCP","66","34325  >  443 [ACK] Seq=173722 Ack=5564 Win=661 Len=0 TSval=8166451 TSecr=601012422"
"325","2018-08-23 02:56:22.457110","192.168.2.3","216.58.197.4","TCP","1434","34325  >  443 [ACK] Seq=173722 Ack=5564 Win=661 Len=1368 TSval=8166455 TSecr=601012422 [TCP segment of a reassembled PDU]"
"326","2018-08-23 02:56:22.457376","192.168.2.3","216.58.197.4","TCP","1434","34325  >  443 [ACK] Seq=175090 Ack=5564 Win=661 Len=1368 TSval=8166455 TSecr=601012422 [TCP segment of a reassembled PDU]"
"327","2018-08-23 02:56:22.457380","192.168.2.3","216.58.197.4","TLSv1.2","212","Application Data"
"328","2018-08-23 02:56:22.457381","192.168.2.3","216.58.197.4","TLSv1.2","592","Application Data"
"333","2018-08-23 02:56:22.501747","192.168.2.3","216.58.197.4","TCP","66","34325  >  443 [ACK] Seq=177130 Ack=6038 Win=661 Len=0 TSval=8166459 TSecr=601012503"
"334","2018-08-23 02:56:22.542909","192.168.2.3","216.58.197.4","TCP","1434","34325  >  443 [ACK] Seq=177130 Ack=6038 Win=661 Len=1368 TSval=8166463 TSecr=601012503 [TCP segment of a reassembled PDU]"
"335","2018-08-23 02:56:22.543390","192.168.2.3","216.58.197.4","TCP","1434","34325  >  443 [ACK] Seq=178498 Ack=6038 Win=661 Len=1368 TSval=8166463 TSecr=601012503 [TCP segment of a reassembled PDU]"
"336","2018-08-23 02:56:22.543406","192.168.2.3","216.58.197.4","TLSv1.2","212","Application Data"
"337","2018-08-23 02:56:22.543549","192.168.2.3","216.58.197.4","TCP","1434","34325  >  443 [ACK] Seq=180012 Ack=6038 Win=661 Len=1368 TSval=8166463 TSecr=601012503 [TCP segment of a reassembled PDU]"
"338","2018-08-23 02:56:22.543552","192.168.2.3","216.58.197.4","TLSv1.2","155","Application Data"
"343","2018-08-23 02:56:22.641836","192.168.2.3","216.58.197.4","TCP","1434","34325  >  443 [ACK] Seq=181469 Ack=6099 Win=661 Len=1368 TSval=8166473 TSecr=601012641 [TCP segment of a reassembled PDU]"
"344","2018-08-23 02:56:22.642155","192.168.2.3","216.58.197.4","TCP","1434","34325  >  443 [ACK] Seq=182837 Ack=6099 Win=661 Len=1368 TSval=8166473 TSecr=601012641 [TCP segment of a reassembled PDU]"
"345","2018-08-23 02:56:22.642157","192.168.2.3","216.58.197.4","TLSv1.2","212","Application Data"
"346","2018-08-23 02:56:22.642158","192.168.2.3","216.58.197.4","TCP","1434","34325  >  443 [ACK] Seq=184351 Ack=6099 Win=661 Len=1368 TSval=8166473 TSecr=601012641 [TCP segment of a reassembled PDU]"
"347","2018-08-23 02:56:22.642292","192.168.2.3","216.58.197.4","TLSv1.2","155","Application Data"
"352","2018-08-23 02:56:22.705070","192.168.2.3","216.58.197.4","TCP","66","34325  >  443 [ACK] Seq=185808 Ack=6337 Win=661 Len=0 TSval=8166480 TSecr=601012717"
"353","2018-08-23 02:56:22.768786","192.168.2.3","216.58.197.4","TCP","1434","34325  >  443 [ACK] Seq=185808 Ack=6337 Win=661 Len=1368 TSval=8166486 TSecr=601012717 [TCP segment of a reassembled PDU]"
"354","2018-08-23 02:56:22.769167","192.168.2.3","216.58.197.4","TCP","1434","34325  >  443 [ACK] Seq=187176 Ack=6337 Win=661 Len=1368 TSval=8166486 TSecr=601012717 [TCP segment of a reassembled PDU]"
"355","2018-08-23 02:56:22.769169","192.168.2.3","216.58.197.4","TLSv1.2","212","Application Data"
"356","2018-08-23 02:56:22.769170","192.168.2.3","216.58.197.4","TCP","1434","34325  >  443 [ACK] Seq=188690 Ack=6337 Win=661 Len=1368 TSval=8166486 TSecr=601012717 [TCP segment of a reassembled PDU]"
"357","2018-08-23 02:56:22.769374","192.168.2.3","216.58.197.4","TLSv1.2","155","Application Data"
"361","2018-08-23 02:56:22.864855","192.168.2.3","216.58.197.4","TCP","1434","34325  >  443 [ACK] Seq=190147 Ack=6337 Win=661 Len=1368 TSval=8166495 TSecr=601012787 [TCP segment of a reassembled PDU]"
"362","2018-08-23 02:56:22.865243","192.168.2.3","216.58.197.4","TCP","1434","34325  >  443 [ACK] Seq=191515 Ack=6337 Win=661 Len=1368 TSval=8166495 TSecr=601012787 [TCP segment of a reassembled PDU]"
"363","2018-08-23 02:56:22.865245","192.168.2.3","216.58.197.4","TLSv1.2","212","Application Data"
"364","2018-08-23 02:56:22.865246","192.168.2.3","216.58.197.4","TCP","1434","34325  >  443 [ACK] Seq=193029 Ack=6337 Win=661 Len=1368 TSval=8166495 TSecr=601012787 [TCP segment of a reassembled PDU]"
"365","2018-08-23 02:56:22.865379","192.168.2.3","216.58.197.4","TLSv1.2","155","Application Data"
"368","2018-08-23 02:56:22.962452","192.168.2.3","216.58.197.4","TCP","1434","34325  >  443 [ACK] Seq=194486 Ack=6337 Win=661 Len=1368 TSval=8166505 TSecr=601012883 [TCP segment of a reassembled PDU]"
"369","2018-08-23 02:56:22.962456","192.168.2.3","216.58.197.4","TCP","1434","34325  >  443 [ACK] Seq=195854 Ack=6337 Win=661 Len=1368 TSval=8166505 TSecr=601012883 [TCP segment of a reassembled PDU]"
"370","2018-08-23 02:56:22.962671","192.168.2.3","216.58.197.4","TLSv1.2","212","Application Data"
"371","2018-08-23 02:56:22.962688","192.168.2.3","216.58.197.4","TCP","1434","34325  >  443 [ACK] Seq=197368 Ack=6337 Win=661 Len=1368 TSval=8166505 TSecr=601012883 [TCP segment of a reassembled PDU]"
"372","2018-08-23 02:56:22.962963","192.168.2.3","216.58.197.4","TLSv1.2","155","Application Data"
"378","2018-08-23 02:56:23.013718","192.168.2.3","216.58.197.4","TCP","66","34325  >  443 [ACK] Seq=198825 Ack=6637 Win=661 Len=0 TSval=8166510 TSecr=601013026"
"379","2018-08-23 02:56:23.055685","192.168.2.3","216.58.197.4","TCP","1434","34325  >  443 [ACK] Seq=198825 Ack=6637 Win=661 Len=1368 TSval=8166514 TSecr=601013026 [TCP segment of a reassembled PDU]"
"380","2018-08-23 02:56:23.056121","192.168.2.3","216.58.197.4","TCP","1434","34325  >  443 [ACK] Seq=200193 Ack=6637 Win=661 Len=1368 TSval=8166514 TSecr=601013026 [TCP segment of a reassembled PDU]"
"381","2018-08-23 02:56:23.056124","192.168.2.3","216.58.197.4","TLSv1.2","212","Application Data"
"382","2018-08-23 02:56:23.056124","192.168.2.3","216.58.197.4","TCP","1434","34325  >  443 [ACK] Seq=201707 Ack=6637 Win=661 Len=1368 TSval=8166514 TSecr=601013026 [TCP segment of a reassembled PDU]"
"383","2018-08-23 02:56:23.056362","192.168.2.3","216.58.197.4","TLSv1.2","155","Application Data"
"386","2018-08-23 02:56:23.152607","192.168.2.3","216.58.197.4","TCP","1434","34325  >  443 [ACK] Seq=203164 Ack=6637 Win=661 Len=1368 TSval=8166524 TSecr=601013074 [TCP segment of a reassembled PDU]"
"387","2018-08-23 02:56:23.152975","192.168.2.3","216.58.197.4","TCP","1434","34325  >  443 [ACK] Seq=204532 Ack=6637 Win=661 Len=1368 TSval=8166524 TSecr=601013074 [TCP segment of a reassembled PDU]"
"388","2018-08-23 02:56:23.152979","192.168.2.3","216.58.197.4","TLSv1.2","212","Application Data"
"389","2018-08-23 02:56:23.153348","192.168.2.3","216.58.197.4","TCP","1434","34325  >  443 [ACK] Seq=206046 Ack=6637 Win=661 Len=1368 TSval=8166524 TSecr=601013074 [TCP segment of a reassembled PDU]"
"390","2018-08-23 02:56:23.153351","192.168.2.3","216.58.197.4","TLSv1.2","155","Application Data"
"396","2018-08-23 02:56:23.211764","192.168.2.3","216.58.197.4","TCP","66","34325  >  443 [ACK] Seq=207503 Ack=7004 Win=661 Len=0 TSval=8166530 TSecr=601013214"
"399","2018-08-23 02:56:23.241274","192.168.2.3","216.58.197.4","TCP","66","34325  >  443 [ACK] Seq=207503 Ack=7733 Win=661 Len=0 TSval=8166533 TSecr=601013252"
"400","2018-08-23 02:56:23.251504","192.168.2.3","216.58.197.4","TCP","1434","34325  >  443 [ACK] Seq=207503 Ack=7733 Win=661 Len=1368 TSval=8166534 TSecr=601013252 [TCP segment of a reassembled PDU]"
"401","2018-08-23 02:56:23.251890","192.168.2.3","216.58.197.4","TCP","1434","34325  >  443 [ACK] Seq=208871 Ack=7733 Win=661 Len=1368 TSval=8166534 TSecr=601013252 [TCP segment of a reassembled PDU]"
"402","2018-08-23 02:56:23.251892","192.168.2.3","216.58.197.4","TLSv1.2","212","Application Data"
"403","2018-08-23 02:56:23.251893","192.168.2.3","216.58.197.4","TCP","1434","34325  >  443 [ACK] Seq=210385 Ack=7733 Win=661 Len=1368 TSval=8166534 TSecr=601013252 [TCP segment of a reassembled PDU]"
"404","2018-08-23 02:56:23.251894","192.168.2.3","216.58.197.4","TLSv1.2","155","Application Data"
"405","2018-08-23 02:56:23.253304","192.168.2.3","216.58.197.4","TLSv1.2","1091","Application Data"
"406","2018-08-23 02:56:23.253307","192.168.2.3","216.58.197.4","TLSv1.2","102","Application Data"
"413","2018-08-23 02:56:23.505670","192.168.2.3","216.58.197.4","TCP","66","34325  >  443 [ACK] Seq=212903 Ack=8048 Win=661 Len=0 TSval=8166560 TSecr=601013503"
"423","2018-08-23 02:56:23.862530","192.168.2.3","216.58.197.4","TCP","66","34325  >  443 [ACK] Seq=212903 Ack=9769 Win=650 Len=0 TSval=8166595 TSecr=601013832"
"428","2018-08-23 02:56:23.865037","192.168.2.3","216.58.197.4","TCP","66","34325  >  443 [ACK] Seq=212903 Ack=13572 Win=650 Len=0 TSval=8166595 TSecr=601013875"
"429","2018-08-23 02:56:23.865475","192.168.2.3","216.58.197.4","TCP","66","34325  >  443 [ACK] Seq=212903 Ack=15311 Win=650 Len=0 TSval=8166596 TSecr=601013875"
