"No.","Time","Source","Destination","Protocol","Length","Info"
"2","2018-08-23 03:01:18.889334","192.168.2.3","192.168.2.1","TCP","183","8009  >  53029 [PSH, ACK] Seq=1 Ack=118 Win=277 Len=117 TSval=8196098 TSecr=2319210855 [TCP segment of a reassembled PDU]"
"4","2018-08-23 03:01:22.327731","192.168.2.3","216.58.197.4","TLSv1.2","156","Application Data"
"5","2018-08-23 03:01:22.327735","192.168.2.3","216.58.197.4","TLSv1.2","104","Application Data"
"6","2018-08-23 03:01:22.327736","192.168.2.3","216.58.197.4","TLSv1.2","158","Application Data"
"11","2018-08-23 03:01:22.348960","192.168.2.3","216.58.197.4","TCP","1434","34325  >  443 [ACK] Seq=221 Ack=39 Win=661 Len=1368 TSval=8196444 TSecr=601312346 [TCP segment of a reassembled PDU]"
"12","2018-08-23 03:01:22.349335","192.168.2.3","216.58.197.4","TCP","1434","34325  >  443 [ACK] Seq=1589 Ack=39 Win=661 Len=1368 TSval=8196444 TSecr=601312346 [TCP segment of a reassembled PDU]"
"13","2018-08-23 03:01:22.349337","192.168.2.3","216.58.197.4","TLSv1.2","212","Application Data"
"14","2018-08-23 03:01:22.350167","192.168.2.3","216.58.197.4","TCP","1434","34325  >  443 [ACK] Seq=3103 Ack=39 Win=661 Len=1368 TSval=8196444 TSecr=601312346 [TCP segment of a reassembled PDU]"
"15","2018-08-23 03:01:22.350170","192.168.2.3","216.58.197.4","TLSv1.2","399","Application Data"
"16","2018-08-23 03:01:22.350171","192.168.2.3","216.58.197.4","TCP","1434","34325  >  443 [ACK] Seq=4804 Ack=39 Win=661 Len=1368 TSval=8196444 TSecr=601312346 [TCP segment of a reassembled PDU]"
"17","2018-08-23 03:01:22.350324","192.168.2.3","216.58.197.4","TCP","1434","34325  >  443 [ACK] Seq=6172 Ack=39 Win=661 Len=1368 TSval=8196444 TSecr=601312346 [TCP segment of a reassembled PDU]"
"18","2018-08-23 03:01:22.350327","192.168.2.3","216.58.197.4","TLSv1.2","212","Application Data"
"19","2018-08-23 03:01:22.350755","192.168.2.3","216.58.197.4","TCP","1434","34325  >  443 [ACK] Seq=7686 Ack=39 Win=661 Len=1368 TSval=8196444 TSecr=601312346 [TCP segment of a reassembled PDU]"
"20","2018-08-23 03:01:22.350757","192.168.2.3","216.58.197.4","TLSv1.2","156","Application Data"
"26","2018-08-23 03:01:22.364279","192.168.2.3","216.58.197.4","TCP","1434","34325  >  443 [ACK] Seq=9144 Ack=39 Win=661 Len=1368 TSval=8196444 TSecr=601312367 [TCP segment of a reassembled PDU]"
"27","2018-08-23 03:01:22.364282","192.168.2.3","216.58.197.4","TCP","1434","34325  >  443 [ACK] Seq=10512 Ack=39 Win=661 Len=1368 TSval=8196444 TSecr=601312367 [TCP segment of a reassembled PDU]"
"28","2018-08-23 03:01:22.364508","192.168.2.3","216.58.197.4","TLSv1.2","1434","Application Data [TCP segment of a reassembled PDU]"
"29","2018-08-23 03:01:22.364734","192.168.2.3","216.58.197.4","TLSv1.2","1434","Application Data [TCP segment of a reassembled PDU]"
"30","2018-08-23 03:01:22.365213","192.168.2.3","216.58.197.4","TCP","1434","34325  >  443 [ACK] Seq=14616 Ack=39 Win=661 Len=1368 TSval=8196444 TSecr=601312368 [TCP segment of a reassembled PDU]"
"31","2018-08-23 03:01:22.365217","192.168.2.3","216.58.197.4","TLSv1.2","1434","Application Data [TCP segment of a reassembled PDU]"
"32","2018-08-23 03:01:22.365218","192.168.2.3","216.58.197.4","TLSv1.2","1434","Application Data [TCP segment of a reassembled PDU]"
"33","2018-08-23 03:01:22.365569","192.168.2.3","216.58.197.4","TCP","1434","34325  >  443 [ACK] Seq=18720 Ack=39 Win=661 Len=1368 TSval=8196444 TSecr=601312368 [TCP segment of a reassembled PDU]"
"34","2018-08-23 03:01:22.365571","192.168.2.3","216.58.197.4","TLSv1.2","1434","Application Data [TCP segment of a reassembled PDU]"
"35","2018-08-23 03:01:22.365726","192.168.2.3","216.58.197.4","TLSv1.2","1434","Application Data [TCP segment of a reassembled PDU]"
"36","2018-08-23 03:01:22.365959","192.168.2.3","216.58.197.4","TCP","1434","34325  >  443 [ACK] Seq=22824 Ack=39 Win=661 Len=1368 TSval=8196444 TSecr=601312368 [TCP segment of a reassembled PDU]"
"37","2018-08-23 03:01:22.366081","192.168.2.3","216.58.197.4","TLSv1.2","1434","Application Data [TCP segment of a reassembled PDU]"
"38","2018-08-23 03:01:22.366487","192.168.2.3","216.58.197.4","TLSv1.2","1434","Application Data [TCP segment of a reassembled PDU]"
"39","2018-08-23 03:01:22.366490","192.168.2.3","216.58.197.4","TCP","1434","34325  >  443 [ACK] Seq=26928 Ack=39 Win=661 Len=1368 TSval=8196445 TSecr=601312369 [TCP segment of a reassembled PDU]"
"40","2018-08-23 03:01:22.366671","192.168.2.3","216.58.197.4","TLSv1.2","1434","Application Data [TCP segment of a reassembled PDU]"
"46","2018-08-23 03:01:22.370262","192.168.2.3","216.58.197.4","TLSv1.2","1434","Application Data [TCP segment of a reassembled PDU]"
"48","2018-08-23 03:01:22.370744","192.168.2.3","216.58.197.4","TCP","1434","34325  >  443 [ACK] Seq=31032 Ack=39 Win=661 Len=1368 TSval=8196446 TSecr=601312382 [TCP segment of a reassembled PDU]"
"49","2018-08-23 03:01:22.370747","192.168.2.3","216.58.197.4","TLSv1.2","1434","Application Data [TCP segment of a reassembled PDU]"
"51","2018-08-23 03:01:22.371375","192.168.2.3","216.58.197.4","TCP","1434","34325  >  443 [ACK] Seq=33768 Ack=39 Win=661 Len=1368 TSval=8196446 TSecr=601312383 [TCP segment of a reassembled PDU]"
"52","2018-08-23 03:01:22.371803","192.168.2.3","216.58.197.4","TLSv1.2","1434","Application Data [TCP segment of a reassembled PDU]"
"53","2018-08-23 03:01:22.371805","192.168.2.3","216.58.197.4","TCP","1434","34325  >  443 [ACK] Seq=36504 Ack=39 Win=661 Len=1368 TSval=8196446 TSecr=601312383 [TCP segment of a reassembled PDU]"
"54","2018-08-23 03:01:22.372053","192.168.2.3","216.58.197.4","TLSv1.2","1434","Application Data [TCP segment of a reassembled PDU]"
"55","2018-08-23 03:01:22.372263","192.168.2.3","216.58.197.4","TLSv1.2","1434","Application Data [TCP segment of a reassembled PDU]"
"56","2018-08-23 03:01:22.372515","192.168.2.3","216.58.197.4","TCP","1434","34325  >  443 [ACK] Seq=40608 Ack=39 Win=661 Len=1368 TSval=8196446 TSecr=601312383 [TCP segment of a reassembled PDU]"
"62","2018-08-23 03:01:22.382527","192.168.2.3","216.58.197.4","TLSv1.2","1434","Application Data [TCP segment of a reassembled PDU]"
"63","2018-08-23 03:01:22.382529","192.168.2.3","216.58.197.4","TLSv1.2","1434","Application Data [TCP segment of a reassembled PDU]"
"64","2018-08-23 03:01:22.382746","192.168.2.3","216.58.197.4","TCP","1434","34325  >  443 [ACK] Seq=44712 Ack=39 Win=661 Len=1368 TSval=8196447 TSecr=601312384 [TCP segment of a reassembled PDU]"
"65","2018-08-23 03:01:22.382845","192.168.2.3","216.58.197.4","TLSv1.2","1434","Application Data [TCP segment of a reassembled PDU]"
"66","2018-08-23 03:01:22.383124","192.168.2.3","216.58.197.4","TLSv1.2","1434","Application Data [TCP segment of a reassembled PDU]"
"67","2018-08-23 03:01:22.383219","192.168.2.3","216.58.197.4","TCP","1434","34325  >  443 [ACK] Seq=48816 Ack=39 Win=661 Len=1368 TSval=8196447 TSecr=601312384 [TCP segment of a reassembled PDU]"
"68","2018-08-23 03:01:22.383394","192.168.2.3","216.58.197.4","TLSv1.2","1434","Application Data [TCP segment of a reassembled PDU]"
"69","2018-08-23 03:01:22.383491","192.168.2.3","216.58.197.4","TLSv1.2","1434","Application Data [TCP segment of a reassembled PDU]"
"70","2018-08-23 03:01:22.383833","192.168.2.3","216.58.197.4","TCP","1434","34325  >  443 [ACK] Seq=52920 Ack=39 Win=661 Len=1368 TSval=8196447 TSecr=601312385 [TCP segment of a reassembled PDU]"
"71","2018-08-23 03:01:22.383835","192.168.2.3","216.58.197.4","TLSv1.2","1434","Application Data [TCP segment of a reassembled PDU]"
"72","2018-08-23 03:01:22.384046","192.168.2.3","216.58.197.4","TLSv1.2","1434","Application Data [TCP segment of a reassembled PDU]"
"73","2018-08-23 03:01:22.384293","192.168.2.3","216.58.197.4","TCP","1434","34325  >  443 [ACK] Seq=57024 Ack=39 Win=661 Len=1368 TSval=8196447 TSecr=601312388 [TCP segment of a reassembled PDU]"
"74","2018-08-23 03:01:22.384326","192.168.2.3","216.58.197.4","TCP","1434","34325  >  443 [ACK] Seq=58392 Ack=39 Win=661 Len=1368 TSval=8196447 TSecr=601312388 [TCP segment of a reassembled PDU]"
"75","2018-08-23 03:01:22.384506","192.168.2.3","216.58.197.4","TLSv1.2","1434","Application Data, Application Data"
"76","2018-08-23 03:01:22.384808","192.168.2.3","216.58.197.4","TCP","1434","34325  >  443 [ACK] Seq=61128 Ack=39 Win=661 Len=1368 TSval=8196447 TSecr=601312389 [TCP segment of a reassembled PDU]"
"77","2018-08-23 03:01:22.384810","192.168.2.3","216.58.197.4","TLSv1.2","1434","Application Data [TCP segment of a reassembled PDU]"
"78","2018-08-23 03:01:22.384952","192.168.2.3","216.58.197.4","TLSv1.2","550","Application Data"
"87","2018-08-23 03:01:22.394945","192.168.2.3","216.58.197.4","TCP","1434","34325  >  443 [ACK] Seq=64348 Ack=39 Win=661 Len=1368 TSval=8196448 TSecr=601312403 [TCP segment of a reassembled PDU]"
"88","2018-08-23 03:01:22.395290","192.168.2.3","216.58.197.4","TCP","1434","34325  >  443 [ACK] Seq=65716 Ack=39 Win=661 Len=1368 TSval=8196448 TSecr=601312403 [TCP segment of a reassembled PDU]"
"89","2018-08-23 03:01:22.395292","192.168.2.3","216.58.197.4","TLSv1.2","212","Application Data"
"90","2018-08-23 03:01:22.395293","192.168.2.3","216.58.197.4","TCP","1434","34325  >  443 [ACK] Seq=67230 Ack=39 Win=661 Len=1368 TSval=8196448 TSecr=601312403 [TCP segment of a reassembled PDU]"
"91","2018-08-23 03:01:22.395651","192.168.2.3","216.58.197.4","TLSv1.2","155","Application Data"
"95","2018-08-23 03:01:22.474468","192.168.2.3","216.58.197.4","TCP","1434","34325  >  443 [ACK] Seq=68687 Ack=39 Win=661 Len=1368 TSval=8196456 TSecr=601312454 [TCP segment of a reassembled PDU]"
"96","2018-08-23 03:01:22.474829","192.168.2.3","216.58.197.4","TCP","1434","34325  >  443 [ACK] Seq=70055 Ack=39 Win=661 Len=1368 TSval=8196456 TSecr=601312454 [TCP segment of a reassembled PDU]"
"97","2018-08-23 03:01:22.474831","192.168.2.3","216.58.197.4","TLSv1.2","212","Application Data"
"98","2018-08-23 03:01:22.474832","192.168.2.3","216.58.197.4","TCP","1434","34325  >  443 [ACK] Seq=71569 Ack=39 Win=661 Len=1368 TSval=8196456 TSecr=601312454 [TCP segment of a reassembled PDU]"
"99","2018-08-23 03:01:22.475172","192.168.2.3","216.58.197.4","TLSv1.2","155","Application Data"
"103","2018-08-23 03:01:22.570532","192.168.2.3","216.58.197.4","TCP","1434","34325  >  443 [ACK] Seq=73026 Ack=39 Win=661 Len=1368 TSval=8196466 TSecr=601312493 [TCP segment of a reassembled PDU]"
"104","2018-08-23 03:01:22.570815","192.168.2.3","216.58.197.4","TCP","1434","34325  >  443 [ACK] Seq=74394 Ack=39 Win=661 Len=1368 TSval=8196466 TSecr=601312493 [TCP segment of a reassembled PDU]"
"105","2018-08-23 03:01:22.570817","192.168.2.3","216.58.197.4","TLSv1.2","212","Application Data"
"106","2018-08-23 03:01:22.571333","192.168.2.3","216.58.197.4","TCP","1434","34325  >  443 [ACK] Seq=75908 Ack=39 Win=661 Len=1368 TSval=8196466 TSecr=601312493 [TCP segment of a reassembled PDU]"
"107","2018-08-23 03:01:22.571336","192.168.2.3","216.58.197.4","TLSv1.2","155","Application Data"
"114","2018-08-23 03:01:22.634563","192.168.2.3","216.58.197.4","TCP","66","34325  >  443 [ACK] Seq=77365 Ack=175 Win=661 Len=0 TSval=8196472 TSecr=601312643"
"116","2018-08-23 03:01:22.644129","192.168.2.3","216.58.197.4","TCP","66","34325  >  443 [ACK] Seq=77365 Ack=332 Win=661 Len=0 TSval=8196473 TSecr=601312644"
"117","2018-08-23 03:01:22.667453","192.168.2.3","216.58.197.4","TCP","1434","34325  >  443 [ACK] Seq=77365 Ack=332 Win=661 Len=1368 TSval=8196475 TSecr=601312644 [TCP segment of a reassembled PDU]"
"118","2018-08-23 03:01:22.667693","192.168.2.3","216.58.197.4","TCP","1434","34325  >  443 [ACK] Seq=78733 Ack=332 Win=661 Len=1368 TSval=8196475 TSecr=601312644 [TCP segment of a reassembled PDU]"
"119","2018-08-23 03:01:22.667696","192.168.2.3","216.58.197.4","TLSv1.2","212","Application Data"
"120","2018-08-23 03:01:22.668086","192.168.2.3","216.58.197.4","TCP","1434","34325  >  443 [ACK] Seq=80247 Ack=332 Win=661 Len=1368 TSval=8196475 TSecr=601312644 [TCP segment of a reassembled PDU]"
"121","2018-08-23 03:01:22.668089","192.168.2.3","216.58.197.4","TLSv1.2","155","Application Data"
"125","2018-08-23 03:01:22.763917","192.168.2.3","216.58.197.4","TCP","1434","34325  >  443 [ACK] Seq=81704 Ack=332 Win=661 Len=1368 TSval=8196485 TSecr=601312686 [TCP segment of a reassembled PDU]"
"126","2018-08-23 03:01:22.764275","192.168.2.3","216.58.197.4","TCP","1434","34325  >  443 [ACK] Seq=83072 Ack=332 Win=661 Len=1368 TSval=8196485 TSecr=601312686 [TCP segment of a reassembled PDU]"
"127","2018-08-23 03:01:22.764277","192.168.2.3","216.58.197.4","TLSv1.2","212","Application Data"
"128","2018-08-23 03:01:22.764444","192.168.2.3","216.58.197.4","TCP","1434","34325  >  443 [ACK] Seq=84586 Ack=332 Win=661 Len=1368 TSval=8196485 TSecr=601312686 [TCP segment of a reassembled PDU]"
"129","2018-08-23 03:01:22.764446","192.168.2.3","216.58.197.4","TLSv1.2","155","Application Data"
"134","2018-08-23 03:01:22.818116","192.168.2.3","216.58.197.4","TCP","66","34325  >  443 [ACK] Seq=86043 Ack=402 Win=661 Len=0 TSval=8196491 TSecr=601312795"
"135","2018-08-23 03:01:22.860212","192.168.2.3","216.58.197.4","TCP","1434","34325  >  443 [ACK] Seq=86043 Ack=402 Win=661 Len=1368 TSval=8196495 TSecr=601312795 [TCP segment of a reassembled PDU]"
"136","2018-08-23 03:01:22.860217","192.168.2.3","216.58.197.4","TCP","1434","34325  >  443 [ACK] Seq=87411 Ack=402 Win=661 Len=1368 TSval=8196495 TSecr=601312795 [TCP segment of a reassembled PDU]"
"137","2018-08-23 03:01:22.860218","192.168.2.3","216.58.197.4","TLSv1.2","212","Application Data"
"138","2018-08-23 03:01:22.860354","192.168.2.3","216.58.197.4","TCP","1434","34325  >  443 [ACK] Seq=88925 Ack=402 Win=661 Len=1368 TSval=8196495 TSecr=601312795 [TCP segment of a reassembled PDU]"
"139","2018-08-23 03:01:22.860579","192.168.2.3","216.58.197.4","TLSv1.2","155","Application Data"
"144","2018-08-23 03:01:22.941405","192.168.2.3","216.58.197.4","TCP","66","34325  >  443 [ACK] Seq=90382 Ack=456 Win=661 Len=0 TSval=8196503 TSecr=601312953"
"145","2018-08-23 03:01:22.954383","192.168.2.3","216.58.197.4","TCP","1434","34325  >  443 [ACK] Seq=90382 Ack=456 Win=661 Len=1368 TSval=8196504 TSecr=601312953 [TCP segment of a reassembled PDU]"
"146","2018-08-23 03:01:22.954926","192.168.2.3","216.58.197.4","TCP","1434","34325  >  443 [ACK] Seq=91750 Ack=456 Win=661 Len=1368 TSval=8196504 TSecr=601312953 [TCP segment of a reassembled PDU]"
"147","2018-08-23 03:01:22.954929","192.168.2.3","216.58.197.4","TLSv1.2","212","Application Data"
"148","2018-08-23 03:01:22.955297","192.168.2.3","216.58.197.4","TCP","1434","34325  >  443 [ACK] Seq=93264 Ack=456 Win=661 Len=1368 TSval=8196504 TSecr=601312953 [TCP segment of a reassembled PDU]"
"149","2018-08-23 03:01:22.955299","192.168.2.3","216.58.197.4","TLSv1.2","155","Application Data"
"153","2018-08-23 03:01:23.064916","192.168.2.3","216.58.197.4","TCP","1434","34325  >  443 [ACK] Seq=94721 Ack=456 Win=661 Len=1368 TSval=8196515 TSecr=601312973 [TCP segment of a reassembled PDU]"
"154","2018-08-23 03:01:23.064920","192.168.2.3","216.58.197.4","TCP","1434","34325  >  443 [ACK] Seq=96089 Ack=456 Win=661 Len=1368 TSval=8196515 TSecr=601312973 [TCP segment of a reassembled PDU]"
"155","2018-08-23 03:01:23.065144","192.168.2.3","216.58.197.4","TLSv1.2","212","Application Data"
"156","2018-08-23 03:01:23.065146","192.168.2.3","216.58.197.4","TCP","1434","34325  >  443 [ACK] Seq=97603 Ack=456 Win=661 Len=1368 TSval=8196515 TSecr=601312973 [TCP segment of a reassembled PDU]"
"157","2018-08-23 03:01:23.065325","192.168.2.3","216.58.197.4","TLSv1.2","155","Application Data"
"161","2018-08-23 03:01:23.147585","192.168.2.3","216.58.197.4","TCP","1434","34325  >  443 [ACK] Seq=99060 Ack=456 Win=661 Len=1368 TSval=8196523 TSecr=601313083 [TCP segment of a reassembled PDU]"
"162","2018-08-23 03:01:23.147947","192.168.2.3","216.58.197.4","TCP","1434","34325  >  443 [ACK] Seq=100428 Ack=456 Win=661 Len=1368 TSval=8196523 TSecr=601313083 [TCP segment of a reassembled PDU]"
"163","2018-08-23 03:01:23.147950","192.168.2.3","216.58.197.4","TLSv1.2","212","Application Data"
"164","2018-08-23 03:01:23.147951","192.168.2.3","216.58.197.4","TCP","1434","34325  >  443 [ACK] Seq=101942 Ack=456 Win=661 Len=1368 TSval=8196523 TSecr=601313083 [TCP segment of a reassembled PDU]"
"165","2018-08-23 03:01:23.148038","192.168.2.3","216.58.197.4","TLSv1.2","155","Application Data"
"169","2018-08-23 03:01:23.249458","192.168.2.3","216.58.197.4","TCP","1434","34325  >  443 [ACK] Seq=103399 Ack=456 Win=661 Len=1368 TSval=8196533 TSecr=601313166 [TCP segment of a reassembled PDU]"
"170","2018-08-23 03:01:23.249464","192.168.2.3","216.58.197.4","TCP","1434","34325  >  443 [ACK] Seq=104767 Ack=456 Win=661 Len=1368 TSval=8196533 TSecr=601313166 [TCP segment of a reassembled PDU]"
"171","2018-08-23 03:01:23.249465","192.168.2.3","216.58.197.4","TLSv1.2","212","Application Data"
"172","2018-08-23 03:01:23.249563","192.168.2.3","216.58.197.4","TCP","1434","34325  >  443 [ACK] Seq=106281 Ack=456 Win=661 Len=1368 TSval=8196533 TSecr=601313166 [TCP segment of a reassembled PDU]"
"173","2018-08-23 03:01:23.249693","192.168.2.3","216.58.197.4","TLSv1.2","155","Application Data"
"177","2018-08-23 03:01:23.339759","192.168.2.3","216.58.197.4","TCP","1434","34325  >  443 [ACK] Seq=107738 Ack=456 Win=661 Len=1368 TSval=8196543 TSecr=601313268 [TCP segment of a reassembled PDU]"
"178","2018-08-23 03:01:23.340162","192.168.2.3","216.58.197.4","TCP","1434","34325  >  443 [ACK] Seq=109106 Ack=456 Win=661 Len=1368 TSval=8196543 TSecr=601313268 [TCP segment of a reassembled PDU]"
"179","2018-08-23 03:01:23.340165","192.168.2.3","216.58.197.4","TLSv1.2","212","Application Data"
"180","2018-08-23 03:01:23.340578","192.168.2.3","216.58.197.4","TCP","1434","34325  >  443 [ACK] Seq=110620 Ack=456 Win=661 Len=1368 TSval=8196543 TSecr=601313268 [TCP segment of a reassembled PDU]"
"181","2018-08-23 03:01:23.340581","192.168.2.3","216.58.197.4","TLSv1.2","155","Application Data"
"185","2018-08-23 03:01:23.433934","192.168.2.3","216.58.197.4","TCP","1434","34325  >  443 [ACK] Seq=112077 Ack=456 Win=661 Len=1368 TSval=8196552 TSecr=601313359 [TCP segment of a reassembled PDU]"
"186","2018-08-23 03:01:23.434291","192.168.2.3","216.58.197.4","TCP","1434","34325  >  443 [ACK] Seq=113445 Ack=456 Win=661 Len=1368 TSval=8196552 TSecr=601313359 [TCP segment of a reassembled PDU]"
"187","2018-08-23 03:01:23.434294","192.168.2.3","216.58.197.4","TLSv1.2","212","Application Data"
"188","2018-08-23 03:01:23.434295","192.168.2.3","216.58.197.4","TCP","1434","34325  >  443 [ACK] Seq=114959 Ack=456 Win=661 Len=1368 TSval=8196552 TSecr=601313359 [TCP segment of a reassembled PDU]"
"189","2018-08-23 03:01:23.434296","192.168.2.3","216.58.197.4","TLSv1.2","155","Application Data"
"193","2018-08-23 03:01:23.508934","192.168.2.3","216.58.197.4","TCP","1434","34325  >  443 [ACK] Seq=116416 Ack=456 Win=661 Len=1368 TSval=8196560 TSecr=601313452 [TCP segment of a reassembled PDU]"
"194","2018-08-23 03:01:23.508938","192.168.2.3","216.58.197.4","TCP","1434","34325  >  443 [ACK] Seq=117784 Ack=456 Win=661 Len=1368 TSval=8196560 TSecr=601313452 [TCP segment of a reassembled PDU]"
"195","2018-08-23 03:01:23.509092","192.168.2.3","216.58.197.4","TLSv1.2","212","Application Data"
"196","2018-08-23 03:01:23.509621","192.168.2.3","216.58.197.4","TCP","1434","34325  >  443 [ACK] Seq=119298 Ack=456 Win=661 Len=1368 TSval=8196560 TSecr=601313452 [TCP segment of a reassembled PDU]"
"197","2018-08-23 03:01:23.509624","192.168.2.3","216.58.197.4","TLSv1.2","155","Application Data"
"201","2018-08-23 03:01:23.604637","192.168.2.3","216.58.197.4","TCP","1434","34325  >  443 [ACK] Seq=120755 Ack=456 Win=661 Len=1368 TSval=8196569 TSecr=601313528 [TCP segment of a reassembled PDU]"
"202","2018-08-23 03:01:23.604997","192.168.2.3","216.58.197.4","TCP","1434","34325  >  443 [ACK] Seq=122123 Ack=456 Win=661 Len=1368 TSval=8196569 TSecr=601313528 [TCP segment of a reassembled PDU]"
"203","2018-08-23 03:01:23.605001","192.168.2.3","216.58.197.4","TLSv1.2","212","Application Data"
"204","2018-08-23 03:01:23.605463","192.168.2.3","216.58.197.4","TCP","1434","34325  >  443 [ACK] Seq=123637 Ack=456 Win=661 Len=1368 TSval=8196569 TSecr=601313528 [TCP segment of a reassembled PDU]"
"205","2018-08-23 03:01:23.605465","192.168.2.3","216.58.197.4","TLSv1.2","155","Application Data"
"211","2018-08-23 03:01:23.645918","192.168.2.3","216.58.197.4","TCP","66","34325  >  443 [ACK] Seq=125094 Ack=592 Win=661 Len=0 TSval=8196573 TSecr=601313644"
"214","2018-08-23 03:01:23.658212","192.168.2.3","216.58.197.4","TCP","66","34325  >  443 [ACK] Seq=125094 Ack=969 Win=661 Len=0 TSval=8196574 TSecr=601313669"
"215","2018-08-23 03:01:23.700783","192.168.2.3","216.58.197.4","TCP","1434","34325  >  443 [ACK] Seq=125094 Ack=969 Win=661 Len=1368 TSval=8196579 TSecr=601313669 [TCP segment of a reassembled PDU]"
"216","2018-08-23 03:01:23.701277","192.168.2.3","216.58.197.4","TCP","1434","34325  >  443 [ACK] Seq=126462 Ack=969 Win=661 Len=1368 TSval=8196579 TSecr=601313669 [TCP segment of a reassembled PDU]"
"217","2018-08-23 03:01:23.701279","192.168.2.3","216.58.197.4","TLSv1.2","212","Application Data"
"218","2018-08-23 03:01:23.701280","192.168.2.3","216.58.197.4","TCP","1434","34325  >  443 [ACK] Seq=127976 Ack=969 Win=661 Len=1368 TSval=8196579 TSecr=601313669 [TCP segment of a reassembled PDU]"
"219","2018-08-23 03:01:23.701281","192.168.2.3","216.58.197.4","TLSv1.2","155","Application Data"
"225","2018-08-23 03:01:23.762361","192.168.2.3","216.58.197.4","TCP","66","34325  >  443 [ACK] Seq=129433 Ack=1157 Win=661 Len=0 TSval=8196585 TSecr=601313762"
"226","2018-08-23 03:01:23.787537","192.168.2.3","216.58.197.4","TCP","1434","34325  >  443 [ACK] Seq=129433 Ack=1157 Win=661 Len=1368 TSval=8196587 TSecr=601313762 [TCP segment of a reassembled PDU]"
"227","2018-08-23 03:01:23.787930","192.168.2.3","216.58.197.4","TCP","1434","34325  >  443 [ACK] Seq=130801 Ack=1157 Win=661 Len=1368 TSval=8196587 TSecr=601313762 [TCP segment of a reassembled PDU]"
"228","2018-08-23 03:01:23.787933","192.168.2.3","216.58.197.4","TLSv1.2","212","Application Data"
"229","2018-08-23 03:01:23.788448","192.168.2.3","216.58.197.4","TCP","1434","34325  >  443 [ACK] Seq=132315 Ack=1157 Win=661 Len=1368 TSval=8196587 TSecr=601313762 [TCP segment of a reassembled PDU]"
"230","2018-08-23 03:01:23.788452","192.168.2.3","216.58.197.4","TLSv1.2","155","Application Data"
"234","2018-08-23 03:01:23.884215","192.168.2.3","216.58.197.4","TCP","1434","34325  >  443 [ACK] Seq=133772 Ack=1157 Win=661 Len=1368 TSval=8196597 TSecr=601313807 [TCP segment of a reassembled PDU]"
"235","2018-08-23 03:01:23.884221","192.168.2.3","216.58.197.4","TCP","1434","34325  >  443 [ACK] Seq=135140 Ack=1157 Win=661 Len=1368 TSval=8196597 TSecr=601313807 [TCP segment of a reassembled PDU]"
"236","2018-08-23 03:01:23.884222","192.168.2.3","216.58.197.4","TLSv1.2","212","Application Data"
"237","2018-08-23 03:01:23.884656","192.168.2.3","216.58.197.4","TCP","1434","34325  >  443 [ACK] Seq=136654 Ack=1157 Win=661 Len=1368 TSval=8196597 TSecr=601313807 [TCP segment of a reassembled PDU]"
"238","2018-08-23 03:01:23.884658","192.168.2.3","216.58.197.4","TLSv1.2","155","Application Data"
"243","2018-08-23 03:01:23.891736","192.168.2.3","192.168.2.1","TCP","183","8009  >  53029 [PSH, ACK] Seq=118 Ack=235 Win=277 Len=117 TSval=8196598 TSecr=2319215844 [TCP segment of a reassembled PDU]"
"247","2018-08-23 03:01:23.944962","192.168.2.3","216.58.197.4","TCP","66","34325  >  443 [ACK] Seq=138111 Ack=1396 Win=661 Len=0 TSval=8196603 TSecr=601313954"
"248","2018-08-23 03:01:23.978407","192.168.2.3","216.58.197.4","TCP","1434","34325  >  443 [ACK] Seq=138111 Ack=1396 Win=661 Len=1368 TSval=8196607 TSecr=601313954 [TCP segment of a reassembled PDU]"
"249","2018-08-23 03:01:23.978852","192.168.2.3","216.58.197.4","TCP","1434","34325  >  443 [ACK] Seq=139479 Ack=1396 Win=661 Len=1368 TSval=8196607 TSecr=601313954 [TCP segment of a reassembled PDU]"
"250","2018-08-23 03:01:23.978855","192.168.2.3","216.58.197.4","TLSv1.2","212","Application Data"
"251","2018-08-23 03:01:23.979232","192.168.2.3","216.58.197.4","TCP","1434","34325  >  443 [ACK] Seq=140993 Ack=1396 Win=661 Len=1368 TSval=8196607 TSecr=601313954 [TCP segment of a reassembled PDU]"
"252","2018-08-23 03:01:23.979235","192.168.2.3","216.58.197.4","TLSv1.2","155","Application Data"
"258","2018-08-23 03:01:24.032233","192.168.2.3","216.58.197.4","TCP","66","34325  >  443 [ACK] Seq=142450 Ack=1703 Win=661 Len=0 TSval=8196612 TSecr=601314045"
"259","2018-08-23 03:01:24.075673","192.168.2.3","216.58.197.4","TCP","1434","34325  >  443 [ACK] Seq=142450 Ack=1703 Win=661 Len=1368 TSval=8196616 TSecr=601314045 [TCP segment of a reassembled PDU]"
"260","2018-08-23 03:01:24.076034","192.168.2.3","216.58.197.4","TCP","1434","34325  >  443 [ACK] Seq=143818 Ack=1703 Win=661 Len=1368 TSval=8196616 TSecr=601314045 [TCP segment of a reassembled PDU]"
"261","2018-08-23 03:01:24.076036","192.168.2.3","216.58.197.4","TLSv1.2","212","Application Data"
"262","2018-08-23 03:01:24.076472","192.168.2.3","216.58.197.4","TCP","1434","34325  >  443 [ACK] Seq=145332 Ack=1703 Win=661 Len=1368 TSval=8196616 TSecr=601314045 [TCP segment of a reassembled PDU]"
"263","2018-08-23 03:01:24.076474","192.168.2.3","216.58.197.4","TLSv1.2","155","Application Data"
"269","2018-08-23 03:01:24.137676","192.168.2.3","216.58.197.4","TCP","66","34325  >  443 [ACK] Seq=146789 Ack=2188 Win=661 Len=0 TSval=8196622 TSecr=601314149"
"270","2018-08-23 03:01:24.171803","192.168.2.3","216.58.197.4","TCP","1434","34325  >  443 [ACK] Seq=146789 Ack=2188 Win=661 Len=1368 TSval=8196626 TSecr=601314149 [TCP segment of a reassembled PDU]"
"271","2018-08-23 03:01:24.172075","192.168.2.3","216.58.197.4","TCP","1434","34325  >  443 [ACK] Seq=148157 Ack=2188 Win=661 Len=1368 TSval=8196626 TSecr=601314149 [TCP segment of a reassembled PDU]"
"272","2018-08-23 03:01:24.172078","192.168.2.3","216.58.197.4","TLSv1.2","212","Application Data"
"273","2018-08-23 03:01:24.172426","192.168.2.3","216.58.197.4","TCP","1434","34325  >  443 [ACK] Seq=149671 Ack=2188 Win=661 Len=1368 TSval=8196626 TSecr=601314149 [TCP segment of a reassembled PDU]"
"274","2018-08-23 03:01:24.172429","192.168.2.3","216.58.197.4","TLSv1.2","155","Application Data"
"280","2018-08-23 03:01:24.243312","192.168.2.3","216.58.197.4","TCP","66","34325  >  443 [ACK] Seq=151128 Ack=2372 Win=661 Len=0 TSval=8196633 TSecr=601314253"
"281","2018-08-23 03:01:24.245578","192.168.2.3","216.58.197.4","TCP","1434","34325  >  443 [ACK] Seq=151128 Ack=2372 Win=661 Len=1368 TSval=8196633 TSecr=601314253 [TCP segment of a reassembled PDU]"
"282","2018-08-23 03:01:24.245893","192.168.2.3","216.58.197.4","TCP","1434","34325  >  443 [ACK] Seq=152496 Ack=2372 Win=661 Len=1368 TSval=8196633 TSecr=601314253 [TCP segment of a reassembled PDU]"
"283","2018-08-23 03:01:24.245898","192.168.2.3","216.58.197.4","TLSv1.2","212","Application Data"
"284","2018-08-23 03:01:24.246365","192.168.2.3","216.58.197.4","TCP","1434","34325  >  443 [ACK] Seq=154010 Ack=2372 Win=661 Len=1368 TSval=8196633 TSecr=601314253 [TCP segment of a reassembled PDU]"
"285","2018-08-23 03:01:24.246375","192.168.2.3","216.58.197.4","TLSv1.2","155","Application Data"
"289","2018-08-23 03:01:24.340673","192.168.2.3","216.58.197.4","TCP","1434","34325  >  443 [ACK] Seq=155467 Ack=2372 Win=661 Len=1368 TSval=8196643 TSecr=601314264 [TCP segment of a reassembled PDU]"
"290","2018-08-23 03:01:24.341035","192.168.2.3","216.58.197.4","TCP","1434","34325  >  443 [ACK] Seq=156835 Ack=2372 Win=661 Len=1368 TSval=8196643 TSecr=601314264 [TCP segment of a reassembled PDU]"
"291","2018-08-23 03:01:24.341037","192.168.2.3","216.58.197.4","TLSv1.2","212","Application Data"
"292","2018-08-23 03:01:24.341490","192.168.2.3","216.58.197.4","TCP","1434","34325  >  443 [ACK] Seq=158349 Ack=2372 Win=661 Len=1368 TSval=8196643 TSecr=601314264 [TCP segment of a reassembled PDU]"
"293","2018-08-23 03:01:24.341493","192.168.2.3","216.58.197.4","TLSv1.2","155","Application Data"
"299","2018-08-23 03:01:24.400285","192.168.2.3","216.58.197.4","TCP","66","34325  >  443 [ACK] Seq=159806 Ack=2775 Win=661 Len=0 TSval=8196649 TSecr=601314413"
"300","2018-08-23 03:01:24.430894","192.168.2.3","216.58.197.4","TCP","1434","34325  >  443 [ACK] Seq=159806 Ack=2775 Win=661 Len=1368 TSval=8196651 TSecr=601314413 [TCP segment of a reassembled PDU]"
"301","2018-08-23 03:01:24.430898","192.168.2.3","216.58.197.4","TCP","1434","34325  >  443 [ACK] Seq=161174 Ack=2775 Win=661 Len=1368 TSval=8196651 TSecr=601314413 [TCP segment of a reassembled PDU]"
"302","2018-08-23 03:01:24.430899","192.168.2.3","216.58.197.4","TLSv1.2","212","Application Data"
"303","2018-08-23 03:01:24.431044","192.168.2.3","216.58.197.4","TCP","1434","34325  >  443 [ACK] Seq=162688 Ack=2775 Win=661 Len=1368 TSval=8196651 TSecr=601314413 [TCP segment of a reassembled PDU]"
"304","2018-08-23 03:01:24.431366","192.168.2.3","216.58.197.4","TLSv1.2","155","Application Data"
"310","2018-08-23 03:01:24.489150","192.168.2.3","216.58.197.4","TCP","66","34325  >  443 [ACK] Seq=164145 Ack=3081 Win=661 Len=0 TSval=8196658 TSecr=601314497"
"311","2018-08-23 03:01:24.522863","192.168.2.3","216.58.197.4","TCP","1434","34325  >  443 [ACK] Seq=164145 Ack=3081 Win=661 Len=1368 TSval=8196661 TSecr=601314497 [TCP segment of a reassembled PDU]"
"312","2018-08-23 03:01:24.523292","192.168.2.3","216.58.197.4","TCP","1434","34325  >  443 [ACK] Seq=165513 Ack=3081 Win=661 Len=1368 TSval=8196661 TSecr=601314497 [TCP segment of a reassembled PDU]"
"313","2018-08-23 03:01:24.523295","192.168.2.3","216.58.197.4","TLSv1.2","212","Application Data"
"314","2018-08-23 03:01:24.523641","192.168.2.3","216.58.197.4","TCP","1434","34325  >  443 [ACK] Seq=167027 Ack=3081 Win=661 Len=1368 TSval=8196661 TSecr=601314497 [TCP segment of a reassembled PDU]"
"315","2018-08-23 03:01:24.523643","192.168.2.3","216.58.197.4","TLSv1.2","155","Application Data"
"321","2018-08-23 03:01:24.585322","192.168.2.3","216.58.197.4","TCP","66","34325  >  443 [ACK] Seq=168484 Ack=3421 Win=661 Len=0 TSval=8196667 TSecr=601314592"
"322","2018-08-23 03:01:24.623401","192.168.2.3","216.58.197.4","TCP","1434","34325  >  443 [ACK] Seq=168484 Ack=3421 Win=661 Len=1368 TSval=8196671 TSecr=601314592 [TCP segment of a reassembled PDU]"
"323","2018-08-23 03:01:24.623406","192.168.2.3","216.58.197.4","TCP","1434","34325  >  443 [ACK] Seq=169852 Ack=3421 Win=661 Len=1368 TSval=8196671 TSecr=601314592 [TCP segment of a reassembled PDU]"
"324","2018-08-23 03:01:24.623407","192.168.2.3","216.58.197.4","TLSv1.2","212","Application Data"
"325","2018-08-23 03:01:24.623539","192.168.2.3","216.58.197.4","TCP","1434","34325  >  443 [ACK] Seq=171366 Ack=3421 Win=661 Len=1368 TSval=8196671 TSecr=601314592 [TCP segment of a reassembled PDU]"
"326","2018-08-23 03:01:24.623779","192.168.2.3","216.58.197.4","TLSv1.2","155","Application Data"
"332","2018-08-23 03:01:24.642511","192.168.2.3","216.58.197.4","TCP","66","34325  >  443 [ACK] Seq=172823 Ack=3661 Win=661 Len=0 TSval=8196673 TSecr=601314644"
"333","2018-08-23 03:01:24.715469","192.168.2.3","216.58.197.4","TCP","1434","34325  >  443 [ACK] Seq=172823 Ack=3661 Win=661 Len=1368 TSval=8196680 TSecr=601314644 [TCP segment of a reassembled PDU]"
"334","2018-08-23 03:01:24.715763","192.168.2.3","216.58.197.4","TCP","1434","34325  >  443 [ACK] Seq=174191 Ack=3661 Win=661 Len=1368 TSval=8196680 TSecr=601314644 [TCP segment of a reassembled PDU]"
"335","2018-08-23 03:01:24.715767","192.168.2.3","216.58.197.4","TLSv1.2","212","Application Data"
"336","2018-08-23 03:01:24.716046","192.168.2.3","216.58.197.4","TCP","1434","34325  >  443 [ACK] Seq=175705 Ack=3661 Win=661 Len=1368 TSval=8196680 TSecr=601314644 [TCP segment of a reassembled PDU]"
"337","2018-08-23 03:01:24.716049","192.168.2.3","216.58.197.4","TLSv1.2","155","Application Data"
"341","2018-08-23 03:01:24.821862","192.168.2.3","216.58.197.4","TCP","1434","34325  >  443 [ACK] Seq=177162 Ack=3661 Win=661 Len=1368 TSval=8196691 TSecr=601314775 [TCP segment of a reassembled PDU]"
"342","2018-08-23 03:01:24.822082","192.168.2.3","216.58.197.4","TCP","1434","34325  >  443 [ACK] Seq=178530 Ack=3661 Win=661 Len=1368 TSval=8196691 TSecr=601314775 [TCP segment of a reassembled PDU]"
"343","2018-08-23 03:01:24.822085","192.168.2.3","216.58.197.4","TLSv1.2","212","Application Data"
"344","2018-08-23 03:01:24.822542","192.168.2.3","216.58.197.4","TLSv1.2","1381","Application Data"
"349","2018-08-23 03:01:24.888091","192.168.2.3","216.58.197.4","TCP","66","34325  >  443 [ACK] Seq=181359 Ack=3706 Win=661 Len=0 TSval=8196698 TSecr=601314866"
"350","2018-08-23 03:01:24.939851","192.168.2.3","216.58.197.4","TCP","1434","34325  >  443 [ACK] Seq=181359 Ack=3706 Win=661 Len=1368 TSval=8196702 TSecr=601314866 [TCP segment of a reassembled PDU]"
"351","2018-08-23 03:01:24.940003","192.168.2.3","216.58.197.4","TCP","1434","34325  >  443 [ACK] Seq=182727 Ack=3706 Win=661 Len=1368 TSval=8196702 TSecr=601314866 [TCP segment of a reassembled PDU]"
"352","2018-08-23 03:01:24.940005","192.168.2.3","216.58.197.4","TLSv1.2","212","Application Data"
"353","2018-08-23 03:01:24.940350","192.168.2.3","216.58.197.4","TCP","1434","34325  >  443 [ACK] Seq=184241 Ack=3706 Win=661 Len=1368 TSval=8196702 TSecr=601314866 [TCP segment of a reassembled PDU]"
"354","2018-08-23 03:01:24.940351","192.168.2.3","216.58.197.4","TLSv1.2","155","Application Data"
"357","2018-08-23 03:01:25.035625","192.168.2.3","216.58.197.4","TCP","1434","34325  >  443 [ACK] Seq=185698 Ack=3706 Win=661 Len=1368 TSval=8196712 TSecr=601314958 [TCP segment of a reassembled PDU]"
"358","2018-08-23 03:01:25.035974","192.168.2.3","216.58.197.4","TCP","1434","34325  >  443 [ACK] Seq=187066 Ack=3706 Win=661 Len=1368 TSval=8196712 TSecr=601314958 [TCP segment of a reassembled PDU]"
"359","2018-08-23 03:01:25.035977","192.168.2.3","216.58.197.4","TLSv1.2","212","Application Data"
"360","2018-08-23 03:01:25.035978","192.168.2.3","216.58.197.4","TCP","1434","34325  >  443 [ACK] Seq=188580 Ack=3706 Win=661 Len=1368 TSval=8196712 TSecr=601314958 [TCP segment of a reassembled PDU]"
"361","2018-08-23 03:01:25.036173","192.168.2.3","216.58.197.4","TLSv1.2","155","Application Data"
"366","2018-08-23 03:01:25.096983","192.168.2.3","216.58.197.4","TCP","66","34325  >  443 [ACK] Seq=190037 Ack=4189 Win=661 Len=0 TSval=8196718 TSecr=601315104"
"367","2018-08-23 03:01:25.141344","192.168.2.3","216.58.197.4","TCP","1434","34325  >  443 [ACK] Seq=190037 Ack=4189 Win=661 Len=1368 TSval=8196723 TSecr=601315104 [TCP segment of a reassembled PDU]"
"368","2018-08-23 03:01:25.141738","192.168.2.3","216.58.197.4","TCP","1434","34325  >  443 [ACK] Seq=191405 Ack=4189 Win=661 Len=1368 TSval=8196723 TSecr=601315104 [TCP segment of a reassembled PDU]"
"369","2018-08-23 03:01:25.141740","192.168.2.3","216.58.197.4","TLSv1.2","212","Application Data"
"370","2018-08-23 03:01:25.144694","192.168.2.3","216.58.197.4","TCP","1434","34325  >  443 [ACK] Seq=192919 Ack=4189 Win=661 Len=1368 TSval=8196723 TSecr=601315104 [TCP segment of a reassembled PDU]"
"371","2018-08-23 03:01:25.144698","192.168.2.3","216.58.197.4","TLSv1.2","155","Application Data"
"377","2018-08-23 03:01:25.199684","192.168.2.3","216.58.197.4","TCP","66","34325  >  443 [ACK] Seq=194376 Ack=4463 Win=661 Len=0 TSval=8196729 TSecr=601315212"
"378","2018-08-23 03:01:25.199941","192.168.2.3","216.58.197.4","TCP","66","34325  >  443 [ACK] Seq=194376 Ack=4512 Win=661 Len=0 TSval=8196729 TSecr=601315212"
"379","2018-08-23 03:01:25.237969","192.168.2.3","216.58.197.4","TCP","1434","34325  >  443 [ACK] Seq=194376 Ack=4512 Win=661 Len=1368 TSval=8196732 TSecr=601315212 [TCP segment of a reassembled PDU]"
"380","2018-08-23 03:01:25.238388","192.168.2.3","216.58.197.4","TCP","1434","34325  >  443 [ACK] Seq=195744 Ack=4512 Win=661 Len=1368 TSval=8196732 TSecr=601315212 [TCP segment of a reassembled PDU]"
"381","2018-08-23 03:01:25.238392","192.168.2.3","216.58.197.4","TLSv1.2","212","Application Data"
"382","2018-08-23 03:01:25.238393","192.168.2.3","216.58.197.4","TCP","1434","34325  >  443 [ACK] Seq=197258 Ack=4512 Win=661 Len=1368 TSval=8196732 TSecr=601315212 [TCP segment of a reassembled PDU]"
"383","2018-08-23 03:01:25.238500","192.168.2.3","216.58.197.4","TLSv1.2","155","Application Data"
"387","2018-08-23 03:01:25.338652","192.168.2.3","216.58.197.4","TCP","1434","34325  >  443 [ACK] Seq=198715 Ack=4512 Win=661 Len=1368 TSval=8196742 TSecr=601315256 [TCP segment of a reassembled PDU]"
"388","2018-08-23 03:01:25.338658","192.168.2.3","216.58.197.4","TCP","1434","34325  >  443 [ACK] Seq=200083 Ack=4512 Win=661 Len=1368 TSval=8196742 TSecr=601315256 [TCP segment of a reassembled PDU]"
"389","2018-08-23 03:01:25.338744","192.168.2.3","216.58.197.4","TLSv1.2","212","Application Data"
"390","2018-08-23 03:01:25.339058","192.168.2.3","216.58.197.4","TCP","1434","34325  >  443 [ACK] Seq=201597 Ack=4512 Win=661 Len=1368 TSval=8196742 TSecr=601315256 [TCP segment of a reassembled PDU]"
"391","2018-08-23 03:01:25.339060","192.168.2.3","216.58.197.4","TLSv1.2","155","Application Data"
"396","2018-08-23 03:01:25.388126","192.168.2.3","216.58.197.4","TCP","66","34325  >  443 [ACK] Seq=203054 Ack=4802 Win=661 Len=0 TSval=8196747 TSecr=601315400"
"397","2018-08-23 03:01:25.420445","192.168.2.3","216.58.197.4","TCP","1434","34325  >  443 [ACK] Seq=203054 Ack=4802 Win=661 Len=1368 TSval=8196750 TSecr=601315400 [TCP segment of a reassembled PDU]"
"398","2018-08-23 03:01:25.420450","192.168.2.3","216.58.197.4","TCP","1434","34325  >  443 [ACK] Seq=204422 Ack=4802 Win=661 Len=1368 TSval=8196750 TSecr=601315400 [TCP segment of a reassembled PDU]"
"399","2018-08-23 03:01:25.420600","192.168.2.3","216.58.197.4","TLSv1.2","212","Application Data"
"400","2018-08-23 03:01:25.420602","192.168.2.3","216.58.197.4","TLSv1.2","308","Application Data"
"401","2018-08-23 03:01:25.420603","192.168.2.3","216.58.197.4","TLSv1.2","102","Application Data"
"406","2018-08-23 03:01:25.467687","192.168.2.3","216.58.197.4","TCP","66","34325  >  443 [ACK] Seq=206214 Ack=6052 Win=661 Len=0 TSval=8196755 TSecr=601315477"
"409","2018-08-23 03:01:25.642709","192.168.2.3","216.58.197.4","TCP","66","34325  >  443 [ACK] Seq=206214 Ack=6394 Win=661 Len=0 TSval=8196773 TSecr=601315644"
"410","2018-08-23 03:01:25.748360","192.168.2.3","104.199.240.211","TCP","66","48861  >  443 [ACK] Seq=1 Ack=1 Win=473 Len=0 TSval=8196784 TSecr=303026273"
"412","2018-08-23 03:01:25.829487","192.168.2.3","104.199.240.211","TCP","66","48862  >  443 [ACK] Seq=1 Ack=1 Win=661 Len=0 TSval=8196792 TSecr=302532538"
"417","2018-08-23 03:01:26.040100","192.168.2.3","216.58.197.4","TCP","66","34325  >  443 [ACK] Seq=206214 Ack=8109 Win=650 Len=0 TSval=8196813 TSecr=601316026"
"428","2018-08-23 03:01:26.055593","192.168.2.3","216.58.197.4","TCP","66","34325  >  443 [ACK] Seq=206214 Ack=10033 Win=650 Len=0 TSval=8196814 TSecr=601316052"
"429","2018-08-23 03:01:26.057210","192.168.2.3","216.58.197.4","TCP","66","34325  >  443 [ACK] Seq=206214 Ack=11839 Win=650 Len=0 TSval=8196814 TSecr=601316060"
"430","2018-08-23 03:01:26.057213","192.168.2.3","216.58.197.4","TCP","66","34325  >  443 [ACK] Seq=206214 Ack=13529 Win=650 Len=0 TSval=8196814 TSecr=601316061"
"431","2018-08-23 03:01:26.057214","192.168.2.3","216.58.197.4","TCP","66","34325  >  443 [ACK] Seq=206214 Ack=15703 Win=661 Len=0 TSval=8196814 TSecr=601316061"
"432","2018-08-23 03:01:26.057665","192.168.2.3","216.58.197.4","TCP","66","34325  >  443 [ACK] Seq=206214 Ack=17384 Win=661 Len=0 TSval=8196814 TSecr=601316061"
"435","2018-08-23 03:01:26.071194","192.168.2.3","216.58.197.4","TCP","66","34325  >  443 [ACK] Seq=206214 Ack=18266 Win=661 Len=0 TSval=8196816 TSecr=601316083"
"436","2018-08-23 03:01:26.187922","192.168.2.3","35.186.224.48","TLSv1.2","124","Application Data"
"437","2018-08-23 03:01:26.187926","192.168.2.3","35.186.224.48","TLSv1.2","104","Application Data"
