"No.","Time","Source","Destination","Protocol","Length","Info"
"3","2018-08-23 02:57:17.817590","192.168.2.3","192.168.2.1","TCP","183","8009  >  53029 [PSH, ACK] Seq=1 Ack=118 Win=277 Len=117 TSval=8171990 TSecr=2318970363 [TCP segment of a reassembled PDU]"
"6","2018-08-23 02:57:20.523608","192.168.2.3","216.58.197.4","TLSv1.2","156","Application Data"
"7","2018-08-23 02:57:20.523826","192.168.2.3","216.58.197.4","TLSv1.2","104","Application Data"
"8","2018-08-23 02:57:20.524161","192.168.2.3","216.58.197.4","TLSv1.2","158","Application Data"
"13","2018-08-23 02:57:20.544015","192.168.2.3","216.58.197.4","TCP","1434","34325  >  443 [ACK] Seq=221 Ack=39 Win=661 Len=1368 TSval=8172263 TSecr=601070542 [TCP segment of a reassembled PDU]"
"14","2018-08-23 02:57:20.544393","192.168.2.3","216.58.197.4","TCP","1434","34325  >  443 [ACK] Seq=1589 Ack=39 Win=661 Len=1368 TSval=8172263 TSecr=601070542 [TCP segment of a reassembled PDU]"
"15","2018-08-23 02:57:20.544396","192.168.2.3","216.58.197.4","TLSv1.2","212","Application Data"
"16","2018-08-23 02:57:20.544780","192.168.2.3","216.58.197.4","TCP","1434","34325  >  443 [ACK] Seq=3103 Ack=39 Win=661 Len=1368 TSval=8172263 TSecr=601070542 [TCP segment of a reassembled PDU]"
"17","2018-08-23 02:57:20.544783","192.168.2.3","216.58.197.4","TLSv1.2","359","Application Data"
"18","2018-08-23 02:57:20.545194","192.168.2.3","216.58.197.4","TCP","1434","34325  >  443 [ACK] Seq=4764 Ack=39 Win=661 Len=1368 TSval=8172263 TSecr=601070542 [TCP segment of a reassembled PDU]"
"19","2018-08-23 02:57:20.545197","192.168.2.3","216.58.197.4","TCP","1434","34325  >  443 [ACK] Seq=6132 Ack=39 Win=661 Len=1368 TSval=8172263 TSecr=601070542 [TCP segment of a reassembled PDU]"
"20","2018-08-23 02:57:20.545199","192.168.2.3","216.58.197.4","TLSv1.2","212","Application Data"
"21","2018-08-23 02:57:20.545490","192.168.2.3","216.58.197.4","TCP","1434","34325  >  443 [ACK] Seq=7646 Ack=39 Win=661 Len=1368 TSval=8172263 TSecr=601070542 [TCP segment of a reassembled PDU]"
"22","2018-08-23 02:57:20.545493","192.168.2.3","216.58.197.4","TLSv1.2","156","Application Data"
"28","2018-08-23 02:57:20.557177","192.168.2.3","216.58.197.4","TCP","1434","34325  >  443 [ACK] Seq=9104 Ack=39 Win=661 Len=1368 TSval=8172264 TSecr=601070562 [TCP segment of a reassembled PDU]"
"29","2018-08-23 02:57:20.557180","192.168.2.3","216.58.197.4","TCP","1434","34325  >  443 [ACK] Seq=10472 Ack=39 Win=661 Len=1368 TSval=8172264 TSecr=601070562 [TCP segment of a reassembled PDU]"
"30","2018-08-23 02:57:20.557337","192.168.2.3","216.58.197.4","TLSv1.2","1434","Application Data [TCP segment of a reassembled PDU]"
"31","2018-08-23 02:57:20.557683","192.168.2.3","216.58.197.4","TLSv1.2","1434","Application Data [TCP segment of a reassembled PDU]"
"32","2018-08-23 02:57:20.557686","192.168.2.3","216.58.197.4","TCP","1434","34325  >  443 [ACK] Seq=14576 Ack=39 Win=661 Len=1368 TSval=8172264 TSecr=601070563 [TCP segment of a reassembled PDU]"
"33","2018-08-23 02:57:20.558140","192.168.2.3","216.58.197.4","TLSv1.2","1434","Application Data [TCP segment of a reassembled PDU]"
"34","2018-08-23 02:57:20.558550","192.168.2.3","216.58.197.4","TLSv1.2","1434","Application Data [TCP segment of a reassembled PDU]"
"35","2018-08-23 02:57:20.558553","192.168.2.3","216.58.197.4","TCP","1434","34325  >  443 [ACK] Seq=18680 Ack=39 Win=661 Len=1368 TSval=8172265 TSecr=601070563 [TCP segment of a reassembled PDU]"
"36","2018-08-23 02:57:20.558816","192.168.2.3","216.58.197.4","TLSv1.2","1434","Application Data [TCP segment of a reassembled PDU]"
"37","2018-08-23 02:57:20.558819","192.168.2.3","216.58.197.4","TLSv1.2","1434","Application Data [TCP segment of a reassembled PDU]"
"38","2018-08-23 02:57:20.559535","192.168.2.3","216.58.197.4","TCP","1434","34325  >  443 [ACK] Seq=22784 Ack=39 Win=661 Len=1368 TSval=8172265 TSecr=601070563 [TCP segment of a reassembled PDU]"
"39","2018-08-23 02:57:20.559538","192.168.2.3","216.58.197.4","TLSv1.2","1434","Application Data [TCP segment of a reassembled PDU]"
"40","2018-08-23 02:57:20.559791","192.168.2.3","216.58.197.4","TLSv1.2","1434","Application Data [TCP segment of a reassembled PDU]"
"41","2018-08-23 02:57:20.559980","192.168.2.3","216.58.197.4","TCP","1434","34325  >  443 [ACK] Seq=26888 Ack=39 Win=661 Len=1368 TSval=8172265 TSecr=601070563 [TCP segment of a reassembled PDU]"
"42","2018-08-23 02:57:20.560127","192.168.2.3","216.58.197.4","TLSv1.2","1434","Application Data [TCP segment of a reassembled PDU]"
"46","2018-08-23 02:57:20.562725","192.168.2.3","216.58.197.4","TLSv1.2","1434","Application Data [TCP segment of a reassembled PDU]"
"49","2018-08-23 02:57:20.563326","192.168.2.3","216.58.197.4","TCP","1434","34325  >  443 [ACK] Seq=30992 Ack=39 Win=661 Len=1368 TSval=8172265 TSecr=601070575 [TCP segment of a reassembled PDU]"
"50","2018-08-23 02:57:20.563454","192.168.2.3","216.58.197.4","TLSv1.2","1434","Application Data [TCP segment of a reassembled PDU]"
"53","2018-08-23 02:57:20.564197","192.168.2.3","216.58.197.4","TCP","1434","34325  >  443 [ACK] Seq=33728 Ack=39 Win=661 Len=1368 TSval=8172265 TSecr=601070575 [TCP segment of a reassembled PDU]"
"54","2018-08-23 02:57:20.564961","192.168.2.3","216.58.197.4","TLSv1.2","1434","Application Data [TCP segment of a reassembled PDU]"
"55","2018-08-23 02:57:20.564966","192.168.2.3","216.58.197.4","TCP","1434","34325  >  443 [ACK] Seq=36464 Ack=39 Win=661 Len=1368 TSval=8172265 TSecr=601070575 [TCP segment of a reassembled PDU]"
"56","2018-08-23 02:57:20.565242","192.168.2.3","216.58.197.4","TLSv1.2","1434","Application Data [TCP segment of a reassembled PDU]"
"57","2018-08-23 02:57:20.565433","192.168.2.3","216.58.197.4","TLSv1.2","1434","Application Data [TCP segment of a reassembled PDU]"
"58","2018-08-23 02:57:20.565646","192.168.2.3","216.58.197.4","TCP","1434","34325  >  443 [ACK] Seq=40568 Ack=39 Win=661 Len=1368 TSval=8172265 TSecr=601070576 [TCP segment of a reassembled PDU]"
"59","2018-08-23 02:57:20.566071","192.168.2.3","216.58.197.4","TLSv1.2","1434","Application Data [TCP segment of a reassembled PDU]"
"60","2018-08-23 02:57:20.566076","192.168.2.3","216.58.197.4","TLSv1.2","1434","Application Data [TCP segment of a reassembled PDU]"
"61","2018-08-23 02:57:20.566376","192.168.2.3","216.58.197.4","TCP","1434","34325  >  443 [ACK] Seq=44672 Ack=39 Win=661 Len=1368 TSval=8172265 TSecr=601070576 [TCP segment of a reassembled PDU]"
"62","2018-08-23 02:57:20.566523","192.168.2.3","216.58.197.4","TLSv1.2","1434","Application Data [TCP segment of a reassembled PDU]"
"63","2018-08-23 02:57:20.566783","192.168.2.3","216.58.197.4","TLSv1.2","1434","Application Data [TCP segment of a reassembled PDU]"
"65","2018-08-23 02:57:20.567115","192.168.2.3","216.58.197.4","TCP","1434","34325  >  443 [ACK] Seq=48776 Ack=39 Win=661 Len=1368 TSval=8172266 TSecr=601070577 [TCP segment of a reassembled PDU]"
"66","2018-08-23 02:57:20.567118","192.168.2.3","216.58.197.4","TLSv1.2","1434","Application Data [TCP segment of a reassembled PDU]"
"67","2018-08-23 02:57:20.567412","192.168.2.3","216.58.197.4","TLSv1.2","1434","Application Data [TCP segment of a reassembled PDU]"
"68","2018-08-23 02:57:20.567579","192.168.2.3","216.58.197.4","TCP","1434","34325  >  443 [ACK] Seq=52880 Ack=39 Win=661 Len=1368 TSval=8172266 TSecr=601070578 [TCP segment of a reassembled PDU]"
"70","2018-08-23 02:57:20.567780","192.168.2.3","216.58.197.4","TLSv1.2","1434","Application Data [TCP segment of a reassembled PDU]"
"71","2018-08-23 02:57:20.569007","192.168.2.3","216.58.197.4","TLSv1.2","1434","Application Data [TCP segment of a reassembled PDU]"
"73","2018-08-23 02:57:20.569414","192.168.2.3","216.58.197.4","TCP","1434","34325  >  443 [ACK] Seq=56984 Ack=39 Win=661 Len=1368 TSval=8172266 TSecr=601070580 [TCP segment of a reassembled PDU]"
"75","2018-08-23 02:57:20.569752","192.168.2.3","216.58.197.4","TCP","1434","34325  >  443 [ACK] Seq=58352 Ack=39 Win=661 Len=1368 TSval=8172266 TSecr=601070580 [TCP segment of a reassembled PDU]"
"76","2018-08-23 02:57:20.569768","192.168.2.3","216.58.197.4","TLSv1.2","1434","Application Data, Application Data"
"78","2018-08-23 02:57:20.570130","192.168.2.3","216.58.197.4","TCP","1434","34325  >  443 [ACK] Seq=61088 Ack=39 Win=661 Len=1368 TSval=8172266 TSecr=601070581 [TCP segment of a reassembled PDU]"
"81","2018-08-23 02:57:20.571324","192.168.2.3","216.58.197.4","TCP","1434","34325  >  443 [ACK] Seq=62456 Ack=39 Win=661 Len=1368 TSval=8172266 TSecr=601070583 [TCP segment of a reassembled PDU]"
"84","2018-08-23 02:57:20.571937","192.168.2.3","216.58.197.4","TLSv1.2","1434","Application Data [TCP segment of a reassembled PDU]"
"85","2018-08-23 02:57:20.571940","192.168.2.3","216.58.197.4","TLSv1.2","255","Application Data"
"91","2018-08-23 02:57:20.583574","192.168.2.3","216.58.197.4","TCP","1434","34325  >  443 [ACK] Seq=65381 Ack=39 Win=661 Len=1368 TSval=8172267 TSecr=601070590 [TCP segment of a reassembled PDU]"
"92","2018-08-23 02:57:20.583865","192.168.2.3","216.58.197.4","TCP","1434","34325  >  443 [ACK] Seq=66749 Ack=39 Win=661 Len=1368 TSval=8172267 TSecr=601070590 [TCP segment of a reassembled PDU]"
"93","2018-08-23 02:57:20.583869","192.168.2.3","216.58.197.4","TLSv1.2","212","Application Data"
"94","2018-08-23 02:57:20.584023","192.168.2.3","216.58.197.4","TCP","1434","34325  >  443 [ACK] Seq=68263 Ack=39 Win=661 Len=1368 TSval=8172267 TSecr=601070590 [TCP segment of a reassembled PDU]"
"95","2018-08-23 02:57:20.584026","192.168.2.3","216.58.197.4","TLSv1.2","155","Application Data"
"98","2018-08-23 02:57:20.625753","192.168.2.3","108.177.97.188","TCP","66","58805  >  5228 [ACK] Seq=1 Ack=1 Win=494 Len=0 TSval=8172272 TSecr=2781139573"
"101","2018-08-23 02:57:20.681104","192.168.2.3","216.58.197.4","TCP","1434","34325  >  443 [ACK] Seq=69720 Ack=39 Win=661 Len=1368 TSval=8172277 TSecr=601070642 [TCP segment of a reassembled PDU]"
"102","2018-08-23 02:57:20.681109","192.168.2.3","216.58.197.4","TCP","1434","34325  >  443 [ACK] Seq=71088 Ack=39 Win=661 Len=1368 TSval=8172277 TSecr=601070642 [TCP segment of a reassembled PDU]"
"103","2018-08-23 02:57:20.681222","192.168.2.3","216.58.197.4","TLSv1.2","212","Application Data"
"104","2018-08-23 02:57:20.681496","192.168.2.3","216.58.197.4","TCP","1434","34325  >  443 [ACK] Seq=72602 Ack=39 Win=661 Len=1368 TSval=8172277 TSecr=601070642 [TCP segment of a reassembled PDU]"
"105","2018-08-23 02:57:20.681499","192.168.2.3","216.58.197.4","TLSv1.2","155","Application Data"
"108","2018-08-23 02:57:20.777168","192.168.2.3","216.58.197.4","TCP","1434","34325  >  443 [ACK] Seq=74059 Ack=39 Win=661 Len=1368 TSval=8172287 TSecr=601070699 [TCP segment of a reassembled PDU]"
"109","2018-08-23 02:57:20.779850","192.168.2.3","216.58.197.4","TCP","1434","34325  >  443 [ACK] Seq=75427 Ack=39 Win=661 Len=1368 TSval=8172287 TSecr=601070699 [TCP segment of a reassembled PDU]"
"110","2018-08-23 02:57:20.779866","192.168.2.3","216.58.197.4","TLSv1.2","212","Application Data"
"111","2018-08-23 02:57:20.780191","192.168.2.3","216.58.197.4","TCP","1434","34325  >  443 [ACK] Seq=76941 Ack=39 Win=661 Len=1368 TSval=8172287 TSecr=601070699 [TCP segment of a reassembled PDU]"
"112","2018-08-23 02:57:20.780194","192.168.2.3","216.58.197.4","TLSv1.2","155","Application Data"
"119","2018-08-23 02:57:20.850134","192.168.2.3","216.58.197.4","TCP","66","34325  >  443 [ACK] Seq=78398 Ack=179 Win=661 Len=0 TSval=8172294 TSecr=601070861"
"121","2018-08-23 02:57:20.868031","192.168.2.3","216.58.197.4","TCP","66","34325  >  443 [ACK] Seq=78398 Ack=457 Win=661 Len=0 TSval=8172296 TSecr=601070861"
"122","2018-08-23 02:57:20.878603","192.168.2.3","216.58.197.4","TCP","1434","34325  >  443 [ACK] Seq=78398 Ack=457 Win=661 Len=1368 TSval=8172297 TSecr=601070861 [TCP segment of a reassembled PDU]"
"123","2018-08-23 02:57:20.878868","192.168.2.3","216.58.197.4","TCP","1434","34325  >  443 [ACK] Seq=79766 Ack=457 Win=661 Len=1368 TSval=8172297 TSecr=601070861 [TCP segment of a reassembled PDU]"
"124","2018-08-23 02:57:20.878871","192.168.2.3","216.58.197.4","TLSv1.2","212","Application Data"
"125","2018-08-23 02:57:20.879088","192.168.2.3","216.58.197.4","TCP","1434","34325  >  443 [ACK] Seq=81280 Ack=457 Win=661 Len=1368 TSval=8172297 TSecr=601070861 [TCP segment of a reassembled PDU]"
"126","2018-08-23 02:57:20.882082","192.168.2.3","216.58.197.4","TLSv1.2","155","Application Data"
"131","2018-08-23 02:57:20.969000","192.168.2.3","216.58.197.4","TCP","1434","34325  >  443 [ACK] Seq=82737 Ack=701 Win=661 Len=1368 TSval=8172306 TSecr=601070976 [TCP segment of a reassembled PDU]"
"132","2018-08-23 02:57:20.969003","192.168.2.3","216.58.197.4","TCP","1434","34325  >  443 [ACK] Seq=84105 Ack=701 Win=661 Len=1368 TSval=8172306 TSecr=601070976 [TCP segment of a reassembled PDU]"
"133","2018-08-23 02:57:20.969360","192.168.2.3","216.58.197.4","TLSv1.2","212","Application Data"
"134","2018-08-23 02:57:20.969362","192.168.2.3","216.58.197.4","TCP","1434","34325  >  443 [ACK] Seq=85619 Ack=701 Win=661 Len=1368 TSval=8172306 TSecr=601070976 [TCP segment of a reassembled PDU]"
"135","2018-08-23 02:57:20.969363","192.168.2.3","216.58.197.4","TLSv1.2","155","Application Data"
"139","2018-08-23 02:57:21.077448","192.168.2.3","216.58.197.4","TCP","1434","34325  >  443 [ACK] Seq=87076 Ack=701 Win=661 Len=1368 TSval=8172317 TSecr=601070987 [TCP segment of a reassembled PDU]"
"140","2018-08-23 02:57:21.078831","192.168.2.3","216.58.197.4","TCP","1434","34325  >  443 [ACK] Seq=88444 Ack=701 Win=661 Len=1368 TSval=8172317 TSecr=601070987 [TCP segment of a reassembled PDU]"
"141","2018-08-23 02:57:21.078834","192.168.2.3","216.58.197.4","TLSv1.2","212","Application Data"
"142","2018-08-23 02:57:21.078835","192.168.2.3","216.58.197.4","TCP","1434","34325  >  443 [ACK] Seq=89958 Ack=701 Win=661 Len=1368 TSval=8172317 TSecr=601070987 [TCP segment of a reassembled PDU]"
"143","2018-08-23 02:57:21.078836","192.168.2.3","216.58.197.4","TLSv1.2","155","Application Data"
"147","2018-08-23 02:57:21.150099","192.168.2.3","216.58.197.4","TCP","66","34325  >  443 [ACK] Seq=91415 Ack=910 Win=661 Len=0 TSval=8172324 TSecr=601071120"
"148","2018-08-23 02:57:21.174221","192.168.2.3","216.58.197.4","TCP","1434","34325  >  443 [ACK] Seq=91415 Ack=910 Win=661 Len=1368 TSval=8172326 TSecr=601071120 [TCP segment of a reassembled PDU]"
"149","2018-08-23 02:57:21.174226","192.168.2.3","216.58.197.4","TCP","1434","34325  >  443 [ACK] Seq=92783 Ack=910 Win=661 Len=1368 TSval=8172326 TSecr=601071120 [TCP segment of a reassembled PDU]"
"150","2018-08-23 02:57:21.174228","192.168.2.3","216.58.197.4","TLSv1.2","212","Application Data"
"151","2018-08-23 02:57:21.174346","192.168.2.3","216.58.197.4","TCP","1434","34325  >  443 [ACK] Seq=94297 Ack=910 Win=661 Len=1368 TSval=8172326 TSecr=601071120 [TCP segment of a reassembled PDU]"
"152","2018-08-23 02:57:21.174549","192.168.2.3","216.58.197.4","TLSv1.2","155","Application Data"
"156","2018-08-23 02:57:21.289022","192.168.2.3","216.58.197.4","TCP","1434","34325  >  443 [ACK] Seq=95754 Ack=910 Win=661 Len=1368 TSval=8172338 TSecr=601071233 [TCP segment of a reassembled PDU]"
"157","2018-08-23 02:57:21.289365","192.168.2.3","216.58.197.4","TCP","1434","34325  >  443 [ACK] Seq=97122 Ack=910 Win=661 Len=1368 TSval=8172338 TSecr=601071233 [TCP segment of a reassembled PDU]"
"158","2018-08-23 02:57:21.289367","192.168.2.3","216.58.197.4","TLSv1.2","212","Application Data"
"159","2018-08-23 02:57:21.292103","192.168.2.3","216.58.197.4","TCP","1434","34325  >  443 [ACK] Seq=98636 Ack=910 Win=661 Len=1368 TSval=8172338 TSecr=601071233 [TCP segment of a reassembled PDU]"
"160","2018-08-23 02:57:21.292108","192.168.2.3","216.58.197.4","TLSv1.2","155","Application Data"
"164","2018-08-23 02:57:21.391395","192.168.2.3","216.58.197.4","TCP","1434","34325  >  443 [ACK] Seq=100093 Ack=910 Win=661 Len=1368 TSval=8172348 TSecr=601071310 [TCP segment of a reassembled PDU]"
"165","2018-08-23 02:57:21.391399","192.168.2.3","216.58.197.4","TCP","1434","34325  >  443 [ACK] Seq=101461 Ack=910 Win=661 Len=1368 TSval=8172348 TSecr=601071310 [TCP segment of a reassembled PDU]"
"166","2018-08-23 02:57:21.391685","192.168.2.3","216.58.197.4","TLSv1.2","212","Application Data"
"167","2018-08-23 02:57:21.391687","192.168.2.3","216.58.197.4","TCP","1434","34325  >  443 [ACK] Seq=102975 Ack=910 Win=661 Len=1368 TSval=8172348 TSecr=601071310 [TCP segment of a reassembled PDU]"
"168","2018-08-23 02:57:21.391688","192.168.2.3","216.58.197.4","TLSv1.2","155","Application Data"
"172","2018-08-23 02:57:21.458172","192.168.2.3","216.58.197.4","TCP","1434","34325  >  443 [ACK] Seq=104432 Ack=910 Win=661 Len=1368 TSval=8172355 TSecr=601071409 [TCP segment of a reassembled PDU]"
"173","2018-08-23 02:57:21.458590","192.168.2.3","216.58.197.4","TCP","1434","34325  >  443 [ACK] Seq=105800 Ack=910 Win=661 Len=1368 TSval=8172355 TSecr=601071409 [TCP segment of a reassembled PDU]"
"174","2018-08-23 02:57:21.458592","192.168.2.3","216.58.197.4","TLSv1.2","212","Application Data"
"175","2018-08-23 02:57:21.458846","192.168.2.3","216.58.197.4","TCP","1434","34325  >  443 [ACK] Seq=107314 Ack=910 Win=661 Len=1368 TSval=8172355 TSecr=601071409 [TCP segment of a reassembled PDU]"
"176","2018-08-23 02:57:21.458849","192.168.2.3","216.58.197.4","TLSv1.2","155","Application Data"
"180","2018-08-23 02:57:21.543664","192.168.2.3","216.58.197.4","TCP","1434","34325  >  443 [ACK] Seq=108771 Ack=910 Win=661 Len=1368 TSval=8172363 TSecr=601071477 [TCP segment of a reassembled PDU]"
"181","2018-08-23 02:57:21.544100","192.168.2.3","216.58.197.4","TCP","1434","34325  >  443 [ACK] Seq=110139 Ack=910 Win=661 Len=1368 TSval=8172363 TSecr=601071477 [TCP segment of a reassembled PDU]"
"182","2018-08-23 02:57:21.544102","192.168.2.3","216.58.197.4","TLSv1.2","212","Application Data"
"183","2018-08-23 02:57:21.544103","192.168.2.3","216.58.197.4","TCP","1434","34325  >  443 [ACK] Seq=111653 Ack=910 Win=661 Len=1368 TSval=8172363 TSecr=601071477 [TCP segment of a reassembled PDU]"
"184","2018-08-23 02:57:21.544239","192.168.2.3","216.58.197.4","TLSv1.2","155","Application Data"
"188","2018-08-23 02:57:21.640360","192.168.2.3","216.58.197.4","TCP","1434","34325  >  443 [ACK] Seq=113110 Ack=910 Win=661 Len=1368 TSval=8172373 TSecr=601071562 [TCP segment of a reassembled PDU]"
"189","2018-08-23 02:57:21.640641","192.168.2.3","216.58.197.4","TCP","1434","34325  >  443 [ACK] Seq=114478 Ack=910 Win=661 Len=1368 TSval=8172373 TSecr=601071562 [TCP segment of a reassembled PDU]"
"190","2018-08-23 02:57:21.640643","192.168.2.3","216.58.197.4","TLSv1.2","212","Application Data"
"191","2018-08-23 02:57:21.640847","192.168.2.3","216.58.197.4","TCP","1434","34325  >  443 [ACK] Seq=115992 Ack=910 Win=661 Len=1368 TSval=8172373 TSecr=601071562 [TCP segment of a reassembled PDU]"
"192","2018-08-23 02:57:21.640850","192.168.2.3","216.58.197.4","TLSv1.2","155","Application Data"
"196","2018-08-23 02:57:21.714764","192.168.2.3","216.58.197.4","TCP","1434","34325  >  443 [ACK] Seq=117449 Ack=910 Win=661 Len=1368 TSval=8172380 TSecr=601071659 [TCP segment of a reassembled PDU]"
"197","2018-08-23 02:57:21.714769","192.168.2.3","216.58.197.4","TCP","1434","34325  >  443 [ACK] Seq=118817 Ack=910 Win=661 Len=1368 TSval=8172380 TSecr=601071659 [TCP segment of a reassembled PDU]"
"198","2018-08-23 02:57:21.714770","192.168.2.3","216.58.197.4","TLSv1.2","212","Application Data"
"199","2018-08-23 02:57:21.715168","192.168.2.3","216.58.197.4","TCP","1434","34325  >  443 [ACK] Seq=120331 Ack=910 Win=661 Len=1368 TSval=8172380 TSecr=601071659 [TCP segment of a reassembled PDU]"
"200","2018-08-23 02:57:21.715171","192.168.2.3","216.58.197.4","TLSv1.2","155","Application Data"
"204","2018-08-23 02:57:21.811424","192.168.2.3","216.58.197.4","TCP","1434","34325  >  443 [ACK] Seq=121788 Ack=910 Win=661 Len=1368 TSval=8172390 TSecr=601071733 [TCP segment of a reassembled PDU]"
"205","2018-08-23 02:57:21.811751","192.168.2.3","216.58.197.4","TCP","1434","34325  >  443 [ACK] Seq=123156 Ack=910 Win=661 Len=1368 TSval=8172390 TSecr=601071733 [TCP segment of a reassembled PDU]"
"206","2018-08-23 02:57:21.811754","192.168.2.3","216.58.197.4","TLSv1.2","212","Application Data"
"207","2018-08-23 02:57:21.811979","192.168.2.3","216.58.197.4","TCP","1434","34325  >  443 [ACK] Seq=124670 Ack=910 Win=661 Len=1368 TSval=8172390 TSecr=601071733 [TCP segment of a reassembled PDU]"
"208","2018-08-23 02:57:21.811983","192.168.2.3","216.58.197.4","TLSv1.2","155","Application Data"
"213","2018-08-23 02:57:21.851418","192.168.2.3","216.58.197.4","TCP","66","34325  >  443 [ACK] Seq=126127 Ack=1061 Win=661 Len=0 TSval=8172394 TSecr=601071861"
"215","2018-08-23 02:57:21.862386","192.168.2.3","216.58.197.4","TCP","66","34325  >  443 [ACK] Seq=126127 Ack=1275 Win=661 Len=0 TSval=8172395 TSecr=601071873"
"218","2018-08-23 02:57:21.873596","192.168.2.3","216.58.197.4","TCP","66","34325  >  443 [ACK] Seq=126127 Ack=1491 Win=661 Len=0 TSval=8172396 TSecr=601071885"
"219","2018-08-23 02:57:21.873972","192.168.2.3","216.58.197.4","TCP","66","34325  >  443 [ACK] Seq=126127 Ack=1679 Win=661 Len=0 TSval=8172396 TSecr=601071885"
"220","2018-08-23 02:57:21.897876","192.168.2.3","216.58.197.4","TCP","1434","34325  >  443 [ACK] Seq=126127 Ack=1679 Win=661 Len=1368 TSval=8172399 TSecr=601071885 [TCP segment of a reassembled PDU]"
"221","2018-08-23 02:57:21.898185","192.168.2.3","216.58.197.4","TCP","1434","34325  >  443 [ACK] Seq=127495 Ack=1679 Win=661 Len=1368 TSval=8172399 TSecr=601071885 [TCP segment of a reassembled PDU]"
"222","2018-08-23 02:57:21.898187","192.168.2.3","216.58.197.4","TLSv1.2","212","Application Data"
"223","2018-08-23 02:57:21.898746","192.168.2.3","216.58.197.4","TCP","1434","34325  >  443 [ACK] Seq=129009 Ack=1679 Win=661 Len=1368 TSval=8172399 TSecr=601071885 [TCP segment of a reassembled PDU]"
"224","2018-08-23 02:57:21.898748","192.168.2.3","216.58.197.4","TLSv1.2","155","Application Data"
"228","2018-08-23 02:57:21.945965","192.168.2.3","216.58.197.4","TCP","66","34325  >  443 [ACK] Seq=130466 Ack=1713 Win=661 Len=0 TSval=8172404 TSecr=601071916"
"231","2018-08-23 02:57:21.953517","192.168.2.3","216.58.197.4","TCP","66","34325  >  443 [ACK] Seq=130466 Ack=1905 Win=661 Len=0 TSval=8172404 TSecr=601071966"
"232","2018-08-23 02:57:21.953730","192.168.2.3","216.58.197.4","TCP","66","34325  >  443 [ACK] Seq=130466 Ack=2006 Win=661 Len=0 TSval=8172404 TSecr=601071966"
"233","2018-08-23 02:57:21.993331","192.168.2.3","216.58.197.4","TCP","1434","34325  >  443 [ACK] Seq=130466 Ack=2006 Win=661 Len=1368 TSval=8172408 TSecr=601071966 [TCP segment of a reassembled PDU]"
"234","2018-08-23 02:57:21.993335","192.168.2.3","216.58.197.4","TCP","1434","34325  >  443 [ACK] Seq=131834 Ack=2006 Win=661 Len=1368 TSval=8172408 TSecr=601071966 [TCP segment of a reassembled PDU]"
"235","2018-08-23 02:57:21.993336","192.168.2.3","216.58.197.4","TLSv1.2","212","Application Data"
"236","2018-08-23 02:57:21.993535","192.168.2.3","216.58.197.4","TCP","1434","34325  >  443 [ACK] Seq=133348 Ack=2006 Win=661 Len=1368 TSval=8172408 TSecr=601071966 [TCP segment of a reassembled PDU]"
"237","2018-08-23 02:57:21.993554","192.168.2.3","216.58.197.4","TLSv1.2","155","Application Data"
"240","2018-08-23 02:57:22.090544","192.168.2.3","216.58.197.4","TCP","1434","34325  >  443 [ACK] Seq=134805 Ack=2006 Win=661 Len=1368 TSval=8172418 TSecr=601072052 [TCP segment of a reassembled PDU]"
"241","2018-08-23 02:57:22.090548","192.168.2.3","216.58.197.4","TCP","1434","34325  >  443 [ACK] Seq=136173 Ack=2006 Win=661 Len=1368 TSval=8172418 TSecr=601072052 [TCP segment of a reassembled PDU]"
"242","2018-08-23 02:57:22.090550","192.168.2.3","216.58.197.4","TLSv1.2","212","Application Data"
"243","2018-08-23 02:57:22.090888","192.168.2.3","216.58.197.4","TCP","1434","34325  >  443 [ACK] Seq=137687 Ack=2006 Win=661 Len=1368 TSval=8172418 TSecr=601072052 [TCP segment of a reassembled PDU]"
"244","2018-08-23 02:57:22.090890","192.168.2.3","216.58.197.4","TLSv1.2","155","Application Data"
"249","2018-08-23 02:57:22.153511","192.168.2.3","216.58.197.4","TCP","66","34325  >  443 [ACK] Seq=139144 Ack=2217 Win=661 Len=0 TSval=8172424 TSecr=601072166"
"250","2018-08-23 02:57:22.153765","192.168.2.3","216.58.197.4","TCP","66","34325  >  443 [ACK] Seq=139144 Ack=2445 Win=661 Len=0 TSval=8172424 TSecr=601072166"
"251","2018-08-23 02:57:22.184847","192.168.2.3","216.58.197.4","TCP","1434","34325  >  443 [ACK] Seq=139144 Ack=2445 Win=661 Len=1368 TSval=8172427 TSecr=601072166 [TCP segment of a reassembled PDU]"
"252","2018-08-23 02:57:22.185267","192.168.2.3","216.58.197.4","TCP","1434","34325  >  443 [ACK] Seq=140512 Ack=2445 Win=661 Len=1368 TSval=8172427 TSecr=601072166 [TCP segment of a reassembled PDU]"
"253","2018-08-23 02:57:22.185273","192.168.2.3","216.58.197.4","TLSv1.2","212","Application Data"
"254","2018-08-23 02:57:22.185673","192.168.2.3","216.58.197.4","TCP","1434","34325  >  443 [ACK] Seq=142026 Ack=2445 Win=661 Len=1368 TSval=8172427 TSecr=601072166 [TCP segment of a reassembled PDU]"
"255","2018-08-23 02:57:22.185676","192.168.2.3","216.58.197.4","TLSv1.2","155","Application Data"
"261","2018-08-23 02:57:22.238152","192.168.2.3","216.58.197.4","TCP","66","34325  >  443 [ACK] Seq=143483 Ack=2703 Win=661 Len=0 TSval=8172433 TSecr=601072249"
"262","2018-08-23 02:57:22.281020","192.168.2.3","216.58.197.4","TCP","1434","34325  >  443 [ACK] Seq=143483 Ack=2703 Win=661 Len=1368 TSval=8172437 TSecr=601072249 [TCP segment of a reassembled PDU]"
"263","2018-08-23 02:57:22.281519","192.168.2.3","216.58.197.4","TCP","1434","34325  >  443 [ACK] Seq=144851 Ack=2703 Win=661 Len=1368 TSval=8172437 TSecr=601072249 [TCP segment of a reassembled PDU]"
"264","2018-08-23 02:57:22.281523","192.168.2.3","216.58.197.4","TLSv1.2","212","Application Data"
"265","2018-08-23 02:57:22.281524","192.168.2.3","216.58.197.4","TCP","1434","34325  >  443 [ACK] Seq=146365 Ack=2703 Win=661 Len=1368 TSval=8172437 TSecr=601072249 [TCP segment of a reassembled PDU]"
"266","2018-08-23 02:57:22.281525","192.168.2.3","216.58.197.4","TLSv1.2","155","Application Data"
"270","2018-08-23 02:57:22.355616","192.168.2.3","216.58.197.4","TCP","1434","34325  >  443 [ACK] Seq=147822 Ack=2703 Win=661 Len=1368 TSval=8172444 TSecr=601072299 [TCP segment of a reassembled PDU]"
"271","2018-08-23 02:57:22.357252","192.168.2.3","216.58.197.4","TCP","1434","34325  >  443 [ACK] Seq=149190 Ack=2703 Win=661 Len=1368 TSval=8172444 TSecr=601072299 [TCP segment of a reassembled PDU]"
"272","2018-08-23 02:57:22.357256","192.168.2.3","216.58.197.4","TLSv1.2","212","Application Data"
"273","2018-08-23 02:57:22.357257","192.168.2.3","216.58.197.4","TCP","1434","34325  >  443 [ACK] Seq=150704 Ack=2703 Win=661 Len=1368 TSval=8172444 TSecr=601072299 [TCP segment of a reassembled PDU]"
"274","2018-08-23 02:57:22.357258","192.168.2.3","216.58.197.4","TLSv1.2","155","Application Data"
"280","2018-08-23 02:57:22.418014","192.168.2.3","216.58.197.4","TCP","66","34325  >  443 [ACK] Seq=152161 Ack=3133 Win=661 Len=0 TSval=8172451 TSecr=601072425"
"283","2018-08-23 02:57:22.427817","192.168.2.3","216.58.197.4","TCP","66","34325  >  443 [ACK] Seq=152161 Ack=3562 Win=661 Len=0 TSval=8172452 TSecr=601072437"
"284","2018-08-23 02:57:22.440739","192.168.2.3","216.58.197.4","TCP","1434","34325  >  443 [ACK] Seq=152161 Ack=3562 Win=661 Len=1368 TSval=8172453 TSecr=601072437 [TCP segment of a reassembled PDU]"
"285","2018-08-23 02:57:22.441116","192.168.2.3","216.58.197.4","TCP","1434","34325  >  443 [ACK] Seq=153529 Ack=3562 Win=661 Len=1368 TSval=8172453 TSecr=601072437 [TCP segment of a reassembled PDU]"
"286","2018-08-23 02:57:22.441118","192.168.2.3","216.58.197.4","TLSv1.2","212","Application Data"
"287","2018-08-23 02:57:22.441474","192.168.2.3","216.58.197.4","TCP","1434","34325  >  443 [ACK] Seq=155043 Ack=3562 Win=661 Len=1368 TSval=8172453 TSecr=601072437 [TCP segment of a reassembled PDU]"
"288","2018-08-23 02:57:22.441476","192.168.2.3","216.58.197.4","TLSv1.2","155","Application Data"
"294","2018-08-23 02:57:22.502344","192.168.2.3","216.58.197.4","TCP","66","34325  >  443 [ACK] Seq=156500 Ack=3882 Win=661 Len=0 TSval=8172459 TSecr=601072509"
"295","2018-08-23 02:57:22.537866","192.168.2.3","216.58.197.4","TCP","1434","34325  >  443 [ACK] Seq=156500 Ack=3882 Win=661 Len=1368 TSval=8172462 TSecr=601072509 [TCP segment of a reassembled PDU]"
"296","2018-08-23 02:57:22.537871","192.168.2.3","216.58.197.4","TCP","1434","34325  >  443 [ACK] Seq=157868 Ack=3882 Win=661 Len=1368 TSval=8172462 TSecr=601072509 [TCP segment of a reassembled PDU]"
"297","2018-08-23 02:57:22.537872","192.168.2.3","216.58.197.4","TLSv1.2","212","Application Data"
"298","2018-08-23 02:57:22.537912","192.168.2.3","216.58.197.4","TCP","1434","34325  >  443 [ACK] Seq=159382 Ack=3882 Win=661 Len=1368 TSval=8172462 TSecr=601072509 [TCP segment of a reassembled PDU]"
"299","2018-08-23 02:57:22.538109","192.168.2.3","216.58.197.4","TLSv1.2","155","Application Data"
"303","2018-08-23 02:57:22.613469","192.168.2.3","216.58.197.4","TCP","1434","34325  >  443 [ACK] Seq=160839 Ack=3882 Win=661 Len=1368 TSval=8172470 TSecr=601072556 [TCP segment of a reassembled PDU]"
"304","2018-08-23 02:57:22.613875","192.168.2.3","216.58.197.4","TCP","1434","34325  >  443 [ACK] Seq=162207 Ack=3882 Win=661 Len=1368 TSval=8172470 TSecr=601072556 [TCP segment of a reassembled PDU]"
"305","2018-08-23 02:57:22.613877","192.168.2.3","216.58.197.4","TLSv1.2","212","Application Data"
"306","2018-08-23 02:57:22.614342","192.168.2.3","216.58.197.4","TCP","1434","34325  >  443 [ACK] Seq=163721 Ack=3882 Win=661 Len=1368 TSval=8172470 TSecr=601072556 [TCP segment of a reassembled PDU]"
"307","2018-08-23 02:57:22.614344","192.168.2.3","216.58.197.4","TLSv1.2","155","Application Data"
"313","2018-08-23 02:57:22.667945","192.168.2.3","216.58.197.4","TCP","66","34325  >  443 [ACK] Seq=165178 Ack=4316 Win=661 Len=0 TSval=8172476 TSecr=601072680"
"314","2018-08-23 02:57:22.697034","192.168.2.3","216.58.197.4","TCP","1434","34325  >  443 [ACK] Seq=165178 Ack=4316 Win=661 Len=1368 TSval=8172479 TSecr=601072680 [TCP segment of a reassembled PDU]"
"315","2018-08-23 02:57:22.697411","192.168.2.3","216.58.197.4","TCP","1434","34325  >  443 [ACK] Seq=166546 Ack=4316 Win=661 Len=1368 TSval=8172479 TSecr=601072680 [TCP segment of a reassembled PDU]"
"316","2018-08-23 02:57:22.697413","192.168.2.3","216.58.197.4","TLSv1.2","212","Application Data"
"317","2018-08-23 02:57:22.697898","192.168.2.3","216.58.197.4","TCP","1434","34325  >  443 [ACK] Seq=168060 Ack=4316 Win=661 Len=1368 TSval=8172479 TSecr=601072680 [TCP segment of a reassembled PDU]"
"318","2018-08-23 02:57:22.697901","192.168.2.3","216.58.197.4","TLSv1.2","155","Application Data"
"324","2018-08-23 02:57:22.758798","192.168.2.3","216.58.197.4","TCP","66","34325  >  443 [ACK] Seq=169517 Ack=4650 Win=661 Len=0 TSval=8172485 TSecr=601072771"
"325","2018-08-23 02:57:22.793187","192.168.2.3","216.58.197.4","TCP","1434","34325  >  443 [ACK] Seq=169517 Ack=4650 Win=661 Len=1368 TSval=8172488 TSecr=601072771 [TCP segment of a reassembled PDU]"
"326","2018-08-23 02:57:22.793574","192.168.2.3","216.58.197.4","TCP","1434","34325  >  443 [ACK] Seq=170885 Ack=4650 Win=661 Len=1368 TSval=8172488 TSecr=601072771 [TCP segment of a reassembled PDU]"
"327","2018-08-23 02:57:22.793576","192.168.2.3","216.58.197.4","TLSv1.2","212","Application Data"
"328","2018-08-23 02:57:22.793577","192.168.2.3","216.58.197.4","TCP","1434","34325  >  443 [ACK] Seq=172399 Ack=4650 Win=661 Len=1368 TSval=8172488 TSecr=601072771 [TCP segment of a reassembled PDU]"
"329","2018-08-23 02:57:22.793734","192.168.2.3","216.58.197.4","TLSv1.2","155","Application Data"
"334","2018-08-23 02:57:22.823131","192.168.2.3","192.168.2.1","TCP","183","8009  >  53029 [PSH, ACK] Seq=118 Ack=235 Win=277 Len=117 TSval=8172491 TSecr=2318975358 [TCP segment of a reassembled PDU]"
"338","2018-08-23 02:57:22.860235","192.168.2.3","216.58.197.4","TCP","66","34325  >  443 [ACK] Seq=173856 Ack=5142 Win=661 Len=0 TSval=8172495 TSecr=601072861"
"339","2018-08-23 02:57:22.898142","192.168.2.3","216.58.197.4","TCP","1434","34325  >  443 [ACK] Seq=173856 Ack=5142 Win=661 Len=1368 TSval=8172499 TSecr=601072861 [TCP segment of a reassembled PDU]"
"340","2018-08-23 02:57:22.898579","192.168.2.3","216.58.197.4","TCP","1434","34325  >  443 [ACK] Seq=175224 Ack=5142 Win=661 Len=1368 TSval=8172499 TSecr=601072861 [TCP segment of a reassembled PDU]"
"341","2018-08-23 02:57:22.898582","192.168.2.3","216.58.197.4","TLSv1.2","212","Application Data"
"342","2018-08-23 02:57:22.899014","192.168.2.3","216.58.197.4","TCP","1434","34325  >  443 [ACK] Seq=176738 Ack=5142 Win=661 Len=1368 TSval=8172499 TSecr=601072861 [TCP segment of a reassembled PDU]"
"343","2018-08-23 02:57:22.899016","192.168.2.3","216.58.197.4","TLSv1.2","155","Application Data"
"347","2018-08-23 02:57:22.994985","192.168.2.3","216.58.197.4","TCP","1434","34325  >  443 [ACK] Seq=178195 Ack=5142 Win=661 Len=1368 TSval=8172508 TSecr=601072917 [TCP segment of a reassembled PDU]"
"348","2018-08-23 02:57:22.995374","192.168.2.3","216.58.197.4","TCP","1434","34325  >  443 [ACK] Seq=179563 Ack=5142 Win=661 Len=1368 TSval=8172508 TSecr=601072917 [TCP segment of a reassembled PDU]"
"349","2018-08-23 02:57:22.995376","192.168.2.3","216.58.197.4","TLSv1.2","212","Application Data"
"350","2018-08-23 02:57:22.995377","192.168.2.3","216.58.197.4","TCP","1434","34325  >  443 [ACK] Seq=181077 Ack=5142 Win=661 Len=1368 TSval=8172508 TSecr=601072917 [TCP segment of a reassembled PDU]"
"351","2018-08-23 02:57:22.995578","192.168.2.3","216.58.197.4","TLSv1.2","155","Application Data"
"356","2018-08-23 02:57:23.082134","192.168.2.3","216.58.197.4","TCP","66","34325  >  443 [ACK] Seq=182534 Ack=5202 Win=661 Len=0 TSval=8172515 TSecr=601073035"
"357","2018-08-23 02:57:23.122123","192.168.2.3","216.58.197.4","TCP","1434","34325  >  443 [ACK] Seq=182534 Ack=5202 Win=661 Len=1368 TSval=8172518 TSecr=601073035 [TCP segment of a reassembled PDU]"
"358","2018-08-23 02:57:23.122129","192.168.2.3","216.58.197.4","TCP","1434","34325  >  443 [ACK] Seq=183902 Ack=5202 Win=661 Len=1368 TSval=8172518 TSecr=601073035 [TCP segment of a reassembled PDU]"
"359","2018-08-23 02:57:23.122276","192.168.2.3","216.58.197.4","TLSv1.2","212","Application Data"
"360","2018-08-23 02:57:23.122504","192.168.2.3","216.58.197.4","TCP","1434","34325  >  443 [ACK] Seq=185416 Ack=5202 Win=661 Len=1368 TSval=8172518 TSecr=601073035 [TCP segment of a reassembled PDU]"
"361","2018-08-23 02:57:23.122506","192.168.2.3","216.58.197.4","TLSv1.2","155","Application Data"
"365","2018-08-23 02:57:23.222863","192.168.2.3","216.58.197.4","TCP","1434","34325  >  443 [ACK] Seq=186873 Ack=5202 Win=661 Len=1368 TSval=8172530 TSecr=601073181 [TCP segment of a reassembled PDU]"
"366","2018-08-23 02:57:23.223131","192.168.2.3","216.58.197.4","TCP","1434","34325  >  443 [ACK] Seq=188241 Ack=5202 Win=661 Len=1368 TSval=8172530 TSecr=601073181 [TCP segment of a reassembled PDU]"
"367","2018-08-23 02:57:23.223146","192.168.2.3","216.58.197.4","TLSv1.2","212","Application Data"
"368","2018-08-23 02:57:23.223147","192.168.2.3","216.58.197.4","TCP","1434","34325  >  443 [ACK] Seq=189755 Ack=5202 Win=661 Len=1368 TSval=8172530 TSecr=601073181 [TCP segment of a reassembled PDU]"
"369","2018-08-23 02:57:23.223309","192.168.2.3","216.58.197.4","TLSv1.2","85","Application Data"
"375","2018-08-23 02:57:23.281243","192.168.2.3","216.58.197.4","TCP","66","34325  >  443 [ACK] Seq=191142 Ack=5386 Win=661 Len=0 TSval=8172537 TSecr=601073294"
"376","2018-08-23 02:57:23.281469","192.168.2.3","216.58.197.4","TCP","66","34325  >  443 [ACK] Seq=191142 Ack=5434 Win=661 Len=0 TSval=8172537 TSecr=601073294"
"377","2018-08-23 02:57:23.305071","192.168.2.3","216.58.197.4","TCP","1434","34325  >  443 [ACK] Seq=191142 Ack=5434 Win=661 Len=1368 TSval=8172539 TSecr=601073294 [TCP segment of a reassembled PDU]"
"378","2018-08-23 02:57:23.305387","192.168.2.3","216.58.197.4","TCP","1434","34325  >  443 [ACK] Seq=192510 Ack=5434 Win=661 Len=1368 TSval=8172539 TSecr=601073294 [TCP segment of a reassembled PDU]"
"379","2018-08-23 02:57:23.305390","192.168.2.3","216.58.197.4","TLSv1.2","212","Application Data"
"380","2018-08-23 02:57:23.305699","192.168.2.3","216.58.197.4","TCP","1434","34325  >  443 [ACK] Seq=194024 Ack=5434 Win=661 Len=1368 TSval=8172539 TSecr=601073294 [TCP segment of a reassembled PDU]"
"381","2018-08-23 02:57:23.305702","192.168.2.3","216.58.197.4","TLSv1.2","155","Application Data"
"387","2018-08-23 02:57:23.366473","192.168.2.3","216.58.197.4","TCP","66","34325  >  443 [ACK] Seq=195481 Ack=5665 Win=661 Len=0 TSval=8172546 TSecr=601073376"
"388","2018-08-23 02:57:23.410182","192.168.2.3","216.58.197.4","TCP","1434","34325  >  443 [ACK] Seq=195481 Ack=5665 Win=661 Len=1368 TSval=8172550 TSecr=601073376 [TCP segment of a reassembled PDU]"
"389","2018-08-23 02:57:23.410550","192.168.2.3","216.58.197.4","TCP","1434","34325  >  443 [ACK] Seq=196849 Ack=5665 Win=661 Len=1368 TSval=8172550 TSecr=601073376 [TCP segment of a reassembled PDU]"
"390","2018-08-23 02:57:23.410553","192.168.2.3","216.58.197.4","TLSv1.2","212","Application Data"
"391","2018-08-23 02:57:23.410936","192.168.2.3","216.58.197.4","TCP","1434","34325  >  443 [ACK] Seq=198363 Ack=5665 Win=661 Len=1368 TSval=8172550 TSecr=601073376 [TCP segment of a reassembled PDU]"
"392","2018-08-23 02:57:23.410939","192.168.2.3","216.58.197.4","TLSv1.2","155","Application Data"
"396","2018-08-23 02:57:23.507001","192.168.2.3","216.58.197.4","TCP","1434","34325  >  443 [ACK] Seq=199820 Ack=5665 Win=661 Len=1368 TSval=8172560 TSecr=601073430 [TCP segment of a reassembled PDU]"
"397","2018-08-23 02:57:23.507418","192.168.2.3","216.58.197.4","TCP","1434","34325  >  443 [ACK] Seq=201188 Ack=5665 Win=661 Len=1368 TSval=8172560 TSecr=601073430 [TCP segment of a reassembled PDU]"
"398","2018-08-23 02:57:23.507420","192.168.2.3","216.58.197.4","TLSv1.2","212","Application Data"
"399","2018-08-23 02:57:23.507495","192.168.2.3","216.58.197.4","TCP","1434","34325  >  443 [ACK] Seq=202702 Ack=5665 Win=661 Len=1368 TSval=8172560 TSecr=601073430 [TCP segment of a reassembled PDU]"
"400","2018-08-23 02:57:23.507771","192.168.2.3","216.58.197.4","TLSv1.2","155","Application Data"
"406","2018-08-23 02:57:23.561558","192.168.2.3","216.58.197.4","TCP","66","34325  >  443 [ACK] Seq=204159 Ack=6184 Win=661 Len=0 TSval=8172565 TSecr=601073571"
"407","2018-08-23 02:57:23.599757","192.168.2.3","216.58.197.4","TCP","1434","34325  >  443 [ACK] Seq=204159 Ack=6184 Win=661 Len=1368 TSval=8172569 TSecr=601073571 [TCP segment of a reassembled PDU]"
"408","2018-08-23 02:57:23.599762","192.168.2.3","216.58.197.4","TCP","1434","34325  >  443 [ACK] Seq=205527 Ack=6184 Win=661 Len=1368 TSval=8172569 TSecr=601073571 [TCP segment of a reassembled PDU]"
"409","2018-08-23 02:57:23.599763","192.168.2.3","216.58.197.4","TLSv1.2","212","Application Data"
"410","2018-08-23 02:57:23.599882","192.168.2.3","216.58.197.4","TCP","1434","34325  >  443 [ACK] Seq=207041 Ack=6184 Win=661 Len=1368 TSval=8172569 TSecr=601073571 [TCP segment of a reassembled PDU]"
"411","2018-08-23 02:57:23.600169","192.168.2.3","216.58.197.4","TLSv1.2","155","Application Data"
"412","2018-08-23 02:57:23.600171","192.168.2.3","216.58.197.4","TLSv1.2","291","Application Data"
"413","2018-08-23 02:57:23.600172","192.168.2.3","216.58.197.4","TLSv1.2","102","Application Data"
"419","2018-08-23 02:57:23.625546","192.168.2.3","216.58.197.4","TCP","66","34325  >  443 [ACK] Seq=208759 Ack=7138 Win=661 Len=0 TSval=8172571 TSecr=601073631"
"422","2018-08-23 02:57:23.862109","192.168.2.3","216.58.197.4","TCP","66","34325  >  443 [ACK] Seq=208759 Ack=7517 Win=661 Len=0 TSval=8172595 TSecr=601073862"
