"No.","Time","Source","Destination","Protocol","Length","Info"
"2","2018-08-23 02:58:22.669401","192.168.2.3","192.168.2.1","TCP","183","8009  >  53029 [PSH, ACK] Seq=1 Ack=118 Win=277 Len=117 TSval=8178476 TSecr=2319035069 [TCP segment of a reassembled PDU]"
"6","2018-08-23 02:58:24.397150","192.168.2.3","104.199.240.211","TCP","66","48848  >  443 [ACK] Seq=1 Ack=32 Win=511 Len=0 TSval=8178649 TSecr=302664950"
"7","2018-08-23 02:58:24.436302","192.168.2.3","104.199.240.211","TCP","66","48848  >  443 [ACK] Seq=1 Ack=33 Win=511 Len=0 TSval=8178653 TSecr=302664950"
"10","2018-08-23 02:58:24.493944","192.168.2.3","104.199.240.211","TCP","66","48843  >  443 [ACK] Seq=1 Ack=32 Win=661 Len=0 TSval=8178658 TSecr=301364436"
"11","2018-08-23 02:58:24.528293","192.168.2.3","104.199.240.211","TCP","66","48843  >  443 [ACK] Seq=1 Ack=33 Win=661 Len=0 TSval=8178662 TSecr=301364436"
"12","2018-08-23 02:58:26.284712","192.168.2.3","216.58.197.4","TLSv1.2","156","Application Data"
"13","2018-08-23 02:58:26.285055","192.168.2.3","216.58.197.4","TLSv1.2","104","Application Data"
"17","2018-08-23 02:58:26.295106","192.168.2.3","216.58.197.4","TLSv1.2","158","Application Data"
"18","2018-08-23 02:58:26.303595","192.168.2.3","216.58.197.4","TCP","1434","34325  >  443 [ACK] Seq=221 Ack=39 Win=661 Len=1368 TSval=8178839 TSecr=601136303 [TCP segment of a reassembled PDU]"
"19","2018-08-23 02:58:26.304068","192.168.2.3","216.58.197.4","TCP","1434","34325  >  443 [ACK] Seq=1589 Ack=39 Win=661 Len=1368 TSval=8178839 TSecr=601136303 [TCP segment of a reassembled PDU]"
"20","2018-08-23 02:58:26.304073","192.168.2.3","216.58.197.4","TLSv1.2","212","Application Data"
"21","2018-08-23 02:58:26.304419","192.168.2.3","216.58.197.4","TCP","1434","34325  >  443 [ACK] Seq=3103 Ack=39 Win=661 Len=1368 TSval=8178839 TSecr=601136303 [TCP segment of a reassembled PDU]"
"22","2018-08-23 02:58:26.304423","192.168.2.3","216.58.197.4","TLSv1.2","404","Application Data"
"23","2018-08-23 02:58:26.304855","192.168.2.3","216.58.197.4","TCP","1434","34325  >  443 [ACK] Seq=4809 Ack=39 Win=661 Len=1368 TSval=8178839 TSecr=601136303 [TCP segment of a reassembled PDU]"
"24","2018-08-23 02:58:26.304859","192.168.2.3","216.58.197.4","TCP","1434","34325  >  443 [ACK] Seq=6177 Ack=39 Win=661 Len=1368 TSval=8178839 TSecr=601136303 [TCP segment of a reassembled PDU]"
"25","2018-08-23 02:58:26.304860","192.168.2.3","216.58.197.4","TLSv1.2","212","Application Data"
"26","2018-08-23 02:58:26.305323","192.168.2.3","216.58.197.4","TCP","1434","34325  >  443 [ACK] Seq=7691 Ack=39 Win=661 Len=1368 TSval=8178839 TSecr=601136303 [TCP segment of a reassembled PDU]"
"32","2018-08-23 02:58:26.313403","192.168.2.3","216.58.197.4","TLSv1.2","1434","Application Data [TCP segment of a reassembled PDU]"
"33","2018-08-23 02:58:26.313787","192.168.2.3","216.58.197.4","TCP","1434","34325  >  443 [ACK] Seq=10427 Ack=39 Win=661 Len=1368 TSval=8178840 TSecr=601136321 [TCP segment of a reassembled PDU]"
"34","2018-08-23 02:58:26.313791","192.168.2.3","216.58.197.4","TLSv1.2","1434","Application Data [TCP segment of a reassembled PDU]"
"35","2018-08-23 02:58:26.313875","192.168.2.3","216.58.197.4","TLSv1.2","1434","Application Data [TCP segment of a reassembled PDU]"
"36","2018-08-23 02:58:26.314048","192.168.2.3","216.58.197.4","TCP","1434","34325  >  443 [ACK] Seq=14531 Ack=39 Win=661 Len=1368 TSval=8178840 TSecr=601136322 [TCP segment of a reassembled PDU]"
"37","2018-08-23 02:58:26.314237","192.168.2.3","216.58.197.4","TLSv1.2","1434","Application Data [TCP segment of a reassembled PDU]"
"38","2018-08-23 02:58:26.314446","192.168.2.3","216.58.197.4","TLSv1.2","1434","Application Data [TCP segment of a reassembled PDU]"
"39","2018-08-23 02:58:26.314816","192.168.2.3","216.58.197.4","TCP","1434","34325  >  443 [ACK] Seq=18635 Ack=39 Win=661 Len=1368 TSval=8178840 TSecr=601136322 [TCP segment of a reassembled PDU]"
"40","2018-08-23 02:58:26.318053","192.168.2.3","216.58.197.4","TLSv1.2","1434","Application Data [TCP segment of a reassembled PDU]"
"43","2018-08-23 02:58:26.318198","192.168.2.3","216.58.197.4","TLSv1.2","1434","Application Data [TCP segment of a reassembled PDU]"
"45","2018-08-23 02:58:26.318634","192.168.2.3","216.58.197.4","TCP","1434","34325  >  443 [ACK] Seq=22739 Ack=39 Win=661 Len=1368 TSval=8178840 TSecr=601136323 [TCP segment of a reassembled PDU]"
"46","2018-08-23 02:58:26.318636","192.168.2.3","216.58.197.4","TLSv1.2","1434","Application Data [TCP segment of a reassembled PDU]"
"47","2018-08-23 02:58:26.318752","192.168.2.3","216.58.197.4","TLSv1.2","1434","Application Data [TCP segment of a reassembled PDU]"
"48","2018-08-23 02:58:26.319137","192.168.2.3","216.58.197.4","TCP","1434","34325  >  443 [ACK] Seq=26843 Ack=39 Win=661 Len=1368 TSval=8178840 TSecr=601136323 [TCP segment of a reassembled PDU]"
"50","2018-08-23 02:58:26.319356","192.168.2.3","216.58.197.4","TLSv1.2","1434","Application Data [TCP segment of a reassembled PDU]"
"54","2018-08-23 02:58:26.325542","192.168.2.3","216.58.197.4","TLSv1.2","1434","Application Data [TCP segment of a reassembled PDU]"
"55","2018-08-23 02:58:26.325549","192.168.2.3","216.58.197.4","TCP","1434","34325  >  443 [ACK] Seq=30947 Ack=39 Win=661 Len=1368 TSval=8178841 TSecr=601136332 [TCP segment of a reassembled PDU]"
"56","2018-08-23 02:58:26.325873","192.168.2.3","216.58.197.4","TCP","1434","34325  >  443 [ACK] Seq=32315 Ack=39 Win=661 Len=1368 TSval=8178841 TSecr=601136332 [TCP segment of a reassembled PDU]"
"57","2018-08-23 02:58:26.327480","192.168.2.3","216.58.197.4","TLSv1.2","1434","Application Data [TCP segment of a reassembled PDU]"
"58","2018-08-23 02:58:26.327484","192.168.2.3","216.58.197.4","TLSv1.2","1434","Application Data [TCP segment of a reassembled PDU]"
"59","2018-08-23 02:58:26.327639","192.168.2.3","216.58.197.4","TCP","1434","34325  >  443 [ACK] Seq=36419 Ack=39 Win=661 Len=1368 TSval=8178841 TSecr=601136332 [TCP segment of a reassembled PDU]"
"60","2018-08-23 02:58:26.327994","192.168.2.3","216.58.197.4","TLSv1.2","1434","Application Data [TCP segment of a reassembled PDU]"
"61","2018-08-23 02:58:26.327996","192.168.2.3","216.58.197.4","TLSv1.2","1434","Application Data [TCP segment of a reassembled PDU]"
"62","2018-08-23 02:58:26.328399","192.168.2.3","216.58.197.4","TCP","1434","34325  >  443 [ACK] Seq=40523 Ack=39 Win=661 Len=1368 TSval=8178841 TSecr=601136332 [TCP segment of a reassembled PDU]"
"63","2018-08-23 02:58:26.328824","192.168.2.3","216.58.197.4","TLSv1.2","1434","Application Data [TCP segment of a reassembled PDU]"
"64","2018-08-23 02:58:26.328827","192.168.2.3","216.58.197.4","TLSv1.2","1434","Application Data [TCP segment of a reassembled PDU]"
"65","2018-08-23 02:58:26.328955","192.168.2.3","216.58.197.4","TCP","1434","34325  >  443 [ACK] Seq=44627 Ack=39 Win=661 Len=1368 TSval=8178841 TSecr=601136333 [TCP segment of a reassembled PDU]"
"66","2018-08-23 02:58:26.329217","192.168.2.3","216.58.197.4","TLSv1.2","1434","Application Data [TCP segment of a reassembled PDU]"
"67","2018-08-23 02:58:26.329220","192.168.2.3","216.58.197.4","TLSv1.2","1434","Application Data [TCP segment of a reassembled PDU]"
"68","2018-08-23 02:58:26.329347","192.168.2.3","216.58.197.4","TCP","1434","34325  >  443 [ACK] Seq=48731 Ack=39 Win=661 Len=1368 TSval=8178841 TSecr=601136336 [TCP segment of a reassembled PDU]"
"69","2018-08-23 02:58:26.329648","192.168.2.3","216.58.197.4","TLSv1.2","1434","Application Data [TCP segment of a reassembled PDU]"
"71","2018-08-23 02:58:26.329803","192.168.2.3","216.58.197.4","TLSv1.2","1434","Application Data [TCP segment of a reassembled PDU]"
"72","2018-08-23 02:58:26.330072","192.168.2.3","216.58.197.4","TCP","1434","34325  >  443 [ACK] Seq=52835 Ack=39 Win=661 Len=1368 TSval=8178841 TSecr=601136337 [TCP segment of a reassembled PDU]"
"73","2018-08-23 02:58:26.330074","192.168.2.3","216.58.197.4","TLSv1.2","1434","Application Data [TCP segment of a reassembled PDU]"
"83","2018-08-23 02:58:26.336799","192.168.2.3","216.58.197.4","TLSv1.2","1434","Application Data [TCP segment of a reassembled PDU]"
"84","2018-08-23 02:58:26.337169","192.168.2.3","216.58.197.4","TCP","1434","34325  >  443 [ACK] Seq=56939 Ack=39 Win=661 Len=1368 TSval=8178843 TSecr=601136343 [TCP segment of a reassembled PDU]"
"85","2018-08-23 02:58:26.337173","192.168.2.3","216.58.197.4","TCP","1434","34325  >  443 [ACK] Seq=58307 Ack=39 Win=661 Len=1368 TSval=8178843 TSecr=601136343 [TCP segment of a reassembled PDU]"
"86","2018-08-23 02:58:26.337444","192.168.2.3","216.58.197.4","TLSv1.2","1434","Application Data [TCP segment of a reassembled PDU]"
"87","2018-08-23 02:58:26.337717","192.168.2.3","216.58.197.4","TLSv1.2","1434","Application Data, Application Data"
"88","2018-08-23 02:58:26.338067","192.168.2.3","216.58.197.4","TCP","1434","34325  >  443 [ACK] Seq=62411 Ack=39 Win=661 Len=1368 TSval=8178843 TSecr=601136345 [TCP segment of a reassembled PDU]"
"89","2018-08-23 02:58:26.339076","192.168.2.3","216.58.197.4","TLSv1.2","1434","Application Data [TCP segment of a reassembled PDU]"
"90","2018-08-23 02:58:26.339426","192.168.2.3","216.58.197.4","TLSv1.2","1434","Application Data [TCP segment of a reassembled PDU]"
"91","2018-08-23 02:58:26.339429","192.168.2.3","216.58.197.4","TCP","1434","34325  >  443 [ACK] Seq=66515 Ack=39 Win=661 Len=1368 TSval=8178843 TSecr=601136346 [TCP segment of a reassembled PDU]"
"92","2018-08-23 02:58:26.339786","192.168.2.3","216.58.197.4","TLSv1.2","1434","Application Data [TCP segment of a reassembled PDU]"
"97","2018-08-23 02:58:26.343731","192.168.2.3","216.58.197.4","TLSv1.2","1187","Application Data"
"100","2018-08-23 02:58:26.440616","192.168.2.3","216.58.197.4","TCP","1434","34325  >  443 [ACK] Seq=70372 Ack=39 Win=661 Len=1368 TSval=8178853 TSecr=601136402 [TCP segment of a reassembled PDU]"
"101","2018-08-23 02:58:26.440993","192.168.2.3","216.58.197.4","TCP","1434","34325  >  443 [ACK] Seq=71740 Ack=39 Win=661 Len=1368 TSval=8178853 TSecr=601136402 [TCP segment of a reassembled PDU]"
"102","2018-08-23 02:58:26.440996","192.168.2.3","216.58.197.4","TLSv1.2","212","Application Data"
"103","2018-08-23 02:58:26.441484","192.168.2.3","216.58.197.4","TCP","1434","34325  >  443 [ACK] Seq=73254 Ack=39 Win=661 Len=1368 TSval=8178853 TSecr=601136402 [TCP segment of a reassembled PDU]"
"104","2018-08-23 02:58:26.441486","192.168.2.3","216.58.197.4","TLSv1.2","155","Application Data"
"108","2018-08-23 02:58:26.561189","192.168.2.3","216.58.197.4","TCP","1434","34325  >  443 [ACK] Seq=74711 Ack=39 Win=661 Len=1368 TSval=8178863 TSecr=601136459 [TCP segment of a reassembled PDU]"
"109","2018-08-23 02:58:26.561194","192.168.2.3","216.58.197.4","TCP","1434","34325  >  443 [ACK] Seq=76079 Ack=39 Win=661 Len=1368 TSval=8178863 TSecr=601136459 [TCP segment of a reassembled PDU]"
"110","2018-08-23 02:58:26.561324","192.168.2.3","216.58.197.4","TLSv1.2","212","Application Data"
"111","2018-08-23 02:58:26.561520","192.168.2.3","216.58.197.4","TCP","1434","34325  >  443 [ACK] Seq=77593 Ack=39 Win=661 Len=1368 TSval=8178863 TSecr=601136459 [TCP segment of a reassembled PDU]"
"112","2018-08-23 02:58:26.561522","192.168.2.3","216.58.197.4","TLSv1.2","155","Application Data"
"119","2018-08-23 02:58:26.583750","192.168.2.3","216.58.197.4","TCP","66","34325  >  443 [ACK] Seq=79050 Ack=256 Win=661 Len=0 TSval=8178867 TSecr=601136596"
"121","2018-08-23 02:58:26.605604","192.168.2.3","216.58.197.4","TCP","66","34325  >  443 [ACK] Seq=79050 Ack=469 Win=661 Len=0 TSval=8178869 TSecr=601136596"
"122","2018-08-23 02:58:26.654036","192.168.2.3","216.58.197.4","TCP","1434","34325  >  443 [ACK] Seq=79050 Ack=469 Win=661 Len=1368 TSval=8178872 TSecr=601136596 [TCP segment of a reassembled PDU]"
"123","2018-08-23 02:58:26.654039","192.168.2.3","216.58.197.4","TCP","1434","34325  >  443 [ACK] Seq=80418 Ack=469 Win=661 Len=1368 TSval=8178872 TSecr=601136596 [TCP segment of a reassembled PDU]"
"124","2018-08-23 02:58:26.654040","192.168.2.3","216.58.197.4","TLSv1.2","212","Application Data"
"125","2018-08-23 02:58:26.654188","192.168.2.3","216.58.197.4","TCP","1434","34325  >  443 [ACK] Seq=81932 Ack=469 Win=661 Len=1368 TSval=8178872 TSecr=601136596 [TCP segment of a reassembled PDU]"
"126","2018-08-23 02:58:26.654442","192.168.2.3","216.58.197.4","TLSv1.2","155","Application Data"
"131","2018-08-23 02:58:26.728815","192.168.2.3","216.58.197.4","TCP","1434","34325  >  443 [ACK] Seq=83389 Ack=775 Win=661 Len=1368 TSval=8178882 TSecr=601136719 [TCP segment of a reassembled PDU]"
"132","2018-08-23 02:58:26.729447","192.168.2.3","216.58.197.4","TCP","1434","34325  >  443 [ACK] Seq=84757 Ack=775 Win=661 Len=1368 TSval=8178882 TSecr=601136719 [TCP segment of a reassembled PDU]"
"133","2018-08-23 02:58:26.729462","192.168.2.3","216.58.197.4","TLSv1.2","212","Application Data"
"134","2018-08-23 02:58:26.729463","192.168.2.3","216.58.197.4","TCP","1434","34325  >  443 [ACK] Seq=86271 Ack=775 Win=661 Len=1368 TSval=8178882 TSecr=601136719 [TCP segment of a reassembled PDU]"
"135","2018-08-23 02:58:26.729464","192.168.2.3","216.58.197.4","TLSv1.2","155","Application Data"
"139","2018-08-23 02:58:26.824322","192.168.2.3","216.58.197.4","TCP","1434","34325  >  443 [ACK] Seq=87728 Ack=775 Win=661 Len=1368 TSval=8178891 TSecr=601136747 [TCP segment of a reassembled PDU]"
"140","2018-08-23 02:58:26.824691","192.168.2.3","216.58.197.4","TCP","1434","34325  >  443 [ACK] Seq=89096 Ack=775 Win=661 Len=1368 TSval=8178891 TSecr=601136747 [TCP segment of a reassembled PDU]"
"141","2018-08-23 02:58:26.824693","192.168.2.3","216.58.197.4","TLSv1.2","212","Application Data"
"142","2018-08-23 02:58:26.825140","192.168.2.3","216.58.197.4","TCP","1434","34325  >  443 [ACK] Seq=90610 Ack=775 Win=661 Len=1368 TSval=8178891 TSecr=601136747 [TCP segment of a reassembled PDU]"
"143","2018-08-23 02:58:26.825145","192.168.2.3","216.58.197.4","TLSv1.2","155","Application Data"
"149","2018-08-23 02:58:26.918730","192.168.2.3","216.58.197.4","TCP","66","34325  >  443 [ACK] Seq=92067 Ack=1020 Win=661 Len=0 TSval=8178901 TSecr=601136872"
"150","2018-08-23 02:58:26.934125","192.168.2.3","216.58.197.4","TCP","1434","34325  >  443 [ACK] Seq=92067 Ack=1020 Win=661 Len=1368 TSval=8178902 TSecr=601136872 [TCP segment of a reassembled PDU]"
"151","2018-08-23 02:58:26.934512","192.168.2.3","216.58.197.4","TCP","1434","34325  >  443 [ACK] Seq=93435 Ack=1020 Win=661 Len=1368 TSval=8178902 TSecr=601136872 [TCP segment of a reassembled PDU]"
"152","2018-08-23 02:58:26.934514","192.168.2.3","216.58.197.4","TLSv1.2","212","Application Data"
"153","2018-08-23 02:58:26.937904","192.168.2.3","216.58.197.4","TCP","1434","34325  >  443 [ACK] Seq=94949 Ack=1020 Win=661 Len=1368 TSval=8178902 TSecr=601136872 [TCP segment of a reassembled PDU]"
"154","2018-08-23 02:58:26.937907","192.168.2.3","216.58.197.4","TLSv1.2","155","Application Data"
"158","2018-08-23 02:58:27.027253","192.168.2.3","216.58.197.4","TCP","1434","34325  >  443 [ACK] Seq=96406 Ack=1020 Win=661 Len=1368 TSval=8178912 TSecr=601136996 [TCP segment of a reassembled PDU]"
"159","2018-08-23 02:58:27.027574","192.168.2.3","216.58.197.4","TCP","1434","34325  >  443 [ACK] Seq=97774 Ack=1020 Win=661 Len=1368 TSval=8178912 TSecr=601136996 [TCP segment of a reassembled PDU]"
"160","2018-08-23 02:58:27.027577","192.168.2.3","216.58.197.4","TLSv1.2","212","Application Data"
"161","2018-08-23 02:58:27.027578","192.168.2.3","216.58.197.4","TCP","1434","34325  >  443 [ACK] Seq=99288 Ack=1020 Win=661 Len=1368 TSval=8178912 TSecr=601136996 [TCP segment of a reassembled PDU]"
"162","2018-08-23 02:58:27.027690","192.168.2.3","216.58.197.4","TLSv1.2","155","Application Data"
"165","2018-08-23 02:58:27.124009","192.168.2.3","216.58.197.4","TCP","1434","34325  >  443 [ACK] Seq=100745 Ack=1020 Win=661 Len=1368 TSval=8178921 TSecr=601137045 [TCP segment of a reassembled PDU]"
"166","2018-08-23 02:58:27.124407","192.168.2.3","216.58.197.4","TCP","1434","34325  >  443 [ACK] Seq=102113 Ack=1020 Win=661 Len=1368 TSval=8178921 TSecr=601137045 [TCP segment of a reassembled PDU]"
"167","2018-08-23 02:58:27.124409","192.168.2.3","216.58.197.4","TLSv1.2","212","Application Data"
"168","2018-08-23 02:58:27.124410","192.168.2.3","216.58.197.4","TCP","1434","34325  >  443 [ACK] Seq=103627 Ack=1020 Win=661 Len=1368 TSval=8178921 TSecr=601137045 [TCP segment of a reassembled PDU]"
"169","2018-08-23 02:58:27.124678","192.168.2.3","216.58.197.4","TLSv1.2","155","Application Data"
"173","2018-08-23 02:58:27.208587","192.168.2.3","216.58.197.4","TCP","1434","34325  >  443 [ACK] Seq=105084 Ack=1020 Win=661 Len=1368 TSval=8178930 TSecr=601137142 [TCP segment of a reassembled PDU]"
"174","2018-08-23 02:58:27.208797","192.168.2.3","216.58.197.4","TCP","1434","34325  >  443 [ACK] Seq=106452 Ack=1020 Win=661 Len=1368 TSval=8178930 TSecr=601137142 [TCP segment of a reassembled PDU]"
"175","2018-08-23 02:58:27.208800","192.168.2.3","216.58.197.4","TLSv1.2","212","Application Data"
"176","2018-08-23 02:58:27.209090","192.168.2.3","216.58.197.4","TCP","1434","34325  >  443 [ACK] Seq=107966 Ack=1020 Win=661 Len=1368 TSval=8178930 TSecr=601137142 [TCP segment of a reassembled PDU]"
"177","2018-08-23 02:58:27.209092","192.168.2.3","216.58.197.4","TLSv1.2","155","Application Data"
"181","2018-08-23 02:58:27.304351","192.168.2.3","216.58.197.4","TCP","1434","34325  >  443 [ACK] Seq=109423 Ack=1020 Win=661 Len=1368 TSval=8178939 TSecr=601137227 [TCP segment of a reassembled PDU]"
"182","2018-08-23 02:58:27.304680","192.168.2.3","216.58.197.4","TCP","1434","34325  >  443 [ACK] Seq=110791 Ack=1020 Win=661 Len=1368 TSval=8178939 TSecr=601137227 [TCP segment of a reassembled PDU]"
"183","2018-08-23 02:58:27.304683","192.168.2.3","216.58.197.4","TLSv1.2","212","Application Data"
"184","2018-08-23 02:58:27.304684","192.168.2.3","216.58.197.4","TCP","1434","34325  >  443 [ACK] Seq=112305 Ack=1020 Win=661 Len=1368 TSval=8178939 TSecr=601137227 [TCP segment of a reassembled PDU]"
"185","2018-08-23 02:58:27.304685","192.168.2.3","216.58.197.4","TLSv1.2","155","Application Data"
"189","2018-08-23 02:58:27.399817","192.168.2.3","216.58.197.4","TCP","1434","34325  >  443 [ACK] Seq=113762 Ack=1020 Win=661 Len=1368 TSval=8178949 TSecr=601137323 [TCP segment of a reassembled PDU]"
"190","2018-08-23 02:58:27.400247","192.168.2.3","216.58.197.4","TCP","1434","34325  >  443 [ACK] Seq=115130 Ack=1020 Win=661 Len=1368 TSval=8178949 TSecr=601137323 [TCP segment of a reassembled PDU]"
"191","2018-08-23 02:58:27.400250","192.168.2.3","216.58.197.4","TLSv1.2","212","Application Data"
"192","2018-08-23 02:58:27.400251","192.168.2.3","216.58.197.4","TCP","1434","34325  >  443 [ACK] Seq=116644 Ack=1020 Win=661 Len=1368 TSval=8178949 TSecr=601137323 [TCP segment of a reassembled PDU]"
"193","2018-08-23 02:58:27.400392","192.168.2.3","216.58.197.4","TLSv1.2","155","Application Data"
"197","2018-08-23 02:58:27.465748","192.168.2.3","216.58.197.4","TCP","1434","34325  >  443 [ACK] Seq=118101 Ack=1020 Win=661 Len=1368 TSval=8178955 TSecr=601137418 [TCP segment of a reassembled PDU]"
"198","2018-08-23 02:58:27.466239","192.168.2.3","216.58.197.4","TCP","1434","34325  >  443 [ACK] Seq=119469 Ack=1020 Win=661 Len=1368 TSval=8178955 TSecr=601137418 [TCP segment of a reassembled PDU]"
"199","2018-08-23 02:58:27.466241","192.168.2.3","216.58.197.4","TLSv1.2","212","Application Data"
"200","2018-08-23 02:58:27.466242","192.168.2.3","216.58.197.4","TCP","1434","34325  >  443 [ACK] Seq=120983 Ack=1020 Win=661 Len=1368 TSval=8178955 TSecr=601137418 [TCP segment of a reassembled PDU]"
"201","2018-08-23 02:58:27.466331","192.168.2.3","216.58.197.4","TLSv1.2","155","Application Data"
"207","2018-08-23 02:58:27.527188","192.168.2.3","216.58.197.4","TCP","66","34325  >  443 [ACK] Seq=122440 Ack=1179 Win=661 Len=0 TSval=8178962 TSecr=601137534"
"208","2018-08-23 02:58:27.527516","192.168.2.3","216.58.197.4","TCP","66","34325  >  443 [ACK] Seq=122440 Ack=1450 Win=661 Len=0 TSval=8178962 TSecr=601137534"
"209","2018-08-23 02:58:27.570865","192.168.2.3","216.58.197.4","TCP","1434","34325  >  443 [ACK] Seq=122440 Ack=1450 Win=661 Len=1368 TSval=8178966 TSecr=601137534 [TCP segment of a reassembled PDU]"
"210","2018-08-23 02:58:27.571286","192.168.2.3","216.58.197.4","TCP","1434","34325  >  443 [ACK] Seq=123808 Ack=1450 Win=661 Len=1368 TSval=8178966 TSecr=601137534 [TCP segment of a reassembled PDU]"
"211","2018-08-23 02:58:27.571288","192.168.2.3","216.58.197.4","TLSv1.2","212","Application Data"
"212","2018-08-23 02:58:27.571727","192.168.2.3","216.58.197.4","TCP","1434","34325  >  443 [ACK] Seq=125322 Ack=1450 Win=661 Len=1368 TSval=8178966 TSecr=601137534 [TCP segment of a reassembled PDU]"
"213","2018-08-23 02:58:27.571730","192.168.2.3","216.58.197.4","TLSv1.2","155","Application Data"
"218","2018-08-23 02:58:27.584599","192.168.2.3","216.58.197.4","TCP","66","34325  >  443 [ACK] Seq=126779 Ack=1525 Win=661 Len=0 TSval=8178967 TSecr=601137596"
"220","2018-08-23 02:58:27.597042","192.168.2.3","216.58.197.4","TCP","66","34325  >  443 [ACK] Seq=126779 Ack=1742 Win=661 Len=0 TSval=8178969 TSecr=601137610"
"221","2018-08-23 02:58:27.657553","192.168.2.3","216.58.197.4","TCP","1434","34325  >  443 [ACK] Seq=126779 Ack=1742 Win=661 Len=1368 TSval=8178975 TSecr=601137610 [TCP segment of a reassembled PDU]"
"222","2018-08-23 02:58:27.657927","192.168.2.3","216.58.197.4","TCP","1434","34325  >  443 [ACK] Seq=128147 Ack=1742 Win=661 Len=1368 TSval=8178975 TSecr=601137610 [TCP segment of a reassembled PDU]"
"223","2018-08-23 02:58:27.657929","192.168.2.3","216.58.197.4","TLSv1.2","212","Application Data"
"224","2018-08-23 02:58:27.658478","192.168.2.3","216.58.197.4","TCP","1434","34325  >  443 [ACK] Seq=129661 Ack=1742 Win=661 Len=1368 TSval=8178975 TSecr=601137610 [TCP segment of a reassembled PDU]"
"225","2018-08-23 02:58:27.658481","192.168.2.3","216.58.197.4","TLSv1.2","155","Application Data"
"231","2018-08-23 02:58:27.704764","192.168.2.3","216.58.197.4","TCP","66","34325  >  443 [ACK] Seq=131118 Ack=1952 Win=661 Len=0 TSval=8178979 TSecr=601137717"
"232","2018-08-23 02:58:27.708525","192.168.2.3","216.58.197.4","TCP","66","34325  >  443 [ACK] Seq=131118 Ack=2089 Win=661 Len=0 TSval=8178980 TSecr=601137717"
"233","2018-08-23 02:58:27.752571","192.168.2.3","216.58.197.4","TCP","1434","34325  >  443 [ACK] Seq=131118 Ack=2089 Win=661 Len=1368 TSval=8178984 TSecr=601137717 [TCP segment of a reassembled PDU]"
"234","2018-08-23 02:58:27.752574","192.168.2.3","216.58.197.4","TCP","1434","34325  >  443 [ACK] Seq=132486 Ack=2089 Win=661 Len=1368 TSval=8178984 TSecr=601137717 [TCP segment of a reassembled PDU]"
"235","2018-08-23 02:58:27.752575","192.168.2.3","216.58.197.4","TLSv1.2","212","Application Data"
"236","2018-08-23 02:58:27.752893","192.168.2.3","216.58.197.4","TCP","1434","34325  >  443 [ACK] Seq=134000 Ack=2089 Win=661 Len=1368 TSval=8178984 TSecr=601137717 [TCP segment of a reassembled PDU]"
"237","2018-08-23 02:58:27.752895","192.168.2.3","216.58.197.4","TLSv1.2","155","Application Data"
"242","2018-08-23 02:58:27.796441","192.168.2.3","192.168.2.1","TCP","183","8009  >  53029 [PSH, ACK] Seq=118 Ack=235 Win=277 Len=117 TSval=8178989 TSecr=2319040187 [TCP segment of a reassembled PDU]"
"244","2018-08-23 02:58:27.848644","192.168.2.3","216.58.197.4","TCP","1434","34325  >  443 [ACK] Seq=135457 Ack=2089 Win=661 Len=1368 TSval=8178994 TSecr=601137771 [TCP segment of a reassembled PDU]"
"245","2018-08-23 02:58:27.848949","192.168.2.3","216.58.197.4","TCP","1434","34325  >  443 [ACK] Seq=136825 Ack=2089 Win=661 Len=1368 TSval=8178994 TSecr=601137771 [TCP segment of a reassembled PDU]"
"246","2018-08-23 02:58:27.848964","192.168.2.3","216.58.197.4","TLSv1.2","212","Application Data"
"247","2018-08-23 02:58:27.849428","192.168.2.3","216.58.197.4","TCP","1434","34325  >  443 [ACK] Seq=138339 Ack=2089 Win=661 Len=1368 TSval=8178994 TSecr=601137771 [TCP segment of a reassembled PDU]"
"248","2018-08-23 02:58:27.849431","192.168.2.3","216.58.197.4","TLSv1.2","155","Application Data"
"254","2018-08-23 02:58:27.911195","192.168.2.3","216.58.197.4","TCP","66","34325  >  443 [ACK] Seq=139796 Ack=2605 Win=661 Len=0 TSval=8179000 TSecr=601137923"
"255","2018-08-23 02:58:27.922833","192.168.2.3","216.58.197.4","TCP","1434","34325  >  443 [ACK] Seq=139796 Ack=2605 Win=661 Len=1368 TSval=8179001 TSecr=601137923 [TCP segment of a reassembled PDU]"
"256","2018-08-23 02:58:27.923209","192.168.2.3","216.58.197.4","TCP","1434","34325  >  443 [ACK] Seq=141164 Ack=2605 Win=661 Len=1368 TSval=8179001 TSecr=601137923 [TCP segment of a reassembled PDU]"
"257","2018-08-23 02:58:27.923213","192.168.2.3","216.58.197.4","TLSv1.2","212","Application Data"
"258","2018-08-23 02:58:27.923628","192.168.2.3","216.58.197.4","TCP","1434","34325  >  443 [ACK] Seq=142678 Ack=2605 Win=661 Len=1368 TSval=8179001 TSecr=601137923 [TCP segment of a reassembled PDU]"
"259","2018-08-23 02:58:27.923631","192.168.2.3","216.58.197.4","TLSv1.2","155","Application Data"
"265","2018-08-23 02:58:27.975601","192.168.2.3","216.58.197.4","TCP","66","34325  >  443 [ACK] Seq=144135 Ack=2876 Win=661 Len=0 TSval=8179006 TSecr=601137987"
"266","2018-08-23 02:58:28.020108","192.168.2.3","216.58.197.4","TCP","1434","34325  >  443 [ACK] Seq=144135 Ack=2876 Win=661 Len=1368 TSval=8179011 TSecr=601137987 [TCP segment of a reassembled PDU]"
"267","2018-08-23 02:58:28.020558","192.168.2.3","216.58.197.4","TCP","1434","34325  >  443 [ACK] Seq=145503 Ack=2876 Win=661 Len=1368 TSval=8179011 TSecr=601137987 [TCP segment of a reassembled PDU]"
"268","2018-08-23 02:58:28.020561","192.168.2.3","216.58.197.4","TLSv1.2","212","Application Data"
"269","2018-08-23 02:58:28.020937","192.168.2.3","216.58.197.4","TCP","1434","34325  >  443 [ACK] Seq=147017 Ack=2876 Win=661 Len=1368 TSval=8179011 TSecr=601137987 [TCP segment of a reassembled PDU]"
"270","2018-08-23 02:58:28.020940","192.168.2.3","216.58.197.4","TLSv1.2","155","Application Data"
"276","2018-08-23 02:58:28.073942","192.168.2.3","216.58.197.4","TCP","66","34325  >  443 [ACK] Seq=148474 Ack=3053 Win=661 Len=0 TSval=8179016 TSecr=601138080"
"277","2018-08-23 02:58:28.106075","192.168.2.3","216.58.197.4","TCP","1434","34325  >  443 [ACK] Seq=148474 Ack=3053 Win=661 Len=1368 TSval=8179019 TSecr=601138080 [TCP segment of a reassembled PDU]"
"278","2018-08-23 02:58:28.106490","192.168.2.3","216.58.197.4","TCP","1434","34325  >  443 [ACK] Seq=149842 Ack=3053 Win=661 Len=1368 TSval=8179019 TSecr=601138080 [TCP segment of a reassembled PDU]"
"279","2018-08-23 02:58:28.106493","192.168.2.3","216.58.197.4","TLSv1.2","212","Application Data"
"280","2018-08-23 02:58:28.106871","192.168.2.3","216.58.197.4","TCP","1434","34325  >  443 [ACK] Seq=151356 Ack=3053 Win=661 Len=1368 TSval=8179019 TSecr=601138080 [TCP segment of a reassembled PDU]"
"281","2018-08-23 02:58:28.106873","192.168.2.3","216.58.197.4","TLSv1.2","155","Application Data"
"285","2018-08-23 02:58:28.199682","192.168.2.3","216.58.197.4","TCP","1434","34325  >  443 [ACK] Seq=152813 Ack=3053 Win=661 Len=1368 TSval=8179029 TSecr=601138125 [TCP segment of a reassembled PDU]"
"286","2018-08-23 02:58:28.200034","192.168.2.3","216.58.197.4","TCP","1434","34325  >  443 [ACK] Seq=154181 Ack=3053 Win=661 Len=1368 TSval=8179029 TSecr=601138125 [TCP segment of a reassembled PDU]"
"287","2018-08-23 02:58:28.200051","192.168.2.3","216.58.197.4","TLSv1.2","212","Application Data"
"288","2018-08-23 02:58:28.200287","192.168.2.3","216.58.197.4","TCP","1434","34325  >  443 [ACK] Seq=155695 Ack=3053 Win=661 Len=1368 TSval=8179029 TSecr=601138125 [TCP segment of a reassembled PDU]"
"289","2018-08-23 02:58:28.200289","192.168.2.3","216.58.197.4","TLSv1.2","155","Application Data"
"295","2018-08-23 02:58:28.247041","192.168.2.3","216.58.197.4","TCP","66","34325  >  443 [ACK] Seq=157152 Ack=3504 Win=661 Len=0 TSval=8179034 TSecr=601138259"
"296","2018-08-23 02:58:28.274860","192.168.2.3","216.58.197.4","TCP","1434","34325  >  443 [ACK] Seq=157152 Ack=3504 Win=661 Len=1368 TSval=8179036 TSecr=601138259 [TCP segment of a reassembled PDU]"
"297","2018-08-23 02:58:28.275279","192.168.2.3","216.58.197.4","TCP","1434","34325  >  443 [ACK] Seq=158520 Ack=3504 Win=661 Len=1368 TSval=8179036 TSecr=601138259 [TCP segment of a reassembled PDU]"
"298","2018-08-23 02:58:28.275281","192.168.2.3","216.58.197.4","TLSv1.2","212","Application Data"
"299","2018-08-23 02:58:28.275621","192.168.2.3","216.58.197.4","TCP","1434","34325  >  443 [ACK] Seq=160034 Ack=3504 Win=661 Len=1368 TSval=8179036 TSecr=601138259 [TCP segment of a reassembled PDU]"
"300","2018-08-23 02:58:28.275623","192.168.2.3","216.58.197.4","TLSv1.2","155","Application Data"
"304","2018-08-23 02:58:28.360494","192.168.2.3","216.58.197.4","TCP","1434","34325  >  443 [ACK] Seq=161491 Ack=3504 Win=661 Len=1368 TSval=8179045 TSecr=601138293 [TCP segment of a reassembled PDU]"
"305","2018-08-23 02:58:28.360995","192.168.2.3","216.58.197.4","TCP","1434","34325  >  443 [ACK] Seq=162859 Ack=3504 Win=661 Len=1368 TSval=8179045 TSecr=601138293 [TCP segment of a reassembled PDU]"
"306","2018-08-23 02:58:28.360998","192.168.2.3","216.58.197.4","TLSv1.2","212","Application Data"
"307","2018-08-23 02:58:28.361461","192.168.2.3","216.58.197.4","TCP","1434","34325  >  443 [ACK] Seq=164373 Ack=3504 Win=661 Len=1368 TSval=8179045 TSecr=601138293 [TCP segment of a reassembled PDU]"
"308","2018-08-23 02:58:28.361463","192.168.2.3","216.58.197.4","TLSv1.2","155","Application Data"
"314","2018-08-23 02:58:28.412178","192.168.2.3","216.58.197.4","TCP","66","34325  >  443 [ACK] Seq=165830 Ack=3886 Win=661 Len=0 TSval=8179050 TSecr=601138424"
"315","2018-08-23 02:58:28.458233","192.168.2.3","216.58.197.4","TCP","1434","34325  >  443 [ACK] Seq=165830 Ack=3886 Win=661 Len=1368 TSval=8179055 TSecr=601138424 [TCP segment of a reassembled PDU]"
"316","2018-08-23 02:58:28.458685","192.168.2.3","216.58.197.4","TCP","1434","34325  >  443 [ACK] Seq=167198 Ack=3886 Win=661 Len=1368 TSval=8179055 TSecr=601138424 [TCP segment of a reassembled PDU]"
"317","2018-08-23 02:58:28.458689","192.168.2.3","216.58.197.4","TLSv1.2","212","Application Data"
"318","2018-08-23 02:58:28.458690","192.168.2.3","216.58.197.4","TCP","1434","34325  >  443 [ACK] Seq=168712 Ack=3886 Win=661 Len=1368 TSval=8179055 TSecr=601138424 [TCP segment of a reassembled PDU]"
"319","2018-08-23 02:58:28.458834","192.168.2.3","216.58.197.4","TLSv1.2","155","Application Data"
"323","2018-08-23 02:58:28.553661","192.168.2.3","216.58.197.4","TCP","1434","34325  >  443 [ACK] Seq=170169 Ack=3886 Win=661 Len=1368 TSval=8179064 TSecr=601138477 [TCP segment of a reassembled PDU]"
"324","2018-08-23 02:58:28.553994","192.168.2.3","216.58.197.4","TCP","1434","34325  >  443 [ACK] Seq=171537 Ack=3886 Win=661 Len=1368 TSval=8179064 TSecr=601138477 [TCP segment of a reassembled PDU]"
"325","2018-08-23 02:58:28.553997","192.168.2.3","216.58.197.4","TLSv1.2","212","Application Data"
"326","2018-08-23 02:58:28.554302","192.168.2.3","216.58.197.4","TCP","1434","34325  >  443 [ACK] Seq=173051 Ack=3886 Win=661 Len=1368 TSval=8179064 TSecr=601138477 [TCP segment of a reassembled PDU]"
"327","2018-08-23 02:58:28.554305","192.168.2.3","216.58.197.4","TLSv1.2","155","Application Data"
"333","2018-08-23 02:58:28.596616","192.168.2.3","216.58.197.4","TCP","66","34325  >  443 [ACK] Seq=174508 Ack=3998 Win=661 Len=0 TSval=8179069 TSecr=601138597"
"336","2018-08-23 02:58:28.607891","192.168.2.3","216.58.197.4","TCP","66","34325  >  443 [ACK] Seq=174508 Ack=4302 Win=661 Len=0 TSval=8179069 TSecr=601138615"
"337","2018-08-23 02:58:28.650119","192.168.2.3","216.58.197.4","TCP","1434","34325  >  443 [ACK] Seq=174508 Ack=4302 Win=661 Len=1368 TSval=8179074 TSecr=601138615 [TCP segment of a reassembled PDU]"
"338","2018-08-23 02:58:28.650125","192.168.2.3","216.58.197.4","TCP","1434","34325  >  443 [ACK] Seq=175876 Ack=4302 Win=661 Len=1368 TSval=8179074 TSecr=601138615 [TCP segment of a reassembled PDU]"
"339","2018-08-23 02:58:28.650126","192.168.2.3","216.58.197.4","TLSv1.2","212","Application Data"
"340","2018-08-23 02:58:28.650388","192.168.2.3","216.58.197.4","TCP","1434","34325  >  443 [ACK] Seq=177390 Ack=4302 Win=661 Len=1368 TSval=8179074 TSecr=601138615 [TCP segment of a reassembled PDU]"
"341","2018-08-23 02:58:28.650391","192.168.2.3","216.58.197.4","TLSv1.2","155","Application Data"
"344","2018-08-23 02:58:28.758292","192.168.2.3","216.58.197.4","TCP","1434","34325  >  443 [ACK] Seq=178847 Ack=4302 Win=661 Len=1368 TSval=8179085 TSecr=601138668 [TCP segment of a reassembled PDU]"
"345","2018-08-23 02:58:28.758297","192.168.2.3","216.58.197.4","TCP","1434","34325  >  443 [ACK] Seq=180215 Ack=4302 Win=661 Len=1368 TSval=8179085 TSecr=601138668 [TCP segment of a reassembled PDU]"
"346","2018-08-23 02:58:28.758384","192.168.2.3","216.58.197.4","TLSv1.2","212","Application Data"
"347","2018-08-23 02:58:28.758588","192.168.2.3","216.58.197.4","TCP","1434","34325  >  443 [ACK] Seq=181729 Ack=4302 Win=661 Len=1368 TSval=8179085 TSecr=601138668 [TCP segment of a reassembled PDU]"
"348","2018-08-23 02:58:28.758590","192.168.2.3","216.58.197.4","TLSv1.2","155","Application Data"
"353","2018-08-23 02:58:28.855054","192.168.2.3","216.58.197.4","TCP","1434","34325  >  443 [ACK] Seq=183186 Ack=4449 Win=661 Len=1368 TSval=8179094 TSecr=601138857 [TCP segment of a reassembled PDU]"
"354","2018-08-23 02:58:28.855058","192.168.2.3","216.58.197.4","TCP","1434","34325  >  443 [ACK] Seq=184554 Ack=4449 Win=661 Len=1368 TSval=8179094 TSecr=601138857 [TCP segment of a reassembled PDU]"
"355","2018-08-23 02:58:28.855209","192.168.2.3","216.58.197.4","TLSv1.2","212","Application Data"
"356","2018-08-23 02:58:28.855212","192.168.2.3","216.58.197.4","TCP","1434","34325  >  443 [ACK] Seq=186068 Ack=4449 Win=661 Len=1368 TSval=8179094 TSecr=601138857 [TCP segment of a reassembled PDU]"
"357","2018-08-23 02:58:28.855488","192.168.2.3","216.58.197.4","TLSv1.2","155","Application Data"
"361","2018-08-23 02:58:28.969927","192.168.2.3","216.58.197.4","TCP","1434","34325  >  443 [ACK] Seq=187525 Ack=4449 Win=661 Len=1368 TSval=8179106 TSecr=601138873 [TCP segment of a reassembled PDU]"
"362","2018-08-23 02:58:28.970264","192.168.2.3","216.58.197.4","TCP","1434","34325  >  443 [ACK] Seq=188893 Ack=4449 Win=661 Len=1368 TSval=8179106 TSecr=601138873 [TCP segment of a reassembled PDU]"
"363","2018-08-23 02:58:28.970268","192.168.2.3","216.58.197.4","TLSv1.2","212","Application Data"
"364","2018-08-23 02:58:28.970690","192.168.2.3","216.58.197.4","TCP","1434","34325  >  443 [ACK] Seq=190407 Ack=4449 Win=661 Len=1368 TSval=8179106 TSecr=601138873 [TCP segment of a reassembled PDU]"
"365","2018-08-23 02:58:28.970694","192.168.2.3","216.58.197.4","TLSv1.2","155","Application Data"
"371","2018-08-23 02:58:29.043147","192.168.2.3","216.58.197.4","TCP","66","34325  >  443 [ACK] Seq=191864 Ack=4604 Win=661 Len=0 TSval=8179113 TSecr=601139033"
"373","2018-08-23 02:58:29.050967","192.168.2.3","216.58.197.4","TCP","78","[TCP Dup ACK 371#1] 34325  >  443 [ACK] Seq=191864 Ack=4604 Win=661 Len=0 TSval=8179114 TSecr=601139060 SLE=4561 SRE=4604"
"374","2018-08-23 02:58:29.069399","192.168.2.3","216.58.197.4","TCP","1434","34325  >  443 [ACK] Seq=191864 Ack=4604 Win=661 Len=1368 TSval=8179115 TSecr=601139060 [TCP segment of a reassembled PDU]"
"375","2018-08-23 02:58:29.069670","192.168.2.3","216.58.197.4","TCP","1434","34325  >  443 [ACK] Seq=193232 Ack=4604 Win=661 Len=1368 TSval=8179115 TSecr=601139060 [TCP segment of a reassembled PDU]"
"376","2018-08-23 02:58:29.069672","192.168.2.3","216.58.197.4","TLSv1.2","212","Application Data"
"377","2018-08-23 02:58:29.069685","192.168.2.3","216.58.197.4","TCP","1434","34325  >  443 [ACK] Seq=194746 Ack=4604 Win=661 Len=1368 TSval=8179115 TSecr=601139060 [TCP segment of a reassembled PDU]"
"378","2018-08-23 02:58:29.069783","192.168.2.3","216.58.197.4","TLSv1.2","155","Application Data"
"382","2018-08-23 02:58:29.174401","192.168.2.3","216.58.197.4","TCP","1434","34325  >  443 [ACK] Seq=196203 Ack=4604 Win=661 Len=1368 TSval=8179126 TSecr=601139088 [TCP segment of a reassembled PDU]"
"383","2018-08-23 02:58:29.174666","192.168.2.3","216.58.197.4","TCP","1434","34325  >  443 [ACK] Seq=197571 Ack=4604 Win=661 Len=1368 TSval=8179126 TSecr=601139088 [TCP segment of a reassembled PDU]"
"384","2018-08-23 02:58:29.174668","192.168.2.3","216.58.197.4","TLSv1.2","212","Application Data"
"385","2018-08-23 02:58:29.174941","192.168.2.3","216.58.197.4","TCP","1434","34325  >  443 [ACK] Seq=199085 Ack=4604 Win=661 Len=1368 TSval=8179126 TSecr=601139088 [TCP segment of a reassembled PDU]"
"386","2018-08-23 02:58:29.174957","192.168.2.3","216.58.197.4","TLSv1.2","155","Application Data"
"392","2018-08-23 02:58:29.228313","192.168.2.3","216.58.197.4","TCP","66","34325  >  443 [ACK] Seq=200542 Ack=4881 Win=661 Len=0 TSval=8179132 TSecr=601139240"
"393","2018-08-23 02:58:29.270215","192.168.2.3","216.58.197.4","TCP","1434","34325  >  443 [ACK] Seq=200542 Ack=4881 Win=661 Len=1368 TSval=8179136 TSecr=601139240 [TCP segment of a reassembled PDU]"
"394","2018-08-23 02:58:29.270219","192.168.2.3","216.58.197.4","TCP","1434","34325  >  443 [ACK] Seq=201910 Ack=4881 Win=661 Len=1368 TSval=8179136 TSecr=601139240 [TCP segment of a reassembled PDU]"
"395","2018-08-23 02:58:29.270444","192.168.2.3","216.58.197.4","TLSv1.2","212","Application Data"
"396","2018-08-23 02:58:29.270823","192.168.2.3","216.58.197.4","TCP","1434","34325  >  443 [ACK] Seq=203424 Ack=4881 Win=661 Len=1368 TSval=8179136 TSecr=601139240 [TCP segment of a reassembled PDU]"
"397","2018-08-23 02:58:29.270826","192.168.2.3","216.58.197.4","TLSv1.2","155","Application Data"
"403","2018-08-23 02:58:29.319686","192.168.2.3","216.58.197.4","TCP","66","34325  >  443 [ACK] Seq=204881 Ack=5126 Win=661 Len=0 TSval=8179141 TSecr=601139329"
"406","2018-08-23 02:58:29.355209","192.168.2.3","216.58.197.4","TCP","66","34325  >  443 [ACK] Seq=204881 Ack=5801 Win=661 Len=0 TSval=8179144 TSecr=601139367"
"407","2018-08-23 02:58:29.370166","192.168.2.3","216.58.197.4","TCP","1434","34325  >  443 [ACK] Seq=204881 Ack=5801 Win=661 Len=1368 TSval=8179145 TSecr=601139367 [TCP segment of a reassembled PDU]"
"408","2018-08-23 02:58:29.370170","192.168.2.3","216.58.197.4","TCP","1434","34325  >  443 [ACK] Seq=206249 Ack=5801 Win=661 Len=1368 TSval=8179145 TSecr=601139367 [TCP segment of a reassembled PDU]"
"409","2018-08-23 02:58:29.370171","192.168.2.3","216.58.197.4","TLSv1.2","212","Application Data"
"410","2018-08-23 02:58:29.370324","192.168.2.3","216.58.197.4","TCP","1434","34325  >  443 [ACK] Seq=207763 Ack=5801 Win=661 Len=1368 TSval=8179145 TSecr=601139367 [TCP segment of a reassembled PDU]"
"411","2018-08-23 02:58:29.370497","192.168.2.3","216.58.197.4","TLSv1.2","155","Application Data"
"415","2018-08-23 02:58:29.390369","192.168.2.3","216.58.197.4","TLSv1.2","630","Application Data"
"416","2018-08-23 02:58:29.390372","192.168.2.3","216.58.197.4","TLSv1.2","102","Application Data"
"420","2018-08-23 02:58:29.599672","192.168.2.3","216.58.197.4","TCP","66","34325  >  443 [ACK] Seq=209820 Ack=6075 Win=661 Len=0 TSval=8179169 TSecr=601139597"
"434","2018-08-23 02:58:29.990923","192.168.2.3","216.58.197.4","TCP","66","34325  >  443 [ACK] Seq=209820 Ack=7640 Win=661 Len=0 TSval=8179206 TSecr=601139949"
"435","2018-08-23 02:58:29.992369","192.168.2.3","216.58.197.4","TCP","66","34325  >  443 [ACK] Seq=209820 Ack=10000 Win=661 Len=0 TSval=8179208 TSecr=601139980"
"436","2018-08-23 02:58:29.992373","192.168.2.3","216.58.197.4","TCP","66","34325  >  443 [ACK] Seq=209820 Ack=11767 Win=661 Len=0 TSval=8179208 TSecr=601139993"
"437","2018-08-23 02:58:29.993170","192.168.2.3","216.58.197.4","TCP","66","34325  >  443 [ACK] Seq=209820 Ack=15266 Win=661 Len=0 TSval=8179208 TSecr=601139994"
