"No.","Time","Source","Destination","Protocol","Length","Info"
"2","2018-08-23 02:51:05.403816","192.168.2.3","192.168.2.1","TCP","183","8009  >  53029 [PSH, ACK] Seq=1 Ack=118 Win=277 Len=117 TSval=8134750 TSecr=2318598810 [TCP segment of a reassembled PDU]"
"5","2018-08-23 02:51:07.995312","192.168.2.3","216.58.197.4","TLSv1.2","156","Application Data"
"6","2018-08-23 02:51:07.995454","192.168.2.3","216.58.197.4","TLSv1.2","104","Application Data"
"7","2018-08-23 02:51:07.997738","192.168.2.3","216.58.197.4","TLSv1.2","158","Application Data"
"11","2018-08-23 02:51:08.027189","192.168.2.3","216.58.197.4","TCP","1434","34325  >  443 [ACK] Seq=221 Ack=39 Win=661 Len=1368 TSval=8135012 TSecr=600698013 [TCP segment of a reassembled PDU]"
"12","2018-08-23 02:51:08.027570","192.168.2.3","216.58.197.4","TCP","1434","34325  >  443 [ACK] Seq=1589 Ack=39 Win=661 Len=1368 TSval=8135012 TSecr=600698013 [TCP segment of a reassembled PDU]"
"13","2018-08-23 02:51:08.027573","192.168.2.3","216.58.197.4","TLSv1.2","212","Application Data"
"14","2018-08-23 02:51:08.027574","192.168.2.3","216.58.197.4","TCP","1434","34325  >  443 [ACK] Seq=3103 Ack=39 Win=661 Len=1368 TSval=8135012 TSecr=600698013 [TCP segment of a reassembled PDU]"
"15","2018-08-23 02:51:08.027709","192.168.2.3","216.58.197.4","TLSv1.2","337","Application Data"
"16","2018-08-23 02:51:08.028179","192.168.2.3","216.58.197.4","TCP","1434","34325  >  443 [ACK] Seq=4742 Ack=39 Win=661 Len=1368 TSval=8135012 TSecr=600698013 [TCP segment of a reassembled PDU]"
"17","2018-08-23 02:51:08.028182","192.168.2.3","216.58.197.4","TCP","1434","34325  >  443 [ACK] Seq=6110 Ack=39 Win=661 Len=1368 TSval=8135012 TSecr=600698013 [TCP segment of a reassembled PDU]"
"18","2018-08-23 02:51:08.028183","192.168.2.3","216.58.197.4","TLSv1.2","212","Application Data"
"19","2018-08-23 02:51:08.028600","192.168.2.3","216.58.197.4","TCP","1434","34325  >  443 [ACK] Seq=7624 Ack=39 Win=661 Len=1368 TSval=8135012 TSecr=600698013 [TCP segment of a reassembled PDU]"
"24","2018-08-23 02:51:08.033180","192.168.2.3","216.58.197.4","TLSv1.2","1434","Application Data [TCP segment of a reassembled PDU]"
"25","2018-08-23 02:51:08.033692","192.168.2.3","216.58.197.4","TCP","1434","34325  >  443 [ACK] Seq=10360 Ack=39 Win=661 Len=1368 TSval=8135013 TSecr=600698045 [TCP segment of a reassembled PDU]"
"26","2018-08-23 02:51:08.033694","192.168.2.3","216.58.197.4","TLSv1.2","1434","Application Data [TCP segment of a reassembled PDU]"
"27","2018-08-23 02:51:08.034178","192.168.2.3","216.58.197.4","TLSv1.2","1434","Application Data [TCP segment of a reassembled PDU]"
"28","2018-08-23 02:51:08.034181","192.168.2.3","216.58.197.4","TCP","1434","34325  >  443 [ACK] Seq=14464 Ack=39 Win=661 Len=1368 TSval=8135013 TSecr=600698045 [TCP segment of a reassembled PDU]"
"29","2018-08-23 02:51:08.034524","192.168.2.3","216.58.197.4","TLSv1.2","1434","Application Data [TCP segment of a reassembled PDU]"
"30","2018-08-23 02:51:08.034526","192.168.2.3","216.58.197.4","TLSv1.2","1434","Application Data [TCP segment of a reassembled PDU]"
"31","2018-08-23 02:51:08.034864","192.168.2.3","216.58.197.4","TCP","1434","34325  >  443 [ACK] Seq=18568 Ack=39 Win=661 Len=1368 TSval=8135013 TSecr=600698045 [TCP segment of a reassembled PDU]"
"32","2018-08-23 02:51:08.035251","192.168.2.3","216.58.197.4","TLSv1.2","1434","Application Data [TCP segment of a reassembled PDU]"
"33","2018-08-23 02:51:08.035254","192.168.2.3","216.58.197.4","TLSv1.2","1434","Application Data [TCP segment of a reassembled PDU]"
"34","2018-08-23 02:51:08.035627","192.168.2.3","216.58.197.4","TCP","1434","34325  >  443 [ACK] Seq=22672 Ack=39 Win=661 Len=1368 TSval=8135013 TSecr=600698045 [TCP segment of a reassembled PDU]"
"35","2018-08-23 02:51:08.036067","192.168.2.3","216.58.197.4","TLSv1.2","1434","Application Data [TCP segment of a reassembled PDU]"
"36","2018-08-23 02:51:08.036083","192.168.2.3","216.58.197.4","TLSv1.2","1434","Application Data [TCP segment of a reassembled PDU]"
"37","2018-08-23 02:51:08.036281","192.168.2.3","216.58.197.4","TCP","1434","34325  >  443 [ACK] Seq=26776 Ack=39 Win=661 Len=1368 TSval=8135013 TSecr=600698046 [TCP segment of a reassembled PDU]"
"44","2018-08-23 02:51:08.040561","192.168.2.3","216.58.197.4","TLSv1.2","1434","Application Data [TCP segment of a reassembled PDU]"
"46","2018-08-23 02:51:08.041266","192.168.2.3","216.58.197.4","TLSv1.2","1434","Application Data [TCP segment of a reassembled PDU]"
"47","2018-08-23 02:51:08.041268","192.168.2.3","216.58.197.4","TCP","1434","34325  >  443 [ACK] Seq=30880 Ack=39 Win=661 Len=1368 TSval=8135013 TSecr=600698051 [TCP segment of a reassembled PDU]"
"48","2018-08-23 02:51:08.041435","192.168.2.3","216.58.197.4","TCP","1434","34325  >  443 [ACK] Seq=32248 Ack=39 Win=661 Len=1368 TSval=8135013 TSecr=600698051 [TCP segment of a reassembled PDU]"
"49","2018-08-23 02:51:08.041807","192.168.2.3","216.58.197.4","TLSv1.2","1434","Application Data [TCP segment of a reassembled PDU]"
"50","2018-08-23 02:51:08.045230","192.168.2.3","216.58.197.4","TLSv1.2","1434","Application Data [TCP segment of a reassembled PDU]"
"51","2018-08-23 02:51:08.045387","192.168.2.3","216.58.197.4","TCP","1434","34325  >  443 [ACK] Seq=36352 Ack=39 Win=661 Len=1368 TSval=8135013 TSecr=600698052 [TCP segment of a reassembled PDU]"
"53","2018-08-23 02:51:08.045580","192.168.2.3","216.58.197.4","TLSv1.2","1434","Application Data [TCP segment of a reassembled PDU]"
"55","2018-08-23 02:51:08.045745","192.168.2.3","216.58.197.4","TLSv1.2","1434","Application Data [TCP segment of a reassembled PDU]"
"56","2018-08-23 02:51:08.045930","192.168.2.3","216.58.197.4","TCP","1434","34325  >  443 [ACK] Seq=40456 Ack=39 Win=661 Len=1368 TSval=8135013 TSecr=600698052 [TCP segment of a reassembled PDU]"
"57","2018-08-23 02:51:08.046116","192.168.2.3","216.58.197.4","TLSv1.2","1434","Application Data [TCP segment of a reassembled PDU]"
"58","2018-08-23 02:51:08.046327","192.168.2.3","216.58.197.4","TLSv1.2","1434","Application Data [TCP segment of a reassembled PDU]"
"59","2018-08-23 02:51:08.046516","192.168.2.3","216.58.197.4","TCP","1434","34325  >  443 [ACK] Seq=44560 Ack=39 Win=661 Len=1368 TSval=8135014 TSecr=600698053 [TCP segment of a reassembled PDU]"
"60","2018-08-23 02:51:08.046673","192.168.2.3","216.58.197.4","TLSv1.2","1434","Application Data [TCP segment of a reassembled PDU]"
"61","2018-08-23 02:51:08.046855","192.168.2.3","216.58.197.4","TLSv1.2","1434","Application Data [TCP segment of a reassembled PDU]"
"62","2018-08-23 02:51:08.047055","192.168.2.3","216.58.197.4","TCP","1434","34325  >  443 [ACK] Seq=48664 Ack=39 Win=661 Len=1368 TSval=8135014 TSecr=600698053 [TCP segment of a reassembled PDU]"
"63","2018-08-23 02:51:08.047212","192.168.2.3","216.58.197.4","TLSv1.2","1434","Application Data [TCP segment of a reassembled PDU]"
"64","2018-08-23 02:51:08.047408","192.168.2.3","216.58.197.4","TLSv1.2","1434","Application Data [TCP segment of a reassembled PDU]"
"65","2018-08-23 02:51:08.047633","192.168.2.3","216.58.197.4","TCP","1434","34325  >  443 [ACK] Seq=52768 Ack=39 Win=661 Len=1368 TSval=8135014 TSecr=600698054 [TCP segment of a reassembled PDU]"
"66","2018-08-23 02:51:08.047827","192.168.2.3","216.58.197.4","TLSv1.2","1434","Application Data [TCP segment of a reassembled PDU]"
"67","2018-08-23 02:51:08.049138","192.168.2.3","216.58.197.4","TLSv1.2","1434","Application Data [TCP segment of a reassembled PDU]"
"76","2018-08-23 02:51:08.053902","192.168.2.3","216.58.197.4","TCP","1434","34325  >  443 [ACK] Seq=56872 Ack=39 Win=661 Len=1368 TSval=8135014 TSecr=600698059 [TCP segment of a reassembled PDU]"
"77","2018-08-23 02:51:08.054073","192.168.2.3","216.58.197.4","TCP","1434","34325  >  443 [ACK] Seq=58240 Ack=39 Win=661 Len=1368 TSval=8135014 TSecr=600698059 [TCP segment of a reassembled PDU]"
"78","2018-08-23 02:51:08.054277","192.168.2.3","216.58.197.4","TLSv1.2","1434","Application Data, Application Data"
"79","2018-08-23 02:51:08.054481","192.168.2.3","216.58.197.4","TCP","1434","34325  >  443 [ACK] Seq=60976 Ack=39 Win=661 Len=1368 TSval=8135014 TSecr=600698059 [TCP segment of a reassembled PDU]"
"82","2018-08-23 02:51:08.058763","192.168.2.3","216.58.197.4","TCP","1434","34325  >  443 [ACK] Seq=62344 Ack=39 Win=661 Len=1368 TSval=8135015 TSecr=600698063 [TCP segment of a reassembled PDU]"
"83","2018-08-23 02:51:08.058765","192.168.2.3","216.58.197.4","TLSv1.2","1434","Application Data [TCP segment of a reassembled PDU]"
"84","2018-08-23 02:51:08.058928","192.168.2.3","216.58.197.4","TLSv1.2","1434","Application Data [TCP segment of a reassembled PDU]"
"85","2018-08-23 02:51:08.059264","192.168.2.3","216.58.197.4","TCP","1434","34325  >  443 [ACK] Seq=66448 Ack=39 Win=661 Len=1368 TSval=8135015 TSecr=600698063 [TCP segment of a reassembled PDU]"
"86","2018-08-23 02:51:08.059433","192.168.2.3","216.58.197.4","TLSv1.2","1434","Application Data [TCP segment of a reassembled PDU]"
"87","2018-08-23 02:51:08.059436","192.168.2.3","216.58.197.4","TLSv1.2","407","Application Data"
"91","2018-08-23 02:51:08.080845","192.168.2.3","216.58.197.4","TCP","1434","34325  >  443 [ACK] Seq=69525 Ack=39 Win=661 Len=1368 TSval=8135017 TSecr=600698077 [TCP segment of a reassembled PDU]"
"92","2018-08-23 02:51:08.081316","192.168.2.3","216.58.197.4","TCP","1434","34325  >  443 [ACK] Seq=70893 Ack=39 Win=661 Len=1368 TSval=8135017 TSecr=600698077 [TCP segment of a reassembled PDU]"
"93","2018-08-23 02:51:08.081320","192.168.2.3","216.58.197.4","TLSv1.2","212","Application Data"
"94","2018-08-23 02:51:08.081635","192.168.2.3","216.58.197.4","TCP","1434","34325  >  443 [ACK] Seq=72407 Ack=39 Win=661 Len=1368 TSval=8135017 TSecr=600698077 [TCP segment of a reassembled PDU]"
"95","2018-08-23 02:51:08.081637","192.168.2.3","216.58.197.4","TLSv1.2","155","Application Data"
"99","2018-08-23 02:51:08.130991","192.168.2.3","216.58.197.4","TCP","1434","34325  >  443 [ACK] Seq=73864 Ack=39 Win=661 Len=1368 TSval=8135022 TSecr=600698099 [TCP segment of a reassembled PDU]"
"100","2018-08-23 02:51:08.131648","192.168.2.3","216.58.197.4","TCP","1434","34325  >  443 [ACK] Seq=75232 Ack=39 Win=661 Len=1368 TSval=8135022 TSecr=600698099 [TCP segment of a reassembled PDU]"
"101","2018-08-23 02:51:08.131651","192.168.2.3","216.58.197.4","TLSv1.2","212","Application Data"
"102","2018-08-23 02:51:08.132074","192.168.2.3","216.58.197.4","TCP","1434","34325  >  443 [ACK] Seq=76746 Ack=39 Win=661 Len=1368 TSval=8135023 TSecr=600698099 [TCP segment of a reassembled PDU]"
"103","2018-08-23 02:51:08.132077","192.168.2.3","216.58.197.4","TLSv1.2","155","Application Data"
"107","2018-08-23 02:51:08.204036","192.168.2.3","216.58.197.4","TCP","1434","34325  >  443 [ACK] Seq=78203 Ack=39 Win=661 Len=1368 TSval=8135030 TSecr=600698190 [TCP segment of a reassembled PDU]"
"108","2018-08-23 02:51:08.204430","192.168.2.3","216.58.197.4","TCP","1434","34325  >  443 [ACK] Seq=79571 Ack=39 Win=661 Len=1368 TSval=8135030 TSecr=600698190 [TCP segment of a reassembled PDU]"
"109","2018-08-23 02:51:08.204432","192.168.2.3","216.58.197.4","TLSv1.2","212","Application Data"
"110","2018-08-23 02:51:08.204951","192.168.2.3","216.58.197.4","TCP","1434","34325  >  443 [ACK] Seq=81085 Ack=39 Win=661 Len=1368 TSval=8135030 TSecr=600698190 [TCP segment of a reassembled PDU]"
"111","2018-08-23 02:51:08.204954","192.168.2.3","216.58.197.4","TLSv1.2","155","Application Data"
"115","2018-08-23 02:51:08.284978","192.168.2.3","216.58.197.4","TCP","1434","34325  >  443 [ACK] Seq=82542 Ack=39 Win=661 Len=1368 TSval=8135038 TSecr=600698222 [TCP segment of a reassembled PDU]"
"116","2018-08-23 02:51:08.284983","192.168.2.3","216.58.197.4","TCP","1434","34325  >  443 [ACK] Seq=83910 Ack=39 Win=661 Len=1368 TSval=8135038 TSecr=600698222 [TCP segment of a reassembled PDU]"
"117","2018-08-23 02:51:08.284985","192.168.2.3","216.58.197.4","TLSv1.2","212","Application Data"
"118","2018-08-23 02:51:08.285352","192.168.2.3","216.58.197.4","TCP","1434","34325  >  443 [ACK] Seq=85424 Ack=39 Win=661 Len=1368 TSval=8135038 TSecr=600698222 [TCP segment of a reassembled PDU]"
"119","2018-08-23 02:51:08.285356","192.168.2.3","216.58.197.4","TLSv1.2","155","Application Data"
"125","2018-08-23 02:51:08.320034","192.168.2.3","216.58.197.4","TCP","66","34325  >  443 [ACK] Seq=86881 Ack=409 Win=661 Len=0 TSval=8135041 TSecr=600698332"
"126","2018-08-23 02:51:08.368247","192.168.2.3","216.58.197.4","TCP","1434","34325  >  443 [ACK] Seq=86881 Ack=409 Win=661 Len=1368 TSval=8135046 TSecr=600698332 [TCP segment of a reassembled PDU]"
"127","2018-08-23 02:51:08.368251","192.168.2.3","216.58.197.4","TCP","1434","34325  >  443 [ACK] Seq=88249 Ack=409 Win=661 Len=1368 TSval=8135046 TSecr=600698332 [TCP segment of a reassembled PDU]"
"128","2018-08-23 02:51:08.368407","192.168.2.3","216.58.197.4","TLSv1.2","212","Application Data"
"129","2018-08-23 02:51:08.368632","192.168.2.3","216.58.197.4","TCP","1434","34325  >  443 [ACK] Seq=89763 Ack=409 Win=661 Len=1368 TSval=8135046 TSecr=600698332 [TCP segment of a reassembled PDU]"
"130","2018-08-23 02:51:08.368636","192.168.2.3","216.58.197.4","TLSv1.2","155","Application Data"
"135","2018-08-23 02:51:08.421653","192.168.2.3","216.58.197.4","TCP","66","34325  >  443 [ACK] Seq=91220 Ack=521 Win=661 Len=0 TSval=8135052 TSecr=600698403"
"138","2018-08-23 02:51:08.473284","192.168.2.3","216.58.197.4","TCP","1434","34325  >  443 [ACK] Seq=91220 Ack=521 Win=661 Len=1368 TSval=8135057 TSecr=600698403 [TCP segment of a reassembled PDU]"
"139","2018-08-23 02:51:08.473621","192.168.2.3","216.58.197.4","TCP","1434","34325  >  443 [ACK] Seq=92588 Ack=521 Win=661 Len=1368 TSval=8135057 TSecr=600698403 [TCP segment of a reassembled PDU]"
"140","2018-08-23 02:51:08.473624","192.168.2.3","216.58.197.4","TLSv1.2","212","Application Data"
"141","2018-08-23 02:51:08.473624","192.168.2.3","216.58.197.4","TLSv1.2","469","Application Data"
"145","2018-08-23 02:51:08.493757","192.168.2.3","172.217.27.170","TCP","74","55868  >  443 [SYN] Seq=0 Win=14600 Len=0 MSS=1460 SACK_PERM=1 TSval=8135059 TSecr=0 WS=64"
"147","2018-08-23 02:51:08.500539","192.168.2.3","172.217.27.170","TCP","66","55868  >  443 [ACK] Seq=1 Ack=1 Win=14656 Len=0 TSval=8135059 TSecr=1014427806"
"148","2018-08-23 02:51:08.501267","192.168.2.3","172.217.27.170","TLSv1.2","583","Client Hello"
"151","2018-08-23 02:51:08.507728","192.168.2.3","172.217.27.170","TCP","66","55868  >  443 [ACK] Seq=518 Ack=153 Win=15680 Len=0 TSval=8135060 TSecr=1014427813"
"152","2018-08-23 02:51:08.514171","192.168.2.3","172.217.27.170","TLSv1.2","266","Change Cipher Spec, Encrypted Handshake Message, Encrypted Handshake Message"
"154","2018-08-23 02:51:08.534296","192.168.2.3","172.217.27.170","TLSv1.2","151","Application Data"
"155","2018-08-23 02:51:08.534299","192.168.2.3","172.217.27.170","TLSv1.2","96","Application Data"
"156","2018-08-23 02:51:08.534299","192.168.2.3","172.217.27.170","TLSv1.2","301","Application Data"
"157","2018-08-23 02:51:08.534375","192.168.2.3","172.217.27.170","TCP","1434","55868  >  443 [ACK] Seq=1068 Ack=214 Win=15680 Len=1368 TSval=8135062 TSecr=1014427826 [TCP segment of a reassembled PDU]"
"158","2018-08-23 02:51:08.534765","192.168.2.3","172.217.27.170","TCP","1434","55868  >  443 [ACK] Seq=2436 Ack=214 Win=15680 Len=1368 TSval=8135062 TSecr=1014427826 [TCP segment of a reassembled PDU]"
"159","2018-08-23 02:51:08.534768","192.168.2.3","172.217.27.170","TLSv1.2","212","Application Data"
"160","2018-08-23 02:51:08.534769","192.168.2.3","172.217.27.170","TLSv1.2","796","Application Data"
"165","2018-08-23 02:51:08.546121","192.168.2.3","216.58.197.4","TCP","66","34325  >  443 [ACK] Seq=94505 Ack=777 Win=661 Len=0 TSval=8135064 TSecr=600698558"
"166","2018-08-23 02:51:08.561378","192.168.2.3","216.58.197.4","TCP","1434","34325  >  443 [ACK] Seq=94505 Ack=777 Win=661 Len=1368 TSval=8135065 TSecr=600698558 [TCP segment of a reassembled PDU]"
"167","2018-08-23 02:51:08.564544","192.168.2.3","216.58.197.4","TCP","1434","34325  >  443 [ACK] Seq=95873 Ack=777 Win=661 Len=1368 TSval=8135065 TSecr=600698558 [TCP segment of a reassembled PDU]"
"168","2018-08-23 02:51:08.564546","192.168.2.3","216.58.197.4","TLSv1.2","212","Application Data"
"169","2018-08-23 02:51:08.564547","192.168.2.3","216.58.197.4","TCP","1434","34325  >  443 [ACK] Seq=97387 Ack=777 Win=661 Len=1368 TSval=8135065 TSecr=600698558 [TCP segment of a reassembled PDU]"
"170","2018-08-23 02:51:08.564730","192.168.2.3","216.58.197.4","TLSv1.2","155","Application Data"
"173","2018-08-23 02:51:08.572977","192.168.2.3","172.217.27.170","TCP","66","55868  >  443 [ACK] Seq=4680 Ack=244 Win=15680 Len=0 TSval=8135067 TSecr=1014427846"
"179","2018-08-23 02:51:08.592059","192.168.2.3","172.217.27.170","TCP","66","55868  >  443 [ACK] Seq=4680 Ack=440 Win=16768 Len=0 TSval=8135069 TSecr=1014427897"
"180","2018-08-23 02:51:08.592061","192.168.2.3","172.217.27.170","TCP","66","55868  >  443 [ACK] Seq=4680 Ack=637 Win=17856 Len=0 TSval=8135069 TSecr=1014427897"
"181","2018-08-23 02:51:08.592402","192.168.2.3","172.217.27.170","TCP","66","55868  >  443 [ACK] Seq=4680 Ack=915 Win=18944 Len=0 TSval=8135069 TSecr=1014427897"
"182","2018-08-23 02:51:08.592538","192.168.2.3","172.217.27.170","TCP","66","55868  >  443 [ACK] Seq=4680 Ack=953 Win=18944 Len=0 TSval=8135069 TSecr=1014427897"
"183","2018-08-23 02:51:08.599348","192.168.2.3","172.217.27.170","TLSv1.2","104","Application Data"
"185","2018-08-23 02:51:08.653885","192.168.2.3","216.58.197.4","TCP","1434","34325  >  443 [ACK] Seq=98844 Ack=777 Win=661 Len=1368 TSval=8135074 TSecr=600698582 [TCP segment of a reassembled PDU]"
"186","2018-08-23 02:51:08.653890","192.168.2.3","216.58.197.4","TCP","1434","34325  >  443 [ACK] Seq=100212 Ack=777 Win=661 Len=1368 TSval=8135074 TSecr=600698582 [TCP segment of a reassembled PDU]"
"187","2018-08-23 02:51:08.653891","192.168.2.3","216.58.197.4","TLSv1.2","212","Application Data"
"188","2018-08-23 02:51:08.654182","192.168.2.3","216.58.197.4","TCP","1434","34325  >  443 [ACK] Seq=101726 Ack=777 Win=661 Len=1368 TSval=8135074 TSecr=600698582 [TCP segment of a reassembled PDU]"
"189","2018-08-23 02:51:08.654185","192.168.2.3","216.58.197.4","TLSv1.2","155","Application Data"
"193","2018-08-23 02:51:08.718576","192.168.2.3","216.58.197.4","TCP","1434","34325  >  443 [ACK] Seq=103183 Ack=777 Win=661 Len=1368 TSval=8135081 TSecr=600698712 [TCP segment of a reassembled PDU]"
"194","2018-08-23 02:51:08.718917","192.168.2.3","216.58.197.4","TCP","1434","34325  >  443 [ACK] Seq=104551 Ack=777 Win=661 Len=1368 TSval=8135081 TSecr=600698712 [TCP segment of a reassembled PDU]"
"195","2018-08-23 02:51:08.718920","192.168.2.3","216.58.197.4","TLSv1.2","212","Application Data"
"196","2018-08-23 02:51:08.719227","192.168.2.3","216.58.197.4","TCP","1434","34325  >  443 [ACK] Seq=106065 Ack=777 Win=661 Len=1368 TSval=8135081 TSecr=600698712 [TCP segment of a reassembled PDU]"
"197","2018-08-23 02:51:08.719229","192.168.2.3","216.58.197.4","TLSv1.2","155","Application Data"
"201","2018-08-23 02:51:08.814925","192.168.2.3","216.58.197.4","TCP","1434","34325  >  443 [ACK] Seq=107522 Ack=777 Win=661 Len=1368 TSval=8135091 TSecr=600698737 [TCP segment of a reassembled PDU]"
"202","2018-08-23 02:51:08.815418","192.168.2.3","216.58.197.4","TCP","1434","34325  >  443 [ACK] Seq=108890 Ack=777 Win=661 Len=1368 TSval=8135091 TSecr=600698737 [TCP segment of a reassembled PDU]"
"203","2018-08-23 02:51:08.815422","192.168.2.3","216.58.197.4","TLSv1.2","212","Application Data"
"204","2018-08-23 02:51:08.815422","192.168.2.3","216.58.197.4","TCP","1434","34325  >  443 [ACK] Seq=110404 Ack=777 Win=661 Len=1368 TSval=8135091 TSecr=600698737 [TCP segment of a reassembled PDU]"
"205","2018-08-23 02:51:08.815577","192.168.2.3","216.58.197.4","TLSv1.2","155","Application Data"
"209","2018-08-23 02:51:08.909711","192.168.2.3","216.58.197.4","TCP","1434","34325  >  443 [ACK] Seq=111861 Ack=777 Win=661 Len=1368 TSval=8135100 TSecr=600698833 [TCP segment of a reassembled PDU]"
"210","2018-08-23 02:51:08.910025","192.168.2.3","216.58.197.4","TCP","1434","34325  >  443 [ACK] Seq=113229 Ack=777 Win=661 Len=1368 TSval=8135100 TSecr=600698833 [TCP segment of a reassembled PDU]"
"211","2018-08-23 02:51:08.910027","192.168.2.3","216.58.197.4","TLSv1.2","212","Application Data"
"212","2018-08-23 02:51:08.910486","192.168.2.3","216.58.197.4","TCP","1434","34325  >  443 [ACK] Seq=114743 Ack=777 Win=661 Len=1368 TSval=8135100 TSecr=600698833 [TCP segment of a reassembled PDU]"
"213","2018-08-23 02:51:08.910489","192.168.2.3","216.58.197.4","TLSv1.2","155","Application Data"
"217","2018-08-23 02:51:09.004804","192.168.2.3","216.58.197.4","TCP","1434","34325  >  443 [ACK] Seq=116200 Ack=777 Win=661 Len=1368 TSval=8135110 TSecr=600698928 [TCP segment of a reassembled PDU]"
"218","2018-08-23 02:51:09.005147","192.168.2.3","216.58.197.4","TCP","1434","34325  >  443 [ACK] Seq=117568 Ack=777 Win=661 Len=1368 TSval=8135110 TSecr=600698928 [TCP segment of a reassembled PDU]"
"219","2018-08-23 02:51:09.005149","192.168.2.3","216.58.197.4","TLSv1.2","212","Application Data"
"220","2018-08-23 02:51:09.005150","192.168.2.3","216.58.197.4","TCP","1434","34325  >  443 [ACK] Seq=119082 Ack=777 Win=661 Len=1368 TSval=8135110 TSecr=600698928 [TCP segment of a reassembled PDU]"
"221","2018-08-23 02:51:09.005368","192.168.2.3","216.58.197.4","TLSv1.2","155","Application Data"
"224","2018-08-23 02:51:09.099956","192.168.2.3","216.58.197.4","TCP","1434","34325  >  443 [ACK] Seq=120539 Ack=777 Win=661 Len=1368 TSval=8135119 TSecr=600699023 [TCP segment of a reassembled PDU]"
"225","2018-08-23 02:51:09.100320","192.168.2.3","216.58.197.4","TCP","1434","34325  >  443 [ACK] Seq=121907 Ack=777 Win=661 Len=1368 TSval=8135119 TSecr=600699023 [TCP segment of a reassembled PDU]"
"226","2018-08-23 02:51:09.100322","192.168.2.3","216.58.197.4","TLSv1.2","212","Application Data"
"227","2018-08-23 02:51:09.100661","192.168.2.3","216.58.197.4","TCP","1434","34325  >  443 [ACK] Seq=123421 Ack=777 Win=661 Len=1368 TSval=8135119 TSecr=600699023 [TCP segment of a reassembled PDU]"
"228","2018-08-23 02:51:09.100663","192.168.2.3","216.58.197.4","TLSv1.2","155","Application Data"
"234","2018-08-23 02:51:09.154458","192.168.2.3","216.58.197.4","TCP","66","34325  >  443 [ACK] Seq=124878 Ack=1067 Win=661 Len=0 TSval=8135125 TSecr=600699164"
"235","2018-08-23 02:51:09.171612","192.168.2.3","216.58.197.4","TCP","1434","34325  >  443 [ACK] Seq=124878 Ack=1067 Win=661 Len=1368 TSval=8135126 TSecr=600699164 [TCP segment of a reassembled PDU]"
"236","2018-08-23 02:51:09.171854","192.168.2.3","216.58.197.4","TCP","1434","34325  >  443 [ACK] Seq=126246 Ack=1067 Win=661 Len=1368 TSval=8135126 TSecr=600699164 [TCP segment of a reassembled PDU]"
"237","2018-08-23 02:51:09.171856","192.168.2.3","216.58.197.4","TLSv1.2","212","Application Data"
"238","2018-08-23 02:51:09.172041","192.168.2.3","216.58.197.4","TCP","1434","34325  >  443 [ACK] Seq=127760 Ack=1067 Win=661 Len=1368 TSval=8135126 TSecr=600699164 [TCP segment of a reassembled PDU]"
"239","2018-08-23 02:51:09.172060","192.168.2.3","216.58.197.4","TLSv1.2","155","Application Data"
"245","2018-08-23 02:51:09.226766","192.168.2.3","216.58.197.4","TCP","66","34325  >  443 [ACK] Seq=129217 Ack=1270 Win=661 Len=0 TSval=8135132 TSecr=600699238"
"246","2018-08-23 02:51:09.275616","192.168.2.3","216.58.197.4","TCP","1434","34325  >  443 [ACK] Seq=129217 Ack=1270 Win=661 Len=1368 TSval=8135137 TSecr=600699238 [TCP segment of a reassembled PDU]"
"247","2018-08-23 02:51:09.276037","192.168.2.3","216.58.197.4","TCP","1434","34325  >  443 [ACK] Seq=130585 Ack=1270 Win=661 Len=1368 TSval=8135137 TSecr=600699238 [TCP segment of a reassembled PDU]"
"248","2018-08-23 02:51:09.276041","192.168.2.3","216.58.197.4","TLSv1.2","212","Application Data"
"249","2018-08-23 02:51:09.276042","192.168.2.3","216.58.197.4","TLSv1.2","455","Application Data"
"254","2018-08-23 02:51:09.293710","192.168.2.3","216.58.197.4","TCP","66","34325  >  443 [ACK] Seq=132488 Ack=1553 Win=661 Len=0 TSval=8135139 TSecr=600699294"
"255","2018-08-23 02:51:09.331369","192.168.2.3","216.58.197.4","TCP","1434","34325  >  443 [ACK] Seq=132488 Ack=1553 Win=661 Len=1368 TSval=8135142 TSecr=600699294 [TCP segment of a reassembled PDU]"
"256","2018-08-23 02:51:09.331842","192.168.2.3","216.58.197.4","TCP","1434","34325  >  443 [ACK] Seq=133856 Ack=1553 Win=661 Len=1368 TSval=8135142 TSecr=600699294 [TCP segment of a reassembled PDU]"
"257","2018-08-23 02:51:09.331845","192.168.2.3","216.58.197.4","TLSv1.2","212","Application Data"
"258","2018-08-23 02:51:09.331846","192.168.2.3","216.58.197.4","TCP","1434","34325  >  443 [ACK] Seq=135370 Ack=1553 Win=661 Len=1368 TSval=8135142 TSecr=600699294 [TCP segment of a reassembled PDU]"
"259","2018-08-23 02:51:09.331961","192.168.2.3","216.58.197.4","TLSv1.2","155","Application Data"
"263","2018-08-23 02:51:09.422711","192.168.2.3","216.58.197.4","TCP","1434","34325  >  443 [ACK] Seq=136827 Ack=1553 Win=661 Len=1368 TSval=8135152 TSecr=600699390 [TCP segment of a reassembled PDU]"
"264","2018-08-23 02:51:09.423069","192.168.2.3","216.58.197.4","TCP","1434","34325  >  443 [ACK] Seq=138195 Ack=1553 Win=661 Len=1368 TSval=8135152 TSecr=600699390 [TCP segment of a reassembled PDU]"
"265","2018-08-23 02:51:09.423071","192.168.2.3","216.58.197.4","TLSv1.2","212","Application Data"
"266","2018-08-23 02:51:09.423072","192.168.2.3","216.58.197.4","TCP","1434","34325  >  443 [ACK] Seq=139709 Ack=1553 Win=661 Len=1368 TSval=8135152 TSecr=600699390 [TCP segment of a reassembled PDU]"
"267","2018-08-23 02:51:09.423264","192.168.2.3","216.58.197.4","TLSv1.2","155","Application Data"
"272","2018-08-23 02:51:09.478693","192.168.2.3","216.58.197.4","TCP","66","34325  >  443 [ACK] Seq=141166 Ack=1986 Win=661 Len=0 TSval=8135157 TSecr=600699489"
"273","2018-08-23 02:51:09.516539","192.168.2.3","216.58.197.4","TCP","1434","34325  >  443 [ACK] Seq=141166 Ack=1986 Win=661 Len=1368 TSval=8135161 TSecr=600699489 [TCP segment of a reassembled PDU]"
"274","2018-08-23 02:51:09.516768","192.168.2.3","216.58.197.4","TCP","1434","34325  >  443 [ACK] Seq=142534 Ack=1986 Win=661 Len=1368 TSval=8135161 TSecr=600699489 [TCP segment of a reassembled PDU]"
"275","2018-08-23 02:51:09.516770","192.168.2.3","216.58.197.4","TLSv1.2","212","Application Data"
"276","2018-08-23 02:51:09.517125","192.168.2.3","216.58.197.4","TCP","1434","34325  >  443 [ACK] Seq=144048 Ack=1986 Win=661 Len=1368 TSval=8135161 TSecr=600699489 [TCP segment of a reassembled PDU]"
"277","2018-08-23 02:51:09.517128","192.168.2.3","216.58.197.4","TLSv1.2","155","Application Data"
"283","2018-08-23 02:51:09.570581","192.168.2.3","216.58.197.4","TCP","66","34325  >  443 [ACK] Seq=145505 Ack=2204 Win=661 Len=0 TSval=8135166 TSecr=600699581"
"284","2018-08-23 02:51:09.617269","192.168.2.3","216.58.197.4","TCP","1434","34325  >  443 [ACK] Seq=145505 Ack=2204 Win=661 Len=1368 TSval=8135171 TSecr=600699581 [TCP segment of a reassembled PDU]"
"285","2018-08-23 02:51:09.617652","192.168.2.3","216.58.197.4","TCP","1434","34325  >  443 [ACK] Seq=146873 Ack=2204 Win=661 Len=1368 TSval=8135171 TSecr=600699581 [TCP segment of a reassembled PDU]"
"286","2018-08-23 02:51:09.617655","192.168.2.3","216.58.197.4","TLSv1.2","212","Application Data"
"287","2018-08-23 02:51:09.617656","192.168.2.3","216.58.197.4","TCP","1434","34325  >  443 [ACK] Seq=148387 Ack=2204 Win=661 Len=1368 TSval=8135171 TSecr=600699581 [TCP segment of a reassembled PDU]"
"288","2018-08-23 02:51:09.617828","192.168.2.3","216.58.197.4","TLSv1.2","155","Application Data"
"293","2018-08-23 02:51:09.681068","192.168.2.3","216.58.197.4","TCP","66","34325  >  443 [ACK] Seq=149844 Ack=2367 Win=661 Len=0 TSval=8135177 TSecr=600699690"
"294","2018-08-23 02:51:09.722131","192.168.2.3","216.58.197.4","TCP","1434","34325  >  443 [ACK] Seq=149844 Ack=2367 Win=661 Len=1368 TSval=8135182 TSecr=600699690 [TCP segment of a reassembled PDU]"
"295","2018-08-23 02:51:09.722608","192.168.2.3","216.58.197.4","TCP","1434","34325  >  443 [ACK] Seq=151212 Ack=2367 Win=661 Len=1368 TSval=8135182 TSecr=600699690 [TCP segment of a reassembled PDU]"
"296","2018-08-23 02:51:09.722610","192.168.2.3","216.58.197.4","TLSv1.2","212","Application Data"
"297","2018-08-23 02:51:09.722611","192.168.2.3","216.58.197.4","TCP","1434","34325  >  443 [ACK] Seq=152726 Ack=2367 Win=661 Len=1368 TSval=8135182 TSecr=600699690 [TCP segment of a reassembled PDU]"
"298","2018-08-23 02:51:09.722742","192.168.2.3","216.58.197.4","TLSv1.2","155","Application Data"
"301","2018-08-23 02:51:09.775326","192.168.2.3","216.58.197.4","TCP","1434","34325  >  443 [ACK] Seq=154183 Ack=2367 Win=661 Len=1368 TSval=8135187 TSecr=600699740 [TCP segment of a reassembled PDU]"
"302","2018-08-23 02:51:09.775810","192.168.2.3","216.58.197.4","TCP","1434","34325  >  443 [ACK] Seq=155551 Ack=2367 Win=661 Len=1368 TSval=8135187 TSecr=600699740 [TCP segment of a reassembled PDU]"
"303","2018-08-23 02:51:09.775812","192.168.2.3","216.58.197.4","TLSv1.2","212","Application Data"
"304","2018-08-23 02:51:09.776087","192.168.2.3","216.58.197.4","TCP","1434","34325  >  443 [ACK] Seq=157065 Ack=2367 Win=661 Len=1368 TSval=8135187 TSecr=600699740 [TCP segment of a reassembled PDU]"
"305","2018-08-23 02:51:09.776091","192.168.2.3","216.58.197.4","TLSv1.2","155","Application Data"
"311","2018-08-23 02:51:09.800442","192.168.2.3","216.58.197.4","TCP","66","34325  >  443 [ACK] Seq=158522 Ack=2801 Win=661 Len=0 TSval=8135189 TSecr=600699803"
"312","2018-08-23 02:51:09.869690","192.168.2.3","216.58.197.4","TCP","1434","34325  >  443 [ACK] Seq=158522 Ack=2801 Win=661 Len=1368 TSval=8135196 TSecr=600699803 [TCP segment of a reassembled PDU]"
"313","2018-08-23 02:51:09.869698","192.168.2.3","216.58.197.4","TCP","1434","34325  >  443 [ACK] Seq=159890 Ack=2801 Win=661 Len=1368 TSval=8135196 TSecr=600699803 [TCP segment of a reassembled PDU]"
"314","2018-08-23 02:51:09.869699","192.168.2.3","216.58.197.4","TLSv1.2","212","Application Data"
"315","2018-08-23 02:51:09.870142","192.168.2.3","216.58.197.4","TCP","1434","34325  >  443 [ACK] Seq=161404 Ack=2801 Win=661 Len=1368 TSval=8135196 TSecr=600699803 [TCP segment of a reassembled PDU]"
"316","2018-08-23 02:51:09.870145","192.168.2.3","216.58.197.4","TLSv1.2","155","Application Data"
"321","2018-08-23 02:51:09.934638","192.168.2.3","216.58.197.4","TCP","66","34325  >  443 [ACK] Seq=162861 Ack=3106 Win=661 Len=0 TSval=8135203 TSecr=600699946"
"322","2018-08-23 02:51:09.967837","192.168.2.3","216.58.197.4","TCP","1434","34325  >  443 [ACK] Seq=162861 Ack=3106 Win=661 Len=1368 TSval=8135206 TSecr=600699946 [TCP segment of a reassembled PDU]"
"323","2018-08-23 02:51:09.967840","192.168.2.3","216.58.197.4","TCP","1434","34325  >  443 [ACK] Seq=164229 Ack=3106 Win=661 Len=1368 TSval=8135206 TSecr=600699946 [TCP segment of a reassembled PDU]"
"324","2018-08-23 02:51:09.967841","192.168.2.3","216.58.197.4","TLSv1.2","212","Application Data"
"325","2018-08-23 02:51:09.968023","192.168.2.3","216.58.197.4","TCP","1434","34325  >  443 [ACK] Seq=165743 Ack=3106 Win=661 Len=1368 TSval=8135206 TSecr=600699946 [TCP segment of a reassembled PDU]"
"326","2018-08-23 02:51:09.968281","192.168.2.3","216.58.197.4","TLSv1.2","155","Application Data"
"330","2018-08-23 02:51:10.034361","192.168.2.3","216.58.197.4","TCP","1434","34325  >  443 [ACK] Seq=167200 Ack=3106 Win=661 Len=1368 TSval=8135213 TSecr=600700026 [TCP segment of a reassembled PDU]"
"331","2018-08-23 02:51:10.034697","192.168.2.3","216.58.197.4","TCP","1434","34325  >  443 [ACK] Seq=168568 Ack=3106 Win=661 Len=1368 TSval=8135213 TSecr=600700026 [TCP segment of a reassembled PDU]"
"332","2018-08-23 02:51:10.034698","192.168.2.3","216.58.197.4","TLSv1.2","212","Application Data"
"333","2018-08-23 02:51:10.035147","192.168.2.3","216.58.197.4","TCP","1434","34325  >  443 [ACK] Seq=170082 Ack=3106 Win=661 Len=1368 TSval=8135213 TSecr=600700026 [TCP segment of a reassembled PDU]"
"334","2018-08-23 02:51:10.035149","192.168.2.3","216.58.197.4","TLSv1.2","155","Application Data"
"338","2018-08-23 02:51:10.129562","192.168.2.3","216.58.197.4","TCP","1434","34325  >  443 [ACK] Seq=171539 Ack=3106 Win=661 Len=1368 TSval=8135222 TSecr=600700052 [TCP segment of a reassembled PDU]"
"339","2018-08-23 02:51:10.129993","192.168.2.3","216.58.197.4","TCP","1434","34325  >  443 [ACK] Seq=172907 Ack=3106 Win=661 Len=1368 TSval=8135222 TSecr=600700052 [TCP segment of a reassembled PDU]"
"340","2018-08-23 02:51:10.129995","192.168.2.3","216.58.197.4","TLSv1.2","212","Application Data"
"341","2018-08-23 02:51:10.130248","192.168.2.3","216.58.197.4","TCP","1434","34325  >  443 [ACK] Seq=174421 Ack=3106 Win=661 Len=1368 TSval=8135222 TSecr=600700052 [TCP segment of a reassembled PDU]"
"342","2018-08-23 02:51:10.130251","192.168.2.3","216.58.197.4","TLSv1.2","155","Application Data"
"348","2018-08-23 02:51:10.180542","192.168.2.3","216.58.197.4","TCP","66","34325  >  443 [ACK] Seq=175878 Ack=3567 Win=661 Len=0 TSval=8135227 TSecr=600700191"
"349","2018-08-23 02:51:10.253438","192.168.2.3","216.58.197.4","TCP","1434","34325  >  443 [ACK] Seq=175878 Ack=3567 Win=661 Len=1368 TSval=8135235 TSecr=600700191 [TCP segment of a reassembled PDU]"
"350","2018-08-23 02:51:10.253750","192.168.2.3","216.58.197.4","TCP","1434","34325  >  443 [ACK] Seq=177246 Ack=3567 Win=661 Len=1368 TSval=8135235 TSecr=600700191 [TCP segment of a reassembled PDU]"
"351","2018-08-23 02:51:10.253768","192.168.2.3","216.58.197.4","TLSv1.2","212","Application Data"
"352","2018-08-23 02:51:10.253769","192.168.2.3","216.58.197.4","TCP","1434","34325  >  443 [ACK] Seq=178760 Ack=3567 Win=661 Len=1368 TSval=8135235 TSecr=600700191 [TCP segment of a reassembled PDU]"
"353","2018-08-23 02:51:10.253910","192.168.2.3","216.58.197.4","TLSv1.2","128","Application Data"
"357","2018-08-23 02:51:10.293457","192.168.2.3","216.58.197.4","TCP","66","34325  >  443 [ACK] Seq=180190 Ack=3798 Win=661 Len=0 TSval=8135239 TSecr=600700294"
"359","2018-08-23 02:51:10.351729","192.168.2.3","216.58.197.4","TCP","1434","34325  >  443 [ACK] Seq=180190 Ack=3971 Win=661 Len=1368 TSval=8135244 TSecr=600700358 [TCP segment of a reassembled PDU]"
"360","2018-08-23 02:51:10.352281","192.168.2.3","216.58.197.4","TCP","1434","34325  >  443 [ACK] Seq=181558 Ack=3971 Win=661 Len=1368 TSval=8135244 TSecr=600700358 [TCP segment of a reassembled PDU]"
"361","2018-08-23 02:51:10.352284","192.168.2.3","216.58.197.4","TLSv1.2","212","Application Data"
"362","2018-08-23 02:51:10.352699","192.168.2.3","216.58.197.4","TCP","1434","34325  >  443 [ACK] Seq=183072 Ack=3971 Win=661 Len=1368 TSval=8135245 TSecr=600700358 [TCP segment of a reassembled PDU]"
"363","2018-08-23 02:51:10.352701","192.168.2.3","216.58.197.4","TLSv1.2","155","Application Data"
"368","2018-08-23 02:51:10.407513","192.168.2.3","192.168.2.1","TCP","183","8009  >  53029 [PSH, ACK] Seq=118 Ack=235 Win=277 Len=117 TSval=8135250 TSecr=2318603803 [TCP segment of a reassembled PDU]"
"370","2018-08-23 02:51:10.450577","192.168.2.3","216.58.197.4","TCP","1434","34325  >  443 [ACK] Seq=184529 Ack=3971 Win=661 Len=1368 TSval=8135254 TSecr=600700411 [TCP segment of a reassembled PDU]"
"371","2018-08-23 02:51:10.450581","192.168.2.3","216.58.197.4","TCP","1434","34325  >  443 [ACK] Seq=185897 Ack=3971 Win=661 Len=1368 TSval=8135254 TSecr=600700411 [TCP segment of a reassembled PDU]"
"372","2018-08-23 02:51:10.450702","192.168.2.3","216.58.197.4","TLSv1.2","212","Application Data"
"373","2018-08-23 02:51:10.451012","192.168.2.3","216.58.197.4","TCP","1434","34325  >  443 [ACK] Seq=187411 Ack=3971 Win=661 Len=1368 TSval=8135254 TSecr=600700411 [TCP segment of a reassembled PDU]"
"374","2018-08-23 02:51:10.451014","192.168.2.3","216.58.197.4","TLSv1.2","155","Application Data"
"377","2018-08-23 02:51:10.541662","192.168.2.3","23.1.99.33","TCP","66","51031  >  443 [ACK] Seq=1 Ack=1 Win=5246 Len=0 TSval=8135264 TSecr=1621971417"
"378","2018-08-23 02:51:10.542527","192.168.2.3","216.58.197.4","TCP","1434","34325  >  443 [ACK] Seq=188868 Ack=3971 Win=661 Len=1368 TSval=8135264 TSecr=600700468 [TCP segment of a reassembled PDU]"
"379","2018-08-23 02:51:10.542933","192.168.2.3","216.58.197.4","TCP","1434","34325  >  443 [ACK] Seq=190236 Ack=3971 Win=661 Len=1368 TSval=8135264 TSecr=600700468 [TCP segment of a reassembled PDU]"
"380","2018-08-23 02:51:10.542936","192.168.2.3","216.58.197.4","TLSv1.2","212","Application Data"
"381","2018-08-23 02:51:10.543295","192.168.2.3","216.58.197.4","TCP","1434","34325  >  443 [ACK] Seq=191750 Ack=3971 Win=661 Len=1368 TSval=8135264 TSecr=600700468 [TCP segment of a reassembled PDU]"
"382","2018-08-23 02:51:10.543297","192.168.2.3","216.58.197.4","TLSv1.2","155","Application Data"
"388","2018-08-23 02:51:10.594510","192.168.2.3","216.58.197.4","TCP","66","34325  >  443 [ACK] Seq=193207 Ack=4413 Win=661 Len=0 TSval=8135269 TSecr=600700604"
"389","2018-08-23 02:51:10.639352","192.168.2.3","216.58.197.4","TCP","1434","34325  >  443 [ACK] Seq=193207 Ack=4413 Win=661 Len=1368 TSval=8135273 TSecr=600700604 [TCP segment of a reassembled PDU]"
"390","2018-08-23 02:51:10.639692","192.168.2.3","216.58.197.4","TCP","1434","34325  >  443 [ACK] Seq=194575 Ack=4413 Win=661 Len=1368 TSval=8135273 TSecr=600700604 [TCP segment of a reassembled PDU]"
"391","2018-08-23 02:51:10.639696","192.168.2.3","216.58.197.4","TLSv1.2","212","Application Data"
"392","2018-08-23 02:51:10.639898","192.168.2.3","216.58.197.4","TCP","1434","34325  >  443 [ACK] Seq=196089 Ack=4413 Win=661 Len=1368 TSval=8135273 TSecr=600700604 [TCP segment of a reassembled PDU]"
"393","2018-08-23 02:51:10.639901","192.168.2.3","216.58.197.4","TLSv1.2","155","Application Data"
"400","2018-08-23 02:51:10.708063","192.168.2.3","216.58.197.4","TCP","66","34325  >  443 [ACK] Seq=197546 Ack=4807 Win=661 Len=0 TSval=8135280 TSecr=600700719"
"401","2018-08-23 02:51:10.765705","192.168.2.3","216.58.197.4","TCP","1434","34325  >  443 [ACK] Seq=197546 Ack=4807 Win=661 Len=1368 TSval=8135286 TSecr=600700719 [TCP segment of a reassembled PDU]"
"402","2018-08-23 02:51:10.765959","192.168.2.3","216.58.197.4","TCP","1434","34325  >  443 [ACK] Seq=198914 Ack=4807 Win=661 Len=1368 TSval=8135286 TSecr=600700719 [TCP segment of a reassembled PDU]"
"403","2018-08-23 02:51:10.765962","192.168.2.3","216.58.197.4","TLSv1.2","212","Application Data"
"404","2018-08-23 02:51:10.766337","192.168.2.3","216.58.197.4","TCP","1434","34325  >  443 [ACK] Seq=200428 Ack=4807 Win=661 Len=1368 TSval=8135286 TSecr=600700719 [TCP segment of a reassembled PDU]"
"405","2018-08-23 02:51:10.766340","192.168.2.3","216.58.197.4","TLSv1.2","155","Application Data"
"409","2018-08-23 02:51:10.862406","192.168.2.3","216.58.197.4","TCP","1434","34325  >  443 [ACK] Seq=201885 Ack=4807 Win=661 Len=1368 TSval=8135296 TSecr=600700784 [TCP segment of a reassembled PDU]"
"410","2018-08-23 02:51:10.862817","192.168.2.3","216.58.197.4","TCP","1434","34325  >  443 [ACK] Seq=203253 Ack=4807 Win=661 Len=1368 TSval=8135296 TSecr=600700784 [TCP segment of a reassembled PDU]"
"411","2018-08-23 02:51:10.862820","192.168.2.3","216.58.197.4","TLSv1.2","212","Application Data"
"412","2018-08-23 02:51:10.862821","192.168.2.3","216.58.197.4","TCP","1434","34325  >  443 [ACK] Seq=204767 Ack=4807 Win=661 Len=1368 TSval=8135296 TSecr=600700784 [TCP segment of a reassembled PDU]"
"413","2018-08-23 02:51:10.862822","192.168.2.3","216.58.197.4","TLSv1.2","155","Application Data"
"418","2018-08-23 02:51:10.914560","192.168.2.3","216.58.197.4","TCP","66","34325  >  443 [ACK] Seq=206224 Ack=5185 Win=661 Len=0 TSval=8135301 TSecr=600700925"
"421","2018-08-23 02:51:10.948257","192.168.2.3","216.58.197.4","TCP","66","34325  >  443 [ACK] Seq=206224 Ack=5878 Win=661 Len=0 TSval=8135304 TSecr=600700959"
