"No.","Time","Source","Destination","Protocol","Length","Info"
"2","2018-08-23 03:05:55.717330","192.168.2.3","216.58.197.4","TLSv1.2","156","Application Data"
"3","2018-08-23 03:05:55.717724","192.168.2.3","216.58.197.4","TLSv1.2","104","Application Data"
"4","2018-08-23 03:05:55.717726","192.168.2.3","216.58.197.4","TLSv1.2","159","Application Data"
"9","2018-08-23 03:05:55.737935","192.168.2.3","216.58.197.4","TCP","1434","34325  >  443 [ACK] Seq=222 Ack=39 Win=661 Len=1368 TSval=8223782 TSecr=601585736 [TCP segment of a reassembled PDU]"
"10","2018-08-23 03:05:55.737938","192.168.2.3","216.58.197.4","TCP","1434","34325  >  443 [ACK] Seq=1590 Ack=39 Win=661 Len=1368 TSval=8223782 TSecr=601585736 [TCP segment of a reassembled PDU]"
"11","2018-08-23 03:05:55.737939","192.168.2.3","216.58.197.4","TLSv1.2","212","Application Data"
"12","2018-08-23 03:05:55.738340","192.168.2.3","216.58.197.4","TCP","1434","34325  >  443 [ACK] Seq=3104 Ack=39 Win=661 Len=1368 TSval=8223782 TSecr=601585736 [TCP segment of a reassembled PDU]"
"13","2018-08-23 03:05:55.738343","192.168.2.3","216.58.197.4","TLSv1.2","404","Application Data"
"14","2018-08-23 03:05:55.738485","192.168.2.3","216.58.197.4","TCP","1434","34325  >  443 [ACK] Seq=4810 Ack=39 Win=661 Len=1368 TSval=8223782 TSecr=601585736 [TCP segment of a reassembled PDU]"
"15","2018-08-23 03:05:55.738486","192.168.2.3","216.58.197.4","TCP","1434","34325  >  443 [ACK] Seq=6178 Ack=39 Win=661 Len=1368 TSval=8223782 TSecr=601585736 [TCP segment of a reassembled PDU]"
"16","2018-08-23 03:05:55.738688","192.168.2.3","216.58.197.4","TLSv1.2","212","Application Data"
"17","2018-08-23 03:05:55.738689","192.168.2.3","216.58.197.4","TCP","1434","34325  >  443 [ACK] Seq=7692 Ack=39 Win=661 Len=1368 TSval=8223782 TSecr=601585736 [TCP segment of a reassembled PDU]"
"18","2018-08-23 03:05:55.738795","192.168.2.3","216.58.197.4","TLSv1.2","156","Application Data"
"24","2018-08-23 03:05:55.745319","192.168.2.3","216.58.197.4","TCP","1434","34325  >  443 [ACK] Seq=9150 Ack=39 Win=661 Len=1368 TSval=8223783 TSecr=601585756 [TCP segment of a reassembled PDU]"
"25","2018-08-23 03:05:55.745593","192.168.2.3","216.58.197.4","TCP","1434","34325  >  443 [ACK] Seq=10518 Ack=39 Win=661 Len=1368 TSval=8223783 TSecr=601585756 [TCP segment of a reassembled PDU]"
"26","2018-08-23 03:05:55.745595","192.168.2.3","216.58.197.4","TLSv1.2","1434","Application Data [TCP segment of a reassembled PDU]"
"27","2018-08-23 03:05:55.745841","192.168.2.3","216.58.197.4","TLSv1.2","1434","Application Data [TCP segment of a reassembled PDU]"
"28","2018-08-23 03:05:55.746233","192.168.2.3","216.58.197.4","TCP","1434","34325  >  443 [ACK] Seq=14622 Ack=39 Win=661 Len=1368 TSval=8223783 TSecr=601585757 [TCP segment of a reassembled PDU]"
"29","2018-08-23 03:05:55.746235","192.168.2.3","216.58.197.4","TLSv1.2","1434","Application Data [TCP segment of a reassembled PDU]"
"30","2018-08-23 03:05:55.746236","192.168.2.3","216.58.197.4","TLSv1.2","1434","Application Data [TCP segment of a reassembled PDU]"
"31","2018-08-23 03:05:55.746577","192.168.2.3","216.58.197.4","TCP","1434","34325  >  443 [ACK] Seq=18726 Ack=39 Win=661 Len=1368 TSval=8223783 TSecr=601585757 [TCP segment of a reassembled PDU]"
"32","2018-08-23 03:05:55.746867","192.168.2.3","216.58.197.4","TLSv1.2","1434","Application Data [TCP segment of a reassembled PDU]"
"33","2018-08-23 03:05:55.748429","192.168.2.3","216.58.197.4","TLSv1.2","1434","Application Data [TCP segment of a reassembled PDU]"
"34","2018-08-23 03:05:55.748871","192.168.2.3","216.58.197.4","TCP","1434","34325  >  443 [ACK] Seq=22830 Ack=39 Win=661 Len=1368 TSval=8223783 TSecr=601585757 [TCP segment of a reassembled PDU]"
"35","2018-08-23 03:05:55.748874","192.168.2.3","216.58.197.4","TLSv1.2","1434","Application Data [TCP segment of a reassembled PDU]"
"36","2018-08-23 03:05:55.749165","192.168.2.3","216.58.197.4","TLSv1.2","1434","Application Data [TCP segment of a reassembled PDU]"
"37","2018-08-23 03:05:55.749471","192.168.2.3","216.58.197.4","TCP","1434","34325  >  443 [ACK] Seq=26934 Ack=39 Win=661 Len=1368 TSval=8223783 TSecr=601585757 [TCP segment of a reassembled PDU]"
"38","2018-08-23 03:05:55.749979","192.168.2.3","216.58.197.4","TLSv1.2","1434","Application Data [TCP segment of a reassembled PDU]"
"46","2018-08-23 03:05:55.756847","192.168.2.3","216.58.197.4","TLSv1.2","1434","Application Data [TCP segment of a reassembled PDU]"
"47","2018-08-23 03:05:55.756849","192.168.2.3","216.58.197.4","TCP","1434","34325  >  443 [ACK] Seq=31038 Ack=39 Win=661 Len=1368 TSval=8223784 TSecr=601585764 [TCP segment of a reassembled PDU]"
"48","2018-08-23 03:05:55.757113","192.168.2.3","216.58.197.4","TLSv1.2","1434","Application Data [TCP segment of a reassembled PDU]"
"49","2018-08-23 03:05:55.757337","192.168.2.3","216.58.197.4","TCP","1434","34325  >  443 [ACK] Seq=33774 Ack=39 Win=661 Len=1368 TSval=8223784 TSecr=601585764 [TCP segment of a reassembled PDU]"
"50","2018-08-23 03:05:55.757340","192.168.2.3","216.58.197.4","TLSv1.2","1434","Application Data [TCP segment of a reassembled PDU]"
"51","2018-08-23 03:05:55.757773","192.168.2.3","216.58.197.4","TCP","1434","34325  >  443 [ACK] Seq=36510 Ack=39 Win=661 Len=1368 TSval=8223784 TSecr=601585764 [TCP segment of a reassembled PDU]"
"52","2018-08-23 03:05:55.757991","192.168.2.3","216.58.197.4","TLSv1.2","1434","Application Data [TCP segment of a reassembled PDU]"
"53","2018-08-23 03:05:55.758221","192.168.2.3","216.58.197.4","TLSv1.2","1434","Application Data [TCP segment of a reassembled PDU]"
"54","2018-08-23 03:05:55.758223","192.168.2.3","216.58.197.4","TCP","1434","34325  >  443 [ACK] Seq=40614 Ack=39 Win=661 Len=1368 TSval=8223784 TSecr=601585765 [TCP segment of a reassembled PDU]"
"55","2018-08-23 03:05:55.758753","192.168.2.3","216.58.197.4","TLSv1.2","1434","Application Data [TCP segment of a reassembled PDU]"
"56","2018-08-23 03:05:55.758755","192.168.2.3","216.58.197.4","TLSv1.2","1434","Application Data [TCP segment of a reassembled PDU]"
"57","2018-08-23 03:05:55.758974","192.168.2.3","216.58.197.4","TCP","1434","34325  >  443 [ACK] Seq=44718 Ack=39 Win=661 Len=1368 TSval=8223784 TSecr=601585765 [TCP segment of a reassembled PDU]"
"60","2018-08-23 03:05:55.761623","192.168.2.3","216.58.197.4","TLSv1.2","1434","Application Data [TCP segment of a reassembled PDU]"
"61","2018-08-23 03:05:55.761625","192.168.2.3","216.58.197.4","TCP","1434","34325  >  443 [ACK] Seq=47454 Ack=39 Win=661 Len=1368 TSval=8223784 TSecr=601585767 [TCP segment of a reassembled PDU]"
"63","2018-08-23 03:05:55.761884","192.168.2.3","216.58.197.4","TLSv1.2","1434","Application Data [TCP segment of a reassembled PDU]"
"64","2018-08-23 03:05:55.761887","192.168.2.3","216.58.197.4","TCP","1434","34325  >  443 [ACK] Seq=50190 Ack=39 Win=661 Len=1368 TSval=8223784 TSecr=601585767 [TCP segment of a reassembled PDU]"
"65","2018-08-23 03:05:55.762106","192.168.2.3","216.58.197.4","TLSv1.2","1434","Application Data [TCP segment of a reassembled PDU]"
"67","2018-08-23 03:05:55.762535","192.168.2.3","216.58.197.4","TCP","1434","34325  >  443 [ACK] Seq=52926 Ack=39 Win=661 Len=1368 TSval=8223784 TSecr=601585768 [TCP segment of a reassembled PDU]"
"69","2018-08-23 03:05:55.762682","192.168.2.3","216.58.197.4","TLSv1.2","1434","Application Data [TCP segment of a reassembled PDU]"
"73","2018-08-23 03:05:55.766123","192.168.2.3","216.58.197.4","TCP","1434","34325  >  443 [PSH, ACK] Seq=55662 Ack=39 Win=661 Len=1368 TSval=8223785 TSecr=601585775 [TCP segment of a reassembled PDU]"
"74","2018-08-23 03:05:55.766126","192.168.2.3","216.58.197.4","TLSv1.2","1434","Application Data [TCP segment of a reassembled PDU]"
"76","2018-08-23 03:05:55.766494","192.168.2.3","216.58.197.4","TCP","1434","34325  >  443 [ACK] Seq=58398 Ack=39 Win=661 Len=1368 TSval=8223785 TSecr=601585775 [TCP segment of a reassembled PDU]"
"77","2018-08-23 03:05:55.766497","192.168.2.3","216.58.197.4","TLSv1.2","1434","Application Data [TCP segment of a reassembled PDU]"
"78","2018-08-23 03:05:55.766845","192.168.2.3","216.58.197.4","TCP","1434","34325  >  443 [ACK] Seq=61134 Ack=39 Win=661 Len=1368 TSval=8223785 TSecr=601585776 [TCP segment of a reassembled PDU]"
"80","2018-08-23 03:05:55.767018","192.168.2.3","216.58.197.4","TLSv1.2","1434","Application Data [TCP segment of a reassembled PDU]"
"81","2018-08-23 03:05:55.767280","192.168.2.3","216.58.197.4","TCP","1434","34325  >  443 [ACK] Seq=63870 Ack=39 Win=661 Len=1368 TSval=8223785 TSecr=601585776 [TCP segment of a reassembled PDU]"
"82","2018-08-23 03:05:55.767283","192.168.2.3","216.58.197.4","TLSv1.2","1434","Application Data [TCP segment of a reassembled PDU]"
"83","2018-08-23 03:05:55.767515","192.168.2.3","216.58.197.4","TCP","1434","34325  >  443 [ACK] Seq=66606 Ack=39 Win=661 Len=1368 TSval=8223785 TSecr=601585776 [TCP segment of a reassembled PDU]"
"84","2018-08-23 03:05:55.767735","192.168.2.3","216.58.197.4","TLSv1.2","1434","Application Data [TCP segment of a reassembled PDU]"
"85","2018-08-23 03:05:55.767737","192.168.2.3","216.58.197.4","TLSv1.2","435","Application Data"
"93","2018-08-23 03:05:55.821071","192.168.2.3","192.168.2.1","TCP","183","8009  >  53029 [PSH, ACK] Seq=1 Ack=118 Win=277 Len=117 TSval=8223791 TSecr=2319487137 [TCP segment of a reassembled PDU]"
"95","2018-08-23 03:05:55.865066","192.168.2.3","216.58.197.4","TCP","1434","34325  >  443 [ACK] Seq=69711 Ack=39 Win=661 Len=1368 TSval=8223795 TSecr=601585826 [TCP segment of a reassembled PDU]"
"96","2018-08-23 03:05:55.865071","192.168.2.3","216.58.197.4","TCP","1434","34325  >  443 [ACK] Seq=71079 Ack=39 Win=661 Len=1368 TSval=8223795 TSecr=601585826 [TCP segment of a reassembled PDU]"
"97","2018-08-23 03:05:55.865072","192.168.2.3","216.58.197.4","TLSv1.2","212","Application Data"
"98","2018-08-23 03:05:55.865206","192.168.2.3","216.58.197.4","TCP","1434","34325  >  443 [ACK] Seq=72593 Ack=39 Win=661 Len=1368 TSval=8223795 TSecr=601585826 [TCP segment of a reassembled PDU]"
"99","2018-08-23 03:05:55.865490","192.168.2.3","216.58.197.4","TLSv1.2","155","Application Data"
"102","2018-08-23 03:05:55.963851","192.168.2.3","216.58.197.4","TCP","1434","34325  >  443 [ACK] Seq=74050 Ack=39 Win=661 Len=1368 TSval=8223804 TSecr=601585884 [TCP segment of a reassembled PDU]"
"103","2018-08-23 03:05:55.963989","192.168.2.3","216.58.197.4","TCP","1434","34325  >  443 [ACK] Seq=75418 Ack=39 Win=661 Len=1368 TSval=8223804 TSecr=601585884 [TCP segment of a reassembled PDU]"
"104","2018-08-23 03:05:55.963992","192.168.2.3","216.58.197.4","TLSv1.2","212","Application Data"
"105","2018-08-23 03:05:55.964237","192.168.2.3","216.58.197.4","TCP","1434","34325  >  443 [ACK] Seq=76932 Ack=39 Win=661 Len=1368 TSval=8223804 TSecr=601585884 [TCP segment of a reassembled PDU]"
"106","2018-08-23 03:05:55.964240","192.168.2.3","216.58.197.4","TLSv1.2","155","Application Data"
"113","2018-08-23 03:05:56.022417","192.168.2.3","216.58.197.4","TCP","66","34325  >  443 [ACK] Seq=78389 Ack=582 Win=661 Len=0 TSval=8223811 TSecr=601586031"
"115","2018-08-23 03:05:56.058924","192.168.2.3","216.58.197.4","TCP","1434","34325  >  443 [ACK] Seq=78389 Ack=825 Win=661 Len=1368 TSval=8223814 TSecr=601586041 [TCP segment of a reassembled PDU]"
"116","2018-08-23 03:05:56.065612","192.168.2.3","216.58.197.4","TCP","1434","34325  >  443 [ACK] Seq=79757 Ack=825 Win=661 Len=1368 TSval=8223814 TSecr=601586041 [TCP segment of a reassembled PDU]"
"117","2018-08-23 03:05:56.065616","192.168.2.3","216.58.197.4","TLSv1.2","212","Application Data"
"118","2018-08-23 03:05:56.065839","192.168.2.3","216.58.197.4","TCP","1434","34325  >  443 [ACK] Seq=81271 Ack=825 Win=661 Len=1368 TSval=8223814 TSecr=601586041 [TCP segment of a reassembled PDU]"
"119","2018-08-23 03:05:56.065842","192.168.2.3","216.58.197.4","TLSv1.2","155","Application Data"
"123","2018-08-23 03:05:56.152510","192.168.2.3","216.58.197.4","TCP","1434","34325  >  443 [ACK] Seq=82728 Ack=825 Win=661 Len=1368 TSval=8223824 TSecr=601586084 [TCP segment of a reassembled PDU]"
"124","2018-08-23 03:05:56.152515","192.168.2.3","216.58.197.4","TCP","1434","34325  >  443 [ACK] Seq=84096 Ack=825 Win=661 Len=1368 TSval=8223824 TSecr=601586084 [TCP segment of a reassembled PDU]"
"125","2018-08-23 03:05:56.152516","192.168.2.3","216.58.197.4","TLSv1.2","212","Application Data"
"126","2018-08-23 03:05:56.152576","192.168.2.3","216.58.197.4","TCP","1434","34325  >  443 [ACK] Seq=85610 Ack=825 Win=661 Len=1368 TSval=8223824 TSecr=601586084 [TCP segment of a reassembled PDU]"
"127","2018-08-23 03:05:56.152774","192.168.2.3","216.58.197.4","TLSv1.2","155","Application Data"
"132","2018-08-23 03:05:56.243761","192.168.2.3","216.58.197.4","TCP","66","34325  >  443 [ACK] Seq=87067 Ack=1028 Win=661 Len=0 TSval=8223833 TSecr=601586213"
"133","2018-08-23 03:05:56.270261","192.168.2.3","216.58.197.4","TCP","1434","34325  >  443 [ACK] Seq=87067 Ack=1028 Win=661 Len=1368 TSval=8223835 TSecr=601586213 [TCP segment of a reassembled PDU]"
"134","2018-08-23 03:05:56.270624","192.168.2.3","216.58.197.4","TCP","1434","34325  >  443 [ACK] Seq=88435 Ack=1028 Win=661 Len=1368 TSval=8223835 TSecr=601586213 [TCP segment of a reassembled PDU]"
"135","2018-08-23 03:05:56.270627","192.168.2.3","216.58.197.4","TLSv1.2","212","Application Data"
"136","2018-08-23 03:05:56.271032","192.168.2.3","216.58.197.4","TCP","1434","34325  >  443 [ACK] Seq=89949 Ack=1028 Win=661 Len=1368 TSval=8223835 TSecr=601586213 [TCP segment of a reassembled PDU]"
"137","2018-08-23 03:05:56.271034","192.168.2.3","216.58.197.4","TLSv1.2","155","Application Data"
"142","2018-08-23 03:05:56.355777","192.168.2.3","216.58.197.4","TCP","66","34325  >  443 [ACK] Seq=91406 Ack=1099 Win=661 Len=0 TSval=8223844 TSecr=601586368"
"143","2018-08-23 03:05:56.372586","192.168.2.3","216.58.197.4","TCP","1434","34325  >  443 [ACK] Seq=91406 Ack=1099 Win=661 Len=1368 TSval=8223845 TSecr=601586368 [TCP segment of a reassembled PDU]"
"144","2018-08-23 03:05:56.372850","192.168.2.3","216.58.197.4","TCP","1434","34325  >  443 [ACK] Seq=92774 Ack=1099 Win=661 Len=1368 TSval=8223845 TSecr=601586368 [TCP segment of a reassembled PDU]"
"145","2018-08-23 03:05:56.372852","192.168.2.3","216.58.197.4","TLSv1.2","212","Application Data"
"146","2018-08-23 03:05:56.372853","192.168.2.3","216.58.197.4","TCP","1434","34325  >  443 [ACK] Seq=94288 Ack=1099 Win=661 Len=1368 TSval=8223845 TSecr=601586368 [TCP segment of a reassembled PDU]"
"147","2018-08-23 03:05:56.372854","192.168.2.3","216.58.197.4","TLSv1.2","155","Application Data"
"151","2018-08-23 03:05:56.462900","192.168.2.3","216.58.197.4","TCP","1434","34325  >  443 [ACK] Seq=95745 Ack=1099 Win=661 Len=1368 TSval=8223855 TSecr=601586391 [TCP segment of a reassembled PDU]"
"152","2018-08-23 03:05:56.463281","192.168.2.3","216.58.197.4","TCP","1434","34325  >  443 [ACK] Seq=97113 Ack=1099 Win=661 Len=1368 TSval=8223855 TSecr=601586391 [TCP segment of a reassembled PDU]"
"153","2018-08-23 03:05:56.463284","192.168.2.3","216.58.197.4","TLSv1.2","212","Application Data"
"154","2018-08-23 03:05:56.463285","192.168.2.3","216.58.197.4","TCP","1434","34325  >  443 [ACK] Seq=98627 Ack=1099 Win=661 Len=1368 TSval=8223855 TSecr=601586391 [TCP segment of a reassembled PDU]"
"155","2018-08-23 03:05:56.463356","192.168.2.3","216.58.197.4","TLSv1.2","155","Application Data"
"159","2018-08-23 03:05:56.556503","192.168.2.3","216.58.197.4","TCP","1434","34325  >  443 [ACK] Seq=100084 Ack=1099 Win=661 Len=1368 TSval=8223864 TSecr=601586482 [TCP segment of a reassembled PDU]"
"160","2018-08-23 03:05:56.556701","192.168.2.3","216.58.197.4","TCP","1434","34325  >  443 [ACK] Seq=101452 Ack=1099 Win=661 Len=1368 TSval=8223864 TSecr=601586482 [TCP segment of a reassembled PDU]"
"161","2018-08-23 03:05:56.556704","192.168.2.3","216.58.197.4","TLSv1.2","212","Application Data"
"162","2018-08-23 03:05:56.556905","192.168.2.3","216.58.197.4","TCP","1434","34325  >  443 [ACK] Seq=102966 Ack=1099 Win=661 Len=1368 TSval=8223864 TSecr=601586482 [TCP segment of a reassembled PDU]"
"163","2018-08-23 03:05:56.556908","192.168.2.3","216.58.197.4","TLSv1.2","155","Application Data"
"167","2018-08-23 03:05:56.653367","192.168.2.3","216.58.197.4","TCP","1434","34325  >  443 [ACK] Seq=104423 Ack=1099 Win=661 Len=1368 TSval=8223874 TSecr=601586575 [TCP segment of a reassembled PDU]"
"168","2018-08-23 03:05:56.653590","192.168.2.3","216.58.197.4","TCP","1434","34325  >  443 [ACK] Seq=105791 Ack=1099 Win=661 Len=1368 TSval=8223874 TSecr=601586575 [TCP segment of a reassembled PDU]"
"169","2018-08-23 03:05:56.653592","192.168.2.3","216.58.197.4","TLSv1.2","212","Application Data"
"170","2018-08-23 03:05:56.653593","192.168.2.3","216.58.197.4","TCP","1434","34325  >  443 [ACK] Seq=107305 Ack=1099 Win=661 Len=1368 TSval=8223874 TSecr=601586575 [TCP segment of a reassembled PDU]"
"171","2018-08-23 03:05:56.653722","192.168.2.3","216.58.197.4","TLSv1.2","155","Application Data"
"175","2018-08-23 03:05:56.728334","192.168.2.3","216.58.197.4","TCP","1434","34325  >  443 [ACK] Seq=108762 Ack=1099 Win=661 Len=1368 TSval=8223881 TSecr=601586672 [TCP segment of a reassembled PDU]"
"176","2018-08-23 03:05:56.728750","192.168.2.3","216.58.197.4","TCP","1434","34325  >  443 [ACK] Seq=110130 Ack=1099 Win=661 Len=1368 TSval=8223881 TSecr=601586672 [TCP segment of a reassembled PDU]"
"177","2018-08-23 03:05:56.728754","192.168.2.3","216.58.197.4","TLSv1.2","212","Application Data"
"178","2018-08-23 03:05:56.729285","192.168.2.3","216.58.197.4","TCP","1434","34325  >  443 [ACK] Seq=111644 Ack=1099 Win=661 Len=1368 TSval=8223881 TSecr=601586672 [TCP segment of a reassembled PDU]"
"179","2018-08-23 03:05:56.729288","192.168.2.3","216.58.197.4","TLSv1.2","155","Application Data"
"183","2018-08-23 03:05:56.814330","192.168.2.3","216.58.197.4","TCP","1434","34325  >  443 [ACK] Seq=113101 Ack=1099 Win=661 Len=1368 TSval=8223890 TSecr=601586748 [TCP segment of a reassembled PDU]"
"184","2018-08-23 03:05:56.814631","192.168.2.3","216.58.197.4","TCP","1434","34325  >  443 [ACK] Seq=114469 Ack=1099 Win=661 Len=1368 TSval=8223890 TSecr=601586748 [TCP segment of a reassembled PDU]"
"185","2018-08-23 03:05:56.814640","192.168.2.3","216.58.197.4","TLSv1.2","212","Application Data"
"186","2018-08-23 03:05:56.815039","192.168.2.3","216.58.197.4","TCP","1434","34325  >  443 [ACK] Seq=115983 Ack=1099 Win=661 Len=1368 TSval=8223890 TSecr=601586748 [TCP segment of a reassembled PDU]"
"187","2018-08-23 03:05:56.815047","192.168.2.3","216.58.197.4","TLSv1.2","155","Application Data"
"191","2018-08-23 03:05:56.910233","192.168.2.3","216.58.197.4","TCP","1434","34325  >  443 [ACK] Seq=117440 Ack=1099 Win=661 Len=1368 TSval=8223899 TSecr=601586833 [TCP segment of a reassembled PDU]"
"192","2018-08-23 03:05:56.910667","192.168.2.3","216.58.197.4","TCP","1434","34325  >  443 [ACK] Seq=118808 Ack=1099 Win=661 Len=1368 TSval=8223899 TSecr=601586833 [TCP segment of a reassembled PDU]"
"193","2018-08-23 03:05:56.910670","192.168.2.3","216.58.197.4","TLSv1.2","212","Application Data"
"194","2018-08-23 03:05:56.911165","192.168.2.3","216.58.197.4","TCP","1434","34325  >  443 [ACK] Seq=120322 Ack=1099 Win=661 Len=1368 TSval=8223899 TSecr=601586833 [TCP segment of a reassembled PDU]"
"195","2018-08-23 03:05:56.911167","192.168.2.3","216.58.197.4","TLSv1.2","155","Application Data"
"201","2018-08-23 03:05:56.967994","192.168.2.3","216.58.197.4","TCP","66","34325  >  443 [ACK] Seq=121779 Ack=1559 Win=661 Len=0 TSval=8223905 TSecr=601586980"
"202","2018-08-23 03:05:57.006946","192.168.2.3","216.58.197.4","TCP","1434","34325  >  443 [ACK] Seq=121779 Ack=1559 Win=661 Len=1368 TSval=8223909 TSecr=601586980 [TCP segment of a reassembled PDU]"
"203","2018-08-23 03:05:57.007300","192.168.2.3","216.58.197.4","TCP","1434","34325  >  443 [ACK] Seq=123147 Ack=1559 Win=661 Len=1368 TSval=8223909 TSecr=601586980 [TCP segment of a reassembled PDU]"
"204","2018-08-23 03:05:57.007302","192.168.2.3","216.58.197.4","TLSv1.2","212","Application Data"
"205","2018-08-23 03:05:57.007303","192.168.2.3","216.58.197.4","TCP","1434","34325  >  443 [ACK] Seq=124661 Ack=1559 Win=661 Len=1368 TSval=8223909 TSecr=601586980 [TCP segment of a reassembled PDU]"
"206","2018-08-23 03:05:57.007304","192.168.2.3","216.58.197.4","TLSv1.2","155","Application Data"
"212","2018-08-23 03:05:57.028469","192.168.2.3","216.58.197.4","TCP","66","34325  >  443 [ACK] Seq=126118 Ack=2112 Win=661 Len=0 TSval=8223911 TSecr=601587032"
"213","2018-08-23 03:05:57.080763","192.168.2.3","216.58.197.4","TCP","1434","34325  >  443 [ACK] Seq=126118 Ack=2112 Win=661 Len=1368 TSval=8223916 TSecr=601587032 [TCP segment of a reassembled PDU]"
"214","2018-08-23 03:05:57.081104","192.168.2.3","216.58.197.4","TCP","1434","34325  >  443 [ACK] Seq=127486 Ack=2112 Win=661 Len=1368 TSval=8223916 TSecr=601587032 [TCP segment of a reassembled PDU]"
"215","2018-08-23 03:05:57.081107","192.168.2.3","216.58.197.4","TLSv1.2","212","Application Data"
"216","2018-08-23 03:05:57.081108","192.168.2.3","216.58.197.4","TCP","1434","34325  >  443 [ACK] Seq=129000 Ack=2112 Win=661 Len=1368 TSval=8223916 TSecr=601587032 [TCP segment of a reassembled PDU]"
"217","2018-08-23 03:05:57.081273","192.168.2.3","216.58.197.4","TLSv1.2","155","Application Data"
"222","2018-08-23 03:05:57.134314","192.168.2.3","216.58.197.4","TCP","66","34325  >  443 [ACK] Seq=130457 Ack=2342 Win=661 Len=0 TSval=8223922 TSecr=601587147"
"223","2018-08-23 03:05:57.176152","192.168.2.3","216.58.197.4","TCP","1434","34325  >  443 [ACK] Seq=130457 Ack=2342 Win=661 Len=1368 TSval=8223926 TSecr=601587147 [TCP segment of a reassembled PDU]"
"224","2018-08-23 03:05:57.176505","192.168.2.3","216.58.197.4","TCP","1434","34325  >  443 [ACK] Seq=131825 Ack=2342 Win=661 Len=1368 TSval=8223926 TSecr=601587147 [TCP segment of a reassembled PDU]"
"225","2018-08-23 03:05:57.176508","192.168.2.3","216.58.197.4","TLSv1.2","212","Application Data"
"226","2018-08-23 03:05:57.176508","192.168.2.3","216.58.197.4","TCP","1434","34325  >  443 [ACK] Seq=133339 Ack=2342 Win=661 Len=1368 TSval=8223926 TSecr=601587147 [TCP segment of a reassembled PDU]"
"227","2018-08-23 03:05:57.176719","192.168.2.3","216.58.197.4","TLSv1.2","155","Application Data"
"231","2018-08-23 03:05:57.262279","192.168.2.3","216.58.197.4","TCP","1434","34325  >  443 [ACK] Seq=134796 Ack=2342 Win=661 Len=1368 TSval=8223935 TSecr=601587235 [TCP segment of a reassembled PDU]"
"232","2018-08-23 03:05:57.262614","192.168.2.3","216.58.197.4","TCP","1434","34325  >  443 [ACK] Seq=136164 Ack=2342 Win=661 Len=1368 TSval=8223935 TSecr=601587235 [TCP segment of a reassembled PDU]"
"233","2018-08-23 03:05:57.262620","192.168.2.3","216.58.197.4","TLSv1.2","212","Application Data"
"234","2018-08-23 03:05:57.263003","192.168.2.3","216.58.197.4","TCP","1434","34325  >  443 [ACK] Seq=137678 Ack=2342 Win=661 Len=1368 TSval=8223935 TSecr=601587235 [TCP segment of a reassembled PDU]"
"235","2018-08-23 03:05:57.263008","192.168.2.3","216.58.197.4","TLSv1.2","155","Application Data"
"241","2018-08-23 03:05:57.326330","192.168.2.3","216.58.197.4","TCP","66","34325  >  443 [ACK] Seq=139135 Ack=2825 Win=661 Len=0 TSval=8223941 TSecr=601587336"
"242","2018-08-23 03:05:57.358444","192.168.2.3","216.58.197.4","TCP","1434","34325  >  443 [ACK] Seq=139135 Ack=2825 Win=661 Len=1368 TSval=8223944 TSecr=601587336 [TCP segment of a reassembled PDU]"
"243","2018-08-23 03:05:57.358822","192.168.2.3","216.58.197.4","TCP","1434","34325  >  443 [ACK] Seq=140503 Ack=2825 Win=661 Len=1368 TSval=8223944 TSecr=601587336 [TCP segment of a reassembled PDU]"
"244","2018-08-23 03:05:57.358825","192.168.2.3","216.58.197.4","TLSv1.2","212","Application Data"
"245","2018-08-23 03:05:57.359258","192.168.2.3","216.58.197.4","TCP","1434","34325  >  443 [ACK] Seq=142017 Ack=2825 Win=661 Len=1368 TSval=8223944 TSecr=601587336 [TCP segment of a reassembled PDU]"
"246","2018-08-23 03:05:57.359260","192.168.2.3","216.58.197.4","TLSv1.2","155","Application Data"
"252","2018-08-23 03:05:57.412885","192.168.2.3","216.58.197.4","TCP","66","34325  >  443 [ACK] Seq=143474 Ack=3090 Win=661 Len=0 TSval=8223950 TSecr=601587426"
"253","2018-08-23 03:05:57.433380","192.168.2.3","216.58.197.4","TCP","1434","34325  >  443 [ACK] Seq=143474 Ack=3090 Win=661 Len=1368 TSval=8223952 TSecr=601587426 [TCP segment of a reassembled PDU]"
"254","2018-08-23 03:05:57.433721","192.168.2.3","216.58.197.4","TCP","1434","34325  >  443 [ACK] Seq=144842 Ack=3090 Win=661 Len=1368 TSval=8223952 TSecr=601587426 [TCP segment of a reassembled PDU]"
"255","2018-08-23 03:05:57.433724","192.168.2.3","216.58.197.4","TLSv1.2","212","Application Data"
"256","2018-08-23 03:05:57.433972","192.168.2.3","216.58.197.4","TCP","1434","34325  >  443 [ACK] Seq=146356 Ack=3090 Win=661 Len=1368 TSval=8223952 TSecr=601587426 [TCP segment of a reassembled PDU]"
"257","2018-08-23 03:05:57.433974","192.168.2.3","216.58.197.4","TLSv1.2","155","Application Data"
"263","2018-08-23 03:05:57.488075","192.168.2.3","216.58.197.4","TCP","66","34325  >  443 [ACK] Seq=147813 Ack=3395 Win=661 Len=0 TSval=8223957 TSecr=601587501"
"266","2018-08-23 03:05:57.505157","192.168.2.3","216.58.197.4","TCP","66","34325  >  443 [ACK] Seq=147813 Ack=3707 Win=661 Len=0 TSval=8223959 TSecr=601587514"
"267","2018-08-23 03:05:57.521572","192.168.2.3","216.58.197.4","TCP","1434","34325  >  443 [ACK] Seq=147813 Ack=3707 Win=661 Len=1368 TSval=8223961 TSecr=601587514 [TCP segment of a reassembled PDU]"
"268","2018-08-23 03:05:57.521887","192.168.2.3","216.58.197.4","TCP","1434","34325  >  443 [ACK] Seq=149181 Ack=3707 Win=661 Len=1368 TSval=8223961 TSecr=601587514 [TCP segment of a reassembled PDU]"
"269","2018-08-23 03:05:57.521892","192.168.2.3","216.58.197.4","TLSv1.2","212","Application Data"
"270","2018-08-23 03:05:57.522361","192.168.2.3","216.58.197.4","TCP","1434","34325  >  443 [ACK] Seq=150695 Ack=3707 Win=661 Len=1368 TSval=8223961 TSecr=601587514 [TCP segment of a reassembled PDU]"
"271","2018-08-23 03:05:57.522377","192.168.2.3","216.58.197.4","TLSv1.2","155","Application Data"
"277","2018-08-23 03:05:57.581129","192.168.2.3","216.58.197.4","TCP","66","34325  >  443 [ACK] Seq=152152 Ack=4018 Win=661 Len=0 TSval=8223966 TSecr=601587590"
"278","2018-08-23 03:05:57.615998","192.168.2.3","216.58.197.4","TCP","1434","34325  >  443 [ACK] Seq=152152 Ack=4018 Win=661 Len=1368 TSval=8223970 TSecr=601587590 [TCP segment of a reassembled PDU]"
"279","2018-08-23 03:05:57.616435","192.168.2.3","216.58.197.4","TCP","1434","34325  >  443 [ACK] Seq=153520 Ack=4018 Win=661 Len=1368 TSval=8223970 TSecr=601587590 [TCP segment of a reassembled PDU]"
"280","2018-08-23 03:05:57.616438","192.168.2.3","216.58.197.4","TLSv1.2","212","Application Data"
"281","2018-08-23 03:05:57.616853","192.168.2.3","216.58.197.4","TCP","1434","34325  >  443 [ACK] Seq=155034 Ack=4018 Win=661 Len=1368 TSval=8223970 TSecr=601587590 [TCP segment of a reassembled PDU]"
"282","2018-08-23 03:05:57.616856","192.168.2.3","216.58.197.4","TLSv1.2","155","Application Data"
"288","2018-08-23 03:05:57.669053","192.168.2.3","216.58.197.4","TCP","66","34325  >  443 [ACK] Seq=156491 Ack=4289 Win=661 Len=0 TSval=8223975 TSecr=601587682"
"289","2018-08-23 03:05:57.688815","192.168.2.3","216.58.197.4","TCP","1434","34325  >  443 [ACK] Seq=156491 Ack=4289 Win=661 Len=1368 TSval=8223977 TSecr=601587682 [TCP segment of a reassembled PDU]"
"290","2018-08-23 03:05:57.688820","192.168.2.3","216.58.197.4","TCP","1434","34325  >  443 [ACK] Seq=157859 Ack=4289 Win=661 Len=1368 TSval=8223977 TSecr=601587682 [TCP segment of a reassembled PDU]"
"291","2018-08-23 03:05:57.688915","192.168.2.3","216.58.197.4","TLSv1.2","212","Application Data"
"292","2018-08-23 03:05:57.689338","192.168.2.3","216.58.197.4","TCP","1434","34325  >  443 [ACK] Seq=159373 Ack=4289 Win=661 Len=1368 TSval=8223977 TSecr=601587682 [TCP segment of a reassembled PDU]"
"293","2018-08-23 03:05:57.689341","192.168.2.3","216.58.197.4","TLSv1.2","155","Application Data"
"296","2018-08-23 03:05:57.786697","192.168.2.3","216.58.197.4","TCP","1434","34325  >  443 [ACK] Seq=160830 Ack=4289 Win=661 Len=1368 TSval=8223987 TSecr=601587708 [TCP segment of a reassembled PDU]"
"297","2018-08-23 03:05:57.786702","192.168.2.3","216.58.197.4","TCP","1434","34325  >  443 [ACK] Seq=162198 Ack=4289 Win=661 Len=1368 TSval=8223987 TSecr=601587708 [TCP segment of a reassembled PDU]"
"298","2018-08-23 03:05:57.786703","192.168.2.3","216.58.197.4","TLSv1.2","212","Application Data"
"299","2018-08-23 03:05:57.787114","192.168.2.3","216.58.197.4","TCP","1434","34325  >  443 [ACK] Seq=163712 Ack=4289 Win=661 Len=1368 TSval=8223987 TSecr=601587708 [TCP segment of a reassembled PDU]"
"300","2018-08-23 03:05:57.787131","192.168.2.3","216.58.197.4","TLSv1.2","155","Application Data"
"306","2018-08-23 03:05:57.838754","192.168.2.3","216.58.197.4","TCP","66","34325  >  443 [ACK] Seq=165169 Ack=4784 Win=661 Len=0 TSval=8223992 TSecr=601587850"
"307","2018-08-23 03:05:57.882159","192.168.2.3","216.58.197.4","TCP","1434","34325  >  443 [ACK] Seq=165169 Ack=4784 Win=661 Len=1368 TSval=8223996 TSecr=601587850 [TCP segment of a reassembled PDU]"
"308","2018-08-23 03:05:57.882163","192.168.2.3","216.58.197.4","TCP","1434","34325  >  443 [ACK] Seq=166537 Ack=4784 Win=661 Len=1368 TSval=8223996 TSecr=601587850 [TCP segment of a reassembled PDU]"
"309","2018-08-23 03:05:57.882368","192.168.2.3","216.58.197.4","TLSv1.2","212","Application Data"
"310","2018-08-23 03:05:57.882384","192.168.2.3","216.58.197.4","TCP","1434","34325  >  443 [ACK] Seq=168051 Ack=4784 Win=661 Len=1368 TSval=8223996 TSecr=601587850 [TCP segment of a reassembled PDU]"
"311","2018-08-23 03:05:57.882611","192.168.2.3","216.58.197.4","TLSv1.2","155","Application Data"
"314","2018-08-23 03:05:57.968484","192.168.2.3","216.58.197.4","TCP","1434","34325  >  443 [ACK] Seq=169508 Ack=4784 Win=661 Len=1368 TSval=8224005 TSecr=601587901 [TCP segment of a reassembled PDU]"
"315","2018-08-23 03:05:57.968948","192.168.2.3","216.58.197.4","TCP","1434","34325  >  443 [ACK] Seq=170876 Ack=4784 Win=661 Len=1368 TSval=8224005 TSecr=601587901 [TCP segment of a reassembled PDU]"
"316","2018-08-23 03:05:57.968951","192.168.2.3","216.58.197.4","TLSv1.2","212","Application Data"
"317","2018-08-23 03:05:57.968952","192.168.2.3","216.58.197.4","TCP","1434","34325  >  443 [ACK] Seq=172390 Ack=4784 Win=661 Len=1368 TSval=8224005 TSecr=601587901 [TCP segment of a reassembled PDU]"
"318","2018-08-23 03:05:57.969054","192.168.2.3","216.58.197.4","TLSv1.2","155","Application Data"
"325","2018-08-23 03:05:58.022510","192.168.2.3","216.58.197.4","TCP","66","34325  >  443 [ACK] Seq=173847 Ack=5135 Win=661 Len=0 TSval=8224010 TSecr=601588032"
"327","2018-08-23 03:05:58.028470","192.168.2.3","216.58.197.4","TCP","66","34325  >  443 [ACK] Seq=173847 Ack=5410 Win=661 Len=0 TSval=8224011 TSecr=601588033"
"328","2018-08-23 03:05:58.064506","192.168.2.3","216.58.197.4","TCP","1434","34325  >  443 [ACK] Seq=173847 Ack=5410 Win=661 Len=1368 TSval=8224015 TSecr=601588033 [TCP segment of a reassembled PDU]"
"329","2018-08-23 03:05:58.064900","192.168.2.3","216.58.197.4","TCP","1434","34325  >  443 [ACK] Seq=175215 Ack=5410 Win=661 Len=1368 TSval=8224015 TSecr=601588033 [TCP segment of a reassembled PDU]"
"330","2018-08-23 03:05:58.064902","192.168.2.3","216.58.197.4","TLSv1.2","212","Application Data"
"331","2018-08-23 03:05:58.065276","192.168.2.3","216.58.197.4","TCP","1434","34325  >  443 [ACK] Seq=176729 Ack=5410 Win=661 Len=1368 TSval=8224015 TSecr=601588033 [TCP segment of a reassembled PDU]"
"332","2018-08-23 03:05:58.065279","192.168.2.3","216.58.197.4","TLSv1.2","155","Application Data"
"336","2018-08-23 03:05:58.158405","192.168.2.3","216.58.197.4","TCP","1434","34325  >  443 [ACK] Seq=178186 Ack=5410 Win=661 Len=1368 TSval=8224024 TSecr=601588084 [TCP segment of a reassembled PDU]"
"337","2018-08-23 03:05:58.158667","192.168.2.3","216.58.197.4","TCP","1434","34325  >  443 [ACK] Seq=179554 Ack=5410 Win=661 Len=1368 TSval=8224024 TSecr=601588084 [TCP segment of a reassembled PDU]"
"338","2018-08-23 03:05:58.158669","192.168.2.3","216.58.197.4","TLSv1.2","212","Application Data"
"339","2018-08-23 03:05:58.159180","192.168.2.3","216.58.197.4","TCP","1434","34325  >  443 [ACK] Seq=181068 Ack=5410 Win=661 Len=1368 TSval=8224024 TSecr=601588084 [TCP segment of a reassembled PDU]"
"340","2018-08-23 03:05:58.159183","192.168.2.3","216.58.197.4","TLSv1.2","155","Application Data"
"345","2018-08-23 03:05:58.264489","192.168.2.3","216.58.197.4","TCP","1434","34325  >  443 [ACK] Seq=182525 Ack=5537 Win=661 Len=1368 TSval=8224035 TSecr=601588273 [TCP segment of a reassembled PDU]"
"346","2018-08-23 03:05:58.264891","192.168.2.3","216.58.197.4","TCP","1434","34325  >  443 [ACK] Seq=183893 Ack=5537 Win=661 Len=1368 TSval=8224035 TSecr=601588273 [TCP segment of a reassembled PDU]"
"347","2018-08-23 03:05:58.264893","192.168.2.3","216.58.197.4","TLSv1.2","212","Application Data"
"348","2018-08-23 03:05:58.265444","192.168.2.3","216.58.197.4","TCP","1434","34325  >  443 [ACK] Seq=185407 Ack=5537 Win=661 Len=1368 TSval=8224035 TSecr=601588273 [TCP segment of a reassembled PDU]"
"349","2018-08-23 03:05:58.265446","192.168.2.3","216.58.197.4","TLSv1.2","68","Application Data"
"353","2018-08-23 03:05:58.382259","192.168.2.3","216.58.197.4","TCP","1434","34325  >  443 [ACK] Seq=186777 Ack=5537 Win=661 Len=1368 TSval=8224047 TSecr=601588284 [TCP segment of a reassembled PDU]"
"354","2018-08-23 03:05:58.382693","192.168.2.3","216.58.197.4","TCP","1434","34325  >  443 [ACK] Seq=188145 Ack=5537 Win=661 Len=1368 TSval=8224047 TSecr=601588284 [TCP segment of a reassembled PDU]"
"355","2018-08-23 03:05:58.382695","192.168.2.3","216.58.197.4","TLSv1.2","212","Application Data"
"356","2018-08-23 03:05:58.383084","192.168.2.3","216.58.197.4","TCP","1434","34325  >  443 [ACK] Seq=189659 Ack=5537 Win=661 Len=1368 TSval=8224047 TSecr=601588284 [TCP segment of a reassembled PDU]"
"357","2018-08-23 03:05:58.383086","192.168.2.3","216.58.197.4","TLSv1.2","155","Application Data"
"363","2018-08-23 03:05:58.433760","192.168.2.3","216.58.197.4","TCP","66","34325  >  443 [ACK] Seq=191116 Ack=6002 Win=661 Len=0 TSval=8224052 TSecr=601588446"
"364","2018-08-23 03:05:58.478685","192.168.2.3","216.58.197.4","TCP","1434","34325  >  443 [ACK] Seq=191116 Ack=6002 Win=661 Len=1368 TSval=8224056 TSecr=601588446 [TCP segment of a reassembled PDU]"
"365","2018-08-23 03:05:58.479106","192.168.2.3","216.58.197.4","TCP","1434","34325  >  443 [ACK] Seq=192484 Ack=6002 Win=661 Len=1368 TSval=8224056 TSecr=601588446 [TCP segment of a reassembled PDU]"
"366","2018-08-23 03:05:58.479109","192.168.2.3","216.58.197.4","TLSv1.2","212","Application Data"
"367","2018-08-23 03:05:58.479268","192.168.2.3","216.58.197.4","TCP","1434","34325  >  443 [ACK] Seq=193998 Ack=6002 Win=661 Len=1368 TSval=8224056 TSecr=601588446 [TCP segment of a reassembled PDU]"
"368","2018-08-23 03:05:58.479270","192.168.2.3","216.58.197.4","TLSv1.2","155","Application Data"
"372","2018-08-23 03:05:58.579622","192.168.2.3","216.58.197.4","TCP","1434","34325  >  443 [ACK] Seq=195455 Ack=6002 Win=661 Len=1368 TSval=8224066 TSecr=601588498 [TCP segment of a reassembled PDU]"
"373","2018-08-23 03:05:58.579630","192.168.2.3","216.58.197.4","TCP","1434","34325  >  443 [ACK] Seq=196823 Ack=6002 Win=661 Len=1368 TSval=8224066 TSecr=601588498 [TCP segment of a reassembled PDU]"
"374","2018-08-23 03:05:58.579631","192.168.2.3","216.58.197.4","TLSv1.2","212","Application Data"
"375","2018-08-23 03:05:58.579764","192.168.2.3","216.58.197.4","TCP","1434","34325  >  443 [ACK] Seq=198337 Ack=6002 Win=661 Len=1368 TSval=8224066 TSecr=601588498 [TCP segment of a reassembled PDU]"
"376","2018-08-23 03:05:58.580066","192.168.2.3","216.58.197.4","TLSv1.2","155","Application Data"
"377","2018-08-23 03:05:58.580069","192.168.2.3","216.58.197.3","TLSv1.2","135","Application Data"
"378","2018-08-23 03:05:58.580069","192.168.2.3","216.58.197.3","TLSv1.2","104","Application Data"
"384","2018-08-23 03:05:58.598990","192.168.2.3","216.58.197.3","TCP","66","43448  >  443 [ACK] Seq=108 Ack=117 Win=406 Len=0 TSval=8224068 TSecr=3996873875"
"385","2018-08-23 03:05:58.598993","192.168.2.3","216.58.197.3","TLSv1.2","100","Application Data"
"386","2018-08-23 03:05:58.598994","192.168.2.3","216.58.197.3","TLSv1.2","104","Application Data"
"390","2018-08-23 03:05:58.637059","192.168.2.3","216.58.197.4","TCP","66","34325  >  443 [ACK] Seq=199794 Ack=6438 Win=661 Len=0 TSval=8224072 TSecr=601588646"
"391","2018-08-23 03:05:58.680415","192.168.2.3","216.58.197.4","TCP","1434","34325  >  443 [ACK] Seq=199794 Ack=6438 Win=661 Len=1368 TSval=8224076 TSecr=601588646 [TCP segment of a reassembled PDU]"
"392","2018-08-23 03:05:58.680868","192.168.2.3","216.58.197.4","TCP","1434","34325  >  443 [ACK] Seq=201162 Ack=6438 Win=661 Len=1368 TSval=8224076 TSecr=601588646 [TCP segment of a reassembled PDU]"
"393","2018-08-23 03:05:58.680871","192.168.2.3","216.58.197.4","TLSv1.2","212","Application Data"
"394","2018-08-23 03:05:58.680872","192.168.2.3","216.58.197.4","TCP","1434","34325  >  443 [ACK] Seq=202676 Ack=6438 Win=661 Len=1368 TSval=8224076 TSecr=601588646 [TCP segment of a reassembled PDU]"
"395","2018-08-23 03:05:58.680873","192.168.2.3","216.58.197.4","TLSv1.2","155","Application Data"
"399","2018-08-23 03:05:58.777244","192.168.2.3","216.58.197.4","TCP","1434","34325  >  443 [ACK] Seq=204133 Ack=6438 Win=661 Len=1368 TSval=8224086 TSecr=601588699 [TCP segment of a reassembled PDU]"
"400","2018-08-23 03:05:58.777248","192.168.2.3","216.58.197.4","TCP","1434","34325  >  443 [ACK] Seq=205501 Ack=6438 Win=661 Len=1368 TSval=8224086 TSecr=601588699 [TCP segment of a reassembled PDU]"
"401","2018-08-23 03:05:58.777249","192.168.2.3","216.58.197.4","TLSv1.2","212","Application Data"
"402","2018-08-23 03:05:58.779963","192.168.2.3","216.58.197.4","TCP","1434","34325  >  443 [ACK] Seq=207015 Ack=6438 Win=661 Len=1368 TSval=8224086 TSecr=601588699 [TCP segment of a reassembled PDU]"
"403","2018-08-23 03:05:58.779965","192.168.2.3","216.58.197.4","TLSv1.2","155","Application Data"
"408","2018-08-23 03:05:58.832290","192.168.2.3","216.58.197.4","TCP","66","34325  >  443 [ACK] Seq=208472 Ack=6795 Win=661 Len=0 TSval=8224092 TSecr=601588845"
"409","2018-08-23 03:05:58.861332","192.168.2.3","216.58.197.4","TCP","1434","34325  >  443 [ACK] Seq=208472 Ack=6795 Win=661 Len=1368 TSval=8224094 TSecr=601588845 [TCP segment of a reassembled PDU]"
"410","2018-08-23 03:05:58.861336","192.168.2.3","216.58.197.4","TCP","1434","34325  >  443 [ACK] Seq=209840 Ack=6795 Win=661 Len=1368 TSval=8224094 TSecr=601588845 [TCP segment of a reassembled PDU]"
"411","2018-08-23 03:05:58.861337","192.168.2.3","216.58.197.4","TLSv1.2","212","Application Data"
"412","2018-08-23 03:05:58.861439","192.168.2.3","216.58.197.4","TLSv1.2","861","Application Data"
"413","2018-08-23 03:05:58.861698","192.168.2.3","216.58.197.4","TLSv1.2","102","Application Data"
"419","2018-08-23 03:05:58.892269","192.168.2.3","216.58.197.4","TCP","66","34325  >  443 [ACK] Seq=212185 Ack=7496 Win=661 Len=0 TSval=8224097 TSecr=601588898"
"422","2018-08-23 03:05:59.034944","192.168.2.3","216.58.197.4","TCP","66","34325  >  443 [ACK] Seq=212185 Ack=7689 Win=661 Len=0 TSval=8224111 TSecr=601589032"
"424","2018-08-23 03:05:59.501015","192.168.2.3","216.58.197.4","TCP","66","34325  >  443 [ACK] Seq=212185 Ack=7854 Win=661 Len=0 TSval=8224159 TSecr=601589483"
"435","2018-08-23 03:05:59.508305","192.168.2.3","216.58.197.4","TCP","66","34325  >  443 [ACK] Seq=212185 Ack=9272 Win=650 Len=0 TSval=8224159 TSecr=601589520"
"436","2018-08-23 03:05:59.508307","192.168.2.3","216.58.197.4","TCP","66","34325  >  443 [ACK] Seq=212185 Ack=9662 Win=650 Len=0 TSval=8224159 TSecr=601589520"
