"No.","Time","Source","Destination","Protocol","Length","Info"
"1","2018-08-23 02:55:11.924807","192.168.2.3","35.186.224.46","TLSv1.2","108","Application Data"
"4","2018-08-23 02:55:11.973371","192.168.2.3","35.186.224.46","TCP","66","49072  >  443 [ACK] Seq=43 Ack=40 Win=1042 Len=0 TSval=8159406 TSecr=3642813425"
"6","2018-08-23 02:55:14.389224","192.168.2.3","216.58.197.4","TLSv1.2","156","Application Data"
"7","2018-08-23 02:55:14.389461","192.168.2.3","216.58.197.4","TLSv1.2","104","Application Data"
"8","2018-08-23 02:55:14.390662","192.168.2.3","216.58.197.4","TLSv1.2","158","Application Data"
"12","2018-08-23 02:55:14.400487","192.168.2.3","216.58.197.4","TCP","1434","34325  >  443 [ACK] Seq=221 Ack=1 Win=661 Len=1368 TSval=8159649 TSecr=600944407 [TCP segment of a reassembled PDU]"
"13","2018-08-23 02:55:14.404435","192.168.2.3","216.58.197.4","TCP","1434","34325  >  443 [ACK] Seq=1589 Ack=1 Win=661 Len=1368 TSval=8159649 TSecr=600944407 [TCP segment of a reassembled PDU]"
"14","2018-08-23 02:55:14.404437","192.168.2.3","216.58.197.4","TLSv1.2","212","Application Data"
"15","2018-08-23 02:55:14.405009","192.168.2.3","216.58.197.4","TCP","1434","34325  >  443 [ACK] Seq=3103 Ack=1 Win=661 Len=1368 TSval=8159649 TSecr=600944407 [TCP segment of a reassembled PDU]"
"16","2018-08-23 02:55:14.405011","192.168.2.3","216.58.197.4","TLSv1.2","337","Application Data"
"18","2018-08-23 02:55:14.406518","192.168.2.3","216.58.197.4","TCP","1434","34325  >  443 [ACK] Seq=4742 Ack=39 Win=661 Len=1368 TSval=8159650 TSecr=600944407 [TCP segment of a reassembled PDU]"
"19","2018-08-23 02:55:14.406521","192.168.2.3","216.58.197.4","TCP","1434","34325  >  443 [ACK] Seq=6110 Ack=39 Win=661 Len=1368 TSval=8159650 TSecr=600944407 [TCP segment of a reassembled PDU]"
"20","2018-08-23 02:55:14.406522","192.168.2.3","216.58.197.4","TLSv1.2","212","Application Data"
"21","2018-08-23 02:55:14.406945","192.168.2.3","216.58.197.4","TCP","1434","34325  >  443 [ACK] Seq=7624 Ack=39 Win=661 Len=1368 TSval=8159650 TSecr=600944407 [TCP segment of a reassembled PDU]"
"22","2018-08-23 02:55:14.407332","192.168.2.3","216.58.197.4","TLSv1.2","1434","Application Data [TCP segment of a reassembled PDU]"
"23","2018-08-23 02:55:14.407651","192.168.2.3","216.58.197.4","TCP","1434","34325  >  443 [ACK] Seq=10360 Ack=39 Win=661 Len=1368 TSval=8159650 TSecr=600944418 [TCP segment of a reassembled PDU]"
"24","2018-08-23 02:55:14.407653","192.168.2.3","216.58.197.4","TLSv1.2","1434","Application Data [TCP segment of a reassembled PDU]"
"27","2018-08-23 02:55:14.410170","192.168.2.3","216.58.197.4","TCP","1434","34325  >  443 [ACK] Seq=13096 Ack=39 Win=661 Len=1368 TSval=8159650 TSecr=600944422 [TCP segment of a reassembled PDU]"
"28","2018-08-23 02:55:14.410459","192.168.2.3","216.58.197.4","TLSv1.2","1434","Application Data [TCP segment of a reassembled PDU]"
"29","2018-08-23 02:55:14.410890","192.168.2.3","216.58.197.4","TCP","1434","34325  >  443 [ACK] Seq=15832 Ack=39 Win=661 Len=1368 TSval=8159650 TSecr=600944422 [TCP segment of a reassembled PDU]"
"30","2018-08-23 02:55:14.410891","192.168.2.3","216.58.197.4","TLSv1.2","1434","Application Data [TCP segment of a reassembled PDU]"
"32","2018-08-23 02:55:14.411193","192.168.2.3","216.58.197.4","TCP","1434","34325  >  443 [ACK] Seq=18568 Ack=39 Win=661 Len=1368 TSval=8159650 TSecr=600944423 [TCP segment of a reassembled PDU]"
"34","2018-08-23 02:55:14.411383","192.168.2.3","216.58.197.4","TLSv1.2","1434","Application Data [TCP segment of a reassembled PDU]"
"36","2018-08-23 02:55:14.412606","192.168.2.3","216.58.197.4","TCP","1434","34325  >  443 [ACK] Seq=21304 Ack=39 Win=661 Len=1368 TSval=8159650 TSecr=600944424 [TCP segment of a reassembled PDU]"
"37","2018-08-23 02:55:14.412883","192.168.2.3","216.58.197.4","TLSv1.2","1434","Application Data [TCP segment of a reassembled PDU]"
"38","2018-08-23 02:55:14.413294","192.168.2.3","216.58.197.4","TCP","1434","34325  >  443 [ACK] Seq=24040 Ack=39 Win=661 Len=1368 TSval=8159650 TSecr=600944424 [TCP segment of a reassembled PDU]"
"39","2018-08-23 02:55:14.413566","192.168.2.3","216.58.197.4","TLSv1.2","1434","Application Data [TCP segment of a reassembled PDU]"
"40","2018-08-23 02:55:14.413781","192.168.2.3","216.58.197.4","TCP","1434","34325  >  443 [ACK] Seq=26776 Ack=39 Win=661 Len=1368 TSval=8159650 TSecr=600944425 [TCP segment of a reassembled PDU]"
"41","2018-08-23 02:55:14.414023","192.168.2.3","216.58.197.4","TLSv1.2","1434","Application Data [TCP segment of a reassembled PDU]"
"42","2018-08-23 02:55:14.414025","192.168.2.3","216.58.197.4","TCP","1434","34325  >  443 [ACK] Seq=29512 Ack=39 Win=661 Len=1368 TSval=8159650 TSecr=600944425 [TCP segment of a reassembled PDU]"
"50","2018-08-23 02:55:14.420330","192.168.2.3","216.58.197.4","TLSv1.2","1434","Application Data [TCP segment of a reassembled PDU]"
"51","2018-08-23 02:55:14.420504","192.168.2.3","216.58.197.4","TCP","1434","34325  >  443 [ACK] Seq=32248 Ack=39 Win=661 Len=1368 TSval=8159650 TSecr=600944425 [TCP segment of a reassembled PDU]"
"52","2018-08-23 02:55:14.420769","192.168.2.3","216.58.197.4","TLSv1.2","1434","Application Data [TCP segment of a reassembled PDU]"
"53","2018-08-23 02:55:14.420880","192.168.2.3","216.58.197.4","TCP","1434","34325  >  443 [ACK] Seq=34984 Ack=39 Win=661 Len=1368 TSval=8159651 TSecr=600944428 [TCP segment of a reassembled PDU]"
"54","2018-08-23 02:55:14.421141","192.168.2.3","216.58.197.4","TLSv1.2","1434","Application Data [TCP segment of a reassembled PDU]"
"55","2018-08-23 02:55:14.421226","192.168.2.3","216.58.197.4","TCP","1434","34325  >  443 [ACK] Seq=37720 Ack=39 Win=661 Len=1368 TSval=8159651 TSecr=600944429 [TCP segment of a reassembled PDU]"
"56","2018-08-23 02:55:14.421413","192.168.2.3","216.58.197.4","TLSv1.2","1434","Application Data [TCP segment of a reassembled PDU]"
"57","2018-08-23 02:55:14.421684","192.168.2.3","216.58.197.4","TCP","1434","34325  >  443 [ACK] Seq=40456 Ack=39 Win=661 Len=1368 TSval=8159651 TSecr=600944429 [TCP segment of a reassembled PDU]"
"58","2018-08-23 02:55:14.422948","192.168.2.3","216.58.197.4","TLSv1.2","1434","Application Data [TCP segment of a reassembled PDU]"
"59","2018-08-23 02:55:14.422950","192.168.2.3","216.58.197.4","TCP","1434","34325  >  443 [ACK] Seq=43192 Ack=39 Win=661 Len=1368 TSval=8159651 TSecr=600944429 [TCP segment of a reassembled PDU]"
"60","2018-08-23 02:55:14.423171","192.168.2.3","216.58.197.4","TLSv1.2","1434","Application Data [TCP segment of a reassembled PDU]"
"61","2018-08-23 02:55:14.423275","192.168.2.3","216.58.197.4","TCP","1434","34325  >  443 [ACK] Seq=45928 Ack=39 Win=661 Len=1368 TSval=8159651 TSecr=600944431 [TCP segment of a reassembled PDU]"
"62","2018-08-23 02:55:14.423464","192.168.2.3","216.58.197.4","TLSv1.2","1434","Application Data [TCP segment of a reassembled PDU]"
"63","2018-08-23 02:55:14.423736","192.168.2.3","216.58.197.4","TCP","1434","34325  >  443 [ACK] Seq=48664 Ack=39 Win=661 Len=1368 TSval=8159651 TSecr=600944431 [TCP segment of a reassembled PDU]"
"64","2018-08-23 02:55:14.423899","192.168.2.3","216.58.197.4","TLSv1.2","1434","Application Data [TCP segment of a reassembled PDU]"
"65","2018-08-23 02:55:14.424168","192.168.2.3","216.58.197.4","TCP","1434","34325  >  443 [ACK] Seq=51400 Ack=39 Win=661 Len=1368 TSval=8159651 TSecr=600944431 [TCP segment of a reassembled PDU]"
"66","2018-08-23 02:55:14.424171","192.168.2.3","216.58.197.4","TLSv1.2","1434","Application Data [TCP segment of a reassembled PDU]"
"67","2018-08-23 02:55:14.424443","192.168.2.3","216.58.197.4","TCP","1434","34325  >  443 [ACK] Seq=54136 Ack=39 Win=661 Len=1368 TSval=8159651 TSecr=600944431 [TCP segment of a reassembled PDU]"
"68","2018-08-23 02:55:14.424446","192.168.2.3","216.58.197.4","TLSv1.2","1434","Application Data, Application Data"
"69","2018-08-23 02:55:14.424647","192.168.2.3","216.58.197.4","TCP","1434","34325  >  443 [ACK] Seq=56872 Ack=39 Win=661 Len=1368 TSval=8159651 TSecr=600944432 [TCP segment of a reassembled PDU]"
"70","2018-08-23 02:55:14.424808","192.168.2.3","216.58.197.4","TLSv1.2","1434","Application Data [TCP segment of a reassembled PDU]"
"81","2018-08-23 02:55:14.429482","192.168.2.3","216.58.197.4","TLSv1.2","1434","Application Data [TCP segment of a reassembled PDU]"
"82","2018-08-23 02:55:14.429484","192.168.2.3","216.58.197.4","TCP","1434","34325  >  443 [ACK] Seq=60976 Ack=39 Win=661 Len=1368 TSval=8159652 TSecr=600944438 [TCP segment of a reassembled PDU]"
"83","2018-08-23 02:55:14.429824","192.168.2.3","216.58.197.4","TLSv1.2","1434","Application Data [TCP segment of a reassembled PDU]"
"84","2018-08-23 02:55:14.429826","192.168.2.3","216.58.197.4","TLSv1.2","1405","Application Data"
"87","2018-08-23 02:55:14.457302","192.168.2.3","216.58.197.4","TCP","1434","34325  >  443 [ACK] Seq=65051 Ack=39 Win=661 Len=1368 TSval=8159654 TSecr=600944447 [TCP segment of a reassembled PDU]"
"88","2018-08-23 02:55:14.457305","192.168.2.3","216.58.197.4","TCP","1434","34325  >  443 [ACK] Seq=66419 Ack=39 Win=661 Len=1368 TSval=8159654 TSecr=600944447 [TCP segment of a reassembled PDU]"
"89","2018-08-23 02:55:14.457306","192.168.2.3","216.58.197.4","TLSv1.2","212","Application Data"
"90","2018-08-23 02:55:14.457731","192.168.2.3","216.58.197.4","TCP","1434","34325  >  443 [ACK] Seq=67933 Ack=39 Win=661 Len=1368 TSval=8159654 TSecr=600944447 [TCP segment of a reassembled PDU]"
"91","2018-08-23 02:55:14.457734","192.168.2.3","216.58.197.4","TLSv1.2","155","Application Data"
"95","2018-08-23 02:55:14.546143","192.168.2.3","216.58.197.4","TCP","1434","34325  >  443 [ACK] Seq=69390 Ack=39 Win=661 Len=1368 TSval=8159664 TSecr=600944476 [TCP segment of a reassembled PDU]"
"96","2018-08-23 02:55:14.546638","192.168.2.3","216.58.197.4","TCP","1434","34325  >  443 [ACK] Seq=70758 Ack=39 Win=661 Len=1368 TSval=8159664 TSecr=600944476 [TCP segment of a reassembled PDU]"
"97","2018-08-23 02:55:14.546640","192.168.2.3","216.58.197.4","TLSv1.2","212","Application Data"
"98","2018-08-23 02:55:14.547058","192.168.2.3","216.58.197.4","TCP","1434","34325  >  443 [ACK] Seq=72272 Ack=39 Win=661 Len=1368 TSval=8159664 TSecr=600944476 [TCP segment of a reassembled PDU]"
"99","2018-08-23 02:55:14.547060","192.168.2.3","216.58.197.4","TLSv1.2","155","Application Data"
"103","2018-08-23 02:55:14.641455","192.168.2.3","216.58.197.4","TCP","1434","34325  >  443 [ACK] Seq=73729 Ack=39 Win=661 Len=1368 TSval=8159673 TSecr=600944605 [TCP segment of a reassembled PDU]"
"104","2018-08-23 02:55:14.641768","192.168.2.3","216.58.197.4","TCP","1434","34325  >  443 [ACK] Seq=75097 Ack=39 Win=661 Len=1368 TSval=8159673 TSecr=600944605 [TCP segment of a reassembled PDU]"
"105","2018-08-23 02:55:14.641770","192.168.2.3","216.58.197.4","TLSv1.2","212","Application Data"
"106","2018-08-23 02:55:14.642306","192.168.2.3","216.58.197.4","TCP","1434","34325  >  443 [ACK] Seq=76611 Ack=39 Win=661 Len=1368 TSval=8159673 TSecr=600944605 [TCP segment of a reassembled PDU]"
"107","2018-08-23 02:55:14.642308","192.168.2.3","216.58.197.4","TLSv1.2","155","Application Data"
"113","2018-08-23 02:55:14.742831","192.168.2.3","216.58.197.4","TCP","66","34325  >  443 [ACK] Seq=78068 Ack=423 Win=661 Len=0 TSval=8159683 TSecr=600944754"
"115","2018-08-23 02:55:14.757618","192.168.2.3","216.58.197.4","TCP","1434","34325  >  443 [ACK] Seq=78068 Ack=531 Win=661 Len=1368 TSval=8159685 TSecr=600944762 [TCP segment of a reassembled PDU]"
"116","2018-08-23 02:55:14.758047","192.168.2.3","216.58.197.4","TCP","1434","34325  >  443 [ACK] Seq=79436 Ack=531 Win=661 Len=1368 TSval=8159685 TSecr=600944762 [TCP segment of a reassembled PDU]"
"117","2018-08-23 02:55:14.758050","192.168.2.3","216.58.197.4","TLSv1.2","212","Application Data"
"118","2018-08-23 02:55:14.758202","192.168.2.3","216.58.197.4","TCP","1434","34325  >  443 [ACK] Seq=80950 Ack=531 Win=661 Len=1368 TSval=8159685 TSecr=600944762 [TCP segment of a reassembled PDU]"
"119","2018-08-23 02:55:14.758482","192.168.2.3","216.58.197.4","TLSv1.2","155","Application Data"
"124","2018-08-23 02:55:14.858849","192.168.2.3","216.58.197.4","TCP","1434","34325  >  443 [ACK] Seq=82407 Ack=531 Win=661 Len=1368 TSval=8159694 TSecr=600944776 [TCP segment of a reassembled PDU]"
"125","2018-08-23 02:55:14.858853","192.168.2.3","216.58.197.4","TCP","1434","34325  >  443 [ACK] Seq=83775 Ack=531 Win=661 Len=1368 TSval=8159694 TSecr=600944776 [TCP segment of a reassembled PDU]"
"126","2018-08-23 02:55:14.858854","192.168.2.3","216.58.197.4","TLSv1.2","212","Application Data"
"127","2018-08-23 02:55:14.859256","192.168.2.3","216.58.197.4","TCP","1434","34325  >  443 [ACK] Seq=85289 Ack=531 Win=661 Len=1368 TSval=8159694 TSecr=600944776 [TCP segment of a reassembled PDU]"
"128","2018-08-23 02:55:14.859259","192.168.2.3","216.58.197.4","TLSv1.2","155","Application Data"
"132","2018-08-23 02:55:14.897258","192.168.2.3","216.58.197.4","TCP","66","34325  >  443 [ACK] Seq=86746 Ack=777 Win=661 Len=0 TSval=8159699 TSecr=600944862"
"133","2018-08-23 02:55:14.951580","192.168.2.3","216.58.197.4","TCP","1434","34325  >  443 [ACK] Seq=86746 Ack=777 Win=661 Len=1368 TSval=8159704 TSecr=600944862 [TCP segment of a reassembled PDU]"
"134","2018-08-23 02:55:14.952034","192.168.2.3","216.58.197.4","TCP","1434","34325  >  443 [ACK] Seq=88114 Ack=777 Win=661 Len=1368 TSval=8159704 TSecr=600944862 [TCP segment of a reassembled PDU]"
"135","2018-08-23 02:55:14.952037","192.168.2.3","216.58.197.4","TLSv1.2","212","Application Data"
"136","2018-08-23 02:55:14.952038","192.168.2.3","216.58.197.4","TCP","1434","34325  >  443 [ACK] Seq=89628 Ack=777 Win=661 Len=1368 TSval=8159704 TSecr=600944862 [TCP segment of a reassembled PDU]"
"137","2018-08-23 02:55:14.952039","192.168.2.3","216.58.197.4","TLSv1.2","155","Application Data"
"142","2018-08-23 02:55:15.002667","192.168.2.3","216.58.197.4","TCP","66","34325  >  443 [ACK] Seq=91085 Ack=983 Win=661 Len=0 TSval=8159709 TSecr=600945015"
"143","2018-08-23 02:55:15.048917","192.168.2.3","216.58.197.4","TCP","1434","34325  >  443 [ACK] Seq=91085 Ack=983 Win=661 Len=1368 TSval=8159714 TSecr=600945015 [TCP segment of a reassembled PDU]"
"144","2018-08-23 02:55:15.048923","192.168.2.3","216.58.197.4","TCP","1434","34325  >  443 [ACK] Seq=92453 Ack=983 Win=661 Len=1368 TSval=8159714 TSecr=600945015 [TCP segment of a reassembled PDU]"
"145","2018-08-23 02:55:15.049036","192.168.2.3","216.58.197.4","TLSv1.2","212","Application Data"
"146","2018-08-23 02:55:15.049315","192.168.2.3","216.58.197.4","TCP","1434","34325  >  443 [ACK] Seq=93967 Ack=983 Win=661 Len=1368 TSval=8159714 TSecr=600945015 [TCP segment of a reassembled PDU]"
"147","2018-08-23 02:55:15.049318","192.168.2.3","216.58.197.4","TLSv1.2","155","Application Data"
"151","2018-08-23 02:55:15.143337","192.168.2.3","216.58.197.4","TCP","1434","34325  >  443 [ACK] Seq=95424 Ack=983 Win=661 Len=1368 TSval=8159723 TSecr=600945067 [TCP segment of a reassembled PDU]"
"152","2018-08-23 02:55:15.143833","192.168.2.3","216.58.197.4","TCP","1434","34325  >  443 [ACK] Seq=96792 Ack=983 Win=661 Len=1368 TSval=8159723 TSecr=600945067 [TCP segment of a reassembled PDU]"
"153","2018-08-23 02:55:15.143836","192.168.2.3","216.58.197.4","TLSv1.2","212","Application Data"
"154","2018-08-23 02:55:15.143837","192.168.2.3","216.58.197.4","TCP","1434","34325  >  443 [ACK] Seq=98306 Ack=983 Win=661 Len=1368 TSval=8159723 TSecr=600945067 [TCP segment of a reassembled PDU]"
"155","2018-08-23 02:55:15.144045","192.168.2.3","216.58.197.4","TLSv1.2","155","Application Data"
"158","2018-08-23 02:55:15.248842","192.168.2.3","216.58.197.4","TCP","1434","34325  >  443 [ACK] Seq=99763 Ack=983 Win=661 Len=1368 TSval=8159734 TSecr=600945162 [TCP segment of a reassembled PDU]"
"159","2018-08-23 02:55:15.249312","192.168.2.3","216.58.197.4","TCP","1434","34325  >  443 [ACK] Seq=101131 Ack=983 Win=661 Len=1368 TSval=8159734 TSecr=600945162 [TCP segment of a reassembled PDU]"
"160","2018-08-23 02:55:15.249314","192.168.2.3","216.58.197.4","TLSv1.2","212","Application Data"
"161","2018-08-23 02:55:15.249623","192.168.2.3","216.58.197.4","TCP","1434","34325  >  443 [ACK] Seq=102645 Ack=983 Win=661 Len=1368 TSval=8159734 TSecr=600945162 [TCP segment of a reassembled PDU]"
"162","2018-08-23 02:55:15.249625","192.168.2.3","216.58.197.4","TLSv1.2","155","Application Data"
"166","2018-08-23 02:55:15.333359","192.168.2.3","216.58.197.4","TCP","1434","34325  >  443 [ACK] Seq=104102 Ack=983 Win=661 Len=1368 TSval=8159742 TSecr=600945268 [TCP segment of a reassembled PDU]"
"167","2018-08-23 02:55:15.333751","192.168.2.3","216.58.197.4","TCP","1434","34325  >  443 [ACK] Seq=105470 Ack=983 Win=661 Len=1368 TSval=8159742 TSecr=600945268 [TCP segment of a reassembled PDU]"
"168","2018-08-23 02:55:15.333753","192.168.2.3","216.58.197.4","TLSv1.2","212","Application Data"
"169","2018-08-23 02:55:15.334117","192.168.2.3","216.58.197.4","TCP","1434","34325  >  443 [ACK] Seq=106984 Ack=983 Win=661 Len=1368 TSval=8159742 TSecr=600945268 [TCP segment of a reassembled PDU]"
"170","2018-08-23 02:55:15.334120","192.168.2.3","216.58.197.4","TLSv1.2","155","Application Data"
"174","2018-08-23 02:55:15.412039","192.168.2.3","216.58.197.4","TCP","1434","34325  >  443 [ACK] Seq=108441 Ack=983 Win=661 Len=1368 TSval=8159750 TSecr=600945352 [TCP segment of a reassembled PDU]"
"175","2018-08-23 02:55:15.412343","192.168.2.3","216.58.197.4","TCP","1434","34325  >  443 [ACK] Seq=109809 Ack=983 Win=661 Len=1368 TSval=8159750 TSecr=600945352 [TCP segment of a reassembled PDU]"
"176","2018-08-23 02:55:15.412347","192.168.2.3","216.58.197.4","TLSv1.2","212","Application Data"
"177","2018-08-23 02:55:15.412814","192.168.2.3","216.58.197.4","TCP","1434","34325  >  443 [ACK] Seq=111323 Ack=983 Win=661 Len=1368 TSval=8159750 TSecr=600945352 [TCP segment of a reassembled PDU]"
"178","2018-08-23 02:55:15.412817","192.168.2.3","216.58.197.4","TLSv1.2","155","Application Data"
"182","2018-08-23 02:55:15.509557","192.168.2.3","216.58.197.4","TCP","1434","34325  >  443 [ACK] Seq=112780 Ack=983 Win=661 Len=1368 TSval=8159760 TSecr=600945431 [TCP segment of a reassembled PDU]"
"183","2018-08-23 02:55:15.509853","192.168.2.3","216.58.197.4","TCP","1434","34325  >  443 [ACK] Seq=114148 Ack=983 Win=661 Len=1368 TSval=8159760 TSecr=600945431 [TCP segment of a reassembled PDU]"
"184","2018-08-23 02:55:15.509855","192.168.2.3","216.58.197.4","TLSv1.2","212","Application Data"
"185","2018-08-23 02:55:15.509856","192.168.2.3","216.58.197.4","TCP","1434","34325  >  443 [ACK] Seq=115662 Ack=983 Win=661 Len=1368 TSval=8159760 TSecr=600945431 [TCP segment of a reassembled PDU]"
"186","2018-08-23 02:55:15.509997","192.168.2.3","216.58.197.4","TLSv1.2","155","Application Data"
"190","2018-08-23 02:55:15.592056","192.168.2.3","216.58.197.4","TCP","1434","34325  >  443 [ACK] Seq=117119 Ack=983 Win=661 Len=1368 TSval=8159768 TSecr=600945549 [TCP segment of a reassembled PDU]"
"191","2018-08-23 02:55:15.592268","192.168.2.3","216.58.197.4","TCP","1434","34325  >  443 [ACK] Seq=118487 Ack=983 Win=661 Len=1368 TSval=8159768 TSecr=600945549 [TCP segment of a reassembled PDU]"
"192","2018-08-23 02:55:15.592271","192.168.2.3","216.58.197.4","TLSv1.2","212","Application Data"
"193","2018-08-23 02:55:15.592739","192.168.2.3","216.58.197.4","TCP","1434","34325  >  443 [ACK] Seq=120001 Ack=983 Win=661 Len=1368 TSval=8159768 TSecr=600945549 [TCP segment of a reassembled PDU]"
"194","2018-08-23 02:55:15.592742","192.168.2.3","216.58.197.4","TLSv1.2","155","Application Data"
"200","2018-08-23 02:55:15.656372","192.168.2.3","216.58.197.4","TCP","66","34325  >  443 [ACK] Seq=121458 Ack=1130 Win=661 Len=0 TSval=8159775 TSecr=600945669"
"201","2018-08-23 02:55:15.656626","192.168.2.3","216.58.197.4","TCP","66","34325  >  443 [ACK] Seq=121458 Ack=1187 Win=661 Len=0 TSval=8159775 TSecr=600945669"
"202","2018-08-23 02:55:15.685421","192.168.2.3","216.58.197.4","TCP","1434","34325  >  443 [ACK] Seq=121458 Ack=1187 Win=661 Len=1368 TSval=8159778 TSecr=600945669 [TCP segment of a reassembled PDU]"
"203","2018-08-23 02:55:15.685728","192.168.2.3","216.58.197.4","TCP","1434","34325  >  443 [ACK] Seq=122826 Ack=1187 Win=661 Len=1368 TSval=8159778 TSecr=600945669 [TCP segment of a reassembled PDU]"
"204","2018-08-23 02:55:15.685731","192.168.2.3","216.58.197.4","TLSv1.2","212","Application Data"
"205","2018-08-23 02:55:15.685731","192.168.2.3","216.58.197.4","TCP","1434","34325  >  443 [ACK] Seq=124340 Ack=1187 Win=661 Len=1368 TSval=8159778 TSecr=600945669 [TCP segment of a reassembled PDU]"
"206","2018-08-23 02:55:15.685924","192.168.2.3","216.58.197.4","TLSv1.2","155","Application Data"
"211","2018-08-23 02:55:15.754080","192.168.2.3","216.58.197.4","TCP","66","34325  >  443 [ACK] Seq=125797 Ack=1502 Win=661 Len=0 TSval=8159784 TSecr=600945749"
"212","2018-08-23 02:55:15.762810","192.168.2.3","216.58.197.4","TCP","1434","34325  >  443 [ACK] Seq=125797 Ack=1502 Win=661 Len=1368 TSval=8159785 TSecr=600945749 [TCP segment of a reassembled PDU]"
"213","2018-08-23 02:55:15.766005","192.168.2.3","216.58.197.4","TCP","1434","34325  >  443 [ACK] Seq=127165 Ack=1502 Win=661 Len=1368 TSval=8159785 TSecr=600945749 [TCP segment of a reassembled PDU]"
"214","2018-08-23 02:55:15.766007","192.168.2.3","216.58.197.4","TLSv1.2","212","Application Data"
"215","2018-08-23 02:55:15.766008","192.168.2.3","216.58.197.4","TCP","1434","34325  >  443 [ACK] Seq=128679 Ack=1502 Win=661 Len=1368 TSval=8159785 TSecr=600945749 [TCP segment of a reassembled PDU]"
"216","2018-08-23 02:55:15.766124","192.168.2.3","216.58.197.4","TLSv1.2","155","Application Data"
"222","2018-08-23 02:55:15.820727","192.168.2.3","216.58.197.4","TCP","66","34325  >  443 [ACK] Seq=130136 Ack=2001 Win=661 Len=0 TSval=8159791 TSecr=600945832"
"223","2018-08-23 02:55:15.859861","192.168.2.3","216.58.197.4","TCP","1434","34325  >  443 [ACK] Seq=130136 Ack=2001 Win=661 Len=1368 TSval=8159795 TSecr=600945832 [TCP segment of a reassembled PDU]"
"224","2018-08-23 02:55:15.860176","192.168.2.3","216.58.197.4","TCP","1434","34325  >  443 [ACK] Seq=131504 Ack=2001 Win=661 Len=1368 TSval=8159795 TSecr=600945832 [TCP segment of a reassembled PDU]"
"225","2018-08-23 02:55:15.860192","192.168.2.3","216.58.197.4","TLSv1.2","212","Application Data"
"226","2018-08-23 02:55:15.860635","192.168.2.3","216.58.197.4","TCP","1434","34325  >  443 [ACK] Seq=133018 Ack=2001 Win=661 Len=1368 TSval=8159795 TSecr=600945832 [TCP segment of a reassembled PDU]"
"227","2018-08-23 02:55:15.860638","192.168.2.3","216.58.197.4","TLSv1.2","155","Application Data"
"232","2018-08-23 02:55:15.944488","192.168.2.3","216.58.197.4","TCP","1434","34325  >  443 [ACK] Seq=134475 Ack=2148 Win=661 Len=1368 TSval=8159803 TSecr=600945949 [TCP segment of a reassembled PDU]"
"233","2018-08-23 02:55:15.944841","192.168.2.3","216.58.197.4","TCP","1434","34325  >  443 [ACK] Seq=135843 Ack=2148 Win=661 Len=1368 TSval=8159803 TSecr=600945949 [TCP segment of a reassembled PDU]"
"234","2018-08-23 02:55:15.944844","192.168.2.3","216.58.197.4","TLSv1.2","212","Application Data"
"235","2018-08-23 02:55:15.945322","192.168.2.3","216.58.197.4","TCP","1434","34325  >  443 [ACK] Seq=137357 Ack=2148 Win=661 Len=1368 TSval=8159804 TSecr=600945949 [TCP segment of a reassembled PDU]"
"236","2018-08-23 02:55:15.945325","192.168.2.3","216.58.197.4","TLSv1.2","155","Application Data"
"242","2018-08-23 02:55:16.008914","192.168.2.3","216.58.197.4","TCP","66","34325  >  443 [ACK] Seq=138814 Ack=2411 Win=661 Len=0 TSval=8159810 TSecr=600946018"
"244","2018-08-23 02:55:16.027462","192.168.2.3","192.168.2.1","TCP","183","8009  >  53029 [PSH, ACK] Seq=1 Ack=118 Win=277 Len=117 TSval=8159812 TSecr=2318848874 [TCP segment of a reassembled PDU]"
"246","2018-08-23 02:55:16.041290","192.168.2.3","216.58.197.4","TCP","1434","34325  >  443 [ACK] Seq=138814 Ack=2411 Win=661 Len=1368 TSval=8159813 TSecr=600946018 [TCP segment of a reassembled PDU]"
"247","2018-08-23 02:55:16.041548","192.168.2.3","216.58.197.4","TCP","1434","34325  >  443 [ACK] Seq=140182 Ack=2411 Win=661 Len=1368 TSval=8159813 TSecr=600946018 [TCP segment of a reassembled PDU]"
"248","2018-08-23 02:55:16.041550","192.168.2.3","216.58.197.4","TLSv1.2","212","Application Data"
"249","2018-08-23 02:55:16.041711","192.168.2.3","216.58.197.4","TCP","1434","34325  >  443 [ACK] Seq=141696 Ack=2411 Win=661 Len=1368 TSval=8159813 TSecr=600946018 [TCP segment of a reassembled PDU]"
"250","2018-08-23 02:55:16.041714","192.168.2.3","216.58.197.4","TLSv1.2","155","Application Data"
"256","2018-08-23 02:55:16.101298","192.168.2.3","216.58.197.4","TCP","66","34325  >  443 [ACK] Seq=143153 Ack=2664 Win=661 Len=0 TSval=8159819 TSecr=600946113"
"257","2018-08-23 02:55:16.139636","192.168.2.3","216.58.197.4","TCP","1434","34325  >  443 [ACK] Seq=143153 Ack=2664 Win=661 Len=1368 TSval=8159823 TSecr=600946113 [TCP segment of a reassembled PDU]"
"258","2018-08-23 02:55:16.139641","192.168.2.3","216.58.197.4","TCP","1434","34325  >  443 [ACK] Seq=144521 Ack=2664 Win=661 Len=1368 TSval=8159823 TSecr=600946113 [TCP segment of a reassembled PDU]"
"259","2018-08-23 02:55:16.139642","192.168.2.3","216.58.197.4","TLSv1.2","212","Application Data"
"260","2018-08-23 02:55:16.139903","192.168.2.3","216.58.197.4","TCP","1434","34325  >  443 [ACK] Seq=146035 Ack=2664 Win=661 Len=1368 TSval=8159823 TSecr=600946113 [TCP segment of a reassembled PDU]"
"261","2018-08-23 02:55:16.139906","192.168.2.3","216.58.197.4","TLSv1.2","155","Application Data"
"266","2018-08-23 02:55:16.186462","192.168.2.3","216.58.197.4","TCP","66","34325  >  443 [ACK] Seq=147492 Ack=2698 Win=661 Len=0 TSval=8159828 TSecr=600946158"
"269","2018-08-23 02:55:16.197063","192.168.2.3","216.58.197.4","TCP","66","34325  >  443 [ACK] Seq=147492 Ack=3080 Win=661 Len=0 TSval=8159829 TSecr=600946206"
"270","2018-08-23 02:55:16.212758","192.168.2.3","216.58.197.4","TCP","1434","34325  >  443 [ACK] Seq=147492 Ack=3080 Win=661 Len=1368 TSval=8159830 TSecr=600946206 [TCP segment of a reassembled PDU]"
"271","2018-08-23 02:55:16.212762","192.168.2.3","216.58.197.4","TCP","1434","34325  >  443 [ACK] Seq=148860 Ack=3080 Win=661 Len=1368 TSval=8159830 TSecr=600946206 [TCP segment of a reassembled PDU]"
"272","2018-08-23 02:55:16.212938","192.168.2.3","216.58.197.4","TLSv1.2","212","Application Data"
"273","2018-08-23 02:55:16.212940","192.168.2.3","216.58.197.4","TCP","1434","34325  >  443 [ACK] Seq=150374 Ack=3080 Win=661 Len=1368 TSval=8159830 TSecr=600946206 [TCP segment of a reassembled PDU]"
"274","2018-08-23 02:55:16.213043","192.168.2.3","216.58.197.4","TLSv1.2","155","Application Data"
"277","2018-08-23 02:55:16.294568","192.168.2.3","216.58.197.4","TCP","1434","34325  >  443 [ACK] Seq=151831 Ack=3080 Win=661 Len=1368 TSval=8159838 TSecr=600946231 [TCP segment of a reassembled PDU]"
"278","2018-08-23 02:55:16.294989","192.168.2.3","216.58.197.4","TCP","1434","34325  >  443 [ACK] Seq=153199 Ack=3080 Win=661 Len=1368 TSval=8159838 TSecr=600946231 [TCP segment of a reassembled PDU]"
"279","2018-08-23 02:55:16.294991","192.168.2.3","216.58.197.4","TLSv1.2","212","Application Data"
"280","2018-08-23 02:55:16.294992","192.168.2.3","216.58.197.4","TCP","1434","34325  >  443 [ACK] Seq=154713 Ack=3080 Win=661 Len=1368 TSval=8159839 TSecr=600946231 [TCP segment of a reassembled PDU]"
"281","2018-08-23 02:55:16.295346","192.168.2.3","216.58.197.4","TLSv1.2","155","Application Data"
"287","2018-08-23 02:55:16.348415","192.168.2.3","216.58.197.4","TCP","66","34325  >  443 [ACK] Seq=156170 Ack=3311 Win=661 Len=0 TSval=8159844 TSecr=600946359"
"288","2018-08-23 02:55:16.400449","192.168.2.3","216.58.197.4","TCP","1434","34325  >  443 [ACK] Seq=156170 Ack=3311 Win=661 Len=1368 TSval=8159849 TSecr=600946359 [TCP segment of a reassembled PDU]"
"289","2018-08-23 02:55:16.400454","192.168.2.3","216.58.197.4","TCP","1434","34325  >  443 [ACK] Seq=157538 Ack=3311 Win=661 Len=1368 TSval=8159849 TSecr=600946359 [TCP segment of a reassembled PDU]"
"290","2018-08-23 02:55:16.400649","192.168.2.3","216.58.197.4","TLSv1.2","212","Application Data"
"291","2018-08-23 02:55:16.401067","192.168.2.3","216.58.197.4","TCP","1434","34325  >  443 [ACK] Seq=159052 Ack=3311 Win=661 Len=1368 TSval=8159849 TSecr=600946359 [TCP segment of a reassembled PDU]"
"292","2018-08-23 02:55:16.401070","192.168.2.3","216.58.197.4","TLSv1.2","155","Application Data"
"298","2018-08-23 02:55:16.456226","192.168.2.3","216.58.197.4","TCP","66","34325  >  443 [ACK] Seq=160509 Ack=3505 Win=661 Len=0 TSval=8159855 TSecr=600946468"
"299","2018-08-23 02:55:16.487481","192.168.2.3","216.58.197.4","TCP","1434","34325  >  443 [ACK] Seq=160509 Ack=3505 Win=661 Len=1368 TSval=8159858 TSecr=600946468 [TCP segment of a reassembled PDU]"
"300","2018-08-23 02:55:16.488052","192.168.2.3","216.58.197.4","TCP","1434","34325  >  443 [ACK] Seq=161877 Ack=3505 Win=661 Len=1368 TSval=8159858 TSecr=600946468 [TCP segment of a reassembled PDU]"
"301","2018-08-23 02:55:16.488056","192.168.2.3","216.58.197.4","TLSv1.2","212","Application Data"
"302","2018-08-23 02:55:16.488321","192.168.2.3","216.58.197.4","TCP","1434","34325  >  443 [ACK] Seq=163391 Ack=3505 Win=661 Len=1368 TSval=8159858 TSecr=600946468 [TCP segment of a reassembled PDU]"
"303","2018-08-23 02:55:16.488324","192.168.2.3","216.58.197.4","TLSv1.2","155","Application Data"
"309","2018-08-23 02:55:16.540674","192.168.2.3","216.58.197.4","TCP","66","34325  >  443 [ACK] Seq=164848 Ack=3813 Win=661 Len=0 TSval=8159863 TSecr=600946552"
"310","2018-08-23 02:55:16.552458","192.168.2.3","216.58.197.4","TCP","1434","34325  >  443 [ACK] Seq=164848 Ack=3813 Win=661 Len=1368 TSval=8159864 TSecr=600946552 [TCP segment of a reassembled PDU]"
"311","2018-08-23 02:55:16.552462","192.168.2.3","216.58.197.4","TCP","1434","34325  >  443 [ACK] Seq=166216 Ack=3813 Win=661 Len=1368 TSval=8159864 TSecr=600946552 [TCP segment of a reassembled PDU]"
"312","2018-08-23 02:55:16.552463","192.168.2.3","216.58.197.4","TLSv1.2","212","Application Data"
"313","2018-08-23 02:55:16.552631","192.168.2.3","216.58.197.4","TCP","1434","34325  >  443 [ACK] Seq=167730 Ack=3813 Win=661 Len=1368 TSval=8159864 TSecr=600946552 [TCP segment of a reassembled PDU]"
"314","2018-08-23 02:55:16.552632","192.168.2.3","216.58.197.4","TLSv1.2","155","Application Data"
"317","2018-08-23 02:55:16.660204","192.168.2.3","216.58.197.4","TCP","1434","34325  >  443 [ACK] Seq=169187 Ack=3813 Win=661 Len=1368 TSval=8159875 TSecr=600946570 [TCP segment of a reassembled PDU]"
"318","2018-08-23 02:55:16.660483","192.168.2.3","216.58.197.4","TCP","1434","34325  >  443 [ACK] Seq=170555 Ack=3813 Win=661 Len=1368 TSval=8159875 TSecr=600946570 [TCP segment of a reassembled PDU]"
"319","2018-08-23 02:55:16.660485","192.168.2.3","216.58.197.4","TLSv1.2","212","Application Data"
"320","2018-08-23 02:55:16.661061","192.168.2.3","216.58.197.4","TCP","1434","34325  >  443 [ACK] Seq=172069 Ack=3813 Win=661 Len=1368 TSval=8159875 TSecr=600946570 [TCP segment of a reassembled PDU]"
"321","2018-08-23 02:55:16.661064","192.168.2.3","216.58.197.4","TLSv1.2","155","Application Data"
"327","2018-08-23 02:55:16.719172","192.168.2.3","216.58.197.4","TCP","66","34325  >  443 [ACK] Seq=173526 Ack=4163 Win=661 Len=0 TSval=8159881 TSecr=600946729"
"330","2018-08-23 02:55:16.754003","192.168.2.3","216.58.197.4","TCP","1434","34325  >  443 [ACK] Seq=173526 Ack=4350 Win=661 Len=1368 TSval=8159884 TSecr=600946749 [TCP segment of a reassembled PDU]"
"331","2018-08-23 02:55:16.754917","192.168.2.3","216.58.197.4","TCP","1434","34325  >  443 [ACK] Seq=174894 Ack=4350 Win=661 Len=1368 TSval=8159884 TSecr=600946749 [TCP segment of a reassembled PDU]"
"332","2018-08-23 02:55:16.754920","192.168.2.3","216.58.197.4","TLSv1.2","212","Application Data"
"333","2018-08-23 02:55:16.754921","192.168.2.3","216.58.197.4","TCP","1434","34325  >  443 [ACK] Seq=176408 Ack=4350 Win=661 Len=1368 TSval=8159885 TSecr=600946749 [TCP segment of a reassembled PDU]"
"334","2018-08-23 02:55:16.755135","192.168.2.3","216.58.197.4","TLSv1.2","155","Application Data"
"338","2018-08-23 02:55:16.794316","192.168.2.3","216.58.197.4","TCP","66","34325  >  443 [ACK] Seq=177865 Ack=4564 Win=661 Len=0 TSval=8159889 TSecr=600946762"
"340","2018-08-23 02:55:16.859746","192.168.2.3","216.58.197.4","TCP","66","34325  >  443 [ACK] Seq=177865 Ack=4676 Win=661 Len=0 TSval=8159895 TSecr=600946862"
"341","2018-08-23 02:55:16.871908","192.168.2.3","216.58.197.4","TCP","1434","34325  >  443 [ACK] Seq=177865 Ack=4676 Win=661 Len=1368 TSval=8159896 TSecr=600946862 [TCP segment of a reassembled PDU]"
"342","2018-08-23 02:55:16.874969","192.168.2.3","216.58.197.4","TCP","1434","34325  >  443 [ACK] Seq=179233 Ack=4676 Win=661 Len=1368 TSval=8159896 TSecr=600946862 [TCP segment of a reassembled PDU]"
"343","2018-08-23 02:55:16.874974","192.168.2.3","216.58.197.4","TLSv1.2","212","Application Data"
"344","2018-08-23 02:55:16.875394","192.168.2.3","216.58.197.4","TCP","1434","34325  >  443 [ACK] Seq=180747 Ack=4676 Win=661 Len=1368 TSval=8159896 TSecr=600946862 [TCP segment of a reassembled PDU]"
"345","2018-08-23 02:55:16.875397","192.168.2.3","216.58.197.4","TLSv1.2","155","Application Data"
"349","2018-08-23 02:55:16.967570","192.168.2.3","216.58.197.4","TCP","1434","34325  >  443 [ACK] Seq=182204 Ack=4676 Win=661 Len=1368 TSval=8159906 TSecr=600946893 [TCP segment of a reassembled PDU]"
"350","2018-08-23 02:55:16.967963","192.168.2.3","216.58.197.4","TCP","1434","34325  >  443 [ACK] Seq=183572 Ack=4676 Win=661 Len=1368 TSval=8159906 TSecr=600946893 [TCP segment of a reassembled PDU]"
"351","2018-08-23 02:55:16.967964","192.168.2.3","216.58.197.4","TLSv1.2","212","Application Data"
"352","2018-08-23 02:55:16.968403","192.168.2.3","216.58.197.4","TCP","1434","34325  >  443 [ACK] Seq=185086 Ack=4676 Win=661 Len=1368 TSval=8159906 TSecr=600946893 [TCP segment of a reassembled PDU]"
"353","2018-08-23 02:55:16.968406","192.168.2.3","216.58.197.4","TLSv1.2","155","Application Data"
"359","2018-08-23 02:55:17.029167","192.168.2.3","216.58.197.4","TCP","66","34325  >  443 [ACK] Seq=186543 Ack=4927 Win=661 Len=0 TSval=8159912 TSecr=600947041"
"360","2018-08-23 02:55:17.064907","192.168.2.3","216.58.197.4","TCP","1434","34325  >  443 [ACK] Seq=186543 Ack=4927 Win=661 Len=1368 TSval=8159915 TSecr=600947041 [TCP segment of a reassembled PDU]"
"361","2018-08-23 02:55:17.064912","192.168.2.3","216.58.197.4","TCP","1434","34325  >  443 [ACK] Seq=187911 Ack=4927 Win=661 Len=1368 TSval=8159915 TSecr=600947041 [TCP segment of a reassembled PDU]"
"362","2018-08-23 02:55:17.065000","192.168.2.3","216.58.197.4","TLSv1.2","212","Application Data"
"363","2018-08-23 02:55:17.065242","192.168.2.3","216.58.197.4","TCP","1434","34325  >  443 [ACK] Seq=189425 Ack=4927 Win=661 Len=1368 TSval=8159915 TSecr=600947041 [TCP segment of a reassembled PDU]"
"364","2018-08-23 02:55:17.065245","192.168.2.3","216.58.197.4","TLSv1.2","155","Application Data"
"369","2018-08-23 02:55:17.169322","192.168.2.3","216.58.197.4","TCP","1434","34325  >  443 [ACK] Seq=190882 Ack=4927 Win=661 Len=1368 TSval=8159926 TSecr=600947083 [TCP segment of a reassembled PDU]"
"370","2018-08-23 02:55:17.169661","192.168.2.3","216.58.197.4","TCP","1434","34325  >  443 [ACK] Seq=192250 Ack=4927 Win=661 Len=1368 TSval=8159926 TSecr=600947083 [TCP segment of a reassembled PDU]"
"371","2018-08-23 02:55:17.169663","192.168.2.3","216.58.197.4","TLSv1.2","212","Application Data"
"372","2018-08-23 02:55:17.170089","192.168.2.3","216.58.197.4","TCP","1434","34325  >  443 [ACK] Seq=193764 Ack=4927 Win=661 Len=1368 TSval=8159926 TSecr=600947083 [TCP segment of a reassembled PDU]"
"373","2018-08-23 02:55:17.170091","192.168.2.3","216.58.197.4","TLSv1.2","154","Application Data"
"379","2018-08-23 02:55:17.191634","192.168.2.3","104.199.240.211","TCP","66","48832  >  443 [ACK] Seq=1 Ack=32 Win=473 Len=0 TSval=8159928 TSecr=303429713"
"380","2018-08-23 02:55:17.224280","192.168.2.3","104.199.240.211","TCP","66","48832  >  443 [ACK] Seq=1 Ack=33 Win=473 Len=0 TSval=8159932 TSecr=303429713"
"381","2018-08-23 02:55:17.286504","192.168.2.3","216.58.197.4","TCP","1434","34325  >  443 [ACK] Seq=195220 Ack=4927 Win=661 Len=1368 TSval=8159938 TSecr=600947188 [TCP segment of a reassembled PDU]"
"382","2018-08-23 02:55:17.286910","192.168.2.3","216.58.197.4","TCP","1434","34325  >  443 [ACK] Seq=196588 Ack=4927 Win=661 Len=1368 TSval=8159938 TSecr=600947188 [TCP segment of a reassembled PDU]"
"383","2018-08-23 02:55:17.286913","192.168.2.3","216.58.197.4","TLSv1.2","212","Application Data"
"384","2018-08-23 02:55:17.287267","192.168.2.3","216.58.197.4","TCP","1434","34325  >  443 [ACK] Seq=198102 Ack=4927 Win=661 Len=1368 TSval=8159938 TSecr=600947188 [TCP segment of a reassembled PDU]"
"385","2018-08-23 02:55:17.287269","192.168.2.3","216.58.197.4","TLSv1.2","155","Application Data"
"391","2018-08-23 02:55:17.305028","192.168.2.3","104.199.240.211","TCP","66","48834  >  443 [ACK] Seq=1 Ack=32 Win=661 Len=0 TSval=8159940 TSecr=302289659"
"394","2018-08-23 02:55:17.340629","192.168.2.3","216.58.197.4","TCP","66","34325  >  443 [ACK] Seq=199559 Ack=5212 Win=661 Len=0 TSval=8159943 TSecr=600947351"
"395","2018-08-23 02:55:17.344351","192.168.2.3","104.199.240.211","TCP","66","48834  >  443 [ACK] Seq=1 Ack=33 Win=661 Len=0 TSval=8159944 TSecr=302289659"
"396","2018-08-23 02:55:17.383620","192.168.2.3","216.58.197.4","TCP","1434","34325  >  443 [ACK] Seq=199559 Ack=5212 Win=661 Len=1368 TSval=8159947 TSecr=600947351 [TCP segment of a reassembled PDU]"
"397","2018-08-23 02:55:17.386383","192.168.2.3","216.58.197.4","TCP","1434","34325  >  443 [ACK] Seq=200927 Ack=5212 Win=661 Len=1368 TSval=8159947 TSecr=600947351 [TCP segment of a reassembled PDU]"
"398","2018-08-23 02:55:17.386388","192.168.2.3","216.58.197.4","TLSv1.2","212","Application Data"
"399","2018-08-23 02:55:17.386389","192.168.2.3","216.58.197.4","TCP","1434","34325  >  443 [ACK] Seq=202441 Ack=5212 Win=661 Len=1368 TSval=8159947 TSecr=600947351 [TCP segment of a reassembled PDU]"
"400","2018-08-23 02:55:17.386569","192.168.2.3","216.58.197.4","TLSv1.2","155","Application Data"
"405","2018-08-23 02:55:17.442402","192.168.2.3","216.58.197.4","TCP","66","34325  >  443 [ACK] Seq=203898 Ack=5547 Win=661 Len=0 TSval=8159953 TSecr=600947451"
"406","2018-08-23 02:55:17.459427","192.168.2.3","216.58.197.4","TCP","1434","34325  >  443 [ACK] Seq=203898 Ack=5547 Win=661 Len=1368 TSval=8159955 TSecr=600947451 [TCP segment of a reassembled PDU]"
"407","2018-08-23 02:55:17.459688","192.168.2.3","216.58.197.4","TCP","1434","34325  >  443 [ACK] Seq=205266 Ack=5547 Win=661 Len=1368 TSval=8159955 TSecr=600947451 [TCP segment of a reassembled PDU]"
"408","2018-08-23 02:55:17.459690","192.168.2.3","216.58.197.4","TLSv1.2","212","Application Data"
"409","2018-08-23 02:55:17.460160","192.168.2.3","216.58.197.4","TLSv1.2","1431","Application Data"
"410","2018-08-23 02:55:17.460164","192.168.2.3","216.58.197.4","TLSv1.2","102","Application Data"
"416","2018-08-23 02:55:17.477507","192.168.2.3","216.58.197.4","TCP","66","34325  >  443 [ACK] Seq=208181 Ack=6126 Win=661 Len=0 TSval=8159957 TSecr=600947487"
"419","2018-08-23 02:55:17.749712","192.168.2.3","216.58.197.4","TCP","66","34325  >  443 [ACK] Seq=208181 Ack=6467 Win=661 Len=0 TSval=8159984 TSecr=600947749"
"423","2018-08-23 02:55:18.088229","192.168.2.3","216.58.197.4","TCP","66","34325  >  443 [ACK] Seq=208181 Ack=8025 Win=650 Len=0 TSval=8160018 TSecr=600948068"
"435","2018-08-23 02:55:18.137318","192.168.2.3","216.58.197.4","TCP","66","34325  >  443 [ACK] Seq=208181 Ack=8525 Win=661 Len=0 TSval=8160022 TSecr=600948090"
"437","2018-08-23 02:55:18.147054","192.168.2.3","216.58.197.4","TCP","66","34325  >  443 [ACK] Seq=208181 Ack=9943 Win=650 Len=0 TSval=8160023 TSecr=600948107"
"438","2018-08-23 02:55:18.147058","192.168.2.3","216.58.197.4","TCP","66","34325  >  443 [ACK] Seq=208181 Ack=10422 Win=650 Len=0 TSval=8160023 TSecr=600948107"
