"No.","Time","Source","Destination","Protocol","Length","Info"
"2","2018-08-23 03:03:43.110764","192.168.2.3","35.186.224.46","TLSv1.2","108","Application Data"
"5","2018-08-23 03:03:43.157225","192.168.2.3","35.186.224.46","TCP","66","49072  >  443 [ACK] Seq=43 Ack=40 Win=1643 Len=0 TSval=8210524 TSecr=3643324569"
"6","2018-08-23 03:03:43.509641","192.168.2.3","216.58.197.3","TCP","66","43448  >  443 [ACK] Seq=1 Ack=1 Win=406 Len=0 TSval=8210560 TSecr=3996693760"
"9","2018-08-23 03:03:45.381344","192.168.2.3","192.168.2.1","TCP","183","8009  >  53029 [PSH, ACK] Seq=1 Ack=118 Win=277 Len=117 TSval=8210746 TSecr=2319357000 [TCP segment of a reassembled PDU]"
"11","2018-08-23 03:03:45.387198","192.168.2.3","216.58.197.4","TLSv1.2","156","Application Data"
"12","2018-08-23 03:03:45.387409","192.168.2.3","216.58.197.4","TLSv1.2","104","Application Data"
"13","2018-08-23 03:03:45.387411","192.168.2.3","216.58.197.4","TLSv1.2","158","Application Data"
"18","2018-08-23 03:03:45.396182","192.168.2.3","216.58.197.4","TCP","1434","34325  >  443 [ACK] Seq=221 Ack=39 Win=661 Len=1368 TSval=8210748 TSecr=601455406 [TCP segment of a reassembled PDU]"
"19","2018-08-23 03:03:45.400798","192.168.2.3","216.58.197.4","TCP","1434","34325  >  443 [ACK] Seq=1589 Ack=39 Win=661 Len=1368 TSval=8210748 TSecr=601455406 [TCP segment of a reassembled PDU]"
"20","2018-08-23 03:03:45.400970","192.168.2.3","216.58.197.4","TLSv1.2","212","Application Data"
"21","2018-08-23 03:03:45.401151","192.168.2.3","216.58.197.4","TCP","1434","34325  >  443 [ACK] Seq=3103 Ack=39 Win=661 Len=1368 TSval=8210748 TSecr=601455406 [TCP segment of a reassembled PDU]"
"22","2018-08-23 03:03:45.401153","192.168.2.3","216.58.197.4","TLSv1.2","334","Application Data"
"23","2018-08-23 03:03:45.401371","192.168.2.3","216.58.197.4","TCP","1434","34325  >  443 [ACK] Seq=4739 Ack=39 Win=661 Len=1368 TSval=8210748 TSecr=601455406 [TCP segment of a reassembled PDU]"
"24","2018-08-23 03:03:45.401571","192.168.2.3","216.58.197.4","TCP","1434","34325  >  443 [ACK] Seq=6107 Ack=39 Win=661 Len=1368 TSval=8210748 TSecr=601455406 [TCP segment of a reassembled PDU]"
"25","2018-08-23 03:03:45.401573","192.168.2.3","216.58.197.4","TLSv1.2","212","Application Data"
"26","2018-08-23 03:03:45.401815","192.168.2.3","216.58.197.4","TCP","1434","34325  >  443 [ACK] Seq=7621 Ack=39 Win=661 Len=1368 TSval=8210748 TSecr=601455406 [TCP segment of a reassembled PDU]"
"27","2018-08-23 03:03:45.401817","192.168.2.3","216.58.197.4","TLSv1.2","156","Application Data"
"33","2018-08-23 03:03:45.406215","192.168.2.3","216.58.197.4","TCP","1434","34325  >  443 [ACK] Seq=9079 Ack=39 Win=661 Len=1368 TSval=8210749 TSecr=601455419 [TCP segment of a reassembled PDU]"
"34","2018-08-23 03:03:45.406947","192.168.2.3","216.58.197.4","TCP","1434","34325  >  443 [ACK] Seq=10447 Ack=39 Win=661 Len=1368 TSval=8210749 TSecr=601455419 [TCP segment of a reassembled PDU]"
"35","2018-08-23 03:03:45.406950","192.168.2.3","216.58.197.4","TLSv1.2","1434","Application Data [TCP segment of a reassembled PDU]"
"36","2018-08-23 03:03:45.407449","192.168.2.3","216.58.197.4","TLSv1.2","1434","Application Data [TCP segment of a reassembled PDU]"
"37","2018-08-23 03:03:45.407452","192.168.2.3","216.58.197.4","TCP","1434","34325  >  443 [ACK] Seq=14551 Ack=39 Win=661 Len=1368 TSval=8210749 TSecr=601455419 [TCP segment of a reassembled PDU]"
"38","2018-08-23 03:03:45.407670","192.168.2.3","216.58.197.4","TLSv1.2","1434","Application Data [TCP segment of a reassembled PDU]"
"39","2018-08-23 03:03:45.408939","192.168.2.3","216.58.197.4","TLSv1.2","1434","Application Data [TCP segment of a reassembled PDU]"
"40","2018-08-23 03:03:45.409237","192.168.2.3","216.58.197.4","TCP","1434","34325  >  443 [ACK] Seq=18655 Ack=39 Win=661 Len=1368 TSval=8210749 TSecr=601455420 [TCP segment of a reassembled PDU]"
"41","2018-08-23 03:03:45.409239","192.168.2.3","216.58.197.4","TLSv1.2","1434","Application Data [TCP segment of a reassembled PDU]"
"42","2018-08-23 03:03:45.409464","192.168.2.3","216.58.197.4","TLSv1.2","1434","Application Data [TCP segment of a reassembled PDU]"
"43","2018-08-23 03:03:45.409467","192.168.2.3","216.58.197.4","TCP","1434","34325  >  443 [ACK] Seq=22759 Ack=39 Win=661 Len=1368 TSval=8210749 TSecr=601455420 [TCP segment of a reassembled PDU]"
"44","2018-08-23 03:03:45.409716","192.168.2.3","216.58.197.4","TLSv1.2","1434","Application Data [TCP segment of a reassembled PDU]"
"45","2018-08-23 03:03:45.409840","192.168.2.3","216.58.197.4","TLSv1.2","1434","Application Data [TCP segment of a reassembled PDU]"
"46","2018-08-23 03:03:45.410873","192.168.2.3","216.58.197.4","TCP","1434","34325  >  443 [ACK] Seq=26863 Ack=39 Win=661 Len=1368 TSval=8210749 TSecr=601455420 [TCP segment of a reassembled PDU]"
"47","2018-08-23 03:03:45.411233","192.168.2.3","216.58.197.4","TLSv1.2","1434","Application Data [TCP segment of a reassembled PDU]"
"55","2018-08-23 03:03:45.419605","192.168.2.3","216.58.197.4","TLSv1.2","1434","Application Data [TCP segment of a reassembled PDU]"
"56","2018-08-23 03:03:45.421016","192.168.2.3","216.58.197.4","TCP","1434","34325  >  443 [ACK] Seq=30967 Ack=39 Win=661 Len=1368 TSval=8210750 TSecr=601455425 [TCP segment of a reassembled PDU]"
"57","2018-08-23 03:03:45.421413","192.168.2.3","216.58.197.4","TLSv1.2","1434","Application Data [TCP segment of a reassembled PDU]"
"58","2018-08-23 03:03:45.421416","192.168.2.3","216.58.197.4","TCP","1434","34325  >  443 [ACK] Seq=33703 Ack=39 Win=661 Len=1368 TSval=8210750 TSecr=601455426 [TCP segment of a reassembled PDU]"
"59","2018-08-23 03:03:45.421631","192.168.2.3","216.58.197.4","TLSv1.2","1434","Application Data [TCP segment of a reassembled PDU]"
"60","2018-08-23 03:03:45.421726","192.168.2.3","216.58.197.4","TCP","1434","34325  >  443 [ACK] Seq=36439 Ack=39 Win=661 Len=1368 TSval=8210750 TSecr=601455426 [TCP segment of a reassembled PDU]"
"61","2018-08-23 03:03:45.421896","192.168.2.3","216.58.197.4","TLSv1.2","1434","Application Data [TCP segment of a reassembled PDU]"
"62","2018-08-23 03:03:45.422061","192.168.2.3","216.58.197.4","TLSv1.2","1434","Application Data [TCP segment of a reassembled PDU]"
"63","2018-08-23 03:03:45.422247","192.168.2.3","216.58.197.4","TCP","1434","34325  >  443 [ACK] Seq=40543 Ack=39 Win=661 Len=1368 TSval=8210751 TSecr=601455426 [TCP segment of a reassembled PDU]"
"64","2018-08-23 03:03:45.422783","192.168.2.3","216.58.197.4","TLSv1.2","1434","Application Data [TCP segment of a reassembled PDU]"
"65","2018-08-23 03:03:45.423050","192.168.2.3","216.58.197.4","TLSv1.2","1434","Application Data [TCP segment of a reassembled PDU]"
"66","2018-08-23 03:03:45.423052","192.168.2.3","216.58.197.4","TCP","1434","34325  >  443 [ACK] Seq=44647 Ack=39 Win=661 Len=1368 TSval=8210751 TSecr=601455427 [TCP segment of a reassembled PDU]"
"67","2018-08-23 03:03:45.423393","192.168.2.3","216.58.197.4","TLSv1.2","1434","Application Data [TCP segment of a reassembled PDU]"
"68","2018-08-23 03:03:45.423395","192.168.2.3","216.58.197.4","TLSv1.2","1434","Application Data [TCP segment of a reassembled PDU]"
"69","2018-08-23 03:03:45.423607","192.168.2.3","216.58.197.4","TCP","1434","34325  >  443 [ACK] Seq=48751 Ack=39 Win=661 Len=1368 TSval=8210751 TSecr=601455428 [TCP segment of a reassembled PDU]"
"70","2018-08-23 03:03:45.424073","192.168.2.3","216.58.197.4","TLSv1.2","1434","Application Data [TCP segment of a reassembled PDU]"
"71","2018-08-23 03:03:45.424075","192.168.2.3","216.58.197.4","TLSv1.2","1434","Application Data [TCP segment of a reassembled PDU]"
"72","2018-08-23 03:03:45.424076","192.168.2.3","216.58.197.4","TCP","1434","34325  >  443 [ACK] Seq=52855 Ack=39 Win=661 Len=1368 TSval=8210751 TSecr=601455429 [TCP segment of a reassembled PDU]"
"74","2018-08-23 03:03:45.424272","192.168.2.3","216.58.197.4","TLSv1.2","1434","Application Data [TCP segment of a reassembled PDU]"
"75","2018-08-23 03:03:45.424560","192.168.2.3","216.58.197.4","TLSv1.2","1434","Application Data [TCP segment of a reassembled PDU]"
"80","2018-08-23 03:03:45.426850","192.168.2.3","216.58.197.4","TCP","1434","34325  >  443 [ACK] Seq=56959 Ack=39 Win=661 Len=1368 TSval=8210751 TSecr=601455438 [TCP segment of a reassembled PDU]"
"81","2018-08-23 03:03:45.426853","192.168.2.3","216.58.197.4","TCP","1434","34325  >  443 [ACK] Seq=58327 Ack=39 Win=661 Len=1368 TSval=8210751 TSecr=601455438 [TCP segment of a reassembled PDU]"
"88","2018-08-23 03:03:45.434674","192.168.2.3","216.58.197.4","TLSv1.2","1434","Application Data [TCP segment of a reassembled PDU]"
"89","2018-08-23 03:03:45.434678","192.168.2.3","216.58.197.4","TLSv1.2","1434","Application Data, Application Data"
"90","2018-08-23 03:03:45.434995","192.168.2.3","216.58.197.4","TCP","1434","34325  >  443 [ACK] Seq=62431 Ack=39 Win=661 Len=1368 TSval=8210752 TSecr=601455440 [TCP segment of a reassembled PDU]"
"91","2018-08-23 03:03:45.434999","192.168.2.3","216.58.197.4","TLSv1.2","1434","Application Data [TCP segment of a reassembled PDU]"
"92","2018-08-23 03:03:45.435144","192.168.2.3","216.58.197.4","TLSv1.2","1244","Application Data"
"96","2018-08-23 03:03:45.451317","192.168.2.3","216.58.197.4","TCP","1434","34325  >  443 [ACK] Seq=66345 Ack=39 Win=661 Len=1368 TSval=8210754 TSecr=601455453 [TCP segment of a reassembled PDU]"
"97","2018-08-23 03:03:45.453774","192.168.2.3","216.58.197.4","TCP","1434","34325  >  443 [ACK] Seq=67713 Ack=39 Win=661 Len=1368 TSval=8210754 TSecr=601455453 [TCP segment of a reassembled PDU]"
"98","2018-08-23 03:03:45.453778","192.168.2.3","216.58.197.4","TLSv1.2","212","Application Data"
"99","2018-08-23 03:03:45.453780","192.168.2.3","216.58.197.4","TCP","1434","34325  >  443 [ACK] Seq=69227 Ack=39 Win=661 Len=1368 TSval=8210754 TSecr=601455453 [TCP segment of a reassembled PDU]"
"100","2018-08-23 03:03:45.453781","192.168.2.3","216.58.197.4","TLSv1.2","155","Application Data"
"106","2018-08-23 03:03:45.466363","192.168.2.3","216.58.197.4","TCP","66","34325  >  443 [ACK] Seq=70684 Ack=557 Win=661 Len=0 TSval=8210755 TSecr=601455478"
"108","2018-08-23 03:03:45.519710","192.168.2.3","216.58.197.4","TCP","66","34325  >  443 [ACK] Seq=70684 Ack=768 Win=661 Len=0 TSval=8210761 TSecr=601455489"
"109","2018-08-23 03:03:45.546847","192.168.2.3","216.58.197.4","TCP","1434","34325  >  443 [ACK] Seq=70684 Ack=768 Win=661 Len=1368 TSval=8210763 TSecr=601455489 [TCP segment of a reassembled PDU]"
"110","2018-08-23 03:03:45.547289","192.168.2.3","216.58.197.4","TCP","1434","34325  >  443 [ACK] Seq=72052 Ack=768 Win=661 Len=1368 TSval=8210763 TSecr=601455489 [TCP segment of a reassembled PDU]"
"111","2018-08-23 03:03:45.547293","192.168.2.3","216.58.197.4","TLSv1.2","212","Application Data"
"112","2018-08-23 03:03:45.547670","192.168.2.3","216.58.197.4","TCP","1434","34325  >  443 [ACK] Seq=73566 Ack=768 Win=661 Len=1368 TSval=8210763 TSecr=601455489 [TCP segment of a reassembled PDU]"
"113","2018-08-23 03:03:45.547673","192.168.2.3","216.58.197.4","TLSv1.2","155","Application Data"
"117","2018-08-23 03:03:45.580372","192.168.2.3","216.58.197.4","TCP","66","34325  >  443 [ACK] Seq=75023 Ack=907 Win=661 Len=0 TSval=8210766 TSecr=601455588"
"118","2018-08-23 03:03:45.643742","192.168.2.3","216.58.197.4","TCP","1434","34325  >  443 [ACK] Seq=75023 Ack=907 Win=661 Len=1368 TSval=8210773 TSecr=601455588 [TCP segment of a reassembled PDU]"
"119","2018-08-23 03:03:45.644118","192.168.2.3","216.58.197.4","TCP","1434","34325  >  443 [ACK] Seq=76391 Ack=907 Win=661 Len=1368 TSval=8210773 TSecr=601455588 [TCP segment of a reassembled PDU]"
"120","2018-08-23 03:03:45.644121","192.168.2.3","216.58.197.4","TLSv1.2","212","Application Data"
"121","2018-08-23 03:03:45.644464","192.168.2.3","216.58.197.4","TCP","1434","34325  >  443 [ACK] Seq=77905 Ack=907 Win=661 Len=1368 TSval=8210773 TSecr=601455588 [TCP segment of a reassembled PDU]"
"122","2018-08-23 03:03:45.644467","192.168.2.3","216.58.197.4","TLSv1.2","155","Application Data"
"127","2018-08-23 03:03:45.730208","192.168.2.3","216.58.197.4","TCP","66","34325  >  443 [ACK] Seq=79362 Ack=1131 Win=661 Len=0 TSval=8210782 TSecr=601455743"
"128","2018-08-23 03:03:45.741456","192.168.2.3","216.58.197.4","TCP","1434","34325  >  443 [ACK] Seq=79362 Ack=1131 Win=661 Len=1368 TSval=8210783 TSecr=601455743 [TCP segment of a reassembled PDU]"
"129","2018-08-23 03:03:45.741458","192.168.2.3","216.58.197.4","TCP","1434","34325  >  443 [ACK] Seq=80730 Ack=1131 Win=661 Len=1368 TSval=8210783 TSecr=601455743 [TCP segment of a reassembled PDU]"
"130","2018-08-23 03:03:45.741459","192.168.2.3","216.58.197.4","TLSv1.2","212","Application Data"
"131","2018-08-23 03:03:45.742235","192.168.2.3","216.58.197.4","TCP","1434","34325  >  443 [ACK] Seq=82244 Ack=1131 Win=661 Len=1368 TSval=8210783 TSecr=601455743 [TCP segment of a reassembled PDU]"
"132","2018-08-23 03:03:45.742237","192.168.2.3","216.58.197.4","TLSv1.2","155","Application Data"
"136","2018-08-23 03:03:45.837205","192.168.2.3","216.58.197.4","TCP","1434","34325  >  443 [ACK] Seq=83701 Ack=1131 Win=661 Len=1368 TSval=8210792 TSecr=601455760 [TCP segment of a reassembled PDU]"
"137","2018-08-23 03:03:45.837663","192.168.2.3","216.58.197.4","TCP","1434","34325  >  443 [ACK] Seq=85069 Ack=1131 Win=661 Len=1368 TSval=8210792 TSecr=601455760 [TCP segment of a reassembled PDU]"
"138","2018-08-23 03:03:45.837677","192.168.2.3","216.58.197.4","TLSv1.2","212","Application Data"
"139","2018-08-23 03:03:45.837678","192.168.2.3","216.58.197.4","TCP","1434","34325  >  443 [ACK] Seq=86583 Ack=1131 Win=661 Len=1368 TSval=8210792 TSecr=601455760 [TCP segment of a reassembled PDU]"
"140","2018-08-23 03:03:45.837679","192.168.2.3","216.58.197.4","TLSv1.2","155","Application Data"
"144","2018-08-23 03:03:45.957019","192.168.2.3","216.58.197.4","TCP","1434","34325  >  443 [ACK] Seq=88040 Ack=1131 Win=661 Len=1368 TSval=8210803 TSecr=601455856 [TCP segment of a reassembled PDU]"
"145","2018-08-23 03:03:45.957028","192.168.2.3","216.58.197.4","TCP","1434","34325  >  443 [ACK] Seq=89408 Ack=1131 Win=661 Len=1368 TSval=8210803 TSecr=601455856 [TCP segment of a reassembled PDU]"
"146","2018-08-23 03:03:45.957030","192.168.2.3","216.58.197.4","TLSv1.2","212","Application Data"
"147","2018-08-23 03:03:45.957301","192.168.2.3","216.58.197.4","TCP","1434","34325  >  443 [ACK] Seq=90922 Ack=1131 Win=661 Len=1368 TSval=8210803 TSecr=601455856 [TCP segment of a reassembled PDU]"
"148","2018-08-23 03:03:45.957305","192.168.2.3","216.58.197.4","TLSv1.2","155","Application Data"
"152","2018-08-23 03:03:46.044877","192.168.2.3","216.58.197.4","TCP","1434","34325  >  443 [ACK] Seq=92379 Ack=1131 Win=661 Len=1368 TSval=8210812 TSecr=601455976 [TCP segment of a reassembled PDU]"
"153","2018-08-23 03:03:46.044882","192.168.2.3","216.58.197.4","TCP","1434","34325  >  443 [ACK] Seq=93747 Ack=1131 Win=661 Len=1368 TSval=8210812 TSecr=601455976 [TCP segment of a reassembled PDU]"
"154","2018-08-23 03:03:46.044883","192.168.2.3","216.58.197.4","TLSv1.2","212","Application Data"
"155","2018-08-23 03:03:46.045240","192.168.2.3","216.58.197.4","TCP","1434","34325  >  443 [ACK] Seq=95261 Ack=1131 Win=661 Len=1368 TSval=8210812 TSecr=601455976 [TCP segment of a reassembled PDU]"
"156","2018-08-23 03:03:46.045242","192.168.2.3","216.58.197.4","TLSv1.2","155","Application Data"
"160","2018-08-23 03:03:46.134356","192.168.2.3","216.58.197.4","TCP","1434","34325  >  443 [ACK] Seq=96718 Ack=1131 Win=661 Len=1368 TSval=8210822 TSecr=601456079 [TCP segment of a reassembled PDU]"
"161","2018-08-23 03:03:46.134718","192.168.2.3","216.58.197.4","TCP","1434","34325  >  443 [ACK] Seq=98086 Ack=1131 Win=661 Len=1368 TSval=8210822 TSecr=601456079 [TCP segment of a reassembled PDU]"
"162","2018-08-23 03:03:46.134722","192.168.2.3","216.58.197.4","TLSv1.2","212","Application Data"
"163","2018-08-23 03:03:46.134723","192.168.2.3","216.58.197.4","TCP","1434","34325  >  443 [ACK] Seq=99600 Ack=1131 Win=661 Len=1368 TSval=8210822 TSecr=601456079 [TCP segment of a reassembled PDU]"
"164","2018-08-23 03:03:46.134903","192.168.2.3","216.58.197.4","TLSv1.2","155","Application Data"
"168","2018-08-23 03:03:46.241540","192.168.2.3","216.58.197.4","TCP","1434","34325  >  443 [ACK] Seq=101057 Ack=1131 Win=661 Len=1368 TSval=8210832 TSecr=601456153 [TCP segment of a reassembled PDU]"
"169","2018-08-23 03:03:46.241679","192.168.2.3","216.58.197.4","TCP","1434","34325  >  443 [ACK] Seq=102425 Ack=1131 Win=661 Len=1368 TSval=8210832 TSecr=601456153 [TCP segment of a reassembled PDU]"
"170","2018-08-23 03:03:46.241685","192.168.2.3","216.58.197.4","TLSv1.2","212","Application Data"
"171","2018-08-23 03:03:46.241851","192.168.2.3","216.58.197.4","TCP","1434","34325  >  443 [ACK] Seq=103939 Ack=1131 Win=661 Len=1368 TSval=8210832 TSecr=601456153 [TCP segment of a reassembled PDU]"
"172","2018-08-23 03:03:46.241854","192.168.2.3","216.58.197.4","TLSv1.2","155","Application Data"
"176","2018-08-23 03:03:46.317114","192.168.2.3","216.58.197.4","TCP","1434","34325  >  443 [ACK] Seq=105396 Ack=1131 Win=661 Len=1368 TSval=8210840 TSecr=601456260 [TCP segment of a reassembled PDU]"
"177","2018-08-23 03:03:46.317445","192.168.2.3","216.58.197.4","TCP","1434","34325  >  443 [ACK] Seq=106764 Ack=1131 Win=661 Len=1368 TSval=8210840 TSecr=601456260 [TCP segment of a reassembled PDU]"
"178","2018-08-23 03:03:46.317447","192.168.2.3","216.58.197.4","TLSv1.2","212","Application Data"
"179","2018-08-23 03:03:46.317448","192.168.2.3","216.58.197.4","TCP","1434","34325  >  443 [ACK] Seq=108278 Ack=1131 Win=661 Len=1368 TSval=8210840 TSecr=601456260 [TCP segment of a reassembled PDU]"
"180","2018-08-23 03:03:46.317653","192.168.2.3","216.58.197.4","TLSv1.2","155","Application Data"
"184","2018-08-23 03:03:46.415116","192.168.2.3","216.58.197.4","TCP","1434","34325  >  443 [ACK] Seq=109735 Ack=1131 Win=661 Len=1368 TSval=8210850 TSecr=601456336 [TCP segment of a reassembled PDU]"
"185","2018-08-23 03:03:46.415509","192.168.2.3","216.58.197.4","TCP","1434","34325  >  443 [ACK] Seq=111103 Ack=1131 Win=661 Len=1368 TSval=8210850 TSecr=601456336 [TCP segment of a reassembled PDU]"
"186","2018-08-23 03:03:46.415512","192.168.2.3","216.58.197.4","TLSv1.2","212","Application Data"
"187","2018-08-23 03:03:46.415513","192.168.2.3","216.58.197.4","TCP","1434","34325  >  443 [ACK] Seq=112617 Ack=1131 Win=661 Len=1368 TSval=8210850 TSecr=601456336 [TCP segment of a reassembled PDU]"
"188","2018-08-23 03:03:46.415880","192.168.2.3","216.58.197.4","TLSv1.2","155","Application Data"
"194","2018-08-23 03:03:46.478899","192.168.2.3","216.58.197.4","TCP","66","34325  >  443 [ACK] Seq=114074 Ack=1235 Win=661 Len=0 TSval=8210856 TSecr=601456479"
"195","2018-08-23 03:03:46.486288","192.168.2.3","216.58.197.4","TCP","1434","34325  >  443 [ACK] Seq=114074 Ack=1235 Win=661 Len=1368 TSval=8210857 TSecr=601456479 [TCP segment of a reassembled PDU]"
"196","2018-08-23 03:03:46.486705","192.168.2.3","216.58.197.4","TCP","1434","34325  >  443 [ACK] Seq=115442 Ack=1235 Win=661 Len=1368 TSval=8210857 TSecr=601456479 [TCP segment of a reassembled PDU]"
"197","2018-08-23 03:03:46.486708","192.168.2.3","216.58.197.4","TLSv1.2","212","Application Data"
"198","2018-08-23 03:03:46.487077","192.168.2.3","216.58.197.4","TCP","1434","34325  >  443 [ACK] Seq=116956 Ack=1235 Win=661 Len=1368 TSval=8210857 TSecr=601456479 [TCP segment of a reassembled PDU]"
"199","2018-08-23 03:03:46.487080","192.168.2.3","216.58.197.4","TLSv1.2","155","Application Data"
"204","2018-08-23 03:03:46.575909","192.168.2.3","216.58.197.4","TCP","1434","34325  >  443 [ACK] Seq=118413 Ack=1235 Win=661 Len=1368 TSval=8210866 TSecr=601456505 [TCP segment of a reassembled PDU]"
"205","2018-08-23 03:03:46.576331","192.168.2.3","216.58.197.4","TCP","1434","34325  >  443 [ACK] Seq=119781 Ack=1235 Win=661 Len=1368 TSval=8210866 TSecr=601456505 [TCP segment of a reassembled PDU]"
"206","2018-08-23 03:03:46.576333","192.168.2.3","216.58.197.4","TLSv1.2","212","Application Data"
"207","2018-08-23 03:03:46.576334","192.168.2.3","216.58.197.4","TCP","1434","34325  >  443 [ACK] Seq=121295 Ack=1235 Win=661 Len=1368 TSval=8210866 TSecr=601456505 [TCP segment of a reassembled PDU]"
"208","2018-08-23 03:03:46.576335","192.168.2.3","216.58.197.4","TLSv1.2","155","Application Data"
"214","2018-08-23 03:03:46.634945","192.168.2.3","216.58.197.4","TCP","66","34325  >  443 [ACK] Seq=122752 Ack=1719 Win=661 Len=0 TSval=8210872 TSecr=601456646"
"215","2018-08-23 03:03:46.668869","192.168.2.3","216.58.197.4","TCP","1434","34325  >  443 [ACK] Seq=122752 Ack=1719 Win=661 Len=1368 TSval=8210875 TSecr=601456646 [TCP segment of a reassembled PDU]"
"216","2018-08-23 03:03:46.669343","192.168.2.3","216.58.197.4","TCP","1434","34325  >  443 [ACK] Seq=124120 Ack=1719 Win=661 Len=1368 TSval=8210875 TSecr=601456646 [TCP segment of a reassembled PDU]"
"217","2018-08-23 03:03:46.669347","192.168.2.3","216.58.197.4","TLSv1.2","212","Application Data"
"218","2018-08-23 03:03:46.669347","192.168.2.3","216.58.197.4","TCP","1434","34325  >  443 [ACK] Seq=125634 Ack=1719 Win=661 Len=1368 TSval=8210875 TSecr=601456646 [TCP segment of a reassembled PDU]"
"219","2018-08-23 03:03:46.669348","192.168.2.3","216.58.197.4","TLSv1.2","155","Application Data"
"224","2018-08-23 03:03:46.725341","192.168.2.3","216.58.197.4","TCP","66","34325  >  443 [ACK] Seq=127091 Ack=2087 Win=661 Len=0 TSval=8210881 TSecr=601456738"
"225","2018-08-23 03:03:46.766925","192.168.2.3","216.58.197.4","TCP","1434","34325  >  443 [ACK] Seq=127091 Ack=2087 Win=661 Len=1368 TSval=8210885 TSecr=601456738 [TCP segment of a reassembled PDU]"
"226","2018-08-23 03:03:46.767400","192.168.2.3","216.58.197.4","TCP","1434","34325  >  443 [ACK] Seq=128459 Ack=2087 Win=661 Len=1368 TSval=8210885 TSecr=601456738 [TCP segment of a reassembled PDU]"
"227","2018-08-23 03:03:46.767403","192.168.2.3","216.58.197.4","TLSv1.2","212","Application Data"
"228","2018-08-23 03:03:46.767404","192.168.2.3","216.58.197.4","TCP","1434","34325  >  443 [ACK] Seq=129973 Ack=2087 Win=661 Len=1368 TSval=8210885 TSecr=601456738 [TCP segment of a reassembled PDU]"
"229","2018-08-23 03:03:46.767589","192.168.2.3","216.58.197.4","TLSv1.2","155","Application Data"
"232","2018-08-23 03:03:46.839115","192.168.2.3","216.58.197.4","TCP","1434","34325  >  443 [ACK] Seq=131430 Ack=2087 Win=661 Len=1368 TSval=8210892 TSecr=601456786 [TCP segment of a reassembled PDU]"
"233","2018-08-23 03:03:46.839462","192.168.2.3","216.58.197.4","TCP","1434","34325  >  443 [ACK] Seq=132798 Ack=2087 Win=661 Len=1368 TSval=8210892 TSecr=601456786 [TCP segment of a reassembled PDU]"
"234","2018-08-23 03:03:46.839465","192.168.2.3","216.58.197.4","TLSv1.2","212","Application Data"
"235","2018-08-23 03:03:46.839466","192.168.2.3","216.58.197.4","TCP","1434","34325  >  443 [ACK] Seq=134312 Ack=2087 Win=661 Len=1368 TSval=8210892 TSecr=601456786 [TCP segment of a reassembled PDU]"
"236","2018-08-23 03:03:46.839593","192.168.2.3","216.58.197.4","TLSv1.2","155","Application Data"
"240","2018-08-23 03:03:46.937958","192.168.2.3","216.58.197.4","TCP","1434","34325  >  443 [ACK] Seq=135769 Ack=2087 Win=661 Len=1368 TSval=8210902 TSecr=601456858 [TCP segment of a reassembled PDU]"
"241","2018-08-23 03:03:46.937962","192.168.2.3","216.58.197.4","TCP","1434","34325  >  443 [ACK] Seq=137137 Ack=2087 Win=661 Len=1368 TSval=8210902 TSecr=601456858 [TCP segment of a reassembled PDU]"
"242","2018-08-23 03:03:46.937963","192.168.2.3","216.58.197.4","TLSv1.2","212","Application Data"
"243","2018-08-23 03:03:46.938027","192.168.2.3","216.58.197.4","TCP","1434","34325  >  443 [ACK] Seq=138651 Ack=2087 Win=661 Len=1368 TSval=8210902 TSecr=601456858 [TCP segment of a reassembled PDU]"
"244","2018-08-23 03:03:46.938029","192.168.2.3","216.58.197.4","TLSv1.2","155","Application Data"
"250","2018-08-23 03:03:46.990766","192.168.2.3","216.58.197.4","TCP","66","34325  >  443 [ACK] Seq=140108 Ack=2300 Win=661 Len=0 TSval=8210908 TSecr=601457003"
"251","2018-08-23 03:03:47.023917","192.168.2.3","216.58.197.4","TCP","1434","34325  >  443 [ACK] Seq=140108 Ack=2300 Win=661 Len=1368 TSval=8210911 TSecr=601457003 [TCP segment of a reassembled PDU]"
"252","2018-08-23 03:03:47.024315","192.168.2.3","216.58.197.4","TCP","1434","34325  >  443 [ACK] Seq=141476 Ack=2300 Win=661 Len=1368 TSval=8210911 TSecr=601457003 [TCP segment of a reassembled PDU]"
"253","2018-08-23 03:03:47.024319","192.168.2.3","216.58.197.4","TLSv1.2","212","Application Data"
"254","2018-08-23 03:03:47.024320","192.168.2.3","216.58.197.4","TCP","1434","34325  >  443 [ACK] Seq=142990 Ack=2300 Win=661 Len=1368 TSval=8210911 TSecr=601457003 [TCP segment of a reassembled PDU]"
"255","2018-08-23 03:03:47.024481","192.168.2.3","216.58.197.4","TLSv1.2","155","Application Data"
"260","2018-08-23 03:03:47.077047","192.168.2.3","216.58.197.4","TCP","66","34325  >  443 [ACK] Seq=144447 Ack=2587 Win=661 Len=0 TSval=8210916 TSecr=601457089"
"261","2018-08-23 03:03:47.123719","192.168.2.3","216.58.197.4","TCP","1434","34325  >  443 [ACK] Seq=144447 Ack=2587 Win=661 Len=1368 TSval=8210920 TSecr=601457089 [TCP segment of a reassembled PDU]"
"262","2018-08-23 03:03:47.123869","192.168.2.3","216.58.197.4","TCP","1434","34325  >  443 [ACK] Seq=145815 Ack=2587 Win=661 Len=1368 TSval=8210920 TSecr=601457089 [TCP segment of a reassembled PDU]"
"263","2018-08-23 03:03:47.123873","192.168.2.3","216.58.197.4","TLSv1.2","212","Application Data"
"264","2018-08-23 03:03:47.124091","192.168.2.3","216.58.197.4","TCP","1434","34325  >  443 [ACK] Seq=147329 Ack=2587 Win=661 Len=1368 TSval=8210920 TSecr=601457089 [TCP segment of a reassembled PDU]"
"265","2018-08-23 03:03:47.124094","192.168.2.3","216.58.197.4","TLSv1.2","155","Application Data"
"271","2018-08-23 03:03:47.210595","192.168.2.3","216.58.197.4","TCP","66","34325  >  443 [ACK] Seq=148786 Ack=2999 Win=661 Len=0 TSval=8210930 TSecr=601457210"
"272","2018-08-23 03:03:47.212496","192.168.2.3","216.58.197.4","TCP","1434","34325  >  443 [ACK] Seq=148786 Ack=2999 Win=661 Len=1368 TSval=8210930 TSecr=601457210 [TCP segment of a reassembled PDU]"
"273","2018-08-23 03:03:47.212810","192.168.2.3","216.58.197.4","TCP","1434","34325  >  443 [ACK] Seq=150154 Ack=2999 Win=661 Len=1368 TSval=8210930 TSecr=601457210 [TCP segment of a reassembled PDU]"
"274","2018-08-23 03:03:47.212812","192.168.2.3","216.58.197.4","TLSv1.2","212","Application Data"
"275","2018-08-23 03:03:47.213311","192.168.2.3","216.58.197.4","TCP","1434","34325  >  443 [ACK] Seq=151668 Ack=2999 Win=661 Len=1368 TSval=8210930 TSecr=601457210 [TCP segment of a reassembled PDU]"
"276","2018-08-23 03:03:47.213314","192.168.2.3","216.58.197.4","TLSv1.2","155","Application Data"
"282","2018-08-23 03:03:47.284875","192.168.2.3","216.58.197.4","TCP","66","34325  >  443 [ACK] Seq=153125 Ack=3519 Win=661 Len=0 TSval=8210937 TSecr=601457293"
"283","2018-08-23 03:03:47.285267","192.168.2.3","216.58.197.4","TCP","1434","34325  >  443 [ACK] Seq=153125 Ack=3519 Win=661 Len=1368 TSval=8210937 TSecr=601457293 [TCP segment of a reassembled PDU]"
"284","2018-08-23 03:03:47.285648","192.168.2.3","216.58.197.4","TCP","1434","34325  >  443 [ACK] Seq=154493 Ack=3519 Win=661 Len=1368 TSval=8210937 TSecr=601457293 [TCP segment of a reassembled PDU]"
"285","2018-08-23 03:03:47.285650","192.168.2.3","216.58.197.4","TLSv1.2","212","Application Data"
"286","2018-08-23 03:03:47.285651","192.168.2.3","216.58.197.4","TCP","1434","34325  >  443 [ACK] Seq=156007 Ack=3519 Win=661 Len=1368 TSval=8210937 TSecr=601457293 [TCP segment of a reassembled PDU]"
"287","2018-08-23 03:03:47.285981","192.168.2.3","216.58.197.4","TLSv1.2","155","Application Data"
"291","2018-08-23 03:03:47.371876","192.168.2.3","216.58.197.4","TCP","1434","34325  >  443 [ACK] Seq=157464 Ack=3519 Win=661 Len=1368 TSval=8210946 TSecr=601457304 [TCP segment of a reassembled PDU]"
"292","2018-08-23 03:03:47.372188","192.168.2.3","216.58.197.4","TCP","1434","34325  >  443 [ACK] Seq=158832 Ack=3519 Win=661 Len=1368 TSval=8210946 TSecr=601457304 [TCP segment of a reassembled PDU]"
"293","2018-08-23 03:03:47.372191","192.168.2.3","216.58.197.4","TLSv1.2","212","Application Data"
"294","2018-08-23 03:03:47.372512","192.168.2.3","216.58.197.4","TCP","1434","34325  >  443 [ACK] Seq=160346 Ack=3519 Win=661 Len=1368 TSval=8210946 TSecr=601457304 [TCP segment of a reassembled PDU]"
"295","2018-08-23 03:03:47.372516","192.168.2.3","216.58.197.4","TLSv1.2","155","Application Data"
"299","2018-08-23 03:03:47.450378","192.168.2.3","216.58.197.4","TCP","1434","34325  >  443 [ACK] Seq=161803 Ack=3519 Win=661 Len=1368 TSval=8210953 TSecr=601457391 [TCP segment of a reassembled PDU]"
"300","2018-08-23 03:03:47.450384","192.168.2.3","216.58.197.4","TCP","1434","34325  >  443 [ACK] Seq=163171 Ack=3519 Win=661 Len=1368 TSval=8210953 TSecr=601457391 [TCP segment of a reassembled PDU]"
"301","2018-08-23 03:03:47.450385","192.168.2.3","216.58.197.4","TLSv1.2","212","Application Data"
"302","2018-08-23 03:03:47.450808","192.168.2.3","216.58.197.4","TCP","1434","34325  >  443 [ACK] Seq=164685 Ack=3519 Win=661 Len=1368 TSval=8210953 TSecr=601457391 [TCP segment of a reassembled PDU]"
"303","2018-08-23 03:03:47.450810","192.168.2.3","216.58.197.4","TLSv1.2","155","Application Data"
"307","2018-08-23 03:03:47.477014","192.168.2.3","216.58.197.4","TCP","66","34325  >  443 [ACK] Seq=166142 Ack=4092 Win=661 Len=0 TSval=8210956 TSecr=601457479"
"310","2018-08-23 03:03:47.498464","192.168.2.3","216.58.197.4","TCP","66","34325  >  443 [ACK] Seq=166142 Ack=4436 Win=661 Len=0 TSval=8210958 TSecr=601457510"
"311","2018-08-23 03:03:47.542078","192.168.2.3","216.58.197.4","TCP","1434","34325  >  443 [ACK] Seq=166142 Ack=4436 Win=661 Len=1368 TSval=8210963 TSecr=601457510 [TCP segment of a reassembled PDU]"
"312","2018-08-23 03:03:47.542411","192.168.2.3","216.58.197.4","TCP","1434","34325  >  443 [ACK] Seq=167510 Ack=4436 Win=661 Len=1368 TSval=8210963 TSecr=601457510 [TCP segment of a reassembled PDU]"
"313","2018-08-23 03:03:47.542414","192.168.2.3","216.58.197.4","TLSv1.2","212","Application Data"
"314","2018-08-23 03:03:47.542870","192.168.2.3","216.58.197.4","TCP","1434","34325  >  443 [ACK] Seq=169024 Ack=4436 Win=661 Len=1368 TSval=8210963 TSecr=601457510 [TCP segment of a reassembled PDU]"
"315","2018-08-23 03:03:47.542873","192.168.2.3","216.58.197.4","TLSv1.2","155","Application Data"
"319","2018-08-23 03:03:47.639645","192.168.2.3","216.58.197.4","TCP","1434","34325  >  443 [ACK] Seq=170481 Ack=4436 Win=661 Len=1368 TSval=8210972 TSecr=601457601 [TCP segment of a reassembled PDU]"
"320","2018-08-23 03:03:47.640071","192.168.2.3","216.58.197.4","TCP","1434","34325  >  443 [ACK] Seq=171849 Ack=4436 Win=661 Len=1368 TSval=8210972 TSecr=601457601 [TCP segment of a reassembled PDU]"
"321","2018-08-23 03:03:47.640074","192.168.2.3","216.58.197.4","TLSv1.2","212","Application Data"
"322","2018-08-23 03:03:47.640074","192.168.2.3","216.58.197.4","TCP","1434","34325  >  443 [ACK] Seq=173363 Ack=4436 Win=661 Len=1368 TSval=8210972 TSecr=601457601 [TCP segment of a reassembled PDU]"
"323","2018-08-23 03:03:47.640190","192.168.2.3","216.58.197.4","TLSv1.2","155","Application Data"
"329","2018-08-23 03:03:47.691856","192.168.2.3","216.58.197.4","TCP","66","34325  >  443 [ACK] Seq=174820 Ack=4735 Win=661 Len=0 TSval=8210978 TSecr=601457700"
"330","2018-08-23 03:03:47.736481","192.168.2.3","216.58.197.4","TCP","1434","34325  >  443 [ACK] Seq=174820 Ack=4735 Win=661 Len=1368 TSval=8210982 TSecr=601457700 [TCP segment of a reassembled PDU]"
"331","2018-08-23 03:03:47.736486","192.168.2.3","216.58.197.4","TCP","1434","34325  >  443 [ACK] Seq=176188 Ack=4735 Win=661 Len=1368 TSval=8210982 TSecr=601457700 [TCP segment of a reassembled PDU]"
"332","2018-08-23 03:03:47.736602","192.168.2.3","216.58.197.4","TLSv1.2","212","Application Data"
"333","2018-08-23 03:03:47.736810","192.168.2.3","216.58.197.4","TCP","1434","34325  >  443 [ACK] Seq=177702 Ack=4735 Win=661 Len=1368 TSval=8210982 TSecr=601457700 [TCP segment of a reassembled PDU]"
"334","2018-08-23 03:03:47.736813","192.168.2.3","216.58.197.4","TLSv1.2","155","Application Data"
"338","2018-08-23 03:03:47.859391","192.168.2.3","216.58.197.4","TCP","1434","34325  >  443 [ACK] Seq=179159 Ack=4735 Win=661 Len=1368 TSval=8210994 TSecr=601457755 [TCP segment of a reassembled PDU]"
"339","2018-08-23 03:03:47.859395","192.168.2.3","216.58.197.4","TCP","1434","34325  >  443 [ACK] Seq=180527 Ack=4735 Win=661 Len=1368 TSval=8210994 TSecr=601457755 [TCP segment of a reassembled PDU]"
"340","2018-08-23 03:03:47.859396","192.168.2.3","216.58.197.4","TLSv1.2","212","Application Data"
"341","2018-08-23 03:03:47.859588","192.168.2.3","216.58.197.4","TCP","1434","34325  >  443 [ACK] Seq=182041 Ack=4735 Win=661 Len=1368 TSval=8210994 TSecr=601457755 [TCP segment of a reassembled PDU]"
"342","2018-08-23 03:03:47.859685","192.168.2.3","216.58.197.4","TLSv1.2","155","Application Data"
"347","2018-08-23 03:03:47.919621","192.168.2.3","216.58.197.4","TCP","66","34325  >  443 [ACK] Seq=183498 Ack=4970 Win=661 Len=0 TSval=8211001 TSecr=601457897"
"348","2018-08-23 03:03:47.961727","192.168.2.3","216.58.197.4","TCP","1434","34325  >  443 [ACK] Seq=183498 Ack=4970 Win=661 Len=1368 TSval=8211004 TSecr=601457897 [TCP segment of a reassembled PDU]"
"349","2018-08-23 03:03:47.961732","192.168.2.3","216.58.197.4","TCP","1434","34325  >  443 [ACK] Seq=184866 Ack=4970 Win=661 Len=1368 TSval=8211004 TSecr=601457897 [TCP segment of a reassembled PDU]"
"350","2018-08-23 03:03:47.961894","192.168.2.3","216.58.197.4","TLSv1.2","212","Application Data"
"351","2018-08-23 03:03:47.961897","192.168.2.3","216.58.197.4","TCP","1434","34325  >  443 [ACK] Seq=186380 Ack=4970 Win=661 Len=1368 TSval=8211004 TSecr=601457897 [TCP segment of a reassembled PDU]"
"352","2018-08-23 03:03:47.962077","192.168.2.3","216.58.197.4","TLSv1.2","155","Application Data"
"355","2018-08-23 03:03:48.053920","192.168.2.3","216.58.197.4","TCP","1434","34325  >  443 [ACK] Seq=187837 Ack=4970 Win=661 Len=1368 TSval=8211014 TSecr=601457980 [TCP segment of a reassembled PDU]"
"356","2018-08-23 03:03:48.054388","192.168.2.3","216.58.197.4","TCP","1434","34325  >  443 [ACK] Seq=189205 Ack=4970 Win=661 Len=1368 TSval=8211014 TSecr=601457980 [TCP segment of a reassembled PDU]"
"357","2018-08-23 03:03:48.054391","192.168.2.3","216.58.197.4","TLSv1.2","212","Application Data"
"358","2018-08-23 03:03:48.054392","192.168.2.3","216.58.197.4","TCP","1434","34325  >  443 [ACK] Seq=190719 Ack=4970 Win=661 Len=1368 TSval=8211014 TSecr=601457980 [TCP segment of a reassembled PDU]"
"359","2018-08-23 03:03:48.054678","192.168.2.3","216.58.197.4","TLSv1.2","155","Application Data"
"365","2018-08-23 03:03:48.106475","192.168.2.3","216.58.197.4","TCP","66","34325  >  443 [ACK] Seq=192176 Ack=5424 Win=661 Len=0 TSval=8211019 TSecr=601458118"
"366","2018-08-23 03:03:48.150236","192.168.2.3","216.58.197.4","TCP","1434","34325  >  443 [ACK] Seq=192176 Ack=5424 Win=661 Len=1368 TSval=8211024 TSecr=601458118 [TCP segment of a reassembled PDU]"
"367","2018-08-23 03:03:48.150562","192.168.2.3","216.58.197.4","TCP","1434","34325  >  443 [ACK] Seq=193544 Ack=5424 Win=661 Len=1368 TSval=8211024 TSecr=601458118 [TCP segment of a reassembled PDU]"
"368","2018-08-23 03:03:48.150566","192.168.2.3","216.58.197.4","TLSv1.2","212","Application Data"
"369","2018-08-23 03:03:48.151118","192.168.2.3","216.58.197.4","TCP","1434","34325  >  443 [ACK] Seq=195058 Ack=5424 Win=661 Len=1368 TSval=8211024 TSecr=601458118 [TCP segment of a reassembled PDU]"
"370","2018-08-23 03:03:48.151121","192.168.2.3","216.58.197.4","TLSv1.2","155","Application Data"
"374","2018-08-23 03:03:48.248539","192.168.2.3","216.58.197.4","TCP","1434","34325  >  443 [ACK] Seq=196515 Ack=5424 Win=661 Len=1368 TSval=8211033 TSecr=601458169 [TCP segment of a reassembled PDU]"
"375","2018-08-23 03:03:48.248544","192.168.2.3","216.58.197.4","TCP","1434","34325  >  443 [ACK] Seq=197883 Ack=5424 Win=661 Len=1368 TSval=8211033 TSecr=601458169 [TCP segment of a reassembled PDU]"
"376","2018-08-23 03:03:48.248545","192.168.2.3","216.58.197.4","TLSv1.2","212","Application Data"
"377","2018-08-23 03:03:48.248945","192.168.2.3","216.58.197.4","TCP","1434","34325  >  443 [ACK] Seq=199397 Ack=5424 Win=661 Len=1368 TSval=8211033 TSecr=601458169 [TCP segment of a reassembled PDU]"
"378","2018-08-23 03:03:48.248948","192.168.2.3","216.58.197.4","TLSv1.2","155","Application Data"
"384","2018-08-23 03:03:48.303147","192.168.2.3","216.58.197.4","TCP","66","34325  >  443 [ACK] Seq=200854 Ack=5706 Win=661 Len=0 TSval=8211038 TSecr=601458308"
"385","2018-08-23 03:03:48.363125","192.168.2.3","216.58.197.4","TCP","1434","34325  >  443 [ACK] Seq=200854 Ack=5706 Win=661 Len=1368 TSval=8211045 TSecr=601458308 [TCP segment of a reassembled PDU]"
"386","2018-08-23 03:03:48.363446","192.168.2.3","216.58.197.4","TCP","1434","34325  >  443 [ACK] Seq=202222 Ack=5706 Win=661 Len=1368 TSval=8211045 TSecr=601458308 [TCP segment of a reassembled PDU]"
"387","2018-08-23 03:03:48.363449","192.168.2.3","216.58.197.4","TLSv1.2","212","Application Data"
"388","2018-08-23 03:03:48.363450","192.168.2.3","216.58.197.4","TCP","1434","34325  >  443 [ACK] Seq=203736 Ack=5706 Win=661 Len=1368 TSval=8211045 TSecr=601458308 [TCP segment of a reassembled PDU]"
"389","2018-08-23 03:03:48.363807","192.168.2.3","216.58.197.4","TLSv1.2","155","Application Data"
"394","2018-08-23 03:03:48.411029","192.168.2.3","216.58.197.4","TCP","66","34325  >  443 [ACK] Seq=205193 Ack=5819 Win=661 Len=0 TSval=8211050 TSecr=601458424"
"396","2018-08-23 03:03:48.412992","192.168.2.3","216.58.197.4","TCP","66","34325  >  443 [ACK] Seq=205193 Ack=5886 Win=661 Len=0 TSval=8211050 TSecr=601458425"
"397","2018-08-23 03:03:48.441953","192.168.2.3","216.58.197.4","TCP","1434","34325  >  443 [ACK] Seq=205193 Ack=5886 Win=661 Len=1368 TSval=8211053 TSecr=601458425 [TCP segment of a reassembled PDU]"
"398","2018-08-23 03:03:48.442280","192.168.2.3","216.58.197.4","TCP","1434","34325  >  443 [ACK] Seq=206561 Ack=5886 Win=661 Len=1368 TSval=8211053 TSecr=601458425 [TCP segment of a reassembled PDU]"
"399","2018-08-23 03:03:48.442282","192.168.2.3","216.58.197.4","TLSv1.2","212","Application Data"
"400","2018-08-23 03:03:48.442735","192.168.2.3","216.58.197.4","TCP","1434","34325  >  443 [ACK] Seq=208075 Ack=5886 Win=661 Len=1368 TSval=8211053 TSecr=601458425 [TCP segment of a reassembled PDU]"
"401","2018-08-23 03:03:48.442737","192.168.2.3","216.58.197.4","TLSv1.2","155","Application Data"
"402","2018-08-23 03:03:48.442737","192.168.2.3","216.58.197.4","TLSv1.2","300","Application Data"
"403","2018-08-23 03:03:48.442738","192.168.2.3","216.58.197.4","TLSv1.2","102","Application Data"
"409","2018-08-23 03:03:48.479643","192.168.2.3","216.58.197.4","TCP","66","34325  >  443 [ACK] Seq=209802 Ack=6125 Win=661 Len=0 TSval=8211056 TSecr=601458479"
"412","2018-08-23 03:03:48.501772","192.168.2.3","216.58.197.4","TCP","66","34325  >  443 [ACK] Seq=209802 Ack=7304 Win=661 Len=0 TSval=8211059 TSecr=601458511"
"414","2018-08-23 03:03:49.079603","192.168.2.3","216.58.197.4","TCP","66","34325  >  443 [ACK] Seq=209802 Ack=7555 Win=661 Len=0 TSval=8211117 TSecr=601459060"
"425","2018-08-23 03:03:49.090687","192.168.2.3","216.58.197.4","TCP","66","34325  >  443 [ACK] Seq=209802 Ack=8973 Win=650 Len=0 TSval=8211117 TSecr=601459098"
"426","2018-08-23 03:03:49.090690","192.168.2.3","216.58.197.4","TCP","66","34325  >  443 [ACK] Seq=209802 Ack=9308 Win=650 Len=0 TSval=8211117 TSecr=601459098"
"427","2018-08-23 03:03:49.090691","192.168.2.3","216.58.197.4","TCP","66","34325  >  443 [ACK] Seq=209802 Ack=10726 Win=650 Len=0 TSval=8211117 TSecr=601459098"
"428","2018-08-23 03:03:49.090692","192.168.2.3","216.58.197.4","TCP","66","34325  >  443 [ACK] Seq=209802 Ack=11163 Win=661 Len=0 TSval=8211118 TSecr=601459098"
