"No.","Time","Source","Destination","Protocol","Length","Info"
"2","2018-08-23 02:52:15.835249","192.168.2.3","192.168.2.1","TCP","183","8009  >  53029 [PSH, ACK] Seq=1 Ack=118 Win=277 Len=117 TSval=8141793 TSecr=2318669091 [TCP segment of a reassembled PDU]"
"4","2018-08-23 02:52:16.122665","192.168.2.3","216.58.197.4","TLSv1.2","156","Application Data"
"5","2018-08-23 02:52:16.122669","192.168.2.3","216.58.197.4","TLSv1.2","104","Application Data"
"6","2018-08-23 02:52:16.122670","192.168.2.3","216.58.197.4","TLSv1.2","159","Application Data"
"11","2018-08-23 02:52:16.143109","192.168.2.3","216.58.197.4","TCP","1434","34325  >  443 [ACK] Seq=222 Ack=39 Win=661 Len=1368 TSval=8141823 TSecr=600766141 [TCP segment of a reassembled PDU]"
"12","2018-08-23 02:52:16.143569","192.168.2.3","216.58.197.4","TCP","1434","34325  >  443 [ACK] Seq=1590 Ack=39 Win=661 Len=1368 TSval=8141823 TSecr=600766141 [TCP segment of a reassembled PDU]"
"13","2018-08-23 02:52:16.143571","192.168.2.3","216.58.197.4","TLSv1.2","212","Application Data"
"14","2018-08-23 02:52:16.143572","192.168.2.3","216.58.197.4","TCP","1434","34325  >  443 [ACK] Seq=3104 Ack=39 Win=661 Len=1368 TSval=8141823 TSecr=600766141 [TCP segment of a reassembled PDU]"
"15","2018-08-23 02:52:16.143573","192.168.2.3","216.58.197.4","TLSv1.2","335","Application Data"
"16","2018-08-23 02:52:16.144060","192.168.2.3","216.58.197.4","TCP","1434","34325  >  443 [ACK] Seq=4741 Ack=39 Win=661 Len=1368 TSval=8141823 TSecr=600766141 [TCP segment of a reassembled PDU]"
"17","2018-08-23 02:52:16.144062","192.168.2.3","216.58.197.4","TCP","1434","34325  >  443 [ACK] Seq=6109 Ack=39 Win=661 Len=1368 TSval=8141823 TSecr=600766141 [TCP segment of a reassembled PDU]"
"18","2018-08-23 02:52:16.144064","192.168.2.3","216.58.197.4","TLSv1.2","212","Application Data"
"19","2018-08-23 02:52:16.144461","192.168.2.3","216.58.197.4","TCP","1434","34325  >  443 [ACK] Seq=7623 Ack=39 Win=661 Len=1368 TSval=8141823 TSecr=600766141 [TCP segment of a reassembled PDU]"
"20","2018-08-23 02:52:16.144463","192.168.2.3","216.58.197.4","TLSv1.2","156","Application Data"
"25","2018-08-23 02:52:16.149843","192.168.2.3","216.58.197.4","TCP","1434","34325  >  443 [ACK] Seq=9081 Ack=39 Win=661 Len=1368 TSval=8141824 TSecr=600766161 [TCP segment of a reassembled PDU]"
"26","2018-08-23 02:52:16.150271","192.168.2.3","216.58.197.4","TCP","1434","34325  >  443 [ACK] Seq=10449 Ack=39 Win=661 Len=1368 TSval=8141824 TSecr=600766161 [TCP segment of a reassembled PDU]"
"27","2018-08-23 02:52:16.150557","192.168.2.3","216.58.197.4","TLSv1.2","1434","Application Data [TCP segment of a reassembled PDU]"
"28","2018-08-23 02:52:16.150808","192.168.2.3","216.58.197.4","TLSv1.2","1434","Application Data [TCP segment of a reassembled PDU]"
"29","2018-08-23 02:52:16.150810","192.168.2.3","216.58.197.4","TCP","1434","34325  >  443 [ACK] Seq=14553 Ack=39 Win=661 Len=1368 TSval=8141824 TSecr=600766161 [TCP segment of a reassembled PDU]"
"30","2018-08-23 02:52:16.150959","192.168.2.3","216.58.197.4","TLSv1.2","1434","Application Data [TCP segment of a reassembled PDU]"
"31","2018-08-23 02:52:16.151150","192.168.2.3","216.58.197.4","TLSv1.2","1434","Application Data [TCP segment of a reassembled PDU]"
"32","2018-08-23 02:52:16.151672","192.168.2.3","216.58.197.4","TCP","1434","34325  >  443 [ACK] Seq=18657 Ack=39 Win=661 Len=1368 TSval=8141824 TSecr=600766161 [TCP segment of a reassembled PDU]"
"33","2018-08-23 02:52:16.151675","192.168.2.3","216.58.197.4","TLSv1.2","1434","Application Data [TCP segment of a reassembled PDU]"
"34","2018-08-23 02:52:16.151971","192.168.2.3","216.58.197.4","TLSv1.2","1434","Application Data [TCP segment of a reassembled PDU]"
"35","2018-08-23 02:52:16.152031","192.168.2.3","216.58.197.4","TCP","1434","34325  >  443 [ACK] Seq=22761 Ack=39 Win=661 Len=1368 TSval=8141824 TSecr=600766162 [TCP segment of a reassembled PDU]"
"36","2018-08-23 02:52:16.152306","192.168.2.3","216.58.197.4","TLSv1.2","1434","Application Data [TCP segment of a reassembled PDU]"
"37","2018-08-23 02:52:16.152421","192.168.2.3","216.58.197.4","TLSv1.2","1434","Application Data [TCP segment of a reassembled PDU]"
"45","2018-08-23 02:52:16.157948","192.168.2.3","216.58.197.4","TCP","1434","34325  >  443 [ACK] Seq=26865 Ack=39 Win=661 Len=1368 TSval=8141825 TSecr=600766167 [TCP segment of a reassembled PDU]"
"46","2018-08-23 02:52:16.158341","192.168.2.3","216.58.197.4","TLSv1.2","1434","Application Data [TCP segment of a reassembled PDU]"
"47","2018-08-23 02:52:16.158582","192.168.2.3","216.58.197.4","TLSv1.2","1434","Application Data [TCP segment of a reassembled PDU]"
"48","2018-08-23 02:52:16.159419","192.168.2.3","216.58.197.4","TCP","1434","34325  >  443 [ACK] Seq=30969 Ack=39 Win=661 Len=1368 TSval=8141825 TSecr=600766168 [TCP segment of a reassembled PDU]"
"49","2018-08-23 02:52:16.159752","192.168.2.3","216.58.197.4","TLSv1.2","1434","Application Data [TCP segment of a reassembled PDU]"
"50","2018-08-23 02:52:16.159754","192.168.2.3","216.58.197.4","TCP","1434","34325  >  443 [ACK] Seq=33705 Ack=39 Win=661 Len=1368 TSval=8141825 TSecr=600766168 [TCP segment of a reassembled PDU]"
"51","2018-08-23 02:52:16.160592","192.168.2.3","216.58.197.4","TLSv1.2","1434","Application Data [TCP segment of a reassembled PDU]"
"52","2018-08-23 02:52:16.160898","192.168.2.3","216.58.197.4","TCP","1434","34325  >  443 [ACK] Seq=36441 Ack=39 Win=661 Len=1368 TSval=8141825 TSecr=600766168 [TCP segment of a reassembled PDU]"
"53","2018-08-23 02:52:16.160902","192.168.2.3","216.58.197.4","TLSv1.2","1434","Application Data [TCP segment of a reassembled PDU]"
"54","2018-08-23 02:52:16.161081","192.168.2.3","216.58.197.4","TLSv1.2","1434","Application Data [TCP segment of a reassembled PDU]"
"55","2018-08-23 02:52:16.161250","192.168.2.3","216.58.197.4","TCP","1434","34325  >  443 [ACK] Seq=40545 Ack=39 Win=661 Len=1368 TSval=8141825 TSecr=600766169 [TCP segment of a reassembled PDU]"
"56","2018-08-23 02:52:16.161486","192.168.2.3","216.58.197.4","TLSv1.2","1434","Application Data [TCP segment of a reassembled PDU]"
"57","2018-08-23 02:52:16.161540","192.168.2.3","216.58.197.4","TLSv1.2","1434","Application Data [TCP segment of a reassembled PDU]"
"58","2018-08-23 02:52:16.161750","192.168.2.3","216.58.197.4","TCP","1434","34325  >  443 [ACK] Seq=44649 Ack=39 Win=661 Len=1368 TSval=8141825 TSecr=600766169 [TCP segment of a reassembled PDU]"
"59","2018-08-23 02:52:16.162307","192.168.2.3","216.58.197.4","TLSv1.2","1434","Application Data [TCP segment of a reassembled PDU]"
"60","2018-08-23 02:52:16.162310","192.168.2.3","216.58.197.4","TLSv1.2","1434","Application Data [TCP segment of a reassembled PDU]"
"61","2018-08-23 02:52:16.162496","192.168.2.3","216.58.197.4","TCP","1434","34325  >  443 [ACK] Seq=48753 Ack=39 Win=661 Len=1368 TSval=8141825 TSecr=600766169 [TCP segment of a reassembled PDU]"
"62","2018-08-23 02:52:16.162636","192.168.2.3","216.58.197.4","TLSv1.2","1434","Application Data [TCP segment of a reassembled PDU]"
"64","2018-08-23 02:52:16.162792","192.168.2.3","216.58.197.4","TLSv1.2","1434","Application Data [TCP segment of a reassembled PDU]"
"65","2018-08-23 02:52:16.162991","192.168.2.3","216.58.197.4","TCP","1434","34325  >  443 [ACK] Seq=52857 Ack=39 Win=661 Len=1368 TSval=8141825 TSecr=600766170 [TCP segment of a reassembled PDU]"
"74","2018-08-23 02:52:16.166835","192.168.2.3","216.58.197.4","TLSv1.2","1434","Application Data [TCP segment of a reassembled PDU]"
"75","2018-08-23 02:52:16.166839","192.168.2.3","216.58.197.4","TLSv1.2","1434","Application Data [TCP segment of a reassembled PDU]"
"76","2018-08-23 02:52:16.166981","192.168.2.3","216.58.197.4","TCP","1434","34325  >  443 [ACK] Seq=56961 Ack=39 Win=661 Len=1368 TSval=8141826 TSecr=600766176 [TCP segment of a reassembled PDU]"
"77","2018-08-23 02:52:16.167137","192.168.2.3","216.58.197.4","TCP","1434","34325  >  443 [ACK] Seq=58329 Ack=39 Win=661 Len=1368 TSval=8141826 TSecr=600766177 [TCP segment of a reassembled PDU]"
"79","2018-08-23 02:52:16.167474","192.168.2.3","216.58.197.4","TLSv1.2","1434","Application Data [TCP segment of a reassembled PDU]"
"80","2018-08-23 02:52:16.167477","192.168.2.3","216.58.197.4","TLSv1.2","1434","Application Data [TCP segment of a reassembled PDU]"
"81","2018-08-23 02:52:16.167721","192.168.2.3","216.58.197.4","TLSv1.2","1434","Application Data [TCP segment of a reassembled PDU]"
"82","2018-08-23 02:52:16.168066","192.168.2.3","216.58.197.4","TCP","1434","34325  >  443 [ACK] Seq=63801 Ack=39 Win=661 Len=1368 TSval=8141826 TSecr=600766177 [TCP segment of a reassembled PDU]"
"83","2018-08-23 02:52:16.168559","192.168.2.3","216.58.197.4","TLSv1.2","1434","Application Data [TCP segment of a reassembled PDU]"
"84","2018-08-23 02:52:16.168779","192.168.2.3","216.58.197.4","TLSv1.2","1434","Application Data [TCP segment of a reassembled PDU]"
"85","2018-08-23 02:52:16.168782","192.168.2.3","216.58.197.4","TCP","1434","34325  >  443 [ACK] Seq=67905 Ack=39 Win=661 Len=1368 TSval=8141826 TSecr=600766178 [TCP segment of a reassembled PDU]"
"86","2018-08-23 02:52:16.169039","192.168.2.3","216.58.197.4","TLSv1.2","1434","Application Data [TCP segment of a reassembled PDU]"
"87","2018-08-23 02:52:16.169254","192.168.2.3","216.58.197.4","TCP","1434","34325  >  443 [ACK] Seq=70641 Ack=39 Win=661 Len=1368 TSval=8141826 TSecr=600766178 [TCP segment of a reassembled PDU]"
"88","2018-08-23 02:52:16.169256","192.168.2.3","216.58.197.4","TLSv1.2","71","Application Data"
"96","2018-08-23 02:52:16.229406","192.168.2.3","216.58.197.4","TCP","1434","34325  >  443 [ACK] Seq=72014 Ack=39 Win=661 Len=1368 TSval=8141832 TSecr=600766187 [TCP segment of a reassembled PDU]"
"97","2018-08-23 02:52:16.229900","192.168.2.3","216.58.197.4","TCP","1434","34325  >  443 [ACK] Seq=73382 Ack=39 Win=661 Len=1368 TSval=8141832 TSecr=600766187 [TCP segment of a reassembled PDU]"
"98","2018-08-23 02:52:16.229903","192.168.2.3","216.58.197.4","TLSv1.2","212","Application Data"
"99","2018-08-23 02:52:16.230194","192.168.2.3","216.58.197.4","TCP","1434","34325  >  443 [ACK] Seq=74896 Ack=39 Win=661 Len=1368 TSval=8141832 TSecr=600766187 [TCP segment of a reassembled PDU]"
"100","2018-08-23 02:52:16.230196","192.168.2.3","216.58.197.4","TLSv1.2","155","Application Data"
"104","2018-08-23 02:52:16.325588","192.168.2.3","216.58.197.4","TCP","1434","34325  >  443 [ACK] Seq=76353 Ack=39 Win=661 Len=1368 TSval=8141842 TSecr=600766288 [TCP segment of a reassembled PDU]"
"105","2018-08-23 02:52:16.326000","192.168.2.3","216.58.197.4","TCP","1434","34325  >  443 [ACK] Seq=77721 Ack=39 Win=661 Len=1368 TSval=8141842 TSecr=600766288 [TCP segment of a reassembled PDU]"
"106","2018-08-23 02:52:16.326002","192.168.2.3","216.58.197.4","TLSv1.2","212","Application Data"
"107","2018-08-23 02:52:16.326003","192.168.2.3","216.58.197.4","TCP","1434","34325  >  443 [ACK] Seq=79235 Ack=39 Win=661 Len=1368 TSval=8141842 TSecr=600766288 [TCP segment of a reassembled PDU]"
"108","2018-08-23 02:52:16.326163","192.168.2.3","216.58.197.4","TLSv1.2","155","Application Data"
"115","2018-08-23 02:52:16.427362","192.168.2.3","216.58.197.4","TCP","1434","34325  >  443 [ACK] Seq=80692 Ack=39 Win=661 Len=1368 TSval=8141851 TSecr=600766343 [TCP segment of a reassembled PDU]"
"116","2018-08-23 02:52:16.427365","192.168.2.3","216.58.197.4","TCP","1434","34325  >  443 [ACK] Seq=82060 Ack=39 Win=661 Len=1368 TSval=8141851 TSecr=600766343 [TCP segment of a reassembled PDU]"
"117","2018-08-23 02:52:16.427366","192.168.2.3","216.58.197.4","TLSv1.2","212","Application Data"
"118","2018-08-23 02:52:16.427663","192.168.2.3","216.58.197.4","TCP","1434","34325  >  443 [ACK] Seq=83574 Ack=39 Win=661 Len=1368 TSval=8141851 TSecr=600766343 [TCP segment of a reassembled PDU]"
"119","2018-08-23 02:52:16.427666","192.168.2.3","216.58.197.4","TLSv1.2","155","Application Data"
"120","2018-08-23 02:52:16.427667","192.168.2.3","216.58.197.4","TCP","66","34325  >  443 [ACK] Seq=85031 Ack=461 Win=661 Len=0 TSval=8141852 TSecr=600766432"
"124","2018-08-23 02:52:16.518184","192.168.2.3","216.58.197.4","TCP","1434","34325  >  443 [ACK] Seq=85031 Ack=461 Win=661 Len=1368 TSval=8141861 TSecr=600766445 [TCP segment of a reassembled PDU]"
"125","2018-08-23 02:52:16.518483","192.168.2.3","216.58.197.4","TCP","1434","34325  >  443 [ACK] Seq=86399 Ack=461 Win=661 Len=1368 TSval=8141861 TSecr=600766445 [TCP segment of a reassembled PDU]"
"126","2018-08-23 02:52:16.518488","192.168.2.3","216.58.197.4","TLSv1.2","212","Application Data"
"127","2018-08-23 02:52:16.518784","192.168.2.3","216.58.197.4","TCP","1434","34325  >  443 [ACK] Seq=87913 Ack=461 Win=661 Len=1368 TSval=8141861 TSecr=600766445 [TCP segment of a reassembled PDU]"
"128","2018-08-23 02:52:16.518787","192.168.2.3","216.58.197.4","TLSv1.2","155","Application Data"
"133","2018-08-23 02:52:16.572412","192.168.2.3","216.58.197.4","TCP","66","34325  >  443 [ACK] Seq=89370 Ack=735 Win=661 Len=0 TSval=8141867 TSecr=600766553"
"134","2018-08-23 02:52:16.613730","192.168.2.3","216.58.197.4","TCP","1434","34325  >  443 [ACK] Seq=89370 Ack=735 Win=661 Len=1368 TSval=8141871 TSecr=600766553 [TCP segment of a reassembled PDU]"
"135","2018-08-23 02:52:16.614204","192.168.2.3","216.58.197.4","TCP","1434","34325  >  443 [ACK] Seq=90738 Ack=735 Win=661 Len=1368 TSval=8141871 TSecr=600766553 [TCP segment of a reassembled PDU]"
"136","2018-08-23 02:52:16.614207","192.168.2.3","216.58.197.4","TLSv1.2","212","Application Data"
"137","2018-08-23 02:52:16.614625","192.168.2.3","216.58.197.4","TCP","1434","34325  >  443 [ACK] Seq=92252 Ack=735 Win=661 Len=1368 TSval=8141871 TSecr=600766553 [TCP segment of a reassembled PDU]"
"138","2018-08-23 02:52:16.614628","192.168.2.3","216.58.197.4","TLSv1.2","155","Application Data"
"143","2018-08-23 02:52:16.697094","192.168.2.3","216.58.197.4","TCP","66","34325  >  443 [ACK] Seq=93709 Ack=908 Win=661 Len=0 TSval=8141879 TSecr=600766709"
"144","2018-08-23 02:52:16.707783","192.168.2.3","216.58.197.4","TCP","1434","34325  >  443 [ACK] Seq=93709 Ack=908 Win=661 Len=1368 TSval=8141880 TSecr=600766709 [TCP segment of a reassembled PDU]"
"145","2018-08-23 02:52:16.708175","192.168.2.3","216.58.197.4","TCP","1434","34325  >  443 [ACK] Seq=95077 Ack=908 Win=661 Len=1368 TSval=8141880 TSecr=600766709 [TCP segment of a reassembled PDU]"
"146","2018-08-23 02:52:16.708178","192.168.2.3","216.58.197.4","TLSv1.2","212","Application Data"
"147","2018-08-23 02:52:16.708439","192.168.2.3","216.58.197.4","TCP","1434","34325  >  443 [ACK] Seq=96591 Ack=908 Win=661 Len=1368 TSval=8141880 TSecr=600766709 [TCP segment of a reassembled PDU]"
"148","2018-08-23 02:52:16.708443","192.168.2.3","216.58.197.4","TLSv1.2","155","Application Data"
"152","2018-08-23 02:52:16.806038","192.168.2.3","216.58.197.4","TCP","1434","34325  >  443 [ACK] Seq=98048 Ack=908 Win=661 Len=1368 TSval=8141890 TSecr=600766726 [TCP segment of a reassembled PDU]"
"153","2018-08-23 02:52:16.806251","192.168.2.3","216.58.197.4","TCP","1434","34325  >  443 [ACK] Seq=99416 Ack=908 Win=661 Len=1368 TSval=8141890 TSecr=600766726 [TCP segment of a reassembled PDU]"
"154","2018-08-23 02:52:16.806253","192.168.2.3","216.58.197.4","TLSv1.2","212","Application Data"
"155","2018-08-23 02:52:16.806542","192.168.2.3","216.58.197.4","TCP","1434","34325  >  443 [ACK] Seq=100930 Ack=908 Win=661 Len=1368 TSval=8141890 TSecr=600766726 [TCP segment of a reassembled PDU]"
"156","2018-08-23 02:52:16.806544","192.168.2.3","216.58.197.4","TLSv1.2","155","Application Data"
"160","2018-08-23 02:52:16.902049","192.168.2.3","216.58.197.4","TCP","1434","34325  >  443 [ACK] Seq=102387 Ack=908 Win=661 Len=1368 TSval=8141899 TSecr=600766824 [TCP segment of a reassembled PDU]"
"161","2018-08-23 02:52:16.902199","192.168.2.3","216.58.197.4","TCP","1434","34325  >  443 [ACK] Seq=103755 Ack=908 Win=661 Len=1368 TSval=8141899 TSecr=600766824 [TCP segment of a reassembled PDU]"
"162","2018-08-23 02:52:16.902202","192.168.2.3","216.58.197.4","TLSv1.2","212","Application Data"
"163","2018-08-23 02:52:16.902484","192.168.2.3","216.58.197.4","TCP","1434","34325  >  443 [ACK] Seq=105269 Ack=908 Win=661 Len=1368 TSval=8141899 TSecr=600766824 [TCP segment of a reassembled PDU]"
"164","2018-08-23 02:52:16.902487","192.168.2.3","216.58.197.4","TLSv1.2","155","Application Data"
"168","2018-08-23 02:52:16.976063","192.168.2.3","216.58.197.4","TCP","1434","34325  >  443 [ACK] Seq=106726 Ack=908 Win=661 Len=1368 TSval=8141907 TSecr=600766920 [TCP segment of a reassembled PDU]"
"169","2018-08-23 02:52:16.976544","192.168.2.3","216.58.197.4","TCP","1434","34325  >  443 [ACK] Seq=108094 Ack=908 Win=661 Len=1368 TSval=8141907 TSecr=600766920 [TCP segment of a reassembled PDU]"
"170","2018-08-23 02:52:16.976547","192.168.2.3","216.58.197.4","TLSv1.2","212","Application Data"
"171","2018-08-23 02:52:16.976935","192.168.2.3","216.58.197.4","TCP","1434","34325  >  443 [ACK] Seq=109608 Ack=908 Win=661 Len=1368 TSval=8141907 TSecr=600766920 [TCP segment of a reassembled PDU]"
"172","2018-08-23 02:52:16.976937","192.168.2.3","216.58.197.4","TLSv1.2","155","Application Data"
"176","2018-08-23 02:52:17.062094","192.168.2.3","216.58.197.4","TCP","1434","34325  >  443 [ACK] Seq=111065 Ack=908 Win=661 Len=1368 TSval=8141915 TSecr=600766995 [TCP segment of a reassembled PDU]"
"177","2018-08-23 02:52:17.062343","192.168.2.3","216.58.197.4","TCP","1434","34325  >  443 [ACK] Seq=112433 Ack=908 Win=661 Len=1368 TSval=8141915 TSecr=600766995 [TCP segment of a reassembled PDU]"
"178","2018-08-23 02:52:17.062346","192.168.2.3","216.58.197.4","TLSv1.2","212","Application Data"
"179","2018-08-23 02:52:17.062347","192.168.2.3","216.58.197.4","TCP","1434","34325  >  443 [ACK] Seq=113947 Ack=908 Win=661 Len=1368 TSval=8141915 TSecr=600766995 [TCP segment of a reassembled PDU]"
"180","2018-08-23 02:52:17.062511","192.168.2.3","216.58.197.4","TLSv1.2","155","Application Data"
"184","2018-08-23 02:52:17.156602","192.168.2.3","216.58.197.4","TCP","1434","34325  >  443 [ACK] Seq=115404 Ack=908 Win=661 Len=1368 TSval=8141925 TSecr=600767080 [TCP segment of a reassembled PDU]"
"185","2018-08-23 02:52:17.157018","192.168.2.3","216.58.197.4","TCP","1434","34325  >  443 [ACK] Seq=116772 Ack=908 Win=661 Len=1368 TSval=8141925 TSecr=600767080 [TCP segment of a reassembled PDU]"
"186","2018-08-23 02:52:17.157021","192.168.2.3","216.58.197.4","TLSv1.2","212","Application Data"
"187","2018-08-23 02:52:17.157022","192.168.2.3","216.58.197.4","TCP","1434","34325  >  443 [ACK] Seq=118286 Ack=908 Win=661 Len=1368 TSval=8141925 TSecr=600767080 [TCP segment of a reassembled PDU]"
"188","2018-08-23 02:52:17.157131","192.168.2.3","216.58.197.4","TLSv1.2","155","Application Data"
"192","2018-08-23 02:52:17.230967","192.168.2.3","216.58.197.4","TCP","1434","34325  >  443 [ACK] Seq=119743 Ack=908 Win=661 Len=1368 TSval=8141932 TSecr=600767175 [TCP segment of a reassembled PDU]"
"193","2018-08-23 02:52:17.231390","192.168.2.3","216.58.197.4","TCP","1434","34325  >  443 [ACK] Seq=121111 Ack=908 Win=661 Len=1368 TSval=8141932 TSecr=600767175 [TCP segment of a reassembled PDU]"
"194","2018-08-23 02:52:17.231392","192.168.2.3","216.58.197.4","TLSv1.2","212","Application Data"
"195","2018-08-23 02:52:17.231807","192.168.2.3","216.58.197.4","TCP","1434","34325  >  443 [ACK] Seq=122625 Ack=908 Win=661 Len=1368 TSval=8141932 TSecr=600767175 [TCP segment of a reassembled PDU]"
"196","2018-08-23 02:52:17.231810","192.168.2.3","216.58.197.4","TLSv1.2","155","Application Data"
"202","2018-08-23 02:52:17.290190","192.168.2.3","216.58.197.4","TCP","66","34325  >  443 [ACK] Seq=124082 Ack=1370 Win=661 Len=0 TSval=8141938 TSecr=600767302"
"203","2018-08-23 02:52:17.327228","192.168.2.3","216.58.197.4","TCP","1434","34325  >  443 [ACK] Seq=124082 Ack=1370 Win=661 Len=1368 TSval=8141942 TSecr=600767302 [TCP segment of a reassembled PDU]"
"204","2018-08-23 02:52:17.327825","192.168.2.3","216.58.197.4","TCP","1434","34325  >  443 [ACK] Seq=125450 Ack=1370 Win=661 Len=1368 TSval=8141942 TSecr=600767302 [TCP segment of a reassembled PDU]"
"205","2018-08-23 02:52:17.327827","192.168.2.3","216.58.197.4","TLSv1.2","212","Application Data"
"206","2018-08-23 02:52:17.327828","192.168.2.3","216.58.197.4","TCP","1434","34325  >  443 [ACK] Seq=126964 Ack=1370 Win=661 Len=1368 TSval=8141942 TSecr=600767302 [TCP segment of a reassembled PDU]"
"207","2018-08-23 02:52:17.327991","192.168.2.3","216.58.197.4","TLSv1.2","155","Application Data"
"211","2018-08-23 02:52:17.413756","192.168.2.3","216.58.197.4","TCP","1434","34325  >  443 [ACK] Seq=128421 Ack=1458 Win=661 Len=1368 TSval=8141951 TSecr=600767408 [TCP segment of a reassembled PDU]"
"212","2018-08-23 02:52:17.414153","192.168.2.3","216.58.197.4","TCP","1434","34325  >  443 [ACK] Seq=129789 Ack=1458 Win=661 Len=1368 TSval=8141951 TSecr=600767408 [TCP segment of a reassembled PDU]"
"213","2018-08-23 02:52:17.414155","192.168.2.3","216.58.197.4","TLSv1.2","212","Application Data"
"214","2018-08-23 02:52:17.414384","192.168.2.3","216.58.197.4","TCP","1434","34325  >  443 [ACK] Seq=131303 Ack=1458 Win=661 Len=1368 TSval=8141951 TSecr=600767408 [TCP segment of a reassembled PDU]"
"215","2018-08-23 02:52:17.414386","192.168.2.3","216.58.197.4","TLSv1.2","155","Application Data"
"220","2018-08-23 02:52:17.462621","192.168.2.3","216.58.197.4","TCP","66","34325  >  443 [ACK] Seq=132760 Ack=1578 Win=661 Len=0 TSval=8141956 TSecr=600767436"
"223","2018-08-23 02:52:17.467303","192.168.2.3","216.58.197.4","TCP","66","34325  >  443 [ACK] Seq=132760 Ack=1664 Win=661 Len=0 TSval=8141956 TSecr=600767477"
"224","2018-08-23 02:52:17.469569","192.168.2.3","216.58.197.4","TCP","66","34325  >  443 [ACK] Seq=132760 Ack=1847 Win=661 Len=0 TSval=8141956 TSecr=600767478"
"225","2018-08-23 02:52:17.509738","192.168.2.3","216.58.197.4","TCP","1434","34325  >  443 [ACK] Seq=132760 Ack=1847 Win=661 Len=1368 TSval=8141960 TSecr=600767478 [TCP segment of a reassembled PDU]"
"226","2018-08-23 02:52:17.510121","192.168.2.3","216.58.197.4","TCP","1434","34325  >  443 [ACK] Seq=134128 Ack=1847 Win=661 Len=1368 TSval=8141960 TSecr=600767478 [TCP segment of a reassembled PDU]"
"227","2018-08-23 02:52:17.510124","192.168.2.3","216.58.197.4","TLSv1.2","212","Application Data"
"228","2018-08-23 02:52:17.510292","192.168.2.3","216.58.197.4","TCP","1434","34325  >  443 [ACK] Seq=135642 Ack=1847 Win=661 Len=1368 TSval=8141960 TSecr=600767478 [TCP segment of a reassembled PDU]"
"229","2018-08-23 02:52:17.510295","192.168.2.3","216.58.197.4","TLSv1.2","155","Application Data"
"233","2018-08-23 02:52:17.585052","192.168.2.3","216.58.197.4","TCP","1434","34325  >  443 [ACK] Seq=137099 Ack=1847 Win=661 Len=1368 TSval=8141968 TSecr=600767568 [TCP segment of a reassembled PDU]"
"234","2018-08-23 02:52:17.585056","192.168.2.3","216.58.197.4","TCP","1434","34325  >  443 [ACK] Seq=138467 Ack=1847 Win=661 Len=1368 TSval=8141968 TSecr=600767568 [TCP segment of a reassembled PDU]"
"235","2018-08-23 02:52:17.585349","192.168.2.3","216.58.197.4","TLSv1.2","212","Application Data"
"236","2018-08-23 02:52:17.585351","192.168.2.3","216.58.197.4","TCP","1434","34325  >  443 [ACK] Seq=139981 Ack=1847 Win=661 Len=1368 TSval=8141968 TSecr=600767568 [TCP segment of a reassembled PDU]"
"237","2018-08-23 02:52:17.585412","192.168.2.3","216.58.197.4","TLSv1.2","155","Application Data"
"242","2018-08-23 02:52:17.593645","192.168.2.3","216.58.197.4","TCP","66","34325  >  443 [ACK] Seq=141438 Ack=1895 Win=661 Len=0 TSval=8141969 TSecr=600767605"
"243","2018-08-23 02:52:17.668293","192.168.2.3","216.58.197.4","TCP","1434","34325  >  443 [ACK] Seq=141438 Ack=1895 Win=661 Len=1368 TSval=8141976 TSecr=600767605 [TCP segment of a reassembled PDU]"
"244","2018-08-23 02:52:17.668567","192.168.2.3","216.58.197.4","TCP","1434","34325  >  443 [ACK] Seq=142806 Ack=1895 Win=661 Len=1368 TSval=8141976 TSecr=600767605 [TCP segment of a reassembled PDU]"
"245","2018-08-23 02:52:17.668570","192.168.2.3","216.58.197.4","TLSv1.2","212","Application Data"
"246","2018-08-23 02:52:17.668884","192.168.2.3","216.58.197.4","TCP","1434","34325  >  443 [ACK] Seq=144320 Ack=1895 Win=661 Len=1368 TSval=8141976 TSecr=600767605 [TCP segment of a reassembled PDU]"
"247","2018-08-23 02:52:17.668886","192.168.2.3","216.58.197.4","TLSv1.2","155","Application Data"
"253","2018-08-23 02:52:17.721947","192.168.2.3","216.58.197.4","TCP","66","34325  >  443 [ACK] Seq=145777 Ack=2298 Win=661 Len=0 TSval=8141981 TSecr=600767734"
"256","2018-08-23 02:52:17.733202","192.168.2.3","216.58.197.4","TCP","66","34325  >  443 [ACK] Seq=145777 Ack=2673 Win=661 Len=0 TSval=8141983 TSecr=600767745"
"257","2018-08-23 02:52:17.764543","192.168.2.3","216.58.197.4","TCP","1434","34325  >  443 [ACK] Seq=145777 Ack=2673 Win=661 Len=1368 TSval=8141986 TSecr=600767745 [TCP segment of a reassembled PDU]"
"258","2018-08-23 02:52:17.764954","192.168.2.3","216.58.197.4","TCP","1434","34325  >  443 [ACK] Seq=147145 Ack=2673 Win=661 Len=1368 TSval=8141986 TSecr=600767745 [TCP segment of a reassembled PDU]"
"259","2018-08-23 02:52:17.764956","192.168.2.3","216.58.197.4","TLSv1.2","212","Application Data"
"260","2018-08-23 02:52:17.765314","192.168.2.3","216.58.197.4","TCP","1434","34325  >  443 [ACK] Seq=148659 Ack=2673 Win=661 Len=1368 TSval=8141986 TSecr=600767745 [TCP segment of a reassembled PDU]"
"261","2018-08-23 02:52:17.765316","192.168.2.3","216.58.197.4","TLSv1.2","155","Application Data"
"267","2018-08-23 02:52:17.827350","192.168.2.3","216.58.197.4","TCP","66","34325  >  443 [ACK] Seq=150116 Ack=2791 Win=661 Len=0 TSval=8141992 TSecr=600767835"
"268","2018-08-23 02:52:17.861821","192.168.2.3","216.58.197.4","TCP","1434","34325  >  443 [ACK] Seq=150116 Ack=2791 Win=661 Len=1368 TSval=8141995 TSecr=600767835 [TCP segment of a reassembled PDU]"
"269","2018-08-23 02:52:17.862224","192.168.2.3","216.58.197.4","TCP","1434","34325  >  443 [ACK] Seq=151484 Ack=2791 Win=661 Len=1368 TSval=8141995 TSecr=600767835 [TCP segment of a reassembled PDU]"
"270","2018-08-23 02:52:17.862226","192.168.2.3","216.58.197.4","TLSv1.2","212","Application Data"
"271","2018-08-23 02:52:17.862227","192.168.2.3","216.58.197.4","TCP","1434","34325  >  443 [ACK] Seq=152998 Ack=2791 Win=661 Len=1368 TSval=8141995 TSecr=600767835 [TCP segment of a reassembled PDU]"
"272","2018-08-23 02:52:17.862501","192.168.2.3","216.58.197.4","TLSv1.2","155","Application Data"
"276","2018-08-23 02:52:17.935909","192.168.2.3","216.58.197.4","TCP","1434","34325  >  443 [ACK] Seq=154455 Ack=2791 Win=661 Len=1368 TSval=8142003 TSecr=600767880 [TCP segment of a reassembled PDU]"
"277","2018-08-23 02:52:17.936330","192.168.2.3","216.58.197.4","TCP","1434","34325  >  443 [ACK] Seq=155823 Ack=2791 Win=661 Len=1368 TSval=8142003 TSecr=600767880 [TCP segment of a reassembled PDU]"
"278","2018-08-23 02:52:17.936333","192.168.2.3","216.58.197.4","TLSv1.2","212","Application Data"
"279","2018-08-23 02:52:17.936334","192.168.2.3","216.58.197.4","TCP","1434","34325  >  443 [ACK] Seq=157337 Ack=2791 Win=661 Len=1368 TSval=8142003 TSecr=600767880 [TCP segment of a reassembled PDU]"
"280","2018-08-23 02:52:17.936509","192.168.2.3","216.58.197.4","TLSv1.2","155","Application Data"
"285","2018-08-23 02:52:18.010290","192.168.2.3","216.58.197.4","TCP","66","34325  >  443 [ACK] Seq=158794 Ack=2977 Win=661 Len=0 TSval=8142010 TSecr=600768001"
"287","2018-08-23 02:52:18.022454","192.168.2.3","216.58.197.4","TCP","1434","34325  >  443 [ACK] Seq=158794 Ack=2977 Win=661 Len=1368 TSval=8142011 TSecr=600768001 [TCP segment of a reassembled PDU]"
"288","2018-08-23 02:52:18.022458","192.168.2.3","216.58.197.4","TCP","1434","34325  >  443 [ACK] Seq=160162 Ack=2977 Win=661 Len=1368 TSval=8142011 TSecr=600768001 [TCP segment of a reassembled PDU]"
"289","2018-08-23 02:52:18.022459","192.168.2.3","216.58.197.4","TLSv1.2","212","Application Data"
"290","2018-08-23 02:52:18.022650","192.168.2.3","216.58.197.4","TCP","1434","34325  >  443 [ACK] Seq=161676 Ack=2977 Win=661 Len=1368 TSval=8142011 TSecr=600768001 [TCP segment of a reassembled PDU]"
"291","2018-08-23 02:52:18.022847","192.168.2.3","216.58.197.4","TLSv1.2","155","Application Data"
"295","2018-08-23 02:52:18.038600","192.168.2.3","216.58.197.4","TCP","78","[TCP Dup ACK 285#1] 34325  >  443 [ACK] Seq=163133 Ack=2977 Win=661 Len=0 TSval=8142012 TSecr=600768027 SLE=2888 SRE=2977"
"296","2018-08-23 02:52:18.115733","192.168.2.3","216.58.197.4","TCP","1434","34325  >  443 [ACK] Seq=163133 Ack=2977 Win=661 Len=1368 TSval=8142021 TSecr=600768041 [TCP segment of a reassembled PDU]"
"297","2018-08-23 02:52:18.116208","192.168.2.3","216.58.197.4","TCP","1434","34325  >  443 [ACK] Seq=164501 Ack=2977 Win=661 Len=1368 TSval=8142021 TSecr=600768041 [TCP segment of a reassembled PDU]"
"298","2018-08-23 02:52:18.116210","192.168.2.3","216.58.197.4","TLSv1.2","212","Application Data"
"299","2018-08-23 02:52:18.116211","192.168.2.3","216.58.197.4","TCP","1434","34325  >  443 [ACK] Seq=166015 Ack=2977 Win=661 Len=1368 TSval=8142021 TSecr=600768041 [TCP segment of a reassembled PDU]"
"300","2018-08-23 02:52:18.116212","192.168.2.3","216.58.197.4","TLSv1.2","155","Application Data"
"306","2018-08-23 02:52:18.180673","192.168.2.3","216.58.197.4","TCP","1434","34325  >  443 [ACK] Seq=167472 Ack=2977 Win=661 Len=1368 TSval=8142027 TSecr=600768134 [TCP segment of a reassembled PDU]"
"307","2018-08-23 02:52:18.181068","192.168.2.3","216.58.197.4","TCP","1434","34325  >  443 [ACK] Seq=168840 Ack=2977 Win=661 Len=1368 TSval=8142027 TSecr=600768134 [TCP segment of a reassembled PDU]"
"308","2018-08-23 02:52:18.181080","192.168.2.3","216.58.197.4","TLSv1.2","212","Application Data"
"309","2018-08-23 02:52:18.181429","192.168.2.3","216.58.197.4","TCP","1434","34325  >  443 [ACK] Seq=170354 Ack=2977 Win=661 Len=1368 TSval=8142027 TSecr=600768134 [TCP segment of a reassembled PDU]"
"310","2018-08-23 02:52:18.181436","192.168.2.3","216.58.197.4","TLSv1.2","155","Application Data"
"311","2018-08-23 02:52:18.181437","192.168.2.3","216.58.197.4","TCP","66","34325  >  443 [ACK] Seq=171811 Ack=3150 Win=661 Len=0 TSval=8142027 TSecr=600768193"
"312","2018-08-23 02:52:18.181438","192.168.2.3","216.58.197.4","TCP","66","34325  >  443 [ACK] Seq=171811 Ack=3313 Win=661 Len=0 TSval=8142027 TSecr=600768193"
"317","2018-08-23 02:52:18.186668","192.168.2.3","216.58.197.4","TCP","66","34325  >  443 [ACK] Seq=171811 Ack=3347 Win=661 Len=0 TSval=8142028 TSecr=600768199"
"318","2018-08-23 02:52:18.276935","192.168.2.3","216.58.197.4","TCP","1434","34325  >  443 [ACK] Seq=171811 Ack=3347 Win=661 Len=1368 TSval=8142037 TSecr=600768199 [TCP segment of a reassembled PDU]"
"319","2018-08-23 02:52:18.277289","192.168.2.3","216.58.197.4","TCP","1434","34325  >  443 [ACK] Seq=173179 Ack=3347 Win=661 Len=1368 TSval=8142037 TSecr=600768199 [TCP segment of a reassembled PDU]"
"320","2018-08-23 02:52:18.277292","192.168.2.3","216.58.197.4","TLSv1.2","212","Application Data"
"321","2018-08-23 02:52:18.277293","192.168.2.3","216.58.197.4","TCP","1434","34325  >  443 [ACK] Seq=174693 Ack=3347 Win=661 Len=1368 TSval=8142037 TSecr=600768199 [TCP segment of a reassembled PDU]"
"322","2018-08-23 02:52:18.277370","192.168.2.3","216.58.197.4","TLSv1.2","155","Application Data"
"327","2018-08-23 02:52:18.332682","192.168.2.3","216.58.197.4","TCP","66","34325  >  443 [ACK] Seq=176150 Ack=3536 Win=661 Len=0 TSval=8142043 TSecr=600768344"
"328","2018-08-23 02:52:18.332955","192.168.2.3","216.58.197.4","TCP","66","34325  >  443 [ACK] Seq=176150 Ack=3784 Win=661 Len=0 TSval=8142043 TSecr=600768344"
"329","2018-08-23 02:52:18.380977","192.168.2.3","216.58.197.4","TCP","1434","34325  >  443 [ACK] Seq=176150 Ack=3784 Win=661 Len=1368 TSval=8142047 TSecr=600768344 [TCP segment of a reassembled PDU]"
"330","2018-08-23 02:52:18.380981","192.168.2.3","216.58.197.4","TCP","1434","34325  >  443 [ACK] Seq=177518 Ack=3784 Win=661 Len=1368 TSval=8142047 TSecr=600768344 [TCP segment of a reassembled PDU]"
"331","2018-08-23 02:52:18.380982","192.168.2.3","216.58.197.4","TLSv1.2","212","Application Data"
"332","2018-08-23 02:52:18.381329","192.168.2.3","216.58.197.4","TCP","1434","34325  >  443 [ACK] Seq=179032 Ack=3784 Win=661 Len=1368 TSval=8142047 TSecr=600768344 [TCP segment of a reassembled PDU]"
"333","2018-08-23 02:52:18.381332","192.168.2.3","216.58.197.4","TLSv1.2","155","Application Data"
"338","2018-08-23 02:52:18.395789","192.168.2.3","216.58.197.4","TCP","66","34325  >  443 [ACK] Seq=180489 Ack=3888 Win=661 Len=0 TSval=8142049 TSecr=600768408"
"340","2018-08-23 02:52:18.424421","192.168.2.3","216.58.197.4","TCP","66","34325  >  443 [ACK] Seq=180489 Ack=4136 Win=661 Len=0 TSval=8142052 TSecr=600768436"
"341","2018-08-23 02:52:18.474852","192.168.2.3","216.58.197.4","TCP","1434","34325  >  443 [ACK] Seq=180489 Ack=4136 Win=661 Len=1368 TSval=8142056 TSecr=600768436 [TCP segment of a reassembled PDU]"
"342","2018-08-23 02:52:18.474857","192.168.2.3","216.58.197.4","TCP","1434","34325  >  443 [ACK] Seq=181857 Ack=4136 Win=661 Len=1368 TSval=8142056 TSecr=600768436 [TCP segment of a reassembled PDU]"
"343","2018-08-23 02:52:18.474858","192.168.2.3","216.58.197.4","TLSv1.2","212","Application Data"
"344","2018-08-23 02:52:18.475301","192.168.2.3","216.58.197.4","TCP","1434","34325  >  443 [ACK] Seq=183371 Ack=4136 Win=661 Len=1368 TSval=8142056 TSecr=600768436 [TCP segment of a reassembled PDU]"
"345","2018-08-23 02:52:18.475304","192.168.2.3","216.58.197.4","TLSv1.2","155","Application Data"
"349","2018-08-23 02:52:18.576419","192.168.2.3","216.58.197.4","TCP","1434","34325  >  443 [ACK] Seq=184828 Ack=4136 Win=661 Len=1368 TSval=8142067 TSecr=600768533 [TCP segment of a reassembled PDU]"
"350","2018-08-23 02:52:18.576514","192.168.2.3","216.58.197.4","TCP","1434","34325  >  443 [ACK] Seq=186196 Ack=4136 Win=661 Len=1368 TSval=8142067 TSecr=600768533 [TCP segment of a reassembled PDU]"
"351","2018-08-23 02:52:18.576738","192.168.2.3","216.58.197.4","TLSv1.2","212","Application Data"
"352","2018-08-23 02:52:18.576741","192.168.2.3","216.58.197.4","TCP","1434","34325  >  443 [ACK] Seq=187710 Ack=4136 Win=661 Len=1368 TSval=8142067 TSecr=600768533 [TCP segment of a reassembled PDU]"
"353","2018-08-23 02:52:18.576917","192.168.2.3","216.58.197.4","TLSv1.2","155","Application Data"
"358","2018-08-23 02:52:18.624015","192.168.2.3","216.58.197.4","TCP","66","34325  >  443 [ACK] Seq=189167 Ack=4354 Win=661 Len=0 TSval=8142072 TSecr=600768595"
"359","2018-08-23 02:52:18.679228","192.168.2.3","216.58.197.4","TCP","1434","34325  >  443 [ACK] Seq=189167 Ack=4354 Win=661 Len=1368 TSval=8142077 TSecr=600768595 [TCP segment of a reassembled PDU]"
"360","2018-08-23 02:52:18.679242","192.168.2.3","216.58.197.4","TCP","1434","34325  >  443 [ACK] Seq=190535 Ack=4354 Win=661 Len=1368 TSval=8142077 TSecr=600768595 [TCP segment of a reassembled PDU]"
"361","2018-08-23 02:52:18.679244","192.168.2.3","216.58.197.4","TLSv1.2","212","Application Data"
"362","2018-08-23 02:52:18.679287","192.168.2.3","216.58.197.4","TCP","1434","34325  >  443 [ACK] Seq=192049 Ack=4354 Win=661 Len=1368 TSval=8142077 TSecr=600768595 [TCP segment of a reassembled PDU]"
"363","2018-08-23 02:52:18.679446","192.168.2.3","216.58.197.4","TLSv1.2","155","Application Data"
"365","2018-08-23 02:52:18.771098","192.168.2.3","216.58.197.4","TCP","1434","34325  >  443 [ACK] Seq=193506 Ack=4354 Win=661 Len=1368 TSval=8142086 TSecr=600768697 [TCP segment of a reassembled PDU]"
"366","2018-08-23 02:52:18.771103","192.168.2.3","216.58.197.4","TCP","1434","34325  >  443 [ACK] Seq=194874 Ack=4354 Win=661 Len=1368 TSval=8142086 TSecr=600768697 [TCP segment of a reassembled PDU]"
"367","2018-08-23 02:52:18.771104","192.168.2.3","216.58.197.4","TLSv1.2","212","Application Data"
"368","2018-08-23 02:52:18.771261","192.168.2.3","216.58.197.4","TCP","1434","34325  >  443 [ACK] Seq=196388 Ack=4354 Win=661 Len=1368 TSval=8142086 TSecr=600768697 [TCP segment of a reassembled PDU]"
"369","2018-08-23 02:52:18.771264","192.168.2.3","216.58.197.4","TLSv1.2","155","Application Data"
"375","2018-08-23 02:52:18.819862","192.168.2.3","216.58.197.4","TCP","66","34325  >  443 [ACK] Seq=197845 Ack=4452 Win=661 Len=0 TSval=8142091 TSecr=600768830"
"376","2018-08-23 02:52:18.820934","192.168.2.3","216.58.197.4","TCP","66","34325  >  443 [ACK] Seq=197845 Ack=4658 Win=661 Len=0 TSval=8142091 TSecr=600768830"
"377","2018-08-23 02:52:18.885835","192.168.2.3","216.58.197.4","TCP","1434","34325  >  443 [ACK] Seq=197845 Ack=4658 Win=661 Len=1368 TSval=8142098 TSecr=600768830 [TCP segment of a reassembled PDU]"
"378","2018-08-23 02:52:18.887480","192.168.2.3","216.58.197.4","TCP","1434","34325  >  443 [ACK] Seq=199213 Ack=4658 Win=661 Len=1368 TSval=8142098 TSecr=600768830 [TCP segment of a reassembled PDU]"
"379","2018-08-23 02:52:18.887484","192.168.2.3","216.58.197.4","TLSv1.2","212","Application Data"
"380","2018-08-23 02:52:18.887806","192.168.2.3","216.58.197.4","TCP","1434","34325  >  443 [ACK] Seq=200727 Ack=4658 Win=661 Len=1368 TSval=8142098 TSecr=600768830 [TCP segment of a reassembled PDU]"
"381","2018-08-23 02:52:18.887809","192.168.2.3","216.58.197.4","TLSv1.2","155","Application Data"
"387","2018-08-23 02:52:18.942590","192.168.2.3","216.58.197.4","TCP","66","34325  >  443 [ACK] Seq=202184 Ack=4916 Win=661 Len=0 TSval=8142103 TSecr=600768951"
"388","2018-08-23 02:52:18.942593","192.168.2.3","216.58.197.4","TCP","66","34325  >  443 [ACK] Seq=202184 Ack=5091 Win=661 Len=0 TSval=8142103 TSecr=600768951"
"389","2018-08-23 02:52:18.986371","192.168.2.3","216.58.197.4","TCP","1434","34325  >  443 [ACK] Seq=202184 Ack=5091 Win=661 Len=1368 TSval=8142107 TSecr=600768951 [TCP segment of a reassembled PDU]"
"390","2018-08-23 02:52:18.986376","192.168.2.3","216.58.197.4","TCP","1434","34325  >  443 [ACK] Seq=203552 Ack=5091 Win=661 Len=1368 TSval=8142107 TSecr=600768951 [TCP segment of a reassembled PDU]"
"391","2018-08-23 02:52:18.986377","192.168.2.3","216.58.197.4","TLSv1.2","212","Application Data"
"392","2018-08-23 02:52:18.986654","192.168.2.3","216.58.197.4","TCP","1434","34325  >  443 [ACK] Seq=205066 Ack=5091 Win=661 Len=1368 TSval=8142107 TSecr=600768951 [TCP segment of a reassembled PDU]"
"393","2018-08-23 02:52:18.986657","192.168.2.3","216.58.197.4","TLSv1.2","155","Application Data"
"397","2018-08-23 02:52:19.076818","192.168.2.3","216.58.197.4","TCP","1434","34325  >  443 [ACK] Seq=206523 Ack=5091 Win=661 Len=1368 TSval=8142117 TSecr=600769004 [TCP segment of a reassembled PDU]"
"398","2018-08-23 02:52:19.077238","192.168.2.3","216.58.197.4","TCP","1434","34325  >  443 [ACK] Seq=207891 Ack=5091 Win=661 Len=1368 TSval=8142117 TSecr=600769004 [TCP segment of a reassembled PDU]"
"399","2018-08-23 02:52:19.077241","192.168.2.3","216.58.197.4","TLSv1.2","212","Application Data"
"400","2018-08-23 02:52:19.077242","192.168.2.3","216.58.197.4","TCP","1434","34325  >  443 [ACK] Seq=209405 Ack=5091 Win=661 Len=1368 TSval=8142117 TSecr=600769004 [TCP segment of a reassembled PDU]"
"401","2018-08-23 02:52:19.077364","192.168.2.3","216.58.197.4","TLSv1.2","155","Application Data"
"407","2018-08-23 02:52:19.127225","192.168.2.3","216.58.197.4","TCP","66","34325  >  443 [ACK] Seq=210862 Ack=5456 Win=661 Len=0 TSval=8142122 TSecr=600769136"
"409","2018-08-23 02:52:19.166753","192.168.2.3","216.58.197.4","TCP","66","34325  >  443 [ACK] Seq=210862 Ack=5929 Win=661 Len=0 TSval=8142126 TSecr=600769178"
"411","2018-08-23 02:52:19.168340","192.168.2.3","216.58.197.4","TCP","66","34325  >  443 [ACK] Seq=210862 Ack=5994 Win=661 Len=0 TSval=8142126 TSecr=600769181"
"412","2018-08-23 02:52:19.177147","192.168.2.3","216.58.197.4","TCP","1434","34325  >  443 [ACK] Seq=210862 Ack=5994 Win=661 Len=1368 TSval=8142127 TSecr=600769181 [TCP segment of a reassembled PDU]"
