"No.","Time","Source","Destination","Protocol","Length","Info"
"6","2018-08-23 02:54:10.980019","192.168.2.3","192.168.2.1","TCP","183","8009  >  53029 [PSH, ACK] Seq=1 Ack=118 Win=277 Len=117 TSval=8153307 TSecr=2318783961 [TCP segment of a reassembled PDU]"
"8","2018-08-23 02:54:11.785697","192.168.2.3","35.186.224.46","TLSv1.2","108","Application Data"
"11","2018-08-23 02:54:11.832313","192.168.2.3","35.186.224.46","TCP","66","49072  >  443 [ACK] Seq=43 Ack=40 Win=1042 Len=0 TSval=8153392 TSecr=3642753291"
"12","2018-08-23 02:54:13.032296","192.168.2.3","216.58.197.4","TLSv1.2","156","Application Data"
"13","2018-08-23 02:54:13.032300","192.168.2.3","216.58.197.4","TLSv1.2","104","Application Data"
"14","2018-08-23 02:54:13.033306","192.168.2.3","216.58.197.4","TLSv1.2","158","Application Data"
"18","2018-08-23 02:54:13.045031","192.168.2.3","216.58.197.4","TCP","1434","34325  >  443 [ACK] Seq=221 Ack=39 Win=661 Len=1368 TSval=8153514 TSecr=600883050 [TCP segment of a reassembled PDU]"
"19","2018-08-23 02:54:13.045551","192.168.2.3","216.58.197.4","TCP","1434","34325  >  443 [ACK] Seq=1589 Ack=39 Win=661 Len=1368 TSval=8153514 TSecr=600883050 [TCP segment of a reassembled PDU]"
"20","2018-08-23 02:54:13.045555","192.168.2.3","216.58.197.4","TLSv1.2","212","Application Data"
"21","2018-08-23 02:54:13.045930","192.168.2.3","216.58.197.4","TCP","1434","34325  >  443 [ACK] Seq=3103 Ack=39 Win=661 Len=1368 TSval=8153514 TSecr=600883050 [TCP segment of a reassembled PDU]"
"22","2018-08-23 02:54:13.045933","192.168.2.3","216.58.197.4","TLSv1.2","329","Application Data"
"23","2018-08-23 02:54:13.046284","192.168.2.3","216.58.197.4","TCP","1434","34325  >  443 [ACK] Seq=4734 Ack=39 Win=661 Len=1368 TSval=8153514 TSecr=600883050 [TCP segment of a reassembled PDU]"
"24","2018-08-23 02:54:13.046631","192.168.2.3","216.58.197.4","TCP","1434","34325  >  443 [ACK] Seq=6102 Ack=39 Win=661 Len=1368 TSval=8153514 TSecr=600883050 [TCP segment of a reassembled PDU]"
"25","2018-08-23 02:54:13.046633","192.168.2.3","216.58.197.4","TLSv1.2","212","Application Data"
"26","2018-08-23 02:54:13.046634","192.168.2.3","216.58.197.4","TCP","1434","34325  >  443 [ACK] Seq=7616 Ack=39 Win=661 Len=1368 TSval=8153514 TSecr=600883050 [TCP segment of a reassembled PDU]"
"30","2018-08-23 02:54:13.050985","192.168.2.3","216.58.197.4","TLSv1.2","1434","Application Data [TCP segment of a reassembled PDU]"
"31","2018-08-23 02:54:13.050987","192.168.2.3","216.58.197.4","TCP","1434","34325  >  443 [ACK] Seq=10352 Ack=39 Win=661 Len=1368 TSval=8153514 TSecr=600883063 [TCP segment of a reassembled PDU]"
"34","2018-08-23 02:54:13.051483","192.168.2.3","216.58.197.4","TLSv1.2","1434","Application Data [TCP segment of a reassembled PDU]"
"35","2018-08-23 02:54:13.051921","192.168.2.3","216.58.197.4","TLSv1.2","1434","Application Data [TCP segment of a reassembled PDU]"
"38","2018-08-23 02:54:13.064249","192.168.2.3","216.58.197.4","TCP","1434","34325  >  443 [ACK] Seq=14456 Ack=39 Win=661 Len=1368 TSval=8153514 TSecr=600883063 [TCP segment of a reassembled PDU]"
"39","2018-08-23 02:54:13.064252","192.168.2.3","216.58.197.4","TLSv1.2","1434","Application Data [TCP segment of a reassembled PDU]"
"40","2018-08-23 02:54:13.064439","192.168.2.3","216.58.197.4","TLSv1.2","1434","Application Data [TCP segment of a reassembled PDU]"
"41","2018-08-23 02:54:13.064698","192.168.2.3","216.58.197.4","TCP","1434","34325  >  443 [ACK] Seq=18560 Ack=39 Win=661 Len=1368 TSval=8153514 TSecr=600883063 [TCP segment of a reassembled PDU]"
"42","2018-08-23 02:54:13.065119","192.168.2.3","216.58.197.4","TLSv1.2","1434","Application Data [TCP segment of a reassembled PDU]"
"43","2018-08-23 02:54:13.066744","192.168.2.3","216.58.197.4","TLSv1.2","1434","Application Data [TCP segment of a reassembled PDU]"
"44","2018-08-23 02:54:13.067262","192.168.2.3","216.58.197.4","TCP","1434","34325  >  443 [ACK] Seq=22664 Ack=39 Win=661 Len=1368 TSval=8153516 TSecr=600883064 [TCP segment of a reassembled PDU]"
"45","2018-08-23 02:54:13.067264","192.168.2.3","216.58.197.4","TLSv1.2","1434","Application Data [TCP segment of a reassembled PDU]"
"48","2018-08-23 02:54:13.069431","192.168.2.3","216.58.197.4","TLSv1.2","1434","Application Data [TCP segment of a reassembled PDU]"
"49","2018-08-23 02:54:13.069433","192.168.2.3","216.58.197.4","TCP","1434","34325  >  443 [ACK] Seq=26768 Ack=39 Win=661 Len=1368 TSval=8153516 TSecr=600883064 [TCP segment of a reassembled PDU]"
"50","2018-08-23 02:54:13.069538","192.168.2.3","216.58.197.4","TLSv1.2","1434","Application Data [TCP segment of a reassembled PDU]"
"51","2018-08-23 02:54:13.070656","192.168.2.3","216.58.197.4","TLSv1.2","1434","Application Data [TCP segment of a reassembled PDU]"
"52","2018-08-23 02:54:13.070913","192.168.2.3","216.58.197.4","TCP","1434","34325  >  443 [ACK] Seq=30872 Ack=39 Win=661 Len=1368 TSval=8153516 TSecr=600883069 [TCP segment of a reassembled PDU]"
"53","2018-08-23 02:54:13.070915","192.168.2.3","216.58.197.4","TCP","1434","34325  >  443 [ACK] Seq=32240 Ack=39 Win=661 Len=1368 TSval=8153516 TSecr=600883069 [TCP segment of a reassembled PDU]"
"55","2018-08-23 02:54:13.071065","192.168.2.3","216.58.197.4","TLSv1.2","1434","Application Data [TCP segment of a reassembled PDU]"
"56","2018-08-23 02:54:13.071204","192.168.2.3","216.58.197.4","TLSv1.2","1434","Application Data [TCP segment of a reassembled PDU]"
"57","2018-08-23 02:54:13.071387","192.168.2.3","216.58.197.4","TCP","1434","34325  >  443 [ACK] Seq=36344 Ack=39 Win=661 Len=1368 TSval=8153516 TSecr=600883069 [TCP segment of a reassembled PDU]"
"59","2018-08-23 02:54:13.071699","192.168.2.3","216.58.197.4","TLSv1.2","1434","Application Data [TCP segment of a reassembled PDU]"
"60","2018-08-23 02:54:13.071700","192.168.2.3","216.58.197.4","TLSv1.2","1434","Application Data [TCP segment of a reassembled PDU]"
"61","2018-08-23 02:54:13.071988","192.168.2.3","216.58.197.4","TCP","1434","34325  >  443 [ACK] Seq=40448 Ack=39 Win=661 Len=1368 TSval=8153516 TSecr=600883082 [TCP segment of a reassembled PDU]"
"62","2018-08-23 02:54:13.072700","192.168.2.3","216.58.197.4","TLSv1.2","1434","Application Data [TCP segment of a reassembled PDU]"
"63","2018-08-23 02:54:13.072702","192.168.2.3","216.58.197.4","TLSv1.2","1434","Application Data [TCP segment of a reassembled PDU]"
"64","2018-08-23 02:54:13.073016","192.168.2.3","216.58.197.4","TCP","1434","34325  >  443 [ACK] Seq=44552 Ack=39 Win=661 Len=1368 TSval=8153516 TSecr=600883082 [TCP segment of a reassembled PDU]"
"65","2018-08-23 02:54:13.073414","192.168.2.3","216.58.197.4","TLSv1.2","1434","Application Data [TCP segment of a reassembled PDU]"
"66","2018-08-23 02:54:13.073734","192.168.2.3","216.58.197.4","TLSv1.2","1434","Application Data [TCP segment of a reassembled PDU]"
"68","2018-08-23 02:54:13.074121","192.168.2.3","216.58.197.4","TCP","1434","34325  >  443 [ACK] Seq=48656 Ack=39 Win=661 Len=1368 TSval=8153516 TSecr=600883085 [TCP segment of a reassembled PDU]"
"69","2018-08-23 02:54:13.074371","192.168.2.3","216.58.197.4","TLSv1.2","1434","Application Data [TCP segment of a reassembled PDU]"
"70","2018-08-23 02:54:13.074752","192.168.2.3","216.58.197.4","TLSv1.2","1434","Application Data [TCP segment of a reassembled PDU]"
"78","2018-08-23 02:54:13.078353","192.168.2.3","216.58.197.4","TCP","1434","34325  >  443 [ACK] Seq=52760 Ack=39 Win=661 Len=1368 TSval=8153517 TSecr=600883087 [TCP segment of a reassembled PDU]"
"79","2018-08-23 02:54:13.078356","192.168.2.3","216.58.197.4","TLSv1.2","1434","Application Data [TCP segment of a reassembled PDU]"
"80","2018-08-23 02:54:13.078648","192.168.2.3","216.58.197.4","TLSv1.2","1434","Application Data [TCP segment of a reassembled PDU]"
"81","2018-08-23 02:54:13.078807","192.168.2.3","216.58.197.4","TCP","1434","34325  >  443 [ACK] Seq=56864 Ack=39 Win=661 Len=1368 TSval=8153517 TSecr=600883088 [TCP segment of a reassembled PDU]"
"82","2018-08-23 02:54:13.079053","192.168.2.3","216.58.197.4","TCP","1434","34325  >  443 [ACK] Seq=58232 Ack=39 Win=661 Len=1368 TSval=8153517 TSecr=600883088 [TCP segment of a reassembled PDU]"
"84","2018-08-23 02:54:13.079167","192.168.2.3","216.58.197.4","TLSv1.2","1434","Application Data, Application Data"
"85","2018-08-23 02:54:13.079170","192.168.2.3","216.58.197.4","TCP","1434","34325  >  443 [ACK] Seq=60968 Ack=39 Win=661 Len=1368 TSval=8153517 TSecr=600883089 [TCP segment of a reassembled PDU]"
"86","2018-08-23 02:54:13.079555","192.168.2.3","216.58.197.4","TLSv1.2","1434","Application Data [TCP segment of a reassembled PDU]"
"87","2018-08-23 02:54:13.080879","192.168.2.3","216.58.197.4","TLSv1.2","1434","Application Data [TCP segment of a reassembled PDU]"
"88","2018-08-23 02:54:13.081240","192.168.2.3","216.58.197.4","TCP","1434","34325  >  443 [ACK] Seq=65072 Ack=39 Win=661 Len=1368 TSval=8153517 TSecr=600883089 [TCP segment of a reassembled PDU]"
"89","2018-08-23 02:54:13.081605","192.168.2.3","216.58.197.4","TLSv1.2","1434","Application Data [TCP segment of a reassembled PDU]"
"90","2018-08-23 02:54:13.081607","192.168.2.3","216.58.197.4","TLSv1.2","953","Application Data"
"98","2018-08-23 02:54:13.169860","192.168.2.3","216.58.197.4","TCP","1434","34325  >  443 [ACK] Seq=68695 Ack=39 Win=661 Len=1368 TSval=8153526 TSecr=600883140 [TCP segment of a reassembled PDU]"
"99","2018-08-23 02:54:13.170264","192.168.2.3","216.58.197.4","TCP","1434","34325  >  443 [ACK] Seq=70063 Ack=39 Win=661 Len=1368 TSval=8153526 TSecr=600883140 [TCP segment of a reassembled PDU]"
"100","2018-08-23 02:54:13.170268","192.168.2.3","216.58.197.4","TLSv1.2","212","Application Data"
"101","2018-08-23 02:54:13.170660","192.168.2.3","216.58.197.4","TCP","1434","34325  >  443 [ACK] Seq=71577 Ack=39 Win=661 Len=1368 TSval=8153526 TSecr=600883140 [TCP segment of a reassembled PDU]"
"102","2018-08-23 02:54:13.170663","192.168.2.3","216.58.197.4","TLSv1.2","155","Application Data"
"106","2018-08-23 02:54:13.285585","192.168.2.3","216.58.197.4","TCP","1434","34325  >  443 [ACK] Seq=73034 Ack=39 Win=661 Len=1368 TSval=8153538 TSecr=600883188 [TCP segment of a reassembled PDU]"
"107","2018-08-23 02:54:13.285827","192.168.2.3","216.58.197.4","TCP","1434","34325  >  443 [ACK] Seq=74402 Ack=39 Win=661 Len=1368 TSval=8153538 TSecr=600883188 [TCP segment of a reassembled PDU]"
"108","2018-08-23 02:54:13.285830","192.168.2.3","216.58.197.4","TLSv1.2","212","Application Data"
"109","2018-08-23 02:54:13.285830","192.168.2.3","216.58.197.4","TCP","1434","34325  >  443 [ACK] Seq=75916 Ack=39 Win=661 Len=1368 TSval=8153538 TSecr=600883188 [TCP segment of a reassembled PDU]"
"110","2018-08-23 02:54:13.286079","192.168.2.3","216.58.197.4","TLSv1.2","155","Application Data"
"117","2018-08-23 02:54:13.334301","192.168.2.3","216.58.197.4","TCP","66","34325  >  443 [ACK] Seq=77373 Ack=177 Win=661 Len=0 TSval=8153543 TSecr=600883346"
"119","2018-08-23 02:54:13.348301","192.168.2.3","216.58.197.4","TCP","66","34325  >  443 [ACK] Seq=77373 Ack=719 Win=661 Len=0 TSval=8153544 TSecr=600883346"
"120","2018-08-23 02:54:13.380755","192.168.2.3","216.58.197.4","TCP","1434","34325  >  443 [ACK] Seq=77373 Ack=719 Win=661 Len=1368 TSval=8153547 TSecr=600883346 [TCP segment of a reassembled PDU]"
"121","2018-08-23 02:54:13.381176","192.168.2.3","216.58.197.4","TCP","1434","34325  >  443 [ACK] Seq=78741 Ack=719 Win=661 Len=1368 TSval=8153547 TSecr=600883346 [TCP segment of a reassembled PDU]"
"122","2018-08-23 02:54:13.381180","192.168.2.3","216.58.197.4","TLSv1.2","212","Application Data"
"123","2018-08-23 02:54:13.381459","192.168.2.3","216.58.197.4","TCP","1434","34325  >  443 [ACK] Seq=80255 Ack=719 Win=661 Len=1368 TSval=8153547 TSecr=600883346 [TCP segment of a reassembled PDU]"
"124","2018-08-23 02:54:13.381462","192.168.2.3","216.58.197.4","TLSv1.2","155","Application Data"
"129","2018-08-23 02:54:13.477320","192.168.2.3","216.58.197.4","TCP","1434","34325  >  443 [ACK] Seq=81712 Ack=793 Win=661 Len=1368 TSval=8153557 TSecr=600883478 [TCP segment of a reassembled PDU]"
"130","2018-08-23 02:54:13.477730","192.168.2.3","216.58.197.4","TCP","1434","34325  >  443 [ACK] Seq=83080 Ack=793 Win=661 Len=1368 TSval=8153557 TSecr=600883478 [TCP segment of a reassembled PDU]"
"131","2018-08-23 02:54:13.477746","192.168.2.3","216.58.197.4","TLSv1.2","212","Application Data"
"132","2018-08-23 02:54:13.477747","192.168.2.3","216.58.197.4","TCP","1434","34325  >  443 [ACK] Seq=84594 Ack=793 Win=661 Len=1368 TSval=8153557 TSecr=600883478 [TCP segment of a reassembled PDU]"
"133","2018-08-23 02:54:13.477962","192.168.2.3","216.58.197.4","TLSv1.2","155","Application Data"
"135","2018-08-23 02:54:13.577836","192.168.2.3","216.58.197.4","TCP","1434","34325  >  443 [ACK] Seq=86051 Ack=793 Win=661 Len=1368 TSval=8153567 TSecr=600883496 [TCP segment of a reassembled PDU]"
"136","2018-08-23 02:54:13.578067","192.168.2.3","216.58.197.4","TCP","1434","34325  >  443 [ACK] Seq=87419 Ack=793 Win=661 Len=1368 TSval=8153567 TSecr=600883496 [TCP segment of a reassembled PDU]"
"137","2018-08-23 02:54:13.578069","192.168.2.3","216.58.197.4","TLSv1.2","212","Application Data"
"138","2018-08-23 02:54:13.578267","192.168.2.3","216.58.197.4","TCP","1434","34325  >  443 [ACK] Seq=88933 Ack=793 Win=661 Len=1368 TSval=8153567 TSecr=600883496 [TCP segment of a reassembled PDU]"
"139","2018-08-23 02:54:13.578283","192.168.2.3","216.58.197.4","TLSv1.2","155","Application Data"
"144","2018-08-23 02:54:13.636457","192.168.2.3","23.1.99.33","TCP","66","51031  >  443 [ACK] Seq=1 Ack=1 Win=5425 Len=0 TSval=8153573 TSecr=1622154544"
"145","2018-08-23 02:54:13.654633","192.168.2.3","216.58.197.4","TCP","66","34325  >  443 [ACK] Seq=90390 Ack=862 Win=661 Len=0 TSval=8153575 TSecr=600883632"
"146","2018-08-23 02:54:13.689787","192.168.2.3","216.58.197.4","TCP","1434","34325  >  443 [ACK] Seq=90390 Ack=862 Win=661 Len=1368 TSval=8153577 TSecr=600883632 [TCP segment of a reassembled PDU]"
"147","2018-08-23 02:54:13.689791","192.168.2.3","216.58.197.4","TCP","1434","34325  >  443 [ACK] Seq=91758 Ack=862 Win=661 Len=1368 TSval=8153577 TSecr=600883632 [TCP segment of a reassembled PDU]"
"148","2018-08-23 02:54:13.689792","192.168.2.3","216.58.197.4","TLSv1.2","212","Application Data"
"149","2018-08-23 02:54:13.689852","192.168.2.3","216.58.197.4","TCP","1434","34325  >  443 [ACK] Seq=93272 Ack=862 Win=661 Len=1368 TSval=8153577 TSecr=600883632 [TCP segment of a reassembled PDU]"
"150","2018-08-23 02:54:13.689854","192.168.2.3","216.58.197.4","TLSv1.2","155","Application Data"
"153","2018-08-23 02:54:13.767879","192.168.2.3","216.58.197.4","TCP","1434","34325  >  443 [ACK] Seq=94729 Ack=862 Win=661 Len=1368 TSval=8153586 TSecr=600883708 [TCP segment of a reassembled PDU]"
"154","2018-08-23 02:54:13.767884","192.168.2.3","216.58.197.4","TCP","1434","34325  >  443 [ACK] Seq=96097 Ack=862 Win=661 Len=1368 TSval=8153586 TSecr=600883708 [TCP segment of a reassembled PDU]"
"155","2018-08-23 02:54:13.767885","192.168.2.3","216.58.197.4","TLSv1.2","212","Application Data"
"156","2018-08-23 02:54:13.768317","192.168.2.3","216.58.197.4","TCP","1434","34325  >  443 [ACK] Seq=97611 Ack=862 Win=661 Len=1368 TSval=8153586 TSecr=600883708 [TCP segment of a reassembled PDU]"
"157","2018-08-23 02:54:13.768320","192.168.2.3","216.58.197.4","TLSv1.2","155","Application Data"
"162","2018-08-23 02:54:13.861583","192.168.2.3","216.58.197.4","TCP","1434","34325  >  443 [ACK] Seq=99068 Ack=862 Win=661 Len=1368 TSval=8153595 TSecr=600883826 [TCP segment of a reassembled PDU]"
"163","2018-08-23 02:54:13.861883","192.168.2.3","216.58.197.4","TCP","1434","34325  >  443 [ACK] Seq=100436 Ack=862 Win=661 Len=1368 TSval=8153595 TSecr=600883826 [TCP segment of a reassembled PDU]"
"164","2018-08-23 02:54:13.861888","192.168.2.3","216.58.197.4","TLSv1.2","212","Application Data"
"165","2018-08-23 02:54:13.862333","192.168.2.3","216.58.197.4","TCP","1434","34325  >  443 [ACK] Seq=101950 Ack=862 Win=661 Len=1368 TSval=8153595 TSecr=600883826 [TCP segment of a reassembled PDU]"
"166","2018-08-23 02:54:13.862336","192.168.2.3","216.58.197.4","TLSv1.2","155","Application Data"
"170","2018-08-23 02:54:13.964138","192.168.2.3","216.58.197.4","TCP","1434","34325  >  443 [ACK] Seq=103407 Ack=862 Win=661 Len=1368 TSval=8153605 TSecr=600883880 [TCP segment of a reassembled PDU]"
"171","2018-08-23 02:54:13.964614","192.168.2.3","216.58.197.4","TCP","1434","34325  >  443 [ACK] Seq=104775 Ack=862 Win=661 Len=1368 TSval=8153605 TSecr=600883880 [TCP segment of a reassembled PDU]"
"172","2018-08-23 02:54:13.964617","192.168.2.3","216.58.197.4","TLSv1.2","212","Application Data"
"173","2018-08-23 02:54:13.965044","192.168.2.3","216.58.197.4","TCP","1434","34325  >  443 [ACK] Seq=106289 Ack=862 Win=661 Len=1368 TSval=8153605 TSecr=600883880 [TCP segment of a reassembled PDU]"
"174","2018-08-23 02:54:13.965047","192.168.2.3","216.58.197.4","TLSv1.2","155","Application Data"
"178","2018-08-23 02:54:14.055443","192.168.2.3","216.58.197.4","TCP","1434","34325  >  443 [ACK] Seq=107746 Ack=862 Win=661 Len=1368 TSval=8153615 TSecr=600883983 [TCP segment of a reassembled PDU]"
"179","2018-08-23 02:54:14.055776","192.168.2.3","216.58.197.4","TCP","1434","34325  >  443 [ACK] Seq=109114 Ack=862 Win=661 Len=1368 TSval=8153615 TSecr=600883983 [TCP segment of a reassembled PDU]"
"180","2018-08-23 02:54:14.055778","192.168.2.3","216.58.197.4","TLSv1.2","212","Application Data"
"181","2018-08-23 02:54:14.055779","192.168.2.3","216.58.197.4","TCP","1434","34325  >  443 [ACK] Seq=110628 Ack=862 Win=661 Len=1368 TSval=8153615 TSecr=600883983 [TCP segment of a reassembled PDU]"
"182","2018-08-23 02:54:14.055780","192.168.2.3","216.58.197.4","TLSv1.2","155","Application Data"
"186","2018-08-23 02:54:14.134780","192.168.2.3","216.58.197.4","TCP","1434","34325  >  443 [ACK] Seq=112085 Ack=862 Win=661 Len=1368 TSval=8153622 TSecr=600884073 [TCP segment of a reassembled PDU]"
"187","2018-08-23 02:54:14.135035","192.168.2.3","216.58.197.4","TCP","1434","34325  >  443 [ACK] Seq=113453 Ack=862 Win=661 Len=1368 TSval=8153622 TSecr=600884073 [TCP segment of a reassembled PDU]"
"188","2018-08-23 02:54:14.135037","192.168.2.3","216.58.197.4","TLSv1.2","212","Application Data"
"189","2018-08-23 02:54:14.135038","192.168.2.3","216.58.197.4","TCP","1434","34325  >  443 [ACK] Seq=114967 Ack=862 Win=661 Len=1368 TSval=8153622 TSecr=600884073 [TCP segment of a reassembled PDU]"
"190","2018-08-23 02:54:14.135215","192.168.2.3","216.58.197.4","TLSv1.2","155","Application Data"
"193","2018-08-23 02:54:14.215155","192.168.2.3","216.58.197.4","TCP","1434","34325  >  443 [ACK] Seq=116424 Ack=862 Win=661 Len=1368 TSval=8153631 TSecr=600884153 [TCP segment of a reassembled PDU]"
"194","2018-08-23 02:54:14.216430","192.168.2.3","216.58.197.4","TCP","1434","34325  >  443 [ACK] Seq=117792 Ack=862 Win=661 Len=1368 TSval=8153631 TSecr=600884153 [TCP segment of a reassembled PDU]"
"195","2018-08-23 02:54:14.216433","192.168.2.3","216.58.197.4","TLSv1.2","212","Application Data"
"196","2018-08-23 02:54:14.216740","192.168.2.3","216.58.197.4","TCP","1434","34325  >  443 [ACK] Seq=119306 Ack=862 Win=661 Len=1368 TSval=8153631 TSecr=600884153 [TCP segment of a reassembled PDU]"
"197","2018-08-23 02:54:14.216743","192.168.2.3","216.58.197.4","TLSv1.2","155","Application Data"
"201","2018-08-23 02:54:14.309759","192.168.2.3","216.58.197.4","TCP","1434","34325  >  443 [ACK] Seq=120763 Ack=862 Win=661 Len=1368 TSval=8153640 TSecr=600884234 [TCP segment of a reassembled PDU]"
"202","2018-08-23 02:54:14.310034","192.168.2.3","216.58.197.4","TCP","1434","34325  >  443 [ACK] Seq=122131 Ack=862 Win=661 Len=1368 TSval=8153640 TSecr=600884234 [TCP segment of a reassembled PDU]"
"203","2018-08-23 02:54:14.310052","192.168.2.3","216.58.197.4","TLSv1.2","212","Application Data"
"204","2018-08-23 02:54:14.310369","192.168.2.3","216.58.197.4","TCP","1434","34325  >  443 [ACK] Seq=123645 Ack=862 Win=661 Len=1368 TSval=8153640 TSecr=600884234 [TCP segment of a reassembled PDU]"
"205","2018-08-23 02:54:14.310371","192.168.2.3","216.58.197.4","TLSv1.2","155","Application Data"
"210","2018-08-23 02:54:14.334212","192.168.2.3","216.58.197.4","TCP","66","34325  >  443 [ACK] Seq=125102 Ack=1091 Win=661 Len=0 TSval=8153643 TSecr=600884346"
"212","2018-08-23 02:54:14.346236","192.168.2.3","216.58.197.4","TCP","66","34325  >  443 [ACK] Seq=125102 Ack=1228 Win=661 Len=0 TSval=8153644 TSecr=600884357"
"215","2018-08-23 02:54:14.358283","192.168.2.3","216.58.197.4","TCP","66","34325  >  443 [ACK] Seq=125102 Ack=1560 Win=661 Len=0 TSval=8153645 TSecr=600884370"
"216","2018-08-23 02:54:14.358352","192.168.2.3","216.58.197.4","TCP","66","34325  >  443 [ACK] Seq=125102 Ack=1710 Win=661 Len=0 TSval=8153645 TSecr=600884370"
"219","2018-08-23 02:54:14.368754","192.168.2.3","216.58.197.4","TCP","66","34325  >  443 [ACK] Seq=125102 Ack=1971 Win=661 Len=0 TSval=8153646 TSecr=600884378"
"220","2018-08-23 02:54:14.368761","192.168.2.3","216.58.197.4","TCP","66","34325  >  443 [ACK] Seq=125102 Ack=2237 Win=661 Len=0 TSval=8153646 TSecr=600884379"
"221","2018-08-23 02:54:14.405897","192.168.2.3","216.58.197.4","TCP","1434","34325  >  443 [ACK] Seq=125102 Ack=2237 Win=661 Len=1368 TSval=8153650 TSecr=600884379 [TCP segment of a reassembled PDU]"
"222","2018-08-23 02:54:14.406215","192.168.2.3","216.58.197.4","TCP","1434","34325  >  443 [ACK] Seq=126470 Ack=2237 Win=661 Len=1368 TSval=8153650 TSecr=600884379 [TCP segment of a reassembled PDU]"
"223","2018-08-23 02:54:14.406217","192.168.2.3","216.58.197.4","TLSv1.2","212","Application Data"
"224","2018-08-23 02:54:14.406218","192.168.2.3","216.58.197.4","TCP","1434","34325  >  443 [ACK] Seq=127984 Ack=2237 Win=661 Len=1368 TSval=8153650 TSecr=600884379 [TCP segment of a reassembled PDU]"
"225","2018-08-23 02:54:14.406219","192.168.2.3","216.58.197.4","TLSv1.2","155","Application Data"
"229","2018-08-23 02:54:14.502976","192.168.2.3","216.58.197.4","TCP","1434","34325  >  443 [ACK] Seq=129441 Ack=2237 Win=661 Len=1368 TSval=8153659 TSecr=600884464 [TCP segment of a reassembled PDU]"
"230","2018-08-23 02:54:14.503534","192.168.2.3","216.58.197.4","TCP","1434","34325  >  443 [ACK] Seq=130809 Ack=2237 Win=661 Len=1368 TSval=8153659 TSecr=600884464 [TCP segment of a reassembled PDU]"
"231","2018-08-23 02:54:14.503546","192.168.2.3","216.58.197.4","TLSv1.2","212","Application Data"
"232","2018-08-23 02:54:14.503547","192.168.2.3","216.58.197.4","TCP","1434","34325  >  443 [ACK] Seq=132323 Ack=2237 Win=661 Len=1368 TSval=8153659 TSecr=600884464 [TCP segment of a reassembled PDU]"
"233","2018-08-23 02:54:14.503646","192.168.2.3","216.58.197.4","TLSv1.2","155","Application Data"
"237","2018-08-23 02:54:14.600213","192.168.2.3","216.58.197.4","TCP","1434","34325  >  443 [ACK] Seq=133780 Ack=2237 Win=661 Len=1368 TSval=8153669 TSecr=600884521 [TCP segment of a reassembled PDU]"
"238","2018-08-23 02:54:14.600218","192.168.2.3","216.58.197.4","TCP","1434","34325  >  443 [ACK] Seq=135148 Ack=2237 Win=661 Len=1368 TSval=8153669 TSecr=600884521 [TCP segment of a reassembled PDU]"
"239","2018-08-23 02:54:14.600219","192.168.2.3","216.58.197.4","TLSv1.2","212","Application Data"
"240","2018-08-23 02:54:14.600445","192.168.2.3","216.58.197.4","TCP","1434","34325  >  443 [ACK] Seq=136662 Ack=2237 Win=661 Len=1368 TSval=8153669 TSecr=600884521 [TCP segment of a reassembled PDU]"
"241","2018-08-23 02:54:14.600449","192.168.2.3","216.58.197.4","TLSv1.2","155","Application Data"
"247","2018-08-23 02:54:14.653572","192.168.2.3","216.58.197.4","TCP","66","34325  >  443 [ACK] Seq=138119 Ack=2454 Win=661 Len=0 TSval=8153674 TSecr=600884664"
"248","2018-08-23 02:54:14.654054","192.168.2.3","216.58.197.4","TCP","66","34325  >  443 [ACK] Seq=138119 Ack=2613 Win=661 Len=0 TSval=8153675 TSecr=600884665"
"249","2018-08-23 02:54:14.699283","192.168.2.3","216.58.197.4","TCP","1434","34325  >  443 [ACK] Seq=138119 Ack=2613 Win=661 Len=1368 TSval=8153679 TSecr=600884665 [TCP segment of a reassembled PDU]"
"250","2018-08-23 02:54:14.699288","192.168.2.3","216.58.197.4","TCP","1434","34325  >  443 [ACK] Seq=139487 Ack=2613 Win=661 Len=1368 TSval=8153679 TSecr=600884665 [TCP segment of a reassembled PDU]"
"251","2018-08-23 02:54:14.699289","192.168.2.3","216.58.197.4","TLSv1.2","212","Application Data"
"252","2018-08-23 02:54:14.699341","192.168.2.3","216.58.197.4","TCP","1434","34325  >  443 [ACK] Seq=141001 Ack=2613 Win=661 Len=1368 TSval=8153679 TSecr=600884665 [TCP segment of a reassembled PDU]"
"253","2018-08-23 02:54:14.699342","192.168.2.3","216.58.197.4","TLSv1.2","155","Application Data"
"258","2018-08-23 02:54:14.749116","192.168.2.3","216.58.197.4","TCP","66","34325  >  443 [ACK] Seq=142458 Ack=2782 Win=661 Len=0 TSval=8153684 TSecr=600884761"
"259","2018-08-23 02:54:14.749513","192.168.2.3","216.58.197.4","TCP","66","34325  >  443 [ACK] Seq=142458 Ack=3079 Win=661 Len=0 TSval=8153684 TSecr=600884761"
"260","2018-08-23 02:54:14.772226","192.168.2.3","216.58.197.4","TCP","1434","34325  >  443 [ACK] Seq=142458 Ack=3079 Win=661 Len=1368 TSval=8153686 TSecr=600884761 [TCP segment of a reassembled PDU]"
"261","2018-08-23 02:54:14.772231","192.168.2.3","216.58.197.4","TCP","1434","34325  >  443 [ACK] Seq=143826 Ack=3079 Win=661 Len=1368 TSval=8153686 TSecr=600884761 [TCP segment of a reassembled PDU]"
"262","2018-08-23 02:54:14.772232","192.168.2.3","216.58.197.4","TLSv1.2","212","Application Data"
"263","2018-08-23 02:54:14.772520","192.168.2.3","216.58.197.4","TCP","1434","34325  >  443 [ACK] Seq=145340 Ack=3079 Win=661 Len=1368 TSval=8153686 TSecr=600884761 [TCP segment of a reassembled PDU]"
"264","2018-08-23 02:54:14.772523","192.168.2.3","216.58.197.4","TLSv1.2","155","Application Data"
"269","2018-08-23 02:54:14.846434","192.168.2.3","216.58.197.4","TCP","66","34325  >  443 [ACK] Seq=146797 Ack=3477 Win=661 Len=0 TSval=8153694 TSecr=600884850"
"270","2018-08-23 02:54:14.864776","192.168.2.3","216.58.197.4","TCP","1434","34325  >  443 [ACK] Seq=146797 Ack=3477 Win=661 Len=1368 TSval=8153696 TSecr=600884850 [TCP segment of a reassembled PDU]"
"271","2018-08-23 02:54:14.864998","192.168.2.3","216.58.197.4","TCP","1434","34325  >  443 [ACK] Seq=148165 Ack=3477 Win=661 Len=1368 TSval=8153696 TSecr=600884850 [TCP segment of a reassembled PDU]"
"272","2018-08-23 02:54:14.865009","192.168.2.3","216.58.197.4","TLSv1.2","212","Application Data"
"273","2018-08-23 02:54:14.865349","192.168.2.3","216.58.197.4","TCP","1434","34325  >  443 [ACK] Seq=149679 Ack=3477 Win=661 Len=1368 TSval=8153696 TSecr=600884850 [TCP segment of a reassembled PDU]"
"274","2018-08-23 02:54:14.865355","192.168.2.3","216.58.197.4","TLSv1.2","155","Application Data"
"280","2018-08-23 02:54:14.924416","192.168.2.3","216.58.197.4","TCP","66","34325  >  443 [ACK] Seq=151136 Ack=3826 Win=661 Len=0 TSval=8153702 TSecr=600884935"
"281","2018-08-23 02:54:14.951192","192.168.2.3","216.58.197.4","TCP","1434","34325  >  443 [ACK] Seq=151136 Ack=3826 Win=661 Len=1368 TSval=8153704 TSecr=600884935 [TCP segment of a reassembled PDU]"
"282","2018-08-23 02:54:14.951632","192.168.2.3","216.58.197.4","TCP","1434","34325  >  443 [ACK] Seq=152504 Ack=3826 Win=661 Len=1368 TSval=8153704 TSecr=600884935 [TCP segment of a reassembled PDU]"
"283","2018-08-23 02:54:14.951635","192.168.2.3","216.58.197.4","TLSv1.2","212","Application Data"
"284","2018-08-23 02:54:14.951636","192.168.2.3","216.58.197.4","TCP","1434","34325  >  443 [ACK] Seq=154018 Ack=3826 Win=661 Len=1368 TSval=8153704 TSecr=600884935 [TCP segment of a reassembled PDU]"
"285","2018-08-23 02:54:14.951637","192.168.2.3","216.58.197.4","TLSv1.2","155","Application Data"
"290","2018-08-23 02:54:15.007381","192.168.2.3","216.58.197.4","TCP","66","34325  >  443 [ACK] Seq=155475 Ack=4298 Win=661 Len=0 TSval=8153710 TSecr=600885018"
"291","2018-08-23 02:54:15.047193","192.168.2.3","216.58.197.4","TCP","1434","34325  >  443 [ACK] Seq=155475 Ack=4298 Win=661 Len=1368 TSval=8153714 TSecr=600885018 [TCP segment of a reassembled PDU]"
"292","2018-08-23 02:54:15.047554","192.168.2.3","216.58.197.4","TCP","1434","34325  >  443 [ACK] Seq=156843 Ack=4298 Win=661 Len=1368 TSval=8153714 TSecr=600885018 [TCP segment of a reassembled PDU]"
"293","2018-08-23 02:54:15.047556","192.168.2.3","216.58.197.4","TLSv1.2","212","Application Data"
"294","2018-08-23 02:54:15.047822","192.168.2.3","216.58.197.4","TCP","1434","34325  >  443 [ACK] Seq=158357 Ack=4298 Win=661 Len=1368 TSval=8153714 TSecr=600885018 [TCP segment of a reassembled PDU]"
"295","2018-08-23 02:54:15.047824","192.168.2.3","216.58.197.4","TLSv1.2","155","Application Data"
"301","2018-08-23 02:54:15.109465","192.168.2.3","216.58.197.4","TCP","66","34325  >  443 [ACK] Seq=159814 Ack=4746 Win=661 Len=0 TSval=8153720 TSecr=600885116"
"302","2018-08-23 02:54:15.121347","192.168.2.3","216.58.197.4","TCP","1434","34325  >  443 [ACK] Seq=159814 Ack=4746 Win=661 Len=1368 TSval=8153721 TSecr=600885116 [TCP segment of a reassembled PDU]"
"303","2018-08-23 02:54:15.121826","192.168.2.3","216.58.197.4","TCP","1434","34325  >  443 [ACK] Seq=161182 Ack=4746 Win=661 Len=1368 TSval=8153721 TSecr=600885116 [TCP segment of a reassembled PDU]"
"304","2018-08-23 02:54:15.121829","192.168.2.3","216.58.197.4","TLSv1.2","212","Application Data"
"305","2018-08-23 02:54:15.122331","192.168.2.3","216.58.197.4","TCP","1434","34325  >  443 [ACK] Seq=162696 Ack=4746 Win=661 Len=1368 TSval=8153721 TSecr=600885116 [TCP segment of a reassembled PDU]"
"306","2018-08-23 02:54:15.122334","192.168.2.3","216.58.197.4","TLSv1.2","155","Application Data"
"312","2018-08-23 02:54:15.172591","192.168.2.3","216.58.197.4","TCP","66","34325  >  443 [ACK] Seq=164153 Ack=5162 Win=661 Len=0 TSval=8153726 TSecr=600885182"
"313","2018-08-23 02:54:15.239620","192.168.2.3","216.58.197.4","TCP","1434","34325  >  443 [ACK] Seq=164153 Ack=5162 Win=661 Len=1368 TSval=8153733 TSecr=600885182 [TCP segment of a reassembled PDU]"
"314","2018-08-23 02:54:15.239625","192.168.2.3","216.58.197.4","TCP","1434","34325  >  443 [ACK] Seq=165521 Ack=5162 Win=661 Len=1368 TSval=8153733 TSecr=600885182 [TCP segment of a reassembled PDU]"
"315","2018-08-23 02:54:15.239626","192.168.2.3","216.58.197.4","TLSv1.2","212","Application Data"
"316","2018-08-23 02:54:15.240003","192.168.2.3","216.58.197.4","TCP","1434","34325  >  443 [ACK] Seq=167035 Ack=5162 Win=661 Len=1368 TSval=8153733 TSecr=600885182 [TCP segment of a reassembled PDU]"
"317","2018-08-23 02:54:15.240006","192.168.2.3","216.58.197.4","TLSv1.2","155","Application Data"
"323","2018-08-23 02:54:15.302056","192.168.2.3","216.58.197.4","TCP","66","34325  >  443 [ACK] Seq=168492 Ack=5569 Win=661 Len=0 TSval=8153739 TSecr=600885308"
"325","2018-08-23 02:54:15.334086","192.168.2.3","216.58.197.4","TCP","1434","34325  >  443 [ACK] Seq=168492 Ack=5569 Win=661 Len=1368 TSval=8153742 TSecr=600885308 [TCP segment of a reassembled PDU]"
"326","2018-08-23 02:54:15.334090","192.168.2.3","216.58.197.4","TCP","1434","34325  >  443 [ACK] Seq=169860 Ack=5569 Win=661 Len=1368 TSval=8153742 TSecr=600885308 [TCP segment of a reassembled PDU]"
"327","2018-08-23 02:54:15.334091","192.168.2.3","216.58.197.4","TLSv1.2","212","Application Data"
"328","2018-08-23 02:54:15.334233","192.168.2.3","216.58.197.4","TCP","1434","34325  >  443 [ACK] Seq=171374 Ack=5569 Win=661 Len=1368 TSval=8153742 TSecr=600885308 [TCP segment of a reassembled PDU]"
"329","2018-08-23 02:54:15.334479","192.168.2.3","216.58.197.4","TLSv1.2","155","Application Data"
"334","2018-08-23 02:54:15.345945","192.168.2.3","216.58.197.4","TCP","66","34325  >  443 [ACK] Seq=172831 Ack=6077 Win=661 Len=0 TSval=8153744 TSecr=600885347"
"335","2018-08-23 02:54:15.444800","192.168.2.3","216.58.197.4","TCP","1434","34325  >  443 [ACK] Seq=172831 Ack=6077 Win=661 Len=1368 TSval=8153753 TSecr=600885347 [TCP segment of a reassembled PDU]"
"336","2018-08-23 02:54:15.445115","192.168.2.3","216.58.197.4","TCP","1434","34325  >  443 [ACK] Seq=174199 Ack=6077 Win=661 Len=1368 TSval=8153753 TSecr=600885347 [TCP segment of a reassembled PDU]"
"337","2018-08-23 02:54:15.445117","192.168.2.3","216.58.197.4","TLSv1.2","212","Application Data"
"338","2018-08-23 02:54:15.445118","192.168.2.3","216.58.197.4","TCP","1434","34325  >  443 [ACK] Seq=175713 Ack=6077 Win=661 Len=1368 TSval=8153753 TSecr=600885347 [TCP segment of a reassembled PDU]"
"339","2018-08-23 02:54:15.445182","192.168.2.3","216.58.197.4","TLSv1.2","155","Application Data"
"342","2018-08-23 02:54:15.537235","192.168.2.3","216.58.197.4","TCP","1434","34325  >  443 [ACK] Seq=177170 Ack=6077 Win=661 Len=1368 TSval=8153763 TSecr=600885463 [TCP segment of a reassembled PDU]"
"343","2018-08-23 02:54:15.537575","192.168.2.3","216.58.197.4","TCP","1434","34325  >  443 [ACK] Seq=178538 Ack=6077 Win=661 Len=1368 TSval=8153763 TSecr=600885463 [TCP segment of a reassembled PDU]"
"344","2018-08-23 02:54:15.537577","192.168.2.3","216.58.197.4","TLSv1.2","212","Application Data"
"345","2018-08-23 02:54:15.537848","192.168.2.3","216.58.197.4","TCP","1434","34325  >  443 [ACK] Seq=180052 Ack=6077 Win=661 Len=1368 TSval=8153763 TSecr=600885463 [TCP segment of a reassembled PDU]"
"346","2018-08-23 02:54:15.537850","192.168.2.3","216.58.197.4","TLSv1.2","155","Application Data"
"350","2018-08-23 02:54:15.603590","192.168.2.3","216.58.197.4","TCP","66","34325  >  443 [ACK] Seq=181509 Ack=6312 Win=661 Len=0 TSval=8153770 TSecr=600885583"
"351","2018-08-23 02:54:15.633331","192.168.2.3","216.58.197.4","TCP","1434","34325  >  443 [ACK] Seq=181509 Ack=6312 Win=661 Len=1368 TSval=8153772 TSecr=600885583 [TCP segment of a reassembled PDU]"
"352","2018-08-23 02:54:15.633859","192.168.2.3","216.58.197.4","TCP","1434","34325  >  443 [ACK] Seq=182877 Ack=6312 Win=661 Len=1368 TSval=8153772 TSecr=600885583 [TCP segment of a reassembled PDU]"
"353","2018-08-23 02:54:15.633862","192.168.2.3","216.58.197.4","TLSv1.2","212","Application Data"
"354","2018-08-23 02:54:15.634257","192.168.2.3","216.58.197.4","TCP","1434","34325  >  443 [ACK] Seq=184391 Ack=6312 Win=661 Len=1368 TSval=8153772 TSecr=600885583 [TCP segment of a reassembled PDU]"
"355","2018-08-23 02:54:15.634259","192.168.2.3","216.58.197.4","TLSv1.2","155","Application Data"
"359","2018-08-23 02:54:15.731242","192.168.2.3","216.58.197.4","TCP","1434","34325  >  443 [ACK] Seq=185848 Ack=6312 Win=661 Len=1368 TSval=8153782 TSecr=600885692 [TCP segment of a reassembled PDU]"
"360","2018-08-23 02:54:15.731673","192.168.2.3","216.58.197.4","TCP","1434","34325  >  443 [ACK] Seq=187216 Ack=6312 Win=661 Len=1368 TSval=8153782 TSecr=600885692 [TCP segment of a reassembled PDU]"
"361","2018-08-23 02:54:15.731675","192.168.2.3","216.58.197.4","TLSv1.2","212","Application Data"
"362","2018-08-23 02:54:15.732563","192.168.2.3","216.58.197.4","TCP","1434","34325  >  443 [ACK] Seq=188730 Ack=6312 Win=661 Len=1368 TSval=8153782 TSecr=600885692 [TCP segment of a reassembled PDU]"
"363","2018-08-23 02:54:15.732566","192.168.2.3","216.58.197.4","TLSv1.2","155","Application Data"
"369","2018-08-23 02:54:15.782557","192.168.2.3","216.58.197.4","TCP","66","34325  >  443 [ACK] Seq=190187 Ack=6419 Win=661 Len=0 TSval=8153787 TSecr=600885794"
"370","2018-08-23 02:54:15.782560","192.168.2.3","216.58.197.4","TCP","66","34325  >  443 [ACK] Seq=190187 Ack=6580 Win=661 Len=0 TSval=8153787 TSecr=600885795"
"371","2018-08-23 02:54:15.847396","192.168.2.3","216.58.197.4","TCP","1434","34325  >  443 [ACK] Seq=190187 Ack=6580 Win=661 Len=1368 TSval=8153794 TSecr=600885795 [TCP segment of a reassembled PDU]"
"372","2018-08-23 02:54:15.847741","192.168.2.3","216.58.197.4","TCP","1434","34325  >  443 [ACK] Seq=191555 Ack=6580 Win=661 Len=1368 TSval=8153794 TSecr=600885795 [TCP segment of a reassembled PDU]"
"373","2018-08-23 02:54:15.847743","192.168.2.3","216.58.197.4","TLSv1.2","212","Application Data"
"374","2018-08-23 02:54:15.850065","192.168.2.3","216.58.197.4","TCP","1434","34325  >  443 [ACK] Seq=193069 Ack=6580 Win=661 Len=1368 TSval=8153794 TSecr=600885795 [TCP segment of a reassembled PDU]"
"375","2018-08-23 02:54:15.850069","192.168.2.3","216.58.197.4","TLSv1.2","155","Application Data"
"381","2018-08-23 02:54:15.904312","192.168.2.3","216.58.197.4","TCP","66","34325  >  443 [ACK] Seq=194526 Ack=6906 Win=661 Len=0 TSval=8153799 TSecr=600885913"
"382","2018-08-23 02:54:15.942933","192.168.2.3","216.58.197.4","TCP","1434","34325  >  443 [ACK] Seq=194526 Ack=6906 Win=661 Len=1368 TSval=8153803 TSecr=600885913 [TCP segment of a reassembled PDU]"
"383","2018-08-23 02:54:15.945724","192.168.2.3","216.58.197.4","TCP","1434","34325  >  443 [ACK] Seq=195894 Ack=6906 Win=661 Len=1368 TSval=8153803 TSecr=600885913 [TCP segment of a reassembled PDU]"
"384","2018-08-23 02:54:15.945728","192.168.2.3","216.58.197.4","TLSv1.2","212","Application Data"
"385","2018-08-23 02:54:15.945728","192.168.2.3","216.58.197.4","TCP","1434","34325  >  443 [ACK] Seq=197408 Ack=6906 Win=661 Len=1368 TSval=8153803 TSecr=600885913 [TCP segment of a reassembled PDU]"
"386","2018-08-23 02:54:15.945729","192.168.2.3","216.58.197.4","TLSv1.2","155","Application Data"
"391","2018-08-23 02:54:15.985798","192.168.2.3","192.168.2.1","TCP","183","8009  >  53029 [PSH, ACK] Seq=118 Ack=235 Win=277 Len=117 TSval=8153808 TSecr=2318788956 [TCP segment of a reassembled PDU]"
"393","2018-08-23 02:54:16.050282","192.168.2.3","216.58.197.4","TCP","1434","34325  >  443 [ACK] Seq=198865 Ack=6906 Win=661 Len=1368 TSval=8153814 TSecr=600885963 [TCP segment of a reassembled PDU]"
"394","2018-08-23 02:54:16.050286","192.168.2.3","216.58.197.4","TCP","1434","34325  >  443 [ACK] Seq=200233 Ack=6906 Win=661 Len=1368 TSval=8153814 TSecr=600885963 [TCP segment of a reassembled PDU]"
"395","2018-08-23 02:54:16.050287","192.168.2.3","216.58.197.4","TLSv1.2","212","Application Data"
"396","2018-08-23 02:54:16.050461","192.168.2.3","216.58.197.4","TCP","1434","34325  >  443 [ACK] Seq=201747 Ack=6906 Win=661 Len=1368 TSval=8153814 TSecr=600885963 [TCP segment of a reassembled PDU]"
"397","2018-08-23 02:54:16.050721","192.168.2.3","216.58.197.4","TLSv1.2","155","Application Data"
"403","2018-08-23 02:54:16.100667","192.168.2.3","216.58.197.4","TCP","66","34325  >  443 [ACK] Seq=203204 Ack=7324 Win=661 Len=0 TSval=8153819 TSecr=600886110"
"404","2018-08-23 02:54:16.129855","192.168.2.3","216.58.197.4","TCP","1434","34325  >  443 [ACK] Seq=203204 Ack=7324 Win=661 Len=1368 TSval=8153822 TSecr=600886110 [TCP segment of a reassembled PDU]"
"405","2018-08-23 02:54:16.129858","192.168.2.3","216.58.197.4","TCP","1434","34325  >  443 [ACK] Seq=204572 Ack=7324 Win=661 Len=1368 TSval=8153822 TSecr=600886110 [TCP segment of a reassembled PDU]"
"406","2018-08-23 02:54:16.129859","192.168.2.3","216.58.197.4","TLSv1.2","212","Application Data"
"407","2018-08-23 02:54:16.129860","192.168.2.3","216.58.197.4","TLSv1.2","879","Application Data"
"408","2018-08-23 02:54:16.130061","192.168.2.3","216.58.197.4","TLSv1.2","102","Application Data"
"413","2018-08-23 02:54:16.176751","192.168.2.3","216.58.197.4","TCP","66","34325  >  443 [ACK] Seq=206935 Ack=8289 Win=661 Len=0 TSval=8153827 TSecr=600886186"
"416","2018-08-23 02:54:16.345571","192.168.2.3","216.58.197.4","TCP","66","34325  >  443 [ACK] Seq=206935 Ack=8618 Win=661 Len=0 TSval=8153844 TSecr=600886347"
"430","2018-08-23 02:54:16.797638","192.168.2.3","216.58.197.4","TCP","66","34325  >  443 [ACK] Seq=206935 Ack=10127 Win=650 Len=0 TSval=8153889 TSecr=600886771"
"431","2018-08-23 02:54:16.797643","192.168.2.3","216.58.197.4","TCP","66","34325  >  443 [ACK] Seq=206935 Ack=12002 Win=650 Len=0 TSval=8153889 TSecr=600886805"
"432","2018-08-23 02:54:16.797644","192.168.2.3","216.58.197.4","TCP","66","34325  >  443 [ACK] Seq=206935 Ack=13879 Win=650 Len=0 TSval=8153889 TSecr=600886805"
"433","2018-08-23 02:54:16.798190","192.168.2.3","216.58.197.4","TCP","66","34325  >  443 [ACK] Seq=206935 Ack=17659 Win=650 Len=0 TSval=8153889 TSecr=600886805"
