"No.","Time","Source","Destination","Protocol","Length","Info"
"1","2018-08-23 02:59:37.587700","192.168.2.3","74.125.204.188","TCP","66","33038  >  5228 [ACK] Seq=1 Ack=1 Win=406 Len=0 TSval=8185968 TSecr=3817455921"
"4","2018-08-23 02:59:37.887434","192.168.2.3","192.168.2.1","TCP","183","8009  >  53029 [PSH, ACK] Seq=1 Ack=118 Win=277 Len=117 TSval=8185998 TSecr=2319110104 [TCP segment of a reassembled PDU]"
"6","2018-08-23 02:59:39.474872","192.168.2.3","216.58.197.4","TLSv1.2","156","Application Data"
"7","2018-08-23 02:59:39.474876","192.168.2.3","216.58.197.4","TLSv1.2","104","Application Data"
"8","2018-08-23 02:59:39.475017","192.168.2.3","216.58.197.4","TLSv1.2","158","Application Data"
"13","2018-08-23 02:59:39.483559","192.168.2.3","216.58.197.4","TCP","1434","34325  >  443 [ACK] Seq=221 Ack=39 Win=661 Len=1368 TSval=8186157 TSecr=601209494 [TCP segment of a reassembled PDU]"
"14","2018-08-23 02:59:39.485913","192.168.2.3","216.58.197.4","TCP","1434","34325  >  443 [ACK] Seq=1589 Ack=39 Win=661 Len=1368 TSval=8186157 TSecr=601209494 [TCP segment of a reassembled PDU]"
"15","2018-08-23 02:59:39.485915","192.168.2.3","216.58.197.4","TLSv1.2","212","Application Data"
"16","2018-08-23 02:59:39.485916","192.168.2.3","216.58.197.4","TCP","1434","34325  >  443 [ACK] Seq=3103 Ack=39 Win=661 Len=1368 TSval=8186157 TSecr=601209494 [TCP segment of a reassembled PDU]"
"17","2018-08-23 02:59:39.486096","192.168.2.3","216.58.197.4","TLSv1.2","354","Application Data"
"18","2018-08-23 02:59:39.486324","192.168.2.3","216.58.197.4","TCP","1434","34325  >  443 [ACK] Seq=4759 Ack=39 Win=661 Len=1368 TSval=8186157 TSecr=601209494 [TCP segment of a reassembled PDU]"
"19","2018-08-23 02:59:39.486326","192.168.2.3","216.58.197.4","TCP","1434","34325  >  443 [ACK] Seq=6127 Ack=39 Win=661 Len=1368 TSval=8186157 TSecr=601209494 [TCP segment of a reassembled PDU]"
"20","2018-08-23 02:59:39.486435","192.168.2.3","216.58.197.4","TLSv1.2","212","Application Data"
"21","2018-08-23 02:59:39.486807","192.168.2.3","216.58.197.4","TCP","1434","34325  >  443 [ACK] Seq=7641 Ack=39 Win=661 Len=1368 TSval=8186157 TSecr=601209494 [TCP segment of a reassembled PDU]"
"22","2018-08-23 02:59:39.486809","192.168.2.3","216.58.197.4","TLSv1.2","156","Application Data"
"28","2018-08-23 02:59:39.498480","192.168.2.3","216.58.197.4","TCP","1434","34325  >  443 [ACK] Seq=9099 Ack=39 Win=661 Len=1368 TSval=8186158 TSecr=601209504 [TCP segment of a reassembled PDU]"
"29","2018-08-23 02:59:39.498898","192.168.2.3","216.58.197.4","TCP","1434","34325  >  443 [ACK] Seq=10467 Ack=39 Win=661 Len=1368 TSval=8186159 TSecr=601209504 [TCP segment of a reassembled PDU]"
"30","2018-08-23 02:59:39.498900","192.168.2.3","216.58.197.4","TLSv1.2","1434","Application Data [TCP segment of a reassembled PDU]"
"31","2018-08-23 02:59:39.499182","192.168.2.3","216.58.197.4","TLSv1.2","1434","Application Data [TCP segment of a reassembled PDU]"
"32","2018-08-23 02:59:39.499332","192.168.2.3","216.58.197.4","TCP","1434","34325  >  443 [ACK] Seq=14571 Ack=39 Win=661 Len=1368 TSval=8186159 TSecr=601209504 [TCP segment of a reassembled PDU]"
"33","2018-08-23 02:59:39.499502","192.168.2.3","216.58.197.4","TLSv1.2","1434","Application Data [TCP segment of a reassembled PDU]"
"34","2018-08-23 02:59:39.499622","192.168.2.3","216.58.197.4","TLSv1.2","1434","Application Data [TCP segment of a reassembled PDU]"
"35","2018-08-23 02:59:39.500092","192.168.2.3","216.58.197.4","TCP","1434","34325  >  443 [ACK] Seq=18675 Ack=39 Win=661 Len=1368 TSval=8186159 TSecr=601209504 [TCP segment of a reassembled PDU]"
"36","2018-08-23 02:59:39.500344","192.168.2.3","216.58.197.4","TLSv1.2","1434","Application Data [TCP segment of a reassembled PDU]"
"37","2018-08-23 02:59:39.500347","192.168.2.3","216.58.197.4","TLSv1.2","1434","Application Data [TCP segment of a reassembled PDU]"
"38","2018-08-23 02:59:39.500437","192.168.2.3","216.58.197.4","TCP","1434","34325  >  443 [ACK] Seq=22779 Ack=39 Win=661 Len=1368 TSval=8186159 TSecr=601209504 [TCP segment of a reassembled PDU]"
"39","2018-08-23 02:59:39.500802","192.168.2.3","216.58.197.4","TLSv1.2","1434","Application Data [TCP segment of a reassembled PDU]"
"40","2018-08-23 02:59:39.500804","192.168.2.3","216.58.197.4","TLSv1.2","1434","Application Data [TCP segment of a reassembled PDU]"
"41","2018-08-23 02:59:39.501102","192.168.2.3","216.58.197.4","TCP","1434","34325  >  443 [ACK] Seq=26883 Ack=39 Win=661 Len=1368 TSval=8186159 TSecr=601209505 [TCP segment of a reassembled PDU]"
"42","2018-08-23 02:59:39.501327","192.168.2.3","216.58.197.4","TLSv1.2","1434","Application Data [TCP segment of a reassembled PDU]"
"49","2018-08-23 02:59:39.505437","192.168.2.3","216.58.197.4","TLSv1.2","1434","Application Data [TCP segment of a reassembled PDU]"
"50","2018-08-23 02:59:39.505440","192.168.2.3","216.58.197.4","TCP","1434","34325  >  443 [ACK] Seq=30987 Ack=39 Win=661 Len=1368 TSval=8186159 TSecr=601209517 [TCP segment of a reassembled PDU]"
"52","2018-08-23 02:59:39.505792","192.168.2.3","216.58.197.4","TLSv1.2","1434","Application Data [TCP segment of a reassembled PDU]"
"53","2018-08-23 02:59:39.505795","192.168.2.3","216.58.197.4","TCP","1434","34325  >  443 [ACK] Seq=33723 Ack=39 Win=661 Len=1368 TSval=8186159 TSecr=601209517 [TCP segment of a reassembled PDU]"
"54","2018-08-23 02:59:39.505924","192.168.2.3","216.58.197.4","TLSv1.2","1434","Application Data [TCP segment of a reassembled PDU]"
"55","2018-08-23 02:59:39.506169","192.168.2.3","216.58.197.4","TCP","1434","34325  >  443 [ACK] Seq=36459 Ack=39 Win=661 Len=1368 TSval=8186159 TSecr=601209517 [TCP segment of a reassembled PDU]"
"56","2018-08-23 02:59:39.509212","192.168.2.3","216.58.197.4","TLSv1.2","1434","Application Data [TCP segment of a reassembled PDU]"
"57","2018-08-23 02:59:39.509215","192.168.2.3","216.58.197.4","TLSv1.2","1434","Application Data [TCP segment of a reassembled PDU]"
"62","2018-08-23 02:59:39.518517","192.168.2.3","216.58.197.4","TCP","1434","34325  >  443 [ACK] Seq=40563 Ack=39 Win=661 Len=1368 TSval=8186159 TSecr=601209517 [TCP segment of a reassembled PDU]"
"63","2018-08-23 02:59:39.518706","192.168.2.3","216.58.197.4","TLSv1.2","1434","Application Data [TCP segment of a reassembled PDU]"
"64","2018-08-23 02:59:39.518953","192.168.2.3","216.58.197.4","TLSv1.2","1434","Application Data [TCP segment of a reassembled PDU]"
"65","2018-08-23 02:59:39.519265","192.168.2.3","216.58.197.4","TCP","1434","34325  >  443 [ACK] Seq=44667 Ack=39 Win=661 Len=1368 TSval=8186159 TSecr=601209518 [TCP segment of a reassembled PDU]"
"66","2018-08-23 02:59:39.519268","192.168.2.3","216.58.197.4","TLSv1.2","1434","Application Data [TCP segment of a reassembled PDU]"
"67","2018-08-23 02:59:39.519684","192.168.2.3","216.58.197.4","TLSv1.2","1434","Application Data [TCP segment of a reassembled PDU]"
"68","2018-08-23 02:59:39.519687","192.168.2.3","216.58.197.4","TCP","1434","34325  >  443 [ACK] Seq=48771 Ack=39 Win=661 Len=1368 TSval=8186160 TSecr=601209518 [TCP segment of a reassembled PDU]"
"69","2018-08-23 02:59:39.521197","192.168.2.3","216.58.197.4","TLSv1.2","1434","Application Data [TCP segment of a reassembled PDU]"
"70","2018-08-23 02:59:39.521597","192.168.2.3","216.58.197.4","TLSv1.2","1434","Application Data [TCP segment of a reassembled PDU]"
"71","2018-08-23 02:59:39.521848","192.168.2.3","216.58.197.4","TCP","1434","34325  >  443 [ACK] Seq=52875 Ack=39 Win=661 Len=1368 TSval=8186161 TSecr=601209519 [TCP segment of a reassembled PDU]"
"72","2018-08-23 02:59:39.522054","192.168.2.3","216.58.197.4","TLSv1.2","1434","Application Data [TCP segment of a reassembled PDU]"
"73","2018-08-23 02:59:39.522234","192.168.2.3","216.58.197.4","TLSv1.2","1434","Application Data [TCP segment of a reassembled PDU]"
"74","2018-08-23 02:59:39.522734","192.168.2.3","216.58.197.4","TCP","1434","34325  >  443 [ACK] Seq=56979 Ack=39 Win=661 Len=1368 TSval=8186161 TSecr=601209523 [TCP segment of a reassembled PDU]"
"75","2018-08-23 02:59:39.522737","192.168.2.3","216.58.197.4","TCP","1434","34325  >  443 [ACK] Seq=58347 Ack=39 Win=661 Len=1368 TSval=8186161 TSecr=601209523 [TCP segment of a reassembled PDU]"
"78","2018-08-23 02:59:39.523671","192.168.2.3","216.58.197.4","TLSv1.2","1434","Application Data, Application Data"
"81","2018-08-23 02:59:39.524421","192.168.2.3","216.58.197.4","TCP","1434","34325  >  443 [ACK] Seq=61083 Ack=39 Win=661 Len=1368 TSval=8186161 TSecr=601209524 [TCP segment of a reassembled PDU]"
"82","2018-08-23 02:59:39.524422","192.168.2.3","216.58.197.4","TLSv1.2","1434","Application Data [TCP segment of a reassembled PDU]"
"83","2018-08-23 02:59:39.524690","192.168.2.3","216.58.197.4","TLSv1.2","724","Application Data"
"89","2018-08-23 02:59:39.533544","192.168.2.3","216.58.197.4","TCP","1434","34325  >  443 [ACK] Seq=64477 Ack=39 Win=661 Len=1368 TSval=8186162 TSecr=601209542 [TCP segment of a reassembled PDU]"
"90","2018-08-23 02:59:39.533547","192.168.2.3","216.58.197.4","TCP","1434","34325  >  443 [ACK] Seq=65845 Ack=39 Win=661 Len=1368 TSval=8186162 TSecr=601209542 [TCP segment of a reassembled PDU]"
"91","2018-08-23 02:59:39.533548","192.168.2.3","216.58.197.4","TLSv1.2","212","Application Data"
"92","2018-08-23 02:59:39.533905","192.168.2.3","216.58.197.4","TCP","1434","34325  >  443 [ACK] Seq=67359 Ack=39 Win=661 Len=1368 TSval=8186162 TSecr=601209542 [TCP segment of a reassembled PDU]"
"93","2018-08-23 02:59:39.533906","192.168.2.3","216.58.197.4","TLSv1.2","155","Application Data"
"97","2018-08-23 02:59:39.626265","192.168.2.3","216.58.197.4","TCP","1434","34325  >  443 [ACK] Seq=68816 Ack=39 Win=661 Len=1368 TSval=8186171 TSecr=601209552 [TCP segment of a reassembled PDU]"
"98","2018-08-23 02:59:39.626831","192.168.2.3","216.58.197.4","TCP","1434","34325  >  443 [ACK] Seq=70184 Ack=39 Win=661 Len=1368 TSval=8186171 TSecr=601209552 [TCP segment of a reassembled PDU]"
"99","2018-08-23 02:59:39.626835","192.168.2.3","216.58.197.4","TLSv1.2","212","Application Data"
"100","2018-08-23 02:59:39.627084","192.168.2.3","216.58.197.4","TCP","1434","34325  >  443 [ACK] Seq=71698 Ack=39 Win=661 Len=1368 TSval=8186171 TSecr=601209552 [TCP segment of a reassembled PDU]"
"101","2018-08-23 02:59:39.627087","192.168.2.3","216.58.197.4","TLSv1.2","155","Application Data"
"105","2018-08-23 02:59:39.721804","192.168.2.3","216.58.197.4","TCP","1434","34325  >  443 [ACK] Seq=73155 Ack=39 Win=661 Len=1368 TSval=8186181 TSecr=601209685 [TCP segment of a reassembled PDU]"
"106","2018-08-23 02:59:39.721810","192.168.2.3","216.58.197.4","TCP","1434","34325  >  443 [ACK] Seq=74523 Ack=39 Win=661 Len=1368 TSval=8186181 TSecr=601209685 [TCP segment of a reassembled PDU]"
"107","2018-08-23 02:59:39.721811","192.168.2.3","216.58.197.4","TLSv1.2","212","Application Data"
"108","2018-08-23 02:59:39.722140","192.168.2.3","216.58.197.4","TCP","1434","34325  >  443 [ACK] Seq=76037 Ack=39 Win=661 Len=1368 TSval=8186181 TSecr=601209685 [TCP segment of a reassembled PDU]"
"109","2018-08-23 02:59:39.722144","192.168.2.3","216.58.197.4","TLSv1.2","155","Application Data"
"116","2018-08-23 02:59:39.803366","192.168.2.3","216.58.197.4","TCP","66","34325  >  443 [ACK] Seq=77494 Ack=326 Win=661 Len=0 TSval=8186189 TSecr=601209816"
"118","2018-08-23 02:59:39.818650","192.168.2.3","216.58.197.4","TCP","1434","34325  >  443 [ACK] Seq=77494 Ack=584 Win=661 Len=1368 TSval=8186190 TSecr=601209826 [TCP segment of a reassembled PDU]"
"119","2018-08-23 02:59:39.818657","192.168.2.3","216.58.197.4","TCP","1434","34325  >  443 [ACK] Seq=78862 Ack=584 Win=661 Len=1368 TSval=8186190 TSecr=601209826 [TCP segment of a reassembled PDU]"
"120","2018-08-23 02:59:39.818791","192.168.2.3","216.58.197.4","TLSv1.2","212","Application Data"
"121","2018-08-23 02:59:39.819117","192.168.2.3","216.58.197.4","TCP","1434","34325  >  443 [ACK] Seq=80376 Ack=584 Win=661 Len=1368 TSval=8186190 TSecr=601209826 [TCP segment of a reassembled PDU]"
"122","2018-08-23 02:59:39.819120","192.168.2.3","216.58.197.4","TLSv1.2","155","Application Data"
"126","2018-08-23 02:59:39.914368","192.168.2.3","216.58.197.4","TCP","1434","34325  >  443 [ACK] Seq=81833 Ack=584 Win=661 Len=1368 TSval=8186200 TSecr=601209837 [TCP segment of a reassembled PDU]"
"127","2018-08-23 02:59:39.921024","192.168.2.3","216.58.197.4","TCP","1434","34325  >  443 [ACK] Seq=83201 Ack=584 Win=661 Len=1368 TSval=8186200 TSecr=601209837 [TCP segment of a reassembled PDU]"
"128","2018-08-23 02:59:39.921028","192.168.2.3","216.58.197.4","TLSv1.2","212","Application Data"
"129","2018-08-23 02:59:39.921177","192.168.2.3","216.58.197.4","TCP","1434","34325  >  443 [ACK] Seq=84715 Ack=584 Win=661 Len=1368 TSval=8186200 TSecr=601209837 [TCP segment of a reassembled PDU]"
"130","2018-08-23 02:59:39.921180","192.168.2.3","216.58.197.4","TLSv1.2","155","Application Data"
"134","2018-08-23 02:59:39.959427","192.168.2.3","216.58.197.4","TCP","66","34325  >  443 [ACK] Seq=86172 Ack=800 Win=661 Len=0 TSval=8186205 TSecr=601209936"
"135","2018-08-23 02:59:40.010382","192.168.2.3","216.58.197.4","TCP","1434","34325  >  443 [ACK] Seq=86172 Ack=800 Win=661 Len=1368 TSval=8186210 TSecr=601209936 [TCP segment of a reassembled PDU]"
"136","2018-08-23 02:59:40.010698","192.168.2.3","216.58.197.4","TCP","1434","34325  >  443 [ACK] Seq=87540 Ack=800 Win=661 Len=1368 TSval=8186210 TSecr=601209936 [TCP segment of a reassembled PDU]"
"137","2018-08-23 02:59:40.010704","192.168.2.3","216.58.197.4","TLSv1.2","212","Application Data"
"138","2018-08-23 02:59:40.011115","192.168.2.3","216.58.197.4","TCP","1434","34325  >  443 [ACK] Seq=89054 Ack=800 Win=661 Len=1368 TSval=8186210 TSecr=601209936 [TCP segment of a reassembled PDU]"
"139","2018-08-23 02:59:40.011124","192.168.2.3","216.58.197.4","TLSv1.2","155","Application Data"
"144","2018-08-23 02:59:40.084484","192.168.2.3","216.58.197.4","TCP","66","34325  >  443 [ACK] Seq=90511 Ack=1102 Win=661 Len=0 TSval=8186217 TSecr=601210093"
"145","2018-08-23 02:59:40.106381","192.168.2.3","216.58.197.4","TCP","1434","34325  >  443 [ACK] Seq=90511 Ack=1102 Win=661 Len=1368 TSval=8186219 TSecr=601210093 [TCP segment of a reassembled PDU]"
"146","2018-08-23 02:59:40.106824","192.168.2.3","216.58.197.4","TCP","1434","34325  >  443 [ACK] Seq=91879 Ack=1102 Win=661 Len=1368 TSval=8186219 TSecr=601210093 [TCP segment of a reassembled PDU]"
"147","2018-08-23 02:59:40.106827","192.168.2.3","216.58.197.4","TLSv1.2","212","Application Data"
"148","2018-08-23 02:59:40.107086","192.168.2.3","216.58.197.4","TCP","1434","34325  >  443 [ACK] Seq=93393 Ack=1102 Win=661 Len=1368 TSval=8186219 TSecr=601210093 [TCP segment of a reassembled PDU]"
"149","2018-08-23 02:59:40.107089","192.168.2.3","216.58.197.4","TLSv1.2","155","Application Data"
"153","2018-08-23 02:59:40.202683","192.168.2.3","216.58.197.4","TCP","1434","34325  >  443 [ACK] Seq=94850 Ack=1102 Win=661 Len=1368 TSval=8186229 TSecr=601210125 [TCP segment of a reassembled PDU]"
"154","2018-08-23 02:59:40.202893","192.168.2.3","216.58.197.4","TCP","1434","34325  >  443 [ACK] Seq=96218 Ack=1102 Win=661 Len=1368 TSval=8186229 TSecr=601210125 [TCP segment of a reassembled PDU]"
"155","2018-08-23 02:59:40.202895","192.168.2.3","216.58.197.4","TLSv1.2","212","Application Data"
"156","2018-08-23 02:59:40.202896","192.168.2.3","216.58.197.4","TCP","1434","34325  >  443 [ACK] Seq=97732 Ack=1102 Win=661 Len=1368 TSval=8186229 TSecr=601210125 [TCP segment of a reassembled PDU]"
"157","2018-08-23 02:59:40.203097","192.168.2.3","216.58.197.4","TLSv1.2","155","Application Data"
"161","2018-08-23 02:59:40.297068","192.168.2.3","216.58.197.4","TCP","1434","34325  >  443 [ACK] Seq=99189 Ack=1102 Win=661 Len=1368 TSval=8186238 TSecr=601210221 [TCP segment of a reassembled PDU]"
"162","2018-08-23 02:59:40.297323","192.168.2.3","216.58.197.4","TCP","1434","34325  >  443 [ACK] Seq=100557 Ack=1102 Win=661 Len=1368 TSval=8186238 TSecr=601210221 [TCP segment of a reassembled PDU]"
"163","2018-08-23 02:59:40.297325","192.168.2.3","216.58.197.4","TLSv1.2","212","Application Data"
"164","2018-08-23 02:59:40.297825","192.168.2.3","216.58.197.4","TCP","1434","34325  >  443 [ACK] Seq=102071 Ack=1102 Win=661 Len=1368 TSval=8186239 TSecr=601210221 [TCP segment of a reassembled PDU]"
"165","2018-08-23 02:59:40.297828","192.168.2.3","216.58.197.4","TLSv1.2","155","Application Data"
"169","2018-08-23 02:59:40.417489","192.168.2.3","216.58.197.4","TCP","1434","34325  >  443 [ACK] Seq=103528 Ack=1102 Win=661 Len=1368 TSval=8186248 TSecr=601210316 [TCP segment of a reassembled PDU]"
"170","2018-08-23 02:59:40.417495","192.168.2.3","216.58.197.4","TCP","1434","34325  >  443 [ACK] Seq=104896 Ack=1102 Win=661 Len=1368 TSval=8186248 TSecr=601210316 [TCP segment of a reassembled PDU]"
"171","2018-08-23 02:59:40.417586","192.168.2.3","216.58.197.4","TLSv1.2","212","Application Data"
"172","2018-08-23 02:59:40.417957","192.168.2.3","216.58.197.4","TCP","1434","34325  >  443 [ACK] Seq=106410 Ack=1102 Win=661 Len=1368 TSval=8186248 TSecr=601210316 [TCP segment of a reassembled PDU]"
"173","2018-08-23 02:59:40.417959","192.168.2.3","216.58.197.4","TLSv1.2","155","Application Data"
"177","2018-08-23 02:59:40.491846","192.168.2.3","216.58.197.4","TCP","1434","34325  >  443 [ACK] Seq=107867 Ack=1102 Win=661 Len=1368 TSval=8186258 TSecr=601210436 [TCP segment of a reassembled PDU]"
"178","2018-08-23 02:59:40.491852","192.168.2.3","216.58.197.4","TCP","1434","34325  >  443 [ACK] Seq=109235 Ack=1102 Win=661 Len=1368 TSval=8186258 TSecr=601210436 [TCP segment of a reassembled PDU]"
"179","2018-08-23 02:59:40.491853","192.168.2.3","216.58.197.4","TLSv1.2","212","Application Data"
"180","2018-08-23 02:59:40.492161","192.168.2.3","216.58.197.4","TCP","1434","34325  >  443 [ACK] Seq=110749 Ack=1102 Win=661 Len=1368 TSval=8186258 TSecr=601210436 [TCP segment of a reassembled PDU]"
"181","2018-08-23 02:59:40.492165","192.168.2.3","216.58.197.4","TLSv1.2","155","Application Data"
"185","2018-08-23 02:59:40.563658","192.168.2.3","216.58.197.4","TCP","1434","34325  >  443 [ACK] Seq=112206 Ack=1102 Win=661 Len=1368 TSval=8186265 TSecr=601210510 [TCP segment of a reassembled PDU]"
"186","2018-08-23 02:59:40.563952","192.168.2.3","216.58.197.4","TCP","1434","34325  >  443 [ACK] Seq=113574 Ack=1102 Win=661 Len=1368 TSval=8186265 TSecr=601210510 [TCP segment of a reassembled PDU]"
"187","2018-08-23 02:59:40.563954","192.168.2.3","216.58.197.4","TLSv1.2","212","Application Data"
"188","2018-08-23 02:59:40.564331","192.168.2.3","216.58.197.4","TCP","1434","34325  >  443 [ACK] Seq=115088 Ack=1102 Win=661 Len=1368 TSval=8186265 TSecr=601210510 [TCP segment of a reassembled PDU]"
"189","2018-08-23 02:59:40.564334","192.168.2.3","216.58.197.4","TLSv1.2","155","Application Data"
"193","2018-08-23 02:59:40.659915","192.168.2.3","216.58.197.4","TCP","1434","34325  >  443 [ACK] Seq=116545 Ack=1102 Win=661 Len=1368 TSval=8186275 TSecr=601210582 [TCP segment of a reassembled PDU]"
"194","2018-08-23 02:59:40.660191","192.168.2.3","216.58.197.4","TCP","1434","34325  >  443 [ACK] Seq=117913 Ack=1102 Win=661 Len=1368 TSval=8186275 TSecr=601210582 [TCP segment of a reassembled PDU]"
"195","2018-08-23 02:59:40.660195","192.168.2.3","216.58.197.4","TLSv1.2","212","Application Data"
"196","2018-08-23 02:59:40.661224","192.168.2.3","216.58.197.4","TCP","1434","34325  >  443 [ACK] Seq=119427 Ack=1102 Win=661 Len=1368 TSval=8186275 TSecr=601210582 [TCP segment of a reassembled PDU]"
"197","2018-08-23 02:59:40.661228","192.168.2.3","216.58.197.4","TLSv1.2","155","Application Data"
"201","2018-08-23 02:59:40.745778","192.168.2.3","216.58.197.4","TCP","1434","34325  >  443 [ACK] Seq=120884 Ack=1102 Win=661 Len=1368 TSval=8186283 TSecr=601210679 [TCP segment of a reassembled PDU]"
"202","2018-08-23 02:59:40.746076","192.168.2.3","216.58.197.4","TCP","1434","34325  >  443 [ACK] Seq=122252 Ack=1102 Win=661 Len=1368 TSval=8186283 TSecr=601210679 [TCP segment of a reassembled PDU]"
"203","2018-08-23 02:59:40.746079","192.168.2.3","216.58.197.4","TLSv1.2","212","Application Data"
"204","2018-08-23 02:59:40.746079","192.168.2.3","216.58.197.4","TCP","1434","34325  >  443 [ACK] Seq=123766 Ack=1102 Win=661 Len=1368 TSval=8186283 TSecr=601210679 [TCP segment of a reassembled PDU]"
"205","2018-08-23 02:59:40.746081","192.168.2.3","216.58.197.4","TLSv1.2","155","Application Data"
"210","2018-08-23 02:59:40.787071","192.168.2.3","216.58.197.4","TCP","66","34325  >  443 [ACK] Seq=125223 Ack=1136 Win=661 Len=0 TSval=8186288 TSecr=601210764"
"213","2018-08-23 02:59:40.801718","192.168.2.3","216.58.197.4","TCP","66","34325  >  443 [ACK] Seq=125223 Ack=1312 Win=661 Len=0 TSval=8186289 TSecr=601210814"
"214","2018-08-23 02:59:40.802027","192.168.2.3","216.58.197.4","TCP","66","34325  >  443 [ACK] Seq=125223 Ack=1553 Win=661 Len=0 TSval=8186289 TSecr=601210814"
"216","2018-08-23 02:59:40.803099","192.168.2.3","216.58.197.4","TCP","66","34325  >  443 [ACK] Seq=125223 Ack=1757 Win=661 Len=0 TSval=8186289 TSecr=601210816"
"218","2018-08-23 02:59:40.813688","192.168.2.3","216.58.197.4","TCP","66","34325  >  443 [ACK] Seq=125223 Ack=1850 Win=661 Len=0 TSval=8186290 TSecr=601210826"
"219","2018-08-23 02:59:40.851765","192.168.2.3","216.58.197.4","TCP","1434","34325  >  443 [ACK] Seq=125223 Ack=1850 Win=661 Len=1368 TSval=8186294 TSecr=601210826 [TCP segment of a reassembled PDU]"
"220","2018-08-23 02:59:40.852133","192.168.2.3","216.58.197.4","TCP","1434","34325  >  443 [ACK] Seq=126591 Ack=1850 Win=661 Len=1368 TSval=8186294 TSecr=601210826 [TCP segment of a reassembled PDU]"
"221","2018-08-23 02:59:40.852141","192.168.2.3","216.58.197.4","TLSv1.2","212","Application Data"
"222","2018-08-23 02:59:40.852289","192.168.2.3","216.58.197.4","TCP","1434","34325  >  443 [ACK] Seq=128105 Ack=1850 Win=661 Len=1368 TSval=8186294 TSecr=601210826 [TCP segment of a reassembled PDU]"
"223","2018-08-23 02:59:40.852296","192.168.2.3","216.58.197.4","TLSv1.2","155","Application Data"
"228","2018-08-23 02:59:40.904295","192.168.2.3","216.58.197.4","TCP","66","34325  >  443 [ACK] Seq=129562 Ack=2311 Win=661 Len=0 TSval=8186299 TSecr=601210916"
"229","2018-08-23 02:59:40.939509","192.168.2.3","216.58.197.4","TCP","1434","34325  >  443 [ACK] Seq=129562 Ack=2311 Win=661 Len=1368 TSval=8186303 TSecr=601210916 [TCP segment of a reassembled PDU]"
"230","2018-08-23 02:59:40.939868","192.168.2.3","216.58.197.4","TCP","1434","34325  >  443 [ACK] Seq=130930 Ack=2311 Win=661 Len=1368 TSval=8186303 TSecr=601210916 [TCP segment of a reassembled PDU]"
"231","2018-08-23 02:59:40.939883","192.168.2.3","216.58.197.4","TLSv1.2","212","Application Data"
"232","2018-08-23 02:59:40.939884","192.168.2.3","216.58.197.4","TCP","1434","34325  >  443 [ACK] Seq=132444 Ack=2311 Win=661 Len=1368 TSval=8186303 TSecr=601210916 [TCP segment of a reassembled PDU]"
"233","2018-08-23 02:59:40.940002","192.168.2.3","216.58.197.4","TLSv1.2","155","Application Data"
"237","2018-08-23 02:59:41.040001","192.168.2.3","216.58.197.4","TCP","1434","34325  >  443 [ACK] Seq=133901 Ack=2311 Win=661 Len=1368 TSval=8186313 TSecr=601210998 [TCP segment of a reassembled PDU]"
"238","2018-08-23 02:59:41.040400","192.168.2.3","216.58.197.4","TCP","1434","34325  >  443 [ACK] Seq=135269 Ack=2311 Win=661 Len=1368 TSval=8186313 TSecr=601210998 [TCP segment of a reassembled PDU]"
"239","2018-08-23 02:59:41.040403","192.168.2.3","216.58.197.4","TLSv1.2","212","Application Data"
"240","2018-08-23 02:59:41.040403","192.168.2.3","216.58.197.4","TCP","1434","34325  >  443 [ACK] Seq=136783 Ack=2311 Win=661 Len=1368 TSval=8186313 TSecr=601210998 [TCP segment of a reassembled PDU]"
"241","2018-08-23 02:59:41.040404","192.168.2.3","216.58.197.4","TLSv1.2","155","Application Data"
"247","2018-08-23 02:59:41.099328","192.168.2.3","216.58.197.4","TCP","66","34325  >  443 [ACK] Seq=138240 Ack=2744 Win=661 Len=0 TSval=8186319 TSecr=601211112"
"248","2018-08-23 02:59:41.129119","192.168.2.3","216.58.197.4","TCP","1434","34325  >  443 [ACK] Seq=138240 Ack=2744 Win=661 Len=1368 TSval=8186322 TSecr=601211112 [TCP segment of a reassembled PDU]"
"249","2018-08-23 02:59:41.129422","192.168.2.3","216.58.197.4","TCP","1434","34325  >  443 [ACK] Seq=139608 Ack=2744 Win=661 Len=1368 TSval=8186322 TSecr=601211112 [TCP segment of a reassembled PDU]"
"250","2018-08-23 02:59:41.129424","192.168.2.3","216.58.197.4","TLSv1.2","212","Application Data"
"251","2018-08-23 02:59:41.130456","192.168.2.3","216.58.197.4","TCP","1434","34325  >  443 [ACK] Seq=141122 Ack=2744 Win=661 Len=1368 TSval=8186322 TSecr=601211112 [TCP segment of a reassembled PDU]"
"252","2018-08-23 02:59:41.130460","192.168.2.3","216.58.197.4","TLSv1.2","155","Application Data"
"258","2018-08-23 02:59:41.189860","192.168.2.3","216.58.197.4","TCP","66","34325  >  443 [ACK] Seq=142579 Ack=2989 Win=661 Len=0 TSval=8186328 TSecr=601211199"
"260","2018-08-23 02:59:41.224118","192.168.2.3","216.58.197.4","TCP","1434","34325  >  443 [ACK] Seq=142579 Ack=2989 Win=661 Len=1368 TSval=8186331 TSecr=601211199 [TCP segment of a reassembled PDU]"
"261","2018-08-23 02:59:41.224622","192.168.2.3","216.58.197.4","TCP","1434","34325  >  443 [ACK] Seq=143947 Ack=2989 Win=661 Len=1368 TSval=8186331 TSecr=601211199 [TCP segment of a reassembled PDU]"
"262","2018-08-23 02:59:41.224624","192.168.2.3","216.58.197.4","TLSv1.2","212","Application Data"
"263","2018-08-23 02:59:41.226864","192.168.2.3","216.58.197.4","TCP","1434","34325  >  443 [ACK] Seq=145461 Ack=2989 Win=661 Len=1368 TSval=8186331 TSecr=601211199 [TCP segment of a reassembled PDU]"
"264","2018-08-23 02:59:41.226867","192.168.2.3","216.58.197.4","TLSv1.2","155","Application Data"
"270","2018-08-23 02:59:41.291882","192.168.2.3","216.58.197.4","TCP","66","34325  >  443 [ACK] Seq=146918 Ack=3398 Win=661 Len=0 TSval=8186338 TSecr=601211302"
"271","2018-08-23 02:59:41.321687","192.168.2.3","216.58.197.4","TCP","1434","34325  >  443 [ACK] Seq=146918 Ack=3398 Win=661 Len=1368 TSval=8186341 TSecr=601211302 [TCP segment of a reassembled PDU]"
"272","2018-08-23 02:59:41.321903","192.168.2.3","216.58.197.4","TCP","1434","34325  >  443 [ACK] Seq=148286 Ack=3398 Win=661 Len=1368 TSval=8186341 TSecr=601211302 [TCP segment of a reassembled PDU]"
"273","2018-08-23 02:59:41.321906","192.168.2.3","216.58.197.4","TLSv1.2","212","Application Data"
"274","2018-08-23 02:59:41.322192","192.168.2.3","216.58.197.4","TCP","1434","34325  >  443 [ACK] Seq=149800 Ack=3398 Win=661 Len=1368 TSval=8186341 TSecr=601211302 [TCP segment of a reassembled PDU]"
"275","2018-08-23 02:59:41.322195","192.168.2.3","216.58.197.4","TLSv1.2","155","Application Data"
"279","2018-08-23 02:59:41.386517","192.168.2.3","216.58.197.4","TCP","1434","34325  >  443 [ACK] Seq=151257 Ack=3398 Win=661 Len=1368 TSval=8186347 TSecr=601211340 [TCP segment of a reassembled PDU]"
"282","2018-08-23 02:59:41.386927","192.168.2.3","216.58.197.4","TCP","1434","34325  >  443 [ACK] Seq=152625 Ack=3398 Win=661 Len=1368 TSval=8186347 TSecr=601211340 [TCP segment of a reassembled PDU]"
"283","2018-08-23 02:59:41.386930","192.168.2.3","216.58.197.4","TLSv1.2","212","Application Data"
"284","2018-08-23 02:59:41.386931","192.168.2.3","216.58.197.4","TCP","1434","34325  >  443 [ACK] Seq=154139 Ack=3398 Win=661 Len=1368 TSval=8186347 TSecr=601211340 [TCP segment of a reassembled PDU]"
"285","2018-08-23 02:59:41.387062","192.168.2.3","216.58.197.4","TLSv1.2","155","Application Data"
"286","2018-08-23 02:59:41.388246","192.168.2.3","216.58.197.4","TCP","66","34325  >  443 [ACK] Seq=155596 Ack=3721 Win=661 Len=0 TSval=8186348 TSecr=601211400"
"290","2018-08-23 02:59:41.495968","192.168.2.3","216.58.197.4","TCP","1434","34325  >  443 [ACK] Seq=155596 Ack=3721 Win=661 Len=1368 TSval=8186358 TSecr=601211405 [TCP segment of a reassembled PDU]"
"291","2018-08-23 02:59:41.495983","192.168.2.3","216.58.197.4","TCP","1434","34325  >  443 [ACK] Seq=156964 Ack=3721 Win=661 Len=1368 TSval=8186358 TSecr=601211405 [TCP segment of a reassembled PDU]"
"292","2018-08-23 02:59:41.495985","192.168.2.3","216.58.197.4","TLSv1.2","212","Application Data"
"293","2018-08-23 02:59:41.496234","192.168.2.3","216.58.197.4","TCP","1434","34325  >  443 [ACK] Seq=158478 Ack=3721 Win=661 Len=1368 TSval=8186358 TSecr=601211405 [TCP segment of a reassembled PDU]"
"294","2018-08-23 02:59:41.496241","192.168.2.3","216.58.197.4","TLSv1.2","155","Application Data"
"300","2018-08-23 02:59:41.563114","192.168.2.3","216.58.197.4","TCP","66","34325  >  443 [ACK] Seq=159935 Ack=4281 Win=661 Len=0 TSval=8186365 TSecr=601211572"
"301","2018-08-23 02:59:41.578786","192.168.2.3","216.58.197.4","TCP","1434","34325  >  443 [ACK] Seq=159935 Ack=4281 Win=661 Len=1368 TSval=8186367 TSecr=601211572 [TCP segment of a reassembled PDU]"
"302","2018-08-23 02:59:41.581677","192.168.2.3","216.58.197.4","TCP","1434","34325  >  443 [ACK] Seq=161303 Ack=4281 Win=661 Len=1368 TSval=8186367 TSecr=601211572 [TCP segment of a reassembled PDU]"
"303","2018-08-23 02:59:41.581680","192.168.2.3","216.58.197.4","TLSv1.2","212","Application Data"
"304","2018-08-23 02:59:41.581681","192.168.2.3","216.58.197.4","TCP","1434","34325  >  443 [ACK] Seq=162817 Ack=4281 Win=661 Len=1368 TSval=8186367 TSecr=601211572 [TCP segment of a reassembled PDU]"
"305","2018-08-23 02:59:41.581923","192.168.2.3","216.58.197.4","TLSv1.2","155","Application Data"
"309","2018-08-23 02:59:41.672253","192.168.2.3","216.58.197.4","TCP","1434","34325  >  443 [ACK] Seq=164274 Ack=4281 Win=661 Len=1368 TSval=8186376 TSecr=601211600 [TCP segment of a reassembled PDU]"
"310","2018-08-23 02:59:41.672510","192.168.2.3","216.58.197.4","TCP","1434","34325  >  443 [ACK] Seq=165642 Ack=4281 Win=661 Len=1368 TSval=8186376 TSecr=601211600 [TCP segment of a reassembled PDU]"
"311","2018-08-23 02:59:41.672513","192.168.2.3","216.58.197.4","TLSv1.2","212","Application Data"
"312","2018-08-23 02:59:41.672951","192.168.2.3","216.58.197.4","TCP","1434","34325  >  443 [ACK] Seq=167156 Ack=4281 Win=661 Len=1368 TSval=8186376 TSecr=601211600 [TCP segment of a reassembled PDU]"
"313","2018-08-23 02:59:41.672954","192.168.2.3","216.58.197.4","TLSv1.2","155","Application Data"
"319","2018-08-23 02:59:41.748177","192.168.2.3","216.58.197.4","TCP","66","34325  >  443 [ACK] Seq=168613 Ack=4704 Win=661 Len=0 TSval=8186384 TSecr=601211749"
"320","2018-08-23 02:59:41.769885","192.168.2.3","216.58.197.4","TCP","1434","34325  >  443 [ACK] Seq=168613 Ack=4704 Win=661 Len=1368 TSval=8186386 TSecr=601211749 [TCP segment of a reassembled PDU]"
"321","2018-08-23 02:59:41.769889","192.168.2.3","216.58.197.4","TCP","1434","34325  >  443 [ACK] Seq=169981 Ack=4704 Win=661 Len=1368 TSval=8186386 TSecr=601211749 [TCP segment of a reassembled PDU]"
"322","2018-08-23 02:59:41.769890","192.168.2.3","216.58.197.4","TLSv1.2","212","Application Data"
"323","2018-08-23 02:59:41.770002","192.168.2.3","216.58.197.4","TCP","1434","34325  >  443 [ACK] Seq=171495 Ack=4704 Win=661 Len=1368 TSval=8186386 TSecr=601211749 [TCP segment of a reassembled PDU]"
"324","2018-08-23 02:59:41.770249","192.168.2.3","216.58.197.4","TLSv1.2","155","Application Data"
"330","2018-08-23 02:59:41.813863","192.168.2.3","216.58.197.4","TCP","66","34325  >  443 [ACK] Seq=172952 Ack=5101 Win=661 Len=0 TSval=8186390 TSecr=601211816"
"331","2018-08-23 02:59:41.866534","192.168.2.3","216.58.197.4","TCP","1434","34325  >  443 [ACK] Seq=172952 Ack=5101 Win=661 Len=1368 TSval=8186395 TSecr=601211816 [TCP segment of a reassembled PDU]"
"332","2018-08-23 02:59:41.866712","192.168.2.3","216.58.197.4","TCP","1434","34325  >  443 [ACK] Seq=174320 Ack=5101 Win=661 Len=1368 TSval=8186395 TSecr=601211816 [TCP segment of a reassembled PDU]"
"333","2018-08-23 02:59:41.866716","192.168.2.3","216.58.197.4","TLSv1.2","212","Application Data"
"334","2018-08-23 02:59:41.867131","192.168.2.3","216.58.197.4","TCP","1434","34325  >  443 [ACK] Seq=175834 Ack=5101 Win=661 Len=1368 TSval=8186395 TSecr=601211816 [TCP segment of a reassembled PDU]"
"335","2018-08-23 02:59:41.867134","192.168.2.3","216.58.197.4","TLSv1.2","155","Application Data"
"340","2018-08-23 02:59:41.974612","192.168.2.3","216.58.197.4","TCP","1434","34325  >  443 [ACK] Seq=177291 Ack=5176 Win=661 Len=1368 TSval=8186406 TSecr=601211975 [TCP segment of a reassembled PDU]"
"341","2018-08-23 02:59:41.974617","192.168.2.3","216.58.197.4","TCP","1434","34325  >  443 [ACK] Seq=178659 Ack=5176 Win=661 Len=1368 TSval=8186406 TSecr=601211975 [TCP segment of a reassembled PDU]"
"342","2018-08-23 02:59:41.974618","192.168.2.3","216.58.197.4","TLSv1.2","212","Application Data"
"343","2018-08-23 02:59:41.975009","192.168.2.3","216.58.197.4","TLSv1.2","1364","Application Data"
"346","2018-08-23 02:59:42.088653","192.168.2.3","216.58.197.4","TCP","1434","34325  >  443 [ACK] Seq=181471 Ack=5176 Win=661 Len=1368 TSval=8186418 TSecr=601211993 [TCP segment of a reassembled PDU]"
"347","2018-08-23 02:59:42.089088","192.168.2.3","216.58.197.4","TCP","1434","34325  >  443 [ACK] Seq=182839 Ack=5176 Win=661 Len=1368 TSval=8186418 TSecr=601211993 [TCP segment of a reassembled PDU]"
"348","2018-08-23 02:59:42.089090","192.168.2.3","216.58.197.4","TLSv1.2","212","Application Data"
"349","2018-08-23 02:59:42.089553","192.168.2.3","216.58.197.4","TCP","1434","34325  >  443 [ACK] Seq=184353 Ack=5176 Win=661 Len=1368 TSval=8186418 TSecr=601211993 [TCP segment of a reassembled PDU]"
"350","2018-08-23 02:59:42.089554","192.168.2.3","216.58.197.4","TLSv1.2","155","Application Data"
"354","2018-08-23 02:59:42.184796","192.168.2.3","216.58.197.4","TCP","1434","34325  >  443 [ACK] Seq=185810 Ack=5176 Win=661 Len=1368 TSval=8186427 TSecr=601212107 [TCP segment of a reassembled PDU]"
"355","2018-08-23 02:59:42.185217","192.168.2.3","216.58.197.4","TCP","1434","34325  >  443 [ACK] Seq=187178 Ack=5176 Win=661 Len=1368 TSval=8186427 TSecr=601212107 [TCP segment of a reassembled PDU]"
"356","2018-08-23 02:59:42.185219","192.168.2.3","216.58.197.4","TLSv1.2","212","Application Data"
"357","2018-08-23 02:59:42.185220","192.168.2.3","216.58.197.4","TCP","1434","34325  >  443 [ACK] Seq=188692 Ack=5176 Win=661 Len=1368 TSval=8186427 TSecr=601212107 [TCP segment of a reassembled PDU]"
"358","2018-08-23 02:59:42.185330","192.168.2.3","216.58.197.4","TLSv1.2","155","Application Data"
"364","2018-08-23 02:59:42.237741","192.168.2.3","216.58.197.4","TCP","66","34325  >  443 [ACK] Seq=190149 Ack=5532 Win=661 Len=0 TSval=8186433 TSecr=601212247"
"365","2018-08-23 02:59:42.298514","192.168.2.3","216.58.197.4","TCP","1434","34325  >  443 [ACK] Seq=190149 Ack=5532 Win=661 Len=1368 TSval=8186438 TSecr=601212247 [TCP segment of a reassembled PDU]"
"366","2018-08-23 02:59:42.298519","192.168.2.3","216.58.197.4","TCP","1434","34325  >  443 [ACK] Seq=191517 Ack=5532 Win=661 Len=1368 TSval=8186438 TSecr=601212247 [TCP segment of a reassembled PDU]"
"367","2018-08-23 02:59:42.298520","192.168.2.3","216.58.197.4","TLSv1.2","212","Application Data"
"368","2018-08-23 02:59:42.298712","192.168.2.3","216.58.197.4","TCP","1434","34325  >  443 [ACK] Seq=193031 Ack=5532 Win=661 Len=1368 TSval=8186438 TSecr=601212247 [TCP segment of a reassembled PDU]"
"369","2018-08-23 02:59:42.298824","192.168.2.3","216.58.197.4","TLSv1.2","155","Application Data"
"375","2018-08-23 02:59:42.356657","192.168.2.3","216.58.197.4","TCP","66","34325  >  443 [ACK] Seq=194488 Ack=5767 Win=661 Len=0 TSval=8186444 TSecr=601212369"
"376","2018-08-23 02:59:42.390825","192.168.2.3","216.58.197.4","TCP","1434","34325  >  443 [ACK] Seq=194488 Ack=5767 Win=661 Len=1368 TSval=8186448 TSecr=601212369 [TCP segment of a reassembled PDU]"
"377","2018-08-23 02:59:42.390830","192.168.2.3","216.58.197.4","TCP","1434","34325  >  443 [ACK] Seq=195856 Ack=5767 Win=661 Len=1368 TSval=8186448 TSecr=601212369 [TCP segment of a reassembled PDU]"
"378","2018-08-23 02:59:42.390831","192.168.2.3","216.58.197.4","TLSv1.2","212","Application Data"
"379","2018-08-23 02:59:42.390949","192.168.2.3","216.58.197.4","TCP","1434","34325  >  443 [ACK] Seq=197370 Ack=5767 Win=661 Len=1368 TSval=8186448 TSecr=601212369 [TCP segment of a reassembled PDU]"
"380","2018-08-23 02:59:42.391181","192.168.2.3","216.58.197.4","TLSv1.2","155","Application Data"
"384","2018-08-23 02:59:42.484593","192.168.2.3","216.58.197.4","TCP","1434","34325  >  443 [ACK] Seq=198827 Ack=5767 Win=661 Len=1368 TSval=8186457 TSecr=601212409 [TCP segment of a reassembled PDU]"
"385","2018-08-23 02:59:42.486527","192.168.2.3","216.58.197.4","TCP","1434","34325  >  443 [ACK] Seq=200195 Ack=5767 Win=661 Len=1368 TSval=8186457 TSecr=601212409 [TCP segment of a reassembled PDU]"
"386","2018-08-23 02:59:42.486544","192.168.2.3","216.58.197.4","TLSv1.2","212","Application Data"
"387","2018-08-23 02:59:42.486879","192.168.2.3","216.58.197.4","TCP","1434","34325  >  443 [ACK] Seq=201709 Ack=5767 Win=661 Len=1368 TSval=8186457 TSecr=601212409 [TCP segment of a reassembled PDU]"
"388","2018-08-23 02:59:42.486881","192.168.2.3","216.58.197.4","TLSv1.2","155","Application Data"
"394","2018-08-23 02:59:42.540364","192.168.2.3","216.58.197.4","TCP","66","34325  >  443 [ACK] Seq=203166 Ack=6283 Win=661 Len=0 TSval=8186463 TSecr=601212549"
"395","2018-08-23 02:59:42.558260","192.168.2.3","35.186.224.46","TLSv1.2","108","Application Data"
"399","2018-08-23 02:59:42.572984","192.168.2.3","216.58.197.4","TCP","66","34325  >  443 [ACK] Seq=203166 Ack=7164 Win=661 Len=0 TSval=8186466 TSecr=601212584"
"400","2018-08-23 02:59:42.601826","192.168.2.3","216.58.197.4","TCP","1434","34325  >  443 [ACK] Seq=203166 Ack=7164 Win=661 Len=1368 TSval=8186469 TSecr=601212584 [TCP segment of a reassembled PDU]"
"401","2018-08-23 02:59:42.602271","192.168.2.3","216.58.197.4","TCP","1434","34325  >  443 [ACK] Seq=204534 Ack=7164 Win=661 Len=1368 TSval=8186469 TSecr=601212584 [TCP segment of a reassembled PDU]"
"402","2018-08-23 02:59:42.602273","192.168.2.3","216.58.197.4","TLSv1.2","212","Application Data"
"403","2018-08-23 02:59:42.602274","192.168.2.3","216.58.197.4","TCP","1434","34325  >  443 [ACK] Seq=206048 Ack=7164 Win=661 Len=1368 TSval=8186469 TSecr=601212584 [TCP segment of a reassembled PDU]"
"404","2018-08-23 02:59:42.602448","192.168.2.3","216.58.197.4","TLSv1.2","155","Application Data"
"405","2018-08-23 02:59:42.602786","192.168.2.3","216.58.197.4","TLSv1.2","634","Application Data"
"407","2018-08-23 02:59:42.606340","192.168.2.3","35.186.224.46","TCP","66","49072  >  443 [ACK] Seq=43 Ack=40 Win=1146 Len=0 TSval=8186469 TSecr=3643084036"
"414","2018-08-23 02:59:42.816902","192.168.2.3","216.58.197.4","TCP","66","34325  >  443 [ACK] Seq=208073 Ack=7272 Win=661 Len=0 TSval=8186490 TSecr=601212816"
"415","2018-08-23 02:59:42.867046","192.168.2.3","216.58.197.14","TCP","66","41280  >  443 [ACK] Seq=1 Ack=1 Win=296 Len=0 TSval=8186496 TSecr=4102705274"
"418","2018-08-23 02:59:42.893912","192.168.2.3","192.168.2.1","TCP","183","8009  >  53029 [PSH, ACK] Seq=118 Ack=235 Win=277 Len=117 TSval=8186498 TSecr=2319115097 [TCP segment of a reassembled PDU]"
"423","2018-08-23 02:59:43.166603","192.168.2.3","216.58.197.4","TCP","66","34325  >  443 [ACK] Seq=208073 Ack=9296 Win=661 Len=0 TSval=8186525 TSecr=601213154"
"433","2018-08-23 02:59:43.186047","192.168.2.3","216.58.197.4","TCP","66","34325  >  443 [ACK] Seq=208073 Ack=11041 Win=661 Len=0 TSval=8186527 TSecr=601213196"
"434","2018-08-23 02:59:43.186050","192.168.2.3","216.58.197.4","TCP","66","34325  >  443 [ACK] Seq=208073 Ack=12868 Win=661 Len=0 TSval=8186527 TSecr=601213197"
"435","2018-08-23 02:59:43.186051","192.168.2.3","216.58.197.4","TCP","66","34325  >  443 [ACK] Seq=208073 Ack=14601 Win=661 Len=0 TSval=8186527 TSecr=601213197"
"436","2018-08-23 02:59:43.187762","192.168.2.3","216.58.197.4","TCP","66","34325  >  443 [ACK] Seq=208073 Ack=17437 Win=661 Len=0 TSval=8186528 TSecr=601213197"
"439","2018-08-23 02:59:43.205499","192.168.2.3","216.58.197.4","TCP","66","34325  >  443 [ACK] Seq=208073 Ack=19069 Win=661 Len=0 TSval=8186529 TSecr=601213197"
