"No.","Time","Source","Destination","Protocol","Length","Info"
"2","2018-08-23 02:34:23.956853","192.168.2.3","192.168.2.1","TCP","183","8009  >  53029 [PSH, ACK] Seq=1 Ack=118 Win=277 Len=117 TSval=8034606 TSecr=2317599907 [TCP segment of a reassembled PDU]"
"6","2018-08-23 02:34:26.319834","192.168.2.3","216.58.197.4","TLSv1.2","156","Application Data"
"7","2018-08-23 02:34:26.320095","192.168.2.3","216.58.197.4","TLSv1.2","104","Application Data"
"11","2018-08-23 02:34:26.341264","192.168.2.3","216.58.197.4","TLSv1.2","159","Application Data"
"12","2018-08-23 02:34:26.341340","192.168.2.3","216.58.197.4","TCP","1434","34236  >  443 [ACK] Seq=222 Ack=1 Win=2363 Len=1368 TSval=8034844 TSecr=762222456 [TCP segment of a reassembled PDU]"
"13","2018-08-23 02:34:26.341523","192.168.2.3","216.58.197.4","TCP","1434","34236  >  443 [ACK] Seq=1590 Ack=1 Win=2363 Len=1368 TSval=8034844 TSecr=762222456 [TCP segment of a reassembled PDU]"
"14","2018-08-23 02:34:26.341652","192.168.2.3","216.58.197.4","TLSv1.2","212","Application Data"
"15","2018-08-23 02:34:26.341926","192.168.2.3","216.58.197.4","TCP","1434","34236  >  443 [ACK] Seq=3104 Ack=1 Win=2363 Len=1368 TSval=8034844 TSecr=762222456 [TCP segment of a reassembled PDU]"
"16","2018-08-23 02:34:26.341930","192.168.2.3","216.58.197.4","TLSv1.2","361","Application Data"
"17","2018-08-23 02:34:26.341931","192.168.2.3","216.58.197.4","TCP","1434","34236  >  443 [ACK] Seq=4767 Ack=1 Win=2363 Len=1368 TSval=8034844 TSecr=762222456 [TCP segment of a reassembled PDU]"
"18","2018-08-23 02:34:26.342340","192.168.2.3","216.58.197.4","TCP","1434","34236  >  443 [ACK] Seq=6135 Ack=1 Win=2363 Len=1368 TSval=8034844 TSecr=762222456 [TCP segment of a reassembled PDU]"
"22","2018-08-23 02:34:26.347786","192.168.2.3","216.58.197.4","TLSv1.2","1434","Application Data [TCP segment of a reassembled PDU]"
"23","2018-08-23 02:34:26.348174","192.168.2.3","216.58.197.4","TCP","1434","34236  >  443 [ACK] Seq=8871 Ack=1 Win=2363 Len=1368 TSval=8034845 TSecr=762241123 [TCP segment of a reassembled PDU]"
"24","2018-08-23 02:34:26.348177","192.168.2.3","216.58.197.4","TLSv1.2","1434","Application Data [TCP segment of a reassembled PDU]"
"25","2018-08-23 02:34:26.348535","192.168.2.3","216.58.197.4","TCP","1434","34236  >  443 [ACK] Seq=11607 Ack=1 Win=2363 Len=1368 TSval=8034845 TSecr=762241123 [TCP segment of a reassembled PDU]"
"28","2018-08-23 02:34:26.352722","192.168.2.3","216.58.197.4","TLSv1.2","1434","Application Data [TCP segment of a reassembled PDU]"
"29","2018-08-23 02:34:26.352725","192.168.2.3","216.58.197.4","TCP","1434","34236  >  443 [ACK] Seq=14343 Ack=39 Win=2363 Len=1368 TSval=8034845 TSecr=762241124 [TCP segment of a reassembled PDU]"
"30","2018-08-23 02:34:26.353127","192.168.2.3","216.58.197.4","TLSv1.2","1434","Application Data [TCP segment of a reassembled PDU]"
"31","2018-08-23 02:34:26.353574","192.168.2.3","216.58.197.4","TCP","1434","34236  >  443 [ACK] Seq=17079 Ack=39 Win=2363 Len=1368 TSval=8034845 TSecr=762241145 [TCP segment of a reassembled PDU]"
"32","2018-08-23 02:34:26.353577","192.168.2.3","216.58.197.4","TLSv1.2","1434","Application Data [TCP segment of a reassembled PDU]"
"33","2018-08-23 02:34:26.353941","192.168.2.3","216.58.197.4","TCP","1434","34236  >  443 [ACK] Seq=19815 Ack=39 Win=2363 Len=1368 TSval=8034845 TSecr=762241145 [TCP segment of a reassembled PDU]"
"34","2018-08-23 02:34:26.353944","192.168.2.3","216.58.197.4","TLSv1.2","1434","Application Data [TCP segment of a reassembled PDU]"
"35","2018-08-23 02:34:26.354070","192.168.2.3","216.58.197.4","TCP","1434","34236  >  443 [ACK] Seq=22551 Ack=39 Win=2363 Len=1368 TSval=8034845 TSecr=762241145 [TCP segment of a reassembled PDU]"
"36","2018-08-23 02:34:26.354419","192.168.2.3","216.58.197.4","TLSv1.2","1434","Application Data [TCP segment of a reassembled PDU]"
"37","2018-08-23 02:34:26.354422","192.168.2.3","216.58.197.4","TCP","1434","34236  >  443 [ACK] Seq=25287 Ack=39 Win=2363 Len=1368 TSval=8034845 TSecr=762241145 [TCP segment of a reassembled PDU]"
"38","2018-08-23 02:34:26.355801","192.168.2.3","216.58.197.4","TLSv1.2","1434","Application Data [TCP segment of a reassembled PDU]"
"39","2018-08-23 02:34:26.356561","192.168.2.3","216.58.197.4","TCP","1434","34236  >  443 [ACK] Seq=28023 Ack=39 Win=2363 Len=1368 TSval=8034846 TSecr=762241151 [TCP segment of a reassembled PDU]"
"40","2018-08-23 02:34:26.356949","192.168.2.3","216.58.197.4","TLSv1.2","1434","Application Data [TCP segment of a reassembled PDU]"
"41","2018-08-23 02:34:26.356951","192.168.2.3","216.58.197.4","TCP","1434","34236  >  443 [ACK] Seq=30759 Ack=39 Win=2363 Len=1368 TSval=8034846 TSecr=762241151 [TCP segment of a reassembled PDU]"
"43","2018-08-23 02:34:26.357153","192.168.2.3","216.58.197.4","TLSv1.2","1434","Application Data [TCP segment of a reassembled PDU]"
"45","2018-08-23 02:34:26.357398","192.168.2.3","216.58.197.4","TCP","1434","34236  >  443 [ACK] Seq=33495 Ack=39 Win=2363 Len=1368 TSval=8034846 TSecr=762241151 [TCP segment of a reassembled PDU]"
"52","2018-08-23 02:34:26.363809","192.168.2.3","216.58.197.4","TLSv1.2","1434","Application Data [TCP segment of a reassembled PDU]"
"53","2018-08-23 02:34:26.364034","192.168.2.3","216.58.197.4","TCP","1434","34236  >  443 [ACK] Seq=36231 Ack=39 Win=2363 Len=1368 TSval=8034846 TSecr=762241156 [TCP segment of a reassembled PDU]"
"54","2018-08-23 02:34:26.364037","192.168.2.3","216.58.197.4","TLSv1.2","1434","Application Data [TCP segment of a reassembled PDU]"
"55","2018-08-23 02:34:26.364197","192.168.2.3","216.58.197.4","TCP","1434","34236  >  443 [ACK] Seq=38967 Ack=39 Win=2363 Len=1368 TSval=8034846 TSecr=762241156 [TCP segment of a reassembled PDU]"
"56","2018-08-23 02:34:26.364409","192.168.2.3","216.58.197.4","TLSv1.2","1434","Application Data [TCP segment of a reassembled PDU]"
"57","2018-08-23 02:34:26.364729","192.168.2.3","216.58.197.4","TCP","1434","34236  >  443 [ACK] Seq=41703 Ack=39 Win=2363 Len=1368 TSval=8034846 TSecr=762241156 [TCP segment of a reassembled PDU]"
"58","2018-08-23 02:34:26.364732","192.168.2.3","216.58.197.4","TLSv1.2","1434","Application Data [TCP segment of a reassembled PDU]"
"59","2018-08-23 02:34:26.365192","192.168.2.3","216.58.197.4","TCP","1434","34236  >  443 [ACK] Seq=44439 Ack=39 Win=2363 Len=1368 TSval=8034846 TSecr=762241157 [TCP segment of a reassembled PDU]"
"60","2018-08-23 02:34:26.365194","192.168.2.3","216.58.197.4","TLSv1.2","1434","Application Data [TCP segment of a reassembled PDU]"
"61","2018-08-23 02:34:26.365352","192.168.2.3","216.58.197.4","TCP","1434","34236  >  443 [ACK] Seq=47175 Ack=39 Win=2363 Len=1368 TSval=8034846 TSecr=762241157 [TCP segment of a reassembled PDU]"
"62","2018-08-23 02:34:26.365682","192.168.2.3","216.58.197.4","TLSv1.2","1434","Application Data [TCP segment of a reassembled PDU]"
"63","2018-08-23 02:34:26.365983","192.168.2.3","216.58.197.4","TCP","1434","34236  >  443 [ACK] Seq=49911 Ack=39 Win=2363 Len=1368 TSval=8034846 TSecr=762241158 [TCP segment of a reassembled PDU]"
"64","2018-08-23 02:34:26.366240","192.168.2.3","216.58.197.4","TLSv1.2","1434","Application Data [TCP segment of a reassembled PDU]"
"65","2018-08-23 02:34:26.366243","192.168.2.3","216.58.197.4","TCP","1434","34236  >  443 [ACK] Seq=52647 Ack=39 Win=2363 Len=1368 TSval=8034846 TSecr=762241158 [TCP segment of a reassembled PDU]"
"66","2018-08-23 02:34:26.366634","192.168.2.3","216.58.197.4","TLSv1.2","1434","Application Data [TCP segment of a reassembled PDU]"
"67","2018-08-23 02:34:26.366636","192.168.2.3","216.58.197.4","TCP","1434","34236  >  443 [ACK] Seq=55383 Ack=39 Win=2363 Len=1368 TSval=8034847 TSecr=762241159 [TCP segment of a reassembled PDU]"
"68","2018-08-23 02:34:26.366748","192.168.2.3","216.58.197.4","TLSv1.2","1434","Application Data [TCP segment of a reassembled PDU]"
"69","2018-08-23 02:34:26.366955","192.168.2.3","216.58.197.4","TCP","1434","34236  >  443 [ACK] Seq=58119 Ack=39 Win=2363 Len=1368 TSval=8034847 TSecr=762241160 [TCP segment of a reassembled PDU]"
"70","2018-08-23 02:34:26.367140","192.168.2.3","216.58.197.4","TLSv1.2","410","Application Data"
"81","2018-08-23 02:34:26.395332","192.168.2.3","216.58.197.4","TCP","1434","34236  >  443 [ACK] Seq=59831 Ack=39 Win=2363 Len=1368 TSval=8034850 TSecr=762241170 [TCP segment of a reassembled PDU]"
"82","2018-08-23 02:34:26.395898","192.168.2.3","216.58.197.4","TCP","1434","34236  >  443 [ACK] Seq=61199 Ack=39 Win=2363 Len=1368 TSval=8034850 TSecr=762241170 [TCP segment of a reassembled PDU]"
"83","2018-08-23 02:34:26.395905","192.168.2.3","216.58.197.4","TLSv1.2","212","Application Data"
"84","2018-08-23 02:34:26.395906","192.168.2.3","216.58.197.4","TCP","1434","34236  >  443 [ACK] Seq=62713 Ack=39 Win=2363 Len=1368 TSval=8034850 TSecr=762241170 [TCP segment of a reassembled PDU]"
"85","2018-08-23 02:34:26.396081","192.168.2.3","216.58.197.4","TLSv1.2","155","Application Data"
"91","2018-08-23 02:34:26.412238","192.168.2.3","216.58.197.4","TCP","66","34236  >  443 [ACK] Seq=64170 Ack=385 Win=2363 Len=0 TSval=8034851 TSecr=762241210"
"93","2018-08-23 02:34:26.425183","192.168.2.3","216.58.197.4","TCP","66","34236  >  443 [ACK] Seq=64170 Ack=894 Win=2363 Len=0 TSval=8034853 TSecr=762241210"
"95","2018-08-23 02:34:26.505616","192.168.2.3","216.58.197.4","TCP","1434","34236  >  443 [ACK] Seq=64170 Ack=894 Win=2363 Len=1368 TSval=8034860 TSecr=762241210 [TCP segment of a reassembled PDU]"
"96","2018-08-23 02:34:26.505723","192.168.2.3","216.58.197.4","TCP","1434","34236  >  443 [ACK] Seq=65538 Ack=894 Win=2363 Len=1368 TSval=8034860 TSecr=762241210 [TCP segment of a reassembled PDU]"
"97","2018-08-23 02:34:26.505828","192.168.2.3","216.58.197.4","TLSv1.2","212","Application Data"
"98","2018-08-23 02:34:26.506044","192.168.2.3","216.58.197.4","TCP","1434","34236  >  443 [ACK] Seq=67052 Ack=894 Win=2363 Len=1368 TSval=8034860 TSecr=762241210 [TCP segment of a reassembled PDU]"
"99","2018-08-23 02:34:26.506046","192.168.2.3","216.58.197.4","TLSv1.2","80","Application Data"
"103","2018-08-23 02:34:26.633102","192.168.2.3","216.58.197.4","TCP","66","34236  >  443 [ACK] Seq=68434 Ack=1076 Win=2363 Len=0 TSval=8034870 TSecr=762241321"
"104","2018-08-23 02:34:26.633234","192.168.2.3","216.58.197.4","TCP","1434","34236  >  443 [ACK] Seq=68434 Ack=1076 Win=2363 Len=1368 TSval=8034870 TSecr=762241321 [TCP segment of a reassembled PDU]"
"105","2018-08-23 02:34:26.633424","192.168.2.3","216.58.197.4","TCP","1434","34236  >  443 [ACK] Seq=69802 Ack=1076 Win=2363 Len=1368 TSval=8034870 TSecr=762241321 [TCP segment of a reassembled PDU]"
"106","2018-08-23 02:34:26.633426","192.168.2.3","216.58.197.4","TLSv1.2","212","Application Data"
"107","2018-08-23 02:34:26.633661","192.168.2.3","216.58.197.4","TCP","1434","34236  >  443 [ACK] Seq=71316 Ack=1076 Win=2363 Len=1368 TSval=8034870 TSecr=762241321 [TCP segment of a reassembled PDU]"
"108","2018-08-23 02:34:26.633663","192.168.2.3","216.58.197.4","TLSv1.2","155","Application Data"
"113","2018-08-23 02:34:26.678658","192.168.2.3","216.58.197.4","TCP","66","34236  >  443 [ACK] Seq=72773 Ack=1378 Win=2363 Len=0 TSval=8034878 TSecr=762241476"
"114","2018-08-23 02:34:26.718017","192.168.2.3","216.58.197.4","TCP","1434","34236  >  443 [ACK] Seq=72773 Ack=1378 Win=2363 Len=1368 TSval=8034882 TSecr=762241476 [TCP segment of a reassembled PDU]"
"115","2018-08-23 02:34:26.718386","192.168.2.3","216.58.197.4","TCP","1434","34236  >  443 [ACK] Seq=74141 Ack=1378 Win=2363 Len=1368 TSval=8034882 TSecr=762241476 [TCP segment of a reassembled PDU]"
"116","2018-08-23 02:34:26.718390","192.168.2.3","216.58.197.4","TLSv1.2","212","Application Data"
"117","2018-08-23 02:34:26.718793","192.168.2.3","216.58.197.4","TCP","1434","34236  >  443 [ACK] Seq=75655 Ack=1378 Win=2363 Len=1368 TSval=8034882 TSecr=762241476 [TCP segment of a reassembled PDU]"
"118","2018-08-23 02:34:26.718795","192.168.2.3","216.58.197.4","TLSv1.2","155","Application Data"
"122","2018-08-23 02:34:26.810838","192.168.2.3","216.58.197.4","TCP","1434","34236  >  443 [ACK] Seq=77112 Ack=1378 Win=2363 Len=1368 TSval=8034891 TSecr=762241522 [TCP segment of a reassembled PDU]"
"123","2018-08-23 02:34:26.811182","192.168.2.3","216.58.197.4","TCP","1434","34236  >  443 [ACK] Seq=78480 Ack=1378 Win=2363 Len=1368 TSval=8034891 TSecr=762241522 [TCP segment of a reassembled PDU]"
"124","2018-08-23 02:34:26.811185","192.168.2.3","216.58.197.4","TLSv1.2","212","Application Data"
"125","2018-08-23 02:34:26.811186","192.168.2.3","216.58.197.4","TCP","1434","34236  >  443 [ACK] Seq=79994 Ack=1378 Win=2363 Len=1368 TSval=8034891 TSecr=762241522 [TCP segment of a reassembled PDU]"
"126","2018-08-23 02:34:26.811314","192.168.2.3","216.58.197.4","TLSv1.2","155","Application Data"
"134","2018-08-23 02:34:26.917459","192.168.2.3","216.58.197.4","TCP","1434","34236  >  443 [ACK] Seq=81451 Ack=1378 Win=2363 Len=1368 TSval=8034902 TSecr=762241614 [TCP segment of a reassembled PDU]"
"135","2018-08-23 02:34:26.917815","192.168.2.3","216.58.197.4","TCP","1434","34236  >  443 [ACK] Seq=82819 Ack=1378 Win=2363 Len=1368 TSval=8034902 TSecr=762241614 [TCP segment of a reassembled PDU]"
"136","2018-08-23 02:34:26.917819","192.168.2.3","216.58.197.4","TLSv1.2","212","Application Data"
"137","2018-08-23 02:34:26.918236","192.168.2.3","216.58.197.4","TCP","1434","34236  >  443 [ACK] Seq=84333 Ack=1378 Win=2363 Len=1368 TSval=8034902 TSecr=762241614 [TCP segment of a reassembled PDU]"
"138","2018-08-23 02:34:26.918239","192.168.2.3","216.58.197.4","TLSv1.2","155","Application Data"
"141","2018-08-23 02:34:26.970072","192.168.2.3","203.211.199.120","TLSv1.2","789","Application Data"
"146","2018-08-23 02:34:26.997572","192.168.2.3","203.211.199.120","TCP","66","52050  >  443 [ACK] Seq=724 Ack=1449 Win=982 Len=0 TSval=8034910 TSecr=1194109982"
"147","2018-08-23 02:34:27.001140","192.168.2.3","203.211.199.120","TCP","66","52050  >  443 [ACK] Seq=724 Ack=2897 Win=982 Len=0 TSval=8034910 TSecr=1194109982"
"148","2018-08-23 02:34:27.001353","192.168.2.3","203.211.199.120","TCP","66","52050  >  443 [ACK] Seq=724 Ack=5232 Win=969 Len=0 TSval=8034910 TSecr=1194109982"
"149","2018-08-23 02:34:27.036058","192.168.2.3","216.58.197.4","TCP","1434","34236  >  443 [ACK] Seq=85790 Ack=1378 Win=2363 Len=1368 TSval=8034914 TSecr=762241721 [TCP segment of a reassembled PDU]"
"150","2018-08-23 02:34:27.036479","192.168.2.3","216.58.197.4","TCP","1434","34236  >  443 [ACK] Seq=87158 Ack=1378 Win=2363 Len=1368 TSval=8034914 TSecr=762241721 [TCP segment of a reassembled PDU]"
"151","2018-08-23 02:34:27.036490","192.168.2.3","216.58.197.4","TLSv1.2","212","Application Data"
"152","2018-08-23 02:34:27.036610","192.168.2.3","216.58.197.4","TCP","1434","34236  >  443 [ACK] Seq=88672 Ack=1378 Win=2363 Len=1368 TSval=8034914 TSecr=762241721 [TCP segment of a reassembled PDU]"
"153","2018-08-23 02:34:27.036615","192.168.2.3","216.58.197.4","TLSv1.2","155","Application Data"
"157","2018-08-23 02:34:27.109431","192.168.2.3","216.58.197.4","TCP","1434","34236  >  443 [ACK] Seq=90129 Ack=1378 Win=2363 Len=1368 TSval=8034921 TSecr=762241840 [TCP segment of a reassembled PDU]"
"158","2018-08-23 02:34:27.109876","192.168.2.3","216.58.197.4","TCP","1434","34236  >  443 [ACK] Seq=91497 Ack=1378 Win=2363 Len=1368 TSval=8034921 TSecr=762241840 [TCP segment of a reassembled PDU]"
"159","2018-08-23 02:34:27.109881","192.168.2.3","216.58.197.4","TLSv1.2","212","Application Data"
"160","2018-08-23 02:34:27.110183","192.168.2.3","216.58.197.4","TCP","1434","34236  >  443 [ACK] Seq=93011 Ack=1378 Win=2363 Len=1368 TSval=8034921 TSecr=762241840 [TCP segment of a reassembled PDU]"
"161","2018-08-23 02:34:27.110187","192.168.2.3","216.58.197.4","TLSv1.2","155","Application Data"
"165","2018-08-23 02:34:27.226237","192.168.2.3","216.58.197.4","TCP","1434","34236  >  443 [ACK] Seq=94468 Ack=1378 Win=2363 Len=1368 TSval=8034933 TSecr=762241914 [TCP segment of a reassembled PDU]"
"166","2018-08-23 02:34:27.228459","192.168.2.3","216.58.197.4","TCP","1434","34236  >  443 [ACK] Seq=95836 Ack=1378 Win=2363 Len=1368 TSval=8034933 TSecr=762241914 [TCP segment of a reassembled PDU]"
"167","2018-08-23 02:34:27.228463","192.168.2.3","216.58.197.4","TLSv1.2","212","Application Data"
"168","2018-08-23 02:34:27.228464","192.168.2.3","216.58.197.4","TCP","1434","34236  >  443 [ACK] Seq=97350 Ack=1378 Win=2363 Len=1368 TSval=8034933 TSecr=762241914 [TCP segment of a reassembled PDU]"
"169","2018-08-23 02:34:27.228645","192.168.2.3","216.58.197.4","TLSv1.2","155","Application Data"
"173","2018-08-23 02:34:27.301979","192.168.2.3","216.58.197.4","TCP","1434","34236  >  443 [ACK] Seq=98807 Ack=1378 Win=2363 Len=1368 TSval=8034940 TSecr=762242033 [TCP segment of a reassembled PDU]"
"174","2018-08-23 02:34:27.302431","192.168.2.3","216.58.197.4","TCP","1434","34236  >  443 [ACK] Seq=100175 Ack=1378 Win=2363 Len=1368 TSval=8034940 TSecr=762242033 [TCP segment of a reassembled PDU]"
"175","2018-08-23 02:34:27.302433","192.168.2.3","216.58.197.4","TLSv1.2","212","Application Data"
"176","2018-08-23 02:34:27.302434","192.168.2.3","216.58.197.4","TCP","1434","34236  >  443 [ACK] Seq=101689 Ack=1378 Win=2363 Len=1368 TSval=8034940 TSecr=762242033 [TCP segment of a reassembled PDU]"
"177","2018-08-23 02:34:27.302435","192.168.2.3","216.58.197.4","TLSv1.2","155","Application Data"
"181","2018-08-23 02:34:27.400756","192.168.2.3","216.58.197.4","TCP","1434","34236  >  443 [ACK] Seq=103146 Ack=1378 Win=2363 Len=1368 TSval=8034950 TSecr=762242106 [TCP segment of a reassembled PDU]"
"182","2018-08-23 02:34:27.400898","192.168.2.3","216.58.197.4","TCP","1434","34236  >  443 [ACK] Seq=104514 Ack=1378 Win=2363 Len=1368 TSval=8034950 TSecr=762242106 [TCP segment of a reassembled PDU]"
"183","2018-08-23 02:34:27.400901","192.168.2.3","216.58.197.4","TLSv1.2","212","Application Data"
"184","2018-08-23 02:34:27.401295","192.168.2.3","216.58.197.4","TCP","1434","34236  >  443 [ACK] Seq=106028 Ack=1378 Win=2363 Len=1368 TSval=8034950 TSecr=762242106 [TCP segment of a reassembled PDU]"
"185","2018-08-23 02:34:27.401298","192.168.2.3","216.58.197.4","TLSv1.2","155","Application Data"
"190","2018-08-23 02:34:27.412341","192.168.2.3","216.58.197.4","TCP","66","34236  >  443 [ACK] Seq=107485 Ack=1674 Win=2363 Len=0 TSval=8034951 TSecr=762242210"
"192","2018-08-23 02:34:27.427829","192.168.2.3","216.58.197.4","TCP","66","34236  >  443 [ACK] Seq=107485 Ack=1927 Win=2363 Len=0 TSval=8034953 TSecr=762242222"
"193","2018-08-23 02:34:27.487854","192.168.2.3","216.58.197.4","TCP","1434","34236  >  443 [ACK] Seq=107485 Ack=1927 Win=2363 Len=1368 TSval=8034959 TSecr=762242222 [TCP segment of a reassembled PDU]"
"194","2018-08-23 02:34:27.488284","192.168.2.3","216.58.197.4","TCP","1434","34236  >  443 [ACK] Seq=108853 Ack=1927 Win=2363 Len=1368 TSval=8034959 TSecr=762242222 [TCP segment of a reassembled PDU]"
"195","2018-08-23 02:34:27.488286","192.168.2.3","216.58.197.4","TLSv1.2","212","Application Data"
"196","2018-08-23 02:34:27.492024","192.168.2.3","216.58.197.4","TCP","1434","34236  >  443 [ACK] Seq=110367 Ack=1927 Win=2363 Len=1368 TSval=8034959 TSecr=762242222 [TCP segment of a reassembled PDU]"
"197","2018-08-23 02:34:27.492221","192.168.2.3","216.58.197.4","TLSv1.2","155","Application Data"
"203","2018-08-23 02:34:27.540883","192.168.2.3","216.58.197.4","TCP","66","34236  >  443 [ACK] Seq=111824 Ack=2183 Win=2363 Len=0 TSval=8034964 TSecr=762242339"
"204","2018-08-23 02:34:27.541032","192.168.2.3","216.58.197.4","TCP","66","34236  >  443 [ACK] Seq=111824 Ack=2413 Win=2363 Len=0 TSval=8034964 TSecr=762242339"
"205","2018-08-23 02:34:27.580947","192.168.2.3","216.58.197.4","TCP","1434","34236  >  443 [ACK] Seq=111824 Ack=2413 Win=2363 Len=1368 TSval=8034968 TSecr=762242339 [TCP segment of a reassembled PDU]"
"206","2018-08-23 02:34:27.580967","192.168.2.3","216.58.197.4","TCP","1434","34236  >  443 [ACK] Seq=113192 Ack=2413 Win=2363 Len=1368 TSval=8034968 TSecr=762242339 [TCP segment of a reassembled PDU]"
"207","2018-08-23 02:34:27.580968","192.168.2.3","216.58.197.4","TLSv1.2","212","Application Data"
"208","2018-08-23 02:34:27.581281","192.168.2.3","216.58.197.4","TCP","1434","34236  >  443 [ACK] Seq=114706 Ack=2413 Win=2363 Len=1368 TSval=8034968 TSecr=762242339 [TCP segment of a reassembled PDU]"
"209","2018-08-23 02:34:27.581299","192.168.2.3","216.58.197.4","TLSv1.2","155","Application Data"
"213","2018-08-23 02:34:27.678062","192.168.2.3","216.58.197.4","TCP","1434","34236  >  443 [ACK] Seq=116163 Ack=2413 Win=2363 Len=1368 TSval=8034978 TSecr=762242385 [TCP segment of a reassembled PDU]"
"214","2018-08-23 02:34:27.678393","192.168.2.3","216.58.197.4","TCP","1434","34236  >  443 [ACK] Seq=117531 Ack=2413 Win=2363 Len=1368 TSval=8034978 TSecr=762242385 [TCP segment of a reassembled PDU]"
"215","2018-08-23 02:34:27.678395","192.168.2.3","216.58.197.4","TLSv1.2","212","Application Data"
"216","2018-08-23 02:34:27.678890","192.168.2.3","216.58.197.4","TCP","1434","34236  >  443 [ACK] Seq=119045 Ack=2413 Win=2363 Len=1368 TSval=8034978 TSecr=762242385 [TCP segment of a reassembled PDU]"
"217","2018-08-23 02:34:27.678894","192.168.2.3","216.58.197.4","TLSv1.2","155","Application Data"
"223","2018-08-23 02:34:27.729749","192.168.2.3","216.58.197.4","TCP","66","34236  >  443 [ACK] Seq=120502 Ack=2856 Win=2363 Len=0 TSval=8034983 TSecr=762242525"
"224","2018-08-23 02:34:27.774079","192.168.2.3","216.58.197.4","TCP","1434","34236  >  443 [ACK] Seq=120502 Ack=2856 Win=2363 Len=1368 TSval=8034988 TSecr=762242525 [TCP segment of a reassembled PDU]"
"225","2018-08-23 02:34:27.774457","192.168.2.3","216.58.197.4","TCP","1434","34236  >  443 [ACK] Seq=121870 Ack=2856 Win=2363 Len=1368 TSval=8034988 TSecr=762242525 [TCP segment of a reassembled PDU]"
"226","2018-08-23 02:34:27.774460","192.168.2.3","216.58.197.4","TLSv1.2","212","Application Data"
"227","2018-08-23 02:34:27.774461","192.168.2.3","216.58.197.4","TCP","1434","34236  >  443 [ACK] Seq=123384 Ack=2856 Win=2363 Len=1368 TSval=8034988 TSecr=762242525 [TCP segment of a reassembled PDU]"
"228","2018-08-23 02:34:27.774462","192.168.2.3","216.58.197.4","TLSv1.2","155","Application Data"
"234","2018-08-23 02:34:27.827054","192.168.2.3","216.58.197.4","TCP","66","34236  >  443 [ACK] Seq=124841 Ack=3295 Win=2363 Len=0 TSval=8034993 TSecr=762242625"
"235","2018-08-23 02:34:27.845461","192.168.2.3","216.58.197.4","TCP","1434","34236  >  443 [ACK] Seq=124841 Ack=3295 Win=2363 Len=1368 TSval=8034995 TSecr=762242625 [TCP segment of a reassembled PDU]"
"236","2018-08-23 02:34:27.845827","192.168.2.3","216.58.197.4","TCP","1434","34236  >  443 [ACK] Seq=126209 Ack=3295 Win=2363 Len=1368 TSval=8034995 TSecr=762242625 [TCP segment of a reassembled PDU]"
"237","2018-08-23 02:34:27.845830","192.168.2.3","216.58.197.4","TLSv1.2","212","Application Data"
"238","2018-08-23 02:34:27.846172","192.168.2.3","216.58.197.4","TCP","1434","34236  >  443 [ACK] Seq=127723 Ack=3295 Win=2363 Len=1368 TSval=8034995 TSecr=762242625 [TCP segment of a reassembled PDU]"
"239","2018-08-23 02:34:27.846175","192.168.2.3","216.58.197.4","TLSv1.2","155","Application Data"
"249","2018-08-23 02:34:27.942849","192.168.2.3","216.58.197.4","TCP","1434","34236  >  443 [ACK] Seq=129180 Ack=3295 Win=2363 Len=1368 TSval=8035004 TSecr=762242649 [TCP segment of a reassembled PDU]"
"250","2018-08-23 02:34:27.945197","192.168.2.3","216.58.197.4","TCP","1434","34236  >  443 [ACK] Seq=130548 Ack=3295 Win=2363 Len=1368 TSval=8035004 TSecr=762242649 [TCP segment of a reassembled PDU]"
"251","2018-08-23 02:34:27.945203","192.168.2.3","216.58.197.4","TLSv1.2","212","Application Data"
"252","2018-08-23 02:34:27.945204","192.168.2.3","216.58.197.4","TCP","1434","34236  >  443 [ACK] Seq=132062 Ack=3295 Win=2363 Len=1368 TSval=8035004 TSecr=762242649 [TCP segment of a reassembled PDU]"
"253","2018-08-23 02:34:27.945237","192.168.2.3","216.58.197.4","TLSv1.2","155","Application Data"
"257","2018-08-23 02:34:28.039208","192.168.2.3","216.58.197.4","TCP","1434","34236  >  443 [ACK] Seq=133519 Ack=3295 Win=2363 Len=1368 TSval=8035014 TSecr=762242748 [TCP segment of a reassembled PDU]"
"258","2018-08-23 02:34:28.039510","192.168.2.3","216.58.197.4","TCP","1434","34236  >  443 [ACK] Seq=134887 Ack=3295 Win=2363 Len=1368 TSval=8035014 TSecr=762242748 [TCP segment of a reassembled PDU]"
"259","2018-08-23 02:34:28.039514","192.168.2.3","216.58.197.4","TLSv1.2","212","Application Data"
"260","2018-08-23 02:34:28.039882","192.168.2.3","216.58.197.4","TCP","1434","34236  >  443 [ACK] Seq=136401 Ack=3295 Win=2363 Len=1368 TSval=8035014 TSecr=762242748 [TCP segment of a reassembled PDU]"
"261","2018-08-23 02:34:28.039885","192.168.2.3","216.58.197.4","TLSv1.2","155","Application Data"
"267","2018-08-23 02:34:28.092664","192.168.2.3","216.58.197.4","TCP","66","34236  >  443 [ACK] Seq=137858 Ack=3621 Win=2363 Len=0 TSval=8035019 TSecr=762242886"
"268","2018-08-23 02:34:28.133535","192.168.2.3","216.58.197.4","TCP","1434","34236  >  443 [ACK] Seq=137858 Ack=3621 Win=2363 Len=1368 TSval=8035024 TSecr=762242886 [TCP segment of a reassembled PDU]"
"269","2018-08-23 02:34:28.133866","192.168.2.3","216.58.197.4","TCP","1434","34236  >  443 [ACK] Seq=139226 Ack=3621 Win=2363 Len=1368 TSval=8035024 TSecr=762242886 [TCP segment of a reassembled PDU]"
"270","2018-08-23 02:34:28.133870","192.168.2.3","216.58.197.4","TLSv1.2","212","Application Data"
"271","2018-08-23 02:34:28.134246","192.168.2.3","216.58.197.4","TCP","1434","34236  >  443 [ACK] Seq=140740 Ack=3621 Win=2363 Len=1368 TSval=8035024 TSecr=762242886 [TCP segment of a reassembled PDU]"
"272","2018-08-23 02:34:28.134249","192.168.2.3","216.58.197.4","TLSv1.2","155","Application Data"
"278","2018-08-23 02:34:28.187555","192.168.2.3","216.58.197.4","TCP","66","34236  >  443 [ACK] Seq=142197 Ack=3923 Win=2363 Len=0 TSval=8035029 TSecr=762242985"
"279","2018-08-23 02:34:28.230259","192.168.2.3","216.58.197.4","TCP","1434","34236  >  443 [ACK] Seq=142197 Ack=3923 Win=2363 Len=1368 TSval=8035033 TSecr=762242985 [TCP segment of a reassembled PDU]"
"280","2018-08-23 02:34:28.230561","192.168.2.3","216.58.197.4","TCP","1434","34236  >  443 [ACK] Seq=143565 Ack=3923 Win=2363 Len=1368 TSval=8035033 TSecr=762242985 [TCP segment of a reassembled PDU]"
"281","2018-08-23 02:34:28.230564","192.168.2.3","216.58.197.4","TLSv1.2","212","Application Data"
"282","2018-08-23 02:34:28.230564","192.168.2.3","216.58.197.4","TCP","1434","34236  >  443 [ACK] Seq=145079 Ack=3923 Win=2363 Len=1368 TSval=8035033 TSecr=762242985 [TCP segment of a reassembled PDU]"
"283","2018-08-23 02:34:28.230656","192.168.2.3","216.58.197.4","TLSv1.2","155","Application Data"
"287","2018-08-23 02:34:28.346332","192.168.2.3","216.58.197.4","TCP","1434","34236  >  443 [ACK] Seq=146536 Ack=3923 Win=2363 Len=1368 TSval=8035045 TSecr=762243034 [TCP segment of a reassembled PDU]"
"288","2018-08-23 02:34:28.346654","192.168.2.3","216.58.197.4","TCP","1434","34236  >  443 [ACK] Seq=147904 Ack=3923 Win=2363 Len=1368 TSval=8035045 TSecr=762243034 [TCP segment of a reassembled PDU]"
"289","2018-08-23 02:34:28.346665","192.168.2.3","216.58.197.4","TLSv1.2","212","Application Data"
"290","2018-08-23 02:34:28.347157","192.168.2.3","216.58.197.4","TCP","1434","34236  >  443 [ACK] Seq=149418 Ack=3923 Win=2363 Len=1368 TSval=8035045 TSecr=762243034 [TCP segment of a reassembled PDU]"
"291","2018-08-23 02:34:28.347161","192.168.2.3","216.58.197.4","TLSv1.2","155","Application Data"
"297","2018-08-23 02:34:28.430610","192.168.2.3","216.58.197.4","TCP","66","34236  >  443 [ACK] Seq=150875 Ack=4107 Win=2363 Len=0 TSval=8035053 TSecr=762243210"
"298","2018-08-23 02:34:28.446837","192.168.2.3","216.58.197.4","TCP","1434","34236  >  443 [ACK] Seq=150875 Ack=4107 Win=2363 Len=1368 TSval=8035055 TSecr=762243210 [TCP segment of a reassembled PDU]"
"299","2018-08-23 02:34:28.446843","192.168.2.3","216.58.197.4","TCP","1434","34236  >  443 [ACK] Seq=152243 Ack=4107 Win=2363 Len=1368 TSval=8035055 TSecr=762243210 [TCP segment of a reassembled PDU]"
"300","2018-08-23 02:34:28.446844","192.168.2.3","216.58.197.4","TLSv1.2","212","Application Data"
"301","2018-08-23 02:34:28.447170","192.168.2.3","216.58.197.4","TCP","1434","34236  >  443 [ACK] Seq=153757 Ack=4107 Win=2363 Len=1368 TSval=8035055 TSecr=762243210 [TCP segment of a reassembled PDU]"
"302","2018-08-23 02:34:28.447173","192.168.2.3","216.58.197.4","TLSv1.2","155","Application Data"
"306","2018-08-23 02:34:28.518530","192.168.2.3","216.58.197.4","TCP","1434","34236  >  443 [ACK] Seq=155214 Ack=4107 Win=2363 Len=1368 TSval=8035062 TSecr=762243250 [TCP segment of a reassembled PDU]"
"307","2018-08-23 02:34:28.518788","192.168.2.3","216.58.197.4","TCP","1434","34236  >  443 [ACK] Seq=156582 Ack=4107 Win=2363 Len=1368 TSval=8035062 TSecr=762243250 [TCP segment of a reassembled PDU]"
"308","2018-08-23 02:34:28.518791","192.168.2.3","216.58.197.4","TLSv1.2","212","Application Data"
"309","2018-08-23 02:34:28.519289","192.168.2.3","216.58.197.4","TCP","1434","34236  >  443 [ACK] Seq=158096 Ack=4107 Win=2363 Len=1368 TSval=8035062 TSecr=762243250 [TCP segment of a reassembled PDU]"
"310","2018-08-23 02:34:28.519292","192.168.2.3","216.58.197.4","TLSv1.2","155","Application Data"
"316","2018-08-23 02:34:28.531889","192.168.2.3","216.58.197.4","TCP","66","34236  >  443 [ACK] Seq=159553 Ack=4335 Win=2363 Len=0 TSval=8035063 TSecr=762243328"
"317","2018-08-23 02:34:28.634627","192.168.2.3","216.58.197.4","TCP","1434","34236  >  443 [ACK] Seq=159553 Ack=4335 Win=2363 Len=1368 TSval=8035074 TSecr=762243328 [TCP segment of a reassembled PDU]"
"318","2018-08-23 02:34:28.634913","192.168.2.3","216.58.197.4","TCP","1434","34236  >  443 [ACK] Seq=160921 Ack=4335 Win=2363 Len=1368 TSval=8035074 TSecr=762243328 [TCP segment of a reassembled PDU]"
"319","2018-08-23 02:34:28.634916","192.168.2.3","216.58.197.4","TLSv1.2","212","Application Data"
"320","2018-08-23 02:34:28.634917","192.168.2.3","216.58.197.4","TCP","1434","34236  >  443 [ACK] Seq=162435 Ack=4335 Win=2363 Len=1368 TSval=8035074 TSecr=762243328 [TCP segment of a reassembled PDU]"
"321","2018-08-23 02:34:28.635018","192.168.2.3","216.58.197.4","TLSv1.2","155","Application Data"
"327","2018-08-23 02:34:28.697770","192.168.2.3","216.58.197.4","TCP","66","34236  >  443 [ACK] Seq=163892 Ack=4766 Win=2363 Len=0 TSval=8035080 TSecr=762243493"
"328","2018-08-23 02:34:28.732152","192.168.2.3","216.58.197.4","TCP","1434","34236  >  443 [ACK] Seq=163892 Ack=4766 Win=2363 Len=1368 TSval=8035083 TSecr=762243493 [TCP segment of a reassembled PDU]"
"329","2018-08-23 02:34:28.732157","192.168.2.3","216.58.197.4","TCP","1434","34236  >  443 [ACK] Seq=165260 Ack=4766 Win=2363 Len=1368 TSval=8035083 TSecr=762243493 [TCP segment of a reassembled PDU]"
"330","2018-08-23 02:34:28.732158","192.168.2.3","216.58.197.4","TLSv1.2","212","Application Data"
"331","2018-08-23 02:34:28.732445","192.168.2.3","216.58.197.4","TCP","1434","34236  >  443 [ACK] Seq=166774 Ack=4766 Win=2363 Len=1368 TSval=8035083 TSecr=762243493 [TCP segment of a reassembled PDU]"
"332","2018-08-23 02:34:28.732446","192.168.2.3","216.58.197.4","TLSv1.2","155","Application Data"
"335","2018-08-23 02:34:28.838278","192.168.2.3","216.58.197.4","TCP","1434","34236  >  443 [ACK] Seq=168231 Ack=4766 Win=2363 Len=1368 TSval=8035094 TSecr=762243536 [TCP segment of a reassembled PDU]"
"336","2018-08-23 02:34:28.838283","192.168.2.3","216.58.197.4","TCP","1434","34236  >  443 [ACK] Seq=169599 Ack=4766 Win=2363 Len=1368 TSval=8035094 TSecr=762243536 [TCP segment of a reassembled PDU]"
"337","2018-08-23 02:34:28.838284","192.168.2.3","216.58.197.4","TLSv1.2","212","Application Data"
"338","2018-08-23 02:34:28.839012","192.168.2.3","216.58.197.4","TCP","1434","34236  >  443 [ACK] Seq=171113 Ack=4766 Win=2363 Len=1368 TSval=8035094 TSecr=762243536 [TCP segment of a reassembled PDU]"
"339","2018-08-23 02:34:28.839016","192.168.2.3","216.58.197.4","TLSv1.2","155","Application Data"
"345","2018-08-23 02:34:28.898045","192.168.2.3","216.58.197.4","TCP","66","34236  >  443 [ACK] Seq=172570 Ack=5222 Win=2363 Len=0 TSval=8035100 TSecr=762243694"
"346","2018-08-23 02:34:28.936863","192.168.2.3","216.58.197.4","TCP","1434","34236  >  443 [ACK] Seq=172570 Ack=5222 Win=2363 Len=1368 TSval=8035104 TSecr=762243694 [TCP segment of a reassembled PDU]"
"347","2018-08-23 02:34:28.936868","192.168.2.3","216.58.197.4","TCP","1434","34236  >  443 [ACK] Seq=173938 Ack=5222 Win=2363 Len=1368 TSval=8035104 TSecr=762243694 [TCP segment of a reassembled PDU]"
"348","2018-08-23 02:34:28.936992","192.168.2.3","216.58.197.4","TLSv1.2","212","Application Data"
"349","2018-08-23 02:34:28.936995","192.168.2.3","216.58.197.4","TCP","1434","34236  >  443 [ACK] Seq=175452 Ack=5222 Win=2363 Len=1368 TSval=8035104 TSecr=762243694 [TCP segment of a reassembled PDU]"
"350","2018-08-23 02:34:28.937203","192.168.2.3","216.58.197.4","TLSv1.2","155","Application Data"
"354","2018-08-23 02:34:28.963887","192.168.2.3","192.168.2.1","TCP","183","8009  >  53029 [PSH, ACK] Seq=118 Ack=235 Win=277 Len=117 TSval=8035106 TSecr=2317604897 [TCP segment of a reassembled PDU]"
"356","2018-08-23 02:34:29.052464","192.168.2.3","216.58.197.4","TCP","1434","34236  >  443 [ACK] Seq=176909 Ack=5222 Win=2363 Len=1368 TSval=8035115 TSecr=762243740 [TCP segment of a reassembled PDU]"
"357","2018-08-23 02:34:29.052851","192.168.2.3","216.58.197.4","TCP","1434","34236  >  443 [ACK] Seq=178277 Ack=5222 Win=2363 Len=1368 TSval=8035115 TSecr=762243740 [TCP segment of a reassembled PDU]"
"358","2018-08-23 02:34:29.052857","192.168.2.3","216.58.197.4","TLSv1.2","212","Application Data"
"359","2018-08-23 02:34:29.053196","192.168.2.3","216.58.197.4","TCP","1434","34236  >  443 [ACK] Seq=179791 Ack=5222 Win=2363 Len=1368 TSval=8035115 TSecr=762243740 [TCP segment of a reassembled PDU]"
"360","2018-08-23 02:34:29.053201","192.168.2.3","216.58.197.4","TLSv1.2","155","Application Data"
"365","2018-08-23 02:34:29.145163","192.168.2.3","216.58.197.4","TCP","66","34236  >  443 [ACK] Seq=181248 Ack=5506 Win=2363 Len=0 TSval=8035125 TSecr=762243894"
"366","2018-08-23 02:34:29.157545","192.168.2.3","216.58.197.4","TCP","1434","34236  >  443 [ACK] Seq=181248 Ack=5506 Win=2363 Len=1368 TSval=8035126 TSecr=762243894 [TCP segment of a reassembled PDU]"
"367","2018-08-23 02:34:29.157948","192.168.2.3","216.58.197.4","TCP","1434","34236  >  443 [ACK] Seq=182616 Ack=5506 Win=2363 Len=1368 TSval=8035126 TSecr=762243894 [TCP segment of a reassembled PDU]"
"368","2018-08-23 02:34:29.157952","192.168.2.3","216.58.197.4","TLSv1.2","212","Application Data"
"369","2018-08-23 02:34:29.158284","192.168.2.3","216.58.197.4","TCP","1434","34236  >  443 [ACK] Seq=184130 Ack=5506 Win=2363 Len=1368 TSval=8035126 TSecr=762243894 [TCP segment of a reassembled PDU]"
"370","2018-08-23 02:34:29.158287","192.168.2.3","216.58.197.4","TLSv1.2","155","Application Data"
"374","2018-08-23 02:34:29.253265","192.168.2.3","216.58.197.4","TCP","1434","34236  >  443 [ACK] Seq=185587 Ack=5506 Win=2363 Len=1368 TSval=8035136 TSecr=762244002 [TCP segment of a reassembled PDU]"
"375","2018-08-23 02:34:29.253503","192.168.2.3","216.58.197.4","TCP","1434","34236  >  443 [ACK] Seq=186955 Ack=5506 Win=2363 Len=1368 TSval=8035136 TSecr=762244002 [TCP segment of a reassembled PDU]"
"376","2018-08-23 02:34:29.253505","192.168.2.3","216.58.197.4","TLSv1.2","212","Application Data"
"377","2018-08-23 02:34:29.253836","192.168.2.3","216.58.197.4","TCP","1434","34236  >  443 [ACK] Seq=188469 Ack=5506 Win=2363 Len=1368 TSval=8035136 TSecr=762244002 [TCP segment of a reassembled PDU]"
"378","2018-08-23 02:34:29.253838","192.168.2.3","216.58.197.4","TLSv1.2","155","Application Data"
"385","2018-08-23 02:34:29.315418","192.168.2.3","216.58.197.4","TCP","66","34236  >  443 [ACK] Seq=189926 Ack=5737 Win=2363 Len=0 TSval=8035142 TSecr=762244112"
"386","2018-08-23 02:34:29.372373","192.168.2.3","216.58.197.4","TCP","1434","34236  >  443 [ACK] Seq=189926 Ack=5737 Win=2363 Len=1368 TSval=8035147 TSecr=762244112 [TCP segment of a reassembled PDU]"
"387","2018-08-23 02:34:29.372791","192.168.2.3","216.58.197.4","TCP","1434","34236  >  443 [ACK] Seq=191294 Ack=5737 Win=2363 Len=1368 TSval=8035147 TSecr=762244112 [TCP segment of a reassembled PDU]"
"388","2018-08-23 02:34:29.372795","192.168.2.3","216.58.197.4","TLSv1.2","212","Application Data"
"389","2018-08-23 02:34:29.372796","192.168.2.3","216.58.197.4","TCP","1434","34236  >  443 [ACK] Seq=192808 Ack=5737 Win=2363 Len=1368 TSval=8035147 TSecr=762244112 [TCP segment of a reassembled PDU]"
"390","2018-08-23 02:34:29.373117","192.168.2.3","216.58.197.4","TLSv1.2","155","Application Data"
"395","2018-08-23 02:34:29.412602","192.168.2.3","216.58.197.4","TCP","66","34236  >  443 [ACK] Seq=194265 Ack=5942 Win=2363 Len=0 TSval=8035151 TSecr=762244210"
"397","2018-08-23 02:34:29.424650","192.168.2.3","216.58.197.4","TCP","66","34236  >  443 [ACK] Seq=194265 Ack=6004 Win=2363 Len=0 TSval=8035153 TSecr=762244222"
"400","2018-08-23 02:34:29.433732","192.168.2.3","216.58.197.4","TCP","66","34236  >  443 [ACK] Seq=194265 Ack=6365 Win=2363 Len=0 TSval=8035154 TSecr=762244229"
"401","2018-08-23 02:34:29.477127","192.168.2.3","216.58.197.4","TCP","1434","34236  >  443 [ACK] Seq=194265 Ack=6365 Win=2363 Len=1368 TSval=8035158 TSecr=762244229 [TCP segment of a reassembled PDU]"
"402","2018-08-23 02:34:29.477592","192.168.2.3","216.58.197.4","TCP","1434","34236  >  443 [ACK] Seq=195633 Ack=6365 Win=2363 Len=1368 TSval=8035158 TSecr=762244229 [TCP segment of a reassembled PDU]"
"403","2018-08-23 02:34:29.477595","192.168.2.3","216.58.197.4","TLSv1.2","212","Application Data"
"404","2018-08-23 02:34:29.478012","192.168.2.3","216.58.197.4","TCP","1434","34236  >  443 [ACK] Seq=197147 Ack=6365 Win=2363 Len=1368 TSval=8035158 TSecr=762244229 [TCP segment of a reassembled PDU]"
"405","2018-08-23 02:34:29.478016","192.168.2.3","216.58.197.4","TLSv1.2","155","Application Data"
"411","2018-08-23 02:34:29.529677","192.168.2.3","216.58.197.4","TCP","66","34236  >  443 [ACK] Seq=198604 Ack=6895 Win=2363 Len=0 TSval=8035163 TSecr=762244324"
"412","2018-08-23 02:34:29.574171","192.168.2.3","216.58.197.4","TCP","1434","34236  >  443 [ACK] Seq=198604 Ack=6895 Win=2363 Len=1368 TSval=8035168 TSecr=762244324 [TCP segment of a reassembled PDU]"
"413","2018-08-23 02:34:29.574455","192.168.2.3","216.58.197.4","TCP","1434","34236  >  443 [ACK] Seq=199972 Ack=6895 Win=2363 Len=1368 TSval=8035168 TSecr=762244324 [TCP segment of a reassembled PDU]"
"414","2018-08-23 02:34:29.574458","192.168.2.3","216.58.197.4","TLSv1.2","212","Application Data"
"415","2018-08-23 02:34:29.574824","192.168.2.3","216.58.197.4","TCP","1434","34236  >  443 [ACK] Seq=201486 Ack=6895 Win=2363 Len=1368 TSval=8035168 TSecr=762244324 [TCP segment of a reassembled PDU]"
"416","2018-08-23 02:34:29.574827","192.168.2.3","216.58.197.4","TLSv1.2","155","Application Data"
"417","2018-08-23 02:34:29.576386","192.168.2.3","216.58.197.4","TLSv1.2","608","Application Data"
"418","2018-08-23 02:34:29.576602","192.168.2.3","216.58.197.4","TLSv1.2","102","Application Data"
"425","2018-08-23 02:34:29.630110","192.168.2.3","216.58.197.4","TCP","66","34236  >  443 [ACK] Seq=203521 Ack=7789 Win=2363 Len=0 TSval=8035173 TSecr=762244427"
"427","2018-08-23 02:34:29.632193","192.168.2.3","216.58.197.4","TCP","66","34236  >  443 [ACK] Seq=203521 Ack=7925 Win=2363 Len=0 TSval=8035173 TSecr=762244430"
"429","2018-08-23 02:34:30.055837","192.168.2.3","216.58.197.4","TCP","66","34236  >  443 [ACK] Seq=203521 Ack=8160 Win=2363 Len=0 TSval=8035216 TSecr=762244823"
"443","2018-08-23 02:34:30.060149","192.168.2.3","216.58.197.4","TCP","66","34236  >  443 [ACK] Seq=203521 Ack=9578 Win=2363 Len=0 TSval=8035216 TSecr=762244855"
"444","2018-08-23 02:34:30.060152","192.168.2.3","216.58.197.4","TCP","66","34236  >  443 [ACK] Seq=203521 Ack=10141 Win=2363 Len=0 TSval=8035216 TSecr=762244855"
