"No.","Time","Source","Destination","Protocol","Length","Info"
"2","2018-08-23 02:24:18.094086","192.168.2.3","203.211.199.120","TCP","66","52036  >  443 [ACK] Seq=1 Ack=24 Win=661 Len=0 TSval=7974020 TSecr=1193501078"
"4","2018-08-23 02:24:18.135954","192.168.2.3","203.211.199.120","TCP","66","52036  >  443 [ACK] Seq=1 Ack=25 Win=661 Len=0 TSval=7974025 TSecr=1193501078"
"6","2018-08-23 02:24:19.884746","192.168.2.3","192.168.2.1","TCP","183","8009  >  53029 [PSH, ACK] Seq=1 Ack=118 Win=277 Len=117 TSval=7974199 TSecr=2316997291 [TCP segment of a reassembled PDU]"
"8","2018-08-23 02:24:19.960212","192.168.2.3","216.58.197.4","TLSv1.2","156","Application Data"
"9","2018-08-23 02:24:19.960998","192.168.2.3","216.58.197.4","TLSv1.2","158","Application Data"
"12","2018-08-23 02:24:19.977387","192.168.2.3","216.58.197.4","TCP","1434","34236  >  443 [ACK] Seq=183 Ack=1 Win=2363 Len=1368 TSval=7974208 TSecr=761634763 [TCP segment of a reassembled PDU]"
"13","2018-08-23 02:24:19.977805","192.168.2.3","216.58.197.4","TCP","1434","34236  >  443 [ACK] Seq=1551 Ack=1 Win=2363 Len=1368 TSval=7974208 TSecr=761634763 [TCP segment of a reassembled PDU]"
"14","2018-08-23 02:24:19.977808","192.168.2.3","216.58.197.4","TLSv1.2","212","Application Data"
"15","2018-08-23 02:24:19.977809","192.168.2.3","216.58.197.4","TCP","1434","34236  >  443 [ACK] Seq=3065 Ack=1 Win=2363 Len=1368 TSval=7974208 TSecr=761634763 [TCP segment of a reassembled PDU]"
"16","2018-08-23 02:24:19.977929","192.168.2.3","216.58.197.4","TLSv1.2","362","Application Data"
"17","2018-08-23 02:24:19.978186","192.168.2.3","216.58.197.4","TCP","1434","34236  >  443 [ACK] Seq=4729 Ack=1 Win=2363 Len=1368 TSval=7974208 TSecr=761634763 [TCP segment of a reassembled PDU]"
"18","2018-08-23 02:24:19.978189","192.168.2.3","216.58.197.4","TCP","1434","34236  >  443 [ACK] Seq=6097 Ack=1 Win=2363 Len=1368 TSval=7974208 TSecr=761634763 [TCP segment of a reassembled PDU]"
"19","2018-08-23 02:24:19.978191","192.168.2.3","216.58.197.4","TLSv1.2","212","Application Data"
"20","2018-08-23 02:24:19.978562","192.168.2.3","216.58.197.4","TCP","1434","34236  >  443 [ACK] Seq=7611 Ack=1 Win=2363 Len=1368 TSval=7974208 TSecr=761634763 [TCP segment of a reassembled PDU]"
"21","2018-08-23 02:24:19.978565","192.168.2.3","216.58.197.4","TCP","1434","34236  >  443 [ACK] Seq=8979 Ack=1 Win=2363 Len=1368 TSval=7974208 TSecr=761634763 [TCP segment of a reassembled PDU]"
"32","2018-08-23 02:24:19.990614","192.168.2.3","216.58.197.4","TLSv1.2","1434","Application Data [TCP segment of a reassembled PDU]"
"33","2018-08-23 02:24:19.990619","192.168.2.3","216.58.197.4","TCP","1434","34236  >  443 [ACK] Seq=11715 Ack=1 Win=2363 Len=1368 TSval=7974210 TSecr=761634780 [TCP segment of a reassembled PDU]"
"34","2018-08-23 02:24:19.990780","192.168.2.3","216.58.197.4","TLSv1.2","1434","Application Data [TCP segment of a reassembled PDU]"
"35","2018-08-23 02:24:19.990837","192.168.2.3","216.58.197.4","TCP","1434","34236  >  443 [ACK] Seq=14451 Ack=1 Win=2363 Len=1368 TSval=7974210 TSecr=761634780 [TCP segment of a reassembled PDU]"
"36","2018-08-23 02:24:19.991096","192.168.2.3","216.58.197.4","TLSv1.2","1434","Application Data [TCP segment of a reassembled PDU]"
"37","2018-08-23 02:24:19.991420","192.168.2.3","216.58.197.4","TCP","1434","34236  >  443 [ACK] Seq=17187 Ack=1 Win=2363 Len=1368 TSval=7974210 TSecr=761634780 [TCP segment of a reassembled PDU]"
"38","2018-08-23 02:24:19.991423","192.168.2.3","216.58.197.4","TLSv1.2","1434","Application Data [TCP segment of a reassembled PDU]"
"39","2018-08-23 02:24:19.991445","192.168.2.3","216.58.197.4","TCP","1434","34236  >  443 [ACK] Seq=19923 Ack=1 Win=2363 Len=1368 TSval=7974210 TSecr=761634780 [TCP segment of a reassembled PDU]"
"40","2018-08-23 02:24:19.991764","192.168.2.3","216.58.197.4","TLSv1.2","1434","Application Data [TCP segment of a reassembled PDU]"
"41","2018-08-23 02:24:19.991835","192.168.2.3","216.58.197.4","TCP","1434","34236  >  443 [ACK] Seq=22659 Ack=1 Win=2363 Len=1368 TSval=7974210 TSecr=761634780 [TCP segment of a reassembled PDU]"
"42","2018-08-23 02:24:19.991926","192.168.2.3","216.58.197.4","TLSv1.2","1434","Application Data [TCP segment of a reassembled PDU]"
"43","2018-08-23 02:24:19.992128","192.168.2.3","216.58.197.4","TCP","1434","34236  >  443 [ACK] Seq=25395 Ack=1 Win=2363 Len=1368 TSval=7974210 TSecr=761634781 [TCP segment of a reassembled PDU]"
"44","2018-08-23 02:24:19.992731","192.168.2.3","216.58.197.4","TLSv1.2","1434","Application Data [TCP segment of a reassembled PDU]"
"45","2018-08-23 02:24:19.992734","192.168.2.3","216.58.197.4","TCP","1434","34236  >  443 [ACK] Seq=28131 Ack=1 Win=2363 Len=1368 TSval=7974210 TSecr=761634781 [TCP segment of a reassembled PDU]"
"46","2018-08-23 02:24:19.992999","192.168.2.3","216.58.197.4","TLSv1.2","1434","Application Data [TCP segment of a reassembled PDU]"
"47","2018-08-23 02:24:19.993200","192.168.2.3","216.58.197.4","TCP","1434","34236  >  443 [ACK] Seq=30867 Ack=1 Win=2363 Len=1368 TSval=7974210 TSecr=761634781 [TCP segment of a reassembled PDU]"
"48","2018-08-23 02:24:19.993202","192.168.2.3","216.58.197.4","TLSv1.2","1434","Application Data [TCP segment of a reassembled PDU]"
"49","2018-08-23 02:24:19.993545","192.168.2.3","216.58.197.4","TCP","1434","34236  >  443 [ACK] Seq=33603 Ack=1 Win=2363 Len=1368 TSval=7974210 TSecr=761634781 [TCP segment of a reassembled PDU]"
"50","2018-08-23 02:24:19.993548","192.168.2.3","216.58.197.4","TLSv1.2","1434","Application Data [TCP segment of a reassembled PDU]"
"51","2018-08-23 02:24:19.993900","192.168.2.3","216.58.197.4","TCP","1434","34236  >  443 [ACK] Seq=36339 Ack=1 Win=2363 Len=1368 TSval=7974210 TSecr=761634781 [TCP segment of a reassembled PDU]"
"59","2018-08-23 02:24:19.996611","192.168.2.3","216.58.197.4","TLSv1.2","1434","Application Data [TCP segment of a reassembled PDU]"
"60","2018-08-23 02:24:19.996753","192.168.2.3","216.58.197.4","TCP","1434","34236  >  443 [ACK] Seq=39075 Ack=1 Win=2363 Len=1368 TSval=7974211 TSecr=761634793 [TCP segment of a reassembled PDU]"
"65","2018-08-23 02:24:19.998030","192.168.2.3","216.58.197.4","TLSv1.2","1434","Application Data [TCP segment of a reassembled PDU]"
"66","2018-08-23 02:24:19.998032","192.168.2.3","216.58.197.4","TCP","1434","34236  >  443 [ACK] Seq=41811 Ack=1 Win=2363 Len=1368 TSval=7974211 TSecr=761634793 [TCP segment of a reassembled PDU]"
"67","2018-08-23 02:24:19.998192","192.168.2.3","216.58.197.4","TLSv1.2","1434","Application Data [TCP segment of a reassembled PDU]"
"68","2018-08-23 02:24:19.998386","192.168.2.3","216.58.197.4","TCP","1434","34236  >  443 [ACK] Seq=44547 Ack=1 Win=2363 Len=1368 TSval=7974211 TSecr=761634793 [TCP segment of a reassembled PDU]"
"69","2018-08-23 02:24:19.998881","192.168.2.3","216.58.197.4","TLSv1.2","1434","Application Data [TCP segment of a reassembled PDU]"
"70","2018-08-23 02:24:19.998884","192.168.2.3","216.58.197.4","TCP","1434","34236  >  443 [ACK] Seq=47283 Ack=1 Win=2363 Len=1368 TSval=7974211 TSecr=761634794 [TCP segment of a reassembled PDU]"
"71","2018-08-23 02:24:19.999198","192.168.2.3","216.58.197.4","TLSv1.2","1434","Application Data [TCP segment of a reassembled PDU]"
"72","2018-08-23 02:24:19.999201","192.168.2.3","216.58.197.4","TCP","1434","34236  >  443 [PSH, ACK] Seq=50019 Ack=1 Win=2363 Len=1368 TSval=7974211 TSecr=761634794 [TCP segment of a reassembled PDU]"
"73","2018-08-23 02:24:19.999301","192.168.2.3","216.58.197.4","TLSv1.2","946","Application Data"
"74","2018-08-23 02:24:19.999953","192.168.2.3","216.58.197.4","TCP","1434","34236  >  443 [ACK] Seq=52267 Ack=1 Win=2363 Len=1368 TSval=7974211 TSecr=761634794 [TCP segment of a reassembled PDU]"
"75","2018-08-23 02:24:20.000495","192.168.2.3","216.58.197.4","TLSv1.2","1434","Application Data [TCP segment of a reassembled PDU]"
"76","2018-08-23 02:24:20.000497","192.168.2.3","216.58.197.4","TCP","1434","34236  >  443 [ACK] Seq=55003 Ack=1 Win=2363 Len=1368 TSval=7974211 TSecr=761634794 [TCP segment of a reassembled PDU]"
"77","2018-08-23 02:24:20.000665","192.168.2.3","216.58.197.4","TLSv1.2","1434","Application Data [TCP segment of a reassembled PDU]"
"79","2018-08-23 02:24:20.000838","192.168.2.3","216.58.197.4","TCP","1434","34236  >  443 [ACK] Seq=57739 Ack=1 Win=2363 Len=1368 TSval=7974211 TSecr=761634795 [TCP segment of a reassembled PDU]"
"80","2018-08-23 02:24:20.001223","192.168.2.3","216.58.197.4","TLSv1.2","1434","Application Data [TCP segment of a reassembled PDU]"
"81","2018-08-23 02:24:20.001563","192.168.2.3","216.58.197.4","TCP","1434","34236  >  443 [ACK] Seq=60475 Ack=1 Win=2363 Len=1368 TSval=7974211 TSecr=761634795 [TCP segment of a reassembled PDU]"
"82","2018-08-23 02:24:20.001565","192.168.2.3","216.58.197.4","TLSv1.2","1434","Application Data [TCP segment of a reassembled PDU]"
"85","2018-08-23 02:24:20.002364","192.168.2.3","216.58.197.4","TCP","1434","34236  >  443 [ACK] Seq=63211 Ack=1 Win=2363 Len=1368 TSval=7974211 TSecr=761634796 [TCP segment of a reassembled PDU]"
"86","2018-08-23 02:24:20.002366","192.168.2.3","216.58.197.4","TCP","1434","34236  >  443 [ACK] Seq=64579 Ack=1 Win=2363 Len=1368 TSval=7974211 TSecr=761634796 [TCP segment of a reassembled PDU]"
"87","2018-08-23 02:24:20.002797","192.168.2.3","216.58.197.4","TLSv1.2","1434","Application Data [TCP segment of a reassembled PDU]"
"89","2018-08-23 02:24:20.003067","192.168.2.3","216.58.197.4","TCP","1434","34236  >  443 [ACK] Seq=67315 Ack=1 Win=2363 Len=1368 TSval=7974211 TSecr=761634796 [TCP segment of a reassembled PDU]"
"90","2018-08-23 02:24:20.003279","192.168.2.3","216.58.197.4","TLSv1.2","1434","Application Data [TCP segment of a reassembled PDU]"
"93","2018-08-23 02:24:20.003647","192.168.2.3","216.58.197.4","TLSv1.2","1434","Application Data [TCP segment of a reassembled PDU]"
"94","2018-08-23 02:24:20.003650","192.168.2.3","216.58.197.4","TLSv1.2","573","Application Data"
"103","2018-08-23 02:24:20.063748","192.168.2.3","216.58.197.4","TCP","1434","34236  >  443 [ACK] Seq=71926 Ack=1 Win=2363 Len=1368 TSval=7974217 TSecr=761634806 [TCP segment of a reassembled PDU]"
"104","2018-08-23 02:24:20.064126","192.168.2.3","216.58.197.4","TCP","1434","34236  >  443 [ACK] Seq=73294 Ack=1 Win=2363 Len=1368 TSval=7974217 TSecr=761634806 [TCP segment of a reassembled PDU]"
"105","2018-08-23 02:24:20.064142","192.168.2.3","216.58.197.4","TLSv1.2","212","Application Data"
"106","2018-08-23 02:24:20.064143","192.168.2.3","216.58.197.4","TCP","1434","34236  >  443 [ACK] Seq=74808 Ack=1 Win=2363 Len=1368 TSval=7974217 TSecr=761634806 [TCP segment of a reassembled PDU]"
"107","2018-08-23 02:24:20.064285","192.168.2.3","216.58.197.4","TLSv1.2","155","Application Data"
"111","2018-08-23 02:24:20.109947","192.168.2.3","203.211.199.120","TCP","66","52036  >  443 [RST, ACK] Seq=1 Ack=25 Win=661 Len=0 TSval=7974222 TSecr=1193501078"
"112","2018-08-23 02:24:20.115382","192.168.2.3","203.211.199.120","TLSv1.2","789","Application Data"
"117","2018-08-23 02:24:20.147892","192.168.2.3","203.211.199.120","TCP","66","52039  >  443 [ACK] Seq=724 Ack=1449 Win=797 Len=0 TSval=7974226 TSecr=1193503131"
"118","2018-08-23 02:24:20.147894","192.168.2.3","203.211.199.120","TCP","66","52039  >  443 [ACK] Seq=724 Ack=2897 Win=797 Len=0 TSval=7974226 TSecr=1193503131"
"119","2018-08-23 02:24:20.148136","192.168.2.3","203.211.199.120","TCP","66","52039  >  443 [ACK] Seq=724 Ack=4345 Win=797 Len=0 TSval=7974226 TSecr=1193503131"
"120","2018-08-23 02:24:20.148422","192.168.2.3","203.211.199.120","TCP","66","52039  >  443 [ACK] Seq=724 Ack=5237 Win=797 Len=0 TSval=7974226 TSecr=1193503131"
"121","2018-08-23 02:24:20.151981","192.168.2.3","216.58.197.4","TCP","1434","34236  >  443 [ACK] Seq=76265 Ack=1 Win=2363 Len=1368 TSval=7974226 TSecr=761634867 [TCP segment of a reassembled PDU]"
"122","2018-08-23 02:24:20.152276","192.168.2.3","216.58.197.4","TCP","1434","34236  >  443 [ACK] Seq=77633 Ack=1 Win=2363 Len=1368 TSval=7974226 TSecr=761634867 [TCP segment of a reassembled PDU]"
"123","2018-08-23 02:24:20.152278","192.168.2.3","216.58.197.4","TLSv1.2","212","Application Data"
"124","2018-08-23 02:24:20.152442","192.168.2.3","216.58.197.4","TCP","1434","34236  >  443 [ACK] Seq=79147 Ack=1 Win=2363 Len=1368 TSval=7974226 TSecr=761634867 [TCP segment of a reassembled PDU]"
"125","2018-08-23 02:24:20.152445","192.168.2.3","216.58.197.4","TLSv1.2","155","Application Data"
"130","2018-08-23 02:24:20.187125","192.168.2.3","216.58.197.4","TCP","66","34236  >  443 [ACK] Seq=80604 Ack=35 Win=2363 Len=0 TSval=7974230 TSecr=761634952"
"131","2018-08-23 02:24:20.254428","192.168.2.3","216.58.197.4","TCP","1434","34236  >  443 [ACK] Seq=80604 Ack=35 Win=2363 Len=1368 TSval=7974236 TSecr=761634952 [TCP segment of a reassembled PDU]"
"132","2018-08-23 02:24:20.254858","192.168.2.3","216.58.197.4","TCP","1434","34236  >  443 [ACK] Seq=81972 Ack=35 Win=2363 Len=1368 TSval=7974236 TSecr=761634952 [TCP segment of a reassembled PDU]"
"133","2018-08-23 02:24:20.254862","192.168.2.3","216.58.197.4","TLSv1.2","212","Application Data"
"134","2018-08-23 02:24:20.254863","192.168.2.3","216.58.197.4","TCP","1434","34236  >  443 [ACK] Seq=83486 Ack=35 Win=2363 Len=1368 TSval=7974236 TSecr=761634952 [TCP segment of a reassembled PDU]"
"135","2018-08-23 02:24:20.255012","192.168.2.3","216.58.197.4","TLSv1.2","155","Application Data"
"138","2018-08-23 02:24:20.256494","192.168.2.3","216.58.197.4","TCP","66","34236  >  443 [ACK] Seq=84943 Ack=104 Win=2363 Len=0 TSval=7974237 TSecr=761635054"
"139","2018-08-23 02:24:20.256702","192.168.2.3","216.58.197.4","TCP","66","34236  >  443 [ACK] Seq=84943 Ack=340 Win=2363 Len=0 TSval=7974237 TSecr=761635054"
"144","2018-08-23 02:24:20.342709","192.168.2.3","216.58.197.4","TCP","1434","34236  >  443 [ACK] Seq=84943 Ack=340 Win=2363 Len=1368 TSval=7974245 TSecr=761635057 [TCP segment of a reassembled PDU]"
"145","2018-08-23 02:24:20.342714","192.168.2.3","216.58.197.4","TCP","1434","34236  >  443 [ACK] Seq=86311 Ack=340 Win=2363 Len=1368 TSval=7974245 TSecr=761635057 [TCP segment of a reassembled PDU]"
"146","2018-08-23 02:24:20.342715","192.168.2.3","216.58.197.4","TLSv1.2","212","Application Data"
"147","2018-08-23 02:24:20.342716","192.168.2.3","216.58.197.4","TCP","66","34236  >  443 [ACK] Seq=87825 Ack=576 Win=2363 Len=0 TSval=7974245 TSecr=761635137"
"148","2018-08-23 02:24:20.343051","192.168.2.3","216.58.197.4","TCP","1434","34236  >  443 [ACK] Seq=87825 Ack=576 Win=2363 Len=1368 TSval=7974245 TSecr=761635137 [TCP segment of a reassembled PDU]"
"149","2018-08-23 02:24:20.343054","192.168.2.3","216.58.197.4","TLSv1.2","155","Application Data"
"152","2018-08-23 02:24:20.435742","192.168.2.3","216.58.197.4","TCP","1434","34236  >  443 [ACK] Seq=89282 Ack=576 Win=2363 Len=1368 TSval=7974254 TSecr=761635145 [TCP segment of a reassembled PDU]"
"153","2018-08-23 02:24:20.436013","192.168.2.3","216.58.197.4","TCP","1434","34236  >  443 [ACK] Seq=90650 Ack=576 Win=2363 Len=1368 TSval=7974254 TSecr=761635145 [TCP segment of a reassembled PDU]"
"154","2018-08-23 02:24:20.436016","192.168.2.3","216.58.197.4","TLSv1.2","212","Application Data"
"155","2018-08-23 02:24:20.436194","192.168.2.3","216.58.197.4","TCP","1434","34236  >  443 [ACK] Seq=92164 Ack=576 Win=2363 Len=1368 TSval=7974254 TSecr=761635145 [TCP segment of a reassembled PDU]"
"156","2018-08-23 02:24:20.436196","192.168.2.3","216.58.197.4","TLSv1.2","155","Application Data"
"161","2018-08-23 02:24:20.534108","192.168.2.3","216.58.197.4","TCP","1434","34236  >  443 [ACK] Seq=93621 Ack=691 Win=2363 Len=1368 TSval=7974264 TSecr=761635309 [TCP segment of a reassembled PDU]"
"162","2018-08-23 02:24:20.534116","192.168.2.3","216.58.197.4","TCP","1434","34236  >  443 [ACK] Seq=94989 Ack=691 Win=2363 Len=1368 TSval=7974264 TSecr=761635309 [TCP segment of a reassembled PDU]"
"163","2018-08-23 02:24:20.534204","192.168.2.3","216.58.197.4","TLSv1.2","212","Application Data"
"164","2018-08-23 02:24:20.534371","192.168.2.3","216.58.197.4","TCP","1434","34236  >  443 [ACK] Seq=96503 Ack=691 Win=2363 Len=1368 TSval=7974264 TSecr=761635309 [TCP segment of a reassembled PDU]"
"165","2018-08-23 02:24:20.534374","192.168.2.3","216.58.197.4","TLSv1.2","155","Application Data"
"168","2018-08-23 02:24:20.627514","192.168.2.3","216.58.197.4","TCP","1434","34236  >  443 [ACK] Seq=97960 Ack=691 Win=2363 Len=1368 TSval=7974274 TSecr=761635337 [TCP segment of a reassembled PDU]"
"169","2018-08-23 02:24:20.627882","192.168.2.3","216.58.197.4","TCP","1434","34236  >  443 [ACK] Seq=99328 Ack=691 Win=2363 Len=1368 TSval=7974274 TSecr=761635337 [TCP segment of a reassembled PDU]"
"170","2018-08-23 02:24:20.627885","192.168.2.3","216.58.197.4","TLSv1.2","212","Application Data"
"171","2018-08-23 02:24:20.628120","192.168.2.3","216.58.197.4","TCP","1434","34236  >  443 [ACK] Seq=100842 Ack=691 Win=2363 Len=1368 TSval=7974274 TSecr=761635337 [TCP segment of a reassembled PDU]"
"172","2018-08-23 02:24:20.628123","192.168.2.3","216.58.197.4","TLSv1.2","155","Application Data"
"176","2018-08-23 02:24:20.703492","192.168.2.3","216.58.197.4","TCP","1434","34236  >  443 [ACK] Seq=102299 Ack=691 Win=2363 Len=1368 TSval=7974281 TSecr=761635430 [TCP segment of a reassembled PDU]"
"177","2018-08-23 02:24:20.703921","192.168.2.3","216.58.197.4","TCP","1434","34236  >  443 [ACK] Seq=103667 Ack=691 Win=2363 Len=1368 TSval=7974281 TSecr=761635430 [TCP segment of a reassembled PDU]"
"178","2018-08-23 02:24:20.703924","192.168.2.3","216.58.197.4","TLSv1.2","212","Application Data"
"179","2018-08-23 02:24:20.706323","192.168.2.3","216.58.197.4","TCP","1434","34236  >  443 [ACK] Seq=105181 Ack=691 Win=2363 Len=1368 TSval=7974281 TSecr=761635430 [TCP segment of a reassembled PDU]"
"180","2018-08-23 02:24:20.706328","192.168.2.3","216.58.197.4","TLSv1.2","155","Application Data"
"184","2018-08-23 02:24:20.790003","192.168.2.3","216.58.197.4","TCP","1434","34236  >  443 [ACK] Seq=106638 Ack=691 Win=2363 Len=1368 TSval=7974290 TSecr=761635509 [TCP segment of a reassembled PDU]"
"185","2018-08-23 02:24:20.790312","192.168.2.3","216.58.197.4","TCP","1434","34236  >  443 [ACK] Seq=108006 Ack=691 Win=2363 Len=1368 TSval=7974290 TSecr=761635509 [TCP segment of a reassembled PDU]"
"186","2018-08-23 02:24:20.790315","192.168.2.3","216.58.197.4","TLSv1.2","212","Application Data"
"187","2018-08-23 02:24:20.790576","192.168.2.3","216.58.197.4","TCP","1434","34236  >  443 [ACK] Seq=109520 Ack=691 Win=2363 Len=1368 TSval=7974290 TSecr=761635509 [TCP segment of a reassembled PDU]"
"188","2018-08-23 02:24:20.790578","192.168.2.3","216.58.197.4","TLSv1.2","155","Application Data"
"192","2018-08-23 02:24:20.885588","192.168.2.3","216.58.197.4","TCP","1434","34236  >  443 [ACK] Seq=110977 Ack=691 Win=2363 Len=1368 TSval=7974299 TSecr=761635593 [TCP segment of a reassembled PDU]"
"193","2018-08-23 02:24:20.891513","192.168.2.3","216.58.197.4","TCP","1434","34236  >  443 [ACK] Seq=112345 Ack=691 Win=2363 Len=1368 TSval=7974299 TSecr=761635593 [TCP segment of a reassembled PDU]"
"194","2018-08-23 02:24:20.891517","192.168.2.3","216.58.197.4","TLSv1.2","212","Application Data"
"195","2018-08-23 02:24:20.891746","192.168.2.3","216.58.197.4","TCP","1434","34236  >  443 [ACK] Seq=113859 Ack=691 Win=2363 Len=1368 TSval=7974299 TSecr=761635593 [TCP segment of a reassembled PDU]"
"196","2018-08-23 02:24:20.891749","192.168.2.3","216.58.197.4","TLSv1.2","155","Application Data"
"200","2018-08-23 02:24:20.950909","192.168.2.3","216.58.197.4","TCP","1434","34236  >  443 [ACK] Seq=115316 Ack=691 Win=2363 Len=1368 TSval=7974306 TSecr=761635694 [TCP segment of a reassembled PDU]"
"201","2018-08-23 02:24:20.951334","192.168.2.3","216.58.197.4","TCP","1434","34236  >  443 [ACK] Seq=116684 Ack=691 Win=2363 Len=1368 TSval=7974306 TSecr=761635694 [TCP segment of a reassembled PDU]"
"202","2018-08-23 02:24:20.951340","192.168.2.3","216.58.197.4","TLSv1.2","212","Application Data"
"203","2018-08-23 02:24:20.951720","192.168.2.3","216.58.197.4","TCP","1434","34236  >  443 [ACK] Seq=118198 Ack=691 Win=2363 Len=1368 TSval=7974306 TSecr=761635694 [TCP segment of a reassembled PDU]"
"204","2018-08-23 02:24:20.951736","192.168.2.3","216.58.197.4","TLSv1.2","155","Application Data"
"208","2018-08-23 02:24:21.047427","192.168.2.3","216.58.197.4","TCP","1434","34236  >  443 [ACK] Seq=119655 Ack=691 Win=2363 Len=1368 TSval=7974316 TSecr=761635754 [TCP segment of a reassembled PDU]"
"209","2018-08-23 02:24:21.047773","192.168.2.3","216.58.197.4","TCP","1434","34236  >  443 [ACK] Seq=121023 Ack=691 Win=2363 Len=1368 TSval=7974316 TSecr=761635754 [TCP segment of a reassembled PDU]"
"210","2018-08-23 02:24:21.047777","192.168.2.3","216.58.197.4","TLSv1.2","212","Application Data"
"211","2018-08-23 02:24:21.048193","192.168.2.3","216.58.197.4","TCP","1434","34236  >  443 [ACK] Seq=122537 Ack=691 Win=2363 Len=1368 TSval=7974316 TSecr=761635754 [TCP segment of a reassembled PDU]"
"212","2018-08-23 02:24:21.048196","192.168.2.3","216.58.197.4","TLSv1.2","155","Application Data"
"216","2018-08-23 02:24:21.119918","192.168.2.3","216.58.197.4","TCP","1434","34236  >  443 [ACK] Seq=123994 Ack=691 Win=2363 Len=1368 TSval=7974323 TSecr=761635851 [TCP segment of a reassembled PDU]"
"217","2018-08-23 02:24:21.120245","192.168.2.3","216.58.197.4","TCP","1434","34236  >  443 [ACK] Seq=125362 Ack=691 Win=2363 Len=1368 TSval=7974323 TSecr=761635851 [TCP segment of a reassembled PDU]"
"218","2018-08-23 02:24:21.120247","192.168.2.3","216.58.197.4","TLSv1.2","212","Application Data"
"219","2018-08-23 02:24:21.120795","192.168.2.3","216.58.197.4","TCP","1434","34236  >  443 [ACK] Seq=126876 Ack=691 Win=2363 Len=1368 TSval=7974323 TSecr=761635851 [TCP segment of a reassembled PDU]"
"220","2018-08-23 02:24:21.120798","192.168.2.3","216.58.197.4","TLSv1.2","155","Application Data"
"224","2018-08-23 02:24:21.205758","192.168.2.3","216.58.197.4","TCP","1434","34236  >  443 [ACK] Seq=128333 Ack=691 Win=2363 Len=1368 TSval=7974331 TSecr=761635923 [TCP segment of a reassembled PDU]"
"225","2018-08-23 02:24:21.206112","192.168.2.3","216.58.197.4","TCP","1434","34236  >  443 [ACK] Seq=129701 Ack=691 Win=2363 Len=1368 TSval=7974331 TSecr=761635923 [TCP segment of a reassembled PDU]"
"226","2018-08-23 02:24:21.206116","192.168.2.3","216.58.197.4","TLSv1.2","212","Application Data"
"227","2018-08-23 02:24:21.206627","192.168.2.3","216.58.197.4","TCP","1434","34236  >  443 [ACK] Seq=131215 Ack=691 Win=2363 Len=1368 TSval=7974331 TSecr=761635923 [TCP segment of a reassembled PDU]"
"228","2018-08-23 02:24:21.206630","192.168.2.3","216.58.197.4","TLSv1.2","155","Application Data"
"234","2018-08-23 02:24:21.234813","192.168.2.3","216.58.197.4","TCP","66","34236  >  443 [ACK] Seq=132672 Ack=1115 Win=2363 Len=0 TSval=7974334 TSecr=761636020"
"235","2018-08-23 02:24:21.278417","192.168.2.3","216.58.197.4","TCP","1434","34236  >  443 [ACK] Seq=132672 Ack=1115 Win=2363 Len=1368 TSval=7974339 TSecr=761636020 [TCP segment of a reassembled PDU]"
"236","2018-08-23 02:24:21.278854","192.168.2.3","216.58.197.4","TCP","1434","34236  >  443 [ACK] Seq=134040 Ack=1115 Win=2363 Len=1368 TSval=7974339 TSecr=761636020 [TCP segment of a reassembled PDU]"
"237","2018-08-23 02:24:21.278859","192.168.2.3","216.58.197.4","TLSv1.2","212","Application Data"
"238","2018-08-23 02:24:21.278860","192.168.2.3","216.58.197.4","TCP","1434","34236  >  443 [ACK] Seq=135554 Ack=1115 Win=2363 Len=1368 TSval=7974339 TSecr=761636020 [TCP segment of a reassembled PDU]"
"239","2018-08-23 02:24:21.279058","192.168.2.3","216.58.197.4","TLSv1.2","155","Application Data"
"243","2018-08-23 02:24:21.374529","192.168.2.3","216.58.197.4","TCP","1434","34236  >  443 [ACK] Seq=137011 Ack=1115 Win=2363 Len=1368 TSval=7974348 TSecr=761636121 [TCP segment of a reassembled PDU]"
"244","2018-08-23 02:24:21.374732","192.168.2.3","216.58.197.4","TCP","1434","34236  >  443 [ACK] Seq=138379 Ack=1115 Win=2363 Len=1368 TSval=7974348 TSecr=761636121 [TCP segment of a reassembled PDU]"
"245","2018-08-23 02:24:21.374737","192.168.2.3","216.58.197.4","TLSv1.2","212","Application Data"
"246","2018-08-23 02:24:21.375143","192.168.2.3","216.58.197.4","TCP","1434","34236  >  443 [ACK] Seq=139893 Ack=1115 Win=2363 Len=1368 TSval=7974348 TSecr=761636121 [TCP segment of a reassembled PDU]"
"247","2018-08-23 02:24:21.375152","192.168.2.3","216.58.197.4","TLSv1.2","155","Application Data"
"251","2018-08-23 02:24:21.460343","192.168.2.3","216.58.197.4","TCP","1434","34236  >  443 [ACK] Seq=141350 Ack=1115 Win=2363 Len=1368 TSval=7974357 TSecr=761636178 [TCP segment of a reassembled PDU]"
"252","2018-08-23 02:24:21.460750","192.168.2.3","216.58.197.4","TCP","1434","34236  >  443 [ACK] Seq=142718 Ack=1115 Win=2363 Len=1368 TSval=7974357 TSecr=761636178 [TCP segment of a reassembled PDU]"
"253","2018-08-23 02:24:21.460753","192.168.2.3","216.58.197.4","TLSv1.2","212","Application Data"
"254","2018-08-23 02:24:21.460754","192.168.2.3","216.58.197.4","TCP","1434","34236  >  443 [ACK] Seq=144232 Ack=1115 Win=2363 Len=1368 TSval=7974357 TSecr=761636178 [TCP segment of a reassembled PDU]"
"255","2018-08-23 02:24:21.460755","192.168.2.3","216.58.197.4","TLSv1.2","155","Application Data"
"261","2018-08-23 02:24:21.485619","192.168.2.3","216.58.197.4","TCP","66","34236  >  443 [ACK] Seq=145689 Ack=1427 Win=2363 Len=0 TSval=7974359 TSecr=761636282"
"262","2018-08-23 02:24:21.560245","192.168.2.3","216.58.197.4","TCP","1434","34236  >  443 [ACK] Seq=145689 Ack=1427 Win=2363 Len=1368 TSval=7974367 TSecr=761636282 [TCP segment of a reassembled PDU]"
"263","2018-08-23 02:24:21.560652","192.168.2.3","216.58.197.4","TCP","1434","34236  >  443 [ACK] Seq=147057 Ack=1427 Win=2363 Len=1368 TSval=7974367 TSecr=761636282 [TCP segment of a reassembled PDU]"
"264","2018-08-23 02:24:21.560668","192.168.2.3","216.58.197.4","TLSv1.2","212","Application Data"
"265","2018-08-23 02:24:21.560669","192.168.2.3","216.58.197.4","TCP","1434","34236  >  443 [ACK] Seq=148571 Ack=1427 Win=2363 Len=1368 TSval=7974367 TSecr=761636282 [TCP segment of a reassembled PDU]"
"266","2018-08-23 02:24:21.560785","192.168.2.3","216.58.197.4","TLSv1.2","155","Application Data"
"272","2018-08-23 02:24:21.624109","192.168.2.3","216.58.197.4","TCP","66","34236  >  443 [ACK] Seq=150028 Ack=1612 Win=2363 Len=0 TSval=7974373 TSecr=761636421"
"273","2018-08-23 02:24:21.630771","192.168.2.3","216.58.197.4","TCP","1434","34236  >  443 [ACK] Seq=150028 Ack=1612 Win=2363 Len=1368 TSval=7974374 TSecr=761636421 [TCP segment of a reassembled PDU]"
"274","2018-08-23 02:24:21.631132","192.168.2.3","216.58.197.4","TCP","1434","34236  >  443 [ACK] Seq=151396 Ack=1612 Win=2363 Len=1368 TSval=7974374 TSecr=761636421 [TCP segment of a reassembled PDU]"
"275","2018-08-23 02:24:21.631135","192.168.2.3","216.58.197.4","TLSv1.2","212","Application Data"
"276","2018-08-23 02:24:21.631626","192.168.2.3","216.58.197.4","TCP","1434","34236  >  443 [ACK] Seq=152910 Ack=1612 Win=2363 Len=1368 TSval=7974374 TSecr=761636421 [TCP segment of a reassembled PDU]"
"277","2018-08-23 02:24:21.631629","192.168.2.3","216.58.197.4","TLSv1.2","155","Application Data"
"281","2018-08-23 02:24:21.724359","192.168.2.3","216.58.197.4","TCP","1434","34236  >  443 [ACK] Seq=154367 Ack=1612 Win=2363 Len=1368 TSval=7974383 TSecr=761636434 [TCP segment of a reassembled PDU]"
"282","2018-08-23 02:24:21.724364","192.168.2.3","216.58.197.4","TCP","1434","34236  >  443 [ACK] Seq=155735 Ack=1612 Win=2363 Len=1368 TSval=7974383 TSecr=761636434 [TCP segment of a reassembled PDU]"
"283","2018-08-23 02:24:21.724534","192.168.2.3","216.58.197.4","TLSv1.2","212","Application Data"
"284","2018-08-23 02:24:21.724750","192.168.2.3","216.58.197.4","TCP","1434","34236  >  443 [ACK] Seq=157249 Ack=1612 Win=2363 Len=1368 TSval=7974383 TSecr=761636434 [TCP segment of a reassembled PDU]"
"285","2018-08-23 02:24:21.725200","192.168.2.3","216.58.197.4","TLSv1.2","155","Application Data"
"288","2018-08-23 02:24:21.790432","192.168.2.3","216.58.197.4","TCP","1434","34236  >  443 [ACK] Seq=158706 Ack=1612 Win=2363 Len=1368 TSval=7974390 TSecr=761636527 [TCP segment of a reassembled PDU]"
"289","2018-08-23 02:24:21.790824","192.168.2.3","216.58.197.4","TCP","1434","34236  >  443 [ACK] Seq=160074 Ack=1612 Win=2363 Len=1368 TSval=7974390 TSecr=761636527 [TCP segment of a reassembled PDU]"
"290","2018-08-23 02:24:21.790826","192.168.2.3","216.58.197.4","TLSv1.2","212","Application Data"
"291","2018-08-23 02:24:21.791290","192.168.2.3","216.58.197.4","TCP","1434","34236  >  443 [ACK] Seq=161588 Ack=1612 Win=2363 Len=1368 TSval=7974390 TSecr=761636527 [TCP segment of a reassembled PDU]"
"292","2018-08-23 02:24:21.791292","192.168.2.3","216.58.197.4","TLSv1.2","155","Application Data"
"297","2018-08-23 02:24:21.826021","192.168.2.3","216.58.197.4","TCP","66","34236  >  443 [ACK] Seq=163045 Ack=1862 Win=2363 Len=0 TSval=7974394 TSecr=761636590"
"300","2018-08-23 02:24:21.864048","192.168.2.3","216.58.197.4","TCP","66","34236  >  443 [ACK] Seq=163045 Ack=2324 Win=2363 Len=0 TSval=7974397 TSecr=761636657"
"302","2018-08-23 02:24:21.877148","192.168.2.3","216.58.197.4","TCP","66","34236  >  443 [ACK] Seq=163045 Ack=2530 Win=2363 Len=0 TSval=7974398 TSecr=761636668"
"303","2018-08-23 02:24:21.881071","192.168.2.3","216.58.197.4","TCP","1434","34236  >  443 [ACK] Seq=163045 Ack=2530 Win=2363 Len=1368 TSval=7974399 TSecr=761636668 [TCP segment of a reassembled PDU]"
"304","2018-08-23 02:24:21.881076","192.168.2.3","216.58.197.4","TCP","1434","34236  >  443 [ACK] Seq=164413 Ack=2530 Win=2363 Len=1368 TSval=7974399 TSecr=761636668 [TCP segment of a reassembled PDU]"
"305","2018-08-23 02:24:21.881077","192.168.2.3","216.58.197.4","TLSv1.2","212","Application Data"
"306","2018-08-23 02:24:21.881404","192.168.2.3","216.58.197.4","TCP","1434","34236  >  443 [ACK] Seq=165927 Ack=2530 Win=2363 Len=1368 TSval=7974399 TSecr=761636668 [TCP segment of a reassembled PDU]"
"307","2018-08-23 02:24:21.881421","192.168.2.3","216.58.197.4","TLSv1.2","155","Application Data"
"310","2018-08-23 02:24:21.971413","192.168.2.3","216.58.197.4","TCP","1434","34236  >  443 [ACK] Seq=167384 Ack=2530 Win=2363 Len=1368 TSval=7974408 TSecr=761636684 [TCP segment of a reassembled PDU]"
"311","2018-08-23 02:24:21.971814","192.168.2.3","216.58.197.4","TCP","1434","34236  >  443 [ACK] Seq=168752 Ack=2530 Win=2363 Len=1368 TSval=7974408 TSecr=761636684 [TCP segment of a reassembled PDU]"
"312","2018-08-23 02:24:21.971817","192.168.2.3","216.58.197.4","TLSv1.2","212","Application Data"
"313","2018-08-23 02:24:21.971992","192.168.2.3","216.58.197.4","TCP","1434","34236  >  443 [ACK] Seq=170266 Ack=2530 Win=2363 Len=1368 TSval=7974408 TSecr=761636684 [TCP segment of a reassembled PDU]"
"314","2018-08-23 02:24:21.971994","192.168.2.3","216.58.197.4","TLSv1.2","155","Application Data"
"318","2018-08-23 02:24:22.037441","192.168.2.3","216.58.197.4","TCP","1434","34236  >  443 [ACK] Seq=171723 Ack=2530 Win=2363 Len=1368 TSval=7974414 TSecr=761636774 [TCP segment of a reassembled PDU]"
"319","2018-08-23 02:24:22.037730","192.168.2.3","216.58.197.4","TCP","1434","34236  >  443 [ACK] Seq=173091 Ack=2530 Win=2363 Len=1368 TSval=7974414 TSecr=761636774 [TCP segment of a reassembled PDU]"
"320","2018-08-23 02:24:22.037732","192.168.2.3","216.58.197.4","TLSv1.2","212","Application Data"
"321","2018-08-23 02:24:22.037733","192.168.2.3","216.58.197.4","TCP","1434","34236  >  443 [ACK] Seq=174605 Ack=2530 Win=2363 Len=1368 TSval=7974414 TSecr=761636774 [TCP segment of a reassembled PDU]"
"322","2018-08-23 02:24:22.037867","192.168.2.3","216.58.197.4","TLSv1.2","155","Application Data"
"326","2018-08-23 02:24:22.135825","192.168.2.3","216.58.197.4","TCP","1434","34236  >  443 [ACK] Seq=176062 Ack=2530 Win=2363 Len=1368 TSval=7974424 TSecr=761636840 [TCP segment of a reassembled PDU]"
"327","2018-08-23 02:24:22.135830","192.168.2.3","216.58.197.4","TCP","1434","34236  >  443 [ACK] Seq=177430 Ack=2530 Win=2363 Len=1368 TSval=7974424 TSecr=761636840 [TCP segment of a reassembled PDU]"
"328","2018-08-23 02:24:22.135831","192.168.2.3","216.58.197.4","TLSv1.2","212","Application Data"
"329","2018-08-23 02:24:22.135940","192.168.2.3","216.58.197.4","TCP","1434","34236  >  443 [ACK] Seq=178944 Ack=2530 Win=2363 Len=1368 TSval=7974424 TSecr=761636840 [TCP segment of a reassembled PDU]"
"330","2018-08-23 02:24:22.136210","192.168.2.3","216.58.197.4","TLSv1.2","155","Application Data"
"335","2018-08-23 02:24:22.195833","192.168.2.3","216.58.197.4","TCP","66","34236  >  443 [ACK] Seq=180401 Ack=2953 Win=2363 Len=0 TSval=7974430 TSecr=761636993"
"336","2018-08-23 02:24:22.206654","192.168.2.3","216.58.197.4","TCP","1434","34236  >  443 [ACK] Seq=180401 Ack=2953 Win=2363 Len=1368 TSval=7974432 TSecr=761636993 [TCP segment of a reassembled PDU]"
"337","2018-08-23 02:24:22.208913","192.168.2.3","216.58.197.4","TCP","1434","34236  >  443 [ACK] Seq=181769 Ack=2953 Win=2363 Len=1368 TSval=7974432 TSecr=761636993 [TCP segment of a reassembled PDU]"
"338","2018-08-23 02:24:22.208918","192.168.2.3","216.58.197.4","TLSv1.2","212","Application Data"
"339","2018-08-23 02:24:22.209132","192.168.2.3","216.58.197.4","TCP","1434","34236  >  443 [ACK] Seq=183283 Ack=2953 Win=2363 Len=1368 TSval=7974432 TSecr=761636993 [TCP segment of a reassembled PDU]"
"340","2018-08-23 02:24:22.209135","192.168.2.3","216.58.197.4","TLSv1.2","155","Application Data"
"346","2018-08-23 02:24:22.237420","192.168.2.3","216.58.197.4","TCP","66","34236  >  443 [ACK] Seq=184740 Ack=3087 Win=2363 Len=0 TSval=7974435 TSecr=761637020"
"347","2018-08-23 02:24:22.302457","192.168.2.3","216.58.197.4","TCP","1434","34236  >  443 [ACK] Seq=184740 Ack=3087 Win=2363 Len=1368 TSval=7974441 TSecr=761637020 [TCP segment of a reassembled PDU]"
"348","2018-08-23 02:24:22.302917","192.168.2.3","216.58.197.4","TCP","1434","34236  >  443 [ACK] Seq=186108 Ack=3087 Win=2363 Len=1368 TSval=7974441 TSecr=761637020 [TCP segment of a reassembled PDU]"
"349","2018-08-23 02:24:22.302921","192.168.2.3","216.58.197.4","TLSv1.2","212","Application Data"
"350","2018-08-23 02:24:22.302922","192.168.2.3","216.58.197.4","TCP","1434","34236  >  443 [ACK] Seq=187622 Ack=3087 Win=2363 Len=1368 TSval=7974441 TSecr=761637020 [TCP segment of a reassembled PDU]"
"351","2018-08-23 02:24:22.302923","192.168.2.3","216.58.197.4","TLSv1.2","155","Application Data"
"357","2018-08-23 02:24:22.354849","192.168.2.3","216.58.197.4","TCP","66","34236  >  443 [ACK] Seq=189079 Ack=3563 Win=2363 Len=0 TSval=7974446 TSecr=761637150"
"358","2018-08-23 02:24:22.389156","192.168.2.3","216.58.197.4","TCP","1434","34236  >  443 [ACK] Seq=189079 Ack=3563 Win=2363 Len=1368 TSval=7974450 TSecr=761637150 [TCP segment of a reassembled PDU]"
"359","2018-08-23 02:24:22.389161","192.168.2.3","216.58.197.4","TCP","1434","34236  >  443 [ACK] Seq=190447 Ack=3563 Win=2363 Len=1368 TSval=7974450 TSecr=761637150 [TCP segment of a reassembled PDU]"
"360","2018-08-23 02:24:22.389162","192.168.2.3","216.58.197.4","TLSv1.2","212","Application Data"
"361","2018-08-23 02:24:22.389462","192.168.2.3","216.58.197.4","TCP","1434","34236  >  443 [ACK] Seq=191961 Ack=3563 Win=2363 Len=1368 TSval=7974450 TSecr=761637150 [TCP segment of a reassembled PDU]"
"362","2018-08-23 02:24:22.389465","192.168.2.3","216.58.197.4","TLSv1.2","155","Application Data"
"366","2018-08-23 02:24:22.462808","192.168.2.3","216.58.197.4","TCP","1434","34236  >  443 [ACK] Seq=193418 Ack=3563 Win=2363 Len=1368 TSval=7974457 TSecr=761637192 [TCP segment of a reassembled PDU]"
"367","2018-08-23 02:24:22.463326","192.168.2.3","216.58.197.4","TCP","1434","34236  >  443 [ACK] Seq=194786 Ack=3563 Win=2363 Len=1368 TSval=7974457 TSecr=761637192 [TCP segment of a reassembled PDU]"
"368","2018-08-23 02:24:22.463329","192.168.2.3","216.58.197.4","TLSv1.2","212","Application Data"
"369","2018-08-23 02:24:22.463607","192.168.2.3","216.58.197.4","TCP","1434","34236  >  443 [ACK] Seq=196300 Ack=3563 Win=2363 Len=1368 TSval=7974457 TSecr=761637192 [TCP segment of a reassembled PDU]"
"370","2018-08-23 02:24:22.463610","192.168.2.3","216.58.197.4","TLSv1.2","155","Application Data"
"374","2018-08-23 02:24:22.551401","192.168.2.3","216.58.197.4","TCP","1434","34236  >  443 [ACK] Seq=197757 Ack=3563 Win=2363 Len=1368 TSval=7974466 TSecr=761637266 [TCP segment of a reassembled PDU]"
"375","2018-08-23 02:24:22.551722","192.168.2.3","216.58.197.4","TCP","1434","34236  >  443 [ACK] Seq=199125 Ack=3563 Win=2363 Len=1368 TSval=7974466 TSecr=761637266 [TCP segment of a reassembled PDU]"
"376","2018-08-23 02:24:22.551726","192.168.2.3","216.58.197.4","TLSv1.2","212","Application Data"
"377","2018-08-23 02:24:22.552182","192.168.2.3","216.58.197.4","TCP","1434","34236  >  443 [ACK] Seq=200639 Ack=3563 Win=2363 Len=1368 TSval=7974466 TSecr=761637266 [TCP segment of a reassembled PDU]"
"378","2018-08-23 02:24:22.552185","192.168.2.3","216.58.197.4","TLSv1.2","155","Application Data"
"384","2018-08-23 02:24:22.610972","192.168.2.3","216.58.197.4","TCP","66","34236  >  443 [ACK] Seq=202096 Ack=3960 Win=2363 Len=0 TSval=7974472 TSecr=761637405"
"385","2018-08-23 02:24:22.645879","192.168.2.3","216.58.197.4","TCP","1434","34236  >  443 [ACK] Seq=202096 Ack=3960 Win=2363 Len=1368 TSval=7974475 TSecr=761637405 [TCP segment of a reassembled PDU]"
"386","2018-08-23 02:24:22.646323","192.168.2.3","216.58.197.4","TCP","1434","34236  >  443 [ACK] Seq=203464 Ack=3960 Win=2363 Len=1368 TSval=7974475 TSecr=761637405 [TCP segment of a reassembled PDU]"
"387","2018-08-23 02:24:22.646326","192.168.2.3","216.58.197.4","TLSv1.2","212","Application Data"
"388","2018-08-23 02:24:22.646327","192.168.2.3","216.58.197.4","TCP","1434","34236  >  443 [ACK] Seq=204978 Ack=3960 Win=2363 Len=1368 TSval=7974475 TSecr=761637405 [TCP segment of a reassembled PDU]"
"389","2018-08-23 02:24:22.646418","192.168.2.3","216.58.197.4","TLSv1.2","155","Application Data"
"393","2018-08-23 02:24:22.709831","192.168.2.3","216.58.197.4","TCP","1434","34236  >  443 [ACK] Seq=206435 Ack=3960 Win=2363 Len=1368 TSval=7974482 TSecr=761637449 [TCP segment of a reassembled PDU]"
"394","2018-08-23 02:24:22.710247","192.168.2.3","216.58.197.4","TCP","1434","34236  >  443 [ACK] Seq=207803 Ack=3960 Win=2363 Len=1368 TSval=7974482 TSecr=761637449 [TCP segment of a reassembled PDU]"
"395","2018-08-23 02:24:22.710252","192.168.2.3","216.58.197.4","TLSv1.2","212","Application Data"
"396","2018-08-23 02:24:22.710577","192.168.2.3","216.58.197.4","TCP","1434","34236  >  443 [ACK] Seq=209317 Ack=3960 Win=2363 Len=1368 TSval=7974482 TSecr=761637449 [TCP segment of a reassembled PDU]"
"397","2018-08-23 02:24:22.710580","192.168.2.3","216.58.197.4","TLSv1.2","155","Application Data"
"403","2018-08-23 02:24:22.770947","192.168.2.3","216.58.197.4","TCP","66","34236  >  443 [ACK] Seq=210774 Ack=4346 Win=2363 Len=0 TSval=7974488 TSecr=761637567"
"404","2018-08-23 02:24:22.805874","192.168.2.3","216.58.197.4","TCP","1434","34236  >  443 [ACK] Seq=210774 Ack=4346 Win=2363 Len=1368 TSval=7974491 TSecr=761637567 [TCP segment of a reassembled PDU]"
"405","2018-08-23 02:24:22.806235","192.168.2.3","216.58.197.4","TCP","1434","34236  >  443 [ACK] Seq=212142 Ack=4346 Win=2363 Len=1368 TSval=7974491 TSecr=761637567 [TCP segment of a reassembled PDU]"
"406","2018-08-23 02:24:22.806238","192.168.2.3","216.58.197.4","TLSv1.2","212","Application Data"
"407","2018-08-23 02:24:22.806420","192.168.2.3","216.58.197.4","TCP","1434","34236  >  443 [ACK] Seq=213656 Ack=4346 Win=2363 Len=1368 TSval=7974491 TSecr=761637567 [TCP segment of a reassembled PDU]"
"408","2018-08-23 02:24:22.806423","192.168.2.3","216.58.197.4","TLSv1.2","155","Application Data"
"414","2018-08-23 02:24:22.866809","192.168.2.3","216.58.197.4","TCP","66","34236  >  443 [ACK] Seq=215113 Ack=4692 Win=2363 Len=0 TSval=7974498 TSecr=761637660"
