"No.","Time","Source","Destination","Protocol","Length","Info"
"2","2018-08-23 02:21:59.029112","192.168.2.3","192.168.2.1","TCP","183","8009  >  53029 [PSH, ACK] Seq=1 Ack=118 Win=277 Len=117 TSval=7960114 TSecr=2316856794 [TCP segment of a reassembled PDU]"
"4","2018-08-23 02:21:59.914581","192.168.2.3","203.211.199.120","TLSv1.2","788","Application Data"
"10","2018-08-23 02:21:59.966377","192.168.2.3","203.211.199.120","TCP","66","52030  >  443 [ACK] Seq=723 Ack=2897 Win=1007 Len=0 TSval=7960208 TSecr=1193362948"
"11","2018-08-23 02:21:59.966766","192.168.2.3","203.211.199.120","TCP","66","52030  >  443 [ACK] Seq=723 Ack=5193 Win=1007 Len=0 TSval=7960208 TSecr=1193362948"
"12","2018-08-23 02:22:02.897210","192.168.2.3","216.58.197.4","TLSv1.2","156","Application Data"
"13","2018-08-23 02:22:02.897621","192.168.2.3","216.58.197.4","TLSv1.2","104","Application Data"
"14","2018-08-23 02:22:02.898469","192.168.2.3","216.58.197.4","TLSv1.2","159","Application Data"
"18","2018-08-23 02:22:02.911089","192.168.2.3","216.58.197.4","TCP","1434","34236  >  443 [ACK] Seq=222 Ack=39 Win=2363 Len=1368 TSval=7960502 TSecr=761497700 [TCP segment of a reassembled PDU]"
"19","2018-08-23 02:22:02.911339","192.168.2.3","216.58.197.4","TCP","1434","34236  >  443 [ACK] Seq=1590 Ack=39 Win=2363 Len=1368 TSval=7960502 TSecr=761497700 [TCP segment of a reassembled PDU]"
"20","2018-08-23 02:22:02.911341","192.168.2.3","216.58.197.4","TLSv1.2","212","Application Data"
"21","2018-08-23 02:22:02.911762","192.168.2.3","216.58.197.4","TCP","1434","34236  >  443 [ACK] Seq=3104 Ack=39 Win=2363 Len=1368 TSval=7960502 TSecr=761497700 [TCP segment of a reassembled PDU]"
"22","2018-08-23 02:22:02.911765","192.168.2.3","216.58.197.4","TLSv1.2","361","Application Data"
"23","2018-08-23 02:22:02.912204","192.168.2.3","216.58.197.4","TCP","1434","34236  >  443 [ACK] Seq=4767 Ack=39 Win=2363 Len=1368 TSval=7960502 TSecr=761497700 [TCP segment of a reassembled PDU]"
"24","2018-08-23 02:22:02.912489","192.168.2.3","216.58.197.4","TCP","1434","34236  >  443 [ACK] Seq=6135 Ack=39 Win=2363 Len=1368 TSval=7960502 TSecr=761497700 [TCP segment of a reassembled PDU]"
"25","2018-08-23 02:22:02.912491","192.168.2.3","216.58.197.4","TLSv1.2","212","Application Data"
"26","2018-08-23 02:22:02.912709","192.168.2.3","216.58.197.4","TCP","1434","34236  >  443 [ACK] Seq=7649 Ack=39 Win=2363 Len=1368 TSval=7960502 TSecr=761497700 [TCP segment of a reassembled PDU]"
"32","2018-08-23 02:22:02.918593","192.168.2.3","216.58.197.4","TLSv1.2","1434","Application Data [TCP segment of a reassembled PDU]"
"33","2018-08-23 02:22:02.918597","192.168.2.3","216.58.197.4","TCP","1434","34236  >  443 [ACK] Seq=10385 Ack=39 Win=2363 Len=1368 TSval=7960503 TSecr=761497713 [TCP segment of a reassembled PDU]"
"34","2018-08-23 02:22:02.918947","192.168.2.3","216.58.197.4","TLSv1.2","1434","Application Data [TCP segment of a reassembled PDU]"
"35","2018-08-23 02:22:02.920558","192.168.2.3","216.58.197.4","TLSv1.2","1434","Application Data [TCP segment of a reassembled PDU]"
"36","2018-08-23 02:22:02.920739","192.168.2.3","216.58.197.4","TCP","1434","34236  >  443 [ACK] Seq=14489 Ack=39 Win=2363 Len=1368 TSval=7960503 TSecr=761497713 [TCP segment of a reassembled PDU]"
"37","2018-08-23 02:22:02.921089","192.168.2.3","216.58.197.4","TLSv1.2","1434","Application Data [TCP segment of a reassembled PDU]"
"41","2018-08-23 02:22:02.925674","192.168.2.3","216.58.197.4","TLSv1.2","1434","Application Data [TCP segment of a reassembled PDU]"
"42","2018-08-23 02:22:02.925677","192.168.2.3","216.58.197.4","TCP","1434","34236  >  443 [ACK] Seq=18593 Ack=39 Win=2363 Len=1368 TSval=7960503 TSecr=761497714 [TCP segment of a reassembled PDU]"
"43","2018-08-23 02:22:02.926038","192.168.2.3","216.58.197.4","TLSv1.2","1434","Application Data [TCP segment of a reassembled PDU]"
"44","2018-08-23 02:22:02.926040","192.168.2.3","216.58.197.4","TLSv1.2","1434","Application Data [TCP segment of a reassembled PDU]"
"45","2018-08-23 02:22:02.926361","192.168.2.3","216.58.197.4","TCP","1434","34236  >  443 [ACK] Seq=22697 Ack=39 Win=2363 Len=1368 TSval=7960503 TSecr=761497715 [TCP segment of a reassembled PDU]"
"46","2018-08-23 02:22:02.926544","192.168.2.3","216.58.197.4","TLSv1.2","1434","Application Data [TCP segment of a reassembled PDU]"
"47","2018-08-23 02:22:02.926776","192.168.2.3","216.58.197.4","TLSv1.2","1434","Application Data [TCP segment of a reassembled PDU]"
"48","2018-08-23 02:22:02.926993","192.168.2.3","216.58.197.4","TCP","1434","34236  >  443 [ACK] Seq=26801 Ack=39 Win=2363 Len=1368 TSval=7960503 TSecr=761497715 [TCP segment of a reassembled PDU]"
"49","2018-08-23 02:22:02.926996","192.168.2.3","216.58.197.4","TLSv1.2","1434","Application Data [TCP segment of a reassembled PDU]"
"50","2018-08-23 02:22:02.927508","192.168.2.3","216.58.197.4","TLSv1.2","1434","Application Data [TCP segment of a reassembled PDU]"
"51","2018-08-23 02:22:02.927510","192.168.2.3","216.58.197.4","TCP","1434","34236  >  443 [ACK] Seq=30905 Ack=39 Win=2363 Len=1368 TSval=7960504 TSecr=761497721 [TCP segment of a reassembled PDU]"
"52","2018-08-23 02:22:02.927664","192.168.2.3","216.58.197.4","TCP","1434","34236  >  443 [ACK] Seq=32273 Ack=39 Win=2363 Len=1368 TSval=7960504 TSecr=761497721 [TCP segment of a reassembled PDU]"
"53","2018-08-23 02:22:02.927885","192.168.2.3","216.58.197.4","TLSv1.2","1434","Application Data [TCP segment of a reassembled PDU]"
"54","2018-08-23 02:22:02.928046","192.168.2.3","216.58.197.4","TLSv1.2","1434","Application Data [TCP segment of a reassembled PDU]"
"55","2018-08-23 02:22:02.928360","192.168.2.3","216.58.197.4","TCP","1434","34236  >  443 [ACK] Seq=36377 Ack=39 Win=2363 Len=1368 TSval=7960504 TSecr=761497723 [TCP segment of a reassembled PDU]"
"57","2018-08-23 02:22:02.929965","192.168.2.3","216.58.197.4","TLSv1.2","1434","Application Data [TCP segment of a reassembled PDU]"
"58","2018-08-23 02:22:02.930303","192.168.2.3","216.58.197.4","TLSv1.2","1434","Application Data [TCP segment of a reassembled PDU]"
"59","2018-08-23 02:22:02.930319","192.168.2.3","216.58.197.4","TCP","1434","34236  >  443 [ACK] Seq=40481 Ack=39 Win=2363 Len=1368 TSval=7960504 TSecr=761497723 [TCP segment of a reassembled PDU]"
"65","2018-08-23 02:22:02.932036","192.168.2.3","216.58.197.4","TLSv1.2","1434","Application Data [TCP segment of a reassembled PDU]"
"67","2018-08-23 02:22:02.932424","192.168.2.3","216.58.197.4","TLSv1.2","1434","Application Data [TCP segment of a reassembled PDU]"
"68","2018-08-23 02:22:02.932426","192.168.2.3","216.58.197.4","TCP","1434","34236  >  443 [ACK] Seq=44585 Ack=39 Win=2363 Len=1368 TSval=7960504 TSecr=761497728 [TCP segment of a reassembled PDU]"
"69","2018-08-23 02:22:02.932675","192.168.2.3","216.58.197.4","TLSv1.2","1434","Application Data [TCP segment of a reassembled PDU]"
"70","2018-08-23 02:22:02.933101","192.168.2.3","216.58.197.4","TLSv1.2","1434","Application Data [TCP segment of a reassembled PDU]"
"71","2018-08-23 02:22:02.933507","192.168.2.3","216.58.197.4","TCP","1434","34236  >  443 [ACK] Seq=48689 Ack=39 Win=2363 Len=1368 TSval=7960504 TSecr=761497728 [TCP segment of a reassembled PDU]"
"72","2018-08-23 02:22:02.933510","192.168.2.3","216.58.197.4","TLSv1.2","1434","Application Data [TCP segment of a reassembled PDU]"
"73","2018-08-23 02:22:02.933836","192.168.2.3","216.58.197.4","TCP","1434","34236  >  443 [ACK] Seq=51425 Ack=39 Win=2363 Len=1368 TSval=7960504 TSecr=761497729 [TCP segment of a reassembled PDU]"
"76","2018-08-23 02:22:02.934647","192.168.2.3","216.58.197.4","TLSv1.2","1434","Application Data [TCP segment of a reassembled PDU]"
"77","2018-08-23 02:22:02.934649","192.168.2.3","216.58.197.4","TCP","1434","34236  >  443 [PSH, ACK] Seq=54161 Ack=39 Win=2363 Len=1368 TSval=7960504 TSecr=761497729 [TCP segment of a reassembled PDU]"
"78","2018-08-23 02:22:02.935027","192.168.2.3","216.58.197.4","TLSv1.2","1434","Application Data [TCP segment of a reassembled PDU]"
"79","2018-08-23 02:22:02.935330","192.168.2.3","216.58.197.4","TCP","1434","34236  >  443 [ACK] Seq=56897 Ack=39 Win=2363 Len=1368 TSval=7960505 TSecr=761497730 [TCP segment of a reassembled PDU]"
"80","2018-08-23 02:22:02.935332","192.168.2.3","216.58.197.4","TCP","1434","34236  >  443 [ACK] Seq=58265 Ack=39 Win=2363 Len=1368 TSval=7960505 TSecr=761497730 [TCP segment of a reassembled PDU]"
"81","2018-08-23 02:22:02.935918","192.168.2.3","216.58.197.4","TLSv1.2","1434","Application Data [TCP segment of a reassembled PDU]"
"82","2018-08-23 02:22:02.935922","192.168.2.3","216.58.197.4","TCP","1434","34236  >  443 [ACK] Seq=61001 Ack=39 Win=2363 Len=1368 TSval=7960505 TSecr=761497730 [TCP segment of a reassembled PDU]"
"83","2018-08-23 02:22:02.936789","192.168.2.3","216.58.197.4","TLSv1.2","1434","Application Data [TCP segment of a reassembled PDU]"
"86","2018-08-23 02:22:02.937336","192.168.2.3","216.58.197.4","TLSv1.2","1434","Application Data, Application Data"
"88","2018-08-23 02:22:02.937916","192.168.2.3","216.58.197.4","TCP","1434","34236  >  443 [ACK] Seq=65105 Ack=39 Win=2363 Len=1368 TSval=7960505 TSecr=761497730 [TCP segment of a reassembled PDU]"
"89","2018-08-23 02:22:02.938195","192.168.2.3","216.58.197.4","TLSv1.2","1434","Application Data [TCP segment of a reassembled PDU]"
"91","2018-08-23 02:22:02.938472","192.168.2.3","216.58.197.4","TCP","1434","34236  >  443 [ACK] Seq=67841 Ack=39 Win=2363 Len=1368 TSval=7960505 TSecr=761497732 [TCP segment of a reassembled PDU]"
"92","2018-08-23 02:22:02.938474","192.168.2.3","216.58.197.4","TLSv1.2","136","Application Data"
"99","2018-08-23 02:22:02.953793","192.168.2.3","216.58.197.4","TCP","1434","34236  >  443 [ACK] Seq=69279 Ack=39 Win=2363 Len=1368 TSval=7960506 TSecr=761497741 [TCP segment of a reassembled PDU]"
"100","2018-08-23 02:22:02.954207","192.168.2.3","216.58.197.4","TCP","1434","34236  >  443 [ACK] Seq=70647 Ack=39 Win=2363 Len=1368 TSval=7960506 TSecr=761497741 [TCP segment of a reassembled PDU]"
"101","2018-08-23 02:22:02.954210","192.168.2.3","216.58.197.4","TLSv1.2","212","Application Data"
"102","2018-08-23 02:22:02.954211","192.168.2.3","216.58.197.4","TCP","1434","34236  >  443 [ACK] Seq=72161 Ack=39 Win=2363 Len=1368 TSval=7960506 TSecr=761497741 [TCP segment of a reassembled PDU]"
"103","2018-08-23 02:22:02.954363","192.168.2.3","216.58.197.4","TLSv1.2","155","Application Data"
"111","2018-08-23 02:22:03.057354","192.168.2.3","216.58.197.4","TCP","1434","34236  >  443 [ACK] Seq=73618 Ack=39 Win=2363 Len=1368 TSval=7960517 TSecr=761497756 [TCP segment of a reassembled PDU]"
"112","2018-08-23 02:22:03.057643","192.168.2.3","216.58.197.4","TCP","1434","34236  >  443 [ACK] Seq=74986 Ack=39 Win=2363 Len=1368 TSval=7960517 TSecr=761497756 [TCP segment of a reassembled PDU]"
"113","2018-08-23 02:22:03.057645","192.168.2.3","216.58.197.4","TLSv1.2","212","Application Data"
"114","2018-08-23 02:22:03.057646","192.168.2.3","216.58.197.4","TCP","1434","34236  >  443 [ACK] Seq=76500 Ack=39 Win=2363 Len=1368 TSval=7960517 TSecr=761497756 [TCP segment of a reassembled PDU]"
"115","2018-08-23 02:22:03.057754","192.168.2.3","216.58.197.4","TLSv1.2","155","Application Data"
"119","2018-08-23 02:22:03.153262","192.168.2.3","216.58.197.4","TCP","1434","34236  >  443 [ACK] Seq=77957 Ack=39 Win=2363 Len=1368 TSval=7960526 TSecr=761497900 [TCP segment of a reassembled PDU]"
"120","2018-08-23 02:22:03.153715","192.168.2.3","216.58.197.4","TCP","1434","34236  >  443 [ACK] Seq=79325 Ack=39 Win=2363 Len=1368 TSval=7960526 TSecr=761497900 [TCP segment of a reassembled PDU]"
"121","2018-08-23 02:22:03.153718","192.168.2.3","216.58.197.4","TLSv1.2","212","Application Data"
"122","2018-08-23 02:22:03.153719","192.168.2.3","216.58.197.4","TCP","1434","34236  >  443 [ACK] Seq=80839 Ack=39 Win=2363 Len=1368 TSval=7960526 TSecr=761497900 [TCP segment of a reassembled PDU]"
"123","2018-08-23 02:22:03.153720","192.168.2.3","216.58.197.4","TLSv1.2","155","Application Data"
"130","2018-08-23 02:22:03.199784","192.168.2.3","216.58.197.4","TCP","66","34236  >  443 [ACK] Seq=82296 Ack=411 Win=2363 Len=0 TSval=7960531 TSecr=761497996"
"132","2018-08-23 02:22:03.217351","192.168.2.3","216.58.197.4","TCP","66","34236  >  443 [ACK] Seq=82296 Ack=726 Win=2363 Len=0 TSval=7960533 TSecr=761497997"
"133","2018-08-23 02:22:03.250679","192.168.2.3","216.58.197.4","TCP","1434","34236  >  443 [ACK] Seq=82296 Ack=726 Win=2363 Len=1368 TSval=7960536 TSecr=761497997 [TCP segment of a reassembled PDU]"
"134","2018-08-23 02:22:03.250994","192.168.2.3","216.58.197.4","TCP","1434","34236  >  443 [ACK] Seq=83664 Ack=726 Win=2363 Len=1368 TSval=7960536 TSecr=761497997 [TCP segment of a reassembled PDU]"
"135","2018-08-23 02:22:03.250998","192.168.2.3","216.58.197.4","TLSv1.2","212","Application Data"
"136","2018-08-23 02:22:03.251168","192.168.2.3","216.58.197.4","TCP","1434","34236  >  443 [ACK] Seq=85178 Ack=726 Win=2363 Len=1368 TSval=7960536 TSecr=761497997 [TCP segment of a reassembled PDU]"
"137","2018-08-23 02:22:03.251171","192.168.2.3","216.58.197.4","TLSv1.2","155","Application Data"
"142","2018-08-23 02:22:03.368077","192.168.2.3","216.58.197.4","TCP","1434","34236  >  443 [ACK] Seq=86635 Ack=910 Win=2363 Len=1368 TSval=7960547 TSecr=761498156 [TCP segment of a reassembled PDU]"
"143","2018-08-23 02:22:03.368082","192.168.2.3","216.58.197.4","TCP","1434","34236  >  443 [ACK] Seq=88003 Ack=910 Win=2363 Len=1368 TSval=7960547 TSecr=761498156 [TCP segment of a reassembled PDU]"
"144","2018-08-23 02:22:03.368083","192.168.2.3","216.58.197.4","TLSv1.2","212","Application Data"
"145","2018-08-23 02:22:03.368525","192.168.2.3","216.58.197.4","TCP","1434","34236  >  443 [ACK] Seq=89517 Ack=910 Win=2363 Len=1368 TSval=7960547 TSecr=761498156 [TCP segment of a reassembled PDU]"
"146","2018-08-23 02:22:03.368528","192.168.2.3","216.58.197.4","TLSv1.2","155","Application Data"
"150","2018-08-23 02:22:03.466615","192.168.2.3","216.58.197.4","TCP","1434","34236  >  443 [ACK] Seq=90974 Ack=910 Win=2363 Len=1368 TSval=7960557 TSecr=761498171 [TCP segment of a reassembled PDU]"
"151","2018-08-23 02:22:03.466619","192.168.2.3","216.58.197.4","TCP","1434","34236  >  443 [ACK] Seq=92342 Ack=910 Win=2363 Len=1368 TSval=7960557 TSecr=761498171 [TCP segment of a reassembled PDU]"
"152","2018-08-23 02:22:03.466744","192.168.2.3","216.58.197.4","TLSv1.2","212","Application Data"
"153","2018-08-23 02:22:03.466748","192.168.2.3","216.58.197.4","TCP","1434","34236  >  443 [ACK] Seq=93856 Ack=910 Win=2363 Len=1368 TSval=7960557 TSecr=761498171 [TCP segment of a reassembled PDU]"
"154","2018-08-23 02:22:03.467053","192.168.2.3","216.58.197.4","TLSv1.2","155","Application Data"
"158","2018-08-23 02:22:03.554691","192.168.2.3","216.58.197.4","TCP","66","34236  >  443 [ACK] Seq=95313 Ack=1044 Win=2363 Len=0 TSval=7960567 TSecr=761498320"
"159","2018-08-23 02:22:03.569340","192.168.2.3","216.58.197.4","TCP","1434","34236  >  443 [ACK] Seq=95313 Ack=1044 Win=2363 Len=1368 TSval=7960568 TSecr=761498320 [TCP segment of a reassembled PDU]"
"160","2018-08-23 02:22:03.569735","192.168.2.3","216.58.197.4","TCP","1434","34236  >  443 [ACK] Seq=96681 Ack=1044 Win=2363 Len=1368 TSval=7960568 TSecr=761498320 [TCP segment of a reassembled PDU]"
"161","2018-08-23 02:22:03.569738","192.168.2.3","216.58.197.4","TLSv1.2","212","Application Data"
"162","2018-08-23 02:22:03.569925","192.168.2.3","216.58.197.4","TCP","1434","34236  >  443 [ACK] Seq=98195 Ack=1044 Win=2363 Len=1368 TSval=7960568 TSecr=761498320 [TCP segment of a reassembled PDU]"
"163","2018-08-23 02:22:03.569927","192.168.2.3","216.58.197.4","TLSv1.2","124","Application Data"
"167","2018-08-23 02:22:03.681754","192.168.2.3","216.58.197.4","TCP","1434","34236  >  443 [ACK] Seq=99621 Ack=1044 Win=2363 Len=1368 TSval=7960579 TSecr=761498372 [TCP segment of a reassembled PDU]"
"168","2018-08-23 02:22:03.682172","192.168.2.3","216.58.197.4","TCP","1434","34236  >  443 [ACK] Seq=100989 Ack=1044 Win=2363 Len=1368 TSval=7960579 TSecr=761498372 [TCP segment of a reassembled PDU]"
"169","2018-08-23 02:22:03.682174","192.168.2.3","216.58.197.4","TLSv1.2","212","Application Data"
"170","2018-08-23 02:22:03.682372","192.168.2.3","216.58.197.4","TCP","1434","34236  >  443 [ACK] Seq=102503 Ack=1044 Win=2363 Len=1368 TSval=7960579 TSecr=761498372 [TCP segment of a reassembled PDU]"
"171","2018-08-23 02:22:03.682375","192.168.2.3","216.58.197.4","TLSv1.2","155","Application Data"
"175","2018-08-23 02:22:03.759284","192.168.2.3","216.58.197.4","TCP","1434","34236  >  443 [ACK] Seq=103960 Ack=1044 Win=2363 Len=1368 TSval=7960587 TSecr=761498485 [TCP segment of a reassembled PDU]"
"176","2018-08-23 02:22:03.759925","192.168.2.3","216.58.197.4","TCP","1434","34236  >  443 [ACK] Seq=105328 Ack=1044 Win=2363 Len=1368 TSval=7960587 TSecr=761498485 [TCP segment of a reassembled PDU]"
"177","2018-08-23 02:22:03.759929","192.168.2.3","216.58.197.4","TLSv1.2","212","Application Data"
"178","2018-08-23 02:22:03.760243","192.168.2.3","216.58.197.4","TCP","1434","34236  >  443 [ACK] Seq=106842 Ack=1044 Win=2363 Len=1368 TSval=7960587 TSecr=761498485 [TCP segment of a reassembled PDU]"
"179","2018-08-23 02:22:03.760867","192.168.2.3","216.58.197.4","TLSv1.2","155","Application Data"
"182","2018-08-23 02:22:03.847672","192.168.2.3","216.58.197.4","TCP","1434","34236  >  443 [ACK] Seq=108299 Ack=1044 Win=2363 Len=1368 TSval=7960596 TSecr=761498563 [TCP segment of a reassembled PDU]"
"183","2018-08-23 02:22:03.848036","192.168.2.3","216.58.197.4","TCP","1434","34236  >  443 [ACK] Seq=109667 Ack=1044 Win=2363 Len=1368 TSval=7960596 TSecr=761498563 [TCP segment of a reassembled PDU]"
"184","2018-08-23 02:22:03.848038","192.168.2.3","216.58.197.4","TLSv1.2","212","Application Data"
"185","2018-08-23 02:22:03.848513","192.168.2.3","216.58.197.4","TCP","1434","34236  >  443 [ACK] Seq=111181 Ack=1044 Win=2363 Len=1368 TSval=7960596 TSecr=761498563 [TCP segment of a reassembled PDU]"
"186","2018-08-23 02:22:03.848515","192.168.2.3","216.58.197.4","TLSv1.2","155","Application Data"
"190","2018-08-23 02:22:03.951219","192.168.2.3","216.58.197.4","TCP","1434","34236  >  443 [ACK] Seq=112638 Ack=1044 Win=2363 Len=1368 TSval=7960606 TSecr=761498651 [TCP segment of a reassembled PDU]"
"191","2018-08-23 02:22:03.954846","192.168.2.3","216.58.197.4","TCP","1434","34236  >  443 [ACK] Seq=114006 Ack=1044 Win=2363 Len=1368 TSval=7960606 TSecr=761498651 [TCP segment of a reassembled PDU]"
"192","2018-08-23 02:22:03.954848","192.168.2.3","216.58.197.4","TLSv1.2","212","Application Data"
"193","2018-08-23 02:22:03.955163","192.168.2.3","216.58.197.4","TCP","1434","34236  >  443 [ACK] Seq=115520 Ack=1044 Win=2363 Len=1368 TSval=7960606 TSecr=761498651 [TCP segment of a reassembled PDU]"
"194","2018-08-23 02:22:03.955165","192.168.2.3","216.58.197.4","TLSv1.2","155","Application Data"
"199","2018-08-23 02:22:04.038839","192.168.2.3","192.168.2.1","TCP","183","8009  >  53029 [PSH, ACK] Seq=118 Ack=235 Win=277 Len=117 TSval=7960615 TSecr=2316861785 [TCP segment of a reassembled PDU]"
"201","2018-08-23 02:22:04.050515","192.168.2.3","216.58.197.4","TCP","1434","34236  >  443 [ACK] Seq=116977 Ack=1044 Win=2363 Len=1368 TSval=7960616 TSecr=761498757 [TCP segment of a reassembled PDU]"
"202","2018-08-23 02:22:04.050673","192.168.2.3","216.58.197.4","TCP","1434","34236  >  443 [ACK] Seq=118345 Ack=1044 Win=2363 Len=1368 TSval=7960616 TSecr=761498757 [TCP segment of a reassembled PDU]"
"203","2018-08-23 02:22:04.050679","192.168.2.3","216.58.197.4","TLSv1.2","212","Application Data"
"204","2018-08-23 02:22:04.050778","192.168.2.3","216.58.197.4","TCP","1434","34236  >  443 [ACK] Seq=119859 Ack=1044 Win=2363 Len=1368 TSval=7960616 TSecr=761498757 [TCP segment of a reassembled PDU]"
"205","2018-08-23 02:22:04.050781","192.168.2.3","216.58.197.4","TLSv1.2","155","Application Data"
"208","2018-08-23 02:22:04.137726","192.168.2.3","216.58.197.4","TCP","1434","34236  >  443 [ACK] Seq=121316 Ack=1044 Win=2363 Len=1368 TSval=7960625 TSecr=761498853 [TCP segment of a reassembled PDU]"
"209","2018-08-23 02:22:04.137731","192.168.2.3","216.58.197.4","TCP","1434","34236  >  443 [ACK] Seq=122684 Ack=1044 Win=2363 Len=1368 TSval=7960625 TSecr=761498853 [TCP segment of a reassembled PDU]"
"210","2018-08-23 02:22:04.137733","192.168.2.3","216.58.197.4","TLSv1.2","212","Application Data"
"211","2018-08-23 02:22:04.138044","192.168.2.3","216.58.197.4","TCP","1434","34236  >  443 [ACK] Seq=124198 Ack=1044 Win=2363 Len=1368 TSval=7960625 TSecr=761498853 [TCP segment of a reassembled PDU]"
"212","2018-08-23 02:22:04.138047","192.168.2.3","216.58.197.4","TLSv1.2","155","Application Data"
"217","2018-08-23 02:22:04.199936","192.168.2.3","216.58.197.4","TCP","66","34236  >  443 [ACK] Seq=125655 Ack=1255 Win=2363 Len=0 TSval=7960631 TSecr=761498997"
"219","2018-08-23 02:22:04.209098","192.168.2.3","216.58.197.4","TCP","66","34236  >  443 [ACK] Seq=125655 Ack=1521 Win=2363 Len=0 TSval=7960632 TSecr=761499006"
"220","2018-08-23 02:22:04.241039","192.168.2.3","216.58.197.4","TCP","1434","34236  >  443 [ACK] Seq=125655 Ack=1521 Win=2363 Len=1368 TSval=7960634 TSecr=761499006 [TCP segment of a reassembled PDU]"
"221","2018-08-23 02:22:04.241045","192.168.2.3","216.58.197.4","TCP","1434","34236  >  443 [ACK] Seq=127023 Ack=1521 Win=2363 Len=1368 TSval=7960634 TSecr=761499006 [TCP segment of a reassembled PDU]"
"222","2018-08-23 02:22:04.241046","192.168.2.3","216.58.197.4","TLSv1.2","212","Application Data"
"223","2018-08-23 02:22:04.241369","192.168.2.3","216.58.197.4","TCP","1434","34236  >  443 [ACK] Seq=128537 Ack=1521 Win=2363 Len=1368 TSval=7960634 TSecr=761499006 [TCP segment of a reassembled PDU]"
"224","2018-08-23 02:22:04.241372","192.168.2.3","216.58.197.4","TLSv1.2","155","Application Data"
"228","2018-08-23 02:22:04.327456","192.168.2.3","216.58.197.4","TCP","1434","34236  >  443 [ACK] Seq=129994 Ack=1521 Win=2363 Len=1368 TSval=7960644 TSecr=761499044 [TCP segment of a reassembled PDU]"
"229","2018-08-23 02:22:04.327462","192.168.2.3","216.58.197.4","TCP","1434","34236  >  443 [ACK] Seq=131362 Ack=1521 Win=2363 Len=1368 TSval=7960644 TSecr=761499044 [TCP segment of a reassembled PDU]"
"230","2018-08-23 02:22:04.327488","192.168.2.3","216.58.197.4","TLSv1.2","212","Application Data"
"231","2018-08-23 02:22:04.327987","192.168.2.3","216.58.197.4","TCP","1434","34236  >  443 [ACK] Seq=132876 Ack=1521 Win=2363 Len=1368 TSval=7960644 TSecr=761499044 [TCP segment of a reassembled PDU]"
"232","2018-08-23 02:22:04.327989","192.168.2.3","216.58.197.4","TLSv1.2","155","Application Data"
"238","2018-08-23 02:22:04.391985","192.168.2.3","216.58.197.4","TCP","66","34236  >  443 [ACK] Seq=134333 Ack=1853 Win=2363 Len=0 TSval=7960650 TSecr=761499186"
"239","2018-08-23 02:22:04.424265","192.168.2.3","216.58.197.4","TCP","1434","34236  >  443 [ACK] Seq=134333 Ack=1853 Win=2363 Len=1368 TSval=7960653 TSecr=761499186 [TCP segment of a reassembled PDU]"
"240","2018-08-23 02:22:04.424535","192.168.2.3","216.58.197.4","TCP","1434","34236  >  443 [ACK] Seq=135701 Ack=1853 Win=2363 Len=1368 TSval=7960653 TSecr=761499186 [TCP segment of a reassembled PDU]"
"241","2018-08-23 02:22:04.424537","192.168.2.3","216.58.197.4","TLSv1.2","212","Application Data"
"242","2018-08-23 02:22:04.424538","192.168.2.3","216.58.197.4","TCP","1434","34236  >  443 [ACK] Seq=137215 Ack=1853 Win=2363 Len=1368 TSval=7960653 TSecr=761499186 [TCP segment of a reassembled PDU]"
"243","2018-08-23 02:22:04.424795","192.168.2.3","216.58.197.4","TLSv1.2","155","Application Data"
"247","2018-08-23 02:22:04.533003","192.168.2.3","216.58.197.4","TCP","1434","34236  >  443 [ACK] Seq=138672 Ack=1853 Win=2363 Len=1368 TSval=7960664 TSecr=761499227 [TCP segment of a reassembled PDU]"
"248","2018-08-23 02:22:04.533380","192.168.2.3","216.58.197.4","TCP","1434","34236  >  443 [ACK] Seq=140040 Ack=1853 Win=2363 Len=1368 TSval=7960664 TSecr=761499227 [TCP segment of a reassembled PDU]"
"249","2018-08-23 02:22:04.533383","192.168.2.3","216.58.197.4","TLSv1.2","212","Application Data"
"250","2018-08-23 02:22:04.533773","192.168.2.3","216.58.197.4","TCP","1434","34236  >  443 [ACK] Seq=141554 Ack=1853 Win=2363 Len=1368 TSval=7960664 TSecr=761499227 [TCP segment of a reassembled PDU]"
"251","2018-08-23 02:22:04.533775","192.168.2.3","216.58.197.4","TLSv1.2","118","Application Data"
"255","2018-08-23 02:22:04.615921","192.168.2.3","216.58.197.4","TCP","1434","34236  >  443 [ACK] Seq=142974 Ack=1853 Win=2363 Len=1368 TSval=7960673 TSecr=761499336 [TCP segment of a reassembled PDU]"
"256","2018-08-23 02:22:04.616166","192.168.2.3","216.58.197.4","TCP","1434","34236  >  443 [ACK] Seq=144342 Ack=1853 Win=2363 Len=1368 TSval=7960673 TSecr=761499336 [TCP segment of a reassembled PDU]"
"257","2018-08-23 02:22:04.616169","192.168.2.3","216.58.197.4","TLSv1.2","212","Application Data"
"258","2018-08-23 02:22:04.616581","192.168.2.3","216.58.197.4","TCP","1434","34236  >  443 [ACK] Seq=145856 Ack=1853 Win=2363 Len=1368 TSval=7960673 TSecr=761499336 [TCP segment of a reassembled PDU]"
"259","2018-08-23 02:22:04.616584","192.168.2.3","216.58.197.4","TLSv1.2","155","Application Data"
"265","2018-08-23 02:22:04.667742","192.168.2.3","216.58.197.4","TCP","66","34236  >  443 [ACK] Seq=147313 Ack=2115 Win=2363 Len=0 TSval=7960678 TSecr=761499461"
"268","2018-08-23 02:22:04.673657","192.168.2.3","216.58.197.4","TCP","66","34236  >  443 [ACK] Seq=147313 Ack=2448 Win=2363 Len=0 TSval=7960678 TSecr=761499470"
"269","2018-08-23 02:22:04.712963","192.168.2.3","216.58.197.4","TCP","1434","34236  >  443 [ACK] Seq=147313 Ack=2448 Win=2363 Len=1368 TSval=7960682 TSecr=761499470 [TCP segment of a reassembled PDU]"
"270","2018-08-23 02:22:04.712968","192.168.2.3","216.58.197.4","TCP","1434","34236  >  443 [ACK] Seq=148681 Ack=2448 Win=2363 Len=1368 TSval=7960682 TSecr=761499470 [TCP segment of a reassembled PDU]"
"271","2018-08-23 02:22:04.712969","192.168.2.3","216.58.197.4","TLSv1.2","212","Application Data"
"272","2018-08-23 02:22:04.713226","192.168.2.3","216.58.197.4","TCP","1434","34236  >  443 [ACK] Seq=150195 Ack=2448 Win=2363 Len=1368 TSval=7960682 TSecr=761499470 [TCP segment of a reassembled PDU]"
"273","2018-08-23 02:22:04.713229","192.168.2.3","216.58.197.4","TLSv1.2","155","Application Data"
"277","2018-08-23 02:22:04.785833","192.168.2.3","216.58.197.4","TCP","1434","34236  >  443 [ACK] Seq=151652 Ack=2448 Win=2363 Len=1368 TSval=7960690 TSecr=761499515 [TCP segment of a reassembled PDU]"
"278","2018-08-23 02:22:04.786156","192.168.2.3","216.58.197.4","TCP","1434","34236  >  443 [ACK] Seq=153020 Ack=2448 Win=2363 Len=1368 TSval=7960690 TSecr=761499515 [TCP segment of a reassembled PDU]"
"279","2018-08-23 02:22:04.786160","192.168.2.3","216.58.197.4","TLSv1.2","212","Application Data"
"280","2018-08-23 02:22:04.786625","192.168.2.3","216.58.197.4","TCP","1434","34236  >  443 [ACK] Seq=154534 Ack=2448 Win=2363 Len=1368 TSval=7960690 TSecr=761499515 [TCP segment of a reassembled PDU]"
"281","2018-08-23 02:22:04.786629","192.168.2.3","216.58.197.4","TLSv1.2","155","Application Data"
"286","2018-08-23 02:22:04.855711","192.168.2.3","216.58.197.4","TCP","66","34236  >  443 [ACK] Seq=155991 Ack=2482 Win=2363 Len=0 TSval=7960697 TSecr=761499588"
"287","2018-08-23 02:22:04.871666","192.168.2.3","216.58.197.4","TCP","1434","34236  >  443 [ACK] Seq=155991 Ack=2482 Win=2363 Len=1368 TSval=7960698 TSecr=761499588 [TCP segment of a reassembled PDU]"
"288","2018-08-23 02:22:04.872105","192.168.2.3","216.58.197.4","TCP","1434","34236  >  443 [ACK] Seq=157359 Ack=2482 Win=2363 Len=1368 TSval=7960698 TSecr=761499588 [TCP segment of a reassembled PDU]"
"289","2018-08-23 02:22:04.872108","192.168.2.3","216.58.197.4","TLSv1.2","212","Application Data"
"290","2018-08-23 02:22:04.872457","192.168.2.3","216.58.197.4","TCP","1434","34236  >  443 [ACK] Seq=158873 Ack=2482 Win=2363 Len=1368 TSval=7960698 TSecr=761499588 [TCP segment of a reassembled PDU]"
"291","2018-08-23 02:22:04.872459","192.168.2.3","216.58.197.4","TLSv1.2","155","Application Data"
"295","2018-08-23 02:22:04.967808","192.168.2.3","216.58.197.4","TCP","1434","34236  >  443 [ACK] Seq=160330 Ack=2482 Win=2363 Len=1368 TSval=7960708 TSecr=761499715 [TCP segment of a reassembled PDU]"
"296","2018-08-23 02:22:04.968185","192.168.2.3","216.58.197.4","TCP","1434","34236  >  443 [ACK] Seq=161698 Ack=2482 Win=2363 Len=1368 TSval=7960708 TSecr=761499715 [TCP segment of a reassembled PDU]"
"297","2018-08-23 02:22:04.968199","192.168.2.3","216.58.197.4","TLSv1.2","212","Application Data"
"298","2018-08-23 02:22:04.968200","192.168.2.3","216.58.197.4","TCP","1434","34236  >  443 [ACK] Seq=163212 Ack=2482 Win=2363 Len=1368 TSval=7960708 TSecr=761499715 [TCP segment of a reassembled PDU]"
"299","2018-08-23 02:22:04.968310","192.168.2.3","216.58.197.4","TLSv1.2","155","Application Data"
"303","2018-08-23 02:22:05.059364","192.168.2.3","216.58.197.4","TCP","1434","34236  >  443 [ACK] Seq=164669 Ack=2482 Win=2363 Len=1368 TSval=7960717 TSecr=761499770 [TCP segment of a reassembled PDU]"
"304","2018-08-23 02:22:05.059370","192.168.2.3","216.58.197.4","TCP","1434","34236  >  443 [ACK] Seq=166037 Ack=2482 Win=2363 Len=1368 TSval=7960717 TSecr=761499770 [TCP segment of a reassembled PDU]"
"305","2018-08-23 02:22:05.059371","192.168.2.3","216.58.197.4","TLSv1.2","212","Application Data"
"306","2018-08-23 02:22:05.059636","192.168.2.3","216.58.197.4","TCP","1434","34236  >  443 [ACK] Seq=167551 Ack=2482 Win=2363 Len=1368 TSval=7960717 TSecr=761499770 [TCP segment of a reassembled PDU]"
"307","2018-08-23 02:22:05.059639","192.168.2.3","216.58.197.4","TLSv1.2","155","Application Data"
"313","2018-08-23 02:22:05.114581","192.168.2.3","216.58.197.4","TCP","66","34236  >  443 [ACK] Seq=169008 Ack=2623 Win=2363 Len=0 TSval=7960722 TSecr=761499911"
"314","2018-08-23 02:22:05.114584","192.168.2.3","216.58.197.4","TCP","66","34236  >  443 [ACK] Seq=169008 Ack=2689 Win=2363 Len=0 TSval=7960722 TSecr=761499911"
"315","2018-08-23 02:22:05.161351","192.168.2.3","216.58.197.4","TCP","1434","34236  >  443 [ACK] Seq=169008 Ack=2689 Win=2363 Len=1368 TSval=7960727 TSecr=761499911 [TCP segment of a reassembled PDU]"
"316","2018-08-23 02:22:05.161358","192.168.2.3","216.58.197.4","TCP","1434","34236  >  443 [ACK] Seq=170376 Ack=2689 Win=2363 Len=1368 TSval=7960727 TSecr=761499911 [TCP segment of a reassembled PDU]"
"317","2018-08-23 02:22:05.161359","192.168.2.3","216.58.197.4","TLSv1.2","212","Application Data"
"318","2018-08-23 02:22:05.161699","192.168.2.3","216.58.197.4","TCP","1434","34236  >  443 [ACK] Seq=171890 Ack=2689 Win=2363 Len=1368 TSval=7960727 TSecr=761499911 [TCP segment of a reassembled PDU]"
"319","2018-08-23 02:22:05.161703","192.168.2.3","216.58.197.4","TLSv1.2","155","Application Data"
"324","2018-08-23 02:22:05.201107","192.168.2.3","216.58.197.4","TCP","66","34236  >  443 [ACK] Seq=173347 Ack=2965 Win=2363 Len=0 TSval=7960731 TSecr=761499997"
"326","2018-08-23 02:22:05.212093","192.168.2.3","216.58.197.4","TCP","66","34236  >  443 [ACK] Seq=173347 Ack=3082 Win=2363 Len=0 TSval=7960732 TSecr=761500006"
"327","2018-08-23 02:22:05.253931","192.168.2.3","216.58.197.4","TCP","1434","34236  >  443 [ACK] Seq=173347 Ack=3082 Win=2363 Len=1368 TSval=7960736 TSecr=761500006 [TCP segment of a reassembled PDU]"
"328","2018-08-23 02:22:05.253936","192.168.2.3","216.58.197.4","TCP","1434","34236  >  443 [ACK] Seq=174715 Ack=3082 Win=2363 Len=1368 TSval=7960736 TSecr=761500006 [TCP segment of a reassembled PDU]"
"329","2018-08-23 02:22:05.253937","192.168.2.3","216.58.197.4","TLSv1.2","212","Application Data"
"330","2018-08-23 02:22:05.254067","192.168.2.3","216.58.197.4","TCP","1434","34236  >  443 [ACK] Seq=176229 Ack=3082 Win=2363 Len=1368 TSval=7960736 TSecr=761500006 [TCP segment of a reassembled PDU]"
"331","2018-08-23 02:22:05.254348","192.168.2.3","216.58.197.4","TLSv1.2","155","Application Data"
"337","2018-08-23 02:22:05.304971","192.168.2.3","216.58.197.4","TCP","66","34236  >  443 [ACK] Seq=177686 Ack=3328 Win=2363 Len=0 TSval=7960742 TSecr=761500102"
"338","2018-08-23 02:22:05.309344","192.168.2.3","216.58.197.4","TCP","66","34236  >  443 [ACK] Seq=177686 Ack=3478 Win=2363 Len=0 TSval=7960742 TSecr=761500102"
"339","2018-08-23 02:22:05.348333","192.168.2.3","216.58.197.4","TCP","1434","34236  >  443 [ACK] Seq=177686 Ack=3478 Win=2363 Len=1368 TSval=7960746 TSecr=761500102 [TCP segment of a reassembled PDU]"
"340","2018-08-23 02:22:05.348692","192.168.2.3","216.58.197.4","TCP","1434","34236  >  443 [ACK] Seq=179054 Ack=3478 Win=2363 Len=1368 TSval=7960746 TSecr=761500102 [TCP segment of a reassembled PDU]"
"341","2018-08-23 02:22:05.348695","192.168.2.3","216.58.197.4","TLSv1.2","212","Application Data"
"342","2018-08-23 02:22:05.348903","192.168.2.3","216.58.197.4","TCP","1434","34236  >  443 [ACK] Seq=180568 Ack=3478 Win=2363 Len=1368 TSval=7960746 TSecr=761500102 [TCP segment of a reassembled PDU]"
"343","2018-08-23 02:22:05.348906","192.168.2.3","216.58.197.4","TLSv1.2","155","Application Data"
"347","2018-08-23 02:22:05.442111","192.168.2.3","216.58.197.4","TCP","1434","34236  >  443 [ACK] Seq=182025 Ack=3478 Win=2363 Len=1368 TSval=7960755 TSecr=761500151 [TCP segment of a reassembled PDU]"
"348","2018-08-23 02:22:05.442545","192.168.2.3","216.58.197.4","TCP","1434","34236  >  443 [ACK] Seq=183393 Ack=3478 Win=2363 Len=1368 TSval=7960755 TSecr=761500151 [TCP segment of a reassembled PDU]"
"349","2018-08-23 02:22:05.442548","192.168.2.3","216.58.197.4","TLSv1.2","212","Application Data"
"350","2018-08-23 02:22:05.442549","192.168.2.3","216.58.197.4","TCP","1434","34236  >  443 [ACK] Seq=184907 Ack=3478 Win=2363 Len=1368 TSval=7960755 TSecr=761500151 [TCP segment of a reassembled PDU]"
"351","2018-08-23 02:22:05.442549","192.168.2.3","216.58.197.4","TLSv1.2","155","Application Data"
"357","2018-08-23 02:22:05.499776","192.168.2.3","216.58.197.4","TCP","66","34236  >  443 [ACK] Seq=186364 Ack=3790 Win=2363 Len=0 TSval=7960761 TSecr=761500296"
"358","2018-08-23 02:22:05.507657","192.168.2.3","216.58.197.4","TCP","1434","34236  >  443 [ACK] Seq=186364 Ack=3790 Win=2363 Len=1368 TSval=7960762 TSecr=761500296 [TCP segment of a reassembled PDU]"
"359","2018-08-23 02:22:05.507662","192.168.2.3","216.58.197.4","TCP","1434","34236  >  443 [ACK] Seq=187732 Ack=3790 Win=2363 Len=1368 TSval=7960762 TSecr=761500296 [TCP segment of a reassembled PDU]"
"360","2018-08-23 02:22:05.507794","192.168.2.3","216.58.197.4","TLSv1.2","212","Application Data"
"361","2018-08-23 02:22:05.507796","192.168.2.3","216.58.197.4","TCP","1434","34236  >  443 [ACK] Seq=189246 Ack=3790 Win=2363 Len=1368 TSval=7960762 TSecr=761500296 [TCP segment of a reassembled PDU]"
"362","2018-08-23 02:22:05.508134","192.168.2.3","216.58.197.4","TLSv1.2","155","Application Data"
"366","2018-08-23 02:22:05.612124","192.168.2.3","216.58.197.4","TCP","1434","34236  >  443 [ACK] Seq=190703 Ack=3790 Win=2363 Len=1368 TSval=7960772 TSecr=761500310 [TCP segment of a reassembled PDU]"
"367","2018-08-23 02:22:05.612130","192.168.2.3","216.58.197.4","TCP","1434","34236  >  443 [ACK] Seq=192071 Ack=3790 Win=2363 Len=1368 TSval=7960772 TSecr=761500310 [TCP segment of a reassembled PDU]"
"368","2018-08-23 02:22:05.612131","192.168.2.3","216.58.197.4","TLSv1.2","212","Application Data"
"369","2018-08-23 02:22:05.612132","192.168.2.3","216.58.197.4","TCP","1434","34236  >  443 [ACK] Seq=193585 Ack=3790 Win=2363 Len=1368 TSval=7960772 TSecr=761500310 [TCP segment of a reassembled PDU]"
"370","2018-08-23 02:22:05.612133","192.168.2.3","216.58.197.4","TLSv1.2","155","Application Data"
"373","2018-08-23 02:22:05.700926","192.168.2.3","216.58.197.4","TCP","1434","34236  >  443 [ACK] Seq=195042 Ack=3790 Win=2363 Len=1368 TSval=7960781 TSecr=761500414 [TCP segment of a reassembled PDU]"
"374","2018-08-23 02:22:05.701263","192.168.2.3","216.58.197.4","TCP","1434","34236  >  443 [ACK] Seq=196410 Ack=3790 Win=2363 Len=1368 TSval=7960781 TSecr=761500414 [TCP segment of a reassembled PDU]"
"375","2018-08-23 02:22:05.701267","192.168.2.3","216.58.197.4","TLSv1.2","212","Application Data"
"376","2018-08-23 02:22:05.701268","192.168.2.3","216.58.197.4","TCP","1434","34236  >  443 [ACK] Seq=197924 Ack=3790 Win=2363 Len=1368 TSval=7960781 TSecr=761500414 [TCP segment of a reassembled PDU]"
"377","2018-08-23 02:22:05.701429","192.168.2.3","216.58.197.4","TLSv1.2","155","Application Data"
"383","2018-08-23 02:22:05.748654","192.168.2.3","216.58.197.4","TCP","66","34236  >  443 [ACK] Seq=199381 Ack=4165 Win=2363 Len=0 TSval=7960786 TSecr=761500545"
"386","2018-08-23 02:22:05.756897","192.168.2.3","216.58.197.4","TCP","66","34236  >  443 [ACK] Seq=199381 Ack=4395 Win=2363 Len=0 TSval=7960787 TSecr=761500554"
"387","2018-08-23 02:22:05.800472","192.168.2.3","216.58.197.4","TCP","1434","34236  >  443 [ACK] Seq=199381 Ack=4395 Win=2363 Len=1368 TSval=7960791 TSecr=761500554 [TCP segment of a reassembled PDU]"
"388","2018-08-23 02:22:05.800737","192.168.2.3","216.58.197.4","TCP","1434","34236  >  443 [ACK] Seq=200749 Ack=4395 Win=2363 Len=1368 TSval=7960791 TSecr=761500554 [TCP segment of a reassembled PDU]"
"389","2018-08-23 02:22:05.800741","192.168.2.3","216.58.197.4","TLSv1.2","212","Application Data"
"390","2018-08-23 02:22:05.801206","192.168.2.3","216.58.197.4","TLSv1.2","1291","Application Data"
"394","2018-08-23 02:22:05.877507","192.168.2.3","216.58.197.4","TCP","1434","34236  >  443 [ACK] Seq=203488 Ack=4395 Win=2363 Len=1368 TSval=7960798 TSecr=761500603 [TCP segment of a reassembled PDU]"
"395","2018-08-23 02:22:05.877512","192.168.2.3","216.58.197.4","TCP","1434","34236  >  443 [ACK] Seq=204856 Ack=4395 Win=2363 Len=1368 TSval=7960798 TSecr=761500603 [TCP segment of a reassembled PDU]"
"396","2018-08-23 02:22:05.877513","192.168.2.3","216.58.197.4","TLSv1.2","212","Application Data"
"397","2018-08-23 02:22:05.877649","192.168.2.3","216.58.197.4","TCP","1434","34236  >  443 [ACK] Seq=206370 Ack=4395 Win=2363 Len=1368 TSval=7960798 TSecr=761500603 [TCP segment of a reassembled PDU]"
"398","2018-08-23 02:22:05.877861","192.168.2.3","216.58.197.4","TLSv1.2","155","Application Data"
"403","2018-08-23 02:22:05.925004","192.168.2.3","216.58.197.4","TCP","66","34236  >  443 [ACK] Seq=207827 Ack=4744 Win=2363 Len=0 TSval=7960804 TSecr=761500721"
"404","2018-08-23 02:22:05.971105","192.168.2.3","216.58.197.4","TCP","1434","34236  >  443 [ACK] Seq=207827 Ack=4744 Win=2363 Len=1368 TSval=7960808 TSecr=761500721 [TCP segment of a reassembled PDU]"
"405","2018-08-23 02:22:05.979154","192.168.2.3","216.58.197.4","TCP","1434","34236  >  443 [ACK] Seq=209195 Ack=4744 Win=2363 Len=1368 TSval=7960808 TSecr=761500721 [TCP segment of a reassembled PDU]"
"406","2018-08-23 02:22:05.979159","192.168.2.3","216.58.197.4","TLSv1.2","212","Application Data"
"407","2018-08-23 02:22:05.979159","192.168.2.3","216.58.197.4","TCP","1434","34236  >  443 [ACK] Seq=210709 Ack=4744 Win=2363 Len=1368 TSval=7960808 TSecr=761500721 [TCP segment of a reassembled PDU]"
"408","2018-08-23 02:22:05.979160","192.168.2.3","216.58.197.4","TLSv1.2","155","Application Data"
"412","2018-08-23 02:22:06.001350","192.168.2.3","203.211.199.120","TLSv1.2","788","Application Data"
"420","2018-08-23 02:22:06.030410","192.168.2.3","203.211.199.120","TCP","66","52030  >  443 [ACK] Seq=1445 Ack=8089 Win=1007 Len=0 TSval=7960814 TSecr=1193369009"
"421","2018-08-23 02:22:06.033308","192.168.2.3","216.58.197.4","TCP","66","34236  >  443 [ACK] Seq=212166 Ack=5258 Win=2363 Len=0 TSval=7960814 TSecr=761500827"
"422","2018-08-23 02:22:06.033315","192.168.2.3","203.211.199.120","TCP","66","52030  >  443 [ACK] Seq=1445 Ack=10391 Win=1007 Len=0 TSval=7960814 TSecr=1193369009"
"423","2018-08-23 02:22:06.083143","192.168.2.3","216.58.197.4","TCP","1434","34236  >  443 [ACK] Seq=212166 Ack=5258 Win=2363 Len=1368 TSval=7960819 TSecr=761500827 [TCP segment of a reassembled PDU]"
