"No.","Time","Source","Destination","Protocol","Length","Info"
"2","2018-08-23 02:16:13.006871","192.168.2.3","192.168.2.1","TCP","183","8009  >  53029 [PSH, ACK] Seq=1 Ack=118 Win=277 Len=117 TSval=7925512 TSecr=2316511628 [TCP segment of a reassembled PDU]"
"4","2018-08-23 02:16:13.026570","192.168.2.3","203.211.199.120","TLSv1.2","789","Application Data"
"9","2018-08-23 02:16:13.061989","192.168.2.3","203.211.199.120","TCP","66","52019  >  443 [ACK] Seq=724 Ack=1449 Win=982 Len=0 TSval=7925518 TSecr=1193016048"
"10","2018-08-23 02:16:13.061992","192.168.2.3","203.211.199.120","TCP","66","52019  >  443 [ACK] Seq=724 Ack=2897 Win=982 Len=0 TSval=7925518 TSecr=1193016048"
"11","2018-08-23 02:16:13.062249","192.168.2.3","203.211.199.120","TCP","66","52019  >  443 [ACK] Seq=724 Ack=4345 Win=982 Len=0 TSval=7925518 TSecr=1193016048"
"12","2018-08-23 02:16:13.062697","192.168.2.3","203.211.199.120","TCP","66","52019  >  443 [ACK] Seq=724 Ack=5237 Win=998 Len=0 TSval=7925518 TSecr=1193016048"
"13","2018-08-23 02:16:13.207119","192.168.2.3","216.58.197.14","TCP","66","41160  >  443 [ACK] Seq=1 Ack=1 Win=494 Len=0 TSval=7925532 TSecr=4135730354"
"15","2018-08-23 02:16:14.360548","192.168.2.3","216.58.197.4","TCP","66","34236  >  443 [ACK] Seq=1 Ack=1 Win=2363 Len=0 TSval=7925648 TSecr=761104023"
"17","2018-08-23 02:16:14.600078","192.168.2.3","216.58.197.4","TLSv1.2","156","[TCP Previous segment not captured] , Application Data"
"18","2018-08-23 02:16:14.600083","192.168.2.3","216.58.197.4","TLSv1.2","104","Application Data"
"19","2018-08-23 02:16:14.600084","192.168.2.3","216.58.197.4","TLSv1.2","158","Application Data"
"24","2018-08-23 02:16:14.627673","192.168.2.3","216.58.197.4","TCP","1434","34236  >  443 [ACK] Seq=222 Ack=1 Win=2363 Len=1368 TSval=7925672 TSecr=761149162 [TCP segment of a reassembled PDU]"
"25","2018-08-23 02:16:14.627680","192.168.2.3","216.58.197.4","TCP","1434","34236  >  443 [ACK] Seq=1590 Ack=1 Win=2363 Len=1368 TSval=7925672 TSecr=761149162 [TCP segment of a reassembled PDU]"
"26","2018-08-23 02:16:14.627681","192.168.2.3","216.58.197.4","TLSv1.2","212","Application Data"
"27","2018-08-23 02:16:14.627831","192.168.2.3","216.58.197.4","TCP","1434","34236  >  443 [ACK] Seq=3104 Ack=1 Win=2363 Len=1368 TSval=7925672 TSecr=761149162 [TCP segment of a reassembled PDU]"
"28","2018-08-23 02:16:14.628046","192.168.2.3","216.58.197.4","TLSv1.2","362","Application Data"
"29","2018-08-23 02:16:14.628276","192.168.2.3","216.58.197.4","TCP","1434","34236  >  443 [ACK] Seq=4768 Ack=1 Win=2363 Len=1368 TSval=7925672 TSecr=761149162 [TCP segment of a reassembled PDU]"
"30","2018-08-23 02:16:14.628471","192.168.2.3","216.58.197.4","TCP","1434","34236  >  443 [ACK] Seq=6136 Ack=1 Win=2363 Len=1368 TSval=7925672 TSecr=761149162 [TCP segment of a reassembled PDU]"
"31","2018-08-23 02:16:14.630063","192.168.2.3","216.58.197.4","TLSv1.2","1434","Application Data [TCP segment of a reassembled PDU]"
"32","2018-08-23 02:16:14.630553","192.168.2.3","216.58.197.4","TLSv1.2","1434","Application Data [TCP segment of a reassembled PDU]"
"33","2018-08-23 02:16:14.630557","192.168.2.3","216.58.197.4","TCP","1434","34236  >  443 [ACK] Seq=10240 Ack=1 Win=2363 Len=1368 TSval=7925674 TSecr=761149402 [TCP segment of a reassembled PDU]"
"34","2018-08-23 02:16:14.630885","192.168.2.3","216.58.197.4","TLSv1.2","1434","Application Data [TCP segment of a reassembled PDU]"
"35","2018-08-23 02:16:14.631312","192.168.2.3","216.58.197.4","TLSv1.2","1434","Application Data [TCP segment of a reassembled PDU]"
"36","2018-08-23 02:16:14.631316","192.168.2.3","216.58.197.4","TCP","1434","34236  >  443 [ACK] Seq=14344 Ack=1 Win=2363 Len=1368 TSval=7925675 TSecr=761149402 [TCP segment of a reassembled PDU]"
"43","2018-08-23 02:16:14.644545","192.168.2.3","216.58.197.4","TLSv1.2","1434","Application Data [TCP segment of a reassembled PDU]"
"44","2018-08-23 02:16:14.644549","192.168.2.3","216.58.197.4","TLSv1.2","1434","Application Data [TCP segment of a reassembled PDU]"
"45","2018-08-23 02:16:14.644693","192.168.2.3","216.58.197.4","TCP","1434","34236  >  443 [ACK] Seq=18448 Ack=39 Win=2363 Len=1368 TSval=7925675 TSecr=761149402 [TCP segment of a reassembled PDU]"
"46","2018-08-23 02:16:14.644930","192.168.2.3","216.58.197.4","TLSv1.2","1434","Application Data [TCP segment of a reassembled PDU]"
"47","2018-08-23 02:16:14.645192","192.168.2.3","216.58.197.4","TLSv1.2","1434","Application Data [TCP segment of a reassembled PDU]"
"48","2018-08-23 02:16:14.645195","192.168.2.3","216.58.197.4","TCP","1434","34236  >  443 [ACK] Seq=22552 Ack=39 Win=2363 Len=1368 TSval=7925675 TSecr=761149430 [TCP segment of a reassembled PDU]"
"49","2018-08-23 02:16:14.645402","192.168.2.3","216.58.197.4","TLSv1.2","1434","Application Data [TCP segment of a reassembled PDU]"
"50","2018-08-23 02:16:14.648919","192.168.2.3","216.58.197.4","TLSv1.2","1434","Application Data [TCP segment of a reassembled PDU]"
"54","2018-08-23 02:16:14.651643","192.168.2.3","216.58.197.4","TCP","1434","34236  >  443 [ACK] Seq=26656 Ack=39 Win=2363 Len=1368 TSval=7925676 TSecr=761149430 [TCP segment of a reassembled PDU]"
"55","2018-08-23 02:16:14.651646","192.168.2.3","216.58.197.4","TLSv1.2","1434","Application Data [TCP segment of a reassembled PDU]"
"56","2018-08-23 02:16:14.651930","192.168.2.3","216.58.197.4","TCP","1434","34236  >  443 [ACK] Seq=29392 Ack=39 Win=2363 Len=1368 TSval=7925676 TSecr=761149432 [TCP segment of a reassembled PDU]"
"57","2018-08-23 02:16:14.652213","192.168.2.3","216.58.197.4","TLSv1.2","1434","Application Data [TCP segment of a reassembled PDU]"
"58","2018-08-23 02:16:14.652215","192.168.2.3","216.58.197.4","TCP","1434","34236  >  443 [ACK] Seq=32128 Ack=39 Win=2363 Len=1368 TSval=7925676 TSecr=761149432 [TCP segment of a reassembled PDU]"
"59","2018-08-23 02:16:14.652354","192.168.2.3","216.58.197.4","TLSv1.2","1434","Application Data [TCP segment of a reassembled PDU]"
"60","2018-08-23 02:16:14.652440","192.168.2.3","216.58.197.4","TLSv1.2","1434","Application Data [TCP segment of a reassembled PDU]"
"61","2018-08-23 02:16:14.652846","192.168.2.3","216.58.197.4","TCP","1434","34236  >  443 [ACK] Seq=36232 Ack=39 Win=2363 Len=1368 TSval=7925676 TSecr=761149432 [TCP segment of a reassembled PDU]"
"62","2018-08-23 02:16:14.652849","192.168.2.3","216.58.197.4","TLSv1.2","1434","Application Data [TCP segment of a reassembled PDU]"
"63","2018-08-23 02:16:14.653113","192.168.2.3","216.58.197.4","TLSv1.2","1434","Application Data [TCP segment of a reassembled PDU]"
"64","2018-08-23 02:16:14.653172","192.168.2.3","216.58.197.4","TCP","1434","34236  >  443 [ACK] Seq=40336 Ack=39 Win=2363 Len=1368 TSval=7925676 TSecr=761149433 [TCP segment of a reassembled PDU]"
"71","2018-08-23 02:16:14.659705","192.168.2.3","216.58.197.4","TLSv1.2","1434","Application Data [TCP segment of a reassembled PDU]"
"72","2018-08-23 02:16:14.659708","192.168.2.3","216.58.197.4","TLSv1.2","1434","Application Data [TCP segment of a reassembled PDU]"
"73","2018-08-23 02:16:14.660070","192.168.2.3","216.58.197.4","TCP","1434","34236  >  443 [ACK] Seq=44440 Ack=39 Win=2363 Len=1368 TSval=7925677 TSecr=761149446 [TCP segment of a reassembled PDU]"
"74","2018-08-23 02:16:14.660072","192.168.2.3","216.58.197.4","TLSv1.2","1434","Application Data [TCP segment of a reassembled PDU]"
"75","2018-08-23 02:16:14.660435","192.168.2.3","216.58.197.4","TLSv1.2","1434","Application Data [TCP segment of a reassembled PDU]"
"76","2018-08-23 02:16:14.660438","192.168.2.3","216.58.197.4","TCP","1434","34236  >  443 [ACK] Seq=48544 Ack=39 Win=2363 Len=1368 TSval=7925677 TSecr=761149447 [TCP segment of a reassembled PDU]"
"77","2018-08-23 02:16:14.660766","192.168.2.3","216.58.197.4","TLSv1.2","1434","Application Data [TCP segment of a reassembled PDU]"
"78","2018-08-23 02:16:14.660926","192.168.2.3","216.58.197.4","TLSv1.2","1434","Application Data [TCP segment of a reassembled PDU]"
"79","2018-08-23 02:16:14.661089","192.168.2.3","216.58.197.4","TCP","1434","34236  >  443 [ACK] Seq=52648 Ack=39 Win=2363 Len=1368 TSval=7925677 TSecr=761149451 [TCP segment of a reassembled PDU]"
"80","2018-08-23 02:16:14.661340","192.168.2.3","216.58.197.4","TLSv1.2","1434","Application Data [TCP segment of a reassembled PDU]"
"81","2018-08-23 02:16:14.661342","192.168.2.3","216.58.197.4","TCP","1434","34236  >  443 [ACK] Seq=55384 Ack=39 Win=2363 Len=1368 TSval=7925677 TSecr=761149453 [TCP segment of a reassembled PDU]"
"82","2018-08-23 02:16:14.661710","192.168.2.3","216.58.197.4","TLSv1.2","1434","Application Data [TCP segment of a reassembled PDU]"
"83","2018-08-23 02:16:14.661712","192.168.2.3","216.58.197.4","TCP","1434","34236  >  443 [ACK] Seq=58120 Ack=39 Win=2363 Len=1368 TSval=7925677 TSecr=761149453 [TCP segment of a reassembled PDU]"
"84","2018-08-23 02:16:14.662068","192.168.2.3","216.58.197.4","TLSv1.2","1434","Application Data [TCP segment of a reassembled PDU]"
"85","2018-08-23 02:16:14.662071","192.168.2.3","216.58.197.4","TCP","1434","34236  >  443 [ACK] Seq=60856 Ack=39 Win=2363 Len=1368 TSval=7925677 TSecr=761149454 [TCP segment of a reassembled PDU]"
"86","2018-08-23 02:16:14.662420","192.168.2.3","216.58.197.4","TLSv1.2","1434","Application Data [TCP segment of a reassembled PDU]"
"87","2018-08-23 02:16:14.662423","192.168.2.3","216.58.197.4","TLSv1.2","311","Application Data"
"97","2018-08-23 02:16:14.724406","192.168.2.3","216.58.197.4","TCP","1434","34236  >  443 [ACK] Seq=63837 Ack=39 Win=2363 Len=1368 TSval=7925684 TSecr=761149464 [TCP segment of a reassembled PDU]"
"98","2018-08-23 02:16:14.724712","192.168.2.3","216.58.197.4","TCP","1434","34236  >  443 [ACK] Seq=65205 Ack=39 Win=2363 Len=1368 TSval=7925684 TSecr=761149464 [TCP segment of a reassembled PDU]"
"99","2018-08-23 02:16:14.724714","192.168.2.3","216.58.197.4","TLSv1.2","212","Application Data"
"100","2018-08-23 02:16:14.724714","192.168.2.3","216.58.197.4","TCP","1434","34236  >  443 [ACK] Seq=66719 Ack=39 Win=2363 Len=1368 TSval=7925684 TSecr=761149464 [TCP segment of a reassembled PDU]"
"101","2018-08-23 02:16:14.724879","192.168.2.3","216.58.197.4","TLSv1.2","155","Application Data"
"105","2018-08-23 02:16:14.827411","192.168.2.3","216.58.197.4","TCP","1434","34236  >  443 [ACK] Seq=68176 Ack=39 Win=2363 Len=1368 TSval=7925694 TSecr=761149566 [TCP segment of a reassembled PDU]"
"106","2018-08-23 02:16:14.827800","192.168.2.3","216.58.197.4","TCP","1434","34236  >  443 [ACK] Seq=69544 Ack=39 Win=2363 Len=1368 TSval=7925694 TSecr=761149566 [TCP segment of a reassembled PDU]"
"107","2018-08-23 02:16:14.827802","192.168.2.3","216.58.197.4","TLSv1.2","212","Application Data"
"108","2018-08-23 02:16:14.827921","192.168.2.3","216.58.197.4","TCP","1434","34236  >  443 [ACK] Seq=71058 Ack=39 Win=2363 Len=1368 TSval=7925694 TSecr=761149566 [TCP segment of a reassembled PDU]"
"109","2018-08-23 02:16:14.827924","192.168.2.3","216.58.197.4","TLSv1.2","128","Application Data"
"115","2018-08-23 02:16:14.897561","192.168.2.3","216.58.197.4","TCP","66","34236  >  443 [ACK] Seq=72488 Ack=217 Win=2363 Len=0 TSval=7925701 TSecr=761149694"
"116","2018-08-23 02:16:14.926753","192.168.2.3","216.58.197.4","TCP","1434","34236  >  443 [ACK] Seq=72488 Ack=217 Win=2363 Len=1368 TSval=7925704 TSecr=761149694 [TCP segment of a reassembled PDU]"
"117","2018-08-23 02:16:14.927069","192.168.2.3","216.58.197.4","TCP","1434","34236  >  443 [ACK] Seq=73856 Ack=217 Win=2363 Len=1368 TSval=7925704 TSecr=761149694 [TCP segment of a reassembled PDU]"
"118","2018-08-23 02:16:14.927072","192.168.2.3","216.58.197.4","TLSv1.2","212","Application Data"
"119","2018-08-23 02:16:14.927072","192.168.2.3","216.58.197.4","TCP","1434","34236  >  443 [ACK] Seq=75370 Ack=217 Win=2363 Len=1368 TSval=7925704 TSecr=761149694 [TCP segment of a reassembled PDU]"
"120","2018-08-23 02:16:14.927209","192.168.2.3","216.58.197.4","TLSv1.2","155","Application Data"
"125","2018-08-23 02:16:15.038319","192.168.2.3","216.58.197.4","TCP","1434","34236  >  443 [ACK] Seq=76827 Ack=512 Win=2363 Len=1368 TSval=7925715 TSecr=761149834 [TCP segment of a reassembled PDU]"
"126","2018-08-23 02:16:15.038742","192.168.2.3","216.58.197.4","TCP","1434","34236  >  443 [ACK] Seq=78195 Ack=512 Win=2363 Len=1368 TSval=7925715 TSecr=761149834 [TCP segment of a reassembled PDU]"
"127","2018-08-23 02:16:15.038745","192.168.2.3","216.58.197.4","TLSv1.2","212","Application Data"
"128","2018-08-23 02:16:15.038746","192.168.2.3","216.58.197.4","TCP","1434","34236  >  443 [ACK] Seq=79709 Ack=512 Win=2363 Len=1368 TSval=7925715 TSecr=761149834 [TCP segment of a reassembled PDU]"
"131","2018-08-23 02:16:15.050266","192.168.2.3","216.58.197.4","TLSv1.2","155","Application Data"
"133","2018-08-23 02:16:15.133796","192.168.2.3","216.58.197.4","TCP","1434","34236  >  443 [ACK] Seq=81166 Ack=512 Win=2363 Len=1368 TSval=7925725 TSecr=761149852 [TCP segment of a reassembled PDU]"
"134","2018-08-23 02:16:15.134088","192.168.2.3","216.58.197.4","TCP","1434","34236  >  443 [ACK] Seq=82534 Ack=512 Win=2363 Len=1368 TSval=7925725 TSecr=761149852 [TCP segment of a reassembled PDU]"
"135","2018-08-23 02:16:15.134090","192.168.2.3","216.58.197.4","TLSv1.2","212","Application Data"
"136","2018-08-23 02:16:15.134578","192.168.2.3","216.58.197.4","TCP","1434","34236  >  443 [ACK] Seq=84048 Ack=512 Win=2363 Len=1368 TSval=7925725 TSecr=761149852 [TCP segment of a reassembled PDU]"
"137","2018-08-23 02:16:15.134581","192.168.2.3","216.58.197.4","TLSv1.2","155","Application Data"
"141","2018-08-23 02:16:15.202672","192.168.2.3","216.58.197.4","TCP","66","34236  >  443 [ACK] Seq=85505 Ack=907 Win=2363 Len=0 TSval=7925732 TSecr=761149977"
"142","2018-08-23 02:16:15.235745","192.168.2.3","216.58.197.4","TCP","1434","34236  >  443 [ACK] Seq=85505 Ack=907 Win=2363 Len=1368 TSval=7925735 TSecr=761149977 [TCP segment of a reassembled PDU]"
"143","2018-08-23 02:16:15.236124","192.168.2.3","216.58.197.4","TCP","1434","34236  >  443 [ACK] Seq=86873 Ack=907 Win=2363 Len=1368 TSval=7925735 TSecr=761149977 [TCP segment of a reassembled PDU]"
"144","2018-08-23 02:16:15.236127","192.168.2.3","216.58.197.4","TLSv1.2","212","Application Data"
"145","2018-08-23 02:16:15.236127","192.168.2.3","216.58.197.4","TCP","1434","34236  >  443 [ACK] Seq=88387 Ack=907 Win=2363 Len=1368 TSval=7925735 TSecr=761149977 [TCP segment of a reassembled PDU]"
"146","2018-08-23 02:16:15.236392","192.168.2.3","216.58.197.4","TLSv1.2","155","Application Data"
"150","2018-08-23 02:16:15.331929","192.168.2.3","216.58.197.4","TCP","1434","34236  >  443 [ACK] Seq=89844 Ack=907 Win=2363 Len=1368 TSval=7925745 TSecr=761150038 [TCP segment of a reassembled PDU]"
"151","2018-08-23 02:16:15.332089","192.168.2.3","216.58.197.4","TCP","1434","34236  >  443 [ACK] Seq=91212 Ack=907 Win=2363 Len=1368 TSval=7925745 TSecr=761150038 [TCP segment of a reassembled PDU]"
"152","2018-08-23 02:16:15.332091","192.168.2.3","216.58.197.4","TLSv1.2","212","Application Data"
"153","2018-08-23 02:16:15.332631","192.168.2.3","216.58.197.4","TCP","1434","34236  >  443 [ACK] Seq=92726 Ack=907 Win=2363 Len=1368 TSval=7925745 TSecr=761150038 [TCP segment of a reassembled PDU]"
"154","2018-08-23 02:16:15.332634","192.168.2.3","216.58.197.4","TLSv1.2","155","Application Data"
"158","2018-08-23 02:16:15.424552","192.168.2.3","216.58.197.4","TCP","1434","34236  >  443 [ACK] Seq=94183 Ack=907 Win=2363 Len=1368 TSval=7925754 TSecr=761150134 [TCP segment of a reassembled PDU]"
"159","2018-08-23 02:16:15.424966","192.168.2.3","216.58.197.4","TCP","1434","34236  >  443 [ACK] Seq=95551 Ack=907 Win=2363 Len=1368 TSval=7925754 TSecr=761150134 [TCP segment of a reassembled PDU]"
"160","2018-08-23 02:16:15.424969","192.168.2.3","216.58.197.4","TLSv1.2","212","Application Data"
"161","2018-08-23 02:16:15.424970","192.168.2.3","216.58.197.4","TCP","1434","34236  >  443 [ACK] Seq=97065 Ack=907 Win=2363 Len=1368 TSval=7925754 TSecr=761150134 [TCP segment of a reassembled PDU]"
"162","2018-08-23 02:16:15.425208","192.168.2.3","216.58.197.4","TLSv1.2","155","Application Data"
"166","2018-08-23 02:16:15.525394","192.168.2.3","216.58.197.4","TCP","1434","34236  >  443 [ACK] Seq=98522 Ack=907 Win=2363 Len=1368 TSval=7925764 TSecr=761150227 [TCP segment of a reassembled PDU]"
"167","2018-08-23 02:16:15.525400","192.168.2.3","216.58.197.4","TCP","1434","34236  >  443 [ACK] Seq=99890 Ack=907 Win=2363 Len=1368 TSval=7925764 TSecr=761150227 [TCP segment of a reassembled PDU]"
"168","2018-08-23 02:16:15.525401","192.168.2.3","216.58.197.4","TLSv1.2","212","Application Data"
"169","2018-08-23 02:16:15.525749","192.168.2.3","216.58.197.4","TCP","1434","34236  >  443 [ACK] Seq=101404 Ack=907 Win=2363 Len=1368 TSval=7925764 TSecr=761150227 [TCP segment of a reassembled PDU]"
"170","2018-08-23 02:16:15.525753","192.168.2.3","216.58.197.4","TLSv1.2","155","Application Data"
"173","2018-08-23 02:16:15.613858","192.168.2.3","216.58.197.4","TCP","1434","34236  >  443 [ACK] Seq=102861 Ack=907 Win=2363 Len=1368 TSval=7925773 TSecr=761150327 [TCP segment of a reassembled PDU]"
"174","2018-08-23 02:16:15.614219","192.168.2.3","216.58.197.4","TCP","1434","34236  >  443 [ACK] Seq=104229 Ack=907 Win=2363 Len=1368 TSval=7925773 TSecr=761150327 [TCP segment of a reassembled PDU]"
"175","2018-08-23 02:16:15.614223","192.168.2.3","216.58.197.4","TLSv1.2","212","Application Data"
"176","2018-08-23 02:16:15.614224","192.168.2.3","216.58.197.4","TCP","1434","34236  >  443 [ACK] Seq=105743 Ack=907 Win=2363 Len=1368 TSval=7925773 TSecr=761150327 [TCP segment of a reassembled PDU]"
"177","2018-08-23 02:16:15.614479","192.168.2.3","216.58.197.4","TLSv1.2","155","Application Data"
"181","2018-08-23 02:16:15.709727","192.168.2.3","216.58.197.4","TCP","1434","34236  >  443 [ACK] Seq=107200 Ack=907 Win=2363 Len=1368 TSval=7925782 TSecr=761150416 [TCP segment of a reassembled PDU]"
"182","2018-08-23 02:16:15.710037","192.168.2.3","216.58.197.4","TCP","1434","34236  >  443 [ACK] Seq=108568 Ack=907 Win=2363 Len=1368 TSval=7925782 TSecr=761150416 [TCP segment of a reassembled PDU]"
"183","2018-08-23 02:16:15.710040","192.168.2.3","216.58.197.4","TLSv1.2","212","Application Data"
"184","2018-08-23 02:16:15.710483","192.168.2.3","216.58.197.4","TCP","1434","34236  >  443 [ACK] Seq=110082 Ack=907 Win=2363 Len=1368 TSval=7925782 TSecr=761150416 [TCP segment of a reassembled PDU]"
"185","2018-08-23 02:16:15.710486","192.168.2.3","216.58.197.4","TLSv1.2","155","Application Data"
"189","2018-08-23 02:16:15.787057","192.168.2.3","216.58.197.4","TCP","1434","34236  >  443 [ACK] Seq=111539 Ack=907 Win=2363 Len=1368 TSval=7925790 TSecr=761150512 [TCP segment of a reassembled PDU]"
"190","2018-08-23 02:16:15.787499","192.168.2.3","216.58.197.4","TCP","1434","34236  >  443 [ACK] Seq=112907 Ack=907 Win=2363 Len=1368 TSval=7925790 TSecr=761150512 [TCP segment of a reassembled PDU]"
"191","2018-08-23 02:16:15.787501","192.168.2.3","216.58.197.4","TLSv1.2","212","Application Data"
"192","2018-08-23 02:16:15.787882","192.168.2.3","216.58.197.4","TCP","1434","34236  >  443 [ACK] Seq=114421 Ack=907 Win=2363 Len=1368 TSval=7925790 TSecr=761150512 [TCP segment of a reassembled PDU]"
"193","2018-08-23 02:16:15.787883","192.168.2.3","216.58.197.4","TLSv1.2","155","Application Data"
"198","2018-08-23 02:16:15.875831","192.168.2.3","216.58.197.4","TCP","1434","34236  >  443 [ACK] Seq=115878 Ack=1079 Win=2363 Len=1368 TSval=7925799 TSecr=761150666 [TCP segment of a reassembled PDU]"
"199","2018-08-23 02:16:15.876240","192.168.2.3","216.58.197.4","TCP","1434","34236  >  443 [ACK] Seq=117246 Ack=1079 Win=2363 Len=1368 TSval=7925799 TSecr=761150666 [TCP segment of a reassembled PDU]"
"200","2018-08-23 02:16:15.876242","192.168.2.3","216.58.197.4","TLSv1.2","212","Application Data"
"201","2018-08-23 02:16:15.876592","192.168.2.3","216.58.197.4","TCP","1434","34236  >  443 [ACK] Seq=118760 Ack=1079 Win=2363 Len=1368 TSval=7925799 TSecr=761150666 [TCP segment of a reassembled PDU]"
"202","2018-08-23 02:16:15.876595","192.168.2.3","216.58.197.4","TLSv1.2","155","Application Data"
"207","2018-08-23 02:16:15.920577","192.168.2.3","216.58.197.4","TCP","66","34236  >  443 [ACK] Seq=120217 Ack=1319 Win=2363 Len=0 TSval=7925804 TSecr=761150678"
"208","2018-08-23 02:16:15.947320","192.168.2.3","216.58.197.4","TCP","1434","34236  >  443 [ACK] Seq=120217 Ack=1319 Win=2363 Len=1368 TSval=7925806 TSecr=761150678 [TCP segment of a reassembled PDU]"
"209","2018-08-23 02:16:15.947724","192.168.2.3","216.58.197.4","TCP","1434","34236  >  443 [ACK] Seq=121585 Ack=1319 Win=2363 Len=1368 TSval=7925806 TSecr=761150678 [TCP segment of a reassembled PDU]"
"210","2018-08-23 02:16:15.947740","192.168.2.3","216.58.197.4","TLSv1.2","212","Application Data"
"211","2018-08-23 02:16:15.947741","192.168.2.3","216.58.197.4","TCP","1434","34236  >  443 [ACK] Seq=123099 Ack=1319 Win=2363 Len=1368 TSval=7925806 TSecr=761150678 [TCP segment of a reassembled PDU]"
"212","2018-08-23 02:16:15.947855","192.168.2.3","216.58.197.4","TLSv1.2","155","Application Data"
"217","2018-08-23 02:16:16.009186","192.168.2.3","216.58.197.4","TCP","66","34236  >  443 [ACK] Seq=124556 Ack=1628 Win=2363 Len=0 TSval=7925812 TSecr=761150805"
"218","2018-08-23 02:16:16.013526","192.168.2.3","216.58.197.4","TCP","66","34236  >  443 [ACK] Seq=124556 Ack=1777 Win=2363 Len=0 TSval=7925813 TSecr=761150806"
"219","2018-08-23 02:16:16.037341","192.168.2.3","216.58.197.4","TCP","1434","34236  >  443 [ACK] Seq=124556 Ack=1777 Win=2363 Len=1368 TSval=7925815 TSecr=761150806 [TCP segment of a reassembled PDU]"
"220","2018-08-23 02:16:16.037347","192.168.2.3","216.58.197.4","TCP","1434","34236  >  443 [ACK] Seq=125924 Ack=1777 Win=2363 Len=1368 TSval=7925815 TSecr=761150806 [TCP segment of a reassembled PDU]"
"221","2018-08-23 02:16:16.037348","192.168.2.3","216.58.197.4","TLSv1.2","212","Application Data"
"222","2018-08-23 02:16:16.037689","192.168.2.3","216.58.197.4","TCP","1434","34236  >  443 [ACK] Seq=127438 Ack=1777 Win=2363 Len=1368 TSval=7925815 TSecr=761150806 [TCP segment of a reassembled PDU]"
"223","2018-08-23 02:16:16.037691","192.168.2.3","216.58.197.4","TLSv1.2","155","Application Data"
"227","2018-08-23 02:16:16.132285","192.168.2.3","216.58.197.4","TCP","1434","34236  >  443 [ACK] Seq=128895 Ack=1777 Win=2363 Len=1368 TSval=7925825 TSecr=761150879 [TCP segment of a reassembled PDU]"
"228","2018-08-23 02:16:16.132812","192.168.2.3","216.58.197.4","TCP","1434","34236  >  443 [ACK] Seq=130263 Ack=1777 Win=2363 Len=1368 TSval=7925825 TSecr=761150879 [TCP segment of a reassembled PDU]"
"229","2018-08-23 02:16:16.132815","192.168.2.3","216.58.197.4","TLSv1.2","212","Application Data"
"230","2018-08-23 02:16:16.133034","192.168.2.3","216.58.197.4","TCP","1434","34236  >  443 [ACK] Seq=131777 Ack=1777 Win=2363 Len=1368 TSval=7925825 TSecr=761150879 [TCP segment of a reassembled PDU]"
"231","2018-08-23 02:16:16.133036","192.168.2.3","216.58.197.4","TLSv1.2","155","Application Data"
"237","2018-08-23 02:16:16.184476","192.168.2.3","216.58.197.4","TCP","66","34236  >  443 [ACK] Seq=133234 Ack=2133 Win=2363 Len=0 TSval=7925830 TSecr=761150981"
"238","2018-08-23 02:16:16.226086","192.168.2.3","216.58.197.4","TCP","1434","34236  >  443 [ACK] Seq=133234 Ack=2133 Win=2363 Len=1368 TSval=7925834 TSecr=761150981 [TCP segment of a reassembled PDU]"
"239","2018-08-23 02:16:16.226514","192.168.2.3","216.58.197.4","TCP","1434","34236  >  443 [ACK] Seq=134602 Ack=2133 Win=2363 Len=1368 TSval=7925834 TSecr=761150981 [TCP segment of a reassembled PDU]"
"240","2018-08-23 02:16:16.226517","192.168.2.3","216.58.197.4","TLSv1.2","212","Application Data"
"241","2018-08-23 02:16:16.226518","192.168.2.3","216.58.197.4","TCP","1434","34236  >  443 [ACK] Seq=136116 Ack=2133 Win=2363 Len=1368 TSval=7925834 TSecr=761150981 [TCP segment of a reassembled PDU]"
"242","2018-08-23 02:16:16.226604","192.168.2.3","216.58.197.4","TLSv1.2","155","Application Data"
"247","2018-08-23 02:16:16.280473","192.168.2.3","216.58.197.4","TCP","66","34236  >  443 [ACK] Seq=137573 Ack=2490 Win=2363 Len=0 TSval=7925839 TSecr=761151071"
"248","2018-08-23 02:16:16.299347","192.168.2.3","216.58.197.4","TCP","1434","34236  >  443 [ACK] Seq=137573 Ack=2490 Win=2363 Len=1368 TSval=7925841 TSecr=761151071 [TCP segment of a reassembled PDU]"
"249","2018-08-23 02:16:16.299736","192.168.2.3","216.58.197.4","TCP","1434","34236  >  443 [ACK] Seq=138941 Ack=2490 Win=2363 Len=1368 TSval=7925841 TSecr=761151071 [TCP segment of a reassembled PDU]"
"250","2018-08-23 02:16:16.299738","192.168.2.3","216.58.197.4","TLSv1.2","212","Application Data"
"251","2018-08-23 02:16:16.299739","192.168.2.3","216.58.197.4","TCP","1434","34236  >  443 [ACK] Seq=140455 Ack=2490 Win=2363 Len=1368 TSval=7925841 TSecr=761151071 [TCP segment of a reassembled PDU]"
"252","2018-08-23 02:16:16.299854","192.168.2.3","216.58.197.4","TLSv1.2","155","Application Data"
"258","2018-08-23 02:16:16.351551","192.168.2.3","216.58.197.4","TCP","66","34236  >  443 [ACK] Seq=141912 Ack=2782 Win=2363 Len=0 TSval=7925847 TSecr=761151148"
"259","2018-08-23 02:16:16.388097","192.168.2.3","216.58.197.4","TCP","1434","34236  >  443 [ACK] Seq=141912 Ack=2782 Win=2363 Len=1368 TSval=7925850 TSecr=761151148 [TCP segment of a reassembled PDU]"
"260","2018-08-23 02:16:16.388489","192.168.2.3","216.58.197.4","TCP","1434","34236  >  443 [ACK] Seq=143280 Ack=2782 Win=2363 Len=1368 TSval=7925850 TSecr=761151148 [TCP segment of a reassembled PDU]"
"261","2018-08-23 02:16:16.388538","192.168.2.3","216.58.197.4","TLSv1.2","212","Application Data"
"262","2018-08-23 02:16:16.388855","192.168.2.3","216.58.197.4","TCP","1434","34236  >  443 [ACK] Seq=144794 Ack=2782 Win=2363 Len=1368 TSval=7925850 TSecr=761151148 [TCP segment of a reassembled PDU]"
"263","2018-08-23 02:16:16.388857","192.168.2.3","216.58.197.4","TLSv1.2","155","Application Data"
"267","2018-08-23 02:16:16.484166","192.168.2.3","216.58.197.4","TCP","1434","34236  >  443 [ACK] Seq=146251 Ack=2782 Win=2363 Len=1368 TSval=7925860 TSecr=761151191 [TCP segment of a reassembled PDU]"
"268","2018-08-23 02:16:16.484171","192.168.2.3","216.58.197.4","TCP","1434","34236  >  443 [ACK] Seq=147619 Ack=2782 Win=2363 Len=1368 TSval=7925860 TSecr=761151191 [TCP segment of a reassembled PDU]"
"269","2018-08-23 02:16:16.484283","192.168.2.3","216.58.197.4","TLSv1.2","212","Application Data"
"270","2018-08-23 02:16:16.484768","192.168.2.3","216.58.197.4","TCP","1434","34236  >  443 [ACK] Seq=149133 Ack=2782 Win=2363 Len=1368 TSval=7925860 TSecr=761151191 [TCP segment of a reassembled PDU]"
"271","2018-08-23 02:16:16.484771","192.168.2.3","216.58.197.4","TLSv1.2","155","Application Data"
"275","2018-08-23 02:16:16.574894","192.168.2.3","216.58.197.4","TCP","1434","34236  >  443 [ACK] Seq=150590 Ack=2782 Win=2363 Len=1368 TSval=7925869 TSecr=761151286 [TCP segment of a reassembled PDU]"
"276","2018-08-23 02:16:16.574900","192.168.2.3","216.58.197.4","TCP","1434","34236  >  443 [ACK] Seq=151958 Ack=2782 Win=2363 Len=1368 TSval=7925869 TSecr=761151286 [TCP segment of a reassembled PDU]"
"277","2018-08-23 02:16:16.574979","192.168.2.3","216.58.197.4","TLSv1.2","212","Application Data"
"278","2018-08-23 02:16:16.575251","192.168.2.3","216.58.197.4","TCP","1434","34236  >  443 [ACK] Seq=153472 Ack=2782 Win=2363 Len=1368 TSval=7925869 TSecr=761151286 [TCP segment of a reassembled PDU]"
"279","2018-08-23 02:16:16.575253","192.168.2.3","216.58.197.4","TLSv1.2","155","Application Data"
"283","2018-08-23 02:16:16.675975","192.168.2.3","216.58.197.4","TCP","1434","34236  >  443 [ACK] Seq=154929 Ack=2782 Win=2363 Len=1368 TSval=7925879 TSecr=761151377 [TCP segment of a reassembled PDU]"
"284","2018-08-23 02:16:16.676210","192.168.2.3","216.58.197.4","TCP","1434","34236  >  443 [ACK] Seq=156297 Ack=2782 Win=2363 Len=1368 TSval=7925879 TSecr=761151377 [TCP segment of a reassembled PDU]"
"285","2018-08-23 02:16:16.676213","192.168.2.3","216.58.197.4","TLSv1.2","212","Application Data"
"286","2018-08-23 02:16:16.676651","192.168.2.3","216.58.197.4","TCP","1434","34236  >  443 [ACK] Seq=157811 Ack=2782 Win=2363 Len=1368 TSval=7925879 TSecr=761151377 [TCP segment of a reassembled PDU]"
"287","2018-08-23 02:16:16.676654","192.168.2.3","216.58.197.4","TLSv1.2","155","Application Data"
"291","2018-08-23 02:16:16.771328","192.168.2.3","216.58.197.4","TCP","1434","34236  >  443 [ACK] Seq=159268 Ack=2782 Win=2363 Len=1368 TSval=7925889 TSecr=761151478 [TCP segment of a reassembled PDU]"
"292","2018-08-23 02:16:16.771710","192.168.2.3","216.58.197.4","TCP","1434","34236  >  443 [ACK] Seq=160636 Ack=2782 Win=2363 Len=1368 TSval=7925889 TSecr=761151478 [TCP segment of a reassembled PDU]"
"293","2018-08-23 02:16:16.771713","192.168.2.3","216.58.197.4","TLSv1.2","212","Application Data"
"294","2018-08-23 02:16:16.772212","192.168.2.3","216.58.197.4","TCP","1434","34236  >  443 [ACK] Seq=162150 Ack=2782 Win=2363 Len=1368 TSval=7925889 TSecr=761151478 [TCP segment of a reassembled PDU]"
"295","2018-08-23 02:16:16.772214","192.168.2.3","216.58.197.4","TLSv1.2","155","Application Data"
"301","2018-08-23 02:16:16.819785","192.168.2.3","216.58.197.4","TCP","66","34236  >  443 [ACK] Seq=163607 Ack=2985 Win=2363 Len=0 TSval=7925893 TSecr=761151616"
"302","2018-08-23 02:16:16.867109","192.168.2.3","216.58.197.4","TCP","1434","34236  >  443 [ACK] Seq=163607 Ack=2985 Win=2363 Len=1368 TSval=7925898 TSecr=761151616 [TCP segment of a reassembled PDU]"
"303","2018-08-23 02:16:16.867532","192.168.2.3","216.58.197.4","TCP","1434","34236  >  443 [ACK] Seq=164975 Ack=2985 Win=2363 Len=1368 TSval=7925898 TSecr=761151616 [TCP segment of a reassembled PDU]"
"304","2018-08-23 02:16:16.867535","192.168.2.3","216.58.197.4","TLSv1.2","212","Application Data"
"305","2018-08-23 02:16:16.867536","192.168.2.3","216.58.197.4","TCP","1434","34236  >  443 [ACK] Seq=166489 Ack=2985 Win=2363 Len=1368 TSval=7925898 TSecr=761151616 [TCP segment of a reassembled PDU]"
"306","2018-08-23 02:16:16.867803","192.168.2.3","216.58.197.4","TLSv1.2","155","Application Data"
"312","2018-08-23 02:16:16.882369","192.168.2.3","216.58.197.4","TCP","66","34236  >  443 [ACK] Seq=167946 Ack=3285 Win=2363 Len=0 TSval=7925900 TSecr=761151666"
"313","2018-08-23 02:16:16.964149","192.168.2.3","216.58.197.4","TCP","1434","34236  >  443 [ACK] Seq=167946 Ack=3285 Win=2363 Len=1368 TSval=7925908 TSecr=761151666 [TCP segment of a reassembled PDU]"
"314","2018-08-23 02:16:16.964620","192.168.2.3","216.58.197.4","TCP","1434","34236  >  443 [ACK] Seq=169314 Ack=3285 Win=2363 Len=1368 TSval=7925908 TSecr=761151666 [TCP segment of a reassembled PDU]"
"315","2018-08-23 02:16:16.964624","192.168.2.3","216.58.197.4","TLSv1.2","212","Application Data"
"316","2018-08-23 02:16:16.965064","192.168.2.3","216.58.197.4","TCP","1434","34236  >  443 [ACK] Seq=170828 Ack=3285 Win=2363 Len=1368 TSval=7925908 TSecr=761151666 [TCP segment of a reassembled PDU]"
"317","2018-08-23 02:16:16.965067","192.168.2.3","216.58.197.4","TLSv1.2","155","Application Data"
"323","2018-08-23 02:16:17.017538","192.168.2.3","216.58.197.4","TCP","66","34236  >  443 [ACK] Seq=172285 Ack=3457 Win=2363 Len=0 TSval=7925913 TSecr=761151814"
"326","2018-08-23 02:16:17.031632","192.168.2.3","216.58.197.4","TCP","66","34236  >  443 [ACK] Seq=172285 Ack=3811 Win=2363 Len=0 TSval=7925915 TSecr=761151828"
"327","2018-08-23 02:16:17.056056","192.168.2.3","216.58.197.4","TCP","1434","34236  >  443 [ACK] Seq=172285 Ack=3811 Win=2363 Len=1368 TSval=7925917 TSecr=761151828 [TCP segment of a reassembled PDU]"
"328","2018-08-23 02:16:17.056389","192.168.2.3","216.58.197.4","TCP","1434","34236  >  443 [ACK] Seq=173653 Ack=3811 Win=2363 Len=1368 TSval=7925917 TSecr=761151828 [TCP segment of a reassembled PDU]"
"329","2018-08-23 02:16:17.056393","192.168.2.3","216.58.197.4","TLSv1.2","212","Application Data"
"330","2018-08-23 02:16:17.056813","192.168.2.3","216.58.197.4","TCP","1434","34236  >  443 [ACK] Seq=175167 Ack=3811 Win=2363 Len=1368 TSval=7925917 TSecr=761151828 [TCP segment of a reassembled PDU]"
"331","2018-08-23 02:16:17.056816","192.168.2.3","216.58.197.4","TLSv1.2","155","Application Data"
"337","2018-08-23 02:16:17.114384","192.168.2.3","216.58.197.4","TCP","66","34236  >  443 [ACK] Seq=176624 Ack=4302 Win=2363 Len=0 TSval=7925923 TSecr=761151909"
"338","2018-08-23 02:16:17.150003","192.168.2.3","216.58.197.4","TCP","1434","34236  >  443 [ACK] Seq=176624 Ack=4302 Win=2363 Len=1368 TSval=7925926 TSecr=761151909 [TCP segment of a reassembled PDU]"
"339","2018-08-23 02:16:17.150417","192.168.2.3","216.58.197.4","TCP","1434","34236  >  443 [ACK] Seq=177992 Ack=4302 Win=2363 Len=1368 TSval=7925926 TSecr=761151909 [TCP segment of a reassembled PDU]"
"340","2018-08-23 02:16:17.150419","192.168.2.3","216.58.197.4","TLSv1.2","212","Application Data"
"341","2018-08-23 02:16:17.150420","192.168.2.3","216.58.197.4","TCP","1434","34236  >  443 [ACK] Seq=179506 Ack=4302 Win=2363 Len=1368 TSval=7925926 TSecr=761151909 [TCP segment of a reassembled PDU]"
"342","2018-08-23 02:16:17.150694","192.168.2.3","216.58.197.4","TLSv1.2","155","Application Data"
"348","2018-08-23 02:16:17.203887","192.168.2.3","216.58.197.4","TCP","66","34236  >  443 [ACK] Seq=180963 Ack=4649 Win=2363 Len=0 TSval=7925932 TSecr=761151999"
"349","2018-08-23 02:16:17.247767","192.168.2.3","216.58.197.4","TCP","1434","34236  >  443 [ACK] Seq=180963 Ack=4649 Win=2363 Len=1368 TSval=7925936 TSecr=761151999 [TCP segment of a reassembled PDU]"
"350","2018-08-23 02:16:17.248042","192.168.2.3","216.58.197.4","TCP","1434","34236  >  443 [ACK] Seq=182331 Ack=4649 Win=2363 Len=1368 TSval=7925936 TSecr=761151999 [TCP segment of a reassembled PDU]"
"351","2018-08-23 02:16:17.248057","192.168.2.3","216.58.197.4","TLSv1.2","212","Application Data"
"352","2018-08-23 02:16:17.248494","192.168.2.3","216.58.197.4","TCP","1434","34236  >  443 [ACK] Seq=183845 Ack=4649 Win=2363 Len=1368 TSval=7925936 TSecr=761151999 [TCP segment of a reassembled PDU]"
"353","2018-08-23 02:16:17.248497","192.168.2.3","216.58.197.4","TLSv1.2","155","Application Data"
"359","2018-08-23 02:16:17.303167","192.168.2.3","216.58.197.4","TCP","66","34236  >  443 [ACK] Seq=185302 Ack=4839 Win=2363 Len=0 TSval=7925941 TSecr=761152091"
"360","2018-08-23 02:16:17.345003","192.168.2.3","216.58.197.4","TCP","1434","34236  >  443 [ACK] Seq=185302 Ack=4839 Win=2363 Len=1368 TSval=7925946 TSecr=761152091 [TCP segment of a reassembled PDU]"
"361","2018-08-23 02:16:17.345006","192.168.2.3","216.58.197.4","TCP","1434","34236  >  443 [ACK] Seq=186670 Ack=4839 Win=2363 Len=1368 TSval=7925946 TSecr=761152091 [TCP segment of a reassembled PDU]"
"362","2018-08-23 02:16:17.345007","192.168.2.3","216.58.197.4","TLSv1.2","212","Application Data"
"363","2018-08-23 02:16:17.345391","192.168.2.3","216.58.197.4","TCP","1434","34236  >  443 [ACK] Seq=188184 Ack=4839 Win=2363 Len=1368 TSval=7925946 TSecr=761152091 [TCP segment of a reassembled PDU]"
"364","2018-08-23 02:16:17.345393","192.168.2.3","216.58.197.4","TLSv1.2","155","Application Data"
"370","2018-08-23 02:16:17.396500","192.168.2.3","216.58.197.4","TCP","66","34236  >  443 [ACK] Seq=189641 Ack=5317 Win=2363 Len=0 TSval=7925951 TSecr=761152193"
"371","2018-08-23 02:16:17.443749","192.168.2.3","216.58.197.4","TCP","1434","34236  >  443 [ACK] Seq=189641 Ack=5317 Win=2363 Len=1368 TSval=7925956 TSecr=761152193 [TCP segment of a reassembled PDU]"
"372","2018-08-23 02:16:17.444137","192.168.2.3","216.58.197.4","TCP","1434","34236  >  443 [ACK] Seq=191009 Ack=5317 Win=2363 Len=1368 TSval=7925956 TSecr=761152193 [TCP segment of a reassembled PDU]"
"373","2018-08-23 02:16:17.444138","192.168.2.3","216.58.197.4","TLSv1.2","212","Application Data"
"374","2018-08-23 02:16:17.447380","192.168.2.3","216.58.197.4","TCP","1434","34236  >  443 [ACK] Seq=192523 Ack=5317 Win=2363 Len=1368 TSval=7925956 TSecr=761152193 [TCP segment of a reassembled PDU]"
"375","2018-08-23 02:16:17.447383","192.168.2.3","216.58.197.4","TLSv1.2","103","Application Data"
"381","2018-08-23 02:16:17.496079","192.168.2.3","216.58.197.4","TCP","66","34236  >  443 [ACK] Seq=193928 Ack=5549 Win=2363 Len=0 TSval=7925961 TSecr=761152290"
"382","2018-08-23 02:16:17.549819","192.168.2.3","216.58.197.4","TCP","1434","34236  >  443 [ACK] Seq=193928 Ack=5549 Win=2363 Len=1368 TSval=7925966 TSecr=761152290 [TCP segment of a reassembled PDU]"
"383","2018-08-23 02:16:17.549825","192.168.2.3","216.58.197.4","TCP","1434","34236  >  443 [ACK] Seq=195296 Ack=5549 Win=2363 Len=1368 TSval=7925966 TSecr=761152290 [TCP segment of a reassembled PDU]"
"384","2018-08-23 02:16:17.549826","192.168.2.3","216.58.197.4","TLSv1.2","212","Application Data"
"385","2018-08-23 02:16:17.550103","192.168.2.3","216.58.197.4","TCP","1434","34236  >  443 [ACK] Seq=196810 Ack=5549 Win=2363 Len=1368 TSval=7925966 TSecr=761152290 [TCP segment of a reassembled PDU]"
"386","2018-08-23 02:16:17.550106","192.168.2.3","216.58.197.4","TLSv1.2","155","Application Data"
"391","2018-08-23 02:16:17.668229","192.168.2.3","216.58.197.4","TCP","1434","34236  >  443 [ACK] Seq=198267 Ack=5703 Win=2363 Len=1368 TSval=7925978 TSecr=761152430 [TCP segment of a reassembled PDU]"
"392","2018-08-23 02:16:17.668845","192.168.2.3","216.58.197.4","TCP","1434","34236  >  443 [ACK] Seq=199635 Ack=5703 Win=2363 Len=1368 TSval=7925978 TSecr=761152430 [TCP segment of a reassembled PDU]"
"393","2018-08-23 02:16:17.668848","192.168.2.3","216.58.197.4","TLSv1.2","212","Application Data"
"394","2018-08-23 02:16:17.668849","192.168.2.3","216.58.197.4","TCP","1434","34236  >  443 [ACK] Seq=201149 Ack=5703 Win=2363 Len=1368 TSval=7925978 TSecr=761152430 [TCP segment of a reassembled PDU]"
"395","2018-08-23 02:16:17.668946","192.168.2.3","216.58.197.4","TLSv1.2","155","Application Data"
"399","2018-08-23 02:16:17.771468","192.168.2.3","216.58.197.4","TCP","1434","34236  >  443 [ACK] Seq=202606 Ack=5703 Win=2363 Len=1368 TSval=7925989 TSecr=761152471 [TCP segment of a reassembled PDU]"
"400","2018-08-23 02:16:17.771918","192.168.2.3","216.58.197.4","TCP","1434","34236  >  443 [ACK] Seq=203974 Ack=5703 Win=2363 Len=1368 TSval=7925989 TSecr=761152471 [TCP segment of a reassembled PDU]"
"401","2018-08-23 02:16:17.771919","192.168.2.3","216.58.197.4","TLSv1.2","212","Application Data"
"402","2018-08-23 02:16:17.773194","192.168.2.3","216.58.197.4","TCP","1434","34236  >  443 [ACK] Seq=205488 Ack=5703 Win=2363 Len=1368 TSval=7925989 TSecr=761152471 [TCP segment of a reassembled PDU]"
"403","2018-08-23 02:16:17.773196","192.168.2.3","216.58.197.4","TLSv1.2","155","Application Data"
"409","2018-08-23 02:16:17.832977","192.168.2.3","216.58.197.4","TCP","66","34236  >  443 [ACK] Seq=206945 Ack=6215 Win=2363 Len=0 TSval=7925995 TSecr=761152628"
"412","2018-08-23 02:16:17.882467","192.168.2.3","216.58.197.4","TCP","66","34236  >  443 [ACK] Seq=206945 Ack=6458 Win=2363 Len=0 TSval=7926000 TSecr=761152666"
"413","2018-08-23 02:16:17.889220","192.168.2.3","216.58.197.4","TCP","1434","34236  >  443 [ACK] Seq=206945 Ack=6458 Win=2363 Len=1368 TSval=7926000 TSecr=761152666 [TCP segment of a reassembled PDU]"
"414","2018-08-23 02:16:17.889622","192.168.2.3","216.58.197.4","TCP","1434","34236  >  443 [ACK] Seq=208313 Ack=6458 Win=2363 Len=1368 TSval=7926000 TSecr=761152666 [TCP segment of a reassembled PDU]"
"415","2018-08-23 02:16:17.889624","192.168.2.3","216.58.197.4","TLSv1.2","212","Application Data"
"416","2018-08-23 02:16:17.889625","192.168.2.3","216.58.197.4","TCP","1434","34236  >  443 [ACK] Seq=209827 Ack=6458 Win=2363 Len=1368 TSval=7926000 TSecr=761152666 [TCP segment of a reassembled PDU]"
"417","2018-08-23 02:16:17.889862","192.168.2.3","216.58.197.4","TLSv1.2","155","Application Data"
"421","2018-08-23 02:16:17.988338","192.168.2.3","216.58.197.4","TCP","1434","34236  >  443 [ACK] Seq=211284 Ack=6458 Win=2363 Len=1368 TSval=7926010 TSecr=761152691 [TCP segment of a reassembled PDU]"
