"No.","Time","Source","Destination","Protocol","Length","Info"
"1","2018-08-23 02:19:56.241120","192.168.2.3","203.211.199.120","TLSv1.2","789","Application Data"
"6","2018-08-23 02:19:56.264500","192.168.2.3","203.211.199.120","TCP","66","52019  >  443 [ACK] Seq=724 Ack=1449 Win=982 Len=0 TSval=7947838 TSecr=1193239255"
"7","2018-08-23 02:19:56.264960","192.168.2.3","203.211.199.120","TCP","66","52019  >  443 [ACK] Seq=724 Ack=2897 Win=982 Len=0 TSval=7947838 TSecr=1193239255"
"8","2018-08-23 02:19:56.265211","192.168.2.3","203.211.199.120","TCP","66","52019  >  443 [ACK] Seq=724 Ack=4345 Win=982 Len=0 TSval=7947838 TSecr=1193239255"
"9","2018-08-23 02:19:56.265214","192.168.2.3","203.211.199.120","TCP","66","52019  >  443 [ACK] Seq=724 Ack=5231 Win=982 Len=0 TSval=7947838 TSecr=1193239255"
"10","2018-08-23 02:19:57.093166","192.168.2.3","203.211.199.122","TCP","66","57083  >  443 [ACK] Seq=1 Ack=1 Win=329 Len=0 TSval=7947920 TSecr=1193792241"
"12","2018-08-23 02:19:57.158516","192.168.2.3","216.58.197.3","TLSv1.2","135","Application Data"
"13","2018-08-23 02:19:57.158520","192.168.2.3","216.58.197.3","TLSv1.2","104","Application Data"
"16","2018-08-23 02:19:57.169696","192.168.2.3","216.58.197.3","TCP","66","43379  >  443 [ACK] Seq=108 Ack=117 Win=406 Len=0 TSval=7947928 TSecr=1766587164"
"17","2018-08-23 02:19:57.169702","192.168.2.3","216.58.197.3","TLSv1.2","100","Application Data"
"18","2018-08-23 02:19:57.169703","192.168.2.3","216.58.197.3","TLSv1.2","104","Application Data"
"21","2018-08-23 02:19:58.811900","192.168.2.3","192.168.2.1","TCP","183","8009  >  53029 [PSH, ACK] Seq=1 Ack=118 Win=277 Len=117 TSval=7948092 TSecr=2316736904 [TCP segment of a reassembled PDU]"
"23","2018-08-23 02:19:59.243165","192.168.2.3","216.58.197.14","TCP","66","41160  >  443 [ACK] Seq=1 Ack=1 Win=494 Len=0 TSval=7948136 TSecr=4135956366"
"25","2018-08-23 02:19:59.290843","192.168.2.3","216.58.197.4","TLSv1.2","156","Application Data"
"26","2018-08-23 02:19:59.291016","192.168.2.3","216.58.197.4","TLSv1.2","104","Application Data"
"27","2018-08-23 02:19:59.291672","192.168.2.3","216.58.197.4","TLSv1.2","159","Application Data"
"31","2018-08-23 02:19:59.309037","192.168.2.3","216.58.197.4","TCP","1434","34236  >  443 [ACK] Seq=222 Ack=39 Win=2363 Len=1368 TSval=7948142 TSecr=761374093 [TCP segment of a reassembled PDU]"
"32","2018-08-23 02:19:59.309043","192.168.2.3","216.58.197.4","TCP","1434","34236  >  443 [ACK] Seq=1590 Ack=39 Win=2363 Len=1368 TSval=7948142 TSecr=761374093 [TCP segment of a reassembled PDU]"
"33","2018-08-23 02:19:59.309044","192.168.2.3","216.58.197.4","TLSv1.2","212","Application Data"
"34","2018-08-23 02:19:59.309368","192.168.2.3","216.58.197.4","TCP","1434","34236  >  443 [ACK] Seq=3104 Ack=39 Win=2363 Len=1368 TSval=7948142 TSecr=761374093 [TCP segment of a reassembled PDU]"
"35","2018-08-23 02:19:59.309372","192.168.2.3","216.58.197.4","TLSv1.2","362","Application Data"
"36","2018-08-23 02:19:59.309373","192.168.2.3","216.58.197.4","TCP","1434","34236  >  443 [ACK] Seq=4768 Ack=39 Win=2363 Len=1368 TSval=7948142 TSecr=761374093 [TCP segment of a reassembled PDU]"
"37","2018-08-23 02:19:59.309756","192.168.2.3","216.58.197.4","TCP","1434","34236  >  443 [ACK] Seq=6136 Ack=39 Win=2363 Len=1368 TSval=7948142 TSecr=761374093 [TCP segment of a reassembled PDU]"
"38","2018-08-23 02:19:59.309760","192.168.2.3","216.58.197.4","TLSv1.2","212","Application Data"
"39","2018-08-23 02:19:59.309761","192.168.2.3","216.58.197.4","TCP","1434","34236  >  443 [ACK] Seq=7650 Ack=39 Win=2363 Len=1368 TSval=7948142 TSecr=761374093 [TCP segment of a reassembled PDU]"
"45","2018-08-23 02:19:59.315018","192.168.2.3","216.58.197.4","TLSv1.2","1434","Application Data [TCP segment of a reassembled PDU]"
"46","2018-08-23 02:19:59.315306","192.168.2.3","216.58.197.4","TCP","1434","34236  >  443 [ACK] Seq=10386 Ack=39 Win=2363 Len=1368 TSval=7948143 TSecr=761374111 [TCP segment of a reassembled PDU]"
"47","2018-08-23 02:19:59.315470","192.168.2.3","216.58.197.4","TLSv1.2","1434","Application Data [TCP segment of a reassembled PDU]"
"48","2018-08-23 02:19:59.315707","192.168.2.3","216.58.197.4","TLSv1.2","1434","Application Data [TCP segment of a reassembled PDU]"
"49","2018-08-23 02:19:59.316288","192.168.2.3","216.58.197.4","TCP","1434","34236  >  443 [ACK] Seq=14490 Ack=39 Win=2363 Len=1368 TSval=7948143 TSecr=761374111 [TCP segment of a reassembled PDU]"
"50","2018-08-23 02:19:59.316430","192.168.2.3","216.58.197.4","TLSv1.2","1434","Application Data [TCP segment of a reassembled PDU]"
"51","2018-08-23 02:19:59.316785","192.168.2.3","216.58.197.4","TLSv1.2","1434","Application Data [TCP segment of a reassembled PDU]"
"52","2018-08-23 02:19:59.316790","192.168.2.3","216.58.197.4","TCP","1434","34236  >  443 [ACK] Seq=18594 Ack=39 Win=2363 Len=1368 TSval=7948143 TSecr=761374111 [TCP segment of a reassembled PDU]"
"53","2018-08-23 02:19:59.317077","192.168.2.3","216.58.197.4","TLSv1.2","1434","Application Data [TCP segment of a reassembled PDU]"
"54","2018-08-23 02:19:59.317235","192.168.2.3","216.58.197.4","TLSv1.2","1434","Application Data [TCP segment of a reassembled PDU]"
"55","2018-08-23 02:19:59.317438","192.168.2.3","216.58.197.4","TCP","1434","34236  >  443 [ACK] Seq=22698 Ack=39 Win=2363 Len=1368 TSval=7948143 TSecr=761374112 [TCP segment of a reassembled PDU]"
"61","2018-08-23 02:19:59.324146","192.168.2.3","216.58.197.4","TLSv1.2","1434","Application Data [TCP segment of a reassembled PDU]"
"62","2018-08-23 02:19:59.324330","192.168.2.3","216.58.197.4","TLSv1.2","1434","Application Data [TCP segment of a reassembled PDU]"
"63","2018-08-23 02:19:59.324489","192.168.2.3","216.58.197.4","TCP","1434","34236  >  443 [ACK] Seq=26802 Ack=39 Win=2363 Len=1368 TSval=7948143 TSecr=761374112 [TCP segment of a reassembled PDU]"
"64","2018-08-23 02:19:59.324686","192.168.2.3","216.58.197.4","TLSv1.2","1434","Application Data [TCP segment of a reassembled PDU]"
"65","2018-08-23 02:19:59.324871","192.168.2.3","216.58.197.4","TLSv1.2","1434","Application Data [TCP segment of a reassembled PDU]"
"66","2018-08-23 02:19:59.325053","192.168.2.3","216.58.197.4","TCP","1434","34236  >  443 [ACK] Seq=30906 Ack=39 Win=2363 Len=1368 TSval=7948143 TSecr=761374117 [TCP segment of a reassembled PDU]"
"67","2018-08-23 02:19:59.325212","192.168.2.3","216.58.197.4","TCP","1434","34236  >  443 [ACK] Seq=32274 Ack=39 Win=2363 Len=1368 TSval=7948143 TSecr=761374117 [TCP segment of a reassembled PDU]"
"68","2018-08-23 02:19:59.325415","192.168.2.3","216.58.197.4","TLSv1.2","1434","Application Data [TCP segment of a reassembled PDU]"
"69","2018-08-23 02:19:59.325598","192.168.2.3","216.58.197.4","TLSv1.2","1434","Application Data [TCP segment of a reassembled PDU]"
"70","2018-08-23 02:19:59.325826","192.168.2.3","216.58.197.4","TCP","1434","34236  >  443 [ACK] Seq=36378 Ack=39 Win=2363 Len=1368 TSval=7948143 TSecr=761374118 [TCP segment of a reassembled PDU]"
"71","2018-08-23 02:19:59.326286","192.168.2.3","216.58.197.4","TLSv1.2","1434","Application Data [TCP segment of a reassembled PDU]"
"72","2018-08-23 02:19:59.326439","192.168.2.3","216.58.197.4","TLSv1.2","1434","Application Data [TCP segment of a reassembled PDU]"
"73","2018-08-23 02:19:59.326593","192.168.2.3","216.58.197.4","TCP","1434","34236  >  443 [ACK] Seq=40482 Ack=39 Win=2363 Len=1368 TSval=7948144 TSecr=761374118 [TCP segment of a reassembled PDU]"
"74","2018-08-23 02:19:59.326776","192.168.2.3","216.58.197.4","TLSv1.2","1434","Application Data [TCP segment of a reassembled PDU]"
"75","2018-08-23 02:19:59.326928","192.168.2.3","216.58.197.4","TLSv1.2","1434","Application Data [TCP segment of a reassembled PDU]"
"76","2018-08-23 02:19:59.327085","192.168.2.3","216.58.197.4","TCP","1434","34236  >  443 [ACK] Seq=44586 Ack=39 Win=2363 Len=1368 TSval=7948144 TSecr=761374119 [TCP segment of a reassembled PDU]"
"77","2018-08-23 02:19:59.327266","192.168.2.3","216.58.197.4","TLSv1.2","1434","Application Data [TCP segment of a reassembled PDU]"
"78","2018-08-23 02:19:59.327460","192.168.2.3","216.58.197.4","TLSv1.2","1434","Application Data [TCP segment of a reassembled PDU]"
"85","2018-08-23 02:19:59.330579","192.168.2.3","216.58.197.4","TCP","1434","34236  >  443 [PSH, ACK] Seq=48690 Ack=39 Win=2363 Len=1368 TSval=7948144 TSecr=761374126 [TCP segment of a reassembled PDU]"
"87","2018-08-23 02:19:59.330735","192.168.2.3","216.58.197.4","TLSv1.2","1434","Application Data [TCP segment of a reassembled PDU]"
"88","2018-08-23 02:19:59.330936","192.168.2.3","216.58.197.4","TLSv1.2","1434","Application Data [TCP segment of a reassembled PDU]"
"91","2018-08-23 02:19:59.334285","192.168.2.3","216.58.197.4","TCP","1434","34236  >  443 [ACK] Seq=52794 Ack=39 Win=2363 Len=1368 TSval=7948145 TSecr=761374126 [TCP segment of a reassembled PDU]"
"94","2018-08-23 02:19:59.335406","192.168.2.3","216.58.197.4","TLSv1.2","1434","Application Data [TCP segment of a reassembled PDU]"
"95","2018-08-23 02:19:59.335752","192.168.2.3","216.58.197.4","TLSv1.2","1434","Application Data [TCP segment of a reassembled PDU]"
"96","2018-08-23 02:19:59.335898","192.168.2.3","216.58.197.4","TCP","1434","34236  >  443 [ACK] Seq=56898 Ack=39 Win=2363 Len=1368 TSval=7948145 TSecr=761374127 [TCP segment of a reassembled PDU]"
"97","2018-08-23 02:19:59.336083","192.168.2.3","216.58.197.4","TLSv1.2","1434","Application Data [TCP segment of a reassembled PDU]"
"98","2018-08-23 02:19:59.336228","192.168.2.3","216.58.197.4","TLSv1.2","1434","Application Data [TCP segment of a reassembled PDU]"
"99","2018-08-23 02:19:59.336388","192.168.2.3","216.58.197.4","TCP","1434","34236  >  443 [ACK] Seq=61002 Ack=39 Win=2363 Len=1368 TSval=7948145 TSecr=761374127 [TCP segment of a reassembled PDU]"
"100","2018-08-23 02:19:59.336575","192.168.2.3","216.58.197.4","TLSv1.2","1434","Application Data [TCP segment of a reassembled PDU]"
"101","2018-08-23 02:19:59.336577","192.168.2.3","216.58.197.4","TLSv1.2","907","Application Data"
"107","2018-08-23 02:19:59.412314","192.168.2.3","216.58.197.4","TCP","1434","34236  >  443 [ACK] Seq=64579 Ack=39 Win=2363 Len=1368 TSval=7948152 TSecr=761374179 [TCP segment of a reassembled PDU]"
"108","2018-08-23 02:19:59.412319","192.168.2.3","216.58.197.4","TCP","1434","34236  >  443 [ACK] Seq=65947 Ack=39 Win=2363 Len=1368 TSval=7948152 TSecr=761374179 [TCP segment of a reassembled PDU]"
"109","2018-08-23 02:19:59.412465","192.168.2.3","216.58.197.4","TLSv1.2","212","Application Data"
"110","2018-08-23 02:19:59.412710","192.168.2.3","216.58.197.4","TCP","1434","34236  >  443 [ACK] Seq=67461 Ack=39 Win=2363 Len=1368 TSval=7948152 TSecr=761374179 [TCP segment of a reassembled PDU]"
"111","2018-08-23 02:19:59.412711","192.168.2.3","216.58.197.4","TLSv1.2","155","Application Data"
"114","2018-08-23 02:19:59.523986","192.168.2.3","216.58.197.4","TCP","1434","34236  >  443 [ACK] Seq=68918 Ack=39 Win=2363 Len=1368 TSval=7948163 TSecr=761374215 [TCP segment of a reassembled PDU]"
"115","2018-08-23 02:19:59.524204","192.168.2.3","216.58.197.4","TCP","1434","34236  >  443 [ACK] Seq=70286 Ack=39 Win=2363 Len=1368 TSval=7948163 TSecr=761374215 [TCP segment of a reassembled PDU]"
"116","2018-08-23 02:19:59.524208","192.168.2.3","216.58.197.4","TLSv1.2","212","Application Data"
"117","2018-08-23 02:19:59.524209","192.168.2.3","216.58.197.4","TCP","1434","34236  >  443 [ACK] Seq=71800 Ack=39 Win=2363 Len=1368 TSval=7948163 TSecr=761374215 [TCP segment of a reassembled PDU]"
"118","2018-08-23 02:19:59.524556","192.168.2.3","216.58.197.4","TLSv1.2","155","Application Data"
"125","2018-08-23 02:19:59.598717","192.168.2.3","216.58.197.4","TCP","66","34236  >  443 [ACK] Seq=73257 Ack=206 Win=2363 Len=0 TSval=7948171 TSecr=761374394"
"127","2018-08-23 02:19:59.621184","192.168.2.3","216.58.197.4","TCP","66","34236  >  443 [ACK] Seq=73257 Ack=737 Win=2363 Len=0 TSval=7948173 TSecr=761374395"
"128","2018-08-23 02:19:59.621609","192.168.2.3","216.58.197.4","TCP","1434","34236  >  443 [ACK] Seq=73257 Ack=737 Win=2363 Len=1368 TSval=7948173 TSecr=761374395 [TCP segment of a reassembled PDU]"
"129","2018-08-23 02:19:59.622289","192.168.2.3","216.58.197.4","TCP","1434","34236  >  443 [ACK] Seq=74625 Ack=737 Win=2363 Len=1368 TSval=7948173 TSecr=761374395 [TCP segment of a reassembled PDU]"
"130","2018-08-23 02:19:59.622292","192.168.2.3","216.58.197.4","TLSv1.2","212","Application Data"
"131","2018-08-23 02:19:59.622293","192.168.2.3","216.58.197.4","TCP","1434","34236  >  443 [ACK] Seq=76139 Ack=737 Win=2363 Len=1368 TSval=7948173 TSecr=761374395 [TCP segment of a reassembled PDU]"
"132","2018-08-23 02:19:59.622595","192.168.2.3","216.58.197.4","TLSv1.2","155","Application Data"
"136","2018-08-23 02:19:59.643475","192.168.2.3","216.58.197.14","TCP","66","41142  >  443 [ACK] Seq=1 Ack=1 Win=661 Len=0 TSval=7948176 TSecr=934338108"
"138","2018-08-23 02:19:59.718370","192.168.2.3","216.58.197.4","TCP","1434","34236  >  443 [ACK] Seq=77596 Ack=737 Win=2363 Len=1368 TSval=7948183 TSecr=761374424 [TCP segment of a reassembled PDU]"
"139","2018-08-23 02:19:59.718807","192.168.2.3","216.58.197.4","TCP","1434","34236  >  443 [ACK] Seq=78964 Ack=737 Win=2363 Len=1368 TSval=7948183 TSecr=761374424 [TCP segment of a reassembled PDU]"
"140","2018-08-23 02:19:59.718809","192.168.2.3","216.58.197.4","TLSv1.2","212","Application Data"
"142","2018-08-23 02:19:59.720539","192.168.2.3","216.58.197.4","TCP","1434","34236  >  443 [ACK] Seq=80478 Ack=737 Win=2363 Len=1368 TSval=7948183 TSecr=761374424 [TCP segment of a reassembled PDU]"
"143","2018-08-23 02:19:59.720541","192.168.2.3","216.58.197.4","TLSv1.2","155","Application Data"
"147","2018-08-23 02:19:59.753136","192.168.2.3","216.58.197.4","TCP","66","34236  >  443 [ACK] Seq=81935 Ack=873 Win=2363 Len=0 TSval=7948187 TSecr=761374517"
"148","2018-08-23 02:19:59.821089","192.168.2.3","216.58.197.4","TCP","1434","34236  >  443 [ACK] Seq=81935 Ack=873 Win=2363 Len=1368 TSval=7948193 TSecr=761374517 [TCP segment of a reassembled PDU]"
"149","2018-08-23 02:19:59.821095","192.168.2.3","216.58.197.4","TCP","1434","34236  >  443 [ACK] Seq=83303 Ack=873 Win=2363 Len=1368 TSval=7948193 TSecr=761374517 [TCP segment of a reassembled PDU]"
"150","2018-08-23 02:19:59.821096","192.168.2.3","216.58.197.4","TLSv1.2","212","Application Data"
"151","2018-08-23 02:19:59.821193","192.168.2.3","216.58.197.4","TCP","1434","34236  >  443 [ACK] Seq=84817 Ack=873 Win=2363 Len=1368 TSval=7948193 TSecr=761374517 [TCP segment of a reassembled PDU]"
"152","2018-08-23 02:19:59.821405","192.168.2.3","216.58.197.4","TLSv1.2","155","Application Data"
"156","2018-08-23 02:19:59.887801","192.168.2.3","216.58.197.4","TCP","66","34236  >  443 [ACK] Seq=86274 Ack=1113 Win=2363 Len=0 TSval=7948200 TSecr=761374682"
"157","2018-08-23 02:19:59.910039","192.168.2.3","216.58.197.4","TCP","1434","34236  >  443 [ACK] Seq=86274 Ack=1113 Win=2363 Len=1368 TSval=7948202 TSecr=761374682 [TCP segment of a reassembled PDU]"
"158","2018-08-23 02:19:59.910439","192.168.2.3","216.58.197.4","TCP","1434","34236  >  443 [ACK] Seq=87642 Ack=1113 Win=2363 Len=1368 TSval=7948202 TSecr=761374682 [TCP segment of a reassembled PDU]"
"159","2018-08-23 02:19:59.910444","192.168.2.3","216.58.197.4","TLSv1.2","212","Application Data"
"160","2018-08-23 02:19:59.910616","192.168.2.3","216.58.197.4","TCP","1434","34236  >  443 [ACK] Seq=89156 Ack=1113 Win=2363 Len=1368 TSval=7948202 TSecr=761374682 [TCP segment of a reassembled PDU]"
"161","2018-08-23 02:19:59.910620","192.168.2.3","216.58.197.4","TLSv1.2","155","Application Data"
"165","2018-08-23 02:20:00.002769","192.168.2.3","216.58.197.4","TCP","1434","34236  >  443 [ACK] Seq=90613 Ack=1113 Win=2363 Len=1368 TSval=7948211 TSecr=761374713 [TCP segment of a reassembled PDU]"
"166","2018-08-23 02:20:00.003234","192.168.2.3","216.58.197.4","TCP","1434","34236  >  443 [ACK] Seq=91981 Ack=1113 Win=2363 Len=1368 TSval=7948211 TSecr=761374713 [TCP segment of a reassembled PDU]"
"167","2018-08-23 02:20:00.003598","192.168.2.3","216.58.197.4","TLSv1.2","212","Application Data"
"168","2018-08-23 02:20:00.003955","192.168.2.3","216.58.197.4","TCP","1434","34236  >  443 [ACK] Seq=93495 Ack=1113 Win=2363 Len=1368 TSval=7948211 TSecr=761374713 [TCP segment of a reassembled PDU]"
"169","2018-08-23 02:20:00.003958","192.168.2.3","216.58.197.4","TLSv1.2","155","Application Data"
"173","2018-08-23 02:20:00.099041","192.168.2.3","216.58.197.4","TCP","1434","34236  >  443 [ACK] Seq=94952 Ack=1113 Win=2363 Len=1368 TSval=7948221 TSecr=761374806 [TCP segment of a reassembled PDU]"
"174","2018-08-23 02:20:00.099383","192.168.2.3","216.58.197.4","TCP","1434","34236  >  443 [ACK] Seq=96320 Ack=1113 Win=2363 Len=1368 TSval=7948221 TSecr=761374806 [TCP segment of a reassembled PDU]"
"175","2018-08-23 02:20:00.099387","192.168.2.3","216.58.197.4","TLSv1.2","212","Application Data"
"176","2018-08-23 02:20:00.099578","192.168.2.3","216.58.197.4","TCP","1434","34236  >  443 [ACK] Seq=97834 Ack=1113 Win=2363 Len=1368 TSval=7948221 TSecr=761374806 [TCP segment of a reassembled PDU]"
"177","2018-08-23 02:20:00.099581","192.168.2.3","216.58.197.4","TLSv1.2","155","Application Data"
"181","2018-08-23 02:20:00.176173","192.168.2.3","216.58.197.4","TCP","1434","34236  >  443 [ACK] Seq=99291 Ack=1113 Win=2363 Len=1368 TSval=7948229 TSecr=761374902 [TCP segment of a reassembled PDU]"
"182","2018-08-23 02:20:00.176506","192.168.2.3","216.58.197.4","TCP","1434","34236  >  443 [ACK] Seq=100659 Ack=1113 Win=2363 Len=1368 TSval=7948229 TSecr=761374902 [TCP segment of a reassembled PDU]"
"183","2018-08-23 02:20:00.176508","192.168.2.3","216.58.197.4","TLSv1.2","212","Application Data"
"184","2018-08-23 02:20:00.176509","192.168.2.3","216.58.197.4","TCP","1434","34236  >  443 [ACK] Seq=102173 Ack=1113 Win=2363 Len=1368 TSval=7948229 TSecr=761374902 [TCP segment of a reassembled PDU]"
"185","2018-08-23 02:20:00.176648","192.168.2.3","216.58.197.4","TLSv1.2","155","Application Data"
"189","2018-08-23 02:20:00.271494","192.168.2.3","216.58.197.4","TCP","1434","34236  >  443 [ACK] Seq=103630 Ack=1113 Win=2363 Len=1368 TSval=7948238 TSecr=761374979 [TCP segment of a reassembled PDU]"
"190","2018-08-23 02:20:00.271899","192.168.2.3","216.58.197.4","TCP","1434","34236  >  443 [ACK] Seq=104998 Ack=1113 Win=2363 Len=1368 TSval=7948238 TSecr=761374979 [TCP segment of a reassembled PDU]"
"191","2018-08-23 02:20:00.271903","192.168.2.3","216.58.197.4","TLSv1.2","212","Application Data"
"192","2018-08-23 02:20:00.272082","192.168.2.3","216.58.197.4","TCP","1434","34236  >  443 [ACK] Seq=106512 Ack=1113 Win=2363 Len=1368 TSval=7948238 TSecr=761374979 [TCP segment of a reassembled PDU]"
"193","2018-08-23 02:20:00.272084","192.168.2.3","216.58.197.4","TLSv1.2","155","Application Data"
"197","2018-08-23 02:20:00.358221","192.168.2.3","216.58.197.4","TCP","1434","34236  >  443 [ACK] Seq=107969 Ack=1113 Win=2363 Len=1368 TSval=7948247 TSecr=761375074 [TCP segment of a reassembled PDU]"
"198","2018-08-23 02:20:00.358650","192.168.2.3","216.58.197.4","TCP","1434","34236  >  443 [ACK] Seq=109337 Ack=1113 Win=2363 Len=1368 TSval=7948247 TSecr=761375074 [TCP segment of a reassembled PDU]"
"199","2018-08-23 02:20:00.358653","192.168.2.3","216.58.197.4","TLSv1.2","212","Application Data"
"200","2018-08-23 02:20:00.358942","192.168.2.3","216.58.197.4","TCP","1434","34236  >  443 [ACK] Seq=110851 Ack=1113 Win=2363 Len=1368 TSval=7948247 TSecr=761375074 [TCP segment of a reassembled PDU]"
"201","2018-08-23 02:20:00.358945","192.168.2.3","216.58.197.4","TLSv1.2","155","Application Data"
"205","2018-08-23 02:20:00.451081","192.168.2.3","216.58.197.4","TCP","1434","34236  >  443 [ACK] Seq=112308 Ack=1113 Win=2363 Len=1368 TSval=7948256 TSecr=761375161 [TCP segment of a reassembled PDU]"
"206","2018-08-23 02:20:00.451492","192.168.2.3","216.58.197.4","TCP","1434","34236  >  443 [ACK] Seq=113676 Ack=1113 Win=2363 Len=1368 TSval=7948256 TSecr=761375161 [TCP segment of a reassembled PDU]"
"207","2018-08-23 02:20:00.451498","192.168.2.3","216.58.197.4","TLSv1.2","212","Application Data"
"208","2018-08-23 02:20:00.451649","192.168.2.3","216.58.197.4","TCP","1434","34236  >  443 [ACK] Seq=115190 Ack=1113 Win=2363 Len=1368 TSval=7948256 TSecr=761375161 [TCP segment of a reassembled PDU]"
"209","2018-08-23 02:20:00.451651","192.168.2.3","216.58.197.4","TLSv1.2","155","Application Data"
"215","2018-08-23 02:20:00.465792","192.168.2.3","216.58.197.4","TCP","66","34236  >  443 [ACK] Seq=116647 Ack=1545 Win=2363 Len=0 TSval=7948258 TSecr=761375262"
"216","2018-08-23 02:20:00.550056","192.168.2.3","216.58.197.4","TCP","1434","34236  >  443 [ACK] Seq=116647 Ack=1545 Win=2363 Len=1368 TSval=7948266 TSecr=761375262 [TCP segment of a reassembled PDU]"
"217","2018-08-23 02:20:00.550245","192.168.2.3","216.58.197.4","TCP","1434","34236  >  443 [ACK] Seq=118015 Ack=1545 Win=2363 Len=1368 TSval=7948266 TSecr=761375262 [TCP segment of a reassembled PDU]"
"218","2018-08-23 02:20:00.550248","192.168.2.3","216.58.197.4","TLSv1.2","212","Application Data"
"219","2018-08-23 02:20:00.550453","192.168.2.3","216.58.197.4","TCP","1434","34236  >  443 [ACK] Seq=119529 Ack=1545 Win=2363 Len=1368 TSval=7948266 TSecr=761375262 [TCP segment of a reassembled PDU]"
"220","2018-08-23 02:20:00.550455","192.168.2.3","216.58.197.4","TLSv1.2","155","Application Data"
"227","2018-08-23 02:20:00.608450","192.168.2.3","216.58.197.4","TCP","66","34236  >  443 [ACK] Seq=120986 Ack=2044 Win=2363 Len=0 TSval=7948272 TSecr=761375395"
"229","2018-08-23 02:20:00.624227","192.168.2.3","216.58.197.4","TCP","1434","34236  >  443 [ACK] Seq=120986 Ack=2196 Win=2363 Len=1368 TSval=7948273 TSecr=761375408 [TCP segment of a reassembled PDU]"
"230","2018-08-23 02:20:00.624582","192.168.2.3","216.58.197.4","TCP","1434","34236  >  443 [ACK] Seq=122354 Ack=2196 Win=2363 Len=1368 TSval=7948273 TSecr=761375408 [TCP segment of a reassembled PDU]"
"231","2018-08-23 02:20:00.624585","192.168.2.3","216.58.197.4","TLSv1.2","212","Application Data"
"232","2018-08-23 02:20:00.624880","192.168.2.3","216.58.197.4","TCP","1434","34236  >  443 [ACK] Seq=123868 Ack=2196 Win=2363 Len=1368 TSval=7948273 TSecr=761375408 [TCP segment of a reassembled PDU]"
"233","2018-08-23 02:20:00.624882","192.168.2.3","216.58.197.4","TLSv1.2","155","Application Data"
"237","2018-08-23 02:20:00.710724","192.168.2.3","216.58.197.4","TCP","1434","34236  >  443 [ACK] Seq=125325 Ack=2196 Win=2363 Len=1368 TSval=7948282 TSecr=761375427 [TCP segment of a reassembled PDU]"
"238","2018-08-23 02:20:00.710964","192.168.2.3","216.58.197.4","TCP","1434","34236  >  443 [ACK] Seq=126693 Ack=2196 Win=2363 Len=1368 TSval=7948282 TSecr=761375427 [TCP segment of a reassembled PDU]"
"239","2018-08-23 02:20:00.710966","192.168.2.3","216.58.197.4","TLSv1.2","212","Application Data"
"240","2018-08-23 02:20:00.711412","192.168.2.3","216.58.197.4","TCP","1434","34236  >  443 [ACK] Seq=128207 Ack=2196 Win=2363 Len=1368 TSval=7948282 TSecr=761375427 [TCP segment of a reassembled PDU]"
"241","2018-08-23 02:20:00.711414","192.168.2.3","216.58.197.4","TLSv1.2","155","Application Data"
"247","2018-08-23 02:20:00.761469","192.168.2.3","216.58.197.4","TCP","66","34236  >  443 [ACK] Seq=129664 Ack=2456 Win=2363 Len=0 TSval=7948287 TSecr=761375558"
"248","2018-08-23 02:20:00.801059","192.168.2.3","216.58.197.4","TCP","1434","34236  >  443 [ACK] Seq=129664 Ack=2456 Win=2363 Len=1368 TSval=7948291 TSecr=761375558 [TCP segment of a reassembled PDU]"
"249","2018-08-23 02:20:00.801195","192.168.2.3","216.58.197.4","TCP","1434","34236  >  443 [ACK] Seq=131032 Ack=2456 Win=2363 Len=1368 TSval=7948291 TSecr=761375558 [TCP segment of a reassembled PDU]"
"250","2018-08-23 02:20:00.801200","192.168.2.3","216.58.197.4","TLSv1.2","212","Application Data"
"251","2018-08-23 02:20:00.801413","192.168.2.3","216.58.197.4","TCP","1434","34236  >  443 [ACK] Seq=132546 Ack=2456 Win=2363 Len=1368 TSval=7948291 TSecr=761375558 [TCP segment of a reassembled PDU]"
"252","2018-08-23 02:20:00.801415","192.168.2.3","216.58.197.4","TLSv1.2","155","Application Data"
"256","2018-08-23 02:20:00.870739","192.168.2.3","216.58.197.4","TCP","1434","34236  >  443 [ACK] Seq=134003 Ack=2456 Win=2363 Len=1368 TSval=7948298 TSecr=761375603 [TCP segment of a reassembled PDU]"
"257","2018-08-23 02:20:00.871113","192.168.2.3","216.58.197.4","TCP","1434","34236  >  443 [ACK] Seq=135371 Ack=2456 Win=2363 Len=1368 TSval=7948298 TSecr=761375603 [TCP segment of a reassembled PDU]"
"258","2018-08-23 02:20:00.871114","192.168.2.3","216.58.197.4","TLSv1.2","212","Application Data"
"259","2018-08-23 02:20:00.871115","192.168.2.3","216.58.197.4","TCP","1434","34236  >  443 [ACK] Seq=136885 Ack=2456 Win=2363 Len=1368 TSval=7948298 TSecr=761375603 [TCP segment of a reassembled PDU]"
"260","2018-08-23 02:20:00.871184","192.168.2.3","216.58.197.4","TLSv1.2","155","Application Data"
"263","2018-08-23 02:20:00.970298","192.168.2.3","216.58.197.4","TCP","1434","34236  >  443 [ACK] Seq=138342 Ack=2456 Win=2363 Len=1368 TSval=7948308 TSecr=761375673 [TCP segment of a reassembled PDU]"
"264","2018-08-23 02:20:00.970483","192.168.2.3","216.58.197.4","TCP","1434","34236  >  443 [ACK] Seq=139710 Ack=2456 Win=2363 Len=1368 TSval=7948308 TSecr=761375673 [TCP segment of a reassembled PDU]"
"265","2018-08-23 02:20:00.970486","192.168.2.3","216.58.197.4","TLSv1.2","212","Application Data"
"266","2018-08-23 02:20:00.970646","192.168.2.3","216.58.197.4","TCP","1434","34236  >  443 [ACK] Seq=141224 Ack=2456 Win=2363 Len=1368 TSval=7948308 TSecr=761375673 [TCP segment of a reassembled PDU]"
"267","2018-08-23 02:20:00.970648","192.168.2.3","216.58.197.4","TLSv1.2","155","Application Data"
"271","2018-08-23 02:20:01.062377","192.168.2.3","216.58.197.4","TCP","1434","34236  >  443 [ACK] Seq=142681 Ack=2456 Win=2363 Len=1368 TSval=7948317 TSecr=761375773 [TCP segment of a reassembled PDU]"
"272","2018-08-23 02:20:01.064920","192.168.2.3","216.58.197.4","TCP","1434","34236  >  443 [ACK] Seq=144049 Ack=2456 Win=2363 Len=1368 TSval=7948317 TSecr=761375773 [TCP segment of a reassembled PDU]"
"273","2018-08-23 02:20:01.064923","192.168.2.3","216.58.197.4","TLSv1.2","212","Application Data"
"274","2018-08-23 02:20:01.065099","192.168.2.3","216.58.197.4","TCP","1434","34236  >  443 [ACK] Seq=145563 Ack=2456 Win=2363 Len=1368 TSval=7948317 TSecr=761375773 [TCP segment of a reassembled PDU]"
"275","2018-08-23 02:20:01.065103","192.168.2.3","216.58.197.4","TLSv1.2","155","Application Data"
"279","2018-08-23 02:20:01.167967","192.168.2.3","216.58.197.4","TCP","1434","34236  >  443 [ACK] Seq=147020 Ack=2456 Win=2363 Len=1368 TSval=7948328 TSecr=761375867 [TCP segment of a reassembled PDU]"
"280","2018-08-23 02:20:01.168177","192.168.2.3","216.58.197.4","TCP","1434","34236  >  443 [ACK] Seq=148388 Ack=2456 Win=2363 Len=1368 TSval=7948328 TSecr=761375867 [TCP segment of a reassembled PDU]"
"281","2018-08-23 02:20:01.168180","192.168.2.3","216.58.197.4","TLSv1.2","212","Application Data"
"282","2018-08-23 02:20:01.168181","192.168.2.3","216.58.197.4","TCP","1434","34236  >  443 [ACK] Seq=149902 Ack=2456 Win=2363 Len=1368 TSval=7948328 TSecr=761375867 [TCP segment of a reassembled PDU]"
"283","2018-08-23 02:20:01.168371","192.168.2.3","216.58.197.4","TLSv1.2","155","Application Data"
"289","2018-08-23 02:20:01.216895","192.168.2.3","216.58.197.4","TCP","66","34236  >  443 [ACK] Seq=151359 Ack=2836 Win=2363 Len=0 TSval=7948333 TSecr=761376011"
"290","2018-08-23 02:20:01.254669","192.168.2.3","216.58.197.4","TCP","1434","34236  >  443 [ACK] Seq=151359 Ack=2836 Win=2363 Len=1368 TSval=7948337 TSecr=761376011 [TCP segment of a reassembled PDU]"
"291","2018-08-23 02:20:01.254674","192.168.2.3","216.58.197.4","TCP","1434","34236  >  443 [ACK] Seq=152727 Ack=2836 Win=2363 Len=1368 TSval=7948337 TSecr=761376011 [TCP segment of a reassembled PDU]"
"292","2018-08-23 02:20:01.254675","192.168.2.3","216.58.197.4","TLSv1.2","212","Application Data"
"293","2018-08-23 02:20:01.256761","192.168.2.3","216.58.197.4","TCP","1434","34236  >  443 [ACK] Seq=154241 Ack=2836 Win=2363 Len=1368 TSval=7948337 TSecr=761376011 [TCP segment of a reassembled PDU]"
"294","2018-08-23 02:20:01.256764","192.168.2.3","216.58.197.4","TLSv1.2","155","Application Data"
"300","2018-08-23 02:20:01.310109","192.168.2.3","216.58.197.4","TCP","66","34236  >  443 [ACK] Seq=155698 Ack=3127 Win=2363 Len=0 TSval=7948342 TSecr=761376104"
"301","2018-08-23 02:20:01.357200","192.168.2.3","216.58.197.4","TCP","1434","34236  >  443 [ACK] Seq=155698 Ack=3127 Win=2363 Len=1368 TSval=7948346 TSecr=761376104 [TCP segment of a reassembled PDU]"
"302","2018-08-23 02:20:01.357206","192.168.2.3","216.58.197.4","TCP","1434","34236  >  443 [ACK] Seq=157066 Ack=3127 Win=2363 Len=1368 TSval=7948346 TSecr=761376104 [TCP segment of a reassembled PDU]"
"303","2018-08-23 02:20:01.357292","192.168.2.3","216.58.197.4","TLSv1.2","212","Application Data"
"304","2018-08-23 02:20:01.357560","192.168.2.3","216.58.197.4","TCP","1434","34236  >  443 [ACK] Seq=158580 Ack=3127 Win=2363 Len=1368 TSval=7948346 TSecr=761376104 [TCP segment of a reassembled PDU]"
"305","2018-08-23 02:20:01.357563","192.168.2.3","216.58.197.4","TLSv1.2","155","Application Data"
"309","2018-08-23 02:20:01.457062","192.168.2.3","216.58.197.4","TCP","1434","34236  >  443 [ACK] Seq=160037 Ack=3127 Win=2363 Len=1368 TSval=7948356 TSecr=761376160 [TCP segment of a reassembled PDU]"
"310","2018-08-23 02:20:01.457072","192.168.2.3","216.58.197.4","TCP","1434","34236  >  443 [ACK] Seq=161405 Ack=3127 Win=2363 Len=1368 TSval=7948357 TSecr=761376160 [TCP segment of a reassembled PDU]"
"311","2018-08-23 02:20:01.457073","192.168.2.3","216.58.197.4","TLSv1.2","212","Application Data"
"312","2018-08-23 02:20:01.457407","192.168.2.3","216.58.197.4","TCP","1434","34236  >  443 [ACK] Seq=162919 Ack=3127 Win=2363 Len=1368 TSval=7948357 TSecr=761376160 [TCP segment of a reassembled PDU]"
"313","2018-08-23 02:20:01.457413","192.168.2.3","216.58.197.4","TLSv1.2","155","Application Data"
"319","2018-08-23 02:20:01.514580","192.168.2.3","216.58.197.4","TCP","66","34236  >  443 [ACK] Seq=164376 Ack=3504 Win=2363 Len=0 TSval=7948363 TSecr=761376308"
"320","2018-08-23 02:20:01.542782","192.168.2.3","216.58.197.4","TCP","1434","34236  >  443 [ACK] Seq=164376 Ack=3504 Win=2363 Len=1368 TSval=7948365 TSecr=761376308 [TCP segment of a reassembled PDU]"
"321","2018-08-23 02:20:01.542938","192.168.2.3","216.58.197.4","TCP","1434","34236  >  443 [ACK] Seq=165744 Ack=3504 Win=2363 Len=1368 TSval=7948365 TSecr=761376308 [TCP segment of a reassembled PDU]"
"322","2018-08-23 02:20:01.542942","192.168.2.3","216.58.197.4","TLSv1.2","212","Application Data"
"323","2018-08-23 02:20:01.543280","192.168.2.3","216.58.197.4","TCP","1434","34236  >  443 [ACK] Seq=167258 Ack=3504 Win=2363 Len=1368 TSval=7948365 TSecr=761376308 [TCP segment of a reassembled PDU]"
"324","2018-08-23 02:20:01.543283","192.168.2.3","216.58.197.4","TLSv1.2","155","Application Data"
"331","2018-08-23 02:20:01.598936","192.168.2.3","216.58.197.4","TCP","66","34236  >  443 [ACK] Seq=168715 Ack=3777 Win=2363 Len=0 TSval=7948371 TSecr=761376395"
"333","2018-08-23 02:20:01.615856","192.168.2.3","216.58.197.4","TCP","66","34236  >  443 [ACK] Seq=168715 Ack=4144 Win=2363 Len=0 TSval=7948373 TSecr=761376395"
"334","2018-08-23 02:20:01.632632","192.168.2.3","216.58.197.4","TCP","1434","34236  >  443 [ACK] Seq=168715 Ack=4144 Win=2363 Len=1368 TSval=7948374 TSecr=761376395 [TCP segment of a reassembled PDU]"
"335","2018-08-23 02:20:01.633037","192.168.2.3","216.58.197.4","TCP","1434","34236  >  443 [ACK] Seq=170083 Ack=4144 Win=2363 Len=1368 TSval=7948374 TSecr=761376395 [TCP segment of a reassembled PDU]"
"336","2018-08-23 02:20:01.633042","192.168.2.3","216.58.197.4","TLSv1.2","212","Application Data"
"337","2018-08-23 02:20:01.633497","192.168.2.3","216.58.197.4","TCP","1434","34236  >  443 [ACK] Seq=171597 Ack=4144 Win=2363 Len=1368 TSval=7948374 TSecr=761376395 [TCP segment of a reassembled PDU]"
"338","2018-08-23 02:20:01.636964","192.168.2.3","216.58.197.4","TLSv1.2","155","Application Data"
"344","2018-08-23 02:20:01.694425","192.168.2.3","216.58.197.4","TCP","66","34236  >  443 [ACK] Seq=173054 Ack=4484 Win=2363 Len=0 TSval=7948381 TSecr=761376490"
"345","2018-08-23 02:20:01.728550","192.168.2.3","216.58.197.4","TCP","1434","34236  >  443 [ACK] Seq=173054 Ack=4484 Win=2363 Len=1368 TSval=7948384 TSecr=761376490 [TCP segment of a reassembled PDU]"
"346","2018-08-23 02:20:01.728888","192.168.2.3","216.58.197.4","TCP","1434","34236  >  443 [ACK] Seq=174422 Ack=4484 Win=2363 Len=1368 TSval=7948384 TSecr=761376490 [TCP segment of a reassembled PDU]"
"347","2018-08-23 02:20:01.728891","192.168.2.3","216.58.197.4","TLSv1.2","212","Application Data"
"348","2018-08-23 02:20:01.729298","192.168.2.3","216.58.197.4","TCP","1434","34236  >  443 [ACK] Seq=175936 Ack=4484 Win=2363 Len=1368 TSval=7948384 TSecr=761376490 [TCP segment of a reassembled PDU]"
"349","2018-08-23 02:20:01.729300","192.168.2.3","216.58.197.4","TLSv1.2","155","Application Data"
"353","2018-08-23 02:20:01.809245","192.168.2.3","216.58.197.4","TCP","1434","34236  >  443 [ACK] Seq=177393 Ack=4484 Win=2363 Len=1368 TSval=7948392 TSecr=761376531 [TCP segment of a reassembled PDU]"
"354","2018-08-23 02:20:01.809522","192.168.2.3","216.58.197.4","TCP","1434","34236  >  443 [ACK] Seq=178761 Ack=4484 Win=2363 Len=1368 TSval=7948392 TSecr=761376531 [TCP segment of a reassembled PDU]"
"355","2018-08-23 02:20:01.809525","192.168.2.3","216.58.197.4","TLSv1.2","212","Application Data"
"356","2018-08-23 02:20:01.809912","192.168.2.3","216.58.197.4","TCP","1434","34236  >  443 [ACK] Seq=180275 Ack=4484 Win=2363 Len=1368 TSval=7948392 TSecr=761376531 [TCP segment of a reassembled PDU]"
"357","2018-08-23 02:20:01.809916","192.168.2.3","216.58.197.4","TLSv1.2","155","Application Data"
"363","2018-08-23 02:20:01.861220","192.168.2.3","216.58.197.4","TCP","66","34236  >  443 [ACK] Seq=181732 Ack=4944 Win=2363 Len=0 TSval=7948397 TSecr=761376654"
"366","2018-08-23 02:20:01.867470","192.168.2.3","216.58.197.4","TCP","66","34236  >  443 [ACK] Seq=181732 Ack=5353 Win=2363 Len=0 TSval=7948398 TSecr=761376663"
"367","2018-08-23 02:20:01.901901","192.168.2.3","216.58.197.4","TCP","1434","34236  >  443 [ACK] Seq=181732 Ack=5353 Win=2363 Len=1368 TSval=7948401 TSecr=761376663 [TCP segment of a reassembled PDU]"
"368","2018-08-23 02:20:01.902199","192.168.2.3","216.58.197.4","TCP","1434","34236  >  443 [ACK] Seq=183100 Ack=5353 Win=2363 Len=1368 TSval=7948401 TSecr=761376663 [TCP segment of a reassembled PDU]"
"369","2018-08-23 02:20:01.902201","192.168.2.3","216.58.197.4","TLSv1.2","212","Application Data"
"370","2018-08-23 02:20:01.902539","192.168.2.3","216.58.197.4","TCP","1434","34236  >  443 [ACK] Seq=184614 Ack=5353 Win=2363 Len=1368 TSval=7948401 TSecr=761376663 [TCP segment of a reassembled PDU]"
"371","2018-08-23 02:20:01.902542","192.168.2.3","216.58.197.4","TLSv1.2","155","Application Data"
"375","2018-08-23 02:20:01.997766","192.168.2.3","216.58.197.4","TCP","1434","34236  >  443 [ACK] Seq=186071 Ack=5353 Win=2363 Len=1368 TSval=7948411 TSecr=761376705 [TCP segment of a reassembled PDU]"
"376","2018-08-23 02:20:01.998204","192.168.2.3","216.58.197.4","TCP","1434","34236  >  443 [ACK] Seq=187439 Ack=5353 Win=2363 Len=1368 TSval=7948411 TSecr=761376705 [TCP segment of a reassembled PDU]"
"377","2018-08-23 02:20:01.998208","192.168.2.3","216.58.197.4","TLSv1.2","212","Application Data"
"378","2018-08-23 02:20:01.998209","192.168.2.3","216.58.197.4","TCP","1434","34236  >  443 [ACK] Seq=188953 Ack=5353 Win=2363 Len=1368 TSval=7948411 TSecr=761376705 [TCP segment of a reassembled PDU]"
"379","2018-08-23 02:20:01.998319","192.168.2.3","216.58.197.4","TLSv1.2","155","Application Data"
"385","2018-08-23 02:20:02.046010","192.168.2.3","216.58.197.4","TCP","66","34236  >  443 [ACK] Seq=190410 Ack=5704 Win=2363 Len=0 TSval=7948416 TSecr=761376842"
"387","2018-08-23 02:20:02.097915","192.168.2.3","216.58.197.4","TCP","1434","34236  >  443 [ACK] Seq=190410 Ack=5704 Win=2363 Len=1368 TSval=7948421 TSecr=761376842 [TCP segment of a reassembled PDU]"
"388","2018-08-23 02:20:02.098305","192.168.2.3","216.58.197.4","TCP","1434","34236  >  443 [ACK] Seq=191778 Ack=5704 Win=2363 Len=1368 TSval=7948421 TSecr=761376842 [TCP segment of a reassembled PDU]"
"389","2018-08-23 02:20:02.098307","192.168.2.3","216.58.197.4","TLSv1.2","212","Application Data"
"390","2018-08-23 02:20:02.098751","192.168.2.3","216.58.197.4","TLSv1.2","1420","Application Data"
"394","2018-08-23 02:20:02.133074","192.168.2.3","216.58.197.4","TCP","66","34236  >  443 [ACK] Seq=194646 Ack=5769 Win=2363 Len=0 TSval=7948425 TSecr=761376895"
"395","2018-08-23 02:20:02.191835","192.168.2.3","216.58.197.4","TCP","1434","34236  >  443 [ACK] Seq=194646 Ack=5769 Win=2363 Len=1368 TSval=7948430 TSecr=761376895 [TCP segment of a reassembled PDU]"
"396","2018-08-23 02:20:02.192258","192.168.2.3","216.58.197.4","TCP","1434","34236  >  443 [ACK] Seq=196014 Ack=5769 Win=2363 Len=1368 TSval=7948430 TSecr=761376895 [TCP segment of a reassembled PDU]"
"397","2018-08-23 02:20:02.192262","192.168.2.3","216.58.197.4","TLSv1.2","212","Application Data"
"398","2018-08-23 02:20:02.192263","192.168.2.3","216.58.197.4","TCP","1434","34236  >  443 [ACK] Seq=197528 Ack=5769 Win=2363 Len=1368 TSval=7948430 TSecr=761376895 [TCP segment of a reassembled PDU]"
"399","2018-08-23 02:20:02.192263","192.168.2.3","216.58.197.4","TLSv1.2","155","Application Data"
"403","2018-08-23 02:20:02.289900","192.168.2.3","216.58.197.4","TCP","1434","34236  >  443 [ACK] Seq=198985 Ack=5769 Win=2363 Len=1368 TSval=7948440 TSecr=761376994 [TCP segment of a reassembled PDU]"
"404","2018-08-23 02:20:02.289904","192.168.2.3","216.58.197.4","TCP","1434","34236  >  443 [ACK] Seq=200353 Ack=5769 Win=2363 Len=1368 TSval=7948440 TSecr=761376994 [TCP segment of a reassembled PDU]"
"405","2018-08-23 02:20:02.289906","192.168.2.3","216.58.197.4","TLSv1.2","212","Application Data"
"406","2018-08-23 02:20:02.290261","192.168.2.3","216.58.197.4","TCP","1434","34236  >  443 [ACK] Seq=201867 Ack=5769 Win=2363 Len=1368 TSval=7948440 TSecr=761376994 [TCP segment of a reassembled PDU]"
"407","2018-08-23 02:20:02.290264","192.168.2.3","216.58.197.4","TLSv1.2","155","Application Data"
"411","2018-08-23 02:20:02.300162","192.168.2.3","203.211.199.120","TLSv1.2","789","Application Data"
"417","2018-08-23 02:20:02.328638","192.168.2.3","203.211.199.120","TCP","66","52019  >  443 [ACK] Seq=1447 Ack=6679 Win=982 Len=0 TSval=7948444 TSecr=1193245318"
"418","2018-08-23 02:20:02.328647","192.168.2.3","203.211.199.120","TCP","66","52019  >  443 [ACK] Seq=1447 Ack=8127 Win=982 Len=0 TSval=7948444 TSecr=1193245318"
"419","2018-08-23 02:20:02.331735","192.168.2.3","203.211.199.120","TCP","66","52019  >  443 [ACK] Seq=1447 Ack=10479 Win=982 Len=0 TSval=7948444 TSecr=1193245318"
"420","2018-08-23 02:20:02.333367","192.168.2.3","203.211.199.120","TCP","66","52019  >  443 [FIN, ACK] Seq=1447 Ack=10479 Win=998 Len=0 TSval=7948445 TSecr=1193245318"
"422","2018-08-23 02:20:02.343157","192.168.2.3","203.211.199.120","TCP","66","52019  >  443 [ACK] Seq=1448 Ack=10480 Win=998 Len=0 TSval=7948446 TSecr=1193245318"
"424","2018-08-23 02:20:02.403514","192.168.2.3","216.58.197.4","TCP","1434","34236  >  443 [ACK] Seq=203324 Ack=5769 Win=2363 Len=1368 TSval=7948451 TSecr=761377092 [TCP segment of a reassembled PDU]"
"425","2018-08-23 02:20:02.403865","192.168.2.3","216.58.197.4","TCP","1434","34236  >  443 [ACK] Seq=204692 Ack=5769 Win=2363 Len=1368 TSval=7948451 TSecr=761377092 [TCP segment of a reassembled PDU]"
"426","2018-08-23 02:20:02.403869","192.168.2.3","216.58.197.4","TLSv1.2","212","Application Data"
