"No.","Time","Source","Destination","Protocol","Length","Info"
"7","2018-08-23 02:50:07.041544","192.168.2.3","203.211.199.120","TCP","66","52086  >  443 [ACK] Seq=1 Ack=25 Win=661 Len=0 TSval=8128914 TSecr=1194763221"
"8","2018-08-23 02:50:07.181052","192.168.2.3","216.58.197.14","TCP","66","41160  >  443 [ACK] Seq=1 Ack=1 Win=661 Len=0 TSval=8128928 TSecr=4137764227"
"10","2018-08-23 02:50:07.196787","192.168.2.3","74.125.204.188","TCP","92","33038  >  5228 [PSH, ACK] Seq=1 Ack=1 Win=406 Len=26 TSval=8128929 TSecr=3816900730"
"12","2018-08-23 02:50:07.240034","192.168.2.3","74.125.204.188","TCP","66","33038  >  5228 [ACK] Seq=27 Ack=27 Win=406 Len=0 TSval=8128933 TSecr=3816930651"
"13","2018-08-23 02:50:07.461106","192.168.2.3","216.58.197.14","TCP","66","41231  >  443 [ACK] Seq=1 Ack=1 Win=661 Len=0 TSval=8128956 TSecr=3122753419"
"15","2018-08-23 02:50:07.821043","192.168.2.3","216.58.197.4","TCP","66","34325  >  443 [ACK] Seq=1 Ack=1 Win=661 Len=0 TSval=8128992 TSecr=600592771"
"17","2018-08-23 02:50:08.343953","192.168.2.3","216.58.197.4","TLSv1.2","156","[TCP Previous segment not captured] , Application Data"
"18","2018-08-23 02:50:08.343957","192.168.2.3","216.58.197.4","TLSv1.2","104","Application Data"
"19","2018-08-23 02:50:08.343958","192.168.2.3","216.58.197.4","TLSv1.2","158","Application Data"
"24","2018-08-23 02:50:08.365274","192.168.2.3","216.58.197.4","TCP","1434","34325  >  443 [ACK] Seq=222 Ack=39 Win=661 Len=1368 TSval=8129045 TSecr=600638362 [TCP segment of a reassembled PDU]"
"25","2018-08-23 02:50:08.365543","192.168.2.3","216.58.197.4","TCP","1434","34325  >  443 [ACK] Seq=1590 Ack=39 Win=661 Len=1368 TSval=8129045 TSecr=600638362 [TCP segment of a reassembled PDU]"
"26","2018-08-23 02:50:08.365546","192.168.2.3","216.58.197.4","TLSv1.2","212","Application Data"
"27","2018-08-23 02:50:08.365683","192.168.2.3","216.58.197.4","TCP","1434","34325  >  443 [ACK] Seq=3104 Ack=39 Win=661 Len=1368 TSval=8129045 TSecr=600638362 [TCP segment of a reassembled PDU]"
"28","2018-08-23 02:50:08.365687","192.168.2.3","216.58.197.4","TLSv1.2","385","Application Data"
"29","2018-08-23 02:50:08.365923","192.168.2.3","216.58.197.4","TCP","1434","34325  >  443 [ACK] Seq=4791 Ack=39 Win=661 Len=1368 TSval=8129046 TSecr=600638362 [TCP segment of a reassembled PDU]"
"30","2018-08-23 02:50:08.365925","192.168.2.3","216.58.197.4","TCP","1434","34325  >  443 [ACK] Seq=6159 Ack=39 Win=661 Len=1368 TSval=8129046 TSecr=600638362 [TCP segment of a reassembled PDU]"
"31","2018-08-23 02:50:08.366145","192.168.2.3","216.58.197.4","TLSv1.2","212","Application Data"
"32","2018-08-23 02:50:08.366147","192.168.2.3","216.58.197.4","TCP","1434","34325  >  443 [ACK] Seq=7673 Ack=39 Win=661 Len=1368 TSval=8129046 TSecr=600638362 [TCP segment of a reassembled PDU]"
"33","2018-08-23 02:50:08.366256","192.168.2.3","216.58.197.4","TLSv1.2","156","Application Data"
"39","2018-08-23 02:50:08.371505","192.168.2.3","216.58.197.4","TCP","1434","34325  >  443 [ACK] Seq=9131 Ack=39 Win=661 Len=1368 TSval=8129046 TSecr=600638383 [TCP segment of a reassembled PDU]"
"40","2018-08-23 02:50:08.371800","192.168.2.3","216.58.197.4","TCP","1434","34325  >  443 [ACK] Seq=10499 Ack=39 Win=661 Len=1368 TSval=8129046 TSecr=600638383 [TCP segment of a reassembled PDU]"
"41","2018-08-23 02:50:08.371977","192.168.2.3","216.58.197.4","TLSv1.2","1434","Application Data [TCP segment of a reassembled PDU]"
"42","2018-08-23 02:50:08.373832","192.168.2.3","216.58.197.4","TLSv1.2","1434","Application Data [TCP segment of a reassembled PDU]"
"43","2018-08-23 02:50:08.374956","192.168.2.3","216.58.197.4","TCP","1434","34325  >  443 [ACK] Seq=14603 Ack=39 Win=661 Len=1368 TSval=8129047 TSecr=600638383 [TCP segment of a reassembled PDU]"
"44","2018-08-23 02:50:08.375271","192.168.2.3","216.58.197.4","TLSv1.2","1434","Application Data [TCP segment of a reassembled PDU]"
"45","2018-08-23 02:50:08.375275","192.168.2.3","216.58.197.4","TLSv1.2","1434","Application Data [TCP segment of a reassembled PDU]"
"46","2018-08-23 02:50:08.375599","192.168.2.3","216.58.197.4","TCP","1434","34325  >  443 [ACK] Seq=18707 Ack=39 Win=661 Len=1368 TSval=8129047 TSecr=600638383 [TCP segment of a reassembled PDU]"
"47","2018-08-23 02:50:08.375601","192.168.2.3","216.58.197.4","TLSv1.2","1434","Application Data [TCP segment of a reassembled PDU]"
"49","2018-08-23 02:50:08.375920","192.168.2.3","216.58.197.4","TLSv1.2","1434","Application Data [TCP segment of a reassembled PDU]"
"50","2018-08-23 02:50:08.376054","192.168.2.3","216.58.197.4","TCP","1434","34325  >  443 [ACK] Seq=22811 Ack=39 Win=661 Len=1368 TSval=8129047 TSecr=600638383 [TCP segment of a reassembled PDU]"
"51","2018-08-23 02:50:08.376279","192.168.2.3","216.58.197.4","TLSv1.2","1434","Application Data [TCP segment of a reassembled PDU]"
"55","2018-08-23 02:50:08.380109","192.168.2.3","216.58.197.4","TLSv1.2","1434","Application Data [TCP segment of a reassembled PDU]"
"56","2018-08-23 02:50:08.380112","192.168.2.3","216.58.197.4","TCP","1434","34325  >  443 [ACK] Seq=26915 Ack=39 Win=661 Len=1368 TSval=8129047 TSecr=600638383 [TCP segment of a reassembled PDU]"
"59","2018-08-23 02:50:08.380489","192.168.2.3","216.58.197.4","TLSv1.2","1434","Application Data [TCP segment of a reassembled PDU]"
"60","2018-08-23 02:50:08.381461","192.168.2.3","216.58.197.4","TLSv1.2","1434","Application Data [TCP segment of a reassembled PDU]"
"61","2018-08-23 02:50:08.381463","192.168.2.3","216.58.197.4","TCP","1434","34325  >  443 [ACK] Seq=31019 Ack=39 Win=661 Len=1368 TSval=8129047 TSecr=600638389 [TCP segment of a reassembled PDU]"
"62","2018-08-23 02:50:08.381715","192.168.2.3","216.58.197.4","TLSv1.2","1434","Application Data [TCP segment of a reassembled PDU]"
"63","2018-08-23 02:50:08.381788","192.168.2.3","216.58.197.4","TCP","1434","34325  >  443 [ACK] Seq=33755 Ack=39 Win=661 Len=1368 TSval=8129047 TSecr=600638391 [TCP segment of a reassembled PDU]"
"64","2018-08-23 02:50:08.382143","192.168.2.3","216.58.197.4","TLSv1.2","1434","Application Data [TCP segment of a reassembled PDU]"
"65","2018-08-23 02:50:08.382580","192.168.2.3","216.58.197.4","TCP","1434","34325  >  443 [ACK] Seq=36491 Ack=39 Win=661 Len=1368 TSval=8129047 TSecr=600638391 [TCP segment of a reassembled PDU]"
"70","2018-08-23 02:50:08.387711","192.168.2.3","216.58.197.4","TLSv1.2","1434","Application Data [TCP segment of a reassembled PDU]"
"71","2018-08-23 02:50:08.387983","192.168.2.3","216.58.197.4","TLSv1.2","1434","Application Data [TCP segment of a reassembled PDU]"
"72","2018-08-23 02:50:08.388202","192.168.2.3","216.58.197.4","TCP","1434","34325  >  443 [ACK] Seq=40595 Ack=39 Win=661 Len=1368 TSval=8129048 TSecr=600638392 [TCP segment of a reassembled PDU]"
"73","2018-08-23 02:50:08.388859","192.168.2.3","216.58.197.4","TLSv1.2","1434","Application Data [TCP segment of a reassembled PDU]"
"74","2018-08-23 02:50:08.389358","192.168.2.3","216.58.197.4","TLSv1.2","1434","Application Data [TCP segment of a reassembled PDU]"
"75","2018-08-23 02:50:08.389361","192.168.2.3","216.58.197.4","TCP","1434","34325  >  443 [ACK] Seq=44699 Ack=39 Win=661 Len=1368 TSval=8129048 TSecr=600638393 [TCP segment of a reassembled PDU]"
"76","2018-08-23 02:50:08.389419","192.168.2.3","216.58.197.4","TLSv1.2","1434","Application Data [TCP segment of a reassembled PDU]"
"77","2018-08-23 02:50:08.389739","192.168.2.3","216.58.197.4","TLSv1.2","1434","Application Data [TCP segment of a reassembled PDU]"
"78","2018-08-23 02:50:08.389743","192.168.2.3","216.58.197.4","TCP","1434","34325  >  443 [ACK] Seq=48803 Ack=39 Win=661 Len=1368 TSval=8129048 TSecr=600638393 [TCP segment of a reassembled PDU]"
"79","2018-08-23 02:50:08.390018","192.168.2.3","216.58.197.4","TLSv1.2","1434","Application Data [TCP segment of a reassembled PDU]"
"80","2018-08-23 02:50:08.390263","192.168.2.3","216.58.197.4","TLSv1.2","1434","Application Data [TCP segment of a reassembled PDU]"
"81","2018-08-23 02:50:08.390625","192.168.2.3","216.58.197.4","TCP","1434","34325  >  443 [ACK] Seq=52907 Ack=39 Win=661 Len=1368 TSval=8129048 TSecr=600638397 [TCP segment of a reassembled PDU]"
"82","2018-08-23 02:50:08.390628","192.168.2.3","216.58.197.4","TLSv1.2","1434","Application Data [TCP segment of a reassembled PDU]"
"83","2018-08-23 02:50:08.390807","192.168.2.3","216.58.197.4","TLSv1.2","1434","Application Data [TCP segment of a reassembled PDU]"
"84","2018-08-23 02:50:08.390945","192.168.2.3","216.58.197.4","TCP","1434","34325  >  443 [ACK] Seq=57011 Ack=39 Win=661 Len=1368 TSval=8129048 TSecr=600638399 [TCP segment of a reassembled PDU]"
"85","2018-08-23 02:50:08.391172","192.168.2.3","216.58.197.4","TLSv1.2","497","Application Data"
"86","2018-08-23 02:50:08.391173","192.168.2.3","216.58.197.4","TCP","1434","34325  >  443 [ACK] Seq=58810 Ack=39 Win=661 Len=1368 TSval=8129048 TSecr=600638399 [TCP segment of a reassembled PDU]"
"87","2018-08-23 02:50:08.391309","192.168.2.3","216.58.197.4","TLSv1.2","155","Application Data"
"97","2018-08-23 02:50:08.399068","192.168.2.3","216.58.197.4","TCP","1434","34325  >  443 [ACK] Seq=60267 Ack=39 Win=661 Len=1368 TSval=8129049 TSecr=600638408 [TCP segment of a reassembled PDU]"
"98","2018-08-23 02:50:08.399482","192.168.2.3","216.58.197.4","TCP","1434","34325  >  443 [ACK] Seq=61635 Ack=39 Win=661 Len=1368 TSval=8129049 TSecr=600638408 [TCP segment of a reassembled PDU]"
"99","2018-08-23 02:50:08.399485","192.168.2.3","216.58.197.4","TLSv1.2","212","Application Data"
"100","2018-08-23 02:50:08.399486","192.168.2.3","216.58.197.4","TCP","1434","34325  >  443 [ACK] Seq=63149 Ack=39 Win=661 Len=1368 TSval=8129049 TSecr=600638408 [TCP segment of a reassembled PDU]"
"101","2018-08-23 02:50:08.399587","192.168.2.3","216.58.197.4","TLSv1.2","155","Application Data"
"105","2018-08-23 02:50:08.514474","192.168.2.3","216.58.197.4","TCP","1434","34325  >  443 [ACK] Seq=64606 Ack=39 Win=661 Len=1368 TSval=8129061 TSecr=600638417 [TCP segment of a reassembled PDU]"
"106","2018-08-23 02:50:08.514804","192.168.2.3","216.58.197.4","TCP","1434","34325  >  443 [ACK] Seq=65974 Ack=39 Win=661 Len=1368 TSval=8129061 TSecr=600638417 [TCP segment of a reassembled PDU]"
"107","2018-08-23 02:50:08.514807","192.168.2.3","216.58.197.4","TLSv1.2","212","Application Data"
"108","2018-08-23 02:50:08.515292","192.168.2.3","216.58.197.4","TLSv1.2","1398","Application Data"
"111","2018-08-23 02:50:08.628515","192.168.2.3","216.58.197.4","TCP","1434","34325  >  443 [ACK] Seq=68820 Ack=39 Win=661 Len=1368 TSval=8129072 TSecr=600638533 [TCP segment of a reassembled PDU]"
"112","2018-08-23 02:50:08.628520","192.168.2.3","216.58.197.4","TCP","1434","34325  >  443 [ACK] Seq=70188 Ack=39 Win=661 Len=1368 TSval=8129072 TSecr=600638533 [TCP segment of a reassembled PDU]"
"113","2018-08-23 02:50:08.628521","192.168.2.3","216.58.197.4","TLSv1.2","212","Application Data"
"114","2018-08-23 02:50:08.628521","192.168.2.3","216.58.197.4","TCP","1434","34325  >  443 [ACK] Seq=71702 Ack=39 Win=661 Len=1368 TSval=8129072 TSecr=600638533 [TCP segment of a reassembled PDU]"
"115","2018-08-23 02:50:08.628523","192.168.2.3","216.58.197.4","TLSv1.2","155","Application Data"
"122","2018-08-23 02:50:08.684045","192.168.2.3","216.58.197.4","TCP","66","34325  >  443 [ACK] Seq=73159 Ack=382 Win=661 Len=0 TSval=8129078 TSecr=600638696"
"124","2018-08-23 02:50:08.702251","192.168.2.3","216.58.197.4","TCP","66","34325  >  443 [ACK] Seq=73159 Ack=730 Win=661 Len=0 TSval=8129079 TSecr=600638696"
"125","2018-08-23 02:50:08.740332","192.168.2.3","216.58.197.4","TCP","1434","34325  >  443 [ACK] Seq=73159 Ack=730 Win=661 Len=1368 TSval=8129083 TSecr=600638696 [TCP segment of a reassembled PDU]"
"126","2018-08-23 02:50:08.740789","192.168.2.3","216.58.197.4","TCP","1434","34325  >  443 [ACK] Seq=74527 Ack=730 Win=661 Len=1368 TSval=8129083 TSecr=600638696 [TCP segment of a reassembled PDU]"
"127","2018-08-23 02:50:08.740792","192.168.2.3","216.58.197.4","TLSv1.2","212","Application Data"
"128","2018-08-23 02:50:08.741331","192.168.2.3","216.58.197.4","TCP","1434","34325  >  443 [ACK] Seq=76041 Ack=730 Win=661 Len=1368 TSval=8129083 TSecr=600638696 [TCP segment of a reassembled PDU]"
"129","2018-08-23 02:50:08.741333","192.168.2.3","216.58.197.4","TLSv1.2","155","Application Data"
"134","2018-08-23 02:50:08.841325","192.168.2.3","216.58.197.4","TCP","66","34325  >  443 [ACK] Seq=77498 Ack=999 Win=661 Len=0 TSval=8129094 TSecr=600638810"
"135","2018-08-23 02:50:08.847473","192.168.2.3","216.58.197.4","TCP","1434","34325  >  443 [ACK] Seq=77498 Ack=999 Win=661 Len=1368 TSval=8129094 TSecr=600638810 [TCP segment of a reassembled PDU]"
"136","2018-08-23 02:50:08.847875","192.168.2.3","216.58.197.4","TCP","1434","34325  >  443 [ACK] Seq=78866 Ack=999 Win=661 Len=1368 TSval=8129094 TSecr=600638810 [TCP segment of a reassembled PDU]"
"137","2018-08-23 02:50:08.847878","192.168.2.3","216.58.197.4","TLSv1.2","212","Application Data"
"138","2018-08-23 02:50:08.848332","192.168.2.3","216.58.197.4","TCP","1434","34325  >  443 [ACK] Seq=80380 Ack=999 Win=661 Len=1368 TSval=8129094 TSecr=600638810 [TCP segment of a reassembled PDU]"
"139","2018-08-23 02:50:08.848336","192.168.2.3","216.58.197.4","TLSv1.2","155","Application Data"
"144","2018-08-23 02:50:08.953592","192.168.2.3","216.58.197.4","TCP","66","34325  >  443 [ACK] Seq=81837 Ack=1216 Win=661 Len=0 TSval=8129105 TSecr=600638963"
"145","2018-08-23 02:50:08.962461","192.168.2.3","216.58.197.4","TCP","1434","34325  >  443 [ACK] Seq=81837 Ack=1216 Win=661 Len=1368 TSval=8129106 TSecr=600638963 [TCP segment of a reassembled PDU]"
"146","2018-08-23 02:50:08.962774","192.168.2.3","216.58.197.4","TCP","1434","34325  >  443 [ACK] Seq=83205 Ack=1216 Win=661 Len=1368 TSval=8129106 TSecr=600638963 [TCP segment of a reassembled PDU]"
"147","2018-08-23 02:50:08.962777","192.168.2.3","216.58.197.4","TLSv1.2","212","Application Data"
"148","2018-08-23 02:50:08.963252","192.168.2.3","216.58.197.4","TCP","1434","34325  >  443 [ACK] Seq=84719 Ack=1216 Win=661 Len=1368 TSval=8129106 TSecr=600638963 [TCP segment of a reassembled PDU]"
"149","2018-08-23 02:50:08.963255","192.168.2.3","216.58.197.4","TLSv1.2","155","Application Data"
"153","2018-08-23 02:50:09.059831","192.168.2.3","216.58.197.4","TCP","1434","34325  >  443 [ACK] Seq=86176 Ack=1216 Win=661 Len=1368 TSval=8129115 TSecr=600638980 [TCP segment of a reassembled PDU]"
"154","2018-08-23 02:50:09.060160","192.168.2.3","216.58.197.4","TCP","1434","34325  >  443 [ACK] Seq=87544 Ack=1216 Win=661 Len=1368 TSval=8129115 TSecr=600638980 [TCP segment of a reassembled PDU]"
"155","2018-08-23 02:50:09.060164","192.168.2.3","216.58.197.4","TLSv1.2","212","Application Data"
"156","2018-08-23 02:50:09.062255","192.168.2.3","216.58.197.4","TCP","1434","34325  >  443 [ACK] Seq=89058 Ack=1216 Win=661 Len=1368 TSval=8129115 TSecr=600638980 [TCP segment of a reassembled PDU]"
"157","2018-08-23 02:50:09.062259","192.168.2.3","216.58.197.4","TLSv1.2","155","Application Data"
"161","2018-08-23 02:50:09.165806","192.168.2.3","216.58.197.4","TCP","1434","34325  >  443 [ACK] Seq=90515 Ack=1216 Win=661 Len=1368 TSval=8129126 TSecr=600639079 [TCP segment of a reassembled PDU]"
"162","2018-08-23 02:50:09.169412","192.168.2.3","216.58.197.4","TCP","1434","34325  >  443 [ACK] Seq=91883 Ack=1216 Win=661 Len=1368 TSval=8129126 TSecr=600639079 [TCP segment of a reassembled PDU]"
"163","2018-08-23 02:50:09.169417","192.168.2.3","216.58.197.4","TLSv1.2","212","Application Data"
"164","2018-08-23 02:50:09.169418","192.168.2.3","216.58.197.4","TLSv1.2","1308","Application Data"
"167","2018-08-23 02:50:09.261848","192.168.2.3","216.58.197.4","TCP","1434","34325  >  443 [ACK] Seq=94639 Ack=1216 Win=661 Len=1368 TSval=8129136 TSecr=600639187 [TCP segment of a reassembled PDU]"
"168","2018-08-23 02:50:09.262152","192.168.2.3","216.58.197.4","TCP","1434","34325  >  443 [ACK] Seq=96007 Ack=1216 Win=661 Len=1368 TSval=8129136 TSecr=600639187 [TCP segment of a reassembled PDU]"
"169","2018-08-23 02:50:09.262155","192.168.2.3","216.58.197.4","TLSv1.2","212","Application Data"
"170","2018-08-23 02:50:09.262603","192.168.2.3","216.58.197.4","TCP","1434","34325  >  443 [ACK] Seq=97521 Ack=1216 Win=661 Len=1368 TSval=8129136 TSecr=600639187 [TCP segment of a reassembled PDU]"
"171","2018-08-23 02:50:09.262605","192.168.2.3","216.58.197.4","TLSv1.2","155","Application Data"
"175","2018-08-23 02:50:09.359011","192.168.2.3","216.58.197.4","TCP","1434","34325  >  443 [ACK] Seq=98978 Ack=1216 Win=661 Len=1368 TSval=8129145 TSecr=600639280 [TCP segment of a reassembled PDU]"
"176","2018-08-23 02:50:09.359372","192.168.2.3","216.58.197.4","TCP","1434","34325  >  443 [ACK] Seq=100346 Ack=1216 Win=661 Len=1368 TSval=8129145 TSecr=600639280 [TCP segment of a reassembled PDU]"
"177","2018-08-23 02:50:09.359373","192.168.2.3","216.58.197.4","TLSv1.2","212","Application Data"
"178","2018-08-23 02:50:09.359564","192.168.2.3","216.58.197.4","TCP","1434","34325  >  443 [ACK] Seq=101860 Ack=1216 Win=661 Len=1368 TSval=8129145 TSecr=600639280 [TCP segment of a reassembled PDU]"
"179","2018-08-23 02:50:09.359568","192.168.2.3","216.58.197.4","TLSv1.2","155","Application Data"
"182","2018-08-23 02:50:09.475954","192.168.2.3","216.58.197.4","TCP","1434","34325  >  443 [ACK] Seq=103317 Ack=1216 Win=661 Len=1368 TSval=8129157 TSecr=600639377 [TCP segment of a reassembled PDU]"
"183","2018-08-23 02:50:09.475958","192.168.2.3","216.58.197.4","TCP","1434","34325  >  443 [ACK] Seq=104685 Ack=1216 Win=661 Len=1368 TSval=8129157 TSecr=600639377 [TCP segment of a reassembled PDU]"
"184","2018-08-23 02:50:09.475959","192.168.2.3","216.58.197.4","TLSv1.2","212","Application Data"
"185","2018-08-23 02:50:09.475960","192.168.2.3","216.58.197.4","TCP","1434","34325  >  443 [ACK] Seq=106199 Ack=1216 Win=661 Len=1368 TSval=8129157 TSecr=600639377 [TCP segment of a reassembled PDU]"
"186","2018-08-23 02:50:09.476028","192.168.2.3","216.58.197.4","TLSv1.2","155","Application Data"
"188","2018-08-23 02:50:09.552165","192.168.2.3","216.58.197.4","TCP","1434","34325  >  443 [ACK] Seq=107656 Ack=1216 Win=661 Len=1368 TSval=8129165 TSecr=600639493 [TCP segment of a reassembled PDU]"
"189","2018-08-23 02:50:09.552587","192.168.2.3","216.58.197.4","TCP","1434","34325  >  443 [ACK] Seq=109024 Ack=1216 Win=661 Len=1368 TSval=8129165 TSecr=600639493 [TCP segment of a reassembled PDU]"
"190","2018-08-23 02:50:09.552590","192.168.2.3","216.58.197.4","TLSv1.2","212","Application Data"
"191","2018-08-23 02:50:09.553082","192.168.2.3","216.58.197.4","TCP","1434","34325  >  443 [ACK] Seq=110538 Ack=1216 Win=661 Len=1368 TSval=8129165 TSecr=600639493 [TCP segment of a reassembled PDU]"
"192","2018-08-23 02:50:09.553085","192.168.2.3","216.58.197.4","TLSv1.2","155","Application Data"
"198","2018-08-23 02:50:09.614847","192.168.2.3","216.58.197.4","TCP","66","34325  >  443 [ACK] Seq=111995 Ack=1505 Win=661 Len=0 TSval=8129171 TSecr=600639626"
"199","2018-08-23 02:50:09.654108","192.168.2.3","216.58.197.4","TCP","1434","34325  >  443 [ACK] Seq=111995 Ack=1505 Win=661 Len=1368 TSval=8129174 TSecr=600639626 [TCP segment of a reassembled PDU]"
"200","2018-08-23 02:50:09.654113","192.168.2.3","216.58.197.4","TCP","1434","34325  >  443 [ACK] Seq=113363 Ack=1505 Win=661 Len=1368 TSval=8129174 TSecr=600639626 [TCP segment of a reassembled PDU]"
"201","2018-08-23 02:50:09.654114","192.168.2.3","216.58.197.4","TLSv1.2","212","Application Data"
"202","2018-08-23 02:50:09.654408","192.168.2.3","216.58.197.4","TCP","1434","34325  >  443 [ACK] Seq=114877 Ack=1505 Win=661 Len=1368 TSval=8129174 TSecr=600639626 [TCP segment of a reassembled PDU]"
"203","2018-08-23 02:50:09.654411","192.168.2.3","216.58.197.4","TLSv1.2","155","Application Data"
"209","2018-08-23 02:50:09.702360","192.168.2.3","216.58.197.4","TCP","66","34325  >  443 [ACK] Seq=116334 Ack=1793 Win=661 Len=0 TSval=8129180 TSecr=600639696"
"212","2018-08-23 02:50:09.713304","192.168.2.3","216.58.197.4","TCP","66","34325  >  443 [ACK] Seq=116334 Ack=2029 Win=661 Len=0 TSval=8129181 TSecr=600639725"
"213","2018-08-23 02:50:09.767885","192.168.2.3","216.58.197.4","TCP","1434","34325  >  443 [ACK] Seq=116334 Ack=2029 Win=661 Len=1368 TSval=8129186 TSecr=600639725 [TCP segment of a reassembled PDU]"
"214","2018-08-23 02:50:09.768303","192.168.2.3","216.58.197.4","TCP","1434","34325  >  443 [ACK] Seq=117702 Ack=2029 Win=661 Len=1368 TSval=8129186 TSecr=600639725 [TCP segment of a reassembled PDU]"
"215","2018-08-23 02:50:09.768307","192.168.2.3","216.58.197.4","TLSv1.2","212","Application Data"
"216","2018-08-23 02:50:09.768308","192.168.2.3","216.58.197.4","TCP","1434","34325  >  443 [ACK] Seq=119216 Ack=2029 Win=661 Len=1368 TSval=8129186 TSecr=600639725 [TCP segment of a reassembled PDU]"
"217","2018-08-23 02:50:09.768393","192.168.2.3","216.58.197.4","TLSv1.2","71","Application Data"
"221","2018-08-23 02:50:09.869561","192.168.2.3","216.58.197.4","TCP","1434","34325  >  443 [ACK] Seq=120589 Ack=2029 Win=661 Len=1368 TSval=8129196 TSecr=600639826 [TCP segment of a reassembled PDU]"
"222","2018-08-23 02:50:09.869847","192.168.2.3","216.58.197.4","TCP","1434","34325  >  443 [ACK] Seq=121957 Ack=2029 Win=661 Len=1368 TSval=8129196 TSecr=600639826 [TCP segment of a reassembled PDU]"
"223","2018-08-23 02:50:09.869849","192.168.2.3","216.58.197.4","TLSv1.2","212","Application Data"
"224","2018-08-23 02:50:09.870308","192.168.2.3","216.58.197.4","TCP","1434","34325  >  443 [ACK] Seq=123471 Ack=2029 Win=661 Len=1368 TSval=8129196 TSecr=600639826 [TCP segment of a reassembled PDU]"
"225","2018-08-23 02:50:09.870312","192.168.2.3","216.58.197.4","TLSv1.2","155","Application Data"
"229","2018-08-23 02:50:09.969068","192.168.2.3","216.58.197.4","TCP","1434","34325  >  443 [ACK] Seq=124928 Ack=2029 Win=661 Len=1368 TSval=8129206 TSecr=600639888 [TCP segment of a reassembled PDU]"
"230","2018-08-23 02:50:09.969375","192.168.2.3","216.58.197.4","TCP","1434","34325  >  443 [ACK] Seq=126296 Ack=2029 Win=661 Len=1368 TSval=8129206 TSecr=600639888 [TCP segment of a reassembled PDU]"
"231","2018-08-23 02:50:09.969378","192.168.2.3","216.58.197.4","TLSv1.2","212","Application Data"
"232","2018-08-23 02:50:09.969870","192.168.2.3","216.58.197.4","TCP","1434","34325  >  443 [ACK] Seq=127810 Ack=2029 Win=661 Len=1368 TSval=8129206 TSecr=600639888 [TCP segment of a reassembled PDU]"
"233","2018-08-23 02:50:09.969873","192.168.2.3","216.58.197.4","TLSv1.2","155","Application Data"
"239","2018-08-23 02:50:10.018786","192.168.2.3","216.58.197.4","TCP","66","34325  >  443 [ACK] Seq=129267 Ack=2428 Win=661 Len=0 TSval=8129211 TSecr=600640030"
"240","2018-08-23 02:50:10.054666","192.168.2.3","216.58.197.4","TCP","1434","34325  >  443 [ACK] Seq=129267 Ack=2428 Win=661 Len=1368 TSval=8129215 TSecr=600640030 [TCP segment of a reassembled PDU]"
"241","2018-08-23 02:50:10.055016","192.168.2.3","216.58.197.4","TCP","1434","34325  >  443 [ACK] Seq=130635 Ack=2428 Win=661 Len=1368 TSval=8129215 TSecr=600640030 [TCP segment of a reassembled PDU]"
"242","2018-08-23 02:50:10.055019","192.168.2.3","216.58.197.4","TLSv1.2","212","Application Data"
"243","2018-08-23 02:50:10.055393","192.168.2.3","216.58.197.4","TCP","1434","34325  >  443 [ACK] Seq=132149 Ack=2428 Win=661 Len=1368 TSval=8129215 TSecr=600640030 [TCP segment of a reassembled PDU]"
"244","2018-08-23 02:50:10.055396","192.168.2.3","216.58.197.4","TLSv1.2","155","Application Data"
"250","2018-08-23 02:50:10.104738","192.168.2.3","216.58.197.4","TCP","66","34325  >  443 [ACK] Seq=133606 Ack=2815 Win=661 Len=0 TSval=8129220 TSecr=600640117"
"251","2018-08-23 02:50:10.153553","192.168.2.3","216.58.197.4","TCP","1434","34325  >  443 [ACK] Seq=133606 Ack=2815 Win=661 Len=1368 TSval=8129225 TSecr=600640117 [TCP segment of a reassembled PDU]"
"252","2018-08-23 02:50:10.153684","192.168.2.3","216.58.197.4","TCP","1434","34325  >  443 [ACK] Seq=134974 Ack=2815 Win=661 Len=1368 TSval=8129225 TSecr=600640117 [TCP segment of a reassembled PDU]"
"253","2018-08-23 02:50:10.153687","192.168.2.3","216.58.197.4","TLSv1.2","212","Application Data"
"254","2018-08-23 02:50:10.153939","192.168.2.3","216.58.197.4","TCP","1434","34325  >  443 [ACK] Seq=136488 Ack=2815 Win=661 Len=1368 TSval=8129225 TSecr=600640117 [TCP segment of a reassembled PDU]"
"255","2018-08-23 02:50:10.153942","192.168.2.3","216.58.197.4","TLSv1.2","155","Application Data"
"259","2018-08-23 02:50:10.254059","192.168.2.3","216.58.197.4","TCP","1434","34325  >  443 [ACK] Seq=137945 Ack=2815 Win=661 Len=1368 TSval=8129235 TSecr=600640171 [TCP segment of a reassembled PDU]"
"260","2018-08-23 02:50:10.254333","192.168.2.3","216.58.197.4","TCP","1434","34325  >  443 [ACK] Seq=139313 Ack=2815 Win=661 Len=1368 TSval=8129235 TSecr=600640171 [TCP segment of a reassembled PDU]"
"261","2018-08-23 02:50:10.254337","192.168.2.3","216.58.197.4","TLSv1.2","212","Application Data"
"262","2018-08-23 02:50:10.254782","192.168.2.3","216.58.197.4","TCP","1434","34325  >  443 [ACK] Seq=140827 Ack=2815 Win=661 Len=1368 TSval=8129235 TSecr=600640171 [TCP segment of a reassembled PDU]"
"263","2018-08-23 02:50:10.254785","192.168.2.3","216.58.197.4","TLSv1.2","155","Application Data"
"268","2018-08-23 02:50:10.286709","192.168.2.3","192.168.2.1","TCP","183","8009  >  53029 [PSH, ACK] Seq=118 Ack=235 Win=277 Len=117 TSval=8129238 TSecr=2318543830 [TCP segment of a reassembled PDU]"
"272","2018-08-23 02:50:10.318459","192.168.2.3","216.58.197.4","TCP","66","34325  >  443 [ACK] Seq=142284 Ack=3219 Win=661 Len=0 TSval=8129241 TSecr=600640330"
"273","2018-08-23 02:50:10.350890","192.168.2.3","216.58.197.4","TCP","1434","34325  >  443 [ACK] Seq=142284 Ack=3219 Win=661 Len=1368 TSval=8129244 TSecr=600640330 [TCP segment of a reassembled PDU]"
"274","2018-08-23 02:50:10.351260","192.168.2.3","216.58.197.4","TCP","1434","34325  >  443 [ACK] Seq=143652 Ack=3219 Win=661 Len=1368 TSval=8129244 TSecr=600640330 [TCP segment of a reassembled PDU]"
"275","2018-08-23 02:50:10.351266","192.168.2.3","216.58.197.4","TLSv1.2","212","Application Data"
"276","2018-08-23 02:50:10.352281","192.168.2.3","216.58.197.4","TCP","1434","34325  >  443 [ACK] Seq=145166 Ack=3219 Win=661 Len=1368 TSval=8129244 TSecr=600640330 [TCP segment of a reassembled PDU]"
"277","2018-08-23 02:50:10.352285","192.168.2.3","216.58.197.4","TLSv1.2","155","Application Data"
"283","2018-08-23 02:50:10.412979","192.168.2.3","216.58.197.4","TCP","66","34325  >  443 [ACK] Seq=146623 Ack=3485 Win=661 Len=0 TSval=8129251 TSecr=600640423"
"286","2018-08-23 02:50:10.421321","192.168.2.3","216.58.197.4","TCP","66","34325  >  443 [ACK] Seq=146623 Ack=3875 Win=661 Len=0 TSval=8129252 TSecr=600640433"
"287","2018-08-23 02:50:10.448730","192.168.2.3","216.58.197.4","TCP","1434","34325  >  443 [ACK] Seq=146623 Ack=3875 Win=661 Len=1368 TSval=8129254 TSecr=600640433 [TCP segment of a reassembled PDU]"
"288","2018-08-23 02:50:10.449063","192.168.2.3","216.58.197.4","TCP","1434","34325  >  443 [ACK] Seq=147991 Ack=3875 Win=661 Len=1368 TSval=8129254 TSecr=600640433 [TCP segment of a reassembled PDU]"
"289","2018-08-23 02:50:10.449065","192.168.2.3","216.58.197.4","TLSv1.2","212","Application Data"
"290","2018-08-23 02:50:10.452009","192.168.2.3","216.58.197.4","TCP","1434","34325  >  443 [ACK] Seq=149505 Ack=3875 Win=661 Len=1368 TSval=8129254 TSecr=600640433 [TCP segment of a reassembled PDU]"
"291","2018-08-23 02:50:10.452012","192.168.2.3","216.58.197.4","TLSv1.2","155","Application Data"
"295","2018-08-23 02:50:10.562722","192.168.2.3","216.58.197.4","TCP","1434","34325  >  443 [ACK] Seq=150962 Ack=3875 Win=661 Len=1368 TSval=8129266 TSecr=600640469 [TCP segment of a reassembled PDU]"
"296","2018-08-23 02:50:10.563038","192.168.2.3","216.58.197.4","TCP","1434","34325  >  443 [ACK] Seq=152330 Ack=3875 Win=661 Len=1368 TSval=8129266 TSecr=600640469 [TCP segment of a reassembled PDU]"
"297","2018-08-23 02:50:10.563040","192.168.2.3","216.58.197.4","TLSv1.2","212","Application Data"
"298","2018-08-23 02:50:10.563490","192.168.2.3","216.58.197.4","TCP","1434","34325  >  443 [ACK] Seq=153844 Ack=3875 Win=661 Len=1368 TSval=8129266 TSecr=600640469 [TCP segment of a reassembled PDU]"
"299","2018-08-23 02:50:10.563493","192.168.2.3","216.58.197.4","TLSv1.2","129","Application Data"
"305","2018-08-23 02:50:10.625941","192.168.2.3","216.58.197.4","TCP","66","34325  >  443 [ACK] Seq=155275 Ack=4277 Win=661 Len=0 TSval=8129272 TSecr=600640633"
"306","2018-08-23 02:50:10.678064","192.168.2.3","216.58.197.4","TCP","1434","34325  >  443 [ACK] Seq=155275 Ack=4277 Win=661 Len=1368 TSval=8129276 TSecr=600640633 [TCP segment of a reassembled PDU]"
"307","2018-08-23 02:50:10.678069","192.168.2.3","216.58.197.4","TCP","1434","34325  >  443 [ACK] Seq=156643 Ack=4277 Win=661 Len=1368 TSval=8129276 TSecr=600640633 [TCP segment of a reassembled PDU]"
"308","2018-08-23 02:50:10.678070","192.168.2.3","216.58.197.4","TLSv1.2","212","Application Data"
"309","2018-08-23 02:50:10.678375","192.168.2.3","216.58.197.4","TCP","1434","34325  >  443 [ACK] Seq=158157 Ack=4277 Win=661 Len=1368 TSval=8129276 TSecr=600640633 [TCP segment of a reassembled PDU]"
"310","2018-08-23 02:50:10.678377","192.168.2.3","216.58.197.4","TLSv1.2","155","Application Data"
"315","2018-08-23 02:50:10.704771","192.168.2.3","216.58.197.4","TCP","66","34325  >  443 [ACK] Seq=159614 Ack=4684 Win=661 Len=0 TSval=8129280 TSecr=600640696"
"317","2018-08-23 02:50:10.791128","192.168.2.3","216.58.197.4","TCP","1434","34325  >  443 [ACK] Seq=159614 Ack=4981 Win=661 Len=1368 TSval=8129288 TSecr=600640792 [TCP segment of a reassembled PDU]"
"318","2018-08-23 02:50:10.791283","192.168.2.3","216.58.197.4","TCP","1434","34325  >  443 [ACK] Seq=160982 Ack=4981 Win=661 Len=1368 TSval=8129288 TSecr=600640792 [TCP segment of a reassembled PDU]"
"319","2018-08-23 02:50:10.791300","192.168.2.3","216.58.197.4","TLSv1.2","212","Application Data"
"320","2018-08-23 02:50:10.791489","192.168.2.3","216.58.197.4","TCP","1434","34325  >  443 [ACK] Seq=162496 Ack=4981 Win=661 Len=1368 TSval=8129288 TSecr=600640792 [TCP segment of a reassembled PDU]"
"321","2018-08-23 02:50:10.791491","192.168.2.3","216.58.197.4","TLSv1.2","155","Application Data"
"325","2018-08-23 02:50:10.896739","192.168.2.3","216.58.197.4","TCP","1434","34325  >  443 [ACK] Seq=163953 Ack=4981 Win=661 Len=1368 TSval=8129299 TSecr=600640849 [TCP segment of a reassembled PDU]"
"326","2018-08-23 02:50:10.899499","192.168.2.3","216.58.197.4","TCP","1434","34325  >  443 [ACK] Seq=165321 Ack=4981 Win=661 Len=1368 TSval=8129299 TSecr=600640849 [TCP segment of a reassembled PDU]"
"327","2018-08-23 02:50:10.899504","192.168.2.3","216.58.197.4","TLSv1.2","212","Application Data"
"328","2018-08-23 02:50:10.899505","192.168.2.3","216.58.197.4","TCP","1434","34325  >  443 [ACK] Seq=166835 Ack=4981 Win=661 Len=1368 TSval=8129299 TSecr=600640849 [TCP segment of a reassembled PDU]"
"329","2018-08-23 02:50:10.899611","192.168.2.3","216.58.197.4","TLSv1.2","155","Application Data"
"333","2018-08-23 02:50:10.941032","192.168.2.3","216.58.197.4","TCP","66","34325  >  443 [ACK] Seq=168292 Ack=5015 Win=661 Len=0 TSval=8129304 TSecr=600640917"
"334","2018-08-23 02:50:11.016007","192.168.2.3","216.58.197.4","TCP","1434","34325  >  443 [ACK] Seq=168292 Ack=5015 Win=661 Len=1368 TSval=8129311 TSecr=600640917 [TCP segment of a reassembled PDU]"
"335","2018-08-23 02:50:11.016012","192.168.2.3","216.58.197.4","TCP","1434","34325  >  443 [ACK] Seq=169660 Ack=5015 Win=661 Len=1368 TSval=8129311 TSecr=600640917 [TCP segment of a reassembled PDU]"
"336","2018-08-23 02:50:11.016172","192.168.2.3","216.58.197.4","TLSv1.2","212","Application Data"
"337","2018-08-23 02:50:11.016174","192.168.2.3","216.58.197.4","TCP","1434","34325  >  443 [ACK] Seq=171174 Ack=5015 Win=661 Len=1368 TSval=8129311 TSecr=600640917 [TCP segment of a reassembled PDU]"
"338","2018-08-23 02:50:11.016348","192.168.2.3","216.58.197.4","TLSv1.2","155","Application Data"
"343","2018-08-23 02:50:11.074128","192.168.2.3","216.58.197.4","TCP","66","34325  >  443 [ACK] Seq=172631 Ack=5368 Win=661 Len=0 TSval=8129317 TSecr=600641081"
"344","2018-08-23 02:50:11.114755","192.168.2.3","216.58.197.4","TCP","1434","34325  >  443 [ACK] Seq=172631 Ack=5368 Win=661 Len=1368 TSval=8129321 TSecr=600641081 [TCP segment of a reassembled PDU]"
"345","2018-08-23 02:50:11.114899","192.168.2.3","216.58.197.4","TCP","1434","34325  >  443 [ACK] Seq=173999 Ack=5368 Win=661 Len=1368 TSval=8129321 TSecr=600641081 [TCP segment of a reassembled PDU]"
"346","2018-08-23 02:50:11.114902","192.168.2.3","216.58.197.4","TLSv1.2","212","Application Data"
"347","2018-08-23 02:50:11.115168","192.168.2.3","216.58.197.4","TCP","1434","34325  >  443 [ACK] Seq=175513 Ack=5368 Win=661 Len=1368 TSval=8129321 TSecr=600641081 [TCP segment of a reassembled PDU]"
"348","2018-08-23 02:50:11.115171","192.168.2.3","216.58.197.4","TLSv1.2","155","Application Data"
"352","2018-08-23 02:50:11.214873","192.168.2.3","216.58.197.4","TCP","1434","34325  >  443 [ACK] Seq=176970 Ack=5368 Win=661 Len=1368 TSval=8129331 TSecr=600641173 [TCP segment of a reassembled PDU]"
"353","2018-08-23 02:50:11.215339","192.168.2.3","216.58.197.4","TCP","1434","34325  >  443 [ACK] Seq=178338 Ack=5368 Win=661 Len=1368 TSval=8129331 TSecr=600641173 [TCP segment of a reassembled PDU]"
"354","2018-08-23 02:50:11.215342","192.168.2.3","216.58.197.4","TLSv1.2","212","Application Data"
"355","2018-08-23 02:50:11.215343","192.168.2.3","216.58.197.4","TLSv1.2","1216","Application Data"
"361","2018-08-23 02:50:11.263356","192.168.2.3","35.186.224.46","TLSv1.2","108","Application Data"
"362","2018-08-23 02:50:11.264455","192.168.2.3","216.58.197.4","TCP","66","34325  >  443 [ACK] Seq=181002 Ack=5622 Win=661 Len=0 TSval=8129336 TSecr=600641276"
"364","2018-08-23 02:50:11.309567","192.168.2.3","35.186.224.46","TCP","66","49072  >  443 [ACK] Seq=43 Ack=40 Win=749 Len=0 TSval=8129340 TSecr=3642512788"
"365","2018-08-23 02:50:11.333988","192.168.2.3","216.58.197.4","TCP","1434","34325  >  443 [ACK] Seq=181002 Ack=5622 Win=661 Len=1368 TSval=8129343 TSecr=600641276 [TCP segment of a reassembled PDU]"
"366","2018-08-23 02:50:11.333994","192.168.2.3","216.58.197.4","TCP","1434","34325  >  443 [ACK] Seq=182370 Ack=5622 Win=661 Len=1368 TSval=8129343 TSecr=600641276 [TCP segment of a reassembled PDU]"
"367","2018-08-23 02:50:11.334078","192.168.2.3","216.58.197.4","TLSv1.2","212","Application Data"
"368","2018-08-23 02:50:11.334313","192.168.2.3","216.58.197.4","TCP","1434","34325  >  443 [ACK] Seq=183884 Ack=5622 Win=661 Len=1368 TSval=8129343 TSecr=600641276 [TCP segment of a reassembled PDU]"
"369","2018-08-23 02:50:11.334316","192.168.2.3","216.58.197.4","TLSv1.2","116","Application Data"
"375","2018-08-23 02:50:11.383155","192.168.2.3","216.58.197.4","TCP","66","34325  >  443 [ACK] Seq=185302 Ack=5812 Win=661 Len=0 TSval=8129348 TSecr=600641395"
"376","2018-08-23 02:50:11.383553","192.168.2.3","216.58.197.4","TCP","66","34325  >  443 [ACK] Seq=185302 Ack=5907 Win=661 Len=0 TSval=8129348 TSecr=600641395"
"379","2018-08-23 02:50:11.426234","192.168.2.3","216.58.197.4","TCP","66","34325  >  443 [ACK] Seq=185302 Ack=6432 Win=661 Len=0 TSval=8129352 TSecr=600641437"
"380","2018-08-23 02:50:11.427286","192.168.2.3","216.58.197.4","TCP","66","34325  >  443 [ACK] Seq=185302 Ack=6653 Win=661 Len=0 TSval=8129352 TSecr=600641439"
"381","2018-08-23 02:50:11.432030","192.168.2.3","216.58.197.4","TCP","1434","34325  >  443 [ACK] Seq=185302 Ack=6653 Win=661 Len=1368 TSval=8129353 TSecr=600641439 [TCP segment of a reassembled PDU]"
"382","2018-08-23 02:50:11.432222","192.168.2.3","216.58.197.4","TCP","1434","34325  >  443 [ACK] Seq=186670 Ack=6653 Win=661 Len=1368 TSval=8129353 TSecr=600641439 [TCP segment of a reassembled PDU]"
"383","2018-08-23 02:50:11.432231","192.168.2.3","216.58.197.4","TLSv1.2","212","Application Data"
"384","2018-08-23 02:50:11.432692","192.168.2.3","216.58.197.4","TCP","1434","34325  >  443 [ACK] Seq=188184 Ack=6653 Win=661 Len=1368 TSval=8129353 TSecr=600641439 [TCP segment of a reassembled PDU]"
"385","2018-08-23 02:50:11.432700","192.168.2.3","216.58.197.4","TLSv1.2","155","Application Data"
"386","2018-08-23 02:50:11.433889","192.168.2.3","216.58.197.4","TLSv1.2","458","Application Data"
"387","2018-08-23 02:50:11.433899","192.168.2.3","216.58.197.4","TLSv1.2","102","Application Data"
"394","2018-08-23 02:50:11.704638","192.168.2.3","216.58.197.4","TCP","66","34325  >  443 [ACK] Seq=190069 Ack=7093 Win=661 Len=0 TSval=8129380 TSecr=600641696"
"398","2018-08-23 02:50:12.039734","192.168.2.3","216.58.197.4","TCP","66","34325  >  443 [ACK] Seq=190069 Ack=8724 Win=650 Len=0 TSval=8129413 TSecr=600642011"
"409","2018-08-23 02:50:12.066531","192.168.2.3","216.58.197.4","TCP","66","34325  >  443 [ACK] Seq=190069 Ack=10567 Win=650 Len=0 TSval=8129416 TSecr=600642049"
"410","2018-08-23 02:50:12.068025","192.168.2.3","216.58.197.4","TCP","66","34325  >  443 [ACK] Seq=190069 Ack=12374 Win=650 Len=0 TSval=8129416 TSecr=600642075"
"411","2018-08-23 02:50:12.068029","192.168.2.3","216.58.197.4","TCP","66","34325  >  443 [ACK] Seq=190069 Ack=14167 Win=650 Len=0 TSval=8129416 TSecr=600642075"
"412","2018-08-23 02:50:12.068617","192.168.2.3","216.58.197.4","TCP","66","34325  >  443 [ACK] Seq=190069 Ack=16092 Win=661 Len=0 TSval=8129416 TSecr=600642075"
"413","2018-08-23 02:50:12.068936","192.168.2.3","216.58.197.4","TCP","66","34325  >  443 [ACK] Seq=190069 Ack=18411 Win=661 Len=0 TSval=8129416 TSecr=600642076"
"416","2018-08-23 02:50:12.071661","192.168.2.3","216.58.197.4","TCP","66","34325  >  443 [ACK] Seq=190069 Ack=19516 Win=661 Len=0 TSval=8129417 TSecr=600642083"
"417","2018-08-23 02:50:12.165156","192.168.2.3","35.186.224.48","TLSv1.2","124","Application Data"
"418","2018-08-23 02:50:12.168928","192.168.2.3","35.186.224.48","TLSv1.2","104","Application Data"
"428","2018-08-23 02:50:12.215005","192.168.2.3","216.58.197.4","TCP","66","34325  >  443 [ACK] Seq=190069 Ack=19787 Win=661 Len=0 TSval=8129431 TSecr=600642223"
"429","2018-08-23 02:50:12.215829","192.168.2.3","216.58.197.4","TCP","66","34325  >  443 [ACK] Seq=190069 Ack=20041 Win=661 Len=0 TSval=8129431 TSecr=600642224"
"434","2018-08-23 02:50:12.218054","192.168.2.3","216.58.197.4","TLSv1.2","104","Application Data"
"435","2018-08-23 02:50:12.219144","192.168.2.3","35.186.224.48","TCP","66","42527  >  443 [ACK] Seq=97 Ack=110 Win=661 Len=0 TSval=8129431 TSecr=335164672"
"436","2018-08-23 02:50:12.220519","192.168.2.3","35.186.224.48","TCP","66","42527  >  443 [ACK] Seq=97 Ack=976 Win=661 Len=0 TSval=8129431 TSecr=335164715"
"438","2018-08-23 02:50:12.222930","192.168.2.3","35.186.224.48","TLSv1.2","104","Application Data"
"440","2018-08-23 02:50:12.316528","192.168.2.3","104.199.240.211","TCP","66","48806  >  443 [RST, ACK] Seq=1 Ack=1 Win=518 Len=0 TSval=8129441 TSecr=301236143"
"441","2018-08-23 02:50:12.316533","192.168.2.3","104.199.240.211","TCP","66","48808  >  443 [RST, ACK] Seq=1 Ack=1 Win=434 Len=0 TSval=8129441 TSecr=303506065"
"442","2018-08-23 02:50:12.316534","192.168.2.3","104.199.240.211","TCP","66","48801  >  443 [RST, ACK] Seq=1 Ack=1 Win=661 Len=0 TSval=8129441 TSecr=303023863"
"443","2018-08-23 02:50:12.316535","192.168.2.3","104.199.240.211","TCP","66","48810  >  443 [RST, ACK] Seq=1 Ack=1 Win=622 Len=0 TSval=8129441 TSecr=302698399"
"444","2018-08-23 02:50:12.316535","192.168.2.3","203.211.199.120","TCP","66","52086  >  443 [RST, ACK] Seq=1 Ack=25 Win=661 Len=0 TSval=8129441 TSecr=1194763221"
"447","2018-08-23 02:50:12.358968","192.168.2.3","104.199.240.211","TCP","74","48815  >  443 [SYN] Seq=0 Win=14600 Len=0 MSS=1460 SACK_PERM=1 TSval=8129445 TSecr=0 WS=64"
"449","2018-08-23 02:50:12.397479","192.168.2.3","104.199.240.211","TCP","66","48815  >  443 [ACK] Seq=1 Ack=1 Win=14656 Len=0 TSval=8129449 TSecr=303353514"
"450","2018-08-23 02:50:12.397864","192.168.2.3","104.199.240.211","TLSv1.2","583","Client Hello"
