"No.","Time","Source","Destination","Protocol","Length","Info"
"12","2018-08-23 03:02:40.120161","192.168.2.3","216.58.197.4","TLSv1.2","156","[TCP Previous segment not captured] , Application Data"
"13","2018-08-23 03:02:40.120165","192.168.2.3","216.58.197.4","TLSv1.2","104","Application Data"
"14","2018-08-23 03:02:40.120166","192.168.2.3","216.58.197.4","TLSv1.2","158","Application Data"
"19","2018-08-23 03:02:40.126214","192.168.2.3","216.58.197.4","TCP","1434","34325  >  443 [ACK] Seq=222 Ack=1 Win=661 Len=1368 TSval=8204221 TSecr=601387848 [TCP segment of a reassembled PDU]"
"20","2018-08-23 03:02:40.126216","192.168.2.3","216.58.197.4","TCP","1434","34325  >  443 [ACK] Seq=1590 Ack=1 Win=661 Len=1368 TSval=8204221 TSecr=601387848 [TCP segment of a reassembled PDU]"
"21","2018-08-23 03:02:40.126217","192.168.2.3","216.58.197.4","TLSv1.2","212","Application Data"
"22","2018-08-23 03:02:40.126595","192.168.2.3","216.58.197.4","TCP","1434","34325  >  443 [ACK] Seq=3104 Ack=1 Win=661 Len=1368 TSval=8204221 TSecr=601387848 [TCP segment of a reassembled PDU]"
"23","2018-08-23 03:02:40.126597","192.168.2.3","216.58.197.4","TLSv1.2","350","Application Data"
"24","2018-08-23 03:02:40.126598","192.168.2.3","216.58.197.4","TCP","1434","34325  >  443 [ACK] Seq=4756 Ack=1 Win=661 Len=1368 TSval=8204221 TSecr=601387848 [TCP segment of a reassembled PDU]"
"25","2018-08-23 03:02:40.126832","192.168.2.3","216.58.197.4","TCP","1434","34325  >  443 [ACK] Seq=6124 Ack=1 Win=661 Len=1368 TSval=8204221 TSecr=601387848 [TCP segment of a reassembled PDU]"
"26","2018-08-23 03:02:40.129365","192.168.2.3","216.58.197.4","TLSv1.2","1434","Application Data [TCP segment of a reassembled PDU]"
"27","2018-08-23 03:02:40.129736","192.168.2.3","216.58.197.4","TCP","1434","34325  >  443 [ACK] Seq=8860 Ack=1 Win=661 Len=1368 TSval=8204221 TSecr=601390138 [TCP segment of a reassembled PDU]"
"28","2018-08-23 03:02:40.130041","192.168.2.3","216.58.197.4","TLSv1.2","1434","Application Data [TCP segment of a reassembled PDU]"
"29","2018-08-23 03:02:40.130043","192.168.2.3","216.58.197.4","TCP","1434","34325  >  443 [ACK] Seq=11596 Ack=1 Win=661 Len=1368 TSval=8204222 TSecr=601390138 [TCP segment of a reassembled PDU]"
"35","2018-08-23 03:02:40.136028","192.168.2.3","216.58.197.4","TLSv1.2","1434","Application Data [TCP segment of a reassembled PDU]"
"36","2018-08-23 03:02:40.136197","192.168.2.3","216.58.197.4","TCP","1434","34325  >  443 [ACK] Seq=14332 Ack=1 Win=661 Len=1368 TSval=8204222 TSecr=601390138 [TCP segment of a reassembled PDU]"
"37","2018-08-23 03:02:40.136450","192.168.2.3","216.58.197.4","TLSv1.2","1434","Application Data [TCP segment of a reassembled PDU]"
"38","2018-08-23 03:02:40.136451","192.168.2.3","216.58.197.4","TLSv1.2","1434","Application Data [TCP segment of a reassembled PDU]"
"39","2018-08-23 03:02:40.136585","192.168.2.3","216.58.197.4","TCP","1434","34325  >  443 [ACK] Seq=18436 Ack=39 Win=661 Len=1368 TSval=8204222 TSecr=601390139 [TCP segment of a reassembled PDU]"
"40","2018-08-23 03:02:40.136719","192.168.2.3","216.58.197.4","TLSv1.2","1434","Application Data [TCP segment of a reassembled PDU]"
"41","2018-08-23 03:02:40.137052","192.168.2.3","216.58.197.4","TLSv1.2","1434","Application Data [TCP segment of a reassembled PDU]"
"42","2018-08-23 03:02:40.137056","192.168.2.3","216.58.197.4","TCP","1434","34325  >  443 [ACK] Seq=22540 Ack=39 Win=661 Len=1368 TSval=8204222 TSecr=601390145 [TCP segment of a reassembled PDU]"
"43","2018-08-23 03:02:40.137434","192.168.2.3","216.58.197.4","TLSv1.2","1434","Application Data [TCP segment of a reassembled PDU]"
"44","2018-08-23 03:02:40.138712","192.168.2.3","216.58.197.4","TCP","1434","34325  >  443 [ACK] Seq=25276 Ack=39 Win=661 Len=1368 TSval=8204222 TSecr=601390145 [TCP segment of a reassembled PDU]"
"45","2018-08-23 03:02:40.139056","192.168.2.3","216.58.197.4","TLSv1.2","1434","Application Data [TCP segment of a reassembled PDU]"
"46","2018-08-23 03:02:40.139059","192.168.2.3","216.58.197.4","TCP","1434","34325  >  443 [ACK] Seq=28012 Ack=39 Win=661 Len=1368 TSval=8204222 TSecr=601390145 [TCP segment of a reassembled PDU]"
"47","2018-08-23 03:02:40.139633","192.168.2.3","216.58.197.4","TLSv1.2","1434","Application Data [TCP segment of a reassembled PDU]"
"48","2018-08-23 03:02:40.139636","192.168.2.3","216.58.197.4","TCP","1434","34325  >  443 [ACK] Seq=30748 Ack=39 Win=661 Len=1368 TSval=8204223 TSecr=601390148 [TCP segment of a reassembled PDU]"
"49","2018-08-23 03:02:40.140260","192.168.2.3","216.58.197.4","TCP","1434","34325  >  443 [ACK] Seq=32116 Ack=39 Win=661 Len=1368 TSval=8204223 TSecr=601390148 [TCP segment of a reassembled PDU]"
"50","2018-08-23 03:02:40.140263","192.168.2.3","216.58.197.4","TLSv1.2","1434","Application Data [TCP segment of a reassembled PDU]"
"52","2018-08-23 03:02:40.140577","192.168.2.3","216.58.197.4","TCP","1434","34325  >  443 [ACK] Seq=34852 Ack=39 Win=661 Len=1368 TSval=8204223 TSecr=601390148 [TCP segment of a reassembled PDU]"
"60","2018-08-23 03:02:40.146964","192.168.2.3","216.58.197.4","TLSv1.2","1434","Application Data [TCP segment of a reassembled PDU]"
"61","2018-08-23 03:02:40.147201","192.168.2.3","216.58.197.4","TLSv1.2","1434","Application Data [TCP segment of a reassembled PDU]"
"62","2018-08-23 03:02:40.147203","192.168.2.3","216.58.197.4","TCP","1434","34325  >  443 [ACK] Seq=38956 Ack=39 Win=661 Len=1368 TSval=8204223 TSecr=601390154 [TCP segment of a reassembled PDU]"
"63","2018-08-23 03:02:40.147388","192.168.2.3","216.58.197.4","TLSv1.2","1434","Application Data [TCP segment of a reassembled PDU]"
"64","2018-08-23 03:02:40.147594","192.168.2.3","216.58.197.4","TCP","1434","34325  >  443 [ACK] Seq=41692 Ack=39 Win=661 Len=1368 TSval=8204223 TSecr=601390155 [TCP segment of a reassembled PDU]"
"65","2018-08-23 03:02:40.147774","192.168.2.3","216.58.197.4","TLSv1.2","1434","Application Data [TCP segment of a reassembled PDU]"
"69","2018-08-23 03:02:40.152888","192.168.2.3","216.58.197.4","TCP","1434","34325  >  443 [ACK] Seq=44428 Ack=39 Win=661 Len=1368 TSval=8204223 TSecr=601390155 [TCP segment of a reassembled PDU]"
"70","2018-08-23 03:02:40.152891","192.168.2.3","216.58.197.4","TCP","1434","34325  >  443 [ACK] Seq=45796 Ack=39 Win=661 Len=1368 TSval=8204223 TSecr=601390155 [TCP segment of a reassembled PDU]"
"71","2018-08-23 03:02:40.153204","192.168.2.3","216.58.197.4","TLSv1.2","1434","Application Data [TCP segment of a reassembled PDU]"
"72","2018-08-23 03:02:40.153354","192.168.2.3","216.58.197.4","TCP","1434","34325  >  443 [ACK] Seq=48532 Ack=39 Win=661 Len=1368 TSval=8204223 TSecr=601390155 [TCP segment of a reassembled PDU]"
"73","2018-08-23 03:02:40.153547","192.168.2.3","216.58.197.4","TLSv1.2","1434","Application Data [TCP segment of a reassembled PDU]"
"74","2018-08-23 03:02:40.153595","192.168.2.3","216.58.197.4","TCP","1434","34325  >  443 [ACK] Seq=51268 Ack=39 Win=661 Len=1368 TSval=8204223 TSecr=601390157 [TCP segment of a reassembled PDU]"
"75","2018-08-23 03:02:40.153761","192.168.2.3","216.58.197.4","TLSv1.2","1434","Application Data [TCP segment of a reassembled PDU]"
"76","2018-08-23 03:02:40.153868","192.168.2.3","216.58.197.4","TLSv1.2","1434","Application Data [TCP segment of a reassembled PDU]"
"77","2018-08-23 03:02:40.154196","192.168.2.3","216.58.197.4","TCP","1434","34325  >  443 [ACK] Seq=55372 Ack=39 Win=661 Len=1368 TSval=8204224 TSecr=601390157 [TCP segment of a reassembled PDU]"
"78","2018-08-23 03:02:40.154199","192.168.2.3","216.58.197.4","TLSv1.2","1434","Application Data [TCP segment of a reassembled PDU]"
"79","2018-08-23 03:02:40.154511","192.168.2.3","216.58.197.4","TCP","1434","34325  >  443 [PSH, ACK] Seq=58108 Ack=39 Win=661 Len=1368 TSval=8204224 TSecr=601390158 [TCP segment of a reassembled PDU]"
"80","2018-08-23 03:02:40.154513","192.168.2.3","216.58.197.4","TCP","1434","34325  >  443 [ACK] Seq=59476 Ack=39 Win=661 Len=1368 TSval=8204224 TSecr=601390158 [TCP segment of a reassembled PDU]"
"81","2018-08-23 03:02:40.154674","192.168.2.3","216.58.197.4","TLSv1.2","1434","Application Data [TCP segment of a reassembled PDU]"
"82","2018-08-23 03:02:40.155085","192.168.2.3","216.58.197.4","TCP","1434","34325  >  443 [ACK] Seq=62212 Ack=39 Win=661 Len=1368 TSval=8204224 TSecr=601390158 [TCP segment of a reassembled PDU]"
"83","2018-08-23 03:02:40.155087","192.168.2.3","216.58.197.4","TLSv1.2","1434","Application Data [TCP segment of a reassembled PDU]"
"84","2018-08-23 03:02:40.155628","192.168.2.3","216.58.197.4","TLSv1.2","1434","Application Data [TCP segment of a reassembled PDU]"
"85","2018-08-23 03:02:40.155631","192.168.2.3","216.58.197.4","TCP","1434","34325  >  443 [ACK] Seq=66316 Ack=39 Win=661 Len=1368 TSval=8204224 TSecr=601390165 [TCP segment of a reassembled PDU]"
"86","2018-08-23 03:02:40.155855","192.168.2.3","216.58.197.4","TLSv1.2","1434","Application Data [TCP segment of a reassembled PDU]"
"87","2018-08-23 03:02:40.155857","192.168.2.3","216.58.197.4","TLSv1.2","1066","Application Data"
"98","2018-08-23 03:02:40.235119","192.168.2.3","216.58.197.4","TCP","1434","34325  >  443 [ACK] Seq=70052 Ack=39 Win=661 Len=1368 TSval=8204232 TSecr=601390174 [TCP segment of a reassembled PDU]"
"99","2018-08-23 03:02:40.235508","192.168.2.3","216.58.197.4","TCP","1434","34325  >  443 [ACK] Seq=71420 Ack=39 Win=661 Len=1368 TSval=8204232 TSecr=601390174 [TCP segment of a reassembled PDU]"
"100","2018-08-23 03:02:40.235512","192.168.2.3","216.58.197.4","TLSv1.2","212","Application Data"
"101","2018-08-23 03:02:40.235513","192.168.2.3","216.58.197.4","TCP","1434","34325  >  443 [ACK] Seq=72934 Ack=39 Win=661 Len=1368 TSval=8204232 TSecr=601390174 [TCP segment of a reassembled PDU]"
"102","2018-08-23 03:02:40.235600","192.168.2.3","216.58.197.4","TLSv1.2","155","Application Data"
"106","2018-08-23 03:02:40.345565","192.168.2.3","216.58.197.4","TCP","1434","34325  >  443 [ACK] Seq=74391 Ack=39 Win=661 Len=1368 TSval=8204243 TSecr=601390294 [TCP segment of a reassembled PDU]"
"107","2018-08-23 03:02:40.345570","192.168.2.3","216.58.197.4","TCP","1434","34325  >  443 [ACK] Seq=75759 Ack=39 Win=661 Len=1368 TSval=8204243 TSecr=601390294 [TCP segment of a reassembled PDU]"
"108","2018-08-23 03:02:40.345700","192.168.2.3","216.58.197.4","TLSv1.2","212","Application Data"
"109","2018-08-23 03:02:40.345950","192.168.2.3","216.58.197.4","TCP","1434","34325  >  443 [ACK] Seq=77273 Ack=39 Win=661 Len=1368 TSval=8204243 TSecr=601390294 [TCP segment of a reassembled PDU]"
"110","2018-08-23 03:02:40.345952","192.168.2.3","216.58.197.4","TLSv1.2","155","Application Data"
"114","2018-08-23 03:02:40.438661","192.168.2.3","216.58.197.4","TCP","1434","34325  >  443 [ACK] Seq=78730 Ack=39 Win=661 Len=1368 TSval=8204252 TSecr=601390364 [TCP segment of a reassembled PDU]"
"115","2018-08-23 03:02:40.439078","192.168.2.3","216.58.197.4","TCP","1434","34325  >  443 [ACK] Seq=80098 Ack=39 Win=661 Len=1368 TSval=8204252 TSecr=601390364 [TCP segment of a reassembled PDU]"
"116","2018-08-23 03:02:40.439080","192.168.2.3","216.58.197.4","TLSv1.2","212","Application Data"
"117","2018-08-23 03:02:40.439509","192.168.2.3","216.58.197.4","TCP","1434","34325  >  443 [ACK] Seq=81612 Ack=39 Win=661 Len=1368 TSval=8204252 TSecr=601390364 [TCP segment of a reassembled PDU]"
"118","2018-08-23 03:02:40.439512","192.168.2.3","216.58.197.4","TLSv1.2","155","Application Data"
"125","2018-08-23 03:02:40.447261","192.168.2.3","216.58.197.4","TCP","66","34325  >  443 [ACK] Seq=83069 Ack=413 Win=661 Len=0 TSval=8204253 TSecr=601390460"
"127","2018-08-23 03:02:40.459730","192.168.2.3","216.58.197.4","TCP","66","34325  >  443 [ACK] Seq=83069 Ack=683 Win=661 Len=0 TSval=8204255 TSecr=601390460"
"129","2018-08-23 03:02:40.570197","192.168.2.3","216.58.197.4","TCP","1434","34325  >  443 [ACK] Seq=83069 Ack=683 Win=661 Len=1368 TSval=8204262 TSecr=601390460 [TCP segment of a reassembled PDU]"
"130","2018-08-23 03:02:40.570200","192.168.2.3","216.58.197.4","TCP","1434","34325  >  443 [ACK] Seq=84437 Ack=683 Win=661 Len=1368 TSval=8204262 TSecr=601390460 [TCP segment of a reassembled PDU]"
"131","2018-08-23 03:02:40.570201","192.168.2.3","216.58.197.4","TLSv1.2","212","Application Data"
"132","2018-08-23 03:02:40.570593","192.168.2.3","216.58.197.4","TCP","1434","34325  >  443 [ACK] Seq=85951 Ack=683 Win=661 Len=1368 TSval=8204262 TSecr=601390460 [TCP segment of a reassembled PDU]"
"133","2018-08-23 03:02:40.570595","192.168.2.3","216.58.197.4","TLSv1.2","155","Application Data"
"136","2018-08-23 03:02:40.598994","192.168.2.3","216.58.197.4","TCP","66","34325  >  443 [ACK] Seq=87408 Ack=830 Win=661 Len=0 TSval=8204269 TSecr=601390575"
"137","2018-08-23 03:02:40.634595","192.168.2.3","216.58.197.4","TCP","1434","34325  >  443 [ACK] Seq=87408 Ack=830 Win=661 Len=1368 TSval=8204272 TSecr=601390575 [TCP segment of a reassembled PDU]"
"138","2018-08-23 03:02:40.634598","192.168.2.3","216.58.197.4","TCP","1434","34325  >  443 [ACK] Seq=88776 Ack=830 Win=661 Len=1368 TSval=8204272 TSecr=601390575 [TCP segment of a reassembled PDU]"
"139","2018-08-23 03:02:40.634599","192.168.2.3","216.58.197.4","TLSv1.2","212","Application Data"
"140","2018-08-23 03:02:40.634894","192.168.2.3","216.58.197.4","TCP","1434","34325  >  443 [ACK] Seq=90290 Ack=830 Win=661 Len=1368 TSval=8204272 TSecr=601390575 [TCP segment of a reassembled PDU]"
"141","2018-08-23 03:02:40.634895","192.168.2.3","216.58.197.4","TLSv1.2","155","Application Data"
"145","2018-08-23 03:02:40.717008","192.168.2.3","216.58.197.4","TCP","66","34325  >  443 [ACK] Seq=91747 Ack=1103 Win=661 Len=0 TSval=8204280 TSecr=601390730"
"146","2018-08-23 03:02:40.729102","192.168.2.3","216.58.197.4","TCP","1434","34325  >  443 [ACK] Seq=91747 Ack=1103 Win=661 Len=1368 TSval=8204281 TSecr=601390730 [TCP segment of a reassembled PDU]"
"147","2018-08-23 03:02:40.729466","192.168.2.3","216.58.197.4","TCP","1434","34325  >  443 [ACK] Seq=93115 Ack=1103 Win=661 Len=1368 TSval=8204281 TSecr=601390730 [TCP segment of a reassembled PDU]"
"148","2018-08-23 03:02:40.729469","192.168.2.3","216.58.197.4","TLSv1.2","212","Application Data"
"149","2018-08-23 03:02:40.729470","192.168.2.3","216.58.197.4","TCP","1434","34325  >  443 [ACK] Seq=94629 Ack=1103 Win=661 Len=1368 TSval=8204282 TSecr=601390730 [TCP segment of a reassembled PDU]"
"150","2018-08-23 03:02:40.729582","192.168.2.3","216.58.197.4","TLSv1.2","155","Application Data"
"153","2018-08-23 03:02:40.842150","192.168.2.3","216.58.197.4","TCP","1434","34325  >  443 [ACK] Seq=96086 Ack=1103 Win=661 Len=1368 TSval=8204293 TSecr=601390748 [TCP segment of a reassembled PDU]"
"154","2018-08-23 03:02:40.842532","192.168.2.3","216.58.197.4","TCP","1434","34325  >  443 [ACK] Seq=97454 Ack=1103 Win=661 Len=1368 TSval=8204293 TSecr=601390748 [TCP segment of a reassembled PDU]"
"155","2018-08-23 03:02:40.842535","192.168.2.3","216.58.197.4","TLSv1.2","212","Application Data"
"156","2018-08-23 03:02:40.842885","192.168.2.3","216.58.197.4","TCP","1434","34325  >  443 [ACK] Seq=98968 Ack=1103 Win=661 Len=1368 TSval=8204293 TSecr=601390748 [TCP segment of a reassembled PDU]"
"157","2018-08-23 03:02:40.842888","192.168.2.3","216.58.197.4","TLSv1.2","155","Application Data"
"161","2018-08-23 03:02:40.921582","192.168.2.3","216.58.197.4","TCP","1434","34325  >  443 [ACK] Seq=100425 Ack=1103 Win=661 Len=1368 TSval=8204301 TSecr=601390901 [TCP segment of a reassembled PDU]"
"162","2018-08-23 03:02:40.921587","192.168.2.3","216.58.197.4","TCP","1434","34325  >  443 [ACK] Seq=101793 Ack=1103 Win=661 Len=1368 TSval=8204301 TSecr=601390901 [TCP segment of a reassembled PDU]"
"163","2018-08-23 03:02:40.921588","192.168.2.3","216.58.197.4","TLSv1.2","212","Application Data"
"164","2018-08-23 03:02:40.921721","192.168.2.3","216.58.197.4","TCP","1434","34325  >  443 [ACK] Seq=103307 Ack=1103 Win=661 Len=1368 TSval=8204301 TSecr=601390901 [TCP segment of a reassembled PDU]"
"165","2018-08-23 03:02:40.921974","192.168.2.3","216.58.197.4","TLSv1.2","155","Application Data"
"168","2018-08-23 03:02:41.013468","192.168.2.3","216.58.197.4","TCP","1434","34325  >  443 [ACK] Seq=104764 Ack=1103 Win=661 Len=1368 TSval=8204310 TSecr=601390940 [TCP segment of a reassembled PDU]"
"169","2018-08-23 03:02:41.013820","192.168.2.3","216.58.197.4","TCP","1434","34325  >  443 [ACK] Seq=106132 Ack=1103 Win=661 Len=1368 TSval=8204310 TSecr=601390940 [TCP segment of a reassembled PDU]"
"170","2018-08-23 03:02:41.013823","192.168.2.3","216.58.197.4","TLSv1.2","212","Application Data"
"171","2018-08-23 03:02:41.014315","192.168.2.3","216.58.197.4","TCP","1434","34325  >  443 [ACK] Seq=107646 Ack=1103 Win=661 Len=1368 TSval=8204310 TSecr=601390940 [TCP segment of a reassembled PDU]"
"172","2018-08-23 03:02:41.014318","192.168.2.3","216.58.197.4","TLSv1.2","155","Application Data"
"177","2018-08-23 03:02:41.059108","192.168.2.3","216.58.197.4","TCP","66","34325  >  443 [ACK] Seq=109103 Ack=1137 Win=661 Len=0 TSval=8204315 TSecr=601391032"
"178","2018-08-23 03:02:41.108209","192.168.2.3","216.58.197.4","TCP","1434","34325  >  443 [ACK] Seq=109103 Ack=1137 Win=661 Len=1368 TSval=8204319 TSecr=601391032 [TCP segment of a reassembled PDU]"
"179","2018-08-23 03:02:41.109178","192.168.2.3","216.58.197.4","TCP","1434","34325  >  443 [ACK] Seq=110471 Ack=1137 Win=661 Len=1368 TSval=8204320 TSecr=601391032 [TCP segment of a reassembled PDU]"
"180","2018-08-23 03:02:41.109180","192.168.2.3","216.58.197.4","TLSv1.2","212","Application Data"
"181","2018-08-23 03:02:41.109708","192.168.2.3","216.58.197.4","TCP","1434","34325  >  443 [ACK] Seq=111985 Ack=1137 Win=661 Len=1368 TSval=8204320 TSecr=601391032 [TCP segment of a reassembled PDU]"
"182","2018-08-23 03:02:41.109710","192.168.2.3","216.58.197.4","TLSv1.2","155","Application Data"
"186","2018-08-23 03:02:41.198534","192.168.2.3","216.58.197.4","TCP","1434","34325  >  443 [ACK] Seq=113442 Ack=1137 Win=661 Len=1368 TSval=8204328 TSecr=601391168 [TCP segment of a reassembled PDU]"
"187","2018-08-23 03:02:41.198815","192.168.2.3","216.58.197.4","TCP","1434","34325  >  443 [ACK] Seq=114810 Ack=1137 Win=661 Len=1368 TSval=8204328 TSecr=601391168 [TCP segment of a reassembled PDU]"
"188","2018-08-23 03:02:41.198817","192.168.2.3","216.58.197.4","TLSv1.2","212","Application Data"
"189","2018-08-23 03:02:41.199162","192.168.2.3","216.58.197.4","TCP","1434","34325  >  443 [ACK] Seq=116324 Ack=1137 Win=661 Len=1368 TSval=8204328 TSecr=601391168 [TCP segment of a reassembled PDU]"
"190","2018-08-23 03:02:41.199165","192.168.2.3","216.58.197.4","TLSv1.2","155","Application Data"
"194","2018-08-23 03:02:41.284255","192.168.2.3","216.58.197.4","TCP","1434","34325  >  443 [ACK] Seq=117781 Ack=1137 Win=661 Len=1368 TSval=8204336 TSecr=601391217 [TCP segment of a reassembled PDU]"
"195","2018-08-23 03:02:41.284260","192.168.2.3","216.58.197.4","TCP","1434","34325  >  443 [ACK] Seq=119149 Ack=1137 Win=661 Len=1368 TSval=8204336 TSecr=601391217 [TCP segment of a reassembled PDU]"
"196","2018-08-23 03:02:41.284356","192.168.2.3","216.58.197.4","TLSv1.2","212","Application Data"
"197","2018-08-23 03:02:41.284666","192.168.2.3","216.58.197.4","TCP","1434","34325  >  443 [ACK] Seq=120663 Ack=1137 Win=661 Len=1368 TSval=8204336 TSecr=601391217 [TCP segment of a reassembled PDU]"
"198","2018-08-23 03:02:41.284668","192.168.2.3","216.58.197.4","TLSv1.2","155","Application Data"
"204","2018-08-23 03:02:41.343964","192.168.2.3","216.58.197.4","TCP","66","34325  >  443 [ACK] Seq=122120 Ack=1436 Win=661 Len=0 TSval=8204343 TSecr=601391356"
"205","2018-08-23 03:02:41.343967","192.168.2.3","216.58.197.4","TCP","66","34325  >  443 [ACK] Seq=122120 Ack=1601 Win=661 Len=0 TSval=8204343 TSecr=601391356"
"206","2018-08-23 03:02:41.356291","192.168.2.3","216.58.197.4","TCP","1434","34325  >  443 [ACK] Seq=122120 Ack=1601 Win=661 Len=1368 TSval=8204344 TSecr=601391356 [TCP segment of a reassembled PDU]"
"207","2018-08-23 03:02:41.356775","192.168.2.3","216.58.197.4","TCP","1434","34325  >  443 [ACK] Seq=123488 Ack=1601 Win=661 Len=1368 TSval=8204344 TSecr=601391356 [TCP segment of a reassembled PDU]"
"208","2018-08-23 03:02:41.356778","192.168.2.3","216.58.197.4","TLSv1.2","212","Application Data"
"209","2018-08-23 03:02:41.357207","192.168.2.3","216.58.197.4","TCP","1434","34325  >  443 [ACK] Seq=125002 Ack=1601 Win=661 Len=1368 TSval=8204344 TSecr=601391356 [TCP segment of a reassembled PDU]"
"210","2018-08-23 03:02:41.357210","192.168.2.3","216.58.197.4","TLSv1.2","155","Application Data"
"215","2018-08-23 03:02:41.453068","192.168.2.3","216.58.197.4","TCP","1434","34325  >  443 [ACK] Seq=126459 Ack=1779 Win=661 Len=1368 TSval=8204354 TSecr=601391460 [TCP segment of a reassembled PDU]"
"216","2018-08-23 03:02:41.453632","192.168.2.3","216.58.197.4","TCP","1434","34325  >  443 [ACK] Seq=127827 Ack=1779 Win=661 Len=1368 TSval=8204354 TSecr=601391460 [TCP segment of a reassembled PDU]"
"217","2018-08-23 03:02:41.453636","192.168.2.3","216.58.197.4","TLSv1.2","212","Application Data"
"218","2018-08-23 03:02:41.453637","192.168.2.3","216.58.197.4","TCP","1434","34325  >  443 [ACK] Seq=129341 Ack=1779 Win=661 Len=1368 TSval=8204354 TSecr=601391460 [TCP segment of a reassembled PDU]"
"219","2018-08-23 03:02:41.453765","192.168.2.3","216.58.197.4","TLSv1.2","155","Application Data"
"224","2018-08-23 03:02:41.503113","192.168.2.3","216.58.197.4","TCP","66","34325  >  443 [ACK] Seq=130798 Ack=2067 Win=661 Len=0 TSval=8204359 TSecr=601391472"
"227","2018-08-23 03:02:41.507466","192.168.2.3","216.58.197.4","TCP","66","34325  >  443 [ACK] Seq=130798 Ack=2367 Win=661 Len=0 TSval=8204359 TSecr=601391518"
"228","2018-08-23 03:02:41.507728","192.168.2.3","216.58.197.4","TCP","66","34325  >  443 [ACK] Seq=130798 Ack=2517 Win=661 Len=0 TSval=8204359 TSecr=601391518"
"231","2018-08-23 03:02:41.519053","192.168.2.3","216.58.197.4","TCP","66","34325  >  443 [ACK] Seq=130798 Ack=2941 Win=661 Len=0 TSval=8204361 TSecr=601391531"
"232","2018-08-23 03:02:41.548198","192.168.2.3","216.58.197.4","TCP","1434","34325  >  443 [ACK] Seq=130798 Ack=2941 Win=661 Len=1368 TSval=8204363 TSecr=601391531 [TCP segment of a reassembled PDU]"
"233","2018-08-23 03:02:41.548615","192.168.2.3","216.58.197.4","TCP","1434","34325  >  443 [ACK] Seq=132166 Ack=2941 Win=661 Len=1368 TSval=8204363 TSecr=601391531 [TCP segment of a reassembled PDU]"
"234","2018-08-23 03:02:41.548618","192.168.2.3","216.58.197.4","TLSv1.2","212","Application Data"
"235","2018-08-23 03:02:41.548914","192.168.2.3","216.58.197.4","TCP","1434","34325  >  443 [ACK] Seq=133680 Ack=2941 Win=661 Len=1368 TSval=8204363 TSecr=601391531 [TCP segment of a reassembled PDU]"
"236","2018-08-23 03:02:41.548916","192.168.2.3","216.58.197.4","TLSv1.2","155","Application Data"
"240","2018-08-23 03:02:41.642754","192.168.2.3","216.58.197.4","TCP","1434","34325  >  443 [ACK] Seq=135137 Ack=2941 Win=661 Len=1368 TSval=8204373 TSecr=601391608 [TCP segment of a reassembled PDU]"
"241","2018-08-23 03:02:41.643215","192.168.2.3","216.58.197.4","TCP","1434","34325  >  443 [ACK] Seq=136505 Ack=2941 Win=661 Len=1368 TSval=8204373 TSecr=601391608 [TCP segment of a reassembled PDU]"
"242","2018-08-23 03:02:41.643217","192.168.2.3","216.58.197.4","TLSv1.2","212","Application Data"
"243","2018-08-23 03:02:41.643218","192.168.2.3","216.58.197.4","TCP","1434","34325  >  443 [ACK] Seq=138019 Ack=2941 Win=661 Len=1368 TSval=8204373 TSecr=601391608 [TCP segment of a reassembled PDU]"
"244","2018-08-23 03:02:41.643219","192.168.2.3","216.58.197.4","TLSv1.2","155","Application Data"
"248","2018-08-23 03:02:41.687771","192.168.2.3","216.58.197.4","TCP","66","34325  >  443 [ACK] Seq=139476 Ack=3076 Win=661 Len=0 TSval=8204377 TSecr=601391659"
"251","2018-08-23 03:02:41.708287","192.168.2.3","216.58.197.4","TCP","66","34325  >  443 [ACK] Seq=139476 Ack=3449 Win=661 Len=0 TSval=8204379 TSecr=601391716"
"252","2018-08-23 03:02:41.742695","192.168.2.3","216.58.197.4","TCP","1434","34325  >  443 [ACK] Seq=139476 Ack=3449 Win=661 Len=1368 TSval=8204383 TSecr=601391716 [TCP segment of a reassembled PDU]"
"253","2018-08-23 03:02:41.742933","192.168.2.3","216.58.197.4","TCP","1434","34325  >  443 [ACK] Seq=140844 Ack=3449 Win=661 Len=1368 TSval=8204383 TSecr=601391716 [TCP segment of a reassembled PDU]"
"254","2018-08-23 03:02:41.742938","192.168.2.3","216.58.197.4","TLSv1.2","212","Application Data"
"255","2018-08-23 03:02:41.743430","192.168.2.3","216.58.197.4","TCP","1434","34325  >  443 [ACK] Seq=142358 Ack=3449 Win=661 Len=1368 TSval=8204383 TSecr=601391716 [TCP segment of a reassembled PDU]"
"256","2018-08-23 03:02:41.743433","192.168.2.3","216.58.197.4","TLSv1.2","155","Application Data"
"262","2018-08-23 03:02:41.802891","192.168.2.3","216.58.197.4","TCP","66","34325  >  443 [ACK] Seq=143815 Ack=3926 Win=661 Len=0 TSval=8204389 TSecr=601391815"
"263","2018-08-23 03:02:41.813543","192.168.2.3","216.58.197.4","TCP","1434","34325  >  443 [ACK] Seq=143815 Ack=3926 Win=661 Len=1368 TSval=8204390 TSecr=601391815 [TCP segment of a reassembled PDU]"
"264","2018-08-23 03:02:41.813833","192.168.2.3","216.58.197.4","TCP","1434","34325  >  443 [ACK] Seq=145183 Ack=3926 Win=661 Len=1368 TSval=8204390 TSecr=601391815 [TCP segment of a reassembled PDU]"
"265","2018-08-23 03:02:41.813849","192.168.2.3","216.58.197.4","TLSv1.2","212","Application Data"
"266","2018-08-23 03:02:41.813850","192.168.2.3","216.58.197.4","TCP","1434","34325  >  443 [ACK] Seq=146697 Ack=3926 Win=661 Len=1368 TSval=8204390 TSecr=601391815 [TCP segment of a reassembled PDU]"
"267","2018-08-23 03:02:41.813956","192.168.2.3","216.58.197.4","TLSv1.2","155","Application Data"
"273","2018-08-23 03:02:41.891082","192.168.2.3","216.58.197.4","TCP","66","34325  >  443 [ACK] Seq=148154 Ack=4343 Win=661 Len=0 TSval=8204397 TSecr=601391901"
"274","2018-08-23 03:02:41.900401","192.168.2.3","216.58.197.4","TCP","1434","34325  >  443 [ACK] Seq=148154 Ack=4343 Win=661 Len=1368 TSval=8204399 TSecr=601391901 [TCP segment of a reassembled PDU]"
"275","2018-08-23 03:02:41.900878","192.168.2.3","216.58.197.4","TCP","1434","34325  >  443 [ACK] Seq=149522 Ack=4343 Win=661 Len=1368 TSval=8204399 TSecr=601391901 [TCP segment of a reassembled PDU]"
"276","2018-08-23 03:02:41.900883","192.168.2.3","216.58.197.4","TLSv1.2","212","Application Data"
"277","2018-08-23 03:02:41.900884","192.168.2.3","216.58.197.4","TCP","1434","34325  >  443 [ACK] Seq=151036 Ack=4343 Win=661 Len=1368 TSval=8204399 TSecr=601391901 [TCP segment of a reassembled PDU]"
"278","2018-08-23 03:02:41.900993","192.168.2.3","216.58.197.4","TLSv1.2","155","Application Data"
"284","2018-08-23 03:02:41.962282","192.168.2.3","216.58.197.4","TCP","66","34325  >  443 [ACK] Seq=152493 Ack=4602 Win=661 Len=0 TSval=8204405 TSecr=601391973"
"285","2018-08-23 03:02:42.002212","192.168.2.3","216.58.197.4","TCP","1434","34325  >  443 [ACK] Seq=152493 Ack=4602 Win=661 Len=1368 TSval=8204409 TSecr=601391973 [TCP segment of a reassembled PDU]"
"286","2018-08-23 03:02:42.002507","192.168.2.3","216.58.197.4","TCP","1434","34325  >  443 [ACK] Seq=153861 Ack=4602 Win=661 Len=1368 TSval=8204409 TSecr=601391973 [TCP segment of a reassembled PDU]"
"287","2018-08-23 03:02:42.002509","192.168.2.3","216.58.197.4","TLSv1.2","212","Application Data"
"288","2018-08-23 03:02:42.002848","192.168.2.3","216.58.197.4","TCP","1434","34325  >  443 [ACK] Seq=155375 Ack=4602 Win=661 Len=1368 TSval=8204409 TSecr=601391973 [TCP segment of a reassembled PDU]"
"289","2018-08-23 03:02:42.002850","192.168.2.3","216.58.197.4","TLSv1.2","155","Application Data"
"295","2018-08-23 03:02:42.055145","192.168.2.3","216.58.197.4","TCP","66","34325  >  443 [ACK] Seq=156832 Ack=4904 Win=661 Len=0 TSval=8204414 TSecr=601392067"
"296","2018-08-23 03:02:42.069698","192.168.2.3","216.58.197.4","TCP","1434","34325  >  443 [ACK] Seq=156832 Ack=4904 Win=661 Len=1368 TSval=8204416 TSecr=601392067 [TCP segment of a reassembled PDU]"
"297","2018-08-23 03:02:42.070080","192.168.2.3","216.58.197.4","TCP","1434","34325  >  443 [ACK] Seq=158200 Ack=4904 Win=661 Len=1368 TSval=8204416 TSecr=601392067 [TCP segment of a reassembled PDU]"
"298","2018-08-23 03:02:42.070083","192.168.2.3","216.58.197.4","TLSv1.2","212","Application Data"
"299","2018-08-23 03:02:42.070390","192.168.2.3","216.58.197.4","TCP","1434","34325  >  443 [ACK] Seq=159714 Ack=4904 Win=661 Len=1368 TSval=8204416 TSecr=601392067 [TCP segment of a reassembled PDU]"
"300","2018-08-23 03:02:42.070393","192.168.2.3","216.58.197.4","TLSv1.2","155","Application Data"
"304","2018-08-23 03:02:42.154967","192.168.2.3","216.58.197.4","TCP","1434","34325  >  443 [ACK] Seq=161171 Ack=4904 Win=661 Len=1368 TSval=8204424 TSecr=601392089 [TCP segment of a reassembled PDU]"
"305","2018-08-23 03:02:42.155420","192.168.2.3","216.58.197.4","TCP","1434","34325  >  443 [ACK] Seq=162539 Ack=4904 Win=661 Len=1368 TSval=8204424 TSecr=601392089 [TCP segment of a reassembled PDU]"
"306","2018-08-23 03:02:42.155422","192.168.2.3","216.58.197.4","TLSv1.2","212","Application Data"
"307","2018-08-23 03:02:42.155423","192.168.2.3","216.58.197.4","TCP","1434","34325  >  443 [ACK] Seq=164053 Ack=4904 Win=661 Len=1368 TSval=8204424 TSecr=601392089 [TCP segment of a reassembled PDU]"
"308","2018-08-23 03:02:42.155786","192.168.2.3","216.58.197.4","TLSv1.2","155","Application Data"
"314","2018-08-23 03:02:42.210104","192.168.2.3","216.58.197.4","TCP","66","34325  >  443 [ACK] Seq=165510 Ack=5369 Win=661 Len=0 TSval=8204430 TSecr=601392223"
"315","2018-08-23 03:02:42.252393","192.168.2.3","216.58.197.4","TCP","1434","34325  >  443 [ACK] Seq=165510 Ack=5369 Win=661 Len=1368 TSval=8204434 TSecr=601392223 [TCP segment of a reassembled PDU]"
"316","2018-08-23 03:02:42.252398","192.168.2.3","216.58.197.4","TCP","1434","34325  >  443 [ACK] Seq=166878 Ack=5369 Win=661 Len=1368 TSval=8204434 TSecr=601392223 [TCP segment of a reassembled PDU]"
"317","2018-08-23 03:02:42.252399","192.168.2.3","216.58.197.4","TLSv1.2","212","Application Data"
"318","2018-08-23 03:02:42.252708","192.168.2.3","216.58.197.4","TCP","1434","34325  >  443 [ACK] Seq=168392 Ack=5369 Win=661 Len=1368 TSval=8204434 TSecr=601392223 [TCP segment of a reassembled PDU]"
"319","2018-08-23 03:02:42.252710","192.168.2.3","216.58.197.4","TLSv1.2","155","Application Data"
"324","2018-08-23 03:02:42.338990","192.168.2.3","216.58.197.4","TCP","66","34325  >  443 [ACK] Seq=169849 Ack=5974 Win=661 Len=0 TSval=8204443 TSecr=601392351"
"325","2018-08-23 03:02:42.348365","192.168.2.3","216.58.197.4","TCP","1434","34325  >  443 [ACK] Seq=169849 Ack=5974 Win=661 Len=1368 TSval=8204443 TSecr=601392351 [TCP segment of a reassembled PDU]"
"326","2018-08-23 03:02:42.348644","192.168.2.3","216.58.197.4","TCP","1434","34325  >  443 [ACK] Seq=171217 Ack=5974 Win=661 Len=1368 TSval=8204443 TSecr=601392351 [TCP segment of a reassembled PDU]"
"327","2018-08-23 03:02:42.348646","192.168.2.3","216.58.197.4","TLSv1.2","212","Application Data"
"328","2018-08-23 03:02:42.349201","192.168.2.3","216.58.197.4","TCP","1434","34325  >  443 [ACK] Seq=172731 Ack=5974 Win=661 Len=1368 TSval=8204443 TSecr=601392351 [TCP segment of a reassembled PDU]"
"329","2018-08-23 03:02:42.349204","192.168.2.3","216.58.197.4","TLSv1.2","155","Application Data"
"333","2018-08-23 03:02:42.389070","192.168.2.3","104.199.240.211","TCP","66","48867  >  443 [ACK] Seq=1 Ack=1 Win=486 Len=0 TSval=8204448 TSecr=301901448"
"336","2018-08-23 03:02:42.454087","192.168.2.3","216.58.197.4","TCP","1434","34325  >  443 [ACK] Seq=174188 Ack=6084 Win=661 Len=1368 TSval=8204454 TSecr=601392460 [TCP segment of a reassembled PDU]"
"337","2018-08-23 03:02:42.457283","192.168.2.3","216.58.197.4","TCP","1434","34325  >  443 [ACK] Seq=175556 Ack=6084 Win=661 Len=1368 TSval=8204454 TSecr=601392460 [TCP segment of a reassembled PDU]"
"338","2018-08-23 03:02:42.457287","192.168.2.3","216.58.197.4","TLSv1.2","212","Application Data"
"339","2018-08-23 03:02:42.457288","192.168.2.3","216.58.197.4","TCP","1434","34325  >  443 [ACK] Seq=177070 Ack=6084 Win=661 Len=1368 TSval=8204454 TSecr=601392460 [TCP segment of a reassembled PDU]"
"340","2018-08-23 03:02:42.457289","192.168.2.3","216.58.197.4","TLSv1.2","155","Application Data"
"345","2018-08-23 03:02:42.501493","192.168.2.3","216.58.197.4","TCP","66","34325  >  443 [ACK] Seq=178527 Ack=6161 Win=661 Len=0 TSval=8204459 TSecr=601392472"
"346","2018-08-23 03:02:42.549528","192.168.2.3","216.58.197.4","TCP","1434","34325  >  443 [ACK] Seq=178527 Ack=6161 Win=661 Len=1368 TSval=8204464 TSecr=601392472 [TCP segment of a reassembled PDU]"
"347","2018-08-23 03:02:42.549833","192.168.2.3","216.58.197.4","TCP","1434","34325  >  443 [ACK] Seq=179895 Ack=6161 Win=661 Len=1368 TSval=8204464 TSecr=601392472 [TCP segment of a reassembled PDU]"
"348","2018-08-23 03:02:42.549835","192.168.2.3","216.58.197.4","TLSv1.2","212","Application Data"
"349","2018-08-23 03:02:42.550400","192.168.2.3","216.58.197.4","TCP","1434","34325  >  443 [ACK] Seq=181409 Ack=6161 Win=661 Len=1368 TSval=8204464 TSecr=601392472 [TCP segment of a reassembled PDU]"
"350","2018-08-23 03:02:42.550403","192.168.2.3","216.58.197.4","TLSv1.2","155","Application Data"
"355","2018-08-23 03:02:42.569877","192.168.2.3","216.58.197.4","TCP","66","34325  >  443 [ACK] Seq=182866 Ack=6364 Win=661 Len=0 TSval=8204466 TSecr=601392581"
"358","2018-08-23 03:02:42.610121","192.168.2.3","216.58.197.4","TCP","66","34325  >  443 [ACK] Seq=182866 Ack=6634 Win=661 Len=0 TSval=8204470 TSecr=601392621"
"359","2018-08-23 03:02:42.648714","192.168.2.3","216.58.197.4","TCP","1434","34325  >  443 [ACK] Seq=182866 Ack=6634 Win=661 Len=1368 TSval=8204473 TSecr=601392621 [TCP segment of a reassembled PDU]"
"360","2018-08-23 03:02:42.649055","192.168.2.3","216.58.197.4","TCP","1434","34325  >  443 [ACK] Seq=184234 Ack=6634 Win=661 Len=1368 TSval=8204473 TSecr=601392621 [TCP segment of a reassembled PDU]"
"361","2018-08-23 03:02:42.649057","192.168.2.3","216.58.197.4","TLSv1.2","212","Application Data"
"362","2018-08-23 03:02:42.649203","192.168.2.3","216.58.197.4","TCP","1434","34325  >  443 [ACK] Seq=185748 Ack=6634 Win=661 Len=1368 TSval=8204473 TSecr=601392621 [TCP segment of a reassembled PDU]"
"363","2018-08-23 03:02:42.649205","192.168.2.3","216.58.197.4","TLSv1.2","155","Application Data"
"367","2018-08-23 03:02:42.765222","192.168.2.3","216.58.197.4","TCP","1434","34325  >  443 [ACK] Seq=187205 Ack=6634 Win=661 Len=1368 TSval=8204485 TSecr=601392708 [TCP segment of a reassembled PDU]"
"368","2018-08-23 03:02:42.765227","192.168.2.3","216.58.197.4","TCP","1434","34325  >  443 [ACK] Seq=188573 Ack=6634 Win=661 Len=1368 TSval=8204485 TSecr=601392708 [TCP segment of a reassembled PDU]"
"369","2018-08-23 03:02:42.765228","192.168.2.3","216.58.197.4","TLSv1.2","212","Application Data"
"370","2018-08-23 03:02:42.765581","192.168.2.3","216.58.197.4","TCP","1434","34325  >  443 [ACK] Seq=190087 Ack=6634 Win=661 Len=1368 TSval=8204485 TSecr=601392708 [TCP segment of a reassembled PDU]"
"371","2018-08-23 03:02:42.765585","192.168.2.3","216.58.197.4","TLSv1.2","155","Application Data"
"374","2018-08-23 03:02:42.860200","192.168.2.3","216.58.197.4","TCP","1434","34325  >  443 [ACK] Seq=191544 Ack=6634 Win=661 Len=1368 TSval=8204495 TSecr=601392784 [TCP segment of a reassembled PDU]"
"375","2018-08-23 03:02:42.860639","192.168.2.3","216.58.197.4","TCP","1434","34325  >  443 [ACK] Seq=192912 Ack=6634 Win=661 Len=1368 TSval=8204495 TSecr=601392784 [TCP segment of a reassembled PDU]"
"376","2018-08-23 03:02:42.860642","192.168.2.3","216.58.197.4","TLSv1.2","212","Application Data"
"377","2018-08-23 03:02:42.860643","192.168.2.3","216.58.197.4","TCP","1434","34325  >  443 [ACK] Seq=194426 Ack=6634 Win=661 Len=1368 TSval=8204495 TSecr=601392784 [TCP segment of a reassembled PDU]"
"378","2018-08-23 03:02:42.860644","192.168.2.3","216.58.197.4","TLSv1.2","155","Application Data"
"384","2018-08-23 03:02:42.920025","192.168.2.3","216.58.197.4","TCP","66","34325  >  443 [ACK] Seq=195883 Ack=6949 Win=661 Len=0 TSval=8204501 TSecr=601392932"
"385","2018-08-23 03:02:42.963585","192.168.2.3","35.186.224.46","TLSv1.2","108","Application Data"
"386","2018-08-23 03:02:42.964004","192.168.2.3","216.58.197.4","TCP","1434","34325  >  443 [ACK] Seq=195883 Ack=6949 Win=661 Len=1368 TSval=8204505 TSecr=601392932 [TCP segment of a reassembled PDU]"
"387","2018-08-23 03:02:42.964007","192.168.2.3","216.58.197.4","TCP","1434","34325  >  443 [ACK] Seq=197251 Ack=6949 Win=661 Len=1368 TSval=8204505 TSecr=601392932 [TCP segment of a reassembled PDU]"
"388","2018-08-23 03:02:42.964008","192.168.2.3","216.58.197.4","TLSv1.2","212","Application Data"
"389","2018-08-23 03:02:42.964177","192.168.2.3","216.58.197.4","TCP","1434","34325  >  443 [ACK] Seq=198765 Ack=6949 Win=661 Len=1368 TSval=8204505 TSecr=601392932 [TCP segment of a reassembled PDU]"
"390","2018-08-23 03:02:42.964324","192.168.2.3","216.58.197.4","TLSv1.2","85","Application Data"
"395","2018-08-23 03:02:43.020306","192.168.2.3","35.186.224.46","TCP","66","49072  >  443 [ACK] Seq=43 Ack=40 Win=1643 Len=0 TSval=8204511 TSecr=3643264426"
"396","2018-08-23 03:02:43.054524","192.168.2.3","216.58.197.4","TCP","1434","34325  >  443 [ACK] Seq=200152 Ack=6949 Win=661 Len=1368 TSval=8204514 TSecr=601392982 [TCP segment of a reassembled PDU]"
"397","2018-08-23 03:02:43.054869","192.168.2.3","216.58.197.4","TCP","1434","34325  >  443 [ACK] Seq=201520 Ack=6949 Win=661 Len=1368 TSval=8204514 TSecr=601392982 [TCP segment of a reassembled PDU]"
"398","2018-08-23 03:02:43.054872","192.168.2.3","216.58.197.4","TLSv1.2","212","Application Data"
"399","2018-08-23 03:02:43.055329","192.168.2.3","216.58.197.4","TCP","1434","34325  >  443 [ACK] Seq=203034 Ack=6949 Win=661 Len=1368 TSval=8204514 TSecr=601392982 [TCP segment of a reassembled PDU]"
"400","2018-08-23 03:02:43.055331","192.168.2.3","216.58.197.4","TLSv1.2","155","Application Data"
"406","2018-08-23 03:02:43.105443","192.168.2.3","216.58.197.4","TCP","66","34325  >  443 [ACK] Seq=204491 Ack=7214 Win=661 Len=0 TSval=8204519 TSecr=601393118"
"407","2018-08-23 03:02:43.134885","192.168.2.3","216.58.197.4","TCP","1434","34325  >  443 [ACK] Seq=204491 Ack=7214 Win=661 Len=1368 TSval=8204522 TSecr=601393118 [TCP segment of a reassembled PDU]"
"408","2018-08-23 03:02:43.135312","192.168.2.3","216.58.197.4","TCP","1434","34325  >  443 [ACK] Seq=205859 Ack=7214 Win=661 Len=1368 TSval=8204522 TSecr=601393118 [TCP segment of a reassembled PDU]"
"409","2018-08-23 03:02:43.135315","192.168.2.3","216.58.197.4","TLSv1.2","212","Application Data"
"410","2018-08-23 03:02:43.135689","192.168.2.3","216.58.197.4","TLSv1.2","1074","Application Data"
"411","2018-08-23 03:02:43.135692","192.168.2.3","216.58.197.4","TLSv1.2","102","Application Data"
"418","2018-08-23 03:02:43.161420","192.168.2.3","216.58.197.4","TCP","66","34325  >  443 [ACK] Seq=208417 Ack=8058 Win=661 Len=0 TSval=8204525 TSecr=601393172"
"419","2018-08-23 03:02:43.428950","192.168.2.3","216.58.197.3","TCP","66","43448  >  443 [ACK] Seq=1 Ack=1 Win=406 Len=0 TSval=8204552 TSecr=3996633712"
"423","2018-08-23 03:02:43.465903","192.168.2.3","216.58.197.4","TCP","66","34325  >  443 [ACK] Seq=208417 Ack=8219 Win=661 Len=0 TSval=8204555 TSecr=601393460"
"437","2018-08-23 03:02:43.791077","192.168.2.3","216.58.197.4","TCP","66","34325  >  443 [ACK] Seq=208417 Ack=8513 Win=661 Len=0 TSval=8204586 TSecr=601393749"
"440","2018-08-23 03:02:43.811066","192.168.2.3","216.58.197.4","TCP","66","34325  >  443 [ACK] Seq=208417 Ack=9931 Win=650 Len=0 TSval=8204589 TSecr=601393789"
"441","2018-08-23 03:02:43.811082","192.168.2.3","216.58.197.4","TCP","66","34325  >  443 [ACK] Seq=208417 Ack=10437 Win=650 Len=0 TSval=8204589 TSecr=601393789"
"442","2018-08-23 03:02:43.811083","192.168.2.3","216.58.197.4","TCP","66","34325  >  443 [ACK] Seq=208417 Ack=12182 Win=650 Len=0 TSval=8204590 TSecr=601393789"
