"No.","Time","Source","Destination","Protocol","Length","Info"
"20","2018-08-23 03:07:16.882669","192.168.2.3","216.58.197.4","TLSv1.2","156","Application Data"
"21","2018-08-23 03:07:16.882673","192.168.2.3","216.58.197.4","TLSv1.2","104","Application Data"
"22","2018-08-23 03:07:16.883676","192.168.2.3","216.58.197.4","TLSv1.2","158","Application Data"
"26","2018-08-23 03:07:16.895419","192.168.2.3","216.58.197.4","TCP","1434","34325  >  443 [ACK] Seq=221 Ack=39 Win=661 Len=1368 TSval=8231898 TSecr=601666899 [TCP segment of a reassembled PDU]"
"27","2018-08-23 03:07:16.895422","192.168.2.3","216.58.197.4","TCP","1434","34325  >  443 [ACK] Seq=1589 Ack=39 Win=661 Len=1368 TSval=8231898 TSecr=601666899 [TCP segment of a reassembled PDU]"
"28","2018-08-23 03:07:16.895423","192.168.2.3","216.58.197.4","TLSv1.2","212","Application Data"
"29","2018-08-23 03:07:16.895942","192.168.2.3","216.58.197.4","TCP","1434","34325  >  443 [ACK] Seq=3103 Ack=39 Win=661 Len=1368 TSval=8231898 TSecr=601666899 [TCP segment of a reassembled PDU]"
"30","2018-08-23 03:07:16.895945","192.168.2.3","216.58.197.4","TLSv1.2","420","Application Data"
"31","2018-08-23 03:07:16.896341","192.168.2.3","216.58.197.4","TCP","1434","34325  >  443 [ACK] Seq=4825 Ack=39 Win=661 Len=1368 TSval=8231898 TSecr=601666899 [TCP segment of a reassembled PDU]"
"32","2018-08-23 03:07:16.896662","192.168.2.3","216.58.197.4","TCP","1434","34325  >  443 [ACK] Seq=6193 Ack=39 Win=661 Len=1368 TSval=8231898 TSecr=601666899 [TCP segment of a reassembled PDU]"
"33","2018-08-23 03:07:16.896664","192.168.2.3","216.58.197.4","TLSv1.2","212","Application Data"
"34","2018-08-23 03:07:16.896665","192.168.2.3","216.58.197.4","TCP","1434","34325  >  443 [ACK] Seq=7707 Ack=39 Win=661 Len=1368 TSval=8231898 TSecr=601666899 [TCP segment of a reassembled PDU]"
"40","2018-08-23 03:07:16.904797","192.168.2.3","216.58.197.4","TLSv1.2","1434","Application Data [TCP segment of a reassembled PDU]"
"41","2018-08-23 03:07:16.904800","192.168.2.3","216.58.197.4","TCP","1434","34325  >  443 [ACK] Seq=10443 Ack=39 Win=661 Len=1368 TSval=8231898 TSecr=601666912 [TCP segment of a reassembled PDU]"
"42","2018-08-23 03:07:16.905120","192.168.2.3","216.58.197.4","TLSv1.2","1434","Application Data [TCP segment of a reassembled PDU]"
"43","2018-08-23 03:07:16.905122","192.168.2.3","216.58.197.4","TLSv1.2","1434","Application Data [TCP segment of a reassembled PDU]"
"44","2018-08-23 03:07:16.905337","192.168.2.3","216.58.197.4","TCP","1434","34325  >  443 [ACK] Seq=14547 Ack=39 Win=661 Len=1368 TSval=8231898 TSecr=601666912 [TCP segment of a reassembled PDU]"
"45","2018-08-23 03:07:16.905583","192.168.2.3","216.58.197.4","TLSv1.2","1434","Application Data [TCP segment of a reassembled PDU]"
"46","2018-08-23 03:07:16.905806","192.168.2.3","216.58.197.4","TLSv1.2","1434","Application Data [TCP segment of a reassembled PDU]"
"47","2018-08-23 03:07:16.905810","192.168.2.3","216.58.197.4","TCP","1434","34325  >  443 [ACK] Seq=18651 Ack=39 Win=661 Len=1368 TSval=8231898 TSecr=601666912 [TCP segment of a reassembled PDU]"
"48","2018-08-23 03:07:16.905921","192.168.2.3","216.58.197.4","TLSv1.2","1434","Application Data [TCP segment of a reassembled PDU]"
"49","2018-08-23 03:07:16.906195","192.168.2.3","216.58.197.4","TLSv1.2","1434","Application Data [TCP segment of a reassembled PDU]"
"50","2018-08-23 03:07:16.906296","192.168.2.3","216.58.197.4","TCP","1434","34325  >  443 [ACK] Seq=22755 Ack=39 Win=661 Len=1368 TSval=8231898 TSecr=601666913 [TCP segment of a reassembled PDU]"
"51","2018-08-23 03:07:16.906420","192.168.2.3","216.58.197.4","TLSv1.2","1434","Application Data [TCP segment of a reassembled PDU]"
"52","2018-08-23 03:07:16.906612","192.168.2.3","216.58.197.4","TLSv1.2","1434","Application Data [TCP segment of a reassembled PDU]"
"53","2018-08-23 03:07:16.906769","192.168.2.3","216.58.197.4","TCP","1434","34325  >  443 [ACK] Seq=26859 Ack=39 Win=661 Len=1368 TSval=8231898 TSecr=601666913 [TCP segment of a reassembled PDU]"
"54","2018-08-23 03:07:16.906991","192.168.2.3","216.58.197.4","TLSv1.2","1434","Application Data [TCP segment of a reassembled PDU]"
"62","2018-08-23 03:07:16.913786","192.168.2.3","216.58.197.4","TLSv1.2","1434","Application Data [TCP segment of a reassembled PDU]"
"63","2018-08-23 03:07:16.913789","192.168.2.3","216.58.197.4","TCP","1434","34325  >  443 [ACK] Seq=30963 Ack=39 Win=661 Len=1368 TSval=8231899 TSecr=601666921 [TCP segment of a reassembled PDU]"
"64","2018-08-23 03:07:16.914078","192.168.2.3","216.58.197.4","TCP","1434","34325  >  443 [ACK] Seq=32331 Ack=39 Win=661 Len=1368 TSval=8231899 TSecr=601666921 [TCP segment of a reassembled PDU]"
"65","2018-08-23 03:07:16.914342","192.168.2.3","216.58.197.4","TLSv1.2","1434","Application Data [TCP segment of a reassembled PDU]"
"66","2018-08-23 03:07:16.914358","192.168.2.3","216.58.197.4","TLSv1.2","1434","Application Data [TCP segment of a reassembled PDU]"
"67","2018-08-23 03:07:16.915634","192.168.2.3","216.58.197.4","TCP","1434","34325  >  443 [ACK] Seq=36435 Ack=39 Win=661 Len=1368 TSval=8231899 TSecr=601666921 [TCP segment of a reassembled PDU]"
"68","2018-08-23 03:07:16.915856","192.168.2.3","216.58.197.4","TLSv1.2","1434","Application Data [TCP segment of a reassembled PDU]"
"69","2018-08-23 03:07:16.916010","192.168.2.3","216.58.197.4","TLSv1.2","1434","Application Data [TCP segment of a reassembled PDU]"
"70","2018-08-23 03:07:16.916182","192.168.2.3","216.58.197.4","TCP","1434","34325  >  443 [ACK] Seq=40539 Ack=39 Win=661 Len=1368 TSval=8231899 TSecr=601666922 [TCP segment of a reassembled PDU]"
"71","2018-08-23 03:07:16.916481","192.168.2.3","216.58.197.4","TLSv1.2","1434","Application Data [TCP segment of a reassembled PDU]"
"72","2018-08-23 03:07:16.916484","192.168.2.3","216.58.197.4","TLSv1.2","1434","Application Data [TCP segment of a reassembled PDU]"
"73","2018-08-23 03:07:16.916485","192.168.2.3","216.58.197.4","TCP","1434","34325  >  443 [ACK] Seq=44643 Ack=39 Win=661 Len=1368 TSval=8231899 TSecr=601666922 [TCP segment of a reassembled PDU]"
"74","2018-08-23 03:07:16.916631","192.168.2.3","216.58.197.4","TLSv1.2","1434","Application Data [TCP segment of a reassembled PDU]"
"75","2018-08-23 03:07:16.916800","192.168.2.3","216.58.197.4","TLSv1.2","1434","Application Data [TCP segment of a reassembled PDU]"
"76","2018-08-23 03:07:16.916982","192.168.2.3","216.58.197.4","TCP","1434","34325  >  443 [ACK] Seq=48747 Ack=39 Win=661 Len=1368 TSval=8231899 TSecr=601666922 [TCP segment of a reassembled PDU]"
"77","2018-08-23 03:07:16.917129","192.168.2.3","216.58.197.4","TLSv1.2","1434","Application Data [TCP segment of a reassembled PDU]"
"78","2018-08-23 03:07:16.917294","192.168.2.3","216.58.197.4","TLSv1.2","1434","Application Data [TCP segment of a reassembled PDU]"
"79","2018-08-23 03:07:16.917664","192.168.2.3","216.58.197.4","TCP","1434","34325  >  443 [ACK] Seq=52851 Ack=39 Win=661 Len=1368 TSval=8231899 TSecr=601666923 [TCP segment of a reassembled PDU]"
"80","2018-08-23 03:07:16.917665","192.168.2.3","216.58.197.4","TLSv1.2","1434","Application Data [TCP segment of a reassembled PDU]"
"81","2018-08-23 03:07:16.918006","192.168.2.3","216.58.197.4","TLSv1.2","1434","Application Data [TCP segment of a reassembled PDU]"
"85","2018-08-23 03:07:16.919770","192.168.2.3","216.58.197.4","TCP","1434","34325  >  443 [ACK] Seq=56955 Ack=39 Win=661 Len=1368 TSval=8231900 TSecr=601666930 [TCP segment of a reassembled PDU]"
"88","2018-08-23 03:07:16.920332","192.168.2.3","216.58.197.4","TCP","1434","34325  >  443 [ACK] Seq=58323 Ack=39 Win=661 Len=1368 TSval=8231900 TSecr=601666930 [TCP segment of a reassembled PDU]"
"91","2018-08-23 03:07:16.921365","192.168.2.3","216.58.197.4","TLSv1.2","1434","Application Data [TCP segment of a reassembled PDU]"
"93","2018-08-23 03:07:16.921571","192.168.2.3","216.58.197.4","TLSv1.2","1434","Application Data, Application Data"
"94","2018-08-23 03:07:16.921573","192.168.2.3","216.58.197.4","TCP","1434","34325  >  443 [ACK] Seq=62427 Ack=39 Win=661 Len=1368 TSval=8231900 TSecr=601666930 [TCP segment of a reassembled PDU]"
"95","2018-08-23 03:07:16.921790","192.168.2.3","216.58.197.4","TLSv1.2","1434","Application Data [TCP segment of a reassembled PDU]"
"97","2018-08-23 03:07:16.921905","192.168.2.3","216.58.197.4","TLSv1.2","1011","Application Data"
"99","2018-08-23 03:07:16.924148","192.168.2.3","216.58.197.4","TCP","1434","34325  >  443 [ACK] Seq=66108 Ack=39 Win=661 Len=1368 TSval=8231900 TSecr=601666934 [TCP segment of a reassembled PDU]"
"101","2018-08-23 03:07:16.924515","192.168.2.3","216.58.197.4","TCP","1434","34325  >  443 [ACK] Seq=67476 Ack=39 Win=661 Len=1368 TSval=8231901 TSecr=601666934 [TCP segment of a reassembled PDU]"
"102","2018-08-23 03:07:16.924517","192.168.2.3","216.58.197.4","TLSv1.2","212","Application Data"
"103","2018-08-23 03:07:16.925272","192.168.2.3","216.58.197.4","TCP","1434","34325  >  443 [ACK] Seq=68990 Ack=39 Win=661 Len=1368 TSval=8231901 TSecr=601666934 [TCP segment of a reassembled PDU]"
"104","2018-08-23 03:07:16.925274","192.168.2.3","216.58.197.4","TLSv1.2","155","Application Data"
"110","2018-08-23 03:07:17.030395","192.168.2.3","216.58.197.4","TCP","1434","34325  >  443 [ACK] Seq=70447 Ack=39 Win=661 Len=1368 TSval=8231910 TSecr=601666942 [TCP segment of a reassembled PDU]"
"111","2018-08-23 03:07:17.030399","192.168.2.3","216.58.197.4","TCP","1434","34325  >  443 [ACK] Seq=71815 Ack=39 Win=661 Len=1368 TSval=8231910 TSecr=601666942 [TCP segment of a reassembled PDU]"
"112","2018-08-23 03:07:17.030400","192.168.2.3","216.58.197.4","TLSv1.2","212","Application Data"
"113","2018-08-23 03:07:17.030513","192.168.2.3","216.58.197.4","TCP","1434","34325  >  443 [ACK] Seq=73329 Ack=39 Win=661 Len=1368 TSval=8231910 TSecr=601666942 [TCP segment of a reassembled PDU]"
"114","2018-08-23 03:07:17.030877","192.168.2.3","216.58.197.4","TLSv1.2","155","Application Data"
"118","2018-08-23 03:07:17.134779","192.168.2.3","216.58.197.4","TCP","66","34325  >  443 [ACK] Seq=74786 Ack=73 Win=661 Len=0 TSval=8231922 TSecr=601667107"
"119","2018-08-23 03:07:17.136892","192.168.2.3","216.58.197.4","TCP","1434","34325  >  443 [ACK] Seq=74786 Ack=73 Win=661 Len=1368 TSval=8231922 TSecr=601667107 [TCP segment of a reassembled PDU]"
"120","2018-08-23 03:07:17.137295","192.168.2.3","216.58.197.4","TCP","1434","34325  >  443 [ACK] Seq=76154 Ack=73 Win=661 Len=1368 TSval=8231922 TSecr=601667107 [TCP segment of a reassembled PDU]"
"121","2018-08-23 03:07:17.137298","192.168.2.3","216.58.197.4","TLSv1.2","212","Application Data"
"122","2018-08-23 03:07:17.137299","192.168.2.3","216.58.197.4","TCP","1434","34325  >  443 [ACK] Seq=77668 Ack=73 Win=661 Len=1368 TSval=8231922 TSecr=601667107 [TCP segment of a reassembled PDU]"
"123","2018-08-23 03:07:17.137405","192.168.2.3","216.58.197.4","TLSv1.2","155","Application Data"
"130","2018-08-23 03:07:17.208850","192.168.2.3","216.58.197.4","TCP","66","34325  >  443 [ACK] Seq=79125 Ack=301 Win=661 Len=0 TSval=8231929 TSecr=601667219"
"131","2018-08-23 03:07:17.210347","192.168.2.3","216.58.197.4","TCP","66","34325  >  443 [ACK] Seq=79125 Ack=558 Win=661 Len=0 TSval=8231929 TSecr=601667219"
"132","2018-08-23 03:07:17.212220","192.168.2.3","216.58.197.4","TCP","1434","34325  >  443 [ACK] Seq=79125 Ack=558 Win=661 Len=1368 TSval=8231929 TSecr=601667219 [TCP segment of a reassembled PDU]"
"133","2018-08-23 03:07:17.212569","192.168.2.3","216.58.197.4","TCP","1434","34325  >  443 [ACK] Seq=80493 Ack=558 Win=661 Len=1368 TSval=8231929 TSecr=601667219 [TCP segment of a reassembled PDU]"
"134","2018-08-23 03:07:17.212572","192.168.2.3","216.58.197.4","TLSv1.2","212","Application Data"
"135","2018-08-23 03:07:17.212573","192.168.2.3","216.58.197.4","TCP","1434","34325  >  443 [ACK] Seq=82007 Ack=558 Win=661 Len=1368 TSval=8231929 TSecr=601667219 [TCP segment of a reassembled PDU]"
"136","2018-08-23 03:07:17.212735","192.168.2.3","216.58.197.4","TLSv1.2","155","Application Data"
"139","2018-08-23 03:07:17.254109","192.168.2.3","216.58.197.4","TCP","66","34325  >  443 [ACK] Seq=83464 Ack=844 Win=661 Len=0 TSval=8231934 TSecr=601667228"
"141","2018-08-23 03:07:17.327489","192.168.2.3","216.58.197.4","TCP","1434","34325  >  443 [ACK] Seq=83464 Ack=844 Win=661 Len=1368 TSval=8231941 TSecr=601667269 [TCP segment of a reassembled PDU]"
"142","2018-08-23 03:07:17.328953","192.168.2.3","216.58.197.4","TCP","1434","34325  >  443 [ACK] Seq=84832 Ack=844 Win=661 Len=1368 TSval=8231941 TSecr=601667269 [TCP segment of a reassembled PDU]"
"143","2018-08-23 03:07:17.328956","192.168.2.3","216.58.197.4","TLSv1.2","212","Application Data"
"144","2018-08-23 03:07:17.328956","192.168.2.3","216.58.197.4","TCP","1434","34325  >  443 [ACK] Seq=86346 Ack=844 Win=661 Len=1368 TSval=8231941 TSecr=601667269 [TCP segment of a reassembled PDU]"
"145","2018-08-23 03:07:17.329128","192.168.2.3","216.58.197.4","TLSv1.2","155","Application Data"
"150","2018-08-23 03:07:17.409383","192.168.2.3","216.58.197.4","TCP","66","34325  >  443 [ACK] Seq=87803 Ack=1022 Win=661 Len=0 TSval=8231948 TSecr=601667412"
"151","2018-08-23 03:07:17.426747","192.168.2.3","216.58.197.4","TCP","1434","34325  >  443 [ACK] Seq=87803 Ack=1022 Win=661 Len=1368 TSval=8231951 TSecr=601667412 [TCP segment of a reassembled PDU]"
"152","2018-08-23 03:07:17.426751","192.168.2.3","216.58.197.4","TCP","1434","34325  >  443 [ACK] Seq=89171 Ack=1022 Win=661 Len=1368 TSval=8231951 TSecr=601667412 [TCP segment of a reassembled PDU]"
"153","2018-08-23 03:07:17.426980","192.168.2.3","216.58.197.4","TLSv1.2","212","Application Data"
"154","2018-08-23 03:07:17.426996","192.168.2.3","216.58.197.4","TCP","1434","34325  >  443 [ACK] Seq=90685 Ack=1022 Win=661 Len=1368 TSval=8231951 TSecr=601667412 [TCP segment of a reassembled PDU]"
"155","2018-08-23 03:07:17.427116","192.168.2.3","216.58.197.4","TLSv1.2","155","Application Data"
"157","2018-08-23 03:07:17.521754","192.168.2.3","216.58.197.4","TCP","1434","34325  >  443 [ACK] Seq=92142 Ack=1022 Win=661 Len=1368 TSval=8231960 TSecr=601667444 [TCP segment of a reassembled PDU]"
"158","2018-08-23 03:07:17.521759","192.168.2.3","216.58.197.4","TCP","1434","34325  >  443 [ACK] Seq=93510 Ack=1022 Win=661 Len=1368 TSval=8231960 TSecr=601667444 [TCP segment of a reassembled PDU]"
"159","2018-08-23 03:07:17.521760","192.168.2.3","216.58.197.4","TLSv1.2","212","Application Data"
"160","2018-08-23 03:07:17.521916","192.168.2.3","216.58.197.4","TCP","1434","34325  >  443 [ACK] Seq=95024 Ack=1022 Win=661 Len=1368 TSval=8231960 TSecr=601667444 [TCP segment of a reassembled PDU]"
"161","2018-08-23 03:07:17.522191","192.168.2.3","216.58.197.4","TLSv1.2","155","Application Data"
"166","2018-08-23 03:07:17.594215","192.168.2.3","216.58.197.4","TCP","66","34325  >  443 [ACK] Seq=96481 Ack=1274 Win=661 Len=0 TSval=8231968 TSecr=601667568"
"167","2018-08-23 03:07:17.616224","192.168.2.3","216.58.197.4","TCP","1434","34325  >  443 [ACK] Seq=96481 Ack=1274 Win=661 Len=1368 TSval=8231970 TSecr=601667568 [TCP segment of a reassembled PDU]"
"168","2018-08-23 03:07:17.616748","192.168.2.3","216.58.197.4","TCP","1434","34325  >  443 [ACK] Seq=97849 Ack=1274 Win=661 Len=1368 TSval=8231970 TSecr=601667568 [TCP segment of a reassembled PDU]"
"169","2018-08-23 03:07:17.616751","192.168.2.3","216.58.197.4","TLSv1.2","212","Application Data"
"170","2018-08-23 03:07:17.617243","192.168.2.3","216.58.197.4","TCP","1434","34325  >  443 [ACK] Seq=99363 Ack=1274 Win=661 Len=1368 TSval=8231970 TSecr=601667568 [TCP segment of a reassembled PDU]"
"171","2018-08-23 03:07:17.617245","192.168.2.3","216.58.197.4","TLSv1.2","155","Application Data"
"175","2018-08-23 03:07:17.712252","192.168.2.3","216.58.197.4","TCP","1434","34325  >  443 [ACK] Seq=100820 Ack=1274 Win=661 Len=1368 TSval=8231979 TSecr=601667673 [TCP segment of a reassembled PDU]"
"176","2018-08-23 03:07:17.712941","192.168.2.3","216.58.197.4","TCP","1434","34325  >  443 [ACK] Seq=102188 Ack=1274 Win=661 Len=1368 TSval=8231979 TSecr=601667673 [TCP segment of a reassembled PDU]"
"177","2018-08-23 03:07:17.712944","192.168.2.3","216.58.197.4","TLSv1.2","212","Application Data"
"178","2018-08-23 03:07:17.713214","192.168.2.3","216.58.197.4","TCP","1434","34325  >  443 [ACK] Seq=103702 Ack=1274 Win=661 Len=1368 TSval=8231979 TSecr=601667673 [TCP segment of a reassembled PDU]"
"179","2018-08-23 03:07:17.713217","192.168.2.3","216.58.197.4","TLSv1.2","155","Application Data"
"183","2018-08-23 03:07:17.807424","192.168.2.3","216.58.197.4","TCP","1434","34325  >  443 [ACK] Seq=105159 Ack=1274 Win=661 Len=1368 TSval=8231989 TSecr=601667729 [TCP segment of a reassembled PDU]"
"184","2018-08-23 03:07:17.807831","192.168.2.3","216.58.197.4","TCP","1434","34325  >  443 [ACK] Seq=106527 Ack=1274 Win=661 Len=1368 TSval=8231989 TSecr=601667729 [TCP segment of a reassembled PDU]"
"185","2018-08-23 03:07:17.807833","192.168.2.3","216.58.197.4","TLSv1.2","212","Application Data"
"186","2018-08-23 03:07:17.808166","192.168.2.3","216.58.197.4","TCP","1434","34325  >  443 [ACK] Seq=108041 Ack=1274 Win=661 Len=1368 TSval=8231989 TSecr=601667729 [TCP segment of a reassembled PDU]"
"187","2018-08-23 03:07:17.808168","192.168.2.3","216.58.197.4","TLSv1.2","155","Application Data"
"191","2018-08-23 03:07:17.889115","192.168.2.3","216.58.197.4","TCP","1434","34325  >  443 [ACK] Seq=109498 Ack=1274 Win=661 Len=1368 TSval=8231996 TSecr=601667824 [TCP segment of a reassembled PDU]"
"192","2018-08-23 03:07:17.889120","192.168.2.3","216.58.197.4","TCP","1434","34325  >  443 [ACK] Seq=110866 Ack=1274 Win=661 Len=1368 TSval=8231996 TSecr=601667824 [TCP segment of a reassembled PDU]"
"193","2018-08-23 03:07:17.889121","192.168.2.3","216.58.197.4","TLSv1.2","212","Application Data"
"194","2018-08-23 03:07:17.889551","192.168.2.3","216.58.197.4","TCP","1434","34325  >  443 [ACK] Seq=112380 Ack=1274 Win=661 Len=1368 TSval=8231996 TSecr=601667824 [TCP segment of a reassembled PDU]"
"195","2018-08-23 03:07:17.889554","192.168.2.3","216.58.197.4","TLSv1.2","155","Application Data"
"199","2018-08-23 03:07:17.980737","192.168.2.3","216.58.197.4","TCP","1434","34325  >  443 [ACK] Seq=113837 Ack=1274 Win=661 Len=1368 TSval=8232006 TSecr=601667906 [TCP segment of a reassembled PDU]"
"200","2018-08-23 03:07:17.981201","192.168.2.3","216.58.197.4","TCP","1434","34325  >  443 [ACK] Seq=115205 Ack=1274 Win=661 Len=1368 TSval=8232006 TSecr=601667906 [TCP segment of a reassembled PDU]"
"201","2018-08-23 03:07:17.981204","192.168.2.3","216.58.197.4","TLSv1.2","212","Application Data"
"202","2018-08-23 03:07:17.981565","192.168.2.3","216.58.197.4","TCP","1434","34325  >  443 [ACK] Seq=116719 Ack=1274 Win=661 Len=1368 TSval=8232006 TSecr=601667906 [TCP segment of a reassembled PDU]"
"203","2018-08-23 03:07:17.981567","192.168.2.3","216.58.197.4","TLSv1.2","155","Application Data"
"207","2018-08-23 03:07:18.065521","192.168.2.3","216.58.197.4","TCP","1434","34325  >  443 [ACK] Seq=118176 Ack=1274 Win=661 Len=1368 TSval=8232015 TSecr=601667998 [TCP segment of a reassembled PDU]"
"208","2018-08-23 03:07:18.065844","192.168.2.3","216.58.197.4","TCP","1434","34325  >  443 [ACK] Seq=119544 Ack=1274 Win=661 Len=1368 TSval=8232015 TSecr=601667998 [TCP segment of a reassembled PDU]"
"209","2018-08-23 03:07:18.065846","192.168.2.3","216.58.197.4","TLSv1.2","212","Application Data"
"210","2018-08-23 03:07:18.066271","192.168.2.3","216.58.197.4","TCP","1434","34325  >  443 [ACK] Seq=121058 Ack=1274 Win=661 Len=1368 TSval=8232015 TSecr=601667998 [TCP segment of a reassembled PDU]"
"211","2018-08-23 03:07:18.066273","192.168.2.3","216.58.197.4","TLSv1.2","155","Application Data"
"217","2018-08-23 03:07:18.126828","192.168.2.3","216.58.197.4","TCP","66","34325  >  443 [ACK] Seq=122515 Ack=1422 Win=661 Len=0 TSval=8232021 TSecr=601668137"
"218","2018-08-23 03:07:18.127147","192.168.2.3","216.58.197.4","TCP","66","34325  >  443 [ACK] Seq=122515 Ack=1568 Win=661 Len=0 TSval=8232021 TSecr=601668137"
"219","2018-08-23 03:07:18.143192","192.168.2.3","216.58.197.4","TCP","1434","34325  >  443 [ACK] Seq=122515 Ack=1568 Win=661 Len=1368 TSval=8232022 TSecr=601668137 [TCP segment of a reassembled PDU]"
"220","2018-08-23 03:07:18.143195","192.168.2.3","216.58.197.4","TCP","1434","34325  >  443 [ACK] Seq=123883 Ack=1568 Win=661 Len=1368 TSval=8232022 TSecr=601668137 [TCP segment of a reassembled PDU]"
"221","2018-08-23 03:07:18.143196","192.168.2.3","216.58.197.4","TLSv1.2","212","Application Data"
"222","2018-08-23 03:07:18.143363","192.168.2.3","216.58.197.4","TCP","1434","34325  >  443 [ACK] Seq=125397 Ack=1568 Win=661 Len=1368 TSval=8232022 TSecr=601668137 [TCP segment of a reassembled PDU]"
"223","2018-08-23 03:07:18.143581","192.168.2.3","216.58.197.4","TLSv1.2","155","Application Data"
"228","2018-08-23 03:07:18.217611","192.168.2.3","216.58.197.4","TCP","66","34325  >  443 [ACK] Seq=126854 Ack=2132 Win=661 Len=0 TSval=8232030 TSecr=601668222"
"229","2018-08-23 03:07:18.234992","192.168.2.3","216.58.197.4","TCP","1434","34325  >  443 [ACK] Seq=126854 Ack=2132 Win=661 Len=1368 TSval=8232032 TSecr=601668222 [TCP segment of a reassembled PDU]"
"230","2018-08-23 03:07:18.235392","192.168.2.3","216.58.197.4","TCP","1434","34325  >  443 [ACK] Seq=128222 Ack=2132 Win=661 Len=1368 TSval=8232032 TSecr=601668222 [TCP segment of a reassembled PDU]"
"231","2018-08-23 03:07:18.235394","192.168.2.3","216.58.197.4","TLSv1.2","212","Application Data"
"232","2018-08-23 03:07:18.235395","192.168.2.3","216.58.197.4","TCP","1434","34325  >  443 [ACK] Seq=129736 Ack=2132 Win=661 Len=1368 TSval=8232032 TSecr=601668222 [TCP segment of a reassembled PDU]"
"233","2018-08-23 03:07:18.235866","192.168.2.3","216.58.197.4","TLSv1.2","155","Application Data"
"239","2018-08-23 03:07:18.287881","192.168.2.3","216.58.197.4","TCP","66","34325  >  443 [ACK] Seq=131193 Ack=2325 Win=661 Len=0 TSval=8232037 TSecr=601668297"
"240","2018-08-23 03:07:18.322032","192.168.2.3","216.58.197.4","TCP","1434","34325  >  443 [ACK] Seq=131193 Ack=2325 Win=661 Len=1368 TSval=8232040 TSecr=601668297 [TCP segment of a reassembled PDU]"
"241","2018-08-23 03:07:18.322503","192.168.2.3","216.58.197.4","TCP","1434","34325  >  443 [ACK] Seq=132561 Ack=2325 Win=661 Len=1368 TSval=8232040 TSecr=601668297 [TCP segment of a reassembled PDU]"
"242","2018-08-23 03:07:18.322506","192.168.2.3","216.58.197.4","TLSv1.2","212","Application Data"
"243","2018-08-23 03:07:18.322507","192.168.2.3","216.58.197.4","TCP","1434","34325  >  443 [ACK] Seq=134075 Ack=2325 Win=661 Len=1368 TSval=8232040 TSecr=601668297 [TCP segment of a reassembled PDU]"
"244","2018-08-23 03:07:18.322507","192.168.2.3","216.58.197.4","TLSv1.2","155","Application Data"
"247","2018-08-23 03:07:18.425224","192.168.2.3","216.58.197.4","TCP","1434","34325  >  443 [ACK] Seq=135532 Ack=2325 Win=661 Len=1368 TSval=8232051 TSecr=601668339 [TCP segment of a reassembled PDU]"
"248","2018-08-23 03:07:18.425672","192.168.2.3","216.58.197.4","TCP","1434","34325  >  443 [ACK] Seq=136900 Ack=2325 Win=661 Len=1368 TSval=8232051 TSecr=601668339 [TCP segment of a reassembled PDU]"
"249","2018-08-23 03:07:18.425674","192.168.2.3","216.58.197.4","TLSv1.2","212","Application Data"
"250","2018-08-23 03:07:18.425675","192.168.2.3","216.58.197.4","TCP","1434","34325  >  443 [ACK] Seq=138414 Ack=2325 Win=661 Len=1368 TSval=8232051 TSecr=601668339 [TCP segment of a reassembled PDU]"
"251","2018-08-23 03:07:18.425676","192.168.2.3","216.58.197.4","TLSv1.2","155","Application Data"
"257","2018-08-23 03:07:18.484624","192.168.2.3","216.58.197.4","TCP","66","34325  >  443 [ACK] Seq=139871 Ack=2764 Win=661 Len=0 TSval=8232057 TSecr=601668495"
"258","2018-08-23 03:07:18.520368","192.168.2.3","216.58.197.4","TCP","1434","34325  >  443 [ACK] Seq=139871 Ack=2764 Win=661 Len=1368 TSval=8232060 TSecr=601668495 [TCP segment of a reassembled PDU]"
"259","2018-08-23 03:07:18.520725","192.168.2.3","216.58.197.4","TCP","1434","34325  >  443 [ACK] Seq=141239 Ack=2764 Win=661 Len=1368 TSval=8232060 TSecr=601668495 [TCP segment of a reassembled PDU]"
"260","2018-08-23 03:07:18.520734","192.168.2.3","216.58.197.4","TLSv1.2","212","Application Data"
"261","2018-08-23 03:07:18.520922","192.168.2.3","216.58.197.4","TCP","1434","34325  >  443 [ACK] Seq=142753 Ack=2764 Win=661 Len=1368 TSval=8232060 TSecr=601668495 [TCP segment of a reassembled PDU]"
"262","2018-08-23 03:07:18.520930","192.168.2.3","216.58.197.4","TLSv1.2","155","Application Data"
"268","2018-08-23 03:07:18.585450","192.168.2.3","216.58.197.4","TCP","66","34325  >  443 [ACK] Seq=144210 Ack=3092 Win=661 Len=0 TSval=8232067 TSecr=601668589"
"269","2018-08-23 03:07:18.621642","192.168.2.3","216.58.197.4","TCP","1434","34325  >  443 [ACK] Seq=144210 Ack=3092 Win=661 Len=1368 TSval=8232069 TSecr=601668589 [TCP segment of a reassembled PDU]"
"270","2018-08-23 03:07:18.621648","192.168.2.3","216.58.197.4","TCP","1434","34325  >  443 [ACK] Seq=145578 Ack=3092 Win=661 Len=1368 TSval=8232069 TSecr=601668589 [TCP segment of a reassembled PDU]"
"271","2018-08-23 03:07:18.621649","192.168.2.3","216.58.197.4","TLSv1.2","212","Application Data"
"272","2018-08-23 03:07:18.621960","192.168.2.3","216.58.197.4","TCP","1434","34325  >  443 [ACK] Seq=147092 Ack=3092 Win=661 Len=1368 TSval=8232069 TSecr=601668589 [TCP segment of a reassembled PDU]"
"273","2018-08-23 03:07:18.621963","192.168.2.3","216.58.197.4","TLSv1.2","155","Application Data"
"279","2018-08-23 03:07:18.685321","192.168.2.3","216.58.197.4","TCP","66","34325  >  443 [ACK] Seq=148549 Ack=3631 Win=661 Len=0 TSval=8232076 TSecr=601668692"
"280","2018-08-23 03:07:18.685599","192.168.2.3","216.58.197.4","TCP","1434","34325  >  443 [ACK] Seq=148549 Ack=3631 Win=661 Len=1368 TSval=8232076 TSecr=601668692 [TCP segment of a reassembled PDU]"
"281","2018-08-23 03:07:18.685601","192.168.2.3","216.58.197.4","TCP","1434","34325  >  443 [ACK] Seq=149917 Ack=3631 Win=661 Len=1368 TSval=8232076 TSecr=601668692 [TCP segment of a reassembled PDU]"
"282","2018-08-23 03:07:18.685602","192.168.2.3","216.58.197.4","TLSv1.2","212","Application Data"
"283","2018-08-23 03:07:18.685962","192.168.2.3","216.58.197.4","TCP","1434","34325  >  443 [ACK] Seq=151431 Ack=3631 Win=661 Len=1368 TSval=8232076 TSecr=601668692 [TCP segment of a reassembled PDU]"
"284","2018-08-23 03:07:18.685965","192.168.2.3","216.58.197.4","TLSv1.2","155","Application Data"
"290","2018-08-23 03:07:18.695817","192.168.2.3","216.58.197.4","TCP","66","34325  >  443 [ACK] Seq=152888 Ack=4217 Win=661 Len=0 TSval=8232078 TSecr=601668706"
"293","2018-08-23 03:07:18.745117","192.168.2.3","216.58.197.4","TCP","66","34325  >  443 [ACK] Seq=152888 Ack=4535 Win=661 Len=0 TSval=8232082 TSecr=601668754"
"294","2018-08-23 03:07:18.769838","192.168.2.3","216.58.197.4","TCP","1434","34325  >  443 [ACK] Seq=152888 Ack=4535 Win=661 Len=1368 TSval=8232085 TSecr=601668754 [TCP segment of a reassembled PDU]"
"295","2018-08-23 03:07:18.770215","192.168.2.3","216.58.197.4","TCP","1434","34325  >  443 [ACK] Seq=154256 Ack=4535 Win=661 Len=1368 TSval=8232085 TSecr=601668754 [TCP segment of a reassembled PDU]"
"296","2018-08-23 03:07:18.770218","192.168.2.3","216.58.197.4","TLSv1.2","212","Application Data"
"297","2018-08-23 03:07:18.770719","192.168.2.3","216.58.197.4","TCP","1434","34325  >  443 [ACK] Seq=155770 Ack=4535 Win=661 Len=1368 TSval=8232085 TSecr=601668754 [TCP segment of a reassembled PDU]"
"298","2018-08-23 03:07:18.770721","192.168.2.3","216.58.197.4","TLSv1.2","155","Application Data"
"302","2018-08-23 03:07:18.865885","192.168.2.3","216.58.197.4","TCP","1434","34325  >  443 [ACK] Seq=157227 Ack=4535 Win=661 Len=1368 TSval=8232095 TSecr=601668827 [TCP segment of a reassembled PDU]"
"303","2018-08-23 03:07:18.866273","192.168.2.3","216.58.197.4","TCP","1434","34325  >  443 [ACK] Seq=158595 Ack=4535 Win=661 Len=1368 TSval=8232095 TSecr=601668827 [TCP segment of a reassembled PDU]"
"304","2018-08-23 03:07:18.866289","192.168.2.3","216.58.197.4","TLSv1.2","212","Application Data"
"305","2018-08-23 03:07:18.866290","192.168.2.3","216.58.197.4","TCP","1434","34325  >  443 [ACK] Seq=160109 Ack=4535 Win=661 Len=1368 TSval=8232095 TSecr=601668827 [TCP segment of a reassembled PDU]"
"306","2018-08-23 03:07:18.866402","192.168.2.3","216.58.197.4","TLSv1.2","155","Application Data"
"310","2018-08-23 03:07:18.941193","192.168.2.3","216.58.197.4","TCP","1434","34325  >  443 [ACK] Seq=161566 Ack=4535 Win=661 Len=1368 TSval=8232102 TSecr=601668882 [TCP segment of a reassembled PDU]"
"311","2018-08-23 03:07:18.941198","192.168.2.3","216.58.197.4","TCP","1434","34325  >  443 [ACK] Seq=162934 Ack=4535 Win=661 Len=1368 TSval=8232102 TSecr=601668882 [TCP segment of a reassembled PDU]"
"312","2018-08-23 03:07:18.941199","192.168.2.3","216.58.197.4","TLSv1.2","212","Application Data"
"313","2018-08-23 03:07:18.941547","192.168.2.3","216.58.197.4","TCP","1434","34325  >  443 [ACK] Seq=164448 Ack=4535 Win=661 Len=1368 TSval=8232102 TSecr=601668882 [TCP segment of a reassembled PDU]"
"314","2018-08-23 03:07:18.941551","192.168.2.3","216.58.197.4","TLSv1.2","155","Application Data"
"320","2018-08-23 03:07:18.995652","192.168.2.3","216.58.197.4","TCP","66","34325  >  443 [ACK] Seq=165905 Ack=4833 Win=661 Len=0 TSval=8232108 TSecr=601669006"
"321","2018-08-23 03:07:19.026239","192.168.2.3","216.58.197.4","TCP","1434","34325  >  443 [ACK] Seq=165905 Ack=4833 Win=661 Len=1368 TSval=8232111 TSecr=601669006 [TCP segment of a reassembled PDU]"
"322","2018-08-23 03:07:19.026254","192.168.2.3","216.58.197.4","TCP","1434","34325  >  443 [ACK] Seq=167273 Ack=4833 Win=661 Len=1368 TSval=8232111 TSecr=601669006 [TCP segment of a reassembled PDU]"
"323","2018-08-23 03:07:19.026298","192.168.2.3","216.58.197.4","TLSv1.2","212","Application Data"
"324","2018-08-23 03:07:19.026521","192.168.2.3","216.58.197.4","TCP","1434","34325  >  443 [ACK] Seq=168787 Ack=4833 Win=661 Len=1368 TSval=8232111 TSecr=601669006 [TCP segment of a reassembled PDU]"
"325","2018-08-23 03:07:19.026530","192.168.2.3","216.58.197.4","TLSv1.2","155","Application Data"
"329","2018-08-23 03:07:19.119242","192.168.2.3","216.58.197.4","TCP","1434","34325  >  443 [ACK] Seq=170244 Ack=4833 Win=661 Len=1368 TSval=8232120 TSecr=601669043 [TCP segment of a reassembled PDU]"
"330","2018-08-23 03:07:19.119675","192.168.2.3","216.58.197.4","TCP","1434","34325  >  443 [ACK] Seq=171612 Ack=4833 Win=661 Len=1368 TSval=8232120 TSecr=601669043 [TCP segment of a reassembled PDU]"
"331","2018-08-23 03:07:19.119678","192.168.2.3","216.58.197.4","TLSv1.2","212","Application Data"
"332","2018-08-23 03:07:19.120085","192.168.2.3","216.58.197.4","TCP","1434","34325  >  443 [ACK] Seq=173126 Ack=4833 Win=661 Len=1368 TSval=8232120 TSecr=601669043 [TCP segment of a reassembled PDU]"
"333","2018-08-23 03:07:19.120087","192.168.2.3","216.58.197.4","TLSv1.2","155","Application Data"
"339","2018-08-23 03:07:19.174746","192.168.2.3","216.58.197.4","TCP","66","34325  >  443 [ACK] Seq=174583 Ack=5346 Win=661 Len=0 TSval=8232126 TSecr=601669185"
"342","2018-08-23 03:07:19.225748","192.168.2.3","216.58.197.4","TCP","1434","34325  >  443 [ACK] Seq=174583 Ack=5541 Win=661 Len=1368 TSval=8232130 TSecr=601669219 [TCP segment of a reassembled PDU]"
"343","2018-08-23 03:07:19.225751","192.168.2.3","216.58.197.4","TCP","1434","34325  >  443 [ACK] Seq=175951 Ack=5541 Win=661 Len=1368 TSval=8232130 TSecr=601669219 [TCP segment of a reassembled PDU]"
"344","2018-08-23 03:07:19.225950","192.168.2.3","216.58.197.4","TLSv1.2","212","Application Data"
"345","2018-08-23 03:07:19.225953","192.168.2.3","216.58.197.4","TLSv1.2","1221","Application Data"
"349","2018-08-23 03:07:19.269257","192.168.2.3","216.58.197.4","TCP","66","34325  >  443 [ACK] Seq=178620 Ack=5702 Win=661 Len=0 TSval=8232135 TSecr=601669228"
"350","2018-08-23 03:07:19.318080","192.168.2.3","216.58.197.4","TCP","1434","34325  >  443 [ACK] Seq=178620 Ack=5702 Win=661 Len=1368 TSval=8232139 TSecr=601669228 [TCP segment of a reassembled PDU]"
"351","2018-08-23 03:07:19.318083","192.168.2.3","216.58.197.4","TCP","1434","34325  >  443 [ACK] Seq=179988 Ack=5702 Win=661 Len=1368 TSval=8232139 TSecr=601669228 [TCP segment of a reassembled PDU]"
"352","2018-08-23 03:07:19.318084","192.168.2.3","216.58.197.4","TLSv1.2","212","Application Data"
"353","2018-08-23 03:07:19.318446","192.168.2.3","216.58.197.4","TCP","1434","34325  >  443 [ACK] Seq=181502 Ack=5702 Win=661 Len=1368 TSval=8232139 TSecr=601669228 [TCP segment of a reassembled PDU]"
"354","2018-08-23 03:07:19.318449","192.168.2.3","216.58.197.4","TLSv1.2","155","Application Data"
"359","2018-08-23 03:07:19.410348","192.168.2.3","216.58.197.4","TCP","66","34325  >  443 [ACK] Seq=182959 Ack=5758 Win=661 Len=0 TSval=8232149 TSecr=601669420"
"360","2018-08-23 03:07:19.420055","192.168.2.3","216.58.197.4","TCP","1434","34325  >  443 [ACK] Seq=182959 Ack=5758 Win=661 Len=1368 TSval=8232150 TSecr=601669420 [TCP segment of a reassembled PDU]"
"361","2018-08-23 03:07:19.420059","192.168.2.3","216.58.197.4","TCP","1434","34325  >  443 [ACK] Seq=184327 Ack=5758 Win=661 Len=1368 TSval=8232150 TSecr=601669420 [TCP segment of a reassembled PDU]"
"362","2018-08-23 03:07:19.420061","192.168.2.3","216.58.197.4","TLSv1.2","212","Application Data"
"363","2018-08-23 03:07:19.420501","192.168.2.3","216.58.197.4","TCP","1434","34325  >  443 [ACK] Seq=185841 Ack=5758 Win=661 Len=1368 TSval=8232150 TSecr=601669420 [TCP segment of a reassembled PDU]"
"364","2018-08-23 03:07:19.420504","192.168.2.3","216.58.197.4","TLSv1.2","155","Application Data"
"367","2018-08-23 03:07:19.515191","192.168.2.3","216.58.197.4","TCP","1434","34325  >  443 [ACK] Seq=187298 Ack=5758 Win=661 Len=1368 TSval=8232160 TSecr=601669437 [TCP segment of a reassembled PDU]"
"368","2018-08-23 03:07:19.515650","192.168.2.3","216.58.197.4","TCP","1434","34325  >  443 [ACK] Seq=188666 Ack=5758 Win=661 Len=1368 TSval=8232160 TSecr=601669437 [TCP segment of a reassembled PDU]"
"369","2018-08-23 03:07:19.515653","192.168.2.3","216.58.197.4","TLSv1.2","212","Application Data"
"370","2018-08-23 03:07:19.516100","192.168.2.3","216.58.197.4","TCP","1434","34325  >  443 [ACK] Seq=190180 Ack=5758 Win=661 Len=1368 TSval=8232160 TSecr=601669437 [TCP segment of a reassembled PDU]"
"371","2018-08-23 03:07:19.516102","192.168.2.3","216.58.197.4","TLSv1.2","155","Application Data"
"377","2018-08-23 03:07:19.576323","192.168.2.3","216.58.197.4","TCP","66","34325  >  443 [ACK] Seq=191637 Ack=6250 Win=661 Len=0 TSval=8232166 TSecr=601669585"
"378","2018-08-23 03:07:19.614821","192.168.2.3","216.58.197.4","TCP","1434","34325  >  443 [ACK] Seq=191637 Ack=6250 Win=661 Len=1368 TSval=8232170 TSecr=601669585 [TCP segment of a reassembled PDU]"
"379","2018-08-23 03:07:19.615224","192.168.2.3","216.58.197.4","TCP","1434","34325  >  443 [ACK] Seq=193005 Ack=6250 Win=661 Len=1368 TSval=8232170 TSecr=601669585 [TCP segment of a reassembled PDU]"
"380","2018-08-23 03:07:19.615227","192.168.2.3","216.58.197.4","TLSv1.2","212","Application Data"
"381","2018-08-23 03:07:19.615228","192.168.2.3","216.58.197.4","TCP","1434","34325  >  443 [ACK] Seq=194519 Ack=6250 Win=661 Len=1368 TSval=8232170 TSecr=601669585 [TCP segment of a reassembled PDU]"
"382","2018-08-23 03:07:19.615343","192.168.2.3","216.58.197.4","TLSv1.2","155","Application Data"
"385","2018-08-23 03:07:19.728540","192.168.2.3","216.58.197.4","TCP","1434","34325  >  443 [ACK] Seq=195976 Ack=6250 Win=661 Len=1368 TSval=8232181 TSecr=601669631 [TCP segment of a reassembled PDU]"
"386","2018-08-23 03:07:19.731699","192.168.2.3","216.58.197.4","TCP","1434","34325  >  443 [ACK] Seq=197344 Ack=6250 Win=661 Len=1368 TSval=8232181 TSecr=601669631 [TCP segment of a reassembled PDU]"
"387","2018-08-23 03:07:19.731702","192.168.2.3","216.58.197.4","TLSv1.2","212","Application Data"
"388","2018-08-23 03:07:19.732063","192.168.2.3","216.58.197.4","TCP","1434","34325  >  443 [ACK] Seq=198858 Ack=6250 Win=661 Len=1368 TSval=8232181 TSecr=601669631 [TCP segment of a reassembled PDU]"
"389","2018-08-23 03:07:19.732065","192.168.2.3","216.58.197.4","TLSv1.2","137","Application Data"
"395","2018-08-23 03:07:19.785777","192.168.2.3","216.58.197.4","TCP","66","34325  >  443 [ACK] Seq=200297 Ack=6402 Win=661 Len=0 TSval=8232187 TSecr=601669796"
"396","2018-08-23 03:07:19.827839","192.168.2.3","216.58.197.4","TCP","1434","34325  >  443 [ACK] Seq=200297 Ack=6402 Win=661 Len=1368 TSval=8232191 TSecr=601669796 [TCP segment of a reassembled PDU]"
"397","2018-08-23 03:07:19.827844","192.168.2.3","216.58.197.4","TCP","1434","34325  >  443 [ACK] Seq=201665 Ack=6402 Win=661 Len=1368 TSval=8232191 TSecr=601669796 [TCP segment of a reassembled PDU]"
"398","2018-08-23 03:07:19.827962","192.168.2.3","216.58.197.4","TLSv1.2","212","Application Data"
"399","2018-08-23 03:07:19.828296","192.168.2.3","216.58.197.4","TCP","1434","34325  >  443 [ACK] Seq=203179 Ack=6402 Win=661 Len=1368 TSval=8232191 TSecr=601669796 [TCP segment of a reassembled PDU]"
"400","2018-08-23 03:07:19.828299","192.168.2.3","216.58.197.4","TLSv1.2","155","Application Data"
"404","2018-08-23 03:07:19.921618","192.168.2.3","216.58.197.4","TCP","1434","34325  >  443 [ACK] Seq=204636 Ack=6402 Win=661 Len=1368 TSval=8232200 TSecr=601669844 [TCP segment of a reassembled PDU]"
"405","2018-08-23 03:07:19.921829","192.168.2.3","216.58.197.4","TCP","1434","34325  >  443 [ACK] Seq=206004 Ack=6402 Win=661 Len=1368 TSval=8232200 TSecr=601669844 [TCP segment of a reassembled PDU]"
"406","2018-08-23 03:07:19.921833","192.168.2.3","216.58.197.4","TLSv1.2","212","Application Data"
"407","2018-08-23 03:07:19.922248","192.168.2.3","216.58.197.4","TCP","1434","34325  >  443 [ACK] Seq=207518 Ack=6402 Win=661 Len=1368 TSval=8232200 TSecr=601669844 [TCP segment of a reassembled PDU]"
"408","2018-08-23 03:07:19.922251","192.168.2.3","216.58.197.4","TLSv1.2","155","Application Data"
"414","2018-08-23 03:07:19.972751","192.168.2.3","216.58.197.4","TCP","66","34325  >  443 [ACK] Seq=208975 Ack=6746 Win=661 Len=0 TSval=8232205 TSecr=601669983"
"417","2018-08-23 03:07:20.017586","192.168.2.3","216.58.197.4","TCP","66","34325  >  443 [ACK] Seq=208975 Ack=7353 Win=661 Len=0 TSval=8232210 TSecr=601670025"
"418","2018-08-23 03:07:20.020128","192.168.2.3","216.58.197.4","TCP","1434","34325  >  443 [ACK] Seq=208975 Ack=7353 Win=661 Len=1368 TSval=8232210 TSecr=601670025 [TCP segment of a reassembled PDU]"
"419","2018-08-23 03:07:20.020471","192.168.2.3","216.58.197.4","TCP","1434","34325  >  443 [ACK] Seq=210343 Ack=7353 Win=661 Len=1368 TSval=8232210 TSecr=601670025 [TCP segment of a reassembled PDU]"
"420","2018-08-23 03:07:20.020473","192.168.2.3","216.58.197.4","TLSv1.2","212","Application Data"
"421","2018-08-23 03:07:20.020474","192.168.2.3","216.58.197.4","TLSv1.2","1043","Application Data"
"422","2018-08-23 03:07:20.020610","192.168.2.3","216.58.197.4","TLSv1.2","102","Application Data"
"428","2018-08-23 03:07:20.222116","192.168.2.3","216.58.197.4","TCP","66","34325  >  443 [ACK] Seq=212870 Ack=7697 Win=661 Len=0 TSval=8232230 TSecr=601670219"
"436","2018-08-23 03:07:20.607274","192.168.2.3","216.58.197.4","TCP","66","34325  >  443 [ACK] Seq=212870 Ack=9910 Win=661 Len=0 TSval=8232269 TSecr=601670595"
"446","2018-08-23 03:07:20.630957","192.168.2.3","216.58.197.4","TCP","66","34325  >  443 [ACK] Seq=212870 Ack=19059 Win=661 Len=0 TSval=8232271 TSecr=601670633"
"449","2018-08-23 03:07:20.641102","192.168.2.3","216.58.197.4","TCP","66","34325  >  443 [ACK] Seq=212870 Ack=20000 Win=661 Len=0 TSval=8232272 TSecr=601670651"
"450","2018-08-23 03:07:20.681714","192.168.2.3","35.186.224.48","TLSv1.2","124","Application Data"
"451","2018-08-23 03:07:20.681719","192.168.2.3","35.186.224.48","TLSv1.2","104","Application Data"
"455","2018-08-23 03:07:20.726986","192.168.2.3","35.186.224.48","TCP","66","42527  >  443 [ACK] Seq=97 Ack=39 Win=661 Len=0 TSval=8232281 TSecr=336193088"
