"No.","Time","Source","Destination","Protocol","Length","Info"
"10","2018-08-23 02:38:32.058966","192.168.2.3","216.58.199.234","TCP","66","43615  >  443 [FIN, ACK] Seq=1 Ack=57 Win=279 Len=0 TSval=8059416 TSecr=3488387685"
"12","2018-08-23 02:38:32.453939","192.168.2.3","203.211.199.120","TCP","66","52050  >  443 [ACK] Seq=1 Ack=1 Win=999 Len=0 TSval=8059456 TSecr=1194174982"
"17","2018-08-23 02:38:32.562743","192.168.2.3","216.58.197.3","TCP","66","43450  >  443 [FIN, ACK] Seq=1 Ack=57 Win=881 Len=0 TSval=8059466 TSecr=941642815"
"21","2018-08-23 02:38:32.619189","192.168.2.3","216.58.197.10","TCP","66","47825  >  443 [FIN, ACK] Seq=1 Ack=57 Win=661 Len=0 TSval=8059472 TSecr=742112964"
"24","2018-08-23 02:38:33.382007","192.168.2.3","216.58.197.4","TLSv1.2","156","Application Data"
"25","2018-08-23 02:38:33.382390","192.168.2.3","216.58.197.4","TLSv1.2","104","Application Data"
"26","2018-08-23 02:38:33.382392","192.168.2.3","216.58.197.4","TLSv1.2","159","Application Data"
"31","2018-08-23 02:38:33.391038","192.168.2.3","216.58.197.4","TCP","1434","34236  >  443 [ACK] Seq=222 Ack=39 Win=2363 Len=1368 TSval=8059549 TSecr=762488188 [TCP segment of a reassembled PDU]"
"32","2018-08-23 02:38:33.391268","192.168.2.3","216.58.197.4","TCP","1434","34236  >  443 [ACK] Seq=1590 Ack=39 Win=2363 Len=1368 TSval=8059549 TSecr=762488188 [TCP segment of a reassembled PDU]"
"33","2018-08-23 02:38:33.391271","192.168.2.3","216.58.197.4","TLSv1.2","212","Application Data"
"34","2018-08-23 02:38:33.391845","192.168.2.3","216.58.197.4","TCP","1434","34236  >  443 [ACK] Seq=3104 Ack=39 Win=2363 Len=1368 TSval=8059549 TSecr=762488188 [TCP segment of a reassembled PDU]"
"35","2018-08-23 02:38:33.391848","192.168.2.3","216.58.197.4","TLSv1.2","385","Application Data"
"36","2018-08-23 02:38:33.392278","192.168.2.3","216.58.197.4","TCP","1434","34236  >  443 [ACK] Seq=4791 Ack=39 Win=2363 Len=1368 TSval=8059549 TSecr=762488188 [TCP segment of a reassembled PDU]"
"37","2018-08-23 02:38:33.392281","192.168.2.3","216.58.197.4","TCP","1434","34236  >  443 [ACK] Seq=6159 Ack=39 Win=2363 Len=1368 TSval=8059549 TSecr=762488188 [TCP segment of a reassembled PDU]"
"38","2018-08-23 02:38:33.392282","192.168.2.3","216.58.197.4","TLSv1.2","212","Application Data"
"39","2018-08-23 02:38:33.392317","192.168.2.3","216.58.197.4","TCP","1434","34236  >  443 [ACK] Seq=7673 Ack=39 Win=2363 Len=1368 TSval=8059549 TSecr=762488188 [TCP segment of a reassembled PDU]"
"40","2018-08-23 02:38:33.392541","192.168.2.3","216.58.197.4","TLSv1.2","156","Application Data"
"46","2018-08-23 02:38:33.397033","192.168.2.3","216.58.197.4","TCP","1434","34236  >  443 [ACK] Seq=9131 Ack=39 Win=2363 Len=1368 TSval=8059550 TSecr=762488197 [TCP segment of a reassembled PDU]"
"47","2018-08-23 02:38:33.399787","192.168.2.3","216.58.197.4","TCP","1434","34236  >  443 [ACK] Seq=10499 Ack=39 Win=2363 Len=1368 TSval=8059550 TSecr=762488197 [TCP segment of a reassembled PDU]"
"48","2018-08-23 02:38:33.399790","192.168.2.3","216.58.197.4","TLSv1.2","1434","Application Data [TCP segment of a reassembled PDU]"
"49","2018-08-23 02:38:33.399903","192.168.2.3","216.58.197.4","TLSv1.2","1434","Application Data [TCP segment of a reassembled PDU]"
"50","2018-08-23 02:38:33.400262","192.168.2.3","216.58.197.4","TCP","1434","34236  >  443 [ACK] Seq=14603 Ack=39 Win=2363 Len=1368 TSval=8059550 TSecr=762488197 [TCP segment of a reassembled PDU]"
"51","2018-08-23 02:38:33.400265","192.168.2.3","216.58.197.4","TLSv1.2","1434","Application Data [TCP segment of a reassembled PDU]"
"52","2018-08-23 02:38:33.403829","192.168.2.3","172.217.25.225","TCP","66","46614  >  80 [ACK] Seq=1 Ack=2 Win=494 Len=0 TSval=8059551 TSecr=377084298"
"56","2018-08-23 02:38:33.404817","192.168.2.3","216.58.197.4","TLSv1.2","1434","Application Data [TCP segment of a reassembled PDU]"
"57","2018-08-23 02:38:33.404820","192.168.2.3","216.58.197.4","TCP","1434","34236  >  443 [ACK] Seq=18707 Ack=39 Win=2363 Len=1368 TSval=8059551 TSecr=762488198 [TCP segment of a reassembled PDU]"
"58","2018-08-23 02:38:33.405158","192.168.2.3","216.58.197.4","TLSv1.2","1434","Application Data [TCP segment of a reassembled PDU]"
"59","2018-08-23 02:38:33.405161","192.168.2.3","216.58.197.4","TLSv1.2","1434","Application Data [TCP segment of a reassembled PDU]"
"60","2018-08-23 02:38:33.407056","192.168.2.3","216.58.197.4","TCP","1434","34236  >  443 [ACK] Seq=22811 Ack=39 Win=2363 Len=1368 TSval=8059551 TSecr=762488198 [TCP segment of a reassembled PDU]"
"61","2018-08-23 02:38:33.407059","192.168.2.3","216.58.197.4","TLSv1.2","1434","Application Data [TCP segment of a reassembled PDU]"
"62","2018-08-23 02:38:33.407244","192.168.2.3","216.58.197.4","TLSv1.2","1434","Application Data [TCP segment of a reassembled PDU]"
"63","2018-08-23 02:38:33.407415","192.168.2.3","216.58.197.4","TCP","1434","34236  >  443 [ACK] Seq=26915 Ack=39 Win=2363 Len=1368 TSval=8059551 TSecr=762488198 [TCP segment of a reassembled PDU]"
"64","2018-08-23 02:38:33.407768","192.168.2.3","216.58.197.4","TLSv1.2","1434","Application Data [TCP segment of a reassembled PDU]"
"65","2018-08-23 02:38:33.407890","192.168.2.3","216.58.197.4","TLSv1.2","1434","Application Data [TCP segment of a reassembled PDU]"
"66","2018-08-23 02:38:33.408183","192.168.2.3","216.58.197.4","TCP","1434","34236  >  443 [ACK] Seq=31019 Ack=39 Win=2363 Len=1368 TSval=8059551 TSecr=762488205 [TCP segment of a reassembled PDU]"
"67","2018-08-23 02:38:33.408185","192.168.2.3","216.58.197.4","TLSv1.2","1434","Application Data [TCP segment of a reassembled PDU]"
"70","2018-08-23 02:38:33.410376","192.168.2.3","216.58.197.4","TCP","1434","34236  >  443 [ACK] Seq=33755 Ack=39 Win=2363 Len=1368 TSval=8059551 TSecr=762488205 [TCP segment of a reassembled PDU]"
"71","2018-08-23 02:38:33.410379","192.168.2.3","216.58.197.4","TLSv1.2","1434","Application Data [TCP segment of a reassembled PDU]"
"72","2018-08-23 02:38:33.410716","192.168.2.3","216.58.197.4","TCP","1434","34236  >  443 [ACK] Seq=36491 Ack=39 Win=2363 Len=1368 TSval=8059551 TSecr=762488205 [TCP segment of a reassembled PDU]"
"73","2018-08-23 02:38:33.410875","192.168.2.3","216.58.197.4","TLSv1.2","1434","Application Data [TCP segment of a reassembled PDU]"
"74","2018-08-23 02:38:33.411265","192.168.2.3","216.58.197.4","TLSv1.2","1434","Application Data [TCP segment of a reassembled PDU]"
"75","2018-08-23 02:38:33.411268","192.168.2.3","216.58.197.4","TCP","1434","34236  >  443 [ACK] Seq=40595 Ack=39 Win=2363 Len=1368 TSval=8059551 TSecr=762488206 [TCP segment of a reassembled PDU]"
"77","2018-08-23 02:38:33.411382","192.168.2.3","216.58.197.4","TLSv1.2","1434","Application Data [TCP segment of a reassembled PDU]"
"79","2018-08-23 02:38:33.411752","192.168.2.3","216.58.197.4","TLSv1.2","1434","Application Data [TCP segment of a reassembled PDU]"
"82","2018-08-23 02:38:33.414032","192.168.2.3","216.58.197.4","TCP","1434","34236  >  443 [ACK] Seq=44699 Ack=39 Win=2363 Len=1368 TSval=8059551 TSecr=762488210 [TCP segment of a reassembled PDU]"
"83","2018-08-23 02:38:33.414181","192.168.2.3","216.58.197.4","TLSv1.2","1434","Application Data [TCP segment of a reassembled PDU]"
"84","2018-08-23 02:38:33.414369","192.168.2.3","216.58.197.4","TLSv1.2","1434","Application Data [TCP segment of a reassembled PDU]"
"86","2018-08-23 02:38:33.414570","192.168.2.3","216.58.197.4","TCP","1434","34236  >  443 [ACK] Seq=48803 Ack=39 Win=2363 Len=1368 TSval=8059551 TSecr=762488211 [TCP segment of a reassembled PDU]"
"87","2018-08-23 02:38:33.414572","192.168.2.3","216.58.197.4","TLSv1.2","1434","Application Data [TCP segment of a reassembled PDU]"
"88","2018-08-23 02:38:33.414940","192.168.2.3","216.58.197.4","TLSv1.2","1434","Application Data [TCP segment of a reassembled PDU]"
"89","2018-08-23 02:38:33.414942","192.168.2.3","216.58.197.4","TCP","1434","34236  >  443 [ACK] Seq=52907 Ack=39 Win=2363 Len=1368 TSval=8059551 TSecr=762488213 [TCP segment of a reassembled PDU]"
"90","2018-08-23 02:38:33.415077","192.168.2.3","216.58.197.4","TLSv1.2","1434","Application Data [TCP segment of a reassembled PDU]"
"91","2018-08-23 02:38:33.415261","192.168.2.3","216.58.197.4","TCP","1434","34236  >  443 [ACK] Seq=55643 Ack=39 Win=2363 Len=1368 TSval=8059551 TSecr=762488213 [TCP segment of a reassembled PDU]"
"93","2018-08-23 02:38:33.415431","192.168.2.3","216.58.197.4","TLSv1.2","1434","Application Data [TCP segment of a reassembled PDU]"
"95","2018-08-23 02:38:33.415664","192.168.2.3","216.58.197.4","TLSv1.2","1270","Application Data"
"102","2018-08-23 02:38:33.438059","192.168.2.3","216.58.197.4","TCP","1434","34236  >  443 [ACK] Seq=59583 Ack=39 Win=2363 Len=1368 TSval=8059554 TSecr=762488221 [TCP segment of a reassembled PDU]"
"103","2018-08-23 02:38:33.438374","192.168.2.3","216.58.197.4","TCP","1434","34236  >  443 [ACK] Seq=60951 Ack=39 Win=2363 Len=1368 TSval=8059554 TSecr=762488221 [TCP segment of a reassembled PDU]"
"104","2018-08-23 02:38:33.438376","192.168.2.3","216.58.197.4","TLSv1.2","212","Application Data"
"105","2018-08-23 02:38:33.438377","192.168.2.3","216.58.197.4","TCP","1434","34236  >  443 [ACK] Seq=62465 Ack=39 Win=2363 Len=1368 TSval=8059554 TSecr=762488221 [TCP segment of a reassembled PDU]"
"106","2018-08-23 02:38:33.438662","192.168.2.3","216.58.197.4","TLSv1.2","155","Application Data"
"113","2018-08-23 02:38:33.470881","192.168.2.3","216.58.197.4","TCP","66","34236  >  443 [ACK] Seq=63922 Ack=477 Win=2363 Len=0 TSval=8059557 TSecr=762488263"
"115","2018-08-23 02:38:33.514052","192.168.2.3","216.58.197.4","TCP","66","34236  >  443 [ACK] Seq=63922 Ack=681 Win=2363 Len=0 TSval=8059562 TSecr=762488278"
"116","2018-08-23 02:38:33.532932","192.168.2.3","216.58.197.4","TCP","1434","34236  >  443 [ACK] Seq=63922 Ack=681 Win=2363 Len=1368 TSval=8059563 TSecr=762488278 [TCP segment of a reassembled PDU]"
"117","2018-08-23 02:38:33.533081","192.168.2.3","216.58.197.4","TCP","1434","34236  >  443 [ACK] Seq=65290 Ack=681 Win=2363 Len=1368 TSval=8059563 TSecr=762488278 [TCP segment of a reassembled PDU]"
"118","2018-08-23 02:38:33.533082","192.168.2.3","216.58.197.4","TLSv1.2","212","Application Data"
"119","2018-08-23 02:38:33.533366","192.168.2.3","216.58.197.4","TCP","1434","34236  >  443 [ACK] Seq=66804 Ack=681 Win=2363 Len=1368 TSval=8059563 TSecr=762488278 [TCP segment of a reassembled PDU]"
"120","2018-08-23 02:38:33.533369","192.168.2.3","216.58.197.4","TLSv1.2","155","Application Data"
"125","2018-08-23 02:38:33.583965","192.168.2.3","216.58.197.4","TCP","66","34236  >  443 [ACK] Seq=68261 Ack=980 Win=2363 Len=0 TSval=8059569 TSecr=762488381"
"126","2018-08-23 02:38:33.642256","192.168.2.3","216.58.197.4","TCP","1434","34236  >  443 [ACK] Seq=68261 Ack=980 Win=2363 Len=1368 TSval=8059574 TSecr=762488381 [TCP segment of a reassembled PDU]"
"127","2018-08-23 02:38:33.642263","192.168.2.3","216.58.197.4","TCP","1434","34236  >  443 [ACK] Seq=69629 Ack=980 Win=2363 Len=1368 TSval=8059574 TSecr=762488381 [TCP segment of a reassembled PDU]"
"128","2018-08-23 02:38:33.642407","192.168.2.3","216.58.197.4","TLSv1.2","212","Application Data"
"129","2018-08-23 02:38:33.642853","192.168.2.3","216.58.197.4","TCP","1434","34236  >  443 [ACK] Seq=71143 Ack=980 Win=2363 Len=1368 TSval=8059574 TSecr=762488381 [TCP segment of a reassembled PDU]"
"130","2018-08-23 02:38:33.642857","192.168.2.3","216.58.197.4","TLSv1.2","155","Application Data"
"135","2018-08-23 02:38:33.738792","192.168.2.3","216.58.197.4","TCP","66","34236  >  443 [ACK] Seq=72600 Ack=1098 Win=2363 Len=0 TSval=8059584 TSecr=762488535"
"136","2018-08-23 02:38:33.757117","192.168.2.3","216.58.197.4","TCP","1434","34236  >  443 [ACK] Seq=72600 Ack=1098 Win=2363 Len=1368 TSval=8059586 TSecr=762488535 [TCP segment of a reassembled PDU]"
"137","2018-08-23 02:38:33.757525","192.168.2.3","216.58.197.4","TCP","1434","34236  >  443 [ACK] Seq=73968 Ack=1098 Win=2363 Len=1368 TSval=8059586 TSecr=762488535 [TCP segment of a reassembled PDU]"
"138","2018-08-23 02:38:33.757530","192.168.2.3","216.58.197.4","TLSv1.2","212","Application Data"
"139","2018-08-23 02:38:33.758034","192.168.2.3","216.58.197.4","TCP","1434","34236  >  443 [ACK] Seq=75482 Ack=1098 Win=2363 Len=1368 TSval=8059586 TSecr=762488535 [TCP segment of a reassembled PDU]"
"140","2018-08-23 02:38:33.758038","192.168.2.3","216.58.197.4","TLSv1.2","155","Application Data"
"144","2018-08-23 02:38:33.854312","192.168.2.3","216.58.197.4","TCP","1434","34236  >  443 [ACK] Seq=76939 Ack=1098 Win=2363 Len=1368 TSval=8059595 TSecr=762488563 [TCP segment of a reassembled PDU]"
"145","2018-08-23 02:38:33.854318","192.168.2.3","216.58.197.4","TCP","1434","34236  >  443 [ACK] Seq=78307 Ack=1098 Win=2363 Len=1368 TSval=8059595 TSecr=762488563 [TCP segment of a reassembled PDU]"
"146","2018-08-23 02:38:33.854320","192.168.2.3","216.58.197.4","TLSv1.2","212","Application Data"
"147","2018-08-23 02:38:33.854631","192.168.2.3","216.58.197.4","TCP","1434","34236  >  443 [ACK] Seq=79821 Ack=1098 Win=2363 Len=1368 TSval=8059595 TSecr=762488563 [TCP segment of a reassembled PDU]"
"148","2018-08-23 02:38:33.854634","192.168.2.3","216.58.197.4","TLSv1.2","155","Application Data"
"151","2018-08-23 02:38:33.959163","192.168.2.3","216.58.197.4","TCP","1434","34236  >  443 [ACK] Seq=81278 Ack=1098 Win=2363 Len=1368 TSval=8059606 TSecr=762488660 [TCP segment of a reassembled PDU]"
"152","2018-08-23 02:38:33.959389","192.168.2.3","216.58.197.4","TCP","1434","34236  >  443 [ACK] Seq=82646 Ack=1098 Win=2363 Len=1368 TSval=8059606 TSecr=762488660 [TCP segment of a reassembled PDU]"
"153","2018-08-23 02:38:33.959391","192.168.2.3","216.58.197.4","TLSv1.2","212","Application Data"
"154","2018-08-23 02:38:33.959603","192.168.2.3","216.58.197.4","TCP","1434","34236  >  443 [ACK] Seq=84160 Ack=1098 Win=2363 Len=1368 TSval=8059606 TSecr=762488660 [TCP segment of a reassembled PDU]"
"155","2018-08-23 02:38:33.959619","192.168.2.3","216.58.197.4","TLSv1.2","76","Application Data"
"160","2018-08-23 02:38:34.017923","192.168.2.3","216.58.197.4","TCP","66","34303  >  443 [FIN, ACK] Seq=1 Ack=57 Win=661 Len=0 TSval=8059612 TSecr=2057783870"
"162","2018-08-23 02:38:34.113718","192.168.2.3","216.58.197.4","TCP","1434","34236  >  443 [ACK] Seq=85538 Ack=1098 Win=2363 Len=1368 TSval=8059618 TSecr=762488765 [TCP segment of a reassembled PDU]"
"163","2018-08-23 02:38:34.113932","192.168.2.3","216.58.197.4","TCP","1434","34236  >  443 [ACK] Seq=86906 Ack=1098 Win=2363 Len=1368 TSval=8059618 TSecr=762488765 [TCP segment of a reassembled PDU]"
"164","2018-08-23 02:38:34.113935","192.168.2.3","216.58.197.4","TLSv1.2","212","Application Data"
"165","2018-08-23 02:38:34.113936","192.168.2.3","216.58.197.4","TCP","1434","34236  >  443 [ACK] Seq=88420 Ack=1098 Win=2363 Len=1368 TSval=8059618 TSecr=762488765 [TCP segment of a reassembled PDU]"
"166","2018-08-23 02:38:34.114022","192.168.2.3","216.58.197.4","TLSv1.2","155","Application Data"
"170","2018-08-23 02:38:34.188819","192.168.2.3","216.58.197.4","TCP","1434","34236  >  443 [ACK] Seq=89877 Ack=1098 Win=2363 Len=1368 TSval=8059627 TSecr=762488919 [TCP segment of a reassembled PDU]"
"171","2018-08-23 02:38:34.188827","192.168.2.3","216.58.197.4","TCP","1434","34236  >  443 [ACK] Seq=91245 Ack=1098 Win=2363 Len=1368 TSval=8059627 TSecr=762488919 [TCP segment of a reassembled PDU]"
"172","2018-08-23 02:38:34.188912","192.168.2.3","216.58.197.4","TLSv1.2","212","Application Data"
"173","2018-08-23 02:38:34.189172","192.168.2.3","216.58.197.4","TCP","1434","34236  >  443 [ACK] Seq=92759 Ack=1098 Win=2363 Len=1368 TSval=8059627 TSecr=762488919 [TCP segment of a reassembled PDU]"
"174","2018-08-23 02:38:34.189174","192.168.2.3","216.58.197.4","TLSv1.2","155","Application Data"
"178","2018-08-23 02:38:34.271590","192.168.2.3","216.58.197.4","TCP","1434","34236  >  443 [ACK] Seq=94216 Ack=1098 Win=2363 Len=1368 TSval=8059637 TSecr=762488994 [TCP segment of a reassembled PDU]"
"179","2018-08-23 02:38:34.271596","192.168.2.3","216.58.197.4","TCP","1434","34236  >  443 [ACK] Seq=95584 Ack=1098 Win=2363 Len=1368 TSval=8059637 TSecr=762488994 [TCP segment of a reassembled PDU]"
"180","2018-08-23 02:38:34.271670","192.168.2.3","216.58.197.4","TLSv1.2","212","Application Data"
"181","2018-08-23 02:38:34.271933","192.168.2.3","216.58.197.4","TCP","1434","34236  >  443 [ACK] Seq=97098 Ack=1098 Win=2363 Len=1368 TSval=8059637 TSecr=762488994 [TCP segment of a reassembled PDU]"
"182","2018-08-23 02:38:34.271937","192.168.2.3","216.58.197.4","TLSv1.2","155","Application Data"
"186","2018-08-23 02:38:34.366398","192.168.2.3","216.58.197.4","TCP","1434","34236  >  443 [ACK] Seq=98555 Ack=1098 Win=2363 Len=1368 TSval=8059647 TSecr=762489077 [TCP segment of a reassembled PDU]"
"187","2018-08-23 02:38:34.366404","192.168.2.3","216.58.197.4","TCP","1434","34236  >  443 [ACK] Seq=99923 Ack=1098 Win=2363 Len=1368 TSval=8059647 TSecr=762489077 [TCP segment of a reassembled PDU]"
"188","2018-08-23 02:38:34.366405","192.168.2.3","216.58.197.4","TLSv1.2","212","Application Data"
"189","2018-08-23 02:38:34.366835","192.168.2.3","216.58.197.4","TCP","1434","34236  >  443 [ACK] Seq=101437 Ack=1098 Win=2363 Len=1368 TSval=8059647 TSecr=762489077 [TCP segment of a reassembled PDU]"
"190","2018-08-23 02:38:34.366836","192.168.2.3","216.58.197.4","TLSv1.2","155","Application Data"
"194","2018-08-23 02:38:34.459330","192.168.2.3","216.58.197.4","TCP","1434","34236  >  443 [ACK] Seq=102894 Ack=1098 Win=2363 Len=1368 TSval=8059656 TSecr=762489172 [TCP segment of a reassembled PDU]"
"195","2018-08-23 02:38:34.461092","192.168.2.3","216.58.197.4","TCP","1434","34236  >  443 [ACK] Seq=104262 Ack=1098 Win=2363 Len=1368 TSval=8059656 TSecr=762489172 [TCP segment of a reassembled PDU]"
"196","2018-08-23 02:38:34.461095","192.168.2.3","216.58.197.4","TLSv1.2","212","Application Data"
"197","2018-08-23 02:38:34.461096","192.168.2.3","216.58.197.4","TCP","1434","34236  >  443 [ACK] Seq=105776 Ack=1098 Win=2363 Len=1368 TSval=8059656 TSecr=762489172 [TCP segment of a reassembled PDU]"
"198","2018-08-23 02:38:34.461261","192.168.2.3","216.58.197.4","TLSv1.2","155","Application Data"
"203","2018-08-23 02:38:34.479945","192.168.2.3","216.58.197.4","TCP","66","34236  >  443 [ACK] Seq=107233 Ack=1460 Win=2363 Len=0 TSval=8059658 TSecr=762489264"
"204","2018-08-23 02:38:34.556012","192.168.2.3","216.58.197.4","TCP","1434","34236  >  443 [ACK] Seq=107233 Ack=1460 Win=2363 Len=1368 TSval=8059666 TSecr=762489264 [TCP segment of a reassembled PDU]"
"205","2018-08-23 02:38:34.556017","192.168.2.3","216.58.197.4","TCP","1434","34236  >  443 [ACK] Seq=108601 Ack=1460 Win=2363 Len=1368 TSval=8059666 TSecr=762489264 [TCP segment of a reassembled PDU]"
"206","2018-08-23 02:38:34.556018","192.168.2.3","216.58.197.4","TLSv1.2","212","Application Data"
"207","2018-08-23 02:38:34.556290","192.168.2.3","216.58.197.4","TCP","1434","34236  >  443 [ACK] Seq=110115 Ack=1460 Win=2363 Len=1368 TSval=8059666 TSecr=762489264 [TCP segment of a reassembled PDU]"
"208","2018-08-23 02:38:34.556293","192.168.2.3","216.58.197.4","TLSv1.2","155","Application Data"
"214","2018-08-23 02:38:34.612213","192.168.2.3","216.58.197.4","TCP","66","34236  >  443 [ACK] Seq=111572 Ack=1849 Win=2363 Len=0 TSval=8059671 TSecr=762489412"
"215","2018-08-23 02:38:34.631183","192.168.2.3","216.58.197.4","TCP","1434","34236  >  443 [ACK] Seq=111572 Ack=1849 Win=2363 Len=1368 TSval=8059673 TSecr=762489412 [TCP segment of a reassembled PDU]"
"216","2018-08-23 02:38:34.631578","192.168.2.3","216.58.197.4","TCP","1434","34236  >  443 [ACK] Seq=112940 Ack=1849 Win=2363 Len=1368 TSval=8059673 TSecr=762489412 [TCP segment of a reassembled PDU]"
"217","2018-08-23 02:38:34.631581","192.168.2.3","216.58.197.4","TLSv1.2","212","Application Data"
"218","2018-08-23 02:38:34.631920","192.168.2.3","216.58.197.4","TCP","1434","34236  >  443 [ACK] Seq=114454 Ack=1849 Win=2363 Len=1368 TSval=8059673 TSecr=762489412 [TCP segment of a reassembled PDU]"
"219","2018-08-23 02:38:34.631923","192.168.2.3","216.58.197.4","TLSv1.2","155","Application Data"
"223","2018-08-23 02:38:34.727864","192.168.2.3","216.58.197.4","TCP","1434","34236  >  443 [ACK] Seq=115911 Ack=1849 Win=2363 Len=1368 TSval=8059683 TSecr=762489437 [TCP segment of a reassembled PDU]"
"224","2018-08-23 02:38:34.728098","192.168.2.3","216.58.197.4","TCP","1434","34236  >  443 [ACK] Seq=117279 Ack=1849 Win=2363 Len=1368 TSval=8059683 TSecr=762489437 [TCP segment of a reassembled PDU]"
"225","2018-08-23 02:38:34.728101","192.168.2.3","216.58.197.4","TLSv1.2","212","Application Data"
"226","2018-08-23 02:38:34.728309","192.168.2.3","216.58.197.4","TCP","1434","34236  >  443 [ACK] Seq=118793 Ack=1849 Win=2363 Len=1368 TSval=8059683 TSecr=762489437 [TCP segment of a reassembled PDU]"
"227","2018-08-23 02:38:34.728312","192.168.2.3","216.58.197.4","TLSv1.2","155","Application Data"
"232","2018-08-23 02:38:34.775893","192.168.2.3","192.168.2.1","TCP","183","8009  >  53029 [PSH, ACK] Seq=118 Ack=235 Win=277 Len=117 TSval=8059687 TSecr=2317850106 [TCP segment of a reassembled PDU]"
"236","2018-08-23 02:38:34.784041","192.168.2.3","216.58.197.4","TCP","66","34236  >  443 [ACK] Seq=120250 Ack=2122 Win=2363 Len=0 TSval=8059689 TSecr=762489584"
"237","2018-08-23 02:38:34.813728","192.168.2.3","216.58.197.4","TCP","1434","34236  >  443 [ACK] Seq=120250 Ack=2122 Win=2363 Len=1368 TSval=8059691 TSecr=762489584 [TCP segment of a reassembled PDU]"
"238","2018-08-23 02:38:34.813933","192.168.2.3","216.58.197.4","TCP","1434","34236  >  443 [ACK] Seq=121618 Ack=2122 Win=2363 Len=1368 TSval=8059691 TSecr=762489584 [TCP segment of a reassembled PDU]"
"239","2018-08-23 02:38:34.813934","192.168.2.3","216.58.197.4","TLSv1.2","212","Application Data"
"240","2018-08-23 02:38:34.813935","192.168.2.3","216.58.197.4","TCP","1434","34236  >  443 [ACK] Seq=123132 Ack=2122 Win=2363 Len=1368 TSval=8059691 TSecr=762489584 [TCP segment of a reassembled PDU]"
"241","2018-08-23 02:38:34.814055","192.168.2.3","216.58.197.4","TLSv1.2","155","Application Data"
"245","2018-08-23 02:38:34.908677","192.168.2.3","216.58.197.4","TCP","1434","34236  >  443 [ACK] Seq=124589 Ack=2122 Win=2363 Len=1368 TSval=8059701 TSecr=762489619 [TCP segment of a reassembled PDU]"
"246","2018-08-23 02:38:34.909173","192.168.2.3","216.58.197.4","TCP","1434","34236  >  443 [ACK] Seq=125957 Ack=2122 Win=2363 Len=1368 TSval=8059701 TSecr=762489619 [TCP segment of a reassembled PDU]"
"247","2018-08-23 02:38:34.909175","192.168.2.3","216.58.197.4","TLSv1.2","212","Application Data"
"248","2018-08-23 02:38:34.909176","192.168.2.3","216.58.197.4","TCP","1434","34236  >  443 [ACK] Seq=127471 Ack=2122 Win=2363 Len=1368 TSval=8059701 TSecr=762489619 [TCP segment of a reassembled PDU]"
"249","2018-08-23 02:38:34.909233","192.168.2.3","216.58.197.4","TLSv1.2","155","Application Data"
"255","2018-08-23 02:38:34.954667","192.168.2.3","216.58.197.4","TCP","66","34236  >  443 [ACK] Seq=128928 Ack=2527 Win=2363 Len=0 TSval=8059706 TSecr=762489754"
"256","2018-08-23 02:38:35.006880","192.168.2.3","216.58.197.4","TCP","1434","34236  >  443 [ACK] Seq=128928 Ack=2527 Win=2363 Len=1368 TSval=8059710 TSecr=762489754 [TCP segment of a reassembled PDU]"
"257","2018-08-23 02:38:35.006885","192.168.2.3","216.58.197.4","TCP","1434","34236  >  443 [ACK] Seq=130296 Ack=2527 Win=2363 Len=1368 TSval=8059710 TSecr=762489754 [TCP segment of a reassembled PDU]"
"258","2018-08-23 02:38:35.007030","192.168.2.3","216.58.197.4","TLSv1.2","212","Application Data"
"259","2018-08-23 02:38:35.007418","192.168.2.3","216.58.197.4","TCP","1434","34236  >  443 [ACK] Seq=131810 Ack=2527 Win=2363 Len=1368 TSval=8059710 TSecr=762489754 [TCP segment of a reassembled PDU]"
"260","2018-08-23 02:38:35.007419","192.168.2.3","216.58.197.4","TLSv1.2","155","Application Data"
"264","2018-08-23 02:38:35.083122","192.168.2.3","216.58.197.4","TCP","1434","34236  >  443 [ACK] Seq=133267 Ack=2527 Win=2363 Len=1368 TSval=8059718 TSecr=762489853 [TCP segment of a reassembled PDU]"
"265","2018-08-23 02:38:35.083127","192.168.2.3","216.58.197.4","TCP","1434","34236  >  443 [ACK] Seq=134635 Ack=2527 Win=2363 Len=1368 TSval=8059718 TSecr=762489853 [TCP segment of a reassembled PDU]"
"266","2018-08-23 02:38:35.083128","192.168.2.3","216.58.197.4","TLSv1.2","212","Application Data"
"267","2018-08-23 02:38:35.083294","192.168.2.3","216.58.197.4","TCP","1434","34236  >  443 [ACK] Seq=136149 Ack=2527 Win=2363 Len=1368 TSval=8059718 TSecr=762489853 [TCP segment of a reassembled PDU]"
"268","2018-08-23 02:38:35.083418","192.168.2.3","216.58.197.4","TLSv1.2","155","Application Data"
"273","2018-08-23 02:38:35.142064","192.168.2.3","216.58.197.4","TCP","66","34236  >  443 [ACK] Seq=137606 Ack=2975 Win=2363 Len=0 TSval=8059724 TSecr=762489938"
"274","2018-08-23 02:38:35.197354","192.168.2.3","216.58.197.4","TCP","1434","34236  >  443 [ACK] Seq=137606 Ack=2975 Win=2363 Len=1368 TSval=8059730 TSecr=762489938 [TCP segment of a reassembled PDU]"
"275","2018-08-23 02:38:35.197673","192.168.2.3","216.58.197.4","TCP","1434","34236  >  443 [ACK] Seq=138974 Ack=2975 Win=2363 Len=1368 TSval=8059730 TSecr=762489938 [TCP segment of a reassembled PDU]"
"276","2018-08-23 02:38:35.197677","192.168.2.3","216.58.197.4","TLSv1.2","212","Application Data"
"277","2018-08-23 02:38:35.198124","192.168.2.3","216.58.197.4","TCP","1434","34236  >  443 [ACK] Seq=140488 Ack=2975 Win=2363 Len=1368 TSval=8059730 TSecr=762489938 [TCP segment of a reassembled PDU]"
"278","2018-08-23 02:38:35.198127","192.168.2.3","216.58.197.4","TLSv1.2","155","Application Data"
"282","2018-08-23 02:38:35.293455","192.168.2.3","216.58.197.4","TCP","1434","34236  >  443 [ACK] Seq=141945 Ack=2975 Win=2363 Len=1368 TSval=8059739 TSecr=762490003 [TCP segment of a reassembled PDU]"
"283","2018-08-23 02:38:35.293806","192.168.2.3","216.58.197.4","TCP","1434","34236  >  443 [ACK] Seq=143313 Ack=2975 Win=2363 Len=1368 TSval=8059739 TSecr=762490003 [TCP segment of a reassembled PDU]"
"284","2018-08-23 02:38:35.293811","192.168.2.3","216.58.197.4","TLSv1.2","212","Application Data"
"285","2018-08-23 02:38:35.294335","192.168.2.3","216.58.197.4","TCP","1434","34236  >  443 [ACK] Seq=144827 Ack=2975 Win=2363 Len=1368 TSval=8059739 TSecr=762490003 [TCP segment of a reassembled PDU]"
"286","2018-08-23 02:38:35.294339","192.168.2.3","216.58.197.4","TLSv1.2","155","Application Data"
"292","2018-08-23 02:38:35.341451","192.168.2.3","216.58.197.4","TCP","66","34236  >  443 [ACK] Seq=146284 Ack=3431 Win=2363 Len=0 TSval=8059744 TSecr=762490141"
"293","2018-08-23 02:38:35.390475","192.168.2.3","216.58.197.4","TCP","1434","34236  >  443 [ACK] Seq=146284 Ack=3431 Win=2363 Len=1368 TSval=8059749 TSecr=762490141 [TCP segment of a reassembled PDU]"
"294","2018-08-23 02:38:35.390480","192.168.2.3","216.58.197.4","TCP","1434","34236  >  443 [ACK] Seq=147652 Ack=3431 Win=2363 Len=1368 TSval=8059749 TSecr=762490141 [TCP segment of a reassembled PDU]"
"295","2018-08-23 02:38:35.390481","192.168.2.3","216.58.197.4","TLSv1.2","212","Application Data"
"296","2018-08-23 02:38:35.390755","192.168.2.3","216.58.197.4","TCP","1434","34236  >  443 [ACK] Seq=149166 Ack=3431 Win=2363 Len=1368 TSval=8059749 TSecr=762490141 [TCP segment of a reassembled PDU]"
"297","2018-08-23 02:38:35.390758","192.168.2.3","216.58.197.4","TLSv1.2","155","Application Data"
"303","2018-08-23 02:38:35.482341","192.168.2.3","216.58.197.4","TCP","66","34236  >  443 [ACK] Seq=150623 Ack=3683 Win=2363 Len=0 TSval=8059758 TSecr=762490264"
"304","2018-08-23 02:38:35.484983","192.168.2.3","216.58.197.4","TCP","1434","34236  >  443 [ACK] Seq=150623 Ack=3683 Win=2363 Len=1368 TSval=8059759 TSecr=762490264 [TCP segment of a reassembled PDU]"
"305","2018-08-23 02:38:35.485236","192.168.2.3","216.58.197.4","TCP","1434","34236  >  443 [ACK] Seq=151991 Ack=3683 Win=2363 Len=1368 TSval=8059759 TSecr=762490264 [TCP segment of a reassembled PDU]"
"306","2018-08-23 02:38:35.485239","192.168.2.3","216.58.197.4","TLSv1.2","212","Application Data"
"307","2018-08-23 02:38:35.485240","192.168.2.3","216.58.197.4","TCP","1434","34236  >  443 [ACK] Seq=153505 Ack=3683 Win=2363 Len=1368 TSval=8059759 TSecr=762490264 [TCP segment of a reassembled PDU]"
"308","2018-08-23 02:38:35.485537","192.168.2.3","216.58.197.4","TLSv1.2","155","Application Data"
"314","2018-08-23 02:38:35.539841","192.168.2.3","216.58.197.4","TCP","66","34236  >  443 [ACK] Seq=154962 Ack=4043 Win=2363 Len=0 TSval=8059764 TSecr=762490339"
"315","2018-08-23 02:38:35.581327","192.168.2.3","216.58.197.4","TCP","1434","34236  >  443 [ACK] Seq=154962 Ack=4043 Win=2363 Len=1368 TSval=8059768 TSecr=762490339 [TCP segment of a reassembled PDU]"
"316","2018-08-23 02:38:35.581678","192.168.2.3","216.58.197.4","TCP","1434","34236  >  443 [ACK] Seq=156330 Ack=4043 Win=2363 Len=1368 TSval=8059768 TSecr=762490339 [TCP segment of a reassembled PDU]"
"317","2018-08-23 02:38:35.581681","192.168.2.3","216.58.197.4","TLSv1.2","212","Application Data"
"318","2018-08-23 02:38:35.582155","192.168.2.3","216.58.197.4","TCP","1434","34236  >  443 [ACK] Seq=157844 Ack=4043 Win=2363 Len=1368 TSval=8059768 TSecr=762490339 [TCP segment of a reassembled PDU]"
"319","2018-08-23 02:38:35.582158","192.168.2.3","216.58.197.4","TLSv1.2","155","Application Data"
"328","2018-08-23 02:38:35.684955","192.168.2.3","216.58.197.4","TCP","66","34236  >  443 [ACK] Seq=159301 Ack=4321 Win=2363 Len=0 TSval=8059779 TSecr=762490435"
"329","2018-08-23 02:38:35.686472","192.168.2.3","216.58.197.4","TCP","66","34236  >  443 [ACK] Seq=159301 Ack=4690 Win=2363 Len=0 TSval=8059779 TSecr=762490441"
"330","2018-08-23 02:38:35.686814","192.168.2.3","216.58.197.4","TCP","78","[TCP Dup ACK 329#1] 34236  >  443 [ACK] Seq=159301 Ack=4690 Win=2363 Len=0 TSval=8059779 TSecr=762490466 SLE=4459 SRE=4690"
"331","2018-08-23 02:38:35.688133","192.168.2.3","216.58.197.4","TCP","1434","34236  >  443 [ACK] Seq=159301 Ack=4690 Win=2363 Len=1368 TSval=8059779 TSecr=762490466 [TCP segment of a reassembled PDU]"
"332","2018-08-23 02:38:35.689805","192.168.2.3","216.58.197.4","TCP","1434","34236  >  443 [ACK] Seq=160669 Ack=4690 Win=2363 Len=1368 TSval=8059779 TSecr=762490466 [TCP segment of a reassembled PDU]"
"333","2018-08-23 02:38:35.689810","192.168.2.3","216.58.197.4","TLSv1.2","212","Application Data"
"334","2018-08-23 02:38:35.690025","192.168.2.3","216.58.197.4","TCP","1434","34236  >  443 [ACK] Seq=162183 Ack=4690 Win=2363 Len=1368 TSval=8059779 TSecr=762490466 [TCP segment of a reassembled PDU]"
"335","2018-08-23 02:38:35.690027","192.168.2.3","216.58.197.4","TLSv1.2","155","Application Data"
"341","2018-08-23 02:38:35.743322","192.168.2.3","216.58.197.4","TCP","66","34236  >  443 [ACK] Seq=163640 Ack=4980 Win=2363 Len=0 TSval=8059784 TSecr=762490543"
"344","2018-08-23 02:38:35.751243","192.168.2.3","216.58.197.4","TCP","66","34236  >  443 [ACK] Seq=163640 Ack=5278 Win=2363 Len=0 TSval=8059785 TSecr=762490551"
"345","2018-08-23 02:38:35.784809","192.168.2.3","216.58.197.4","TCP","1434","34236  >  443 [ACK] Seq=163640 Ack=5278 Win=2363 Len=1368 TSval=8059788 TSecr=762490551 [TCP segment of a reassembled PDU]"
"346","2018-08-23 02:38:35.784825","192.168.2.3","216.58.197.4","TCP","1434","34236  >  443 [ACK] Seq=165008 Ack=5278 Win=2363 Len=1368 TSval=8059788 TSecr=762490551 [TCP segment of a reassembled PDU]"
"347","2018-08-23 02:38:35.784826","192.168.2.3","216.58.197.4","TLSv1.2","212","Application Data"
"348","2018-08-23 02:38:35.785053","192.168.2.3","216.58.197.4","TCP","1434","34236  >  443 [ACK] Seq=166522 Ack=5278 Win=2363 Len=1368 TSval=8059788 TSecr=762490551 [TCP segment of a reassembled PDU]"
"349","2018-08-23 02:38:35.785061","192.168.2.3","216.58.197.4","TLSv1.2","155","Application Data"
"354","2018-08-23 02:38:35.839108","192.168.2.3","216.58.197.4","TCP","66","34236  >  443 [ACK] Seq=167979 Ack=5568 Win=2363 Len=0 TSval=8059794 TSecr=762490639"
"355","2018-08-23 02:38:35.885885","192.168.2.3","216.58.197.4","TCP","1434","34236  >  443 [ACK] Seq=167979 Ack=5568 Win=2363 Len=1368 TSval=8059798 TSecr=762490639 [TCP segment of a reassembled PDU]"
"356","2018-08-23 02:38:35.885890","192.168.2.3","216.58.197.4","TCP","1434","34236  >  443 [ACK] Seq=169347 Ack=5568 Win=2363 Len=1368 TSval=8059798 TSecr=762490639 [TCP segment of a reassembled PDU]"
"357","2018-08-23 02:38:35.885891","192.168.2.3","216.58.197.4","TLSv1.2","212","Application Data"
"358","2018-08-23 02:38:35.885965","192.168.2.3","216.58.197.4","TCP","1434","34236  >  443 [ACK] Seq=170861 Ack=5568 Win=2363 Len=1368 TSval=8059798 TSecr=762490639 [TCP segment of a reassembled PDU]"
"359","2018-08-23 02:38:35.885966","192.168.2.3","216.58.197.4","TLSv1.2","155","Application Data"
"365","2018-08-23 02:38:35.942487","192.168.2.3","216.58.197.4","TCP","66","34236  >  443 [ACK] Seq=172318 Ack=5786 Win=2363 Len=0 TSval=8059804 TSecr=762490742"
"366","2018-08-23 02:38:35.995182","192.168.2.3","216.58.197.4","TCP","1434","34236  >  443 [ACK] Seq=172318 Ack=5786 Win=2363 Len=1368 TSval=8059810 TSecr=762490742 [TCP segment of a reassembled PDU]"
"367","2018-08-23 02:38:35.995540","192.168.2.3","216.58.197.4","TCP","1434","34236  >  443 [ACK] Seq=173686 Ack=5786 Win=2363 Len=1368 TSval=8059810 TSecr=762490742 [TCP segment of a reassembled PDU]"
"368","2018-08-23 02:38:35.995543","192.168.2.3","216.58.197.4","TLSv1.2","212","Application Data"
"369","2018-08-23 02:38:35.995544","192.168.2.3","216.58.197.4","TLSv1.2","1335","Application Data"
"372","2018-08-23 02:38:36.094370","192.168.2.3","216.58.197.4","TCP","1434","34236  >  443 [ACK] Seq=176469 Ack=5786 Win=2363 Len=1368 TSval=8059819 TSecr=762490801 [TCP segment of a reassembled PDU]"
"373","2018-08-23 02:38:36.094375","192.168.2.3","216.58.197.4","TCP","1434","34236  >  443 [ACK] Seq=177837 Ack=5786 Win=2363 Len=1368 TSval=8059819 TSecr=762490801 [TCP segment of a reassembled PDU]"
"374","2018-08-23 02:38:36.094376","192.168.2.3","216.58.197.4","TLSv1.2","212","Application Data"
"375","2018-08-23 02:38:36.094708","192.168.2.3","216.58.197.4","TCP","1434","34236  >  443 [ACK] Seq=179351 Ack=5786 Win=2363 Len=1368 TSval=8059819 TSecr=762490801 [TCP segment of a reassembled PDU]"
"376","2018-08-23 02:38:36.094710","192.168.2.3","216.58.197.4","TLSv1.2","155","Application Data"
"381","2018-08-23 02:38:36.196717","192.168.2.3","216.58.197.4","TCP","66","34236  >  443 [ACK] Seq=180808 Ack=5848 Win=2363 Len=0 TSval=8059830 TSecr=762490950"
"382","2018-08-23 02:38:36.198808","192.168.2.3","216.58.197.4","TCP","1434","34236  >  443 [ACK] Seq=180808 Ack=5848 Win=2363 Len=1368 TSval=8059830 TSecr=762490950 [TCP segment of a reassembled PDU]"
"383","2018-08-23 02:38:36.199054","192.168.2.3","216.58.197.4","TCP","1434","34236  >  443 [ACK] Seq=182176 Ack=5848 Win=2363 Len=1368 TSval=8059830 TSecr=762490950 [TCP segment of a reassembled PDU]"
"384","2018-08-23 02:38:36.199056","192.168.2.3","216.58.197.4","TLSv1.2","212","Application Data"
"385","2018-08-23 02:38:36.199639","192.168.2.3","216.58.197.4","TLSv1.2","1285","Application Data"
"389","2018-08-23 02:38:36.315723","192.168.2.3","216.58.197.4","TCP","1434","34236  >  443 [ACK] Seq=184909 Ack=5848 Win=2363 Len=1368 TSval=8059842 TSecr=762491005 [TCP segment of a reassembled PDU]"
"390","2018-08-23 02:38:36.316150","192.168.2.3","216.58.197.4","TCP","1434","34236  >  443 [ACK] Seq=186277 Ack=5848 Win=2363 Len=1368 TSval=8059842 TSecr=762491005 [TCP segment of a reassembled PDU]"
"391","2018-08-23 02:38:36.316152","192.168.2.3","216.58.197.4","TLSv1.2","212","Application Data"
"392","2018-08-23 02:38:36.316153","192.168.2.3","216.58.197.4","TCP","1434","34236  >  443 [ACK] Seq=187791 Ack=5848 Win=2363 Len=1368 TSval=8059842 TSecr=762491005 [TCP segment of a reassembled PDU]"
"393","2018-08-23 02:38:36.316335","192.168.2.3","216.58.197.4","TLSv1.2","155","Application Data"
"397","2018-08-23 02:38:36.414437","192.168.2.3","216.58.197.4","TCP","1434","34236  >  443 [ACK] Seq=189248 Ack=5848 Win=2363 Len=1368 TSval=8059851 TSecr=762491122 [TCP segment of a reassembled PDU]"
"398","2018-08-23 02:38:36.414442","192.168.2.3","216.58.197.4","TCP","1434","34236  >  443 [ACK] Seq=190616 Ack=5848 Win=2363 Len=1368 TSval=8059851 TSecr=762491122 [TCP segment of a reassembled PDU]"
"399","2018-08-23 02:38:36.414443","192.168.2.3","216.58.197.4","TLSv1.2","212","Application Data"
"400","2018-08-23 02:38:36.414517","192.168.2.3","216.58.197.4","TCP","1434","34236  >  443 [ACK] Seq=192130 Ack=5848 Win=2363 Len=1368 TSval=8059851 TSecr=762491122 [TCP segment of a reassembled PDU]"
"401","2018-08-23 02:38:36.414887","192.168.2.3","216.58.197.4","TLSv1.2","155","Application Data"
"406","2018-08-23 02:38:36.461354","192.168.2.3","216.58.197.4","TCP","66","34236  >  443 [ACK] Seq=193587 Ack=6087 Win=2363 Len=0 TSval=8059856 TSecr=762491261"
"407","2018-08-23 02:38:36.461357","192.168.2.3","216.58.197.4","TCP","66","34236  >  443 [ACK] Seq=193587 Ack=6319 Win=2363 Len=0 TSval=8059856 TSecr=762491261"
"409","2018-08-23 02:38:36.463699","192.168.2.3","216.58.197.4","TCP","66","34236  >  443 [ACK] Seq=193587 Ack=6514 Win=2363 Len=0 TSval=8059856 TSecr=762491264"
"411","2018-08-23 02:38:36.477999","192.168.2.3","216.58.197.4","TCP","66","34236  >  443 [ACK] Seq=193587 Ack=6717 Win=2363 Len=0 TSval=8059858 TSecr=762491278"
"412","2018-08-23 02:38:36.519425","192.168.2.3","216.58.197.4","TCP","1434","34236  >  443 [ACK] Seq=193587 Ack=6717 Win=2363 Len=1368 TSval=8059862 TSecr=762491278 [TCP segment of a reassembled PDU]"
"413","2018-08-23 02:38:36.519631","192.168.2.3","216.58.197.4","TCP","1434","34236  >  443 [ACK] Seq=194955 Ack=6717 Win=2363 Len=1368 TSval=8059862 TSecr=762491278 [TCP segment of a reassembled PDU]"
"414","2018-08-23 02:38:36.519633","192.168.2.3","216.58.197.4","TLSv1.2","212","Application Data"
"415","2018-08-23 02:38:36.519994","192.168.2.3","216.58.197.4","TLSv1.2","1424","Application Data"
"421","2018-08-23 02:38:36.570851","192.168.2.3","216.58.197.4","TCP","66","34236  >  443 [ACK] Seq=197827 Ack=6987 Win=2363 Len=0 TSval=8059867 TSecr=762491371"
"422","2018-08-23 02:38:36.571113","192.168.2.3","216.58.197.4","TCP","66","34236  >  443 [ACK] Seq=197827 Ack=7177 Win=2363 Len=0 TSval=8059867 TSecr=762491371"
"423","2018-08-23 02:38:36.639046","192.168.2.3","216.58.197.4","TCP","1434","34236  >  443 [ACK] Seq=197827 Ack=7177 Win=2363 Len=1368 TSval=8059874 TSecr=762491371 [TCP segment of a reassembled PDU]"
"424","2018-08-23 02:38:36.639053","192.168.2.3","216.58.197.4","TCP","1434","34236  >  443 [ACK] Seq=199195 Ack=7177 Win=2363 Len=1368 TSval=8059874 TSecr=762491371 [TCP segment of a reassembled PDU]"
"425","2018-08-23 02:38:36.639054","192.168.2.3","216.58.197.4","TLSv1.2","212","Application Data"
"426","2018-08-23 02:38:36.639367","192.168.2.3","216.58.197.4","TCP","1434","34236  >  443 [ACK] Seq=200709 Ack=7177 Win=2363 Len=1368 TSval=8059874 TSecr=762491371 [TCP segment of a reassembled PDU]"
"427","2018-08-23 02:38:36.639370","192.168.2.3","216.58.197.4","TLSv1.2","155","Application Data"
"432","2018-08-23 02:38:36.686092","192.168.2.3","216.58.197.4","TCP","66","34236  >  443 [ACK] Seq=202166 Ack=7317 Win=2363 Len=0 TSval=8059879 TSecr=762491486"
"433","2018-08-23 02:38:36.686465","192.168.2.3","216.58.197.4","TCP","66","34236  >  443 [ACK] Seq=202166 Ack=7593 Win=2363 Len=0 TSval=8059879 TSecr=762491487"
"434","2018-08-23 02:38:36.725925","192.168.2.3","216.58.197.4","TCP","1434","34236  >  443 [ACK] Seq=202166 Ack=7593 Win=2363 Len=1368 TSval=8059883 TSecr=762491487 [TCP segment of a reassembled PDU]"
"435","2018-08-23 02:38:36.726318","192.168.2.3","216.58.197.4","TCP","1434","34236  >  443 [ACK] Seq=203534 Ack=7593 Win=2363 Len=1368 TSval=8059883 TSecr=762491487 [TCP segment of a reassembled PDU]"
"436","2018-08-23 02:38:36.726321","192.168.2.3","216.58.197.4","TLSv1.2","212","Application Data"
"437","2018-08-23 02:38:36.726849","192.168.2.3","216.58.197.4","TLSv1.2","1294","Application Data"
